scrp_date,scrp_time,genre_en,genre_jp,rank,media_jp,title,link,date_original
2025-04-15,12:22,sports,スポーツ,1,スポニチアネックス,エドマン　来年WBCは「まだ考えていない」前回23年は韓国代表で出場もわずか2安打　チームは予選敗退,https://news.yahoo.co.jp/articles/01c8ea481e7453b6b1125b0dcd0f6c0717eb2a5a,4/15(火) 9:09
2025-04-15,12:22,sports,スポーツ,2,日刊スポーツ,菅野智之、両手けいれんで緊急降板は「何も食べないで試合に行った」「クラブハウスのメシが」,https://news.yahoo.co.jp/articles/1f3d9f1270673f1e13b261bbcb715d6ce2a3b6cf,4/15(火) 10:41
2025-04-15,12:22,sports,スポーツ,3,RONSPO,レッドブルで“内紛騒ぎ”？！角田裕毅の9位入賞を代表が「かなりいい走り」と称賛も6位に沈んだエースのフェルスタッペンが不満を漏らして緊急対策会議を開く,https://news.yahoo.co.jp/articles/fece2fc3cfa697f1c7b466af732afd1cae379508,4/15(火) 6:00
2025-04-15,12:22,sports,スポーツ,4,デイリースポーツ,大谷翔平、6戦ぶり5号ソロ　確信歩きからCMポーズ2回　本拠地熱狂マルチ安打　連敗脱出へ貴重な追加点,https://news.yahoo.co.jp/articles/5780006a26a570506f5beca651f77ab0aaa5bbd5,4/15(火) 11:48
2025-04-15,12:22,sports,スポーツ,5,Full-Count,他球団から誘いも…36歳で古巣復帰「筋を通したかった」　厳しい周囲の目、覚悟の帰国,https://news.yahoo.co.jp/articles/6eb5b878d305d543490eac7e1dbf1e4ac69c290e,4/15(火) 7:30
2025-04-15,12:22,sports,スポーツ,6,CoCoKARAnext,「可能性はある」故障者続出の巨人で緊急トレードはあるか　球界OBが着目する「巨人ベテラン捕手」「パ・リーグ右の外野手」,https://news.yahoo.co.jp/articles/ae3adc33b377716fb254ec2e877a306061e9f5a4,4/15(火) 11:22
2025-04-15,12:22,sports,スポーツ,7,東スポWEB,【Ｆ１】角田裕毅　レッドブルと古巣ブルズのマシンを比較「その違いはかなり大きい」,https://news.yahoo.co.jp/articles/2b1e9ccffd6c73e16bd20e3eb6713b2292f3f01a,4/15(火) 11:21
2025-04-15,12:22,sports,スポーツ,8,theWORLD（ザ・ワールドWeb）,リヴァプールがブライトンから左WGを引き抜き？　151億円で日本代表FW三笘薫獲得か,https://news.yahoo.co.jp/articles/2033cd802b154a990983f8845c501777fa6294e7,4/15(火) 7:31
2025-04-15,12:22,sports,スポーツ,9,DAZN News,「ペレス以来最高の結果」『F1』の識者が”バーレーンGP5つの勝者と敗者”を選定…角田裕毅は勝者のトピックに｜F1,https://news.yahoo.co.jp/articles/389fb8d2999fa8591d36bdd927df564c8753ed19,4/15(火) 8:00
2025-04-15,12:22,sports,スポーツ,10,イーファイト,”最強ラウンドガール”宮原華音、ビキニ姿で清流にドボン！「大自然の水風呂、気持ちいい」,https://news.yahoo.co.jp/articles/4049e87573606ab896cfba2786f85ae3c1a940c2,4/15(火) 8:32
2025-04-15,12:22,sports,スポーツ,11,Full-Count,金髪美女がド軍本拠地“初降臨”　「興奮しすぎて」…ベッツと生対面でサインもゲット,https://news.yahoo.co.jp/articles/692e6a04a4776e6c2ec5d2f6106e448e1faa5312,4/15(火) 10:37
2025-04-15,12:22,sports,スポーツ,12,デイリースポーツ,なぜ？広島が今季から採用する時短練習　新井監督が取り組む“働き方改革”の狙いと効果　黒田球団アドバイザーにも相談,https://news.yahoo.co.jp/articles/b93c124c828365830568819b3e8ad6d07f6f92ab,4/15(火) 10:00
2025-04-15,12:22,sports,スポーツ,13,日刊スポーツ,宮本慎也氏、巨人戸郷翔征に「中10日とかの問題ではない」ロッテ吉井監督との重要議論も明かす,https://news.yahoo.co.jp/articles/3999d39f8c3bbfd37126b059ef209ed9799e4f88,4/15(火) 10:43
2025-04-15,12:22,sports,スポーツ,14,高校野球ドットコム,センバツ王者・横浜「春のベンチ入り選手」一覧！投打に強力布陣を形成、2年生遊撃手が二刀流解禁！1年生4人がベンチ入りで競争激化！,https://news.yahoo.co.jp/articles/13f1fddee7f09a5b90130ccabc2a7bc075f3af79,4/15(火) 11:00
2025-04-15,12:22,sports,スポーツ,15,Full-Count,大谷翔平、衝撃5号　中越え123m弾、6戦ぶり一発でMLB通算230号、年45発ペース…本拠地騒然,https://news.yahoo.co.jp/articles/eb86820bb91d649d7f3bac388b343cfe302d970a,4/15(火) 11:48
2025-04-15,12:22,sports,スポーツ,16,東スポWEB,不倫報道の川崎春花　復帰決断の背景に「米ツアー参戦」の思惑,https://news.yahoo.co.jp/articles/8f48b56dc79c32eb774312ad69923d37fd7d601f,4/15(火) 5:16
2025-04-15,12:22,sports,スポーツ,17,ベースボールキング,打率.129…解説陣は巨人・坂本勇人の打撃をどう見てる？,https://news.yahoo.co.jp/articles/9afb835aab2bcec8471074c177542b82870464c2,4/15(火) 9:00
2025-04-15,12:22,sports,スポーツ,18,RONSPO,記者が聞いた「今井上尚弥と戦って勝算はあるのか？」の愚問に中谷潤人が「見えていない」と答えた理由とは？…ドネア、ネリ、タパレスとの“モンスター前哨戦”にも興味示さず,https://news.yahoo.co.jp/articles/a26381a069b6467bf32f8c88a477a670783eccf4,4/15(火) 7:34
2025-04-15,12:22,sports,スポーツ,19,デイリースポーツ,ドジャース・大谷が２戦８打席ぶり快音　初回に右前打　最後は右手１本の技あり打→直後にベッツが先制の４号左越え２ラン,https://news.yahoo.co.jp/articles/6283fc047c8fb4def907b921ed64fb9d186d90cf,4/15(火) 11:21
2025-04-15,12:22,sports,スポーツ,20,スポニチアネックス,「もちろん出たい」ベッツ来年WBCでジャッジとの“共闘”心待ち　前回23年は1番打者で存在感,https://news.yahoo.co.jp/articles/7d446043a1db02a352768bfa97254fe1e65d1d6d,4/15(火) 8:44
2025-04-15,12:22,sports,スポーツ,21,ゲキサカ,女優の井桁弘恵さんがユニ姿でJリーグ観戦! 売れっ子放送作家&元日向坂46影山優佳さんの弟と3ショット,https://news.yahoo.co.jp/articles/b5222ea047ab44433667397608286aaa24451d79,4/15(火) 10:14
2025-04-15,12:22,sports,スポーツ,22,TBS NEWS DIG Powered by JNN,“おかわりくん2世”、中村勇斗が父・剛也の背中追い大阪桐蔭に入学　「気持ちが楽になった」父からの金言,https://news.yahoo.co.jp/articles/5bed68d7fe3066562589aa54f4ff055a19bd9062,4/14(月) 17:02
2025-04-15,12:22,sports,スポーツ,23,Full-Count,ロッテに現れた「ネクストモンスター」　続くパーフェクト…19歳にX騒然「末恐ろしい」,https://news.yahoo.co.jp/articles/534c1c795acb18566e907ff536f1dd58f68fb2a9,4/15(火) 10:17
2025-04-15,12:22,sports,スポーツ,24,産経新聞,中軸のテコ入れは幻に…肝煎りの「宝船打線」に手を付けた藤川球児監督は正着を導けるのか　鬼筆のトラ漫遊記,https://news.yahoo.co.jp/articles/17ccb7d4e073219fb86bf14685a2d9ac37a07247,4/15(火) 11:42
2025-04-15,12:22,sports,スポーツ,25,東スポWEB,【Ｆ１】角田裕毅昇格のレッドブルで〝内紛〟 フェルスタッペン側近がマルコ博士に「怒鳴っている姿」,https://news.yahoo.co.jp/articles/e33c384a3118594aab6aa59ac5f03c63f88dc392,4/15(火) 5:16
2025-04-15,12:22,sports,スポーツ,26,FITNESS LOVE,57歳の大変身　「垂れたピーマン尻」からビキニモデルへ！【筋トレビフォーアフター】,https://news.yahoo.co.jp/articles/2fda52d7a3b388fe1684a59d87ee785c2c9d1836,4/15(火) 7:10
2025-04-15,12:22,sports,スポーツ,27,デイリースポーツ,「巨人・坂本はまだまだやれる」打撃の名伯楽・内田順三氏が断言する理由　三塁併用が続く中山の課題は－,https://news.yahoo.co.jp/articles/efacfaad99ddb3b49b91e59382b34426e4c614f0,4/15(火) 11:11
2025-04-15,12:22,sports,スポーツ,28,Full-Count,ド軍右腕「どうしても出たいんだ」　WBC米国代表入りへ決意、31歳が明かす“失意の過去”,https://news.yahoo.co.jp/articles/5f1ee6e5f3bae1d5262cd6edad0bc4c782bbdf8f,4/15(火) 8:30
2025-04-15,12:22,sports,スポーツ,29,日刊スポーツ,【陸上】寺田明日香が涙で「競技者として第一線を退く」　100メートル障害の元日本記録保持者,https://news.yahoo.co.jp/articles/abc36c56427cc053cb175ee6e5c474811d75eeef,4/15(火) 10:08
2025-04-15,12:22,sports,スポーツ,30,サンケイスポーツ,阪神の育成D1位・工藤泰成が2軍降格も藤川球児監督の親心　強心臓になって帰ってこい,https://news.yahoo.co.jp/articles/440c53acd607fd6658a131799c3e659d976a3d0f,4/15(火) 7:30
2025-04-15,12:22,sports,スポーツ,31,ベースボールキング,ドジャース・大谷翔平が6試合ぶり5号ソロ　バックスクリーンへ打球速度180キロの豪快弾,https://news.yahoo.co.jp/articles/237201bb8e77c1cd9ad1c0ec684f9d83c1427d70,4/15(火) 11:52
2025-04-15,12:22,sports,スポーツ,32,Full-Count,魚雷バットで「ヤバいことに」　過去に大物も使用…専門家が“覚醒”を予感する大砲2人,https://news.yahoo.co.jp/articles/a38115b2a06845dc039aa63f049803f501860d95,4/15(火) 8:10
2025-04-15,12:22,sports,スポーツ,33,スポニチアネックス,大谷翔平　6戦ぶり5号！打球速度180キロ中越え124ｍ弾に本拠大興奮　ビジョンでデコルテCMの演出,https://news.yahoo.co.jp/articles/6d02604a2c388352f3554d29cd1579bc8f883927,4/15(火) 11:49
2025-04-15,12:22,sports,スポーツ,34,日刊スポーツ,菅野智之「投げていて思うところはあるよ」メジャー屈指のスラッガーとの対戦で感じた“違和感”,https://news.yahoo.co.jp/articles/e83071ce584b16dc40906dcbf9850809cdc0677f,4/15(火) 10:45
2025-04-15,12:22,sports,スポーツ,35,Full-Count,予期した戦力外「やっぱりか」　引退して就職か、育成契約か…揺れた26歳の胸中,https://news.yahoo.co.jp/articles/0fdda0763b756b73a417b8b6227c2e23df907aaa,4/15(火) 7:10
2025-04-15,12:22,sports,スポーツ,36,Full-Count,「フライが怖い」子どもが増加中　スマホ社会で失った“重要動作”、遊具撤去も影響,https://news.yahoo.co.jp/articles/1ac0c17630610a03a4482d33c9ddaf9a87bed375,4/15(火) 7:50
2025-04-15,12:22,sports,スポーツ,37,オートスポーツweb,レーシングブルズはノーポイント。ローソンは接触で15秒のペナルティ。ハジャー「ひどいスタートだった」,https://news.yahoo.co.jp/articles/c71ce1405f50a65e920eb9abdb56246870a1db79,4/15(火) 8:40
2025-04-15,12:22,sports,スポーツ,38,theWORLD（ザ・ワールドWeb）,バルセロナとハフィーニャの契約延長交渉が難航　最悪の場合は今夏放出の可能性も,https://news.yahoo.co.jp/articles/801c99950328c0c3dfaa7ab81a4f88cdfad42661,4/15(火) 11:20
2025-04-15,12:22,sports,スポーツ,39,Full-Count,大谷出場試合でハローキティが始球式　ド軍ユニでツーバウンド投球…ファン拍手喝采,https://news.yahoo.co.jp/articles/7446ea26f71e8e15b42e91cfa606af2dfbcb8bcc,4/15(火) 11:06
2025-04-15,12:22,sports,スポーツ,40,Full-Count,来日で“遭遇”した出来事に「やりがいを感じた」　東京に響いた自分の名前…「最高だった」,https://news.yahoo.co.jp/articles/fe06aba41ba43e406f1b2a682bbeb3039e4d2682,4/15(火) 11:31
