scrp_date,scrp_time,genre_en,genre_jp,rank,media_jp,title,link,date_original
2025-03-05,14:07,domestic,国内,1,J-CASTニュース,「乗船できません」外国人の迷惑系配信者にレッドカード　海保・フェリー会社の毅然対応に賞賛相次ぐ,https://news.yahoo.co.jp/articles/a50c0daddd3f7c293e61d1a5cd877a3b8d944f29,3/4(火) 13:59
2025-03-05,14:07,domestic,国内,2,共同通信,国民、維新提案の5党協議を拒否　ガソリン暫定税率廃止で,https://news.yahoo.co.jp/articles/b09643305e1eba766793ffc1717b5312f2d3465e,3/5(水) 12:50
2025-03-05,14:07,domestic,国内,3,東海テレビ,ネットには「全額支払い済み」等の声…キャンピングカー製造販売会社が自己破産申請 2月に市と防災協定結んだばかり,https://news.yahoo.co.jp/articles/0f7902cbacd40b9f966ec3be78418de99415ce73,3/5(水) 11:31
2025-03-05,14:07,domestic,国内,4,共同通信,退職金課税制度を見直すべきだと首相,https://news.yahoo.co.jp/articles/bf12fd1fef2d7ee70e04930a489f614871e851db,3/5(水) 11:08
2025-03-05,14:07,domestic,国内,5,日刊スポーツ,泉房穂氏に猛反論　維新の大阪市長「まったく意味不明なんだが」文末の「愛してるぜ」も話題に,https://news.yahoo.co.jp/articles/6d5ed0b81493f9e53b4906164dd4faebf8c3f907,3/5(水) 9:48
2025-03-05,14:07,domestic,国内,6,FNNプライムオンライン（フジテレビ系）,【速報】石破首相　退職金税制「慎重な上に適切な見直しを」　立憲は氷河期世代への影響指摘し「拙速な見直し避けて」,https://news.yahoo.co.jp/articles/df66c66e64b3e418e62cbc9d9f6c27261d78feca,3/5(水) 11:49
2025-03-05,14:07,domestic,国内,7,スポニチアネックス,全国最年少27歳の市長、一部市議から「学歴詐称」指摘　声明　慶大に問い合わせ確認「正式に回答あった」,https://news.yahoo.co.jp/articles/b49c59c6cddc290acfeec90b215ce196c5869d6f,3/4(火) 12:58
2025-03-05,14:07,domestic,国内,8,毎日新聞,想定外のコメ高騰　中から国を守る「農業」　ないがしろにした結果,https://news.yahoo.co.jp/articles/a6f8cf3885680113e3d74e2bbe666bdc22ed9153,3/5(水) 11:00
2025-03-05,14:07,domestic,国内,9,MBC南日本放送,【東京 雪まだまだ続く?】東京 首都圏  雪のシミュレーション6日（木）7日（金） 道路凍結注意【東京・神奈川・埼玉・千葉・山梨・群馬・栃木・茨城】,https://news.yahoo.co.jp/articles/404b973440923592df56078e73a480adc8652a20,3/5(水) 11:32
2025-03-05,14:07,domestic,国内,10,TBS NEWS DIG Powered by JNN,待望の雨も鎮圧に至らず　岩手県大船渡市の山林火災　発生から1週間,https://news.yahoo.co.jp/articles/838430480325aebd49c4b768cd6155655274fb62,3/5(水) 11:52
2025-03-05,14:07,domestic,国内,11,テレビ朝日系（ANN）,高島平にタワマン計画浮上　「東洋一のマンモス団地」激変？　住民に期待と不安,https://news.yahoo.co.jp/articles/2d67e9f819d0328aab6e3ba0864a6df22b1a6037,3/5(水) 12:46
2025-03-05,14:07,domestic,国内,12,弁護士ドットコムニュース,女子プロレス選手の「性的部位」写真をSNSに投稿、訴訟が“勝訴的和解”…解決金100万円と会場出禁,https://news.yahoo.co.jp/articles/00d58cf98555253b765c22b076c29bef44e8a99e,2/27(木) 16:06
2025-03-05,14:07,domestic,国内,13,河北新報,学歴詐称疑惑巡り全国最年少の市長、慶応大に「合格したこと確認した」　秋田・大館,https://news.yahoo.co.jp/articles/6f76d75ad8f9c4e5d99825a39544cad8f741ae60,3/5(水) 10:00
2025-03-05,14:07,domestic,国内,14,中日スポーツ,“炎上中”のYouTuber『中町兄妹』、家族への「誹謗中傷」や「殺害予告」明かす　兄・JPは「何て親不孝なことを…」と反省,https://news.yahoo.co.jp/articles/e4325a8acf76d2c2a9ef61bd8fdbf6aa43974d16,3/5(水) 10:45
2025-03-05,14:07,domestic,国内,15,産経新聞,「子供じみている」孤立無援の維新・吉村執行部　党内に渦巻く不満、橋下徹氏も苦言,https://news.yahoo.co.jp/articles/7ecbc6d1930e0942a6c007fa8ff3eb5942cbfcbc,3/4(火) 20:03
2025-03-05,14:07,domestic,国内,16,ABEMA TIMES,高額療養費めぐり「制度を守るための命じゃない。命を守るために制度をどうしていくのか」立憲・田名部議員が石破首相に語気強める,https://news.yahoo.co.jp/articles/15052a4d4038b5a20d08a94c9508f7adac30aaf9,3/5(水) 12:02
2025-03-05,14:07,domestic,国内,17,時事通信,国民幹部、ガソリン5党協議に不参加　維新提唱に「考え違う」,https://news.yahoo.co.jp/articles/c871690e21f9f00012773d37f496e9a24b9e7888,3/5(水) 12:21
2025-03-05,14:07,domestic,国内,18,毎日新聞,兵庫・斎藤知事、懲戒処分撤回せず　「告発文は誹謗中傷性高い」,https://news.yahoo.co.jp/articles/4e0b94960aa97759b245bd8b2f18b13ccda8da73,3/5(水) 12:30
2025-03-05,14:07,domestic,国内,19,産経新聞,江藤拓農水相、食糧法に価格の安定「書いていない」4連発　実際は法律名にも条文にも明記,https://news.yahoo.co.jp/articles/cb2eb21b23b29c4403571401164d98f28a3d76dc,3/5(水) 7:00
2025-03-05,14:07,domestic,国内,20,関西テレビ,【速報】斎藤知事への告発調査する百条委員会の報告書県議会で了承　片山元副知事がコメント「このような報告を出すこと予測通りで不公正な委員会運営と感じつつ、真摯に証言してきたが、非常に残念です」,https://news.yahoo.co.jp/articles/41d97e335c78c6a95c037621b5282203a6f5f555,3/5(水) 13:21
2025-03-05,14:07,domestic,国内,21,ABEMA TIMES,藤井聡太名人への挑戦者は永瀬拓矢九段に決定！「歴史と重みのあるタイトルにふさわしい将棋を」 ファンも熱烈応援「和服増やさなきゃだな！」,https://news.yahoo.co.jp/articles/26cb932b7d948ad3b169387e4f153d6db1c7e9bf,3/5(水) 11:51
2025-03-05,14:07,domestic,国内,22,tenki.jp,この先も気温の変動大　8日は関東など真冬並みの寒さの所も　2週間天気,https://news.yahoo.co.jp/articles/e965e7f806501e1a4d20640a3cdb4c767e6d590a,3/5(水) 11:59
2025-03-05,14:07,domestic,国内,23,弁護士JPニュース,水原一平氏から大谷選手「26億円」の被害額を回収するのは難しい？  裁判で言い渡された“現実的”な返済計画とは【米国弁護士解説】,https://news.yahoo.co.jp/articles/902165daa2fc9a2dcab9e4c4454357ce3d291110,3/5(水) 13:26
2025-03-05,14:07,domestic,国内,24,毎日新聞,兵庫・斎藤知事「改めるべきは改める」　百条委の最終報告書了承受け,https://news.yahoo.co.jp/articles/f97aef1f971b8f07114a03cebf0539f3a28a343a,3/5(水) 12:00
2025-03-05,14:07,domestic,国内,25,テレビ朝日系（ANN）,【雪の影響】すべて「ノーマルタイヤ」　栃木県内で24時間に10件のスリップ事故,https://news.yahoo.co.jp/articles/f7b3ac448fec9d3d31f2236c7fd7073c88bc4edd,3/5(水) 12:49
2025-03-05,14:07,domestic,国内,26,共同通信,ドラッグストアのハンドソープに尿混入疑い,https://news.yahoo.co.jp/articles/1f336d787d4e4234a1ff4c458876874149ba0004,3/3(月) 17:07
2025-03-05,14:07,domestic,国内,27,関西テレビ,【速報】斎藤知事　自身の告発への県の対応「適切だったと考えています」　5日朝取材に応じる　告発調査した百条委員会「告発は外部公益通報に当たる可能性が高い」「法に違反する可能性が高い」など報告書公開,https://news.yahoo.co.jp/articles/64f7fbb989f161942321389b4dd64c32aa9aac69,3/5(水) 9:26
2025-03-05,14:07,domestic,国内,28,読売新聞オンライン,沖縄県・尖閣諸島の領海警備に巡視船2隻を新たに配備…第10管区海上保安本部に「しきしま」「あまみ」,https://news.yahoo.co.jp/articles/712a102410bb8c1bb825682cba9c0cfb7c586b8a,3/5(水) 13:01
2025-03-05,14:07,domestic,国内,29,FNNプライムオンライン（フジテレビ系）,【速報】東京渋谷区で一酸化炭素が漏れ作業員3人搬送され1人は意識不明の重体…ビル解体現場でプロパンガス撤去中に,https://news.yahoo.co.jp/articles/d09b340e8fa58cab380343da8e2868242239850a,3/5(水) 12:58
2025-03-05,14:07,domestic,国内,30,TBS NEWS DIG Powered by JNN,【速報】石破総理「日本の防衛費は日本が決める」　アメリカ国防次官候補“日本の防衛費はGDP比3%への増額進めるべき”発言受け,https://news.yahoo.co.jp/articles/160e91ec60ac1ba0b6196c262f30b2d47fda9be4,3/5(水) 13:50
2025-03-05,14:07,domestic,国内,31,共同通信,給食無償化5月に制度設計　自公維、小学校対象,https://news.yahoo.co.jp/articles/1f8b7cecbcb3ac47fe3bc6d3858287cd556feac7,3/5(水) 13:36
2025-03-05,14:07,domestic,国内,32,産経新聞,宮城県知事、土葬墓地計画で持論「特定宗教狙い撃ちのようなネガティブなやり取りに問題」,https://news.yahoo.co.jp/articles/b417dc7ad3409af442a0fae1701bef9c0f9a7bd7,3/5(水) 13:32
2025-03-05,14:07,domestic,国内,33,朝日新聞,「治療やめランドセル用意して旅立つ人も」がん患者団体が首相に訴え,https://news.yahoo.co.jp/articles/f05bb7113f5fc67874d370340e22709c361d9e36,3/5(水) 12:00
2025-03-05,14:07,domestic,国内,34,J-CASTニュース,女性隊員が男性隊員を招き入れ...陸自施設「密会劇」で停職処分　決定に2年半もかかった理由,https://news.yahoo.co.jp/articles/623f67b97f963a0108c3364d2146f724bc71ace4,3/5(水) 13:42
2025-03-05,14:07,domestic,国内,35,朝日新聞,保育園児の水筒に尿入れた疑い 「怖がらせて言うこと聞かせようと」,https://news.yahoo.co.jp/articles/897316fb8cb9c87d635aaa34fa32c9212e4e6921,3/5(水) 11:55
2025-03-05,14:07,domestic,国内,36,西日本新聞,予算に不満の立民・国民が接近　法案共同提出、参院選での連携は不透明,https://news.yahoo.co.jp/articles/502f70ead6ed2c402d47e0c4559992167554c9e9,3/5(水) 12:44
2025-03-05,14:07,domestic,国内,37,FNNプライムオンライン,【鎮火は?】大船渡市山火事現場に50ミリの雨雪予想…延焼は防げるのか?今後の天気は?天達武史気象予報士解説,https://news.yahoo.co.jp/articles/28190c70cb81f1fd58b8c19582b0f5c0ebdcf487,3/5(水) 12:32
2025-03-05,14:07,domestic,国内,38,共同通信,渋谷の工事現場から3人搬送、1人は重体,https://news.yahoo.co.jp/articles/e73219f81b6381dbc3c0aea36680ad111cdecd25,3/5(水) 13:12
2025-03-05,14:07,domestic,国内,39,弁護士ドットコムニュース,サンリオ「クロミ」著作者人格権をめぐり訴訟に発展　グッズはもう買えなくなる？,https://news.yahoo.co.jp/articles/bcbbb017e9e33c41c45f2a51df2529c6c60e15f4,3/1(土) 9:09
2025-03-05,14:07,domestic,国内,40,CBCテレビ,警察署の留置場で16人が吐き気などの症状  同じ業者の弁当で71人が食中毒  岐阜,https://news.yahoo.co.jp/articles/326d8bfaf9383f33b0c5ab047c5c0c52d9ce3e61,3/5(水) 11:27
