scrp_date,scrp_time,genre_en,genre_jp,rank,media_jp,title,link,date_original
2024-07-05,15:08,sports,スポーツ,1,デイリースポーツ,「ますます美人に」昨年引退のバレー元日本代表が茶髪ロングで雰囲気激変　ファン驚く「また綺麗に」男子代表選手と共演,https://news.yahoo.co.jp/articles/579805520c2ea0da7969d6995f0f94561e67bbea,7/5(金) 11:16
2024-07-05,15:08,sports,スポーツ,2,日刊ゲンダイDIGITAL,ロッテ佐々木朗希は“身内”からも嫌われた？ 故障中とはいえ選手間投票でも球宴選外のトホホ,https://news.yahoo.co.jp/articles/e502eec8462826a2059d848f9af52e046ca93b4a,7/5(金) 11:54
2024-07-05,15:08,sports,スポーツ,3,Full-Count,DeNA、大谷翔平の元同僚フォードを獲得　米通算37発、背番号は「99」…球団発表,https://news.yahoo.co.jp/articles/f04127719836bcf00ef64e00345f4e4a6ba4ae2f,7/5(金) 13:02
2024-07-05,15:08,sports,スポーツ,4,CoCoKARAnext,大谷翔平の特大HRが少年の頭部直撃で波紋 米メディアはド軍に“見舞い”を訴え「オオタニがちょっとでも挨拶に来れば」,https://news.yahoo.co.jp/articles/613f4bc28e4faa71e764fde907b4514c8ee29e1f,7/5(金) 6:03
2024-07-05,15:08,sports,スポーツ,5,日刊ゲンダイDIGITAL,鈴木誠也と吉田正尚が窮地…トレード浮上も引き取り手なし、大谷フィーバーの裏で価値大暴落,https://news.yahoo.co.jp/articles/d0118c928171e689d0f169c52d7d97ba638cf730,7/5(金) 11:42
2024-07-05,15:08,sports,スポーツ,6,Full-Count,鷹・野村大樹と西武の元ドラ1齊藤大将の電撃トレード成立　育成は史上初…両球団発表,https://news.yahoo.co.jp/articles/a421eba5cdc7f19973b141ff601e4c83ab612d17,7/5(金) 14:00
2024-07-05,15:08,sports,スポーツ,7,東スポWEB,大谷翔平の球宴出場でドジャースファン怒りも「他の選手が大谷に強奪された」＝米報道,https://news.yahoo.co.jp/articles/904ee63333ebe1ca26c91ef41ebfe0c9330129d8,7/5(金) 14:11
2024-07-05,15:08,sports,スポーツ,8,中日スポーツ,大谷翔平、3三振、3試合ぶりのノーヒットも『日本選手単独2位』メジャー通算103個目の盗塁決める　ドジャースは2連敗,https://news.yahoo.co.jp/articles/1ec7d8903826d1842d3a3bae282fa169b8d50a34,7/5(金) 13:09
2024-07-05,15:08,sports,スポーツ,9,サンケイスポーツ,ＤｅＮＡ・筒香嘉智が２軍合流　直近２２打席無安打で７戦連続スタメン落ち,https://news.yahoo.co.jp/articles/d2f650da386aaad263c3ab28a9a67d27e361cf3b,7/5(金) 12:42
2024-07-05,15:08,sports,スポーツ,10,ゴルフダイジェスト・オンライン（GDO）,男子プロがスタート時刻に来ず失格　前日の熱中症で体調不良、来場して謝罪,https://news.yahoo.co.jp/articles/00138a5f08fe206ea2e9bc14a7dc99bb21f020fe,7/5(金) 11:48
2024-07-05,15:08,sports,スポーツ,11,Full-Count,西武にトレードも「妻は喜んでいた」　野村大樹が激白、再会喜ぶ“元同期”の存在,https://news.yahoo.co.jp/articles/742e8092d6043d3603ee38ee0926fd6ace464540,7/5(金) 14:00
2024-07-05,15:08,sports,スポーツ,12,中日スポーツ,阪神・岡田彰布監督「あれは一番悪影響」現代の”トレンド”練習方法をボヤく　それを聞いて、ある中日OBの話を思い出した,https://news.yahoo.co.jp/articles/e7ff72cdb7fed5a90573c82936a22cf18d38a80f,7/5(金) 10:19
2024-07-05,15:08,sports,スポーツ,13,GOAL,なぜイングランド＆フランスは「つまらない」のか？EUROを支配する“恐怖心”とスペインの“希望”,https://news.yahoo.co.jp/articles/48b634ab13635047cff2d6f77f171ec5acabde98,7/5(金) 11:41
2024-07-05,15:08,sports,スポーツ,14,イーファイト,超マッスルビルダー、ビンタ大会“190kg巨漢”王者に挑戦も、衝撃の結果に,https://news.yahoo.co.jp/articles/e49ead09f930ef12b17c60d3f269a9b18998b8fc,7/5(金) 12:21
2024-07-05,15:08,sports,スポーツ,15,デイリースポーツ,大谷出場の一戦で相手選手が暴言で退場　通算５度目の“退場男”監督仲裁も抗議やめず,https://news.yahoo.co.jp/articles/96b302fbc787262979ea0a047ca6c8a277fe9c92,7/5(金) 12:41
2024-07-05,15:08,sports,スポーツ,16,TBS NEWS DIG Powered by JNN,女子走幅跳の秦澄美鈴が優勝でパリ五輪代表に内定、厚底スパイクでの新しい跳躍に挑戦する“変化を怖れない”メンタル【日本選手権4日目】,https://news.yahoo.co.jp/articles/4b187cc0e90e20a52645c450870c6a3d3c548639,7/5(金) 12:01
2024-07-05,15:08,sports,スポーツ,17,ゴルフ総合サイト ALBA Net,弓削淳詩がスタート時刻過ぎても現れず失格　日本プロ2日目,https://news.yahoo.co.jp/articles/7d640f25a4cfe460a741ee1529e9785815d4559d,7/5(金) 8:59
2024-07-05,15:08,sports,スポーツ,18,イーファイト,平本蓮が吉成名高とムエタイスパー！「同階級なら死んでいた」,https://news.yahoo.co.jp/articles/5eecd29314d3ce8a9b059b41a9066eb3c033b4e8,7/5(金) 12:08
2024-07-05,15:08,sports,スポーツ,19,日刊スポーツ,【ソフトバンク】小久保監督、野村大樹のトレードに「こっちにいたら出られる場所がなかった」,https://news.yahoo.co.jp/articles/aa58d499a3d5d55cf13b3a1576042e5bfa4c03c8,7/5(金) 14:38
2024-07-05,15:08,sports,スポーツ,20,スポーツ報知,ドジャースにまたしても故障者の緊急事態　３４歳ベテラン外野手が左膝痛で３回から交代,https://news.yahoo.co.jp/articles/7c8ef4ae7fecd4679567c48d5a331a09a6973dfb,7/5(金) 11:29
2024-07-05,15:08,sports,スポーツ,21,Full-Count,元盗塁王が覚醒の兆し「天才なんだな」　昨季出場ゼロ→.331＆.812…26歳の躍動が「頼もしい」,https://news.yahoo.co.jp/articles/f2728f940d6bd16b1c21c2688ba1405f05230f2c,7/5(金) 10:58
2024-07-05,15:08,sports,スポーツ,22,デイリースポーツ,西武入りの野村大樹が心境「複雑な思い」本音も「母校が１番近い球団ですし心機一転頑張ろうと思います」,https://news.yahoo.co.jp/articles/5ce168d13bb4c0eb3ded32df5ff3edd2b5c9e5d2,7/5(金) 14:22
2024-07-05,15:08,sports,スポーツ,23,Full-Count,“別れ”を察した着信に「泣きました」　電撃トレード、6年目の付き合い「本当に親友です」,https://news.yahoo.co.jp/articles/9132fa369de30a155a8b01a14dafbe5d3e5b106f,7/5(金) 14:36
2024-07-05,15:08,sports,スポーツ,24,Full-Count,大谷翔平が首位打者陥落　通算103盗塁で日本人2位も5度目の3三振…20代最後を飾れず,https://news.yahoo.co.jp/articles/640e71a381f7f1a29244933ca9474b4100f90f9f,7/5(金) 12:58
2024-07-05,15:08,sports,スポーツ,25,GOAL,王者アルゼンチンが死闘制し準決勝へ！PK戦メッシ失敗もGKマルティネスが圧巻の連続セーブ,https://news.yahoo.co.jp/articles/d2e4bfc9e07e31feef53058ff7d2e3ddecd90b03,7/5(金) 12:09
2024-07-05,15:08,sports,スポーツ,26,西スポWEB OTTO！,異例の〝格差トレード〟成立　ソフトバンク・野村大樹と西武育成・齊藤大将　打撃強化の最下位獅子とリリーフ左腕求めた首位独走鷹の思惑一致,https://news.yahoo.co.jp/articles/bcd1142490d856dc1329ceecbeeaa8e10dcd3424,7/5(金) 10:21
2024-07-05,15:08,sports,スポーツ,27,CoCoKARAnext,中日のラストピースは2軍で無双中の右腕か　残り支配下枠は「1」,https://news.yahoo.co.jp/articles/0232b23a324d724360f990ea272b864c75fd10f1,7/5(金) 11:50
2024-07-05,15:08,sports,スポーツ,28,RONSPO,岡田阪神を混乱させた広島の新井監督が計算ずくで「むちゃくちゃやった」これだけの根拠…初球エンドランが4度に代走の羽月が二盗→三盗→暴投で勝ち越し点,https://news.yahoo.co.jp/articles/b4728a9a713d430d0f7c3fa07bdc517fd3b9d4da,7/5(金) 6:30
2024-07-05,15:08,sports,スポーツ,29,デイリースポーツ,ＮＰＢ最速１６６キロ元巨人守護神、２度の戦力外乗り越えてＭＬＢで奮投「巨人ファンの声援を忘れない」厳しい生き残り競争も「モンダイナイ！」,https://news.yahoo.co.jp/articles/846fe9e3cbbfa8c7d3185415b3db0b365dc9940a,7/5(金) 9:43
2024-07-05,15:08,sports,スポーツ,30,中日スポーツ,再入幕の遠藤、しこ名がずっと本名のままなのを直撃したら…まさかの理由でした【はなわの相撲ヲタク対談】,https://news.yahoo.co.jp/articles/2e999e1377c57175947cca53f53061dd0ec2f439,7/5(金) 6:00
2024-07-05,15:08,sports,スポーツ,31,東スポWEB,アーセナルが不遇のＭＦグリーリッシュを獲得か　移籍金は１０４億円超,https://news.yahoo.co.jp/articles/04666a3400ec3d631ff89f6b88c0360194ccc2d0,7/5(金) 10:02
2024-07-05,15:08,sports,スポーツ,32,e!Golf,【中間速報】川崎春花がトーナメントコースレコードタイ「65」で単独首位浮上　2打差に河本結、櫻井心那 ＜女子ゴルフ＞,https://news.yahoo.co.jp/articles/26fc091e820b81352b624dbfe268b816c009e791,7/5(金) 13:09
2024-07-05,15:08,sports,スポーツ,33,サンケイスポーツ,ヤクルト・松本直樹、攻守の進化を後押しするコミュ力　物腰柔らかい燕の〝まっちゃん〟,https://news.yahoo.co.jp/articles/b89626fb052efbbe9f8a10a28a0c3db61fd9846f,7/5(金) 14:00
2024-07-05,15:08,sports,スポーツ,34,西スポWEB OTTO！,「モイネロと当たりたい」　ソフトバンクから西武にトレード移籍、野村大樹の野望は恩人打ち　「ビシエドとかもつないでくれた」,https://news.yahoo.co.jp/articles/48e1e9abf3cdb2d7bc172543ed2094fb72b742d8,7/5(金) 14:25
2024-07-05,15:08,sports,スポーツ,35,サンケイスポーツ,ヤクルトの嘉弥真新也、増田珠が１軍合流,https://news.yahoo.co.jp/articles/25a0289bd64fe290a0c2b96ad30044551c881ce1,7/5(金) 14:02
2024-07-05,15:08,sports,スポーツ,36,西スポWEB OTTO！,「ただただシンプルにはええ」〝令和のピノ〟が高速ヘッスラ三連発で決勝点「すさまじかった」「カープ野球の申し子！」,https://news.yahoo.co.jp/articles/2a0e7bb31ace9e684a5e3525ef8fe19ce635fc5d,7/5(金) 12:30
2024-07-05,15:08,sports,スポーツ,37,Full-Count,大谷翔平、日本人単独2位の通算103盗塁　14戦ぶり三盗成功…松井稼頭央を抜く,https://news.yahoo.co.jp/articles/1d94a2b167b467f51e7262902b434f2ae6e9da7e,7/5(金) 10:30
2024-07-05,15:08,sports,スポーツ,38,ABEMA TIMES,お前、やる気あんの…？ 今永昇太のボールで“異変”が起きた…！？ 空振り三振したバッターのリアクションがヤバすぎる「お手上げ感w」「訳が分からない」,https://news.yahoo.co.jp/articles/21d4dd6147faa461cdc8bbdd6dbf8e493589dc75,7/5(金) 6:32
2024-07-05,15:08,sports,スポーツ,39,サッカー批評Web,「凄い競演!」「2人とも嬉しそう!!」ブライトンに2人目の日本人選手加入で「三笘薫との初競演映像」が話題に! 筑波大学出身コンビに「本当に夢みたいな話だよな…」の声,https://news.yahoo.co.jp/articles/d89ec03c096d75ac065445cd9f7084683e2fdf91,7/5(金) 5:36
2024-07-05,15:08,sports,スポーツ,40,東スポWEB,大谷翔平２７号が米国で物議　子供の頭部直撃で〝捕球ミス〟の大人たちを「全員永久追放」,https://news.yahoo.co.jp/articles/950ab68a2231b8f06f520ff8207115b29b22a41d,7/3(水) 21:02
