scrp_date,scrp_time,genre_en,genre_jp,rank,media_jp,title,link,date_original
2025-08-12,06:07,life,ライフ,1,ねとらぼ,雑草ボーボーだった“ばあちゃん家の庭”→孫がスコップ1本でDIYしたら……　1カ月後、まさかの光景に「羨ましぎる」「努力の賜物やな」,https://news.yahoo.co.jp/articles/87333174948ad6fd6f08a1e1b09009e9071f16fd,8/11(月) 19:15
2025-08-12,06:07,life,ライフ,2,ほ・とせなNEWS,赤ちゃんを見て、突然近づいてきた中学生集団。すると母親に手渡したものに「あまりにも平和」「王子様集団」,https://news.yahoo.co.jp/articles/9d430493b418f441077f2c426290d5ba1be4a74d,8/11(月) 6:00
2025-08-12,06:07,life,ライフ,3,ほ・とせなNEWS,スーパーのレジで…小銭をまき散らした女性。すると近くにいた人が手渡した”まさかのモノ”に「なんて素敵な方」「心がじんわり温かくなった」,https://news.yahoo.co.jp/articles/2bf986b28bf4c9bf194ea9f40261836b5b2f0fc4,8/11(月) 21:47
2025-08-12,06:07,life,ライフ,4,ねとらぼ,釣り針が刺さった猫を助けたら……　まさかの展開に「感動で泣いちゃった」「猫の恩返しって、こういうこと」,https://news.yahoo.co.jp/articles/619bf3398e3581d9bd11f5a457d9d4e642d1d263,8/11(月) 20:00
2025-08-12,06:07,life,ライフ,5,Hint-Pot,「これはあり得ないよ」　フランス人シェフが日本のラーメン店で修業して驚愕　「おそろしい…日本人は」と思った意外なこととは,https://news.yahoo.co.jp/articles/6b4760d8d2ae06171c7627f2cb7ef1e611524ebd,8/12(火) 5:10
2025-08-12,06:07,life,ライフ,6,ENCOUNT,「小学生泣いてた」外国人がハッピーセット買い占め…マクドナルド“杜撰対応”に現役クルーも苦言,https://news.yahoo.co.jp/articles/a51004315c8905d872a1b63a4cbb33fc675b832b,8/10(日) 17:10
2025-08-12,06:07,life,ライフ,7,ファイナンシャルフィールド,実家にいまだに「固定電話」があることに気づきました。2024年でサービスが終わったのではないのでしょうか？ 通信費はかかっているの？,https://news.yahoo.co.jp/articles/56c8fb70da382e5435311e6f3c6d804126158230,8/10(日) 14:40
2025-08-12,06:07,life,ライフ,8,ENCOUNT,「もうやめにしたら」マックのハッピーセット騒動、元店員が疑問視　“ポケカおまけ”は「地獄」,https://news.yahoo.co.jp/articles/2ee5e014a8c89334a16fa271809eb7ac67bfd326,8/11(月) 16:20
2025-08-12,06:07,life,ライフ,9,ねとらぼ,初代ガンダムを「ジークアクス」の“赤いガンダム”に改造すると……　「まじでかっけぇ」「発想が大好き」驚がくの完成品に称賛【ガンプラの記事まとめ】,https://news.yahoo.co.jp/articles/7cbfe1cfeb9555fc26c87b27d5b55fc436b2b40a,8/11(月) 21:15
2025-08-12,06:07,life,ライフ,10,ファイナンシャルフィールド,「子ども3人だから大学無償化」と奨学金を申請したら“不採用”だった！「高校生・中学生」を扶養してるのになぜですか？ 見落としがちな注意点とは,https://news.yahoo.co.jp/articles/a324d4fe6f5d854c90a3b68a4a77fb314117f1a7,8/11(月) 14:10
2025-08-12,06:07,life,ライフ,11,まいどなニュース,「30年苦労すると 人間はこうなります」16歳→46歳 免許証写真の変化に衝撃　高校中退、妻と紙吹雪の内職を経て…「最後の顔が1番カッコいい」20万いいね,https://news.yahoo.co.jp/articles/d030f5710e28ce49267e3d65be765a5744919d7c,8/9(土) 8:02
2025-08-12,06:07,life,ライフ,12,LIMO,【海外旅行】ロングフライト時の服装はどうしてる？旅行好きの元CAが「服装の注意点5つ」を紹介,https://news.yahoo.co.jp/articles/60c81e9c5ef1cb00b28852213249d08c85466fd5,8/11(月) 17:01
2025-08-12,06:07,life,ライフ,13,LIMO,「口コミ570件で大人気！」無印良品のミニ財布が690円！新色も登場、ストラップ付きで旅行にも便利,https://news.yahoo.co.jp/articles/4dabacfb1f39b62112f09d7ed0f3e3b963da4cca,8/11(月) 19:46
2025-08-12,06:07,life,ライフ,14,ねとらぼ,水を吸わせた石に草とコケをのせ、我が子のように育てたら……　5カ月後、思わず見入る姿に「最高です〜！」「これやってみます」,https://news.yahoo.co.jp/articles/27da3b4d15bdb54b8e92e8452dc2c323e821a270,8/11(月) 22:05
2025-08-12,06:07,life,ライフ,15,ねとらぼ,野良猫に追われて脱走したニワトリの「コッコ」が、1カ月後……　目を疑う姿と“まさかの連れ”に反響「奇跡」「すごいなー」,https://news.yahoo.co.jp/articles/259cfa040fb06f3548d94e23137ef3b23bd2dd53,8/10(日) 9:30
2025-08-12,06:07,life,ライフ,16,ねとらぼ,ダイソーで買った“ゴツゴツの石”→徹底的に磨いてみたら……「うわぁ！」　信じられない結果が100万再生「こんなに綺麗に」,https://news.yahoo.co.jp/articles/4c27f15a606723f677bca870e9fc37dcf900a5d6,8/11(月) 11:55
2025-08-12,06:07,life,ライフ,17,ENCOUNT,子連れでラーメン屋→会計でまさか「現金が足りない」　大将の“神対応”にネット感動「これは通う」,https://news.yahoo.co.jp/articles/e51aaff25947cc881c69d84466c81f27cced1c06,8/11(月) 9:10
2025-08-12,06:07,life,ライフ,18,ENCOUNT,通勤ラッシュで乗り込んできた高齢の登山者集団　30代サラリーマンの本音で論争発展「元気なら譲らない」「逆に失礼」,https://news.yahoo.co.jp/articles/d4fe30ec1457ddde9d6ccbe61a6c9ba33ee421b5,8/11(月) 9:40
2025-08-12,06:07,life,ライフ,19,ねとらぼ,ビーズ刺しゅうで作ったカニ、ポーチにつけると……「これ合ってるよね？」→まさかの光景に「さ、最高すぎます」「The夏」,https://news.yahoo.co.jp/articles/3696735ca938db29b4160358a0e188fdd1c21ed3,8/11(月) 11:00
2025-08-12,06:07,life,ライフ,20,LIMO,「年々ラクになる！」庭の雑草対策3つのコツ＆早めに抜いておきたい雑草4選を「園芸のプロが解説」,https://news.yahoo.co.jp/articles/21341563d6c22156923529ce1ba7acfac61ec78a,8/11(月) 8:16
2025-08-12,06:07,life,ライフ,21,BuzzFeed Japan,【coca】2490円→1490円の「楽ちんワンピース」すぽんと着るだけでカワイイ！体型カバーもできてヘビロテしたくなります！《着用レビュー》,https://news.yahoo.co.jp/articles/baba0ee106abe4ed17c4b97fed201cae1b49a54b,8/11(月) 21:35
2025-08-12,06:07,life,ライフ,22,ねとらぼ,モンハンワイルズで『ジョジョ』のキャラを再現すると……　「なんという完成度」「本物過ぎて震えてきます」完璧な再現に反響,https://news.yahoo.co.jp/articles/63248c68d0f302033b25cbbb7145a36d360ed117,8/11(月) 19:00
2025-08-12,06:07,life,ライフ,23,ねとらぼ,ピンクの布に2カ月かけて刺しゅうし、完成したのはまさかの……「すげぇー！！」　目を疑う作品に「えっ可愛いぃ〜」「素晴らしい！」,https://news.yahoo.co.jp/articles/2b0108fcab944da0044b0276464d9ad234e8a055,8/10(日) 14:30
2025-08-12,06:07,life,ライフ,24,ねとらぼ,修学旅行前の中学生「垢抜けたい」→美容師に依頼すると……　「えぐい変わりよう」「こりゃーモテるぞ」　イメチェンが600万再生の大反響,https://news.yahoo.co.jp/articles/c2b6a1c6c40e88a84fd0c36ec3c0d9a8db3f758c,8/10(日) 11:55
2025-08-12,06:07,life,ライフ,25,ねとらぼ,ばぁばが1歳孫のため、タオルを縫って作ったのは……「すげえええ!!」　予想外の完成品に「ばぁば天才」,https://news.yahoo.co.jp/articles/517ebb786c1a266e4e20dc05462b774fa1b93410,8/10(日) 9:00
2025-08-12,06:07,life,ライフ,26,FNNプライムオンライン,生まれつき左手の指がない高校球児・横山温大選手 家族と共に乗り越えたハンディキャップ 強豪校でスタメン張り甲子園へ,https://news.yahoo.co.jp/articles/b8cd746277131e6bedcd6966e7b130f521d24835,8/11(月) 8:03
2025-08-12,06:07,life,ライフ,27,ねとらぼ,出産で大増量した40歳ママ、本気ダイエットで→「もう笑いしかない」「凄すぎる」　11キロ減の現在の姿に反響,https://news.yahoo.co.jp/articles/7e867124d797ee125dce1b1c2bb4dec4dd264481,8/11(月) 20:30
2025-08-12,06:07,life,ライフ,28,BuzzFeed Japan,ユニクロ×ムーミンの「1500円Tシャツ」が可愛い！淡いピンク色がオシャレで、コーデの差し色にぴったりです！《着用レビュー》,https://news.yahoo.co.jp/articles/14bc84e4400effa309b19a13934c7272875704a6,8/11(月) 19:05
2025-08-12,06:07,life,ライフ,29,ほ・とせなNEWS,85㎏の女性「自分を変えると決めて」　40歳から努力を重ねた現在、”まさかの姿”に「ここまで綺麗に」「すごー！！」,https://news.yahoo.co.jp/articles/41e274d22f22ae51e0c1691cfb6068847ddda58d,8/9(土) 10:00
2025-08-12,06:07,life,ライフ,30,LIMO,「この価格でこの機能？」ワークマンのサングラスが980円！40代からの“日差し対策”にちょうどいいワケ。,https://news.yahoo.co.jp/articles/fdb75d4d161eb77e0b8d58b4d4c571e45b53ba57,8/11(月) 20:46
2025-08-12,06:07,life,ライフ,31,ほ・とせなNEWS,質素な和室の押し入れ→1ヶ月後、理想の空間にするべくリノベーションをした結果…「どこまでもおしゃれです」「古着屋さんみたい」「理想的すぎる空間」,https://news.yahoo.co.jp/articles/0fe402ae2b5a2d2f4a58d8370d9e60a27c891e4a,8/11(月) 9:00
2025-08-12,06:07,life,ライフ,32,ねとらぼ,「尊敬しかない」　93歳おばあちゃんが“自分のためだけ”に作る夕食→驚きの光景に「見習わなければ」「感心します」,https://news.yahoo.co.jp/articles/5597e7b2b3d80578bd85853b4f9990bb46c36769,8/9(土) 7:00
2025-08-12,06:07,life,ライフ,33,BuzzFeed Japan,"孤児になったチーターが""まさかの生き物""と共生。動物園が公開した日常に「ほっこり」の声（オーストラリア）",https://news.yahoo.co.jp/articles/4c303fbb1c7f996adac819173b887307b6494ba5,8/10(日) 19:05
2025-08-12,06:07,life,ライフ,34,ENCOUNT,民泊が外国人の転売拠点に？　大量に捨てられたポケモンカードに衝撃「うちの子が買えなかったボックスまで」,https://news.yahoo.co.jp/articles/1f6947de034d0e9ccfb7401965562f3d2d45acc8,8/6(水) 17:10
2025-08-12,06:07,life,ライフ,35,ねとらぼ,3色の刺しゅう糸を垂らし、手でもくもくと編み続けると……「わぁっ！」　夏休みにぴったりな完成品が100万再生突破【海外】,https://news.yahoo.co.jp/articles/8acc764ee524b962ddaaae28faf560b13e3656f4,8/10(日) 9:45
2025-08-12,06:07,life,ライフ,36,ねとらぼ,「何卒ご容赦ください」　晩ごはんを台無しにした妹が“お堅い長文LINE”を送ったら……　姉のノリノリすぎる返信が1900万表示　「圧すごいw」「到底許されないww」,https://news.yahoo.co.jp/articles/2178e27f3448ee8f1e5928d9677dcc16291b5e24,8/11(月) 20:30
2025-08-12,06:07,life,ライフ,37,LIMO,ワークマン新作の「ミニミニ財布」が便利！カードもしっかりと入る仕様で980円！旅行用の財布にも良さそう！,https://news.yahoo.co.jp/articles/0328f60f692ac4f565eef85f40744c8e8fc4c377,8/9(土) 20:31
2025-08-12,06:07,life,ライフ,38,ねとらぼ,実家の柴犬が遊びにきた日、柴犬×2で出掛けると……「絶対話し合ったやろw」　“ウソみたい”なワンコ3匹の光景に「めちゃくちゃ笑いました」,https://news.yahoo.co.jp/articles/48f3643387bde51f966979b2450d682e2850916e,8/11(月) 10:30
2025-08-12,06:07,life,ライフ,39,ほ・とせなNEWS,小1男子が朝顔を育てた結果…　→夏休み後の姿に「愛されてる」「息子の朝顔も…」「これは素敵」,https://news.yahoo.co.jp/articles/2a0d92ede5cfe934d74c956c4ddfcbf0c7b02f8d,8/11(月) 10:00
2025-08-12,06:07,life,ライフ,40,BuzzFeed Japan,ユニクロの「1990円→1290円パンツ」が軽くて涼しい！汗をかいてもベタつきにくくて快適です《着用レビュー》,https://news.yahoo.co.jp/articles/9c23659d6f84d7689d3ed95e0bdfa516d0707f01,8/8(金) 22:05
