scrp_date,scrp_time,genre_en,genre_jp,rank,media_jp,title,link,date_original
2024-06-13,11:33,TTL,総合,1,よろず～ニュース,40歳の人気YouTuberが「不運な事故」で死去　登録者300万人、妻がチャンネル継承へ,https://news.yahoo.co.jp/articles/964631f236b95252cac7d5e4c8d200186d32f736,6/13(木) 7:50
2024-06-13,11:33,TTL,総合,2,Full-Count,マウンドに「天使がきた」　長髪さらりの1球…ふわふわ笑顔にファン悶絶「かわいすぎる」,https://news.yahoo.co.jp/articles/e139ff97ca141b03eca7222853e2fd3fe48424e0,6/13(木) 7:20
2024-06-13,11:33,TTL,総合,3,デイリースポーツ,まさかの敗戦のＪ１町田・黒田監督　判定と筑波大のラフプレー、マナーに苦言「すごく憤り感じる」「大人に向かって配慮に欠ける言葉あった」負傷者続出、骨折の選手も,https://news.yahoo.co.jp/articles/92b6d1c3b159fb070807dbc5a20e8200a4569970,6/12(水) 21:53
2024-06-13,11:33,TTL,総合,4,西スポWEB OTTO！,「何がどうなって…」有村架純のタレント姉〝激変〟ショットにネット騒然!?「ビビるくらい…」「一瞬誰かとわからなかったかも」,https://news.yahoo.co.jp/articles/0bcc68aa8d5c2754fe705865a7ea05c4eb4ea12d,6/12(水) 23:20
2024-06-13,11:33,TTL,総合,5,withnews,〝探偵〟の張り込みや尾行、なぜOK？　実は法律で…　こんな業者は注意、選ぶポイントも,https://news.yahoo.co.jp/articles/13a93bedc4bed1e16630ee459bddc656e1752c45,6/13(木) 7:00
2024-06-13,11:33,TTL,総合,6,MANTANWEB,＜米倉涼子＞病気公表後、初の生放送　6月14日「あさイチ」に出演　難病抱え、50代目前の今感じていること,https://news.yahoo.co.jp/articles/9424ce11db8fe286c1243bc3381565085f363d20,6/13(木) 7:41
2024-06-13,11:33,TTL,総合,7,スポーツ報知,工藤静香５４歳、美魔女なメイク姿！次女が作ったワンプレート朝食も素敵「１番好きな卵の黄身具合」,https://news.yahoo.co.jp/articles/bca76f9cb9326e35339a3575d114000cdfb809f5,6/12(水) 18:45
2024-06-13,11:33,TTL,総合,8,Full-Count,魅惑のボディ“日本初”披露に「まじか！」　181万人フォロワー興奮…台湾チアが「美しい」,https://news.yahoo.co.jp/articles/3846129055c439dd487c35f639b9573c50f4af43,6/13(木) 8:25
2024-06-13,11:33,TTL,総合,9,サッカーキング,伊藤洋輝がバイエルンと5年契約で合意とロマーノ氏の報道　残すはメディカルチェックのみか,https://news.yahoo.co.jp/articles/5d8119653dcd192fbe2a7e6f670eba3c0a8638e3,6/13(木) 6:56
2024-06-13,11:33,TTL,総合,10,HBCニュース北海道,ＳＮＳに内田梨瑚容疑者が写った画像を無断で使用したことでトラブルに…女子高校生を橋から川に転落させ殺害した疑いの女２人を逮捕　北海道旭川市,https://news.yahoo.co.jp/articles/1d69bfc78abf90bcc5c71b1ae2c41676bd57e1de,6/12(水) 23:11
2024-06-13,11:33,TTL,総合,11,36Kr Japan,中国BYDの高コスパEVは「米国には作れない」　車両の分解で明らかにされた驚きの理由,https://news.yahoo.co.jp/articles/fc4ac03bb99a83b3727c01f4ca1cb56c9d3b92a7,6/13(木) 8:00
2024-06-13,11:33,TTL,総合,12,まいどなニュース,そろそろ片付けたい羽毛布団「圧縮袋で保管はNG」って本当？→お手入れ方法を寝具メーカーに聞いた「コインランドリーで乾燥も要注意です」,https://news.yahoo.co.jp/articles/5f4418933750a8e6fd1f16c491c97bc01d58c474,6/13(木) 8:07
2024-06-13,11:33,TTL,総合,13,サンケイスポーツ,関西ダービーが完敗ダービーに…　阪神・岡田彰布監督はバッテリーに苦言「試合前に言うてんのに、それやらへんから」,https://news.yahoo.co.jp/articles/ffd97531936dab31e52871bc1de886827fc7a691,6/13(木) 7:30
2024-06-13,11:33,TTL,総合,14,ENCOUNT,松本人志VS文春裁判　松本側は“暴露系配信”まで証拠提出していた…全記録を閲覧した弁護士が明かす狙い,https://news.yahoo.co.jp/articles/1f85f2c2bc21a13f40063de099b94ca6ae562298,6/12(水) 20:22
2024-06-13,11:33,TTL,総合,15,ねとらぼ,これは知らなかった！　現役清掃員が教える“タバスコのびんの捨て方”　意外な盲点に「そうだったんだ」「タメになる」,https://news.yahoo.co.jp/articles/230684f614a35116d52c0400667992e3976f35e2,6/13(木) 7:00
2024-06-13,11:33,TTL,総合,16,弁護士JPニュース,「NHKは重要な布石を打った」受信料支払いが“国民の義務”となる可能性も？　放送法改正に見える“思惑”を弁護士が解説,https://news.yahoo.co.jp/articles/d3a783fd871693b20807b99b45a41ced80821e22,6/13(木) 9:50
2024-06-13,11:33,TTL,総合,17,スポニチアネックス,門倉有希さん通夜　氷川きよし号泣　伍代夏子、長山洋子、西尾夕紀ら約300人が参列,https://news.yahoo.co.jp/articles/00399dc6e2545e3ab089b022f9b67795c3067474,6/13(木) 4:46
2024-06-13,11:33,TTL,総合,18,デイリースポーツ,古賀紗理那＆西田有志夫妻に「好感が持てる」韓国戦中継後に特別映像「良く跳ぶゴリラ」→「盛りグセあるんですよ」頭なでなでも,https://news.yahoo.co.jp/articles/3ca0b2efc27f835621a6b2e12c372a9fc001e345,6/13(木) 10:31
2024-06-13,11:33,TTL,総合,19,日刊スポーツ,浜田雅功「水ダウ」開始０秒で一喝「ギリギリまで私語するな」48歳吉本芸人いきなり謝罪スタート,https://news.yahoo.co.jp/articles/ab12ad39a337a22e1b460964b884c72dec92f19f,6/13(木) 9:06
2024-06-13,11:33,TTL,総合,20,ねとらぼ,飼い主のことが好きすぎる超大型犬、最後は勢い余って……　直視できないレベルの一撃に「何回見ても笑っちゃう」「襲われてる人がいます!!」,https://news.yahoo.co.jp/articles/918e6993ca617adca98b1fffeea674388ba47402,6/13(木) 10:00
2024-06-13,11:33,TTL,総合,21,メ〜テレ（名古屋テレビ）,レンタカー4年返さず　岐阜県警が横領容疑で男を逮捕　延滞料金は…,https://news.yahoo.co.jp/articles/370dea0d68a72586b15f63254c0577b0ff841c33,6/13(木) 0:46
2024-06-13,11:33,TTL,総合,22,イーファイト,あのBD椅子蹴りラウンドガール、現在は黒髪”アイドル系”美女にイメチェン！ファン「見るたびに可愛いくなる」,https://news.yahoo.co.jp/articles/3cc96eeb0f26fb5bcd20fca4c2a9f43a8f290197,6/13(木) 7:16
2024-06-13,11:33,TTL,総合,23,デイリースポーツ,元メッツのロペスがカブスとマイナー契約　大谷翔平に被弾→退場＆問題行動→戦力外の右腕　米メディア報じる,https://news.yahoo.co.jp/articles/325db4f51076bfe1c916f998f1fda8a0346e58fe,6/13(木) 9:20
2024-06-13,11:33,TTL,総合,24,MLB.jp,【MLB】ベリンジャーの一発でカブスが逆転勝利　鈴木誠也は今季初の4番で8号ソロを含む2安打1打点,https://news.yahoo.co.jp/articles/8eb287de804e47d52eb77cb0e287bf274b70d2af,6/13(木) 10:32
2024-06-13,11:33,TTL,総合,25,デイリースポーツ,なぜ阪神・佐藤輝明はボール球を振ってしまうのか　評論家が問題点と対応策を指摘　再昇格後は打率・１５８、０本塁打、０打点,https://news.yahoo.co.jp/articles/6682679de6ae6cd4adee616ee4d5f669d837cef5,6/13(木) 10:00
2024-06-13,11:33,TTL,総合,26,朝日新聞デジタル,17歳を殺害容疑で逮捕の21歳　SNSトラブル、家族「しらない」,https://news.yahoo.co.jp/articles/0b3541a2117acbb5fb516a7be6f2033d8583db9b,6/13(木) 6:00
2024-06-13,11:33,TTL,総合,27,まいどなニュース,「小1娘の宿題…合ってるのになぜ？」算数の採点方法に「厳しすぎない？」「やる気なくなっちゃう」,https://news.yahoo.co.jp/articles/7adec3aa70b2ca4cc76d7b44a9ff2a2cb02c8415,6/13(木) 7:40
2024-06-13,11:33,TTL,総合,28,朝日新聞デジタル,マンション解体「必ず影響ある」　国立市長、積水ハウスに遺憾表明,https://news.yahoo.co.jp/articles/a7f3a17bd2b297b352b60b51b187841a8918d403,6/12(水) 14:34
2024-06-13,11:33,TTL,総合,29,ほ・とせなNEWS,カメラにメンチを切る赤ちゃん　しかし、ママに気づくと…「ふり幅すごすぎ」「爆笑」「最高にかわいい」,https://news.yahoo.co.jp/articles/d87c8e12a26a4b363eaaa2f528ec8587f1419b7f,6/13(木) 6:30
2024-06-13,11:33,TTL,総合,30,GOAL,急転直下の合意報道…バイエルン、伊藤洋輝の獲得を決めた背景は？独メディアが理由を説明&分析「ニーズに完璧に合致」「コンパニ監督就任により…」,https://news.yahoo.co.jp/articles/b27c1ea00f18346c385b17629a77527cadfc662f,6/13(木) 7:50
2024-06-13,11:33,TTL,総合,31,47NEWS,習近平氏は「不運な」指導者？方向性見えず、強まる統制　中国分析４０年の研究者が抱く危惧【中国の今を語る③】,https://news.yahoo.co.jp/articles/ffe381f8a50e7e9af40377e5984529e360820d88,6/13(木) 10:02
2024-06-13,11:33,TTL,総合,32,日刊スポーツ,島崎遥香、LINEの連絡先消したい超大物の実名明かす　電話帳の合理的「断捨離」法も公開,https://news.yahoo.co.jp/articles/f684f4594d33359131d6b327a54c522bfe643b02,6/12(水) 22:58
2024-06-13,11:33,TTL,総合,33,スポニチアネックス,上原亜衣　オーバーサイズの彼シャツ・ショット公開に「これは良い」「色気が凄い」「超カワイイ」,https://news.yahoo.co.jp/articles/58579be4946985ea9e01d5d3222f2f8312818861,6/13(木) 8:42
2024-06-13,11:33,TTL,総合,34,埼玉新聞,性的暴行しようと…5歳未満の女児2人が悲劇、スマホで撮影し迫ってきた保育士を逮捕　勤務する児童施設で　その後、退職した26歳…20人以上に乱暴していた可能性、逮捕は6度目,https://news.yahoo.co.jp/articles/66f25c80e91fac1fffc26d56fbea06f9dcc5f48a,6/13(木) 9:03
2024-06-13,11:33,TTL,総合,35,ENCOUNT,広瀬アリス、へそ出しコーデ披露　ファン魅了「細い」「顔、スタイル完璧すぎ」,https://news.yahoo.co.jp/articles/c3ce4ac73bb2ce70f53f588ef8b36db9c1600870,6/13(木) 7:10
2024-06-13,11:33,TTL,総合,36,ABEMA TIMES,大谷翔平は一体、何をしているのか…！？ チームメイトに取った行動が話題に　特大アーチ直後にベンチで熱血指導？「こういうシーン増えたな」「良いチーム」,https://news.yahoo.co.jp/articles/049a3d82bf90a1e975c68e6351683f1fc17d0c8a,6/13(木) 6:46
2024-06-13,11:33,TTL,総合,37,みんかぶマガジン,「負の実績しかない」少子化対策「ラストチャンス」煽られても響かず…鬼の岸田政権「意味不明の少子化対策」増税に国民総絶望,https://news.yahoo.co.jp/articles/5db959047795fe4ee8ad98b02e7f6df8d83d326b,6/13(木) 9:10
2024-06-13,11:33,TTL,総合,38,MBSニュース,自殺ほのめかす児童のノートに、担任教諭が『花丸とYou can do it!』両親ら訴えた裁判始まる　奈良市「教員らの対応に義務違反はない」争う姿勢　原告側は「愕然とした」,https://news.yahoo.co.jp/articles/ab27489293150eb39e7d5dd398e0e2264053c466,6/13(木) 10:00
2024-06-13,11:33,TTL,総合,39,スポーツ報知,西城秀樹さんのイケメン長男、２０歳になった姿に仰天！「そっくり」「カッコいい」「お父様も感激」,https://news.yahoo.co.jp/articles/002f99911b2e958a354f4c39d481939bb6db5bf8,6/12(水) 19:50
2024-06-13,11:33,TTL,総合,40,乗りものニュース,「神奈川県最大のターミナル」が大変貌へ “駅前一等地”で再開発検討 JR東と京急も参画,https://news.yahoo.co.jp/articles/3b01915b310ef6e3039d4c51c18d8f9516568850,6/13(木) 8:42
