scrp_date,scrp_time,genre_en,genre_jp,rank,media_jp,title,link,date_original
2024-11-02,15:08,sports,スポーツ,1,東スポWEB,ロッテが佐々木朗希のポスティングを拒否と米報道「ドジャースを失望させた」,https://news.yahoo.co.jp/articles/1f75cab841bfe3243bcdc92fa7c5f96ff7a97677,11/2(土) 10:41
2024-11-02,15:08,sports,スポーツ,2,スポーツ報知,真美子夫人　まなざし麗しい姿に反響！「ビューティフル！」「笑顔も見られてうれしい」の声,https://news.yahoo.co.jp/articles/c21ec0b2b592c94ddd201a53af190c77b4948e6c,11/2(土) 8:52
2024-11-02,15:08,sports,スポーツ,3,デイリースポーツ,「凛として本当に素敵」真美子夫人がみせた笑顔と気遣いに反響　夫がデコピン抱っこ時にはリードを手に「真美子さんがちゃんと」　左手薬指には指輪きらり,https://news.yahoo.co.jp/articles/c4b523c68a33838eb07852a77a51c7ebfc36493a,11/2(土) 12:20
2024-11-02,15:08,sports,スポーツ,4,中日スポーツ,大谷翔平の妻・真美子さんが優勝パレードで着ていた“ジャケット”に注目集まる…左胸に背番号17、「かっこいい」と称賛の声,https://news.yahoo.co.jp/articles/741f9fa5686bcd319182420263445a391753e250,11/2(土) 11:06
2024-11-02,15:08,sports,スポーツ,5,ABEMA TIMES,「反則負けにしろ」中国人ボクサーに批判殺到！ 足踏み＆再三のバッティングで流血の日本人選手が男気発言 称賛相次ぐ,https://news.yahoo.co.jp/articles/7cb0dd0fcc534add82c34b9fd62d981e0f225ec8,11/2(土) 11:48
2024-11-02,15:08,sports,スポーツ,6,Full-Count,大谷翔平が同僚の娘に“神対応”「尊すぎる」　デコピンをゆらゆら「可愛いが過ぎる」,https://news.yahoo.co.jp/articles/d954655479d60a4ac5ed43c3032c49cd89572d5a,11/2(土) 11:42
2024-11-02,15:08,sports,スポーツ,7,Full-Count,ド軍世界一パレードで少なかった背番号「17」　シーズンとは激変…LAが熱狂した36年ぶり歓喜,https://news.yahoo.co.jp/articles/9c026ffc79317ba635199efd49bf7cf8d41a3b3f,11/2(土) 8:30
2024-11-02,15:08,sports,スポーツ,8,スポニチアネックス,ルヴァン杯決勝　名古屋が前半に先制＆追加点　35歳ベテランFW永井が立て続けに決めた,https://news.yahoo.co.jp/articles/e000b2aca30f91b7659df23f0f7a7487f5ec2878,11/2(土) 13:50
2024-11-02,15:08,sports,スポーツ,9,イーファイト,なんと割れた腹筋ラウンドガールがデビュー！本職はコスプレイヤー,https://news.yahoo.co.jp/articles/318285bc8782c4302ed4a80b3c6f4ae97446d050,11/2(土) 12:16
2024-11-02,15:08,sports,スポーツ,10,日刊スポーツ,日本シリーズ、DeNA－ソフトバンク第６戦は雨天順延　第６戦３日、第７戦４日ハマスタ午後６時,https://news.yahoo.co.jp/articles/48bd4c6289d1a3eaad2e54613eb903cdb1ad7960,11/2(土) 13:08
2024-11-02,15:08,sports,スポーツ,11,高校野球ドットコム,巨人の6年目右腕が戦力外…期待の若手として取り上げられるもブレイク至らず…,https://news.yahoo.co.jp/articles/8da066135fc27f8b0f52e1c7e69d8055a09520be,11/2(土) 14:00
2024-11-02,15:08,sports,スポーツ,12,デイリースポーツ,大谷翔平　優勝パレードに真美子夫人＆デコピンも参加　沿道びっしりのファンに「壮観、圧倒されている」「感謝しています」,https://news.yahoo.co.jp/articles/8d03c300bf2ce3bcbb80db615ded4e0f3c2fedbd,11/2(土) 2:45
2024-11-02,15:08,sports,スポーツ,13,Full-Count,大谷翔平、真美子夫人＆デコピンとの“家族写真”投稿　世界一トロフィーとともに笑顔,https://news.yahoo.co.jp/articles/ae7b461565963153a417321aa1827335a69998ad,11/2(土) 13:46
2024-11-02,15:08,sports,スポーツ,14,スポニチアネックス,京都8Rが取りやめ　降雨の影響「安全な競馬の実施が困難であると判断」9Rから再開,https://news.yahoo.co.jp/articles/211e9d4552a396551e3e03e07b4f08fcea7d1fce,11/2(土) 14:11
2024-11-02,15:08,sports,スポーツ,15,VITUP!,「太い脚→強み」に変えた27歳ビキニ選手　“筋肉があっても女性らしい”体づくりのポイント,https://news.yahoo.co.jp/articles/e7724575d43a425def44f73d50dcb922ca16107f,11/2(土) 14:05
2024-11-02,15:08,sports,スポーツ,16,デイリースポーツ,大谷翔平の妻・真美子さんが見せた配慮　ファンが待ち受ける場所で後方に下がる　デコピンはパパに抱っこされ,https://news.yahoo.co.jp/articles/02f4a4ca3df3b71a66acb11731b4f7fd23cd3af0,11/2(土) 5:43
2024-11-02,15:08,sports,スポーツ,17,CoCoKARAnext,「マジか」優勝セレモニーで出た大谷翔平の“珍しい”英語スピーチ　流暢さに米驚嘆「日本語から英語を学ぶのは大変」,https://news.yahoo.co.jp/articles/cb8d6577ed5ce9abb3ddc92f65446d82cbd1417f,11/2(土) 11:02
2024-11-02,15:08,sports,スポーツ,18,Full-Count,ド軍カーショーが2年連続の手術へ　左足親指と半月板を修復…復帰時期は未定、米報道,https://news.yahoo.co.jp/articles/1df2c9108eef2b5914bd9f74b4b041fffee6509f,11/2(土) 6:19
2024-11-02,15:08,sports,スポーツ,19,CoCoKARAnext,「ソトよりも安くて良い選手」ド軍は通算“150発の男”を獲得するのか？ 「獲得する最も有力なチーム」と米報道,https://news.yahoo.co.jp/articles/e2e94d076241bb9a1ecc3e2742a7e96f34c873ef,11/2(土) 12:03
2024-11-02,15:08,sports,スポーツ,20,高校野球ドットコム,大阪桐蔭“史上最強世代”、生き残った3人は来季が正念場…エースは今季で戦力外,https://news.yahoo.co.jp/articles/b89a9313af754166a4ee06361b125ebc542f522e,11/2(土) 14:00
2024-11-02,15:08,sports,スポーツ,21,日刊ゲンダイDIGITAL,甲斐拓也だけじゃない！補強に目の色変えた阿部巨人が狙うソフトバンク「Cランク」右腕の名前,https://news.yahoo.co.jp/articles/b29835a9e387d823a741eb1d5e1b239cc2eb313b,11/2(土) 9:06
2024-11-02,15:08,sports,スポーツ,22,スポーツ報知,真美子夫人が「見るたび綺麗に」「どんどん洗練」大谷翔平と体ピタッ「めっちゃ似てる」,https://news.yahoo.co.jp/articles/6863c37bb6a7f8f9ad054767c62ee819af343095,11/2(土) 13:59
2024-11-02,15:08,sports,スポーツ,23,日刊ゲンダイDIGITAL,いまや大谷ドジャースこそ「悪の帝国」だ…カネ&人気&裏技フル活用でタンパリング疑惑まで,https://news.yahoo.co.jp/articles/74dd3e0751ca7b6e175058b6dd31f44d0389707f,11/2(土) 9:06
2024-11-02,15:08,sports,スポーツ,24,Full-Count,真美子夫人へそっと…大谷翔平の“紳士的振る舞い”にX注目「本当にお似合いのカップル」,https://news.yahoo.co.jp/articles/07156841b6af5ecf0f542a1b95f6ab036c288846,11/2(土) 9:01
2024-11-02,15:08,sports,スポーツ,25,スポーツ報知,ドジャース監督がハイテンションＭＣ…大谷に「私がダメにしてしまうところだった」やらかし振り返る自虐ジョーク,https://news.yahoo.co.jp/articles/398a0952ef96d0133070c1179136d0888d3aee7f,11/2(土) 9:09
2024-11-02,15:08,sports,スポーツ,26,Full-Count,入団4か月で戦力外…元ドラ1が選んだホテル住まい　漏らした“本音”「そんなに熱もない」,https://news.yahoo.co.jp/articles/977f2a06e1e60f2d1235d820f0a686ba6cbd4d8a,11/2(土) 7:10
2024-11-02,15:08,sports,スポーツ,27,日刊スポーツ,悲願達成の大谷翔平、真美子夫人＆愛犬とのレアな家族写真を公開　デコピンはトロフィーに夢中？,https://news.yahoo.co.jp/articles/277bc6ca587c64b0f0f3a47c394f97eb880c08c2,11/2(土) 14:23
2024-11-02,15:08,sports,スポーツ,28,日刊スポーツ,「お茶吹いた」大谷翔平の和やか家族写真にまさかの“ひょっこりはん”…やっぱりこの男かい,https://news.yahoo.co.jp/articles/87923220960de3b151d154b4b65a3b92351d1979,11/2(土) 14:27
2024-11-02,15:08,sports,スポーツ,29,デイリースポーツ,日本Ｓ第６戦は悪天候で中止、３日に順延　ＤｅＮＡが下克上日本一王手でハマスタ帰還も“水入り”　３勝３敗なら４日に第７戦,https://news.yahoo.co.jp/articles/9c857142b62632bf3883b5ebced9c4fb3a3269c6,11/2(土) 13:03
2024-11-02,15:08,sports,スポーツ,30,RONSPO,「あなたは脱がないの？」の質問をパレード中に受けた大谷翔平が「絶対にない」…米メディアはアクセントもバッチリの流暢な英語スピーチを「珍しい」と絶賛,https://news.yahoo.co.jp/articles/e7e6f391fdb67a4cd46d5fb0dc2ee76dc69a4bcb,11/2(土) 7:55
2024-11-02,15:08,sports,スポーツ,31,中日スポーツ,大谷翔平の『英語スピーチ』に反応続々…推しアナリストがXで報告「公の場で英語を話す」ファンは「すごく尊敬します」,https://news.yahoo.co.jp/articles/24ab008c9c7929174875acb7263dfb76572e061f,11/2(土) 10:54
2024-11-02,15:08,sports,スポーツ,32,デイリースポーツ,大谷翔平が真美子夫人、デコピンとの３ショットで感謝「Ｔｈａｎｋ　ｙｏｕ　ＬＡ」ファンほっこり「奥様とデコピンにもＭＶＰを」「夫婦は顔が似るっていうけど」,https://news.yahoo.co.jp/articles/fb5322577fc1b7b82f0db6fe2567b2a1b1d04202,11/2(土) 14:02
2024-11-02,15:08,sports,スポーツ,33,スポニチアネックス,日本シリーズ第6戦　雨天中止で3日に順延　屋外球場での中止は21年ぶり　第7戦は4日午後6時開始,https://news.yahoo.co.jp/articles/71b93c5177af68ea76508a70458b178b274b3fcb,11/2(土) 13:07
2024-11-02,15:08,sports,スポーツ,34,Full-Count,真美子夫人の“気配り”にX注目「優しさを感じる」　大谷翔平の隣で「そっと持ってる」,https://news.yahoo.co.jp/articles/3b5efa91b006182ffe93ca894ac2401e8c3c7635,11/2(土) 14:31
2024-11-02,15:08,sports,スポーツ,35,日刊スポーツ,ドジャース名物リポーターもパレード満喫！「また来年！」にファン沈痛…「ワトソンロスだ」,https://news.yahoo.co.jp/articles/2e7695749808730107abf6b38529efdfdcf491ab,11/2(土) 8:20
2024-11-02,15:08,sports,スポーツ,36,日刊スポーツ,エンゼルスが２日連続でトレード、来季巻き返しにフィリーズから元トッププロスペクトを獲得,https://news.yahoo.co.jp/articles/ec7386701b6039ff9e4b9a061099c84e4f9321b4,11/2(土) 11:15
2024-11-02,15:08,sports,スポーツ,37,高校サッカードットコム,【高校サッカー選手権】夏の全国王者・昌平が聖望学園を相手に2点のビハインドで前半終了,https://news.yahoo.co.jp/articles/f9f2af6759c5e0477e48bde2ba41e7d2712dec5a,11/2(土) 11:56
2024-11-02,15:08,sports,スポーツ,38,DAZN News,VCARB幹部「ユウキのクルマに何が起こっているのか…」角田裕毅のSQ1敗退にチーム首脳陣も驚き…決勝までの改善を模索｜F1,https://news.yahoo.co.jp/articles/aba854d650bb0609e9887af88c247eb626cc9fbe,11/2(土) 12:21
2024-11-02,15:08,sports,スポーツ,39,高校野球ドットコム,慶大4年生たちの進路は超豪華！名だたる一流企業、官僚になる選手も！独立オファーの清原正吾は未定,https://news.yahoo.co.jp/articles/ac8d74985d7365000bf346361b0d78bd56ebf6dd,11/2(土) 12:19
2024-11-02,15:08,sports,スポーツ,40,バトル・ニュース,『給料未払い』と『社長の音信不通』の涙の訴えから2週間、給料は支払われず23歳の女子プロレス王者が退団へ,https://news.yahoo.co.jp/articles/abaf8a90ccfd165ae7a646595aca0d52c3a1d6d8,11/2(土) 7:01
