scrp_date,scrp_time,genre_en,genre_jp,rank,media_jp,title,link,date_original
2024-10-13,09:29,local,地域,1,中京テレビＮＥＷＳ,「全日本大学女子駅伝」で7年間負けなしの名城大学女子駅伝部　前人未踏の8連覇をかけた戦いに挑む！　次々と降りかかる試練に立ち向かい、再び栄光を手に…,https://news.yahoo.co.jp/articles/a6368df3b1d69e29c2e8724ebd207c46a85ff0f7,10/13(日) 7:00
2024-10-13,09:29,local,地域,2,RKB毎日放送,後部座席に息子を乗せたまま飲酒運転か　パート従業員の女を逮捕も親子で食い違う供述,https://news.yahoo.co.jp/articles/084bc97a24f328d6213a81d9c848ccc9a5827792,10/13(日) 8:14
2024-10-13,09:29,local,地域,3,埼玉新聞,【速報】埼玉で最大震度3　久喜市、春日部市で　さいたま市など震度2　震源は茨城県南部　マグニチュード4・3,https://news.yahoo.co.jp/articles/f0bb24130dfe582df3759349e7427e042f90db20,10/13(日) 6:03
2024-10-13,09:29,local,地域,4,山陰中央新報,出雲駅伝、１４日号砲　駒大・伊藤の力走に注目　優勝争いは青学大、城西大が軸か,https://news.yahoo.co.jp/articles/dd0a2a24168deb88163b357d944daf1b2f68dc63,10/13(日) 7:00
2024-10-13,09:29,local,地域,5,福島民友新聞,菅家一郎氏が立候補取りやめ　衆院選福島3区、後任は上杉氏が有力,https://news.yahoo.co.jp/articles/3610f5d938304a48317ecc0bed9a93b444a078be,10/13(日) 7:53
2024-10-13,09:29,local,地域,6,RKB毎日放送,「妻には言わないでほしい」　口論の引き金は”支払われなかった740万円の手付金”　小学校教員の妻（当時35）を殺害した罪に問われた夫（42）　事件直前にマンション購入めぐるトラブル,https://news.yahoo.co.jp/articles/56f0d17bce4e67bbad04540db6d1809066af349b,10/10(木) 10:41
2024-10-13,09:29,local,地域,7,千葉日報オンライン,【速報】千葉県内で地震　野田で最大震度3　震源は茨城県南部、M4・3,https://news.yahoo.co.jp/articles/6edcf72d7952f21c95a9f0a3323bf58471090c1e,10/13(日) 4:08
2024-10-13,09:29,local,地域,8,MBSニュース,多額の生活保護支給漏れか…重度障害の子2人抱えたシングルマザーに計600万円超　女性側は『行政は間違え得だ』と不服審査請求へ,https://news.yahoo.co.jp/articles/545d5aa620fb73feba1847cc3c2f5e46ccebaaab,10/10(木) 13:00
2024-10-13,09:29,local,地域,9,神戸新聞NEXT,駅構内トイレで不同意わいせつ致傷　23歳女性が被害　尼崎,https://news.yahoo.co.jp/articles/3e059c569e39cae859b0bef5cd7bf35139474d69,10/13(日) 9:03
2024-10-13,09:29,local,地域,10,MBSニュース,「まさか私の家の真上を通るとは」道路計画で自宅が立ち退き対象に！？怒る住民「将来の子どもに負の遺産を残すわけには...」なぜ住宅街を横断？市の事情を聞いた,https://news.yahoo.co.jp/articles/4fd41c4aa0bec29d9ee822732d0f26569cda163a,10/11(金) 15:58
2024-10-13,09:29,local,地域,11,TUFテレビユー福島,ドライブ中の85歳男に衝突され…積み荷作業中の男性死亡　過失運転傷害容疑で男逮捕　福島・須賀川市,https://news.yahoo.co.jp/articles/b2d355cf607cb9c1d723e1fb7608aad392259606,10/13(日) 8:09
2024-10-13,09:29,local,地域,12,HBCニュース北海道,「客が人を殺すと言っている」タクシー運転手が交番に駆け込む…折り畳みナイフ所持の24歳の女「弁解は特にない」,https://news.yahoo.co.jp/articles/1bf1e7b71da62090ca4c40df80746f9fc335f1c5,10/13(日) 8:48
2024-10-13,09:29,local,地域,13,神戸新聞NEXT,三宮の歩道でスケボー「危ないやろ」注意され立腹、相手の胸ぐらつかむ　49歳男を暴行容疑で逮捕　神戸,https://news.yahoo.co.jp/articles/6f2e5a7ff8ff8e5276d786bb070df43b395b3a1d,10/12(土) 19:18
2024-10-13,09:29,local,地域,14,静岡朝日テレビ,閉山中の富士山の山小屋に何者かが進入しようとした形跡が…　登山客が暖を取ろうとしたか？,https://news.yahoo.co.jp/articles/c98470538f9fdedd48ca51459c8a4509b7e838ae,10/12(土) 15:27
2024-10-13,09:29,local,地域,15,tbc東北放送,31歳の自称・大学院生の男　酒に酔い飲食店従業員の男性の顔を殴り逮捕　仙台,https://news.yahoo.co.jp/articles/fd73840b8462adac4ad1c5694a36f2aa7b1b944f,10/13(日) 7:28
2024-10-13,09:29,local,地域,16,佐賀新聞,愛子さま、ご視察「また佐賀にうかがえる機会あれば」　赤十字訪問や和紙作り体験　ご来県2日目,https://news.yahoo.co.jp/articles/1643058a4da0013f79d7285518401ec250e39855,10/13(日) 7:43
2024-10-13,09:29,local,地域,17,ABCニュース,成人男性１人が意識不明の状態で病院搬送　神戸・灘区の集合住宅で火事,https://news.yahoo.co.jp/articles/5549d00b6ccd1fec2008fba605a074a2055079c8,10/13(日) 5:32
2024-10-13,09:29,local,地域,18,京都新聞,京都・大文字山からオレンジに輝くほうき星を撮影　夜景の京都上空に「紫金山・アトラス彗星」,https://news.yahoo.co.jp/articles/6214df710e5464775c542317e9f7410587097c0a,10/12(土) 20:32
2024-10-13,09:29,local,地域,19,ＡＴＶ青森テレビ,アントニオ猪木さんも愛した秘湯「ながまっていました！！」源泉“湧き流し”の湯【青森の温泉・銭湯へドライ風呂】,https://news.yahoo.co.jp/articles/0c7fe9cb5d469fbf803728462f1c7c3daecf394e,10/13(日) 6:34
2024-10-13,09:29,local,地域,20,千葉日報オンライン,197人メアド見える状態で送信、千葉県教委事務所,https://news.yahoo.co.jp/articles/0fe98abc7893518d178646e786374978db39a814,10/13(日) 7:30
2024-10-13,09:29,local,地域,21,ＳＢＣ信越放送,下山予定も行動不能　北アルプス常念岳で29歳の男性が救助要請　2人パーティーで登山,https://news.yahoo.co.jp/articles/1ec61f142fa36a33261dc68f00a5f25038a07d34,10/13(日) 0:57
2024-10-13,09:29,local,地域,22,中国新聞デジタル,太もも故障の日本中学記録保持者　広島・神辺西中3年三好　涙と感謝の8位　佐賀国スポ・陸上100メートル少年女子,https://news.yahoo.co.jp/articles/3e78728aefd350f379de12bf7cf6b28524c8fc13,10/12(土) 16:55
2024-10-13,09:29,local,地域,23,テレビ北海道,手稲区まで地下鉄が!?　第２青函トンネル？,https://news.yahoo.co.jp/articles/9d5218fc87559bee4e2c08af600132982ea2c164,10/12(土) 12:02
2024-10-13,09:29,local,地域,24,静岡放送（SBS）,ラブレターズが『キングオブコント2024』初優勝 浜松出身塚本直毅さんが“ジュビロ磐田サポ”を演じ最終決戦で逆転【速報】,https://news.yahoo.co.jp/articles/4f3bd77e7759a6dbf56c1bf46559e3e2f0654bea,10/12(土) 22:26
2024-10-13,09:29,local,地域,25,北國新聞社,散居村の空に気球舞う　スカイフェスとなみ開幕,https://news.yahoo.co.jp/articles/28a6061620daa5a0004c24b477dbb91c80e881c1,10/13(日) 7:02
2024-10-13,09:29,local,地域,26,HBCニュース北海道,23万円超“海外ブランド”ダウンコートを盗み、別の店へ「過去の万引き犯がいました」店員が気づき通報　52歳の女「悪いこととはわかっているが、万引きをしました」,https://news.yahoo.co.jp/articles/0f80b58b39785ede767390a059f1a697da3e8704,10/13(日) 8:32
2024-10-13,09:29,local,地域,27,茨城新聞クロスアイ,《連載:衆院選2024　茨城選挙区情勢》　4区　自民前職に維・共挑む,https://news.yahoo.co.jp/articles/147a8918c8fffb3c3e6c3f18e4cbff60e8ea7e4c,10/13(日) 8:00
2024-10-13,09:29,local,地域,28,琉球新報,れいわ、久保田氏の擁立を取りやめ　衆院選沖縄1区　山本代表が発表,https://news.yahoo.co.jp/articles/1b9948567cea8a7f88acdba261326ca591a385fe,10/12(土) 14:31
2024-10-13,09:29,local,地域,29,カナロコ by 神奈川新聞,横浜・鶴見「開かずの踏切」で相次ぐ死亡事故　踏切廃止へ進まない合意形成,https://news.yahoo.co.jp/articles/4568ca36f8e17f8edce3f6b5cf0e689630a62a79,10/13(日) 5:00
2024-10-13,09:29,local,地域,30,MRT宮崎放送,作業中の男性3人が崩れてきた玄米が入った容器の下敷きに　1人死亡,https://news.yahoo.co.jp/articles/479b9aab9fce115560164faa53adae3426db6392,10/12(土) 16:24
2024-10-13,09:29,local,地域,31,信濃毎日新聞デジタル,北アルプス常念岳、茨城県の29歳男性が行動不能に　夜になってからの救助要請、13日早朝から捜索へ,https://news.yahoo.co.jp/articles/b4e9c498ed6455507199ba35b169b0fbb454bced,10/13(日) 6:27
2024-10-13,09:29,local,地域,32,RBC琉球放送,交際女性の死体遺棄事件 「仲が良く、結婚すると聞いていた…」 容疑者の男（61）を送検,https://news.yahoo.co.jp/articles/8ee34bd362e87f639022a3fe5d0a42042a04bbd1,10/1(火) 11:48
2024-10-13,09:29,local,地域,33,石川テレビ,「泣いてばかりいたら翼音が心配する」能登襲豪雨災害から3週間　喜三翼音さんの告別式,https://news.yahoo.co.jp/articles/6ac5bfd1c436c459a50e92b9756ce9af1a72e058,10/12(土) 12:15
2024-10-13,09:29,local,地域,34,MRO北陸放送,福井沖の女性遺体は、不明の中学3年生・喜三翼音さんと判明,https://news.yahoo.co.jp/articles/20bd6ab8e1287303dbccad6068db9e2b87906404,10/3(木) 19:09
2024-10-13,09:29,local,地域,35,読売テレビ,【混迷の兵庫県知事選】過去最多の7人が“乱立” 最大会派・自民は候補者“一本化できず”右往左往　県議「斎藤前知事は知名度抜群」さらに擁護の声まで…,https://news.yahoo.co.jp/articles/b07d50ba966fa91b2895f0408129b43d01d66a8e,10/12(土) 10:00
2024-10-13,09:29,local,地域,36,静岡新聞DIGITAL,「バイクのふるさと」発信　浜松オートレース場で新型展示、曲芸走行も,https://news.yahoo.co.jp/articles/25c29c8c5c741da57cb2741feb267985fbbb2edf,10/13(日) 8:07
2024-10-13,09:29,local,地域,37,FBC 福井放送,城好き集まれ「出張！お城EXPO」　現存する全国の天守閣模型など展示　丸岡藩の歴史紹介するパネルも　13日まで、坂井市・丸岡体育館,https://news.yahoo.co.jp/articles/38b6cad5fde21f0bda7a317ff67870be19f083db,10/12(土) 12:04
2024-10-13,09:29,local,地域,38,北海道ニュースUHB,「鍵がかかってなかったので中に入りました」共同住宅の空き部屋に侵入…男(46)を現行犯逮捕 ”宿泊費節約”のためか 札幌市中央区,https://news.yahoo.co.jp/articles/eb63191184871df957620950ceb06dadbddaeae9,10/13(日) 8:26
2024-10-13,09:29,local,地域,39,HBCニュース北海道,感動ありがとう！北口榛花選手が地元旭川市で凱旋パレード　母校・旭川東高校の後輩が先導「背中を追いかけるはずの先輩に、背中を追いかけてもらうなんて一生ない」,https://news.yahoo.co.jp/articles/f5c119fb66d4a9f5dfa3315c6a358df85115e7c0,10/13(日) 7:08
2024-10-13,09:29,local,地域,40,神戸新聞NEXT,「たかはしけいこ」名乗りSNSで投資話　男性会社員が443万円だまし取られる　神戸,https://news.yahoo.co.jp/articles/7f4e67eae091de7c730bf9c72e220d86095ebc37,10/13(日) 8:45
