scrp_date,scrp_time,genre_en,genre_jp,rank,media_jp,title,link,date_original
2025-03-15,20:05,sports,スポーツ,1,スポニチアネックス,大谷翔平　第2打席であいさつ代わりの120ｍ弾　734日ぶり凱旋弾に東京D大興奮　侍J同僚の戸郷から,https://news.yahoo.co.jp/articles/317dfb42da3583c3b49a17ab10bd78287c449de2,3/15(土) 19:40
2025-03-15,20:05,sports,スポーツ,2,Full-Count,阪神がカブスに完封勝利　20歳門別が5回パーフェクト、藤川監督は古巣から白星…鈴木誠也は1安打,https://news.yahoo.co.jp/articles/032de81f140fca2899550ee935a8a53b17d83e9b,3/15(土) 14:23
2025-03-15,20:05,sports,スポーツ,3,バトル・ニュース,日本一可愛い体育大卒グラドルがリングに立ち続けるその理由とは…「はじめてプロレス見た時に本気で闘い合ってるその姿に私は感動したんです」,https://news.yahoo.co.jp/articles/41cd871c140986cc4545aad7b4a5b0b9113f400b,3/15(土) 8:03
2025-03-15,20:05,sports,スポーツ,4,東スポWEB,【Ｆ１】角田裕毅が予選で躍進　レッドブル昇格のローソン大失態で「過剰評価の期待外れ」,https://news.yahoo.co.jp/articles/dac0f41d0cec9e7b88bf8dcd3cbef9d6492b81ed,3/15(土) 15:16
2025-03-15,20:05,sports,スポーツ,5,スポニチアネックス,【カーリング】日本は黒星発進　地元・韓国と延長死闘　スキップ吉村「私のショットが決め切れなくて」,https://news.yahoo.co.jp/articles/08b059b8e5a3b0dedca7121946fde3ccbce3e676,3/15(土) 17:02
2025-03-15,20:05,sports,スポーツ,6,サンケイスポーツ,大谷翔平の第1打席は四球　2度のフルスイングによるファウルで球場どよめき,https://news.yahoo.co.jp/articles/83e7640b1aa73ae5a9901bcba994cb1899294395,3/15(土) 19:19
2025-03-15,20:05,sports,スポーツ,7,スポーツ報知,１敗は大の里ら３人に　追う２敗は豊昇龍ら６人　カド番の琴桜は白星先行,https://news.yahoo.co.jp/articles/798b1f851179e590e9537503eef78bb94ae05b3d,3/15(土) 18:28
2025-03-15,20:05,sports,スポーツ,8,中日スポーツ,名古屋グランパス・山口GM「監督交代は今のところ考えていない」開幕6戦未勝利「悠長なことは言ってられないが、今ではない」,https://news.yahoo.co.jp/articles/412a12e2b5649a2dff4b496c179980d0b2f0d04e,3/15(土) 17:14
2025-03-15,20:05,sports,スポーツ,9,デイリースポーツ,日本ハム・新庄監督　吉田賢吾の起用方針に言及「サードはもうないかな」「でも打撃はものすごくいいものを持っている」,https://news.yahoo.co.jp/articles/cdf8844548b70d14bbbfeffdd3a279845c1e4b80,3/15(土) 17:44
2025-03-15,20:05,sports,スポーツ,10,Full-Count,来日中にまさかの通告…ド軍27歳捕手がマイナーキャンプへ、東京ロースター入りも悲劇,https://news.yahoo.co.jp/articles/5e62aafcdd565da4ed90336158ff215b4951e1ba,3/15(土) 15:46
2025-03-15,20:05,sports,スポーツ,11,TBS NEWS DIG Powered by JNN,琉球ゴールデンキングス、悲願の天皇杯初制覇！2年連続準優勝もA東京下し100回目の記念大会制す【男子バスケ】,https://news.yahoo.co.jp/articles/dfe08df8e319eb2cec3a0af4aa43bc112a0be2e5,3/15(土) 17:02
2025-03-15,20:05,sports,スポーツ,12,Full-Count,NPB球は「クレイジー」　米ファン疑問、データと“乖離”した一打「マジで飛ばない」,https://news.yahoo.co.jp/articles/d7bf9827a6a058ff8c891a7f76d127d91a575325,3/15(土) 15:28
2025-03-15,20:05,sports,スポーツ,13,東スポWEB,「体重すごく減っている」ムーキー・ベッツの容態を公表　日本開幕戦出場は不透明,https://news.yahoo.co.jp/articles/d4f3875ffef5d8f62ad328b877ea11bd550de523,3/15(土) 18:02
2025-03-15,20:05,sports,スポーツ,14,デイリースポーツ,巨人・戸郷が呆然　まさかの１イニング３被弾　三回にコンフォルト、大谷、テオスカーに食らう　球場が異様な雰囲気に,https://news.yahoo.co.jp/articles/5edb9dd08539b07c922ab7d503cf7e0674797b44,3/15(土) 19:46
2025-03-15,20:05,sports,スポーツ,15,Full-Count,大谷翔平出場の巨人戦前に“世界的美女”降臨　グラウンド登場に騒然「めちゃくちゃ可愛い」,https://news.yahoo.co.jp/articles/afbe3641b4a6e51fb6e99e252c85caa1e27a055b,3/15(土) 18:51
2025-03-15,20:05,sports,スポーツ,16,TopNews,角田裕毅、プレッシャーを跳ね除けた！「アイスラテ」効果で予選5番手！F1公式も驚愕、フェラーリ撃破でF1界が騒然！,https://news.yahoo.co.jp/articles/8ef6788b0af89a7d69cc1299636bc00acbef807c,3/15(土) 18:04
2025-03-15,20:05,sports,スポーツ,17,motorsport.com 日本版,「最後は魔法みたいなラップだった！」角田裕毅、渾身アタックでの開幕戦予選5番手に本人も驚き。雨予報の決勝にも準備万端？,https://news.yahoo.co.jp/articles/a9ddb5b48bf7f220f841e32081fb23212a26eca0,3/15(土) 17:21
2025-03-15,20:05,sports,スポーツ,18,motorsport.com 日本版,Q1敗退のリアム・ローソン「FP3で走れなかったのが響いた。予選のスタートは厳しいと思っていたけど……」,https://news.yahoo.co.jp/articles/d24c9da307ca82577411185c72cd095e54f26cd9,3/15(土) 17:08
2025-03-15,20:05,sports,スポーツ,19,日刊スポーツ,ドジャース選手の妻たちが東京のランチ堪能　極厚トンカツのカツ丼や築地市場でウナギ串をガブリ,https://news.yahoo.co.jp/articles/f2794d254e0b27c1d3a7dd8bece9ada176a86f19,3/15(土) 12:46
2025-03-15,20:05,sports,スポーツ,20,Full-Count,ベッツ、巨人＆阪神戦は欠場「体重もだいぶ減った」　ロバーツ監督説明…開幕戦は慎重に判断,https://news.yahoo.co.jp/articles/f9574c88022cff1a4ae565d472c8f9c15a8e8393,3/15(土) 17:01
2025-03-15,20:05,sports,スポーツ,21,中日スポーツ,角田裕毅の予選5番手にネット沸騰「ほんますごい男やで」「最高のスタート」「決勝も期待してしまう」【F1】,https://news.yahoo.co.jp/articles/0a2346f782a824774900f01499289b180c7ccb34,3/15(土) 18:30
2025-03-15,20:05,sports,スポーツ,22,TBS NEWS DIG Powered by JNN,大谷翔平、巨人戦で戸郷翔征から豪快2ラン！“メジャー本塁打王”の一振りにドーム騒然、3回にド軍3発で一挙5点,https://news.yahoo.co.jp/articles/d86cea394d828de8afe8ec4b1e25412ce43568f4,3/15(土) 19:39
2025-03-15,20:05,sports,スポーツ,23,Full-Count,大谷翔平、衝撃の特大弾　第2打席で戸郷を粉砕、東京ドーム大歓声…テオから“ひまわりシャワー”,https://news.yahoo.co.jp/articles/af29b79c1ec5ea261e0951c198d39317f16c4ad2,3/15(土) 19:39
2025-03-15,20:05,sports,スポーツ,24,デイリースポーツ,ドジャース　フリーマンの長男・チャーリー君の人気ぶりに美貌の妻も驚き？「可愛い会いたかった！」日本での様子を伝える,https://news.yahoo.co.jp/articles/c8b3083ca8cf0bd2bcc74ba5464a2e1c64bd83ff,3/15(土) 16:33
2025-03-15,20:05,sports,スポーツ,25,スポニチアネックス,田口壮氏　昨季対戦して「この子、来るなぁ！」と確信した才能あふれる投手　「球が強い」と絶賛,https://news.yahoo.co.jp/articles/02518f84ff3dea3e8badbb0e3be14a571200bdf3,3/15(土) 19:02
2025-03-15,20:05,sports,スポーツ,26,スポーツ報知,大谷翔平が日本がい旋初戦の巨人戦で衝撃の本塁打　戸郷から右翼へ１１９メートル弾…日本７３４日ぶり弾,https://news.yahoo.co.jp/articles/a4bc365052838423ff45270addec76cc60cdf66a,3/15(土) 19:39
2025-03-15,20:05,sports,スポーツ,27,スポニチアネックス,日本ハムが粋な演出！　ソフトバンク和田毅氏の引退試合で清宮幸太郎が1打席限定勝負「光栄です」,https://news.yahoo.co.jp/articles/9f83660727cb8abad1d44855792dc89b91f5c408,3/15(土) 14:39
2025-03-15,20:05,sports,スポーツ,28,オートスポーツweb,【F1第1戦予選の要点】残酷なほどに明暗が別れたルーキー6人。ハジャーが見せた意外な輝き,https://news.yahoo.co.jp/articles/ae82658644d7faee129c0eb5d3c0dcb9222ea803,3/15(土) 17:19
2025-03-15,20:05,sports,スポーツ,29,ENCOUNT,BreakingDownの“喧嘩自慢”が王者に1000万円ドリームマッチ提案　ネットは仰天「なんでそんな金あるの？」,https://news.yahoo.co.jp/articles/b2adf52268bd770f09c504bb2c6a854715b3f79e,3/15(土) 14:02
2025-03-15,20:05,sports,スポーツ,30,デイリースポーツ,「マジで誰かと思った」２５歳になったメドベージェワが衝撃変貌「どこのハリウッド女優かと」「髪の女神」,https://news.yahoo.co.jp/articles/04cd90f6ab99d63f778794679625241a64297a2c,3/15(土) 9:52
2025-03-15,20:05,sports,スポーツ,31,デイリースポーツ,ドジャース選手築地で「ワオ！」　コンビニで大谷のポスターに（笑）「彼を知ってるよ」鮭おにぎりにハマった投手も,https://news.yahoo.co.jp/articles/329df47bcd1bbe08c569df71f0be3245d050bdc2,3/15(土) 16:43
2025-03-15,20:05,sports,スポーツ,32,スポーツ報知,エース区間の３区にトヨタの太田智樹、ＧＭＯの吉田祐也ら　エキスポ駅伝区間オーダー発表,https://news.yahoo.co.jp/articles/c03605b104f53ecca8321ffacd6709038de3efe9,3/15(土) 17:06
2025-03-15,20:05,sports,スポーツ,33,日刊スポーツ,大谷翔平が少年にボールをプレゼント　スタンドのファンが一気に撮影開始,https://news.yahoo.co.jp/articles/17e960478e9f1c0d92f03055d7ba75901a2f747e,3/15(土) 17:58
2025-03-15,20:05,sports,スポーツ,34,Full-Count,阪神応援団に米衝撃　圧倒的な“熱量”…実況ポツリ「MLBの試合でも鳴り物応援」,https://news.yahoo.co.jp/articles/c18e7ec1adff7b33d0ab3ac28c448406c55e07c0,3/15(土) 16:37
2025-03-15,20:05,sports,スポーツ,35,ゴルフ総合サイト ALBA Net,＜速報＞山下美夢有が首位と3差で後半へ　高木優奈は6差追走【韓国女子】,https://news.yahoo.co.jp/articles/1e1d8009f26c519099713f8fb237b37db85d41fb,3/15(土) 15:41
2025-03-15,20:05,sports,スポーツ,36,中日スポーツ,角田裕毅が予選5番手「チームの頑張りによるクルマの進化に驚いた」フェラーリ2台を上回る【F1】,https://news.yahoo.co.jp/articles/e39422d525154d01435e972b932d8a5c8973a083,3/15(土) 18:20
2025-03-15,20:05,sports,スポーツ,37,デイリースポーツ,阪神　試合終了後のグラウンドで感動的な光景　カブス選手と交流　ターナーに声をかけられた佐藤輝「純粋にスーパープレーヤーと野球ができて楽しかった」,https://news.yahoo.co.jp/articles/73e1b2c4c59c763c02cf69d71a5ad38f33d465b1,3/15(土) 14:35
2025-03-15,20:05,sports,スポーツ,38,CoCoKARAnext,安定の156キロ！阪神育成→支配下→メジャー打線に0封　23歳右腕に東京ドームどよめき止まらず「マジ、ばけものやな」「シーズンが楽しみすぎる」,https://news.yahoo.co.jp/articles/c24aaa141146b06a7e85e7a99bc425fb09e20856,3/15(土) 15:27
2025-03-15,20:05,sports,スポーツ,39,日刊スポーツ,カブス・ターナーNPB球に苦戦？「硬くて飛ばない。相手はMLB球だから打ちやすかったかも」,https://news.yahoo.co.jp/articles/ed1d4f8fe027c53576cb56849b015106575241ef,3/15(土) 19:20
2025-03-15,20:05,sports,スポーツ,40,CBCテレビ,中日OB・吉見一起さんが明かす！「髙橋投手とマラー投手しかいない…!?」開幕ローテーションが難題に！その解決策とは？,https://news.yahoo.co.jp/articles/45b02ac874150c666f50428a733f0f9f387399ee,3/15(土) 18:10
