scrp_date,scrp_time,genre_en,genre_jp,rank,media_jp,title,link,date_original
2025-10-29,15:11,TTL,総合,1,スポニチアネックス,オリックス　宇田川優希ら4選手に戦力外通告　いずれも育成契約を打診　大里は右肩手術も発表,https://news.yahoo.co.jp/articles/7e9b81026cc10875325c4a5db88a551e0d1083de,10/29(水) 13:00
2025-10-29,15:11,TTL,総合,2,スポーツ報知,【オリックス】宇田川優希、小木田敦也、東山玲士、大里昂生に戦力外通告…いずれも育成契約が打診されるもよう,https://news.yahoo.co.jp/articles/4e831805cecb794698dde032ca1c5da68a7f6d75,10/29(水) 13:00
2025-10-29,15:11,TTL,総合,3,Full-Count,楽天、宮森＆山田ら大量11人を戦力外に　現ドラ加入の柴田も1年で通告…徳山には育成打診,https://news.yahoo.co.jp/articles/a09be06dffaebe48b7e24cc6e8d43967461cd28e,10/29(水) 12:32
2025-10-29,15:11,TTL,総合,4,CoCoKARAnext,「頼むから、もう彼を試合に出すな」点差を広げられたド軍37歳右腕に米記者も憤慨「まだ勝負の行方が分からない状況で何故？」,https://news.yahoo.co.jp/articles/ea7358169428e9607d34cda2597ac7377ef0a22e,10/29(水) 11:55
2025-10-29,15:11,TTL,総合,5,スポニチアネックス,テレ朝官邸キャップ　高市首相の振る舞いに「こんな総理大臣は見たことない」も「トランプさんも…」,https://news.yahoo.co.jp/articles/35b48a4a4fd0aadb228e231bc57bb60ffcc74b68,10/29(水) 12:12
2025-10-29,15:11,TTL,総合,6,日刊スポーツ,元TBSの立民議員、小野田紀美大臣の週刊誌「迷惑行為」投稿に違和感「言い過ぎではないか」,https://news.yahoo.co.jp/articles/d4078f5e6e36dd76898b212bdc68d54a919ae5c8,10/29(水) 13:21
2025-10-29,15:11,TTL,総合,7,日刊スポーツ,「あんな総理大臣は見たことない」テレ朝官邸キャップ、高市早苗首相のはじけっぷりに驚き,https://news.yahoo.co.jp/articles/2200e51c5530216ed1169699b44e62e938af0045,10/29(水) 11:10
2025-10-29,15:11,TTL,総合,8,日刊スポーツ,共産党志位議長、高市氏を強烈批判「米空母で飛び跳ねてはしゃぐ。正視に堪えない卑屈な媚態」,https://news.yahoo.co.jp/articles/88571456085a541f3866416fa70deef560b050f7,10/29(水) 14:31
2025-10-29,15:11,TTL,総合,9,デイリースポーツ,ドジャース、逆転負けで王手ならず　大谷翔平はWS初登板で7回途中4失点初黒星　7戦ぶり無安打　ロバーツ監督の継投策裏目　最終決戦は敵地トロント,https://news.yahoo.co.jp/articles/d50db352f5f936dcb899324d3c3ac773b943737e,10/29(水) 12:05
2025-10-29,15:11,TTL,総合,10,共同通信,トランプ大統領、高市首相を評価　日本訪問「素晴らしかった」,https://news.yahoo.co.jp/articles/498cf9abaac7a9ff454ac3b4931066ed9153fdf5,10/29(水) 12:19
2025-10-29,15:11,TTL,総合,11,日刊スポーツ,立憲議員、高市早苗首相の振る舞いめぐる「日本の恥」批判に私見「『ヤン◯ー』だからよく映える」,https://news.yahoo.co.jp/articles/30ef598cecdbc4fe1411abfcda15ac5c259a1160,10/29(水) 13:28
2025-10-29,15:11,TTL,総合,12,日刊スポーツ,「大谷のユニホームやん」インスタフォロワー2512万米女優がWS観戦を報告,https://news.yahoo.co.jp/articles/270b320aad90cb311f2bc36dcc85bf6dc52d13ff,10/29(水) 12:58
2025-10-29,15:11,TTL,総合,13,CoCoKARAnext,「またトライネンか！」大谷翔平7回途中降板後にファンから嘆きの声続々…「なぜこんなに信頼が厚いのかだけ理解できない」,https://news.yahoo.co.jp/articles/8ba73ecae40c37d58f7b7411fbc60f8afdd44510,10/29(水) 11:56
2025-10-29,15:11,TTL,総合,14,ねとらぼ,コスプレイヤーが、ディズニーで写真を撮ったら……「今気付いたwww」　後ろに写り込んだ“キャストの姿”が1790万表示「わろたwww」,https://news.yahoo.co.jp/articles/55c4499fbbc8972ee1f951f5b855265f05f8125c,10/29(水) 11:30
2025-10-29,15:11,TTL,総合,15,東スポWEB,ドジャース大谷翔平の真美子夫人が「１７」の白トップス姿で写真撮影　米誌「ひと際目立っていた」,https://news.yahoo.co.jp/articles/8682a795bc5c0d915157461e290de9aaad143b4b,10/29(水) 11:40
2025-10-29,15:11,TTL,総合,16,日刊スポーツ,れいわ議員、高市早苗首相の「対米従属」外交に「怒りを通り越して心底情けない」,https://news.yahoo.co.jp/articles/a4daaafeb4b80cd92d3125d6f769818e9473a5bb,10/29(水) 13:00
2025-10-29,15:11,TTL,総合,17,西スポWEB OTTO！,人気芸人と離婚、8歳下男性と交際3カ月〝電撃子連れ再婚〟今冬出産予定…33歳元タレント〝くつろぎ〟ショットに「お幸せに」「素敵な笑顔」の声,https://news.yahoo.co.jp/articles/ee39be0a661302d1a7f31c19b9a41932b72f8da1,10/29(水) 5:00
2025-10-29,15:11,TTL,総合,18,ねとらぼ,エレベーターに“芸妓15人”が一斉に乗ったら…… “衝撃の光景”が350万表示「見たことない光景すぎるw」「美術館レベル」,https://news.yahoo.co.jp/articles/4c4779203a65aa48aeebac43ea7ede1b5441807d,10/29(水) 12:34
2025-10-29,15:11,TTL,総合,19,スポーツ報知,再婚した６２歳女性タレント　１３歳年下と密着「新婚さんいらっしゃいに出たいバカップル」ラブラブの野沢直子,https://news.yahoo.co.jp/articles/4e5ad55d623054d16cf5ba0ca09d37e1f616ccbf,10/29(水) 11:55
2025-10-29,15:11,TTL,総合,20,スポニチアネックス,大谷翔平から逆転2ランのBジェイズ・ゲレロ「あの一発で勢いが出た。彼から打てて気持ち良かった」,https://news.yahoo.co.jp/articles/5ffda91bb2ea0591d98b522fdff77ecfa7a26e1a,10/29(水) 13:36
2025-10-29,15:11,TTL,総合,21,ほ・とせなNEWS,夜8時…高1息子「今日、友達とご飯食べて帰る」母「はい？」 →翌日、母の反撃に「開けたときの息子さんの顔が見たい」「絶対全員文句言ってる」「腹がたっても手込んでるの愛」,https://news.yahoo.co.jp/articles/b32fdddfa8dc93cceea8795caad6520dd09d839e,10/29(水) 10:24
2025-10-29,15:11,TTL,総合,22,ファイナンシャルフィールド,一人暮らしの弟が急死し、賃貸オーナーから「補修費用15万円」を請求されました。契約書の提示が拒否され、敷金の有無が分かりません。全額支払うべきなのでしょうか。,https://news.yahoo.co.jp/articles/947ea770b4c118cd046f5dfd6078d97cc38d2184,10/29(水) 11:51
2025-10-29,15:11,TTL,総合,23,朝日新聞,トランプ氏、日本を離れ韓国へ　出発前に高市氏と腕組み歩く写真投稿,https://news.yahoo.co.jp/articles/4bd336ad8e86eed5454b4a62bc93fe5cacfc7a9d,10/29(水) 10:17
2025-10-29,15:11,TTL,総合,24,ENCOUNT,「きれいな人たちの間で流行ってる」　ヒコロヒー、半年前から通う習いごとを公表…共演者驚き「珍しっ！」,https://news.yahoo.co.jp/articles/e4476e4e9aac5759ceeedd9f82cc1e3f8426471e,10/29(水) 7:10
2025-10-29,15:11,TTL,総合,25,毎日新聞,高市首相の外交マナーは？　「ロックスターのよう」と驚く外交官も,https://news.yahoo.co.jp/articles/984e43ea3a29bf5a70217e33080bbaba36bd7a50,10/29(水) 12:05
2025-10-29,15:11,TTL,総合,26,スポーツ報知,米軍基地訪問の高市首相　雰囲気ガラリで反響「珍しい」「似合ってる」「敏腕スタイリストさんが…」,https://news.yahoo.co.jp/articles/9a5b95c3f7d7690d45ecc458e9a191b102a870ff,10/29(水) 10:29
2025-10-29,15:11,TTL,総合,27,スポニチアネックス,ロバーツ監督「ショウヘイは本当に良く投げた」　大谷翔平の7回続投判断は「あと3イニング行ける」を信頼,https://news.yahoo.co.jp/articles/7a3d85ffaca0d040f2155c9cd363a6a03b17d779,10/29(水) 12:40
2025-10-29,15:11,TTL,総合,28,スポーツ報知,ポニーテールの真美子さんが激カワ！よく見ると「旦那様…」ファン二度見「愛情感じます」「綺麗すぎ」,https://news.yahoo.co.jp/articles/06b3e3f2cf03f4bd639cbcecf261172c67db0ef8,10/29(水) 11:36
2025-10-29,15:11,TTL,総合,29,日刊スポーツ,東ちづる、日本の核兵器保有の肯定意見に異論「それこそ頭の中お花畑じゃないかしら」,https://news.yahoo.co.jp/articles/1b634da394b47dcddaba80489e8e3c2d7432de9d,10/29(水) 12:53
2025-10-29,15:11,TTL,総合,30,LIMO,高市総理が検討する「給付付き税額控除」ってなに？非課税世帯なら「全員現金給付」になるの？仕組みをわかりやすく解説,https://news.yahoo.co.jp/articles/d8bafed884d7a79c3e923481a4523141277351d4,10/28(火) 14:16
2025-10-29,15:11,TTL,総合,31,スポニチアネックス,玉川徹氏　経済界トップ招待の米国側主催の夕食会は「まさに朝貢」も「日本もしたたかだなと」思ったことは,https://news.yahoo.co.jp/articles/c21b18dc85e42e21ad6221bb82985474eb5f270b,10/29(水) 13:45
2025-10-29,15:11,TTL,総合,32,ENCOUNT,「別人にしか見えない」女子レスラーの垢抜け具合にネット衝撃「整形してなくて！？」「こ、これはすごい」,https://news.yahoo.co.jp/articles/c0671b6b09c42de61b15381032ac9bbc9f3e1d41,10/29(水) 10:35
2025-10-29,15:11,TTL,総合,33,デイリースポーツ,ドジャース奥さま会　真美子さんは中腰で優しい笑み　米ファンが「真美子さんが見事！」「かわいい」と反響　恒例の集合写真,https://news.yahoo.co.jp/articles/88c033568257e0a51f8fb4ef47698d9fdcc68143,10/29(水) 10:56
2025-10-29,15:11,TTL,総合,34,日テレNEWS NNN,【解説】トランプ氏を「平和賞」へ推薦……効果は？　「うまくいった」日米首脳会談のポイント　“防衛費引き上げ”どうなる？,https://news.yahoo.co.jp/articles/b6f5ac84dc9093585bae47f2289e95a52a6dc97e,10/29(水) 9:45
2025-10-29,15:11,TTL,総合,35,サッカーキング,トッテナムDF高井幸大のデビューは再び不透明に？　ドラグシンは来月に復帰の可能性,https://news.yahoo.co.jp/articles/25cf4b0714c8abae38a8f81bd51becef3ab11131,10/29(水) 12:42
2025-10-29,15:11,TTL,総合,36,ねとらぼ,東横インの駐車場にあった看板→脳がバグる料金表示に「お得すぎる」「もう“住める”レベル」「気付かなかった」,https://news.yahoo.co.jp/articles/f5f532750b415264e16c0b3f9c9e78646e40c2ba,10/29(水) 11:05
2025-10-29,15:11,TTL,総合,37,まいどなニュース,「お目目くりくりですねぇ〜」看護師さんも驚いた赤ちゃん　生後3日でお顔はこの完成度！？　「世界一可愛い新生児！」とSNSで話題,https://news.yahoo.co.jp/articles/35b21d106830ea96c40bd4924b1223d4ccf978d4,10/29(水) 11:45
2025-10-29,15:11,TTL,総合,38,マグミクス,「ネタ切れかと思ったら…」『鬼滅の刃』第9弾特典にファンから“嬉しい悲鳴”続出　「お金が…」,https://news.yahoo.co.jp/articles/37239d5d754eee359cc0911cc54ab6a20e6cf5fe,10/29(水) 11:55
2025-10-29,15:11,TTL,総合,39,FASHIONSNAP,スターバックスが2026年の福袋を発表　限定グッズやドリンクチケットを封入,https://news.yahoo.co.jp/articles/0be83a4c8790ea4801b748bc0736e4703440b81f,10/29(水) 11:45
2025-10-29,15:11,TTL,総合,40,Car Watch,トヨタ、一般初公開の新型「RAV4」と話題の新型「ランドクルーザーFJ」展示,https://news.yahoo.co.jp/articles/fc2714a91dd1ba7ec28e230000d2e4ad319f6ea1,10/29(水) 14:01
