scrp_date,scrp_time,genre_en,genre_jp,rank,media_jp,title,link,date_original
2025-07-20,20:06,TTL,総合,1,日刊スポーツ,【日本ハム】新庄監督「明日話したいことがある」16年ぶり単独首位ターン決定も一言で球場去る,https://news.yahoo.co.jp/articles/34f4e2690448c402ece9bac4194d07bdae9cc1c1,7/20(日) 15:41
2025-07-20,20:06,TTL,総合,2,スポニチアネックス,22年に植毛手術を公表…いしだ壱成の最新ショットが話題「本当かっこいいなぁ～～」「素敵です」,https://news.yahoo.co.jp/articles/53fec8ebea9c19c7dc8962fe866736b0c4f26c92,7/20(日) 17:54
2025-07-20,20:06,TTL,総合,3,J-CASTニュース,れいわ・山本太郎代表、コスプレ姿で投票呼びかけ波紋　衣装の説明なく「特に何もないですが。普段通りですよ」,https://news.yahoo.co.jp/articles/20f4e2a8c73a9d3130f8a3aa79e1997d2ef014d6,7/20(日) 11:09
2025-07-20,20:06,TTL,総合,4,J-CASTニュース,「日本を北朝鮮のようにしたいんだな」橋下徹氏、参政党の憲法案バッサリ　神谷宗幣代表は応戦「ウソやめて」,https://news.yahoo.co.jp/articles/6ba92b283e3a8478569b239edef7baca44d3f2c1,7/19(土) 19:58
2025-07-20,20:06,TTL,総合,5,まいどなニュース,天皇皇后両陛下のペアルックに愛子さまがひと言　散策動画、公開1日で35万回再生突破「新鮮ですね」「愛が感じられる」,https://news.yahoo.co.jp/articles/d6a3819ca1d933962d285853c8a8f50cf30e40d8,7/20(日) 16:16
2025-07-20,20:06,TTL,総合,6,日刊スポーツ,溝口勇児氏衝撃事態「チャンネルがいきなりバンされて動画全消し」報告「無力な自分が情けない」,https://news.yahoo.co.jp/articles/a1f64a024c2021f0d120575a94f740d169b18af1,7/20(日) 16:33
2025-07-20,20:06,TTL,総合,7,東スポWEB,【巨人】Ｘで小林誠司の交代巡り「懲罰交代」がトレンド入り「またバント絡みなのか」,https://news.yahoo.co.jp/articles/ac943b8a918d6e1ad40831d96ed7c65c6ec71022,7/20(日) 18:41
2025-07-20,20:06,TTL,総合,8,オリコン,TM NETWORK・木根尚登の所属事務所、声明発表「大変残念で、遺憾に思います」　ライブ終演後、無断でピック抜き取り持ち去り事案発生,https://news.yahoo.co.jp/articles/4b887b49bd0753c335d60f7c84cffed8991df0fb,7/20(日) 12:16
2025-07-20,20:06,TTL,総合,9,中央社フォーカス台湾,元オリックス・モヤ選手の妻が死去　台湾への機内で心肺停止に,https://news.yahoo.co.jp/articles/ba8e916e02b136a2543db29c62ad0c2269b83cb0,7/20(日) 16:17
2025-07-20,20:06,TTL,総合,10,ねとらぼ,夕方、羊にエサをあげに行くと……「ウソでしょ？」　ギャグ漫画のような目を疑う光景に驚き「えぇw」「えらいこっちゃ」,https://news.yahoo.co.jp/articles/8cd2c048264a0d261d41ef8f74f6edf4a1f4c17e,7/20(日) 17:00
2025-07-20,20:06,TTL,総合,11,TBS NEWS DIG Powered by JNN,バレー男子日本代表、アメリカに勝っても負けても2セット奪えば決勝R進出決定【ネーションズリーグ】,https://news.yahoo.co.jp/articles/412919a59bdd69f3fb37e895f12f790f176fce74,7/20(日) 17:44
2025-07-20,20:06,TTL,総合,12,スポニチアネックス,ひろゆき氏、ホリエモン＆井川意高氏から「クズ」呼ばわりも…“たった一言”でバッサリ,https://news.yahoo.co.jp/articles/c71021f0dce3d1602244fdaa567a4e4612983ee0,7/20(日) 15:07
2025-07-20,20:06,TTL,総合,13,スポニチアネックス,スザンヌ　旅館経営に1億5000万円　“強気な値段設定”宿泊料は…「お食事にすごくこだわって」,https://news.yahoo.co.jp/articles/de86d62cd83327a89ea02b6f7b1778bffd67be1f,7/20(日) 16:16
2025-07-20,20:06,TTL,総合,14,スポニチアネックス,大の里　痛恨2敗目…首位陥落　新入幕・草野が“快進撃”で1敗死守　琴桜は3敗に後退、1敗勢は4人に,https://news.yahoo.co.jp/articles/d65f301ecbf96e866df28b644425722dda664569,7/20(日) 17:57
2025-07-20,20:06,TTL,総合,15,BuzzFeed Japan,「どんな状況！？」佐藤健、共演者との2ショットに「お似合い」「お二人の空気感がたまりません」とSNS沸く,https://news.yahoo.co.jp/articles/2f7dd79f93cfe9fee336214209d6084e06d81ba2,7/20(日) 16:20
2025-07-20,20:06,TTL,総合,16,日刊スポーツ,【バレー】パリ五輪代表の西田有志なぜ不在？　パリ五輪後１年休養明言もトレーニング継続中,https://news.yahoo.co.jp/articles/42f15ab8d1a7a6204e5c99229c616889ac3c0aa1,7/17(木) 11:47
2025-07-20,20:06,TTL,総合,17,スポニチアネックス,巨人が球団初の屈辱！球宴前に阪神戦シーズン負け越し決定　自力V消滅の翌日も打線つながらず,https://news.yahoo.co.jp/articles/55fcc51ae0dc57cfff389f5e0f0340e6c027102f,7/20(日) 16:55
2025-07-20,20:06,TTL,総合,18,オリコン,遠野なぎこさん追悼　『未成年』共演の元グレチキ北原雅樹、自身の「事件」後の言葉も明かして嘆き,https://news.yahoo.co.jp/articles/1f3f4f8fac0a5f553c795e57e63db9d2cb39b0cf,7/20(日) 17:13
2025-07-20,20:06,TTL,総合,19,スポニチアネックス,バイきんぐ小峠、完全“共演NG”な芸人を実名ぶっちゃけ「どう考えてもくつがえらない」,https://news.yahoo.co.jp/articles/866545fb7edd215ca06b9154e45a0c3acfa6d55b,7/20(日) 19:23
2025-07-20,20:06,TTL,総合,20,ほ・とせなNEWS,茶色い前髪の子猫　5年後、成長した姿に「可愛すぎ」「どこでこうなった…ｗ」「ギャップ萌え」「最高じゃないですかぁ」,https://news.yahoo.co.jp/articles/4218d20db914b6e0f0be3ebee69287de818fb6c8,7/20(日) 13:51
2025-07-20,20:06,TTL,総合,21,スポニチアネックス,伊原剛志「子供が学校一緒で」　実はパパ友だという同じ年の超大物「どう見ても、オラオラって」,https://news.yahoo.co.jp/articles/61eb5d153d008265a94e69cc976c1a3aadafcfdd,7/20(日) 16:11
2025-07-20,20:06,TTL,総合,22,スポニチアネックス,木下優樹菜さん、長女が大絶叫「今写真撮ったぁぁ！！！」一般人からの“ありえない”盗撮を告白,https://news.yahoo.co.jp/articles/a0b7a3620cec69a17e24f33c06196e93b6ac1ff8,7/20(日) 15:57
2025-07-20,20:06,TTL,総合,23,クランクイン！,萬田久子67歳、タイトなスリットドレスが優雅で美しい…ファンほれぼれ「永遠に憧れ」,https://news.yahoo.co.jp/articles/a62668c08d80a03ecccb82fa22bac72af1c31569,7/20(日) 18:00
2025-07-20,20:06,TTL,総合,24,テレビ朝日系（ANN）,富士山に中国人登山客ら殺到　“予言デマ”で急減→大混雑　ルール知らず断念も,https://news.yahoo.co.jp/articles/4105e919113ba0bb9e4572bab48943d1712fa23f,7/20(日) 11:22
2025-07-20,20:06,TTL,総合,25,CoCoKARAnext,大不振の原因は2番固定？ ベッツが漏らしていた大谷翔平への“本音”「ショウヘイがあっさりとアウトになると『マジかよ』って…」,https://news.yahoo.co.jp/articles/0ad1e8e2029f1604868776c365408890492e3552,7/20(日) 6:31
2025-07-20,20:06,TTL,総合,26,Full-Count,大谷翔平は「本当に馬鹿げてる」　33号に米メディアどよめき…しかも逆方向「スタンド中段」,https://news.yahoo.co.jp/articles/008025c39dd3f0829fa0f9272b395abe97a6a913,7/20(日) 11:19
2025-07-20,20:06,TTL,総合,27,中日スポーツ,「頑張れ頑張れジャイアンツ！」前半戦での阪神戦負け越し決定…屈辱の巨人へ虎の応援団からエール送られ、さらなる屈辱の場面,https://news.yahoo.co.jp/articles/44b4d82be9f321c5f676cd3087ee3addfd019af6,7/20(日) 17:50
2025-07-20,20:06,TTL,総合,28,毎日新聞,参院選、午後6時現在の投票率は26.65％　前回を下回る,https://news.yahoo.co.jp/articles/bbdbb25aba5feb3b68bda642000b7899380eb3c0,7/20(日) 19:33
2025-07-20,20:06,TTL,総合,29,ENCOUNT,15年間給料上がらずも…「電気代がずっとタダ」　重盛さと美の生活ぶりに上沼恵美子「家広いのね」,https://news.yahoo.co.jp/articles/132a0dcd226e4d0ed51e3560de9f6e4ef9f8ff6c,7/20(日) 16:21
2025-07-20,20:06,TTL,総合,30,デイリースポーツ,阪神・坂本　左肩付近の死球にファン悲鳴「やめて」　首振ってベンチ制す　赤星はイニング完了後にも謝罪,https://news.yahoo.co.jp/articles/2f74158e37558affc59d4f3dfe2ed695800718ea,7/20(日) 15:30
2025-07-20,20:06,TTL,総合,31,J-CASTニュース,相手をイラつかせる「お世話になっております」もうやめたら　好印象なメールの書き出し、すぐ作れる方法,https://news.yahoo.co.jp/articles/09ecb61272134baed59cbce8241c8d7d789b80b4,7/20(日) 16:00
2025-07-20,20:06,TTL,総合,32,東スポWEB,河本準一　うつ病になり「ショックやった」自身に起きた異変明かす,https://news.yahoo.co.jp/articles/92d6fb09afc9af985cb76b94e0ffac7c1977df94,7/20(日) 16:46
2025-07-20,20:06,TTL,総合,33,ENCOUNT,加藤浩次が映画館で”恐怖”体験　客席200人超のスクリーンに観客5人…うち1人のまさかの行動に「ありえねえ」,https://news.yahoo.co.jp/articles/2656fefd0febe7d8e3f60a5c0194e4714f18f391,7/20(日) 15:27
2025-07-20,20:06,TTL,総合,34,デイリースポーツ,「誰に喧嘩売っとんじゃこら、ワレ！」ＢＤ喧嘩自慢がパイプ椅子手にブチ切れで騒然　仲間突き飛ばし、瓜田に止められるも…ＳＮＳ戦慄「怖すぎる」「エグい」,https://news.yahoo.co.jp/articles/f197dbf57fe38d2f7c18566357bd41e09cccb2fc,7/20(日) 14:25
2025-07-20,20:06,TTL,総合,35,日刊スポーツ,【真弓明信】阪神が巨人に力の差示すも万全ではない　球宴後、故障者戻った各チームにどう戦うか,https://news.yahoo.co.jp/articles/d362cda941dd82f3d9874afe8edfef9da0d02845,7/20(日) 18:55
2025-07-20,20:06,TTL,総合,36,ねとらぼ,「長時間歩いても痛くならない」 ワークマンの“1900円サンダル”が大好評！　「毎日履いてます」「ヘビロテしてます」,https://news.yahoo.co.jp/articles/2d57d480034c16476c7ec20add09d1507b36209f,7/20(日) 14:50
2025-07-20,20:06,TTL,総合,37,デイリースポーツ,中日が痛恨逆転負けで６年ぶり８連勝＆２位浮上スルリ　清水が誤算九回２失点で同点に、勝野が勝ち越し許す,https://news.yahoo.co.jp/articles/53c897a71a28931c86962f0d1745949b8f56ea26,7/20(日) 17:45
2025-07-20,20:06,TTL,総合,38,J-CASTニュース,児童、生徒へのわいせつ教師が相次ぐ　尾木ママが指摘したその原因は,https://news.yahoo.co.jp/articles/b78471b9f288949e46d083f705b7351e3f01ad0c,7/20(日) 17:43
2025-07-20,20:06,TTL,総合,39,スポニチアネックス,阪神・藤川監督　4回からの大逃亡リレー「計算通り」　Gに早々勝ち越し「気にしている余裕はない」,https://news.yahoo.co.jp/articles/f1fbd938c8aedea3760467f168c745cd10239008,7/20(日) 19:10
2025-07-20,20:06,TTL,総合,40,テレビ朝日系（ANN）,人気バンドのライブ中　大企業CEOの“不倫”が大スクリーンに映し出され辞任,https://news.yahoo.co.jp/articles/ca930cd962aafbf53ef84f7ae6463f6e7aec9d66,7/20(日) 10:31
