scrp_date,scrp_time,genre_en,genre_jp,rank,media_jp,title,link,date_original
2025-11-12,14:08,sports,スポーツ,1,東スポWEB,【MLB】千賀滉大にオファー殺到か　トレード29球団NGから「19球団OK」に〝大幅緩和〟,https://news.yahoo.co.jp/articles/6ada5008be650be233ddc4f37564dd051365468d,11/12(水) 10:45
2025-11-12,14:08,sports,スポーツ,2,スポーツ報知,結婚した４１歳美女ゴルファー　年下のイケメン夫に肩を抱かれるラブラブショット！幸せそうな佐伯三貴＆森照夫,https://news.yahoo.co.jp/articles/c3c5c1d0ed810117b0ad9208219f4a496b298f03,11/12(水) 10:55
2025-11-12,14:08,sports,スポーツ,3,中日スポーツ,中日・大野雄大、5000万円増の1億7000万円でサイン、カムバック賞を受賞した左腕「もう一度、規定投球回をクリアしたい」,https://news.yahoo.co.jp/articles/4895c374b8370345c027dfe8c8c106ff009466da,11/12(水) 12:08
2025-11-12,14:08,sports,スポーツ,4,Full-Count,世界一も…ド軍指揮官まさかのゼロ票　落選にファンは猛抗議「クレイジー」「盗まれた！」,https://news.yahoo.co.jp/articles/4ebd1052a11343676fa6801026562dc060839dfb,11/12(水) 10:53
2025-11-12,14:08,sports,スポーツ,5,東スポWEB,【ドジャース】山本由伸の〝３２億円豪邸〟は「大谷夫妻の倹約ぶりとは少し違う」 韓国報道,https://news.yahoo.co.jp/articles/a32c8ac2d3fa8d0174c473037813384961101db3,11/12(水) 11:40
2025-11-12,14:08,sports,スポーツ,6,スポーツ報知,パドレスＧＭが今井達也争奪戦に参戦宣言「願わくば、願わくば、願わくば…」　ダルビッシュ有の存在も後押しに,https://news.yahoo.co.jp/articles/98f86a49d995b40e827919a035ab7243ef58d195,11/12(水) 10:03
2025-11-12,14:08,sports,スポーツ,7,イーファイト,元祖アイドルレスラー井上貴子が56歳に！「おばぁちゃん」　と自虐もファン「お美しすぎます」,https://news.yahoo.co.jp/articles/85b34508ff5c9f57e5a78b083c3fa5e190f22325,11/12(水) 11:56
2025-11-12,14:08,sports,スポーツ,8,高校野球ドットコム,トライアウト午前の部が終了！前楽天右腕が150キロ連発、広島・松山が2安打、西武20年ドラ1・渡部が本塁打を放ちアピールに成功,https://news.yahoo.co.jp/articles/f2e37944bfd0af82480de7415fdb225a6c5afbab,11/12(水) 12:21
2025-11-12,14:08,sports,スポーツ,9,東スポWEB,ドジャース・ロハスは「まともなアスリートではない」 ヤンキースのチザムが受けた〝暴行〟,https://news.yahoo.co.jp/articles/fb926ffa8808e321570989686bfcfce78c944ec3,11/12(水) 12:40
2025-11-12,14:08,sports,スポーツ,10,Full-Count,トライアウトに現れた“超剛腕”「戦力外なの!?」　150キロ連発…27歳に熱視線「面白そう」,https://news.yahoo.co.jp/articles/c3e1cb015619c808a9bb6e6b52872cca6715c6a2,11/12(水) 13:15
2025-11-12,14:08,sports,スポーツ,11,スポニチアネックス,仙台育英　全国高校サッカー選手権出場を辞退　「構造的いじめ」認定　代替出場は未定,https://news.yahoo.co.jp/articles/bae06ea78082d4998218faa7a9500ba2c16aeeaf,11/12(水) 10:16
2025-11-12,14:08,sports,スポーツ,12,スポーツ報知,Ｊ１横浜ＦＭ―浦和でオフサイド見逃し→ゴールの事象発生…ＪＦＡが見解「正しい判定ができなかった」,https://news.yahoo.co.jp/articles/204350074ec30b00e93df98fc97ef99cd0bcce06,11/12(水) 12:23
2025-11-12,14:08,sports,スポーツ,13,スポニチアネックス,【トライアウト】元ソフトバンク育成の22歳・大城真乃が圧巻の3者連続三振！強打者斬りにマツダ騒然,https://news.yahoo.co.jp/articles/80ab8503610c36a8c416b4ad3305bca456e51c31,11/12(水) 13:21
2025-11-12,14:08,sports,スポーツ,14,ABEMA TIMES,鈴木誠也選手の妻・畠山愛理、息子と夫の幸せあふれる親子ショット公開,https://news.yahoo.co.jp/articles/ef4a91c5e8fa00ecf08ea10bacd8ff8025e3529c,11/12(水) 11:15
2025-11-12,14:08,sports,スポーツ,15,Full-Count,ド軍が狙う“最強守護神”　昨オフはスコットに111億円…1年越しの移籍の可能性,https://news.yahoo.co.jp/articles/fc975b8cdd5206b0a90c8b550c06cbf6813e3b68,11/12(水) 12:34
2025-11-12,14:08,sports,スポーツ,16,CoCoKARAnext,今永昇太とのオプション行使は「価値がなかった」　カブス幹部が明かした契約延長見送りの背景　FA市場で問われる左腕の真価,https://news.yahoo.co.jp/articles/116838dafbdc5b36867d770c0a04d35f1d0e2cde,11/12(水) 11:02
2025-11-12,14:08,sports,スポーツ,17,デイリースポーツ,ＤｅＮＡ・桑原がＦＡ権を行使　国内移籍を視野　球団は宣言残留も認める,https://news.yahoo.co.jp/articles/81691828be1e78c469e6095959d67adad2a03b61,11/12(水) 11:00
2025-11-12,14:08,sports,スポーツ,18,日刊スポーツ,【阪神】今年もFA流出ゼロ　保持者が全員残留で落着　複数年契約が切れても再び契約／まとめ,https://news.yahoo.co.jp/articles/8429b9fa6a372cf2fdb274d61a52b11a3fe434ea,11/12(水) 11:10
2025-11-12,14:08,sports,スポーツ,19,高校野球ドットコム,大手予備校が高校野球界に進出！…通信制高校を設立、目標は「文武両道で甲子園」、全国から15人の新入部員が集う！,https://news.yahoo.co.jp/articles/380310b579e36275f2d01dd2da74effed2252190,11/12(水) 12:00
2025-11-12,14:08,sports,スポーツ,20,日刊スポーツ,【阪神】今日ゴールデン・グラブ賞発表　阪神勢の史上最多ジャックなるか　最も確率が高いのは？,https://news.yahoo.co.jp/articles/36e4e8d9bcec8ee5ba52f8eb3f1bb09e82e24ca4,11/12(水) 11:31
2025-11-12,14:08,sports,スポーツ,21,東スポWEB,大谷翔平スゴ過ぎる経済効果！１５４０億円稼ぎ出す　超大型契約メッツ・ソトは回収未達,https://news.yahoo.co.jp/articles/49f24ecb36c56a100c9335dab2928c9b82fe8087,11/12(水) 11:30
2025-11-12,14:08,sports,スポーツ,22,スポニチアネックス,DeNA　「ハマのガッツマン」桑原将志と18年目終えた伊藤光が「海外フリーエージェント権」を行使,https://news.yahoo.co.jp/articles/8cd4faf4124ca78f3ddafc9e17f0be303ec41559,11/12(水) 11:00
2025-11-12,14:08,sports,スポーツ,23,デイリースポーツ,オリ西川龍馬がトライアウト現地観戦　元同僚のカープ野間、堂林と並んで、先輩・松山らのプレーに熱視線,https://news.yahoo.co.jp/articles/6c2bb8d1748a10a4f2ba365ba157d634e6db9127,11/12(水) 11:09
2025-11-12,14:08,sports,スポーツ,24,東スポWEB,【Ｆ１】角田裕毅の支持派を黙らせた…来季シートを争うローソンの残留をエンジニアらが熱望,https://news.yahoo.co.jp/articles/9386284fd6030fc24b525f3f6c6bbab2d13f4995,11/12(水) 11:40
2025-11-12,14:08,sports,スポーツ,25,デイリースポーツ,トライアウト　主な不参加選手は－田中広輔、今村信貴、沢村拓一ら,https://news.yahoo.co.jp/articles/6ab2733096cbef4d04e28e7d7d2b782f53e9e9e3,11/12(水) 9:53
2025-11-12,14:08,sports,スポーツ,26,デイリースポーツ,長嶋監督からの仰天提案「うちの前の土地が空いてるから、おまえ買え」高級住宅地購入勧められ困惑した小俣進さん,https://news.yahoo.co.jp/articles/c388072cdefd5cc8a9dee31bbd282194a131966d,11/12(水) 10:00
2025-11-12,14:08,sports,スポーツ,27,日刊スポーツ,【侍ジャパン】強化合宿打ち上げ　手締めあいさつは坂本誠志郎「みんなでいい準備、アピールを」,https://news.yahoo.co.jp/articles/05fa036295211f1922a7cbcb1db9bba2ee1c8106,11/12(水) 12:37
2025-11-12,14:08,sports,スポーツ,28,スポーツ報知,【ＤｅＮＡ】桑原将志がＦＡ行使決断　補償が必要なＢランク　伊藤光に続いて２人目,https://news.yahoo.co.jp/articles/516c7774827752f3c971e058496b0c6a4b8dbcda,11/12(水) 11:00
2025-11-12,14:08,sports,スポーツ,29,Full-Count,「え、いるよね!?」トライアウト会場にまさか…訪れた“大物”に騒然　隠せなかったオーラ,https://news.yahoo.co.jp/articles/34a1886ede0405b58c41a43f19992f46ec47a43a,11/12(水) 12:00
2025-11-12,14:08,sports,スポーツ,30,デイリースポーツ,ロバーツ監督、まさかの得票なし　MLB最優秀監督賞発表　地区4連覇評価されず　ブルワーズ・マーフィー監督とガーディアンズのボート監督がともに2年連続の快挙,https://news.yahoo.co.jp/articles/99eea23c3a04b5f2b18591021222ebd229447322,11/12(水) 9:54
2025-11-12,14:08,sports,スポーツ,31,デイリースポーツ,前広島　４０歳の松山が３安打！本拠地マツダ沸く　１８歳下、森木の速球を中前にはじき返す,https://news.yahoo.co.jp/articles/5fac753979ce7cd1bab58ba058d7dba0d1bef0b1,11/12(水) 13:41
2025-11-12,14:08,sports,スポーツ,32,日刊スポーツ,オフを満喫！畠山愛理さん、夫・カブス鈴木誠也＆息子と愛犬のほのぼのショット公開,https://news.yahoo.co.jp/articles/0c9c2cd8487e8cecf84c5c660b3cabb589329b03,11/12(水) 12:40
2025-11-12,14:08,sports,スポーツ,33,日刊スポーツ,丸刈りの二子山親方に周囲もびっくり「どうしたんですか？」　三田の今後は検討中,https://news.yahoo.co.jp/articles/0473988a97c6d4fadddaaa474e870f0dd1ed77f9,11/12(水) 11:31
2025-11-12,14:08,sports,スポーツ,34,日刊スポーツ,【トライアウト】ロッテ沢村拓一、ヤクルト西川遥輝、ソフト板東湧梧ら／主な不参加選手一覧,https://news.yahoo.co.jp/articles/af9299f0ffae227fd5c7f3d474437e497ca1164b,11/12(水) 11:39
2025-11-12,14:08,sports,スポーツ,35,Full-Count,西武戦力外の渡部健人が特大弾　ハム・石川直也からいきなり…解説者驚愕「軽打して」,https://news.yahoo.co.jp/articles/7d87e5f07f0de70385d33ec42df69c0c4865f036,11/12(水) 10:56
2025-11-12,14:08,sports,スポーツ,36,高校野球ドットコム,ソフトバンクから戦力外受けた風間球打は最速143キロ計測、「21年高校BIG3」の元ドラ1右腕【トライアウト】,https://news.yahoo.co.jp/articles/4156000696d61a3ecfbe38c55fa32f4a959e49fd,11/12(水) 13:14
2025-11-12,14:08,sports,スポーツ,37,日刊スポーツ,ドジャース、FA市場でのトップターゲットは通算86セーブの右腕　米記者が伝える,https://news.yahoo.co.jp/articles/9ed4d58e6b6c0a8ea0e6ec931cc21f297987fe3e,11/12(水) 13:12
2025-11-12,14:08,sports,スポーツ,38,日テレNEWS NNN,フリーマン家の保護猫が無防備にお昼寝　チェルシーさんは「ホームレス状態から昼寝するだけの生活へ。チャンプは猫の宝くじに当たったのね」,https://news.yahoo.co.jp/articles/34aa19d99dd4e9e0ec360ab11c70da770949d628,11/12(水) 12:41
2025-11-12,14:08,sports,スポーツ,39,デイリースポーツ,元プロ野球選手　長女の婚約で心境「婚姻届にサインする時はさすがに緊張しました」娘からの贈り物も　「泣けますね」「素敵」,https://news.yahoo.co.jp/articles/94fa82ca4711848a604daca28caad3870c3e447e,11/12(水) 12:24
2025-11-12,14:08,sports,スポーツ,40,ABEMA TIMES,すごいスタイル…「脚長い」「顔ちっさ」20歳の三段目力士、均整の取れたカラダにファン驚き,https://news.yahoo.co.jp/articles/d7ac33448386a67955fd967f2d6121448f17777c,11/12(水) 10:03
