scrp_date,scrp_time,genre_en,genre_jp,rank,media_jp,title,link,date_original
2025-02-15,09:27,local,地域,1,北海道ニュースUHB,【変死体】約90cm…海岸で見つかった“下半身”は女性だった―下着含め5枚重ねばき「死後数か月から数年」花柄ズボンなど4枚の写真公開＜北海道松前町＞,https://news.yahoo.co.jp/articles/315c73d12979b5c96c3ba763dcbf7cd2e850fcfd,2/15(土) 6:00
2025-02-15,09:27,local,地域,2,HBCニュース北海道,北海道の31歳女性職員「人気が出てしまい報酬を…」ネットショッピングの商品評価をSNS投稿し34万円報酬得る　匿名通報で発覚　減給の懲戒処分,https://news.yahoo.co.jp/articles/83bd67f2e173a36e8316e8beed689fdb0a79f587,2/14(金) 18:58
2025-02-15,09:27,local,地域,3,NBC長崎放送,30メートルの橋げたが道路ふさぐ 台車横転 長崎県佐世保市,https://news.yahoo.co.jp/articles/bc1423034798f1bb831f86b61035388d51b81846,2/15(土) 6:47
2025-02-15,09:27,local,地域,4,静岡放送（SBS）,酒気帯び運転でJR浜松駅前を暴走か 60歳無職男を逮捕 中央分離帯乗り越えタクシーと正面衝突 3台絡む事故で4人けが=静岡県警【速報】,https://news.yahoo.co.jp/articles/171286acae3885665338cd442aa94c19fa5b6a79,2/14(金) 23:41
2025-02-15,09:27,local,地域,5,カナロコ by 神奈川新聞,横浜市議補選でダブルスコア敗北　参院選で神奈川選挙区に２人擁立、立民に広がる動揺,https://news.yahoo.co.jp/articles/7666ed3b1009dc60da380d1e88941023e5ffbebc,2/14(金) 22:30
2025-02-15,09:27,local,地域,6,テレビ高知,緊急走行中の救急車と軽乗用車が衝突　「救急車が来たことはわかっていたが、避けようとアクセルを…」搬送中だった患者は別の救急車で病院へ　事故によるけが人なし【高知】,https://news.yahoo.co.jp/articles/7a8e05851407b46e24ec0ad671256ad792e66421,2/14(金) 23:02
2025-02-15,09:27,local,地域,7,中国新聞デジタル,「これほど死んだの経験ない」 宮島のカキが大量死、海水温上昇が原因　祭りも中止に　広島県廿日市市,https://news.yahoo.co.jp/articles/3e072b2006006f3c4fe5cd45b42616ac968e88a2,2/15(土) 7:01
2025-02-15,09:27,local,地域,8,埼玉新聞,【速報】関越道で渋滞25 キロに拡大　車10台絡む事故　別区間でさらに21キロの渋滞〈続報〉,https://news.yahoo.co.jp/articles/ce6365f21d4d36a44f797ba629611822af4dc03e,2/15(土) 6:33
2025-02-15,09:27,local,地域,9,読売テレビ,【ナゼ】頭部・手足が切断された被害者は“新婚”国交省職員…同じマンションに住む男との“接点”は？　事件後にATМで金を引き出しも…謎に包まれた動機と経緯,https://news.yahoo.co.jp/articles/1479073544ccd6ab031c638597f60aac598b59fe,2/15(土) 9:00
2025-02-15,09:27,local,地域,10,HBCニュース北海道,下半身だけの身元不明遺体“女性”と判明　死後数か月～数年経過か　ピンクの股引や花柄ズボンなど着衣公開し警察が情報提供を呼びかける　北海道松前町,https://news.yahoo.co.jp/articles/23e71a54c742172578e75960f0d8b2444f8f5815,2/14(金) 16:16
2025-02-15,09:27,local,地域,11,神戸新聞NEXT,【独自】兵庫県知事選で落選、清水貴之氏が参院選に出馬へ　維新から立候補意向　兵庫選挙区,https://news.yahoo.co.jp/articles/2ce671f52a2eacaad26ffb19981710b2248554c6,2/15(土) 8:30
2025-02-15,09:27,local,地域,12,中京テレビＮＥＷＳ,「戦争に行って、死んで、日本を守る」　100歳超の双子姉妹“きんさん”が激怒した息子の憧れ　戦時教育に翻弄された若者たち　今でも残る“怒り”と“悲しみ”…,https://news.yahoo.co.jp/articles/03f3fff780784b875636395650051bd62e7447ed,2/15(土) 8:00
2025-02-15,09:27,local,地域,13,NBC長崎放送,空港バスのトランクに20代女性を閉じ込め1.5キロ走行　JR長崎駅前,https://news.yahoo.co.jp/articles/0cc49d9c033bad01d91f00a50cd5e72eb5fde988,2/13(木) 17:14
2025-02-15,09:27,local,地域,14,中国新聞デジタル,広島市中区の飲食店で集団食中毒　営業禁止命令,https://news.yahoo.co.jp/articles/5e0d9629c8818a1e53849d48fb510253ae1d2ca6,2/14(金) 20:06
2025-02-15,09:27,local,地域,15,中国新聞デジタル,女子高生に不同意わいせつ容疑、で逮捕された山口県の教頭　地検は暴行罪で起訴,https://news.yahoo.co.jp/articles/3cb132ef06245e2b65cfc318545245ae8199ab9f,2/15(土) 8:11
2025-02-15,09:27,local,地域,16,南日本新聞,ヘッドホン自転車、スマホ運転…楽しいのは当事者だけ　ながら運転の恐ろしさを際立たせた表情が秀逸、小3が描いたポスターが全国大賞,https://news.yahoo.co.jp/articles/5bf09bcf9685e727e2c965a5b95c0e95290acbcc,2/12(水) 15:03
2025-02-15,09:27,local,地域,17,ＢＳＮ新潟放送,重なる育児と介護「正社員は諦めた “2人目”も諦めた」数年後に2割以上が『ダブルケアラー』に?逃げられない現実をまずは知ってもらいたい,https://news.yahoo.co.jp/articles/e21f64cd0873aa436b5e8461017e1030a4671d41,2/15(土) 5:02
2025-02-15,09:27,local,地域,18,北國新聞社,１９日ごろ大雪恐れ　北陸、警報級,https://news.yahoo.co.jp/articles/9e613dc5ded9b51d9d12b9e2ef92bc3cc0a8f4e3,2/15(土) 5:01
2025-02-15,09:27,local,地域,19,HOME広島ホームテレビ,コンサート何度も中止にさせたか　県職員ら2人逮捕　他にも複数関与の可能性も…　広島,https://news.yahoo.co.jp/articles/a90d8688bfcb31c10f9eefba5008258180ff1ff4,2/6(木) 12:56
2025-02-15,09:27,local,地域,20,北國新聞社,女子高生と中年男性の口論で遅れ　あいの風鉄道、金沢発泊行き,https://news.yahoo.co.jp/articles/9379d9d87bb2c4cb31ffb2883c792393d338494e,2/15(土) 5:01
2025-02-15,09:27,local,地域,21,北海道ニュースUHB,≪高齢ドライバー事故≫車5台に次々と衝突…80代男性運転のSUV「アクセル踏んだら戻らなくなった」　警察は注意呼びかけ　北海道砂川市,https://news.yahoo.co.jp/articles/f897d79535fb559dbdaa7b7e740acc665222363c,2/15(土) 8:35
2025-02-15,09:27,local,地域,22,あいテレビ,【雪の最新シミュレーション】再び強烈寒波で「10年に1度の大雪・低温」の可能性　東北、北陸、近畿、山陰などは『大雪』　関東甲信、北陸、東海、近畿、中国、四国、九州、沖縄は『低温』【気象庁・強い冬型の気圧配置に関する全般気象情報・早期天候情報】,https://news.yahoo.co.jp/articles/6642efeec95c1fea7c331e4330973577713eb018,2/14(金) 22:16
2025-02-15,09:27,local,地域,23,西スポWEB OTTO！,〝希少昭和64年生まれ〟福岡タレントの大胆イメチェン姿が話題「美しい長い髪」「素敵な笑顔」,https://news.yahoo.co.jp/articles/98ceaa65da8e10f74920ea2088bbbcd35af67adc,2/15(土) 0:00
2025-02-15,09:27,local,地域,24,北海道ニュースUHB,飼いネコ「面倒を見きれないから譲ろう」同居姉(60代)に言われて激高し髪の毛引っ張る暴行　逮捕の弟(54)は「やってない」容疑否認　北海道歌志内市,https://news.yahoo.co.jp/articles/9ae65e118952972dbb5486c8d19385cadec82199,2/15(土) 8:27
2025-02-15,09:27,local,地域,25,千葉日報オンライン,【速報】N党立花氏「2馬力選挙はやらない」　千葉県知事選で方針転換　「『迷惑』と言っているのに逆らうのはよくない」　出馬意向は変わらず,https://news.yahoo.co.jp/articles/f91a547116d764b73761bf4307d5a16dde9df934,2/14(金) 19:03
2025-02-15,09:27,local,地域,26,KFB福島放送,田んぼに車が突っ込み 男性２人死亡　須賀川市で軽乗用車が横転事故(福島),https://news.yahoo.co.jp/articles/8a827fba902b916b6a94835ad1236f9fe4ced77f,2/15(土) 8:42
2025-02-15,09:27,local,地域,27,沖縄タイムス,伊藤詩織さん、名誉毀損で東京新聞の望月衣塑子記者を提訴　映画を巡る記事は「事実と異なる」　望月記者「誤りはない」,https://news.yahoo.co.jp/articles/b871a7652e851a8a6676c760977689ecd163903f,2/14(金) 9:57
2025-02-15,09:27,local,地域,28,福島中央テレビ,顔から血を流し倒れていた男性2人…搬送先で死亡確認　付近に横転した軽四輪乗用車　須賀川市・福島,https://news.yahoo.co.jp/articles/f0cd9bde2cfbd9bde8f92493aba13d5d800cc965,2/15(土) 7:55
2025-02-15,09:27,local,地域,29,MBSニュース,立花孝志氏が入手の死亡の元県議「黒幕」文書　事実解明を百条委などに申し入れ　共産党県議団　岸口県議は文書提供を否定,https://news.yahoo.co.jp/articles/351a310ef6b72b4c320c429030fb3a372ed25492,2/14(金) 22:04
2025-02-15,09:27,local,地域,30,BSS山陰放送,80歳までに3人に1人が発症「帯状疱疹」…ワクチンの「定期接種」4月から開始、接種対象者は?　自己負担額は?　2種類のワクチンをどう選ぶ?,https://news.yahoo.co.jp/articles/1d46d5bc00609b2feffecdad9a62354f5f3bdd72,2/15(土) 8:12
2025-02-15,09:27,local,地域,31,北日本新聞,１９日から富山県内大雪警戒,https://news.yahoo.co.jp/articles/7991a4e42c23d5af053a5ca5641814fae20b7f62,2/15(土) 8:05
2025-02-15,09:27,local,地域,32,埼玉新聞,東武東上線の人身事故…ホームから転落も通過した急行電車と接触せず軽傷　運転見合わせ、最大1時間25分の遅延【鉄道情報】,https://news.yahoo.co.jp/articles/4ea4d623424195a0fa076ce2c91dcece7f068142,2/14(金) 21:00
2025-02-15,09:27,local,地域,33,チューリップテレビ,乗客トラブルの影響で “あいの風とやま鉄道” で一時運転取り止め　中年男性と女子高校生のトラブルの影響　富山,https://news.yahoo.co.jp/articles/4e760f8fe6ea9d1ab304b3fa3bfc74683b0919a0,2/14(金) 18:47
2025-02-15,09:27,local,地域,34,HBCニュース北海道,大型ダンプカーから左後ろ“ダブルタイヤ”2本脱落　巻き込まれた人や車なくけが人なし…50代男性運転手「去年12月に組み替え交換」北海道八雲町,https://news.yahoo.co.jp/articles/0bfdf7b58c9f62d181d1a32e83e34fe6ce1d5771,2/14(金) 20:30
2025-02-15,09:27,local,地域,35,埼玉新聞,血だらけで歩く…倒れ込んだ男らは10～20代、深夜の路上で　通行人が119番、刃物5本を発見　26歳会社員らのグループ、25歳らのグループと包丁で切り合っていた　双方を再び逮捕、住民ら「怖い」,https://news.yahoo.co.jp/articles/7876c6d89bf6544f327ce0d7fcacdf79a8f62b06,2/14(金) 19:49
2025-02-15,09:27,local,地域,36,南日本新聞,値上げが続いてもすぐ売り切れてしまうコメ…備蓄米放出に消費者「品薄解消に期待」　一方で首をかしげる集荷業者も,https://news.yahoo.co.jp/articles/d0e1b0682c1ce72519b028a0a3c04feae1cd800c,2/15(土) 7:00
2025-02-15,09:27,local,地域,37,中国新聞デジタル,「不倫相手を妊娠させた」の高校生を逮捕　詐欺の疑い　広島,https://news.yahoo.co.jp/articles/ca9691b28d342304098aa02cc11ec2a4940ba4d5,2/13(木) 7:07
2025-02-15,09:27,local,地域,38,静岡新聞DIGITAL,沼津の東名、新東名IC周辺に大規模商業施設誘致へ　市、25年度から始動,https://news.yahoo.co.jp/articles/fd4470d11cc73d4f5ce749485ab5acc24f80275f,2/15(土) 8:17
2025-02-15,09:27,local,地域,39,北海道ニュースUHB,【速報】「真っ赤に燃えさかる炎」自動車整備工場で火災…“けが人の情報なし”―現場付近の道路が一部通行止め＜北海道中標津町＞,https://news.yahoo.co.jp/articles/7141ebe05d45f610bb84adab05e27c6f0384f0e3,2/15(土) 1:01
2025-02-15,09:27,local,地域,40,山陰中央新報,特急やくも２号、車両の異常知らせる表示　運転士による処置できず運転取り止め　ＪＲ西日本,https://news.yahoo.co.jp/articles/ed0a7dab86bcc13543baf7bfc9cefa88fe654019,2/15(土) 8:40
