scrp_date,scrp_time,genre_en,genre_jp,rank,media_jp,title,link,date_original
2025-10-13,11:37,domestic,国内,1,産経新聞,川口クルド人迷惑行為「もう限界」引っ越す住民「大物」送還後「おとなしくなった」の声も　「移民」と日本人,https://news.yahoo.co.jp/articles/19305a7300f399cb89e221cd5f3e5e041f134876,10/13(月) 7:00
2025-10-13,11:37,domestic,国内,2,デイリースポーツ,田崎史郎氏　東京、神奈川、埼玉、兵庫で「壊滅的な打撃」が自民に→さらに深刻なのは党員が「せいせいしている」、公明党員もおそらく同じ,https://news.yahoo.co.jp/articles/336df4ace3d2f2eb56fada2a4bca586775c4a3d5,10/13(月) 9:50
2025-10-13,11:37,domestic,国内,3,よろず～ニュース,国民・玉木代表、立憲に安保政策「変更」突き付けた！野田代表「高いところから」発言→深夜の檄文で返答,https://news.yahoo.co.jp/articles/39c61bb09c0c936d6f9faaa4c4f874f7cfc4078e,10/13(月) 6:10
2025-10-13,11:37,domestic,国内,4,日刊スポーツ,自民ベテラン議員が「高市総裁の辞任→総裁選挙やり直し」持論を主張　公明の連立離脱受けて,https://news.yahoo.co.jp/articles/ec79d0ba023bc5169406be4c0c30c36df261fb98,10/13(月) 9:14
2025-10-13,11:37,domestic,国内,5,スポーツ報知,「ＺＩＰ！」出演の同局政治部記者、自公連立崩壊について「高市さんが総裁でなければ公明党の離脱はなかったという声が聞こえてきます」,https://news.yahoo.co.jp/articles/5db1ccc37eb422aba2faef2548a06de8a7136c20,10/13(月) 8:40
2025-10-13,11:37,domestic,国内,6,デイリースポーツ,【連立離脱】元自民幹事長　「首班指名で野党がまとまらず、結果として高市くんが指名されたとしても」→公明が離脱した理由を分析,https://news.yahoo.co.jp/articles/241a5d75951321d6118330bfa1e8de95786bcd83,10/13(月) 10:48
2025-10-13,11:37,domestic,国内,7,スポーツ報知,「今回の局面のキャスチングボートを握っている」…次の総理は誰か？…「モーニングショー」田崎史郎氏がカギを握る政党を解説「ガラっと局面が変わる」,https://news.yahoo.co.jp/articles/4bec32e57c7527e21a3a8fdd9953d4f397e8ab61,10/13(月) 9:50
2025-10-13,11:37,domestic,国内,8,よろず～ニュース,維新・藤田共同代表 万博会場で国民・玉木代表とバッタリ会う 息子たちから「お父さんのおともだち？」,https://news.yahoo.co.jp/articles/c26d21e102b4f0661957c5fb5ef993ba537afaaa,10/13(月) 8:00
2025-10-13,11:37,domestic,国内,9,弁護士JPニュース,「公金を使ってまでやるべきことではない」田久保市長“学歴証明書”提出のルール化、元市議の弁護士が“不合理性”を指摘,https://news.yahoo.co.jp/articles/43abe4de4c212b9986db570c0dcaf78d6954cc8f,10/13(月) 10:40
2025-10-13,11:37,domestic,国内,10,デイリースポーツ,【連立離脱】もし高市総理が誕生したら…「少しでも議席増やす方に賭ける可能性も」青山和弘氏、解散の可能性指摘,https://news.yahoo.co.jp/articles/d645e7bd29422ecffd1e7a9dd3b772e6de02b153,10/13(月) 10:23
2025-10-13,11:37,domestic,国内,11,日刊スポーツ,小沢一郎氏、公明離脱の本当の理由は「高市総裁の『考え方・発想・体質』そのものへの拒否感」,https://news.yahoo.co.jp/articles/58fb0481db0c15688c3c6b28e3c5056f92c50f30,10/13(月) 7:58
2025-10-13,11:37,domestic,国内,12,弁護士ドットコムニュース,「『殺せ』と叫ぶ人と議論できますか？」 クルドから在日コリアンまで……差別と闘う神原元弁護士の問い,https://news.yahoo.co.jp/articles/ce35cc664752971682f9b0c52eac5a5372a5193f,10/13(月) 9:40
2025-10-13,11:37,domestic,国内,13,47NEWS,理論上は本当に実現？「玉木首相」、公明連立離脱で可能性高まるも… 　立民の「秋波」に本人は消極的、なぜ,https://news.yahoo.co.jp/articles/6a5408ea701198c9dbd59d30251395894292f5f3,10/13(月) 11:02
2025-10-13,11:37,domestic,国内,14,産経新聞,公明・斉藤代表、夫婦別姓導入に意欲「やりやすくなる」　自身の不記載は「ミスだ」と陳謝,https://news.yahoo.co.jp/articles/f257db14bcd303505837ff3dec875f6b112572d6,10/13(月) 7:00
2025-10-13,11:37,domestic,国内,15,日刊スポーツ,小沢一郎氏、「自民党は高市君らのかなり右寄りの考え方と決別すべき」　幹事長務めた古巣に苦言,https://news.yahoo.co.jp/articles/ec98b73c39c653aa8e034aef9855dca93a560f86,10/13(月) 8:39
2025-10-13,11:37,domestic,国内,16,共同通信,宮崎の女性刺傷、顔を知っていたと逮捕の男,https://news.yahoo.co.jp/articles/c938e1b007527c2bb49c7a768823630ed004fb2f,10/12(日) 22:06
2025-10-13,11:37,domestic,国内,17,日刊スポーツ,ひろゆき氏持論「自民党を下野させないのが目的なら…高市総裁辞任＆石破首相継続は筋通ってる」,https://news.yahoo.co.jp/articles/74baf9a800853366b326e46dc6f11f2b84ad4293,10/13(月) 8:38
2025-10-13,11:37,domestic,国内,18,デイリースポーツ,【高市自民】公明離脱→難局乗り切る切り札「衆院解散」青山和弘氏が「可能性高い」　岩田明子氏「気持ちはすぐにでも、だが」Ｍｒ．サンデーで,https://news.yahoo.co.jp/articles/4ec8c09b73ac904bd283194e28c41aab6b547f0b,10/12(日) 23:13
2025-10-13,11:37,domestic,国内,19,スポーツ報知,「自民党政権が続くには、ふたつしかない」…次の総理を巡る「シナリオ」…「モーニングショー」田崎史郎氏が解説,https://news.yahoo.co.jp/articles/87507ab9ec4a3a79526c6b1a44de3fc8d81e499e,10/13(月) 9:35
2025-10-13,11:37,domestic,国内,20,デイリースポーツ,玉木代表に「この人は連立政治というものが分かっていないと痛感する」→法政大教授が私見「期限が来れば分かれればよい」,https://news.yahoo.co.jp/articles/43494640ec38d532c9b1e78c1e9af1a60a3a4e7a,10/12(日) 12:10
2025-10-13,11:37,domestic,国内,21,日刊スポーツ,田﨑史郎氏「公明党や創価学会の大事さを感じていない人が多い」自民高市執行部に苦言呈す,https://news.yahoo.co.jp/articles/cec16b2d3e43da0c3029a886a6647494649b8e47,10/13(月) 11:10
2025-10-13,11:37,domestic,国内,22,スポーツ報知,「実現するために野党一本化の中に入りますよ、っていう可能性はあるんですか？」…「モーニングショー」羽鳥慎一アナ、生放送で公明党・西田実仁幹事長に質問,https://news.yahoo.co.jp/articles/03a70f038301df7fd09a04b4b48269793598634f,10/13(月) 10:05
2025-10-13,11:37,domestic,国内,23,弁護士JPニュース,万博“駆け込み需要”爆増で「延長して」の声も…予定通り「閉幕」せざるを得ない“法的障壁”,https://news.yahoo.co.jp/articles/62b8f160516d05f1cbc8efb0c9f0ab7418c6527a,10/13(月) 10:20
2025-10-13,11:37,domestic,国内,24,デイリースポーツ,【連立離脱】橋下徹氏、日曜朝からぶっ込む「なぜ総裁選の途中で主張しなかった？」公明・斉藤代表を直撃「ちょっと違うんじゃないか」,https://news.yahoo.co.jp/articles/ff80e67ad59465db5817861c5cc5a83b516699b7,10/12(日) 17:56
2025-10-13,11:37,domestic,国内,25,日刊スポーツ,公明幹事長が自民党の驚き対応を暴露「残念ながら1度も」連立政権離脱に至る経緯明かす,https://news.yahoo.co.jp/articles/85a9741f9a24053d2594941660f68da5cdc6c7e2,10/13(月) 10:56
2025-10-13,11:37,domestic,国内,26,日刊スポーツ,前澤友作氏怒りの緊急呼び掛け「みんなでこの詐欺師を通報して！」,https://news.yahoo.co.jp/articles/928c64d72e8ef6d92a273bf5275d10ce4cf017cf,10/12(日) 6:55
2025-10-13,11:37,domestic,国内,27,日刊スポーツ,松山千春が要請「宗教法人のお布施とか寄付、これもぜひ税金かけてもらいたいな」,https://news.yahoo.co.jp/articles/a833013da97b114afbc11a45269d71f8a8468106,10/13(月) 6:45
2025-10-13,11:37,domestic,国内,28,産経新聞,自民・船田元氏「石破首相の退陣撤回」「高市氏退き総裁選やり直し」案言及　公明連立離脱,https://news.yahoo.co.jp/articles/88bfa11539841d632bc155e9d340f84758ea72fb,10/13(月) 7:00
2025-10-13,11:37,domestic,国内,29,時事通信,ミャクミャク人気、想定超え　「気持ち悪い」一転大化け　来年3月まで販売延長　大阪・関西万博,https://news.yahoo.co.jp/articles/70d155ebde1f6717323734c32a61b60c11a585f3,10/13(月) 7:10
2025-10-13,11:37,domestic,国内,30,日刊スポーツ,公明党の斉藤鉄夫代表も不記載議員「リハック」で自民党との違い聞かれ「私のミス」連発で釈明,https://news.yahoo.co.jp/articles/ed79b93b2717feb22f8a6bbae7bb8793f673adcb,10/12(日) 11:45
2025-10-13,11:37,domestic,国内,31,デイリースポーツ,【連立離脱】公明党の強気理由「本当の理由は高市さんが総裁になったこと」元ＮＨＫジャーナリスト指摘,https://news.yahoo.co.jp/articles/d4d166e7ceea76f2662dcbfbf9a53918f97f20b6,10/13(月) 10:05
2025-10-13,11:37,domestic,国内,32,朝日新聞,採用時にニセの免許提示容疑、中学補助教員逮捕へ　九州や関東で勤務,https://news.yahoo.co.jp/articles/5aaa2c137d67ed8fa808c594cdcc49a43478b3f7,10/13(月) 8:55
2025-10-13,11:37,domestic,国内,33,ハフポスト日本版,選択的夫婦別姓で、地方議会にも圧力をかけてきた高市早苗さん。「旧姓使用でも困らない」のに夫が高市姓になったのはなぜですか？,https://news.yahoo.co.jp/articles/fe09ca09048d440aa7858b1d2a9ed601645590f5,10/12(日) 9:40
2025-10-13,11:37,domestic,国内,34,FNNプライムオンライン（フジテレビ系）,国民民主・玉木代表「立憲は安保関連法廃止と主張。曖昧にしたまま政権担えると本気で考えているのか。自ら政策変更すべき」,https://news.yahoo.co.jp/articles/971937176eb4c5edbcda0e5a90c1cb743b3a4a9f,10/13(月) 7:09
2025-10-13,11:37,domestic,国内,35,共同通信,高市総裁の対応に問題　自民・船田氏「公明の怒り当然」,https://news.yahoo.co.jp/articles/bc630eaeefb7bc90d3a747ded1a89b10d325f1c1,10/12(日) 19:33
2025-10-13,11:37,domestic,国内,36,tenki.jp,【速報】台風23号の強風域が関東の一部にかかる　台風が離れるまで強風に注意を,https://news.yahoo.co.jp/articles/6c65027ae7e307d0ae89e214528e9293d6e84004,10/13(月) 10:23
2025-10-13,11:37,domestic,国内,37,日刊スポーツ,小沢一郎氏、野党に喝「大同団結の発想に立たなければ万年野党」自公連立解消も政権「獲らない」,https://news.yahoo.co.jp/articles/557f7e39774eabb753d105a1f915bcfc71b0e350,10/13(月) 9:13
2025-10-13,11:37,domestic,国内,38,スポーツ報知,「自民党の議員からは『もう一度考え直してほしい』という声」…公明党「連立離脱」…「モーニングショー」羽鳥慎一アナが伝える,https://news.yahoo.co.jp/articles/54738a8f11e6b3b46c5829d09146cca1b221d29c,10/13(月) 9:10
2025-10-13,11:37,domestic,国内,39,日刊スポーツ,東国原英夫氏が高市早苗氏の「これは称賛されるべきところ」を指摘　岸博幸氏も「凄いところ」,https://news.yahoo.co.jp/articles/aed591734047ba501c1f44de64a576a996daaa6f,10/12(日) 17:16
2025-10-13,11:37,domestic,国内,40,BUSINESS INSIDER JAPAN,ハワイ育ちの私は、ハワイ移住を勧めない。それでも移住したい人が知っておくべき13のポイント（海外）,https://news.yahoo.co.jp/articles/840507359f34b0f47b76c6e8a97f39be714e1773,10/13(月) 7:10
