scrp_date,scrp_time,genre_en,genre_jp,rank,media_jp,title,link,date_original
2025-05-20,03:09,life,ライフ,1,ほ・とせなNEWS,10年の不妊治療を経て生まれた双子。しかし出産後…医師「奥さんが心肺停止しました」　それまでの話を聞いた,https://news.yahoo.co.jp/articles/aac02e7b07a1ce5d9750ecb7ff2ddd6d481533e3,5/19(月) 11:00
2025-05-20,03:09,life,ライフ,2,ねとらぼ,マクドナルド、ハッピーセットの「早期終了」を発表　横行する転売――モラルのない行動に第2弾販売への不安広まる,https://news.yahoo.co.jp/articles/c6b41d7b5f330461f95cbbecde8ee9efc61fb5ec,5/19(月) 12:42
2025-05-20,03:09,life,ライフ,3,大手小町（読売新聞）,低気圧が近づくと頭痛が…気象病への対処法を専門医に聞く,https://news.yahoo.co.jp/articles/c8269d187c125bbd53277f1f5200b99f13d615e0,5/19(月) 12:11
2025-05-20,03:09,life,ライフ,4,メディカルドック,【闘病】”たかが鼻血”がステージ4『鼻副鼻腔がん』だった 嗅覚失い「もっと検査が早ければ…」,https://news.yahoo.co.jp/articles/9ec58f0699e60f2730f07d4d9b3a1707a7f86998,5/18(日) 12:05
2025-05-20,03:09,life,ライフ,5,Hint-Pot,「ネーミングセンスがすごすぎる（笑）」　クマが寝ているタルトの名前が“笑撃”的　京都の洋菓子店で予約打ち切りの大反響,https://news.yahoo.co.jp/articles/43a4635f555c42641c3f88c57239c09fe427cb8c,5/19(月) 19:10
2025-05-20,03:09,life,ライフ,6,ほ・とせなNEWS,高校2年生の春。テスト中「机から顔を上げられない」そのまま担架で運ばれ…1年半後、判明した病とは　その後さまざまな活動に踏み出した女性に迫る,https://news.yahoo.co.jp/articles/38df28e15b8c47ab1ea585249b684a60b5e21056,5/19(月) 8:30
2025-05-20,03:09,life,ライフ,7,デイリースポーツ,国会　お米高騰→石破首相に「ＪＡに忖度しすぎ」「お金、票もらってる」と維新議員が質問　首相反論「忖度してない」「米の値段、いい訳ない。下げます」,https://news.yahoo.co.jp/articles/e6143d201401c72dc48ab34bbc721d139236d1a9,5/19(月) 19:21
2025-05-20,03:09,life,ライフ,8,ねとらぼ,動物病院を頑張った13歳柴犬、飼い主が迎えに行くと……　姿を見た瞬間「パァっ」と笑顔になる姿が324万再生突破　現在どうしてるか飼い主に聞いた,https://news.yahoo.co.jp/articles/a9163b28e81c3e4bc73b3102db1ca84bbc531118,5/19(月) 21:00
2025-05-20,03:09,life,ライフ,9,婦人公論.jp,江原啓之「高齢になり息子夫婦と同居。最初は幸せだったはずが、だんだん居心地が悪くなった。ひとり暮らしに戻るべき？感謝の気持ちを忘れないで」,https://news.yahoo.co.jp/articles/287a101ea14f55473909f379a1ff88aaf602f3e6,5/19(月) 12:32
2025-05-20,03:09,life,ライフ,10,ENCOUNT,自宅の電気を消してわずか5分後…駐車場で愛車プラドのエンジン音　窃盗犯とニアミスも間に合わず,https://news.yahoo.co.jp/articles/455a22d0998a7786eb02b53b660f7f7c88709567,5/19(月) 19:21
2025-05-20,03:09,life,ライフ,11,トラベル Watch,ユニクロ、夏先取り「感謝祭」セール5月23日から。UVカットパンツなど特価1000円引き,https://news.yahoo.co.jp/articles/9f4500cf2d176bf5fc312060e8f2cd60543b872d,5/19(月) 20:21
2025-05-20,03:09,life,ライフ,12,ねとらぼ,「このトートだけでいい」アフタヌーンティーの“無重力トート”が快適すぎる「本当に軽く持ちやすい」「一目惚れして即決」,https://news.yahoo.co.jp/articles/365e9408925398f8779ac3977269cda6420e6cb1,5/19(月) 19:15
2025-05-20,03:09,life,ライフ,13,ねとらぼ,ペットショップセール価格でも売れ残り、檻の中で高速に行ったり来たりしていた柴犬→家族に迎えて5年後……　笑顔あふれるビフォーアフターに反響,https://news.yahoo.co.jp/articles/06850c15669b5c7f1667cb967f149a6ca3c0de25,5/18(日) 21:35
2025-05-20,03:09,life,ライフ,14,ねとらぼ,白猫だと思っていた子猫→4年後……　「ええええ」飼い主も驚いた“現在の姿”が472万再生「不思議ですね～」,https://news.yahoo.co.jp/articles/a83af912b0335d31cc7f9059f8214ab8f76b9d3e,5/17(土) 20:00
2025-05-20,03:09,life,ライフ,15,LIMO,「とにかく小さい！」無印良品の“三つ折りミニ財布”に高評価の声多数！「かさばらない」「カードも入る」,https://news.yahoo.co.jp/articles/98ab941261e47ef48533c53abf4a394d370227d4,5/19(月) 20:32
2025-05-20,03:09,life,ライフ,16,メディカルドック,大腸がんを防ぐ「大腸カメラ」を受けるべき人の特徴はご存じですか? 医師が徹底解説,https://news.yahoo.co.jp/articles/b414d98a6fd0824087254448af1ed735c08ec1bc,5/19(月) 19:30
2025-05-20,03:09,life,ライフ,17,ファイナンシャルフィールド,家の「Wi-Fiルーター」は24時間365日つけっぱなしです。当然と思っていたのですが「電気代が1万円くらいかかるのでは？」と不安になってきました。年間の電気代はどれくらいになるのでしょうか？,https://news.yahoo.co.jp/articles/2e4e534b17a9deaf5c8941269d242314654c7a39,5/15(木) 12:50
2025-05-20,03:09,life,ライフ,18,ねとらぼ,築50年、薄暗かった実家の玄関→4年かけてDIYしたら……「これがあの家…？」　様変わりした空間に反響,https://news.yahoo.co.jp/articles/7741a8e1009bb5c3a2a0bf1758cf053bded9b7ab,5/19(月) 20:35
2025-05-20,03:09,life,ライフ,19,ねとらぼ,築36年の家の“古臭いスイッチプレート”→ディズニー仕様に大変身！　夢あふれるDIYに「すごーい」「ワクワクするね」,https://news.yahoo.co.jp/articles/930866214354d936a1dbb6624bbd73dfaa02f7e4,5/17(土) 11:00
2025-05-20,03:09,life,ライフ,20,産経新聞,苦境で減給宣言も従業員から予想外の反応　市場への支払いができず、最大のピンチに　話の肖像画　スーパー「アキダイ」社長・秋葉弘道＜17＞,https://news.yahoo.co.jp/articles/3ac2e4277397802da0473d6273ef82920e234d76,5/19(月) 12:00
2025-05-20,03:09,life,ライフ,21,ねとらぼ,VTuber「焼きそばのサイズどうしよう？」→店員「あ、じゃあ……」　まさかの提案に「ん？？？」「ちょっと待て」,https://news.yahoo.co.jp/articles/809c8a5cabf3dbb689e1472208c278a04aae8563,5/19(月) 19:30
2025-05-20,03:09,life,ライフ,22,ねとらぼ,「夏はこれしか着ていないw」　ユニクロの“リピ買い続出T”が便利すぎる　「着崩れしない」「気に入ったので再度購入」,https://news.yahoo.co.jp/articles/8edb753e01c23daebb91dc424d1f3019e886d398,5/19(月) 10:00
2025-05-20,03:09,life,ライフ,23,CanCam.jp,【ぼる塾】あんりさんが「このために鹿児島にきた！」と言うほど溺愛するご当地グルメ,https://news.yahoo.co.jp/articles/41ea853b001e2ff1a0cab5bec0ec04e79e283d9c,5/18(日) 21:10
2025-05-20,03:09,life,ライフ,24,ねとらぼ,「通算10着購入してる」　ユニクロの“快適ルームパンツ”が手放せない！　「夏は毎年履いてる」「ノンストレスで履ける」,https://news.yahoo.co.jp/articles/385e45788308c10d651c54c52888c462b6b5ea20,5/19(月) 21:15
2025-05-20,03:09,life,ライフ,25,婦人公論.jp,不登校になる4つの理由を専門家が解説。卒業に関する「誤解」は意外と多い？「公立の小中学校なら、たとえ1日も通えなくても…」,https://news.yahoo.co.jp/articles/0b5dd9bfbc1d39034cbbcbc6e3ee024e4b103fa2,5/19(月) 12:32
2025-05-20,03:09,life,ライフ,26,めざましmedia,「待ってました〜!」サーティワン話題の『よくばりフェス』を今年も開催!アイス最大10個の超お得キャンペーンに「冷凍庫のスペース空けておきます!」,https://news.yahoo.co.jp/articles/003a48ad3d624d510c535a6fba1456416a048863,5/19(月) 14:09
2025-05-20,03:09,life,ライフ,27,ねとらぼ,「一択です」主婦が推す“最強の歯磨き粉ブランド”に絶賛の声「今後も購入します」「1カ月後にはくすみが取れてました」,https://news.yahoo.co.jp/articles/1437d96f8c321e6cae27d6b0b6ef93092eb91410,5/19(月) 18:00
2025-05-20,03:09,life,ライフ,28,ねとらぼ,リアル富江!?　“伊藤潤二の漫画に出てきそう”な顔の女性が話題に　「激似ですやん」「2枚目特にそれ」,https://news.yahoo.co.jp/articles/9c5e1dfea8e6bc9302a6660870314bec4e7790fa,5/19(月) 20:10
2025-05-20,03:09,life,ライフ,29,ほ・とせなNEWS,じいじに会いに行った孫　じいじを見つけた瞬間…「かわいい」「涙出てきた」「こりゃたまらん」,https://news.yahoo.co.jp/articles/e06839596a8dcf37406555ae6b0b13412090b144,5/18(日) 7:30
2025-05-20,03:09,life,ライフ,30,ねとらぼ,セリアのクリアファイルフレームを改造→糸を通していくと……　完成した“まさかのアイテム”に「アイデアすごい」「私もやってみたい」,https://news.yahoo.co.jp/articles/25589d13d8b7e7a8fa91a2a3f433e55c7bb05448,5/19(月) 10:30
2025-05-20,03:09,life,ライフ,31,ねとらぼ,モンハンワイルズでエヴァに登場する“みんなのトラウマ”を再現したら……　「これはアカン」「悪魔の所業」完成度が高すぎて話題に,https://news.yahoo.co.jp/articles/c9ffc7a3ba4f3d5d935df6664b08ce69253a3cf7,5/18(日) 20:30
2025-05-20,03:09,life,ライフ,32,ねとらぼ,小5のときに描いた絵→4年後……　「ねぇ何があったん？」「鳥肌立った」中3になって描いた絵が160万再生,https://news.yahoo.co.jp/articles/46c4438453f80b616aabd123ff7cd65b2f7ca9d6,5/13(火) 19:00
2025-05-20,03:09,life,ライフ,33,ねとらぼ,「アムロ専用ザクか……」 ガンダムが奪われた世界でアムロが乗る機体を“妄想したガンプラ”に反響　「すごく“ありそう”」,https://news.yahoo.co.jp/articles/6ffe5c427080f7d3b8f54376121a356789c365b2,5/18(日) 17:10
2025-05-20,03:09,life,ライフ,34,ねとらぼ,散歩中、通行人を笑顔にした柴犬→“自由すぎる行動”に飼い主は苦笑い「ひゃーーー」「自然と目じりが下がる」,https://news.yahoo.co.jp/articles/14b97d387d8743d6c0ac943d53dc2a503776e698,5/19(月) 15:00
2025-05-20,03:09,life,ライフ,35,BuzzFeed Japan,ホテルの朝食みたい！びっくりドンキーの「贅沢モーニング」3選。朝から幸せなおいしさ《実食レビュー》,https://news.yahoo.co.jp/articles/6f9071af3782b99f384b7bd0e84675dcd6fb3f45,5/19(月) 10:35
2025-05-20,03:09,life,ライフ,36,ファイナンシャルフィールド,メイン口座の残高が「200万円」になったので、「貯金用の口座」に「移動」させたいです。一度に移したらなにか問題はありますか？,https://news.yahoo.co.jp/articles/2dc82ab2b42c4662c73a46bc0f32aca409bc7865,5/16(金) 18:10
2025-05-20,03:09,life,ライフ,37,ねとらぼ,小5のとき買った“裁縫セット”→40年後……　同世代「私もコレだった！」　現役バリバリの姿に「すごい」,https://news.yahoo.co.jp/articles/c79b8ff25f9d065d70acd7bc8a14828391013392,5/18(日) 12:20
2025-05-20,03:09,life,ライフ,38,BuzzFeed Japan,【ファミマ】重量感がすごい！コスパばつぐんの「168円ケーキ」拳よりデカいサイズだし、クリームたっぷりで大満足《実食レビュー》,https://news.yahoo.co.jp/articles/5f66b12502156cfe25972ff7f54d5106ced1d7d7,5/19(月) 20:05
2025-05-20,03:09,life,ライフ,39,ねとらぼ,「大人バルーンって感じがいい」　GUの“2290円ワンピ”がお値段以上のかわいさ　「全色そろえようかな」「高見えする」,https://news.yahoo.co.jp/articles/21c4f4c29c1bd9eda637310f8454af2cb6b9a0a7,5/19(月) 21:20
2025-05-20,03:09,life,ライフ,40,magacol,本当は教えたくない社長秘書の手土産【2025春の個包装の洋菓子3選】｜CLASSY.,https://news.yahoo.co.jp/articles/b0b23eeae1aa5802cf6497f3dc826132a366efab,5/19(月) 19:30
