scrp_date,scrp_time,genre_en,genre_jp,rank,media_jp,title,link,date_original
2025-05-20,17:10,domestic,国内,1,FNNプライムオンライン（フジテレビ系）,維新・藤田氏「誰が決めたんですか!吉村さんの意向ですか?」参院選“目標6議席”に異論　党会合で執行部に直言,https://news.yahoo.co.jp/articles/3b594dd6236be4b97a21d9483d6b7b9994a56005,5/20(火) 14:52
2025-05-20,17:10,domestic,国内,2,FNNプライムオンライン,タワマン住民の男性転落　自ら飛び降りの可能性高い　巻き込まれた自転車の男性と2人とも死亡,https://news.yahoo.co.jp/articles/b955315bfef84f695bcc67ef3f9f154be977cfe9,5/20(火) 14:37
2025-05-20,17:10,domestic,国内,3,西日本新聞,「黒いやつ、石とか入っている」もう一つの農相発言、コメ農家から怒りの声広がる,https://news.yahoo.co.jp/articles/6df6dd97a39e8ac7b20ddb5862c8a10491385e28,5/20(火) 15:30
2025-05-20,17:10,domestic,国内,4,日刊スポーツ,江藤農相が珍妙釈明「『売るほどある』は宮崎弁的な言い方」コメ失言で「言い訳はしたくないが」,https://news.yahoo.co.jp/articles/b8591eac0373dad331391539afd2cdbb3c6d9d9b,5/20(火) 11:46
2025-05-20,17:10,domestic,国内,5,J-CASTニュース,JR川口駅に上野東京ライン停車で考える　「中距離電車」は首都圏のどの駅にストップすると便利か,https://news.yahoo.co.jp/articles/d9ab8948dd26e05622d2de46d26ec3f9c510e673,5/19(月) 17:00
2025-05-20,17:10,domestic,国内,6,FNNプライムオンライン,「まさに政治の怠慢そのもの」ジャーナリスト青山和弘氏が指摘する“骨抜き”年金改革の大罪　国会審議なしで社会保険料は25年で1.5倍に!このままでは「生活保護をもらうほうが暮らしが安定する」という事態に,https://news.yahoo.co.jp/articles/9c41471b75c9188c5c5730d55e7e437e0740de65,5/20(火) 13:19
2025-05-20,17:10,domestic,国内,7,東海テレビ,乗用車で自転車の55歳男性をはねて重傷負わせ逃走か 現場に現れた83歳会社役員の男逮捕 容疑を否認,https://news.yahoo.co.jp/articles/e7c8462b1c94a2499d69ba2cfdea9c00a7a00f29,5/20(火) 16:00
2025-05-20,17:10,domestic,国内,8,朝日新聞,吉川友梨さんの幼なじみが刑事に　警察官になって強くなった思い,https://news.yahoo.co.jp/articles/a31eed5e6f58352afbefe092541b33b852f599ae,5/20(火) 5:00
2025-05-20,17:10,domestic,国内,9,スポニチアネックス,小泉進次郎氏　「コメはもちろん買ったことがあります」　江藤農相の不適切発言に言及,https://news.yahoo.co.jp/articles/f117b2f4fe9ddb25b98ca8cea6ef9c0f79d08322,5/20(火) 15:38
2025-05-20,17:10,domestic,国内,10,弁護士ドットコムニュース,江藤農相「コメを買ったことがない」発言が波紋…　賄賂にあたる可能性は？,https://news.yahoo.co.jp/articles/0d9d88ca41c010347dd32c995a896c03935308f4,5/20(火) 16:11
2025-05-20,17:10,domestic,国内,11,朝日新聞,5歳女児「両親がけんか」集合住宅で男女2遺体見つかる　大阪・池田,https://news.yahoo.co.jp/articles/e95b42d0c88dc74eeecbbb4050ed7b70f55adcd0,5/20(火) 16:13
2025-05-20,17:10,domestic,国内,12,J-CASTニュース,原爆投稿問題でホンダがスポンサー契約解除を決定　3日前から一転「『人間尊重フィロソフィー』と相容れない」,https://news.yahoo.co.jp/articles/3a0d1df453c8a0253c7d09da65b0f1246d822895,5/19(月) 16:16
2025-05-20,17:10,domestic,国内,13,産経新聞,＜独自＞新名神逆走で逮捕のペルー人男も「外免切替」　相次ぐ重大事故　警察庁見直し検討,https://news.yahoo.co.jp/articles/014091fa456e4ef7c50dbfabc1e602f65c45b489,5/20(火) 15:22
2025-05-20,17:10,domestic,国内,14,京都新聞,【速報】京阪本線などが全線で運転見合わせ　人身事故で、運行再開時期は未定,https://news.yahoo.co.jp/articles/706aed729a3d322d619d97aa5783b642d1931de6,5/20(火) 16:24
2025-05-20,17:10,domestic,国内,15,日刊スポーツ,山尾志桜里氏に「反省すべきは反省し説明すべきは説明」国民・玉木代表、比例擁立批判に言及,https://news.yahoo.co.jp/articles/e7d9ae126174b919ac0d92cde44ac9bc436f8907,5/20(火) 14:24
2025-05-20,17:10,domestic,国内,16,関西テレビ,【速報】吉川友梨さん行方不明事件から22年 警察が新たな不審車両の画像公開　トヨタ「カムリ」と日産「セドリック」　男が車内から下校中の小学生を見ていた目撃情報も,https://news.yahoo.co.jp/articles/346b0afdcba6c66a1eeb6e42f51b49e1686e6349,5/20(火) 13:00
2025-05-20,17:10,domestic,国内,17,ABEMA TIMES,江藤農水大臣「YouTubeであるとかSNS系を朝明るくなるまでずっと見ました」“米発言”をめぐり改めて謝罪,https://news.yahoo.co.jp/articles/cf4f9387569468c9027e0d9c12c8ab217e24ad59,5/20(火) 11:54
2025-05-20,17:10,domestic,国内,18,朝日新聞,吉川友梨さん不明1カ月前、黒の乗用車内から下校中の小学生を見る男,https://news.yahoo.co.jp/articles/62fc4c6f6bf8c626eae81c25e73def6590e1d561,5/20(火) 13:00
2025-05-20,17:10,domestic,国内,19,ABEMA TIMES,「ちいかわ」ハッピーセットに殺到…買い占め＆転売どう規制？専門家「世論が“転売ヤー憎し”一辺倒では解決しない」「販売側に対策を」,https://news.yahoo.co.jp/articles/aeb10c0644d5b25855a6c41df94230e6d588e9d7,5/20(火) 14:16
2025-05-20,17:10,domestic,国内,20,ABEMA TIMES,「お米は高いと感じますか？」JA全農の広告が物議…ネットでは批判の声「価格を下げる努力を放棄している」,https://news.yahoo.co.jp/articles/293908d2f5ffb9563486c68c77bfed426542ba05,5/20(火) 11:32
2025-05-20,17:10,domestic,国内,21,TBS NEWS DIG Powered by JNN,小泉進次郞氏　企業の食事補助に対する非課税枠引き上げに前向き「“骨太”に明記し必ず実現」,https://news.yahoo.co.jp/articles/f1065917947451e0baef3bb20ea16df0c40dbca3,5/20(火) 15:57
2025-05-20,17:10,domestic,国内,22,弁護士ドットコムニュース,福岡の伝統校で「威圧的な校歌指導」、わずか8カ月で中退…文筆家の西田藍さんが語る高校時代の恐怖,https://news.yahoo.co.jp/articles/6a1a3b9199f0cb54df09c38837db2c35462684bb,5/18(日) 9:44
2025-05-20,17:10,domestic,国内,23,TBS NEWS DIG Powered by JNN,疲れやすい・イライラ・憂うつ…生活習慣や薬で緩和できる?「更年期」との上手な付き合い方【ひるおび】,https://news.yahoo.co.jp/articles/746b03ef16dbaba6a7057a5a3a31b4289f9799f3,5/19(月) 16:57
2025-05-20,17:10,domestic,国内,24,朝日新聞,玉木氏「本当に申し訳ない気持ち」　参院選候補擁立で批判相次ぎ,https://news.yahoo.co.jp/articles/57695f1e07e47171bed17a2d8a63ee698240c128,5/20(火) 12:54
2025-05-20,17:10,domestic,国内,25,時事通信,自民・小泉氏、日産工場閉鎖で説明要請,https://news.yahoo.co.jp/articles/881337a26cc54a5f2d7f2fbd0c231e7006e94a27,5/20(火) 15:54
2025-05-20,17:10,domestic,国内,26,産経新聞,三郷ひき逃げ、逮捕の中国人男は「外免切替」　中国で免許取得、数年前に日本で切り替え,https://news.yahoo.co.jp/articles/1cf85c0a8ec693a5c3f6b2c5b1d4eef027b51a96,5/20(火) 15:13
2025-05-20,17:10,domestic,国内,27,J-CASTニュース,蓮舫氏が痛烈批判「こりゃ、ないわ」「呆れる」　江藤拓農水相の「コメ買ったことはない」発言＆釈明に,https://news.yahoo.co.jp/articles/f9bc7b75a8746efe85315ee746110218f112ff6d,5/20(火) 14:10
2025-05-20,17:10,domestic,国内,28,朝日新聞,国民・榛葉氏、農水相発言に「即刻辞めるべき」　玉木氏と異なる認識,https://news.yahoo.co.jp/articles/f909c3f6fe5721421d9234717806b85f5a86e84b,5/20(火) 16:45
2025-05-20,17:10,domestic,国内,29,産経新聞,〝西部劇的カウボーイ〟の米国が「決闘で敗北」…本気の日本、安保理で決議廃案に追い込む　国際舞台駆けた外交官　岡村善文氏（60）,https://news.yahoo.co.jp/articles/1d9d9e6dc9ba3748826b0a62805e5e42739521af,5/20(火) 13:00
2025-05-20,17:10,domestic,国内,30,共同通信,万博、東ゲート入場が西の3倍超　想定と逆、来場者増へ懸念,https://news.yahoo.co.jp/articles/05d51732524b32385fc542f68e0c411ffc8b83cf,5/20(火) 5:47
2025-05-20,17:10,domestic,国内,31,TBS NEWS DIG Powered by JNN,江藤農水大臣発言で小泉進次郞氏「国民の不信感払拭する重い責任、団体などに気を遣う姿勢を変え消費者目線の改革を」,https://news.yahoo.co.jp/articles/89ced6d091e3f5af0d13f44f6586e155462a0864,5/20(火) 15:58
2025-05-20,17:10,domestic,国内,32,朝日新聞,江藤農水相「ニュースやSNSを朝まで見た。国民の憤慨を見た」,https://news.yahoo.co.jp/articles/3edf4cef141820491dfb5a65b191567f4204ac92,5/20(火) 8:21
2025-05-20,17:10,domestic,国内,33,テレビ朝日系（ANN）,約10億円の売り上げ…悪質リフォーム詐欺疑いで会社社長ら5人を逮捕　神奈川県警,https://news.yahoo.co.jp/articles/2d8222137eb2763a3dddaa0dffd69d7485e6379f,5/20(火) 14:47
2025-05-20,17:10,domestic,国内,34,読売新聞オンライン,東京・上野で電柱の変圧器から出火、５２０軒が停電…ビルのエレベーター閉じ込めも発生,https://news.yahoo.co.jp/articles/ab8a2a3b393d3d33d59b222982ae5bde8e32975f,5/20(火) 15:47
2025-05-20,17:10,domestic,国内,35,中日スポーツ,大阪・関西万博、バルト館が『ミャクミャク館』に！？　マスコット盗難で「供える」人々が相次ぐ,https://news.yahoo.co.jp/articles/9c4cb9441c0a0d2ce19f5abecf453fe312dbfc1c,5/20(火) 13:02
2025-05-20,17:10,domestic,国内,36,朝日新聞,いわき信組の架空融資、財務相「厳正に対応」　震災後200億円注入,https://news.yahoo.co.jp/articles/05a65ad7aa9473cd6ca8ff1eb98920c1ad03cc2e,5/20(火) 11:26
2025-05-20,17:10,domestic,国内,37,J-CASTニュース,少年3人組、見張りつきでポケカ万引きか　店が防犯カメラの画像公開→来店して身柄確保、警察が連行,https://news.yahoo.co.jp/articles/46248ac5183a1a67e5fd212cf38ecf2e630331ab,5/13(火) 18:26
2025-05-20,17:10,domestic,国内,38,弁護士ドットコムニュース,ちいかわ「ハッピーセット」販売終了…転売目的で買い占め、法的に問題ない？「最低じゃん」の声も,https://news.yahoo.co.jp/articles/b0327e9113501374719d4c10eff3ad52aeb65ad3,5/19(月) 18:47
2025-05-20,17:10,domestic,国内,39,読売新聞オンライン,企業で働きながら有事に駆け付ける「即応予備自衛官」制度、定数の半分割り込む事態に,https://news.yahoo.co.jp/articles/1bb6ecd336b1e2ca0ff9925dd030d12227b4facc,5/20(火) 10:15
2025-05-20,17:10,domestic,国内,40,ABEMA TIMES,国民1人が毎日おにぎりを1つ捨てている？コメ不足・価格高騰でも減らない“大量廃棄”を専門家が解説,https://news.yahoo.co.jp/articles/d3d2d7cc1a06a033e4fc627ab216e674d335462f,5/20(火) 12:32
