scrp_date,scrp_time,genre_en,genre_jp,rank,media_jp,title,link,date_original
2024-03-19,15:21,TTL,総合,1,スポーツ報知,「別人」みのもんた７９歳の激変姿にネット衝撃…「めざまし８」で取材映像,https://news.yahoo.co.jp/articles/5c0dac02298a0d1f40e9a478b49bc783e1045784,3/19(火) 10:55
2024-03-19,15:21,TTL,総合,2,ENCOUNT,年収6000万円からの急転落、突然の離婚　どん底を経験したレジェンド漫画家の栄光と挫折,https://news.yahoo.co.jp/articles/87d937f22b3375f688f9c270028812caf3f301f6,3/19(火) 10:20
2024-03-19,15:21,TTL,総合,3,Bloomberg,日銀が17年ぶり利上げ決定、世界最後のマイナス金利に幕－ＹＣＣ廃止,https://news.yahoo.co.jp/articles/c087378a4bd49686a1c061041cd1eeb3f4004f2c,3/19(火) 12:39
2024-03-19,15:21,TTL,総合,4,スポニチアネックス,「大谷翔平さん、真美子と結婚できて逆にラッキー！」馬瓜エブリン、ベタ褒め　「真美子って本当に…」,https://news.yahoo.co.jp/articles/3c4c47fc59533b924f0c1c71126c8058edad052e,3/19(火) 10:26
2024-03-19,15:21,TTL,総合,5,東スポWEB,ロス在住の飯島真理　大谷の妻を「映すのやめて」の声に「大リーガーの家族になるのはそういう事」,https://news.yahoo.co.jp/articles/962113a1663d9d0348fe152c33e9017c7fa2b107,3/19(火) 11:16
2024-03-19,15:21,TTL,総合,6,中日スポーツ,大谷翔平の妻・真美子さん、左手薬指の指輪に注目集まる「高そう」 谷原章介はフィーバーに苦笑い「まず2人でゆっくりしてほしいよ」,https://news.yahoo.co.jp/articles/fdbda1de7d6d84b9a4f974b8c8825dc705a97481,3/19(火) 11:48
2024-03-19,15:21,TTL,総合,7,まいどなニュース,神戸大のサークルが旅館で迷惑行為？　胴上げして天井に大穴　破った障子から顔を出して撮影　大学当局「事実確認を始めた」　,https://news.yahoo.co.jp/articles/17c3c72244def9dcd56426edf8580c78c6f1681b,3/19(火) 12:15
2024-03-19,15:21,TTL,総合,8,まいどなニュース,「自宅に届いたレターパック」→品名にまさかの文字！　元バス運転手、ショックで動けず「これって法的に有効なの？」,https://news.yahoo.co.jp/articles/b4593ad953a4d5df624e585d352143d4003a4448,3/19(火) 8:10
2024-03-19,15:21,TTL,総合,9,デイリースポーツ,「ＤｅＮＡと連絡取っている」バウアーに新事実　メキシカンリーグ５登板限定契約は途中破棄可能　パワハラ疑惑で楽天解雇の安楽と同僚に,https://news.yahoo.co.jp/articles/c4183c70b20d00a433f86642a765f8d205c6b503,3/19(火) 13:47
2024-03-19,15:21,TTL,総合,10,スポーツ報知,真美子夫人の左手薬指にはきらりと光る指輪が　１０００億円男が贈った超高級品か,https://news.yahoo.co.jp/articles/d8ee39b546352c70f313a6ae7bcf1b57641d0fb1,3/18(月) 22:34
2024-03-19,15:21,TTL,総合,11,Full-Count,水原通訳が「めっちゃ飲んでる！」　“ストイックすぎる”大谷の正面で…置かれた缶に注目,https://news.yahoo.co.jp/articles/85326abd7b663ea3443cc89ce8ced27a258111f7,3/19(火) 9:24
2024-03-19,15:21,TTL,総合,12,J-CASTニュース,ライブ中下向いて携帯...「見る気無いなら外出ろや」　人気バンドボーカルの苦言に賛否「失礼で最悪」「曲が魅力ないから」,https://news.yahoo.co.jp/articles/7be652ba06acd41a239318b084162059a3da3f51,3/18(月) 15:08
2024-03-19,15:21,TTL,総合,13,TNCテレビ西日本,博多女子中学の出願ミス　高校側が３月中旬に受験機会を設ける救済措置　生徒に落ち度がないこと考慮,https://news.yahoo.co.jp/articles/565eb8486e2442d4de023dad08004560ea1281eb,3/19(火) 11:12
2024-03-19,15:21,TTL,総合,14,モデルプレス,大谷翔平選手の妻・元バスケ選手の田中真美子さん、昨年の現役引退理由についての“返答”が話題「素敵」「気遣いが見える」,https://news.yahoo.co.jp/articles/12d6a6686d2d056658c647651a1c953e2410c02e,3/19(火) 14:25
2024-03-19,15:21,TTL,総合,15,超WORLDサッカー！,「史上最悪」「恥ずかしい」伝統の市松模様が史上最大サイズになったクロアチアの新ユニフォームには酷評の嵐「これ以上酷いものは見たことがない」,https://news.yahoo.co.jp/articles/3bf113cb4de84b3ca73377e6a9a1677d228a0e72,3/19(火) 11:50
2024-03-19,15:21,TTL,総合,16,デイリースポーツ,甲子園　なぜ？挟殺プレーで三走が「３フィート」超えもアウト判定ならず　元審判員がルール解説「間違いなくアウトになっていたプレイ」,https://news.yahoo.co.jp/articles/1cc2d40a687ac1a13c49a4ed33e6041a102e7621,3/19(火) 10:43
2024-03-19,15:21,TTL,総合,17,TBS NEWS DIG Powered by JNN,ダルビッシュ有、12年のメジャー生活で経験した知られざる苦悩明かす「妬む人もいるんで、嫌味言ってきたりとか」,https://news.yahoo.co.jp/articles/57ef7ab80536639516772129492e99d9a38eca52,3/18(月) 17:02
2024-03-19,15:21,TTL,総合,18,くるまのニュース,「クルマの駐車」 なぜ“真っすぐ”駐められない？バック駐車をきれいに決めるコツ… プロが伝授,https://news.yahoo.co.jp/articles/b48a645f1211310f8c46abb038d8299d312524d8,3/19(火) 11:00
2024-03-19,15:21,TTL,総合,19,デイリースポーツ,うっかり！フジ原田葵アナ「何卒」を「なにそつ」あいさつ　港社長から指摘か　談笑中に超赤面,https://news.yahoo.co.jp/articles/3f97727630524eaa00f2564bf23f080fb828849d,3/19(火) 14:24
2024-03-19,15:21,TTL,総合,20,Bloomberg,銀行業界に追い風、「金利ある世界」が到来－稼ぎにくさは変わらず,https://news.yahoo.co.jp/articles/335f67abc547423c5ead0c3e6ccdc34de6be2f07,3/19(火) 13:11
2024-03-19,15:21,TTL,総合,21,テレビ朝日系（ANN）,「中国一の富豪」不買運動でピンチ　“日本びいきだ”批判殺到　不景気が背景に？,https://news.yahoo.co.jp/articles/7fdf4ce308c8c35d4bdd0b2c4979a4f6bdf23628,3/19(火) 11:46
2024-03-19,15:21,TTL,総合,22,ねとらぼ,「あなたが1年を通して観察した生物を1つかきましょう」小4のテスト解答が秀逸　「天才！」「神回答と神対応」と話題,https://news.yahoo.co.jp/articles/fcac6ad3714740f0c0bd43961b430a10cc5fbd35,3/19(火) 11:37
2024-03-19,15:21,TTL,総合,23,ABEMA TIMES,「入学式の撮影カメラマン」Xで募集→「親として怖いしかない」などと炎上 背景に「ブラックすぎる待遇」か,https://news.yahoo.co.jp/articles/83235ae7dcebb2d6b5a07693773988a59a844837,3/19(火) 12:24
2024-03-19,15:21,TTL,総合,24,日刊ゲンダイDIGITAL,経歴ハイスペでも超自然体…大谷翔平の妻・田中真美子さんに憧れる女性が急増中のワケ,https://news.yahoo.co.jp/articles/c559785dfdc24f85f43bb0d238658f4d79d3b171,3/19(火) 10:32
2024-03-19,15:21,TTL,総合,25,スポニチアネックス,【センバツ】明豊が劇的サヨナラ勝利　9回に4番・石田が決めた！1－0決着は3年ぶり,https://news.yahoo.co.jp/articles/76d7210fe7dcf263df248781ab80f31b4cfb0ac9,3/19(火) 14:30
2024-03-19,15:21,TTL,総合,26,ねとらぼ,お迎えに来たパパを見つけた息子、次の瞬間……！　240万いいねを集めたリアクションに「全世界共通なんだな」【海外】,https://news.yahoo.co.jp/articles/36c46294db6bf45ea0be611844b2496a1723b197,3/19(火) 12:35
2024-03-19,15:21,TTL,総合,27,スポニチアネックス,だいたひかる夫、左手に異変　指先がマヒ…脳のCT検査も原因不明　既に10日経過「悪化してきた」,https://news.yahoo.co.jp/articles/42498609604c769344e1ce3c8332d6a6211b2a72,3/19(火) 11:10
2024-03-19,15:21,TTL,総合,28,日テレNEWS NNN,【イチからわかる】マイナス金利解除で大規模金融緩和は転換点に…わかりやすく学ぶ「超低金利」の歴史と今後の課題,https://news.yahoo.co.jp/articles/ea515f7b008528349347c40e4b7605cf9cadc6db,3/19(火) 12:53
2024-03-19,15:21,TTL,総合,29,センバツLIVE！,死球受けた主将は「行きます」と　阿南光監督の涙　センバツ,https://news.yahoo.co.jp/articles/9572294132f5488de13a2a03523e00e63d3be19e,3/19(火) 13:26
2024-03-19,15:21,TTL,総合,30,Rallys,伊藤美誠、4ランク上昇でトップ10返り咲き　国際大会V・中国の王曼昱が2位に｜卓球女子世界ランキング（2024年第12週）,https://news.yahoo.co.jp/articles/09be4beb32094b0e193f88553d501d3d631cdadb,3/19(火) 12:09
2024-03-19,15:21,TTL,総合,31,Hint-Pot,「全然味が違う」　アメリカ人が日本のグルメを絶賛　6歳の男の子がハマったものとは,https://news.yahoo.co.jp/articles/32fa950b093efc9771efd69231d834780deb9cda,3/19(火) 8:10
2024-03-19,15:21,TTL,総合,32,まいどなニュース,「どなたか犬をもらって下さい」と張り紙…荒れはてた一軒家に12匹の犬が置き去り、動物愛護団体が保護　妊娠した犬が2匹も「命をなんだと思ってるんだろう」,https://news.yahoo.co.jp/articles/255035205c162e83a550d79e421214f1d5b2da5f,3/19(火) 14:20
2024-03-19,15:21,TTL,総合,33,オリコン,母が心配になって見に行くと…わんこの添い寝で泣き止む2名の赤ちゃん「もう絶対自分の子だと思ってるｗｗ」「理想の子育て環境」,https://news.yahoo.co.jp/articles/6c071c8067fc913ed4d2e0205cbf26ebfe0579a2,3/19(火) 8:10
2024-03-19,15:21,TTL,総合,34,九州朝日放送,女子高生をナンパ後”性行為”　男性２人不起訴に,https://news.yahoo.co.jp/articles/238db0ffbb304e47bd241065d21e30e5ec31e373,3/18(月) 19:00
2024-03-19,15:21,TTL,総合,35,デイリースポーツ,受験不合格のゆたぼんに「高認→医学部受験」提案　著名医師が呼びかけ「高校なんか行かずに」,https://news.yahoo.co.jp/articles/8b76459d148f3b6b1c4649c9b30fff3647bb6609,3/15(金) 21:33
2024-03-19,15:21,TTL,総合,36,朝鮮日報日本語版,MLB：大谷翔平の妻・真美子さん、義母と一緒に高尺ドームで観戦,https://news.yahoo.co.jp/articles/7deeba78598d87bf058a801809e3145d1e600499,3/19(火) 11:15
2024-03-19,15:21,TTL,総合,37,神戸新聞NEXT,高齢女性宅にいた24歳女に「あなた詐欺でしょ。出て行って」　工事で訪問した職人が不審に感じ通報、被害防ぐ,https://news.yahoo.co.jp/articles/db38a11a6291ada8724aa36557429f9e5649fc31,3/18(月) 23:45
2024-03-19,15:21,TTL,総合,38,スポーツ報知,本田真凜さん、「うれしいご報告です！」正装した最新姿に「おめでとう」「笑顔が最高にかわいい」の声,https://news.yahoo.co.jp/articles/32a35f37518e99d7e29b5409006b616cc93f969f,3/19(火) 8:36
2024-03-19,15:21,TTL,総合,39,Full-Count,韓国スタンドに日本困惑「やめたほうが」　まさかのイベントにどよめき「不思議すぎる」,https://news.yahoo.co.jp/articles/f5d94972ee35032568105391edfea22f085fa50f,3/19(火) 13:37
2024-03-19,15:21,TTL,総合,40,共同通信,広島のコンビニで複数人刺され負傷,https://news.yahoo.co.jp/articles/4398939d0eb2485cd4c022b0b065da68ff195bc1,3/19(火) 14:32
