scrp_date,scrp_time,genre_en,genre_jp,rank,media_jp,title,link,date_original
2024-03-19,13:20,domestic,国内,1,みんかぶマガジン,大臣の答弁が下手すぎて、議場騒然！「あまりに能力不足」ポンコツ加藤鮎子こども相「異次元の少子化対策」無意味な政策に月1000円増税,https://news.yahoo.co.jp/articles/b22b8d78e92e56faf254a1a5003261c659e2611c,3/19(火) 9:10
2024-03-19,13:20,domestic,国内,2,デイリースポーツ,玉川徹氏、大谷夫妻の睡眠疑問を口にするも菊間千乃氏から「余計なお世話だと思います」,https://news.yahoo.co.jp/articles/9e12efa9dabbfd51534afde454d8c85e1d301f48,3/19(火) 9:47
2024-03-19,13:20,domestic,国内,3,日刊スポーツ,今井絵理子議員の手話への一部報道にパートナー橋本健氏が抗議「揶揄するような記事を書く奴は」,https://news.yahoo.co.jp/articles/d161d7aaa778f2666e99757c7850d50b9b9e7c7e,3/19(火) 10:23
2024-03-19,13:20,domestic,国内,4,読売新聞オンライン,廃食油が今や「お宝」、航空燃料活用へ争奪戦…取引価格は１年で３倍,https://news.yahoo.co.jp/articles/0e070dcc3584eafcd87977d66f783a3a87752d1a,3/19(火) 8:43
2024-03-19,13:20,domestic,国内,5,ABEMA TIMES,「入学式の撮影カメラマン」Xで募集→「親として怖いしかない」などと炎上 背景に「ブラックすぎる待遇」か,https://news.yahoo.co.jp/articles/83235ae7dcebb2d6b5a07693773988a59a844837,3/19(火) 12:24
2024-03-19,13:20,domestic,国内,6,ハフポスト日本版,「外見からわからなくても」神戸市の「ヘルプマーク」ポスターに称賛続々。どうやって生まれたの？,https://news.yahoo.co.jp/articles/d1f636e7268383b5911d52196784a426ccd70c02,3/19(火) 9:59
2024-03-19,13:20,domestic,国内,7,ABEMA TIMES,【独自】工藤会を脱退し“うどん店の店主”に 元幹部が明かす組織の実態「工藤会は多分あり続ける 誰かが必要としているから」,https://news.yahoo.co.jp/articles/52675980256d96907d91c8b3487da9977f221d9c,3/19(火) 7:32
2024-03-19,13:20,domestic,国内,8,ABCニュース,春分の日は荒れた天気に　落雷や突風・ひょうに要注意　暴風や波浪警報の可能性も　翌21日は真冬の寒さに　3月下旬なのに積雪か,https://news.yahoo.co.jp/articles/ae504b88e58b0e27edf16a5f8c94ab22210c322b,3/19(火) 11:58
2024-03-19,13:20,domestic,国内,9,朝日新聞デジタル,教員ミスで出願できなかった生徒に受験認める　高校側が特例措置,https://news.yahoo.co.jp/articles/272afdb96355b08a418aaf2d88f206d781bc85e0,3/19(火) 11:55
2024-03-19,13:20,domestic,国内,10,スポニチアネックス,東京創元社、翻訳家に無許可で電子書籍を無料配信　謝罪　「ひとえに弊社の確認不足によるもの」　,https://news.yahoo.co.jp/articles/d2af9b4d39cb91bccab64c5e7e134dc838301099,3/19(火) 12:23
2024-03-19,13:20,domestic,国内,11,東海テレビ,裁判中泣き出す場面も…“頂き女子りりちゃん”に懲役13年・罰金1200万円を求刑「心情につけこみ卑劣」,https://news.yahoo.co.jp/articles/de6072df545bbac1bc7d0beb2fcb6a4b0d38e8b0,3/15(金) 21:14
2024-03-19,13:20,domestic,国内,12,J-CASTニュース,サボりを確認したら、発覚したのは「隠れ残業」だった　Xへの投稿相次ぐ...「リモートワーク」実体験,https://news.yahoo.co.jp/articles/806e801c3eda53d26d8b81939dcf93eef5c9e8bf,3/18(月) 10:00
2024-03-19,13:20,domestic,国内,13,日刊スポーツ,煉獄コロアキ「暇つぶしに20人ほど訴えてみた！」誹謗中傷への情報開示請求「お前ら覚悟しろ」,https://news.yahoo.co.jp/articles/dba27e00e63711ab33c94b6c8d0b1289dd99ec9d,3/19(火) 9:48
2024-03-19,13:20,domestic,国内,14,毎日新聞,首相、自らの処分検討　安倍・二階両派82人含め4月にも　裏金事件,https://news.yahoo.co.jp/articles/89954742be76e35538010b40c233c7c890684190,3/19(火) 5:00
2024-03-19,13:20,domestic,国内,15,レスキューナウニュース,京急本線で人身事故 一部運転見合わせ,https://news.yahoo.co.jp/articles/016d4dc50b720441bd659dd140416a62d61cd9ea,3/19(火) 7:35
2024-03-19,13:20,domestic,国内,16,日刊スポーツ,中村美香埼玉県議、当選無効確定「残念ながら認められませんでした」Ｘで謝罪　最高裁が上告棄却,https://news.yahoo.co.jp/articles/81a0855ac1c9b7d2a2b472123c52c9f7af00a56f,3/19(火) 12:47
2024-03-19,13:20,domestic,国内,17,弁護士JPニュース,“有害”「モペッド」が今春に大粛清！？　明確に“原付き”扱いとなり「ペダルのみの走行」でも摘発へ,https://news.yahoo.co.jp/articles/2185a1c47e7440a4130b010d3a12d8ffd6f46993,3/19(火) 10:10
2024-03-19,13:20,domestic,国内,18,読売新聞オンライン,旅館で女性の着替えを盗撮、市職員を逮捕…スマホの動画を確認,https://news.yahoo.co.jp/articles/f51abdcbe4ea6dffa009a471784edb2fc63c7a0e,3/19(火) 12:08
2024-03-19,13:20,domestic,国内,19,日刊スポーツ,堀江貴文氏「特捜部は幇助容疑で捜査しろ」詐欺広告めぐり米SNS運営会社への捜査を“要請”,https://news.yahoo.co.jp/articles/c26c744379ec24d9469d5cf2e899fcba1dea20c0,3/19(火) 12:39
2024-03-19,13:20,domestic,国内,20,東海テレビ,信号無視で停止求めるも逃げる…警察の捜査車両から逃走した車が交差点で別の車2台に衝突 そのまま逃走,https://news.yahoo.co.jp/articles/fe107d0788fd5a336e2ae1213ecb248cfa0f8f6d,3/19(火) 11:36
2024-03-19,13:20,domestic,国内,21,47NEWS,夫を殺害した男性は、心神喪失で不起訴になった。裁判官と受け答えができていたのに…「どうして殺されたの？」真相を求める遺族の苦悩は続く,https://news.yahoo.co.jp/articles/6e1223a789eaed872bc1caa6084f8eb650ad464a,3/19(火) 11:02
2024-03-19,13:20,domestic,国内,22,47NEWS,後藤田知事も激怒、高校生に配備のタブレット「３年もたず半数超が故障」の異常　後手に回る教育委員会、中国メーカーからは返答なし,https://news.yahoo.co.jp/articles/68e92fff865112eaea030dbc5eeefd3f12c21131,3/17(日) 10:32
2024-03-19,13:20,domestic,国内,23,東海テレビ,踏切で23歳の男子大学生が急行列車にはねられ死亡 約2時間運転見合わせ 事故と自殺の両面で捜査,https://news.yahoo.co.jp/articles/dc7a6981079a2a9de41eee2300b5fabba79186f0,3/19(火) 7:13
2024-03-19,13:20,domestic,国内,24,デイリースポーツ,菊間千乃氏　「知らない」連発の下村博文氏の政倫審に「国民はだまされない」,https://news.yahoo.co.jp/articles/695f681272dcff239d2292fa67ba66b1ae4288b3,3/19(火) 9:28
2024-03-19,13:20,domestic,国内,25,tenki.jp,春分の日は大荒れ　今週末から週明けは西・東日本で雨続く　大雨の恐れも　2週間天気,https://news.yahoo.co.jp/articles/ae4ef1eb8f763a52ccfcc72e6970725deb450b75,3/19(火) 11:43
2024-03-19,13:20,domestic,国内,26,読売新聞オンライン,教育長が町長を提訴、厳重注意「根拠ない」…「土下座を強要」とのうわさ流れ,https://news.yahoo.co.jp/articles/4045658dedb1518032dfa69ca717dcf13171ee69,3/19(火) 12:09
2024-03-19,13:20,domestic,国内,27,FNNプライムオンライン,「何で逃げるんだ」信号無視の自転車が車と“衝突寸前”　自転車の男性“あわてて立ち去り”　東京・江東区,https://news.yahoo.co.jp/articles/de6a4477960be9596ffbba9bc103e11f3652a58d,3/12(火) 12:13
2024-03-19,13:20,domestic,国内,28,時事通信,「いなづま」座礁、元艦長を停職　潜水艦衝突事故でも懲戒処分　海自,https://news.yahoo.co.jp/articles/6c93950fcc299a659ce7f6053e5fb3b3555f2776,3/19(火) 12:16
2024-03-19,13:20,domestic,国内,29,ABEMA TIMES,藤井聡太叡王との“再戦”を決めるのはどっちだ 叡王経験者の永瀬拓矢九段と新鋭・伊藤匠七段が対戦中/将棋・叡王戦挑決,https://news.yahoo.co.jp/articles/72035a990480a361cd9b5563fd43cd0396e251cd,3/19(火) 12:06
2024-03-19,13:20,domestic,国内,30,読売新聞オンライン,免許失効状態で1年間も授業、高校教諭…隠して採用され,https://news.yahoo.co.jp/articles/c6f4ee7276ec0fccee20ef68219db1e011a3b53a,3/19(火) 12:08
2024-03-19,13:20,domestic,国内,31,FNNプライムオンライン,日銀が「マイナス金利」解除か…金融政策の転換が迫る　『住宅ローン』金利も上昇?　「それでも結論、変動でいい!」と専門家,https://news.yahoo.co.jp/articles/c972dd76014dd70e4800324c350cc778ac08f6d2,3/18(月) 19:12
2024-03-19,13:20,domestic,国内,32,読売新聞オンライン,中２が大麻を「スマホ使い３千円で購入」…その後「気分が悪くなった」と自ら１１９番、所持容疑で逮捕,https://news.yahoo.co.jp/articles/6831ad40056212f294b16388ba631577098b0867,3/19(火) 7:51
2024-03-19,13:20,domestic,国内,33,日刊スポーツ,松尾貴史が強烈皮肉「岸田文雄君、えらいぞ！」裏金議員一斉処分報道の「及び腰」ぶりを暗に批判,https://news.yahoo.co.jp/articles/ec4851c91013d8ff25328b7fc981f769885db936,3/19(火) 9:27
2024-03-19,13:20,domestic,国内,34,日刊スポーツ,玉川徹氏「奥さんはどう過ごすのだろう」大谷夫妻の韓国ホテルでの過ごし方に「妄想」止まらず,https://news.yahoo.co.jp/articles/0c961d48932addc6c5493d3bae4b466cd4147ae4,3/19(火) 9:49
2024-03-19,13:20,domestic,国内,35,共同通信,神戸の滝川二高、野球部監督辞任　部員に不適切行為、詳細明かさず,https://news.yahoo.co.jp/articles/fd0504ecf5f31b95a6800a7b0c549e9759d2bbc9,3/19(火) 12:18
2024-03-19,13:20,domestic,国内,36,弁護士JPニュース,担当者の“願書出し忘れ”で生徒が志望高校受験できず、中学校側「和解金30万円」を提案...校長「二度とくり返さない」,https://news.yahoo.co.jp/articles/82c8f7460b9570d27b63b2e7cbfc9c81e8de14fb,3/9(土) 9:30
2024-03-19,13:20,domestic,国内,37,TBS NEWS DIG Powered by JNN,東京都、神奈川県で最大震度2の地震　東京都・東京練馬区、神奈川県・横浜鶴見区、横浜神奈川区,https://news.yahoo.co.jp/articles/4728728068cc0ac9a3256aac4b2b24a5e3dea9f5,3/18(月) 18:54
2024-03-19,13:20,domestic,国内,38,弁護士JPニュース,高知「ゴトゴト石」器物損壊、影響は“前科”にも…「罰金刑」受けた大学生6人の“重すぎる”代償,https://news.yahoo.co.jp/articles/97960f2a36337cde812b36ea5a6b7ac1d36f67c8,3/15(金) 10:10
2024-03-19,13:20,domestic,国内,39,デイリースポーツ,「ドンマイドンマイ、本官は好きだよ」　熊本県警「春になったら」意識の道路掲示板が話題,https://news.yahoo.co.jp/articles/c89759647be11e4636026c84b4240641d564b304,3/19(火) 11:08
2024-03-19,13:20,domestic,国内,40,選挙ドットコム,自民党・太田房江参院議員登場！女性総理ならこの人！解散総選挙はいつ？選挙ドットコムちゃんねるまとめ,https://news.yahoo.co.jp/articles/4546b33c32558d264c495d73637cacaa16a268e1,3/19(火) 11:40
