scrp_date,scrp_time,genre_en,genre_jp,rank,media_jp,title,link,date_original
2025-09-02,05:07,TTL,総合,1,スポニチアネックス,土田晃之　唯一、自ら降板を申し出た番組明かす　恩義を感じている人の番組だったが「辛くなっちゃって」,https://news.yahoo.co.jp/articles/a7b122ba63b173a72e44d95e4821086a582d4fd4,9/1(月) 21:48
2025-09-02,05:07,TTL,総合,2,西スポWEB OTTO！,「スタイルがすごい」札幌テレビ〝新人アナ〟オフショにSNS騒然「本気で三度見」「アイドルと言われても信じてしまう」,https://news.yahoo.co.jp/articles/9f29cc30fed4db93389e4dc906a4967d8e5f288d,9/2(火) 0:10
2025-09-02,05:07,TTL,総合,3,Full-Count,イチロー氏が苦言「全く敬意がない」　現代野球の“所作”に一石…女子選手は「絶対しない」,https://news.yahoo.co.jp/articles/a0a2cf6448bc39fc86cf0b1f8dc1675c63049ab2,9/1(月) 10:23
2025-09-02,05:07,TTL,総合,4,J-CASTニュース,「24時間テレビ」、横山裕の壮絶な生い立ちに涙も...「義父」に疑問の声　「病気の妻と幼い子供置いて何してた」,https://news.yahoo.co.jp/articles/f124d6014728125e732951ed41d6880c7937c1d8,9/1(月) 17:15
2025-09-02,05:07,TTL,総合,5,スポニチアネックス,横山裕　「24時間マラソン」当日に持参していた弟からの差し入れ　スタート地点に向かう車内でも手放さず,https://news.yahoo.co.jp/articles/93b202eed0697a7b5566dad14a236b2b2c714708,9/1(月) 21:19
2025-09-02,05:07,TTL,総合,6,西スポWEB OTTO！,小5で衝撃のグラビアデビュー…「メンタルえぐられる」「思い出したくない過去」1児の母となった〝奇跡の美少女〟の美貌保つ近影に反響,https://news.yahoo.co.jp/articles/379558b380f3db867327f6578adf0bc17829e53d,9/1(月) 23:30
2025-09-02,05:07,TTL,総合,7,スポーツ報知,本田真凜さん「２４時間テレビ」での姿にネット騒然「意味わからん」「バグったか」「衣装が…」「すごい」,https://news.yahoo.co.jp/articles/ec24dac7d63621aacbb3688262f4b4fdaa44a296,9/1(月) 10:15
2025-09-02,05:07,TTL,総合,8,西スポWEB OTTO！,「これはあかん」大原優乃〝スイカショット〟披露に反響「すげーな」「最高すぎるって」「たまらんありがとう」の声,https://news.yahoo.co.jp/articles/7a9c1f5c8530fa68ce15e9ec4eeef2dabf4e3f9f,9/1(月) 23:50
2025-09-02,05:07,TTL,総合,9,Full-Count,韓国の至宝キムを“放出”　43億円契約も怪我続き…元GG賞男をブレーブスが獲得、米報道,https://news.yahoo.co.jp/articles/6f7ac9440d1d6adc31612d7345d75a5c9039dda2,9/2(火) 3:29
2025-09-02,05:07,TTL,総合,10,テレビ朝日系（ANN）,【速報】小学生とみられる女の子が東京・赤坂の高層マンション29階から落下,https://news.yahoo.co.jp/articles/052daf383288879ea2fdadd36da961f9596aa04e,9/1(月) 16:13
2025-09-02,05:07,TTL,総合,11,STVニュース北海道,【判明】事故前にヒグマへの餌付け疑われる事案　男性襲った個体が出没していた地区で…羅臼岳,https://news.yahoo.co.jp/articles/91587a23aa602b7c69533fea0d4d498fb976721a,9/1(月) 16:15
2025-09-02,05:07,TTL,総合,12,Full-Count,ド軍、56勝左腕ヒーニーを緊急獲得　3年ぶり古巣復帰で大谷翔平と再共闘…米報道,https://news.yahoo.co.jp/articles/fe7cdf5af8c7db83e7fd95ef00ef00846ecbcff1,9/2(火) 0:37
2025-09-02,05:07,TTL,総合,13,スポニチアネックス,ヤクルト来季GMに青木宣親氏、小川GMは今年限りで退任へ　今季で退任・高津監督後任は池山隆寛氏最有力,https://news.yahoo.co.jp/articles/6179a063adfcb309a77b9dc1d0aa01222ba72a84,9/2(火) 2:00
2025-09-02,05:07,TTL,総合,14,イーファイト,角田夏実がハワイでダイエット、海辺の鍛えたボディ公開に「痩せる必要なし」「お美しい」,https://news.yahoo.co.jp/articles/5a0f3f0f36795ad41d7500d771c3cc65c6c06ab9,9/2(火) 3:30
2025-09-02,05:07,TTL,総合,15,西スポWEB OTTO！,「丸出しだね」覆面女子レスラー〝プール満喫ショット〟,https://news.yahoo.co.jp/articles/760317d92ddaa293a37b41b3620f0c348c8928ac,9/2(火) 0:30
2025-09-02,05:07,TTL,総合,16,Full-Count,ヤ軍がドブに捨てた103億円、7年延長を「すぐに後悔」　球界ワースト級の“不良債権”,https://news.yahoo.co.jp/articles/1bee2cf639a144cfe46df0639886ad13b3f38161,9/1(月) 20:42
2025-09-02,05:07,TTL,総合,17,デイリースポーツ,驚異的ペースで本塁打を量産するヤクルト・村上　ケガさえなければ日本新記録だった可能性,https://news.yahoo.co.jp/articles/637ba910d0c615a8095322886273dc5abad1505c,9/1(月) 21:41
2025-09-02,05:07,TTL,総合,18,まいどなニュース,葬儀で「ご愁傷様です」と言われたら？葬儀社が教える〝正しい返し方〟「ためになった」「誰も教えてくれなかった」,https://news.yahoo.co.jp/articles/e8411cbe095583e13e5b659f957aed2dd6a1cb3b,9/1(月) 16:50
2025-09-02,05:07,TTL,総合,19,テレビ静岡NEWS,田久保市長に対する不信任決議めぐり中島議長が声を震わせながら議会事務局の職員を労う「君たちがいなければできなかったと思う。ありがとう」　調査に協力的だった東洋大学への謝意も,https://news.yahoo.co.jp/articles/d827b966ef36cbc4455f83888513a203e59ed236,9/1(月) 21:51
2025-09-02,05:07,TTL,総合,20,東スポWEB,【巨人】堀内恒夫氏　阪神戦の逆転負けで…岡田彰布氏に同調「勝てる試合を…俺にもわからん」,https://news.yahoo.co.jp/articles/0dcd5cc2c257695a318c069572b71e8592aba540,9/1(月) 23:35
2025-09-02,05:07,TTL,総合,21,スポニチアネックス,「チャラン・ポ・ランタン」小春　1月出産の息子が脳障害と公表　出産中の事故で「脳に大きなダメージ」,https://news.yahoo.co.jp/articles/145a0903f46287b3d5d6663a35cde0057bd9a649,9/1(月) 17:23
2025-09-02,05:07,TTL,総合,22,GOAL,レヴァークーゼン、わずか3試合でテン・ハーグ監督を解任「誰もこんな決断を望んでいなかったが…」,https://news.yahoo.co.jp/articles/d4872aea5658667cdb081f3a8b9aacab9f9253b9,9/1(月) 19:19
2025-09-02,05:07,TTL,総合,23,東海テレビ,ホームから線路内へ…駅で40代位の女性が列車にはねられる 左足の膝から下を切断する重傷 約1時間半運転見合わせ,https://news.yahoo.co.jp/articles/4a910780a799f831f894f2a32176cde07d0bffdb,9/1(月) 21:34
2025-09-02,05:07,TTL,総合,24,デイリースポーツ,難病の１０歳長女と「２４時間」出演の女優「子どもたちを世間の目に晒してしまっても良いのかという逡巡も」と思い綴る　夫は元ＴＢＳアナ,https://news.yahoo.co.jp/articles/22038f973983cd27fe38b0edca6790fbae8a3159,9/1(月) 23:50
2025-09-02,05:07,TTL,総合,25,西スポWEB OTTO！,〝金魚妻〟から3年「なんか色っぽい」濡れ髪水着ショットの29歳女優に脚光「最高に輝いてるやん」「カルピスCMに使える笑顔」,https://news.yahoo.co.jp/articles/4a6651343ee76216bf5258b9fe7907e33eae8680,9/1(月) 23:40
2025-09-02,05:07,TTL,総合,26,FNNプライムオンライン（フジテレビ系）,「今になって関税ゼロを提案してきた、手遅れだ」トランプ大統領がインドを非難　アメリカメディアは中国インドロシアの結束に危機感,https://news.yahoo.co.jp/articles/e9f9b01939d7a4b0af2afd3719d3bf4ba81e1c06,9/2(火) 3:51
2025-09-02,05:07,TTL,総合,27,Full-Count,試合後の山本由伸に“違和感”「気になりすぎる」　まさかの9文字に爆笑「只者じゃない」,https://news.yahoo.co.jp/articles/06287f53b7dc4863aacff31dd661624fc956fcab,9/1(月) 22:03
2025-09-02,05:07,TTL,総合,28,ほ・とせなNEWS,周囲からいじられるようになった小6男子　→垢抜けを頑張った結果…10年後の姿に「ガチのイケメン」「好きな顔すぎる」「努力の塊やな」,https://news.yahoo.co.jp/articles/37edf457896661a2fe485b17c7f95cf5d5c7865a,8/31(日) 18:00
2025-09-02,05:07,TTL,総合,29,産経新聞,「さっきまで元気だったのに」と同僚絶句　目の前で40代男性が死亡　歓送迎会で脳出血　脳卒中サバイバー記者,https://news.yahoo.co.jp/articles/d9ec85ad8e7f0a077172421bdf1bcd7873fd492c,9/1(月) 11:00
2025-09-02,05:07,TTL,総合,30,西日本新聞,スーパーは閉まり、ファミレスも撤退した「消滅可能性都市」…定住奨励100万円や保育料無償化は子育て世帯に刺さるか,https://news.yahoo.co.jp/articles/eeea495f2d8cc94696024c834c6a99673b3c03ee,8/30(土) 14:00
2025-09-02,05:07,TTL,総合,31,西スポWEB OTTO！,「解禁だ！」〝あまちゃん女優〟中学以来の水着「恥ずかしかったけど…」お披露目姿に反響続々「何水着?」「市民プールを思い出した(笑)」,https://news.yahoo.co.jp/articles/cd6cd57a24c2ffe7bbb1824a632de48164940d4e,9/2(火) 0:00
2025-09-02,05:07,TTL,総合,32,中日スポーツ,『あんぱん』ヤムおじさん（阿部サダヲ）の後ろに貼られた張り紙にフォロワー考察止まらず「やってたのですねぇ～」【ネタバレ注意】,https://news.yahoo.co.jp/articles/82df82b97cb8a472e8785bf691cf7c9e2f6f6ab6,9/1(月) 18:12
2025-09-02,05:07,TTL,総合,33,NBS長野放送,“10年に1度レベル”全国で「かなり気温が高くなる」可能性　9月7日頃から北海道、東北、関東甲信、北陸、東海、近畿、中国、四国、九州北部、九州南部・奄美、沖縄　気象庁が「高温に関する早期天候情報」発表,https://news.yahoo.co.jp/articles/329f57633ae482eb5e6c43d3c1a320e7b923c252,9/1(月) 20:54
2025-09-02,05:07,TTL,総合,34,tennis365.net,【速報】大坂なおみvs世界3位ガウフ 第1セットは大坂が先取！全米OP4回戦＜女子テニス＞,https://news.yahoo.co.jp/articles/64f5ac76a0c111a849e86aa69681816f5027593b,9/2(火) 4:01
2025-09-02,05:07,TTL,総合,35,中央日報日本語版,日本で発明された寿司の「魚型醤油容器」、南オーストラリア州で世界初の全面禁止,https://news.yahoo.co.jp/articles/331d29c036d5eb1f6840e6a3cf4b57b598fb65cb,9/1(月) 12:03
2025-09-02,05:07,TTL,総合,36,デイリースポーツ,壮絶生い立ち明かし２４時間完走の横山裕　元ジャニ風間俊介「自分の事吐露するタイプではない。大きな覚悟だったと思う、伝えたいことがある、と」,https://news.yahoo.co.jp/articles/c20063bb97f8161143bfafcd9475bb3820668d9f,9/1(月) 17:11
2025-09-02,05:07,TTL,総合,37,高校野球ドットコム,U−18代表vs沖縄県選抜の予告先発が発表！末吉、新垣と甲子園優勝に貢献した2枚看板が登板,https://news.yahoo.co.jp/articles/f5ae5b9bace0af30fbda118829d814bbd95706d8,9/1(月) 18:08
2025-09-02,05:07,TTL,総合,38,ゴルフダイジェスト・オンライン（GDO）,竹田、山下、岩井ツインズのいない国内女子ツアー　鈴木愛が「つまんないゴルフはしたくない」と言う理由,https://news.yahoo.co.jp/articles/0b9bc2dff96be6b88146d964ccbe38d9a89c932d,9/1(月) 17:35
2025-09-02,05:07,TTL,総合,39,デイリースポーツ,横山裕　母の訃報はライブ直前に…やめて帰るのは「オカンが悲しむ」ラスト曲「オニギシ」で号泣「歌えなくて」母を思い作ったナンバー,https://news.yahoo.co.jp/articles/b515d3fdb55265285a78c1612e2666e7524abf1d,9/1(月) 23:07
2025-09-02,05:07,TTL,総合,40,Full-Count,突如現れた“変則左腕”に騒然「プロ志望だしてくれ」　完璧投球に12球団ファン熱視線,https://news.yahoo.co.jp/articles/7d01a3303c8e688d5777c4e2754136e36b635826,9/1(月) 19:22
