scrp_date,scrp_time,genre_en,genre_jp,rank,media_jp,title,link,date_original
2025-02-06,20:06,life,ライフ,1,ENCOUNT,「エグすぎだろ」教習所の料金に驚きの声　物価高騰余波　「免許取るのにもこんな金額じゃなかなか難しい」,https://news.yahoo.co.jp/articles/0379de2eeff5113d1a0110fd10050f72926a90c7,2/6(木) 10:30
2025-02-06,20:06,life,ライフ,2,ハフポスト日本版,カイロを貼る場所を警視庁が紹介⇨「まじ温まるよ！」「風邪ひきかけたら絶対に貼る」。最強寒波の予報,https://news.yahoo.co.jp/articles/12f57741b1df64b3c1b8ef1b95bbc717d66e3a8c,2/5(水) 6:50
2025-02-06,20:06,life,ライフ,3,メディカルドック,「働く大人の発達障害」が増加中 具体的な症状とその対処法をご存じですか？,https://news.yahoo.co.jp/articles/e3f6f7432680f1efbdc1c22dc7331a5aa9311284,2/6(木) 8:03
2025-02-06,20:06,life,ライフ,4,ねとらぼ,「尊敬します」　妻が22時に作る“旦那弁当”をのぞくと……　残り物がパッと豪華に見える“ひと工夫”に「幸せ者ですなぁ」,https://news.yahoo.co.jp/articles/42925b1468245c69fc7bdbabf7428dcbbf796853,2/5(水) 11:00
2025-02-06,20:06,life,ライフ,5,ねとらぼ,夏ごろに植えた1本のサツマイモ→今になって思い出し、恐る恐る抜いてみると……　驚きの成果に「えーー」「感動」,https://news.yahoo.co.jp/articles/55fbb5bc0f026f0b3d1ccd4cfba27ab947026119,2/6(木) 19:00
2025-02-06,20:06,life,ライフ,6,LASISA,【SNS】横断歩道を渡った子どもが車に「おじぎ」… 一部の大人たちが大激怒したワケ　「バカな風習」「ドライバーが勘違いする」,https://news.yahoo.co.jp/articles/84eab087e60061e2e101f951952488aa506679c5,2/6(木) 6:40
2025-02-06,20:06,life,ライフ,7,リセマム,大学人気ランキング2025年1月版…国公私大トップ50発表,https://news.yahoo.co.jp/articles/799554a50b5696e0efeac26eaef1ec94a75f9824,2/6(木) 17:00
2025-02-06,20:06,life,ライフ,8,オリコン,スシロー、笑福亭鶴瓶の広告を順次再開へ　公式サイトから削除の経緯説明＆謝罪も「ご迷惑とご心痛をおかけし、深く反省」,https://news.yahoo.co.jp/articles/bbcbe5c2b2f341c6be9d54fc188fe7f3bbde56a1,2/6(木) 14:05
2025-02-06,20:06,life,ライフ,9,ほ・とせなNEWS,母「横を見たら…」生後2ヶ月の赤ちゃんの姿に…「完全に休日のお父さん」「将来は大物」,https://news.yahoo.co.jp/articles/9094adcb1dabb86a331f9ac0eb2329ad83df5575,2/6(木) 12:30
2025-02-06,20:06,life,ライフ,10,LIMO,【激変】髪に無頓着な大学生が『高校で禁止だった髪型』に初挑戦！驚きの変身に「え!?凄く良くなった」「彼女できそう」,https://news.yahoo.co.jp/articles/51df30a6beeaa167f84a749555073653401feaa6,2/6(木) 18:52
2025-02-06,20:06,life,ライフ,11,メディカルドック,俳優・岸野佑香さん逝去 「大腸がん」になりやすい人の特徴・代表的な症状を医師が解説,https://news.yahoo.co.jp/articles/536c6519c755985eea7c94f367d17e49ead59e2d,2/4(火) 16:39
2025-02-06,20:06,life,ライフ,12,ねとらぼ,古いバスタオルをザクザク切って縫い付けると……　目からウロコの再利用に「すてきなアイデア」【海外】,https://news.yahoo.co.jp/articles/891549917b7abf1d69e8568794b867349c949501,2/6(木) 12:00
2025-02-06,20:06,life,ライフ,13,ねとらぼ,14歳のとき、親友の兄と付き合うことになった女性→13年後……　“まさかの結末”に「韓国ドラマみたい」【海外】,https://news.yahoo.co.jp/articles/c80891d57b44c7a7413da8d52fc8d8177fe8f706,2/6(木) 19:15
2025-02-06,20:06,life,ライフ,14,ENCOUNT,「報道の自由があるから」テレビ局の撮影に保護施設の犬が錯乱→負傷　所長ぼう然「泣き寝入りするしか」,https://news.yahoo.co.jp/articles/4ef43859560297a02bfd44aa81cfc1e74ea52775,2/6(木) 18:01
2025-02-06,20:06,life,ライフ,15,ほ・とせなNEWS,高1の頃から彼女を撮り続けた男性　10年後の姿に「泣けてきた」「感動しました」,https://news.yahoo.co.jp/articles/28ce2e5802f15c886618afdf2392b62f0230af5e,2/4(火) 9:00
2025-02-06,20:06,life,ライフ,16,ほ・とせなNEWS,「交際相手に太っていることをいじられた」→2年後…ダイエットで激変した姿に「尊敬します」「お綺麗です」,https://news.yahoo.co.jp/articles/d15b426ca4a3f916e5b55aeaa6e6f80bd2f73124,2/6(木) 7:30
2025-02-06,20:06,life,ライフ,17,まいどなニュース,漫画「脳外科医竹田くん」作者、素性明かす「被害者の親族です」赤穂市民病院の医療事故「モチーフに」【声明文全文】,https://news.yahoo.co.jp/articles/085e002f2caf29c1aeffdfbfcf6b6e8f3bdca5c2,2/6(木) 8:26
2025-02-06,20:06,life,ライフ,18,ねとらぼ,ランチの前に「ぬいぐるみくじ」を引いたら……　“まさかの大当たり”に「もう1席必要ですね」,https://news.yahoo.co.jp/articles/161aafbb5e01b6279fe562ce28a164e120d94bee,2/5(水) 20:50
2025-02-06,20:06,life,ライフ,19,オリコン,どうしてそうなったん？ 柴犬の寝起きに390万表示「お腹抱えるほど笑いました」「マーメイド??」,https://news.yahoo.co.jp/articles/b74fd20e8a4a175453daa0e1d497cd63fcba494d,2/6(木) 16:10
2025-02-06,20:06,life,ライフ,20,メディカルドック,「食道がんを疑う咳」の特徴はご存知ですか？前兆となる初期症状も医師が解説！,https://news.yahoo.co.jp/articles/c65bdae1ce884b7157fc327a203d206feaef532f,2/6(木) 18:05
2025-02-06,20:06,life,ライフ,21,BuzzFeed Japan,「犬がひんひん鳴いてたから何事かと…」大変なことになっていたワンちゃんに18万いいね⇒「美脚の柴犬かと思った」「ドッグタワー、初めて見た」,https://news.yahoo.co.jp/articles/085251c394dce0107296c36c5afaef2cb3984ccb,2/6(木) 8:15
2025-02-06,20:06,life,ライフ,22,ねとらぼ,毛糸の代わりに古くなったジーンズを細く切って編んでいくと……　生まれ変わったアイテムが131万再生「すてきなアイディア」「すごく気に入った」,https://news.yahoo.co.jp/articles/0b621a2b838ce4b6e3cc859c56b89b85fd75fa39,2/5(水) 12:00
2025-02-06,20:06,life,ライフ,23,リセマム,【共通テスト2025】平均点等を最終発表…化学過去最低、受験率93.31％,https://news.yahoo.co.jp/articles/e0072ebfef5264e9f81fef5ede175818a3b9dd4c,2/6(木) 16:07
2025-02-06,20:06,life,ライフ,24,まいどなニュース,ゴミ捨て場で「ギャー」という子猫の悲鳴→4本足が折れていた　獣医師「限りなく虐待に近い骨折」、その後は？,https://news.yahoo.co.jp/articles/a603fac80c21affacb127a10bc890e07b97098c5,2/6(木) 7:40
2025-02-06,20:06,life,ライフ,25,ねとらぼ,ズボラ母が5人分サンドイッチを爆速で作ったら……　目からウロコの時短テクと美しい仕上がりに「信じられない」,https://news.yahoo.co.jp/articles/ab4179f71bbf036046b9ca3aa1764d6c51f41f8f,2/6(木) 9:23
2025-02-06,20:06,life,ライフ,26,LIMO,まるでジャージの履き心地！ワークマン「ストレッチウォームパンツ」1900円で最強防寒！履き心地最高です。,https://news.yahoo.co.jp/articles/6aa32efd6ebb364cf35bfa83ba94676665e29d58,2/5(水) 17:47
2025-02-06,20:06,life,ライフ,27,まいどなニュース,「お店のスピーカーの音かと思ったら…」看板の裏で身動きできない子猫を発見！ 救出の先に待っていた“家族の宝物”,https://news.yahoo.co.jp/articles/1d6efb3f7c7ec5923caea8412731594c72da48ed,2/6(木) 16:40
2025-02-06,20:06,life,ライフ,28,ほ・とせなNEWS,2020年、仲良しな2歳娘とわんこ　4年後の2人の姿に「泣ける」「微笑ましい」,https://news.yahoo.co.jp/articles/fabbd7671c7f68445c7e585a5f1017c1bbe80afc,2/4(火) 7:30
2025-02-06,20:06,life,ライフ,29,まいどなニュース,「吉池で買ったタカアシガニ、意外と生きてて怖いw」→食べたら、想像以上の美味しさ！,https://news.yahoo.co.jp/articles/331f82590d92e03a84d22213ba5e1910bd1971d8,2/6(木) 17:25
2025-02-06,20:06,life,ライフ,30,BuzzFeed Japan,インナーなしでも暖かい！ワークマンの「1500円トップス」裏地のぽこぽこフリースが気持ちいいんです《着用レビュー》,https://news.yahoo.co.jp/articles/191c4bbb889e802fb30ec8204465f26a96bccdb0,2/6(木) 17:05
2025-02-06,20:06,life,ライフ,31,BuzzFeed Japan,【松屋】ガッツリ感がたまらない！ニンニクたっぷりの「厚切り豚カルビ定食」ライス特盛り無料で大満足です《実食レビュー》,https://news.yahoo.co.jp/articles/87a788484728dfd28420178145521db40f5ac8ad,2/6(木) 18:35
2025-02-06,20:06,life,ライフ,32,ねとらぼ,妻の実家で夫が目撃した“衝撃の張り紙”　斬新すぎる内容に「最高」「センス抜群」,https://news.yahoo.co.jp/articles/847eef17a02516f4356f12048c12695f10ea02cb,2/6(木) 15:00
2025-02-06,20:06,life,ライフ,33,ファイナンシャルフィールド,「2025年4月」から「アクアライン」の通行料金が「400円」に！？ 今までの通行料金や値下げの背景は？,https://news.yahoo.co.jp/articles/9c23fde76f15e0001e4ee96be1ae037b57d6f7d9,2/6(木) 12:30
2025-02-06,20:06,life,ライフ,34,ファイナンシャルフィールド,肉を切った「包丁やまな板」は「キッチンハイター」で除菌するべき？ 「食器用洗剤」では除菌されないの？,https://news.yahoo.co.jp/articles/a80a3b262593a16a429c400ec2b3029b895a948d,2/5(水) 19:20
2025-02-06,20:06,life,ライフ,35,毎日新聞,お餅、大福が「受験のトイレ対策」になる?　医師に聞くうわさの真相,https://news.yahoo.co.jp/articles/9ced2dfd80e8842583e3886ec359fd7c40e58815,2/5(水) 10:00
2025-02-06,20:06,life,ライフ,36,ねとらぼ,マクドナルド、次のハッピーセットを“チラ見せ”……　“国民的人気キャラ”の正体に「激アツ案件!!」「きゃー！たのしみ」,https://news.yahoo.co.jp/articles/7127db81be71cf4b1b0d2b4779e13ae60b4d61b8,2/6(木) 11:02
2025-02-06,20:06,life,ライフ,37,リセマム,【高校受験2025】福岡県私立高、一般前期までの志願倍率…大濠3.31倍,https://news.yahoo.co.jp/articles/da796953a11811ccc791e575f159a90e3b0b5049,2/6(木) 16:53
2025-02-06,20:06,life,ライフ,38,ねとらぼ,【60代以上の男性が選ぶ】評判よりもずっとおいしいと思う「カレーチェーン」ランキング！　2位は「カレーハウスCoCo壱番屋」、1位は？,https://news.yahoo.co.jp/articles/a9fec113d54ef04af4979eeb84d911b7191cfe77,2/6(木) 19:10
2025-02-06,20:06,life,ライフ,39,ねとらぼ,ポケモン好きの息子に母が作ったもの、30年後に見てみると……　思い出の一品が300万表示「幼稚園でも人気で自慢だった」「愛を感じる」,https://news.yahoo.co.jp/articles/d91136559d2fa7430dcb20289bd2155088b83842,2/6(木) 19:30
2025-02-06,20:06,life,ライフ,40,まいどなニュース,リュックサックの「型崩れ」防止　警視庁のアイデアに目からウロコ「マジで入れておくと良いぞ」,https://news.yahoo.co.jp/articles/2d34b6dca0083cfedf4756c4a250e91e69ec8d52,2/6(木) 18:00
