scrp_date,scrp_time,genre_en,genre_jp,rank,media_jp,title,link,date_original
2024-05-05,15:23,domestic,国内,1,関西テレビ,【カメムシ春の大発生】専門家たちも初めて見るレベル　LEDへの切り替えなどで対応を,https://news.yahoo.co.jp/articles/9ebbc511475c52455d2506b29027b794c0418a78,5/5(日) 6:50
2024-05-05,15:23,domestic,国内,2,CBCテレビ,「脂質異常症」改善オススメ最強食材とは!?…専門医に学ぶ！脂質異常症の原因と対策,https://news.yahoo.co.jp/articles/e04abf5975f4a1a5d04bb342b9228e7a74785c31,5/5(日) 7:10
2024-05-05,15:23,domestic,国内,3,スポニチアネックス,看板で有名な「きぬた歯科」富士山人気撮影スポット問題解決に名乗り「いいアイデア」「逆に観光名所に」,https://news.yahoo.co.jp/articles/3e6e98a731574968e26a72918dfc4c1191cae228,5/2(木) 15:26
2024-05-05,15:23,domestic,国内,4,デイリースポーツ,乙武洋匡氏、補選落選で「お金がもうないです」の本音　連日大音量浴び「ずっと不眠」,https://news.yahoo.co.jp/articles/932bd29163b74070cff46c21285b25005ca4066b,5/5(日) 10:56
2024-05-05,15:23,domestic,国内,5,東海テレビ,アクセルとブレーキも分からず走行…免許を一度も取ったことない25歳市職員が公用車を運転 減給の懲戒処分,https://news.yahoo.co.jp/articles/65f838b3b5ae73b8af75057fa2d8209a1ede4f9f,5/2(木) 17:09
2024-05-05,15:23,domestic,国内,6,ニッポン放送,リニア中央新幹線「失敗すれば国民負担の可能性も……あらためて必要性の国民的議論を」石川和男が指摘,https://news.yahoo.co.jp/articles/4ffa4f0e6df44c7dea27d02bc1e89dea5fb8cb93,5/5(日) 11:40
2024-05-05,15:23,domestic,国内,7,読売テレビ,【年金密着】80歳で収入は年金月額4万5000円のみ 50年以上銭湯で働き2人の子どもと妻を支えていたが　がんで先立たれ…　「のんびりやっていけるのは全部嫁の力」 男性のささやかな楽しみは競艇と競馬,https://news.yahoo.co.jp/articles/c16c88d68e977de382a9f432c82b4d9b400c69b3,5/4(土) 18:00
2024-05-05,15:23,domestic,国内,8,日刊スポーツ,乙武洋匡氏「お金がもうないですね」東京15区補選終え告白　泉谷しげる「また無所属で」と期待,https://news.yahoo.co.jp/articles/ff69fed8f18d463b7879696f172a96f7b5217924,5/5(日) 12:37
2024-05-05,15:23,domestic,国内,9,Yahoo!ニュース オリジナル 特集,「いったい、どのような入試が望ましいのか」中学受験、議論を呼ぶ問題の難化スパイラル #こどもをまもる,https://news.yahoo.co.jp/articles/c6d8ab21e32568a6a58c978bde58e4b77ec7fb75,5/4(土) 17:08
2024-05-05,15:23,domestic,国内,10,TBS NEWS DIG Powered by JNN,京都府、大阪府、兵庫県で最大震度1の地震　京都府・京都中京区、京都右京区、京都西京区、亀岡市、南丹市,https://news.yahoo.co.jp/articles/632f34557546d4f4161a494a66023ff46dccf035,5/5(日) 14:57
2024-05-05,15:23,domestic,国内,11,カナロコ by 神奈川新聞,米空母ロナルド・レーガン、横須賀を出港　長期整備明け、短期の試験航海か,https://news.yahoo.co.jp/articles/116e55bf14504752806629c9f9941e457102bde5,5/5(日) 14:20
2024-05-05,15:23,domestic,国内,12,tenki.jp,GW終盤「みずがめ座η流星群」が極大　1時間10個ほどの流星数　気になる天気は?,https://news.yahoo.co.jp/articles/efa4a64ddd8b323b26e96bf1127e3656ef6feab5,5/5(日) 12:09
2024-05-05,15:23,domestic,国内,13,読売新聞オンライン,自転車ヘルメット浸透せず、都内着用９％…「面倒」「置き場所ない」「髪形崩れる」,https://news.yahoo.co.jp/articles/6bc638212479f9671b77a789ef845f1080777777,5/5(日) 14:34
2024-05-05,15:23,domestic,国内,14,日刊スポーツ,「富士山ローソン」観光客殺到２店舗に本部が対応策「多言語表記にて」,https://news.yahoo.co.jp/articles/9b481c4633ca59947f4b9d84cc4cdc1fac7d6af9,5/5(日) 13:43
2024-05-05,15:23,domestic,国内,15,デイリースポーツ,高橋洋一氏「バイデン氏は単なるアホ　トランプ氏が正しい」通貨安でＧＤＰは上昇「いずれ１ドル１１０～１２０円に落ち着く」,https://news.yahoo.co.jp/articles/c1eab208d1d65c800c7eb557f45e55b26666c463,5/4(土) 20:57
2024-05-05,15:23,domestic,国内,16,スポーツ報知,「サンモニ」膳場貴子アナ、「３補選全敗」の自民党に見解…「若手議員から改革を進めようとする動きがなかなか出て来ない…もどかしさを感じる」,https://news.yahoo.co.jp/articles/c23221a0a135353c8091fdeee70653e44d484f77,5/5(日) 9:14
2024-05-05,15:23,domestic,国内,17,ABEMA TIMES,足立区の環七で乗用車とパトカー数台が“カーチェイス”,https://news.yahoo.co.jp/articles/a8c93d4700fc2205c87ac684b92a3407d5b57928,5/5(日) 7:22
2024-05-05,15:23,domestic,国内,18,東海テレビ,助かった4歳女の子「お母さんがまだ車の中に…」事故起こした車が炎上し運転手と投げ出された2歳女の子が死亡,https://news.yahoo.co.jp/articles/17d1efcde50c57cac37c1633c9a8a034be0b18c1,5/3(金) 17:21
2024-05-05,15:23,domestic,国内,19,スポーツ報知,泉房穂氏、「サンジャポ」で「ポスト岸田」報道への違和感を明かす…「国民の声をテレビや新聞は報じるべき」,https://news.yahoo.co.jp/articles/bfb65867625c40d791f43be518a8523f8e6b24e4,5/5(日) 11:14
2024-05-05,15:23,domestic,国内,20,スポーツ報知,デーブ・スペクター氏、バイデン大統領の「日本は外国人嫌い」発言に私見「リップサービスをしてるんですよ」,https://news.yahoo.co.jp/articles/422dabdecfa2a4f63cc4df47702eab6ced7364d5,5/3(金) 21:45
2024-05-05,15:23,domestic,国内,21,日刊スポーツ,犬塚浩弁護士、東京15区補選での妨害行為「生まれうる状態」「選挙そのものがカオスな状態」,https://news.yahoo.co.jp/articles/df90839798da16fa14da0211648beebb68e4622f,5/5(日) 13:31
2024-05-05,15:23,domestic,国内,22,読売新聞オンライン,仙台のホテル、バスケ部員１２人病院搬送…秋田から遠征中の高校生,https://news.yahoo.co.jp/articles/d699201d900e27152544eb802e3e7a39c14051f9,5/5(日) 13:48
2024-05-05,15:23,domestic,国内,23,J-CASTニュース,日本の順位なぜ下がる　「報道の自由度ランキング」が蒸し返す「フクシマ・ウォーター」「放射能処理水」,https://news.yahoo.co.jp/articles/917a3bfb8f645a17d79c0b34defb8698d479bdbc,5/5(日) 13:30
2024-05-05,15:23,domestic,国内,24,テレビ朝日系（ANN）,富士山“目隠し”騒動　別のコンビニに外国人観光客集結…撮影スポット化で車の妨げに,https://news.yahoo.co.jp/articles/4827b8fde6825a78965f2956770f3b2c2e8cc6c4,5/3(金) 14:12
2024-05-05,15:23,domestic,国内,25,テレビ朝日系（ANN）,ホテル「備品持ち帰り」続出　客室のテレビ、空気清浄機も被害　スーツケースに入れ？,https://news.yahoo.co.jp/articles/4e7fc67ba0e80784e286c3ec61e4bc887595c407,5/4(土) 12:48
2024-05-05,15:23,domestic,国内,26,47NEWS,議員の「知りませんでした」もう終わりに　看板にペンキ投げつけられた苦い記憶 　元特捜部長の五十嵐紀男弁護士に聞く【裏金国会を問う】,https://news.yahoo.co.jp/articles/83e58eaea5ba3167f9070f4c0f29f6e533456877,5/5(日) 10:32
2024-05-05,15:23,domestic,国内,27,ウェザーマップ,石川県加賀市で33.8℃　全国で今年一番の暑さに　真夏日地点続出　熱中症に注意　連休最終日は西日本中心に雨や風強まる,https://news.yahoo.co.jp/articles/9ee0c4305b8fb6673f3e76862d47529e003e0117,5/5(日) 14:26
2024-05-05,15:23,domestic,国内,28,共同通信,富士山撮影スポットに黒幕、山梨　訪日客マナー違反、町が設置へ,https://news.yahoo.co.jp/articles/7dd25307125cf9e37d1f647d632d0ea574c45a13,4/30(火) 15:28
2024-05-05,15:23,domestic,国内,29,ウェザーマップ,真夏並みの暑さのち荒天に警戒　GW最終日にかけて九州・中国は警報級暴風・大雨のおそれ,https://news.yahoo.co.jp/articles/9364ec98cbfe957810c6bf6a29ecd67568b5989e,5/5(日) 11:46
2024-05-05,15:23,domestic,国内,30,朝日新聞デジタル,電動キックボード、酒気帯び運転容疑　自称・市職員を現行犯逮捕,https://news.yahoo.co.jp/articles/df6bc84a7e3030770a6b6afcfc2b45fd1c0f2722,5/5(日) 12:59
2024-05-05,15:23,domestic,国内,31,日刊スポーツ,小泉進次郎氏、長男がとんかつを食べる後ろ姿の写真を投稿「今日はこどもの日＆とんかつの日」,https://news.yahoo.co.jp/articles/82354fc99abc8d66fb04c045cadd59fefb728cf3,5/5(日) 14:34
2024-05-05,15:23,domestic,国内,32,読売テレビ,【特集】パートナー求めて二人三脚！入会費は約25万円、それでも婚活中の若者が続々集う『結婚相談所』　鏡が大好きなカウンセラーは、通算700人を結婚に導いた敏腕仲人！会員の幸せは自分の幸せ…“人生の岐路”に寄り添う彼女たちの素顔に密着,https://news.yahoo.co.jp/articles/ef143cd2eec2e8c6f4a8eab5c53ad8a08a26c94b,5/5(日) 11:00
2024-05-05,15:23,domestic,国内,33,共同通信,腹痛で秋田の高校生12人搬送　仙台のホテル、食中毒か,https://news.yahoo.co.jp/articles/f8f6e4cc57aa9304759f35dc7b31bea60e4c538a,5/5(日) 14:28
2024-05-05,15:23,domestic,国内,34,中日スポーツ,「頂き女子りりちゃん」、獄中日記を更新「理不尽人生全部飲みこんで、私絶対幸せなっちゃうから」「判決聞いたあの日からずっと放心状態」,https://news.yahoo.co.jp/articles/87355e26b610a7c5d5616bebef90bda7179a52ff,5/3(金) 16:38
2024-05-05,15:23,domestic,国内,35,テレビ朝日系（ANN）,解散や総裁選の対応問われ岸田総理「課題に成果を出すこと以外考えていない」,https://news.yahoo.co.jp/articles/baba8f63fe6a65d58937dd1ed05ebc86dd3c34a0,5/5(日) 13:40
2024-05-05,15:23,domestic,国内,36,時事通信,岸田首相が帰国の途,https://news.yahoo.co.jp/articles/4be7796415995c215f0500c737245e5c38552221,5/5(日) 12:25
2024-05-05,15:23,domestic,国内,37,tvkニュース（テレビ神奈川）,電車内で下半身露出か　東京消防庁職員を逮捕「はみ出してしまった」と否認,https://news.yahoo.co.jp/articles/a29513216603e3ef2ccc110306df3171c370e353,5/3(金) 18:12
2024-05-05,15:23,domestic,国内,38,読売新聞オンライン,ロデオ猿「みわ」と「ウリ坊」すっかり貫禄…名コンビ誕生の陰に悲しい物語,https://news.yahoo.co.jp/articles/7978078cb0f8be0793cc695820016ae9cbd4fffe,5/5(日) 9:01
2024-05-05,15:23,domestic,国内,39,東海テレビ,2歳位の女の子1人は外に投げ出され死亡…軽乗用車がガードパイプに突っ込み炎上 大人1人と女の子2人が死傷,https://news.yahoo.co.jp/articles/1b4d3c841f26a661cf86f94a72e28b3f41131067,5/3(金) 11:36
2024-05-05,15:23,domestic,国内,40,毎日新聞,母の日にほしいもの、最多は花ではなく…調査結果に表れた切実な願い,https://news.yahoo.co.jp/articles/8e25f45a7c02530ffc55aedd98bd92212e2a0daf,5/2(木) 19:31
