scrp_date,scrp_time,genre_en,genre_jp,rank,media_jp,title,link,date_original
2025-12-10,18:14,TTL,総合,1,MBSニュース,"夢のマイホーム建たぬまま...住宅メーカーが""突然破産""　残ったのは2000万円超のローン返済「生活が成り立たない。想像を絶するつらさ」",https://news.yahoo.co.jp/articles/1ed09adcc11c450561abd51783d794820b4b2cb6,12/10(水) 14:01
2025-12-10,18:14,TTL,総合,2,デイリースポーツ,高代延博さんが死去　第２回ＷＢＣで連覇に貢献　中日、阪神などＮＰＢ６球団でコーチを務めた名参謀,https://news.yahoo.co.jp/articles/f7f1f323a390f577dfb01268172b6a2baeef49c4,12/10(水) 16:55
2025-12-10,18:14,TTL,総合,3,スポニチアネックス,大阪在住人気バンド　メンバーの死去を発表「メンバー・スタッフ全員が、現実を受け止められない状況」,https://news.yahoo.co.jp/articles/0c9c9075d3b63acca84424ff77ddc86700c2fdc5,12/10(水) 15:06
2025-12-10,18:14,TTL,総合,4,ENCOUNT,Nintendo Switch2の“写真”を3万5000円で販売　フリマサイトの商品に「詐欺まがいの行為」の声,https://news.yahoo.co.jp/articles/04eafada153cee5c6c22883b15ef008f2217d744,12/10(水) 15:54
2025-12-10,18:14,TTL,総合,5,スポーツ報知,６０歳・中森明菜の姿に騒然「えええええ！」「髪型…」「ますます」「もう、明菜ちゃんとは呼べないレベル」,https://news.yahoo.co.jp/articles/3f3913766f3a1ec498ddf0bec09934ff2bad30a6,12/10(水) 16:15
2025-12-10,18:14,TTL,総合,6,アスキー,Gmail、外部メール利用不能まであと1ヵ月　「2025年中に移行を」呼びかけ続く,https://news.yahoo.co.jp/articles/ac88a31fd9fe030e6c6ee4328342df99076e9f85,12/9(火) 18:30
2025-12-10,18:14,TTL,総合,7,J-CASTニュース,「日本を応援するやつはくたばれ」中国で卓球・張本智和選手を襲った暴言　「許されない」水谷隼さん怒る,https://news.yahoo.co.jp/articles/6c7b6533c02022de3fb55faa44bd4bd7119fe8c1,12/10(水) 11:45
2025-12-10,18:14,TTL,総合,8,中央日報日本語版,中国が最後通告の時に使った用語、日本に突きつけた,https://news.yahoo.co.jp/articles/e317fb15816d0562e0e7a2ecc7c1c41661f2d2fc,12/10(水) 15:16
2025-12-10,18:14,TTL,総合,9,中日スポーツ,「やられた」 『じゃあ、あんたが作ってみろよ』最終回、予告シーンがまるごと消滅… 「こんなことあるんだ」「なんで？」騒然,https://news.yahoo.co.jp/articles/7651e466105362545dcc9a308bb3acb24b1fa434,12/10(水) 14:00
2025-12-10,18:14,TTL,総合,10,スポーツ報知,橋本環奈の最新姿「あわわわ」「大丈夫？」「いきなり…」「どういうこと」２ショット「美男美女すぎ」,https://news.yahoo.co.jp/articles/8051b6ccbc64cda0243f8defc016ece906cb0391,12/10(水) 14:55
2025-12-10,18:14,TTL,総合,11,スポニチアネックス,「さすがに那須川天心が可哀想」日本ボクシング空前の盛況に水差すWBCの暴挙！元日本王者が指摘,https://news.yahoo.co.jp/articles/638796759ddd8d31c20534e45050e5db4cee669f,12/10(水) 15:51
2025-12-10,18:14,TTL,総合,12,ABEMA TIMES,上野大臣の答弁を立憲がキャンセル？ 「けっこうです。けっこうです。けっこうです」「高市さん、高市さん」「高市総理が決断できないものを大臣決断できない」 医療介護業界5％賃上げめぐり国会紛糾,https://news.yahoo.co.jp/articles/cc1cb3bde1a90c63458f226949b4c4fa39003da3,12/10(水) 14:03
2025-12-10,18:14,TTL,総合,13,KURU KURA（くるくら）,ガソリン暫定税率が廃止！ ガソリンの価格はいつから何円下がる？ 軽油はどうなるの？,https://news.yahoo.co.jp/articles/756873b31fccb4a5c108a23e38903d10a3f75722,12/10(水) 13:08
2025-12-10,18:14,TTL,総合,14,スポーツ報知,「南海キャンディーズ」山里亮太、３日連続「ＤａｙＤａｙ．」休む「理由」を武田真一アナが告知…代理ＭＣは児嶋一哉,https://news.yahoo.co.jp/articles/fc9276471dc870c2eacb28a6e7aefa2aa6e79d03,12/10(水) 9:01
2025-12-10,18:14,TTL,総合,15,中日スポーツ,【広島】森下暢仁、2000万円増の年俸2億円でサイン…メジャー移籍希望については「少ししましたけど」「成績が中途半端なので」,https://news.yahoo.co.jp/articles/cc26c02023f5ac071cfe164341770f5d0e6b7c48,12/10(水) 15:53
2025-12-10,18:14,TTL,総合,16,ファイナンシャルフィールド,生前贈与は「あえて年120万円にして、贈与税1万円払う」と言う父にビックリ！ どうやら「税金回避」になるそうですが、税務署に“定期贈与”とみなされないって本当ですか？ リスクもあわせ解説,https://news.yahoo.co.jp/articles/5cf509c95f87fe47dc7ee27beec859ea7d12511c,12/10(水) 14:30
2025-12-10,18:14,TTL,総合,17,日刊スポーツ,【カーリング】五輪王手の日本代表フォルティウス初黒星、ノルウェーに逆転負け　２位でPOへ,https://news.yahoo.co.jp/articles/386cc0bd1e437a2af059efd24a5f1ce907a58433,12/10(水) 15:05
2025-12-10,18:14,TTL,総合,18,日刊スポーツ,【箱根駅伝】チームエントリー発表　青学大・黒田朝日、駒大・佐藤圭汰ら各校エースが順当に登録,https://news.yahoo.co.jp/articles/c439cddb0fbe114abcdc939ce539f866d39d52fb,12/10(水) 15:00
2025-12-10,18:14,TTL,総合,19,デイリースポーツ,ダイアン津田「パワハラもパワハラ」「腐りかけの肉を食わされ」勤務先で壮絶「悲しくて。つらすぎて。許さへんわ」　ユースケ「腐りかけが一番ウマい」には爆笑,https://news.yahoo.co.jp/articles/98faaf2d46ac2827cb0fe4d5dd6417531703782f,12/10(水) 15:48
2025-12-10,18:14,TTL,総合,20,東スポWEB,元放送作家が指摘　松岡昌宏の日テレ疑念は「前代未聞」他局からも「今後仕事は一切こない可能性」,https://news.yahoo.co.jp/articles/c1e2522624f462b1630ed9dd42d03b2f945eae8b,12/9(火) 18:40
2025-12-10,18:14,TTL,総合,21,ENCOUNT,地震の前兆？　浜に打ち上がった大量のイワシ…発生半日前の投稿にネット騒然,https://news.yahoo.co.jp/articles/bcf7b6f2e3be8780ce4139808b85c0ca9c9e54f8,12/10(水) 17:10
2025-12-10,18:14,TTL,総合,22,J-CASTニュース,「対話が通じる相手ではないと、すごく感じる」　中国がレーダー照射を正当化「この海域にいることを常態化したい」,https://news.yahoo.co.jp/articles/12bfaf9734af8d11f1e0ed296515ff911bb4aac8,12/10(水) 16:35
2025-12-10,18:14,TTL,総合,23,ねとらぼ,「家族全員分を買いました」「これ一枚で寒さも余裕」　ワークマンの“2900円ライトダウン”が大好評　「軽くて薄くてあたたかい、そして安い」「風が吹いても中はぽかぽか」,https://news.yahoo.co.jp/articles/60fc59b17ff6aa4a5b2e1ae7eeac06d8da2f7b26,12/10(水) 13:20
2025-12-10,18:14,TTL,総合,24,FNNプライムオンライン,レーダー照射は中国に逆風か…日本に圧力はかけにくい?指導部と国民のかい離に見る中国社会の“成熟”,https://news.yahoo.co.jp/articles/dfc5d8fcdb55e13b2b34b38698111de49c787b55,12/10(水) 17:39
2025-12-10,18:14,TTL,総合,25,J-CASTニュース,登録者173万超YouTuber、解散を発表　「自分のやりたかったことで生きれてないのかな」リーダー思いを吐露,https://news.yahoo.co.jp/articles/1655c51b0fc616c9ff8437097dc2d30cee82e475,12/10(水) 11:00
2025-12-10,18:14,TTL,総合,26,デイリースポーツ,「誰がてめぇ庇って刺されたと思ってんだ！」瓜田純士がかつての兄貴分にブチギレ「死ぬまで許せない」１年以上集団脅迫行為の元ギャング最高幹部との因縁マッチが決定　引退撤回,https://news.yahoo.co.jp/articles/25138327f7229b9010b6492cbc16b75bc26dd94c,12/10(水) 11:47
2025-12-10,18:14,TTL,総合,27,東スポWEB,井上尚弥の年間４試合に不安の声「疲労が蓄積」「５歳以上も老けて見える」海外報道,https://news.yahoo.co.jp/articles/b326ebee158f2cd7272966c73e0375d743a47053,12/10(水) 14:00
2025-12-10,18:14,TTL,総合,28,ファイナンシャルフィールド,大阪から福岡への帰省は毎回「新幹線」を利用しています。ママ友に「ぜいたく」と言われたのですが、そうなのでしょうか？,https://news.yahoo.co.jp/articles/4500e186eb0e38798d851b2de68e5ae398fc6ef5,12/10(水) 13:20
2025-12-10,18:14,TTL,総合,29,まいどなニュース,下半身が繋がった結合双生児で生まれ…分離手術から37年、現在は双子の父親に！亡き兄への思いとは【徹子の部屋】,https://news.yahoo.co.jp/articles/e84155a627218647e414fc89958c5883ccf564dd,12/10(水) 11:51
2025-12-10,18:14,TTL,総合,30,Full-Count,ド軍移籍で“唯一の不安”「どうなるんやろ」　107億円で大物獲得も…ファンが懸念するワケ,https://news.yahoo.co.jp/articles/3591cfe8ee401fdf14c64d401a5d0ee5f4eebf3b,12/10(水) 15:48
2025-12-10,18:14,TTL,総合,31,スポニチアネックス,前巨人・戸田懐生が1年総額2000万円で韓国・NCダイノス加入！武田翔太らに続き「アジア枠」で挑戦,https://news.yahoo.co.jp/articles/660d1925a8c43db21623d9a2e9e314d5a9d783ed,12/10(水) 17:00
2025-12-10,18:14,TTL,総合,32,デイリースポーツ,【高市自民】ネット大荒れ「これ本物か？」「日本側の女性の声が」「怪しい」　中国軍まさか→小泉大臣に反論、訓練通告の音源Ｘ公開「反論余地ない証拠」と　真偽不明で騒然「違和感」「中国訛りの英語のような」「これでなぜレーダー照射」,https://news.yahoo.co.jp/articles/2dfae2ac10f8098ca14ed2726405b39e19a80f51,12/10(水) 0:29
2025-12-10,18:14,TTL,総合,33,FNNプライムオンライン,“グエー 死んだンゴ…” 父も知らなかった「22歳の遺言」　“ぼっち”ではなかった息子の生きざまが起こした奇跡,https://news.yahoo.co.jp/articles/1d45340987765f792615fb64e909b3e57bc7e3a6,12/9(火) 10:30
2025-12-10,18:14,TTL,総合,34,日刊スポーツ,小沢一郎氏「高市首相は自ら引き起こした日中対立を解決するつもりがないようにさえ見える」,https://news.yahoo.co.jp/articles/43070a1a09d585a5f72625b18c2cde7bc327cc33,12/10(水) 15:17
2025-12-10,18:14,TTL,総合,35,ENCOUNT,キムチに虫混入訴えの女性、製造元に反論「納得できない」　監視カメラで確認も見解に食い違い,https://news.yahoo.co.jp/articles/00fdebaee012547541e89b0a2d570467bb34aa97,12/10(水) 11:54
2025-12-10,18:14,TTL,総合,36,日刊スポーツ,海上自衛隊の元海将が断言「日本の防空規則は世界で一番厳しい」「相手を挑発、威嚇しないプロ」,https://news.yahoo.co.jp/articles/30d20f5723ccc1482e4f3b93d0d9ecfde13e1227,12/10(水) 14:27
2025-12-10,18:14,TTL,総合,37,中日スポーツ,高蔵寺・芹沢大地、ヤマハに内定…日米スカウト注目の最速151キロ左腕、明大の高須大雅投手、近大の野間翔一郎外野手も,https://news.yahoo.co.jp/articles/02a2a79acd831e6e2d81a7f6e8cf90514d09a67c,12/10(水) 13:34
2025-12-10,18:14,TTL,総合,38,ねとらぼ,「セリフ全然入ってこない」　中条あやみの“まさかの服装”にネット騒然　「三度見」「注意してあげたらいいのに……」【じゃあ、あんたが作ってみろよ】,https://news.yahoo.co.jp/articles/19e9b70e50121bad7752d9a9052be54f32481bb3,12/10(水) 17:19
2025-12-10,18:14,TTL,総合,39,デイリースポーツ,広島・森下暢仁が２０００万増の２億円で更改「上げてもらいました」１時間２０分交渉で契約更改「ちゃんと評価してもらえた」メジャー挑戦の話も「少ししました」,https://news.yahoo.co.jp/articles/5b5e8b43c210c57981b9a9f758679dd4036e10f4,12/10(水) 14:33
2025-12-10,18:14,TTL,総合,40,スポニチアネックス,オリックスから戦力外通告の福田周平が去就について語る「今はもう…」,https://news.yahoo.co.jp/articles/99962da57339f6a92ede19a554d268c8f81b7cb7,12/10(水) 17:18
