scrp_date,scrp_time,genre_en,genre_jp,rank,media_jp,title,link,date_original
2025-08-11,18:10,sports,スポーツ,1,東スポWEB,【ＭＬＢ】ヤンキース主砲・ジャッジがついに…泥沼のチーム批判「努力さえ怠っている」,https://news.yahoo.co.jp/articles/d1710e3a442ea7475f6801931fe39d1e6c6e7518,8/11(月) 14:25
2025-08-11,18:10,sports,スポーツ,2,デイリースポーツ,巨人が痛恨の完封負けで勝率５割　序盤の拙攻で好機つぶす　阪神の優勝マジック「２８」に,https://news.yahoo.co.jp/articles/d0be4b95232a7f86ce226c0c318b1b9ec02e2ac7,8/11(月) 16:48
2025-08-11,18:10,sports,スポーツ,3,中日スポーツ,中日・チェイビス、ファウルフライ追いかけ、エキサイトシートに飛び込む　観客に覆いかぶさるような形になり試合一時中断,https://news.yahoo.co.jp/articles/6c739263e863f6a518a4a5022b6717d253c5c314,8/11(月) 14:31
2025-08-11,18:10,sports,スポーツ,4,スポーツ報知,グリーリッシュ、エバートン移籍へ　１年間レンタルで合意…英報道,https://news.yahoo.co.jp/articles/c1ff3e6d2431b9101ccbc0bce066b47fe982b53e,8/11(月) 16:20
2025-08-11,18:10,sports,スポーツ,5,デイリースポーツ,新庄監督　痛恨４連敗も前向く「まだまだ４０試合ある」ソフトバンクには「うちの時、生き生きとやってますよね」,https://news.yahoo.co.jp/articles/c8f24165eba1ecd6880b79c41bb779fd8ceeb451,8/11(月) 17:35
2025-08-11,18:10,sports,スポーツ,6,Full-Count,「気の毒すぎる」甲子園でまさかの光景　“応援歌なし”の高川学園にネット注目「なんとか…」,https://news.yahoo.co.jp/articles/f21bab003a31a5931e0d3de71cda1e88ec91484f,8/11(月) 15:11
2025-08-11,18:10,sports,スポーツ,7,デイリースポーツ,中日・チェイビスのダイブで観客が下敷きのハプニング　担架で搬送　井上監督も駆けつけ、球場騒然,https://news.yahoo.co.jp/articles/08aa7a979104b76545ca1d7574b387aa495663da,8/11(月) 14:14
2025-08-11,18:10,sports,スポーツ,8,テレ東スポーツ,張本智和 日米エース対決を制して決勝進出！地元Vに王手【卓球 WTT横浜】,https://news.yahoo.co.jp/articles/1c1c842b34f4be13451fbdca5ec89231d67b6f1b,8/11(月) 12:29
2025-08-11,18:10,sports,スポーツ,9,中日スポーツ,ロバーツ監督、大谷翔平に２つの苦言「絶対にやってはいけない」…三盗失敗、９回の絶好機で空振り三振,https://news.yahoo.co.jp/articles/b84c2702d84102b1d7e5ea4c923ffd6850b7d3d1,8/11(月) 9:13
2025-08-11,18:10,sports,スポーツ,10,Full-Count,甲子園でハプニング…ぽっかり空いた応援席「間に合わない」　到着は絶望的,https://news.yahoo.co.jp/articles/af8a4b3f5a9c704b77ead7bacf95458f651c5279,8/11(月) 12:25
2025-08-11,18:10,sports,スポーツ,11,J-CASTニュース,美女サーファー松田詩野、美ボディのぞくハーフトップ姿が圧巻　「鍛えられた体がカッコいい」の声,https://news.yahoo.co.jp/articles/fd8c690c093d810314f0c065368866941741ca2d,8/11(月) 15:00
2025-08-11,18:10,sports,スポーツ,12,日刊スポーツ,ロバーツ監督「ショウヘイと話した」大谷翔平と打線の話し合い「必要なことならやってください」,https://news.yahoo.co.jp/articles/a3025eced3f30b40c3cb6acce3049c8d62d06c91,8/11(月) 12:36
2025-08-11,18:10,sports,スポーツ,13,CoCoKARAnext,藤川阪神の強さは「盗む技術」にあり！元投手コーチが感嘆「これはすごい。あまりにも完璧すぎる」　剛速球にも難なく対応,https://news.yahoo.co.jp/articles/88a54c7f5c405360069ef1ae8f955257fe47f343,8/11(月) 16:20
2025-08-11,18:10,sports,スポーツ,14,中日スポーツ,「すっぴんですか？」往年のグラビアクイーンが見せる機内でのリラックスショットに…ネット「やはり華がある」「綺麗です」,https://news.yahoo.co.jp/articles/e1d52c86f65885fa29e069837f62ca4468b49ace,8/11(月) 13:32
2025-08-11,18:10,sports,スポーツ,15,西スポWEB OTTO！,強すぎるソフトバンク　首位攻防3連戦で日本ハムをスイープ　5月に借金7の最下位も…驚異的巻き返しで4ゲーム差の首位　最短14日にもM点灯,https://news.yahoo.co.jp/articles/6b90aceb43ae142e2527c87ca3c53efb79254ab7,8/11(月) 17:12
2025-08-11,18:10,sports,スポーツ,16,デイリースポーツ,「ため息が出るスタイルの良さ」デニム姿で降臨の超絶美女にドーム騒然　悲願のノーバンならずも笑顔で魅了「脚長すぎる」「ほんと綺麗」,https://news.yahoo.co.jp/articles/6939189a898cfa60a8f5543003d19fec5578e480,8/10(日) 23:20
2025-08-11,18:10,sports,スポーツ,17,TBS NEWS DIG Powered by JNN,【日本ハム】逆転負け 痛恨の3タテ喰らい4ゲーム差...敵地で6連敗 万波が初回に先制弾も孫が踏ん張れず 上原が牧原大に痛打 好機に1本出ず,https://news.yahoo.co.jp/articles/5ac4e62d803a62f619ee71a1f41551c2a0b5d6bf,8/11(月) 17:13
2025-08-11,18:10,sports,スポーツ,18,RONSPO,「何が本当なんだ？SNSに振り回される馬鹿げた社会になった」広陵の異例の大会途中辞退に“反対論”を掲げていた93歳の日本球界大御所が怒りと嘆き…「高野連も戸惑っているんじゃないか」,https://news.yahoo.co.jp/articles/e41f299c925ceb3d0fe31796859e1e8cfa69404d,8/11(月) 6:32
2025-08-11,18:10,sports,スポーツ,19,サンケイスポーツ,【GⅠ裏話・宝塚記念】全てがかみ合ったメイショウタバル　きっかけは一本の電話だった,https://news.yahoo.co.jp/articles/df316e51a92f31cf53bc02de5bcdb511239418a4,8/11(月) 15:28
2025-08-11,18:10,sports,スポーツ,20,デイリースポーツ,清原和博氏が「文通」していた、まさか相手　同い年の女子トップスター　谷繁氏ガチ情報と伝え「ジャンク」騒然「ええーっ！？」　浜田雅功も「ほんまに！？」,https://news.yahoo.co.jp/articles/ab61fa69d66ccf070f08aaaa0133d3ff2bd63269,8/11(月) 17:19
2025-08-11,18:10,sports,スポーツ,21,デイリースポーツ,プロ注目左腕がまさかの８失点　未来富山・江藤「全国には僕の力は通用しないと痛感した」「力不足です」,https://news.yahoo.co.jp/articles/b6da8b37a4ebc404cb507dc08ea9e1b79161e000,8/11(月) 17:08
2025-08-11,18:10,sports,スポーツ,22,日刊スポーツ,【アクシデント】中日チェイビスが客席に飛び込み観客が下敷きに　その後担架で運ばれる,https://news.yahoo.co.jp/articles/32c62a6f3b2f542ff8ef6f47200802828f5cefd7,8/11(月) 14:44
2025-08-11,18:10,sports,スポーツ,23,東スポWEB,【Ｆ１】角田裕毅とレッドブルの舞台裏巡りガスリーが爆弾発言「口に出せないこともある」,https://news.yahoo.co.jp/articles/53b2bef19dbb75ca2153a10afb03244886646080,8/11(月) 17:31
2025-08-11,18:10,sports,スポーツ,24,東スポWEB,ロバーツ監督の〝大谷翔平批判〟に米メディア狼狽「大谷でさえも批判から逃れられない」,https://news.yahoo.co.jp/articles/46f403335557407e2651d43041074766ed81e486,8/11(月) 16:50
2025-08-11,18:10,sports,スポーツ,25,スポニチアネックス,【卓球】波紋　張本智和「許せないと思います」妹・美和を破った早田サイドの治療対応に言及,https://news.yahoo.co.jp/articles/bcaba4d723cb7694d842e22d143bece73a2da8c4,8/10(日) 19:29
2025-08-11,18:10,sports,スポーツ,26,Full-Count,大谷翔平の打席で敵監督が激怒「なぜ」　顔真っ赤…ファンからも疑問殺到「最悪の判定」,https://news.yahoo.co.jp/articles/886fcbb14a8ec74a2e2fcf2df8d053c40f3e266c,8/11(月) 12:09
2025-08-11,18:10,sports,スポーツ,27,Full-Count,「いや本当にやるんかいw」甲子園に流れた一曲に騒然　“ツッコミ”入るも「最高やんか」,https://news.yahoo.co.jp/articles/bf137e11d3977da5d59b70a1fde28dad69ce2e42,8/11(月) 17:44
2025-08-11,18:10,sports,スポーツ,28,サンケイスポーツ,中日・チェイビスが飛球を追って客席にダイブ　下敷きになった観客が担架で運び出される,https://news.yahoo.co.jp/articles/ae6ba0d4cbe53661c3877d0f8d0fa21ee3131102,8/11(月) 14:45
2025-08-11,18:10,sports,スポーツ,29,日刊スポーツ,【中西清起】独走阪神は余裕の采配で日本Ｓ視野に　不思議は本塁打数トップ佐藤輝の死球「0」,https://news.yahoo.co.jp/articles/4039085cc8a25ce8a34dd8817a7e4f8c3f6dd62a,8/11(月) 17:22
2025-08-11,18:10,sports,スポーツ,30,TBS NEWS DIG Powered by JNN,【巨人】今季10度目の完封負けで連勝ストップ...阪神と12G差＆M28に 中5日の戸郷は5回2失点で7敗目 打線はわずか4安打と沈黙,https://news.yahoo.co.jp/articles/4b3dd9a03332f9d13dd0cd213fca5b7802a3a1bd,8/11(月) 16:44
2025-08-11,18:10,sports,スポーツ,31,Full-Count,甲子園で1年生が147キロ連発「ビビった」　マウンドで躍動する13番に熱視線「すごすぎ」,https://news.yahoo.co.jp/articles/0d66db2c5de429bfddd0d03d2e92b6a34ae872f9,8/11(月) 12:46
2025-08-11,18:10,sports,スポーツ,32,スポーツ報知,【日本ハム】首位ソフトに痛恨３タテ食らい４差に拡大…２０年以来敵地ソフト戦７連敗,https://news.yahoo.co.jp/articles/f9c5f9bec358353da5e20db3bec6166909bfd36c,8/11(月) 17:13
2025-08-11,18:10,sports,スポーツ,33,Full-Count,甲子園でハプニングも…生まれた光景が「素敵すぎる」　不運に“助っ人”登場「なんも違和感ない」,https://news.yahoo.co.jp/articles/7c5ee684d89e25b287bbd1139152a4fd9749d989,8/11(月) 13:34
2025-08-11,18:10,sports,スポーツ,34,高校野球ドットコム,全校生徒25人中23人が野球部員の未来富山、頼みのエースがまさかの8失点で聖地初勝利ならず【25年夏甲子園】,https://news.yahoo.co.jp/articles/8f108b11260d3e021a41402dedf8e52ace663561,8/11(月) 16:39
2025-08-11,18:10,sports,スポーツ,35,スポニチアネックス,東京ドーム騒然　中日チェイビスがエキサイトシートにダイブ　観客が96キロの下敷きに、試合中断,https://news.yahoo.co.jp/articles/ac71025fc20c831b68179bc1463c8ab01f65bbb5,8/11(月) 14:31
2025-08-11,18:10,sports,スポーツ,36,スポーツ報知,【中日】チェイビスが飛球追って観客席に突っ込む　すぐに立ち上がったが、衝突した観客が心配,https://news.yahoo.co.jp/articles/68073094b5926df6a5d821eac2468fb248ac2efd,8/11(月) 14:37
2025-08-11,18:10,sports,スポーツ,37,CoCoKARAnext,「どれだけの投手か忘れたのか」米識者が大谷翔平の打者専任論に異見！　「ファンを惹きつけるのは彼が打つから」の声に反発,https://news.yahoo.co.jp/articles/737e27a8792c0e8ba213e3b47020738dc9754950,8/11(月) 17:02
2025-08-11,18:10,sports,スポーツ,38,高校野球ドットコム,未来富山のプロ注目左腕がまさかの6回途中まで被安打11、8失点…完投続きだった富山大会の激闘が影響か,https://news.yahoo.co.jp/articles/af13042fad5bec9049213450c619294f6cbcab05,8/11(月) 15:52
2025-08-11,18:10,sports,スポーツ,39,TBS NEWS DIG Powered by JNN,番付崩壊…期待の“大豊時代”が一転、不振の両横綱へ横審苦言呈す「残念至極だ」両雄には9月場所に期待,https://news.yahoo.co.jp/articles/b5995d28467266ffbc787ad6e20ae803fc0cae4a,8/11(月) 12:03
2025-08-11,18:10,sports,スポーツ,40,日テレNEWS NNN,【中日】完封勝利で4位浮上　松山晋也が今季30セーブ　山本泰寛が今季東京ドーム3本目のアーチ,https://news.yahoo.co.jp/articles/1f0fa3346454e18ea304895e17641e5ac7485d6f,8/11(月) 17:06
