scrp_date,scrp_time,genre_en,genre_jp,rank,media_jp,title,link,date_original
2025-05-09,10:35,domestic,国内,1,J-CASTニュース,社長が従業員を殴る蹴る...暴行動画がネット拡散　札幌の建設会社側「補償のため示談したい」、支援のバスケチームは契約解除,https://news.yahoo.co.jp/articles/4720655693b66af72abf01e6ad35dfe8fbbd30e1,5/8(木) 18:25
2025-05-09,10:35,domestic,国内,2,読売新聞オンライン,オートレースで３億６５００万円が的中、申告せず７７００万円脱税…無職の５１歳男が起訴事実認める,https://news.yahoo.co.jp/articles/e911e45b47ae1ac5a893567dfd9be6b24268f310,5/9(金) 7:57
2025-05-09,10:35,domestic,国内,3,産経新聞,国民民主・榛葉氏「不安で寝られない」外国人土地取得規制で政府は司令塔や海外事例答えず,https://news.yahoo.co.jp/articles/b6ce11c647411903d1aa249bbb59f0844507f307,5/9(金) 7:00
2025-05-09,10:35,domestic,国内,4,スポニチアネックス,「政府・自民　消費減税を見送る方針」トレンド急上昇！ネット「じゃあ何をしてくれるの」「それでいい」,https://news.yahoo.co.jp/articles/a05c59f209a00a45e4b33b4f618417e5616dbe76,5/9(金) 8:23
2025-05-09,10:35,domestic,国内,5,FNNプライムオンライン,「先生がやられたから逃げるしかなかった」小2授業中の教室に20代と40代の男が侵入し担任に暴行　逮捕の男2人は児童の母親の友人　東京・立川市立第三小学校,https://news.yahoo.co.jp/articles/307356bf7988bb1533267fa96da403545928a728,5/8(木) 19:52
2025-05-09,10:35,domestic,国内,6,TBS NEWS DIG Powered by JNN,「ほとんどみんな泣いていた」小学校で男2人が教職員暴行、保護者の知人 現行犯逮捕【Nスタ解説】,https://news.yahoo.co.jp/articles/090bc5efc4e1cc546f14738ac499424421c81f36,5/8(木) 22:03
2025-05-09,10:35,domestic,国内,7,読売新聞オンライン,政府・自民、消費税減税を見送り方針…代替の財源困難・「財源論置き去り」の経済対策と一線,https://news.yahoo.co.jp/articles/1b73695d9910464d0496bf660563551d288fe9ba,5/9(金) 5:00
2025-05-09,10:35,domestic,国内,8,毎日新聞,東京・立川の小学校侵入　いじめ対応を巡るトラブルが背景か,https://news.yahoo.co.jp/articles/4bac2b8871328c73a60baede4d9104f64200b3d3,5/8(木) 18:55
2025-05-09,10:35,domestic,国内,9,朝日新聞,国道交差点で2人死亡事故　歩行中の女性とバイクの男性　埼玉・越谷,https://news.yahoo.co.jp/articles/006f860b7fcd31f2aafd827c122f72e9aa913428,5/9(金) 8:24
2025-05-09,10:35,domestic,国内,10,日刊スポーツ,暴力動画拡散　北海道の建設会社に札幌市も対応「確認が取れ次第、認証取り消し」Ｂリーグに続き,https://news.yahoo.co.jp/articles/813d2a1a3987024df4d5b3abf8d9c86a8c0bd048,5/8(木) 17:27
2025-05-09,10:35,domestic,国内,11,よろず～ニュース,斎藤知事 消費者庁から「公式見解と異なる」指摘受けたことに「一般的な法解釈のアドバイス」会見で質問集中,https://news.yahoo.co.jp/articles/670b9bbc3976299449512ffc685ebec1e7eaf0c0,5/9(金) 7:10
2025-05-09,10:35,domestic,国内,12,テレビ朝日系（ANN）,小学校に男ら侵入・暴行なぜ？　きっかけは“児童間のトラブル”,https://news.yahoo.co.jp/articles/b23a468e4208632749811ca5e1de7e7c253c1111,5/8(木) 20:01
2025-05-09,10:35,domestic,国内,13,レスキューナウニュース,近鉄名古屋線で人身事故 一部運転見合わせ,https://news.yahoo.co.jp/articles/a42b86a7fb4b34aa82f878014f0c92217ee484bf,5/9(金) 7:45
2025-05-09,10:35,domestic,国内,14,FNNプライムオンライン（フジテレビ系）,【速報】愛子さまがホテルを出発　万博視察二日目は「EXPOアリーナ」「夢の球体」などに足を運ばれる予定,https://news.yahoo.co.jp/articles/f1bd1d28c8feab7570843a0bf87bbc78a8aca463,5/9(金) 9:46
2025-05-09,10:35,domestic,国内,15,東海テレビ,自転車側に一時停止線…信号のない交差点で車と出合い頭に衝突 自転車の16歳男子高校生が意識不明の重体,https://news.yahoo.co.jp/articles/9b8a0a8363218ddffeb60cfeecaa3c691cf00885,5/9(金) 6:03
2025-05-09,10:35,domestic,国内,16,産経新聞,「右の人が入る法案許せるか」発言は北大教授　FBで「学術会議が右派にお墨付きは害」,https://news.yahoo.co.jp/articles/31cbc6992e521ba5e7180fc64352112180d45682,5/9(金) 7:00
2025-05-09,10:35,domestic,国内,17,47NEWS,ローマ教皇を選ぶコンクラーベ、投票資格がある日本人枢機卿ってどんな人？　「田舎の司祭になりたかった」被爆２世、大阪の前田万葉さん,https://news.yahoo.co.jp/articles/d434eeb0c9534b3255e7e9d8931f855c977a160f,5/7(水) 9:02
2025-05-09,10:35,domestic,国内,18,読売テレビ,【物議】『本籍を皇居に』申請殺到!?東京駅や東京大神宮…ランドマーク多数の東京・千代田区に本籍を置く人が人口の約3倍！業務ひっ迫で現場は悲鳴…背景にある「法律の改正」,https://news.yahoo.co.jp/articles/55b0e90b973d18ff3d191db230ce6d67cfb2121d,5/9(金) 8:00
2025-05-09,10:35,domestic,国内,19,東海テレビ,うじがわいたビニール袋の中に…マンションのベランダに“赤ちゃんの遺体” 母親とみられる21歳女を逮捕,https://news.yahoo.co.jp/articles/5ed349274a87f790a1836ce94b6a2b9d863a9f58,5/9(金) 6:24
2025-05-09,10:35,domestic,国内,20,FNNプライムオンライン,児童の母親とタクシーで訪問、正門から侵入…授業中の小学校に男2人が侵入　教職員5人がけが　東京・立川市,https://news.yahoo.co.jp/articles/1301446bf6cc7c574bb536d8fa4b19d4e36366a0,5/9(金) 10:02
2025-05-09,10:35,domestic,国内,21,ABEMA TIMES,体格差を物ともせず挑む子猫！優しく手加減をする大型犬の姿に「優しいコですね」「可愛いしかない」とほっこり,https://news.yahoo.co.jp/articles/3989aadc5ce4bf5be9c1a9634c59dd15f36c80fe,5/9(金) 7:51
2025-05-09,10:35,domestic,国内,22,スポーツ報知,「厳しい対応をしてほしい」…東京・立川「小学校襲撃事件」容疑者２人へ「サン！シャイン」カズレーザーが断「ちゃんと罪に問うべき」,https://news.yahoo.co.jp/articles/fe0e874e6483e50bfcf484dee322b0b6d85758de,5/9(金) 9:34
2025-05-09,10:35,domestic,国内,23,FNNプライムオンライン,コメが売れる、売れる!　物価高騰中のGWに土産物店で飛ぶように売れたのはコメ・東京より安く日常用に購入【山形発】,https://news.yahoo.co.jp/articles/95fc2107eca786847b587618d9c2e02d5d4ae4b2,5/9(金) 7:04
2025-05-09,10:35,domestic,国内,24,スポニチアネックス,暴力動画拡散、北海道の建設会社に札幌市も対応「事実の確認が取れ次第、認証取り消しの手続きを進めて…」,https://news.yahoo.co.jp/articles/8ee08a1ecfca10e6afc0da0273bb2f5ed0385373,5/9(金) 8:22
2025-05-09,10:35,domestic,国内,25,スポーツ報知,「教室に侵入した男らは子どもたちの目の前で襲いかかりました」…東京・立川「小学校襲撃」事件…「ＴＨＥ　ＴＩＭＥ，」江藤愛アナが伝える,https://news.yahoo.co.jp/articles/1cf4f46b5df040e9283caadd909b2c69f21d0fcc,5/9(金) 7:27
2025-05-09,10:35,domestic,国内,26,テレビ朝日系（ANN）,【独自】東大大学院教授ら“高額接待”強要か…共同研究団体が提訴へ,https://news.yahoo.co.jp/articles/c07ea5e5b799e6cafe8fb724c0a51a13aa5074c9,5/9(金) 1:09
2025-05-09,10:35,domestic,国内,27,読売新聞オンライン,中１男子生徒、授業の持久走で倒れ死亡…当日の健康状態に異常見られず,https://news.yahoo.co.jp/articles/dfeaa38cbc7eef06fcaeaef2e2a1be6a2bf94596,5/9(金) 8:47
2025-05-09,10:35,domestic,国内,28,FNNプライムオンライン,大学生を3回切りつけ逮捕の戸田佳孝容疑者（43）数年前に長野県移住、地元の人と交流も…地下鉄「東大前駅」をパニックに陥れる,https://news.yahoo.co.jp/articles/48f2c02a4f7b7ff0a0a6760bdcb7b8a91f90cb75,5/8(木) 20:37
2025-05-09,10:35,domestic,国内,29,読売新聞オンライン,立川小学校襲撃、男２人は瓶をたたきつけ椅子で担任殴る…児童間トラブルで面談した母親と来校,https://news.yahoo.co.jp/articles/0118caa564b91783a3feea805132498f5815eade,5/8(木) 20:33
2025-05-09,10:35,domestic,国内,30,朝日新聞,1歳と5歳を乗せた自転車はねられ、母親が死亡　高松の市道交差点,https://news.yahoo.co.jp/articles/4d902adb1983a1a6c5887f92b469a87d74caee5a,5/7(水) 13:00
2025-05-09,10:35,domestic,国内,31,読売新聞オンライン,無車検・無保険レンタカー、１年間で３００回超貸し出し…容疑の熊本の店長逮捕「売り上げ伸ばすためだった」,https://news.yahoo.co.jp/articles/554ca9123d7d2de7f285181d2bbe2e5cc40c4ec9,5/9(金) 6:33
2025-05-09,10:35,domestic,国内,32,スポーツ報知,「こんなとんでもない話、聞いたことない」…東京・立川「小学校襲撃」事件に「モーニングショー」玉川徹氏が断「厳罰に処してほしい」,https://news.yahoo.co.jp/articles/8d5af34350c76e9eb6ca21b9671647109cd4be55,5/9(金) 8:48
2025-05-09,10:35,domestic,国内,33,FNNプライムオンライン,【本人直撃】「表現の自由が憲法で保障」電車内や交番前でも“迷惑ダンス”　過激配信で投げ銭稼ぐ半裸男が主張…弁護士「威力業務妨害罪の可能性」,https://news.yahoo.co.jp/articles/8573dda58a6d7b6aad2da5405f851b2f2040243b,5/9(金) 7:13
2025-05-09,10:35,domestic,国内,34,ABEMA TIMES,「事実は全くない」石破総理、3000万円の“裏金疑惑”の報道を否定,https://news.yahoo.co.jp/articles/561f95984e41f0215f75231f10042d5adc68ed0a,5/9(金) 9:13
2025-05-09,10:35,domestic,国内,35,東海テレビ,「落下物と思った」バイクの17歳少年を車ではねて大ケガさせ逃走か 約30分後に名乗り出た72歳男を逮捕,https://news.yahoo.co.jp/articles/ab319074708662f6b948ee8ffd07df63945d74f8,5/2(金) 16:17
2025-05-09,10:35,domestic,国内,36,日刊スポーツ,石破首相、文春報道を完全否定「事実はございません」「覚えがありません」自身の政治資金疑惑,https://news.yahoo.co.jp/articles/f7db329331c40727306fa69e380c0bde9d8a347e,5/8(木) 20:01
2025-05-09,10:35,domestic,国内,37,読売新聞オンライン,北海道・鈴木知事の高校時代は「バイト漬け」、両親の離婚で生活困窮・姉は短大中退…「やることがないので掃除をしていたら」,https://news.yahoo.co.jp/articles/b00d562bf76b82c1134c8e43cb475923b3a6be92,5/9(金) 10:00
2025-05-09,10:35,domestic,国内,38,スポーツ報知,「明らかに農林水産省の失敗」…高騰続く「コメ」価格に「サン！シャイン」田崎史郎氏が断「石破さんもものすごい怒っている」,https://news.yahoo.co.jp/articles/1dab18aef69564c16201a39adf554073958b5b59,5/8(木) 10:01
2025-05-09,10:35,domestic,国内,39,読売新聞オンライン,愛子さま、２日間の万博視察へ…吉村・大阪府知事の出迎えに「楽しみにして参りました」,https://news.yahoo.co.jp/articles/898c968d8fcd28531c460a957598c06873455fa6,5/8(木) 10:38
2025-05-09,10:35,domestic,国内,40,日刊スポーツ,泉房穂氏「欠けているのは政治家の覚悟」　消費減税めぐり、政治家の“本気”問う,https://news.yahoo.co.jp/articles/8d6702d8bcecf13ea2809036bf6738e49d5d94c8,5/9(金) 9:49
