scrp_date,scrp_time,genre_en,genre_jp,rank,media_jp,title,link,date_original
2024-09-25,05:06,world,国際,1,夕刊フジ,「日本人を殺すのは規律」四川省地方政府幹部がヘイト発言　中国・深圳の日本人男児刺殺、主張する「『仇日教育ない』は真っ赤なウソ」,https://news.yahoo.co.jp/articles/cf33135d9cb04f65272019272221da6bf012e96b,9/24(火) 17:00
2024-09-25,05:06,world,国際,2,共同通信,中国、日本の論調に反発　安全リスク「事実不一致」,https://news.yahoo.co.jp/articles/5527a62ea9d7f425333e3c7ba9320f181c1845aa,9/24(火) 17:52
2024-09-25,05:06,world,国際,3,夕刊フジ,トランプ氏発言で台湾有事まで〝あと一歩〟か　習主席へ「力による現状変更」容認とも受け取れるメッセージと「チェンバレンの罠」,https://news.yahoo.co.jp/articles/81ed572711a96fc26d72cb9e0a56c7a19178e2e2,9/24(火) 17:00
2024-09-25,05:06,world,国際,4,夕刊フジ,〝サムスン凋落〟の日　半導体は「歩留まりの悪さ」で米大手から見放され…TSMCに受注競争で敗北　囁かれる「韓国こける」の現実味,https://news.yahoo.co.jp/articles/086916c671f820cd26bad8615400f0442507bd38,9/24(火) 17:00
2024-09-25,05:06,world,国際,5,共同通信,中国、自国の訪日旅行者に注意喚起,https://news.yahoo.co.jp/articles/ce9a87027f28abf053affe905b4325a340792d2f,9/24(火) 23:26
2024-09-25,05:06,world,国際,6,TBS NEWS DIG Powered by JNN,ロシア 新型ICBM「サルマト」発射実験に失敗か　衛星画像に爆発によるとみられる巨大なクレーター,https://news.yahoo.co.jp/articles/4aa24a135703fc630e6544580a6838dbf7ebc24c,9/25(水) 3:43
2024-09-25,05:06,world,国際,7,中央日報日本語版,日本料理店去った理由明かした韓国スターシェフ…「イチローが韓国代表チーム殺してやると」,https://news.yahoo.co.jp/articles/f0b7df7f35bda2f61eded92abfceec0131cdbf86,9/24(火) 17:28
2024-09-25,05:06,world,国際,8,TBS NEWS DIG Powered by JNN,10月の大型連休を前に在日本中国大使館が旅行者に「注意喚起」　深センの日本人学校の児童殺害を受けた措置か,https://news.yahoo.co.jp/articles/cc6d558e0cedee71562894dc61225764560c6eb1,9/25(水) 3:21
2024-09-25,05:06,world,国際,9,KOREA WAVE,怒る韓国、かの「石焼きビビンバ」が中国で無形文化遺産に…「少数民族の料理」だとか,https://news.yahoo.co.jp/articles/a5b51b7d3647e71bf936c265ce38e110b7df567e,9/25(水) 4:03
2024-09-25,05:06,world,国際,10,TBS NEWS DIG Powered by JNN,長崎・対馬から盗まれた仏像、韓国の浮石寺が返還を承服　100日間の「法要」実施への了承が条件,https://news.yahoo.co.jp/articles/9a0fbdd5dd054c343a8032ddfa7e49951cfbb588,9/24(火) 22:21
2024-09-25,05:06,world,国際,11,産経新聞,中国の危険情報レベルゼロ、環太平洋先進国で日本のみ　米はレベル3「拘束の危険が存在」,https://news.yahoo.co.jp/articles/0971b1eacf53f5b7c98168226a301a2d1427e9f7,9/24(火) 15:34
2024-09-25,05:06,world,国際,12,時事通信,NY株、続伸,https://news.yahoo.co.jp/articles/93ab35a231c8b8b2a6eeded68714dbdd46a1dccb,9/24(火) 23:22
2024-09-25,05:06,world,国際,13,中央社フォーカス台湾,台湾の漁師、希少な貝を54万円で売却後  購入者の求めに応じ自然に返す,https://news.yahoo.co.jp/articles/5deb7f5c65738b8514ba6f2f75a874fc214d6680,9/24(火) 18:30
2024-09-25,05:06,world,国際,14,ロイター,米大統領選支持率、ハリス氏48％・トランプ氏47％＝ＣＮＮ世論調査,https://news.yahoo.co.jp/articles/35a5f08cda6d4764c8d1fe25219e95ec4977c328,9/25(水) 2:41
2024-09-25,05:06,world,国際,15,ロイター,トルコ大統領、国連でイスラエルを糾弾　「西側価値観は瀕死」,https://news.yahoo.co.jp/articles/3b1248005eb82da79c9aec0ef9572f41c837b1ed,9/25(水) 3:30
2024-09-25,05:06,world,国際,16,ロイター,ヒズボラは大打撃被る、一段の攻撃準備整う＝イスラエル国防相,https://news.yahoo.co.jp/articles/a0100df6fc8cf0c57a901afb89b5dedd44fa8091,9/25(水) 4:29
2024-09-25,05:06,world,国際,17,テレビ朝日系（ANN）,なぜ狙われた？中国で日本人男児（10）死亡　少しずつ分かってきた“容疑者の人物像”,https://news.yahoo.co.jp/articles/5d4a2f3b959c11daa9885c5faf7ab8bdc5ba490c,9/20(金) 20:09
2024-09-25,05:06,world,国際,18,朝鮮日報日本語版,すでに中国に追い抜かれた韓国がさらに差を付けられても仕方ない理由【9月24日付社説】,https://news.yahoo.co.jp/articles/a6b8ea1e65f5fa613f738c1efba20081fd415e2c,9/24(火) 20:35
2024-09-25,05:06,world,国際,19,産経新聞,自民総裁選「米国が警戒するのはこの人」知日派評論家ハリス氏指摘　安倍元首相の伝記著者,https://news.yahoo.co.jp/articles/7f5c8785d7ef3fabc9298dc632d599ed15eecf48,9/17(火) 11:01
2024-09-25,05:06,world,国際,20,TBS NEWS DIG Powered by JNN,中国の安全上リスク「大げさに誇張されている」 中国外務省の報道官が反発　男子児童刺殺事件と「反日的言論」は無関係と強調,https://news.yahoo.co.jp/articles/8e411fef244aea39fdbeb8644f2fbf3cbf149c31,9/24(火) 18:03
2024-09-25,05:06,world,国際,21,共同通信,ロシア、ICBM実験失敗か　発射施設損傷、衛星画像に,https://news.yahoo.co.jp/articles/2f0e77aea641ae9da0d43e3ab5da75f32cb1620c,9/24(火) 22:33
2024-09-25,05:06,world,国際,22,テレビ朝日系（ANN）,ヒズボラのロケット部隊司令官ら殺害　レバノン首都ベイルートにイスラエル軍が空爆,https://news.yahoo.co.jp/articles/a95d4b9f93161b0f0334b84036f129e3e51a1c4b,9/25(水) 1:03
2024-09-25,05:06,world,国際,23,日テレNEWS NNN,英スターマー首相　ガザ地区の人質を「ソーセージ」と言い間違える,https://news.yahoo.co.jp/articles/072a478250c41d1b1906bf955ffcafc59993f350,9/25(水) 1:02
2024-09-25,05:06,world,国際,24,テレビ朝日系（ANN）,ロシア新型ICBMが爆発か？衛星画像分析新型ミサイル「サルマト」発射直後に,https://news.yahoo.co.jp/articles/848310a91b182832f86d443b2f79ab530ac84d9f,9/24(火) 20:40
2024-09-25,05:06,world,国際,25,朝鮮日報日本語版,価格は仏ラファールの4分の1なのに売れません…親中国家にもそっぽを向かれる中国戦闘機「殲10C」,https://news.yahoo.co.jp/articles/8df5b3248e22508b65619deac77062d0336b1177,9/23(月) 11:13
2024-09-25,05:06,world,国際,26,読売新聞オンライン,深圳の男児刺殺、中国在住の欧米人や韓国人にも不安広がる…「外国人が被害に遭う事件が相次いでいる」,https://news.yahoo.co.jp/articles/a043e077878affb895566d120feb314cc597f305,9/24(火) 18:42
2024-09-25,05:06,world,国際,27,朝鮮日報日本語版,「中国は半導体を除けば韓国に追い付き、大半は追い越した」「もはやわれわれ韓国人が知っている中国ではない」（上）,https://news.yahoo.co.jp/articles/419fd8b73aad7c184aa4ace561404b6bad70a592,9/24(火) 11:35
2024-09-25,05:06,world,国際,28,FNNプライムオンライン,「お前はゴミ、オレは神だ!」店員に割引強要し殴ったのは公務員…職権乱用でやりたい放題　SNSで批判殺到、停職処分に　中国,https://news.yahoo.co.jp/articles/1b7d0563a4ce621cffe810932a465a6a2b3d3d77,9/22(日) 14:02
2024-09-25,05:06,world,国際,29,日テレNEWS NNN,中国地方政府幹部「我々の規律は日本人を殺すこと」…香港メディア　当局がすでに調査か,https://news.yahoo.co.jp/articles/a0d947de37fab6769fc76656b3c0122db04baa71,9/24(火) 10:02
2024-09-25,05:06,world,国際,30,ロイター,ブラジル大統領、中国とのウクライナ紛争終結へ計画提案　国連で,https://news.yahoo.co.jp/articles/478bfc2d0a7ab0bc83a601d0d474091af242948f,9/25(水) 1:36
2024-09-25,05:06,world,国際,31,47NEWS,脅してもすかしても動じぬ台湾、加速する中国離れ　焦る習近平氏、包囲網演習は常態化【中国の今を語る④】,https://news.yahoo.co.jp/articles/fcecd37a912dc89160aed951f641039aa0a0bc6b,9/24(火) 10:02
2024-09-25,05:06,world,国際,32,時事通信,日本旅行に注意喚起　男児刺殺で警戒か　中国大使館,https://news.yahoo.co.jp/articles/82e0dd38c645189b480a0654caa88b4f02c67675,9/24(火) 21:13
2024-09-25,05:06,world,国際,33,TBS NEWS DIG Powered by JNN,スイスで“自殺ほう助カプセル”初使用か　捜査当局が数人の身柄拘束,https://news.yahoo.co.jp/articles/81ca087e5e8fa843edd81df44322c06b5ea810aa,9/25(水) 1:58
2024-09-25,05:06,world,国際,34,中央日報日本語版,【コラム】日本の不安と韓国の不満,https://news.yahoo.co.jp/articles/e7cf01e1332372a27eb564f8a0a354e20868c998,9/24(火) 13:33
2024-09-25,05:06,world,国際,35,聯合ニュース,円キャリートレード資金　「32．7兆円が清算可能性」＝韓国中銀,https://news.yahoo.co.jp/articles/c271ac3d3e0efbb4c04614d528c269d1cae26ec2,9/24(火) 14:36
2024-09-25,05:06,world,国際,36,ロイター,ゼレンスキー氏「戦争終結に近づいている」、米テレビに語る,https://news.yahoo.co.jp/articles/ddfcdc76ad2bc9cc625fdcf60e8a7305ecc26405,9/24(火) 8:39
2024-09-25,05:06,world,国際,37,共同通信,上川氏、中国に邦人安全確保迫る　王毅外相「政治化回避を」,https://news.yahoo.co.jp/articles/ed51c366e98ffb80470e7e97fda1c869a797fea4,9/24(火) 7:51
2024-09-25,05:06,world,国際,38,中央日報日本語版,韓国の「石焼きビビンバ」が中国の無形文化遺産？…徐坰徳教授「度を越した無理な主張」,https://news.yahoo.co.jp/articles/929e65ee1c0e9630427be7fde539b49af51304f7,9/24(火) 11:32
2024-09-25,05:06,world,国際,39,毎日新聞,中国外相「日本は冷静、理性的に対処を」　深圳の男児刺殺事件巡り,https://news.yahoo.co.jp/articles/5780f1eab00113e23913ade265d349ab37bc3753,9/24(火) 11:16
2024-09-25,05:06,world,国際,40,TBS NEWS DIG Powered by JNN,中国政府　新疆ウイグル自治区の綿花製品めぐり「カルバン・クライン」などを調査対象に　制裁への対抗措置か,https://news.yahoo.co.jp/articles/8b2b3970f95548cc1ec98d15a366ca1529ff2dfb,9/25(水) 2:47
