scrp_date,scrp_time,genre_en,genre_jp,rank,media_jp,title,link,date_original
2024-03-10,23:14,sports,スポーツ,1,東スポWEB,プロレスラーの吉江豊さんが急死　試合後に容体が急変,https://news.yahoo.co.jp/articles/b3b4f0162fd744f2c879b7efc4dd507826491ff3,3/10(日) 22:06
2024-03-10,23:14,sports,スポーツ,2,Full-Count,巨人の19歳ドラ1は「ものが違う」　衝撃アーチ＆4打点と圧倒…開幕1軍へ覚醒の予感,https://news.yahoo.co.jp/articles/959b614517d599b616c05e9ed9d480806c4aa9eb,3/10(日) 17:32
2024-03-10,23:14,sports,スポーツ,3,テレ東スポーツ,平野美宇が圧巻のストレート勝利！早田とのパリ五輪代表対決を制す！早田は初戦敗退 1回戦から日本代表対決の不運…【卓球 シンガポールスマッシュ】,https://news.yahoo.co.jp/articles/ba260bd90f753d7d559bd9d5d7bc335b288bd133,3/10(日) 20:23
2024-03-10,23:14,sports,スポーツ,4,バスケットボールキング,千葉ジェッツがEASL初優勝…富樫勇樹が22得点と躍動してソウルSKナイツとの激闘を制す,https://news.yahoo.co.jp/articles/b95baccd6d5e8963b0220452180d2f07dafa92b9,3/10(日) 21:55
2024-03-10,23:14,sports,スポーツ,5,東スポWEB,レイカーズ再建へ今オフに八村塁を放出も「フロントは解雇せざるを得なくなる」,https://news.yahoo.co.jp/articles/a1e977252e99ad0b7a506f5c95689d15e82b4c06,3/10(日) 17:31
2024-03-10,23:14,sports,スポーツ,6,スポニチアネックス,台本欲しかった!?中村俊輔氏引退試合で“1人だけ”空気読めなかった選手とは…稲本＆小野氏もあきれ顔,https://news.yahoo.co.jp/articles/8cec0ecc934eb38070df9e395c752d537f1c9c5f,3/10(日) 19:41
2024-03-10,23:14,sports,スポーツ,7,日刊スポーツ,【全日本】巨漢レスラー吉江豊さん50歳急死、タッグ戦後に体調急変し救急搬送も帰らぬ人に,https://news.yahoo.co.jp/articles/c6252b4a5c56e4383d8bc2afce7bbbf458bb6a83,3/10(日) 22:22
2024-03-10,23:14,sports,スポーツ,8,デイリースポーツ,プロレスラーの吉江豊氏が死去　全日本プロレスが発表　１０日の高崎大会出場後に体調が急変,https://news.yahoo.co.jp/articles/6b66f8164bff193c759784a7277a2432175c36a6,3/10(日) 22:13
2024-03-10,23:14,sports,スポーツ,9,日刊スポーツ,【阪神】岡田監督また捕手に苦言「投手つぶしたらアカンよ、ほんまに」新人石黒は評価　一問一答,https://news.yahoo.co.jp/articles/4bb6c86c73e0769ab2e7ea6709c0736c5880fa18,3/10(日) 18:53
2024-03-10,23:14,sports,スポーツ,10,スポニチアネックス,照ノ富士も負けた…大相撲春場所初日から“大波乱”1横綱2大関が痛恨の黒星発進,https://news.yahoo.co.jp/articles/e16adcada5a3bb6f157d471c45f95ecacfaf323c,3/10(日) 18:05
2024-03-10,23:14,sports,スポーツ,11,イーファイト,武井壮、BD逮捕者で「犯罪者生み出すコンテンツ」同王者・井原反論「人生かけてる、お前が迷惑」と白熱！,https://news.yahoo.co.jp/articles/8238fa36105e50e0dbd5f40b73314055b91597d8,3/10(日) 12:56
2024-03-10,23:14,sports,スポーツ,12,スポニチアネックス,坂本勇人が「もうオレはあの動きはできない」と三塁転向を受け入れた門脇の守備　他球団監督も…,https://news.yahoo.co.jp/articles/46d54e76a68ab9878b2160079b32f95c0cda60eb,3/10(日) 19:19
2024-03-10,23:14,sports,スポーツ,13,motorsport.com 日本版,【F1分析】角田裕毅らを翻弄したマグヌッセン＆ハースF1の頭脳戦。そのレースペースを分析……そりゃあ抜けないわけだ！,https://news.yahoo.co.jp/articles/4b16033bf6e44d044456a9e4d5eff4503ac0f883,3/10(日) 19:33
2024-03-10,23:14,sports,スポーツ,14,中日スポーツ,『宮城野部屋をなくす方向で話し合われたか』と聞かれた浅香山親方「そんなことは絶対ない」否定　大相撲,https://news.yahoo.co.jp/articles/43173e7c6a7fcab461b53c555581dc022abebdb0,3/10(日) 20:25
2024-03-10,23:14,sports,スポーツ,15,ENCOUNT,魔裟斗が「天才的格闘センス」と驚愕　ミット打ちで感心「久々に本物の強いやつに会った」,https://news.yahoo.co.jp/articles/71a365cf6b2d1acbe733e1daf9dd686a77fd9832,3/10(日) 17:04
2024-03-10,23:14,sports,スポーツ,16,スポニチアネックス,JBCがWBA世界王者・井岡一翔に戒告処分　22年ドーピング検査で大麻成分検出,https://news.yahoo.co.jp/articles/30c226a7b6442df1b6e96d59911058377040fee5,3/10(日) 12:55
2024-03-10,23:14,sports,スポーツ,17,中日スポーツ,阪神・岡田監督「キャッチャー何しとんや、オマエ」ドラフト6位・津田淳哉の配球に語気強める,https://news.yahoo.co.jp/articles/780a7f9312a1a3192c51f4309e7ccb268ba9a318,3/10(日) 18:15
2024-03-10,23:14,sports,スポーツ,18,東スポWEB,伊東純也がＰＳＧ戦で大活躍　代表待望論が沸騰「これで呼ばなかったら誰を呼ぶのよ」の声も,https://news.yahoo.co.jp/articles/9e80d9654d5ec94cc35a3420fc35a8b7c336f486,3/10(日) 22:41
2024-03-10,23:14,sports,スポーツ,19,共同通信,元関脇・明武谷が死去　つりが得意の「起重機」,https://news.yahoo.co.jp/articles/829224bb2b50836828c50969dc3498101be5a9a6,3/10(日) 17:41
2024-03-10,23:14,sports,スポーツ,20,東スポWEB,札幌ドームもピッチ劣悪化でファン悲鳴「コンサドーレもエスコンフィールド行こう」,https://news.yahoo.co.jp/articles/daa646c0fc1b35a618be1451a3d4ff6dfb75fc94,3/10(日) 18:46
2024-03-10,23:14,sports,スポーツ,21,バトル・ニュース,「私の初勝利って、これですか？」新人アイドルレスラーが顔面を汚され不本意な初めてに悔し泣き,https://news.yahoo.co.jp/articles/212999e0211ea09cda135f6086a0dc8626ed7da0,3/10(日) 11:00
2024-03-10,23:14,sports,スポーツ,22,中日スポーツ,アンカツさん「改めて4歳のレベルに疑問を持った」金鯱賞で5馬身差“完敗”の菊花賞馬ドゥレッツァを見て私見,https://news.yahoo.co.jp/articles/ed29d14f3cab07c9e50e739cc73f0660420b7834,3/10(日) 22:15
2024-03-10,23:14,sports,スポーツ,23,motorsport.com 日本版,角田裕毅のレースを台無しにしたマグヌッセンの”戦略”をRBが猛批判。角田は「それでも抜いてみせないと」,https://news.yahoo.co.jp/articles/b3fe9cbcb9faff32f2fae0440ebfe687be0899b5,3/10(日) 18:16
2024-03-10,23:14,sports,スポーツ,24,日刊スポーツ,本田圭佑「ドラゴンボールにどれだけ影響を受けたか。鳥山明先生、ありがとうございました」追悼,https://news.yahoo.co.jp/articles/fe6dc6d3d543750f84a42d009ded37dfcece5e9f,3/10(日) 19:31
2024-03-10,23:14,sports,スポーツ,25,サッカー批評Web,「ヤバい、、相当鳥肌立ちました。。」ACミランが公開した「鳥山明氏への追悼デザイン」に世界中から6万いいね! 選手2人のパフォーマンスを元にした特別デザイン,https://news.yahoo.co.jp/articles/f50586c622bd4eb37b56d291e49c54c369621a81,3/9(土) 5:36
2024-03-10,23:14,sports,スポーツ,26,CoCoKARAnext,なぜ豪王者は敵地・東京Dでの武居由樹戦を快諾したのか？代理人が舞台裏を語る「日本からのオファーは断っていた」,https://news.yahoo.co.jp/articles/f57f9a687d6c0ce5ca16ae480cf6332fbcc8e8f3,3/10(日) 17:02
2024-03-10,23:14,sports,スポーツ,27,中日スポーツ,鈴木亜由子、給水とりそこね…ライバルが手渡しでフォロー「本当に素晴らしい」高橋尚子さん称賛　名古屋ウィメンズマラソン,https://news.yahoo.co.jp/articles/5bf7af57495413bf3a42ac1e5d2a531db6b01f08,3/10(日) 10:16
2024-03-10,23:14,sports,スポーツ,28,ABEMA TIMES,この足の位置でもNGですか…名手も戸惑うMLBの新ルール「走塁妨害」の判定がめちゃくちゃ厳しくなった,https://news.yahoo.co.jp/articles/ed417cfd89a47c0028796da7db91e11886a114e7,3/10(日) 21:02
2024-03-10,23:14,sports,スポーツ,29,Full-Count,大谷翔平が打ち立てた“数字”は不滅「おそらくもう現れない」　ベッツが出した答え,https://news.yahoo.co.jp/articles/181896ed3cdefac0ea18c714e7c64ce038ff73fd,3/10(日) 19:33
2024-03-10,23:14,sports,スポーツ,30,デイリースポーツ,ダルビッシュがキャンプ地で自炊「白米、みそ汁、納豆、温泉卵、鶏の胸肉、サラダのセットがメイン」高木豊氏のＹｏｕＴｕｂｅで,https://news.yahoo.co.jp/articles/4fbcd0db6e177251248b15ad7c8424e951067764,3/10(日) 20:53
2024-03-10,23:14,sports,スポーツ,31,デイリースポーツ,広島・新井監督のリクエスト失敗　空タッチにも見えＳＮＳ「セーフがアウトになるなら野球にならねーんだよ！？」,https://news.yahoo.co.jp/articles/04ea7906be10e66acc78c2fcdc2973f30f29287a,3/10(日) 15:45
2024-03-10,23:14,sports,スポーツ,32,サッカー批評Web,PK時の「侵入」、GKの「ボール保持時間」、一時的退場「ブルーカード」【2024年7月「ルール改正」で日本サッカーはこう変わる】（3）,https://news.yahoo.co.jp/articles/501a85d03b4a26b78e1c48f1931163a891bb98cc,3/10(日) 19:32
2024-03-10,23:14,sports,スポーツ,33,デイリースポーツ,中畑清氏　白井審判員に「大喝！」遊撃手と衝突珍事に「あれはまずい！ケガしたら大変」関口宏も困惑「自分が選手だと？」,https://news.yahoo.co.jp/articles/0979ec1a4509b5bd06e1b9925c67ce0e90a914d7,3/10(日) 22:40
2024-03-10,23:14,sports,スポーツ,34,サッカー批評Web,日本代表イケメンFW中村敬斗も大ピンチ【2024年7月「ルール改正」で日本サッカーはこう変わる】（2）,https://news.yahoo.co.jp/articles/285e34e127aa787490023eb45314b939a489af01,3/10(日) 12:32
2024-03-10,23:14,sports,スポーツ,35,テレ東スポーツ,伊藤美誠 ルクセンブルクの60歳エースを破り初戦突破！【卓球 シンガポールスマッシュ】,https://news.yahoo.co.jp/articles/7867b7f37693e315785273e30c5302ac3b5ea366,3/10(日) 16:32
2024-03-10,23:14,sports,スポーツ,36,Full-Count,阪神・中野の死球に甲子園騒然　右足直撃で座り込む…代走送られ歩いてベンチへ,https://news.yahoo.co.jp/articles/151787917041b0c925e3a5f00d54c917c422afdf,3/10(日) 15:16
2024-03-10,23:14,sports,スポーツ,37,スポーツ報知,【巨人】二塁筆頭候補の吉川に強力ライバル、泉口友汰２安打　阿部監督「尚輝が打てないようであれば」,https://news.yahoo.co.jp/articles/a2396d0dc052610e19743fa77c7a93a2f7aa0d8b,3/10(日) 21:12
2024-03-10,23:14,sports,スポーツ,38,イーファイト,後藤祐樹、BD出場者の逮捕報道に持論「ヤンチャしてた人間のチャンスの場、BDは悪くない」,https://news.yahoo.co.jp/articles/241c08df2088bf6852dc8676d14b54f7fa01adda,3/10(日) 21:29
2024-03-10,23:14,sports,スポーツ,39,デイリースポーツ,大谷翔平「あー、だめだ！」オープン戦出場せず個別メニューで肉体強化　終始リラックスムード,https://news.yahoo.co.jp/articles/d7ea79001044e486e039035bed929c918116428e,3/10(日) 20:30
2024-03-10,23:14,sports,スポーツ,40,読売新聞オンライン,鈴木亜由子３位「出しきった」、給水失敗でライバル加世田梨花から水手渡され感謝…名古屋ウィメンズ,https://news.yahoo.co.jp/articles/af5f86bba42ac904af4a42ff068089fa4247af7e,3/10(日) 22:31
