scrp_date,scrp_time,genre_en,genre_jp,rank,media_jp,title,link,date_original
2025-11-07,16:08,TTL,総合,1,日刊スポーツ,玉川徹氏の発言に「テレビで言うのはやめて」MC羽鳥慎一が厳しめ注意　モーニングショー,https://news.yahoo.co.jp/articles/524668aba7d866e1f34fbd628be755b6b0fcbee5,11/7(金) 11:58
2025-11-07,16:08,TTL,総合,2,スポーツ報知,３５歳になったキム・ヨナさんの姿に「なんてこった」「どうして」驚き止まらず…３年前に結婚も,https://news.yahoo.co.jp/articles/3da751a1105b4abc4d28e7f86d5bbe7555a20ee2,11/7(金) 15:05
2025-11-07,16:08,TTL,総合,3,弁護士ドットコムニュース,「捕殺だけでは解決しない」「子グマ殺すな」日本熊森協会が緊急要請、環境省に対策見直し求める,https://news.yahoo.co.jp/articles/a905ca8b0e97115cc32581b5a59ebbf5b4a51865,11/6(木) 19:15
2025-11-07,16:08,TTL,総合,4,関西テレビ,【速報】「僕は高市総裁を信じています」維新・吉村代表　議員定数削減巡り　自民・鈴木幹事長テレビ収録で「臨時国会中に全会派の合意得るのは難しい」と発言　報道受け,https://news.yahoo.co.jp/articles/78e1e362512734a7dc661ac1777bf8d99a817007,11/7(金) 15:04
2025-11-07,16:08,TTL,総合,5,Full-Count,日本一ソフトバンク、来季コーチ陣が決定　ヘッドコーチ不在…斉藤和巳氏が3軍→2軍監督,https://news.yahoo.co.jp/articles/c0f4a82209524cc3f08e106a1d2ad0cf2c363b03,11/7(金) 13:04
2025-11-07,16:08,TTL,総合,6,日刊スポーツ,橋下徹氏、午前３時始動の高市早苗首相を「ルールなき飲み食い政治の対極」Xで言及,https://news.yahoo.co.jp/articles/39caf84f3400d482f17d1a7e47edcafb1f370bd8,11/7(金) 12:01
2025-11-07,16:08,TTL,総合,7,東スポWEB,大谷翔平の真美子夫人はＡＲＭＹ！？　バッグのアクセサリーが「ＢＴＳ・Ｖのグッズではないか」,https://news.yahoo.co.jp/articles/cb6ac8a3412f1d9a9d1531ccd0986887684358f5,11/7(金) 13:35
2025-11-07,16:08,TTL,総合,8,オリコン,“投資家”桐谷さん、保有株を紹介「高利回りなので、私は1000円台の時に買いました」,https://news.yahoo.co.jp/articles/5ebdccb30ad24c4545a0fd836348b9533f5d5173,11/7(金) 11:35
2025-11-07,16:08,TTL,総合,9,Full-Count,ド軍退団の26歳右腕、1.4億円で韓国球界入り　WS制覇3日後に放出も…アジアで覚醒なるか,https://news.yahoo.co.jp/articles/e85f5c5f27184354759acdb0ff31af1d8d503bbd,11/7(金) 15:21
2025-11-07,16:08,TTL,総合,10,デイリースポーツ,ドジャース　スミスに抱っこされた長女・シャーロットちゃんが「かわいい天使」秘蔵ショット公開→日本のファンも反響,https://news.yahoo.co.jp/articles/3d942e03a49167c4d95cbb9494a2ad410473d38a,11/7(金) 15:05
2025-11-07,16:08,TTL,総合,11,デイリースポーツ,テレ東「タクうま」で番組史上最高額運賃　東京－佐賀１２００キロ、フェリー代除いた運賃にスタジオ騒然,https://news.yahoo.co.jp/articles/9756d87a7879f270e4dfeb121aba67389c4935fd,11/7(金) 13:55
2025-11-07,16:08,TTL,総合,12,ねとらぼ,サミットで80円引きの「焼きそば」をゲット→ワクワクしながら開けると……　「これは悲しい」「泣いてもええんやで」,https://news.yahoo.co.jp/articles/c6331772449fd4cb3e446fc7aa6a49f94ff2f0d7,11/7(金) 14:30
2025-11-07,16:08,TTL,総合,13,東スポWEB,ドジャース大谷翔平　劇的ＨＲのロハスに迫った〝引退撤回〟「翔平、俺はもう…」,https://news.yahoo.co.jp/articles/4707196c65a88b855df1c1cf9f05d4b1fb1eb3ea,11/7(金) 8:55
2025-11-07,16:08,TTL,総合,14,中央日報日本語版,中国製の電気バス、中国から遠隔制御が可能だった…北欧各国が騒然,https://news.yahoo.co.jp/articles/6b8f99503ad69ce4d30c074b84413329b39d98d3,11/7(金) 10:56
2025-11-07,16:08,TTL,総合,15,MBSニュース,台風26号は急カーブして日本接近する可能性も？週末にかけて「非常に強い」勢力へ　最大風速50メートル 暴風域を伴う予想【台風情報　気象庁】,https://news.yahoo.co.jp/articles/570ecca7de88c4cd49bbd2225bf5489eea4232c6,11/7(金) 11:52
2025-11-07,16:08,TTL,総合,16,スポーツ報知,【侍ジャパン】巨人・大勢、同じ守護神候補右腕の“豪球”に驚がく「（自分の）自信がなくなるようなボールを投げていた」,https://news.yahoo.co.jp/articles/affa776044c440d72cca6ed85039e5764f9acdc8,11/7(金) 13:10
2025-11-07,16:08,TTL,総合,17,あいテレビ,【台風26号】日本列島接近の可能性も　「非常に強い勢力」に発達する見込み　最大瞬間風速70メートル予想【最新台風情報・雨と風のシミュレーション】,https://news.yahoo.co.jp/articles/18edc03f5e42e4bcc52379f5a57680f23c51a238,11/7(金) 10:30
2025-11-07,16:08,TTL,総合,18,ENCOUNT,片山さつき財務大臣のものまねに様々な声「少しやり過ぎ！（笑）」「もう少し敬意を」,https://news.yahoo.co.jp/articles/058b2fbf0413833f4d66d05a3ff1adad7aa5c83d,11/6(木) 19:12
2025-11-07,16:08,TTL,総合,19,日刊スポーツ,【日本ハム】中島卓也「ファイターズで最後までやっていきたい」海外FA権を行使せず残留表明,https://news.yahoo.co.jp/articles/714e4848341be8af889917045acee2d244f7c2b9,11/7(金) 14:22
2025-11-07,16:08,TTL,総合,20,Full-Count,ド軍スコット「過去は全て置いてきた」　100億円契約も不振→“選外”、美人妻と堪能した頂点,https://news.yahoo.co.jp/articles/21f3161ad7a5ff8af8e793aa75e11ec88b27db06,11/7(金) 15:17
2025-11-07,16:08,TTL,総合,21,東スポWEB,【ドジャース】帰国のキム・ヘソン　空港で真偽不明の「親族借金騒動」に巻き込まれる＝韓国報道,https://news.yahoo.co.jp/articles/fbe76f8d44c3b85b48d571103c91b1a463ef5aae,11/7(金) 14:00
2025-11-07,16:08,TTL,総合,22,テレビユー山形,"【画像】""緊急銃猟"" で駆除されたクマ　旅館のフロント、調理場、2階和室など広範囲を荒らす（山形・米沢市）",https://news.yahoo.co.jp/articles/d72559d5dadb357a5c9f1166359be5434f759918,11/7(金) 15:03
2025-11-07,16:08,TTL,総合,23,スポーツ報知,自民党広報本部長の鈴木貴子氏「なんでそうなった、わたし…」まさかの姿に驚き「吹いた」父は宗男氏,https://news.yahoo.co.jp/articles/bbb6f5e7b88e34a951668b1e2e5332dca0b3ef69,11/7(金) 12:35
2025-11-07,16:08,TTL,総合,24,スポニチアネックス,SHELLY　移住先の豪州パースは「私みたいな人があんまりいない」現地スーパーでびっくり「子供が…」,https://news.yahoo.co.jp/articles/6fe6d64d66bfe15558d7329e7d7cc92c41106d3c,11/7(金) 13:53
2025-11-07,16:08,TTL,総合,25,日刊スポーツ,【日本ハム】石井一成が国内FA権行使の理由を語る「来ていただければありがたい」12球団OK,https://news.yahoo.co.jp/articles/1ee9ac89bcb530f5b528e7a45bdccdf363d30335,11/7(金) 12:48
2025-11-07,16:08,TTL,総合,26,ゴルフのニュース,高校3年生の伊藤愛華、中国の20歳ジ・ユアイがトップ合格！　22人の新たなプロゴルファーが誕生【JLPGA最終プロテスト】,https://news.yahoo.co.jp/articles/7288e2fddd5c1492fa8cd5bbb01d59785fb1557c,11/7(金) 14:47
2025-11-07,16:08,TTL,総合,27,ENCOUNT,川谷絵音、奨学金の返済完了　祝福コメント殺到も…「それよりも年齢に驚きました」の声,https://news.yahoo.co.jp/articles/31ea6cf7f27b71489dac878d1b936b75bd4b67c4,11/7(金) 7:20
2025-11-07,16:08,TTL,総合,28,スポニチアネックス,芸能界イチ“酒豪”自負のマテンロウ・アントニー「TKO勝ち」した相手は…周囲が「これ以上やめろ」,https://news.yahoo.co.jp/articles/51695d6fdb998a31296428ba4c64b40789b76049,11/7(金) 13:50
2025-11-07,16:08,TTL,総合,29,ゲキサカ,U-22日本代表のイングランド遠征メンバー決定! 大岩監督体制の“ロス世代”本格始動…ピサノ、新川志音ら招集,https://news.yahoo.co.jp/articles/4b36e642d3436f9af230ef51f22175890aacbd32,11/7(金) 13:01
2025-11-07,16:08,TTL,総合,30,サンケイスポーツ,ソフトバンクがD1位・佐々木麟太郎に挨拶　城島健司CBO「来てくれない可能性がある選手を指名したというのが僕らのメッセージ」,https://news.yahoo.co.jp/articles/cc23f9f781a09b10831440ed077e5aed91eb7e6a,11/5(水) 12:09
2025-11-07,16:08,TTL,総合,31,ファイナンシャルフィールド,ビールを「ノンアル」にしたら“1缶200円”近くて驚き！ 酒税がないのに、なぜ「発泡酒」と値段が変わらないのでしょうか？ 意外とかかるコストとは,https://news.yahoo.co.jp/articles/106758f8fa50254ce594e62725a4a7d0bc452cb0,11/7(金) 13:40
2025-11-07,16:08,TTL,総合,32,ABEMA TIMES,宗男氏娘・鈴木貴子議員「家宅捜索に入ってきた捜査官は我が家の居間で腕まくらをしてテレビを見た」「当時中学生の私の通知表も。なんのための押収だったのか」 高市総理に“法整備”訴え,https://news.yahoo.co.jp/articles/c13fb5626de9f731f2e09b0e012989f9254120a5,11/7(金) 15:30
2025-11-07,16:08,TTL,総合,33,テレビユー山形,【速報】山形県米沢市の温泉旅館に侵入のクマ　緊急銃猟で駆除,https://news.yahoo.co.jp/articles/22723bde60de277671dac3610616e9c4428f8706,11/7(金) 12:12
2025-11-07,16:08,TTL,総合,34,スポーツ報知,「片山さつきさんに任せられないなら誰に任せればいいの？」デーブ・スペクター氏、高市政権の経済政策に私見…「ワイド！スクランブル」,https://news.yahoo.co.jp/articles/e084783151982a1990fb990271a67a5532db6859,11/7(金) 13:05
2025-11-07,16:08,TTL,総合,35,中央日報日本語版,日本が給油を拒否…韓国空軍、ドバイ・エアショーへの参加が事実上中止に,https://news.yahoo.co.jp/articles/f9f5a754454982496cc18493733d5bab7636918c,11/7(金) 6:37
2025-11-07,16:08,TTL,総合,36,モデルプレス,眞栄田郷敦、共演後「全てが変わった」影響受けた人気女優明かす「すごく素敵」,https://news.yahoo.co.jp/articles/f954756a6df1e80e3463abaa7311efabe883721b,11/7(金) 12:48
2025-11-07,16:08,TTL,総合,37,スポーツ報知,トヨタ転職の元テレ朝アナ　どえらい「愛車」を公開し騒然「本当にマイカー！？」富川悠太さんが運転,https://news.yahoo.co.jp/articles/a01d6728c9165d037b36010b8fe9f3a85b07330b,11/7(金) 15:35
2025-11-07,16:08,TTL,総合,38,毎日新聞,交番で当直中に性行為　警察官2人を減給処分　神奈川県警,https://news.yahoo.co.jp/articles/31c17aba1219560f2bd6d00f6f152a1c5b9b9327,11/7(金) 15:35
2025-11-07,16:08,TTL,総合,39,スポニチアネックス,【トライアウト】セ・リーグ王者・阪神から4人が参加…最速155キロ右腕、強打の外野手など,https://news.yahoo.co.jp/articles/51eaf05b8943b1514887ad57c805bd6be460bccc,11/7(金) 15:03
2025-11-07,16:08,TTL,総合,40,ゴルフ総合サイト ALBA Net,畑岡奈紗と申ジエが首位で週末へ　山下美夢有3位、佐久間朱莉ら4位,https://news.yahoo.co.jp/articles/f4cacf1ae807794712b3ca104830888252065c50,11/7(金) 15:19
