scrp_date,scrp_time,genre_en,genre_jp,rank,media_jp,title,link,date_original
2024-09-19,07:06,sports,スポーツ,1,中日スポーツ,中日・立浪監督、退任を表明「けじめをつけます」　就任後2年連続最下位、今季は一時単独首位に立つも…ずるずる順位下げ,https://news.yahoo.co.jp/articles/471862abcf903a2c607755552734c06f2b9d46fc,9/18(水) 22:02
2024-09-19,07:06,sports,スポーツ,2,Full-Count,大谷も遥か及ばぬ…ジャッジとの「26」の差　82年ぶり記録、米データ会社紹介,https://news.yahoo.co.jp/articles/005e398cfc68766d046b5b271a1fbe4a31857e78,9/18(水) 20:34
2024-09-19,07:06,sports,スポーツ,3,東スポWEB,【中日】立浪監督の後任は〝レジェンドＯＢ〟にあらずか　浮上した本命候補の「名前」,https://news.yahoo.co.jp/articles/6c62e998cba1f3550da290abec33a4c653af5957,9/19(木) 5:16
2024-09-19,07:06,sports,スポーツ,4,Full-Count,大谷翔平は「1番・DH」　2戦連発49号＆49盗塁で「50-50」へ前進なるか…ベッツは二塁先発,https://news.yahoo.co.jp/articles/4408d3c7c2836261c1aba62271d93b55f5cb1d65,9/19(木) 4:31
2024-09-19,07:06,sports,スポーツ,5,ABEMA TIMES,“4階席”にぶち込んだ！ 大谷翔平、衝撃の48号弾にド軍ベンチ“驚愕” カーショーは口あんぐり、フリーマンも呆然の圧巻光景,https://news.yahoo.co.jp/articles/e5f4342772638c631b8aec91223c5797663c93d2,9/18(水) 21:36
2024-09-19,07:06,sports,スポーツ,6,スポーツ報知,【巨人】優勝マジック「９」が点灯　ＤｅＮＡと延長１２回、４時間２３分の熱戦で引き分け,https://news.yahoo.co.jp/articles/e183f8aab654a8fe8398fe57ac15768c81e334e2,9/18(水) 22:23
2024-09-19,07:06,sports,スポーツ,7,スポニチアネックス,日本ハム・新庄監督「もう僕の理想」「さすが開幕投手」2試合連続完封勝利の先発・伊藤をべた褒め,https://news.yahoo.co.jp/articles/d9225d0e566da875d87db5152b7f33fe9e2c91c3,9/18(水) 21:39
2024-09-19,07:06,sports,スポーツ,8,CoCoKARAnext,中日激震！立浪監督退任で次期監督候補に浮上する　チーム再建を託せる「有力OB」とは,https://news.yahoo.co.jp/articles/b504e02ee2fbaf703730422f49d936b2a108ecca,9/19(木) 5:00
2024-09-19,07:06,sports,スポーツ,9,ABEMA TIMES,大谷翔平、特大アーチで女性観客に“想定外のハプニング”「どうした？」 48号ボールをうっかりゲット「ラッキーすぎ」,https://news.yahoo.co.jp/articles/86e195082d24e9f0f2d06417f988ee568656ddb2,9/18(水) 23:46
2024-09-19,07:06,sports,スポーツ,10,日刊スポーツ,【中日】井上一樹２軍監督らが次期監督の有力候補　立浪監督退任表明で,https://news.yahoo.co.jp/articles/81ba1e77b9c8e5c4f83b6bc2dafe919f9915dc32,9/19(木) 0:21
2024-09-19,07:06,sports,スポーツ,11,東スポWEB,Ｍ９点灯の巨人が陥る〝星勘定のわな〟　伊勢孝夫氏が「阪神Ｖ本命」を強調する２つの理由,https://news.yahoo.co.jp/articles/08ccde39ca8148ab9a6193c33921b4dfa609eb5b,9/19(木) 5:02
2024-09-19,07:06,sports,スポーツ,12,RONSPO,「韓国伝説の記録がこんなにも早く抜かれるとは信じられない」韓国メディアが大谷翔平の「48－48」で秋信守の持つアジア記録を抜いたメジャー通算219本塁打に驚嘆,https://news.yahoo.co.jp/articles/da2ead9e5ad3ae63357db00473824cdebafdd23e,9/19(木) 6:00
2024-09-19,07:06,sports,スポーツ,13,ABEMA TIMES,「怖いな…」遠藤航にミランFWが激昂！ ど突かれる→ガン詰めされた瞬間「ブチギレ」「喧嘩は買わないねぇ」「過激だな」,https://news.yahoo.co.jp/articles/7a4072cc9c382c80b97ddf4108393c8c66c87312,9/18(水) 21:02
2024-09-19,07:06,sports,スポーツ,14,デイリースポーツ,【２人の全文】元バレー代表栗原恵さん　結婚と妊娠を発表　お相手はモデル兼写真家「背の高い世界一素敵な女性と」,https://news.yahoo.co.jp/articles/c32e2ec6e3248d082ded3bff02ac554d7eace2b8,9/18(水) 18:43
2024-09-19,07:06,sports,スポーツ,15,RONSPO,立浪監督辞任で中日の次期監督はどうなる？“大本命”井端弘和氏氏は侍Jの監督続投要請で消え井上一樹2軍監督の昇格か、地元人気抜群“ジャイアン”山崎武司氏の招聘か,https://news.yahoo.co.jp/articles/cfafa8c8ced39a479ce2baa3c2270f748ae71dc6,9/19(木) 5:55
2024-09-19,07:06,sports,スポーツ,16,スポニチアネックス,大の里　大関昇進へ“マジック1”　1年半前まで大学生！大銀杏結えないまま所要9場所なら史上最速昇進,https://news.yahoo.co.jp/articles/01a9b429472178abbe44fbec5a9c54bd47111eb8,9/19(木) 4:15
2024-09-19,07:06,sports,スポーツ,17,Full-Count,ド軍、剛腕ミラーがマイナー降格　防御率8.52と低迷…ケリーら5人入れ替え、球団発表,https://news.yahoo.co.jp/articles/610fc86982b8d3cee00aca19940dbe8435f87329,9/19(木) 5:59
2024-09-19,07:06,sports,スポーツ,18,theWORLD（ザ・ワールドWeb）,エヴァートンにハーランド、アーセナルにグリーリッシュ……　降格となれば主力選手の流出は避けられない。英紙がマンチェスター・シティドラフト会議を大胆予想！？,https://news.yahoo.co.jp/articles/c5c8b07331d312fbf14cfe324e4a0838da73c83d,9/18(水) 22:30
2024-09-19,07:06,sports,スポーツ,19,中日スポーツ,解説務める山本浩二さん、”異変”…「どうしたんだろう」「大丈夫？」ミスター赤ヘルを心配する声相次ぐ,https://news.yahoo.co.jp/articles/1e80433958df037183000dcab42955eb995e335f,9/18(水) 19:13
2024-09-19,07:06,sports,スポーツ,20,スポニチアネックス,中日・高橋宏「誰が何と言おうと僕は立浪監督に育ててもらった選手」　退任表明の指揮官に感謝と自責の念,https://news.yahoo.co.jp/articles/f835a6b5bc58619173057e10f567ac39594caf12,9/18(水) 23:16
2024-09-19,07:06,sports,スポーツ,21,GOAL,かつて磐田でもプレーした元イタリア代表スキラッチ氏、59歳で逝去…90年W杯で得点王＆MVP,https://news.yahoo.co.jp/articles/d3d9eaaeabb63a6719b237ffdea1ea00b2c38ed4,9/18(水) 18:58
2024-09-19,07:06,sports,スポーツ,22,スポニチアネックス,新庄監督「まあ脚本通りですね」日本ハムがパ全球団に勝率5割以上　2年連続最下位から飛躍,https://news.yahoo.co.jp/articles/5d9a32772375ff0ea236214298ee0190f247853b,9/18(水) 21:57
2024-09-19,07:06,sports,スポーツ,23,GOAL,京都が2年ぶりの天皇杯ベスト4進出！ 豊川雄太ら3ゴールで千葉に快勝,https://news.yahoo.co.jp/articles/601b5d50c0511b33cf9e5b8ec19a671eeb2d03ca,9/18(水) 21:01
2024-09-19,07:06,sports,スポーツ,24,スポニチアネックス,中日・砂田が引退　22年にトレードでDeNAから移籍　今季1軍登板なく、プロ11年目の決断,https://news.yahoo.co.jp/articles/d6767f3bf75cc8c6e1273536448d2567250120b9,9/19(木) 6:00
2024-09-19,07:06,sports,スポーツ,25,中日スポーツ,大谷翔平の48号ボール、キャッチした女子大生「震えが止まらない」…「絶対売らない。お金に変えられない価値」,https://news.yahoo.co.jp/articles/133cdd905f7d2745c792571674fe78ba3e87a54a,9/18(水) 9:26
2024-09-19,07:06,sports,スポーツ,26,スポーツ報知,【中日】中継ぎで活躍の砂田毅樹が引退　１３年育成ドラフト１位でＤｅＮＡ入団　今季１軍での登板なし,https://news.yahoo.co.jp/articles/de99a7c96fe4d872f73e91173930c0c919317011,9/19(木) 5:00
2024-09-19,07:06,sports,スポーツ,27,スポニチアネックス,完封13勝目の日本ハム・伊藤大海のヒロインに鳥越裕介氏が“ダメ出し”「福岡帰ってくるって…」,https://news.yahoo.co.jp/articles/3271bb6481b18d96a16c328741ad2b1145956c17,9/18(水) 21:40
2024-09-19,07:06,sports,スポーツ,28,デイリースポーツ,紀平梨花が２季連続全休決断「今季の試合出場はありません」中部選手権見送り発表　骨折の右足首「ほぼ完治」も「全力で動ける状態ではない」,https://news.yahoo.co.jp/articles/b8f2aabf9a9099800b1063aee1d520c26bbe90c1,9/18(水) 14:28
2024-09-19,07:06,sports,スポーツ,29,TBS NEWS DIG Powered by JNN,元バレーボール女子日本代表・栗原恵が結婚&妊娠発表「安定期に入りましたので、喜びと共にご報告させていただきます」,https://news.yahoo.co.jp/articles/76b0d9e47a6833ecdd7793fa3e362329bae10422,9/18(水) 18:00
2024-09-19,07:06,sports,スポーツ,30,日刊スポーツ,【西本聖】DeNAの野球に「厳しさ」感じず　隙だらけの守備では逆転Ｖの可能性しぼむ,https://news.yahoo.co.jp/articles/b1bc41dcbe6ab99160f7e6cefe68d28363269e8b,9/18(水) 23:21
2024-09-19,07:06,sports,スポーツ,31,Full-Count,通算440セーブのキンブレルが事実上の“戦力外”に　今季は防御率5点台…球団発表,https://news.yahoo.co.jp/articles/3baaa4a6509e7eac4dd6cc453a37ead74189997f,9/19(木) 3:20
2024-09-19,07:06,sports,スポーツ,32,日刊ゲンダイDIGITAL,中日・立浪監督「続投」の仰天情報！ 後続候補が消え“人望ゼロ”でも「客を呼べる男」,https://news.yahoo.co.jp/articles/51ed930593a11e3c22d999dbce5e92119431fde0,9/18(水) 11:42
2024-09-19,07:06,sports,スポーツ,33,ABEMA TIMES,大谷翔平が「確信歩きどころじゃない！」日ハムOBも脱帽 特大48号弾にただ茫然「まじか」「すげえよ！」異次元の光景,https://news.yahoo.co.jp/articles/6b55dbd05623aedaeb55db220ded1302131139b3,9/18(水) 23:27
2024-09-19,07:06,sports,スポーツ,34,東スポWEB,【巨人】阿部監督がＭ９点灯後にＧナイン〝引き締め〟　取材拒否の裏で緊急ミーティング開催,https://news.yahoo.co.jp/articles/e07c0acc67b95ff37822b9a984f2d5deaabd323b,9/19(木) 5:16
2024-09-19,07:06,sports,スポーツ,35,西スポWEB OTTO！,「謎交代」の試合成立　Jリーグが規則適用ミス認めるも…サポーター「2分じゃ何もできないですよ～って言われているみたい」,https://news.yahoo.co.jp/articles/2737600413707f34ea432ea9669a19e2fcaae961,9/18(水) 23:00
2024-09-19,07:06,sports,スポーツ,36,デイリースポーツ,阪神が怒濤の５連勝で７０勝到達！首位巨人に１・５Ｇ差　九回にダメ押し一挙４点のビッグイニング　佳境で岩崎温存にも成功,https://news.yahoo.co.jp/articles/4398cc7e6e17224e9f46c2b91a414f336555e3f1,9/18(水) 21:46
2024-09-19,07:06,sports,スポーツ,37,サッカーキング,CL初戦でセルティック古橋＆前田が1ゴール、旗手アシストの大活躍！　CL史上初の日本人複数選手得点、5発快勝で白星発進,https://news.yahoo.co.jp/articles/5f93135be9a02c2e4911a8ee13b90e8fdf754b10,9/19(木) 6:11
2024-09-19,07:06,sports,スポーツ,38,Full-Count,急失速の大谷ライバルは「どしたん？」　まさかの26試合ゼロ「全然打たなくなった」,https://news.yahoo.co.jp/articles/5bbea19fa9486239b665ec50b3993f07e243427e,9/18(水) 20:01
2024-09-19,07:06,sports,スポーツ,39,デイリースポーツ,阪神　勢いを象徴するベンチの風景　満面笑みの岡田監督＆隣でガッツポーズの前川が素敵　５連勝で首位巨人に１・５Ｇ差,https://news.yahoo.co.jp/articles/f274b3ba1f54d39dd0baee9c93c5f32a47945733,9/18(水) 23:26
2024-09-19,07:06,sports,スポーツ,40,中日スポーツ,中日・立浪監督、トップダウン指導を続けたが…「切り札」去るのは球団にとってもダメージ大きい【記者の目】,https://news.yahoo.co.jp/articles/86d5f3ce46c2717dd827caaf1bc0d7667044d26d,9/18(水) 23:24
