scrp_date,scrp_time,genre_en,genre_jp,rank,media_jp,title,link,date_original
2024-09-19,16:06,TTL,総合,1,MBSニュース,【速報】”高速道路で跳ね飛ばされ”警察官が即死…　YouTube視聴「ながらスマホ」トラック運転の男に禁錮2年の実刑判決,https://news.yahoo.co.jp/articles/5d6eba7d518ee9d483a1690116245a08516eac62,9/19(木) 11:54
2024-09-19,16:06,TTL,総合,2,Full-Count,“SNSの標的”渦巻いた物議、限界超えた退任要求…立浪監督が果たせなかった「2つの約束」,https://news.yahoo.co.jp/articles/9e77bc026b03b7b0afd01bab45fa1b4b2098f4a4,9/19(木) 11:53
2024-09-19,16:06,TTL,総合,3,スポーツ報知,「誰だと思ったら」吉岡里帆の最新姿にネット騒然「朝から」「思わず２度見」「一瞬時が止まった」,https://news.yahoo.co.jp/articles/4727095c1132e6f5022a11307d434f2aa77c45e1,9/19(木) 12:05
2024-09-19,16:06,TTL,総合,4,中央日報日本語版,香港俳優のノーマン・チューさん死去…３０歳年下の妻も葬儀中に死去,https://news.yahoo.co.jp/articles/3b23e2106e68bb65cea6ca413b1a4c3fe57e7aef,9/18(水) 10:53
2024-09-19,16:06,TTL,総合,5,読売新聞（ヨミドクター）,ランニング中に倒れた男性が帰らぬ人に　仲間たちに自責の念…現場で救急隊員から受け取ったカードが持つ意味,https://news.yahoo.co.jp/articles/01ca99460ac75b8e4a23640a3aba912c51af9c3b,9/19(木) 11:40
2024-09-19,16:06,TTL,総合,6,東スポWEB,大谷翔平のアジア記録「分からなかった」発言に韓国メディアが不満「秋信守のプライドを傷つける」,https://news.yahoo.co.jp/articles/69e416de7055ad35c77aeb0bfbf026e12b5cc9d7,9/19(木) 12:56
2024-09-19,16:06,TTL,総合,7,スポーツ報知,元「魔性の女」葉月里緒奈、４９歳の近影に衝撃「かわいい」３度目の結婚から６年、大学生娘の母,https://news.yahoo.co.jp/articles/d99e269f4d8cfdf132a72c0c113c3eb4bbf36d66,9/19(木) 12:10
2024-09-19,16:06,TTL,総合,8,オリコン,太川陽介、妻・藤吉久美子と“ほぼ初”の夫婦旅行　レア2ショに反響「アツアツ」「憧れます」　来年結婚30周年,https://news.yahoo.co.jp/articles/e10b4f3260bc32915db69161abf39a551bb15f4f,9/19(木) 12:07
2024-09-19,16:06,TTL,総合,9,スポーツ報知,堺正章の次女・堺小春、結婚式で父と親子ショット「愛があふれてる」「感動的」母・岡田美里も笑顔,https://news.yahoo.co.jp/articles/b58278cb0601b7f8ea092833bda1212b2d9fc4f1,9/19(木) 11:45
2024-09-19,16:06,TTL,総合,10,読売新聞オンライン,中国・深圳で死亡の男児に哀悼の声、現場周辺は警戒態勢続く…ＳＮＳには反日感情あらわの投稿も,https://news.yahoo.co.jp/articles/95ed5dca748f0aac22a964c4dd0f3a68593d12e0,9/19(木) 12:01
2024-09-19,16:06,TTL,総合,11,中日スポーツ,小川彩佳キャスターの質問に…自民総裁選の候補９人、全員だまりこむ「もう放送事故レベル」「党内で干されるんだろうね」ネット厳しい声,https://news.yahoo.co.jp/articles/1cea935821941c37c70ab7fe5c4d71dd209a08ca,9/18(水) 18:10
2024-09-19,16:06,TTL,総合,12,TBS NEWS DIG Powered by JNN,【台風情報】台風15号が発生　最大瞬間風速は25メートルの予想　気象庁【今後の進路予想】,https://news.yahoo.co.jp/articles/ee6dc43008340fb4ac066c8fb86e4c09aa0701a2,9/19(木) 10:34
2024-09-19,16:06,TTL,総合,13,中日スポーツ,大谷翔平ドジャース、優勝マジック「7」に…49盗塁で前人未踏の『50―50』にまた一歩前進、ロバーツ監督に並ぶ,https://news.yahoo.co.jp/articles/4db00e900fde475b290c1834589ada37cf489311,9/19(木) 10:28
2024-09-19,16:06,TTL,総合,14,スポーツ報知,元「キャンディーズ」伊藤蘭、かわいすぎる６９歳の姿に騒然「ヤバっ！」「完全に普通の女の子に戻ってますやん」,https://news.yahoo.co.jp/articles/924591de144c92465c8b0d8dc45a65d2b412587c,9/19(木) 12:42
2024-09-19,16:06,TTL,総合,15,まいどなニュース,幼稚園の娘の“話し方”に、お隣さんが「言うか悩んだけれども…」　助言に母感謝、幼少期の「構音障害」とは？,https://news.yahoo.co.jp/articles/909e2e604f04f2e237f9328b24b538e09a071507,9/19(木) 7:00
2024-09-19,16:06,TTL,総合,16,ENCOUNT,山本譲二、北島三郎から「一番殴られた」弟子告白　スタジオ騒然…昭和の演歌界にMC苦笑い,https://news.yahoo.co.jp/articles/fc34ef4ee64a7cc8827d4fa045c0b13d81a2c6a1,9/19(木) 13:15
2024-09-19,16:06,TTL,総合,17,ねとらぼ,使用済みタオルはどこに置くのが正解？　ホテル従業員に“神客”と喜ばれる「チェックアウト時の行動」はこれだ！,https://news.yahoo.co.jp/articles/d0ce66f7bd2b1ec4216c874f22e0eeb12c73c75d,9/19(木) 11:45
2024-09-19,16:06,TTL,総合,18,日刊スポーツ,兵庫県知事に驚きの「戦略」浮上か　モーニングショー指摘「予想を超えた方なので…」泉房穂氏,https://news.yahoo.co.jp/articles/fe073f33600d7a987196563d0fd749fd36cd445e,9/19(木) 9:37
2024-09-19,16:06,TTL,総合,19,CoCoKARAnext,中日、嵐のオフ再び　監督退任が決まり、大粛清モードに突入か　注目高まる「理由」,https://news.yahoo.co.jp/articles/bb9841f81cedb07a8bb7a22f050bce8471b259e7,9/19(木) 10:40
2024-09-19,16:06,TTL,総合,20,FNNプライムオンライン,【決断】斎藤元彦知事は休日に笑顔で神事に参加…不信任決議案きょう可決へ　松井一郎氏「県民の皆さんの信を問うのが誠意」,https://news.yahoo.co.jp/articles/284a6486e62ea3cb7f54733764da30a42806e3e7,9/19(木) 12:37
2024-09-19,16:06,TTL,総合,21,乗りものニュース,「世界初の第6世代軍用機」就役間近か？ 米空軍が新ステルス爆撃機の新たな画像公開“吸気口”を使う様子も,https://news.yahoo.co.jp/articles/cd5d579d0925bfc826e4d1a89c8173321497a6dd,9/19(木) 15:12
2024-09-19,16:06,TTL,総合,22,Full-Count,阪神退団→巨人で無双「エグい」　”1人連覇”へ…衝撃12.86にファン歓喜「素晴らしい」,https://news.yahoo.co.jp/articles/51eba0ec5b8f2d64d71eaf0fd28d85974abea8e8,9/19(木) 10:20
2024-09-19,16:06,TTL,総合,23,日刊スポーツ,東国原英夫氏、山田邦子の“元カレ”暴露に驚き「言っちゃいけないと思ってずっと黙ってた」,https://news.yahoo.co.jp/articles/b2c5296ac1459999a2a9d442cdace4c90086d616,9/19(木) 10:46
2024-09-19,16:06,TTL,総合,24,ねとらぼ,荒れ放題の庭を、3年間ひたすら草刈りし続けたら……　感動のビフォーアフターに「劇的に変わってる」「素晴らしい」,https://news.yahoo.co.jp/articles/d96340f3f45be7fcd0a93595e3a583a8d356fbab,9/18(水) 22:00
2024-09-19,16:06,TTL,総合,25,ファイナンシャルフィールド,帰省したら、今年亡くなった祖父の遺産分割で孫にも「5万円」ずつもらいました。この金額なら“お小遣い”の範囲で、相続税は気にしなくても大丈夫ですよね…？,https://news.yahoo.co.jp/articles/88345025f3db006f5610ebf4210adc4d481234ec,9/19(木) 13:30
2024-09-19,16:06,TTL,総合,26,スポニチアネックス,「HiHi　Jets」高橋優斗　退所を発表「挑戦をしたい」　本人の申し出「アイドル人生最高でした」,https://news.yahoo.co.jp/articles/f91cae923bf007e4d2425959dd4edc9592c49086,9/19(木) 12:30
2024-09-19,16:06,TTL,総合,27,日刊スポーツ,【中日】立浪和義監督がチームに退任報告　選手らショック「ビックリ」「僕にも責任がある」,https://news.yahoo.co.jp/articles/f66764de82cbb4726975413a539d4b15f566d5e8,9/19(木) 13:57
2024-09-19,16:06,TTL,総合,28,まいどなニュース,新幹線の座席「体が大きいので、2席分買って座っていいですか？」←実はNG！相撲協会にも聞いてみた,https://news.yahoo.co.jp/articles/b682fe5bd2103a9c13a26c4ec36db177df49d2e6,9/19(木) 11:30
2024-09-19,16:06,TTL,総合,29,Full-Count,三浦監督“ブチギレ”後に激変「すげぇわ」　無双の助っ人、7連続ゼロ「一気に株上げた」,https://news.yahoo.co.jp/articles/487c27f381b6348ea626d1cdfd6c1f578664e611,9/19(木) 13:43
2024-09-19,16:06,TTL,総合,30,LIMO,日本で1番「面積が大きい市区町村」がある都道府県はどこなのか　約2割の人が知っていた,https://news.yahoo.co.jp/articles/aa083f80bf3d85af08b74d1c2ff90ff8127042be,9/19(木) 11:41
2024-09-19,16:06,TTL,総合,31,ITmedia PC USER,「約12万円のPS5 ProよりゲーミングPCを買った方がいい」は本当なのか？　同等スペックで組んだら価格は……,https://news.yahoo.co.jp/articles/ebd19be51b6bb4c7a20c99cc5480c5b8c6b23bce,9/19(木) 15:05
2024-09-19,16:06,TTL,総合,32,Full-Count,大谷翔平が「ひとりぼっち」　ライバル不在の孤高…6度越えた“0”は「驚異的な偉業」,https://news.yahoo.co.jp/articles/59d09a57191815c64602ae70535fbe17b0ca3d20,9/19(木) 11:34
2024-09-19,16:06,TTL,総合,33,朝鮮日報日本語版,「地震のような爆発」　ロシアのミサイル弾薬庫、ウクライナ軍の自爆ドローン攻撃で大規模火災,https://news.yahoo.co.jp/articles/1a2273752a338af287f2c8faa13c3f561d72ab03,9/19(木) 11:13
2024-09-19,16:06,TTL,総合,34,LIMO,庭の雑草を一掃する画期的な方法が話題に　「天才」「来年やってみるしかない」,https://news.yahoo.co.jp/articles/bc5020f3b4a79b930b0881ad08fada966f5a1328,9/18(水) 17:22
2024-09-19,16:06,TTL,総合,35,TBS NEWS DIG Powered by JNN,壇蜜さん　「元気で長生きって、かなり難しい」　ブログで心境　「心身不調により1年の30％以上を入退院に費やし、多額の治療費を使い」「独りになったらどう生きるか、なんて考えたりも」,https://news.yahoo.co.jp/articles/7f80965e4bf921a80d340402a47e11ae86173f3b,9/16(月) 17:36
2024-09-19,16:06,TTL,総合,36,ファイナンシャルフィールド,新幹線の指定席2つに座る4人の母子。「一人一席」かと思っていましたが、この乗り方は問題ないのでしょうか？,https://news.yahoo.co.jp/articles/19eb785c346ea489bc3f54df79921928cdbfb9fc,9/18(水) 14:10
2024-09-19,16:06,TTL,総合,37,あいテレビ,【大雨情報】関東甲信地方で警報級の大雨の可能性 東京都、神奈川県、千葉県、埼玉県、茨城県、栃木県、群馬県、山梨県、長野県で注意を【最新の雨の予想シミュレーション】,https://news.yahoo.co.jp/articles/72bc11a342b60ea8e6c125fc03f14a1298152dbe,9/19(木) 15:08
2024-09-19,16:06,TTL,総合,38,スポーツ報知,ヤンキースが延長戦勝利で２年ぶりポストシーズン進出決定　珍プレーでピンチ脱す,https://news.yahoo.co.jp/articles/07736a9eb5d2f7579b6794f1e84b11f4cd3a2dc4,9/19(木) 14:08
2024-09-19,16:06,TTL,総合,39,ABEMA TIMES,「なんか様子がヘンだ…」勝った力士に突如異変 館内騒然も力士の振る舞いにざわめきが一転、安堵の拍手と大歓声,https://news.yahoo.co.jp/articles/e68a4db9c5e3929701fd9e5c571770e12ace926a,9/19(木) 15:24
2024-09-19,16:06,TTL,総合,40,スポニチアネックス,東北新幹線が運転見合わせ…ロッテナインの帰京に影響も　吉井監督はホテルで待機,https://news.yahoo.co.jp/articles/2de0ce37f7121187d9c3fd1d3e4f109ea53e09c8,9/19(木) 13:40
