scrp_date,scrp_time,genre_en,genre_jp,rank,media_jp,title,link,date_original
2025-08-25,19:08,domestic,国内,1,J-CASTニュース,元ロンブー田村淳、クルド人問題に「擁護するつもりなど全くありません」再度釈明　酷い誹謗中傷には「然るべき対応」,https://news.yahoo.co.jp/articles/23f08ef4478c1299d2f1165e62bb6851440af8e9,8/25(月) 14:20
2025-08-25,19:08,domestic,国内,2,FNNプライムオンライン（フジテレビ系）,有権者の“石破辞めるな”急増　半数に迫る「総裁選前倒し支持せず」　自民党内から聞こえる“戸惑い”“嘆き”の理由,https://news.yahoo.co.jp/articles/7c33045b52e744467c630bef3760c30bbd1bb8bf,8/25(月) 14:09
2025-08-25,19:08,domestic,国内,3,弁護士JPニュース,“年金”で生活できず「生活保護」に頼った高齢者たちの“後悔”…日本の“老後生活”は「情報戦サバイバル」に？,https://news.yahoo.co.jp/articles/b4166e854d5a29ecf57f9c172068076f82b1f8b4,8/25(月) 10:00
2025-08-25,19:08,domestic,国内,4,デイリースポーツ,「クマ殺すな」北海道に苦情殺到→石井アナ「これ誰が苦情電話してるんですか？」　石原良純「自分とこの町に出たらどうするの？」　カンテレ番組,https://news.yahoo.co.jp/articles/ff79e2888e239cbdd8969335132b837e3e27e51d,8/24(日) 18:20
2025-08-25,19:08,domestic,国内,5,47NEWS,両親は実の親じゃなかった。６７年前に産院で取り違えられた男性。「出自を知りたい」,https://news.yahoo.co.jp/articles/db3b9330a92a0a0dc03ddf341a0fdc89bf5ede21,8/25(月) 9:02
2025-08-25,19:08,domestic,国内,6,日刊スポーツ,「ナイジェリアからの移民受け入れ」千葉・木更津市が完全否定　SNS騒動化に市長名義で声明,https://news.yahoo.co.jp/articles/70020b04904668c81083158f01eb2305e567f86d,8/25(月) 11:57
2025-08-25,19:08,domestic,国内,7,毎日新聞,万博帰宅困難トラブル　約1000人、徒歩で帰宅か,https://news.yahoo.co.jp/articles/07abd932d37210ef03838f59246c1a9e1bdc766b,8/25(月) 16:56
2025-08-25,19:08,domestic,国内,8,FNNプライムオンライン（フジテレビ系）,「真面目で社交的だがシャイな面も」被害者と“面識ない”谷本将志容疑者の勤務先社長語る素顔…事件直前から夏季休暇取得　神戸女性刺殺事件,https://news.yahoo.co.jp/articles/0d6be6c686422c4621e954686ed6622201a2b17e,8/25(月) 13:30
2025-08-25,19:08,domestic,国内,9,FNNプライムオンライン,「“路上の伝説”で有名な豊橋でストリートファイトが始まった」ライダーとドライバーが道路せき止め“3ラウンド”の殴り合い　愛知・豊橋市,https://news.yahoo.co.jp/articles/6cad649d12cf1b3662545b698c008bb0ec407610,8/25(月) 12:00
2025-08-25,19:08,domestic,国内,10,FNNプライムオンライン,立山・室堂でクマの目撃相次ぐ、登山客に注意呼びかけ　室堂ターミナル近くまで出没、登山客が計画変更も,https://news.yahoo.co.jp/articles/923ba20156769708e25d219c30a38aef63cbfb77,8/25(月) 18:12
2025-08-25,19:08,domestic,国内,11,読売新聞オンライン,焼き肉店で夕食後こつぜんと姿消した弟、雪積もる佐渡島を捜し回った兄…活動５１年「形に残す」,https://news.yahoo.co.jp/articles/764b4841de6b1cc4afd61fbad4254efc6289a760,8/25(月) 16:51
2025-08-25,19:08,domestic,国内,12,MBC南日本放送,【台風日本接近か?】次の台風は 来週に日本接近の可能性も【雨・風シミュレーション26日（火）〜9月4日（木）】台風情報2025,https://news.yahoo.co.jp/articles/573f08a1b5a9df3d786833d2b12c852925ec43f5,8/25(月) 11:14
2025-08-25,19:08,domestic,国内,13,J-CASTニュース,伊東市長が「伊豆高原メガソーラー計画」めぐりXで主張　膠着状態に...「謝ってから市長続ければ」の声も,https://news.yahoo.co.jp/articles/eb2bb3a6c12184e89219f008a5ae6e47d4cd0191,8/25(月) 11:39
2025-08-25,19:08,domestic,国内,14,毎日新聞,中3の娘を奪われ憎んだマスコミ　心変わりの転機は「法廷の執念」,https://news.yahoo.co.jp/articles/60a72256b41cd32bb73b3884db948e0453f08ab8,8/25(月) 17:00
2025-08-25,19:08,domestic,国内,15,産経新聞,千葉・木更津市役所のグーグルマップ表記が「ナイジェリア市役所」に、ホームタウン認定,https://news.yahoo.co.jp/articles/8e9269eac31edcea28d48da7a92334b2e5bc6e92,8/25(月) 15:36
2025-08-25,19:08,domestic,国内,16,共同通信,国保、1803億円赤字に　23年度、加入者減が影響,https://news.yahoo.co.jp/articles/d13217375d03126dcf2090a5b881a20a6327c4e1,8/25(月) 18:22
2025-08-25,19:08,domestic,国内,17,読売新聞オンライン,「九大生体解剖事件」資料が訴える戦争の愚かさ、立ち会った元医学生が収集…生き残った米軍機長との書簡も,https://news.yahoo.co.jp/articles/f6609fa956e7d4db80879c9d05f2117dfb95fc2e,8/25(月) 15:00
2025-08-25,19:08,domestic,国内,18,産経新聞,「電話が鳴りやまない」　アフリカ・ホームタウン認定で千葉・木更津市が対応に追われる,https://news.yahoo.co.jp/articles/961c3fc49c6dee75063735029707e90a0ca4eb82,8/25(月) 17:10
2025-08-25,19:08,domestic,国内,19,共同通信,千葉刑務所で受刑者死亡　頭から血、別の男が暴行か,https://news.yahoo.co.jp/articles/75f29ba7133ba2dfbd14915ee59caa3485995b3c,8/25(月) 16:01
2025-08-25,19:08,domestic,国内,20,FNNプライムオンライン,【ヒグマ速報】恐怖!玄関前にいた”デカい”クマが住宅敷地内へ―家庭菜園が連日食い荒らされているマチで”獲物を物色するように”徘徊するクマの姿をキャッチ＜北海道上ノ国町＞,https://news.yahoo.co.jp/articles/99d42c48861f28f90d3ed1aaa6a1f80358d39527,8/25(月) 15:03
2025-08-25,19:08,domestic,国内,21,TBS NEWS DIG Powered by JNN,【独自】神戸女性刺殺　容疑者が“尾行し始めたとみられる瞬間”が防犯カメラ映像に　勤務先出た直後から50分間後をつけ1人になるのを狙ったか,https://news.yahoo.co.jp/articles/738449dd41b5728aa5a55bb39320ecbc311ad942,8/25(月) 18:37
2025-08-25,19:08,domestic,国内,22,読売新聞オンライン,神戸女性刺殺、容疑者は３日前から被害者職場近くのホテルに…奥多摩で１５分以上押さえつけられ連行,https://news.yahoo.co.jp/articles/074491307a9c51fadd113100e3cd2c5cf40c96a0,8/25(月) 5:01
2025-08-25,19:08,domestic,国内,23,日刊スポーツ,「日本が山形・長井市をタンザニアに捧げた」現地報道が物議　へずまりゅう氏や参政党市議が疑問,https://news.yahoo.co.jp/articles/b1f257f6957ecedb136bf314197bc13cf23a9545,8/24(日) 16:16
2025-08-25,19:08,domestic,国内,24,FNNプライムオンライン,命がけの「満州引き揚げ」飢えと寒さで死ぬ人も 馬賊の恐怖 親と生き別れた子どもは「中国残留孤児」に…戦争の記憶,https://news.yahoo.co.jp/articles/33ad540d9ceea5db6937f8191aa5a818b4b897a9,8/25(月) 16:46
2025-08-25,19:08,domestic,国内,25,デイリースポーツ,田崎史郎氏　石破首相が「安倍さんや岸田さんと違う本質」→国民に見えた時にどうか　「１０カ月やらなかった人が、これからできます？」石破さんが良くて自民が悪い構図はおかしいと,https://news.yahoo.co.jp/articles/731225d2a2cdabfdce8ce400f62fea042738c993,8/20(水) 20:44
2025-08-25,19:08,domestic,国内,26,時事通信,河本三郎さん死去　元自民党衆院議員,https://news.yahoo.co.jp/articles/88fd546981ddfe96203694df11523c838e71fa77,8/25(月) 16:13
2025-08-25,19:08,domestic,国内,27,毎日新聞,石丸伸二氏、再生の道「代表交代に絡む発表」　27日に会見へ,https://news.yahoo.co.jp/articles/4c17ca060f3fc9b8f193ac9c7da914ec207f9210,8/25(月) 15:39
2025-08-25,19:08,domestic,国内,28,読売新聞オンライン,神戸女性刺殺、事件１か月前に新幹線チケットを入手…「帰省するため」と勤務先に申告,https://news.yahoo.co.jp/articles/59a25a3a9a457d9b6c02f3b621302a8b8ede9d76,8/25(月) 13:30
2025-08-25,19:08,domestic,国内,29,産経新聞,神戸刺殺　オートロック「共連れ」で突破　被害女性はエレベーターまで気づかなかったか,https://news.yahoo.co.jp/articles/0dd57ee850cc82c9ea8a5a6a2101041ef56f491f,8/25(月) 15:22
2025-08-25,19:08,domestic,国内,30,毎日新聞,未就学の子供ら3人を放置した疑い　30歳母を逮捕　「友人と食事」,https://news.yahoo.co.jp/articles/40fac5a1298b14f10230bcb755dd983e8107f89c,8/25(月) 18:35
2025-08-25,19:08,domestic,国内,31,スポーツ報知,"蓮舫氏　“家族""が「突然の心停止」…悲しみを吐露「安らかな寝顔でした」病気が判明した愛犬が死ぬ",https://news.yahoo.co.jp/articles/e76c6809f9573546ad86df4232921cdbf26c5a64,8/25(月) 12:00
2025-08-25,19:08,domestic,国内,32,ABCニュース,男が宿泊したホテルは女性の勤務先から数百メートルしか離れていなかった　神戸・マンション女性刺殺事件　”被害に遭いやすい瞬間”を専門家解説,https://news.yahoo.co.jp/articles/98e29aae1fe32e92ab95b5aba6de3ec2d461e8fe,8/25(月) 17:11
2025-08-25,19:08,domestic,国内,33,産経新聞,「今治市役所（モザンビーク）」とグーグルマップ書き換え被害　移民懸念の苦情も殺到,https://news.yahoo.co.jp/articles/e45deae771fcbea88e1c966651e97f2284923a64,8/25(月) 17:36
2025-08-25,19:08,domestic,国内,34,毎日新聞,同僚女性の太もも触る、酒に酔って暴行…　県職員らを処分　群馬,https://news.yahoo.co.jp/articles/eee6e7603a1b3a5be571cb7a719e61368213e3a1,8/25(月) 18:23
2025-08-25,19:08,domestic,国内,35,弁護士JPニュース,「何度注意しても指示を守らない」“問題社員”をクビにしてもいい？　裁判所が「解雇有効」と認める“判断基準”とは,https://news.yahoo.co.jp/articles/24f934d98d9732945c70470421d3cdd94041e8fe,8/25(月) 10:20
2025-08-25,19:08,domestic,国内,36,よろず～ニュース,石丸伸二氏27日の会見予告「再生の道代表交代に絡む発表」「あんまり慌てない方がいい」,https://news.yahoo.co.jp/articles/d94161b28f8924131b8be5ac420a734d50cf4b74,8/25(月) 17:30
2025-08-25,19:08,domestic,国内,37,TBS NEWS DIG Powered by JNN,千葉刑務所で50代の男性受刑者が血を流して倒れているのが見つかり死亡　同室の受刑者がステンレス製の水筒で殴ったか,https://news.yahoo.co.jp/articles/bba7dcbad52499547ee3f07e748ef9b0864df21c,8/25(月) 16:16
2025-08-25,19:08,domestic,国内,38,毎日新聞,家宅捜索中、捜査対象の男性に暴行疑い　警察官2人を起訴　大阪,https://news.yahoo.co.jp/articles/acbdcfc18a1442c2434dee13cd86a837fb2a64eb,8/25(月) 17:58
2025-08-25,19:08,domestic,国内,39,TBS NEWS DIG Powered by JNN,関東大震災朝鮮人犠牲者追悼式典の実行委員会が小池知事に抗議　「看過できない深刻な問題」　追悼文を送らないことに対し,https://news.yahoo.co.jp/articles/4b8d6ff6a2016292d286e5682a07dd226e891e46,8/25(月) 17:13
2025-08-25,19:08,domestic,国内,40,J-CASTニュース,「宅建の国家資格を偽造」元従業員が3年働き発覚のなぜ　マンションリノベ大手は謝罪、刑事告発も検討,https://news.yahoo.co.jp/articles/dc58acccc271aec3728434e11431d9a9a64a1e85,8/25(月) 18:25
