scrp_date,scrp_time,genre_en,genre_jp,rank,media_jp,title,link,date_original
2025-06-24,12:30,business,経済,1,みんかぶマガジン,また補助金垂れ流すの？小泉農水相「2000万円のコンバイン、普通買いますか？」農業機械リース推進の“怪しい”表明…経済アナリスト疑問,https://news.yahoo.co.jp/articles/a6e9574445dad051b3b7ce928cddaec0f24d6703,6/24(火) 9:10
2025-06-24,12:30,business,経済,2,ファイナンシャルフィールド,平均年収は460万円なのに「400万円以下が半数以上」の現実。男女別での“格差”も浮き彫りに…「普通の人」の年収はいくら？ 統計をもとに解説,https://news.yahoo.co.jp/articles/7327516e8f3d8f216e19b4014b9ee905a53e5f96,6/24(火) 11:20
2025-06-24,12:30,business,経済,3,ファイナンシャルフィールド,「賞与の給与化」で賞与が年2回→1回へ！“その分月収が増える”とのことだけど、同じ年収540万円で「賞与年1回 or ボーナスなし」を比較すると、年間の手取りはどちらが多い？ メリット・デメリットも解説,https://news.yahoo.co.jp/articles/3d9b6fa9fa8c270c6c62dc96567d38b3827a9212,6/24(火) 11:31
2025-06-24,12:30,business,経済,4,FNNプライムオンライン,「なぜ敷地外」「空港地下は絶対に無理なのか」熊本県が空港アクセス鉄道の駅を空港南側の敷地外で検討　空中回廊や地下通路で接続検討,https://news.yahoo.co.jp/articles/adeffa3e82b5fc4658b4d8d4bc49678e043b9608,6/24(火) 11:02
2025-06-24,12:30,business,経済,5,ファイナンシャルフィールド,中学校教員の平均年収は「660万円」だけど、残業・休日出勤の量を考えると“高い”とは言えない！ 教員の夫は「教頭になれば800万円台になるから…」と言いますが、そんなに年収アップするのでしょうか？,https://news.yahoo.co.jp/articles/304549108b27f0abc6991909f1f9c1c0666c85df,6/24(火) 11:20
2025-06-24,12:30,business,経済,6,LIMO,「月額15万円以上」の厚生年金＋国民年金を受け取る人の割合は何パーセント？6月13日に振り込まれた公的年金は前年度より増額,https://news.yahoo.co.jp/articles/fc9c3545be796b7f6a2b37af4d228287a919ee7b,6/23(月) 20:56
2025-06-24,12:30,business,経済,7,ファイナンシャルフィールド,30歳で「年収450万円」だけど、大企業勤務の同級生は「年収700万円」でうらやましい！ 大企業ってなぜ年収が高いのでしょうか？ 企業規模別の“平均年収”も比較,https://news.yahoo.co.jp/articles/7ef5dac19222dbef6e028a34bdae61e1e46890bb,6/24(火) 11:40
2025-06-24,12:30,business,経済,8,くるまのニュース,235万円から！ トヨタ新「ステーションワゴン」に大反響！ 「昭和のクラウンみたい」「高級車感がたまらん」「最新モデルなのに懐かしさを感じる」の声も！ 「カローラ ツーリング」のコーディネートに注目！,https://news.yahoo.co.jp/articles/1fe8aacf12defb023bf90dd60416eac1e635e1d2,6/24(火) 7:05
2025-06-24,12:30,business,経済,9,ロイター,再送-日産社長、閉鎖工場「決まったものはない」＝株主総会,https://news.yahoo.co.jp/articles/ea845fc920bf68bd6674909293f56e698fc11ca1,6/24(火) 11:23
2025-06-24,12:30,business,経済,10,読売新聞オンライン,「霧島酒造」社長が29年ぶりに交代…江夏順行社長のおい、邦威氏が昇格「本格焼酎事業により一層注力」,https://news.yahoo.co.jp/articles/f6971ab4724083133ea56e8a1b8451b0b8d9e3c3,6/24(火) 10:54
2025-06-24,12:30,business,経済,11,Bloomberg,ペルシャ湾便、主要航空会社が相次ぎ欠航－ＪＡＬは迂回ルート,https://news.yahoo.co.jp/articles/1101559835847ade942baad1219269b8b63c9353,6/22(日) 20:37
2025-06-24,12:30,business,経済,12,共同通信,農水次官は留任,https://news.yahoo.co.jp/articles/589ceb4952de41dbc7c8c52e2cd255b84363be96,6/24(火) 11:29
2025-06-24,12:30,business,経済,13,carview！,【制度は整ったが…】4月から普通自動車免許で125ccバイク解禁。でも今すぐ乗れないってどういうこと？,https://news.yahoo.co.jp/articles/0c68ca645b4f992526e55d4083bfccc89bc21a44,6/22(日) 9:00
2025-06-24,12:30,business,経済,14,くるまのニュース,新車114万円！ スズキ「“新”軽セダン」発表！ 「リッター28.2km」走る「新アルト」登場！ 精悍“リアスポイラー”×斬新2トーンも採用の「エントリー軽自動車」仕様変更実施,https://news.yahoo.co.jp/articles/93d083a6cdb63aef9ea4883101738262bc1e658e,6/23(月) 12:40
2025-06-24,12:30,business,経済,15,ファイナンシャルフィールド,夫婦で「年収600万円ずつ」稼いだ方が、1人で「年収1200万円」稼ぐより手取り額は多いのでしょうか？,https://news.yahoo.co.jp/articles/30845fb0c866d4a3bb0b5f6dff681efb4f25464c,6/24(火) 11:32
2025-06-24,12:30,business,経済,16,共同通信,【独自】宿泊予約アゴダに改善要請　観光庁、部屋確保されずトラブル,https://news.yahoo.co.jp/articles/b0f86e4473f1eedddc529ea2d57fd2c948988914,6/23(月) 17:47
2025-06-24,12:30,business,経済,17,乗りものニュース,胴体が無くて主翼だけ!? 「異形のステルス爆撃機」がイラン核施設を空爆して帰還  “大役”終えた機体の映像公開,https://news.yahoo.co.jp/articles/2ca654b9ef6526ba0e62ad8d68526cce9b052458,6/24(火) 11:42
2025-06-24,12:30,business,経済,18,BUSINESS INSIDER JAPAN,日本は出社回帰でも、米エリート社員は“高級賃貸”でリモート…働き方の差が生む市場,https://news.yahoo.co.jp/articles/c7c007a3fbfa34e35f6fbf975bf676aac7b98b50,6/24(火) 11:15
2025-06-24,12:30,business,経済,19,Merkmal,エア・インディア機墜落事故、なぜ「ボーイング787」は滑走路の端で離陸したのか？,https://news.yahoo.co.jp/articles/f8d7decdd81ee82806927a87696d53a63d4e73c1,6/21(土) 8:51
2025-06-24,12:30,business,経済,20,共同通信,「グロー」新商品、全国発売　BAT加熱式たばこ、9月,https://news.yahoo.co.jp/articles/f383159f7a64af3ec86f23454184f5f99387a7ad,6/23(月) 17:03
2025-06-24,12:30,business,経済,21,ITmedia ビジネスオンライン,『スマブラ』『カービィ』生みの親に聞く　ヒット作を生み出し続けるマネジメント,https://news.yahoo.co.jp/articles/8d4c8cadd4d5df79bfdb3590e6447a33d9e66434,6/22(日) 18:20
2025-06-24,12:30,business,経済,22,食品産業新聞社ニュースWEB,ほっかほっか亭「夏の冷しうどんシリーズ」3品発売/毎年人気の「えび天おろしうどん」、新登場の「チャーシューうどん」、一部店舗限定の「黒胡麻担々うどん」を展開,https://news.yahoo.co.jp/articles/8f35e9ba726f93842bde3ef4d6bb1aa8789de4e8,6/24(火) 11:43
2025-06-24,12:30,business,経済,23,産経新聞,「人員は足りないぐらいで」遠い家族主義　黒字でも人員削減するパナソニックのリアリズム,https://news.yahoo.co.jp/articles/61f99c620f64351f7ebfbca4804165303509690f,6/22(日) 22:30
2025-06-24,12:30,business,経済,24,carview！,【深刻】約3900名の従業員はどうなる？ 日産の主力「追浜工場」存廃の影響度と、閉鎖が避けられないワケ,https://news.yahoo.co.jp/articles/141895d90f485ccea86448d8fd4cc7e4c89029f8,6/24(火) 9:00
2025-06-24,12:30,business,経済,25,ファイナンシャルフィールド,年金暮らしの親への仕送りは「贈与」にあたる？300万円仕送りしたケースで解説,https://news.yahoo.co.jp/articles/e1280cf5eb3e9708a4810e5bd73ebfd1bafe7b44,6/24(火) 11:20
2025-06-24,12:30,business,経済,26,乗りものニュース,2時間半の航路でここまで豪華とは…！ 九州～四国のフェリー、“住める”レベルな設備の数々,https://news.yahoo.co.jp/articles/d33e1f74f79aa2be5ef9e918211a896c1845887a,6/24(火) 7:42
2025-06-24,12:30,business,経済,27,テレビ朝日系（ANN）,物価高“水筒持ち歩き派”急増　年間10万円節約　“便利機能付き”も続々登場,https://news.yahoo.co.jp/articles/0410b0a6d8f49877f815db02b0a12e9d68d5d25f,6/24(火) 11:31
2025-06-24,12:30,business,経済,28,共同通信,日産社長、業績不振を陳謝　株主総会、大規模リストラ説明,https://news.yahoo.co.jp/articles/d8a2c5285365437e88d1a182733a3bf5292520cf,6/24(火) 11:27
2025-06-24,12:30,business,経済,29,朝日新聞,「置き配」が標準、手渡しは追加料金　国交省が宅配の新ルール検討,https://news.yahoo.co.jp/articles/1275b37ccd4a212080bf5cff498fb7cdea617a68,6/23(月) 5:00
2025-06-24,12:30,business,経済,30,carview！,【衝撃デビューから早3年】「クラウンクロスオーバー」購入者のリアルな本音…SUV化は正解だったのか？,https://news.yahoo.co.jp/articles/e761142e9b23fb049abcb639b3d21fe079853961,6/24(火) 10:00
2025-06-24,12:30,business,経済,31,共同通信,日産社長、業績悪化を陳謝,https://news.yahoo.co.jp/articles/9037ebc47b058085d5d301d48e2f86956e8ae9e9,6/24(火) 10:47
2025-06-24,12:30,business,経済,32,くるまのニュース,トヨタ新「ハリアー」に大反響！ 「“250万円以上”安くてコスパ最高」「でも高級感バッチリ」「装備も十分」の声も！ “お洒落内装”＆上品デザインも魅力の「最安モデル」に注目！,https://news.yahoo.co.jp/articles/b68c2e44ebf9775e28c4bdc62f26a08d10b99977,6/24(火) 12:05
2025-06-24,12:30,business,経済,33,テレビ朝日系（ANN）,コメ5kg3000円台に下落　「皆さんの協力で達成」小泉氏　銘柄米は「あまり下がらず」,https://news.yahoo.co.jp/articles/d0c914e22840fd7d5e5cd315b2b68cbbaacfb587,6/24(火) 11:02
2025-06-24,12:30,business,経済,34,NOSWEB,旧車に出会ってわずか三年、純粋培養された空冷マニア｜1968年式 トヨタ パブリカ バン ＆ 日産 ブルーバード,https://news.yahoo.co.jp/articles/aaa38b3bcea8584388c08a2c5ff8c91b113e947b,6/24(火) 12:03
2025-06-24,12:30,business,経済,35,36Kr Japan,シャオミが全固体電池の特許を公開。大幅な性能向上を実現、量産に向け弾み,https://news.yahoo.co.jp/articles/6d2ca09b88f4ab0588f6ea7747983fff051c7f80,6/24(火) 9:01
2025-06-24,12:30,business,経済,36,ニュースイッチ,ダイバーズウオッチ初代再現…シチズン時計が投入、限定モデルのデザイン,https://news.yahoo.co.jp/articles/13728941cb449d36004b7d24f90bc420df66fadc,6/24(火) 10:40
2025-06-24,12:30,business,経済,37,共同通信,日産社長、工場削減計画の詳細を明かさず,https://news.yahoo.co.jp/articles/7e622aef62a40110cf55ac5f4c18036e7b9d25dc,6/24(火) 10:47
2025-06-24,12:30,business,経済,38,みんかぶマガジン,いま東京でマンションを買うなら「城東エリア」を選びなさい…識者が断言する理由とは,https://news.yahoo.co.jp/articles/7a033ed08d79bc6d974a0e18f005663634121a84,6/23(月) 17:10
2025-06-24,12:30,business,経済,39,共同通信,経産次官に藤木氏,https://news.yahoo.co.jp/articles/7ac7250ce20f21843f94905253076daeae90b09a,6/24(火) 11:20
2025-06-24,12:30,business,経済,40,ABCニュース,「黒字なのになぜ１万人削減？」パナソニックＨＤが１５００人の株主に構造改革への理解求める,https://news.yahoo.co.jp/articles/957f2be1ed76ecb9c8b740fa482033e06e05c6e0,6/23(月) 16:49
