scrp_date,scrp_time,genre_en,genre_jp,rank,media_jp,title,link,date_original
2024-05-29,07:17,TTL,総合,1,デイリースポーツ,「印象変わった」激変の新垣結衣、ＴＶ現れネット祭り　オン眉ぱっつん美貌に騒然「ええー」「分からなかった」「常人は許されない短さ」,https://news.yahoo.co.jp/articles/0a92283151fc42ab8b462ebe6827bfe84cea1aca,5/28(火) 21:16
2024-05-29,07:17,TTL,総合,2,西スポWEB OTTO！,〝サンモニ〟卒業から2年半 「元ご意見番」の姿にネット騒然!!あまりの変わりように心配の声も…「いつまでもお元気で」,https://news.yahoo.co.jp/articles/5905054562b7e4be48bac35fd334be709cb45fbf,5/28(火) 23:20
2024-05-29,07:17,TTL,総合,3,Medical DOC,お笑い芸人・今くるよさん逝去 死因の「膵がん」の前兆となる初期症状を医師が解説,https://news.yahoo.co.jp/articles/ae1ff041744a919a225354ad298e053b8ed34a93,5/28(火) 18:25
2024-05-29,07:17,TTL,総合,4,スポニチアネックス,【全文】新垣結衣　星野源のラジオに生出演　沈んだ声で騒動を否定「隣で見るのが本当に辛くて」,https://news.yahoo.co.jp/articles/42f95a2c8388b8d95fa8d046f478bab036143ffc,5/29(水) 2:00
2024-05-29,07:17,TTL,総合,5,スポーツ報知,コンビ解散から２か月…人気女性芸人、イケメンと体密着の２ショット！２０キロ減で美女オーラ,https://news.yahoo.co.jp/articles/676e645d1bfe1705f47b233436dc203ea6dfc6a5,5/28(火) 17:05
2024-05-29,07:17,TTL,総合,6,J-CASTニュース,「LUMIX」製品サイトの画像、ストックフォト使用に批判　パナソニックは謝罪「誤解を与える画像使用だった」,https://news.yahoo.co.jp/articles/b1ceaff274c301e9bcde27099c6e391b768bb95e,5/28(火) 19:07
2024-05-29,07:17,TTL,総合,7,ABEMA TIMES,身長115cmモデル・後藤仁美、第1子誕生を報告「小さな体での妊娠・出産はとても不安でした」,https://news.yahoo.co.jp/articles/1bb520123d1539b953e68b050276952e50103a71,5/28(火) 20:16
2024-05-29,07:17,TTL,総合,8,東スポWEB,星野源〝不倫疑惑〟の決定的間違い　もみ消し費用１０億円のずさんすぎる出どころ,https://news.yahoo.co.jp/articles/e240759f93befd809cfb7a42772c9255fe386089,5/24(金) 5:16
2024-05-29,07:17,TTL,総合,9,ABEMA TIMES,一体、何が起きた…！？ ヌートバーに“異変”が起こった…！ 中継カメラがとらえたアクシデントの瞬間　ファン騒然「やりすぎw」「怪我しなくてよかった」,https://news.yahoo.co.jp/articles/4d1f6d43e03fe4c6b71cc2b13c00fd4ce88dfc8f,5/28(火) 22:32
2024-05-29,07:17,TTL,総合,10,RONSPO,敵前逃亡？！井上尚弥の9月防衛戦相手がグッドマンから元世界王者ドヘニーに変更へ…理解し難い事態が起きた裏事情とは？,https://news.yahoo.co.jp/articles/16d295149b3eca39869c8b62ef47f181c43e31cd,5/29(水) 6:01
2024-05-29,07:17,TTL,総合,11,スポーツ報知,田中碧の争奪戦にドイツ１部優勝のレバークーゼン、同２位のシュツットガルト、イングランド・プレミアリーグのエバートンなど複数クラブが熱視線,https://news.yahoo.co.jp/articles/075ccec8d399438f329f5b3b42ec923b0743f83d,5/29(水) 3:00
2024-05-29,07:17,TTL,総合,12,日刊スポーツ,大谷翔平、Ｗヘッダー第２試合目は出場なし「クールダウンした後に出場、意味をなさない」監督,https://news.yahoo.co.jp/articles/b13d1e6ad02366d1edd402e741c83295187d8e39,5/29(水) 5:30
2024-05-29,07:17,TTL,総合,13,デイリースポーツ,麒麟同期の２５年売れてない芸人　まさか１００万超再生の大バスり　芸人界騒然　ゴミ屋敷の住人、部屋からまさかの,https://news.yahoo.co.jp/articles/347e5b74f5fa4c002492fcd47dbaf88d86a08ed2,5/28(火) 23:19
2024-05-29,07:17,TTL,総合,14,西スポWEB OTTO！,結成40周年の伝説バンド、64歳女性ボーカルの近影が「女王様」と話題に「唯一無二の存在感」「女神に会った様な感覚に」「おじさんにはたまらん」,https://news.yahoo.co.jp/articles/21ddc062f8588ac32cd4721f2e351402cd0023f3,5/28(火) 23:10
2024-05-29,07:17,TTL,総合,15,デイリースポーツ,「ガキ使」ＴＶで突然見なくなった男が　一瞬映り騒然　路上で電話、陣内「おるやん！」　ネットも「久しぶりｗ」「あれで終わり！？」,https://news.yahoo.co.jp/articles/fc8d4266758673ffb98522f62c38d6b5af71444f,5/28(火) 17:30
2024-05-29,07:17,TTL,総合,16,ENCOUNT,人気芸人の父親が『ラヴィット！』に“ブチギレ”「あれはアカン」　MCの川島明は謝罪,https://news.yahoo.co.jp/articles/88bd6be954b609271847ca4618e8ada7e15b145b,5/28(火) 17:32
2024-05-29,07:17,TTL,総合,17,日テレNEWS NNN,【女子バレーNL】日本が世界ランク2位ブラジルとフルセットの熱戦　古賀紗理那のサービスエースが光るも惜敗,https://news.yahoo.co.jp/articles/c38a76e7cbe43ceee0eb1a481cb8cd590c5bb49b,5/28(火) 22:52
2024-05-29,07:17,TTL,総合,18,西スポWEB OTTO！,「金額を見てびっくり」人気歌手が宝くじ当選を報告しネット騒然!?驚きの当選確率は…「日頃の行い」「これは素直にすごい！！」,https://news.yahoo.co.jp/articles/410ad45b2b2e16f546278ceaf2a651b40ccb4407,5/29(水) 0:40
2024-05-29,07:17,TTL,総合,19,西スポWEB OTTO！,初代ミニスカポリスの51歳変わらぬ近影が話題に「タイムスリップ？」「もうプンプン」「変わらなさすぎ」,https://news.yahoo.co.jp/articles/2af7e6e928a7831d4faf65244efde50dad70094e,5/28(火) 23:30
2024-05-29,07:17,TTL,総合,20,西スポWEB OTTO！,「イケメンですね!!」元モー娘。人気タレントが〝大胆〟ショートヘアで大反響!!「昔から全然変わらない…」「相変わらずお綺麗」,https://news.yahoo.co.jp/articles/80e191673242d91f817ca27cca1734a6d2db265c,5/28(火) 23:40
2024-05-29,07:17,TTL,総合,21,J-CASTニュース,元人気アイドル「今まであった芸能人の中で一番ヤバい」年下女優の「態度悪い」「なめてる」姿暴露　自分よりも「デビュー早かった」から？,https://news.yahoo.co.jp/articles/d4d933a281159f5fa77c1186924ae0b70824570b,5/28(火) 18:54
2024-05-29,07:17,TTL,総合,22,Full-Count,大谷翔平は「2番・DH」　Wヘッダー第1戦で14号なるか、第2戦は欠場見込み…スタメン発表,https://news.yahoo.co.jp/articles/5991dd2d804a3098ac86f9455c01f5cf2eeb5e4d,5/29(水) 2:03
2024-05-29,07:17,TTL,総合,23,ほ・とせなNEWS,10歳差の兄が妹に愛を注ぎまくった結果　2年後、妹の行動の変化に「こんな子に育ってほしいなぁ」「おじさん泣いちゃう」「尊い」,https://news.yahoo.co.jp/articles/04f351a5c3dd8792b1a7396f17b265bd066d1d66,5/28(火) 11:45
2024-05-29,07:17,TTL,総合,24,FITNESS LOVE,卓球女子がビキニ競技に挑戦！　コンテストで銀メダル獲得　筋トレ開始前は「ぽちゃぽちゃ体型」だった,https://news.yahoo.co.jp/articles/1d717c695241540d8031c88d573835e72a5d2312,5/29(水) 5:00
2024-05-29,07:17,TTL,総合,25,東スポWEB,宮迫博之 ５年ぶりの地上波出演が決定「何がしかを乗り越えてくれたオファー」,https://news.yahoo.co.jp/articles/eb46d9acc27e32ed621b98915f3bef0a6a78e3b0,5/28(火) 20:51
2024-05-29,07:17,TTL,総合,26,神戸新聞NEXT,駐車禁止場所に覆面パトカー、車内で隊員がハンバーガーを　通行人が110番、ルール守らず口頭注意「同僚の目が気になり…」　神戸,https://news.yahoo.co.jp/articles/9e78151940fa5305a06ab344ab657db14c76b6d5,5/28(火) 19:48
2024-05-29,07:17,TTL,総合,27,日刊スポーツ,おぎやはぎ、滝沢ガレソの“ガセネタ”投稿問題に私見　矢作兼「訴えなかったから調子に乗った」,https://news.yahoo.co.jp/articles/f4e9fa6460d8792cc35fb110597910d7c5c80f38,5/24(金) 15:25
2024-05-29,07:17,TTL,総合,28,まいどなニュース,「この子達をどうするんですか」自宅の敷地内に子猫4匹が置き去り…体を寄せ合う姿に「ひどい」「無責任」なぜここに？,https://news.yahoo.co.jp/articles/72d9ac8df2594479dc7921badb3563c683a81415,5/28(火) 14:20
2024-05-29,07:17,TTL,総合,29,中日スポーツ,今くるよさん、40年前は巨人のように大柄に映ったのに…背中がやけに小さく見えた【悼む】,https://news.yahoo.co.jp/articles/0bc978dc7fe305810ca33a8507b763320b7da7dd,5/29(水) 4:00
2024-05-29,07:17,TTL,総合,30,スポーツ報知,久保建英、パリ五輪出場断念を明言「みんなで話して決まった結論。僕も納得しているという感じ」,https://news.yahoo.co.jp/articles/600af5c19110f5243b48d5e2618ad23ee10ad0ed,5/28(火) 17:17
2024-05-29,07:17,TTL,総合,31,スポニチアネックス,超名門高出身の井桁弘恵、進学先を決めた理由に驚き　パンサー向井「一番かっこいい理由！」,https://news.yahoo.co.jp/articles/cf3a609bfb2a5c5bb2c62bd85b7f42f2d9a931f2,5/28(火) 16:51
2024-05-29,07:17,TTL,総合,32,デイリースポーツ,岡田圭右　いま松竹芸能を退社されたらヤバい２組の名前　松竹命運を吉本に売るボケ→エース芸人に涙流し怒られる　大悟「会社終わるで」,https://news.yahoo.co.jp/articles/e8189ef8e64486e0da922092af711e1c668383d7,5/28(火) 19:44
2024-05-29,07:17,TTL,総合,33,東スポWEB,久保建英〝冷遇〟じゃなかった？　Ｒソシエダード監督がシーズン終盤「出番減」の理由説明,https://news.yahoo.co.jp/articles/6012e41064ebb39d74a8297e11c52164b37aca88,5/29(水) 5:16
2024-05-29,07:17,TTL,総合,34,スポーツ報知,原辰徳氏から阿部監督へ「こういう意図であの作戦を取ったとナインに説明すべき」バントは「消極的に見えた」,https://news.yahoo.co.jp/articles/539a511944c632032b95254280fad5d6c98ae3d6,5/29(水) 5:00
2024-05-29,07:17,TTL,総合,35,日刊スポーツ,室井佑月氏、家賃５万円のボロビル住まいで「落ちぶれた」の声に「なんとでも言えばいい」,https://news.yahoo.co.jp/articles/aa83a22256c47f9ab5f668617323270f48c51fc0,5/28(火) 17:08
2024-05-29,07:17,TTL,総合,36,スポーツ報知,現役時のイチロー氏が衝撃を受けた巨人投手とは「真っすぐがゴォー！って来る」プロスピＡイチローセレクション,https://news.yahoo.co.jp/articles/a649eccf1c3720f1420c3b632062ab71e087f2e5,5/28(火) 23:14
2024-05-29,07:17,TTL,総合,37,ファイナンシャルフィールド,友だちの彼氏が公務員だと知りました。「高給」だと言っています。公務員で年収1000万円の人とか、いるのでしょうか？,https://news.yahoo.co.jp/articles/23628166fbacf86209c05168f13a25563a005b6c,5/28(火) 6:50
2024-05-29,07:17,TTL,総合,38,デイリースポーツ,高梨沙羅　ばっちりメイクで目力美貌！黒タンクで挑発的、クールな姿にドキドキッ,https://news.yahoo.co.jp/articles/4a55d782d8f7ddc558d6cc7e37cbc3c0492e114f,5/28(火) 18:19
2024-05-29,07:17,TTL,総合,39,スポニチアネックス,今くるよさん死去　最後の舞台は22年「伝説の一日」　車椅子姿で登場し「どやさ～！」,https://news.yahoo.co.jp/articles/837bb2c6c5a54a0a62efb467d3c5487794469927,5/28(火) 17:57
2024-05-29,07:17,TTL,総合,40,日刊スポーツ,【阪神】岡田監督が挑発返し「３番に入れたら、大したもんやけどな」日本ハム新庄監督を揺さぶる,https://news.yahoo.co.jp/articles/4b8ffb1461921a1bfec2dd6b1d3595b509144a69,5/29(水) 5:00
