scrp_date,scrp_time,genre_en,genre_jp,rank,media_jp,title,link,date_original
2025-10-16,09:31,business,経済,1,ITmedia ビジネスオンライン,元ドラフト1位投手、28歳で戦力外、そして回転寿司屋へ――異色キャリアの裏にあった決断,https://news.yahoo.co.jp/articles/be14159ed4fc11436bcb6392a356f816a785cdf5,10/16(木) 8:10
2025-10-16,09:31,business,経済,2,読売新聞オンライン,ＵＦＯキャッチャー４０年の人気「１週間で景品入れ替え、全く別のゲームになる」,https://news.yahoo.co.jp/articles/b20b953538e3a61d1d3e0414d10388db510d707c,10/16(木) 5:00
2025-10-16,09:31,business,経済,3,みんかぶマガジン,玉木財務相起用を検討⁉自民関係者「わざとポストを空けている」…経済アナリスト「高市ー玉木ラインが実現すれば株価急騰の可能性」,https://news.yahoo.co.jp/articles/a823804df94e14e307dccde68706c7d38565fe1c,10/16(木) 9:10
2025-10-16,09:31,business,経済,4,Bloomberg,トランプ氏、米中は貿易戦争のさなかと表明－財務長官は長期停戦提案,https://news.yahoo.co.jp/articles/c4eeb857364dde48a673ec8b48bf63e9a9127a0d,10/15(水) 22:33
2025-10-16,09:31,business,経済,5,ファイナンシャルフィールド,今年の「年末調整」から“基礎控除”や“給与所得控除”が見直されると聞きました。年収400万円なら、結局どれくらい「減税される」ことになりますか？,https://news.yahoo.co.jp/articles/08379b3b1fd4ece10c5a826ea97c4bcf6b3fa8f2,10/15(水) 13:40
2025-10-16,09:31,business,経済,6,テレビ朝日系（ANN）,コメ増産“宝の山”価格2倍…収穫量過去最大　大規模化進む中、手放す農家の複雑胸中,https://news.yahoo.co.jp/articles/92873860835de0703cb0f01379633b7ed9baf793,10/15(水) 17:21
2025-10-16,09:31,business,経済,7,36Kr Japan,高市総裁誕生で注目、議員会館の中国製AI掃除ロボットの正体。ソフトバンクGが出資し日本で広がる,https://news.yahoo.co.jp/articles/106ecf3beac56267dfd62cc798e733dbeafe6923,10/16(木) 8:30
2025-10-16,09:31,business,経済,8,LIMO,非課税世帯は「現金給付」ってこと？高市新総裁が言ってる「給付付き税額控除」をわかりやすく解説！,https://news.yahoo.co.jp/articles/8b568bb2ff184165c0ab5083bba11d21f8f18039,10/16(木) 8:06
2025-10-16,09:31,business,経済,9,ITmedia ビジネスオンライン,今は鮮魚を追う、元楽天投手・森雄大さんが見つけた新たな「生きがい」,https://news.yahoo.co.jp/articles/15cb076388ccc0a852e948f9ecd153885346ad04,10/16(木) 8:15
2025-10-16,09:31,business,経済,10,ITmedia ビジネスオンライン,「24時間・完全セルフ」大阪のうどん店、オープン3年でどうなった？　売上半分でも4つの成果,https://news.yahoo.co.jp/articles/73851593fb0e349ab621fc2aef16a2bb217543e4,10/16(木) 7:10
2025-10-16,09:31,business,経済,11,乗りものニュース,「交通系ICカードは一切ご利用いただけません」ついに解消！ 日本最後の“空白地帯”埋まる ただし鉄道はまだ,https://news.yahoo.co.jp/articles/5d6fc30fbc7129128ad2121fceaba22ae8bc1ae4,10/15(水) 16:12
2025-10-16,09:31,business,経済,12,ファイナンシャルフィールド,退職金にも税金がかかるそうですが、「2000万円」もらえる場合手取りはどれくらいになりますか？ 老後資金として不足するでしょうか？,https://news.yahoo.co.jp/articles/0cb6a237a3fd5648740c96795a13997a2a40a6c6,10/15(水) 13:20
2025-10-16,09:31,business,経済,13,MONEY PLUS,株価暴落を待つのは間違い？データが語る、投資を始められない人の心理,https://news.yahoo.co.jp/articles/168c6d95aff8a1cdc41be0958d2becfd791c429e,10/16(木) 7:30
2025-10-16,09:31,business,経済,14,乗りものニュース,ヨーロッパ最大の原子力空母ついに建造スタート！ 次世代原子炉×電磁カタパルト 就役はかなり先,https://news.yahoo.co.jp/articles/f7b663eaf0c85ce39d4148bb2c19bda1ef3114c3,10/15(水) 12:12
2025-10-16,09:31,business,経済,15,産経新聞,さらば万博、変わる街並み…大阪の街彩ったバナーフラッグやモニュメント、今月末に撤去,https://news.yahoo.co.jp/articles/98a455aa9275d85abb9f1fcef2d3fa6c30b16928,10/16(木) 8:10
2025-10-16,09:31,business,経済,16,乗りものニュース,千葉の「ナイスっ！な新スマートIC」ついに工事着手へ 交通量6万台“超絶渋滞ポイント”の対策セット！,https://news.yahoo.co.jp/articles/cc7ef7d85b4a3e45b8b307e749fef8b65f706482,10/16(木) 7:42
2025-10-16,09:31,business,経済,17,Webikeプラス,お待たせしすぎたかもしれません！ ヤマハ「YZF-R9」149万6000円で10月30日発売,https://news.yahoo.co.jp/articles/6d486886c483f5652a00f85f5dc5477381cc56ec,10/16(木) 6:40
2025-10-16,09:31,business,経済,18,乗りものニュース,進水した「海自の最新潜水艦」が多数の船に囲まれた！ 神戸港ならではの“珍光景”が実現,https://news.yahoo.co.jp/articles/a6562d4eba544be5aa3519f1c0e373f215e07632,10/16(木) 6:12
2025-10-16,09:31,business,経済,19,MBSニュース,"ひたすら試してランキング「カップラーメン醤油味」を徹底調査！麺・スープ・全体の味で満点獲得し""王者の貫禄""見せつけた1位の商品は？プロも脱帽「もう言うことなし」【MBSサタプラ】",https://news.yahoo.co.jp/articles/f17a2740dedf3fa507d8d77f1d14b7a0b4fa058e,10/15(水) 15:01
2025-10-16,09:31,business,経済,20,NOSWEB,「商売抜き」で心底ホレ込んで所有している2台と2人,https://news.yahoo.co.jp/articles/414c2f5a8feac3a03ca89a14f1d8956e7e0544e0,10/16(木) 7:03
2025-10-16,09:31,business,経済,21,読売新聞オンライン,「ユーチューブ」で世界的に障害発生か…動画が再生されず・画面が急に暗転,https://news.yahoo.co.jp/articles/da696df593954dac91626953a3013173d982ad46,10/16(木) 9:06
2025-10-16,09:31,business,経済,22,ファイナンシャルフィールド,病院でもらった「処方箋」は、家の近くの薬局で会計が「1500円」だったけど、駅前の薬局なら“1200円で済んだ”かもしれないって本当？ 値段に差が出る理由とは,https://news.yahoo.co.jp/articles/bd2b77003bf1a20d1f149a528223a057cf12dd05,10/14(火) 13:50
2025-10-16,09:31,business,経済,23,乗りものニュース,「飛行機乗る人よりカネ使う人優遇」に怒りの声も 新千歳空港の駐車料金“最大5倍”の衝撃 一体なぜ？,https://news.yahoo.co.jp/articles/e721867a34ceddce984eddea303094e6f8f19f0c,10/16(木) 7:12
2025-10-16,09:31,business,経済,24,食品産業新聞社ニュースWEB,【エースコック】必ずもらえる『ミッフィーバッグプレゼントキャンペーン』開催、対象商品は「スープはるさめ」など,https://news.yahoo.co.jp/articles/ff9dccc055f9f32b75b27357182a5b5a8ae64363,10/15(水) 13:19
2025-10-16,09:31,business,経済,25,Bloomberg,米国の手法学んだ中国、「バズーカ砲」でレアアース統制に乗り出す,https://news.yahoo.co.jp/articles/90325229f6ca19654d00c66ca50dfc9a3ccc771f,10/15(水) 12:36
2025-10-16,09:31,business,経済,26,乗りものニュース,ロシアなぜ恐れる？ 米「トマホークミサイル」ウクライナ供与の重たい“意味” よく飛ぶミサイルはすでにあるのに,https://news.yahoo.co.jp/articles/b872323b5e8d2c81163b714d84bf220e60d5915f,10/15(水) 8:12
2025-10-16,09:31,business,経済,27,Yahoo!ニュース オリジナル THE PAGE,【ヤフコメで話題】「JAの米買い取り価格が高騰し消費者負担増」「農家の収入増も消費者の苦しさに」 - JAによる米価高騰への意見が相次ぐ,https://news.yahoo.co.jp/articles/260369ec4e417a6061f0fb25cf35ec741406ae1d,10/16(木) 7:22
2025-10-16,09:31,business,経済,28,バイクのニュース,車検も車庫証明も不要、普通免許で運転可、76万円から購入できる「3人乗りトライク」 かわいさと快適性を両立した新モデル「VIVEL TRIKE cocoシリーズ」予約受付開始,https://news.yahoo.co.jp/articles/82f63079b5f5939bef5629c38623bd4e7dedd439,10/14(火) 6:55
2025-10-16,09:31,business,経済,29,バイクのニュース,自転車への「青切符」導入は2026年4月から　同時にクルマに追加される新ルールとは？,https://news.yahoo.co.jp/articles/6a2564dd155209b1752f407886263a8fe8301742,10/14(火) 15:15
2025-10-16,09:31,business,経済,30,共同通信,米、友好国と中国に対抗　レアアース輸出規制巡り,https://news.yahoo.co.jp/articles/f6dc42eb80bb13970f7a8e33dd764b1597decfba,10/16(木) 6:47
2025-10-16,09:31,business,経済,31,Bloomberg,高市氏の首相指名へ、自民が維新ときょう連立視野に政策協議を開始,https://news.yahoo.co.jp/articles/10b3f9a0186785c1c435ea06848618995e43617a,10/16(木) 8:32
2025-10-16,09:31,business,経済,32,乗りものニュース,国内屈指の「離着陸が難しい空港」に空自の巨大輸送機が出現 埼玉から支援物資を空輸,https://news.yahoo.co.jp/articles/95f5291b472ba2a1d28ac8d813af749d7f4612b7,10/15(水) 7:12
2025-10-16,09:31,business,経済,33,乗りものニュース,「電気機関車」JR東日本から全滅!? 最後まで残る機関車は？ 往年の“列車の顔”が次々引退,https://news.yahoo.co.jp/articles/f4d4d4c0cf7129694891475243c2c7adec8a6e98,10/16(木) 6:42
2025-10-16,09:31,business,経済,34,ファイナンシャルフィールド,年金「15万円」をもらっていた夫が急逝…自分の年金は「5万円」ほどなのですが、遺族年金が受け取れたら生活していけるでしょうか？,https://news.yahoo.co.jp/articles/97bdbf85b7b3a6f9a64b65d3b8b73ccdd04ccc3c,10/14(火) 11:31
2025-10-16,09:31,business,経済,35,ABEMA TIMES,コンビニ3社の中間決算 セブン苦戦、ファミマ・ローソンは増収,https://news.yahoo.co.jp/articles/741f615882f5cbb87a883bacbfcb637918c3dab9,10/16(木) 8:33
2025-10-16,09:31,business,経済,36,LIMO,どこで買うのが正解？『ポケモンレジェンズZ-A』の早期特典は27種類！販売店による違いをチェック【Switch新作】,https://news.yahoo.co.jp/articles/6cdc4d068c8c16e954de796e58d7ea5571ae0651,10/15(水) 8:31
2025-10-16,09:31,business,経済,37,ITmedia ビジネスオンライン,部下「出社義務化なら転職します」　上司は引き止めるべきか、去ってもらうべきか,https://news.yahoo.co.jp/articles/e60781d89448ee28e33eea5a882f84cc3e863d85,10/14(火) 8:10
2025-10-16,09:31,business,経済,38,ファイナンシャルフィールド,私の手取りは17万円なのに、パートさんの時給は1500円…。正社員って本当に得なのかと考えてしまいます。,https://news.yahoo.co.jp/articles/bf6c5a68ebb5b2b3981928ec1018b804b4d09c6e,10/10(金) 7:50
2025-10-16,09:31,business,経済,39,Impress Watch,「東京大学西千葉キャンパス跡地」再開発始動　1.2万m 2 のキャンパスパーク,https://news.yahoo.co.jp/articles/1f9ffa5bcbb3274655f611b354297c28df6ea3b8,10/15(水) 20:20
2025-10-16,09:31,business,経済,40,BUSINESS INSIDER JAPAN,フォーエバー21、ヨーカドー向けアパレル「撤退」の旧アダストリア、競合と協業する次の戦略,https://news.yahoo.co.jp/articles/61c73b4c5a16861544286348253e85de849d8cd5,10/16(木) 7:00
