scrp_date,scrp_time,genre_en,genre_jp,rank,media_jp,title,link,date_original
2025-10-16,21:12,sports,スポーツ,1,Full-Count,台湾球界で35歳の日本人が「影のMVP」　人気拡大…観客動員数は初の300万人突破,https://news.yahoo.co.jp/articles/57dd05a4b45bbedb87d3481f1c8ca228166ad099,10/16(木) 19:08
2025-10-16,21:12,sports,スポーツ,2,Full-Count,豪快150m弾も…大谷翔平に容赦ない発言　フリーマンの痛烈反応に「イジり草すぎる」,https://news.yahoo.co.jp/articles/ab70832757fd2c2a70533dcfce96f477ffa9a97f,10/16(木) 16:49
2025-10-16,21:12,sports,スポーツ,3,中日スポーツ,甲子園、5回表終了で雨のため試合中断　試合は3―2でDeNAが1点リード【セCSファイナル第2戦】,https://news.yahoo.co.jp/articles/131fa5ac9bea9c69d6fe1b132e66f9fc2fa306b5,10/16(木) 19:52
2025-10-16,21:12,sports,スポーツ,4,スポーツ報知,【巨人】キャベッジが米国へ帰国　長野久義に「かわいがってくださって本当に感謝」,https://news.yahoo.co.jp/articles/a315ead9d5107a3f11c29ca8a327755c1b2efec3,10/16(木) 19:05
2025-10-16,21:12,sports,スポーツ,5,スポーツ報知,畠山愛理　夫のカブス鈴木誠也と密着ショット！「２７番」ジャケット姿を披露…結婚６年,https://news.yahoo.co.jp/articles/31d74e32565a27a71e8abd5549c148cdee9677e6,10/16(木) 13:50
2025-10-16,21:12,sports,スポーツ,6,デイリースポーツ,亀田興毅氏　現役時代の稼ぎは３０億円も「なくなった。どっかいった」愛妻から「子どもの幼稚園代がないって」,https://news.yahoo.co.jp/articles/b176b691313255d57933313e8a57c5be17089130,10/16(木) 19:31
2025-10-16,21:12,sports,スポーツ,7,デイリースポーツ,阪神－ＤｅＮＡ　降雨で４７分試合中断　２０時２７分、五回裏から試合再開,https://news.yahoo.co.jp/articles/e0c8e39af089e027bf1e4edb96bd6e69e9a338b1,10/16(木) 20:33
2025-10-16,21:12,sports,スポーツ,8,Full-Count,「さっきも言いましたけど」　大谷翔平から“NGワード”連発も…17分会見で見えた真髄,https://news.yahoo.co.jp/articles/7e3591ae0f70c119f9c9e24faf2b26efbcbbe939,10/16(木) 12:27
2025-10-16,21:12,sports,スポーツ,9,月刊陸上競技,中央学大、大東大が上位候補か!? 東海大、順大、立教大、日大は主軸に力 「10枠」懸けた“立川決戦”／箱根駅伝予選会展望,https://news.yahoo.co.jp/articles/1ad980e47da71148801740397d468de0c2a84077,10/16(木) 18:00
2025-10-16,21:12,sports,スポーツ,10,Full-Count,突然の離脱も…ドジャース本拠地で目撃「なんか哀愁が漂う」　108億円男へ気になる視線,https://news.yahoo.co.jp/articles/0d60f3ea2754687b3f17d0f1abaab17bd9969766,10/16(木) 20:15
2025-10-16,21:12,sports,スポーツ,11,日テレNEWS NNN,前回登板は球速低下も…佐々木朗希に“懸念なし”　ロバーツ監督は直近起用も示唆「我々は優勝を目指している。総力戦だ」,https://news.yahoo.co.jp/articles/82eea159dcd4215ac3f7ed77c2778dd7e9efc596,10/16(木) 15:00
2025-10-16,21:12,sports,スポーツ,12,東スポWEB,【ＭＬＢ】パドレス・シルト監督　電撃辞任の真相「もう疲れた」殺害予告にコーチと衝突で乱闘寸前＝米報道,https://news.yahoo.co.jp/articles/4d859bd15cc43060ed7ce3ebd8b9f5b7a7c73d12,10/16(木) 16:16
2025-10-16,21:12,sports,スポーツ,13,毎日新聞,クライマックスシリーズなのに…みずほペイペイドームは空席目立つ,https://news.yahoo.co.jp/articles/0d518cf5f88ddae3fb32d67ac6fbee91fef87bff,10/16(木) 19:13
2025-10-16,21:12,sports,スポーツ,14,デイリースポーツ,「店に入ってきた時は息をのんだ」ロンドンで異質存在感の力士たちに現地メディアも注目「恐らく最大の観光客」食事量には驚愕「牡蠣、カルパッチョ、ステーキ、ロブスター…」,https://news.yahoo.co.jp/articles/6b370ef6db76e4266d318396a9e4913696a0f3a6,10/16(木) 17:27
2025-10-16,21:12,sports,スポーツ,15,デイリースポーツ,「Ｗ不倫なんて大きなミスよ、人生において！」ＢＤ人気選手と結婚の美人マネ激怒　「全て失った」夫に離婚切り出され…無断撮影にブチギレ「載せるつもりなん？」,https://news.yahoo.co.jp/articles/53ac0a4260559c1e8a7c1e7fb6d4097ac83c25ca,10/16(木) 19:37
2025-10-16,21:12,sports,スポーツ,16,スポニチアネックス,ブラジルでテレビ観戦の闘将が吠えた！森保ジャパンの王国撃破に「お前らざまあ見ろ！」,https://news.yahoo.co.jp/articles/4e60267403f79b9f2fff17a0765b0dd718eca7dc,10/16(木) 16:59
2025-10-16,21:12,sports,スポーツ,17,日刊スポーツ,【中日】井上監督が木下拓哉らベテラン野手６人に対し、秋季練習の全体練習参加終了を伝える,https://news.yahoo.co.jp/articles/d213c086d8121096058625673a60eee26cc79d2d,10/16(木) 18:20
2025-10-16,21:12,sports,スポーツ,18,Full-Count,日本で活躍した32歳が台湾で首位打者争い　吉田一将や櫻井周斗が「助っ人」に,https://news.yahoo.co.jp/articles/0516bcbff410a484ea10963f7905795ec1ec11da,10/16(木) 20:27
2025-10-16,21:12,sports,スポーツ,19,スポーツ報知,【巨人】ヘルナンデスが帰国　残留熱望「皆が好き。できればジャイアンツに戻ってプレーしたい意思は強い」,https://news.yahoo.co.jp/articles/75c3f10c823b8e66998df8dc81fcf463ea5f32b3,10/16(木) 17:59
2025-10-16,21:12,sports,スポーツ,20,theWORLD（ザ・ワールドWeb）,「日本はブラジルに勝ったというのに、たかがパラグアイに勝って喜んでいる」　韓国代表、パラグアイ戦勝利もホン・ミョンボ監督は批判に,https://news.yahoo.co.jp/articles/df11384ec80d7952791ab991d45af21d603314dd,10/16(木) 11:52
2025-10-16,21:12,sports,スポーツ,21,東スポWEB,【ＭＬＢ】ドジャースファンに暴言を放ったブルワーズファンが仕事をクビに＝米報道,https://news.yahoo.co.jp/articles/b6971c03e1f5bec61c46c56570ef7215dbec7feb,10/16(木) 17:20
2025-10-16,21:12,sports,スポーツ,22,CoCoKARAnext,「こいつはどんどん強くなってる」――“エース”へと進化を遂げた山本由伸　ド軍同僚たちが語る価値「本当に、本当に感銘的だ」,https://news.yahoo.co.jp/articles/b2185aafd28e60c1c91b1cb58f15f73833bb997b,10/16(木) 18:03
2025-10-16,21:12,sports,スポーツ,23,日刊スポーツ,元横綱の白鵬翔さん　意外すぎる豪華な３ショット「笑顔が素敵すぎます」の声　大阪・関西万博で,https://news.yahoo.co.jp/articles/a99ba8368f186e4c49a4397d359fe9c579347b29,10/16(木) 16:22
2025-10-16,21:12,sports,スポーツ,24,日刊スポーツ,鈴木誠也の妻・畠山愛理さん、試合後のグラウンドで肩を寄せた夫婦ラブラブショットを公開,https://news.yahoo.co.jp/articles/cb63e299fec0b5d9feb659f9b6982010a189d57d,10/16(木) 16:03
2025-10-16,21:12,sports,スポーツ,25,中日スポーツ,前田健太、実況アナからの”むちゃ振り”対応がSNSで話題「メジャーでの評価ばっかり聞くのやめろって」解説には「話上手くて解説大好き」と好評,https://news.yahoo.co.jp/articles/7a867b9351035e2fefae631769173aa20b136151,10/16(木) 20:06
2025-10-16,21:12,sports,スポーツ,26,スポニチアネックス,甲子園の雨中断に両軍ファン、ザワザワ…　「泥んこ筒香！？」「そら、よぎるよ」　17年に伝説の泥中決戦,https://news.yahoo.co.jp/articles/8df1e01d2fc3d53f73183390f4df2f7345872d1e,10/16(木) 20:07
2025-10-16,21:12,sports,スポーツ,27,CoCoKARAnext,「なぜMLBで1球も投げてないのに大金を払う？」――大舞台で山本由伸が証明した“495億円の価値”　呼び覚ました2年前の懐疑論,https://news.yahoo.co.jp/articles/5417793f4e3dc2a56b46a443a96a8bea9bc59709,10/16(木) 11:02
2025-10-16,21:12,sports,スポーツ,28,高校野球ドットコム,智弁和歌山、履正社などに続き、北海、仙台育英など全国名門校が相次いで敗戦…センバツ出場は絶望的【25年秋高校野球】,https://news.yahoo.co.jp/articles/cfd3ee8cad0ea0cf10150cdd3b17c25c097ff620,10/16(木) 18:50
2025-10-16,21:12,sports,スポーツ,29,デイリースポーツ,阪神・才木　牧に勝ち越しソロ被弾、５回３失点でリード守れず降板,https://news.yahoo.co.jp/articles/1011b20c738d11a46ccbaaf46c1ad55f22e7243a,10/16(木) 20:37
2025-10-16,21:12,sports,スポーツ,30,デイリースポーツ,「行動力ハンパない」人気アイドルが福岡入り報告　強烈なシャツ姿で「まいにちいっぱい応援するから」に「やはり現地でしたか」「可愛すぎる♥」,https://news.yahoo.co.jp/articles/ae334fb932c1c46a92b5c251b1078f097c4b433e,10/16(木) 16:41
2025-10-16,21:12,sports,スポーツ,31,日刊スポーツ,【阪神】突然の大雨で試合中断…このままノーゲームならＣＳファイナル残り日程どうなる？,https://news.yahoo.co.jp/articles/5d0ca335143057285d1652d5f7292636821c5fb5,10/16(木) 19:51
2025-10-16,21:12,sports,スポーツ,32,日刊スポーツ,大相撲ロンドン公演　阿炎と若元春が大英博物館で…「修学旅行で必ずやる男子がいるヤツ」の声,https://news.yahoo.co.jp/articles/e5baf58fccbc5a5dbf53e10bc4a14c78c8668c44,10/16(木) 15:24
2025-10-16,21:12,sports,スポーツ,33,読売新聞オンライン,阿炎「俺が行かなきゃダメでしょ」、アビイ・ロード横断歩道で記念撮影…力士らロンドン観光,https://news.yahoo.co.jp/articles/c9c320179143ebaab5060d5d7a825b49eb035e21,10/16(木) 20:16
2025-10-16,21:12,sports,スポーツ,34,デイリースポーツ,日本ハム呆然　八回に２番手上原がソフトＢ・柳田に痛恨３ラン被弾　負ければ崖っぷち,https://news.yahoo.co.jp/articles/998e4cdbe04500764ceb3626c860ff82d4743eec,10/16(木) 20:54
2025-10-16,21:12,sports,スポーツ,35,日刊スポーツ,Ｍ・デムーロ騎手が12月まで渡米延長へ「日本のG1も乗せてもらえるなら…」,https://news.yahoo.co.jp/articles/3c7e1be966f03c545aeaa95751c0a58ae156cf0c,10/16(木) 17:00
2025-10-16,21:12,sports,スポーツ,36,Full-Count,山本由伸で成し遂げたド軍の“史上最長”　記録ラッシュ…完投がもたらした偉業,https://news.yahoo.co.jp/articles/46ca1843a58c6535b9fb09f04f1aa17b08bb97bc,10/16(木) 19:46
2025-10-16,21:12,sports,スポーツ,37,Full-Count,消えた山本由伸の名前「入ってない??」　届かなかった“+3”…選外に日本ファン疑問,https://news.yahoo.co.jp/articles/e06de96be61cfaf86608abbce954fab30045e3e7,10/16(木) 20:52
2025-10-16,21:12,sports,スポーツ,38,デイリースポーツ,先制点遠い日本ハム…四回、六回とも絶好機も郡司、石井に一本が出ず　ハム党ため息　郡司は七回守備から交代,https://news.yahoo.co.jp/articles/30f3b79e335f32bd7d19334c6e2f769ba0c9cc31,10/16(木) 19:57
2025-10-16,21:12,sports,スポーツ,39,ベースボールキング,掛布氏、阪神・前川の途中交代に疑問「6番はある意味第2の4番」、「前川の6番はなんだったんだって」,https://news.yahoo.co.jp/articles/9fc797ed6120a0c61046dcf047e0ecd8aa7b5979,10/16(木) 20:51
2025-10-16,21:12,sports,スポーツ,40,Full-Count,山本由伸に「奇襲をかけられなかった」　球界OB絶賛の「14」…MLB最強軍団を封じた“修正力”,https://news.yahoo.co.jp/articles/80a7ea90e5c3e55c1b5504447caaf9d879178ef0,10/16(木) 18:36
