scrp_date,scrp_time,genre_en,genre_jp,rank,media_jp,title,link,date_original
2024-08-05,22:08,TTL,総合,1,ENCOUNT,フワちゃん、やす子への「暴言」を再度謝罪「心から後悔しています」　6日のラジオは休止,https://news.yahoo.co.jp/articles/32b434b6e1958df1d8b1accd52cb1896cb4ef622,8/5(月) 19:22
2024-08-05,22:08,TTL,総合,2,日刊スポーツ,「フワちゃん出るから見ない」有吉弘行「有吉の夏休み2024」番組告知投稿に波紋,https://news.yahoo.co.jp/articles/a545149f572af0b5f3e0938b5ae7c0584577bf22,8/5(月) 19:32
2024-08-05,22:08,TTL,総合,3,スポニチアネックス,森永卓郎氏　株価暴落どうすればいい？「下がったから買うのは絶対にダメ。もっと最悪なのは…」,https://news.yahoo.co.jp/articles/b2af69692269cbbc246c0078f5497237bfc7518d,8/5(月) 16:14
2024-08-05,22:08,TTL,総合,4,オリコン,『フワちゃんANN0』放送休止「不適切な投稿が確認できたため」　本人も反省つづる「心から後悔しています」,https://news.yahoo.co.jp/articles/465fe54220706836efcc2f13a23b4f6344bad95d,8/5(月) 19:03
2024-08-05,22:08,TTL,総合,5,東スポWEB,粗品が動画で早速「やす子オリンピック」に言及　「おまえは偉くないので予選敗退でーす」と言い放つ,https://news.yahoo.co.jp/articles/4e18d3d6cc02101074af4e8e279d2479e586a770,8/5(月) 16:51
2024-08-05,22:08,TTL,総合,6,スポニチアネックス,【男子バレー】日本、世界2位イタリアから2セット連取！石川祐希サーブから逆転呼んだ,https://news.yahoo.co.jp/articles/1147b14bc849fcc6bfc3743ec2e511e54e156bd5,8/5(月) 20:59
2024-08-05,22:08,TTL,総合,7,ENCOUNT,生放送で“小道具”倒れる　元消防士芸人が身を投げ出しスタッフ保護　視聴者称賛「こりゃ惚れる」,https://news.yahoo.co.jp/articles/9f9058959f34bb2298d3f69d1ede3fe7673934d1,8/5(月) 15:43
2024-08-05,22:08,TTL,総合,8,日刊スポーツ,【柔道】負けた腹いせか　股間蹴り潰す行為の選手に重い処分　最終処分まで国際大会に出場不可,https://news.yahoo.co.jp/articles/da323ca49180166573189ba7d8e1ad53a58e25b5,8/5(月) 12:23
2024-08-05,22:08,TTL,総合,9,テレ東スポーツ,団体・個人総合二冠の岡慎之助が鉄棒でも金メダル！初の五輪で金3つ、銅1つ『4つ』のメダルを獲得！【パリ五輪 体操】,https://news.yahoo.co.jp/articles/c31b2ed0d3117f3851b65af7a44f7a6a32582a20,8/5(月) 21:23
2024-08-05,22:08,TTL,総合,10,スポニチアネックス,3冠だ！岡慎之助　鉄棒で金メダル締め「奇跡ですね」日本人52年ぶり快挙　帰国後は「ドライブしたい」,https://news.yahoo.co.jp/articles/555a73753406901f3a2e7034c2b74c147d0d45fe,8/5(月) 21:23
2024-08-05,22:08,TTL,総合,11,スポーツ報知,バレー男子準々決勝　日本は第２セットも奪う　逆転で２５―２３　２セット連取！…パリ五輪,https://news.yahoo.co.jp/articles/7133405660219e00bfff423312fe724b3eea466a,8/5(月) 20:57
2024-08-05,22:08,TTL,総合,12,日刊スポーツ,ほんこん、フワちゃんの“取り巻き”に苦言「器のデカいところを見せようとしてるバカな芸能人」,https://news.yahoo.co.jp/articles/cb05acd606bed3c934ba8feb58cc62cf76071710,8/5(月) 12:14
2024-08-05,22:08,TTL,総合,13,まいどなニュース,「許せねえ」「仲間じゃねえのかよ」マミィ酒井が怒り、フワちゃん不適切投稿に反応か…その後投稿は削除,https://news.yahoo.co.jp/articles/2c0873ad4a5caf8d4066f54a18575baa29931f1a,8/5(月) 7:48
2024-08-05,22:08,TTL,総合,14,ファイナンシャルフィールド,課長から部長に昇格した夫。「給料は3万しか増えなかった」というのですが、一般的なのでしょうか？,https://news.yahoo.co.jp/articles/960492f3171738feaa234e2f18de876d329fde0f,8/5(月) 19:20
2024-08-05,22:08,TTL,総合,15,デイリースポーツ,えっ男子バレー決勝Ｔなのに？！川合俊一会長帰国「パスなかった」　ネット「どういうこと？」「なんで帰ってきたｗ」,https://news.yahoo.co.jp/articles/fd5263bfbf1f4b5d0926d1dcb90086b1155f5521,8/5(月) 18:44
2024-08-05,22:08,TTL,総合,16,Hint-Pot,「ヤバイ、うちこれだ」　エアコンの室外機が取りつけ直しになった理由　プロの呼びかけに驚きの声,https://news.yahoo.co.jp/articles/606c15993b941e6e5ec1319c1919cd8ddad4e6b8,8/5(月) 8:40
2024-08-05,22:08,TTL,総合,17,クランクイン！,脳出血で療養中の清原翔、“4年ぶりの顔出し”から約2か月半　“明るい笑顔”の近影に反響,https://news.yahoo.co.jp/articles/c13ae428c0483661cb9b1d5485a1717f913aecdc,8/5(月) 18:10
2024-08-05,22:08,TTL,総合,18,中日スポーツ,スポーツクライミング・安楽宙斗と楢崎智亜、準決勝のボルダーで１、２位独占【パリオリンピック】,https://news.yahoo.co.jp/articles/1da24cebb15d2f4a5d3362f4651268a6005689f5,8/5(月) 19:56
2024-08-05,22:08,TTL,総合,19,スポーツ報知,バレーボール男子、２セット連取　ベンチに藤井直伸さんの写真でネット号泣「これだけでもダバダバ泣いてる」…パリ五輪,https://news.yahoo.co.jp/articles/4fadfa9975f50a2cb40a9c08a5d8640de40cdee6,8/5(月) 21:11
2024-08-05,22:08,TTL,総合,20,スポニチアネックス,阿部一二三が敗れた技は「タックルじゃない」　柔道メダリストが解説「この技、凄くはやりなんです」,https://news.yahoo.co.jp/articles/6d1a991dfff48cef78cc77f27afd83f8eca82b01,8/5(月) 17:38
2024-08-05,22:08,TTL,総合,21,スポニチアネックス,小泉進次郎議員　長女が高熱で病院へ　薬局でまさかの事態…日本が抱える問題を憂慮「政治課題を痛感した」,https://news.yahoo.co.jp/articles/b8cf549d8bf78d166f7af50dc732dbc1cc2e64c5,8/5(月) 11:29
2024-08-05,22:08,TTL,総合,22,オトナライフ,「090」「080」ではなく「0800」から電話がかかって来たら無視するのが無難？,https://news.yahoo.co.jp/articles/6432b8d0bc04f911f883323e9b9da4fb5963f42d,8/3(土) 14:30
2024-08-05,22:08,TTL,総合,23,J-CASTニュース,「顔こんなだったのわら」フワちゃん、不適切発言で蒸し返される3年前の「やす子イジリ」　「こんな前から言ってたんや」,https://news.yahoo.co.jp/articles/2c915aef00e288991fac441bd07f5a03b563ed8f,8/5(月) 19:14
2024-08-05,22:08,TTL,総合,24,日刊スポーツ,粗品、フワちゃん謝罪した「やす子オリンピック」に言及し一言”絶叫”,https://news.yahoo.co.jp/articles/08d6f8027859a36e4b24010ba1c86407bafacd66,8/5(月) 9:56
2024-08-05,22:08,TTL,総合,25,デイリースポーツ,バスケ男子のホーバス監督　続投への意欲は「やりたい気持ちはすごくある」も「ちょっとゆっくりして、いろいろ考えて」,https://news.yahoo.co.jp/articles/e1f4193e5b0bcb6701546333a03b9256b29b3139,8/5(月) 21:13
2024-08-05,22:08,TTL,総合,26,スポニチアネックス,前澤友作氏　株価暴落に「初心者が今手を出すのは正直危険かもしれません」と指摘,https://news.yahoo.co.jp/articles/f93a369433e61e6515583d65f7815575d406bc43,8/5(月) 19:33
2024-08-05,22:08,TTL,総合,27,スポニチアネックス,【男子バレー】日本が第3セット落としセットカウント2―1　マッチポイント握るも…イタリア意地見せた,https://news.yahoo.co.jp/articles/ddde568ba8d5292a0637e77c2fada9ac5c3277d0,8/5(月) 21:39
2024-08-05,22:08,TTL,総合,28,西スポWEB OTTO！,エースの早田ひな、左手首痛抱えながらも献身プレーで勝利に貢献　16歳張本美和はストレート五輪デビュー、平野美宇も圧勝　卓球女子団体【パリ五輪】,https://news.yahoo.co.jp/articles/0b0d511da11b23b73bd2a20583fc173c7b930c29,8/5(月) 18:30
2024-08-05,22:08,TTL,総合,29,乗りものニュース,戦艦「大和」よりスゴかった？ 史上最多の被弾で沈んだ“日本最後の戦艦”とは,https://news.yahoo.co.jp/articles/9c0847f56ab6ba410f29b0ca832697871acd1688,8/5(月) 16:12
2024-08-05,22:08,TTL,総合,30,デイリースポーツ,卓球女子団体　日本が３－０快勝で８強入り　１６歳張本美和が圧巻五輪デビュー　左腕満身創痍の早田はダブルスのみ出場、負担最小限で準々決勝へ,https://news.yahoo.co.jp/articles/8fe9f552775effdf0992e8976e7a8392b567bff1,8/5(月) 18:31
2024-08-05,22:08,TTL,総合,31,J-CASTニュース,「痩せすぎ」「老け見え」　工藤静香、エクササイズ動画に寄せられた心無いコメントに「容姿攻撃はやめて...」,https://news.yahoo.co.jp/articles/3d692f00fbdc773e2af387536b8623c485393857,8/5(月) 16:57
2024-08-05,22:08,TTL,総合,32,スポーツ報知,バレー男子、第３セットは接戦も２５―２７と落とす　セットカウントは２―１に…パリ五輪,https://news.yahoo.co.jp/articles/1f337e26034e4f16350985bd013c686219058eaa,8/5(月) 21:45
2024-08-05,22:08,TTL,総合,33,デイリースポーツ,粗品、早くも動画で「お前は偉くないので、予選敗退でーす！」　ネット仰天「鮮度がすごい」,https://news.yahoo.co.jp/articles/0f907c31b1dbf9858ab6efcd02dd6e0aff8ada56,8/5(月) 12:51
2024-08-05,22:08,TTL,総合,34,東スポWEB,【卓球】陳夢に「中指」「地獄へ落ちろ」の罵詈雑言で中国ＳＮＳアカウント大量永久凍結処分,https://news.yahoo.co.jp/articles/dada983b559f1b9ef2a1ef5128b0870139fa9d62,8/5(月) 16:41
2024-08-05,22:08,TTL,総合,35,ファイナンシャルフィールド,最近ニュースで「1世帯あたり10万円」「子ども1人あたり5万円」の給付があると聞きました。子どもが2人いる「年収400万円」の会社員ですが、私も対象になるのでしょうか？,https://news.yahoo.co.jp/articles/ead7b73a514ae7254bbe37269004819f2c37a8ae,8/3(土) 11:20
2024-08-05,22:08,TTL,総合,36,CoCoKARAnext,性別騒動の台湾女子ボクサーに敗れた相手の“侮辱ジェスチャー”が波紋 敵コーチは「ここにいるべきじゃない」と異論【パリ五輪】,https://news.yahoo.co.jp/articles/7ae466e2543a36bbfa39712d897ed8a5fa58de29,8/5(月) 16:30
2024-08-05,22:08,TTL,総合,37,日テレNEWS NNN,シダマツペアが表彰式後にまさかのハプニング　一瞬の隙に銅メダル奪われる「わちゃわちゃしていた」舞台裏語る,https://news.yahoo.co.jp/articles/b9f7eb377c895d56726a1aa33e73056d62462c18,8/5(月) 11:31
2024-08-05,22:08,TTL,総合,38,デイリースポーツ,【男子バレー】西田有志の妻、古賀紗理那　日の丸振って応援　左手薬指に結婚指輪　代表メンバーと,https://news.yahoo.co.jp/articles/23a6c35f04fc9003af67c8f88223a3fee0530aa5,8/5(月) 21:00
2024-08-05,22:08,TTL,総合,39,日テレNEWS NNN,【クライミング】安楽宙斗が唯一の2課題連続完投で他を圧倒　楢﨑智亜も意地の完登で日本が1・2フィニッシュ,https://news.yahoo.co.jp/articles/6794d35b0b60e436061a6f912b0d277b9c864257,8/5(月) 19:18
2024-08-05,22:08,TTL,総合,40,RKB毎日放送,4歳児が新幹線ホームと列車の間から線路に転落→母親が非常ボタンを押す→新幹線出発せず駅員が救助　男児は頭に軽傷,https://news.yahoo.co.jp/articles/0ba9db60e9bd46430e41a9ccf0bd92361f82ae6d,8/5(月) 15:21
