scrp_date,scrp_time,genre_en,genre_jp,rank,media_jp,title,link,date_original
2024-08-05,10:33,TTL,総合,1,まいどなニュース,「許せねえ」「仲間じゃねえのかよ」マミィ酒井が怒り、フワちゃん不適切投稿に反応か…その後投稿は削除,https://news.yahoo.co.jp/articles/2c0873ad4a5caf8d4066f54a18575baa29931f1a,8/5(月) 7:48
2024-08-05,10:33,TTL,総合,2,RONSPO,東京銀がなぜ全敗？「渡嘉敷を外したことが敗因ではない」…パリ五輪女子バスケットで日本がベルギーに完敗し予選リーグ敗退,https://news.yahoo.co.jp/articles/c72b9952b1fb5dcf691832a03b8e89e32d958032,8/5(月) 6:00
2024-08-05,10:33,TTL,総合,3,東スポWEB,フワちゃん謝罪　直前にやす子〝とっても悲しい〟で波紋…スクショ出回りトレンド入り「これマジ？」,https://news.yahoo.co.jp/articles/79a9887deff38dd06e6153a3a2bc568608bb820c,8/5(月) 1:11
2024-08-05,10:33,TTL,総合,4,CoCoKARAnext,女子卓球で衝撃事態！ 金メダルの陳夢に中国ファンが中指を立てる蛮行 国内メディアも嘆き「本当に恥ずかしい」【パリ五輪】,https://news.yahoo.co.jp/articles/89e2bb6f7d68e845efd2cef9ebc9d63aaff78648,8/5(月) 5:10
2024-08-05,10:33,TTL,総合,5,中日スポーツ,フワちゃん、「言っちゃいけないこと言って傷つけた」と謝罪　やす子の「とっても悲しい」投稿でSNSでは波紋広がる,https://news.yahoo.co.jp/articles/9853bb457169a2773e95391e828349bb005157b5,8/5(月) 0:05
2024-08-05,10:33,TTL,総合,6,スポーツ報知,池江璃花子が女子４００Ｍメドレーリレー決勝後に医務室へ　村松監督が明かす「調べてもらっている状況」…パリ五輪,https://news.yahoo.co.jp/articles/dd0f8102266d4ccda9f110f41350bbcab4e68649,8/5(月) 4:16
2024-08-05,10:33,TTL,総合,7,西スポWEB OTTO！,人気急上昇中20歳「卓球天使」が代表ユニ姿披露「透明感ハンパない」「モデルとか女優にしか見えんのよな」,https://news.yahoo.co.jp/articles/288cb7360f55557651d75438116d6d25ef8f7be6,8/4(日) 22:40
2024-08-05,10:33,TTL,総合,8,スポニチアネックス,医務室に搬送された池江の容体を医師が説明「既往症とは直接関係するものではない」,https://news.yahoo.co.jp/articles/522b600249ce84d5d8c1f97ab0fbd4f7524e7d82,8/5(月) 6:41
2024-08-05,10:33,TTL,総合,9,東スポWEB,【柔道】騒動続出で熱戦も台なし　小川直也氏は柔道界に提言「ルールブック見ろよ、の姿勢じゃなく…」,https://news.yahoo.co.jp/articles/cc788e84fe7f84152070bc63f726bd108a353455,8/5(月) 5:16
2024-08-05,10:33,TTL,総合,10,東スポWEB,【競泳】メダル銀１つの惨状  〝北島康介の成功例〟に甘える日本水連に「上層部が変わらないと」の声,https://news.yahoo.co.jp/articles/d316a410b71a23142f647c9899bb405025776115,8/5(月) 6:16
2024-08-05,10:33,TTL,総合,11,CoCoKARAnext,「間違いなく最悪」4度の五輪経験の伊競泳選手が怒りの主張！ 選手村の環境に苦言「暑さで2時前まで眠れない」【パリ五輪】,https://news.yahoo.co.jp/articles/ae5bc84fd6e43eda5cd5b72c8b08b7a159e10793,8/5(月) 7:01
2024-08-05,10:33,TTL,総合,12,スポニチアネックス,「美人」話題のバド五輪選手、まさかの私物にネット騒然「これはエグイ」知る人ぞ知る激レア品…本人も反応,https://news.yahoo.co.jp/articles/dcbad3910cc18927d6c04778bdcd57226725dbc6,8/5(月) 9:42
2024-08-05,10:33,TTL,総合,13,ENCOUNT,フワちゃん、謝罪文…やす子「とっても悲しい」20分後に　ネット上では「笑えない」「謝ったのは評価」の声,https://news.yahoo.co.jp/articles/baf8f445dd0bdbb9d15bf27bbdd1605076462b72,8/5(月) 8:09
2024-08-05,10:33,TTL,総合,14,スポニチアネックス,石川佳純さん　早田ひなの異変察知も、あえて質問しなかったワケ　「配慮すごい」「気遣いに感動」の声,https://news.yahoo.co.jp/articles/934b955111ba2b70670a25d8ff589b48b2b3554c,8/5(月) 0:01
2024-08-05,10:33,TTL,総合,15,RONSPO,「私は女性だけと戦いたい」パリ五輪メダル確定の“性別騒動”ボクサー台湾のリンに負けたブルガリア選手が「X」染色体を手で示す問題行動起こす…コーチが抗議メモ,https://news.yahoo.co.jp/articles/8e3437d3befc5953a416a7a3375bec391b4b0e5a,8/5(月) 6:30
2024-08-05,10:33,TTL,総合,16,TBS NEWS DIG Powered by JNN,世界最速は米ライルズ、自己新9秒79で金 ! 2位と0.005秒差の激戦、サニブラウンは自己新も準決勝で敗退【パリ五輪・男子100m】,https://news.yahoo.co.jp/articles/b8a4ad665e9a383da90733705a4a0d7209242133,8/5(月) 6:17
2024-08-05,10:33,TTL,総合,17,CoCoKARAnext,バド・志田千陽の人気が中国でも爆発！「真珠のような美貌」と現地メディアが褒めちぎり　ファンも熱狂「あなたの笑顔に癒された」【パリ五輪】,https://news.yahoo.co.jp/articles/9e4a3a0f619d5cc7ac9493b7c3f0efd26009a212,8/5(月) 7:50
2024-08-05,10:33,TTL,総合,18,RONSPO,「少しは食事を美味しくできないのか？」「ここじゃあパフォは上がらない」悪評だらけの選手村に金メダリスト達が苦言…部屋の暑さに耐えきれず公園で昼寝する選手も,https://news.yahoo.co.jp/articles/0f04c4ada48ca9cd093c3436070127b652c7cf5e,8/5(月) 6:10
2024-08-05,10:33,TTL,総合,19,オトナライフ,「090」「080」ではなく「0800」から電話がかかって来たら無視するのが無難？,https://news.yahoo.co.jp/articles/6432b8d0bc04f911f883323e9b9da4fb5963f42d,8/3(土) 14:30
2024-08-05,10:33,TTL,総合,20,産経新聞,セーヌ川で泳いだベルギー女子選手が入院、大腸菌感染症か　同国はトライアスロン混合棄権,https://news.yahoo.co.jp/articles/7499c54cf9e7471a1ea9ee15c00f81e091f71acc,8/5(月) 8:25
2024-08-05,10:33,TTL,総合,21,ENCOUNT,パリ五輪メダリストのSNSに突然の異変　まさかの理由が話題「世界一レア」「お金では買えない」,https://news.yahoo.co.jp/articles/25fbcf5228e30af08d59e60aa62c9e3002cb89ba,8/5(月) 9:34
2024-08-05,10:33,TTL,総合,22,読売新聞オンライン,学童保育の登録条件を来年度にも厳格化…６割で利用実態乏しく、待機児童の解消図る,https://news.yahoo.co.jp/articles/3d168b2b5ea2c4768b185799ff8811c84fc00cc8,8/5(月) 5:01
2024-08-05,10:33,TTL,総合,23,Yahoo!ニュース オリジナル 特集,コーヒー1杯に出せるのは「500円」 カフェ倒産が過去最多、本当の要因は？ #くらしと経済,https://news.yahoo.co.jp/articles/9dea6c7633dc9117b1843a75d00e22aff72219d6,8/4(日) 17:52
2024-08-05,10:33,TTL,総合,24,Bloomberg,日銀利上げで急落した日本株、長期的見通しへの投資家の期待変わらず,https://news.yahoo.co.jp/articles/6af6c1d93044b63e6bcd6ef650f34e9b8fca4646,8/4(日) 10:06
2024-08-05,10:33,TTL,総合,25,東スポWEB,NHKのパリ五輪「このあと」演出…加藤浩次の苦言に賛同者続出　TBSは18年前にクレーム殺到,https://news.yahoo.co.jp/articles/1627ad9292c1243a75726d6fd9ffa10412d4de07,8/5(月) 5:16
2024-08-05,10:33,TTL,総合,26,スポニチアネックス,「最も美しい五輪選手」の登場に日本のネット騒然「エグいくらい奇麗」「超絶モデル風美女がいてびっくり」,https://news.yahoo.co.jp/articles/733fc68b53d86a850989c5487bf21913e7fb3f66,8/4(日) 15:32
2024-08-05,10:33,TTL,総合,27,スポニチアネックス,斉藤立が爆笑会見　激闘後にリネールと交わした言葉明かす？「ノーノーノーと…自分英語しゃべれないんで」,https://news.yahoo.co.jp/articles/64fea64371fdf76e9858ea7926fcd89f3846f3b5,8/4(日) 18:53
2024-08-05,10:33,TTL,総合,28,Hint-Pot,「ヤバイ、うちこれだ」　エアコンの室外機が取りつけ直しになった理由　プロの呼びかけに驚きの声,https://news.yahoo.co.jp/articles/606c15993b941e6e5ec1319c1919cd8ddad4e6b8,8/5(月) 8:40
2024-08-05,10:33,TTL,総合,29,ABEMA TIMES,判定をめぐり炎上… 大谷翔平がキレた！ 酷すぎる“不可解判定”　ネット上で物議を醸した“問題シーン”「誤審だろ」「そりゃキレる」,https://news.yahoo.co.jp/articles/4136337441fa4d06e407e0caa3abd3d1d60adffb,8/5(月) 6:02
2024-08-05,10:33,TTL,総合,30,日刊ゲンダイDIGITAL,中日・根尾昂に投打で「限界説」…一軍復帰登板の大炎上で突きつけられた厳しい現実,https://news.yahoo.co.jp/articles/6b2d3dae3152ecd4cc22f0b8a2ca323bb7a5b86a,8/5(月) 7:21
2024-08-05,10:33,TTL,総合,31,デイリースポーツ,フワちゃん「言っちゃいけないこと言って」謝罪投稿がコメント１・２万件の大波紋,https://news.yahoo.co.jp/articles/4b52fa16bf27b0a0d7ec4c9a820bc970108f0285,8/5(月) 9:22
2024-08-05,10:33,TTL,総合,32,スポニチアネックス,松山英樹が日本男子悲願のメダル獲得！　丸山茂樹監督は涙止まらず「こんなに泣くとは思わなかった」,https://news.yahoo.co.jp/articles/bc89f07475cabdac55eb675e773628a82d7a1c43,8/5(月) 1:16
2024-08-05,10:33,TTL,総合,33,ファイナンシャルフィールド,最近ニュースで「1世帯あたり10万円」「子ども1人あたり5万円」の給付があると聞きました。子どもが2人いる「年収400万円」の会社員ですが、私も対象になるのでしょうか？,https://news.yahoo.co.jp/articles/ead7b73a514ae7254bbe37269004819f2c37a8ae,8/3(土) 11:20
2024-08-05,10:33,TTL,総合,34,Hint-Pot,「思わず周りを見渡すことがある」　カナダ人が日本で衝撃を受けた母国ではあり得ない光景とは,https://news.yahoo.co.jp/articles/8dc89ac9a5cb42daa2ec728be21533b8339fb663,8/5(月) 6:10
2024-08-05,10:33,TTL,総合,35,東スポWEB,寺島しのぶ　フランス人の夫が五輪柔道混合団体決勝で〝困惑〟「これは、柔道じゃない…」,https://news.yahoo.co.jp/articles/adc5b574aa03ffc7ccd624490acc7754bc355789,8/4(日) 21:56
2024-08-05,10:33,TTL,総合,36,日刊スポーツ,粗品、フワちゃん謝罪した「やす子オリンピック」に言及し一言”絶叫”,https://news.yahoo.co.jp/articles/08d6f8027859a36e4b24010ba1c86407bafacd66,8/5(月) 9:56
2024-08-05,10:33,TTL,総合,37,中日スポーツ,メダリストにエッフェル塔のマーク、阿部一二三や堀米雄斗らは付かず　オリンピック公式「Xに大会期間中付くマークです」,https://news.yahoo.co.jp/articles/af48c0bcce3de645906329ebd8a8665e2f83d461,8/5(月) 8:52
2024-08-05,10:33,TTL,総合,38,みんかぶマガジン,「辻元清美と同じ手口やん」広瀬めぐみ議員の家宅捜索に地元自民党員「エッフェル塔、ベンツ不倫は個人の勝手でも、さすがにこれは…」と唖然,https://news.yahoo.co.jp/articles/85562fde5b4b595ff8a566f90de6381361f55413,8/5(月) 9:10
2024-08-05,10:33,TTL,総合,39,RONSPO,「起用しないならなぜ呼んだ？」パリ五輪男子バスケ日本代表は八村塁がいればブラジルに勝てたのか…“代役”筆頭候補の富永啓生の出番が少なかったのも誤算？！,https://news.yahoo.co.jp/articles/2868934eede65acc16fe23566b21c6a957cb4226,8/3(土) 6:47
2024-08-05,10:33,TTL,総合,40,スポニチアネックス,フリーマン三男が退院「神様、この奇跡をありがとう」看病で離脱していたフリーマンは次カードから合流へ,https://news.yahoo.co.jp/articles/3df4b926766ece6aa372f5efc1472597de2dfec7,8/5(月) 6:14
