scrp_date,scrp_time,genre_en,genre_jp,rank,media_jp,title,link,date_original
2025-02-24,17:09,world,国際,1,FNNプライムオンライン,「腕が!腕が!」「落ちそう!」スキーリフトで子どもが宙づりに…母親支えるも数m下の茂みへ落下　安全バーが不完全だったか　中国,https://news.yahoo.co.jp/articles/acc30fddc697fc00c15ea13c58df3e7dcda1a788,2/24(月) 10:02
2025-02-24,17:09,world,国際,2,BBC News,マスク氏、米政府職員に「先週したこと五つ」メールするよう指示　一部省庁は「従うな」と,https://news.yahoo.co.jp/articles/a62e972aed8b0cbd3c642d7017cf308f12e64a34,2/24(月) 14:32
2025-02-24,17:09,world,国際,3,中央日報日本語版,中国・武漢で新種のコウモリコロナウイルス衝撃…「ヒトに感染可能」,https://news.yahoo.co.jp/articles/843d979b5aeea1e35685600e00784f9af5f72931,2/23(日) 9:25
2025-02-24,17:09,world,国際,4,中央日報日本語版,マスク氏、米連邦公務員２３０万人に「成果を報告しろ」…情報機関トップが反発,https://news.yahoo.co.jp/articles/939cb68a51c6a1ae0ed9283886779cb1ba9be724,2/24(月) 16:19
2025-02-24,17:09,world,国際,5,産経新聞,ヒト、モノ、カネを総動員　露・ウクライナの死傷者100万人突破か　侵略3年,https://news.yahoo.co.jp/articles/a0509dfdbd68de8a69016dc2d535ff5aadcb4918,2/24(月) 9:39
2025-02-24,17:09,world,国際,6,毎日新聞,ミサイル攻撃で人口の5分の1失った村　遺族夫婦に託された「運命」,https://news.yahoo.co.jp/articles/643242fbdcec3711963b930d083c955c3af01ed0,2/24(月) 5:00
2025-02-24,17:09,world,国際,7,朝鮮日報日本語版,スティーブ・バノン氏「中国共産党の介入で我々の同盟国・韓国が危機的状況」　トランプ大統領が出席した米最大の保守派集会で韓国への言及相次ぐ,https://news.yahoo.co.jp/articles/ee7ed7e592b0acaa1ee12215c73337bf29e7d837,2/24(月) 11:45
2025-02-24,17:09,world,国際,8,中央日報日本語版,ウクライナがレアアースを差し出さなければスターリンクを断つ？　「米国が結局敗者なるだろう」,https://news.yahoo.co.jp/articles/1c255b2bf30da1da548625bf893896d0cff5e65d,2/24(月) 8:57
2025-02-24,17:09,world,国際,9,読売新聞オンライン,トランプ氏がウクライナ停戦に前のめり、英仏首脳が訪米し直接クギ刺す思惑か…マクロン氏「プーチン氏に弱腰ではいけない」,https://news.yahoo.co.jp/articles/39ffcbe3bf3a7f82e466bb1de67886b3a9c2fdb8,2/24(月) 13:51
2025-02-24,17:09,world,国際,10,中央日報日本語版,１年以上姿が見えない李雪主氏　「妊娠・出産でない」…娘ジュエ宣伝効果の最大化か,https://news.yahoo.co.jp/articles/e07eb3dbcd9b70da41ba4bca2ffeebd838328886,2/24(月) 15:06
2025-02-24,17:09,world,国際,11,テレビ朝日系（ANN）,ウクライナ戦争「4月20日に停戦」報道,https://news.yahoo.co.jp/articles/bf0c382fc6f04e77b4e3281d6f6f60533405ee16,2/17(月) 20:33
2025-02-24,17:09,world,国際,12,FNNプライムオンライン,【驚き】まるで“氷河期”路上の車はカチカチ氷漬け「映画みたいに水がどんどん」真冬のアメリカで約100年前の水道管破裂し水浸し,https://news.yahoo.co.jp/articles/5a55cbc3fba5aa325a0d15fa259eec7b36ee4f49,2/24(月) 7:13
2025-02-24,17:09,world,国際,13,TBS NEWS DIG Powered by JNN,ウクライナ侵攻から3年　中国がロシア経済支える構図鮮明に　2024年　中国とロシアの貿易総額が過去最高を記録,https://news.yahoo.co.jp/articles/9becdac2da9a7c857add5d29799c9073802850d4,2/24(月) 14:42
2025-02-24,17:09,world,国際,14,共同通信,USAIDの職員1600人削減　米政権、大半に休暇指示も,https://news.yahoo.co.jp/articles/349d51ebbfc009274534fd291b73e74788959621,2/24(月) 9:29
2025-02-24,17:09,world,国際,15,中央日報日本語版,ブーメランになる「トランプ関税」…インフレ懸念でニューヨーク証券市場急落,https://news.yahoo.co.jp/articles/376f1da30ce9cfa4e6a52de75d5b6f9eb77fe7a5,2/24(月) 8:36
2025-02-24,17:09,world,国際,16,中央日報日本語版,メラニア夫人、１カ月ぶりにホワイトハウスに登場…夫婦揃って「タキシードファッション」,https://news.yahoo.co.jp/articles/5724565d95fe88872fe9d26aca753fd2536c7f62,2/24(月) 14:23
2025-02-24,17:09,world,国際,17,朝鮮日報日本語版,ドタキャンするも抗議されたので30分だけ…韓国経済使節団と面会した米商務長官「各企業10億ドルずつ出せ」,https://news.yahoo.co.jp/articles/a5cc4c26d1d1f1c13c53c5ed3abb2e3f0d63bb37,2/24(月) 11:25
2025-02-24,17:09,world,国際,18,KOREA WAVE,ベトナム空港で入国拒否＆高額罰金…現地を怒らせた韓国人旅行者の“無神経行為”,https://news.yahoo.co.jp/articles/15df1c48b06fc0b90c4b91653fe387145bc5cef7,2/24(月) 7:03
2025-02-24,17:09,world,国際,19,CNN.co.jp,トランプ政権、解雇した核兵器関連人員の呼び戻しに奔走,https://news.yahoo.co.jp/articles/45a34b91be370f51cfec6118d2eaa71ed60fe2ea,2/18(火) 15:15
2025-02-24,17:09,world,国際,20,毎日新聞,中国外相、欧州の「小さな巨人」に熱視線　人口500万人のIT強国,https://news.yahoo.co.jp/articles/5527623f1a1be9660bc1fdc47bf212261a0fb1a9,2/18(火) 18:03
2025-02-24,17:09,world,国際,21,中央日報日本語版,「マスク氏、１３人目の子どもを産んだ後、連絡を切った」…２０代女性、親子関係不存在確認訴訟へ,https://news.yahoo.co.jp/articles/1ffa95c2041a8e26ad1a8fdea143f36049a7c885,2/24(月) 8:56
2025-02-24,17:09,world,国際,22,産経新聞,ウクライナ、難航する兵員確保　「抗戦の意義は理解する。でも自分の入隊は…」　　平和は来るのか　ウクライナ侵略3年（2）,https://news.yahoo.co.jp/articles/9aef9088d5e742d42cf2f70d96ec1fd194efd85b,2/24(月) 15:58
2025-02-24,17:09,world,国際,23,共同通信,「平和実現なら辞任用意」　侵攻3年、ゼレンスキー氏会見,https://news.yahoo.co.jp/articles/5bb0a8f5251aa305d3f3024377974440d7f00edd,2/24(月) 0:10
2025-02-24,17:09,world,国際,24,CNN.co.jp,中国アニメ映画「ナタ２」大ヒット、国内興行記録を塗り替え　欧米市場へ進出,https://news.yahoo.co.jp/articles/20b2d4509f197ae54e4b898dba9ec0707e78fb4b,2/24(月) 13:30
2025-02-24,17:09,world,国際,25,ロイター,マスク氏、政府職員に成果報告要請　複数機関が返信拒否を指示,https://news.yahoo.co.jp/articles/9b7d6174b57fa1156399ae7191c1bba60d0ea1d2,2/24(月) 16:05
2025-02-24,17:09,world,国際,26,中央日報日本語版,メモリー半導体まで…中国が基礎能力追い越し、ＮＡＮＤも日本があごの下まで追撃＝韓国,https://news.yahoo.co.jp/articles/e73e305797655b46a2d0eb5c8b9a5a520e8678d0,2/24(月) 6:41
2025-02-24,17:09,world,国際,27,中央日報日本語版,軍靴を履いて韓国元大統領のまね…中国人男性、光州の至るところで迷惑行為,https://news.yahoo.co.jp/articles/5f1d2cb73505b7855f03a3b3f8d54fcf1974b623,2/24(月) 14:53
2025-02-24,17:09,world,国際,28,中央日報日本語版,【社説】半導体技術で中国に逆転されても足を引っ張る韓国政界,https://news.yahoo.co.jp/articles/40f6899cefb4a0b90f67d9168fa6bb60fd7ec442,2/24(月) 16:20
2025-02-24,17:09,world,国際,29,CNN.co.jp,トランプ政権、米軍制服組トップと海軍作戦部長を解任　前例のない軍幹部の更迭,https://news.yahoo.co.jp/articles/28fe5ca0b74d9506e5d35a223b89be6affe75c7c,2/22(土) 10:50
2025-02-24,17:09,world,国際,30,共同通信,ドイツ極右歓喜「より強力に」　広がる不安、抗議デモも,https://news.yahoo.co.jp/articles/3b2797a37950ae277d59ec85eb0531d0a2a03474,2/24(月) 15:10
2025-02-24,17:09,world,国際,31,聯合ニュース,韓国人の生活満足度が下落　OECD38カ国中33位＝自殺率はトップ,https://news.yahoo.co.jp/articles/5b9d457fe30668b77f2736695532bfe7ac981f64,2/24(月) 15:32
2025-02-24,17:09,world,国際,32,GLOBE＋,ウクライナ侵攻から3年、ボグダンさん「国民は疲弊、トランプ政権に期待していない」,https://news.yahoo.co.jp/articles/ab00ee9e184670a998798e8388b00e4723501879,2/24(月) 9:37
2025-02-24,17:09,world,国際,33,時事通信,住宅街で突然の道路陥没　埼玉事故も報道　英,https://news.yahoo.co.jp/articles/fa38eb089d23a10652405bd94023812949c7c94d,2/21(金) 13:32
2025-02-24,17:09,world,国際,34,産経新聞,米露交渉プーチン氏のペース　〝やった者勝ち〟中国も勢い　兵頭慎治・防衛研究所研究幹事,https://news.yahoo.co.jp/articles/8e91d812d9e1c629d08464b1276368130a63d08c,2/24(月) 9:21
2025-02-24,17:09,world,国際,35,KOREA WAVE,55歳兄「金欠だが再婚（国際結婚）したい」…韓国・費用負担を頼まれ、妹が怒り「あまりにも情けない」,https://news.yahoo.co.jp/articles/52fd850c984ddd94f52cbde7154e19f89897ca76,2/24(月) 13:03
2025-02-24,17:09,world,国際,36,時事通信,トランプ氏、ドイツの選挙結果歓迎　「非常識政策に国民うんざり」,https://news.yahoo.co.jp/articles/a24770209554792c997e1631ebe246333074a356,2/24(月) 7:55
2025-02-24,17:09,world,国際,37,聯合ニュース,韓国人宣教師2人　マダガスカルで強盗に襲われ死亡,https://news.yahoo.co.jp/articles/fd7f51d21141fce4e9243c8320ed832b503f96aa,2/24(月) 16:25
2025-02-24,17:09,world,国際,38,FNNプライムオンライン,「トランプ大統領は経済がわかっているのか?」関税戦争の足元でインフレ加速…「最も馬鹿げた貿易戦争」米経済専門紙が批判,https://news.yahoo.co.jp/articles/87f0632b8c12d87c6a8b4e31fa8b64c4b2bcd2a7,2/17(月) 17:02
2025-02-24,17:09,world,国際,39,時事通信,保守野党が第1党、政権復帰へ　極右躍進、与党は大敗　4月中旬にも連立合意・独総選挙,https://news.yahoo.co.jp/articles/f4f685cf5b325fe463be7805b85188d08bc5a252,2/24(月) 5:19
2025-02-24,17:09,world,国際,40,中央日報日本語版,中国で「新種コウモリコロナ」発見…韓国防疫当局「人が感染する可能性低い」,https://news.yahoo.co.jp/articles/9516510ffe79c3412c557fe076e14279ab75f006,2/24(月) 14:03
