scrp_date,scrp_time,genre_en,genre_jp,rank,media_jp,title,link,date_original
2025-07-03,21:12,sports,スポーツ,1,スポニチアネックス,リバプールFWディオゴ・ジョタが交通事故で急逝　28歳　先月挙式したばかり　ポルトガル連盟が正式発表,https://news.yahoo.co.jp/articles/8f6921c3b02331b36ee3895cf38b11b13abd15c0,7/3(木) 17:45
2025-07-03,21:12,sports,スポーツ,2,中日スポーツ,カーショーのために… 大谷翔平、封印解いた盗塁… ロバーツ監督「計算された賭け」、試合後は感動スピーチ,https://news.yahoo.co.jp/articles/0ee20d2b14a787dea38f94e7593080c2365c6b40,7/3(木) 16:54
2025-07-03,21:12,sports,スポーツ,3,日刊スポーツ,【ジャンプ】雪印メグミルク19歳坂野旭飛さんが死去、25年世界ジュニア代表　父は前監督幸夫氏,https://news.yahoo.co.jp/articles/c8268a8565b5f677a12200e0685fb757767a803d,7/3(木) 14:12
2025-07-03,21:12,sports,スポーツ,4,時事通信,19歳の坂野旭飛選手死去　スキージャンプ,https://news.yahoo.co.jp/articles/0afde99d5a284a85eb522ad1ed07b61be6a972ce,7/3(木) 12:10
2025-07-03,21:12,sports,スポーツ,5,スポーティングニュース日本版,ドジャースのデイブ・ロバーツ監督がマックス・マンシーの怪我の状態を説明,https://news.yahoo.co.jp/articles/428afd9d5d206eac16b1f803503af10f5b4db5df,7/3(木) 15:40
2025-07-03,21:12,sports,スポーツ,6,スポニチアネックス,28歳の若さで…リバプールFWディオゴ・ジョタ急逝　ファン悲痛「まじかよ…」「早すぎる」,https://news.yahoo.co.jp/articles/0f746190831ff446caf19c73120c38ba4f1a46c4,7/3(木) 18:16
2025-07-03,21:12,sports,スポーツ,7,スポーツ報知,【球宴】楽天ドラフト１位の宗山塁が選手間投票で選出「１年目からオールスターに出るというのは目指していた」,https://news.yahoo.co.jp/articles/c25e80fa8dde207ab2658510cbd0169ea33f0be0,7/3(木) 16:00
2025-07-03,21:12,sports,スポーツ,8,Full-Count,シカゴ放送局が脱帽した大谷翔平の“異能”　一般論が通用せず…「本当に多面的」,https://news.yahoo.co.jp/articles/239ae78d16664e84920ce63f2d28248941a5b0b5,7/3(木) 17:46
2025-07-03,21:12,sports,スポーツ,9,スポニチアネックス,ドラフト目玉高校生に12球団勢ぞろい…36人スカウト集結に幹部「そら来るでしょう」「すばらしい投手」,https://news.yahoo.co.jp/articles/824dbb81ae443654c58119bd3aeeecc181b8ffd1,7/3(木) 17:07
2025-07-03,21:12,sports,スポーツ,10,日刊スポーツ,リバプールのポルトガル代表FWジョタさん交通事故死、結婚式後10日余りの悲劇　遠藤航の同僚,https://news.yahoo.co.jp/articles/f709c03f62c474f7a707d531e479557b7b3eec3d,7/3(木) 18:49
2025-07-03,21:12,sports,スポーツ,11,デイリースポーツ,本塁上で２日連続際どいタイミング　巨人・阿部監督はリクエストせず…　解説者「セーフでしょ」　ＳＮＳ「なんでリクエストしないの？」,https://news.yahoo.co.jp/articles/5a4aa8c44252c09d6bfbc1df11afcc0dd3f9b4c4,7/3(木) 19:50
2025-07-03,21:12,sports,スポーツ,12,日刊スポーツ,【空手】「太ったからなに？あんたに迷惑かけたか？」東京五輪代表植草歩、ルッキズムに怒り,https://news.yahoo.co.jp/articles/606487542bd1bd19ad3c5238e429494a08799671,7/1(火) 22:49
2025-07-03,21:12,sports,スポーツ,13,中日スポーツ,「セーフやん」5回、巨人・泉口友汰の本塁タッチアウトにネット即応「なんでリクエストしなかった！？」「手の方が早かった気が…」,https://news.yahoo.co.jp/articles/6fbed8ce29ee16fdebf780089f3bf4c76ef8d64c,7/3(木) 20:28
2025-07-03,21:12,sports,スポーツ,14,スポーツ報知,ディオゴ・ジョッタが交通事故で死亡　結婚後わずか２週間の悲劇　同乗していた２６歳弟も亡くなる,https://news.yahoo.co.jp/articles/11449b8985fd6ad17b5581bc5e42509a513169f2,7/3(木) 18:02
2025-07-03,21:12,sports,スポーツ,15,東スポWEB,【ＭＬＢ】ドジャース・マンシー　悲劇の瞬間を米メディア解析「ヒザが不自然に曲がっている」,https://news.yahoo.co.jp/articles/ced3551fadc414ebf64a6bb49ae13d4f5b7d7231,7/3(木) 18:32
2025-07-03,21:12,sports,スポーツ,16,デイリースポーツ,土壇場二盗は大谷翔平の判断　ロバーツ監督も絶賛「賢明な賭けだったし、素晴らしいスタートを切った」大逆転サヨナラ呼ぶ大激走,https://news.yahoo.co.jp/articles/b12cdbf2029fd6919daece216f966d73ae25a329,7/3(木) 14:44
2025-07-03,21:12,sports,スポーツ,17,Full-Count,カーショー、大谷翔平ら同僚に感謝「特別な夜だ」　3000Kへの思い、11分間の会見で激白,https://news.yahoo.co.jp/articles/2c3efbf626c5b628b9a9c5c9927377b650a8ca27,7/3(木) 15:29
2025-07-03,21:12,sports,スポーツ,18,デイリースポーツ,田中希実　日本選手権１５００メートル＆５０００メートルに出場「確実に世界陸上の即時内定を頂けるような結果を」,https://news.yahoo.co.jp/articles/0a899b7cb3523c87ee51f56af4691c72e9c29a08,7/3(木) 19:11
2025-07-03,21:12,sports,スポーツ,19,ゲキサカ,28歳ジョタの早すぎる死…C・ロナウドが胸中吐露「こないだ代表で一緒だったのに。君は結婚したばかりじゃないか」,https://news.yahoo.co.jp/articles/4b5a76e485d53c9e81a6069496df324d339cfb1c,7/3(木) 19:48
2025-07-03,21:12,sports,スポーツ,20,スポニチアネックス,ソフトバンク山川穂高2発！　どすこい“おかわり”12号ソロ＆13号ソロ！今季初の2位浮上見えた,https://news.yahoo.co.jp/articles/af134b79845f5bc6c779f64ba262ec5cf7c4edcc,7/3(木) 20:10
2025-07-03,21:12,sports,スポーツ,21,スポーツ報知,日本代表の森保一監督「チームキャプテンとしては長友を指名したい」３８歳の長友佑都をＥ―１選手権のリーダーに指名,https://news.yahoo.co.jp/articles/ec2db6dc145e4b037dbbaf2f3dfad89bc32147d8,7/3(木) 15:03
2025-07-03,21:12,sports,スポーツ,22,西スポWEB OTTO！,ソフトバンクがついに今季初の2位浮上　3チームがゲーム差なしの大混戦に　首位ハム引きずり下ろす同一カード3連勝　山川穂高が2発、松本晴が自己最多14Kで3勝目,https://news.yahoo.co.jp/articles/3ef9d35c39fdb66302fd0089f7264b66e19e36d9,7/3(木) 20:42
2025-07-03,21:12,sports,スポーツ,23,GOAL,リヴァプールのジョタが交通事故により28歳で死去…6月22日に婚約者と結婚式を開いたばかり,https://news.yahoo.co.jp/articles/3f94cf9e6e1c6f4737e273ab321180afd68d9ab7,7/3(木) 18:17
2025-07-03,21:12,sports,スポーツ,24,CoCoKARAnext,大谷翔平は「毎日、ずっと変わらない人間」　ベッツ＆フリーマンが脱帽した偉才の“素顔”「いつも驚かされっぱなしだ」,https://news.yahoo.co.jp/articles/d6dd3c160f0373183648f725ad016f3a7ef8b827,7/3(木) 17:01
2025-07-03,21:12,sports,スポーツ,25,ENCOUNT,プロレス中継で活躍のタレントの結婚・妊娠電撃発表に武藤敬司は仰天「清宮海斗じゃなかったのか」,https://news.yahoo.co.jp/articles/ffc15f0cf3dcc8c0935ff00363a1110a91bf45dd,7/3(木) 15:18
2025-07-03,21:12,sports,スポーツ,26,東スポWEB,ヤンキースが〝放出〟した二塁手が球宴選出でファン悲嘆「ＧＭに蹴り飛ばされたあの選手が…」,https://news.yahoo.co.jp/articles/e43f8a7a1a277fe650c932a7638dd9ff28d7e265,7/3(木) 18:32
2025-07-03,21:12,sports,スポーツ,27,イーファイト,元TOKIO山口達也、格闘家も驚く“キレキレ”サンドバッグ打ち！「まさか、BDに」の声,https://news.yahoo.co.jp/articles/db32c92535d7561ab3c7ddf1b3e035cffa6d5367,7/3(木) 11:30
2025-07-03,21:12,sports,スポーツ,28,ゲキサカ,リバプールのポルトガル代表MFディオゴ・ジョタが交通事故で急逝,https://news.yahoo.co.jp/articles/f350c2c20eae5926b9c9b7d5868b0829bdf2f74b,7/3(木) 17:46
2025-07-03,21:12,sports,スポーツ,29,CoCoKARAnext,なぜスピードが出ない“不振”が続くのか？ 元実力派F1戦士が断じた角田裕毅の近未来「明らかなミスは見当たらない。だからこそ――」,https://news.yahoo.co.jp/articles/1be9fc63791c3f0bd05ae6423633d4d45bedb23b,7/3(木) 11:30
2025-07-03,21:12,sports,スポーツ,30,東スポWEB,大谷翔平がすごすぎて…禁止薬物使用疑惑投稿の米ファン「正当な調査を」で〝炎上〟＝米報道,https://news.yahoo.co.jp/articles/7481ddab0721829f259cd0fbddf80a76c85a389f,7/3(木) 12:11
2025-07-03,21:12,sports,スポーツ,31,日刊スポーツ,貴乃花氏「負けられない国政政党！？投票にいくぞ－！」現状に危機感　参院選の投票を呼びかけ,https://news.yahoo.co.jp/articles/b7c451392997df9edd078030dd959a400cebedd5,7/3(木) 17:35
2025-07-03,21:12,sports,スポーツ,32,デイリースポーツ,日本ハムが約２カ月ぶりの首位陥落　ソフトＢに３連敗で首位とゲーム差なしの３位に後退　打線元気なく、松本晴に１４三振喫する,https://news.yahoo.co.jp/articles/8bb49b605140faac8ed86d4fc0c3033ab9449801,7/3(木) 20:45
2025-07-03,21:12,sports,スポーツ,33,CoCoKARAnext,不振を極める角田裕毅に「深刻な疑問が生じている」　蘭メディアが伝えたレッドブル内部の動き「苦戦で『社内協議』を認めた」,https://news.yahoo.co.jp/articles/5a87a0ca66e664e682e536b2087af1efef614304,7/3(木) 19:03
2025-07-03,21:12,sports,スポーツ,34,TBS NEWS DIG Powered by JNN,【日本ハム】首位陥落 鷹に3タテ喰らい61日ぶり3位転落...同点の4回、金村が海野にV打 3失点KO 山川に2被弾 一時同点も17三振,https://news.yahoo.co.jp/articles/b1705a6d86440529b3ec5e543800a776f36fe300,7/3(木) 20:42
2025-07-03,21:12,sports,スポーツ,35,スポーツ報知,【巨人】門脇誠が守備で負傷交代　足をひきずりながらベンチに下がる,https://news.yahoo.co.jp/articles/2856515d11fc498c55a5fa4d45f9611b356c33f8,7/3(木) 20:07
2025-07-03,21:12,sports,スポーツ,36,Full-Count,忘れられてしまった大谷翔平…ファンの指摘続出「当たり前すぎて」　“No.1”に起きた珍事,https://news.yahoo.co.jp/articles/3fdbd12be03ecb34383862138566df731192d98f,7/3(木) 19:15
2025-07-03,21:12,sports,スポーツ,37,Full-Count,夢の舞台のはずが…「屈辱的な結果」　最下位球団の“現実”に嘆き「すごい選手いるのに」,https://news.yahoo.co.jp/articles/b70cb1f1169578c2c998337e4919313cc849e130,7/3(木) 18:32
2025-07-03,21:12,sports,スポーツ,38,スポニチアネックス,スキージャンプ・坂野旭飛さん死去　19歳　24年2月にW杯初出場,https://news.yahoo.co.jp/articles/ad2549f6b7df5a849d756eaf630422778137df2e,7/3(木) 12:34
2025-07-03,21:12,sports,スポーツ,39,サッカーキング,C・ロナウドが交通事故で亡くなったディオゴ・ジョッタを追悼「つい最近まで一緒に代表チームにいたのに。結婚したばかりだったのに」,https://news.yahoo.co.jp/articles/7b9a44fb37eb9e47b4653fe07aeb1bbbad8112fe,7/3(木) 20:19
2025-07-03,21:12,sports,スポーツ,40,theWORLD（ザ・ワールドWeb）,ギェケレシュ、イングランド行き反対の恋人と破局か　移籍目前でポルトガルとの“全関係断絶”へ,https://news.yahoo.co.jp/articles/f5b57563d64c101cb912507470e963843236ea5c,7/3(木) 20:03
