scrp_date,scrp_time,genre_en,genre_jp,rank,media_jp,title,link,date_original
2024-10-12,18:06,TTL,総合,1,ENCOUNT,斉藤慎二は「12億捨てたいうこと」　大御所芸人が言及「とんとん拍子に売れたからかな」,https://news.yahoo.co.jp/articles/4e144baec098e942809851d1daffe0ed785fef31,10/12(土) 12:11
2024-10-12,18:06,TTL,総合,2,スポニチアネックス,大谷翔平の愛犬デコピン　パーティー会場に連れられる写真が話題「デコピンちゃんの表情絶妙すぎて好き」,https://news.yahoo.co.jp/articles/1594b0a34a1ede0f565b50083e8492f52b62f00d,10/12(土) 13:21
2024-10-12,18:06,TTL,総合,3,デイリースポーツ,阪神　追い上げ実らず岡田監督崖っぷち　自慢の救援陣が致命的な２失点　九回に反撃で完封阻止も　甲子園が大きなため息,https://news.yahoo.co.jp/articles/d1521e287d606fcc4eecdb6127d17152138d1972,10/12(土) 17:21
2024-10-12,18:06,TTL,総合,4,中日スポーツ,山本由伸、圧巻投球の裏にチームメートの支え…ロバーツ監督「彼を信じていた、ワールドシリーズまで投げさせるのが楽しみだ」,https://news.yahoo.co.jp/articles/e4a8e9da2b8ddd47a21841161230be5d5eca5011,10/12(土) 13:37
2024-10-12,18:06,TTL,総合,5,スポーツ報知,【ロッテ】佐々木朗希がＣＳ初勝利で最終Ｓ進出王手　下剋上日本一へ好発進,https://news.yahoo.co.jp/articles/ab55421be51e2f40c864e2f94d3d46f643741675,10/12(土) 16:56
2024-10-12,18:06,TTL,総合,6,中日スポーツ,ダルビッシュ、頭を使っての好投「人生で言うと、ほぼ死ぬ間近なので。いや、だから死にたくないところが強い」大谷翔平についても言及,https://news.yahoo.co.jp/articles/132db049e4fb6f2d9130d0e2235adf7a7e5389b3,10/12(土) 15:13
2024-10-12,18:06,TTL,総合,7,ENCOUNT,「川島さんキレてるじゃん」　川島明、破天荒芸人の生放送での行動に怒り「こんな顔するんすね」,https://news.yahoo.co.jp/articles/079924e6b3307ac54ef97e6c8755445676fb0aea,10/12(土) 15:52
2024-10-12,18:06,TTL,総合,8,中日スポーツ,負けてなお…ダルビッシュへの称賛やまず「偉大だった」「高ぶった感情を抱えながらも注意深く投げていた」米解説者がしみじみ,https://news.yahoo.co.jp/articles/0b114f6156a775f66423d2d0c0cf15d17e58044f,10/12(土) 14:24
2024-10-12,18:06,TTL,総合,9,デイリースポーツ,全国模試１７位だった人気女性歌手　「Ａスタ」騒然「ええーっ！？」　高校時はモデル、大学進学やめて夢の歌手目指す,https://news.yahoo.co.jp/articles/175c30aa769af37aeb38fe4a6762f58baeb8ec98,10/12(土) 14:21
2024-10-12,18:06,TTL,総合,10,Hint-Pot,ホテルのベッドでよく見る“謎の布”　正体に「知らなかった」「お腹にかけてた」の声,https://news.yahoo.co.jp/articles/5faf93327f054dabe5933b2098f5c141774ad631,10/12(土) 8:10
2024-10-12,18:06,TTL,総合,11,ABEMA TIMES,「いつか殺してやる」ダンプ松本、憎しみ続けた父が認知症に…最期のやりとりを告白「心から許したことはなかった」,https://news.yahoo.co.jp/articles/d36a389a8658858f1d833bd85d7c9ce770773764,10/12(土) 11:32
2024-10-12,18:06,TTL,総合,12,ハフポスト日本版,メキシコの市長、就任から1週間もせずに殺害。頭部が車の屋根に置かれた写真が拡散、麻薬組織の犯行とみられる,https://news.yahoo.co.jp/articles/a45bbd830c6bf947c36ad9720e3f9aa56bcf36bd,10/12(土) 8:50
2024-10-12,18:06,TTL,総合,13,日刊スポーツ,伊達みきお、今江敏晃氏の楽天監督１年退任に「下手くそだと思う球団が。ファンあってのチーム」,https://news.yahoo.co.jp/articles/8404897c84bb42a1bafb413dbd06aa45d3c41792,10/12(土) 13:48
2024-10-12,18:06,TTL,総合,14,スポニチアネックス,元JRAトップジョッキー、藤田菜七子の電撃引退にコメント「騎手は稼げるのに…勿体無い！」,https://news.yahoo.co.jp/articles/51520f830f2e822f3584c277dbba72004ca21ebb,10/12(土) 15:11
2024-10-12,18:06,TTL,総合,15,Hint-Pot,アメリカ人「まだ着いたばかりだけど」　日本人を見て「買って帰りたい」と思ったものとは,https://news.yahoo.co.jp/articles/45743a9921a6abc7c9d655e99a5f1879b51e5d0b,10/12(土) 6:10
2024-10-12,18:06,TTL,総合,16,ゴルフ総合サイト ALBA Net,西郷真央が米ツアー初Vに王手　畑岡奈紗5位、渋野日向子は69位,https://news.yahoo.co.jp/articles/9066314be2571681ddfbc68d02b9cd3a37c19e06,10/12(土) 17:03
2024-10-12,18:06,TTL,総合,17,デイリースポーツ,「僕たちは何も驚いてない」殊勲打の“Ｗヘルナンデス”山本由伸の快投を絶賛「これが野球の素晴らしいところ」,https://news.yahoo.co.jp/articles/442e68559caf801a8479d857ea630d994fb7cdf3,10/12(土) 14:49
2024-10-12,18:06,TTL,総合,18,デイリースポーツ,ドジャース奥さま会　第５戦も球場に集結「真美子さんだ♥」「全員がキュート」勝負の一戦前にメッセージも,https://news.yahoo.co.jp/articles/fda3937af2da1e32622e8928173349d7affadebe,10/12(土) 8:53
2024-10-12,18:06,TTL,総合,19,東スポWEB,山本由伸に米メディアが手の平返しの絶賛「これがエースだ」「３億２５００万ドル男の仕事だ」,https://news.yahoo.co.jp/articles/0f50dec9b13758dfb050f36bb46dfd4530e271eb,10/12(土) 17:06
2024-10-12,18:06,TTL,総合,20,デイリースポーツ,森渉＆金田朋子の元夫婦　番組出演で誹謗中傷も　誤解生じ「クズ夫とかヒモとか」,https://news.yahoo.co.jp/articles/ee2e2c9d4b8646837a7cc5607e8237c57e41f4c3,10/12(土) 13:17
2024-10-12,18:06,TTL,総合,21,イーファイト,【ボクシング】カシメロがまさかの”1kg”オーバー！再計量もパスできず！対するサンチェス「彼はプロではない」,https://news.yahoo.co.jp/articles/8286f33830bb31d8a3545109535b6b1faa4f6382,10/12(土) 13:57
2024-10-12,18:06,TTL,総合,22,日刊スポーツ,ベッツ、試合後にレジェンドたちの質問に応じる「最高の気持ち」先発好投の山本由伸にも言及,https://news.yahoo.co.jp/articles/9918f6d2bd6ec6b9b129fd8234e851dc7024d40e,10/12(土) 13:49
2024-10-12,18:06,TTL,総合,23,スポーツ報知,大原櫻子、１０周年コンサートでスクリーンを越えた“カップル復活”にファン大歓喜「だいすき超えて愛してます」「一生の思い出」,https://news.yahoo.co.jp/articles/7baa7db9f53ec2e59fc1320ec4914cfa3ab83341,10/12(土) 14:42
2024-10-12,18:06,TTL,総合,24,スポニチアネックス,向井慧「壁一枚隔てて隣」の高校に通っていた人気芸人「柄の悪い高校だったの。やんちゃ…全然痩せてて」,https://news.yahoo.co.jp/articles/ef3518ae2831f3e0922ba729fb99df35549122ad,10/12(土) 13:49
2024-10-12,18:06,TTL,総合,25,スポニチアネックス,42歳元アイドル　生活保護、自己破産経て…現在の就労状況明かす「職種の経験値は年々上がっている」,https://news.yahoo.co.jp/articles/298db1b16409d1ee107208bc526b2de2b57ea424,10/12(土) 12:50
2024-10-12,18:06,TTL,総合,26,夕刊フジ,投開票の夜に「政界再編の幕」が開くか　石破首相が再度の〝変節〟　世耕氏、萩生田氏ら中心の新党なら…「非公認」は離党勧告と同じこと,https://news.yahoo.co.jp/articles/63bff747fea09550a55bf6cb1594c0e1d60e4853,10/12(土) 17:00
2024-10-12,18:06,TTL,総合,27,スポニチアネックス,パドレス指揮官　ダル「今回も見事だった」山本「これまでで最高の出来」終戦に「落胆している」,https://news.yahoo.co.jp/articles/ebda3973e15e60e6698e8582d3d699a67d14e3c9,10/12(土) 13:39
2024-10-12,18:06,TTL,総合,28,スポニチアネックス,終戦のパドレス「ただフィールドにいたいと…」最後までド軍の歓喜を見ていたのは期待の大型新人,https://news.yahoo.co.jp/articles/a6a9791b982987846e804c47a89254ef83331a99,10/12(土) 15:13
2024-10-12,18:06,TTL,総合,29,オトナライフ,意外と知らない「iPhone」と「Android」の国内シェア、その差は想像以上？,https://news.yahoo.co.jp/articles/aba74e23bf6d788c93edc715b0c592211cc36f3d,10/12(土) 14:00
2024-10-12,18:06,TTL,総合,30,スポーツ報知,「イッテＱ！」祭り企画で６年ぶりに男子チームが集結！「楽しみすぎる」「待ってたぞー！」とファン歓喜,https://news.yahoo.co.jp/articles/7f10139e25acdff801a6d6bf9fcc96ac365b7a8a,10/12(土) 14:58
2024-10-12,18:06,TTL,総合,31,デイリースポーツ,衆院選・自民惨敗→石破首相が連立組むウルトラＣの衝撃相手　杉村太蔵が指摘「ゼロじゃなくなってきた」　金子恵美氏も「起きる可能性」,https://news.yahoo.co.jp/articles/2016edecc6ea8f45bde22179c31716feb88b3a52,10/12(土) 17:41
2024-10-12,18:06,TTL,総合,32,デイリースポーツ,裏金除外で比例不足→自民が代役比例で狙ったＴＶ出まくり女性　「やんわり、問い合わせ」と認める　東野＆青山氏「やっぱり！」,https://news.yahoo.co.jp/articles/5e21a92992eaad6d2d7f1888eba0b07d2e50fca6,10/12(土) 13:31
2024-10-12,18:06,TTL,総合,33,TBS NEWS DIG Powered by JNN,強度行動障害の息子…受け入れ施設が見つからない　両親の苦悩【報道特集】,https://news.yahoo.co.jp/articles/040dfeda15e812e335a4b2aa68a4196ecb089410,10/12(土) 6:32
2024-10-12,18:06,TTL,総合,34,中日スポーツ,米メディア、ダルビッシュは称賛もパドレス打線を痛烈批判「チームが彼を見殺しにした」「恥を知れ」「ひどかった」,https://news.yahoo.co.jp/articles/3ad3995fce7963ef392f44f7f933cdb3f3a8e617,10/12(土) 15:02
2024-10-12,18:06,TTL,総合,35,スポーツ報知,山本由伸、自信を取り戻したきっかけはカフェでの２時間「キケが誘ってくれて…」　同僚に感謝の好投,https://news.yahoo.co.jp/articles/a2fd9d81e0d207b75c0a71f16b3147eeebef5a1b,10/12(土) 13:08
2024-10-12,18:06,TTL,総合,36,FNNプライムオンライン,大蛇VS酔っ払い「勝負したい!」バトル挑み強がり続けるも歯が立たず…約2メートル・15kgの巨大ニシキヘビにキス連発で反撃?　中国,https://news.yahoo.co.jp/articles/06a20eb10c537236db34535929ccd5ecdd64d560,10/12(土) 13:32
2024-10-12,18:06,TTL,総合,37,ファイナンシャルフィールド,【実録】小学3年生の娘に「友だちと映画に行くから6000円ちょうだい」と言われました。友だちはみんな持ってくるそうですが、高額すぎませんか？ チケット代は「1000円」程度ですよね？,https://news.yahoo.co.jp/articles/7760beace7b11a25e47a8faeca8ad4d784b02de3,10/12(土) 13:50
2024-10-12,18:06,TTL,総合,38,ENCOUNT,榊原郁恵が悩まされた最愛の渡辺徹さんの病気　亡くなる直前の選択で“最大の後悔”,https://news.yahoo.co.jp/articles/bd36ecb2d82c57cc41aa059fb0407f95178124e5,10/12(土) 10:50
2024-10-12,18:06,TTL,総合,39,中日スポーツ,ドジャース地元メディアさえ…ダルビッシュのPSパフォーマンスに畏敬の念　あの“呪われた2試合”で「スケープゴートにされてしまった」,https://news.yahoo.co.jp/articles/7f801440fb6519c9f34f7bcf639d0c5eaa6d8ad0,10/12(土) 15:51
2024-10-12,18:06,TTL,総合,40,スポーツ報知,「完全に別人」ホラン千秋、激変姿にフォロワーショック「えっ誰誰誰やばいってドキドキ」「やば」,https://news.yahoo.co.jp/articles/2dcf007333ba88f69576cb01a9a21610899c6e9e,10/12(土) 9:15
