scrp_date,scrp_time,genre_en,genre_jp,rank,media_jp,title,link,date_original
2024-03-31,15:20,sports,スポーツ,1,Full-Count,大谷翔平、サヨナラ機に凡退でド軍敗戦　下向き悔しさ露わ…山本由伸は5回0封も初勝利お預け,https://news.yahoo.co.jp/articles/c7ccc010472bb15a217b2324fef47d4550626580,3/31(日) 13:52
2024-03-31,15:20,sports,スポーツ,2,FNNプライムオンライン（フジテレビ系）,水原一平氏に未返済の借金か　米メディア報道　違法賭博の胴元はコメント拒否,https://news.yahoo.co.jp/articles/b4832d72703b5dcb70a0b544c6793c72b31c0f7e,3/31(日) 12:46
2024-03-31,15:20,sports,スポーツ,3,センバツLIVE！,健大高崎が春夏通じて甲子園初優勝　報徳学園降す　センバツ,https://news.yahoo.co.jp/articles/116a00311ee9b1749b56c6e07b09ad4ed947c705,3/31(日) 14:15
2024-03-31,15:20,sports,スポーツ,4,スポーツ報知,ドジャース延長１０回惜敗　山本由伸５回無失点好投も初勝利お預け、大谷翔平大チャンスで凡退,https://news.yahoo.co.jp/articles/135acbf0aa09f306e90e3258495d8ed6143407df,3/31(日) 13:54
2024-03-31,15:20,sports,スポーツ,5,デイリースポーツ,中日・中田翔が反撃の２号ソロ「うまく打つことができました」　初回でリクエスト権使い切る珍事　嫌なムード振り払う一発,https://news.yahoo.co.jp/articles/17f006bcc83000801cc85c3d6333218feb9b90da,3/31(日) 14:38
2024-03-31,15:20,sports,スポーツ,6,スポニチアネックス,ドジャース・ベッツ　4戦連発弾に本拠大熱狂　開幕5試合打率.611、出塁率7割、OPSは2.109,https://news.yahoo.co.jp/articles/25c1f04dedb7d917002269328cc287e8a9da43f4,3/31(日) 13:13
2024-03-31,15:20,sports,スポーツ,7,CoCoKARAnext,山本由伸、5回5Kの貫録投球！ 初回KOの前回登板からの“別人化”に米記者も絶賛「特別な才能の持ち主だ」,https://news.yahoo.co.jp/articles/f6c6206c77c28aa9f5b3c1b64235fcab404ef362,3/31(日) 12:09
2024-03-31,15:20,sports,スポーツ,8,ゴルフ総合サイト ALBA Net,＜中間速報＞竹田麗央が単独首位キープ　小祝さくら、岩井千怜ら1差追走,https://news.yahoo.co.jp/articles/396567d145023196d883f3afd93093dc0c2a5559,3/31(日) 13:08
2024-03-31,15:20,sports,スポーツ,9,Full-Count,大谷翔平に小さな変化…首元でキラリ「初めて見た」　さりげない“新装備”にファン注目,https://news.yahoo.co.jp/articles/97c67fc6536bfe58fc21a8b00c2d9485763e8b7f,3/31(日) 9:58
2024-03-31,15:20,sports,スポーツ,10,CoCoKARAnext,水原一平氏は「壁」だった “名通訳”を失った大谷翔平の現況に米記者が持論「ショウヘイは非常に奇妙な場所にいる」,https://news.yahoo.co.jp/articles/2817aac04e846bf870691c84441588abef40046b,3/31(日) 7:02
2024-03-31,15:20,sports,スポーツ,11,デイリースポーツ,広島　前日に危険球退場の黒原がＤｅＮＡ・度会へ直接謝罪　三浦監督にも頭を下げる,https://news.yahoo.co.jp/articles/afee91c208e2f32c39c5e0ba422672bf70b1f76e,3/31(日) 11:09
2024-03-31,15:20,sports,スポーツ,12,デイリースポーツ,大谷翔平も手ぶりで「何これ？」山本由伸のロッカーにてるてる坊主を置いたのは…本人も「誰っすか？」と苦笑い,https://news.yahoo.co.jp/articles/c661b76d785510205acf9eb9ab2166a222e9fe5d,3/31(日) 11:44
2024-03-31,15:20,sports,スポーツ,13,デイリースポーツ,中日　初回にリクエスト２回使い切る珍事　ともに一塁判定で行使もセーフ覆らず　立浪監督首傾げ、中田は苦笑　神宮騒然　流れ逸し、痛恨３失点,https://news.yahoo.co.jp/articles/aaa9c49c2e6be8b69d8de23e92ad53c13cb21577,3/31(日) 13:54
2024-03-31,15:20,sports,スポーツ,14,TBS NEWS DIG Powered by JNN,健大高崎が春夏通じて初の全国制覇！群馬県勢センバツ初Vの快挙、報徳学園は2年連続準Vで雪辱ならず,https://news.yahoo.co.jp/articles/3baa7c0ce541bcb53c54d1dd76ca46f125c812a7,3/31(日) 14:14
2024-03-31,15:20,sports,スポーツ,15,Full-Count,新庄監督が“水原氏問題”言及　自身は22億円損失「人間不信になりかける」,https://news.yahoo.co.jp/articles/f1c9ff75b52713927e8bb3316472ad70ef16909d,3/31(日) 14:02
2024-03-31,15:20,sports,スポーツ,16,中日スポーツ,健大高崎、春夏通じて初の甲子園優勝、群馬県勢として初のセンバツ制覇　報徳学園は2年連続の準優勝,https://news.yahoo.co.jp/articles/355b26a60efcdb280b550908633a5cf1fa8f8658,3/31(日) 14:29
2024-03-31,15:20,sports,スポーツ,17,スポーツ報知,【センバツ】報徳学園が明石中以来９１年ぶり史上２校目の２年連続準Ｖ　今秋ドラフト上位候補右腕が３失点,https://news.yahoo.co.jp/articles/38b9201ce87361fe1c66fe8da9f899ca13e4104e,3/31(日) 14:14
2024-03-31,15:20,sports,スポーツ,18,デイリースポーツ,オリックス　山本由伸の雄姿に昼食時の選手が釘付け　ファンも「泣ける」の声続々　球団公式ＳＮＳで公開,https://news.yahoo.co.jp/articles/c89a101590bd0c419c4299b1c5d2b42e9e8fe663,3/31(日) 11:55
2024-03-31,15:20,sports,スポーツ,19,Full-Count,屈辱の打率.000…崖っぷち29歳に「どうせ打てない」　阿部監督がかけた“魔法の言葉”,https://news.yahoo.co.jp/articles/e51b179b88e432013a5fe5675d9ebbca6cc929cc,3/31(日) 8:10
2024-03-31,15:20,sports,スポーツ,20,デイリースポーツ,山本由伸　試合中断も異例の続投→五回も抑え初勝利の権利手にするも消滅　大谷に背番号譲ったケリーが乱調　ロッカーにてるてる坊主も,https://news.yahoo.co.jp/articles/ca6481adb937b3a96fe866c0b881bc8d9e4e358c,3/31(日) 11:14
2024-03-31,15:20,sports,スポーツ,21,Full-Count,大谷翔平「見え方自体は悪くない」　サヨナラ機に凡退で敗戦…5試合25打席一発なし,https://news.yahoo.co.jp/articles/829aa811e09952b5b11312d9a3952dc2a63f2d69,3/31(日) 14:19
2024-03-31,15:20,sports,スポーツ,22,FITNESS LOVE,同僚からの「早く会社を辞めて欲しい」や私生活の悩みで心身ボロボロ→グランプリ獲得まで変化した25歳が立てた『目標』,https://news.yahoo.co.jp/articles/8b043239b0b51da71a3172b78c8868fe20b85dcc,3/31(日) 7:11
2024-03-31,15:20,sports,スポーツ,23,スポニチアネックス,【センバツ】23年ぶり本塁打0でV！　新基準の低反発バット導入　大会本塁打は75年以降で最少の3,https://news.yahoo.co.jp/articles/47ae4bef40b40f506d92ad51337e20057ff6c91d,3/31(日) 14:27
2024-03-31,15:20,sports,スポーツ,24,ABEMA TIMES,大谷翔平も被害に…ロバーツ監督が鬼の形相でブチギレ！ 度重なる球審の不可解なストライク判定が物議,https://news.yahoo.co.jp/articles/171f99cf35b44a1acee3789a45b47a34c4ac97af,3/31(日) 13:36
2024-03-31,15:20,sports,スポーツ,25,東スポWEB,大谷翔平は捜査対象外！会見で「嘘反応ない」と若狭氏　真美子さんとの結婚がポイント,https://news.yahoo.co.jp/articles/1bc135b488a543cac1a40a77606faafce7e628f0,3/31(日) 5:16
2024-03-31,15:20,sports,スポーツ,26,中日スポーツ,ドジャース山本由伸、初戦から見違える快投に「ついに全米にバレてしまう」ネット称賛、リリーフ打たれ初白星スルリ,https://news.yahoo.co.jp/articles/e7275757861ea9058bc4f014e5205fba87df80cb,3/31(日) 13:04
2024-03-31,15:20,sports,スポーツ,27,ABEMA TIMES,いや、キツいって…山本由伸の“エグすぎ”カーブに見逃し打者が思わず後ずさる珍事 完全お手上げリアクション,https://news.yahoo.co.jp/articles/2f0fff1dd3117c96f6f4aafb626a944202aea28f,3/31(日) 11:33
2024-03-31,15:20,sports,スポーツ,28,中日スポーツ,V字回復の山本由伸に…ドジャース地元メディアは鼻高々「アンチの連中はみんな何も言えないな！」,https://news.yahoo.co.jp/articles/a16c4605f959fce486aca48671696812ba219b38,3/31(日) 14:17
2024-03-31,15:20,sports,スポーツ,29,馬トク報知,日曜メインレースの注目激走馬…阪神１１Ｒ大阪杯・Ｇ１,https://news.yahoo.co.jp/articles/94aa1c05474f183ebab3744d56bdd65f0097c4ab,3/31(日) 14:27
2024-03-31,15:20,sports,スポーツ,30,スポニチアネックス,【センバツ】高崎健康福祉大高崎が初優勝！　春大旗が初めて群馬へ　2年生リレーで1点差逃げ切る,https://news.yahoo.co.jp/articles/149bfccc3648b56f07640fcb58adceabfe6c0ff5,3/31(日) 14:15
2024-03-31,15:20,sports,スポーツ,31,東スポWEB,【ドジャース】雨天続投の山本由伸　５回快投に敏腕記者「４９２億円の投手」と賛辞,https://news.yahoo.co.jp/articles/2b7075bfda3c1247eb79587f413b4d63769d5322,3/31(日) 13:41
2024-03-31,15:20,sports,スポーツ,32,中日スポーツ,10回2死満塁、一打出れば…の好機に大谷翔平、遊飛に倒れゲームセット、ドジャース競り負け、山本由伸の初勝利お預け,https://news.yahoo.co.jp/articles/aea48b3a489f69eb1fbe4d41de6df47111fb78af,3/31(日) 14:11
2024-03-31,15:20,sports,スポーツ,33,スポーツ報知,ドジャース・山本由伸５回無失点の好投も救援陣踏ん張れず初勝利ならず　降雨中断後気合の続投も実らず,https://news.yahoo.co.jp/articles/41cdf76b9cc2eaa5312591d74f54499d4e5a99f3,3/31(日) 12:36
2024-03-31,15:20,sports,スポーツ,34,デイリースポーツ,大谷翔平が一打サヨナラの絶好機で凡退　ドジャースタジアムが大きなタメ息「捉えたつもりでしたけど」現状も分析,https://news.yahoo.co.jp/articles/8ea10d93ddd4103b139c6bbccc246c77c1f657af,3/31(日) 13:58
2024-03-31,15:20,sports,スポーツ,35,デイリースポーツ,大谷が水原氏と１対１避け代理人呼ぶ　高橋洋一氏「驚いた」「あれ呼ばないと危ないんです」,https://news.yahoo.co.jp/articles/e6414ce127c8f94e558ac728c166f2ee0de2165b,3/30(土) 10:54
2024-03-31,15:20,sports,スポーツ,36,デイリースポーツ,山本由伸が５回無失点の快投＆ベッツ４戦連発もド軍３連勝逃す　大谷翔平がサヨナラ好機で凡退「捉えたつもりでしたけどポップフライに」,https://news.yahoo.co.jp/articles/fb07f18eef5d40c514c550be9596ac3686f0bb86,3/31(日) 13:54
2024-03-31,15:20,sports,スポーツ,37,デイリースポーツ,阪神　開幕からの連続イニング無得点がついに２０の大台に　初回でセ・リーグワーストを更新　ゼロの地獄が続く,https://news.yahoo.co.jp/articles/72fd69875a774eccfb3285be1e508751bfb74cb5,3/31(日) 14:28
2024-03-31,15:20,sports,スポーツ,38,Full-Count,大谷翔平は「何とかしてくれると…」　サヨナラ機に凡退、指揮官も嘆き「ミスしてしまった」,https://news.yahoo.co.jp/articles/a518b0611141c4940c62a10b1a6787fe272c53a9,3/31(日) 14:49
2024-03-31,15:20,sports,スポーツ,39,馬トク報知,【大阪杯】森泰斗騎手「先行して抜け出す王道の競馬に期待」本命にはまだ底を見せていないあの馬を指名,https://news.yahoo.co.jp/articles/99d14c3ffc51889b818af73ff847a6cf3a1c2cb2,3/31(日) 13:27
2024-03-31,15:20,sports,スポーツ,40,東スポWEB,Ｊ２最下位転落の徳島　吉田達磨監督の「10分解任」波紋…ＭＦ西谷和希への〝冷遇〟も判明,https://news.yahoo.co.jp/articles/2408c55d4ccc8e51f8b8a6bbf64ff47cd4177ed8,3/31(日) 6:02
