scrp_date,scrp_time,genre_en,genre_jp,rank,media_jp,title,link,date_original
2024-11-17,08:06,domestic,国内,1,FNNプライムオンライン,「不倫続けようと…」妻と1歳の娘を殺害した元看護師の男に“無期懲役”を求刑 遺族も衝撃…逮捕後にも続いていた不倫関係「貴方に一生の誓いを…」,https://news.yahoo.co.jp/articles/a2451d97056898e82351307c26f2236dc2e82e04,11/16(土) 21:02
2024-11-17,08:06,domestic,国内,2,スポニチアネックス,国民民主・玉木雄一郎氏が否定　不倫相手の一部情報「全くの虚偽情報であることを確認しました」,https://news.yahoo.co.jp/articles/76bb13954f9c43e4c840096ed8f4a1b5879733e9,11/17(日) 4:43
2024-11-17,08:06,domestic,国内,3,TBS NEWS DIG Powered by JNN,【独自】非公認候補 高木毅氏が党支部資金を選挙区“地域支部”に支給　衆議院選挙に使用された実態が明らかに【報道特集】,https://news.yahoo.co.jp/articles/8a302d391125aa58a74ffc6b02b1a1f3d943483b,11/16(土) 20:24
2024-11-17,08:06,domestic,国内,4,よろず～ニュース,兵庫県知事選にデヴィ夫人が降臨　西から東に移動しながらパワフルに応援演説,https://news.yahoo.co.jp/articles/0449c7254b154ce2c7336ce4fdaaac73c7c309cc,11/16(土) 22:20
2024-11-17,08:06,domestic,国内,5,選挙ドットコム,兵庫県知事選挙の政策を比較！全候補者の県政課題への意見は？選挙ドットコムちゃんねるまとめ,https://news.yahoo.co.jp/articles/dab0aaff05a17fa6505559277654ed503b3bb9bc,11/16(土) 19:31
2024-11-17,08:06,domestic,国内,6,読売新聞オンライン,埼玉栄高校でグラウンド整備用の車が横転、助手席の男子生徒死亡…のり面に乗り上げたか,https://news.yahoo.co.jp/articles/3d18c3a1861222416f165c70180cf6704c5bf8b1,11/17(日) 6:50
2024-11-17,08:06,domestic,国内,7,TBS NEWS DIG Powered by JNN,埼玉栄高校のサッカーグラウンドで軽乗用車が横転　高校2年の男子生徒（17）が死亡　グラウンド整備用の車か　危険運転致死の疑いも視野に捜査　埼玉県警,https://news.yahoo.co.jp/articles/995b894122ed7309e57f56787f7ab4ba92716f4d,11/17(日) 6:31
2024-11-17,08:06,domestic,国内,8,朝日新聞デジタル,高校生運転の車がグラウンド内で横転　同乗の生徒が死亡　埼玉栄高校,https://news.yahoo.co.jp/articles/7d7078f3875f133c132f4a78fb46ce910354809a,11/17(日) 7:15
2024-11-17,08:06,domestic,国内,9,毎日新聞,最高のお姉ちゃん「かえちゃん」を奪われた家族の20年　小１女児殺害,https://news.yahoo.co.jp/articles/a9f617ebb460112ed00919ab7ed6038bd92fd336,11/17(日) 5:00
2024-11-17,08:06,domestic,国内,10,よろず～ニュース,稲村和美氏が兵庫県知事選最後の訴え「ネットで極端な情報が拡散」「県民の皆さんの冷静な判断を信じます」,https://news.yahoo.co.jp/articles/ce44fec930ff2e0cbce3da9503eabc5789f340dd,11/16(土) 20:45
2024-11-17,08:06,domestic,国内,11,よろず～ニュース,兵庫県議「何をやってるんだ」市長会有志22人の「特定候補の支援」表明に「県民の判断待てばいい」,https://news.yahoo.co.jp/articles/db5582ef6398569a74723a442bd578c32364e023,11/16(土) 13:31
2024-11-17,08:06,domestic,国内,12,日テレNEWS NNN,トランプ氏側が石破首相との会談を見送る考え…正式に伝達,https://news.yahoo.co.jp/articles/2a3c19976765f27352bcd19741e69bf3dad2093d,11/16(土) 21:55
2024-11-17,08:06,domestic,国内,13,カナロコ by 神奈川新聞,自民・松本純氏、次期衆院選に不出馬を検討　元国家公安委員長、銀座クラブ問題で離党したことも,https://news.yahoo.co.jp/articles/ca416aeed5b6e3f94d3ae4f601cffd8e7450d720,11/17(日) 5:00
2024-11-17,08:06,domestic,国内,14,日テレNEWS NNN,“鍵開け”レスキュー商法で……「980円が10万円に」高額請求の実態　ネット検索上位に“広告”表示【#みんなのギモン】,https://news.yahoo.co.jp/articles/1d459f34432bf1c6b148beb567527e8da44fb85c,11/16(土) 8:02
2024-11-17,08:06,domestic,国内,15,東海テレビ,81歳の県議が運転する車が軽乗用車と衝突 軽の後部座席にいた40歳男性が死亡 その妻と5歳の息子もケガ,https://news.yahoo.co.jp/articles/4d47a5d10c47d2f1e78dafafd8b2dc45c7774512,11/10(日) 7:00
2024-11-17,08:06,domestic,国内,16,日本ファクトチェックセンター,斎藤前兵庫県知事はパワハラしていない？ 職員の4割が見聞き、本人は厳しい叱責など認めて「必要な指導」【ファクトチェック】,https://news.yahoo.co.jp/articles/5976ed02c65aef5cb3ef0eb1d4100f3449d906d2,11/15(金) 17:18
2024-11-17,08:06,domestic,国内,17,MRO北陸放送,ホテルで20代女性をめった刺しにし写真撮影 今後も殺してしまう可能性「高い」 55歳男が30年前から抱える“殺人願望”「後悔というのは無い」,https://news.yahoo.co.jp/articles/7d18750c1f7857254626f62434ad838559db39b1,11/12(火) 20:48
2024-11-17,08:06,domestic,国内,18,朝日新聞デジタル,殺害から25年、妻がくれた「奇跡の出会い」　新たな家族と願う解決,https://news.yahoo.co.jp/articles/383477dca9ca483f909309c51e263584b8efd890,11/14(木) 16:36
2024-11-17,08:06,domestic,国内,19,朝日新聞デジタル,会食写真「これ俺だ」　馬毛島に迫った中国企業幹部に桜田元五輪相は,https://news.yahoo.co.jp/articles/6b4d69df4e24759e741909006ef56764cc834519,11/17(日) 7:00
2024-11-17,08:06,domestic,国内,20,CBCテレビ,「腎臓」一度悪くなったら元に戻らず…健康診断の数値のポイントと「腎臓」を労わる方法,https://news.yahoo.co.jp/articles/f5c7f78f4a79112f0fa94652aa22961e10a1ab3f,11/17(日) 7:10
2024-11-17,08:06,domestic,国内,21,読売新聞オンライン,トランプ氏、石破首相との会談を見送り…就任まで外国首脳に会わない方針で「例外認めない」,https://news.yahoo.co.jp/articles/31141ce6492cfa75de2f2a542b117056ce599bc8,11/16(土) 22:30
2024-11-17,08:06,domestic,国内,22,夕刊フジ,減税ド正論「財源論の前に国民の生存権だ」村上総務相に〝榛葉節〟炸裂　「103万円の壁」撤廃で税収減主張に「取り過ぎた税金を国民へ返す」,https://news.yahoo.co.jp/articles/3de6f41d85b744179332231be4e4c6542b26e49c,11/16(土) 17:00
2024-11-17,08:06,domestic,国内,23,tenki.jp,明日18日は真冬並みの寒気が流れ込み　北海道は平地でも積雪の恐れ　関東北部も雪か,https://news.yahoo.co.jp/articles/7ea20dd5bebd8bbd9a51f3b9d6a63c295c5bf6e9,11/17(日) 7:06
2024-11-17,08:06,domestic,国内,24,スポニチアネックス,菊間千乃弁護士　国民・玉木代表のスキャンダルに「報道が衆院選前に出てたら結果は変わってたんだろうな」,https://news.yahoo.co.jp/articles/2b51a3d665ea6aa5e9654294d286ba2f3f015525,11/12(火) 15:36
2024-11-17,08:06,domestic,国内,25,弁護士ドットコムニュース,電動キックボード「LUUP」の「交通違反」目撃続出　運営会社は「見つけたら警察に通報を」,https://news.yahoo.co.jp/articles/12e920467b8edc47e786d9ef174d28fb566227ac,11/16(土) 9:19
2024-11-17,08:06,domestic,国内,26,スポーツ報知,斎藤元彦前知事「改革を止めるわけにはいかない」街頭演説会でアンコールに応える…兵庫県知事選１７日投開票,https://news.yahoo.co.jp/articles/283b230dc3c055e5bf9f530c911688790bf59e73,11/17(日) 7:30
2024-11-17,08:06,domestic,国内,27,毎日新聞,百合子さまの「お舟入」と「拝訣」　三笠宮邸で喪主の彬子さまら参列,https://news.yahoo.co.jp/articles/cf893fb4e3bc94f1552f5b53105feb035d1b9369,11/16(土) 20:12
2024-11-17,08:06,domestic,国内,28,日刊スポーツ,【ひふみんEYE】棋士70年で初めて見た　藤井聡太竜王が「軽視」した佐々木勇気八段の指し回し,https://news.yahoo.co.jp/articles/307244dbd290c73bbdda1cce632297b033b29713,11/16(土) 18:02
2024-11-17,08:06,domestic,国内,29,デイリースポーツ,石破首相　トランプ氏と電話わずか５分→祝勝パーティーで大騒ぎの最中だった　橋下氏「普通ドンチャン騒ぎに電話します？」　小野寺氏「配慮し早めに戻っていただいたと」,https://news.yahoo.co.jp/articles/5d3b06d819b5486d8379f1bb86bc092592a51c64,11/10(日) 8:54
2024-11-17,08:06,domestic,国内,30,共同通信,百合子さま「御舟入」　孫の彬子さまら親族参列,https://news.yahoo.co.jp/articles/90b9f53efc0eb332e562e7426edf51dce3a8d54f,11/16(土) 18:07
2024-11-17,08:06,domestic,国内,31,東海テレビ,前日には別の階の通路で焦げた紙見つかる…14階建てビルの6階男子トイレでゴミ箱等燃える 名古屋駅前の「名古屋ビルディング」,https://news.yahoo.co.jp/articles/4374298cee769fd604153ee054127417402d5729,11/17(日) 6:20
2024-11-17,08:06,domestic,国内,32,よろず～ニュース,斎藤元彦氏 兵庫県知事選最後の訴え 映画「ロッキー」に姿重ねる「ボコボコに」「勝たなければ意味が無い」,https://news.yahoo.co.jp/articles/6af45d8dca17059d65bd2bcdcc13c02937f11d56,11/16(土) 20:50
2024-11-17,08:06,domestic,国内,33,産経新聞,楓ちゃん事件、20年目の捜査秘話　事件報じる新聞を配った犯人の「勘違い」と刑事の執念,https://news.yahoo.co.jp/articles/e056d17f991c37c0ed772b9b8d9ea573c49c96ac,11/16(土) 19:03
2024-11-17,08:06,domestic,国内,34,産経新聞,兵庫県知事選　最後まで多くの聴衆あふれる　SNSには注意呼び掛ける書き込みも,https://news.yahoo.co.jp/articles/dc1205fab060d3daca9611559be51c37fb9e0771,11/16(土) 21:50
2024-11-17,08:06,domestic,国内,35,東海テレビ,「ボンと音がして車から火が…」ワンボックスカーが燃え後部座席付近から身元不明の1人の遺体発見,https://news.yahoo.co.jp/articles/2174b67147212c512374edaa32e697129e9a51aa,11/16(土) 22:11
2024-11-17,08:06,domestic,国内,36,東海テレビ,高速道路の橋の上に“無人の車” 持ち主が海に飛び込んだ可能性あり周辺捜索 黒い乗用車で事故等の形跡なし,https://news.yahoo.co.jp/articles/015724faa13f518e97b61e0ed9abc128cdb0a94d,11/15(金) 11:33
2024-11-17,08:06,domestic,国内,37,共同通信,小林薫元死刑囚最後まで謝罪なく　遺族「楓は戻ってこない」,https://news.yahoo.co.jp/articles/464a6a6b25c585a9b6c962f4e6746b589e1f7ec5,11/16(土) 16:59
2024-11-17,08:06,domestic,国内,38,日テレNEWS NNN,天皇皇后両陛下と上皇ご夫妻が相次いで三笠宮邸を訪問　百合子さまにお別れを告げる儀式の前に,https://news.yahoo.co.jp/articles/1b6557931e6a233bd03baf91eade6120b1c5dcc6,11/16(土) 16:40
2024-11-17,08:06,domestic,国内,39,メ〜テレ（名古屋テレビ）,バス運転手に「お前、降りろ」　カスハラで乗客35人が次のバスに乗り換えるはめに…業務妨害容疑で男逮捕,https://news.yahoo.co.jp/articles/560a4cfe4d0b1712bb718f677232ec3adc1574a4,11/14(木) 18:34
2024-11-17,08:06,domestic,国内,40,FNNプライムオンライン,なぜ1歳の娘まで…不倫相手の家から帰宅後に妻と娘を殺害した男が法廷で語った身勝手な動機「娘の顔が妻の顔に見え…」,https://news.yahoo.co.jp/articles/ca784a39636a7475f9c329d667c38ffc1c4312d2,11/10(日) 11:02
