scrp_date,scrp_time,genre_en,genre_jp,rank,media_jp,title,link,date_original
2024-03-18,20:14,TTL,総合,1,日刊スポーツ,ｍｉｗａが萩野公介氏と離婚　大学卒業と同時に武道館公演、13年から４年連続で紅白出場／略歴,https://news.yahoo.co.jp/articles/a4c2ab066c531295989b0c5401762f5143c96d3e,3/18(月) 12:38
2024-03-18,20:14,TTL,総合,2,J-CASTニュース,ライブ中下向いて携帯...「見る気無いなら外出ろや」　人気バンドボーカルの苦言に賛否「失礼で最悪」「曲が魅力ないから」,https://news.yahoo.co.jp/articles/7be652ba06acd41a239318b084162059a3da3f51,3/18(月) 15:08
2024-03-18,20:14,TTL,総合,3,TBS NEWS DIG Powered by JNN,ダルビッシュ有、12年のメジャー生活で経験した知られざる苦悩明かす「妬む人もいるんで、嫌味言ってきたりとか」,https://news.yahoo.co.jp/articles/57ef7ab80536639516772129492e99d9a38eca52,3/18(月) 17:02
2024-03-18,20:14,TTL,総合,4,産経新聞,将棋「ひふみん」加藤一二三氏の次女・美紀さん、仙台白百合女子大の学長に,https://news.yahoo.co.jp/articles/404ec95ace2e209f9392e524f7e27c2590895068,3/18(月) 11:35
2024-03-18,20:14,TTL,総合,5,日刊ゲンダイDIGITAL,天才子役と呼ばれた斉藤こず恵さんは3年前に22歳年下と“コロナ婚”「イケメンゆえ、最初は詐欺かと…」【あの人は今】,https://news.yahoo.co.jp/articles/e65705330ed9bb722f6ab28f9cc845b933c7d459,3/18(月) 9:06
2024-03-18,20:14,TTL,総合,6,デイリースポーツ,大谷の妻　大谷両親と試合観戦、左手薬指に指輪光る　打席に向かう夫に笑顔で拍手、中継カメラにも映る,https://news.yahoo.co.jp/articles/fd6441aa54f30e9354767d4ca2a1e318b8e71d8d,3/18(月) 18:55
2024-03-18,20:14,TTL,総合,7,ねとらぼ,ボクシング・ユース王者の坂間叶夢選手、20歳で逝去　『はじめの一歩』作者や那須川天心が追悼「誰よりも一生懸命だった」,https://news.yahoo.co.jp/articles/3af051344ff30785e8bcee7d9f2433423b59bb4e,3/18(月) 12:55
2024-03-18,20:14,TTL,総合,8,スポニチアネックス,【センバツ】近江・西山14Kの力投報われず…延長10回タイブレークまさかのサヨナラ暴投で幕,https://news.yahoo.co.jp/articles/326c4e37963a37bc5b0d5d9eded983ac399724f7,3/18(月) 18:53
2024-03-18,20:14,TTL,総合,9,スポニチアネックス,中村メイコさん　最期は夫・神津善行氏の腕の中で　「女優らしく、幕引きがしっかりしていた」,https://news.yahoo.co.jp/articles/78c034d2712a32c991421c896f61e5a99def5670,3/18(月) 16:05
2024-03-18,20:14,TTL,総合,10,モデルプレス,千鳥・大悟の本名に注目集まる「意外」「初めて知った」,https://news.yahoo.co.jp/articles/f053877444fe7642f9bfb8b93dceaf66deb1a19e,3/18(月) 15:19
2024-03-18,20:14,TTL,総合,11,ファイナンシャルフィールド,新幹線で「窓側指定席」を予約したのに、「通路側」の人が「真ん中」の肘掛けを使っていました。この場合、「指定席代」を一部でも請求できるでしょうか…？,https://news.yahoo.co.jp/articles/dd6bc0910bbad21eed238fd472761492cc602192,3/18(月) 17:04
2024-03-18,20:14,TTL,総合,12,スポーツ報知,真美子夫人が大谷翔平の試合を現地観戦　韓国に夫婦で遠征中　テレビ中継で映し出される,https://news.yahoo.co.jp/articles/a1526c79b57fc1e0a751b77a82f37f49925e1c61,3/18(月) 18:54
2024-03-18,20:14,TTL,総合,13,モデルプレス,miwa＆五輪金メダリスト・萩野公介氏、離婚を発表,https://news.yahoo.co.jp/articles/5de46487e586b9c363a119a778d5ea74a0d682b7,3/18(月) 13:30
2024-03-18,20:14,TTL,総合,14,デイリースポーツ,大谷翔平の妻・真美子さん　左手薬指に指輪光る　試合前、宿泊先ロビーに姿　日テレ「ｅｖｅｒｙ．」がキャッチ,https://news.yahoo.co.jp/articles/72b20d019d3e16da10dcbb823ce6d361baf2d96f,3/18(月) 18:11
2024-03-18,20:14,TTL,総合,15,毎日新聞,ダルビッシュ、ファン経営のカフェを突然訪問　店主「叫びました」,https://news.yahoo.co.jp/articles/dd7b2a7c56286df3588fe105398f1131400bb2cc,3/18(月) 17:47
2024-03-18,20:14,TTL,総合,16,MBSニュース,ユーカリ植樹に賛否　町の狙いは『放置される森林を買い取り...早く育つユーカリ植えて建材や燃料に』一方で住民は『全国で杉やヒノキは失敗』『生態系への影響は？』,https://news.yahoo.co.jp/articles/a49e079481c29e178509eb60b229a61fca0bc790,3/18(月) 14:43
2024-03-18,20:14,TTL,総合,17,西スポWEB OTTO！,SNS騒然!!プロ最強右腕を〝完コピ〟九州王者エースが徹底研究で作り上げたフォームに「あまりにも…」「びっくりした」などの声,https://news.yahoo.co.jp/articles/cb3a3563353333f0516320df7352e41e8872ccf1,3/18(月) 16:50
2024-03-18,20:14,TTL,総合,18,Full-Count,食事会なのに…大谷翔平の食べ物が「流石すぎる」　“違和感ある”食卓にネット騒然,https://news.yahoo.co.jp/articles/407fb2c830747473db72df339c0873b4492d122f,3/18(月) 19:07
2024-03-18,20:14,TTL,総合,19,ENCOUNT,『不適切にも』クレームが「全然来ない」　絶大な“テロップ効果”に番組Pも驚き「今までも出しておけば」,https://news.yahoo.co.jp/articles/c1edba5816acb52ebfed854960f0700f57061acd,3/18(月) 10:40
2024-03-18,20:14,TTL,総合,20,ハフポスト日本版,結婚式でおしゃれな料理の演出？⇒フタを開けたら大爆笑「めちゃめちゃセンス良い」の声,https://news.yahoo.co.jp/articles/586c173ea2a6311e1983d5ed0bb55dec932cf0d0,3/18(月) 17:32
2024-03-18,20:14,TTL,総合,21,WANI BOOKS NewsCrunch,1571年「日本人奴隷の買い付け禁止令」が出されたほどの悲惨な歴史,https://news.yahoo.co.jp/articles/60cb48642f23eb120c3c35566a86bb7cd20761a3,3/18(月) 12:02
2024-03-18,20:14,TTL,総合,22,イーファイト,【訃報】”期待のボクサー”坂間叶夢が急死、前日計量に姿見せず体調不良で中止に！減量事故の問題点とは,https://news.yahoo.co.jp/articles/8a060b1e3069ac3d592fffe3abbe6b276fe01e54,3/18(月) 11:42
2024-03-18,20:14,TTL,総合,23,スポニチアネックス,二宮和也　両親の職業明かした　まさかの事実に中居正広も衝撃「えぇー!?」,https://news.yahoo.co.jp/articles/08ba229ef283806caf3156a532c7618969c4e73b,3/17(日) 22:00
2024-03-18,20:14,TTL,総合,24,モデルプレス,WEST.桐山照史、体調不良で「CDTVライブ！ライブ！」出演見合わせ,https://news.yahoo.co.jp/articles/d76db6b89d7a7882107aece88beed5bc1a8093fb,3/18(月) 17:19
2024-03-18,20:14,TTL,総合,25,スポーツ報知,韓国でのドジャース、パドレス戦は日曜なのに観客１万５０００人以下　球場外やグッズ店は大行列も,https://news.yahoo.co.jp/articles/3db21ae866006278a8ce98028a8a6916e9347bf7,3/17(日) 21:31
2024-03-18,20:14,TTL,総合,26,日刊スポーツ,大谷翔平の真美子夫人が大谷の両親、水原通訳夫人とスタンドから観戦　夫の打席を見つめる,https://news.yahoo.co.jp/articles/b9e7f549c9f46f8f24917f33d9ac6e3fec359c19,3/18(月) 19:42
2024-03-18,20:14,TTL,総合,27,東スポWEB,大谷翔平の妻・真美子さん　母・加代子さんらとともにドジャース vs 韓国代表をスタンド観戦,https://news.yahoo.co.jp/articles/1848cc71e65103aabe8324ccc288818c0aead846,3/18(月) 19:46
2024-03-18,20:14,TTL,総合,28,毎日新聞,「ブレイキングダウン」出場の28歳を強盗容疑で逮捕　警視庁,https://news.yahoo.co.jp/articles/fe200a81f0159af1d2d90a398228a55330032231,3/18(月) 17:40
2024-03-18,20:14,TTL,総合,29,くるまのニュース,超有名な日産「R34GT-R」が盗難!? 約3週間後に「無事発見！」 輸出間際の「コンテナ」で発見、盗難からの経緯とは,https://news.yahoo.co.jp/articles/7d7593f91c1373b56ba15a19fcae0e88e795dca4,3/18(月) 16:10
2024-03-18,20:14,TTL,総合,30,スポニチアネックス,大谷翔平の妻・真美子さんが球場入り　韓国代表戦を現地観戦　水原通訳の妻らとTV中継カメラに映る,https://news.yahoo.co.jp/articles/b47b6c4c757b5942573c2e390a64539fb01e9a41,3/18(月) 18:54
2024-03-18,20:14,TTL,総合,31,スポーツ報知,瀬戸大也、池江璃花子が本命種目でパリ切符獲得へ…内定第１号は誰の手に　競泳五輪代表選考会２日目,https://news.yahoo.co.jp/articles/ad3b3e78461eafd1ab1015e143bc324d3c6292bb,3/18(月) 17:41
2024-03-18,20:14,TTL,総合,32,スポニチアネックス,【センバツ】春夏初出場の熊本国府　近江に10回“歴史的”サヨナラ1勝　第1日2戦タイブレークは史上初,https://news.yahoo.co.jp/articles/958a8f72feb37eec4348cbf21b609c5b028f012b,3/18(月) 18:38
2024-03-18,20:14,TTL,総合,33,ゴルフ総合サイト ALBA Net,ネット配信などでJLPGAが“5億超”の黒字化　小林浩美会長「選手らの頑張りの成果」,https://news.yahoo.co.jp/articles/911d859951bcc07e8acc0671adbf83162192d0c0,3/18(月) 17:00
2024-03-18,20:14,TTL,総合,34,ファイナンシャルフィールド,風呂もトイレも「使う時だけ」換気扇を点ける夫。湿気や匂いが嫌なのでずっと点けていたいのですが、電気代がかさむでしょうか？,https://news.yahoo.co.jp/articles/8e3f05f65ef6492d0e05dc5c6923531fd69634f2,3/18(月) 16:50
2024-03-18,20:14,TTL,総合,35,夕刊フジ,心筋梗塞・脳梗塞など血管系の突然死には…睡眠不足による疲労蓄積の共通点　ただ長く寝ればいいわけではない,https://news.yahoo.co.jp/articles/ac758e737f1429ce7c9c6beedd51d9936da6ca50,3/18(月) 17:00
2024-03-18,20:14,TTL,総合,36,読売新聞オンライン,ラリードライバーの篠塚建次郎さん死去、７５歳…「パリダカ」で日本人初の総合優勝,https://news.yahoo.co.jp/articles/4ff4264c548aeaf39ed3eaae5cbe6adb585c4594,3/18(月) 14:00
2024-03-18,20:14,TTL,総合,37,スポニチアネックス,荒れる春場所の主役、新入幕の尊富士が9連勝　三役初挑戦で小結の阿炎を一気に押し出す,https://news.yahoo.co.jp/articles/b1a6a8b988a95d5d89697f056320f1aebf075a0a,3/18(月) 17:45
2024-03-18,20:14,TTL,総合,38,TBS NEWS DIG Powered by JNN,東京都、神奈川県で最大震度2の地震　東京都・東京練馬区、神奈川県・横浜鶴見区、横浜神奈川区,https://news.yahoo.co.jp/articles/4728728068cc0ac9a3256aac4b2b24a5e3dea9f5,3/18(月) 18:54
2024-03-18,20:14,TTL,総合,39,東スポWEB,韓国選手が凱旋試合で明暗　大谷翔平への〝故意死球発言〟で炎上投手は２ラン被弾,https://news.yahoo.co.jp/articles/31e332005da1d3112ec2296528403b43e7814a81,3/18(月) 16:56
2024-03-18,20:14,TTL,総合,40,Full-Count,12球団トップの「16.2」…巨人23歳の超美技が「完璧です」　異次元守備に「GG期待」,https://news.yahoo.co.jp/articles/676f38bfbc672cee8e42ff1573eef45ec0396e23,3/18(月) 17:59
