scrp_date,scrp_time,genre_en,genre_jp,rank,media_jp,title,link,date_original
2024-01-20,11:29,life,ライフ,1,LIMO,ブックオフでなんとなく手にした漫画　「挟まっていた紙」に思わず目を疑う,https://news.yahoo.co.jp/articles/8e1b19ce90c073dfe7efcc897c35a559057ea7de,1/20(土) 5:17
2024-01-20,11:29,life,ライフ,2,ほ・とせなNEWS,深夜に吐き続ける1歳の息子　困っていると夫がやってきて…「ありがとうの気持ちでいっぱいです」,https://news.yahoo.co.jp/articles/29cacb626c609123332169c692fd73848aafbdee,1/20(土) 10:30
2024-01-20,11:29,life,ライフ,3,弁護士ドットコムニュース,デキちゃった…伝えたら「認知しない、養育費も払わない」　元カレに責任とらせるには？,https://news.yahoo.co.jp/articles/97b583adbea9ab5faf6f8048c3d7ac9fc174b74f,1/20(土) 8:51
2024-01-20,11:29,life,ライフ,4,Hint-Pot,日本で「不親切な人には一人も会っていません」　米国のベビーカー夫婦、初訪日前の「緊張」吹き飛んだおもてなし精神,https://news.yahoo.co.jp/articles/d8eac75838946d7c3689ef2b7c19ccfbf62a0164,1/20(土) 8:10
2024-01-20,11:29,life,ライフ,5,ねとらぼ,双子赤ちゃんとパパがお返事練習をはじめたら……コントのようなオチに！　180万再生された姿に「1時間見られるｗ」「可愛すぎんか？」,https://news.yahoo.co.jp/articles/67ad6d54154f213034e4d07c5a065c18d65e9aa6,1/20(土) 10:00
2024-01-20,11:29,life,ライフ,6,ねとらぼ,2歳やしゃご、大好きな94歳高祖母を探しとった行動が涙を誘う　「こんな幸せな日常ある？」「うるっときた」,https://news.yahoo.co.jp/articles/693cb367840749e823adaf7057f23ede3ab9998a,1/20(土) 8:30
2024-01-20,11:29,life,ライフ,7,ねとらぼ,巨大深海魚のぶっとい毒針に刺され5時間後、体がとんでもないことに……　衝撃の経過報告に「死なないで」,https://news.yahoo.co.jp/articles/89933db31f1942797e295c126f7e902ca5b1ff50,1/18(木) 22:05
2024-01-20,11:29,life,ライフ,8,まいどなニュース,警視庁が伝授…「折るだけで、お菓子袋を閉じる方法」に大反響　「素晴らしいアイディア」「覚えればすぐできそう」,https://news.yahoo.co.jp/articles/d6e4788623fc372e100c2af3cfdd734e3f483b3d,1/20(土) 10:20
2024-01-20,11:29,life,ライフ,9,ハフポスト日本版,豆乳パックの正しい捨て方が「マジかよ…全く知らなかった」と話題。内側のアルミ箔がポイント,https://news.yahoo.co.jp/articles/f76aad78fc40aef8d15a023d2d09b5bd441ad09f,1/20(土) 9:33
2024-01-20,11:29,life,ライフ,10,LIMO,能登半島地震後、新潟県の海岸で発見された「漂流物」に思わず目を疑う 「自然の力は脅威ですね」,https://news.yahoo.co.jp/articles/2a92e0a1ad61fc00d03069b7459457dc6927be87,1/19(金) 6:37
2024-01-20,11:29,life,ライフ,11,LIMO,夫に「消しゴム貸して」と頼んだ妻　渡されたのは再現度が高すぎる「男児消しゴム」だった,https://news.yahoo.co.jp/articles/0a1a407ad173c81a2d8eaad301aad849a7c14460,1/19(金) 5:17
2024-01-20,11:29,life,ライフ,12,まいどなニュース,2歳の娘と母ではなく…「年の差72」　衝撃的な後ろ姿に「うそだろ！ 40代くらいに見える」「姿勢とスタイルですね」,https://news.yahoo.co.jp/articles/637482403ed5ca5e81b040b9f6005cdf53ea2afe,1/18(木) 7:40
2024-01-20,11:29,life,ライフ,13,産経新聞,正月の帰省　９０代母の膝痛吹き飛ばした３歳息子　～還暦パパの異次元子育て,https://news.yahoo.co.jp/articles/dbfc18eed704489255d027c9c2abac8d897278f3,1/20(土) 7:30
2024-01-20,11:29,life,ライフ,14,マイナビニュース,「定額減税4万円」で手取りはどのくらい増える? 収入や家族構成ごとにシミュレーションしてみた,https://news.yahoo.co.jp/articles/0891f4baf16512489f0e210cf73d12912ce7aefe,1/17(水) 12:11
2024-01-20,11:29,life,ライフ,15,オリコン,一見、普通のマンションでも…30代不動産マンが絶賛した間取りに反響、「すべてが理想」「契約したい」,https://news.yahoo.co.jp/articles/ac2d31058b3a684f11b2dc1ff9e22e7c55c69ff1,1/19(金) 16:00
2024-01-20,11:29,life,ライフ,16,日刊ゲンダイDIGITAL,「そいつ知ってる」「私も」ネット上で“元カノ”たちからボロクソに…シカゴ32歳男性が100億円訴訟,https://news.yahoo.co.jp/articles/149ce83c0aebb166b6f8de79216d111cf806494a,1/20(土) 9:06
2024-01-20,11:29,life,ライフ,17,ファイナンシャルフィールド,【極限の節約】30代独身の女です。人と会わないなら、お風呂って2日に1回で事足りますよね？ 毎日入った場合と比べて、どれだけ節約になりますか？,https://news.yahoo.co.jp/articles/015e255b68684b5d68116d1a176fb2670bb6a30c,1/19(金) 11:10
2024-01-20,11:29,life,ライフ,18,日刊ゲンダイDIGITAL,古村比呂さんは16回目の治療…がんの種類やタイプによっては「抗がん剤」で長生きできる【Dr.中川 がんサバイバーの知恵】,https://news.yahoo.co.jp/articles/91204ad5d225a73756f25de691b8713d3d7216e3,1/20(土) 9:06
2024-01-20,11:29,life,ライフ,19,読売新聞オンライン,【入試ルポ】校門前で弁当持たせ…大阪で熱気の中学入試　人気の四天王寺は約2・5倍　校長は「複数回入試難しい」,https://news.yahoo.co.jp/articles/e582475ea453313656043f104bf3e2ff36ebd150,1/20(土) 9:10
2024-01-20,11:29,life,ライフ,20,マイナビ子育て,北斗晶さん「雛人形が届くまでは…」溺愛する孫娘との別れの日が近づき「大丈夫じゃない」,https://news.yahoo.co.jp/articles/cdba47bd85a156d7b7a0cf6b2b6fa346d7f1db90,1/19(金) 12:10
2024-01-20,11:29,life,ライフ,21,オリコン,「早く二人きりになりたい…」「まだ20時だぞ」愛犬に誘われるじぃじ、ラブラブすぎる会話が150万回再生,https://news.yahoo.co.jp/articles/187998a0c5b1d715136f9b798acab98778723c01,1/18(木) 11:00
2024-01-20,11:29,life,ライフ,22,ねとらぼ,【2024福袋】16万円相当がはいったCOACH（コーチ）福袋の中身は？　アイテム詳細に「見ていて楽しかった」「参考にします」の声,https://news.yahoo.co.jp/articles/d7da56f8336f5e30de405bda4935b24f7995a53d,1/18(木) 20:00
2024-01-20,11:29,life,ライフ,23,ねとらぼ,【関東の男性が選ぶ】GMARCH・早慶上理ICU・日東駒専で「校舎がかっこいい大学」ランキング！　同率1位は「早稲田大学」とどこ？,https://news.yahoo.co.jp/articles/7f2ac3d39e92a719926fe56de6e6947c0f501e93,1/20(土) 7:20
2024-01-20,11:29,life,ライフ,24,まいどなニュース,ベビーカーの赤ちゃん、お店からこっそり持って帰ってきたものにママもびっくり！  「うちはキャベツ食べてた」体験談続々,https://news.yahoo.co.jp/articles/57be80c0bf9ef67e102f41d728fe16f2fc7ac426,1/18(木) 16:10
2024-01-20,11:29,life,ライフ,25,ダイヤモンド教育ラボ,実力に合わせたレベル分けと4つの「受験型」から考える私立文系大学の受験校の決め方,https://news.yahoo.co.jp/articles/9466d28d95e65eb3e1369522121398b4257bcb7f,1/20(土) 10:03
2024-01-20,11:29,life,ライフ,26,ねとらぼ,なぜホワイトボード用クリーナーは“ミルフィーユ状”？　意外な理由に「そういう模様だと思ってた」と反響,https://news.yahoo.co.jp/articles/681c70d8dea8cb7f83431e5674275e709c042b0f,1/20(土) 8:15
2024-01-20,11:29,life,ライフ,27,FNNプライムオンライン,「勉強より野球」阪神ファン10歳男児が快挙!合格率17％宅建で史上最年少合格　勉強スケジュールは父作成　大阪市,https://news.yahoo.co.jp/articles/cec2eaa753000281873dfcc7d65c7a007d3305cd,1/20(土) 10:32
2024-01-20,11:29,life,ライフ,28,まいどなニュース,丸太が動かない…「大丈夫ですか？」警官を救った運送会社社長「能登地震救援行けなかった自分にできること」,https://news.yahoo.co.jp/articles/c3399a7da63e746c2a458b802094b3356882be3d,1/19(金) 6:40
2024-01-20,11:29,life,ライフ,29,ねとらぼ,寝起きの赤ちゃん、ママへの予想外の行動に「人間何回目？」「声出して笑った」　170万再生されたオチがかわいい,https://news.yahoo.co.jp/articles/5889e2ad78f049f7f9c58e5df48f4c01e69b6d23,1/19(金) 8:30
2024-01-20,11:29,life,ライフ,30,食べログマガジン,スイーツのプロも通う！ ショートケーキがおいしいパティスリー5選,https://news.yahoo.co.jp/articles/80e196e470025b10d4249ba38f0de4ab270acbb1,1/19(金) 6:30
2024-01-20,11:29,life,ライフ,31,＆GP,キーンの防水ソックスは履き心地も防水性もバッチリ！ってかこれスゴくない!?,https://news.yahoo.co.jp/articles/9392c751aee1faff50ec990d5313c1657e5322e1,1/20(土) 8:04
2024-01-20,11:29,life,ライフ,32,よろず～ニュース,あれ？5個入りだったはず…フジパン「ネオレーズンバターロール」告知なし増量にSNS歓喜　経緯を聞いた,https://news.yahoo.co.jp/articles/d95375bb9b027b7a17fb11616acb1598c3e354d2,1/20(土) 7:50
2024-01-20,11:29,life,ライフ,33,LIMO,転職前に上司から渡されたTシャツに思わず目を疑う　強烈なセンスに驚きの声,https://news.yahoo.co.jp/articles/cb81549f20f0b85645b622f028a49fed5e432c3f,1/18(木) 5:17
2024-01-20,11:29,life,ライフ,34,まいどなニュース,「高校に行けない時期があって」心配そうに飼い主を見つめる柴犬…急逝した愛犬とのエピソードに感動「本当家族」「支えてくれたんだね」,https://news.yahoo.co.jp/articles/184b018b78f0604456b9442f6a85b64d4cdba998,1/19(金) 7:20
2024-01-20,11:29,life,ライフ,35,LASISA,2024年の開運【金運神社BEST5】5位「田無神社」4位「戸隠神社」3位「龍蛇神神社」、2位～1位は？,https://news.yahoo.co.jp/articles/173a4941f09a306765bfa4b25241f4ffbf8adac3,1/19(金) 19:40
2024-01-20,11:29,life,ライフ,36,ねとらぼ,3800円が300円に!?　ウキウキで買った見切り品のおせちに「どんまい」「薄味で身体にはいいはず」,https://news.yahoo.co.jp/articles/e500d70939654e38fcb40713f75efb217158e23f,1/19(金) 20:15
2024-01-20,11:29,life,ライフ,37,LIMO,紀ノ国屋の可愛すぎる「苺スイーツバッグ」5151件のリポスト！ ギフトにも,https://news.yahoo.co.jp/articles/f64e196695d158e695dea360791622abddcedcd9,1/20(土) 10:47
2024-01-20,11:29,life,ライフ,38,産経新聞,残業削減必要も地域医療に影響　医師の働き方改革、現場の苦悩,https://news.yahoo.co.jp/articles/9d7a429e6593af7176d661823038fff7db102148,1/20(土) 10:00
2024-01-20,11:29,life,ライフ,39,LIMO,COACHの福袋で入手した「千年パズル」のようなポーチ　斜め上を行く使い道に目を疑う,https://news.yahoo.co.jp/articles/5ffdb9a0d4fadcfd7b214e73e79682163ee8d9be,1/13(土) 19:02
2024-01-20,11:29,life,ライフ,40,ねとらぼ,「神奈川県で人気のスーパー銭湯・温泉施設」ランキング！　2位は19室の貸切個室露天風呂などがある「箱根湯寮」、1位は？【2024年1月版】,https://news.yahoo.co.jp/articles/54d800b8b176960c636145171053d72b6a9e2891,1/20(土) 8:40
