scrp_date,scrp_time,genre_en,genre_jp,rank,media_jp,title,link,date_original
2024-12-30,13:08,domestic,国内,1,TBS NEWS DIG Powered by JNN,子ども3人が意識不明で搬送その後死亡　帰宅した父親が発見　一緒に搬送の母親から事情聴く　神奈川・海老名市,https://news.yahoo.co.jp/articles/eaa1df878ba14198c2aa2f3f2d07cfb41881d52c,12/30(月) 8:10
2024-12-30,13:08,domestic,国内,2,TBS NEWS DIG Powered by JNN,ジャニー氏による性加害問題 “補償の舞台裏”を取材　東山紀之社長「生前になぜ止められなかったのか」【報道の日2024】,https://news.yahoo.co.jp/articles/fea26a7e4f2d023771f59f475f95225ab9697002,12/29(日) 20:02
2024-12-30,13:08,domestic,国内,3,スポニチアネックス,韓国航空機事故　車輪降下装置不具合との関連は?専門家「聞いたことがない」,https://news.yahoo.co.jp/articles/be3da5ba356c27eb6694ddc2048ad513c2b5222e,12/30(月) 4:35
2024-12-30,13:08,domestic,国内,4,ABEMA TIMES,【独自取材】「アイツが殺したんだ！」八田容疑者を知る人々の“証言”から見えた事件の新事実 別府ひき逃げ事件,https://news.yahoo.co.jp/articles/a482a604fa3822daffc298ada4a758cc0565b042,12/30(月) 12:10
2024-12-30,13:08,domestic,国内,5,読売新聞オンライン,能登大雨で犠牲、中３女子の家族らが「１５歳の誕生日会」…おしゃれだった娘へプレゼントはディオールの化粧水,https://news.yahoo.co.jp/articles/970de0061ec3cc47d115361534a609b98219739a,12/30(月) 5:00
2024-12-30,13:08,domestic,国内,6,共同通信,住宅で子ども3人死亡、神奈川　負傷搬送の母親から事情聴く,https://news.yahoo.co.jp/articles/b7466115285140d5857c9be9e862c8a6def30684,12/30(月) 6:21
2024-12-30,13:08,domestic,国内,7,神戸新聞NEXT,阪神・淡路の活断層に「割れ残り」　兵庫県南部、30年以内にＭ7.9の可能性「やや高い」　政府の地震本部,https://news.yahoo.co.jp/articles/086e84bdd132bd432bf7fb76d7ed073a435574c4,12/30(月) 9:00
2024-12-30,13:08,domestic,国内,8,読売新聞オンライン,新東名のトンネルで７台絡む玉突き事故、５人が軽傷…愛知・新城,https://news.yahoo.co.jp/articles/383054ec079ac3d1dae88520712fe75330f0d3ff,12/30(月) 11:39
2024-12-30,13:08,domestic,国内,9,信濃毎日新聞デジタル,「必要性が見えない…」住民から厳しい意見も　財政悪化した交通安全協会が合併断念し解散へ　地域を見守り54年「苦渋の選択」,https://news.yahoo.co.jp/articles/3d825823c855ad72d19845cc49a67ee559ca6d32,12/30(月) 12:07
2024-12-30,13:08,domestic,国内,10,朝日新聞デジタル,子ども3人死亡、頭に外傷　母もけが　帰宅の父発見　神奈川・海老名,https://news.yahoo.co.jp/articles/d4dc206c9c8c43f2c784e888ab81bd4faee0544e,12/30(月) 6:37
2024-12-30,13:08,domestic,国内,11,毎日新聞,「俺は地獄に行くから会えない」　妻と娘救えなかった罪悪感―残された家族守るため、思い出の地で再開した店　能登半島地震1年,https://news.yahoo.co.jp/articles/3b282b2e488dc35f1f1749ea933d95dde4e4b95f,12/29(日) 17:00
2024-12-30,13:08,domestic,国内,12,読売新聞オンライン,秋田新幹線、午前１０時半めどに運転再開の見通し…立ち往生車両の乗客５００人をタクシーなどで避難,https://news.yahoo.co.jp/articles/e27d22f5f1f3ecd82d48334c23d4d0cf16fa3857,12/30(月) 9:16
2024-12-30,13:08,domestic,国内,13,日テレNEWS NNN,【速報】消火剤まきながら渋谷スクランブル交差点を暴走か　男（29）と少年（15）を逮捕　警視庁,https://news.yahoo.co.jp/articles/aa88f5787f1bb2e09ee488a2a6f6482210d8c8a0,12/30(月) 9:42
2024-12-30,13:08,domestic,国内,14,ABEMA TIMES,何やってんだよ！ 人気レースのピットでまさかのアクシデント「落ちた！焦った！」僅か“4秒差”…大逆転劇の一部始終,https://news.yahoo.co.jp/articles/ae4d23f2648f93fdc37b626597681f48365188cb,12/30(月) 11:51
2024-12-30,13:08,domestic,国内,15,J-CASTニュース,韓国LCC、着陸失敗で死者120人超...2日前にはエンジントラブル、昨日は長崎に飛来,https://news.yahoo.co.jp/articles/9820695fe3ec707b50f152f8442cd57ffeaf0edb,12/29(日) 18:39
2024-12-30,13:08,domestic,国内,16,スポーツ報知,令和ロマン・高比良くるま　Ｍ－１連覇、漫才の傾向、成功人の「戦略」…初の著書「漫才過剰考察」は出し惜しみなし,https://news.yahoo.co.jp/articles/5dbb623abc723bc6ed47e03d709a5402ef0e8514,12/30(月) 12:00
2024-12-30,13:08,domestic,国内,17,日刊スポーツ,【韓国】120人超死亡の旅客機炎上「遺言すべきか」バードストライク伝える乗客とのやりとり判明,https://news.yahoo.co.jp/articles/dc9fac7ae2b75ecd145c0db207099287bc43daf9,12/29(日) 16:19
2024-12-30,13:08,domestic,国内,18,時事通信,民家で子ども3人死亡　母が自殺図る　神奈川県警,https://news.yahoo.co.jp/articles/87fee7c4dad0cfb6534cffba2d5ee9ef5144cfd3,12/30(月) 10:45
2024-12-30,13:08,domestic,国内,19,ABEMA TIMES,東京・江戸川区の住宅で火災 1人逃げ遅れか,https://news.yahoo.co.jp/articles/eb5bb3934c4d616da384778f7ec94688610813ab,12/30(月) 11:39
2024-12-30,13:08,domestic,国内,20,読売新聞オンライン,青い森鉄道で貨物列車が脱線、青森―八戸間で一部運転見合わせ,https://news.yahoo.co.jp/articles/fc20017a0d41049f395da64dca82741fea3f01ac,12/30(月) 10:09
2024-12-30,13:08,domestic,国内,21,スポニチアネックス,韓国航空機、大破炎上　同国史上最悪179人死亡　地元消防「バードストライク」原因指摘も…,https://news.yahoo.co.jp/articles/c923188fa03ba168420f9014b593861e1f9766c4,12/30(月) 4:35
2024-12-30,13:08,domestic,国内,22,日テレNEWS NNN,保育の質どうなる？ 76年ぶり基準改善も保育士不足深刻　スキマバイトの単発保育士も,https://news.yahoo.co.jp/articles/2898da607e9552efa6f1d0cddee578edf6543cc2,12/30(月) 9:00
2024-12-30,13:08,domestic,国内,23,日テレNEWS NNN,「頑張っても報われない」“隠れた貧困”にあえぐ子育て世帯　今必要な支援とは,https://news.yahoo.co.jp/articles/0964e848306877ba77f52c6be661a0433386e25d,12/29(日) 10:00
2024-12-30,13:08,domestic,国内,24,BUSINESS INSIDER JAPAN,年末年始って、銀行の休日はいつからいつまで？ 2024年冬季・主要銀行の「営業状況」まとめ,https://news.yahoo.co.jp/articles/d5dff66fb2db24cd427703c13ae9e58051bd3748,12/16(月) 20:00
2024-12-30,13:08,domestic,国内,25,ニュースイッチ,若手研究者のトップ10％論文割合25％へ…国際卓越大に東北大学、極めて高いKPI達成の勝算,https://news.yahoo.co.jp/articles/41b2155fcfa28d9d8a7ed409a0a2b6dd2371f5ae,12/30(月) 11:20
2024-12-30,13:08,domestic,国内,26,スポニチアネックス,韓国・チェジュ航空　代表が日本語声明を発表　務安国際空港での旅客機事故「最高経営責任者として…」,https://news.yahoo.co.jp/articles/e88d7351d3091b7a79aea011f552dffa47c94d35,12/30(月) 9:17
2024-12-30,13:08,domestic,国内,27,弁護士ドットコムニュース,「もし生きていれば成人式だった」 名古屋市いじめ自殺訴訟、遺族側は上告へ…努力家だった亡き娘への思い,https://news.yahoo.co.jp/articles/f10199aae41d8260d5412d8338ce6eea560e3885,12/30(月) 9:53
2024-12-30,13:08,domestic,国内,28,産経新聞,タクシーの順番めぐり男性殴ってけがさせる、容疑で21歳男逮捕　男性は搬送先病院で死亡,https://news.yahoo.co.jp/articles/8a7ecdf6c34b4bc5ad854c651b2399ecbbc4832e,12/29(日) 11:13
2024-12-30,13:08,domestic,国内,29,中日スポーツ,ひろゆきさん、“日本のいいところは？”問いから、出てきた「始発までファミレス体験」フォロワーも大共感「おー覚えがありますね」「楽しかったな」,https://news.yahoo.co.jp/articles/eca28f9f73d851423c260d1803aae67cad4239bb,12/30(月) 12:39
2024-12-30,13:08,domestic,国内,30,毎日新聞,電子マネー詐欺防止の「秘策」ダミー販売急停止　コンビニ側の言い分,https://news.yahoo.co.jp/articles/69dfc1f8cf75a780e438cdeee16472d0bb3cfa01,12/30(月) 11:00
2024-12-30,13:08,domestic,国内,31,時事通信,岩屋氏、中国の発表「不正確」　外相会談の歴史発言,https://news.yahoo.co.jp/articles/5985cad4d166fc6a8d47b297bbd529c968ec6b41,12/27(金) 19:14
2024-12-30,13:08,domestic,国内,32,読売新聞オンライン,羽田空港衝突事故、直前の機内では「問題なしね」「問題なしでーす」…ボイス・レコーダーの記録（抜粋）,https://news.yahoo.co.jp/articles/56c8ba3c7af1e1f6da4db629058b3669dc8edd28,12/25(水) 10:01
2024-12-30,13:08,domestic,国内,33,読売新聞オンライン,務安空港で炎上の旅客機、前日含め日本で何度も発着…ＬＣＣのチェジュ航空が日韓路線を積極就航,https://news.yahoo.co.jp/articles/8b888c91a0ed991a2d1dde7aa604a4d4b2a7b05d,12/29(日) 12:06
2024-12-30,13:08,domestic,国内,34,読売新聞オンライン,日航機操縦室内では衝撃音の後「小型機いましたね」…羽田空港衝突事故・ＣＶＲの記録から,https://news.yahoo.co.jp/articles/6df4c3c5fa67bcc602942bcba1df490fc755213b,12/25(水) 11:32
2024-12-30,13:08,domestic,国内,35,読売新聞オンライン,国民・玉木氏、役職停止中でも「一議員」として存在感…積極的な発信に「反省見えず」との声も,https://news.yahoo.co.jp/articles/ec1cfab3e361afd144ad229fc8429e403c671dab,12/30(月) 12:18
2024-12-30,13:08,domestic,国内,36,ABEMA TIMES,元不登校YouTuberゆたぼんはなぜ学校に？本人が語る現在地と背中を押したEXIT兼近大樹の言葉,https://news.yahoo.co.jp/articles/b17ff239cb47556d33a45dc7ce8972edd10cfe46,12/28(土) 12:02
2024-12-30,13:08,domestic,国内,37,時事通信,生かされた命、「家族の分も」　つらい日々、懸命に前へ　妻子4人亡くした大間さん・能登地震1年,https://news.yahoo.co.jp/articles/cecc6e09023625c7e8a13f522efce18fdb3c9587,12/27(金) 7:06
2024-12-30,13:08,domestic,国内,38,読売新聞オンライン,北九州市の中学生殺傷、容疑者の車から血痕の付いたナイフ押収…男子生徒の目撃情報と一致,https://news.yahoo.co.jp/articles/0fbaec58d0f10c33f4195b79057471a012742a90,12/30(月) 9:34
2024-12-30,13:08,domestic,国内,39,朝日新聞デジタル,JAL機炎上、大破免れ全員脱出につながる　重なった複数の要因,https://news.yahoo.co.jp/articles/2737e8cfa1945c24a1717c45d44a49fd156b9c21,12/25(水) 10:00
2024-12-30,13:08,domestic,国内,40,tenki.jp,2024年　日本も世界も過去最も気温が高い年に　記録を大幅更新,https://news.yahoo.co.jp/articles/a5389728662a3531cf063d442b6ccf09214c33a8,12/30(月) 12:17
