scrp_date,scrp_time,genre_en,genre_jp,rank,media_jp,title,link,date_original
2025-01-13,07:06,world,国際,1,CNN.co.jp,米ＬＡ山火事、高級住宅地パシフィック・パリセーズがほぼ完全に焼失　人工衛星画像,https://news.yahoo.co.jp/articles/cdcec0ce42a03670b0bf957eb795a5b1bd8a47a5,1/10(金) 16:38
2025-01-13,07:06,world,国際,2,中央日報日本語版,「ロスが燃えているのにスタイルばかり気にするのか」…アンカーの防火服に洗濯ばさみ,https://news.yahoo.co.jp/articles/2ba4ffc65f6cbe3bb79269b2b6e7c7dbe88c49c5,1/12(日) 12:21
2025-01-13,07:06,world,国際,3,共同通信,「ウクライナで暮らしたい」と北朝鮮兵捕虜,https://news.yahoo.co.jp/articles/c6a089792451f17e898e1fa8654a6733ed94705c,1/13(月) 5:13
2025-01-13,07:06,world,国際,4,BuzzFeed Japan,トランプ次期米大統領、隣国カナダをネタにする画像を投稿。ネット「まったく笑えない」,https://news.yahoo.co.jp/articles/f750f5253ce9a671b207d52916eb5bb3c0f2ecc2,1/13(月) 6:00
2025-01-13,07:06,world,国際,5,TBS NEWS DIG Powered by JNN,トランプ大統領 誕生へ 「アメリカ湾...なんて素晴らしい響きだ」エスカレートする発言と、身構える世界【サンデーモーニング】,https://news.yahoo.co.jp/articles/68e763f619c877f8d9ee5c1d51740a7eb00ee911,1/12(日) 16:32
2025-01-13,07:06,world,国際,6,ハンギョレ新聞,ウクライナ軍が捕虜にした北朝鮮軍兵士「戦争ではなく訓練と聞いてロシアにきた」,https://news.yahoo.co.jp/articles/41cdf12b21da68bb720f75b22cb9ada8afbbe3a4,1/13(月) 6:49
2025-01-13,07:06,world,国際,7,KOREA WAVE,韓国・弾劾反対集会で無料配布されたナゾの「水ご飯」…隠された「民俗信仰」の影に騒然,https://news.yahoo.co.jp/articles/a25b918ed485d7f2b652c8e14d0418013a6bfb20,1/13(月) 6:03
2025-01-13,07:06,world,国際,8,KOREA WAVE,「頭蓋骨の半分が失われ、左脳の95％が損傷」韓国の元客室乗務員、「勇敢な近況」報告,https://news.yahoo.co.jp/articles/385e3bbc70d6229d933ad8a08fd2406c9dd687b0,1/11(土) 7:03
2025-01-13,07:06,world,国際,9,朝日新聞デジタル,ロス山火事、死者16人に　1万2千世帯が被災、消火活動続く,https://news.yahoo.co.jp/articles/214002e8d52b4bec275bc31f9e4d4dbbcd1b7bf3,1/12(日) 14:34
2025-01-13,07:06,world,国際,10,中央日報日本語版,ウォン相場、１カ月で５．６％下落…主要２０カ国でロシア除き最大の下げ幅,https://news.yahoo.co.jp/articles/e5e93a1d0b65981588d3ea79edac7800a2f8264f,1/13(月) 6:39
2025-01-13,07:06,world,国際,11,共同通信,「ウクライナで暮らしたい」　北朝鮮兵捕虜の動画公開,https://news.yahoo.co.jp/articles/d8da5cd5161c143a9768ec7b44ce4c7afef89565,1/13(月) 5:09
2025-01-13,07:06,world,国際,12,朝鮮日報日本語版,年俸より出場機会　日本ではなく韓国を選ぶ大リーガーたち,https://news.yahoo.co.jp/articles/16ba378ffbe701836a525581b90719add672760b,1/12(日) 11:15
2025-01-13,07:06,world,国際,13,中央日報日本語版,＜チェジュ航空旅客機事故＞「機長のメーデー宣言後最後の４分間、フライトレコーダーに記録されていなかった」,https://news.yahoo.co.jp/articles/bd31d7052cbb26e469d13749f7e1744d96f3b779,1/12(日) 9:05
2025-01-13,07:06,world,国際,14,中央日報日本語版,ニューヨーク市民、地下鉄のホームで並ばずに壁にくっついて待つ,https://news.yahoo.co.jp/articles/e6f667a5db4e5a8792d0cec139094ecda8300588,1/9(木) 10:39
2025-01-13,07:06,world,国際,15,ABEMA TIMES,中国で急拡大「ヒトメタニューモウイルス」とは？専門家「珍しくないありふれたウイルス」平時に考える感染症対策,https://news.yahoo.co.jp/articles/e5e286a886893ff929dfe6ce5f4556675dc5d708,1/12(日) 20:02
2025-01-13,07:06,world,国際,16,CNN.co.jp,後部座席から相次ぎ生還、最近の墜落事故に見る航空安全上の教訓とは,https://news.yahoo.co.jp/articles/4c904baaef8a4d97ef71973a0f1c48a1eff1d8b1,1/12(日) 17:00
2025-01-13,07:06,world,国際,17,中央日報日本語版,ロスの山火事で自宅焼けたメル・ギブソンの憤怒…「税金は知事のヘアジェルにすべて使ったのか」,https://news.yahoo.co.jp/articles/3fd43ddf1992216db94b6523d1d63145ca53d03d,1/12(日) 11:11
2025-01-13,07:06,world,国際,18,テレビ朝日系（ANN）,「東の空を見たら真っ暗な煙が…」ロスの山火事で避難警告出された日本人を取材,https://news.yahoo.co.jp/articles/b848366fbbbc9bb587400bda438a88aa839d4cbf,1/12(日) 12:12
2025-01-13,07:06,world,国際,19,聯合ニュース,ウクライナが捕虜にした北朝鮮兵「相当数の兵が失われた」　韓国情報機関,https://news.yahoo.co.jp/articles/cb48f8f2a9a3c6fa54b89a0929d01409d8757001,1/12(日) 14:00
2025-01-13,07:06,world,国際,20,KOREA WAVE,「登録者83万人」韓国のフィットネスユーチューバー亡くなる…過去動画で「孤独」「後悔」吐露,https://news.yahoo.co.jp/articles/d5d54323b7f2427e3a2b1a6e60b81b3acbedae97,1/12(日) 18:03
2025-01-13,07:06,world,国際,21,共同通信,「司令官に訓練と言われた」と北朝鮮兵捕虜,https://news.yahoo.co.jp/articles/f4d2db186a1c243a88cb9b2fa9f4e03d54311b4c,1/13(月) 5:15
2025-01-13,07:06,world,国際,22,朝鮮日報日本語版,ウ軍「ロシア派遣の北朝鮮兵、『人間地雷探知機』として利用されている」,https://news.yahoo.co.jp/articles/d799f3eef0a2703ef99ee140093e09ec849ec3f1,1/11(土) 11:13
2025-01-13,07:06,world,国際,23,共同通信,北朝鮮兵の捕虜交換の用意とゼレンスキー氏,https://news.yahoo.co.jp/articles/5d8a14b5eab72fe6d8d0bc8dfbd18f78076f0db8,1/13(月) 5:03
2025-01-13,07:06,world,国際,24,CNN.co.jp,プロテインパウダーから鉛やカドミウム検出、植物性やオーガニック製品は数倍の含有量,https://news.yahoo.co.jp/articles/217fb4e2686bc0cd0527d5621d74be0ead6a1c5f,1/10(金) 12:18
2025-01-13,07:06,world,国際,25,共同通信,高齢者施設に空爆、1人死亡　ロシア軍、西部クルスク州で,https://news.yahoo.co.jp/articles/1fae6cd7c299ca5f8a3b989c3d241b6bb6ef3815,1/13(月) 5:08
2025-01-13,07:06,world,国際,26,KOREA WAVE,写真は華やかな「イチゴケーキ」、箱を開けると「詐欺レベル」…韓国・失望する消費者,https://news.yahoo.co.jp/articles/11871201a617057824be221d9ade50b30b696674,1/8(水) 5:03
2025-01-13,07:06,world,国際,27,朝日新聞デジタル,ロシア重油流出、「影響は数十年にも」　絶滅危惧種イルカの死体倍増,https://news.yahoo.co.jp/articles/2f59585b183f1495ca1ed116821ced904f54215f,1/12(日) 11:00
2025-01-13,07:06,world,国際,28,KOREA WAVE,韓国・事故の旅客機レコーダー、4分前から記録が保存されず…原因調査中,https://news.yahoo.co.jp/articles/43d3e70998e7677827a24c6dda70d7bcc18281a9,1/11(土) 15:22
2025-01-13,07:06,world,国際,29,毎日新聞,LA山火事、死者16人に　ゲティ美術館、UCLAにも延焼の恐れ,https://news.yahoo.co.jp/articles/ce0f761f51323367b4bdb37e5456e12d7cf32cb2,1/12(日) 14:01
2025-01-13,07:06,world,国際,30,時事通信,LA山火事、SNSに陰謀論　マスク氏同調、中傷も,https://news.yahoo.co.jp/articles/accefea206f4f279d9928b2e9f1e14fb2e947c7f,1/12(日) 7:03
2025-01-13,07:06,world,国際,31,BuzzFeed Japan,おむつ1枚の16歳少女を遺体で発見。傷害容疑で養母逮捕。「目をつぶってベルトで叩いた」と裁判記録も（アメリカ）,https://news.yahoo.co.jp/articles/6d7a2c2ce66225658dd8b461b777583788b2a933,1/10(金) 12:05
2025-01-13,07:06,world,国際,32,共同通信,ロサンゼルス山火事、16人行方不明,https://news.yahoo.co.jp/articles/94fdd3e37290d7dd4b3563c009498999f13f5f0d,1/13(月) 5:03
2025-01-13,07:06,world,国際,33,TBS NEWS DIG Powered by JNN,ゼレンスキー大統領、捕虜にした北朝鮮の兵士について「ロシアで捕らえられているウクライナ兵と交換できるなら、北朝鮮兵を金正恩に引き渡す用意がある」捕虜の交換に前向きな姿勢示す,https://news.yahoo.co.jp/articles/e40cb8d4c7e0392413e5aa44531572262373c8b9,1/13(月) 6:53
2025-01-13,07:06,world,国際,34,FNNプライムオンライン,北朝鮮「勝負の2025年」幕開けから際立った「ジュエ」氏…「金与正氏の子ども?ライバルにあらず」,https://news.yahoo.co.jp/articles/8a5eca1ffab689996acb11923c96743ba547ac36,1/12(日) 19:02
2025-01-13,07:06,world,国際,35,FNNプライムオンライン,数メートルの大波が海岸襲う　ボートが次々と転覆し25隻以上が被害…漁師100人以上が海に取り残される　街にも波が到達　ペルー,https://news.yahoo.co.jp/articles/37d803b0f3906df7949c488c3faae1909a9a93f6,1/11(土) 16:02
2025-01-13,07:06,world,国際,36,ロイター,「日米首脳会談へ地ならし」と岩屋外相、トランプ氏就任式に出席表明,https://news.yahoo.co.jp/articles/a66a72d58e9cf0e965a1cbb21eb19760a3760e9c,1/12(日) 10:36
2025-01-13,07:06,world,国際,37,読売新聞オンライン,ロサンゼルス山火事の死者１６人に、高級住宅街で鎮火の見通し立たず…１３人が行方不明との情報も,https://news.yahoo.co.jp/articles/ac41169ae10517e9e304a3571a14df0514549d10,1/12(日) 13:36
2025-01-13,07:06,world,国際,38,毎日新聞,LA山火事の焼け跡は「原爆後の広島のよう」　米キャスターが発言,https://news.yahoo.co.jp/articles/acadeeb04f699cc485e78e99711ec08584b2222b,1/12(日) 23:16
2025-01-13,07:06,world,国際,39,読売新聞オンライン,インドネシアの無料給食、石破首相が支援約束…新大統領の看板政策に米中も協力,https://news.yahoo.co.jp/articles/789d548d0eafaac100818967776e061a00b1e061,1/11(土) 21:36
2025-01-13,07:06,world,国際,40,KOREA WAVE,韓流トップ俳優、不動産で15億円の差益…老朽住宅取り壊し新築ビルに,https://news.yahoo.co.jp/articles/5d3fd10cc10d5cb8414046b2e1eed5b9c843675f,1/12(日) 14:03
