scrp_date,scrp_time,genre_en,genre_jp,rank,media_jp,title,link,date_original
2025-07-24,20:07,domestic,国内,1,日刊スポーツ,参政党さや氏の本名「公表できるはずがないだろ！」関係者が経緯説明「御主人が超有名人で…」,https://news.yahoo.co.jp/articles/337cc11d9e379820b5482604c91ab28cc34c7add,7/24(木) 10:24
2025-07-24,20:07,domestic,国内,2,MBC南日本放送,【トリプル台風に】台風7号、8号、そして9号発生「予想図が台風だらけ」気象庁の進路予想【雨・風シミュレーション〜8月3日（日）】台風のたまご=熱帯低気圧が発達【台風情報2025】,https://news.yahoo.co.jp/articles/a705cdd87f223660124a5c57e3815a12a36fdb38,7/24(木) 12:02
2025-07-24,20:07,domestic,国内,3,デイリースポーツ,橋下氏　小泉進次郎総理なら組める野党トップ１人「非常に親和性ある」　高市総理だと割れる党も　「いま自民党は誰が組めるか議論でグチャグチャ」,https://news.yahoo.co.jp/articles/b08f4a6f307bcb76e2f22279fae7f2e06e9c4409,7/24(木) 16:00
2025-07-24,20:07,domestic,国内,4,デイリースポーツ,【石破首相】ネット騒然「鈴木宗男さんがド正論ｗ」「娘は石破おろし」議員復活ムネオ氏ＶＳ娘鈴木貴子議員が激突　父「裏金責任取らん連中が石破さんに反発するな！」娘「潔い退陣を！」,https://news.yahoo.co.jp/articles/79fb2c20c8279a1de4764a2ee8c20cf793706434,7/24(木) 17:55
2025-07-24,20:07,domestic,国内,5,スポニチアネックス,田崎史郎氏「あれで麻生さんも岸田さんもカチンと」　2人を怒らせた石破首相の発言「包囲網はさらに…」,https://news.yahoo.co.jp/articles/00ec88a52de2b2ea3ce5e7cd40f675f9c69231f4,7/24(木) 16:58
2025-07-24,20:07,domestic,国内,6,日刊スポーツ,米山隆一氏、参政さや氏の本名公表めぐる投稿を削除、一部報道を完全否定したことを受けて,https://news.yahoo.co.jp/articles/d60adb160cc194f35aae947a7ad46bc072ac3d34,7/24(木) 13:58
2025-07-24,20:07,domestic,国内,7,中日スポーツ,田崎史郎さん、『元首相3人会談』の中身をポロリ…「麻生さんも岸田さんもカチーン」「話したじゃねえかと」実名漏らし苦笑い,https://news.yahoo.co.jp/articles/c2c8de5ab2fa1564e6512e3c3b3fcd669c8e855d,7/24(木) 15:42
2025-07-24,20:07,domestic,国内,8,日刊スポーツ,奈良市議へずまりゅう氏効果!?「中国人が日本へ旅行に来ない運動…本当なら大功績を残せそう」,https://news.yahoo.co.jp/articles/427f3ac2fef573980eda71616b15b5d9d49f1088,7/24(木) 17:39
2025-07-24,20:07,domestic,国内,9,日刊スポーツ,参政党・神谷宗幣代表が苦言、さや氏巡る一部報道に「私人である家族も巻き込んで…本当に悪質」,https://news.yahoo.co.jp/articles/62e14e59c55ffe4cd13bccd2ef2f87b8b924f233,7/24(木) 17:46
2025-07-24,20:07,domestic,国内,10,日刊スポーツ,クルド人問題抱える埼玉知事、参政党躍進の参院選に私見「国籍、民族にかかわらず治安維持必要」,https://news.yahoo.co.jp/articles/61cf98da49909546e1b2efc62c1316be4d4d36aa,7/24(木) 16:42
2025-07-24,20:07,domestic,国内,11,共同通信,泉房穂氏、立民会派入りへ　ラサール石井氏も,https://news.yahoo.co.jp/articles/6a67cece0d797ce6fcbbb02f573e458e43ac02f9,7/23(水) 20:08
2025-07-24,20:07,domestic,国内,12,毎日新聞,ガソリン暫定税率廃止法案成立へ　自民検討、8月の臨時国会で,https://news.yahoo.co.jp/articles/7eb87b6eeb82497bd46732f1416ffba43ec83488,7/23(水) 17:09
2025-07-24,20:07,domestic,国内,13,J-CASTニュース,学歴詐称疑惑の伊東市長「不自然な話」　卒業証書は偽物...「同級生」名乗る人物からの新たな投書に疑問示す,https://news.yahoo.co.jp/articles/9eeb930b4f515112f6768d96f136a804a1dee56f,7/24(木) 17:03
2025-07-24,20:07,domestic,国内,14,デイリースポーツ,参政党・さや氏、Ｘで「現在騒がれている報道に関して、一点だけはっきり申し上げます」,https://news.yahoo.co.jp/articles/46518a2f782bb2f5e08d51b8b6e3f5f4fca74a54,7/24(木) 16:17
2025-07-24,20:07,domestic,国内,15,デイリースポーツ,田崎史郎氏　自民総裁出馬を狙ってる「５人目」まさか大物の名前「ひるおび」観客もどよめく「ええーっ！？」　小泉・高市・林・小林に続く超ダークホース,https://news.yahoo.co.jp/articles/59a5f941676551b17bd3343787b705a7a5103b52,7/22(火) 16:32
2025-07-24,20:07,domestic,国内,16,日刊スポーツ,国民民主の初当選都議「当選無効の異議申し立て」は事実も「申し出の内容は事実無根」／発表全文,https://news.yahoo.co.jp/articles/04de5f46053e0404e88e2394f33f5649c2186b78,7/24(木) 16:57
2025-07-24,20:07,domestic,国内,17,日刊スポーツ,参政党さや氏「略奪婚」報道を完全否定　夫の名は否定せず「塩入さんが離婚された４年後に結婚」,https://news.yahoo.co.jp/articles/5f8a2333f8aef00ea017385f609ca4643f0c1870,7/24(木) 16:38
2025-07-24,20:07,domestic,国内,18,ABEMA TIMES,“参政党の憲法草案”に専門家「日本国憲法の方が100倍いい」「憲法に報道機関をこういう風に書くのは中国・北朝鮮、そういう非民主主義国家にしかない」,https://news.yahoo.co.jp/articles/64b34756a4587418294750e4a6544637edbae818,7/24(木) 19:24
2025-07-24,20:07,domestic,国内,19,弁護士JPニュース,学歴詐称疑惑の伊東市長「百条委員会」出頭を拒否すれば“刑罰”も？　「事ここに至っては…」元議員の弁護士が助言する“賢明な振る舞い”とは,https://news.yahoo.co.jp/articles/11a7479148482ea89e67d792033e7e0c96e81dbf,7/24(木) 9:50
2025-07-24,20:07,domestic,国内,20,FNNプライムオンライン,【混迷】首相経験者「カッコよく辞めるならきのうだった」　石破首相退陣否定も党内で“石破おろし”やまず　金子恵美さん「ご本人が言う“政治の停滞”招く」,https://news.yahoo.co.jp/articles/128b6ed03fc2cd6548da2875b2d5c5c7388ae4f2,7/24(木) 18:47
2025-07-24,20:07,domestic,国内,21,デイリースポーツ,小沢一郎氏、石破総理辞任しても「次の総裁は更にひどいのが出てくる」石破降ろしの声にも「一体どの口が」,https://news.yahoo.co.jp/articles/c29b90f3b944a2e085fe0852bd9466998f5f3373,7/24(木) 11:52
2025-07-24,20:07,domestic,国内,22,日刊スポーツ,生放送で公開ダメ出し→国民・玉木雄一郎代表と立民・小川淳也幹事長ダブル釈明「お言葉ですが」,https://news.yahoo.co.jp/articles/7a6a16fd3b96ad2522280888d93352fe35f39fa1,7/24(木) 13:46
2025-07-24,20:07,domestic,国内,23,デイリースポーツ,「Ｎｅｗｓ２３」石破首相が退陣報道に「もの凄く怒ってる」官邸筋情報あると伝える　元首相３氏とも進退話なし→小川彩佳アナ「それ、あり得るんでしょうか？麻生さんもいらっしゃる」,https://news.yahoo.co.jp/articles/906c05762f094ebf587723afe55701605d07df8e,7/24(木) 19:43
2025-07-24,20:07,domestic,国内,24,スポニチアネックス,本名公表の参政・さや氏　一部報道に「『略奪婚』などでは全くありません」「離婚された4年後に結婚」,https://news.yahoo.co.jp/articles/bf87b56b8a3975871db54af2eab48ce75e756fe7,7/24(木) 16:48
2025-07-24,20:07,domestic,国内,25,tenki.jp,福島県で39.3℃今年全国最高　北海道北見市39℃と観測史上1位　猛暑いつまで?,https://news.yahoo.co.jp/articles/8233ee3f60c908c4d05cb63c8510a468975ecc28,7/24(木) 15:04
2025-07-24,20:07,domestic,国内,26,スポニチアネックス,中林美恵子氏　日米関税交渉合意に各国から「よくやった。日本がうらやましい」の声が…懸念点も説明,https://news.yahoo.co.jp/articles/fa1536a44012a2552d9afb742565b7e43caac968,7/24(木) 16:02
2025-07-24,20:07,domestic,国内,27,共同通信,石破首相の進退巡り自民内に亀裂　旧安倍、茂木派が辞任圧力強める,https://news.yahoo.co.jp/articles/6a75afd4a588aee9ad31ac7735407c854199a81c,7/24(木) 18:52
2025-07-24,20:07,domestic,国内,28,ABEMA TIMES,参政党の支持層と批判層の議論が噛み合わないワケ…社会学者が指摘する“深刻なズレ”「支持者は子ども1人10万円くれるんだなど入り口政策を見ている」,https://news.yahoo.co.jp/articles/cb47d47609385c95ef23fbbcd19c0d44ff4c9f39,7/24(木) 11:52
2025-07-24,20:07,domestic,国内,29,TBS NEWS DIG Powered by JNN,「本当に取り返しのつかないことをしてしまった」温泉施設の個室で太ももや尻をマッサージ…県立高校の職員ら2人を懲戒処分　埼玉県教育委員会,https://news.yahoo.co.jp/articles/e4533f5de2a18258be477c961370a37c7303b269,7/24(木) 19:06
2025-07-24,20:07,domestic,国内,30,日刊スポーツ,ドワンゴ川上量生氏、NHK党１億5000万円出資の学生投資家を“説教”「政治資金規正法に」,https://news.yahoo.co.jp/articles/5b5502ad803f5353c90da5632c7c4c488db2ea9d,7/24(木) 11:00
2025-07-24,20:07,domestic,国内,31,J-CASTニュース,「誰も喜んでくれない」日本保守党・百田代表が参院選当選なのに「これも私の運命かと諦めて...」　支持者困惑,https://news.yahoo.co.jp/articles/df3c85891f0e432bdf16c2ce44fcafbb4b01ae4b,7/24(木) 18:15
2025-07-24,20:07,domestic,国内,32,日刊スポーツ,「本名公表」参政党さや氏の立候補めぐり場外戦!?関係者と評論家が激論「妄想もいい加減に」,https://news.yahoo.co.jp/articles/d0f8f75752c867336000cbf7db21e86a6ac1c644,7/24(木) 15:16
2025-07-24,20:07,domestic,国内,33,デイリースポーツ,田崎史郎氏　自民が新総裁に選ぶと政権失いかねない人物　全野党が反対・結束で首相阻止する可能性指摘　「この人にしてしまうと危うい」で野党共闘と,https://news.yahoo.co.jp/articles/c7f67bd4a8f98ac526ae31b642ad08422fe514e4,7/23(水) 11:34
2025-07-24,20:07,domestic,国内,34,ABEMA TIMES,参院選で巻き起こった参政党現象にジャーナリスト浜田敬子氏「意外と女性が支持」社会学者が指摘する財務省デモとの“共通点”,https://news.yahoo.co.jp/articles/2e528b690ab3524d6899dc0d8d987e2f231f5c15,7/24(木) 11:32
2025-07-24,20:07,domestic,国内,35,よろず～ニュース,「＃石破やめるな」に野村修也氏「混在している」意味を解説　ラサール石井は続投希望「辞めたら極右政権」,https://news.yahoo.co.jp/articles/d2c5ea21ebaef24b898eb37e0c8f04c63f885c12,7/24(木) 18:30
2025-07-24,20:07,domestic,国内,36,FNNプライムオンライン,石破総理”続投”に関西の「身内」からも不満　奈良県連「党刷新を」大阪府連会長「退陣要求を申し入れるべき」　”歴代総理”3人と会談も「続投認めていない」　高市氏や茂木氏”前総裁選出馬議員”も「石破おろし」の動きか,https://news.yahoo.co.jp/articles/55b7ae35b68a4d470a2dbf8208ae4446b59d8c39,7/24(木) 18:55
2025-07-24,20:07,domestic,国内,37,毎日新聞,参政党、神奈川新聞記者を会見から排除　抗議文は「見ていない」,https://news.yahoo.co.jp/articles/f87587c56e42735ca5911a98bff15ffaf11aa709,7/24(木) 18:30
2025-07-24,20:07,domestic,国内,38,日刊スポーツ,玉川徹氏の投票めぐる発言をアイドルがチクリ「まるで自分は利口な側にいるような言い振り」,https://news.yahoo.co.jp/articles/2afee3f891e9b2ef966a67bc51d7735a4b7c0551,7/23(水) 10:27
2025-07-24,20:07,domestic,国内,39,よろず～ニュース,小沢一郎氏が石破首相に〝逆エール〟「自民党の闇を暴露すれば歴史に残る総理に」退陣要求に「どの口が」,https://news.yahoo.co.jp/articles/2b84e347622041b5fdc9c347dedcbafb7ad4ebcf,7/24(木) 19:30
2025-07-24,20:07,domestic,国内,40,朝日新聞,ドローンで撮影中に突然の爆発的噴火　新燃岳の貴重な瞬間を間近で,https://news.yahoo.co.jp/articles/ac387cd59beb531f424618e5a3000f6778efcf73,7/24(木) 12:44
