scrp_date,scrp_time,genre_en,genre_jp,rank,media_jp,title,link,date_original
2025-12-08,09:34,sports,スポーツ,1,FITNESS LOVE,20歳「女子大生ビキニ選手」が作り上げた「若さ全開はつらつボディ」　新人戦の日本大会で2位　逆境乗り越え「メダルを獲れて良かった」,https://news.yahoo.co.jp/articles/7bc5cbc6243930d371491a7de521407e342f20fc,12/8(月) 4:10
2025-12-08,09:34,sports,スポーツ,2,ゴルフ総合サイト ALBA Net,松山英樹が3打差逆転で大会2勝目　プレーオフを制す「タイガーから『10アンダーを出してこい』と」,https://news.yahoo.co.jp/articles/c6d92bf7a6a105d9e2950b580a2f2ef6d250671f,12/8(月) 6:41
2025-12-08,09:34,sports,スポーツ,3,ゴルフダイジェスト・オンライン（GDO）,「お酒を飲みたい」ウィニングショットに自画自賛／松山英樹の一問一答,https://news.yahoo.co.jp/articles/41cb9ee4df86f8cff3027d5f220af7cb960c6119,12/8(月) 8:44
2025-12-08,09:34,sports,スポーツ,4,西スポWEB OTTO！,美大卒、元公務員...覆面女性レスラー〝素顔公開〟ショットに反響「雪の妖精ですか」「好きになったらどうするの〜」「ちょっとー。ええやん」,https://news.yahoo.co.jp/articles/cefd89d0d38fa8863a624c626981175204351757,12/8(月) 5:40
2025-12-08,09:34,sports,スポーツ,5,デイリースポーツ,岡本和真の獲得にブルージェイズ動く　「三塁が主なポジションになるだろう」米情報サイト報じる,https://news.yahoo.co.jp/articles/abe0e38be0e9b810b334fe7803330de33b06add9,12/8(月) 2:00
2025-12-08,09:34,sports,スポーツ,6,RONSPO,「そんなバカなことがあるのか」角田裕毅がノリスとの“バトル”でペナルティを受け裁定に「不可解」と不服…フェルスタッペン逆転Vを援護できずラストランは不完全燃焼の14位,https://news.yahoo.co.jp/articles/8c110ee08f57a781142ed12bee8148a90b465ead,12/8(月) 6:00
2025-12-08,09:34,sports,スポーツ,7,Full-Count,バッグ投げつけ激怒「絶対にやらない！」　破られた2つの“約束”…人生唯一の保留の真相,https://news.yahoo.co.jp/articles/bf38703d8f5a1f46ab78669ec8d7023d11a9a3fc,12/8(月) 6:30
2025-12-08,09:34,sports,スポーツ,8,日刊スポーツ,【阪神】佐藤輝明「次世代の最強打者候補」に挙げたのは？「パワーがすごい。森下みたいな…」,https://news.yahoo.co.jp/articles/208b17cc80a2bfabc7d0d96d2bb986e1546d5419,12/8(月) 6:55
2025-12-08,09:34,sports,スポーツ,9,Full-Count,異国で無双する巨人19歳「なんで入んだよ」　軽々フェンス奥まで…SNS騒然「岡本の後釜」,https://news.yahoo.co.jp/articles/a31cb8b507ef4bcaa61322c6d52bf4cd810184fc,12/8(月) 7:55
2025-12-08,09:34,sports,スポーツ,10,CoCoKARAnext,対峙した仏選手が「気の毒に思う」と同情　張本智和への“敵視ムード”に中国メディアは異論「一種の名誉。前向きに受け止めるべき」,https://news.yahoo.co.jp/articles/26fb2d893676a0a7acca116e23e8a9f8ecccb981,12/8(月) 5:30
2025-12-08,09:34,sports,スポーツ,11,東スポWEB,【Ｆ１】角田裕毅〝ラストラン〟での厳格裁定が大論争「ノリスはなぜ処罰免れたのか」,https://news.yahoo.co.jp/articles/797586448188b05b1807e7153cf3cfde177ee673,12/8(月) 5:15
2025-12-08,09:34,sports,スポーツ,12,ゴルフダイジェスト・オンライン（GDO）,【速報】5時間超の中断挟み渋野日向子ら第3ラウンド再開　最終予選会は72ホールの短縮競技に,https://news.yahoo.co.jp/articles/539168cc42b614da8625a6151efd9974cd6fd5a8,12/8(月) 5:30
2025-12-08,09:34,sports,スポーツ,13,東スポWEB,井上尚弥にピカソは勝てるのか？　亀田大毅氏が断言「無理です。１００回やって１回も勝てん」,https://news.yahoo.co.jp/articles/a424891488f71f517ad12d98c5e214039de97c78,12/8(月) 5:15
2025-12-08,09:34,sports,スポーツ,14,ENCOUNT,関東最大級ギャングの元ボスは「誇れる話でもない」　高校生で年収5000万も「前面には出したくない」,https://news.yahoo.co.jp/articles/3fe44cd1b88e3f82e88a34bdabf8b197edb0ba2d,12/8(月) 8:40
2025-12-08,09:34,sports,スポーツ,15,デイリースポーツ,カーリング女子　日本代表フォルティウスが大接戦制し無傷の３連勝　スキップ吉村が最終投で鮮やかなテークアウト,https://news.yahoo.co.jp/articles/62c93c04efc3327b4f4533524210710ee28d540e,12/8(月) 5:36
2025-12-08,09:34,sports,スポーツ,16,スポーツ報知,川崎が岡山守護神 ・ブローダーセン獲りへ　ＧＫ鄭退団、安藤引退で白羽の矢,https://news.yahoo.co.jp/articles/b57e95d6848f497c3ef73b0c2a94b33e7cbaa68c,12/8(月) 1:00
2025-12-08,09:34,sports,スポーツ,17,ゴルフ総合サイト ALBA Net,「生きているだけでこんなにお金がかかるんだ…」小祝さくら、“長期離脱中”の生活は？,https://news.yahoo.co.jp/articles/ee7242f767a9a8754102fd957a19f3aff0abca92,12/8(月) 7:03
2025-12-08,09:34,sports,スポーツ,18,Full-Count,ベッツ放出がもたらした“悪夢”　明暗分けた567億円…際立つド軍フロントとの違い,https://news.yahoo.co.jp/articles/ba399fc4173e1c299bf6dadc20a436f2303f6d34,12/7(日) 19:24
2025-12-08,09:34,sports,スポーツ,19,日刊スポーツ,【カーリング】負傷発生も日本代表フォルティウス３連勝“緊急登板”小林未奈「寝られなかった」,https://news.yahoo.co.jp/articles/d37fedcc75c2afd503c514d60c964bce0fbae1a3,12/8(月) 6:20
2025-12-08,09:34,sports,スポーツ,20,スポニチアネックス,J1昇格の水戸に激震　“功労者”西村GMが退任…“立役者”森監督は強化責任者へ　新監督に樹森氏濃厚,https://news.yahoo.co.jp/articles/76860edcf5bbfdea5a7e95b27ec5f59cdf70528c,12/8(月) 0:00
2025-12-08,09:34,sports,スポーツ,21,GOAL,終盤にグエイが決勝弾！鎌田大地フル出場のクリスタル・パレス、敵地でフラムに競り勝ち2連勝,https://news.yahoo.co.jp/articles/78595decc7f60b7096b4b99b32436208ea9bfe07,12/8(月) 3:26
2025-12-08,09:34,sports,スポーツ,22,東スポWEB,ドジャース〝スクバル強奪プラン〟始動　タイガース＆ボラス氏は「若手５人」「由伸超え」要求か,https://news.yahoo.co.jp/articles/cd581adb53ec36ec1d23c5c096396f3ac509366a,12/8(月) 5:15
2025-12-08,09:34,sports,スポーツ,23,スポニチアネックス,川崎F　福岡MF紺野＆岡山GKブローダーセンの獲得が決定的に,https://news.yahoo.co.jp/articles/e4fe0cba5de8e335631893d4d1b9b53b371c77ad,12/8(月) 2:00
2025-12-08,09:34,sports,スポーツ,24,Full-Count,現役引退→監督就任も「選手が来ない」　困難な運営…直面した現実「休止にすれば」,https://news.yahoo.co.jp/articles/667a1a5f355d5dd767c7dbf59f8674166c82c26d,12/8(月) 6:50
2025-12-08,09:34,sports,スポーツ,25,スポニチアネックス,「なぜ放出？」マリナーズファンほぼ全員が失望　ドラ1の有望株捕手フォードを防御率4.48左腕と交換,https://news.yahoo.co.jp/articles/87e812c6cc22a1d45973f8faa6b3777213f36381,12/8(月) 8:07
2025-12-08,09:34,sports,スポーツ,26,ゴルフダイジェスト・オンライン（GDO）,「タイガーが『10アンダー出してこい』と」松山英樹が3打差逆転で大会2勝目 「64」からプレーオフで決着,https://news.yahoo.co.jp/articles/196925a4879b06e07f359e8b229e1f855c0589a2,12/8(月) 6:34
2025-12-08,09:34,sports,スポーツ,27,TopNews,【F1放送配信】DAZNがF1中継に幕・・・フェルスタッペンが見せた深い“ホンダ愛”にサッシャ氏や中野信治氏も感激　2026年からはフジテレビ独占＆F1 TV開始,https://news.yahoo.co.jp/articles/249395768d6934c23de2125e9f37885dcb97e9ec,12/8(月) 5:43
2025-12-08,09:34,sports,スポーツ,28,ゴルフのニュース,「3年で100切りできない＝センスなし」は本当？ レッスンプロが語る“残酷な現実”と“迷宮入り”ゴルファーの共通点とは,https://news.yahoo.co.jp/articles/b6f469755bd429ad491ee86870a84345ce68db02,12/8(月) 7:15
2025-12-08,09:34,sports,スポーツ,29,デイリースポーツ,「俺が申し訳なかった」朝倉未来のブチギレその後…元ギャング総長が謝罪「大人げなかった」来年３月、元アウトサイダー萩原との対戦決定「もうやるしかない」,https://news.yahoo.co.jp/articles/33cbba0c571daa34feead63ac3e2273985853dc9,12/7(日) 22:33
2025-12-08,09:34,sports,スポーツ,30,西スポWEB OTTO！,「すっかり奥様になってて驚き」夫は広島の最年長投手…35歳タレント〝スタジアムで家族ショット〟に「ファミリー箱推しです」「来年も応援します」の声,https://news.yahoo.co.jp/articles/a14287e940b7fc52f4a6606e345ced222acefe4f,12/7(日) 23:30
2025-12-08,09:34,sports,スポーツ,31,ゴルフダイジェスト・オンライン（GDO）,日没順延で72ホール短縮競技に　渋野日向子、西村優菜、櫻井心那ら全選手が第3R完了できず,https://news.yahoo.co.jp/articles/5ffc15ad8f0f2e7d38d8d298194087ceaa696ff0,12/8(月) 8:06
2025-12-08,09:34,sports,スポーツ,32,Full-Count,3度の指名漏れ→NPB球団を粉砕した“苦労人”に脱帽「凄すぎる」「マリンで待ってる」,https://news.yahoo.co.jp/articles/229257ba6fbfe84fecf2c8cbda0c1cd139e6070d,12/8(月) 8:29
2025-12-08,09:34,sports,スポーツ,33,Full-Count,苦しんだ鈴木誠也との比較「社会に不満を」　戦力外から4年…元ドラ1の葛藤、そして芽生えた夢,https://news.yahoo.co.jp/articles/583d81e2451e93e0e6c0fa3cd61990386a6019fc,12/8(月) 7:20
2025-12-08,09:34,sports,スポーツ,34,CoCoKARAnext,今井達也、村上宗隆にも…ヤンキースが日本人獲得に燃える背景　幹部が漏らす“隠せぬ本音”「多くの才能が米球界を支えている」,https://news.yahoo.co.jp/articles/7bb3e861746207182b985bda693ce609bbdf7ea1,12/8(月) 6:02
2025-12-08,09:34,sports,スポーツ,35,motorsport.com 日本版,ランド・ノリス、悲願のF1初王座！　優勝フェルスタッペン2点差に迫るも5連覇ならず……角田裕毅は14位で一旦表舞台を去る｜F1アブダビGP決勝レポート,https://news.yahoo.co.jp/articles/f89cd58c7e9ed87dbeac68c1997175077c5493a5,12/7(日) 23:58
2025-12-08,09:34,sports,スポーツ,36,西スポWEB OTTO！,「おめでとう！」新宿中村屋創業者の玄孫のサッカー日本代表夫と結婚4年…6歳年上フリーアナ妻〝出産直後〟家族4ショット公開！「幸せもらった」,https://news.yahoo.co.jp/articles/2513e58896784f94eecf9bb6a399852ab1c4b971,12/7(日) 23:20
2025-12-08,09:34,sports,スポーツ,37,tennis365.net,大坂なおみ 世界1位にフルセットで敗れる、まさかの結末 ボールガールにポイント奪われ試合終了＜女子テニス＞,https://news.yahoo.co.jp/articles/5d04dec9da8f5e3303fb381f8bf38988b0aff8da,12/8(月) 8:13
2025-12-08,09:34,sports,スポーツ,38,オートスポーツweb,勝者フェルスタッペン、2点差で王座に届かず「辛くはない。ここまで挽回したことを誇りに思う」袂を分かつホンダには感謝,https://news.yahoo.co.jp/articles/28690675d45a10897be2893264e5f59430ebb032,12/8(月) 8:12
2025-12-08,09:34,sports,スポーツ,39,ゴルフ総合サイト ALBA Net,＜速報＞渋野日向子、西村優菜ら出場の米最終予選会は5時間25分の中断から再開　競技は72ホールに短縮へ,https://news.yahoo.co.jp/articles/ea2a5b7016751d2e33a21c1daf6f08cc89f75553,12/8(月) 6:13
2025-12-08,09:34,sports,スポーツ,40,スポニチアネックス,【F1】最終戦Vフェルスタッペンがホンダに感謝「ありがとう」…中野信治氏「ちょっと泣きそう」,https://news.yahoo.co.jp/articles/84cf4ea6461c3cb017640fef4d9136ce8e1dfb4e,12/8(月) 0:35
