scrp_date,scrp_time,genre_en,genre_jp,rank,media_jp,title,link,date_original
2025-07-29,12:39,TTL,総合,1,ねとらぼ,鬼滅の刃を見に行ったら「猗窩座だ！」と言われた女性→まさかの格好に「センス良すぎ笑」「それにしか見えない」,https://news.yahoo.co.jp/articles/0e7bbeec6eab33322c0fcd60a1421e44d55b7268,7/29(火) 8:20
2025-07-29,12:39,TTL,総合,2,スポーツ報知,山本由伸「調子はすごくよかった」「裏をかく配球」　７回１失点９Ｋで９勝目、決勝打の大谷翔平も快投絶賛,https://news.yahoo.co.jp/articles/f99d13478b9cf22c418e421770d1ff0f855eac79,7/29(火) 11:19
2025-07-29,12:39,TTL,総合,3,CoCoKARAnext,大谷翔平、“怪物”と塁上での恒例シーン「野球の言語は普遍的だ」米メディアも注目　両リーグ最速100得点で勝利に貢献,https://news.yahoo.co.jp/articles/37d380874fbdba76d09e709fae33b02021d8b582,7/29(火) 11:02
2025-07-29,12:39,TTL,総合,4,MRO北陸放送,【台風情報】台風9号（クローサ）の進路は西よりに変わる予想に 週末に関東などへ接近のおそれ 今後の進路は“不確実性”が強く 雨と風シミュレーション,https://news.yahoo.co.jp/articles/8cf1bed588a8c54b019bd99bf4bae24078adec9f,7/29(火) 9:31
2025-07-29,12:39,TTL,総合,5,毎日キレイ,＜森進一＞次男について初めて明かす　長男はワンオクTaka、三男はマイファスHiro　性格の異なる息子たちとの関係は？「徹子の部屋」で,https://news.yahoo.co.jp/articles/e16ef31d1cdefb5d4bc24f4330bdef53c36987b5,7/29(火) 6:30
2025-07-29,12:39,TTL,総合,6,TBS NEWS DIG Powered by JNN,「息子なら責任を持って殺しなさい」介護の末に91歳の母を殺害した息子「母には自分しかいなかった…」自治体に相談も母自身が支援を拒否,https://news.yahoo.co.jp/articles/2f6a51327476fa3f384b1bbe379d44b7881a5ef8,7/29(火) 7:02
2025-07-29,12:39,TTL,総合,7,Full-Count,大谷ライバルに緊急事態…154キロ直撃で負傷交代　トレード期限3日前、Dバックス激震,https://news.yahoo.co.jp/articles/bf9e1118ca27ca81fc2499c6439ea38eccdc9863,7/29(火) 9:58
2025-07-29,12:39,TTL,総合,8,日刊スポーツ,食道がん闘病していた45歳DJが死去　６月の投稿で「できる事がどんどん限られていく。。。」,https://news.yahoo.co.jp/articles/b019a611c4cd94e73f5c1dec1205f51c4cbe19ce,7/29(火) 10:15
2025-07-29,12:39,TTL,総合,9,スポーツ報知,「学歴はどうでもいいんです」…伊東市・田久保真紀市長「疑惑」を巡り「モーニングショー」羽鳥慎一アナ＆玉川徹氏が見解…「何をやってくれるかが大事」,https://news.yahoo.co.jp/articles/9fea144f081a6db92d61a198aad6f4b2ef2d8a87,7/29(火) 8:55
2025-07-29,12:39,TTL,総合,10,埼玉新聞,身元不明の遺体、川で発見…上半身のみ、立っているような状態　犬の散歩をする夫婦が発見　3週間ほど前、腰から下部分の遺体も見つかる…2・2キロ上流の取水口で,https://news.yahoo.co.jp/articles/7407772a3c1886f0999a3c48a20cb59ff72234dd,7/29(火) 8:39
2025-07-29,12:39,TTL,総合,11,スポニチアネックス,北野武　映画「アウトレイジ」の食事会で一言も話さず　異様な現場で最初に食事に手を付けたのは？,https://news.yahoo.co.jp/articles/5c375a541399f6fcbd35428d8f272c856a2f2413,7/29(火) 7:00
2025-07-29,12:39,TTL,総合,12,スポニチアネックス,前田敦子「愛しい人」インスタに登場した美女にファン騒然「美人になっててびっくり」「仲良しだったんだ」,https://news.yahoo.co.jp/articles/8d7776fe01f4556542f46c692624061d67315cc6,7/29(火) 11:23
2025-07-29,12:39,TTL,総合,13,スポニチアネックス,橋下徹氏、またも北村晴男氏を痛烈批判「バカな国会議員が誕生」「日本を壊しているのはアンタだよ」,https://news.yahoo.co.jp/articles/c48374bc2edbf7f59d09e48642d7f450aa24d38f,7/28(月) 22:19
2025-07-29,12:39,TTL,総合,14,日刊スポーツ,井川意高氏「まさにどこまでも醜い異様な生物」石破首相続投意欲報道受け改めて投稿,https://news.yahoo.co.jp/articles/145971bc78f45547c86db32666763a8bac5ac08c,7/29(火) 11:06
2025-07-29,12:39,TTL,総合,15,ほ・とせなNEWS,7年付き合った彼女に振られた結果、うつ病になった男性　→2年後の驚きの変化に「素敵」「色気がすごい」「かっこよすぎる」,https://news.yahoo.co.jp/articles/4919413c211cbccd51707a13001e4e479ecdf751,7/29(火) 8:00
2025-07-29,12:39,TTL,総合,16,Full-Count,阪神スカウトの後悔「誠也を推してた」　覚醒を感じた“断トツ能力”「比較にならない」,https://news.yahoo.co.jp/articles/e1c707e49af37588742999e8852e39da907f8224,7/29(火) 7:10
2025-07-29,12:39,TTL,総合,17,日刊スポーツ,「何とも気持ち悪い」菊間千乃氏が“裏金議員”の石破首相批判に強い疑問「そもそも…」,https://news.yahoo.co.jp/articles/a6f330661baa8245bec97b4852abd724aece7fdb,7/29(火) 11:05
2025-07-29,12:39,TTL,総合,18,テレビ朝日系（ANN）,強盗殺人事件で技能実習生逮捕　里帰り中に…日本語講師の女性死亡　中国から悼む声,https://news.yahoo.co.jp/articles/7af673dc2cfcec8148da0148030167613c4f98b6,7/29(火) 1:24
2025-07-29,12:39,TTL,総合,19,ねとらぼ,久々にグリルを開けたら……「え、え、こわい」　まさかの光景に38歳男性が絶句「イリュージョンか？」「毎年やってまう」,https://news.yahoo.co.jp/articles/38f1d21e7546490e24ef964e22eb1c89f5e638c1,7/29(火) 10:45
2025-07-29,12:39,TTL,総合,20,埼玉新聞,JR大宮駅で人身事故　女性死亡…快速にはねられる　最大1時間ほど遅れ　午後3時半、ホームにいた女性…身元が判明　市内在住だったアルバイト20歳,https://news.yahoo.co.jp/articles/bb854f057a5374a1461c9ac353735b87d36f57e4,7/29(火) 9:49
2025-07-29,12:39,TTL,総合,21,中央日報日本語版,「これは本当に恥ずかしいこと」…トランプ、ゴルフ中に欧州の風車に激怒,https://news.yahoo.co.jp/articles/2871a74f9d5f8d25ff0637acea001d6ca741d17a,7/29(火) 7:54
2025-07-29,12:39,TTL,総合,22,ABEMA TIMES,木下優樹菜さん（37）、娘2人との水着姿に反響「なんて美しい3人」「親子そろってスタイル良すぎ」,https://news.yahoo.co.jp/articles/220365b561272caf5444cbf656531f9ef342fcc9,7/29(火) 11:36
2025-07-29,12:39,TTL,総合,23,デイリースポーツ,菊間千乃氏、自民党裏金議員が石破総理退陣求める構図に「すごく気持ちが悪い」,https://news.yahoo.co.jp/articles/05321c33b999e1c417fc98fd3b7425ae92129606,7/29(火) 10:44
2025-07-29,12:39,TTL,総合,24,弁護士JPニュース,フィリピン人トランスジェンダー女性が「難民認定」求めて会見　母国には「迫害」存在する…当事者標的の“殺人事件”も多発,https://news.yahoo.co.jp/articles/2a6eac29b64c5757cfbdb78081507488724739f1,7/29(火) 10:36
2025-07-29,12:39,TTL,総合,25,Full-Count,「なんで放出した」エ軍“戦力外”→覚醒する大谷元相棒　止まらぬ.865にファン衝撃,https://news.yahoo.co.jp/articles/ccd4e6271c78bd38f6af7029c1b70dbc80bbfc20,7/29(火) 9:15
2025-07-29,12:39,TTL,総合,26,ねとらぼ,「車乗れんやん」　タイヤを見ると“まさかの付着物”→夏ならではの結末に「すごーい！」「初めて見た」,https://news.yahoo.co.jp/articles/d44f5f27c7859f30cbb37536a88276419fb426a9,7/28(月) 20:45
2025-07-29,12:39,TTL,総合,27,デイリースポーツ,瓜田純士　父の葬儀を報告「親父は幸せ者でした」妻、麗子さんと喪服の写真添え感謝つづる,https://news.yahoo.co.jp/articles/22f41dc02f343c954573f5e74767b71d27032e23,7/29(火) 10:11
2025-07-29,12:39,TTL,総合,28,イーファイト,「びしょ濡れ！？」ラウンドガールが朝倉未来のシャンパンに「きゃー！」,https://news.yahoo.co.jp/articles/95847a94bf8bf6496aed17b897caba4d019c852c,7/29(火) 6:54
2025-07-29,12:39,TTL,総合,29,GOAL,大岩監督のU-22日本代表がウズベキスタンに勝利で連勝！親善試合大会を優勝で締めくくる,https://news.yahoo.co.jp/articles/fbdebb633f082e3a5dae09bf4937801016c6f86b,7/29(火) 6:03
2025-07-29,12:39,TTL,総合,30,デイリースポーツ,「肩えぐい」マッチョで注目の美女アスリート「可愛い水着には筋肉でしょうよ」海のマッスルポーズに反響,https://news.yahoo.co.jp/articles/784452e7ea9fdeda0716851bfca7a6f22a2b89c1,7/29(火) 10:46
2025-07-29,12:39,TTL,総合,31,ねとらぼ,お昼寝から目覚めた0歳赤ちゃん→隣にママがいないと気付いた、次の瞬間……「まって」「なんじゃこれかわいすぎる」,https://news.yahoo.co.jp/articles/443b3e6791b26e3338d73826b49690669fd311dc,7/29(火) 8:30
2025-07-29,12:39,TTL,総合,32,オリコン,『鬼滅の刃』泣けるだろ…笑顔の冨岡＆錆兎　ufotable公式絵に衝撃「親友だな」「特典になりませんか（涙）」,https://news.yahoo.co.jp/articles/8aa1a1b0dfb006f1a8b4fa4e4bdad1109bb142ad,7/29(火) 11:15
2025-07-29,12:39,TTL,総合,33,中央日報日本語版,香港衛生当局、日本産アイスクリームから基準値超過の大腸菌群検出で輸入を停止,https://news.yahoo.co.jp/articles/63a32d8a47450143f1f7bebd5100aca7564b98dc,7/29(火) 10:24
2025-07-29,12:39,TTL,総合,34,TBS CROSS DIG with Bloomberg,団塊世代は75歳、“働かない高齢者”急増で実は「消費にブレーキ」　賃上げ届かぬシニアに仕事が必要,https://news.yahoo.co.jp/articles/94a156b4711756b1b50c0a3dd36ad933a31c761e,7/29(火) 8:02
2025-07-29,12:39,TTL,総合,35,スポーティングニュース日本版,「残念至極」は言い過ぎ!? 大相撲名古屋場所、横審の豊昇龍・大の里批判に異論出るワケは,https://news.yahoo.co.jp/articles/7e317685f1028382dd99e1e1a220575fb674dc30,7/29(火) 6:00
2025-07-29,12:39,TTL,総合,36,ねとらぼ,夫の枕元に落とし物→気付いた妻が残した伝言は……「奥様、最高です！」　キレのあるやりとりに「こういう夫婦憧れる」,https://news.yahoo.co.jp/articles/fbe22e44e2b4fe02e1e7be5bf7cf864803a04172,7/28(月) 11:45
2025-07-29,12:39,TTL,総合,37,日刊スポーツ,大谷翔平との談笑が大盛り上がり？　日本語勉強中の「大谷ファン」デラクルスがテンションMAX,https://news.yahoo.co.jp/articles/6e243f9fc8da51ec8fa72833b9f0d5a7705dd66c,7/29(火) 11:28
2025-07-29,12:39,TTL,総合,38,スポニチアネックス,久保田かずのぶ「みんな志した」　“声”を大絶賛した人気芸人「勝てないのよ、あの人が言ったあとは」,https://news.yahoo.co.jp/articles/04761b93862658b6b8e40fba06881cbac5353a87,7/29(火) 11:29
2025-07-29,12:39,TTL,総合,39,日刊スポーツ,参政党・梅村みずほ氏、過去の「詐病」めぐる立憲議員の投稿にチクリ「おかわいそうに…」,https://news.yahoo.co.jp/articles/f6c6f1d27bcdc171f32a02222c5f0100cd0c232e,7/29(火) 11:03
2025-07-29,12:39,TTL,総合,40,まいどなニュース,「俺じゃなきゃ見逃し…え、どこ！？」うっかり踏んだら命取り！隠れてないのに見えない…高校生の投稿に47万回表示の反響,https://news.yahoo.co.jp/articles/af0be9f5de91f9069ddafeb5c6fd2946c0dcc47e,7/29(火) 7:00
