scrp_date,scrp_time,genre_en,genre_jp,rank,media_jp,title,link,date_original
2025-07-29,07:07,sports,スポーツ,1,ABEMA TIMES,どこに怒れば… 菅野智之に“打者がイライラ”「そらキレる」連続三振でバットを思い切りブン投げる「飛ばしすぎw」,https://news.yahoo.co.jp/articles/0743b28e7c1119693ea3512431398f76ff164e90,7/28(月) 23:32
2025-07-29,07:07,sports,スポーツ,2,ENCOUNT,SATORUに対戦断られた飯田将成、今度は意外な人物から対戦オファー「BDでしかしないですけど」,https://news.yahoo.co.jp/articles/f56b711eef50bc7eb19cce4cd4a5a6cba094f8c9,7/28(月) 21:30
2025-07-29,07:07,sports,スポーツ,3,FITNESS LOVE,27歳・看護師が鍛え上げた3Dヒップでコンテスト総合優勝　苦手な尻トレを1カ月で徹底強化,https://news.yahoo.co.jp/articles/1736aa0ef95887135b4f4f7d4eeb864a228fd118,7/29(火) 4:30
2025-07-29,07:07,sports,スポーツ,4,日刊スポーツ,【巨人】36歳坂本勇人、今季２度の２軍降格を味わった心境を告白「今まで中心でやってきて…」,https://news.yahoo.co.jp/articles/1e87e54d4f52c26577b43e8917c09dd751441cc0,7/28(月) 18:40
2025-07-29,07:07,sports,スポーツ,5,サンケイスポーツ,MLB激震　3年連続セーブ王に賭博疑惑　ガ軍守護神が8月31日まで『休職』　同僚は既に調査対象,https://news.yahoo.co.jp/articles/899db66eacf0edcc2887cd63ab0eb4208698de8b,7/29(火) 2:06
2025-07-29,07:07,sports,スポーツ,6,サンケイスポーツ,ドジャースの先発ローテは充実の見込み　スネル＆佐々木は8月復帰　救援陣苦しくメイはトレード候補,https://news.yahoo.co.jp/articles/be2573303cda705b300a4bbf008a2ae676923306,7/28(月) 23:57
2025-07-29,07:07,sports,スポーツ,7,Full-Count,ヤンキース、通算112勝右腕をトレード放出　球団発表…今季8登板で2勝止まり,https://news.yahoo.co.jp/articles/3b442548e6e73467c9209fe214f1886682d2aeda,7/29(火) 4:04
2025-07-29,07:07,sports,スポーツ,8,東スポWEB,イチロー氏にイジられたマーリンズの元社長が即反応「彼のスピーチは…」米メディアは賛否,https://news.yahoo.co.jp/articles/f1abe13e2ff0ad3fe25995c0fc5716b70b65313d,7/28(月) 14:20
2025-07-29,07:07,sports,スポーツ,9,スポーティングニュース日本版,「残念至極」は言い過ぎ!? 大相撲名古屋場所、横審の豊昇龍・大の里批判に異論出るワケは,https://news.yahoo.co.jp/articles/7e317685f1028382dd99e1e1a220575fb674dc30,7/29(火) 6:00
2025-07-29,07:07,sports,スポーツ,10,スポニチアネックス,東京V　J2水戸・寺沼星文獲得へ　ガーナ人のハーフ　188センチ長身生かした点取り屋,https://news.yahoo.co.jp/articles/7e82f04b82a5061e32765790dc6b2496b3794ce7,7/29(火) 1:00
2025-07-29,07:07,sports,スポーツ,11,中日スポーツ,高木豊さん、セ新人王候補を独自予想　投手では阪神左腕が「抜けている」　野手では「バッティングが急成長」中日捕手がダークホース的存在に,https://news.yahoo.co.jp/articles/27787fccdc6a138553487e66a89acbaaf968d554,7/29(火) 6:13
2025-07-29,07:07,sports,スポーツ,12,CoCoKARAnext,溢れ出る「24歳」の色気　本田真凜さん1st写真集の表紙＆タイトルを公開「愛される一冊となりますように」宇野昌磨さんも「いいね！」,https://news.yahoo.co.jp/articles/f72ae87fc2db2dc9739edfdde0c7a4c4d1a6b665,7/29(火) 5:10
2025-07-29,07:07,sports,スポーツ,13,サッカー批評Web,神様の呼びかけにロナウジーニョ、闘将、ヒデ、「友達なら当たり前」FW、シンジらが集結、「無双」はポルトガル代表41歳,https://news.yahoo.co.jp/articles/7d13c6aa8d291fcf4ae3a6737f23fa03b1bd7a64,7/29(火) 5:01
2025-07-29,07:07,sports,スポーツ,14,中日スポーツ,関東第一・坂本慎太郎、天国の両親に届けた吉報「2人のことを思い出して絶対に抑えようと」決勝で1失点完投、打者としても本塁打&二塁打,https://news.yahoo.co.jp/articles/27355bab6fa47cd38d5f8a87bcb6516f7ffcf7ef,7/28(月) 18:46
2025-07-29,07:07,sports,スポーツ,15,デイリースポーツ,糸井嘉男氏　阪神首位独走の分岐点は７・４大山外し　新人監督とは思えない藤川監督の決断を指摘　佐藤輝の三冠王近道は,https://news.yahoo.co.jp/articles/a01fc2e17a92b9caa03d5e6cf0a5cf3e29805ed0,7/29(火) 5:01
2025-07-29,07:07,sports,スポーツ,16,スポニチアネックス,横審　休場の豊昇龍に苦言「至極残念。横綱としての心技体の風格ある姿、結果を」,https://news.yahoo.co.jp/articles/81d3dc7c65029f521a4876af3232a430108c709c,7/29(火) 4:30
2025-07-29,07:07,sports,スポーツ,17,デイリースポーツ,阪神・坂本がつば九郎をベンチに置いた理由　球宴第２戦目、ＳＮＳ中心に話題沸騰,https://news.yahoo.co.jp/articles/cc755f5c5bc7828d7f1e63674ecf1ffc2b9b9e46,7/29(火) 5:01
2025-07-29,07:07,sports,スポーツ,18,読売新聞オンライン,長期離脱中の岡本和真、負傷と復帰への胸中語る…「ぎりぎりのものが三つあった」「復帰後はフルで完璧に」,https://news.yahoo.co.jp/articles/0fa9d10933f0a42f7d37d3141d00fb7e7cf3d645,7/29(火) 5:01
2025-07-29,07:07,sports,スポーツ,19,Full-Count,大谷活躍の裏で…スポンサー企業が“激白”　発覚した事実に「嬉しい悩み」,https://news.yahoo.co.jp/articles/f54086b304af2d489c41d0d45edd47833e64c92c,7/29(火) 6:20
2025-07-29,07:07,sports,スポーツ,20,スポニチアネックス,巨人　菊地大稀投手を支配下登録へ　21年育成ドラ6→22年に支配下も昨年オフに自由契約→育成契約,https://news.yahoo.co.jp/articles/fcb8ec12c37bc564be63896867627374f86128a1,7/29(火) 5:00
2025-07-29,07:07,sports,スポーツ,21,スポーツ報知,小学４年で母、昨年父が他界　関東第一の二刀流・坂本慎太郎を支える兄と姉,https://news.yahoo.co.jp/articles/e9a69be46741856e7deabb1dc0d6e427a7db285b,7/29(火) 5:20
2025-07-29,07:07,sports,スポーツ,22,スポーツ報知,米野球殿堂入りイチロー氏をドジャース・ロハスが祝福　ともにプレーした３年で受けた「大きな影響」,https://news.yahoo.co.jp/articles/240ecc136d9f310066764c62bc2778cd3ce1efa7,7/29(火) 6:10
2025-07-29,07:07,sports,スポーツ,23,日テレNEWS NNN,【高校サッカー】インターハイ3回戦　ベスト8に進むのは？　強豪校同士が激突,https://news.yahoo.co.jp/articles/7b893c83e3371356189b09eb12e29f11cbebb57d,7/29(火) 5:30
2025-07-29,07:07,sports,スポーツ,24,西スポWEB OTTO！,「滞在時間10分」復興支援で石川県を訪れた武藤敬司、盟友と〝再会2ショット〟も少ない面会時間を惜しむ「忙しそう。飛び出していった！」,https://news.yahoo.co.jp/articles/0079c45de4884e8b8c5a48466d75b137ee59e78e,7/29(火) 5:50
2025-07-29,07:07,sports,スポーツ,25,中日スポーツ,ディープインパクトは落札価格7350万円が種牡馬の価値は51億円に…ただ、セレクトセール高額馬トップ10でJRA重賞勝ち馬は皆無,https://news.yahoo.co.jp/articles/b93958ec54f3ef1deafb43d9c502b4f556e611aa,7/29(火) 5:15
2025-07-29,07:07,sports,スポーツ,26,東スポWEB,【巨人】岡本和真〝一軍復帰〟に前進　ライバル球団が恐れる波及効果「明らかな復調気配」,https://news.yahoo.co.jp/articles/114e005dc47faae08032b7b2fcd5fc35f28f7adc,7/29(火) 5:16
2025-07-29,07:07,sports,スポーツ,27,サッカー批評Web,ホテル代は「日本の70％」、はるかに安い「交通運賃」、庶民を苦しめる「食事代」【E-1選手権で「優勝」も…キャッシュレス化は「完敗」!韓国マネー最前線】（2）,https://news.yahoo.co.jp/articles/ee4be3481ebba550dde6291d171829c47696be2c,7/29(火) 5:32
2025-07-29,07:07,sports,スポーツ,28,スポニチアネックス,【世界水泳】34歳の鈴木聡美が決勝進出　5度目出場舞台で悲願のメダル獲得へ　女子100メートル平泳ぎ,https://news.yahoo.co.jp/articles/cb9a4badec43ee03f25935a0e9de5f46ba2b44cf,7/28(月) 21:12
2025-07-29,07:07,sports,スポーツ,29,東スポWEB,【陸上】いたちごっこの盗撮問題　ドルーリー朱瑛里の代理人弁護士が提起するアスリート側の〝役割〟,https://news.yahoo.co.jp/articles/96c4f7653b3869897bb50566ab3d52646ae94e25,7/29(火) 5:16
2025-07-29,07:07,sports,スポーツ,30,tennis365.net,大坂なおみ 快勝で2年連続4度目の初戦突破、コーチ解約も影響見せず＜女子テニス＞,https://news.yahoo.co.jp/articles/3799112ff36a65b13dd9995dd1162b4b23eefe0d,7/29(火) 5:43
2025-07-29,07:07,sports,スポーツ,31,スポニチアネックス,阪神・先発マッチアップ　鯉キラー大竹から1週間スタート　29日は勝てばマジック点灯も,https://news.yahoo.co.jp/articles/b47dd702a0824e4a29f71d5b2ef7d88f70617478,7/29(火) 5:15
2025-07-29,07:07,sports,スポーツ,32,Full-Count,イチロー氏が突然放った日本語に感動の嵐「泣ける」　溢れ出た思い「素敵すぎるよ」,https://news.yahoo.co.jp/articles/503c0fe90a1cc788ec8f321c169b724a82b139b0,7/28(月) 20:40
2025-07-29,07:07,sports,スポーツ,33,スポニチアネックス,高校野球にDH制!来春選抜大会から導入へ　指導者から求める声…近日中に承認、新時代へ突入,https://news.yahoo.co.jp/articles/208202bbf8f3c2cc90e6954604ea83e276484c0a,7/29(火) 1:30
2025-07-29,07:07,sports,スポーツ,34,デイリースポーツ,めっちゃ楽しそう！バレー男子日本代表　ＡＮＡビジネスクラスで中国へ　高橋藍が公開「行ってきます！」広々座席で極上感,https://news.yahoo.co.jp/articles/f13787fcff5173cb155dc3112516c0d0bc985929,7/28(月) 21:38
2025-07-29,07:07,sports,スポーツ,35,サンケイスポーツ,大谷翔平が「2番・DH」で出場　レッズ・デラクルスと〝怪物〟対決　本拠地30球場『王手』弾なるか　山本由伸が先発,https://news.yahoo.co.jp/articles/4ca8b2be9b4d0170b8ccfa91fc4f3f54e2a76a7c,7/29(火) 4:10
2025-07-29,07:07,sports,スポーツ,36,高校野球ドットコム,大阪桐蔭を破った東大阪大柏原！指揮官は元プロ野球選手で、あの球団でプレー【2025年夏高校野球】,https://news.yahoo.co.jp/articles/cc2652e2b31f92c6e45d3aa12656d3d6edb7bd51,7/27(日) 15:14
2025-07-29,07:07,sports,スポーツ,37,時事通信,日本、男女とも4位　世界フェンシング,https://news.yahoo.co.jp/articles/e3a14e7aadfce8362c90dc1b16da2426623f709a,7/28(月) 22:55
2025-07-29,07:07,sports,スポーツ,38,motorsport.com 日本版,【F1分析】レッドブルのあまりにも痛い伝達ミス。角田裕毅、ピットストップ”1周遅れ”で失ったのは約12秒,https://news.yahoo.co.jp/articles/a3e33bbe12c0671187ef35f61a84465166448489,7/28(月) 19:11
2025-07-29,07:07,sports,スポーツ,39,サッカー批評Web,英国で「サッカー・ガバナンス法案」が可決、発端はマンC他プレミア6クラブ参加「欧州スーパーリーグ」構想【Jリーグ激震「イングランド・サッカー革命」の行方】（1）,https://news.yahoo.co.jp/articles/5db2b4c3a6424f0f973349f561f28d97567e7119,7/29(火) 5:01
2025-07-29,07:07,sports,スポーツ,40,東スポWEB,【ソフトバンク】日本ハムと首位決戦　警戒打者はレイエスでも万波中正でもない〝伏兵〟,https://news.yahoo.co.jp/articles/de9ad752a2b77385a8f086a5b830e367660ca30d,7/29(火) 6:16
