scrp_date,scrp_time,genre_en,genre_jp,rank,media_jp,title,link,date_original
2024-08-19,06:05,sports,スポーツ,1,Full-Count,ド軍が29歳右腕を“事実上の戦力外”　途中加入で防御率2.21も…球団発表,https://news.yahoo.co.jp/articles/ba2854b8fb48a8d1fcca417c123c694a9e04e86f,8/19(月) 1:40
2024-08-19,06:05,sports,スポーツ,2,デイリースポーツ,体操・岡慎之助　選手村の部屋が水浸し→段ボールベッドも潰れ→橋本、萱ら団体で床ふきふき　原因は,https://news.yahoo.co.jp/articles/617aa29a30f028b0862d0c64b40937bcf9c99b44,8/18(日) 23:56
2024-08-19,06:05,sports,スポーツ,3,Full-Count,藤浪晋太郎に「何が起きた!?」　唸る160キロで5連続K、衝撃“21/23”にどよめき,https://news.yahoo.co.jp/articles/f1090d68a1711096c0198fbddfe3846056076ccc,8/18(日) 18:02
2024-08-19,06:05,sports,スポーツ,4,CoCoKARAnext,パリでも相次いだ段ボールベッドへの“賛否”…海外参加選手たちの意見を米紙が紹介「本当にひどかった」「ベッドはベッドだ」,https://news.yahoo.co.jp/articles/7236bdd7ecf549f699d18a17518051ab12a0f90b,8/19(月) 5:00
2024-08-19,06:05,sports,スポーツ,5,ABEMA TIMES,大谷翔平、弾丸38号アーチを被弾した投手にハプニング発生！ ヤバすぎる“衝撃リアクション”が話題に「飛んでいった…？」,https://news.yahoo.co.jp/articles/1328919478e801718d1104cc241fec0f8019aa6b,8/18(日) 23:36
2024-08-19,06:05,sports,スポーツ,6,中日スポーツ,大社・馬庭優太、計401球を投げて３戦連続完投　「1週間で500球」の制限によって準々決勝＆準決勝２試合で計236球が上限【甲子園】,https://news.yahoo.co.jp/articles/bc4e02ac9d8dac46cda85ec51d7582844fafcd78,8/18(日) 8:01
2024-08-19,06:05,sports,スポーツ,7,西スポWEB OTTO！,美人妻にかけた8年越しの2色のメダル　レスリング金メダリストが公開した自宅ショットに反響「奥様、素敵な笑顔ですね～」,https://news.yahoo.co.jp/articles/8c23289b85a54113fdd967158fd776e7dfcee219,8/18(日) 23:20
2024-08-19,06:05,sports,スポーツ,8,ベースボールキング,ドジャース・大谷翔平、2戦連発の39号先制ソロ　打球速度183キロ弾で先発カーショーを援護,https://news.yahoo.co.jp/articles/e25d97f66396c85d94abc382b58606d2956c9a56,8/19(月) 4:18
2024-08-19,06:05,sports,スポーツ,9,Full-Count,大谷翔平にド軍英雄が“戦々恐々”　38号でまた一歩…指揮官に異例要求「休ませて」,https://news.yahoo.co.jp/articles/f44627586b5b9a2dc8d8c3b40182c53bda1c2a97,8/18(日) 19:42
2024-08-19,06:05,sports,スポーツ,10,Full-Count,打率3割も…わずか5試合でド軍放出　なかった居場所、28歳便利屋がレッズへ移籍,https://news.yahoo.co.jp/articles/9de2e3bf49a436f254e4ebf9e6e153b14830746e,8/19(月) 3:47
2024-08-19,06:05,sports,スポーツ,11,デイリースポーツ,ＤｅＮＡがサヨナラ勝ち　延長十一回、オースティンがサヨナラ弾　３年ぶり２０号　連敗を２でストップ,https://news.yahoo.co.jp/articles/59a294ef22257d1c17fcb1ab89da599ce76f238c,8/18(日) 21:50
2024-08-19,06:05,sports,スポーツ,12,Full-Count,ド軍暗雲…フリーマンは「現在バットが握れない状態」　指揮官も苦悶、IL入りの可能性,https://news.yahoo.co.jp/articles/eea1c5b73ee742281f66e4c1e839930d17821d58,8/19(月) 3:36
2024-08-19,06:05,sports,スポーツ,13,東スポWEB,伊東純也がＷ杯アジア最終予選で代表復帰へ　不起訴でスポンサーが〝ゴーサイン〟,https://news.yahoo.co.jp/articles/d48018dbca49bd34d8228546f8de6e7eb6b24612,8/19(月) 5:16
2024-08-19,06:05,sports,スポーツ,14,東スポWEB,【甲子園】神村学園・正林輝大　監督から〝15分説教〟…指摘された「愛のない野球」の中身,https://news.yahoo.co.jp/articles/c3de9e5662d9e60606d80eaef34c47c9e9019779,8/18(日) 21:41
2024-08-19,06:05,sports,スポーツ,15,高校野球ドットコム,甲子園のヒーローがわずか4年でプロ野球を戦力外…育成契約を断り、社会人野球に進んだ本当の理由,https://news.yahoo.co.jp/articles/5de977fe9dc12f4aa3f92e23d6aa3f07f86be725,8/18(日) 12:15
2024-08-19,06:05,sports,スポーツ,16,FITNESS LOVE,鍛え上げてきた下半身と背中でビキニ優勝の28歳　徹底した準備がコンテスト優勝のカギ,https://news.yahoo.co.jp/articles/e772680ca3f2da5cd40deb81ebec4cac00c1cd9a,8/19(月) 5:00
2024-08-19,06:05,sports,スポーツ,17,スポニチアネックス,大谷って不調なの？2戦連発39号、183キロ弾丸ライナーにネット「不調…ホームランしか打てない」,https://news.yahoo.co.jp/articles/4750924191c29ad6510fd04a67651e4db29b6dcc,8/19(月) 5:22
2024-08-19,06:05,sports,スポーツ,18,日刊スポーツ,大谷翔平、２戦連発39号で２年連続３度目の40発に王手　シーズン50・5本ペース,https://news.yahoo.co.jp/articles/d21b51d6ed145c46075de8c0351402fecfe3af1c,8/19(月) 5:01
2024-08-19,06:05,sports,スポーツ,19,スポーツ報知,大谷翔平、第５打席は一ゴロ　２戦連発３９号も５打数１安打で８月打率・１７４　月間７発もまだ不振？,https://news.yahoo.co.jp/articles/72df7b74268083004465ed1630cdb530fe8dfa21,8/19(月) 5:34
2024-08-19,06:05,sports,スポーツ,20,超WORLDサッカー！,29歳でキャリアハイ更新中、磐田FWジャーメイン良もブラックバーンへ！ 現地では加入合意と報道…3戦連発中の28歳FW大橋祐紀と日本人2トップ形成か,https://news.yahoo.co.jp/articles/b9db200b511adf610ed80edcf9ff88c96815fba8,8/18(日) 21:53
2024-08-19,06:05,sports,スポーツ,21,東スポWEB,大谷翔平 まるで〝デジャブ〟２戦連発の39号先制ソロ！　２位オズナと再び３本差,https://news.yahoo.co.jp/articles/31fbd5157393e2d637ab744adede12d86541de98,8/19(月) 5:46
2024-08-19,06:05,sports,スポーツ,22,スポニチアネックス,ドジャース・大谷　2試合連発39号！第3打席に183キロ弾丸ライナーの先制ソロ,https://news.yahoo.co.jp/articles/8e54fde2e712f626e3e82ebe885dc07176e3de6c,8/19(月) 4:15
2024-08-19,06:05,sports,スポーツ,23,ABEMA TIMES,大谷翔平、2戦連発39号！182キロ弾丸アーチで2年連続40本塁打に王手 前人未到「50本塁打＆40盗塁」ペース,https://news.yahoo.co.jp/articles/f7b6fbe141aa145c84e44c93492b80801090dea4,8/19(月) 4:14
2024-08-19,06:05,sports,スポーツ,24,CoCoKARAnext,「食べ物もないのに」パリ五輪200m金メダリストへの“金銭要求”に国民反発！ ボツワナ政府の異例案が波紋「全てが台無し」,https://news.yahoo.co.jp/articles/422c98c6545f280bfb78176453a644c83e69bcd4,8/18(日) 6:02
2024-08-19,06:05,sports,スポーツ,25,東スポWEB,【阪神】「笛吹けども踊らず」で３連敗…岡田虎はすでに〝詰み寸前〟なのか,https://news.yahoo.co.jp/articles/28d36b084db9062453bae21c8d430e7226b381e8,8/19(月) 5:16
2024-08-19,06:05,sports,スポーツ,26,日刊スポーツ,【DeNA】牧秀悟、右胸直撃の死球受け場内騒然　前夜にはオースティン激怒で警告試合,https://news.yahoo.co.jp/articles/8fc449fea033cafdbf51ed99b761814667589c76,8/18(日) 21:31
2024-08-19,06:05,sports,スポーツ,27,スポニチアネックス,巨人、延長サヨナラ負け！　0―1の8回に坂本が同点打も延長11回に平内が1球でサヨナラ被弾,https://news.yahoo.co.jp/articles/afdec253ad7d9bd9705edb9b87891d0cd2e3297f,8/18(日) 21:52
2024-08-19,06:05,sports,スポーツ,28,日刊スポーツ,【なでしこ】「それじゃあ澤さんになれないぞ」負けず嫌い谷川萌々子に火を付けた存在,https://news.yahoo.co.jp/articles/d75801cced29e63aae3da46237c2415b2bca0238,8/19(月) 4:45
2024-08-19,06:05,sports,スポーツ,29,日刊スポーツ,大谷翔平、２試合連発の39号先制ソロで40発へリーチ　角度22度の低空ライナー弾,https://news.yahoo.co.jp/articles/842aa02958d6042033ed3d2cfa56908d36b94142,8/19(月) 5:22
2024-08-19,06:05,sports,スポーツ,30,theWORLD（ザ・ワールドWeb）,若き日のメッシとの対峙は衝撃だった　R・カルロスが仰天した過去「カンナバーロと話し合った。おい、誰だあれは？と」,https://news.yahoo.co.jp/articles/85dca8ebfe36a106cf4d9c5ebeebf0848f49989f,8/19(月) 0:30
2024-08-19,06:05,sports,スポーツ,31,中日スポーツ,大谷翔平、2試合連続39号先制ソロ…フリーマン不在の打線で存在感…2年連続3度目40号に王手,https://news.yahoo.co.jp/articles/c574ca20da02aab406f340b8150a4ce312570d82,8/19(月) 4:25
2024-08-19,06:05,sports,スポーツ,32,東スポWEB,【巨人】杉内コーチ　同点10回の守護神投入は「大勢を出さずに負けるっていうのが…」,https://news.yahoo.co.jp/articles/17f574e2dae719853f43e48651f3f1cdc98d60bd,8/19(月) 2:41
2024-08-19,06:05,sports,スポーツ,33,デイリースポーツ,石川祐希がイタリアへ出発「ペルージャでバレー極めてきます」,https://news.yahoo.co.jp/articles/06a9cba046d4a275f0cd3bc7f9514dca1ea1813c,8/19(月) 0:24
2024-08-19,06:05,sports,スポーツ,34,TBS NEWS DIG Powered by JNN,大谷翔平 今季8度目の2試合連続39号！2年連続40号に王手、オズーナを突き放し独走態勢に、8月7本目で7月超える,https://news.yahoo.co.jp/articles/ef7511ac476412e0243b64e31c63500b1ac10afb,8/19(月) 4:14
2024-08-19,06:05,sports,スポーツ,35,GOAL,主力流出＆FW不足のレアル・ソシエダ、大丈夫か？ラージョに1-2敗戦…見せ場もつくった久保建英は68分に交代を命じられる,https://news.yahoo.co.jp/articles/24c00c2313e9e42ff424308efbe945b912388798,8/19(月) 4:00
2024-08-19,06:05,sports,スポーツ,36,中日スポーツ,大谷翔平、2戦連続39号決勝ソロ…フリーマン不在のチーム救う…ヌートバーは代打8号弾,https://news.yahoo.co.jp/articles/00a18c77ee5461835bcf237fe88b12e9fe1f2ce7,8/19(月) 5:44
2024-08-19,06:05,sports,スポーツ,37,日刊スポーツ,大谷翔平２戦連発39号先制ソロで２年連続３度目40発へリーチ　カーショー６回無失点で２勝目,https://news.yahoo.co.jp/articles/6885e51ba22f8734fbaa67a331288aa1a4bc4f9f,8/19(月) 5:52
2024-08-19,06:05,sports,スポーツ,38,CoCoKARAnext,「みんなにみせちゃお」女子バスケ・宮崎早織が入手した“五輪グッズ”が「可愛い～」「センスよすぎ」と大好評,https://news.yahoo.co.jp/articles/e1f68836deb40089ab76d2d09c511d98abc49e45,8/19(月) 5:30
2024-08-19,06:05,sports,スポーツ,39,GOAL,ソシエダ監督、主力流出を嘆く「ミケル・メリーノはラ・リーガ最高の選手でル・ノルマンはEURO優勝DFだ。失うものが大き過ぎる！」,https://news.yahoo.co.jp/articles/3754c73475a84980f8150889e951e5d3383ff6bd,8/18(日) 22:52
2024-08-19,06:05,sports,スポーツ,40,日テレNEWS NNN,【巨人】オースティンのサヨナラ弾に散る　延長11回平内龍太が1球で打たれる,https://news.yahoo.co.jp/articles/1d695303d25d49049ada7cd0b73c4702752065b7,8/18(日) 22:04
