scrape_time,genre_en,genre_jp,rank,media_jp,title,link,date_original
2023_1207_1523,life,ライフ,1,Hint-Pot,子どもの送迎で“おなじみ”の光景、日本を訪れたアメリカ人は仰天　「地元では見たことがないよ」,https://news.yahoo.co.jp/articles/bc9ef77c97e5722459424e462e4f0f3070678462,12/7(木) 8:10
2023_1207_1523,life,ライフ,2,ENCOUNT,「犯人は何回も下見」　狙われた愛車、なぜ盗難を阻止できた？　威力を発揮した専門店の助言,https://news.yahoo.co.jp/articles/9291c3d692bed78cea98e60a6c31c1cb53c3283f,12/7(木) 9:30
2023_1207_1523,life,ライフ,3,エルザ,つぶすと臭いデキモノ「粉瘤」の正体は？　同じ場所に繰り返しできるのなぜ？【医師解説】,https://news.yahoo.co.jp/articles/395a220da6aa4618fa70145cefb63779481f113f,12/7(木) 9:10
2023_1207_1523,life,ライフ,4,ねとらぼ,お米炊くの忘れた！→用意された“まさかの代替品”に反響　「大胆すぎる！」「こういう発想好き！」,https://news.yahoo.co.jp/articles/3e5d5047f68e1f64f2cf11601fcffef4d9c61ffb,12/7(木) 12:46
2023_1207_1523,life,ライフ,5,ハフポスト日本版,清掃員は「神ごみ」と呼んでいる…ゴミ袋の出し方とは？「目から鱗」「人の優しさを感じる」と話題,https://news.yahoo.co.jp/articles/371f5a3ccaa75f172e3ef7c225d3eb0d81066988,12/6(水) 9:32
2023_1207_1523,life,ライフ,6,ねとらぼ,アンパンマンの食パンを切ったら……　まさかの中身に「怖い」「うわぁぁぁ！！」など恐怖の声,https://news.yahoo.co.jp/articles/08df85becbe97edbb511888684792fb32c5a4234,12/6(水) 20:45
2023_1207_1523,life,ライフ,7,まいどなニュース,「診察券はポーチから出して」医療事務員のお願いが話題　提示求めると「ほい」とポーチごと投げる患者も,https://news.yahoo.co.jp/articles/d70bc99ee43273fd49c4e3ecfa285ab33aeca094,12/7(木) 7:30
2023_1207_1523,life,ライフ,8,ファイナンシャルフィールド,タンス預金の200万円があります。ウチは田舎の民家ですし、調査が入ってバレるなんてことはないですよね……？,https://news.yahoo.co.jp/articles/96c14a924d9fc99bc3dc0d456fd24410e473b8f4,12/7(木) 12:13
2023_1207_1523,life,ライフ,9,婦人公論.jp,ビール500ml缶2本の晩酌が至福の時間。酒好きだった父の遺伝子を引き継ぎ、22歳から飲み続けて,https://news.yahoo.co.jp/articles/67394f96c2a47028e2573a9c45ae3b7d11ab2fe2,12/7(木) 12:51
2023_1207_1523,life,ライフ,10,まいどなニュース,ご飯をチビチビ食べていた野良猫を家族に→おうちで常にチビチビ食べてたら「おブちゃん」に　飼い主は「毎日幸せ」,https://news.yahoo.co.jp/articles/052e24d7007084619e1b5fde230efc6a021368e8,12/7(木) 14:20
2023_1207_1523,life,ライフ,11,マイナビ子育て,平愛梨さん「おかわり何回するの？ 足りない」息子たちがハマッて一瞬でなくなるごはん「美味しいの間違いない」,https://news.yahoo.co.jp/articles/0709d9b6565dcf82473c1c4fb3cb839604248357,12/7(木) 12:10
2023_1207_1523,life,ライフ,12,ファイナンシャルフィールド,小銭をコツコツためて10万円達成！「無料で」両替する方法はありますか？,https://news.yahoo.co.jp/articles/322ee3461dccc7c8967e1c705fe7372b9713ec9f,12/7(木) 12:30
2023_1207_1523,life,ライフ,13,婦人公論.jp,東海林さだお85歳「脳梗塞の入院後、ビールが飲めなくなった。食生活が変わり食事量は半分になったけれど、食への好奇心は変らずに」,https://news.yahoo.co.jp/articles/ddb5551dfdbfbf1b2230391518eb6de9d54ece8a,12/7(木) 12:32
2023_1207_1523,life,ライフ,14,FNNプライムオンライン,「撮ってほしいのはこれ…」妻の理想と夫“撮影写真”のギャップに共感の声…撮り直したら素敵な構図に?その後を聞いた,https://news.yahoo.co.jp/articles/3fffcf63eeffbb83367aa74fd4689f529d1faf05,12/7(木) 11:17
2023_1207_1523,life,ライフ,15,Hint-Pot,私立中高一貫校の給食でホテルオークラの味　プロが作ったビーフストロガノフに生徒「いつもの100倍うまい」　給食費は？,https://news.yahoo.co.jp/articles/8a47f41af8dd0da253fed0b7397dbf4a099cb2f8,12/7(木) 9:10
2023_1207_1523,life,ライフ,16,ねとらぼ,赤ちゃんが「ママ」と呼んだ先に居たのは……　娘が勘違いした“まさかの存在”に「きょういち笑いました」,https://news.yahoo.co.jp/articles/e6122620a4a65e3d1222eff5109e235d841f4a40,12/6(水) 19:15
2023_1207_1523,life,ライフ,17,Hint-Pot,ストリートビューで生前の父の姿を偶然発見　4年前に84歳で死去　奇跡の“再会”にネット「守られている」「私も探した」,https://news.yahoo.co.jp/articles/cf60672ef3b096ec4d1a890a16094cc8bc1f6125,12/6(水) 10:12
2023_1207_1523,life,ライフ,18,ファイナンシャルフィールド,エアコンの「電気代」と灯油ストーブの「灯油代」、1ヶ月でいくらかかる？,https://news.yahoo.co.jp/articles/0253e189c0ab42aa854a9baf1ef1f0676fb55c8f,12/4(月) 13:30
2023_1207_1523,life,ライフ,19,弁護士ドットコムニュース,「秘伝のタレの作り方教えろ！」食物アレルギー主張の客に困惑、店に表示義務はあるの？,https://news.yahoo.co.jp/articles/16f800c073d6c51bc6159e0af61c3d4120531a56,12/7(木) 9:47
2023_1207_1523,life,ライフ,20,よろず～ニュース,「絶対にやめて」玉子焼き器で揚げ物はNG！メーカーの注意喚起に「10年ぐらいやってた」「血の気が引いた」,https://news.yahoo.co.jp/articles/a54eb0ae41995a041e5bb044e685f8bcbef209fa,12/7(木) 15:00
2023_1207_1523,life,ライフ,21,OTONA SALONE,紀子さまは涙を拭いたティッシュを「私が預かります」と受け取った。映画監督が舞台挨拶で体験した感動のエピソード,https://news.yahoo.co.jp/articles/1eca13ab057259a9434c61fee4a123d7f809a410,12/6(水) 21:11
2023_1207_1523,life,ライフ,22,ほ・とせなNEWS,滑り台大好きなワンちゃんが長い滑り台に挑戦すると…→上手なバック姿に「上手」「可愛すぎる」,https://news.yahoo.co.jp/articles/3c508ba52ee724f8b9bc11427d4502c31c8b0c1e,12/7(木) 12:30
2023_1207_1523,life,ライフ,23,LEON.JP,モテる大人は、毎日同じバッグじゃダメなんです！,https://news.yahoo.co.jp/articles/35955ec073d90acd188fc572af16e11df32f7ce8,12/7(木) 14:00
2023_1207_1523,life,ライフ,24,BuzzFeed Japan,【ユニクロ】はいた瞬間から暖かい。今なら1000円オフで買える「楽ちんパンツ」上品デザインでオンオフ着回せます！,https://news.yahoo.co.jp/articles/42a5c3693c4e2a84dccbc422377dd99010d838e9,12/4(月) 12:35
2023_1207_1523,life,ライフ,25,BuzzFeed Japan,【ディズニーお土産】デパ地下みたいな高級感。クリスマス限定の「チョコレート缶」飾っておきたくなるかわいさです！,https://news.yahoo.co.jp/articles/558a877df8d6b36f445894d14a9d932665419aa0,12/7(木) 13:35
2023_1207_1523,life,ライフ,26,Hint-Pot,中学受験のライバル蹴落とし　母親「受験番号のスクショは送っていけない」　Xユーザー「ゾッとする」「ひどすぎる」,https://news.yahoo.co.jp/articles/af20771566fadd61407c45e5c980f906321582c4,12/7(木) 11:11
2023_1207_1523,life,ライフ,27,マイナビニュース,「新NISA」やらないほうがいい人の特徴4つ,https://news.yahoo.co.jp/articles/8dc4f04e0e9e6ee688147b18026006cb190b0a08,12/7(木) 12:11
2023_1207_1523,life,ライフ,28,ねとらぼ,七五三のお祝いで記念写真→全員“ジョジョ立ち”だと……!?　ノリノリの3人家族に「最高すぎる」と祝福の声,https://news.yahoo.co.jp/articles/61cfb8149e4b318a09a726d97acdcd41a54b7861,12/4(月) 20:30
2023_1207_1523,life,ライフ,29,朝日新聞EduA,【2024大学入試直前情報】河合塾分析「少子化と入学定員増で競争率緩和、女子は理工系・医療系の志願者増える」,https://news.yahoo.co.jp/articles/120a0c18e8dc38aa8b1e79883fb59c3dc9244b67,12/7(木) 11:32
2023_1207_1523,life,ライフ,30,日刊ゲンダイDIGITAL,安倍元首相「国葬」の是非問う声が“再燃”のナゼ…安倍派絡みの醜聞相次ぎ、SNSで急拡大,https://news.yahoo.co.jp/articles/cc31aed4dadcc6a3f6227f831088f8e8c309222e,12/7(木) 9:06
2023_1207_1523,life,ライフ,31,LIMO,【ビックカメラ・福袋】最高倍率は1300倍超に!! 締切は12/7（木）「20:59」、大人気「新春福箱」の抽選申し込み,https://news.yahoo.co.jp/articles/c21d78fe2b48c7b18128b5ff63a9f1dc591e89e9,12/6(水) 18:56
2023_1207_1523,life,ライフ,32,LIMO,超ビビリ猫ちゃん　シンクに水が落ちる音を聞いただけなのに…思わず目を疑う動作に「申し訳ないけど可愛い」,https://news.yahoo.co.jp/articles/31085cde5cc02e1ca9c98a85cfe0314bfd4d1242,12/7(木) 11:52
2023_1207_1523,life,ライフ,33,kufura,「洗面所に置いたら便利になったもの」トップ5！ちょっとしたことで日々の動作が効率的に,https://news.yahoo.co.jp/articles/39fb2be7e45796481691715aa5830671973c7d10,12/5(火) 22:10
2023_1207_1523,life,ライフ,34,産経新聞,宝塚雪組公演が開演直前に中止　歌劇団「出演者の体調不良」,https://news.yahoo.co.jp/articles/7aec8defc8aec0982db5345201c2004818120662,12/7(木) 13:23
2023_1207_1523,life,ライフ,35,朝日新聞EduA,【企業入社難易度ランキング】〈化学・医薬品編〉コロナ下で製薬会社が浮上、首位は大胆に業務転換した企業,https://news.yahoo.co.jp/articles/0f502a0c6f9d2aecd9fa6424114ec94d913aa264,12/7(木) 11:53
2023_1207_1523,life,ライフ,36,BuzzFeed Japan,GUの「高見えワンピース」が2990円とは思えないオシャレさ！レースの透け感がカワイイし、1枚でコーデが完成するんです！,https://news.yahoo.co.jp/articles/3869cfaa854025b0318c1decb11ce9a64b5eae58,12/7(木) 12:35
2023_1207_1523,life,ライフ,37,東京バーゲンマニア,【売り切れ続出】「マジ天才かよ...」芸人やす子が本気で作ったセブンのパスタ、食べてみたら想像以上の味だった。≪編集部レポ≫,https://news.yahoo.co.jp/articles/54717cd6be0f67bc19046cc6cf6f54922315c3d7,12/4(月) 19:00
2023_1207_1523,life,ライフ,38,ねとらぼ,見た人みんなを笑顔にする、今は天国にいる猫との最高の1枚が85万表示！　「大好きな写真」「かわいがられてたんだなぁ」,https://news.yahoo.co.jp/articles/874081ca2c44cf3a886f1bdf3f353c124400626b,12/4(月) 20:05
2023_1207_1523,life,ライフ,39,ファイナンシャルフィールド,クレカ加盟店でランチをしたら「ランチではクレカ払いを受け付けていない」と言われました。これって違法ですよね？,https://news.yahoo.co.jp/articles/c646b4d0aa5510368a4cfc78aa76d9f5c46692b6,12/6(水) 11:30
2023_1207_1523,life,ライフ,40,婦人公論.jp,柴田理恵　要介護の母と会うと１カ月介護サービスを受けられず、施設にも入れず…＜孤独＞と向き合ったコロナ禍の遠距離介護で気づかされたこと,https://news.yahoo.co.jp/articles/769f3d25be69a5723dfc3422d537cd71ab0a5967,12/6(水) 12:32
