scrp_date,scrp_time,genre_en,genre_jp,rank,media_jp,title,link,date_original
2023-12-20,20:12,sports,スポーツ,1,Full-Count,巨大戦力ゆえの苦悩「転校もできない」　東浜巨が改善訴え…深刻すぎる“移動問題”,https://news.yahoo.co.jp/articles/c7c534f08bf9700616eb5088d10ce1bb678c5ca4,12/20(水) 17:39
2023-12-20,20:12,sports,スポーツ,2,日刊スポーツ,松井裕樹、パドレスと契約合意でダルビッシュと同僚に　WBCでは“ダル先生”の助言に救われる,https://news.yahoo.co.jp/articles/10f8dd8127adf2d68f0414fb6067b4e16c05422f,12/20(水) 19:01
2023-12-20,20:12,sports,スポーツ,3,夕刊フジ,山川穂高にさっそく福岡の洗礼、ソフトバンク入団会見の異様さ　代表質問で地元局から〝苦情〟出待ちファンもわずか４人,https://news.yahoo.co.jp/articles/6d5b9de872e221c42ab6b65c072ea446c15d69e6,12/20(水) 17:00
2023-12-20,20:12,sports,スポーツ,4,ゲキサカ,「代表選出の一報を受け、僕自身が1番驚きました」甲府のルーキーDF三浦颯太が日本代表に追加で初招集!,https://news.yahoo.co.jp/articles/21249c4900f323037edbe4dd8db6c767423ec76b,12/20(水) 17:19
2023-12-20,20:12,sports,スポーツ,5,RONSPO,「勝てれば何でもいいのか」「昔の巨人みたい」大バッシングのソフトバンクは本当に山川穂高を獲得すべきだったのか？,https://news.yahoo.co.jp/articles/050163537a45c588954bb931c10665cfd505154f,12/20(水) 8:07
2023-12-20,20:12,sports,スポーツ,6,夕刊フジ,楽天、女子ゴルフツアー〝スピード撤退〟の裏事情　三木谷会長の激怒と…同一線上にある苦戦する本社の経営状態,https://news.yahoo.co.jp/articles/5b8206ee8842ab433ff8e9edcddbf61e41506b6e,12/20(水) 17:00
2023-12-20,20:12,sports,スポーツ,7,中日スポーツ,女子ゴルフ　イ・ボミ「日本ツアーのすべてが好きでした」特別功労賞に壇上で涙【JLPGAアワード】,https://news.yahoo.co.jp/articles/5ad10cc51ea05d9eff2cf1f4c670ef3b3d3a3fa6,12/20(水) 18:35
2023-12-20,20:12,sports,スポーツ,8,デイリースポーツ,ポスティングでの米大リーグ挑戦を希望する選手が続出する現状に球界ＯＢが疑問符　「なんか勘違いしてるんじゃないか」　落合博満氏はかつて「契約金返してから言え」と提言,https://news.yahoo.co.jp/articles/cc7a2bb45438b58ea345cbd02417b1aa508d4630,12/20(水) 17:45
2023-12-20,20:12,sports,スポーツ,9,Full-Count,ド軍、山本由伸へ360億円超の大型契約を提示か　資金面は劣るも…大谷翔平とW獲りへ,https://news.yahoo.co.jp/articles/5b5485803dd2f47fa64c70f8a107b30c642d6f43,12/20(水) 11:06
2023-12-20,20:12,sports,スポーツ,10,デイリースポーツ,イチロー氏　人気女優との２ショに「え、どんな繋がり？？」「マジ～」と驚きの声,https://news.yahoo.co.jp/articles/921a59dd1838dee040cc2fcdf2ef0944d68890c2,12/20(水) 15:16
2023-12-20,20:12,sports,スポーツ,11,月刊陸上競技,【陸上】やり投・北口榛花がアスリート・オブ・ザ・イヤー！女子フィールド種目初の快挙／陸連アワード,https://news.yahoo.co.jp/articles/58f6bf98253f962fbdb86186b2485b3524f515a2,12/20(水) 18:08
2023-12-20,20:12,sports,スポーツ,12,スポニチアネックス,小野伸二氏　中村俊輔氏の引退試合で中田英寿氏に出場打診も拒否された裏話を披露,https://news.yahoo.co.jp/articles/d48ae149de21ecef6fc14144e2b6c139e9931985,12/20(水) 18:57
2023-12-20,20:12,sports,スポーツ,13,日刊スポーツ,【ヤクルト】高橋奎二が将来的なメジャー挑戦を球団に直訴「しっかりこっちで結果残して」,https://news.yahoo.co.jp/articles/11c2f0440247893556d27aa0dc1770302612d532,12/20(水) 15:54
2023-12-20,20:12,sports,スポーツ,14,Full-Count,突然現れた大谷翔平は「ハリウッドの待遇」　一躍話題に…NY紙も注目する“スターの証”,https://news.yahoo.co.jp/articles/cdc97965ee6d73061afdb4a3cac8c49851376a6d,12/20(水) 14:01
2023-12-20,20:12,sports,スポーツ,15,デイリースポーツ,オリックス　ＦＡ加入の西川龍馬の人的補償リストで山本由伸をプロテクト　福良ＧＭが明言「もちろん」,https://news.yahoo.co.jp/articles/4e4cd535ff54c8df82adc2009b4d9db2d3288b19,12/20(水) 5:01
2023-12-20,20:12,sports,スポーツ,16,西スポWEB OTTO！,「来年さらに活躍する」3度首位打者に輝いたヤクルト青木宣親が阪神の若手選手に太鼓判！「後半本当に良くなってきていた」,https://news.yahoo.co.jp/articles/0203a7bbc645c7181b529cdc872df15cdce63f2c,12/20(水) 18:33
2023-12-20,20:12,sports,スポーツ,17,西スポWEB OTTO！,中日移籍の中田翔が秋広優人連れて〝九州男旅〟　恐竜に食べられ…仲良しショット公開にファン「大きい子供たちや」「楽しさダダ洩れ」,https://news.yahoo.co.jp/articles/2ab24beaec52fb8cdcfbab04afcd16a39a522d08,12/20(水) 19:08
2023-12-20,20:12,sports,スポーツ,18,中日スポーツ,「浦和のレベルはイングランド2部下位」浦和レッズ完敗に英メディア酷評「暑さの中、追いかける選手たちにとっては罰ゲーム」,https://news.yahoo.co.jp/articles/888b432e698ad03c503c5c10aa89e89bcb76dfef,12/20(水) 10:25
2023-12-20,20:12,sports,スポーツ,19,東スポWEB,【大相撲】元貴闘力がライバルの寺尾を追悼「俺らと組んでなかったら理事になれた」,https://news.yahoo.co.jp/articles/b73cb7d33a9474f93ccecda170b7ad60461f5b0d,12/20(水) 17:11
2023-12-20,20:12,sports,スポーツ,20,ENCOUNT,ノッコン寺田、地上波出演で人気芸人の服をビリビリに　「BreakingDown」批判に“ブチギレ”,https://news.yahoo.co.jp/articles/c4d0d4c819840a306c1fa29b96bcc0f018a95935,12/20(水) 13:45
2023-12-20,20:12,sports,スポーツ,21,東スポWEB,【ソフトバンク】周東佑京が語る進化の前兆「ヒットが増えれば四球も増える。そこは絶対」,https://news.yahoo.co.jp/articles/5c19eb1a219b0ba9102a696d7b4b161c87345262,12/20(水) 19:26
2023-12-20,20:12,sports,スポーツ,22,日刊スポーツ,「日本には馬がいた。その名は大谷翔平」メキシコ大統領が大谷のサイン入りユニホーム贈られ自慢,https://news.yahoo.co.jp/articles/4f3577e403fca78fa9dadea832a42602bb972d74,12/20(水) 16:36
2023-12-20,20:12,sports,スポーツ,23,デイリースポーツ,大阪出身の巨人・坂本勇人が青森の光星学院に進学したワケ　「最初は尽誠学園に行きたかった」「ユニホームが格好いいイメージ」,https://news.yahoo.co.jp/articles/672fd4ae662faaed94115501961c8f49036fa3ea,12/20(水) 19:19
2023-12-20,20:12,sports,スポーツ,24,スポニチアネックス,大谷翔平のボールをほぼ初見で“ビタ止め”した捕手・中村悠平「佐々木朗希も速いんですけど…」,https://news.yahoo.co.jp/articles/cf9cf5added32862662cda5c9e596a43e3f8167c,12/19(火) 20:36
2023-12-20,20:12,sports,スポーツ,25,日刊スポーツ,大谷翔平の抜けたエンゼルス、今季ナ・リーグのサイ・ヤング賞左腕ブレーク・スネルと契約交渉,https://news.yahoo.co.jp/articles/604fe734921d55da72be4ee3695ba354a3840e66,12/20(水) 17:40
2023-12-20,20:12,sports,スポーツ,26,ゲキサカ,来年2月メッシ来日、J1王者神戸との親善試合一般チケット価格を発表…今夏パリSGvsインテルの“1/4”,https://news.yahoo.co.jp/articles/b0db7245cf5a7682861d16da3e981595df76f68f,12/20(水) 17:44
2023-12-20,20:12,sports,スポーツ,27,西スポWEB OTTO！,J2長崎社長「急な状況に困惑」　カリーレ監督がサントスFC監督への就任意思を表明　契約更新したはずが…　クラブ間交渉はなし,https://news.yahoo.co.jp/articles/39138fd05f0f1ca1641b6c5ba99ee340860ad3d2,12/20(水) 14:40
2023-12-20,20:12,sports,スポーツ,28,Full-Count,元中日助っ人、46歳で成し遂げた快挙　母国で“MVP”の衝撃…鉄腕は依然健在,https://news.yahoo.co.jp/articles/a4e884db6ea405cda28bbf44af59e67d6a7d1e09,12/20(水) 17:12
2023-12-20,20:12,sports,スポーツ,29,ゴルフ総合サイト ALBA Net,JLPGAアワードで山下美夢有が“5冠”　イ・ボミ、櫻井心那らが和装＆ドレス姿で百花繚乱,https://news.yahoo.co.jp/articles/d80f35d5a0fe2307f50435f0d8bf236a697972ef,12/20(水) 15:43
2023-12-20,20:12,sports,スポーツ,30,スポニチアネックス,【兵庫ゴールドT】5着セキフウの武豊「深いダートは良くないのかも」「でも、復調してきています」,https://news.yahoo.co.jp/articles/12bc0ae5ef2914fb545d57187b044c384c880515,12/20(水) 17:01
2023-12-20,20:12,sports,スポーツ,31,中日スポーツ,女子ゴルフ　原英莉花、モデル級のスタイルで魅了　女子プロたちがドレスアップして集合【年間表彰式】,https://news.yahoo.co.jp/articles/2980b419add8a2739d9e7677ed18f00ed31352ab,12/20(水) 18:56
2023-12-20,20:12,sports,スポーツ,32,Full-Count,衝撃を受けた“1日8000人”「冗談だろ？」　鷹・和田毅が18年間社会貢献を続けるワケ,https://news.yahoo.co.jp/articles/c5450b70a0cd4fd9e4016208a03a0f90d1ba55ab,12/18(月) 7:50
2023-12-20,20:12,sports,スポーツ,33,netkeiba.com,有馬記念でオルフェーヴル以来の快挙なるか ムーア騎手と再タッグのダービー馬参戦,https://news.yahoo.co.jp/articles/7bcceed27693c3842f6dce71ab453065dbf5e343,12/20(水) 19:00
2023-12-20,20:12,sports,スポーツ,34,CoCoKARAnext,大谷翔平との比較にピシャリ “韓国の至宝”イ・ジョンフが「僕と大谷選手は比べられない」と訴え続けたワケ,https://news.yahoo.co.jp/articles/da723ae0a3e98595f92fd86625fdbfe11850dba1,12/20(水) 10:30
2023-12-20,20:12,sports,スポーツ,35,中日スポーツ,ヤクルト・石川雅規、減額制限MAXで更改　球界最年長43歳「チャンスをいただいて本当に感謝」,https://news.yahoo.co.jp/articles/58e00a90b2421b22bce8cdec4ac553c9f5ccc08c,12/20(水) 19:33
2023-12-20,20:12,sports,スポーツ,36,日刊スポーツ,【データ】松井裕樹パドレス合意、同僚ダルビッシュと同時名球会入りの可能性　５月頃に実現か,https://news.yahoo.co.jp/articles/2caebccd600964884fff2ae15a77c650d3c9ed32,12/20(水) 19:01
2023-12-20,20:12,sports,スポーツ,37,Full-Count,盗塁王の鷹・周東は4500万円でサイン「妥当かな」　WBCで世界一…3年ぶり2度目のタイトル,https://news.yahoo.co.jp/articles/785c0795db7180b27ad08c659ee8c49619da274c,12/20(水) 10:51
2023-12-20,20:12,sports,スポーツ,38,スポニチアネックス,松井秀喜氏が会う度に「あんなコントロール良かったか？」と“口撃”　「センターから見てた時は…」,https://news.yahoo.co.jp/articles/595c04e3c126f7b74e3b6fa2b4739845406fbdf3,12/20(水) 18:50
2023-12-20,20:12,sports,スポーツ,39,中日スポーツ,女子ゴルフ　吉田優利「マーメイドな感じで」自らデザインのドレス披露　菅沼菜々は大胆カット【年間表彰式】,https://news.yahoo.co.jp/articles/fc91471b4df6b60fabe57ab106ffee2c7d896cd3,12/20(水) 19:14
2023-12-20,20:12,sports,スポーツ,40,Full-Count,巨人元ドラ1がスカウトから“現役復帰”　西武は巨漢スラッガー獲得…20日の去就,https://news.yahoo.co.jp/articles/144588fcb548b83f38168a6f7ec180778c89abc4,12/20(水) 19:22
