scrp_date,scrp_time,genre_en,genre_jp,rank,media_jp,title,link,date_original
2025-08-07,09:36,domestic,国内,1,弁護士JPニュース,「悪魔のような制度」自治医大・修学金等3766万円の“一括返済”巡り卒業生の医師が「違憲」主張　大学側は否定し“反訴”予告,https://news.yahoo.co.jp/articles/42e99371562be2f9f76a478134f85b2910a46fd2,8/6(水) 19:30
2025-08-07,09:36,domestic,国内,2,日刊スポーツ,ひろゆき氏「宮城県知事との話し合いすら逃げる」神谷代表をバッサリ「外国と戦うと言っても…」,https://news.yahoo.co.jp/articles/7b9dc8f5b2c68d2cd17f1bf2e85b9c4a9bd12fe3,8/7(木) 6:50
2025-08-07,09:36,domestic,国内,3,日刊スポーツ,堀江貴文氏が激怒「バカめ」“居眠り”議員をたたく風潮に警鐘「だから能力の高い人間が…」,https://news.yahoo.co.jp/articles/09ff86ad1ea937eb31713c81d9fa2709a51c292c,8/7(木) 6:34
2025-08-07,09:36,domestic,国内,4,日刊スポーツ,堀江貴文氏「式典なんてつまんねーんだから居眠りくらいするだろよ」石破首相「目つぶり」に言及,https://news.yahoo.co.jp/articles/9b0277e3c4e95ac178e51d6671c9145c4b70d22a,8/7(木) 6:46
2025-08-07,09:36,domestic,国内,5,弁護士ドットコムニュース,「明徳は辞退したのに」広陵の暴力問題、甲子園出場に波紋…「処分の有無」が判断の分かれ目か,https://news.yahoo.co.jp/articles/b57dbcaeb14d5224427ba44547c87b3b47e1287b,8/6(水) 13:06
2025-08-07,09:36,domestic,国内,6,産経新聞,不法滞在ゼロ計画、鈴木法相「これから結果出てくる」ビザ免除停止など「外務省にも要請」　「移民」と日本人,https://news.yahoo.co.jp/articles/995963b91bee781900dc1c2e31240facb4c71b0d,8/7(木) 7:00
2025-08-07,09:36,domestic,国内,7,東海テレビ,盗難車と知りながらプリウス1台を4万円で売り処分を斡旋か 韓国籍の56歳男を逮捕 入手ルートなど捜査,https://news.yahoo.co.jp/articles/33bc50f2ac5de7fedcafb0955bc48bfe0d6d9ac3,8/7(木) 6:26
2025-08-07,09:36,domestic,国内,8,ABEMA TIMES,小林鷹之氏、総裁選出馬に明言避けながらも「常にそういう気持ちで」 当選同期・宮崎謙介氏は「鷹ちゃんしかいない」,https://news.yahoo.co.jp/articles/5be758baa80fd77b55f9041388527051561d480a,8/7(木) 6:51
2025-08-07,09:36,domestic,国内,9,よろず～ニュース,百田尚樹氏「過ちを繰り返しません」というフレーズに疑問符「原爆に関して何も過ちを犯していない」,https://news.yahoo.co.jp/articles/c00323c48120d8223d7e2415cdfa7e9125be2075,8/6(水) 19:30
2025-08-07,09:36,domestic,国内,10,毎日新聞,詐欺容疑で「闇金ウシジマくん」出演俳優を再逮捕　「打ち子」か,https://news.yahoo.co.jp/articles/e12737c85440831806e3a59cdf7347be73b90eb1,8/6(水) 20:22
2025-08-07,09:36,domestic,国内,11,読売新聞オンライン,参政党の神谷代表、宮城県の水道事業巡り村井知事が申し入れた対談「応じかねる」…知事「逃げた」,https://news.yahoo.co.jp/articles/e86f58ee10228feadba9088478ce79817c7428d9,8/7(木) 7:10
2025-08-07,09:36,domestic,国内,12,FNNプライムオンライン,70代母親の“一番の楽しみ”奪われ…木になったリンゴを根こそぎもぎ取り走り去る自転車2人組「たぶん80代くらいの夫婦」買い物帰りの盗みか　東京・足立区,https://news.yahoo.co.jp/articles/9cd54aacfa46acef9c4dc990fdd0cfb66c6f625b,8/7(木) 6:12
2025-08-07,09:36,domestic,国内,13,日刊スポーツ,「広島県知事」トレンド入り　平和記念式典スピーチに称賛の声「自信過剰な指導者が…」／全文,https://news.yahoo.co.jp/articles/4bea9e05466c24715aa1612b472fc728c438ecd4,8/6(水) 13:08
2025-08-07,09:36,domestic,国内,14,産経新聞,保守党・百田尚樹氏、本会議中の居眠り指摘投稿に「文句あるんかい！」　表決方法を疑問視,https://news.yahoo.co.jp/articles/5cf4fc78957e85fc8f55e8e7ee25570dda869efe,8/7(木) 7:00
2025-08-07,09:36,domestic,国内,15,デイリースポーツ,橋下氏「ポスト石破で名前の有力人物が」衝撃情報→玉木代表を「全権委任の財務大臣」起用と言ってる　近く発信か　「１７８万円の壁」自由にドウゾ→「断ったら腰砕け」と　カンテレ番組,https://news.yahoo.co.jp/articles/3c5fb67ce42c7aef074f779c1fe1076a931b7fc7,8/6(水) 15:25
2025-08-07,09:36,domestic,国内,16,産経新聞,自民内から不満噴出の石破首相　かつて民主に苦言「党内まとまらなきゃ何も進むはずない」,https://news.yahoo.co.jp/articles/41d8965400b9b83ef84cc20685aa6bee9bdf4fc8,8/7(木) 7:00
2025-08-07,09:36,domestic,国内,17,日刊スポーツ,紀藤正樹氏「人に厳しく自分に甘い」　国会居眠り物議の日本保守党百田尚樹代表に一言,https://news.yahoo.co.jp/articles/e67a1653b8049cd6de194fb4052d660442194a12,8/7(木) 9:03
2025-08-07,09:36,domestic,国内,18,TBS NEWS DIG Powered by JNN,「ジャングリア沖縄」は成功するのか?700億円プロジェクトに横たわる「2つの懸念」,https://news.yahoo.co.jp/articles/2be2c456a9fede6dbe43d5051dfe6b3d56f6518b,8/7(木) 7:31
2025-08-07,09:36,domestic,国内,19,共同通信,新鉱物アマテラス石を発見　岡山の翡翠から、東大など,https://news.yahoo.co.jp/articles/30fc3e8f27347509dd5298b2aaa13331bbdd8fe0,8/7(木) 0:06
2025-08-07,09:36,domestic,国内,20,日刊スポーツ,48歳女性歌手「石破っち、どうしても嫌いになれへんのや」踏ん張る石破茂首相への揺れる思い吐露,https://news.yahoo.co.jp/articles/8b6ec80e91a65e356805839e0affde66cc5348ae,8/7(木) 7:23
2025-08-07,09:36,domestic,国内,21,弁護士ドットコムニュース,『まんが甲子園』最優秀賞作品が失格に…何が問題だった？　「見た目が似ているだけ」＝「著作権侵害」ではない,https://news.yahoo.co.jp/articles/47ca3db26b674336aab92f291afe1473a5e9b96e,8/6(水) 12:39
2025-08-07,09:36,domestic,国内,22,ABEMA TIMES,現役教師ら「主務教諭」導入の見送りを要望,https://news.yahoo.co.jp/articles/7345ac676b72a8106caea8725d7a0621aa58cad9,8/7(木) 7:54
2025-08-07,09:36,domestic,国内,23,産経新聞,外国人人口、15年後に総人口の1割　鈴木法相の私的勉強会試算「国民の安全が絶対条件」　「移民」と日本人,https://news.yahoo.co.jp/articles/ef5914c5bad8c4016b07aee5b1864b094fe14c78,8/7(木) 7:00
2025-08-07,09:36,domestic,国内,24,FNNプライムオンライン,【ヒグマ速報】ドライブレコーダーに瞬間が―道路に飛び出したクマが乗用車と“衝突”そのまま山の中へ去るも車は破損―町内では家庭菜園荒らされる被害相次ぎ「ヒグマ注意報」で警戒＜北海道上ノ国町＞,https://news.yahoo.co.jp/articles/a38ea2ddb892154e4d51abcea111d60511d0d4fd,8/7(木) 6:03
2025-08-07,09:36,domestic,国内,25,47NEWS,「１０万！２３時から！」闇バイトの犯行指示、連絡開始から逮捕までわずか「１日半」　ギャンブルで借金、消費者金融→ヤミ金→強盗実行役に……裁判員裁判で見えた経緯,https://news.yahoo.co.jp/articles/cad89808f8ac1e73c24ef2f77af73aa0c85cb2c3,8/7(木) 9:02
2025-08-07,09:36,domestic,国内,26,東海テレビ,追突し数十メートル引きずったか…原付バイクの19歳男性が死亡したひき逃げ事件 大型トラックの55歳運転手を逮捕,https://news.yahoo.co.jp/articles/ce99d826dd36f763d5a25b568a392cdf61965ade,8/7(木) 6:18
2025-08-07,09:36,domestic,国内,27,共同通信,医師と歯科医師28人を処分　厚労省、免許取り消しなど,https://news.yahoo.co.jp/articles/f763a0bcc72df6cedca9544dbd7a682432a1b7aa,8/6(水) 18:21
2025-08-07,09:36,domestic,国内,28,TBS NEWS DIG Powered by JNN,お茶の水女子大でアカハラ　30代講師が「一方的に学生非難」　言動振り返る“行動改善プログラム”を受講予定,https://news.yahoo.co.jp/articles/2a372d46e20fdb3605def684451a24c62c9d2d6d,8/6(水) 21:53
2025-08-07,09:36,domestic,国内,29,デイリースポーツ,堀江貴文氏、百田代表に激怒の橋下徹氏にチクリ「だから民間から政治家になりたいって思わないんすよ」,https://news.yahoo.co.jp/articles/7f9c7d9d48db28cc1070e96f55a760212d6f9978,8/6(水) 13:11
2025-08-07,09:36,domestic,国内,30,東海テレビ,実際は違うのに“末期がん”と偽る…クリニックが診療報酬573万円余りを不正請求 保険医療機関の指定取消へ,https://news.yahoo.co.jp/articles/a3ffe08418830bacb92d2174698dac589c51dd43,8/6(水) 21:19
2025-08-07,09:36,domestic,国内,31,読売新聞オンライン,運転士に急行から各駅への変更知らされず、後続の急行待たずに出発しポイントこじ開け故障…副都心線,https://news.yahoo.co.jp/articles/8e030dd29a7b9f8f00b4f3d9df9262c96c3e8f85,8/7(木) 9:13
2025-08-07,09:36,domestic,国内,32,共同通信,金沢市で床下浸水2地域、19カ所で道路冠水,https://news.yahoo.co.jp/articles/69a0e5d851d4984b993b8cb8dd1282e852cd7ffd,8/7(木) 8:54
2025-08-07,09:36,domestic,国内,33,日刊スポーツ,東大卒タレント神谷明采、韓国の若者の投票率の高さに「日本も今後エンタメと近くなって…」,https://news.yahoo.co.jp/articles/e0e6898146ca018eed5b9d89706955e5ff57b915,8/7(木) 6:10
2025-08-07,09:36,domestic,国内,34,共同通信,宮城知事、神谷代表は「逃げた」　水道事業発言巡り批判,https://news.yahoo.co.jp/articles/663264da04da51de1925cf55ef0d7257b319b799,8/6(水) 15:53
2025-08-07,09:36,domestic,国内,35,共同通信,日本人、過去最大90万人減　1億2千万人割れ間近,https://news.yahoo.co.jp/articles/e109e0ad8f5c86446270b8cac672f8622e9fd2ec,8/6(水) 17:00
2025-08-07,09:36,domestic,国内,36,共同通信,教え子装いSNSで元同僚を中傷　東大教授に22万円賠償命令,https://news.yahoo.co.jp/articles/d2c73ec292c25b704e97311a497dbe543a920344,8/6(水) 19:35
2025-08-07,09:36,domestic,国内,37,日刊スポーツ,百田尚樹氏が違和感指摘、平和記念式典の出席者挨拶の“たった10文字”に「原爆に関して何も…」,https://news.yahoo.co.jp/articles/8629fda61eb63e5488150b4458e9c8b7db964d0b,8/6(水) 16:17
2025-08-07,09:36,domestic,国内,38,日本農業新聞,高温・渇水で「生産量減る」8割　農家に緊急アンケート　「かつてない危機」の声も,https://news.yahoo.co.jp/articles/d46ce054e9e94356c3541f6de09dcfd3efd5fce2,8/7(木) 8:10
2025-08-07,09:36,domestic,国内,39,信濃毎日新聞デジタル,日本の人気登山スポットで広がる「協力金制度」…課題は認知度の低さ　トイレ維持を求める募金箱には月6万円集まるが、協力金には月1万1400円,https://news.yahoo.co.jp/articles/5a214f2c87f6831bd931c301912e5c59a472d707,8/7(木) 6:20
2025-08-07,09:36,domestic,国内,40,TBS NEWS DIG Powered by JNN,熊本県、大分県で最大震度3の地震　熊本県・南小国町、熊本小国町、産山村、大分県・九重町,https://news.yahoo.co.jp/articles/2ec0530a89b2395df986ee4c7a54063940c3d95e,8/7(木) 8:52
