scrp_date,scrp_time,genre_en,genre_jp,rank,media_jp,title,link,date_original
2024-02-06,21:30,local,地域,1,MBSニュース,【速報】琵琶湖で55歳の不動産会社社長の男性遺体見つかる　愛知県に住む男女を逮捕　男性経営の会社口座から現金50万円をコンビニATMで引き出した疑い　滋賀県警,https://news.yahoo.co.jp/articles/7a810933e9f07b5df46d4990120dc35569ac80cd,2/6(火) 18:30
2024-02-06,21:30,local,地域,2,神戸新聞NEXT,神戸の精神科病院で死亡の入院女性、7日間の「違法な身体拘束が原因」　遺族が損害賠償求め訴訟へ,https://news.yahoo.co.jp/articles/effe2f3a713801353536f78b7d1077268b37d25f,2/6(火) 17:10
2024-02-06,21:30,local,地域,3,MBSニュース,腎不全で透析治療の男性　新型コロナ陽性で転院するも透析治療されず死亡　遺族が約5000万円の賠償を求め病院側を提訴　大阪地裁,https://news.yahoo.co.jp/articles/8220c785ddbd300dfe181adb2a353dae987b676d,2/6(火) 20:28
2024-02-06,21:30,local,地域,4,BSS山陰放送,高級「ガンプラ」次々”予約済”のワケ　ガンプラ塗装技術を買われて自動車販売会社に入社した男性も…「プラモデルって正解がない」,https://news.yahoo.co.jp/articles/c06943099c8dd02a70b4e6d732560b63783e2dd9,2/6(火) 18:17
2024-02-06,21:30,local,地域,5,RCC中国放送,アパートの脱衣所に小型カメラを設置した疑い　会社員の男（18）を逮捕　広島,https://news.yahoo.co.jp/articles/329fe82f8636ca2c505aea0d60f210c99a30fc13,2/6(火) 18:57
2024-02-06,21:30,local,地域,6,神戸新聞NEXT,「西宮ガーデンズ」館内、5階から男性飛び降り死亡　防犯カメラに様子写る　けが人なし,https://news.yahoo.co.jp/articles/a97d367a6be284fb0991b547b2df4d4016ec7d25,2/5(月) 9:03
2024-02-06,21:30,local,地域,7,北國新聞社,猫と１か月ぶり再会　地震で行方不明「家族そろった」　チラシ１千枚配布、探し続け,https://news.yahoo.co.jp/articles/d11456318e71e05b58caebfd7b5361292272a711,2/2(金) 20:06
2024-02-06,21:30,local,地域,8,京都新聞,【速報】大津の琵琶湖岸で見つかった遺体は60歳女性、家族が警察に行方不明届,https://news.yahoo.co.jp/articles/339b0d39a4df818af610978dad8996b69818b12d,2/6(火) 19:31
2024-02-06,21:30,local,地域,9,上毛新聞,リード工業（群馬・高崎市）に破産手続き開始決定,https://news.yahoo.co.jp/articles/3124d4516389d4578c406c307e465e8e59323e8f,2/6(火) 18:41
2024-02-06,21:30,local,地域,10,ABA青森朝日放送,油圧式圧縮機に上半身を挟まれ 30歳男性が意識不明　タイヤの内側に別のタイヤを押し込む作業中／青森市,https://news.yahoo.co.jp/articles/90bd49329c1edcae956bc1b89f7ff8bae1828296,2/6(火) 19:33
2024-02-06,21:30,local,地域,11,広島テレビ　ニュース,性的暴行 警視正の男 4度目の逮捕,https://news.yahoo.co.jp/articles/1b9a6a1d143e72e1d4799a689cbd77a36a30dadd,2/6(火) 20:05
2024-02-06,21:30,local,地域,12,北海道ニュースUHB,仕事してるのに”無職”と偽り 生活保護 約40万円を「不正受給」…区役所にばれ返還請求されるも高圧的な態度で拒否した62歳男を逮捕…職場では偽名使い 給与は他人名義の口座に振り込ませていたか,https://news.yahoo.co.jp/articles/e040a81d502a098d9f77a95829caaf662bdbb418,2/6(火) 20:31
2024-02-06,21:30,local,地域,13,HBCニュース北海道,役場に因縁をつけて職員を呼び出し「俺は上のものの使いで来てる、どうなっても知らないぞ」「200万用意すれ」恐喝容疑で54歳の男を逮捕,https://news.yahoo.co.jp/articles/2700f86e719c0d3817584637ce7eba3268d90161,2/6(火) 20:20
2024-02-06,21:30,local,地域,14,RKB毎日放送,松尾潔「上川外相は麻生氏の暴言に抗議すべき」ラジオ番組で痛烈批判,https://news.yahoo.co.jp/articles/937005b7a674e6efb9182fb8862d8ab6004a6fa3,2/6(火) 17:02
2024-02-06,21:30,local,地域,15,カナロコ by 神奈川新聞,横浜・野毛山が大変身　動物園は全面リニューアル、「全国で類を見ない」新施設も,https://news.yahoo.co.jp/articles/a386fa989bab2fefb2d0965fa8487f18ecbc52bc,2/5(月) 5:31
2024-02-06,21:30,local,地域,16,カナロコ by 神奈川新聞,神奈川県内、大雪で８８人重軽傷　主要道路の一部で通行止め続く,https://news.yahoo.co.jp/articles/c2a25486cdf56e9d3e457e5d12af00f36650a707,2/6(火) 20:21
2024-02-06,21:30,local,地域,17,BSS山陰放送,【速報】「恵方巻」食べた66人が下痢・嘔吐など食中毒症状　島根県内の製造業者を5日間営業停止　計80人が発症,https://news.yahoo.co.jp/articles/86173345b6d57a5f89327c08da57c0d4ab4016a3,2/6(火) 19:27
2024-02-06,21:30,local,地域,18,ＡＴＶ青森テレビ,「副作用より打つだけで『がん』にならないなら、そっちのほうがいい」唯一ワクチンで予防できる『子宮頸がん』　しかし「HPVワクチン」接種率は20歳が推定2割と低迷…　その背景とは?,https://news.yahoo.co.jp/articles/cb5ea617c57a24372be7c0366f4d038473c54fab,2/6(火) 17:31
2024-02-06,21:30,local,地域,19,HBCニュース北海道,走行中のダンプカーから左後“ダブルタイヤ”が２本とも脱落　1本は前方の乗用車に衝突、けが人なし　北海道北見市,https://news.yahoo.co.jp/articles/288480e67764be9dec84f42de6b0b975ab738be0,2/6(火) 19:29
2024-02-06,21:30,local,地域,20,ＳＢＣ信越放送,【独自】高級スポーツカーを借りたまま「1000キロ走行」して大分で乗り捨て…別の罪で逮捕起訴され公判中の20歳男を横領の疑いで7日にも再逮捕へ,https://news.yahoo.co.jp/articles/f34a76a30246f0eacea0fa6f1edee8d1970124f6,2/6(火) 18:12
2024-02-06,21:30,local,地域,21,京都新聞,琵琶湖の湖底で発見の遺体は34歳会社員の男性　大津,https://news.yahoo.co.jp/articles/3930adae0faccb9ae52d24b7e4f1392112f0d26e,2/5(月) 20:54
2024-02-06,21:30,local,地域,22,STVニュース北海道,長崎の中学生を札幌に連れ出し…札幌工業高校女性職員　未成年者誘拐容疑で逮捕,https://news.yahoo.co.jp/articles/ff0086e093034bb8ad70cafe840795d0451684df,2/6(火) 21:01
2024-02-06,21:30,local,地域,23,HBCニュース北海道,シャチの群れ10頭ほどが流氷に囲まれ動けず　流氷が動いてシャチが泳げるようになるのを見守る現地　北海道羅臼町沖,https://news.yahoo.co.jp/articles/45827a34c080eb0071a6b371684d0959b24ca83e,2/6(火) 13:14
2024-02-06,21:30,local,地域,24,ｔｙｓテレビ山口,“車検”に出した車が返ってこず・・・「売却」か　自動車販売業の男（36）を詐欺の疑いで逮捕 山口,https://news.yahoo.co.jp/articles/da1c44454fda320427f50164959453d40bfae01e,2/6(火) 14:44
2024-02-06,21:30,local,地域,25,abn長野朝日放送,単独で八ヶ岳に入山 登山者が行方不明…硫黄岳の山頂付近で1人の遺体見つかる【長野】,https://news.yahoo.co.jp/articles/5be2caa6c7fd45bb13f8613b1ba4d07ac45d019f,2/6(火) 19:11
2024-02-06,21:30,local,地域,26,埼玉新聞,セブン店員、女性客の買い物に違和感…なぜ購入したいのか質問、直感で通報　詐欺阻止に成功、女性客が寸前で救われる,https://news.yahoo.co.jp/articles/c3b8ff352765faa263ad957160c32578d92fa936,2/4(日) 12:33
2024-02-06,21:30,local,地域,27,茨城新聞クロスアイ,水戸刑務所で60代受刑者死亡　体調不良、呼びかけに反応なく　茨城,https://news.yahoo.co.jp/articles/41dfd778c883eac2fc5e6b82a9b6ce856b9a6f28,2/6(火) 20:20
2024-02-06,21:30,local,地域,28,みんなの経済新聞ネットワーク,「ルクア大阪」に新テナント20店舗　全国初、関西初出店も,https://news.yahoo.co.jp/articles/a4d774c1a264de91f1ad48a4f2f20bb8e5770400,2/6(火) 18:01
2024-02-06,21:30,local,地域,29,HOME広島ホームテレビ,共政会系暴力団組長を逮捕　身分を隠し携帯電話をローンで購入か　広島,https://news.yahoo.co.jp/articles/5ed44efa7c5428b84f515f70023d589b67497db0,2/6(火) 18:51
2024-02-06,21:30,local,地域,30,福島民報,路線バスが道路脇にはみ出す　乗客なく、運転手けがなし　福島県二本松市,https://news.yahoo.co.jp/articles/86b880e62c9ffcc1292f934e6d233799e1fd0924,2/6(火) 18:39
2024-02-06,21:30,local,地域,31,京都新聞,【速報】京都市長選落選の村山祥栄氏を告発、弁護士ら「架空の政治資金パーティーは違反」,https://news.yahoo.co.jp/articles/56df89ab080b3a6f1a1a26808bfc17fc9c557f06,2/6(火) 18:32
2024-02-06,21:30,local,地域,32,千葉日報オンライン,首都高で成人はねられ死亡　歩行中、大型トラックなど複数台関与か　市川,https://news.yahoo.co.jp/articles/8fd62202bbe627d0e38fbad3c901947534fb6b87,2/6(火) 11:32
2024-02-06,21:30,local,地域,33,京都新聞,【速報】京都・西京極で車に追突し逃走、運搬業の男を容疑で逮捕　追突された女性はけが,https://news.yahoo.co.jp/articles/cec9a3eebb03d0e70df4214ff9e03c8c05f16c67,2/6(火) 17:42
2024-02-06,21:30,local,地域,34,ＳＢＣ信越放送,速報・長野県内の中央道と長野道の通行止めすべて解除,https://news.yahoo.co.jp/articles/b63fdb3bc7dc51fba501ea2ac2d79a5a0124fdb3,2/6(火) 19:57
2024-02-06,21:30,local,地域,35,RKB毎日放送,「万引きのために日本に来た」ユニクロなどで大量万引き疑いの外国人の男女4人を逮捕…8都府県で被害1970万円に上るおそれ,https://news.yahoo.co.jp/articles/aea91ad2bc64e31dd2cd073c8b2929a4d1fcef92,2/6(火) 16:04
2024-02-06,21:30,local,地域,36,福井新聞ＯＮＬＩＮＥ,町内会を退会したら「ごみステーション」利用禁止に…男性が「違法」と提訴　町内会側は争う姿勢,https://news.yahoo.co.jp/articles/dbf7a3a1911322772ec9975a2e97e342d543368e,1/30(火) 18:01
2024-02-06,21:30,local,地域,37,日本海テレビ,恵方巻などを食べた80人が食中毒症状　1日と2日で562本販売　島根県「症状が出たら医療機関の受診を」業者は5日間の営業停止処分,https://news.yahoo.co.jp/articles/5cde02c6d2089ec3b2af81b2df179a887c45a5f5,2/6(火) 20:12
2024-02-06,21:30,local,地域,38,HBCニュース北海道,長崎県内の女子中学生を札幌に連れ出した疑い　札幌工業高校の職員の女（25）「間違いありません」飛行機の搭乗履歴などから割り出し逮捕,https://news.yahoo.co.jp/articles/5c11d63e761d20fc67017f5ef5340a62036432d8,2/6(火) 18:43
2024-02-06,21:30,local,地域,39,TeNYテレビ新潟,交差点で停まっていた車に別の車が追突　追突した車の運転手が死亡《新潟》,https://news.yahoo.co.jp/articles/8ca04d0036a1331d893da7afe1f9025605f941dc,2/6(火) 20:14
2024-02-06,21:30,local,地域,40,茨城新聞クロスアイ,サイトウ匠店、破産手続き開始決定　負債1億9600万円,https://news.yahoo.co.jp/articles/e46daedee2765594c08a67193aff80fccf5c3b1a,2/6(火) 17:00
