scrp_date,scrp_time,genre_en,genre_jp,rank,media_jp,title,link,date_original
2025-06-25,18:09,life,ライフ,1,メディカルドック,【初公開】桑野信義、大腸がんで「人工肛門の姿」排泄障害の地獄を告白,https://news.yahoo.co.jp/articles/73bdf0bf6165f2888daa18de6dabd93c165a41d4,6/25(水) 12:03
2025-06-25,18:09,life,ライフ,2,Hint-Pot,体育の授業で“公開処刑”、自閉症児の親が怒り　ネットも共感「体育嫌いの子増やしてるだけ」,https://news.yahoo.co.jp/articles/d88f2500832cdefeffcb31b80603b8b085d3ca4a,6/25(水) 8:10
2025-06-25,18:09,life,ライフ,3,ほ・とせなNEWS,腕に”筋肉痛のような痛み”を感じ、違和感。　その後、医師「右腕を切断します」判明した病とは。　現在、ポジティブな発信を続ける理由に迫る,https://news.yahoo.co.jp/articles/cf9bf34b883a31b52d468c8c349e98eb3c228527,6/25(水) 11:00
2025-06-25,18:09,life,ライフ,4,ねとらぼ,「革命が起きる」　サイゼリヤが導入「300円台モーニング」にネット衝撃　「バグりすぎ」「どこももう勝てん」,https://news.yahoo.co.jp/articles/f01cb656011362c27d8ef2457c8b2d8d49b7898b,6/25(水) 7:00
2025-06-25,18:09,life,ライフ,5,ねとらぼ,「売り切れたら困る」　ワークマンの“1500円パンツ”が大人気　「色違いで3本購入しました」「この値段はありがたい」,https://news.yahoo.co.jp/articles/6f1882713727316b425775a0a00fc6f6adf7a8c3,6/25(水) 11:30
2025-06-25,18:09,life,ライフ,6,まいどなニュース,ペットショップから迎えた猫が2週間で急逝…“代替え”を勧められた現実に葛藤　“自分なりの命の助け方”を考え、迎えたのは「お店で売れ残っていた子」,https://news.yahoo.co.jp/articles/8e9eb4464b5cbccb1d7d422efd414f9395d88688,6/25(水) 14:20
2025-06-25,18:09,life,ライフ,7,メディカルドック,「がんを予防する可能性の高い飲み物」はご存知ですか？医師が徹底解説,https://news.yahoo.co.jp/articles/99d5b91ace7c15a745562391a9a74ba7b9110cdf,6/25(水) 15:00
2025-06-25,18:09,life,ライフ,8,ファイナンシャルフィールド,職場の定期券で「自宅と逆方向」のスタバに通う友人。「改札出なきゃ大丈夫」とのことですが、その分の“運賃”を払う必要はないの？ 不正乗車をしないために知っておきたいこととは,https://news.yahoo.co.jp/articles/29eaa0a45aebc8b8c7251238909c5b6811e60e20,6/25(水) 13:40
2025-06-25,18:09,life,ライフ,9,ほ・とせなNEWS,平成7年に小学4年生だった男女　→30年後…現在の姿に「美男美女ご夫婦」「素敵すぎます」,https://news.yahoo.co.jp/articles/9b9d2d7dddb33279bd6e510c78078d03f6944832,6/25(水) 10:22
2025-06-25,18:09,life,ライフ,10,産経新聞,世界遺産・平等院を無料ロッカーに手ぶら観光するインバウンドも　迷惑行為で苦渋の決断,https://news.yahoo.co.jp/articles/14c34e010b46df3219c20631c67950117aa461a8,6/25(水) 14:58
2025-06-25,18:09,life,ライフ,11,まいどなニュース,「洗い物が苦にならなくなった」5年間ずっとシンクで見守ってくれる猫さん「この背中に支えられてる」,https://news.yahoo.co.jp/articles/d1e91c0331fe48741a2a9c9b8b0f11edb4fbb12e,6/25(水) 17:30
2025-06-25,18:09,life,ライフ,12,ねとらぼ,←真面目そうな結婚前の夫　結婚後の夫→　激変ビフォーアフターが750万再生「そうはならんやろ」「同じ人ですか？」【海外】,https://news.yahoo.co.jp/articles/434a3289586f24816da5bd0f79b787439c01169f,6/25(水) 17:00
2025-06-25,18:09,life,ライフ,13,ねとらぼ,妻「いよいよその日がやってきた」→夫に残した“置き手紙”が110万表示　「これは焦るなぁ」「私もやりたい」,https://news.yahoo.co.jp/articles/f2d842144809dea8eb9e6feac99176bbae06c87f,6/25(水) 11:45
2025-06-25,18:09,life,ライフ,14,まいどなニュース,「テーブルに着くまでが割と険しい」猫で埋め尽くされた畳の部屋に驚き「猫だらけ踏むと地雷発生」,https://news.yahoo.co.jp/articles/f10a9ab87c7724496207d98fa9b7f1081fc5b986,6/25(水) 16:15
2025-06-25,18:09,life,ライフ,15,まいどなニュース,「何度見てもこの顔どうかしてる」奇跡の瞬間を撮った飼い主さん「猫って時々ポンコツになるのが最高」,https://news.yahoo.co.jp/articles/4126d603d45dc671416398887f9909df4e3cdb47,6/25(水) 17:10
2025-06-25,18:09,life,ライフ,16,ねとらぼ,ディズニーの塗り絵→ママが2日間かけて塗ったら……　「すごっ！」斜め上の“仕上がり”に「もう塗り絵ではない」,https://news.yahoo.co.jp/articles/e0d849526b6b60cc26d8d8b87368cc8ab2249284,6/24(火) 20:00
2025-06-25,18:09,life,ライフ,17,ほ・とせなNEWS,カラオケで95点以上を目指していた夫　しかし直後、まさかの光景に…「こんなの初めて」「笑神様が付いてる」,https://news.yahoo.co.jp/articles/8fca078bd36a80e74ab969ef72eeeff19bdfd091,6/25(水) 16:45
2025-06-25,18:09,life,ライフ,18,ねとらぼ,猫と赤ちゃん、妙に静かだなと思ったら……　1180万表示の理解が追いつかない光景に「なにー！？」「極めてシュール」,https://news.yahoo.co.jp/articles/ef80692504432c939bf2af58783510dbadee47a0,6/25(水) 7:00
2025-06-25,18:09,life,ライフ,19,ねとらぼ,万博・ドイツ館の人気キャラグッズ、再販も即完売→高額転売「悲しいです」「怒りで震えてる」　公式「再入荷を進めています」,https://news.yahoo.co.jp/articles/1cb54520189cabaeb1188cd675bbaae11d40eed2,6/25(水) 16:12
2025-06-25,18:09,life,ライフ,20,ねとらぼ,ある仮面ライダーのマグカップ→口に近づけると……　暴力的すぎる“まさかのワナ”に「致命的すぎる」「ただの凶器じゃん」,https://news.yahoo.co.jp/articles/b18bd9dc5fed3585629f8f3f53e05cc9fe6f2f06,6/25(水) 15:00
2025-06-25,18:09,life,ライフ,21,ねとらぼ,友人の結婚式→「自分にドレス作らせて」　懇願して仕上げた“感涙の完成品”に「こんなに美しいものを作れるなんて」,https://news.yahoo.co.jp/articles/f1d5b59b74cb2c2edc3285144df1766b31cb9a72,6/25(水) 7:00
2025-06-25,18:09,life,ライフ,22,ねとらぼ,80代義父母のために朝4時起き、50代主婦が作る“5人分の弁当”がすごい！　「手が込んでいてさすが」「元気が出ました」,https://news.yahoo.co.jp/articles/d52829cf87dc8acf6affd65836c4c5171bf8712f,6/23(月) 7:00
2025-06-25,18:09,life,ライフ,23,ねとらぼ,東京藝大院生が鉛筆1本で“ピカチュウ”を描いたら……　「何が起きた」衝撃の完成品に「小学生の落書きLV.100」,https://news.yahoo.co.jp/articles/669af2f2693b7734db7da6d699ec7eaff7565ad7,6/25(水) 7:20
2025-06-25,18:09,life,ライフ,24,まいどなニュース,「ぼく2、3キロですよって顔してるけど…」実は大きな犬さん「わがままボディのぬいぐるみ！？」「ギュッとさせて下さい」,https://news.yahoo.co.jp/articles/627b56db0dfb5bb433a76045a9cf53c751e5f654,6/25(水) 16:30
2025-06-25,18:09,life,ライフ,25,ファイナンシャルフィールド,楽天市場で「楽天ポイント」を使うのはもったいない!? 同僚に「楽天ペイがおすすめ」と言われたけど、実際どう“お得”になるの？ 二重取りも可能な使い方を解説,https://news.yahoo.co.jp/articles/9c2e2545a5d6463e43a286cf906415c710f56528,6/25(水) 14:40
2025-06-25,18:09,life,ライフ,26,婦人公論.jp,ゴルフ場では上手い人ほどカートに乗らないのはなぜ？臨床40年の医師が教える、ゴルフを楽しんでいる高齢者に「ピンピンコロリ」が多い理由,https://news.yahoo.co.jp/articles/69ece7d15661f1e77a5ed5dede91e5d10bf2c0d2,6/25(水) 12:32
2025-06-25,18:09,life,ライフ,27,ねとらぼ,飲み終えた牛乳パックは捨てないで！　縫わずに作れる“便利アイテム”に「おおお目からウロコ」「すてきなアイデア」,https://news.yahoo.co.jp/articles/0f54f27bb09187f8f61a7015182f4030e1bee4f8,6/25(水) 10:30
2025-06-25,18:09,life,ライフ,28,まいどなニュース,「それ子グマでは？」「森に返して！」2162万回以上表示された、真っ黒の赤ちゃんの正体とは？,https://news.yahoo.co.jp/articles/50bd9b334d58adde8f247fb9c7e7ef27d901622a,6/24(火) 7:35
2025-06-25,18:09,life,ライフ,29,まいどなニュース,「一緒に行けたらいいですね」　社交辞令が通じないママ友　「できない約束なら最初からしないで！」と突然の逆ギレ,https://news.yahoo.co.jp/articles/d06e04f88416f18c85b84e8fb84b82dbd665d9e3,6/25(水) 12:15
2025-06-25,18:09,life,ライフ,30,ねとらぼ,「もうパンプスに戻れません」　 ワークマンの“1900円シューズ”に絶賛の声　「軽くて歩きやすく走りやすい」「何も不満がありません」,https://news.yahoo.co.jp/articles/8fc008df9a001d81b1b7bb3575216471d0a3cf96,6/25(水) 17:20
2025-06-25,18:09,life,ライフ,31,ねとらぼ,「気に入ってまとめ買いしています」　無印良品の“風を通すパンツ”に感動の声続出　「一度試着してみてください！」「もう夏はこれしか履けません」,https://news.yahoo.co.jp/articles/03ad8da3825548347dad96eb25d46485a2b9e685,6/25(水) 11:00
2025-06-25,18:09,life,ライフ,32,LIMO,10年以上植えっぱなし！育てやすい多年草「チェリーセージ」が可愛い。「クリスマスローズ」や「オルレア」と組み合わせても素敵,https://news.yahoo.co.jp/articles/e39b63889c2ba7aa4e0411badf4ccac7d17e3b7c,6/25(水) 17:07
2025-06-25,18:09,life,ライフ,33,ほ・とせなNEWS,孫「肉まん作って」お願いされたじいじが作った結果…「あたしの分も作ってー」「羨ましすぎる！」「最強なじいちゃん」,https://news.yahoo.co.jp/articles/a9590d2d4a6fff9aa74b5640b141f3ff3869516a,6/25(水) 17:30
2025-06-25,18:09,life,ライフ,34,magacol,【がん専門医】が毎日食べてる「がん予防に役立つ食事」とは？【ベストな3食】｜美ST,https://news.yahoo.co.jp/articles/43ca9b153402a3af56370063434924aded2ccb06,6/24(火) 12:00
2025-06-25,18:09,life,ライフ,35,おとなの週末,穴場のスーパー銭湯を発見、天然温泉で過ごしたあとは絶品の本格中華で癒し時間,https://news.yahoo.co.jp/articles/c658f336fad05f8c70269026ae9127fd655318ec,6/23(月) 18:00
2025-06-25,18:09,life,ライフ,36,KURU KURA（くるくら）,新東名の難所「高松トンネル」で掘削進む！ 最後の未開通区間「新秦野IC～新御殿場IC」はいつ開通？,https://news.yahoo.co.jp/articles/8edee0c35106927abf62c869639a0c3e1eafd824,6/25(水) 12:11
2025-06-25,18:09,life,ライフ,37,ほ・とせなNEWS,すやすや眠る赤ちゃん。　しかし、頭上をよく見ると…「尊い」「愛おしい」「守り神」「優しいお兄ちゃん」「愛情ですね」,https://news.yahoo.co.jp/articles/2c9cbfae3de8daef6d5c68ae13b9273c5e6937fd,6/22(日) 21:10
2025-06-25,18:09,life,ライフ,38,ハフポスト日本版,「七味は汁じゃなくて...」富士そばが伝授するそばの食べ方が「初耳」「試してみます！」と話題に,https://news.yahoo.co.jp/articles/3000daca12ab951f01af47a8377ba278ce8f10fa,6/25(水) 14:04
2025-06-25,18:09,life,ライフ,39,Hint-Pot,「昭和生まれと平成生まれ、悲しみの差が…」　中2長男のお弁当作りに奮闘する元フジアナ　成長を感じた瞬間とは,https://news.yahoo.co.jp/articles/067fc7586763887f05b6af42dd345c41084afccf,6/25(水) 12:04
2025-06-25,18:09,life,ライフ,40,Hint-Pot,「昭和の話？」と話題に　「みそ汁はみそを入れたら煮立ててはダメ」な理由とは,https://news.yahoo.co.jp/articles/4f7aeb3fd372dccb46b566669751a0dcd66d0cb3,6/25(水) 11:10
