scrp_date,scrp_time,genre_en,genre_jp,rank,media_jp,title,link,date_original
2025-05-28,10:35,sports,スポーツ,1,日刊スポーツ,ド軍打線が奮起で２連勝　大谷翔平３戦連発20号、５月初の20本塁打到達で自己新58本ペース,https://news.yahoo.co.jp/articles/d30c90c38bcc5e04616e3f7c67199e2308b185cb,5/28(水) 10:01
2025-05-28,10:35,sports,スポーツ,2,スポニチアネックス,大谷翔平　今季2度目3戦連発で5年連続20号！投手あ然　衝撃の逆方向弾　松井秀喜抜く6度目20発,https://news.yahoo.co.jp/articles/fc17d6c16bee4c1b8ec28a856bd48c11a2fb9038,5/28(水) 8:20
2025-05-28,10:35,sports,スポーツ,3,Full-Count,大谷翔平が衝撃弾も…ベッツは“無関心”　まさかの行動に驚き「何事もなかったように」,https://news.yahoo.co.jp/articles/39edb40ea7dd4301b5d7ee39ec0f97aac51143e7,5/28(水) 5:23
2025-05-28,10:35,sports,スポーツ,4,デイリースポーツ,大谷翔平が３戦連発の衝撃２０号２ラン！左翼席への異次元弾に投手あ然　ＮＨＫ解説者も驚く「これはすごい、これはすごい」,https://news.yahoo.co.jp/articles/a6c138422945d8f186a2a22f0236f630dd1d853f,5/28(水) 8:23
2025-05-28,10:35,sports,スポーツ,5,スポニチアネックス,パリSGが小杉獲りへ!　スウェーデンで活躍、U20日本代表の“強心臓DF”　セルティックなども興味,https://news.yahoo.co.jp/articles/9461ae165d70369fa0fcae5904f27c33ab80fb2c,5/28(水) 1:00
2025-05-28,10:35,sports,スポーツ,6,イーファイト,選手でラウンドガールの中村サキ、ミニ衣装でハイキック！河北麻友子似と話題も,https://news.yahoo.co.jp/articles/f5b2f318031de4cdf46373cad230f729ceab2c41,5/28(水) 7:38
2025-05-28,10:35,sports,スポーツ,7,Full-Count,大谷翔平＆ジャッジだけが到達した「35」　他者を圧倒…寄せ付けぬ好調ぶり,https://news.yahoo.co.jp/articles/6078a00c0fe587f7d33501fb1c936591d5d56bd6,5/28(水) 6:30
2025-05-28,10:35,sports,スポーツ,8,デイリースポーツ,波紋を呼んだ中日戦のファウル判定　元審判員も見解「リクエスト制度の大幅な見直しが必要な時期に来ている」,https://news.yahoo.co.jp/articles/45fffaaec232d241f340ee0842fb070d50b41e0f,5/28(水) 8:19
2025-05-28,10:35,sports,スポーツ,9,ゴルフダイジェスト・オンライン（GDO）,「出られて良かった、ホンマに」 渋野日向子が6年目の全米女子で感じるメジャーの重み,https://news.yahoo.co.jp/articles/8a6beebd7c306ed12b4b1cdd4ec80f245fe4f643,5/28(水) 9:23
2025-05-28,10:35,sports,スポーツ,10,RONSPO,なぜ起きた？「原因がわからない」重岡銀次朗が世界戦後に緊急開頭手術で引退へ…意識不明で集中治療室にいる予断を許さない状況にSNSでは「回復を祈る」の激励の声が殺到,https://news.yahoo.co.jp/articles/b8d26f8da848f23bb34ed3016cdb3b3e21d9d843,5/28(水) 6:11
2025-05-28,10:35,sports,スポーツ,11,中日スポーツ,大谷翔平に20号を打たれたバイビー…放送禁止用語をつぶやき、ぼうぜん「何て××××だ…」米メディアは“同情”も,https://news.yahoo.co.jp/articles/aeef266394c5f350f6c53087f5b13789eac72f5b,5/28(水) 9:38
2025-05-28,10:35,sports,スポーツ,12,Full-Count,大谷翔平のHR量産でまさかの事態　スポンサーをファン“心配”「この後どうなって」,https://news.yahoo.co.jp/articles/87b71ebbaf719c2cd5d10645b24d2ed3d9bbb1df,5/28(水) 7:45
2025-05-28,10:35,sports,スポーツ,13,DAZN News,角田裕毅、モナコGPターン10接触についてガスリーからの非難に困惑…スチュワードは角田に落ち度なし＆ガスリーに譴責の裁定｜F1,https://news.yahoo.co.jp/articles/fcd144965ce9e40339894e2ef654877575e09921,5/28(水) 5:32
2025-05-28,10:35,sports,スポーツ,14,Full-Count,大谷翔平、3戦連発で5年連続20号到達　松井秀喜抜き日本人最多6度目…5月驚異の13発,https://news.yahoo.co.jp/articles/73bce91723d8877bf8cb3562cb5b1216db5ec01e,5/28(水) 8:20
2025-05-28,10:35,sports,スポーツ,15,中日スポーツ,大谷翔平、圧巻20号に米解説者「ガーディアンズはびっくりしているね。連中はこんなのを目の当たりにしたことがないから」,https://news.yahoo.co.jp/articles/b99855f833ae0bf01ef1101a3d6fdf24194acec7,5/28(水) 8:48
2025-05-28,10:35,sports,スポーツ,16,ABEMA TIMES,走る、走る…力士が走る 「一体、なぜ？」ファンを困惑させた衝撃の“珍行動”【大相撲五月場所】,https://news.yahoo.co.jp/articles/52b2e36867e6e1fa20240c7f0930d4dbcba392b1,5/28(水) 6:02
2025-05-28,10:35,sports,スポーツ,17,スポーツ報知,大の里の横綱昇進が臨時理事会で正式決定　使者の出羽海親方、秀ノ山親方が昇進伝達式を行う二所ノ関部屋へ出発,https://news.yahoo.co.jp/articles/8dbf37b4b74616bd057ee5ffbac6fbbd4d495e3b,5/28(水) 9:07
2025-05-28,10:35,sports,スポーツ,18,Full-Count,指揮官が椅子を蹴り激怒「何考えとるんじゃあ！」　阪神Vの裏で…脳裏に焼き付く“悲劇”,https://news.yahoo.co.jp/articles/bed665fad265adce0c9cadae880c6bf08386a265,5/28(水) 6:50
2025-05-28,10:35,sports,スポーツ,19,ゴルフのニュース,「その選択は“非現実的”だから救済はNO」と一蹴されたショットを成功させたファウラーに全米喝采！ 物議醸した競技委員の判断とは？,https://news.yahoo.co.jp/articles/7ad95ded5ae9b9a00afe3adfb79b37b284113450,5/28(水) 9:10
2025-05-28,10:35,sports,スポーツ,20,CoCoKARAnext,新庄剛志監督、シーズン中に異例の行動　最速155キロ中日25歳ロマン腕のトレード情報を自ら否定　「本当、感謝しかない」,https://news.yahoo.co.jp/articles/31c13f7d9b153c4baac904d4d05376c4fcdfa62b,5/28(水) 5:20
2025-05-28,10:35,sports,スポーツ,21,RONSPO,大橋会長が「井上尚弥は3度逃げた」という英有名プロモーターの挑発に「本人はアフマダリエフ戦を要望していた」という新事実を明かして反論,https://news.yahoo.co.jp/articles/2456c5075d88d8cfb8f94e5d5e016b36d546df29,5/28(水) 7:25
2025-05-28,10:35,sports,スポーツ,22,中日スポーツ,大谷翔平、6月の声を前に20号は球団タイ記録…58発ペースに米解説者「去年を上回るなんて、誰が想像した？ 現実じゃないよ」,https://news.yahoo.co.jp/articles/ba05a4c73caebd61a86950d34efae1e9d8f577ba,5/28(水) 9:56
2025-05-28,10:35,sports,スポーツ,23,日テレNEWS NNN,「強くなるぞこの人は」ベンチで悔しがる巨人7年目の24歳にファンからエールの声続々,https://news.yahoo.co.jp/articles/2c2598bec482fa893a64de2fdd54b7486278e45c,5/28(水) 6:35
2025-05-28,10:35,sports,スポーツ,24,スポーツ報知,【中日】井上監督がリクエスト改善提言「アメリカは専用の人がいる」…川越の大飛球ファウル判定覆らず,https://news.yahoo.co.jp/articles/373fd6858e2019077bdc8daf4417a5964f2134d7,5/28(水) 5:00
2025-05-28,10:35,sports,スポーツ,25,FITNESS LOVE,29歳、ビキニ初挑戦、初々しい姿で2位！　「“身体を大きくする”ことがどんどん楽しくなってきた」,https://news.yahoo.co.jp/articles/9733f0845bd2949989b1634b6ffd2df7ef1cbcb4,5/28(水) 4:30
2025-05-28,10:35,sports,スポーツ,26,Full-Count,日系27歳外野手もNPB入り熱望「そうなれば最高だ」　隠せない侍ジャパンへの思い,https://news.yahoo.co.jp/articles/b7f7490310e79c191177605d73e5f19cebda325d,5/28(水) 6:24
2025-05-28,10:35,sports,スポーツ,27,デイリースポーツ,「えっホームラン？」大谷翔平の衝撃弾に投手が思わず二度見　ネット沸く「えぇ？みたいな顔してるやん」「マジかよって顔してる」,https://news.yahoo.co.jp/articles/7ffb72eb8e06195937f365f0048d3b45316de626,5/28(水) 8:47
2025-05-28,10:35,sports,スポーツ,28,Full-Count,MLB公式も注目…大谷翔平の「75→55」　驚異の進化は「どうなっちゃうのよこれ」,https://news.yahoo.co.jp/articles/31dd42d4e3e5adef7bfa2be78fa950c52a418d4c,5/28(水) 10:13
2025-05-28,10:35,sports,スポーツ,29,デイリースポーツ,プロレスラー同士の結婚報告に祝福殺到　竹下幸之介が２ショ＆指輪の写真投稿「妻のユカは背中を叩いてくれます」,https://news.yahoo.co.jp/articles/1a0f7320e3c731bd1d81447142fc02e095dc1959,5/28(水) 9:44
2025-05-28,10:35,sports,スポーツ,30,スポーツ報知,横綱昇進が正式決定した大の里、今後の待遇…月給は３００万　付け人は３人→１０人など,https://news.yahoo.co.jp/articles/f4add9d3db5b4e3311f9947b62df7c6f9078ca71,5/28(水) 9:30
2025-05-28,10:35,sports,スポーツ,31,サンケイスポーツ,プロ野球2軍、早ければ来季から3リーグ制に再編成　移動距離を短くして経費削減目的…7月めどに最終決定,https://news.yahoo.co.jp/articles/b9c5a8d24d33cd19966efbed831aeb0e83fa1031,5/28(水) 5:00
2025-05-28,10:35,sports,スポーツ,32,日刊スポーツ,積立金横領疑惑の行司、日本相撲協会に退職届提出も協会側は受理せず　刑事事件に発展の可能性も,https://news.yahoo.co.jp/articles/2a5f343e5872684f60a71f6f2c8bb7b987cef95f,5/28(水) 5:00
2025-05-28,10:35,sports,スポーツ,33,CoCoKARAnext,「すごい音がした」大谷翔平、3戦連発！5月13発の量産態勢に突入　圧巻の逆方向20号にX驚愕「完ぺきにいかれてる」,https://news.yahoo.co.jp/articles/7459b8912a8ca09ed7036e186417744753027f02,5/28(水) 9:42
2025-05-28,10:35,sports,スポーツ,34,日刊スポーツ,大谷翔平がナ・リーグ本塁打トップ／MLB打撃上位一覧（米26日現在）,https://news.yahoo.co.jp/articles/26856dfd2274cce3ba9fc8624e43d79394704cb7,5/28(水) 7:31
2025-05-28,10:35,sports,スポーツ,35,ゴルフのニュース,パー3、パー4、パー5にはそれぞれ定義があるって本当？ 日本に“短いパー5”が多い理由とは,https://news.yahoo.co.jp/articles/45e05db15bc76c37e2d311930c7ed33b518b8bea,5/28(水) 8:10
2025-05-28,10:35,sports,スポーツ,36,デイリースポーツ,バレー女子　井上愛里沙さんが結婚式「会いたかった人たちに会えて幸せ」パリ五輪チームメート、古賀紗理那さんも出席,https://news.yahoo.co.jp/articles/8294d5a7777df0cacc30309581c7ae7916635d13,5/28(水) 7:57
2025-05-28,10:35,sports,スポーツ,37,Full-Count,衝撃ペースの大谷翔平が迫る「あと2」　3戦連発20号で期待される40年ぶり快挙,https://news.yahoo.co.jp/articles/df4679c0b5a39ce0f369611ac113fd91cef08db1,5/28(水) 9:39
2025-05-28,10:35,sports,スポーツ,38,東スポWEB,【中日】井上監督　ファウル判定に異例の猛抗議「退場が怖くて言わん監督おらんやろ」,https://news.yahoo.co.jp/articles/1afe8dc8e5f7335b22d18bf0ad22be315aa86b41,5/28(水) 5:16
2025-05-28,10:35,sports,スポーツ,39,東スポ競馬,【日本ダービー・激推し】２強に割って入るのは？　あきれるほどの切れ味誇るファンダムが無敗の戴冠へ！,https://news.yahoo.co.jp/articles/ffb559cf0b4ea15f60df6a0dc3baef021c8a6a5f,5/28(水) 6:35
2025-05-28,10:35,sports,スポーツ,40,スポーツ報知,大谷翔平が３戦連発２０号２ラン、その後２打席は快音なし,https://news.yahoo.co.jp/articles/39f12aa87c7f4afbf69ed19fc65f9dce7e23c661,5/28(水) 9:41
