scrp_date,scrp_time,genre_en,genre_jp,rank,media_jp,title,link,date_original
2024-02-14,19:18,domestic,国内,1,J-CASTニュース,盗難車持ち込み→タイヤ交換中に警察官登場→客逃亡　タイヤショップがJ-CASTニュースに明かした客の素性,https://news.yahoo.co.jp/articles/97b2eb0fb9cd7e31c248e2e0b09152258d411066,2/13(火) 20:02
2024-02-14,19:18,domestic,国内,2,夕刊フジ,桐島聡容疑者を名乗る男　死の数日前までは普通に暮らし、がん放置療法…「最期は本名で迎えたい」突然の自白は自分のためか,https://news.yahoo.co.jp/articles/52e92781acda2ee1afa4588f26a9d7cd59d67046,2/14(水) 17:00
2024-02-14,19:18,domestic,国内,3,tenki.jp,京都府で震度4の地震　津波の心配なし,https://news.yahoo.co.jp/articles/3e77430685001434ee021fbeb947a9f6e457869a,2/14(水) 15:34
2024-02-14,19:18,domestic,国内,4,スポーツ報知,田崎史郎氏、「モーニングショー」で松野博一前官房長官の辞任前「機密費」４６６０万円支出に見解…「僕はそんなに驚かなかった」,https://news.yahoo.co.jp/articles/f9310acb405e26e616769198f02e765c7dd3ac98,2/14(水) 9:33
2024-02-14,19:18,domestic,国内,5,夕刊フジ,岸田首相に異様な高揚感、４月選挙説が急浮上　ポスト岸田の声「石破元幹事長は党内に人気がない。上川外相では…」,https://news.yahoo.co.jp/articles/79662a172af1984542954fe94632e7f107606faa,2/14(水) 17:00
2024-02-14,19:18,domestic,国内,6,TBS NEWS DIG Powered by JNN,京都府で最大震度4のやや強い地震　京都府・京都伏見区,https://news.yahoo.co.jp/articles/f5a716b05562e640a56b161ba9e3c06caa3eea3e,2/14(水) 15:33
2024-02-14,19:18,domestic,国内,7,毎日新聞,相模原の2遺体は夫婦か　高1息子に逮捕状、男性殺害の容疑,https://news.yahoo.co.jp/articles/b79701eb6d468462f97854a6de6b65e671f33ec7,2/14(水) 16:34
2024-02-14,19:18,domestic,国内,8,tenki.jp,明日15日　春の荒天に警戒　天気急変　春一番の可能性,https://news.yahoo.co.jp/articles/aac8c18a3971c423ce3c0af83c86cabdef96c9c3,2/14(水) 18:00
2024-02-14,19:18,domestic,国内,9,ABCニュース,新幹線500系残り2編成に　戦闘機のような外観で人気　JR西日本がN700S追加投入を発表　N700を8両化し「こだま」で運用,https://news.yahoo.co.jp/articles/3bef8aa584d07a11ccddcd251e181b236ee31d8a,2/14(水) 14:00
2024-02-14,19:18,domestic,国内,10,朝日新聞デジタル,4歳次女に薬品飲ませ殺害した疑い、両親逮捕　父親の姉も死亡　浅草,https://news.yahoo.co.jp/articles/4c24987b00e6f7158af489f1cb7a7747f3033e52,2/14(水) 10:45
2024-02-14,19:18,domestic,国内,11,西日本新聞,低賃金で働くキャラに共感広がる「ちいかわ」ブーム　ままならぬ人生描くドラマから目を離せず,https://news.yahoo.co.jp/articles/1098aa03c6f26651c401e001c5104fbd0329e2d1,2/14(水) 6:03
2024-02-14,19:18,domestic,国内,12,時事通信,京都で震度4,https://news.yahoo.co.jp/articles/3fadaa264aa192921ebd3112e15d9b1b69f91128,2/14(水) 15:37
2024-02-14,19:18,domestic,国内,13,東海テレビ,影響は2日間に及ぶ…39歳女性運転の乗用車が踏切で列車と衝突した事故 先頭車両が脱輪し復旧に時間,https://news.yahoo.co.jp/articles/a65b3426e70a1df57f6b883709620fd23c0f158e,2/14(水) 17:46
2024-02-14,19:18,domestic,国内,14,FNNプライムオンライン,「子育て増税だ!」少子化対策財源に国民1人“月500円負担”　野党が批判…街の声「ふざけてるな」,https://news.yahoo.co.jp/articles/34d8397b701d219f66933091ae3b4555e92f9d60,2/8(木) 18:02
2024-02-14,19:18,domestic,国内,15,ABEMA TIMES,「なんじゃこのイベントは…」保育園からの案内状に記載されていた“ユニークな依頼”に「9割パソコンになりそう」「1つと言われたら悩む!」と話題,https://news.yahoo.co.jp/articles/7b4f467b00d82fb0847023b1e22e192630ad078b,2/14(水) 12:08
2024-02-14,19:18,domestic,国内,16,TBS NEWS DIG Powered by JNN,都立高校入試2024　最終志願倍率は日比谷1.81倍、西1.70倍、国立1.56倍に【令和6年度高校受験　進路希望調査】,https://news.yahoo.co.jp/articles/86018487aa4f2252670f46f4249c112d763c1697,2/14(水) 18:34
2024-02-14,19:18,domestic,国内,17,CBCテレビ,藤井聡太八冠（21）がプロ棋士になって驚いた加藤一二三九段とのエピソード 「昼休憩終わっていないのに…」 30人限定 参加費35万円のファンミーティング,https://news.yahoo.co.jp/articles/e2e851a1541b25cd152dc7ffd1e5ec1a34ad15f3,2/14(水) 18:48
2024-02-14,19:18,domestic,国内,18,レスキューナウニュース,東葉高速線で人身事故 一部運転見合わせ,https://news.yahoo.co.jp/articles/6bc608de2dbe354391f5423091d82192d680ea8d,2/14(水) 16:40
2024-02-14,19:18,domestic,国内,19,共同通信,支援金26年度は月300円徴収　制度開始時、少子化対策の財源,https://news.yahoo.co.jp/articles/4f389d6ad1c44f68d858f6004dbbf4b807d2dc2c,2/14(水) 11:51
2024-02-14,19:18,domestic,国内,20,FNNプライムオンライン（フジテレビ系）,【速報】4歳の娘殺害容疑で両親を逮捕　向精神薬と不凍液飲ませたか　両親は浅草でホテル経営　警視庁,https://news.yahoo.co.jp/articles/8a224257bd8f13aa556d3a4b4af015ca1ad3e655,2/14(水) 10:45
2024-02-14,19:18,domestic,国内,21,毎日新聞,「いつも同じ服」　保育園関係者が虐待疑う証言　4歳次女殺害,https://news.yahoo.co.jp/articles/ae2e60dfb655df4e4b5371442a84402f9eee1e44,2/14(水) 14:00
2024-02-14,19:18,domestic,国内,22,日刊スポーツ,将棋の野月浩貴八段と渡部愛女流三段が“道産婚”「地元北海道を盛り上げていけるよう活動する」,https://news.yahoo.co.jp/articles/7faba7d99a685749c35cd410fdfe6f5cf2d4b7a7,2/14(水) 16:56
2024-02-14,19:18,domestic,国内,23,FNNプライムオンライン,この形では限界…教員の82％が勤務時間内に仕事処理できず「何をすれば削減できるの」　教員の本来の業務はなに?,https://news.yahoo.co.jp/articles/c790f8064a2dcb875c8635b57d7b31e1c21e00d0,2/14(水) 16:32
2024-02-14,19:18,domestic,国内,24,J-CASTニュース,オイシックス会長、福島原発「汚染水」ポストで炎上→「風評被害拡大の恐れ」で訂正,https://news.yahoo.co.jp/articles/3e05c86c044d89ea32c26b3f666de5e2312eb28e,2/14(水) 16:08
2024-02-14,19:18,domestic,国内,25,日テレNEWS NNN,【速報】4歳娘に抗精神病薬や化学物質を摂取させ殺害か　43歳父と37歳母を警視庁が逮捕　6年前には父の姉も不審死,https://news.yahoo.co.jp/articles/27e4fe16e439e9f127a8cd5471492341ca8d799d,2/14(水) 10:45
2024-02-14,19:18,domestic,国内,26,朝日新聞デジタル,神戸市が高校通学費を無料化　大阪の授業料無償化に対抗、年20億円,https://news.yahoo.co.jp/articles/d1808972ccbb9828c8d1cf0d1ab4b022da68273b,2/14(水) 13:30
2024-02-14,19:18,domestic,国内,27,朝日新聞デジタル,父親殺害容疑で15歳高1少年を逮捕、容疑認める　自宅に両親の遺体,https://news.yahoo.co.jp/articles/849706ab9799c343bbef500b47d14776d38a42b6,2/14(水) 16:18
2024-02-14,19:18,domestic,国内,28,デイリースポーツ,国会中継「裏金上位」２千万円超で堀井学氏、橋本聖子氏が映り続ける→ネット「２人がスピードスケート」「五輪選手が」,https://news.yahoo.co.jp/articles/ef8035b3caf5a29616f795b865ecf53406d5b8cb,2/14(水) 18:35
2024-02-14,19:18,domestic,国内,29,TBS NEWS DIG Powered by JNN,済生会総裁の秋篠宮さま　石川県の病院を訪問し被災者をお見舞い　涙ぐむ被災者も,https://news.yahoo.co.jp/articles/ba91186d1cb08446fde6dffbb8519624afa69bcd,2/14(水) 18:05
2024-02-14,19:18,domestic,国内,30,産経新聞,＜独自＞遺体取り違え別人を火葬、東大阪の斎場　墓埋法違反容疑で捜査も,https://news.yahoo.co.jp/articles/106a2c32bd34ec57dd4c0b2f506724dfafafd8be,2/13(火) 23:18
2024-02-14,19:18,domestic,国内,31,FNNプライムオンライン,【抑止力】エスカレーター痴漢・盗撮を防げ! 特殊ミラーを駅に設置する実験スタート 後ろの人がハッキリ見える!?,https://news.yahoo.co.jp/articles/97d203584850af8695762a4b5cba556f8b11e3c1,2/14(水) 14:57
2024-02-14,19:18,domestic,国内,32,FNNプライムオンライン,死者は能登半島地震の10倍近くに…切迫度が最も高い「Sランク」の活断層が2つある富山　M7以上の地震へ備えを,https://news.yahoo.co.jp/articles/b2529ccfc1e420424497321c5bb50e31a9fee1d2,2/13(火) 17:17
2024-02-14,19:18,domestic,国内,33,TBS NEWS DIG Powered by JNN,【速報】岸田総理 “500円弱の負担は生じない”支援金制度めぐり歳出削減で差し引きできると強調,https://news.yahoo.co.jp/articles/695fced7485dde8ea40ccae814848656b3b175cd,2/14(水) 10:08
2024-02-14,19:18,domestic,国内,34,ABEMA TIMES,"""コーチ""から""夫""に！渡部愛女流三段が野月浩貴八段とゴールイン 20歳差婚に祝福コメント続々「おめでとーーう！」",https://news.yahoo.co.jp/articles/5bc42b9b3c54bc3cab7aed43a0c6de99c8fde367,2/14(水) 12:27
2024-02-14,19:18,domestic,国内,35,日テレNEWS NNN,【速報】「地獄を味わわせる」区役所に夜通し11時間電話し業務妨害か　59歳の男逮捕　埼玉県,https://news.yahoo.co.jp/articles/d4a2e60204f8c2d25b5b8b42128386adb53a58ed,2/14(水) 10:47
2024-02-14,19:18,domestic,国内,36,朝日新聞デジタル,神戸市、「人口100万人割れ」の予測まとめる　独自推計で39年後,https://news.yahoo.co.jp/articles/b0b16c4c5f6e80b35f36d83d3874e5cc6a04cd90,2/14(水) 18:10
2024-02-14,19:18,domestic,国内,37,毎日新聞,長崎ランタンフェス、福山雅治さん出演で大混雑予想　街は厳戒態勢,https://news.yahoo.co.jp/articles/91f4971ca7f30f5bfd0fb91dd5660c67bf6cf095,2/14(水) 15:59
2024-02-14,19:18,domestic,国内,38,ウェザーマップ,太平洋側は落雷・突風・急な強い雨に注意　日本海側はなだれ・融雪に注意を,https://news.yahoo.co.jp/articles/d36347579f09f57d84970ec85e5d68e5e0490e2b,2/14(水) 17:12
2024-02-14,19:18,domestic,国内,39,FNNプライムオンライン（フジテレビ系）,【速報】被災した患者の手を取り「大変でしたね」秋篠宮さまが金沢の病院を視察　能登半島地震対応の医療従事者を労う,https://news.yahoo.co.jp/articles/de0f39af3ec61f4e4a8813284afccf1bd64a4b42,2/14(水) 16:17
2024-02-14,19:18,domestic,国内,40,デイリースポーツ,元ＡＥＲＡ編集長「政治家に買い取り約束してもらう条件で出版」出版社側の実態語る「今すごく経営が厳しい」,https://news.yahoo.co.jp/articles/3712cf5f40224af0d0e433e4b01dad02afe4c372,2/14(水) 10:37
