scrp_date,scrp_time,genre_en,genre_jp,rank,media_jp,title,link,date_original
2025-12-01,11:53,business,経済,1,みんかぶマガジン,「まるでかつての日本人」中国不動産バブル崩壊で関連余波は金融にも「でもなぜか反日デモ起きない」…家買えば値上がりすると信じた人たち,https://news.yahoo.co.jp/articles/875355771ae5c2c10257af9b3708244a7ea93ede,12/1(月) 9:10
2025-12-01,11:53,business,経済,2,ファイナンシャルフィールド,友人はいつも「グリーン車」、一方私は「普通車自由席」…。“5000円以上の差額”を払って新幹線の「グリーン車」に乗るメリットってなに？,https://news.yahoo.co.jp/articles/b9a0499327f92ce4a9da1656c93017dc447117f2,11/29(土) 13:40
2025-12-01,11:53,business,経済,3,産経新聞,中国の渡航自粛から半月　観光産業、一部で影響も冷静受け止め　中国依存脱却カギ,https://news.yahoo.co.jp/articles/ebbf7703eba1d50c068d5f4549ba67b6f5494736,11/30(日) 21:22
2025-12-01,11:53,business,経済,4,朝日新聞,ハローワーク職員、求職者になりすまし応募　就職件数に偽って計上,https://news.yahoo.co.jp/articles/c714bd67eb7b61442093bbb23877e15789f69da0,12/1(月) 8:55
2025-12-01,11:53,business,経済,5,ファイナンシャルフィールド,入院中に限度額認定証を出しているのに14万円の高額請求…。一度支払ってから、後で高額療養費を申請すればいいの？,https://news.yahoo.co.jp/articles/677e6ce0a41d9064d9336b51027e558e69eb63d7,11/29(土) 17:50
2025-12-01,11:53,business,経済,6,帝国データバンク,「ゴルフ人気」回復へ　ゴルフ場市場、4年連続増　6年ぶり8000億円台　若年層の「ゴルフ」参入も追い風,https://news.yahoo.co.jp/articles/e5ebb8742d62764b38a92b7116fd4f3e038bc7eb,12/1(月) 10:00
2025-12-01,11:53,business,経済,7,共同通信,日銀総裁、次回会合で利上げ是非「判断」,https://news.yahoo.co.jp/articles/c622c896ea18aa70f8676571b1304c6161cde64b,12/1(月) 10:20
2025-12-01,11:53,business,経済,8,ファイナンシャルフィールド,12月1日で「従来の健康保険証」は“有効期限切れ”に…「資格確認書があれば大丈夫」と思っていたら、医療費が高くなりビックリ！ 結局「マイナ保険証」は必要なんですか？ 意外と知らないリスクとは,https://news.yahoo.co.jp/articles/13c85489ea43dfbf627ba52d587902cfecdf30e1,11/25(火) 13:30
2025-12-01,11:53,business,経済,9,時事通信,日経平均、800円超安＝東京株式,https://news.yahoo.co.jp/articles/811ba18cb882be77a1cdb7153638f2146ea8478e,12/1(月) 10:30
2025-12-01,11:53,business,経済,10,乗りものニュース,「結局どこを走ればいいんですか？自転車は」 26年度から「青切符」導入でどう変わる？ 「自覚を」と弁護士,https://news.yahoo.co.jp/articles/af89c506247f6456364859a933e38dfd7ee93789,12/1(月) 9:42
2025-12-01,11:53,business,経済,11,ファイナンシャルフィールド,「入社祝い金20万円」がもらえるはずなのに…2ヶ月経ってもまだ振り込まれません。もらう条件があるのでしょうか？,https://news.yahoo.co.jp/articles/5bcd684e68096b3de8d7f237e1c394ce90b07897,11/27(木) 13:30
2025-12-01,11:53,business,経済,12,時事通信,〔東京株式〕一時900円超安＝値がさ株の下落で（1日前場中盤）,https://news.yahoo.co.jp/articles/9101763e751c3033b452a8503fd8ae814cc993ca,12/1(月) 10:30
2025-12-01,11:53,business,経済,13,36Kr Japan,理想汽車、7〜9月は36％減収で赤字転落　MEGAリコール・BEV転換で“苦境”鮮明に,https://news.yahoo.co.jp/articles/a15fd1b95ac8a0fe9602e214a3e61465761395b6,12/1(月) 10:00
2025-12-01,11:53,business,経済,14,読売新聞オンライン,定期預金でポイント年１・７５％分、通常金利と合わせ最大２・０％分に…みずほ銀行が来年３月末まで,https://news.yahoo.co.jp/articles/37e72af8662a83dbcba69f277158ef7ad57879a8,12/1(月) 8:05
2025-12-01,11:53,business,経済,15,LIMO,【個人向け国債】「変動10年」半年ごとの利率はどうなってる？《適用利率の推移》を見てみる,https://news.yahoo.co.jp/articles/9f059ee4e216db8c9c3402ae34c426a50a0ff9bb,11/30(日) 18:15
2025-12-01,11:53,business,経済,16,LIMO,「マイナ保険証の手続きがまだ！」そんな人に無償で交付される「資格確認書」とは？有効期限はあるのか,https://news.yahoo.co.jp/articles/31a0f58d62e605c4346580745653e2d5ae770379,11/25(火) 6:25
2025-12-01,11:53,business,経済,17,ファイナンシャルフィールド,長年「音信不通」の弟。いまだに連絡がつかないのですが、父が残した“4000万円の相続手続き”は兄の私が進めてしまって問題ないですよね？,https://news.yahoo.co.jp/articles/0b11a251d8db79637247da63c0626b1b24efa595,11/30(日) 15:40
2025-12-01,11:53,business,経済,18,共同通信,長期金利、一時1.850％に上昇,https://news.yahoo.co.jp/articles/d3c88dd0268c22fd9ab0f31026a9691fce729ef4,12/1(月) 10:43
2025-12-01,11:53,business,経済,19,共同通信,長期金利、一時1.840％　17年半ぶり、利上げ観測で,https://news.yahoo.co.jp/articles/b31293b1a4eff5f8745bf1993e9483b682094555,12/1(月) 10:34
2025-12-01,11:53,business,経済,20,くるまのニュース,28年ぶり復活！ ダイハツ“新”「ミゼット」登場！ 「1+2」の3人乗り仕様で“軽”より小さい「コンパクトボディ」採用 「ミゼットX」とは？,https://news.yahoo.co.jp/articles/2b85e51cdc50ac563788dc636a333686c5d29623,11/30(日) 12:10
2025-12-01,11:53,business,経済,21,くるまのニュース,優良ドライバーでも「ゴールド免許が消える…」 無事故無違反でも「ブルー免許」になる条件は？ うっかりな「落とし穴」とは,https://news.yahoo.co.jp/articles/4c17ea1b18fed111f8c91727a461395c74ddcc00,11/24(月) 8:10
2025-12-01,11:53,business,経済,22,時事通信,利上げ是非、次回会合で判断　賃上げの情報収集　植田日銀総裁,https://news.yahoo.co.jp/articles/9ac3003bf06e54a55e33c19572e5c14af8cddd09,12/1(月) 10:33
2025-12-01,11:53,business,経済,23,みんかぶマガジン,相次ぐ中国公演中止に歌手ら高市首相に怒り「黙るな。怒れ。抗議しろ」…「中国経済3重苦」これは発言への単純反応ではない,https://news.yahoo.co.jp/articles/4ed51bb401f60f35a72658b3fa949e186945c400,11/29(土) 9:10
2025-12-01,11:53,business,経済,24,ファイナンシャルフィールド,新幹線で「荷物置き場付き座席」を予約したのに、ほかの乗客に“スペースを占領”されていた！ 自分で直接「どけてください」と言うのはNGでしょうか…？,https://news.yahoo.co.jp/articles/1ab4c22f50e687706cf0d8a9ed5c51c5c005c7d0,11/25(火) 13:30
2025-12-01,11:53,business,経済,25,ロイター,香港高層住宅火災、中国当局が保険金支払いなどの迅速処理指示,https://news.yahoo.co.jp/articles/2d573619b66cd57e5372848e6a9eeeb390732449,12/1(月) 10:44
2025-12-01,11:53,business,経済,26,ITmedia ビジネスオンライン,ハワイのスイーツ「マラサダ」がじわりと人気上昇　ファミマで初週50万個、催事は2時間待ち,https://news.yahoo.co.jp/articles/003ba3a51f5097260927b4514d2fbcc9452ca24f,11/30(日) 8:10
2025-12-01,11:53,business,経済,27,LIMO,マイナ保険証がない場合どうなる？無償交付される「資格確認書」の内容・送付時期・有効期限を解説,https://news.yahoo.co.jp/articles/0631d991cd5b4760a793069b787615d1b5dba2d6,11/28(金) 11:20
2025-12-01,11:53,business,経済,28,ファイナンシャルフィールド,父の遺産8000万円を母が全額相続。一人っ子の私が、二次相続する場合「どれくらいの相続税」を覚悟すべきでしょうか？,https://news.yahoo.co.jp/articles/fef9eea20461d1590d4e693fbf96028dc8982ae0,11/30(日) 7:50
2025-12-01,11:53,business,経済,29,Bloomberg,日本製鉄の室蘭製鉄所で火災、操業への影響や原因は調査中,https://news.yahoo.co.jp/articles/17c15ab9ea268293b3322e6c4df43691b046351c,12/1(月) 9:14
2025-12-01,11:53,business,経済,30,乗りものニュース,韓国初のオリジナル戦闘機「これ、ステルス機なんですか？」開発元を直撃！ 傍らには発展型まで展示,https://news.yahoo.co.jp/articles/ba1e8a1a816d1364a027a320df88fd4e81caf2c8,12/1(月) 8:42
2025-12-01,11:53,business,経済,31,乗りものニュース,東武東上線が激変！ 池袋口から「マルーン帯の電車」撤退へ  新型車両を大量に導入する理由とは,https://news.yahoo.co.jp/articles/8d898343095e4a550788c150d86867eb7ca3ab2b,12/1(月) 6:12
2025-12-01,11:53,business,経済,32,共同通信,日銀総裁、経済想定通りで引き続き利上げ,https://news.yahoo.co.jp/articles/d091f66eec3cb9b8f11bbcd5c4aa05e03b301a58,12/1(月) 10:28
2025-12-01,11:53,business,経済,33,くるまのニュース,約220万円！ トヨタ最新型「“4人乗り”シエンタ」がスゴイ！ 全長4.2mの「ちょうどいいサイズ」な「“2列”ミニバン」!? 乗降の利便性高い「サードシートレス仕様」どんなモデル？,https://news.yahoo.co.jp/articles/10cb4d6af5cfdccdeba3ba4cade810bf544a506c,11/30(日) 18:10
2025-12-01,11:53,business,経済,34,ファイナンシャルフィールド,住宅ローンを完済したら、「抵当権抹消」が必要？ 行わなかった場合のリスクと費用を解説,https://news.yahoo.co.jp/articles/30afc1ce0b6e28bf1cdaadcd5347329935de00cf,11/30(日) 7:20
2025-12-01,11:53,business,経済,35,ニュースイッチ,日産・ホンダ・マツダ…乗用車8社の10月世界生産、5社が前年割れの要因,https://news.yahoo.co.jp/articles/d92582d512afe8f450b1a1abc478264fd934d5b0,12/1(月) 11:20
2025-12-01,11:53,business,経済,36,共同通信,日銀の植田総裁、今月利上げ判断　米関税「不確実性低下」と指摘,https://news.yahoo.co.jp/articles/c7d9c079efc86d5145c3dea7be82ed8c715f1986,12/1(月) 10:57
2025-12-01,11:53,business,経済,37,ファイナンシャルフィールド,【自転車】「歩行者信号が青」なので進もうとしたら、友人に「それ信号無視だよ」と言われた！“交通ルール”は守ってるはずなのにナゼ？ 意外と知らない走り方とは,https://news.yahoo.co.jp/articles/93ea4ca17ea7c7886db56d17cc7ba4c4229f134e,11/30(日) 14:20
2025-12-01,11:53,business,経済,38,ニュースイッチ,世界初の商用規模...川崎に液化水素基地、川重などが起工式,https://news.yahoo.co.jp/articles/14d3deee6f211703c687d1c5d99a7d3722af81c1,12/1(月) 10:40
2025-12-01,11:53,business,経済,39,AUTOCAR JAPAN,マイナーな1980年代の名車＆迷車　39選（前編）　スターの陰に隠れてしまった不運なクルマ,https://news.yahoo.co.jp/articles/9b2ab7ad5e13c10677f89588fee81e8e01e6090f,11/30(日) 11:25
2025-12-01,11:53,business,経済,40,LIMO,【75歳以上・後期高齢者医療制度】医療費「1割・2割・3割」年収いくらで何割負担になる？,https://news.yahoo.co.jp/articles/280a21c6a902f3819483e7ee0b4c10a3920be27c,12/1(月) 11:35
