scrp_date,scrp_time,genre_en,genre_jp,rank,media_jp,title,link,date_original
2025-05-18,10:35,sports,スポーツ,1,スポニチアネックス,パレス鎌田が快挙!　マンC撃破でFA杯初優勝　クラブ創設165年目の悲願初タイトル獲得に貢献,https://news.yahoo.co.jp/articles/975f3426da1d930feaded3e0f93c933c32e40ba6,5/18(日) 2:31
2025-05-18,10:35,sports,スポーツ,2,日刊スポーツ,6日目の結びの一番でマナー違反　元嘉風の中村親方の熱い思い「大相撲への侮辱行為ですよ」,https://news.yahoo.co.jp/articles/5d4d23abbd4cbe2cca958136d35ae70f11fa5e2b,5/18(日) 6:00
2025-05-18,10:35,sports,スポーツ,3,Full-Count,阪神から謝罪「やる気なくした」　成績は急降下…球宴前に告げられた“大人の事情”,https://news.yahoo.co.jp/articles/776e06d18099827e3807b624d164bfea63114d87,5/18(日) 6:50
2025-05-18,10:35,sports,スポーツ,4,スポーツ報知,大谷翔平がデコピンの２歳誕生日秘蔵写真＆映像公開　２種類ケーキで豪華お祝い,https://news.yahoo.co.jp/articles/ae0bbbf164b198c8424a244c31570469fc9865f4,5/18(日) 4:14
2025-05-18,10:35,sports,スポーツ,5,スポニチアネックス,【F1】「馬鹿げたミス」予選クラッシュでマシン大破の角田裕毅が謝罪「不必要なプッシュで車失った」,https://news.yahoo.co.jp/articles/6dab421c9efea7cf303c621b9da4c25d55125d21,5/18(日) 7:31
2025-05-18,10:35,sports,スポーツ,6,日テレNEWS NNN,巨人・阿部監督が称賛するのは“阪神の若手”「羨ましく思っちゃいました」,https://news.yahoo.co.jp/articles/dd066ad6ba59e4fc1eadf2f7d41dec876d3e2f36,5/18(日) 9:20
2025-05-18,10:35,sports,スポーツ,7,イーファイト,ブレイキングダウンで斜視→引退のイケメン選手、なんと”斜視”写真に合成疑惑！動画公開でファン「怖い」「なってる」,https://news.yahoo.co.jp/articles/7a0192e3b298756c8bf8de9094b0199561f84677,5/18(日) 7:28
2025-05-18,10:35,sports,スポーツ,8,スポーツ報知,ドジャースの長身イケメン右腕が婚約発表　観客席の美女に一目ぼれ驚きの“ナンパ”で交際開始,https://news.yahoo.co.jp/articles/9defd08949afedc2d54f92440da1753d957cf8c7,5/18(日) 5:31
2025-05-18,10:35,sports,スポーツ,9,ENCOUNT,幼稚園から喧嘩に明け暮れ、2度の少年院生活→更生して資格大量取得　RIZINにも出た中卒戦士の波瀾万丈な人生,https://news.yahoo.co.jp/articles/ee9913f8fe77245f64d12af6703c00888e38764a,5/18(日) 9:40
2025-05-18,10:35,sports,スポーツ,10,スポーツ報知,大谷翔平、右肘手術後最多ブルペンで５０球、最速１５３キロで順調な調整ぶり…市制定の「大谷翔平の日」,https://news.yahoo.co.jp/articles/0d28c69c1ea35b4c6fd39469aa26b7c734b52231,5/18(日) 7:47
2025-05-18,10:35,sports,スポーツ,11,スポーツ報知,オリオールズがハイド監督を電撃解任、球団発表　菅野智之がチーム最多４勝と孤軍奮闘も借金１３と大苦戦,https://news.yahoo.co.jp/articles/1b34bf5f0e4bb3558a795b9cff6431f0570595f8,5/18(日) 1:24
2025-05-18,10:35,sports,スポーツ,12,Full-Count,ド軍マンシーに「オオタニに会える？」　少年の直球質問にまさかの回答で爆笑,https://news.yahoo.co.jp/articles/eb91c4214770e42205f9609fa7c869ebd23527ba,5/18(日) 9:47
2025-05-18,10:35,sports,スポーツ,13,スポーツ報知,佐々木朗希が右肩痛を隠していたことにロバーツ監督が苦言「彼は率直にコミュニケーションをとるべき」,https://news.yahoo.co.jp/articles/c11ae7906481c1fb335472a7af1a800e09e3f119,5/18(日) 0:10
2025-05-18,10:35,sports,スポーツ,14,SAL,女子日本代表、悲願のアジアカップ初優勝！タイとの超激闘PK戦を制し選手の目に歓喜の涙 中1日6連戦の激戦を終えアジア女王としてW杯へ｜フットサル,https://news.yahoo.co.jp/articles/6b9e23c4331ced09b0bc78c7e5c786be4bad3f81,5/17(土) 23:30
2025-05-18,10:35,sports,スポーツ,15,ベースボールキング,木浪聖也が2試合連続の適時打！高木豊氏「干されてるのかなと思うくらい、ベンチに置かれたけど、彼は…」,https://news.yahoo.co.jp/articles/917f885619a3805ab6bc0063b78febf47992f438,5/18(日) 8:30
2025-05-18,10:35,sports,スポーツ,16,デイリースポーツ,佐々木朗希が負った「インピンジメント症候群」オリックスの名将「よく聞きました」一般的に馴染みがない理由も解説「コンディション不良で」,https://news.yahoo.co.jp/articles/c7dcab7e8e4ec2aa63948813c62ff3d62ca397dd,5/18(日) 9:38
2025-05-18,10:35,sports,スポーツ,17,ベースボールキング,中日、今季9度目の完封負け…消極的采配に高木豊氏「ちょっとSNSを気にしてるのかな…」,https://news.yahoo.co.jp/articles/9fb5ede3faf4d1985c0e7ff4cbd8b0cd18db810b,5/18(日) 8:15
2025-05-18,10:35,sports,スポーツ,18,日刊スポーツ,【プリークネスＳ】「なんてこった」起死回生の差し切り！ジャーナリズムが大逆転で２冠目を制す,https://news.yahoo.co.jp/articles/3638ab26d7bad35569c7ec685e9185993ca987e0,5/18(日) 9:15
2025-05-18,10:35,sports,スポーツ,19,CoCoKARAnext,“MLB平均以下のスイング”でもHR量産の異能　大谷翔平の打撃センスに米解説も愕然「これが打者にとっては理想なんだ」,https://news.yahoo.co.jp/articles/a88ef0bda8b12a21dd449c3c00febd6735deb564,5/18(日) 6:02
2025-05-18,10:35,sports,スポーツ,20,CoCoKARAnext,軽視される制球と重視されるパワー　MLB通算262勝のバーランダーが止まらぬ投手の高速化に苦言「愛してきた野球ではない」,https://news.yahoo.co.jp/articles/b31c1d289e538814e502cedc380f90c8bb445367,5/18(日) 7:02
2025-05-18,10:35,sports,スポーツ,21,theWORLD（ザ・ワールドWeb）,FA杯決勝直後にペップが握手拒否　守護神ヘンダーソンとの応酬が話題に「君が望んでいた10分間が得られたね！」,https://news.yahoo.co.jp/articles/e059492abc113fc2ab2f153bde9676a7fb436286,5/18(日) 7:32
2025-05-18,10:35,sports,スポーツ,22,スポーツ報知,「キャベッジ選手が４番でプレッシャー感じずに打てる」…リーグ優勝３回「名監督」が「サンモニ」で巨人・岡本和真「離脱後」４番打者を解説,https://news.yahoo.co.jp/articles/fbeb72151298e9adf2651551e8f0cb0314f6e0cd,5/18(日) 9:32
2025-05-18,10:35,sports,スポーツ,23,デイリースポーツ,大谷翔平　先輩の菊池雄星と談笑→山本由伸＆佐々木朗希も合流　日本人投手の４ショット実現　ブルペンで術後最多５０球,https://news.yahoo.co.jp/articles/200d1516684292153369b5a449fcc0ef2e3538d2,5/18(日) 8:01
2025-05-18,10:35,sports,スポーツ,24,デイリースポーツ,ドジャース　スミス長女にエドマン長男も！激カワキッズが集結　消防士と触れあうシーンに「とても愛らしい♥」,https://news.yahoo.co.jp/articles/9974e8b6678b7e305ed72cc36c69e9a87f5267c9,5/18(日) 9:07
2025-05-18,10:35,sports,スポーツ,25,Full-Count,大谷翔平、菊池雄星と再会　笑顔でガッチリ握手、由伸＆朗希も“合流”で日本人大集合,https://news.yahoo.co.jp/articles/7f726141bf476104fca3f5dbfc81eaaaeb32f252,5/18(日) 7:36
2025-05-18,10:35,sports,スポーツ,26,TBS NEWS DIG Powered by JNN,【GGP展望】5000mの代表争いで極めて重要な“男子3000m”　駒大の佐藤圭汰らが大迫傑の持つ日本記録に挑戦 !,https://news.yahoo.co.jp/articles/4b6915d9d5252e4c52c6b48ba452fc6a255fbbd5,5/18(日) 5:32
2025-05-18,10:35,sports,スポーツ,27,馬トク報知,「荒れないんちゃうか」粗品、人気サイドからのヴィクトリアマイル予想に「先週の美しい１着飛ばしを今週も」,https://news.yahoo.co.jp/articles/616a1fcfac51a8cea90e80a5db24d25dca22becf,5/18(日) 7:45
2025-05-18,10:35,sports,スポーツ,28,RONSPO,「何てことだ！ユウキは大丈夫なのか？」レッドブル角田裕毅が予選Q1でマシンが逆さまになる大クラッシュ…F1公式サイトは「大きなプレッシャーを受けていた」と原因を指摘,https://news.yahoo.co.jp/articles/e23b8941348bdb684d1bdcc74cf08ceb3ab074b6,5/18(日) 5:51
2025-05-18,10:35,sports,スポーツ,29,Full-Count,大谷の完璧16号…エ軍放送席「もう忘れてくれ」　実況がすぐに伝えた“救い”「とても大きい」,https://news.yahoo.co.jp/articles/4a53c9895d262900e4cc3720da03f4d6244506f1,5/18(日) 6:54
2025-05-18,10:35,sports,スポーツ,30,VITUP!,「脚太いけど推してくれる？」筋肉女子・さくら、ゴリゴリムチムチの美脚に賞賛の声,https://news.yahoo.co.jp/articles/7456b53d0537d26470ad22ba80e63c036612688f,5/18(日) 10:10
2025-05-18,10:35,sports,スポーツ,31,FITNESS LOVE,透き通る「白肌ボディ」の22歳がコンテスト満点グランプリ　ボートレーサー試験がきっかけで筋トレ開始、トレーナーの道へ,https://news.yahoo.co.jp/articles/95c7ab81df2137fa3caf35a03d2a1ad6231697ae,5/18(日) 4:30
2025-05-18,10:35,sports,スポーツ,32,GOAL,鎌田大地フル出場のクリスタル・パレスが悲願のFAカップ初制覇！エゼの先制弾を守り切りマン・Cを撃破,https://news.yahoo.co.jp/articles/aaae291141a5da00a66ec7f5f024ff02d80751f2,5/18(日) 2:31
2025-05-18,10:35,sports,スポーツ,33,デイリースポーツ,佐々木朗希、肉体強化に着手　ストレングスコーチ指導のメニューこなす　右肩痛で14日に離脱　依然ノースロー,https://news.yahoo.co.jp/articles/2f240ce236ab757b032217f1ef86759751dc6079,5/18(日) 9:42
2025-05-18,10:35,sports,スポーツ,34,GOAL,レアル・マドリーとの契約延長を切望するモドリッチ、まもなくペレス会長と面談…昨季半減したという年俸をさらに減らす覚悟,https://news.yahoo.co.jp/articles/38a7a90dffec7f9648fb68ccef4fd5d641a4efd5,5/18(日) 9:10
2025-05-18,10:35,sports,スポーツ,35,デイリースポーツ,大谷翔平が古巣エンゼルス関係者にあいさつ回り　ウォード、アデルら元同僚、ＧＭ、スタッフとも談笑,https://news.yahoo.co.jp/articles/ef4827565dc5ca0923b0793ca02a29fbb15ea42d,5/17(土) 10:03
2025-05-18,10:35,sports,スポーツ,36,MLB.jp,【MLB】エドマンとテオスカー・ヘルナンデスが復帰目前のドジャース　ロースターの難しい決断が迫る,https://news.yahoo.co.jp/articles/3351bb2aff8935e7bc5002964bc377031f8586d6,5/18(日) 8:02
2025-05-18,10:35,sports,スポーツ,37,Full-Count,カーショーの復帰発表も…264億円男が60日ILへ　ド軍加入後わずか2登板、離脱続く,https://news.yahoo.co.jp/articles/6eafc43c3ed3dfbc6fad0f27ecad2dd5168071d4,5/18(日) 7:32
2025-05-18,10:35,sports,スポーツ,38,GOAL,堂安律が今季10発目のフライブルク、CL出場ならずELへ…佐野海舟が全試合先発のマインツは6位でECLへ,https://news.yahoo.co.jp/articles/8f02b6d7cd295a11727a2500aa5796904886df6f,5/18(日) 0:36
2025-05-18,10:35,sports,スポーツ,39,日刊スポーツ,【西武】ベテラン栗山巧が２軍再調整へ　通算2150安打のバットマンも今季打率１割届かず苦戦,https://news.yahoo.co.jp/articles/026d7516d215a2d62d490c9c14c4eead70814d48,5/18(日) 10:01
2025-05-18,10:35,sports,スポーツ,40,スポーツ報知,巨人・阿部監督狙い通り、相手に絶望を与える２人の右腕…６回までリードなら開幕から１４連勝,https://news.yahoo.co.jp/articles/efe6348db7834575c5fdbc6b089caf651c815d52,5/18(日) 5:25
