scrp_date,scrp_time,genre_en,genre_jp,rank,media_jp,title,link,date_original
2025-11-27,09:32,business,経済,1,ファイナンシャルフィールド,友人は「社会保険料」を毎月“9万円”程度払っているそうです。月収30万円ほどの私は“4万5000円程度”なのですが、友人はお給料も“2倍”なのでしょうか？,https://news.yahoo.co.jp/articles/288260bf787b579fdf2dc17d9cdd91928d50ff37,11/26(水) 13:40
2025-11-27,09:32,business,経済,2,みんかぶマガジン,石破さん頼む、黙ってくれ！「おこめ券配布の原資は？」前総理の異議に経済誌元編集長が激怒…全部あなたの尻拭い！国民と日本農業の重荷,https://news.yahoo.co.jp/articles/5b5d6ce2dabd5ba8591412f37722308949ca4ec4,11/27(木) 9:10
2025-11-27,09:32,business,経済,3,BUSINESS INSIDER JAPAN,"SBI、太陽、トーセイ……12月1日に""株式分割""する全9銘柄リスト。それぞれのファンダメンタルも解説する",https://news.yahoo.co.jp/articles/ee29868e8eb052671fe62aed016c4a57b4d93fc3,11/27(木) 6:00
2025-11-27,09:32,business,経済,4,LIMO,【70歳代・二人以上の世帯】「1カ月の生活費・貯蓄額」は平均いくら？《公的年金だけに頼るシニア世帯》の割合は何％？,https://news.yahoo.co.jp/articles/461318447c8e545a4715a172f680a43fe389ca90,11/27(木) 6:20
2025-11-27,09:32,business,経済,5,朝日新聞,ガソリン補助金あす20円に　軽油は暫定税率廃止と同じ値下げが実現,https://news.yahoo.co.jp/articles/fca6dc77fbdcc22b41bcc14a59551b6e479c641b,11/26(水) 17:00
2025-11-27,09:32,business,経済,6,BUSINESS INSIDER JAPAN,「タイミー要らず」で40店舗。人手不足時代、時給の“ダイナミックプライシング”で回す外食チェーン,https://news.yahoo.co.jp/articles/0a1fb93e96a6503a985cf8864f5a6a62b76a275a,11/27(木) 7:00
2025-11-27,09:32,business,経済,7,LIMO,【住民税課税世帯でも申請OK】《給付金・補助金・手当・減免措置》10選「子育て世帯・ひとり親世帯・自営業やフリーランス・住宅購入やリフォーム検討者向け」の制度とは？,https://news.yahoo.co.jp/articles/79f7eaa2c5e8daa2822e32e3228e1a1399f6adfb,11/22(土) 20:35
2025-11-27,09:32,business,経済,8,ファイナンシャルフィールド,80代の父から「毎年100万円」の“生前贈与”を受けることに。「非課税だから」とのことですが、結局“定期的だと課税される”のではないでしょうか？ 注意点を解説,https://news.yahoo.co.jp/articles/a1f7523b9345a0b9ff684930627d9f094e1abe44,11/25(火) 13:50
2025-11-27,09:32,business,経済,9,乗りものニュース,「日本一着陸が難しい空港」なぜ？ 実際に乗ったら「おっ、違うぞ…！」 ランクは「世界のANA就航空港のなかで最難」,https://news.yahoo.co.jp/articles/8eaac8d248ebf66aea631f1b7d7e10bf86c4c474,11/27(木) 7:12
2025-11-27,09:32,business,経済,10,朝日新聞,賃貸マンション節税に待った　政府与党、評価額の算定ルール見直しへ,https://news.yahoo.co.jp/articles/d7e707349f36f249fc1d0b425ef0adddbc13d3db,11/27(木) 6:30
2025-11-27,09:32,business,経済,11,MONEY PLUS,節約につながる！「外食」株主優待5銘柄,https://news.yahoo.co.jp/articles/a7ea245aa80df69e156f8e6bcdba89f9bd283f8d,11/27(木) 7:04
2025-11-27,09:32,business,経済,12,共同通信,NY株式　　26日終値,https://news.yahoo.co.jp/articles/a388ffe41ef9ca84e074a0b93497fe09ac932283,11/27(木) 6:40
2025-11-27,09:32,business,経済,13,36Kr Japan,中国、2026年よりEV輸出を厳格化！不具合多発のEVモーターズ・ジャパンの電気バスは輸出許可を得ているのか？,https://news.yahoo.co.jp/articles/0e0c4d53de25c1537b3a62dc9da320f4af986f78,11/27(木) 8:02
2025-11-27,09:32,business,経済,14,食品産業新聞社ニュースWEB,『マクドナルドの福袋2026』は「Francfranc」と初コラボ、ビッグマックスープジャーなどグッズ3点に販売金額相当の無料券付き,https://news.yahoo.co.jp/articles/bb5a7606b8934795dd3864f20fdba8efa7c77f22,11/25(火) 11:06
2025-11-27,09:32,business,経済,15,LIMO,【12月15日は年金支給日】厚生年金と国民年金「月額20万円以上の人」と「月額10万円未満の人」どっちが多い？,https://news.yahoo.co.jp/articles/e5c63cf7a767f31b8bff9f5500fefed243af4a5d,11/26(水) 21:00
2025-11-27,09:32,business,経済,16,読売新聞オンライン,低迷するＥＶの戦略見直し相次ぐ、米国市場での販売も見通せず…当面はＨＶに注力の構え,https://news.yahoo.co.jp/articles/373cf6bc07071d161cfef0f00ea0617a08abc667,11/27(木) 7:14
2025-11-27,09:32,business,経済,17,MONEY PLUS,「株価が大きく下落してから…」と思っても投資はできない。怖がらずに始める方法,https://news.yahoo.co.jp/articles/8dacfdf596a3ee3da8ace3ac09c4b45548bc5691,11/27(木) 7:30
2025-11-27,09:32,business,経済,18,ITmedia ビジネスオンライン,「スーパー戦隊」終了の理由は？　レッドだけが残った、少し切ない現実,https://news.yahoo.co.jp/articles/05e4759fdb2c4d0434427f504d61de3dbe5bdaf0,11/26(水) 10:05
2025-11-27,09:32,business,経済,19,MBSニュース,ひたすら試してランキング『ポン酢』6年連続ミシュランガイド三つ星に輝く京割烹「祇園さゝ木」の佐々木浩さんが導入を検討！？香りも食材との相性も抜群の第1位の商品は？【MBSサタプラ】,https://news.yahoo.co.jp/articles/8aa9b579285dd982f860035dc6cb9c1539607a2f,11/27(木) 8:05
2025-11-27,09:32,business,経済,20,ファイナンシャルフィールド,「106万円の壁」はいつ廃止される？うっかり超えた場合はどうなるの？,https://news.yahoo.co.jp/articles/2467d27da4319b9d7a098940220439b410fba2d6,11/27(木) 7:50
2025-11-27,09:32,business,経済,21,ファイナンシャルフィールド,親の土地に家を建て、建築費3500万円のうち「2000万円」を親が負担。親も住めば「贈与」にならない？,https://news.yahoo.co.jp/articles/5e1e170348033126f767bf67395379c18b61731a,11/26(水) 15:30
2025-11-27,09:32,business,経済,22,ITmedia ビジネスオンライン,ローソン「高級ハイボール」が好調　1缶600円でも売れているワケ,https://news.yahoo.co.jp/articles/ab95fc8f5edd5d3b355b714dbd506acbc0e13906,11/27(木) 8:40
2025-11-27,09:32,business,経済,23,みんかぶマガジン,中国の本音「長期化は避けてね」長引く内需不足と世界が進める「脱チャイナ政策」で国内ボロボロ…報復エスカレートで自国も大ダメージ,https://news.yahoo.co.jp/articles/23ada95a1d3598bb5bd5eca61c52bbbe94ddc645,11/22(土) 9:10
2025-11-27,09:32,business,経済,24,ファイナンシャルフィールド,11月末で「退職」予定です。12月に支給される冬のボーナス「50万円」は、もうもらえないのでしょうか？,https://news.yahoo.co.jp/articles/a7434e50b3f7d90c25638938cb6424af17eb550b,11/21(金) 15:10
2025-11-27,09:32,business,経済,25,LIMO,「生活が苦しい」高齢者が半数超！70歳代のリアルな「貯蓄額」と夫婦世帯の「生活費」はどれくらい？,https://news.yahoo.co.jp/articles/8f949d02e2e9f346d58792f57e1e5921173adae5,11/26(水) 11:20
2025-11-27,09:32,business,経済,26,ITmedia ビジネスオンライン,ドンキの巨大歯ブラシ「1年で27.4時間の節約」　1カ月で1万本売れた背景とは,https://news.yahoo.co.jp/articles/3ad278cb9812f1df5015759d8a002442bb291374,11/27(木) 6:35
2025-11-27,09:32,business,経済,27,みんかぶマガジン,〈コメ最高値〉余っているのに高騰「農協の吊り上げ」重大証言！農家も国民もバカにした「お米券」配布…自民党に農政を任せてはいけない,https://news.yahoo.co.jp/articles/208b9ce5f29edf0538471ad83428e767f4bf4802,11/24(月) 9:10
2025-11-27,09:32,business,経済,28,Bloomberg,中国、航空各社に来年3月末までの日本向け減便を指示－関係者,https://news.yahoo.co.jp/articles/4a183f6c8aa9429a43491b93001bf4d02b63d934,11/25(火) 16:04
2025-11-27,09:32,business,経済,29,ロイター,ネクスペリア問題、中国がＥＵと解決促進で合意　オランダ蚊帳の外,https://news.yahoo.co.jp/articles/b1a68c318e7fece1c10fb530ca9ea75f3af7e9b5,11/27(木) 7:30
2025-11-27,09:32,business,経済,30,Bloomberg,トランプ大統領、高市首相に台湾巡り中国を刺激しないよう助言－WSJ,https://news.yahoo.co.jp/articles/9d7e5a22b3863cbba6abe809fe595f34db66e4e1,11/27(木) 8:45
2025-11-27,09:32,business,経済,31,乗りものニュース,ロシア軍の“先端の尖った”奇妙な練習機が現れスクランブル発進！ 領空侵犯を受け警戒強化中のNATO,https://news.yahoo.co.jp/articles/13eb68ccbc76d80a161e4e0860b9b4ccebe0ab7a,11/27(木) 6:12
2025-11-27,09:32,business,経済,32,Bloomberg,円は対ドル156円半ば、円安基調続く－野口日銀委員の講演トーン注目,https://news.yahoo.co.jp/articles/8976ef27fd0d59120e765276da5c09525b97e0dc,11/27(木) 7:52
2025-11-27,09:32,business,経済,33,毎日新聞,小野妹子の子孫が願う「新しい風景」　茅乃舎が老舗の思い継承　福岡,https://news.yahoo.co.jp/articles/36580b029669bf277a3307da7cf3bb8d2432de2c,11/27(木) 8:15
2025-11-27,09:32,business,経済,34,ファイナンシャルフィールド,12月1日で「従来の健康保険証」は“有効期限切れ”に…「資格確認書があれば大丈夫」と思っていたら、医療費が高くなりビックリ！ 結局「マイナ保険証」は必要なんですか？ 意外と知らないリスクとは,https://news.yahoo.co.jp/articles/13c85489ea43dfbf627ba52d587902cfecdf30e1,11/25(火) 13:30
2025-11-27,09:32,business,経済,35,carview！,米から逆輸入されるトヨタ車の本命が「カムリ」の理由は「パトカー需要」という説。「ハイランダー」や「タンドラ」の可能性は？,https://news.yahoo.co.jp/articles/8629c2418bb9190abf714b545fa786a1b19f0255,11/27(木) 8:30
2025-11-27,09:32,business,経済,36,ABCニュース,「『危ないから日本に行かないように』と両親から言われたが、ここはとても安全」中国人観光客　3連休でにぎわう観光地に“渡航自粛”呼びかけの影響は？,https://news.yahoo.co.jp/articles/183d5b5a11584f8e54e9cfaf580b1a4082a5ce1b,11/24(月) 16:33
2025-11-27,09:32,business,経済,37,乗りものニュース,東武線「かつてのターミナル駅」が大変化！ 新ホームと改札が来月に使用開始へ 現ホームは94年の歴史に幕,https://news.yahoo.co.jp/articles/f42265a2da70201bee149b09d0aef85d18a3e097,11/27(木) 8:42
2025-11-27,09:32,business,経済,38,くるまのニュース,道の駅激怒「電気ぜんぶ消します！」“異例”の徹底対策を実施！ 同様の「走り屋集結スポット化」で“迷惑行為”に悩む施設も… 相次ぐ道の駅「迷惑集団」来場の現状とは,https://news.yahoo.co.jp/articles/5070ba2137e3fdd596ac3ded1b4daf4fb1c92cba,11/27(木) 7:00
2025-11-27,09:32,business,経済,39,日本農業新聞,「農業で1億円プレーヤーに」　元ドラゴンズ選手の三ツ間さん　限定イチゴスイーツ店が盛況,https://news.yahoo.co.jp/articles/623264a5540da56dcfa1ac5f8c8f8519b671f4b5,11/27(木) 8:20
2025-11-27,09:32,business,経済,40,まいどなニュース,知名度ゼロから、今や「おいしいごはん」の代表格に　街の米屋が生き残るために……次々と繰り出した、型破りの一手とは？,https://news.yahoo.co.jp/articles/2df133f816d42bf30cd07c9367651346d5eabcd5,11/27(木) 7:05
