scrp_date,scrp_time,genre_en,genre_jp,rank,media_jp,title,link,date_original
2025-05-05,05:07,domestic,国内,1,共同通信,建設会社勤務、ラップ活動も　川崎女性遺棄の27歳容疑者,https://news.yahoo.co.jp/articles/4a94a698c6595905916bdac096e7015bee0b92aa,5/5(月) 0:04
2025-05-05,05:07,domestic,国内,2,J-CASTニュース,離婚発表の与沢翼氏がビデオ通話公開、優しかった妻「もう存在しない」と嘆き節　視聴者は妻の人間力に感服,https://news.yahoo.co.jp/articles/98262ea00f5ce0df4e9cf334a30580a002079b44,5/4(日) 12:35
2025-05-05,05:07,domestic,国内,3,共同通信,ローソン店員、客にわいせつ疑い　神奈川県警が逮捕,https://news.yahoo.co.jp/articles/60072a4080e5a6b85020e874d39b1a2672fc6485,5/3(土) 23:03
2025-05-05,05:07,domestic,国内,4,テレビ朝日系（ANN）,タクシーの客同士が口論　仲裁に入った運転手が突き飛ばされ重傷　客を逮捕　相模原市,https://news.yahoo.co.jp/articles/ba5fe29fe4dc1b580f22e08a209544af1ade31d9,5/4(日) 20:19
2025-05-05,05:07,domestic,国内,5,FNNプライムオンライン（フジテレビ系）,行方不明の20歳女性の関係者ら約50人が“警察の対応”に抗議…警察官ともみ合いになるなど一時騒然　川崎市,https://news.yahoo.co.jp/articles/70c0655769f6bfd40548de2b317666a2c8f413bf,5/1(木) 18:58
2025-05-05,05:07,domestic,国内,6,FNNプライムオンライン,ストーカー被害訴えるも…警察「被害相談受けていたという認識なかった」元交際相手の白井秀征容疑者（27）を逮捕　川崎・遺体遺棄事件,https://news.yahoo.co.jp/articles/e37845acf19e30d66d3ebb7b263e925a2bd4e06f,5/4(日) 10:47
2025-05-05,05:07,domestic,国内,7,FNNプライムオンライン,女性の入浴を見ながら飲食“VIPコース”も…東京・渋谷で“無許可接待営業”ペルー国籍のバー経営者逮捕　1日に30万円も支払う太客も…売上1億円以上か,https://news.yahoo.co.jp/articles/fcc9745ac793ffb4cc97016177da68c739ae81fd,5/2(金) 14:13
2025-05-05,05:07,domestic,国内,8,テレビ朝日系（ANN）,任意で自宅捜索「そこはやめて」 後日その部屋から女性遺体発見　元交際相手の男逮捕,https://news.yahoo.co.jp/articles/0fb8b5724635a91f44ee8101dec12200c01e13fe,5/4(日) 11:48
2025-05-05,05:07,domestic,国内,9,日刊スポーツ,【叡王戦】斎藤慎太郎八段「中終盤の大事なところで間違えた」かど番に追い込まれる,https://news.yahoo.co.jp/articles/c02d70ea3e1180bda72d804da940e369eee0398e,5/4(日) 21:07
2025-05-05,05:07,domestic,国内,10,日テレNEWS NNN,【最新】「ストーカー相談受けた認識なし」川崎20歳女性遺体遺棄　神奈川県警が被害相談などへの当時の対応を説明,https://news.yahoo.co.jp/articles/8aa4f1b857c818699337d596eaef47165c0e3361,5/3(土) 19:15
2025-05-05,05:07,domestic,国内,11,TBS NEWS DIG Powered by JNN,【速報】石破内閣の支持率33.3％　先月調査から2.7ポイント上昇　5月JNN世論調査,https://news.yahoo.co.jp/articles/1e22c341488820f0dae3407ee062c8a006499c7b,5/4(日) 23:01
2025-05-05,05:07,domestic,国内,12,時事通信,参院選後に「玉木首相」？　本人にずばり聞いた,https://news.yahoo.co.jp/articles/13e58e62d0bc21474f251ebdc6d40de4d2d4894b,5/4(日) 15:00
2025-05-05,05:07,domestic,国内,13,共同通信,耳に着けないイヤリング、手軽なおしゃれ　考案の中学生社長、アイデア絶えず,https://news.yahoo.co.jp/articles/6a6c218462e5335ec4d8458c7f30ce8d066e9ba0,5/4(日) 8:00
2025-05-05,05:07,domestic,国内,14,弁護士ドットコムニュース,「八百長プレイでグラウンドを…」巨人阪神、伝統の一戦で〝侮辱的な〟替え歌　法的問題はないのか？,https://news.yahoo.co.jp/articles/b0a78b75beb7cf0d0cc28dea3972f0c927e603de,5/4(日) 7:21
2025-05-05,05:07,domestic,国内,15,毎日新聞,川崎・遺体遺棄事件　遺体は行方不明の20歳女性と判明,https://news.yahoo.co.jp/articles/4ea813c092db35abaa541771b7e3f05732ff26d1,5/3(土) 15:44
2025-05-05,05:07,domestic,国内,16,よろず～ニュース,国民・玉木代表 若者減税法案「党内からも反発」との記事に反論「党内に異論はありません」「なぜ急に批判」,https://news.yahoo.co.jp/articles/e3f48a0d317ee04f8377b6e49bdd97e80070c0bd,5/4(日) 18:30
2025-05-05,05:07,domestic,国内,17,日刊スポーツ,「東京都23区」震源の地震でトレンド入り「珍しい」「警戒しましょう」SNSに驚きや不安の声,https://news.yahoo.co.jp/articles/261ed704066441dda90068a59bb4a14c9ea8a874,5/4(日) 15:13
2025-05-05,05:07,domestic,国内,18,時事通信,被害女性の父、県警対応を非難　「ここで殺されたも同じ」と抗議,https://news.yahoo.co.jp/articles/9b2a6075d626d3528aab95f509645957286c0a41,5/3(土) 23:33
2025-05-05,05:07,domestic,国内,19,読売新聞オンライン,国内外で増す佳子さまの役割、皇室への親しみ広げる存在に…側近が明かす「頑張り屋」の一面,https://news.yahoo.co.jp/articles/2abf747040df58f0174281df819b4f65023955a6,5/4(日) 13:01
2025-05-05,05:07,domestic,国内,20,TBS NEWS DIG Powered by JNN,【速報】消費税の減税「食料品の税率下げるべき」35％で最多　5月JNN世論調査,https://news.yahoo.co.jp/articles/8c072f656484867106a75a3427a9c4694501fa9f,5/4(日) 23:03
2025-05-05,05:07,domestic,国内,21,産経新聞,「娘は神奈川県警に殺されたも同じ」　川崎住宅遺体、女性の家族らが警察に抗議,https://news.yahoo.co.jp/articles/5b9093526be64cb8008f9a20c85c771d602869da,5/3(土) 21:45
2025-05-05,05:07,domestic,国内,22,朝日新聞,石破首相の妻佳子さん「初のベトナム訪問で刺激」　2度目の外遊同行,https://news.yahoo.co.jp/articles/078e8ead5855ac3b46104a7821b1cae206b49379,4/28(月) 16:20
2025-05-05,05:07,domestic,国内,23,スポニチアネックス,オリラジ中田弟・FISHBOYこと中田フィッシュ氏　参院選向け出馬会見「求められれば踊ります」,https://news.yahoo.co.jp/articles/a1b2e5de09f10eccf8d13eab58063893e2a2b921,5/1(木) 13:33
2025-05-05,05:07,domestic,国内,24,FNNプライムオンライン,【独自】「下手したら命の危機」“20〜30代女性”が自転車で車道のド真ん中走行　“スマホながら運転”の自転車とあわや正面衝突の瞬間も「周り巻き込むのは勘弁」,https://news.yahoo.co.jp/articles/67473e648654f4aa3a70ca3b1e151c07e25c356d,5/4(日) 11:02
2025-05-05,05:07,domestic,国内,25,共同通信,川崎遺棄容疑者、親族説得で帰国　出国の経緯捜査、5日送検,https://news.yahoo.co.jp/articles/bd57b7c4a7f009a8793ab4e41eed096e9f331203,5/5(月) 3:16
2025-05-05,05:07,domestic,国内,26,読売新聞オンライン,岩場のロープつたい渡ろうとした７３歳、滑落死…谷川岳天神尾根の登山道,https://news.yahoo.co.jp/articles/89630861098f45b030104d32ca20f5772a213b34,5/4(日) 22:06
2025-05-05,05:07,domestic,国内,27,TBS NEWS DIG Powered by JNN,長崎県、熊本県で最大震度1の地震　長崎県・雲仙市、熊本県・八代市、上天草市、芦北町,https://news.yahoo.co.jp/articles/5389ffdfe27b89691e2a3cca3ceca9a331b3bba0,5/5(月) 2:08
2025-05-05,05:07,domestic,国内,28,J-CASTニュース,ADHDの「先延ばし癖」改善に「殴る」は有効か　Xで主張流布、専門家は警鐘「ずっとは続かない」,https://news.yahoo.co.jp/articles/389153d531738812f6d1083d6101a23c414d7202,5/4(日) 13:00
2025-05-05,05:07,domestic,国内,29,スポニチアネックス,川崎女性死体遺棄　「そこはやめて」で床下捜索できず　行方不明後3度容疑者宅確認も捜査令状なく…,https://news.yahoo.co.jp/articles/19ebb1bdf9e93fb4e595a109eb84c3333da354dd,5/5(月) 4:42
2025-05-05,05:07,domestic,国内,30,日刊スポーツ,「恥を知れ」神奈川県警Ｘに批判コメント殺到　川崎死体遺棄事件で説明求める声　抗議動画も拡散,https://news.yahoo.co.jp/articles/22f2f95766ed1a18b7e5b2a4f0bc0cd678455b66,5/4(日) 15:38
2025-05-05,05:07,domestic,国内,31,時事通信,マスクに帽子、淡々とした様子　元交際相手の白井容疑者　川崎女性遺体,https://news.yahoo.co.jp/articles/55574d2bf4cd6c296b2d4ca4cbc25350d661c7bc,5/3(土) 17:12
2025-05-05,05:07,domestic,国内,32,J-CASTニュース,離婚報告の与沢翼氏が明かした「罪」とは......「初めての薬物経験」振り返り「この機に処分しました」,https://news.yahoo.co.jp/articles/b64d6adc08b39e1c16c5cc82f38c63fa8ec59792,5/2(金) 12:25
2025-05-05,05:07,domestic,国内,33,ABEMA TIMES,「消費税減税はやらない方針」石破総理に直撃取材 森山幹事長の存在や立憲への批判が決め手となったか,https://news.yahoo.co.jp/articles/4a273d2b1152c8e578a6ad9d212cdb237ea10401,5/4(日) 14:57
2025-05-05,05:07,domestic,国内,34,読売新聞オンライン,神戸の病院、がんの治療が遅れて患者２人死亡…耳鼻咽喉科と循環器内科で,https://news.yahoo.co.jp/articles/4d6c41b7fdf5e9e07decc715df18e77cbfee5982,5/3(土) 7:10
2025-05-05,05:07,domestic,国内,35,共同通信,ヘビ真菌症、野生で初確認　沖縄・与那国、致死率40％,https://news.yahoo.co.jp/articles/ddc4b4490fc87245f209b8827a85fa1357f76962,5/4(日) 15:31
2025-05-05,05:07,domestic,国内,36,日刊スポーツ,米山隆一氏、配信番組混乱を謝罪　日大関連投稿は削除も…西田亮介教授には長文で再反論／全文,https://news.yahoo.co.jp/articles/dfb1a6715def2b9c57d663eb91d1e739d507f05f,5/4(日) 9:16
2025-05-05,05:07,domestic,国内,37,共同通信,容疑者父「被害者に申し訳ない」　児童7人重軽傷、2年前に異変,https://news.yahoo.co.jp/articles/9c9600b3af277e14bc44301cf9796b099b31bf00,5/4(日) 18:01
2025-05-05,05:07,domestic,国内,38,TBS NEWS DIG Powered by JNN,「参院選前のパフォーマンス」玉木代表の肝入り?「若者減税法案」に波紋　国民民主党内からも反発の声あがり火消しに躍起【edge23】,https://news.yahoo.co.jp/articles/db5b070127898322e5e1e8aa59e7323c23c00f1f,5/3(土) 7:02
2025-05-05,05:07,domestic,国内,39,毎日新聞,ユニセフに27円寄付はルール違反？　練馬区教委が小学校を指導,https://news.yahoo.co.jp/articles/44ebdd0513e4cc989467698e6fe4ace14c8941af,5/4(日) 6:00
2025-05-05,05:07,domestic,国内,40,TBS NEWS DIG Powered by JNN,「消費税減税の大合唱」も課題は山積…ブレ目立つ石破総理　「痛税感」の抑制などで“真の物価高対策”を,https://news.yahoo.co.jp/articles/fa3f9c66ef507c037351c77802dc2e87461dc64f,5/4(日) 7:01
