scrp_date,scrp_time,genre_en,genre_jp,rank,media_jp,title,link,date_original
2024-11-09,08:06,life,ライフ,1,OTONA SALONE,田中律子「53歳の恋はそばにいられたらそれでいい」。12年のレスを経て離婚した意外すぎる「きっかけ」と「現在の恋愛」は？【インタビュー】,https://news.yahoo.co.jp/articles/cfe46cba250816d64fd263b2b614d52cdf256a30,11/8(金) 20:01
2024-11-09,08:06,life,ライフ,2,ほ・とせなNEWS,2歳孫を抱っこするじいじ　しかしよく見ると…「見てるこっちもほっこりする」「大好きですね」「孫の前ではデレデレ」の声,https://news.yahoo.co.jp/articles/5a786beb907a8d122f4aee9d9f596563ee4fac4c,11/9(土) 6:30
2024-11-09,08:06,life,ライフ,3,ファイナンシャルフィールド,ランドクルーザーの「10倍以上」の盗難率！最も狙われている国産車とは,https://news.yahoo.co.jp/articles/f0e853875f7dfe1949e7b3c2c4fd166a198859a6,11/8(金) 11:20
2024-11-09,08:06,life,ライフ,4,ねとらぼ,イモト、突然「今日まさかの納車です」と“圧倒的人気車”を購入　こだわりのオプションも披露し光岡自動車からの乗り換えを明かす,https://news.yahoo.co.jp/articles/3caf47d9aeccfe3f6a0b5df5f3fbeaeff489289f,11/8(金) 17:38
2024-11-09,08:06,life,ライフ,5,LIMO,東京メトロの車内ディスプレイを見ていたら…「大手町駅の乗換案内の情報量」に驚きの声,https://news.yahoo.co.jp/articles/6b68fe6ad0d6d6c353f125ed3f7a8832846b5f18,11/9(土) 5:56
2024-11-09,08:06,life,ライフ,6,ほ・とせなNEWS,まだ目があいていない生まれたて赤ちゃん　2年後の変化に「爆笑しました」「どんどんかわいくなっていく」の声,https://news.yahoo.co.jp/articles/ed75144a5f616e297564814d5df56bd186592f2f,11/8(金) 14:00
2024-11-09,08:06,life,ライフ,7,ねとらぼ,子なし夫妻が柴犬を“人間の子ども”と同じように育てたら……　幸せあふれる日常の様子に癒やしをもらう人が続出「とても素敵」「本当に我が子」,https://news.yahoo.co.jp/articles/52d93d9f6e341fe6d3c3d5c49ce24d8e691a8346,11/7(木) 8:00
2024-11-09,08:06,life,ライフ,8,LIMO,チェックアウトの時に確認したはずが…スーパーホテルの「忘れ物あるある」に共感の声が続出,https://news.yahoo.co.jp/articles/4c0756b0523ca28e48532f30a567444a5758d61d,11/9(土) 6:32
2024-11-09,08:06,life,ライフ,9,Web LEON,最新ツーブロック、ショートヘアetc. 30～40代のデキる男の髪型はコレ！,https://news.yahoo.co.jp/articles/e6a04dc246cba74d6852d8bfdfb563804e43828b,11/7(木) 8:05
2024-11-09,08:06,life,ライフ,10,ねとらぼ,「これ一番憧れる！」　“職場で二度見された”お弁当が7万いいね　みっちり詰まった“最高ビジュ”に「おかずの圧が凄いなwww」,https://news.yahoo.co.jp/articles/dfa3c4efe910cd3d1889e803fd2aeb45a9c12694,11/8(金) 22:00
2024-11-09,08:06,life,ライフ,11,ファイナンシャルフィールド,2024年10月から「社会保険」の範囲拡大！「絶対に扶養を抜けたくない」パート主婦は月いくらまで稼げる？,https://news.yahoo.co.jp/articles/4659ecd29ec9e1df0e053b97669c07d626b654e7,11/8(金) 14:00
2024-11-09,08:06,life,ライフ,12,LIMO,ワークマンで今人気の「マザーズショルダーバッグ」が便利！お子さんと手ぶらで外出できて1900円なんです！,https://news.yahoo.co.jp/articles/45a1d2a40ef1b66fde79acbc33979e6dc609651c,11/9(土) 6:47
2024-11-09,08:06,life,ライフ,13,ねとらぼ,100均プラバンにいろいろな画材で描く→焼いてみたら……　驚きの仕上がりに「素敵！」「こんなに綺麗に！？」,https://news.yahoo.co.jp/articles/820ab134683472674a05d51ade1dbe0306be92a1,11/8(金) 10:30
2024-11-09,08:06,life,ライフ,14,日刊ゲンダイDIGITAL,マイナ保険証への一本化に医師らが撤回要請 官僚はタジタジ回答、場内から総ツッコミ！,https://news.yahoo.co.jp/articles/c955c30c13db12c2e2dd882fd01f38b2eaa14178,11/8(金) 9:06
2024-11-09,08:06,life,ライフ,15,LIMO,インドネシアで発見した「3文字の日本語」　自動車のリアガラスに書かれた内容に驚き,https://news.yahoo.co.jp/articles/7a4a8b3ae3f73a82ad3412273604cb4e64d5f921,11/9(土) 5:17
2024-11-09,08:06,life,ライフ,16,ねとらぼ,「今こんなするの……」　ブックオフに6万6000円で売っていた“伝説の商品”に驚がく「昔投げ売り状態だった」,https://news.yahoo.co.jp/articles/9ad0d439e95dc64928f7a7e36b6e4e6d859767c6,11/7(木) 7:00
2024-11-09,08:06,life,ライフ,17,Hint-Pot,「少し物足りない感じがしたわ」　イタリア人が気づいた日本食の特徴　一番おいしいと思った料理とは,https://news.yahoo.co.jp/articles/cc721294dcb5ee18f6795437491126a771bc11c2,11/9(土) 6:10
2024-11-09,08:06,life,ライフ,18,ファイナンシャルフィールド,引っ越し先で大家さんに「町内会費」を請求された！ アパートで一人暮らしでも払うものなのでしょうか？ 払わない“デメリット”はありますか？,https://news.yahoo.co.jp/articles/f4051b6297caab41c10fbe1151192a8257cab2d4,11/8(金) 13:40
2024-11-09,08:06,life,ライフ,19,ファイナンシャルフィールド,アパートの駐車場で「洗車」している人を見かけました。洗車代が節約できそうとは思いますが、ルール的には問題ないのでしょうか？,https://news.yahoo.co.jp/articles/5b7351d55f3c2d3006c663228aa80a996405c89d,11/6(水) 13:30
2024-11-09,08:06,life,ライフ,20,ねとらぼ,セリアの毛糸をどんどん編んでいくと……　秋にぴったりなアイテム完成に「すごくかわいい」「大人かわいい色合い」,https://news.yahoo.co.jp/articles/8dfec8d19ef660140fd07dd49af743a79afb4171,11/8(金) 11:00
2024-11-09,08:06,life,ライフ,21,おとなの週末,"万馬券に巨額の課税が!? 怯えた浅田次郎がたどり着いた、納税界の""解脱""",https://news.yahoo.co.jp/articles/dbd076c92faee1c7f5037686e69169ea1bd69686,11/9(土) 6:00
2024-11-09,08:06,life,ライフ,22,ねとらぼ,「なぜそのパーツがそうなるんだ!!」　100均木材の“棚”DIYがすごい→プロのような仕上がりに「凄過ぎる!!」,https://news.yahoo.co.jp/articles/99fa02d2d738ca8a5d15a37c2dd50df92cb82deb,11/8(金) 21:00
2024-11-09,08:06,life,ライフ,23,LIMO,「あったかい」「暖房費節約になる！」ワークマンで「ルームシューズ」が異例の大ヒット！1280円は凄い,https://news.yahoo.co.jp/articles/6e0f26a3b4d070315b201911bfeeafab84837540,11/8(金) 18:37
2024-11-09,08:06,life,ライフ,24,Fav-Log by ITmedia,元アウトドア店員が本当に買って良かった「ザ・ノース・フェイスのアイテム」3選　運動中も休憩時も快適な保温ウェアなど,https://news.yahoo.co.jp/articles/208e76fb9b43d7b074b831cbb9f460b0e9e4eef0,11/7(木) 20:30
2024-11-09,08:06,life,ライフ,25,BuzzFeed Japan,【ファミマ限定】ミッフィーの「ぽってりタンブラー」が絵本みたいなかわいさ！保冷保温もできて万能です《購入レビュー》,https://news.yahoo.co.jp/articles/40fe97ef1b27c74dc2e35bb0651e8ea4ed08c3d5,11/8(金) 17:35
2024-11-09,08:06,life,ライフ,26,BuzzFeed Japan,GUの「楽ちんセーター」が2990円→1990円に値下げ中！ゆったり楽ちんだし、体型カバーもできる名品です《着用レビュー》,https://news.yahoo.co.jp/articles/b31819438eecabeafaff1a4a5f40d7f2893e02ee,11/7(木) 17:05
2024-11-09,08:06,life,ライフ,27,婦人公論.jp,国民健康保険料が高すぎる！所得300万の40代夫婦と未成年の子ども2人、驚きの数字が…,https://news.yahoo.co.jp/articles/27524cbcab778916b6f4be2b479a56c0b82315c2,11/8(金) 12:32
2024-11-09,08:06,life,ライフ,28,リセマム,大学人気ランキング2024年10月版…神戸大・上智が上昇,https://news.yahoo.co.jp/articles/8d839452e4798c397939470e2d390aaef45f52ce,11/8(金) 18:16
2024-11-09,08:06,life,ライフ,29,婦人公論.jp,眉毛をペンシルだけで描いていませんか？大人世代はアイブロウパウダーで一気に垢抜け！パレットの中でも残りがちな「ベージュ」がポイントだった,https://news.yahoo.co.jp/articles/087cc77b0edfff675593b43c0fc87aa858bd1397,11/8(金) 12:32
2024-11-09,08:06,life,ライフ,30,ねとらぼ,「うちの愛犬にも」 大谷翔平の愛犬デコピンが日本の神社に“まさかの影響”　参拝者から「最近お問い合わせが多い」理由,https://news.yahoo.co.jp/articles/9fda84ab70ae4cd1607720222b0050650bcab37e,11/8(金) 18:11
2024-11-09,08:06,life,ライフ,31,ファイナンシャルフィールド,扶養内パートで「1日6時間・週4日」働いています。10月から社会保険の「加入対象者」が増えたそうですが、私も払う必要はありますか？ 払わずに済む方法はないのでしょうか？,https://news.yahoo.co.jp/articles/b62732d1d356bd991f7377b617b802e12aa06d4f,11/7(木) 13:40
2024-11-09,08:06,life,ライフ,32,ほ・とせなNEWS,パパの帰りを待つ1歳娘　パパが帰宅した瞬間…！？「全力で帰りたくなる～」「天使」「幸せだね」「こりゃメロメロ」,https://news.yahoo.co.jp/articles/afac0c69a4865b69175a4dfcde9559b71ed0e451,11/7(木) 11:30
2024-11-09,08:06,life,ライフ,33,LIMO,おばあちゃんから届いたLINEの文面に違和感　「誰かと交互に打っているような内容」を考察する人も,https://news.yahoo.co.jp/articles/b85c17f6119432352fc14b97a23b7f2b0054da1f,11/9(土) 4:47
2024-11-09,08:06,life,ライフ,34,ほ・とせなNEWS,子猫三兄弟を保護した3歳娘。その4年後の姿に「全員優勝」「すごいパワー」「可愛すぎだよ」の声,https://news.yahoo.co.jp/articles/ef0b730a7e4216c11f7908ff8e7f4484bc627b00,11/6(水) 15:00
2024-11-09,08:06,life,ライフ,35,グルメ Watch,カルディ「クリスマスミニバッグ」と「クリスマスぱっちんポーチ」発売,https://news.yahoo.co.jp/articles/f6af89faec9b48c3dc1d00628c24ea8e30882e6a,11/8(金) 12:57
2024-11-09,08:06,life,ライフ,36,BuzzFeed Japan,【GU】サッと羽織るだけでカワイイ！レビュー絶賛の「ぽかぽかアウター」秋冬のお出かけにたっぷり活躍してくれます！《着用レビュー》,https://news.yahoo.co.jp/articles/34f8f6e9659e116b614f31e13a28dee1c5fa0577,11/6(水) 16:05
2024-11-09,08:06,life,ライフ,37,まいどなニュース,50代男性が語る「妻と違う安らぎ求めた代償」 “ダブル不倫”が残した深い傷「こんなに苦しむなら…」,https://news.yahoo.co.jp/articles/857b0ad2f12f5ceb7e62cf0719c1841a71a364aa,11/8(金) 20:00
2024-11-09,08:06,life,ライフ,38,まいどなニュース,「頭が痛くて割れそう！」耳から出てきたモノに仰天　10年間綿棒でキレイにしていたのに…耳鼻科医「同じ症状の患者さん多い」,https://news.yahoo.co.jp/articles/5bd20ce158a933accdea80f7f9ac1489941e0e6f,11/6(水) 6:50
2024-11-09,08:06,life,ライフ,39,ほ・とせなNEWS,プールではしゃいでいた1歳息子…母「急に静かになったと思ったら」直後の姿に「可愛い」「うちの子も」「気持ちよかったんだね」,https://news.yahoo.co.jp/articles/5af36531113f0ef0f622c74570a7d489b39a1e37,11/8(金) 11:30
2024-11-09,08:06,life,ライフ,40,LIMO,「絶対喜んでる」噛まれてキックもされているのになぜか幸せそうな猫に1.3万いいねの大反響！「我々にはわからない2人の世界」,https://news.yahoo.co.jp/articles/22e05b75fb96c383a49fa047e35eb53411d310e7,11/9(土) 4:52
