scrp_date,scrp_time,genre_en,genre_jp,rank,media_jp,title,link,date_original
2025-06-23,08:07,sports,スポーツ,1,RONSPO,「他球団に失礼だ！」「撤回すべき」ソフトバンク小久保監督の「秋にはセ1位の阪神さんと戦えるように」の交流戦優勝コメントがSNSで物議…虎党からは「新庄日ハムとやりたい」の声も,https://news.yahoo.co.jp/articles/5a203ae30e89939339ed0d1f94c89c4306ae7399,6/23(月) 6:33
2025-06-23,08:07,sports,スポーツ,2,デイリースポーツ,ドジャースがまさか…ファンの手に当たってホームラン判定に覆る　本拠地大ブーイング　キムが痛恨アシストの形に　一気に３点ビハインド,https://news.yahoo.co.jp/articles/28be97a30db7d57fe088bf77b20ebbe949aa0134,6/23(月) 5:58
2025-06-23,08:07,sports,スポーツ,3,デイリースポーツ,「ドキッとしちゃうよね」伝説グラドルのハマスタ強風始球式に反響　ミニスカートふわり、ノーバンならずも笑顔で魅了「可愛かった」「３３なんや、全然見えん」,https://news.yahoo.co.jp/articles/bf55cc6f63542e88de24c4ac8a05df14b3674fb0,6/22(日) 23:00
2025-06-23,08:07,sports,スポーツ,4,スポニチアネックス,リアル二刀流の大谷翔平　2度目先発は1回無安打無失点2Kで笑顔で降板　最速159キロ！場内は拍手,https://news.yahoo.co.jp/articles/8de174077ea06735a0d0e23910707b0dbda207f9,6/23(月) 5:14
2025-06-23,08:07,sports,スポーツ,5,Full-Count,大谷翔平は「羨ましくない」　カーショーが語った“本音”…同僚として感謝「毎日アメージング」,https://news.yahoo.co.jp/articles/19b6947250b3f3aac333772534c9958c624e2536,6/23(月) 6:29
2025-06-23,08:07,sports,スポーツ,6,デイリースポーツ,来日最短ＫＯのＤｅＮＡ・バウアー　粘れなかったのかの問いに「その質問は納得がいかない」と反発　「自分の中では粘り強く投げていたつもり」,https://news.yahoo.co.jp/articles/285c1dfd074603b851ae300577557d2b28be8b50,6/22(日) 18:58
2025-06-23,08:07,sports,スポーツ,7,CoCoKARAnext,「イキがってるだけ」元阪神スアレスの“報復”に米記者が怒り心頭！　大谷翔平への死球を糾弾「タチが悪い。最低のやり方だ」,https://news.yahoo.co.jp/articles/4b4fe42a56aa095e3b81f0a23f34125a3abd4516,6/23(月) 5:30
2025-06-23,08:07,sports,スポーツ,8,日刊スポーツ,大谷翔平は中５日で１イニング18球で降板　予想外の球数に解説も「どういう意味を持つのか…」,https://news.yahoo.co.jp/articles/8d9319a0a14d559317c2c9618dfedf3977d8952e,6/23(月) 6:02
2025-06-23,08:07,sports,スポーツ,9,東スポWEB,【Ｆ１】角田裕毅が逆転残留へ〝追い風〟　ホーナー代表が異例絶賛「彼はマックスに近づいている」＝英報道,https://news.yahoo.co.jp/articles/21cf06c7bf86688f207cef5e9d54c347fe4d832e,6/23(月) 5:16
2025-06-23,08:07,sports,スポーツ,10,ゴルフ総合サイト ALBA Net,岩井千怜、山下美夢有が合計1億3000万円超　全米女子プロで日本勢はいくら稼いだ？,https://news.yahoo.co.jp/articles/f22fb72534d02aedcd7d91351e81437994d1db50,6/23(月) 7:05
2025-06-23,08:07,sports,スポーツ,11,Full-Count,大谷翔平、最速159kmで1回無失点降板　ベッツ失策でピンチも連続K…1球ごとに歓声,https://news.yahoo.co.jp/articles/43a7a450bb24c1399b9ebf22e74530de97edc890,6/23(月) 5:25
2025-06-23,08:07,sports,スポーツ,12,ベースボールキング,阪神、1点を追う7回に不可解な采配…斎藤雅樹氏が苦言「セーフティスクイズというサインは選手に丸投げなんですよ」,https://news.yahoo.co.jp/articles/297c3eab439421a9e0d0b195972d5192cf9002af,6/23(月) 6:50
2025-06-23,08:07,sports,スポーツ,13,デイリースポーツ,大谷翔平　２６号弾を父が捕球し損ね少年ファンが号泣　本塁打レビューで覆り無事に本塁打　１試合５打点の大暴れ,https://news.yahoo.co.jp/articles/760fa136fe9dfae15052a7dc2d4f174529fab479,6/23(月) 7:38
2025-06-23,08:07,sports,スポーツ,14,ABEMA TIMES,球場騒然！ 死球にブチギレ… あわや乱闘「ヤバすぎ」「怖え」 打者が大激怒して詰め寄る→投手も“逆ギレ応戦”… 両軍が入り乱れる緊急事態,https://news.yahoo.co.jp/articles/51e0ea82884c13213c062285e4e1d10c4b7da833,6/23(月) 5:46
2025-06-23,08:07,sports,スポーツ,15,ENCOUNT,BDオーディションで“本物の不良”が配信できないほど大暴れ　エンセン井上が危惧「間違いなく事故起きる」,https://news.yahoo.co.jp/articles/44b9331d733ae28518a03a1743f9ce50fd6fee7b,6/22(日) 20:36
2025-06-23,08:07,sports,スポーツ,16,中日スポーツ,【中日・井上監督語録】先発・松葉に「ウチの今の間違いなくエース」「世間は6回までいったら残業とか…6回7回いかせてくださいって言う松葉が完成したのかな」,https://news.yahoo.co.jp/articles/0363af73bdccf4b09fcc0afac1b808d6c66f4785,6/23(月) 5:45
2025-06-23,08:07,sports,スポーツ,17,東スポWEB,【柔道】国士舘大６人が大麻使用　前総監督・鈴木桂治氏は再建に意欲も…指摘される「廃部」の可能性,https://news.yahoo.co.jp/articles/41cf076517e6b7dc69171f7b963dedf22f38af98,6/23(月) 5:16
2025-06-23,08:07,sports,スポーツ,18,共同通信,ネビンと2年契約延長へ　西武、5月に月間MVP,https://news.yahoo.co.jp/articles/24a16ca6f74812320a1b6a591591fa0c548de4da,6/23(月) 5:02
2025-06-23,08:07,sports,スポーツ,19,西スポWEB OTTO！,ドラ1指名から17年…斬新ヘアスタイルで登場の39歳・蕭一傑さんに脚光「こんな髪型になってたのか」「懐かしすぎるやろ」「球が強いね」,https://news.yahoo.co.jp/articles/eb02dcdb1d238bc900d89b8b846d1ba99ffa4ec2,6/23(月) 5:40
2025-06-23,08:07,sports,スポーツ,20,Full-Count,大谷翔平が覆した“定説”　LA中継は興奮…1回2K無失点→激走三塁打「打てないって誰が」,https://news.yahoo.co.jp/articles/70daed54a5db145f6cc62294ca999523256aa491,6/23(月) 7:29
2025-06-23,08:07,sports,スポーツ,21,日刊スポーツ,大谷翔平、８試合ぶり26号　日本人３人目の日米通算300号に王手　投打二刀流のリズム合う,https://news.yahoo.co.jp/articles/1852c5f4326f85cfdba6534a39413bf86cc6c816,6/23(月) 7:36
2025-06-23,08:07,sports,スポーツ,22,東スポWEB,【日本ハム】新庄監督「11勝７敗」の〝公約〟堂々実現も…気になる唯一の「誤算」,https://news.yahoo.co.jp/articles/7a90190ab875c34b05b58843dbf916581c381e22,6/23(月) 6:16
2025-06-23,08:07,sports,スポーツ,23,サッカーキング,サウジでプレーする21歳コロンビア代表FW、わずか半年で欧州サッカー界へ電撃復帰か,https://news.yahoo.co.jp/articles/c7c5ae83f3998167059a08817a9e36680e654219,6/23(月) 0:50
2025-06-23,08:07,sports,スポーツ,24,日刊スポーツ,【DeNA】グラドル篠崎愛が始球式　ミニスカルーズソックス姿で華麗なワンバン投球,https://news.yahoo.co.jp/articles/f2b380b9049e025970ff1808fc1eee6d0ef37358,6/22(日) 14:32
2025-06-23,08:07,sports,スポーツ,25,東スポWEB,内藤哲也のフリー初陣は７月２５日の英国・ＲＰＷロンドン大会「最初の１歩は海外から」,https://news.yahoo.co.jp/articles/f674f2aa775fb7a8d51d1cdf1400dba78c808f38,6/23(月) 5:16
2025-06-23,08:07,sports,スポーツ,26,FITNESS LOVE,“曲線ボディライン”で魅せた27歳・歯科衛生士　「昔は細ければ正解と思っていました」,https://news.yahoo.co.jp/articles/30a7367d339543e0b7ca353b24138df0624ad56c,6/23(月) 4:30
2025-06-23,08:07,sports,スポーツ,27,Full-Count,大谷翔平にメロメロ、ド軍美人カメラマン「これ以上になれる？」　捉えた1枚が「アメージング」,https://news.yahoo.co.jp/articles/33a5eb03746c430e380343a58c91622e266c1d93,6/22(日) 22:03
2025-06-23,08:07,sports,スポーツ,28,スポーツ報知,巨人・坂本勇人「懐かしいなー」１７日のハム戦で９年ぶりレジェンド左腕と対戦　翌日は約５分間の野球談議,https://news.yahoo.co.jp/articles/c88a41bc359a52b134cefdcc058de931caed821f,6/23(月) 5:00
2025-06-23,08:07,sports,スポーツ,29,スポニチアネックス,元横綱・朝青龍、笑顔の2ショットで白鵬翔氏へエール「飛ぶんだ白鵬」　Tシャツ短パン姿に反響,https://news.yahoo.co.jp/articles/8c380ecceea5c60c4a0e05b70e726c74d556f6ec,6/22(日) 22:34
2025-06-23,08:07,sports,スポーツ,30,東スポWEB,ドネア＆バルガス＆堤聖也…ＷＢＡの王座乱立に元世界王者が苦言「多すぎ。１人にするべき」,https://news.yahoo.co.jp/articles/45bf665bb56f42bc164a5777e5a9246e2dbcbc33,6/23(月) 5:16
2025-06-23,08:07,sports,スポーツ,31,スポーツ報知,大谷翔平投手復帰２戦目で珍事　観客の手に直撃で３ラン判定に…金慧成が痛恨の“アシスト”の形に,https://news.yahoo.co.jp/articles/6bb3d6e80d527d02b74f1033758f429cdc0846ce,6/23(月) 6:16
2025-06-23,08:07,sports,スポーツ,32,Full-Count,大谷翔平、7回満塁機で走者一掃の3点三塁打　1回無失点降板後に快音、本拠地は熱狂,https://news.yahoo.co.jp/articles/aa16176cb2613bc64476d622a18fec079a91b703,6/23(月) 7:11
2025-06-23,08:07,sports,スポーツ,33,Full-Count,1度諦めたプロ入り「やっぱ無理かな」　スーツ着て就活も…会社辞めて選んだ茨の道,https://news.yahoo.co.jp/articles/1de60fce1114a68039eb453d11566d47d919c60b,6/23(月) 7:20
2025-06-23,08:07,sports,スポーツ,34,ゴルフのニュース,韓国のセクシークイーンが“爽やかすぎる”ゴルフウエア姿を披露！ 夏らしい装いにファンからは「美モモshotありがとう」の声も,https://news.yahoo.co.jp/articles/d335375af2e3d6e37016dd9a4d7ae0958183cadf,6/23(月) 6:00
2025-06-23,08:07,sports,スポーツ,35,TBS NEWS DIG Powered by JNN,大谷翔平 8試合ぶり26号で日米通算300号に王手！23年8月以来の“二刀流豪快弾” リーグトップタイのスアレスを突き放す,https://news.yahoo.co.jp/articles/2cbfe328a3a3a1f0c8ea09455004e1bb689c47f0,6/23(月) 7:35
2025-06-23,08:07,sports,スポーツ,36,デイリースポーツ,ドジャース　マンシーが逆転１０号満塁弾！吠えながらダイヤモンド一周　沈んでいた本拠地が一気に沸騰　２打席連発の１１号ダメ押し３ランも,https://news.yahoo.co.jp/articles/ebdfd49207b311732c0a8b8d735b024299581c68,6/23(月) 6:56
2025-06-23,08:07,sports,スポーツ,37,GOAL,レアル・マドリーがクラブW杯初勝利！7分にラウール・アセンシオが一発退場も…その後3点を叩き込んでパチューカ撃破,https://news.yahoo.co.jp/articles/60298d49b2e8b9023a80f76a7af22bdc69bfe574,6/23(月) 6:01
2025-06-23,08:07,sports,スポーツ,38,スポニチアネックス,片岡篤史氏が監督復帰を願う名捕手の名前「もう一回ユニホーム着て采配振るってる姿見たい」,https://news.yahoo.co.jp/articles/b05b9acebe901f22be7f5b3993403aeb37424a22,6/22(日) 20:33
2025-06-23,08:07,sports,スポーツ,39,Full-Count,マンシーが逆転満塁弾で本拠地熱狂　大谷翔平登板試合で収まらぬ歓声…衝撃弾で最高潮,https://news.yahoo.co.jp/articles/974666f9416ce67bc05ef0781a2ade06b777e7a3,6/23(月) 6:55
2025-06-23,08:07,sports,スポーツ,40,日テレNEWS NNN,【J1順位表】首位鹿島が敗戦　広島＆神戸が虎視眈々と浮上　残留争いFC東京＆新潟＆横浜FC＆横浜FMは全負け,https://news.yahoo.co.jp/articles/50d4ed109894fa014a6b81ba078b0d5ae8f76e29,6/23(月) 6:05
