scrp_date,scrp_time,genre_en,genre_jp,rank,media_jp,title,link,date_original
2026-02-20,20:15,world,国際,1,中央日報日本語版,インドで女性観光客に集団性的暴行…同行男性も死亡、3人に死刑判決,https://news.yahoo.co.jp/articles/2f162408b734b0831a0148b0807635e0730b1e67,2/20(金) 8:01
2026-02-20,20:15,world,国際,2,CNN.co.jp,食料も燃料もなく、観光客もいなくなったーー米国の圧力下で停止に追い込まれつつあるキューバ経済,https://news.yahoo.co.jp/articles/b64a8874b4cdc310e5fd72d7fc5023e0b3ba7d95,2/18(水) 19:03
2026-02-20,20:15,world,国際,3,BBC News,英警察が王室のアンドリュー元王子を逮捕、のち釈放　公務中の不正行為の疑い　国王は「法に沿って」と声明,https://news.yahoo.co.jp/articles/72a652bb8a6353ee57c27a635e1e9fc26eb4e43b,2/19(木) 13:58
2026-02-20,20:15,world,国際,4,朝鮮日報日本語版,「フグ毒の100倍」猛毒カニ食べたフィリピンの女性インフルエンサー、2日後に死亡,https://news.yahoo.co.jp/articles/b4e85a6a6f211789bd002bf7dad142f2936cb48c,2/20(金) 11:33
2026-02-20,20:15,world,国際,5,中央日報日本語版,「関税で赤字78％減少」主張したが…米国の輸入「過去最大」,https://news.yahoo.co.jp/articles/0f8ad8aa6f6d2c0efc3820cd09c04a2910c67512,2/20(金) 9:33
2026-02-20,20:15,world,国際,6,BBC News,【解説】 アンドリュー元王子の逮捕、イギリス王室にどれくらいダメージを及ぼすのか,https://news.yahoo.co.jp/articles/b60e2f044c4edc14231636cf82543a9197b63a19,2/20(金) 16:58
2026-02-20,20:15,world,国際,7,BUSINESS INSIDER JAPAN,ゴールドマン・サックスによると、金価格の上昇は「コモディティのスーパーサイクル」を意味するものではない（海外）,https://news.yahoo.co.jp/articles/d000a7b2c94145521ec75bbd406eaad68f546cda,2/20(金) 7:10
2026-02-20,20:15,world,国際,8,朝鮮日報日本語版,ウクライナ軍、スターリンク遮断されたロシア軍相手に直近2年半で最大の領土を奪還,https://news.yahoo.co.jp/articles/a67b8627c96b408483e0340b5de3b4d019ed3a61,2/20(金) 11:43
2026-02-20,20:15,world,国際,9,聯合ニュース,韓国政府　茂木外相の独島領有権主張に「即時撤回」要求＝日本公使呼び抗議,https://news.yahoo.co.jp/articles/69376406b8d834c8b3135a6022637e4225e58a81,2/20(金) 15:55
2026-02-20,20:15,world,国際,10,CNN.co.jp,英チャールズ国王、アンドルー元王子から距離置く　王室にダイアナ元妃の死以降最大の危機,https://news.yahoo.co.jp/articles/44caac14551c944c75bbcab18f065f2cdd271569,2/20(金) 12:35
2026-02-20,20:15,world,国際,11,読売テレビ,【衝撃】「自分を見ることを許さない」メーガン妃がイギリス帰国にあたり女王様のような要求か…Netflixの番組は打ち切り危機も!?,https://news.yahoo.co.jp/articles/0cde36919b1e874e02cf5334fb4bc566e99fe1d0,2/17(火) 16:00
2026-02-20,20:15,world,国際,12,CNN.co.jp,食品の世界最大手ネスレ、ハーゲンダッツなどアイスクリーム事業を売却へ,https://news.yahoo.co.jp/articles/f2c5e84427d18eb80448d9afcba0d6b8cf47c008,2/20(金) 11:24
2026-02-20,20:15,world,国際,13,FNNプライムオンライン,皇太子妃の長男が涙、揺らぐ信頼…マリウス裁判と皇太子妃スキャンダル　ノルウェー王室に迫る“二重危機”の行方は?,https://news.yahoo.co.jp/articles/013a1093c6c10609e702a271072e6c98de98cf71,2/13(金) 17:00
2026-02-20,20:15,world,国際,14,CNN.co.jp,市販ドッグフードから「危険な水準」の鉛や水銀　米調査団体が警鐘,https://news.yahoo.co.jp/articles/6d980f6a7230008fc9363ec8c521bf59917b92c7,2/20(金) 18:15
2026-02-20,20:15,world,国際,15,CNN.co.jp,米人気ドラマ「グレイズ・アナトミー」のエリック・デインさん死去、53歳　昨年ALSを公表,https://news.yahoo.co.jp/articles/7912ef7a0542ccfaebe8912c69698a3b0a103795,2/20(金) 15:00
2026-02-20,20:15,world,国際,16,47NEWS,「父や兄弟４人を目前で殺され、村の女性がレイプされた」８歳だったフィリピン人女性は…　旧日本軍の集団性暴力があった「赤い家」が朽ち果てる寸前に,https://news.yahoo.co.jp/articles/e0efff36c740d9a8f64c43c5afceb4571d1105f5,2/19(木) 10:32
2026-02-20,20:15,world,国際,17,中央日報日本語版,＜冬季五輪＞韓国スノーボードのチェ・ガオン、検査の結果「3カ所骨折」…足を引きずり掴んだ金メダルの代償,https://news.yahoo.co.jp/articles/e665267f43c4b04ee7380500beecbb86e0c37bb8,2/20(金) 10:56
2026-02-20,20:15,world,国際,18,中央日報日本語版,「自作自演の銃撃」で補償金詐取…「英雄」と称えられたロシア軍将校の実態,https://news.yahoo.co.jp/articles/f4c26380a1655d7db08651a2518ed2b3db07e829,2/20(金) 16:31
2026-02-20,20:15,world,国際,19,時事通信,米ゴールドマン女性幹部退任へ　エプスタイン氏と交友,https://news.yahoo.co.jp/articles/da7ace4d1934f0727c22fdba7d3a615201dbff2c,2/13(金) 18:31
2026-02-20,20:15,world,国際,20,ハフポスト日本版,オバマが「宇宙人は存在する」と明言。その理由をSNSで説明「本当です！」,https://news.yahoo.co.jp/articles/9b2fc2e67626be8c3ca9164eee28244097c18d7b,2/16(月) 19:50
2026-02-20,20:15,world,国際,21,ＡＦＰ＝時事,エプスタイン元被告との関係発覚のビル・ゲイツ氏、AIサミットでの基調講演をキャンセル,https://news.yahoo.co.jp/articles/05f5051b156c230411e1470db629e9794dee07bc,2/19(木) 13:43
2026-02-20,20:15,world,国際,22,KOREA WAVE,「養子にする」子犬3匹を連れ出し食用に…韓国・里親のはずが食肉解体、70代男に動物保護法違反の疑い,https://news.yahoo.co.jp/articles/377d0ee066ab61e5a560ccc1e115e5c2e085e4c8,2/19(木) 21:09
2026-02-20,20:15,world,国際,23,毎日新聞,中国外相の日本批判、欧米から「現実離れ」と冷ややかな評価も,https://news.yahoo.co.jp/articles/989b56f5be3d9df68c5f9dfa44bf9de97f2fc4f0,2/17(火) 21:05
2026-02-20,20:15,world,国際,24,ABEMA TIMES,「この落ちぶれた負け犬弁護士め！」“エプスタイン文書”めぐり米議会が罵詈雑言の嵐…国際政治学者が指摘する司法長官の“不可解な態度”とトランプ氏への余波,https://news.yahoo.co.jp/articles/eb9d49d0dbe07d3a611e4b05fc4a04af2847eab6,2/20(金) 11:30
2026-02-20,20:15,world,国際,25,中央日報日本語版,＜冬季五輪＞痛恨の第6エンド4失点···韓国女子カーリング、4強の壁に泣き崩れた,https://news.yahoo.co.jp/articles/2c1d97661ba2d6e87715aeb9b89ce3403ba3b616,2/20(金) 8:40
2026-02-20,20:15,world,国際,26,CNN.co.jp,アンドルー元王子の逮捕、英王室高位メンバーで約400年ぶり　チャールズ1世以来,https://news.yahoo.co.jp/articles/477c4d506ada21d477b1c6fac755a9787db03a79,2/20(金) 9:04
2026-02-20,20:15,world,国際,27,共同通信,日本の武器輸出ルール緩和を歓迎　ゼレンスキー氏単独会見,https://news.yahoo.co.jp/articles/a5dab06a2d19c4b2c57c114ee9562df55a5fa544,2/20(金) 8:48
2026-02-20,20:15,world,国際,28,ABEMA TIMES,氷上で動けないハクトウワシ 警官らが連携プレーで無事救助 アメリカ・ハドソン川,https://news.yahoo.co.jp/articles/d0ee4c10a0b6d63a98169e7c2080c28c867dbb03,2/20(金) 18:30
2026-02-20,20:15,world,国際,29,朝鮮日報日本語版,メダルラッシュの日本は現在総合9位、トップ10入り目指す韓国は15位　ミラノ冬季五輪,https://news.yahoo.co.jp/articles/4fc6576fe7efbabdf8ec18252049064e5f013833,2/19(木) 11:15
2026-02-20,20:15,world,国際,30,時事通信,米エヌビディア、オープンAIに4．6兆円出資か　15．5兆円の計画修正,https://news.yahoo.co.jp/articles/6bd7b5409f86fc40788bb66e241a886de7fada0f,2/20(金) 16:43
2026-02-20,20:15,world,国際,31,BBC News,【解説】 アンドリュー元王子の捜査、「エプスティーン資料」は「氷山の一角」か,https://news.yahoo.co.jp/articles/c3694f6191761239ab2e80b4ac458fa310976f7a,2/20(金) 14:58
2026-02-20,20:15,world,国際,32,時事通信,米最高裁、20日にも判決か　「相互関税」訴訟,https://news.yahoo.co.jp/articles/8c45e1b39657e04a150f8b3092b1a2b9517c0350,2/20(金) 14:16
2026-02-20,20:15,world,国際,33,ＡＦＰ＝時事,エプスタイン元被告を告発したジュフリーさんの家族、アンドルー容疑者は「王子では決してなかった」,https://news.yahoo.co.jp/articles/05f06132e5b3f65a3c40c01e997c1d3192b0b3fa,2/20(金) 8:22
2026-02-20,20:15,world,国際,34,BBC News,トランプ氏、10日以内にイランと核合意か攻撃かわかると　英政府は基地使用認めず,https://news.yahoo.co.jp/articles/bc75343b4cb89c0bbf998e7a833e1a31ba90b4cf,2/20(金) 14:02
2026-02-20,20:15,world,国際,35,読売新聞オンライン,侵略終結協議でいらだつウクライナ、ロシア側が「歴史の講義」で侵略正当化か…ゼレンスキー氏「くだらない話は不要だ」,https://news.yahoo.co.jp/articles/15b278f8f9e78c1103f7312ec1f88b8f6ee56e3e,2/20(金) 19:05
2026-02-20,20:15,world,国際,36,ロイター,仏伊首脳が非難の応酬、仏極右活動家死亡事件で,https://news.yahoo.co.jp/articles/0c594335ada92b2dd6134260f032d19e243ed260,2/20(金) 16:14
2026-02-20,20:15,world,国際,37,朝鮮日報日本語版,平均生存期間3日「人間地雷探知機」としてロシアに売られる東南アジアの若者たち,https://news.yahoo.co.jp/articles/626fae178a1b6e9dab7db4c7df0a0919f9bc19e8,2/14(土) 11:23
2026-02-20,20:15,world,国際,38,中央日報日本語版,オバマ氏を侮辱したトランプSNS…「参謀のミス」から一転、「すべて本人が投稿」,https://news.yahoo.co.jp/articles/b0d57edd2f8d54d714e868e391093e6eedb73f8b,2/20(金) 9:23
2026-02-20,20:15,world,国際,39,BUSINESS INSIDER JAPAN,1年で20kg痩せた男性が、過激なダイエットの反省から学んだ「無理なく痩せるための3つのルール」（海外）,https://news.yahoo.co.jp/articles/6c6455e677c90c2eda4855e83c53609e181564bf,2/20(金) 7:10
2026-02-20,20:15,world,国際,40,CNN.co.jp,アンドルー元王子が逮捕された理由　「公務上の不正行為」について知っておくべきこと,https://news.yahoo.co.jp/articles/10b369ce629472622f1007de4f4df8806c090742,2/20(金) 18:45
