scrp_date,scrp_time,genre_en,genre_jp,rank,media_jp,title,link,date_original
2025-09-04,02:05,domestic,国内,1,デイリースポーツ,ネット騒然「さすがにヤバ過ぎ」「嫌な予感しかない」鳩山由紀夫元首相、中国の抗日戦勝パレード出席でトレンド騒ぎ　元日テレ青山氏「完全に中国のプロパガンダに」,https://news.yahoo.co.jp/articles/6880e09c2ca25e89af0ccca00d5e93d81a6dec4c,9/3(水) 20:09
2025-09-04,02:05,domestic,国内,2,スポーツ報知,村上佳菜子、婦人科系の症状を抱えていることを告白「私はパートナーがいるので…」,https://news.yahoo.co.jp/articles/74dae5970ca835aac0666d26c93388fc7cafbf96,9/3(水) 19:46
2025-09-04,02:05,domestic,国内,3,デイリースポーツ,Ｘ大荒れ「すげえメンタルだな」「負けるな」東洋大学歴疑惑の市長　不信任可決も→白鳥ボートのお花畑投稿　１６００超コメ殺到「何を呑気に」「今することは？」「メガソーラ不要！」,https://news.yahoo.co.jp/articles/fe842e6fdb3155d66af7b918280237ad60fa2197,9/3(水) 16:48
2025-09-04,02:05,domestic,国内,4,スポニチアネックス,サントリーHD新浪剛史会長が辞任　「クーデターにはめられた」剛腕経営者に社内で反発か？,https://news.yahoo.co.jp/articles/05a91dd6ba84e386d76600425ffb860830d6d4a2,9/3(水) 4:30
2025-09-04,02:05,domestic,国内,5,共同通信,首相、週内にも経済対策指示検討　現金給付の所得制限案,https://news.yahoo.co.jp/articles/416ce2ccb6b74ae636b2845875605b1924f47fb3,9/3(水) 23:52
2025-09-04,02:05,domestic,国内,6,FNNプライムオンライン,「潔白」を繰り返し主張…サントリーHD会長辞任の新浪剛史氏が会見　逮捕された男からの“郵送”は「想定外」,https://news.yahoo.co.jp/articles/c7f60f6b5e32934cc25b52556d1d5692b480c832,9/3(水) 20:54
2025-09-04,02:05,domestic,国内,7,スポーツ報知,「はめられるなら社長やと思いますんで」サントリーＨＤ社長が会長辞任新浪氏のクーデター発言完全否定,https://news.yahoo.co.jp/articles/cdf2b3f5ed67eb1e7916455fcb36164746167108,9/3(水) 6:00
2025-09-04,02:05,domestic,国内,8,デイリースポーツ,田崎史郎氏　両院議員総会で評価ガタ落ちした自民大物幹部の名前「ボクは見苦しいなと思った」「自民党内の信頼厚かったが…」,https://news.yahoo.co.jp/articles/a8e7482916f68acd7f563482460456fb65a97f43,9/3(水) 14:46
2025-09-04,02:05,domestic,国内,9,共同通信,捜査対象のサプリからTHC　違法割合で含有、福岡県警,https://news.yahoo.co.jp/articles/a11df6deb0623bccb5faa33e7d41eaa06b2d91b7,9/3(水) 20:27
2025-09-04,02:05,domestic,国内,10,よろず～ニュース,堀江貴文氏、サントリーHD新浪会長辞任と違法サプリ疑いで捜査対象の報道に私見「これも芋蔓系なんかな」,https://news.yahoo.co.jp/articles/250178d9d29debd33a11194ab94119932c61e6d3,9/2(火) 20:02
2025-09-04,02:05,domestic,国内,11,ABEMA TIMES,ひろゆき氏、三菱商事の“洋上風力撤退”をめぐり「日本全体の風力発電も3年間止まった」「この責任は政府も大きい」,https://news.yahoo.co.jp/articles/c05c353b106586f0096023e6df0e47f5c6b19154,9/3(水) 22:09
2025-09-04,02:05,domestic,国内,12,テレビ朝日系（ANN）,伊東市長が議会解散へ　全会一致の不信任案可決を受け　再びの不信任決議阻止の動きが,https://news.yahoo.co.jp/articles/3bb8f8a85710868cda96192c79d7a2b437a2a5f1,9/2(火) 11:36
2025-09-04,02:05,domestic,国内,13,CBCテレビ,あす未明にも台風発生か 東海地方は接近前から“警報級大雨”のおそれ  本州直撃で広い範囲に影響も 発生すれば台風15号に【台風情報】,https://news.yahoo.co.jp/articles/c68ad932d9d1de0de51c413ee539a95ce79f32db,9/3(水) 20:01
2025-09-04,02:05,domestic,国内,14,J-CASTニュース,「じゃあ、何のために世論調査してるんですか」　田崎史郎氏の石破首相めぐる発言にジャーナリスト怒る,https://news.yahoo.co.jp/articles/6c12ad4a3e02a559b79611f550c2d521d60fa20e,9/3(水) 16:30
2025-09-04,02:05,domestic,国内,15,朝日新聞,「あいさつしない」部員約10人をバスに乗せず歩かせる　佐久長聖高,https://news.yahoo.co.jp/articles/850f2e9e93ffd375a607e0b658f426a37f10f965,9/3(水) 21:41
2025-09-04,02:05,domestic,国内,16,FNNプライムオンライン,猟銃やナイフで襲われ女性2人と警察官2人が犠牲　中野4人殺害立てこもり事件　9月4日初公判　争点は「刑事責任能力」と「量刑」　専門家「被告の精神疾患が犯行にどう影響を与えたかが一番のポイント」,https://news.yahoo.co.jp/articles/b5fd9a5762e7182506b6bc2f92e0c6e63d877451,9/3(水) 20:57
2025-09-04,02:05,domestic,国内,17,共同通信,畑に性別年齢不明の焼死体　愛知・岡崎,https://news.yahoo.co.jp/articles/ccceb8fd968dae58437081ec126b63f40eb38df1,9/4(木) 0:09
2025-09-04,02:05,domestic,国内,18,テレビ朝日系（ANN）,私は誰？カバンに残された60万円で身元探す“記憶喪失”の男性,https://news.yahoo.co.jp/articles/35f6e545c88ab07aee410dc417131ed026224821,9/2(火) 19:27
2025-09-04,02:05,domestic,国内,19,ABEMA TIMES,「潔白」主張の新浪剛史氏 サプリ購入は「時差ボケ対策」 アメリカ購入は「圧倒的に安い」,https://news.yahoo.co.jp/articles/f1203609b133edc9d9ba445cc23fb3b2d1e798e8,9/3(水) 16:03
2025-09-04,02:05,domestic,国内,20,毎日新聞,京阪本線で人身事故、運転見合わせ　2時間40分前も事故、再開直後,https://news.yahoo.co.jp/articles/c06d4190d9b9a64744f8cc263a161c34c0ee6d28,9/4(木) 1:02
2025-09-04,02:05,domestic,国内,21,日刊スポーツ,鳩山元首相に訪中中止要請の長男に「正しい認識」国民・玉木代表「諫言、心苦しかったと思う」,https://news.yahoo.co.jp/articles/239e2228b7f5145de7206d6aa0104e19346b7ad5,8/30(土) 6:10
2025-09-04,02:05,domestic,国内,22,FNNプライムオンライン,「全て事実です」同居の20代女も供述…俳優の清水尋也容疑者（26）を乾燥大麻所持の疑いで逮捕　常習的に使用か,https://news.yahoo.co.jp/articles/43909d2256cd4a64f5659dc9013b2f0fac3a5d80,9/3(水) 12:27
2025-09-04,02:05,domestic,国内,23,産経新聞,バス急ブレーキで乗客骨折　原因は飛び出し自転車、接触しなくてもひき逃げ容疑で捜査の訳,https://news.yahoo.co.jp/articles/2d2b52d3b5b017fd4736a603ddb077246b71ea4b,9/3(水) 19:00
2025-09-04,02:05,domestic,国内,24,読売新聞オンライン,「氷河期世代」対象の都職員採用試験、倍率５７倍に…募集は２０人,https://news.yahoo.co.jp/articles/a7a9c5f7f68dd228073159a608c7d03fea0aa703,9/3(水) 17:34
2025-09-04,02:05,domestic,国内,25,読売新聞オンライン,新浪剛史氏、違法サプリ所持・使用「ない」と繰り返し否定…購入は規制のない「ＣＢＤ」と主張,https://news.yahoo.co.jp/articles/8582ea0bc9ca1dbde7ef52c1a9eb4614808fa7eb,9/4(木) 0:36
2025-09-04,02:05,domestic,国内,26,読売新聞オンライン,外国人のワタリガニ大量捕獲が横行、夜間の採捕禁止…千葉・木更津の海岸で９～１１月,https://news.yahoo.co.jp/articles/62bd2309466388ef53e4278123aa186f1070bebb,9/3(水) 10:21
2025-09-04,02:05,domestic,国内,27,読売新聞オンライン,麻生太郎氏「総裁選前倒しを要求する」と明言…麻生派は大半が賛成へ・派閥外にも影響か,https://news.yahoo.co.jp/articles/057e9515111e5d2ff281f571f63018e1d25fc89f,9/3(水) 22:49
2025-09-04,02:05,domestic,国内,28,弁護士ドットコムニュース,満員電車で紙パック飲料こぼされ「スカートびしょ濡れ」に…被害女性の投稿話題「本当にやめて」 弁護士がリスク解説,https://news.yahoo.co.jp/articles/c40d347e634ce4245da3aa81661ead2880c39b43,9/3(水) 19:35
2025-09-04,02:05,domestic,国内,29,tenki.jp,台風発生へ　4日～5日は西日本～東日本に接近・横断か　東海地方は警報級大雨の恐れ,https://news.yahoo.co.jp/articles/54609cd6b1b9f23940435d1044425bb76c72d5e2,9/3(水) 15:22
2025-09-04,02:05,domestic,国内,30,CBCテレビ,【台風情報】東海地方は台風接近前から大雨に警戒を  あす未明にも台風15号発生へ 列島“直撃”予想  最新の雨・風シミュレーション 愛知・名古屋・岐阜・三重の天気予報,https://news.yahoo.co.jp/articles/c544db7cb8b8f9d6e247d4b799010ebfe69fb943,9/3(水) 17:33
2025-09-04,02:05,domestic,国内,31,tenki.jp,明日4日～5日は台風接近か　九州～関東で大雨の恐れ　6日以降は猛暑と急な雨に注意,https://news.yahoo.co.jp/articles/d90c1750b8a18a94a978d55ecb2b146ca5e5a5ca,9/3(水) 16:38
2025-09-04,02:05,domestic,国内,32,読売新聞オンライン,進退、揺れ動く首相…石破氏が虚偽説明　読売「退陣」報道を検証,https://news.yahoo.co.jp/articles/934dc19e1a4cf8f552023a054c7221e617f49597,9/3(水) 5:02
2025-09-04,02:05,domestic,国内,33,レスキューナウニュース,京阪本線・中之島線で人身事故 運転見合わせ,https://news.yahoo.co.jp/articles/2ca62957cc77d3b0e14d5657a7650ea45cd04380,9/4(木) 0:00
2025-09-04,02:05,domestic,国内,34,テレビ朝日系（ANN）,石破総理　週内にも経済対策指示を検討　現金給付は修正し所得制限設ける方向,https://news.yahoo.co.jp/articles/05e2db03f0adbb0fd7522b4b5eeb0e792ff00aa1,9/4(木) 1:09
2025-09-04,02:05,domestic,国内,35,FNNプライムオンライン（フジテレビ系）,俳優の清水尋也容疑者（26）と同居の20代女を逮捕　乾燥大麻所持の疑い「間違いありません」容疑認める,https://news.yahoo.co.jp/articles/f96be5263112d164df63d37e1853cf88443efc2e,9/3(水) 10:51
2025-09-04,02:05,domestic,国内,36,東海テレビ,ロータリーから来た車に次々…駅前の道路を横断していた93歳男性が車2台にはねられ死亡 当初意識あるも容体急変,https://news.yahoo.co.jp/articles/aada077ed431f1afd9fa39358d178bc352beb800,9/3(水) 19:06
2025-09-04,02:05,domestic,国内,37,読売新聞オンライン,銀行に来た女性客が電話しながら差し出したメモ…行員は電話先に気づかれないよう筆談を続け、詐欺を防いだ,https://news.yahoo.co.jp/articles/f1163784192677d0f4b92c4192ba89b30643d410,9/3(水) 14:50
2025-09-04,02:05,domestic,国内,38,読売新聞オンライン,不自由のない生活が一変、満州で子供だけの逃避行…置き去りや連れ去り「人間の本性は一生忘れず」,https://news.yahoo.co.jp/articles/fb3c96c5c94d83d1d859a2cfb4928b578a9b41e8,9/3(水) 15:36
2025-09-04,02:05,domestic,国内,39,ABEMA TIMES,「なぜ“サプリメント名”を公表しない？」「サントリーではない他のメーカーのサプリに疑いがかけられるとは考えなかった？」サントリーHD・新浪会長の辞任発表会見で記者が厳しく“追及”,https://news.yahoo.co.jp/articles/d223a9ec6ba3d99c031394e61b866ca2cffcb875,9/2(火) 16:30
2025-09-04,02:05,domestic,国内,40,日刊スポーツ,不信任可決の田久保真紀市長に著名弁護士が苦言「伊東市民全体のことを考えるという視点では…」,https://news.yahoo.co.jp/articles/7a51b9da69c018882abecafc276419427414bb45,9/2(火) 9:07
