scrp_date,scrp_time,genre_en,genre_jp,rank,media_jp,title,link,date_original
2025-07-05,15:09,sports,スポーツ,1,GOAL,マンチェスター・Uに5選手が退団意思を通達…ラッシュフォードやガルナチョら。チーム合流も見送りへ,https://news.yahoo.co.jp/articles/adaed1c7fe36b51e7090d26b2a00082274099c2c,7/5(土) 12:50
2025-07-05,15:09,sports,スポーツ,2,スポーツ報知,ドジャース屈辱的大敗　今季ワースト１８失点、２６年ぶり記録も…バースデー＆登板前日の大谷翔平無安打で３分後帰宅,https://news.yahoo.co.jp/articles/647bb1029b203a62697fc48139ca9b57c2a05c0a,7/5(土) 12:56
2025-07-05,15:09,sports,スポーツ,3,デイリースポーツ,阪神　岡田彰布顧問「大山の負担が大きい」得点力アップへ「打順が逆なんよ」鳥谷敬氏と「せやねん」で師弟対談「あーんじゃなくて！」のツッコミも,https://news.yahoo.co.jp/articles/7fe1477ddaf4268de815e75ccd2dbe40cd4c1bfb,7/5(土) 13:45
2025-07-05,15:09,sports,スポーツ,4,CoCoKARAnext,藤川阪神は「強すぎて、やばない？」光る用兵、主力の休養も、伏兵の活躍でしっかり勝ち星もぎ取るチーム力が話題　「3年後を見越して采配してるな」,https://news.yahoo.co.jp/articles/7fb5f63d10c780767b7c47a57d24b38295db0524,7/5(土) 11:25
2025-07-05,15:09,sports,スポーツ,5,Full-Count,ド軍本拠地に降臨した“実写版”ナミ「マジで綺麗」　大谷らの前で快投…ファン熱視線,https://news.yahoo.co.jp/articles/36dc07962b880c1909240e542aef76e3a1089866,7/5(土) 10:23
2025-07-05,15:09,sports,スポーツ,6,デイリースポーツ,ドジャース　１６点ビハインドでバンダ投入　日本のファン驚き「なんで投げてるの」「流石に無駄使い」米でも「ロバーツ正気か？」,https://news.yahoo.co.jp/articles/a78009ef8a8b167972287dbbd12148954ea4cf2b,7/5(土) 12:19
2025-07-05,15:09,sports,スポーツ,7,GOAL,三笘薫、バイエルン移籍を拒否。ブライトンとの新契約を選択へ,https://news.yahoo.co.jp/articles/38f2d097e7565cd1436c32e7ef9f8e1bb8afa643,7/5(土) 7:11
2025-07-05,15:09,sports,スポーツ,8,Full-Count,ロバーツ監督怒り心頭「今すぐ忘れたい」　18失点大敗…投手陣をバッサリ「収穫はない」,https://news.yahoo.co.jp/articles/bf2113f8b5d25686e0c838ca1f643212b2116e38,7/5(土) 13:12
2025-07-05,15:09,sports,スポーツ,9,スポニチアネックス,ド軍　1イニング10失点もファンが席を立たない理由　レジェンドOB明かす「この試合の…」“皮肉”も,https://news.yahoo.co.jp/articles/9e4f424454498c450c32be9f6618fbb531325231,7/5(土) 12:57
2025-07-05,15:09,sports,スポーツ,10,日刊スポーツ,ドジャース名物リポーター、ブルーの美ワンピースで登場　ベンチでバッチリ決めポーズ映像を公開,https://news.yahoo.co.jp/articles/21a7b054573b296dceb40868aa59f511f2355fb7,7/5(土) 14:05
2025-07-05,15:09,sports,スポーツ,11,デイリースポーツ,ドジャース　ミゲル・ロハスが１回無失点　山本由伸がベンチで拍手　１７点ビハインドでマウンドへ　キャリアハイの登板試合数に,https://news.yahoo.co.jp/articles/6aaa28bb6bc4a42e70513b3183a0e4cf3f1806dd,7/5(土) 12:49
2025-07-05,15:09,sports,スポーツ,12,TBS NEWS DIG Powered by JNN,松井秀喜「私の守備範囲は半径1mくらいですよ（笑）」松井稼頭央との三遊間へ意欲、“IL入り中”も「イチローさん記念の年、お祝いしたい」と出場決断,https://news.yahoo.co.jp/articles/0c3da0bce4a14854d58993ac83cbe2fdf76a72c2,7/5(土) 11:50
2025-07-05,15:09,sports,スポーツ,13,Full-Count,ド軍本拠地でまさかの“商品”「そんな売り方ありか」　絶大な大谷効果…SNS騒然,https://news.yahoo.co.jp/articles/0ade5fcf1758ec126bf6bbe0097df993ee2b414e,7/5(土) 14:14
2025-07-05,15:09,sports,スポーツ,14,東スポWEB,鳥谷敬氏　阪神からロッテに移籍して驚いたことは「誰もいない中で練習できる」,https://news.yahoo.co.jp/articles/9188e06c07d5c3c9f645e660903c27d05e19d0ab,7/5(土) 12:31
2025-07-05,15:09,sports,スポーツ,15,Full-Count,北海道に降臨した人気美女が豪快な一投　まさかの“暴投”も…満面の笑みにファン虜,https://news.yahoo.co.jp/articles/b6731e336795e0b8e519c1815c7e333c90a2116f,7/5(土) 13:48
2025-07-05,15:09,sports,スポーツ,16,東スポWEB,【Ｆ１】角田裕毅〝Ｆ１撤退〟は不可避か　ハジャールが昇格、リンドブラッドはＲブルズ加入へ,https://news.yahoo.co.jp/articles/781cd43830ee3ce5f5d758e59569db47a038d0cd,7/5(土) 10:06
2025-07-05,15:09,sports,スポーツ,17,デイリースポーツ,福島競馬で「７」の単勝に各レース約１００万円の“大口投票”１０連発！６Ｒで見事にＶ！単勝２０４０円！,https://news.yahoo.co.jp/articles/74e806c70f632ae4e064b79a3ea1b92376952caf,7/5(土) 11:59
2025-07-05,15:09,sports,スポーツ,18,中日スポーツ,42歳元中日内野手、ナショナルズ小笠原を訪ね、はるばる東海岸の小都市へ　ネット「2人ともいい笑顔」「素敵！」くしくもメジャーデビュー決定,https://news.yahoo.co.jp/articles/9f8716144a2a865db11d59a5c53ca042d8acc137,7/5(土) 14:15
2025-07-05,15:09,sports,スポーツ,19,デイリースポーツ,ドジャース　投手陣崩壊で悪夢の今季ワースト２桁１８失点　ロバーツ監督ゲキも響かず２６年ぶり屈辱　アストロズを揶揄していた客席も静まりかえる,https://news.yahoo.co.jp/articles/972d6e05d8ce1fe0e6c6f40c5bd2e0721cff0c3e,7/5(土) 11:55
2025-07-05,15:09,sports,スポーツ,20,デイリースポーツ,日本ハム　森香澄がまさかの赤面大暴投　引っかかって一塁側へのゴロに　マウンドでしゃがみ込む「ひどかった」「びっくりした」,https://news.yahoo.co.jp/articles/c7275c8a32c6febba6f1f6bc5e282bb281e4bc78,7/5(土) 13:54
2025-07-05,15:09,sports,スポーツ,21,中日スポーツ,【クラブW杯】マンC撃破のアルヒラルは惜敗で4強ならず…ネット「中東こんな強いのか」「このチームを倒さないとJリーグ勢は…」,https://news.yahoo.co.jp/articles/9c606504a700ef2efc66437e9f349f4b5783a5ae,7/5(土) 12:16
2025-07-05,15:09,sports,スポーツ,22,日刊スポーツ,【日本ハム】森香澄、ミニスカ大暴投「好きな人、私に教えて下さい…」,https://news.yahoo.co.jp/articles/9b84d4de6c0daa9176dc72a73843e51e48d3b30f,7/5(土) 14:34
2025-07-05,15:09,sports,スポーツ,23,スポーツ報知,大谷翔平の３１歳を同僚「キケ」が“前祝い”！？　ユニホーム風「１７」トップスで出勤,https://news.yahoo.co.jp/articles/25d0f76fa88cc5e46232322b280e1275d4e6664a,7/5(土) 14:18
2025-07-05,15:09,sports,スポーツ,24,日テレNEWS NNN,阿部監督も思わず頭抱える　巨人・中山礼都の好捕にベンチもわく　必死なプレーの裏にはある思い,https://news.yahoo.co.jp/articles/05eb615ab0a7138d3369511911d1744a6247faee,7/5(土) 14:32
2025-07-05,15:09,sports,スポーツ,25,RONSPO,衝撃結末の裏に何が？流れを変えた横浜DeNA「7回のベンチワークのミス」と“休養”でスタメンを外した大山悠輔を代打起用して一気に逆転を狙った藤川監督の“勝負師采配”,https://news.yahoo.co.jp/articles/344b50a8a33e1e2da8c1db2a8edd772efbb2c2b3,7/5(土) 7:02
2025-07-05,15:09,sports,スポーツ,26,ゴルフのニュース,【中間速報】吉本ここねが単独首位で後半へ 1差に木戸愛、永峰咲希 佐久間朱莉が5バーディーの猛追で4位浮上,https://news.yahoo.co.jp/articles/3263d398765e4d7d46ab40eba5323989ebc829df,7/5(土) 12:22
2025-07-05,15:09,sports,スポーツ,27,CoCoKARAnext,阪神27歳右腕の存在で「一気にブルペンが落ち着いたな」復帰後初の連投にも圧巻の0行進　防御率0.33の異才ぶり「戻ってきたの、めちゃめちゃでかい」,https://news.yahoo.co.jp/articles/8bc7eb0ac4b2cd86ec3e40deed5e656f0fed58f3,7/5(土) 12:27
2025-07-05,15:09,sports,スポーツ,28,馬トク報知,松山弘平騎手が小倉９Ｒを乗り替わり　検査のため,https://news.yahoo.co.jp/articles/2636b95b67d02e8259ee3efb1f389bcf6fd6951c,7/5(土) 14:18
2025-07-05,15:09,sports,スポーツ,29,日刊スポーツ,ベッツ「ブルペンにいるショウヘイを…」「神様が用意してくれた」23年WBC決勝の鮮明な記憶,https://news.yahoo.co.jp/articles/b6e7ecee76fee143ccdad6b8643698cbd9d35f25,7/5(土) 13:45
2025-07-05,15:09,sports,スポーツ,30,Full-Count,31歳大谷翔平へ…後輩から“粋な計らい”　総勢800人の壮大な祝福「なんて素敵な」,https://news.yahoo.co.jp/articles/4496fcd3b0409ac076cdf63a497a79314c006469,7/5(土) 11:23
2025-07-05,15:09,sports,スポーツ,31,スポニチアネックス,岡田さんズバズバ評論　「大山は3番起用も」「阪神勝負は8月」MBSテレビで,https://news.yahoo.co.jp/articles/afd41de80da0152b37889c25a479a3ed82fe0672,7/5(土) 13:28
2025-07-05,15:09,sports,スポーツ,32,東スポWEB,冨安健洋がアーセナル退団　ＳＮＳは今後に注目「日本でリハビリ」「Ｊクラブで再スタート」,https://news.yahoo.co.jp/articles/cdceb67456314f9c2068fb855c012a80d6596c21,7/5(土) 9:56
2025-07-05,15:09,sports,スポーツ,33,TBS NEWS DIG Powered by JNN,ドジャース屈辱…今季最悪18失点の大敗、連勝4で止まる　大谷翔平は2戦連続ノーヒット、明日31歳バースデー登板へ,https://news.yahoo.co.jp/articles/3d41ca3042b37d345727da0d4802b8c30e5d5d60,7/5(土) 12:55
2025-07-05,15:09,sports,スポーツ,34,時事通信,19歳の坂野旭飛選手死去　スキージャンプ,https://news.yahoo.co.jp/articles/0afde99d5a284a85eb522ad1ed07b61be6a972ce,7/3(木) 12:10
2025-07-05,15:09,sports,スポーツ,35,日刊スポーツ,【DeNA】９回悪夢の５失点…空席目立ち、黄色で染まる　三浦監督「７回ですよね…」,https://news.yahoo.co.jp/articles/337b670338237b350d9a130648e9b34cd26f1398,7/5(土) 9:36
2025-07-05,15:09,sports,スポーツ,36,RONSPO,角田裕毅が英国GPフリー走行2回目で17歳“神童”リンドブラッドにフェルスタッペンとのタイム差で遅れを取って15番手に沈むも「前戦よりいいスタート地点にいる」と強気姿勢崩さず,https://news.yahoo.co.jp/articles/22f7e3df8688db32ed5b06fa975fe2b9be06f902,7/5(土) 6:55
2025-07-05,15:09,sports,スポーツ,37,GOAL,チェルシー、パルメイラス撃破でクラブW杯4強入り！ 来季加入の18歳逸材に豪快弾浴びるも,https://news.yahoo.co.jp/articles/d2401143340c90f2886f958f12da517d198e7c96,7/5(土) 12:04
2025-07-05,15:09,sports,スポーツ,38,ゴルフダイジェスト・オンライン（GDO）,ツアー最長のブランクVへ木戸愛が首位浮上　永峰咲希も並走,https://news.yahoo.co.jp/articles/3e11e07aba94b9a69e48843bdf736b3bb9f9acfb,7/5(土) 14:48
2025-07-05,15:09,sports,スポーツ,39,中日スポーツ,大谷翔平、試合後わずか3分で帰宅　大量ビハインドで9回の打席には立たず交代、翌5日は31歳の”バースデー登板”,https://news.yahoo.co.jp/articles/5215526949d34010b563500853716989600b3fa5,7/5(土) 13:09
2025-07-05,15:09,sports,スポーツ,40,ゲキサカ,異例の試み…東京Vが発表した3rdユニフォームに反響「ビックリ」「まさかの」「一石二鳥」,https://news.yahoo.co.jp/articles/2b6362101107603ecf430d21b562653642fdc993,7/5(土) 14:10
