scrp_date,scrp_time,genre_en,genre_jp,rank,media_jp,title,link,date_original
2024-11-21,18:06,life,ライフ,1,まいどなニュース,アニサキスに復讐を果たした男性が話題　どうやって？「内部から焼かれろ下等生物めが」,https://news.yahoo.co.jp/articles/3d7b02eb583aedbfdc58bef7d6c4a58f688b83bf,11/21(木) 16:40
2024-11-21,18:06,life,ライフ,2,ファイナンシャルフィールド,うちの市は給食費がまだ自己負担です。シンママで月4500円×2人分を払うのは正直キツいです…。これって平均的な金額でしょうか？,https://news.yahoo.co.jp/articles/6cf686d35bfb565d6d5247084e3fbe6227027697,11/21(木) 13:10
2024-11-21,18:06,life,ライフ,3,ほ・とせなNEWS,じいじの帰りを待つ4歳孫。じいじが来た瞬間…！？「サイコーのじーじ」「笑っちゃうんだけど」,https://news.yahoo.co.jp/articles/13c14ea01d9b23e89dd2d56049725ac7d30691f5,11/21(木) 11:30
2024-11-21,18:06,life,ライフ,4,BuzzFeed Japan,「前に座る男性は気づかないの？」飛行機で撮影された光景が物議。投稿者はCAを呼ぶも（海外）,https://news.yahoo.co.jp/articles/4ba744f4ef2d80b97928ca91e75d49f90ffb88a1,11/19(火) 21:10
2024-11-21,18:06,life,ライフ,5,ファイナンシャルフィールド,家にいらなくなった「ハガキ」や「切手」が大量にあるのですが、郵便局で「現金化」できるのでしょうか？,https://news.yahoo.co.jp/articles/b15ec0b35a287aae495e8cc90f81de28c3c975fa,11/21(木) 13:20
2024-11-21,18:06,life,ライフ,6,まいどなニュース,「なんで頭だけ出すねんw」まるでろくろ首！水槽からひょっこり、目が合ったのは？,https://news.yahoo.co.jp/articles/aa3903b755a84c08afdacc1b27b38a13af0d35bf,11/21(木) 16:30
2024-11-21,18:06,life,ライフ,7,ほ・とせなNEWS,産後70kgに。ダイエットを決意した2年後の姿に…「別人」「お見事です」「ビックリしました」の声,https://news.yahoo.co.jp/articles/fd34674c784626e82ef73fe059258c39803c79df,11/20(水) 11:30
2024-11-21,18:06,life,ライフ,8,ねとらぼ,ディズニーシーのお菓子が「異様に美味しい」→実は……“驚愕の事実”に9.6万いいね　「納得した」「これはガチ」,https://news.yahoo.co.jp/articles/56621507bcb7c12d7a535bad82a3fa3dedb0bc96,11/21(木) 12:20
2024-11-21,18:06,life,ライフ,9,ファイナンシャルフィールド,車をコインパーキングに3時間駐めたら「5400円」も請求されました！最大料金の「2000円」だと思っていたのですがなぜでしょうか…？,https://news.yahoo.co.jp/articles/fcce5478dd000c1267a1a963657481846beb887a,11/21(木) 11:10
2024-11-21,18:06,life,ライフ,10,Hint-Pot,「日本好きね～」　親日家の世界的歌姫がお忍びで東京の街を満喫　コンビニで買った日本ならではのアイスとは,https://news.yahoo.co.jp/articles/7c6a0ee059140b40bd7e0c83bca8bec86ee4a9aa,11/21(木) 11:05
2024-11-21,18:06,life,ライフ,11,BuzzFeed Japan,【ワークマン】羽毛布団みたいな「2900円アウター」がオシャレなうえに暖かい！通勤にもお出かけにも使える名品です！《着用レビュー》,https://news.yahoo.co.jp/articles/c64ea8912bc5dc9764eb138fc3e043717ae15cd4,11/19(火) 13:00
2024-11-21,18:06,life,ライフ,12,BuzzFeed Japan,【ユニクロ】軽いのにとっても暖かい！3990円→2990円の「楽ちんアウター」今から冬まで手放せない！《着用レビュー》,https://news.yahoo.co.jp/articles/f44382cbfe1ef55d5436c07aa3431431a6604672,11/21(木) 17:05
2024-11-21,18:06,life,ライフ,13,ねとらぼ,「え、ネタバレ……？」　“timeleszオーディション”候補者がテレビ局を退社　ディズニーキャストの過去も話題,https://news.yahoo.co.jp/articles/f8da6271c1df1ed1b8a0b63aa8327406e5c5cdf5,11/21(木) 11:27
2024-11-21,18:06,life,ライフ,14,ねとらぼ,大きくなったらかっこいいシェパードになると思っていたら……　予想を上回るビフォーアフターに大反響！→さらに1年半後の今は？　飼い主に聞いた,https://news.yahoo.co.jp/articles/41085457fc556642e39320851ea67ebc78e15b00,11/21(木) 10:30
2024-11-21,18:06,life,ライフ,15,ファイナンシャルフィールド,友人宅は「月2回」家族で外食するようですが、わが家は「年3～4回」。家族4人で1回1万円近くかかるのは痛いのですが、そんなに行くものなのでしょうか？,https://news.yahoo.co.jp/articles/be6bf3195f0558b07602ca9c9731b754229c1a4c,11/21(木) 12:30
2024-11-21,18:06,life,ライフ,16,ほ・とせなNEWS,生後3ヶ月のワンコをお迎えしたら…半年後の姿に驚き！？→その姿に「凄い」「中身はまだまだ赤ちゃん」「成長が早い」,https://news.yahoo.co.jp/articles/f19ffd3ccc358dd965875a893b33642e199236b5,11/21(木) 16:00
2024-11-21,18:06,life,ライフ,17,BuzzFeed Japan,カインズの『家中で使える物干しラック』が想像以上に便利！洗濯物をたくさんかけられるから、部屋干しでも大活躍です！《購入レビュー》,https://news.yahoo.co.jp/articles/586a635ee6326a8198cf78c3b4ec7389e838ff6c,11/21(木) 13:35
2024-11-21,18:06,life,ライフ,18,ほ・とせなNEWS,アメリカ人のパパに似ていないと思ったら…3ヶ月後の変化に「可愛さの更新」「うちも」の声,https://news.yahoo.co.jp/articles/1f5f69a3ae48bc9feedc3b5eb5155ec8e29aad51,11/21(木) 6:30
2024-11-21,18:06,life,ライフ,19,美術手帖,カテランの“バナナ”が約9.6億円で落札。中国コレクターの手に,https://news.yahoo.co.jp/articles/1ed899bf2736c978f7d27c7d0eb1ade866af19b6,11/21(木) 11:32
2024-11-21,18:06,life,ライフ,20,Hint-Pot,「オーストラリアと全然違います」　初訪日のオーストラリア人が驚いた日本のマナー　感激した理由とは,https://news.yahoo.co.jp/articles/fce7bf5b61c1987614f60b3062a7127635ce66b2,11/21(木) 14:10
2024-11-21,18:06,life,ライフ,21,リセマム,早慶上理の合格実績ランキング、3位は渋幕…TOP10に公立4校,https://news.yahoo.co.jp/articles/c8868ae554a3e3c87a263fc81fc996be47cfc6f6,11/21(木) 13:15
2024-11-21,18:06,life,ライフ,22,LIMO,有名漫画家の父を持つ高校生が話題　Xで明かした驚きの事実に「さらっとすごいこと言っている」,https://news.yahoo.co.jp/articles/1b244decbacc5d5c959e694c4f321725408de382,11/21(木) 11:41
2024-11-21,18:06,life,ライフ,23,Reライフ.net,たんぱく質の多い食品一覧 朝・昼・晩の献立例と効率よく摂取するコツ たんぱく質の多い食品一覧,https://news.yahoo.co.jp/articles/56c358c1af266ad7f9ea34c59943d66de2ad7755,11/21(木) 11:36
2024-11-21,18:06,life,ライフ,24,Fav-Log by ITmedia,【付録】宝島チャンネルで「ブラックフライデーセール」開催中　最大90％オフ！　紀ノ国屋のコラボバッグもセール価格に,https://news.yahoo.co.jp/articles/3ef6317d33764f61836601e95cd2d885451ff2ed,11/21(木) 14:50
2024-11-21,18:06,life,ライフ,25,まいどなニュース,「何百匹もの野良猫を捕獲、大量殺処分」動物愛護団体が沖縄の村と獣医らを刑事告発　村「住民らの苦情や希少なコウモリ捕食被害で野良猫を適正管理」,https://news.yahoo.co.jp/articles/be6737fa7d69d692b7a23e688d1d13a394e3ef2b,11/21(木) 15:00
2024-11-21,18:06,life,ライフ,26,ファイナンシャルフィールド,12月以降も「マイナ保険証」を作らず「資格確認書」を利用する予定です。友人から「マイナ保険証で医療費が安くなる」と聞いたのですが、作ったほうがお得なのでしょうか？,https://news.yahoo.co.jp/articles/7bd2fd8ace7f930e3b31d9b791e15596147895e5,11/20(水) 11:51
2024-11-21,18:06,life,ライフ,27,ファイナンシャルフィールド,消防士の友人が「出動したら700円支給される」と言っていました。兄が勤めている消防署では「1回300円」だそうですが、地域によって異なるのでしょうか？,https://news.yahoo.co.jp/articles/0f5c54c99f0e9f0c5c6c1e3d69366ba1526dd334,11/21(木) 13:40
2024-11-21,18:06,life,ライフ,28,リセマム,私立高生徒、経済的理由の中退が増加…全国私教連,https://news.yahoo.co.jp/articles/46c40b5d289cdfb22ff6bc4bcfddecddba6a5f17,11/21(木) 16:45
2024-11-21,18:06,life,ライフ,29,ファイナンシャルフィールド,ふるさと納税を年間上限額ぎりぎりの「8万円」で行いました。控除されるのはすべて「所得税」からですか？,https://news.yahoo.co.jp/articles/b8066a3aacaa15fe40f61f5ca96dbc9a14dd890c,11/21(木) 13:50
2024-11-21,18:06,life,ライフ,30,Hint-Pot,「これが犬のおやつなのかどうかわからないんだけど」　日本大好きなアメリカ人記者が困惑　コンビニで驚いたものとは,https://news.yahoo.co.jp/articles/38188a14c48647ec5568487540ebf1dd81fcc819,11/21(木) 16:06
2024-11-21,18:06,life,ライフ,31,まいどなニュース,「3日で捨てられた大型犬の子犬」に大型犬の飼い主たちが激怒！「ヤンチャで手に負えない」は当たり前、「すぐ思い通りになると？」,https://news.yahoo.co.jp/articles/7193dc3f534d57edc3172e6f9f6db48ec30f672f,11/21(木) 7:01
2024-11-21,18:06,life,ライフ,32,トラベル Watch,JR東日本、新型気動車「HB-E220系」導入へ。高崎・盛岡エリア向けのロングシート車,https://news.yahoo.co.jp/articles/e0d178f24500cc81e40a22926d7d80aac97cf93d,11/21(木) 16:41
2024-11-21,18:06,life,ライフ,33,ねとらぼ,楽譜に書かれていた“重すぎる指示”が200万表示　ツッコまずにはいられない光景に「スゥ……」「怖い怖い怖い怖い」,https://news.yahoo.co.jp/articles/4072df5d91cb5b8c5d35ca0f5be81ce30ed15e93,11/21(木) 7:30
2024-11-21,18:06,life,ライフ,34,トラベル Watch,「ブラックフライデー」セールまとめ35選。旅行/家電/商業施設/アパレル/アウトレットなど【2024】,https://news.yahoo.co.jp/articles/fbfc8266ba8e1ca0e7e97a389e12440c832de43c,11/21(木) 13:00
2024-11-21,18:06,life,ライフ,35,ねとらぼ,高校生の時に出会った2人→つらい闘病生活を経て、10年後……　山あり谷ありを乗り越えた“現在の姿”が話題,https://news.yahoo.co.jp/articles/fd333a3d6e91a5c304065c285563a1f81e8cd00d,11/20(水) 21:00
2024-11-21,18:06,life,ライフ,36,magacol,白髪が気になる40代＆50代が知っておきたい「隠しやすい髪型」って？｜美ST,https://news.yahoo.co.jp/articles/7f24c660ad0225059c25aa58c5d016a9e889eeef,11/20(水) 7:15
2024-11-21,18:06,life,ライフ,37,婦人公論.jp,小学1年生の息子を事故で亡くし、七回忌を迎えても納骨できない家族。和尚は何を語ったのか,https://news.yahoo.co.jp/articles/cd4f8bea701bfe8e5c162eca5ad016221d95e6de,11/21(木) 12:32
2024-11-21,18:06,life,ライフ,38,ねとらぼ,「静岡県で人気のイオン」ランキング！　2位は県内最大級のショッピングモール「イオンモール浜松志都呂」、1位は？【2024年11月版】,https://news.yahoo.co.jp/articles/5f96267c91c97d9a5bac0d25e3a5557a3ab79ee4,11/21(木) 17:05
2024-11-21,18:06,life,ライフ,39,LIMO,野良猫を保護した4年後　驚きのビフォーアフターが「まるで別の猫みたい！」と話題に,https://news.yahoo.co.jp/articles/27d54f8668cb53b4192360563963d7fbc5bdf0e8,11/20(水) 14:41
2024-11-21,18:06,life,ライフ,40,ファイナンシャルフィールド,【要注意】バイト先で「通帳」の提出を求められた！ 「給与振り込みに必要」とのことだけど、これって“闇バイト”の可能性もあるの？ 注意すべきポイントを解説,https://news.yahoo.co.jp/articles/923b4bcc078d55c72b702bbb8e7abf4e0757e968,11/19(火) 14:10
