scrp_date,scrp_time,genre_en,genre_jp,rank,media_jp,title,link,date_original
2024-11-21,20:06,life,ライフ,1,まいどなニュース,アニサキスに復讐を果たした男性が話題　どうやって？「内部から焼かれろ下等生物めが」,https://news.yahoo.co.jp/articles/3d7b02eb583aedbfdc58bef7d6c4a58f688b83bf,11/21(木) 16:40
2024-11-21,20:06,life,ライフ,2,ほ・とせなNEWS,産後70kgに。ダイエットを決意した2年後の姿に…「別人」「お見事です」「ビックリしました」の声,https://news.yahoo.co.jp/articles/fd34674c784626e82ef73fe059258c39803c79df,11/20(水) 11:30
2024-11-21,20:06,life,ライフ,3,ほ・とせなNEWS,じいじの帰りを待つ4歳孫。じいじが来た瞬間…！？「サイコーのじーじ」「笑っちゃうんだけど」,https://news.yahoo.co.jp/articles/13c14ea01d9b23e89dd2d56049725ac7d30691f5,11/21(木) 11:30
2024-11-21,20:06,life,ライフ,4,BuzzFeed Japan,「前に座る男性は気づかないの？」飛行機で撮影された光景が物議。投稿者はCAを呼ぶも（海外）,https://news.yahoo.co.jp/articles/4ba744f4ef2d80b97928ca91e75d49f90ffb88a1,11/19(火) 21:10
2024-11-21,20:06,life,ライフ,5,まいどなニュース,「なんで頭だけ出すねんw」まるでろくろ首！水槽からひょっこり、目が合ったのは？,https://news.yahoo.co.jp/articles/aa3903b755a84c08afdacc1b27b38a13af0d35bf,11/21(木) 16:30
2024-11-21,20:06,life,ライフ,6,BuzzFeed Japan,【ワークマン】羽毛布団みたいな「2900円アウター」がオシャレなうえに暖かい！通勤にもお出かけにも使える名品です！《着用レビュー》,https://news.yahoo.co.jp/articles/c64ea8912bc5dc9764eb138fc3e043717ae15cd4,11/19(火) 13:00
2024-11-21,20:06,life,ライフ,7,BuzzFeed Japan,【ユニクロ】軽いのにとっても暖かい！3990円→2990円の「楽ちんアウター」今から冬まで手放せない！《着用レビュー》,https://news.yahoo.co.jp/articles/f44382cbfe1ef55d5436c07aa3431431a6604672,11/21(木) 17:05
2024-11-21,20:06,life,ライフ,8,ねとらぼ,「スンスンが餌食に」 販売から“全店舗3分で完売”→高額転売で「怒りが込み上げる」　スシロー×人気キャラコラボが物議,https://news.yahoo.co.jp/articles/12038b488f44e600eb9168d33f3bda52ff3b3b48,11/21(木) 19:02
2024-11-21,20:06,life,ライフ,9,ほ・とせなNEWS,生後3ヶ月のワンコをお迎えしたら…半年後の姿に驚き！？→その姿に「凄い」「中身はまだまだ赤ちゃん」「成長が早い」,https://news.yahoo.co.jp/articles/f19ffd3ccc358dd965875a893b33642e199236b5,11/21(木) 16:00
2024-11-21,20:06,life,ライフ,10,ファイナンシャルフィールド,家にいらなくなった「ハガキ」や「切手」が大量にあるのですが、郵便局で「現金化」できるのでしょうか？,https://news.yahoo.co.jp/articles/b15ec0b35a287aae495e8cc90f81de28c3c975fa,11/21(木) 13:20
2024-11-21,20:06,life,ライフ,11,ねとらぼ,「え、ネタバレ……？」　“timeleszオーディション”候補者がテレビ局を退社　ディズニーキャストの過去も話題,https://news.yahoo.co.jp/articles/f8da6271c1df1ed1b8a0b63aa8327406e5c5cdf5,11/21(木) 11:27
2024-11-21,20:06,life,ライフ,12,ファイナンシャルフィールド,うちの市は給食費がまだ自己負担です。シンママで月4500円×2人分を払うのは正直キツいです…。これって平均的な金額でしょうか？,https://news.yahoo.co.jp/articles/6cf686d35bfb565d6d5247084e3fbe6227027697,11/21(木) 13:10
2024-11-21,20:06,life,ライフ,13,ねとらぼ,ディズニーシーのお菓子が「異様に美味しい」→実は……“驚愕の事実”に9.6万いいね　「納得した」「これはガチ」,https://news.yahoo.co.jp/articles/56621507bcb7c12d7a535bad82a3fa3dedb0bc96,11/21(木) 12:20
2024-11-21,20:06,life,ライフ,14,Reライフ.net,たんぱく質の多い食品一覧 朝・昼・晩の献立例と効率よく摂取するコツ たんぱく質の多い食品一覧,https://news.yahoo.co.jp/articles/56c358c1af266ad7f9ea34c59943d66de2ad7755,11/21(木) 11:36
2024-11-21,20:06,life,ライフ,15,ファイナンシャルフィールド,車をコインパーキングに3時間駐めたら「5400円」も請求されました！最大料金の「2000円」だと思っていたのですがなぜでしょうか…？,https://news.yahoo.co.jp/articles/fcce5478dd000c1267a1a963657481846beb887a,11/21(木) 11:10
2024-11-21,20:06,life,ライフ,16,Hint-Pot,「日本好きね～」　親日家の世界的歌姫がお忍びで東京の街を満喫　コンビニで買った日本ならではのアイスとは,https://news.yahoo.co.jp/articles/7c6a0ee059140b40bd7e0c83bca8bec86ee4a9aa,11/21(木) 11:05
2024-11-21,20:06,life,ライフ,17,BuzzFeed Japan,結婚式で“前代未聞”の事態。100人を招待も出席したのはなぜか5人だけ。ネットでは「心が痛い」「準備は簡単じゃない」（海外）,https://news.yahoo.co.jp/articles/b71b731a0f784c69999109e621ca7f98e19804df,11/21(木) 19:15
2024-11-21,20:06,life,ライフ,18,ほ・とせなNEWS,アメリカ人のパパに似ていないと思ったら…3ヶ月後の変化に「可愛さの更新」「うちも」の声,https://news.yahoo.co.jp/articles/1f5f69a3ae48bc9feedc3b5eb5155ec8e29aad51,11/21(木) 6:30
2024-11-21,20:06,life,ライフ,19,BuzzFeed Japan,カインズの『家中で使える物干しラック』が想像以上に便利！洗濯物をたくさんかけられるから、部屋干しでも大活躍です！《購入レビュー》,https://news.yahoo.co.jp/articles/586a635ee6326a8198cf78c3b4ec7389e838ff6c,11/21(木) 13:35
2024-11-21,20:06,life,ライフ,20,まいどなニュース,「何百匹もの野良猫を捕獲、大量殺処分」動物愛護団体が沖縄の村と獣医らを刑事告発　村「住民らの苦情や希少なコウモリ捕食被害で野良猫を適正管理」,https://news.yahoo.co.jp/articles/be6737fa7d69d692b7a23e688d1d13a394e3ef2b,11/21(木) 15:00
2024-11-21,20:06,life,ライフ,21,ファイナンシャルフィールド,友人宅は「月2回」家族で外食するようですが、わが家は「年3～4回」。家族4人で1回1万円近くかかるのは痛いのですが、そんなに行くものなのでしょうか？,https://news.yahoo.co.jp/articles/be6bf3195f0558b07602ca9c9731b754229c1a4c,11/21(木) 12:30
2024-11-21,20:06,life,ライフ,22,ねとらぼ,【50代の男性が選ぶ】「マジでうまい」と思うカップ焼きそばランキング！　第2位は「日清焼そばU.F.O.」、1位は？,https://news.yahoo.co.jp/articles/5b3b1a787294466533f88575f2b22c5d923a4847,11/21(木) 19:15
2024-11-21,20:06,life,ライフ,23,Fav-Log by ITmedia,【付録】宝島チャンネルで「ブラックフライデーセール」開催中　最大90％オフ！　紀ノ国屋のコラボバッグもセール価格に,https://news.yahoo.co.jp/articles/3ef6317d33764f61836601e95cd2d885451ff2ed,11/21(木) 14:50
2024-11-21,20:06,life,ライフ,24,まいどなニュース,「3日で捨てられた大型犬の子犬」に大型犬の飼い主たちが激怒！「ヤンチャで手に負えない」は当たり前、「すぐ思い通りになると？」,https://news.yahoo.co.jp/articles/7193dc3f534d57edc3172e6f9f6db48ec30f672f,11/21(木) 7:01
2024-11-21,20:06,life,ライフ,25,リセマム,私立高生徒、経済的理由の中退が増加…全国私教連,https://news.yahoo.co.jp/articles/46c40b5d289cdfb22ff6bc4bcfddecddba6a5f17,11/21(木) 16:45
2024-11-21,20:06,life,ライフ,26,ねとらぼ,ダンプ松本と対戦後の女子プロレスラー、結婚記念日にファミレスで豪遊　合計金額は……「しっかりアプリのクーポン使って」,https://news.yahoo.co.jp/articles/daa6c8c3230d8adbee7211630071e3ccba324b43,11/21(木) 18:36
2024-11-21,20:06,life,ライフ,27,トラベル Watch,「ブラックフライデー」セールまとめ35選。旅行/家電/商業施設/アパレル/アウトレットなど【2024】,https://news.yahoo.co.jp/articles/fbfc8266ba8e1ca0e7e97a389e12440c832de43c,11/21(木) 13:00
2024-11-21,20:06,life,ライフ,28,ねとらぼ,大きくなったらかっこいいシェパードになると思っていたら……　予想を上回るビフォーアフターに大反響！→さらに1年半後の今は？　飼い主に聞いた,https://news.yahoo.co.jp/articles/41085457fc556642e39320851ea67ebc78e15b00,11/21(木) 10:30
2024-11-21,20:06,life,ライフ,29,毎日新聞,元十両、高校教師に　土俵人生生かし授業「『番付』上げていきたい」,https://news.yahoo.co.jp/articles/655729f713d9e7fb634049323a6754580fdc988a,11/21(木) 18:21
2024-11-21,20:06,life,ライフ,30,ねとらぼ,楽譜に書かれていた“重すぎる指示”が200万表示　ツッコまずにはいられない光景に「スゥ……」「怖い怖い怖い怖い」,https://news.yahoo.co.jp/articles/4072df5d91cb5b8c5d35ca0f5be81ce30ed15e93,11/21(木) 7:30
2024-11-21,20:06,life,ライフ,31,ねとらぼ,「最後www」　高校生が単語帳で“20秒CM”を作ったら……　“Apple感がハンパない作品”に「吹いた！」「才能の塊かよ」,https://news.yahoo.co.jp/articles/4d1d66cabf6da156ee7840cf6cc1a222798b813d,11/21(木) 19:00
2024-11-21,20:06,life,ライフ,32,Hint-Pot,「オーストラリアと全然違います」　初訪日のオーストラリア人が驚いた日本のマナー　感激した理由とは,https://news.yahoo.co.jp/articles/fce7bf5b61c1987614f60b3062a7127635ce66b2,11/21(木) 14:10
2024-11-21,20:06,life,ライフ,33,感染症・予防接種ナビ,【感染症ニュース】首都圏で広がりをみせる伝染性紅斑（＝リンゴ病）　原因のヒトパルボウイルスB19はさまざまな症状を引き起こす！　医師「大人の女性、痛み出る場合も」,https://news.yahoo.co.jp/articles/eb3eaa35369663a851f4226352bd53787c0cf1f0,11/16(土) 7:00
2024-11-21,20:06,life,ライフ,34,グルメ Watch,ケンタッキー「トクトク2ピースパック」「ウィンターパック」発売,https://news.yahoo.co.jp/articles/d8a7997e8e4a9cd4c8c92bb1acea8033b9bcc7fd,11/21(木) 11:41
2024-11-21,20:06,life,ライフ,35,ファイナンシャルフィールド,12月以降も「マイナ保険証」を作らず「資格確認書」を利用する予定です。友人から「マイナ保険証で医療費が安くなる」と聞いたのですが、作ったほうがお得なのでしょうか？,https://news.yahoo.co.jp/articles/7bd2fd8ace7f930e3b31d9b791e15596147895e5,11/20(水) 11:51
2024-11-21,20:06,life,ライフ,36,ファイナンシャルフィールド,【要注意】バイト先で「通帳」の提出を求められた！ 「給与振り込みに必要」とのことだけど、これって“闇バイト”の可能性もあるの？ 注意すべきポイントを解説,https://news.yahoo.co.jp/articles/923b4bcc078d55c72b702bbb8e7abf4e0757e968,11/19(火) 14:10
2024-11-21,20:06,life,ライフ,37,BuzzFeed Japan,外国人観光客が「めっちゃ礼儀正しい…」と感動。日本で目撃したある光景をSNSに投稿すると、170万いいねが集まる,https://news.yahoo.co.jp/articles/9bf8b3c08487683cc6dbbb6dcb129527abaf065b,11/20(水) 21:05
2024-11-21,20:06,life,ライフ,38,リセマム,早慶上理の合格実績ランキング、3位は渋幕…TOP10に公立4校,https://news.yahoo.co.jp/articles/c8868ae554a3e3c87a263fc81fc996be47cfc6f6,11/21(木) 13:15
2024-11-21,20:06,life,ライフ,39,ねとらぼ,高校生の時に出会った2人→つらい闘病生活を経て、10年後……　山あり谷ありを乗り越えた“現在の姿”が話題,https://news.yahoo.co.jp/articles/fd333a3d6e91a5c304065c285563a1f81e8cd00d,11/20(水) 21:00
2024-11-21,20:06,life,ライフ,40,ファイナンシャルフィールド,コンビニで「トイレ」を借りようとしたら断られた！ その前に「150円」の飲み物を買いましたが、購入金額が少なかったのでしょうか…？,https://news.yahoo.co.jp/articles/375724398600e1952cccf351836724c4ee873ab1,11/20(水) 13:50
