scrp_date,scrp_time,genre_en,genre_jp,rank,media_jp,title,link,date_original
2025-10-30,16:07,local,地域,1,NBC長崎放送,"中咽頭がん闘病ワッキー（53）　家族にも言えず…笑顔の裏の""葛藤""　「先日亡くなりました」亡き大学生に誓った決意",https://news.yahoo.co.jp/articles/593691a44b9b1de8a013ba6325d168a63c3c950c,10/29(水) 17:20
2025-10-30,16:07,local,地域,2,読売新聞オンライン,阪南・門真など府内12市町村「消滅可能性」、大阪市は出生率低く「ブラックホール型」…「何もしなければ衰退」,https://news.yahoo.co.jp/articles/5f647a58b7f2619dd36d3d6bda7f9afa4da5002a,10/30(木) 13:35
2025-10-30,16:07,local,地域,3,千葉日報オンライン,幻のヘビ、小学生が散歩中に見つけた！　「最初はひもかと」山武の江口さん一家,https://news.yahoo.co.jp/articles/7f74c393b1392beca22b3df2209c6b5f8603c302,10/29(水) 20:02
2025-10-30,16:07,local,地域,4,ＡＴＶ青森テレビ,【大雨情報】ハロウィンに“爆弾低気圧”が北上か　31日夜〜11月1日にかけて急速に発達する低気圧が本州付近を通過か　活発な“雨の影”西日本・東日本・北日本に…　今後の天気は?【雨風シミュレーション】,https://news.yahoo.co.jp/articles/71c1f51b3f5766f0b397da7c4f7a0fa520b8b5e3,10/30(木) 15:15
2025-10-30,16:07,local,地域,5,読売新聞オンライン,1歳里子を夫婦で虐待…5月から母となった女は男児の下半身を踏みつけ、父である男は翌日に床にたたきつけた疑い,https://news.yahoo.co.jp/articles/8fa79b224ebc7da114795e5066cc12ac83912874,10/30(木) 11:48
2025-10-30,16:07,local,地域,6,MBSニュース,"京都の観光地に異変「客の8割が外国人」「日本語聞こえへん」日本人はどこへ？　市民の不満トップは""市バスの混雑""か　観光客・市民・事業者の「三方よし」実現するには...",https://news.yahoo.co.jp/articles/42a1936e00d7630e25596e37b847ce3fefc723d6,10/30(木) 13:00
2025-10-30,16:07,local,地域,7,カナロコ by 神奈川新聞,横浜中華街の店舗から「黒煙が出ている」　ビルで火事,https://news.yahoo.co.jp/articles/6bffd3387e33f6adacf04555de6409f86c5027ac,10/30(木) 14:51
2025-10-30,16:07,local,地域,8,OHK岡山放送,約１６．６万人調査　赤ちゃんの名前ランキング発表　男の子「碧」女の子「翠」がトップ　ベネッセ調べ,https://news.yahoo.co.jp/articles/f5b4b291f27be6ad5757025fad90caf1758eb66d,10/30(木) 13:28
2025-10-30,16:07,local,地域,9,HOME広島ホームテレビ,県内で重体事故相次ぐ…大学生が車の下敷きに　広島,https://news.yahoo.co.jp/articles/263c4402f0b4a588e92f6e2ca84b7f465c0abf1a,10/30(木) 12:49
2025-10-30,16:07,local,地域,10,TSKさんいん中央テレビ,エサ求めて人里に…浜田市でクマの親子3頭目撃　市営団地近くの道路に出没　警察などパトロール（島根）,https://news.yahoo.co.jp/articles/a093383a04bb9043b712ed12f75c07f57570f1d4,10/30(木) 14:34
2025-10-30,16:07,local,地域,11,京都新聞,【速報】北陸自動車道で陥没が見つかる　緊急工事、福井－滋賀県境が30日夜から通行止め,https://news.yahoo.co.jp/articles/5af419245818f101eeff3ebd40352469d52fd64f,10/30(木) 13:54
2025-10-30,16:07,local,地域,12,長崎文化放送,【長崎】病院敷地内で下半身を露出　公然わいせつ容疑で７４歳男を逮捕,https://news.yahoo.co.jp/articles/add3555d3224575f76fc348eacec1dac799d97bb,10/30(木) 13:52
2025-10-30,16:07,local,地域,13,MBSニュース,斎藤知事の定例会見　異例の申し入れで中止「小学校の音楽会」県議や市教委から『抗議の音懸念する意見』,https://news.yahoo.co.jp/articles/95389dc0b27b8b0c8d453a1b8ba2c3ee0f845c31,10/29(水) 13:30
2025-10-30,16:07,local,地域,14,神戸新聞NEXT,神戸で相次ぐ地域の空洞化　市のニュータウン整備から半世紀、高まる住民不安,https://news.yahoo.co.jp/articles/2ca3bec10ca7ec4cb32f37e35f32a7378d80fdf3,10/30(木) 11:49
2025-10-30,16:07,local,地域,15,北海道ニュースUHB,"【ヒグマ速報】札幌の街中にクマ出没か？札幌市電が走る通りを歩いていた人が車道にたたずむ体長約1メートルの""熊っぽい動物""を目撃＿住宅街で近くには高校も〈北海道札幌市中央区南17条西6丁目〉",https://news.yahoo.co.jp/articles/dfa99c564df813cf75e6903a34b388686159fa5a,10/30(木) 5:10
2025-10-30,16:07,local,地域,16,RBC琉球放送,黒島沖でダイビング中に息苦しさを訴え　東京の女性が死亡,https://news.yahoo.co.jp/articles/2bc534f234084bd3beeffbdfac4432a06fbc307a,10/30(木) 15:15
2025-10-30,16:07,local,地域,17,ＢＳＮ新潟放送,【大雨・暴風警戒】あす31日〜1日にかけて非常に激しい雨や暴風の恐れ　2日〜3日は北日本や北陸などを中心に荒れた天気か【3時間ごとの雨風シミュレーション・30日正午更新】,https://news.yahoo.co.jp/articles/d3691ccaaca4a0fe409f833c33ca5e15835af5aa,10/30(木) 12:00
2025-10-30,16:07,local,地域,18,埼玉新聞,あきれた事務長、病院で20万円を横領か　経理を一任され、知らぬ間に改ざん…別の担当者が気付く「売上金を抜いている」　内部調査で発覚、容疑で逮捕　今は運送業の43歳「身に覚えがない」,https://news.yahoo.co.jp/articles/010105cd8dc4278cb3a7ab6f513432327e46b184,10/30(木) 13:47
2025-10-30,16:07,local,地域,19,埼玉新聞,ヤオコーで行列、埼玉106店目がオープン　ベーカリーなど拡充、初展開“全国”冷凍駅弁コーナーも　全28席のカフェも誕生　敷地広大、店舗は地上2階建て　百均、薬局、歯科医院など入って充実,https://news.yahoo.co.jp/articles/3e59c2e92ab1b25287fcced5b44a5b1c35d598eb,10/30(木) 9:35
2025-10-30,16:07,local,地域,20,あいテレビ,先輩からの緊迫した電話で「出港」 愛媛・大洲市の強盗傷害事件　海を泳いで逃げた容疑者を漁船で追跡し確保に協力 宇和島の養殖業男性へ感謝状,https://news.yahoo.co.jp/articles/6b08808c8d6fa887726c7cdde8c01a8238ceacb6,10/30(木) 14:21
2025-10-30,16:07,local,地域,21,読売新聞オンライン,雄のツキノワグマ1頭、広島で箱わなにかかり殺処分…体長約1・5メートル、体重64キロ,https://news.yahoo.co.jp/articles/7ce206fd618a8885b8655e2b617e21650dbb3501,10/30(木) 12:07
2025-10-30,16:07,local,地域,22,埼玉新聞,さいたま市新庁舎　総事業費は700億円に増　3棟で構成、地下1階、地上18階　さいたま新都心駅からデッキ延伸整備,https://news.yahoo.co.jp/articles/115030f713abc00a1ae68cb434cbbf7362d2e379,10/30(木) 12:49
2025-10-30,16:07,local,地域,23,新潟ニュースNST,「クマを殺すな」「麻酔銃で眠らせて山に帰せたのでは」目撃情報だけではない…自治体に届く苦情や批判の声　新潟,https://news.yahoo.co.jp/articles/906bed09c3a1f6d5eeab3e62545570885d243542,10/28(火) 18:44
2025-10-30,16:07,local,地域,24,IAT岩手朝日テレビ,防犯カメラが捉える　公民館の自動ドアにクマ突撃【岩手・雫石町】,https://news.yahoo.co.jp/articles/fe0ee609dc100a2abe5e22890477ad98024f213d,10/30(木) 15:27
2025-10-30,16:07,local,地域,25,中国新聞デジタル,【続報】重体の大学生女性は横断歩道を歩行　車は青信号を右折中に衝突か　広島,https://news.yahoo.co.jp/articles/ca6838baa9b151d4aebab000e371a5b5d3f62254,10/30(木) 15:22
2025-10-30,16:07,local,地域,26,沖縄テレビOTV,竹富町黒島沖でダイビング中の観光客の女性が死亡　体調不良を訴え浮上したあと意識失う,https://news.yahoo.co.jp/articles/abfc82cd343f6fe22d67109653a7c1ed8e168c12,10/30(木) 12:52
2025-10-30,16:07,local,地域,27,サンテレビ,競輪性被害訴え　男性選手を不起訴に／兵庫県,https://news.yahoo.co.jp/articles/c4eeb289e709c65b2db4ac6acfb546bbb9d464ef,10/30(木) 15:09
2025-10-30,16:07,local,地域,28,日本海テレビ,松江市東出雲町の住宅街　普通乗用車とトラックの衝突事故　1人が病院に搬送　島根県,https://news.yahoo.co.jp/articles/e972e3a823cf1261730294b94f0c837d44290d59,10/30(木) 14:51
2025-10-30,16:07,local,地域,29,中京テレビＮＥＷＳ,【岐阜県】クマ対策にドローン活用を検討　動物が嫌がる音を出して山に戻す“攻めの対策”を　江崎知事は早期実施に意欲「冬眠の時期で対応はまったなし」,https://news.yahoo.co.jp/articles/0176f25ff469b35c1343493d64c368fef36e5db0,10/30(木) 15:07
2025-10-30,16:07,local,地域,30,ABCニュース,【速報】大阪市中央区東心斎橋堺筋で自転車に乗った15歳の男子中学生と観光バスが接触　男子中学生が頭を強く打ち搬送先の病院で死亡　警察は観光バスの運転手を過失運転致傷の疑いで現行犯逮捕　大阪府警,https://news.yahoo.co.jp/articles/86836995fefdb37c0187bbfc59381ca64bddf52b,10/29(水) 21:25
2025-10-30,16:07,local,地域,31,tbc東北放送,SNSで客集め覚醒剤密売 暴力団組員の男逮捕 客12人も摘発 宮城,https://news.yahoo.co.jp/articles/89a2c0549e9be553e7593b2d30650f844d51519d,10/30(木) 15:22
2025-10-30,16:07,local,地域,32,NBS長野放送,150個完売！中学生が開発した「クッキー」　生徒と洋菓子店がコラボ　学校のバザーで販売,https://news.yahoo.co.jp/articles/c5157f6a7aff0d4b16d7f765114438149523ba62,10/30(木) 14:29
2025-10-30,16:07,local,地域,33,RSK山陽放送,路上に停車中の原付を引き倒しブレーキレバーを壊した疑い　アメリカ国籍で英会話講師の男（36）を逮捕【香川】,https://news.yahoo.co.jp/articles/472b443394facc1ee067a01578fcdc13683fd658,10/30(木) 14:28
2025-10-30,16:07,local,地域,34,長崎文化放送,【高校野球】長崎日大が九州大会で決勝進出！来春のセンバツ甲子園出場「確実」に,https://news.yahoo.co.jp/articles/1bb2b528769250ea3a0e23d69522395f8a29c022,10/30(木) 12:23
2025-10-30,16:07,local,地域,35,沖縄タイムス,中学校の廊下に細かいちりが…　天井裏に60センチのはく離コンクリート落下　沖縄・糸満市,https://news.yahoo.co.jp/articles/2b640d9390e1e0424b6921b28b5c5af771c5e5d5,10/30(木) 15:01
2025-10-30,16:07,local,地域,36,RCC中国放送,「歩行者が土手下に転落 呼びかけ応答なし」貨物自動車が歩行者はねる事故 歩行者が意識不明の重体　広島・府中市,https://news.yahoo.co.jp/articles/612d2f273e0af91f321ccd84475a6d2f02324d85,10/30(木) 13:25
2025-10-30,16:07,local,地域,37,MRO北陸放送,週末は低気圧が“急速に発達” 10月31日（金）は九州から関東で雨強まる 11月1日（土）は東北や北海道で警報級の大雨で大荒れのおそれ 雨と風シミュレーション,https://news.yahoo.co.jp/articles/589b860ca34bea61ffbdb93f88b818ec6e218cfa,10/30(木) 13:52
2025-10-30,16:07,local,地域,38,福島中央テレビ,博士山に入った70代男性が行方不明…昨夜国道401号で車両は発見される　福島,https://news.yahoo.co.jp/articles/1511c8dbb8b3314c807495d90a0151a7222b41a0,10/30(木) 12:00
2025-10-30,16:07,local,地域,39,TNCテレビ西日本,女子高校生ら10代男女3人が美人局か　SNSで待ち合わせ…男性を殴りケガをさせ現金奪った“強盗致傷”で逮捕　福岡市,https://news.yahoo.co.jp/articles/909495f11df8eba4d8808a16a2799c0a81cc9dc4,10/30(木) 12:08
2025-10-30,16:07,local,地域,40,秋田テレビ,クマによる人身被害と断定　秋田市雄和で見つかった女性の遺体　2025年の秋田県内の死者3人に,https://news.yahoo.co.jp/articles/575ad12faf8d35618d9be3336cf98f5ccb4a6945,10/30(木) 12:31
