scrp_date,scrp_time,genre_en,genre_jp,rank,media_jp,title,link,date_original
2024-09-07,07:05,life,ライフ,1,ファイナンシャルフィールド,母は「食器を洗ったスポンジ」でそのまま「シンク」も掃除します。「衛生面」が心配なのですが、分けなくて問題ないのでしょうか…？,https://news.yahoo.co.jp/articles/fac73ea8f7b6dda8450ba5162c539eae960535e3,9/5(木) 11:01
2024-09-07,07:05,life,ライフ,2,ねとらぼ,母に「メイクしてはだめ」と言われ悩み続けた40代女性、“変わりたい”とプロに依頼し……　表情も激変の結末に「エッ女優さんみたい！」,https://news.yahoo.co.jp/articles/3dbeb200bfbd47fca6f29b5e4641ad10360c9b4a,9/6(金) 19:30
2024-09-07,07:05,life,ライフ,3,Hint-Pot,「アメリカにもこんな乗り物があったらいいのに」　初訪日のアメリカ人が快適さに驚いた乗り物とは,https://news.yahoo.co.jp/articles/5352efc371123783dfffe5ec70e2b81342dc24e5,9/7(土) 6:10
2024-09-07,07:05,life,ライフ,4,ほ・とせなNEWS,幼い三つ子が大きくなった結果…その姿に「イケメン3人組」「かわいすぎます」「幸せも3倍」の声,https://news.yahoo.co.jp/articles/cc3ce36e6662305aa401b61ca6860eb1d306597f,9/6(金) 11:30
2024-09-07,07:05,life,ライフ,5,ねとらぼ,水族館で夫が撮った思い出の写真、見返そうと思ったら……　予想外すぎる姿に「ママ見てコーヒー吹いた」「これはさすがに王騎将軍もびっくり」,https://news.yahoo.co.jp/articles/f376067f8ed41b1fec8e75f223d514fc58321a41,9/2(月) 21:46
2024-09-07,07:05,life,ライフ,6,ENCOUNT,母国の日本食は「ニセモノだった」　在日イタリア人、来日後に食べて感激した庶民派の逸品とは,https://news.yahoo.co.jp/articles/80b188234f91fea74f370eed9fe6417191803f31,9/6(金) 15:10
2024-09-07,07:05,life,ライフ,7,ほ・とせなNEWS,「自分が無能すぎてつらい」頑張りたくても頑張れない　離職を繰り返してしまう女性その生活を赤裸々に語る,https://news.yahoo.co.jp/articles/0ddb5bd63ca02df71a0570e0392d2f58603a0eab,9/6(金) 15:00
2024-09-07,07:05,life,ライフ,8,ダイヤモンド教育ラボ,「大学受験地図が一変する…」東洋大学の「常識を覆す」新しい学校推薦選抜に教育現場が揺れるワケ,https://news.yahoo.co.jp/articles/0be592bed3d68620077cee85b265abd73637f891,9/7(土) 5:02
2024-09-07,07:05,life,ライフ,9,kufura,【自分が汗臭かった夏】「ニオイ対策アイテム」はママ友談義でも話題になった「使って損なし」のものばかり！,https://news.yahoo.co.jp/articles/0d6b5ce53644f607e94a8a365c5502a7a0c3226b,9/6(金) 20:20
2024-09-07,07:05,life,ライフ,10,マイナビ子育て,宮崎麗果さん「おなかの中で赤ちゃんの成長が止まって…」体重1kg未満で生まれた娘。発達がゆっくりな彼女が教えてくれた大切なこと,https://news.yahoo.co.jp/articles/def63b7d93d106e0270865af1d42a6666042807e,9/6(金) 12:11
2024-09-07,07:05,life,ライフ,11,ファイナンシャルフィールド,新居に「24時間換気」がついています。電気代がもったいないですよね？寝ている間「オフ」にしたほうがいいですか？,https://news.yahoo.co.jp/articles/a61180b5c55710dd6a00def6c033c400cb5863ef,9/6(金) 11:32
2024-09-07,07:05,life,ライフ,12,ファイナンシャルフィールド,戸建てベランダで「BBQ」をしていたら、近隣住民から「苦情」が入りました。「敷地内」でやっていることですが、今後は控えるべきでしょうか…？,https://news.yahoo.co.jp/articles/359498a186ab5cf2dc92f88a737065da5bc27504,9/4(水) 13:30
2024-09-07,07:05,life,ライフ,13,トラベル Watch,たまたま立ち寄った「6日後に破綻する百貨店」。消えゆく地方の百貨店、原因は競合だけにあらず？,https://news.yahoo.co.jp/articles/6f69aca7ae8cae97c95f4d14bf188d5957e230e2,9/6(金) 19:00
2024-09-07,07:05,life,ライフ,14,ファイナンシャルフィールド,晩酌のハイボールのために「ペットボトル」の炭酸水をたくさん消費します。「炭酸水メーカー」を買おうか迷っているのですが、どれくらい節約になるでしょうか？,https://news.yahoo.co.jp/articles/8c62772278b10ec48d0d942c8bdcb604f78ed5fd,9/6(金) 13:50
2024-09-07,07:05,life,ライフ,15,ファイナンシャルフィールド,水道の蛇口を閉め忘れ「3日間」の旅行中に水が「流しっぱなし」になっていました。「水道代」はいくらかかるでしょうか？,https://news.yahoo.co.jp/articles/648b37038223a80a6b95e3d6d43686a31747b9d3,9/5(木) 11:10
2024-09-07,07:05,life,ライフ,16,ほ・とせなNEWS,失語症のじいじがひ孫を前にし”数年ぶりの発言”…しかし、まさかの内容に「予想のはるか上の発言」「孫の力はすごい」の声,https://news.yahoo.co.jp/articles/33cf5f14a0f762c53c0ebd98a8ac863e8fd8b33c,9/4(水) 15:00
2024-09-07,07:05,life,ライフ,17,ファイナンシャルフィールド,ママ友が「PTA割引」でパソコンを安く買ったと言っていました。「PTA役員」になるととても大変ですが、本当にパソコンが安く買えるのでしょうか？,https://news.yahoo.co.jp/articles/d75e293abb1c9a21fd3d713809d53ce66ef17eba,9/7(土) 6:10
2024-09-07,07:05,life,ライフ,18,BuzzFeed Japan,スタバの「新作タンブラー」に一目惚れ！夜空に輝く星がついてて、ロマンチックなんです《購入レビュー》,https://news.yahoo.co.jp/articles/86d366ee6f10f56354ea3ea2d6cc9b10cffc91c2,9/6(金) 16:05
2024-09-07,07:05,life,ライフ,19,共同通信,歌手のセルジオ・メンデスさん死去,https://news.yahoo.co.jp/articles/44f613ae8559eb88f63767c17e99d86c3bfb5967,9/7(土) 0:43
2024-09-07,07:05,life,ライフ,20,All About,グリーン車はなぜ「グリーン」なの？ 意外と知らない名前の由来、有力とされる説は,https://news.yahoo.co.jp/articles/4bedc88abc6b3e2dba0814ccb3c2b298c60e073c,9/6(金) 21:25
2024-09-07,07:05,life,ライフ,21,共同通信,セルジオ・メンデスさん死去は5日,https://news.yahoo.co.jp/articles/5b39442ef6ba5a131998fe228a830fe65b95f3fe,9/7(土) 6:00
2024-09-07,07:05,life,ライフ,22,LIMO,「パソコンしてないでさぁ…」子猫の予期せぬ『誘い方』に31万反響　至福の3コマに「こんなのメロメロ」,https://news.yahoo.co.jp/articles/33d962bc5b45bcce664cc19594bb5c64de54ee66,9/7(土) 4:41
2024-09-07,07:05,life,ライフ,23,LIMO,夫婦で作業をするため「万葉の湯の個室」を借りた家族　予定外のオチが話題に,https://news.yahoo.co.jp/articles/18cda5410cf2afc09d53189843fcc4c35292e723,9/5(木) 5:17
2024-09-07,07:05,life,ライフ,24,まいどなニュース,オンライン会議中に、子どもが号泣…あやしながらプレゼンしたら、上司から「労働時間から省くように」と指摘が…従わないとダメ？【社労士が解説】,https://news.yahoo.co.jp/articles/be3c63872ef9830c8e790d7b5cf6744366a23ed3,9/5(木) 15:30
2024-09-07,07:05,life,ライフ,25,ほ・とせなNEWS,生後1秒で”綺麗な顔”と言われた息子　しかし数日後…！？「笑わせてもらいました」「かわいすぎ」衝撃のアフターに反響,https://news.yahoo.co.jp/articles/2525253dcd99189da8bbae3bb7e157f9d38e4afd,9/2(月) 17:10
2024-09-07,07:05,life,ライフ,26,Reライフ.net,扶養を外れる条件と払うべき税金を紹介 老後を見据えた損をしない働き方とは,https://news.yahoo.co.jp/articles/11e2ead82392b5bc23a1e30b7a23ed58ef0a5095,9/5(木) 11:10
2024-09-07,07:05,life,ライフ,27,ねとらぼ,【60代に聞いた】一番モーニングがおいしいと思う「ファミレスチェーン」ランキング！　2位は「ロイヤルホスト」、1位は？,https://news.yahoo.co.jp/articles/bb65eb35ee85506cb705f4263ad7d830a0297bbf,9/5(木) 22:05
2024-09-07,07:05,life,ライフ,28,ねとらぼ,奇形のフナを育てて1年後、タライから取り出してみたら……　成長した驚きの姿に「ロマンを感じる」,https://news.yahoo.co.jp/articles/3337a300c33737013e4e6bfdf98a6dceeef3db45,9/5(木) 21:00
2024-09-07,07:05,life,ライフ,29,LIMO,「同じ日の、同じ猫です」ん？　2枚の写真に思わず二度見　「脳がバグるww」「ふくらんで…いる？」の声,https://news.yahoo.co.jp/articles/abd32169b3b4fc6d2d3b437fdc78c3e2c50685fe,9/7(土) 4:22
2024-09-07,07:05,life,ライフ,30,ねとらぼ,牧場に捨てられていた元野犬がシャンプーに挑戦したら……　キレイになった姿に「100億満点」「がんばった」,https://news.yahoo.co.jp/articles/22dfbe64acbb89fd050a1c57e0cb4b8fa96a57c0,9/6(金) 22:00
2024-09-07,07:05,life,ライフ,31,ねとらぼ,「天才！」　人気料理研究家による“目玉焼きの作り方”が目からウロコ　今すぐ試したいライフハックに「初めて知りました！」,https://news.yahoo.co.jp/articles/498cb96d6dbc598186afdd7160815690a55476d4,9/4(水) 7:45
2024-09-07,07:05,life,ライフ,32,OCEANS,【全米1位】約30人を容赦なくディス！エミネム“最新アルバム”の最狂っぷりを徹底解説,https://news.yahoo.co.jp/articles/df10b28e2ef73361c76bf0de4669fd1b885290fc,9/6(金) 19:00
2024-09-07,07:05,life,ライフ,33,LIMO,「プレミアム商品券」9月7日更新！申し込み期間中の都道府県（市区町村）を【一覧】でチェック,https://news.yahoo.co.jp/articles/5d083413b7e572a9c461875c34445bea327d344a,9/7(土) 5:32
2024-09-07,07:05,life,ライフ,34,LIMO,政令指定都市が3つある都道府県はどこなのか　正解したのは全体の5割だった,https://news.yahoo.co.jp/articles/a99fdd7d9e62ee414a6152379023bb43ba128090,9/6(金) 5:17
2024-09-07,07:05,life,ライフ,35,LIMO,タリーズの「肩がけトート型エコバッグ」が楽ちん。人気キャラとのコラボ商品も,https://news.yahoo.co.jp/articles/d90ddb23a28377c1d080d1caa3fb71177172bf70,9/6(金) 8:47
2024-09-07,07:05,life,ライフ,36,ねとらぼ,“ダイエット中”の北斗晶、5キロ減量するための秘訣明かす　「軽い気持ちで」,https://news.yahoo.co.jp/articles/4e5d8d7c008ff66617f6dbed0df0fe4855fc6532,9/6(金) 17:45
2024-09-07,07:05,life,ライフ,37,ファイナンシャルフィールド,ママ友が「10月から児童手当が月1万円もらえる！」と喜んでいました。わが家はもともと支給されているのですが、“誰でももらえるもの”ではないのでしょうか…？,https://news.yahoo.co.jp/articles/15aba779034d6c8edc09bf003e3a5bce0eab981a,9/5(木) 13:40
2024-09-07,07:05,life,ライフ,38,ねとらぼ,流れが悪い台所の排水管を、プロが高圧洗浄したら……　姿を現した引くほどデカい“40年モノの油塊”に「まるで化石」「物凄い大きさとか量でびっくり」,https://news.yahoo.co.jp/articles/379fc7507d69db3f97a9b088e40e54b05b6eb946,9/4(水) 22:00
2024-09-07,07:05,life,ライフ,39,ねとらぼ,夫婦でふらっと釣りにいくと妻がまさかの……　“うわでっか！”夫もびっくりの予想外な釣果に「すげー」「さすがです」,https://news.yahoo.co.jp/articles/145c7db982989ca21da54b2e1cea079ff16ccca0,9/6(金) 21:00
2024-09-07,07:05,life,ライフ,40,LIMO,キャンプやアウトドアでも活躍！ワークマンの「防災グッズ」備蓄にもコスパ良し,https://news.yahoo.co.jp/articles/e89a103fb8ce418b5ffde6ad9eb54a67d9574899,9/7(土) 5:47
