scrp_date,scrp_time,genre_en,genre_jp,rank,media_jp,title,link,date_original
2025-09-03,21:12,TTL,総合,1,MBSニュース,年金の「強引徴収」で経営危機に陥る運送会社...20人以上の運転手解雇　『社員が横領』犯罪被害で厚生年金の猶予を申請...年金事務所は「猶予する理由がない」,https://news.yahoo.co.jp/articles/d9069533fefd02a795704ffd2f7172c6d25a3601,9/3(水) 11:02
2025-09-03,21:12,TTL,総合,2,デイリースポーツ,Ｘ大荒れ「すげえメンタルだな」「負けるな」東洋大学歴疑惑の市長　不信任可決も→白鳥ボートのお花畑投稿　１６００超コメ殺到「何を呑気に」「今することは？」「メガソーラ不要！」,https://news.yahoo.co.jp/articles/fe842e6fdb3155d66af7b918280237ad60fa2197,9/3(水) 16:48
2025-09-03,21:12,TTL,総合,3,スポニチアネックス,藤本美貴「資格持ってるから」　2つの意外な資格をさらりと告白　横澤夏子驚がく「嘘だよ！なんで？」,https://news.yahoo.co.jp/articles/bb46001a027846729a836c3d0b52d0c903ee50cc,9/3(水) 14:27
2025-09-03,21:12,TTL,総合,4,東スポWEB,【ＭＬＢ】イ・ジョンフが〝イチロー超え〟記録に迫る　韓国メディア「世界の野球ファンが注目」,https://news.yahoo.co.jp/articles/2bd2c1619e65604e4731db007407f8fba2bf1822,9/3(水) 17:05
2025-09-03,21:12,TTL,総合,5,NBS長野放送,【台風情報】熱帯低気圧が今後12時間以内に台風となる見込み　進路予想は　5日には東日本にもかなり接近か　気象庁の発表（3日午後5時28分）,https://news.yahoo.co.jp/articles/6a15bde05821c29ff4dc0e1c37659ce246864333,9/3(水) 17:58
2025-09-03,21:12,TTL,総合,6,東スポWEB,「なんだコイツ」清水尋也容疑者　将来有望も撮影現場で〝浮いていた〟証言,https://news.yahoo.co.jp/articles/2c856c696a88b98c8324ac81e65e8fb64c8dae36,9/3(水) 12:01
2025-09-03,21:12,TTL,総合,7,クランクイン！,“可愛すぎる”と話題・卓球女子21歳にネット衝撃「モデルさん！」「素敵すぎ」「スーパー美人」,https://news.yahoo.co.jp/articles/1354f34e818c4c4c30c09a9c36ee74ced0cb0de5,9/3(水) 18:00
2025-09-03,21:12,TTL,総合,8,J-CASTニュース,ヒカル、深夜1時に...「トップ女優」と生電話　「冗談とかも言い合える」YouTubeで明かした関係,https://news.yahoo.co.jp/articles/ac289be2478c22df63a59fefed54fa85040f8d86,9/3(水) 17:23
2025-09-03,21:12,TTL,総合,9,新潟ニュースNST,【台風情報】熱帯低気圧は12時間以内に台風に発達する予想　4日(木)に西日本・5日(金)に東日本にかなり接近するおそれ　太平洋側は大雨や暴風に警戒,https://news.yahoo.co.jp/articles/c9844385393e99d5fc505303eff61df99c2340a7,9/3(水) 19:45
2025-09-03,21:12,TTL,総合,10,デイリースポーツ,田崎史郎氏　両院議員総会で評価ガタ落ちした自民大物幹部の名前「ボクは見苦しいなと思った」「自民党内の信頼厚かったが…」,https://news.yahoo.co.jp/articles/a8e7482916f68acd7f563482460456fb65a97f43,9/3(水) 14:46
2025-09-03,21:12,TTL,総合,11,オリコン,清水尋也容疑者、逮捕報道の1ヶ月前に語っていたこと　5年前に母が急逝で実家を引き払う「兄が全部やってくれた」,https://news.yahoo.co.jp/articles/266b0ee0fad8dbbe31c195ccb14b031d7962517a,9/3(水) 15:00
2025-09-03,21:12,TTL,総合,12,日刊スポーツ,【世界バレー壮行試合】世界５位の日本男子が同15位のブルガリアと対戦、世界選手権へ最終調整,https://news.yahoo.co.jp/articles/17af822863b9639c198d752eb416b2902caa8cee,9/3(水) 17:41
2025-09-03,21:12,TTL,総合,13,千葉日報オンライン,【速報】校内などで女子生徒4人に性暴力、高校教諭を懲戒免職　中学生への性暴力で別の中学教諭も免職　千葉県教委,https://news.yahoo.co.jp/articles/c2044f6205d207a2e0c357df5472c1a9291888d5,9/3(水) 14:13
2025-09-03,21:12,TTL,総合,14,スポーツ報知,男子ゴルフ史上初！　キャディーに選手賞金の１０％を贈呈　進藤大典氏「新しい文化ができれば」,https://news.yahoo.co.jp/articles/ad50fa9876a1bb456499f733c5ba6c9d2434c92c,9/3(水) 19:41
2025-09-03,21:12,TTL,総合,15,産経新聞,バス急ブレーキで乗客骨折　原因は飛び出し自転車、接触しなくてもひき逃げ容疑で捜査の訳,https://news.yahoo.co.jp/articles/2d2b52d3b5b017fd4736a603ddb077246b71ea4b,9/3(水) 19:00
2025-09-03,21:12,TTL,総合,16,高校野球ドットコム,新たに4人がプロ志望！神奈川県屈指の進学校・川和の濱岡蒼太が提出！【25年・高校生プロ志望届提出者リスト】,https://news.yahoo.co.jp/articles/cf74603f45ccfd89980325f9366926caf8697e71,9/3(水) 17:19
2025-09-03,21:12,TTL,総合,17,ねとらぼ,「うれじいぃぃぃ」　ミスド“次回コラボ”のヒント公開→大興奮の“確定演出”に「嘘だろ」「史上一番売れるんちゃう？」,https://news.yahoo.co.jp/articles/31293d273cd2b16fbd4f1543b3fe611b39b40783,9/3(水) 18:02
2025-09-03,21:12,TTL,総合,18,ほ・とせなNEWS,息子2人を連れてワンオペで帰省しようとしたママ。直後、義母のまさかの神対応に…「すっごいありがたい」「自分もこんな心遣いをしたいです」,https://news.yahoo.co.jp/articles/264913f7ed79af8d514d952bad6117ff8087f5d5,9/3(水) 19:00
2025-09-03,21:12,TTL,総合,19,ABCニュース,町内会に入会しないと“ゴミ出し拒否”はアリ？　年会費の倍額払えば役員が回ってこない自治会も　加入率は年々減少…識者「できる範囲でかかわれる仕組みを」【識者解説】,https://news.yahoo.co.jp/articles/2fb7a3ef93eec6f8becef142ab65e2726b0afb0d,9/3(水) 18:02
2025-09-03,21:12,TTL,総合,20,デイリースポーツ,ネット騒然「さすがにヤバ過ぎ」「嫌な予感しかない」鳩山由紀夫元首相、中国の抗日戦勝パレード出席でトレンド騒ぎ　元日テレ青山氏「完全に中国のプロパガンダに」,https://news.yahoo.co.jp/articles/6880e09c2ca25e89af0ccca00d5e93d81a6dec4c,9/3(水) 20:09
2025-09-03,21:12,TTL,総合,21,スポニチアネックス,逮捕の俳優・清水尋也容疑者とは　13歳でデビュー　きっかけは俳優の兄　21歳で最愛の母が死去,https://news.yahoo.co.jp/articles/cb1efd1eee02f0dfc607c214833dafd94e99d669,9/3(水) 14:33
2025-09-03,21:12,TTL,総合,22,北海道ニュースUHB,"【ヒグマ速報】大雪山の登山道で""ヒグマ接近""40代男性が『スプレー噴射』で追い払う_その距離わずか約10メートル…ラジオを流しながら登山中にクマと遭遇〈北海道〉",https://news.yahoo.co.jp/articles/2998d70a48a1ab761f4f59bfc42582cd9fe3d170,9/3(水) 19:14
2025-09-03,21:12,TTL,総合,23,スポーツ報知,東国原英夫氏のイケメン長男・加藤守氏　美人妻と旅行へ！母・かとうかず子の誕生日だった今年２月に結婚,https://news.yahoo.co.jp/articles/8f29f125f3a71c44fb6b92844b1ce99a6a4c7808,9/3(水) 15:55
2025-09-03,21:12,TTL,総合,24,スポニチアネックス,藤本美貴　子どもが習い事に「行きたくない」と言ったら？「うちは行く行かないとかの問題じゃないから」,https://news.yahoo.co.jp/articles/20587ad384fd4dd9eb3a23b68c830b7e23e79d73,9/3(水) 15:09
2025-09-03,21:12,TTL,総合,25,スポニチアネックス,斎藤佑樹氏　高卒プロ入りしなかった理由は2つ「当時前田健太投手とか…」「中学3年生の時に…」,https://news.yahoo.co.jp/articles/1ac3b5288852ab235985c5e67a0836f0e32ee4f0,9/3(水) 13:44
2025-09-03,21:12,TTL,総合,26,ねとらぼ,引き離すと泣くひっつき兄妹猫→2匹とも引き取った6年後……　感涙の“現在”に「涙出ちゃう！」「なんて尊いの」,https://news.yahoo.co.jp/articles/206d1a7b7aeb55623c13d1abe5cf0070edb2fe94,9/3(水) 19:00
2025-09-03,21:12,TTL,総合,27,デイリースポーツ,「『レンタル怖い人』みたいなこと、２０年以上前にやってたな確か」瓜田純士の若き日の姿に反響　顔にタトゥーなしも「これは【ただの怖い人】ですｗ」,https://news.yahoo.co.jp/articles/ccf4a0e19f43f3fe9e8c3fe811a437fdb7d9f55d,9/3(水) 18:46
2025-09-03,21:12,TTL,総合,28,J-CASTニュース,「じゃあ、何のために世論調査してるんですか」　田崎史郎氏の石破首相めぐる発言にジャーナリスト怒る,https://news.yahoo.co.jp/articles/6c12ad4a3e02a559b79611f550c2d521d60fa20e,9/3(水) 16:30
2025-09-03,21:12,TTL,総合,29,ENCOUNT,田村亮、出演予定だった舞台『リア王2025』降板が決定　異例の2日前発表,https://news.yahoo.co.jp/articles/542be4759479c40e372726f267dbc96503696d09,9/3(水) 10:19
2025-09-03,21:12,TTL,総合,30,まいどなニュース,家に泊まった18歳息子の友達→翌朝見た、光景に母は胸キュン　「育ちが出る」「躾がきちんとできてる」,https://news.yahoo.co.jp/articles/3e75cd9edc92eabbee7a44122372eadb90c61a84,9/3(水) 7:15
2025-09-03,21:12,TTL,総合,31,オリコン,『なんでも鑑定団』出張鑑定に山下清の水彩画登場　本人評価額100万円→鑑定結果にスタジオ騒然「これはスタジオ行きだったんじゃ？」,https://news.yahoo.co.jp/articles/3444afb71c1cfe8878d2c006eda38592d06c1648,9/3(水) 17:30
2025-09-03,21:12,TTL,総合,32,tbc東北放送,リフォーム業者だった元大工に懲役26年判決　1400万奪われ死亡した72歳男性「孫の成長を何より喜んでいた」遺族が語った憤り「父と過ごすはずだったかけがえのない時間も奪われた」【裁判傍聴記(4)】,https://news.yahoo.co.jp/articles/87315856dc575b2cd1d71b812d880049b2d56bb6,9/3(水) 20:01
2025-09-03,21:12,TTL,総合,33,神戸新聞NEXT,入院中の患者、2階の病室から転落し死亡　神戸・須磨区の総合病院,https://news.yahoo.co.jp/articles/90ed0dad065270910a5336722a1160a83eb397b9,9/3(水) 17:09
2025-09-03,21:12,TTL,総合,34,Full-Count,まさかの“15位・大谷翔平”「なんだこれ」　独占した理解不能な記録に唖然「怪物だ」,https://news.yahoo.co.jp/articles/95f98a81884cc8dcaaf4d850f330f82fd9966a17,9/3(水) 19:31
2025-09-03,21:12,TTL,総合,35,NBS長野放送,部活の遠征先で生活態度の乱れなど理由に部員10人をバスに乗せず…荷物を持ち数キロ離れた会場に向かわせる　佐久長聖高校の女子バスケットボール部　部員1人を遠征先から1人で帰らせるトラブルも,https://news.yahoo.co.jp/articles/2ef2552f6deb19337802b4b952a4005fea25f181,9/3(水) 19:46
2025-09-03,21:12,TTL,総合,36,ABEMA TIMES,大谷翔平の衝撃46号に味方も“ビックリ”…中継カメラが捉えたド軍ベンチのリアクション「お口あんぐりww」「みんな引いてる」,https://news.yahoo.co.jp/articles/53702a7c3bd56604c28aa20c20047041fdc9628c,9/3(水) 18:00
2025-09-03,21:12,TTL,総合,37,ねとらぼ,「スマホと財布が楽に入る」モンベルの“便利ポケットみたいなミニバッグ”が人気　「こういうのが欲しかった」「ゴルフ用ポーチとして使っています」,https://news.yahoo.co.jp/articles/d0cfbc431cf3b9d1e08d81e0caee609d67932817,9/1(月) 12:20
2025-09-03,21:12,TTL,総合,38,あいテレビ,【台風情報】九州→四国→近畿→東海→関東へ日本横断の可能性…台風のたまご=熱帯低気圧から台風15号に発達見込み【雨と風の最新シミュレーション】,https://news.yahoo.co.jp/articles/03b15b0b31042c21ae5cb6820de09d29db9df6df,9/3(水) 16:18
2025-09-03,21:12,TTL,総合,39,ABEMA TIMES,“チラ見え水着が話題”中条あやみ（28）、トレーニング中の無防備な姿,https://news.yahoo.co.jp/articles/493e91daeb6302f3f396f0bfa87218c9af437717,9/3(水) 17:45
2025-09-03,21:12,TTL,総合,40,デイリースポーツ,「誘拐の日」最終回　最後の最後ドデカ伏線回収に鳥肌「そういうことか！」政宗が突然覚醒→別人の顔に「刑務所だから」「見事すぎる」　序盤から意味深だった伏線が,https://news.yahoo.co.jp/articles/4ab49a78e70808baa7d02ecdbe92c60351b162ac,9/3(水) 18:45
