scrp_date,scrp_time,genre_en,genre_jp,rank,media_jp,title,link,date_original
2025-06-18,01:08,TTL,総合,1,ほ・とせなNEWS,容姿を差別され…「こんな外見に生まれなきゃ良かった」→そう思った14年後の姿に…「可愛い」「今も昔も天使みたい」,https://news.yahoo.co.jp/articles/d98dbed6cee96f1a22a3eba27ee3620de5ecaaba,6/17(火) 15:19
2025-06-18,01:08,TTL,総合,2,デイリースポーツ,「謎の集団セリーグ」セ首位の阪神７連敗でも２位とのゲーム差ほぼ不動の珍現象　ネット話題「どないしてん」「負けすぎやで」,https://news.yahoo.co.jp/articles/0f6fd88373c2e5a9b3f1149266b1739069da68ac,6/17(火) 22:13
2025-06-18,01:08,TTL,総合,3,日刊スポーツ,“２万円花柄ワンピ”と対照的…石破首相夫人・佳子さんのサミットファッションに「凄く素敵」,https://news.yahoo.co.jp/articles/333e4fdfef0cd2ffb1ad7dec8fc94b44d18c1f9b,6/17(火) 15:31
2025-06-18,01:08,TTL,総合,4,マイナビニュース,『正直不動産』『東京サラダボウル』から『舟を編む』へ…NHK「ドラマ10」はなぜ“ハズレなし”の枠になったのか,https://news.yahoo.co.jp/articles/03e1c7904c40409079dbf29b147f9919f3d6b0fc,6/17(火) 17:43
2025-06-18,01:08,TTL,総合,5,スポーツ報知,「男子より…」石田ゆり子５５歳　別人のようなイメチェン姿「わー！」「バッサリ」「雰囲気が全く違う」,https://news.yahoo.co.jp/articles/b0eeb934329dd4c875c69eed5a2b2bd70c2ef991,6/17(火) 11:55
2025-06-18,01:08,TTL,総合,6,中日スポーツ,巨人・阿部監督、４番について聞かれ「じゃあ誰を打たせればいいですかね」４連敗に苦悩の色浮かべる,https://news.yahoo.co.jp/articles/f5d31bdcf86c72697d5a6e1f40fda421d1987a2d,6/17(火) 21:21
2025-06-18,01:08,TTL,総合,7,ABEMA TIMES,石田ゆり子（55）、髪ばっさりカットの“激変”ショットに反響「カッコ良すぎる」「美しさが際立ってます」,https://news.yahoo.co.jp/articles/4dca0f86722de7ffa00f4d1d864987cb41e222f9,6/17(火) 19:39
2025-06-18,01:08,TTL,総合,8,まいどなニュース,父は2038安打のヒットメーカー、夫は日本代表のモデル　父と腕を組む花嫁姿にあふれる幸せ　「3人とも素敵です」,https://news.yahoo.co.jp/articles/93b96b144e5eb99e49c7f0ff0c323e246609bff7,6/17(火) 19:00
2025-06-18,01:08,TTL,総合,9,ねとらぼ,コケまみれの水槽にエビ200匹を投入→2日後……　まさかの光景に「お口あんぐり」「すごい食欲ですね」,https://news.yahoo.co.jp/articles/7395ba426cf2689df775b98ff325e3c0887e0329,6/17(火) 20:00
2025-06-18,01:08,TTL,総合,10,ITmedia NEWS,PCが起動しない──「Windows Update」後の不具合でPCメーカーが相次ぎ注意喚起　富士通、マウス、GIGABYTEも,https://news.yahoo.co.jp/articles/1a618d377bee72de6b9f03d69fae11ff3380c2f1,6/17(火) 17:07
2025-06-18,01:08,TTL,総合,11,スポニチアネックス,横須賀市長　交通違反を謝罪　息子の上地雄輔について「連絡なかったし私から連絡することもない」,https://news.yahoo.co.jp/articles/5eb3dbdfa3172bf241bb1754d0f7363b8690c36d,6/17(火) 17:32
2025-06-18,01:08,TTL,総合,12,スポニチアネックス,小泉進次郎氏、昼食取りながらの“お願い”電話　73歳大物歌手が「一言」でバッサリ！,https://news.yahoo.co.jp/articles/cf896c8ff0a2fc92ce141402b8f8d89d4151d669,6/17(火) 15:32
2025-06-18,01:08,TTL,総合,13,スポニチアネックス,ヒカル「どうせすぐ離婚する」の声にアンサー　離婚したら財産はどうする？にも回答,https://news.yahoo.co.jp/articles/43ca0dcd1b9c99ec2b1e3b46693cc398a5d858a3,6/17(火) 21:25
2025-06-18,01:08,TTL,総合,14,映画.com,山奥の村に花嫁として売られた大学生　検閲で約20カ所カット、国内上映禁止となった中国の衝撃作「盲山」,https://news.yahoo.co.jp/articles/60bae16364565b74c403050a6a529cc1b701c091,6/17(火) 18:00
2025-06-18,01:08,TTL,総合,15,ABEMA TIMES,一体、何が起きた？ 大谷翔平が叫んだ…！「ピッチャーの時は別人格」 際どい判定に見せた“一瞬の表情”が話題に,https://news.yahoo.co.jp/articles/2198c81e6cb0cc321868cd65714cf8efe1621945,6/17(火) 22:52
2025-06-18,01:08,TTL,総合,16,時事通信,れいわ・舩後氏が政界引退へ　「さらに6年は難しい」,https://news.yahoo.co.jp/articles/798d154c695d962137a1495ecf349adce49ee24e,6/17(火) 19:48
2025-06-18,01:08,TTL,総合,17,FNNプライムオンライン,マグニチュード7以上の地震発生の可能性も　国東半島沖に見つかった新たな活断層は「横ずれが主体」市民からは不安の声「まさかここに断層が…」【大分発】,https://news.yahoo.co.jp/articles/71bee548f8ada4a48cc8a56daec768fec8e8e773,6/17(火) 14:25
2025-06-18,01:08,TTL,総合,18,南海日日新聞,ハブが「うり坊」を丸のみ　専門家、相当つらかったはず…　加計呂麻島,https://news.yahoo.co.jp/articles/e5473ad9c76a3c3a2b749b11e6d295ecb367632c,6/17(火) 13:01
2025-06-18,01:08,TTL,総合,19,デイリースポーツ,夫はメジャーリーガーの３２歳女優　生まれたばかりの第３子に「この感じかわいい」とメロメロ,https://news.yahoo.co.jp/articles/03f3621cd334ba881f07b23957e07c648e21b868,6/17(火) 19:22
2025-06-18,01:08,TTL,総合,20,ねとらぼ,「なんだよww」「腹いてぇ笑」　役所からの留守電、文字起こしを見たら……　“ツッコミどころ満載な内容”に「意味が分からなくて三度見」,https://news.yahoo.co.jp/articles/2d8a0e95a0a89a66a6422384cc5d72a583f4d0ed,6/17(火) 21:00
2025-06-18,01:08,TTL,総合,21,西スポWEB OTTO！,「え？待って何そのビジュ」妻は13歳年下女優…〝一変〟1児のパパとなった43歳俳優の渋みある〝ひげ＆アクセ〟姿に大絶賛「かっこよすぎ」,https://news.yahoo.co.jp/articles/89ab964fa79c7ee118802686c493586677a137e8,6/17(火) 23:30
2025-06-18,01:08,TTL,総合,22,デイリースポーツ,娘より若い２４歳下男性と再婚の美魔女歌手「すごく真面目な方」　デビュー前の２０歳で娘出産「働きっぱなしでした」,https://news.yahoo.co.jp/articles/2589175e4806b0fd95b49d18143f0a0e4818c899,6/17(火) 20:00
2025-06-18,01:08,TTL,総合,23,Full-Count,大谷翔平、投打で“誤審”発生　ロバーツ監督も猛抗議…敵地放送局まで同情「低すぎました」,https://news.yahoo.co.jp/articles/896c8757413219ffedcf8b0356cde0b3b7277f99,6/17(火) 20:05
2025-06-18,01:08,TTL,総合,24,ENCOUNT,エハラマサヒロの妻、リフォームしたばかりの家からスピード引っ越し　理由も告白「学びました」,https://news.yahoo.co.jp/articles/4207182fc8b0f360a0caa1c00d2bcdfc373db9b6,6/17(火) 21:30
2025-06-18,01:08,TTL,総合,25,TBS NEWS DIG Powered by JNN,バレー女子日本代表、ネーションズリーグ第2週の香港ラウンド登録メンバー発表 リベロ総入れ替えで福留慧美ら選出【一覧】,https://news.yahoo.co.jp/articles/c1e6cb82579bbfebb346148bf45a4812d3fc41c9,6/17(火) 18:54
2025-06-18,01:08,TTL,総合,26,スポーツ報知,【西武】松坂大輔超えた！今井達也が球団新の１７奪三振で今季初完封　貯金は今季最多の７に伸びる,https://news.yahoo.co.jp/articles/b642388e855e0faeab9512af3160c6d270c66407,6/17(火) 20:41
2025-06-18,01:08,TTL,総合,27,中日スポーツ,ドジャースの編成本部長、大谷翔平への『過小評価』にご立腹…何度も首を振り「信じられないくらい…」,https://news.yahoo.co.jp/articles/e00b532b0545bcfe50bc76976d24cc66a8d7fee9,6/17(火) 15:59
2025-06-18,01:08,TTL,総合,28,FNNプライムオンライン,【何が】両親と3人暮らし容疑者宅から7年半行方不明の宮本果歩さん（当時21歳）の頭蓋骨…逮捕の斎藤純容疑者（31）家族入れないよう部屋につっかえ棒　さいたま市,https://news.yahoo.co.jp/articles/37aaef95f152dfebd96d24616e6f41debb8bd2c9,6/17(火) 18:02
2025-06-18,01:08,TTL,総合,29,スポニチアネックス,箕輪厚介氏、湿布の保険適用問題で怒り「働いて、働いて、働いて…湿布が9割引きは納得いかない」,https://news.yahoo.co.jp/articles/a3631abfe1fc9498e6ae06518eec53c67154f314,6/17(火) 20:53
2025-06-18,01:08,TTL,総合,30,テレビ朝日系（ANN）,イランがイスラエル情報機関攻撃か　諜報活動担当が多数死亡の報道も,https://news.yahoo.co.jp/articles/bcf1b2d56e7744e68c33c0519b02efc933aa4691,6/17(火) 23:25
2025-06-18,01:08,TTL,総合,31,ねとらぼ,新卒でメガバンクに就職した女性→働いて5年で退職したら……　“人生が激変した現在”に「カッコいい」「応援します」,https://news.yahoo.co.jp/articles/1ac3042c542429e1ef43473fbf8f1c7132f5ed4f,6/17(火) 22:30
2025-06-18,01:08,TTL,総合,32,ENCOUNT,「ワンプッシュタイプのスプレー」で舌が“レレレ”に　SNSで相次ぐ声…気になる健康への影響、メーカーの見解は？,https://news.yahoo.co.jp/articles/65fe78f2c63fc7241d7fb7aa0e0034e890db1c93,6/17(火) 17:10
2025-06-18,01:08,TTL,総合,33,Full-Count,“間近”で見た大谷翔平の復活投球「凄かった」　ド軍ルーキーは万感の思い「特別」,https://news.yahoo.co.jp/articles/89c701bc3febff3bf58de68191b0fa81a88c70d9,6/17(火) 21:01
2025-06-18,01:08,TTL,総合,34,ゲキサカ,日本代表DF瀬古歩夢のグラスホッパー退団が発表!! W杯イヤーにステップアップなるか,https://news.yahoo.co.jp/articles/d44dbbb89187e54b01be2cc00847d28f9ddfae2d,6/17(火) 19:10
2025-06-18,01:08,TTL,総合,35,ねとらぼ,ママ「なんでおじさん？」　娘のネイルシールをよく見たら……　まさかの見間違いに「もうそれにしか見えません」,https://news.yahoo.co.jp/articles/39444abdbe5163bc4382c2c7a7355c1eaee000be,6/17(火) 20:30
2025-06-18,01:08,TTL,総合,36,スポニチアネックス,峯岸みなみ　岡崎移住で大号泣　「打ちひしがれた」東京とのギャップとは,https://news.yahoo.co.jp/articles/8d2a0c70a3d612193d93c2cd77bee4068ee67642,6/17(火) 22:52
2025-06-18,01:08,TTL,総合,37,Hint-Pot,エアコン代節約のための室外機対策　アルミ製カバーをプロが「おすすめしない」理由とは,https://news.yahoo.co.jp/articles/c22a4597a9a49c0b3c18e96ef2bb6cb575e1bad2,6/16(月) 7:31
2025-06-18,01:08,TTL,総合,38,Full-Count,「彼にしかわからない」大谷翔平の復活への道　エ軍の元監督が語った1イニング限定の”真意”,https://news.yahoo.co.jp/articles/ccbfcff2477324e212c54ee588903d91ec552c92,6/17(火) 21:39
2025-06-18,01:08,TTL,総合,39,ABEMA TIMES,森口博子、車いす姿で57歳の誕生日を報告「そんな年には見えない」「痛々しい」などの反響,https://news.yahoo.co.jp/articles/7aa160ebc580e8acb11df0f829dd1cb146915020,6/17(火) 8:33
2025-06-18,01:08,TTL,総合,40,スポニチアネックス,カズレーザー　現金一律2万円給付の自公案に「消費税減税よりもプラスになる人が結構いるのかなあと」,https://news.yahoo.co.jp/articles/bd821a16b40b272c874d609afcfd8188e7d77af3,6/16(月) 11:10
