scrp_date,scrp_time,genre_en,genre_jp,rank,media_jp,title,link,date_original
2025-11-02,03:08,sports,スポーツ,1,スポーツ報知,ドジャースのベッツ、第７戦での大谷翔平を予言「ショウヘイの人生はまるで運命」,https://news.yahoo.co.jp/articles/0a4133d3e4c555aa8c10c1d63a74dc831f071f84,11/1(土) 18:12
2025-11-02,03:08,sports,スポーツ,2,ABEMA TIMES,何してんの…？ 山本由伸、目を疑う“まさかの光景”「すげえ」ベンチで行動が話題に「流石すぎる」「これぞエース」,https://news.yahoo.co.jp/articles/ff675095bf3f06b7b5b667b41817561549e96726,11/1(土) 22:30
2025-11-02,03:08,sports,スポーツ,3,デイリースポーツ,巨人戦力外　元ドラ１の３０歳が退団を報告「沢山の事を学び経験させていただきました！」感謝つづる,https://news.yahoo.co.jp/articles/0809c68970025dc87f98c7d633c8645dfab50c16,11/1(土) 22:19
2025-11-02,03:08,sports,スポーツ,4,RONSPO,大谷翔平が運命の第7戦に中3日で先発へ…NYポスト、ESPNなど米複数メディアが報道…その根拠とは？,https://news.yahoo.co.jp/articles/c2e1abea8bec350aada7c6c68db3c820f8d5c5f0,11/1(土) 21:33
2025-11-02,03:08,sports,スポーツ,5,Full-Count,山本由伸は「本物のプロ」　ベンチで映った「他の投手はやらない」行動…米称賛,https://news.yahoo.co.jp/articles/7dc1e2ba0b107a09999fa2d3f6f7ae4b562c508d,11/1(土) 21:07
2025-11-02,03:08,sports,スポーツ,6,スポニチアネックス,高橋慶彦氏　“カープが獲ったら面白い”と熱望する他球団戦力外の40歳外野手「勉強になる」,https://news.yahoo.co.jp/articles/e8111dc0abda8f97dd69fa00e21fd5180a63801e,11/1(土) 21:35
2025-11-02,03:08,sports,スポーツ,7,スポニチアネックス,ドジャース・由伸の魅力をカーショーが熱弁「ヤマのフォームは完璧」「息子にも最高のロールモデル」,https://news.yahoo.co.jp/articles/cc84dd7cb5a0259ecf144d1a79e8da389d4e7690,11/2(日) 1:30
2025-11-02,03:08,sports,スポーツ,8,スポーツ報知,広島・スキッベ監督　今季限りで退任か　日本でタイトル２つ獲得のドイツ人指揮官に国内外クラブが注目,https://news.yahoo.co.jp/articles/4dabf5bb0e1db49396b7e98312ee6ed81150a903,11/2(日) 2:00
2025-11-02,03:08,sports,スポーツ,9,サンケイスポーツ,大谷翔平が中3日で先発へ…トロントで新伝説　勝率高める合理的な判断が『先発二刀流』　21世紀初WS連覇へ…今季最終戦のボール託す,https://news.yahoo.co.jp/articles/7ee2ec4c797b8477f6322a758011fc386050aae9,11/1(土) 23:30
2025-11-02,03:08,sports,スポーツ,10,中日スポーツ,「俺はWSで素晴らしい投球をしているのに、山本由伸の影を踏めない」Bジェイズ・ガウスマン、6回3失点も第2戦に続き投げ負け　米メディアも同情「野球は残酷」,https://news.yahoo.co.jp/articles/de9ca804e003dd96eacb365789bd9e8a8108e4fc,11/1(土) 18:42
2025-11-02,03:08,sports,スポーツ,11,Full-Count,佐々木朗希の“悲劇”「明かな誤審」　LAメディア怒り心頭「流れを変える可能性」,https://news.yahoo.co.jp/articles/046579e10c59f9ac06a60dff6ad9d3059f56175f,11/1(土) 18:41
2025-11-02,03:08,sports,スポーツ,12,スポニチアネックス,阿部葉太　横浜高校野球部初の早大合格！ドラ1級の実力も東京六大学へ　村田監督「新たな歴史を」,https://news.yahoo.co.jp/articles/167b0c22df42e70b5c37017ac2d34af2a9f02f1e,11/2(日) 1:30
2025-11-02,03:08,sports,スポーツ,13,スポーツ報知,大谷翔平はギリギリの状態か　点滴打って強行出場、米報道「脱水症状気味では…」,https://news.yahoo.co.jp/articles/2e371ba2deaa11659a434eb87f399091d39a17e4,11/1(土) 14:00
2025-11-02,03:08,sports,スポーツ,14,VITUP!,横川尚隆が衝撃のFWJボディビルデビュー　圧巻のインプルーブで初戦制覇,https://news.yahoo.co.jp/articles/8ffb5140648660aca8390f4de2f679f51572a970,11/1(土) 20:33
2025-11-02,03:08,sports,スポーツ,15,テレ東スポーツ,ロバーツ監督「全員が登板可能だがヤマモトは除く」山本由伸の第7戦登板回避を明言「彼はもう限界まで投げてきた。今夜すべてを出し切った」,https://news.yahoo.co.jp/articles/4efa189063ad363f06cb8d58e4c776fcb10e4d9e,11/2(日) 2:26
2025-11-02,03:08,sports,スポーツ,16,スポーツ報知,大谷翔平が運命の第７戦で先発登板決定、球団発表　球団史上初の快挙へ気合の中３日で登板,https://news.yahoo.co.jp/articles/7eff54e380ac23162a375342ae2d98f89ea4a270,11/2(日) 2:32
2025-11-02,03:08,sports,スポーツ,17,スポーティングニュース日本版,ブルージェイズの救援投手陣がWS第6戦で欠場中のドジャース投手へ思いを伝えたアクションとは,https://news.yahoo.co.jp/articles/e7c3efbb0f57a0ca87875a091c0f40929fb23181,11/2(日) 0:32
2025-11-02,03:08,sports,スポーツ,18,デイリースポーツ,劇的幕切れ　ドジャース専属カメラマンが捉えた“ベストショット”公開　「最高の瞬間」と反響,https://news.yahoo.co.jp/articles/8444526b1090cd6575b710db72831ff2ed7c4c00,11/1(土) 21:49
2025-11-02,03:08,sports,スポーツ,19,デイリースポーツ,紀平梨花　緊張のアイスダンス初披露「ドキドキだったが良かった」西山真瑚とのペアで２位発進　演技後は安どの笑み,https://news.yahoo.co.jp/articles/938382d8446b397ede80fe2cfdc7774b4a3d3521,11/1(土) 22:35
2025-11-02,03:08,sports,スポーツ,20,CoCoKARAnext,「ヤマモトは本当に優秀なピッチャーだよ」敵将も称えた山本由伸2戦連続の“快投”　6回降板で「我々に有利になるだろうと」,https://news.yahoo.co.jp/articles/9a821a607b02c5f16dadee8e3773096e69742529,11/1(土) 16:20
2025-11-02,03:08,sports,スポーツ,21,スポニチアネックス,紀平梨花「ドキドキ」アイスダンス初披露も観衆スタオベ！1043日ぶり競技会で2位発進「楽しく滑れた」,https://news.yahoo.co.jp/articles/505dba286d5cc45768a5d3644b08f85b1a238491,11/1(土) 22:30
2025-11-02,03:08,sports,スポーツ,22,スポーティングニュース日本版,「思考は一切働かなかった」ドジャース・グラスノーが“ゾーン”状態に!? WS第6戦、3球セーブの裏側明かす,https://news.yahoo.co.jp/articles/b3de27f30ae8c7349d91357f3e402feca73db624,11/2(日) 2:00
2025-11-02,03:08,sports,スポーツ,23,スポニチアネックス,ドームならでは…ブルージェイズ本拠の両翼ポールが金属製ではなく「網」である理由,https://news.yahoo.co.jp/articles/e69c72aa99bf93848f29ccf90f1f9bb57ed7a933,11/2(日) 1:30
2025-11-02,03:08,sports,スポーツ,24,スポニチアネックス,大谷翔平　勝てばWS連覇の大一番でリアル二刀流「1番・投手兼DH」で先発　自身初中3日でマウンドへ,https://news.yahoo.co.jp/articles/a61ad07f12c4f1b70546942e32276b22b0a5de59,11/2(日) 2:40
2025-11-02,03:08,sports,スポーツ,25,中日スポーツ,ベッツ、山本由伸絶賛「ヨシはヨシ」、「なぜあの契約かを証明した」…打順”降格”で意地の２点適時打「みんなでリング取る」,https://news.yahoo.co.jp/articles/1a61a9ae5795fbb8aefa74fc26a8840850c76e8a,11/1(土) 15:36
2025-11-02,03:08,sports,スポーツ,26,中日スポーツ,大谷翔平、決戦の第7戦先発へ、グラスノー＆スネルのリレーか…”黄金の先発陣”で世界一掴む、完全否定できない中0日の山本起用,https://news.yahoo.co.jp/articles/873f307fe1667752dd0f23f2bedc1ac2175e4414,11/1(土) 18:09
2025-11-02,03:08,sports,スポーツ,27,テレ東スポーツ,【天皇賞・秋 見どころ】秋の府中の新名物・世代交代の争いを制するのは,https://news.yahoo.co.jp/articles/67aeffa00530c385d2eb698e1efda5bb19b34490,11/2(日) 1:48
2025-11-02,03:08,sports,スポーツ,28,Full-Count,Bジェイズにまで広がった“粋な計らい”　中継に映ったさりげない51…日本でも感激「涙出た」,https://news.yahoo.co.jp/articles/b9a1de1757b0641b4f1bc98ef59bfa32ad2e80b7,11/1(土) 20:12
2025-11-02,03:08,sports,スポーツ,29,Full-Count,大谷翔平、WS第7戦で先発登板決定　球団発表…今世紀初のWS連覇へ中3日で投打二刀流,https://news.yahoo.co.jp/articles/d2c699715c58ed947817e13c6facce3322acdce0,11/2(日) 2:28
2025-11-02,03:08,sports,スポーツ,30,Full-Count,山本由伸に鳴りやまぬ称賛「まさに一流」　ド軍を救う96球に米メディア脱帽「圧倒的だ」,https://news.yahoo.co.jp/articles/4b3792f06ba7156b0e8e3412b22acdea6788a70a,11/1(土) 16:36
2025-11-02,03:08,sports,スポーツ,31,Full-Count,まさかの飛び出し、崩れ落ちるBジェイズ主砲　9回攻防で一体何が？…試合後に明かした胸中,https://news.yahoo.co.jp/articles/a2208a7bcf4339b8cd3219531745289a0ea835b8,11/1(土) 15:58
2025-11-02,03:08,sports,スポーツ,32,Full-Count,山本由伸がいなかったら…541HRオルティズ絶賛「私のMVPだ」　“救世主”に称賛の嵐,https://news.yahoo.co.jp/articles/eff60baa2275f1e41b8426d1d6721edb4a2f7ddf,11/1(土) 21:30
2025-11-02,03:08,sports,スポーツ,33,デイリースポーツ,苦しむベッツの言葉にレジェンドが反応「言わせてくれ。『自分が良くなかった』なんて言うのはやめなよ」熱く語りかける,https://news.yahoo.co.jp/articles/1620a543b63de15959dc7cbbce0e438d728b804c,11/1(土) 23:51
2025-11-02,03:08,sports,スポーツ,34,GOAL,絶好調アーセナル、公式戦9連勝＆7試合連続無失点！得意のCKも炸裂で今節も首位キープ,https://news.yahoo.co.jp/articles/a9a41419eb44074f0377daf62a073b71dc9c587d,11/2(日) 1:57
2025-11-02,03:08,sports,スポーツ,35,日刊スポーツ,大谷翔平は２位、山本由伸は３位　ワールドシリーズMVP予想を米メディアが特集,https://news.yahoo.co.jp/articles/2d70cd491e030e5dcf1e3e3beed4b3d913f8350c,10/31(金) 13:31
2025-11-02,03:08,sports,スポーツ,36,Full-Count,元鷹40歳がくふうハヤテ退団を報告　異例の現役復帰も…今後は未定「もう少し時間をかけて」,https://news.yahoo.co.jp/articles/bdb467614f9fa42adab652d1654ca4ce896dfc95,11/1(土) 17:07
2025-11-02,03:08,sports,スポーツ,37,theWORLD（ザ・ワールドWeb）,レアル入りしたアーノルドにスペイン語を教えたのは誰？　7カ国語を操るフォロワー37万人の美人講師に注目集まる,https://news.yahoo.co.jp/articles/9d5f7d308ed2c07ea44b73ab96bea49db4db76e8,11/1(土) 23:40
2025-11-02,03:08,sports,スポーツ,38,GOAL,C・パレス、ブレントフォード撃破でリーグ4試合ぶり白星も…鎌田大地が終盤に負傷交代,https://news.yahoo.co.jp/articles/2debd4a9e138d78219465d4668345b0edb1cd696,11/2(日) 1:53
2025-11-02,03:08,sports,スポーツ,39,デイリースポーツ,【天皇賞】馬場から浮上するのはこの馬だ,https://news.yahoo.co.jp/articles/5931688b50111d74a2cde7cd795d7504ca0d4ed7,11/1(土) 19:29
2025-11-02,03:08,sports,スポーツ,40,日テレNEWS NNN,山本由伸の好投を相手選手たちも称賛「あれだけの金額で契約した理由がよく分かる」「正直“嬉しい”と言えないが…心から尊敬」,https://news.yahoo.co.jp/articles/70628d8bfdad06446da38f2213a067c525752faa,11/1(土) 20:00
