scrp_date,scrp_time,genre_en,genre_jp,rank,media_jp,title,link,date_original
2025-09-28,16:06,domestic,国内,1,スポニチアネックス,ひろゆき氏　英語で質問　コロンビア大院卒進次郎氏“逃げた”　ハーバード大院卒の茂木氏、林氏は回答,https://news.yahoo.co.jp/articles/7ca0694a3c8c915b43fbf183d68eb73835895499,9/28(日) 5:30
2025-09-28,16:06,domestic,国内,2,日刊スポーツ,へずまりゅう氏、家族の死去を報告「もう絶対に悪い道には戻りません」,https://news.yahoo.co.jp/articles/163bdb1a7326069a8e83964ecddd49ea8116eea9,9/28(日) 7:12
2025-09-28,16:06,domestic,国内,3,日刊スポーツ,【総裁選】高市早苗氏、ステマ問題発覚後初の小泉進次郎氏と顔合わせ「当事者」の感想問われ…,https://news.yahoo.co.jp/articles/86d6f0f1a10a9f7ebc085db8f7870c760e3b6e42,9/28(日) 12:58
2025-09-28,16:06,domestic,国内,4,スポニチアネックス,ひろゆき氏　総裁選5候補に英語で質疑応答求める　すべて日本語返答の候補に「大和魂的な…」,https://news.yahoo.co.jp/articles/72a42df804ce153ada4420ae901184f49870a8cc,9/27(土) 21:24
2025-09-28,16:06,domestic,国内,5,日刊スポーツ,堀江貴文氏、絶縁状態ひろゆき氏MCの自民党総裁選討論番組について聞かれ“一言”で返答,https://news.yahoo.co.jp/articles/04fcd1251a4aa49d5cfaf2c811687d804ce4e639,9/24(水) 8:11
2025-09-28,16:06,domestic,国内,6,東海テレビ,下痢や発熱等…日本料理店の弁当など食べた16人に食中毒症状 原因となったメニューは不明も店に営業禁止処分,https://news.yahoo.co.jp/articles/950a1633dd1535aa599c5298870f0aada8384766,9/28(日) 13:52
2025-09-28,16:06,domestic,国内,7,日刊スポーツ,蓮舫氏が進次郎氏陣営ステマ問題に初言及「勝つための異常な熱があったとすればその時点でもう」,https://news.yahoo.co.jp/articles/95cebde48375088ed5e1bf0711c995eab6b4eead,9/28(日) 13:32
2025-09-28,16:06,domestic,国内,8,デイリースポーツ,【ポスト石破】まさか順位逆転　元日テレ・青山氏が総裁選順位予想をＴＶ公表　ステマ直撃で小泉氏墜落危機と　「この問題を甘く見たら」,https://news.yahoo.co.jp/articles/76c34138dfdd84fff17b66d5ab116bb5e82183ed,9/27(土) 19:47
2025-09-28,16:06,domestic,国内,9,読売新聞オンライン,万博とは異なる景色広がる「ニシヨドスタン」、多くのパキスタン人が住む地域を記者が取材…対立あおるSNSの誤情報,https://news.yahoo.co.jp/articles/cbbfd417c9354e6abfac87cff556db87175ae790,9/28(日) 9:13
2025-09-28,16:06,domestic,国内,10,共同通信,来場者2200万人到達　大阪・関西、愛知万博超え確実,https://news.yahoo.co.jp/articles/de8d1bdee46d8ec01d09eedf2e2542bd38aeda16,9/28(日) 10:43
2025-09-28,16:06,domestic,国内,11,日刊スポーツ,文筆家の女性モデル「ださい、ですね」　総裁選、小泉進次郎農相陣営の「ステマ問題」に一言,https://news.yahoo.co.jp/articles/7de8b0c5b7e94ae88df777ea1af0b6f23ec78b7d,9/28(日) 12:30
2025-09-28,16:06,domestic,国内,12,TBS NEWS DIG Powered by JNN,天皇皇后両陛下　滋賀県に到着　「国民スポーツ大会」開会式へ　盲学校見学や盲導犬の説明受けられる場面も,https://news.yahoo.co.jp/articles/df9ba7641d8c9c9cc37ced34438eb0cb67ca8ea4,9/28(日) 12:55
2025-09-28,16:06,domestic,国内,13,日刊スポーツ,【総裁選】ひろゆき氏「英語で」ムチャぶりも…候補２人は拒否　日本語返答に「大和魂」ツッコミ,https://news.yahoo.co.jp/articles/d8baf48ea1ba4a17ca755c4e723b61c446376e12,9/28(日) 12:24
2025-09-28,16:06,domestic,国内,14,デイリースポーツ,ネット騒然「ワロタ」「金は払わせろよ」吉村知事　万博批判→出禁騒動で因縁のラスボスを最後招待「公式でお越しください。僕が案内します」　「マジで激アツ展開」「名指しｗ」,https://news.yahoo.co.jp/articles/3ea8a84516166e4f0cb59f235888dd119f861c3b,9/21(日) 14:58
2025-09-28,16:06,domestic,国内,15,毎日新聞,京都JA会長、国税局処分に不服申し立て　3億円申告漏れ指摘,https://news.yahoo.co.jp/articles/9b6c881e9cbb955de15b838af5a78c3ed48114c2,9/28(日) 10:59
2025-09-28,16:06,domestic,国内,16,東海テレビ,入口近くのガラス突き破る…60代男性運転の車がコンビニに前から突っ込む 店内に客おらず店員も無事,https://news.yahoo.co.jp/articles/10aa0ebf2121c1c478424669f6a42c6de1eb2d0f,9/28(日) 12:15
2025-09-28,16:06,domestic,国内,17,よろず～ニュース,蓮舫氏「ステマ。」と進次郎氏陣営の指示問題に言及 「誰もやめた方がいいと言わなかったのでしょうか」,https://news.yahoo.co.jp/articles/229ea613b1c45689fddf37d92540e1d4e24cd08c,9/28(日) 15:06
2025-09-28,16:06,domestic,国内,18,スポーツ報知,「書かれている内容がホント気持ち悪い…どうにもならねぇな」…小泉進次郎氏「陣営」投稿依頼問題…「サンジャポ」杉村太蔵が憤慨,https://news.yahoo.co.jp/articles/e884cdf574efcdd2250eb5a8eb7928066f8a0755,9/28(日) 10:30
2025-09-28,16:06,domestic,国内,19,デイリースポーツ,【ポスト石破】橋下氏　高市早苗氏に砲撃「民主国家の政治家としてダメ」　僕も直接聞いた「総理で靖国」曖昧→「これで行ったら選挙で嘘ついた総理になる」言えばいいと,https://news.yahoo.co.jp/articles/260b5901fb6ad0b2f71e89ac5a24863f40ba77ec,9/27(土) 20:40
2025-09-28,16:06,domestic,国内,20,日刊スポーツ,杉村太蔵氏「ほんっと気持ち悪い」小泉氏陣営の「ステマ問題」に「どうにもならねえな」酷評,https://news.yahoo.co.jp/articles/807ac2e31e0e421eb71fb42ef0cebcedd124d806,9/28(日) 11:04
2025-09-28,16:06,domestic,国内,21,毎日新聞,両陛下が滋賀入り　国民スポーツ大会開会式出席へ　盲学校見学も,https://news.yahoo.co.jp/articles/e758d80eb754320fbcfdb8c3e38fe2c1fcd27e4e,9/28(日) 12:34
2025-09-28,16:06,domestic,国内,22,産経新聞,「自分以外で総理になってほしい人は？」手が止まる4候補　林芳正氏だけは…総裁選討論会,https://news.yahoo.co.jp/articles/66eb53b61423946062a531cae700c63100743f60,9/28(日) 7:00
2025-09-28,16:06,domestic,国内,23,よろず～ニュース,吉村洋文氏 万博黒字化目安の来場者数2200万人突破に「やって良かった」「開幕前は全メディアから詰められた」,https://news.yahoo.co.jp/articles/dbe509f084396e729f7477f5d967959d0e13b1f1,9/28(日) 15:40
2025-09-28,16:06,domestic,国内,24,TBS NEWS DIG Powered by JNN,細川護煕元総理が語る“非自民連立”　野党共闘の作法とは?「大きな旗を立てねばならない!」8党派連立から30年余り新たな連立は…【サンデーモーニング】,https://news.yahoo.co.jp/articles/193d310d3a11623db3320065eb3f36b0f7ffe811,9/28(日) 14:31
2025-09-28,16:06,domestic,国内,25,日刊スポーツ,【総裁選】高市早苗氏「生まれ変わったら女優」「阪神応援すれば別人」フジ候補者討論で横顔紹介,https://news.yahoo.co.jp/articles/c85fc4efe0578b4a6ea6bc45219d74e2dd558657,9/28(日) 15:21
2025-09-28,16:06,domestic,国内,26,日テレNEWS NNN,【速報】「ゲームしたいね。会う？」女子児童にSNSで連絡し連れ出しか、男子大学生を逮捕　未成年者誘拐容疑　千葉県警,https://news.yahoo.co.jp/articles/d995588ee9e7ea9be20f22fa9f2c4fb130fbf60a,9/28(日) 12:46
2025-09-28,16:06,domestic,国内,27,FNNプライムオンライン,ワンボックスカーが猛スピードで突進…ゴミ収集車も巻き込み2人病院搬送　カメラが捉えた事故の瞬間　静岡市,https://news.yahoo.co.jp/articles/ba0520b3fbdc4f1227fd7ef29b4eb0b34cb27935,9/28(日) 13:01
2025-09-28,16:06,domestic,国内,28,読売新聞オンライン,81歳男が自宅を訪れた近所の女性の首を包丁で切りつけ、殺人未遂容疑で逮捕…女性は逃げ出して110番,https://news.yahoo.co.jp/articles/52856f88e5cb749430875f3c16191b69c083314b,9/28(日) 13:40
2025-09-28,16:06,domestic,国内,29,J-CASTニュース,話題の「サンマをゆでて食べる」料理法、「ゴゴスマ」スタジオでも試食　割れるゲストの反応,https://news.yahoo.co.jp/articles/08a5a53a6ba076815baa8584d7ebba09eafc6ad6,9/28(日) 14:16
2025-09-28,16:06,domestic,国内,30,共同通信,JA京都会長が税逃れ否定　国税局の処分に不服、審査請求,https://news.yahoo.co.jp/articles/09956e4d4e3031369d335eab3bf67736fb18126e,9/28(日) 15:12
2025-09-28,16:06,domestic,国内,31,東海テレビ,車5台が絡む多重事故に…飲酒運転で追突し2人にケガさせた危険運転致傷の疑い 31歳男を逮捕「覚えていない」,https://news.yahoo.co.jp/articles/73046b96c2abc2573244406234e8dcb6dc245595,9/28(日) 12:19
2025-09-28,16:06,domestic,国内,32,スポーツ報知,大阪・関西万博で世界のミャクミャク展開催予定　関係者が個性＆感性を生かしてペイント,https://news.yahoo.co.jp/articles/e2163a991abf013b09f8caac36d3916581e43382,9/28(日) 14:56
2025-09-28,16:06,domestic,国内,33,読売新聞オンライン,大学授業料無償化に「3浪の壁」、おかしくない？…「若者が挑戦する機会奪う恐れがある」との指摘も,https://news.yahoo.co.jp/articles/f0f3da22b7989e987e9fd3dcd1828158afb58564,9/28(日) 9:35
2025-09-28,16:06,domestic,国内,34,FNNプライムオンライン,「うわ!!」首都高でバスに衝突した“鳥”が目の前に落下し急ブレーキ　「通話中で気づかず?」“すれ違いざま”積荷接触のトラックが当て逃げ,https://news.yahoo.co.jp/articles/9fcaac9b3d18a8c05e24be2e2a14782a34aa36de,9/28(日) 12:31
2025-09-28,16:06,domestic,国内,35,朝日新聞,虐待容疑の両親、死亡した2歳娘を1人で残したびたび外出か　和歌山,https://news.yahoo.co.jp/articles/23d53973e0361cb1f6549a5ddecfc7314765c427,9/27(土) 17:51
2025-09-28,16:06,domestic,国内,36,スポニチアネックス,高市早苗氏　ひろゆき氏から“ステマ投稿”ツッコまれる「憎み合ってどうするという…」,https://news.yahoo.co.jp/articles/00fae9299659faee14f71d31206b726dec068a53,9/27(土) 19:46
2025-09-28,16:06,domestic,国内,37,読売新聞オンライン,上野賢一郎・衆院議員の元公設秘書、公民権停止中の参議院選挙で「よろしく」…公選法違反で罰金30万円,https://news.yahoo.co.jp/articles/ca5ba4317aaf1a88f2fca71dad0756b08d9d439e,9/28(日) 14:34
2025-09-28,16:06,domestic,国内,38,よろず～ニュース,突如現れた「巨大な火の玉」これって隕石？西日本の夜空が白昼に変わったワケ【天文学者が解説】,https://news.yahoo.co.jp/articles/6a03190885d5b1a528826bc789d50cbf2201842c,9/28(日) 12:10
2025-09-28,16:06,domestic,国内,39,弁護士JPニュース,夏の災害派遣、自衛官の「入浴事情」とは？　被災者用の風呂には入れないが…元隊員が“天国”と感じた場所,https://news.yahoo.co.jp/articles/3a45911ecb08e6d98c5e7f8c63c1887002dc88ce,9/28(日) 10:20
2025-09-28,16:06,domestic,国内,40,デイリースポーツ,【ポスト石破】橋下氏　小泉ステマ「これ芸能人ならタレント生命終了」民間なら完全アウト！　ステマより＜＜＜高市氏悪口を謝罪してる進次郎氏、大丈夫か！？　玉木代表「国政選挙でもやってるのか？」,https://news.yahoo.co.jp/articles/866e58818e809640f7acf1c36ce98aab277eb3b2,9/27(土) 22:08
