scrp_date,scrp_time,genre_en,genre_jp,rank,media_jp,title,link,date_original
2024-01-17,13:22,local,地域,1,北國新聞社,滑川市長が炊き出し準備　１人で参加、ＳＮＳで反響,https://news.yahoo.co.jp/articles/8f9a06efccf8c29578fd45f401424f9989c8ab79,1/17(水) 8:01
2024-01-17,13:22,local,地域,2,MBSニュース,「30センチ必要なのに厚さたったの3センチ」トンネルに空洞…コンクリ不足で施工不良　施工会社が謝罪　現場所長「自分はトンネル工事の専門家」和歌山・八郎山トンネル,https://news.yahoo.co.jp/articles/d45e183ad1919ce9f2ce0bc8a88a99975f983a97,1/17(水) 11:00
2024-01-17,13:22,local,地域,3,チューリップテレビ,「生まれてきてよかった」難病・顔面動静脈奇形の河除静香さん　見た目の悩みを乗り越え“この顔だからこそできること”,https://news.yahoo.co.jp/articles/5f32ad8c7361f3468d49d887a92dd016dc9ddc4f,1/16(火) 21:09
2024-01-17,13:22,local,地域,4,北國新聞社,志賀で震度５弱,https://news.yahoo.co.jp/articles/1258608dfae40bcbfcfb72ab6b4b2cf7beaaa940,1/17(水) 8:01
2024-01-17,13:22,local,地域,5,北日本新聞,心に届く炊き出しを　滑川の有志が下ごしらえ、１４日から能登町で１６００食分提供,https://news.yahoo.co.jp/articles/65ae25eebb1de6ce76a13828da4ddc0be773065c,1/14(日) 6:41
2024-01-17,13:22,local,地域,6,YBS山梨放送,空飛ぶバイクの開発企業が破産開始 負債総額は11億6000万円超 山梨県,https://news.yahoo.co.jp/articles/80285a3c01273d4acce97edc45b40173f1804662,1/16(火) 22:21
2024-01-17,13:22,local,地域,7,テレビ静岡NEWS,Jリーグ静岡県勢の今季を注目数字で展望！　藤枝30・磐田40・沼津50・清水200,https://news.yahoo.co.jp/articles/9f9967e124f488c0fbd59070ac29ca7c3b6ada0c,1/17(水) 12:20
2024-01-17,13:22,local,地域,8,信濃毎日新聞デジタル,1枚のメモが証拠に　夫の死後分かった20年以上もの年金支給漏れ　問題発覚化後も国から上乗せ分救済されず,https://news.yahoo.co.jp/articles/552977aab779e6ef362e501e6223caffa2ed6f8e,1/17(水) 11:33
2024-01-17,13:22,local,地域,9,埼玉新聞,集団暴行した不良グループ、また凶器を持って20人集結　縄張りで集まった男性9人発見され、2人がバイクで逃げる　　2人は“コルク”かぶっていたので呼び戻され暴行、骨折など重傷　特定された不良8人逮捕、解体工ら16～18歳,https://news.yahoo.co.jp/articles/62d3eb9dffe1267214834deb7b74181da4d1d303,1/17(水) 10:07
2024-01-17,13:22,local,地域,10,FBS福岡放送,1キロにわたりパトカーから逃走　縁石に乗り上げ「すみません。飲酒運転です」　福岡,https://news.yahoo.co.jp/articles/7068747d0ad37dc082d3afddb9a615942949fe38,1/17(水) 9:34
2024-01-17,13:22,local,地域,11,あなたの静岡新聞,御殿場西高野球部・森下知幸監督が死去　常葉菊川高率い、センバツV　62歳,https://news.yahoo.co.jp/articles/e495f729d5e188de9085ab616d0ccc596be104aa,1/17(水) 11:14
2024-01-17,13:22,local,地域,12,広島テレビ　ニュース,【事故】高齢女性がはねられ　意識不明の重体　広島市中区,https://news.yahoo.co.jp/articles/3ff3484c4d654294081a4fc5a5ea947e1d4755c6,1/17(水) 12:33
2024-01-17,13:22,local,地域,13,埼玉新聞,男性死亡…トラックの荷台から転落、フォークリフトのフォーク部分に腹を打つ　会社を書類送検　荷物を積む作業中の悲劇、搬送先で息を引き取る,https://news.yahoo.co.jp/articles/22cfabd3ce7508fecfa44cbcc7dd1417cfe66a35,1/17(水) 8:02
2024-01-17,13:22,local,地域,14,千葉日報オンライン,【速報・追記あり】外国人の生活保護認めず　千葉地裁「受給権有しない」,https://news.yahoo.co.jp/articles/3babfa804a0abdbb12d102cd804fdb5d789cd37b,1/16(火) 15:17
2024-01-17,13:22,local,地域,15,MRO北陸放送,住宅6棟が焼ける 火元の50代男性がやけど 石川・野々市市,https://news.yahoo.co.jp/articles/4ae2f689b9ab3a79bf9f0ca538e7d464dd2b5b42,1/17(水) 11:46
2024-01-17,13:22,local,地域,16,チューリップテレビ,10代の少女に裸の写真を送信させた疑い　富山市の33歳の男を逮捕　,https://news.yahoo.co.jp/articles/2bdb39dfc8f46c9a77ce5823eff214f5c50fc195,1/17(水) 12:02
2024-01-17,13:22,local,地域,17,OBS大分放送,重要指名手配の八田與一容疑者 情報提供4000件超え 一般社会に溶け込み潜伏か…引き続き“関東”で目撃情報増加,https://news.yahoo.co.jp/articles/f26ed3a487dbd8416131805fddd86293972fa792,1/9(火) 15:31
2024-01-17,13:22,local,地域,18,STVニュース北海道,当時13歳未満の少女に睡眠導入剤を飲ませてわいせつ行為　39歳～55歳の男5人逮捕,https://news.yahoo.co.jp/articles/d8248b63b17298bc8499ee5aee64106ca0fdaf95,1/15(月) 20:00
2024-01-17,13:22,local,地域,19,神戸新聞NEXT,地震で両親奪われ「世界一不幸」になった小学生、29年を経て「幸せ」に　人々の支えと7年間の愛情に感謝,https://news.yahoo.co.jp/articles/bef2c0c6d088404fbedb82fd27d0884052a47946,1/17(水) 6:13
2024-01-17,13:22,local,地域,20,埼玉新聞,高校生4人を逮捕、住宅を襲撃…女性の口ふさぎ「金があるのは分かっている」、包丁を見せて暴行し5千円奪う　女性の親族が通報「家の中めちゃくちゃに」　4人は地元の知人同士で16～18歳,https://news.yahoo.co.jp/articles/1203fff643989cd6f4686afbf1fb39a304fb7ac9,1/17(水) 8:35
2024-01-17,13:22,local,地域,21,TeNYテレビ新潟,高級食パン事業に参入するが不振　プールろ過装置取り付けなどを手がけていた会社が破産開始決定　負債5484万円《新潟》,https://news.yahoo.co.jp/articles/a217ec01523dffdc0df2be51bee37b4d7bfbda5f,1/17(水) 7:35
2024-01-17,13:22,local,地域,22,茨城新聞クロスアイ,茨城高・中の校舎に侵入　容疑で男を逮捕　県警水戸署,https://news.yahoo.co.jp/articles/cfecd67d03e9eca55aea2b337543f314a8b40a41,1/17(水) 12:02
2024-01-17,13:22,local,地域,23,熊本日日新聞,どんどやに神様降臨!?【Sカメ!】,https://news.yahoo.co.jp/articles/70724e6611c7cfa99e9cfa3ba7d07c5138dec246,1/17(水) 10:35
2024-01-17,13:22,local,地域,24,HOME広島ホームテレビ,マツダボンゴなど3車種「型式指定」取り消しへ　ダイハツ不正問題,https://news.yahoo.co.jp/articles/16f5b3a3fc9a239ce3b2c227b1a9da449ac38461,1/17(水) 11:57
2024-01-17,13:22,local,地域,25,テレビ静岡NEWS,“元側近”からの猛批判受けて軌道修正か？川勝知事「2037年までになるべく早く解決すればいい」　静岡,https://news.yahoo.co.jp/articles/d2d464b8ffc5fa973b1a8e7e46de50a5330a2747,1/17(水) 6:30
2024-01-17,13:22,local,地域,26,読売テレビ,家庭内暴力から逃れた母が母子寮で死亡…一家は離散し児童養護施設へ　29年を経て男性が伝えたい思い【阪神・淡路大震災から29年】,https://news.yahoo.co.jp/articles/87c2a76cb6d4cd2b11f935cb8614bcbe0fbe8373,1/17(水) 0:00
2024-01-17,13:22,local,地域,27,MBSニュース,【速報】奈良教育大付属小などが会見『授業の実施不足』『教科書の未使用』発覚　なぜ？「教員が独自の考えで実施、学習指導要領など省察なく」,https://news.yahoo.co.jp/articles/1d7e222b41e1461cdc0a31baf70544c84bb859a3,1/17(水) 10:00
2024-01-17,13:22,local,地域,28,tbc東北放送,市営バスが車と接触するなど「スリップ事故」少なくとも26件発生　仙台,https://news.yahoo.co.jp/articles/c3405bf940bd1900201c234e34c80c838989532e,1/17(水) 11:33
2024-01-17,13:22,local,地域,29,神戸新聞NEXT,特急電車内で体を触られた女子高生、スマホで後部座席に被害訴える　兵庫県警、容疑で54歳男逮捕,https://news.yahoo.co.jp/articles/bafcd6504769b87dbb2997b0bd0ed242905c0c1e,1/9(火) 9:18
2024-01-17,13:22,local,地域,30,北國新聞社,名勝「見附島」半分に　住民落胆「もう軍艦島じゃない」　能登半島地震で崩落,https://news.yahoo.co.jp/articles/b1df7ebea92d518e49543228c59994f5f9f1f9c7,1/15(月) 21:02
2024-01-17,13:22,local,地域,31,中京テレビＮＥＷＳ,名鉄が3月にダイヤ改正実施　セントレアへの利便性向上や地下鉄直通列車の輸送力見直しへ,https://news.yahoo.co.jp/articles/9675fa1c09f0bfb72f677889cb75fe1129b5bb3e,1/17(水) 11:36
2024-01-17,13:22,local,地域,32,RCC中国放送,「息子を救いたかった」生きる意味を見失った母親　息子からの“決意と感謝”の手紙に支えられ…生きた証と命の大切さを訴え続け,https://news.yahoo.co.jp/articles/d29260c0159b7dfc0593c59dc832c239e2ded2f1,1/17(水) 11:02
2024-01-17,13:22,local,地域,33,RKB毎日放送,「今から携帯作りに行こうか」無職男性に契約させて脅し取った疑い、工藤会傘下の組員を逮捕,https://news.yahoo.co.jp/articles/a8211835ca67f565629f225db7be8448c08ec68d,1/17(水) 12:13
2024-01-17,13:22,local,地域,34,神戸新聞NEXT,がれきの中から見つかった1歳長女「抱いたらほんのり温かく」　義母と犠牲に「悲しみ消えない」,https://news.yahoo.co.jp/articles/e312b9cceac258d3fd924d4b862e4b14dc867520,1/17(水) 12:20
2024-01-17,13:22,local,地域,35,NBS長野放送,「娘を本当に愛していたのか、あなたは…」　28歳男「駆け落ちしよ」と女子高校生を誘い出す　両親「生死わからず、内臓をえぐり出されるような心の痛み」　被告は涙ながらに謝罪…懲役2年求刑,https://news.yahoo.co.jp/articles/76501673ee041ddc80166aa58c948e0d18e05f86,1/16(火) 21:40
2024-01-17,13:22,local,地域,36,千葉日報オンライン,一部存続では「満足できない」　市原市長、京葉線快速の現状維持訴え　「元に戻す努力継続」,https://news.yahoo.co.jp/articles/c5f763502b21229267e59981dde816e1d1b45990,1/17(水) 11:41
2024-01-17,13:22,local,地域,37,ＮＳＴ新潟総合テレビ,【続報】「新雪を滑りたかった」“コース外”滑走の県外スノーボーダー３人を救助　夜の救助活動に【新潟】,https://news.yahoo.co.jp/articles/62d3bb24e4ade5f6a3e69b93d496dcb577a3a7ad,1/17(水) 11:32
2024-01-17,13:22,local,地域,38,北海道ニュースUHB,【速報】新千歳空港で大韓航空とキャセイパシフィック航空の機体同士が接触…大韓航空機の左主翼とキャセイパシフィック機の垂直尾翼が接触か…大韓機の乗客ら289人にケガなし 燃料漏れ・火災等は確認されず,https://news.yahoo.co.jp/articles/5be36846cba78c6fd097addace29821ee471bd06,1/16(火) 18:39
2024-01-17,13:22,local,地域,39,神戸新聞NEXT,結婚は「つらいことも乗り越えられる」震災前日、母と交わした会話が最後に　「一緒に看護師に」その思いは孫へ,https://news.yahoo.co.jp/articles/943831d8f4f892f22819745a3c33fa041c39c274,1/17(水) 12:25
2024-01-17,13:22,local,地域,40,北國新聞社,輪島朝市で新たに死者１０人　能登半島地震　合計２３２人,https://news.yahoo.co.jp/articles/93ebb47fc467f61a0cef1e68ae2ebda53a846754,1/17(水) 10:31
