scrp_date,scrp_time,genre_en,genre_jp,rank,media_jp,title,link,date_original
2024-01-17,15:23,sports,スポーツ,1,サンケイスポーツ,大型インタビュー　ダルビッシュが大谷＆由伸のド軍移籍にショックを受けた理由とは…／中編,https://news.yahoo.co.jp/articles/9e6fac0ba1ae749c2c122cbb712444953185e91f,1/17(水) 12:00
2024-01-17,15:23,sports,スポーツ,2,スポニチアネックス,DeNAドラ1度会が衝撃150メートル弾！球団関係者「ドックで新人が最も飛ばした打球」と驚き,https://news.yahoo.co.jp/articles/99a78b0107fac7f1c9171135da8e62cfbd11925a,1/17(水) 14:20
2024-01-17,15:23,sports,スポーツ,3,デイリースポーツ,中日がキャンプ振り分け発表　主力の北谷組には根尾昂　中田、中島ら移籍組も【一覧】,https://news.yahoo.co.jp/articles/d220db92a5edcef3d238699b198c017002a84043,1/17(水) 13:14
2024-01-17,15:23,sports,スポーツ,4,デイリースポーツ,貴景勝が休場　頚椎症性神経根症　慢性的な首痛が悪化　再出場せず来場所８度目かど番　師匠「右腕に全然力が入りません、と」,https://news.yahoo.co.jp/articles/c40621e3947eaee77999de89604d6556afa2bc9b,1/17(水) 11:47
2024-01-17,15:23,sports,スポーツ,5,GOAL,サウジアラビアがアジア杯白星スタート！後半ATに劇的逆転弾…マンチーニ体制で臨む大会初陣、オマーンに勝利,https://news.yahoo.co.jp/articles/96456928be5a06ac86e0657a5359a5820b88ae05,1/17(水) 5:12
2024-01-17,15:23,sports,スポーツ,6,東スポWEB,【阪神】岡田監督〝ＦＡ人的補償〟問題に「今プロテクト可能なのは２８人やろ。そらしんどいよ」,https://news.yahoo.co.jp/articles/b26dc32939d3076288b149065b73c99954ed66c5,1/17(水) 11:16
2024-01-17,15:23,sports,スポーツ,7,スポーツ報知,【巨人】浅野翔吾がイチロー氏との合同自主トレを明かす「常に全力という話をしてもらった。一番自分の中で残っている」,https://news.yahoo.co.jp/articles/8ad6ce9c7b36d04b9d3e2668901d938db237cc01,1/17(水) 11:17
2024-01-17,15:23,sports,スポーツ,8,Full-Count,“就活中”の元DeNA助っ人、メジャーに居場所無しか…　米報道、失った首位打者の輝き,https://news.yahoo.co.jp/articles/8b458e024a36e914b53a4e70e8169780c2590f0a,1/17(水) 12:11
2024-01-17,15:23,sports,スポーツ,9,イーファイト,ジョリーが悪童レオにボコられる！元美人マネ清水も上着脱ぎ参戦も…,https://news.yahoo.co.jp/articles/54a042830d8875372e9c94c7814d933105074dbe,1/17(水) 11:54
2024-01-17,15:23,sports,スポーツ,10,スポニチアネックス,大相撲初場所　連日の著名人映り込みにネット沸く!「着物姿で可愛い」「若旦那もおるやん」と話題,https://news.yahoo.co.jp/articles/7c4ef87d331b1796d9af8d3dae3f8a06d0f073e9,1/16(火) 17:41
2024-01-17,15:23,sports,スポーツ,11,デイリースポーツ,巨人・阿部監督「メジャー式にしてもいい」　本塁打後のハイタッチ＆パフォについて持論「多いから待っている時もある」,https://news.yahoo.co.jp/articles/51f5c395245c8ff9f3c4c147ea6f2f8b902762a6,1/16(火) 18:40
2024-01-17,15:23,sports,スポーツ,12,Full-Count,大谷翔平ら共闘で「勝てる」　複数年契約を希望も…通算159発男が1年勝負を選んだ理由,https://news.yahoo.co.jp/articles/27b03635049a6ce56c731a80310d6c3e1612df57,1/17(水) 11:54
2024-01-17,15:23,sports,スポーツ,13,スポニチアネックス,昨年の大阪杯覇者ジャックドール、屈腱炎で9カ月以上の休養　今後について藤岡師「オーナーと相談」,https://news.yahoo.co.jp/articles/615d0554647bb3ff0342f84ee8dcb76f0f61c975,1/17(水) 14:17
2024-01-17,15:23,sports,スポーツ,14,Full-Count,婚約翌日に知った大谷翔平の1030億円契約　エ軍の若手“衝撃”…同僚に即連絡「見たか？」,https://news.yahoo.co.jp/articles/0083dbfe7ed93703fb065ba5751e1549490ce8f2,1/17(水) 14:35
2024-01-17,15:23,sports,スポーツ,15,Full-Count,大谷翔平、止まらぬ“CMラッシュ”　“副収入”は74億円予想…企業に絶大な人気,https://news.yahoo.co.jp/articles/019f7fa43e9e763aa50501ae14cacfc105df1a48,1/17(水) 8:22
2024-01-17,15:23,sports,スポーツ,16,中国新聞デジタル,都道府県対抗男子駅伝の歴史に名を刻め！いざ区間新記録への挑戦　最注目は「花の1区」,https://news.yahoo.co.jp/articles/934986603ab6cd1780f1751c25124fb7f545ecc9,1/17(水) 13:05
2024-01-17,15:23,sports,スポーツ,17,サンケイスポーツ,大型インタビュー　ダルビッシュが独占激白　メジャーを超えるために日本球界へ提言／前編,https://news.yahoo.co.jp/articles/69e4ebff17d3d2abcb2eaa6fe20fe07985a68e58,1/16(火) 12:00
2024-01-17,15:23,sports,スポーツ,18,東スポWEB,久保建英所属のＲソシエダードが古橋亨梧を獲得へ　敏腕ロマーノ氏が指摘…すでに交渉中か,https://news.yahoo.co.jp/articles/4781b7dbae2a572722431e98070b4c455aecfb4a,1/17(水) 9:36
2024-01-17,15:23,sports,スポーツ,19,日刊スポーツ,レイズ上沢直之マイナー契約詳細が判明　契約金363万円、譲渡金は90万円　昇格なら上乗せも,https://news.yahoo.co.jp/articles/5b6dc9a13704306874d365b05c055bd18ae60767,1/17(水) 9:56
2024-01-17,15:23,sports,スポーツ,20,47NEWS,「大谷翔平はトロントに飛んだ」史上最高の１千億円契約、その直前に起きた大混乱の「内幕」　錯綜する情報、有力記者が大誤報、代理人の大勝負…記者が見ていた裏側,https://news.yahoo.co.jp/articles/08f52f67252e8da196c6cd271fcacd1a21e0be94,1/17(水) 10:02
2024-01-17,15:23,sports,スポーツ,21,RONSPO,なぜ19歳の福田師王が独ボルシアMGでトップチーム昇格の大抜擢を受けたのか？,https://news.yahoo.co.jp/articles/fe121a0c10877cb9a8742462ba6b266f7b306cee,1/17(水) 6:30
2024-01-17,15:23,sports,スポーツ,22,ABEMA TIMES,豊昇龍、大ピンチからの豪快すぎる投げ ふっ飛ばされた宇良の顔がびっくりすぎる「え？何が起きた？？」,https://news.yahoo.co.jp/articles/73af559303eb93b59355eb1256fb0ea8e2d1febf,1/17(水) 14:00
2024-01-17,15:23,sports,スポーツ,23,東スポWEB,エムバペ〝狂騒曲〟パリＳＧが契約延長へ年俸１６０億円オファー　レアルは年俸４８億円か,https://news.yahoo.co.jp/articles/9952c12b0c8360e2fc013bfce8d5f8d89051b1f5,1/17(水) 10:56
2024-01-17,15:23,sports,スポーツ,24,Full-Count,CM撮影にも帯同…大谷翔平の支え「横で見守る一平さん」　万能通訳が「オカンスタイル」,https://news.yahoo.co.jp/articles/f6c49f9441e9e660ac278b37fc3ea659735e155d,1/17(水) 8:58
2024-01-17,15:23,sports,スポーツ,25,東スポ競馬,【ＪＲＡ賞】例年を超えるレベルで「？」がついた〝少数票〟の背景　抜本的な改革を前に不可欠な〝有権者〟の知識,https://news.yahoo.co.jp/articles/c4c58f70b4f2a3cf9b694bbccaeca07ba24e5de9,1/17(水) 11:45
2024-01-17,15:23,sports,スポーツ,26,Full-Count,戦力外から2年…再起目指す元ドラ1　“涙の退団”で残り1人に、西武15年組の現在地,https://news.yahoo.co.jp/articles/d54ab340ba051795eefe96a9b20465427f900d49,1/17(水) 11:30
2024-01-17,15:23,sports,スポーツ,27,Full-Count,オリが獲得…自由契約にいた“お宝”「良い補強」　右腕が示した12球団断トツ「1.5％」,https://news.yahoo.co.jp/articles/bbc6b936eaf111a28d885e2e7c6b54b919f2ae62,1/17(水) 9:27
2024-01-17,15:23,sports,スポーツ,28,GOAL,トーマスには頼れない…アーセナルが1月の移籍市場で獲得する可能性のある6人のMF,https://news.yahoo.co.jp/articles/4590f7a81c3a6cb2a25ffa941741241bc1c70bc2,1/17(水) 14:00
2024-01-17,15:23,sports,スポーツ,29,西スポWEB OTTO！,ソフトバンク小久保監督12球団監督会議で提案　ベンチ内タブレット解禁＆育成選手の2軍戦出場枠緩和「全ては強いチームをつくるため」,https://news.yahoo.co.jp/articles/e802f5c594c2d0d959bc217296f8e9ff800eebf8,1/17(水) 8:02
2024-01-17,15:23,sports,スポーツ,30,イーファイト,ブラジルのMMAファイターが麻薬組織に射殺、シウバやピットブル兄弟が怒り,https://news.yahoo.co.jp/articles/eed6d34726c186a25cd8336866a91b5595903608,1/17(水) 12:17
2024-01-17,15:23,sports,スポーツ,31,Full-Count,退団の大谷翔平に「腹を立てるわけにはいかない」　エ軍左腕が本音…ド軍ユニは「奇妙」,https://news.yahoo.co.jp/articles/40030f50e6a0652b27525060fad78ea008b975f0,1/17(水) 12:55
2024-01-17,15:23,sports,スポーツ,32,REAL SPORTS,なぜFA移籍に「補償」が必要なのか？ ソフトバンク“狂騒の一日”で改めて問われた人的補償の意義,https://news.yahoo.co.jp/articles/102cddf262865bd923616a46c6dabec2e84c2d29,1/17(水) 11:56
2024-01-17,15:23,sports,スポーツ,33,西スポWEB OTTO！,オリックス山下舜平大が助っ人右腕へ惜別メッセージ　さっそく〝先生〟から返信「アメリカで会おう」,https://news.yahoo.co.jp/articles/1fc5fe9c697a52430e8ad888cc2f76177b5e1d29,1/17(水) 13:44
2024-01-17,15:23,sports,スポーツ,34,CoCoKARAnext,ドジャースが山本由伸に提示した“超大型契約”に元メッツGMが「私なら12年のオファーは提示しない」と語る理由とは？,https://news.yahoo.co.jp/articles/b9bacc16167c8bc382bab2a9b986c45b1607b4a0,1/17(水) 14:30
2024-01-17,15:23,sports,スポーツ,35,馬トク報知,昨年の大阪杯勝ち馬ジャックドールが故障　右前浅屈腱炎で９か月以上の休養の見込み,https://news.yahoo.co.jp/articles/663500244e31437b577d913321e92c584d0a4a57,1/17(水) 14:34
2024-01-17,15:23,sports,スポーツ,36,Full-Count,NPBがセ・リーグ日程を発表　開幕は3月29日…開催球場、試合開始時間も決定,https://news.yahoo.co.jp/articles/d3a50e5896dbd8b2af0cbbd7cc725cc70f761fa4,1/17(水) 13:14
2024-01-17,15:23,sports,スポーツ,37,TBS NEWS DIG Powered by JNN,【中日】キャンプ 1、2軍 振り分け発表！1軍に中田翔、上林、ビシエド、ディカーソン 2軍に龍空、高橋周 初対外試合は12日DeNA戦,https://news.yahoo.co.jp/articles/d4c19d6733bff87c5ec87f8c0b0cfd0329e0cfc3,1/17(水) 14:28
2024-01-17,15:23,sports,スポーツ,38,J-CASTニュース,元巨人コーチが挙げた「崖っぷち選手」とは？ 「意地見せるけど空回り」「今年はだいぶ瀬戸際」,https://news.yahoo.co.jp/articles/cfff5cfff2d77b015e4126dcaea20d1bb61b0f70,1/17(水) 13:07
2024-01-17,15:23,sports,スポーツ,39,西スポWEB OTTO！,「もうやめて...やっぱ続けて」大久保嘉人さんの〝女装〟投稿にSNS大盛り上がり「イモトいた？」「最後の澤さんみたい」「3番目で吹いた」「DMしそうになった」,https://news.yahoo.co.jp/articles/9c32024e6488e20de6b030fe4912e4b6740da830,1/17(水) 11:57
2024-01-17,15:23,sports,スポーツ,40,中日スポーツ,藤浪晋太郎、パイレーツ地元メディアが獲得進言「リスク高いが資金は低額…いずれは重要な場面を任せられる可能性も」,https://news.yahoo.co.jp/articles/8791b551d7386b3cee3e207063a395e6fb0420c1,1/17(水) 12:25
