scrp_date,scrp_time,genre_en,genre_jp,rank,media_jp,title,link,date_original
2024-02-09,17:19,sports,スポーツ,1,中日スポーツ,伊藤美誠のパリ五輪リザーブめぐる発言、水谷隼さんの指摘が反響 「やっと腑に落ちました」「補足する優しさ」【卓球】,https://news.yahoo.co.jp/articles/7bdcf2271f62a8c7f3814273708a86cdbc165d5e,2/9(金) 11:44
2024-02-09,17:19,sports,スポーツ,2,スポーツ報知,巨人でたった出場４試合のみの外野手がレンジャーズと２年最大３０億円契約　昨季本塁打王争い＆世界一,https://news.yahoo.co.jp/articles/030ad7836478e7a6e9ca7a1cabba52973883b75c,2/9(金) 10:08
2024-02-09,17:19,sports,スポーツ,3,超WORLDサッカー！,U-23ブラジル代表がパリ五輪出場へ薄氷勝利！ 最終戦は宿敵アルゼンチンと…勝てば本大会、負ければ予選敗退,https://news.yahoo.co.jp/articles/6df8afc24299c44b37c5c87c8fdb350d85395a97,2/9(金) 15:05
2024-02-09,17:19,sports,スポーツ,4,日刊スポーツ,【篠塚和典】巨人秋広優人あっけない空振り…必死にアピールしてチャンスつかむ心構え見えない,https://news.yahoo.co.jp/articles/8c0f3ab4975b3b6611366196618e440a56749f77,2/9(金) 15:43
2024-02-09,17:19,sports,スポーツ,5,東スポWEB,伊藤美誠の補欠発言が波紋　水谷隼氏が理解示す一方で〝自分勝手〟との声も,https://news.yahoo.co.jp/articles/fad34366c212da37c37ba5a1e2c2e2de355f2993,2/9(金) 16:41
2024-02-09,17:19,sports,スポーツ,6,中日スポーツ,【バスケ女子五輪予選】日本にまさかの敗戦…「スペインはハラキリ、もう失敗は許されない」衝撃広がる、戦術にも驚き「日本は普通ではない」,https://news.yahoo.co.jp/articles/d1e4e6a430096e0bf9a7a13ae5e36d0ac284e8e0,2/9(金) 11:40
2024-02-09,17:19,sports,スポーツ,7,デイリースポーツ,私服姿の大谷翔平が持つ特大の水筒に熱視線　ネット反応「値段調べたらビックリｗｗ」「欲しい人いっぱいいそう」,https://news.yahoo.co.jp/articles/4a88ec52352249bffc34583d17b6b5dcc7a82a4e,2/9(金) 15:08
2024-02-09,17:19,sports,スポーツ,8,motorsport.com 日本版,ビザ・キャッシュアップRB、角田裕毅が操る2024年マシン『VCARB 01』発表！　トロロッソ時代のメタリックブルーへ回帰,https://news.yahoo.co.jp/articles/b2f25ea0db98716c0a94afb5f370cce34a59d573,2/9(金) 15:37
2024-02-09,17:19,sports,スポーツ,9,サッカーキング,川崎F退団のL・ダミアン、新天地はコリチーバに決定…事前契約締結が発表,https://news.yahoo.co.jp/articles/cb013560ffe5dbff9474b93cf6923152f07edeb8,2/9(金) 13:45
2024-02-09,17:19,sports,スポーツ,10,日刊スポーツ,【浦和】GK西川周作、後輩の鈴木彩艶へ「GKはミスを成長のエサにする。自分もそうだった」,https://news.yahoo.co.jp/articles/84b455690509b5b5d68ca788ca04f35ed7c363c2,2/9(金) 16:14
2024-02-09,17:19,sports,スポーツ,11,デイリースポーツ,男子ハンドボール日本代表に激震　名将シグルドソン監督がパリ五輪待たず突然辞任　契約期間も他国の監督に就任意向　協会が発表,https://news.yahoo.co.jp/articles/36232115a42570a9ce64ffaf902165a1c474fbfb,2/9(金) 12:07
2024-02-09,17:19,sports,スポーツ,12,デイリースポーツ,なぜ卓球の五輪代表発表で厳しい質問が続出したのか　納得の人選だからこそ新選考システムがはらむジレンマが浮き彫りに,https://news.yahoo.co.jp/articles/bf7003e9777c87176c59675b840b4eee75e00e61,2/9(金) 10:00
2024-02-09,17:19,sports,スポーツ,13,Full-Count,電撃移籍のドラ1が「劇的によくなってる」　主力圧倒の美直球＆変化球「覚醒の兆し」,https://news.yahoo.co.jp/articles/f8428c14bb706c3e4e6473a57b49de255f33800e,2/9(金) 13:01
2024-02-09,17:19,sports,スポーツ,14,e!Golf,小祝さくらが接客!? ルコックの店頭に立つミニスカートの“店員姿”にファンも胸キュン,https://news.yahoo.co.jp/articles/66072413d65b68e6bdc40e37d10fbc0edcb8a12b,2/9(金) 16:10
2024-02-09,17:19,sports,スポーツ,15,スポニチアネックス,オリックスが開幕シリーズで着用の特別ユニホームを発表　3連覇表す3つのVマークをデザイン,https://news.yahoo.co.jp/articles/3a351359639758a0f53c9051af9a0b5bbc5b2827,2/9(金) 14:00
2024-02-09,17:19,sports,スポーツ,16,TopNews,【F1新車発表】角田裕毅所属のビザ・キャッシュアップRB『VCARB 01』発表！レッドブル缶風メタリックブルー,https://news.yahoo.co.jp/articles/50d1f3b4933b731f5fa889e7cd0bfb3d7aa402d5,2/9(金) 15:49
2024-02-09,17:19,sports,スポーツ,17,日刊ゲンダイDIGITAL,巨人・大勢がキャンプ離脱第1号の大誤算…「守護神」代役候補はやはり菅野智之か,https://news.yahoo.co.jp/articles/5e2d7f854131af71ebfa84de107b15afeb5e107a,2/9(金) 12:03
2024-02-09,17:19,sports,スポーツ,18,日刊スポーツ,【広島】中村奨成「まだまだ技術が底辺」休日返上で打撃練習　10日からの紅白戦でアピール誓う,https://news.yahoo.co.jp/articles/fa066c220cd779a19e7f17e1e53dbca01d85f656,2/9(金) 16:54
2024-02-09,17:19,sports,スポーツ,19,スポニチアネックス,若隆景「無事に関取に復帰できてよかった」昨年大ケガ負った大阪の土俵へ「本格的な15日間の戦いに」,https://news.yahoo.co.jp/articles/6feed01ccac44d91f5ff5b0ae62c4a7a965da56c,2/9(金) 16:21
2024-02-09,17:19,sports,スポーツ,20,Full-Count,イチローを最後に途絶えた“伝説”　誰も到達できず19年…3人の怪物と並ぶ偉業,https://news.yahoo.co.jp/articles/453a63254985ed04d6d0137e410d7c0e9369a74c,2/9(金) 14:40
2024-02-09,17:19,sports,スポーツ,21,デイリースポーツ,女子ゴルファー藤田光里が結婚式　盟友がドレス姿の新婦＆新郎と３ショット「良い人に出会えて本当に良かった」,https://news.yahoo.co.jp/articles/aa4f3ac8ef8e8efa0d75803778b1fd7e079a54c2,2/9(金) 16:29
2024-02-09,17:19,sports,スポーツ,22,スポニチアネックス,関脇復帰確実の若元春「言葉にできない思い」優勝＆準優勝力士破った初場所の複雑な胸中明かす,https://news.yahoo.co.jp/articles/61506b7e410461ac277c4c744be3c47efa2738a5,2/9(金) 16:14
2024-02-09,17:19,sports,スポーツ,23,Full-Count,大谷翔平待ちで“異様な光景”　まもなくド軍始動…美人レポーターが感じた興奮,https://news.yahoo.co.jp/articles/e7592e4127387378ab9fe4aff7162c6099a07342,2/9(金) 16:19
2024-02-09,17:19,sports,スポーツ,24,Full-Count,中田翔の“配慮”…ファンが気づき「めちゃ後悔」　新記録樹立、早くも中日に“恩恵”,https://news.yahoo.co.jp/articles/37fa2c2bca6c8e247f3bc8164debd53bb9b44443,2/9(金) 15:00
2024-02-09,17:19,sports,スポーツ,25,4years.,佐々木朗希の弟に、谷佳知さん・亮子さん夫妻の長男も　「戦国」東都1部リーグに進む予定の新入生たち,https://news.yahoo.co.jp/articles/bfc0df8561544943992b9b4a09dc398032c40000,2/9(金) 12:27
2024-02-09,17:19,sports,スポーツ,26,オートスポーツweb,レーシング・ブルズF1が2024年型F1マシン『VCARB 01』のリバリーをお披露目。ブルー基調に一新,https://news.yahoo.co.jp/articles/53c83fa36184b801a63c7379a3c88950a21b4567,2/9(金) 15:40
2024-02-09,17:19,sports,スポーツ,27,日刊スポーツ,【日本ハム】捕手の郡司裕也、10日紅白戦で三塁デビュー　武器の打撃を生かし出場機会増を狙う,https://news.yahoo.co.jp/articles/a8c81948804d507759a0a53212f621fefb3123f5,2/9(金) 15:54
2024-02-09,17:19,sports,スポーツ,28,RONSPO,なぜパリ五輪予選第1戦の北朝鮮での開催が“白紙”に戻ったのか…困惑するなでしこジャパン,https://news.yahoo.co.jp/articles/71b08c919faa1ece987e15e7c3b4564f2c7da2ff,2/9(金) 6:32
2024-02-09,17:19,sports,スポーツ,29,スポーツ報知,ドジャース―パドレスの開幕戦韓国シリーズがＮＨＫとテレ朝で地上波生中継…オープン戦も生中継の異例対応,https://news.yahoo.co.jp/articles/ef71ed46e2110a044f1bcb767a63d1af20289f19,2/9(金) 15:10
2024-02-09,17:19,sports,スポーツ,30,日刊スポーツ,【巨人】浅野翔吾、15日からの第３クールで実戦除く全体練習復帰　駒田３軍監督「一緒にやれる」,https://news.yahoo.co.jp/articles/48f9275776de5535099faed2b30822c9418850d0,2/9(金) 13:53
2024-02-09,17:19,sports,スポーツ,31,中日スポーツ,大谷翔平、元同僚が明かす桁違いなパワー 「トスバッティングなのに…そんなヤツ、いないよ」,https://news.yahoo.co.jp/articles/b5f029af5765e0fea3e125c3b9f10e6f4290935f,2/9(金) 12:20
2024-02-09,17:19,sports,スポーツ,32,東スポWEB,伊東純也の逆告訴をＪクラブ関係者が支持「ハニートラップもある」,https://news.yahoo.co.jp/articles/d2ef7c132f1eb083d6402534d23315bfa3f7cde1,2/9(金) 5:16
2024-02-09,17:19,sports,スポーツ,33,日テレNEWS NNN,【女子バスケ】強敵スペイン撃破でパリ五輪に王手　グループ3位以上で出場権獲得,https://news.yahoo.co.jp/articles/2c9bd8402feda5272b85d1b6c8785c526cdfbdb5,2/9(金) 11:32
2024-02-09,17:19,sports,スポーツ,34,西スポWEB OTTO！,巨人コーチ陣が再びゴルフへ、杉内俊哉1軍投手コーチら真剣練習6ショット公開、ラウンド中にはまさかの〝乱入者〟も,https://news.yahoo.co.jp/articles/a8d6330e897385d381ed783204d96ff43aa305a4,2/9(金) 13:00
2024-02-09,17:19,sports,スポーツ,35,ベースボールキング,元ロッテのぺルドモがナショナルズとマイナー契約　昨季はパ・リーグ最優秀中継ぎ投手賞を獲得,https://news.yahoo.co.jp/articles/211336e51c7961d2b62ae2f11302a5d1d9e21314,2/9(金) 12:46
2024-02-09,17:19,sports,スポーツ,36,スポニチアネックス,西武・増田達至が異例のブルペン4連投「今年はやらないといけない年」,https://news.yahoo.co.jp/articles/1384b165830f05bb309c508ddf43d1378649e348,2/9(金) 13:54
2024-02-09,17:19,sports,スポーツ,37,CoCoKARAnext,批判殺到で解任論も噴出！ それでも韓国を率いるクリンスマン監督は辞めない「なぜ批判の声が多いのか、私には分からない」,https://news.yahoo.co.jp/articles/786c423d69985ae2172b61e58f260972db995dcb,2/9(金) 16:00
2024-02-09,17:19,sports,スポーツ,38,Full-Count,わずか43試合出場で“長者番付入り”　エ軍366億円男に厳しい声「釣り合っていない」,https://news.yahoo.co.jp/articles/89746002603030c582a5f330a5687b201f00bd7c,2/9(金) 15:52
2024-02-09,17:19,sports,スポーツ,39,ABEMA TIMES,女子レスラー、“パンツ固め”の奇策発動！ 「なんだそれはw」「極めてるw」ファン騒然,https://news.yahoo.co.jp/articles/61365e564ecd9fca39b54608abefa64151defd2c,2/9(金) 8:21
2024-02-09,17:19,sports,スポーツ,40,東スポWEB,闘莉王氏　久保建英の途中交代を非難「代えちゃいけない」「森保監督の失敗」,https://news.yahoo.co.jp/articles/c051b1c9347b2f9074a835f2781d6df571222323,2/9(金) 11:41
