scrp_date,scrp_time,genre_en,genre_jp,rank,media_jp,title,link,date_original
2024-02-09,20:14,domestic,国内,1,FNNプライムオンライン,【話題】佳子さまの身につける洋服が「かわいい」と話題に　“親しみのあるブランド”で同じものを求める女性が増加,https://news.yahoo.co.jp/articles/67925c1d40d9fb1fd5479ebea5547fbeee74b4b0,2/9(金) 16:02
2024-02-09,20:14,domestic,国内,2,みんかぶマガジン,冬季五輪もなくなり万事休す…日本ハムに見放された札幌ドームの当然すぎる末路「札幌市民の怒りは収まらない」,https://news.yahoo.co.jp/articles/42fdfa6bac25806f067ed1719002346647a5ce24,2/9(金) 9:10
2024-02-09,20:14,domestic,国内,3,Yahoo!ニュース オリジナル 特集,「能登地震の復興は東日本に学べ」元復興庁・岡本全勝さんの提言　町を元に戻しても人は戻らず ＃知り続ける,https://news.yahoo.co.jp/articles/e174e231feb0ae1584a4b642011899d5b2317f19,2/9(金) 17:00
2024-02-09,20:14,domestic,国内,4,デイリースポーツ,岸田首相、国会炎上　二階氏に「５０億円」なぜ聞かない？立憲議員「総理が火の玉になり二階さんに聞けないのか？」→首相が長い回答,https://news.yahoo.co.jp/articles/207dca23a653e64ad477cef274daeb964799f4c2,2/9(金) 16:34
2024-02-09,20:14,domestic,国内,5,東海テレビ,地下鉄のトンネルで「線路にしゃがみこんだ人」20‐30代とみられる女性がはねられ死亡 一時運転見合わせ,https://news.yahoo.co.jp/articles/1b0403a1a4d298f25c1087c261e869e3ce3623de,2/9(金) 17:14
2024-02-09,20:14,domestic,国内,6,日テレNEWS NNN,杉田水脈議員に賠償命じる判決が確定　中傷投稿に「いいね」めぐり　杉田議員側の上告退ける決定　最高裁,https://news.yahoo.co.jp/articles/14d69f9428682fa755821f6168650567db136e71,2/9(金) 15:48
2024-02-09,20:14,domestic,国内,7,TBS NEWS DIG Powered by JNN,茨城県、栃木県、埼玉県、千葉県、東京都、神奈川県で最大震度2の地震　茨城県・日立市、笠間市、取手市,https://news.yahoo.co.jp/articles/92c0f126357544f538828be0e39acab8c8e403c4,2/9(金) 17:48
2024-02-09,20:14,domestic,国内,8,FNNプライムオンライン（フジテレビ系）,【速報】愛子さま“宮中ランチ”デビュー英語でご歓談,https://news.yahoo.co.jp/articles/30186d7474793c8f2a3f417d958e1c09eb67f145,2/9(金) 12:48
2024-02-09,20:14,domestic,国内,9,時事通信,M7．6直前に地震2回　まとめて最大震度7　気象庁,https://news.yahoo.co.jp/articles/f007c954e3da4c6fe81d90a3de84ca0cbc1434ea,2/8(木) 19:41
2024-02-09,20:14,domestic,国内,10,日本ファクトチェックセンター,池上彰氏の番組の「左翼は『在日的』な考えをする人」は誤り　加工された画像が拡散【ファクトチェック】,https://news.yahoo.co.jp/articles/1e744cc27183d22bb3ba50ab3c6ba8220205b906,2/9(金) 16:15
2024-02-09,20:14,domestic,国内,11,日刊スポーツ,「四国犬が決して悪いわけじゃない」田中ウルヴェ京氏　狂犬病の予防注射せず12人かまれた問題,https://news.yahoo.co.jp/articles/f920967ebefc06600561dba86a06a81466e62985,2/9(金) 15:47
2024-02-09,20:14,domestic,国内,12,デイリースポーツ,米山隆一氏　三浦瑠麗氏に反論「政治家はＳＮＳでなくリアルで仕事を」を論破へ「コメンテーターは事実に即したコメントを」,https://news.yahoo.co.jp/articles/d41b1560349cdb0856db3871149e9f669e349550,2/9(金) 15:18
2024-02-09,20:14,domestic,国内,13,デイリースポーツ,小池百合子都知事の国政復帰→総理に「ついにジョーカーが」高橋洋一氏「政策は無茶苦茶」も「麻生さん落としたら」,https://news.yahoo.co.jp/articles/52c0153f70193c66c7625cdb4c77052fcc557a6a,2/9(金) 17:39
2024-02-09,20:14,domestic,国内,14,FNNプライムオンライン,【リニア】国交省幹部が静岡県に“土産”　川勝知事はその時「お～」…しかし結局は“拡大解釈”で自説に終始,https://news.yahoo.co.jp/articles/f0e6ef662087e91d8913a4209beeec9398992468,2/9(金) 17:32
2024-02-09,20:14,domestic,国内,15,FNNプライムオンライン,体長1.3mの四国犬　児童ら12人に噛みつき　「人懐っこい犬」と飼い主は驚き謝罪　過失傷害罪に問われる可能性も,https://news.yahoo.co.jp/articles/cc7b925a77d28f781592118e6b316b94763c3e13,2/8(木) 17:49
2024-02-09,20:14,domestic,国内,16,J-CASTニュース,スマホをステージに向け、安い席から大挙して目の前に...　テイラー・スウィフト日本公演、一部客の蛮行に「VIP席なのに」と苦情続々,https://news.yahoo.co.jp/articles/27593f00d9cb7ce0b2d203ac7d285dc2de0cde23,2/8(木) 20:04
2024-02-09,20:14,domestic,国内,17,時事通信,両陛下、ケニア大統領夫妻と会見　愛子さま、宮中昼食会に初出席　皇居,https://news.yahoo.co.jp/articles/f02a9eaf6ccabd248c98e2e078cc73a0ad626c92,2/9(金) 13:54
2024-02-09,20:14,domestic,国内,18,マイナビニュース,「強い、強すぎる...」「もう誰にも止められないのか？」　藤井王将が圧巻４連勝で王将防衛　第73期ALSOK杯王将戦七番勝負第４局,https://news.yahoo.co.jp/articles/58da1ed9807ad97abc0ea0c2fd575928fe26843c,2/9(金) 12:11
2024-02-09,20:14,domestic,国内,19,FNNプライムオンライン（フジテレビ系）,愛子さまがスワヒリ語で挨拶　ケニア大統領夫妻招いた昼食会に出席　英語で会話し大統領からケニア招待の話も,https://news.yahoo.co.jp/articles/c1b31280f3dd489b92c3a36a7382d797608e398f,2/9(金) 16:32
2024-02-09,20:14,domestic,国内,20,弁護士ドットコムニュース,東京藝大「大吉原展」がSNS炎上「人身売買の歴史をエンタメ化」中止求める声も…主催者「負の歴史ふまえ展示」,https://news.yahoo.co.jp/articles/0f5c4553632204dd44ba593f67d46cfa6d786da0,2/8(木) 20:37
2024-02-09,20:14,domestic,国内,21,FNNプライムオンライン,政治家や官僚の皆さんは、自分たちがマイナカード使わないのなら、国民にあーだこーだ言うのやめてくれないか,https://news.yahoo.co.jp/articles/83dd799d267c19cd3b9355dbe1cc0212248cb13e,2/9(金) 16:02
2024-02-09,20:14,domestic,国内,22,日刊スポーツ,立花孝志氏、ガーシー被告懲役４年求刑に驚き「執行猶予が付くだろうと…ちょっと厳しい求刑」,https://news.yahoo.co.jp/articles/75d9948a4f4ffa385360bfa73c764f2e3bdc14cb,2/9(金) 11:52
2024-02-09,20:14,domestic,国内,23,FNNプライムオンライン,愛子さまスワヒリ語で「ごきげんよう」の「HABARI（ハバリ）」と挨拶　宮中ランチデビューでケニア大統領と英語で交流も,https://news.yahoo.co.jp/articles/cdc081c36260a62bbc3c92ce1bbf9393f1980796,2/9(金) 18:17
2024-02-09,20:14,domestic,国内,24,産経新聞,自民・二階俊博氏、３年間で書籍代３５００万円の不思議「家１軒分」「読書家ぶりに驚き」,https://news.yahoo.co.jp/articles/c06fb547ddbe9302388a0f8d5e5f1d41877ab3eb,2/9(金) 12:01
2024-02-09,20:14,domestic,国内,25,FNNプライムオンライン,「ペットにするような犬じゃない」小学生ら12人を次々かんだ四国犬　トイプードルがかまれて死んだことも　群馬・伊勢崎市,https://news.yahoo.co.jp/articles/9088a852f7a82ded3fb5f6d1318fae79929f049e,2/8(木) 19:39
2024-02-09,20:14,domestic,国内,26,北海道新聞,北方領土に新たな湖か　歯舞・色丹で地盤沈下進む　衛星画像分析、東方沖地震が影響,https://news.yahoo.co.jp/articles/18a79a6397f63192a1de57e6bb08343e859b31e7,2/9(金) 15:16
2024-02-09,20:14,domestic,国内,27,読売新聞オンライン,逮捕状や起訴状の被害者名を加害者側に秘匿、１５日から新制度…被告側の「反証」困難との懸念も,https://news.yahoo.co.jp/articles/409c856e803a48af77ddd6173e6cf4b76146ee3b,2/8(木) 5:01
2024-02-09,20:14,domestic,国内,28,デイリースポーツ,芦原妃名子さん急死で声あげた「ちはやふる」作者「原作者は製作者と脚本家に早い段階で会う」などのルールも提言,https://news.yahoo.co.jp/articles/3809588cd42eacd6658cd62b0633dd413f910c29,2/9(金) 18:23
2024-02-09,20:14,domestic,国内,29,朝日新聞デジタル,愛子さま、宮中の昼食会に初出席　両陛下、ケニア大統領夫妻と会見,https://news.yahoo.co.jp/articles/e869477fdd552b35b402f05bb8004737a6f4230c,2/9(金) 19:30
2024-02-09,20:14,domestic,国内,30,朝日新聞デジタル,染色家の柚木沙弥郎さんが101歳で死去　素朴でカラフルな作風,https://news.yahoo.co.jp/articles/69c04ecdaf59b57449e681607a1ff8b29b6748c3,2/7(水) 20:25
2024-02-09,20:14,domestic,国内,31,共同通信,障害者施設の入浴で全身やけど　大阪、利用者の30代男性,https://news.yahoo.co.jp/articles/527f4668183c7257603e39f51cd4df52ff93d938,2/9(金) 17:51
2024-02-09,20:14,domestic,国内,32,毎日新聞,小学生ら12人かんだ犬、義務の狂犬病予防注射せず　群馬・伊勢崎,https://news.yahoo.co.jp/articles/3edb593bce193663455573fa47d43a7eb8404d65,2/9(金) 15:48
2024-02-09,20:14,domestic,国内,33,朝日新聞デジタル,ピアニストの江戸京子さん死去　アリオン賞など音楽文化振興に尽力,https://news.yahoo.co.jp/articles/1ab7f2d90ff470b96639957eb1c54cdf6d81a56a,2/1(木) 19:25
2024-02-09,20:14,domestic,国内,34,FNNプライムオンライン（フジテレビ系）,中傷メッセージに「いいね!」杉田水脈議員の敗訴確定　フリージャーナリストの伊藤詩織さんに55万円の賠償,https://news.yahoo.co.jp/articles/c30edb4f9420ea0bcb0001152b8baf9692305b70,2/9(金) 18:27
2024-02-09,20:14,domestic,国内,35,夕刊フジ,岸田首相の「共生社会」ビデオメッセージで意見さまざま…「第二の河野談話」、「『日本人全員が差別している』とは言っていない」との声も,https://news.yahoo.co.jp/articles/400db42f0f7334647982b075fe96709e90c6a684,2/9(金) 17:00
2024-02-09,20:14,domestic,国内,36,FNNプライムオンライン,【独自】「元に戻して…」千葉・タクシー強盗致傷事件で運転手は意識不明…妻が胸中告白　容疑者の父は“混乱”,https://news.yahoo.co.jp/articles/a9229b55ddec37f96be26d18502c0bffae8b17c7,2/8(木) 12:02
2024-02-09,20:14,domestic,国内,37,テレビ朝日系（ANN）,「四国犬」小学生ら12人かむ…10針縫った人も　首輪なし、会社役員の家から逃走か,https://news.yahoo.co.jp/articles/3d77fd9fd55225c3e341e140545f1e7ca20e551d,2/8(木) 12:09
2024-02-09,20:14,domestic,国内,38,時事通信,悠仁さまがインフルエンザ感染,https://news.yahoo.co.jp/articles/c16b464369fa3bd3a2d522335eb8c4b1adf51502,2/9(金) 16:10
2024-02-09,20:14,domestic,国内,39,日刊スポーツ,小沢一郎氏、杉田水脈氏賠償確定に「自民党はもはや差別の党」と私見「嘲笑う人物を放置し…」,https://news.yahoo.co.jp/articles/52e9e9a3de580b00a00ce2b1631718f7ca844e8d,2/9(金) 17:48
2024-02-09,20:14,domestic,国内,40,共同通信,両陛下、ケニア大統領夫妻と会見　秋篠宮さま愛子さま同席昼食会も,https://news.yahoo.co.jp/articles/bd7cebda4c168d0ef8ca127fd3f02561e0e5a11b,2/9(金) 17:10
