scrp_date,scrp_time,genre_en,genre_jp,rank,media_jp,title,link,date_original
2024-02-09,17:19,TTL,総合,1,クランクイン！,再放送中『救命病棟24時』今では大物になった“看護師”キャスト　本作きっかけで結婚した人も！,https://news.yahoo.co.jp/articles/ddd1cbd377c8f90001fe2f769618e9f81391e0a5,2/9(金) 7:00
2024-02-09,17:19,TTL,総合,2,デイリースポーツ,横澤夏子、号泣告白　言えない妊娠察知してロケでかばってくれた意外芸人　スタジオ騒然「言いふらすと思ってた」,https://news.yahoo.co.jp/articles/428e51e24427a2ce1137f59df7ddee6cd1e2f19a,2/9(金) 11:39
2024-02-09,17:19,TTL,総合,3,モデルプレス,ムロツヨシ、戸田恵梨香の結婚発表後に驚きのコメント寄せられる「何故か世の皆さんから…」,https://news.yahoo.co.jp/articles/a476ff3a018691ae94189466771b61697c3a793e,2/9(金) 13:59
2024-02-09,17:19,TTL,総合,4,ねとらぼ,パーカーをガバッとまくり上げて……　女性インフルエンサー、台湾でボディーライン晒す　上半身露出で物議　「羞恥心どこに置いてきたん？」,https://news.yahoo.co.jp/articles/56ab9e1c883bfc441ee548f2afd72bcbd132863e,2/9(金) 16:00
2024-02-09,17:19,TTL,総合,5,日刊スポーツ,白血病公表のタレント、検査結果に混乱　医師から「このままだと死にますよ」症状や判明経緯説明,https://news.yahoo.co.jp/articles/0f2599c3d013a8e120538e2f7460ca5d196f2c67,2/9(金) 9:54
2024-02-09,17:19,TTL,総合,6,みんかぶマガジン,冬季五輪もなくなり万事休す…日本ハムに見放された札幌ドームの当然すぎる末路「札幌市民の怒りは収まらない」,https://news.yahoo.co.jp/articles/42fdfa6bac25806f067ed1719002346647a5ce24,2/9(金) 9:10
2024-02-09,17:19,TTL,総合,7,中日スポーツ,伊藤美誠のパリ五輪リザーブめぐる発言、水谷隼さんの指摘が反響 「やっと腑に落ちました」「補足する優しさ」【卓球】,https://news.yahoo.co.jp/articles/7bdcf2271f62a8c7f3814273708a86cdbc165d5e,2/9(金) 11:44
2024-02-09,17:19,TTL,総合,8,スポーツ報知,「ダウンタウンＤＸ」まさかの「芸能界ケンカ最強」俳優にネット騒然！「マジでカッケー」兄＆妻も有名人,https://news.yahoo.co.jp/articles/d810ee67ecc9ba5f17d344640481bbfb9b4eb243,2/9(金) 12:40
2024-02-09,17:19,TTL,総合,9,スポーツ報知,巨人でたった出場４試合のみの外野手がレンジャーズと２年最大３０億円契約　昨季本塁打王争い＆世界一,https://news.yahoo.co.jp/articles/030ad7836478e7a6e9ca7a1cabba52973883b75c,2/9(金) 10:08
2024-02-09,17:19,TTL,総合,10,ハフポスト日本版,分娩で赤ちゃんが頭部切断され死亡⇒「殺人」と米検視局。両親は医師の隠蔽を主張,https://news.yahoo.co.jp/articles/fee81a0f8f3b3c3c139a1b28eebaee84675e8702,2/8(木) 19:40
2024-02-09,17:19,TTL,総合,11,ENCOUNT,午前8時10分に田村真子アナが大号泣、『ラヴィット』出演人気芸人にネットも「出勤前に何するんや！」,https://news.yahoo.co.jp/articles/96bb5eaf06431ba12e18105121eccad1813a23f9,2/9(金) 10:07
2024-02-09,17:19,TTL,総合,12,FNNプライムオンライン（フジテレビ系）,【速報】愛子さま“宮中ランチ”デビュー「How are you?」英語で歓談,https://news.yahoo.co.jp/articles/30186d7474793c8f2a3f417d958e1c09eb67f145,2/9(金) 12:48
2024-02-09,17:19,TTL,総合,13,デイリースポーツ,偏差値７０超、東大合格率１位の名門卒→レジェンド男優　人生激変の衝撃理由告白　同級生は官僚、東大教授　共演女優数が,https://news.yahoo.co.jp/articles/10b538118e7033687ba5fcdea882d2cb13abb77e,2/9(金) 12:14
2024-02-09,17:19,TTL,総合,14,東スポWEB,「単行本も読んでなかったのかも」古市憲寿氏が脚本家・相沢友子氏の告白に〝脱力〟したワケ,https://news.yahoo.co.jp/articles/61a231adf232ace02c441c937cdc1a35f98f5dbf,2/9(金) 10:41
2024-02-09,17:19,TTL,総合,15,スポニチアネックス,小学館で連載中の漫画家　編集者一同の声明への“穿った見方”に反論「結構早い段階で、作家には内内に…」,https://news.yahoo.co.jp/articles/f04f27c896568b8956d0de18d88b5ee2880b6a04,2/9(金) 13:31
2024-02-09,17:19,TTL,総合,16,FNNプライムオンライン,【話題】佳子さまの身につける洋服が「かわいい」と話題に　“親しみのあるブランド”で同じものを求める女性が増加,https://news.yahoo.co.jp/articles/67925c1d40d9fb1fd5479ebea5547fbeee74b4b0,2/9(金) 16:02
2024-02-09,17:19,TTL,総合,17,オリコン,韓ドラオタがおすすめするNetflix韓国ドラマランキングTOP10～恋愛編～ 王道ラブコメから隠れた名作まで！【ハングクTIMES】,https://news.yahoo.co.jp/articles/49d5d8331497214cc12a42c0fba2e4f092f52a03,2/9(金) 16:00
2024-02-09,17:19,TTL,総合,18,日刊ゲンダイDIGITAL,フジ「大奥」酷評で小芝風花の“黒歴史”に？ 2003年の菅野美穂版も《軽すぎる》と叩かれていた,https://news.yahoo.co.jp/articles/e4bb86db3a196a950b4ab14a36fa8c36881ea7e6,2/9(金) 14:25
2024-02-09,17:19,TTL,総合,19,スポーツ報知,【ブギウギ】久々のタイ子ちゃんが不穏「あの時お腹にいた子」がまさか　次週予告で修羅場,https://news.yahoo.co.jp/articles/7bf0c5170b441593496588c236768675f0ce8269,2/9(金) 13:00
2024-02-09,17:19,TTL,総合,20,日刊スポーツ,箕輪厚介氏「一方は懲役四年求刑、一方はボロ儲け」ガーシー被告と週刊誌”違い”指摘に共感の声,https://news.yahoo.co.jp/articles/ea5112ee56df02f8ea719e260090ec0901ccbdf0,2/9(金) 16:19
2024-02-09,17:19,TTL,総合,21,オリコン,とにかく隠れたい…人見知り全開の1歳児がとった行動に300万回再生「かわいすぎ」「ウチの子も同じだった」,https://news.yahoo.co.jp/articles/130885c2cd84cef2d9fea0351b7d58d815374a19,2/9(金) 8:10
2024-02-09,17:19,TTL,総合,22,超WORLDサッカー！,U-23ブラジル代表がパリ五輪出場へ薄氷勝利！ 最終戦は宿敵アルゼンチンと…勝てば本大会、負ければ予選敗退,https://news.yahoo.co.jp/articles/6df8afc24299c44b37c5c87c8fdb350d85395a97,2/9(金) 15:05
2024-02-09,17:19,TTL,総合,23,あいテレビ,貯水率0％のダム、地面のひび割れはまるで“ウユニ塩湖” 一方、下流の川には水?! その正体は“堆砂容量”に溜まった水… 県内No2の規模「鹿野川ダム」の謎に迫る,https://news.yahoo.co.jp/articles/e74547daf3d16ffd54c8a36efc8e63f4a6393307,2/9(金) 16:14
2024-02-09,17:19,TTL,総合,24,時事通信,両陛下、ケニア大統領夫妻と会見　愛子さま、宮中昼食会に初出席　皇居,https://news.yahoo.co.jp/articles/f02a9eaf6ccabd248c98e2e078cc73a0ad626c92,2/9(金) 13:54
2024-02-09,17:19,TTL,総合,25,まいどなニュース,セクシー田中さん脚本家「初めて聞くこと」に古市憲寿「単行本読んでなかったのか」,https://news.yahoo.co.jp/articles/211d255690eea1c1c46446dc727567bf9315c9cd,2/9(金) 9:34
2024-02-09,17:19,TTL,総合,26,チューリップテレビ,13歳未満の女児への強制性交等の疑いで漁師の男（62）を再逮捕　すでに女児に対する同様の性的暴行で起訴　富山,https://news.yahoo.co.jp/articles/c3c8d789a15398f85ceda0ae0d70bec185a2f19d,2/9(金) 14:53
2024-02-09,17:19,TTL,総合,27,日刊スポーツ,【篠塚和典】巨人秋広優人あっけない空振り…必死にアピールしてチャンスつかむ心構え見えない,https://news.yahoo.co.jp/articles/8c0f3ab4975b3b6611366196618e440a56749f77,2/9(金) 15:43
2024-02-09,17:19,TTL,総合,28,Hint-Pot,「ねこの写真見せて」　友人のリクエストに応えたら…　無言になったワケとは,https://news.yahoo.co.jp/articles/240b5fc99c71acec316596a88596b6d332c8854b,2/9(金) 12:43
2024-02-09,17:19,TTL,総合,29,東スポWEB,伊藤美誠の補欠発言が波紋　水谷隼氏が理解示す一方で〝自分勝手〟との声も,https://news.yahoo.co.jp/articles/fad34366c212da37c37ba5a1e2c2e2de355f2993,2/9(金) 16:41
2024-02-09,17:19,TTL,総合,30,ITmedia NEWS,「33歳のVTuber」、掲示板のコメントに発信者情報開示請求→東京地裁が棄却　判例がWebで公開,https://news.yahoo.co.jp/articles/37b2f8d2d78946fbc34082e636c82c395f572404,2/9(金) 12:32
2024-02-09,17:19,TTL,総合,31,ねとらぼ,ムロツヨシ、隣の車に乗っていた“超大物親子”に衝撃　「ビーって窓開いたら」「お父さん、こんにちは！」,https://news.yahoo.co.jp/articles/59024cea8aa99c045206ab5a36ee55725cea5e5b,2/9(金) 12:36
2024-02-09,17:19,TTL,総合,32,デイリースポーツ,「不適切にもほどがある」クラリオンガールに暴言→ネット「蓮舫さんｗ」ＴＢＳ二重お断りに爆笑「怒られる」「風評被害ｗ」　若者は「何？」も,https://news.yahoo.co.jp/articles/178dded34e4dd7cdc389ef352e3523ad154be5a6,2/9(金) 12:58
2024-02-09,17:19,TTL,総合,33,中日スポーツ,【バスケ女子五輪予選】日本にまさかの敗戦…「スペインはハラキリ、もう失敗は許されない」衝撃広がる、戦術にも驚き「日本は普通ではない」,https://news.yahoo.co.jp/articles/d1e4e6a430096e0bf9a7a13ae5e36d0ac284e8e0,2/9(金) 11:40
2024-02-09,17:19,TTL,総合,34,FNNプライムオンライン,体長1.3mの四国犬　児童ら12人に噛みつき　「人懐っこい犬」と飼い主は驚き謝罪　過失傷害罪に問われる可能性も,https://news.yahoo.co.jp/articles/cc7b925a77d28f781592118e6b316b94763c3e13,2/8(木) 17:49
2024-02-09,17:19,TTL,総合,35,日本ファクトチェックセンター,池上彰氏の番組の「左翼は『在日的』な考えをする人」は誤り　加工された画像が拡散【ファクトチェック】,https://news.yahoo.co.jp/articles/1e744cc27183d22bb3ba50ab3c6ba8220205b906,2/9(金) 16:15
2024-02-09,17:19,TTL,総合,36,デイリースポーツ,岸田首相、国会炎上　二階氏に「５０億円」なぜ聞かない？立憲議員「総理が火の玉になり二階さんに聞けないのか？」→首相が長い回答,https://news.yahoo.co.jp/articles/207dca23a653e64ad477cef274daeb964799f4c2,2/9(金) 16:34
2024-02-09,17:19,TTL,総合,37,沖縄タイムス,「ドーン」すさまじい衝撃音　立体駐車場を車が突き破る瞬間を目撃　「大丈夫ですか」声を掛けたが放心状態,https://news.yahoo.co.jp/articles/ff5e84c2f8e1a5b2ee0e0dabddfb4952b1d7374a,2/9(金) 15:43
2024-02-09,17:19,TTL,総合,38,デイリースポーツ,私服姿の大谷翔平が持つ特大の水筒に熱視線　ネット反応「値段調べたらビックリｗｗ」「欲しい人いっぱいいそう」,https://news.yahoo.co.jp/articles/4a88ec52352249bffc34583d17b6b5dcc7a82a4e,2/9(金) 15:08
2024-02-09,17:19,TTL,総合,39,ABEMA TIMES,先天性疾患により低身長・6歳のYouTuberりおなちゃん、身長が伸びた姿に多くの反響「涙が流れました」「日々の努力と家族のサポートが実を結んだ」,https://news.yahoo.co.jp/articles/f61c7809772584dc17c832556d02f8b025aacb2a,2/9(金) 10:16
2024-02-09,17:19,TTL,総合,40,FNNプライムオンライン,政治家や官僚の皆さんは、自分たちがマイナカード使わないのなら、国民にあーだこーだ言うのやめてくれないか,https://news.yahoo.co.jp/articles/83dd799d267c19cd3b9355dbe1cc0212248cb13e,2/9(金) 16:02
