scrp_date,scrp_time,genre_en,genre_jp,rank,media_jp,title,link,date_original
2025-01-12,13:07,local,地域,1,チューリップテレビ,北日本1月17日頃から「かなり高くなる見込み」関東甲信・北陸は20日頃から「かなり高くなる可能性」気象庁・2週間気温予想,https://news.yahoo.co.jp/articles/77deea027345921fa2a90b81bda3aa0c828aae84,1/12(日) 10:57
2025-01-12,13:07,local,地域,2,テレビ新広島,後ろからきた車にはねられ男性（２７）死亡　広島県福山市,https://news.yahoo.co.jp/articles/e7a0bc924f621951dac721d9f2891644acca555b,1/12(日) 8:42
2025-01-12,13:07,local,地域,3,千葉日報オンライン,千葉県西部で雪交じる恐れ　12日夜から、走行に影響も,https://news.yahoo.co.jp/articles/a353fea5ce1c2712a51c1a2d48164ac070087498,1/12(日) 12:00
2025-01-12,13:07,local,地域,4,ＢＳＮ新潟放送,雪はいつ、どこで? 12日夕方にかけて九州で大雪の恐れ　福岡・佐賀の平地では13日朝までに3cmの降雪予想【3時間ごとの雨雪シミュレーション・12日午前11時更新】,https://news.yahoo.co.jp/articles/e4ab3c58119849beb6cefc487880797c4f23e244,1/12(日) 11:02
2025-01-12,13:07,local,地域,5,ｔｙｓテレビ山口,「ドミノ倒しのように休職せざるをえない状況に」山口県立高校　教員未配置は35人　教職員組合が負担増の窮状訴え,https://news.yahoo.co.jp/articles/60355d73d3ea72634e618df40834346ec30d8748,1/12(日) 10:04
2025-01-12,13:07,local,地域,6,千葉日報オンライン,「なぜいじめられた側が逃げなきゃいけないの」　転校後も続く恐怖の日々、加害生徒へのペナルティーいまだ「ゼロ」の実態　#令和の子　#令和の親,https://news.yahoo.co.jp/articles/014ac35b8a97b7b3996afda0d16d0987528b4c8f,1/11(土) 18:03
2025-01-12,13:07,local,地域,7,HBCニュース北海道,「拉致したろか」「旭川にいること忘れるな」自衛隊を受験した21歳男性を恐喝未遂疑い　採用担当の元自衛官の男「一部は私以外の者が送った」,https://news.yahoo.co.jp/articles/d6b2c340fe6020019427038fcaa79f47c69356d3,1/12(日) 9:52
2025-01-12,13:07,local,地域,8,ＳＢＣ信越放送,【雪はいつ、どこで降る?】15日（水）から16日（木）頃は北日本から東日本の日本海側を中心に荒天の可能性…再び強い寒気が南下【雪のシミュレーション掲載　12日正午】,https://news.yahoo.co.jp/articles/2846e344b46bcfedc413fb5729fb8b6635a479b0,1/12(日) 12:36
2025-01-12,13:07,local,地域,9,RCC中国放送,道路脇歩いていた20代男性　後ろからきた軽乗用車にはねられ死亡　運転していた女は現行犯逮捕　前をよく見ていなかった可能性も,https://news.yahoo.co.jp/articles/593f7d236e4ef210e4586c42ecc8678fae63afb7,1/12(日) 12:24
2025-01-12,13:07,local,地域,10,読売テレビ,【なぜ】「大義ない」選挙の行方は…「自分に非はない」岸和田市長VS選挙戦に突入する前市議のホンネ 女性との性的関係めぐり“不信任決議”と年の瀬の“議会解散”,https://news.yahoo.co.jp/articles/87f85895809ae2629b92258382c917c1257b756a,1/12(日) 12:00
2025-01-12,13:07,local,地域,11,BSS山陰放送,不妊治療を経て待望の妊娠…3卵性「三つ子」育児に密着　「3つ胎盤があったからその度に出血…死ぬかも」　リスク乗り越えまもなく3歳に,https://news.yahoo.co.jp/articles/fdcf2829bdf2e726e89c0f683d13ebb8ad4dfc56,1/12(日) 7:06
2025-01-12,13:07,local,地域,12,NBC長崎放送,嵐活動休止に引き裂かれた心、救ったのも‟推し”だった　人生の潤い「推し活」代は年間平均40万円,https://news.yahoo.co.jp/articles/d98b161143719a72456862fb421032079b1a52e8,1/12(日) 11:57
2025-01-12,13:07,local,地域,13,愛媛新聞ONLINE,画家MAYA MAXXさん死去　63歳　愛媛・今治出身,https://news.yahoo.co.jp/articles/98ae272be992ec1d4220d6274a3922c8aa7e26bb,1/11(土) 20:50
2025-01-12,13:07,local,地域,14,千葉日報オンライン,【速報】松戸で路上強盗、女子大生襲った男逃走　塩付いた手袋で顔押さえつけ、バッグ奪ったか,https://news.yahoo.co.jp/articles/ec8d22936ce0a56378376c554724d997c4d8bb26,1/12(日) 11:57
2025-01-12,13:07,local,地域,15,TNCテレビ西日本,「知らない人が家のこたつに入って寝ている」住居侵入の現行犯で３２歳の男を現行犯逮捕　福岡市早良区,https://news.yahoo.co.jp/articles/bd261b841064cc37f699248d79949131bd6cc7f6,1/12(日) 9:31
2025-01-12,13:07,local,地域,16,ＳＢＣ信越放送,やって来た!【第3次ドーナツブーム】続々オープンの店には行列が…クリスピー・クリーム・ドーナツの上陸、コンビニドーナツに続く「波」の背景には専門店が、一方で地元客に愛される「ドーナツ万十」も,https://news.yahoo.co.jp/articles/2bda4abb48061284b7402ea6814f4421420ebf1f,1/12(日) 8:02
2025-01-12,13:07,local,地域,17,京都新聞,全国女子駅伝、まもなくスタート　京都新聞デジタルで1区から9区まで速報,https://news.yahoo.co.jp/articles/50901604d788ab59654bc50557285edf74b9a3ae,1/12(日) 12:02
2025-01-12,13:07,local,地域,18,OHK岡山放送,丸亀市の飲食店で食中毒「カンピロバクター」検出…２人が下痢や腹痛などの症状　３日間の営業停止【香川】,https://news.yahoo.co.jp/articles/d812f4dabb139d9fa086615ac8eec4b38ea61a4c,1/12(日) 10:45
2025-01-12,13:07,local,地域,19,チューリップテレビ,15日 16日に再び “冬の嵐” 強烈寒気で関東以西も極寒に…その後は寒さ和らぐ【2週間天気】15日から “嵐の使者” 強い寒気が流れこみ荒れた天気に【大雪と雨のシミュレーション 16日まで】,https://news.yahoo.co.jp/articles/fd22d743501d99d4d64b1d0cba948b657a6e463e,1/12(日) 10:32
2025-01-12,13:07,local,地域,20,埼玉新聞,ついに姿を現した「西武8000系」　元小田急の車両、青帯から市松模様へイメージ一新　省エネ「サステナ車両」整備を終え、屋外を走行　今年5月から西武国分寺線で運行開始予定,https://news.yahoo.co.jp/articles/75878d037bf61055b251db1a1074beb6701f16c6,1/12(日) 11:21
2025-01-12,13:07,local,地域,21,HOME広島ホームテレビ,福山市で歩行者が軽自動車にはねられ死亡・広島,https://news.yahoo.co.jp/articles/8e6c383f2bd3565e1123f65be5b00c0fe25d751c,1/12(日) 12:15
2025-01-12,13:07,local,地域,22,埼玉新聞,ヤオコーが出店を予定、マミーマート跡地に　ファミマの向かい側　地上2階建て、店舗面積は4963平方メートル　駐車場は205台の計画　最短で8月7日オープンか,https://news.yahoo.co.jp/articles/e7e9f0c6dc1b474b1cf255af3a3d4d30e46d8317,1/10(金) 10:23
2025-01-12,13:07,local,地域,23,TNCテレビ西日本,八木山バイパスで大型トレーラー炎上　大量の“紙おむつ”など全焼　通報「荷台が燃えている」　国道２０１号線は５時間全面通行止め　焼け跡の状況からタイヤ付近から出火か　福岡・飯塚市,https://news.yahoo.co.jp/articles/1dea261a29c85bdc9e7755263520bc3812564516,1/11(土) 10:07
2025-01-12,13:07,local,地域,24,読売新聞オンライン,「春高バレー」男子の東福岡が決勝進出、3連覇を目指す駿台学園と再戦へ…総体決勝では敗れる,https://news.yahoo.co.jp/articles/da3c68b2968030383fb2f883d32fa9476f81a5c0,1/12(日) 10:58
2025-01-12,13:07,local,地域,25,神戸新聞NEXT,JR神戸線大久保－姫路間で一時運転見合わせ　播磨町で新快速が人身事故,https://news.yahoo.co.jp/articles/6c39bc6399dccc2bb25daad93d488b318f9f43ec,1/12(日) 11:30
2025-01-12,13:07,local,地域,26,RKB毎日放送,特急「ソニック12号」が人と衝突　上下線で運転見合わせ　在来線も運休や遅れ,https://news.yahoo.co.jp/articles/ba34a9d6028908a903ba28995a56401e19a5bd42,1/12(日) 10:41
2025-01-12,13:07,local,地域,27,福島民報,福島県１区は鈴木　１２日都道府県女子駅伝,https://news.yahoo.co.jp/articles/c7ea006fdaa8bdb504172f1b15c9bf6331af4f93,1/12(日) 12:01
2025-01-12,13:07,local,地域,28,新潟ニュースNST,面識ある未成年の女性を車に連れ込み性的暴行の疑い　無職の47歳男を3度目の逮捕【新潟】,https://news.yahoo.co.jp/articles/51403be61fdec11240ae4e91eb85eac561a7afa8,1/12(日) 11:01
2025-01-12,13:07,local,地域,29,チューリップテレビ,【気象情報】千葉県ではあす朝からあさってはじめにかけて雪が降る所も…予想より気温が低く経過すれば“積雪”となる可能性も【大雪と雨のシミュレーション 13日まで】,https://news.yahoo.co.jp/articles/e0be3c418cda60eeaa5fa32a54bb8e21a8bac266,1/11(土) 19:13
2025-01-12,13:07,local,地域,30,神戸新聞NEXT,俳優・鈴木亮平さん、小学6年で震災体験　傷ついた西宮や神戸、心に刻んだ「すごく自分に効いている」,https://news.yahoo.co.jp/articles/ab5de9b278433451ad8704ca44196c13e6df51b9,1/12(日) 8:00
2025-01-12,13:07,local,地域,31,神戸新聞NEXT,トラックと衝突、バイク2人乗りの15歳少年少女が重傷　尼崎の国道2号,https://news.yahoo.co.jp/articles/738fafbca02f4d4e742a9a2ded1bead524c0198b,1/12(日) 9:00
2025-01-12,13:07,local,地域,32,京都新聞,全国女子駅伝のオーダーが決定　アンカーに有力選手ずらり　兵庫・田中、長崎・広中、石川・五島,https://news.yahoo.co.jp/articles/45846b5d77f26a0d612a5b8e584de85a7e71b1f5,1/11(土) 15:18
2025-01-12,13:07,local,地域,33,YBS山梨放送,解体作業中に5ｍ転落 重さ1.5ｔの成形機に足挟まれ死亡 サンスター技研の工場で 山梨,https://news.yahoo.co.jp/articles/3b3af4b6919e33edf8eb187ce20252a1bcbad2be,1/11(土) 23:06
2025-01-12,13:07,local,地域,34,埼玉新聞,28年半の歴史に幕…「トイザらス・ベビーザらス岩槻店」あす13日に閉店　「実際に手に取って選ぶ楽しさは格別」「なくなるのは悲しい」親子3代で通った客も　全国でも希少な単独店舗だった　閉店の理由は,https://news.yahoo.co.jp/articles/8f97119f60a4883677747fe103984fdd84f5372e,1/12(日) 10:06
2025-01-12,13:07,local,地域,35,NBC長崎放送,長崎県内 山間部の道路18か所で交通規制【午前7時現在】,https://news.yahoo.co.jp/articles/abc3cfd6eed69a0de65f84fcfb113b9f47dc12d6,1/12(日) 8:19
2025-01-12,13:07,local,地域,36,秋田テレビ,秋田市土崎地区でクマの目撃相次ぐ　秋田,https://news.yahoo.co.jp/articles/22d50b44f8e5c33511f2242eb729edd9d14db27b,1/12(日) 11:36
2025-01-12,13:07,local,地域,37,RKB毎日放送,九州北部12日夕方にかけて大雪のおそれ 路面の凍結などに注意,https://news.yahoo.co.jp/articles/7341fc4b11e389d2786911db69583225b1ec82d3,1/12(日) 12:13
2025-01-12,13:07,local,地域,38,カナロコ by 神奈川新聞,ＪＲ橋本駅北口で天井板が落下　重さ３・６キロのケイカル板、けが人なし,https://news.yahoo.co.jp/articles/85d5effbdf6c7c217ebfe07310121d6ad39a3319,1/11(土) 19:50
2025-01-12,13:07,local,地域,39,ABCニュース,ガールズバーで従業員が多量飲酒し死亡　「酔いつぶれて寝ているだけだと思った」倒れたまま放置していた経営者・客らを書類送検　京都・福知山市,https://news.yahoo.co.jp/articles/9e7ea15cef645b40369b4b9a24a4bf87078e9e52,1/10(金) 14:17
2025-01-12,13:07,local,地域,40,カナロコ by 神奈川新聞,談笑していたところ…派遣社員の女性の腕刺した疑い　無職の男を現行犯逮捕,https://news.yahoo.co.jp/articles/c6313decab0ac7f0a718b7dce8faf3f0477251f0,1/12(日) 10:50
