scrp_date,scrp_time,genre_en,genre_jp,rank,media_jp,title,link,date_original
2024-12-09,12:22,TTL,総合,1,日刊スポーツ,中山美穂さんと交際していた音楽家がXで追悼投稿「『最近どうよ』とか話せたらと思っていた」,https://news.yahoo.co.jp/articles/b28a4169ed037b425d5188b0ab57621862211f88,12/9(月) 9:40
2024-12-09,12:22,TTL,総合,2,ABEMA TIMES,「一生分の借金かな」デビット伊東、妻のため最後のラーメン店…元相方・ヒロミへの思いも明かす,https://news.yahoo.co.jp/articles/efd81ef7de47d8c68d412b7f08497ebe382087cd,12/8(日) 11:32
2024-12-09,12:22,TTL,総合,3,J-CASTニュース,「座席を倒していいですか？」→「ダメです」とバッサリ　Xに集まる...虚を突かれる「新幹線トラブル」,https://news.yahoo.co.jp/articles/97c3cf1d8e574128c488c2a71e7a30e49355daa5,12/9(月) 10:00
2024-12-09,12:22,TTL,総合,4,日刊スポーツ,中山美穂さん、死亡推定時刻は午前３時～５時ごろか　死因は入浴中の不慮の事故／発見までの経過,https://news.yahoo.co.jp/articles/da56b8c24584220a560aae64a84c75ba040c1c9e,12/9(月) 5:02
2024-12-09,12:22,TTL,総合,5,Full-Count,「3年だけ」のはずが…日本で過ごした15年　退団で溢れた涙、31歳の心に宿る“第2の故郷”,https://news.yahoo.co.jp/articles/04ee211cd54996a814c9fb71b9184bb4e77180ed,12/9(月) 7:20
2024-12-09,12:22,TTL,総合,6,ねとらぼ,母親から届いた「もち」の仕送り方法が秀逸　まさかの梱包アイデアに「この発想は無かった」と称賛　投稿者にその後を聞いた,https://news.yahoo.co.jp/articles/a27012e4934587c72ff63897119b42b7dd3ab688,12/9(月) 7:30
2024-12-09,12:22,TTL,総合,7,デイリースポーツ,ダンプ松本、中山美穂さんに「怖くないの？」も「全然怖くないよ」　涙流して「美穂ちゃんの前だけ普通のダンプに」,https://news.yahoo.co.jp/articles/4946497dbf621ece2cee93997c00c945e1400fa8,12/9(月) 8:53
2024-12-09,12:22,TTL,総合,8,ファイナンシャルフィールド,年末年始に30代の娘が帰省しますが「滞在費を払うから家事を全てやって」と言われています。どれくらいお金をもらえばいいのでしょうか？,https://news.yahoo.co.jp/articles/e8bc009f6dd03aa3b674d226ddc5afd2189b7a26,12/9(月) 8:40
2024-12-09,12:22,TTL,総合,9,スポニチアネックス,中山美穂さん　死因は入浴中の事故　医療ジャーナリスト4つの可能性指摘,https://news.yahoo.co.jp/articles/21bf600d3816dc3e52b7c9d56d7e9c33db12fc7d,12/9(月) 4:00
2024-12-09,12:22,TTL,総合,10,ENCOUNT,【BreakingDown】「マジ!?」「鳥肌」　残り1秒での大逆転“失神KO”にネット戦慄「ありえんやろ」,https://news.yahoo.co.jp/articles/1c33a3576c69eac127dd73bd18fec6accbc0506d,12/9(月) 8:29
2024-12-09,12:22,TTL,総合,11,J-CASTニュース,池袋暴走事故遺族、殺害予告の女子中学生への「被害届」取り下げず　「私なりの唯一出来る愛の形」思いつづる,https://news.yahoo.co.jp/articles/8c9df18bf6dbe4c7427d3e84af9bc2e28d0b5402,12/8(日) 12:21
2024-12-09,12:22,TTL,総合,12,スポニチアネックス,ドジャースが通算167発の左打ち外野手コンフォートと25億円で契約　今季ジ軍で20HR　米報道,https://news.yahoo.co.jp/articles/d8584211de482fdabf91853759ddaa84cbd2a22b,12/9(月) 11:38
2024-12-09,12:22,TTL,総合,13,中央日報日本語版,ウクライナ軍、ロシア兵の死ぬ前最後の姿公開…「たばこを１本だけ」,https://news.yahoo.co.jp/articles/1f89a647416760aacb3e0d87eb99ce599c9c4e52,12/9(月) 10:10
2024-12-09,12:22,TTL,総合,14,RONSPO,「井上尚弥の歴史を終わらせる」はずの五輪連覇ラミレスがWBO世界戦でまさかの6R棄権負けで「自分が終わる」も「肘打ちの反則で目が見えなくなった」と猛抗議,https://news.yahoo.co.jp/articles/5ea1d8307aecbb181c6b473a698fed57f56c496c,12/9(月) 6:31
2024-12-09,12:22,TTL,総合,15,日テレNEWS NNN,シリアのアサド政権が崩壊　“後ろ盾”露プーチン政権へのダメージは,https://news.yahoo.co.jp/articles/52f2a169c3393a2a8a5bc962f2f115e8e7a35351,12/9(月) 6:00
2024-12-09,12:22,TTL,総合,16,Full-Count,次なる“ブレーク枠”は誰に…9/24が退団の厳しい現実も　注目される第3回現役ドラフト,https://news.yahoo.co.jp/articles/a8bf59b53d0ad25a28d3e61c541a4869e0368f35,12/9(月) 7:10
2024-12-09,12:22,TTL,総合,17,朝鮮日報日本語版,死ぬ前にタバコを一服…ウクライナのドローンに捉えられたロシア兵士の最期,https://news.yahoo.co.jp/articles/7536ada4363e4ac9088578f1efb47f8d1f51b98a,12/9(月) 11:33
2024-12-09,12:22,TTL,総合,18,ねとらぼ,父「好きなアイス1つ買っていいよ」→“1つ”の概念が問われそうな選択に870万表示「こんなのあるんだ」「“1つ”には違いない」,https://news.yahoo.co.jp/articles/357be20dc5ead381baf934d2650fbea848437fe1,12/9(月) 7:40
2024-12-09,12:22,TTL,総合,19,日刊スポーツ,俵万智さん、高校の最寄り駅の名前を公開し衝撃「そんなことある？」「本名なんかい」驚きの声,https://news.yahoo.co.jp/articles/edaffa06ff3e106b5869bbf6e1ad7d72b546cf2a,12/9(月) 10:49
2024-12-09,12:22,TTL,総合,20,ほ・とせなNEWS,無限に生えてくるドクダミ　その驚きの駆除方法に「目から鱗」「やってみよう」「勉強になりました」,https://news.yahoo.co.jp/articles/d224bf79e950ab2b82013c61d8c2430d007ef2b0,12/9(月) 6:30
2024-12-09,12:22,TTL,総合,21,産経新聞,ロシア、アサド政権崩壊でまたも「勢力圏」喪失　ウクライナ侵略の代償、アルメニアに続き,https://news.yahoo.co.jp/articles/17defdeee817dc1c411b77c5870d7be17f6cdc74,12/9(月) 9:36
2024-12-09,12:22,TTL,総合,22,Full-Count,4度戦力外のドラ1が引退　急成長の28歳、侍で世界一の捕手も…巨人2017年組の明暗,https://news.yahoo.co.jp/articles/c8aa4506dd9413dd664440ec25b33b18dbcd4692,12/9(月) 8:10
2024-12-09,12:22,TTL,総合,23,スポニチアネックス,中山美穂さん死因判明　ドカベンの入浴法が話題に　ネット「このシーンを思い出した」「足から温めて…」,https://news.yahoo.co.jp/articles/ad4e73ff49fb24b437cd804aa6f80781cf2c2818,12/8(日) 22:30
2024-12-09,12:22,TTL,総合,24,RONSPO,「元RIZIN王者の朝倉海は完全にレベルの違いを見せつけられた」米メディアはUFCデビュー戦でフライ級王者に失神1本負けの衝撃を辛辣批判…「才能があるのも明らか」の声も,https://news.yahoo.co.jp/articles/627e9c7ff46438d092557dad8dccce54fb7627e9,12/9(月) 7:33
2024-12-09,12:22,TTL,総合,25,TBS NEWS DIG Powered by JNN,【速報】会社の元同僚を自殺に見せかけ殺害か…線路に立ち入らせ電車と衝突　塗装会社社長ら4人を殺人・監禁疑いで逮捕　背景に日常的ないじめか　警視庁,https://news.yahoo.co.jp/articles/f6147b21e9931bf7f50b6d592626c056c9126fbc,12/8(日) 23:15
2024-12-09,12:22,TTL,総合,26,CoCoKARAnext,衝撃の失神一本負け　UFC王者にレベルの違いを見せつけられた朝倉海　“無謀な挑戦”での敗因は何だったのか「減量がまずかった」,https://news.yahoo.co.jp/articles/522eb6bfb53b261f80d66d2278ac2468759d1bf2,12/9(月) 11:32
2024-12-09,12:22,TTL,総合,27,シネマトゥデイ,中山美穂さん、死因が判明,https://news.yahoo.co.jp/articles/36674dca9d978501236b675bb5cb78308f8e7122,12/8(日) 16:05
2024-12-09,12:22,TTL,総合,28,motorsport.com 日本版,角田裕毅、次はいよいよ”レッドブルRB20”テストドライブ「楽しみだけど、それ以上にチームが求めるような仕事をしたい」,https://news.yahoo.co.jp/articles/b0de4585a8c3867366709c031e9b88f6bb32f5c5,12/9(月) 8:23
2024-12-09,12:22,TTL,総合,29,スポニチアネックス,元夫・辻仁成氏、ブログで心境吐露「不意の悲しい知らせが…」　14年に離婚…息子中山美穂さんと会えず,https://news.yahoo.co.jp/articles/7dd2186b614cd9b07dca795389eb8954d06d6291,12/9(月) 4:00
2024-12-09,12:22,TTL,総合,30,スポニチアネックス,大谷翔平　妻・真美子さんと仲睦まじくレイカーズ戦サプライズ生観戦！特別ユニを持って笑顔2S,https://news.yahoo.co.jp/articles/cc1bbb5683b8bf68690f8a1f9d3cda6ca96e7d26,12/9(月) 11:52
2024-12-09,12:22,TTL,総合,31,婦人公論.jp,『光る君へ』最終回予告。「よろしいかしら」と道長の前に立つ倫子と舌を出す明子。年を重ねたききょうとまひろが笑い合う。そして最期の時を迎えた道長を前にまひろが語るのは…,https://news.yahoo.co.jp/articles/b721ec4cbf5d176314fc93f64de1fdb19dd80709,12/9(月) 11:09
2024-12-09,12:22,TTL,総合,32,ゴルフ総合サイト ALBA Net,岩井千怜が単独首位で最終日へ　山下美夢有2位、原英莉花は敗退【LPGA最終予選】,https://news.yahoo.co.jp/articles/05a5587139d37fc7108c8e87ec8afce46ee8ead6,12/9(月) 5:52
2024-12-09,12:22,TTL,総合,33,スポニチアネックス,森永卓郎氏「腫瘍マーカーが爆上がりしている。CA19―9が20、30倍…がんは今のところ小康状態」,https://news.yahoo.co.jp/articles/4a911eb49917010d7ffd2c3156d255b8a0149dde,12/9(月) 10:31
2024-12-09,12:22,TTL,総合,34,Full-Count,大谷翔平、グラブ寄贈の舞台裏「少額にはなりませんよ」　関係者が感動した“男気”,https://news.yahoo.co.jp/articles/63349805dde929e2910ac25bfab5719325585beb,12/9(月) 7:40
2024-12-09,12:22,TTL,総合,35,イーファイト,水着の太腿がピクピク動く…怪物マッスル女子、リカバリーの衝撃,https://news.yahoo.co.jp/articles/05b227cefc69c341b7f8ffaf89bed4961af2aa4d,12/9(月) 8:10
2024-12-09,12:22,TTL,総合,36,ファイナンシャルフィールド,年末年始は家族で「ニューヨーク」に行くというママ友がうらやましい…！旦那さんは「大手企業の課長」らしいのですが、そんなにお金があるのでしょうか？,https://news.yahoo.co.jp/articles/c08264213ae559c86c93f8fdb8ca6da18c83bf05,12/9(月) 11:20
2024-12-09,12:22,TTL,総合,37,ねとらぼ,高校生のときに付き合い始めた2人→10年後……　現在の姿に「めっちゃキュンってした」「まるで映画の世界」と1000万表示突破,https://news.yahoo.co.jp/articles/7d635c64f16f09d924b18d621e4e0382197f5a27,12/8(日) 19:00
2024-12-09,12:22,TTL,総合,38,読売新聞オンライン,シリア政権軍は無抵抗、「アサド氏は驚き不満」…イラン外相が国営テレビで明かす,https://news.yahoo.co.jp/articles/d49017d25fdfb78e386043ec56f05d79050258f1,12/9(月) 9:57
2024-12-09,12:22,TTL,総合,39,日刊ゲンダイDIGITAL,巨人が助っ人大量補強へまっしぐら…阿部監督は新規で「投打の主力級」3人をリクエスト,https://news.yahoo.co.jp/articles/a0b3ad027dfe0b688a600ba3b57f3545d332510f,12/9(月) 11:32
2024-12-09,12:22,TTL,総合,40,Full-Count,大谷夫妻がNBA観戦　場内大歓声…レイカーズから2人に特別ユニプレゼントも,https://news.yahoo.co.jp/articles/4eb53f4bf42c705a0c5c927108741f1f06a8ccd4,12/9(月) 11:35
