scrp_date,scrp_time,genre_en,genre_jp,rank,media_jp,title,link,date_original
2025-02-07,10:34,TTL,総合,1,中央日報日本語版,インフルエンザ罹患の２７歳中国男性俳優も他界…徐熙媛さんの悲報に次いで判明,https://news.yahoo.co.jp/articles/15b3eb8eef86732cbe06845111ece296f8288a7f,2/7(金) 7:52
2025-02-07,10:34,TTL,総合,2,ほ・とせなNEWS,父の隣に写る12歳の少女　10年後の2人の姿に…「お父さん若くなっている」「イケメン」「美人」,https://news.yahoo.co.jp/articles/597ea6aedc698ac99c13332f9061b56706ec2935,2/7(金) 7:30
2025-02-07,10:34,TTL,総合,3,スポニチアネックス,浜田雅功　沖縄行きの航空機で両隣に座った超大物芸能人「挟まれたんだよ」　スタジオ騒然,https://news.yahoo.co.jp/articles/fe8c24a9c85fb076e151f0ec102ee60e4cbcf75b,2/6(木) 22:28
2025-02-07,10:34,TTL,総合,4,映画チャンネル,これは許せない…日本アニメの海外実写版、世紀の失敗作（5）原作ファンも無視…大爆死に終わった原因とは？,https://news.yahoo.co.jp/articles/08f314fb3d102f2d7ed9ba326b9480ff34a0248e,2/7(金) 6:50
2025-02-07,10:34,TTL,総合,5,Full-Count,水原夫人、大谷からポルシェ贈呈されていた　ファーストクラス手配も…検察が指摘した“好待遇”,https://news.yahoo.co.jp/articles/f0b511bba9911a92952f05b77e39c94d7aff82e5,2/7(金) 9:07
2025-02-07,10:34,TTL,総合,6,RONSPO,「今のままじゃ後何年も野球はできないぞ」中日・中田翔の15キロ大減量の仕掛け人は井上監督だった…ただ「4番・一塁を彼に空けておく気はない」と“4番サバイバル”を通告,https://news.yahoo.co.jp/articles/541999e5cc55d6f7a1379a3145ca40cbd4026ae5,2/7(金) 7:00
2025-02-07,10:34,TTL,総合,7,Full-Count,公開された大谷翔平の“衝撃画像”「可愛過ぎて声出た」　激レア衣装に注目「ママみが凄い」,https://news.yahoo.co.jp/articles/1597666e04d3d1ff2f8d475a99ad30466902ca9b,2/7(金) 7:40
2025-02-07,10:34,TTL,総合,8,スポニチアネックス,渡辺明九段　漫画家・伊奈めぐみ氏と昨年に離婚　元妻とは「今後も一緒に暮らしていく」,https://news.yahoo.co.jp/articles/d8fcb7bfa524cc250f4de772146f7d535ceecf1b,2/7(金) 6:50
2025-02-07,10:34,TTL,総合,9,日刊ゲンダイDIGITAL,元フジテレビ長谷川豊氏“危機管理のプロ”が古巣告発は禁じ手？ 大反響の動画チャンネル行脚の裏事情,https://news.yahoo.co.jp/articles/21d621e5d2455b2d1dc601361dda2e9ed25dc186,2/7(金) 7:16
2025-02-07,10:34,TTL,総合,10,ゲキサカ,ギョズテペ松木玖生が8強王手に導く決勝ゴール!! トルコ杯3戦2発でさすがの勝負強さ発揮,https://news.yahoo.co.jp/articles/73e761e8b236d01c21bd956090c67f93960231b6,2/7(金) 8:14
2025-02-07,10:34,TTL,総合,11,ENCOUNT,「エグすぎだろ」教習所の料金に驚きの声　物価高騰余波　「免許取るのにもこんな金額じゃなかなか難しい」,https://news.yahoo.co.jp/articles/0379de2eeff5113d1a0110fd10050f72926a90c7,2/6(木) 10:30
2025-02-07,10:34,TTL,総合,12,ABEMA TIMES,国民・玉木雄一郎氏、SNSで猛反発受けた「金融所得課税30％」に「103万円の壁のための財源ではない」「資産形成を阻害することは絶対にやらない」,https://news.yahoo.co.jp/articles/eaa8de6294d929f3af56332ec25147993640fc03,2/7(金) 7:02
2025-02-07,10:34,TTL,総合,13,イーファイト,あの”BD”椅子蹴りラウンドガール、初挑戦にギリギリ”極小”ボデイで「新たな破壊力！」格闘技でブレイク,https://news.yahoo.co.jp/articles/5d000513b2b5c6b1e9ca444dd687b7a10e988816,2/7(金) 5:56
2025-02-07,10:34,TTL,総合,14,ハフポスト日本版,上着の下に着るだけで防寒対策になるグッズ⇨「盲点だった」「まさか役立つとは」。100円ショップで購入可能、自衛隊の豆知識,https://news.yahoo.co.jp/articles/ab677cf0e08ead406f5e86e3630a143d9f70725e,2/7(金) 6:31
2025-02-07,10:34,TTL,総合,15,ABEMA TIMES,埼玉県の道路陥没事故…原因は“技術者をないがしろにしたツケ”？ 配管のプロが提言「工業高校で“設備科”の拡充を」,https://news.yahoo.co.jp/articles/7b56807b1727b668c138a9bfb04b81d3a6001cf6,2/6(木) 12:51
2025-02-07,10:34,TTL,総合,16,ねとらぼ,「これは泣いてまうやろ～」友人の安産祈願に“クッキー缶”をプレゼント→驚きの中身が618万表示「永久保存しときたい」,https://news.yahoo.co.jp/articles/81f5511847d6d763a972cafefc9d3cb6f8c6b2f4,2/7(金) 7:40
2025-02-07,10:34,TTL,総合,17,日刊スポーツ,PTSD公表の元フジアナ渡邊渚さん「素敵な写真たくさん」ノースリーブで雑誌インタビュー告知,https://news.yahoo.co.jp/articles/ad659591212c034e0ca85849dfc9fed56e66ff01,2/7(金) 4:00
2025-02-07,10:34,TTL,総合,18,Full-Count,“老けない”40歳は「奇跡のフェイス」　1軍復帰のイケメン…ファン悶絶「ビジュ爆上がり」,https://news.yahoo.co.jp/articles/039eb2c6741c9dd89b8cf90101f78197a79adee7,2/7(金) 7:20
2025-02-07,10:34,TTL,総合,19,中央日報日本語版,顔面蒼白な徐熙媛さん、夫ク・ジュンヨプさんに寄りかかる写真…故人のプライバシー流出に怒り,https://news.yahoo.co.jp/articles/eccc2a8953e571dd9381d247ac855e91a742b6ac,2/7(金) 8:16
2025-02-07,10:34,TTL,総合,20,デイリースポーツ,水原一平被告　南カリフォルニアの刑務所を希望　３月２４日に収監　米報道では大谷翔平が被害者陳述書を提出とも,https://news.yahoo.co.jp/articles/e9d23c70a109a3aaf2afbe99f7e99b174f4e6a48,2/7(金) 8:43
2025-02-07,10:34,TTL,総合,21,MBSニュース,石破総理に記者がぶつけた「万博の目玉って何ですか？」「もし赤字になったら？」モヤモヤ残る“無難な回答”から見えたこと,https://news.yahoo.co.jp/articles/0d02924c32bf5088ec81d8d38ae74845ccab4f42,2/7(金) 8:03
2025-02-07,10:34,TTL,総合,22,スポニチアネックス,禁錮4年9月の水原一平被告　刑期終了後は米国外退去へ　双方の弁護士が見解示す　賠償金は26億円,https://news.yahoo.co.jp/articles/34221d0fd03b5b09a05064b719d9ed154d685ce4,2/7(金) 8:23
2025-02-07,10:34,TTL,総合,23,西スポWEB OTTO！,フジ大ヒットドラマ「白い巨塔」ヒロインから21年　46歳女優の〝美魔女ヘア〟に「やばーいほど綺麗過ぎ」「美しさえぐい」と反響,https://news.yahoo.co.jp/articles/9ebc8c4dc6e508fd8f9986e1fb6c55cb6073d7fa,2/7(金) 0:10
2025-02-07,10:34,TTL,総合,24,ねとらぼ,14歳のとき、親友の兄と付き合うことになった女性→13年後……　“まさかの結末”に「韓国ドラマみたい」【海外】,https://news.yahoo.co.jp/articles/c80891d57b44c7a7413da8d52fc8d8177fe8f706,2/6(木) 19:15
2025-02-07,10:34,TTL,総合,25,西スポWEB OTTO！,〝日本一かわいい女子高生〟から大河出演女優へ。「仕事帰りに癒されました」情報番組レギュラー出演し反響,https://news.yahoo.co.jp/articles/109fc0922b468d898ee1d957ca19cbe87bbd3742,2/7(金) 0:20
2025-02-07,10:34,TTL,総合,26,オリコン,キンライサー、フジテレビのCM放送を再開「さまざまなご意見があることも承知」,https://news.yahoo.co.jp/articles/df58af2b5dbe2b4b7c669e7ad50b9227645588ee,2/7(金) 9:08
2025-02-07,10:34,TTL,総合,27,新潟ニュースNST,「逃げるな！」“ながら運転”取り締まられた52歳の女が逃走図り…ドアを開けたまま車をバックさせて警察官に衝突　“公務執行妨害”で逮捕「関係ないし、やってません」,https://news.yahoo.co.jp/articles/c094331a37073c25aa0b8a5f6242a1ae75e8f948,2/7(金) 6:30
2025-02-07,10:34,TTL,総合,28,中日スポーツ,大谷翔平、MVPフリーマンが目撃した衝撃シーン…トラウトと同じ言葉、二刀流復活に疑いなし…「彼ができないことはない」,https://news.yahoo.co.jp/articles/0724142b429fc482f059f70bb173a53c26b6ed6e,2/7(金) 2:25
2025-02-07,10:34,TTL,総合,29,スポニチアネックス,夫は有名力士、美人歌手が雰囲気ガラリ“春の装い”披露に「2人の母親とは思えない」「めちゃ可愛い」,https://news.yahoo.co.jp/articles/3360bed7bba055fb238776cc639deae45542a4c6,2/7(金) 8:35
2025-02-07,10:34,TTL,総合,30,BBC News,コンゴ民主共和国で脱獄、女性100人以上がレイプされ生きたまま焼かれたと国連,https://news.yahoo.co.jp/articles/f56e78afaa1eb45de750fca09d23d6e9ca039043,2/7(金) 9:28
2025-02-07,10:34,TTL,総合,31,ファイナンシャルフィールド,停止線を越えて停車してしまい、警察に呼び止められました。信号が「黄色」になったタイミングで仕方なかったのですが、罰金は払わないといけないのでしょうか？,https://news.yahoo.co.jp/articles/d3fe35f496652c213859b08b01e10fc0c27b3e8f,2/6(木) 11:30
2025-02-07,10:34,TTL,総合,32,ねとらぼ,「ほんとにぃ？」　登山中に見かけた“疑わしい看板”が怪しすぎて総ツッコミ　「信用してはならない」「1時間は覚悟が必要」,https://news.yahoo.co.jp/articles/fced0a745744c633614dac60805449bbd3c3f6ea,2/7(金) 7:00
2025-02-07,10:34,TTL,総合,33,ねとらぼ,台所に立つおばあちゃん、まさかの“巨大生物”をおんぶしながら……　驚きの光景が100万再生「凄すぎ」,https://news.yahoo.co.jp/articles/13863325c73367ba961847a86b82cd8c2b7114bd,2/7(金) 9:30
2025-02-07,10:34,TTL,総合,34,スポーツ報知,渡辺明九段、漫画家・伊奈めぐみさんと離婚していた「夫婦で応援して下さった方に申し訳なく思います」,https://news.yahoo.co.jp/articles/d0062bdea32ffd04a59cfbfad3f6985cc68f53ad,2/7(金) 1:21
2025-02-07,10:34,TTL,総合,35,Hint-Pot,「あれ？　忘れていないかな？」　オーストラリア人が日本で衝撃　滞在中に何度も驚いてしまった場面とは,https://news.yahoo.co.jp/articles/4b32b5c572e1ddcff8c70f68f42eb50787fe377c,2/7(金) 6:10
2025-02-07,10:34,TTL,総合,36,くるまのニュース,「どんな神経をしているんだ？」「永久に免許取消しでいい」 救急車にあおり運転をした男を逮捕 どんな罪になる？ 罰則強化求める声も,https://news.yahoo.co.jp/articles/d7ac223bc9afbc751acd730690cdf532170e1d61,2/7(金) 9:10
2025-02-07,10:34,TTL,総合,37,Full-Count,2軍で驚異の4割超→戦力外　涙の25歳が誓う“リベンジ”…古巣には「思うことない」,https://news.yahoo.co.jp/articles/a6a2e64b01c3d3f059a736436978b51a5555a66c,2/7(金) 7:30
2025-02-07,10:34,TTL,総合,38,まいどなニュース,車のボンネットから子猫の鳴き声「うちの子にしよう！」と迎えたら…“母親代わり”になった先住犬が若返り！ 飼い主はまさかのYouTubeデビュー,https://news.yahoo.co.jp/articles/fad6d87c5c36dad0820356b1c8a6324c6f3154b6,2/7(金) 7:01
2025-02-07,10:34,TTL,総合,39,スポニチアネックス,【王将戦第3局】藤井王将　異次元「6二銀不成」指摘　ネット騒然「将棋星人」「見えてたのか」,https://news.yahoo.co.jp/articles/00aa4e1c442de0314e0754bdca87c9116d2d3f5a,2/6(木) 20:43
2025-02-07,10:34,TTL,総合,40,日刊ゲンダイDIGITAL,佐々木朗希に忍び寄るトミージョン手術の甚大リスク…ドジャースで投げる前から不安材料が山積,https://news.yahoo.co.jp/articles/2543acad6e6ba1d9a8dc4d3cc792d56f22c7b21d,2/7(金) 9:06
