scrp_date,scrp_time,genre_en,genre_jp,rank,media_jp,title,link,date_original
2025-04-24,07:06,life,ライフ,1,LASISA,お笑いのために“容姿”を捨てた！？昔は「イケメンだった」芸人たち,https://news.yahoo.co.jp/articles/2224c7ef7c7117c92a5b7a96bee191cb55b230f4,4/23(水) 20:10
2025-04-24,07:06,life,ライフ,2,ほ・とせなNEWS,高校1年の時に出会った2人→19年後の姿に「涙が出ました」「素敵すぎます」「美男美女ですね～」,https://news.yahoo.co.jp/articles/b3d9a7102c1c7363ef6a3db080172abea4a24b38,4/23(水) 14:19
2025-04-24,07:06,life,ライフ,3,ねとらぼ,ティッシュの空箱に、クリアファイルを貼るだけで→この発想はなかった！　便利でかわいいアイテムに反響,https://news.yahoo.co.jp/articles/56215b3467f797d16c2a4e53cafcaccdcc4f21da,4/23(水) 9:05
2025-04-24,07:06,life,ライフ,4,ELLE DIGITAL,賞味期限が切れたら使わないほうがいい調味料 5,https://news.yahoo.co.jp/articles/5009abeffba5f7add3f81412d171d215af6611a2,4/22(火) 20:50
2025-04-24,07:06,life,ライフ,5,まいどなニュース,自宅の車にスプレー、券売機も破損…悪質な嫌がらせを受けるラーメン店の嘆き　卑劣な行為にファンから怒りの声,https://news.yahoo.co.jp/articles/c953d2be22e4d187cfc998f4956421fa8577e1f3,4/23(水) 7:55
2025-04-24,07:06,life,ライフ,6,ねとらぼ,これは知らなかった！　ダイソー「ワイヤーネット」×「すのこ」目からウロコなDIYに反響「超簡単で安くておしゃれ」,https://news.yahoo.co.jp/articles/65abe3af09daf3feb1c958959f11dcc8910e385f,4/23(水) 20:00
2025-04-24,07:06,life,ライフ,7,ねとらぼ,「日本もついに導入」  ディズニーランド＆シーの“新システム”に大きな反響　「1回はやりたい」「うれしすぎる」,https://news.yahoo.co.jp/articles/0711b053ec4401ecf41b7730537024280e1542d1,4/23(水) 18:04
2025-04-24,07:06,life,ライフ,8,Hint-Pot,「いったい、どのようにしたら保っていられるの？」　フランス人が目を丸くした日本の光景　「全然ない」と驚いたものとは,https://news.yahoo.co.jp/articles/539c02e41faaba3e8f51cac465bc892f9dd494bf,4/24(木) 6:10
2025-04-24,07:06,life,ライフ,9,毎日新聞,飼い犬のチワワを6階から落とした疑い　52歳逮捕　友人と飲酒中,https://news.yahoo.co.jp/articles/69bc205a0f8ccbe7e38a600032e6015f238199f0,4/23(水) 21:32
2025-04-24,07:06,life,ライフ,10,まいどなニュース,山で聞こえる「おーい」の声は人じゃない、すぐ逃げろ…は本当？ツキノワグマの飼育担当者に聞いた,https://news.yahoo.co.jp/articles/0dc1e3adf68ac9bb93c7e314848faeb016bbbf00,4/23(水) 6:55
2025-04-24,07:06,life,ライフ,11,婦人公論.jp,クリスマスイブに宅配ピザが届かず訴訟を起こした男性。「適切な注文管理をしていなかった」と主張…裁判所の判断とは,https://news.yahoo.co.jp/articles/4ddbe8ea60c8fb4a2435b57f009a1f9def7be9dc,4/24(木) 6:32
2025-04-24,07:06,life,ライフ,12,ほ・とせなNEWS,妊娠が判明。しかしその後…医者「あれ？」見せてもらったエコーに「えっ……？？？」「驚き」,https://news.yahoo.co.jp/articles/77d9de7762492b751b1d8639b0e57233d891559b,4/23(水) 21:36
2025-04-24,07:06,life,ライフ,13,ハフポスト日本版,「この手のプラごみ」、洗ったほうがいい？「よく聞かれる」とゴミ清掃芸人、「本当に捨て方に迷う」と話題,https://news.yahoo.co.jp/articles/f5d198121a6aeec41673ccb2c6775df48b97edc1,4/24(木) 6:20
2025-04-24,07:06,life,ライフ,14,Hint-Pot,モラルに欠ける行為…ホテルが「実はやってほしくないこと3選」　知っておきたい宿泊者としてのマナーとは,https://news.yahoo.co.jp/articles/50d6af3289e78dfca5df1afa0a0609c4beb72c9f,4/19(土) 9:24
2025-04-24,07:06,life,ライフ,15,ファイナンシャルフィールド,令和7年4月から「継続雇用制度」が変わる？来月60歳になる私にはどんな影響があるの？,https://news.yahoo.co.jp/articles/f8634d057a1578e85032887a65ae23e1ac1f5a35,4/23(水) 18:20
2025-04-24,07:06,life,ライフ,16,LIMO,【ワークマン】優れた通気性で暑い季節も快適「超通気パンツ」1780円で通勤にも,https://news.yahoo.co.jp/articles/c8e89b2b5d775951566db6f277c8ac581f5b774c,4/23(水) 19:47
2025-04-24,07:06,life,ライフ,17,ほ・とせなNEWS,小学3年生からずっと幼馴染の2人。　16歳で撮ったツーショットから34年後…「あの頃に戻りたいって思わせてくれる」「変わらない友情に乾杯」,https://news.yahoo.co.jp/articles/255c93189b5d77e6ad03e6a53c1fe3a062c585f6,4/22(火) 9:00
2025-04-24,07:06,life,ライフ,18,ファイナンシャルフィールド,「2000円札はプレミアがつく」と聞きました。保管しておいた方がよいでしょうか？,https://news.yahoo.co.jp/articles/be807d226f7b9038ee0ff421d35fa647dae26ddd,4/23(水) 13:30
2025-04-24,07:06,life,ライフ,19,まいどなニュース,「関西万博」の予約が必要なパビリオンが一目でわかるマップが話題「これは助かる！」,https://news.yahoo.co.jp/articles/62667d5442140ff561f9e34ede6b655e683a6a2e,4/23(水) 11:00
2025-04-24,07:06,life,ライフ,20,ねとらぼ,"友達が描いた“すっぴんで麺啜ってる私の油絵""が1000万表示　普段とのギャップに「全力の悪意と全力の愛情を感じる」　投稿者に話を聞いた",https://news.yahoo.co.jp/articles/7902945c5cdf980c9899f6af250ed60216d680e7,4/23(水) 7:30
2025-04-24,07:06,life,ライフ,21,ねとらぼ,住んで5年目の家で“信じられない発見”→キッチンの“まさかの盲点”に「コレは気付かない」「うちにもありました！」,https://news.yahoo.co.jp/articles/e4e7deff9b2e0461f6b4d5aa85020e55d3d44daa,4/23(水) 7:00
2025-04-24,07:06,life,ライフ,22,ねとらぼ,官公庁オークションにすごいクルマが出品　“普通には手に入らない”2台に思わず二度見,https://news.yahoo.co.jp/articles/bf0ebcb1409d2ada8157409201a4296c28ca6d95,4/22(火) 19:40
2025-04-24,07:06,life,ライフ,23,ねとらぼ,“この子はきっと小型犬サイズ”と思っていたら1年半後……「本当に同じ犬かと」　信じられない現在に「これはビックリ」,https://news.yahoo.co.jp/articles/dbc87538372aa5d7f8c92811030547dfa812a794,4/23(水) 19:35
2025-04-24,07:06,life,ライフ,24,ほ・とせなNEWS,母「宿題をやっておいてね」小1男児におねがいしたら　残されたメモに…「社会人みたい」「将来シゴデキ」「よくできました」の声,https://news.yahoo.co.jp/articles/05dfd6a434071d953a8499fe4b2612b3e3584492,4/22(火) 14:10
2025-04-24,07:06,life,ライフ,25,ほ・とせなNEWS,ご飯を食べている生後10ヶ月の息子　しかし、次の瞬間…！？「お父さん若い」「何回も見ちゃう」「可愛い」「幸せ空間」,https://news.yahoo.co.jp/articles/06c7c54f039c487da09a3265a61e47bd3ecdc5b8,4/24(木) 6:30
2025-04-24,07:06,life,ライフ,26,ねとらぼ,クルマを運転していたら→「そんな機能あるんだ」　カーナビの“ある機能”が1400万表示の反響　「すごい」「これが未来の世界」,https://news.yahoo.co.jp/articles/3928e6b7d62e9997cec295df91553d740a368f08,4/23(水) 7:50
2025-04-24,07:06,life,ライフ,27,まいどなニュース,よつ葉バターの自主回収に「このまま食べる」「良い企業は守らねば」　消費者から異例の応援　担当者「お客様の安全を最優先に考え回収しております」,https://news.yahoo.co.jp/articles/1649f3a993d88a004ea8121c94391092a4088fea,4/22(火) 6:50
2025-04-24,07:06,life,ライフ,28,ねとらぼ,夢だった警察官を泣く泣く辞め、ディズニーキャストに→そして今は……　予想外の姿に「憧れます」「面白くて最高！」,https://news.yahoo.co.jp/articles/aa916a3e319656229b0a1114a50daecbd10b6145,4/23(水) 12:00
2025-04-24,07:06,life,ライフ,29,ねとらぼ,絵画のように美しいエビ水槽に高級水草を植え、1年ガチ放置したら……　そうはならんやろな結果に反響,https://news.yahoo.co.jp/articles/ada07e00175f0258e6ad9ae1777a2d0e52c63811,4/22(火) 19:35
2025-04-24,07:06,life,ライフ,30,BuzzFeed Japan,3coinsの「ぽってりコーヒーメーカー」が韓国風っぽくてかわいい！キッチンに置いとくだけでカフェみたいなんです《購入レビュー》,https://news.yahoo.co.jp/articles/7a218d78ac16acf7e4ac59a8cbd8502d4f65a728,4/23(水) 13:35
2025-04-24,07:06,life,ライフ,31,FNNプライムオンライン,南海トラフ巨大地震　福島県でも津波最大4m予想　被害想定見直しで範囲拡大　津波被災地ならではの備えと心構えの危うさを指摘する声,https://news.yahoo.co.jp/articles/fbabe981c0353d005e149467c75273b2927facf1,4/23(水) 20:06
2025-04-24,07:06,life,ライフ,32,ファイナンシャルフィールド,【実録】子どもが「幼稚園の遠足」で水族館に！→入館料150円なのに遠足代「4400円」も請求されたけど、どうしてそんなに高くなるの？ 内訳を確認,https://news.yahoo.co.jp/articles/d5450daeb53818506b175b6dbb356d4a49911dc1,4/20(日) 14:10
2025-04-24,07:06,life,ライフ,33,BuzzFeed Japan,【ニコアンド】4950円→1485円に値下げ中！春夏たっぷり着回せる「コスパ抜群カーディガン」涼しげデザインがオシャレ！《着用レビュー》,https://news.yahoo.co.jp/articles/8a4fe1f6da12296293ed48218c217c5f5539ef18,4/23(水) 12:35
2025-04-24,07:06,life,ライフ,34,ほ・とせなNEWS,新作の柴犬巾着袋。しかしその後ろをよく見ると…「凄い！天才！」「見入ってしまいました」,https://news.yahoo.co.jp/articles/cc073a8cd70d9985c15d097f1922f97f86da119b,4/23(水) 10:00
2025-04-24,07:06,life,ライフ,35,ENCOUNT,「これから大暴落が来る」森永卓郎さんの“予言”は的中したのか　ネット話題も森永康平氏「真意を全く理解していない」,https://news.yahoo.co.jp/articles/af384b7a9078e3ec83c7e9c1f751de43007a425c,4/23(水) 9:10
2025-04-24,07:06,life,ライフ,36,ねとらぼ,「確かに！」「隠れミッキーすぎる」　ディズニーから福岡へ帰宅途中、駅で見つけた“まさかのマーク”が話題に,https://news.yahoo.co.jp/articles/188587c9ba5d8e308f9212028f2e3c915cd39c68,4/22(火) 8:15
2025-04-24,07:06,life,ライフ,37,ENGINE WEB,塊感があってワイルドになった6代目スバル・フォレスター、日本仕様発表！　1.8リットル・ターボと2.5リットル・ハイブリッドの二本立て,https://news.yahoo.co.jp/articles/5e1f8d46c23d317e142c3043aacb3b26ad39ce0b,4/24(木) 6:10
2025-04-24,07:06,life,ライフ,38,LIMO,【元保護猫のビフォーアフター】8ヶ月前はパヤ毛で小さかった子猫→成長した姿に感動！Xで3.2万いいね,https://news.yahoo.co.jp/articles/0464ef34c4e06ebbecc52fed9aaa04ed6abe1d68,4/23(水) 18:03
2025-04-24,07:06,life,ライフ,39,LIMO,「中に人間入ってる？」　ハムスターの人間味があふれすぎた行動に思わず二度見,https://news.yahoo.co.jp/articles/d285ad2726a301daaf71866da22e980e6f88632d,4/24(木) 5:17
2025-04-24,07:06,life,ライフ,40,ねとらぼ,全国の「交通系ICカード」を買い集めていった結果……　“ガチすぎるコレクション”が125万表示　「知らないカードがいっぱい」「地元の見つけると興奮するな」,https://news.yahoo.co.jp/articles/af82b3e8e2f504a6a54667a9c120d4b3d1183892,4/23(水) 20:05
