scrp_date,scrp_time,genre_en,genre_jp,rank,media_jp,title,link,date_original
2024-09-09,22:10,domestic,国内,1,関西テレビ,【速報】「僕がやったらパワハラ」と維新吉村氏　斎藤知事に『辞職』説得　しかし、知事は「続投宣言」　「全ての人事権を持つ知事が懲戒処分を決定づけるのは間違った権限執行」と吉村氏,https://news.yahoo.co.jp/articles/e606202d360a76f75013d9757e9e633f27ee8189,9/9(月) 17:01
2024-09-09,22:10,domestic,国内,2,中日スポーツ,田中真紀子さん、自民党総裁の適任者「私は１人いると思うが」 「そのあとの方たちは使い物にならない」とバッサリ,https://news.yahoo.co.jp/articles/81d95745c0061d6ae6aa896223387259da29022c,9/9(月) 16:10
2024-09-09,22:10,domestic,国内,3,日テレNEWS NNN,衆院東京15区補選で公認内定取り消しの女性　都内で死亡,https://news.yahoo.co.jp/articles/10faeaf3eec270743130d8555734060217bec022,9/9(月) 17:04
2024-09-09,22:10,domestic,国内,4,中日スポーツ,「まず身を引いて」 田中真紀子さん、パワハラ疑惑に揺れる兵庫・斎藤元彦知事に進言 「あの人はなぜ辞めないんですか」,https://news.yahoo.co.jp/articles/e083d138fa8d3a68897b85150da43c20c8884ff3,9/9(月) 16:25
2024-09-09,22:10,domestic,国内,5,ABEMA TIMES,外で遊ぶ子どもに隣人が大音量の「モスキート音」 都議会議員がXで投げかけ賛否両論 “社会全体での子育て”は可能？,https://news.yahoo.co.jp/articles/b9111e36d26d2790a67b74386b9e9008015fd671,8/31(土) 18:10
2024-09-09,22:10,domestic,国内,6,デイリースポーツ,須田慎一郎氏　総裁選「推薦人１人足りない」と大騒ぎの候補明かす　永田町常識だと「間に合わない可能性ある」,https://news.yahoo.co.jp/articles/68bec2b7f237b47e2375536154b112fb704ff5af,9/9(月) 18:08
2024-09-09,22:10,domestic,国内,7,スポーツ報知,吉村洋文大阪府知事が元部下・斎藤元彦兵庫県知事の“激変”に「正直に言えば、予測できない人物像」,https://news.yahoo.co.jp/articles/592998cd5c0955667728e873ddeb3ec3bd1ffbfa,9/9(月) 19:27
2024-09-09,22:10,domestic,国内,8,共同通信,琵琶湖で大学生50人遭難情報　「全員岸に戻った」と地元消防,https://news.yahoo.co.jp/articles/7ac7c1c1b720242c13e20ac406be090d27ea6d8c,9/9(月) 20:54
2024-09-09,22:10,domestic,国内,9,FNNプライムオンライン,「あだ名はフェンディ」東大の同級生・大島てるさん語る斎藤元彦知事　小学校時代の親友語る「将来の夢は警察官だった」,https://news.yahoo.co.jp/articles/f7735e062130e5bb2b747f0f75cacbe265b72b9f,9/9(月) 14:55
2024-09-09,22:10,domestic,国内,10,共同通信,琵琶湖の学生「全員無事」と大津市消防局,https://news.yahoo.co.jp/articles/cccd4b1aaae5129699eafef4a6899ec845af9de0,9/9(月) 21:06
2024-09-09,22:10,domestic,国内,11,中日スポーツ,「美味しかったけど正直ヤバそうな…」ハンバーグ店食中毒、Ｘで『O157検出』トレンド入り　実体験や警戒する意見飛び交う,https://news.yahoo.co.jp/articles/a6cfbb37de9be782060289152fb79e45308ee97c,9/9(月) 18:39
2024-09-09,22:10,domestic,国内,12,FNNプライムオンライン（フジテレビ系）,天皇ご一家が東京ステーションギャラリーへ　愛子さまもベルギーの作品展鑑賞,https://news.yahoo.co.jp/articles/e464ad00e75a61bb9d0b61c12fd7fa9fa395d08e,9/9(月) 16:28
2024-09-09,22:10,domestic,国内,13,デイリースポーツ,田中真紀子さん８０歳　総裁選にボロクソ砲撃「勘違いのヘナチョコばっかり出てきて売名」「ふざけてる」　大嫌い小泉元首相の息子もガツン！　ミヤネ屋,https://news.yahoo.co.jp/articles/f5294b17c6a00455cd941cb4168668979b4e7492,9/9(月) 15:24
2024-09-09,22:10,domestic,国内,14,日刊スポーツ,田中真紀子氏謎のにおわせ、自民党総裁選本命「１名いる、申しませんけど。あとは使い物にならない」,https://news.yahoo.co.jp/articles/8c25c8420b412d1f9604c4904e05b938c8af74b4,9/9(月) 19:43
2024-09-09,22:10,domestic,国内,15,スポニチアネックス,千葉の人気飲食店「将泰庵」で食中毒　謝罪　「飲めるハンバーグ」で話題,https://news.yahoo.co.jp/articles/211685c4cd0606d79ed5ec24dd80f5cbc513c160,9/9(月) 15:56
2024-09-09,22:10,domestic,国内,16,デイリースポーツ,田崎史郎氏　総裁候補に総理大臣に向かない「単なる理想主義者」がいる　名前当てられ「そうかも」　実現できない事を唱えてる,https://news.yahoo.co.jp/articles/29462815f3a8632500aeb592b44333c8b01b9ef0,9/2(月) 18:58
2024-09-09,22:10,domestic,国内,17,J-CASTニュース,マークシート、勘で記入してはダメ？　　試験の「不自然な回答」「一律0点」が波紋、早大「問題があった」と教授を厳重注意,https://news.yahoo.co.jp/articles/d3ec9aa8824f3f2e703b67650273d404130abb5b,9/9(月) 10:40
2024-09-09,22:10,domestic,国内,18,デイリースポーツ,脳科学者がバッサリ「メンタルが強いというより」斎藤兵庫県知事は「認めたら負けと思ってる人の典型」,https://news.yahoo.co.jp/articles/f5a172047a1450e67572e45c36de3d6e69736752,9/7(土) 16:09
2024-09-09,22:10,domestic,国内,19,テレビ朝日系（ANN）,【速報】琵琶湖で大学生約50人遭難か　うち約20人は自力で戻ったとの情報　滋賀県警,https://news.yahoo.co.jp/articles/c983d760922923af50d15689a47859bc23914a0a,9/9(月) 21:16
2024-09-09,22:10,domestic,国内,20,夕刊フジ,高市早苗氏〝逆転の戦略〟とは　自民党総裁選、進次郎氏一歩リード　安倍元首相の〝遺志〟胸に「政界屈指の保守政治家」追撃なるか,https://news.yahoo.co.jp/articles/ca32b2b0ad5b63eba199ebad83c5227d9aa3c37d,9/9(月) 17:00
2024-09-09,22:10,domestic,国内,21,テレビ朝日系（ANN）,4月の衆議院補欠選挙で公認取り消しの女性　自宅マンション敷地で死亡,https://news.yahoo.co.jp/articles/87e83e39c2cc6722888469a6decd5448b2307ab1,9/9(月) 20:59
2024-09-09,22:10,domestic,国内,22,デイリースポーツ,田中真紀子さん８０歳砲撃　大嫌い小泉元首相の息子ガツン「総理なったら困る」「お調子者の息子が」「できるわけない」スカート踏まれた事件から２２年,https://news.yahoo.co.jp/articles/6746d0dd22fd88cbe76dc402def35ec3964ed07e,9/9(月) 20:18
2024-09-09,22:10,domestic,国内,23,夕刊フジ,将棋「最年少永世王位」でとんでもない記録への期待　タイトル戦ほとんど負けなしの藤井聡太王位、何歳で全冠になるのか,https://news.yahoo.co.jp/articles/8dcb902f5af14f13855bb38e0244444bc15c22c4,9/9(月) 17:00
2024-09-09,22:10,domestic,国内,24,共同通信,琵琶湖で大学生約50人が遭難か,https://news.yahoo.co.jp/articles/958553832a74cb0a712c6668153a3f9ed5ba3430,9/9(月) 20:49
2024-09-09,22:10,domestic,国内,25,デイリースポーツ,兵庫県の斎藤元彦知事、東大時代のあだ名は「フェンディ」同級生の大島てる氏が思い出す,https://news.yahoo.co.jp/articles/0de3f52683e1b64ad8ca9d8566b8cf45bb7544c5,9/9(月) 9:59
2024-09-09,22:10,domestic,国内,26,共同通信,宮崎で撃たれた男性死亡,https://news.yahoo.co.jp/articles/595a61e487419053d52010f70bc6241dae3bf002,9/9(月) 18:43
2024-09-09,22:10,domestic,国内,27,共同通信,大学生50人の無事確認,https://news.yahoo.co.jp/articles/7a9fb3125334e058067349f53286428c1f0cc1aa,9/9(月) 21:31
2024-09-09,22:10,domestic,国内,28,東海テレビ,遺族「20年前のきょうは元気に…」母親と子供3人が殺害され放火された事件から20年 情報提供呼びかけ,https://news.yahoo.co.jp/articles/c8e8fd1af6b33979bfca1b1a91a70efd7e2584be,9/8(日) 21:43
2024-09-09,22:10,domestic,国内,29,読売新聞オンライン,兵庫・斎藤元彦知事が維新の辞職要求方針決定を受け、改めて続投する考え表明,https://news.yahoo.co.jp/articles/0e30c3bf3b8c1cde56ce14f7f55675068f90232e,9/9(月) 10:10
2024-09-09,22:10,domestic,国内,30,中日スポーツ,小泉進次郎氏、自民党総裁には「なってもらっちゃ困る」と田中真紀子さん 「現実がわかってないんですよ」,https://news.yahoo.co.jp/articles/6c5b33e66d4cc168e13061467a74af0fb41273ec,9/9(月) 16:13
2024-09-09,22:10,domestic,国内,31,スポーツ報知,泉房穂氏、「モーニングショー」で「パワハラ疑惑」兵庫県・斎藤元彦知事に見解「ご本人は、素で間違っていないと思ってはる」,https://news.yahoo.co.jp/articles/02e077aad6b8ba639524affb1232fefe40a80c79,9/9(月) 9:27
2024-09-09,22:10,domestic,国内,32,東海テレビ,自民党総裁選に意欲も…野田聖子氏に今回も立ちはだかる“推薦人20人の壁” 7人が出馬表明し「厳しい戦い」,https://news.yahoo.co.jp/articles/859ab3a68fae6eea8c6f5a4071bd7a34abb318ee,9/9(月) 17:39
2024-09-09,22:10,domestic,国内,33,FNNプライムオンライン（フジテレビ系）,【速報】「サナエあれば憂いなし。」高市氏が総裁選出馬を正式表明「日本をもう一度世界のてっぺんに」と強調,https://news.yahoo.co.jp/articles/a9908fc1fd62e065fb2143abf06a0cc8ebc4b2b1,9/9(月) 14:02
2024-09-09,22:10,domestic,国内,34,スポニチアネックス,高橋茉莉さん死去で玉木雄一郎氏が追悼「深い悲しみを禁じ得ません」国民民主候補に一時内定も擁立取り消し,https://news.yahoo.co.jp/articles/65d0d75308c78c50f02022b0baa49d569dcdd90b,9/9(月) 21:34
2024-09-09,22:10,domestic,国内,35,MBSニュース,【速報】斎藤知事が続投の考えか「支援いただいた維新の会からの申し入れは重く受け止める」辞職・出直し選の申し入れを受けて反応,https://news.yahoo.co.jp/articles/e7cd6cacd721e745b9a1f6f15de9d6ac1a0d2d0f,9/9(月) 17:02
2024-09-09,22:10,domestic,国内,36,日刊スポーツ,田中真紀子氏、斎藤元彦知事をバッサリ「なぜ辞めないんですか？まずは身を引いて…」と持論展開,https://news.yahoo.co.jp/articles/af01970da4fbc22c6487154a08df68c9325474c8,9/9(月) 19:56
2024-09-09,22:10,domestic,国内,37,産経新聞,高市早苗氏、中国に「言うべきは言う」尖閣ブイは撤去　韓国は「昭和ソング人気うれしい」,https://news.yahoo.co.jp/articles/e470c56615c581ad4326c06959e5bedcf7755d42,9/9(月) 18:15
2024-09-09,22:10,domestic,国内,38,毎日新聞,直売所の新米1200キロ、5時間で売り切れ　千葉・匝瑳,https://news.yahoo.co.jp/articles/9c1722fea981cb5925af1fb5936bcbb1394821e3,9/9(月) 19:43
2024-09-09,22:10,domestic,国内,39,スポニチアネックス,田中真紀子氏　自民党の総裁選をバッサリ「へなちょこばっか」適任者「私は1名いると思いますけど」,https://news.yahoo.co.jp/articles/66dc662a2c6b409c38fa8a43f2bf6249588d3f92,9/9(月) 20:07
2024-09-09,22:10,domestic,国内,40,BUSINESS INSIDER JAPAN,アメリカでは、いくらの年収で「上流階級」となるのか？ 各州ごとに年収の分布を解析（海外）,https://news.yahoo.co.jp/articles/8498c8cb2f9b4be7db0d8f939685a4fa01b4cf7f,9/9(月) 20:00
