scrp_date,scrp_time,genre_en,genre_jp,rank,media_jp,title,link,date_original
2024-06-05,21:35,life,ライフ,1,オリコン,容姿をいじられ続けた男性が激変、筋トレと整形で驚きの変貌を遂げた今の人生観「やっぱり外見も大事」,https://news.yahoo.co.jp/articles/564171f090a9afaf4cbc5758c309aeaf2a612d35,6/5(水) 8:40
2024-06-05,21:35,life,ライフ,2,ほ・とせなNEWS,可愛いトイプードルをお迎えしたら…1年半後の姿に思わず笑みが！？　その姿に「珍しいね」「可愛さ増します」の声,https://news.yahoo.co.jp/articles/a627d4e721f2069c86087015c61e4a8b1d2fa7cb,6/5(水) 12:30
2024-06-05,21:35,life,ライフ,3,LIMO,ワークマンの「1900円ワンピース」が便利！体型カバー力があってポケットつきです,https://news.yahoo.co.jp/articles/1626c3e1c449481ddc47363c8a88e51e02b2945a,6/5(水) 18:37
2024-06-05,21:35,life,ライフ,4,ファイナンシャルフィールド,ママ友がみんな「ニューバランス」のスニーカーを履いていますが、私にはとても手が出ません。どうやってお金を捻出しているのでしょうか？,https://news.yahoo.co.jp/articles/19019e67c74745418967406601397f7079bbb6ef,6/4(火) 21:40
2024-06-05,21:35,life,ライフ,5,ねとらぼ,「天才やわ」　中学生男子が初恋人のためにイメチェン……　人気美容師に称賛の声「彼女が心配するレベル」,https://news.yahoo.co.jp/articles/5889d900b48d2f92eb20cddf4e444c17a569571c,6/5(水) 20:15
2024-06-05,21:35,life,ライフ,6,産経新聞,関ケ原後も生存？ 名将・島左近の墓を発掘調査、見つかった人骨,https://news.yahoo.co.jp/articles/9358ea5ed8ecc9e6dfa02d1180c57cbe6642c1f6,6/5(水) 18:47
2024-06-05,21:35,life,ライフ,7,リセマム,人事担当から見た大学ランキング…3年連続の就職力1位は？,https://news.yahoo.co.jp/articles/8def5a9128aa4a336f68fc9342021f4b7da644c1,6/5(水) 15:15
2024-06-05,21:35,life,ライフ,8,Hint-Pot,マクドナルドが紙ストローをプラスチックに戻した？　ネットで情報拡散　同社に見解を聞いた,https://news.yahoo.co.jp/articles/be9ac50904e0630c12cacebca687d0edbac50b87,6/4(火) 15:05
2024-06-05,21:35,life,ライフ,9,まいどなニュース,深夜の大型スーパー　涙目の子猫が鳴いていた　空腹による衰弱で何度も転倒　保護後しっかり食べて元気になると朗報が！,https://news.yahoo.co.jp/articles/e1d7ba04be454c8dea4737c4d6c21fee57e4f68f,6/5(水) 17:30
2024-06-05,21:35,life,ライフ,10,めざましmedia,【徹底解説】ディズニー新エリア 入園チケットだけでは入れない!? 今から間に合う無料パスや有料サービスを紹介  アナ雪・ラプンツェル・ピーターパンのアトラクションに待たずに乗るには,https://news.yahoo.co.jp/articles/f144d8aed6f8d9cb1a98cf143329cb9ef98732f4,6/4(火) 22:22
2024-06-05,21:35,life,ライフ,11,LASISA,やっちまった！ティッシュを入れたまま洗濯しちゃった…知っておきたい効果的な落とし方は？,https://news.yahoo.co.jp/articles/d2c2a69276e925a1f16ef113745b2bf02ca88ea0,6/5(水) 11:40
2024-06-05,21:35,life,ライフ,12,ねとらぼ,「これは最高」　月曜を乗り切れる“ミスド弁当”がダイナミックで話題　「天才現る」「絶対マネしたい」,https://news.yahoo.co.jp/articles/a33da982bc2809a71ae72777bdff0f743c10d8ae,6/5(水) 12:15
2024-06-05,21:35,life,ライフ,13,オリコン,「子どもの指が壊死しかけた」思わぬ原因で赤ちゃんの手の指が1.5倍に…、注意喚起に大きな反響,https://news.yahoo.co.jp/articles/da2b9a3d07362ae4d4e0786f3af1f9befef27fdb,6/5(水) 8:00
2024-06-05,21:35,life,ライフ,14,ファイナンシャルフィールド,結局「マイナンバーカード」ってなんだったんですか？ 一度も使っていないのですが…。,https://news.yahoo.co.jp/articles/3d394ac6e5bfaeaa719eb6fed80cd02ad24d7cb0,6/5(水) 20:20
2024-06-05,21:35,life,ライフ,15,ねとらぼ,ディズニーシーにダッフィーのポップコーンバケット登場！　「かわいすぎる」「やばい」と反響,https://news.yahoo.co.jp/articles/8171bfab49e3be87c682572553a18775097a1a97,6/5(水) 18:15
2024-06-05,21:35,life,ライフ,16,BuzzFeed Japan,【GU】トムとジェリーの「楽ちんパジャマ」が大人かわいい！色味もオシャレで、着心地バツグンでした,https://news.yahoo.co.jp/articles/4df3e03777db45267dd02dd8e4074e09fde0d7b3,6/4(火) 19:05
2024-06-05,21:35,life,ライフ,17,LIMO,【しまむら】両面デザインで可愛さ2倍「ピーターパン巾着バッグ」予約はじまる,https://news.yahoo.co.jp/articles/f7cc199073b5c36d48444cbb044eae1ec5e743c1,6/5(水) 17:47
2024-06-05,21:35,life,ライフ,18,Hint-Pot,旅館の女湯に男児2人　「見たことないくらい大きい子」にあ然…　問われる親のモラルと混浴年齢,https://news.yahoo.co.jp/articles/470fa3122cf1a4cf145eed3d5ec5e7093faff2d4,6/4(火) 9:10
2024-06-05,21:35,life,ライフ,19,トラベル Watch,ファンタジースプリングス開業前夜祭、一夜限りの配信イベント「THE FANTASY BEGINS」はこのあと20時30分から！,https://news.yahoo.co.jp/articles/adb71fbd0e6a8212f6a46d65830a1d54613c89de,6/5(水) 12:03
2024-06-05,21:35,life,ライフ,20,LIMO,ラ・ムーで買ってよかった！マニア厳選のオリジナル食品「D-PRICE」7選,https://news.yahoo.co.jp/articles/cdd0ad71b8d75886fcba767eafe2e58999e2cd10,6/4(火) 8:47
2024-06-05,21:35,life,ライフ,21,BuzzFeed Japan,知ってる？ 生ゴミの臭いを抑える方法。家にあるもので簡単にできる“スゴ技”が目からウロコすぎた！,https://news.yahoo.co.jp/articles/ab26b7fbca1877b09aa3a9a537fac77c777ea9de,6/5(水) 18:15
2024-06-05,21:35,life,ライフ,22,LIMO,雨や曇り続きでもお庭を美しく！シェードガーデンでも育てられる＜多年草・低木＞厳選6種,https://news.yahoo.co.jp/articles/ad6a9e233402df091e119e935bc1dc2e191be8ea,6/5(水) 18:26
2024-06-05,21:35,life,ライフ,23,BuzzFeed Japan,【ユニクロ】二の腕カバーできて嬉しい！2990円の「新作ブラウス」ぽわんとボリューミーな袖がかわいいんです,https://news.yahoo.co.jp/articles/158be4b510d56f63a096b105e4a85c4d2499d08c,6/5(水) 18:05
2024-06-05,21:35,life,ライフ,24,クランクイン！,カルディ「レモンバッグ」数量限定で登場！　旅行にピッタリな“トラベルポーチ”付き,https://news.yahoo.co.jp/articles/ef92cd7da3ccec1a6769b21ee0ed5276f43ca2cf,6/5(水) 10:57
2024-06-05,21:35,life,ライフ,25,読売新聞オンライン,俳優・岡本信人さん「野草食」に出会い「私の五感は全開に」…父が肺結核で生活苦しかった少年時代,https://news.yahoo.co.jp/articles/39a4c81c9333fd2e65ed4b791fae73a24100a0dc,6/5(水) 16:20
2024-06-05,21:35,life,ライフ,26,ねとらぼ,【社会人に聞いた】「積立貯金におすすめの銀行」ランキング！　2位は「ゆうちょ銀行」、1位は？,https://news.yahoo.co.jp/articles/af1d4b468a2980b1fe3a3ccb507e49b623b6a12d,6/5(水) 18:35
2024-06-05,21:35,life,ライフ,27,Hint-Pot,初訪日のアメリカ人「絶対に見たかった」　ハリウッド映画で有名に　日本で感動した場所とは,https://news.yahoo.co.jp/articles/d2eb517c071c3821a5c5eeeb0b8cb807ecd8b60b,6/5(水) 6:03
2024-06-05,21:35,life,ライフ,28,ねとらぼ,次男のサプライズ帰省で実家の猫が大変なことに!!　予想を裏切る再会の様子が「パパの悲鳴、最高」「面白すぎる」と話題,https://news.yahoo.co.jp/articles/abf704011057455e34b0ced9746f4bc449948a5a,6/5(水) 21:05
2024-06-05,21:35,life,ライフ,29,Fav-Log by ITmedia,アニメ第3期も好評の「転スラ」ってそもそもどんな話？　原作は完結済み？　「転生したらスライムだった件」の基本を紹介【2024年6月版】,https://news.yahoo.co.jp/articles/7a88651a185f64ecb9fdd091dc2cecba20876e9f,6/5(水) 18:20
2024-06-05,21:35,life,ライフ,30,Hint-Pot,「ねこはどの角度から見てもかわいいとか言ったの、誰だ！」元保護ねこを下から撮影したら衝撃の結果に,https://news.yahoo.co.jp/articles/5dbd8c7d3ee4baa9f7b5455c4ff243f7c061c34e,6/5(水) 10:24
2024-06-05,21:35,life,ライフ,31,ねとらぼ,【地元の社会人に聞いた】永住したい「名古屋市16区」ランキング！　2位は「天白区」、1位は？,https://news.yahoo.co.jp/articles/205e2e345a3e9a7c9a350de71c86f85d26534041,6/5(水) 17:50
2024-06-05,21:35,life,ライフ,32,ハフポスト日本版,「珍しそうな花咲いてる！」⇒近づいてみると「これは笑った」「まさかのシュシュ」,https://news.yahoo.co.jp/articles/87f0146e623a021060cdf1bae8483356dbb23f6f,6/5(水) 21:10
2024-06-05,21:35,life,ライフ,33,グルメ Watch,ニッカウヰスキー90周年「ザ・ニッカ ナインディケイズ」国内2000本限定で登場,https://news.yahoo.co.jp/articles/990d4232031790950e3ac389631193e21d868305,6/5(水) 14:12
2024-06-05,21:35,life,ライフ,34,ねとらぼ,残り有給日数確認 → “ありえない日数”が表示された新入社員が話題に　「有休消化できない会社」「無限有給編」,https://news.yahoo.co.jp/articles/84561fd1f8e92b64045a5597ab3a9276a105f2cd,6/5(水) 20:30
2024-06-05,21:35,life,ライフ,35,ファイナンシャルフィールド,「マルチ商法」が何度もニュースに取り上げられるのに、なぜ被害者が後を絶たないのでしょうか？,https://news.yahoo.co.jp/articles/742b7d715bf82ea91606e94d0a26e0eaa924a3e0,6/5(水) 20:30
2024-06-05,21:35,life,ライフ,36,ねとらぼ,【女性が選ぶ】最高にうまいと思う「カレールー」ランキング！　2位は「ジャワカレー（ハウス食品）」、1位は？,https://news.yahoo.co.jp/articles/3d3f09ff89b66088e7ae6d06be2c15d984eb47ac,6/5(水) 18:30
2024-06-05,21:35,life,ライフ,37,ファイナンシャルフィールド,パート先で「有休」を申請したら、店長に「代わりに違う日に出勤して」と言われた！ シフト制だと有休の取得は難しいの？“パート勤務での有休取得”について解説,https://news.yahoo.co.jp/articles/f1f3fad728d4a380032cc5300393db009c75437c,6/5(水) 11:33
2024-06-05,21:35,life,ライフ,38,BuzzFeed Japan,しまむらで見つけた「サンリオごみ箱」かわいくて万能！車に置いても倒れにくいし、小物入れにもピッタリです,https://news.yahoo.co.jp/articles/42d2585942c180d5cce087f48ff46239a8ccdb42,6/5(水) 13:35
2024-06-05,21:35,life,ライフ,39,LIMO,「1日歩いても疲れにくい！」ハニーズのラクちんトレンドシューズ。,https://news.yahoo.co.jp/articles/be8d6c79e9dc2cebf9da5e26af496279be7ac1cb,6/4(火) 20:47
2024-06-05,21:35,life,ライフ,40,マイナビ子育て,杏さんが子どもの学校行事で代打を頼んだ大女優「わかった、行ける行ける」家族同然、親戚のような存在,https://news.yahoo.co.jp/articles/83ea098c5a057a5a2764a21d268505101eff406a,6/3(月) 12:11
