scrp_date,scrp_time,genre_en,genre_jp,rank,media_jp,title,link,date_original
2024-05-17,15:24,domestic,国内,1,テレビ朝日系（ANN）,男性の“目を見て落とす”　違法社債20億円“販売”の女　客を「チルドレン」と呼び…,https://news.yahoo.co.jp/articles/594a6be14832a8bd4ad016589231b06d99104b23,5/17(金) 12:31
2024-05-17,15:24,domestic,国内,2,FNNプライムオンライン,【解説】“皇族数確保”の与野党協議きょう始まる　焦点は愛子さま佳子さまなど女性皇族の結婚後と旧宮家男子の将来,https://news.yahoo.co.jp/articles/66b25ca67f91bf2014fd7474b2692ada030b8213,5/17(金) 9:02
2024-05-17,15:24,domestic,国内,3,日刊スポーツ,つばさの党根本良輔容疑者、都知事選出馬表明の石丸伸二市長に「徹底的に質問」Ｘで予告していた,https://news.yahoo.co.jp/articles/1dc1f44432cb565420cbf51521777a6e432a9fea,5/17(金) 11:47
2024-05-17,15:24,domestic,国内,4,弁護士ドットコムニュース,交通違反“青切符”への押印「任意なので断ってよし」 河野大臣もお墨付き　警察が「押して」と求めるワケとは,https://news.yahoo.co.jp/articles/684378d726b9174a104115974d9d8ae3fca1800d,5/17(金) 9:49
2024-05-17,15:24,domestic,国内,5,朝日新聞デジタル,修学旅行引率中、ディズニーで女性にわいせつ容疑　小学校教諭を逮捕,https://news.yahoo.co.jp/articles/13ef07650b62da29d6113d03e50506bc06bd315d,5/17(金) 11:34
2024-05-17,15:24,domestic,国内,6,産経新聞,「つばさの党」黒川敦彦容疑者が逮捕前日の取材に語る「若者の声を代弁」「尾崎豊みたいな」,https://news.yahoo.co.jp/articles/efdd03d90dc49d343dffee7b5b1e4749ca4da7c4,5/17(金) 11:42
2024-05-17,15:24,domestic,国内,7,毎日新聞,つばさの党、田村淳さんらの自宅特定し街宣　否定的見解に反発か,https://news.yahoo.co.jp/articles/4737fb483086c28668e7e0d4d2a4d18c9a2d8cda,5/17(金) 14:16
2024-05-17,15:24,domestic,国内,8,スポニチアネックス,「TDL」トレンド入り、わいせつ事案にネット「こんなアトラクション嫌」「TDLってディズニー…」,https://news.yahoo.co.jp/articles/cf9802dfa0444461f1c2e5d99c66608c7526a53b,5/17(金) 14:18
2024-05-17,15:24,domestic,国内,9,日刊スポーツ,菊間千乃弁護士、強制捜査のつばさの党が主張する「表現の自由」に私見,https://news.yahoo.co.jp/articles/6dcbd2db0d0d0e7dd0f07ade2eeffe9d6e5fa47d,5/14(火) 10:08
2024-05-17,15:24,domestic,国内,10,毎日新聞,つばさの党の選挙妨害容疑、異例の特捜本部設置　他の被害も捜査へ,https://news.yahoo.co.jp/articles/2e9b7e804e5a56a0dc1f0e3f04d186288c86ec21,5/17(金) 13:12
2024-05-17,15:24,domestic,国内,11,FNNプライムオンライン,妻子いるのに生活費全て賭ける…「ハズれたら死ねばいいや」ギャンブル依存症男性の“転落人生”と克服への歩み,https://news.yahoo.co.jp/articles/d621202d3352506248a33afc1560d175b5e83a62,5/14(火) 21:02
2024-05-17,15:24,domestic,国内,12,夕刊フジ,つばさの党〝悪質妨害〟にメス、捜査と法改正の行方　「警察呼べよババア！」本紙記者目撃も「処罰は簡単な話ではない」若狭弁護士,https://news.yahoo.co.jp/articles/f4375d22c4d95ac631167f096d99c94b453fbdeb,5/14(火) 17:00
2024-05-17,15:24,domestic,国内,13,日刊スポーツ,石丸伸二氏、都知事選出馬表明Ｘ投稿のコメ欄沸騰3500件「新しい風」「胸熱」「面白くなる」,https://news.yahoo.co.jp/articles/8eac0793906b4179572e9fe54c75c631d9a2771f,5/16(木) 21:12
2024-05-17,15:24,domestic,国内,14,日刊スポーツ,乙武洋匡氏、つばさの党幹部逮捕に言及「法律ギリギリの範囲を狙って選挙を荒らしまくり…」,https://news.yahoo.co.jp/articles/4f05d19693cd211eaf0ea136e1166614e956d63c,5/17(金) 13:09
2024-05-17,15:24,domestic,国内,15,TBS NEWS DIG Powered by JNN,【速報】悪質違反の自転車運転者に「青切符」　改正道交法が成立,https://news.yahoo.co.jp/articles/eaf943609c28298e4c000ff4b3c961d77db3223e,5/17(金) 12:17
2024-05-17,15:24,domestic,国内,16,読売新聞オンライン,「アルミホイル」貼った改造バイクで集団暴走、赤信号で交差点進入…熊本県警が少年8人を容疑で逮捕,https://news.yahoo.co.jp/articles/83f1de3ba26e52590df529382b6ef3c1e4309897,5/17(金) 14:17
2024-05-17,15:24,domestic,国内,17,共同通信,自転車違反に反則金、改正法成立　ながら運転、酒気帯びに罰則,https://news.yahoo.co.jp/articles/cba0b5b29dd349f6599146b7f48f4c53447c5066,5/17(金) 5:30
2024-05-17,15:24,domestic,国内,18,弁護士JPニュース,11歳少年が無免許で油圧ショベル運転も…月20万円前後の費用払わせ“違法労働”させた「自立支援施設」の評判,https://news.yahoo.co.jp/articles/fcaef7784cb2a4631d7da4255777be90f4a8dd3d,5/17(金) 13:45
2024-05-17,15:24,domestic,国内,19,中日スポーツ,石丸伸二・安芸高田市長の東京都知事選苦戦を「確信」PR戦略のプロが語る理由とは…,https://news.yahoo.co.jp/articles/d4e47f9cff68efc825717b45dfdfabe16db2b1da,5/16(木) 20:39
2024-05-17,15:24,domestic,国内,20,テレビ朝日系（ANN）,ザ・グランシールド、違法社債で80億円集金…女2人で46億円　矯正トラブルとのW被害も,https://news.yahoo.co.jp/articles/3bde31c2c2eabf39778ac59b5ae1540891886016,5/16(木) 12:54
2024-05-17,15:24,domestic,国内,21,FNNプライムオンライン,【異変】リニア中央新幹線トンネル掘削工事で水源の水位低下　米農家も「大打撃」工事中断も開業はどうなる?,https://news.yahoo.co.jp/articles/a93f87361810a28542b3379755d502dedf21c6a2,5/17(金) 14:13
2024-05-17,15:24,domestic,国内,22,みんかぶマガジン,これは政権交代前夜だ…立憲、調査で比例投票先自民党超え「岸田首相はもはや自民の疫病神」,https://news.yahoo.co.jp/articles/983052be450765c16e99eb74bb18894c43ef01a9,5/17(金) 9:10
2024-05-17,15:24,domestic,国内,23,日刊スポーツ,堀江貴文氏、都知事選出馬意向の石丸伸二市長に「すばら！」と短文投稿、エールか,https://news.yahoo.co.jp/articles/9e6a3c74c7e5e998746c0dcdcfda46e24a9115ad,5/16(木) 20:32
2024-05-17,15:24,domestic,国内,24,選挙ドットコム,衆院東京15区補選の妨害行為で逮捕　「つばさの党」根本良輔氏と黒川敦彦氏の経歴は？過去に立候補した選挙は？,https://news.yahoo.co.jp/articles/f2c46e80f05c97a3446886835ae712c3350ccee4,5/17(金) 13:37
2024-05-17,15:24,domestic,国内,25,朝日新聞デジタル,石丸・安芸高田市長、都知事選は無所属で出馬「地方の衰退止める」,https://news.yahoo.co.jp/articles/889e938cdb0c9d69c99b8b8aa69f514697a2109f,5/17(金) 13:56
2024-05-17,15:24,domestic,国内,26,産経新聞,黒川敦彦容疑者が設立「つばさの党」、矛先はワクチンや宗教団体の政治活動も,https://news.yahoo.co.jp/articles/d674ad6655e929d234e98a5fe24cb777fbe21b50,5/17(金) 13:06
2024-05-17,15:24,domestic,国内,27,読売新聞オンライン,ネット上で注目集めた広島・安芸高田市長、東京都知事選挙に出馬表明…「一極集中を是正したい」,https://news.yahoo.co.jp/articles/c216ef6592d32c9f84a4ab083f834713cd6967d8,5/17(金) 14:52
2024-05-17,15:24,domestic,国内,28,弁護士JPニュース,定年70歳時代「シニア間格差」というシビアな現実…50歳過ぎても「引く手あまた」と「オファー無し」選別される納得の“基準”,https://news.yahoo.co.jp/articles/860e78b2d1d4046c1a608d8208db39f0634ba743,5/17(金) 12:05
2024-05-17,15:24,domestic,国内,29,TBS NEWS DIG Powered by JNN,【速報】NHKネット配信「必須業務」　改正放送法が成立　スマホのみの視聴も受信契約必要に,https://news.yahoo.co.jp/articles/58ee329fd6dbe9abeefa57615e5b7b3a4c709b3f,5/17(金) 12:25
2024-05-17,15:24,domestic,国内,30,産経新聞,つばさの党の根本容疑者、都知事選出馬表明の石丸氏に「徹底的に質問に行くよ」逮捕前予告,https://news.yahoo.co.jp/articles/e139329d66d7aa44b0ab71dc10e6aed2ce83eb46,5/17(金) 14:30
2024-05-17,15:24,domestic,国内,31,読売新聞オンライン,１７歳と偽り児童相談所に一時保護され、２か月間食事や宿泊場所の提供受ける…健康保険証で判明,https://news.yahoo.co.jp/articles/e17155f8686704fe9fb5b404472d684a55f15195,5/17(金) 14:01
2024-05-17,15:24,domestic,国内,32,日刊スポーツ,玉川徹氏が疑問「本質的にまったく違う」札幌での安倍元首相へのヤジめぐる根本良輔容疑者主張に,https://news.yahoo.co.jp/articles/111e8e9da052251217b583b07673c3139e452fc4,5/17(金) 11:26
2024-05-17,15:24,domestic,国内,33,東海テレビ,乗用車の男が一時停止を無視か…交差点で軽乗用車と乗用車が衝突 軽運転の50代位の男性が意識不明の重体,https://news.yahoo.co.jp/articles/81d5f56ce18d3336854bedf94626f85daaadcacf,5/17(金) 11:30
2024-05-17,15:24,domestic,国内,34,日刊スポーツ,ひろゆき氏、都知事選出馬の石丸伸二氏の応援表明で称賛相次ぐも一部で心配の声「乙武さん…」,https://news.yahoo.co.jp/articles/103fc304a133bb10ddc683876efb832a4fce1da9,5/16(木) 20:47
2024-05-17,15:24,domestic,国内,35,よろず～ニュース,共同親権法案は「骨抜き」「まやかし」北村弁護士がバッサリ　離婚時の「共同監護計画」提出の必要性力説,https://news.yahoo.co.jp/articles/cd52de8fd5a45e47e3317e24352e08f650baa8cb,5/11(土) 13:50
2024-05-17,15:24,domestic,国内,36,日刊スポーツ,小池百合子知事、石丸伸二氏の都知事選出馬表明に「多くのチャレンジャーがおられるんだなと」,https://news.yahoo.co.jp/articles/1b9dfb03296bc72e3a6855a417a7ee007aa1046e,5/17(金) 15:01
2024-05-17,15:24,domestic,国内,37,読売新聞オンライン,小中高校にあって当たり前と思われがちな「宿題」、本当に必要？,https://news.yahoo.co.jp/articles/4a63d8438010a0460e1af9431318a8139e3ac97d,5/17(金) 14:03
2024-05-17,15:24,domestic,国内,38,読売新聞オンライン,「つばさの党」代表ら３人、選挙妨害容疑で逮捕…警視庁,https://news.yahoo.co.jp/articles/44a0d1a022e324b7015a998beb7ee9772ad175db,5/17(金) 9:41
2024-05-17,15:24,domestic,国内,39,共同通信,石丸氏が都知事選への出馬表明　広島・安芸高田市長,https://news.yahoo.co.jp/articles/96afe9043a3c993ea9db12b7e22cf4abcd75bfce,5/17(金) 13:36
2024-05-17,15:24,domestic,国内,40,共同通信,TDLでわいせつ疑い、教員逮捕　修学旅行引率中の53歳,https://news.yahoo.co.jp/articles/f34cd34aebd3cec45b0427371f9403ce2405176e,5/17(金) 10:58
