scrp_date,scrp_time,genre_en,genre_jp,rank,media_jp,title,link,date_original
2025-02-25,11:29,domestic,国内,1,信濃毎日新聞デジタル,高速のインターできるけど人は減った　消えた祭り、そして小学校も…かつて全国注目、隣県の市と合併した地域の今　「声は届いているか」元村長の問い,https://news.yahoo.co.jp/articles/d445347776a7a764847506108d2361f0e6a35b35,2/25(火) 6:20
2025-02-25,11:29,domestic,国内,2,J-CASTニュース,電車でリュック「前抱え」やめてほしいの声　「車内で迷惑な荷物の持ち方」5位、マナー啓発にも変化,https://news.yahoo.co.jp/articles/2228a4d84d20b0a0bac6cd3062e3018f2304bc55,2/24(月) 16:00
2025-02-25,11:29,domestic,国内,3,デイリースポーツ,菊間千乃弁護士　維新・吉村洋文代表に厳しくピシャリ「気持ち分かるって言ってるのが、ちょっと分かんない」　Ｎ党立花氏への兵庫漏洩問題,https://news.yahoo.co.jp/articles/00a14da660dc682aa509aaea4a9439607e302f98,2/25(火) 9:37
2025-02-25,11:29,domestic,国内,4,BUSINESS INSIDER JAPAN,就活不正：「Webテスト」露骨なカンニング、友人間で拡散する解答集「それでも受かりたい」学生の本音,https://news.yahoo.co.jp/articles/b6b2868b27f0bf5c6297c98f649e9ab8016ddf29,2/25(火) 8:10
2025-02-25,11:29,domestic,国内,5,スポニチアネックス,荻野稔区議、妻への批判に抗議　「赤いきつね」への言及が容姿批判に発展「結婚式の写真を侮辱の道具に」,https://news.yahoo.co.jp/articles/94b3d503081f3d58246d68d654192037943cf80e,2/25(火) 10:00
2025-02-25,11:29,domestic,国内,6,読売新聞オンライン,警備員男性を殴殺か、韓国籍の５４歳男逮捕…知人の暴力団員や一緒に北九州へ逃亡した女も逮捕,https://news.yahoo.co.jp/articles/32da394d8ad4d6737033db0f023e0fe17385286f,2/25(火) 8:56
2025-02-25,11:29,domestic,国内,7,共同通信,列車にはねられ女性死亡、札幌　JR北海道、50本超運休,https://news.yahoo.co.jp/articles/2d3a968d70de8c24ac9f386266174086671a0224,2/25(火) 10:09
2025-02-25,11:29,domestic,国内,8,弁護士JPニュース,「幹部としての基準を満たしていない」次長 → 一般職へ“5階級”降格…「人事権の濫用」訴える従業員に裁判所の判断は,https://news.yahoo.co.jp/articles/f67d04bddffefbb460d31df24ac26de0d78fb848,2/25(火) 10:20
2025-02-25,11:29,domestic,国内,9,共同通信,娘への性虐待で父逮捕「あとは大人に任せて」と言われたけれど…　残された弟妹は不登校に。家族の未来は,https://news.yahoo.co.jp/articles/77bd1fc6e6c2ce5d48aff330c68bbb9f8ed1e218,2/24(月) 18:04
2025-02-25,11:29,domestic,国内,10,時事通信,神田内閣参与が退職,https://news.yahoo.co.jp/articles/d75d13f6879e4de38fca0a88f55605b25460d87b,2/25(火) 10:22
2025-02-25,11:29,domestic,国内,11,FNNプライムオンライン,橋下徹弁護士「15年前に維新を作った責任を感じる」維新県議が非公開の音声データをN国・立花氏に提供　兵庫県知事選で拡散,https://news.yahoo.co.jp/articles/5f430a01487cfe268da64686a3718d07bfa3205c,2/24(月) 14:02
2025-02-25,11:29,domestic,国内,12,J-CASTニュース,橋下徹氏、「維新のモラル低下は、国会議員が来てからだ」　維新県議の情報提供問題で見解,https://news.yahoo.co.jp/articles/2a014ab00afcb8247307309e52d66b293dbdf835,2/25(火) 10:30
2025-02-25,11:29,domestic,国内,13,毎日新聞,「年収の壁」国民民主が年収制限撤廃を与党に求める方針,https://news.yahoo.co.jp/articles/e338c98f87bf69b6dd3accab4fcb4cca39cea412,2/25(火) 10:42
2025-02-25,11:29,domestic,国内,14,TBS NEWS DIG Powered by JNN,【速報】「国の財政は崖っぷち」衆議院・予算委員会で中央公聴会　有識者が与野党の国会審議に苦言,https://news.yahoo.co.jp/articles/14ca8e7b1363d332ed7382173f78e074a0f63a12,2/25(火) 9:42
2025-02-25,11:29,domestic,国内,15,テレビ朝日系（ANN）,池袋のホテルで20代女性刺される　「人を刺した」と通報　35歳男を現行犯逮捕　警視庁,https://news.yahoo.co.jp/articles/1918f991cf5dbaa0908a48decf4e5df68de1872a,2/25(火) 10:08
2025-02-25,11:29,domestic,国内,16,47NEWS,クマがわなにかかったシカを食べる光景を初撮影。新たな食料源？研究者は人とクマが遭遇する危険性を指摘する,https://news.yahoo.co.jp/articles/a130e7a7e6940a05ac129e88507332908cf17d1b,2/25(火) 9:02
2025-02-25,11:29,domestic,国内,17,弁護士ドットコムニュース,「また放火するかも…不安でいっぱい」　出所翌日の犯行、刑務所に戻った放火犯　浮かび上がる炎への依存と衝動,https://news.yahoo.co.jp/articles/fdf3e9846cce0e334945e92a390f45a1757c8e1b,2/24(月) 11:01
2025-02-25,11:29,domestic,国内,18,朝日新聞,交通事故で脳挫傷で死亡、警察に届け出ず「病死」と診断し火葬　栃木,https://news.yahoo.co.jp/articles/31268c38ffcaf4b1f972687602faeb94fc14e6ba,2/25(火) 10:45
2025-02-25,11:29,domestic,国内,19,テレビ朝日系（ANN）,幼稚園バス、打ち切り…園長「晴天のへきれき」　バスの街にも異変…相次ぐ運休・減便,https://news.yahoo.co.jp/articles/285a61116169c36e6006379a4fa243ec2c421562,2/18(火) 16:32
2025-02-25,11:29,domestic,国内,20,時事通信,国公立大2次、前期日程始まる　23万人が志願,https://news.yahoo.co.jp/articles/00284440931277ecc426bde2e06e1e0c278b0cf2,2/25(火) 9:54
2025-02-25,11:29,domestic,国内,21,テレビ朝日系（ANN）,立憲・野田代表「戦闘モードに入る」最大野党が危機感　「議席数」活用の可能性示唆,https://news.yahoo.co.jp/articles/7c1eb3439e53c9aed9ce3f1f3e6283189cff6cd0,2/25(火) 10:39
2025-02-25,11:29,domestic,国内,22,読売新聞オンライン,大分空港の滑走路に雪が積もり19便欠航…九州北部と山口県に強い寒気、各地で氷点下の冷え込み,https://news.yahoo.co.jp/articles/1830e30c552bb6801fbda402a2879d0240cc2e0e,2/25(火) 9:52
2025-02-25,11:29,domestic,国内,23,FNNプライムオンライン,「お風呂中に排水口から茶色い水…」水道管が破裂し大量の水噴出　道路冠水し周辺住宅では断水…老朽化が原因　埼玉・所沢市,https://news.yahoo.co.jp/articles/3cd7f25317d97f29b7a1e76f96ddd74c96fd0c7d,2/25(火) 9:43
2025-02-25,11:29,domestic,国内,24,ABEMA TIMES,藤井聡太竜王・名人、“八冠奪還ロード”準決勝対局開始！初の新・関西会館で糸谷哲郎八段と激突/将棋・叡王戦本戦T,https://news.yahoo.co.jp/articles/a9b3f52b72fa96d10282afbb19c68c5453b5cd5a,2/25(火) 10:03
2025-02-25,11:29,domestic,国内,25,J-CASTニュース,「報じないから代わりに僕が」　財務省解体デモ、人気YouTuberにも波及,https://news.yahoo.co.jp/articles/1a91c6a1af1da06252f0228d1c4fe78413954aec,2/24(月) 13:30
2025-02-25,11:29,domestic,国内,26,日刊スポーツ,三原じゅん子氏、24歳年下の夫とツーショット写真公開　皇居での「宴会の儀」に出席,https://news.yahoo.co.jp/articles/f3ba29c9b36fb96bcbdaf7b1afe60b1f27fc5b07,2/24(月) 16:35
2025-02-25,11:29,domestic,国内,27,テレビ朝日系（ANN）,警察官に職質され…“柔道技”で投げ飛ばした？　逮捕の男の正体は,https://news.yahoo.co.jp/articles/492f0f28c0595b4258003db1f70da7fdeeeb4bf2,2/24(月) 20:06
2025-02-25,11:29,domestic,国内,28,福祉新聞,福祉職員への一時金　厚労省が要項を発表,https://news.yahoo.co.jp/articles/272988f299832ade2718451839e4f2165f329cc9,2/24(月) 10:00
2025-02-25,11:29,domestic,国内,29,読売新聞オンライン,ＪＲ函館・千歳線で人身事故、北海道大・小樽商科大など４大学が入試開始を繰り下げ,https://news.yahoo.co.jp/articles/3dcf6e073cd0bd98a22d640b69d6acc96154bbd2,2/25(火) 10:41
2025-02-25,11:29,domestic,国内,30,47NEWS,利用者減に電力高騰…アイスリンクは最盛期の４分の１以下に　存続の鍵はコストカットや自治体との連携,https://news.yahoo.co.jp/articles/06844464e8961995c05cb94a471f39989ec51f6f,2/25(火) 10:02
2025-02-25,11:29,domestic,国内,31,日刊スポーツ,【将棋】藤井聡太７冠の叡王戦準決勝「関西将棋会館」での初対局スタート、早指し糸谷哲郎八段と,https://news.yahoo.co.jp/articles/060bfaff21547d64a42973a62bb52c58379abc16,2/25(火) 10:41
2025-02-25,11:29,domestic,国内,32,レスキューナウニュース,〔JR東日本〕東海道本線で人身事故 一部運転見合わせ,https://news.yahoo.co.jp/articles/6652d0831e38aabcb3bfbf57df38f8eb39773b8c,2/25(火) 9:15
2025-02-25,11:29,domestic,国内,33,読売新聞オンライン,国公立二次試験の前期日程スタート、東大は過去３０年で志願者数最低…人気学部は法・政治学,https://news.yahoo.co.jp/articles/32f32293c892618ae5b6cf66552c75784fe646bb,2/25(火) 10:20
2025-02-25,11:29,domestic,国内,34,FNNプライムオンライン（フジテレビ系）,国民民主・榛葉幹事長「なめない方がいい。妥協しないよ」　「103万円の壁」めぐる与党の対応に反発,https://news.yahoo.co.jp/articles/9ff76d3a83c25137a44e79617a9136ee188872a7,2/24(月) 16:19
2025-02-25,11:29,domestic,国内,35,読売新聞オンライン,石破首相、ウクライナ侵略３年で米にクギ刺す…米ロの話し合いはＧ７首脳で「評価する発言多かった」,https://news.yahoo.co.jp/articles/34c5905103975414f448ad6294d586f443e6d345,2/25(火) 0:22
2025-02-25,11:29,domestic,国内,36,東海テレビ,発見時被害者には“首輪”付けられる…28歳男性を車に連れ込み物置小屋に監禁か 仕事仲間の男2人を逮捕,https://news.yahoo.co.jp/articles/637b7554f09435b9f1df1c2c90bccb4f568ba50a,2/25(火) 6:18
2025-02-25,11:29,domestic,国内,37,ABEMA TIMES,国民民主ピンチ？「103万円の壁」石破総理“塩対応”、維新に歩み寄り…予算案協議をめぐる各党の思惑,https://news.yahoo.co.jp/articles/92c0e2d812bee2392f6e6b81b4968926a466087c,2/25(火) 7:02
2025-02-25,11:29,domestic,国内,38,共同通信,琴電「はなまるうどん駅」誕生　25周年で1号店最寄り、林道駅,https://news.yahoo.co.jp/articles/7ac478c7fa46696139dfab02dbcf07714a4358c8,2/25(火) 10:42
2025-02-25,11:29,domestic,国内,39,朝日新聞,京大恒例の「折田先生像」出現、今年は「はなかっぱ」　受験生励ます,https://news.yahoo.co.jp/articles/01484f07f92a8d3a3e0bbf042d9df309307e0636,2/25(火) 9:01
2025-02-25,11:29,domestic,国内,40,TBS NEWS DIG Powered by JNN,【速報】女性が左胸を果物ナイフのようなもので刺される　命に別状なし　その場にいた男（30代）を現行犯逮捕　東京・豊島区　警視庁,https://news.yahoo.co.jp/articles/7e022b7ae082ff1b72f9b7a602746bd4e28e4a60,2/25(火) 5:19
