scrp_date,scrp_time,genre_en,genre_jp,rank,media_jp,title,link,date_original
2024-06-21,04:15,sports,スポーツ,1,イーファイト,こんなのOK！？ぱんちゃん璃奈が都知事選ポスター掲示場をジャック！その理由とは,https://news.yahoo.co.jp/articles/5557f7dc2a74664f1f52bdb1ffdf9b595f7ec51d,6/20(木) 18:56
2024-06-21,04:15,sports,スポーツ,2,スポニチアネックス,佐々木朗希はなぜ160キロを投げても打たれるのか　レジェンド投手が苦言「手を抜いてんじゃないかな」,https://news.yahoo.co.jp/articles/59f79bb7a842927b80b0d1b681ebaeafe7fa29dc,6/20(木) 22:03
2024-06-21,04:15,sports,スポーツ,3,ABEMA TIMES,お前、何やってんだよ！ 大谷翔平に“ド真ん中”を投げてしまった…！？ 解説者も呆れた相手投手のリアクションが話題に「怖すぎだろ」「打ちとれるわけないw」,https://news.yahoo.co.jp/articles/8058f45520f45ac823f2a091669a31b78fadf5a8,6/20(木) 23:46
2024-06-21,04:15,sports,スポーツ,4,CoCoKARAnext,バレー女子日本、3大会ぶりのベスト4進出！ 中国相手にストレート勝ちを収める【ネーションズリーグ準々決勝】,https://news.yahoo.co.jp/articles/507d565f73de5746e07b8ad6b388cb63b49d796a,6/20(木) 20:20
2024-06-21,04:15,sports,スポーツ,5,GOAL,2026年W杯アジア最終予選のポット分け決定…日本は韓国＆イランと対戦せず,https://news.yahoo.co.jp/articles/e964185c537584b378e3b97553569be81326f7d4,6/20(木) 18:19
2024-06-21,04:15,sports,スポーツ,6,Full-Count,大谷翔平に立ちはだかる“天才打者”　最速で大台到達…止まらぬ快音、突き進む偉業,https://news.yahoo.co.jp/articles/403c06db10e0b0d36abc14d684db6b5906a6557d,6/20(木) 18:28
2024-06-21,04:15,sports,スポーツ,7,スポニチアネックス,「大谷は素晴らしい」ド軍ロバーツ監督が改めて代役1番を称賛「他に誰もいなかった。彼は完璧」,https://news.yahoo.co.jp/articles/5b03fa61e4c5c62f49e77e6976c761538b815213,6/21(金) 3:15
2024-06-21,04:15,sports,スポーツ,8,スポーツ報知,大谷翔平、ロッキーズ戦で「１番・ＤＨ」リーグ単独トップ２１号＆自己最長並ぶ５戦連続マルチ安打なるか,https://news.yahoo.co.jp/articles/ca351ef9757bd7a45bc9a822edc78832f8027d03,6/21(金) 1:01
2024-06-21,04:15,sports,スポーツ,9,スポーツ報知,初代タイガーマスク、体調不良で「リング上」あいさつ断念も復活を約束「もう少しお待ちください。必ず元気になります」,https://news.yahoo.co.jp/articles/6c642558ab88db7f9ad7dee032a942d3bbf9ca7d,6/20(木) 20:33
2024-06-21,04:15,sports,スポーツ,10,東スポWEB,カブス・今永昇太ショック！　快投導いた女房役が突然の解雇,https://news.yahoo.co.jp/articles/08dcddcf170105521cc3bba4f014e816a8fbce43,6/20(木) 17:41
2024-06-21,04:15,sports,スポーツ,11,日刊スポーツ,ザギトワ、太もも内側あらわな妖艶ドレス姿を披露「スケートでもヒールでも女王」小悪魔メイクも,https://news.yahoo.co.jp/articles/8a3fe3f086b95494a64c9a037f1c4797c851d344,6/20(木) 18:55
2024-06-21,04:15,sports,スポーツ,12,西スポWEB OTTO！,独立L外野手が161キロ！　公式SNS動画に大反響　打撃も無双の徳島主将に「これはヤバイ」「間違いなく即戦力候補」「どの球団も欲しい逸材」の声,https://news.yahoo.co.jp/articles/f7f7b3febc00fc905afbd5b1a3d0be7ba8cc39ec,6/20(木) 22:30
2024-06-21,04:15,sports,スポーツ,13,GOAL,降格圏の鳥栖、ユヴェントス下部組織出身＆リトアニア代表MFスリヴカを獲得！「ヴィキと呼んでください！」,https://news.yahoo.co.jp/articles/8172ec4a4b65bd2d1d7ea599201fdf49eaf5c551,6/20(木) 20:14
2024-06-21,04:15,sports,スポーツ,14,日刊スポーツ,【バレー】ブラジルがタイにストレート勝ちで準決勝進出　22日に日本との対戦が決定,https://news.yahoo.co.jp/articles/3c7f1604931f0e4bb2d1717e33400c7421183cac,6/20(木) 23:55
2024-06-21,04:15,sports,スポーツ,15,超WORLDサッカー！,日本はドイツの1つ下の17位でアジア最高位！ W杯最終予選のポット分けも決定し、イラン＆韓国とは対戦せず【FIFAランキング】,https://news.yahoo.co.jp/articles/4e7f55062d78bb897c101879dc20769f1cbf4901,6/20(木) 21:40
2024-06-21,04:15,sports,スポーツ,16,ABEMA TIMES,球場騒然！ アイツは一体、何者だ…！？ 身長211cm！“メジャーで最も背が高い投手”が衝撃の登板　ファン騒然「怖っ…！」「大谷さん、ダル兄さんよりデカい」,https://news.yahoo.co.jp/articles/a6816e732ea7f396c58842a51ad474b7d93e6fa7,6/20(木) 23:32
2024-06-21,04:15,sports,スポーツ,17,Full-Count,負け試合で取材対応「変わったね」　大谷翔平、ド軍移籍で生まれた“変化”,https://news.yahoo.co.jp/articles/16263cea072b2883aba8db78e54e165dc2845f80,6/20(木) 15:36
2024-06-21,04:15,sports,スポーツ,18,スポニチアネックス,カブス・今永　戦力外となった捕手のゴームズに惜別と感謝「僕に、より大きな自信を与えてくれた」,https://news.yahoo.co.jp/articles/21226f9bb4d202dd622e4a118e8e305ac39bc149,6/21(金) 1:30
2024-06-21,04:15,sports,スポーツ,19,スポニチアネックス,「どれだけ木に当たるか楽しみ」　しぶこ節で抱負　全米女子プロ、過去は苦戦続きも「前よりは自信」,https://news.yahoo.co.jp/articles/8572e7f9dedf3914a585296e63758c3059501c7b,6/21(金) 3:00
2024-06-21,04:15,sports,スポーツ,20,スポニチアネックス,【バレー女子】世界ランク7位の日本　同6位の中国の高さに苦しむも第1セット先取　NL決勝T準々決勝,https://news.yahoo.co.jp/articles/a26ffdd3b0bfba46d49d93ec05b25d75888c3252,6/20(木) 19:24
2024-06-21,04:15,sports,スポーツ,21,競馬ラボ,【宝塚記念】2週続けて勝ち馬ズバリ！ドウデュースを脅かす逆転グランプリ候補,https://news.yahoo.co.jp/articles/93d61afefe5868e8759f568468301ecc25b3d7ec,6/20(木) 21:02
2024-06-21,04:15,sports,スポーツ,22,サンケイスポーツ,ＭＬＢ　ドジャース・大谷翔平、４戦連続マルチ安打＆日本人歴代３位の米通算７４４安打　好調の秘けつは「立ち位置のズレの修正」,https://news.yahoo.co.jp/articles/9e962ff3ec7063abc0464aa02baa9e9897a4e4f6,6/20(木) 20:17
2024-06-21,04:15,sports,スポーツ,23,theWORLD（ザ・ワールドWeb）,デンマークに大苦戦のイングランドはドロー　ストライカーのケインにゴールが生まれるもヒュルマンドがスーパーミドルを叩き込む,https://news.yahoo.co.jp/articles/87bd764a3509d243cc534fe056925c8b4f8148cc,6/21(金) 3:10
2024-06-21,04:15,sports,スポーツ,24,道新スポーツ,交流戦明けローテ再編　日本ハム3本柱同一カード投入へ　ソフトバンク戦にらんで勝負,https://news.yahoo.co.jp/articles/7348184786f98054fae51768ba456e111c3ec9ee,6/20(木) 22:26
2024-06-21,04:15,sports,スポーツ,25,デイリースポーツ,大谷翔平と同身長＆２ショの女子バスケ選手　モデルショットがすごっ！９頭身の抜群スタイルに「スーパーモデル」の声,https://news.yahoo.co.jp/articles/880a0ce9a7920da2feb6a4dc96c7e32d8e71a3e4,6/14(金) 17:42
2024-06-21,04:15,sports,スポーツ,26,サンケイスポーツ,元幕内炎鵬の「弓取り式」に送られた声援と、拍手に思う,https://news.yahoo.co.jp/articles/8dbd25010db44a78a98bfdbfe95bd0fca3c09889,6/20(木) 20:00
2024-06-21,04:15,sports,スポーツ,27,スポニチアネックス,亀田大毅氏「結構危なくてやられてしまう可能性も…」　那須川天心のボクシング4戦目の勝敗予想,https://news.yahoo.co.jp/articles/83f95f3b88b76947d9630153bb23723740e37a77,6/20(木) 20:08
2024-06-21,04:15,sports,スポーツ,28,超WORLDサッカー！,セルビアがユーロ2024から去る可能性も? クロアチアvsアルバニアのチャントが大問題に…UEFAに正式に抗議「制裁を求める」,https://news.yahoo.co.jp/articles/0add054d30eec7559a3dc2c2d8917f79e77f1fb1,6/20(木) 23:50
2024-06-21,04:15,sports,スポーツ,29,日刊スポーツ,【巨人】サプライズ訪問のミスターが車いす姿で岡本和真に熱血指導！打球音にOKサインでエール,https://news.yahoo.co.jp/articles/e3412918b08085982aa4a2f28a55d096cb080436,6/20(木) 19:47
2024-06-21,04:15,sports,スポーツ,30,ABEMA TIMES,いつもと違う…？ 大谷翔平に一体、何が起こったのか…！？ 試合開始直後に見せた“一瞬の表情”が話題に「これだから空気読めないヤツはw」「この顔にもなるわ」,https://news.yahoo.co.jp/articles/20796277e8c6f2251093443a84e23c581b8c5916,6/20(木) 22:57
2024-06-21,04:15,sports,スポーツ,31,東スポWEB,【Ｆ１】ペレスの契約延長は〝失敗〟とマルコ博士が後悔「残念ながらうまくいかなかった」,https://news.yahoo.co.jp/articles/5898fc93e69bde276a621597718348acf5e9f37f,6/20(木) 17:51
2024-06-21,04:15,sports,スポーツ,32,Full-Count,41歳で打率4割超え　薬物違反、不良債権…“お騒がせ”天才打者が異国でV字復活,https://news.yahoo.co.jp/articles/0fcc35e96840ae9b5cc3b794f9c1d7778abf8064,6/20(木) 19:24
2024-06-21,04:15,sports,スポーツ,33,西スポWEB OTTO！,裏交流戦!?　広島の秋山翔吾がソフトバンクユニ姿で笑顔、ユニ交換した選手は…「サッカーみたいですき」「身体の大きさ変わらんのかな」,https://news.yahoo.co.jp/articles/cb41fa3a714e447236ecc37c55df34021912eb41,6/20(木) 21:50
2024-06-21,04:15,sports,スポーツ,34,スポニチアネックス,ダルビッシュ有　WBCの時に“勉強になった”2人の投手を実名告白！「自分の考えとは全く違うので…」,https://news.yahoo.co.jp/articles/a120ea6a720ea55ed04083b724b0259469ab8db3,6/18(火) 21:03
2024-06-21,04:15,sports,スポーツ,35,ゴルフ総合サイト ALBA Net,＜速報＞日本勢12人出場の全米女子プロが開幕　勝みなみが先陣、渋野日向子は早朝4時55分スタート,https://news.yahoo.co.jp/articles/e0c98bd2bb155e1970d4e329f9bd5acf3c87cfb3,6/20(木) 23:29
2024-06-21,04:15,sports,スポーツ,36,Full-Count,ドラフト1位は確実？　12球団が認める高校ナンバーワン…151キロ右腕の“現在地”,https://news.yahoo.co.jp/articles/3aa8b4309c14358297e1de334402c4d580306956,6/20(木) 8:20
2024-06-21,04:15,sports,スポーツ,37,東スポWEB,最短復帰できない佐々木朗希に海外メディアが辛らつ「165キロ投げてもガラスの体なら意味がない」,https://news.yahoo.co.jp/articles/31e320acc6d8faff92956c679245fefbc262e189,6/20(木) 13:51
2024-06-21,04:15,sports,スポーツ,38,デイリースポーツ,日本ハム・水谷、交流戦ＭＶＰにも「複雑な気持ち」賞金２００万円は年俸１／３以上も「欲しい物、何もないです」,https://news.yahoo.co.jp/articles/b49673d18f2f008774792eb6746befab69d16ba9,6/20(木) 19:55
2024-06-21,04:15,sports,スポーツ,39,デイリースポーツ,木村沙織さん「心臓バクバクしながら撮ってた」衝撃の動画に「沙織さんらしくて爆笑」「沙織ちゃん　かわいい」の声,https://news.yahoo.co.jp/articles/5867215f6ed1b4fcf69b68fd0c7015f09ebb8ee2,6/20(木) 22:14
2024-06-21,04:15,sports,スポーツ,40,FITNESS LOVE,大学病院看護師が171cmの長身を活かした腰高脚線でコンテスト銅メダル,https://news.yahoo.co.jp/articles/c77af7dab0a69e45fa6b6e3b338c007634ee61b0,6/20(木) 7:10
