scrp_date,scrp_time,genre_en,genre_jp,rank,media_jp,title,link,date_original
2025-08-30,15:08,TTL,総合,1,RKB毎日放送,「暗いトンネルに落ちた」引き金は”ささいな夫婦喧嘩”　我が子（7）の人工呼吸器を外した母親の8年間　裁判からみえた、亡くなった心菜ちゃんからのメッセージ　福岡,https://news.yahoo.co.jp/articles/6a5344b87dff10b0ddbc3c36554455731c0afb54,8/30(土) 14:01
2025-08-30,15:08,TTL,総合,2,デイリースポーツ,お笑い芸人の元妻、第２子妊娠を公表　電撃子連れ再婚から約２カ月「彼となら乗り越えていける」,https://news.yahoo.co.jp/articles/0ee9cda6c53c3ccece2937c9575c2e1430e2c414,8/30(土) 12:32
2025-08-30,15:08,TTL,総合,3,ねとらぼ,「しまむら」に行った58歳父→買ってきたTシャツが“まさかのデザイン”で3万いいね！　「同じ年だから気持ちわかる」「欲しい！」　1年後の現在は……投稿者に聞いた,https://news.yahoo.co.jp/articles/e835154cebecc8b9ade1629b6942a5922b783781,8/30(土) 7:10
2025-08-30,15:08,TTL,総合,4,中日スポーツ,ドジャース・スネルに異変、平均より2．7キロ球速低下で３失点… ８月に左肩痛から復帰、ポストシーズン大黒柱の期待も,https://news.yahoo.co.jp/articles/b17f7e0d11b4a808bf0962ceff39553c03920a37,8/30(土) 13:20
2025-08-30,15:08,TTL,総合,5,RONSPO,「なんで？こんなことをしていたら野球がダメになる」阪神顧問の岡田彰布氏がTG戦制した巨人にTVゲスト解説で苦言連発…「小林の抑えキャッチャー起用」の提案も,https://news.yahoo.co.jp/articles/ee89acf8a03730874ad294c8f0717c32460b08aa,8/30(土) 8:15
2025-08-30,15:08,TTL,総合,6,スポーツ報知,【巨人】ＯＢの松井秀喜氏と高橋由伸氏がトークショー　松井氏は「ジャイアンツの未来に自分自身が関わっても不思議はない」,https://news.yahoo.co.jp/articles/9ae617f181d3e269c55cfadd82953ef4044b45e6,8/30(土) 13:12
2025-08-30,15:08,TTL,総合,7,マグミクス,「好きだけど許せない」アシタカとサンの知られざる結末　宮崎駿が明かした『もののけ姫』のその後,https://news.yahoo.co.jp/articles/45c2a9cf113124633a2f374f7e4a5a15f7b13587,8/30(土) 7:10
2025-08-30,15:08,TTL,総合,8,日刊スポーツ,石原伸晃氏「怖かった」自民党幹事長の名を告白「森山さんよりもっと怖いよ。ビクビクした」,https://news.yahoo.co.jp/articles/1bbf4b9f06054c84621eac27fc1bade91df4e357,8/30(土) 12:18
2025-08-30,15:08,TTL,総合,9,映画チャンネル,こんなに面白いのになぜ爆死？ 低視聴率ドラマの隠れた名作（1）時代が早すぎた…際どい問題に切り込んだ傑作,https://news.yahoo.co.jp/articles/31abafb3b48a883208d00f45558be51b33a869e3,8/30(土) 9:10
2025-08-30,15:08,TTL,総合,10,デイリースポーツ,「なめてる。限界」エンセン井上がブチギレ　弟子３人破門を明かす「息子みたいに思っていた。本当にがっかり」,https://news.yahoo.co.jp/articles/58eaf7b6b60aef28a07dc4ad8560cae1ad1a7f1b,8/30(土) 10:38
2025-08-30,15:08,TTL,総合,11,スポニチアネックス,ドジャース　今季7度目零敗、連勝4でストップ　大谷翔平は1安打も不発　2位パドレス敗れて優勝M25,https://news.yahoo.co.jp/articles/ddab256af3431e88c47e94895deb1fe1c3c9eec0,8/30(土) 13:50
2025-08-30,15:08,TTL,総合,12,ENCOUNT,小倉弘子アナ、昨年TBS退社の真相「このままではマズい」　夫との再出発「70歳までは働ける」,https://news.yahoo.co.jp/articles/ec5a12ebac67d82b033e40c8871d466f0b8b2757,8/30(土) 10:20
2025-08-30,15:08,TTL,総合,13,ファイナンシャルフィールド,独身だった兄が“年金受給前”に亡くなりました。親族は私以外いなのですが、受け取るはずだった年金はどうなるのでしょうか？,https://news.yahoo.co.jp/articles/51501654ef156512dba755fdcc40857294cb622d,8/30(土) 11:30
2025-08-30,15:08,TTL,総合,14,ファイナンシャルフィールド,駅の“トイレ”を使うためだけに「通勤定期券」で改札内に入る同僚。「入場券」などは買っていないようですが問題ないのでしょうか…？,https://news.yahoo.co.jp/articles/1544abf0cf64369981fb601954dbc6533987b6e4,8/30(土) 13:40
2025-08-30,15:08,TTL,総合,15,日刊スポーツ,堀江貴文氏、フジ50億円損害賠償請求訴訟の結末に“12文字”で言及　港前社長らを巨額提訴,https://news.yahoo.co.jp/articles/c4d27a19d138d804565adb9b6b76fa6896009cc3,8/30(土) 13:54
2025-08-30,15:08,TTL,総合,16,ファイナンシャルフィールド,40年前に「電話加入権」を“7万2000円”で購入した両親。今売ったらいくらになりますか？ もう“資産価値”はないのでしょうか？,https://news.yahoo.co.jp/articles/0bd911b693fe2627942584d171f84581f2a1088b,8/30(土) 14:10
2025-08-30,15:08,TTL,総合,17,スポーツ報知,年上の妻は主演級女優…スーツ姿がダンディーで素敵！山本直寛がバースデー「３１歳になりました！」,https://news.yahoo.co.jp/articles/6575e27e13d43d2a293d29c3ede2c977939e2977,8/30(土) 10:55
2025-08-30,15:08,TTL,総合,18,西スポWEB OTTO！,「痩せた」「めっちゃ疲れてるように…」24時間テレビ〝直前〟44歳アイドルの姿が話題「この写真だと…」「チャリティーランナーあるある」,https://news.yahoo.co.jp/articles/3a52e42a7e8c1e3a7cffae6fd9c667d19c3c056d,8/30(土) 11:40
2025-08-30,15:08,TTL,総合,19,弁護士JPニュース,斎藤知事「公職選挙法違反」が“セーフ”でも、今度は「政治資金規正法違反」で“詰み”？　神戸地検から聴取…罪に問われる可能性は【選挙法務のプロが解説】,https://news.yahoo.co.jp/articles/343e01c49f036f855953ba1b2fed212ad7ed6838,8/30(土) 10:40
2025-08-30,15:08,TTL,総合,20,共同通信,歴史問題でも中国と共闘　ロシア大統領、日本名指し,https://news.yahoo.co.jp/articles/cb98a2364bc90e0fe6cc0fc1144f9e9c0f532831,8/30(土) 11:49
2025-08-30,15:08,TTL,総合,21,スポーツ報知,元妻・福原愛さんの最新姿が話題…江宏傑さん、イメージ違う最新ショット！離婚成立４年　２児のパパ,https://news.yahoo.co.jp/articles/8a98ed653d535b99bc1ccf27f01b94797e99a848,8/30(土) 14:25
2025-08-30,15:08,TTL,総合,22,テレビユー山形,"【危険運転】女子中学生が意識不明に...横断中 ""停車した車を追い抜いた車"" にはねられる　容疑はなぜ過失運転から ""危険運転"" に切り替わったのか（山形・酒田市）",https://news.yahoo.co.jp/articles/681d17fa12de3fe2abaa8b3b45b2acc4e68684ca,8/30(土) 12:01
2025-08-30,15:08,TTL,総合,23,日刊スポーツ,内村光良、稽古に来ないコンビ明かす「あいつらめっちゃ売れっ子になっちゃって」,https://news.yahoo.co.jp/articles/b4b7e77316ace8690dd84f5f187a7fa0d4057849,8/30(土) 12:35
2025-08-30,15:08,TTL,総合,24,テレビ静岡NEWS,田久保市長のSNSについて「伊東市の公式な見解を示すものではありません」　市がホームページに明記　意見箱に寄せられた声に回答　「市が公式に管理・運営するアカウントではございません」,https://news.yahoo.co.jp/articles/668069bfe49f4b0d843d3b13be9d97833afa150e,8/30(土) 11:37
2025-08-30,15:08,TTL,総合,25,埼玉新聞,東北・関東で地震　M5・7　最大震度4　震源は宮城県沖　埼玉、東京も揺れる【地震情報】,https://news.yahoo.co.jp/articles/617d39f28302d5ccc73e8e6053f2d230f03f85fd,8/30(土) 6:41
2025-08-30,15:08,TTL,総合,26,LIMO,10月15日に振り込まれる年金から「手取り額」が変わる人も！老齢年金「国民年金・厚生年金」みんな月いくらもらってる？,https://news.yahoo.co.jp/articles/79fdaa11a0769e59d637bec6a1d1c15b7eaccfcf,8/30(土) 11:36
2025-08-30,15:08,TTL,総合,27,デイリースポーツ,横山裕、中学卒業後に即就職、母の病気で弟は施設へ　「２４時間テレビ」ランナーに「はっきり走る理由がある」,https://news.yahoo.co.jp/articles/64b68e03540c1ca1423804d1456df252e73ca8f0,8/30(土) 9:39
2025-08-30,15:08,TTL,総合,28,日刊スポーツ,大阪・関西万博の公式サイト「安全確保できる環境ではありません」早朝の入場待ち自粛を呼びかけ,https://news.yahoo.co.jp/articles/86e1201dc4a9a304ed1b8655ae0a51668e199d11,8/30(土) 11:36
2025-08-30,15:08,TTL,総合,29,デイリースポーツ,長嶋一茂が収録中に突然退席のその後…涙目のサバンナ高橋がなぜか責められる,https://news.yahoo.co.jp/articles/1da57726964d388defc310cad3ab5754a4a2c687,8/30(土) 10:10
2025-08-30,15:08,TTL,総合,30,デイリースポーツ,橋下徹氏　学歴疑惑の田久保市長が「勝つかもわからない」→兵庫斎藤知事のように失職を選び市長選となった場合,https://news.yahoo.co.jp/articles/5a98fc2a57d2580d6bb692aa337f762259f46bff,8/30(土) 12:26
2025-08-30,15:08,TTL,総合,31,ほ・とせなNEWS,運動会で走る15歳の女の子　→恋をした結果…5年後の姿に「可愛い」「恋の力か！」「いい年齢の重ね方」,https://news.yahoo.co.jp/articles/02530387b24d384994bcf18212759ddf2244ba90,8/30(土) 8:00
2025-08-30,15:08,TTL,総合,32,デイリースポーツ,キンプリ高橋海人、２４時間テレビ出演取りやめ「シューイチ」で改めて説明　中山秀征「やむを得ない」,https://news.yahoo.co.jp/articles/d4fcefca845ee624d8622769791a6c3f9fc195bb,8/30(土) 9:52
2025-08-30,15:08,TTL,総合,33,ABEMA TIMES,犬に噛まれて30針縫った元グラドル・小島可奈子（49） 発達障害の娘と考える「普通って何？」,https://news.yahoo.co.jp/articles/f49470e809200376a2a848c0720c57b4e399434c,8/30(土) 11:30
2025-08-30,15:08,TTL,総合,34,MBSニュース,【速報】4200グラムの赤ちゃん　ゴミ袋に入れて口結び殺害か　18歳の母親と交際相手19歳を逮捕　「両親にも相談できず…どうしていいかわかりませんでした」　迷ったら相談を,https://news.yahoo.co.jp/articles/2ea2b51330ebe40541864780d1792bb896b3718a,8/30(土) 10:00
2025-08-30,15:08,TTL,総合,35,CoCoKARAnext,阪神29歳内野手は「もう、完全にレギュラー」出場8試合連続安打も話題、注目の.458、センター、遊撃もマルチにこなす「本当に頼もしい限りです」,https://news.yahoo.co.jp/articles/b1bbe13ab9b7683b8b268f8f17e151c1ae56d214,8/30(土) 12:50
2025-08-30,15:08,TTL,総合,36,日刊スポーツ,女子ゴルフ会場に動物が出没　川崎春花も練習の手を止めて見つめた先にいたのは,https://news.yahoo.co.jp/articles/ce60a7018ae6b3a86cf9a41f085d5b4fc0502e9f,8/30(土) 11:34
2025-08-30,15:08,TTL,総合,37,西スポWEB OTTO！,女子モーグル上村愛子さんの水着姿に反響続々「ドキっとしてもうた」「すごく綺麗な人」「夏の愛子さんも良い」などの声,https://news.yahoo.co.jp/articles/4d21c8b06789f98dfc9cbfe9d34eda1914f95d72,8/29(金) 23:30
2025-08-30,15:08,TTL,総合,38,ねとらぼ,「オオクワガタ来るかな？」→木に果物をつるしたら……　夜、大集合した生き物に「初めて見た」「とにかくすごい！」,https://news.yahoo.co.jp/articles/8bdad37c5e8c23ad909f28c4df2bdaf551e116e3,8/28(木) 22:05
2025-08-30,15:08,TTL,総合,39,スポニチアネックス,56歳・北村一輝　バキバキに鍛え上げられた肉体にファン驚き「腕の筋肉凄い」「カッコ良過ぎ」,https://news.yahoo.co.jp/articles/4f4cb0336bf2d7dbe4c28743e98a4b313bbde476,8/30(土) 14:13
2025-08-30,15:08,TTL,総合,40,マグミクス,『もののけ姫』ラストでアシタカはなぜタタラ場に残った？　「共に生きよう」に隠された“ヤバすぎる覚悟”【ネタバレ考察】,https://news.yahoo.co.jp/articles/dd54ee65ca5275359c00151013f5d8c61e46f62d,8/30(土) 0:07
