scrp_date,scrp_time,genre_en,genre_jp,rank,media_jp,title,link,date_original
2024-03-16,12:18,TTL,総合,1,TBS NEWS DIG Powered by JNN,イチローさん、僕たち「ちゃんとやりました!」金言胸にサクラ咲かせた、進学校・都立新宿高校の球児たち　,https://news.yahoo.co.jp/articles/5ef881b4ea65a8643814e90c397e890b13d70a4e,3/16(土) 7:02
2024-03-16,12:18,TTL,総合,2,弁護士ドットコムニュース,ディズニーランドで「初めてこんなにガッカリ」 溢れかえるゴミ箱の画像拡散…オリエンタルランドの回答は？,https://news.yahoo.co.jp/articles/70def013c7a8e212255021c7fed068a88b37f1af,3/15(金) 18:19
2024-03-16,12:18,TTL,総合,3,スポーツ報知,大谷翔平の妻・田中真美子さん、昨季突然の引退に不思議がる声も　美しさにファンは「真美子様」身長１８０センチで国際大会でも活躍,https://news.yahoo.co.jp/articles/6f3f0d89574b5cb10c68727e2ad2e334cd25540a,3/15(金) 19:32
2024-03-16,12:18,TTL,総合,4,スポーツ報知,ドジャース大谷翔平の妻・田中真美子さん現役時の好プレーをＷリーグ公式がこのタイミングで動画公開,https://news.yahoo.co.jp/articles/c8f80ee440bd61f44c2b24e10440a577a31a9f57,3/16(土) 6:49
2024-03-16,12:18,TTL,総合,5,J-CASTニュース,ラストラン直前「サンダーバード」で外国人の男が車掌に暴力　鉄道ファン怒り「迷惑極まりない」「車掌さんかわいそう」,https://news.yahoo.co.jp/articles/00753d28c0c3ab829e971b62ee09c84543e17aa1,3/15(金) 19:29
2024-03-16,12:18,TTL,総合,6,読売テレビ,「流出したら終わり」“過激ダンスショー”で何が？「違和感」「目のやり場に困った」参加者が語る状況,https://news.yahoo.co.jp/articles/8386ba1cbfb30fe99c0569d5b4ea22755d4909b0,3/16(土) 10:00
2024-03-16,12:18,TTL,総合,7,TBS NEWS DIG Powered by JNN,大谷翔平の“妻”田中真美子さんの元所属会社がお祝いコメント発表「たくさんの人に元気を与えてくれた」,https://news.yahoo.co.jp/articles/f4d4eace008e21b46c5afdf9b450912b5b3fc9a5,3/16(土) 3:16
2024-03-16,12:18,TTL,総合,8,デイリースポーツ,「不適切にもほどがある」八嶋智人氏のリアル奥さん出てきた　高身長の美貌女優「えっ！本物の奥さん！？」「出てるｗ」「クセ強い」,https://news.yahoo.co.jp/articles/8493e940f2157ce89f63dfd313d05d54bb354aac,3/15(金) 23:46
2024-03-16,12:18,TTL,総合,9,スポニチアネックス,4四死球に3暴投…メッツ・藤浪晋太郎が大荒れ　1死も奪えず3失点で降板　防御率13・50に悪化,https://news.yahoo.co.jp/articles/3e6bfe4d10aa745fa860869e81b6a43dd8006ee1,3/16(土) 9:22
2024-03-16,12:18,TTL,総合,10,中日スポーツ,大谷翔平の妻・田中真美子さんをバスケ日本代表の馬瓜エブリンがSNSで祝福　「やっと言えた系ですね」の声,https://news.yahoo.co.jp/articles/87e63023219f8e7fd606f4ab3b200c022ef10f17,3/15(金) 20:59
2024-03-16,12:18,TTL,総合,11,スポーツ報知,「めざましどようび」谷尻萌アナが結婚報告「より一層努力してお仕事に真摯に向き合っていきたい」,https://news.yahoo.co.jp/articles/81c4ad2f809dca4e61f96cc8c10cdc35db64db55,3/16(土) 6:58
2024-03-16,12:18,TTL,総合,12,Medical DOC,“認知症になりやすくなる”生活習慣は？ 予防法について専門家が解説,https://news.yahoo.co.jp/articles/79863da2d0fca5c4489c0da21b23eef6753b12b2,3/15(金) 19:30
2024-03-16,12:18,TTL,総合,13,デイリースポーツ,大谷妻の大学名や経歴も「平凡でなかった」韓国メディアも実名詳報「９千億男　妻の素晴らしいスペック」「ネット民の推測当たった」,https://news.yahoo.co.jp/articles/540afd430f6268d08a95ac6e0cff466dfdc903a0,3/15(金) 19:58
2024-03-16,12:18,TTL,総合,14,Hint-Pot,「神回答」　理科のテストで10歳女児が驚きの発想　6.8万の“いいね”　先生の採点に称賛も,https://news.yahoo.co.jp/articles/00f98410b2c66cc4420317071bad9ed7dca97e91,3/16(土) 7:20
2024-03-16,12:18,TTL,総合,15,デイリースポーツ,「まさかの公式ｗ」大谷翔平の妻、田中真美子さんの好プレー動画が大反響　Ｗリーグ絶好のタイミングで投稿「もっと遠慮なくお願いします！」,https://news.yahoo.co.jp/articles/ef2cc72c260b7285900684f94a60ca22c6ba4565,3/16(土) 10:01
2024-03-16,12:18,TTL,総合,16,TBS NEWS DIG Powered by JNN,自民党「過激ダンスショー」と「裏金事件」の共通点　なぜ問題は繰り返されるのか,https://news.yahoo.co.jp/articles/6ac30a1eca2dc0f98b22a560dc838cfeb24a09d1,3/16(土) 6:02
2024-03-16,12:18,TTL,総合,17,日テレNEWS NNN,山本由伸　ドジャースカラーの超高級バッグに視線　ファンは「バッグに目が行った」,https://news.yahoo.co.jp/articles/0aa4904fdec889f245c34eaba50803233d64f9e6,3/15(金) 17:32
2024-03-16,12:18,TTL,総合,18,ほ・とせなNEWS,風邪のような症状から始まり緊急入院に　難病と診断された女性の“顔の変化”に驚きの声　「可哀想と捉えないで」発信した思いを聞いた,https://news.yahoo.co.jp/articles/bfb18f5532034a5794e0ae2057877f00a14c8eea,3/16(土) 11:30
2024-03-16,12:18,TTL,総合,19,マグミクス,『ドラクエ』リメイク要素に賛否両論　「ベホマなくなっても倒せない」「仲間モンスター廃止！？」,https://news.yahoo.co.jp/articles/1c3c2353523fc643fa6b7078d9e961b48e6e4898,3/15(金) 22:05
2024-03-16,12:18,TTL,総合,20,デイリースポーツ,大谷通訳　水原一平さんも美人妻と現る「綺麗！」長い髪がエレガント　「ゴゴスマ」石井アナ興奮実況「水原夫妻です！初めてツーショット！」,https://news.yahoo.co.jp/articles/bb45c917b6d079606ea97d32026c7de1ef99249e,3/15(金) 22:22
2024-03-16,12:18,TTL,総合,21,47NEWS,伊藤美誠は泣きながら母に伝えた「卓球が嫌になった状態でやめたくない」　五輪選考レースが終わった今だから明かせる当時の思い、そして世界ランク１位へ新たな挑戦,https://news.yahoo.co.jp/articles/d77ea3721ee2997524a324bcae942e40f6e6772a,3/16(土) 11:02
2024-03-16,12:18,TTL,総合,22,弁護士JPニュース,大谷翔平選手「妻の写真」公開は“過熱報道”回避？「有名人のプライベート情報」はどこまで守られるべきか,https://news.yahoo.co.jp/articles/405e9c290687e524388d59d2345ea412ce778b3c,3/16(土) 8:50
2024-03-16,12:18,TTL,総合,23,KOREA WAVE,犬に性的虐待という卑劣さ…韓国で広がる怒りの声「犯人を捕まえよ」,https://news.yahoo.co.jp/articles/c3298f25d25123a8ee159912eb812293894d836a,3/14(木) 4:03
2024-03-16,12:18,TTL,総合,24,デイリースポーツ,大谷１８０ｃｍ長身妻が　若き日の大谷母と似てると驚き　漂う雰囲気ソックリ　ＭＬＢ紹介２５年前の大谷母子の写真が話題「めちゃ似てる」,https://news.yahoo.co.jp/articles/92ed0916ae78d48587be80b1f5a9182541e02fb9,3/16(土) 11:08
2024-03-16,12:18,TTL,総合,25,デイリースポーツ,大谷翔平、空港大フィーバーで新妻を気づかう　先頭歩くも振り返り　数歩後ろの真美子さんと視線合わせる　韓国到着,https://news.yahoo.co.jp/articles/b34584e2acd195b428c997375e409844c9a66f20,3/15(金) 15:04
2024-03-16,12:18,TTL,総合,26,日刊ゲンダイDIGITAL,秋篠宮家が学習院に見切りをつけることを決定づけた数学教師の性加害事件【秋篠宮家の学校選び #6】,https://news.yahoo.co.jp/articles/23a20503431a3335050a241da2ff539f7b30c2b9,3/16(土) 9:06
2024-03-16,12:18,TTL,総合,27,スポーツ報知,「韓国チームは冷遇？」大谷翔平出場のＭＬＢ韓国開幕シリーズで本拠キウムに思わぬ余波…現地メディア報じる,https://news.yahoo.co.jp/articles/06a01b2d40b986aac6d2f5b78912b06a88eeeee8,3/16(土) 9:41
2024-03-16,12:18,TTL,総合,28,デイリースポーツ,福原愛さん　パッチリ二重に「雰囲気変わった」「綺麗過ぎてびびった」元夫と和解成立で会見　昨年末に美容整形医院で施術,https://news.yahoo.co.jp/articles/c1b11bd56f68e374450e88f1a89e2d76b981b764,3/15(金) 15:51
2024-03-16,12:18,TTL,総合,29,デイリースポーツ,福原愛さん　元夫との和解成立を発表「これからは江さんと協力して子供を育てていきたい」　長男を引き渡す　冒頭挨拶後、即退席,https://news.yahoo.co.jp/articles/2adbdf33808199bdae276c07fde93748bc9ca08b,3/15(金) 14:02
2024-03-16,12:18,TTL,総合,30,朝日新聞デジタル,「ブレイキングダウン」格闘家を傷害容疑で逮捕　神奈川県警,https://news.yahoo.co.jp/articles/621792ca7a134ad19e7b59be85431e4230f2f220,3/16(土) 10:28
2024-03-16,12:18,TTL,総合,31,LIMO,【厚生年金】友人が「月額30万円以上もらってる」と言います。年収いくらあればそんなにもらえるんですか？,https://news.yahoo.co.jp/articles/35f3fc08d1632f55947152fa6c5e3d98703ae211,3/16(土) 5:17
2024-03-16,12:18,TTL,総合,32,朝鮮日報日本語版,MLB：普通と言っていたのに…来韓した大谷の妻、「身長180cm」抜群スタイルに驚きの声,https://news.yahoo.co.jp/articles/ab75fd3d5ee3cc221bdd1e874ffbaed9951f6918,3/16(土) 11:25
2024-03-16,12:18,TTL,総合,33,スポーツ報知,神田正輝、「旅サラダ」中丸雄一のＪＲ敦賀駅から生中継で一時映像停止のトラブルも動じず…「生放送っぽくていい」,https://news.yahoo.co.jp/articles/40837da34d498f922d2cbfe4c953a554baae845e,3/16(土) 8:28
2024-03-16,12:18,TTL,総合,34,スポニチアネックス,大谷翔平と「彼の妻」の2S、球団インスタで別カット公開　ファン「雰囲気が似ている」「超お似合い」,https://news.yahoo.co.jp/articles/c031937394e4a54dc390e8cf34b8bc0f0e848d38,3/15(金) 8:16
2024-03-16,12:18,TTL,総合,35,中日スポーツ,大谷翔平の妻・田中真美子さんへファンから祝福の声「元気そうなマナさんの姿を見れてとても嬉しいです」,https://news.yahoo.co.jp/articles/1a01979bec31cbbcaed7f1911747da966e1470b1,3/15(金) 22:35
2024-03-16,12:18,TTL,総合,36,よろず～ニュース,れいわ山本太郎代表 参院予算委で成田悠輔氏の〝老害発言〟ただす 岸田首相「極めて不適切な発言」,https://news.yahoo.co.jp/articles/dd8e8ac6e8f6905ac37d85c2c71dfa37a7f4242d,3/16(土) 8:50
2024-03-16,12:18,TTL,総合,37,関西テレビ,寺を乗っ取られた元住職が語る　1000年を超える歴史の寺が「ごみ捨て場」　自分も被告人となり…「自身の甘さが発端です」,https://news.yahoo.co.jp/articles/707f618676e62fe6a384f71e6c1e839f2a7146d7,3/15(金) 20:31
2024-03-16,12:18,TTL,総合,38,ABEMA TIMES,「事故だろw」青木真也の発言に女子アナが“ドン引き” 「青木ブチギレww」「激おこw」ファン困惑,https://news.yahoo.co.jp/articles/ef19e26aa328c3d6de34dca1071b86d702b87a50,3/16(土) 7:42
2024-03-16,12:18,TTL,総合,39,デイリースポーツ,にしおかすみこ　激変の茶髪ショートで生ＴＶ　トレンド騒ぎ「びっくり」「綺麗」「４９歳に見えない」「久々に見たら」,https://news.yahoo.co.jp/articles/c425bfae6a85331a0235077db237acf058f625e0,3/16(土) 9:48
2024-03-16,12:18,TTL,総合,40,J-CASTニュース,大谷翔平の試合がテレビ中継から消える？　ゴルフ「全英オープン」テレ朝撤退、サッカーアジア杯は放映なし試合も,https://news.yahoo.co.jp/articles/a6f30344800d57dcda828fdd17b06aa58cf76c4f,3/15(金) 21:08
