scrp_date,scrp_time,genre_en,genre_jp,rank,media_jp,title,link,date_original
2024-03-16,16:15,TTL,総合,1,TBS NEWS DIG Powered by JNN,イチローさん、僕たち「ちゃんとやりました!」金言胸にサクラ咲かせた、進学校・都立新宿高校の球児たち　,https://news.yahoo.co.jp/articles/5ef881b4ea65a8643814e90c397e890b13d70a4e,3/16(土) 7:02
2024-03-16,16:15,TTL,総合,2,デイリースポーツ,大谷夫人・真美子さん経歴「超ハイスペ」早稲田大→富士通、１８０ｃｍ、高校も強豪に感嘆「すごい」「勝てない」「憧れる」,https://news.yahoo.co.jp/articles/574d78916e1deae1c37ae9c465c00717495334bb,3/16(土) 12:24
2024-03-16,16:15,TTL,総合,3,デイリースポーツ,あの状況でまさか　大谷翔平の妻、真美子さんが思わず笑ったワケ　愛あふれる仕草にネット反響「わ！気づかなかった」「奥様照れてる」,https://news.yahoo.co.jp/articles/c3ef579685f402fa15cb500e317404df4c12a664,3/16(土) 12:32
2024-03-16,16:15,TTL,総合,4,スポーツ報知,田中真美子さんの元所属・富士通が祝福コメント「新たな門出を心よりお祝い申し上げます」大谷翔平の“妻”と米報道,https://news.yahoo.co.jp/articles/a3097ec9686ae09c1f7a565582f68058b559faa1,3/16(土) 9:59
2024-03-16,16:15,TTL,総合,5,弁護士ドットコムニュース,ディズニーランドで「初めてこんなにガッカリ」 溢れかえるゴミ箱の画像拡散…オリエンタルランドの回答は？,https://news.yahoo.co.jp/articles/70def013c7a8e212255021c7fed068a88b37f1af,3/15(金) 18:19
2024-03-16,16:15,TTL,総合,6,スポーツ報知,大谷翔平の妻・田中真美子さん、昨季突然の引退に不思議がる声も　美しさにファンは「真美子様」身長１８０センチで国際大会でも活躍,https://news.yahoo.co.jp/articles/6f3f0d89574b5cb10c68727e2ad2e334cd25540a,3/15(金) 19:32
2024-03-16,16:15,TTL,総合,7,ねとらぼ,「知らんわ」　ハードオフでジャンク品に遭遇→商品説明欄に書かれた「まさかのコメント」に思わずツッコミ,https://news.yahoo.co.jp/articles/be504ad1ff7e19cf8cea03f984e8ea76d7c15d35,3/16(土) 12:00
2024-03-16,16:15,TTL,総合,8,ほ・とせなNEWS,風邪のような症状から始まり緊急入院に　難病と診断された女性の“顔の変化”に驚きの声　「可哀想と捉えないで」発信した思いを聞いた,https://news.yahoo.co.jp/articles/bfb18f5532034a5794e0ae2057877f00a14c8eea,3/16(土) 11:30
2024-03-16,16:15,TTL,総合,9,スポニチアネックス,大谷翔平　韓国でダルとの初対戦に向け「小さい頃から見てきて大好きな投手。個人的に凄く楽しみ」,https://news.yahoo.co.jp/articles/74a16a4c80c285b982495ec0fdd197f50b269915,3/16(土) 15:13
2024-03-16,16:15,TTL,総合,10,ねとらぼ,話題沸騰の田中真美子さん、“現役時のプレー動画”をWリーグが公開　再生数が急上昇「まさかの公式」「めっちゃカッコいい」,https://news.yahoo.co.jp/articles/05568fd49f0f55721ce408a147ac4b608fcf44eb,3/16(土) 12:04
2024-03-16,16:15,TTL,総合,11,朝鮮日報日本語版,MLB：普通と言っていたのに…来韓した大谷の妻、「身長180cm」抜群スタイルに驚きの声,https://news.yahoo.co.jp/articles/ab75fd3d5ee3cc221bdd1e874ffbaed9951f6918,3/16(土) 11:25
2024-03-16,16:15,TTL,総合,12,中日スポーツ,大谷翔平の妻・田中真美子さんをバスケ日本代表の馬瓜エブリンがSNSで祝福　「やっと言えた系ですね」の声,https://news.yahoo.co.jp/articles/87e63023219f8e7fd606f4ab3b200c022ef10f17,3/15(金) 20:59
2024-03-16,16:15,TTL,総合,13,読売テレビ,「流出したら終わり」“過激ダンスショー”で何が？「違和感」「目のやり場に困った」参加者が語る状況,https://news.yahoo.co.jp/articles/8386ba1cbfb30fe99c0569d5b4ea22755d4909b0,3/16(土) 10:00
2024-03-16,16:15,TTL,総合,14,デイリースポーツ,大谷妻の大学名や経歴も「平凡でなかった」韓国メディアも実名詳報「９千億男　妻の素晴らしいスペック」「ネット民の推測当たった」,https://news.yahoo.co.jp/articles/540afd430f6268d08a95ac6e0cff466dfdc903a0,3/15(金) 19:58
2024-03-16,16:15,TTL,総合,15,J-CASTニュース,ラストラン直前「サンダーバード」で外国人の男が車掌に暴力　鉄道ファン怒り「迷惑極まりない」「車掌さんかわいそう」,https://news.yahoo.co.jp/articles/00753d28c0c3ab829e971b62ee09c84543e17aa1,3/15(金) 19:29
2024-03-16,16:15,TTL,総合,16,デイリースポーツ,「不適切にもほどがある」八嶋智人氏のリアル奥さん出てきた　高身長の美貌女優「えっ！本物の奥さん！？」「出てるｗ」「クセ強い」,https://news.yahoo.co.jp/articles/8493e940f2157ce89f63dfd313d05d54bb354aac,3/15(金) 23:46
2024-03-16,16:15,TTL,総合,17,ねとらぼ,大家に「好きにしていいよ」と言われて薄暗い部屋をDIY改装したら……　あまりの変貌に仰天「すっげえええ」,https://news.yahoo.co.jp/articles/4e2905e282f3b2f09cf09b1bdce72f73be8e041e,3/16(土) 12:15
2024-03-16,16:15,TTL,総合,18,デイリースポーツ,大谷翔平の通訳、水原一平氏の妻も一緒に顔出し　その覚悟に称賛の声「失うものもあるだろうに本当にすごい」「あえてしたのかな」,https://news.yahoo.co.jp/articles/35a7128596c684d6095fde37af80a1df1ed08fc3,3/16(土) 11:24
2024-03-16,16:15,TTL,総合,19,デイリースポーツ,「まさかの公式ｗ」大谷翔平の妻、田中真美子さんの好プレー動画が大反響　Ｗリーグ絶好のタイミングで投稿「もっと遠慮なくお願いします！」,https://news.yahoo.co.jp/articles/ef2cc72c260b7285900684f94a60ca22c6ba4565,3/16(土) 10:01
2024-03-16,16:15,TTL,総合,20,CoCoKARAnext,"広告業界からも熱視線 　大谷翔平「美しすぎる妻」の存在でにわかに注目集める""夫婦競演""プラン",https://news.yahoo.co.jp/articles/784c726d12e4c117f6029830168bf24100517696,3/16(土) 11:49
2024-03-16,16:15,TTL,総合,21,ねとらぼ,北斗晶、ネットの詐欺広告に引っかかる　届いた商品に「バカやろーーーー」「全然、違うじゃねーか」,https://news.yahoo.co.jp/articles/4cea1066d0f3943a16a85a97927cf83f364ca0f0,3/16(土) 14:13
2024-03-16,16:15,TTL,総合,22,日刊スポーツ,堀江貴文氏「俺は結果として１人だけ子供作ったけど…」古市憲寿氏の少子化巡る投稿に私見,https://news.yahoo.co.jp/articles/e725adbca04d8fdc9e8416a85a050af37a86a0de,3/16(土) 15:02
2024-03-16,16:15,TTL,総合,23,ねとらぼ,桐朋高等学校、78期卒業生の答辞に賛辞やまず　「只者ではない」「感動のあまり泣いて10回読み直した」,https://news.yahoo.co.jp/articles/17d30eecde6afe873826ffe06a5ed560c1b1d5db,3/13(水) 18:46
2024-03-16,16:15,TTL,総合,24,デイリースポーツ,大谷翔平、空港大フィーバーで新妻を気づかう　先頭歩くも振り返り　数歩後ろの真美子さんと視線合わせる　韓国到着,https://news.yahoo.co.jp/articles/b34584e2acd195b428c997375e409844c9a66f20,3/15(金) 15:04
2024-03-16,16:15,TTL,総合,25,デイリースポーツ,新妻の質問で表情変わった大谷にベッツ爆笑　肩を揉む　フリーマンいじる「俺も聞きたい、ショウ、話してくれ」,https://news.yahoo.co.jp/articles/3c2a853efdc10ac9b14b53f6d56f9a52c488dd9d,3/16(土) 15:22
2024-03-16,16:15,TTL,総合,26,デイリースポーツ,大谷妻２７歳１８０ｃｍ「お似合い」モモコ、母親世代の意見「こんな誰も文句言えへんの初めてちゃう？」に爆笑→福田「誰の結婚でもね」,https://news.yahoo.co.jp/articles/890a4fec21d3e33e45ccf0b4eee8dede09459ba9,3/16(土) 10:22
2024-03-16,16:15,TTL,総合,27,スポーツ報知,ＤＦ長友佑都が５０５４日ぶりＪ１ゴール！日本代表サプライズ復帰の３７歳がストライカー顔負け豪快弾,https://news.yahoo.co.jp/articles/8f9281424140d519fe7dfc5d4737048a84b02c93,3/16(土) 13:52
2024-03-16,16:15,TTL,総合,28,くるまのニュース,前走車の「エンジンブレーキ」は“ウザい”？ AT全盛で知らない人多い!? 逆に「エンブレ」使わない方が危険なワケ,https://news.yahoo.co.jp/articles/695450f84ae44a67b9a63c79ab8aed704440fc5b,3/16(土) 14:10
2024-03-16,16:15,TTL,総合,29,よろず～ニュース,人気イラストレーターが突然の活動休止宣言　双極性障害明かし「薬のサポートを受けながら活動を続けて参りました」,https://news.yahoo.co.jp/articles/f216ca5af83f85e5829b148d65ccba63fb214f69,3/16(土) 14:41
2024-03-16,16:15,TTL,総合,30,朝日新聞デジタル,「ブレイキングダウン格闘家」を傷害容疑で逮捕　神奈川県警,https://news.yahoo.co.jp/articles/621792ca7a134ad19e7b59be85431e4230f2f220,3/16(土) 10:28
2024-03-16,16:15,TTL,総合,31,デイリースポーツ,お笑いコンビの「ミーナ」が解散　「相方に不満を伝えた結果、許せないとの事で」と説明　昨年ナイツ塙がドッキリ炎上でも話題に,https://news.yahoo.co.jp/articles/c50180a36f21a27d3bc0bfb9f8b20a2043d1911f,3/16(土) 12:15
2024-03-16,16:15,TTL,総合,32,LIMO,【厚生年金】友人が「月額30万円以上もらってる」と言います。年収いくらあればそんなにもらえるんですか？,https://news.yahoo.co.jp/articles/35f3fc08d1632f55947152fa6c5e3d98703ae211,3/16(土) 5:17
2024-03-16,16:15,TTL,総合,33,スポーツ報知,大谷翔平、真美子さんとの初遠征「一緒に公式戦に来て見るのは初めてで、いい思い出になると思う」,https://news.yahoo.co.jp/articles/f4aab960983aacc602197225ed13f45fa5d7ea10,3/16(土) 15:06
2024-03-16,16:15,TTL,総合,34,ゴルフ総合サイト ALBA Net,＜中間速報＞首位に菊地絵理香、金澤志奈　1打差で鈴木愛、柏原明日架、竹田麗央が追走,https://news.yahoo.co.jp/articles/d96af25af0896a8f91d7544978542502f8200193,3/16(土) 13:31
2024-03-16,16:15,TTL,総合,35,Full-Count,水原一平通訳、韓国記者会見で大活躍　“ベッタニマン”への質問ラッシュに完璧対応,https://news.yahoo.co.jp/articles/f90fcd7005d05bf0e724591e6355e71952b2599e,3/16(土) 15:29
2024-03-16,16:15,TTL,総合,36,日テレNEWS NNN,山本由伸　ドジャースカラーの超高級バッグに視線　ファンは「バッグに目が行った」,https://news.yahoo.co.jp/articles/0aa4904fdec889f245c34eaba50803233d64f9e6,3/15(金) 17:32
2024-03-16,16:15,TTL,総合,37,日刊スポーツ,田中真美子さんの元所属先・富士通がコメント「心よりお祝い申し上げます」大谷翔平の妻と米報道,https://news.yahoo.co.jp/articles/8241ffd2ebe33b0d3302586d3557fe1415b01d1d,3/16(土) 11:43
2024-03-16,16:15,TTL,総合,38,スポーツ報知,清原和博氏のイケメン長男・清原正吾、モテそうなアイドル顔！慶応大３年…田中大貴アナ公開,https://news.yahoo.co.jp/articles/31dc3b12a729c3dfe24e17f883790787b8ff092f,3/16(土) 12:15
2024-03-16,16:15,TTL,総合,39,大手小町（読売新聞）,トングでトレーに取ったパンを元に戻すのはマナー違反？店側の見解も真っ二つ,https://news.yahoo.co.jp/articles/68cf434d96509cb5b5eea881854fc98ef313bf2d,3/16(土) 12:10
2024-03-16,16:15,TTL,総合,40,ハフポスト日本版,イオンシネマ、移動の手伝いで「従業員が不適切な発言」と謝罪。車椅子ユーザーの介助巡り議論に,https://news.yahoo.co.jp/articles/9bf313d183a96b4ce305d6ef5b391c5ae9e7ee42,3/16(土) 14:42
