scrp_date,scrp_time,genre_en,genre_jp,rank,media_jp,title,link,date_original
2023-12-08,17:22,life,ライフ,1,まいどなニュース,高速道路前のラーメン店に罰金看板「めちゃくちゃ煽ってるw」「ラーメン安く感じる」看板掲げた理由、店長に聞いた,https://news.yahoo.co.jp/articles/c52f98b21982b90090c666d2623e637a7d8fe2b4,12/7(木) 17:39
2023-12-08,17:22,life,ライフ,2,BuzzFeed Japan,ワークマン新作の「3900円アウター」がとっても軽くてオシャレ！まるで羽毛布団みたいな暖かさです,https://news.yahoo.co.jp/articles/0d185a55c8a1c9e55db1318ed1b2178614ac0a4d,12/7(木) 20:35
2023-12-08,17:22,life,ライフ,3,ファイナンシャルフィールド,新500円玉の存在意義が分かりません。自販機のジュースすら買えないのですが……。,https://news.yahoo.co.jp/articles/2ca7a907892b456e6351a466bceac1c110f27753,12/8(金) 11:32
2023-12-08,17:22,life,ライフ,4,ねとらぼ,もう2度と撮れない“魔法の杖で空に飛んでいくキツネ”　「すごい一瞬」「魔狐の宅急便」と感嘆の声,https://news.yahoo.co.jp/articles/7b6f3ef4f1130b402b8bf5f59a145519fac950e6,12/8(金) 14:00
2023-12-08,17:22,life,ライフ,5,日刊ゲンダイDIGITAL,岸田政権の少子化対策また的外れ…子ども3人世帯「大学無償化」に《不公平だ》と批判殺到,https://news.yahoo.co.jp/articles/4dd3f9ef373ba9b8a454fff98b8e0b237fb56f3a,12/8(金) 16:06
2023-12-08,17:22,life,ライフ,6,ハフポスト日本版,清掃員は「神ごみ」と呼んでいる…ゴミ袋の出し方とは？「目から鱗」「人の優しさを感じる」と話題,https://news.yahoo.co.jp/articles/371f5a3ccaa75f172e3ef7c225d3eb0d81066988,12/6(水) 9:32
2023-12-08,17:22,life,ライフ,7,ほ・とせなNEWS,長男「トイレ」亀「待って待って」猛スピードで長男を追いかけ…人間を好きすぎる亀に「こんなに感情を出すの？」の声,https://news.yahoo.co.jp/articles/0c6d44e2a5f201b0357dcd814a0f8106f600e6c9,12/8(金) 12:25
2023-12-08,17:22,life,ライフ,8,ねとらぼ,子猫を保護して2週間、最初は警戒していた先住犬たちも……　みんなで団子寝する仲睦まじい姿に「なんて幸せな光景」「愛にあふれてる」,https://news.yahoo.co.jp/articles/a3d5f13aa8bc1922290412b28c850c78078b1d8b,12/8(金) 16:30
2023-12-08,17:22,life,ライフ,9,LIMO,人に物を投げられていた野良猫が、毎日家に来て…とろける変貌ぶりに仰天と感涙「おめめが全然違う」の声,https://news.yahoo.co.jp/articles/9d1e181cef71438de9cbb260c41558d4c8bf5530,12/7(木) 19:11
2023-12-08,17:22,life,ライフ,10,LIMO,「連れてってくれニャ…」外出する飼い主と猫『説得』の光景に1.3万いいね「こんな事されたら躊躇する」,https://news.yahoo.co.jp/articles/8651920671405a072db1f16cc01e6b55ff1789f4,12/8(金) 11:52
2023-12-08,17:22,life,ライフ,11,ファイナンシャルフィールド,小銭をコツコツためて10万円達成！「無料で」両替する方法はありますか？,https://news.yahoo.co.jp/articles/322ee3461dccc7c8967e1c705fe7372b9713ec9f,12/7(木) 12:30
2023-12-08,17:22,life,ライフ,12,日刊ゲンダイDIGITAL,二階派退会の桜田元五輪相ってどんな人？ あっさりノルマ暴露でさらなる“失言”に期待高まる,https://news.yahoo.co.jp/articles/f6c2c0f7855c4b8600fdca24612745bfbf8eae1c,12/8(金) 9:06
2023-12-08,17:22,life,ライフ,13,まいどなニュース,ガンを乗り越えた82歳の母と暮らす24歳の猫「母は猫のために生きて、猫も母のために生きている」,https://news.yahoo.co.jp/articles/93c67f3372212f3cda65e682d15d7c8c867159fb,12/8(金) 15:30
2023-12-08,17:22,life,ライフ,14,まいどなニュース,カレーライス、ご飯はどっち向き？ ココイチ、ハウスが教える「きれいに見え、食べやすい位置」,https://news.yahoo.co.jp/articles/8441a29c93287ca4cbb6933bb357b0bcd1e568b1,12/8(金) 6:40
2023-12-08,17:22,life,ライフ,15,まいどなニュース,「リュックから怪物の舌!?」伸縮自在のベロと鋭い牙…その正体に爆笑「お腹痛いw」「ミミックやん」,https://news.yahoo.co.jp/articles/e738b0d652403cba6214bceb199e257f73319a12,12/8(金) 6:50
2023-12-08,17:22,life,ライフ,16,Hint-Pot,ハサミなしでビニール紐がカットできる　超簡単裏ワザを警視庁が伝授し驚きの声　「これ便利」,https://news.yahoo.co.jp/articles/5aa834793caa0a9d28dd01af3f3a5cb0a9095b8d,12/8(金) 9:26
2023-12-08,17:22,life,ライフ,17,おとなの週末,ユージとトオルに近藤課長まで!?『あぶない刑事』テイストの隠れた名作!!横浜を舞台にした『勝手にしやがれヘイ!ブラザー』を知っているか?,https://news.yahoo.co.jp/articles/13fc77ea4ff2db4e5cca10b39e2904c358b9fe0e,12/8(金) 15:00
2023-12-08,17:22,life,ライフ,18,マイナビ子育て,丸山桂里奈さん娘が「朝起きたら別人くらい顔が腫れて…」やたらと泣いてしまう様子も「まだ地上にきてから9ヶ月」,https://news.yahoo.co.jp/articles/6ff9085028c574beae0df4c5f52fd7317c2109f8,12/8(金) 12:11
2023-12-08,17:22,life,ライフ,19,Hint-Pot,子どもの送迎で“おなじみ”の光景、日本を訪れたアメリカ人は仰天　「地元では見たことがないよ」,https://news.yahoo.co.jp/articles/bc9ef77c97e5722459424e462e4f0f3070678462,12/7(木) 8:10
2023-12-08,17:22,life,ライフ,20,OCEANS,コスパ最強「インナーダウン」はどれだ!?ユニクロ、無印良品、タイオン、ワークマンを徹底比較！,https://news.yahoo.co.jp/articles/0990ddcba674c74e5dcb7b6bbfbffbfae34b9509,12/7(木) 19:04
2023-12-08,17:22,life,ライフ,21,ねとらぼ,【関東の高校生に聞いた】「学生の学力が高いと思う大学」ランキング！　第2位は「早稲田大学」、1位は？,https://news.yahoo.co.jp/articles/02bb3deb08d125fa2573838c419f3c3f74504c13,12/8(金) 12:15
2023-12-08,17:22,life,ライフ,22,magacol,【頭皮が老けると顔が老けます！】50代伝説の美女たちが実践するケア方法｜美ST,https://news.yahoo.co.jp/articles/78a98ac24d974ad19fdf250a0ba5b58fbb1f3120,12/8(金) 16:00
2023-12-08,17:22,life,ライフ,23,ねとらぼ,「GRAND SEIKO（グランドセイコー）の腕時計」おすすめ人気ランキング！　2位は控えめながら存在感がある「SBGX261」、1位は？【2023年12月版】,https://news.yahoo.co.jp/articles/16e7bf68f99e0f28906a4991547e1424721a80bf,12/8(金) 15:20
2023-12-08,17:22,life,ライフ,24,ファイナンシャルフィールド,タンス預金の200万円があります。ウチは田舎の民家ですし、調査が入ってバレるなんてことはないですよね……？,https://news.yahoo.co.jp/articles/96c14a924d9fc99bc3dc0d456fd24410e473b8f4,12/7(木) 12:13
2023-12-08,17:22,life,ライフ,25,BuzzFeed Japan,一目惚れして買ったかわいい猫型のお皿を家で使ってみたら…意図せずかわいそうな絵面になってしまいSNSざわつく,https://news.yahoo.co.jp/articles/6df74279bae2249530dca3fc3a60f297dd81dd0c,12/7(木) 19:00
2023-12-08,17:22,life,ライフ,26,まいどなニュース,肥満児が事故に遭って救急搬送！ 朝イチで救急医から着信「治療頑張ったのですが…」→まさかの展開に13万人爆笑,https://news.yahoo.co.jp/articles/1bc740a4fe74ff7635d882612fbfdeb527135fc4,12/8(金) 11:20
2023-12-08,17:22,life,ライフ,27,共同通信,宝塚音楽学校の角理事長辞任　1日付、歌劇団の俳優急死で,https://news.yahoo.co.jp/articles/fc63d06637f1be64ab74fddb287d6391aab7e71f,12/8(金) 9:41
2023-12-08,17:22,life,ライフ,28,BuzzFeed Japan,【GU】パッとコーデが華やぐ！グラデーションが美しい「ゆったりニット」存在感たっぷりでオシャレです,https://news.yahoo.co.jp/articles/63b57cfc213adaf058b4e95a300ef2ac98355bc1,12/8(金) 16:35
2023-12-08,17:22,life,ライフ,29,ねとらぼ,お風呂に入ったワンコ、笑いの神が降りてしまう　落花生が爆誕してしまった光景に「声出たわ」「さすが千葉の名産」,https://news.yahoo.co.jp/articles/90ebfe8ae5ccfdab36cb25081b1451e57f6c23ba,12/8(金) 8:00
2023-12-08,17:22,life,ライフ,30,オリコン,“柴距離”を知らないゴールデンレトリバーに360万再生「柴犬ってパーソナルスペース広いの？」「しょんぼりしてるレトリバー可愛すぎ」,https://news.yahoo.co.jp/articles/bead81a2cd32b5526a088cc8c63bb8f8ff669558,12/7(木) 8:00
2023-12-08,17:22,life,ライフ,31,マイナビニュース,トヨタ新型クラウン(スポーツ)の販売状況は? 購入者の年齢層が判明!,https://news.yahoo.co.jp/articles/d4ede9f3af206c5c7556ce62b747e032f8ad5fa8,12/8(金) 12:11
2023-12-08,17:22,life,ライフ,32,LIMO,家電量販店で販売されていたモバイルバッテリー　POPに記された「驚きの容量」に目を疑う,https://news.yahoo.co.jp/articles/1ac938973a43a9ecf706f1efb21eb5714243ee74,12/8(金) 6:26
2023-12-08,17:22,life,ライフ,33,婦人公論.jp,休憩中も乗客から向けられる「なぜ乗せてくれないんだ」という無言の視線…バス運転士の賃金は大きなプレッシャーと長い拘束時間に見合っているのか？,https://news.yahoo.co.jp/articles/dab9f60ef79f33545d03bd805a8b7c40bc7b81b6,12/8(金) 6:32
2023-12-08,17:22,life,ライフ,34,オリコン,歳の差兄妹、お兄ちゃんの帰省に歓喜する妹の姿に反響「かわいったらありゃしない」「羨ましすぎる」,https://news.yahoo.co.jp/articles/8b471f4c6cd20b790a9c39cba3d80277985e3438,12/8(金) 8:30
2023-12-08,17:22,life,ライフ,35,ENCOUNT,「犯人は何回も下見」　狙われた愛車、なぜ盗難を阻止できた？　威力を発揮した専門店の助言,https://news.yahoo.co.jp/articles/9291c3d692bed78cea98e60a6c31c1cb53c3283f,12/7(木) 9:30
2023-12-08,17:22,life,ライフ,36,LIMO,【セリア】シマエナガデザインのタオルがかわいすぎる！ふわふわ素材でサイズは2種類,https://news.yahoo.co.jp/articles/40feb5b53f988a6aa63e12452ce7d1a225228948,12/8(金) 4:47
2023-12-08,17:22,life,ライフ,37,Fav-Log by ITmedia,「付録付き雑誌・ムック」が最大半額　宝島チャンネルでセール開催中　紀ノ国屋の「大容量ショッピングバッグ」がお買い得【12月10日まで】,https://news.yahoo.co.jp/articles/33077acacf0a0d112c216b1bc770133ad07e01b7,12/8(金) 12:50
2023-12-08,17:22,life,ライフ,38,Medical DOC,健康診断は「毎年同じ時期・同じ病院で受ける方がいい」のウソ・ホント 受ける時の注意点も教えて,https://news.yahoo.co.jp/articles/62ff59bd36444aa5abfd556b4c37d5a3dc173376,12/8(金) 7:31
2023-12-08,17:22,life,ライフ,39,BuzzFeed Japan,【ファミマ】これがコンビニで買えるのすごい！財布代わりになる「スマホショルダー」高級感たっぷりでオシャレなんです,https://news.yahoo.co.jp/articles/5dc3f5feacf0eefd1eb176c31f3c7706685a3017,12/6(水) 19:05
2023-12-08,17:22,life,ライフ,40,BuzzFeed Japan,「しわしわピカチュウ」「隠し事をしてるときのフリーレン」絶妙な表情のホワイトタイガーの赤ちゃんに癒される人が続出,https://news.yahoo.co.jp/articles/fc5861d4c3ae45d7a70aa351785ffbdff848aff3,12/8(金) 17:00
