scrp_date,scrp_time,genre_en,genre_jp,rank,media_jp,title,link,date_original
2025-12-19,08:08,TTL,総合,1,西スポWEB OTTO！,東大医学部卒同士電撃婚から4カ月…突然の退社発表フジアナ〝番組卒業〟ショットに反響「お疲れ様でした」「いつも元気をもらっていました」,https://news.yahoo.co.jp/articles/3c8d962ab4306e4a09059832164c55348bbb64c4,12/18(木) 23:30
2025-12-19,08:08,TTL,総合,2,スポニチアネックス,小泉純一郎氏、進次郎氏が総裁選で敗れた件をどう思う？“たった一言”でコメント,https://news.yahoo.co.jp/articles/a43c46b5ec7562844642232615f1c69f6ac9fecc,12/18(木) 22:28
2025-12-19,08:08,TTL,総合,3,ねとらぼ,“兄さん”がくれたエビ20匹→大切に育てて2カ月後……　信じられない光景に「まさか!?」「初めて知った！」,https://news.yahoo.co.jp/articles/50db23e1d4d45419e4bb72b66b3e429b34b979f1,12/18(木) 22:05
2025-12-19,08:08,TTL,総合,4,スポニチアネックス,若槻千夏　ランチデートでの男性の行動にスタジオも悲鳴　交際したい思い消えた「結婚したら凄く大変」,https://news.yahoo.co.jp/articles/27ca0f6a9a519921460d9c84578454ab666c80ce,12/19(金) 4:50
2025-12-19,08:08,TTL,総合,5,西スポWEB OTTO！,「見えてない?」29歳・黒船天使〝透け透け〟Xmasショットにファン悶絶「セクシーでエレガント」「天使すぎる」「こっちまでニヤニヤしちゃうよ〜!」の声,https://news.yahoo.co.jp/articles/346885440f8935ff7937f8a654a995e8bae49c62,12/19(金) 0:00
2025-12-19,08:08,TTL,総合,6,デイリースポーツ,明石家さんま、関根勤も怒！大物芸人が放送事故級の大暴走　霜降り・粗品「あれ、おもろかったなぁ。伝説すね」後日談「でも、その後、器デカいのが」,https://news.yahoo.co.jp/articles/f769b383016144b77519ef7c8d3c511a44b3201e,12/18(木) 22:44
2025-12-19,08:08,TTL,総合,7,ファイナンシャルフィールド,定年退職後、「高速道路の料金所」で働く父。「月25万は稼げる」そうですが、時給はどれくらいなのでしょうか？,https://news.yahoo.co.jp/articles/289db1d59903553d475a0d03b23ca8766992d446,12/18(木) 5:10
2025-12-19,08:08,TTL,総合,8,東スポWEB,ポスティング村上宗隆〝市場沈黙〟　期限迫るＭＬＢ挑戦「日本Ｕターン」悪夢が現実味＝米報道,https://news.yahoo.co.jp/articles/6eec90d3d762f5bd4ab8748b06c4be1632041261,12/18(木) 21:50
2025-12-19,08:08,TTL,総合,9,デイリースポーツ,前DeNAオースティン、カブスと1年2億円で合意　7年ぶりメジャー復帰　元同僚今永と共闘　24年首位打者＆26年ぶり日本一貢献　公式サイト,https://news.yahoo.co.jp/articles/8321e3ad134c21aabff011bbe609854ec96086d1,12/19(金) 6:04
2025-12-19,08:08,TTL,総合,10,東スポWEB,山下泰裕氏が頸髄損傷後初の会見　現在の状態は「上半身、下半身は全く動かない」,https://news.yahoo.co.jp/articles/b94b41509eae75d32f17bbb1236dd338c3fd0fe7,12/18(木) 19:35
2025-12-19,08:08,TTL,総合,11,サッカーキング,フランクフルトが19歳DF小杉啓太の獲得を発表！　来年1月からブンデスリーガ挑戦！,https://news.yahoo.co.jp/articles/56e5f929032d447e0439413ea72417d54e9e8e0e,12/19(金) 6:39
2025-12-19,08:08,TTL,総合,12,Full-Count,西武、ヤンキース右腕と契約合意か　現地報道…3Aで12勝＆防御率1点台の技巧派,https://news.yahoo.co.jp/articles/964adac37002d865a909684600ebe9e5ee32781f,12/19(金) 2:48
2025-12-19,08:08,TTL,総合,13,スポニチアネックス,大久保佳代子　恋愛感情が一瞬で冷める男性の行動　好意を寄せていたけど「一気にバサッとなくなる」,https://news.yahoo.co.jp/articles/04aea0b993ac9b297e5a12ac86e573650622161c,12/19(金) 5:20
2025-12-19,08:08,TTL,総合,14,スマホライフPLUS,ブルーレイはオワコン？ ソニー生産終了が意味する「次世代メディア」の失敗,https://news.yahoo.co.jp/articles/cec43ab57fc0521061f240e1394a86504feab66b,12/18(木) 16:01
2025-12-19,08:08,TTL,総合,15,みんかぶマガジン,「もはや中国、四面楚歌」経済アナリスト指摘…焦る習近平、GDP下方修正待ったなし！日本への報復措置が与える「ブーメラン」,https://news.yahoo.co.jp/articles/4ae00a19e1f2b1023305d2cc41c40d4641938581,12/17(水) 9:10
2025-12-19,08:08,TTL,総合,16,サンケイスポーツ,村上宗隆は短期契約か…米報道「提示契約が金額で折り合わない可能性」　第2のシュワバー？　結果示して大型契約の道も,https://news.yahoo.co.jp/articles/5584edb4a143670ed340f04840fa90cb8c89d2d7,12/19(金) 6:55
2025-12-19,08:08,TTL,総合,17,スポーツ報知,ほしのあき　１３歳年下・三浦皇成騎手とスタイリッシュな夫婦ショット！娘の姿も公開…結婚から１４年,https://news.yahoo.co.jp/articles/64aca2964e1b2ef7722f63fc7e51d3081f4510d3,12/18(木) 12:05
2025-12-19,08:08,TTL,総合,18,日刊スポーツ,橋下徹氏「中国の代理人」とのツッコミに「違う違う」、真意は「口だけ番長が１番イヤ」,https://news.yahoo.co.jp/articles/d0796cfbc9cd7eb6744fa61c92f948cf2eb9df22,12/18(木) 20:17
2025-12-19,08:08,TTL,総合,19,スポニチアネックス,J1史上最速！来年2・6「金J」開幕　「百年構想リーグ」東地区は横浜M―町田戦　会場は日産スタ,https://news.yahoo.co.jp/articles/c94a88fe49379438f4d430ed9c1899fd52cd7227,12/19(金) 5:00
2025-12-19,08:08,TTL,総合,20,スポーツ報知,サウナ勤務５年のカンニング竹山、夫婦が死亡の個室サウナ火災に「何を言っても非常ボタンの電源を切っていた時点でダメでしょ」,https://news.yahoo.co.jp/articles/149d4b96a74055f762ad5f52b6952bdec03a64a7,12/18(木) 16:05
2025-12-19,08:08,TTL,総合,21,時事通信,年収の壁「178万円」　年収665万円以下対象　税制改正大綱、午後決定・与党,https://news.yahoo.co.jp/articles/8aef36b52a794dd1be5714531a91d356751c922a,12/19(金) 4:46
2025-12-19,08:08,TTL,総合,22,ねとらぼ,「汗ばむぐらい暖かい」ワークマンの“防寒アウター”がセール価格に　「色違いの3着目を買いました」「中はTシャツ1枚で十分」,https://news.yahoo.co.jp/articles/d2a89aff3962bd49bc35d29de5b7bb78debabd65,12/18(木) 21:15
2025-12-19,08:08,TTL,総合,23,デイリースポーツ,佐久間宣行氏、４０歳過ぎて一切行かなくなった２次会　「悪い事起きるのは全部２次会」,https://news.yahoo.co.jp/articles/38dce5a682b343ebee5f477d18280370d1406762,12/18(木) 13:45
2025-12-19,08:08,TTL,総合,24,産経新聞,「言うべき相手を考えて」小泉防衛相、防衛費増を批判する共産・山添氏に中国を名指し反論,https://news.yahoo.co.jp/articles/481121cd2120ffccd415f18d54bd9082d1c9baa4,12/17(水) 7:00
2025-12-19,08:08,TTL,総合,25,Hint-Pot,義実家への泊まりがけの帰省を「もう来ないで」と断られました。40代にもなって自分の下着まで義母に洗わせていたのは、やはり甘えすぎだったのでしょうか？,https://news.yahoo.co.jp/articles/de2a77e476ab8e66e690ea4164dbc21dd10a799e,12/19(金) 6:30
2025-12-19,08:08,TTL,総合,26,高校野球ドットコム,巨人の生え抜き最年長投手が現役引退を決断…今季二軍で41試合防御率1.91の好投もオファー届かず,https://news.yahoo.co.jp/articles/cb691410b04f6a2a1ceaafea08b44cd23a868f8c,12/19(金) 7:16
2025-12-19,08:08,TTL,総合,27,スポニチアネックス,ひろゆき氏、現在の貯金額をあっさり明かすも「え～っ！想像より少ない」の声,https://news.yahoo.co.jp/articles/7ca191e81a1ad7cd71f8f8343a1a57e51077f899,12/18(木) 20:24
2025-12-19,08:08,TTL,総合,28,KOREA WAVE,「太極旗Tシャツ」の韓国人男性、機内で公安に連行され号泣…ベトナム人女性への嫌がらせ疑惑,https://news.yahoo.co.jp/articles/8c2b32049ba0fffd45356384e725a8c1866b090b,12/19(金) 4:42
2025-12-19,08:08,TTL,総合,29,東スポWEB,【巨人】元ヘッドコーチの元木大介氏〝激やせ〟の真相明かす「病気だとか言われるのはいいけど…」,https://news.yahoo.co.jp/articles/90a2bebe49dff4b821610a69c396195a1b43a0c0,12/19(金) 5:15
2025-12-19,08:08,TTL,総合,30,オリコン,東京ヤクルト“中継ぎの柱”、まさかの戦力外にぼうぜん　家族の前で挑んだトライアウト→妻の涙の意味【プロ野球戦力外通告】,https://news.yahoo.co.jp/articles/03884eae1b032a72e043f582d4e437553ef22665,12/19(金) 6:50
2025-12-19,08:08,TTL,総合,31,デイリースポーツ,日本ハム、ナショナルズから異色の救援右腕を獲得　23年に内野手から投手転向　3Aで先発兼任　海外記者伝える「総額4・6億円超」,https://news.yahoo.co.jp/articles/905bab1cda0c645134765a1fc6f944afa315c211,12/19(金) 3:10
2025-12-19,08:08,TTL,総合,32,クランクイン！,171cm“人気ABEMAアナウンサー”、オフショルダー姿が「スタイル抜群」「最強」「美しすぎる」と絶賛の声,https://news.yahoo.co.jp/articles/0eab8b90865c709b9b83eec615d3c42f2d61dd7e,12/19(金) 6:00
2025-12-19,08:08,TTL,総合,33,共同通信,年収の中間層、3万円前後の減税　基礎控除増額で幅広く恩恵,https://news.yahoo.co.jp/articles/802b78cc79ea733698442d7ea18362ece860547d,12/18(木) 19:48
2025-12-19,08:08,TTL,総合,34,FNNプライムオンライン,ドアたたいて“助け”求めたか　死亡の30代夫婦の手に「皮下出血」…専門家「ドアノブ外れると大人でも開けられない」赤坂サウナ火災,https://news.yahoo.co.jp/articles/03e3b52708494fc4108319fb6e58befab8a60318,12/18(木) 18:36
2025-12-19,08:08,TTL,総合,35,スポーツ報知,「報ステ」大越健介氏、フィンランドの国会議員たちの「つり目ポーズ」騒動に「やっぱり、たちが悪いと言わざるを得ない」,https://news.yahoo.co.jp/articles/4da0b5eeec8a8944c3fca13b7dc83323861cb52d,12/19(金) 5:28
2025-12-19,08:08,TTL,総合,36,トラベル Watch,新幹線も5日間乗り放題「大人の休日倶楽部パス」本日発売。1月利用分、東京～新青森往復だけでも1万円以上お得に,https://news.yahoo.co.jp/articles/7781b82d3fc26ff75069c8d6f9110402d7969538,12/19(金) 6:00
2025-12-19,08:08,TTL,総合,37,南日本新聞,完済は100年後…。公金着服した元役場職員…返済は1240回分割払い――町長「提訴しても回収困難」。和解案を議会は否決　知名町,https://news.yahoo.co.jp/articles/3248793e5162619d478ff5e00165452ba2b87145,12/19(金) 5:47
2025-12-19,08:08,TTL,総合,38,日刊スポーツ,吉本人気男性芸人「癌じゃないか再検査」肝臓CT検査で病気発覚「女性がかかる病気のようです」,https://news.yahoo.co.jp/articles/81124f11eb3e826294983c9a24b2752782f1a6ac,12/19(金) 7:30
2025-12-19,08:08,TTL,総合,39,トラベル Watch,ワークマン、リカバリーウェアを全店舗で在庫復活。超低価格上下2580円の“春夏用”も12月19日発売,https://news.yahoo.co.jp/articles/20a25a9f7ec16f88f341e89153749184f2876cf8,12/18(木) 15:30
2025-12-19,08:08,TTL,総合,40,スポーツ報知,神田聖子　最新姿の美ぼう衝撃！中央大学に入学して１年…「ときめく出会いがあり」「毎日歌える事に感謝」,https://news.yahoo.co.jp/articles/ed736a7dca03fae223b0a3a184d460987fc8e6fd,12/19(金) 6:32
