scrp_date,scrp_time,genre_en,genre_jp,rank,media_jp,title,link,date_original
2024-02-12,02:14,sports,スポーツ,1,スポニチアネックス,ドジャース・由伸　衝撃のブルペン投球に指揮官が投手史上最高額契約に至った理由語る「自信を持っている」,https://news.yahoo.co.jp/articles/29bbb0141610fddf692adb75ddcee183b89cd809,2/11(日) 16:13
2024-02-12,02:14,sports,スポーツ,2,スポーツ報知,日本女子、パリ五輪出場決定　格上カナダ撃破で３大会連続６度目　金星一転“崖っぷち”から道切り開く　世界最終予選,https://news.yahoo.co.jp/articles/75635fa2791681292a1dc74414136278658276b0,2/12(月) 0:53
2024-02-12,02:14,sports,スポーツ,3,ゴルフダイジェスト・オンライン（GDO）,星野陸也が日本勢4人目の欧州ツアーV　参戦2年目で初タイトル,https://news.yahoo.co.jp/articles/f274c7812931991052c33cc3ae727da4dc981bc6,2/11(日) 22:16
2024-02-12,02:14,sports,スポーツ,4,西スポWEB OTTO！,「心臓に悪い……」女子バスケ日本がシーソーゲーム制し世界ランク5位撃破！　3大会連続五輪出場権にファン歓喜「こりゃ興奮して眠れね​​​​​​​～」,https://news.yahoo.co.jp/articles/8eb8cb1202b725efc6920c83c7660957511b3219,2/12(月) 0:54
2024-02-12,02:14,sports,スポーツ,5,バスケットボールキング,女子日本代表がパリ五輪切符獲得！　運命の最終戦で格上カナダに勝利、2勝1敗で“死の組”突破,https://news.yahoo.co.jp/articles/2f14f094f34b8faba8594abf643ef7c82486860a,2/12(月) 0:53
2024-02-12,02:14,sports,スポーツ,6,共同通信,バスケ女子、パリ五輪出場権獲得　日本が強豪カナダ破る,https://news.yahoo.co.jp/articles/d5c1cabf96e6d4359ae90889ac87ee54a92f1a08,2/12(月) 1:13
2024-02-12,02:14,sports,スポーツ,7,デイリースポーツ,五輪出場決定のバスケ女子　馬瓜エブリンは絶叫「パリ行くぞ！みんなで！」「ステファニーと代表やりたい」姉妹愛で切符つかみ取る,https://news.yahoo.co.jp/articles/5ce117b6bac63c609ad7236ac374e76fe3f6b710,2/12(月) 1:12
2024-02-12,02:14,sports,スポーツ,8,Full-Count,大谷翔平、ポルシェのスポーツカーで球団施設入り　華麗に自ら運転…報道陣騒然,https://news.yahoo.co.jp/articles/3909019b9cb743b8ad660f6a1ac74859f5b83794,2/12(月) 1:08
2024-02-12,02:14,sports,スポーツ,9,中日スポーツ,電撃引退した元関脇・逸ノ城が断髪式、母校の校長から止めばさみを入れられて涙腺が崩壊,https://news.yahoo.co.jp/articles/732c8ea6d3a3e19a35e14f0cf71083c64c376996,2/11(日) 20:43
2024-02-12,02:14,sports,スポーツ,10,スポニチアネックス,五十嵐亮太氏「次に野手でメジャーリーグに行くのは彼かな」と挙げた一人の名前　「能力は高い」,https://news.yahoo.co.jp/articles/9bbdc1dd3f59b340831c45264eeafedc4cdafc12,2/11(日) 16:59
2024-02-12,02:14,sports,スポーツ,11,TBS NEWS DIG Powered by JNN,女子バスケ日本代表 パリ五輪出場権獲得！世界5位のカナダに劇的勝利で3大会連続6度目となる大舞台へ【世界最終予選】,https://news.yahoo.co.jp/articles/cae4fca776b5c5e335288e6a077f024cd0045f1c,2/12(月) 0:53
2024-02-12,02:14,sports,スポーツ,12,スポニチアネックス,Sランス伊東純也　中村と揃ってスタメン起用にネット反響「これが普通」「日本とは考え方が違う」,https://news.yahoo.co.jp/articles/967e723fbd0a91cac619ded4d2f25dcdb28a3b7d,2/11(日) 22:56
2024-02-12,02:14,sports,スポーツ,13,日刊スポーツ,【バスケ】日本女子パリ五輪！窮地から３大会連続！エブリン「正直どうしよう…」からカナダ破る,https://news.yahoo.co.jp/articles/e59d946d5838bc049392b0aa2a1cfe1b16fd5f0c,2/12(月) 0:53
2024-02-12,02:14,sports,スポーツ,14,GOAL,レアル・マドリー、エンバペとの契約交渉が難航か…クラブのオファー内容と母親の要求がかけ離れているとスペイン紙報道,https://news.yahoo.co.jp/articles/18040455d62771aa70f0a7e9f078f26cc54ab2f3,2/12(月) 0:45
2024-02-12,02:14,sports,スポーツ,15,超WORLDサッカー！,アーセナルが今季2敗喫したハマーズに6ゴールの圧勝！　ライスが圧巻ミドル弾に2Aの痛烈恩返し【プレミアリーグ】,https://news.yahoo.co.jp/articles/090b4574c2c9d57d318e2f12c10b1b9c69f77725,2/12(月) 1:01
2024-02-12,02:14,sports,スポーツ,16,FNNプライムオンライン（フジテレビ系）,【速報】やった！！バスケ女子日本 パリ五輪出場決定　大激戦の末強豪カナダを撃破！ 3大会連続五輪へ,https://news.yahoo.co.jp/articles/fa5801ec4dd239581f8b4cca2359741c55835dc4,2/12(月) 0:53
2024-02-12,02:14,sports,スポーツ,17,スポニチアネックス,女子バスケ日本代表発表も…渡嘉敷来夢、町田瑠唯ら落選にファンはショック「インサイドで蹂躙される」,https://news.yahoo.co.jp/articles/fc015d21d12abb9231211cd61e002eff888967d4,2/7(水) 14:47
2024-02-12,02:14,sports,スポーツ,18,東スポWEB,バスケ女子が３大会連続の五輪出場　馬瓜エブリン復活の２１点「使命果たせた」,https://news.yahoo.co.jp/articles/0298633af34be5e61050c07e47b1826f69e522e7,2/12(月) 1:46
2024-02-12,02:14,sports,スポーツ,19,ゲキサカ,GK大国ドイツの若き守護神・長田澪が日本代表入りも視野に「日本からの関心は嬉しい」「時間をかけて考える」,https://news.yahoo.co.jp/articles/97cf7849db5febeb7dfb4a73e1f51eef6f65bde5,2/11(日) 19:08
2024-02-12,02:14,sports,スポーツ,20,ABEMA TIMES,全ては水しぶきを立てないために 飛込で金メダル独占・中国選手の極限まで細めた体 肩幅すら縮める神技,https://news.yahoo.co.jp/articles/654235b08e83ae1b10e9277485d0cff236bc1f75,2/11(日) 14:00
2024-02-12,02:14,sports,スポーツ,21,BASKET COUNT,ファウルトラブルを乗り越えたバスケ女子日本代表、高確率な2点プレーでカナダを4点差で下しパリ五輪出場権を獲得！,https://news.yahoo.co.jp/articles/a6376770a5ec2e9307a83d6c597b9e35a283b85f,2/12(月) 0:59
2024-02-12,02:14,sports,スポーツ,22,デイリースポーツ,バスケ女子　１６０センチ台の山本＆宮崎が大活躍　宮崎は涙「ホッと。昨日は全然寝れなかった」,https://news.yahoo.co.jp/articles/fc060a274e2bb5d9556aa7af807a57358aadaad6,2/12(月) 1:24
2024-02-12,02:14,sports,スポーツ,23,Full-Count,巨人にトレード移籍で驚いた“鷹との違い”「マジですごい」　プロ6年目で戸惑った伝統,https://news.yahoo.co.jp/articles/423f22909c584f0179ef5de84cc5271267c62259,2/11(日) 7:20
2024-02-12,02:14,sports,スポーツ,24,日刊スポーツ,【バスケ】前半終え日本がカナダに50―46とリード　宮崎早織、馬瓜エブリンら奮闘,https://news.yahoo.co.jp/articles/a889493862805878b16fcf863a2f505f07300d8d,2/11(日) 23:52
2024-02-12,02:14,sports,スポーツ,25,デイリースポーツ,日本ハム・新庄監督　江越の特大弾にびっくり「パワーはゴリラくらいあるんで」「変わってくれたら」,https://news.yahoo.co.jp/articles/615be44c4164da19c990a931ba93d5decc14883d,2/11(日) 16:51
2024-02-12,02:14,sports,スポーツ,26,日刊スポーツ,【バスケ】日本女子がパリ五輪切符、強敵カナダ撃破　映像分析200時間超、緻密な準備実る,https://news.yahoo.co.jp/articles/92914d1b063dc2dc8b8c44fcbcba185dd346eca8,2/12(月) 1:02
2024-02-12,02:14,sports,スポーツ,27,スポーツ報知,アジア杯で日本代表から離脱のＳランスＦＷ伊東純也が復帰戦でフル出場　前半にミス散見も後半は復調,https://news.yahoo.co.jp/articles/78f510c897be6a25f00d876850a4ae21449babcf,2/12(月) 1:05
2024-02-12,02:14,sports,スポーツ,28,デイリースポーツ,宮城野親方の紗代子夫人が愛娘の背中を後押し　三女・真結羽さんが女子相撲大会に出場　長女の愛美羽さんの姿も,https://news.yahoo.co.jp/articles/d2691b4e469bc95b09939c7f3d1b4f7de87715c7,2/11(日) 14:20
2024-02-12,02:14,sports,スポーツ,29,バスケットボールキング,男女そろってパリ五輪へ…ホーバスHC「おめでとうございます！ 」、馬場雄大「流石です！」,https://news.yahoo.co.jp/articles/606e8e4384b6511c228e2607cbbc3679889dba91,2/12(月) 1:15
2024-02-12,02:14,sports,スポーツ,30,日テレNEWS NNN,【西武】松坂臨時投手コーチ　同じ“ドラ1”武内夏暉の改善点は「ないです」と食い気味に　「大きな弓のよう」と絶賛,https://news.yahoo.co.jp/articles/f5c8fc490ff5ab6a8841eff467530816a12a362e,2/11(日) 16:49
2024-02-12,02:14,sports,スポーツ,31,GOAL,アーセナル、ウェストハムから大量6ゴールで4連勝達成！サカが二桁得点到達、ライスは強烈恩返し弾,https://news.yahoo.co.jp/articles/d8e99829e7caa50091b8263723f79f8d44089c49,2/12(月) 0:56
2024-02-12,02:14,sports,スポーツ,32,西スポWEB OTTO！,「強かった時代の話ばかり…」巨人の杉内俊哉コーチが〝黄金期〟メンバーと食事会4ショット「まだまだ長さんと勇人には頑張ってもらいましょう」,https://news.yahoo.co.jp/articles/0b66f2f3aa5b41cd5e386627de9931fddfba811f,2/11(日) 22:00
2024-02-12,02:14,sports,スポーツ,33,スポニチアネックス,女子バスケをパリ五輪に導いた恩塚監督の異色の経歴「ワクワクは最強」,https://news.yahoo.co.jp/articles/030b0ceef5704f79cac49aef1f74b56379e94d87,2/12(月) 0:55
2024-02-12,02:14,sports,スポーツ,34,日刊スポーツ,【新日本】オスプレイAEW移籍前最後の試合で血だらけ敗戦も「男の約束。必ず戻ってくる」,https://news.yahoo.co.jp/articles/8be4a5f41b700d3f22fdebee9690f26af83503ec,2/12(月) 1:13
2024-02-12,02:14,sports,スポーツ,35,日刊スポーツ,【バスケ】１次リーグ最終戦は「同日同時刻開始」が当たり前？不公平と指摘も実は…,https://news.yahoo.co.jp/articles/c69e003d18d0b79b8ab8688a35bc001ab0ef5f2f,2/11(日) 17:39
2024-02-12,02:14,sports,スポーツ,36,時事通信,日本、3大会連続五輪へ　カナダ破り突破―バスケ女子,https://news.yahoo.co.jp/articles/fd1d05cb898dd132ba2ff45194416c10b06c1823,2/12(月) 0:59
2024-02-12,02:14,sports,スポーツ,37,GOAL,ブライトン、今夏の三笘薫売却へ「扉開く」。今冬獲得の19歳FWが後釜に？,https://news.yahoo.co.jp/articles/7f3804259ac8463330818f7180bb9fb8f6ee55bc,2/11(日) 23:00
2024-02-12,02:14,sports,スポーツ,38,スポニチアネックス,バスケ女子　3大会連続の五輪切符も高さの不安を露呈,https://news.yahoo.co.jp/articles/388746df04d5ba798ac2a02bea4bcf1d1fa30c6b,2/12(月) 1:41
2024-02-12,02:14,sports,スポーツ,39,スポーツ報知,元白鵬の宮城野親方の三女・眞結羽さんが女子相撲大会で準Ｖ「パパの夢がかなってうれしい」　父は「泣いてしまった」,https://news.yahoo.co.jp/articles/53de05ec4f9bb99f557d1fc1d0e28afdfe292465,2/11(日) 20:13
2024-02-12,02:14,sports,スポーツ,40,スポニチアネックス,馬瓜エブリン絶叫！「みんなでパリいくぞー！！」　女子バスケ代表復帰で五輪切符掴んだ！,https://news.yahoo.co.jp/articles/b61c2a321f0b265ead608c3c064289937df84258,2/12(月) 0:56
