scrp_date,scrp_time,genre_en,genre_jp,rank,media_jp,title,link,date_original
2025-09-12,07:06,domestic,国内,1,デイリースポーツ,【ポスト石破】田崎史郎氏　麻生太郎氏が支持する総裁候補→意外な動き予想　前回は高市氏推すも　結束力最強の旧岸田派は？,https://news.yahoo.co.jp/articles/98908b37478df069075bb4d66a12963bb16c7340,9/11(木) 23:07
2025-09-12,07:06,domestic,国内,2,デイリースポーツ,【ポスト石破】麻生太郎氏が、まさか人物支持を示唆→意外な名前に「ええーっ！？」　元日テレ青山氏の取材結果に騒然　依然麻生派率いて影響大　前回は高市氏支持も,https://news.yahoo.co.jp/articles/7039d5aa1899c7c1092bbaadb7658751ef7dd739,9/10(水) 19:58
2025-09-12,07:06,domestic,国内,3,日刊スポーツ,東国原英夫氏、自民党総裁選に小泉進次郎氏「出ない方がよい」と語るワケ「シンプルに…」,https://news.yahoo.co.jp/articles/f9dc71cfa99f1f345d46243e859387e93300d89a,9/11(木) 6:21
2025-09-12,07:06,domestic,国内,4,読売新聞オンライン,小泉進次郎氏、総裁選出馬の意向固める…高市早苗氏は岸田前首相に「出馬する方向で考えている」,https://news.yahoo.co.jp/articles/ba01727b29cb505d291913f099e821d84f93cfe7,9/12(金) 5:00
2025-09-12,07:06,domestic,国内,5,デイリースポーツ,【ポスト石破】田崎史郎氏　有力５人で「話すと頭抜けて頭良いなと思う」人物　「全然違う」仕事は凄い早いし何でもやっちゃう　能力高いと,https://news.yahoo.co.jp/articles/a1a23160f437e6cbcbe0f4d3469b0f25af0d5b53,9/10(水) 23:24
2025-09-12,07:06,domestic,国内,6,読売新聞オンライン,新入社員の女性に「野良犬」と叱責…化粧品会社のパワハラで死亡、１億５０００万円支払いへ,https://news.yahoo.co.jp/articles/44cce08d2b05b46ad365eaaabef6aded67ea18d5,9/11(木) 18:19
2025-09-12,07:06,domestic,国内,7,日刊スポーツ,小室眞子さんに母・紀子さまがメッセージ「よいタイミングで日本を訪れて」米国での孫誕生を喜ぶ,https://news.yahoo.co.jp/articles/221706cb924be754d10a29766e80dcf2d0e7992d,9/12(金) 6:30
2025-09-12,07:06,domestic,国内,8,日刊スポーツ,佳子さまの「結婚」に言及　秋篠宮妃紀子さま「彼女らしい生き方、幸せを」59歳迎え心境,https://news.yahoo.co.jp/articles/4f3313c9abba34c8ab91b69287b46d48bcf5d8e5,9/11(木) 19:21
2025-09-12,07:06,domestic,国内,9,毎日新聞,「機内で食べようと」　輸入禁止の果物持ち込み容疑で30歳逮捕,https://news.yahoo.co.jp/articles/065ed2a42b6807f8cc3ee706d4019465ec0b320b,9/11(木) 20:43
2025-09-12,07:06,domestic,国内,10,朝日新聞,小学校教諭の指導は「教育的な範囲を逸脱」　東京都小平市に賠償命令,https://news.yahoo.co.jp/articles/97c713e92e3e1accdbb7913778e47c001ed488df,9/11(木) 21:00
2025-09-12,07:06,domestic,国内,11,日刊スポーツ,「女性リーダーってボコボコにされる」伊東市長に女性タレント私見　杉村太蔵氏「男女関係ない」,https://news.yahoo.co.jp/articles/3d3f9efcbba84099f7b9717c456e0852a3a413fc,9/11(木) 14:16
2025-09-12,07:06,domestic,国内,12,J-CASTニュース,ベビーカー転落事故、3つの疑問点を専門家が指摘　「そもそも機械式駐車場の使い方が間違っている」,https://news.yahoo.co.jp/articles/5084536ffe6a593297f649a83e2728f486205d60,9/11(木) 18:27
2025-09-12,07:06,domestic,国内,13,産経新聞,＜独自＞自民・小泉進次郎農水相が総裁選出馬へ、来週表明　推薦人20人確保にめど,https://news.yahoo.co.jp/articles/db79e591d2253f53f885c32a5c95fee41882062f,9/12(金) 0:13
2025-09-12,07:06,domestic,国内,14,デイリースポーツ,【ポスト石破】Ｘ大荒れ「高市首相なら連立解消するのか」「高市潰し」　公明代表「連立組めない」で騒然→「一般論」釈明もコメ殺到「高市さんの何がまずい」「いい発言」「口挟んでるだろｗ」,https://news.yahoo.co.jp/articles/ac9e5d8e1eb98f22b6844e84832ea7b565526023,9/11(木) 18:35
2025-09-12,07:06,domestic,国内,15,ABEMA TIMES,毎日通った記者「田久保市長による印象操作に聞こえた」「職員の人たちから聞いていることと全然違う」“矛盾”を追及 伊東市長「遺憾」「心外」,https://news.yahoo.co.jp/articles/3e91b72500fd2053c1b55d3cce8d3e42d4397ba8,9/10(水) 13:27
2025-09-12,07:06,domestic,国内,16,J-CASTニュース,市長の学歴詐称疑惑に揺れる伊東市、2か月余りで問い合わせ9500件　日中は業務に支障...夜間の電話に「警備員は対応に苦慮」,https://news.yahoo.co.jp/articles/c3718240fc0d370c2f2315b032964fed604c536f,9/11(木) 16:50
2025-09-12,07:06,domestic,国内,17,日刊スポーツ,【全文】公明党がテレ朝「ワイド！スクランブル」のコメンテーター発言に抗議声明、金銭授受否定,https://news.yahoo.co.jp/articles/bd7cc3fe568edea22c05c34fd9d301b3516ab23d,9/11(木) 20:24
2025-09-12,07:06,domestic,国内,18,デイリースポーツ,【ポスト石破】「高市潰しか」小林鷹之氏出馬→また高市氏と保守分裂　ネット諸説「なぜ潰し合い」「今回は高市支援に回ってよ」「決選で協力」　田崎史郎氏は「２人の関係は微妙」と,https://news.yahoo.co.jp/articles/a13ec930cd6977f72e9d20767097b607f656a424,9/11(木) 19:53
2025-09-12,07:06,domestic,国内,19,FNNプライムオンライン（フジテレビ系）,日本医師会などが厚労相に要望賃金・物価上昇で医療機関の経営悪化「早期の対応が必要」,https://news.yahoo.co.jp/articles/5e9c51b925a5484359535661a5fc4c7d1a238bab,9/12(金) 0:33
2025-09-12,07:06,domestic,国内,20,共同通信,東海道新幹線の見合わせ、10万人に影響,https://news.yahoo.co.jp/articles/ef3c447fc647c774ca05ceaaff1f43795441813f,9/11(木) 22:11
2025-09-12,07:06,domestic,国内,21,TBS NEWS DIG Powered by JNN,＜解除＞【土砂災害警戒情報】広島県・広島市東区、広島市南区、広島市安佐南区、広島市安佐北区、広島市安芸区など 12日06:30時点,https://news.yahoo.co.jp/articles/8ef34e7882daa55196ea3ea8f8da1e29929b8792,9/12(金) 6:33
2025-09-12,07:06,domestic,国内,22,日刊スポーツ,次期自民党総裁の最有力候補、高市早苗氏の勝機は？　「よっぽど」青山和弘氏が分析,https://news.yahoo.co.jp/articles/a2f4a48750f0396149e74434895bbea8f464042a,9/9(火) 15:22
2025-09-12,07:06,domestic,国内,23,朝日新聞,ソフトボール部主将の自殺　「不適切指導が一因の可能性」と第三者委,https://news.yahoo.co.jp/articles/651a0d2fb6e11c697c3bab1e560069ec516570e6,9/12(金) 6:00
2025-09-12,07:06,domestic,国内,24,デイリースポーツ,遙洋子、伊東市長問題で「女性のリーダーはボコボコにされる」発言　杉村太蔵氏は「女性男性関係ない」,https://news.yahoo.co.jp/articles/a0bd9163811e7b24b1f58959906436fd6f967956,9/11(木) 11:04
2025-09-12,07:06,domestic,国内,25,ウェザーマップ,きょう(金)の天気　不安定列島　きのうのような激しい雨や雷雨のおそれ　土砂災害などに厳重警戒,https://news.yahoo.co.jp/articles/32fca704fe6f171a9dffcd7891330168790a066d,9/12(金) 5:25
2025-09-12,07:06,domestic,国内,26,毎日新聞,「経験のないゲリラ豪雨」　東京・品川の立会川、欄干から水あふれる,https://news.yahoo.co.jp/articles/f7bc0d5c81143dc056cdacbef55425e5dd288b91,9/11(木) 20:06
2025-09-12,07:06,domestic,国内,27,スポニチアネックス,田崎史郎氏　立民新体制をチクリ「総裁と幹事長が旧民主党の中心にいた方で…」　刷新感感じられず？,https://news.yahoo.co.jp/articles/70fcd0fbc2127824cbaa0ede411f043e275b3735,9/11(木) 22:39
2025-09-12,07:06,domestic,国内,28,弁護士ドットコムニュース,「私も死んで父に謝りたい」特殊詐欺の被害にあい自死した父　残された家族の深い後悔,https://news.yahoo.co.jp/articles/4b109ddac133eb955be8a7034b14b82ba4fdd5f9,9/11(木) 17:09
2025-09-12,07:06,domestic,国内,29,共同通信,北海道の村、メガソーラー防止で土地購入へ,https://news.yahoo.co.jp/articles/84d6c14814119fc2aba679bff01d868dd35263f1,9/11(木) 19:26
2025-09-12,07:06,domestic,国内,30,FNNプライムオンライン,【衝撃】レンタカーを勝手に外国人に売却　他にも借りた車を売却か?自宅前に「わ」ナンバー高級外車…店員語る手口「信じられない」　神奈川,https://news.yahoo.co.jp/articles/a6980d1a4fa371078b194298438cb5dd071f5e13,9/10(水) 13:48
2025-09-12,07:06,domestic,国内,31,TBS NEWS DIG Powered by JNN,【土砂災害警戒情報】広島県・東広島市に発表 12日05:10時点,https://news.yahoo.co.jp/articles/d7191292b44481c0e9180dd71e60e4650ae84342,9/12(金) 5:12
2025-09-12,07:06,domestic,国内,32,産経新聞,「医師が大声でキレた」グーグルに嘘の口コミで名誉毀損　投稿者に３００万円超の賠償命令,https://news.yahoo.co.jp/articles/ee9ba7dd070c3ccf3c1d5cb2b04290d3386370f8,9/11(木) 19:10
2025-09-12,07:06,domestic,国内,33,ウェザーマップ,大気非常に不安定　東・西日本で大雨のおそれ　特に中国地方は土砂災害などに厳重警戒,https://news.yahoo.co.jp/articles/c28fb872b52ee9638a6bc49306a24b152d47ddc6,9/12(金) 5:46
2025-09-12,07:06,domestic,国内,34,関西テレビ,【独自検証】立体駐車場で赤ちゃん重傷「入庫時は運転手だけ」守られず「人感知センサー少ない」“盲点”も,https://news.yahoo.co.jp/articles/1cbdff4f83206768e9e0e6f4146722f9835c58a7,9/12(金) 5:00
2025-09-12,07:06,domestic,国内,35,日刊スポーツ,「SNS重視の政治」疑問視、立民・安住淳幹事長が力説「間違ってる」「私はおかしいと思う」,https://news.yahoo.co.jp/articles/123a82068c1af01157340e4b03f79233711f60c9,9/12(金) 5:10
2025-09-12,07:06,domestic,国内,36,FNNプライムオンライン（フジテレビ系）,紀子さま59歳の誕生日で愛子さまがお祝いに　“親子ドライブ”紹介し初孫は「よいタイミングで日本を訪れてくれたら」,https://news.yahoo.co.jp/articles/30b09adf36d08999d814ef5af6e2a0cc8836693a,9/11(木) 12:01
2025-09-12,07:06,domestic,国内,37,テレビ朝日系（ANN）,「野良犬」と叱責…社長“パワハラ”で女性社員死亡　遺族に1.5億円の支払いへ,https://news.yahoo.co.jp/articles/d645ad914da88448db708baab6743104ca03c3c7,9/12(金) 3:01
2025-09-12,07:06,domestic,国内,38,日テレNEWS NNN,【1か月予報】高温傾向が続き厳しい残暑も,https://news.yahoo.co.jp/articles/1ea35495062eaf5f95569dbcaf40c55a8c342a02,9/12(金) 6:17
2025-09-12,07:06,domestic,国内,39,中国新聞デジタル,夫のギャンブルで水道料金の支払いが滞納、困窮し子ども4人は児童相談所へ…　8歳娘の首を絞め、殺人未遂罪となった40歳母親　裁判員裁判で生活実態が明らかに,https://news.yahoo.co.jp/articles/826bb23638acea135ab1d9737879810a51df8b64,9/11(木) 8:03
2025-09-12,07:06,domestic,国内,40,毎日新聞,高齢者の交通費助成、1万円→7000円に　奈良・生駒　28年度から,https://news.yahoo.co.jp/articles/5abffd3dbe855245db138a38febc92563432f4aa,9/12(金) 5:20
