scrp_date,scrp_time,genre_en,genre_jp,rank,media_jp,title,link,date_original
2024-09-01,10:33,TTL,総合,1,Full-Count,大谷翔平から衝撃3連発　44号→ベッツ、フリーマン…豪快弾が飛び交う“異空間”に敵地騒然,https://news.yahoo.co.jp/articles/1edf41f8215a2f394d73b55b990773c86feb58ef,9/1(日) 9:12
2024-09-01,10:33,TTL,総合,2,東スポWEB,やす子マラソン　淡々と続く周回映像にＳＮＳザワつく「日テレやばすぎ」,https://news.yahoo.co.jp/articles/df1c6334f012f1535159e161587ea8558ca5fb5c,8/31(土) 21:16
2024-09-01,10:33,TTL,総合,3,日刊ゲンダイDIGITAL,もはや「苦行」、「回数ごまかせる」の指摘も…24時間テレビ「やす子マラソン」強行に視聴者ドン引き,https://news.yahoo.co.jp/articles/57268079ae99473da0483c6295f865b5a760f1e7,9/1(日) 6:30
2024-09-01,10:33,TTL,総合,4,スポニチアネックス,ドジャース史上初！MVPトリオが試合開始直後から圧巻3連発！大谷翔平、ベッツ、フリーマンが競弾,https://news.yahoo.co.jp/articles/138076b7f45a1f982cfef6f830c2246dcdc914c4,9/1(日) 9:23
2024-09-01,10:33,TTL,総合,5,東スポWEB,さんま　再婚・東出昌大に〝贈る言葉〟「俺はIMALUと会えなくなるから再婚しなかった」,https://news.yahoo.co.jp/articles/473810b9138859e97ec58ffa3ea888124e0ac271,9/1(日) 0:11
2024-09-01,10:33,TTL,総合,6,ほ・とせなNEWS,車に乗せられた赤ちゃん。表情をよく見ると…「こんな赤さん初めて見た」「とりあえずごめんなさい」の声,https://news.yahoo.co.jp/articles/b88fd800f9bd135ad785be41de44775a51afb6ac,9/1(日) 6:30
2024-09-01,10:33,TTL,総合,7,Medical DOC,俳優・高橋克明さん「心筋梗塞」で逝去 前兆となる“3つの初期症状”を医師が解説,https://news.yahoo.co.jp/articles/be7005f0d130e01d10764100c2ff73e4c06551fc,8/29(木) 11:17
2024-09-01,10:33,TTL,総合,8,Full-Count,大谷翔平が迫る112年ぶり偉業　他は“白黒時代”…理解不能な「本塁打王＋40盗塁以上」,https://news.yahoo.co.jp/articles/55de484acd27c7f1f022492dd06548d8191895a6,9/1(日) 6:30
2024-09-01,10:33,TTL,総合,9,TBS NEWS DIG Powered by JNN,また戻ってくる台風10号 東海道沖を北上中　熱帯低気圧に変わっても大雨に警戒を　関東・東海・近畿では引き続き大気不安定に【台風10号最新情報】,https://news.yahoo.co.jp/articles/84c91e8b6f6bde0fdc628b2cbb3224a5383f5782,9/1(日) 8:59
2024-09-01,10:33,TTL,総合,10,ねとらぼ,友人にメダカと睡蓮をあげる→3年後に見に行くと……　想像を超える“楽園”に「こんなに……！？」「めちゃくちゃ綺麗」,https://news.yahoo.co.jp/articles/73e71ba56f66769817d9e2f520db7b8662ce1e1e,8/31(土) 21:00
2024-09-01,10:33,TTL,総合,11,スポーツ報知,宮島咲良アナ、インスタ画像がマッチングアプリで大量盗用！男性プロフに使われ「ダメだよ絶対」,https://news.yahoo.co.jp/articles/4e88e054926c962cd61bfdeb7e86a02c9d6be679,9/1(日) 7:16
2024-09-01,10:33,TTL,総合,12,ウェザーマップ,遅すぎる台風10号　東海に接近へ　近畿から関東を中心に大雨災害への警戒続く,https://news.yahoo.co.jp/articles/29e158649fd1f4525e6a816982151fb9dc42d310,9/1(日) 6:35
2024-09-01,10:33,TTL,総合,13,デイリースポーツ,やす子、現在の母親との関係性　１８歳まで児童養護施設「金銭的な面で、母は悪くないが」,https://news.yahoo.co.jp/articles/43ed143e1f5bba7290e2922450b98ab67dba29bb,8/31(土) 10:58
2024-09-01,10:33,TTL,総合,14,読売新聞オンライン,横浜駅西口で起きた死亡事故、転落したのは千葉の高３女子…３２歳会社員が巻き添えに,https://news.yahoo.co.jp/articles/a1d4b00c9ee16e2ccd0919d9c0bd4e0b924813f9,9/1(日) 8:17
2024-09-01,10:33,TTL,総合,15,RCC中国放送,【台風情報】次の“台風の卵”か　フィリピン東の熱帯低気圧　9月前半に日本周辺へ向け北上予想も　海外予報機関の監視対象に　台風11号または12号か　気象庁・アメリカ・ヨーロッパの進路予想比較,https://news.yahoo.co.jp/articles/55bf8c65e5f9a6c3e21bc85baf100307448631bd,8/31(土) 22:06
2024-09-01,10:33,TTL,総合,16,西スポWEB OTTO！,「フワちゃんが消えた」フジ・有吉の夏休み2024公式サイトが〝厳格〟対応を発表　出演者一覧、トップ画から姿を消す,https://news.yahoo.co.jp/articles/232b78b4e230310507f88fb296d561ad479eb408,8/31(土) 18:49
2024-09-01,10:33,TTL,総合,17,スポーツ報知,大谷翔平、第２打席は同点の中犠飛で打点リーグトップタイ浮上　本塁打と２冠　初回に２戦連発の４４号ソロ,https://news.yahoo.co.jp/articles/77ffbfa4974b9a00aecda1e652b21e590b3625b5,9/1(日) 9:42
2024-09-01,10:33,TTL,総合,18,TBS NEWS DIG Powered by JNN,大谷翔平 2試合連発の44号先頭打者弾！今季月間最多タイとなる8月12本目、初回に“MVPトリオ”が衝撃の3者連続アーチ,https://news.yahoo.co.jp/articles/805d5042146a1bed087ffcaf9317b7e92eb09fec,9/1(日) 9:12
2024-09-01,10:33,TTL,総合,19,ABEMA TIMES,"大谷翔平の通算11本目先頭打者から""MVPトリオ""の3者連続アーチ！2試合連続の44号で8月12本目　2位オズナと7本差",https://news.yahoo.co.jp/articles/996446b8db9c0bd193bd78e8bf1d13f7042c35be,9/1(日) 9:12
2024-09-01,10:33,TTL,総合,20,Full-Count,カメラに抜かれた美少女の正体「所沢にも来たのか！」　台風関係なしの“ガチ勢”ぶりに騒然,https://news.yahoo.co.jp/articles/bc5c1f5b13bb08a80cf3dfa6d4647fd1967d0220,9/1(日) 7:40
2024-09-01,10:33,TTL,総合,21,Full-Count,大谷翔平44号からMVPトリオ3者連発　敵地解説も憤り「なんで勝負するんだ」,https://news.yahoo.co.jp/articles/789f815b462e945bba6ffbe70f9b07f1a4bab404,9/1(日) 9:40
2024-09-01,10:33,TTL,総合,22,くるまのニュース,“216万円”から！ ホンダ「6速MT＆ターボ車」に反響殺到！ “初代NSX風”マフラー＆「反転TURBOステッカー」ありの「軽」に熱視線！,https://news.yahoo.co.jp/articles/b41309f6b3a4d34f00f88f874b1ee7d78a9e82bc,9/1(日) 7:40
2024-09-01,10:33,TTL,総合,23,スポーツ報知,東原亜希、家族でＬＡ旅行満喫！夫・井上康生氏と夫婦ショットも披露「旦那様カッコいい」「素敵な写真ばっかり」の声,https://news.yahoo.co.jp/articles/05f5b714a3e7d3dbe3660fc0420b21e4f97a3102,9/1(日) 5:54
2024-09-01,10:33,TTL,総合,24,くるまのニュース,突然…「ゴールド免許」剥奪？ なぜ？ 無事故・無違反でも「ブルー免許」格下げ!? 気をつけたい「うっかり失効」とは,https://news.yahoo.co.jp/articles/2e12b8d00bc27919efaf1e8a5216466a6e7a7825,9/1(日) 9:10
2024-09-01,10:33,TTL,総合,25,RONSPO,嫌がらせ？駆け引き？J1町田が浦和コーチにロングスロー時にボールを拭くタオルを“強奪”される“ひと悶着”の末に首位陥落,https://news.yahoo.co.jp/articles/9beddadcfe0caa99e62bf185d8bfb4e896a15851,9/1(日) 6:37
2024-09-01,10:33,TTL,総合,26,スポーツ報知,大谷翔平４４号先頭弾で着火！　ベッツ、フリーマンも続き初回に球団初３者連続本塁打…敵軍は先頭ランニング弾などですぐ逆転,https://news.yahoo.co.jp/articles/e3c8c460095acddb22ef48c58b8fd58b8c5be68b,9/1(日) 9:27
2024-09-01,10:33,TTL,総合,27,ファイナンシャルフィールド,「タンス預金」が300万円を超えたので「車の買い替え」に使用したいのですが、税務署に指摘されませんか？,https://news.yahoo.co.jp/articles/7076b1e1b8b0872b488622be0c396ac76babfba9,8/29(木) 14:00
2024-09-01,10:33,TTL,総合,28,スポーツ報知,やす子、「２４時間テレビ」チャリティーマラソン…競技場を出て両国国技館を目指し走り始める「今日は景色が変わるから楽しみだなぁ」,https://news.yahoo.co.jp/articles/c0f98ebbd0134b486fc662b98a2958f03b577a4a,9/1(日) 6:40
2024-09-01,10:33,TTL,総合,29,マグミクス,『マジンガーZ』やっぱり納得いかない！　大敗北からの退場劇（最終回）から半世紀,https://news.yahoo.co.jp/articles/2cd4433f39e4bd67846d23062c0db6e4ad2d1756,9/1(日) 6:45
2024-09-01,10:33,TTL,総合,30,RONSPO,「ショウヘイは盗塁の価値を理解している」大谷翔平の歴史的「43－43」達成の裏にある盗塁数の増加理由をロバーツ監督が語る,https://news.yahoo.co.jp/articles/cd41921591baab99f0acc03fb18a7d473b498f55,9/1(日) 6:10
2024-09-01,10:33,TTL,総合,31,ベースボールキング,ドジャース・大谷翔平が2戦連発の44号先頭打者アーチ　ベッツ＆フリーマンとMVPトリオ3者連発！,https://news.yahoo.co.jp/articles/bba19cfe5036428944957e01ddb5e7a3730cc911,9/1(日) 9:18
2024-09-01,10:33,TTL,総合,32,Full-Count,大谷翔平を見つめるデコピンが「勝負師の顔」　始球式直前の表情にX興奮「スイッチ入った」,https://news.yahoo.co.jp/articles/a47346f53f78c174e476fc7986f7bef47c4f2268,9/1(日) 7:20
2024-09-01,10:33,TTL,総合,33,中日スポーツ,元放送作家・長谷川良品さん、やす子の24時間テレビマラソンに私案 「そんなに走らせたいのであれば…」,https://news.yahoo.co.jp/articles/f0aded5c212095a8a74a1499d99dc2de7ed2d65b,8/31(土) 12:46
2024-09-01,10:33,TTL,総合,34,デイリースポーツ,高梨沙羅　攻めたフロント穴あき服やお腹見せ服でパリ五輪満喫　貴重なオフ姿を公開　美麗メイクもお似合い,https://news.yahoo.co.jp/articles/716ec14fd5c335818cd477f526ccb9d692200b80,8/31(土) 17:33
2024-09-01,10:33,TTL,総合,35,スポニチアネックス,中村江里子「新しい家族」迎えたと報告「私の幸福感は言葉にならず…」昨年11月の悲しい別れ乗り越え,https://news.yahoo.co.jp/articles/9d61e404db817f6600ca916d864bf598dcf892e8,9/1(日) 6:35
2024-09-01,10:33,TTL,総合,36,朝日新聞デジタル,横浜駅商業施設12階から女性転落　下で歩いていた女性ともに死亡,https://news.yahoo.co.jp/articles/dbf099c0178686505d7c52270b89165195626c35,8/31(土) 22:40
2024-09-01,10:33,TTL,総合,37,スポニチアネックス,やす子「休憩中です！」　24時間テレビのマラソン中に異例の投稿　フォロワーからはエール殺到,https://news.yahoo.co.jp/articles/150e2efe1d44a202cb5cfd23d027b3ec71251022,8/31(土) 21:28
2024-09-01,10:33,TTL,総合,38,スポーツ報知,２０年前の朝ドラヒロイン女優、現在の姿が「めっちゃカワイイ」４１歳に見えん！２児のママ,https://news.yahoo.co.jp/articles/2454ef78a3199dfa790ec151f619b6d99421d43a,9/1(日) 6:06
2024-09-01,10:33,TTL,総合,39,スポニチアネックス,やす子「24時間テレビ」マラソン　日産スタジアムを出て…両国国技館を目指し走り出す,https://news.yahoo.co.jp/articles/1098426b1968151271aaf7554e159bf2a7135699,9/1(日) 6:42
2024-09-01,10:33,TTL,総合,40,ゴルフ総合サイト ALBA Net,松山英樹は「68」も14打差9位後退　シェフラーが5打リードで最終日へ,https://news.yahoo.co.jp/articles/e5a6c1b8a47688661c8b4b7f228b787e644f29af,9/1(日) 7:58
