scrp_date,scrp_time,genre_en,genre_jp,rank,media_jp,title,link,date_original
2024-01-30,16:17,domestic,国内,1,ABEMA TIMES,【独自】「車でひいたら事故扱い」八田容疑者と留置場で過ごした男性が語る驚きの新事実 元刑事「これは有力情報。供述証拠になる」 大分・別府ひき逃げ事件,https://news.yahoo.co.jp/articles/3285f81c459277d93f0e72f1fc6b97825e86040e,1/30(火) 7:00
2024-01-30,16:17,domestic,国内,2,日刊スポーツ,八代英輝弁護士「日本の恥」麻生太郎氏の上川外相の容姿めぐる発言を批判「この時代でまだ…」,https://news.yahoo.co.jp/articles/0c0cb178f063c178f32a9612154a3d31c2b8e478,1/30(火) 13:54
2024-01-30,16:17,domestic,国内,3,スポニチアネックス,作家・相沢沙呼氏　芦原妃名子さん急死に「どうしても他人事には思えず、想起することも多々あります」,https://news.yahoo.co.jp/articles/4c046032e716fb13306c18362b2156ee55d7f1fd,1/30(火) 13:07
2024-01-30,16:17,domestic,国内,4,日刊スポーツ,田崎史郎氏、麻生太郎氏は「早めに上川さんを押さえた」容姿発言批判の中、ポスト岸田念頭言及？,https://news.yahoo.co.jp/articles/31888724c61233e31fe48430b74c12a0d516b5a6,1/30(火) 14:57
2024-01-30,16:17,domestic,国内,5,デイリースポーツ,「全漫画家は芦原先生の言い分はわかってた」と映像化経験の作者　芦原妃名子さん急死に悲しみ,https://news.yahoo.co.jp/articles/88fbf844119c7e1f88cbc64d59ea34e48a70fc4e,1/30(火) 12:35
2024-01-30,16:17,domestic,国内,6,CBCテレビ,少年が踏切で列車にはねられ死亡　身分証などから高校生とみられ警察が身元の確認急ぐ　地下鉄でも男子中学生（14）がホームから線路に転落,https://news.yahoo.co.jp/articles/1ae57cdb7186bc65907dec1eb288ee1e18e002d0,1/30(火) 15:14
2024-01-30,16:17,domestic,国内,7,FNNプライムオンライン,"新潟・佐渡沖に活断層の""割れ残り"" 2週間以内に""大きな揺れ""引き起こす恐れ…M7級の地震で3mの津波も",https://news.yahoo.co.jp/articles/deb81ecb9197db0d7b5c1e5227618e075d7e5c39,1/29(月) 20:02
2024-01-30,16:17,domestic,国内,8,朝日新聞デジタル,元捜査員「後味悪い」、遺族「終わってない」　桐島聡名乗る男死亡,https://news.yahoo.co.jp/articles/65d782352c1bb48134b0d81a4425590bb1258dc2,1/30(火) 6:00
2024-01-30,16:17,domestic,国内,9,レスキューナウニュース,JR神戸線で人身事故 一部運転見合わせ,https://news.yahoo.co.jp/articles/c7163faa26aa054425fcedcdc9f6ada60ccea322,1/30(火) 14:00
2024-01-30,16:17,domestic,国内,10,共同通信,手配のポスター見るたび嫌な思い　桐島容疑者の親族、複雑な心境,https://news.yahoo.co.jp/articles/08e2571cce3177651f038d56acdb9bac37df9f28,1/29(月) 15:59
2024-01-30,16:17,domestic,国内,11,TBS NEWS DIG Powered by JNN,死亡前の任意聴取に「事件について後悔している」「1人で逃亡していた」…桐島容疑者とみられる男　警視庁公安部,https://news.yahoo.co.jp/articles/ded6efeaa7954379251009c9cae78c0f38fea2ab,1/30(火) 15:22
2024-01-30,16:17,domestic,国内,12,毎日新聞,みんなを笑顔に　小児がんで逝った12歳少女の生涯、映画化　広島,https://news.yahoo.co.jp/articles/41556019e8fcada4ad46c32b26b73a1bfabec270,1/30(火) 12:30
2024-01-30,16:17,domestic,国内,13,日刊スポーツ,泉房穂氏が田崎史郎氏を遠回しにチクリ　自民党裏金調査めぐる第三者委員会メンバーの例え話で…,https://news.yahoo.co.jp/articles/2260829054b53b911a91bf777f6609b189e5534c,1/30(火) 12:26
2024-01-30,16:17,domestic,国内,14,J-CASTニュース,大学の授業中、学生が鍋を食べる...驚きの光景にSNS賛否両論　許可した教授が明かす「自由」めぐる深い理由,https://news.yahoo.co.jp/articles/43aafecd1293c3eeef21c05f51bf9df3be8ca04f,1/28(日) 12:00
2024-01-30,16:17,domestic,国内,15,ハフポスト日本版,著名人の「自殺報道」、厚労省が20回目の注意喚起。場所を伝えるのは「やってはいけない」報道,https://news.yahoo.co.jp/articles/dd62b407e5909538d41c315c2e3b8759a17969be,1/30(火) 11:45
2024-01-30,16:17,domestic,国内,16,FNNプライムオンライン（フジテレビ系）,【速報】 野党が自民に「裏金議員リスト」提出要求 拒否なら予算案審議入りできずと伝達 二階氏らの政倫審出席も要求,https://news.yahoo.co.jp/articles/398e12b6b57cae7554e793422652143bd6709dc2,1/30(火) 13:03
2024-01-30,16:17,domestic,国内,17,ABEMA TIMES,麻生氏の「おばさん」発言に上川大臣「ありがたく受け止める」 ルッキズムと批判の声,https://news.yahoo.co.jp/articles/becd2d816782dce94ac0c52ebbd573a1dc45dffb,1/30(火) 14:08
2024-01-30,16:17,domestic,国内,18,朝日新聞デジタル,修徳高サッカー部元監督を3回目の逮捕　数百点の少年の画像見つかる,https://news.yahoo.co.jp/articles/8221531fac0a5383df8ed9d1be4ad6634960276d,1/30(火) 14:57
2024-01-30,16:17,domestic,国内,19,ABEMA TIMES,死亡の“桐島聡”名乗る男「逃亡中は誰の支援も受けていなかった」,https://news.yahoo.co.jp/articles/23ee49573b25328004aebe18e7f3eaf6e355cc83,1/30(火) 14:29
2024-01-30,16:17,domestic,国内,20,日刊スポーツ,上川陽子外相、麻生太郎氏の容姿発言に言及「どのような声もありがたく受け止める」直接論評せず,https://news.yahoo.co.jp/articles/a8a9b692b5c688b2b282307892c80faa1b74170e,1/30(火) 15:02
2024-01-30,16:17,domestic,国内,21,FNNプライムオンライン（フジテレビ系）,【速報】 高市大臣の万博中止提案で「首相に従う」 経産相への指示を受け矛収める,https://news.yahoo.co.jp/articles/7e51d004913be3a0cdc27ff30ca9be57cebf157a,1/30(火) 14:17
2024-01-30,16:17,domestic,国内,22,読売新聞オンライン,松井秀喜さん「今度は私が応援しなくてはいけない時」…故郷石川の被災者にメッセージ,https://news.yahoo.co.jp/articles/a579f0688b9710172040624cc94b650e3634fc59,1/30(火) 15:36
2024-01-30,16:17,domestic,国内,23,ABEMA TIMES,完全にコントの流れ 監督が「絶対にやらないと思いますよ」と指摘した手をエース棋士が即決「やった！？」と目がまんまる／将棋・ABEMA地域対抗戦,https://news.yahoo.co.jp/articles/db3c9741f3e94a332d173890e810cef4fa573f38,1/30(火) 12:30
2024-01-30,16:17,domestic,国内,24,日刊スポーツ,桐島聡容疑者名乗る男死亡「捕まらなかった要因は…」警視庁元鑑識課捜査員が見解示す　,https://news.yahoo.co.jp/articles/4be14362fb294871d97e061f40588f346a22fa03,1/29(月) 18:12
2024-01-30,16:17,domestic,国内,25,時事通信,酒飲み仲間から「うっちー」　銭湯でストレッチも　「内田」の偽名、桐島容疑者名乗る男,https://news.yahoo.co.jp/articles/bb1124fe693213d07a56de51d315a1b89b44bb88,1/30(火) 7:04
2024-01-30,16:17,domestic,国内,26,日刊スポーツ,大空幸星「SNSはもはや人の命を奪う凶器になってしまった」漫画家芦原妃名子さん訃報について,https://news.yahoo.co.jp/articles/bbf44d1a917a07b3961525dec5d4527bffa7969b,1/30(火) 10:40
2024-01-30,16:17,domestic,国内,27,朝日新聞デジタル,むき出しの海底、姿を変えた島　地震前後の比較で見る能登半島の景観,https://news.yahoo.co.jp/articles/4e37b24f1b8bbb70eab2065edb43c585aac3b202,1/27(土) 13:00
2024-01-30,16:17,domestic,国内,28,CBCテレビ,男子中学生（14）が地下鉄のホームから線路に転落　列車と接触して両肩を打撲するけが　名古屋市営地下鉄・鶴舞線,https://news.yahoo.co.jp/articles/a39d16a75b860ed99081bd9b950acbe83c69d9da,1/30(火) 11:46
2024-01-30,16:17,domestic,国内,29,FNNプライムオンライン,「高速並みのスピードも」「一時停止しない」　“7歳女児重体”の事故現場に信号機設置　住民は以前から「不安の声」,https://news.yahoo.co.jp/articles/855b5be95ad81a42bfa325eca8fded7c3dda07cf,1/30(火) 11:32
2024-01-30,16:17,domestic,国内,30,FNNプライムオンライン,3歳女児が内臓損傷…交際女性の娘に暴力疑いで25歳男を逮捕　日常的に暴行か,https://news.yahoo.co.jp/articles/f102c475b26d4f2d600a027ab7ff15f6e1e36a01,1/30(火) 13:43
2024-01-30,16:17,domestic,国内,31,FNNプライムオンライン（フジテレビ系）,【速報】秋篠宮家側近トップ交代　吉田尚正・元警視総監が皇嗣職大夫に就任,https://news.yahoo.co.jp/articles/a4ec35c807baaaeb7a528cce79a4498d3b12a351,1/30(火) 9:13
2024-01-30,16:17,domestic,国内,32,FNNプライムオンライン（フジテレビ系）,「脚本家責める流れいけない」日本テレビ側とトラブルか?「セクシー田中さん」作者死去で漫画家の赤松健議員コメント,https://news.yahoo.co.jp/articles/63d03877a583f73c455c47159d2340acd473e5d0,1/30(火) 6:46
2024-01-30,16:17,domestic,国内,33,レスキューナウニュース,名古屋市営鶴舞線で人身事故 一部運転見合わせ,https://news.yahoo.co.jp/articles/e51d9bcc6511be5743fabe0f22b4a4a37d8b0cbc,1/30(火) 12:25
2024-01-30,16:17,domestic,国内,34,時事通信,「コロナ禍初期みたい」　観光減、飲食業に再び試練　県南部や金沢市でも悲鳴・能登地震,https://news.yahoo.co.jp/articles/83c20f8fccb846fb93b375184d2882e8905ae654,1/30(火) 13:32
2024-01-30,16:17,domestic,国内,35,産経新聞,琵琶湖のボート事故　死亡3人の身元判明　滋賀の40～50代男性,https://news.yahoo.co.jp/articles/185beb9b8b9a4516848e82db98c2e005f53fe302,1/30(火) 15:11
2024-01-30,16:17,domestic,国内,36,読売新聞オンライン,鶏が鳴いて殺された一家７人、今も地域では鶏を飼わない風習…元寇から今年で７５０年,https://news.yahoo.co.jp/articles/6c9feeedc630f860b0863c7c0e23c4297404acb0,1/30(火) 14:29
2024-01-30,16:17,domestic,国内,37,読売新聞オンライン,桐島聡と名乗る男、がん治療のため自費通院…偽名「ウチダヒロシ」で健康保険加入できなかったか,https://news.yahoo.co.jp/articles/9b15e6d448614b884aa506c0069726e33452d3bc,1/29(月) 5:00
2024-01-30,16:17,domestic,国内,38,産経新聞,成人式迎えるはずの長女の晴れ着写真、妻がくれた腕時計…下敷きになった居酒屋店主が探し続ける「思い出」,https://news.yahoo.co.jp/articles/981d5cb7a02c24ac5893dbb57b1f00494a1b1398,1/30(火) 11:33
2024-01-30,16:17,domestic,国内,39,レスキューナウニュース,名古屋市営鶴舞線で人身事故 運転再開,https://news.yahoo.co.jp/articles/f8da298009f1c7b61ab4a4acf2562f67f685ccab,1/30(火) 14:30
2024-01-30,16:17,domestic,国内,40,アジアプレス・ネットワーク,岸田派、茂木派などの刑事告発を東京地検が「軽微な過失」と不受理　「裏金は高額。告発権の侵害で恣意的」と上脇教授が批判,https://news.yahoo.co.jp/articles/bb7b7a775dc1f193ff2d03e6f3626a1f3752e2fc,1/30(火) 11:21
