scrp_date,scrp_time,genre_en,genre_jp,rank,media_jp,title,link,date_original
2024-01-30,12:16,sports,スポーツ,1,サッカー批評Web,サッカー日本代表、アジアカップ・ラウンド16バーレーン戦の「予想スタメン＆フォーメーション」! 伊東純也、遠藤航、南野拓実の起用には警告の影響もあるか,https://news.yahoo.co.jp/articles/9e134092570917e04134549278bda59a6959ff80,1/30(火) 5:02
2024-01-30,12:16,sports,スポーツ,2,デイリースポーツ,巨人発表　ＯＢ松井秀喜氏が臨時コーチでキャンプ参加　６年ぶり４度目　阿部監督の強力援軍,https://news.yahoo.co.jp/articles/13b7d0e1a6e28a693da69f0fba549d786e7387fd,1/30(火) 10:13
2024-01-30,12:16,sports,スポーツ,3,CoCoKARAnext,ネイマール、体型が衝撃の変貌…中東メディアは故障離脱中のパーティー参加姿に愕然「太りすぎ。どういうことだ」,https://news.yahoo.co.jp/articles/e6b5cc3c02beb96ac4cd892415152b7380d6e3fc,1/30(火) 7:02
2024-01-30,12:16,sports,スポーツ,4,バスケットボールキング,ネブラスカ大の指揮官が語る富永成長の足跡…「シュートを決めきる力がNBAへのキップ」,https://news.yahoo.co.jp/articles/5b07c6113ba331e8bb511cf269c441be51d80a47,1/30(火) 7:30
2024-01-30,12:16,sports,スポーツ,5,Full-Count,鷹ウォーカーが衝撃のイメチェン　ドレッドヘア→超短髪で入団会見「リセット」,https://news.yahoo.co.jp/articles/9950d5ff828ed39b7ee4dee0933ed54c73fab4e4,1/30(火) 11:34
2024-01-30,12:16,sports,スポーツ,6,Full-Count,ロッテ、WBCチェコ代表コーチのキャンプ招待を発表　ダーハク氏「特別な機会」,https://news.yahoo.co.jp/articles/7b902c0dfeed7c68a6c311e448c42b25abe99aa6,1/30(火) 10:51
2024-01-30,12:16,sports,スポーツ,7,日刊ゲンダイDIGITAL,日本ハム清宮幸太郎またまた開幕前に故障のナゼ…貪欲さは向上も決定的に「足りない」もの,https://news.yahoo.co.jp/articles/797326d2b9785f81e011832462d1e1608ae1ad03,1/30(火) 11:20
2024-01-30,12:16,sports,スポーツ,8,東スポWEB,【大相撲】大関昇進決めた琴ノ若　一門待望の横綱となるか…気になる親方衆たちの〝見解〟,https://news.yahoo.co.jp/articles/3a8bd79c2ed1325e2f5e6d16630b1abe29822373,1/30(火) 6:16
2024-01-30,12:16,sports,スポーツ,9,J-CASTニュース,卓球・伊藤美誠「団体戦出るかはっきり決まってない」に波紋　「何様発言」「精神すり減らしてて心配」,https://news.yahoo.co.jp/articles/4fdc5332a54b56825cff58e2745418216ac25abc,1/29(月) 19:23
2024-01-30,12:16,sports,スポーツ,10,Full-Count,ド軍、通算64勝パクストンと1年契約を正式発表　年俸16億円、大谷＆由伸に援軍,https://news.yahoo.co.jp/articles/52db524b3b6364e07465dafccfd73a5c3d1c7869,1/30(火) 7:10
2024-01-30,12:16,sports,スポーツ,11,スポーツ報知,【中日】ドラフト１位・草加勝が２月１日にトミー・ジョン手術　復帰まで１年以上　来季後半戦以降の完全復活目指す,https://news.yahoo.co.jp/articles/37f5b7d7675beac8974348098efd835dbc25d743,1/30(火) 3:00
2024-01-30,12:16,sports,スポーツ,12,デイリースポーツ,ワリエワに４年間の資格停止処分　露側は反発　タラソワ氏激怒「クソ野郎ども！我が国への憎しみが少女に」　連盟は「我々が五輪王者」,https://news.yahoo.co.jp/articles/64fa47bd8daba124b1a8817fbedd5b5fd9f73f9f,1/29(月) 23:55
2024-01-30,12:16,sports,スポーツ,13,スポーツナビ,セ・リーグ6球団の補強診断　活発なストーブリーグで唯一のA評価となったチームは？,https://news.yahoo.co.jp/articles/dc5a904b1d480c3ca4e5fa59cf6192dfd7bfd208,1/30(火) 11:59
2024-01-30,12:16,sports,スポーツ,14,RONSPO,井上尚弥が5.6東京ドームのネリ戦に注目発言…「過去の因縁を持ち込んで試合はしない。ただ…」“悪童”はモンスターの地雷を踏まずにゴングを聞けるのか？,https://news.yahoo.co.jp/articles/343aff3480266751458bc8d31c45e95030954341,1/30(火) 6:10
2024-01-30,12:16,sports,スポーツ,15,日テレNEWS NNN,【アジアカップ】ヨルダン＆カタールがベスト8入り　後半ATに2得点の劇的逆転勝利,https://news.yahoo.co.jp/articles/f9d6de32a7610ef52d1732866f028a668dd03d47,1/30(火) 11:32
2024-01-30,12:16,sports,スポーツ,16,超WORLDサッカー！,「これは痺れる」「実に劇的な幕切れ」後半AT7分のドラマ、ヨルダンの劇的な逆転ゴールに称賛の嵐「今大会面白すぎる」,https://news.yahoo.co.jp/articles/1fb5a64b9e12cd7d338cab6b5794bc9ca135cb7a,1/30(火) 9:55
2024-01-30,12:16,sports,スポーツ,17,デイリースポーツ,巨人　前日事故発生のジャイアンツ球場で選手が練習　スタンド一般開放は中止,https://news.yahoo.co.jp/articles/5bb194a92cf574acbaed8df5215b59fd83ee6219,1/30(火) 11:17
2024-01-30,12:16,sports,スポーツ,18,東スポWEB,三笘薫もバルセロナ入り？　デゼルビ監督がバルセロナ新指揮官の最有力候補に浮上,https://news.yahoo.co.jp/articles/16fdbf996fe8c80f9570ced1922be8779a485fc1,1/30(火) 11:36
2024-01-30,12:16,sports,スポーツ,19,高校野球ドットコム,【セ・リーグ新外国人選手一覧】広島が4人の大補強！ DeNAは投手3人獲得！ 巨人入りした前阪神・ケラーは守護神候補！,https://news.yahoo.co.jp/articles/643c52078a342b4e1e5c0d95be109171539244e1,1/30(火) 11:01
2024-01-30,12:16,sports,スポーツ,20,日刊ゲンダイDIGITAL,ロッテ佐々木朗希「強硬姿勢」から一転…契約合意の全真相 球団があえて泥を被った本当の理由,https://news.yahoo.co.jp/articles/794300eb1b2a353e4554be81c78aa0ea5146a41d,1/29(月) 12:15
2024-01-30,12:16,sports,スポーツ,21,ABEMA TIMES,横綱は月給いくらもらってる？元若乃花が明かす“力士のお金にまつわる赤裸々な話”「生々しいw」驚きの声,https://news.yahoo.co.jp/articles/a309a5006e444e325d5c8d4c95b3c685793491c4,1/29(月) 14:33
2024-01-30,12:16,sports,スポーツ,22,デイリースポーツ,若隆景　右膝手術から完全復活への現在地　元関脇が３場所連続全休で幕下陥落も親方「こんなに早く治るとは」,https://news.yahoo.co.jp/articles/6aef1be663a1bec1647473d979153e878cebfd62,1/30(火) 9:00
2024-01-30,12:16,sports,スポーツ,23,Full-Count,韓国が見た大谷翔平　米TVマンの発言は「すべて妄言」、痛快だった“2分間スピーチ”,https://news.yahoo.co.jp/articles/cd186b12c05e58cbced8dc3faf8136a2e37bb4ea,1/30(火) 7:40
2024-01-30,12:16,sports,スポーツ,24,スポーツ報知,【日本ハム】自主トレ中に「うわっ…」と悲鳴、清宮幸太郎が倒れ込み病院直行　キャンプイン前に１軍離脱の可能性も,https://news.yahoo.co.jp/articles/81be7bd8e0328898487253f6512c67350f2281f7,1/30(火) 5:00
2024-01-30,12:16,sports,スポーツ,25,ゴルフ総合サイト ALBA Net,優勝予想トップはローリー・マキロイ　大会初出場の松山英樹は選出されず,https://news.yahoo.co.jp/articles/68f0de2ac8275f190cda9a24e675591badd09814,1/30(火) 11:30
2024-01-30,12:16,sports,スポーツ,26,デイリースポーツ,女子ゴルファー菅沼菜々　優勝副賞のベンツ届く「１００％電気自動車でめちゃくちゃカッコ良い」ファンも反応「夢のある仕事」,https://news.yahoo.co.jp/articles/820b7688e4e88a97f6c042bb7190ef8f5ba4393e,1/30(火) 11:33
2024-01-30,12:16,sports,スポーツ,27,MBSニュース,【高校ラグビー】新シーズンの主役は？大阪桐蔭と東海大大阪仰星が激突!!　雪辱の常翔学園が関大北陽振り切る　近畿大会出場が決定,https://news.yahoo.co.jp/articles/35202bbc59241f9bef32289cbe5c8cfe658ab8aa,1/30(火) 10:19
2024-01-30,12:16,sports,スポーツ,28,スポニチアネックス,選手会・森事務局長　ロッテ・佐々木の脱退に「情けない。寂しい。先輩方がいろんなものを変えてきた」,https://news.yahoo.co.jp/articles/33ec2d923497047575337a87fe87cb36346174bc,1/29(月) 16:38
2024-01-30,12:16,sports,スポーツ,29,時事通信,過密日程とも戦った選考レース　団体要員「あと1枠」の行方は―卓球,https://news.yahoo.co.jp/articles/115ac579035f92bf7d5d4e7508fefe245564ceea,1/30(火) 7:05
2024-01-30,12:16,sports,スポーツ,30,ABEMA TIMES,「華あるやん」「カイリかっけえ」日本人女子レスラー、大一番で“ド派手”入場 トレードマーク封印で“ただならぬ予感” 漂う元王者コンビのオーラに全米熱狂,https://news.yahoo.co.jp/articles/9f2ca32544c0c7d02573226770d9b594d003bd12,1/30(火) 10:58
2024-01-30,12:16,sports,スポーツ,31,西スポWEB OTTO！,PL学園の清原和博と並び称された「九州のブーマー」、39年前のセンバツで仲間と残した「驚打」の記録と記憶　現在の姿は？,https://news.yahoo.co.jp/articles/cba86cea0493175c52a03a39e3182a663482a89b,1/30(火) 11:50
2024-01-30,12:16,sports,スポーツ,32,スポニチアネックス,【アジア杯】日本から“金星”のイラクが敗退…ヨルダン　後半ATからの劇的勝利で3大会ぶり8強決めた,https://news.yahoo.co.jp/articles/e6117abd66f889e058598ad7c6078682335290aa,1/29(月) 22:46
2024-01-30,12:16,sports,スポーツ,33,Full-Count,登板わずか4試合の逸材「相当な戦力に」　専門家絶賛…“2年前のドラ1”が秘める可能性,https://news.yahoo.co.jp/articles/61982e1fbb419f97680bd2059b0b9e9915d02dbf,1/30(火) 7:20
2024-01-30,12:16,sports,スポーツ,34,読売新聞オンライン,過去７０年の記録を分析して見えた、「箱根路」と「マラソン」似通うレベルアップの軌跡,https://news.yahoo.co.jp/articles/112c373bebee70ed7cbff9106c58f9cc74208f40,1/30(火) 11:12
2024-01-30,12:16,sports,スポーツ,35,デイリースポーツ,江川卓氏が阪神・岡田監督との対戦を振り返る「岡田さんが巨人で、僕が阪神の可能性もあったって話？」,https://news.yahoo.co.jp/articles/c8c126b1da1c45fe71bc2fa6eb80db181312b950,1/30(火) 11:36
2024-01-30,12:16,sports,スポーツ,36,4years.,井上尚弥と同じ身長ながら、階級は5個上　「ハマのタイソン」田中空、東洋大学卒業後もウエルター級で勝負,https://news.yahoo.co.jp/articles/b01107a54f89b888771b56e0c69bb657a5ff732e,1/30(火) 11:40
2024-01-30,12:16,sports,スポーツ,37,Full-Count,エ軍の元有望株が“戦力外危機”　170キロ外野手の加入で飽和状態「この春が分岐点」,https://news.yahoo.co.jp/articles/ea0c2c858b3fbd018393b8eb8fac8e5c449c4f0d,1/30(火) 11:32
2024-01-30,12:16,sports,スポーツ,38,西スポWEB OTTO！,相次ぐソフトバンク主軸の〝苦言〟奮い立った若手は筑後の外にいた,https://news.yahoo.co.jp/articles/507ceb3093c0ad1c172591dcf5c86089a9a312f0,1/30(火) 8:03
2024-01-30,12:16,sports,スポーツ,39,FITNESS LOVE,ボンキュッボンなビキニ姿　痩せて「胸が小さくなる」を抑制した方法とは？,https://news.yahoo.co.jp/articles/f51bb0c0c0213db2501f4cfab5e926b7c447d905,1/30(火) 5:10
2024-01-30,12:16,sports,スポーツ,40,西スポWEB OTTO！,「失礼ですけど全く使っている理由がわからない選手だった」ソフトバンク小久保裕紀監督がオリックス中嶋聡監督〝愛弟子〟起用にド直球質問,https://news.yahoo.co.jp/articles/55f39b16a939fc973e3a5486272d4e6a0f22d459,1/30(火) 0:00
