scrp_date,scrp_time,genre_en,genre_jp,rank,media_jp,title,link,date_original
2024-03-12,18:22,TTL,総合,1,ファイナンシャルフィールド,新幹線の予約していた「特大荷物」スペースに「ベビーカーを置きたい」と言われました…譲る必要がありますか？,https://news.yahoo.co.jp/articles/773ae067daf3862fc896d22fa79f379cfba7ece0,3/12(火) 15:20
2024-03-12,18:22,TTL,総合,2,スポーツ報知,元天才子役、２９歳の激変した近影にファン騒然「え！ヒゲ」「ダンディね」「大人になっちゃって…」,https://news.yahoo.co.jp/articles/a2212f5bd7a086f51b9deec70436f3943444b0cb,3/12(火) 14:30
2024-03-12,18:22,TTL,総合,3,ほ・とせなNEWS,出産後のママのお見舞いに来た1歳長男　“まだ一緒に帰れない”とわかった長男の姿に「もらい泣きする」「涙腺崩壊」の声,https://news.yahoo.co.jp/articles/1cf053670aacd3a5e372bccc3e0e940958eb4ee2,3/12(火) 11:40
2024-03-12,18:22,TTL,総合,4,ABEMA TIMES,木下優樹菜さん、交際中のサッカー三幸秀稔選手との韓国での最新2ショットが話題に「本当にお似合い」「かわいすぎる」,https://news.yahoo.co.jp/articles/05a766083028497e7d130a713545fa282edc0083,3/12(火) 15:18
2024-03-12,18:22,TTL,総合,5,チューリップテレビ,「家庭内で被害に遭っている人へ」実名・顔出しで父親からの性被害訴えた24歳女性【会見詳報つづき】逮捕された父親は黙秘,https://news.yahoo.co.jp/articles/454a537d82b7bf0672f0de1620b5d7b804602d80,3/12(火) 15:26
2024-03-12,18:22,TTL,総合,6,デイリースポーツ,内藤剛志「だから俳優はダメなんだ！」ナイツ塙から匿名俳優の態度聞き激怒「俺たちが上じゃないんだよ」,https://news.yahoo.co.jp/articles/9146d57cd2c4b052bbf2433194e996dcb07ebf36,3/12(火) 14:39
2024-03-12,18:22,TTL,総合,7,西日本新聞,「おかしいでしょ」入社10日後に退職、手数料は34万円…人材紹介のトラブルに悩む現場,https://news.yahoo.co.jp/articles/cd7dd6b48a2c2e78cd5c1ce81450a784d5dd4d58,3/12(火) 9:30
2024-03-12,18:22,TTL,総合,8,ENCOUNT,お風呂で5時間半爆睡　「手が痛すぎて死にそう」驚愕の光景…“その後”どうなった？　当事者が明かす,https://news.yahoo.co.jp/articles/373ee86ffacbcab7399d26cbb72bfa31f7a2ff8a,3/12(火) 10:10
2024-03-12,18:22,TTL,総合,9,日刊ゲンダイDIGITAL,元横綱・白鵬の凄まじい嫌われっぷり…理事長どころか理事すら絶望的の自業自得,https://news.yahoo.co.jp/articles/9be5621a71cb34c6c1758e51577824374238c2f1,3/12(火) 9:06
2024-03-12,18:22,TTL,総合,10,スポーツ報知,９０年代ＣＭ女王の近影が「可愛すぎる」「この若さはスゴイ」年齢に仰天！「４０過ぎてこれはすごい」と話題,https://news.yahoo.co.jp/articles/288d49d83a5b86237883bbdcc79c38c9e9699c46,3/12(火) 11:35
2024-03-12,18:22,TTL,総合,11,産経新聞,ハマコーさん、肝臓がん消えて引退撤回？親子バトルに…浜田靖一さんが明かす父の豪傑伝　夜の政論・番外編,https://news.yahoo.co.jp/articles/7d19f972389b579008d23ca9cb755e3167ba0997,3/12(火) 16:00
2024-03-12,18:22,TTL,総合,12,弁護士JPニュース,仕事をえり好み「1000日以上」指示を待ち続け…積極性皆無“地雷社員”に裁判所が下した判断,https://news.yahoo.co.jp/articles/c82b5670306cce811cb6e8144dbc50fc040766b3,3/12(火) 10:20
2024-03-12,18:22,TTL,総合,13,デイリースポーツ,「子連れママに厳しすぎ」で物議の元アイドル「子育て世代は子連れ時のみタクシー乗り放題に」と要望　雨天送迎のつらさ訴える,https://news.yahoo.co.jp/articles/c1ff14df79495e253a3eed90f733ae889e5c9f28,3/12(火) 15:05
2024-03-12,18:22,TTL,総合,14,ファイナンシャルフィールド,子どもが生まれたので「アルファード」を買おうとしたら、妻に「保育園の送迎だけなのに贅沢」と止められました。頭金も「100万円」貯めたので大丈夫だと思うのですが、ほかの車を選ぶべきでしょうか？,https://news.yahoo.co.jp/articles/0c310095ed53a28655b9f38aeb31b6df4cd97f39,3/12(火) 11:30
2024-03-12,18:22,TTL,総合,15,西スポWEB OTTO！,ソフトバンク、ウォーカー古巣に恩返し場外弾「フォローの風に乗せようとイメージ通り」　昨季まで所属した巨人からオープン戦1号、逆転2ラン,https://news.yahoo.co.jp/articles/eba5817de3a03bacc919a7ad7502b0583cdebeac,3/12(火) 15:42
2024-03-12,18:22,TTL,総合,16,スポーツ報知,弘中アナ不在「激レアさん」代役はプロ雀士の３３歳美人アナ「やっぱり綺麗な方やわ」とネット沸く,https://news.yahoo.co.jp/articles/fab5a118379b96914164cee55ab423ea53b1836d,3/12(火) 14:05
2024-03-12,18:22,TTL,総合,17,BBC News,米ボーイング機の安全性問題を告発した元従業員、遺体で見つかる,https://news.yahoo.co.jp/articles/9db02365bd1ba5f8d213c1b24a31d28eeff0214c,3/12(火) 14:36
2024-03-12,18:22,TTL,総合,18,ファイナンシャルフィールド,祖父が亡くなり会社を休みましたが、上司に「ウチに忌引き休暇はない」と言われました。「有休」を使用したのですが、これって違法ではないのですか？,https://news.yahoo.co.jp/articles/15528a5661e7e1f392f010b3ba59ad810393f63a,3/12(火) 13:50
2024-03-12,18:22,TTL,総合,19,日刊スポーツ,【日本ハム】巨人からトレードの若林晃弘４番二塁デビュー　11日の加入発表後、いきなり実戦へ,https://news.yahoo.co.jp/articles/87575eabd58719a4026c9fc71704f966b4345edb,3/12(火) 17:33
2024-03-12,18:22,TTL,総合,20,くるまのニュース,クルマの「暖房」はガソリンを消費しない？ 実は完全に「無料」じゃない！「燃費を悪化」させる間違ったエアコンの使い方とは,https://news.yahoo.co.jp/articles/2e565bc258fb2c82542048011374029a5b243ceb,3/12(火) 11:10
2024-03-12,18:22,TTL,総合,21,東スポWEB,成田悠輔氏　米国永住権取得も直後からトラブル続きで「深く後悔した」,https://news.yahoo.co.jp/articles/8df25dba144c233f38a309f2b0b572ae43450e2d,3/12(火) 13:02
2024-03-12,18:22,TTL,総合,22,Hint-Pot,「この国は素晴らしいと再確認」　初訪日のフランス人が感動　持ち帰りを希望したものとは,https://news.yahoo.co.jp/articles/e1e2163aaf91e2eba652538e34557852719d1be7,3/12(火) 16:28
2024-03-12,18:22,TTL,総合,23,みんかぶマガジン,止まらぬ倒産連鎖で地獄をみることに…名物グローバル投資家が警告「日本経済は後退局面にある」人手不足での廃業が急増,https://news.yahoo.co.jp/articles/9cab99b81caef419fd9a5d76ad356471f6f7eefb,3/12(火) 17:10
2024-03-12,18:22,TTL,総合,24,ABEMA TIMES,サンシャイン池崎、崩壊寸前の家に住む親にプレゼントした“新築の家”を公開「本当に親孝行」「優しさにあふれた家」と話題に,https://news.yahoo.co.jp/articles/b265bdbb375222c957a7d8a428700f99236731cd,3/12(火) 11:36
2024-03-12,18:22,TTL,総合,25,スポーツ報知,クワバタオハラ・小原正子、医師から「かなり悪い」診断結果を公表「ええぇ！」「本当に辛い」衝撃走る,https://news.yahoo.co.jp/articles/ca78695a4bef6e30b85495b4ae6c4cb0a91b1d9e,3/12(火) 12:15
2024-03-12,18:22,TTL,総合,26,デイリースポーツ,「家、ついて行って」みたら有名俳優のいとこだった！矢作も仰天　ＬＩＮＥ公開に「出しちゃいけないｗ」,https://news.yahoo.co.jp/articles/d652f121bd97a2fd20495a2367b22067a0eeff55,3/12(火) 15:53
2024-03-12,18:22,TTL,総合,27,デイリースポーツ,石田純一７０歳の今　焼肉店で皿洗いや床掃除も　電車通勤　騒動で芸能界の仕事ほぼゼロ→豪邸も売却「めちゃくちゃ苦しかったです」,https://news.yahoo.co.jp/articles/3d5ae0f0ef9b40c1ae995d0347b0b6ae84ebbe7c,3/11(月) 20:50
2024-03-12,18:22,TTL,総合,28,東スポWEB,【Ｆ１】角田裕毅を封じた〝脱法戦略騒動〟でＲＢが小松代表率いるハースを提訴へ,https://news.yahoo.co.jp/articles/5a0b33bcc353db561a3b8f3f16789d0445cbd577,3/12(火) 15:56
2024-03-12,18:22,TTL,総合,29,ハフポスト日本版,「アジア系軽視」と議論に。アカデミー賞受賞のエマ・ストーンの行動に波紋⇒ミシェル・ヨーが沈黙を破る,https://news.yahoo.co.jp/articles/920f846f9e6bf7db4e08095ce0f52f9ee931886f,3/12(火) 10:41
2024-03-12,18:22,TTL,総合,30,tenki.jp,関東　活発な雨雲接近中　夕方から急に雨・風強まる　帰宅時間帯は交通機関の影響注意,https://news.yahoo.co.jp/articles/d200745a37590647dd077c153140008adea4a688,3/12(火) 14:28
2024-03-12,18:22,TTL,総合,31,中央日報日本語版,トランプ氏、独裁者を称賛「ヒトラー『良いことをした』、金正恩『ＯＫガイ』」,https://news.yahoo.co.jp/articles/803251a64966beac4793856fbf3b93728f9a90db,3/12(火) 15:01
2024-03-12,18:22,TTL,総合,32,中日スポーツ,新幹線で幼児に「うるさいんだけど」”整形YouTuber”の主張が物議、30分間泣き続けに,https://news.yahoo.co.jp/articles/45cfc9f2eaea743c5ea27a80c66c746d8cff398d,3/12(火) 14:33
2024-03-12,18:22,TTL,総合,33,Full-Count,「天才すぎる」衝撃の“直撃弾”　巨人23歳に高まる期待「逆転開幕スタメンあるか」,https://news.yahoo.co.jp/articles/279c624ab1555fe2ad3ed18fc0c4e48722a1c2a6,3/12(火) 17:49
2024-03-12,18:22,TTL,総合,34,TUFテレビユー福島,「人と会うことがストレス」俳優・村杉蝉之介被告に懲役10か月求刑「役者に戻ろうとは考えていない」法廷で謝罪　麻薬特例法違反などの罪　あまちゃん、大河ドラマなど出演,https://news.yahoo.co.jp/articles/e68046d681d4889f262dee9a0e5de99b363a4cc4,3/12(火) 13:38
2024-03-12,18:22,TTL,総合,35,夕刊フジ,森保ジャパン、北朝鮮戦は平壌開催　入国審査の悪夢再び…１３年前は空港で５時間足止め、国籍を疑われたハーフナー・マイク,https://news.yahoo.co.jp/articles/d115bbd759cc2a4d9fb44980ffcff6371abb60cc,3/12(火) 17:00
2024-03-12,18:22,TTL,総合,36,RONSPO,ボクシング界は許さない！逮捕されたヒロキングの問題を所属ジム亀田大毅会長が謝罪＆活動自粛表明もJBCは厳罰処分検討へ,https://news.yahoo.co.jp/articles/8b077e2b7547e07dc8a13c53204882e111db38fe,3/12(火) 11:01
2024-03-12,18:22,TTL,総合,37,まいどなニュース,食事中「トイレ行ってくる」→アプリで出会った男性が30分以戻ってこず… 25歳受付嬢が語る食い逃げ被害,https://news.yahoo.co.jp/articles/16d73823e6d83d7686015a4c6cc7bf5af0b1e50e,3/12(火) 6:40
2024-03-12,18:22,TTL,総合,38,ファイナンシャルフィールド,「ノースフェイス」や「アンダーアーマー」を着ている人を街中でよく見かけますが、みんなそんなに「高収入」なのでしょうか？,https://news.yahoo.co.jp/articles/6707b6fa30ecf3c66c1830595e0c9fc17c94ef55,3/9(土) 13:30
2024-03-12,18:22,TTL,総合,39,日刊スポーツ,「令和の怪物」伯桜鵬３連勝　１分30秒近い熱戦を制し幕下勇磨を寄り切る,https://news.yahoo.co.jp/articles/b40477fc0104192283a7f9483f38194dc035e843,3/12(火) 15:28
2024-03-12,18:22,TTL,総合,40,J-CASTニュース,「子連れの時のみタクシー乗り放題にして」　元SDN光上せあら、悪天候時の自転車送迎「辛すぎて」願望訴え,https://news.yahoo.co.jp/articles/5da9445e987be0fc296c80e4ddf5a38ca3ca0d20,3/12(火) 14:04
