scrp_date,scrp_time,genre_en,genre_jp,rank,media_jp,title,link,date_original
2024-11-19,09:28,domestic,国内,1,産経新聞,自転車で信号無視の10歳児が車と衝突　「過失割合100％」　保護者に賠償リスク,https://news.yahoo.co.jp/articles/6198efe35c18c7966b184566a87c8854f9d7c2a7,11/18(月) 19:00
2024-11-19,09:28,domestic,国内,2,弁護士JPニュース,飲酒運転が発覚「退職金1620万円」ゼロに…“市職員”が不服訴えた結果「地裁・高裁」と「最高裁」で判断が割れたワケ,https://news.yahoo.co.jp/articles/91bd5248cba4864dfa3ddb2c408c968a7e15be09,11/18(月) 10:00
2024-11-19,09:28,domestic,国内,3,スポニチアネックス,百条委員会・奥谷委員長　立花氏に「自死しても困る」などと脅された　中傷で別の県議は辞職,https://news.yahoo.co.jp/articles/6ebaf2ead8301a218d53ce91f7046b8c06c164fd,11/19(火) 4:40
2024-11-19,09:28,domestic,国内,4,産経新聞,稲村氏支持22市長、〝勝利〟は4市にとどまる　相生市長の会見時振る舞いも批判の的に,https://news.yahoo.co.jp/articles/1c059f8a81e0806bee488bf79ac7e8797e94966b,11/19(火) 7:50
2024-11-19,09:28,domestic,国内,5,日刊スポーツ,石破茂首相、各国首脳挨拶に立ち上がらず対応し「日本の恥」Ｘトレンド「品格ない」「立てよ」,https://news.yahoo.co.jp/articles/99e7ac76bf2fd4b582f60554345af43f6c9dcb13,11/19(火) 6:18
2024-11-19,09:28,domestic,国内,6,産経新聞,再選斎藤氏、辞職促された吉村氏と微妙な距離感にじませ…百条委に協力も「対応問題ない」,https://news.yahoo.co.jp/articles/5168db259dfcd14c37385e0ec3902c76fa9b0a65,11/18(月) 22:05
2024-11-19,09:28,domestic,国内,7,デイリースポーツ,「何なんですか！この人たちは」橋下徹氏が速攻寝返った兵庫県の一部市長にあきれ顔「補助金大きいからベタ降りする」,https://news.yahoo.co.jp/articles/c382b657d2445dab507d438c6c31fdf79602b7b8,11/18(月) 17:45
2024-11-19,09:28,domestic,国内,8,共同通信,【独自】横転車両、鍵の管理不備か　埼玉栄高、生徒死亡事故,https://news.yahoo.co.jp/articles/5acc62aed719736355b36222e389ac28d4452bc6,11/18(月) 20:17
2024-11-19,09:28,domestic,国内,9,日本ファクトチェックセンター,「斎藤氏の支持者がデマを熱狂的に信じた」という言説の落とし穴　兵庫県知事選・後編【解説】,https://news.yahoo.co.jp/articles/3f7391b11bc5f82068f0045fcec3c939731ba204,11/18(月) 16:16
2024-11-19,09:28,domestic,国内,10,日刊スポーツ,池上彰氏が石破首相の外交マナーに苦言　中国・習近平主席との握手めぐり「外交慣例では…」,https://news.yahoo.co.jp/articles/7ce6b265fc71156ae8183541facf77b595037bf4,11/18(月) 18:00
2024-11-19,09:28,domestic,国内,11,スポーツ報知,「紀州のドン・ファン」元妻への無期懲役求刑に若狭弁護士驚き「３０年ぐらいかと思っていた」,https://news.yahoo.co.jp/articles/be5b3b64db586ff909273ca643aa4fa0c2fc2b53,11/19(火) 6:20
2024-11-19,09:28,domestic,国内,12,産経新聞,斎藤氏不信任の県議会は「解散が筋」、市長会の支持「1人で言え」　元市長の樋渡啓祐氏,https://news.yahoo.co.jp/articles/449f28e1eabe3639e693e16757b84a37c59e9901,11/18(月) 14:01
2024-11-19,09:28,domestic,国内,13,スポニチアネックス,N党党首・立花孝志氏　国政復帰の野望　反・斎藤元彦氏の“22市長の1人”が現職…南あわじ市長選出馬へ,https://news.yahoo.co.jp/articles/a3e6a701377bfdf3c80f207ea6c455b5bc5ceafa,11/19(火) 4:40
2024-11-19,09:28,domestic,国内,14,産経新聞,斎藤氏、稲村氏支持3市長「なぜか事務所に来た」　吉村氏の祝福メールは「寝て返信せず」,https://news.yahoo.co.jp/articles/d1edc24bfc52dc44d56d36d40cba09769b9013a4,11/18(月) 14:52
2024-11-19,09:28,domestic,国内,15,共同通信,【独自】働く高齢者の年金減「緩和」へ　厚労省、人手不足対策で,https://news.yahoo.co.jp/articles/7f0784c25d118fb720b119ac0ee55b8d9d62e24d,11/19(火) 6:00
2024-11-19,09:28,domestic,国内,16,レスキューナウニュース,阪急京都本線で人身事故 運転見合わせ,https://news.yahoo.co.jp/articles/238015be2fb3c68420e4e3a66dcd4beaf44a5c34,11/18(月) 22:40
2024-11-19,09:28,domestic,国内,17,時事通信,「トランプ会談」仕切り直し　自信暗転、石破首相に痛手,https://news.yahoo.co.jp/articles/493fe8616719880526f00bfe3af966b407ebfa9b,11/19(火) 7:04
2024-11-19,09:28,domestic,国内,18,カナロコ by 神奈川新聞,兵庫県知事選は予想外…神戸出身の神奈川・黒岩知事「わが郷土はどうなっているのか」,https://news.yahoo.co.jp/articles/552bd33302bff5a388213224955bc96101b1e8b8,11/18(月) 22:10
2024-11-19,09:28,domestic,国内,19,読売新聞オンライン,兵庫県知事選で再選の斎藤前知事「民意を得た」…失職から１か月半、県議・職員は戸惑いや不安,https://news.yahoo.co.jp/articles/141621260cc8ad938c189e89d3eae962ab92506d,11/19(火) 7:43
2024-11-19,09:28,domestic,国内,20,読売新聞オンライン,兵庫県知事選挙で落選の稲村和美氏陣営、選挙中にＸアカウント２度凍結…「組織的に虚偽通報された」と主張,https://news.yahoo.co.jp/articles/233ed110f11ce4681b919cfc20d17ef201bd4416,11/18(月) 19:21
2024-11-19,09:28,domestic,国内,21,よろず～ニュース,前川喜平氏、兵庫県知事選「正気が狂気に敗れた」斎藤氏の当選を嘆く→ネット「有権者を馬鹿にしすぎ」,https://news.yahoo.co.jp/articles/0d5c69cd8a1af6ff6bb3f1640052371bfa01503d,11/18(月) 12:15
2024-11-19,09:28,domestic,国内,22,みんかぶマガジン,「豚肉が入ってるぞ！」イスラム教徒を激怒させた日本のレストランに呆れるフランス哲学者「自民党はこの店と同じ対応して負けた」,https://news.yahoo.co.jp/articles/f700130f52fc53dcd8d1b2b6e323de92af4dfabd,11/18(月) 9:10
2024-11-19,09:28,domestic,国内,23,日刊スポーツ,相生市長の机バンバン動画に批判相次ぐ　兵庫県知事選めぐり「なんでいちいち机叩いて話すの？」,https://news.yahoo.co.jp/articles/f24f1149205484a13b3118f0040aa4a62e318a4c,11/18(月) 12:09
2024-11-19,09:28,domestic,国内,24,中日スポーツ,「闇深すぎ」「しっかり説明を」知事再選・斎藤元彦氏の疑惑を追及した『百条委』メンバーが辞職　ネット大騒ぎ,https://news.yahoo.co.jp/articles/16c377c9e623dedc9b965c05ddfadccae3621650,11/18(月) 19:32
2024-11-19,09:28,domestic,国内,25,FNNプライムオンライン,【独自】クレーンで人を吊り上げ危険な伐採作業「すごいことするな」15m超える高さで何度も移動…業者「それしか方法がなくやってしまった」,https://news.yahoo.co.jp/articles/4c2455807a5a34ee2d156626205df317e1f2e677,11/18(月) 20:47
2024-11-19,09:28,domestic,国内,26,産経新聞,立花氏「援護射撃」1500万回再生、斎藤氏の12倍　兵庫知事選、ネット動画の爆発力,https://news.yahoo.co.jp/articles/5c6a01496d677fc91e952b3f3e60eafc6e34adda,11/19(火) 8:14
2024-11-19,09:28,domestic,国内,27,夕刊フジ,「安倍の敵」「対中融和」石破首相、トランプ氏と「1分も会えない衝撃」の面会断念、大丈夫か日米同盟　習主席からは〝秋波〟も,https://news.yahoo.co.jp/articles/ade8d4f8e0ab1c3adb41ef22f6514d956354935b,11/18(月) 17:00
2024-11-19,09:28,domestic,国内,28,読売新聞オンライン,要請受けヒグマ駆除し猟銃所持許可の取り消し判決、猟友会「やっていられない」…道知事ら捕獲体制強化を要望,https://news.yahoo.co.jp/articles/86162f1132d4d7a7d3777d7d341efc6f868fdb88,11/18(月) 22:08
2024-11-19,09:28,domestic,国内,29,読売新聞オンライン,兵庫県議会、百条委メンバーの竹内英明氏が議員辞職…知事選を巡りＳＮＳで誹謗中傷受けたか,https://news.yahoo.co.jp/articles/909ae5360f91ab2bde62b1e5f48827fe1fba0eef,11/18(月) 20:34
2024-11-19,09:28,domestic,国内,30,みんかぶマガジン,なぜオワコン維新を大阪人は愛すのか…在阪ネット論客が語る3つの理由「みな自分の生活で頭いっぱい」ホームレス広場が綺麗な公園に,https://news.yahoo.co.jp/articles/ad8248b3c2c79a15ff0099f9e97f30a7a603a9f0,11/19(火) 9:10
2024-11-19,09:28,domestic,国内,31,デイリースポーツ,玉川徹氏が危機感　兵庫知事選「メディアが嘘」「テレビがわざと間違い」と投票者の声を紹介→「既存メディアは本当に考えないと」,https://news.yahoo.co.jp/articles/0d4e651f7793134bac4e0037a3a203300032f482,11/18(月) 12:20
2024-11-19,09:28,domestic,国内,32,デイリースポーツ,鈴木エイト氏が注意勧告「斎藤元彦氏演説に詰めかけた人の熱量を過大評価しないよう」オールドメディア敗北論にも私見,https://news.yahoo.co.jp/articles/de12ea767df85a8bde7a38a487eb8c9b94421af7,11/18(月) 16:08
2024-11-19,09:28,domestic,国内,33,弁護士JPニュース,「どうか、お父さんを連れて行かないで下さい」　フィリピン人男性への“退去強制処分”の取り消しと在留許可を求める訴訟が始まる,https://news.yahoo.co.jp/articles/7f8bde3a20ca738138d626c7ea95b1d35ae07361,11/18(月) 18:24
2024-11-19,09:28,domestic,国内,34,東海テレビ,道路渡っていた76歳男性が原付バイクにはねられ死亡 58歳運転手を現行犯逮捕 住宅街にある信号のない交差点,https://news.yahoo.co.jp/articles/48a4c95a9c72cb3dda305c6d7d78adbf15413373,11/19(火) 6:34
2024-11-19,09:28,domestic,国内,35,ABEMA TIMES,「103万円の壁」の問題点とは？石破政権はどうする？元議員「200万円まで持っていけば勝ち」,https://news.yahoo.co.jp/articles/993d8056918123d6538cb9697258c216bcf3b537,11/19(火) 6:50
2024-11-19,09:28,domestic,国内,36,関西テレビ,「斎藤さんを完全否定した議会が百条委を継続する正当性はあるのか」と維新・吉村氏【兵庫県知事選】,https://news.yahoo.co.jp/articles/711df82189490c98fd98fa7372523bb5e3ea7962,11/18(月) 16:32
2024-11-19,09:28,domestic,国内,37,毎日新聞,車いすインフルエンサーにＸで殺害予告　20代会社員を脅迫容疑で逮捕,https://news.yahoo.co.jp/articles/fae5f496faa1b1eb363d19a84be61887876ae505,11/19(火) 7:00
2024-11-19,09:28,domestic,国内,38,産経新聞,百条委員の兵庫県議が辞職、一身上の都合理由に　立憲議員らの「ひょうご県民連合」,https://news.yahoo.co.jp/articles/110245e7329115051fc5f5baafdc40ee39dc6957,11/18(月) 19:01
2024-11-19,09:28,domestic,国内,39,日刊スポーツ,注目27歳芦屋市長が斎藤元彦氏に祝意　稲村氏支援22市長に加わらず「新たなリーダーと連携」,https://news.yahoo.co.jp/articles/e4462d7c604ce774aab88d4cc2081b03fb208d7e,11/18(月) 15:20
2024-11-19,09:28,domestic,国内,40,読売新聞オンライン,オフィス家具大手イトーキ、運送業者に対価払わず一部「ただ働き」常態化か…公取委が警告へ,https://news.yahoo.co.jp/articles/fbbc0f25620026edc2944d49dc4a66535036cbf7,11/19(火) 5:00
