scrp_date,scrp_time,genre_en,genre_jp,rank,media_jp,title,link,date_original
2026-02-17,16:26,domestic,国内,1,ABEMA TIMES,50歳で出産・野田聖子議員（65）、生後2年以上入院した息子の幼少期と現在の比較写真を公開,https://news.yahoo.co.jp/articles/ad875e67707ccc3d33ea0a9bf3879cfe0a6756fb,2/17(火) 13:12
2026-02-17,16:26,domestic,国内,2,毎日新聞,「こんなデタラメな選挙許せない」　栃木で中道の元議員2人が離党へ,https://news.yahoo.co.jp/articles/d8f8675c9cf0b47a340c3d54886cd0f91d6b20b8,2/17(火) 15:11
2026-02-17,16:26,domestic,国内,3,J-CASTニュース,「なぜ俺に回ってくるのか」　泉健太氏、深夜のつぶやきに中道元議員ら続々反応→午後には「素晴らしい副議長人事」,https://news.yahoo.co.jp/articles/e4a050298c4d61ef1b4c00650f3f5adc9906fcaf,2/17(火) 13:15
2026-02-17,16:26,domestic,国内,4,日刊スポーツ,れいわ・女性新共同代表が壮絶決意表明「全身火あぶりにされたような心境」「一切忖度しません」,https://news.yahoo.co.jp/articles/69faae8b23db452015b1353b256e35c713e7df05,2/17(火) 9:20
2026-02-17,16:26,domestic,国内,5,ABEMA TIMES,「中道の落選議員が国民民主に入りたい、と希望してきたら受け入れる？」記者の質問に玉木代表の回答は,https://news.yahoo.co.jp/articles/2b7de96267f0398a4688e18c69d42c8716be74af,2/17(火) 11:30
2026-02-17,16:26,domestic,国内,6,日刊スポーツ,中道と“どっちが野党第１党”問題に国民・玉木雄一郎氏が言及「衆参合わせて何人が１つの判断」,https://news.yahoo.co.jp/articles/82c7c3a14471715f5bae627e25dc091c5155bfbd,2/17(火) 14:41
2026-02-17,16:26,domestic,国内,7,J-CASTニュース,自民・中道「約2:1の比率なのに...」乙武洋匡さんが「小選挙区比例代表並立制」めぐり公明党の主張取り上げ,https://news.yahoo.co.jp/articles/683017b36bdba7613b1b1298098b7d0d28053755,2/17(火) 13:45
2026-02-17,16:26,domestic,国内,8,共同通信,公明出身の石井氏を衆院副議長に　中道が泉氏から方針転換,https://news.yahoo.co.jp/articles/a4d366fdaeb6d48ae4d1652a099fb35cc4c032a9,2/17(火) 11:49
2026-02-17,16:26,domestic,国内,9,日刊スポーツ,百田尚樹氏、ついに井川意高氏をミュートし「ストーカー」と指摘　井川氏も「クソクズ」と返答,https://news.yahoo.co.jp/articles/9c157686e7a757424f6e9ef034f61b6d92f4d78d,2/17(火) 8:28
2026-02-17,16:26,domestic,国内,10,ABEMA TIMES,「リベラル思想は有事の時は蒸発する」リベラル勢力の大惨敗に宮崎謙介氏が私見,https://news.yahoo.co.jp/articles/727e066f960b5f3c6c2cbbe806add73b024bfd46,2/17(火) 12:30
2026-02-17,16:26,domestic,国内,11,スポーツ報知,政界引退から１年「ヤンキー先生」激変した現在の姿「え！」「だいぶ変わって」「誰かわからない」義家弘介氏がイケオジ化,https://news.yahoo.co.jp/articles/51d024aebf8aab8d44e253ff66d9e8869d4bd14b,2/17(火) 14:20
2026-02-17,16:26,domestic,国内,12,ABEMA TIMES,「野党第一党」は中道or国民どっち？ 続く議論に終止符？ 国民・玉木代表が丁寧に説明,https://news.yahoo.co.jp/articles/9327e5cb8c3d69143afb6c0c8a2bbc01bab21527,2/17(火) 12:30
2026-02-17,16:26,domestic,国内,13,日刊スポーツ,自民党新人議員66人が初の研修会に出席「発言に気をつけてほしい」鈴木幹事長が念を押す,https://news.yahoo.co.jp/articles/6dff726a7b01c52138dce4850f5fc7b995999f56,2/17(火) 14:14
2026-02-17,16:26,domestic,国内,14,共同通信,佐藤副長官の対応見直しへ　参院、野党が協議,https://news.yahoo.co.jp/articles/57db4c79e7ff7995c279f1324a84d15d1e0f49f3,2/17(火) 12:55
2026-02-17,16:26,domestic,国内,15,読売新聞オンライン,深夜の玄関前に頭から血を流した女性「強盗に入られて、火をつけられた」…「私は２階から飛び降りた」「旦那がまだ家の中にいる」とパニックに,https://news.yahoo.co.jp/articles/3813572539021eafd9a78e664ebf3d592556ad21,2/17(火) 12:09
2026-02-17,16:26,domestic,国内,16,ABEMA TIMES,「なんじゃこりゃー！」永瀬拓矢九段の“トロ三原色”本鮪重が話題 ファン騒然「しゅごい」「ハイ優勝」 藤井聡太王将は彩り天丼,https://news.yahoo.co.jp/articles/53818fd382168fb87d59b3d967c090fc5d44fba0,2/17(火) 15:03
2026-02-17,16:26,domestic,国内,17,読売新聞オンライン,高校のミスで指定校推薦得られず、卒業生への賠償命じる判決…必修科目を掲示せず「他の受験機会失われ権利侵害」,https://news.yahoo.co.jp/articles/984629635c3f56e873de20c0ab536054ec0ea54f,2/17(火) 16:06
2026-02-17,16:26,domestic,国内,18,レスキューナウニュース,西武新宿線で人身事故 一部運転見合わせ,https://news.yahoo.co.jp/articles/9f46a2e1c5ea0141ee242e0319911a3da57dd240,2/17(火) 15:25
2026-02-17,16:26,domestic,国内,19,スポニチアネックス,中道・泉健太氏「なぜ俺に回ってくるのか」早朝に困惑投稿→党の方針転換を評価「素晴らしい副議長人事」,https://news.yahoo.co.jp/articles/5640b2ed9f141ad8b8c6a24247d055622c5362c7,2/17(火) 15:46
2026-02-17,16:26,domestic,国内,20,弁護士JPニュース,神奈川県警、交通違反2700件“でっち上げ”で巡査部長ら書類送検へ　「最高で15年拘禁刑」の重罪か,https://news.yahoo.co.jp/articles/47faae8a7d2aa025fe051f2ea57c7580e711e33b,2/17(火) 11:15
2026-02-17,16:26,domestic,国内,21,選挙ドットコム,原則は全員が小選挙区で戦うべき！伊佐進一衆院議員が語る中道改革連合の生存戦略と、公明党出身者が「比例単独」で臨んだ真の理由とは？,https://news.yahoo.co.jp/articles/5a17e663c90ca9bfb916d1c1569a023096bf3857,2/17(火) 9:31
2026-02-17,16:26,domestic,国内,22,よろず～ニュース,田久保前市長の家宅捜索が示した県警の「本気度」元刑事が解説、次は“卒業証書”保管の弁護士事務所も？,https://news.yahoo.co.jp/articles/55f1c3837000762c961cd40085119af6de89bed6,2/17(火) 12:30
2026-02-17,16:26,domestic,国内,23,FNNプライムオンライン,マジで可愛がってくれる先輩「気を付けて帰りや」が最後の言葉に…大阪・道頓堀で刺され死亡した17歳の男性 　容疑者は女性への迷惑行為を注意され犯行か,https://news.yahoo.co.jp/articles/2dfedf22bc4194b6d967e40e61b922bebefb6cca,2/16(月) 18:57
2026-02-17,16:26,domestic,国内,24,日刊スポーツ,小泉進次郎防衛相、レジェンド女性歌手の投稿に感謝「自衛隊員の励みになります」,https://news.yahoo.co.jp/articles/f0faaa722f3ecaa7f0f768295afaf22bac58ad22,2/17(火) 11:18
2026-02-17,16:26,domestic,国内,25,テレビ朝日系（ANN）,衆院委員長ポスト2つ除き与党独占,https://news.yahoo.co.jp/articles/15cf7ff28d6279fe77b1905cd94f93ae65575160,2/17(火) 14:01
2026-02-17,16:26,domestic,国内,26,共同通信,プロ野球広島選手を起訴　指定薬物使った罪,https://news.yahoo.co.jp/articles/3764b6309003c18924c845973477523984f30b2b,2/17(火) 11:39
2026-02-17,16:26,domestic,国内,27,TBS NEWS DIG Powered by JNN,"「JKにしかできない“特別感”」女子高生がハマる「JKケーキ」とは?【THE TIME,】",https://news.yahoo.co.jp/articles/624ff96eab60a4ed8f9b18745bd5eb7f1365a3fa,2/17(火) 7:00
2026-02-17,16:26,domestic,国内,28,読売新聞オンライン,はしか感染の３０代男性、東京駅構内の飲食店で不特定多数と接触か…上越新幹線やバスも利用,https://news.yahoo.co.jp/articles/f2a45887ee8098cead8ded59da1c22a56bd1dcc9,2/17(火) 14:59
2026-02-17,16:26,domestic,国内,29,読売新聞オンライン,面接中に保護司の背後からナイフで首に切りつけた男、「なんでこんなことするんや」との問いかけにも答えず…初公判で検察側「保護観察制度への攻撃だ」,https://news.yahoo.co.jp/articles/17196452a6c84d13cc5c405f8e9708e09f99d55c,2/17(火) 15:40
2026-02-17,16:26,domestic,国内,30,読売新聞オンライン,道頓堀３人死傷の容疑者、事件前日に初めて会った女性に折りたたみナイフ見せ「病院送りにしたことがある」…事件後「グリ下にいられなくなった」と電話,https://news.yahoo.co.jp/articles/e5e3074beeb5147a0f8fc8cbd269f2ea86da5072,2/16(月) 13:05
2026-02-17,16:26,domestic,国内,31,FNNプライムオンライン,【全掲載】福岡県警の春の人事異動　警部（相当職含む）以上590人　総務部長に西村氏、刑事部長に清末氏　一部を除き3月3日発令,https://news.yahoo.co.jp/articles/816e1cf49773240ba803b2efbff6b05bcbfcabb5,2/17(火) 15:03
2026-02-17,16:26,domestic,国内,32,デイリースポーツ,【中道】泉健太氏「なぜ俺に？」副議長人事に不満隠せず　小川新代表へ「きっと適材適所の人事に」と願う,https://news.yahoo.co.jp/articles/d827f7d01c80c097d032ca8433db648a8eef3435,2/17(火) 11:09
2026-02-17,16:26,domestic,国内,33,FNNプライムオンライン,「まさか持ち上げて…」“エッホエッホ”大胆にバイク運び出す4人組…犯行直前に下見も　同様事件も発生　東京・足立区,https://news.yahoo.co.jp/articles/48ac951fc976d39b23b25cfefb3e30aefa72c5a5,2/17(火) 14:30
2026-02-17,16:26,domestic,国内,34,毎日新聞,容疑者が送検に抵抗　署の留置場から出ず　大阪・ミナミ3人死傷,https://news.yahoo.co.jp/articles/f618778dbda5cb47e79985afbd961625b425321e,2/17(火) 10:31
2026-02-17,16:26,domestic,国内,35,J-CASTニュース,古市憲寿氏、「バンキシャ」報道に指摘の鈴木貴子氏を批判　「政治家の権力性を理解していない」,https://news.yahoo.co.jp/articles/bd119b63ba1709216d76497efb7972b22834f563,2/16(月) 12:47
2026-02-17,16:26,domestic,国内,36,日刊スポーツ,石丸伸二氏「必ず殴り返します」太田光の高市首相への対応は「イジわるな聞き方、仕返しします」,https://news.yahoo.co.jp/articles/95bb57751c94cdcc0aeeec30dc8401138f56fd01,2/16(月) 10:42
2026-02-17,16:26,domestic,国内,37,時事通信,れいわ幹事長に山本譲司氏,https://news.yahoo.co.jp/articles/58daec5a33086704bd5df5249b8bdf4cd773c3c0,2/17(火) 11:43
2026-02-17,16:26,domestic,国内,38,毎日新聞,相談相手はAIだけ 平成不況で敗者復活ならず、孤独な団塊ジュニアがそれでも抱く希望,https://news.yahoo.co.jp/articles/58e771864e8333b45523c848a994f7372be9a7d2,2/16(月) 17:02
2026-02-17,16:26,domestic,国内,39,産経新聞,中道・階猛氏が俳優の息子と代表選反省会「公明が住民票移動」発言念頭に「一番の反省点」,https://news.yahoo.co.jp/articles/7ef3f1b0a65cd2da0c484ff26d1798e3c70a925d,2/17(火) 7:00
2026-02-17,16:26,domestic,国内,40,FNNプライムオンライン,立憲・杉尾秀哉長野県連代表「新党結成はマイナス多かった」中道は小選挙区議席ゼロ「説明から始まる選挙になり厳しかった」,https://news.yahoo.co.jp/articles/6c696077348037008578e6bb32e97f2c6fe52071,2/10(火) 16:57
