scrp_date,scrp_time,genre_en,genre_jp,rank,media_jp,title,link,date_original
2025-05-02,09:31,TTL,総合,1,Full-Count,前田健太が事実上の戦力外　タイガース発表…7試合で防御率7.88、2年34億円契約の最終年,https://news.yahoo.co.jp/articles/3b0b9723b8f1fdf96901c12c4e053043a6ab706d,5/2(金) 7:32
2025-05-02,09:31,TTL,総合,2,信濃毎日新聞デジタル,スマホのサブスク解約したはずが…「無駄払い」4年で10万円　「アプリ削除したのに…」 全国で相談も急増　死後に請求続くこともある”見えない契約”の注意点は,https://news.yahoo.co.jp/articles/4c9a0954f80f65bbd92ff8d95d59a572ac241ec2,5/2(金) 6:30
2025-05-02,09:31,TTL,総合,3,サンケイスポーツ,巨人、歓喜の輪で田中将大にウォーターシャワー！？　悔しさ抱えるベテランを大勢と船迫大雅が笑顔に,https://news.yahoo.co.jp/articles/fa048fb5f04cf2b688066966fd233332d472046b,5/1(木) 23:59
2025-05-02,09:31,TTL,総合,4,J-CASTニュース,「ベッド下にアジア系の男が」都内ホテルで侵入騒ぎ　ウクライナ出身女性が恐怖体験投稿、警察も出動,https://news.yahoo.co.jp/articles/3ec87a91cfd125fd042085f4ae223339004c4f47,5/1(木) 18:29
2025-05-02,09:31,TTL,総合,5,イーファイト,“三十路ラウンドガール”高橋凛、巨大化するヒップ公開！「育尻中」,https://news.yahoo.co.jp/articles/11e24a477edaf857eb31bac4b3e4e7b6390f3830,5/2(金) 6:35
2025-05-02,09:31,TTL,総合,6,日刊スポーツ,元鉄工所勤務25歳グラドルが10キロ減量で激変、鼻整形も否定→ビフォーアフター写真公開,https://news.yahoo.co.jp/articles/54130becf15f487d790e063d7551316d0b348eda,5/2(金) 6:46
2025-05-02,09:31,TTL,総合,7,スポーツ報知,「誰？」「一瞬わからなかった」２８歳女優　激変姿にネット衝撃「別人」「二度見しちゃった」,https://news.yahoo.co.jp/articles/f3acf2e92664e41d819480634a1aa32c20a0d2db,5/1(木) 18:15
2025-05-02,09:31,TTL,総合,8,Full-Count,鈴木誠也、2打席連続9号2ラン　4年連続2桁HRに王手…驚異の年45発ペース、3打点で勝利貢献,https://news.yahoo.co.jp/articles/bb1c1e77af122171fbafc09df41c4dd5314d778f,5/2(金) 3:25
2025-05-02,09:31,TTL,総合,9,デイリースポーツ,前田健太、事実上の戦力外　年俸14・5億円　タイガース発表　メジャー10年目は7登板で防御率7・88,https://news.yahoo.co.jp/articles/921fa5cec236159fc300a796efecd920bcbe3748,5/2(金) 7:19
2025-05-02,09:31,TTL,総合,10,ねとらぼ,「大谷翔平が娘の名前を公表」　YouTubeなどで「デマ画像」の投稿相次ぐ　生成AI活用か……　「ひどい」非難の声も,https://news.yahoo.co.jp/articles/568c48d95bafba697294d3eb3c7052775297c717,5/2(金) 7:00
2025-05-02,09:31,TTL,総合,11,スポニチアネックス,安田顕　同じマンションに住んでいた人気女優明かす　フロアも同じ「うるせえな！って思ったら…」,https://news.yahoo.co.jp/articles/b290492b927db2ed409656e13436ff32fce68a02,5/1(木) 20:58
2025-05-02,09:31,TTL,総合,12,FNNプライムオンライン（フジテレビ系）,行方不明の20歳女性の関係者ら約50人が“警察の対応”に抗議…警察官ともみ合いになるなど一時騒然　川崎市,https://news.yahoo.co.jp/articles/70c0655769f6bfd40548de2b317666a2c8f413bf,5/1(木) 18:58
2025-05-02,09:31,TTL,総合,13,Full-Count,千賀滉大がウイルスに感染、点滴受け強行登板　試合後も顔色悪く「決して良くはない」,https://news.yahoo.co.jp/articles/0799b8bf35093c87aaf1306d27bc800a54811fef,5/2(金) 8:51
2025-05-02,09:31,TTL,総合,14,ねとらぼ,メガネ模様の子犬→成長したら……　「やば」「こりゃーたまらん」予想外の姿に大反響「アザラシの子どもって感じ」,https://news.yahoo.co.jp/articles/d7308ffe1c89e206d9156da851b7ad7848d9e49a,5/1(木) 20:00
2025-05-02,09:31,TTL,総合,15,日刊スポーツ,オール巨人、ヒッチハイク中の学生を京都まで送り「僕オール巨人やで！って言ったら…」,https://news.yahoo.co.jp/articles/2605052bfff2555cbe190a8a00562ceebd7cc43d,5/1(木) 20:45
2025-05-02,09:31,TTL,総合,16,ゴルフ総合サイト ALBA Net,＜速報＞渋野日向子は初日2アンダー「70」　西郷真央が連続バーディで浮上,https://news.yahoo.co.jp/articles/c7fd7eda1bd9f0392b65c8bd9fa7ef0bfd02f1e9,5/2(金) 8:37
2025-05-02,09:31,TTL,総合,17,スポーツ報知,９回の大ピンチで巨人・阿部監督が異例の行動　田中瑛斗、徹底してシュートでホームゲッツー…救援陣７投手が無失点リレー,https://news.yahoo.co.jp/articles/d757bf497115e4b9a71c112537b22259a287d075,5/2(金) 5:20
2025-05-02,09:31,TTL,総合,18,ENCOUNT,紙コップ提供で物議の“万博のアフタヌーンティー”　投稿者が騒動の誹謗中傷に困惑、英国側からは直接連絡,https://news.yahoo.co.jp/articles/1203df7940624ea32638fda2360876f1acbf9912,5/1(木) 18:50
2025-05-02,09:31,TTL,総合,19,スポーツ報知,「週５勤務」会社員に転身の片瀬那奈、変わらぬ美貌に衝撃「脚長い！！！！！」「相変わらず綺麗」と絶賛,https://news.yahoo.co.jp/articles/d9840e9efdd738718d908a451978c5d53b3143b6,5/2(金) 5:55
2025-05-02,09:31,TTL,総合,20,ABEMA TIMES,何が起きた？ 大谷翔平の目の前で“想定外のハプニング”「どうした」「怖っ！」 相手投手がとんでもない大暴投→一気に爆速生還「実質ホームランやん」,https://news.yahoo.co.jp/articles/722f2268a1ab2f984558e637286d8e2ee109a024,5/2(金) 6:32
2025-05-02,09:31,TTL,総合,21,Full-Count,前田健太が事実上の戦力外に　米記者報道…7試合で防御率7.88、2戦連続無失点も,https://news.yahoo.co.jp/articles/5f3462f0fbd1138d052a462d9f41ab840f551c78,5/2(金) 6:58
2025-05-02,09:31,TTL,総合,22,ハフポスト日本版,大阪万博で話題のアフタヌーンティーがSNSの声で劇的変化。カップは紙から陶磁器に、ケーキは？英国大使館に聞いた,https://news.yahoo.co.jp/articles/a22f57a509dfcd0ab662a794c5e0c9d369b92418,5/1(木) 16:59
2025-05-02,09:31,TTL,総合,23,TBS NEWS DIG Powered by JNN,男子小学生が特急電車と衝突し死亡　裸足に手ぶら… 列車の車載カメラに1人で線路内入る様子　JR内房線・五井駅近く　千葉・市原市,https://news.yahoo.co.jp/articles/65713da74cfbddc72b7f8c6de852af576bfc1725,5/2(金) 3:05
2025-05-02,09:31,TTL,総合,24,スポニチアネックス,日本ハム・新庄剛志監督　上沢の印象聞かれ「ファイターズの時には、全くしてなかった…」,https://news.yahoo.co.jp/articles/0c0a6784339882a58af8aa249fdb125e64cec089,5/1(木) 22:10
2025-05-02,09:31,TTL,総合,25,スポニチアネックス,「マヂカルラブリー」村上　昨年末購入の新居の値段明かす「約35年のローンやってますよ」,https://news.yahoo.co.jp/articles/9e6a09e39215bfd435873d876314d00bcf7f6a98,5/2(金) 6:40
2025-05-02,09:31,TTL,総合,26,ベースボールキング,鷹・野村勇が8回にまさかの走塁ミスでチャンス潰す…坂口氏「100パーセント自信があっても行くべきではない場面」とバッサリ,https://news.yahoo.co.jp/articles/1d0598bff9417d2acbd7eed47cef7198b19617cd,5/2(金) 6:50
2025-05-02,09:31,TTL,総合,27,ねとらぼ,ペットが突然、シッポを自ら切断→1週間後……　「マジでびっくり」「なんで」ド肝を抜く“変化”に反響,https://news.yahoo.co.jp/articles/dc451cd36017251373607b20b73a77b783ce3e86,5/1(木) 21:05
2025-05-02,09:31,TTL,総合,28,オリコン,『あんぱん』一瞬チラリ重要人物　ネット困惑「なんで？」「どこで情報を…」【ネタバレあり】,https://news.yahoo.co.jp/articles/dd0a0be89623add4a99c734380f3e422a93abe48,5/2(金) 8:15
2025-05-02,09:31,TTL,総合,29,スポニチアネックス,浅香唯　結婚まで交際15年　ずっとお断りしていたワケ「結婚するならこの人かなと思っていたんですが…」,https://news.yahoo.co.jp/articles/ae402ab410aa38aacbdb856f9327fcb3d8df2524,5/2(金) 6:20
2025-05-02,09:31,TTL,総合,30,西スポWEB OTTO！,夫は日テレアナ　新婚・美人妻「今から楽しみ」報告 & 近影にファン仰天「信じられない」「楽しみましょ！」,https://news.yahoo.co.jp/articles/bd8a746743c8d662954b5a0016d99786769bb9af,5/1(木) 23:50
2025-05-02,09:31,TTL,総合,31,スポニチアネックス,浅香唯　交際含めると約40年の夫と記念日に必ず行う儀式　「気持ち悪いですよね」,https://news.yahoo.co.jp/articles/e6783450f7333a9278cb9bf20df27388a8bfe209,5/2(金) 6:50
2025-05-02,09:31,TTL,総合,32,withnews,誰も知らない42歳の死…現役世代の孤独死　就職氷河期世代「自分もいつかひとりぼっちで死ぬんだ」,https://news.yahoo.co.jp/articles/5d78a516b2b48142ea63765be6c2fbe0637f1e23,5/2(金) 7:02
2025-05-02,09:31,TTL,総合,33,Full-Count,巨人を「絶対に負かさないとアカン」　受けた父の影響…TV観戦で激怒「恐ろしいくらい」,https://news.yahoo.co.jp/articles/64db7ca5dd30f281f198f83e079b91c42ac10504,5/2(金) 6:50
2025-05-02,09:31,TTL,総合,34,デイリースポーツ,阪神、勝敗分けた同点五回　田中コーチ「ミスがあったとかではない」坂本の二塁送球→小幡のタッチより早く三走生還,https://news.yahoo.co.jp/articles/9bd87b71c0b8ff80cab0b6053212f06cd6c3dcdb,5/2(金) 5:01
2025-05-02,09:31,TTL,総合,35,デイリースポーツ,ドジャース、MLB95登板右腕ら救援2投手を“緊急補強”　コペックとトライネンを60日間負傷者リストへ移行,https://news.yahoo.co.jp/articles/1f884cbbfe1e2509e9b85997dd4497cf1c2deb49,5/2(金) 6:59
2025-05-02,09:31,TTL,総合,36,よろず～ニュース,立花孝志氏が参院選兵庫選挙区で立候補へ「決めました。全国じゃなくて」改選数3に9人出馬の大混戦に,https://news.yahoo.co.jp/articles/f8358c90ab19c534a145283a5593f303277544ea,5/2(金) 6:50
2025-05-02,09:31,TTL,総合,37,ABEMA TIMES,与野党こぞって減税ムード、その現実味は？立憲案“食料品消費税ゼロ”にひろゆき氏「金持ちがどんどん税金を払う方が税収は増える」,https://news.yahoo.co.jp/articles/26c135ada7168d3f51bfeb7e3e0580474cf2c5a7,5/2(金) 6:46
2025-05-02,09:31,TTL,総合,38,東スポWEB,【阪神】藤川監督の入れ替えは厳格すぎる？　「プロの大原則」「萎縮してしまう」の声,https://news.yahoo.co.jp/articles/5333205b2d28dd90260aca960b3eaa8512d2e650,5/2(金) 5:16
2025-05-02,09:31,TTL,総合,39,毎日新聞,埼玉・八潮の道路陥没　下水道管内で遺体を発見　運転手の男性か,https://news.yahoo.co.jp/articles/f3e2b59fbce8f939d049f392ef21ba11b869bdd0,5/2(金) 7:50
2025-05-02,09:31,TTL,総合,40,西スポWEB OTTO！,大物お笑い芸人の妻で有名タレント〝手作り〟お稽古弁当に反響「手を抜かない家事素晴らしいです」,https://news.yahoo.co.jp/articles/949a7a90e18845c95d492910dc61b5deac3543c9,5/2(金) 5:50
