scrp_date,scrp_time,genre_en,genre_jp,rank,media_jp,title,link,date_original
2025-05-02,09:31,domestic,国内,1,信濃毎日新聞デジタル,スマホのサブスク解約したはずが…「無駄払い」4年で10万円　「アプリ削除したのに…」 全国で相談も急増　死後に請求続くこともある”見えない契約”の注意点は,https://news.yahoo.co.jp/articles/4c9a0954f80f65bbd92ff8d95d59a572ac241ec2,5/2(金) 6:30
2025-05-02,09:31,domestic,国内,2,J-CASTニュース,「ベッド下にアジア系の男が」都内ホテルで侵入騒ぎ　ウクライナ出身女性が恐怖体験投稿、警察も出動,https://news.yahoo.co.jp/articles/3ec87a91cfd125fd042085f4ae223339004c4f47,5/1(木) 18:29
2025-05-02,09:31,domestic,国内,3,FNNプライムオンライン（フジテレビ系）,行方不明の20歳女性の関係者ら約50人が“警察の対応”に抗議…警察官ともみ合いになるなど一時騒然　川崎市,https://news.yahoo.co.jp/articles/70c0655769f6bfd40548de2b317666a2c8f413bf,5/1(木) 18:58
2025-05-02,09:31,domestic,国内,4,ハフポスト日本版,大阪万博で話題のアフタヌーンティーがSNSの声で劇的変化。カップは紙から陶磁器に、ケーキは？英国大使館に聞いた,https://news.yahoo.co.jp/articles/a22f57a509dfcd0ab662a794c5e0c9d369b92418,5/1(木) 16:59
2025-05-02,09:31,domestic,国内,5,TBS NEWS DIG Powered by JNN,男子小学生が特急電車と衝突し死亡　裸足に手ぶら… 列車の車載カメラに1人で線路内入る様子　JR内房線・五井駅近く　千葉・市原市,https://news.yahoo.co.jp/articles/65713da74cfbddc72b7f8c6de852af576bfc1725,5/2(金) 3:05
2025-05-02,09:31,domestic,国内,6,よろず～ニュース,立花孝志氏が参院選兵庫選挙区で立候補へ「決めました。全国じゃなくて」改選数3に9人出馬の大混戦に,https://news.yahoo.co.jp/articles/f8358c90ab19c534a145283a5593f303277544ea,5/2(金) 6:50
2025-05-02,09:31,domestic,国内,7,ABEMA TIMES,与野党こぞって減税ムード、その現実味は？立憲案“食料品消費税ゼロ”にひろゆき氏「金持ちがどんどん税金を払う方が税収は増える」,https://news.yahoo.co.jp/articles/26c135ada7168d3f51bfeb7e3e0580474cf2c5a7,5/2(金) 6:46
2025-05-02,09:31,domestic,国内,8,毎日新聞,埼玉・八潮の道路陥没　下水道管内で遺体を発見　運転手の男性か,https://news.yahoo.co.jp/articles/f3e2b59fbce8f939d049f392ef21ba11b869bdd0,5/2(金) 7:50
2025-05-02,09:31,domestic,国内,9,毎日新聞,元交際女性「殺されるかもしれない」　行方不明前日、母にメッセージ,https://news.yahoo.co.jp/articles/9ab727c7514320dbbcb70e0f9242b6a9c844dc8c,5/1(木) 22:52
2025-05-02,09:31,domestic,国内,10,共同通信,埼玉陥没、運転手とみられる人の死亡確認,https://news.yahoo.co.jp/articles/b3ab8483f5e9b721e1971ba9c9d1caa794ee72be,5/2(金) 7:58
2025-05-02,09:31,domestic,国内,11,ABEMA TIMES,生ゴミ問題を“ハエの幼虫”が解決 1キロの生ゴミが300グラムに激減「凄まじい勢いでゴミを資源化」,https://news.yahoo.co.jp/articles/03f941afc26ce43adb352cbf999a68a7f2b47f9b,5/2(金) 6:51
2025-05-02,09:31,domestic,国内,12,ABEMA TIMES,ネットギャンブルをした中学生の親が「損失分の調整を学校がしろ！」 “モンスターペアレンツ対処法”都教委が策定へ 千差万別な学校現場で必要な“マニュアル”とは？,https://news.yahoo.co.jp/articles/300db9c7c27c10a49aabe8a27d86829454d51fc1,5/2(金) 7:32
2025-05-02,09:31,domestic,国内,13,テレビ朝日系（ANN）,【八潮市陥没事故】トラック運転手を救出も死亡確認　遺族「かけがえのない存在」【遺族コメント全文】,https://news.yahoo.co.jp/articles/667bc7fc457798537135f34b23aa0592d69ca4a7,5/2(金) 8:18
2025-05-02,09:31,domestic,国内,14,産経新聞,「私と同列に扱われる内容ではない」国民民主・玉木氏　偽名不倫の平岩氏の離党届受理せず,https://news.yahoo.co.jp/articles/c8b6477878f4cdb7ef99bf72471b4a76d9831b43,5/2(金) 7:00
2025-05-02,09:31,domestic,国内,15,朝日新聞,危険交差点で自転車が「ボンッ」　記者の前で男子生徒ははねられた,https://news.yahoo.co.jp/articles/2247271d4e1373c27f6ae1fa55aefec03ef30416,5/2(金) 7:00
2025-05-02,09:31,domestic,国内,16,読売新聞オンライン,「傘５０円」「眼鏡８００円」引き取り手ない電車の忘れ物販売、一輪車やスキーブーツも…主婦「宝探しのよう」,https://news.yahoo.co.jp/articles/22332065619b5e4e6f3bcc9469ee1cde6747c07c,5/2(金) 7:36
2025-05-02,09:31,domestic,国内,17,テレビ朝日系（ANN）,【八潮市陥没事故】トラック運転手の死亡確認　「仕事に真面目で、とても温厚な方でした」【トラック運転手が所属する会社の代表のコメント】,https://news.yahoo.co.jp/articles/d5f9734f0676ee85031208c8cf80aab4ba8e62e2,5/2(金) 8:42
2025-05-02,09:31,domestic,国内,18,スポーツ報知,中田フィッシュ氏、自民党から比例代表で参院選出馬　オリラジ・中田敦彦の弟…兄から贈られた言葉を披露,https://news.yahoo.co.jp/articles/96528163467a377cf5e00956300930c3187a303b,5/2(金) 6:00
2025-05-02,09:31,domestic,国内,19,産経新聞,NHK党・立花氏　夏の参院選で比例代表ではなく兵庫選挙区から立候補する意向示す,https://news.yahoo.co.jp/articles/ca1360c63c691c77d0a46d38220ce780d42990f2,5/1(木) 23:00
2025-05-02,09:31,domestic,国内,20,読売新聞オンライン,埼玉・八潮の道路陥没、転落したトラックの運転席から遺体を搬出…運転していた７４歳男性か,https://news.yahoo.co.jp/articles/30c622f4be346777ad05ac877b490392ae844a84,5/2(金) 8:00
2025-05-02,09:31,domestic,国内,21,朝日新聞,埼玉・八潮の道路陥没から3カ月　掘削工事は近く完了、運転手救出へ,https://news.yahoo.co.jp/articles/cb5a705202414f4df89f299bc645e7f8179f375e,4/28(月) 9:00
2025-05-02,09:31,domestic,国内,22,東海テレビ,気付いた関係者が取り押さえる…駐車場の車内にあった約3万円など入った財布等を盗んだか 車上ねらいの48歳男逮捕,https://news.yahoo.co.jp/articles/88df5c26736471cb5cfc6b616fc0e9aade718dcb,5/2(金) 6:02
2025-05-02,09:31,domestic,国内,23,ABEMA TIMES,「体と心はボロボロだった」年収230万円、残業200時間…転職先も低賃金 氷河期世代の“ブラック企業連鎖”とは？当事者「“捨てられる民”にされてしまう恐怖があった」,https://news.yahoo.co.jp/articles/24cd701196af40b5bbd6ecef2f4a479992334c3a,5/2(金) 7:32
2025-05-02,09:31,domestic,国内,24,ENCOUNT,オリラジ中田の弟・中田フィッシュ氏、自民党に自ら売り込んだワケ　政局は「非常に厳しい」と本音も,https://news.yahoo.co.jp/articles/79dc6d2f06415edc68554c3b7bfa967cb29017e1,5/2(金) 7:40
2025-05-02,09:31,domestic,国内,25,ABEMA TIMES,「かわいそう」「窒息死している」物議を醸した万博の“ぬいぐるみベンチ”が撤去,https://news.yahoo.co.jp/articles/bbb2a3e31bebe80b5922fb8515553eed8c524fd0,4/29(火) 11:32
2025-05-02,09:31,domestic,国内,26,産経新聞,西成の7人負傷事件　容疑者を取り押さえたのは70代の学校支援員、元警察官だった,https://news.yahoo.co.jp/articles/f5528b2b8adfa4562000673bb85a4a143d15ca8e,5/1(木) 18:16
2025-05-02,09:31,domestic,国内,27,読売新聞オンライン,大阪・西成で児童７人はねた車、向きを変え下校の列に突っ込む…教員らが血だらけの児童救出,https://news.yahoo.co.jp/articles/3b39be01a4d03b41d77ecf80c0c4a2d5bf9a7330,5/1(木) 21:53
2025-05-02,09:31,domestic,国内,28,日刊スポーツ,「世も末」紀藤正樹弁護士　宮内庁職員が天皇家の生活費の一部を窃取,https://news.yahoo.co.jp/articles/c9f99001d01bef013f85b90e4f7fc752cb7d665c,5/2(金) 8:58
2025-05-02,09:31,domestic,国内,29,共同通信,「日本は戦略的自律を迫られる」　訪米の自民・小林鷹之氏,https://news.yahoo.co.jp/articles/907d5ef283644ebef29563cb5365bab17a14014a,5/2(金) 8:39
2025-05-02,09:31,domestic,国内,30,弁護士JPニュース,「経理経験者」のはずが“資質ナシ”、わずか1か月足らずで解雇…　不服訴える従業員に、裁判所の判断は,https://news.yahoo.co.jp/articles/fe49b0b5752117c2ce6b193b62a13eaf8ba2e6a7,5/1(木) 10:00
2025-05-02,09:31,domestic,国内,31,テレビ朝日系（ANN）,八潮陥没「4つの想定外」無線記録で判明,https://news.yahoo.co.jp/articles/36e82a9c83ab4d5941066d1519669f5a8d65c3e2,4/25(金) 20:12
2025-05-02,09:31,domestic,国内,32,高校生新聞オンライン,「コミュ力おばけ」に聞いた友達付き合いの秘けつ　必要なのは才能ではなかった,https://news.yahoo.co.jp/articles/06a308eb3553d800e3ae06bde47f3077dad39e0f,5/1(木) 11:05
2025-05-02,09:31,domestic,国内,33,産経新聞,埼玉・八潮陥没事故、発見の遺体を草加署に搬送　県「社会死状態であることを確認」,https://news.yahoo.co.jp/articles/4c1ba5e1f1ae11daece37fc0dd6ff03e1a19a100,5/2(金) 9:02
2025-05-02,09:31,domestic,国内,34,スポーツ報知,「とても許されない」…小学生７人はねた殺人未遂事件に「モーニングショー」長嶋一茂が憤慨,https://news.yahoo.co.jp/articles/0c68f05143f687117966b7332a0b9148462bf95b,5/2(金) 8:58
2025-05-02,09:31,domestic,国内,35,日刊スポーツ,訪米中の小泉進次郎氏「日本で聞いていた話と違う内容も」トランプ関税めぐり米側と意見交換,https://news.yahoo.co.jp/articles/abbba0fcd1817e582693fcdaf5895468b3faa4d5,5/1(木) 17:48
2025-05-02,09:31,domestic,国内,36,東海テレビ,車のトランクから見つかった遺体は19歳女性 遺棄容疑で逮捕の男「公園の駐車場に停めた車の中で首を絞めて殺した」,https://news.yahoo.co.jp/articles/e3e09db65d31df4677d18e6e6a5071b5f640ede1,4/25(金) 6:00
2025-05-02,09:31,domestic,国内,37,共同通信,男児、電車と接触していない可能性と警察,https://news.yahoo.co.jp/articles/2c6826b367026e3b6e9c437af39d5d6fd3b2933e,4/27(日) 0:11
2025-05-02,09:31,domestic,国内,38,共同通信,東京の赤ちゃんポストに初の預け入れ,https://news.yahoo.co.jp/articles/16ad7c441080e89ae3df5c2f0ac3ea4a88611eb6,5/1(木) 10:15
2025-05-02,09:31,domestic,国内,39,毎日新聞,JR横須賀線で事故、7歳男児が重傷　パジャマ姿で1人線路歩く,https://news.yahoo.co.jp/articles/c440ca288b36eddfc2b0817dd0cfbdc2070aaf49,4/27(日) 8:23
2025-05-02,09:31,domestic,国内,40,中日スポーツ,物議醸した万博『ぬいぐるみベンチ』撤去へ「サステナブルな取り組みも…配慮行き届かなかった」　続く波紋「炎上する意味わからん」「実に不愉快」,https://news.yahoo.co.jp/articles/738241b3573c324b8967c3583882694f66a5a034,4/25(金) 11:55
