scrp_date,scrp_time,genre_en,genre_jp,rank,media_jp,title,link,date_original
2024-04-02,18:17,sports,スポーツ,1,デイリースポーツ,平本蓮が結婚発表「正式に入籍しました！」　１月に左薬指に指輪をはめた交際相手を公開「爆美女」と話題　７・２８朝倉未来戦前に門出の報告,https://news.yahoo.co.jp/articles/c38ca31be049a3bbf9118282ed0348b0b0b7880c,4/2(火) 17:10
2024-04-02,18:17,sports,スポーツ,2,ゲキサカ,FIFAが北朝鮮協会に1万スイスフランの罰金処分!! 大会追放など重罰は回避か,https://news.yahoo.co.jp/articles/7eb2b786a96891063ab122f59417fadbcf8e13e4,4/2(火) 17:07
2024-04-02,18:17,sports,スポーツ,3,Full-Count,今永昇太、メジャー初勝利は記録ずくめ　123年間で“1人”の偉業も…衝撃デビュー戦,https://news.yahoo.co.jp/articles/8d0e9d680ef271d0dfd6dbac4e1800055888ceaa,4/2(火) 9:18
2024-04-02,18:17,sports,スポーツ,4,中日スポーツ,大谷翔平、1安打1打点も…自己ワースト開幕33打席ノーアーチ　ドジャースは好調2連勝,https://news.yahoo.co.jp/articles/191089bd16d583ad1a56ae37b79c58b92b15fa6b,4/2(火) 13:48
2024-04-02,18:17,sports,スポーツ,5,ENCOUNT,BreakingDown人気選手、右足を「複雑骨折」　手術の成功率25％の悲劇にネット心配「難しい選択」,https://news.yahoo.co.jp/articles/d5efb302f85cce56aad0d2594e848c1cc2b985aa,4/2(火) 13:56
2024-04-02,18:17,sports,スポーツ,6,東スポWEB,【ＤｅＮＡ】大暴れのドラ１ 度会隆輝のガッツポーズに球団関係者は危惧している,https://news.yahoo.co.jp/articles/cd49f5533097bd3f695f400d47ca57153c90928f,4/2(火) 11:46
2024-04-02,18:17,sports,スポーツ,7,スポーツ報知,「龍神ニッポン」「火の鳥ニッポン」の愛称は廃止…バレー協会のロゴを統一「一緒に戦っていく」,https://news.yahoo.co.jp/articles/eb0eca10cac9bf54646b50fe91994b676c41d566,4/2(火) 15:21
2024-04-02,18:17,sports,スポーツ,8,デイリースポーツ,中日・中田翔　巨人ナインとの再会を喜ぶ　阿部監督には頭を下げて挨拶　岡本は小突いてじゃれ合う,https://news.yahoo.co.jp/articles/3b75518a34aa8e0e77ddab5912b4b4949a37d4cc,4/2(火) 16:58
2024-04-02,18:17,sports,スポーツ,9,J-CASTニュース,JAL入社式「ドジャースユニの大谷翔平」が「激レア」映像になった事情　翌日に「ANA」からの発表が...,https://news.yahoo.co.jp/articles/2cec511eee42149fa7f34d480d665dc09ab4b7b4,4/2(火) 15:51
2024-04-02,18:17,sports,スポーツ,10,MLB.jp,【MLB】エンゼルスが初回4失点から逆転勝利　トラウト2本塁打　2本目は473フィートの特大弾,https://news.yahoo.co.jp/articles/ca626635d9725c466cb741904410d3b41bc67ae1,4/2(火) 10:55
2024-04-02,18:17,sports,スポーツ,11,CoCoKARAnext,日本球界復帰も現実味？メジャーを自由契約となった筒香嘉智をめぐって注目集める「球団名」,https://news.yahoo.co.jp/articles/a068d414b69a461882a3972c21f74d6ebdfcf6a7,4/2(火) 12:00
2024-04-02,18:17,sports,スポーツ,12,朝日新聞デジタル,甲子園40勝の阪口慶三さん、なぜ公立校へ？　名将が守った「約束」,https://news.yahoo.co.jp/articles/e5d591756c0bc795d2909846b5051ab1be71361c,4/2(火) 16:38
2024-04-02,18:17,sports,スポーツ,13,ABEMA TIMES,大谷翔平、1安打1打点も一発出ず 自己ワーストの開幕33打席ノーアーチ ドジャースはベッツ2安打＆フリーマン3安打などで快勝,https://news.yahoo.co.jp/articles/6fee17791b84991c98efe48ac8fa82acb4c1b496,4/2(火) 13:48
2024-04-02,18:17,sports,スポーツ,14,スポーツ報知,元エンゼルス監督、大谷翔平の代理人を疑問視「取引を把握していなかったのか？」…水原氏の違法賭博問題,https://news.yahoo.co.jp/articles/827c82fefa4b7aed45e2fe9b69232cca8e8e0fae,4/2(火) 17:40
2024-04-02,18:17,sports,スポーツ,15,中日スポーツ,中日・松山晋也、『試合4日後』の記録訂正でトレンド入り、3月29日の自責点1→４に「試合やってない昼間に防御率大悪化…可哀想すぎ」,https://news.yahoo.co.jp/articles/d3a04152a1f4bcb8e0fec4425d067ed81c8599f9,4/2(火) 14:35
2024-04-02,18:17,sports,スポーツ,16,中日スポーツ,巨人・梶谷隆幸がベンチ外れる、グラウンドに姿見せず ２年目・浅野翔吾が「３番・中堅」でスタメン,https://news.yahoo.co.jp/articles/455d90d3b20e77a740e22d97f3ec91f81fb5c9f4,4/2(火) 17:50
2024-04-02,18:17,sports,スポーツ,17,e!Golf,渋野日向子にドッキリ?? ボールがあり得ない軌道で…米ツアー公式が仕掛けた“エイプリルフール”ネタが話題に,https://news.yahoo.co.jp/articles/edf4c2372dcb27f6856efee731a4befbde27be10,4/2(火) 16:10
2024-04-02,18:17,sports,スポーツ,18,スポニチアネックス,江川卓氏　巨人の開幕3連戦で見えた阿部慎之助監督の考え方「3番打者に誰を置くかで分かった」,https://news.yahoo.co.jp/articles/c72a5b2c6e46002c8cfe4d87aeb5f649097db27f,4/2(火) 15:46
2024-04-02,18:17,sports,スポーツ,19,TBS NEWS DIG Powered by JNN,【2日・巨人スタメン】外野は萩尾1番ライト 浅野3番センター 丸7番レフト 岡本和4番ファースト 先発・山﨑伊 捕手は大城卓6番,https://news.yahoo.co.jp/articles/cd3d48399abc24bd49905dd3736debaba338377f,4/2(火) 17:27
2024-04-02,18:17,sports,スポーツ,20,RCC中国放送,野球殿堂入りの谷繁元信さん　容 “しゃ” なしのセ・リーグ展望　昨季は広島カープ最下位を予想「新井監督に謝りに行きましたよ」で 今季は?,https://news.yahoo.co.jp/articles/b8c076d4f503c170e6376c4c046ee88f2a8c61f0,4/2(火) 15:32
2024-04-02,18:17,sports,スポーツ,21,デイリースポーツ,ＪＡＬとサポート契約の大谷翔平　ドジャースがＡＮＡとパートナシップ契約で飛行機移動どうなる,https://news.yahoo.co.jp/articles/7d827a18933aa915993c6821201a088e0960fd7b,4/2(火) 13:01
2024-04-02,18:17,sports,スポーツ,22,TBS NEWS DIG Powered by JNN,【2日・中日スタメン】三好1番センター＆田中2番セカンド 高橋周3番サード 上林6番ライト 村松8番ショート 先発・小笠原,https://news.yahoo.co.jp/articles/f1dc9ec8a7293e520d23f9d49b9a9b719bc61b8d,4/2(火) 17:24
2024-04-02,18:17,sports,スポーツ,23,Full-Count,ド軍29歳右腕“わずか1日で戦力外”　2回無失点＆勝利投手も…好投デビュー直後の悲劇,https://news.yahoo.co.jp/articles/1f638e188263fc5af6158f9613ffb97b2355f43d,4/2(火) 7:59
2024-04-02,18:17,sports,スポーツ,24,Full-Count,驚きのノビ…吉田輝星が変貌「ほんとに覚醒してる」　成長遂げた“美直球”が「えぐすぎる」,https://news.yahoo.co.jp/articles/3a5cc1f4058517c74d9fcd3ec4a9116b1a99cb8e,4/2(火) 7:50
2024-04-02,18:17,sports,スポーツ,25,TBS NEWS DIG Powered by JNN,【2日・阪神スタメン】森下3番ライト 大山4番ファースト ノイジー6番レフト ショートは木浪8番 先発・村上 捕手は坂本7番,https://news.yahoo.co.jp/articles/7000e23b504b1c68fa9a199db4508cbf6a810d1b,4/2(火) 17:18
2024-04-02,18:17,sports,スポーツ,26,日刊スポーツ,【日本ハム】ファイターズガールが限定衣装　４月５～21日のホームゲーム８試合で,https://news.yahoo.co.jp/articles/738494baedb52966f5aad25a832930930ba3441d,4/2(火) 13:50
2024-04-02,18:17,sports,スポーツ,27,日刊スポーツ,【バレー】日本代表の愛称廃止　男子「龍神ＮＩＰＰＯＮ」女子「火の鳥ＮＩＰＰＯＮ」15年で幕,https://news.yahoo.co.jp/articles/581312c7f96d90eb3adf126f66f02e123d3ed616,4/2(火) 14:39
2024-04-02,18:17,sports,スポーツ,28,東スポ競馬,「菜七子騎手とコパノキッキングの活躍を見て」今年は３人の女性騎手の卵が競馬学校に入学,https://news.yahoo.co.jp/articles/e39aa6575f84535ac9aac69a65fa1ce6c6a2a7de,4/2(火) 16:34
2024-04-02,18:17,sports,スポーツ,29,e!Golf,シニアデビューを前に岡本綾子の大会で不動裕理が連覇 「親戚の子どもにアマチュアだと思われていた」と衝撃告白,https://news.yahoo.co.jp/articles/173081ac277a21eb4c80d25f03238fff2c2b3d97,4/2(火) 17:10
2024-04-02,18:17,sports,スポーツ,30,スポーツ報知,【巨人】 ベテラン・梶谷隆幸が中日戦でベンチ外　試合前練習にも姿を見せず,https://news.yahoo.co.jp/articles/f3c65977c1921f4785c667e27d6ec5d254d6d8ac,4/2(火) 17:47
2024-04-02,18:17,sports,スポーツ,31,Full-Count,ド軍公式から「一平さんが消された…」　大谷入団会見にも“映らず”日米驚き「悲しい」,https://news.yahoo.co.jp/articles/0e6e5a79c38781b5f020491ce68fa144e7fa9d6b,4/2(火) 17:22
2024-04-02,18:17,sports,スポーツ,32,Full-Count,“非情通告”に騒然「わずか1日で捨てられた」　好投直後に戦力外…ド軍右腕の現実,https://news.yahoo.co.jp/articles/64853e5836ca8af978dd630577092c606a1cbf51,4/2(火) 13:46
2024-04-02,18:17,sports,スポーツ,33,西スポWEB OTTO！,「早く上がってこい！」広島期待の23歳スラッガーがオリックス下手投げから完璧タイムリー　ファン「うまく育てばいずれ主軸になれる素材」「打ち終わり感が好き」,https://news.yahoo.co.jp/articles/e118a16b07c2e3f7fec583f54dbbfd34ca326919,4/2(火) 15:29
2024-04-02,18:17,sports,スポーツ,34,Full-Count,なぜ大谷翔平は開幕からノーアーチ？　低迷示す“7.5”…打撃コーチが語るカギ,https://news.yahoo.co.jp/articles/c191ef213003738f10e0588ee02372d0f48378d6,4/2(火) 16:39
2024-04-02,18:17,sports,スポーツ,35,GOAL,遠藤航＆マクアリスターで「リヴァプールは新たな次元に突入」…有力メディアが絶賛！,https://news.yahoo.co.jp/articles/c7088a1d9fba6dda5464cfadefb5d8b1130fc18c,4/2(火) 11:41
2024-04-02,18:17,sports,スポーツ,36,ENCOUNT,元モデルレスラー、韓国での試合で“事故”　団体に助け求めるも拒否「韓国救急車ない」,https://news.yahoo.co.jp/articles/f6492ae76e73873909488f1e5996aa22b8e84f4e,4/2(火) 14:36
2024-04-02,18:17,sports,スポーツ,37,デイリースポーツ,「松山が気の毒」記録訂正で中日投手の防御率が６７・５０に跳ね上がる　ロドリゲスが捕球できなかった開幕戦の失策が安打に,https://news.yahoo.co.jp/articles/e28c56221ccc718e33a0f5e122fe0fe1498e3477,4/2(火) 14:45
2024-04-02,18:17,sports,スポーツ,38,J SPORTS,今永昇太、地元メディアが絶賛。初登板の快投でMLB史上2人目の快挙,https://news.yahoo.co.jp/articles/e02d84bf5c523432e1a7e12e2ec32acb03e3b2dd,4/2(火) 17:02
2024-04-02,18:17,sports,スポーツ,39,ABEMA TIMES,大谷翔平が思わずキレた…！？ 「ミスジャッジだろ」「審判どこ見てんだよ！」見送ったボールが“まさかのストライク” 厳しい判定にファンも怒り,https://news.yahoo.co.jp/articles/0c650dd473605da7c81c95171124ad40147d52a5,4/2(火) 12:02
2024-04-02,18:17,sports,スポーツ,40,スポーツ報知,アーセナルとトットナムが１９４億円でスウェーデン代表ＦＷイサク争奪戦　,https://news.yahoo.co.jp/articles/e2a730f084eaca49452d8173c742515ba0b3ff67,4/2(火) 16:29
