scrp_date,scrp_time,genre_en,genre_jp,rank,media_jp,title,link,date_original
2024-09-11,15:08,sports,スポーツ,1,Full-Count,今永昇太、13勝目も「気にしない」　大谷翔平の大飛球は「運が味方してくれました」,https://news.yahoo.co.jp/articles/64f60f56a2424a39dc734d98c583fd46868714d0,9/11(水) 13:51
2024-09-11,15:08,sports,スポーツ,2,ABEMA TIMES,久保、遠藤も怒り心頭「退場だろ」伊東純也にあわや大怪我の危険スライディング→ カニばさみで追撃する悪質ラフプレーに「怪我させにきてるやん」,https://news.yahoo.co.jp/articles/8cf1f328792951481dfb03fdefcd085b9859ab03,9/11(水) 11:31
2024-09-11,15:08,sports,スポーツ,3,ゲキサカ,アルゼンチンに続き、ブラジルも敗れる…“王国”はW杯南米予選4敗目で5位後退、出場圏外との勝ち点差はわずか「1」,https://news.yahoo.co.jp/articles/59037ff1f5e46f3e701ba15779d7287c73e8b836,9/11(水) 12:40
2024-09-11,15:08,sports,スポーツ,4,スポニチアネックス,日本選手4人先発試合はカブス勝利！今永13勝目、誠也3安打1打点　大谷は無安打、山本4回1失点,https://news.yahoo.co.jp/articles/e7b723c6d94314d1ce0a4afe13b0b902340e5aaa,9/11(水) 13:46
2024-09-11,15:08,sports,スポーツ,5,スポニチアネックス,13勝目の今永昇太　山本由伸の好投が「僕を引っ張ってくれた」　大谷の大飛球は「紙一重。その時の運」,https://news.yahoo.co.jp/articles/ea3491c16accf7bc9357b7c662d4a6ec89647899,9/11(水) 14:05
2024-09-11,15:08,sports,スポーツ,6,デイリースポーツ,山本由伸　圧巻投球の復帰戦「今年の中でもトップに良いくらい」と自賛　４回１失点、３回までに８奪三振　カーショーから「いいアドバイスを」,https://news.yahoo.co.jp/articles/9175dd9ff620b606ed370eb07630e2d83ea08d60,9/11(水) 14:18
2024-09-11,15:08,sports,スポーツ,7,Full-Count,大谷翔平、“幻の47号”に衝撃データ「1/30」　本拠地ため息「惜しいいいい」,https://news.yahoo.co.jp/articles/f23d87fdc430bb50afc9c5d4b01666748b682e41,9/11(水) 12:45
2024-09-11,15:08,sports,スポーツ,8,CoCoKARAnext,西武　日本ハムにサヨナラ負けでシーズン最下位確定 　監督交代決定的に　チーム再建に浮上する「有力OB」とは,https://news.yahoo.co.jp/articles/a972a74828c0c75320d68f1fef31f34c7e7064e3,9/11(水) 11:11
2024-09-11,15:08,sports,スポーツ,9,CoCoKARAnext,中日ビシエド他球団移籍の焦点は？　注目集める「ウイークポイント」と「球団名」,https://news.yahoo.co.jp/articles/f1aa842b7c2668e5b97cdcc2f4fbf681defa8177,9/11(水) 12:51
2024-09-11,15:08,sports,スポーツ,10,ABEMA TIMES,アニメかよ！久保建英“50m級”超異次元スルーパスが大バズリ「緩急凄い」「なんだ今のパス」カメラも追いつかない超速スーパースルーパス炸裂の瞬間,https://news.yahoo.co.jp/articles/7b6ede7b0b598a9184cc8c66346a535097bc8b5c,9/11(水) 12:03
2024-09-11,15:08,sports,スポーツ,11,日刊スポーツ,ダルビッシュ有、野茂英雄に並ぶ日米通算201勝目　復帰２戦目で５回２失点、今季５勝目,https://news.yahoo.co.jp/articles/b103f64404d933e85e65f9eb291d551c5f5a2c78,9/11(水) 13:38
2024-09-11,15:08,sports,スポーツ,12,デイリースポーツ,ドジャースがまさかのミス連発で逆転許す　悪夢の１イニング３失策絡み一挙５失点　フィリップス炎上　本拠地スタンドがざわつく,https://news.yahoo.co.jp/articles/1902d795e19f914397340a1cb5d624dbbd0e7042,9/11(水) 13:16
2024-09-11,15:08,sports,スポーツ,13,ゴルフ総合サイト ALBA Net,260ヤード飛ばすとは思えない!? 女子プロ3人がお揃いの着物で浅草に出現「惚れてしまう！」と大盛り上がり,https://news.yahoo.co.jp/articles/f7ba2ce4f10cb22e9244cf91c8c96136795c42a0,9/11(水) 11:55
2024-09-11,15:08,sports,スポーツ,14,ABEMA TIMES,批判殺到！「最低の行為」「マジで低俗」日本代表がレーザーポインター被害…バーレーン観客の悪質妨害→Xトレンド入り【W杯アジア最終予選】,https://news.yahoo.co.jp/articles/0ba05e5b41b063654466b02fa3093501818420d2,9/11(水) 5:32
2024-09-11,15:08,sports,スポーツ,15,日刊ゲンダイDIGITAL,三笘薫が完全復調で移籍金うなぎ上り！ 冬の欧州移籍市場「200億円」ビッグディールの条件,https://news.yahoo.co.jp/articles/191b4b2169a27dfc05371c981709eb97bf72138e,9/11(水) 11:54
2024-09-11,15:08,sports,スポーツ,16,日刊ゲンダイDIGITAL,阪神が期待する近本光司の“豹変” 成績は文句なし、ナインからも慕われているが…,https://news.yahoo.co.jp/articles/d8f6c430b286def01e6488e46663f44b637ffa17,9/11(水) 11:32
2024-09-11,15:08,sports,スポーツ,17,Full-Count,巨人27歳逸材が「衝撃デビュー」　“遅咲き”左腕が驚愕の「4/6」…ファン期待「来年の新人王」,https://news.yahoo.co.jp/articles/549d7603842ff7c3117df41d0d5bf853d869170d,9/11(水) 11:59
2024-09-11,15:08,sports,スポーツ,18,日刊ゲンダイDIGITAL,貴景勝は大関最短復帰が叶わずこのまま「引退」か…親方就任の準備はとっくに万端,https://news.yahoo.co.jp/articles/6782116af8bf476bd011001979f56b198c141f89,9/11(水) 9:06
2024-09-11,15:08,sports,スポーツ,19,Full-Count,大谷翔平の理解不能な「7-46-47」　77年間で8人だけ…伝説打者の“ほぼ倍”に米注目,https://news.yahoo.co.jp/articles/c49fa2c9fe2d4bf23774f19e87397737b68b9d40,9/11(水) 11:05
2024-09-11,15:08,sports,スポーツ,20,スポニチアネックス,大谷翔平　痛恨逆転負けからわずか8分で帰宅　今永昇太との注目の対決は大飛球放つも3打数無安打,https://news.yahoo.co.jp/articles/0343e63266b8d7cc413712c457ee8e42ab3df4e3,9/11(水) 14:02
2024-09-11,15:08,sports,スポーツ,21,デイリースポーツ,山本由伸　復帰戦で４回１失点、８奪三振の圧巻投球！ロバーツ監督と笑顔でハグ　鈴木誠也を２打席連続Ｋ斬り　最速１５７・６キロ,https://news.yahoo.co.jp/articles/88f991b34d6e330517213ae4c9a81053011a9900,9/11(水) 12:04
2024-09-11,15:08,sports,スポーツ,22,スポーツ報知,今永昇太が今季本塁打０の４番に２打席連続弾被弾　大谷翔平をピンチで抑えるも４回にリード許す,https://news.yahoo.co.jp/articles/f5210a7c734c7e1bf1f583967e967159152a6876,9/11(水) 12:10
2024-09-11,15:08,sports,スポーツ,23,デイリースポーツ,今永昇太　１３勝目は「彼（山本）の投球を見て引っ張られた」大谷翔平の大飛球は「紙一重。運が味方してくれた」,https://news.yahoo.co.jp/articles/5d777f39addb4ad2427ea626b727ad33c4e34294,9/11(水) 13:54
2024-09-11,15:08,sports,スポーツ,24,ベースボールキング,ロッテ・山本大斗「長打も多く自分の持ち味を発揮できた」8月度のスカパー！ファーム月間MVP賞を受賞,https://news.yahoo.co.jp/articles/2505c6259159b7fcad2ef2f6e5857d6d85e0ece8,9/11(水) 13:07
2024-09-11,15:08,sports,スポーツ,25,日テレNEWS NNN,【W杯アジア最終予選順位表】日本含め連勝は3チーム　豪州が勝ち点1で足踏み…,https://news.yahoo.co.jp/articles/4fb6a73a6f42d5c70c0a685ebc2f3f7ecf6c1704,9/11(水) 11:46
2024-09-11,15:08,sports,スポーツ,26,FITNESS LOVE,50歳・介護士がヘルシーボディを披露　「年齢はただの数字、いつからでも輝ける！」,https://news.yahoo.co.jp/articles/5a3dade895934736b8b47cc3c99c3d7199106e8d,9/11(水) 7:10
2024-09-11,15:08,sports,スポーツ,27,日刊スポーツ,今永昇太ミラクル13勝目に「Ｘ」トレンド欄で珍事態発生？「今永先生の勝ち運」「勝ち付く？」,https://news.yahoo.co.jp/articles/365f52eccc0718595d4a9bb120d9a3a481681f04,9/11(水) 13:58
2024-09-11,15:08,sports,スポーツ,28,ABEMA TIMES,鎌田大地、ラフプレーに怒りのフェイスオフ「荒すぎだろ」背後からタイキックを喰らって悶絶転倒の瞬間「蹴ってたぞ」,https://news.yahoo.co.jp/articles/f70d21aa77cf077b2c4bbb9e81428d74b8bfa61a,9/11(水) 6:33
2024-09-11,15:08,sports,スポーツ,29,スポーツ報知,井上尚弥への挑戦希望者　グッドマンが１位、アフマダリエフは４位、カシメロは１１位　ＩＢＦ最新世界ランキングで３者に変動なし,https://news.yahoo.co.jp/articles/05c088ca17be054273a109fc38169a67048c948a,9/11(水) 13:42
2024-09-11,15:08,sports,スポーツ,30,デイリースポーツ,阪神　「感動するレベル」だった森下翔太のスーパー送球　「大山さんの胸めがけて」岡田監督の教え＆基本を怠らなかったワンプレー,https://news.yahoo.co.jp/articles/df946b581ff7404a14ddf2d9b65eae32a13a44c2,9/11(水) 11:05
2024-09-11,15:08,sports,スポーツ,31,スポニチアネックス,大谷翔平　今永昇太との注目の対決は3打数無安打　自己新47号お預け　チームは8回ミス連発で逆転負け,https://news.yahoo.co.jp/articles/dec48a8e17d0295aaf1d8e70836ff5269783ec60,9/11(水) 13:46
2024-09-11,15:08,sports,スポーツ,32,ABEMA TIMES,「狂ってる…」「別次元だ」日本代表が強すぎる！ ライバル国ファンが震撼…「もうW杯のチケットを与えるべき」アジア最終予選でバーレーン圧倒,https://news.yahoo.co.jp/articles/93d6d80d7c3d7a1f7dff0ec1c929a4602b48edd7,9/11(水) 6:02
2024-09-11,15:08,sports,スポーツ,33,ゴルフダイジェスト・オンライン（GDO）,香妻陣一朗はLIV残留なるか　破格ボーナス巡る年間タイトル争いも決着,https://news.yahoo.co.jp/articles/7b855c95bf04c31249dd48fda63022b0aa12a8c1,9/11(水) 14:01
2024-09-11,15:08,sports,スポーツ,34,日刊スポーツ,大谷翔平と今永昇太の「対戦のあいさつ」話題に　SNS「敬礼合戦」「品格がある」「いい関係」,https://news.yahoo.co.jp/articles/2469ae2c8582b638d3b3aee5177208132721129e,9/11(水) 14:02
2024-09-11,15:08,sports,スポーツ,35,Full-Count,大谷翔平が迫る“DH史上最高”　残り18試合…記録更新は確実か、異次元ペース「83」,https://news.yahoo.co.jp/articles/8650c1e1d6f9266b36ea7e5c1ced50b729418bb5,9/11(水) 7:36
2024-09-11,15:08,sports,スポーツ,36,中日スポーツ,久保建英をスペイン紙が称賛「最高のクボを見るには25分間で十分だった」見出しには「休養し、すでにマドリードのことを考えている」,https://news.yahoo.co.jp/articles/07682c5fe5b7ccc2f57f8880269dc18ddf8f5cb3,9/11(水) 12:20
2024-09-11,15:08,sports,スポーツ,37,スポニチアネックス,大谷翔平　惜しい47号！今永昇太との第3打席は特大114ｍ右飛　第4打席も右中間フェンス際へ大飛球,https://news.yahoo.co.jp/articles/69fc2d8676dd11fe370318da6e6d4b8eceab6b17,9/11(水) 12:26
2024-09-11,15:08,sports,スポーツ,38,東スポWEB,【Ｆ１】韓国GPのずさんな実態を英紙糾弾　560億円パーの仰天理由は「K-1と混同」,https://news.yahoo.co.jp/articles/02b1d12f7aa632cf9ff1723f02c406556320d9c6,9/11(水) 12:36
2024-09-11,15:08,sports,スポーツ,39,Full-Count,岡田監督の一言に「ホンマにムカついて」　新聞目に“怒り”「プライド傷つけられた」,https://news.yahoo.co.jp/articles/cb7bdaf9513aac79d98ddd855a8c996b626702eb,9/11(水) 6:50
2024-09-11,15:08,sports,スポーツ,40,日刊ゲンダイDIGITAL,「負けた」はずの琴桜が「勝った」ウラ事情…疑惑の軍配が大炎上《翔猿がかわいそう》,https://news.yahoo.co.jp/articles/e2f87a8c157a23fed999e477893f3f9778d208e4,9/11(水) 9:06
