scrp_date,scrp_time,genre_en,genre_jp,rank,media_jp,title,link,date_original
2024-09-11,09:25,domestic,国内,1,TBS NEWS DIG Powered by JNN,紀子さま58歳の誕生日　ネット上の批判に「心穏やかに過ごすことが難しい」,https://news.yahoo.co.jp/articles/6813474377eb3e3b90e5c8887c041486f46faf33,9/11(水) 0:00
2024-09-11,09:25,domestic,国内,2,神戸新聞NEXT,斎藤知事の後援会、トップのアシックス尾山氏辞任　「言動にがっかり」経済界との断絶決定的,https://news.yahoo.co.jp/articles/d263f6d2c6875457d9473ac98c5aa70cf6267351,9/10(火) 20:19
2024-09-11,09:25,domestic,国内,3,デイリースポーツ,高橋茉莉さん急死　国民・玉木代表「残念でなりません」【全文】東京１５区公認候補に一時内定,https://news.yahoo.co.jp/articles/a887775ac53d5f093c484383a8783fcf613e6884,9/10(火) 0:02
2024-09-11,09:25,domestic,国内,4,FNNプライムオンライン（フジテレビ系）,紀子さま58歳の誕生日「長男自身が考え決めたことを尊重したい」悠仁さま進路に言及「トンボ見つけ隊」の思い出も,https://news.yahoo.co.jp/articles/32f3f701d31276dbf0be9ab10acce91c0b57e5f7,9/11(水) 0:00
2024-09-11,09:25,domestic,国内,5,デイリースポーツ,田崎史郎氏が激低評価　高市早苗氏はポスト安倍晋三総理でなかった「４０点」　省庁再編に違和感「さて…」　政策は目標年次なく「羅列」と,https://news.yahoo.co.jp/articles/3c0758fbf8e39f3cbae0cbc7d1ac97486b89bbd3,9/10(火) 19:52
2024-09-11,09:25,domestic,国内,6,共同通信,「障害者の仕事が減った」悩む企業が新たな挑戦　働きやすい環境に、IT人材も #令和に働く,https://news.yahoo.co.jp/articles/41411f0f05193f731c10d545f1cf0a26b25b2951,9/10(火) 11:01
2024-09-11,09:25,domestic,国内,7,ABEMA TIMES,「ワンタッチ痴漢」の被害を女子プロレスラーが告白「あらゆるところから手が入ってくる」,https://news.yahoo.co.jp/articles/f64760f15b875160052fd3c3436c09cda588405e,9/11(水) 7:02
2024-09-11,09:25,domestic,国内,8,読売新聞オンライン,ＪＲ貨物の５６４両、はめ合わせる作業で不正…輪軸の金属疲労進行が速まる恐れ,https://news.yahoo.co.jp/articles/da8d5aad19092ae2cfc50dde890b9928a3cd2d97,9/10(火) 17:18
2024-09-11,09:25,domestic,国内,9,スポーツ報知,英ウィリアム皇太子、ひげを生やした姿が「かっこいい」と話題！　前日にはキャサリン妃が化学療法終了を報告,https://news.yahoo.co.jp/articles/f46f1cc51d78917944ecf16cf0560b4010f2e05f,9/11(水) 5:11
2024-09-11,09:25,domestic,国内,10,読売テレビ,【今どこに？】集団で殺害した男性は人違いだった…『六本木クラブ襲撃事件』から12年　リーダー格・元『関東連合』見立真一容疑者は現在も逃亡中…警察はフィリピンと日本の“4都県”をマーク,https://news.yahoo.co.jp/articles/5d48279113702a42ff6c40c44befbd92da224175,9/11(水) 7:30
2024-09-11,09:25,domestic,国内,11,CBCテレビ,【台風情報】新たな「台風13号 14号」発生へ　日本の南には2つの熱帯低気圧“台風のたまご”  3連休に影響与える可能性も… 最新進路予想,https://news.yahoo.co.jp/articles/b2ffa41ab30721cff5ecc49181368fbc69e771ee,9/10(火) 13:44
2024-09-11,09:25,domestic,国内,12,J-CASTニュース,「#斎藤知事がんばれ」突如トレンド入り　「大喜利タグはここですか...え？違うの？」Xに困惑広がる,https://news.yahoo.co.jp/articles/6126e4e3bca7b6fdfe364784b010834fafad5940,9/10(火) 18:41
2024-09-11,09:25,domestic,国内,13,ABEMA TIMES,「棋士になるのって大変…」西山朋佳女流三冠、棋士編入試験を白星スタート！“剛腕”将棋炸裂にファン興奮「ともかさまー！」,https://news.yahoo.co.jp/articles/67125f49b0e883e9d9b38311debb78b3ffe54f0f,9/11(水) 7:32
2024-09-11,09:25,domestic,国内,14,毎日新聞,紀子さま、58歳に　秋篠宮家への批判に「思い悩むことも」,https://news.yahoo.co.jp/articles/52041ac9b4d17f487af2d814d7fb449d41812104,9/11(水) 0:00
2024-09-11,09:25,domestic,国内,15,FNNプライムオンライン,「あだ名はフェンディ」東大の同級生・大島てるさん語る斎藤元彦知事　小学校時代の親友語る「将来の夢は警察官だった」,https://news.yahoo.co.jp/articles/f7735e062130e5bb2b747f0f75cacbe265b72b9f,9/9(月) 14:55
2024-09-11,09:25,domestic,国内,16,読売新聞オンライン,駅員が巡回怠り施錠、利用者１人がホームに４時間閉じ込められる,https://news.yahoo.co.jp/articles/4077de96f79c2b852c9668a13657bfbf0e7f3666,9/11(水) 6:43
2024-09-11,09:25,domestic,国内,17,TBS NEWS DIG Powered by JNN,高市大臣 「党の決めたことには一切違反をしていない」　総裁選で禁止されている印刷物郵送について反論,https://news.yahoo.co.jp/articles/c87f0dcfe55135d16ca1577d37befab68ee74cef,9/10(火) 23:08
2024-09-11,09:25,domestic,国内,18,読売新聞オンライン,紀子さま「遠く離れた場所に暮らす娘のことが心のどこかに感じられます」…宮内記者会への回答全文,https://news.yahoo.co.jp/articles/4a83e8778178925390d81695bb1a3a85eabf339d,9/11(水) 0:00
2024-09-11,09:25,domestic,国内,19,毎日新聞,熊本のラーメン店「天外天」本店が閉店へ　TSMCに沸く町から撤退,https://news.yahoo.co.jp/articles/ce8cdec9b42d1731997161c15c5755e04c39f3a9,9/10(火) 16:02
2024-09-11,09:25,domestic,国内,20,TBS NEWS DIG Powered by JNN,「私の小泉氏への態度は決まった」“日本は家族で成り立つ”夫婦別姓絶対反対の人の理屈【報道1930】,https://news.yahoo.co.jp/articles/f3fcf321cb82aaa1f02637658338fae1c64118c5,9/10(火) 16:32
2024-09-11,09:25,domestic,国内,21,共同通信,公務員「地域手当」の見直し表明　総務相、支給率は県単位に,https://news.yahoo.co.jp/articles/866ee073cb13b327459a13b5423cb1ca9f1b7d31,9/10(火) 12:14
2024-09-11,09:25,domestic,国内,22,デイリースポーツ,誰？なぜ？田中真紀子さん　総裁選砲撃も１人だけ大絶賛する、まさか人物の名前「育ち良いし賢い！」　他は「ヘナチョコ売名」使い物にならない！,https://news.yahoo.co.jp/articles/fc0f92c2e1fd887e45f90c84075065f517a01935,9/10(火) 16:05
2024-09-11,09:25,domestic,国内,23,弁護士ドットコムニュース,仮釈放認められず「もう出られない」、自暴自棄になる囚人も　無期懲役の「終身刑」化に危機感,https://news.yahoo.co.jp/articles/c018a3c0784ef68640466bbc1b101b944cd35ac1,9/6(金) 11:02
2024-09-11,09:25,domestic,国内,24,夕刊フジ,「解雇規制緩和」に高市早苗氏が猛反論　小泉進次郎氏が表明　中高年〝クビ切り〟加速の懸念「必要なし」総裁選の大きな争点に,https://news.yahoo.co.jp/articles/badd193a52812c7c755c0c9a52a006904255b619,9/10(火) 17:00
2024-09-11,09:25,domestic,国内,25,tenki.jp,冬にかけてラニーニャ現象が発生する可能性が高い　エルニーニョ監視速報,https://news.yahoo.co.jp/articles/412809ae715c19f2b3cb5798c810b0c4af321612,9/10(火) 14:42
2024-09-11,09:25,domestic,国内,26,TBS NEWS DIG Powered by JNN,"中学・高校で増加「ハーフパンツ制服」…10代が求める“機能性”と、もう1つの“重要ポイント”【THE TIME,】",https://news.yahoo.co.jp/articles/3c44a1e3dda12277cefd193adfdefdc3a4df1e07,9/11(水) 7:32
2024-09-11,09:25,domestic,国内,27,中日スポーツ,田中真紀子さん、自民党総裁の適任者「私は１人いると思うが」 「そのあとの方たちは使い物にならない」とバッサリ,https://news.yahoo.co.jp/articles/81d95745c0061d6ae6aa896223387259da29022c,9/9(月) 16:10
2024-09-11,09:25,domestic,国内,28,デイリースポーツ,須田慎一郎氏　総裁選「推薦人１人足りない」と大騒ぎの候補明かす　永田町常識だと「間に合わない可能性ある」,https://news.yahoo.co.jp/articles/68bec2b7f237b47e2375536154b112fb704ff5af,9/9(月) 18:08
2024-09-11,09:25,domestic,国内,29,時事通信,吉田氏推薦人、野田氏に投票？　　立民代表選、「茶番」批判も,https://news.yahoo.co.jp/articles/5a5b4829bf1a166631b1e0c785e2a736d229920a,9/11(水) 7:08
2024-09-11,09:25,domestic,国内,30,弁護士JPニュース,SHEIN、Temu、アリエク…商品から“発がん性物質”検出の韓国発表を受け厚労省「情報収集中」　もし健康被害が発生したら？,https://news.yahoo.co.jp/articles/30f22455451d3cd4a454d9013f00910cb88f1dcd,9/10(火) 10:30
2024-09-11,09:25,domestic,国内,31,朝日新聞デジタル,刃物で切り付けられ男性死亡　61歳男を殺人未遂容疑で逮捕　埼玉,https://news.yahoo.co.jp/articles/908f6127edf2c21bc0e662dd4d42c0a0224f2c06,9/11(水) 0:09
2024-09-11,09:25,domestic,国内,32,デイリースポーツ,高市早苗氏の立候補会見「話が長すぎる」伊藤惇夫氏がバッサリ「４５点」,https://news.yahoo.co.jp/articles/499b65adce1b2eb1d029f1465e7f6c2e32923ba3,9/10(火) 16:50
2024-09-11,09:25,domestic,国内,33,京都新聞,「45分差で助かった命」京都→ニューヨーク出張中にまさかの「9.11」米同時多発テロ遭遇,https://news.yahoo.co.jp/articles/66d7a981fd772cba2293a0747f3dd1b0ae213bbb,9/11(水) 7:01
2024-09-11,09:25,domestic,国内,34,産経新聞,「県民からは激励の声の方が多い」斎藤知事　辞職は改めて否定,https://news.yahoo.co.jp/articles/9ecced718849ab6be7b0d080430a4197c78da646,9/10(火) 11:58
2024-09-11,09:25,domestic,国内,35,毎日新聞,最期は誰が…、高齢単身一人っ子が頼った「ホームロイヤー」とは,https://news.yahoo.co.jp/articles/d067ce0ec89373881b64efa42ca43ca8ddc361f5,9/11(水) 5:01
2024-09-11,09:25,domestic,国内,36,日刊スポーツ,玉川徹氏、小泉進次郎氏の「限界」を指摘「言わないとバランスが取れないんだろうね」,https://news.yahoo.co.jp/articles/a7cb1793ef991244debc11e6e452e4592571f1b7,9/9(月) 9:43
2024-09-11,09:25,domestic,国内,37,テレ東BIZ,【独自】野田聖子氏　総裁選への出馬断念へ　小泉氏の支援検討,https://news.yahoo.co.jp/articles/f4bdc8cca1aad710b99909442fb8ad67d7605c34,9/10(火) 21:18
2024-09-11,09:25,domestic,国内,38,共同通信,野田元総務相が総裁選出馬を断念へ,https://news.yahoo.co.jp/articles/c89d7f7bab4d0635488d949349b33478cd7eff4d,9/10(火) 23:17
2024-09-11,09:25,domestic,国内,39,FNNプライムオンライン,紀子さま58歳の誕生日「自分の興味を大事に」悠仁さま進学先は「尊重したい」ネットのバッシング「思い悩むことも」苦しい胸中明かされる　記者の質問に文書回答,https://news.yahoo.co.jp/articles/aecae940c9e06bccdfedbb17c9ada237dc804924,9/11(水) 0:02
2024-09-11,09:25,domestic,国内,40,FNNプライムオンライン（フジテレビ系）,紀子さまと佳子さまが源氏物語の刺しゅう展へ　お二人での公務は約5年ぶり,https://news.yahoo.co.jp/articles/55245280e906fd5ace4bfa06bfa039379925e1a0,9/10(火) 11:28
