scrp_date,scrp_time,genre_en,genre_jp,rank,media_jp,title,link,date_original
2024-07-02,15:08,domestic,国内,1,時事通信,サッカー伊東選手を書類送検　不起訴の公算　大阪府警,https://news.yahoo.co.jp/articles/e2e55faea10eb1d908959808bff4772366d627aa,7/2(火) 12:29
2024-07-02,15:08,domestic,国内,2,みんかぶマガジン,「これは人種差別だ！」記者会見突入の元カイロ大副学部長…「小池さんのアラビア語の評価は」”発展途上国だから”、”独裁だから”、と勝手なことばかりいう日本人,https://news.yahoo.co.jp/articles/8d4ae9b2f149c06c2e5fa9caeacfe44b8a4a27b2,7/2(火) 12:10
2024-07-02,15:08,domestic,国内,3,京都新聞,「この中の誰かが漏らしたことになる」30万円入りの封筒を両親に押しつけ土下座　性被害「もみ消し」に映る対応　バトンコーチ性暴力問題,https://news.yahoo.co.jp/articles/0aa6d90b1cd1e0f0392f62463dcb413d82e9899f,7/2(火) 9:00
2024-07-02,15:08,domestic,国内,4,産経新聞,菅前首相と麻生副総裁、自民総裁選は首相経験者２人によるキングメーカー争いの様相,https://news.yahoo.co.jp/articles/9fc8a788b888e1943c1766cdb7a807963b42571f,7/2(火) 14:04
2024-07-02,15:08,domestic,国内,5,産経新聞,人あふれる三鷹駅構内　女性専用車両も解除…６月だけで９件、人身事故続出のＪＲ中央線,https://news.yahoo.co.jp/articles/33d4fd426ae431a68ccc6e13999aaaba2771f584,7/2(火) 13:15
2024-07-02,15:08,domestic,国内,6,弁護士JPニュース,「母は奴隷なのか」1週間泊まり込み勤務後“急死”、家事使用人の「労災不支給」めぐる裁判が結審　遺族ら思いを語る,https://news.yahoo.co.jp/articles/84019f256d7f295cfec56094e2452557bd965324,7/2(火) 9:50
2024-07-02,15:08,domestic,国内,7,CBCテレビ,マイナ保険証への切替えに大反響！？賛否の理由は？,https://news.yahoo.co.jp/articles/7455c1b1aac6840554b2d7c48608bbeadfe856c3,7/2(火) 12:11
2024-07-02,15:08,domestic,国内,8,テレビ朝日系（ANN）,“400万円”ピンクのベンチは高すぎる？　渋谷「都会のオアシス」再整備計画で物議,https://news.yahoo.co.jp/articles/d84f18cb3d4ceb4701c5309feda56accfa837f4b,7/2(火) 13:42
2024-07-02,15:08,domestic,国内,9,読売新聞オンライン,東京湾に浮かぶ巨大なブーメラン…かつての海上要塞の護岸整備、今年度中にも終了,https://news.yahoo.co.jp/articles/8cce8d7797727c38a59d46b03058a37cd2065572,7/2(火) 13:21
2024-07-02,15:08,domestic,国内,10,レスキューナウニュース,中央線(快速)で人身事故 運転見合わせ,https://news.yahoo.co.jp/articles/2cc7a74fae84b5addc64455ee6f40298b70563e5,7/2(火) 8:15
2024-07-02,15:08,domestic,国内,11,サンケイスポーツ,飯島栄治八段の解説　藤井棋聖の２１歳１１カ月での永世称号、破られない大記録,https://news.yahoo.co.jp/articles/816f702bf530e29fa9006939e71312aa23f6fa15,7/2(火) 14:00
2024-07-02,15:08,domestic,国内,12,共同通信,サッカー伊東選手と告訴女性2人を書類送検,https://news.yahoo.co.jp/articles/caabc501331b93c17b13cba2ef0d536bdd375e0c,7/2(火) 14:36
2024-07-02,15:08,domestic,国内,13,FNNプライムオンライン,小池氏は船と電車で“選挙戦”　蓮舫氏はイメチェン?犬と2ショットも　都知事選後半戦…注目候補の“戦略”に変化,https://news.yahoo.co.jp/articles/98843499f6c1dfbf8972cc544ed7228a725e1f10,7/2(火) 12:13
2024-07-02,15:08,domestic,国内,14,読売新聞オンライン,登山の女性連絡取れず、「足がつりそうになった」と引き返し,https://news.yahoo.co.jp/articles/34cb6af66203d63c64bbbead2bc317e9ed531569,7/2(火) 11:42
2024-07-02,15:08,domestic,国内,15,FNNプライムオンライン,＜ススキノ首切断事件＞田村瑠奈被告「首、拾った」と父親に 黒い袋には“小ぶりのスイカくらいの大きさのもの” 裁判で明かされた衝撃的発言 遺族は悲痛「一家全員の極刑を望む」 北海道札幌市,https://news.yahoo.co.jp/articles/0f7c2841e629dbbd49d5e9eb901e5f74919ff20c,7/1(月) 22:02
2024-07-02,15:08,domestic,国内,16,FNNプライムオンライン,【独自】「幻を見ているような感覚」追い越し・信号無視で交差点“爆走”　「せっかち」が原因?　茨城・かすみがうら市,https://news.yahoo.co.jp/articles/bb37a18961195c515a9bb91bbfd9933db500bc14,7/2(火) 14:13
2024-07-02,15:08,domestic,国内,17,共同通信,スノーピークが6億円申告漏れ,https://news.yahoo.co.jp/articles/c269e86ebee7ffd7d7682a000381f87b5c565e70,7/2(火) 12:28
2024-07-02,15:08,domestic,国内,18,共同通信,伊東選手と告訴女性2人書類送検　準強制性交容疑と虚偽告訴容疑,https://news.yahoo.co.jp/articles/492b82c2fa104108edc76d357d5cf79b0268c1ec,7/2(火) 14:40
2024-07-02,15:08,domestic,国内,19,ハフポスト日本版,永住許可取り消し制度、国連の委員会が緊急の書簡「不均衡な影響を懸念」。日本政府に見直しや廃止措置への回答求める,https://news.yahoo.co.jp/articles/f0e200645280311121c5b6470202d0c23af69a7f,7/2(火) 12:02
2024-07-02,15:08,domestic,国内,20,ABEMA TIMES,警察官装い「俺の言うことを聞けば見逃してやる」 ホテルで20代女性に性的暴行か、61歳男を逮捕 東京・歌舞伎町,https://news.yahoo.co.jp/articles/1005724060a47988b258e0664285fad4c26c639d,7/2(火) 14:31
2024-07-02,15:08,domestic,国内,21,選挙ドットコム,東京都議会議員補欠選挙で咲く花は何色か？今後の政局へ甚大な影響を与える“ほぼ”国政並みの都議補選9選挙区の解説！（坂本東生）,https://news.yahoo.co.jp/articles/97d96ce5077389b552d1d9bd49dbbd2a355f085f,7/2(火) 7:48
2024-07-02,15:08,domestic,国内,22,47NEWS,１人で５分の訪問看護、でも記録上は〝２人で３０分〟　「患者や家族はおかしさに気付かない」ホスピス型住宅の「手厚い」ケア,https://news.yahoo.co.jp/articles/7889f9d8604b00bd214fc3f6d4f33230c0489fe7,7/2(火) 10:02
2024-07-02,15:08,domestic,国内,23,ABEMA TIMES,【独自】日大悪質タックル問題から6年…「スキャンダラスなことを見たいのは自身だった」激しくバッシングしたメディアへの思いは？内田正人元監督が激白（2）,https://news.yahoo.co.jp/articles/c5e3f9b425bc0ec29697da8916dbef631e85bcfe,7/2(火) 12:00
2024-07-02,15:08,domestic,国内,24,読売新聞オンライン,店を閉め「珠洲には仕事ない」と市外へ…被災後、奥能登の地域経済が弱体化,https://news.yahoo.co.jp/articles/0ad034e8add3df707ece75b57202b9a22334933d,7/2(火) 5:01
2024-07-02,15:08,domestic,国内,25,FNNプライムオンライン,「混んじゃうので遅刻しそう」ラッシュ時に乗れないのに熊本市電が過去最大規模の減便 人員不足でトラブル続き,https://news.yahoo.co.jp/articles/af362d79ec4d0c09ce644687f9db56ee11722015,7/2(火) 11:55
2024-07-02,15:08,domestic,国内,26,共同通信,スノーピークが6億円申告漏れ　韓国子会社に所得移転、国税指摘,https://news.yahoo.co.jp/articles/24a081f9613892087f74d64e510c6520463a9d4a,7/2(火) 12:44
2024-07-02,15:08,domestic,国内,27,ABEMA TIMES,「父を引き取り、死を悼みたい」オウム松本元死刑囚の次女が出廷し訴え 遺骨などの引き渡し巡る裁判,https://news.yahoo.co.jp/articles/a0d974b9fdac6b8f17098395e877fab9aa5120df,7/2(火) 14:12
2024-07-02,15:08,domestic,国内,28,テレビ朝日系（ANN）,大雨と猛暑のダブルパンチ　次の大雨はどのエリア？　東京は連日の熱帯夜に,https://news.yahoo.co.jp/articles/8248baa3693b5004b7bdd29fff446388196ca931,7/2(火) 12:46
2024-07-02,15:08,domestic,国内,29,共同通信,国税職員、美容整形代で不正還付　医療費として1千万円確定申告,https://news.yahoo.co.jp/articles/9d60f43f44e5738064cc96d7ccc5995f56ba910f,6/28(金) 18:00
2024-07-02,15:08,domestic,国内,30,共同通信,20歳未満の女子部員飲酒　日体大アーチェリー,https://news.yahoo.co.jp/articles/e7461e14befa8df31206b321f5855eb802b35135,7/2(火) 12:20
2024-07-02,15:08,domestic,国内,31,TBS NEWS DIG Powered by JNN,河野大臣、質問通告の「打ち直し」を問題視　「FAX利用」の見直しに前向きな姿勢示す,https://news.yahoo.co.jp/articles/4a7e041499ea31679591f6b81701bbd74669b93b,7/2(火) 14:44
2024-07-02,15:08,domestic,国内,32,時事通信,「就活に親が参戦」は当たり前？◆広がるオヤカク、正しい距離感とは【時事ドットコム取材班】＃令和の親＃令和の子,https://news.yahoo.co.jp/articles/f698a0f78ed9b67ccf5934fabfe1b210b2925972,7/2(火) 10:00
2024-07-02,15:08,domestic,国内,33,読売新聞オンライン,ロードバイク窃盗容疑、中国人２人を逮捕…関係先から自転車１００台押収,https://news.yahoo.co.jp/articles/8bfbd23dc24b4bfb37bcd69796efc773f70ded8a,7/2(火) 13:53
2024-07-02,15:08,domestic,国内,34,ニュースイッチ,下げ止まり傾向も…大学教員など「研究時間」縮小続く,https://news.yahoo.co.jp/articles/0afbb504ca687d043ff13a601e540b5b70eb0585,7/2(火) 14:10
2024-07-02,15:08,domestic,国内,35,共同通信,感染症対応の政府行動計画を閣議決定,https://news.yahoo.co.jp/articles/71b330e88eeca5c43a70ef990a231f89518353ed,7/2(火) 10:36
2024-07-02,15:08,domestic,国内,36,読売新聞オンライン,ススキノ切断遺体、精神科医の父「通報は娘を裏切る気がした」…瑠奈被告の動機は「聞いていない」,https://news.yahoo.co.jp/articles/ec80577e4cfe55db0d1e859e89142ca3645465c9,7/2(火) 10:46
2024-07-02,15:08,domestic,国内,37,共同通信,Luupが独自違反制度　電動ボード、利用停止も,https://news.yahoo.co.jp/articles/64b98c1e3cd127642a14854f19020cb573f533be,6/25(火) 15:43
2024-07-02,15:08,domestic,国内,38,ABEMA TIMES,【独自】「コーチには“演技”が必要。あえて“ダメ人間”も見せるべき」 日大悪質タックル問題で打ち砕かれた“教育論” 内田正人元監督が激白（1）,https://news.yahoo.co.jp/articles/859fc7580e5859777035426842d4541055b64ca6,7/2(火) 11:30
2024-07-02,15:08,domestic,国内,39,朝日新聞デジタル,球児メシ　はみ出る唐揚げ、完食に1時間　駒大の裏メニュー　KSP,https://news.yahoo.co.jp/articles/84af1f7a8ec34e0b3bd591799003773715902785,7/2(火) 12:00
2024-07-02,15:08,domestic,国内,40,TBS NEWS DIG Powered by JNN,スノーピークに約6億円申告漏れ指摘 海外子会社との取引めぐり納税額減らしたか　スノーピーク「見解の相違も修正申告し納付済み」 関東信越国税局,https://news.yahoo.co.jp/articles/0e18cc6c549eac2006337b859ce6d4bdc425dcaf,7/2(火) 13:46
