scrp_date,scrp_time,genre_en,genre_jp,rank,media_jp,title,link,date_original
2024-12-06,09:29,local,地域,1,ＡＴＶ青森テレビ,「24時間で1匹…」かつて9万匹近くも獲れた“サケの漁場”のいま　昨シーズンの漁獲数は過去最低の151匹「日本のサケがなくなるのでは…」関係者に募る危機感,https://news.yahoo.co.jp/articles/b54c5a17c67a4229f2f1dbd19af723ebfbcd591d,12/6(金) 6:13
2024-12-06,09:29,local,地域,2,北海道ニュースUHB,【牛丼店で大暴れ】虫よけスプレー使いレジ破壊→店長と入店してきた客を殴打―38歳男“現行犯逮捕”「セルフレジの処理うまくいかず激高」北海道岩見沢市,https://news.yahoo.co.jp/articles/f8f7ff4f4d748067ca3248de9b56dc0a25be37a4,12/6(金) 5:00
2024-12-06,09:29,local,地域,3,RKB毎日放送,成人女性　川で死亡しているのが見つかる　下半身に衣服なし,https://news.yahoo.co.jp/articles/721ffd57f408201654e3ad95ab5ad2fc94ac3cac,12/5(木) 16:14
2024-12-06,09:29,local,地域,4,埼玉新聞,行方不明…家族に「ありがとう。さようなら」とメールして男性消える　20代の会社員　家族が通報、警察犬が追跡開始…1時間半かけ男性を発見、無事保護し称賛　泥酔した状態「彼女にふられた」,https://news.yahoo.co.jp/articles/69643927bc1eea28fa92d2f3ece69a63e2ff6a51,12/5(木) 10:15
2024-12-06,09:29,local,地域,5,STVニュース北海道,無理やり謝罪させ暴行　容疑者らが動画撮影　交際相手の女ら２人きょうにも起訴へ　大学生暴行死,https://news.yahoo.co.jp/articles/6771809aff0c519925963e1fac1182ec6551c165,12/6(金) 4:00
2024-12-06,09:29,local,地域,6,ＢＳＮ新潟放送,自宅脱衣所にスマホ設置　女性を盗撮か　25歳の男を逮捕　新潟・燕市,https://news.yahoo.co.jp/articles/286911a58d8bf8e9417d4db68d84de5022908a40,12/6(金) 8:24
2024-12-06,09:29,local,地域,7,新潟ニュースNST,置き忘れの財布を警察に届けるも…財布から現金約1万円を抜き取っていた疑いで無職の男を逮捕「抜き取ってはいません」,https://news.yahoo.co.jp/articles/15a79383d98e2f94ee2f2a946f912d6a2d09d443,12/6(金) 6:30
2024-12-06,09:29,local,地域,8,MBSニュース,阪神電車に神戸三宮行き“深夜特急”新設へ　2025年2月22日にダイヤ改正,https://news.yahoo.co.jp/articles/5635541226518375ed8b49e8e4642f7a8454c0b7,12/5(木) 17:06
2024-12-06,09:29,local,地域,9,カナロコ by 神奈川新聞,相模湾・三浦半島で若干の海面変動、６日正午以降に２０センチ未満か　米北西部Ｍ７・３地震で津波予報,https://news.yahoo.co.jp/articles/40e5c13808964d20d6248de5160050b27cf1dc63,12/6(金) 7:50
2024-12-06,09:29,local,地域,10,RSK山陽放送,高齢とみられる女性がトラックにはねられる　病院に救急搬送も意識不明の重体　県道倉敷成羽線【岡山】,https://news.yahoo.co.jp/articles/cff6379ca2515d920edf25af94529cfdd3486cdd,12/6(金) 7:41
2024-12-06,09:29,local,地域,11,チューリップテレビ,母親の遺体と半年間…放置した娘の裁判　うなりながら苦しむ母親を1人で看取る…救急車 呼べなかった理由【裁判傍聴記・富山】,https://news.yahoo.co.jp/articles/ebf853fe701f6a8093f9cb594bda60b605e10e2d,12/5(木) 19:31
2024-12-06,09:29,local,地域,12,北海道ニュースUHB,【61歳の小学校教師】懲戒免職―“ショルダーバッグとはさみ”1万4000円相当を万引「お金払うのもったいない」校長の経験あり再任用の“先生”が…北海道帯広市,https://news.yahoo.co.jp/articles/b0491908353ad3eed71830dcc545937455edc922,12/6(金) 5:15
2024-12-06,09:29,local,地域,13,伊勢新聞,新和工業、破産手続き開始決定　鈴鹿の管工事会社　帝国データバンク　三重,https://news.yahoo.co.jp/articles/6c0d168d8e12e0b5428dda6b278d5dffe15fcafc,12/6(金) 8:02
2024-12-06,09:29,local,地域,14,埼玉新聞,突っ込んだパトカー…サイレン鳴らし緊急走行中、大学生の車とぶつかり民家へ突入　深夜に交差点で騒然　隣接していた民家の2階に住人がいると…衝突したパトカー、1階のシャッターを突き破り入ってきた,https://news.yahoo.co.jp/articles/347d07405778fbe6013d396d84f84292dd6b8aef,12/6(金) 8:00
2024-12-06,09:29,local,地域,15,RCC中国放送,北・東・西日本の日本海側などに「大雪に関する早期天候情報」発表　気象庁　来週11日頃から平年の2～3倍以上の“まとまった雪”が降る可能性高い　西日本中心に年末にかけて「低温傾向」予想　一気に冬らしい寒さへ,https://news.yahoo.co.jp/articles/b67e3387e45cd7bb950de23405a69c2f612eab77,12/5(木) 23:02
2024-12-06,09:29,local,地域,16,埼玉新聞,発がん性…埼玉“PFAS”汚染調査　PFASの一種である「PFOS」「PFOA」、新たに1地点で超過検出　原因特定へ地下水も調査へ　周辺の水道水に影響は,https://news.yahoo.co.jp/articles/f77f5a61515befea85621364bf230aac4aafa4a5,12/5(木) 7:17
2024-12-06,09:29,local,地域,17,新潟ニュースNST,中学生が修学旅行中に“大地の芸術祭”の作品を壊した問題　新潟市が674万円の賠償金を支払うことで和解へ　保護者などに賠償は求めず,https://news.yahoo.co.jp/articles/c7184f7a88059490fa0f3da30dbf0411f2cb5be7,12/3(火) 13:46
2024-12-06,09:29,local,地域,18,HBCニュース北海道,50代男性が自分で交換⇒直後の運転で…軽乗用車から左前タイヤが脱落　住宅の壁に衝突　ナット締めつけ不十分だったか,https://news.yahoo.co.jp/articles/fa69f563ce3c9f0ce3568cce387e094b9e933176,12/6(金) 8:52
2024-12-06,09:29,local,地域,19,静岡放送（SBS）,一緒に酒を飲んでいてトラブル? 幼なじみの男性殴り顔面や肋骨骨折させた疑い 53歳男逮捕=静岡県警,https://news.yahoo.co.jp/articles/3fd8601985b1f4e0b64c2296b2a84d71cde7ce7c,12/4(水) 8:38
2024-12-06,09:29,local,地域,20,中国新聞デジタル,広島県への転入者減少　お隣の山口県からも大阪圏からも　吸引力低下の背景を探ると…,https://news.yahoo.co.jp/articles/7edddb4717c13e0e1a46232c47cb2e806d925c86,12/6(金) 8:14
2024-12-06,09:29,local,地域,21,中国新聞デジタル,広島市中区の飲食店で14人の集団食中毒、営業禁止に,https://news.yahoo.co.jp/articles/c6a87c742e6498cb12662779cd199d12d15b344e,12/5(木) 18:26
2024-12-06,09:29,local,地域,22,八重山日報,牛歩「条例に抵触せず」　県、辺野古反対運動巡り見解,https://news.yahoo.co.jp/articles/38d5b9a3c194cb090e7538a750cdbdfd92827f19,12/6(金) 4:00
2024-12-06,09:29,local,地域,23,茨城新聞クロスアイ,水海道一トップ4.53倍　県立中高一貫校志願倍率　茨城県教委,https://news.yahoo.co.jp/articles/43e13beae59f735d9fdf698fbee6caf7a3440937,12/6(金) 8:00
2024-12-06,09:29,local,地域,24,STVニュース北海道,暴力団幹部の男（53）酒を飲んで顔見知りだった20代男性の腹部を足で蹴る… 北海道千歳市,https://news.yahoo.co.jp/articles/407c44823e58aa3398f670129f6325496a419336,12/6(金) 6:57
2024-12-06,09:29,local,地域,25,ABCニュース,岸和田市長を訴えた女性「人生がめちゃくちゃ　悔しいだろう」　裁判傍聴のジャーナリストが明かす法廷内　「同意あった」と食い違う主張　和解調書は「対等な関係とはいえず」と指摘,https://news.yahoo.co.jp/articles/557d1d4127a53312ea82a0dcad9b10ddc34a3156,12/5(木) 19:39
2024-12-06,09:29,local,地域,26,南日本新聞,知事も困った。カスハラ被害、県庁でも相次いでいた　SNSで動画公開、誹謗中傷…「業務への影響懸念」,https://news.yahoo.co.jp/articles/89a00c19a08b194f0e5990099d638115dc9ff15c,12/6(金) 6:03
2024-12-06,09:29,local,地域,27,伊勢新聞,伊賀モクモクファームで火災　「焼豚専門館」が全焼　けが人なし　三重,https://news.yahoo.co.jp/articles/18ecd1ecb47bf2fe2a827dcf211a77bff94e757e,12/6(金) 8:02
2024-12-06,09:29,local,地域,28,TNCテレビ西日本,九州の警察では「初」福岡県警が滞納男性の自宅を捜索　車の放置違反金と延滞金を“現金”で差し押さえ　男性１人は約２年滞納　滞納額は１万８０００円あまり,https://news.yahoo.co.jp/articles/9bb015cd058a9218b75cc816b20f5060a53a7e23,12/5(木) 21:03
2024-12-06,09:29,local,地域,29,RKB毎日放送,「自宅の倉庫で白骨遺体を発見した」毛布の上に性別不明の遺体　横にはたたまれた衣服と栄養補助食品　60代女性が発見,https://news.yahoo.co.jp/articles/6f59351ae62c8a62cd34fcd2212f9b7394109029,12/5(木) 19:47
2024-12-06,09:29,local,地域,30,中国新聞デジタル,SNSで知り合った女子中学生をコンビニに誘い出し誘拐、容疑の20歳男逮捕　広島県警,https://news.yahoo.co.jp/articles/598e6284276c9dc5b09f6de6db300e899a9c10b7,12/6(金) 6:20
2024-12-06,09:29,local,地域,31,NBC長崎放送,寒気流入　7～8日冬型気圧配置が強まる　寒気流入シミュレーション（6日午前）,https://news.yahoo.co.jp/articles/9286b5f2aa22ad8cd59165696263449bda688154,12/6(金) 7:14
2024-12-06,09:29,local,地域,32,伊勢新聞,不当労働行為で謝罪命令、労組役員選に介入　伊賀市水道管理者に　県労働委　三重,https://news.yahoo.co.jp/articles/a84026b00031244c89efc9b42639f9eb9f5faf97,12/6(金) 8:02
2024-12-06,09:29,local,地域,33,北海道ニュースUHB,暴力団幹部の53歳男が朝方の飲食店で若者に暴行 20代男性が腹を蹴られる…客同士でトラブルに発展か 「蹴ったことは間違いない」 北海道千歳市,https://news.yahoo.co.jp/articles/dc790b772d8bff4abef0058cc73079f97e5614ff,12/6(金) 6:45
2024-12-06,09:29,local,地域,34,千葉日報オンライン,集団暴行し金品奪った疑い、千葉県職員ら6人逮捕　高校生含む7人被害か　八街,https://news.yahoo.co.jp/articles/c8fdf03cb9554f873dabe04b210b3768d37543b0,12/5(木) 19:34
2024-12-06,09:29,local,地域,35,NBS長野放送,コロナ、暖冬影響で客減少　今季のスキー場の営業を断念　一転、地元有志やファンの支援で営業へ　ただ運転資金1800万円足りず…クラウドファンディングで支援募る予定,https://news.yahoo.co.jp/articles/bc5b0226324fe772f9959bf8b59e0ceca7d44bd6,12/5(木) 19:07
2024-12-06,09:29,local,地域,36,茨城新聞クロスアイ,JR常磐線で沿線火災　勝田ー土浦駅間で一時運転見合わせ　茨城【まとめ】,https://news.yahoo.co.jp/articles/1bfdac74fdfde51d6b90599fb3e66bc16f544313,12/5(木) 21:37
2024-12-06,09:29,local,地域,37,北國新聞社,トラック２台と車玉突き、３人重軽傷　金沢・清湖大橋,https://news.yahoo.co.jp/articles/e5c9cf7b65ccfc021cfda075aab56d3f31a33e4d,12/6(金) 5:02
2024-12-06,09:29,local,地域,38,北海道ニュースUHB,【交際中の30代カップル】ルームミストや食料品“計32点2万3183円分を万引”店出たところで女を現行犯逮捕→男は逃走し3日後逮捕…「わたしは普通に買い物」男は否認＜北海道札幌市＞,https://news.yahoo.co.jp/articles/2e46054cf0f73872c6a8b6580e36b47fe0db7142,12/6(金) 5:30
2024-12-06,09:29,local,地域,39,ｔｙｓテレビ山口,緊急走行中のパトカー　交差点で出会い頭に軽乗用車と衝突　軽乗用車の女性は搬送　JR新山口駅近くで,https://news.yahoo.co.jp/articles/86560f0253fbba4e21d7f4620e821a36752afd34,12/5(木) 21:57
2024-12-06,09:29,local,地域,40,カナロコ by 神奈川新聞,相模原と町田市境の境川、魚５００～１０００匹死ぬ　水質異常は確認されず,https://news.yahoo.co.jp/articles/6522d5e5b0863f19ce78e8d6f1b8df8f7cb8e326,12/5(木) 21:40
