scrp_date,scrp_time,genre_en,genre_jp,rank,media_jp,title,link,date_original
2024-12-06,08:07,TTL,総合,1,スポニチアネックス,22歳人気女優　お笑い芸人にガチ告白「恋してるんですよ」　イケメン同級生ガックリ?「意味分かんない」,https://news.yahoo.co.jp/articles/0dfcab07e811570bc71b37ccd7fabd9860874366,12/5(木) 23:23
2024-12-06,08:07,TTL,総合,2,スポニチアネックス,岸谷五朗の長男がメディア初出演！「今日までずっと隠してきました」超異色の経歴の持ち主,https://news.yahoo.co.jp/articles/5541d77e186845fe58a27e7284ab77f6b0ee1ff5,12/5(木) 21:43
2024-12-06,08:07,TTL,総合,3,J-CASTニュース,丸山穂高、兵庫県元県民局長の公用PCデータとされる情報「全部見た」　「『そりゃ処分されるわ』という内容」,https://news.yahoo.co.jp/articles/da48fbb0cc51160e75c1220a18b0bf5888a3247c,12/5(木) 19:45
2024-12-06,08:07,TTL,総合,4,LIMO,「これが24年間の結果か…」ストレートで大手企業に入社した男性　自炊した夕食が話題に,https://news.yahoo.co.jp/articles/9445ac30169bffffc7c45f92aa7d30e617044620,12/6(金) 5:17
2024-12-06,08:07,TTL,総合,5,スポニチアネックス,宮迫博之「牛宮城」で超大物が大盤振る舞い！「一番高いヤツ持って来い」お値段はなんと…,https://news.yahoo.co.jp/articles/7909f2bd78117d03ec263400a686ba62bbfa6f3a,12/5(木) 20:52
2024-12-06,08:07,TTL,総合,6,スポニチアネックス,新クラブW杯組み合わせ決定!浦和はインテル、リバープレート、モンテレイと同組に,https://news.yahoo.co.jp/articles/826708f73b358deef0bbf54d14bced9e8e0edf52,12/6(金) 4:33
2024-12-06,08:07,TTL,総合,7,スポニチアネックス,ヤクルト　中日FA腕・福谷獲得調査　ソフトバンクFA石川から断りでシフトチェンジ,https://news.yahoo.co.jp/articles/74f5b03f71b87d290885b49ec46395cf7955b435,12/6(金) 1:30
2024-12-06,08:07,TTL,総合,8,東スポWEB,【ソフトバンク】柳田悠岐　２年連続の大減俸…　背負い続ける「長期大型契約」の重責,https://news.yahoo.co.jp/articles/e85ceb54fc23d12eb75a6bd9a45c8cea97597059,12/6(金) 5:16
2024-12-06,08:07,TTL,総合,9,ほ・とせなNEWS,平成7年に生まれた双子…その29年後の姿に「漫画みたい」「素敵すぎる」,https://news.yahoo.co.jp/articles/070c36f19cee588f72d1828698568202e398ed6d,12/5(木) 6:30
2024-12-06,08:07,TTL,総合,10,デイリースポーツ,チュート徳井義実　東京進出後に交際した女性に「結婚しよう」喉元でのみこんだ　女優との交際で注目の時期も,https://news.yahoo.co.jp/articles/2fc68ad2cffbdd46e8285024f4b729c7cab17b6d,12/6(金) 0:07
2024-12-06,08:07,TTL,総合,11,スポニチアネックス,初出場・千葉百音、69・33点で2位発進　グレンがトリプルアクセル着氷で首位　吉田陽菜が3位,https://news.yahoo.co.jp/articles/4ba24e7412be94f68f3fc64559eab232f0f98043,12/6(金) 6:10
2024-12-06,08:07,TTL,総合,12,BuzzFeed Japan,「希空っていう名前は…」杉浦太陽、長女の名前の由来を明かす→「泣きました」「感動」娘への想いに反響,https://news.yahoo.co.jp/articles/26fc9e98655210a9b53f4cd25fe5f712a986d890,12/5(木) 21:10
2024-12-06,08:07,TTL,総合,13,東スポWEB,【Ｆ１】角田裕毅が昇格迷うレッドブルに退団辞さない強硬発言「彼らに頼り続けることはできない」,https://news.yahoo.co.jp/articles/298aa84ac603f38bf7afe02926b46db1c5cacd17,12/6(金) 5:16
2024-12-06,08:07,TTL,総合,14,スポーツ報知,ソトの契約は１５年総額７・５億ドルで大谷翔平の７億ドル更新か　米報道,https://news.yahoo.co.jp/articles/cfb8dbde3932d0743b8479281a04901fa494a4e6,12/6(金) 6:49
2024-12-06,08:07,TTL,総合,15,弁護士JPニュース,会社内で発生する令和の“不適切”「フキハラ」「ハラハラ」「ツメハラ」って？　“新型ハラスメント” 法的に問題になるのは…【弁護士解説】,https://news.yahoo.co.jp/articles/89c1afd3d94478af0ea80c50857860b9ce7b36db,12/5(木) 10:10
2024-12-06,08:07,TTL,総合,16,スポニチアネックス,河野太郎氏　りんたろー。によるマイナカードへの“不満”に言及「やる気のある病院だったら」,https://news.yahoo.co.jp/articles/ca13fedc61f50681123c623e324d09aa90a6b499,12/5(木) 22:49
2024-12-06,08:07,TTL,総合,17,マグミクス,FC版『ドラクエ3』で友達に「ウソだ」と言われたレアアイテム　HD-2D版では簡単に手に入る…「複雑」,https://news.yahoo.co.jp/articles/8098e73e8b8256bdf39337077f6aa25636b82e7d,12/5(木) 21:45
2024-12-06,08:07,TTL,総合,18,RONSPO,大谷翔平の“盟友”テオスカー・ヘルナンデスがドジャースと再契約か…米報道,https://news.yahoo.co.jp/articles/c78cb461bffe0c5508a37df8e3f80213252ba9a6,12/6(金) 6:02
2024-12-06,08:07,TTL,総合,19,スポニチアネックス,福岡が東京Vの10番　MF見木友哉を完全移籍で獲得　横浜DF上島の獲得決定的,https://news.yahoo.co.jp/articles/706a724674dec1d717dcced2ce62c3d78c6f7724,12/6(金) 1:13
2024-12-06,08:07,TTL,総合,20,テレビ朝日系（ANN）,原因不明の病気140人超が死亡　インフルとの違いは,https://news.yahoo.co.jp/articles/8de9856aab81ec5364c1d61ede8c3c9a340f6a00,12/5(木) 20:12
2024-12-06,08:07,TTL,総合,21,西スポWEB OTTO！,「これはヤバイ…」浜崎あゆみ、テレビ出演の近影にネット仰天「14年振りにアキラが作ってくれた」深紅のチャイナドレス姿に絶賛の声,https://news.yahoo.co.jp/articles/4f268eb2db3d9cf30a60deba8f3ebe6cfddd9fca,12/5(木) 23:40
2024-12-06,08:07,TTL,総合,22,西スポWEB OTTO！,「ラヴィット」に伝説バンドがサプライズ出演でSNS騒然「朝からマジ泣いた」「世代すぎる」「いまだに鼻歌で出ちゃう」,https://news.yahoo.co.jp/articles/a5c0e69b441b65b39451172704716645cf46aeaf,12/5(木) 22:10
2024-12-06,08:07,TTL,総合,23,ねとらぼ,イモトアヤコ、購入した“圧倒的人気車”でスーパーに行くと→「後ろから警備員さんが」……　まさかの勘違いを招いてしまう,https://news.yahoo.co.jp/articles/dccb464642a2cea43e914fa8dd0ac2566141ea22,12/5(木) 17:40
2024-12-06,08:07,TTL,総合,24,高校野球ドットコム,「トライアウト2球で終了」ソフトバンク戦力外右腕がロッテ移籍決定！,https://news.yahoo.co.jp/articles/78c09dc048d1021f7b29a1358a0df5cca2a5b0a7,12/5(木) 18:20
2024-12-06,08:07,TTL,総合,25,Full-Count,先発の軸がFA権行使で流出危機も…　元コーチが太鼓判押す右腕「穴を埋める活躍が期待」,https://news.yahoo.co.jp/articles/06d56612217c861177d69f44610b5c8c6ba83c91,12/6(金) 7:20
2024-12-06,08:07,TTL,総合,26,くるまのニュース,約36万円！ スクーター界の“王者”!? クラスを“超えた”豪華装備と「乗り心地」を実現！ “セカンドバイク”にもぴったりな ホンダ「PCX」とは,https://news.yahoo.co.jp/articles/998cd8e700cf94b766541adac662b36b05e4e289,12/6(金) 5:50
2024-12-06,08:07,TTL,総合,27,LIMO,551蓬莱の豚まんを買った友人からLINE　思わず二度見する購入数に「業者か」「句読点の大切さ」,https://news.yahoo.co.jp/articles/4c56b4144fe11801541ff97eaa7acdca433ac554,12/6(金) 5:56
2024-12-06,08:07,TTL,総合,28,ねとらぼ,友達が撮るとおしゃれな1枚→父が撮ると……　“別人級の仕上がり”に「笑ったww」「ちゃんと娘っぽくしてるw」,https://news.yahoo.co.jp/articles/c7824866ea857c9db19508028a5673e574f9b96e,12/2(月) 7:30
2024-12-06,08:07,TTL,総合,29,乗りものニュース,ロシア海軍の「メッチャ静かな潜水艦」沖縄に出現！ “ポッカリ浮上”している姿を自衛隊が撮影,https://news.yahoo.co.jp/articles/d50061a80ff69ceae1a5343495ce299ec2d636bf,12/6(金) 6:12
2024-12-06,08:07,TTL,総合,30,クランクイン！,“ボンビーガール史上最大級の美女”26歳、出演から4年の近影に衝撃「可愛いすぎ」　グラビア＆スッピンも,https://news.yahoo.co.jp/articles/2aabc43647356b4531da4b97192c818b30c6a81d,12/5(木) 18:00
2024-12-06,08:07,TTL,総合,31,マグミクス,ガンダム新作にファン興奮の中「ハサウェイはどうなった？」　続報がない理由とは,https://news.yahoo.co.jp/articles/491e0d168a6810fc1cc3eae9aed8495eed51bb0a,12/6(金) 6:50
2024-12-06,08:07,TTL,総合,32,スポニチアネックス,現役プロ野球選手500人が選んだ“守備の達人”　菊池涼介が5位、吉川尚輝は4位…1位はこの選手！！！,https://news.yahoo.co.jp/articles/78ae87a4546bea91a59a55e9235b18ff5e3b95a3,12/5(木) 22:10
2024-12-06,08:07,TTL,総合,33,RONSPO,「エンゼルス時代にドジャースは簡単にPO出場しているように見えたが入団すると大変だった」大谷翔平がUSAトゥデイ紙敏腕記者の独占取材で激動の1年を振り返った,https://news.yahoo.co.jp/articles/e8b19ce5eabe021e79f75673c7d3768d56706537,12/6(金) 6:20
2024-12-06,08:07,TTL,総合,34,スポニチアネックス,「M-1」令和ロマン、ジョックロックら決勝進出9組決定！復活ロングコートダディ敗退、オズワルドら無念,https://news.yahoo.co.jp/articles/67f65e67e4a464f87973f3f2975e44da8ff1be3b,12/5(木) 21:30
2024-12-06,08:07,TTL,総合,35,ゴルフダイジェスト・オンライン（GDO）,「気づけば6つ」山下美夢有が3位発進　岩井千怜6位／米女子最終予選会,https://news.yahoo.co.jp/articles/dc951565b074b79effb62f838c62b7e2d6da0ac2,12/6(金) 7:25
2024-12-06,08:07,TTL,総合,36,ARTnews JAPAN,「9億円バナナ」を35円で売った果物店店員の窮状に、中国の富豪がバナナ10万本購入を宣言,https://news.yahoo.co.jp/articles/0dc0ad61401123df233d1302b9df6b4db0766fb8,12/6(金) 6:04
2024-12-06,08:07,TTL,総合,37,西スポWEB OTTO！,「これは超凄いぞ！！」〝400戦無敗の男〟ヒクソン・グレイシーの近影にSNS騒然！隣にいるのは…「日本の格闘技の歴史が詰まってる！」,https://news.yahoo.co.jp/articles/3ee0e2db94213a4eb956f26e6c76bfbfb6c15b44,12/5(木) 23:40
2024-12-06,08:07,TTL,総合,38,Full-Count,他球団が“飛びついた”阪神戦力外…驚異の60％　2軍無双右腕やタイトルホルダーら逸材揃い,https://news.yahoo.co.jp/articles/509132afd8c60b8b0cf0c635211012c804fed6fd,12/6(金) 6:30
2024-12-06,08:07,TTL,総合,39,東スポ競馬,【有馬記念ファン投票】ドウデュースが史上最多の４７万８４１５票で１位　ラストランでいざ連覇＆古馬３冠へ,https://news.yahoo.co.jp/articles/78fc3af010d8cdf8af4967a4ce0c2d093b40475a,12/5(木) 15:12
2024-12-06,08:07,TTL,総合,40,オリコン,石橋貴明、とんねるず武道館ライブで感動「あの画は、オレと憲武しか見られない」　次回を期待する声にも反応,https://news.yahoo.co.jp/articles/1fc1e95fd98644498d8e71c3f90f954c4b24835c,12/6(金) 5:00
