scrp_date,scrp_time,genre_en,genre_jp,rank,media_jp,title,link,date_original
2024-03-15,02:15,TTL,総合,1,スポーツ報知,大谷翔平が新妻公開？　インスタグラムで横並び写真投稿…おそろいコーデで背の高い女性が横に,https://news.yahoo.co.jp/articles/21c9d5bdf50ff121ab77ed0131c73ba21d6bfb61,3/15(金) 1:04
2024-03-15,02:15,TTL,総合,2,スポニチアネックス,大谷翔平　新妻？を伴い、韓国へ　自身インスタでおそろい「黒コーデ」披露　韓国語で「待ち遠しい」,https://news.yahoo.co.jp/articles/7764b19c156feaf90e80c913e4dd0c83bc047c9e,3/15(金) 0:58
2024-03-15,02:15,TTL,総合,3,Full-Count,大谷翔平、長身女性に寄り添う写真公開　インスタ投稿に深夜の日本騒然,https://news.yahoo.co.jp/articles/f4210758f76696670b19cdf8b7644b31f38ea4ff,3/15(金) 0:59
2024-03-15,02:15,TTL,総合,4,スポニチアネックス,がん闘病中の森永卓郎氏、魂のメッセージ　新NISAは「絶対にやってはダメ！特に中高年以降の人は危険」,https://news.yahoo.co.jp/articles/7f0c17617b3b2475e98575efcd9ce3deedb6b670,3/14(木) 15:36
2024-03-15,02:15,TTL,総合,5,デイリースポーツ,「大谷さんの奥様が初登場」「奥さん素敵－！」大谷翔平、韓国へ出発直前写真を投稿　結婚を発表したばかりの夫人も帯同か　ＳＮＳ上で話題,https://news.yahoo.co.jp/articles/fbe8a26433ebad28bb59784b82d60ac755172b99,3/15(金) 1:35
2024-03-15,02:15,TTL,総合,6,まいどなニュース,トイレでよく見るこれ→「結局なんなん？w」「え、すごい、知らなかった」メーカーに聞いた,https://news.yahoo.co.jp/articles/b5fd05024625e04d4d677bcf162e7edc1ab12f65,3/14(木) 7:50
2024-03-15,02:15,TTL,総合,7,ねとらぼ,がん闘病中の見栄晴、20回以上の放射線治療を受け変化が……　「痛がゆくなって来ました」,https://news.yahoo.co.jp/articles/e49788e4aebeb43482759654be617887947b4fe9,3/14(木) 19:50
2024-03-15,02:15,TTL,総合,8,デイリースポーツ,立花孝志氏「みんなでつくる党」破産手続き開始で「大津綾香を支援した人は覚悟して」と予告,https://news.yahoo.co.jp/articles/50e6738538183c92b55271b831714a7a85ea6795,3/14(木) 21:16
2024-03-15,02:15,TTL,総合,9,ENCOUNT,午前8時10分に『ラヴィット』出演者がキレ気味の絶叫→涙、スタジオ騒然の事態にネット「ただただ可哀想だった」,https://news.yahoo.co.jp/articles/2109f65f86aa2232350ff033e05c46aa210cad7b,3/14(木) 9:09
2024-03-15,02:15,TTL,総合,10,デイリースポーツ,大谷翔平が韓国入りに際し　女性と寄り添う姿をＳＮＳにアップ,https://news.yahoo.co.jp/articles/2196729fcfe19766ddfb048d60ecc33fcd1f8251,3/15(金) 1:14
2024-03-15,02:15,TTL,総合,11,デイリースポーツ,かまいたち山内「私の中の何かが空っぽになった」　悲しい報告に長文コメント続々「いっぱい泣いて」,https://news.yahoo.co.jp/articles/9ec27307a925c1bddb537b7ef89187ff1549de82,3/14(木) 16:03
2024-03-15,02:15,TTL,総合,12,夕刊フジ,７５歳を待たずに死亡、なぜ増えているのか　無事通過するには…生活を若い頃と大きく変える〝６５歳以前の努力〟が必要,https://news.yahoo.co.jp/articles/61f44460c4baaa14026a9763311d9fcf3d5574af,3/14(木) 17:00
2024-03-15,02:15,TTL,総合,13,スポーツ報知,安東弘樹アナ、元女性アイドルが子どもの触ったサンドイッチ全買い取り告白に「ある程度の社会の寛容というのは必要」,https://news.yahoo.co.jp/articles/c3940cb21d84d5cbf2254625f5de5f5f1e6dd715,3/14(木) 22:54
2024-03-15,02:15,TTL,総合,14,日刊スポーツ,新婚の大谷翔平が韓国へ出発！水原通訳、山本由伸らと飛行機前で記念撮影　かたわらに長身女性も,https://news.yahoo.co.jp/articles/05e1457c795f29dad7609933a2fd3e6ce7e580a5,3/15(金) 1:16
2024-03-15,02:15,TTL,総合,15,Full-Count,陽岱鋼が決意「100％の力を」　ド派手な金髪姿で登場…入団オファーは“即決”,https://news.yahoo.co.jp/articles/1fc787752e5c6437fcf7e5cb6e3244e787fa4854,3/14(木) 13:02
2024-03-15,02:15,TTL,総合,16,くるまのニュース,ホンダ「新型ミニバン」日本初公開！ 次期「ステップワゴン!?」と反響！ 斬新「“窓なし”丸テール」が未来的な新型「スペースハブ」市販化はどうなる？,https://news.yahoo.co.jp/articles/5334a5b9b63d171e71360a3a58b4c6e2208097d3,3/14(木) 12:30
2024-03-15,02:15,TTL,総合,17,まいどなニュース,「お風呂のお湯は翌日も追い炊きOK？」「42度以下の設定で菌が発生する？」→お風呂の給湯問題に決着！メーカーに聞いた,https://news.yahoo.co.jp/articles/aa2dba1aa2599573d9fb45e98c5815bb8968fcd6,3/14(木) 8:00
2024-03-15,02:15,TTL,総合,18,日テレNEWS NNN,有吉弘行「奥さんが寝てても」　時間を気にせず行うことを明かす,https://news.yahoo.co.jp/articles/6f06511df879b28c6bdd2f4e07d0cb9049acae67,3/14(木) 22:05
2024-03-15,02:15,TTL,総合,19,よろず～ニュース,ゆたぼん、高校受験の不合格を発表「すごくショック」今後について「またご報告させてもらおうと思います」,https://news.yahoo.co.jp/articles/d54783a8b9f4892fe73d82f6322e878ed7357bbc,3/14(木) 20:11
2024-03-15,02:15,TTL,総合,20,時事通信,旧N党、負債11億円で破産,https://news.yahoo.co.jp/articles/149dfc30b304a39bf7b53f2155af177bb17a3ced,3/14(木) 20:34
2024-03-15,02:15,TTL,総合,21,婦人公論.jp,大神いずみ「長男・翔大の履正社の卒業式。挨拶はまさかの短さ！関西弁に囲まれながら〈学校の皆さんに育てていただいたんだなあ〉と感慨深い」,https://news.yahoo.co.jp/articles/d594265c78c33a540181863942dd812f851d5850,3/14(木) 12:01
2024-03-15,02:15,TTL,総合,22,チューリップテレビ,“父親からの性被害”訴える24歳女性「実名・顔出し」決断までの苦悩告白…夫との出会い、自殺未遂、結婚…逮捕の父親は黙秘,https://news.yahoo.co.jp/articles/e30fa8c1f69c5310a66ca2f789aa4e977d2ea09c,3/14(木) 20:27
2024-03-15,02:15,TTL,総合,23,ねとらぼ,菊池風磨と“匂わせ”疑惑浮上のアーティストに再び指摘の声か　「なんかずっと巻き込まれてるな」と意味深ポスト,https://news.yahoo.co.jp/articles/64f8dad583b7d3a72817c100488a868fe1b2228b,3/14(木) 18:35
2024-03-15,02:15,TTL,総合,24,日刊スポーツ,堀江貴文氏「野菜食べたら健康ってアホみたいな信仰」と指摘「肉食わないと大谷翔平産まれねー」,https://news.yahoo.co.jp/articles/7b973feb85895e5326542c7fc31c8e52716eb2ee,3/14(木) 23:43
2024-03-15,02:15,TTL,総合,25,日刊スポーツ,ゆたぼん高校不合格明かす「落ち込んでも…」中３の２学期から登校再開、今後は「また報告」,https://news.yahoo.co.jp/articles/ef2519167cf8c10d27ce7471900edaa959be4ac2,3/14(木) 22:13
2024-03-15,02:15,TTL,総合,26,ねとらぼ,「アゲアゲ酔っぱらい～」　沢尻エリカ、六本木のクラブでノリノリ投げキッス　金髪＆大胆ファッションに「本当に美人」「一生綺麗」,https://news.yahoo.co.jp/articles/04cd24b6f3a46bfdf53d6a8d8007951dc639c966,3/14(木) 12:35
2024-03-15,02:15,TTL,総合,27,J-CASTニュース,注目浴びるTOKYO BASEの「初任給40万円」、実は「公序良俗に反して無効」の可能性　弁護士が指摘する「固定残業代80時間分」の問題点,https://news.yahoo.co.jp/articles/ad5b1b9e7e35d71ffad4b4ee13a1ab1f808f2760,3/14(木) 16:59
2024-03-15,02:15,TTL,総合,28,ねとらぼ,遠野なぎこ、「もう一度ママになりたい」心境激白　闘病生活続くも「私、母性だけは異常に強いんだ」,https://news.yahoo.co.jp/articles/252018ff2ddf186fca168013bda6043f4817a509,3/14(木) 13:02
2024-03-15,02:15,TTL,総合,29,ねとらぼ,80代一人暮らし女性が“365日毎日食べている”朝食に驚き！　健康ルーティンに「お手本にしています」の声続々,https://news.yahoo.co.jp/articles/090cb17c3e1b6aa3bf217bb1470d06b98c42419b,3/14(木) 22:00
2024-03-15,02:15,TTL,総合,30,中央日報日本語版,小児麻痺で７０年間「鉄の肺」の中で過ごした米国人男性、７８歳で死去,https://news.yahoo.co.jp/articles/70d3e68e05080127e493b88ed0e0f91f1702b1bd,3/14(木) 7:53
2024-03-15,02:15,TTL,総合,31,ねとらぼ,桐朋高等学校、78期卒業生の答辞に賛辞やまず　「只者ではない」「感動のあまり泣いて10回読み直した」,https://news.yahoo.co.jp/articles/17d30eecde6afe873826ffe06a5ed560c1b1d5db,3/13(水) 18:46
2024-03-15,02:15,TTL,総合,32,日刊スポーツ,大谷翔平の投稿にSNS騒然「大谷の奥さん」「奥さん公開」などトレンド　靴おそろい長身女性,https://news.yahoo.co.jp/articles/fd9da919c3822094b532dc995614352ad40ff360,3/15(金) 1:38
2024-03-15,02:15,TTL,総合,33,東スポWEB,ゆたぼん　県立高校は不合格「すごくショックなんですけど仕方がない」,https://news.yahoo.co.jp/articles/74c734c5d975834b5cf85ce752768a4cc24f1990,3/14(木) 20:32
2024-03-15,02:15,TTL,総合,34,TBS NEWS DIG Powered by JNN,“通勤通学ラッシュ”の時間帯に…京王線車内で女子高校生に約15分間わいせつ行為を繰り返したか　45歳の男逮捕　警視庁,https://news.yahoo.co.jp/articles/c62855e255cb889b5d7ed6f097c1bc2fa8384d2c,3/14(木) 16:38
2024-03-15,02:15,TTL,総合,35,千葉日報オンライン,【速報】最大震度5弱の地震　震源は福島県沖　千葉県は東金、千葉市など震度2,https://news.yahoo.co.jp/articles/372bf41b3d4de231c8e51da49a6c9903bba0bda8,3/15(金) 0:32
2024-03-15,02:15,TTL,総合,36,サンケイスポーツ,大谷翔平が夫人を公開？　インスタグラムに長身女性との写真をアップ,https://news.yahoo.co.jp/articles/bb7d1287177d92aec0e7ef5eb0749c73a41b32d1,3/15(金) 1:27
2024-03-15,02:15,TTL,総合,37,スポニチアネックス,巨人・阿部監督　OP戦打率・500のルーキー佐々木に「すげえなと」オドーアは「時差ぼけじゃない？！」,https://news.yahoo.co.jp/articles/f3cf6bf7a6dd030cdac80fe4a6958c9585366617,3/14(木) 21:28
2024-03-15,02:15,TTL,総合,38,Full-Count,現役ドラフトで「なぜ出された」　防御率0.00…24歳左腕が衝撃無双「ええのもろたわ」,https://news.yahoo.co.jp/articles/9cee6131f4b7899fb7f44408cb035bae6e009501,3/14(木) 17:06
2024-03-15,02:15,TTL,総合,39,スポニチアネックス,下咽頭がんステージ4　見栄晴、放射線治療の影響で肌が…副作用に驚きの声「これはつらいですね」,https://news.yahoo.co.jp/articles/0ffd634a77cde1387c22211e4fc65676579e1fe8,3/14(木) 11:14
2024-03-15,02:15,TTL,総合,40,読売新聞（ヨミドクター）,ペットボトルのふたはどう開けている？　開け方でわかるフレイルのサイン…鹿児島大と「伊藤園」が研究,https://news.yahoo.co.jp/articles/353ebdb4943dbdf053d297e2f25e2a8bb5582777,3/14(木) 11:40
