scrp_date,scrp_time,genre_en,genre_jp,rank,media_jp,title,link,date_original
2025-03-24,22:13,domestic,国内,1,J-CASTニュース,民泊に1人で予約→6人で滞在、ゴミも散乱　中国人客に追加料金＆清掃代請求、経営者が明かしたその顛末,https://news.yahoo.co.jp/articles/e05f4171f5f1b43c1e5b56e7963c8e0dfda6c81f,3/24(月) 17:17
2025-03-24,22:13,domestic,国内,2,J-CASTニュース,「極めて重大かつ許されない不敬行為」で「観光目的での参入を全てお断り」　対馬の神社が異例声明,https://news.yahoo.co.jp/articles/84b9188b6497822099cdf873d2b22cbfe5da104d,3/24(月) 11:20
2025-03-24,22:13,domestic,国内,3,ABEMA TIMES,「前輪のあたりに挟まれている」軽トラックが小学生4人に突っ込み、女児1人が心肺停止 静岡・浜松市,https://news.yahoo.co.jp/articles/758a222d6f5afb290e60c52c13a6b301ce880572,3/24(月) 18:36
2025-03-24,22:13,domestic,国内,4,産経新聞,斎藤知事肝いり県予算案、可決も自民6県議が退席　県立大授業料無償化巡る修正動議は否決,https://news.yahoo.co.jp/articles/425ab161a61312b2b04e8cd6a6932c2931d00268,3/24(月) 20:01
2025-03-24,22:13,domestic,国内,5,東海テレビ,乗っていたバスが突然林へ…22人が死傷した大型バス事故 乗客が語った“その時”「急に来て出血した方が何人も」,https://news.yahoo.co.jp/articles/3090d202bd62a41c549932cb45c6447f40add8f8,3/24(月) 21:07
2025-03-24,22:13,domestic,国内,6,デイリースポーツ,【ほぼ全文】橋下氏、生番組で大爆発７分→泉房穂氏の参院選「卑怯ずるい」「テレビ名前売り楽な選挙」「西村さんの首取らず何が政権」　リンゴ「これＴＶで流れてるの？」,https://news.yahoo.co.jp/articles/2ce6a94741cda21888e5f6c2a6e3a18dd9bba1d0,3/24(月) 15:26
2025-03-24,22:13,domestic,国内,7,共同通信,ロードサービスで高額請求　消費者庁がサイト名公表で注意,https://news.yahoo.co.jp/articles/4a0f38483472c0d96d604fd3a577dc477ccf920c,3/24(月) 19:08
2025-03-24,22:13,domestic,国内,8,TBS NEWS DIG Powered by JNN,【速報】埼玉・狭山市で池の水を抜いた後に集めたごみの袋の中から人の頭蓋骨発見　事件・事故の可能性も視野に身元の特定急ぐ　埼玉県警,https://news.yahoo.co.jp/articles/d762d4617b45fed97e63263880b1e64228128cf7,3/24(月) 20:52
2025-03-24,22:13,domestic,国内,9,FNNプライムオンライン,「10万円商品券」問題の波紋さらに…石破内閣支持率急落　自民支持率も20.8％に下落　岸田内閣時の最低支持率も下回る　FNN世論調査,https://news.yahoo.co.jp/articles/77f4dc1876acbb0c3ecce573e64f9c9edd3189c9,3/24(月) 20:02
2025-03-24,22:13,domestic,国内,10,FNNプライムオンライン,あの日足先を濡らしたサリン「私が電車を止められていたら」16歳少女が30年間抱えた葛藤と静かな痛み【地下鉄サリン事件30年】,https://news.yahoo.co.jp/articles/e502f385ff17e1b22593e1936a32d3940713f184,3/20(木) 18:02
2025-03-24,22:13,domestic,国内,11,共同通信,兵庫県議会傍聴で暴行疑い　自称ジャーナリスト逮捕,https://news.yahoo.co.jp/articles/6648abaa63324d872811ae96682b826ab70f9aa1,3/24(月) 19:47
2025-03-24,22:13,domestic,国内,12,デイリースポーツ,橋下徹氏　「斎藤さんを支持している方に考えてもらいたい」→選挙で許される問題と許されない問題がある,https://news.yahoo.co.jp/articles/709785c616f96ac20b7849284017252deea8f29e,3/24(月) 10:32
2025-03-24,22:13,domestic,国内,13,読売新聞オンライン,兵庫県の斎藤知事に共産党県委が辞職要求…「首長としての資質を備えていない」,https://news.yahoo.co.jp/articles/73fa44fe0b9fa4346f4a8817531d305c38fc3ad9,3/24(月) 19:20
2025-03-24,22:13,domestic,国内,14,J-CASTニュース,駅の券売機「裏コマンド的な？」テンキーでチャージ　Xで話題、実は約30年前に導入,https://news.yahoo.co.jp/articles/c0563a936462ba1074028dc02804897ced0918f0,3/24(月) 17:54
2025-03-24,22:13,domestic,国内,15,共同通信,十八親和銀で行員がまた現金着服　顧客から4年で9200万円,https://news.yahoo.co.jp/articles/5902535fa0bb5153fdaee65a956d46cd15c063fc,3/24(月) 15:55
2025-03-24,22:13,domestic,国内,16,中日スポーツ,倉田真由美さん、炎上のストリートピアノ投稿に「誰かを特別扱いすることは、誰かを蔑ろにすることにもつながる」,https://news.yahoo.co.jp/articles/062dcd4c6cb9803da9407a90484ac3d8e71ad9eb,3/24(月) 21:15
2025-03-24,22:13,domestic,国内,17,J-CASTニュース,ストリートピアノが異例の注意喚起「練習は家でしてください」　SNS上では物議「撤去すればいい」の声も,https://news.yahoo.co.jp/articles/2b4ecd165b0ad5ffc3e47b5e7ba0bf13ab0e0721,3/24(月) 15:10
2025-03-24,22:13,domestic,国内,18,産経新聞,沖縄の市民団体がワシントン事務所の予算増額求め会見「減額なら不当、無駄な証拠示して」,https://news.yahoo.co.jp/articles/40aeddfa95d0d075554ea1d718d6b838fa3ba88a,3/24(月) 17:43
2025-03-24,22:13,domestic,国内,19,共同通信,給与増へ官民比較見直しを提言　国家公務員のなり手不足解消へ,https://news.yahoo.co.jp/articles/e8a4fbdf4eb9844e2a9b913e7e90e7a0ccdabfc6,3/24(月) 12:50
2025-03-24,22:13,domestic,国内,20,共同通信,バス廃止事業者に代替手段要求　長野知事「補助出せない」,https://news.yahoo.co.jp/articles/5cdbb499c471776c6be77229fb0f45bc2ac0f1bc,3/24(月) 20:06
2025-03-24,22:13,domestic,国内,21,FNNプライムオンライン,逮捕された78歳男「なぜぶつかったかはわからない」　女児1人死亡・1人重体　小学生の集団に軽トラックが後ろから突っ込む,https://news.yahoo.co.jp/articles/f1e49caf5e39f2d99880f612e061a4630c08e9bc,3/24(月) 21:13
2025-03-24,22:13,domestic,国内,22,共同通信,浜松の事故で心肺停止の女児死亡,https://news.yahoo.co.jp/articles/b463e934e89e83b7cf389ff03f80377d33ef7b1d,3/24(月) 21:06
2025-03-24,22:13,domestic,国内,23,時事通信,自民、立維案を批判　企業献金禁止は「乱暴」　衆院特別委,https://news.yahoo.co.jp/articles/82ffcf445d525eb67cdf7ec27b3fa4f034960462,3/24(月) 19:17
2025-03-24,22:13,domestic,国内,24,テレビ朝日系（ANN）,岡山・愛媛で大規模山火事　周辺に高齢者施設や工場も,https://news.yahoo.co.jp/articles/f62d9edf77532949beaae96deeedd1e677cd3c00,3/24(月) 19:51
2025-03-24,22:13,domestic,国内,25,日刊スポーツ,大阪・関西万博での校外学習を「強制しないで」保護者有志の署名活動に賛同2万7000超,https://news.yahoo.co.jp/articles/eda8de321f8f325bf0bdc3a4d4329226459aeb20,3/24(月) 18:40
2025-03-24,22:13,domestic,国内,26,日テレNEWS NNN,東京大空襲“無差別爆撃”はなぜ行われたのか　米司令官の肉声から内幕に迫る『every.特集』,https://news.yahoo.co.jp/articles/263455aeedf638a7f498ed57d2620e568c5db2bc,3/15(土) 7:02
2025-03-24,22:13,domestic,国内,27,朝日新聞,兵庫県議会の受付で暴行容疑、自称ジャーナリスト逮捕　傍聴席入れず,https://news.yahoo.co.jp/articles/40a9d716afdcf325df23980a40ea91e2afd84e76,3/24(月) 16:24
2025-03-24,22:13,domestic,国内,28,毎日新聞,国家公務員の人材確保「危機的状況」　人事院の有識者会議が提言,https://news.yahoo.co.jp/articles/a5ed091dae19a3dbee91ff4ddbf1fda375f4bead,3/24(月) 12:35
2025-03-24,22:13,domestic,国内,29,産経新聞,大阪・関西万博「全く行きたくない」44・2％　約7割が来場に否定的　産経・FNN合同世論調査,https://news.yahoo.co.jp/articles/95dc1724bf5d5e2d252a2090fa42b3205998e0d5,3/24(月) 15:16
2025-03-24,22:13,domestic,国内,30,日刊スポーツ,泉房穂　橋下氏の「ずるい立候補」批判コメに「それは政治評論家としてのコメント」と一蹴,https://news.yahoo.co.jp/articles/50a80d1a52868932026903dc264ac74b2149b055,3/24(月) 17:18
2025-03-24,22:13,domestic,国内,31,共同通信,【独自】ホスピス最大手で不正か　全国120カ所「医心館」,https://news.yahoo.co.jp/articles/9b3fdfcdca933bd53cdacde28d47dc7cb1d9ad71,3/23(日) 21:00
2025-03-24,22:13,domestic,国内,32,FNNプライムオンライン（フジテレビ系）,自民・森山幹事長　予算案「何としても年度内成立目指す。土日を使ってでも」　暫定予算案は「お断りした」,https://news.yahoo.co.jp/articles/89f485fae9da5a600757215c3a1d4bafef98d490,3/24(月) 19:22
2025-03-24,22:13,domestic,国内,33,デイリースポーツ,杉田水脈前衆院議員　テレ朝番組からコメント依頼も断る「番組呼んで」も断られ「ので、こちらも」,https://news.yahoo.co.jp/articles/06d69cd4645728ca2c9c3e523bb4fc30f30a5eb1,3/24(月) 18:42
2025-03-24,22:13,domestic,国内,34,時事通信,空港内農地の明け渡し命令　仮執行は認めず　千葉地裁,https://news.yahoo.co.jp/articles/0c7b78d81be347d9bcb5b4921a905c0aaf82adc3,3/24(月) 20:37
2025-03-24,22:13,domestic,国内,35,東海テレビ,生徒が情報開示請求して発覚…中学校が高校入試に使う調査書の成績間違える 本来の1月末でなく2学期末を提出,https://news.yahoo.co.jp/articles/9b42cf61b8e408df5bdcc4f19142178913f3cb24,3/18(火) 22:00
2025-03-24,22:13,domestic,国内,36,TBS NEWS DIG Powered by JNN,【天気が急変】きょう（24日）夜から落雷、竜巻、ひょうなどに注意を!関東地方に雨予報　気象庁「全般気象情報」発表【雨はいつから?今後の天気予想シミュレーション】,https://news.yahoo.co.jp/articles/62717bcd6a5b1df0662a5a97368defef262561ba,3/24(月) 19:28
2025-03-24,22:13,domestic,国内,37,デイリースポーツ,泉房穂氏　出馬会見で批判してくる橋下氏に反撃砲火「橋下氏も立候補したら？いつまでも政治評論家やっとらんと！」←会見裏の生ＴＶで猛批判され秒速反撃,https://news.yahoo.co.jp/articles/5f324b8c5514900def1df911ecf49416b204b486,3/24(月) 16:22
2025-03-24,22:13,domestic,国内,38,時事通信,新司令官「新たな歴史築く」　戦闘機パイロット、熱血漢の一面も　自衛隊統合作戦司令部,https://news.yahoo.co.jp/articles/0b592e74d13b52b5494719ca07e1e82602640e28,3/24(月) 20:31
2025-03-24,22:13,domestic,国内,39,朝日新聞,小学生に車突っ込む、1人死亡1人意識不明　78歳運転手逮捕　浜松,https://news.yahoo.co.jp/articles/9b559df529929c00b885f909ee579a0e570287e8,3/24(月) 21:03
2025-03-24,22:13,domestic,国内,40,日刊スポーツ,「百条委員会まで作ったのに何だったんだ」斎藤知事の問題は議会も問われるべき…フジ番組で指摘,https://news.yahoo.co.jp/articles/e45bc38190e30c4e5f49dd0904e17fd0034841d4,3/24(月) 10:21
