scrp_date,scrp_time,genre_en,genre_jp,rank,media_jp,title,link,date_original
2025-07-14,11:47,sports,スポーツ,1,RONSPO,「監督が負け惜しみを言っている限り最下位を脱せない」ヤクルト高津監督が阪神“サトテル”24号2ラン前の判定を「あんなの三振。ハーフスイングじゃない」と批判した発言がSNSで物議,https://news.yahoo.co.jp/articles/500b415910a7adcfa8e1c8503bb11180ab3e96c6,7/14(月) 8:04
2025-07-14,11:47,sports,スポーツ,2,Full-Count,大谷翔平、空港での“肩組みショット”公開　オールスターへ出発…SNS更新,https://news.yahoo.co.jp/articles/e712100ab921524ecd885204c68a48f142468150,7/14(月) 9:45
2025-07-14,11:47,sports,スポーツ,3,ENCOUNT,“伝説の喧嘩師”、わずか4秒で沈む衝撃KOに会場もネットも騒然「幻想が…」「弱すぎ」「正直一番印象に残った」,https://news.yahoo.co.jp/articles/66f580ac46ee532a61f39fe92f99d434b85f9f9b,7/14(月) 9:44
2025-07-14,11:47,sports,スポーツ,4,ENCOUNT,“ドタキャン”飯田将成に「オファーすることはない」　朝倉未来はきっぱり、今後の参戦は「考えづらい」,https://news.yahoo.co.jp/articles/c5e04a158ad0a56b2bbe257e5576c0ffad9b7c1a,7/14(月) 10:09
2025-07-14,11:47,sports,スポーツ,5,スポニチアネックス,MLBドラフト全体1位は、再分類で“飛び級”の17歳ウィリッツ、父は元エンゼルス外野手,https://news.yahoo.co.jp/articles/5df3e931dd258f4de471ecca6f5425f6a4fa1dc9,7/14(月) 8:04
2025-07-14,11:47,sports,スポーツ,6,中日スポーツ,相手選手を“殴打”!?…ルイスエンリケ監督が弁明「目的は選手たちを引き離すことだった」処分の可能性も【クラブW杯決勝】,https://news.yahoo.co.jp/articles/fc06f3c135f3398608276d3824dab1b12903a1ab,7/14(月) 9:30
2025-07-14,11:47,sports,スポーツ,7,スポーツ報知,「悲報」山本由伸、９勝目消滅にファン悲鳴「気の毒すぎる」「ふざけてんの？？」「由伸の勝ちが消されてて泣いた」,https://news.yahoo.co.jp/articles/91544af716da15485671aeb2b076eaa7fbef0248,7/14(月) 8:21
2025-07-14,11:47,sports,スポーツ,8,スポーティングニュース日本版,先場所は現役親方も激怒!? 大相撲名古屋場所、新横綱・大の里戦で発生した残念なマナー違反,https://news.yahoo.co.jp/articles/130c2d6ef8d1f55bf0a25253ee020b34de5e3e37,7/14(月) 6:00
2025-07-14,11:47,sports,スポーツ,9,TBS NEWS DIG Powered by JNN,山本由伸 7回無失点の好投もスコットが9回1死から同点被弾 大谷は四球で先制の起点、ド軍延長で勝ち越し連勝,https://news.yahoo.co.jp/articles/7eabf708217289146d053e308051216c019fd671,7/14(月) 8:07
2025-07-14,11:47,sports,スポーツ,10,デイリースポーツ,「目がキマリすぎててまじで恐怖」顔が怖すぎる瓜田純士の弟分、元アウトサイダー対決完敗もＳＮＳ騒然「華ありすぎやろ」「どこがモブやねん」,https://news.yahoo.co.jp/articles/db0b283317b6ffa14ec7a6d60c165f8067848828,7/14(月) 7:00
2025-07-14,11:47,sports,スポーツ,11,デイリースポーツ,山本由伸　フリーマンが明かした秘話「真ん中には絶対投げない」他球団の打者が一塁でこぼす「それが嫌なんだ」称賛惜しまず「素晴らしい前半戦」,https://news.yahoo.co.jp/articles/b371dd66771b8846318a2d83e0b67c38903f9931,7/14(月) 8:52
2025-07-14,11:47,sports,スポーツ,12,スポーツ報知,佐々木朗希がブルペン投球を再開、８月下旬の復帰を目指す…ロバーツ監督が明かす「順調に進んでいます」,https://news.yahoo.co.jp/articles/2ef5755b3fc3d01c6771c15a20624ceb39cfb4f2,7/14(月) 3:49
2025-07-14,11:47,sports,スポーツ,13,デイリースポーツ,日本ハム　清宮幸太郎が大物芸能人夫婦に「こんな日が来るとは」エスコンで２１ユニ着て応援　ファンびっくり「どういう関係なの？」,https://news.yahoo.co.jp/articles/b3b558b44be506293afe07882a98767f8f84bf53,7/14(月) 8:32
2025-07-14,11:47,sports,スポーツ,14,Full-Count,山本由伸の9勝目が消滅　9回1死からスコットが痛恨の同点弾被弾…ロバーツ監督は呆然,https://news.yahoo.co.jp/articles/c24369d4634e8d736748b4deca270b9f8bc6231d,7/14(月) 7:30
2025-07-14,11:47,sports,スポーツ,15,スポニチアネックス,大谷翔平　球宴出場ドジャース5人衆の写真公開　チャーター機でアトランタ出発前に記念撮影,https://news.yahoo.co.jp/articles/2b364155ffc70d0bf818bfb542c4eca9a255bb01,7/14(月) 10:27
2025-07-14,11:47,sports,スポーツ,16,Full-Count,ド軍ロバーツ監督「今日は山本が引っ張ってくれた」　勝ち消滅もエースの力投を絶賛,https://news.yahoo.co.jp/articles/25f0a7515d848f8f4fa9fa99f9de70604014abcc,7/14(月) 8:47
2025-07-14,11:47,sports,スポーツ,17,デイリースポーツ,【セレクトセール２５】ソフトバンク柳田悠岐が２３００万円でノーマルシー２４を落札　カラヴァッジオ産駒,https://news.yahoo.co.jp/articles/e49b1d9d39d75411a44af81a97495cfd4fa8b556,7/14(月) 11:11
2025-07-14,11:47,sports,スポーツ,18,ベースボールキング,佐々木氏、首位・阪神は「やる野球が選手がわかっています」、「ブレないですよ、作戦面で」,https://news.yahoo.co.jp/articles/a478968cf0610a303e90b9dd062199135f3437bd,7/14(月) 10:00
2025-07-14,11:47,sports,スポーツ,19,東スポWEB,大谷翔平をピッチングニンジャが絶賛「今のドジャースで一番の投手」,https://news.yahoo.co.jp/articles/6cde8e1058b33d278d01930771f7b10e67ac7790,7/14(月) 10:41
2025-07-14,11:47,sports,スポーツ,20,デイリースポーツ,【セレクトセール２５】初日初の１億円超えは上場番号１番メチャコルタ２４　コントレイル産駒　落札者は窪田芳郎氏で福永厩舎に預託予定「この馬でダービーに行けたら」,https://news.yahoo.co.jp/articles/e5c9c53ddd1751d48b842515bfee04da8aab5258,7/14(月) 10:31
2025-07-14,11:47,sports,スポーツ,21,Full-Count,9回1死から同点被弾…ド軍“守護神”にファン嘆き「今季7度目の失敗」「また」,https://news.yahoo.co.jp/articles/f0f34a2d62c4eeea42bb17545f8fc07df48c0035,7/14(月) 8:01
2025-07-14,11:47,sports,スポーツ,22,Full-Count,大谷翔平が背伸びしてニコリ　山本由伸と身長争い？　球団SNSがほっこり写真公開,https://news.yahoo.co.jp/articles/432a5ade0ddd137b46c568c8f70aa7c190014ea4,7/14(月) 10:15
2025-07-14,11:47,sports,スポーツ,23,RONSPO,劇的幕切れを演出した阪神の森下翔太スーパービームの裏に虎“最強スカウト”の眼力,https://news.yahoo.co.jp/articles/a7cee6cd3a59b58cf0f9f1242d142b3a74a3e874,7/14(月) 6:24
2025-07-14,11:47,sports,スポーツ,24,Full-Count,ド軍指揮官が苦言「いつも同じコースが」　また背信…守護神がMLB最多7度目のセーブ失敗,https://news.yahoo.co.jp/articles/74c0404aa819e9419c9069bcbbca65110be6f17c,7/14(月) 9:35
2025-07-14,11:47,sports,スポーツ,25,日刊スポーツ,【阪神】他球団関係者との雑談で何度も話題に…高橋遥人が待望の復活　リーグ優勝へ強力な追い風,https://news.yahoo.co.jp/articles/fe70458f1875e74a595ce374527ff05fb1aa5996,7/14(月) 11:00
2025-07-14,11:47,sports,スポーツ,26,デイリースポーツ,山本由伸　大谷翔平と背伸び対決に「かわいい」の声続出　レジェンド２人も微笑ましく見つめる　アトランタ移動前の珍光景,https://news.yahoo.co.jp/articles/69c159b61e31f4b5aab18f2ed907f05c0b2e17d3,7/14(月) 10:37
2025-07-14,11:47,sports,スポーツ,27,日刊スポーツ,菊池雄星の妻・深津瑠美さん、一家でアトランタへＧＯ！　長男レオ君もレッドカーペット登場か,https://news.yahoo.co.jp/articles/2d5634a7697c1a6f319d6ef12d602e40eda7e118,7/14(月) 10:21
2025-07-14,11:47,sports,スポーツ,28,デイリースポーツ,飯田将成辞退で電撃出場の溝口勇児ＣＯＯがＳＡＴＯＲＵに執念星　飯田に痛烈マイク「おい、へたれ。お前プロだろ、びびってんなカス、と朝倉兄弟が言えと」,https://news.yahoo.co.jp/articles/4a167bbb9a69bcf594a3d405c51e8507eb68d8d7,7/13(日) 20:56
2025-07-14,11:47,sports,スポーツ,29,CoCoKARAnext,藤川阪神の真骨頂　豊田降格に見る、チームプレーの徹底ぶりに称賛の声　「より、競争意識が高まるな」,https://news.yahoo.co.jp/articles/e1f86571bb136c5945a52987e8ea9c99ca777c7c,7/14(月) 11:03
2025-07-14,11:47,sports,スポーツ,30,ENCOUNT,「久々に見た」「起用謎すぎる笑」　BreakingDown解説席にいた意外な人物にネット驚き「なぜ呼んだ？」,https://news.yahoo.co.jp/articles/c4d2c691f870da5f6cbdac624e4991a1fab794c6,7/14(月) 9:02
2025-07-14,11:47,sports,スポーツ,31,日刊スポーツ,【バドミントン】志田千陽「お顔が天才的に可愛い」18歳宮崎友花と“夢のコラボショット”公開,https://news.yahoo.co.jp/articles/4dd9dae1565edfab1ce166333a21f383f439853b,7/14(月) 10:24
2025-07-14,11:47,sports,スポーツ,32,中日スポーツ,トランプ大統領、空気を読めない“奇行”にチェルシーの選手も困惑…歓喜トロフィーの場面でも『ど真ん中』に居座る【クラブW杯】,https://news.yahoo.co.jp/articles/ed919c6dce88336c71854e79ffc32a42933d2992,7/14(月) 9:51
2025-07-14,11:47,sports,スポーツ,33,Full-Count,研究続けて驚異の159キロ　ドラフト候補右腕が明かす成長の秘密「凄くシンプル」,https://news.yahoo.co.jp/articles/bdfa57ba7ffa2684229844328d73023de94da00d,7/14(月) 10:53
2025-07-14,11:47,sports,スポーツ,34,Full-Count,大谷翔平に脱帽…実況が思わず漏らした声　次々圧倒、別次元の4分間に「おーほっほっ」,https://news.yahoo.co.jp/articles/38aa756cffaec560e518a787804d7c6be64ad369,7/14(月) 6:03
2025-07-14,11:47,sports,スポーツ,35,日刊スポーツ,ロバーツ監督「よく踏ん張ってくれた」山本由伸の７回無失点、三塁踏ませぬ快投を高評価,https://news.yahoo.co.jp/articles/030984dbcdba3aecdc1ebb0e5b96953cccf7edcd,7/14(月) 9:21
2025-07-14,11:47,sports,スポーツ,36,スポニチアネックス,【リーグワン】浦安が山中亮平の獲得を発表「新しいチャレンジにワクワク」19、23年W杯日本代表,https://news.yahoo.co.jp/articles/04c8b32bc49478db6a4c1e65ba6be2719e31dfe4,7/14(月) 10:26
2025-07-14,11:47,sports,スポーツ,37,日刊スポーツ,「ショウヘイの代わりに俺を代打で使わない？」ロバーツ監督がリーグ首位打者のおねだりを明かす,https://news.yahoo.co.jp/articles/a6623edc665b700702458b48e80af4746ec027a2,7/14(月) 11:20
2025-07-14,11:47,sports,スポーツ,38,日テレNEWS NNN,死球のあとの投球を・・・　巨人・赤星優志　阿部監督から告げられた言葉,https://news.yahoo.co.jp/articles/e358be43f71049cea501a0d45c35d9c023e86789,7/14(月) 10:47
2025-07-14,11:47,sports,スポーツ,39,ゲキサカ,レアンドロ・ダミアンがアマチュアチームで現役復帰へ!! 元ブラジル代表で川崎Fでも活躍,https://news.yahoo.co.jp/articles/f8a585376646d1bdcab05a9e5b11e0b2e5f1505c,7/14(月) 11:05
2025-07-14,11:47,sports,スポーツ,40,Full-Count,大谷翔平ら5選手が空港で笑顔　ド軍が“貴重な1枚”を公開…オールスターへ出発,https://news.yahoo.co.jp/articles/7f6d25050f2d498845eb06669c8f4d835cc5ecf8,7/14(月) 10:02
