scrp_date,scrp_time,genre_en,genre_jp,rank,media_jp,title,link,date_original
2025-02-01,07:06,domestic,国内,1,共同通信,小学校更衣室に録画スマホ、所有の教諭死亡,https://news.yahoo.co.jp/articles/3504d48448d8bd080c10a6736f2a21134901547e,1/31(金) 20:45
2025-02-01,07:06,domestic,国内,2,共同通信,更衣室にスマホ、所有の教諭死亡　小学校側の聞き取り後に,https://news.yahoo.co.jp/articles/86fce650fefe25c99773b35d9f869aab2f0a47a6,1/31(金) 20:54
2025-02-01,07:06,domestic,国内,3,tenki.jp,明日2日(日)は東京都心でも雪　一部では積雪の恐れも　交通機関の乱れに注意,https://news.yahoo.co.jp/articles/6f5b521560a84fa383fa930fe5cd2ec81cf2698c,2/1(土) 6:30
2025-02-01,07:06,domestic,国内,4,J-CASTニュース,ビデオカード抽選で中国人客大集結、幼稚園侵入で警察出動も...秋葉原のPC店が明かした一部始終,https://news.yahoo.co.jp/articles/38a9b2fb6951c19195d0054e3fda24f07adbdb13,1/31(金) 20:52
2025-02-01,07:06,domestic,国内,5,日テレNEWS NNN,「事件が起きた時間帯は自分の家にいた」勤務先の中学校近くで男性“殺害”中学校教諭の男（38）の被告人質問　東京地裁,https://news.yahoo.co.jp/articles/8d690664303a52d5884c041fd2cb0401e6ebd6c2,1/30(木) 18:15
2025-02-01,07:06,domestic,国内,6,J-CASTニュース,ビニールケースにお金入れる「100均財布界隈」増殖中...キーワードは「共感」、識者と背景を考えた,https://news.yahoo.co.jp/articles/7198e6c66e6180c54bf71da99acc6e2501803c3b,1/31(金) 20:26
2025-02-01,07:06,domestic,国内,7,テレビ朝日系（ANN）,「下水道管に落下の可能性」　穴拡大で救助難航“スロープ”どうなる,https://news.yahoo.co.jp/articles/dacd4a41a3481e04b861721325fe29bdd4bb0dd1,1/31(金) 19:24
2025-02-01,07:06,domestic,国内,8,毎日新聞,中高生2人相次ぎ死亡　社会福祉法人の施設の行事で　群馬県が調査,https://news.yahoo.co.jp/articles/2adcc2fd2980ef5353c8e0637ed03b3c1b2d92c7,1/29(水) 9:57
2025-02-01,07:06,domestic,国内,9,弁護士ドットコムニュース,「後頭部ハイキック」危険すぎる反則行為で負傷の小学生、スピード回復→今年の空手大会で優勝,https://news.yahoo.co.jp/articles/fe5e634d4b6522a4204c26a866b66ca479273b3f,1/31(金) 15:32
2025-02-01,07:06,domestic,国内,10,J-CASTニュース,夕刊フジ、56年の歴史に幕　ライバル紙が「前垂れ」で惜別「お疲れ様でした」「ありがとう」,https://news.yahoo.co.jp/articles/d7070080b1a4f68f91970e05fe1f92558bfdc733,1/31(金) 17:40
2025-02-01,07:06,domestic,国内,11,テレビ朝日系（ANN）,巨大な穴40mに拡大…　住民不安「どこまで広がる？」　専門家、要因は「軟弱な地盤」,https://news.yahoo.co.jp/articles/385b60f8e2d5a32ef1ec3fcd7a91b954ff9a83c8,1/31(金) 14:46
2025-02-01,07:06,domestic,国内,12,よろず～ニュース,国民・榛葉幹事長、参院選1人区「予備選」提案の維新に「無理ってことが分かった」立民とも「戦うしかない」,https://news.yahoo.co.jp/articles/1b2430199ff25aeac39429058e234472112767ee,1/31(金) 21:20
2025-02-01,07:06,domestic,国内,13,ABEMA TIMES,足立康史氏が国民民主党から出馬？噂の真相に「馬場さんやめてください」「前原共同代表もマイクで言うなよな（笑）」,https://news.yahoo.co.jp/articles/929c85d3574f13eaee6f18ee02fedc52abf135e8,1/31(金) 21:46
2025-02-01,07:06,domestic,国内,14,産経新聞,村上総務相、フジテレビ問題で「天下りない」とフライング答弁　安住委員長から注意受ける,https://news.yahoo.co.jp/articles/5c072cbb611d71912720d3da43737be3ddac676f,1/31(金) 19:18
2025-02-01,07:06,domestic,国内,15,FNNプライムオンライン,「不思議なこと多い」米旅客機と米軍ヘリ衝突事故　事故直前のやりとりから見えてくる“謎”　元JAL機長「日本では考えられない」,https://news.yahoo.co.jp/articles/b262edd3e359ea0b02c28fdf48af56b5689b2c70,1/31(金) 14:28
2025-02-01,07:06,domestic,国内,16,スポニチアネックス,悲劇再び…フィギュア界衝撃　米旅客機墜落で元世界王者や10代選手ら関係者14人が犠牲,https://news.yahoo.co.jp/articles/f9fcd91f02407c6d6f1344735cefd09f244bb230,2/1(土) 4:36
2025-02-01,07:06,domestic,国内,17,ニッポン放送,29キロ減量に成功したアラフォー女性の挑戦「デブを理由に何かを諦める人生はやめたい」,https://news.yahoo.co.jp/articles/e69cb513a81b231fef45d7595cd9cf23683b8ac1,1/31(金) 12:00
2025-02-01,07:06,domestic,国内,18,TBS NEWS DIG Powered by JNN,東京・江戸川区殺人事件　中学校教諭の被告人質問　現場で発見血のついたマスクについて「事件とは別の日に被害者とぶつかった時のもの」　無罪主張,https://news.yahoo.co.jp/articles/17d4e88d7069eb2a1a51689ebb798bc143755061,1/30(木) 20:03
2025-02-01,07:06,domestic,国内,19,弁護士JPニュース,JR東日本の男性社員、懲戒処分と出向命令の取り消し求め会社・上司を提訴　東京地裁,https://news.yahoo.co.jp/articles/07e3d2d4adcf85a9aa3b3be64ab09bcf958ae9fb,1/31(金) 18:00
2025-02-01,07:06,domestic,国内,20,スポーツ報知,「穴が家にまで広がるかもとやきもきしている」埼玉・八潮県道陥没で計１９人が避難所で眠れぬ夜「不安でいっぱい」,https://news.yahoo.co.jp/articles/750a561c01c612f7d69879b94286992279cd7e93,2/1(土) 6:00
2025-02-01,07:06,domestic,国内,21,共同通信,学校の保護者対応、民間で　教員負担軽減へ文科省モデル事業,https://news.yahoo.co.jp/articles/3415690509691e93b133f37c6c48a40f50de330c,2/1(土) 5:00
2025-02-01,07:06,domestic,国内,22,日刊スポーツ,「文春さん出番です」岩屋外相めぐる「女性の宿舎侵入」トレンド入り→SNSに真相究明期待の声？,https://news.yahoo.co.jp/articles/bfac8d655a31fbef76a1c08f42c9d07f06300e05,1/31(金) 15:06
2025-02-01,07:06,domestic,国内,23,FNNプライムオンライン（フジテレビ系）,「お花のモチーフで作られているんですね」佳子さま花壇など観賞　秋篠宮ご夫妻と親子揃って「関東東海花の展覧会」へ,https://news.yahoo.co.jp/articles/adb8a7e86b1e06dfb404cde587207689a498a4b3,1/31(金) 12:32
2025-02-01,07:06,domestic,国内,24,産経新聞,紛糾する沖縄県議会百条委　ワシントン事務所の入出金担当者すら分からず、自民県議も閉口,https://news.yahoo.co.jp/articles/299c15f9c127caabb281e39d012009bd11cbd7a0,1/31(金) 22:21
2025-02-01,07:06,domestic,国内,25,デイリースポーツ,金子恵美氏「夫が文春砲のときに…」　夫・宮崎謙介氏の文春砲被弾を例に出し、記事訂正の文春に説明求める,https://news.yahoo.co.jp/articles/001d44cba2e7aedda81d8dd1fb56b95ba4015041,1/31(金) 16:22
2025-02-01,07:06,domestic,国内,26,日刊スポーツ,れいわ市議が不適切投稿を削除、謝罪　八潮市陥没事故めぐり松尾芭蕉の俳句念頭か「傲慢だった」,https://news.yahoo.co.jp/articles/e25c2295cf784d03ccac1b5deea657197fd4cf85,1/31(金) 20:46
2025-02-01,07:06,domestic,国内,27,メ〜テレ（名古屋テレビ）,プロボクサーを大麻所持の疑いで逮捕　ショッピングモールの拾得物から特定、容疑を否認　岐阜県警,https://news.yahoo.co.jp/articles/8f0d9d6174e7d204051c70080ff180d3d52f8800,1/30(木) 15:48
2025-02-01,07:06,domestic,国内,28,スポニチアネックス,「見知らぬ女」トレンド1位！衆院議員宿舎で不審者が岩屋外相と鉢合わせにネット「えっ、なぜ？」「？？」,https://news.yahoo.co.jp/articles/ce0381e84b32e4bf654f9abcde6bd31d89b28d56,1/31(金) 11:14
2025-02-01,07:06,domestic,国内,29,朝日新聞デジタル,ホンダ「N―BOX」など8車種155万台をリコール,https://news.yahoo.co.jp/articles/65fe4903999be8741d0968224691d448ff29f982,1/31(金) 15:53
2025-02-01,07:06,domestic,国内,30,TBS NEWS DIG Powered by JNN,岩屋外務大臣「経済的威圧には当たらない」　皇室典範改正勧告の女性差別撤廃委への対抗措置めぐり,https://news.yahoo.co.jp/articles/9166965decd5dfd585de4d47b8da3b647354d758,1/31(金) 19:56
2025-02-01,07:06,domestic,国内,31,FNNプライムオンライン,発生から72時間超…道路陥没でトラック転落　運転手救助のためのスロープが穴とほぼ繋がる　埼玉・八潮市,https://news.yahoo.co.jp/articles/876de53be90eb0a21369e9d246878ea2936aaf32,1/31(金) 13:19
2025-02-01,07:06,domestic,国内,32,選挙ドットコム,番狂わせは起こるのか！？注目の千代田区長選を徹底解説！,https://news.yahoo.co.jp/articles/5dd08838726d21c1411867fbe5addf85f4cb9977,2/1(土) 6:00
2025-02-01,07:06,domestic,国内,33,tenki.jp,今日1日花粉情報　関東から中国地方は花粉が飛ぶ予想　「少ない」でも対策を忘れずに,https://news.yahoo.co.jp/articles/5c48629f98d50b695ad82dbc7a3b4670728c1b67,2/1(土) 5:40
2025-02-01,07:06,domestic,国内,34,読売新聞オンライン,緊急走行中のパトカー、サイレン鳴らし赤信号の交差点に進入…横断歩道を横切る高校生の自転車に衝突,https://news.yahoo.co.jp/articles/55f3443edcc0b00a7593288965a535b58d9b6bb2,1/31(金) 14:59
2025-02-01,07:06,domestic,国内,35,スポニチアネックス,ウサギ蹴って逮捕の男が勤務する会社が声明「事実関係の確認を進めたうえで、然るべき厳正な措置を…」,https://news.yahoo.co.jp/articles/e026fbe43ab2a71717784e260baab2048cc40ec6,1/31(金) 10:41
2025-02-01,07:06,domestic,国内,36,東海テレビ,のべ1000人と取引か…覚醒剤とみられる薬物を“レターパック”で発送し販売した疑い 26歳男を書類送検,https://news.yahoo.co.jp/articles/d110b79938b57cbad6b382e4c03caef2042b03b7,2/1(土) 6:19
2025-02-01,07:06,domestic,国内,37,毎日新聞,トップ当選は国民民主新人　各党勢力に大きな変化なし　北九州市議選,https://news.yahoo.co.jp/articles/eb190cd394d3d5a6177421c1a871947f886b1ae0,1/27(月) 22:52
2025-02-01,07:06,domestic,国内,38,デイリースポーツ,ウソだろ？ビックリマンシールに衝撃お値段「スーパーゼウス」「ブラックゼウス」に驚がく査定「ヘッドロココ」「ヘラクライスト」も,https://news.yahoo.co.jp/articles/1b31215ada3ac1e3b7818e454cf751dd6a2c8653,1/31(金) 18:45
2025-02-01,07:06,domestic,国内,39,朝日新聞デジタル,今年の節分は2月2日　なぜ3日じゃない？　理由は地球の公転周期,https://news.yahoo.co.jp/articles/90f75e23b74b99068ae9eae12ffc479a4fe33dd5,1/24(金) 16:00
2025-02-01,07:06,domestic,国内,40,中日スポーツ,サガミ休業、衝撃映像に動揺広がる 「どんだけ深いんだよ」「怖すぎる」「スッと地面に」,https://news.yahoo.co.jp/articles/7106be77f47ee981f4e13c8d7135709f6a693c22,1/29(水) 12:00
