scrp_date,scrp_time,genre_en,genre_jp,rank,media_jp,title,link,date_original
2023-12-09,20:13,life,ライフ,1,まいどなニュース,顔を540針縫う大けが　「フランケン」のあだ名とLDに苦しんでもあきらめなかった夢　AS北京五輪代表の石黒由美子さん,https://news.yahoo.co.jp/articles/239bf5cb7dbdef13dff73eb23adebc003a10fae9,12/9(土) 16:00
2023-12-09,20:13,life,ライフ,2,ねとらぼ,「餃子焼いてみ」スマホばかり見ている中1息子に任せた結果……　予想外の展開に「かっこいい」「天才現る」の声,https://news.yahoo.co.jp/articles/1782e414cfaca4ef277945c9f731a759143c40a4,12/9(土) 18:00
2023-12-09,20:13,life,ライフ,3,東京バーゲンマニア,くら寿司の無料ガリが大根に。ネット騒然の変更、広報に理由を聞くと...驚きの事実が判明。,https://news.yahoo.co.jp/articles/a3d58f86aa9cea3f1ae24da1b7b5b1ce5494e07a,12/8(金) 20:03
2023-12-09,20:13,life,ライフ,4,LIMO,2023年12月8日から開始する県も！全国旅行支援＆独自割を12月以降も実施する県まとめ,https://news.yahoo.co.jp/articles/a8f17b70479011d05dd2f52e366114d3b8d1cb16,12/9(土) 19:02
2023-12-09,20:13,life,ライフ,5,ファイナンシャルフィールド,姉の子どもに「任天堂スイッチ」をねだられています。4万円近くするのですが、クリスマスプレゼントにしては高くないですか？ 最近はこれが普通なのでしょうか…？,https://news.yahoo.co.jp/articles/ba4aad529f8d8a9b2c66e2508140960c38b84f99,12/9(土) 11:20
2023-12-09,20:13,life,ライフ,6,ねとらぼ,セブン-イレブンの“超絶シンプルすぎるパン”に衝撃　「想像を超えてきた」「山で遭難してる時に買いたい」,https://news.yahoo.co.jp/articles/dcbf25384a49ae100caa73275ebfacedc31e93f1,12/9(土) 19:00
2023-12-09,20:13,life,ライフ,7,ファイナンシャルフィールド,「住民税非課税世帯」なら大学無償化の対象になるけど、世帯年収「800万円」のわが家は対象外？ 要件や進学のために必要な費用も解説,https://news.yahoo.co.jp/articles/9331048acd00b1033c6423118ffca4f83f1329fb,12/9(土) 19:10
2023-12-09,20:13,life,ライフ,8,マイナビ子育て,息子と一緒に出たR-1グランプリ予選「私の後ろには、この子がいるんだぞ！」5児の母・芸人 竹田こもちこんぶさんインタビュー,https://news.yahoo.co.jp/articles/0f264e7797a44235da34148f77e76b877eb25235,12/9(土) 11:30
2023-12-09,20:13,life,ライフ,9,BuzzFeed Japan,ワークマン新作の「3900円アウター」がとっても軽くてオシャレ！まるで羽毛布団みたいな暖かさです,https://news.yahoo.co.jp/articles/0d185a55c8a1c9e55db1318ed1b2178614ac0a4d,12/7(木) 20:35
2023-12-09,20:13,life,ライフ,10,ねとらぼ,愛猫が息を引き取る直前「ありがとう、楽しかったよ」と声を掛けたら……　家族みんなが久々に集った夜の奇跡に涙,https://news.yahoo.co.jp/articles/e73fa4b8437838a7d09d2bbc0feba510aba704f9,12/8(金) 21:30
2023-12-09,20:13,life,ライフ,11,まいどなニュース,高速道路前のラーメン店に罰金看板「めちゃくちゃ煽ってるw」「ラーメン安く感じる」看板掲げた理由、店長に聞いた,https://news.yahoo.co.jp/articles/c52f98b21982b90090c666d2623e637a7d8fe2b4,12/7(木) 17:39
2023-12-09,20:13,life,ライフ,12,日刊ゲンダイDIGITAL,《裕福な家庭への支援》か《Fラン大学救済策》か…岸田首相の大学無償化政策に国民憤慨,https://news.yahoo.co.jp/articles/8282ff6199a9e13e110b3c289b59a7ce2209f69e,12/9(土) 9:06
2023-12-09,20:13,life,ライフ,13,Hint-Pot,力を入れて作った朝食、子どもが示したのは「位の低い役人の食事」　ネットは称賛「現代では最高の朝食」,https://news.yahoo.co.jp/articles/8a8b11f9b382e3c7f5645175ffeb32c27d64e618,12/8(金) 17:14
2023-12-09,20:13,life,ライフ,14,ねとらぼ,名古屋5車線道路のスロープが、「野球盤」の装置にそっくり!?　「パカパカするやつ」「確かにw」と話題,https://news.yahoo.co.jp/articles/2a8376d1961c48754d2cd7618b696f5e1a6e7262,12/9(土) 19:15
2023-12-09,20:13,life,ライフ,15,ねとらぼ,「ちいかわ」知らない母が“ガチャ”挑戦→「変なの出てきた」と思わず泣き顔……　珍エピソードに「笑った」,https://news.yahoo.co.jp/articles/b1a3297f320804cddcbcf429a3706aa1efff46a1,12/9(土) 12:00
2023-12-09,20:13,life,ライフ,16,ねとらぼ,飼い主、猫ちゃんの様子を見に行くとPCの前に座っていて……？　衝撃の展開に「独学で学んだ…？」「見なかったことにw」,https://news.yahoo.co.jp/articles/0c2e910b7cd4a9fa54193c634c807280e3312834,12/9(土) 17:00
2023-12-09,20:13,life,ライフ,17,ほ・とせなNEWS,16歳で両足を切断後、モデルとして活躍　「障がい・健常は関係ない」前向きに生きる彼女のマインドに迫る,https://news.yahoo.co.jp/articles/ac495995120f708e58e88c0bbb4a798af8674d04,12/9(土) 11:30
2023-12-09,20:13,life,ライフ,18,まいどなニュース,肥満児が事故に遭って救急搬送！ 朝イチで救急医から着信「治療頑張ったのですが…」→まさかの展開に13万人爆笑,https://news.yahoo.co.jp/articles/1bc740a4fe74ff7635d882612fbfdeb527135fc4,12/8(金) 11:20
2023-12-09,20:13,life,ライフ,19,ファイナンシャルフィールド,職場の飲み会で「終電」を逃してしまいました。付き合いで参加したのですが「タクシー代」を払ってもらうことはできるのでしょうか？ 家が遠いので、自腹だとかなりきついです…,https://news.yahoo.co.jp/articles/3d6071ede419c515d7ce5aefb5f5abef8146f4c1,12/9(土) 19:12
2023-12-09,20:13,life,ライフ,20,Hint-Pot,子どもの送迎で“おなじみ”の光景、日本を訪れたアメリカ人は仰天　「地元では見たことがないよ」,https://news.yahoo.co.jp/articles/bc9ef77c97e5722459424e462e4f0f3070678462,12/7(木) 8:10
2023-12-09,20:13,life,ライフ,21,ねとらぼ,一番おいしいと思う「とんかつチェーン」ランキング！　2位は「とんかつ和幸」、1位は？,https://news.yahoo.co.jp/articles/6b23464a8b12cec23d0dc6ed9fbcfd8945936907,12/9(土) 17:30
2023-12-09,20:13,life,ライフ,22,ファイナンシャルフィールド,小銭をコツコツためて10万円達成！「無料で」両替する方法はありますか？,https://news.yahoo.co.jp/articles/322ee3461dccc7c8967e1c705fe7372b9713ec9f,12/7(木) 12:30
2023-12-09,20:13,life,ライフ,23,sippo,死んでしまいそうなほどおびえていた元野犬「ヌーサ」　譲り合いの心で無二の相棒に,https://news.yahoo.co.jp/articles/6974a73467ffc122d875b64064319ed2185865ed,12/9(土) 19:02
2023-12-09,20:13,life,ライフ,24,Hint-Pot,「天井から“生えて”きたねこ」　逆さまで顔を出す姿に驚愕の声　「二度見しました」,https://news.yahoo.co.jp/articles/01c331b9f8cb4cb2b3da2ef3e869874f5f39d792,12/9(土) 19:12
2023-12-09,20:13,life,ライフ,25,ENGINE WEB,「クルマ好きの父を看取ったときに、後悔のない人生をおくらなければダメだと思った」　亡き父が背中を押した996型GT3オーナーの911ストーリーとは,https://news.yahoo.co.jp/articles/629e941dadc11c4225189fc883b4cb5b4a091733,12/9(土) 19:10
2023-12-09,20:13,life,ライフ,26,Hint-Pot,具材はたった3つ　杏さん流「シンプルで飽きない」鍋　簡単な作り方に「最高です」の声,https://news.yahoo.co.jp/articles/83797e32abc11834f79445bdee0b28f4879d1a7c,12/9(土) 17:07
2023-12-09,20:13,life,ライフ,27,OCEANS,コスパ最強「インナーダウン」はどれだ!?ユニクロ、無印良品、タイオン、ワークマンを徹底比較！,https://news.yahoo.co.jp/articles/0990ddcba674c74e5dcb7b6bbfbffbfae34b9509,12/7(木) 19:04
2023-12-09,20:13,life,ライフ,28,LIMO,学校から送られてきた「個人面談のお知らせ」　パンチの効いた誤植に思わず笑ってしまう,https://news.yahoo.co.jp/articles/b4125012e1a140d534a7a6fd6b437c556245c1cb,12/6(水) 5:07
2023-12-09,20:13,life,ライフ,29,まいどなニュース,こんなショボい「盛り合わせ」があるか！ 衝撃のビジュアルで注目を集めた“詐欺ソーセージ”騒動　イベント運営の見解は,https://news.yahoo.co.jp/articles/e834267cbe3d64275f4ea98aa318123bd6bbd8b6,12/9(土) 7:00
2023-12-09,20:13,life,ライフ,30,LIMO,「出てますよ、ロースハム。」元保護猫の真っ白なお口から覗く『しまい忘れ』まるでハムみたいと話題に,https://news.yahoo.co.jp/articles/b824f7d47768ad3aa46eaf755f01eafc87830fed,12/8(金) 19:11
2023-12-09,20:13,life,ライフ,31,ねとらぼ,座れないけど「すわっていいよ」　観光地で見つけた謎の標語に「そういうことか！」と納得の声,https://news.yahoo.co.jp/articles/6b5124b9590ab0650694bc094afa06d5e5660803,12/9(土) 17:45
2023-12-09,20:13,life,ライフ,32,ファイナンシャルフィールド,結婚式のために100万円準備しています。ご祝儀をもらえれば300万円くらいの式を挙げられますか？,https://news.yahoo.co.jp/articles/2af70ac8c2db66280ca298b4f348c7200fa06a3b,12/8(金) 17:30
2023-12-09,20:13,life,ライフ,33,Fav-Log by ITmedia,車中泊におすすめの「日帰り温泉」3選　今年の疲れは、今年のうちに　「源泉かけ流し」で癒やされ旅【2023年12月版】,https://news.yahoo.co.jp/articles/7795453d8c1481432eba29caae681a0855d61ea3,12/9(土) 9:50
2023-12-09,20:13,life,ライフ,34,ねとらぼ,ワンコ、飼い主のなでなでが終わる気配を感じると……？　ハートをつかむ“しぐさ”に「かわいすぎる～!!!!!!」もん絶の声,https://news.yahoo.co.jp/articles/f60bc7427f85f4c849a33e7072691474baaa20de,12/9(土) 19:00
2023-12-09,20:13,life,ライフ,35,産経新聞,小学３年で英検１級合格　足立区の男子児童、将来の夢は「宇宙飛行士」,https://news.yahoo.co.jp/articles/437ad941e50f4ae5b250a932d018ad5af14fbc02,12/9(土) 16:21
2023-12-09,20:13,life,ライフ,36,LIMO,待望の再入荷！株式会社エールの「ラッコカプセルトイ」が最高にかわいい！カプセルは貝殻です,https://news.yahoo.co.jp/articles/e40b47172ce9e729b6b84665894b95abda0270d3,12/9(土) 18:37
2023-12-09,20:13,life,ライフ,37,ねとらぼ,七五三のお祝いで記念写真→全員“ジョジョ立ち”だと……!?　ノリノリの3人家族に「最高すぎる」と祝福の声,https://news.yahoo.co.jp/articles/61cfb8149e4b318a09a726d97acdcd41a54b7861,12/4(月) 20:30
2023-12-09,20:13,life,ライフ,38,朝日新聞デジタル,【大学トレンド】国公立大で広がる年内入試、筑波大は入学者3割が「特別選抜」,https://news.yahoo.co.jp/articles/a9ce714a44df575973f280a19a1d4d671814f8c1,12/9(土) 12:06
2023-12-09,20:13,life,ライフ,39,ねとらぼ,やっちゃダメ！　ホテルスタッフによる客室での「NGマナー」解説が参考になる,https://news.yahoo.co.jp/articles/f37479f154452d31c0cc8a73f091769f69c4544f,12/9(土) 12:00
2023-12-09,20:13,life,ライフ,40,LIMO,「連れてってくれニャ…」外出する飼い主と猫『説得』の光景に1.3万いいね「こんな事されたら躊躇する」,https://news.yahoo.co.jp/articles/8651920671405a072db1f16cc01e6b55ff1789f4,12/8(金) 11:52
