scrp_date,scrp_time,genre_en,genre_jp,rank,media_jp,title,link,date_original
2025-08-24,16:06,domestic,国内,1,弁護士JPニュース,一家3人を殺害後、犯人は愛車シルビアと消えた…27年前の群馬でストーカー行為の末、凶行に及んだ男の“足取り”は【未解決事件】,https://news.yahoo.co.jp/articles/e8ba1b263d0246f0fe9a54b9bfabd2289a7d5f15,8/24(日) 10:20
2025-08-24,16:06,domestic,国内,2,読売新聞オンライン,京都人の「いけず」イメージキャラクターで老舗扇子店社長の大西里枝さん、35歳で死去,https://news.yahoo.co.jp/articles/f7f82260255f92918c6a2575143d95b5e88cdf2c,8/24(日) 10:56
2025-08-24,16:06,domestic,国内,3,TBS NEWS DIG Powered by JNN,決め手を欠く“石破おろし”めぐる攻防…いよいよ佳境に 「臨時総裁選」に求められる“踏み絵”とは【サンデーモーニング】,https://news.yahoo.co.jp/articles/9d2abf2f0e35319116e3060ecdb56c0f9ec1f5f6,8/24(日) 13:35
2025-08-24,16:06,domestic,国内,4,産経新聞,現地さながらの「中国朝市」で横行する違法駐車　警告も改善なく大阪府警が一斉取り締まり,https://news.yahoo.co.jp/articles/a255bfa7d42ce18bcce53acb269f13cb3d8f1699,8/24(日) 13:23
2025-08-24,16:06,domestic,国内,5,毎日新聞,秋田新幹線こまち、子グマと衝突し緊急停車　線路上に1頭の死体,https://news.yahoo.co.jp/articles/38200b859b10e9d00e97ec90eea82c38b1956532,8/24(日) 13:56
2025-08-24,16:06,domestic,国内,6,弁護士JPニュース,アポロ月面着陸「陰謀論」に東大生もダマされた？　“真空”で星条旗が揺れるはずない…「ねつ造」説の“科学的根拠”とは,https://news.yahoo.co.jp/articles/b7e64f13c2796b7658917bb15fe6ca02570f3c1a,8/24(日) 10:00
2025-08-24,16:06,domestic,国内,7,tvkニュース（テレビ神奈川）,自転車と歩行者が衝突する事故　歩行者の男性が意識不明の重体　横浜市青葉区,https://news.yahoo.co.jp/articles/2e7c67f1c6111cc86d48f307733bcecbdc03577f,8/24(日) 13:40
2025-08-24,16:06,domestic,国内,8,日刊スポーツ,石破首相の佳子夫人、夏色ワンピで韓国大統領夫人をおもてなし　日韓の伝統工芸づくり体験,https://news.yahoo.co.jp/articles/fdcf25ee14a1edfe41ee4573ba957052b55cb3e9,8/24(日) 11:18
2025-08-24,16:06,domestic,国内,9,弁護士JPニュース,「極道並みの容貌」でタバコを配り立ち話…大阪・西成の“マトリ”が売人や中毒者を逮捕するために行っていた「情報収集の手法」とは,https://news.yahoo.co.jp/articles/b44a18e7310bff6daa7b814cbd8a99fc4ee80347,8/24(日) 10:40
2025-08-24,16:06,domestic,国内,10,高校生新聞オンライン,「ウシガエルがうるさい」苦情に高校生奮闘　駆除して「食べて」数が大幅減,https://news.yahoo.co.jp/articles/1a279c7d3a149c6c0fa14597ac0cb7ba44b4fb43,8/23(土) 18:02
2025-08-24,16:06,domestic,国内,11,日刊スポーツ,天皇陛下、アフリカ首脳おもてなしの様子公開　皇后さま、愛子さま、佳子さまは青の和装姿,https://news.yahoo.co.jp/articles/7845db2a3bcc08e26ba0ab545fb0aff19e6641c2,8/24(日) 11:07
2025-08-24,16:06,domestic,国内,12,FNNプライムオンライン,ホームにいたのに…JR白新線・豊栄駅で乗客12人が乗れないまま列車が発進　運転士「乗車する客だと思わなかった…」新潟,https://news.yahoo.co.jp/articles/8ccdd2249380473ce812b7e3eab0dac11122f679,8/24(日) 10:03
2025-08-24,16:06,domestic,国内,13,CBCテレビ,夢のマイホームが雨漏り絶えず… 壁の中はボロボロに 外壁落下の危険性も…不動産会社「話し合いの解決を強く望む」,https://news.yahoo.co.jp/articles/fd84f8d90d24fe3947f1b571a38ec398362392f3,8/24(日) 6:03
2025-08-24,16:06,domestic,国内,14,産経新聞,自民・青山繁晴氏、総裁選管「石破首相側の人が多い」　前倒し派に「圧力がかかっている」,https://news.yahoo.co.jp/articles/8999a0b554517cfa84018b314b16e722acfe8fc4,8/23(土) 7:00
2025-08-24,16:06,domestic,国内,15,FNNプライムオンライン,“傘差しバイク”に「歩道を走る車」、緑ナンバーが突然の進路変更で衝突寸前…各地で目撃された身勝手運転,https://news.yahoo.co.jp/articles/b6fdfd4de727f961d54ebe3105b0c4f059827576,8/24(日) 14:00
2025-08-24,16:06,domestic,国内,16,テレビ朝日系（ANN）,神戸女性刺殺　事件直前10分以上尾行か　逮捕の男と女性の接点は,https://news.yahoo.co.jp/articles/254039577c5ab355770f35bc1f6ac3a24ec0d890,8/24(日) 12:18
2025-08-24,16:06,domestic,国内,17,日刊スポーツ,鳥嶋和彦氏「サウジに作るから文句言ってるんじゃない」ドラゴンボールテーマパークに言及,https://news.yahoo.co.jp/articles/9bbdfce660993d235e3c17007e14f0fcec59d5d2,8/24(日) 14:23
2025-08-24,16:06,domestic,国内,18,TBS NEWS DIG Powered by JNN,読書は“ノイズ”に!? 進む読書離れが社会にもたらす弊害　世界で広まる「反知性主義」が奪う“理解と対話”【サンデーモーニング】,https://news.yahoo.co.jp/articles/5c47ffc2f8997601f4ec25b273b7277b0cd11ce2,8/24(日) 15:05
2025-08-24,16:06,domestic,国内,19,TBS NEWS DIG Powered by JNN,【速報】東北新幹線　東京－盛岡間の上下線で運転見合わせ　車両故障が原因　再開のめど立たず,https://news.yahoo.co.jp/articles/91c44884610ded77860ff19e90ff870cd909e5af,8/24(日) 15:15
2025-08-24,16:06,domestic,国内,20,FNNプライムオンライン,休憩用の椅子めぐり口論に「渋谷ヒカリエ」で“催涙スプレー”噴射…0歳含む男女18人が目や喉に痛み　46歳男を現行犯逮捕,https://news.yahoo.co.jp/articles/779dbbd2b318fd83b651ed7bd126ec59d3ada6da,8/24(日) 11:18
2025-08-24,16:06,domestic,国内,21,ABEMA TIMES,日本は核武装すべきか否か 田母神俊雄氏「核は究極的な抑止用兵器。国が潰れるほど追い込まれない限り使われない」安部敏樹氏「日本が核を持つと世界的な核保有の合図になる」,https://news.yahoo.co.jp/articles/7393c632ba9488757eb2f4f70dd7971547fbff8b,8/24(日) 12:00
2025-08-24,16:06,domestic,国内,22,CBCテレビ,「大好きだった」 その言葉を残して戦争へ  終戦のとき20歳だった若者は現在100歳 「好きな人は?食べ物は?」 今の20歳と戦禍の20歳に聞いてみた【戦後80年】,https://news.yahoo.co.jp/articles/576379bd621fc4931f5b45278d80859275754116,8/24(日) 14:02
2025-08-24,16:06,domestic,国内,23,日刊スポーツ,ゆたぼん「今度は立憲民主党の支持者に絡まれています」と報告　前日“自国民ファースト論”展開,https://news.yahoo.co.jp/articles/94f4a56937d6cfd2debb5013ef1e36a8237eff64,8/24(日) 12:16
2025-08-24,16:06,domestic,国内,24,産経新聞,石破首相、李大統領の自叙伝にサインもらう　特製カレーでおもてなし…日韓首脳会談舞台裏,https://news.yahoo.co.jp/articles/da11d2c4beba9c9294a21b34952fe1fd9c2862f6,8/24(日) 12:23
2025-08-24,16:06,domestic,国内,25,ウェザーマップ,群馬県桐生市で39.4℃　関東の内陸で40℃に迫る危険な暑さ　都心も37.3℃　週明けも猛暑続く,https://news.yahoo.co.jp/articles/222ad3dab095772d9035c065c4c9e9cbd9fdd501,8/24(日) 14:52
2025-08-24,16:06,domestic,国内,26,産経新聞,自民政局、カギ握る麻生太郎氏　有力議員が次々訪問　派閥一枚岩になれるか焦点,https://news.yahoo.co.jp/articles/c4fed47760015c9a2016e65fe32d05284ffd30ba,8/17(日) 19:11
2025-08-24,16:06,domestic,国内,27,読売新聞オンライン,参院選公約「２万円給付」、政府・自民党内で見直し論…野党賛成のメド立たず,https://news.yahoo.co.jp/articles/2a701637d1e649de17e160b19236be5d5f383f2b,8/24(日) 5:00
2025-08-24,16:06,domestic,国内,28,産経新聞,数日前から現場近くのホテルに宿泊か　神戸女性刺殺容疑の谷本容疑者、17日から休暇取得,https://news.yahoo.co.jp/articles/e0577f94b45bff67b1085ef14f4bdbc75c3db677,8/24(日) 11:02
2025-08-24,16:06,domestic,国内,29,FNNプライムオンライン（フジテレビ系）,秋田新幹線がクマと衝突…田沢湖〜雫石駅間で　東北新幹線は東京〜盛岡駅間の上下線で運転見合わせ…車両点検の影響,https://news.yahoo.co.jp/articles/6833ff911e6c0c4efd0c6683eb723c9df30082d2,8/24(日) 14:51
2025-08-24,16:06,domestic,国内,30,共同通信,クマに襲われ70代男性けが,https://news.yahoo.co.jp/articles/2cafd8de655c2dc3e1e15c647aad70366a0ff33a,8/24(日) 11:58
2025-08-24,16:06,domestic,国内,31,tenki.jp,台風シーズン続く　海面水温は九州～西日本30℃以上　新たな台風のたまご続々発生か,https://news.yahoo.co.jp/articles/0f82f7ad3ed988c1607eb62ad33032d36c6cb8fd,8/24(日) 15:41
2025-08-24,16:06,domestic,国内,32,レスキューナウニュース,名鉄常滑線・空港線で人身事故 一部運転見合わせ,https://news.yahoo.co.jp/articles/ae14542dfa47443427031da785a78cd79464e2fb,8/24(日) 12:35
2025-08-24,16:06,domestic,国内,33,TBS NEWS DIG Powered by JNN,エアコンなく熱中症後も「我慢するんですよ」　猛暑から守る有効な政策がない“エネルギー貧困”の現場【報道特集】,https://news.yahoo.co.jp/articles/a5bd96e3e2c3d984b37c1d6df97ef947c5a4ef28,8/23(土) 20:01
2025-08-24,16:06,domestic,国内,34,読売新聞オンライン,北海道の高校生は道内進学の傾向強め…「志願したい大学」１位は北海道大、２位は北海学園大,https://news.yahoo.co.jp/articles/802ed89215f7b2b9c3a6b4de4e8e56b05e23a46d,8/24(日) 14:30
2025-08-24,16:06,domestic,国内,35,テレビ朝日系（ANN）,ニセコ4000人分の水源ピンチ？17年前の所有者と土地めぐり敗訴　町が異例の署名活動,https://news.yahoo.co.jp/articles/0f9a367b93038f556d5f9e5939704a2e6613774f,8/23(土) 13:54
2025-08-24,16:06,domestic,国内,36,ABEMA TIMES,「楽しい日本を目指したい」から一転「楽しいことはない」石破総理のボヤキに注目集まる,https://news.yahoo.co.jp/articles/fa2c23f6126b03bb48e0ead51342827cec7fcf6f,8/24(日) 15:27
2025-08-24,16:06,domestic,国内,37,読売新聞オンライン,東北新幹線が車両故障で東京―盛岡間で運転見合わせ、けが人や体調不良者なし…復旧に時間要する見込み,https://news.yahoo.co.jp/articles/6edb2f565575525f880525ac84e8b8c4e88ebb62,8/24(日) 15:12
2025-08-24,16:06,domestic,国内,38,日刊スポーツ,平将明デジタル相「根こそぎデジタル化するのは賛成」当選同期に「現金をやめませんか」と聞かれ,https://news.yahoo.co.jp/articles/57efff132a0f0c9e02aa26be4b93fe73b5ef860d,8/24(日) 13:41
2025-08-24,16:06,domestic,国内,39,日刊スポーツ,へずまりゅう氏緊急報告「リコールし奈良市議会議員から強制的に追放するとの電話がありました」,https://news.yahoo.co.jp/articles/e1f9e89ab1ad682970754502221f42aacb073e97,8/23(土) 7:49
2025-08-24,16:06,domestic,国内,40,ABEMA TIMES,東北新幹線が運転見合わせ 車両故障のため 再開の見通し立たず,https://news.yahoo.co.jp/articles/b0313390d560a16c90658a4ae93a4ce7939c5055,8/24(日) 15:27
