scrp_date,scrp_time,genre_en,genre_jp,rank,media_jp,title,link,date_original
2025-05-01,18:07,sports,スポーツ,1,ABEMA TIMES,大谷翔平が「とんだ！」 激走スリーベース→一瞬の隙を付く“超速生還”に「実質ランニングホームラン」驚きの声続出,https://news.yahoo.co.jp/articles/bda8374d89c17d521395f8f3857165c6dfc10ba4,5/1(木) 14:54
2025-05-01,18:07,sports,スポーツ,2,Full-Count,離脱者続くヤクルトの電撃発表に「マジでビックリ」　緊急補強にX騒然「まさか」,https://news.yahoo.co.jp/articles/a3b03b76414a9d27f16cd5046fccb22b66572c69,5/1(木) 10:25
2025-05-01,18:07,sports,スポーツ,3,デイリースポーツ,ソフトバンク激震　周東は右腓骨骨折の診断　今宮とともにリハビリ組へ　球団発表　開幕スタメン野手９人のうち山川以外の８人抹消の異常事態,https://news.yahoo.co.jp/articles/8f0ad5f9759308e6772ca666eea1183cd5379c7e,5/1(木) 17:35
2025-05-01,18:07,sports,スポーツ,4,西スポWEB OTTO！,ソフトバンクにさらなる衝撃！離脱中の周東佑京は右腓骨骨折と判明,https://news.yahoo.co.jp/articles/3c2ed910e783a52088b8b49c14279c0fd20b83cf,5/1(木) 16:35
2025-05-01,18:07,sports,スポーツ,5,ＡＦＰ＝時事,レブロン、来季の去就を検討 レイカーズはPOで敗退,https://news.yahoo.co.jp/articles/8d5db66ebacbe592054dd827dc17fe3115ab1d33,5/1(木) 16:43
2025-05-01,18:07,sports,スポーツ,6,デイリースポーツ,メイショウマンボが急死　１５歳　Ｇ１・３勝で１３年ＪＲＡ最優秀３歳牝馬　松本好雄会長「オークスは涙が止まりませんでした」,https://news.yahoo.co.jp/articles/dc35ed82d3b5359b2cf43096e66d50f4f0c853f8,5/1(木) 16:31
2025-05-01,18:07,sports,スポーツ,7,Full-Count,中日の根尾昂が1軍昇格、2軍で防御率0.00　DeNAは打率.115の筒香を抹消…1日の公示,https://news.yahoo.co.jp/articles/42667c376ccce267920a22bb03324bcecd32d49d,5/1(木) 16:03
2025-05-01,18:07,sports,スポーツ,8,SPAIA AI競馬,【天皇賞（春）枠順】ダイヤモンドS圧勝のヘデントールは4枠6番　阪神大賞典勝ち馬サンライズアースは3枠5番,https://news.yahoo.co.jp/articles/a72b88767eafee46aa4a8aa71b39ffd7e50e4f58,5/1(木) 14:28
2025-05-01,18:07,sports,スポーツ,9,日テレNEWS NNN,試合中にファンが6m超の高さのスタンドから落下し重体　試合は中断され救急搬送　カブスとパイレーツの選手らが心配そうに見守る,https://news.yahoo.co.jp/articles/3e675b2e52e285d8d9e3836a1e96c0a4cc84adbb,5/1(木) 15:50
2025-05-01,18:07,sports,スポーツ,10,日刊スポーツ,高梨沙羅「カッコ可愛いい～」ウエストキュッ　ヘソ出しデニムコーデを披露,https://news.yahoo.co.jp/articles/3cd5b9531039cb50676db0913d9f5739a2d9a7b6,5/1(木) 15:56
2025-05-01,18:07,sports,スポーツ,11,高校野球ドットコム,黄金カードはまさかの試合展開に…浦和学院が強敵・花咲徳栄に7回コールド！！【埼玉】,https://news.yahoo.co.jp/articles/fc6798c81095f978df04138b82cf2929e1be54c9,5/1(木) 14:25
2025-05-01,18:07,sports,スポーツ,12,Full-Count,鷹にまたも激震　右肘死球の今宮が登録抹消…開幕オーダーから8人が姿消す“超異常事態”,https://news.yahoo.co.jp/articles/633fb9309aaa7c6be6c334f1230fb1dcfdc0749c,5/1(木) 16:02
2025-05-01,18:07,sports,スポーツ,13,デイリースポーツ,女子プロレス　スターダム退団の岩谷麻優、マリーゴールドに電撃入団「小川さん、マリーゴールドに岩谷麻優は必要でしょ」,https://news.yahoo.co.jp/articles/a6d357002bb9a89ab68522be25e8ffca4406b3f5,5/1(木) 16:10
2025-05-01,18:07,sports,スポーツ,14,Full-Count,大谷翔平と「そのために契約している」　ド軍監督が“激賞”した1000億円の「理由」,https://news.yahoo.co.jp/articles/1adafa4b5c82572c14046436566467bc154f4c23,5/1(木) 9:20
2025-05-01,18:07,sports,スポーツ,15,theWORLD（ザ・ワールドWeb）,川崎フロンターレに“目ん玉飛び出る賞金額”、ACLE準優勝以上確定ですでに“J1優勝3年分相当”を獲得　さらに優勝すれば……,https://news.yahoo.co.jp/articles/811ed1bc8b931bcd677272eb6f73538e290168b3,5/1(木) 11:32
2025-05-01,18:07,sports,スポーツ,16,デイリースポーツ,大相撲　綱とりの大の里、一門の連合稽古を欠席　師匠の元稀勢の里が理由明かす,https://news.yahoo.co.jp/articles/a8ea3342a247dd3cda6146df2d6dd51dba8ebfc7,5/1(木) 13:56
2025-05-01,18:07,sports,スポーツ,17,J-CASTニュース,中日・山本泰寛、9回2死満塁→セーフティーバントにネットあぜん...「これ誰が予想できた？」「選択としてありえない」,https://news.yahoo.co.jp/articles/7e27fea67323489cb2f81366bce6adb33bcba4a8,5/1(木) 11:34
2025-05-01,18:07,sports,スポーツ,18,西スポWEB OTTO！,ミニスカから伸びる脚が…23歳陸上選手〝ふくらはぎの血管〟私服姿に「こういうの求めてた」「ムキってるなぁ」「ゴッつい！」の声,https://news.yahoo.co.jp/articles/cece7ec9574af6880deb4382febe11333c628831,4/29(火) 0:10
2025-05-01,18:07,sports,スポーツ,19,デイリースポーツ,ソフトバンク・今宮の兄が日本ハム・柳川にメッセージ「あまり自身を責めないように」　前夜右肘死球で負傷退場　同じ大分県出身で実家が近く,https://news.yahoo.co.jp/articles/1025432e3ba1b652a1fe9010a9716c42ca873167,5/1(木) 14:04
2025-05-01,18:07,sports,スポーツ,20,デイリースポーツ,中日・涌井投手の「社長」発言巡り　人気女子アナが真顔で謝罪　ＳＮＳは爆笑「申し訳ないが笑えた」「涌井相談役やぞ笑」,https://news.yahoo.co.jp/articles/8924926e36915131c232da0d668307f3cdf30a65,5/1(木) 17:23
2025-05-01,18:07,sports,スポーツ,21,スポーツ報知,【巨人】西舘勇陽が登録抹消…防御率２・５７も救援陣層の厚く,https://news.yahoo.co.jp/articles/188971a6e627f26deda2f181e42491ac95e48778,5/1(木) 16:58
2025-05-01,18:07,sports,スポーツ,22,Full-Count,元広島助っ人、半月で4度目の“事実上の戦力外”　獲得後2日の通告に「かわいそうな男だ」,https://news.yahoo.co.jp/articles/5fea830ba6f12f4e3a8cc53b165105153fb5982e,5/1(木) 14:36
2025-05-01,18:07,sports,スポーツ,23,CoCoKARAnext,再び降臨する阪神158キロ剛腕に話題沸騰！新たなブルペンの切り札となるか「制圧力に期待したい」,https://news.yahoo.co.jp/articles/a61f8cd4fe88d6801d39fe17080deb2032b84b9d,5/1(木) 16:19
2025-05-01,18:07,sports,スポーツ,24,日刊スポーツ,大谷翔平と真美子夫人、セーラームーン…MLB公式〝３ショット〟公開「愛妻家のショウヘイさん」,https://news.yahoo.co.jp/articles/253f65de7f739f25c9d8896bb99d3166c53888a2,5/1(木) 14:52
2025-05-01,18:07,sports,スポーツ,25,SPAIA AI競馬,【天皇賞（春）】「直近1年の中距離GⅡ勝ち馬」が複回収率128%　データで導く穴馬候補3頭,https://news.yahoo.co.jp/articles/25f85a80e830dae8ab28fb627252ff7fb9055fab,5/1(木) 17:02
2025-05-01,18:07,sports,スポーツ,26,TBS NEWS DIG Powered by JNN,【巨人1日スタメン】キャベッジ2番 クリーンナップは吉川、岡本、甲斐 増田陸6番ファースト 佐々木7番レフト 萩尾8番 先発田中将,https://news.yahoo.co.jp/articles/9b3ad788d403d73d4d69abff4e2ec9579d3538c9,5/1(木) 17:18
2025-05-01,18:07,sports,スポーツ,27,ゴルフ総合サイト ALBA Net,不動裕理がノーボギーの「66」で単独首位発進　日本女子シニアオープン,https://news.yahoo.co.jp/articles/587981d7bd9e688f482a8ade198cbede81446c84,5/1(木) 15:40
2025-05-01,18:07,sports,スポーツ,28,TBS NEWS DIG Powered by JNN,中日 広島に2連敗...投手陣は11被安打8四球 3失策で8失点 先発・福田は3回3失点 勝野1回2失点  石川昂が死球交代 【ウエスタン】,https://news.yahoo.co.jp/articles/31fe578212df08e305d1b2f868b4b4c511dbae01,5/1(木) 15:58
2025-05-01,18:07,sports,スポーツ,29,スポーツ報知,【西武】ヤクルトに金銭トレードで移籍の山野辺翔が１軍ナインにあいさつ　西口監督「頑張ってる姿をみせて」,https://news.yahoo.co.jp/articles/a67f80eda87d429b24f48c0cd9e88d8ff8377960,5/1(木) 16:59
2025-05-01,18:07,sports,スポーツ,30,中日スポーツ,中日・石川昂、負傷交代　ウエスタン広島戦、アドゥワから左腕付近に死球　一度は一塁へ歩くも、トレーナーに付き添われてベンチへ,https://news.yahoo.co.jp/articles/aff4fcd0dbc39890714d84a9a9efcda7e994ceb3,5/1(木) 13:19
2025-05-01,18:07,sports,スポーツ,31,CoCoKARAnext,そして誰もいなくなった…ソフトバンク激震！　今度は今宮が登録抹消で開幕オーダーで残ったのは山川のみの緊急事態　4軍制が今こそ機能するか,https://news.yahoo.co.jp/articles/7ffb24efd175371d24b419b7a8b24fa9a6d7b1e4,5/1(木) 17:25
2025-05-01,18:07,sports,スポーツ,32,東スポWEB,【マリーゴールド】スターダムを退団した岩谷麻優が電撃入団,https://news.yahoo.co.jp/articles/48bfb97d7d25e972b38088f5f40d9a0fac3225d1,5/1(木) 16:06
2025-05-01,18:07,sports,スポーツ,33,スポニチアネックス,ソフトバンク・今宮健太「10日以内の中で休んで投げられますと言い切れなかった」死球の影響で登録抹消,https://news.yahoo.co.jp/articles/b1cad8f734971d18717bba99817572522e4ef215,5/1(木) 17:05
2025-05-01,18:07,sports,スポーツ,34,日刊スポーツ,【西武】トレードで支配下枠は残り「５」　仲三河優太、モンテル、佐々木健らがしのぎ削る,https://news.yahoo.co.jp/articles/48ac6d720a0c15aa62b1468862c269bcf2d7c39f,5/1(木) 17:19
2025-05-01,18:07,sports,スポーツ,35,スポニチアネックス,ソフトバンク激震！周東佑京が右腓骨骨折で長期離脱へ　実戦復帰未定,https://news.yahoo.co.jp/articles/4cd05aab1a24d34232afa4bcf77fefe0827a9994,5/1(木) 17:35
2025-05-01,18:07,sports,スポーツ,36,ゴルフのニュース,ドライバーの飛距離は“ピッチングの2倍”って本当！？ プロはそれ以上飛ぶのにアマは下回る納得の理由とは？,https://news.yahoo.co.jp/articles/ec1c18ea5f20466d8dbf731acfe52bdb1e6b8b54,5/1(木) 15:10
2025-05-01,18:07,sports,スポーツ,37,ENCOUNT,覆面レスラーの素顔が「ふつーに美人すぎやろ！」　イメチェン報告にネット魅了「まさに強可愛！」,https://news.yahoo.co.jp/articles/26195bace6b50da26d3da4f8fead6a4db4c1d867,4/30(水) 15:02
2025-05-01,18:07,sports,スポーツ,38,デイリースポーツ,ソフトバンク　上沢直之が国内ＦＡ権取得　球団を通じ「プロ野球選手として嬉しく思います」節目の日に古巣・日本ハム戦に先発,https://news.yahoo.co.jp/articles/69623942bbc29729b124081a16d3c540560aea7a,5/1(木) 16:00
2025-05-01,18:07,sports,スポーツ,39,デイリースポーツ,広島・坂倉将吾が巨人・長野久義と談笑　元同僚の先輩＆後輩が胸アツシーン,https://news.yahoo.co.jp/articles/efc4ae76d1d1aea42e270c0dd9b3a492ea867506,5/1(木) 17:06
2025-05-01,18:07,sports,スポーツ,40,日刊スポーツ,【ヤクルト】小川GM「チーム状況も全部含めて」金銭トレードで西武から加入の山野辺翔へ期待,https://news.yahoo.co.jp/articles/29deb445b1f755f479e9159e97ecf1b009b503b7,5/1(木) 12:02
