scrp_date,scrp_time,genre_en,genre_jp,rank,media_jp,title,link,date_original
2025-12-29,00:07,domestic,国内,1,読売新聞オンライン,小樽のスキー場でエスカレーターに腕挟まれ、５歳男児が死亡…自動停止せず母親が非常停止ボタン,https://news.yahoo.co.jp/articles/5458ca137ad48636c6d9c5a7a5f6a52f4e548ca1,12/28(日) 12:56
2025-12-29,00:07,domestic,国内,2,共同通信,男児死亡のエスカレーター非常停止せず,https://news.yahoo.co.jp/articles/37f2a9024199185d42c2b3e94696556ee18147d4,12/28(日) 19:54
2025-12-29,00:07,domestic,国内,3,共同通信,【独自】障害年金、医師の判定を破棄　機構職員、ひそかにやり直し,https://news.yahoo.co.jp/articles/615a270a7ba87c9c487a6a4050f5d2f87fe79171,12/28(日) 21:01
2025-12-29,00:07,domestic,国内,4,読売新聞オンライン,多摩動物公園でオオカミ脱走、正門近くで職員が捕獲…園内で４時間避難した４歳「つかれちゃった」,https://news.yahoo.co.jp/articles/088e262f91b556c6303a5a48351012b858e0c266,12/28(日) 14:50
2025-12-29,00:07,domestic,国内,5,医療介護ＣＢニュース,若年の大腸がんと子宮体がん　罹患率・死亡率とも増加 - 国がん,https://news.yahoo.co.jp/articles/196d088c9f780c805b99bc34912fe0d982140800,12/25(木) 17:40
2025-12-29,00:07,domestic,国内,6,東海テレビ,刃物が刺さった状態で発見…路上で配送業の35歳男性が背中を刺される 犯人は逃走し殺人未遂事件として捜査,https://news.yahoo.co.jp/articles/5ba14fb8cd7f816817be8fa7dd0ba82450a98b10,12/28(日) 23:15
2025-12-29,00:07,domestic,国内,7,CBCテレビ,体温計に残された41.5度の表示 ワクチン接種後に39歳息子が死亡 「検視時の体温が非常に高かった、普通じゃ考えられない」 【“ワクチン後遺症”を考える シリーズ5】,https://news.yahoo.co.jp/articles/b2391211209c8b1b902222c1c269d18aec8e0a78,12/28(日) 12:56
2025-12-29,00:07,domestic,国内,8,共同通信,エスカレーターに挟まれ男児死亡　小樽のスキー場、非常停止せず,https://news.yahoo.co.jp/articles/0e3032c661d4409d2859aefea564bff3da4268e4,12/28(日) 12:59
2025-12-29,00:07,domestic,国内,9,日刊スポーツ,中国駐日大使館Ｘ、米への警告を日本語で掲載しツッコミ「びびってる？」「米にも渡航自粛は？」,https://news.yahoo.co.jp/articles/ade0ff91ae16187d29f0144ac4f151e33f235211,12/28(日) 7:52
2025-12-29,00:07,domestic,国内,10,スポーツ報知,井上貴博アナ、「報道の日」でオウム真理教事件回顧「我々ＴＢＳはこのオウム真理教を巡ってビデオ問題という大きな問題を引き起こしました」,https://news.yahoo.co.jp/articles/acd36adda1bcebe47b80ed8a5d0c51161c53292e,12/28(日) 18:23
2025-12-29,00:07,domestic,国内,11,東海テレビ,「ドーンという音が」などと通報相次ぐ…マンションの5階の一室が全焼し焼け跡から遺体 1人暮らしの男性と連絡取れず,https://news.yahoo.co.jp/articles/2140f0f5b4e1041308c64b8739f74c632520ad0c,12/28(日) 22:30
2025-12-29,00:07,domestic,国内,12,FNNプライムオンライン,「何てことをしてくれた」市職員から不満…給与引き上げは見送りへ　ふるさと納税“産地偽装問題”の余波　税収大幅減・財政運営に影響も　31の公共事業実施が先送りに　長野・須坂市,https://news.yahoo.co.jp/articles/91eb350e187457e043ba677fca38d4e4334ef1f4,12/28(日) 17:00
2025-12-29,00:07,domestic,国内,13,中日スポーツ,「どうやってしょっぴこう」吉村大阪府知事発言に山本景交野市長が猛反発「まさにファシズム」「私は意地でも屈しない」,https://news.yahoo.co.jp/articles/88185607287c7ca599d5daa59fd483bd12617947,12/28(日) 17:43
2025-12-29,00:07,domestic,国内,14,産経新聞,大石氏「一緒に牛歩を」に山添氏固まる　初のれいわ・共産政策懇談…共闘の思惑も,https://news.yahoo.co.jp/articles/f6d04381a400acde1177a1369b47c33331ea9027,12/22(月) 7:00
2025-12-29,00:07,domestic,国内,15,スポーツ報知,有働由美子アナ、マタギの猟に密着してクマ被害に言及「人の命を守るために駆除するという方法も必要ですけど…」,https://news.yahoo.co.jp/articles/f0af6eb1ebafe55cdd4e0a1a90cbffe532c432c1,12/28(日) 21:53
2025-12-29,00:07,domestic,国内,16,デイリースポーツ,ゴミ清掃員芸人　東京２３区家庭ゴミ有料化案に「賛成」怒りには理解も「無駄な税金使うな、は別々に考えること大事」,https://news.yahoo.co.jp/articles/0752cc641729197cb806285c8518c79b4fd52791,12/28(日) 22:43
2025-12-29,00:07,domestic,国内,17,朝日新聞,小樽のスキー場で5歳男児、腕を挟まれ死亡　屋外エスカレーターに,https://news.yahoo.co.jp/articles/3be36298e7f50cf3facc1cfc821a4e975e7d5e5b,12/28(日) 12:52
2025-12-29,00:07,domestic,国内,18,読売新聞オンライン,横浜で３３歳女性はねられ死亡、ひき逃げ容疑で１８歳の男逮捕…無免許運転で逃走か,https://news.yahoo.co.jp/articles/f42c772e7a427575c46f2c9024327e39056807ef,12/28(日) 19:50
2025-12-29,00:07,domestic,国内,19,共同通信,名古屋の路上で男性刺されたか、意識あり,https://news.yahoo.co.jp/articles/b5e0c7aff30acae5b57d7dc5dd2fbb5de573058a,12/28(日) 23:44
2025-12-29,00:07,domestic,国内,20,共同通信,障害年金、医師の判定ひそかに破棄,https://news.yahoo.co.jp/articles/234f2e495bf2317a32450855ba507eeb6dba0c3a,12/28(日) 21:00
2025-12-29,00:07,domestic,国内,21,毎日新聞,オオカミ脱走で一時騒然「怖かった」　来園者、3時間以上閉じ込め,https://news.yahoo.co.jp/articles/cf85df3222d8315619da8e1509d1a17a32e4b455,12/28(日) 22:24
2025-12-29,00:07,domestic,国内,22,デイリースポーツ,オオカミ脱走の多摩動物公園、Ｘでも注意呼びかけ　コメント殺到５８０件超え「無事に見つかりますよう」,https://news.yahoo.co.jp/articles/62b26b6cb5758896bcfd41692ef17cae80b78995,12/28(日) 12:33
2025-12-29,00:07,domestic,国内,23,朝日新聞,脱走のオオカミ1頭を園内の林で捕獲、通報の4時間後　多摩動物公園,https://news.yahoo.co.jp/articles/5811f407132e017b82724e7c52d20e888e9d0db1,12/28(日) 11:46
2025-12-29,00:07,domestic,国内,24,読売新聞オンライン,関越道通行止め解除、路面に雪なくてもドライバーは速度抑え走行…燃えた電光掲示板撤去し中央分離帯も修復,https://news.yahoo.co.jp/articles/ae660186f238a94e11e40b670da43a7772bcc38c,12/28(日) 20:05
2025-12-29,00:07,domestic,国内,25,読売新聞オンライン,飼い犬を助けようと飛び込んだか、佐賀市で４９歳男性死亡…捜索中の警察官が発見,https://news.yahoo.co.jp/articles/38594a4badf9f6dd19c7e35b0f0808bd7e5966c9,12/28(日) 22:18
2025-12-29,00:07,domestic,国内,26,弁護士JPニュース,競馬で「1億4000万円」儲け→税金で「4億円超」のマイナス？　裁判所が“外れ馬券代の控除“を認めた条件とは,https://news.yahoo.co.jp/articles/0303011ce74b6f812e7dfe938c131e3add0131a1,12/28(日) 9:40
2025-12-29,00:07,domestic,国内,27,毎日新聞,脱走したオオカミを捕獲　多摩動物公園内で　園側はXで陳謝,https://news.yahoo.co.jp/articles/2679f43b303e435b6fc3a4e1d62126408ba8afef,12/28(日) 14:38
2025-12-29,00:07,domestic,国内,28,産経新聞,「日中議連発言」保守党・有本氏、立民・岡田氏の抗議に「証拠」示し反論　公開討論を要求,https://news.yahoo.co.jp/articles/353adf9916e71e532500cf60c7d675d171b8d077,12/27(土) 7:00
2025-12-29,00:07,domestic,国内,29,共同通信,北海道の養鶏場で鳥インフル疑い,https://news.yahoo.co.jp/articles/67967d40ad959829e6b2e7ba5b8fed18a8f0cb20,12/28(日) 21:02
2025-12-29,00:07,domestic,国内,30,弁護士JPニュース,植松聖死刑囚らの作品展示『死刑囚表現展2025』開催　「きわめて身勝手だと感じた」「生きて償う、に賛同したい」毎年さまざまな声,https://news.yahoo.co.jp/articles/1528af996d78208f25f44c847b43d513be29cab8,12/25(木) 10:20
2025-12-29,00:07,domestic,国内,31,朝日新聞,名古屋市緑区で男性刺される　刃物刺さった状態で発見、容疑者は逃走,https://news.yahoo.co.jp/articles/2d08d81c4fab13e57b0ef4b79249bec6b08c6ef4,12/28(日) 23:45
2025-12-29,00:07,domestic,国内,32,日テレNEWS NNN,多摩動物公園で脱走したオオカミ、園内で捕獲　麻酔銃と網を使い　東京・日野市,https://news.yahoo.co.jp/articles/1417ae98fcf0a1a3f7b3462144e8b697001611d5,12/28(日) 15:04
2025-12-29,00:07,domestic,国内,33,日テレNEWS NNN,「難病の弟を治したい」──双子のピアニストは、“二刀流”目指す医大生　憧れの在宅医と…病気の子や家族へライブ『every.特集』,https://news.yahoo.co.jp/articles/e17edf85065b960b1c688f71bcd11d2a52c195b3,12/28(日) 19:46
2025-12-29,00:07,domestic,国内,34,FNNプライムオンライン（フジテレビ系）,多摩動物公園で脱走していたオオカミ1頭を捕獲、28日は臨時休園に,https://news.yahoo.co.jp/articles/23eebfbb802afc253f09c6aacd6cdcba48d4e8ff,12/28(日) 14:57
2025-12-29,00:07,domestic,国内,35,デイリースポーツ,倉田真由美氏　東京２３区での家庭ゴミ有料化に「絶対にやめて欲しい」→プロジェクションマッピングよりゴミ無料の方がありがたい,https://news.yahoo.co.jp/articles/696e6491ad53eaf51bd53f9c226798472befde87,12/28(日) 10:24
2025-12-29,00:07,domestic,国内,36,朝日新聞,全財産は105円　年末年始、居場所ない若者に「屋根とメシ」を,https://news.yahoo.co.jp/articles/e6d0922b60d70577688005de0ce379449207ccee,12/28(日) 12:00
2025-12-29,00:07,domestic,国内,37,J-CASTニュース,埼玉、神奈川、千葉には東京の税を回さないと不公平、アンバランスと橋下徹氏　小池知事の説明「おかしい」,https://news.yahoo.co.jp/articles/23c5a5fef864de8bc0b7d4f54e0aecdf28b2e97a,12/28(日) 18:22
2025-12-29,00:07,domestic,国内,38,tenki.jp,明日29日　日本海側は次第に雨や雪　落雷・ひょう注意　関東は午前雨で雪の可能性も,https://news.yahoo.co.jp/articles/18f1bb46c631293239098fb1c658baeb1c8d5d1d,12/28(日) 18:31
2025-12-29,00:07,domestic,国内,39,スポニチアネックス,脱走のオオカミを捕獲、多摩動物公園「無事に捕獲され、安全が確認されました」けが人の情報なし,https://news.yahoo.co.jp/articles/66dfe9e6f7beab17caba12775faa56fa47353f06,12/28(日) 14:50
2025-12-29,00:07,domestic,国内,40,共同通信,介護のカスハラ対策を義務化へ　職員保護狙い厚労省、手引も改定,https://news.yahoo.co.jp/articles/00f5f5ab35294acf28259dd666a044e47e168f2e,12/28(日) 17:10
