scrp_date,scrp_time,genre_en,genre_jp,rank,media_jp,title,link,date_original
2024-02-22,05:17,TTL,総合,1,サンケイスポーツ,山本陽子さん死去　２月２日にテレビ出演も…熱海市内の病院で　６４年映画「抜き射ちの竜　拳銃の歌」で頭角,https://news.yahoo.co.jp/articles/f450796bc0b6776726b1cf8be631052d9acf4706,2/22(木) 2:00
2024-02-22,05:17,TTL,総合,2,マイナビ子育て,藤本美貴さん激怒！ ディズニーランドで何度も腹痛を訴えトイレに行く長男を不審に思い…「お前にはまだ早い！」,https://news.yahoo.co.jp/articles/2a9e97637d0dae94be045ae4add64a0a34575220,2/21(水) 12:10
2024-02-22,05:17,TTL,総合,3,中日スポーツ,『プラス・マイナス』岩橋良昌「吉本、芸人辞めます　お疲れ様でした」とSNSに投稿…ファンも心配,https://news.yahoo.co.jp/articles/7afb25f3883a0f8544d2a9e3bc1b6c68c0d22964,2/21(水) 20:56
2024-02-22,05:17,TTL,総合,4,スポーツ報知,４０歳・磯山さやか、最後に交際していた時期告白に女性陣も「えっ！」と驚き,https://news.yahoo.co.jp/articles/a9c1fdbb9be6bc4af83f45f08516ac86e6c20d92,2/21(水) 15:55
2024-02-22,05:17,TTL,総合,5,スポニチアネックス,プラス・マイナス岩橋「吉本、芸人辞めます　お疲れ様でした。」コンビも「解散です」など連続投稿,https://news.yahoo.co.jp/articles/a5870d81c8646dd61d1ee770d91e06918260b662,2/21(水) 20:22
2024-02-22,05:17,TTL,総合,6,MusicVoice,磯山さやか、最後に交際していた“年齢”に驚きの声,https://news.yahoo.co.jp/articles/49bb509cdd1633fda08d427fb3d973e692a782cd,2/22(木) 2:33
2024-02-22,05:17,TTL,総合,7,デイリースポーツ,スタンフォード日本人女子学生「あまりに酷すぎ。遅れ取りすぎてる」佐々木麟太郎否定コメに激怒「スポーツで入ってズル」なし,https://news.yahoo.co.jp/articles/56a65be23f4f7b549c4098a727349a02c5d4b9f2,2/21(水) 11:05
2024-02-22,05:17,TTL,総合,8,日刊スポーツ,「水ダウ」次週報告ＶＴＲに松本人志登場でＸざわつく、首をかしげ下を向いた映像放送される,https://news.yahoo.co.jp/articles/beac3c690a3077105a0771933619793bfee732ea,2/22(木) 0:49
2024-02-22,05:17,TTL,総合,9,スポーツ報知,「爆痩せ」りんごちゃん、“激変”した姿に騒然「コーヒー噴くｗ」「何でそうなるの」「上と下の差よw」,https://news.yahoo.co.jp/articles/382453d83df6e42d848bd9366eee171416959807,2/21(水) 18:25
2024-02-22,05:17,TTL,総合,10,産経新聞,欧州の本気、遅すぎたか　ウクライナ砲弾支援「北朝鮮に負けるのか」　トランプ氏再来焦り　ウクライナ侵略２年,https://news.yahoo.co.jp/articles/03f9f64bfb4f1b348b6531b8d2a2b9d3c025cf9e,2/21(水) 16:21
2024-02-22,05:17,TTL,総合,11,まいどなニュース,猫に枕を取られ続け…新たにもう一つ買ったが→「泣いた」　「全枕を奪われた」「これぞ猫」,https://news.yahoo.co.jp/articles/ff76cf1e7b248fe20d5db6fbc4209ca3864fd66a,2/21(水) 17:00
2024-02-22,05:17,TTL,総合,12,デイリースポーツ,榊英雄容疑者逮捕に性被害を実名告白の女優「やっと、やっと逮捕された」,https://news.yahoo.co.jp/articles/65814925b9502b2eb61565682243da831d4a7cd4,2/21(水) 19:16
2024-02-22,05:17,TTL,総合,13,デイリースポーツ,「石川県に寄付したのは無駄ということ」大阪万博に１０００万計上の馳浩知事に俳優、蓮舫氏ら批判「ポケットマネーでどうぞ」,https://news.yahoo.co.jp/articles/bc617dc23fd187be47db8352c98179a915162842,2/21(水) 9:44
2024-02-22,05:17,TTL,総合,14,中日スポーツ,「酷すぎ」…？ 濱田マリ、ウクライナ人ディレクターへの質問に「こんな人だったの？」と厳しい声　ＳＮＳと生放送の難しさ,https://news.yahoo.co.jp/articles/eb62cd3e3c2fb06596d2af92ce9d0e5dc97925fb,2/21(水) 14:46
2024-02-22,05:17,TTL,総合,15,テレ東スポーツ,女子に続いて男子もベスト8進出でパリ五輪への切符を獲得！準々決勝では最強・中国と対戦【世界卓球】,https://news.yahoo.co.jp/articles/46f830bdc92c4301db46c3392044b159e565072d,2/21(水) 21:39
2024-02-22,05:17,TTL,総合,16,ほ・とせなNEWS,お昼寝するおじいちゃんとわんこ　しかしよく見ると…「何回でも見てしまう」「ラブリーすぎ」の声,https://news.yahoo.co.jp/articles/de756911a51bf1c4e09f058063de78e5e4ade0ef,2/21(水) 12:30
2024-02-22,05:17,TTL,総合,17,スポニチアネックス,暴行発覚の北青鵬　激闘制した翌日…初場所“突然”休場　診断書提出も宮城野親方は“意味深なコメント,https://news.yahoo.co.jp/articles/b976546ff7b4e2bb539332bbbadd7090e1e5f3ac,2/21(水) 20:15
2024-02-22,05:17,TTL,総合,18,東スポWEB,プラス・マイナス岩橋良昌が吉本興業と決別宣言「汚ねぇ世界とおさらば」　コンビ解散も発表,https://news.yahoo.co.jp/articles/744b3ce4e214984b20c70e5347448bcd224870b5,2/21(水) 21:01
2024-02-22,05:17,TTL,総合,19,ENCOUNT,第4子妊娠中の加藤夏希、ナンパされ「まだイケるようです」　驚きで「産まれるとこだった！」,https://news.yahoo.co.jp/articles/020abadef5e8f59fdc709676b29ec4b0ba1e69a5,2/21(水) 20:23
2024-02-22,05:17,TTL,総合,20,ＡＦＰ＝時事,腐食性物質で女性襲った男の遺体、テムズ川で発見 英警察見解,https://news.yahoo.co.jp/articles/aac14031b7037f8f6306c41d1c2694ac5be32a97,2/21(水) 10:31
2024-02-22,05:17,TTL,総合,21,日刊スポーツ,ホラン千秋がご乱心「水ダウ」ビリビリ椅子で奇声発しフリップたたきつけ、机に座る“下品”姿も,https://news.yahoo.co.jp/articles/d253c82205e8cdf2cbddb7df724cecd42847b09f,2/21(水) 23:12
2024-02-22,05:17,TTL,総合,22,デイリースポーツ,男子卓球　張本の対戦相手がボールを蹴るしぐさ　ネットインで得点奪われイラつく　イエローカードは出ず,https://news.yahoo.co.jp/articles/2c4810dfbc2cd26a1a01af6a3393f20a9ad9ed01,2/21(水) 20:57
2024-02-22,05:17,TTL,総合,23,デイリースポーツ,西山喜久恵アナ、小６時に「皇太子さまがうちに来た」　後輩アナきょとん「どういうことですか？」,https://news.yahoo.co.jp/articles/ab3fa433eb55b99ca2490baedcc512cfa9cb6802,2/21(水) 16:21
2024-02-22,05:17,TTL,総合,24,ゲキサカ,横浜FMがクラブ史上初のACLベスト8! 延長接戦の末にA・ロペスがPK決勝弾、バンコク・Uの堅守打ち破る,https://news.yahoo.co.jp/articles/144fb751fdba6a82d634eab58886d375df891de2,2/21(水) 22:46
2024-02-22,05:17,TTL,総合,25,日刊スポーツ,エハラマサヒロ、SNS騒がせる後輩芸人に「悲しくなるなぁ…承認欲求なのか自暴自棄なのか…」,https://news.yahoo.co.jp/articles/28df34899d4f75fca0c17770f686d5b79cd78011,2/20(火) 10:44
2024-02-22,05:17,TTL,総合,26,デイリースポーツ,磯山さやか、バストもヒップも！に答えた「ダブル見せ」ポーズにシソンヌ長谷川「磯ダブル」と命名,https://news.yahoo.co.jp/articles/8a18f52730d52e7eee1190cbfe088a81d6575477,2/21(水) 12:05
2024-02-22,05:17,TTL,総合,27,時事通信,NY株、続落,https://news.yahoo.co.jp/articles/24e12c0d60bed9c68884023bf3e0e3b16cbe584f,2/21(水) 23:48
2024-02-22,05:17,TTL,総合,28,スポニチアネックス,楽天パワハラ解雇の安楽智大　メキシカンリーグ入り目指す　力を発揮できる新天地模索,https://news.yahoo.co.jp/articles/088e7a24574247d72c06bab076aa15dfbff5229e,2/22(木) 2:00
2024-02-22,05:17,TTL,総合,29,TBS NEWS DIG Powered by JNN,男子バスケ日本代表、富樫や河村ら12人発表 パリ五輪イヤー最初の国際大会 昨夏W杯活躍ホーキンソンは外れる,https://news.yahoo.co.jp/articles/a52dca88561dac029a02785484a242f7e491f86b,2/21(水) 22:09
2024-02-22,05:17,TTL,総合,30,Full-Count,大谷翔平と比較された二刀流の今　4年間メジャー出場なし…待っていた“過酷な運命”,https://news.yahoo.co.jp/articles/b3f1658fb43756cb22b6e52e145fdd7354f749bc,2/21(水) 17:40
2024-02-22,05:17,TTL,総合,31,中日スポーツ,自民党がネット上の誹謗中傷に『緊急提言』もSNSでは批判殺到「まずはあなた方の党の議員を」「自民党に常習犯」,https://news.yahoo.co.jp/articles/64cc041d8c7f5184837f70a9040f7031fa6b2705,2/21(水) 23:08
2024-02-22,05:17,TTL,総合,32,ELLE DIGITAL,メーガン妃の共演者リック・ホフマン、ロイヤルウェディングの会場には「悪臭が漂っていた」と主張,https://news.yahoo.co.jp/articles/5bf614ac70186873f579cfea7f9a8b788edca862,2/21(水) 21:02
2024-02-22,05:17,TTL,総合,33,ELLE DIGITAL,血圧低下にも期待！ バナナよりもカリウムが豊富な食べ物 8選,https://news.yahoo.co.jp/articles/2ccd09363b4983a5cc605c73ac1b2f6575be4bdb,2/20(火) 20:50
2024-02-22,05:17,TTL,総合,34,カナロコ by 神奈川新聞,未就学女児に不同意わいせつ容疑、６０歳逮捕　母が通報「娘が泣いて帰ってきた」,https://news.yahoo.co.jp/articles/37072d8fbe554dae0578efcd97c10fdf56768d39,2/21(水) 21:41
2024-02-22,05:17,TTL,総合,35,日刊ゲンダイDIGITAL,佐々木麟太郎「米留学→2年後メジャー挑戦」に立ちはだかる高すぎる壁…パックンも辛口コメント,https://news.yahoo.co.jp/articles/437a1e7f12a569892e5273d3c0f03793325bd5d3,2/21(水) 16:53
2024-02-22,05:17,TTL,総合,36,J-CASTニュース,「日本人よ」茂木健一郎氏が一喝「小学校5年生レべルの『お笑い』で満足してる」　松本人志や有吉の壁...列挙で痛烈批判,https://news.yahoo.co.jp/articles/4879ab6b48deb743d73ee2d2cf3e9cdf7388d4a5,2/21(水) 14:45
2024-02-22,05:17,TTL,総合,37,Full-Count,トラウトぽつり「オオタニは行ってしまった」　激減した取材陣で実感した“流出”,https://news.yahoo.co.jp/articles/ac3643cea92be50f3fa7293f7be3f205f0d29eb0,2/21(水) 6:33
2024-02-22,05:17,TTL,総合,38,スポーツ報知,久常涼が特別招待選手でマスターズ初出場へ…昨年、日本勢初の欧州ツアー新人王,https://news.yahoo.co.jp/articles/4598f035f987beb9687703386a54fdcfb35f97e5,2/21(水) 23:02
2024-02-22,05:17,TTL,総合,39,スポーツ報知,３０歳売れっ子女優「午前０時の森」でプライベート告白もネット「結婚してたの？」「知らなかった」,https://news.yahoo.co.jp/articles/4d28f149c20adff2878b736ce02bac16ec851a8b,2/21(水) 14:55
2024-02-22,05:17,TTL,総合,40,オリコン,激しくじゃれて遊ぶスタンダードプードルに我関せずな5歳児の姿に700万回再生「もはや振り向きもしない笑」,https://news.yahoo.co.jp/articles/92bd8af372a77ef2b3ecb9c7b28483e276fa9f76,2/21(水) 8:10
