scrp_date,scrp_time,genre_en,genre_jp,rank,media_jp,title,link,date_original
2026-02-12,09:43,domestic,国内,1,読売新聞オンライン,２度目の敗軍の将の野田氏に「Ａ級戦犯だ」…中道への合流「自滅しにいくようなものだ」との声も,https://news.yahoo.co.jp/articles/36f731a243898d311e842a463e400d90b443cc21,2/12(木) 5:00
2026-02-12,09:43,domestic,国内,2,スポニチアネックス,落選の海江田万里氏、高市首相を批判「悪いけど彼女は“経済音痴”ですよ」,https://news.yahoo.co.jp/articles/6cfcda2a3493080d9e69d818eba9a2b4a0b41bdf,2/11(水) 22:31
2026-02-12,09:43,domestic,国内,3,ABEMA TIMES,古さの象徴？「5爺」の“時代遅れ感”も仇に？「無党派層取れず支持層も流出」中道・小選挙区で96.5％敗北の衝撃…選挙ドットコム副編集長「今回は新しいか古いかが軸になった」,https://news.yahoo.co.jp/articles/4a26c3c58363108c847e78b774eb6d22202c289d,2/12(木) 7:00
2026-02-12,09:43,domestic,国内,4,スポーツ報知,「ゴゴスマ」コメンテーター、衆院選大勝の高市首相の高支持率維持で指摘「実は自民党の中は高市さん素晴らしいと思っている人だけじゃない」,https://news.yahoo.co.jp/articles/b31cd9adcd1988d388c2cb9cf5c8f2ddd89d3d47,2/11(水) 18:05
2026-02-12,09:43,domestic,国内,5,日刊スポーツ,夫や子と離れ単身赴任で衆院選→落選の国民候補が複雑胸中「離婚をした方がいいのでしょうか？」,https://news.yahoo.co.jp/articles/f6f6a245ed792d718599ffe607c04a7f7910398e,2/11(水) 16:42
2026-02-12,09:43,domestic,国内,6,日刊スポーツ,「高市政権の支持率は確実に下がる」フジ出演の早大名誉教授が予言「ここまで勝つと…」理由説明,https://news.yahoo.co.jp/articles/16968f61a4ea8b98ad7c717fc97dad4c1ead6925,2/12(木) 8:36
2026-02-12,09:43,domestic,国内,7,BUSINESS INSIDER JAPAN,シルバー（銀）とゴールド（金）があふれかえる、地元のコインショップの苦しい現状。すでに購入制限がはじまっている（海外）,https://news.yahoo.co.jp/articles/b80218f7b5b35ca27f5a3a351f8c63170ee8e81a,2/12(木) 7:10
2026-02-12,09:43,domestic,国内,8,よろず～ニュース,辻元清美氏「涙が出そうになった」衆院選落選した大物中道議員の事務所撤収手伝う,https://news.yahoo.co.jp/articles/b279a29375e1a77deb57dee111a0f745ce2d6031,2/12(木) 7:00
2026-02-12,09:43,domestic,国内,9,スポニチアネックス,維新・藤田共同代表　公約に反対の自民議員にクギ「高市人気で勝ったんでしょう？生産的な議論を」,https://news.yahoo.co.jp/articles/ed3c085c13632cefd6d79006cd12e979fd64366a,2/11(水) 22:16
2026-02-12,09:43,domestic,国内,10,共同通信,野田氏「比例復活の機会増やす」　中道、公明優遇で不協和音,https://news.yahoo.co.jp/articles/cabc13f84f91a281c090e7338d9a76b581f05e54,2/11(水) 17:25
2026-02-12,09:43,domestic,国内,11,毎日新聞,「岩屋降ろし」非自民保守系が存在感　中道は失速　衆院選・大分,https://news.yahoo.co.jp/articles/f7e1c3215648403bfcd227cb0d9ca71d6e555a41,2/12(木) 7:45
2026-02-12,09:43,domestic,国内,12,スポニチアネックス,辻元清美氏　中道の代表選に言及「私、立憲民主党の参議院議員なので、中道の代表選には出られません」,https://news.yahoo.co.jp/articles/e83e828d155110b54b83e786444db29eee5f885b,2/11(水) 11:22
2026-02-12,09:43,domestic,国内,13,デイリースポーツ,辻元清美氏、中道代表選にＸで言及　泉健太氏が解説「アホいうたらあかんよ」「権利持ってない」,https://news.yahoo.co.jp/articles/5838e9b60c2402464675e237a4312c9fd1434800,2/11(水) 9:28
2026-02-12,09:43,domestic,国内,14,日刊スポーツ,ひろゆき氏、高市政権「そんな持たないと思ってる」と私見「マジでやばいよね、っていう…」,https://news.yahoo.co.jp/articles/5f1609ff790561fb4979b346e71c3b9a272707a8,2/11(水) 13:59
2026-02-12,09:43,domestic,国内,15,産経新聞,「党内融和を一番に」中道・伊佐進一氏、新代表への要望　衆院選は「全員平等で戦わねば」,https://news.yahoo.co.jp/articles/9adfdc3b164463fa4e2b35d170aa12a5c6891d61,2/12(木) 7:00
2026-02-12,09:43,domestic,国内,16,中日スポーツ,「え？そうなの？」赤沢亮正経産相、渡米時に明かした”出張ルール”がネットで話題「初耳」「勿体ないな」,https://news.yahoo.co.jp/articles/d249fa75829dba14330c498ee638e86f2daae2dd,2/11(水) 22:15
2026-02-12,09:43,domestic,国内,17,日刊スポーツ,井川意高氏が衝撃「決別」宣言　支援した百田尚樹氏＆日本保守党と…「ほんとうに悲しい」,https://news.yahoo.co.jp/articles/4b3e04c42dd2b3f8caca53bdd7376b690f54752e,2/11(水) 11:33
2026-02-12,09:43,domestic,国内,18,弁護士JPニュース,「衆院選は無効」弁護士らが東京高裁に提訴　“議員定数の不均衡”前回から是正なし…「このままでは民主主義の前提が崩れる」と訴え,https://news.yahoo.co.jp/articles/66588a982b65d2bacc98c091e231c00bd5da040d,2/11(水) 11:01
2026-02-12,09:43,domestic,国内,19,産経新聞,中道代表選は13日　野田氏「火だるまの投手では失点続く」、斉藤氏「立民と垣根ない」,https://news.yahoo.co.jp/articles/5efd00bc13dfe92bd823828dae8e34b5b20d8305,2/12(木) 7:00
2026-02-12,09:43,domestic,国内,20,読売新聞オンライン,参院選１人区での試算は自民３１勝１敗、野党勝利は香川選挙区のみ…自民と維新一本化なら与党が全勝,https://news.yahoo.co.jp/articles/5c476b21a2606f87398b122f66a30149cc5a72e9,2/12(木) 8:13
2026-02-12,09:43,domestic,国内,21,スポニチアネックス,中道“ドタバタ”代表選　小川氏、階氏が立候補も…「推薦人10人案」反対相次ぎ急きょ「不要」に,https://news.yahoo.co.jp/articles/cda9c2f26a8383374ee00c5a6d2ca631a59421a7,2/12(木) 5:30
2026-02-12,09:43,domestic,国内,22,日刊スポーツ,辻元清美氏「必死に笑顔になったけど本当は涙が…」落選した中道重鎮の議員会館撤収伝える,https://news.yahoo.co.jp/articles/aa8ac429bd9bcc3863ae19e1f0ebd095ebf63b2d,2/12(木) 9:15
2026-02-12,09:43,domestic,国内,23,中日スポーツ,「双子みたい」蓮舫議員、中道の惨敗も”女性黄金コンビ”2ショットで「前を見よう」と呼びかけ「まさに…」「最強めっちゃ大好き」,https://news.yahoo.co.jp/articles/eb06a433a726e88771001c2857cc2322bb624be5,2/11(水) 11:35
2026-02-12,09:43,domestic,国内,24,産経新聞,国民・榛葉氏「希望の党以上の崩れ方」中道の惨敗念頭　二度大敗の野田氏に「思うところ」,https://news.yahoo.co.jp/articles/f843a07dcf77c5e9a8361398771d7df13eff6a86,2/9(月) 16:21
2026-02-12,09:43,domestic,国内,25,産経新聞,「私も党を引っ張る立場に」中道代表選出馬の階猛氏　大敗の原因は「時間足りなさ過ぎた」,https://news.yahoo.co.jp/articles/bbc3f7ac589d273129bda2b4f63488b692e8c931,2/12(木) 7:00
2026-02-12,09:43,domestic,国内,26,中日スポーツ,政権与党に厳しいテレ朝出身なのに…元アナウンサーの2人が自民党で同期当選「よりにもよって」「なぜ自民？w」,https://news.yahoo.co.jp/articles/0b45d0697d15b47a2f1308517bcb86833cbbac0a,2/11(水) 20:59
2026-02-12,09:43,domestic,国内,27,J-CASTニュース,蓮舫氏、高市首相の投票呼びかけ発言を批判　「揚げ足取り」指摘も,https://news.yahoo.co.jp/articles/0aad8b42367d77c29122eee3061c8978a0b5eb71,2/5(木) 13:15
2026-02-12,09:43,domestic,国内,28,読売新聞オンライン,江藤拓さんのコメ失言に失望語る有権者「半年たってもあの発言は忘れていない」…大勝の自民党、宮崎県では２敗,https://news.yahoo.co.jp/articles/f9ccc348278996af64d3bcdc937d97b24d689eb0,2/11(水) 15:54
2026-02-12,09:43,domestic,国内,29,中日スポーツ,立憲・辻元清美議員、笑顔で”落選引っ越し”お手伝い　議席失った岡田克也元外相の事務所訪れ「本当は涙が出そう」,https://news.yahoo.co.jp/articles/32b415c8c0a77c7376aa716e594ae76848260e4b,2/11(水) 17:51
2026-02-12,09:43,domestic,国内,30,時事通信,急造中道、内部で不満続出　揺らぐ存続、代表選論点に,https://news.yahoo.co.jp/articles/c38290e66ae5fd129f855b37978db3190668fd5e,2/12(木) 7:06
2026-02-12,09:43,domestic,国内,31,スポニチアネックス,中道はなぜ若者に支持されない？新代表候補が分析　他の野党は「若者をターゲットにした政策の発信を」,https://news.yahoo.co.jp/articles/d3d703916f4e27dc51a1ee6e03ed5f2d6e8fc842,2/11(水) 22:56
2026-02-12,09:43,domestic,国内,32,産経新聞,玉木氏、日本の左派系主張に「防衛力強化＝戦争の考え、変えないと」　リベラルは「大事」,https://news.yahoo.co.jp/articles/eeb69d30e9dede2c387101c4b1064c97877296cc,2/11(水) 7:00
2026-02-12,09:43,domestic,国内,33,デイリースポーツ,国民・玉木代表　中道と共闘していれば議席増の指摘に反論「典型的タラレバ」政策・理念無視した一本化が「いかに有権者に忌避されるか選挙結果が示してる」,https://news.yahoo.co.jp/articles/7d0bfd3681cf88d4d4e5e57159e64226c55e6084,2/11(水) 21:24
2026-02-12,09:43,domestic,国内,34,ABEMA TIMES,「ふざけるな、自分たちの党を大事にしろ」泉健太氏、中道改革連合の“大惨敗”に「事実上、焼け野原の状態」 代表選への出馬は「まだ決めていない」,https://news.yahoo.co.jp/articles/f5c961c743369ad6621196bfb1ab4fdbd9cc9e2a,2/10(火) 12:21
2026-02-12,09:43,domestic,国内,35,読売新聞オンライン,中道再建の道筋が焦点、立民側落選者「公明に譲りすぎだ」・公明側は「融和」優先方針…代表選きょう告示,https://news.yahoo.co.jp/articles/efbda6de8cc2e2a0ced7aae715f5594eff3d4ee3,2/12(木) 8:51
2026-02-12,09:43,domestic,国内,36,日刊スポーツ,【衆院選】自民の“おこぼれゾンビ”復活当選に議論　中道は大物３氏の名　れいわは唯一の１議席,https://news.yahoo.co.jp/articles/88ce99d20982fb24dd7e0f3a6508e1aa934c2708,2/10(火) 12:19
2026-02-12,09:43,domestic,国内,37,日刊スポーツ,落選の枝野幸男氏、ラフな服装で議員会館の荷物整理　盟友が報告「寂し過ぎます。痛恨の極み」,https://news.yahoo.co.jp/articles/08db00ed1c4f5ea069c5a6b796b71d3de2a45bb4,2/11(水) 12:36
2026-02-12,09:43,domestic,国内,38,ABEMA TIMES,岡山中3・梶谷恭暉さん 行方不明4年目で警察がスマホ解析…中身は？母親の悲痛な思い「プッツリ糸が切れたような感じ」,https://news.yahoo.co.jp/articles/72d6effc3820a0d18e3f5f6c06e9e8331c6186cf,2/11(水) 11:51
2026-02-12,09:43,domestic,国内,39,時事通信,日大三野球部員2人書類送検へ　女子生徒のわいせつ画像拡散容疑　警視庁,https://news.yahoo.co.jp/articles/ff2c82a8881f9937b3d0dedb1dbff570d1e77fe9,2/12(木) 5:36
2026-02-12,09:43,domestic,国内,40,産経新聞,超大型射出成形機の図面データを不正持ち出しか　中国在住の元社員を逮捕,https://news.yahoo.co.jp/articles/1b0e6bab14c449d3827de21e138826b98395e533,2/11(水) 20:29
