scrp_date,scrp_time,genre_en,genre_jp,rank,media_jp,title,link,date_original
2025-10-17,20:06,domestic,国内,1,デイリースポーツ,【高市自民】比例復活不要！吉村爆弾投下に自民重鎮が反撃　吉村代表→衆院５０人削減！イヤなら連立拒否「誰が反対するか国民に見てもらう」→自民重鎮が堂々反対「論外です」,https://news.yahoo.co.jp/articles/bdbf8f4c5daace84eb934bc596fa85075a93879b,10/17(金) 16:47
2025-10-17,20:06,domestic,国内,2,よろず～ニュース,「熊に襲われ行方不明だった」マリーゴールド・ロッシー小川代表 笹崎勝巳レフェリー死去を報告,https://news.yahoo.co.jp/articles/2a95969c3147468ea0ee9a3e190fd1c47b641d61,10/17(金) 14:54
2025-10-17,20:06,domestic,国内,3,毎日新聞,居眠り運転でひき逃げか　女性俳優が死亡、38歳容疑者を逮捕　東京,https://news.yahoo.co.jp/articles/28b9a459ee5932c52492c3998c99c3d9f3a0e506,10/17(金) 16:27
2025-10-17,20:06,domestic,国内,4,デイリースポーツ,【高市自民】維新に騙されたと不満爆発の玉木代表→橋本氏あきれ「政治家にあるまじき発言」　交渉力が疑われると　首相候補もグズグズ煮え切らず終了「案外、ホッとしてるかも」,https://news.yahoo.co.jp/articles/2b1e7d6971233ab2632f4a75860d5b33198ea840,10/17(金) 13:36
2025-10-17,20:06,domestic,国内,5,デイリースポーツ,【悲報】玉木代表　大阪ＴＶ生出演中に維新・共同代表会見割り込み→小ワイプで見つめる屈辱２分　吉村氏の議員削減案に「なんでこんなのが…」不満連発,https://news.yahoo.co.jp/articles/dc9ffcd797a3de99d6695d403e4ddd73f0024cb7,10/17(金) 18:07
2025-10-17,20:06,domestic,国内,6,デイリースポーツ,【高市自民】ネット失笑「エッフェル姉さん久々見た」「必死やなｗ」維新と連立協議→維新に全敗中の大阪自民が自民本部乗り込み　ＴＶで流れ、案の定「何言ってるの」「エッフェル松川ｗ」「会長代行なの？」,https://news.yahoo.co.jp/articles/01da15984df7a02ae959ca682034efdccd83b4a6,10/17(金) 15:50
2025-10-17,20:06,domestic,国内,7,スポニチアネックス,維新・吉村代表「田崎さんは、甘い」　議員定数削減巡り…田崎史郎氏の見解をバッサリ,https://news.yahoo.co.jp/articles/25a6250bf27cd819a57b435bfbbbd1c44c4bb1fc,10/17(金) 16:10
2025-10-17,20:06,domestic,国内,8,日刊スポーツ,維新・吉村洋文代表「いつかは総理大臣になりたい？」に淀みなく回答,https://news.yahoo.co.jp/articles/c39a479f286538f3195dcb32cf0f308548194b4a,10/17(金) 13:51
2025-10-17,20:06,domestic,国内,9,よろず～ニュース,立憲民主・安住幹事長、ネットに不信感「オールドメディアの方がちゃんとしてる」「都合のいいこと言う人多い」,https://news.yahoo.co.jp/articles/07eeda870d4bbc77e92a5a9c3630a89503a8fd4d,10/17(金) 17:38
2025-10-17,20:06,domestic,国内,10,関西テレビ,自民・維新連立協議　吉村代表「議員定数削減はマスト」に京大・藤井聡教授「自民の“マスト”は経済対策“マスト”の調整・せめぎ合いが鍵」,https://news.yahoo.co.jp/articles/63850b8eafa04528edf39df57ba6187147b7ccea,10/17(金) 18:02
2025-10-17,20:06,domestic,国内,11,デイリースポーツ,【高市自民】ネット騒然「要らない」「廃止して」吉村代表、国会議員大幅削減「比例復活」を標的→イヤなら連立拒否！　カズレーザーが回答引き出した「カズ見事」「賛成！」「いらねー」,https://news.yahoo.co.jp/articles/f12aa94517acdbf5d63b34705fb76946856ad664,10/17(金) 11:10
2025-10-17,20:06,domestic,国内,12,デイリースポーツ,立憲・安住幹事長、吉村代表は「テレビ見てると熱心に聞こえるけど」議員定数削減と政治とカネ「すり替えちゃダメ」,https://news.yahoo.co.jp/articles/2021c23f1d228fe4c9ca42f4f3467796bba26c32,10/17(金) 18:12
2025-10-17,20:06,domestic,国内,13,毎日新聞,自民・維新、議員定数削減で合意へ　自民譲歩で「連立」可能性高まる,https://news.yahoo.co.jp/articles/593681e8f2be28ab34ec0596190e860b4eb483f0,10/17(金) 18:20
2025-10-17,20:06,domestic,国内,14,西日本新聞,自民と維新の急接近、きっかけは重鎮からの電話　「一緒にやれないか。細かい話は今後だ」高市氏との接触要求,https://news.yahoo.co.jp/articles/add661961e74198f5731ec373672576b6d0f143f,10/17(金) 10:22
2025-10-17,20:06,domestic,国内,15,朝日新聞,クマ被害者はプロレス元レフェリー　最近まで現役、がっちりした体格,https://news.yahoo.co.jp/articles/3e6883ddf80fbf42fb5397b64b4ae22ba3d8dd71,10/17(金) 17:00
2025-10-17,20:06,domestic,国内,16,朝日新聞,公明・斉藤代表の選挙区、自民が立候補に意欲　立憲は漁夫の利？,https://news.yahoo.co.jp/articles/624e64a06b00601fff1d7c9ca27ed13c8a3d6135,10/17(金) 18:00
2025-10-17,20:06,domestic,国内,17,スポーツ報知,維新・吉村洋文代表、衆院５０議席減の具体案語る　実現すれば公明、共産、れいわ、参政など厳しい選挙戦に,https://news.yahoo.co.jp/articles/5868b2b6531d42b8a9b0238c13b2cee92727295b,10/17(金) 15:44
2025-10-17,20:06,domestic,国内,18,日刊スポーツ,国民・玉木雄一郎氏「絶対ありません」共闘オファーの立民をバッサリ「身の引き締まる話ですが」,https://news.yahoo.co.jp/articles/f3c8d80ef4c4b2320c38b0a83fa80bc783eb253d,10/17(金) 15:45
2025-10-17,20:06,domestic,国内,19,デイリースポーツ,【高市自民】一体誰が？衝撃の突然維新→超深海でバレずに極秘交渉を続けていた凄い人脈持つ人物　「ひるおび」佐藤千矢子氏が指摘「相当水面下に潜って皆分からず」　突然１４日夜頃に表面化と,https://news.yahoo.co.jp/articles/8d64e8bcbfdd48cea4ccd380d02071bdc9dcbcdd,10/17(金) 11:51
2025-10-17,20:06,domestic,国内,20,J-CASTニュース,「なんてことだ」外国人YouTuberが原発事故被災民家で配信　「立入禁止区域でない」と釈明も、炎上止まず,https://news.yahoo.co.jp/articles/b70dbe043d937f399984e1710aada987c27f5eff,10/17(金) 18:17
2025-10-17,20:06,domestic,国内,21,ねとらぼ,“クマに襲われ遺体で発見“プロレス関係者が死去　「こんな最期はありえない」大仁田厚らが追悼,https://news.yahoo.co.jp/articles/cb1929224886b471a77b481cf94ec812d94272e1,10/17(金) 18:14
2025-10-17,20:06,domestic,国内,22,日刊スポーツ,維新・吉村洋文代表が指摘、自民党と公明党の連立解消の舞台裏「公明党は分かってやってる」,https://news.yahoo.co.jp/articles/4cd103cc6e274caaab5a206a97204b18c4dc9913,10/17(金) 13:34
2025-10-17,20:06,domestic,国内,23,スポニチアネックス,立民・野田代表も「さすがに驚いた」維新と自民の急接近「いきなり政策協議まで入るとは」,https://news.yahoo.co.jp/articles/510233085ee1a2f638743fcc8a42839976485ee9,10/17(金) 17:35
2025-10-17,20:06,domestic,国内,24,デイリースポーツ,【高市自民】「ｎｅｗｓ２３」小川彩佳アナ、国会議員削減訴える吉村代表を止め、追及→企業献金廃止は？「大項目になってない」「直近選挙で示された民意は政治とカネの透明性だと思います」,https://news.yahoo.co.jp/articles/c588c62ceb04b8b7d7710f3db7e2c4f304830017,10/17(金) 0:09
2025-10-17,20:06,domestic,国内,25,日刊スポーツ,国民・玉木雄一郎代表「いずれもありません」本音吐露「自＋国」「自＋国＋維」ダブル否定の真意,https://news.yahoo.co.jp/articles/b8d0b4c5b3733003bf300b6a287e5f453569bfa0,10/17(金) 16:14
2025-10-17,20:06,domestic,国内,26,読売新聞オンライン,「お前のところにクマ送る」発言の佐竹前知事「本当にクマが好きな人はそうしつこくなかった」,https://news.yahoo.co.jp/articles/c7aaed980173582892e1e2be3b7425944765bc68,10/17(金) 16:56
2025-10-17,20:06,domestic,国内,27,スポニチアネックス,国民・榛葉幹事長「悪口を言ったつもりはない」　蓮舫氏巡る玉木代表との「黒歴史」動画で釈明,https://news.yahoo.co.jp/articles/e36295c837d9a22220d16bb6d196bdc2eb6fd00a,10/17(金) 16:46
2025-10-17,20:06,domestic,国内,28,毎日新聞,立憲、公明が党首会談　維新の議員定数削減は「議論のすり替え」,https://news.yahoo.co.jp/articles/9685f13520044d51d5c6f5189b1a4f688a21f0d9,10/17(金) 18:12
2025-10-17,20:06,domestic,国内,29,読売新聞オンライン,ゆうパック「動物」発送禁止に…爬虫類認めていたら不正続出、「ミーアキャットが死んで届いた」例も,https://news.yahoo.co.jp/articles/f4001b117c886573dfcc56c242256716f0723ef9,10/17(金) 15:00
2025-10-17,20:06,domestic,国内,30,日刊スポーツ,維新・吉村洋文代表、田﨑史郎氏をバッサリ「甘い、評論家の域」連立条件の議員定数削減巡り反論,https://news.yahoo.co.jp/articles/8621d5eff06f3034cbdedc5059d82ac3e8d7afec,10/17(金) 19:17
2025-10-17,20:06,domestic,国内,31,J-CASTニュース,「え、維新の一丁目一番地は『議員定数削減』なの？」　吉村代表の「連立条件」に日本保守党幹部が驚き...懸念も指摘,https://news.yahoo.co.jp/articles/931db21053ac85858f693cb1a4fd0872a512f06f,10/17(金) 16:45
2025-10-17,20:06,domestic,国内,32,日刊スポーツ,ひろゆき氏「ゾンビ復活する制度はおかしい」維新主張の連立条件「議員定数の削減」に理解示す,https://news.yahoo.co.jp/articles/31885a878d7d115d96bfa3eaf3d163d977d4cbaa,10/17(金) 19:07
2025-10-17,20:06,domestic,国内,33,日刊スポーツ,国民・玉木雄一郎代表が実名告白「行儀が悪い」と思う議員、ミヤネ屋のルーレット企画で本音吐露,https://news.yahoo.co.jp/articles/d3ca5e8ecf1b13ded09351ce60c4dd83f5067f52,10/17(金) 14:56
2025-10-17,20:06,domestic,国内,34,共同通信,元力士「若麒麟」逮捕　大麻所持疑い、警視庁,https://news.yahoo.co.jp/articles/71d844e0005851b4bbeda5af0390dc6d35875c8c,10/17(金) 12:41
2025-10-17,20:06,domestic,国内,35,読売新聞オンライン,私大合格後の辞退、既に納めた入学金はどうなる？文科省通知受けて返還の動き…「大学も余裕ない」財政への影響大きく戸惑いも,https://news.yahoo.co.jp/articles/82e9007f5ffa27c87f941da5c556c1578b09c1a9,10/17(金) 19:02
2025-10-17,20:06,domestic,国内,36,共同通信,クマ被害男性か、周辺で遺体発見　岩手・北上の旅館で不明,https://news.yahoo.co.jp/articles/47fc9f22f34d9300b4ac79438118d466660b52ff,10/17(金) 10:26
2025-10-17,20:06,domestic,国内,37,FNNプライムオンライン（フジテレビ系）,立憲・公明が党首会談で維新主張の議員定数削減に「臨時国会で短兵急に決める話ではない」　企業・団体献金の規制強化へ法案成立目指す方針で一致,https://news.yahoo.co.jp/articles/54d65d4dc597da510ac87f32ec639866a17e9607,10/17(金) 18:39
2025-10-17,20:06,domestic,国内,38,日刊スポーツ,国民・榛葉賀津也氏、蓮舫氏に「黒歴史」発言の玉木代表との対談陳謝「悪口言ったつもりはない」,https://news.yahoo.co.jp/articles/ccbe73e951476e346e74bc54a436fd6b4965437c,10/17(金) 15:16
2025-10-17,20:06,domestic,国内,39,デイリースポーツ,維新・吉村代表、玉木代表の「二枚舌」発言に「腹は立たない」けど…「僕が玉木さんならチャンスととらえる」,https://news.yahoo.co.jp/articles/18eb973d63ee27c173135e655162f07d2294f0b8,10/16(木) 16:03
2025-10-17,20:06,domestic,国内,40,レスキューナウニュース,阪急神戸本線で人身事故 一部運転見合わせ,https://news.yahoo.co.jp/articles/970aafe2038310adefac84ca49902fa9883d355f,10/17(金) 17:45
