scrp_date,scrp_time,genre_en,genre_jp,rank,media_jp,title,link,date_original
2025-10-17,18:08,TTL,総合,1,よろず～ニュース,「熊に襲われ行方不明だった」マリーゴールド・ロッシー小川代表 笹崎勝巳レフェリー死去を報告,https://news.yahoo.co.jp/articles/2a95969c3147468ea0ee9a3e190fd1c47b641d61,10/17(金) 14:54
2025-10-17,18:08,TTL,総合,2,デイリースポーツ,【高市自民】維新に騙されたと不満爆発の玉木代表→橋本氏あきれ「政治家にあるまじき発言」　交渉力が疑われると　首相候補もグズグズ煮え切らず終了「案外、ホッとしてるかも」,https://news.yahoo.co.jp/articles/2b1e7d6971233ab2632f4a75860d5b33198ea840,10/17(金) 13:36
2025-10-17,18:08,TTL,総合,3,デイリースポーツ,【高市自民】ネット失笑「エッフェル姉さん久々見た」「必死やなｗ」維新と連立協議→維新に全敗中の大阪自民が自民本部乗り込み　ＴＶで流れ、案の定「何言ってるの」「エッフェル松川ｗ」「会長代行なの？」,https://news.yahoo.co.jp/articles/01da15984df7a02ae959ca682034efdccd83b4a6,10/17(金) 15:50
2025-10-17,18:08,TTL,総合,4,Full-Count,佐々木朗希の13球目に困惑「なんなん？」　打者絶望の“物理法則無視”「打てる訳ない」,https://news.yahoo.co.jp/articles/5091c249929d903a649c3af51c36b49cd11227c9,10/17(金) 15:47
2025-10-17,18:08,TTL,総合,5,デイリースポーツ,【高市自民】比例復活不要！吉村爆弾投下に自民重鎮が反撃　吉村代表→衆院５０人削減！イヤなら連立拒否「誰が反対するか国民に見てもらう」→自民重鎮が堂々反対「論外です」,https://news.yahoo.co.jp/articles/bdbf8f4c5daace84eb934bc596fa85075a93879b,10/17(金) 16:47
2025-10-17,18:08,TTL,総合,6,デイリースポーツ,４年前に失踪の元プロ野球選手「気付いたら岐阜の森の中」５０キロ徒歩でさまよい「橋の下で寝ていた」,https://news.yahoo.co.jp/articles/938a84d25016d9199d7b64a8e181f7877d151612,10/17(金) 13:21
2025-10-17,18:08,TTL,総合,7,スポーツ報知,復帰した石原さとみの姿「ビビった」「なんで顔…」「おったまげた」「ほんと」「不思議だ」「驚くわ」,https://news.yahoo.co.jp/articles/9a980fecaa0e275b88715d95cd2093414b4aece0,10/17(金) 10:55
2025-10-17,18:08,TTL,総合,8,弁護士ドットコムニュース,『新しい学校のリーダーズ』公演延期で賛否 「お大事に」「2日間無駄に」ファンは複雑…問われる情報発信,https://news.yahoo.co.jp/articles/50ace096f86ad2fbf7177855428201cc9eae8158,10/17(金) 10:23
2025-10-17,18:08,TTL,総合,9,ねとらぼ,スーパーでティラミスを買ったら……　信じられない中身に「ぎゃー！」「もう完全にアレ」「トイレに行きたくなった!?」,https://news.yahoo.co.jp/articles/3ad92ec06890a4c908816b18e1ad96c44a49f259,10/17(金) 14:30
2025-10-17,18:08,TTL,総合,10,Full-Count,所要時間たった4分…　佐々木朗希を米メディア称賛「えげつない」「扉を閉めた」,https://news.yahoo.co.jp/articles/1cbe8bc02d4192c7ee69e690ce6b8229f6fabb48,10/17(金) 11:58
2025-10-17,18:08,TTL,総合,11,デイリースポーツ,【高市自民】ネット騒然「要らない」「廃止して」吉村代表、国会議員大幅削減「比例復活」を標的→イヤなら連立拒否！　カズレーザーが回答引き出した「カズ見事」「賛成！」「いらねー」,https://news.yahoo.co.jp/articles/f12aa94517acdbf5d63b34705fb76946856ad664,10/17(金) 11:10
2025-10-17,18:08,TTL,総合,12,ねとらぼ,亀田興毅、“30億円”儲けたボクシング界のスターから無一文へ……　引退後に妻は「幼稚園代が払えない」→今は「ちょっと飯食えるようになった」,https://news.yahoo.co.jp/articles/0ac7974ebff4d632f86c96ff176a9746bd160561,10/17(金) 15:50
2025-10-17,18:08,TTL,総合,13,日刊スポーツ,国民・玉木雄一郎氏「絶対ありません」共闘オファーの立民をバッサリ「身の引き締まる話ですが」,https://news.yahoo.co.jp/articles/f3c8d80ef4c4b2320c38b0a83fa80bc783eb253d,10/17(金) 15:45
2025-10-17,18:08,TTL,総合,14,スポニチアネックス,維新・吉村代表「田崎さんは、甘い」　議員定数削減巡り…田崎史郎氏の見解をバッサリ,https://news.yahoo.co.jp/articles/25a6250bf27cd819a57b435bfbbbd1c44c4bb1fc,10/17(金) 16:10
2025-10-17,18:08,TTL,総合,15,毎日新聞,居眠り運転でひき逃げか　女性俳優が死亡、38歳容疑者を逮捕　東京,https://news.yahoo.co.jp/articles/28b9a459ee5932c52492c3998c99c3d9f3a0e506,10/17(金) 16:27
2025-10-17,18:08,TTL,総合,16,中日スポーツ,『ばけばけ』出演者が、次週24日のプレミアムトークに登場「という事は…」ネット涙,https://news.yahoo.co.jp/articles/7f4019b21964b5ec9ad8558d4d7a916f69a2468c,10/17(金) 14:45
2025-10-17,18:08,TTL,総合,17,日刊スポーツ,維新・吉村洋文代表「いつかは総理大臣になりたい？」に淀みなく回答,https://news.yahoo.co.jp/articles/c39a479f286538f3195dcb32cf0f308548194b4a,10/17(金) 13:51
2025-10-17,18:08,TTL,総合,18,バトル・ニュース,元プロレス団体社長が露天風呂でクマに襲われ死亡。近くの雑木林内で遺体を発見,https://news.yahoo.co.jp/articles/4513eec80389dca9b71658195a568b42f0c24c74,10/17(金) 17:00
2025-10-17,18:08,TTL,総合,19,スポニチアネックス,「彼が機能していないチームはジョーダンがいないブルズ」　ベッツが試合後に告白した大谷翔平への信頼！,https://news.yahoo.co.jp/articles/edb58c7896593fdf4ff426a0f232126af23e1aca,10/17(金) 13:21
2025-10-17,18:08,TTL,総合,20,TBS NEWS DIG Powered by JNN,大谷翔平の不振に監督「いずれ抜け出すと思う」敵将も依然として警戒「とてつもなく危険な打者だ、一瞬でスイッチが入る」,https://news.yahoo.co.jp/articles/a8008237a2d5517b10bb2f9457859720bdf2bbaf,10/17(金) 14:11
2025-10-17,18:08,TTL,総合,21,スポーツ報知,渋野日向子「自分でもビックリ」　単独首位でホールアウト、６６のビッグスコア！　５戦連続予選落ちの不振から復活へ好発進,https://news.yahoo.co.jp/articles/5b53d812e51190d0106a8ed0b976b756473144c2,10/17(金) 14:45
2025-10-17,18:08,TTL,総合,22,中央日報日本語版,モデルになるためタイに行ったベラルーシの20代女性、ミャンマーで臓器摘出され遺体焼却,https://news.yahoo.co.jp/articles/3b48fbfa149c8d3408f4d3d314a91ed71967a3e4,10/17(金) 11:53
2025-10-17,18:08,TTL,総合,23,日刊スポーツ,国民・玉木雄一郎代表が実名告白「行儀が悪い」と思う議員、ミヤネ屋のルーレット企画で本音吐露,https://news.yahoo.co.jp/articles/d3ca5e8ecf1b13ded09351ce60c4dd83f5067f52,10/17(金) 14:56
2025-10-17,18:08,TTL,総合,24,西日本新聞,自民と維新の急接近、きっかけは重鎮からの電話　「一緒にやれないか。細かい話は今後だ」高市氏との接触要求,https://news.yahoo.co.jp/articles/add661961e74198f5731ec373672576b6d0f143f,10/17(金) 10:22
2025-10-17,18:08,TTL,総合,25,ベースボールキング,ロッテ、チーム強化を目的で春季キャンプ地変更を発表,https://news.yahoo.co.jp/articles/7149cd3db0b8789aeec68144c753d0ce8bfa0863,10/17(金) 13:12
2025-10-17,18:08,TTL,総合,26,ゴルフ総合サイト ALBA Net,渋野日向子が初の単独首位発進「本当にパットが良かった」　佐久間朱莉ら2位,https://news.yahoo.co.jp/articles/8c6471573215ae0018ef176c0a8d0fdf5d50f060,10/17(金) 15:17
2025-10-17,18:08,TTL,総合,27,ねとらぼ,柴犬をパトカーに乗せると……「マジか」「何したんwww」　窓から見せた“まさかの表情”に35万表示の爆笑,https://news.yahoo.co.jp/articles/91cb8623537d26da09cae568babfa096ac2b108a,10/17(金) 11:00
2025-10-17,18:08,TTL,総合,28,日刊スポーツ,維新・吉村洋文代表が指摘、自民党と公明党の連立解消の舞台裏「公明党は分かってやってる」,https://news.yahoo.co.jp/articles/4cd103cc6e274caaab5a206a97204b18c4dc9913,10/17(金) 13:34
2025-10-17,18:08,TTL,総合,29,高校野球ドットコム,ドラフト1位候補12人はこの選手だ！競合必至・創価大立石を外した球団がカギを握る！,https://news.yahoo.co.jp/articles/a59e6996a5388607e1eeadff423c5ad3fa5df9ad,10/17(金) 17:08
2025-10-17,18:08,TTL,総合,30,読売テレビ,【速報】「車が落ちそう」JR難波駅のバスターミナル・OCATで『ベンツ』地下に続く階段へ突っ込む　運転手は80代男性,https://news.yahoo.co.jp/articles/6bd8414b88af8f7dd961c82f48d4a8abe62e8dde,10/17(金) 11:24
2025-10-17,18:08,TTL,総合,31,MBSニュース,【速報】大阪・梅田のビル地下で男性（58）がナイフで背中と胸を刺される　搬送時意識あり　女（44）を殺人未遂容疑で現行犯逮捕　責任能力の有無を慎重に捜査,https://news.yahoo.co.jp/articles/683d911b42c9c2333b00bfde60e4da52b20e6541,10/17(金) 14:02
2025-10-17,18:08,TTL,総合,32,デイリースポーツ,【高市自民】一体誰が？衝撃の突然維新→超深海でバレずに極秘交渉を続けていた凄い人脈持つ人物　「ひるおび」佐藤千矢子氏が指摘「相当水面下に潜って皆分からず」　突然１４日夜頃に表面化と,https://news.yahoo.co.jp/articles/8d64e8bcbfdd48cea4ccd380d02071bdc9dcbcdd,10/17(金) 11:51
2025-10-17,18:08,TTL,総合,33,LASISA,どういう意味？「玉木る」がSNSで急拡散！国民民主・玉木代表の“迷走（？）”を揶揄する新語誕生の背景,https://news.yahoo.co.jp/articles/9dee6d7a349c3e083c0293172b956584c148b744,10/17(金) 13:47
2025-10-17,18:08,TTL,総合,34,共同通信,維新、立国との協議打ち切りを伝達,https://news.yahoo.co.jp/articles/7d3f1abf22aacfa86600c74ed4bf9194f0864ce0,10/17(金) 16:37
2025-10-17,18:08,TTL,総合,35,TBS NEWS DIG Powered by JNN,【維新・吉村代表に生直撃】「高市総裁から『閣内に入ってもらいたい』と」自民×維新“急接近”　過去に都構想めぐり対立も…自民と連立で維新は大丈夫?【news23】,https://news.yahoo.co.jp/articles/b63bc7850f78bdeaf8cbe22cab6353b9e95fc31c,10/17(金) 14:40
2025-10-17,18:08,TTL,総合,36,IAT岩手朝日テレビ,【速報】北上市・温泉施設で行方不明の男性の遺体発見か　クマは射殺【岩手】,https://news.yahoo.co.jp/articles/b19ea8bdeab1a61fcd7c2f841780b18246bb84b4,10/17(金) 10:38
2025-10-17,18:08,TTL,総合,37,デイリースポーツ,巨人戦力外の２９歳がファンに報告「本当に幸せでした」「また良い報告ができるよう頑張ります！」,https://news.yahoo.co.jp/articles/3c6ccf940726cc372eca7a7b86a1f2cce67a6367,10/17(金) 16:32
2025-10-17,18:08,TTL,総合,38,スポーツ報知,維新・吉村洋文代表、衆院５０議席減の具体案語る　実現すれば公明、共産、れいわ、参政など厳しい選挙戦に,https://news.yahoo.co.jp/articles/5868b2b6531d42b8a9b0238c13b2cee92727295b,10/17(金) 15:44
2025-10-17,18:08,TTL,総合,39,スポーツ報知,経済キャスターになった元局アナ「合格率４０％以上」の資格試験に「落ちました」「トホホ」「あー悔しい」須黒清華アナ落胆,https://news.yahoo.co.jp/articles/c8840f5ecdd39a2c960f4aa36d8721f616d1fae3,10/17(金) 13:20
2025-10-17,18:08,TTL,総合,40,京都新聞,ファストフード店で高校生が備品を鼻の中に…悪ふざけの映像にSNSで批判　高校がHPで謝罪,https://news.yahoo.co.jp/articles/a909b2271d633c739ee172cc0be3f90af1eb8314,10/17(金) 12:06
