scrp_date,scrp_time,genre_en,genre_jp,rank,media_jp,title,link,date_original
2024-06-30,07:06,TTL,総合,1,テレビ朝日系（ANN）,【独自】未解決のまま2年…八田與一容疑者の“親友”が証言,https://news.yahoo.co.jp/articles/14b100cd26b9bdfb3ed04696a2f0c0cc8967db08,6/30(日) 0:22
2024-06-30,07:06,TTL,総合,2,デイリースポーツ,たけうちほのか　芸人恋人の正体を明かし、ゆうちゃみパニック「えーっ！」有吉弘行「みんな知ってる人なんだ」,https://news.yahoo.co.jp/articles/812295e91809229c856e1fe93bd86491615bdf70,6/29(土) 22:28
2024-06-30,07:06,TTL,総合,3,TBS NEWS DIG Powered by JNN,バレー男子日本代表、52年ぶり決勝進出！スロベニアに3-0勝利で銀メダル以上確定　金懸けフランスと対戦へ【ネーションズリーグ】,https://news.yahoo.co.jp/articles/0a347617769e39f06bf15976566297cd4baabafa,6/30(日) 4:58
2024-06-30,07:06,TTL,総合,4,スポニチアネックス,【バレー　準決勝詳報】日本　最後まで大熱戦も3－0でスロベニア撃破　国際大会52年ぶり決勝進出！,https://news.yahoo.co.jp/articles/10cf1338fc2091522dc5b4918b04a171e8dfbc1f,6/30(日) 3:42
2024-06-30,07:06,TTL,総合,5,東スポWEB,「おまえ関係ねぇだろ！」ナイツ塙の胸ぐら掴んだオリラジ中田　後日謝罪し漫才協会に加入,https://news.yahoo.co.jp/articles/73e7a6ed260b9c9b0cf942aa0b732368cc1892e5,6/29(土) 22:56
2024-06-30,07:06,TTL,総合,6,ねとらぼ,「ショムニ」、放送開始から26年　当時出演したキャストの現在　芸能界引退した俳優も,https://news.yahoo.co.jp/articles/52e154a742efb9d1eae678583a427364a774042e,6/29(土) 8:05
2024-06-30,07:06,TTL,総合,7,ENCOUNT,交際発覚で引退した元人気グラドル、“泥沼裁判”→費用払うために銀座でホステス　現在は年商6000万円実業家に,https://news.yahoo.co.jp/articles/6b5378540daffce8a085837f083b861fa68a5da6,6/29(土) 16:10
2024-06-30,07:06,TTL,総合,8,ABEMA TIMES,最高月収180万円も週刊誌報道でCM打ち切り…5年続いた「月収4万円生活」 テレビから消えた一発屋ジョイマン、現在の月収を初告白,https://news.yahoo.co.jp/articles/d1b110e52b8441e564aedf62643dd6f29ff7ddf5,6/29(土) 11:32
2024-06-30,07:06,TTL,総合,9,西スポWEB OTTO！,「年齢非公表」人気アイドルが実年齢を突然〝暴露〟驚きの真実にネット波紋「逆に推せる！」「年下だと思ってた…」,https://news.yahoo.co.jp/articles/064d224229d32daaddc456c1f2c5e29d5a2cb29a,6/29(土) 23:40
2024-06-30,07:06,TTL,総合,10,スポニチアネックス,Snow　Man目黒蓮　今カノと元カノに挟まれ「不思議な感じ」共演者も「もうたぶん現場で会わない」,https://news.yahoo.co.jp/articles/9fa124690a5a872f5e455e4c3ce2e994036d8ea7,6/29(土) 20:01
2024-06-30,07:06,TTL,総合,11,ほ・とせなNEWS,昼寝中の1歳孫　祖母がこっそり見に行くと…予想外の姿に衝撃！「何回も見ちゃいます」「かわいい」,https://news.yahoo.co.jp/articles/dbb51425fee725a277b8ffb55f13d09f7610099e,6/29(土) 15:00
2024-06-30,07:06,TTL,総合,12,スポーツ報知,大谷翔平、２戦ぶり２６号で初の「スプラッシュヒット」なるか　ジャイアンツ戦「１番ＤＨ」スタメン,https://news.yahoo.co.jp/articles/7033280eb9da6748594b07fe2eefe4df306e53b7,6/30(日) 5:00
2024-06-30,07:06,TTL,総合,13,ほ・とせなNEWS,生後8ヶ月で亡くなった息子　約3年半後、当時の妻の日記に書いてあった本音とは,https://news.yahoo.co.jp/articles/469214512a3d278a828c04b1a4da9ec894d94919,6/29(土) 12:30
2024-06-30,07:06,TTL,総合,14,東スポWEB,男闘呼組・前田耕陽　海原ともこと結婚した理由明かす「人生で出会ったことのない人種だった」,https://news.yahoo.co.jp/articles/24e143895e51e8ccce13abee2e28f2d1b1b39b0d,6/29(土) 11:11
2024-06-30,07:06,TTL,総合,15,ゴルフダイジェスト・オンライン（GDO）,「わたし、まだいけるかな」　李知姫が20年来の相棒に届けたい吉報,https://news.yahoo.co.jp/articles/c12869e6ba9b0d2f7da27a8e3ec70fa789ccc0c3,6/29(土) 18:03
2024-06-30,07:06,TTL,総合,16,ファイナンシャルフィールド,「地方公務員」1年目ですが、6月の賞与が「12万円」でした。毎月赤字なので「ボーナス」をあてにしていたのですが、民間企業のほうが多くもらえますか…？,https://news.yahoo.co.jp/articles/74c4a9d264ba9367de56dadc0ea27c1d2246d2d6,6/29(土) 11:20
2024-06-30,07:06,TTL,総合,17,ファイナンシャルフィールド,近所に1400円で時間無制限の「食べ放題」のお店ができました。毎日食べに行った場合、食費の節約になるでしょうか？,https://news.yahoo.co.jp/articles/d3046f90bab49cac951f488f82901d7a66de68f0,6/28(金) 19:10
2024-06-30,07:06,TTL,総合,18,withnews,ビニール傘、絶対に盗ませない　「究極の盗難防止」がXで話題　「これは持っていかないわ笑」,https://news.yahoo.co.jp/articles/94d179ed361b0413b520f319469ff9f04ab0bb67,6/28(金) 7:00
2024-06-30,07:06,TTL,総合,19,J-CASTニュース,女子ゴルフのイ・ボミ　「目のやり場に困っちゃう」キャミソールスタイルで来日...「おかえり～」歓迎の声,https://news.yahoo.co.jp/articles/5c44dba2cdc28a54033e0d877ae27cdde512496a,6/29(土) 20:00
2024-06-30,07:06,TTL,総合,20,スポニチアネックス,渋野日向子　日米4度目ホールインワンに「震えました」　勝とのコンビ「めちゃくちゃ楽しい、やばい！」,https://news.yahoo.co.jp/articles/6bf79c8e06304c64c15a2c0af0cf12837b8e04e1,6/30(日) 4:00
2024-06-30,07:06,TTL,総合,21,スポニチアネックス,オリックス　吉田輝星が「1球勝利」球団15年ぶり2人目　668日ぶりの白星となるプロ4勝目,https://news.yahoo.co.jp/articles/052d039255eedcf8afa60a1e0311228efb9284f8,6/29(土) 21:59
2024-06-30,07:06,TTL,総合,22,J-CASTニュース,「かつみさゆり」さゆり＆男子バレー選手の2ショ　身長差30cmなのに「さゆりちゃん！足、長過ぎ！」,https://news.yahoo.co.jp/articles/1134f9c323c22bc2dfed0d58cbcb53503cbe3360,6/29(土) 18:00
2024-06-30,07:06,TTL,総合,23,ねとらぼ,老後の趣味で気軽に“塗り絵”を始めて1年後……　めきめき上達した70代女性の美麗な水彩画に「本当にすごい…」「感動です」,https://news.yahoo.co.jp/articles/627f5dfaa331b795d3ce97098dbc6e2d6d20be36,6/29(土) 22:00
2024-06-30,07:06,TTL,総合,24,東スポWEB,佐々木麟太郎　ドラフトリーグ３発も米メディア酷評「行動がスローモーション」「プロには程遠い」,https://news.yahoo.co.jp/articles/059af6d93a62059cd2eb760b40d99a024374603a,6/29(土) 18:26
2024-06-30,07:06,TTL,総合,25,motorsport.com 日本版,角田裕毅が”暴言”を発した疑いが浮上。FIAが調査へ……ファンによるSNSへの投稿がきっかけに,https://news.yahoo.co.jp/articles/dcb0549ec17a1cc2974ed4fea5d47ba07847fa1d,6/30(日) 3:36
2024-06-30,07:06,TTL,総合,26,東スポWEB,さんま　泥酔・和田アキ子＆〝大物先輩芸人〟の電話にゲンナリ「俺の身にもなれ…」,https://news.yahoo.co.jp/articles/6ea3d611bc0fbd7b18754b13bce7b81d864a682a,6/29(土) 22:51
2024-06-30,07:06,TTL,総合,27,ねとらぼ,レジンで生のイチゴを閉じ込め→4年放置したら……？　“まさかの姿”に「100万年後に発見されて欲しい」,https://news.yahoo.co.jp/articles/f257724bf0092758bdec6db9e95d92da7346bfe9,6/29(土) 20:15
2024-06-30,07:06,TTL,総合,28,RONSPO,「ポルシェはもらっていない。噂に過ぎない」大谷翔平の”生命危機”を救った38歳のバットボーイが異例の緊急会見…大谷はSNSで「マイヒーロー!!」と感謝,https://news.yahoo.co.jp/articles/7e953672fed8bb272671e0aa368117e36761ad0d,6/30(日) 5:58
2024-06-30,07:06,TTL,総合,29,デイリースポーツ,東大医学部卒の頭脳王・河野玄斗に辛坊治郎「アホちゃう？」資格多数保持もＴＶコメンテーターにあきれ顔,https://news.yahoo.co.jp/articles/f8d343673dd44816538d30acb01a4eb3e4840a30,6/29(土) 17:37
2024-06-30,07:06,TTL,総合,30,東スポWEB,さんま　陣内智則の〝永野にマジギレ事件〟顛末語り爆笑「いろいろ世間から言われてんけど…」,https://news.yahoo.co.jp/articles/5b4e151377ac1c7220cf9b89a59c6bfafd86343c,6/30(日) 0:01
2024-06-30,07:06,TTL,総合,31,スポニチアネックス,鹿島MF佐野海舟　ドイツ1部マインツへの完全移籍が決定的　移籍金はJから海外では史上最高クラス,https://news.yahoo.co.jp/articles/12271ce0fab32dbbd8b9a13f7e9f36193ea13830,6/30(日) 3:00
2024-06-30,07:06,TTL,総合,32,スポニチアネックス,槙野智章「ケイスケ君から…」超豪華メンバーでサッカー　「メンツえぐいて」「最高」とファン驚愕,https://news.yahoo.co.jp/articles/8311fd16dda3cced56f8c92ff9d97a29c8b5a539,6/29(土) 22:38
2024-06-30,07:06,TTL,総合,33,スポニチアネックス,ジャパンXV逆転負けにエディーHC「怒りも感じている」　大学生も積極起用、「矢崎は成長著しい」,https://news.yahoo.co.jp/articles/3a07c90a4cd252f59754f7045123306b7ec2f28b,6/29(土) 21:52
2024-06-30,07:06,TTL,総合,34,ABEMA TIMES,大谷翔平を苦しめた第1打席の疑惑判定 じつは「1球も入っていなかった」データが示した衝撃事実,https://news.yahoo.co.jp/articles/74e4432e5afbf18e36a1fff687ee339e5f24a483,6/30(日) 5:57
2024-06-30,07:06,TTL,総合,35,All About,「低所得者なのにディズニーに行こうとするなんて…」いつから夢の国は「格差社会の象徴」になったのか,https://news.yahoo.co.jp/articles/7a7e7e8bb2c811faf20403988228b3499d5e21c0,6/28(金) 21:05
2024-06-30,07:06,TTL,総合,36,MANTANWEB,＜ブラック・ジャック＞24年ぶりのテレビドラマ今夜放送　第1話「医者はどこだ！」を軸にさまざまな原作エピソードで構成,https://news.yahoo.co.jp/articles/39a63eba8c71ae01cea79f2f4806c8374c57c14e,6/30(日) 6:05
2024-06-30,07:06,TTL,総合,37,オートスポーツweb,角田裕毅に4万ユーロの罰金。F1オーストリアGP予選中の暴言で国際スポーツ競技規則に違反,https://news.yahoo.co.jp/articles/3e17d5ccebc4bc4d737f0346ea19c3af8c8d8df9,6/30(日) 5:39
2024-06-30,07:06,TTL,総合,38,バレーボールマガジン,バレー男子日本がスロベニアに競り勝ち大会初決勝進出　銀メダル以上が確定　石川祐希　西田有志が躍動　山本「小川の首にもメダルをかけてあげたい」　ネーションズリーグ,https://news.yahoo.co.jp/articles/2736daa031b616514f2bc2395f682d69134060bb,6/30(日) 5:03
2024-06-30,07:06,TTL,総合,39,Hint-Pot,アメリカ人「パンの具材にしてしまうなんてすごい」　日本人のアイデアを称賛　独自の進化を遂げた食べ物とは,https://news.yahoo.co.jp/articles/954a693d3a72289dd6b9f5dc6652dd8213371beb,6/30(日) 6:10
2024-06-30,07:06,TTL,総合,40,スポニチアネックス,乃木坂46人気メンバー、母親の年齢明かしスタジオ騒然！りんたろー。驚き「俺とタメじゃん」,https://news.yahoo.co.jp/articles/5c7635e33b40a7bba8f11125e41d2bb727f52fa1,6/29(土) 20:18
