scrp_date,scrp_time,genre_en,genre_jp,rank,media_jp,title,link,date_original
2024-06-30,04:05,domestic,国内,1,テレビ朝日系（ANN）,【独自】未解決のまま2年…八田與一容疑者の“親友”が証言,https://news.yahoo.co.jp/articles/14b100cd26b9bdfb3ed04696a2f0c0cc8967db08,6/30(日) 0:22
2024-06-30,04:05,domestic,国内,2,みんかぶマガジン,超攻撃的スタイル蓮舫「とうとう3位墜落の危機」迫る石丸…右から左までバラマキ合戦の大炎上都知事選,https://news.yahoo.co.jp/articles/0466860327bddd6b447f938be78b158e99d0f676,6/29(土) 9:10
2024-06-30,04:05,domestic,国内,3,共同通信,マンションで男女死亡　腹部に刺し傷、無理心中か,https://news.yahoo.co.jp/articles/9f2a64736c08b43a0c236c4b61760ed7ed965d9d,6/29(土) 21:42
2024-06-30,04:05,domestic,国内,4,読売テレビ,【いまだ逃走中】『おい、八田！必ず捕まえてやる』大学生を死亡させた重要指名手配犯・八田與一容疑者、事故のシミュレーションから見えた“意思”『これは、凶器を車に変えただけの殺人事件』,https://news.yahoo.co.jp/articles/49be1fd3b6de5e02430040c7ef7e0c970571086f,6/29(土) 6:00
2024-06-30,04:05,domestic,国内,5,デイリースポーツ,橋下徹氏　大阪万博「不満の人はチケット全額払い戻し！倍返し！」吉村知事に迫る「言い切らないと」開幕日間違えるミスも,https://news.yahoo.co.jp/articles/a6951003821251d9f20fff6cbf558a89a0977b50,6/29(土) 19:09
2024-06-30,04:05,domestic,国内,6,47NEWS,中国の鉄道車両メーカー、スパイ懸念や納入遅れで破談相次ぐ　日本に競り勝ったインドネシア高速鉄道は〝金食い虫〟に『鉄道なにコレ！？』【第６４回】　,https://news.yahoo.co.jp/articles/384e36745f5bf76260569562958b2841f009285f,6/27(木) 10:02
2024-06-30,04:05,domestic,国内,7,中日スポーツ,ひろゆきさん、「何を言ってるのだろう」千葉県知事に絡むも…「もう少し調べてから発言して」と火だるまに,https://news.yahoo.co.jp/articles/e1e2eb0af191a97cf1a8f53d79b825d6b15cb6fd,6/29(土) 20:49
2024-06-30,04:05,domestic,国内,8,日刊スポーツ,拍手や声援、ヤジで騒然…小池知事が都知事選初の東京23区内街頭演説　北千住駅前に1200人,https://news.yahoo.co.jp/articles/22ba5806d7736d112dea1344da7f630ca3b4cde9,6/29(土) 21:00
2024-06-30,04:05,domestic,国内,9,東海テレビ,遮断機下りた踏切に入ってくる…18歳の女性が電車にはねられる その場で死亡確認 一時運転見合わせ,https://news.yahoo.co.jp/articles/d500efd6035d7289e7e942c42f5711f353e35d4f,6/29(土) 16:40
2024-06-30,04:05,domestic,国内,10,テレビ朝日系（ANN）,【賛否】人気ラーメン店「イヤホンやめて」SNS投稿　片手でゲーム…回転率はダウン,https://news.yahoo.co.jp/articles/b2ea8a39d6ec321cef71e6467f3a9c6de35ba5cd,6/29(土) 11:46
2024-06-30,04:05,domestic,国内,11,読売新聞オンライン,水俣病懇談会でマイク切った環境省室長、厚生労働省へ出向…環境省「定期的な異動の一環」,https://news.yahoo.co.jp/articles/1f4c52ea4160a94f81a7d5e6d1721b31fe6e9a74,6/30(日) 1:26
2024-06-30,04:05,domestic,国内,12,朝日新聞デジタル,小学校2校で教諭のミスでプールの水が流出　学校長、損失負担の意向,https://news.yahoo.co.jp/articles/fa4c80cc6051a97eac1dc37f15891ff2e0cbddb9,6/29(土) 10:45
2024-06-30,04:05,domestic,国内,13,FNNプライムオンライン,維新「説明会」で“口撃”　執行部批判に馬場代表は「あなたは選挙を知らない」と応戦　幹部が語る“自維交渉”の裏側,https://news.yahoo.co.jp/articles/1b7a39c871f7cb622fb323378bcdf106ac9eb83e,6/29(土) 16:02
2024-06-30,04:05,domestic,国内,14,ABEMA TIMES,逃亡2年…“整形経験あり”の八田容疑者 証言からまとめた人物特徴「耳が特徴的」「笑うとアゴが割れている」 別府ひき逃げ事件,https://news.yahoo.co.jp/articles/3c10ecb952619985160b6e3afd6b16bfbceccad6,6/28(金) 6:50
2024-06-30,04:05,domestic,国内,15,FNNプライムオンライン,【独自】逃走中の八田與一容疑者がかつて交際相手に宛てた手紙に「思いやりなど大切に」　遺族の声は届くか　大分・別府ひき逃げ事件,https://news.yahoo.co.jp/articles/34a5feb7487d1c938d46b4a0c0d37d09562e5573,6/28(金) 20:22
2024-06-30,04:05,domestic,国内,16,スポニチアネックス,小池百合子都知事　23区で初の街頭演説に聴衆約1200人　「都政をもっとよく」,https://news.yahoo.co.jp/articles/4cb151c8c269a4cf62157d8bb9d2cdbaa62015b2,6/29(土) 20:05
2024-06-30,04:05,domestic,国内,17,読売新聞オンライン,パチンコ店で不明になった横山ゆかりちゃん、業界からの情報謝礼金１００万円引上げ…懸賞金は計７００万円に,https://news.yahoo.co.jp/articles/6a206bdac0e10840fbe003fe0732908bb2b7793e,6/29(土) 23:31
2024-06-30,04:05,domestic,国内,18,TBS NEWS DIG Powered by JNN,大阪万博の会場で“メタンガス爆発”　会場の安全性は?万博協会は「信じて来て、楽しんで」【報道特集】,https://news.yahoo.co.jp/articles/24139be33d3cddf3a1271e328fe0dde4680a97a5,6/29(土) 21:08
2024-06-30,04:05,domestic,国内,19,FNNプライムオンライン,宝島さん夫婦の長女・真奈美容疑者　事件後社長に就任…逮捕2日前に漏らしていた店経営の大変さ「なんか店やりたくない」,https://news.yahoo.co.jp/articles/4bd2cbea5eec9a58bfa3aaae00685aad11942ecf,6/28(金) 13:43
2024-06-30,04:05,domestic,国内,20,日テレNEWS NNN,【密着】履歴書・面接なしで働ける「スキマバイト」　幅広い年代で利用…気軽にさまざまな仕事の経験も,https://news.yahoo.co.jp/articles/34eeab96221a0c947c42346da849f506c5f35c71,6/29(土) 15:02
2024-06-30,04:05,domestic,国内,21,日テレNEWS NNN,【東京都知事選】4候補　30日の街頭演説などのスケジュール（29日午後11時判明分）,https://news.yahoo.co.jp/articles/5344b6f9796291f3b806344e18523fb19fac7b5c,6/29(土) 23:53
2024-06-30,04:05,domestic,国内,22,読売新聞オンライン,天皇、皇后両陛下が東京・羽田空港に到着…英国の公式訪問から帰国,https://news.yahoo.co.jp/articles/5f0b7fa81fb41b6ea05d8ec41394540e3fab2ca4,6/29(土) 18:01
2024-06-30,04:05,domestic,国内,23,FNNプライムオンライン,女性で初めて暴力団員と認定…刑務所生活終えた人等に手を差し伸べる「元・ヤクザの女」消せない過去と充実する今,https://news.yahoo.co.jp/articles/1d519ebde5f4fca03acea3743e96a93e0341d110,6/29(土) 20:02
2024-06-30,04:05,domestic,国内,24,tenki.jp,梅雨の後半と梅雨明け予想　日本海側を中心に警報級の大雨　梅雨明けは平年並みか,https://news.yahoo.co.jp/articles/1b1948093facd019cddbbd29a15b2cb8901bc98f,6/29(土) 17:54
2024-06-30,04:05,domestic,国内,25,ウェザーマップ,7月スタートは警報級大雨のおそれ　来週は日本海側に梅雨前線が停滞　度々大雨の可能性も,https://news.yahoo.co.jp/articles/ce3e02a2c7e4a90f588feb9a2658cb58d2701793,6/29(土) 15:20
2024-06-30,04:05,domestic,国内,26,ねとらぼ,皇后陛下、「淡いピンクの装い」に注目集まる　「天皇陛下のネクタイ」に合わせたコーディネートか,https://news.yahoo.co.jp/articles/1b9e0f8c5a79852e5d198394682ef642f792992a,6/28(金) 13:52
2024-06-30,04:05,domestic,国内,27,みんかぶマガジン,蓮舫「2位もダメで3位転落の危機」都知事選…石丸猛追「国政の代理戦争など馬鹿げたマネは是非やめてもらいたい」,https://news.yahoo.co.jp/articles/a42522e116b85b51f2411d31db6d33b43a0e7af9,6/26(水) 9:10
2024-06-30,04:05,domestic,国内,28,デイリースポーツ,ひろゆき氏　東大数学科卒の経済学者に「算数も出来なくなってるんですか？」円安で工場日本回帰を否定「嘘は証明済み」,https://news.yahoo.co.jp/articles/6cd0493df3875c0f5f90bcf9389ef02c6ac6970a,6/28(金) 17:56
2024-06-30,04:05,domestic,国内,29,夕刊フジ,石丸伸二氏の人気〝ホンモノ〟か　都知事選で台風の目「政策にブレがない」集まる聴衆　ネットで「動員」と指摘も…陣営を直撃！,https://news.yahoo.co.jp/articles/ad32f8d502659a0c991e4af1e655ad1179684433,6/26(水) 17:00
2024-06-30,04:05,domestic,国内,30,朝日新聞デジタル,石丸伸二氏が去った安芸高田市　30日告示の市長選に4人が立候補へ,https://news.yahoo.co.jp/articles/980aa6ff9ca5ac40bacdf2bb450214cbbb66c91f,6/29(土) 8:30
2024-06-30,04:05,domestic,国内,31,共同通信,高校生男女飛び降り死傷　岡山県立高の校舎から,https://news.yahoo.co.jp/articles/7195a575503201957d6b7278fcd2be6822a44948,6/26(水) 19:48
2024-06-30,04:05,domestic,国内,32,テレビ朝日系（ANN）,環境省の水俣病担当の幹部が6月末で異動　“マイクオフ問題”受け　事実上の更迭,https://news.yahoo.co.jp/articles/80ee83f7a173277090342d6e7e268980cd9e622b,6/30(日) 0:00
2024-06-30,04:05,domestic,国内,33,読売新聞オンライン,粗大ごみから出た現金を職場懇親会に流用、黙認した処理施設係長を懲戒処分,https://news.yahoo.co.jp/articles/fa8c356392930d2a3dbaed5b5195cba582d44454,6/29(土) 15:48
2024-06-30,04:05,domestic,国内,34,夕刊フジ,岸田首相在職１０００日　関係に亀裂、麻生氏には「わび」…続投意欲も〝空回り〟に拍車、鈍感地方行脚　総裁選へ動き本格化　,https://news.yahoo.co.jp/articles/aea7e770b2d05fb23c9c512a24d77f8471d480e1,6/29(土) 17:00
2024-06-30,04:05,domestic,国内,35,ABEMA TIMES,いまだ逃亡中…八田容疑者の逃亡生活について元刑事が分析「変装、偽名、第三者に助けてもらっている可能性」,https://news.yahoo.co.jp/articles/02ffb81801cf636b597bb0cf8cfe0a4fd867b7db,6/27(木) 6:50
2024-06-30,04:05,domestic,国内,36,tenki.jp,2週間天気　来週前半は日本海側を中心に警報級の大雨　梅雨明けはいつ?,https://news.yahoo.co.jp/articles/40616c0429b6508ffb8802a74ac8e1d940b3a51d,6/29(土) 6:16
2024-06-30,04:05,domestic,国内,37,FNNプライムオンライン,【続報】佐久間清来容疑者が昼寝中の男の子を足で踏みつけ顔付近をたたく様子も　園児に暴行を加えた疑いで逮捕　東京・世田谷区,https://news.yahoo.co.jp/articles/b4d31d44dd910b6476a7776fbd5f312923a5dc7d,6/26(水) 12:25
2024-06-30,04:05,domestic,国内,38,朝日新聞デジタル,両陛下が英国から帰国　「温かい気持ちうれしく」　留学先再訪も,https://news.yahoo.co.jp/articles/4b358dfa452b944cefdba1ba7527b4ef560480a2,6/29(土) 20:47
2024-06-30,04:05,domestic,国内,39,共同通信,父親の顔など数十発殴った疑い、巡査長逮捕,https://news.yahoo.co.jp/articles/3523d15f29296f9351619d669caabd36770b4c1d,6/29(土) 20:05
2024-06-30,04:05,domestic,国内,40,毎日新聞,劇症型溶連菌感染症、手足の壊死や多臓器不全も　患者が過去最多,https://news.yahoo.co.jp/articles/45108d90af0a9eb509f4944f9fca0d6b41987e66,6/29(土) 9:00
