scrp_date,scrp_time,genre_en,genre_jp,rank,media_jp,title,link,date_original
2024-06-01,07:16,domestic,国内,1,夕刊フジ,フルネームである「斉藤蓮舫」で活動を　小池百合子氏「学歴疑惑」を指摘、ブーメランの女王・蓮舫氏の「二重国籍」問題を振り返る,https://news.yahoo.co.jp/articles/3ad2e1e2ce3a0efdd2055e510a0c248c46bbfc96,5/31(金) 17:00
2024-06-01,07:16,domestic,国内,2,J-CASTニュース,粗暴客に店主憤慨「許しません」　笑いながら沖縄そばを器ごとブチまける...謝罪受け入れず被害届提出へ,https://news.yahoo.co.jp/articles/dfb10dc28b9a18731fcf49eca9a41eea48b5b9f1,5/31(金) 20:22
2024-06-01,07:16,domestic,国内,3,TBS NEWS DIG Powered by JNN,高知県で最大震度4のやや強い地震　高知県・宿毛市,https://news.yahoo.co.jp/articles/aef119916e686f130f778861d4675e0b8bf8041f,6/1(土) 4:06
2024-06-01,07:16,domestic,国内,4,読売新聞オンライン,崩れた冷凍ケーキ、販売会社側の「予冷不足」…地裁支部が運送会社への賠償請求退ける,https://news.yahoo.co.jp/articles/0a6376fb979d17d94a54485dbe44424912326c05,5/31(金) 9:19
2024-06-01,07:16,domestic,国内,5,東海テレビ,業者の杜撰さ明らかに…名古屋市立小学校の部活動民間委託「来るはずの指導者が来ない」保護者等から苦情殺到,https://news.yahoo.co.jp/articles/51749424bd57f9cddabd70e20d97cbed9bcf57df,5/31(金) 21:01
2024-06-01,07:16,domestic,国内,6,ABEMA TIMES,藤井聡太叡王、完勝でのシリーズ逆王手に“ホッ”？ファンを前にジョーク披露「次局は持将棋がなければ最終局に…」視聴者は爆笑「やめとけw」,https://news.yahoo.co.jp/articles/8f9822c1bd480dd9df8835a75fc86b3168a086ff,5/31(金) 20:06
2024-06-01,07:16,domestic,国内,7,日刊スポーツ,【ひふみんEYE】後手なのに主導権奪った藤井叡王の指し回し光る　伊藤七段は意味のない手で敗着,https://news.yahoo.co.jp/articles/b5d98bea621ddb0df206033bd579c643ddcf85c4,5/31(金) 20:15
2024-06-01,07:16,domestic,国内,8,テレビ朝日系（ANN）,パー券公開「5万円超」公明・維新に譲歩…なぜ？“規正法”トップ会談で急転決着,https://news.yahoo.co.jp/articles/011098c46be5201429c761f3a8e9ea409472dc8d,6/1(土) 1:22
2024-06-01,07:16,domestic,国内,9,読売テレビ,【なぜ？】都心で幹線道路寸断、18年経っても開通せず 既に立ち退いた家や、新しく建ったスーパーなども…道を塞ぐのは由緒ある寺の“200基の墓”「全ての墓と本堂を合わせて一つの寺だと考えている」,https://news.yahoo.co.jp/articles/fdffed106d4c8160ac5fb33d0abbcb987d7a637e,5/31(金) 19:00
2024-06-01,07:16,domestic,国内,10,スポーツ報知,田崎史郎氏、「モーニングショー」で小池百合子都知事が「出馬表明」しない背景を解説「今だと蓮舫さんのペースにはまってしまうと思われた」,https://news.yahoo.co.jp/articles/5f4d114aab6e2a28083458f7d8bb74bc5e25caff,5/30(木) 9:41
2024-06-01,07:16,domestic,国内,11,日テレNEWS NNN,四国地方で震度4の地震,https://news.yahoo.co.jp/articles/77b19189803e34ff56b73313919b28c1872537d7,6/1(土) 4:03
2024-06-01,07:16,domestic,国内,12,読売新聞オンライン,埼玉・飯能市の林道脇の車内に６０代くらいの男性と男児の遺体、２人の体には血が,https://news.yahoo.co.jp/articles/eee623f6d726447865a4370465b9143d907ec6ee,6/1(土) 0:39
2024-06-01,07:16,domestic,国内,13,東海テレビ,歩いて道を渡っていた12歳中学生が車にはねられ一時意識不明となる大ケガ 運転手の59歳男を現行犯逮捕,https://news.yahoo.co.jp/articles/76bbbc8dc27f913136e71379991ecd8dfd0447eb,6/1(土) 6:00
2024-06-01,07:16,domestic,国内,14,読売テレビ,【速報】逮捕された男のHIV感染　警察署から拘置所に引き継がれずエイズ発症　大阪府警に是正を要望　大阪弁護士会,https://news.yahoo.co.jp/articles/79f83a8e239e43767a42c9455a6b170490ae892b,5/29(水) 10:00
2024-06-01,07:16,domestic,国内,15,読売新聞オンライン,「Ｋアリーナ」と横浜駅をつなぐ歩道橋、利用開始前日に延期発表…設計ミスでのひび割れ発見,https://news.yahoo.co.jp/articles/101c3b1fb1a43d8922ab4cd97b3685daf5739729,6/1(土) 0:50
2024-06-01,07:16,domestic,国内,16,J-CASTニュース,バス運転手の夏休みを1日1万円で買い取り　横浜市が人手不足で苦肉の策、違法性は否定,https://news.yahoo.co.jp/articles/0a2e7286828a1b58b40ab5be65b60b35166b6b63,5/31(金) 14:55
2024-06-01,07:16,domestic,国内,17,47NEWS,唯一無二のスカイレール、２６年目で惜しくも廃止,https://news.yahoo.co.jp/articles/88109c75c8cca0052a94d6e658086f3832c3bd30,5/31(金) 11:02
2024-06-01,07:16,domestic,国内,18,毎日新聞,いすゞ子会社、「デコトラ」を車検時のみ装飾外す不正　九州運輸局,https://news.yahoo.co.jp/articles/ab8759d3085253de4e96ef5203d6a51bdd8327c1,5/31(金) 19:24
2024-06-01,07:16,domestic,国内,19,夕刊フジ,信念なき立憲民主党幹部！〝永田町の不動産屋〟小沢一郎氏も呆れる「パーティー禁止」　過去の政治資金報告書で丸儲けの実態が,https://news.yahoo.co.jp/articles/ff147616ae39cf33c4c9c554f5c82fd3a63bb5db,5/31(金) 17:00
2024-06-01,07:16,domestic,国内,20,TBS NEWS DIG Powered by JNN,6月から始まる定額減税めぐり自民・茂木幹事長「今回限りにしたい」,https://news.yahoo.co.jp/articles/2d8c9ec334ce4120fe76facb689fea59542b76d8,6/1(土) 0:46
2024-06-01,07:16,domestic,国内,21,ABEMA TIMES,藤井聡太叡王がカド番しのぐ！「ひとまず最終局に持ち込めたのは良かった」同学年・伊藤匠七段とのタイトル争いは2勝2敗のタイに 決着は最終第5局へ／将棋・叡王戦五番勝負,https://news.yahoo.co.jp/articles/c9aee2bf9cfd7ab2df2affe1b539abace33a172a,5/31(金) 18:03
2024-06-01,07:16,domestic,国内,22,読売新聞オンライン,発車間際のＪＲ武蔵野線「車掌が来ない」…ホームには乗客１５０人、回送電車として発車,https://news.yahoo.co.jp/articles/9405151bb6b7d4ac24ed9bd1ff40e2f50bc3a730,5/31(金) 7:36
2024-06-01,07:16,domestic,国内,23,東海テレビ,駅で特急にはねられた男性がホームの女子高校生を直撃 男性は死亡し女子高校生も大ケガ 一時運転見合わせに,https://news.yahoo.co.jp/articles/e31fe878aca9f5ee5bb9544bfa7073bb10059be2,5/30(木) 15:59
2024-06-01,07:16,domestic,国内,24,読売新聞オンライン,軽トラごと漁港に女性転落、ハンマーを手に男性が服脱いで海へ…濁った海水に満ちた車内の「黒いもの」は腕だった,https://news.yahoo.co.jp/articles/3b73ff28e3586f5864e6ac75788c96fd1e4f6599,5/31(金) 14:21
2024-06-01,07:16,domestic,国内,25,日刊スポーツ,小沢一郎氏「偏った茶番」ワイドショーコメンテーター「都知事選」コメにクギ「現知事擁護し…」,https://news.yahoo.co.jp/articles/e7e8eef22e8528ad31598675e55393b7bc2f32f4,5/31(金) 20:54
2024-06-01,07:16,domestic,国内,26,朝日新聞デジタル,嘔吐した園児「汚い」と放置　市が不適切保育疑い公表、保育士は否定,https://news.yahoo.co.jp/articles/2ea1bd4de9023965187b53958609ebcc5423593d,6/1(土) 6:30
2024-06-01,07:16,domestic,国内,27,朝日新聞デジタル,河川敷にロケットランチャー数基か　北九州市、暴力団の武器庫の見方,https://news.yahoo.co.jp/articles/9ce4ee633c0b70399125136427cca3948b06850c,5/31(金) 17:12
2024-06-01,07:16,domestic,国内,28,産経新聞,＜独自＞「歴史に残る記録作れた（笑）」人身事故の運転士、社内報で不適切コメント,https://news.yahoo.co.jp/articles/4c719322b3588da5a44d1e4b3d3172f7e18c36a0,5/31(金) 11:25
2024-06-01,07:16,domestic,国内,29,TBS NEWS DIG Powered by JNN,「やるなら徹底的におやりなさい」ー戦後最大の総会屋事件（2）　“業界のガリバー”野村証券の徹底抗戦に「SEC」の委員長が命じたこと,https://news.yahoo.co.jp/articles/4b8c02de3b13b61b647998ced100658f219862da,6/1(土) 6:02
2024-06-01,07:16,domestic,国内,30,朝日新聞デジタル,「井戸端会議じゃないんだから」　ライドシェア解禁めぐり大阪府知事,https://news.yahoo.co.jp/articles/54c7e596161f5fd1bb911366eb05edbd8fdaa743,5/31(金) 22:10
2024-06-01,07:16,domestic,国内,31,ABEMA TIMES,「本当の急所が見えている」藤井聡太叡王とタイトル戦で2度激突した菅井竜也八段が感じた“一番の強み”「あの能力があればな…」,https://news.yahoo.co.jp/articles/c511427e66c6853bfbaccee76a1eb38b15d19446,5/31(金) 11:51
2024-06-01,07:16,domestic,国内,32,スポニチアネックス,規制法、パー券5万円超＆政活費10年後公開で6・3採決にネット「抜け道だらけ」「1円から公開しなよ」,https://news.yahoo.co.jp/articles/06ed5fae621f97a2d6f55fd841f665419220bbf1,5/31(金) 14:32
2024-06-01,07:16,domestic,国内,33,夕刊フジ,減税帳消し〝給与明細ショック〟「２０万円負担増」の実態　一時的に恩恵、複雑な税制で徐々に徴収…定額減税では消費喚起効果は限定的,https://news.yahoo.co.jp/articles/16def52ba4ecc63e5cb84c9a1420c70ee7b29f3a,5/29(水) 17:00
2024-06-01,07:16,domestic,国内,34,読売新聞オンライン,給油機に残っていた３０００円、看護師の男性「ラッキー」と懐に…警察に事情聴取され停職１か月,https://news.yahoo.co.jp/articles/c52807a9036a2785fbe096c01c9f5f49850f8ff8,5/31(金) 13:56
2024-06-01,07:16,domestic,国内,35,TBS NEWS DIG Powered by JNN,戦後最大の総会屋事件（3）　野村證券元社員に内部告発を決断させた“不審な取引”「こんな下落相場が続いているのに、毎回利益がでてるのは…」,https://news.yahoo.co.jp/articles/79e4adae5a239e8d9f1a57803a826f796f93e3a8,6/1(土) 6:02
2024-06-01,07:16,domestic,国内,36,朝日新聞デジタル,「怖い」朝夕は犬の散歩コース　北九州でロケットランチャー？発見,https://news.yahoo.co.jp/articles/3bfe2905f1e7651cad750c09e5eb13d079356722,5/31(金) 20:36
2024-06-01,07:16,domestic,国内,37,東海テレビ,少女の性行為動画等をスマホに保存 小学校の33歳男性教師が停職4カ月の処分 退職の意向は示さず,https://news.yahoo.co.jp/articles/4a20788beead7a7a8a92596a57b7768c3bfdafa3,5/23(木) 21:07
2024-06-01,07:16,domestic,国内,38,東海テレビ,傘を差して乗り警察官が停止求める…パトカーが追跡していた自転車の52歳男性が転倒 首の骨を折る大ケガ,https://news.yahoo.co.jp/articles/c48e1e897321c7c88e13100d22f1a1d9a44bf348,5/31(金) 21:15
2024-06-01,07:16,domestic,国内,39,スポーツ報知,中瀬ゆかりさん、八坂神社での外国人観光客と日本人女性のトラブルに「『あっ、すみません。気を付けます』で済んだ話が…」,https://news.yahoo.co.jp/articles/48cc4d3fa63d2d7ce7bb77bc4398c1ff5f3eadf6,5/30(木) 22:08
2024-06-01,07:16,domestic,国内,40,朝日新聞デジタル,能登地震5カ月、70代夫婦の車庫暮らし「こんな年でこんな目に…」,https://news.yahoo.co.jp/articles/35d9f4aa43f94eaff67c7e3436abe50d95c6202a,6/1(土) 5:00
