scrp_date,scrp_time,genre_en,genre_jp,rank,media_jp,title,link,date_original
2024-12-08,20:05,domestic,国内,1,メ〜テレ（名古屋テレビ）,“風邪”がインフルエンザやコロナと同じ「5類感染症」に　25年4月から　受診時の負担は増えるの？,https://news.yahoo.co.jp/articles/aa68c175e999bb9c8770d6950d2c63ec7a658ce6,12/8(日) 7:00
2024-12-08,20:05,domestic,国内,2,J-CASTニュース,池袋暴走事故遺族、殺害予告の女子中学生への「被害届」取り下げず　「私なりの唯一出来る愛の形」思いつづる,https://news.yahoo.co.jp/articles/8c9df18bf6dbe4c7427d3e84af9bc2e28d0b5402,12/8(日) 12:21
2024-12-08,20:05,domestic,国内,3,デイリースポーツ,突然政界から消えた大物政治家　ＴＶ現れ騒然　たけし驚き「急にいなくなった。全然理由分かんねえ」　元政党代表が今は　阿川「凄く若返ってる」,https://news.yahoo.co.jp/articles/27eed3895354984b589fd4a40ef02921c085c6a9,12/8(日) 17:13
2024-12-08,20:05,domestic,国内,4,デイリースポーツ,斎藤知事を刑事告発　読テレ解説委員「視聴率獲るため各テレビはやるんでしょうけど」　女性社長ｎｏｔｅに疑念多数も「権限は捜査側だけ」,https://news.yahoo.co.jp/articles/4716aba667f50a5f60a81cb73bf672469159eab0,12/8(日) 18:13
2024-12-08,20:05,domestic,国内,5,よろず～ニュース,立花孝志氏、アンチを演説台に上げてしゃべらせた！ 泉大津市長選で仰天の第一声 「僕からしたらブースト」,https://news.yahoo.co.jp/articles/36640f0d367f62abdc2787b4e2fbe3bb03e62bbc,12/8(日) 18:14
2024-12-08,20:05,domestic,国内,6,TBS NEWS DIG Powered by JNN,車から降りた直後にドアに押し倒されて下敷きに　搬送されるも57歳の女性死亡,https://news.yahoo.co.jp/articles/a786b158a1e6595ef559d76e2478a7c4110e27a5,12/8(日) 19:43
2024-12-08,20:05,domestic,国内,7,産経新聞,飲酒後じゃれ合いで親友の命奪う　悔恨の元近大生に遺族が送った「懸命に生きろ」の叱咤,https://news.yahoo.co.jp/articles/b076d5ed67fbb83ddc31aa167ebdb4de6b1b8682,12/7(土) 19:00
2024-12-08,20:05,domestic,国内,8,デイリースポーツ,立憲代表候補４人全員で「嘘」？　ＴＶ約束→全員反故　橋下氏が追及「言ったことはやる！」→野田代表「年内には」他の３人は「把握してない」,https://news.yahoo.co.jp/articles/fbc5643b31b464a4f05b0adbb618f397d4f69af6,12/8(日) 19:23
2024-12-08,20:05,domestic,国内,9,FNNプライムオンライン,"【独自】曲がった先に若い女性の逆走車「逆走ー!」呼びかけ気づかず　「コンビニワープ」した車は結局""元の位置”に　各地で危険運転“そこ走っちゃダメ!”2連発",https://news.yahoo.co.jp/articles/15cf4b7e993f588c3cda1048421063d22976098d,12/8(日) 17:02
2024-12-08,20:05,domestic,国内,10,毎日新聞,冬場に急増「ヒートショック」　若い人も要注意　対策と救助方法,https://news.yahoo.co.jp/articles/86917e92e84ffce6cbb37b817b25fc170a81d4dc,12/7(土) 13:50
2024-12-08,20:05,domestic,国内,11,よろず～ニュース,斎藤元彦知事らを刑事告発した弁護士VS疑義を唱える弁護士が激論「犯罪の疑義がある」「具体的な事実は何ですか」,https://news.yahoo.co.jp/articles/000345ddcb4d5c8ed7e74622716d469caaef9221,12/8(日) 8:50
2024-12-08,20:05,domestic,国内,12,ハフポスト日本版,生理用ショーツ型ナプキン、異例の“黒色”採用で「オムツっぽい」→「かっこいい」に。1年で出荷400万枚突破の大人気。開発の背景は,https://news.yahoo.co.jp/articles/ab229eff05b052abefaef66f77fcfc622149bed2,12/8(日) 8:30
2024-12-08,20:05,domestic,国内,13,デイリースポーツ,「パーカ着てるおじさんおかしい」発言の脚本家が再挑発「ジジイは先が短いから早とちり」堀江貴文氏やひろゆき氏反応,https://news.yahoo.co.jp/articles/fdcb3e8d06c5b63c2048899f1ccc0c239c0445dc,12/7(土) 23:20
2024-12-08,20:05,domestic,国内,14,共同通信,山手線が一時運転見合わせ　渋谷で人身事故2万人影響,https://news.yahoo.co.jp/articles/3897f1056e9bad02a3318df37c602ca5f023e9cc,12/8(日) 15:23
2024-12-08,20:05,domestic,国内,15,信濃毎日新聞デジタル,どっち？「使い捨てカイロ」は燃えるゴミ？燃えないゴミ？　成分の半分以上は鉄粉だが…記者が調べてみた,https://news.yahoo.co.jp/articles/5e5d3e59932c28e482f7127dc3ad2bd6d19448bb,12/8(日) 7:40
2024-12-08,20:05,domestic,国内,16,高校生新聞オンライン,数学五輪で世界4位の狩野慧志さん「1問を8時間解き続ける」驚異の集中力,https://news.yahoo.co.jp/articles/b96435a8c98a0ca6e6c3f61ec349d022c1373224,12/8(日) 18:01
2024-12-08,20:05,domestic,国内,17,レスキューナウニュース,山手線で人身事故 運転見合わせ,https://news.yahoo.co.jp/articles/e9074aa966753b39a29b2ae48b851f8b5ae47424,12/8(日) 11:15
2024-12-08,20:05,domestic,国内,18,読売テレビ,【プロ直伝】5年ぶりの奇跡“最大9連休”の年末年始は国内旅行が熱い！ホテル代高騰の今、知る人ぞ知る『国民宿舎』の魅力＆お得な予約テクニックを専門家が伝授,https://news.yahoo.co.jp/articles/ca8ad5fd5f98d433ee5f9e6217488202d1e66dea,12/8(日) 9:00
2024-12-08,20:05,domestic,国内,19,tenki.jp,明日9日　冬日地点続出　13日は太平洋側も冷たい雨　都心は真冬並みの寒さ,https://news.yahoo.co.jp/articles/867bfb384ff68370093683632d60ae69b1079543,12/8(日) 16:41
2024-12-08,20:05,domestic,国内,20,産経新聞,「私が稼いできたお金をみなさんに還元」　大阪・泉大津市長選告示で立花孝志氏が第一声,https://news.yahoo.co.jp/articles/147d4788e560f27af16f7514a18dfc194497f680,12/8(日) 15:28
2024-12-08,20:05,domestic,国内,21,朝日新聞デジタル,秋篠宮ご夫妻がトルコから帰国　記念式典出席や遺跡視察など,https://news.yahoo.co.jp/articles/e77d7c429e6385a76e9f34a96b8c88cc6a29f642,12/8(日) 17:02
2024-12-08,20:05,domestic,国内,22,弁護士JPニュース,「生活保護の受給要件をみたしているのに…」相談者の7割近くが申請断念　行政の“水際作戦”「実態と背景」とは【行政書士解説】,https://news.yahoo.co.jp/articles/f964bf1e52f1eee8656f4e0a463e9922e48cd880,12/8(日) 9:30
2024-12-08,20:05,domestic,国内,23,tenki.jp,群馬県北部に大雪警報　今シーズン関東で初　今夜にかけ積雪急増　冬装備を万全に,https://news.yahoo.co.jp/articles/501a5c942b01a4c3609895c877b54a5f054f1f90,12/8(日) 16:26
2024-12-08,20:05,domestic,国内,24,ABEMA TIMES,秋篠宮ご夫妻、トルコから帰国 皇室にゆかりのある遺跡の視察など,https://news.yahoo.co.jp/articles/4542e4400c8fd236b7668bd7f5227efde4d6ce4d,12/8(日) 19:01
2024-12-08,20:05,domestic,国内,25,よろず～ニュース,兵庫・斎藤知事告発の目的→捜査の進展　ReHacQで郷原弁護士、告発状は「主張」「表現」と説明　報道に疑問も,https://news.yahoo.co.jp/articles/3f391bc09f83c50558eefa09cc1fe405e0c78602,12/8(日) 19:50
2024-12-08,20:05,domestic,国内,26,ABEMA TIMES,藤井聡太竜王・名人「100年に一度の対局、大変緊張した」“野球の聖地”甲子園での100周年記念対局で羽生善治九段に敗れる,https://news.yahoo.co.jp/articles/901af0d30db0a55ab42a37550679727e3f758726,12/8(日) 15:12
2024-12-08,20:05,domestic,国内,27,J-CASTニュース,韓国が政権交代すれば「反日」へ舵切る？　大統領は弾劾免れるも命運は尽きた,https://news.yahoo.co.jp/articles/fdbd09fcf1975a783a9b2d3dc55a9fa643593359,12/8(日) 18:10
2024-12-08,20:05,domestic,国内,28,ABEMA TIMES,「かっ飛ばせー！フ・ジ・イ！」藤井聡太竜王・名人、谷川浩司十七世名人からのサプライズに笑顔 ファンも興奮「関西らしいノリ」,https://news.yahoo.co.jp/articles/07e7932fab9d429fc5320b75a1f1be51c22e6030,12/8(日) 15:48
2024-12-08,20:05,domestic,国内,29,ABEMA TIMES,岸谷五朗・香の長男、蘭丸氏がメディア初登場 異例の経歴＆豊富な海外経験で堂々と熱弁「日本の文化は変えない方がいい」,https://news.yahoo.co.jp/articles/7026028fcb1a2777f3cfa62c5ca10dbf30c7a82b,12/7(土) 12:02
2024-12-08,20:05,domestic,国内,30,ENCOUNT,斎藤元彦知事「SNS戦略を知らない」に疑念、よみがえる泉房穂氏との“盗聴器騒ぎ”…弁護士「知り尽くしているのでは」,https://news.yahoo.co.jp/articles/c789accd82a5d6b72718076897de140496eb56a6,12/8(日) 8:15
2024-12-08,20:05,domestic,国内,31,産経新聞,大敗「執行部の戦略ミスだ」　自民・下村氏、衆院選落選者向け会合で石破首相らを批判,https://news.yahoo.co.jp/articles/86170df30a658324ba8a31a089be47fd5b1343c7,12/8(日) 16:12
2024-12-08,20:05,domestic,国内,32,TBS NEWS DIG Powered by JNN,地面師に直撃した記者が語る手口…今後、起こる被害を専門家が警告　「すごすぎて手に負えない」仕事ぶりも,https://news.yahoo.co.jp/articles/72ed143f02c6c13581b2bbd390159f09e47dc8b9,12/7(土) 7:02
2024-12-08,20:05,domestic,国内,33,共同通信,政倫審欠席「幹部の要請」　自民旧安倍派、衛藤氏主張,https://news.yahoo.co.jp/articles/6e8b342e73af39fac1f6b73af9f696588cd7b9d2,12/8(日) 19:30
2024-12-08,20:05,domestic,国内,34,MBC南日本放送,【ふたご座流星群】8日（日）夜の天気　見やすい時間帯は?【観察＆撮影のポイント/スマホで流星を撮るには】2024,https://news.yahoo.co.jp/articles/74e240389ce4ff674824cfcf28a0abe3fd22619c,12/8(日) 14:53
2024-12-08,20:05,domestic,国内,35,時事通信,「朝鮮半島出身者を忘れないで」　在日韓国人で被爆2世の権さん　日本被団協のノーベル平和賞,https://news.yahoo.co.jp/articles/4ff5c7b993e776053fda3517f832296f6c78ff64,12/8(日) 19:03
2024-12-08,20:05,domestic,国内,36,読売新聞オンライン,走行中の九州新幹線が倒木と衝突、鹿児島県内で停車…熊本―鹿児島中央間の一部で運休,https://news.yahoo.co.jp/articles/bcecd3e9d1cb162d24048ddb59e296324578885f,12/8(日) 17:25
2024-12-08,20:05,domestic,国内,37,FNNプライムオンライン（フジテレビ系）,【速報】立憲・野田氏と維新・吉村氏が参院選の野党候補一本化方針で一致　予備選実施も含め模索へ,https://news.yahoo.co.jp/articles/7b1edacf532a7c7bf741f609bb2c668e79126057,12/8(日) 9:37
2024-12-08,20:05,domestic,国内,38,デイリースポーツ,自民大物議員　１日会食６軒→計１０６万円超の衝撃　焼肉３１万、中華２１万円…カンテレ番組　橋下氏「当然奢ってる」相手は？「全員割り勘に」,https://news.yahoo.co.jp/articles/f62b47827462b41756538ee7a470309444807e90,12/7(土) 17:04
2024-12-08,20:05,domestic,国内,39,デイリースポーツ,斎藤知事報道「オールドメディアの象徴」と言われた読テレ解説委員「カットすんな！」とＴＶ応戦　「お前らは隠してる嘘ついてると。代償の大きさ考えてもらいたい」,https://news.yahoo.co.jp/articles/f15b78bc435d8ef042c2571a3d981dba6d497eb4,12/7(土) 15:24
2024-12-08,20:05,domestic,国内,40,共同通信,帯状疱疹ワクチン、定期接種へ　来年4月から65歳対象、厚労省,https://news.yahoo.co.jp/articles/2b241908251528bcb51221c665dfd718aafe6e9a,12/6(金) 19:57
