scrp_date,scrp_time,genre_en,genre_jp,rank,media_jp,title,link,date_original
2024-10-19,05:06,sports,スポーツ,1,日刊スポーツ,粗品「引退します」と発表、競馬予想動画無期限休止…体力、金銭面の限界,https://news.yahoo.co.jp/articles/6da3e9f3d22a6fc9c474e930a84471835a79e767,10/18(金) 22:24
2024-10-19,05:06,sports,スポーツ,2,テレ東スポーツ,ロバーツ監督 大谷の敬遠にベッツの気持ちを代弁「個人的に見下されていると感じたのだろう。ああいうことが火をつけるんだ」,https://news.yahoo.co.jp/articles/c5fd8fc521e86663ead8749b6783cf5a1d1c6c1b,10/18(金) 23:10
2024-10-19,05:06,sports,スポーツ,3,デイリースポーツ,日本ハム・新庄監督は自身の進退は明言せず　ＣＳ敗退後「ドラフト会議が終わったときにしっかり答えを出しますので。ちょっと待って下さい」と話す,https://news.yahoo.co.jp/articles/17584c1fb6ab45018c4ee1d88fb95176aba4f98a,10/18(金) 21:04
2024-10-19,05:06,sports,スポーツ,4,デイリースポーツ,「今日もいる！」劣勢の日本ハム応援席にアイドルの姿　試合前から熱視線「全く変装もせず」「ガチ応援」と話題に,https://news.yahoo.co.jp/articles/3f1522e0c51844cd231181d61f1451c7601da9ce,10/18(金) 20:37
2024-10-19,05:06,sports,スポーツ,5,スポニチアネックス,大谷と仲良しT・ヘルナンデスが語る「ワールドシリーズ出場」への夢と、ドジャースを蘇らせた舞台裏,https://news.yahoo.co.jp/articles/392171fc7991a659512b36af00d2af32ee14f331,10/19(土) 3:39
2024-10-19,05:06,sports,スポーツ,6,ABEMA TIMES,大谷翔平に「キレた？」 衝撃の“先頭打者弾”… メッツ監督の様子がおかしくなる「表情ヤバいな」,https://news.yahoo.co.jp/articles/1769130cf0cc53937023c45848d0b6708fd33e7e,10/18(金) 23:22
2024-10-19,05:06,sports,スポーツ,7,Full-Count,鷹・王貞治会長、崖っぷち巨人に「まだ1つある」　現役時代を過ごした古巣へ“エール”,https://news.yahoo.co.jp/articles/c9759705b4ba0fb3705d1f23c18eb88735c884b2,10/18(金) 21:33
2024-10-19,05:06,sports,スポーツ,8,スポーツ報知,日本ハムが前楽天の的場１軍バッテリーコーチ＆横尾２軍打撃コーチを招へい,https://news.yahoo.co.jp/articles/f3940d4e20356b235f52b2e0c7b370ecf44571ce,10/19(土) 4:00
2024-10-19,05:06,sports,スポーツ,9,デイリースポーツ,敗退の日本ハム　新庄監督はソフトバンク小久保監督らに拍手を送る「レベルの差を感じた」首脳陣、選手全員が喜ぶ姿を見つめる,https://news.yahoo.co.jp/articles/7c21bddf631e25fe2ab93c2580be1e05e7f6fd57,10/18(金) 20:55
2024-10-19,05:06,sports,スポーツ,10,スポーツ報知,変化球多すぎてかわそうという感じに…髙橋尚成氏がドジャース山本由伸へ「最初からどんどん直球系を」,https://news.yahoo.co.jp/articles/897d8d8876e7820a1f23d07c4d4a012ea18e125a,10/19(土) 1:15
2024-10-19,05:06,sports,スポーツ,11,TBS NEWS DIG Powered by JNN,【DeNA】ファイナル3連勝7年ぶり日本S王手！オースティンが2戦連発の同点弾 暴投間に勝ち越し 吉野は3回1失点 好救援で競り勝つ,https://news.yahoo.co.jp/articles/3780270dc0401e7572e3f90db35fa8059dbf4ca0,10/18(金) 21:06
2024-10-19,05:06,sports,スポーツ,12,スポーツ報知,崖っぷち巨人に救世主再び…１軍緊急招集ヘルナンデスよ、３戦わずか２得点の低調打線に火をつけてくれ,https://news.yahoo.co.jp/articles/451903b6a4d783e06f7cf2b8c7a504a0d3d59023,10/19(土) 4:00
2024-10-19,05:06,sports,スポーツ,13,高校野球ドットコム,ドラフト最大の目玉・宗山塁（明大）指名直前インタビュー「目指すは侍ジャパンの“3番・ショート”、首位打者、最多安打、Gグラブ賞」！【ドラフト候補インタビュー】,https://news.yahoo.co.jp/articles/2b0185a81452123d82c79e9961826ed227731d4f,10/18(金) 12:06
2024-10-19,05:06,sports,スポーツ,14,ABEMA TIMES,「魔法だ！」なでしこジャパンMFのスーパーゴールが欧州で話題沸騰！ 女子CLで36m鮮烈弾を叩き込んだ瞬間「最優秀得点が早くも決定」「パーマーみたい」,https://news.yahoo.co.jp/articles/946263c7b78a15e9452d3daf6aa30779a420bddd,10/18(金) 22:32
2024-10-19,05:06,sports,スポーツ,15,西スポWEB OTTO！,「まさかの新事実」盗塁王2度の韋駄天がプロ入り前にフジテレビアナ試験受験も辞退!?　SNS騒然「選手で頭もよくてイケメンですごいなぁ」,https://news.yahoo.co.jp/articles/acd6eac91f27353316e84f2f6ea73b471a2c8563,10/18(金) 22:40
2024-10-19,05:06,sports,スポーツ,16,motorsport.com 日本版,フェラーリのサインツJr.が最速！　角田裕毅10番手。新相方ローソンと0.1秒差｜F1アメリカGP FP1,https://news.yahoo.co.jp/articles/d264fb3778245e3f07c7d48e8b9948cb6c49982c,10/19(土) 3:56
2024-10-19,05:06,sports,スポーツ,17,ABEMA TIMES,なんだ、ただの紳士か…山本由伸、まさかのデッドボールにも“即謝罪”の瞬間「アルバレス無事なら良かった」,https://news.yahoo.co.jp/articles/90c1ac54fe39735d26ed96b9ddd919e6f70f8681,10/18(金) 19:02
2024-10-19,05:06,sports,スポーツ,18,デイリースポーツ,３連敗の巨人・阿部監督は１５秒で会見終了「あとは意地を見ましょう」３戦わずか２得点と貧打に苦しむ,https://news.yahoo.co.jp/articles/092040326b8182af736267840138a332c2d95540,10/18(金) 21:13
2024-10-19,05:06,sports,スポーツ,19,スポニチアネックス,ド軍監督　ワールドシリーズ王手に「楽しく過ごしている」　大谷は「1番・DH」で3戦連発に期待,https://news.yahoo.co.jp/articles/17b42bb72a418169409062d3b2c15c4f85ea8912,10/19(土) 4:22
2024-10-19,05:06,sports,スポーツ,20,サンケイスポーツ,日本ハム、前楽天・的場直樹氏をコーチ招へいへ,https://news.yahoo.co.jp/articles/2fb8e263b0f8ef556d6fb03a7981511473f1e7f6,10/19(土) 2:00
2024-10-19,05:06,sports,スポーツ,21,デイリースポーツ,夫は元大リーガーの難関大卒女子アナ「奥さま会」は大忙し　ベビーシャワーなど企画多数「毎日球場に来る」人も,https://news.yahoo.co.jp/articles/51b8cbc218af9b53de1f82d2e0423ddf1484f1e8,10/18(金) 20:30
2024-10-19,05:06,sports,スポーツ,22,東スポWEB,ドジャース怒とうの「３０―９」メッツ地元悲観「魔法が解けた」「スプリングトレーニングの計画を」,https://news.yahoo.co.jp/articles/069588ae2e43700640704b207308113dd8f0ebf8,10/18(金) 18:16
2024-10-19,05:06,sports,スポーツ,23,西スポWEB OTTO！,ソフトバンク強い！ストレートで4年ぶり日本シリーズ進出！周東佑京が決勝打　13.5差の2位日本ハムに1勝も許さず,https://news.yahoo.co.jp/articles/58ed0e2a64231073e4f1dbd338a14718c1ac473a,10/18(金) 20:50
2024-10-19,05:06,sports,スポーツ,24,東スポWEB,大谷翔平の２戦連発にＮＹメディア降参「かなわない」「あまりにも優秀すぎる」,https://news.yahoo.co.jp/articles/0fe93f9b66660d388913e197407a59261c06a3b4,10/18(金) 15:26
2024-10-19,05:06,sports,スポーツ,25,スポニチアネックス,ロバーツ監督　ロッテの佐々木朗希に言及　ドジャースのブランドで獲得につながる？に「そう願うよ」,https://news.yahoo.co.jp/articles/4dd904ab80a059db0634aafa2726a9494bd0d624,10/19(土) 1:30
2024-10-19,05:06,sports,スポーツ,26,超WORLDサッカー！,日本代表と最終予選で同組に問題発生、バーレーンが懸念を示しインドネシア戦の開催地を協議へ…パレスチナvs韓国は中立地開催に,https://news.yahoo.co.jp/articles/5116562fa5db47bac98e67ce2daaf2d4cf2231c5,10/18(金) 22:50
2024-10-19,05:06,sports,スポーツ,27,中日スポーツ,日本ハム・新庄剛志監督、「ドラフト会議が終わったときにしっかり答えを出します」去就明言せず,https://news.yahoo.co.jp/articles/67eb64f6d5590bb6bb94c6fb2574aecf47b05419,10/18(金) 21:12
2024-10-19,05:06,sports,スポーツ,28,中日スポーツ,崖っぷちの巨人、負ければCS最多の『下克上』許した球団に…過去2回の敗退もストレート負け【CSファイナル】,https://news.yahoo.co.jp/articles/31f0698dd8eca73baca07818278f784fb6602c05,10/18(金) 21:31
2024-10-19,05:06,sports,スポーツ,29,中日スポーツ,ドジャース・フリーマン、大谷翔平を絶賛「金属バットでもあんなに飛ばせないのに…」 ベッツとの打者としての違いも語る,https://news.yahoo.co.jp/articles/88d634d151016b9576f42a019c6456006797ebeb,10/18(金) 16:33
2024-10-19,05:06,sports,スポーツ,30,スポニチアネックス,ドジャースWSチケット発売　最安値12万円以上も数時間で完売　三塁側ベンチ上は353万円,https://news.yahoo.co.jp/articles/0de0b95db7abed8b60ad48cc0f3dff8ef8d3f986,10/19(土) 1:30
2024-10-19,05:06,sports,スポーツ,31,オートスポーツweb,【タイム結果】2024年F1第19戦アメリカGPフリー走行1回目,https://news.yahoo.co.jp/articles/90767d695c585e2f6f6c5210a3314359cfe97f83,10/19(土) 3:34
2024-10-19,05:06,sports,スポーツ,32,スポーツ報知,大谷翔平、日本人初のＰＳ３戦連発なるか　勝てばＷＳ進出　メッツ戦「１番・ＤＨ」先発出場,https://news.yahoo.co.jp/articles/0cb5b4bea521fe5b0941b50c7b33278c9ed94ffd,10/19(土) 2:09
2024-10-19,05:06,sports,スポーツ,33,スポニチアネックス,新庄日本ハム終戦　ベンチで山崎はぼう然、失策の清宮は下を向き頭抱える場面も…,https://news.yahoo.co.jp/articles/5b5f99fe45593dcba3d47230d937ad690ca7e926,10/18(金) 21:08
2024-10-19,05:06,sports,スポーツ,34,デイリースポーツ,山本由伸、８奪三振快投も５回途中で降板　ドジャースファンも驚きと嘆き「なんとデーブ」「少なくともイニング終わりまで投げさせるべきだ」,https://news.yahoo.co.jp/articles/6edd13244b5e2c0ce435a860890b022ba8f75c30,10/18(金) 11:13
2024-10-19,05:06,sports,スポーツ,35,日刊スポーツ,【日本ハム】今季25本塁打レイエスとの残留交渉を本格化　水面下では複数年契約で延長オファー,https://news.yahoo.co.jp/articles/74d6b153246239fbd93b97d43f85328efcfc2929,10/19(土) 4:45
2024-10-19,05:06,sports,スポーツ,36,優馬,【富士S】「本当に雰囲気が良い」現場からの声で“買うしかない”伏兵の1頭,https://news.yahoo.co.jp/articles/b8e200bddc25b46225881b614408dc8f6d1133a4,10/18(金) 21:01
2024-10-19,05:06,sports,スポーツ,37,ベースボールキング,江本孟紀氏「優勝したチームに見えない」巨人、3位・DeNAにまさかの3連敗…,https://news.yahoo.co.jp/articles/5d3f2251179f281ffb523cc2bdebeded863a9571,10/18(金) 21:15
2024-10-19,05:06,sports,スポーツ,38,DAZN News,アメリカGP60分のみのFPはサインツ最速＆フェラーリ勢1－2！フェルスタッペン3番手…角田裕毅10番手、ローソン13番手｜F1,https://news.yahoo.co.jp/articles/96e0c7896d02223879c3aa1766be2d34986ac481,10/19(土) 3:55
2024-10-19,05:06,sports,スポーツ,39,中日スポーツ,”異例”ドラフト後に進退発表する日本ハム・新庄監督、「当たりくじ引いて置き土産？」「ドラフト参加＝残留？」ネット様々な反応,https://news.yahoo.co.jp/articles/23d9bf431a8a3b00f5df6cdc38b0ca15a68b7471,10/18(金) 21:46
2024-10-19,05:06,sports,スポーツ,40,サンケイスポーツ,巨人、崖っぷち　5番打者が3試合で11打数無安打　阿部監督「あとはもう、意地を見ましょう」,https://news.yahoo.co.jp/articles/1e73f69d1a10e6bf09901295074f7a2e32a87bb0,10/19(土) 1:05
