scrp_date,scrp_time,genre_en,genre_jp,rank,media_jp,title,link,date_original
2024-10-19,07:06,sports,スポーツ,1,日刊スポーツ,粗品「引退します」と発表、競馬予想動画無期限休止…体力、金銭面の限界,https://news.yahoo.co.jp/articles/6da3e9f3d22a6fc9c474e930a84471835a79e767,10/18(金) 22:24
2024-10-19,07:06,sports,スポーツ,2,デイリースポーツ,「今日もいる！」劣勢の日本ハム応援席にアイドルの姿　試合前から熱視線「全く変装もせず」「ガチ応援」と話題に,https://news.yahoo.co.jp/articles/3f1522e0c51844cd231181d61f1451c7601da9ce,10/18(金) 20:37
2024-10-19,07:06,sports,スポーツ,3,デイリースポーツ,日本ハム・新庄監督は自身の進退は明言せず　ＣＳ敗退後「ドラフト会議が終わったときにしっかり答えを出しますので。ちょっと待って下さい」と話す,https://news.yahoo.co.jp/articles/17584c1fb6ab45018c4ee1d88fb95176aba4f98a,10/18(金) 21:04
2024-10-19,07:06,sports,スポーツ,4,テレ東スポーツ,ロバーツ監督 大谷の敬遠にベッツの気持ちを代弁「個人的に見下されていると感じたのだろう。ああいうことが火をつけるんだ」,https://news.yahoo.co.jp/articles/c5fd8fc521e86663ead8749b6783cf5a1d1c6c1b,10/18(金) 23:10
2024-10-19,07:06,sports,スポーツ,5,Full-Count,鷹・王貞治会長、崖っぷち巨人に「まだ1つある」　現役時代を過ごした古巣へ“エール”,https://news.yahoo.co.jp/articles/c9759705b4ba0fb3705d1f23c18eb88735c884b2,10/18(金) 21:33
2024-10-19,07:06,sports,スポーツ,6,東スポWEB,【セＣＳ】「ノムさんやったらボロカス怒られとる」　伊勢孝夫氏が驚いた巨人ベンチ最終回の光景,https://news.yahoo.co.jp/articles/fadeb4eca7a6e352788f6b0e7fe607813081fec1,10/19(土) 5:16
2024-10-19,07:06,sports,スポーツ,7,デイリースポーツ,ドジャース奥さま会　気合ヒシヒシ集合写真　おそろのダウンジャケット＆ヘアメークばっちり「ミセスフリーマンは」,https://news.yahoo.co.jp/articles/431faa803774ecf4dd52e35cb257b6048b7ba7d8,10/19(土) 5:56
2024-10-19,07:06,sports,スポーツ,8,デイリースポーツ,敗退の日本ハム　新庄監督はソフトバンク小久保監督らに拍手を送る「レベルの差を感じた」首脳陣、選手全員が喜ぶ姿を見つめる,https://news.yahoo.co.jp/articles/7c21bddf631e25fe2ab93c2580be1e05e7f6fd57,10/18(金) 20:55
2024-10-19,07:06,sports,スポーツ,9,TBS NEWS DIG Powered by JNN,【DeNA】ファイナル3連勝7年ぶり日本S王手！オースティンが2戦連発の同点弾 暴投間に勝ち越し 吉野は3回1失点 好救援で競り勝つ,https://news.yahoo.co.jp/articles/3780270dc0401e7572e3f90db35fa8059dbf4ca0,10/18(金) 21:06
2024-10-19,07:06,sports,スポーツ,10,高校野球ドットコム,ドラフト最大の目玉・宗山塁（明大）指名直前インタビュー「目指すは侍ジャパンの“3番・ショート”、首位打者、最多安打、Gグラブ賞」！【ドラフト候補インタビュー】,https://news.yahoo.co.jp/articles/2b0185a81452123d82c79e9961826ed227731d4f,10/18(金) 12:06
2024-10-19,07:06,sports,スポーツ,11,スポーツ報知,日本ハムが前楽天の的場１軍バッテリーコーチ＆横尾２軍打撃コーチを招へい,https://news.yahoo.co.jp/articles/f3940d4e20356b235f52b2e0c7b370ecf44571ce,10/19(土) 4:00
2024-10-19,07:06,sports,スポーツ,12,スポニチアネックス,大谷と仲良しT・ヘルナンデスが語る「ワールドシリーズ出場」への夢と、ドジャースを蘇らせた舞台裏,https://news.yahoo.co.jp/articles/392171fc7991a659512b36af00d2af32ee14f331,10/19(土) 3:39
2024-10-19,07:06,sports,スポーツ,13,スポーツ報知,ドジャースをよみがえらせた運命のミーティング「ただチームをひとつにまとめたかった」　エース離脱がきっかけに,https://news.yahoo.co.jp/articles/bbdaf620e51864c1d1739c5f43868017faecc51f,10/19(土) 6:01
2024-10-19,07:06,sports,スポーツ,14,ABEMA TIMES,「魔法だ！」なでしこジャパンMFのスーパーゴールが欧州で話題沸騰！ 女子CLで36m鮮烈弾を叩き込んだ瞬間「最優秀得点が早くも決定」「パーマーみたい」,https://news.yahoo.co.jp/articles/946263c7b78a15e9452d3daf6aa30779a420bddd,10/18(金) 22:32
2024-10-19,07:06,sports,スポーツ,15,スポニチアネックス,日本ハム・レイエス　来季も残留へ　複数年契約を提示したもよう,https://news.yahoo.co.jp/articles/b208b7252bb304443af75fdb5f49da7164cfd8a8,10/19(土) 6:00
2024-10-19,07:06,sports,スポーツ,16,スポーツ報知,変化球多すぎてかわそうという感じに…髙橋尚成氏がドジャース山本由伸へ「最初からどんどん直球系を」,https://news.yahoo.co.jp/articles/897d8d8876e7820a1f23d07c4d4a012ea18e125a,10/19(土) 1:15
2024-10-19,07:06,sports,スポーツ,17,日刊スポーツ,ドジャース夫人会、おそろい白ベストでWS王手の選手へエール「青いユニホームを着た選手へ…」,https://news.yahoo.co.jp/articles/200082afe51a8a5be9266d73d16950115039831a,10/19(土) 6:48
2024-10-19,07:06,sports,スポーツ,18,日刊スポーツ,【日本ハム】今季25本塁打レイエスとの残留交渉を本格化　水面下では複数年契約で延長オファー,https://news.yahoo.co.jp/articles/74d6b153246239fbd93b97d43f85328efcfc2929,10/19(土) 4:45
2024-10-19,07:06,sports,スポーツ,19,スポニチアネックス,Jリーグ　複数クラブから反発でレンタル移籍「8」から「10」に変更,https://news.yahoo.co.jp/articles/af49d49231a4e3c267a1cb9743bbb5bbc0c69267,10/19(土) 4:44
2024-10-19,07:06,sports,スポーツ,20,中日スポーツ,中日、ドラフト指名候補として”社会人ナンバーワン捕手”リストアップ　日本生命・石伊雄太捕手,https://news.yahoo.co.jp/articles/a48e9721709ec32fa3a25a1112d0e7df190ed90a,10/19(土) 5:45
2024-10-19,07:06,sports,スポーツ,21,西スポWEB OTTO！,「まさかの新事実」盗塁王2度の韋駄天がプロ入り前にフジテレビアナ試験受験も辞退!?　SNS騒然「選手で頭もよくてイケメンですごいなぁ」,https://news.yahoo.co.jp/articles/acd6eac91f27353316e84f2f6ea73b471a2c8563,10/18(金) 22:40
2024-10-19,07:06,sports,スポーツ,22,イーファイト,人気ハリウッド女優、伝説ボクサーの役作りで驚きの肉体改造！ぶっとい腕に「本当に本人？」,https://news.yahoo.co.jp/articles/485114c0157f2464600b025ac6a1aca85b22c215,10/19(土) 5:50
2024-10-19,07:06,sports,スポーツ,23,スポニチアネックス,阪神・球児監督　FA組残留へ“動きます”　交渉出馬で火の玉ラブコールも,https://news.yahoo.co.jp/articles/46621ce43b0afccbcc789fc3c6daed23fff89478,10/19(土) 5:15
2024-10-19,07:06,sports,スポーツ,24,motorsport.com 日本版,フェラーリのサインツJr.が最速！　角田裕毅10番手。新相方ローソンと0.1秒差｜F1アメリカGP FP1,https://news.yahoo.co.jp/articles/d264fb3778245e3f07c7d48e8b9948cb6c49982c,10/19(土) 3:56
2024-10-19,07:06,sports,スポーツ,25,ABEMA TIMES,大谷翔平に「キレた？」 衝撃の“先頭打者弾”… メッツ監督の様子がおかしくなる「表情ヤバいな」,https://news.yahoo.co.jp/articles/1769130cf0cc53937023c45848d0b6708fd33e7e,10/18(金) 23:22
2024-10-19,07:06,sports,スポーツ,26,デイリースポーツ,３連敗の巨人・阿部監督は１５秒で会見終了「あとは意地を見ましょう」３戦わずか２得点と貧打に苦しむ,https://news.yahoo.co.jp/articles/092040326b8182af736267840138a332c2d95540,10/18(金) 21:13
2024-10-19,07:06,sports,スポーツ,27,中日スポーツ,中日、ドラフト上位指名候補に”坂本2世”　宮崎商・中村奈一輝内野手　松永スカウト部長「身体能力は非常に高い」抜群の守備力,https://news.yahoo.co.jp/articles/b947b7d063156c41a6a704721ed045ddac4ba0fe,10/19(土) 5:45
2024-10-19,07:06,sports,スポーツ,28,東スポWEB,西武退団の平石洋介前ヘッドはどこへ…　古巣・楽天復帰の目は？,https://news.yahoo.co.jp/articles/6fd7c00e83930f7fd2aa599629c68cd1dcb83ca6,10/19(土) 6:16
2024-10-19,07:06,sports,スポーツ,29,西スポWEB OTTO！,ソフトバンク強い！ストレートで4年ぶり日本シリーズ進出！周東佑京が決勝打　13.5差の2位日本ハムに1勝も許さず,https://news.yahoo.co.jp/articles/58ed0e2a64231073e4f1dbd338a14718c1ac473a,10/18(金) 20:50
2024-10-19,07:06,sports,スポーツ,30,オートスポーツweb,RBのローソン、パワーユニットの6つのエレメントを交換。グリッド降格が決定／F1第19戦,https://news.yahoo.co.jp/articles/fd3e13811c2b627050d825b9302d2d89083ac392,10/19(土) 4:57
2024-10-19,07:06,sports,スポーツ,31,RONSPO,「岸田は体を張って暴投を止めなきゃダメだ！」崖っぷち巨人は「意地を見せる」ことができるのか…的中した横浜DeNA三浦采配と埋められぬ吉川尚の穴,https://news.yahoo.co.jp/articles/26189d63ff81f0ce17c0baa52322aadb08c16ef5,10/19(土) 6:32
2024-10-19,07:06,sports,スポーツ,32,Full-Count,大谷翔平、第1打席は右前打　勝てばWS進出決定…ド軍は無死二、三塁の好機も先制ならず,https://news.yahoo.co.jp/articles/9d541b4e00e51bc287ebd10aa19b0e259e0fe5ed,10/19(土) 6:10
2024-10-19,07:06,sports,スポーツ,33,中日スポーツ,日本ハム・新庄剛志監督、「ドラフト会議が終わったときにしっかり答えを出します」去就明言せず,https://news.yahoo.co.jp/articles/67eb64f6d5590bb6bb94c6fb2574aecf47b05419,10/18(金) 21:12
2024-10-19,07:06,sports,スポーツ,34,超WORLDサッカー！,日本代表と最終予選で同組に問題発生、バーレーンが懸念を示しインドネシア戦の開催地を協議へ…パレスチナvs韓国は中立地開催に,https://news.yahoo.co.jp/articles/5116562fa5db47bac98e67ce2daaf2d4cf2231c5,10/18(金) 22:50
2024-10-19,07:06,sports,スポーツ,35,スポニチアネックス,日本ハム・新庄監督　3連敗終戦も続投濃厚　去就明言避けるもドラフト会議「行きます」,https://news.yahoo.co.jp/articles/c064ca01e79562ba2043a6e166b7df663b19eec3,10/19(土) 6:00
2024-10-19,07:06,sports,スポーツ,36,東スポWEB,【セＣＳ】〝失策王〟DeNA牧秀悟　チーム救う併殺美技はベンチ指示だった「僕らを信頼してくれた」,https://news.yahoo.co.jp/articles/f5f58e651ec951ae9d9289ee4974343e4b751558,10/19(土) 6:16
2024-10-19,07:06,sports,スポーツ,37,ABEMA TIMES,大谷翔平、弾丸PS3号で“異変”「ヤバすぎ」 外野手がドン引き… 頭上を“爆速通過”で「動いてもムダ」,https://news.yahoo.co.jp/articles/12c4b20846e56568bb174980321566c48903a9d4,10/19(土) 5:46
2024-10-19,07:06,sports,スポーツ,38,CoCoKARAnext,【ヤクルト】ドラフトで指名すべき注目選手は？ 「即戦力投手」獲得と“ポスト村上”育成も急務,https://news.yahoo.co.jp/articles/94b900e7344cf4e5021c5db0b55ff3426c39f163,10/19(土) 5:30
2024-10-19,07:06,sports,スポーツ,39,中日スポーツ,”異例”ドラフト後に進退発表する日本ハム・新庄監督、「当たりくじ引いて置き土産？」「ドラフト参加＝残留？」ネット様々な反応,https://news.yahoo.co.jp/articles/23d9bf431a8a3b00f5df6cdc38b0ca15a68b7471,10/18(金) 21:46
2024-10-19,07:06,sports,スポーツ,40,日刊スポーツ,【阪神】坂本誠志郎、国内FA熟考変わらず　藤川球児新監督とは自主トレともに「今に生きている」,https://news.yahoo.co.jp/articles/d3ef7197060ab1cc425e3cb40c376e6d281e233e,10/19(土) 5:15
