scrp_date,scrp_time,genre_en,genre_jp,rank,media_jp,title,link,date_original
2024-10-19,10:33,sports,スポーツ,1,Full-Count,ド軍は12失点大敗、WS進出へ足踏み　大谷翔平は2安打＆3出塁も…3勝2敗で本拠地へ,https://news.yahoo.co.jp/articles/599084e07ae8e9f80145a79021af9bc2bf1ee7cf,10/19(土) 9:16
2024-10-19,10:33,sports,スポーツ,2,スポーツ報知,崖っぷち巨人に救世主再び…１軍緊急招集ヘルナンデスよ、３戦わずか２得点の低調打線に火をつけてくれ,https://news.yahoo.co.jp/articles/451903b6a4d783e06f7cf2b8c7a504a0d3d59023,10/19(土) 4:00
2024-10-19,10:33,sports,スポーツ,3,東スポWEB,【セＣＳ】「ノムさんやったらボロカス怒られとる」　伊勢孝夫氏が驚いた巨人ベンチ最終回の光景,https://news.yahoo.co.jp/articles/fadeb4eca7a6e352788f6b0e7fe607813081fec1,10/19(土) 5:16
2024-10-19,10:33,sports,スポーツ,4,日刊スポーツ,大谷真美子夫人、ゆったりジーンズ姿で笑顔「偉大な男の後ろには常に偉大な女性がいるもの」,https://news.yahoo.co.jp/articles/8ef6ea93e82a9b750afa639c0019a0e5b0cca852,10/19(土) 8:56
2024-10-19,10:33,sports,スポーツ,5,RONSPO,「なんでそんな嫌がらせをするんだ？」井上尚弥戦が絶望的になった“問題児”カシメロの“成田空港場外乱闘騒ぎ”の真相とは…元世界王者の仕掛け人が明かす,https://news.yahoo.co.jp/articles/3c69a9cd22a916cd3180eaf0246d92aa8da1f23c,10/19(土) 7:02
2024-10-19,10:33,sports,スポーツ,6,Full-Count,ヤ軍ソトに900億円契約の可能性　150億円上昇した相場…米記者が見るスターの現状,https://news.yahoo.co.jp/articles/f488e2f7a70048d12b4976bdfe169a5d428f9a4a,10/19(土) 7:20
2024-10-19,10:33,sports,スポーツ,7,スポニチアネックス,大谷翔平　2安打も3戦連発ならず12失点完敗　監督は先制点逃した走塁に珍しく苦言「言い訳できない」,https://news.yahoo.co.jp/articles/f1a9c26ac1d489b776b36c45465cd9d65a23a014,10/19(土) 9:17
2024-10-19,10:33,sports,スポーツ,8,日刊スポーツ,ドジャース夫人会、おそろい白ベストでWS王手の選手へエール「青いユニホームを着た選手へ…」,https://news.yahoo.co.jp/articles/200082afe51a8a5be9266d73d16950115039831a,10/19(土) 6:48
2024-10-19,10:33,sports,スポーツ,9,日刊スポーツ,粗品「引退します」と発表、競馬予想動画無期限休止…体力、金銭面の限界,https://news.yahoo.co.jp/articles/6da3e9f3d22a6fc9c474e930a84471835a79e767,10/18(金) 22:24
2024-10-19,10:33,sports,スポーツ,10,FNNプライムオンライン,井川慶がメジャー契約のままマイナー落ちとなった驚きの“契約”。移籍後に直面したボール問題と理解されなかったコンディション,https://news.yahoo.co.jp/articles/b60ecc754874abe646115604b224a680317c3176,10/19(土) 7:02
2024-10-19,10:33,sports,スポーツ,11,日刊スポーツ,ロバーツ監督、大谷翔平が本塁突入しなかったプレーに「分からない。あれは流れの分岐点だった」,https://news.yahoo.co.jp/articles/f6dec5553d3445ea4720dcbd0b9f9e5f92031b0c,10/19(土) 8:38
2024-10-19,10:33,sports,スポーツ,12,スポニチアネックス,まさか…フラーティ3回8失点KO　救援陣投入しないド軍ベンチに「許しがたい」「2点差だった」と米記者,https://news.yahoo.co.jp/articles/397d0bd31f4efc303ceb1c4f2263b67312650aec,10/19(土) 7:41
2024-10-19,10:33,sports,スポーツ,13,中日スポーツ,ドジャース奥さま会、おそろいの白いダウンベストの写真を公開 ニューヨークの寒さに負けず「大声を出します」,https://news.yahoo.co.jp/articles/0ffa83e036949ce59c7316d4534ec8d45c1c31fb,10/19(土) 8:42
2024-10-19,10:33,sports,スポーツ,14,スポーツ報知,ドジャース王手も完敗で足踏み３勝２敗　初回の大谷翔平の走塁にロバーツ監督苦言「勢いに…」「言い訳はできない」,https://news.yahoo.co.jp/articles/b2f5ae8aa71967d35bb50b11c46fe083887d8d92,10/19(土) 9:44
2024-10-19,10:33,sports,スポーツ,15,西スポWEB OTTO！,「記憶に残っているんよ」　日本S進出のソフトバンク　小久保裕紀監督に〝禁じ手〟3連投を決断させた14年前の悪夢,https://news.yahoo.co.jp/articles/a437c9e19401c14aecdbbd7d293253cfefa72767,10/19(土) 7:01
2024-10-19,10:33,sports,スポーツ,16,デイリースポーツ,「今日もいる！」劣勢の日本ハム応援席にアイドルの姿　試合前から熱視線「全く変装もせず」「ガチ応援」と話題に,https://news.yahoo.co.jp/articles/3f1522e0c51844cd231181d61f1451c7601da9ce,10/18(金) 20:37
2024-10-19,10:33,sports,スポーツ,17,スポニチアネックス,ド軍指揮官　大谷翔平の初回走塁に珍しく苦言　先制できずその後大量失点「頭が真っ白になって…」,https://news.yahoo.co.jp/articles/a5fdd9a33a230b7f0bcddcc65fd2401a5ccc955d,10/19(土) 8:58
2024-10-19,10:33,sports,スポーツ,18,Full-Count,大谷翔平の“消極的”走塁に指揮官苦言　先制機を逃して大敗「言い訳はできない」,https://news.yahoo.co.jp/articles/7c4b46d1409d8bbd4d423b0e7b7686b60a9b32f1,10/19(土) 9:47
2024-10-19,10:33,sports,スポーツ,19,日刊ゲンダイDIGITAL,日本ハム栗山CBOが二刀流高校生のドラフト指名を示唆した本当の理由は《ソフトバンクけん制》か,https://news.yahoo.co.jp/articles/49671de4db4153fdd1a298a7b6d248a7e848967e,10/19(土) 9:06
2024-10-19,10:33,sports,スポーツ,20,スポニチアネックス,日本ハム・レイエス　来季も残留へ　複数年契約を提示したもよう,https://news.yahoo.co.jp/articles/b208b7252bb304443af75fdb5f49da7164cfd8a8,10/19(土) 6:00
2024-10-19,10:33,sports,スポーツ,21,スポニチアネックス,「最終的に7試合で4勝すること」ド軍指揮官「長いシリーズでは…」滅多打ちフラーティ引っ張った経緯説明,https://news.yahoo.co.jp/articles/830807f96a93cc8eec20b79b0b777340b6eae757,10/19(土) 9:50
2024-10-19,10:33,sports,スポーツ,22,中日スポーツ,中日、ドラフト上位指名候補に”坂本2世”　宮崎商・中村奈一輝内野手　松永スカウト部長「身体能力は非常に高い」抜群の守備力,https://news.yahoo.co.jp/articles/b947b7d063156c41a6a704721ed045ddac4ba0fe,10/19(土) 5:45
2024-10-19,10:33,sports,スポーツ,23,日刊ゲンダイDIGITAL,NBAを目指す河村勇輝と富永啓生を待ち受ける…開幕後のエコノミー&モーテル地獄,https://news.yahoo.co.jp/articles/88ab3ee214e44f0063e7f6c8d06fc54ab23b5297,10/19(土) 9:06
2024-10-19,10:33,sports,スポーツ,24,デイリースポーツ,日テレアナが「ん？」箱根駅伝予選会でハプニング　予定時刻１０秒遅れでスタート　「過去最悪のコンディション」残暑の残る中、４３校が１０枚の切符争う,https://news.yahoo.co.jp/articles/c84d1134119870175d9351ec40fda168aa9d5fb4,10/19(土) 9:36
2024-10-19,10:33,sports,スポーツ,25,Full-Count,打率.000…ド軍ヘルナンデスに米記者“絶望”　大谷翔平が出塁も「大チャンスを無駄に」,https://news.yahoo.co.jp/articles/7356ad18fa90b7266284d68dea429058e4ad6624,10/19(土) 7:37
2024-10-19,10:33,sports,スポーツ,26,スポーツ報知,女子ゴルフ第３Ｒは雷雲接近で競技中断　宮田成華がトップ…延田グループ・マスターズＧＣレディース,https://news.yahoo.co.jp/articles/d96967feba9c6398ed662bd1b2d7129b04dfbad0,10/19(土) 9:40
2024-10-19,10:33,sports,スポーツ,27,ベースボールキング,"巨人打線""覇気なし""でファイナルステージ3連敗…谷繁氏バッサリ「巨人は調整に失敗している」",https://news.yahoo.co.jp/articles/e287827b763a6144f901d6ed09da8d745e34f9f6,10/19(土) 8:50
2024-10-19,10:33,sports,スポーツ,28,日刊ゲンダイDIGITAL,渋野日向子は今季未勝利なのに…「獲得賞金2億5000万円」で国内7勝の竹田麗央を上回る衝撃,https://news.yahoo.co.jp/articles/7550f6cb81f13eeaff130e7740cba14d8dbcf196,10/19(土) 9:06
2024-10-19,10:33,sports,スポーツ,29,デイリースポーツ,ドジャース　投手陣大炎上で「捨て試合」トレンド　４回までに２桁失点「早起きして見せられる捨て試合」ファンげんなり,https://news.yahoo.co.jp/articles/072f3f495947d26f2932604588cd204cdd28af3c,10/19(土) 7:55
2024-10-19,10:33,sports,スポーツ,30,デイリースポーツ,ドジャース奥さま会　気合ヒシヒシ集合写真　おそろのダウンベスト＆ヘアメークばっちり「ミセスフリーマンは」,https://news.yahoo.co.jp/articles/431faa803774ecf4dd52e35cb257b6048b7ba7d8,10/19(土) 5:56
2024-10-19,10:33,sports,スポーツ,31,東スポWEB,【セＣＳ】阿部巨人３連敗に〝２つの誤算〟「攻撃面はもちろんだけど…」,https://news.yahoo.co.jp/articles/06df3ff5b1f614a1f68386dcee4f6494eba659ef,10/19(土) 5:16
2024-10-19,10:33,sports,スポーツ,32,日刊ゲンダイDIGITAL,阪神藤川監督の就任会見「言語明瞭、意味不明」だった“特殊事情”…虎ファンが感じた心の揺れ,https://news.yahoo.co.jp/articles/701c1937ded4dde8ed0f900f78ff0601e796e3e3,10/19(土) 9:06
2024-10-19,10:33,sports,スポーツ,33,スポーツ報知,楽天・三木新監督が“初カミナリ”「ファームで指導したのに裕季也が…」,https://news.yahoo.co.jp/articles/e93495836578dd498caae1c61474ea15d7fde9b8,10/19(土) 6:40
2024-10-19,10:33,sports,スポーツ,34,スポニチアネックス,阪神・球児監督　FA組残留へ“動きます”　交渉出馬で火の玉ラブコールも,https://news.yahoo.co.jp/articles/46621ce43b0afccbcc789fc3c6daed23fff89478,10/19(土) 5:15
2024-10-19,10:33,sports,スポーツ,35,Full-Count,西武のイケメン25歳が「未来を担う」　100％＆4.7で大化け間近…X期待「頭一つ抜けた」,https://news.yahoo.co.jp/articles/0b51c18b4c4006140aded40626e7f08062c9cf3c,10/19(土) 7:40
2024-10-19,10:33,sports,スポーツ,36,ゴルフのニュース,【速報】女子ゴルフが競技中断… ツアー未勝利の宮田成華が単独首位 山下美夢有はまさかの3連続ボギーで後退,https://news.yahoo.co.jp/articles/44831853bc499f126f51f9d0b296790cf881116d,10/19(土) 9:52
2024-10-19,10:33,sports,スポーツ,37,TopNews,【F1アメリカGP：SQ1】波乱！ピアストリがトラックリミット違反で最速タイム抹消！角田裕毅はSQ2進出,https://news.yahoo.co.jp/articles/4bb26cf42b0de442fb37a1de90d9d758b4966480,10/19(土) 6:55
2024-10-19,10:33,sports,スポーツ,38,TopNews,【F1アメリカGP：SQレポート】SQ1でマクラーレン敗退の波乱！フェルスタッペンがポール、角田裕毅がペレスとローソン撃破！,https://news.yahoo.co.jp/articles/6741264e97a3e321530d5beeb805d0f345236766,10/19(土) 8:09
2024-10-19,10:33,sports,スポーツ,39,スポーツ報知,日本ハムが前楽天の的場１軍バッテリーコーチ＆横尾２軍打撃コーチを招へい,https://news.yahoo.co.jp/articles/f3940d4e20356b235f52b2e0c7b370ecf44571ce,10/19(土) 4:00
2024-10-19,10:33,sports,スポーツ,40,Full-Count,現ドラ＆戦力外→CSで躍動　移籍で“覚醒”…DeNAの切り札にX胸熱「俺たちの希望」,https://news.yahoo.co.jp/articles/6219b633534654a408038be546527376ba2148d4,10/19(土) 8:10
