scrp_date,scrp_time,genre_en,genre_jp,rank,media_jp,title,link,date_original
2025-01-11,09:27,domestic,国内,1,読売新聞オンライン,まるで「罰ゲーム」、業務負担増える管理職なんかなりたくない…価値観一変に公募制導入も,https://news.yahoo.co.jp/articles/94ddb35fae610d7456245a6ddae5499307061dd8,1/11(土) 5:00
2025-01-11,09:27,domestic,国内,2,TBS NEWS DIG Powered by JNN,「インフルにかかる人・かからない人の違いは?」「医師はどう予防?」インフルエンザの疑問を専門家に聞く【ひるおび】,https://news.yahoo.co.jp/articles/184cc4d0ec03b91f5af3e86884d535aa35b82fb6,1/10(金) 16:04
2025-01-11,09:27,domestic,国内,3,共同通信,8人中6人が頭にけが　法政大、ハンマー殴打疑い,https://news.yahoo.co.jp/articles/1e2f4e33a532f0ce0f21af67ad4b42fe73c4a00d,1/11(土) 5:00
2025-01-11,09:27,domestic,国内,4,産経新聞,講義中、無言でハンマー抜けるまで殴打　法大生の女「こんにちは、私は何もしていません」,https://news.yahoo.co.jp/articles/86eae0d0bd263aaec17b1194f25b9cbe50fe227d,1/10(金) 21:57
2025-01-11,09:27,domestic,国内,5,スポニチアネックス,法大で学生男女計8人をハンマーで殴打「グループから無視されて鬱憤が…」韓国籍の22歳女逮捕,https://news.yahoo.co.jp/articles/fe16962b63e9f199df5c53a1b148cbc894df19cc,1/10(金) 21:35
2025-01-11,09:27,domestic,国内,6,産経新聞,女学生が教室で机など「ガン」と叩く姿、学生らパニック　法大ハンマー殴打事件の映像入手,https://news.yahoo.co.jp/articles/9be6ae7e1f8fe6b583c914f18adb902c244e2bba,1/11(土) 8:24
2025-01-11,09:27,domestic,国内,7,読売新聞オンライン,沖縄県の米事務所、開設当時の県幹部ら「株式会社」知らず…委託業者に「丸投げ」で確認怠る,https://news.yahoo.co.jp/articles/77a20c341547e973890cdb6658b769331eff0114,1/11(土) 8:04
2025-01-11,09:27,domestic,国内,8,毎日新聞,税金滞納で差し押さえたエルメスの「ケリー」　公売で308万円から,https://news.yahoo.co.jp/articles/e30f8df4c458514704790549d425b14aa516df37,1/10(金) 21:42
2025-01-11,09:27,domestic,国内,9,信濃毎日新聞デジタル,湖面の氷がせり上がる「御神渡り」8年連続出現せずの古記録…本当に暖冬だった？　未解明の日本の冬、過去1000年の詳細を解析へ,https://news.yahoo.co.jp/articles/bee07c4c2315d78be9315877deaa9220d234d99f,1/11(土) 8:10
2025-01-11,09:27,domestic,国内,10,読売新聞オンライン,岩屋外相、トランプ次期大統領の就任式に出席へ…アメリカ側から招待状届く,https://news.yahoo.co.jp/articles/61bceba90b2d01246360da2f5cf0b38ef56b861b,1/11(土) 0:44
2025-01-11,09:27,domestic,国内,11,テレビ朝日系（ANN）,警察手帳を見せ郵便局から700万円“詐取”で起訴　警察官を懲戒免職処分　神奈川県警,https://news.yahoo.co.jp/articles/e488a3bbd1f6406e15fae9645e20dffc06774d22,1/10(金) 21:30
2025-01-11,09:27,domestic,国内,12,中日スポーツ,ケンタッキーフライドチキン「食べ放題」 1月14日から24日まで【全国353の実施店舗】をチェック！,https://news.yahoo.co.jp/articles/b73e217f7f0d04e3005b2188760d9372b2f435be,1/7(火) 15:16
2025-01-11,09:27,domestic,国内,13,京都新聞,東海道新幹線に一時遅れ　雪の影響で速度落とし運転,https://news.yahoo.co.jp/articles/e4b7e24280cf581d2a6cef6022515e97ced90252,1/11(土) 8:06
2025-01-11,09:27,domestic,国内,14,ABEMA TIMES,「授業中いきなり」「急にハンマーを振り回す感じだった」法政大ハンマー殴打 女を逮捕,https://news.yahoo.co.jp/articles/3b4f72a64df9671de1ee12322dbd7b5a9e9b30ff,1/11(土) 0:09
2025-01-11,09:27,domestic,国内,15,産経新聞,菅氏　カーター元米大統領の国葬参列　トランプ氏と接触なし　石破氏に関係構築の努力促す,https://news.yahoo.co.jp/articles/0230043cbe7228d4a423066341fd0edec2ad9acc,1/10(金) 8:54
2025-01-11,09:27,domestic,国内,16,京都新聞,名神高速道路の一宮ー栗東湖南が雪のため一時通行止め　北陸道の米原ー敦賀も,https://news.yahoo.co.jp/articles/ad5d7630fef1ce0a5174daa42d50bada1efdcaf0,1/11(土) 0:39
2025-01-11,09:27,domestic,国内,17,東海テレビ,ひっくり返りフロント大破…80代夫婦が乗った車がカーブで電柱に衝突 運転の夫が死亡し妻は意識不明の重体,https://news.yahoo.co.jp/articles/5ce30b9146db833df4a96ce901a6b533da967cc4,1/10(金) 17:13
2025-01-11,09:27,domestic,国内,18,読売新聞オンライン,郷土の偉人顕彰の神社、管理者不在で１５年間雨ざらし…「政教分離に抵触の恐れ」で町は動けず,https://news.yahoo.co.jp/articles/8d7fa1d82643ed9c946db8c7351dba3a2ae8f54f,1/11(土) 6:39
2025-01-11,09:27,domestic,国内,19,時事通信,「年収の壁」財源は中長期で　国民・古川代表代行インタビュー,https://news.yahoo.co.jp/articles/454d159040eb13838f59e46c1ebf1bc1da6ac37e,1/11(土) 7:06
2025-01-11,09:27,domestic,国内,20,読売新聞オンライン,志望大学には偏差値２０足りず、塾にも行けない…教育系YouTuber・葉一が見せた「逆転劇」,https://news.yahoo.co.jp/articles/a84cbd2c65216c06109d5f87bc0233287ed3a2a0,1/10(金) 10:00
2025-01-11,09:27,domestic,国内,21,弁護士JPニュース,「じぇじぇじぇ」「イイネ」「坂本龍馬」までも出願されていた… “公有財産語”を商標登録したい人たちの身勝手な思惑,https://news.yahoo.co.jp/articles/86cd6a68b6b0395abb0add9e0fbdc3f30d925243,1/11(土) 9:00
2025-01-11,09:27,domestic,国内,22,レスキューナウニュース,近鉄大阪線で人身事故 一部運転見合わせ,https://news.yahoo.co.jp/articles/70b975935eb70f852ec111c413db35ddcf74de15,1/10(金) 20:40
2025-01-11,09:27,domestic,国内,23,夕刊フジ,2年目の新NISAで考えるべきこと　「成長投資枠」で個別銘柄を買ってみたいなら…大型高配当銘柄を選んでインフレ対策,https://news.yahoo.co.jp/articles/abe076f8b37bbfbc2c19cf8a2d29e526368011e4,1/10(金) 17:00
2025-01-11,09:27,domestic,国内,24,朝日新聞デジタル,学校体育館のエアコン設置完了、5年前倒しへ　横浜市、避難所を想定,https://news.yahoo.co.jp/articles/df909128c056248c7a149b8c2e7f84ef5494b401,1/11(土) 7:00
2025-01-11,09:27,domestic,国内,25,J-CASTニュース,「献体写真騒動」麻生泰氏の息子が擁護「親父が一番倫理性がある」　「全然寝れてない」近況も明かす,https://news.yahoo.co.jp/articles/cce434b2378162f11ecac22f362fe3b0a6179f89,1/1(水) 16:53
2025-01-11,09:27,domestic,国内,26,共同通信,渋滞の原因？現役最古の路面電車が存続危機　インド・コルカタ、19世紀から運行,https://news.yahoo.co.jp/articles/1b67b429bd34d118ca659185116d5bfb0e094867,1/11(土) 8:00
2025-01-11,09:27,domestic,国内,27,TBS NEWS DIG Powered by JNN,神奈川・横須賀市で住宅全焼の火事　住人2人と連絡取れず,https://news.yahoo.co.jp/articles/deabead6f495ff6b975d32bed5aeb5355927ad66,1/11(土) 7:46
2025-01-11,09:27,domestic,国内,28,共同通信,自民片山参院議員が訪米へ　大統領就任式に出席予定,https://news.yahoo.co.jp/articles/c46d0222821bb9fcd033bf72ff845f4cebe38d50,1/10(金) 19:03
2025-01-11,09:27,domestic,国内,29,夕刊フジ,自民・森山幹事長〝ちゃぶ台返し〟発言に国民・玉玉木代表が激怒　「103万円の壁」引き上げで「取り過ぎの税金を国民に返せばいい」,https://news.yahoo.co.jp/articles/cf06ef6e142111a55b8cb292c75507b60047b595,1/10(金) 17:00
2025-01-11,09:27,domestic,国内,30,弁護士JPニュース,JT社員“うつで休職”後に就労可能と診断も「復職」認められず自動退職に　地位の確認求め会社を提訴,https://news.yahoo.co.jp/articles/3b3daf1e6948de0c31d0b32b2e4f6f1a1b897e3f,1/10(金) 12:39
2025-01-11,09:27,domestic,国内,31,ABCニュース,【ABC特集】「手取りで消費税込みで日給1万7000円くらいです。ガソリン代も個人負担」　Amazon宅配ドライバーの過酷な現実　“定額働かせ放題”に密着,https://news.yahoo.co.jp/articles/06073116e85f90911a3f718f6754c40ce27e9d54,1/1(水) 10:02
2025-01-11,09:27,domestic,国内,32,tenki.jp,3連休の道路影響予測　今日11日東北と北陸・中国地方　明日12日九州で影響「大」,https://news.yahoo.co.jp/articles/82c7a7f851b3c3ab3950eec6d065e905d558875d,1/11(土) 5:45
2025-01-11,09:27,domestic,国内,33,スポニチアネックス,トランプ次期大統領「LAは全滅だ!!!」　カリフォルニア州山火事でニューサム州知事らを痛烈批判,https://news.yahoo.co.jp/articles/e3ad2161cc1c8cbc10e8334294f64db4957cbe81,1/10(金) 10:48
2025-01-11,09:27,domestic,国内,34,産経新聞,法大ハンマー殴打、逮捕は韓国籍22歳女　学生100人の教室で殴る　8人けが頭部出血,https://news.yahoo.co.jp/articles/6038e27f3d36ffd99219a8a12f1a8427957798c8,1/10(金) 18:13
2025-01-11,09:27,domestic,国内,35,TBS NEWS DIG Powered by JNN,国力低下も外国人を引き寄せる求心力強める日本～WSJ紙の元東京支局長が在任10年を振り返る～【調査情報デジタル】,https://news.yahoo.co.jp/articles/32d878be47d4012ddf556e7efa8a93cf9ad06191,1/11(土) 9:02
2025-01-11,09:27,domestic,国内,36,よろず～ニュース,越年「103万円の壁」問題　玉木雄一郎氏、財源発言にウンザリ　自民・森山幹事長が「裏づけ」要求,https://news.yahoo.co.jp/articles/14d75636b2335e3f6b9b01cd503e08e9aafe0f3f,1/10(金) 17:33
2025-01-11,09:27,domestic,国内,37,日本農業新聞,移住「過去5年で最多」24県　田園回帰の流れ継続,https://news.yahoo.co.jp/articles/93ded572aac8a5941368f47662f091a8ea55a383,1/11(土) 8:30
2025-01-11,09:27,domestic,国内,38,tenki.jp,今日11日も日本海側では大雪に注意　ピークの過ぎた所もなだれや落雪などに注意,https://news.yahoo.co.jp/articles/33be09ba0192070b29a48519d5651719395dd546,1/11(土) 6:40
2025-01-11,09:27,domestic,国内,39,デイリースポーツ,堀江貴文氏　元日から「ひろゆきはアホ　フォロワーは輪をかけてアホ」顧客の金品盗んだ行員「無罪放免おかしい」投稿に,https://news.yahoo.co.jp/articles/ca22a6cdca3b0915c7f194067feff69f8b8c982f,1/6(月) 18:34
2025-01-11,09:27,domestic,国内,40,共同通信,盛岡で鳥インフル疑い　40万羽飼育の養鶏場,https://news.yahoo.co.jp/articles/03e1b998395ddd20787433690c5b8c44cab8bb74,1/10(金) 22:58
