scrp_date,scrp_time,genre_en,genre_jp,rank,media_jp,title,link,date_original
2024-01-28,15:19,life,ライフ,1,朝日新聞デジタル,試験直前にトイレ、なにかが違う…　地方から東大受験、「想定外」の連発,https://news.yahoo.co.jp/articles/7cd18ce40b284abd8b7e85db94d37b73d5f23b31,1/28(日) 12:06
2024-01-28,15:19,life,ライフ,2,LIMO,「3つで850円！」シャトレーゼの「ひとり用ケーキ」はコスパ最強。,https://news.yahoo.co.jp/articles/a91265a61fcd8b0d1fa45191c70b2a9b4289975c,1/28(日) 10:47
2024-01-28,15:19,life,ライフ,3,東京バーゲンマニア,コンビニいちごサンド食べ比べ！ファミマ・セブン・ローソン、いちごで満たされるのはどれ？,https://news.yahoo.co.jp/articles/4e860177e4d8374666b9e41c1b55c3db1c51e84d,1/28(日) 11:00
2024-01-28,15:19,life,ライフ,4,ねとらぼ,パパが0歳三つ子の同時寝かしつけに挑戦した結果……　必死さ伝わる奮闘劇が160万再生「1人でも大変なのに神」,https://news.yahoo.co.jp/articles/14b92f78e5d9e5774be9adc9f465145511073bb9,1/28(日) 10:00
2024-01-28,15:19,life,ライフ,5,ほ・とせなNEWS,旅行先で父に妊娠報告のサプライズ…！　「もらい泣きした」「素敵！」感動の瞬間をおさえた動画は375万回再生,https://news.yahoo.co.jp/articles/c13c875572253c33fadea696e3d2242f5aa4ae5e,1/28(日) 11:04
2024-01-28,15:19,life,ライフ,6,ねとらぼ,タンスの裏に謎の隙間……　理由を聞いて納得する“おばあちゃんの知恵”に「育児ベテランの発想」と反響,https://news.yahoo.co.jp/articles/8cc7763ad344fec3742dd0092ef74c9f4c2c829a,1/27(土) 21:00
2024-01-28,15:19,life,ライフ,7,まいどなニュース,目が合って、駆け寄ってきた子猫…抱き上げたら、しがみついて離れない！　大胆な甘えん坊は、そのまま“うちのにゃんこ”に,https://news.yahoo.co.jp/articles/80fde04b5ddbe8b80ad9267742fe969e9c2945e2,1/28(日) 14:20
2024-01-28,15:19,life,ライフ,8,まいどなニュース,北海道の離島で豪雪「朝ごはん買いに行くだけで命懸け」 →雪掻き分けコンビニへ→ネット民衝撃「無敵ライフライン」,https://news.yahoo.co.jp/articles/5db50b250bd8944cc16c1dbdcd69c2529a38148e,1/28(日) 7:10
2024-01-28,15:19,life,ライフ,9,ねとらぼ,スーパーで「アコヤ貝」を買ったら→真珠が入ってた！　「運がいい」「これはすごい」と驚きの声,https://news.yahoo.co.jp/articles/b3e2ebbf497d22572c178790a8eab332000f9d8f,1/28(日) 12:15
2024-01-28,15:19,life,ライフ,10,Hint-Pot,日本の安さにびっくり！　オーストラリア人三姉妹がすごいと思った　意外すぎる食べ物とは,https://news.yahoo.co.jp/articles/046eb5580554f01d1ff4e5f1df9102201f39a5f9,1/27(土) 8:10
2024-01-28,15:19,life,ライフ,11,ねとらぼ,暗くてボロボロな築152年の玄関が、たった3700円のDIYで……　明るく開放的に変化したビフォーアフターに「見違えるほどキレイ」,https://news.yahoo.co.jp/articles/d10b1269c3211a4622d6bbd32cf4819d1a3f00a9,1/26(金) 21:30
2024-01-28,15:19,life,ライフ,12,Hint-Pot,念願だった初来日　米国人が冬を選んだ2つの理由　街中で驚いた出来事とは,https://news.yahoo.co.jp/articles/790cc5fa1e8f29df48b906dd5637220e21f1bb1b,1/28(日) 8:10
2024-01-28,15:19,life,ライフ,13,ねとらぼ,1歳娘にリングガールをお願い→扉が開いた瞬間……　予想外の行動に「笑いをありがとう」「最高な思い出！」,https://news.yahoo.co.jp/articles/b351be84d3a5fc14760072c4631ad7316897dd21,1/28(日) 11:30
2024-01-28,15:19,life,ライフ,14,ほ・とせなNEWS,寝ている飼い主の上に乗るワンちゃんに「自由過ぎる」「もう笑うしかない」の声　この行動の理由を飼い主に聞いた,https://news.yahoo.co.jp/articles/e719f1961f224d862566700121a7c2fba5880db6,1/27(土) 15:15
2024-01-28,15:19,life,ライフ,15,ねとらぼ,雑草対策、春になったら手遅れかも！　ガーデナーが教える除草剤いらず＆草むしり不要の“生ごみ活用法”に「知らなかった」,https://news.yahoo.co.jp/articles/68903f7f4b7a7c7bbeaa092a1f783a803ac1c3f6,1/27(土) 9:00
2024-01-28,15:19,life,ライフ,16,まいどなニュース,中国人女子観光客「支払いでQR決済が使えない！」ピンチの結末に「かっこよすぎ」「日本のこと好きになってくれると良いですね」,https://news.yahoo.co.jp/articles/2eb0096f2ef6b372b70b44e8cb0fc5991b049704,1/28(日) 8:10
2024-01-28,15:19,life,ライフ,17,All About,石田ゆり子も炎上！ 緊急時の「動物愛護メッセージ」で絶対発信してはいけない“3つのNGワード”とは,https://news.yahoo.co.jp/articles/dd997d3c119632ddfd76f465be30ce650e2518ef,1/27(土) 21:05
2024-01-28,15:19,life,ライフ,18,まいどなニュース,収入が低くて、生活に余裕がない…それでも「新NISA」始めたほうがいいのでしょうか【FPが解説】,https://news.yahoo.co.jp/articles/c7d68881a1b96c41e65e8213020fe84f50ce97b6,1/27(土) 18:45
2024-01-28,15:19,life,ライフ,19,まいどなニュース,妻を追い詰めていませんか？「夫源病」を引き起こす10の禁句　離婚カウンセラーが解説,https://news.yahoo.co.jp/articles/9afe8394c6d334fa2ed716d4d568bab0027175dc,1/27(土) 11:00
2024-01-28,15:19,life,ライフ,20,ファイナンシャルフィールド,1人暮らしで毎日「サトウのごはん」を食べていますが、やはり「炊飯器」で炊くほうが節約になりますか？ すぐ食べられるのでコスパは良いと思うのですが…,https://news.yahoo.co.jp/articles/a8e0f9a0ff17367518e029e9c79f79701b9949aa,1/27(土) 11:20
2024-01-28,15:19,life,ライフ,21,クックパッドニュース,備えていても役に立たなかった… 能登半島地震・被災者が語る非常時の食「意外な盲点」,https://news.yahoo.co.jp/articles/6fbbaa939dc0592ddf8d97bb4e26e3fce4ded2f9,1/26(金) 13:00
2024-01-28,15:19,life,ライフ,22,まいどなニュース,「息子はどれだけライオンズが好きなのか…」小学校の漢字問題 “さいたま“をまさかの書き間違い、球団ファンからは「英才教育の賜物！」,https://news.yahoo.co.jp/articles/4f9f7962860d88f879529f2270eeebc098ca2e4a,1/28(日) 10:02
2024-01-28,15:19,life,ライフ,23,クックパッドニュース,関西人が言う「明日のパン」の意味って？他地域の人には通じない独自文化か,https://news.yahoo.co.jp/articles/19eac1865d6850efa5a3af54222b0888ebf2ecfa,1/27(土) 21:02
2024-01-28,15:19,life,ライフ,24,まいどなニュース,警察犬「お話、飽きたワン…」式典でだらけるエリート犬が可愛い「人間でもこういうのは飽きちゃうから…」,https://news.yahoo.co.jp/articles/d7160ca6db9fb8ec11148502954d4f9228dc56b3,1/28(日) 7:50
2024-01-28,15:19,life,ライフ,25,BuzzFeed Japan,【コメダ和喫茶】おかげ庵の「和風モーニング」がコスパ抜群でおいしい！ドリンク代だけでおにぎり＆味噌汁が付いてくるんです,https://news.yahoo.co.jp/articles/c36f480dbd525ddbf37369f7dbc8970c7cb616d8,1/28(日) 10:35
2024-01-28,15:19,life,ライフ,26,ねとらぼ,被災地で活動する災害救助犬に「危ないから靴をはかせてほしい」の声　派遣しているNPO法人の「はかない理由」に納得する人が続出,https://news.yahoo.co.jp/articles/0b8f17714b666e3fa65e46f61ab7afe48e5a7506,1/25(木) 11:30
2024-01-28,15:19,life,ライフ,27,よろず～ニュース,「子どもにさせて良かった習い事」ピアノ、英語を抑え1位が圧倒　理由は「体力底上げ」「授業で役立った」,https://news.yahoo.co.jp/articles/f99a7b354e785c19ad5e494ac3a58966216f5c25,1/28(日) 14:10
2024-01-28,15:19,life,ライフ,28,LIMO,【セリア新作】シマエナガが七味入れになりました！新作小皿がどれも素敵です！厳選3つ,https://news.yahoo.co.jp/articles/4a0a91c3b9090d1689cd7ceafc734e8bfd638a1f,1/26(金) 18:37
2024-01-28,15:19,life,ライフ,29,OTONA SALONE,東大生が授業をボイコット。1月に東大で起きていた学生ストライキ、教養学部で配られたビラに書かれていた訴えとは？,https://news.yahoo.co.jp/articles/4e1e251b63a2371fa6d485c4f8543cfe5a457ce6,1/27(土) 21:30
2024-01-28,15:19,life,ライフ,30,マイナビ子育て,「バチェラー」初代ヒロイン・蒼川愛がシングルマザーの道を選んだ理由。,https://news.yahoo.co.jp/articles/54ea8623aca76bb5ba5aa101b92041d2064fe835,1/27(土) 11:30
2024-01-28,15:19,life,ライフ,31,まいどなニュース,トイレタンクに紙ロール詰め込まれ、2フロア水びたし「損害額500万円以上」店が映像公表「名乗り出て」,https://news.yahoo.co.jp/articles/0fd691d030ca2a4a69f4d45f339cd019084090c6,1/27(土) 19:07
2024-01-28,15:19,life,ライフ,32,ファイナンシャルフィールド,友人が就寝中もエアコンを「つけっぱなし」にしているそうですが、贅沢すぎませんか？ 正直「よく電気代払えるな…」と感じてしまいしました…,https://news.yahoo.co.jp/articles/81179f8e71bca8c9926ae239f81aabf6ff1cca7f,1/28(日) 13:40
2024-01-28,15:19,life,ライフ,33,ファイナンシャルフィールド,宝くじで1等前後賞が当たりました。受け取る際に「税金」はかかりますか？,https://news.yahoo.co.jp/articles/bf765d4d287653c985c6e2a287368276679bb6d6,1/28(日) 13:50
2024-01-28,15:19,life,ライフ,34,婦人公論.jp,照ノ富士の9回目の優勝か、琴ノ若の初優勝か、二人の運命を握るのは綱とり危機の霧島と勝ち越しをかけた翔猿,https://news.yahoo.co.jp/articles/1df6828d7cc83971f63d8637cb2626027374895a,1/28(日) 14:09
2024-01-28,15:19,life,ライフ,35,ねとらぼ,「弟子入りさせて」の声が続出!!　80代一人暮らしの女性が公開した“1日1カ所”掃除テクが100万再生間近,https://news.yahoo.co.jp/articles/3814f193b0f35c6ea87db30402ead2b0523a5b13,1/26(金) 21:00
2024-01-28,15:19,life,ライフ,36,産経新聞,ヌードモデルは「ブルースの女王」か　朝ドラ「ブギウギ」が結びつけた２点の裸婦像と淡谷のり子,https://news.yahoo.co.jp/articles/55c6ad1f567ed586fd041c972ad25deffdc0cb48,1/27(土) 8:15
2024-01-28,15:19,life,ライフ,37,BuzzFeed Japan,GUの「新作ジャンパードレス」が上品デザインでオシャレ！ほっそり見えして、着心地もバツグンなんです,https://news.yahoo.co.jp/articles/bec4f51096feb90431adde28a04d298f83d579b4,1/28(日) 12:35
2024-01-28,15:19,life,ライフ,38,ねとらぼ,12歳差の仲良し兄弟、毎朝やる儀式に「なんですか、このキュン！」「ホントにカワイイ」と絶賛の声　愛あふれる光景に笑顔になる,https://news.yahoo.co.jp/articles/e1bcaf8bf240774937570904fbdec703f5d2df0f,1/28(日) 7:00
2024-01-28,15:19,life,ライフ,39,ファイナンシャルフィールド,会社の制服は、退職時に「クリーニングして返却」と言われました。もともと給与から「買い取り」として天引きされていたのですが、違法ではありませんか？ なんだか納得いきません…,https://news.yahoo.co.jp/articles/c9720e6beb962f9285a503d533e1edb4c74b949f,1/27(土) 13:50
2024-01-28,15:19,life,ライフ,40,ハフポスト日本版,全米が熱狂するスタンレーのメガタンブラーを入手。使って分かった大人気のワケ,https://news.yahoo.co.jp/articles/bfc402579e74c327c8bf1ee95e69121542da9222,1/28(日) 9:01
