scrp_date,scrp_time,genre_en,genre_jp,rank,media_jp,title,link,date_original
2023-12-11,17:23,sports,スポーツ,1,中日スポーツ,エンゼルスファン、大谷翔平を慰留できなかったオーナーへの怒り爆発「チームを売却しろ！」,https://news.yahoo.co.jp/articles/6cfd6962d92a9ab8da86a8a2a90b1919b85a524b,12/11(月) 12:33
2023-12-11,17:23,sports,スポーツ,2,RONSPO,衝撃事実発覚！「ギリギリまでドジャースは決断を知らなかった」大谷翔平の10年1015億円ド軍入り決定の裏で一体何が起きていたのか？,https://news.yahoo.co.jp/articles/b5be8e5201ec292ad514ebe97cc86ced5489dcbe,12/11(月) 6:03
2023-12-11,17:23,sports,スポーツ,3,日刊スポーツ,【広島】FA西川龍馬の人的補償名簿がオリックスから届く「将来か、今か」金銭補償の可能性も,https://news.yahoo.co.jp/articles/1e918e8c6debb617fba1f6aed9e20ebe742e9ac9,12/11(月) 15:24
2023-12-11,17:23,sports,スポーツ,4,スポーツ報知,第１００回箱根駅伝出場校の登録選手発表　駒大の唐沢拓海、青学大の志貴勇斗主将、東洋大の石田洸介らは無念の選外,https://news.yahoo.co.jp/articles/51a502e4d691fbb443c737a09b6def803b8db76d,12/11(月) 14:39
2023-12-11,17:23,sports,スポーツ,5,J-CASTニュース,元阪神28歳ドラ1右腕、現役ドラフトで「大化け」するか　元巨人コーチ期待「頻繁に起用されると思う」,https://news.yahoo.co.jp/articles/f67ab27aa89ccb3439044636fe213f77f7fa67f8,12/11(月) 15:43
2023-12-11,17:23,sports,スポーツ,6,スポーツ報知,【オリックス】山岡泰輔、１０００万円増の９０００万円でサイン　球団に珍要望「お風呂にテレビを」,https://news.yahoo.co.jp/articles/53ae96f5a5f99245d0b4f564d029309644d8a07b,12/11(月) 12:42
2023-12-11,17:23,sports,スポーツ,7,CoCoKARAnext,大谷翔平も決まり…日本のFA戦線最後の大物　山川穂高は宣言残留もある？　気になる「背番号問題」と「西武の現役ドラフトの選択」とは,https://news.yahoo.co.jp/articles/5eec715cad0eca51852c626943185fa0cdb49fb3,12/11(月) 11:57
2023-12-11,17:23,sports,スポーツ,8,e!Golf,「忘年会ですか？」 脇元華が永井花奈＆松田鈴英ら“同級生”集結のプライベートショットをお披露目,https://news.yahoo.co.jp/articles/9a4d24c5df78e7417aad641ec4164931d38b1d34,12/11(月) 16:10
2023-12-11,17:23,sports,スポーツ,9,スポーツ報知,大谷翔平の年俸、ほとんどが“後払い”に　総年俸枠に余裕出たことで山本由伸までドジャースが獲得の可能性も,https://news.yahoo.co.jp/articles/a043774097ba1f03105b5207ac21d6dbe0411615,12/11(月) 5:10
2023-12-11,17:23,sports,スポーツ,10,CoCoKARAnext,大谷翔平の退団余波　米ファンからトラウト移籍を望む声が相次ぐ「急いでリクエストするべき」,https://news.yahoo.co.jp/articles/dbb74a161c7b11a18c0d11a9a50bd03d258c95ec,12/11(月) 16:31
2023-12-11,17:23,sports,スポーツ,11,Full-Count,DeNA加入の佐々木千隼が入団会見「急でびっくり」　大魔神以来の佐々木姓に「恐縮です」,https://news.yahoo.co.jp/articles/15340bf60e9924986ea073ed70ba81dd7feecf3e,12/11(月) 14:04
2023-12-11,17:23,sports,スポーツ,12,Full-Count,ブルージェイズの提示額は「ドジャースと同じくらいだった」　大谷翔平を逃した舞台裏,https://news.yahoo.co.jp/articles/2bfbb35f397fb3ff5dc4d24676b338ce7d551a13,12/11(月) 13:01
2023-12-11,17:23,sports,スポーツ,13,Full-Count,大谷翔平加入に…ド軍ナインがチャットで狂喜乱舞　「クレイジーだった」獲得の瞬間,https://news.yahoo.co.jp/articles/01b72232c1782cd96155d679605b42bea2f0c8b1,12/11(月) 9:56
2023-12-11,17:23,sports,スポーツ,14,CoCoKARAnext,大谷翔平のドジャース加入に“陰謀論”が浮上 海外記者がブルージェイズ移籍騒動に疑念「オオタニたちが熱狂を演出した」,https://news.yahoo.co.jp/articles/4b3048be0a2c3ac7450c2b604b1ce4fd0228a9bb,12/11(月) 16:00
2023-12-11,17:23,sports,スポーツ,15,デイリースポーツ,阪神　才木が明かす岡田監督のカワイイ「試合中にベンチでウェーーーイって」大竹も「孫が立った時みたいに」,https://news.yahoo.co.jp/articles/499095d6967c12999cb1132cf18466c116fe442e,12/11(月) 16:07
2023-12-11,17:23,sports,スポーツ,16,ゴルフ総合サイト ALBA Net,3ツアー対抗戦で圧勝！　申ジエがJLPGA代表のチームメートとの食事風景を公開,https://news.yahoo.co.jp/articles/9af6bd80a909b3146d57fa7adb2b7dd278e42ea7,12/11(月) 16:13
2023-12-11,17:23,sports,スポーツ,17,デイリースポーツ,ソフトバンク戦力外の九鬼が入団会見　ＤｅＮＡ新加入で決意新た　いずれは森唯と１軍でバッテリー結成を,https://news.yahoo.co.jp/articles/4d28f477b2f6f743d2ab8551f319f8bcff874f14,12/11(月) 13:50
2023-12-11,17:23,sports,スポーツ,18,中日スポーツ,阪神が新入団発表、岡田監督は珍アドバイス「阪神ではマスコミにいらんこと言わないことが…」,https://news.yahoo.co.jp/articles/59c6d3bf7d1a8cb7cf236719c11cd51694378294,12/11(月) 16:14
2023-12-11,17:23,sports,スポーツ,19,西スポWEB OTTO！,「藤浪戻ってきたら18番か…」阪神の新入団選手たちの初々しい姿にファン「みんなタテジマ似合ってる」,https://news.yahoo.co.jp/articles/3c8dbcaadb6c9268ca9657de10ff2a92eb9a0d88,12/11(月) 16:31
2023-12-11,17:23,sports,スポーツ,20,スポニチアネックス,菊池涼介も注目する守備職人「広島のシャー君」とは？　野村謙二郎氏「すごかったね、あれ！」,https://news.yahoo.co.jp/articles/cd9027cf8e14f644852ae293f0bab4cebb04d9e5,12/11(月) 16:37
2023-12-11,17:23,sports,スポーツ,21,Full-Count,盟友トラウトは「トレードを要求すべき」　大谷翔平“流失”で溢れる全米ファンの訴え,https://news.yahoo.co.jp/articles/c481c486dea24f8d48341446f5cd1d457e08273e,12/10(日) 18:15
2023-12-11,17:23,sports,スポーツ,22,馬トク報知,ＪＲＡ７０周年で４８レース対象に「ＪＲＡウルトラプレミアム」　長澤まさみら続投も発表,https://news.yahoo.co.jp/articles/cdb75fc0878681694465015eb150bd4b62b65018,12/11(月) 14:59
2023-12-11,17:23,sports,スポーツ,23,Full-Count,日本ハム、26歳右腕ザバラを獲得　最速162キロ…新庄監督「ボールがめちゃくちゃ速い」,https://news.yahoo.co.jp/articles/12859e462dd2e5018b9c2c7c0e3e58459b6919d1,12/11(月) 13:04
2023-12-11,17:23,sports,スポーツ,24,日刊スポーツ,【阪神】ドラ１下村海翔が入団会見「19番は下村と言ってもらえるよう」強気投球で地元わかす,https://news.yahoo.co.jp/articles/168c8fab1d9b7ea150c284f64e14845ddd5eef19,12/11(月) 15:40
2023-12-11,17:23,sports,スポーツ,25,中日スポーツ,ヤンキース、山本由伸へ438億円提示も 「他にもメッツとドジャースがビッグ・プレーヤー」三つどもえの争いか,https://news.yahoo.co.jp/articles/6573bb57b8fa35f9cc98f81b57c19ce86ec187a9,12/11(月) 16:03
2023-12-11,17:23,sports,スポーツ,26,東スポWEB,大谷翔平に米メディア「エンゼルスに６年間甘やかされてきた」「孤独の一部を放棄する」,https://news.yahoo.co.jp/articles/dcaaee18e4cc1c29b881a14e457b22f164429cfd,12/10(日) 16:11
2023-12-11,17:23,sports,スポーツ,27,スポニチアネックス,ドジャースが大谷翔平＆山本由伸の“1450億円”補強か…米記者「両獲りの可能性はある」,https://news.yahoo.co.jp/articles/ccc146ff613fb0b9caad206bc036283b2d1c53a6,12/11(月) 15:09
2023-12-11,17:23,sports,スポーツ,28,産経新聞,今オフの本命・大谷翔平の去就決定でＦＡ市場が本格化　山本由伸は４３０億円超の可能性も,https://news.yahoo.co.jp/articles/a5d4f75abbf8cd124442ffcb122ffed4e64a2db8,12/11(月) 14:45
2023-12-11,17:23,sports,スポーツ,29,中国新聞デジタル,サンフレッチェ広島、ユースVS青森山田高の判定巡り質問状提出へ　オウンゴール直前のプレー問題視,https://news.yahoo.co.jp/articles/61c7ef567c9d13ed1a4a029c908a4acc6c3d16d1,12/11(月) 15:06
2023-12-11,17:23,sports,スポーツ,30,東スポWEB,五十嵐亮太氏　大谷翔平１０１５億円契約の分割後払いに「税金にビックリするのは薄れる」,https://news.yahoo.co.jp/articles/1eb1b63a38546c4c66e450c4459d31c6541ecbf7,12/11(月) 12:11
2023-12-11,17:23,sports,スポーツ,31,月刊陸上競技,【箱根駅伝エントリー】史上初の快挙に王手の駒大 主将・鈴木芽吹、篠原倖太朗、佐藤圭汰ら順当に登録！唐澤拓海は外れるも豪華メンバー勢ぞろい,https://news.yahoo.co.jp/articles/43e0ddf43076c5114e40f20b7731d7bd78a6197b,12/11(月) 14:47
2023-12-11,17:23,sports,スポーツ,32,スポーツ報知,第１００回箱根駅伝に向けて青学大の原晋監督が「負けてたまるか！大作戦」発令　絶対王者の駒大に挑む,https://news.yahoo.co.jp/articles/8d2ba9c489c942c625a224937d977294cdf21651,12/11(月) 15:42
2023-12-11,17:23,sports,スポーツ,33,スポニチアネックス,阪神・岡田監督　新人8選手に虎戦士の“心得”伝授「マスコミに好かれること、いらんこと言わんこと」,https://news.yahoo.co.jp/articles/6cb9e44ba41870198eacf93af7b21ca8fbbf04de,12/11(月) 13:46
2023-12-11,17:23,sports,スポーツ,34,e!Golf,吉田優利が渋野日向子との“食事会”ショットを大公開 「終始爆笑でした」と日本での再会に反響続々,https://news.yahoo.co.jp/articles/eaf91c1a1f1bfa89ea193cdd913dbc3abab810ec,12/11(月) 11:56
2023-12-11,17:23,sports,スポーツ,35,日テレNEWS NNN,「まさか離れませんよね！？」移籍決定の大谷翔平　“相棒”水原通訳の去就が話題に,https://news.yahoo.co.jp/articles/4cf930c3d67b3cc7c975e04590afd4ba2702aa97,12/10(日) 18:25
2023-12-11,17:23,sports,スポーツ,36,東スポWEB,【Ｆ１】角田裕毅が米放送局の今季トップ１０ドライバーに選出「最も成長したドライバー」,https://news.yahoo.co.jp/articles/f4fbd5e5179047f69ab754df6f35fe5e5c710667,12/11(月) 15:46
2023-12-11,17:23,sports,スポーツ,37,西スポWEB OTTO！,「そのまま履いて帰っちゃいました」中日の上林誠知が〝一目惚れ〟したスニーカーとは…　ファン「同じの欲しいなぁ…」,https://news.yahoo.co.jp/articles/54e6419ac23a9fed2199a4b7e32b9a612e3ac2eb,12/11(月) 15:40
2023-12-11,17:23,sports,スポーツ,38,スポーツ報知,マンＵ、ウルグアイ代表ＤＦアラウホ獲得か　バルサＣＢに給料倍増オファー！,https://news.yahoo.co.jp/articles/03aa90fddfbd3a408718304f078f632e993834da,12/11(月) 16:21
2023-12-11,17:23,sports,スポーツ,39,Full-Count,衝撃のポルシェ2475台、国民全員にうまい棒66本…　大谷翔平、異次元過ぎる1015億円の価値,https://news.yahoo.co.jp/articles/6cc2125b8b455dcd5c3f91aea40db308fcd792ed,12/11(月) 16:37
2023-12-11,17:23,sports,スポーツ,40,スポニチアネックス,JRA　100分の1秒単位の時計表示「技術的には可能」も「必要性を感じない」,https://news.yahoo.co.jp/articles/bf477be06e6f0851389536430f61a18eebe7baaf,12/11(月) 14:53
