scrp_date,scrp_time,genre_en,genre_jp,rank,media_jp,title,link,date_original
2025-07-04,20:06,sports,スポーツ,1,東スポWEB,ドジャースが離脱マンシーの後釜として超大物を獲得か　米メディアが衝撃トレード報じる,https://news.yahoo.co.jp/articles/76557453954423b9047c2877dd22706e7669acd6,7/4(金) 16:41
2025-07-04,20:06,sports,スポーツ,2,スポニチアネックス,巨人が1カ月ぶり3捕手制に戻る　猛暑で内野手にコンディション不良続出　大城卓三が今季2度目抹消,https://news.yahoo.co.jp/articles/af5c3dfb453ccf4a6c12e7be0d5049e9a81ce938,7/4(金) 16:19
2025-07-04,20:06,sports,スポーツ,3,デイリースポーツ,瓜田純士「これが最後」ＢＤ引退を宣言　自身の存在が「気を使わせてしまっている」溝口氏の「損得で動いている」には「そんなこと言われて居れないでしょ」,https://news.yahoo.co.jp/articles/48904b22038142132034ec45a830c28485a8481b,7/4(金) 15:17
2025-07-04,20:06,sports,スポーツ,4,Full-Count,大谷翔平の凡退直後…ド軍本拠地が揺れた瞬間「やばい泣ける」　LAファンが待ち望んだ“20秒”,https://news.yahoo.co.jp/articles/1aeecd2b7dbae0654e3bcefaf82e3573258a82b4,7/4(金) 16:45
2025-07-04,20:06,sports,スポーツ,5,日刊スポーツ,【陸上】17歳の久保凛が女子800ｍ決勝進出「世界陸上に出場する目標を必ず…」日本選手権,https://news.yahoo.co.jp/articles/c1f7891787fb27ee18e948dd68211e3e15a11c85,7/4(金) 18:40
2025-07-04,20:06,sports,スポーツ,6,時事通信,19歳の坂野旭飛選手死去　スキージャンプ,https://news.yahoo.co.jp/articles/0afde99d5a284a85eb522ad1ed07b61be6a972ce,7/3(木) 12:10
2025-07-04,20:06,sports,スポーツ,7,ENCOUNT,プロレスラー、口座残高を堂々公開「1億ぶち込みます」　ファンに衝撃「正に超人！」,https://news.yahoo.co.jp/articles/5f8953ce3a796c67d2f405618fc7c20ec6b9c0fe,7/4(金) 17:05
2025-07-04,20:06,sports,スポーツ,8,デイリースポーツ,阪神　両手を重ね合わせて祈る近本の姿がＳＮＳで話題に「女子マネやん」「完全に乙女」「祈り届いたね」「これ泣いた」,https://news.yahoo.co.jp/articles/33903039ee17cc5c7aded46d616fa59d32493b22,7/4(金) 16:17
2025-07-04,20:06,sports,スポーツ,9,スポーツ報知,ダルビッシュ有、イブニングドレスの妻・聖子さんとピタリ寄り添うラブラブショットがステキ…球団が公開,https://news.yahoo.co.jp/articles/b57280de67fa2ac90a4cf84b81663775e93287fe,7/4(金) 12:40
2025-07-04,20:06,sports,スポーツ,10,スポニチアネックス,パドレス・ダルビッシュ　日本時間7日レンジャーズ戦で先発復帰浮上　指揮官「可能性はある」,https://news.yahoo.co.jp/articles/46c830149fbca8ecaf402ea53cc68325f20bb5d3,7/4(金) 18:43
2025-07-04,20:06,sports,スポーツ,11,Full-Count,大谷翔平がまたも“悪ガキ”発動　餌食になった24歳同僚…思わず苦笑「とんでもねぇ畜谷」,https://news.yahoo.co.jp/articles/bed9c6aa6b58ea2e4c2eb9121e344aa02e1f13f5,7/4(金) 18:33
2025-07-04,20:06,sports,スポーツ,12,デイリースポーツ,どうした？広島・小園が打席途中に駆け足でベンチ裏に下がる　再登場時には巨人ベンチ、山崎らに何度も頭下げる,https://news.yahoo.co.jp/articles/279d528d9f92ca5e4f6bace868f405d1ef77ce2b,7/4(金) 18:57
2025-07-04,20:06,sports,スポーツ,13,スポーツ報知,サニブラウンがまさかの予選敗退　全治３週間の骨挫傷…日本選手権,https://news.yahoo.co.jp/articles/e01f68ceb339251c5e763b3b0a18b9efce64f838,7/4(金) 16:17
2025-07-04,20:06,sports,スポーツ,14,デイリースポーツ,「彼女はとってもかわいい」ドジャース戦で始球式の人気女優に反響　米ドラマ版でナミ役　山本由伸も笑顔で握手,https://news.yahoo.co.jp/articles/a19578057d929a9ede094d440877057657a0299f,7/4(金) 15:23
2025-07-04,20:06,sports,スポーツ,15,西スポWEB OTTO！,ソフトバンク小久保監督、大胆打順変更前に異例の〝個人面談〟　中軸の一人一人に説明,https://news.yahoo.co.jp/articles/cfe73a0a7a17256b03cbf6a6c0547c8e429ed575,7/4(金) 17:34
2025-07-04,20:06,sports,スポーツ,16,デイリースポーツ,阪神　大山が約１年ぶりにスタメン外れる　ヘルナンデスが「５番・一塁」,https://news.yahoo.co.jp/articles/31b56476b375d0475b87a143f2c8b422a2f4cffc,7/4(金) 17:26
2025-07-04,20:06,sports,スポーツ,17,Full-Count,また味わわされた大谷翔平の“爆速”　シカゴ実況が脱帽「もう一度言いますが、速すぎです」,https://news.yahoo.co.jp/articles/4bcbe6fde92192c78417cb2ddb55c15626a6604a,7/4(金) 13:19
2025-07-04,20:06,sports,スポーツ,18,日刊スポーツ,【中日】激震！28Ｓの絶対的守護神・松山晋也が上肢のコンディション不良で登録抹消,https://news.yahoo.co.jp/articles/5a765015c4b7d77d13d8b3e98172a682607ad86f,7/4(金) 16:07
2025-07-04,20:06,sports,スポーツ,19,CoCoKARAnext,「10回中10回は併殺にできるはずだが…」Wソックス投手が舌を巻いた大谷翔平の“異次元スピード” サヨナラ負けから一夜明け「信じられない」,https://news.yahoo.co.jp/articles/5b5c275866f095c989079c79df32247d30d53959,7/4(金) 18:50
2025-07-04,20:06,sports,スポーツ,20,Full-Count,元阪神右腕が争奪戦に？　成績は平凡も…市場では高評価「複数から連絡あるはず」,https://news.yahoo.co.jp/articles/d37f6a8601791318db6c2d8faafa3eb7df38f0cf,7/4(金) 17:43
2025-07-04,20:06,sports,スポーツ,21,GOAL,バルサ移籍は破談…スペイン代表FWニコ・ウィリアムズが2035年まで契約延長,https://news.yahoo.co.jp/articles/4f398065e0ccf28e50760b4bfd754021c0929cba,7/4(金) 18:16
2025-07-04,20:06,sports,スポーツ,22,CoCoKARAnext,再始動した二刀流は「普通じゃない」　元MLB投手が指摘する大谷翔平の“懸念”「彼を失えば、ドジャースは『最強』とは言えない」,https://news.yahoo.co.jp/articles/3a469c0f3aab813a9b1b3f497a5e14bfae8e7af9,7/4(金) 11:02
2025-07-04,20:06,sports,スポーツ,23,スポニチアネックス,サッカー豪州リーグ　賭博容疑で逮捕・起訴が報じられた日本人選手が退団　クラブが発表,https://news.yahoo.co.jp/articles/ebf17a846bbf95b28dfb172b4ff106f32c742458,7/4(金) 16:44
2025-07-04,20:06,sports,スポーツ,24,ABEMA TIMES,大谷翔平、“爆速”ホームインの瞬間　異次元のスピードでファンを圧倒「足はやっ！」「この走塁はエグい」,https://news.yahoo.co.jp/articles/6284c64bb912f6dcb6e5af233e4f87769fed3cb3,7/4(金) 17:02
2025-07-04,20:06,sports,スポーツ,25,中日スポーツ,日本代表DFの冨安健洋がアーセナル退団へ　英BBC「契約解除でクラブ側と合意」昨季の出場はわずか6分間,https://news.yahoo.co.jp/articles/dd18f0ec7e55a0483ef780ab7965c2fa952f5a37,7/4(金) 17:56
2025-07-04,20:06,sports,スポーツ,26,TopNews,フェルスタッペン、信頼も限界？移籍説に拍車「なぜキミと仲良しなのか？」残留派「メルセデスの結果を見ろ」,https://news.yahoo.co.jp/articles/f173ba89c2f896e9155ed67cf47fa9924a36d8d9,7/4(金) 17:30
2025-07-04,20:06,sports,スポーツ,27,ゴルフ総合サイト ALBA Net,吉本ここねが単独首位で決勝へ　桑木志帆ら2位、佐久間朱莉は19位,https://news.yahoo.co.jp/articles/6a3aaaa4ad1ba05f38fd1dc4cff7fe237462006c,7/4(金) 18:08
2025-07-04,20:06,sports,スポーツ,28,日刊スポーツ,【阪神】前日３安打の大山悠輔が77戦目初ベンチスタート　練習は参加、ヘルナンデス一塁／スタメン,https://news.yahoo.co.jp/articles/6e5e0305bf2b79c17c8ace3b4bfb561fbb677934,7/4(金) 17:30
2025-07-04,20:06,sports,スポーツ,29,サッカーキング,チェルシーFWペドロ・ネト、ジョッタ訃報で練習欠席…CWC準々決勝の出場可否は本人の決断次第に,https://news.yahoo.co.jp/articles/884352efe894b19a65f9932dcfb345e0688c11b9,7/4(金) 18:59
2025-07-04,20:06,sports,スポーツ,30,Full-Count,大谷の背後にズラリ…ド軍戦の中継で“珍光景”「たくさんおる」　いつもと違う客席に注目,https://news.yahoo.co.jp/articles/a07c66f08584e02e4bfc89d277a255d70087ccc8,7/4(金) 12:40
2025-07-04,20:06,sports,スポーツ,31,J-CASTニュース,なぜ巨人は阪神に3連敗を喫したのか　識者が指摘する大きな違い...「巨人は流れを自分たちで切っている」,https://news.yahoo.co.jp/articles/8a6b6520925b77d9fd5ee4ace1dc2c1d8f77c915,7/4(金) 14:22
2025-07-04,20:06,sports,スポーツ,32,デイリースポーツ,ＤｅＮＡ・牧は敵チームにも人気者？阪神選手と次々交流　デュプランティエとも談笑,https://news.yahoo.co.jp/articles/b31d0c40704aec15bae22915ee84723cac8e3753,7/4(金) 16:45
2025-07-04,20:06,sports,スポーツ,33,REAL SPORTS,J1最下位に沈む名門に何が起きた？ 　横浜F・マリノス守護神が語る「末期的」危機の本質,https://news.yahoo.co.jp/articles/25a5c3c9f4ab3df75a4eb0d8c3204480a31e05a4,7/4(金) 16:01
2025-07-04,20:06,sports,スポーツ,34,J-CASTニュース,最下位低迷のロッテ...次期監督に注目が　内部昇格か？外部招聘か？名前が挙がる「有力候補」,https://news.yahoo.co.jp/articles/2bd26fe97da120307513c2adcd0b486cf8b1ed96,7/4(金) 13:51
2025-07-04,20:06,sports,スポーツ,35,デイリースポーツ,一斉風靡の人気者登場にエスコン騒然　大きなリボン、美脚露わのミニスカ姿で豪快Ｆピッチ　ノーバンならずも観客魅了「めっちゃ緊張しました」,https://news.yahoo.co.jp/articles/eb9f23de16da6e4f9117de6bd353cce207f29bfa,7/4(金) 17:58
2025-07-04,20:06,sports,スポーツ,36,GOAL,Jリーグ、ジョタの急逝を受けて声明を発表,https://news.yahoo.co.jp/articles/2f2458752eb02655afd878ea9b048aa81cad4483,7/4(金) 19:05
2025-07-04,20:06,sports,スポーツ,37,デイリースポーツ,男子１００ｍで波乱　Ｖ候補柳田大輝がフライングで失格　まさかの予選落ちに涙「なにもないっす。スタートすらできなかったので」号砲前に前のめりに崩れる「冷静さを欠いてしまった」,https://news.yahoo.co.jp/articles/6dc33c47e7c4de1d096206b82e10ff8f27a396e5,7/4(金) 16:05
2025-07-04,20:06,sports,スポーツ,38,GOAL,遠藤航、急逝したチームメイトのジョタとアンドレを追悼「気持ちの整理をするのがまだ難しいですが…」,https://news.yahoo.co.jp/articles/a7408d2eda99d72055ea69e4604f747f1c004f59,7/4(金) 19:27
2025-07-04,20:06,sports,スポーツ,39,GOAL,交通事故で急逝のジョタ、飛行機移動を避けるよう勧告されていた模様…リヴァプールは背番号「20」を不滅の番号に,https://news.yahoo.co.jp/articles/44a20d0a814cf236f5db1ba1aa9bb6adb2af657a,7/4(金) 11:41
2025-07-04,20:06,sports,スポーツ,40,スポニチアネックス,グリズリーズのエースが“弟分”河村勇輝へメッセージ！ファン感動「最高に良い奴」「泣ける」,https://news.yahoo.co.jp/articles/c320821ed407c6fba17b192ca672491afa033959,7/4(金) 18:20
