scrp_date,scrp_time,genre_en,genre_jp,rank,media_jp,title,link,date_original
2025-03-01,15:08,world,国際,1,産経新聞,欧州各国、米との会談決裂のゼレンスキー氏支持を表明　「侵略者はロシア」と仏大統領,https://news.yahoo.co.jp/articles/25fa8551bdeb9b7442338ec66650e64a7c282993,3/1(土) 6:59
2025-03-01,15:08,world,国際,2,ＡＦＰ＝時事,トランプ氏、大統領執務室でゼレンスキー氏と衝突「強く出過ぎ」,https://news.yahoo.co.jp/articles/652d66701d0d452496b4259d2168774aa66f1ec5,3/1(土) 9:46
2025-03-01,15:08,world,国際,3,共同通信,トランプ大統領、怒りで顔赤く　雰囲気一変、緊迫の会談,https://news.yahoo.co.jp/articles/b1a4441872a7125360ad9ef374991331892de572,3/1(土) 6:38
2025-03-01,15:08,world,国際,4,TBS NEWS DIG Powered by JNN,【速報】トランプ大統領　ゼレンスキー氏は「プーチン氏についてあれこれ言う必要はない」と会談終え不快感,https://news.yahoo.co.jp/articles/c9b74985989c3c67b122f98eedfb26148cd01573,3/1(土) 8:03
2025-03-01,15:08,world,国際,5,CNN.co.jp,米ウクライナ首脳会談で激しい応酬、ゼレンスキー氏は退出を命じられる　何が起きたのか,https://news.yahoo.co.jp/articles/1a69ded2879f5759ca8cdb503387462bdcf9d6fb,3/1(土) 9:39
2025-03-01,15:08,world,国際,6,毎日新聞,和やかな雰囲気が一変　口論のきっかけは米副大統領の一言,https://news.yahoo.co.jp/articles/00af16f0df2219653b62c334706cdc5927d1aca8,3/1(土) 10:20
2025-03-01,15:08,world,国際,7,共同通信,「英だけでロシアと戦える？」　トランプ氏、英首相が口ごもる,https://news.yahoo.co.jp/articles/3a3a4fc23fe5c67177c61904514f0aba67b54ad6,2/28(金) 8:34
2025-03-01,15:08,world,国際,8,ロイター,情報ＢＯＸ：米ウクライナ決裂、米議員の反応さまざま　「無礼」「米国の恥」,https://news.yahoo.co.jp/articles/295694574b0c33858a4ce852839d74a0622ddc04,3/1(土) 10:46
2025-03-01,15:08,world,国際,9,産経新聞,「お前たちは勝てない」とトランプ氏　米ウクライナ首脳会談が決裂、記者団を前に口論も,https://news.yahoo.co.jp/articles/7e95796f232886847f3ed6c81d13436da7f292c5,3/1(土) 5:14
2025-03-01,15:08,world,国際,10,時事通信,蜜月演出一転、激しい応酬　バンス副大統領の「無礼」発言きっかけ　米ウクライナ首脳会談,https://news.yahoo.co.jp/articles/f73f5a1d0c2cb2c1b05954bb672dcdc50126b4be,3/1(土) 6:00
2025-03-01,15:08,world,国際,11,中央日報日本語版,内縁の男の子ども産んで売り渡し…児童１７人誘拐した中国死刑囚の最期,https://news.yahoo.co.jp/articles/c97469c00eee9b52005497246715711c428f6c5d,3/1(土) 11:50
2025-03-01,15:08,world,国際,12,時事通信,米大統領、ゼレンスキー氏の服装やゆ　親トランプの米記者も加担,https://news.yahoo.co.jp/articles/f8d8a02a0b5bbce98430baa47a39abea8fbb10e0,3/1(土) 14:13
2025-03-01,15:08,world,国際,13,BBC News,【解説】トランプ氏とゼレンスキー氏の対立　NATOにとって一大危機,https://news.yahoo.co.jp/articles/6bf2c3a5865f23251990042df64d5ff32a8234c0,3/1(土) 13:54
2025-03-01,15:08,world,国際,14,TBS NEWS DIG Powered by JNN,トランプ氏とゼレンスキー氏“物別れ”受け　ヨーロッパ首脳らは改めて結束呼びかけ「支援してきたことは正しいことだ」,https://news.yahoo.co.jp/articles/d0f2e1179f9dec1c1d612dff892ab813ede81fad,3/1(土) 6:56
2025-03-01,15:08,world,国際,15,共同通信,ロシア高官「これは有益」　米ウクライナ首脳口論で,https://news.yahoo.co.jp/articles/2edb6adb498d908305b27bfd8e5843890a73ef07,3/1(土) 5:08
2025-03-01,15:08,world,国際,16,CNN.co.jp,「ゼレンスキー氏は謝罪すべき」、ルビオ国務長官が発言　米ウクライナ首脳会談受け,https://news.yahoo.co.jp/articles/ffd49bbb385cf0ac3c9cbc7f69972bafd7dfecf1,3/1(土) 13:35
2025-03-01,15:08,world,国際,17,時事通信,ロシア、不和を最大限利用　苦境ウクライナに攻勢も,https://news.yahoo.co.jp/articles/af4a46e280503b6d9ac0a3bdc3c8b40f2e33a791,3/1(土) 14:14
2025-03-01,15:08,world,国際,18,時事通信,ウクライナ支援の停止検討　米政権、会談決裂受け　報道,https://news.yahoo.co.jp/articles/c56445218e7a561802052acd058dd1aaee30ecf2,3/1(土) 8:36
2025-03-01,15:08,world,国際,19,時事通信,米政権幹部、トランプ大統領の対応を一斉礼賛　民主党「二流のマフィア」と非難,https://news.yahoo.co.jp/articles/34cbb541a11c99c0c27672d341e01116135b6eb0,3/1(土) 13:01
2025-03-01,15:08,world,国際,20,BBC News,ホワイトハウスで激しい口論　ウクライナとアメリカ大統領の間で何が,https://news.yahoo.co.jp/articles/acf1be1d1ca49bb92be232647268b3cc52e13d26,3/1(土) 9:32
2025-03-01,15:08,world,国際,21,TBS NEWS DIG Powered by JNN,トランプ大統領　ロシア掌握のウクライナ領土返還を交渉する考え示す,https://news.yahoo.co.jp/articles/554d2cf787a1ff17e5458561fed9761d016ad88a,2/28(金) 6:01
2025-03-01,15:08,world,国際,22,読売新聞オンライン,俳優のジーン・ハックマンさんとピアニストのベッツィ・アラカワさん夫妻死亡、毒物使用か,https://news.yahoo.co.jp/articles/d199cd3af98772419384b4455163fd578bbbede0,2/28(金) 10:25
2025-03-01,15:08,world,国際,23,中央日報日本語版,トランプ大統領「ウクライナ終戦協議に近接」…ゼレンスキー大統領「殺人者に譲歩できない」,https://news.yahoo.co.jp/articles/c67b6486778bddbb74fe12d1007bdb0f53c51d91,3/1(土) 13:09
2025-03-01,15:08,world,国際,24,BuzzFeed Japan,【エッホエッホ】走るフクロウの赤ちゃんの元ネタは？ SNSで大流行の写真は2021年にオランダで撮影されていた,https://news.yahoo.co.jp/articles/3ac5d8d1dfa78cd7fa9555a0b62d20c8d4f00a79,2/28(金) 11:55
2025-03-01,15:08,world,国際,25,朝日新聞,米俳優ジーン・ハックマンさん、発見9日前には死亡か 地元警察発表,https://news.yahoo.co.jp/articles/694285961b127cc11fad333e9102084250624456,3/1(土) 13:56
2025-03-01,15:08,world,国際,26,読売新聞オンライン,トランプ氏に期待したゼレンスキー氏の計算狂う、亀裂は決定的…支援停止なら戦闘継続「夏まで」との見方,https://news.yahoo.co.jp/articles/fb28dd540ab5d6b4b821531c310063b164ee6e89,3/1(土) 11:41
2025-03-01,15:08,world,国際,27,時事通信,「トランプ氏、同志にあらず」　ウクライナ巡り亀裂深刻　前仏大統領,https://news.yahoo.co.jp/articles/b9f24ea8f9e9512bb72d3eee18934afffff879eb,2/28(金) 19:38
2025-03-01,15:08,world,国際,28,中央日報日本語版,捕虜の北朝鮮兵「ロシアに行くことも知らず…命令なので戦った」,https://news.yahoo.co.jp/articles/ce1282513aeaa34ae4cb8ebee471002afde07d5e,3/1(土) 13:46
2025-03-01,15:08,world,国際,29,ＡＦＰ＝時事,コンゴで原因不明の病気、中毒の疑い WHO,https://news.yahoo.co.jp/articles/7e831687be0b69229dae589d8f9de3adfde37aae,3/1(土) 9:37
2025-03-01,15:08,world,国際,30,ＡＦＰ＝時事,ゼレンスキー氏を殴らず「自制心」発揮 ロシア、トランプ氏を称賛,https://news.yahoo.co.jp/articles/2ca9d0e9b03797cdc24ce305dd100e39beca9ffb,3/1(土) 10:07
2025-03-01,15:08,world,国際,31,産経新聞,「餌に食いつくな」米議員の事前忠告奏功せずヒートアップ　米ウクライナ会談の舞台裏,https://news.yahoo.co.jp/articles/95234d1b849400f4df77ad5f7aa4eeee3d29fce3,3/1(土) 11:39
2025-03-01,15:08,world,国際,32,ロイター,米ウクライナ首脳会談決裂、激しい口論　鉱物協定署名せず,https://news.yahoo.co.jp/articles/8b360c4f75754144e74c8a3ce929b16a3f0c4a36,3/1(土) 2:07
2025-03-01,15:08,world,国際,33,読売新聞オンライン,トランプ氏「あなたは第３次世界大戦を賭けたギャンブルしている」…首脳会談での口論やり取り,https://news.yahoo.co.jp/articles/b60d92b36685a37e7cb3f6580983c1e0b2386a7f,3/1(土) 11:46
2025-03-01,15:08,world,国際,34,朝鮮日報日本語版,金融機関をだまして違法融資受けた共に民主・梁文錫議員、一審で当選無効相当の判決,https://news.yahoo.co.jp/articles/e5c97813f760f3cd87c19defcab366b9842b8bc7,3/1(土) 14:05
2025-03-01,15:08,world,国際,35,CNN.co.jp,ゼレンスキー氏、トランプ氏に謝罪する必要なし　首脳会談後のインタビュー,https://news.yahoo.co.jp/articles/cd935ca5e12ed3a21718a0e56c38ad0b7bb232d6,3/1(土) 14:18
2025-03-01,15:08,world,国際,36,時事通信,ウクライナ、根深い不信　トランプ氏は個人的恨みも,https://news.yahoo.co.jp/articles/e99495c6367c4c38f45c1e41262876b9e9a3c0b7,3/1(土) 13:01
2025-03-01,15:08,world,国際,37,読売新聞オンライン,トランプ氏、台湾有事の対応「コメントしない」…中国が「武力統一」の好機とみなす危険性も,https://news.yahoo.co.jp/articles/08880f9eecff517e2fd36414b8a32824fd7335d3,2/27(木) 18:15
2025-03-01,15:08,world,国際,38,共同通信,味方をしてほしいとゼレンスキー氏,https://news.yahoo.co.jp/articles/d748569720cca2b32a343c32982f9c974b0898dd,3/1(土) 9:25
2025-03-01,15:08,world,国際,39,TBS NEWS DIG Powered by JNN,【速報】トランプ大統領「無礼だ」報道陣のカメラの前でゼレンスキー大統領を声を荒げて批判 “ロシア寄り懸念”に猛反発で口論に,https://news.yahoo.co.jp/articles/8d25088252a14ac1ffd56ffda5ed017b704b1f3d,3/1(土) 3:08
2025-03-01,15:08,world,国際,40,中央日報日本語版,血を吐いてから４８時間後に死亡…コウモリを食べて１カ月で５３人が死亡＝コンゴ,https://news.yahoo.co.jp/articles/0a3eecc2972de36bac8033e1a5cf2756ed3728ef,2/27(木) 9:09
