scrp_date,scrp_time,genre_en,genre_jp,rank,media_jp,title,link,date_original
2024-07-29,20:05,sports,スポーツ,1,日刊ゲンダイDIGITAL,パリ五輪女子柔道・阿部詩のギャン泣きに賛否…《コーチが早く場外へ連れ出すべきだった》の辛口意見も,https://news.yahoo.co.jp/articles/e41fcd8bcb495f1b839a9fd86285d6f13b98dd1f,7/29(月) 16:32
2024-07-29,20:05,sports,スポーツ,2,スポニチアネックス,柔道女子57キロ級・舟久保遥香が初五輪で準々決勝進出！東京銅「9頭身モデル」ビロディドを7分激闘討ち,https://news.yahoo.co.jp/articles/64cdd3af68cbad17e71220ead3275835c6840b89,7/29(月) 18:49
2024-07-29,20:05,sports,スポーツ,3,CoCoKARAnext,「控えめに言って最悪！」選手村の“厳しい食事事情”に不満続出！ 独選手は苛立ちを隠さず「質と量も良くない」【パリ五輪】,https://news.yahoo.co.jp/articles/0ae5f57f9f85498cfebe1fbe8f3384519ede8fd5,7/29(月) 16:00
2024-07-29,20:05,sports,スポーツ,4,スポニチアネックス,ええっ！総合馬術の日本　競技前に馬体検査で減点…団体3位→5位転落で最終種目　代役の田中は好走,https://news.yahoo.co.jp/articles/612d2cb0f1e7a30bbec3f29e3d74c64983cae24a,7/29(月) 17:54
2024-07-29,20:05,sports,スポーツ,5,RONSPO,「銅メダルを返上しろ」「あなたの行為は殺人未遂」パリ五輪柔道で永山竜樹に“疑惑の誤審”1本勝ちのガリゴスのインスタに2700件超えの批判コメの異常事態…米メディアは永山の抗議を非難,https://news.yahoo.co.jp/articles/39a3f367ff3c2396b78741e0bee6b98b106c3b0b,7/29(月) 6:33
2024-07-29,20:05,sports,スポーツ,6,スポーツ報知,【パリ五輪】１７歳・成田実生が初五輪で決勝進出「ちょっとだけだけど余力も残せた気がする」４００個メ全体５位で突破,https://news.yahoo.co.jp/articles/2b6d81eba903c839de2060c4e2dcf8ee111382a9,7/29(月) 18:16
2024-07-29,20:05,sports,スポーツ,7,デイリースポーツ,旗手の江村美咲、冷や冷やの３回戦進出　あわや敗退の危機　ウクライナ選手に１５－１４の辛勝　フェンシング女子サーブル個人,https://news.yahoo.co.jp/articles/9525591128d9a83b0607b3e0a234f4187a2a4822,7/29(月) 18:57
2024-07-29,20:05,sports,スポーツ,8,読売新聞オンライン,金メダル候補のフェンシング江村美咲、薄氷の初戦突破,https://news.yahoo.co.jp/articles/6969a8eaeb73ce1b8fc10d7146847ddc32b34d30,7/29(月) 19:22
2024-07-29,20:05,sports,スポーツ,9,Full-Count,大谷翔平、捉えた史上初「40-100-40-40」　ボンズもできなかった偉業に現実味,https://news.yahoo.co.jp/articles/a80b3d73cd7ce8ba5d8392ed8617cb48276550f7,7/29(月) 11:37
2024-07-29,20:05,sports,スポーツ,10,デイリースポーツ,柔道女子　舟久保に敗れたビロディドが号泣も…傍らにコーチの姿なし　延長戦中に退場処分のハプニング　１人で泣きながら引き揚げる,https://news.yahoo.co.jp/articles/c622ba94cbc157546b916fa9bffe9f75d7f91986,7/29(月) 19:07
2024-07-29,20:05,sports,スポーツ,11,東スポWEB,【柔道】阿部詩は勝っていた？　一本負けの２回戦…審判が見逃した〝反則〟を小川直也氏が指摘,https://news.yahoo.co.jp/articles/a1bafc3d21c1c063e6a3eb5d5c2c977fe0d70776,7/29(月) 6:17
2024-07-29,20:05,sports,スポーツ,12,デイリースポーツ,体操女子　１０代の選手たちを支えた美しいコーチ　元アトランタ五輪代表＆２児のママ　献身的な姿勢にファン「泣きそう…」,https://news.yahoo.co.jp/articles/25d0ed07ba4f0e2a96506b62d31856b3081e00c3,7/29(月) 16:39
2024-07-29,20:05,sports,スポーツ,13,デイリースポーツ,柔道女子　舟久保が準々決勝敗退　開始９秒でまさかの一本負け　敗者復活戦へ,https://news.yahoo.co.jp/articles/867c9460f9eb168dcc3e2b7a5f254f9fbe4d6f46,7/29(月) 19:48
2024-07-29,20:05,sports,スポーツ,14,東スポWEB,ドジャース・フリーマン夫人が息子の病状明かす「立つことも、歩くこともできない」,https://news.yahoo.co.jp/articles/0202c185ace546e2c9b2c5912acfd8c633f08a51,7/28(日) 17:41
2024-07-29,20:05,sports,スポーツ,15,デイリースポーツ,【２９日の見どころ】フェンシング江村、スケボ堀米らが登場　体操男子団体はリオ以来の金なるか　バスケ女子は米国と初戦,https://news.yahoo.co.jp/articles/70fbe3d52d225515bfaae285363bc78c8bfdb9b5,7/29(月) 16:02
2024-07-29,20:05,sports,スポーツ,16,デイリースポーツ,傷心の阿部詩に両親寄り添う　家族愛伝わる姿にＳＮＳ感動「２３歳だもんな」「おにぎり食べる姿を見て安心した」,https://news.yahoo.co.jp/articles/0cefc35cd32cd841e554120d08eee7922f6e2e79,7/28(日) 22:56
2024-07-29,20:05,sports,スポーツ,17,スポーツ報知,全国高校総体１５００Ｍでドルーリー朱瑛里は１１位　８００Ｍでは久保凛と対決も,https://news.yahoo.co.jp/articles/345d17884ccdb90d75c9db8fa1d6a33e8e1dcaa4,7/29(月) 16:11
2024-07-29,20:05,sports,スポーツ,18,Full-Count,“戦力外”から「宝石を見つけた」　ド軍に現れた救世主、壊滅投手陣を救う「0.00」,https://news.yahoo.co.jp/articles/81f39b4772359757da1227ef6a02807a2f9d3a7a,7/29(月) 16:00
2024-07-29,20:05,sports,スポーツ,19,CoCoKARAnext,「日本はかなり効率的だった」選手村の食材不足問題に“生肉提供”を受けた英選手が不満吐露「かなりカオス」【パリ五輪】,https://news.yahoo.co.jp/articles/ca5ad33a294846e8b2e842145f4debee59c7994c,7/27(土) 11:01
2024-07-29,20:05,sports,スポーツ,20,ENCOUNT,朝倉未来、引退を表明「自分が戦うのは一旦終わりに」　1RKO負けから一夜明け心境「格闘技が好きなので…」,https://news.yahoo.co.jp/articles/000832ab4042679fd4e3cdb01488fbd9b38d9101,7/29(月) 10:45
2024-07-29,20:05,sports,スポーツ,21,東スポWEB,阿部詩のインスタ　心無い書き込み殺到でウズベキスタン人謝罪「私は恥ずかしい」「嘲笑するな」,https://news.yahoo.co.jp/articles/8f5a90606c5ebef28b913738720176dd015e5345,7/29(月) 18:32
2024-07-29,20:05,sports,スポーツ,22,デイリースポーツ,阿部一二三の表彰式が「胸熱」と話題　メダル授与者が日本人、ガッチリ両手握手＆笑顔,https://news.yahoo.co.jp/articles/8f471b1bb2346edb72382718b5fea3317a873a17,7/29(月) 10:55
2024-07-29,20:05,sports,スポーツ,23,スポニチアネックス,張本智和　男子シングルス初戦圧勝！冷静に「うれしさはない」「プレー自体にはまあまあ納得」,https://news.yahoo.co.jp/articles/3e35301a082a5bf5607e398c564474f22985363c,7/29(月) 17:24
2024-07-29,20:05,sports,スポーツ,24,日刊ゲンダイDIGITAL,恋人のグラドルが会場で応援 圧巻連続金の阿部一二三が見据える柔道史上初「五輪4連覇」シナリオ,https://news.yahoo.co.jp/articles/6790a160a1b89e4c00cea7c5e7a58819b095ab90,7/29(月) 11:23
2024-07-29,20:05,sports,スポーツ,25,オートスポーツweb,両選手権の制覇を目指すレッドブルF1。ペレスの後任を検討、リカルドとローソンがイモラでテストへ,https://news.yahoo.co.jp/articles/06499a0e808eaff58c71b9b72adef836b0b2a39c,7/29(月) 17:00
2024-07-29,20:05,sports,スポーツ,26,朝日新聞デジタル,鳴門渦潮が7年ぶりの夏の甲子園へ　選抜8強の阿南光に延長サヨナラ,https://news.yahoo.co.jp/articles/c0eb93bcb8583d6cc5a76b7462101e4af85dee34,7/29(月) 16:50
2024-07-29,20:05,sports,スポーツ,27,Full-Count,大谷翔平、92年ぶり偉業は幻か　快挙阻む“怪物”、早くも到達した衝撃の「55」,https://news.yahoo.co.jp/articles/b7329ebaaa4e05822f7c405eb65fc9040bcc690c,7/29(月) 13:49
2024-07-29,20:05,sports,スポーツ,28,CoCoKARAnext,「腹が立つぐらいだ」選手の移動用バスに問題相次ぐ 独コーチは苛立ちを隠さず「選手村を出ると間違った方向に走る」【パリ五輪】,https://news.yahoo.co.jp/articles/1d385f0f081787718d507246c7b3ad269e3d4a4f,7/29(月) 18:51
2024-07-29,20:05,sports,スポーツ,29,TBS NEWS DIG Powered by JNN,柔道女子57キロ級 舟久保遥香 東京五輪銀メダリストのシジクに敗れて敗者復活戦へ【パリ五輪】,https://news.yahoo.co.jp/articles/f334ebffc52ea92f9a60b84391048a18a6b0fe74,7/29(月) 19:50
2024-07-29,20:05,sports,スポーツ,30,Full-Count,大谷翔平の“怪力伝説”「とんでもない」　現場に赴いた米記者、再認識した桁違いの才能,https://news.yahoo.co.jp/articles/091533806678b1da701b35708520c09b7acb083c,7/29(月) 16:39
2024-07-29,20:05,sports,スポーツ,31,東スポWEB,ブラジル競泳代表　恋人と〝エッフェル塔無断デート〟で五輪追放　SNSに写真載せて発覚,https://news.yahoo.co.jp/articles/eefe06734598aab6a95201731056bdc5f501b882,7/29(月) 16:46
2024-07-29,20:05,sports,スポーツ,32,CoCoKARAnext,「私、死んでる」女子100mバタフライ金メダリストの“奇妙”な写真に違和感しかない！「何なんだ一体？」【パリ五輪】,https://news.yahoo.co.jp/articles/55be71be98406f1ee9e0045f9e890b5dca881a6b,7/29(月) 18:56
2024-07-29,20:05,sports,スポーツ,33,ゲキサカ,U-23日本代表は首位通過をかけた一戦…パリ五輪イスラエル戦の主審が決定,https://news.yahoo.co.jp/articles/820e50d600f633c3933fc1a1a40d9ba90ba62e69,7/29(月) 17:48
2024-07-29,20:05,sports,スポーツ,34,東スポWEB,ドジャース・フリーマン夫人「つらい」闘病中の息子が退院も再入院の可能性…広がる祈りの輪,https://news.yahoo.co.jp/articles/27c74c5d57e9f1b0d0eee1de707ef454e4c405a3,7/29(月) 16:46
2024-07-29,20:05,sports,スポーツ,35,スポーツ報知,【パリ五輪】衝撃敗退の阿部詩、なぜ世界ランク１位と２回戦で対戦？　世界ランクのポイント少なくシード外に,https://news.yahoo.co.jp/articles/0ed7a6a32dc2ee0f81dac2d1b5e9cd1a59551a59,7/28(日) 22:45
2024-07-29,20:05,sports,スポーツ,36,日テレNEWS NNN,釈放された佐野海舟が声明「この度は誠に申し訳ございませんでした」14日に性的暴行を加えたとして逮捕,https://news.yahoo.co.jp/articles/287a2beab7f0968b74a41f446db7d2dfd45eb226,7/29(月) 19:20
2024-07-29,20:05,sports,スポーツ,37,東スポWEB,五輪で相次ぐ〝ハイテンション実況〟に苦言続出「絶叫うるさい」「名言狙いすぎて冷める」,https://news.yahoo.co.jp/articles/0b344c5e1d1fa017e402d6dbe82ce7f2766fa6be,7/29(月) 19:36
2024-07-29,20:05,sports,スポーツ,38,FITNESS LOVE,目指すは60歳で赤いビキニ！54歳が宅トレと散歩でコンテスト準グランプリ【筋トレビフォーアフター】,https://news.yahoo.co.jp/articles/450308dd8aff69896e81bd2d967730282e9cefc5,7/29(月) 17:07
2024-07-29,20:05,sports,スポーツ,39,Full-Count,大谷翔平、衝撃のチーム11冠　ド軍でも際立つ存在感…“一刀流”で名門球団を圧倒,https://news.yahoo.co.jp/articles/5f35ae1242b7e30f123f0102084a0356bf3bb74f,7/29(月) 19:00
2024-07-29,20:05,sports,スポーツ,40,日刊スポーツ,【RIZIN】朝倉未来にKO勝ちした平本蓮の師匠が長文投稿「負ける要因探すの難しかった」,https://news.yahoo.co.jp/articles/adbe8b4dae90f004d6adb6d1a3f55f1e056027a3,7/29(月) 12:51
