scrp_date,scrp_time,genre_en,genre_jp,rank,media_jp,title,link,date_original
2025-06-28,20:05,local,地域,1,ミヤギテレビ,【速報】東北新幹線　仙台～盛岡の上下線で運転見合わせ,https://news.yahoo.co.jp/articles/1f77059126226cf184369e8dc3710842d16c4447,6/28(土) 16:26
2025-06-28,20:05,local,地域,2,NBS長野放送,「あいつはもう帰ってこない」かなりのスピードで走行か　水門に衝突…19歳と20歳の自動車整備科の訓練生4人死亡　涙ながらに友人が誓う「あいつの死を無駄にせず、事故が減るよう活動する」,https://news.yahoo.co.jp/articles/de6fc3106a57686a575d0e6a02970a604df87666,6/27(金) 19:57
2025-06-28,20:05,local,地域,3,UTYテレビ山梨,「クマに襲われた」「鼻がとれそう」と通報　1人で釣りをしていた男性がクマに襲われけが　山梨・北杜市,https://news.yahoo.co.jp/articles/aaa39fac5d6440eeb3d51227b3d4e16175e423b4,6/28(土) 17:17
2025-06-28,20:05,local,地域,4,福井テレビ,「せっかくコメ価格上がったのに…農家は廃業ですわ」JA福井県宮田会長が小泉農水相の政策に苦言「消費者だけでなく生産者にも寄り添って」,https://news.yahoo.co.jp/articles/1c7b2bbcd932ae95dc3fd7276ecb55530a1f058a,6/27(金) 16:48
2025-06-28,20:05,local,地域,5,関西テレビ,【速報】バスと軽自動車が交差点付近で衝突　複数の乗客がケガ　警察が原因を調査　大阪・北区,https://news.yahoo.co.jp/articles/3b3234bb8f9cd3a29eb98388153bc44166073ea6,6/28(土) 18:50
2025-06-28,20:05,local,地域,6,ABCニュース,【注目】日本一の花火師が万博に　直径約320メートル”大曲の花火”が大阪の夜空を彩る　前回の「双葉花火」開催日には過去最多の入場者数を記録,https://news.yahoo.co.jp/articles/aa9c2be667c93720424927e9608adc5d15ef3e2d,6/28(土) 18:04
2025-06-28,20:05,local,地域,7,ＳＢＣ信越放送,130人程度の採用予定に約460人が受験　県立高校の教員採用試験始まる,https://news.yahoo.co.jp/articles/28b345da58f3a1808c6ac74d5508b97b1a1f2555,6/28(土) 17:57
2025-06-28,20:05,local,地域,8,MRT宮崎放送,延岡市の川で水難事故　男子高校生が死亡,https://news.yahoo.co.jp/articles/3f6d4f5941f1896e7e6f2e2ad1bd90083bc92e12,6/28(土) 17:14
2025-06-28,20:05,local,地域,9,九州朝日放送,博多湾の遊泳レース参加者が死亡　突然死か,https://news.yahoo.co.jp/articles/21be0e8fb2650f2cbf97d04c929fc1a2dc9f2d95,6/28(土) 15:45
2025-06-28,20:05,local,地域,10,琉球新報,キャベツ10000玉を廃棄　沖縄の農家「出荷すればするほど赤字」　高値→暴落、苦渋の決断,https://news.yahoo.co.jp/articles/1c6888f11c3e6da83875212a205191f274eb5acf,6/28(土) 13:11
2025-06-28,20:05,local,地域,11,RKB毎日放送,「部下の女性警察官は勤務中に被害に遭ったため職務を放棄して逃げ出すこともできなかった・・・」警察官による部下への性犯罪　”立場を悪用”執行猶予付き判決を受けた37歳元警部補の男,https://news.yahoo.co.jp/articles/4b69f3e0bc33e6f895d23541655d164ec708a691,6/28(土) 14:02
2025-06-28,20:05,local,地域,12,MRT宮崎放送,道路中央をはだしで走る男児を発見　橋の欄干を越えて・・・車で通りがかった夫婦がとっさの判断で保護,https://news.yahoo.co.jp/articles/790789aea52388ded4fd2c58e4cffdd9ba7180db,6/27(金) 19:09
2025-06-28,20:05,local,地域,13,ABCニュース,和歌山に再びパンダは「来る可能性低い」　理由に”二階氏の引退”や”台湾シフト”　　アドベンチャーワールドのパンダあす中国へ,https://news.yahoo.co.jp/articles/c00b088a302a2d05694d6ea4791aabe0e2ca46c3,6/27(金) 17:59
2025-06-28,20:05,local,地域,14,沖縄タイムス,高校生ら3人が乗ったバイク、対向車線を逆走し車と正面衝突　3人とも意識不明で搬送　沖縄・浦添市,https://news.yahoo.co.jp/articles/efff145de837b0807736459fa4af8f9b56c4aa8f,6/28(土) 17:37
2025-06-28,20:05,local,地域,15,チューリップテレビ,クロマグロ遊漁禁止中に富山湾で8匹捕獲　男女4人で釣り上げ　中には30キロ未満の小型魚も…,https://news.yahoo.co.jp/articles/4c9be39bc2b4a6ec5d85dce338621ad1f8ea9b92,6/26(木) 19:06
2025-06-28,20:05,local,地域,16,千葉日報オンライン,生徒に性的メッセージ　千葉県立高教諭、減給の懲戒処分「飲酒した状態でラインした」,https://news.yahoo.co.jp/articles/f9196da42a75423fb8ae7245f0b1dea01480181f,6/28(土) 12:11
2025-06-28,20:05,local,地域,17,eat愛媛朝日テレビ,松山市の小学校給食で児童がアレルギー症状【愛媛】,https://news.yahoo.co.jp/articles/ee321ba465129b2549febf580c9efa04852f0f86,6/28(土) 18:18
2025-06-28,20:05,local,地域,18,TUFテレビユー福島,交差点で軽乗用車と大型トラックが出合い頭に衝突　軽自動車の60代女性が死亡　福島,https://news.yahoo.co.jp/articles/b5ad49d584ee67725ddf8fe64e341e65c73616d7,6/28(土) 19:06
2025-06-28,20:05,local,地域,19,あいテレビ,アレルギー情報の入力漏れで…小麦など食物アレルギーある児童に学校給食で誤って提供 救急搬送される【愛媛・松山市】,https://news.yahoo.co.jp/articles/2034b6f214bb9a7f80f336a528e911445798fefb,6/28(土) 18:59
2025-06-28,20:05,local,地域,20,南海放送,アレルギーある児童に“小麦”入りスープ　給食で提供し救急搬送　松山市教育委員会,https://news.yahoo.co.jp/articles/d5b53723222ce66c32d5268ea018f8bd0afc5085,6/28(土) 19:21
2025-06-28,20:05,local,地域,21,京都新聞,【速報】自宅リビングなどで放火　父母や弟を殺害しようとした疑い　20歳女を逮捕,https://news.yahoo.co.jp/articles/6c283f5ef5712cb59cf6dd283f509e11c3ba08f2,6/28(土) 19:36
2025-06-28,20:05,local,地域,22,北海道ニュースUHB,【ヒグマ速報】高速道路をクマが”乱横断”走行中の乗用車と衝突…そのまま走り去る―男性ドライバーなどに「負傷なし」も車はレッカー〈北海道遠軽町〉,https://news.yahoo.co.jp/articles/b4b8da73669aa26187f87d7c162aedd50abd8c2d,6/28(土) 18:00
2025-06-28,20:05,local,地域,23,中国新聞デジタル,266万円入りセカンドバッグ盗んだ疑い　山口で男逮捕,https://news.yahoo.co.jp/articles/b04c5f793da06717c76bdab970e27d2e017b0d43,6/28(土) 17:41
2025-06-28,20:05,local,地域,24,埼玉新聞,人気のフランス菓子店が事業停止　メディアでも有名　埼玉の白鳥菓子工房　数々のコンクール入賞経験　負債約1億6千万円　「キャトーズ・ジュイエ」運営【倒産情報】,https://news.yahoo.co.jp/articles/b704326afaeeaee0e2e13f769c13a316eb122c04,6/27(金) 8:24
2025-06-28,20:05,local,地域,25,MBC南日本放送,【次の台風か?】シミュレーションで九州に接近する「渦」…熱帯じょう乱が今後発達か【雨・風シミュレーション30日（月）〜7月8日（火）】,https://news.yahoo.co.jp/articles/533f1eb3ba0aff0643724a5e0cb7a0460661789c,6/27(金) 19:36
2025-06-28,20:05,local,地域,26,南日本新聞,参院選鹿児島・共産松崎氏が出馬取りやめ　立民推薦の尾辻氏に一本化,https://news.yahoo.co.jp/articles/34196d9a8cf7a162a85636ab90bde20539f1afdb,6/28(土) 18:45
2025-06-28,20:05,local,地域,27,MBSニュース,【速報】万博東ゲート前はきょうも長蛇の列　最高気温は33℃予想…日傘さす人も 午前9時台は2週間先まで満員「最初からレジオネラ属菌ほぼ検出されなかった」水上ショー再開はいつ？,https://news.yahoo.co.jp/articles/2f4c4183d8205146a55355d4c8fa6f3479bd3157,6/28(土) 8:50
2025-06-28,20:05,local,地域,28,神戸新聞NEXT,斎藤知事への抗議活動「活動家と記者クラブが繋がってる」は誤り　X上で拡散,https://news.yahoo.co.jp/articles/7b0ba091da7e7907c557cd6cd7b8f6ffc38aba0f,6/28(土) 13:01
2025-06-28,20:05,local,地域,29,tbc東北放送,原因は「クマとの衝突」東北新幹線（仙台ー盛岡）走行中車両から“異音”で一時運転見合わせ,https://news.yahoo.co.jp/articles/824172a07df1cc82bce12cf556eeb69af2f6e519,6/28(土) 16:56
2025-06-28,20:05,local,地域,30,読売新聞オンライン,杉森高校から「福岡キャリアi高」に校名変更、岩本初恵理事長「学校は経営が安定していないと続かない」,https://news.yahoo.co.jp/articles/cf1b8c9cc245fd839bac066fb25d9c266d0a4ffb,6/28(土) 15:35
2025-06-28,20:05,local,地域,31,テレビ静岡NEWS,学歴詐称疑惑の市長がSNSを更新　7月2日に弁護士同席で会見へ…インターネットでライブ配信も　「確たる証拠もなく人を貶めようとする行為に対しては毅然とした対応を貫く」　卒業証書と卒業アルバムを持参予定,https://news.yahoo.co.jp/articles/2cebc39100501bb2b23fd9ac583593c916b3950a,6/27(金) 18:21
2025-06-28,20:05,local,地域,32,IAT岩手朝日テレビ,クマが住宅に侵入　住人は避難し無事　クマは一時は住居内に…【岩手・北上市】,https://news.yahoo.co.jp/articles/86b8259da9e31b2e651195badd42c0e210b378c0,6/28(土) 16:52
2025-06-28,20:05,local,地域,33,RCC中国放送,チンパンジーのナナが多摩動物公園へ　世界初・死体から採取の凍結精子で人工授精　波乱に満ちた人生…安佐動物公園　広島,https://news.yahoo.co.jp/articles/24a8e8d14ee1a27a806697f1d10000a7192cf2ee,6/28(土) 7:02
2025-06-28,20:05,local,地域,34,STVニュース北海道,「倉庫から爆発音が聞こえ、煙が出てる」 釧路市の倉庫で火事 現在も消火活動中,https://news.yahoo.co.jp/articles/eea34842f37eed38a9c340d24bf50b5321b13486,6/28(土) 13:12
2025-06-28,20:05,local,地域,35,RBC琉球放送,肋骨や背骨など複数骨折する大けがで発見　路上で女性をひき逃げか,https://news.yahoo.co.jp/articles/426035a4d421689ae6bfc80109bb50e71051c7e8,6/28(土) 16:56
2025-06-28,20:05,local,地域,36,仙台放送,東北新幹線がクマと衝突し一時運転見合わせ,https://news.yahoo.co.jp/articles/2c3dc372c4f27d2c714854746d7cbf49d43873e5,6/28(土) 18:01
2025-06-28,20:05,local,地域,37,BSS山陰放送,80代の男性が外出中に気分不良　10代の女性が自転車走行中にふらつき…熱中症疑いによる救急搬送　鳥取・米子市,https://news.yahoo.co.jp/articles/af4959fe49d0164556cfdb9c05ea9a5e77bc97d9,6/28(土) 18:44
2025-06-28,20:05,local,地域,38,HBCニュース北海道,商業施設から体重計やリュック、展示品のパソコンを…自宅などから押収されるも「買ったりパチンコの景品でもらったりした」と説明　窃盗容疑で39歳男を逮捕,https://news.yahoo.co.jp/articles/78d7b863f1fdea81406e1fc90587195277cde47f,6/28(土) 15:29
2025-06-28,20:05,local,地域,39,KSB瀬戸内海放送,係留中の小型船が半分沈没　油が600m流出　香川,https://news.yahoo.co.jp/articles/392ca3693b5ea0caf8764a7d281ee95068bb48a6,6/28(土) 17:45
2025-06-28,20:05,local,地域,40,STVニュース北海道,牧場内の堀から顔を出す子グマを観光客が目撃 警察と役場が調査するも痕跡見つからず 北海道,https://news.yahoo.co.jp/articles/f49db2a1e5bd110e7f81ba495fd188280a8b795b,6/28(土) 19:19
