scrp_date,scrp_time,genre_en,genre_jp,rank,media_jp,title,link,date_original
2025-04-07,05:06,sports,スポーツ,1,Full-Count,はしゃぐ朗希を皮肉るMLB大物「先にステーキを注文する男」　またも発言炎上「恥ずかしい」,https://news.yahoo.co.jp/articles/358297d7e7f8e56a65768d95c32894ca5dd30a28,4/6(日) 19:46
2025-04-07,05:06,sports,スポーツ,2,スポーツ報知,ドジャースに衝撃、元サイ・ヤング賞左腕がＩＬ入り　フリーマンに続き早くも故障者続出,https://news.yahoo.co.jp/articles/90f90a33e385187c76763da6ffd4f4467fbf751f,4/7(月) 2:31
2025-04-07,05:06,sports,スポーツ,3,スポーツ報知,柔道パリ五輪金メダルの角田夏実は世界選手権代表に選ばれず　所属先から辞退の申し入れ,https://news.yahoo.co.jp/articles/daa7c5637f4c78b23a7ac85f7879178051f844a3,4/6(日) 20:21
2025-04-07,05:06,sports,スポーツ,4,スポーツ報知,グラスノーが３者連続四球などでまさかの大乱調　３回途中降板→直後に救援左腕ベシアが初球を満塁被弾,https://news.yahoo.co.jp/articles/e998357fb007e789c09f3f1f59b15a5182df6a09,4/7(月) 3:54
2025-04-07,05:06,sports,スポーツ,5,スポーツ報知,【日本ハム】新庄監督「見えないミス」　清宮幸太郎「あれがなかったら…」判断誤った三塁守備を猛省,https://news.yahoo.co.jp/articles/8aeb8fbefad57b52a1385c7336a52a068d418070,4/6(日) 18:44
2025-04-07,05:06,sports,スポーツ,6,Full-Count,「どうして…」グラスノーに異変？　8年ぶりの“乱調”にファン騒然「あんな急に崩れる？」,https://news.yahoo.co.jp/articles/9e3fd0abdb6626ba24c262b2bd32ca8f6abadaa8,4/7(月) 3:57
2025-04-07,05:06,sports,スポーツ,7,日刊スポーツ,【町田】黒田監督「出て行ってくれ」コーチ膝立ち約30分謝罪もパワハラ該当なし…報告書／要旨３,https://news.yahoo.co.jp/articles/bb242eedf726ad0a3e2f35556464e2211212975d,4/6(日) 22:35
2025-04-07,05:06,sports,スポーツ,8,スポーツ報知,【巨人】３連敗に阿部監督「悔しいけど、まだまだやり返すチャンスがあるしね。前を向いてやります」,https://news.yahoo.co.jp/articles/f90dde99b4de50dd1f2575552897d3ddc4a0da7c,4/6(日) 16:23
2025-04-07,05:06,sports,スポーツ,9,Full-Count,佐々木朗希は「時間がかかる」　ロバーツ監督が明かした育成プラン…次回登板は13日,https://news.yahoo.co.jp/articles/e499ecc755dfb18b4275a0eebecae70547f8a5cf,4/7(月) 3:27
2025-04-07,05:06,sports,スポーツ,10,デイリースポーツ,ドジャース先発グラスノー、三回途中5失点KO　雨の影響か三回に突然崩れる　大谷は2打席連続三振,https://news.yahoo.co.jp/articles/11fd7ffbf46297907ca2f9fa995904a7099ba0d6,4/7(月) 3:48
2025-04-07,05:06,sports,スポーツ,11,中日スポーツ,今年のF1日本GP、ネットでは「つまらない」「単調すぎる」の声多数…上位6台は予選と順位変わらず、ジャーナリストも落胆,https://news.yahoo.co.jp/articles/83992cec734681ef059fc1aae4c05a0941e183e6,4/6(日) 19:43
2025-04-07,05:06,sports,スポーツ,12,スポニチアネックス,ドジャース投手コーチが明かす佐々木朗希の劇的改善の理由　「彼が持ち込んだこと」「効果的に強化した」,https://news.yahoo.co.jp/articles/ce6d18e04e19da5055f0f4251f81cbccba5dba74,4/7(月) 3:24
2025-04-07,05:06,sports,スポーツ,13,デイリースポーツ,阪神　宿敵巨人に３連勝した藤川監督　感情むき出しの姿＆石井３連投「全員で辞めなアカン」１３年前の言葉を思い起こさせた伝統の一戦,https://news.yahoo.co.jp/articles/4126fbdbf917c569634d6e00e6843a2eb3cefd56,4/6(日) 21:18
2025-04-07,05:06,sports,スポーツ,14,デイリースポーツ,東京五輪２冠の美しきスイマー　桜バックのスーツ姿が「美しい」「美人さんに桜がお似合い」大学院進学を報告,https://news.yahoo.co.jp/articles/0288f01c5961db63c19515b236dc25c716b7e726,4/6(日) 22:11
2025-04-07,05:06,sports,スポーツ,15,イーファイト,ボクシング元世界女王、素手ボクシングで失神“32秒”KO負けの衝撃！「目が完全に飛んでいる」,https://news.yahoo.co.jp/articles/4f75ed8a1d790bcb812c3af0d16340d6717e9b4c,4/6(日) 21:59
2025-04-07,05:06,sports,スポーツ,16,ゲキサカ,菅原由勢が所属するサウサンプトン、プレミアリーグ“史上最速”降格確定…松木玖生のレンタル元、高卒FW高岡伶颯も今春から入団,https://news.yahoo.co.jp/articles/a73716afd474d8ab4b6e702c530aa7582091f74a,4/7(月) 1:36
2025-04-07,05:06,sports,スポーツ,17,東スポWEB,【巨人】３四球の石川達也は救援〝再転向〟か　阿部監督「ローテは再考しようかな」,https://news.yahoo.co.jp/articles/d5107143bc74fdd7708c439bdeee10432adf8572,4/6(日) 20:16
2025-04-07,05:06,sports,スポーツ,18,スポニチアネックス,ドジャース大谷翔平が3打席連続三振…雨の中でのフィリーズ戦　本塁打を打てば“30球場制覇”へ王手,https://news.yahoo.co.jp/articles/c1d562928152fa1a8556dbc51bf1d7ae4a3525db,4/7(月) 4:18
2025-04-07,05:06,sports,スポーツ,19,スポニチアネックス,T・ヘルナンデスが2本塁打でポーズ　大谷CMからドジャース浸透「コスメデコルテ・セレブレーション」,https://news.yahoo.co.jp/articles/7b4feec5366b4033c45fab68f88a4ea7549d692f,4/7(月) 4:08
2025-04-07,05:06,sports,スポーツ,20,スポニチアネックス,【F1】移籍初戦で12位の角田裕毅「複雑な気持ち。ちょっと悔しい」　レッドブル代表は今後に期待,https://news.yahoo.co.jp/articles/b700fb56b3b8460e111e07eaf4a711e542a7e7b5,4/6(日) 16:59
2025-04-07,05:06,sports,スポーツ,21,テレ東スポーツ,リードしている場面で降板 佐々木朗希の好投にドジャース監督がコメント「次回は80球目安」,https://news.yahoo.co.jp/articles/dc85b324ee436e8d88be636cf3b0fcde9693bb68,4/6(日) 23:00
2025-04-07,05:06,sports,スポーツ,22,スポニチアネックス,内川聖一氏、セの優勝予想で熱弁「強い。万全に万全」　石橋貴明は手の内見せない「秘めたる思い」推し,https://news.yahoo.co.jp/articles/581636be35f906321f5515b6d398ec65c423b5d9,4/6(日) 20:55
2025-04-07,05:06,sports,スポーツ,23,CoCoKARAnext,「有望な“新ドライバー”を迎えた」移籍初戦で12位の角田裕毅に及第点の評価　ローソンとの比較も「5つ上の順位だ」,https://news.yahoo.co.jp/articles/78af97a4861956ecc41d472e049fe3eeb80d5b1d,4/6(日) 18:48
2025-04-07,05:06,sports,スポーツ,24,中日スポーツ,ドジャース激震、サイ・ヤング賞投手スネルが負傷者リスト入り…長期離脱なら大きな痛手,https://news.yahoo.co.jp/articles/ac978fb09f670b757da1a2a16f67b4fbde0e63f7,4/7(月) 2:47
2025-04-07,05:06,sports,スポーツ,25,中日スポーツ,13着大敗のステレンボッシュにアンカツさん「安全策で外から間に合うほど…」、連覇ベラジオオペラには「レコード圧倒には驚いた」【大阪杯】,https://news.yahoo.co.jp/articles/9a430d54093d4e32d41e58d77f78dddc0457b9b8,4/6(日) 21:49
2025-04-07,05:06,sports,スポーツ,26,スポーツ報知,【広島】新井監督「よく打ってよく点を取ってくれた」中軸３人不在でも…計２３得点で３連勝／一問一答,https://news.yahoo.co.jp/articles/633955282a4b1874ec4d64394fbbc31063b7dc79,4/7(月) 1:37
2025-04-07,05:06,sports,スポーツ,27,馬トク報知,「まさかの大撃沈」「着順にビックリ」大阪杯の人気馬が初の大敗にネット悲鳴「最初から最後までサッパリ」,https://news.yahoo.co.jp/articles/7c83f9623b387a1e41c7b4e04869b58293254f4c,4/6(日) 16:41
2025-04-07,05:06,sports,スポーツ,28,デイリースポーツ,阪神伝説のヒッティングマーチ　相手投手は「何で味方にこんなこと」本人は「テンション下がる」→契約更改で要望の過去　浜田雅功が思わず口ずさむ,https://news.yahoo.co.jp/articles/8a6a24dda1608ce8b93c21533682e02bfc52e4cb,4/6(日) 22:34
2025-04-07,05:06,sports,スポーツ,29,FITNESS LOVE,筋肉による「メリハリ感」と小麦肌で魅せる　「昔はとにかく色白命で、日傘をさして歩いていた」,https://news.yahoo.co.jp/articles/c20d234c70ec959d8601c318c715f0972d7659cc,4/7(月) 4:30
2025-04-07,05:06,sports,スポーツ,30,スポーツ報知,リバプール、逆転負けで今季２敗目！　リーグ戦無敗は２６試合でストップ、遠藤は出番なし,https://news.yahoo.co.jp/articles/3327ee196ece93a8004762d9c3e4c3b8b87d195a,4/7(月) 3:20
2025-04-07,05:06,sports,スポーツ,31,スポーツ報知,大谷翔平、第４打席に四球で開幕１１試合連続出塁　今季“ラストチャンス”で３０球場制覇王手なるか,https://news.yahoo.co.jp/articles/d95b8162334a523eae04bc704e3ae5fc23b35431,4/7(月) 4:46
2025-04-07,05:06,sports,スポーツ,32,日刊スポーツ,大阪杯当てた粗品の思いやり…誕生日のマネジャーに15万馬券プレゼント,https://news.yahoo.co.jp/articles/8f2297a04f560410f0f0e6b7a942b1b57bb9853b,4/6(日) 19:38
2025-04-07,05:06,sports,スポーツ,33,日刊スポーツ,菅楓華、水色ウエア＆紺ミニスカコーデなど公開　５位で今季開幕４戦連続トップ10「来週も…」,https://news.yahoo.co.jp/articles/3d348215c37873e855593c37929c47a9f92178d8,4/7(月) 1:00
2025-04-07,05:06,sports,スポーツ,34,スポーツ報知,９勝１敗と好調のドジャース、心配される先発投手事情　スネル離脱、グラスノー３回途中５失点ＫＯ、佐々木朗希０勝,https://news.yahoo.co.jp/articles/3ce6dda33b286b11d75c1ca13bc546dc98b91ee4,4/7(月) 3:49
2025-04-07,05:06,sports,スポーツ,35,スポニチアネックス,森保監督　日本代表で強化していきたいポジションに言及「世界的にも…」「データで見ると日本は…」,https://news.yahoo.co.jp/articles/8de4de1a20141ecc3867ba42ffddea81793e00ca,4/6(日) 22:30
2025-04-07,05:06,sports,スポーツ,36,日刊スポーツ,【F1】高梨沙羅が鈴鹿に降臨、優勝陣営マシンと笑顔　支援受けるレッドブルの応援で日本ＧＰへ,https://news.yahoo.co.jp/articles/46aef31991a2aea6d126d4abd5fc673f9d15aff0,4/6(日) 19:34
2025-04-07,05:06,sports,スポーツ,37,Full-Count,阪神23歳は「なんで育成で獲れた？」　窮地動じぬ“爆速球”に虎党「ロマンの塊すぎる」,https://news.yahoo.co.jp/articles/5ab043be7a8e61443450d7c855c1c77230833867,4/6(日) 17:01
2025-04-07,05:06,sports,スポーツ,38,Full-Count,中日25歳ドラ1は「今年こそ覚醒」　“ロマン砲”の一振りにX驚嘆「弾道5くらいありそう」,https://news.yahoo.co.jp/articles/41c441aac5a50d487a3e4c58cf6f8c59c63cc2d3,4/6(日) 19:20
2025-04-07,05:06,sports,スポーツ,39,ベースボールキング,ドジャースの先発左腕スネルが負傷者リスト入り　今季新加入も、わずか2登板で左肩負傷,https://news.yahoo.co.jp/articles/9cb9d6d2a8b3e5590d563569fadabfb82e3de9ec,4/7(月) 2:49
2025-04-07,05:06,sports,スポーツ,40,Full-Count,沈黙続く中日…12球団唯一の0/8に「何とかして」　解消されぬ課題にX悲痛「厳しいな」,https://news.yahoo.co.jp/articles/b85fc961cbece21e71c16a866ee4ff575c412e21,4/6(日) 10:53
