scrp_date,scrp_time,genre_en,genre_jp,rank,media_jp,title,link,date_original
2025-08-13,03:10,TTL,総合,1,西スポWEB OTTO！,「そんなにくっつかれたら…」ドラマ共演から8年…37歳女優が年上俳優の隣でデレデレ…顔を寄せ合う〝ウエディング〟姿に反響「ベストカップル賞」ドラマオフショットが話題,https://news.yahoo.co.jp/articles/76f03034ac281c80dba2b68ec23d91e350db4238,8/12(火) 23:30
2025-08-13,03:10,TTL,総合,2,デイリースポーツ,橋下氏が砲撃　反発する高市早苗氏に「『親中』とレッテル貼るような人は日本のトップにはなれない。日本保守党レベル」　中国に厳しい態度は賛成だが　総裁選は期待していると,https://news.yahoo.co.jp/articles/c410cb9eb07165f1b705d4f8bc1f822549c19f02,8/12(火) 22:57
2025-08-13,03:10,TTL,総合,3,スポニチアネックス,金村義明氏　広陵の出場辞退で“みんな不幸になる”とため息「一番かわいそうなのは…」,https://news.yahoo.co.jp/articles/24317660ab054816b56aad8d7d759ea32651e3a8,8/12(火) 21:50
2025-08-13,03:10,TTL,総合,4,スポニチアネックス,カズレーザーと二階堂ふみの関係を「1年前から知っていた」芸人　「ずっと黙ってた」スタジオ「えー！！」,https://news.yahoo.co.jp/articles/ffd1d66086a714f0a5b67d42a7765c515124087c,8/12(火) 17:57
2025-08-13,03:10,TTL,総合,5,TBS NEWS DIG Powered by JNN,「いつ帰ってくるんや」日航機墜落で娘3人亡くし錯乱した母、守り続けた父の最期　悲しみを抱きながら生きた遺族の40年,https://news.yahoo.co.jp/articles/8b0c413ba947106b4210a9e2d59f43897eddbed7,8/11(月) 17:01
2025-08-13,03:10,TTL,総合,6,ほ・とせなNEWS,寝転がってスマホを見るパパ。しかし、おしりをよく見ると…「1番安全な場所ね笑」「最高のゆりかご」,https://news.yahoo.co.jp/articles/986b64e913c192f83c471dd51b51a82445ec2e9e,8/12(火) 22:07
2025-08-13,03:10,TTL,総合,7,スポーツ報知,第５子出産の辻希美「今日から杉浦家　家族７人生活がスタートです」退院を報告　赤ちゃんの写真も公開,https://news.yahoo.co.jp/articles/ed9972d69fcd6b9ca1477c8202b4fdc97091c4c3,8/12(火) 23:20
2025-08-13,03:10,TTL,総合,8,日刊スポーツ,やす子“激変”最新姿に騒然「本当にやす子さん？」「一瞬誰か」「うわっ」「どうしたの？？」,https://news.yahoo.co.jp/articles/841e73e048f281aa4c7a45410b8b5613f3fe13d6,8/12(火) 20:29
2025-08-13,03:10,TTL,総合,9,ねとらぼ,夜にカップ焼きそばを食べようと、お湯を注いで4分後……「いるね」　共感殺到の光景に「ああ…」「怖い話だった」,https://news.yahoo.co.jp/articles/c3bf0bf7095f8a0d5b7126bd6fd70325dd8a3f24,8/12(火) 22:00
2025-08-13,03:10,TTL,総合,10,西スポWEB OTTO！,「エレベーターの中でもずっと足踏んでる」嵐・二宮和也、共演重ねた大人気女優との〝親密〟ぶりに反響　写真でも同じポーズ…他共演者も「2人の感じいい」「推せる」と惚れ惚れ,https://news.yahoo.co.jp/articles/25a27edea67b78c2c8f39b87c1b6cddd2e81da1d,8/12(火) 23:50
2025-08-13,03:10,TTL,総合,11,CoCoKARAnext,物議を醸した早田ひなvs張本美和の“メディカルタイムアウト”　その真相,https://news.yahoo.co.jp/articles/70b740b1c0c16e235232a730b71073a7bf8bac83,8/12(火) 19:02
2025-08-13,03:10,TTL,総合,12,ねとらぼ,雑草ボーボーだった“ばあちゃん家の庭”→孫がスコップ1本でDIYしたら……　1カ月後、まさかの光景に「羨ましぎる」「努力の賜物やな」,https://news.yahoo.co.jp/articles/87333174948ad6fd6f08a1e1b09009e9071f16fd,8/11(月) 19:15
2025-08-13,03:10,TTL,総合,13,朝日新聞,ポケモンカード、マックは300万枚準備「レアじゃない」転売に困惑,https://news.yahoo.co.jp/articles/3ace531ea2257b9d7bcf71f64bad32f1b73861c1,8/12(火) 18:00
2025-08-13,03:10,TTL,総合,14,デイリースポーツ,掛布雅之氏「どういう意図があるんだろう」５点ビハインドの六回からスタメンを外れた中野を起用した采配に「ここで使うならスタメンで良かったのでは」,https://news.yahoo.co.jp/articles/8476c4e5f13be36365b424bb915862cdfa5ac3eb,8/12(火) 20:20
2025-08-13,03:10,TTL,総合,15,共同通信,韓国前大統領妻を逮捕,https://news.yahoo.co.jp/articles/96005c71f4857ae902bdf418a096fad754b835a3,8/13(水) 0:43
2025-08-13,03:10,TTL,総合,16,中日スポーツ,倉田真由美さん、「『SNSのせいで甲子園辞退させられた』ではなく『SNSのおかげでいじめが闇に葬られなくてすんだ』でしょ」Xで私見,https://news.yahoo.co.jp/articles/1476e0952ffeb00b919e91ba31d92f5a64a940e1,8/12(火) 16:22
2025-08-13,03:10,TTL,総合,17,デイリースポーツ,超ソックリ！「さんま御殿」可愛すぎる高学歴の双子姉妹に騒然　米国・ドイツ育ち→名門大ＪＤ　ＴＯＥＩＣ９００点超　ネットも「区別つかない」「可愛すぎる」「全く違い分からない」,https://news.yahoo.co.jp/articles/07babbbaf66b0ff191ca1e113522ee42a19c56a4,8/12(火) 20:57
2025-08-13,03:10,TTL,総合,18,ほ・とせなNEWS,スーパーのレジで…小銭をまき散らした女性。すると近くにいた人が手渡した”まさかのモノ”に「なんて素敵な方」「心がじんわり温かくなった」,https://news.yahoo.co.jp/articles/2bf986b28bf4c9bf194ea9f40261836b5b2f0fc4,8/11(月) 21:47
2025-08-13,03:10,TTL,総合,19,ねとらぼ,「え…？大正解が出てきた、、!」　甘露寺蜜璃のコスプレの“まさかの完成度”に「伊黒には渡しません。私と結婚します」「かっっっわいい！！！」と反響,https://news.yahoo.co.jp/articles/a4b2514421d8c81cef1f95ca0ab19350899558b1,8/12(火) 12:35
2025-08-13,03:10,TTL,総合,20,ABEMA TIMES,女子レスラー、“パンツを掴んで”丸め込みの大胆技…ベテランが見せたまさかの“機転”にファンもヒヤヒヤ「あわやだったな」,https://news.yahoo.co.jp/articles/46930f00c73dd03ac01d35fa70cd2afb7c4d6a02,8/12(火) 20:00
2025-08-13,03:10,TTL,総合,21,東海テレビ,名門ホテルでディナーの宿泊客7人が嘔吐等の体調不良「食中毒」とは断定されず 6月にもありいずれも原因不明,https://news.yahoo.co.jp/articles/b4bee977f6de1ffba4dfec8616ef779f6aaf8056,8/12(火) 21:17
2025-08-13,03:10,TTL,総合,22,めざましmedia,「可愛い過ぎだろぉ」辻󠄀希美 生まれたばかりの次女の初めての笑顔を公開!“ババ”が「令和版のゲップ」に初挑戦する姿も,https://news.yahoo.co.jp/articles/793b93fd9a3cd6af0f2ad6b076a0eb07b92729a3,8/12(火) 21:31
2025-08-13,03:10,TTL,総合,23,ねとらぼ,コメダ珈琲で“ミニコメバスケット”を頼んだら「写真と違う」→とんでもない“詐欺”が1200万再生　「明らかにおかしい」,https://news.yahoo.co.jp/articles/e6828d0fa09fa3dcf44c37fc73a94b061d75d9c9,8/12(火) 10:30
2025-08-13,03:10,TTL,総合,24,スポニチアネックス,杉浦太陽　第5子出産・辻希美の退院に「ノン、ベビちゃん、おめでとう」きょうだいの抱っこショットも,https://news.yahoo.co.jp/articles/5b0607168115f40acafd447aceeaa2abaafd0bcf,8/12(火) 22:59
2025-08-13,03:10,TTL,総合,25,TBS NEWS DIG Powered by JNN,ジャンボ機墜落の”凄惨な現場”で遺体と寝た夜　「職業を間違えた」ーー陸自元幕僚長が語るストレス障害との闘い　日航機墜落40年,https://news.yahoo.co.jp/articles/bfa9cc95f6d0c6f7e2698e6e4af6222ed3cda348,8/12(火) 17:03
2025-08-13,03:10,TTL,総合,26,西スポWEB OTTO！,「おパンツがオレンジ色に？」プロレスラー井上貴子〝トリック〟写真に反響「アップにして見てしまった」「よく見ると…」「オレンジがセクシー」,https://news.yahoo.co.jp/articles/dd69fa78b3124c64b13202186a1dc49d51c3c3c6,8/12(火) 23:50
2025-08-13,03:10,TTL,総合,27,西スポWEB OTTO！,「47歳には見えない!」夫はアイドル、2児の母…47歳女優〝真っピンク〟近影にネット衝撃「妖艶なお姉さん」「こんなにもピンクが似合うママさんはいないよー!」,https://news.yahoo.co.jp/articles/51f16eb4c42ba93eb5f0dbbbcddd3da0ebfe5684,8/13(水) 0:10
2025-08-13,03:10,TTL,総合,28,聯合ニュース,［速報］尹前大統領妻の逮捕状発付　韓国地裁,https://news.yahoo.co.jp/articles/cf0ea01b90212daa49f74db14f2d0fee405e7b22,8/13(水) 0:05
2025-08-13,03:10,TTL,総合,29,ABEMA TIMES,相性最悪だろ… 山本由伸に“疑惑の判定”「試合にならん」「どこ見てんだよ」不運すぎる“謎ジャッジ”が物議を醸す「調子狂わされた」,https://news.yahoo.co.jp/articles/5b6c9995fea7632934761492598739cda48b318c,8/12(火) 21:51
2025-08-13,03:10,TTL,総合,30,ねとらぼ,「三回目の購入」DEAN＆DELUCA（ディーンアンドデルーカ）の“エコバッグ”が大好評！「肩に掛けられるので本当に楽」「とにかく最強最高です」,https://news.yahoo.co.jp/articles/d60fc9db30d59d66692b5691142fdd4f6d179e2d,8/12(火) 22:00
2025-08-13,03:10,TTL,総合,31,東スポWEB,亀田史郎氏　相次ぐリング事故の根本原因を指摘「スパーリングなのよ。そこで来んのよ」,https://news.yahoo.co.jp/articles/e6feadca5fc60f3cc4fc483a0dde302c02a5fec4,8/9(土) 5:16
2025-08-13,03:10,TTL,総合,32,デイリースポーツ,「なんてことなの！？」五輪沸かせた卓球美女、激変姿に反響「これはかわいい」「ワオ！」,https://news.yahoo.co.jp/articles/abf48508e71bed684a6a3741b46503c861a2d968,8/12(火) 23:03
2025-08-13,03:10,TTL,総合,33,ねとらぼ,布に文字を書き、のりをたっぷりつけて乾かすと……「天才」　目からウロコな“刺しゅう作品”が2300万再生【海外】,https://news.yahoo.co.jp/articles/cf2fe8df9347c5d71597b32fa40cc98c0feda79d,8/12(火) 11:00
2025-08-13,03:10,TTL,総合,34,スポーツ報知,【巨人】阿部監督、７回無失点の森田駿哉に「要所でフォークも落ちて三振取れてたし、素晴らしい内容だった」,https://news.yahoo.co.jp/articles/862cd5a59920ab9e7dccc93b44315e2149a02666,8/12(火) 21:08
2025-08-13,03:10,TTL,総合,35,スポニチアネックス,巨人・森田駿哉が明かす　初回1死満塁ピンチで坂本勇人にかけられた言葉とは,https://news.yahoo.co.jp/articles/b19c62093e43f632bd4b7a1736cbf8d420ec85d2,8/12(火) 22:47
2025-08-13,03:10,TTL,総合,36,TBS NEWS DIG Powered by JNN,“前代未聞の行動”トランプ大統領　オバマ元大統領の肖像画をホワイトハウス入り口から人目につかない場所に移動するよう指示　CNN報道“軽蔑的な行為”と指摘,https://news.yahoo.co.jp/articles/f1dd64ee39055ab82ce179682c6c2eb61d22c35d,8/12(火) 23:55
2025-08-13,03:10,TTL,総合,37,よろず～ニュース,ひろゆき氏〝ハッピーセット問題〟に提案「店内で食べ終わったお客さんにだけポケカ配ればよくない？」,https://news.yahoo.co.jp/articles/dd8bd06b20eee6c00e9ec40bdc9fb77b611a39b6,8/12(火) 18:22
2025-08-13,03:10,TTL,総合,38,東スポWEB,【バスケ】日本代表〝運命の一戦〟へホーバス監督巡る議論沸騰「解任全然ある」「今から監督いる？」,https://news.yahoo.co.jp/articles/1bf174f75d736d83b07d2a2f88a696e1cef428b2,8/12(火) 21:10
2025-08-13,03:10,TTL,総合,39,西スポWEB OTTO！,おちょこ片手にほろ酔い…桜井日奈子〝んもぅ〟ショットに反響「今までで一番かわいい」「粋ですね」「浴衣姿バッチリ」,https://news.yahoo.co.jp/articles/b2496f6d12f90a6a5e63187bfae4f378a6ed4fbd,8/12(火) 23:10
2025-08-13,03:10,TTL,総合,40,時事通信,黒木瞳さん、初の慰霊登山　宝塚同期が犠牲、事故40年で決意　日航機墜落,https://news.yahoo.co.jp/articles/f3be59a8ca77b4e6c18b760ed2468b48b342dfdb,8/12(火) 16:36
