scrp_date,scrp_time,genre_en,genre_jp,rank,media_jp,title,link,date_original
2025-08-13,01:08,TTL,総合,1,スポニチアネックス,カズレーザーと二階堂ふみの関係を「1年前から知っていた」芸人　「ずっと黙ってた」スタジオ「えー！！」,https://news.yahoo.co.jp/articles/ffd1d66086a714f0a5b67d42a7765c515124087c,8/12(火) 17:57
2025-08-13,01:08,TTL,総合,2,デイリースポーツ,橋下氏が砲撃　反発する高市早苗氏に「『親中』とレッテル貼るような人は日本のトップにはなれない。日本保守党レベル」　中国に厳しい態度は賛成だが　総裁選は期待していると,https://news.yahoo.co.jp/articles/c410cb9eb07165f1b705d4f8bc1f822549c19f02,8/12(火) 22:57
2025-08-13,01:08,TTL,総合,3,スポニチアネックス,金村義明氏　広陵の出場辞退で“みんな不幸になる”とため息「一番かわいそうなのは…」,https://news.yahoo.co.jp/articles/24317660ab054816b56aad8d7d759ea32651e3a8,8/12(火) 21:50
2025-08-13,01:08,TTL,総合,4,TBS NEWS DIG Powered by JNN,「いつ帰ってくるんや」日航機墜落で娘3人亡くし錯乱した母、守り続けた父の最期　悲しみを抱きながら生きた遺族の40年,https://news.yahoo.co.jp/articles/8b0c413ba947106b4210a9e2d59f43897eddbed7,8/11(月) 17:01
2025-08-13,01:08,TTL,総合,5,オリコン,第5子出産の辻希美、無事退院を報告「杉浦家家族7人生活がスタート」  天使のようなbabyフォト公開,https://news.yahoo.co.jp/articles/4ba9155bc09557ddfeb19b5093b4a6e63e84f7c8,8/12(火) 21:58
2025-08-13,01:08,TTL,総合,6,ほ・とせなNEWS,寝転がってスマホを見るパパ。しかし、おしりをよく見ると…「1番安全な場所ね笑」「最高のゆりかご」,https://news.yahoo.co.jp/articles/986b64e913c192f83c471dd51b51a82445ec2e9e,8/12(火) 22:07
2025-08-13,01:08,TTL,総合,7,ねとらぼ,夜にカップ焼きそばを食べようと、お湯を注いで4分後……「いるね」　共感殺到の光景に「ああ…」「怖い話だった」,https://news.yahoo.co.jp/articles/c3bf0bf7095f8a0d5b7126bd6fd70325dd8a3f24,8/12(火) 22:00
2025-08-13,01:08,TTL,総合,8,TBS NEWS DIG Powered by JNN,ジャンボ機墜落の”凄惨な現場”で遺体と寝た夜　「職業を間違えた」ーー陸自元幕僚長が語るストレス障害との闘い　日航機墜落40年,https://news.yahoo.co.jp/articles/bfa9cc95f6d0c6f7e2698e6e4af6222ed3cda348,8/12(火) 17:03
2025-08-13,01:08,TTL,総合,9,デイリースポーツ,超ソックリ！「さんま御殿」可愛すぎる高学歴の双子姉妹に騒然　米国・ドイツ育ち→名門大ＪＤ　ＴＯＥＩＣ９００点超　ネットも「区別つかない」「可愛すぎる」「全く違い分からない」,https://news.yahoo.co.jp/articles/07babbbaf66b0ff191ca1e113522ee42a19c56a4,8/12(火) 20:57
2025-08-13,01:08,TTL,総合,10,日刊スポーツ,やす子“激変”最新姿に騒然「本当にやす子さん？」「一瞬誰か」「うわっ」「どうしたの？？」,https://news.yahoo.co.jp/articles/841e73e048f281aa4c7a45410b8b5613f3fe13d6,8/12(火) 20:29
2025-08-13,01:08,TTL,総合,11,デイリースポーツ,掛布雅之氏「どういう意図があるんだろう」５点ビハインドの六回からスタメンを外れた中野を起用した采配に「ここで使うならスタメンで良かったのでは」,https://news.yahoo.co.jp/articles/8476c4e5f13be36365b424bb915862cdfa5ac3eb,8/12(火) 20:20
2025-08-13,01:08,TTL,総合,12,CoCoKARAnext,物議を醸した早田ひなvs張本美和の“メディカルタイムアウト”　その真相,https://news.yahoo.co.jp/articles/70b740b1c0c16e235232a730b71073a7bf8bac83,8/12(火) 19:02
2025-08-13,01:08,TTL,総合,13,時事通信,黒木瞳さん、初の慰霊登山　宝塚同期が犠牲、事故40年で決意　日航機墜落,https://news.yahoo.co.jp/articles/f3be59a8ca77b4e6c18b760ed2468b48b342dfdb,8/12(火) 16:36
2025-08-13,01:08,TTL,総合,14,めざましmedia,「可愛い過ぎだろぉ」辻󠄀希美 生まれたばかりの次女の初めての笑顔を公開!“ババ”が「令和版のゲップ」に初挑戦する姿も,https://news.yahoo.co.jp/articles/793b93fd9a3cd6af0f2ad6b076a0eb07b92729a3,8/12(火) 21:31
2025-08-13,01:08,TTL,総合,15,西スポWEB OTTO！,「そんなにくっつかれたら…」ドラマ共演から8年…37歳女優が年上俳優の隣でデレデレ…顔を寄せ合う〝ウエディング〟姿に反響「ベストカップル賞」ドラマオフショットが話題,https://news.yahoo.co.jp/articles/76f03034ac281c80dba2b68ec23d91e350db4238,8/12(火) 23:30
2025-08-13,01:08,TTL,総合,16,ねとらぼ,「え…？大正解が出てきた、、!」　甘露寺蜜璃のコスプレの“まさかの完成度”に「伊黒には渡しません。私と結婚します」「かっっっわいい！！！」と反響,https://news.yahoo.co.jp/articles/a4b2514421d8c81cef1f95ca0ab19350899558b1,8/12(火) 12:35
2025-08-13,01:08,TTL,総合,17,朝日新聞,ポケモンカード、マックは300万枚準備「レアじゃない」転売に困惑,https://news.yahoo.co.jp/articles/3ace531ea2257b9d7bcf71f64bad32f1b73861c1,8/12(火) 18:00
2025-08-13,01:08,TTL,総合,18,東海テレビ,名門ホテルでディナーの宿泊客7人が嘔吐等の体調不良「食中毒」とは断定されず 6月にもありいずれも原因不明,https://news.yahoo.co.jp/articles/b4bee977f6de1ffba4dfec8616ef779f6aaf8056,8/12(火) 21:17
2025-08-13,01:08,TTL,総合,19,デイリースポーツ,「一瞬誰」「綺麗すぎて三度見」人気女性芸人が本人も驚くレベチ激変→「どこのモデルかと」「５６歳と思えない」大反響,https://news.yahoo.co.jp/articles/c1b5e00816e62c43dfd29564b19209f9518c8474,8/12(火) 19:35
2025-08-13,01:08,TTL,総合,20,ねとらぼ,コメダ珈琲で“ミニコメバスケット”を頼んだら「写真と違う」→とんでもない“詐欺”が1200万再生　「明らかにおかしい」,https://news.yahoo.co.jp/articles/e6828d0fa09fa3dcf44c37fc73a94b061d75d9c9,8/12(火) 10:30
2025-08-13,01:08,TTL,総合,21,ねとらぼ,「三回目の購入」DEAN＆DELUCA（ディーンアンドデルーカ）の“エコバッグ”が大好評！「肩に掛けられるので本当に楽」「とにかく最強最高です」,https://news.yahoo.co.jp/articles/d60fc9db30d59d66692b5691142fdd4f6d179e2d,8/12(火) 22:00
2025-08-13,01:08,TTL,総合,22,中日スポーツ,倉田真由美さん、「『SNSのせいで甲子園辞退させられた』ではなく『SNSのおかげでいじめが闇に葬られなくてすんだ』でしょ」Xで私見,https://news.yahoo.co.jp/articles/1476e0952ffeb00b919e91ba31d92f5a64a940e1,8/12(火) 16:22
2025-08-13,01:08,TTL,総合,23,スポニチアネックス,杉浦太陽　第5子出産・辻希美の退院に「ノン、ベビちゃん、おめでとう」きょうだいの抱っこショットも,https://news.yahoo.co.jp/articles/5b0607168115f40acafd447aceeaa2abaafd0bcf,8/12(火) 22:59
2025-08-13,01:08,TTL,総合,24,ABEMA TIMES,女子レスラー、“パンツを掴んで”丸め込みの大胆技…ベテランが見せたまさかの“機転”にファンもヒヤヒヤ「あわやだったな」,https://news.yahoo.co.jp/articles/46930f00c73dd03ac01d35fa70cd2afb7c4d6a02,8/12(火) 20:00
2025-08-13,01:08,TTL,総合,25,スポーツ報知,結婚発表から１０か月…山本舞香の最新姿「ほんまに」「えーまって！！」「どんだけ」「めっちゃ…」,https://news.yahoo.co.jp/articles/4ccbdd3b92a18dfa0204664a92b4788132e1fc2a,8/12(火) 12:25
2025-08-13,01:08,TTL,総合,26,スポニチアネックス,オダギリジョー「人にこんなこと言わないんですけど、天才」　信頼置く実力派女優を実名告白,https://news.yahoo.co.jp/articles/b4c36ca9d4cd73d8ac5254a9e76918f577ebd3ad,8/12(火) 19:38
2025-08-13,01:08,TTL,総合,27,ねとらぼ,雑草ボーボーだった“ばあちゃん家の庭”→孫がスコップ1本でDIYしたら……　1カ月後、まさかの光景に「羨ましぎる」「努力の賜物やな」,https://news.yahoo.co.jp/articles/87333174948ad6fd6f08a1e1b09009e9071f16fd,8/11(月) 19:15
2025-08-13,01:08,TTL,総合,28,東スポWEB,亀田史郎氏　相次ぐリング事故の根本原因を指摘「スパーリングなのよ。そこで来んのよ」,https://news.yahoo.co.jp/articles/e6feadca5fc60f3cc4fc483a0dde302c02a5fec4,8/9(土) 5:16
2025-08-13,01:08,TTL,総合,29,日刊スポーツ,黒木瞳「やっと来られたよ」宝塚同期の親友、北原遥子さんの墓碑を訪問　日航機墜落事故から40年,https://news.yahoo.co.jp/articles/c85513f4cb72b176ad99ba1878f6c92e2912c2a3,8/12(火) 19:50
2025-08-13,01:08,TTL,総合,30,ENCOUNT,辻希美、第5子次女の“ゲップ顔”に「か、か、か、可愛い過ぎだろぉ」　初笑顔ショットも披露,https://news.yahoo.co.jp/articles/0948cb0a098c6f6037a9e6432141a72ca0930f24,8/12(火) 19:45
2025-08-13,01:08,TTL,総合,31,イーファイト,誰！？角田夏実、飛行機の中の姿が別人すぎて恐怖！「横に座ったら嫌よね」,https://news.yahoo.co.jp/articles/4bce08d05327289c0c1dffcfcbacc884efe06e53,8/12(火) 15:38
2025-08-13,01:08,TTL,総合,32,オリコン,カズレーザー＆二階堂ふみ交際を「知ってた」芸人が明らかに　『VIVANT』オチも聞く「ふみさん、仲嶺さんの仲」,https://news.yahoo.co.jp/articles/438b57dcaddc8b04b0c0a09a3c7d6da1b4fae4ad,8/12(火) 21:37
2025-08-13,01:08,TTL,総合,33,デイリースポーツ,阪神・藤川監督　“鯉キラー”大竹の乱調に「今日は広島の方が上回ったというところ」中野、佐藤輝のスタメン外には「そのへんはまあまあ」,https://news.yahoo.co.jp/articles/7157e12663ef271c512eee1cac9aa145c82be2e2,8/12(火) 21:42
2025-08-13,01:08,TTL,総合,34,デイリースポーツ,高市早苗議員　橋下氏に猛反論「なぜ私が自民を出ないといけない？」分裂離党「やんない！」　バリバリ「親中派」以外は出て行けと言われてるに等しい話　「橋下氏は以前から私に批判的」とも,https://news.yahoo.co.jp/articles/5280ad66f503d98127c3b905ee67557471551e04,8/12(火) 17:55
2025-08-13,01:08,TTL,総合,35,スポーツ報知,【巨人】阿部監督、７回無失点の森田駿哉に「要所でフォークも落ちて三振取れてたし、素晴らしい内容だった」,https://news.yahoo.co.jp/articles/862cd5a59920ab9e7dccc93b44315e2149a02666,8/12(火) 21:08
2025-08-13,01:08,TTL,総合,36,ほ・とせなNEWS,スーパーのレジで…小銭をまき散らした女性。すると近くにいた人が手渡した”まさかのモノ”に「なんて素敵な方」「心がじんわり温かくなった」,https://news.yahoo.co.jp/articles/2bf986b28bf4c9bf194ea9f40261836b5b2f0fc4,8/11(月) 21:47
2025-08-13,01:08,TTL,総合,37,ねとらぼ,布に文字を書き、のりをたっぷりつけて乾かすと……「天才」　目からウロコな“刺しゅう作品”が2300万再生【海外】,https://news.yahoo.co.jp/articles/cf2fe8df9347c5d71597b32fa40cc98c0feda79d,8/12(火) 11:00
2025-08-13,01:08,TTL,総合,38,中日スポーツ,『あんぱん』「そういう意味か…」「核心をついた」八木（妻夫木聡）の鉄子（戸田恵子）に対する指摘にSNSは反応,https://news.yahoo.co.jp/articles/4057cc2ed3c6e1a95e4a21b8d09f816693e67605,8/12(火) 18:30
2025-08-13,01:08,TTL,総合,39,Yahoo!ニュース オリジナル 特集,僕は物珍しい目で見られる人生と割り切っている──芸歴20年・鈴木福21歳の現実 #今つらいあなたへ,https://news.yahoo.co.jp/articles/7f4ab793c55006797466aeebe76438d93324e9ed,8/12(火) 15:00
2025-08-13,01:08,TTL,総合,40,日刊スポーツ,石丸伸二氏、資格試験不合格を告白「みっともない、恥ずかしすぎる」苦笑い「普通に時間…」,https://news.yahoo.co.jp/articles/4413b82be278972394034de97d9371173e9c6a16,8/12(火) 5:10
