scrp_date,scrp_time,genre_en,genre_jp,rank,media_jp,title,link,date_original
2024-03-07,15:22,world,国際,1,BBC News,ゼレンスキー大統領とギリシャ首相の会談中に爆発、5人死亡　両首脳は無事　,https://news.yahoo.co.jp/articles/afc237525418a32d085507f9c3f7c0b08e25e11e,3/7(木) 11:44
2024-03-07,15:22,world,国際,2,中央日報日本語版,「妻が集団性的暴行受けた」夫に慰労金を渡して「認証ショット」撮影したインド警察,https://news.yahoo.co.jp/articles/b6c8c701271c45aba0e310658d6699f3b000ea21,3/7(木) 14:36
2024-03-07,15:22,world,国際,3,中央日報日本語版,ニューヨーク市内を走る「旭日旗人力車」を通報したら…米警察「管轄ではない」,https://news.yahoo.co.jp/articles/f76ac4f1b7224e98db2daf5cc6aeb79ef89ac0d7,3/7(木) 10:46
2024-03-07,15:22,world,国際,4,CGTN Japanese,タクシーに乗った男性が多額のチップ 運転手が警察署へ直行,https://news.yahoo.co.jp/articles/911efe9a29db630041b821b3b971bc6a2d96f19f,3/6(水) 18:32
2024-03-07,15:22,world,国際,5,中央日報日本語版,中国では売れず、ドイツでは燃え…テスラ時価総額７６０億ドル蒸発,https://news.yahoo.co.jp/articles/e3bbe10db5f2ae7459474dcde103240cd7991830,3/7(木) 8:42
2024-03-07,15:22,world,国際,6,FNNプライムオンライン,ロシア黒海艦隊の哨戒艇をドローン攻撃　ウクライナが“戦果”を発表　空と海でロシアに大きなダメージを与える,https://news.yahoo.co.jp/articles/f3d313df631371765b552863d2ac238dde88e5af,3/7(木) 14:13
2024-03-07,15:22,world,国際,7,読売新聞オンライン,ゼレンスキー氏夫人、バイデン氏の招待固辞か…「クリミア容認」ナワリヌイ氏の妻と同席避けた見方も,https://news.yahoo.co.jp/articles/2b747a6b23ff387c7e486a4e80221396a9f1a0f0,3/7(木) 12:19
2024-03-07,15:22,world,国際,8,中央日報日本語版,「病院のトイレ直し、院長の子どものお迎え」…製薬会社営業マン、医師のパワハラ暴露,https://news.yahoo.co.jp/articles/90b6df9e32158f9dfb68e5991b8adcb2c8c2b807,3/7(木) 10:11
2024-03-07,15:22,world,国際,9,中央日報日本語版,【時視各角】韓国半導体、油断してすべて追いつかれた,https://news.yahoo.co.jp/articles/063da9b370014e0d0748631714977cc2e816c429,3/7(木) 11:28
2024-03-07,15:22,world,国際,10,CNN.co.jp,新型コロナワクチン、２１７回接種した結果は？　ドイツ人男性を調査,https://news.yahoo.co.jp/articles/efbe9b5671d3177fdb2dbb3ae14d642edc4fa0a8,3/7(木) 13:00
2024-03-07,15:22,world,国際,11,BBC News,﻿映画撮影中の発砲死傷事件、武器担当者に有罪評決　米俳優ボールドウィン氏と共に訴追,https://news.yahoo.co.jp/articles/a1384022cf7278a405df63b8dcbb3df33ef611b1,3/7(木) 13:32
2024-03-07,15:22,world,国際,12,ＡＦＰ＝時事,コロナワクチン217回接種、独男性に「副反応なし」 研究,https://news.yahoo.co.jp/articles/c83c18d400ff29a7a8070bfad03b14887b6fcea1,3/7(木) 11:28
2024-03-07,15:22,world,国際,13,CNN.co.jp,１０００柱の人骨出土、腺ペスト犠牲者を集団埋葬　ドイツ,https://news.yahoo.co.jp/articles/8b7c9f074a68aca07b2314dd02346b349db6b397,3/7(木) 12:37
2024-03-07,15:22,world,国際,14,中央日報日本語版,「米国、韓国・ドイツにも対中国半導体輸出統制の圧力」,https://news.yahoo.co.jp/articles/8e91a964a90bd860f23e8dd0021c0dd3fecea1b3,3/7(木) 14:16
2024-03-07,15:22,world,国際,15,朝日新聞デジタル,中国の外交部門トップ、米に警告　「圧力続ければ必ず自らを害する」,https://news.yahoo.co.jp/articles/89caa293e7519a029e725e30c9a5a204716bdc52,3/7(木) 13:50
2024-03-07,15:22,world,国際,16,アジアプレス・ネットワーク,＜訃報＞在日脱北者の石川学さんが死去　14歳で北朝鮮に帰国　波乱万丈の人生65年　北朝鮮政府相手に裁判闘争も,https://news.yahoo.co.jp/articles/037cf3c4b4bddb60c9a634a727db7ab0293e2021,3/7(木) 12:34
2024-03-07,15:22,world,国際,17,中央日報日本語版,日本産ブリを韓国産として販売していた業者７カ所摘発,https://news.yahoo.co.jp/articles/8c8163508156e3834cc332e8746a84d5a4467c4f,3/7(木) 14:09
2024-03-07,15:22,world,国際,18,朝鮮日報日本語版,チャンネル登録者36万人の韓国人男性ユーチューバー、「三一節って何をやる日？」発言で物議,https://news.yahoo.co.jp/articles/3389643471be9f34123090ca3008bdd7d9c8d7cf,3/7(木) 11:35
2024-03-07,15:22,world,国際,19,中央日報日本語版,「生殖器切断に集団強姦まで」…国連が明らかにしたハマス奇襲当日,https://news.yahoo.co.jp/articles/faabc68f139618b620c6728d9bc9d4a63c407cf5,3/6(水) 7:09
2024-03-07,15:22,world,国際,20,中央日報日本語版,「海外でリコールされた製品、韓国国内で堂々と流通…６３％が中国製」,https://news.yahoo.co.jp/articles/998bba1a5862815fbbb545b0501cc6b55cbc52ba,3/7(木) 10:20
2024-03-07,15:22,world,国際,21,朝鮮日報日本語版,尹大統領「専門医中心に病院の構造を転換、PA看護師を活用」　研修医依存からの脱却に向け舵取り,https://news.yahoo.co.jp/articles/6da51bada45353afa754ce5e92216d437b0bae4a,3/7(木) 14:35
2024-03-07,15:22,world,国際,22,The News Lens Japan,中国の比船妨害を同行取材のCNNが目撃 放水砲の攻撃受けフィリピン人乗員4人負傷,https://news.yahoo.co.jp/articles/e5db03b83649715d5c26f072e8445b10acae4f77,3/7(木) 11:50
2024-03-07,15:22,world,国際,23,ＡＦＰ＝時事,米国はフィリピンを「駒」として利用 中国,https://news.yahoo.co.jp/articles/76c9cc53c7d92380fb98142f0dbc1ecfba2840f0,3/7(木) 12:46
2024-03-07,15:22,world,国際,24,CNN.co.jp,ロシア新興財閥から差し押さえた豪華ヨット、維持整備に月１億５千万円　米政府が売却申請,https://news.yahoo.co.jp/articles/6e58661c3fd3778021c5437652c0051d2f17f1c9,3/7(木) 10:38
2024-03-07,15:22,world,国際,25,ＡＦＰ＝時事,中絶は「殺人」 アルゼンチン大統領、高校生の前で明言,https://news.yahoo.co.jp/articles/f05b07c33ad9e50943652db84166c4d87ad82abb,3/7(木) 13:40
2024-03-07,15:22,world,国際,26,ロイター,ロシア企業利益、23年は前年比35.2％増　制裁影響から回復,https://news.yahoo.co.jp/articles/a57b5aafbe26f958bd8489da92544e4601841725,3/7(木) 14:37
2024-03-07,15:22,world,国際,27,読売新聞オンライン,撤退表明のヘイリー氏、トランプ氏支持明言せず「良い政治とは人々を呼び込むもの」…トランプ氏に変化促す,https://news.yahoo.co.jp/articles/f2075b58f2d980505f068f3ed7114a4f3cb5942a,3/7(木) 6:49
2024-03-07,15:22,world,国際,28,産経新聞,中国外相、台湾独立は「最大の破壊要素」　総統選も「中国の一部という事実は変えられず」,https://news.yahoo.co.jp/articles/b3e60fd62a873da9af3d70f5ec24aef76996ce4f,3/7(木) 13:30
2024-03-07,15:22,world,国際,29,時事通信,米エピックのアプリストア拒否　CEOの運営批判原因か　アップル,https://news.yahoo.co.jp/articles/980160d94849e8af8e74a7d913076e98d61ba8db,3/7(木) 14:11
2024-03-07,15:22,world,国際,30,朝鮮日報日本語版,アラビア文字入りの服を着た女性がランチで入店、コーランの一節と勘違いされて群衆300人に取り囲まれる　／パキスタン,https://news.yahoo.co.jp/articles/6fa7f672465cc7b31296fe119774571e0bf5d76f,3/6(水) 11:13
2024-03-07,15:22,world,国際,31,CNN.co.jp,外国人旅行者を集団で強姦の容疑、７人逮捕　インド東部,https://news.yahoo.co.jp/articles/204cd511e47a76784297f27d0aab6c806dae6a23,3/6(水) 19:49
2024-03-07,15:22,world,国際,32,ロイター,焦点：トランプ氏の資金集めに訴訟費用の逆風、大口献金獲得がカギ,https://news.yahoo.co.jp/articles/83436722bdba924f8a48af1ddd2bf12c51493980,3/7(木) 13:10
2024-03-07,15:22,world,国際,33,ハンギョレ新聞,木星の衛星「エウロパ」、１日に１千トンの酸素を生成…生命の神秘に一歩前進,https://news.yahoo.co.jp/articles/67123d4ba853be298d4134d0f0211dd167676c6c,3/6(水) 10:09
2024-03-07,15:22,world,国際,34,KOREA WAVE,実際より重い表示「インチキ」計量器も…韓国“ぼったくり”市場を自治体が摘発,https://news.yahoo.co.jp/articles/470839d7a29277a5ce42c2d36e23a240eb95f18a,3/7(木) 7:03
2024-03-07,15:22,world,国際,35,朝鮮日報日本語版,9万ウォン分給油してカード払い、「満タン」扱いされ15万ウォン請求される…韓国金融監督院、セルフGS利用に注意喚起,https://news.yahoo.co.jp/articles/17c97cfe5d1f74d36bc8bf31724c4f13505b5dbe,3/7(木) 11:05
2024-03-07,15:22,world,国際,36,FNNプライムオンライン,【異変】トランプ氏スーパーチューズデー圧勝も陣営にファミリー感なし…メラニア夫人とイバンカ氏どこに?8年前との違い,https://news.yahoo.co.jp/articles/2f59e08fda1f0fae006e4191b88d3870350648b3,3/6(水) 20:02
2024-03-07,15:22,world,国際,37,ロイター,中国石炭輸入、1─2月は前年比＋23％　過去最高,https://news.yahoo.co.jp/articles/df18d7b0a8f9c1c8f27f56cd6ad676c1fd72d298,3/7(木) 13:58
2024-03-07,15:22,world,国際,38,読売新聞オンライン,四つの刑事事件で「被告人」トランプ氏、選挙期間は裁判の遅延戦術で抗戦…一つは逃げ道少ない「厄介な事件」,https://news.yahoo.co.jp/articles/9d7c62d5915c0a6fea26c7ae74e6d7bfc064ca45,3/7(木) 10:13
2024-03-07,15:22,world,国際,39,ＡＦＰ＝時事,血の涙流す聖母マリア像、教会が否定 イタリア,https://news.yahoo.co.jp/articles/735499e793a340168ff5f76a2fc47d9278c89e61,3/7(木) 14:55
2024-03-07,15:22,world,国際,40,中央日報日本語版,中国が建造中の４隻目空母、初の原子力空母の可能性,https://news.yahoo.co.jp/articles/879f7f91232834177867b447d8e45b026eeceba6,3/7(木) 6:59
