scrp_date,scrp_time,genre_en,genre_jp,rank,media_jp,title,link,date_original
2024-11-26,19:07,sports,スポーツ,1,TBS NEWS DIG Powered by JNN,MVPはセは投手史上最多タイ3度目のG菅野智之「野球人生で忘れられないシーズン」パは首位打者のH近藤健介【NPBアワーズ】,https://news.yahoo.co.jp/articles/95126f5badef9bf77dc9e4524999479e0e0b7d49,11/26(火) 18:02
2024-11-26,19:07,sports,スポーツ,2,スポーツ報知,【ＮＰＢアワード】新人王は巨人・船迫大雅と西武・武内夏暉…船迫は球団最年長２８歳で受賞,https://news.yahoo.co.jp/articles/805208d3161881042e121613fefc267c9a9e4f4c,11/26(火) 17:31
2024-11-26,19:07,sports,スポーツ,3,スポーツ報知,【巨人】戸郷翔征が１億８０００万円→３億円で契約更改　「最多勝、沢村賞を取れるように」,https://news.yahoo.co.jp/articles/c5121dbbc3987a5a1a8ada235be59ed63c577cfb,11/26(火) 15:01
2024-11-26,19:07,sports,スポーツ,4,デイリースポーツ,田中将が「提示を受けた印象としては期待はされていないな、と」と心境　球団には「感謝しかない」とも　楽天退団発表後初の取材に対応,https://news.yahoo.co.jp/articles/d52ebf71dc00443ef03309eea2f002f4699567c2,11/26(火) 11:56
2024-11-26,19:07,sports,スポーツ,5,サンケイスポーツ,楽天・田中将大が条件提示を受けた際に「もう期待はされていないんだなと。居場所がないと受け取りました」,https://news.yahoo.co.jp/articles/e137fd07de694d5fdcdf543b8afc0c2cd0f681e5,11/26(火) 13:04
2024-11-26,19:07,sports,スポーツ,6,東スポWEB,ドジャースは本気だった！「１５年７億ドル以上」要求のソトに正式オファー,https://news.yahoo.co.jp/articles/f9202461473fe262bcf7fcc82aefb5c89c6bba87,11/26(火) 16:02
2024-11-26,19:07,sports,スポーツ,7,東スポWEB,河村勇輝は早々にＮＢＡ本契約へ　米メディア予想「Ｇリーグにとっては強すぎる」,https://news.yahoo.co.jp/articles/de69b1264cb971e02a1282df4016d13a83ade70d,11/26(火) 17:26
2024-11-26,19:07,sports,スポーツ,8,中日スポーツ,菊池雄星、『3年97億円』で日本との年俸格差があらためて浮き彫りに…平均年俸メジャーの16分の1、トップ10選手の平均年俸も13分の1,https://news.yahoo.co.jp/articles/b5cf0fc9ac466019cb8148d05f637704609990e5,11/26(火) 14:51
2024-11-26,19:07,sports,スポーツ,9,デイリースポーツ,巨人・坂本勇人が１億減の５億円、単年契約で更改「（ダウンは）当たり前のこと」と複数年は希望せず　１９年目の来季へ「一年一年が勝負」,https://news.yahoo.co.jp/articles/1212786d605fc27111c712287fe07d3e011be483,11/26(火) 14:15
2024-11-26,19:07,sports,スポーツ,10,J-CASTニュース,「仙人かと思った」「全く別人みたい」　落合博満（70）現在の姿が話題に...報道番組出演を報告,https://news.yahoo.co.jp/articles/7ddba79c55ffc0c24293b5672ee0c43ebc31b8c2,11/26(火) 15:56
2024-11-26,19:07,sports,スポーツ,11,産経新聞,勝ってもバカ騒ぎせず、プレミア12制覇の台湾に称賛の声　「旗を立てるあの国とは違う」,https://news.yahoo.co.jp/articles/1bb167be86cb7b4c899f6a0ebd7b4d0065c7f5bd,11/26(火) 13:23
2024-11-26,19:07,sports,スポーツ,12,スポニチアネックス,06年2冠馬メイショウサムソンが心不全で死す　21歳　通算27戦9勝、GI4勝　08年凱旋門賞挑戦,https://news.yahoo.co.jp/articles/977aeb7f1c16db2f1e3e6e57175d814b0661dc7c,11/26(火) 17:52
2024-11-26,19:07,sports,スポーツ,13,スポニチアネックス,退団表明の田中将　楽天と決裂したのは「気持ちの部分」球団から期待の言葉も「素直に受け取れなかった」,https://news.yahoo.co.jp/articles/574a440b3f16cbadbac172e0b5854406af9d1914,11/26(火) 13:00
2024-11-26,19:07,sports,スポーツ,14,スポニチアネックス,巨人・坂本勇人が新たに単年契約「1億円くらいダウンです。ダウンは当たり前」「凄く苦しい時期あった」,https://news.yahoo.co.jp/articles/2b5381688e063e387d534a69fea3756b7d3e2862,11/26(火) 14:10
2024-11-26,19:07,sports,スポーツ,15,J-CASTニュース,田中将大は「巨人にマッチする」　球団OBは猛プッシュ「菅野が抜ける穴はかなり大きい」,https://news.yahoo.co.jp/articles/78391a671d0eea2ece9b3ecc6279e5444b64cd7e,11/26(火) 16:15
2024-11-26,19:07,sports,スポーツ,16,東スポWEB,楽天・辰己涼介に台湾メディア注目　妻セリーナさんのロッテ戦「ＫＹ応援」蒸し返し,https://news.yahoo.co.jp/articles/43800cbef5bf25938351101d992e6a31adfe3021,11/26(火) 16:11
2024-11-26,19:07,sports,スポーツ,17,J-CASTニュース,「終わったなこのチーム」田中将大「退団」に元楽天監督辛らつ　大功労者への対応に怒り「俺たち人間なんだぞ」,https://news.yahoo.co.jp/articles/4c91e0cbfeedb0d1265d2e4ef9500ddb8c152ea5,11/25(月) 13:45
2024-11-26,19:07,sports,スポーツ,18,サッカー批評Web,久保建英も「いいね」日本代表・堂安律の美人妻、「可愛い」「えぐい」「爆美女」デコルテ＆おでこ丸出し超接近ショットに熱視線「リップが…」,https://news.yahoo.co.jp/articles/927c1c9541f4db21cb03720fa56666dc635e8c36,11/26(火) 15:31
2024-11-26,19:07,sports,スポーツ,19,スポニチアネックス,退団表明の田中将　新天地はNPB希望　楽天との再交渉は「考えてないも何も、別にそういうお話もない」,https://news.yahoo.co.jp/articles/d4e5f295b086d10f2d1e730127b01809c03b9a0c,11/26(火) 12:49
2024-11-26,19:07,sports,スポーツ,20,スポーツ報知,【ロッテ】小島和哉、５５００万増の１・６億円でサイン　４年連続規定投球回到達のエース左腕「いい意味の“誤算”になりたい」,https://news.yahoo.co.jp/articles/7cad18e53a7ac32f0561259f820279b0390f1946,11/26(火) 15:13
2024-11-26,19:07,sports,スポーツ,21,netkeiba,史上最長の「中579日」で重賞初制覇なるか チャレンジCで実績馬が1年7カ月ぶり復帰だ,https://news.yahoo.co.jp/articles/5b538224badc262adf305349c97d85ff7acc8590,11/26(火) 17:30
2024-11-26,19:07,sports,スポーツ,22,CoCoKARAnext,プレミア12制覇後の“深夜の焼肉会”　台湾代表が臨時対応の日本人従業員に1万円の謝礼「わざわざ店を開けてくれたから」,https://news.yahoo.co.jp/articles/35bec3f5281b992afefb77365143a07e14bfee01,11/26(火) 11:01
2024-11-26,19:07,sports,スポーツ,23,デイリースポーツ,楽天・辰己がＮＰＢ表彰式で衝撃のコスプレ３連発！侍→殺人鬼→将軍　会場からどよめきと爆笑「侍ジャパンもかかってます」山川も苦笑い,https://news.yahoo.co.jp/articles/c7b143e18ca042fc9e00de694d06b6ca23cbad89,11/26(火) 16:56
2024-11-26,19:07,sports,スポーツ,24,日刊ゲンダイDIGITAL,田中将大獲得へヤクルト資金捻出？大量4助っ人放出の相関関係…結果残した優良株までバッサリ,https://news.yahoo.co.jp/articles/72d1dcd09a9761058d2be7339e03ba76d7f16049,11/26(火) 11:32
2024-11-26,19:07,sports,スポーツ,25,イーファイト,開始ゴングと同時にKO！一瞬のスキを突いたパンチに「これは世界最速記録だ」＝素手ボクシング,https://news.yahoo.co.jp/articles/78f923bf8d143684ee85168bf71e63909ea15b90,11/26(火) 18:04
2024-11-26,19:07,sports,スポーツ,26,日刊スポーツ,電撃移籍が報じられた菊池雄星の妻、深津瑠美さんが女子アナ仲間とランチ「楽しい時間でした」,https://news.yahoo.co.jp/articles/a50c6c283168b365848f5178714c25481add7189,11/26(火) 18:10
2024-11-26,19:07,sports,スポーツ,27,デイリースポーツ,巨人・坂本が阪神ＦＡの大山にラブコール「いい子なので来てほしい」　実現なら競争激化必至も「ジャイアンツは常に勝たないといけないチーム」,https://news.yahoo.co.jp/articles/b55c0f293b1d554f766893bc97d1b5d9f202837a,11/26(火) 14:58
2024-11-26,19:07,sports,スポーツ,28,スポニチアネックス,阪神・富田は約3倍増で笑顔のサイン「5勝したいなというのはある」来季は先発転向も視野,https://news.yahoo.co.jp/articles/e7e86ae7dff4aa306091ab128253f47ad3ec2043,11/26(火) 16:59
2024-11-26,19:07,sports,スポーツ,29,RONSPO,なぜエンゼルスは菊池雄星を3年97億円の大型契約で獲得したのか…「すぐに球団のエースになれる」とMLB公式サイト…大谷翔平が去る原因となった暗黒時代から抜け出す切り札,https://news.yahoo.co.jp/articles/2a868d144c5a1436cfe1a78045d9586d75750335,11/26(火) 6:01
2024-11-26,19:07,sports,スポーツ,30,夕刊フジ,「誰とも会いたくない…」立浪前監督の気になる近況　中日OB会欠席「タニマチは大事だろうけど、顔を出さなきゃダメだろ」苦言も,https://news.yahoo.co.jp/articles/5802805260041bf1cb525131f590726b06907da7,11/26(火) 17:00
2024-11-26,19:07,sports,スポーツ,31,デイリースポーツ,巨人の戸郷翔征が球団最速３億円の大台到達　１億２０００万増で契約更改「最多勝、沢村賞を取りにいく」,https://news.yahoo.co.jp/articles/c6fdc50a070d60604d2e541c4dbc0b351007b74c,11/26(火) 14:32
2024-11-26,19:07,sports,スポーツ,32,スポーツ報知,【巨人】小林誠司「まだまだ若い選手に負けない」１０００万円増で契約更改,https://news.yahoo.co.jp/articles/1538cf5fd2e11239a26cfa36861e957eb71dd654,11/26(火) 13:08
2024-11-26,19:07,sports,スポーツ,33,中日スポーツ,【中日】木下拓哉、200万円増の7000万円でサイン…複数年契約も明かす  FA行使も残留決断「人の動向で自分の動向が決まるのが嫌だった」,https://news.yahoo.co.jp/articles/1c70a0c3b841579a5e0e9c8b5a4d786d290a67fc,11/26(火) 15:04
2024-11-26,19:07,sports,スポーツ,34,Full-Count,ドジャース、ソトに契約提示か　米報道、ヤンキースら5球団…“1000億円級”の争奪戦も,https://news.yahoo.co.jp/articles/3a6ec1d3c316b6410cbd82b1caa20fceed1c8f4c,11/26(火) 14:16
2024-11-26,19:07,sports,スポーツ,35,日刊ゲンダイDIGITAL,佐々木朗希×ドジャースの相思相愛に“亀裂”か…スポンサー収入期待の広告代理店にもウマミなし,https://news.yahoo.co.jp/articles/c117e96ef08794e6d498c25299dc7438c84e125a,11/26(火) 11:37
2024-11-26,19:07,sports,スポーツ,36,ABEMA TIMES,外に出ろ！久保建英に大ブーイング！足を踏みつけられて転倒悶絶も直後の“頭脳プレー”に相手サポーターが大騒ぎ,https://news.yahoo.co.jp/articles/e1ea03330e067839469d651bc36fc08056da30d4,11/26(火) 11:54
2024-11-26,19:07,sports,スポーツ,37,日刊ゲンダイDIGITAL,八村塁の止まらぬ“口撃”にバスケ協会会長なぜ沈黙？ 巨額の退職金まで約束されていながらの無責任,https://news.yahoo.co.jp/articles/9339a9106c1e777fc0b4d32048acd3091e78cff7,11/26(火) 11:32
2024-11-26,19:07,sports,スポーツ,38,Full-Count,想像絶する衣装に会場騒然「くそ笑った」　1人だけ異次元…楽天27歳にX衝撃「やばすぎる」,https://news.yahoo.co.jp/articles/e1398f213ddd9c762f5acaa381bdcb99a207cf39,11/26(火) 17:44
2024-11-26,19:07,sports,スポーツ,39,デイリースポーツ,ＭＶＰ、新人王【票内訳】巨人・菅野は岡本和、戸郷らと争う　セ新人王には１０選手に票が入る,https://news.yahoo.co.jp/articles/6f2c20b282ca35c74c96a79b2eed088ffc7cb244,11/26(火) 18:31
2024-11-26,19:07,sports,スポーツ,40,Full-Count,プレミアで見つけた逸材「NPBと契約するだろう」　魔球で翻弄…27歳を米記者が称賛,https://news.yahoo.co.jp/articles/f52394e4a6882e4aff74e11aaaa0d57a2664eccd,11/26(火) 17:34
