scrp_date,scrp_time,genre_en,genre_jp,rank,media_jp,title,link,date_original
2024-11-26,11:32,TTL,総合,1,まいどなニュース,パーキングに車を駐車→戻ったら大破… 修理費530万円、もらい事故なのに相手提示280万円、 被害者悲痛「なぜ泣き寝入り」【弁護士に聞いた】,https://news.yahoo.co.jp/articles/e6e2760d92f86a06876824213f971f543967f142,11/26(火) 6:50
2024-11-26,11:32,TTL,総合,2,まいどなニュース,通話料12万9321円の請求、中1息子が通話中のまま放置　その理由に唖然「高い勉強代だけどため息」「LINEの無料通話に慣れて…」,https://news.yahoo.co.jp/articles/5e772461a9f0847815ab851cc2bbc928774eb7b4,11/26(火) 7:20
2024-11-26,11:32,TTL,総合,3,日刊スポーツ,ヘンリー王子とメーガン妃、離婚の危機に「結婚生活はそれほど長く続かないだろう」王室専門家,https://news.yahoo.co.jp/articles/22158a3dc218f21c3fe2dfd8fa4fd03fe9b0cb7b,11/26(火) 8:34
2024-11-26,11:32,TTL,総合,4,ABEMA TIMES,「大相撲には似合わない」藤井康生アナが異例の苦言 そのとき何が？ 熱戦の陰で問題視された観客のマナー,https://news.yahoo.co.jp/articles/0f5487bbdc04eef6dd1310bdf04e8db1ca3856c5,11/26(火) 6:22
2024-11-26,11:32,TTL,総合,5,ファイナンシャルフィールド,旅行中に「オービス」が反応し、自宅から「100キロ以上」離れた警察署から「出頭依頼」が来ました。遠くて行けない場合はどうすればよいのでしょうか…？,https://news.yahoo.co.jp/articles/89673d53ce54fa35bbe9b627ec718a097931224e,11/25(月) 19:11
2024-11-26,11:32,TTL,総合,6,RONSPO,なぜエンゼルスは菊池雄星を3年97億円の大型契約で獲得したのか…「すぐに球団のエースになれる」とMLB公式サイト…大谷翔平が去る原因となった暗黒時代から抜け出す切り札,https://news.yahoo.co.jp/articles/2a868d144c5a1436cfe1a78045d9586d75750335,11/26(火) 6:01
2024-11-26,11:32,TTL,総合,7,オリコン,アグネス・チャン、超広大な住まいを公開　“門から家まで歩いて5分”“庭にゴルフ場”,https://news.yahoo.co.jp/articles/aaab25d5d504471e48061a8cf1047ea8660dae1a,11/26(火) 7:00
2024-11-26,11:32,TTL,総合,8,まいどなニュース,アナウンサーが「市町」を「しまち」と読んで“苦情”→読み方には理由があった　現役アナの投稿が話題「勉強になる」,https://news.yahoo.co.jp/articles/e169650d870803c4d23cfa69624cec46cbcc9c8f,11/26(火) 7:35
2024-11-26,11:32,TTL,総合,9,スポニチアネックス,「海に眠るダイヤモンド」いづみの正体発覚　実は…初回に出ていた“大ヒント”　鋭い視聴者発見「すげえ」,https://news.yahoo.co.jp/articles/bb4e294de557fe7f8bcd5964b005a461121fa69d,11/26(火) 10:05
2024-11-26,11:32,TTL,総合,10,馬トク報知,【注目馬動向】ドウデュースの有馬記念参戦が正式決定　武豊騎手とグランプリ連覇で有終Ｖへ友道調教師「何とかいい形になれば」,https://news.yahoo.co.jp/articles/f736dc94b6047b3d8aa61902489debdd08fba6f0,11/26(火) 9:58
2024-11-26,11:32,TTL,総合,11,ねとらぼ,「理解できない」　大谷翔平と真美子さんの“スキンシップ”に海外驚き　「文化は100%違う」「伝説だわ」,https://news.yahoo.co.jp/articles/78f29b52bc4a25c2e2523587e959eddcae565601,11/25(月) 19:03
2024-11-26,11:32,TTL,総合,12,ITmedia ビジネスオンライン,「牛丼500円時代」の幕開け　なぜ吉野家は減速し、すき家が独走したのか,https://news.yahoo.co.jp/articles/ac202e692fe28fb731be32866e5a32a7d57a3e28,11/26(火) 8:10
2024-11-26,11:32,TTL,総合,13,ねとらぼ,辻希美の高2長女、「明日皆さんにご報告があります」　16歳最後の日の意味深投稿に注目集まる,https://news.yahoo.co.jp/articles/8b70613186eba3cf17a49310b98d4d3e90271534,11/25(月) 19:50
2024-11-26,11:32,TTL,総合,14,TBS NEWS DIG Powered by JNN,東京・世田谷区のコンビニ強盗傷害事件　商品奪うも従業員に気づかれ“頭突き” 逃走していた49歳男逮捕　警視庁,https://news.yahoo.co.jp/articles/f82eddb055947be75d3736c56fc7951d35758b71,11/21(木) 12:04
2024-11-26,11:32,TTL,総合,15,くるまのニュース,クルマの希望ナンバー「358」なぜ人気？ 意味が分かれば「1031（天才！）」かも!? 語呂合せじゃない「謎の数字」の由来とは？,https://news.yahoo.co.jp/articles/99722f10d059691ba5d96c2a162870c74146bc04,11/26(火) 9:10
2024-11-26,11:32,TTL,総合,16,ねとらぼ,百均で多肉植物を購入→半年以上放置してしまったが……　驚きの結果に「すごーい！」「品種は何ですか！？」,https://news.yahoo.co.jp/articles/345c0f2f38f2a646de5ee34ca4a288dc32415db0,11/26(火) 8:30
2024-11-26,11:32,TTL,総合,17,日刊ゲンダイDIGITAL,ヤクルト2位 モイセエフ・ニキータ 《生きていくために日本に来ました》父が明かす壮絶半生【ドラフト選手の“家庭の事情”】,https://news.yahoo.co.jp/articles/cb9e0be2ea6c09dcdacd24d8f412ab24c97f079e,11/26(火) 9:06
2024-11-26,11:32,TTL,総合,18,ENCOUNT,人気YouTuber、無免許で1000万円の高級外車購入「ローンで払ってる」　教習車との違いを実感,https://news.yahoo.co.jp/articles/2ab76765b8df800a1754a0a4d638312002e826b1,11/26(火) 9:53
2024-11-26,11:32,TTL,総合,19,ABEMA TIMES,「一体、いくら貰えるんだ？」1本7万円の“分厚い”束に騒然 大相撲、力士の懸賞金が「少年ジャンプ」「セカンドバッグみたい」「夢あるなぁ」ネットで話題,https://news.yahoo.co.jp/articles/fe6458a8109d4f62a5484ddf7cd0b7c64bd205a2,11/26(火) 10:22
2024-11-26,11:32,TTL,総合,20,ねとらぼ,日本に1店舗のみの“完璧なマクドナルド”が778万表示の話題　地元民も「そんなすごい店やったんか…」「たまに使ってるけどそんなすげぇとこだったのね」,https://news.yahoo.co.jp/articles/6458c3720d30aaae158c5604a5726761e4d65889,11/26(火) 7:40
2024-11-26,11:32,TTL,総合,21,テレビ朝日系（ANN）,斎藤知事「ボランティアで参加」PR会社に70万円　公選法違反の可能性は？,https://news.yahoo.co.jp/articles/6f878965cf81d207286f126011f4c940c3137d6e,11/26(火) 2:46
2024-11-26,11:32,TTL,総合,22,デイリースポーツ,斎藤知事選挙問題のＰＲ会社　女性社長が２９日に知事らから表彰予定→「欠席」申し入れ　取材に担当者、表彰自体は「協議中」,https://news.yahoo.co.jp/articles/6d1d88f341135a91e869cc086a6bce7810f32627,11/26(火) 10:56
2024-11-26,11:32,TTL,総合,23,スポーツ報知,辻希美＆杉浦太陽の長女・希空さん「皆さんにご報告があります」　母は祝福「おめでとう」,https://news.yahoo.co.jp/articles/c4e8b5eb432bcd800688b97f1572d6a065aa95c6,11/26(火) 10:55
2024-11-26,11:32,TTL,総合,24,まいどなニュース,タラは引っ越しトラックから捨てられた犬だった…元飼い主を待ち続けた公園で虐待され妊娠させられた愛犬の過去「どんな酷い飼い主のことも犬は…」,https://news.yahoo.co.jp/articles/f9b2d72d0ac36b004c0ba78f44222dc7fd6055bc,11/26(火) 7:25
2024-11-26,11:32,TTL,総合,25,ゴルフのニュース,4億5443万円を稼いだ古江彩佳がトップ　日本選手の日米合算賞金ランキングを算出したら3億円超えが4人も！,https://news.yahoo.co.jp/articles/4a3002e1ce2a0aaedc6dd1fbb9c28ca361d69d6f,11/26(火) 9:10
2024-11-26,11:32,TTL,総合,26,Full-Count,33歳メジャーリーガーが私財を投じ…　岩手に誕生の複合野球施設「野球は冬のスポーツ」,https://news.yahoo.co.jp/articles/99d2234e3b274fb7e81eb640ce1e45234fa63dd7,11/26(火) 7:50
2024-11-26,11:32,TTL,総合,27,共同通信,写真家、橋村奉臣さんが死亡　NYで突き飛ばされ転倒,https://news.yahoo.co.jp/articles/d29b9f45be17a69644706603d51059bf510debc5,11/26(火) 9:51
2024-11-26,11:32,TTL,総合,28,東スポWEB,斎藤元彦知事〝失職〟の可能性「ないわけではない」 元検事がテレ朝番組で,https://news.yahoo.co.jp/articles/e2a50a683d96d5d925f51097fe8b1533240fd9f8,11/26(火) 10:41
2024-11-26,11:32,TTL,総合,29,日刊スポーツ,斎藤元彦知事、歯切れ悪っ…兵庫知事選SNS戦略の舞台裏「暴露」に慎重な物言い,https://news.yahoo.co.jp/articles/694a6d7c7c91579d860f1b218428915b935b1443,11/26(火) 7:54
2024-11-26,11:32,TTL,総合,30,J-CASTニュース,「終わったなこのチーム」田中将大「退団」に元楽天監督辛らつ　大功労者への対応に怒り「俺たち人間なんだぞ」,https://news.yahoo.co.jp/articles/4c91e0cbfeedb0d1265d2e4ef9500ddb8c152ea5,11/25(月) 13:45
2024-11-26,11:32,TTL,総合,31,読売新聞オンライン,川淵三郎の「つい口走った」歴史的失言の裏側、会見場を退席し指示した「すぐ電話せぇ」,https://news.yahoo.co.jp/articles/9af96083b8ac043eb0fa944671217e3e0614c46e,11/26(火) 10:00
2024-11-26,11:32,TTL,総合,32,スポーツ報知,ドジャースに元サイ・ヤング賞左腕加入か,https://news.yahoo.co.jp/articles/9229a84e217686008693ab4297f751c5404a4b3b,11/26(火) 10:54
2024-11-26,11:32,TTL,総合,33,ABEMA TIMES,楽天を電撃退団の田中将大、すぐさま獲得調査を開始と報道にあがった“意外な球団”とは,https://news.yahoo.co.jp/articles/96f1ba9fb5cace4032358c7353a3c6d0da87635b,11/26(火) 6:32
2024-11-26,11:32,TTL,総合,34,47NEWS,「寿命半分」を掲げた電車、登場３０年超で〝再就職〟できる秘訣は？　ＪＲ東日本２０９系、置き換え用車両も判明　【鉄道なにコレ！？】第６８回,https://news.yahoo.co.jp/articles/f12afe4d440aa31a01982e0968687c86862ff470,11/25(月) 10:02
2024-11-26,11:32,TTL,総合,35,ベースボールキング,菊池雄星がエンゼルスと3年6300万ドルで契約合意　MLB公式サイトが発表,https://news.yahoo.co.jp/articles/4862d404c49ca012ee9de00e91b39c7898895aa5,11/26(火) 6:20
2024-11-26,11:32,TTL,総合,36,デイリースポーツ,斎藤知事の公選法違反疑惑　文書は「全部嘘でした」しか「解消法ないのでは」と選挙プランナー,https://news.yahoo.co.jp/articles/01f4fa29a43e9bc921f30671f696b56017521a73,11/26(火) 10:14
2024-11-26,11:32,TTL,総合,37,日刊スポーツ,堀江貴文氏「批判してるやつくそ」鈴木紗理奈不倫報道巡る“岡村隆史の発言への批判”を批判,https://news.yahoo.co.jp/articles/310466a6d0cfaacdcfa1a1c05170354ba61fd9f4,11/26(火) 9:43
2024-11-26,11:32,TTL,総合,38,産経新聞,「刑務所で最期…無念だろう」池袋暴走事故の飯塚受刑者死亡　遺族の松永さんコメント,https://news.yahoo.co.jp/articles/bb8edd524a6dc304eedf128069011a33c15bc11b,11/25(月) 17:03
2024-11-26,11:32,TTL,総合,39,スポニチアネックス,日本ハム矢沢が契約更改　アップ提示受けサイン　二刀流は来季も継続「開幕スタメンが第1の目標」,https://news.yahoo.co.jp/articles/6bf31a1147d85cc442e1dad63e985652a0f76c03,11/26(火) 10:47
2024-11-26,11:32,TTL,総合,40,日刊ゲンダイDIGITAL,斎藤元彦知事が百条委トンズラで大誤算！公選法違反疑惑に“逃げの答弁”連発も「事前収賄罪」の可能性,https://news.yahoo.co.jp/articles/e89cda01d0304ad410adb932409d78cbf4a2d4fb,11/26(火) 10:52
