scrp_date,scrp_time,genre_en,genre_jp,rank,media_jp,title,link,date_original
2025-05-24,19:06,business,経済,1,テレ東プラス,マイナンバーカード本格運用で浮き彫りになる光と影…医療現場の反発、救急の課題とは？,https://news.yahoo.co.jp/articles/6ae9887248721d3ee44c1bcea4c9a204ea4d3b61,5/24(土) 8:10
2025-05-24,19:06,business,経済,2,ねとらぼ,「店舗での寝泊まり行為」も発覚……　チョコザップが“悪質利用者”に「強制退会」などの措置を実施,https://news.yahoo.co.jp/articles/aa962dba3ac30cabd8ea0873f0058974bf191c08,5/24(土) 7:30
2025-05-24,19:06,business,経済,3,産経新聞,USスチール買収、日鉄の計画承認に傾いたトランプ氏　背景には高関税政策の限界も,https://news.yahoo.co.jp/articles/2dbde79ee533b553a6f2598abf73916a20222749,5/24(土) 16:47
2025-05-24,19:06,business,経済,4,みんかぶマガジン,京大名誉教授「南海トラフ巨大地震は2030年代に必ず起きる」なぜなのか…東京で火災が起きる可能性が高い危険エリアと、地震発生時にタワマンで起きる最も恐ろしいこと,https://news.yahoo.co.jp/articles/9463270821e92dfdc71298dd5e25436612d4124b,5/24(土) 17:10
2025-05-24,19:06,business,経済,5,TBS NEWS DIG Powered by JNN,「ちいかわ」のハッピーセット わずか1日で販売終了、30日からの3回目の販売も中止　日本マクドナルド発表,https://news.yahoo.co.jp/articles/d97f424b187aac3c84ee8bbb734154c767caae41,5/24(土) 13:22
2025-05-24,19:06,business,経済,6,ファイナンシャルフィールド,国民全員に「5万円給付」の案が出たけど、「減税のほうがいい」という意見も！ 実際どんな違いがあるの？ それぞれのメリット・デメリットを解説,https://news.yahoo.co.jp/articles/c1e4f05f297dc62585ee1d5313ae9a1b65a98e9c,5/24(土) 11:31
2025-05-24,19:06,business,経済,7,LIMO,65歳以上「貯蓄4000万円以上」「貯蓄100万円未満」はそれぞれ何割？6月支給分から厚生年金と国民年金は1.9％増額へ,https://news.yahoo.co.jp/articles/e920e6883c6790f14990600825feaf1ed6a0c8c3,5/24(土) 15:02
2025-05-24,19:06,business,経済,8,産経新聞,マクドナルドでLサイズ超える大きさ「グランドポテト」「グランドコーク」　6年ぶり復活,https://news.yahoo.co.jp/articles/1c9ea68d76dcf010107af1913f44df353ce487a5,5/15(木) 14:12
2025-05-24,19:06,business,経済,9,LIMO,40～50歳代の貯蓄額「平均」と「中央値」はいくら？老後に向けて貯蓄を増やす対策3つ,https://news.yahoo.co.jp/articles/d78efe1be07854dadd33b22dc50c5f79139a6a9f,5/24(土) 14:02
2025-05-24,19:06,business,経済,10,テレビ朝日系（ANN）,「ざまあみろ」会社に仕返し“リベンジ退職”重要データ削除も 変わる日本の退職事情,https://news.yahoo.co.jp/articles/e86e81a2108f8667fbad05b61b28568cad7f55e2,5/21(水) 16:00
2025-05-24,19:06,business,経済,11,朝日新聞,乗っ取られた証券口座、闇サイトに14万件　ダークウェブで売買か,https://news.yahoo.co.jp/articles/356d842769323bff43cd04fde318cd1daf6deb25,5/24(土) 6:00
2025-05-24,19:06,business,経済,12,乗りものニュース,ホントに架線が無くなってる…！ “非電化化”されて”電車的な気動車”で災害復旧したかつての大幹線「奥羽本線」 コストカットの背景は？,https://news.yahoo.co.jp/articles/9e1c781f61f497131e2b2fa1ccf734248ef74f44,5/24(土) 15:12
2025-05-24,19:06,business,経済,13,みんかぶマガジン,全国民への現金給付「自民党も一時検討」…待望する声もある一方で「なぜ効率が悪いのか」経済アナリスとが解説,https://news.yahoo.co.jp/articles/9df8a7de855c2727d562c5a7e14118e964ff4831,5/24(土) 9:10
2025-05-24,19:06,business,経済,14,MBSニュース,【速報】万博の1日の来場者数が「過去最多」23日の来場者は約13万9000人　ついに開幕日を超える　一方で2820万人想定のペースは下回る,https://news.yahoo.co.jp/articles/9f09b2177ce82c3ea4454b4dbd215be782603d26,5/24(土) 9:46
2025-05-24,19:06,business,経済,15,FNNプライムオンライン,“コメ”をめぐる失言で江藤農水相が辞任…石破政権へのダメージと後任・小泉氏の影響力は,https://news.yahoo.co.jp/articles/929963ed136fa01f828f07cb852f8b0cfe821bf2,5/22(木) 19:02
2025-05-24,19:06,business,経済,16,MBSニュース,【速報】万博・東ゲート前はきょうも長蛇の列　あすから「アーリーゲートオープン」“開門ダッシュ”間に合わない問題解消なるか　5月中の午前9時10時台は空きなし,https://news.yahoo.co.jp/articles/e1a1364a148fadb149425801e5df8e391534b976,5/24(土) 8:46
2025-05-24,19:06,business,経済,17,AUTOCAR JAPAN,自動車史に残るフランスの名車　21選　世界を魅了した革新性と美しさ,https://news.yahoo.co.jp/articles/10105ed9e241c7d2d75a8b9606527acaa9511442,5/24(土) 18:25
2025-05-24,19:06,business,経済,18,ファイナンシャルフィールド,再雇用で「月収45万→22万円」になった夫。下がった分「給付金」で補てんされるそうですが、いくら受け取れるのでしょうか？「高年齢雇用継続給付」の給付金額を試算,https://news.yahoo.co.jp/articles/3139fb7259945da6bd664d223c4e4581b9139f33,5/24(土) 13:40
2025-05-24,19:06,business,経済,19,産経新聞,小泉農水相「5キロ2990円」投稿に店困惑　「今春からこの価格」「利用された感じ」,https://news.yahoo.co.jp/articles/4ba750fdb2be659887d34f59e58b754dcaaf3822,5/24(土) 7:00
2025-05-24,19:06,business,経済,20,FNNプライムオンライン（フジテレビ系）,小泉農水相「価格高騰が続くとコメ離れを起こす」コメ生産者らとの懇談で価格引き下げに理解求める,https://news.yahoo.co.jp/articles/42471286e834686b88a427ba125f926ce135a43c,5/24(土) 12:37
2025-05-24,19:06,business,経済,21,朝日新聞,西武鉄道に小田急から中古車両　リニューアルされ、引き継ぎ式,https://news.yahoo.co.jp/articles/2ca991d1d8e58810de6dc0932ff7bc044efefb40,5/24(土) 16:00
2025-05-24,19:06,business,経済,22,ファイナンシャルフィールド,夫が「なぜか車検の更新ができない」というのですが、「車検拒否」に該当しているのでしょうか…？ 車検の残りがあと1ヶ月もない場合どうしたらいい？,https://news.yahoo.co.jp/articles/2f28aaa4e4fada02cab7ebc70f4dd779c4e25cb0,5/24(土) 13:30
2025-05-24,19:06,business,経済,23,テレ東BIZ,【独自】日産 栃木工場の一部売却を検討,https://news.yahoo.co.jp/articles/b83e003d2748b029a259a6eac48ce60008d9f0c3,5/23(金) 22:51
2025-05-24,19:06,business,経済,24,ニュースイッチ,損保3グループの通期見通し、2社が当期減益…収支厳しく保険料引き上げ検討へ,https://news.yahoo.co.jp/articles/4d4793b55408d2c0d67707a37b0e4b6b91977471,5/24(土) 15:10
2025-05-24,19:06,business,経済,25,乗りものニュース,東急田園都市線の「最閑散駅」来年に一新！“駅周辺に広がる田畑”をモチーフにリニューアル,https://news.yahoo.co.jp/articles/fee281ac279e5dcd9d573267eb482af09f4511ba,5/23(金) 14:12
2025-05-24,19:06,business,経済,26,Bloomberg,ＥＵ、ＳＷＩＦＴから20行超のロシア銀行排除検討－新たな対ロ制裁で,https://news.yahoo.co.jp/articles/6b5abfc7b1d30259166d63ebdd50cda87bb11b70,5/24(土) 16:49
2025-05-24,19:06,business,経済,27,日刊自動車新聞,日産、リストラ費用の捻出へ資産を売却　横浜の本社ビルも検討,https://news.yahoo.co.jp/articles/0933d43964e4f0ddd6ada99d68a9754fed20cc72,5/23(金) 19:09
2025-05-24,19:06,business,経済,28,ファイナンシャルフィールド,昨年、住宅ローン「4000万円」を借り入れ！ 今年4月から基準金利が「0.25％→0.50％」へ上がったけど、今のところ私の返済額は増えていません。金利引き上げの“対象外”なのでしょうか？,https://news.yahoo.co.jp/articles/d2ad72cb5ab3985999a9c244f624d5edd4856c50,5/24(土) 13:50
2025-05-24,19:06,business,経済,29,読売新聞オンライン,トヨタ豊田章男会長の取締役選任、昨年は反対だった議決権行使助言会社ＩＳＳが賛成を推奨,https://news.yahoo.co.jp/articles/e06116cc38da1e02b7527c8ac20916982694531d,5/24(土) 17:03
2025-05-24,19:06,business,経済,30,ハフポスト日本版,ドンキの「全身長向け自転車」が半年で2500台突破！⇒135〜180cmまで乗れて買い替え不要。開発背景を聞いた,https://news.yahoo.co.jp/articles/e96288db36f670c4af67a5e190efb4967fffc581,5/24(土) 10:30
2025-05-24,19:06,business,経済,31,Webikeプラス,使わない時は折り畳んでコンパクトに！ デイトナより「FMDH-1 ドリンクホルダー」が登場,https://news.yahoo.co.jp/articles/4f841d0de2a9f746c0585b29d0ff09f2583c0816,5/24(土) 17:40
2025-05-24,19:06,business,経済,32,共同通信,自動車部品マレリにインド同業が買収提案,https://news.yahoo.co.jp/articles/8cd0ca0428e3e33557218e34f225586b60848308,5/24(土) 18:29
2025-05-24,19:06,business,経済,33,朝日新聞,「小泉氏就任で価格下がったのでない」　備蓄米でJA全農長野が声明,https://news.yahoo.co.jp/articles/63950539a63d698cf677147b47f3835ea29cfe5c,5/23(金) 17:12
2025-05-24,19:06,business,経済,34,テレ東プラス,「無印のコメ」で農家がピンチ！？「令和の米騒動」が招いた深刻な亀裂,https://news.yahoo.co.jp/articles/ce26919b422451c47debde27760cfc8e1e42b84f,5/17(土) 11:01
2025-05-24,19:06,business,経済,35,日刊自動車新聞,経営再建中のマレリ、インド大手のマザーサンが買収へ　不成立なら法的整理の可能性も,https://news.yahoo.co.jp/articles/f790a6d86eb5af9dd94d292d6280a6102776bcb9,5/24(土) 16:32
2025-05-24,19:06,business,経済,36,乗りものニュース,なぜ空自「F-35乗り」がグアムで汗水垂らして土いじり!? 日本人なら忘れちゃいけない“戦争の記憶”,https://news.yahoo.co.jp/articles/5c57223f79b1ad7ce7f5ca0cbf2c81620c6c9eef,5/24(土) 16:12
2025-05-24,19:06,business,経済,37,共同通信,自動車部品マレリHDに買収提案　インドの同業大手、26日協議へ,https://news.yahoo.co.jp/articles/fff70df7bd7bde79b9e76b4d62eac611d1d0eff6,5/24(土) 18:45
2025-05-24,19:06,business,経済,38,Bloomberg,日鉄副会長、中国鋼材輸入に通商措置を要求－今講じなければ手遅れに,https://news.yahoo.co.jp/articles/acbfb7cfdcfb552d68d517d05bbe0574c164c6d5,5/21(水) 2:00
2025-05-24,19:06,business,経済,39,ファイナンシャルフィールド,去年「部長」に昇進した友人は「年収1000万円」を超えたそうです。年収が1000万円を超える「給与所得者」はどのくらいいるのでしょうか？,https://news.yahoo.co.jp/articles/47a1f144446943f8ed2af5ad5794c53b63ff8a16,5/17(土) 13:50
2025-05-24,19:06,business,経済,40,産経新聞,トラブル「利用者間で解決」から方針転換　メルカリ、直接関与へ　転売「規約違反」は制限,https://news.yahoo.co.jp/articles/2d6b165ef32795c5363e0024a156d514c8dc02e1,5/22(木) 7:00
