scrp_date,scrp_time,genre_en,genre_jp,rank,media_jp,title,link,date_original
2024-08-18,20:05,TTL,総合,1,デイリースポーツ,東国原　次の総理「実は」自民議員に一番人気のある人物明かす　「へええーっ」スタジオに驚きの声　選挙目当てなら小泉進次郎氏とも,https://news.yahoo.co.jp/articles/a7773aee76caa3c4a34112b07f46a242f09a597d,8/18(日) 14:29
2024-08-18,20:05,TTL,総合,2,モデルプレス,山本耕史、妻・堀北真希さんとの結婚で「別れるという選択肢がなくなった」家庭での思いやりの大切さ語る,https://news.yahoo.co.jp/articles/394fdecfb09b261fb440fa835ee55d48e4b76373,8/18(日) 13:44
2024-08-18,20:05,TTL,総合,3,ほ・とせなNEWS,「不登校は病気と診断」全国初の不登校専門クリニック、前に進むための医学的アプローチ　#令和の子 #令和に働く,https://news.yahoo.co.jp/articles/7c35285c2059edb04066c4ad6aa5a183716304ba,8/18(日) 18:00
2024-08-18,20:05,TTL,総合,4,ほ・とせなNEWS,母「急に静かになったと思ったら…」泣いてたはずの娘の姿に「寝てると思ってたけど」母の投稿が20万再生,https://news.yahoo.co.jp/articles/e895c4bd4ab261ac03eabcc92828c8620140edb0,8/18(日) 11:30
2024-08-18,20:05,TTL,総合,5,スポーツ報知,【阪神】虎党が泣いている…“投壊”で４カード連続負け越し　球団史上初のリーグ連覇遠のく,https://news.yahoo.co.jp/articles/df0723d025e28341702f2ca2cb3db519b2a33366,8/18(日) 16:40
2024-08-18,20:05,TTL,総合,6,スポーツ報知,「ワイドナショー」兼近大樹、ＳＮＳ上での誹謗中傷問題で実名ポロリ　今田耕司がフォロー,https://news.yahoo.co.jp/articles/faf2dca0fc3ee2f47112cd5e28ab3af5216041ca,8/18(日) 14:00
2024-08-18,20:05,TTL,総合,7,中日スポーツ,大社・馬庭優太、計401球を投げて３戦連続完投　「1週間で500球」の制限によって準々決勝＆準決勝２試合で計236球が上限【甲子園】,https://news.yahoo.co.jp/articles/bc4e02ac9d8dac46cda85ec51d7582844fafcd78,8/18(日) 8:01
2024-08-18,20:05,TTL,総合,8,FBS福岡放送,【速報】5歳と7歳の女の子の死亡確認　福岡市早良区で西鉄バスと軽乗用車が正面衝突　計6人を病院に搬送,https://news.yahoo.co.jp/articles/1e706b046d45fe1a5570b9a92cadefac14269eca,8/18(日) 12:49
2024-08-18,20:05,TTL,総合,9,FNNプライムオンライン,「席譲れ!」マッチョ高齢者が「風紀正す」と若者に馬乗りで殴打…地下鉄でトラブル勃発…SNSでは賛否分かれる　中国,https://news.yahoo.co.jp/articles/2a7d008c4a180282886c44ac1851268d7955b1ae,8/18(日) 17:02
2024-08-18,20:05,TTL,総合,10,Hint-Pot,「その研究は思いつかなかった」　小学4年生の夏休みの自由研究に脱帽　大人もすっかり夢中に,https://news.yahoo.co.jp/articles/8e8cd767435ab9ba4967d6f5c283ff6e6839a1b6,8/18(日) 8:10
2024-08-18,20:05,TTL,総合,11,弁護士ドットコムニュース,「まさか」パラアスリートを襲った誹謗中傷、投稿者は「圧倒的格上」の日本代表だった…パラ五輪開幕直前の衝撃判決,https://news.yahoo.co.jp/articles/eff7ac485ecb33e5df2e4991bcadb4f86a6823e9,8/18(日) 10:20
2024-08-18,20:05,TTL,総合,12,ABEMA TIMES,あのちゃん、ノーメイク＆ノーセットで体重を初公開 「この細さでめちゃくちゃ働いてるからすごい」と話題,https://news.yahoo.co.jp/articles/df6c32211001964b6ff388b2df6b3cf4435aaabb,8/18(日) 11:46
2024-08-18,20:05,TTL,総合,13,デイリースポーツ,人気ナレーターが死去　６月に交通事故でＩＣＵに入院もよみがえらず　番組で報告,https://news.yahoo.co.jp/articles/fa55246b58afa2ed65d9036c916f6f812804f362,8/18(日) 10:19
2024-08-18,20:05,TTL,総合,14,デイリースポーツ,日本ハム・新庄監督　応援団のコールに注文「気合を入れてない試合なんて１回もない」　他のチームでも聞き「よくないなあ」,https://news.yahoo.co.jp/articles/b0e3d37ce40ef0ff1a96f05ac35d199ccbc8d42c,8/18(日) 16:05
2024-08-18,20:05,TTL,総合,15,中日スポーツ,王者・帝京大が予想外の完敗　青木恵斗主将「悪い流れを変えることができなかった」【大学ラグビー】,https://news.yahoo.co.jp/articles/bf74f018ebe3ae65d240d85d6aabb563475c8179,8/18(日) 17:54
2024-08-18,20:05,TTL,総合,16,日刊ゲンダイDIGITAL,フワちゃんに起死回生の一手？ 自撮り棒使いセクシー女優デビュー「脱いだらスゴい」説,https://news.yahoo.co.jp/articles/8aeb90ae5c65773cff045343d3a5e177483cd694,8/18(日) 9:06
2024-08-18,20:05,TTL,総合,17,オリコン,『そこまで言って委員会NP』ナレーター・きしめんさん、死去　番組が追悼・感謝…6月に交通事故【全文】,https://news.yahoo.co.jp/articles/540c1f973937816f677e3015f9037b855d22c3f8,8/18(日) 15:00
2024-08-18,20:05,TTL,総合,18,ファイナンシャルフィールド,保育料が高いので「毎月7万円はイタイよね」と愚痴ったら、「人前で言わないほうがいいよ」と注意されました。保育料で年収が分かるらしいのですが、どういうことでしょうか？,https://news.yahoo.co.jp/articles/611149150e3aafc1d1ec69ec87d04f406b8edadd,8/17(土) 13:40
2024-08-18,20:05,TTL,総合,19,中日スポーツ,『トド発言』謝罪、和田アキ子に擁護の声が相次ぐ 「かわいいつもりで言ったのだろう」「追撃批判の方が不快」,https://news.yahoo.co.jp/articles/f72dd7daf4787196cbab48c6868016c67bd51271,8/18(日) 13:30
2024-08-18,20:05,TTL,総合,20,スポーツ報知,ザック・セイバーＪｒ．、「Ｇ１」初優勝…辻陽太を破り史上２人目の外国人制覇…日本語で歓喜の絶叫「カチマシタ！」,https://news.yahoo.co.jp/articles/e8a3c4f06d57171e089afbb1898bd04d1f0189ae,8/18(日) 17:57
2024-08-18,20:05,TTL,総合,21,CoCoKARAnext,告発相次ぐパリ五輪の“メダル劣化問題” 金＆銀を手にした豪競泳スター選手も訴え「ちょっとぶつかっただけでへこんだ」,https://news.yahoo.co.jp/articles/942c4937bd5f4ac68d44d15124b60485dc47c1a1,8/18(日) 16:00
2024-08-18,20:05,TTL,総合,22,スポニチアネックス,ヤクルト44歳・石川雅規　4回持たず今季ワースト6失点KO…今季初神宮で歴代最多記録かかるもガックリ,https://news.yahoo.co.jp/articles/f152ba97f40c15601c79d6aa35b8046f41bde9e6,8/18(日) 19:23
2024-08-18,20:05,TTL,総合,23,ENCOUNT,パリ五輪・阿部詩の号泣を一部が批判　大御所芸人「抑えきれなかったんよ。分かってやろうよ」,https://news.yahoo.co.jp/articles/82e858140147c42b1201d7d5acf1ae97407bc8f2,8/18(日) 13:46
2024-08-18,20:05,TTL,総合,24,日刊スポーツ,【町田】藤尾翔太「水かけPK」に賛否「大相撲で大量塩捲き力士と同じエンタメ」「白黒すべき」,https://news.yahoo.co.jp/articles/4684113155d792433c9d2f379577666727aa6569,8/18(日) 16:30
2024-08-18,20:05,TTL,総合,25,弁護士ドットコムニュース,パラ五輪日本代表女性アスリートに賠償命令　「投稿者に厳しく慰謝料も相場より高額」判決のポイント解説,https://news.yahoo.co.jp/articles/e659a5acea88d82aed31dd1f569d11bb3cabe883,8/18(日) 10:21
2024-08-18,20:05,TTL,総合,26,朝日新聞デジタル,快進撃の大社、打線好調の神村学園をどう抑えるか　第12日見どころ,https://news.yahoo.co.jp/articles/94636777a7699555cf7cf9136dd0af8b5192f915,8/18(日) 17:00
2024-08-18,20:05,TTL,総合,27,デイリースポーツ,完敗の阪神・岡田監督「聞くことあるか？」　１回４失点の伊藤将におかんむり「あんまり伝わってこんわな。俺一人で怒ってるみたい」,https://news.yahoo.co.jp/articles/dd91d9d8fa281d8e9ee0ddf89aef1ccfb659f116,8/18(日) 17:26
2024-08-18,20:05,TTL,総合,28,スポニチアネックス,レスリング五輪金メダリスト　2歳娘が競技デビューで銀メダル　「可愛らしい」「すごい」の声,https://news.yahoo.co.jp/articles/282b4ad5cbdd71bee537fe45adc82e0ba4876a60,8/18(日) 17:31
2024-08-18,20:05,TTL,総合,29,高校野球ドットコム,甲子園のヒーローがわずか4年でプロ野球を戦力外…育成契約を断り、社会人野球に進んだ本当の理由,https://news.yahoo.co.jp/articles/5de977fe9dc12f4aa3f92e23d6aa3f07f86be725,8/18(日) 12:15
2024-08-18,20:05,TTL,総合,30,みんかぶマガジン,頼むから菅さん、もう一度総理をやってくれ…戦後最長の実質賃金マイナス実現「岸田首相、やっと退陣」大災難,https://news.yahoo.co.jp/articles/6ac43644739a8a5212e9944aa4c71783887e72fd,8/18(日) 9:10
2024-08-18,20:05,TTL,総合,31,デイリースポーツ,阪神の敗因は森下のポジショニング　「ヘッドコーチ、外野守備コーチが言うべきこと」「こんな指示まで監督にさせていたらダメ」と西山秀二氏,https://news.yahoo.co.jp/articles/47bb47f12e0758f8e589175c03c606fc9b737bd8,8/18(日) 17:32
2024-08-18,20:05,TTL,総合,32,マイナビニュース,発達障害の息子の“居場所”を守ろうともがく家族…身近に感じた永作博美「自分も頑張ろうと」,https://news.yahoo.co.jp/articles/afffcec129a873782ffe01da16a2e6b5aaadd1a3,8/17(土) 18:00
2024-08-18,20:05,TTL,総合,33,スポニチアネックス,落合博満氏「本人は謝ったつもりなんでしょ」ロッテ坂本の死球後の態度に中畑氏は「ちょっとねイラ～っと」,https://news.yahoo.co.jp/articles/7ba702762aab495b4918eda766696585c2422caa,8/18(日) 17:49
2024-08-18,20:05,TTL,総合,34,くるまのニュース,日産「新型フェアレディZ“スポーツ”」登場へ!? “受注再開”の噂受け「ド迫力モデル」を開発！ より旧車デザインな「KUHL」仕様とは,https://news.yahoo.co.jp/articles/e31699cb88d02ced7edcfbc3c6039b0e84d94d77,8/18(日) 17:10
2024-08-18,20:05,TTL,総合,35,日刊スポーツ,「新千歳空港」「ハサミ紛失」Ｘトレンド入り「原因やばくない？」「俺なら言えない」様々な声,https://news.yahoo.co.jp/articles/d6a096bc54db4c4506a061cf6a99adb3d0cefecf,8/17(土) 16:33
2024-08-18,20:05,TTL,総合,36,スポニチアネックス,吉岡里帆　「メキシコ旅最後」仲良し女優＆アーティストとおそろトップス3S「美女3人」「ナイスバディ」,https://news.yahoo.co.jp/articles/b2908070b806e35402aea7fd20d6d2b2bf082f01,8/17(土) 18:13
2024-08-18,20:05,TTL,総合,37,スポニチアネックス,てんちむ、子供の父親についての“新情報”明かす「その人の子供が欲しかったんです」,https://news.yahoo.co.jp/articles/e5c51f62c5897be5631c3d006dc52be86f3698da,8/18(日) 15:50
2024-08-18,20:05,TTL,総合,38,日刊スポーツ,【バドミントン】「世の中にかわいさバレてしまう」田口真彩ファン複雑心境…渡辺勇大と新ペア,https://news.yahoo.co.jp/articles/f9dff1b1c2e1dba15b1a7fedd0facd2b6105373e,8/17(土) 16:06
2024-08-18,20:05,TTL,総合,39,時事通信,乱立模様、推薦人集め激化　「ポスト岸田」が汗、自民総裁選,https://news.yahoo.co.jp/articles/7098d2d4deaba4d618185edb894c8b100c265973,8/18(日) 7:04
2024-08-18,20:05,TTL,総合,40,日刊スポーツ,【バレー】米国女子銀ハンコックがパリで交通事故　コーチとタクシーで電柱激突　顔面など負傷,https://news.yahoo.co.jp/articles/2854d241c824c31691fba34cf06153ff16c52849,8/18(日) 18:47
