scrp_date,scrp_time,genre_en,genre_jp,rank,media_jp,title,link,date_original
2024-12-03,14:07,domestic,国内,1,みんかぶマガジン,「斎藤元彦知事は『人ごとのような対応』恐ろしいこと」…民主主義を否定するTBS「報道特集」テレビ屋“村瀬キャスター”の言いたい放題,https://news.yahoo.co.jp/articles/4dd38a05820d181347287562d962069c08ca7bd2,12/3(火) 9:10
2024-12-03,14:07,domestic,国内,2,中日スポーツ,立花孝志氏、兵庫県元幹部の私的情報とされるデータ　入手経緯の一部明かす　「議員に公益通報！」「ようやく…」ネット反応さまざま,https://news.yahoo.co.jp/articles/56789055c148dd9aa5474a4862514f03643fcf3d,12/2(月) 21:33
2024-12-03,14:07,domestic,国内,3,47NEWS,巨大軍需工場の悲劇、真っ先に攻撃の標的となり犠牲者多数　「東洋一」とうたわれゼロ戦エンジンなど製造,https://news.yahoo.co.jp/articles/9764e37481614fec8bc2b9701234e6e1a05f425e,12/3(火) 9:32
2024-12-03,14:07,domestic,国内,4,産経新聞,「120万円が妥当」自民・茂木敏充氏　「103万円の壁」引き上げに「財源苦労する」,https://news.yahoo.co.jp/articles/34fd87e1018487a7779e10cb6a1f13c6d4add6ab,12/3(火) 9:49
2024-12-03,14:07,domestic,国内,5,TBS NEWS DIG Powered by JNN,秋篠宮ご夫妻 トルコ公式訪問へ　秋篠宮邸を出発し羽田空港へ向かわれる　次女の佳子さまが見送り,https://news.yahoo.co.jp/articles/e92b10c6da0c9e93e72ffb449eeeb435dff368ea,12/3(火) 8:49
2024-12-03,14:07,domestic,国内,6,毎日新聞,ニセコ・スキー場のリフト券、初の1万円超え　観光客増加で設備投資,https://news.yahoo.co.jp/articles/fa2fb480184898861cc94796ea1be220b1c9e65a,12/3(火) 6:15
2024-12-03,14:07,domestic,国内,7,中日スポーツ,兵庫県元幹部の私的情報とされるデータ、ネットで拡散　斎藤知事が真偽など調査検討　SNS「パンドラの箱」「各メディアが一斉に…」,https://news.yahoo.co.jp/articles/37f4733137184bf62c29574c154c3a9df7710821,12/2(月) 20:48
2024-12-03,14:07,domestic,国内,8,J-CASTニュース,「スーパーの熊」無事捕獲も...　地元県議に「熊を殺すことしか考えない」苦情メール,https://news.yahoo.co.jp/articles/a0e2b0baaba2d0a2089ba507f2577b77d69f1ff7,12/3(火) 12:06
2024-12-03,14:07,domestic,国内,9,SlowNews／スローニュース,四日市・キオクシア工場の排水から製造・使用が禁じられたPFOAを高濃度で検出　京大の調査で判明,https://news.yahoo.co.jp/articles/d4c6cb675a88869cc61ceddc80a8b49e9f8d0600,12/3(火) 12:21
2024-12-03,14:07,domestic,国内,10,FNNプライムオンライン,【判明】燃え方激しく応接室から出火か…猪口邦子議員の自宅マンション火災　東大名誉教授で夫・孝さんと33歳の長女が死亡　東京・文京区小石川,https://news.yahoo.co.jp/articles/28b75be9b58166d22883795628b1a90266cdb75b,12/2(月) 8:43
2024-12-03,14:07,domestic,国内,11,弁護士ドットコムニュース,登下校中の小学生を無断撮影、中国語アカウントの投稿が波紋　米沢市は「削除依頼をしたが…」,https://news.yahoo.co.jp/articles/5db84e08048ac389f445e4a0a0a35e3357139d8d,12/3(火) 12:06
2024-12-03,14:07,domestic,国内,12,読売新聞オンライン,秋篠宮ご夫妻、トルコ公式訪問へご出発…宮邸で佳子さまがお見送り,https://news.yahoo.co.jp/articles/db6e19b04e9fda7a64081365c7077d91fa6ffc20,12/3(火) 9:43
2024-12-03,14:07,domestic,国内,13,日刊スポーツ,石田健氏、斎藤元彦知事の公職選挙法違反疑いでの刑事告発に「問題はそれが受理されるか」,https://news.yahoo.co.jp/articles/bda6be39eff3019117b8b4c3b1b453025388a22a,12/3(火) 11:37
2024-12-03,14:07,domestic,国内,14,スポニチアネックス,「クマ侵入」秋田のスーパー・いとく、7日から営業再開　「徹底した消毒清掃を行う」　応援の声続々,https://news.yahoo.co.jp/articles/89a4d95502c4aebf6cc764904d8c64eb1614d0ce,12/3(火) 11:22
2024-12-03,14:07,domestic,国内,15,弁護士JPニュース,ガソリン税の上に“消費税”がかかる「Tax on Tax（二重課税）」…35年間「正当化」されてきた“法的根拠”とは【税理士解説】,https://news.yahoo.co.jp/articles/6c9e9274ab94508ff9ba5d6f29d73559c2ef5efd,12/3(火) 10:00
2024-12-03,14:07,domestic,国内,16,デイリースポーツ,元ＴＢＳアナの立民・杉尾参院議員　兵庫県知事選扱った古巣番組を絶賛「秀作だった」　コメントには批判意見殺到,https://news.yahoo.co.jp/articles/79b5e6e6081dd15b4c9e80316061e4f158ecf38c,12/2(月) 22:18
2024-12-03,14:07,domestic,国内,17,テレビ朝日系（ANN）,斎藤知事らを公選法違反の疑いで刑事告発　SNS運用「買収にあたる」ブログ書き換えも,https://news.yahoo.co.jp/articles/32d3f6c9a75a29f1c1ddd15bd7b89885a20ced17,12/3(火) 12:27
2024-12-03,14:07,domestic,国内,18,信濃毎日新聞デジタル,「ついに出た」開始から2年で初の吉報…返礼品はブランド牛1頭分の肉　ふるさと納税300万円寄付に町は沸いた,https://news.yahoo.co.jp/articles/f438987162332112e7a3e71bcf884e68e7e35c9b,12/3(火) 12:08
2024-12-03,14:07,domestic,国内,19,日刊スポーツ,斎藤元彦知事を追及の「報道特集」元TBSの立民議員が「秀作」と称賛「後輩が頑張っている」,https://news.yahoo.co.jp/articles/4b1d957a26d3762a55744788d85e2b4c184e927b,12/3(火) 11:09
2024-12-03,14:07,domestic,国内,20,ABEMA TIMES,知らない番号からの着信、無視する？ 検索する？ 番号の末尾が「0110」は警察からって本当？ 30万いいねが集まった対応とは？,https://news.yahoo.co.jp/articles/9cb84e626afa611121bfd065042b999cb9a57994,12/3(火) 6:52
2024-12-03,14:07,domestic,国内,21,J-CASTニュース,元「青汁王子」の「2026年から独身税がスタート」投稿にツッコミ殺到　「嘘です」「誤解は仕方ないけど...」,https://news.yahoo.co.jp/articles/bf8f982bdb3d1c2628e90bf33fa69fe1cdd94281,12/3(火) 12:35
2024-12-03,14:07,domestic,国内,22,弁護士ドットコムニュース,上司から指導ないのに「仕事できない」と低評価　正社員→契約社員にさせられそう…　違法じゃないの？,https://news.yahoo.co.jp/articles/22b48bdb6c5440d2df5aa655f97bf5866e66bf2f,12/3(火) 10:17
2024-12-03,14:07,domestic,国内,23,FNNプライムオンライン,「納税しているのに督促状が来た」熊本・阿蘇市波野支所の元職員が在職中に約53万円を着服　窓口で固定資産税などの着服繰り返したか,https://news.yahoo.co.jp/articles/bca0097302824ebceaed177acbf07beae5bde9a2,12/3(火) 11:02
2024-12-03,14:07,domestic,国内,24,スポニチアネックス,外国人インフルエンサー、下校中の小学生を無断撮影→投稿し物議　山形・米沢市が声明　対策を発表,https://news.yahoo.co.jp/articles/066b588d617f59a3f24f713134570911d8403bd6,12/3(火) 11:01
2024-12-03,14:07,domestic,国内,25,中日スポーツ,新語・流行語大賞の会場に”来られなかった”理由に…ネット衝撃「午前中、斎藤知事を刑事告発したので」『裏金問題』で受賞の上脇博之教授,https://news.yahoo.co.jp/articles/b4d464426ecd5653c53f887698dbcd1f4c871b58,12/2(月) 18:23
2024-12-03,14:07,domestic,国内,26,日刊スポーツ,国民・玉木雄一郎代表「総理答弁にはがっかり」　暗号資産税制改正めぐる石破首相の答弁に失望感,https://news.yahoo.co.jp/articles/becedbcd98718bbeaff67ae9d1defea09ee884ed,12/3(火) 10:39
2024-12-03,14:07,domestic,国内,27,読売新聞オンライン,「マイナ保険証」移行、エラーで使えなかった80歳代男性「複雑で煩わしい」…70歳代女性は「簡単だった」,https://news.yahoo.co.jp/articles/ccfd7a318eb1043c5acc07691f88869ef076b11b,12/3(火) 12:49
2024-12-03,14:07,domestic,国内,28,東海テレビ,踏切で電車にはねられ死亡したのは“13歳女子中学生”と判明 運転士が遮断機くぐる姿を目撃 自殺の可能性も,https://news.yahoo.co.jp/articles/759d41900cac8d40730226d4f21f5026d71b68b1,12/3(火) 7:04
2024-12-03,14:07,domestic,国内,29,朝日新聞 SDGs ACTION！,「老化対策は若いうちから」その理由とは　「44歳」と「60歳」で何が起きる？　「老化学」でわかってきたこと、まだわからないこと,https://news.yahoo.co.jp/articles/8ea122345c1c29cdfbd07fe23fa6cab9257c69ac,12/3(火) 11:42
2024-12-03,14:07,domestic,国内,30,中日スポーツ,斎藤元彦知事めぐる公選法違反疑い、古市憲寿さんネット選挙に私見 「ブログに女性社長が自分からウキウキして書いちゃうぐらい…」,https://news.yahoo.co.jp/articles/ec48ceb6745929ef914d592ce0a7e9816175047a,11/28(木) 11:39
2024-12-03,14:07,domestic,国内,31,FNNプライムオンライン,“廃棄物”が道路に散乱…関越道でトラック横転　ドライバーのハンドル操作ミスか　埼玉・寄居パーキングエリア付近,https://news.yahoo.co.jp/articles/8a8c9b7f8313396d9089b87d4e49ea8cb9b03a06,12/3(火) 13:32
2024-12-03,14:07,domestic,国内,32,時事通信,立民、国民との共同提出断念　企業献金禁止法案,https://news.yahoo.co.jp/articles/6d370e4ff262b6db5a54b3a89c679664bb21e4ea,12/3(火) 12:05
2024-12-03,14:07,domestic,国内,33,デイリースポーツ,辻元清美氏、石破総理へ「ふてほど」追及　企業・団体献金問い「まさに不適切にもほどがある」,https://news.yahoo.co.jp/articles/e7f521b3c410a0fe38da75c1b9ecd161d3bd6563,12/3(火) 12:00
2024-12-03,14:07,domestic,国内,34,テレビ朝日系（ANN）,ガソリン減税、結論1年先送り　“マルバツ審議”は廊下で聞き耳　国民民主は？,https://news.yahoo.co.jp/articles/f93bc54c68f68b7057049d1858b0655e0b1d507d,12/3(火) 11:32
2024-12-03,14:07,domestic,国内,35,日刊スポーツ,【将棋】羽生善治九段が衝撃告白、電車で隣に座った男性に突然泣かれた「何か悲しい事が…？」,https://news.yahoo.co.jp/articles/ad96c19c83424817517163003572534bccef65d3,12/3(火) 8:11
2024-12-03,14:07,domestic,国内,36,読売新聞オンライン,「103万円の壁」見直し、長崎県は240億円の税収減見込み「行政運営が立ちゆかなくなる規模感」,https://news.yahoo.co.jp/articles/4d5bb84364572ffc4dbde3abb03c5e680b02e455,12/3(火) 12:59
2024-12-03,14:07,domestic,国内,37,FNNプライムオンライン,スポーツカーと軽自動車が交差点で衝突…軽自動車運転手の40代男性が胸を強打し搬送　東京・中央区勝どき,https://news.yahoo.co.jp/articles/6d03563b5ad99a99401599a8bc15e2186bd5f02f,12/3(火) 11:37
2024-12-03,14:07,domestic,国内,38,J-CASTニュース,8万円分コース料理を当日予約→ドタキャン＆逃亡　「泣き寝入りです」老舗フグ料理店が払った「高い勉強代」,https://news.yahoo.co.jp/articles/e77929d93a08a803d91df02650275c4059d3a4c8,12/2(月) 18:16
2024-12-03,14:07,domestic,国内,39,読売新聞オンライン,「賃貸借契約中の重機が転売されている」油圧ショベル2台を借入金の担保で引き渡した疑い…会社役員逮捕,https://news.yahoo.co.jp/articles/fc64ca9c1cffb383c266e922bd7b6024b7e9c17f,12/3(火) 12:02
2024-12-03,14:07,domestic,国内,40,読売新聞オンライン,ヒラメのカルパッチョ食べた男女10人、下痢・吐き気訴え…便から食中毒引き起こす寄生虫,https://news.yahoo.co.jp/articles/d137e661d322e67b688c5f945c56dd40b45db389,12/3(火) 11:51
