scrp_date,scrp_time,genre_en,genre_jp,rank,media_jp,title,link,date_original
2025-09-26,20:06,sports,スポーツ,1,デイリースポーツ,阪神・森下　見逃し三振の判定に不服の態度　白井球審と不穏な空気に　慌てて上本コーチが間に入る　甲子園騒然,https://news.yahoo.co.jp/articles/ffb5614794b46cfecbb04669d285b9c22e25be80,9/26(金) 18:46
2025-09-26,20:06,sports,スポーツ,2,CoCoKARAnext,「ちなみに防御率は2.87です」浮き彫りになった衝撃事実　大谷翔平の「54-62」到達に米騒然　MVP論争も「もはや終了した」,https://news.yahoo.co.jp/articles/72756b0a4d6efcc8ff0e419ab88f13c0770ea1e5,9/26(金) 12:02
2025-09-26,20:06,sports,スポーツ,3,スポニチアネックス,阪神・森下翔太　白井球審のストライク判定に不満あらわ…上本打撃コーチが仲裁も不穏な空気,https://news.yahoo.co.jp/articles/700ed6906832216da86934a03366ba7d42bba69e,9/26(金) 18:55
2025-09-26,20:06,sports,スポーツ,4,日刊スポーツ,【阪神】森下翔太が白井一行球審と一触即発　判定不服であわや　距離詰める２人をコーチが仲裁,https://news.yahoo.co.jp/articles/82d5f9a97aa605c72215f9f22b00661608d3bbc5,9/26(金) 18:58
2025-09-26,20:06,sports,スポーツ,5,日刊スポーツ,【凱旋門賞】JRAが出走予定馬18頭発表　クロワデュノール、アヴァンチュール、カルパナなど,https://news.yahoo.co.jp/articles/afbccc401cba5950981a21d5e0c007527701ca7e,9/26(金) 17:51
2025-09-26,20:06,sports,スポーツ,6,CoCoKARAnext,大谷翔平への米球界の「不満」は必然か　元二刀流選手が疑問視する大谷ルールに設けられた“条件”「なぜ資格が必要なんだ」,https://news.yahoo.co.jp/articles/0b3257bb623a3cde99e77f363e196131444b69c7,9/26(金) 16:01
2025-09-26,20:06,sports,スポーツ,7,デイリースポーツ,「数年先に生まれたくらいでガタガタ偉そうにしてんじゃねぇ！」ＢＤ衝撃　溝口勇児氏が関東最大級ギャング元総長と大口論　元総長も怒り「お前みてぇなゆってぃの真似事によ！」　朝倉未来「試合決定で」,https://news.yahoo.co.jp/articles/8d958c2de471be1a42a9a04f359be11e7c15e4ce,9/26(金) 14:43
2025-09-26,20:06,sports,スポーツ,8,デイリースポーツ,大の里が単独トップ！横綱初Ｖに前進　若隆景を圧倒で１敗守る　豊昇龍は琴桜に敗れ痛恨連敗で２敗後退　安青錦、隆の勝が３敗で続く,https://news.yahoo.co.jp/articles/dec976b326a1d7fe8a166f96d6fa7e5758dc3008,9/26(金) 17:57
2025-09-26,20:06,sports,スポーツ,9,Full-Count,山本由伸を絶賛するカーショー「信じられない」　CY賞は困難も…「匹敵、それ以上かも」,https://news.yahoo.co.jp/articles/013663c685ac33c45435f72686ee0cecdb9998b2,9/26(金) 15:56
2025-09-26,20:06,sports,スポーツ,10,日刊スポーツ,ドジャース２年目テオスカー・ヘルナンデス「これが再契約した理由だ」25本塁打89打点でＶ貢献,https://news.yahoo.co.jp/articles/072c78236a93d6b519c3ec6d8ffe1f7c735fcd99,9/26(金) 17:46
2025-09-26,20:06,sports,スポーツ,11,Full-Count,ソフトバンク、前田悠伍が左肘手術を発表　今季プロ初勝利のドラ1が決断…復帰まで3～4か月,https://news.yahoo.co.jp/articles/3c8ee8b1db16383f36e65f2fbb68bf33f7f78db8,9/26(金) 17:16
2025-09-26,20:06,sports,スポーツ,12,デイリースポーツ,「めちゃくちゃキレイ」人気女優の登場に甲子園沸く　空に向かって拍手　ネットも反応「天まで届けー」,https://news.yahoo.co.jp/articles/6f41cea58d4f84e7efd6e4b5034f5aa93a8efca4,9/26(金) 18:44
2025-09-26,20:06,sports,スポーツ,13,デイリースポーツ,相撲観客席で「えらい美人」異彩透明感美女、人気芸人と升席２ショットに反響　オレンジシャツに「翔猿」の文字,https://news.yahoo.co.jp/articles/40f7b89dbf31799f0ac6b7603138b83cc2885653,9/26(金) 15:36
2025-09-26,20:06,sports,スポーツ,14,Full-Count,大谷翔平に付け足された“事実”　強調せずにいられない「2.87」…米驚愕「クレイジーだ」,https://news.yahoo.co.jp/articles/02015baf41d8aca9fc6b909ca319eea7c7c1d4ef,9/26(金) 14:24
2025-09-26,20:06,sports,スポーツ,15,ABEMA TIMES,カーショーが、大谷が、チームメイトが…“大エース”山本由伸を「惜しみない賞賛」で出迎えた感動光景 “頭ポンポン連発”ベンチの一コマ,https://news.yahoo.co.jp/articles/0a6759ac32623a83caae21514ab071f4d920298c,9/26(金) 16:45
2025-09-26,20:06,sports,スポーツ,16,日テレNEWS NNN,MVP争いはどうなる？大谷翔平が54号でチーム地区優勝に貢献　シュワバーが前日2ホーマーから一転3打数無安打〈残り3戦〉,https://news.yahoo.co.jp/articles/ef5df3692da3dcf12de9312dad1a777f741476e6,9/26(金) 16:45
2025-09-26,20:06,sports,スポーツ,17,J-CASTニュース,ドジャースのキム・ヘソン、ポストシーズンメンバー入りに「暗雲」...「事実上最後のチャンス生かせなかった」韓国メディア悲観,https://news.yahoo.co.jp/articles/205f7350aa429ece11d73be5d3c678866b1bee11,9/26(金) 14:04
2025-09-26,20:06,sports,スポーツ,18,ABEMA TIMES,「本当にやめて欲しい」大相撲、“残念”な光景が波紋 無敗の横綱に“土”であわや 一部客の振る舞いに「節度は守って」ファン困惑,https://news.yahoo.co.jp/articles/8591df937ded8743d5b0f3f5d17c5a9a95f465c2,9/26(金) 6:21
2025-09-26,20:06,sports,スポーツ,19,Full-Count,無冠の山本由伸が到達した“伝説の領域”　大谷翔平も感銘…達成したMLB史上2人目の偉業,https://news.yahoo.co.jp/articles/d85fb07edd17eacd71461ba56459c40614eb472a,9/26(金) 14:59
2025-09-26,20:06,sports,スポーツ,20,GOAL,なぜ久保建英はビッグクラブに見向きされない？有力紙副編集長が「私がSDなら獲得しない」と話す理由と「言い訳できない」今季,https://news.yahoo.co.jp/articles/05451a48466b6b6a8488917c3edcf1ae5b804474,9/26(金) 12:01
2025-09-26,20:06,sports,スポーツ,21,TopNews,角田裕毅に未来あり！辛口シューマッハが評価一転「キャリア終わり」発言を撤回、2026年残留の可能性示唆,https://news.yahoo.co.jp/articles/a5188ac0bfa8835253c712d4c4ed958a643d1650,9/26(金) 19:03
2025-09-26,20:06,sports,スポーツ,22,中日スポーツ,「ジャイアンツ6年、ファイターズ2年、人間として成長できた」日本ハムの32歳内野手、今季限りで引退　28日2軍ヤクルト戦に出場予定,https://news.yahoo.co.jp/articles/4b89e1a055749d567bfd1422ce07a57926b1315a,9/26(金) 18:54
2025-09-26,20:06,sports,スポーツ,23,中日スポーツ,「探さないでください！」51歳元Jリーガー、入院画像をアップ「詮索しないで」　フォロワー心配の声「どうしたのですか？」,https://news.yahoo.co.jp/articles/1d85c7daa1bab922f082dd76121188b2b794dfe7,9/26(金) 18:24
2025-09-26,20:06,sports,スポーツ,24,日刊スポーツ,ロバーツ監督は４年連続地区Ｖ決めても、シャンパンファイトに加わらなかった…その理由とは,https://news.yahoo.co.jp/articles/ddfb812a377132a1da2112706f55a20c760696bd,9/26(金) 19:00
2025-09-26,20:06,sports,スポーツ,25,CoCoKARAnext,「事態はほとんど不公平なレベルだ」投打二刀流の活躍で“圧倒”する大谷翔平が3年連続4度目のMVPへ「道を阻む者はいない」,https://news.yahoo.co.jp/articles/2951be56a8ae61ad765544d9eea765e61d57d72c,9/26(金) 16:30
2025-09-26,20:06,sports,スポーツ,26,日刊スポーツ,ドジャース名物リポーター、シャンパンファイトでびしょ濡れインタビュー「ワトソンさん最高！」,https://news.yahoo.co.jp/articles/2615e648e6992e40264e1d9017596a295af1d2c8,9/26(金) 12:07
2025-09-26,20:06,sports,スポーツ,27,デイリースポーツ,ヤクルト　キャプテン山田が三回一挙６点の起点となる貴重な追加点　二回の中前打で自身出場６試合連続安打,https://news.yahoo.co.jp/articles/58530cc0d3f209c7ee967e3f55ac657dce4fec8d,9/26(金) 19:32
2025-09-26,20:06,sports,スポーツ,28,スポーツ報知,【日本ハム】松本剛、国内ＦＡ取得「ここまで育ててくれたファイターズに感謝の気持ちでいっぱい」,https://news.yahoo.co.jp/articles/188f0d35dbc7d3ae9981eb97a8e6aee792994b3d,9/26(金) 17:45
2025-09-26,20:06,sports,スポーツ,29,Full-Count,大谷翔平に同僚が届けた“贈り物”　歓喜の瞬間…まさかの光景にファン感動「最高すぎる」,https://news.yahoo.co.jp/articles/4194be70ddfd0b6ba03e361bd011c0577dfa9089,9/26(金) 18:49
2025-09-26,20:06,sports,スポーツ,30,日テレNEWS NNN,優勝へ「M2」のソフトバンクが先制許す　8月から負けなしの上沢直之が初回2失点,https://news.yahoo.co.jp/articles/b1226ae5826713a518ad1b14d486332f6d183321,9/26(金) 18:46
2025-09-26,20:06,sports,スポーツ,31,日刊スポーツ,ドジャースが４連覇達成　新加入の282億円左腕スネル「地区優勝も素晴らしいけど…」,https://news.yahoo.co.jp/articles/432677a14eb8af6a4ed7024742fb1f20ee5b4185,9/26(金) 16:55
2025-09-26,20:06,sports,スポーツ,32,CoCoKARAnext,「正真正銘のエースだ」山本由伸、最終登板で無失点＆200奪三振　群を抜く安定感に賛辞止まず「2年目の集大成とも言える数字」,https://news.yahoo.co.jp/articles/2aa0e497ff3603377ae43de72de9fd08c606d2c5,9/26(金) 19:00
2025-09-26,20:06,sports,スポーツ,33,月刊陸上競技,【陸上】北口榛花インタビュー「これからのことを考えるのが今はすごく楽しい」世界陸上予選敗退も次へ突き進む,https://news.yahoo.co.jp/articles/c2008f89a10b10fe409d684363da38965c72decd,9/26(金) 19:36
2025-09-26,20:06,sports,スポーツ,34,Full-Count,山本由伸の快挙が生んだ“史上初”　MLBで存在感…4年連続の快挙を米称賛「クレイジーだ」,https://news.yahoo.co.jp/articles/512b4b796c09e1910b49b3f476e87428bd6dc3f5,9/26(金) 17:11
2025-09-26,20:06,sports,スポーツ,35,デイリースポーツ,楽天・浅村栄斗が３５０二塁打を達成　史上４９人目　記録ラッシュの１年で４つ目の勲章,https://news.yahoo.co.jp/articles/5e0af91f39cb2a91855510b695b467ee3a3bb9c0,9/26(金) 18:27
2025-09-26,20:06,sports,スポーツ,36,デイリースポーツ,阪神　最高勝率＆最多奪三振狙う村上にハプニング　打球が右足直撃も続投,https://news.yahoo.co.jp/articles/7a26da5f84c7fc9fe0848e806afe304707829bbc,9/26(金) 19:00
2025-09-26,20:06,sports,スポーツ,37,デイリースポーツ,ドジャース　地区Ｖ記念撮影に人柄にじむ　大谷翔平は前で手を組み、ベッツは寝転ぶ　最後列に顔だけのぞかせた若きスラッガーが,https://news.yahoo.co.jp/articles/18944159cdf6d1ea73c78d3d17fbfcb7e12c30a1,9/26(金) 8:27
2025-09-26,20:06,sports,スポーツ,38,デイリースポーツ,広島・床田が悪夢のＫＯ　今季自己ワーストタイ三回途中７失点　三回だけで５４球投じる,https://news.yahoo.co.jp/articles/5db237927099a62ffe3efd564dddf7819f245781,9/26(金) 19:27
2025-09-26,20:06,sports,スポーツ,39,ENCOUNT,関東最大級ギャング元ボス、昨今の“乱闘文化”に警鐘「癖になったら取り返しのつかないことになる」,https://news.yahoo.co.jp/articles/2d1684436679cba7c0b54a1b49b39966c2c090b0,9/26(金) 9:40
2025-09-26,20:06,sports,スポーツ,40,FITNESS LOVE,70歳が週1の水泳と週4のダンス、本格的な筋トレで女性らしい“品格ある健康ボディ”へ【ボディメイクBefore After オーバー70】,https://news.yahoo.co.jp/articles/c3b87d9fee8446368779d8c46221c8147172daef,9/26(金) 18:11
