scrp_date,scrp_time,genre_en,genre_jp,rank,media_jp,title,link,date_original
2025-05-25,00:06,TTL,総合,1,日刊スポーツ,キム・ムジュンが「嘘をつかないで…」意味深投稿　永野芽郁「二股不倫」報道後初インスタ更新,https://news.yahoo.co.jp/articles/ded6f94048ebcd9c77e4de6dc419b1d6fec8ffd7,5/24(土) 20:18
2025-05-25,00:06,TTL,総合,2,産経新聞,「斎藤知事に愛想尽きた」兵庫県庁離れ加速　17年ぶり自主退職4割増、他自治体に転職も,https://news.yahoo.co.jp/articles/824f2b5921a7f7939565373b29b4948cc730b1d6,5/24(土) 19:28
2025-05-25,00:06,TTL,総合,3,中日スポーツ,小泉農相、ニュース番組で発した”経済用語”に…ネットざわつく「いつからコメは固定資産に？」「日本大丈夫か」「ポエマー発揮」,https://news.yahoo.co.jp/articles/e1d59ed22901752eee2d80d84415589ee597a2a1,5/24(土) 20:31
2025-05-25,00:06,TTL,総合,4,東スポWEB,【阪神】藤川監督　最終回のジャッジと中日・井上監督の抗議に怒り「それだったら自分たちも抗議する」,https://news.yahoo.co.jp/articles/8ebb8ab413eb145f36e6d31012d846248b4b0013,5/24(土) 19:11
2025-05-25,00:06,TTL,総合,5,スポニチアネックス,35歳女優　第1子出産を報告「自身の誕生日と1日違い」　夫は39歳俳優,https://news.yahoo.co.jp/articles/035a22991b7ea8a8d619520e94920a56418e6b55,5/24(土) 21:14
2025-05-25,00:06,TTL,総合,6,ねとらぼ,大学入学までに“垢抜け”を目指す女性、わずか6カ月後……　「何があったんだ」な姿が320万再生　「女の子の努力って凄い」「泣きそう」,https://news.yahoo.co.jp/articles/b52c36716e74a9c079586596034ace60f62622b6,5/24(土) 19:30
2025-05-25,00:06,TTL,総合,7,デイリースポーツ,【解説】阪神・藤川監督なぜ苦言？疑念につながった井上監督の抗議　審判説明も、ルール通りなら退場の可能性も,https://news.yahoo.co.jp/articles/10b14e379ea972ca672388f1a6426791ce261217,5/24(土) 20:49
2025-05-25,00:06,TTL,総合,8,Full-Count,大谷とHR王争いした姿はどこへ…71億円男が絶望の打率.180…　トレード需要に“自虐”,https://news.yahoo.co.jp/articles/95b0f287a4a434e062e514a6d20fba0b940d59a4,5/24(土) 17:05
2025-05-25,00:06,TTL,総合,9,ねとらぼ,保育園で出会った幼なじみの2人→20年後……　現在の姿に「ご両親びっくりやろな」「まじ鳥肌やばい」と大反響,https://news.yahoo.co.jp/articles/3d135808d8bc92d1bbc5b7bf52faaac0f539b920,5/24(土) 19:15
2025-05-25,00:06,TTL,総合,10,スポーツ報知,Ｍｒｓ．ＧＲＥＥＮ　ＡＰＰＬＥメンバー　生放送で衝撃姿「えええ！」「驚き」「何で」「やばい」「動揺」,https://news.yahoo.co.jp/articles/4248cce6809b0dbaa0df9c1cc98c3c716f7c92a4,5/24(土) 12:15
2025-05-25,00:06,TTL,総合,11,OTONA SALONE,「やめてって何度も言ったよね！」毎日のスキンシップが地雷に変わった夜、妻の怒声とともに地獄が始まった,https://news.yahoo.co.jp/articles/075b99ec0eb0d6c14b18015e5829e1fd90b568cb,5/24(土) 20:40
2025-05-25,00:06,TTL,総合,12,スポニチアネックス,亀田和毅は3階級制覇逃す　圧倒的不利の予想から接近戦で逆襲　大健闘も0―2判定負け,https://news.yahoo.co.jp/articles/175d09fc573915f650e49048ece1f5b31cc020dc,5/24(土) 18:29
2025-05-25,00:06,TTL,総合,13,ほ・とせなNEWS,ひたすら食べていた5歳男児→20年後の姿に「う、嘘やろ？笑」「イケメン」「息子にそっくりで笑った」「面影ない」,https://news.yahoo.co.jp/articles/df07eea0c52da5fdbcff56f3759aedd9e29a00e7,5/24(土) 19:51
2025-05-25,00:06,TTL,総合,14,ENCOUNT,尾上松也、芸能人通う高校のマドンナを実名告白「みんな好きでした」　“同級生”の活躍に「あんなボディーに…」,https://news.yahoo.co.jp/articles/8411e26494f0e1d12ed68e8d60fc214268ada8be,5/24(土) 20:02
2025-05-25,00:06,TTL,総合,15,スポニチアネックス,浜田雅功　地上波復帰回で持病告白　「疲れてきたらちょっとこうせえへんかったら…」,https://news.yahoo.co.jp/articles/41711dacdef58d2d17b9854cccce46913779cfee,5/24(土) 17:43
2025-05-25,00:06,TTL,総合,16,ENCOUNT,ダウンタウン浜田、地上波復帰で持病告白　GACKTが階段上る姿を見て指摘「ほぼ、じいちゃん」,https://news.yahoo.co.jp/articles/bff44f78da33312cf0c24088b309706573143881,5/24(土) 18:41
2025-05-25,00:06,TTL,総合,17,ねとらぼ,小1娘、ペンギンの卵を楽しみに育ててみたら……　期待を裏切る生き物の爆誕に「声出して笑ったw」「反応がめちゃくちゃ可愛い」→1年後を聞いてみた,https://news.yahoo.co.jp/articles/dc500cfe6be17aeaae949e16b0766f8c2750b86f,5/24(土) 9:45
2025-05-25,00:06,TTL,総合,18,日刊スポーツ,中島裕之氏が真相激白　メジャー帰国後に起きた争奪戦「西武から早い段階でなかったことにって」,https://news.yahoo.co.jp/articles/d2562b221cb766a5028d25931eb8bb3322eeda27,5/24(土) 20:12
2025-05-25,00:06,TTL,総合,19,ねとらぼ,「絶対買いです」　無印良品の“安眠パジャマ”が高評価　「永眠できるくらい寝れます」「色違いも購入したい」,https://news.yahoo.co.jp/articles/543bc766979fe67e346c44e76fa10b4b474aa2b6,5/24(土) 21:30
2025-05-25,00:06,TTL,総合,20,デイリースポーツ,兄・大毅氏の身内に厳しい解説がＳＮＳで好評「兄貴なのにすごくフェアな解説で素晴らしい」「めちゃ的確でいい」,https://news.yahoo.co.jp/articles/13d1a5ec77c26aefe9d4eecebd6418f8efc57947,5/24(土) 19:04
2025-05-25,00:06,TTL,総合,21,スポニチアネックス,巨人・阿部監督　グリフィン88球で降板は「キシが“そろそろじゃないですか”みたいなのを」,https://news.yahoo.co.jp/articles/73ae4d2e4d9be03ff347d12abb8b4d8982a56639,5/24(土) 21:54
2025-05-25,00:06,TTL,総合,22,スポニチアネックス,ヒロミ「1人の時は100パー食べる」大好きな食べ物とは…「芸能界一と自負してる」　何とハワイでも,https://news.yahoo.co.jp/articles/51382b26bfb618846153c7cb5e6190f698e4a270,5/24(土) 19:11
2025-05-25,00:06,TTL,総合,23,ENCOUNT,「どうしたらそんなに足が綺麗に」　人気女優が『anan』で見せたモデル足にSNS驚愕「色気がすごい」,https://news.yahoo.co.jp/articles/1199f06a0dda3a737e2767021332e4c26b722c57,5/24(土) 20:42
2025-05-25,00:06,TTL,総合,24,Full-Count,元燕助っ人、養育費未払い→出廷せず逮捕状　約400万円…年金口座「残高ゼロ」が判明,https://news.yahoo.co.jp/articles/8bcdc82cb30dec9ddc0f97d502420d0ac56dbc52,5/24(土) 19:57
2025-05-25,00:06,TTL,総合,25,デイリースポーツ,島田紳助氏がリング上にサプライズ登場　場内騒然　亀田興毅氏の涙にもらい泣き「亀田家最終章。最後まで感動させてください」と和毅にエール,https://news.yahoo.co.jp/articles/696bc530fed6c568592abae4db78b97ee73c3b91,5/24(土) 17:23
2025-05-25,00:06,TTL,総合,26,BuzzFeed Japan,「結婚したい彼女がいるのに、1番好きだった元カノに告白されて…」男性の悩みに藤本美貴が辛口回答！「名言多すぎる」と話題に,https://news.yahoo.co.jp/articles/427bbc1234059566b12bcbfc17842bdcd73a0ce2,5/24(土) 20:35
2025-05-25,00:06,TTL,総合,27,スポーツ報知,【世界卓球】吉村真晴、大藤沙月の「大吉ペア」は銀メダル　パリ五輪金ペアに１―４で敗れ、８年ぶりの日本勢Ｖ逃す　大藤「大舞台で戦えたことは宝物です」,https://news.yahoo.co.jp/articles/ddd2d617eb26897b37368252fb6a55e4bde6c27e,5/24(土) 22:53
2025-05-25,00:06,TTL,総合,28,デイリースポーツ,中日・井上監督がボール判定に抗議「なんだよ！それ」球審の紛らわしいジェスチャーにベンチを飛び出す,https://news.yahoo.co.jp/articles/8c1b1998d1fec55bfd6b6dcdd8e5bcc8b487ef53,5/24(土) 17:33
2025-05-25,00:06,TTL,総合,29,弁護士JPニュース,アニメグッズ「大量売れ残り」で“1400万円”損失、30代女性店長が解雇…管理職の「責任問題」裁判所はどう判断した？,https://news.yahoo.co.jp/articles/2bc55ba7f3e718a9d6348a6e07639320416cb42b,5/24(土) 10:10
2025-05-25,00:06,TTL,総合,30,ねとらぼ,「ユニクロで一番好き」　“2990円スカート”が高評価　「当たりでした！」「デザインも素材も最高です」,https://news.yahoo.co.jp/articles/087fc2258f1966da3eb08ac4310a40269a1c599a,5/24(土) 22:00
2025-05-25,00:06,TTL,総合,31,スポーツ報知,織田信成さん、結婚１５年の妻との夫婦ケンカに共演者どん引き「やば！」「最悪！」スタジオ登場の妻も「ありがたいけど…」,https://news.yahoo.co.jp/articles/9bae4e54e34ade4a508b5ed66e4700232356329f,5/24(土) 20:55
2025-05-25,00:06,TTL,総合,32,あいテレビ,「家族で過ごせて幸せと思う反面、事故がなければ…悔しさ、悲しさ、寂しさも」給食のリンゴを喉に詰まらせ意識不明のまま2年　2歳の男の子と両親のいま【前編】,https://news.yahoo.co.jp/articles/cc0a6d7de1e2e1b3d677fbab9d19eb8c0222252a,5/24(土) 9:02
2025-05-25,00:06,TTL,総合,33,デイリースポーツ,判定負けの亀田和毅が現役続行の意向「もう一回チームと話して次を考えたい」　判定は受け入れる「俺が勝ってたやんけって言ってどうするん？」,https://news.yahoo.co.jp/articles/75e9ca109ebae1e9b19e3fd4abaae838302f039e,5/24(土) 19:23
2025-05-25,00:06,TTL,総合,34,TBS NEWS DIG Powered by JNN,【巨人】今季2度目4連勝 貯金4で3位浮上 首位・阪神と0.5差！泉口が8回2死一・二塁からⅤ打＆2号ソロ 岸田が2度目の犠打は成功,https://news.yahoo.co.jp/articles/9dabd0db203815ac6bce2ed3004346ea0397bfd9,5/24(土) 20:57
2025-05-25,00:06,TTL,総合,35,西スポWEB OTTO！,夫は大人気アイドル…〝電撃婚〟妊娠中の38歳歌手、スタイリッシュな最新ショットに「顔つき変わっても…」「幸せに満ちあふれた表情」の声,https://news.yahoo.co.jp/articles/715504d36160d3df1999a445f107493fb599be8d,5/24(土) 22:50
2025-05-25,00:06,TTL,総合,36,時事通信,自民・森山氏「参院選敗北なら政権交代」,https://news.yahoo.co.jp/articles/4ca45df4cac95b80284acf5f821b68ffd509ba8c,5/24(土) 15:40
2025-05-25,00:06,TTL,総合,37,東スポWEB,永野芽郁「プラダ」のプロジェクト起用も終了…スポンサー、ブランド側が眉ひそめた〝文春第２砲〟,https://news.yahoo.co.jp/articles/3ace13f5b1d89f72aa79b618b207e0c05ab737e2,5/20(火) 5:16
2025-05-25,00:06,TTL,総合,38,スポーツ報知,６９歳大物女優、１２歳年下夫と笑顔ショットに「めちゃくちゃキレイやった」「着物姿ステキ」とネット称賛,https://news.yahoo.co.jp/articles/9c4e7c9900de53ce40185410b9e2ed712c7a0216,5/24(土) 21:45
2025-05-25,00:06,TTL,総合,39,デイリースポーツ,【オークス】馬場状態から浮上するのはこの馬だ,https://news.yahoo.co.jp/articles/6351e9a89e8ea1daa2166bc67bb27a4cdaad2a9b,5/24(土) 20:22
2025-05-25,00:06,TTL,総合,40,高校生新聞オンライン,こっちのけんとさんの高校時代は「めっちゃ真面目！」第一志望不合格から奮起,https://news.yahoo.co.jp/articles/5e480c52b5b9dda4b3f0bb697b976983bb3b3b43,5/24(土) 18:03
