scrp_date,scrp_time,genre_en,genre_jp,rank,media_jp,title,link,date_original
2024-02-02,11:21,TTL,総合,1,日刊ゲンダイDIGITAL,小泉今日子“クイズ番組で霜降り牛肉もらう”おかしさを指摘…「バラエティくだらない」はテレビへの苦言,https://news.yahoo.co.jp/articles/a5a62e10a95bf263a3a5db554bcce3df72743e9d,2/2(金) 9:06
2024-02-02,11:21,TTL,総合,2,まいどなニュース,「従業員も、させていただいております」レジの貼り紙に衝撃広がる「世界で日本くらい」「客じゃなく、クレーマー」,https://news.yahoo.co.jp/articles/76bada680f07ecd5ccccb8dd20fa88974c430705,2/2(金) 6:40
2024-02-02,11:21,TTL,総合,3,イーファイト,【キック】24歳マサキが減量で倒れ死去、団体は今後の対策を発表,https://news.yahoo.co.jp/articles/91565b4a457548e62d1bc3a783512c5a791e6171,2/1(木) 19:25
2024-02-02,11:21,TTL,総合,4,BSS山陰放送,数字は見える?日本人男性20人に1人が「色覚異常」…「牛肉が焼けていく色調変化がわかりにくい」「青が白に見える」　なぜ色が他人と違って見えるのか,https://news.yahoo.co.jp/articles/ab4954d606b0c53e2bc230c4bfa53743efc76c86,2/2(金) 5:57
2024-02-02,11:21,TTL,総合,5,スポーツ報知,ゴゴスマ出演者「今回は警察にも」と指摘　「セラピスト女性がマッサージ店で行為を」松本人志の文春砲第５弾で新証言,https://news.yahoo.co.jp/articles/f5dc7f61a765d4a7b26fe1922e67d4161a190cc2,2/1(木) 17:33
2024-02-02,11:21,TTL,総合,6,日刊ゲンダイDIGITAL,松本人志さらにピンチ…“多目的トイレ不倫”渡部建への過去発言と泉谷しげるの耳の痛いダメ出し,https://news.yahoo.co.jp/articles/5d756368eabc9a9042fca0d465a05c86d1abe959,2/2(金) 9:06
2024-02-02,11:21,TTL,総合,7,TBS NEWS DIG Powered by JNN,「事実無根で、週刊誌に報道させる目的で行われた悪質な行為」伊東純也選手に性加害疑惑　女性の刑事告訴に逆告訴,https://news.yahoo.co.jp/articles/d89225cec020834ab2c05289820ec7df3a5f03bf,2/1(木) 18:16
2024-02-02,11:21,TTL,総合,8,サンケイスポーツ,虎将トーク　阪神・岡田彰布監督、森下翔太の打撃練習に「速攻でバッティングコーチに言っといたわ。あれじゃ打てへん」,https://news.yahoo.co.jp/articles/9e644cd5928ff495396c8eef7b8358264ece09a1,2/2(金) 8:00
2024-02-02,11:21,TTL,総合,9,オリコン,「ミス日本」椎野カロリーナさん報道相手が謝罪「ご迷惑がかかる事になり申し訳ない」,https://news.yahoo.co.jp/articles/6cc4a3ed7bf209d2e1f0dc66ac6d59fe28b123a1,2/2(金) 10:18
2024-02-02,11:21,TTL,総合,10,サッカー批評Web,サッカー日本代表、アジアカップ・準々決勝イラン戦の「予想スタメン＆フォーメーション」! 伊東純也・堂安律が務めてきた右サイドの起用と、気になる最終ラインの構成,https://news.yahoo.co.jp/articles/e40e8bfe21aa99c90fe6cdc6f8db165e61d6c87a,2/2(金) 5:01
2024-02-02,11:21,TTL,総合,11,中日スポーツ,松本人志は『尊敬される人間だけど』泉谷しげるのコメントに注目集まる 「的確すぎる」「こういう発信を待っていた」,https://news.yahoo.co.jp/articles/b5ec7c115e1c63584e5dd6c801cc44d03406a9c3,2/1(木) 15:10
2024-02-02,11:21,TTL,総合,12,スポニチアネックス,日本シナリオ作家協会、動画「原作者と脚本家はどう共存できるのか編」削除　「誹謗中傷や脅迫等が…」,https://news.yahoo.co.jp/articles/51f6f7cd8f5e26c6fd0df681922762e07e7540c3,2/2(金) 9:58
2024-02-02,11:21,TTL,総合,13,みんかぶマガジン,「テレビが偉い」と未だ思っている…原作軽視はもはや慣習の実態！漫画家・芦原妃名子さんの死を経て問われる映像化の価値,https://news.yahoo.co.jp/articles/1fa07abea64574117db8ed0f8a1ef9e4b2767c4a,2/2(金) 9:10
2024-02-02,11:21,TTL,総合,14,読売新聞オンライン,羽田航空機衝突、海保機長「進入許可と思い違い」…ナンバーワンが誤進入の一因の可能性強まる,https://news.yahoo.co.jp/articles/163aee91183f3f151f56dc88b14763caf0dda968,2/2(金) 5:02
2024-02-02,11:21,TTL,総合,15,theWORLD（ザ・ワールドWeb）,伊東純也の一件で思い出されるメンディのこと、そしてデパイの悲痛な叫び「それで、この責任を一体誰が負う？」,https://news.yahoo.co.jp/articles/68e1279afea1eb48929367bf10eae7619128e20f,2/2(金) 7:01
2024-02-02,11:21,TTL,総合,16,中央日報日本語版,「自動車輸出世界１位」にも笑えなかった…安く売った中国の自責ゴール,https://news.yahoo.co.jp/articles/4c0e2f970377b6368c9d8601f73a117edb4a9777,2/2(金) 9:54
2024-02-02,11:21,TTL,総合,17,ENCOUNT,優先席の女性に女子高生が蹴り→老人に譲るも「やべぇ、妊婦じゃん」　正義感が暴走する恐さ,https://news.yahoo.co.jp/articles/fd9915d4d8fd678e5fa9effdb46dbf210a64931f,2/1(木) 10:30
2024-02-02,11:21,TTL,総合,18,MBSニュース,性加害問題で告訴　サッカー日本代表の伊東純也選手　代理人「例えば同意があったとか、なかったとかの話ではない」と逆に女性らに対する告訴状を提出,https://news.yahoo.co.jp/articles/52d0526519dc2ca4d135de342db2844ad04aa01f,2/1(木) 17:50
2024-02-02,11:21,TTL,総合,19,まいどなニュース,『ブギウギ』実話通りではあまりに残酷だから…「生まれて死んで」の展開に　スズ子が愛助の死を知る瞬間、史実からアレンジした理由,https://news.yahoo.co.jp/articles/43f7f3993d40429b0745dfca8d9f9571f202c487,2/2(金) 8:15
2024-02-02,11:21,TTL,総合,20,ENCOUNT,20歳アイドル「親知らず4本抜いた顔」が衝撃的　「別人やん」「修正無し？」とザワつく,https://news.yahoo.co.jp/articles/69530053b1c96190c72601090c3222e41a56daa4,2/2(金) 8:20
2024-02-02,11:21,TTL,総合,21,スポニチアネックス,ミス日本・椎野カロリーナさんとの週刊誌報道　相手の医師が一部内容を否定し謝罪「誤解を生む行動だった」,https://news.yahoo.co.jp/articles/87b6053cfb906b3996472b1d0fb76d59b2c4d67a,2/2(金) 9:23
2024-02-02,11:21,TTL,総合,22,デイリースポーツ,松本不在「ＤＸ」冒頭から荒れる「Ｍはどこ行った！」　浜田雅功、暴露トークは「あのＭ」厳禁指令！「皆も溜まっとんのか！？」,https://news.yahoo.co.jp/articles/db9cd8d0a7611f59e81af3cffa336e25eb548675,2/1(木) 22:12
2024-02-02,11:21,TTL,総合,23,モデルプレス,アンミカ、松本人志報道“第5弾”にコメント「今更何年も経ってなぜ」の声にも持論,https://news.yahoo.co.jp/articles/9d6ddfa2d23366b36cd6ffbc74e2bc9e43af62cb,2/1(木) 18:32
2024-02-02,11:21,TTL,総合,24,スポニチアネックス,週刊誌に“ウソ”の証言した場合、どうなる？　堀江貴文氏が経験もとに説明　「なるほど」「参考になる」,https://news.yahoo.co.jp/articles/96da50614ebea4770b97c38ea32482c3e77e4dea,2/2(金) 10:35
2024-02-02,11:21,TTL,総合,25,日刊スポーツ,椎野カロリーナと不倫報道の「筋肉医師」前田拓摩氏「既婚者である事を隠して仲良くなろうと…」,https://news.yahoo.co.jp/articles/2fe8ed3896ebad4b5cf26ddc91000543c33e934d,2/2(金) 9:53
2024-02-02,11:21,TTL,総合,26,デイリースポーツ,元なでしこ岩渕真奈さん　記者から聞かれて答えを断った質問　若槻千夏は反論「なんだアイツ、つまんねーな」,https://news.yahoo.co.jp/articles/8c712da578a11902ed3b4dc580023494f64d6169,2/1(木) 18:17
2024-02-02,11:21,TTL,総合,27,日刊スポーツ,石川佳純さんが「５変化」ＯＬ、デート、パーティー衣装披露「可愛すぎて心臓痛い」の声,https://news.yahoo.co.jp/articles/c6ac13ed325febed0ee20c3eb8fb2420897d6d3f,2/2(金) 10:17
2024-02-02,11:21,TTL,総合,28,デイリースポーツ,ソフトバンク　渡辺陸が左第１肋骨疲労骨折と診断　リハビリ組へ移管、復帰時期は未定　球団発表,https://news.yahoo.co.jp/articles/58946eb757eca1d84e9c577cdbc32a451e8b2911,2/2(金) 10:04
2024-02-02,11:21,TTL,総合,29,Merkmal,飛行機の「ペット同伴」 SNSでの“絶対NG論”は意外と正しいのかもしれない,https://news.yahoo.co.jp/articles/79e4223a0f3da10b95af6cabf6eb69e5a17f680c,1/27(土) 8:11
2024-02-02,11:21,TTL,総合,30,デイリースポーツ,前田穂南の日本新を後押しした“最強の相棒”　「脱いで走りたい」大苦戦した厚底シューズへの対応の裏側,https://news.yahoo.co.jp/articles/737c63cfbb4f4212cd11d11b4194aabcfebbab70,2/2(金) 10:00
2024-02-02,11:21,TTL,総合,31,スポーツ報知,「えっ常盤貴子なん？」５１歳全身ショットにネット二度見「マジ」「びっくり」１５年前に年下俳優と結婚,https://news.yahoo.co.jp/articles/194dff2025250d281a49c903169bfdeea5b5d60c,2/2(金) 10:55
2024-02-02,11:21,TTL,総合,32,弁護士ドットコムニュース,「南海電鉄関係者はすべて入店禁止」　居酒屋の張り紙が話題、「これで潰れても気にしない」店主の言い分,https://news.yahoo.co.jp/articles/5a53a1b1e50d6f634ba5a38ecb17e951bc4e1e70,2/1(木) 13:06
2024-02-02,11:21,TTL,総合,33,東スポWEB,のだめ作者・二ノ宮知子氏 〝原作者に会いたくない〟の声に「うん知ってる。だから問題が起きる」,https://news.yahoo.co.jp/articles/ac9a9c9264990adc1af3c9463671fea504d2aaaf,2/2(金) 11:02
2024-02-02,11:21,TTL,総合,34,読売新聞オンライン,体育館の冷たい床に今も雑魚寝、高齢被災者に過酷な避難所…「このままでは関連死防ぐの難しい」,https://news.yahoo.co.jp/articles/bc81091fe2c0498e11d66a67513c9b7be9c47c2a,2/2(金) 5:05
2024-02-02,11:21,TTL,総合,35,ITmedia NEWS,AMラジオ、34局が放送休止へ　1日から順次,https://news.yahoo.co.jp/articles/04af2f039fdc6e2cfe3a74aa9b7ba9ac1accdfb8,2/1(木) 19:27
2024-02-02,11:21,TTL,総合,36,西スポWEB OTTO！,「こんな日が来るなんて…」奈緒が全く同じ生年月日で九州出身の女優と合同誕生日会2ショット公開　ファン「運命すぎるよね?!」「バリ可愛いか～」,https://news.yahoo.co.jp/articles/3ab2b0d8ca3572c1e564684b93e346390df8706c,2/2(金) 7:01
2024-02-02,11:21,TTL,総合,37,日刊ゲンダイDIGITAL,男性モデルに女性水着を着せたPRが大炎上！ ハワイの「モアナ・ビキニ」は“落ち着きなさい”と呼びかけ,https://news.yahoo.co.jp/articles/c022908b5ecdacf96b7df74640b26bccde216bac,2/2(金) 9:06
2024-02-02,11:21,TTL,総合,38,ほ・とせなNEWS,夫が割った皿にメッセージを書くと…　翌日、夫からの返答に「面白い」「傑作すぎて飾ってほしい」の声,https://news.yahoo.co.jp/articles/4605eb89e9c7f1c5425f9ee674f3f199b6ca0acc,2/1(木) 12:30
2024-02-02,11:21,TTL,総合,39,ねとらぼ,ユニクロ7990円のコートを田舎暮らしの60代女性が着ると……　リアルなコーディネート結果に反響「最高ですね」,https://news.yahoo.co.jp/articles/287a806b08ec090f46afde04be11259f0ddff84f,2/2(金) 8:05
2024-02-02,11:21,TTL,総合,40,ねとらぼ,0歳赤ちゃんの驚愕する特技に「すごい!!」「こんな赤子も存在するんだ…」　ママ大助かりな姿が100万再生超え,https://news.yahoo.co.jp/articles/753babbe73f2c8109293c56c34dd59536ec517c9,2/2(金) 8:30
