scrp_date,scrp_time,genre_en,genre_jp,rank,media_jp,title,link,date_original
2025-07-28,11:50,domestic,国内,1,日刊スポーツ,ひろゆき氏「醜いという言葉は」北村晴男氏の「醜く奇妙な生き物を国のリーダーに選んだ」に言及,https://news.yahoo.co.jp/articles/8d33a80bf79aa82d6a24f7e8f65f80cb6a9030da,7/28(月) 10:24
2025-07-28,11:50,domestic,国内,2,読売新聞オンライン,道路陥没から半年の八潮市、悪臭続き「窓開けられない」…工事完了まで「５～７年程度かかる」,https://news.yahoo.co.jp/articles/e0be1f415c374c67ab7ebcc286e7334cbd8e03f0,7/28(月) 6:43
2025-07-28,11:50,domestic,国内,3,日刊スポーツ,松山千春が推察、石破茂首相の進退問題めぐり「俺たちよりモヤモヤしている」３人「やっぱり…」,https://news.yahoo.co.jp/articles/316eac10662f0e3cd699b5886a209c404b50512a,7/28(月) 7:08
2025-07-28,11:50,domestic,国内,4,日刊スポーツ,参政党・神谷宗幣代表ブチ切れ「それはあなたの主観」テレビ番組で皇位継承巡り“大バトル”,https://news.yahoo.co.jp/articles/f445b61cc63239801a390e665f4566df7915919d,7/27(日) 17:22
2025-07-28,11:50,domestic,国内,5,スポニチアネックス,「ベトナム国籍の技能実習生」トレンド急上昇で1位に、佐賀・伊万里市の母娘死傷強殺事件で容疑者逮捕,https://news.yahoo.co.jp/articles/e99050e9c4cb2b0b8f878b145a701e5cd8d924b4,7/28(月) 9:50
2025-07-28,11:50,domestic,国内,6,日刊スポーツ,北村晴男氏、Ｘに批判殺到　石破首相“解散言及”との 誤情報引用し「醜い奇妙な生き物」,https://news.yahoo.co.jp/articles/bf7a21e3cc9cc4844d022ddf0ae2922ed2792060,7/28(月) 8:40
2025-07-28,11:50,domestic,国内,7,日刊スポーツ,山口真由氏「自民党の右派がすごく動揺…絶対動揺すべきじゃない」強まる石破おろしの動きに提言,https://news.yahoo.co.jp/articles/b6a94e3ed14bdef38b33a03bd457b5eb9dc80eaf,7/28(月) 9:58
2025-07-28,11:50,domestic,国内,8,中日スポーツ,「批判じゃなくて誹謗中傷」北村晴男・参院議員の発言が物議…一国の首相を「醜く奇妙な生き物」呼ばわりに非難殺到「政治家が使う言葉か？」,https://news.yahoo.co.jp/articles/94dd386a8b3c9e4de46c7e6fc3a8485cab12bd31,7/27(日) 18:50
2025-07-28,11:50,domestic,国内,9,ABEMA TIMES,「内閣はあなたの私物ではない」「選挙を舐めるな」石破総理に特大ブーメラン…選挙大敗政権に退陣迫る“石破発言録”,https://news.yahoo.co.jp/articles/275eb3db3842e6c57671084eafcd9fabd1ec3e8c,7/28(月) 7:02
2025-07-28,11:50,domestic,国内,10,弁護士JPニュース,教師が「無断撮影・録音」でクビ→「解雇無効」の判決　学校側は20以上の“問題行動”を訴えるも…裁判所が認めなかったワケ,https://news.yahoo.co.jp/articles/dd5e2c675ece50db4d614162c16fda98d97d74a6,7/28(月) 10:00
2025-07-28,11:50,domestic,国内,11,弁護士JPニュース,知的障害者は「弁護士」からも見放される？　「執行猶予付き」判決はほぼ無理…国の仕組みが招く“刑務所行き”の実態,https://news.yahoo.co.jp/articles/bffedf7fa790e9215ad72bc7849ec4622dedfea9,7/28(月) 10:40
2025-07-28,11:50,domestic,国内,12,産経新聞,不法滞在ゼロ計画に日弁連会長が反対声明　入管庁がコメント「厳格な対応求められている」　「移民」と日本人,https://news.yahoo.co.jp/articles/d5a6f054e9077a9c0f2d45f0afbab76d9f23b0b1,7/28(月) 7:00
2025-07-28,11:50,domestic,国内,13,Yahoo!ニュース オリジナル 特集,戦後3日で通達された占領軍向け慰安所の設置。国策だった売春は女性を守ったのか　#戦争の記憶,https://news.yahoo.co.jp/articles/8bfe0d9020b5f3470a0a5d3fc68e6e1d7d477cb2,7/27(日) 15:00
2025-07-28,11:50,domestic,国内,14,中国新聞デジタル,高層ビル建設で使われるタワークレーン、どうやって上に？,https://news.yahoo.co.jp/articles/0c2342bd507b3126103695a6265064c2509e3578,7/28(月) 10:28
2025-07-28,11:50,domestic,国内,15,TBS NEWS DIG Powered by JNN,プールで女子中学生の水着に手を入れた男を逮捕　潜水してきたところを家族に見られ　「かわいかったから」と容疑を認める　埼玉・所沢市,https://news.yahoo.co.jp/articles/cd7698878f0face38aa7311f46308e7408788816,7/27(日) 23:44
2025-07-28,11:50,domestic,国内,16,J-CASTニュース,日本保守党・北村晴男氏が石破茂首相に「どこまでも醜い、奇妙な生き物」　まとめサイト引用、過激表現に批判相次ぐ,https://news.yahoo.co.jp/articles/fb8c855762d81275ee1c616688a1f06f600b8ebd,7/28(月) 10:55
2025-07-28,11:50,domestic,国内,17,レスキューナウニュース,常磐線で人身事故 一部運転見合わせ,https://news.yahoo.co.jp/articles/72165803becccad0134efe040747842606bd0cf7,7/28(月) 10:25
2025-07-28,11:50,domestic,国内,18,日刊スポーツ,“ド正論”指摘の鈴木宗男氏「裏金議員はどう受け止めるのか」自民内の石破おろしの動きをけん制,https://news.yahoo.co.jp/articles/477b88ec333e82515427bfae3210080ea33c382f,7/28(月) 10:58
2025-07-28,11:50,domestic,国内,19,読売新聞オンライン,伊万里の強盗殺人、母は数日前「舞子が帰ってきている」…３０年来の知人「とても仲がいい家族」,https://news.yahoo.co.jp/articles/24a0a84fe7fa140225fea8fcbefb8191f2806a23,7/28(月) 7:32
2025-07-28,11:50,domestic,国内,20,弁護士JPニュース,生活保護受給者の“孫”が働きながら学校に通うのはNG？　最高裁判決に「国はヤングケアラー推進か」疑問の声も…若者の自立を阻む“制度の矛盾”とは,https://news.yahoo.co.jp/articles/367bd51d8075618ff380184bee0f9ae2d4a957d8,7/28(月) 10:20
2025-07-28,11:50,domestic,国内,21,TBS NEWS DIG Powered by JNN,【速報】「目出し帽の男たちが室内に入ってきた」　横浜市神奈川区で強盗事件　金庫も盗まれたか,https://news.yahoo.co.jp/articles/61db70d6f9d2c0efd19d1525d725884159c5f388,7/28(月) 7:19
2025-07-28,11:50,domestic,国内,22,日刊スポーツ,早大教授「石破さんなぜ嫌われる？」直球質問に石原伸晃氏が「それは簡単ですよ」即答説明,https://news.yahoo.co.jp/articles/3045190feddc9948a283d4e8024b1bf649bc7fb8,7/27(日) 12:12
2025-07-28,11:50,domestic,国内,23,読売新聞オンライン,街のスプレー落書き、容疑の１８歳を逮捕…相次ぐ渋谷区は税金投入し４年で１４００件消去,https://news.yahoo.co.jp/articles/32a878c53c656775e5516a6cee580ea3a3d5b291,7/28(月) 10:26
2025-07-28,11:50,domestic,国内,24,日刊スポーツ,松山千春が告白「これは予想外」だった参院選「本来だったら自民、公明が駄目だったら…」,https://news.yahoo.co.jp/articles/c11e76352845affd1d22573f095326b31ca86ad0,7/28(月) 6:50
2025-07-28,11:50,domestic,国内,25,スポニチアネックス,田崎史郎氏　石破首相の進退に「退陣を表明するなら8月下旬頃の可能性が高い。きょうの懇談会では…」,https://news.yahoo.co.jp/articles/996fc3d8063a95c662e57f34b4b361bcf33e4875,7/28(月) 9:00
2025-07-28,11:50,domestic,国内,26,J-CASTニュース,伊東市・田久保市長「7月中の辞職」トーンダウンか、よもや退職金絡み？　百条委の回答拒否で罰則もあり得る,https://news.yahoo.co.jp/articles/70e0199435143a5914b9c4d76d6c484027bc1536,7/27(日) 17:40
2025-07-28,11:50,domestic,国内,27,デイリースポーツ,石原伸晃氏が「能力はあるけど友達がいない」と評した次期総裁候補　「民主主義って票の数ですから」,https://news.yahoo.co.jp/articles/d93632db9071ab75386c34fe729742d5c4eb3610,7/26(土) 14:01
2025-07-28,11:50,domestic,国内,28,テレビ朝日系（ANN）,28日午後に自民両院議員懇談会　石破総理続投は理解されるのか　大荒れの展開も,https://news.yahoo.co.jp/articles/640ad02714d7a2a4d1017598b3c0fc942882e5e6,7/28(月) 10:42
2025-07-28,11:50,domestic,国内,29,日刊スポーツ,91歳田原総一朗氏「首相辞めるなのデモは前代未聞だ。これだけ期待されてるのだから…」と私見,https://news.yahoo.co.jp/articles/d2e848192999fee18043c6474f6fb8166e73fcdd,7/27(日) 11:35
2025-07-28,11:50,domestic,国内,30,日本ファクトチェックセンター,参政党がスパイ防止法案を提出? 投稿時点で提出なし【ファクトチェック】,https://news.yahoo.co.jp/articles/a3b9a64f5a5e6d1d832b07a16dc8e1cb2568cf9f,7/28(月) 9:57
2025-07-28,11:50,domestic,国内,31,読売テレビ,【速報】27日（日）万博の一般来場者11.4万人 28日（月）は大屋根リングで盆踊り 西川きよしファミリー・NMB48など参加,https://news.yahoo.co.jp/articles/6fcfdec5014a557fd84c50d23620eac68b61f00d,7/28(月) 9:48
2025-07-28,11:50,domestic,国内,32,TBS NEWS DIG Powered by JNN,「本当に取り返しのつかないことをしてしまった」温泉施設の個室で太ももや尻をマッサージ…県立高校の職員ら2人を懲戒処分　埼玉県教育委員会,https://news.yahoo.co.jp/articles/e4533f5de2a18258be477c961370a37c7303b269,7/24(木) 19:06
2025-07-28,11:50,domestic,国内,33,日刊スポーツ,「報道特集」参政党が取材拒否した神奈川新聞記者が実名登場　参院選当選者「非国民」発言も批判,https://news.yahoo.co.jp/articles/b3cbaf42214b228648150556ee9f7e83cde3411f,7/26(土) 19:16
2025-07-28,11:50,domestic,国内,34,J-CASTニュース,味噌汁は沸騰させたらダメなのか　リュウジが「炎上覚悟」で3パターン検証、明らかになった「新事実」,https://news.yahoo.co.jp/articles/b5df27ecf97ad4684f8a0bdd69be601d9c56f3b2,7/27(日) 12:15
2025-07-28,11:50,domestic,国内,35,毎日新聞,知床の国道でエゾシカの雄をヒグマが襲う　「動けないシカは通報を」,https://news.yahoo.co.jp/articles/64ea1182ce6b27062a13fab5c4757f83205d3dc5,7/27(日) 17:46
2025-07-28,11:50,domestic,国内,36,読売新聞オンライン,目出し帽の男たち、横浜の民家に早朝押し入り金庫を奪う…住人の顔に催涙スプレーか,https://news.yahoo.co.jp/articles/1d4556ce87fccd64997f1571c43c86e5730abb8d,7/28(月) 10:38
2025-07-28,11:50,domestic,国内,37,毎日新聞,「次の首相」石破氏がトップ　2位は高市氏　毎日新聞世論調査,https://news.yahoo.co.jp/articles/9fd9bf732c5b6ff5f77d10b0fe5bc829a030f6c1,7/27(日) 15:54
2025-07-28,11:50,domestic,国内,38,TBS NEWS DIG Powered by JNN,「介護美容」が現場を変える?なり手は増加中、意外な役割の期待も　嫌なことが「気持ち良い」に,https://news.yahoo.co.jp/articles/9c7586b52f4a3429b60c0dcfef5e10bb202a0501,7/27(日) 7:02
2025-07-28,11:50,domestic,国内,39,デイリースポーツ,卒業証書チラ見せ窮地の伊東市長、野口健氏が添付のメガソーラー建設中止に署名したと投稿,https://news.yahoo.co.jp/articles/ae6ff4725fc11ae56634e5798c20fff463fb59b8,7/26(土) 15:36
2025-07-28,11:50,domestic,国内,40,日刊スポーツ,昨年10月当選…43歳森下千里議員“まるで別人”現在の姿に反響「初めての…」,https://news.yahoo.co.jp/articles/c9023ac1237086aaf4375f2d426df80cc051d115,7/27(日) 10:32
