scrp_date,scrp_time,genre_en,genre_jp,rank,media_jp,title,link,date_original
2024-03-20,10:12,domestic,国内,1,J-CASTニュース,サークル合宿で障子や天井破壊→動画拡散　神戸大が「不適切行為」で謝罪「大学として厳重に対処」,https://news.yahoo.co.jp/articles/6168b6663a201c3eb96a3cd54f50becab2e20628,3/19(火) 17:59
2024-03-20,10:12,domestic,国内,2,スポーツ報知,安住紳一郎アナ　神戸大バドミントンサークル学生「旅館破壊」動画に憤り「ちょっと信じられない」,https://news.yahoo.co.jp/articles/7c9f2dce60e6d2c1fbc0e5dcf9da323f13165702,3/20(水) 7:33
2024-03-20,10:12,domestic,国内,3,デイリースポーツ,藤井聡京大教授「最悪です」日銀のマイナス金利解除に「国民貧困化の加速は決定的」テレビ出演多数「正義のミカタ」など,https://news.yahoo.co.jp/articles/f30c518f570201b30a1541bd45052f6845df954a,3/19(火) 18:30
2024-03-20,10:12,domestic,国内,4,朝日新聞デジタル,たばこをゴミ箱に捨てたら…駅が全焼、重過失失火容疑で男を書類送検,https://news.yahoo.co.jp/articles/c422b8311abdf6bd000bab80e69d238067137f4d,3/19(火) 17:36
2024-03-20,10:12,domestic,国内,5,FNNプライムオンライン（フジテレビ系）,【速報】愛子さま学習院大学卒業式へ　桜色の振り袖に紺色の袴姿「充実した4年間を過ごすことができました」,https://news.yahoo.co.jp/articles/d8370aa58f13c06dd7d4807a6b326192cd832220,3/20(水) 9:30
2024-03-20,10:12,domestic,国内,6,時事通信,再エネ負担、年1万円増　4月から、標準家庭で　経産省,https://news.yahoo.co.jp/articles/c2564bba473dd81ca8298dec66cf224baf1708fd,3/19(火) 16:16
2024-03-20,10:12,domestic,国内,7,ABEMA TIMES,元暴力団員、覚せい剤中毒で服役も… 異色の経歴を持つ弁護士がどん底人生から変わることができたきっかけ 「母親が差し入れてくれた1冊の本に感銘を受けて…」,https://news.yahoo.co.jp/articles/b609e841688bdbd191ce74646c74468988bd6099,3/20(水) 7:31
2024-03-20,10:12,domestic,国内,8,みんかぶマガジン,まだ新NISAやってないのか「やるなら早い方がいい」…日経平均爆上げで株始めるド素人にお話したい「資産形成」と「資産運用」の違い,https://news.yahoo.co.jp/articles/b1fdec4a3513f68b7c42b24c76f180c6902cf4b3,3/20(水) 9:10
2024-03-20,10:12,domestic,国内,9,レスキューナウニュース,高崎線・宇都宮線で人身事故 一部運転見合わせ,https://news.yahoo.co.jp/articles/4587eb5354abd41ebcc7d726b5603ef1aab5210d,3/20(水) 9:10
2024-03-20,10:12,domestic,国内,10,ABEMA TIMES,「入学式の撮影カメラマン」Xで募集→「親として怖いしかない」などと炎上 背景に「ブラックすぎる待遇」か,https://news.yahoo.co.jp/articles/83235ae7dcebb2d6b5a07693773988a59a844837,3/19(火) 12:24
2024-03-20,10:12,domestic,国内,11,FNNプライムオンライン,【独自】迫る電車…高齢夫婦の車が警報鳴る踏切内に侵入　「焦った感じなかった」遮断機が下りた後になぜ?,https://news.yahoo.co.jp/articles/a415b9d25ba24a761be852f8ef3ec74f12ebeb79,3/20(水) 6:13
2024-03-20,10:12,domestic,国内,12,朝日新聞デジタル,野田元首相「岸田さん、脱法執行部が脱法議員を処分できるか」,https://news.yahoo.co.jp/articles/68047bfba9ef5187e49739625523c922a2c95c71,3/19(火) 18:10
2024-03-20,10:12,domestic,国内,13,FNNプライムオンライン,【全文】愛子さま大学卒業「一生の思い出」　オンライン授業の戸惑い　“当たり前”の尊さ実感された対面授業や友人との交流,https://news.yahoo.co.jp/articles/c63cfe359a4f0ee416cb041fe982c30d62aba04e,3/20(水) 9:32
2024-03-20,10:12,domestic,国内,14,毎日新聞,サッカー観戦行かないで　外務省、北朝鮮への渡航自粛改めて要請,https://news.yahoo.co.jp/articles/2a774afa409ed6d99d97a1c7ee5a7b348904c793,3/19(火) 14:30
2024-03-20,10:12,domestic,国内,15,日テレNEWS NNN,愛子さま、きょう大学卒業　指導教授が明かす愛子さまの「粘り強さ」と「朗らかな笑顔」,https://news.yahoo.co.jp/articles/b0254d2e1b5d8542c9dc0edcd049cd72d681a19b,3/20(水) 9:30
2024-03-20,10:12,domestic,国内,16,47NEWS,夫を殺害した男性は、心神喪失で不起訴になった。裁判官と受け答えができていたのに…「どうして殺されたの？」真相を求める遺族の苦悩は続く,https://news.yahoo.co.jp/articles/6e1223a789eaed872bc1caa6084f8eb650ad464a,3/19(火) 11:02
2024-03-20,10:12,domestic,国内,17,毎日新聞,愛子さま「知的好奇心にあふれ、常に誠実」　卒論は式子内親王,https://news.yahoo.co.jp/articles/c34dd2b5618d322ad760e87942eafd9c09d1ca87,3/20(水) 9:30
2024-03-20,10:12,domestic,国内,18,読売新聞オンライン,オーバーランした東北新幹線つばさ、７ｋｍ「滑走」…ポイントを６５キロオーバーで通過,https://news.yahoo.co.jp/articles/b8a29a7c4068edc95d773ec551ab178667613e71,3/19(火) 19:04
2024-03-20,10:12,domestic,国内,19,朝日新聞デジタル,「パパ、送り返されちゃうの？」息子の言葉に英会話教師の胸は痛んだ,https://news.yahoo.co.jp/articles/083e905bc787f32b74d228a00259ff29fdf72da1,3/20(水) 9:00
2024-03-20,10:12,domestic,国内,20,毎日新聞,公園のため池で2歳男児溺れ意識不明　柵で囲われるも隙間　千葉,https://news.yahoo.co.jp/articles/c097c1597dabef1a170ff15813b66f8ec5dd665d,3/19(火) 21:16
2024-03-20,10:12,domestic,国内,21,朝日新聞デジタル,岸田首相、二階元幹事長も処分へ　派閥裏金問題で4月上旬にも,https://news.yahoo.co.jp/articles/4cfc04a1c4e557a2dc0c8d1cdf6bf8e2c515d1a8,3/20(水) 8:00
2024-03-20,10:12,domestic,国内,22,読売新聞オンライン,愛子さま卒業、指導教員の中野貴文教授「共に学び研究すること楽しかった」…ユーモア忘れない姿も印象に,https://news.yahoo.co.jp/articles/fda4a989b9144e6bf31dc31769ed883c9145f533,3/20(水) 9:30
2024-03-20,10:12,domestic,国内,23,TOKYO MX,宇宙で発電し地球へ送電…日本が世界をリードする“宇宙太陽光発電システム”に迫る,https://news.yahoo.co.jp/articles/d2c8aeb633e861e48635cfade0f497dd918c05c7,3/20(水) 7:00
2024-03-20,10:12,domestic,国内,24,東海テレビ,裁判中泣き出す場面も…“頂き女子りりちゃん”に懲役13年・罰金1200万円を求刑「心情につけこみ卑劣」,https://news.yahoo.co.jp/articles/de6072df545bbac1bc7d0beb2fcb6a4b0d38e8b0,3/15(金) 21:14
2024-03-20,10:12,domestic,国内,25,日テレNEWS NNN,東北新幹線“オーバーラン”ポイントを制限速度の倍近いスピードで通過　JR東日本が明らかに,https://news.yahoo.co.jp/articles/f51e37e79986dee831f786610129af41c9bbb537,3/19(火) 18:47
2024-03-20,10:12,domestic,国内,26,時事通信,岸田首相の解散判断焦点に　自民裏金、逆風やまず　人事断行論も〔深層探訪〕,https://news.yahoo.co.jp/articles/a2340cae2f106f4a34ebecdb7551b88a89a55bb5,3/20(水) 7:00
2024-03-20,10:12,domestic,国内,27,TBS NEWS DIG Powered by JNN,【暴風警報】愛知県・豊橋市、半田市、豊川市、碧南市、刈谷市、西尾市などに発表,https://news.yahoo.co.jp/articles/7a16aa213b5186d5d467475c952fd89fe7e5eec6,3/20(水) 6:53
2024-03-20,10:12,domestic,国内,28,スポーツ報知,若狭勝氏「めざまし８」で「裏金事件」自民党現職議員の処分を解説「銀座３兄弟が離党勧告…今回は離党勧告さえも誰もしないとなると相当軽すぎる」,https://news.yahoo.co.jp/articles/2f65d09f249ca8828819d719b33a97a27c8684fb,3/20(水) 9:39
2024-03-20,10:12,domestic,国内,29,J-CASTニュース,サボりを確認したら、発覚したのは「隠れ残業」だった　Xへの投稿相次ぐ...「リモートワーク」実体験,https://news.yahoo.co.jp/articles/806e801c3eda53d26d8b81939dcf93eef5c9e8bf,3/18(月) 10:00
2024-03-20,10:12,domestic,国内,30,FNNプライムオンライン,愛子さま学習院大学卒業　コロナ禍乗り越えて学習に公務に励まれた4年間　成長の軌跡,https://news.yahoo.co.jp/articles/9aa10f4faf7351de6b1c184894b5f1114d465aff,3/20(水) 9:32
2024-03-20,10:12,domestic,国内,31,日テレNEWS NNN,【天気】春分の日は急な雨やカミナリに注意,https://news.yahoo.co.jp/articles/ff00de32d5717d5bd6c256c1a4b09cf0782c2f78,3/20(水) 7:03
2024-03-20,10:12,domestic,国内,32,tenki.jp,2024年桜開花予想更新　桜の開花迫る　寒の戻りで前回より遅く　東京24日,https://news.yahoo.co.jp/articles/ba8d7a609a357dd4119d3e00ba8efbf0b834850c,3/19(火) 14:27
2024-03-20,10:12,domestic,国内,33,中日スポーツ,紀藤正樹弁護士「なんとしょぼい」日銀のマイナス金利政策解除による普通預金金利の引き上げに私見,https://news.yahoo.co.jp/articles/017fc0d102b590120edd1a8d543c07fe87d66223,3/19(火) 19:33
2024-03-20,10:12,domestic,国内,34,夕刊フジ,若い棋士が上がる図式定着　順位戦（Ｂ級１組～Ｃ級１組）　昨今は年配者の昇級が見られず…戦法や戦術、ＡＩの影響か,https://news.yahoo.co.jp/articles/96fba8ffdd62402a19c2904d8a1f87e34f317ecb,3/19(火) 17:00
2024-03-20,10:12,domestic,国内,35,読売新聞オンライン,愛子さま、桜色の振り袖と紺のはかま姿で卒業式「素晴らしい先生方や友人たちと出会えた」,https://news.yahoo.co.jp/articles/8e56c876fab74cdf286d046422848cd5168d37a2,3/20(水) 9:56
2024-03-20,10:12,domestic,国内,36,tenki.jp,20日(春分の日)　春の嵐で全国的に荒天　暴風・高波に警戒　大雪になる所も,https://news.yahoo.co.jp/articles/0ddc8a275a009464824c9a0bc66306973851db35,3/20(水) 5:44
2024-03-20,10:12,domestic,国内,37,朝日新聞デジタル,生活保護受給者の車利用、行政側の報告要求は妥当？津地裁であす判決,https://news.yahoo.co.jp/articles/a04d4726facdf4dbf63b8d998582b3ab05ec8f02,3/20(水) 7:00
2024-03-20,10:12,domestic,国内,38,共同通信,有機フッ素、夏に除去指針　各地で検出、健康影響懸念,https://news.yahoo.co.jp/articles/13ab4ae875bedc7042ae8683671343a196ebd2fa,3/16(土) 21:01
2024-03-20,10:12,domestic,国内,39,ニッポン放送,自民青年局「破廉恥パーティー」の原点は「埼玉県連」にある　須田慎一郎が指摘,https://news.yahoo.co.jp/articles/4c44af4507ec17b2fdee40375597bb91e3c46660,3/18(月) 17:30
2024-03-20,10:12,domestic,国内,40,TBS NEWS DIG Powered by JNN,【全文】愛子さま「大きな達成感」中世の女流歌人式子内親王の和歌に関する卒業論文終えて　学習院大学卒業にあたり文書で感想,https://news.yahoo.co.jp/articles/ca52cea0bac0198191d0a7050f91d5a0396e3387,3/20(水) 9:30
