scrp_date,scrp_time,genre_en,genre_jp,rank,media_jp,title,link,date_original
2024-03-20,14:18,domestic,国内,1,読売新聞オンライン,愛子さま、桜色の振り袖と紺のはかま姿で卒業式「素晴らしい先生方や友人たちと出会えた」,https://news.yahoo.co.jp/articles/8e56c876fab74cdf286d046422848cd5168d37a2,3/20(水) 9:56
2024-03-20,14:18,domestic,国内,2,FNNプライムオンライン,【全文】愛子さま大学卒業「一生の思い出」　オンライン授業の戸惑い　“当たり前”の尊さ実感された対面授業や友人との交流,https://news.yahoo.co.jp/articles/c63cfe359a4f0ee416cb041fe982c30d62aba04e,3/20(水) 9:32
2024-03-20,14:18,domestic,国内,3,朝日新聞デジタル,岸田首相、二階元幹事長も処分へ　派閥裏金問題で4月上旬にも,https://news.yahoo.co.jp/articles/4cfc04a1c4e557a2dc0c8d1cdf6bf8e2c515d1a8,3/20(水) 8:00
2024-03-20,14:18,domestic,国内,4,J-CASTニュース,サークル合宿で障子や天井破壊→動画拡散　神戸大が「不適切行為」で謝罪「大学として厳重に対処」,https://news.yahoo.co.jp/articles/6168b6663a201c3eb96a3cd54f50becab2e20628,3/19(火) 17:59
2024-03-20,14:18,domestic,国内,5,スポーツ報知,安住紳一郎アナ　神戸大バドミントンサークル学生「旅館破壊」動画に憤り「ちょっと信じられない」,https://news.yahoo.co.jp/articles/7c9f2dce60e6d2c1fbc0e5dcf9da323f13165702,3/20(水) 7:33
2024-03-20,14:18,domestic,国内,6,ABEMA TIMES,「殺すぞ」カスハラ激化でラーメン店が閉店 売上がゼロになったものの罰金は10万円だけ「もし高額だったらさらに恨みを買うんじゃないかと…」,https://news.yahoo.co.jp/articles/115b63f26ffeb5c9882611c7039807fa4c4d638e,3/20(水) 11:32
2024-03-20,14:18,domestic,国内,7,デイリースポーツ,藤井聡京大教授「最悪です」日銀のマイナス金利解除に「国民貧困化の加速は決定的」テレビ出演多数「正義のミカタ」など,https://news.yahoo.co.jp/articles/f30c518f570201b30a1541bd45052f6845df954a,3/19(火) 18:30
2024-03-20,14:18,domestic,国内,8,毎日新聞,裸の父おぶい「俺はもう住まない」　集団移転した集落　中越地震20年,https://news.yahoo.co.jp/articles/9ed9d738206c0e6b2bd92172662ba289d84c1bf7,3/20(水) 8:00
2024-03-20,14:18,domestic,国内,9,朝日新聞デジタル,弥生人の顔「第2弾」を20日にお披露目へ　女性の想定が男性に,https://news.yahoo.co.jp/articles/2bb3927603ec93b02e17008970d4a4dd7280d466,3/19(火) 21:00
2024-03-20,14:18,domestic,国内,10,時事通信,再エネ負担、年1万円増　4月から、標準家庭で　経産省,https://news.yahoo.co.jp/articles/c2564bba473dd81ca8298dec66cf224baf1708fd,3/19(火) 16:16
2024-03-20,14:18,domestic,国内,11,テレビ朝日系（ANN）,裏金議員80人に厳重処分なし？　田崎氏解説、安倍派5人衆「二重処分になる」と主張,https://news.yahoo.co.jp/articles/bae6ff3032b803e7bdd6ba41767593109e4dfb87,3/20(水) 13:22
2024-03-20,14:18,domestic,国内,12,レスキューナウニュース,JR京都線で人身事故 運転見合わせ,https://news.yahoo.co.jp/articles/bd12a9c92701bcc79fe1bdc72876b4f2c60f38ff,3/20(水) 11:50
2024-03-20,14:18,domestic,国内,13,ABEMA TIMES,京葉線「通勤快速」廃止 改正後初のラッシュは悲鳴相次ぐ,https://news.yahoo.co.jp/articles/8819c082ff79a3543c1e1248f0827c39f971ec35,3/20(水) 11:42
2024-03-20,14:18,domestic,国内,14,朝日新聞デジタル,火を使わなくても爆発、なぜ？　化学の定説覆した高校生2人が米国へ,https://news.yahoo.co.jp/articles/ce2dce9ec658039d20e9387a3d0158cf6847e029,3/20(水) 11:06
2024-03-20,14:18,domestic,国内,15,みんかぶマガジン,まだ新NISAやってないのか「やるなら早い方がいい」…日経平均爆上げで株始めるド素人にお話したい「資産形成」と「資産運用」の違い,https://news.yahoo.co.jp/articles/b1fdec4a3513f68b7c42b24c76f180c6902cf4b3,3/20(水) 9:10
2024-03-20,14:18,domestic,国内,16,読売新聞オンライン,交番勤務中にニンテンドースイッチで１０回１７時間遊ぶ…抜き打ち検査で発覚、給料差し引く方針,https://news.yahoo.co.jp/articles/6dd5b9816134cd8a520130ff0cc498a8f7d32e34,3/20(水) 12:58
2024-03-20,14:18,domestic,国内,17,テレビ朝日系（ANN）,神戸大非公認サークル“不適切動画”拡散　胴上げで旅館の天井破壊　告発した男性取材,https://news.yahoo.co.jp/articles/3375fc1441ad141c055137e22b994a0fb1f07f35,3/20(水) 13:46
2024-03-20,14:18,domestic,国内,18,読売新聞オンライン,愛子さま、伊勢神宮と神武天皇の陵を参拝へ…学習院大の卒業を報告,https://news.yahoo.co.jp/articles/d206ffc8ea13a2f9e8d9288c1acd05bbd296d3f4,3/18(月) 22:08
2024-03-20,14:18,domestic,国内,19,47NEWS,朝鮮人労働者の追悼碑、県が撤去した根拠は「後出し」だった？　議会も「全会一致」で採択したはずが…１３年後に態度が一変,https://news.yahoo.co.jp/articles/65c8bb407514ba72925b198f909bfb97b6de85df,3/20(水) 10:02
2024-03-20,14:18,domestic,国内,20,日テレNEWS NNN,愛子さま、きょう大学卒業　指導教授が明かす愛子さまの「粘り強さ」と「朗らかな笑顔」,https://news.yahoo.co.jp/articles/b0254d2e1b5d8542c9dc0edcd049cd72d681a19b,3/20(水) 9:30
2024-03-20,14:18,domestic,国内,21,FNNプライムオンライン（フジテレビ系）,【速報】愛子さま学習院大学卒業式へ　桜色の振り袖に紺色の袴姿「充実した4年間を過ごすことができました」,https://news.yahoo.co.jp/articles/d8370aa58f13c06dd7d4807a6b326192cd832220,3/20(水) 9:30
2024-03-20,14:18,domestic,国内,22,読売新聞オンライン,５０代京大職員が出勤日の５割超で遅刻、うその勤怠入力し戒告処分…「起きられなかった」,https://news.yahoo.co.jp/articles/07327221a467d8d7fcc3bf52d2544aa44ca29eea,3/20(水) 12:23
2024-03-20,14:18,domestic,国内,23,ABEMA TIMES,元暴力団員、覚せい剤中毒で服役も… 異色の経歴を持つ弁護士がどん底人生から変わることができたきっかけ 「母親が差し入れてくれた1冊の本に感銘を受けて…」,https://news.yahoo.co.jp/articles/b609e841688bdbd191ce74646c74468988bd6099,3/20(水) 7:31
2024-03-20,14:18,domestic,国内,24,レスキューナウニュース,高崎線・宇都宮線で人身事故 一部運転見合わせ,https://news.yahoo.co.jp/articles/4587eb5354abd41ebcc7d726b5603ef1aab5210d,3/20(水) 9:10
2024-03-20,14:18,domestic,国内,25,時事通信,連結納税制度「乱用」を認定　光通信子会社19億円追徴　東京国税局,https://news.yahoo.co.jp/articles/6f797eae0a364966ab491cce919388641e020715,3/20(水) 11:18
2024-03-20,14:18,domestic,国内,26,ABEMA TIMES,格闘イベント出場の“強盗男” 連行中に土下座も容疑は否認「途中から記憶が飛んでいる」,https://news.yahoo.co.jp/articles/875d3459162f83d2b03420300a829d6d366f1d7a,3/20(水) 11:32
2024-03-20,14:18,domestic,国内,27,東海テレビ,裁判中泣き出す場面も…“頂き女子りりちゃん”に懲役13年・罰金1200万円を求刑「心情につけこみ卑劣」,https://news.yahoo.co.jp/articles/de6072df545bbac1bc7d0beb2fcb6a4b0d38e8b0,3/15(金) 21:14
2024-03-20,14:18,domestic,国内,28,Yahoo!ニュース オリジナル 特集,ゲイと公表した後も怖かった――與真司郎が得た「自分らしく生きる」実感 #性のギモン,https://news.yahoo.co.jp/articles/ed5e3b0ddf39c13eb64fd553a99650688d88e6d5,3/19(火) 18:04
2024-03-20,14:18,domestic,国内,29,毎日新聞,サッカー観戦行かないで　外務省、北朝鮮への渡航自粛改めて要請,https://news.yahoo.co.jp/articles/2a774afa409ed6d99d97a1c7ee5a7b348904c793,3/19(火) 14:30
2024-03-20,14:18,domestic,国内,30,TBS NEWS DIG Powered by JNN,強い寒気流入で「雪」の範囲広がる見込み　関東地方は落雷や突風に注意【20日の天気】,https://news.yahoo.co.jp/articles/45ad8f66ddecf4619893fac6166d5cc928fa93b6,3/20(水) 12:48
2024-03-20,14:18,domestic,国内,31,FNNプライムオンライン,愛子さま学習院大学卒業　コロナ禍乗り越えて学習に公務に励まれた4年間　成長の軌跡,https://news.yahoo.co.jp/articles/9aa10f4faf7351de6b1c184894b5f1114d465aff,3/20(水) 9:32
2024-03-20,14:18,domestic,国内,32,朝日新聞デジタル,たばこをゴミ箱に捨てたら…駅が全焼、重過失失火容疑で男を書類送検,https://news.yahoo.co.jp/articles/c422b8311abdf6bd000bab80e69d238067137f4d,3/19(火) 17:36
2024-03-20,14:18,domestic,国内,33,読売テレビ,【まもなく開幕】大谷選手と妻・真美子さん、幸せの秘訣は「ハッピーワイフ・ハッピーライフ」？もしメジャーリーガーと結婚したら…“憧れの生活”の裏側を元MLB妻が独自解説,https://news.yahoo.co.jp/articles/1c62b3efe35cdc1533f296f535c34072fb152bfd,3/20(水) 12:30
2024-03-20,14:18,domestic,国内,34,日テレNEWS NNN,東北新幹線“オーバーラン”ポイントを制限速度の倍近いスピードで通過　JR東日本が明らかに,https://news.yahoo.co.jp/articles/f51e37e79986dee831f786610129af41c9bbb537,3/19(火) 18:47
2024-03-20,14:18,domestic,国内,35,スポーツ報知,若狭勝氏「めざまし８」で「裏金事件」自民党現職議員の処分を解説「銀座３兄弟が離党勧告…今回は離党勧告さえも誰もしないとなると相当軽すぎる」,https://news.yahoo.co.jp/articles/2f65d09f249ca8828819d719b33a97a27c8684fb,3/20(水) 9:39
2024-03-20,14:18,domestic,国内,36,読売新聞オンライン,博多女子中の出願ミス「生徒には非がない」…高校受験できなかった3人に特例で受験機会,https://news.yahoo.co.jp/articles/2228795883ad5481d54fd01b7c77e8bcbdcae9c7,3/20(水) 11:21
2024-03-20,14:18,domestic,国内,37,テレビ朝日系（ANN）,ぼったくり店に違法契約でクレカ決済端末機を設置　「全東信」を書類送検　警視庁,https://news.yahoo.co.jp/articles/fe26def0653a031e926f9933aa009337c55ea821,3/13(水) 14:51
2024-03-20,14:18,domestic,国内,38,共同通信,有機フッ素、夏に除去指針　各地で検出、健康影響懸念,https://news.yahoo.co.jp/articles/13ab4ae875bedc7042ae8683671343a196ebd2fa,3/16(土) 21:01
2024-03-20,14:18,domestic,国内,39,tenki.jp,寒の戻りは22日まで　週末からは暖かく　沖縄は夏日も　西・東日本は桜の季節へ,https://news.yahoo.co.jp/articles/fa689f42c05be9202d8ef354041cff6d8a3e34c0,3/20(水) 12:36
2024-03-20,14:18,domestic,国内,40,共同通信,「拘置所医療の問題認めて」遺族　大川原化工機元顧問の拘留中死亡,https://news.yahoo.co.jp/articles/b0c855b000d90b5d898c80683a1c33789f71b83f,3/18(月) 20:52
