scrp_date,scrp_time,genre_en,genre_jp,rank,media_jp,title,link,date_original
2025-03-20,03:09,sports,スポーツ,1,J-CASTニュース,山本由伸、開幕戦で「首元」の心配相次ぐ　「見ててびっくり」「ひどくない？どした」,https://news.yahoo.co.jp/articles/6e3df5dde87c99a5e43a5ab0241d8bd97bd0d843,3/19(水) 19:04
2025-03-20,03:09,sports,スポーツ,2,スポニチアネックス,大谷今季1号“お宝”ボールは小学生がゲット「家宝にします」　グラウンドに戻るもPCAが客席に投げ返す,https://news.yahoo.co.jp/articles/fa9002832ca3a8b2a4287b925dfe113ae8632f66,3/19(水) 21:21
2025-03-20,03:09,sports,スポーツ,3,中日スポーツ,自費で帯同のドジャース・カーショー、「大谷翔平を本当の意味で理解した」… 日本ファンの大谷愛に「大きな期待を背負ってすごいことをする」,https://news.yahoo.co.jp/articles/3697f765703af79fe32208fb46ad29fbaf74f74f,3/19(水) 23:30
2025-03-20,03:09,sports,スポーツ,4,TBS NEWS DIG Powered by JNN,佐々木朗希、デビュー戦は3回56球1失点で降板　3連続四球で初失点も2者連続Kで雄叫び、鈴木誠也からメジャー初三振,https://news.yahoo.co.jp/articles/d9c7f1d4d081d09b0efe02365a63205d91cee5b3,3/19(水) 20:10
2025-03-20,03:09,sports,スポーツ,5,日刊スポーツ,大谷翔平ら両チーム選手はすぐに「帰宅モード」米国移動へ、ベンチ前にトラック並び、荷物搬出作業,https://news.yahoo.co.jp/articles/84db1dea6893683c6e2f30528874bed245d5ed9e,3/19(水) 23:27
2025-03-20,03:09,sports,スポーツ,6,デイリースポーツ,大谷翔平　プロ最速８打席目の凱旋弾「本当にいい思い出になりました」お立ち台に大歓声　日本開幕Ｓに連勝「またいつか試合ができればうれしい」,https://news.yahoo.co.jp/articles/e7bf5241c7f6af33b6502f49239357b66a46f36a,3/19(水) 22:02
2025-03-20,03:09,sports,スポーツ,7,スポーツ報知,大谷翔平のホームラン球は１０歳の少年がゲット「家宝として大事にします」,https://news.yahoo.co.jp/articles/6a9bd5519c567168f3ba89a6ac1c525131259b43,3/19(水) 21:45
2025-03-20,03:09,sports,スポーツ,8,スポニチアネックス,大谷翔平と鈴木誠也が試合後に“イチャイチャ”　ネット「仲いいなー」　ロバーツ監督とハグも,https://news.yahoo.co.jp/articles/0f932c73ebdabb8fcf5c19d194e974d037885ce1,3/19(水) 22:29
2025-03-20,03:09,sports,スポーツ,9,Full-Count,大谷の1号が手に当たり落下　男性の名前は偶然「オオタニ」…少年ゲットに安堵「よかった」,https://news.yahoo.co.jp/articles/143aa1d2ee181938fc4d5c1dcdd8c12060d7eed2,3/19(水) 21:35
2025-03-20,03:09,sports,スポーツ,10,中日スポーツ,大谷翔平、あわや幻のホームランに「世界からブーイング」「真の野球ファンではない」「ホームランになったんだし…」とネットさまざまな意見,https://news.yahoo.co.jp/articles/ffb8778427e0387ca45d6b0d41d925e7b326b7a3,3/19(水) 21:20
2025-03-20,03:09,sports,スポーツ,11,Full-Count,佐々木朗希は「レベルが違う」　平均160キロの“暴力”に騒然「鳥肌立った」,https://news.yahoo.co.jp/articles/4e274e9e1347a266baf00b34286f900a74ed0350,3/19(水) 19:30
2025-03-20,03:09,sports,スポーツ,12,東スポWEB,大谷翔平ビデオ判定アーチが物議　本場カブスファンは大荒れ「操作されている」＝米報道,https://news.yahoo.co.jp/articles/582486c036553bb6d0e735ce8721b5d4d58685a2,3/20(木) 1:17
2025-03-20,03:09,sports,スポーツ,13,スポニチアネックス,【カーリング】日本が5敗目　スコットランドに痛恨逆転負け　1次L突破＆五輪切符へ崖っぷち,https://news.yahoo.co.jp/articles/026f7654644293c025dd196be8f9e14060958916,3/19(水) 21:48
2025-03-20,03:09,sports,スポーツ,14,中日スポーツ,ドジャース・佐々木朗希、3イニング交代に黒田博樹さん「彼は1年目のスプリングトレーニングの途中」と球団幹部の話紹介,https://news.yahoo.co.jp/articles/fb069b930fa22176efa00d419a251024bd04dc08,3/19(水) 21:26
2025-03-20,03:09,sports,スポーツ,15,スポーツ報知,ドジャースの開幕２戦目勝利投手＆この日メジャー登録投手ら３人が帰国前にマイナー降格の非情通告,https://news.yahoo.co.jp/articles/fafe33ac280de38c0ba8e02ad383b4f145daa331,3/20(木) 1:32
2025-03-20,03:09,sports,スポーツ,16,デイリースポーツ,大谷翔平、鈴木誠也ら日本５選手で記念撮影　ロバーツ監督も飛び入り参加　帰り始めていたファンが慌てて客席へ戻る,https://news.yahoo.co.jp/articles/bedbfe6cafc3806cea04a2fad74b34f395df2b75,3/19(水) 22:15
2025-03-20,03:09,sports,スポーツ,17,デイリースポーツ,ドジャース　エドマンが大谷翔平に「１人だけビデオゲームをやっているよう」偽らざる心境明かす「一生懸命やってるのに１人だけ違う（笑）」,https://news.yahoo.co.jp/articles/d72b4cf29e74b43109b081f0bec8335910a715a4,3/19(水) 22:44
2025-03-20,03:09,sports,スポーツ,18,東スポWEB,５四球の佐々木朗希は３回降板　ロバーツ監督「ある意味簡単な決断だった」,https://news.yahoo.co.jp/articles/244c235b776f1548fee111e7ea5475adce05ffb3,3/19(水) 23:21
2025-03-20,03:09,sports,スポーツ,19,Full-Count,佐々木朗希、初陣で露呈した“課題”　LA記者は問題視「どんどん悪化している」,https://news.yahoo.co.jp/articles/de17e153a695dc0a4bf6048655333a141e16ab12,3/19(水) 20:11
2025-03-20,03:09,sports,スポーツ,20,スポーツ報知,ドジャース＆カブスは試合後即帰国へ　開幕したのに米国では再びオープン戦の変則日程,https://news.yahoo.co.jp/articles/21282b02e8f5aa05c0c2a36d5a9c2bb4ca80c397,3/20(木) 2:11
2025-03-20,03:09,sports,スポーツ,21,東スポWEB,大谷翔平が今季１号ソロ　フェンス際でファンが触れてビデオ判定,https://news.yahoo.co.jp/articles/a5820465ba410d2c26c809c06cf6f9483a6fa0bf,3/19(水) 20:51
2025-03-20,03:09,sports,スポーツ,22,日刊スポーツ,【中日】右膝負傷の福永裕基が開幕アウト「ボスラーおらんし福永おらんし」井上監督“ネガティブ”,https://news.yahoo.co.jp/articles/8848362acf0cd5e8daec660e9e3feb106bf80c9b,3/19(水) 21:56
2025-03-20,03:09,sports,スポーツ,23,東スポWEB,３回５四球降板の佐々木朗希に閉口する米メディアも「ストライク率４５％では」,https://news.yahoo.co.jp/articles/9fb1389017a47b73b8a349f3e8d009f0c8b6bc56,3/19(水) 21:36
2025-03-20,03:09,sports,スポーツ,24,中日スポーツ,大谷翔平のリプレー検証本塁打にネット『山田哲人』が突如トレンド入り「やっちゃあかん事分からんかね」と怒り混じりの声,https://news.yahoo.co.jp/articles/9d9d7fb6f32f914c382f460635a04ca4eabf30eb,3/19(水) 21:50
2025-03-20,03:09,sports,スポーツ,25,デイリースポーツ,究極の打撃技術が詰まった大谷翔平の一発　こんなにすごい打者は今後ＭＬＢでも現れないのでは　谷佳知氏が絶賛,https://news.yahoo.co.jp/articles/96d59d8c19ddcb7946609ed9b9f30bd90c064563,3/20(木) 2:00
2025-03-20,03:09,sports,スポーツ,26,デイリースポーツ,東京ドームのグラウンドにオシャレ名球会戦士と人気女子アナ　仲良く並んでカブスの練習をチェック　阪神時代に縁,https://news.yahoo.co.jp/articles/a46d9f32db09af83503f78d56229e722ed3d0db9,3/19(水) 16:01
2025-03-20,03:09,sports,スポーツ,27,東スポWEB,大谷翔平の今季１号に米誌が〝疑惑の目〟「ファンがいなければフェンスを越えられなかったかも」,https://news.yahoo.co.jp/articles/371d4a3c506e26b48d637f4ff416a5caab891283,3/19(水) 21:32
2025-03-20,03:09,sports,スポーツ,28,デイリースポーツ,カ軍＆ド軍両監督が球数問題持論語る　カウンセル監督「１００％で１３０球はリミットオーバー」ロバーツ監督「出力のレベル違う」,https://news.yahoo.co.jp/articles/d4a503438f3095f007512ab9eeef9250fcb5d1bc,3/20(木) 2:00
2025-03-20,03:09,sports,スポーツ,29,日刊スポーツ,ロバーツ監督、会見の最後に「感謝の気持ちがもういっぱい」日本のファンへありがとう／一問一答,https://news.yahoo.co.jp/articles/e2490a62badef535993180202cf4a600d307a248,3/19(水) 23:20
2025-03-20,03:09,sports,スポーツ,30,サッカーマガジンWeb,【日本代表・バーレーン戦先発予想】2シャドーは南野と鎌田、ボランチは遠藤＆田中、3バックは昨年6月以来復帰の伊藤洋と板倉、瀬古で構成か？,https://news.yahoo.co.jp/articles/f8cdcf45d7995880c927e4309b22b61dbc4ebfcb,3/19(水) 19:06
2025-03-20,03:09,sports,スポーツ,31,ベースボールキング,吉田正尚が2試合連続で見せた油断…打撃は「絶好調」だがスタメンどころか開幕メジャーも絶望的？,https://news.yahoo.co.jp/articles/be8522a730eb2334d7b2af81bb952f914afdc244,3/19(水) 17:30
2025-03-20,03:09,sports,スポーツ,32,日刊スポーツ,大谷翔平が東京の思い出ショット公開「素晴らしい思い出をありがとうございました」感謝つづる,https://news.yahoo.co.jp/articles/905c6bb6fef2f08ee36f27e680819386750f4879,3/19(水) 23:55
2025-03-20,03:09,sports,スポーツ,33,西スポWEB OTTO！,元いいとも青年隊の人気双子兄弟が〝甲子園球児の父〟に！息子のセンバツ開会式で感涙「堂々と入場...涙が止まりませんでした」,https://news.yahoo.co.jp/articles/b1fd577d7da36b7a9ddfb27e715d052e17cbc054,3/19(水) 22:30
2025-03-20,03:09,sports,スポーツ,34,CoCoKARAnext,「なんで手を伸ばすんだ？」あわや幻のアーチにXは騒然　“ファンの手”に当たるも…大谷翔平が今季1号,https://news.yahoo.co.jp/articles/2692c512a11c26bf737c7799fb69dcec889d2ba4,3/19(水) 21:12
2025-03-20,03:09,sports,スポーツ,35,デイリースポーツ,ドジャース奥さま会　東京Ｄ恒例の集合写真は第１戦後に　チームは試合後に空港直行で帰国　別行動の奥さまにも配慮,https://news.yahoo.co.jp/articles/7ade6e82f61f843a3e7826a4b30853cb7fb52dfc,3/19(水) 17:32
2025-03-20,03:09,sports,スポーツ,36,Full-Count,ド軍開幕戦にいた超VIP「来日されてるとは！」　日本人混乱「えええ！」,https://news.yahoo.co.jp/articles/867b807e92413626c1a1b6580bf2cda25099fbac,3/19(水) 16:47
2025-03-20,03:09,sports,スポーツ,37,デイリースポーツ,ロバーツ監督が異例の行動　会見終了後に自らマイクを握り「東京の皆様に本当に感謝したい」壇上で頭を下げる,https://news.yahoo.co.jp/articles/04f10af79ee5d9a956184f593bbf2d70e88a7a1b,3/19(水) 22:31
2025-03-20,03:09,sports,スポーツ,38,J-CASTニュース,ブレイキングダウン「出禁」ノッコン寺田　数千万円の借金抱え「誰も助けてくれない」「嘘つき呼ばわり」愚痴止まらず,https://news.yahoo.co.jp/articles/3314459d065563129aa4e013fdccc0c7e9a3cc11,3/19(水) 16:30
2025-03-20,03:09,sports,スポーツ,39,東スポWEB,ドジャースの〝日本独占〟にマリナーズ嘆く「イチローがいたのに…もう日本人は来ない」,https://news.yahoo.co.jp/articles/9bd0811bd36f044599f1a363a1d7115556c94017,3/19(水) 13:36
2025-03-20,03:09,sports,スポーツ,40,イーファイト,猛連打に立ったまま失神！”KO率91％”Sフライ級に無敗の新星＝英国ボクシング,https://news.yahoo.co.jp/articles/6e3d42e2ff7470772cde1c7acfb5287c8bb21203,3/19(水) 23:00
