scrp_date,scrp_time,genre_en,genre_jp,rank,media_jp,title,link,date_original
2023-12-23,23:14,TTL,総合,1,スポーツ報知,ＳＰＥＥＤ島袋寛子が“激変”「若返ってる」近影に衝撃「１７歳」「幼く見えます」「まじ可愛すぎ」,https://news.yahoo.co.jp/articles/2bdc08e61d979afa439f510ca6dfa91f870cab90,12/23(土) 16:35
2023-12-23,23:14,TTL,総合,2,スポーツ報知,水上恒司　自分が大物女優の“息子”であることに納得「似てるって自覚した時期があって」,https://news.yahoo.co.jp/articles/14bd45cdd2e89ada94da1c61ec708779b190a25b,12/23(土) 16:00
2023-12-23,23:14,TTL,総合,3,スポーツ報知,衝撃Ｍａｔｔの金銭感覚「ディズニー行くからお金ちょうだい」でもらえる金額にスタジオ仰天「使い切れない」,https://news.yahoo.co.jp/articles/a23819d4d90801341179547975795f1ffcd4592f,12/23(土) 14:35
2023-12-23,23:14,TTL,総合,4,スポニチアネックス,山田孝之　大親友だという芸歴22年のお笑い芸人を明かす「よく飲んだりしてた」も「本当に何も起きない」,https://news.yahoo.co.jp/articles/88b29a3d5a696123ff246664e51170477b606e60,12/23(土) 18:21
2023-12-23,23:14,TTL,総合,5,ねとらぼ,吉瀬美智子、人気芸人との“結婚報告”に反響「ま、まさか」　話題の親密オフショットがそのままドラマに「伏線回収致しました！」,https://news.yahoo.co.jp/articles/685ec5d3dcc5be8bbe61fdeeec226913bbac6061,12/23(土) 12:26
2023-12-23,23:14,TTL,総合,6,TBS NEWS DIG Powered by JNN,宇野昌磨が激戦制し2連覇！羽生＆本田に並ぶ歴代2位の6度目V、鍵山がフリートップの演技で2位【全日本フィギュア】,https://news.yahoo.co.jp/articles/0c95bb718912589106b152f0263bfc0ed078d9c3,12/23(土) 20:53
2023-12-23,23:14,TTL,総合,7,西スポWEB OTTO！,バスケ日本代表の偉大な兄の支えで復帰、精華女子「背番号18」が残り1秒で描いた奇跡「感謝でいっぱい」【ウインターカップ】,https://news.yahoo.co.jp/articles/52a098966b1409c3375122b83582d65557400cbf,12/23(土) 18:51
2023-12-23,23:14,TTL,総合,8,スポーツ報知,「久々に見た」剛力彩芽の姿が「別人」「雰囲気変わって誰かわからん」とネットざわつく「かなり印象違った」,https://news.yahoo.co.jp/articles/79953d1f08b778e73c82960473c32598d4d23edd,12/23(土) 11:25
2023-12-23,23:14,TTL,総合,9,GOAL,遠藤航、アーセナル戦もスタメンと現地メディア。評価高まりレギュラー確保,https://news.yahoo.co.jp/articles/2b283afc595381296bed5f1ad4c73fe747751cab,12/23(土) 17:02
2023-12-23,23:14,TTL,総合,10,中日スポーツ,ロッテ・吉井監督「競馬新聞風に言うと」来季開幕投手の本命、対抗、3番手候補をサプライズ発表,https://news.yahoo.co.jp/articles/300904666313903929fd4000d9a219d88af9b550,12/23(土) 19:04
2023-12-23,23:14,TTL,総合,11,日刊ゲンダイDIGITAL,北野武監督「首」大コケ？ 興収は製作費にも届かない見通し、意欲的な次回作に早くも“黄信号”,https://news.yahoo.co.jp/articles/07a39af77aed9a646ecc84469d671c0ba731fff5,12/23(土) 13:56
2023-12-23,23:14,TTL,総合,12,スポーツ報知,水上恒司　超仲良しの２９歳年上の大物芸能人　キャラ強烈で周囲に驚かれるも「あまり存じ上げなかった」,https://news.yahoo.co.jp/articles/4e6c48009edf2bc45de2566004f4bb11c89203bc,12/23(土) 17:00
2023-12-23,23:14,TTL,総合,13,デイリースポーツ,安藤美姫コーチからエール「１人じゃないよ」　教え子・田内誠悟が躍動　恩師は衣装とおそろい紫ストールで寄り添う,https://news.yahoo.co.jp/articles/134362d82c3488d85e06e8413c558b103456765b,12/23(土) 18:10
2023-12-23,23:14,TTL,総合,14,クックパッドニュース,これ知らなかった…！医師が教える「なぜか若く見える人」が食べているもの,https://news.yahoo.co.jp/articles/c4ae9fd0310d1d6d133a47c2f80f50b8650b928b,12/23(土) 21:01
2023-12-23,23:14,TTL,総合,15,＆GP,車両盗難被害の2位はプリウス、1位は…。最新の盗難手口に対抗するカーセキュリティ,https://news.yahoo.co.jp/articles/c4a246a7a26079b9c1245031696a1eb574d2c6b0,12/22(金) 19:01
2023-12-23,23:14,TTL,総合,16,J-CASTニュース,「ビッグモーターで購入しENEOSでオイル交換したダイハツ車」に乗る人は今、何を思う？　不祥事で話題...当事者明かした胸の内,https://news.yahoo.co.jp/articles/1e1130f0ce607bfb4249e53676d185b2558a2228,12/22(金) 20:47
2023-12-23,23:14,TTL,総合,17,夕刊フジ,安倍元首相「ただちに直せ」裏付ける報道続々　パー券疑惑　岩田明子氏リポートに〝かばっている〟批判も産経や朝日が補強報道,https://news.yahoo.co.jp/articles/0a42894915096e0bc314b190ac55e33167492320,12/23(土) 17:00
2023-12-23,23:14,TTL,総合,18,スポニチアネックス,小林美駒騎手と鈴木伸尋師に戒告処分　感染症に関する注意義務怠る,https://news.yahoo.co.jp/articles/2461dfeac3a59d43e9b5f6126870640b15b2682f,12/23(土) 17:40
2023-12-23,23:14,TTL,総合,19,時事通信,帝京大、明大が準決勝へ　京産大と天理大も4強―全国大学ラグビー,https://news.yahoo.co.jp/articles/1368ec7fb9ef2cb0fcf889aeed6456b4016f48bf,12/23(土) 17:05
2023-12-23,23:14,TTL,総合,20,中日スポーツ,本田真凜、28人中の最下位でフリー進出ならず…大学4年生、今後については「お答えできることは今の時点ではない」,https://news.yahoo.co.jp/articles/4c2b4e368ca0a8fe3c57c955fb4d889a425bfe85,12/22(金) 20:07
2023-12-23,23:14,TTL,総合,21,LIMO,【2000円札を売る方法と価値】2000円札が手に入ったので3000円で売ろうと思います。これって違法ですか？,https://news.yahoo.co.jp/articles/b2c53232fdcf4fafb7b3066979f7bbbd372575c3,12/23(土) 20:41
2023-12-23,23:14,TTL,総合,22,デイリースポーツ,ダウンタウン衝撃「ええっ！？」狂気芸人が６３７万円を「ガキ使」「ドキュメンタル」でドボン　ネタと思わせガチ出費,https://news.yahoo.co.jp/articles/d0f04406b467aff9cfe452ab83e7682c72700121,12/23(土) 21:48
2023-12-23,23:14,TTL,総合,23,毎日新聞,注目選手の起用は　全国高校駅伝、男女のオーダー発表,https://news.yahoo.co.jp/articles/22c1a054f5506df2d12c7615f303b104dc68956b,12/23(土) 14:48
2023-12-23,23:14,TTL,総合,24,スポーツ報知,えっ高岡早紀！？エレベーターで女優オーラ消した姿が別人すぎ「めっちゃ疲れた顔してる」「お疲れですね…」,https://news.yahoo.co.jp/articles/83805e097cea1766994f795c02442a1b2692de8a,12/23(土) 13:10
2023-12-23,23:14,TTL,総合,25,マグミクス,「イカれてる」「本当にゲーム？」ファミコン世代を震撼させた「伝説の怪作ソフト」とは,https://news.yahoo.co.jp/articles/733197504367ee32de7f302546c46938c7955991,12/23(土) 21:50
2023-12-23,23:14,TTL,総合,26,スポーツ報知,「銭湯は立ち入り禁止」ロッチ中岡、“巨大タトゥー”にネット騒然「アウトレイジ」「すごいリアル」,https://news.yahoo.co.jp/articles/6e7a6642195d07d6e1e97c0185981f14d7b61a07,12/22(金) 17:52
2023-12-23,23:14,TTL,総合,27,スポニチアネックス,キングオブコント王者・鈴木もぐら、最新月給ポロリ　視聴者ドン引き「それだけもらってるのに借金って…」,https://news.yahoo.co.jp/articles/6e0e7fdcc7dd5f05ff8f58f33b38b0cae47be785,12/23(土) 16:52
2023-12-23,23:14,TTL,総合,28,オリコン,見取り図、和牛“電撃解散劇”の内幕に憤り「こんな悲しい結末ありますか」　川西「現代の風潮みたいなものが…」,https://news.yahoo.co.jp/articles/d2723e837e3721c531a21736f3f9ad8fbc93f3e8,12/23(土) 18:21
2023-12-23,23:14,TTL,総合,29,スポニチアネックス,衛藤美彩　第2子女児出産を報告　2度の切迫流産乗り越え…夫の西武・源田も立ち合い「感謝の気持ち」,https://news.yahoo.co.jp/articles/a968f08277a5151e8de8713df6f244199fd6c91e,12/23(土) 20:56
2023-12-23,23:14,TTL,総合,30,ELLEgirl,整形疑惑のアドリアナ・リマ、写真を見て「自分でもショック」と告白「まるで別人」ファンからはいまだに困惑の声も,https://news.yahoo.co.jp/articles/d427243c1b109ef08b42ffcdaf8c07258050784c,12/23(土) 20:31
2023-12-23,23:14,TTL,総合,31,読売新聞オンライン,スーパー駐車場で女児はねられ死亡した事故、車は知人名義・車検切れ・自賠責保険なし,https://news.yahoo.co.jp/articles/7a230eaf99c60835a3a04e95326cdb27cf2bc2fe,12/23(土) 16:39
2023-12-23,23:14,TTL,総合,32,BuzzFeed Japan,中条あやみ、突然の“ご報告”「これからも見守ってね」→「6年間お疲れ様でした」「ずっと応援してます」ねぎらいのコメント集まる,https://news.yahoo.co.jp/articles/4fafe166939594a6dcd9fafd06c72314c030d993,12/22(金) 19:05
2023-12-23,23:14,TTL,総合,33,Full-Count,由伸“争奪戦”に敗れたヤ軍に激怒「受け入れ難い」　惜しんだ35億円…NYメディア酷評,https://news.yahoo.co.jp/articles/cbae063c994c087bb897a6528dde87a25de82a10,12/23(土) 19:41
2023-12-23,23:14,TTL,総合,34,ほ・とせなNEWS,電車で泣き出してしまった生後3ヶ月の娘　すると近づいてきた女性の言動に「肩の力が抜けた気がしました」,https://news.yahoo.co.jp/articles/ebb9a9c4cd14ba6c82f3b9b44eea6a3046422826,12/23(土) 11:30
2023-12-23,23:14,TTL,総合,35,日刊ゲンダイDIGITAL,石田純一は自身の「焼き肉店」で終電まで働いて…人気減で周囲から人が消えた現在地（城下尊之）,https://news.yahoo.co.jp/articles/798d2035c4c78b886e775fc3df7ca497011b14e2,12/23(土) 9:06
2023-12-23,23:14,TTL,総合,36,デイリースポーツ,浜田雅功が愕然「ごぶごぶ」次回ゲストが衝撃大物　浜田困惑「ううううう…」と泣き声「来ます！？」,https://news.yahoo.co.jp/articles/c211bc766a443ab60ca28040fa08751355bca850,12/23(土) 15:51
2023-12-23,23:14,TTL,総合,37,ねとらぼ,寒い日にチョコドーナツを購入→ひと口かじったら……　“衝撃の光景”にどこか哀愁を感じる,https://news.yahoo.co.jp/articles/7deb68f3938147f0320afec6fda7b4bda6793eb1,12/23(土) 20:30
2023-12-23,23:14,TTL,総合,38,読売新聞オンライン,歩道橋の欄干越えた少女、散歩中の８０歳男性がとっさに抱きかかえ救助…少女は言葉なく涙,https://news.yahoo.co.jp/articles/c6f715503f27aa4a0b24494e318fe8639e89cf4b,12/23(土) 7:10
2023-12-23,23:14,TTL,総合,39,ENCOUNT,赤井沙希、父・赤井英和との思い出は「ほとんどない」　強烈過ぎる元レディース総長だった母の教え,https://news.yahoo.co.jp/articles/3d6c34e949200b4952e217a4a2f108120ed5412c,12/23(土) 19:10
2023-12-23,23:14,TTL,総合,40,モデルプレス,佐藤健、綾瀬はるかから「今までやってきた中で一番似てる」と言われた役明かす,https://news.yahoo.co.jp/articles/1f48a1d561d202a9eec3da49555cdaa1b5e9510b,12/23(土) 20:57
