scrp_date,scrp_time,genre_en,genre_jp,rank,media_jp,title,link,date_original
2024-08-13,19:06,TTL,総合,1,デイリースポーツ,元局アナたちが「漸く」読み方まさかの全滅　林先生も絶句「こんなことあるの？」,https://news.yahoo.co.jp/articles/1489d7d74faf8c09063cdd76e106ba79cd767057,8/13(火) 14:22
2024-08-13,19:06,TTL,総合,2,デイリースポーツ,智弁和歌山ナインが慟哭　控え室で泣き叫ぶ選手、立ち上がれない選手　中谷監督「僕のせいです」「僕に問題がある」,https://news.yahoo.co.jp/articles/cb8aad867675e79d49bc82d45d65bd97076805b5,8/13(火) 17:23
2024-08-13,19:06,TTL,総合,3,日刊スポーツ,宮迫博之「牛宮城に関するお知らせがあります」プロデュース焼き肉店について投稿　開店から２年,https://news.yahoo.co.jp/articles/301ba17c33a102e200a13be4f5459d4ad698b1cd,8/13(火) 14:22
2024-08-13,19:06,TTL,総合,4,デイリースポーツ,やり投げ金の北口榛花　拠点チェコ凱旋で２００人が熱烈歓迎　花束とビール贈呈「ビールを飲み始めたのはチェコにきてから」,https://news.yahoo.co.jp/articles/64b2e6775aa50cccb51de881f9695a0329ac698e,8/13(火) 15:21
2024-08-13,19:06,TTL,総合,5,ハフポスト日本版,インドで研修医がレイプされ死亡。事件に抗議し、医師らがストライキ,https://news.yahoo.co.jp/articles/403016b1a5a6dc7a059d4cf2aafe56c9a4efa6a3,8/13(火) 17:01
2024-08-13,19:06,TTL,総合,6,ENCOUNT,宮迫博之、「牛宮城に関するお知らせ」を告知　閉店、値上げ、2号店…SNSで臆測飛び交う,https://news.yahoo.co.jp/articles/d7d68c75e6420e50d606e9c42ffea2c0cb818846,8/13(火) 16:32
2024-08-13,19:06,TTL,総合,7,東スポWEB,クライミング森秋彩　身長届かず０点問題を論客が糾弾「これがフランスのやり方」,https://news.yahoo.co.jp/articles/abd0d7fea03974608cf683c1778246db243f6e31,8/13(火) 18:02
2024-08-13,19:06,TTL,総合,8,LIMO,【厚生年金】8月15日の年金支給日に「30万円（月額15万円）」が振り込まれる人の現役時代の年収はいくら？,https://news.yahoo.co.jp/articles/9280c35b453571efbfcd7b9748b7d7f321c386b7,8/13(火) 4:52
2024-08-13,19:06,TTL,総合,9,スポーツ報知,【海のはじまり】「無神経すぎる」と非難殺到　ネットどん引き「よく言えるね？」「傷つきます」,https://news.yahoo.co.jp/articles/78f95e222824625a790abcbc1e9cd4b4bd57614b,8/13(火) 12:20
2024-08-13,19:06,TTL,総合,10,スポニチアネックス,【1人賛否】粗品　芸能界の“闇”に触れる「みんなが崇めてる人、ホンマはめっちゃヤバいで」,https://news.yahoo.co.jp/articles/24169db59b1d2d7a54c63ab6ddea5a40d3595e22,8/13(火) 16:35
2024-08-13,19:06,TTL,総合,11,日刊スポーツ,【甲子園】霞ケ浦がタイブレーク制し初勝利　智弁和歌山、８回２者連続弾で同点も初戦敗退,https://news.yahoo.co.jp/articles/aed1157991fa1da98ac8eda4066ba763ac1c35b8,8/13(火) 16:48
2024-08-13,19:06,TTL,総合,12,UTYテレビ山梨,シャトレーゼの創業者　会長の齊藤寛さんが死去　90歳,https://news.yahoo.co.jp/articles/56ac98694b0b3cd731e6e6cf82ab01f1c26925bc,8/13(火) 15:59
2024-08-13,19:06,TTL,総合,13,デイリースポーツ,やり投げ金・北口榛花　超難関校出身だった！「東大にも合格する北海道屈指の進学校」同郷の木下博勝医師が証言,https://news.yahoo.co.jp/articles/5524ab17e9423b4d9c7fba3db3d98e46ef5d085a,8/13(火) 18:12
2024-08-13,19:06,TTL,総合,14,ファイナンシャルフィールド,近所の車が「アウディ」から「レクサス」のように頻繁に変わります。なにか特別なサービスを利用しているのでしょうか？,https://news.yahoo.co.jp/articles/8f11f84e928657df64d90138b95e0ee5d0596545,8/13(火) 15:50
2024-08-13,19:06,TTL,総合,15,TBS NEWS DIG Powered by JNN,「コバエが、料理に一瞬だけ止まってしまった!」その料理、衛生的に大丈夫?専門家に聞いた,https://news.yahoo.co.jp/articles/e184c1b3a2f0b5f385aef0b44e4d4207a3d0dc6b,8/12(月) 7:02
2024-08-13,19:06,TTL,総合,16,ねとらぼ,「男性の体臭苦手」投稿で契約解除の女子アナ、ネットでは舌鋒鋭い擁護の声も「当たり前の事言っただけなのに」「お前らマジでくさいで」,https://news.yahoo.co.jp/articles/e553543ef3cde33997e1fe30a5c2f216f1e79609,8/13(火) 15:10
2024-08-13,19:06,TTL,総合,17,スポニチアネックス,日本水連のアンテナの低さ　把握したのは開幕直前、現地入り後…競泳、ASの無策さには課題が,https://news.yahoo.co.jp/articles/00f3b238ccbc33aa30d08a79aabd44340484ff36,8/13(火) 5:00
2024-08-13,19:06,TTL,総合,18,ABEMA TIMES,“生卵投げつけ女”による4年間毎日続いた嫌がらせ「1日2パック」「原因わからず」被害女性が語る苦悩の日々,https://news.yahoo.co.jp/articles/8cf29b182f6eda4783adf1447fd0feed9d16f093,8/13(火) 6:50
2024-08-13,19:06,TTL,総合,19,東スポWEB,ブレイキンの五輪競技復帰は今後も無しと米紙報道「追加したのはバッハ会長とその取り巻き」,https://news.yahoo.co.jp/articles/7f6a4b7bab06f7b2617a1039d2e886bd2a00dab9,8/13(火) 14:36
2024-08-13,19:06,TTL,総合,20,スポニチアネックス,やり投げ・北口の表彰式　プレゼンターが話題「どこの国の綺麗なお姉さまかと」「誰かと思ったら」,https://news.yahoo.co.jp/articles/a9ec57802c98cb5142ac79e4671491462a4f9019,8/12(月) 18:12
2024-08-13,19:06,TTL,総合,21,東スポWEB,三崎優太氏　全てを失ったことを明かす「金もない、家もない、女もいない。何もない」,https://news.yahoo.co.jp/articles/10b3e723b44ecdfff47e53b0b5530062e9cf9a67,8/13(火) 16:21
2024-08-13,19:06,TTL,総合,22,マイナビニュース,島田珠代、おのろけ全開　恋人・ひろしとの結婚を娘も応援「殿方はいたほうがいい」,https://news.yahoo.co.jp/articles/127191820c042782071d87ade10cb1759db4abe3,8/13(火) 10:00
2024-08-13,19:06,TTL,総合,23,マイナビニュース,『海のはじまり』海(泉谷星奈)の“そっくり”保育園時代は実妹だった　今後も登場予定,https://news.yahoo.co.jp/articles/cebcf456728e71b0d612aa9c05dc0b9500121d21,8/13(火) 17:00
2024-08-13,19:06,TTL,総合,24,日刊スポーツ,体臭投稿で炎上　女性アナのパートナーが虚偽投稿や誹謗中傷に警鐘「命を落とすようなことが…」,https://news.yahoo.co.jp/articles/94de54236fb72ae2bb1c753fb5c9fdce3d90cc98,8/13(火) 13:04
2024-08-13,19:06,TTL,総合,25,スポニチアネックス,女子課題が「不公平」と議論のスポクラ　男子金・英国選手が森秋彩を「レジェンド」と称賛　ネット感涙,https://news.yahoo.co.jp/articles/761cda405475a5d01ea08cb9f0425d96bdadb4c3,8/13(火) 11:35
2024-08-13,19:06,TTL,総合,26,J-CASTニュース,美容外科医「エルメスやヴィトン買うのやめようかな」　パリ五輪「自国を勝たせる」フランスに不満あらわ,https://news.yahoo.co.jp/articles/2e9e2b9f0f17e59853f596cf19cf06040649addd,8/13(火) 16:15
2024-08-13,19:06,TTL,総合,27,スポニチアネックス,【甲子園】霞ケ浦　異色・前バレー部監督が甲子園初勝利！　智弁和歌山撃破「本当に勝っちゃった…」,https://news.yahoo.co.jp/articles/b58511831c3189682dd70dfa05dc5fb9ad156289,8/13(火) 16:48
2024-08-13,19:06,TTL,総合,28,日刊スポーツ,粗品「活動休止妥当や」フワちゃんが唯一敬語を使う歌手も実名暴露「人選んどんねん、あいつ！」,https://news.yahoo.co.jp/articles/6f4cdf3eb5286ede2c89bd3d634268038c35067c,8/13(火) 5:30
2024-08-13,19:06,TTL,総合,29,CoCoKARAnext,悔やまれる河村勇輝の4点献上プレー　”世紀の大誤審”に「レフリーがフランスを救った」と批判殺到　仏選手は「感謝」【パリ五輪事件簿】,https://news.yahoo.co.jp/articles/6173e832525aa30f00718fe05bb68b7a25b1da59,8/13(火) 16:30
2024-08-13,19:06,TTL,総合,30,弁護士ドットコムニュース,男性の体臭めぐるSNS投稿で契約解消、フリーアナは謝罪も…いきすぎた批判がもたらす「息苦しい社会」,https://news.yahoo.co.jp/articles/b91a5eadde2c9d7202e3e72a25650ab8cf9cbfcc,8/13(火) 14:16
2024-08-13,19:06,TTL,総合,31,毎日新聞,霞ケ浦の負傷者を救護、智弁和歌山の選手らに拍手　夏の甲子園,https://news.yahoo.co.jp/articles/805f0a4634f5c07f639496756167c45a8ab52b86,8/13(火) 16:36
2024-08-13,19:06,TTL,総合,32,デイリースポーツ,阪神　佐藤輝明がスタメン落ち　４番に森下　自力Ｖ消滅で岡田監督が動いた　佐藤輝は８月１１試合で６失策,https://news.yahoo.co.jp/articles/37c77290ca4214a1be392ef2b494bb65ac0e1372,8/13(火) 17:13
2024-08-13,19:06,TTL,総合,33,東スポWEB,体操団体の萱和磨＆橋本大輝　金メダルを雑に扱い注意される「もっと大切に扱いな」,https://news.yahoo.co.jp/articles/dd820dbad08a08e26e40cf8f53aa72a7e8a3fa1c,8/13(火) 15:56
2024-08-13,19:06,TTL,総合,34,ＢＳＮ新潟放送,関東甲信では14日夜遅くにかけて“バケツをひっくり返したような“激しい雷雨の恐れ　さらに16日にも台風7号が直撃か【18日（日）まで・3時間ごとの雨と風のシミュレーション】,https://news.yahoo.co.jp/articles/289f3fc6fce9c42b8d654846e556bb517677038c,8/13(火) 16:19
2024-08-13,19:06,TTL,総合,35,ENCOUNT,「これで完全にブレイク」“シダマツ”志田千陽、試合中のリアクションに視聴者「可愛すぎだろ」,https://news.yahoo.co.jp/articles/c9793084e36c56acb5b45d9b38b9c6448e8fba86,8/13(火) 10:02
2024-08-13,19:06,TTL,総合,36,J-CASTニュース,パリ五輪・銅メダリストが手荷物検査ゲートを通過すると...　まさかの事態に「素晴らしい」「最高だよ」,https://news.yahoo.co.jp/articles/49f6a85e0fa0b3279e5521abb859dc08d092d038,8/13(火) 17:48
2024-08-13,19:06,TTL,総合,37,ENCOUNT,「NHKに映ってるのすごい」五輪閉会式放送に“ピー音”入らず視聴者ヒヤリ「わかってて放送してんのかな？」,https://news.yahoo.co.jp/articles/f9ab1c0c229042a62826879adcb7197b1528dfa8,8/13(火) 9:03
2024-08-13,19:06,TTL,総合,38,高校野球ドットコム,智弁和歌山が涙の初戦敗退！終盤に2者連発の執念見せるも延長タイブレーク11回に力尽きる【24年・夏甲子園】,https://news.yahoo.co.jp/articles/8a0d03b74b2d453aecf0c7ee4d88113184c954f6,8/13(火) 16:49
2024-08-13,19:06,TTL,総合,39,MBSニュース,【台風最新情報】台風8号発生「トリプル台風」に…台風7号は週末に関東地方へ直撃　強い勢力で東日本や北日本に接近か…お盆休み・Uターンへの影響は？,https://news.yahoo.co.jp/articles/80dd923e7808ec61b9922f9bf894186bac983f8c,8/13(火) 18:02
2024-08-13,19:06,TTL,総合,40,日刊スポーツ,ほんこん、女性アナの体臭投稿めぐる騒動に疑問「何人の名誉を毀損したんや？」,https://news.yahoo.co.jp/articles/6cd11d4b52940a2a3d157da3123ad1b575f329ea,8/13(火) 16:56
