scrp_date,scrp_time,genre_en,genre_jp,rank,media_jp,title,link,date_original
2024-08-13,17:07,sports,スポーツ,1,デイリースポーツ,やり投げ金の北口榛花　拠点チェコ凱旋で２００人が熱烈歓迎　花束とビール贈呈「ビールを飲み始めたのはチェコにきてから」,https://news.yahoo.co.jp/articles/64b2e6775aa50cccb51de881f9695a0329ac698e,8/13(火) 15:21
2024-08-13,17:07,sports,スポーツ,2,日刊スポーツ,【競泳】池江璃花子「１週間掃除が入らなくて…同じタオルを」賛否分かれたパリ選手村生活の実態,https://news.yahoo.co.jp/articles/4039fdb89b3b9679b255ec46883bbcfbbf2d1b8e,8/13(火) 15:33
2024-08-13,17:07,sports,スポーツ,3,東スポWEB,ブレイキンの五輪競技復帰は今後も無しと米紙報道「追加したのはバッハ会長とその取り巻き」,https://news.yahoo.co.jp/articles/7f6a4b7bab06f7b2617a1039d2e886bd2a00dab9,8/13(火) 14:36
2024-08-13,17:07,sports,スポーツ,4,スポニチアネックス,女子課題が「不公平」と議論のスポクラ　男子金・英国選手が森秋彩を「レジェンド」と称賛　ネット感涙,https://news.yahoo.co.jp/articles/761cda405475a5d01ea08cb9f0425d96bdadb4c3,8/13(火) 11:35
2024-08-13,17:07,sports,スポーツ,5,スポニチアネックス,やり投げ・北口の表彰式　プレゼンターが話題「どこの国の綺麗なお姉さまかと」「誰かと思ったら」,https://news.yahoo.co.jp/articles/a9ec57802c98cb5142ac79e4671491462a4f9019,8/12(月) 18:12
2024-08-13,17:07,sports,スポーツ,6,Full-Count,大谷翔平、復帰のベッツは「いるだけで脅威」　実感した存在の大きさ「厚みが全然違う」,https://news.yahoo.co.jp/articles/9af27c2400eded00364ea31810675821ff57aea6,8/13(火) 12:39
2024-08-13,17:07,sports,スポーツ,7,スポニチアネックス,【甲子園】智弁和歌山4番・花田　木製バットで起死回生の同点弾！豪快一発にアルプスも大興奮,https://news.yahoo.co.jp/articles/6ec075efc579d8af2af1cc9723b4318775059b41,8/13(火) 16:09
2024-08-13,17:07,sports,スポーツ,8,日刊スポーツ,復帰果たしたドジャース・ベッツがチームホテル宿泊を拒否　その意外な理由とは…,https://news.yahoo.co.jp/articles/c5f85bcd6b8569aff8f0f5e8126d19afb69a3487,8/13(火) 9:19
2024-08-13,17:07,sports,スポーツ,9,デイリースポーツ,智弁和歌山が２者連続本塁打で球場騒然　花田が木製バットで本塁打　新基準バット導入後、甲子園での１試合２発、１日２発は初,https://news.yahoo.co.jp/articles/d0ec5d355b34ab5ccfce254501b9ac8659df231d,8/13(火) 15:53
2024-08-13,17:07,sports,スポーツ,10,スポニチアネックス,日本水連のアンテナの低さ　把握したのは開幕直前、現地入り後…競泳、ASの無策さには課題が,https://news.yahoo.co.jp/articles/00f3b238ccbc33aa30d08a79aabd44340484ff36,8/13(火) 5:00
2024-08-13,17:07,sports,スポーツ,11,東スポWEB,ベッツ完全復活でドジャース・ロバーツ監督に新たな悩み「難しい会話だった」,https://news.yahoo.co.jp/articles/51dc0561514569d4f7bf089a3d2ad9400cc1e556,8/13(火) 12:51
2024-08-13,17:07,sports,スポーツ,12,Full-Count,大谷翔平「今季ゴールは決めてない」　“40-40”目前も「やることに集中」…一問一答,https://news.yahoo.co.jp/articles/a9ac4acc208ccfef44d0d5edf73c9e5789f21933,8/13(火) 12:43
2024-08-13,17:07,sports,スポーツ,13,スポーツ報知,【甲子園】「石橋高校推せる」「石橋何者、すごすぎる」県立進学校の奮闘にＳＮＳも沸く,https://news.yahoo.co.jp/articles/9ef0b9b28711acdb86ae2111ade0162889058dc0,8/13(火) 13:11
2024-08-13,17:07,sports,スポーツ,14,日テレNEWS NNN,【卓球】伊藤美誠が9月の国際大会にエントリー　五輪落選後に「いいところでやめたい」と語る,https://news.yahoo.co.jp/articles/c6c0b59be90513783c4e19bf392c6fb77fa5f146,8/13(火) 13:42
2024-08-13,17:07,sports,スポーツ,15,CoCoKARAnext,「ほんと馬鹿げているわ！」セーヌ川を泳いだベルギー女子選手の“珍対策”「ヤクルトを飲んだ」話題に【パリ五輪事件簿】,https://news.yahoo.co.jp/articles/f23a736f240f1bbe59550c75e09db9e5d756b4b9,8/13(火) 7:03
2024-08-13,17:07,sports,スポーツ,16,日刊スポーツ,【甲子園】霞ケ浦がタイブレーク制し初勝利　智弁和歌山、８回２者連続弾で同点も初戦敗退,https://news.yahoo.co.jp/articles/aed1157991fa1da98ac8eda4066ba763ac1c35b8,8/13(火) 16:48
2024-08-13,17:07,sports,スポーツ,17,デイリースポーツ,智弁和歌山　審判員が笑顔で足をつった選手に駆け寄る→担架運ばれるまで寄り添い「若くていい感じや」,https://news.yahoo.co.jp/articles/9c8acd8ea1d46038ea4e3df0712377545375f431,8/13(火) 16:23
2024-08-13,17:07,sports,スポーツ,18,東スポWEB,体操団体の萱和磨＆橋本大輝　金メダルを雑に扱い注意される「もっと大切に扱いな」,https://news.yahoo.co.jp/articles/dd820dbad08a08e26e40cf8f53aa72a7e8a3fa1c,8/13(火) 15:56
2024-08-13,17:07,sports,スポーツ,19,ゲキサカ,ジダンとフィーゴに“削られる”日本人に再脚光「すげえ構図」「二人がかりで止めようとしてる」,https://news.yahoo.co.jp/articles/927a90ce58c422f6750805fb07fce8e21b8ecef9,8/13(火) 12:22
2024-08-13,17:07,sports,スポーツ,20,デイリースポーツ,２者連続弾で追いついた智弁和歌山ベンチがグラウンド飛び出す　塩部長が鬼の形相で制圧,https://news.yahoo.co.jp/articles/a3961b811b79a21814241258c3ba72e008fd8c3c,8/13(火) 16:03
2024-08-13,17:07,sports,スポーツ,21,共同通信,競泳の大橋悠依が国スポで引退へ　東京五輪個人メドレー2冠,https://news.yahoo.co.jp/articles/49f3090dbce5c488d87da96e9ee63f09ee628456,8/13(火) 11:09
2024-08-13,17:07,sports,スポーツ,22,CoCoKARAnext,悔やまれる河村勇輝の4点献上プレー　”世紀の大誤審”に「レフリーがフランスを救った」と批判殺到　仏選手は「感謝」【パリ五輪事件簿】,https://news.yahoo.co.jp/articles/6173e832525aa30f00718fe05bb68b7a25b1da59,8/13(火) 16:30
2024-08-13,17:07,sports,スポーツ,23,RONSPO,「フランスが負けた腹いせ？」パリ五輪男子バスケ金メダル米国代表のNBAカリーの美人妻が現地観戦後に仏警察とのトラブルで涙,https://news.yahoo.co.jp/articles/77b944e28f4065d6835f06dbf4889e71213d738c,8/13(火) 7:10
2024-08-13,17:07,sports,スポーツ,24,Full-Count,アルプス埋めた応援団が「映えるよね」　初出場校が作った異例の光景「すっごく鮮やか」,https://news.yahoo.co.jp/articles/72735b7b645e328f6e769a9f5da8697eab70f6be,8/13(火) 13:25
2024-08-13,17:07,sports,スポーツ,25,Full-Count,「聞けて良かった」　甲子園に響いた“魔曲”…即トレンド入り「迫力あるなー」,https://news.yahoo.co.jp/articles/9ab4f13e8fc4554f15cb243527df1bd2ea1697ac,8/13(火) 15:42
2024-08-13,17:07,sports,スポーツ,26,日刊スポーツ,【甲子園】攻撃終了かと思いきや「故意落球」の宣告で「併殺」認められず続行　初出場対決で珍事,https://news.yahoo.co.jp/articles/9496d7bac0dc9dbf4a479c411a4db62f06c70697,8/13(火) 15:32
2024-08-13,17:07,sports,スポーツ,27,日刊スポーツ,総合格闘家・石井慧「予期せぬ病気と闘っている」２週間前に３回緊急手術報告,https://news.yahoo.co.jp/articles/84e410b2cae3cb25e94a39c753692d12ca072670,8/13(火) 14:07
2024-08-13,17:07,sports,スポーツ,28,イーファイト,高跳び金マフチフ、試合でバキバキ腹筋も私服とのギャップが話題,https://news.yahoo.co.jp/articles/db9332cc195e87e92a86f596198c0ea6b49a3800,8/13(火) 11:50
2024-08-13,17:07,sports,スポーツ,29,スポーツ報知,藤浪晋太郎「良い報告ではありませんが…」現在の心境を吐露　７月にメッツから事実上の戦力外通告,https://news.yahoo.co.jp/articles/f181bb8875212b493fb43170788d02d28c974cd1,8/13(火) 14:11
2024-08-13,17:07,sports,スポーツ,30,Full-Count,打率3割も…ド軍加入14日で“戦力外”　補強のはずが消えた居場所「起用できるとは思わない」,https://news.yahoo.co.jp/articles/5733d1c22d8ed8ee2b33ee3105b1e2047996838a,8/13(火) 11:35
2024-08-13,17:07,sports,スポーツ,31,スポーツ報知,【巨人】 郡拓也が１軍合流　捕手に加えて内外野でプレーできる超ユーティリティー,https://news.yahoo.co.jp/articles/0eb3ea26102f24ea5a01f1c14985c95c82b2d2aa,8/13(火) 13:54
2024-08-13,17:07,sports,スポーツ,32,ゴング格闘技,【UFC】朝倉海が急遽タイ合宿入り「直近で試合が決まるかも」「大きな勝負になる。絶対勝ってステップアップしたい。死ぬ気で1カ月間頑張る」,https://news.yahoo.co.jp/articles/680f4ba6ef7f8da9a84011cab5432412363cf122,8/13(火) 14:39
2024-08-13,17:07,sports,スポーツ,33,デイリースポーツ,聖和学園の捕手が監督の伝令を制止　七回１死満塁のピンチで３度目の守備のタイムを使わず,https://news.yahoo.co.jp/articles/f51be5bdd5f9ca485b2ef59bdbbc53022079f220,8/13(火) 12:51
2024-08-13,17:07,sports,スポーツ,34,CoCoKARAnext,決勝戦当日の計量にわずか100グラム超過で電撃引退　印レスリング選手が経験した過酷な減量方法「あやうく死ぬところだった」【パリ五輪事件簿】,https://news.yahoo.co.jp/articles/1090c1e5adfa190246c23f108d3fb287142ea008,8/13(火) 12:04
2024-08-13,17:07,sports,スポーツ,35,ゲキサカ,シーズン途中のキャプテン流出…群馬が異例の移籍劇について声明「オファーがあったと聞いたのは11日で、クラブとしても突然の出来事」,https://news.yahoo.co.jp/articles/b12fff8259c7782b8bd82f4fa8a024076159ade7,8/13(火) 13:18
2024-08-13,17:07,sports,スポーツ,36,サッカー批評Web,"「客少なっ」「浦和からの落差すご」カタール移籍のショルツが開幕スタメンも“ガラガラの観客席”が話題に!「悲しい、ガラガラ」「1,2年稼いで、帰っておいで!」の声",https://news.yahoo.co.jp/articles/8e3315aa7c2a7cb19fd3f9995cf1a8148026217d,8/13(火) 5:36
2024-08-13,17:07,sports,スポーツ,37,デイリースポーツ,智弁和歌山が初戦敗退　２１年夏Ｖ以降、春夏合わせて３大会連続で白星無しの呪縛　２者連発で延長戦に持ち込むも…,https://news.yahoo.co.jp/articles/69cf5389262ce2a41fd411f24e96aa60c228f4ca,8/13(火) 16:48
2024-08-13,17:07,sports,スポーツ,38,スポニチアネックス,元木大介氏　菅野が今季好調なのは「いなくなって肩の力がぬけたのかな」「智之には厳しく当たってた」,https://news.yahoo.co.jp/articles/1f0cbc7e9ca8ce282b96dae1adb873f3b76cb876,8/13(火) 16:14
2024-08-13,17:07,sports,スポーツ,39,デイリースポーツ,しゃく熱の甲子園　日中の試合で足つる選手が続出　兵庫県内は熱中症警戒アラート,https://news.yahoo.co.jp/articles/79ebbcbd0d9861b903ab3e98c31eaa5c9ccd62f1,8/13(火) 15:33
2024-08-13,17:07,sports,スポーツ,40,J SPORTS,【広島好き】新井監督の9連戦8先発の大胆起用で勝率5割以上確定　有言実行の全員野球で頂点へ,https://news.yahoo.co.jp/articles/9e651eace853e1892cac45c93303342b909a132b,8/13(火) 11:30
