scrp_date,scrp_time,genre_en,genre_jp,rank,media_jp,title,link,date_original
2026-01-20,11:48,sports,スポーツ,1,スポーティングニュース日本版,大谷翔平に続く『二刀流』へ一歩前進、19歳のプロスペクトは今シーズン投打でプレイ予定と米報道,https://news.yahoo.co.jp/articles/c9da09b61d0e56bfead01931f4402dec89ffeb6f,1/20(火) 6:00
2026-01-20,11:48,sports,スポーツ,2,デイリースポーツ,「テレビに映ってます」相撲客席の美女タレントに反響「綺麗！」前日の天覧相撲は着物姿で来場,https://news.yahoo.co.jp/articles/b7851a5bea7469c671b1f7548e55539fb40a242d,1/19(月) 21:11
2026-01-20,11:48,sports,スポーツ,3,スポーツ報知,菊池雄星「僕に会うためだけに来てくれました」大切な後輩とオフ会に「来年こそはＭＬＢで投げ合ってほしい」の声…美人妻・瑠美さんの姿も,https://news.yahoo.co.jp/articles/fbd5c4a076d54fd87d34b1d1ff27a328e843d5a6,1/20(火) 9:55
2026-01-20,11:48,sports,スポーツ,4,Full-Count,広島ドラ1が手にした高級車「マジか!?」　661万円超の輝き…歓喜の報告「人生初めて」,https://news.yahoo.co.jp/articles/e03a81dbe6a743c2859e1b98af200b771c6b2171,1/20(火) 10:40
2026-01-20,11:48,sports,スポーツ,5,RONSPO,「佐々木麟太郎はソフトバンクを経由せずにメジャーへ行くべきだ」球界重鎮がただ一人入団未定のドラフト1位の怪物スラッガーの進路に過激提言！,https://news.yahoo.co.jp/articles/2e08e1053fe7c88a4415dec1b806cd0fd9366c92,1/20(火) 7:00
2026-01-20,11:48,sports,スポーツ,6,ABEMA TIMES,一体、どうした？ 力士が後ずさって自ら土俵の外へ… 勝った力士も驚いた様子で二度見,https://news.yahoo.co.jp/articles/93707de107502e8a6fc1f569b48b14fe94bab28a,1/20(火) 10:30
2026-01-20,11:48,sports,スポーツ,7,ABEMA TIMES,大相撲に「貴族みたい」と“ただならぬ存在感”の着物姿の人物が鎮座 “推し力士”まさかの負け越しに「がっかり」な瞬間も,https://news.yahoo.co.jp/articles/84ba2fa78f8c5ce195d372ad99db8bc47935ee15,1/20(火) 7:57
2026-01-20,11:48,sports,スポーツ,8,Full-Count,ベッツ“最新情報”に「2度見した」　576億円契約の裏で…X仰天「そうなるかぁ」,https://news.yahoo.co.jp/articles/57c3ece4832fc0cff704e209deb8c567210fd2e9,1/20(火) 8:56
2026-01-20,11:48,sports,スポーツ,9,Full-Count,大谷翔平、判明した“本当の知名度”　米国人のジャッジより…海外出身選手で最高位,https://news.yahoo.co.jp/articles/b251a08917ead6d19f6233c1a4ecbc3d7ea55504,1/20(火) 7:32
2026-01-20,11:48,sports,スポーツ,10,GOAL,最新FIFAランキングが発表！ 日本は19位にダウン…W杯で対戦のオランダは7位、チュニジアは47位に,https://news.yahoo.co.jp/articles/811debc69bef096d1cac1a8f9dae8a3552ecb5d0,1/20(火) 6:00
2026-01-20,11:48,sports,スポーツ,11,東スポWEB,【大相撲】格下に連敗…大の里はなぜ強行出場を決断したのか　元大関が指摘する最強横綱の「誤算」,https://news.yahoo.co.jp/articles/fe8ef19ae9339b1e68f1becc9bebc4d815ca50dc,1/20(火) 6:15
2026-01-20,11:48,sports,スポーツ,12,ゴルフダイジェスト・オンライン（GDO）,石川遼が69で4打差暫定17位に浮上 大西魁斗は暫定26位／米男子下部,https://news.yahoo.co.jp/articles/18f4c7f86b8e56284b7961bdc9b81df934f5fea0,1/20(火) 8:18
2026-01-20,11:48,sports,スポーツ,13,サンケイスポーツ,ダイワメジャー死す…25歳　現役時に天皇賞・秋などGⅠ5勝で2年連続のJRA賞最優秀短距離馬　産駒も大活躍,https://news.yahoo.co.jp/articles/6da43b9efdbf358d9f9df72809f98c5e985b70f1,1/20(火) 10:05
2026-01-20,11:48,sports,スポーツ,14,みんなのゴルフダイジェスト,2026シーズン開幕！ 松山英樹は「神様のような存在」。PGAツアー日本勢5人が語り合う「互いの強み」,https://news.yahoo.co.jp/articles/54b4c600357a2719e4cd334ac98645e519fe3c38,1/20(火) 8:03
2026-01-20,11:48,sports,スポーツ,15,ハフポスト日本版,元大関・魁皇の浅香山親方、愛犬が「長寿表彰」される　15歳フォードくんの快挙と“現在の姿”に反響,https://news.yahoo.co.jp/articles/324d87a75077fb0de5a8872dfe2f7a7a72f8d9ff,1/20(火) 10:30
2026-01-20,11:48,sports,スポーツ,16,日刊スポーツ,ハワイ優勝旅行不参加のソフトバンク選手に、浜田雅功ツッコミ「腹立つ」「お前、生意気やな！」,https://news.yahoo.co.jp/articles/6773f834639538ec5b2b93d4d975172f226da4e2,1/20(火) 11:11
2026-01-20,11:48,sports,スポーツ,17,Full-Count,巨人、則本昂大獲得へ動いた理由　フロント動かしたベテラン…刺さった言葉「選手も評価」,https://news.yahoo.co.jp/articles/7d706b5b4fb77a74201ce1b13d8cad569d1cc26c,1/20(火) 7:30
2026-01-20,11:48,sports,スポーツ,18,スポーツ報知,城西大女子駅伝部の赤羽周平監督と妻・有紀子コーチが退任を発表「学生達を心から誇りに」２冠での契約満了は異例　２人の４月以降は「具体的には決まっていない」,https://news.yahoo.co.jp/articles/c980cf74da604324f88ea9b8c3b89583b347982d,1/20(火) 10:03
2026-01-20,11:48,sports,スポーツ,19,Full-Count,西武ドラ1が「マジ森友哉」　重なるMVPの“残像”…高まる期待「マジで首位打者行ける」,https://news.yahoo.co.jp/articles/160546be6b0aeba7a9a068bc92a54b24eb93d036,1/20(火) 8:13
2026-01-20,11:48,sports,スポーツ,20,日刊スポーツ,大谷翔平や山本由伸がドレスアップして登場　授賞式をライブ配信すると米ポッドキャスト発表,https://news.yahoo.co.jp/articles/1c4f6a2a0f8b5d6a7d87a4355e8ad3eb56695b28,1/20(火) 9:09
2026-01-20,11:48,sports,スポーツ,21,サンケイスポーツ,巨人・坂本勇人が沖縄自主トレ公開　オリックス・広岡大志が初合流,https://news.yahoo.co.jp/articles/0ead13d1a0c01838ba37a1af8e31d46a30a273c7,1/20(火) 10:22
2026-01-20,11:48,sports,スポーツ,22,ゴルフのニュース,若者ゴルファーにマナーを注意しただけで“老害”扱い!? コロナ以降に深まる「世代間ギャップ」の正体とは,https://news.yahoo.co.jp/articles/5d8beb56e7b4c5fc5f26a846621a3a1e3e5cbc93,1/20(火) 8:15
2026-01-20,11:48,sports,スポーツ,23,ENCOUNT,【RIZIN】RENAのグローブタッチ拒否　王者・伊澤星花、困惑し頭が真っ白「それで作戦がどこかに」,https://news.yahoo.co.jp/articles/a5e69b6a3e6f91e20f3c849b81942f62cd79883f,1/20(火) 11:16
2026-01-20,11:48,sports,スポーツ,24,RONSPO,「どうぞ（ご自由に）！」ヤンキースがFA最後の大物ベリンジャーの再契約に5年約253億円以上出さず異例のマネーゲーム参戦拒否を決めた理由とは？逆襲狙う対抗馬はメッツ,https://news.yahoo.co.jp/articles/2b039fa15618a8fcdd2109a13fc52fed0d0aba71,1/20(火) 6:00
2026-01-20,11:48,sports,スポーツ,25,ABEMA TIMES,15歳力士、取組後に髪が爆発 食らいついたら離さない執念の勝ち越しでの一コマ「負けん気の強さ顔に出てる」ファン驚嘆,https://news.yahoo.co.jp/articles/e952012c6ba4dbad610ec410281787ca39796680,1/20(火) 11:03
2026-01-20,11:48,sports,スポーツ,26,GOAL,エンバペ、シャビ・アロンソ監督解任について口を開く「とぼけるつもりはない。もちろん色々なことが起こったさ」,https://news.yahoo.co.jp/articles/56c436616853e8cfbb9fb3e98336e393b0f880f8,1/20(火) 11:21
2026-01-20,11:48,sports,スポーツ,27,日刊スポーツ,森井翔太郎いよいよ投打の二刀流として実戦開始　ルーキーから今季1Aに昇格、米専門誌伝える,https://news.yahoo.co.jp/articles/c47281c942ca410cd3990702869930a8dc799339,1/20(火) 9:41
2026-01-20,11:48,sports,スポーツ,28,日刊スポーツ,連敗中の豊昇龍、大の里が10日目出場へ　豊昇龍出場は師匠が明言　大の里の師匠は出場におわす,https://news.yahoo.co.jp/articles/a16fa28436bfd2e76a6ca9afbf2e12a95e9db5e4,1/20(火) 11:14
2026-01-20,11:48,sports,スポーツ,29,Full-Count,狭くなるバンテリンに驚きの“新発見”　「存在知らなかった」…もう一つの激変,https://news.yahoo.co.jp/articles/1d370b02eb7b8afaa63103dbaed00e3bfa467d21,1/20(火) 7:20
2026-01-20,11:48,sports,スポーツ,30,スポーティングニュース日本版,好機で相次ぎ凡退、目前で逃した甲子園…巨人守護神の次男が反省「興味がなかった」,https://news.yahoo.co.jp/articles/91f53e42eb519f316c55151b114a3ac13fb9d7d9,1/20(火) 7:30
2026-01-20,11:48,sports,スポーツ,31,Full-Count,ド軍の大補強を「許してはいけない」　繰り返されるご意見番の“大放言”「球界追放を」,https://news.yahoo.co.jp/articles/0d29d11409954447dab2c9dfc69cecbf00cf9d2b,1/20(火) 10:13
2026-01-20,11:48,sports,スポーツ,32,FITNESS LOVE,メリハリ砂時計ボディで魅せた41歳がコンテストで活躍！　足裏や呼吸の意識でさらに身体の変化を実感,https://news.yahoo.co.jp/articles/7296c1d91fad2589f0f9cb15a6662ef74c387790,1/20(火) 7:10
2026-01-20,11:48,sports,スポーツ,33,スポニチアネックス,WBC韓国代表にまた悲報…カージナルス有望株ウェザーホルト「プレーしたかった」も資格満たさず出場不可,https://news.yahoo.co.jp/articles/ed90ab320b60be4d47cdfccba43d7abb5a40e6f4,1/20(火) 8:50
2026-01-20,11:48,sports,スポーツ,34,東スポWEB,【ＭＬＢ】放出報道続くＴ・ヘルナンデスは残留濃厚　米サイト指摘,https://news.yahoo.co.jp/articles/51675a7828f198b129a7459ea615b999cb6327c6,1/20(火) 10:45
2026-01-20,11:48,sports,スポーツ,35,デイリースポーツ,栃大海「右膝内側側副靱帯損傷」で休場、９１年続く春日野部屋の関取在籍は微妙に,https://news.yahoo.co.jp/articles/feaccabe967df8808aaf37996978185c875bf30e,1/20(火) 10:02
2026-01-20,11:48,sports,スポーツ,36,日刊スポーツ,【日本ハム】新庄監督からモイネロ攻略へインスタ指令「１巡目10球以上粘れ。三振は査定せず」,https://news.yahoo.co.jp/articles/e0c62f1bdb2aa6da1df27d591f43d15760a95f39,1/20(火) 11:17
2026-01-20,11:48,sports,スポーツ,37,日刊スポーツ,「弱ええー」「ひどい」元朝青龍が激怒「お前ら舐めるなよ。相撲の事」横綱、大関のていたらくに,https://news.yahoo.co.jp/articles/8a27c0503e88e82854f2145801e31f611a589d41,1/19(月) 23:28
2026-01-20,11:48,sports,スポーツ,38,CoCoKARAnext,阪神追撃の1番手は？球界OBのキャンプ前順位予想　台風の目となるのは？阿部巨人はBクラス…「打つプラスアルファのほうが大きく作用すると思っている」,https://news.yahoo.co.jp/articles/5afe0c6dfdc04cab53568265a9faf85b482be219,1/20(火) 11:05
2026-01-20,11:48,sports,スポーツ,39,デイリースポーツ,金田久美子の海外あるあるに「日本のエース！」「美脚すぎ」「モデルみたい」とＳＮＳ反響　「私世代のおねぇさん方　共感してくれると思います」と投稿,https://news.yahoo.co.jp/articles/26ff2732dd2da3883207f4bc170894243ee2e170,1/20(火) 8:57
2026-01-20,11:48,sports,スポーツ,40,デイリースポーツ,エプロン姿の女子ゴルファー　川崎春花とホッコリみそ作り報告「楽しかった！！！８月まで待ちきれない」　ＳＮＳ「勝てるミソですね！」「２人とも可愛いー♥」,https://news.yahoo.co.jp/articles/1af0b451a4dee2eacac687221157b288a3502e2a,1/20(火) 10:42
