scrp_date,scrp_time,genre_en,genre_jp,rank,media_jp,title,link,date_original
2024-11-07,12:10,domestic,国内,1,FNNプライムオンライン,【独自】カメムシ“丸々1匹”がお菓子に混入　口に入れて“異物感”に気づく…メーカー「2週間以内に原因報告」とするも連絡無く,https://news.yahoo.co.jp/articles/aaada6fda0c38bea5f6d7e602526035acc37ba76,11/7(木) 7:13
2024-11-07,12:10,domestic,国内,2,テレビ朝日系（ANN）,高級ホテルのスイートルームで親族など21人が大宴会　注意した従業員に「ぶっ殺すぞ」　東京・六本木,https://news.yahoo.co.jp/articles/48fc79a25b139e4fc6140c52401b566159077185,11/7(木) 10:55
2024-11-07,12:10,domestic,国内,3,デイリースポーツ,高橋洋一氏「石破首相はトランプ氏に会えない」衝撃の理由！関係構築できる後継はただ一人「早く変わらないと国益反する」,https://news.yahoo.co.jp/articles/79c95dae26f92da8f319dcc6cc6d7089d7cce8bc,11/6(水) 23:04
2024-11-07,12:10,domestic,国内,4,みんかぶマガジン,自民関係者「辞めないなら辞めさせるしかない」次の総理に2人の名前「茂木、そして」…石破おろし本格化は「補正予算通った後」,https://news.yahoo.co.jp/articles/3fb0cf2ca3d0e8c8769708d388fecdbc20047d58,11/7(木) 9:10
2024-11-07,12:10,domestic,国内,5,弁護士JPニュース,都内放火で“アメリカ人観光客”（18）逮捕　「米国の圧力で不起訴になる」の声も…現実性は？,https://news.yahoo.co.jp/articles/03f5bdaa1936ad582bdcbe9287174e7d405b1761,11/7(木) 11:06
2024-11-07,12:10,domestic,国内,6,TBS NEWS DIG Powered by JNN,意識不明の重体だった小学5年生の息子（11）搬送先の病院で死亡　母親（43）が子ども2人を殺害しようとしたとして逮捕された事件　横浜・港北区,https://news.yahoo.co.jp/articles/8f4b1d236cb689a83b3d7d0ecf3cc6a943080da0,11/7(木) 8:19
2024-11-07,12:10,domestic,国内,7,MBSニュース,実の娘に性的暴行の罪　父親の初公判の期日決定　12月16日に富山地裁　娘は「（家庭内性被害者は）私で最後にしてほしい」と訴え,https://news.yahoo.co.jp/articles/1b570f0be2615817dd788fc9f31bda117d4d3ecc,11/7(木) 10:40
2024-11-07,12:10,domestic,国内,8,スポニチアネックス,れいわ幹事長、公職選挙法違反の指摘に反論　「当選祝賀会」ではなく「慰労会」主張「誤解を生んでいる」,https://news.yahoo.co.jp/articles/7fc418a71dd0bc198b6971c0244963b9f709ab4c,11/7(木) 11:31
2024-11-07,12:10,domestic,国内,9,読売新聞オンライン,１８年前の女児刺傷事件、別の女児殺害で服役中の勝田州彦容疑者を殺人未遂容疑で逮捕…兵庫県警,https://news.yahoo.co.jp/articles/0021090cbcbb3722bc50c21baf5e719e57ed79eb,11/7(木) 10:52
2024-11-07,12:10,domestic,国内,10,デイリースポーツ,橋下氏　立憲民主の「１０３万」反対議員→「何の責任も負わないペーペー政治家が」Ｘで相手組織を腐すな,https://news.yahoo.co.jp/articles/60995a8576542067f85a0497c17dd62dd8194406,11/6(水) 16:28
2024-11-07,12:10,domestic,国内,11,朝日新聞デジタル,六本木のホテルスイートで大宴会、業務妨害容疑で兄弟逮捕,https://news.yahoo.co.jp/articles/c8beb54a2e41f24be2f3fbd6d8d01d5b1696e88c,11/6(水) 18:03
2024-11-07,12:10,domestic,国内,12,毎日新聞,「103万円の壁」解消に直接補塡　国民民主、自公への要望原案判明,https://news.yahoo.co.jp/articles/c137c0bc93af378ec0d97bf34eec1334fda64f19,11/6(水) 20:39
2024-11-07,12:10,domestic,国内,13,MBSニュース,「消費されて終わったなと…」川で溺れた小中学生を助けようとした夫が死亡『美談』の報道に違和感覚えた妻は研究者の道へ『どうすれば事故を防げるのか？』,https://news.yahoo.co.jp/articles/e196636d639b9088ee0ac9f7ae178db6bce6a658,11/6(水) 14:03
2024-11-07,12:10,domestic,国内,14,デイリースポーツ,池上彰氏が驚く　米ＮＹの街にトランプ支持者「考えられないです」全員ガックリ８年前と激変,https://news.yahoo.co.jp/articles/9694fd12a27de02aa04b98463675c11ed63afd63,11/6(水) 20:21
2024-11-07,12:10,domestic,国内,15,テレビ朝日系（ANN）,「いきなり入って息子を殴りだした」　通報で駆けつけた警察官が血のついた服の男逮捕,https://news.yahoo.co.jp/articles/6fcaec2dfc83b283204d1b17868cc8303961da4e,11/4(月) 13:12
2024-11-07,12:10,domestic,国内,16,デイリースポーツ,池上彰氏　トランプ氏「２４時間で戦争終結」豪語→ウクライナ支援やめ降伏圧力の見方指摘「仲良いプーチン大統領に有利な形では」と,https://news.yahoo.co.jp/articles/2ec41f3a20968467cc73db2c5fd1aa1fb04abdc0,11/6(水) 19:22
2024-11-07,12:10,domestic,国内,17,ENCOUNT,立憲・野田佳彦代表、トランプ次期大統領の「これが心配です」と懸念を口に…「個人的な信頼関係を、早く」,https://news.yahoo.co.jp/articles/ca5498d1ad9b44e14d56991c781dc82fa963e574,11/7(木) 10:55
2024-11-07,12:10,domestic,国内,18,FNNプライムオンライン,茨城の畑で発見された白骨化遺体は4年前から行方不明の森順子さんだった…別の事件で服役中の森さんの長男「死体処理を知人に依頼」,https://news.yahoo.co.jp/articles/79cacabff79d1b3a86fe3ac29e23b12f12f3d124,11/7(木) 9:09
2024-11-07,12:10,domestic,国内,19,FNNプライムオンライン（フジテレビ系）,浴槽に沈めた5歳娘は溺死…逮捕の母「間違いありません」容疑認める　首絞めた11歳長男は意識不明の重体　神奈川・横浜市,https://news.yahoo.co.jp/articles/9f76578a9f3006a00bc0b02a23e473938e022000,11/1(金) 3:34
2024-11-07,12:10,domestic,国内,20,デイリースポーツ,三浦瑠麗氏「エリートのほとんどは理解していない」トランプ現象の本質を解説「副大統領が勝つ要素乏しすぎる」勝敗の要因も分析,https://news.yahoo.co.jp/articles/b1f382c2efd47dc0a869ea4cf62309f0b19867c7,11/6(水) 17:28
2024-11-07,12:10,domestic,国内,21,デイリースポーツ,ひろゆき氏　トランプ大統領復帰で起こる近未来を予測「原油価格下がる」「景気良くなる」も最後は悪夢のシナリオ,https://news.yahoo.co.jp/articles/19d2f6b5709a8bb24d87329c01bcf2df74e40dc5,11/6(水) 17:53
2024-11-07,12:10,domestic,国内,22,産経新聞,保険証不正使用容疑で逮捕の革労協活動家の女　24年前の内ゲバ殺傷事件の被害者だった,https://news.yahoo.co.jp/articles/ae668808f1569aecfd4b96fd599899480b0fb9fe,11/7(木) 10:59
2024-11-07,12:10,domestic,国内,23,日テレNEWS NNN,石破首相、トランプ氏と電話会談,https://news.yahoo.co.jp/articles/fbc1b6e6389ab6c79e89b8e001b7c1bedba2006f,11/7(木) 10:20
2024-11-07,12:10,domestic,国内,24,日刊スポーツ,鳩山由紀夫元首相、トランプ氏当確に「無理な要求には毅然とNOと言える日本に」,https://news.yahoo.co.jp/articles/6d500cac53464a05b596d94e306b7ab974faa839,11/7(木) 9:11
2024-11-07,12:10,domestic,国内,25,毎日新聞,兵庫・たつの市の女児殺人未遂容疑　別事件の受刑者を7日に逮捕へ,https://news.yahoo.co.jp/articles/48807b0e931e8fd8fd92b9dbb4be23b85c10740a,11/6(水) 17:01
2024-11-07,12:10,domestic,国内,26,日刊スポーツ,ひろゆき氏、難民申請却下→強制送還に「人道的」「母国の友達を作る方が幸せ」,https://news.yahoo.co.jp/articles/390668345434bd7e0ded2cdbf4c18226516b7dfb,11/7(木) 10:13
2024-11-07,12:10,domestic,国内,27,デイリースポーツ,玉川徹氏　トランプ政権誕生に不快感「４年間イヤなニュースを見なきゃいけない」,https://news.yahoo.co.jp/articles/e93df21d840c48f121499edcfbe959ccaac6be95,11/7(木) 11:18
2024-11-07,12:10,domestic,国内,28,読売テレビ,【速報】18年前の未解決事件「 たつの市女児刺傷」で男を逮捕　 別の女児殺害事件で服役中　兵庫県警,https://news.yahoo.co.jp/articles/6e7533d1e0a851a7f5ae58c72343ea6738cab7bc,11/7(木) 10:47
2024-11-07,12:10,domestic,国内,29,共同通信,富山県警警察官が拳銃2発発砲、男性重傷,https://news.yahoo.co.jp/articles/a6e01c742924f1284d2739f258e860934e4049e9,11/7(木) 10:26
2024-11-07,12:10,domestic,国内,30,朝日新聞デジタル,警察官が発砲、男性が重傷　「息子が妻を殴っている」通報で駆けつけ,https://news.yahoo.co.jp/articles/560446ba4be911d10cf751db307c8eee9fefc456,11/7(木) 11:12
2024-11-07,12:10,domestic,国内,31,スポーツ報知,「モーニングショー」玉川徹氏、「米大統領選」トランプ氏勝利に不安「これからの４年間は嫌なニュースをずいぶん見そうな感じ」,https://news.yahoo.co.jp/articles/159ea416845ca95c70bb73f07d284fca667a7ea9,11/7(木) 9:27
2024-11-07,12:10,domestic,国内,32,よろず～ニュース,国民民主・玉木雄一郎代表、まさかの“ひろゆき構文”発動　会見中に「あなたの感想ですよね」,https://news.yahoo.co.jp/articles/9fbdcd178467eec67d21670372ec6790f804be13,11/6(水) 21:54
2024-11-07,12:10,domestic,国内,33,デイリースポーツ,「トランプと石破」案の定、ネットは不安の声続々「嫌な予感」「もうシンゾーはいない」「トランプに日米地位協定とか言うの？」,https://news.yahoo.co.jp/articles/3054cfb89dfbd4f0178b6359928b860512d24ead,11/6(水) 20:55
2024-11-07,12:10,domestic,国内,34,Yahoo!ニュース オリジナル THE PAGE,【図解】国民民主党・玉木雄一郎氏のプロフィール,https://news.yahoo.co.jp/articles/a8f5bf47a1a9460803903e8ac3dabbfbd8fff001,11/7(木) 10:31
2024-11-07,12:10,domestic,国内,35,中日スポーツ,トランプ氏当確　ひろゆき氏、「中国が台湾侵攻という流れになりそうな」フォロワーからは反論や平和祈る声,https://news.yahoo.co.jp/articles/82b19cc0887471575fdb980821e08b1cc8f0cb33,11/6(水) 20:02
2024-11-07,12:10,domestic,国内,36,共同通信,意識不明の11歳長男死亡、横浜　長女も殺害容疑で母親捜査,https://news.yahoo.co.jp/articles/df08be1b34a07dc80fb46402a84858816d46e4a7,11/7(木) 11:17
2024-11-07,12:10,domestic,国内,37,共同通信,警察官発砲の1発は男性に命中か,https://news.yahoo.co.jp/articles/6dc2266b74948cde1f8555be70a77018fa1e5a8d,11/7(木) 11:35
2024-11-07,12:10,domestic,国内,38,スポーツ報知,米大統領選　ハリス副大統領の敗因は「魅力不足が一番」…デーブ・スペクター氏,https://news.yahoo.co.jp/articles/17a47949da9e7571af46a8192fb13ee522d8c1ef,11/7(木) 6:15
2024-11-07,12:10,domestic,国内,39,デイリースポーツ,誰？デカッ！　激変　トランプ氏の横→１８歳になった息子バロン君が衝撃２０６ｃｍ　騒然「びっくり」「めちゃデカくなってるｗ」「イケメン過ぎる」,https://news.yahoo.co.jp/articles/2e373a9b71ff7e6dfe7f7a2fa1ce39dfb33e79f2,11/6(水) 17:25
2024-11-07,12:10,domestic,国内,40,J-CASTニュース,「ピザーラ」配達バイクが歩道を走行、動画拡散で批判相次ぐ　運営会社「警察署に相談の上、厳正に対応」,https://news.yahoo.co.jp/articles/11630e300be142188a119d6db82d22138026a6ea,11/6(水) 14:36
