scrp_date,scrp_time,genre_en,genre_jp,rank,media_jp,title,link,date_original
2024-10-20,03:07,domestic,国内,1,毎日新聞,都内の物件は「もはや手が出せない」　物価高に追い付かない賃上げ、遠ざかるマイホーム,https://news.yahoo.co.jp/articles/8e19c2f88419801ec16f7bd94f2db049a0610d75,10/19(土) 17:00
2024-10-20,03:07,domestic,国内,2,共同通信,宝田容疑者「間違いありません」と認める,https://news.yahoo.co.jp/articles/8cce88cf0a41b78be8e883624ee414d08d604010,10/19(土) 23:10
2024-10-20,03:07,domestic,国内,3,TBS NEWS DIG Powered by JNN,「闇バイト」した男性宅に強盗しようとしたか　事件4日前にも男性襲撃受ける 「トクリュウ」内でトラブル原因か　33歳男と18歳男逮捕　さいたま市,https://news.yahoo.co.jp/articles/1d53ac8ba179fae0c8a93ca3b599f36b8669eebb,10/18(金) 21:28
2024-10-20,03:07,domestic,国内,4,スポーツ報知,人気女優の“証明写真”がレベチ！「明治大学で学び…」履歴書が絶賛「可愛い～」「出来る女って感じ」,https://news.yahoo.co.jp/articles/aa704d95ee4ce5d7f3a4889f3373b83264c90ff2,10/19(土) 12:05
2024-10-20,03:07,domestic,国内,5,毎日新聞,横浜高齢者殺害　強盗殺人容疑で22歳逮捕　連続強盗との関連捜査,https://news.yahoo.co.jp/articles/04e573b033832d02a55511e639c40f732ecb2f9b,10/19(土) 23:01
2024-10-20,03:07,domestic,国内,6,レスキューナウニュース,JR京都線で人身事故 一部運転見合わせ,https://news.yahoo.co.jp/articles/5248d7adb5b3489b6811ff8fa00861b8f182129f,10/20(日) 0:15
2024-10-20,03:07,domestic,国内,7,よろず～ニュース,維新の前代表・松井一郎氏が萩生田光一氏を応援！維新候補もいるのに「俺も無所属！政党より友情」,https://news.yahoo.co.jp/articles/006468266c0a711fb9557c595a826f45fd71dacc,10/19(土) 20:51
2024-10-20,03:07,domestic,国内,8,FNNプライムオンライン,「織田信長」「夏目漱石」に「ジョジョ」連続“闇バイト強盗”指示役か　住人殺傷・連れ去り…エスカレートする犯行手口　1都3県合同捜査本部「悪いやつら切り取る」,https://news.yahoo.co.jp/articles/61932dcd80641dfd1471dbf49a40333c15e77fd7,10/18(金) 18:52
2024-10-20,03:07,domestic,国内,9,朝日新聞デジタル,室内荒らされ、複数の土足の足跡　横浜市の男性死亡、殺人容疑で捜査,https://news.yahoo.co.jp/articles/c86bd480c4f7f616c1ca4ef00a9cbf35b9686ae5,10/17(木) 10:25
2024-10-20,03:07,domestic,国内,10,産経新聞,辻元清美氏の地盤で立民奪還なるか　自民、維新との三つ巴に党幹部投入　大阪10区,https://news.yahoo.co.jp/articles/c93c5a7930131acb92341b1709f065202223753c,10/19(土) 20:55
2024-10-20,03:07,domestic,国内,11,デイリースポーツ,高橋洋一氏「国民ナメられてる」複数政党がバラ色の最低賃金１５００円→計算したら無理「すぐウソって分かる」　正義のミカタ,https://news.yahoo.co.jp/articles/dcdc63a4beafdd143e72788d1bd1614335ef05d3,10/19(土) 17:49
2024-10-20,03:07,domestic,国内,12,ABEMA TIMES,小さな侵入者！？背後に迫る“影”にも動じない藤井聡太竜王の様子が話題 ファンはあわあわ「無視できない」「ちょw」,https://news.yahoo.co.jp/articles/9e3b18d664aaa1ff48a1e9888d490ee5b7042522,10/19(土) 16:02
2024-10-20,03:07,domestic,国内,13,FNNプライムオンライン（フジテレビ系）,【独自】警察官に“高圧洗浄機”で液体噴射か　臼田敦伸容疑者（49）は黙秘　車内からポリタンク・火炎瓶・発煙筒が発見　警視庁公安部,https://news.yahoo.co.jp/articles/9cdcec66ef460195e30c353ea7c114c381df2e36,10/19(土) 19:07
2024-10-20,03:07,domestic,国内,14,日本ファクトチェックセンター,山本太郎氏「在日コリアンの方々は何年も納税されてきた！参政権ぐらい与えてもいいだろう！」と発言？　まとめサイトによるもの【ファクトチェック】,https://news.yahoo.co.jp/articles/2f4e0b658808e9d0f892225174c4ae6cd643133f,10/19(土) 9:02
2024-10-20,03:07,domestic,国内,15,FNNプライムオンライン（フジテレビ系）,上皇后美智子さま90歳＝卒寿をお迎えに　骨折前の映像公開　上皇さまをお支えするため毎日リハビリを続ける,https://news.yahoo.co.jp/articles/a3e2638aae6847803ffb7e7d95fc9a7c47fea9e7,10/20(日) 0:00
2024-10-20,03:07,domestic,国内,16,TBS NEWS DIG Powered by JNN,安楽死合法の国で――　余命3か月の母を支える家族　激痛に耐え、法制化を求めた男性,https://news.yahoo.co.jp/articles/50c55981183016f7eb27be51744a92b162a16dd2,10/19(土) 18:03
2024-10-20,03:07,domestic,国内,17,FNNプライムオンライン（フジテレビ系）,【速報】横浜市の住宅の強盗殺人事件で宝田真月容疑者22歳を逮捕　後藤寛治さん（75）殺害し現金奪った容疑,https://news.yahoo.co.jp/articles/f360c70fac9bad6f4d78d58750f62c25b01ce35f,10/19(土) 23:03
2024-10-20,03:07,domestic,国内,18,よろず～ニュース,高市早苗氏、支持者の自民党離れを危惧　投票呼び掛けも「高市さん応援しても自民党には失望」の声が続く,https://news.yahoo.co.jp/articles/d4c791f3987620eeb7a75e87e11b5683cc4b97d5,10/19(土) 18:06
2024-10-20,03:07,domestic,国内,19,FNNプライムオンライン,秘匿性高い通信アプリ「シグナル」で犯行の指示され…千葉・市川市強盗事件で逮捕の高梨謙吾容疑者（21） 他の強盗事件への関与を認める供述,https://news.yahoo.co.jp/articles/3df36fd492a9ce422fe7a970375557fed370dc65,10/19(土) 17:13
2024-10-20,03:07,domestic,国内,20,毎日新聞,容疑者宅を家宅捜索　自民党本部前に火炎瓶　警視庁,https://news.yahoo.co.jp/articles/a210fd7b0c96e5e3dd2f56d99ca3da205eb4578c,10/19(土) 20:53
2024-10-20,03:07,domestic,国内,21,スポーツ報知,「誰の選挙か分からなくなる」“王国”継いだ二階俊博氏三男、父の応援演説見送りへ,https://news.yahoo.co.jp/articles/df5fa0156bffda921b3a6066ffb76ee009a9a5f7,10/17(木) 6:00
2024-10-20,03:07,domestic,国内,22,読売新聞オンライン,横浜・青葉区の強盗殺人、近隣にスーツ姿の男が数日前突然「水漏れ点検させて」「屋根浮いている」,https://news.yahoo.co.jp/articles/2ff4a14467e57f1944bbe0139184a22b553f11cb,10/19(土) 7:25
2024-10-20,03:07,domestic,国内,23,読売新聞オンライン,首相官邸前に突入した車にポリタンク２０個、中身はいずれもガソリン…容疑者は車内に火を付ける,https://news.yahoo.co.jp/articles/4d51c6fe1ef5652f4ffdb8984c96410b6dc889ac,10/19(土) 19:45
2024-10-20,03:07,domestic,国内,24,夕刊フジ,東京24区八王子　〝どぶ板〟萩生田光一氏VS立民・有田芳生氏　熾烈な〝場外戦〟辻元氏「出場停止」猛批判　昭恵夫人、高市氏が現地入り,https://news.yahoo.co.jp/articles/73ce71468cb41536e818cc056417bd9bda71eea4,10/19(土) 17:00
2024-10-20,03:07,domestic,国内,25,スポニチアネックス,公明代表“低所得世帯へ10万円給付案”トレンド入り、ネット「お得意の選挙前のやり方」「税率下げれば」,https://news.yahoo.co.jp/articles/80497183be27df44ce135ddb12635fd47ff5f15c,10/18(金) 9:50
2024-10-20,03:07,domestic,国内,26,日テレNEWS NNN,【速報】横浜強盗殺人“実行役”の男（22）を逮捕　神奈川県警,https://news.yahoo.co.jp/articles/afd486e2ae23dc36031855f9dc851b0d0d9d88c2,10/19(土) 23:00
2024-10-20,03:07,domestic,国内,27,デイリースポーツ,衆院選ＴＶ報道つまらない？「自主規制です」と元日テレ次長　有権者より公平に縛られ「やめとこう」　政党から抗議も？「それもあります」　正義のミカタ,https://news.yahoo.co.jp/articles/99b40dd74c155c7816ab0da3b741b3ee51c11179,10/19(土) 23:29
2024-10-20,03:07,domestic,国内,28,毎日新聞,上皇后さま20日に90歳の誕生日　民間から皇室、平成流を支えた旅,https://news.yahoo.co.jp/articles/b18e7890dce222c23fbd64d3e83181d988751995,10/19(土) 5:00
2024-10-20,03:07,domestic,国内,29,ウェザーマップ,北海道の各地で初雪を観測　いずれも昨年より早い,https://news.yahoo.co.jp/articles/74d937ddff2741282c81f28f11c9937153631264,10/20(日) 0:52
2024-10-20,03:07,domestic,国内,30,毎日新聞,保護された女性「宿泊施設に連れて行かれた」　千葉・市川の強盗,https://news.yahoo.co.jp/articles/627599b392e75cee94b63578a2fb4a109672d798,10/18(金) 11:00
2024-10-20,03:07,domestic,国内,31,共同通信,車のポリタンクは約20個、大半がガソリン,https://news.yahoo.co.jp/articles/1460acbd3fae37a86ccbb2b56bcd9190e18f5ad1,10/19(土) 23:41
2024-10-20,03:07,domestic,国内,32,夕刊フジ,大阪・東京、49全選挙区「当落予測リスト」　大阪小選挙区で〝全面激突〟維新が公明に完勝か　東京24区、萩生田氏が苦戦予想覆す地力,https://news.yahoo.co.jp/articles/7ef5dedd104797e0d3b9127c86eef4ae0f406a5b,10/17(木) 17:00
2024-10-20,03:07,domestic,国内,33,毎日新聞,職を転々、国政選挙への出馬模索も　自民党本部に火炎瓶の容疑者,https://news.yahoo.co.jp/articles/e3489a033f0b265fe82de55765c232053bea6092,10/19(土) 20:05
2024-10-20,03:07,domestic,国内,34,TBS NEWS DIG Powered by JNN,衆議院議員選挙 非公認となった“裏金議員”の選挙区では…　支援者は「好きでも嫌いでもないが、いないと困る」【報道特集】,https://news.yahoo.co.jp/articles/aeaf282121bf450293ec1b95ba9f284bf6a92229,10/19(土) 20:28
2024-10-20,03:07,domestic,国内,35,ABEMA TIMES,国会議員が英語をネイティブ発音して議場から笑い声 SNSで批判殺到の件をEXITが徹底分析「笑った人たちは馬鹿にしていたわけじゃない」,https://news.yahoo.co.jp/articles/c77ca0c105fcaa1f613f9dee0480effb19ef6752,10/19(土) 11:02
2024-10-20,03:07,domestic,国内,36,TBS NEWS DIG Powered by JNN,車内にガソリン入りポリタンク約20個　総理官邸前柵に車で突入など疑いで現行犯逮捕の49歳男　自民党本部に火炎瓶投げる　警視庁公安部が自宅を家宅捜索,https://news.yahoo.co.jp/articles/10ca37107be8c2b40d8b012fac00704201b0f92c,10/20(日) 2:32
2024-10-20,03:07,domestic,国内,37,よろず～ニュース,堀江貴文氏、山本太郎氏の「消費税廃止」に異論「相変わらず頓珍漢な事言ってる」大物対談を期待の声も,https://news.yahoo.co.jp/articles/19165afdf771ca72e2f13943ded16b7ce25aae51,10/17(木) 16:00
2024-10-20,03:07,domestic,国内,38,毎日新聞,連合、年金の3号廃止を正式提起　「年収の壁」で働き控え招くと批判,https://news.yahoo.co.jp/articles/9a74f9347c50a2c64e920cfcd453534338fd44b7,10/18(金) 19:19
2024-10-20,03:07,domestic,国内,39,産経新聞,「許されない行為」「事件連鎖するかも」永田町の事件受け陣営に緊張、警察も警戒強める,https://news.yahoo.co.jp/articles/86aacfd2e49221e450d75feda0b52f2354269c23,10/19(土) 19:23
2024-10-20,03:07,domestic,国内,40,テレビ朝日系（ANN）,首都高速湾岸線　7台からむ事故　重体の男性死亡　12人けが,https://news.yahoo.co.jp/articles/389cc773af1a1c9c32257430ba3e37c6c8dbb9bb,10/19(土) 23:32
