scrp_date,scrp_time,genre_en,genre_jp,rank,media_jp,title,link,date_original
2025-02-12,06:06,domestic,国内,1,東海テレビ,「人のやる事じゃない…」出荷直前のキャベツ約800玉盗まれる 生育不良で価格高騰の中 農家らは憤り隠せず,https://news.yahoo.co.jp/articles/e2ac1ef0c8b505f195f7323f8fca6630a9452139,2/11(火) 21:03
2025-02-12,06:06,domestic,国内,2,読売テレビ,【物議】「マナー以前というか正直あきれた」新幹線の乗降口を塞ぐスーツケース、入れないはずの線路に立ち入り電車と接触死亡事故…相次ぐ外国人観光客による迷惑行為の背景に、国ごとに違う“常識”!?,https://news.yahoo.co.jp/articles/1333d812acd1d73f38c27deedb0671ef9580d842,2/11(火) 13:00
2025-02-12,06:06,domestic,国内,3,ABEMA TIMES,天井から伸びる“白い手”の正体は害獣？狂犬病になる恐れも…駆除業者が危険性を指摘,https://news.yahoo.co.jp/articles/56342c2881d2456429599c2097b7bfc3e62dcbbf,2/11(火) 11:32
2025-02-12,06:06,domestic,国内,4,朝日新聞,運転席で人とみられる姿を確認　陥没事故、救助に最短で3カ月見通し,https://news.yahoo.co.jp/articles/2fa9519a89edf58a42456f67773db81de6f12cdc,2/11(火) 19:20
2025-02-12,06:06,domestic,国内,5,テレビ朝日系（ANN）,安否不明の運転手か…穴から30m付近に人がいる可能性　八潮・陥没事故から2週間,https://news.yahoo.co.jp/articles/7d0768f051a28e5f2c89443e920c9db99ba18e96,2/12(水) 1:36
2025-02-12,06:06,domestic,国内,6,共同通信,賞与水増し、9千万脱税疑い　エンジン製造会社を告発,https://news.yahoo.co.jp/articles/df480eb573d7f672caf6cd3ea11192f125d699dd,2/12(水) 2:00
2025-02-12,06:06,domestic,国内,7,中日スポーツ,『秒で死んだらおもろいよね』 兄妹YouTuber、道路陥没事故めぐる発言で炎上→謝罪も… 「目が反省してない」「不貞腐れたような感じ…」厳しい声,https://news.yahoo.co.jp/articles/5e23f437a511588d896ce3274c6e36de92f6ed26,2/10(月) 15:32
2025-02-12,06:06,domestic,国内,8,読売新聞オンライン,ネット署名で中国側が世論工作か、処理水放出や防衛力強化を反対に誘導…専門家「分断広げる」,https://news.yahoo.co.jp/articles/61feb003d979a4361b120e9573e2903c0f2c48ac,2/12(水) 5:01
2025-02-12,06:06,domestic,国内,9,TBS NEWS DIG Powered by JNN,公明党代表が本音をポロリ「“裏金議員”を推薦したことを後悔している…」【報道1930】,https://news.yahoo.co.jp/articles/daeccfac148abeb56dc1d9bd606c411ba40b8db8,2/11(火) 21:59
2025-02-12,06:06,domestic,国内,10,東海テレビ,“道路に飛び出した”との情報も…小中学生とみられる女の子が車にはねられ意識不明の重体 運転の保育士を現行犯逮捕,https://news.yahoo.co.jp/articles/89b31aa109b4758bc9046e038eb5b5ed288f72c5,2/11(火) 17:05
2025-02-12,06:06,domestic,国内,11,弁護士ドットコムニュース,〈テレビ業界の接待〉 経営側になった女性フリーアナの視点、地方ロケで部屋に誘われた…それでも「飲み会必要」と言える理由,https://news.yahoo.co.jp/articles/1d90b6f7cf6d62ef3fac110275b02d0dba30d41f,2/11(火) 9:26
2025-02-12,06:06,domestic,国内,12,日刊スポーツ,埼玉県知事、道路陥没事故の取材めぐり注意「身元が不明な状況にもかかわらず…」,https://news.yahoo.co.jp/articles/2be4f5c72d4f9f081d0ab55788dfc07842cbf819,2/10(月) 12:12
2025-02-12,06:06,domestic,国内,13,ABEMA TIMES,車中で暮らす26歳の軽バンガール、定職と家を手放したZ世代の葛藤…「100%は応援できない」両親とのすれ違いも,https://news.yahoo.co.jp/articles/2ca0f810ac645ebe085b53869719a97852a99594,2/11(火) 12:01
2025-02-12,06:06,domestic,国内,14,読売新聞オンライン,道路わきに４ｍ積み上げられた雪から遺体…数日前から行方不明の９０代女性か,https://news.yahoo.co.jp/articles/54dd18d0a0f96736790c07be411fa7b51e34b012,2/11(火) 23:14
2025-02-12,06:06,domestic,国内,15,ABEMA TIMES,給食の残りで「まかない」を作り調理員が減給処分に あらかじめ食材を取り置く行為を問題視,https://news.yahoo.co.jp/articles/95fd5c177c36442ef26f89947c08c5838cd2e556,2/11(火) 11:51
2025-02-12,06:06,domestic,国内,16,TBS NEWS DIG Powered by JNN,"都内の小中学校で広がる「上履き廃止」…“土足のまま”の学校生活に子どものホンネは?【THE TIME,】",https://news.yahoo.co.jp/articles/6db36f563ae90f6f4e096cea04297f81a4984447,2/11(火) 7:02
2025-02-12,06:06,domestic,国内,17,共同通信,横浜市で道路下に空洞2カ所発見　埼玉の陥没受け緊急点検,https://news.yahoo.co.jp/articles/8c4c4afca12ecc8633baea45d2cb158d98db983a,2/10(月) 19:49
2025-02-12,06:06,domestic,国内,18,BUSINESS INSIDER JAPAN,日本のスキーハウスを約100万円で買った男性は、「安いから」という理由で日本の家を買うべきではないと忠告する（海外）,https://news.yahoo.co.jp/articles/197ee3bd8200f9766447e62a7dce5579342750e7,2/10(月) 20:00
2025-02-12,06:06,domestic,国内,19,デイリースポーツ,国際弁護士　トランプ氏が石破首相を絶賛の「日本語訳」に疑問「本当にそう訳していいのかな」早大教授も同調,https://news.yahoo.co.jp/articles/0422309dbde87a5e9a9bcc505b7e2d989a82488b,2/11(火) 13:32
2025-02-12,06:06,domestic,国内,20,スポニチアネックス,高騰中キャベツ、8000個消えた　畑から…重さ計1トン、売却目的?複数人で窃盗か　主要産地で悲劇,https://news.yahoo.co.jp/articles/4ba1fde4572aa277dfcdb0130a51d4171638fea5,2/12(水) 4:45
2025-02-12,06:06,domestic,国内,21,ウェザーマップ,12日(水)の天気　日本海低気圧　西から雨域拡大　強風やなだれ注意　「春一番」の可能性も,https://news.yahoo.co.jp/articles/db310c338f5bf7217efd85f9a73900036c109d03,2/12(水) 5:33
2025-02-12,06:06,domestic,国内,22,TBS NEWS DIG Powered by JNN,茨城県、栃木県、群馬県、埼玉県で最大震度2の地震　茨城県・笠間市、桜川市、栃木県・日光市、宇都宮市,https://news.yahoo.co.jp/articles/4e9390bcd2939236b7f9891361d412904d595c48,2/12(水) 5:48
2025-02-12,06:06,domestic,国内,23,弁護士JPニュース,「看護師の離職が止まらない」ケア労働者の低過ぎる賃金の改善求め、医労連が全国統一ストライキ実施へ,https://news.yahoo.co.jp/articles/41b76b53e45111ccb34ec0f5364eeba4bd556a7e,2/10(月) 18:10
2025-02-12,06:06,domestic,国内,24,デイリースポーツ,石破首相「バンキシャ」衝撃発言で炎上中　トランプ大統領に約束した投資１５１兆円→「民間がやること。政府が言う問題じゃない」　ネット大荒れ,https://news.yahoo.co.jp/articles/b17c531a2048c6da0fc26bdcce0e1099619d1d75,2/10(月) 13:48
2025-02-12,06:06,domestic,国内,25,毎日新聞,タイピング音がうるさい！　意外と多い職場の「音ハラ」、どう対処?,https://news.yahoo.co.jp/articles/815b05f54f74cf021d59c7fddfbb06ab707ef7c3,2/11(火) 10:00
2025-02-12,06:06,domestic,国内,26,MBSニュース,【高校無償化】与党も維新も「所得制限なし」で支援の方向…私立の無償化めぐり隔たり　大阪の現行制度から見えてくる課題とは？,https://news.yahoo.co.jp/articles/b5a50868a08df7c670a6bb0609216df551d86b2f,2/11(火) 13:00
2025-02-12,06:06,domestic,国内,27,弁護士ドットコムニュース,シンガポールで日本人初、男性受刑者に「鞭打ち刑」執行、性的暴行事件で2024年に有罪判決,https://news.yahoo.co.jp/articles/24ef512270a3684c05d296af91ddc4ee3bf6f355,2/5(水) 9:56
2025-02-12,06:06,domestic,国内,28,読売新聞オンライン,石破首相の提案に耳傾けたトランプ大統領、インド太平洋の多国間協力「大切」…つなぎとめ課題に,https://news.yahoo.co.jp/articles/1a87a8401b5f5a96b9e92b6d0ca7d74dcb5b7d5d,2/12(水) 5:00
2025-02-12,06:06,domestic,国内,29,日刊スポーツ,デヴィ夫人が新党「12（ワンニャン）平和党」代表就任、参院選に候補擁立へ　「軍師」が後押し,https://news.yahoo.co.jp/articles/d0c812f10bac2e4ebd31c8f52b69935dc1beb740,2/12(水) 5:30
2025-02-12,06:06,domestic,国内,30,ABCニュース,【徹底解説】高騰続くお米の値段　流通量の少なさは“売り渋り業者”が原因か　政府が備蓄米放出の方針も…コメ価格は今後どうなる？「さらに上昇」の最悪のシナリオとは,https://news.yahoo.co.jp/articles/824f2f86128b7cfe48c16f5bb7290357e7ae90f9,2/11(火) 19:04
2025-02-12,06:06,domestic,国内,31,日テレNEWS NNN,10人に1人──「左利き」は身近なマイノリティー　急須や調理器具…どんな不便が？　　教育現場では変化も【#みんなのギモン】,https://news.yahoo.co.jp/articles/5667fe3a95596873d76204c30940cf11e68161be,2/11(火) 10:21
2025-02-12,06:06,domestic,国内,32,J-CASTニュース,迷惑駐車注意したら「白タクじゃねーよ！」　高台寺岡林院、暴言に辟易「共存は無理だと思います」,https://news.yahoo.co.jp/articles/8f653f0c8a4b266b7f1ce145c2a509587390a469,2/11(火) 15:30
2025-02-12,06:06,domestic,国内,33,MBSニュース,【10年に1度の寒さ】17日（月）頃から再び寒波か　北陸・東海・近畿・四国・中国・九州・沖縄に気象庁が『早期天候情報』を発表,https://news.yahoo.co.jp/articles/63b868d8339d8cc394cb1db3555eeba9960386e4,2/11(火) 15:24
2025-02-12,06:06,domestic,国内,34,よろず～ニュース,国民民主・榛葉幹事長、党大会で玉木氏に異例のゲキ！「あんた必要だ」“いじり”も忘れず「訳あって…」,https://news.yahoo.co.jp/articles/6b038e7910244a8dff68055b52c4dca2f1ef6877,2/11(火) 18:40
2025-02-12,06:06,domestic,国内,35,日刊スポーツ,安倍昭恵さん、愛犬「ロン」の今後を報告「今日からは長門市の江原市長のお宅でお世話に…」,https://news.yahoo.co.jp/articles/1260379dde033807160153782b52dca9ddce0fad,2/11(火) 18:43
2025-02-12,06:06,domestic,国内,36,産経新聞,＜独自＞「もがみ型」護衛艦を豪州に派遣へ　実物で総額1兆円の輸出受注に売り込み攻勢,https://news.yahoo.co.jp/articles/9fa8660b5aebc35e09215cb33886023df4af39b0,2/11(火) 17:10
2025-02-12,06:06,domestic,国内,37,デイリースポーツ,古市憲寿氏　万博に苦言「大阪の人大丈夫なの？僕は関東の人間なんで別にいいけど」レガシー利用に的確指摘,https://news.yahoo.co.jp/articles/23a7bf710ca7119f7989e5a157f49e7c1fc9ff43,2/10(月) 14:50
2025-02-12,06:06,domestic,国内,38,TBS NEWS DIG Powered by JNN,相模原市のマンションで火事　男女2人が死亡,https://news.yahoo.co.jp/articles/358e5843a379b5765e598a89c77c3f34496bec61,2/11(火) 23:46
2025-02-12,06:06,domestic,国内,39,47NEWS,「経験」求める総合型選抜は金次第、進む教育格差　家庭環境に関係なく経験を、危機感抱いた学生団体がプロジェクトをスタート,https://news.yahoo.co.jp/articles/f36d3dbeed71670dfa06219f142f49a04b1ae596,2/11(火) 9:32
2025-02-12,06:06,domestic,国内,40,読売新聞オンライン,参院選の野党一本化「予備選」、維新が制度案を修正へ…選挙区ごとの世論調査で勝敗,https://news.yahoo.co.jp/articles/b63b6cfbc1e0ef27c365f87611ae880e0b35fdd9,2/12(水) 5:00
