scrp_date,scrp_time,genre_en,genre_jp,rank,media_jp,title,link,date_original
2025-02-12,20:06,local,地域,1,チューリップテレビ,強烈寒波「10年に一度程度」の大雪が今月2度目の可能性「北陸地方」は17日頃から　JPCZの強雪に厳重警戒【大雪と雨と風のシミュレーション】,https://news.yahoo.co.jp/articles/50c16e795b18af23153d28afcfb5d325bd23ba77,2/12(水) 15:41
2025-02-12,20:06,local,地域,2,埼玉新聞,東武東上線で人身事故　女性死亡…普通電車にはねられる　運転見合わせ、最大約2時間の遅れ　早朝の線路にいた60代の女性【鉄道情報】,https://news.yahoo.co.jp/articles/abe5dc0b03d1bc3218bb74aa56b564f6e37a8764,2/12(水) 15:46
2025-02-12,20:06,local,地域,3,埼玉新聞,またか！…来週「10年に1度の大雪」可能性高まり発表　気象庁が早期天候情報　関東北部など18日ごろから【気象情報】,https://news.yahoo.co.jp/articles/5b2e3f6dd3eb33455d40a8ece80b06a1b0ad36c9,2/10(月) 18:36
2025-02-12,20:06,local,地域,4,千葉日報オンライン,千葉知事選　熊谷氏「迷惑で、困惑している」　立花氏の「2馬力」発言受け　「当然ながら、やめていただきたい」,https://news.yahoo.co.jp/articles/4b2f486e8b719c71c87937b8bc19722faebf9f6c,2/12(水) 17:13
2025-02-12,20:06,local,地域,5,ＳＢＣ信越放送,寒波・大雪再び…「10年に一度の大雪・低温」【気象庁が早期天候情報】『大雪』2月17日頃〜長野北部、群馬北部、北陸、岐阜山間部　『低温』北陸、東海、近畿、中国、四国、九州、沖縄　【寒気のシミュレーション更新】,https://news.yahoo.co.jp/articles/65349a4bdfd090376cf5635d233d179dc3bec9b4,2/11(火) 19:21
2025-02-12,20:06,local,地域,6,MBSニュース,死亡の元県議を「知事印象操作の黒幕」とした“文書”　立花孝志氏と岸口兵庫県議で食い違う主張　維新・吉村代表は“事実関係の調査結果を近く公表”の考え,https://news.yahoo.co.jp/articles/8f393acdf8a71f69e95641b0657c459e5ae931e2,2/12(水) 16:45
2025-02-12,20:06,local,地域,7,京都新聞,【速報】大津の琵琶湖岸で見つかった遺体の身元判明　家族から不明届、死因は凍死,https://news.yahoo.co.jp/articles/2f4fd47f82b2dd2538db3c25a5395fecc603bcac,2/12(水) 19:01
2025-02-12,20:06,local,地域,8,カナロコ by 神奈川新聞,横浜の４８歳男、公園で鬼ごっこ中の小学生からゲーム機を盗んだ疑いで逮捕,https://news.yahoo.co.jp/articles/b2a8f590eb71e11d09d5c28cb2a91ee2a3fa20a4,2/12(水) 19:20
2025-02-12,20:06,local,地域,9,BSS山陰放送,大雪の国道で大型トレーラーがスリップ、大型トラック2台が巻き込まれ「立ち往生」発生…約7時間通行止めに　知事が現場視察…対策は?,https://news.yahoo.co.jp/articles/9080eb635887335cdb84494d314caf734ca23fb0,2/12(水) 17:04
2025-02-12,20:06,local,地域,10,読売テレビ,【速報】堺市で水道管の破損相次ぐ、堺区で断水「道路から泥水」美原区では通行止めも…老朽化が原因か　大阪,https://news.yahoo.co.jp/articles/475f90a5fa828981fc881dd18216145041f113d1,2/12(水) 11:53
2025-02-12,20:06,local,地域,11,TNCテレビ西日本,米高騰　“消えた21万トン”の背景に業者の買い占めか　「備蓄米」放出で騒動収束に期待　「3～4割安いところまで一気に下げていく」,https://news.yahoo.co.jp/articles/41a6b22fc81f6f2e569fee97f6f81adad2c825c4,2/12(水) 18:06
2025-02-12,20:06,local,地域,12,千葉日報オンライン,【速報】習志野の下水管で漏水　国道14号、一部で片側通行規制,https://news.yahoo.co.jp/articles/665a06a0b3978d0581279d703f2df86b76d23655,2/12(水) 17:00
2025-02-12,20:06,local,地域,13,北海道ニュースUHB,【ファイターズ】地獄の”50本ノック”で清宮幸太郎が野村佑希に怒り心頭!?　まさかのエラーで連帯責任も…「エンターテイナーだなと」,https://news.yahoo.co.jp/articles/fa8778fa8755be55bcbfc8d3c22c5efd14a9c9c5,2/12(水) 18:56
2025-02-12,20:06,local,地域,14,京都新聞,【速報】3日前に車検切れの捜査車両、検査工場まで3キロ運行,https://news.yahoo.co.jp/articles/8f6c64d8e08f419319193393f0c071bd3f17079a,2/12(水) 17:57
2025-02-12,20:06,local,地域,15,読売テレビ,【速報】悠仁さまが京都「舞鶴引揚記念館」訪問 シベリア抑留の資料を視察 単独での地方訪問は2回目,https://news.yahoo.co.jp/articles/fb49561eb55927cfc41812e285fbcd89224b1793,2/12(水) 15:56
2025-02-12,20:06,local,地域,16,京都新聞,肺移植の第一人者、京都大の元教授が渡米へ　定年後に異例、院長ポスト内定も「現役続行」選んだ理由は,https://news.yahoo.co.jp/articles/9d4fb567734cf267e7cd0c5bdc1a0e772994cbf3,2/11(火) 18:32
2025-02-12,20:06,local,地域,17,ＡＴＶ青森テレビ,【大雪情報】寒波・大雪再び…「10年に1度の大雪・かなりの低温」の可能性で日本どうなる?　13日は大荒れの天気か　その後17日〜も…　最新の大雪・雨のシミュレーションと寒気予想で見る『今後の天気』【気象庁・早期天候情報】,https://news.yahoo.co.jp/articles/7019755e6e4868f9425a913befbdb210118c5cf2,2/12(水) 15:32
2025-02-12,20:06,local,地域,18,メ〜テレ（名古屋テレビ）,名古屋の歩道で帰宅中の女性に暴行、カバン奪った疑いで20代の男2人逮捕,https://news.yahoo.co.jp/articles/6f5a66cf1ba93e98864203440b0cba705ad267a9,2/12(水) 17:54
2025-02-12,20:06,local,地域,19,仙台放送,【速報】「沼に人が浮いている」意識のない男性を発見〈仙台〉,https://news.yahoo.co.jp/articles/52efdf7e4bbe09f00a119f78c8d3d63813b42847,2/12(水) 15:17
2025-02-12,20:06,local,地域,20,メ〜テレ（名古屋テレビ）,名鉄名古屋本線、須ヶ口～名鉄一宮駅間で運転見合わせ　JR東海道線で振替輸送,https://news.yahoo.co.jp/articles/7a50996c099a4183d7d714719c7c7fbee3611d2d,2/12(水) 17:50
2025-02-12,20:06,local,地域,21,RSK山陽放送,ベテルギウスが超新星爆発する?「500光年の距離にある寿命の短い赤色巨星」地球への影響はある?【専門家が解説】,https://news.yahoo.co.jp/articles/ab28e771034b49aadba3a514d22cd270c57c01ee,2/11(火) 12:02
2025-02-12,20:06,local,地域,22,神戸新聞NEXT,産廃3460キロの処分、無許可で受託した疑い　大阪の男ら3人逮捕、三木に投棄か　兵庫県警,https://news.yahoo.co.jp/articles/693112cb36f6819c0714733c3eb09fba3d6044b5,2/12(水) 18:51
2025-02-12,20:06,local,地域,23,OBS大分放送,男性客3人に集団暴行、ビルの踊り場から突き落とす　飲食店経営の男ら4人を傷害容疑で逮捕　大分,https://news.yahoo.co.jp/articles/a45ced7b7e22557cb19759c51c181ccb0d1a1206,2/12(水) 18:17
2025-02-12,20:06,local,地域,24,テレビ新広島,ゴルフ練習場で女性のスカート内を盗撮か　プロゴルファーの男（41）逮捕　広島,https://news.yahoo.co.jp/articles/0a92636c5c514241b3f19abe80679f4d978bc6ef,2/12(水) 17:25
2025-02-12,20:06,local,地域,25,JRT四国放送,徳島市の飲食店で食中毒　患者と調理担当者からノロウイルスを検出　店は7日間の営業停止処分【徳島】,https://news.yahoo.co.jp/articles/99cc67b85e96efdfe4c0ec74fb18d672906eb2f7,2/12(水) 17:00
2025-02-12,20:06,local,地域,26,HBCニュース北海道,上から落ちて来た雪が歩いていた29歳女性に直撃「半分水のような雪が…」15階建てのビルから落雪か 札幌市中央区,https://news.yahoo.co.jp/articles/9b3ef602729f3b48cb5eff38bfd43f66abe42ce5,2/12(水) 14:53
2025-02-12,20:06,local,地域,27,埼玉新聞,大宮で20代女性ショック…暮らすアパートで深夜、知らない男性が寝ていた　女性が通報、駆け付けた警官が逮捕　男性は警察学校の教官「覚えていない」と語り…その後、理由不明の不起訴に,https://news.yahoo.co.jp/articles/4ab98d276d2904bfba42903e5770f8b0dbe5c081,2/12(水) 11:14
2025-02-12,20:06,local,地域,28,BSS山陰放送,気温上昇のあとはまた…この時期としては10年に一度程度しか起きないような「著しい低温」となる可能性　17日頃から　北陸、東海、近畿、中国、四国、九州北部、九州南部・奄美、沖縄に「低温に関する早期天候情報」,https://news.yahoo.co.jp/articles/de62cf1552bb423a563cd6f53236a32b99b01b42,2/12(水) 13:38
2025-02-12,20:06,local,地域,29,BSS山陰放送,生活保護を受けている人のフードバンク利用、国の基準より踏み込み「2回目以降を収入認定」…市民団体が中止を要望　鳥取県鳥取市,https://news.yahoo.co.jp/articles/152bb7cc308903263b35481f7081fdb4e8cc11c1,2/12(水) 15:22
2025-02-12,20:06,local,地域,30,新潟日報,「ボツリヌス菌」で新潟市の女性が重い食中毒　「要冷蔵」を常温保存、ブルーチーズのような味やにおい,https://news.yahoo.co.jp/articles/0da3f3dc78e198514225be249986dc4af2a27d83,2/12(水) 10:02
2025-02-12,20:06,local,地域,31,RSK山陽放送,市立病院に勤める女性看護師（23）「減給10分の1」1か月の処分　自転車と接触し7日間のけがをさせるも警察署と職場へ報告せず【香川・高松市】,https://news.yahoo.co.jp/articles/d2f99118220390a6770e58950bae7bb9cdfcc98e,2/12(水) 16:28
2025-02-12,20:06,local,地域,32,HBCニュース北海道,【北海道・公立高校入試】出願変更後の最新倍率　全日制普通で札幌平岸1.8倍　札幌東と札幌国際情報が1.6倍、市立札幌旭丘と苫小牧東1.5倍、札幌南は1.3倍、札幌西1.4倍、札幌北1.2倍（全日・定時全校一覧）,https://news.yahoo.co.jp/articles/b1da0b3db30341dcfb6d38792153a28ba39afbb8,2/12(水) 16:37
2025-02-12,20:06,local,地域,33,MBSニュース,PR会社「メルチュ」側を家宅捜索...ポイントは「見積額の変遷」と「ボランティアしてくれると知った時期」　斎藤知事側による買収はあった？それともセーフ？【専門家解説】,https://news.yahoo.co.jp/articles/babbe59bcf86759172b8cd98632db2e5f5c18777,2/12(水) 8:03
2025-02-12,20:06,local,地域,34,南日本新聞,ヘッドホン自転車、スマホ運転…楽しいのは当事者だけ　ながら運転の恐ろしさを際立たせた表情が秀逸、小3が描いたポスターが全国大賞,https://news.yahoo.co.jp/articles/5bf09bcf9685e727e2c965a5b95c0e95290acbcc,2/12(水) 15:03
2025-02-12,20:06,local,地域,35,MRO北陸放送,すし王国はどっち?支出額 金沢市は4位、富山市が首位に 背景にはブランド戦略,https://news.yahoo.co.jp/articles/4171edce00f30ca613334e4df5157bc579b1a508,2/12(水) 18:44
2025-02-12,20:06,local,地域,36,高知さんさんテレビ,桜井つぐみ選手が高知大大学院に合格、春から拠点を高知に,https://news.yahoo.co.jp/articles/4a50cb8bd26678be3f74c6c66034702c448b9a8d,2/12(水) 18:40
2025-02-12,20:06,local,地域,37,メ〜テレ（名古屋テレビ）,生活保護費392万円を不正に受給した疑いで64歳の女を逮捕　三重県警,https://news.yahoo.co.jp/articles/9382372c1dfc3e44c196f636ba29bc98ab9bb3c0,2/12(水) 17:25
2025-02-12,20:06,local,地域,38,ぎふチャンDIGITAL,覚せい剤を使用した疑い　４７歳の男を逮捕　岐阜・大垣署,https://news.yahoo.co.jp/articles/8f3a3312518e001470ee5ce66eef6d104ad80142,2/12(水) 18:22
2025-02-12,20:06,local,地域,39,南海放送,「もう全滅です」大雪で100棟近くのビニールハウスが被害…費用高く再建断念するかんきつ農家も【愛媛】,https://news.yahoo.co.jp/articles/7f27e7e18c15b8cdee55e2222dd00e97cd63dcb8,2/12(水) 17:13
2025-02-12,20:06,local,地域,40,NBC長崎放送,【寒波襲来】2月17日頃から「かなりの低温」　沖縄、九州、四国、中国、近畿、東海、北陸で気温急降下　寒気シミュレーション,https://news.yahoo.co.jp/articles/32daa2c551eb940c0aea6cce44ec33ff08a88ef8,2/12(水) 18:02
