scrp_date,scrp_time,genre_en,genre_jp,rank,media_jp,title,link,date_original
2024-01-14,15:22,TTL,総合,1,ENCOUNT,大手事務所からデビュー→わずか3年で芸能界引退　53歳になった元アイドルが33年ぶり復活「忘れ物取りに帰りたい」,https://news.yahoo.co.jp/articles/50f4a582b71fe8411722972fd5c31d5f92f1f76e,1/14(日) 11:10
2024-01-14,15:22,TTL,総合,2,オリコン,上沼恵美子、松本人志に忖度なし「真っ赤な嘘では私はないと思ってる」「女やってるんで、吐きそうになったの」とも,https://news.yahoo.co.jp/articles/f2d2c8eda10722294c68725e47ec7bdbb52fcc1d,1/14(日) 12:45
2024-01-14,15:22,TTL,総合,3,スポーツ報知,デーブ・スペクター氏、「サンジャポ」で松本人志「性行為強要疑惑」報道に見解…「あれだけのむちゃなパーティー…いずれトラブルになる」,https://news.yahoo.co.jp/articles/2bc2d79f7b860aabc5a98f269fbae6a3d3a3aa5e,1/14(日) 11:07
2024-01-14,15:22,TTL,総合,4,ねとらぼ,能登半島地震により海底が“隆起”→すさまじい様子を収めた写真に「自然の脅威を感じる」,https://news.yahoo.co.jp/articles/f893910ce2b847102c27f02bd58f96d3f7b9217c,1/13(土) 21:00
2024-01-14,15:22,TTL,総合,5,オリコン,太田光、松本人志からの被害訴えた人へ「自分を責める必要はまったくない」　松本への思いも含めて5分間熱弁【ほぼ全文掲載】,https://news.yahoo.co.jp/articles/ae09ebfad9e6af684ea048d81a1fef0bde26d6ba,1/14(日) 10:52
2024-01-14,15:22,TTL,総合,6,中日スポーツ,松本人志の活動休止、『ワイドナショー』『サンデー・ジャポン』を視聴者ら比較 「今日だけはサンジャポが見やすかったね」「ワイドナはどうしても擁護する方向に」,https://news.yahoo.co.jp/articles/d0efcb60799dd73a214155f964a20c18f7c9c1af,1/14(日) 13:40
2024-01-14,15:22,TTL,総合,7,デイリースポーツ,宮城が２９年ぶり優勝　アンカー小海が兵庫を逆転　「２日前にオーダー変更」　都道府県対抗女子駅伝,https://news.yahoo.co.jp/articles/e428dbd810406c30a9e12d2d00b787cfaa3d593d,1/14(日) 14:47
2024-01-14,15:22,TTL,総合,8,ほ・とせなNEWS,妊娠8ヶ月で我が子に障がいがあると気づいた母　現在は日々の暮らしに役立つ情報を多くの人へ発信,https://news.yahoo.co.jp/articles/ff9528b6b75f5bb54c14b854c6d416537ccbdcf6,1/14(日) 11:30
2024-01-14,15:22,TTL,総合,9,スポニチアネックス,ドルーリー朱瑛里　2区で8人抜き！初対決の田中希実に36秒及ばず区間5位,https://news.yahoo.co.jp/articles/6945d907851bb774a0b024629acac1d1a5d0e7df,1/14(日) 13:04
2024-01-14,15:22,TTL,総合,10,中日スポーツ,松本人志の性加害疑惑、『なんで今更』論に安藤優子が私見 「同意かな」「事実有りきで…」視聴者ら賛否,https://news.yahoo.co.jp/articles/b538f8a0b24e3f5837164162737e1755c2a9066e,1/14(日) 12:05
2024-01-14,15:22,TTL,総合,11,日刊スポーツ,【ジャンプ】伊藤有希が今季２勝目　２回目で129・5 メートル の大飛躍　大倉山で初優勝,https://news.yahoo.co.jp/articles/03fd803e742a41486e54fa1a7c09f4a95867dbdd,1/14(日) 14:14
2024-01-14,15:22,TTL,総合,12,47NEWS,「命だけは助かった」でも…残された荷物はどうなった？　羽田の航空機炎上事故、避難した乗客が語る「その後」,https://news.yahoo.co.jp/articles/96485f5b138d5d57aac5247e1dae1191c8654247,1/13(土) 10:32
2024-01-14,15:22,TTL,総合,13,デイリースポーツ,さんま　松本人志の活動休止決断に「俺は子供のため、と思う」、誘った芸人が「悩んでる」と気遣いも,https://news.yahoo.co.jp/articles/dd2cc0cd24619ad9ecef6ed36b8372cd4b565f5e,1/13(土) 22:22
2024-01-14,15:22,TTL,総合,14,ねとらぼ,授業参観の度に「かっこいい」と言われた父親が10年後……　「時間止まってる？」と驚愕の声がやまない父子の姿が870万再生,https://news.yahoo.co.jp/articles/173a9633f130eeabfd45525f3c92cc43f09a8478,1/13(土) 21:30
2024-01-14,15:22,TTL,総合,15,Full-Count,田中将大、被災地支援でマットレス100本を石川県に寄付　「少しでも力に」球団発表,https://news.yahoo.co.jp/articles/73c44834fb87bf774cc073c2ea12f170d4d15777,1/14(日) 11:04
2024-01-14,15:22,TTL,総合,16,日刊ゲンダイDIGITAL,松本人志さんが週刊文春を名誉毀損で提訴…勝訴なら損害賠償は過去最高額級に？【「表と裏」の法律知識】,https://news.yahoo.co.jp/articles/2353d30bfc61b330056d8794adb5edf76db9ad8a,1/14(日) 9:06
2024-01-14,15:22,TTL,総合,17,中日スポーツ,鈴木紗理奈、かつて交際のたむらけんじから『松本人志のために店を予約』と聞いた過去 「こういう合コンだったんだと思うと…」,https://news.yahoo.co.jp/articles/ded1867c451b6f67dfe70bbbe50895fb903457c8,1/14(日) 11:57
2024-01-14,15:22,TTL,総合,18,中日スポーツ,松本人志めぐる性加害報道、デーブ・スペクターが私見「これは無茶すぎますよ。いずれトラブルになるに決まってる」,https://news.yahoo.co.jp/articles/a79559bbf782cc5fa706a3fc8becc6e1cde7a3fc,1/14(日) 11:34
2024-01-14,15:22,TTL,総合,19,日刊スポーツ,太田光「仲悪いけど」松本人志エール「王様が転げ落ちる物語を自分が面白いと思ってつくれれば」,https://news.yahoo.co.jp/articles/eee75ea89f0b1292dbecb9df1a05abc08cb52649,1/14(日) 12:13
2024-01-14,15:22,TTL,総合,20,Hint-Pot,手で持つより楽　両手が使えて安全な水の運搬方法　警視庁のアイデアに称賛　「余計なものもない」,https://news.yahoo.co.jp/articles/2024701fb05419c635e150e771ed0334e32e0b7c,1/14(日) 13:54
2024-01-14,15:22,TTL,総合,21,Full-Count,最大11億円…日本で失敗しても手に入る大金　ハム助っ人“電撃復帰”もたらした契約条件,https://news.yahoo.co.jp/articles/a5439187af78139b13d08d50982becf18896dcc4,1/14(日) 11:26
2024-01-14,15:22,TTL,総合,22,Hint-Pot,6万8000円の高額福袋　“厨二病心”くすぐるバッグが入っていたと話題に　収まったのはおにぎり2個と…,https://news.yahoo.co.jp/articles/20cca9e4e5cbec4f90b4c95b2225fcec87457b41,1/14(日) 9:24
2024-01-14,15:22,TTL,総合,23,BSS山陰放送,認知症の妻が突然失踪、行方不明から5か月…夫は写真に語りかける日々　半年すぎて見つかる確率は0.1％未満も「私は諦めきれない」,https://news.yahoo.co.jp/articles/67f0b8f5123a7d1483e8cdde31d6c919c8eb8c4e,1/14(日) 11:06
2024-01-14,15:22,TTL,総合,24,ねとらぼ,坂上忍、「ペット犠牲」の羽田空港事故で私見　“モノ扱い”へ指摘するも「乗せる乗せないという選択をするのは人間」「航空会社をどうのとは思わない」,https://news.yahoo.co.jp/articles/0fe2ce9e364e4d7a0f6b0c862d790a0d538fa174,1/14(日) 14:16
2024-01-14,15:22,TTL,総合,25,月刊陸上競技,これが世界の走り！2区・田中希実が19人抜きで兵庫トップへ 区間記録届かず「祐梨子さんは偉大」山本有真が2位、ドルーリー5位／都道府県女子駅伝,https://news.yahoo.co.jp/articles/997191cf920f9cba33ae757fd1230d95b09c3b59,1/14(日) 13:27
2024-01-14,15:22,TTL,総合,26,LIMO,コンビニで受け取った千円札に強烈な違和感　手持ちの千円と比較した結果に思わず目を疑う,https://news.yahoo.co.jp/articles/9302a591d4ece8f2cb492bc92d7917434b386dee,1/11(木) 18:32
2024-01-14,15:22,TTL,総合,27,モデルプレス,東野幸治、松本人志「ワイドナ」出演取りやめに言及,https://news.yahoo.co.jp/articles/5b0f22b788cf8742774c90327c5fde659e3146f1,1/14(日) 10:46
2024-01-14,15:22,TTL,総合,28,スポニチアネックス,八村塁　6試合ぶり復帰戦でいきなり躍動！豪快ダンクなど17得点も…レイカーズは2連敗,https://news.yahoo.co.jp/articles/69bc907f4d418c933a12a56a43153f9fd56216e3,1/14(日) 14:01
2024-01-14,15:22,TTL,総合,29,ENCOUNT,鈴木紗理奈、元恋人たむらけんじを「きもい」　松本人志と女性の飲み会をセッティングで失望,https://news.yahoo.co.jp/articles/1f0b0738fec00116dd52932211445f11a1978941,1/14(日) 11:11
2024-01-14,15:22,TTL,総合,30,よろず～ニュース,偽札？それとも？ コンビニのお釣りから明らかにサイズが異なる千円札が発見され話題に,https://news.yahoo.co.jp/articles/7f2b04f081b4375b1b0e90c7e2b46e36611b4162,1/14(日) 12:00
2024-01-14,15:22,TTL,総合,31,オリコン,上沼恵美子、過去に松本人志から直接謝罪…「ところが今回どうしたん？」先輩として自身の希望をカメラ越し発信,https://news.yahoo.co.jp/articles/682fcc92f5c985a8cb3a4def2d2c51763018bbfc,1/14(日) 13:07
2024-01-14,15:22,TTL,総合,32,スポーツ報知,鈴木紗理奈、「サンジャポ」で「元カレ」たむらけんじから聞いた松本人志にまつわる秘話を告白…「松本さんが大阪に来る時にお店を予約」,https://news.yahoo.co.jp/articles/55327566c5b6278703441dae854d7ccd1ee67f17,1/14(日) 11:32
2024-01-14,15:22,TTL,総合,33,CBCテレビ,南海トラフ巨大地震が発生したら8分・最大16mの津波が予想される三重・大紀町　津波避難タワーの備えを聞いた,https://news.yahoo.co.jp/articles/30e67974080aefdb93ed0e36ff998900dd9f2c83,1/14(日) 7:02
2024-01-14,15:22,TTL,総合,34,ENCOUNT,トヨタ会長が愛車コレクション披露　激レアセンチュリー＆まさかの“トヨタじゃない”愛車に広がる驚き,https://news.yahoo.co.jp/articles/46ec078653c39494d5299e8288370a78bf0fc12f,1/14(日) 10:20
2024-01-14,15:22,TTL,総合,35,47NEWS,４年で戦力外通告、でも「意外とスッと入ってきた」　国立大学から中日の育成選手になった左腕が見た「プロの投手の凄み」,https://news.yahoo.co.jp/articles/bb9ddfbb8e46f4707d52e74fc3077f3a39d2fa84,1/14(日) 10:02
2024-01-14,15:22,TTL,総合,36,ねとらぼ,粗品、元騎手からの批判に口座残高をさらして挑発　テロップに「なあ藤田伸二」,https://news.yahoo.co.jp/articles/fe72dbec75ea6aa2519084e89fff0bc7419e4d54,1/13(土) 21:01
2024-01-14,15:22,TTL,総合,37,スポーツ報知,和田アキ子、「おまかせ」で小沢一敬が一転、活動自粛に至った「ホリプロコム」対応を謝罪…「どうもすみませんでした、ホリプロとして」,https://news.yahoo.co.jp/articles/5e5ce8096cd836dbe0ea3a6c8aa95389ca6efc15,1/14(日) 12:28
2024-01-14,15:22,TTL,総合,38,ファイナンシャルフィールド,「ロレックス」ってなんで高いんですか？ 腕時計に「300万円」は高すぎるように感じますし、シルバーで似たような時計が「2000円」くらいで売っていると思うのですが…,https://news.yahoo.co.jp/articles/a68e7946092fb1f55579ce3a426112f52979eb22,1/14(日) 13:50
2024-01-14,15:22,TTL,総合,39,RONSPO,「わだかまりが尾を引く」和田毅“プロテクト漏れ騒動”でごちゃついたソフトバンクが空中分解の危機？…元ヤクルト編成部長が指摘,https://news.yahoo.co.jp/articles/b7849ec67ef71845c8981be9f7b61bbfc895e7f7,1/14(日) 6:31
2024-01-14,15:22,TTL,総合,40,読売新聞オンライン,島根県で唯一のデパート閉店…隣県の百貨店長に危機感「同じ山陰でがんばってきた、さびしい」,https://news.yahoo.co.jp/articles/1d888e59a0d1545b38f35603354d3dfef45b1741,1/14(日) 12:43
