scrp_date,scrp_time,genre_en,genre_jp,rank,media_jp,title,link,date_original
2025-11-06,01:08,sports,スポーツ,1,デイリースポーツ,真美子さん爆笑の理由が判明　大谷が指さした先にあった「メッセージ」をＭＬＢ公式が公開　「ほっこりする雰囲気」と反響,https://news.yahoo.co.jp/articles/12f4147f66946cb608d46239ad91eed28c1a0049,11/5(水) 22:25
2025-11-06,01:08,sports,スポーツ,2,サンケイスポーツ,村上宗隆の獲得に東海岸の強豪2球団が乗り出す可能性　地元メディア報じる　日本野手史上最高185億円規模の契約予想も,https://news.yahoo.co.jp/articles/2dd296dc4b8fcffec5afea734505b7c8dbdb6731,11/5(水) 23:30
2025-11-06,01:08,sports,スポーツ,3,東スポWEB,ドジャース大谷翔平の真美子夫人が持つ〝旧型ｉＰｈｏｎｅ〟が話題「７億ドルの妻がなぜ…」,https://news.yahoo.co.jp/articles/20cd288cf3c0b462ad29e38b039abf27646d8da7,11/5(水) 12:05
2025-11-06,01:08,sports,スポーツ,4,デイリースポーツ,ベッツ家主催の豪華優勝パーティー　高級シャンパンタワー、ケーキタワー、激カワの本拠地ケーキも　奥さま続々公開「何て楽しいの？」,https://news.yahoo.co.jp/articles/e57b5eb55a81ba1c938d10639b3916b733c20c5d,11/5(水) 17:31
2025-11-06,01:08,sports,スポーツ,5,デイリースポーツ,「キケも翔平も試合後に点滴をしていた」ロバーツ監督　死闘ＷＳの舞台裏明かす　１８回の第３戦、スミスは「１３回で足がつり始めた」,https://news.yahoo.co.jp/articles/b62512ed9d0e4d3c7f1347be7531be068db207b6,11/5(水) 19:42
2025-11-06,01:08,sports,スポーツ,6,スポニチアネックス,“巨人最強助っ人”72歳のクロマティさんは4年前から闘病　車いす生活の支えは32歳下の妻と5歳の息子,https://news.yahoo.co.jp/articles/036f40e8957978f30763bf8efa7c0127a70a6daf,11/5(水) 21:34
2025-11-06,01:08,sports,スポーツ,7,Full-Count,山本由伸が残した衝撃「今まで見たことはない」　フリーマンも称賛…忘れぬ光景,https://news.yahoo.co.jp/articles/71f7682889e2e510607038482192b8e581154601,11/5(水) 21:30
2025-11-06,01:08,sports,スポーツ,8,デイリースポーツ,死闘ＷＳ舞台裏　山本由伸のブルペン準備で明かされた衝撃エピソード　同僚が明かす「うわ、この男、完全にスイッチが入ったなと」,https://news.yahoo.co.jp/articles/9ab95005265553e2377544fa4d302865185ca351,11/5(水) 23:12
2025-11-06,01:08,sports,スポーツ,9,CoCoKARAnext,「真美子夫人が最高の反応！」米誌も注目　優勝パレード中に起きた大谷への衝撃プロポーズに真美子夫人が見せた“神対応”が話題「仲の良さが伝わる心温まる一幕」,https://news.yahoo.co.jp/articles/01ab1e761f98a9fffeb3e140ea1fac2009acf0f7,11/5(水) 17:46
2025-11-06,01:08,sports,スポーツ,10,デイリースポーツ,ドジャース４選手が米トーク番組出演　危険？なキケのポーズにファン大ウケ「礼儀正しく見えるｗ」「面白すぎる」,https://news.yahoo.co.jp/articles/453a81f38881b601274390a674cde204207513ca,11/5(水) 18:12
2025-11-06,01:08,sports,スポーツ,11,Full-Count,村上宗隆、ド軍入団なら仰天の起用法も　「ごまかしながら」マンシーと併用、米メディア提案,https://news.yahoo.co.jp/articles/d5694fe14d2b648659079323b0a8b46898e226b0,11/5(水) 19:59
2025-11-06,01:08,sports,スポーツ,12,日刊スポーツ,【ソフトバンク】周東佑京が選手会長卒業へ「自分が大変というよりも、楽しかったのが一番」,https://news.yahoo.co.jp/articles/b65e03dbcf9669e336048f2c0a2ab85ed5abd76a,11/5(水) 19:50
2025-11-06,01:08,sports,スポーツ,13,Full-Count,山本由伸の1球が、意外な“タイトル獲得”に　専門家が勝手に選定「最悪の誤審」,https://news.yahoo.co.jp/articles/12e34fb2dab3630b91366c97eca5da2ec21d0b57,11/5(水) 22:03
2025-11-06,01:08,sports,スポーツ,14,スポーツ報知,米人気番組でド軍ナインがＷＳ舞台裏明かす「ヤマモトはロボットでは？」司会質問にロバーツ監督「ショウヘイと同じで…」,https://news.yahoo.co.jp/articles/612bdc1b9027639d06700fb6bf49a303c976915e,11/5(水) 19:42
2025-11-06,01:08,sports,スポーツ,15,デイリースポーツ,レアル・ソシエダードの久保建英　けがの状態「現状は５０％」代表招集＆ひとり暮らしの影響にも言及,https://news.yahoo.co.jp/articles/e6d2e86aeac1d2cd5b175ce80629374fb881c80e,11/5(水) 19:19
2025-11-06,01:08,sports,スポーツ,16,デイリースポーツ,巨人　石塚、荒巻ら４選手が豪州ＷＬへ出発　石塚「結果を出せるような取り組みを」,https://news.yahoo.co.jp/articles/f67bd976ea83b6c487258a6eadfd46521ef5a429,11/5(水) 22:05
2025-11-06,01:08,sports,スポーツ,17,Full-Count,ド軍優勝パレードから一夜…米放送局から“残酷な報せ”　突きつけられた現実に「終わった」,https://news.yahoo.co.jp/articles/f5500283a074fd4ebca3346ee8aae695343bbfc0,11/5(水) 11:12
2025-11-06,01:08,sports,スポーツ,18,西スポWEB OTTO！,「ぎゃる!」〝イチローさん打ち取った女子高生〟4年後の姿に驚きの声「分かんなかった」「めっちゃいい」,https://news.yahoo.co.jp/articles/a8282df292f6a767dce73a4111b80f2bd027a87f,11/5(水) 23:30
2025-11-06,01:08,sports,スポーツ,19,スポニチアネックス,【RIZIN】会見終了後にBD選手が乱入…ネット怒り「場違いすぎ」「最悪の悪手」「未来に泥を塗った」,https://news.yahoo.co.jp/articles/93c1cefa0c046b79aa6970eee97df41aba6a5fb2,11/5(水) 20:10
2025-11-06,01:08,sports,スポーツ,20,サッカーキング,G大阪が4連勝でACL2決勝T進出を決める！…美藤倫の1点守り抜き敵地でナムディンFC撃破,https://news.yahoo.co.jp/articles/341d25bd0a4608acaff9852b04cae28888cecac2,11/5(水) 23:11
2025-11-06,01:08,sports,スポーツ,21,中日スポーツ,ドジャースのキケ・ヘルナンデス、タトゥー入りのお尻とツーショット「誰だと思う？」　同僚のミゲル・ロハスも反応,https://news.yahoo.co.jp/articles/719dbb2b1af71fd5ff361aa27e9eed4ef5febf9b,11/5(水) 23:06
2025-11-06,01:08,sports,スポーツ,22,スポーツ報知,【広島】ドラフト１位の平川蓮が教育実習デビューもまさかの通告「戦力外」恩師の有倉監督から激辛採点,https://news.yahoo.co.jp/articles/f269abaed041552fb35dfe71c410e27ef142338f,11/5(水) 18:31
2025-11-06,01:08,sports,スポーツ,23,ABEMA TIMES,元侍ジャパン・山口俊「アスリートのセカンドキャリアって全然夢がない」 ちゃんこ鍋店等で年商4億円＆上場目指す,https://news.yahoo.co.jp/articles/d78bc68ad6a6b3d0f5d0d6c30c21edadec252aa3,11/5(水) 18:00
2025-11-06,01:08,sports,スポーツ,24,スポーツ報知,【侍ジャパン】辞退者が“ドミノ状態”に　日本ハム・伊藤大海がコンディション不良　３日にはロッテ・種市ら３人が辞退,https://news.yahoo.co.jp/articles/3eae1310939301b6739349640b8b3ae94fb7d619,11/5(水) 10:25
2025-11-06,01:08,sports,スポーツ,25,スポーティングニュース日本版,シェーン・ビーバーが残留を決意｜ブルージェイズの2026年の展望・課題は？,https://news.yahoo.co.jp/articles/e4b7ab7aa53c866fb516d738836a2c693bb6e4c9,11/6(木) 0:09
2025-11-06,01:08,sports,スポーツ,26,CoCoKARAnext,「60-60でもやらないと勝てなくないか？」MVP最終候補の大谷翔平をMLBアナリストらが絶賛 ボンズ超えも「可能性ある」,https://news.yahoo.co.jp/articles/d9f826bc5b3159db0f8821802d953633a9c71e15,11/5(水) 19:10
2025-11-06,01:08,sports,スポーツ,27,中日スポーツ,天皇賞・秋で武豊「馬は本当に良くなった」　「逃げた馬33秒1で上がったのに6着…昔なら考えられなかった」,https://news.yahoo.co.jp/articles/cf35813f7c2bdac8a6b4392f22a67bc1509a2d05,11/5(水) 18:09
2025-11-06,01:08,sports,スポーツ,28,J-CASTニュース,大谷翔平に「僕のママと結婚して」　ファンからのまさかの要求に真美子さんの反応は...「ラブラブですね」「可愛すぎ」,https://news.yahoo.co.jp/articles/923f34cc7b76d4510eb10d52df7dd1be554e104b,11/5(水) 16:15
2025-11-06,01:08,sports,スポーツ,29,ENCOUNT,【RIZIN】朝倉未来、4年ぶり大みそかでタイトル戦　“無敗王者”シェイドゥラエフと対戦決定に観客大歓声,https://news.yahoo.co.jp/articles/020e44ea226cc0f144c626bbc17dd6b21f5d68a1,11/5(水) 18:36
2025-11-06,01:08,sports,スポーツ,30,ABEMA TIMES,何が起きた…？ 山本由伸、極限状態で“まさかの光景”「現代のサムライ」相手主砲に見せた”ある行動”が話題に「人間性もMVP」,https://news.yahoo.co.jp/articles/75584d300274535da4fc0cc7cb1808d45fbbfa7f,11/5(水) 22:00
2025-11-06,01:08,sports,スポーツ,31,東スポWEB,ダルビッシュ有に地元司会者が暴言「引退しないことはパドレスにとって痛手だ」,https://news.yahoo.co.jp/articles/b7f61358581f7f0f4901e0eb03c6f2acb0ee3e1d,11/5(水) 16:45
2025-11-06,01:08,sports,スポーツ,32,ゲキサカ,神戸が蔚山を直接下してACLE首位に浮上!大迫躍動、決勝点はパトリッキ,https://news.yahoo.co.jp/articles/9e4400c68f8be19d1b9608b9b889ccc24de3246d,11/5(水) 20:57
2025-11-06,01:08,sports,スポーツ,33,スポニチアネックス,ロッテ「サンデー晋吾」長女の立大・小野マネが日本ハムの球団職員に！ドラ1明大・大川慈英と共闘宣言,https://news.yahoo.co.jp/articles/9e564d3b00aaa0c7b02a55ea94a622b46441782c,11/5(水) 16:58
2025-11-06,01:08,sports,スポーツ,34,Full-Count,大谷翔平に「見ないでって」　真美子夫人が目隠しした理由…まさかの要求にファン爆笑,https://news.yahoo.co.jp/articles/21732d0de4555bc9d1ce6cd9b510367a68e37985,11/5(水) 16:16
2025-11-06,01:08,sports,スポーツ,35,スポニチアネックス,セ・リーグが26年日程発表　開幕カード開催権は24年上位3チーム　2位の阪神がビジター開幕の訳は？,https://news.yahoo.co.jp/articles/6a0c896b27d9f6a0e520789d89303776da6a31e4,11/5(水) 22:32
2025-11-06,01:08,sports,スポーツ,36,中日スポーツ,元木大介さん、メジャー移籍目指す巨人・岡本和真のオススメ球団は「やっぱりピンストライプよ」理由は巨人4番の大先輩の存在「困ったら相談できる」,https://news.yahoo.co.jp/articles/3e9c70886a1d27d5a4c9accd083d21857a5f837d,11/5(水) 21:23
2025-11-06,01:08,sports,スポーツ,37,西スポWEB OTTO！,「会食中なのに…」DeNA南場智子オーナーのスマホ画面が話題「ちゃんとチェックしてるんやな」「野球オタクでかわいい」「親近感が湧きます」,https://news.yahoo.co.jp/articles/f9eb033dddad596328c3b321f6070c63812e75d1,11/5(水) 22:20
2025-11-06,01:08,sports,スポーツ,38,デイリースポーツ,大谷夫妻とベッツ夫妻が仲良く談笑　記念撮影待つ間に壇上で　真美子夫人が大笑いするシーンも,https://news.yahoo.co.jp/articles/b9f839ab0f36cf2a043e5e82d6f7235444589900,11/4(火) 6:43
2025-11-06,01:08,sports,スポーツ,39,Full-Count,大谷翔平は「絶対にしないって」　真美子夫人が思わず目隠し…珍要求に米メディア爆笑,https://news.yahoo.co.jp/articles/ef236b908d3493fbb5d7764a119f079037a2256b,11/5(水) 11:42
2025-11-06,01:08,sports,スポーツ,40,Full-Count,通算2730安打男が“変貌”「かっこいい」　引退しても変わらぬ姿に思わず「社会人1年目かな？」,https://news.yahoo.co.jp/articles/74b4d30d18005249b1f43cc4ac019b6c42b054cb,11/5(水) 19:43
