scrp_date,scrp_time,genre_en,genre_jp,rank,media_jp,title,link,date_original
2025-11-06,06:06,sports,スポーツ,1,デイリースポーツ,真美子さん爆笑の理由が判明　大谷が指さした先にあった「メッセージ」をＭＬＢ公式が公開　「ほっこりする雰囲気」と反響,https://news.yahoo.co.jp/articles/12f4147f66946cb608d46239ad91eed28c1a0049,11/5(水) 22:25
2025-11-06,06:06,sports,スポーツ,2,サンケイスポーツ,村上宗隆の獲得に東海岸の強豪2球団が乗り出す可能性　地元メディア報じる　日本野手史上最高185億円規模の契約予想も,https://news.yahoo.co.jp/articles/2dd296dc4b8fcffec5afea734505b7c8dbdb6731,11/5(水) 23:30
2025-11-06,06:06,sports,スポーツ,3,デイリースポーツ,死闘ＷＳ舞台裏　山本由伸のブルペン準備で明かされた衝撃エピソード　同僚が明かす「うわ、この男、完全にスイッチが入ったなと」,https://news.yahoo.co.jp/articles/9ab95005265553e2377544fa4d302865185ca351,11/5(水) 23:12
2025-11-06,06:06,sports,スポーツ,4,スポニチアネックス,阪神が西武戦力外の元山飛優を調査　今オフ補強第1弾は小技巧みな26歳内野手,https://news.yahoo.co.jp/articles/bad3326ec5eaf681a17153e41ae1f50b673635b5,11/6(木) 5:15
2025-11-06,06:06,sports,スポーツ,5,CoCoKARAnext,「最悪のフルシーズンとなった」ド軍20億円、PS登板なし　38歳救援右腕の去就に米注目「現役続行なら、大幅減俸は避けられない」,https://news.yahoo.co.jp/articles/18d5c62e31fed87b795baf96a9039c32221a892f,11/6(木) 5:00
2025-11-06,06:06,sports,スポーツ,6,東スポWEB,ドジャース大谷翔平の真美子夫人が持つ〝旧型ｉＰｈｏｎｅ〟が話題「７億ドルの妻がなぜ…」,https://news.yahoo.co.jp/articles/20cd288cf3c0b462ad29e38b039abf27646d8da7,11/5(水) 12:05
2025-11-06,06:06,sports,スポーツ,7,東スポWEB,【Ｆ１】角田裕毅に対するレッドブルのお粗末対応が波紋「旅行管理に対する批判が巻き起こった」＝海外メディア,https://news.yahoo.co.jp/articles/32946a957b594cede080b4d59ee74cedf3be708e,11/6(木) 5:15
2025-11-06,06:06,sports,スポーツ,8,スポニチアネックス,西武・今井達也　米で“ネクスト山本由伸”評価爆上がり 8年292億円　ポスティング容認へ最終段階,https://news.yahoo.co.jp/articles/45424ce49b60a7eb69463a01bc776216c69c75eb,11/6(木) 3:00
2025-11-06,06:06,sports,スポーツ,9,Full-Count,ド軍優勝パレードから一夜…米放送局から“残酷な報せ”　突きつけられた現実に「終わった」,https://news.yahoo.co.jp/articles/f5500283a074fd4ebca3346ee8aae695343bbfc0,11/5(水) 11:12
2025-11-06,06:06,sports,スポーツ,10,スポーツ報知,慶大・常松広太郎がカブスとマイナー契約で合意　ゴールドマン・サックス内定も野球継続へ　４番も務めた右の強打者,https://news.yahoo.co.jp/articles/498a37c99bfe7e201894a854d596fa98bf36711d,11/6(木) 4:00
2025-11-06,06:06,sports,スポーツ,11,スポーツ報知,巨人・重信慎之介が引退　１０月に戦力外　現役続行希望もオファーなく…３２歳巨人一筋１０年,https://news.yahoo.co.jp/articles/81ba6d9fb091af2658d5be4f42433d5e10afab11,11/6(木) 4:00
2025-11-06,06:06,sports,スポーツ,12,テレ東スポーツ,ロバーツ監督 「ヤマモトはロボットかもしれない」山本由伸はアメリカでもすでに伝説となりつつある,https://news.yahoo.co.jp/articles/1af397901bcebe81d97f6c2b1c6f6475eb32726f,11/6(木) 0:38
2025-11-06,06:06,sports,スポーツ,13,スポニチアネックス,“巨人最強助っ人”72歳のクロマティさんは4年前から闘病　車いす生活の支えは32歳下の妻と5歳の息子,https://news.yahoo.co.jp/articles/036f40e8957978f30763bf8efa7c0127a70a6daf,11/5(水) 21:34
2025-11-06,06:06,sports,スポーツ,14,スポーツ報知,森保ジャパンにサプライズ！２１歳ＦＷ北野颯太が日本代表初招集へ　今季オーストリア１部ザルツブルクで１０戦４発,https://news.yahoo.co.jp/articles/76ce74235d93e2c27de749b9a8be20721f4f17b9,11/6(木) 2:00
2025-11-06,06:06,sports,スポーツ,15,デイリースポーツ,巨人　石塚、荒巻ら４選手が豪州ＷＬへ出発　石塚「結果を出せるような取り組みを」,https://news.yahoo.co.jp/articles/f67bd976ea83b6c487258a6eadfd46521ef5a429,11/5(水) 22:05
2025-11-06,06:06,sports,スポーツ,16,東スポWEB,大谷翔平、山本由伸、佐々木朗希が〝解任危機〟のロバーツ監督を救った！ＷＳ連覇で名将に評価激変,https://news.yahoo.co.jp/articles/8451003b375a8876bbf269f4f3d9c2c1e8fab9c3,11/6(木) 5:15
2025-11-06,06:06,sports,スポーツ,17,スポーティングニュース日本版,「スタメンの余地はほとんどない」ドジャース、期待のプロスペクトの扱いに困る!? トレード放出にも無視できないリスクが,https://news.yahoo.co.jp/articles/edaf6c4469b609003871813a3d3ffda588348d91,11/6(木) 2:00
2025-11-06,06:06,sports,スポーツ,18,デイリースポーツ,ベッツ家主催の豪華優勝パーティー　高級シャンパンタワー、ケーキタワー、激カワの本拠地ケーキも　奥さま続々公開「何て楽しいの？」,https://news.yahoo.co.jp/articles/e57b5eb55a81ba1c938d10639b3916b733c20c5d,11/5(水) 17:31
2025-11-06,06:06,sports,スポーツ,19,CoCoKARAnext,ロバーツ監督が大谷翔平を「史上最高の選手」と主張 米人気番組でべた褒め「人々は偉大なものを見たい」,https://news.yahoo.co.jp/articles/3cc04de9abd527c199217798170b7dc616f38d4d,11/6(木) 5:30
2025-11-06,06:06,sports,スポーツ,20,デイリースポーツ,レアル・ソシエダードの久保建英　けがの状態「現状は５０％」代表招集＆ひとり暮らしの影響にも言及,https://news.yahoo.co.jp/articles/e6d2e86aeac1d2cd5b175ce80629374fb881c80e,11/5(水) 19:19
2025-11-06,06:06,sports,スポーツ,21,日刊スポーツ,【解説】今永昇太FAで争奪戦へ　QO次第で移籍先変化　ダルビッシュ来季不在パドレスなど候補か,https://news.yahoo.co.jp/articles/f1ceeea0fc5ec8c72c6dee6ed141d01377d01884,11/6(木) 4:55
2025-11-06,06:06,sports,スポーツ,22,スポーティングニュース日本版,フィリーズのハリソン・ベイダーがオプトアウトを決意しフリーエージェントに,https://news.yahoo.co.jp/articles/f3655a716971790d8ccf551c89de3726bc39a418,11/6(木) 0:39
2025-11-06,06:06,sports,スポーツ,23,スポニチアネックス,【RIZIN】会見終了後にBD選手が乱入…ネット怒り「場違いすぎ」「最悪の悪手」「未来に泥を塗った」,https://news.yahoo.co.jp/articles/93c1cefa0c046b79aa6970eee97df41aba6a5fb2,11/5(水) 20:10
2025-11-06,06:06,sports,スポーツ,24,日刊スポーツ,「サンデー晋吾」元ロッテ小野晋吾氏長女の立大・馨子マネジャーが日本ハムに球団職員で入社へ,https://news.yahoo.co.jp/articles/4e1a550de5fb1b52c5eab1ec3723f850cbc8aa93,11/6(木) 5:00
2025-11-06,06:06,sports,スポーツ,25,日刊スポーツ,【ソフトバンク】周東佑京が選手会長卒業へ「自分が大変というよりも、楽しかったのが一番」,https://news.yahoo.co.jp/articles/b65e03dbcf9669e336048f2c0a2ab85ed5abd76a,11/5(水) 19:50
2025-11-06,06:06,sports,スポーツ,26,ABEMA TIMES,何が起きた…？ 山本由伸、極限状態で“まさかの光景”「現代のサムライ」相手主砲に見せた”ある行動”が話題に「人間性もMVP」,https://news.yahoo.co.jp/articles/75584d300274535da4fc0cc7cb1808d45fbbfa7f,11/5(水) 22:00
2025-11-06,06:06,sports,スポーツ,27,サッカーキング,G大阪が4連勝でACL2決勝T進出を決める！…美藤倫の1点守り抜き敵地でナムディンFC撃破,https://news.yahoo.co.jp/articles/341d25bd0a4608acaff9852b04cae28888cecac2,11/5(水) 23:11
2025-11-06,06:06,sports,スポーツ,28,サンケイスポーツ,巨人に新・師弟！坂本勇人が”2世”石塚裕惺の自主トレ同行志願を受諾　ソフトバンク・秋広優人も,https://news.yahoo.co.jp/articles/d3d0069106920d9e3510bc3c7039f192ab346984,11/6(木) 5:00
2025-11-06,06:06,sports,スポーツ,29,FITNESS LOVE,リバウンド続きだった24歳　運動の習慣化に成功し“砂時計ボディ”を作り上げる【筋トレ】,https://news.yahoo.co.jp/articles/3d6aa30f846964518c73b5cef784d48e1ba081bb,11/6(木) 4:30
2025-11-06,06:06,sports,スポーツ,30,Full-Count,山本由伸の1球が、意外な“タイトル獲得”に　専門家が勝手に選定「最悪の誤審」,https://news.yahoo.co.jp/articles/12e34fb2dab3630b91366c97eca5da2ec21d0b57,11/5(水) 22:03
2025-11-06,06:06,sports,スポーツ,31,サンケイスポーツ,巨人戦力外の重信慎之介が現役引退を決断「次に進むしかない」　今後は事業家志望,https://news.yahoo.co.jp/articles/06959f2d45498bcce4ae562a336ff6b2d92e52b6,11/6(木) 5:00
2025-11-06,06:06,sports,スポーツ,32,テレ東スポーツ,「どこからともなくNBA選手にダンクされたようにパヘスが飛んできた」キケが語る命懸けのスーパーキャッチの真実,https://news.yahoo.co.jp/articles/3b0527d9109e1e0f241eea5496b48fe231cb6a4d,11/6(木) 1:13
2025-11-06,06:06,sports,スポーツ,33,ゴング格闘技,【RIZIN】榊原CEO「朝倉未来にシェイドゥラエフに『挑んでほしい』と話して、未来も『行く』と腹を決めてくれたのが3日、4日前」「決まらなければ『サトシvs.シェイドゥラエフ』だった」「未来は十分勝機はあると踏んで上がる」「『残酷な結果』には──」,https://news.yahoo.co.jp/articles/ce73a6c168356c99cb174b0b5e560b659f0b269f,11/5(水) 23:58
2025-11-06,06:06,sports,スポーツ,34,スポーツ報知,【侍ジャパン】辞退者が“ドミノ状態”に　日本ハム・伊藤大海がコンディション不良　３日にはロッテ・種市ら３人が辞退,https://news.yahoo.co.jp/articles/3eae1310939301b6739349640b8b3ae94fb7d619,11/5(水) 10:25
2025-11-06,06:06,sports,スポーツ,35,西スポWEB OTTO！,「ぎゃる!」〝イチローさん打ち取った女子高生〟4年後の姿に驚きの声「分かんなかった」「めっちゃいい」,https://news.yahoo.co.jp/articles/a8282df292f6a767dce73a4111b80f2bd027a87f,11/5(水) 23:30
2025-11-06,06:06,sports,スポーツ,36,日刊スポーツ,キケ・ヘルナンデス妻、ダンスパーティーでマタニティーショット　夫はフリーマンダンス引き出す,https://news.yahoo.co.jp/articles/e8dcd69960860a376ba8bb48813fc6dff1289506,11/6(木) 4:55
2025-11-06,06:06,sports,スポーツ,37,ENCOUNT,【RIZIN】朝倉未来、4年ぶり大みそかでタイトル戦　“無敗王者”シェイドゥラエフと対戦決定に観客大歓声,https://news.yahoo.co.jp/articles/020e44ea226cc0f144c626bbc17dd6b21f5d68a1,11/5(水) 18:36
2025-11-06,06:06,sports,スポーツ,38,サッカー批評Web,柏FWが示した「日本代表FW上田綺世を超える」可能性、広島は「さらなるカップ戦制覇」へ【ルヴァン杯決勝で「変貌を遂げた」柏、新兵器を「手に入れた」広島】（3）,https://news.yahoo.co.jp/articles/995716628e65dbd823f4c17bd350df32e4b7dbef,11/6(木) 5:00
2025-11-06,06:06,sports,スポーツ,39,J-CASTニュース,大谷翔平に「僕のママと結婚して」　ファンからのまさかの要求に真美子さんの反応は...「ラブラブですね」「可愛すぎ」,https://news.yahoo.co.jp/articles/923f34cc7b76d4510eb10d52df7dd1be554e104b,11/5(水) 16:15
2025-11-06,06:06,sports,スポーツ,40,ゲキサカ,神戸が蔚山を直接下してACLE首位に浮上!大迫躍動、決勝点はパトリッキ,https://news.yahoo.co.jp/articles/9e4400c68f8be19d1b9608b9b889ccc24de3246d,11/5(水) 20:57
