scrp_date,scrp_time,genre_en,genre_jp,rank,media_jp,title,link,date_original
2025-03-03,10:34,domestic,国内,1,日テレNEWS NNN,"関東37自治体で水道料金値上げ “40％増の街”も困惑の声…""老朽化""水道管の補修現場は今『every.気になる！』",https://news.yahoo.co.jp/articles/a4a46d4b67adeb62bbe4171baa09be0f92c94d2c,3/2(日) 15:58
2025-03-03,10:34,domestic,国内,2,弁護士JPニュース,30代シングルマザー「息子の高校“入学金”が払えない」“高校授業料無償化”の落とし穴…母子が行政の“たらい回し”の果て「生活保護」選んだ理由,https://news.yahoo.co.jp/articles/42f65df81f1c3aba3e5efef984eb748ff7b81c36,3/2(日) 9:02
2025-03-03,10:34,domestic,国内,3,中日スポーツ,泉房穂さん、橋下徹さん「アホか！」「テメーが」”罵倒”に「新鮮だ」「それだけ追い込まれているのか」皮肉っぽくかわす,https://news.yahoo.co.jp/articles/452f67d72373e721129ec5d9928248c84b8266e4,3/2(日) 20:30
2025-03-03,10:34,domestic,国内,4,よろず～ニュース,野村修也氏、不信任決議後の兵庫百条委は「正当化する機関に」なった　「ネットに騙された」報道は愚民扱い,https://news.yahoo.co.jp/articles/872afa371fa2e60aa8f11d9d48d7bca6b3205842,3/3(月) 7:20
2025-03-03,10:34,domestic,国内,5,TBS NEWS DIG Powered by JNN,【速報】埼玉・草加市の国道でトレーラーが中央分離帯乗り越え建物に衝突　運転手の男性が軽傷,https://news.yahoo.co.jp/articles/c9545819c1f6cc577a77a6c7aa6137c7011c8a67,3/3(月) 9:41
2025-03-03,10:34,domestic,国内,6,読売新聞オンライン,１０億円かけた虐待判定ＡＩ、こども家庭庁が導入見送り…ミス６割で「実用化困難」,https://news.yahoo.co.jp/articles/2e93e428378fcb71b80fb0aa5bd1d4b5606fe0d7,3/3(月) 5:00
2025-03-03,10:34,domestic,国内,7,47NEWS,「知らなければ、子を殺し死んでいた」　性被害で妊娠、家族に明かせず思い詰め、たどり着いた熊本の病院で内密出産,https://news.yahoo.co.jp/articles/2e4fc5a9582feddf69a0129258728db80b02912c,3/3(月) 9:02
2025-03-03,10:34,domestic,国内,8,ABEMA TIMES,“ガソリン減税法案”提出へ 立憲・野田代表「少数与党政権の意味を思い知らせる」,https://news.yahoo.co.jp/articles/029626a412a8468b6b3ab4f31cd5c307e6086409,3/3(月) 7:22
2025-03-03,10:34,domestic,国内,9,デイリースポーツ,藤井聡太棋王　３連勝防衛で歴代５位タイのタイトル通算２７期　番勝負通算１００勝で脅威の勝率８割超,https://news.yahoo.co.jp/articles/b14e6dcda7b12291ade9b68670ceba52e68b7480,3/2(日) 20:59
2025-03-03,10:34,domestic,国内,10,産経新聞,トルコビザ免除、継続か停止か　第3の道「ビザ取得勧奨措置」の可能性はあるか　「移民」と日本人,https://news.yahoo.co.jp/articles/990dea435553d8de42167c0b5a942998c60914c6,3/3(月) 7:00
2025-03-03,10:34,domestic,国内,11,東海テレビ,近鉄特急「ひのとり」と夜の踏切で男性が衝突し死亡 約2時間運転見合わせ 踏切は正常に作動,https://news.yahoo.co.jp/articles/0e6ee722a66c7e48cb3ce55fc6eb4981bc9c6698,3/3(月) 6:01
2025-03-03,10:34,domestic,国内,12,読売新聞オンライン,飢えた牛がかじった柱、真っ黒な物体にギンバエ…「やってはいけないことをしてしまった」,https://news.yahoo.co.jp/articles/f8f62f9e3948b8ebf464f2ba6abdfa5b70253e3c,3/2(日) 19:54
2025-03-03,10:34,domestic,国内,13,毎日新聞,悠仁さま、きょう成年の記者会見　家族と歩んだ18年を振り返る,https://news.yahoo.co.jp/articles/2862eb6a43613d4bb2a6abc5cec22b59617a25cf,3/3(月) 5:00
2025-03-03,10:34,domestic,国内,14,読売新聞オンライン,ＪＲ東日本子会社「アトレ」、テナント契約を一方的に変更か…公取委が独禁法違反の疑いで警告へ,https://news.yahoo.co.jp/articles/46037389870ccd6c071c60e4cdabe94fce62f4fa,3/3(月) 6:33
2025-03-03,10:34,domestic,国内,15,ABEMA TIMES,「力不足を痛感」増田康宏八段、タイトル戦初挑戦はストレート敗退 藤井聡太棋王との激闘にファンは労い「ハイレベルだった」「また挑戦者に」,https://news.yahoo.co.jp/articles/d02e8eee778c98ff0db1a7a8302bec17f2c6717c,3/3(月) 7:22
2025-03-03,10:34,domestic,国内,16,tenki.jp,3日は全国的に風が強まる　九州は30メートルの暴風も　北風に雨・雪で真冬の寒さ,https://news.yahoo.co.jp/articles/4334b951ce04e20d12d8bf66596c06a25cb61c80,3/3(月) 9:30
2025-03-03,10:34,domestic,国内,17,日刊スポーツ,【棋王戦】谷川浩司17世名人驚き「22歳の人に追いつかれる想像つかず」藤井棋王タイトル通算27期,https://news.yahoo.co.jp/articles/b8cfbd0413f35ea789164bbdc3a75c2660e2c71d,3/2(日) 21:23
2025-03-03,10:34,domestic,国内,18,共同通信,福岡のマンションで男女2人死亡,https://news.yahoo.co.jp/articles/032f4c721f1784e8a53b8ecf6b32286afa371b54,3/3(月) 7:43
2025-03-03,10:34,domestic,国内,19,朝日新聞,関西万博、学校の不参加相次ぐ　大阪は半年で10万人減　不安広がる,https://news.yahoo.co.jp/articles/99d2854e1cfe351702b7fe4143aae9536759b6b9,3/2(日) 20:00
2025-03-03,10:34,domestic,国内,20,テレビ朝日系（ANN）,越谷市の住宅で50歳女が母親に蹴るなど暴行か　傷害容疑で逮捕　母親は死亡　埼玉県警,https://news.yahoo.co.jp/articles/bf1535769077d866c1a8c244373a0ab5e876bb40,3/3(月) 9:33
2025-03-03,10:34,domestic,国内,21,TBS NEWS DIG Powered by JNN,「私の私物を盗んだと思ったから」母親に顔を蹴るなどの暴行を加えけがさせた傷害の疑い　同居の50歳娘を逮捕　母親はその場で死亡,https://news.yahoo.co.jp/articles/a76881388ef0296dc2d139c648470b117b97b6dd,3/3(月) 9:07
2025-03-03,10:34,domestic,国内,22,読売新聞オンライン,市が黒に統一した無償配布のランドセル…「特定の性別をイメージさせる色分けは現代に合わない」「好きな色選べたらもっと良かった」,https://news.yahoo.co.jp/articles/4e536d0084e4db7faa507cb739629f2a4306f4a7,3/2(日) 21:21
2025-03-03,10:34,domestic,国内,23,共同通信,【独自】鉄道塗料から基準値超えの石綿　大手メーカーが「非含有」と販売,https://news.yahoo.co.jp/articles/2aeb75dfbc92c9bad87ab2ea7b1fc37acb721197,3/2(日) 21:00
2025-03-03,10:34,domestic,国内,24,TBS NEWS DIG Powered by JNN,【速報】JR青梅線　青梅駅－奥多摩駅間の上下線で午前10時ごろから夕方頃まで運転見合わせへ　降雪が見込まれる影響　JR東日本,https://news.yahoo.co.jp/articles/1ad09e103e0d560109efe296bf4b99ca5d22c0cc,3/3(月) 9:46
2025-03-03,10:34,domestic,国内,25,産経新聞,「NHK会長としてしっかり謝罪を」N党浜田聡氏、軍艦島映像は「島民ならず国民を侮辱」,https://news.yahoo.co.jp/articles/5bdfbedd5e4d0aacd467d262c1b2de1945049639,3/3(月) 7:00
2025-03-03,10:34,domestic,国内,26,毎日新聞,高齢者の1人暮らしを支えて「燃え尽きる」ケアマネ,https://news.yahoo.co.jp/articles/89c5f483244c2445cfda50b1f981f2896c804d58,3/3(月) 7:46
2025-03-03,10:34,domestic,国内,27,FNNプライムオンライン,「左手がない猿がいた」と110番通報相次ぐ…東京・足立区と葛飾区で猿の目撃情報、昨日2日だけで両区に計25件以上,https://news.yahoo.co.jp/articles/99ff20e2510fac083e16d041cf95b3c596a957aa,3/3(月) 9:09
2025-03-03,10:34,domestic,国内,28,共同通信,岩手山火事2100ヘクタールに　日々拡大、鎮火見通し立たず,https://news.yahoo.co.jp/articles/9cf211a952e0a2ebf896fbac087ebd1b55223941,3/3(月) 9:11
2025-03-03,10:34,domestic,国内,29,共同通信,アトレがテナント契約を一方的に変更か,https://news.yahoo.co.jp/articles/73b00ef948f8af6fa589672094a699b85f034d5d,3/3(月) 9:03
2025-03-03,10:34,domestic,国内,30,日刊スポーツ,【ひふみんアイ】藤井聡太棋王は立て直し急務、指し手の切れ味鈍り気がかり　指し直しはやむなし,https://news.yahoo.co.jp/articles/54abfe1643c0d405f5d21079f09ace93908d607c,3/2(日) 21:14
2025-03-03,10:34,domestic,国内,31,東海テレビ,2/21に関空へ帰国後に…名古屋に住む20代女性に“はしか”感染判明「はま寿司1国豊明店」を2/27に利用,https://news.yahoo.co.jp/articles/c885b25cac0312f779fa5a2076afb1324ff6d800,3/2(日) 21:00
2025-03-03,10:34,domestic,国内,32,共同通信,自民が4日の予算案採決提案、野党応じず,https://news.yahoo.co.jp/articles/9520f1bc14a9dde38f57772ed98e19306d73a396,3/3(月) 9:18
2025-03-03,10:34,domestic,国内,33,テレビ朝日系（ANN）,「私の私物を盗んだ」足で蹴るなど暴行加え…77歳母親死亡　50歳娘逮捕,https://news.yahoo.co.jp/articles/9af2fc5501351b00967e77b881fec10f495b5237,3/3(月) 10:01
2025-03-03,10:34,domestic,国内,34,中日スポーツ,中国出身・石平さん『参院選出馬断念』報道に橋下徹さん、「維新らしい候補だったのに」「形だけで保守を叫ぶ人たちって結局」　Xでもさまざまな意見,https://news.yahoo.co.jp/articles/edff213500a757009948d336a8fcc00ed1f49a2b,3/2(日) 17:50
2025-03-03,10:34,domestic,国内,35,共同通信,野党、予算案採決応じず　自民4日提案、招致要求,https://news.yahoo.co.jp/articles/a9ce0813cbc3d99ac1677226b77464456437b750,3/3(月) 9:55
2025-03-03,10:34,domestic,国内,36,中日スポーツ,泉房穂さん、堀江貴文さんの「努力しようぜみんな。お前が貧乏なのは」主張に反論 「だから政治が必要なんだと思う」,https://news.yahoo.co.jp/articles/d3a8d5dbbaed75010b243975a5b57ed08f854d47,3/1(土) 13:35
2025-03-03,10:34,domestic,国内,37,朝日新聞,秋篠宮家の長男悠仁さま、初記者会見へ　愛子さま、佳子さまの時は,https://news.yahoo.co.jp/articles/2782351742cab05eecdd558ee86ee39e879f540b,3/2(日) 18:00
2025-03-03,10:34,domestic,国内,38,時事通信,予算修正案、立・維の対応焦点　衆院通過、なお不透明,https://news.yahoo.co.jp/articles/a68af13663e8e849e88abb9582c460008369b98e,3/3(月) 7:02
2025-03-03,10:34,domestic,国内,39,共同通信,テナント契約一方的変更か　アトレに公取委警告へ,https://news.yahoo.co.jp/articles/48ff0e60beb521d0b6b6cd18e9ce29f985b4ab29,3/3(月) 9:07
2025-03-03,10:34,domestic,国内,40,読売新聞オンライン,福井のかみつきイルカ、発信器で居場所監視へ…５０針以上縫った海水浴客も,https://news.yahoo.co.jp/articles/ace5181786ef275a7622e643f49d2bf347ae7695,2/24(月) 12:01
