scrp_date,scrp_time,genre_en,genre_jp,rank,media_jp,title,link,date_original
2025-04-17,18:07,TTL,総合,1,スポニチアネックス,俳優の板垣瑞生さんが死去　24歳　突然の訃報にネット衝撃「嘘だと言ってよ」「早すぎる…」,https://news.yahoo.co.jp/articles/21678e382806a082405a78f10e5894d665bd6b7d,4/17(木) 14:55
2025-04-17,18:07,TTL,総合,2,デイリースポーツ,俳優の板垣瑞生さんが死去　２４歳　１月から「行方不明」で警察が遺体発見と　家族がＳＮＳで報告,https://news.yahoo.co.jp/articles/4c2bfcafcaa1fae51ee440b6513ba5aa1e85ad43,4/17(木) 14:36
2025-04-17,18:07,TTL,総合,3,日刊スポーツ,板垣瑞生さん不慮の事故で死去、24歳　１月末から行方不明「ソロモンの偽証」「正直不動産２」,https://news.yahoo.co.jp/articles/82b412153bddede8a2eeb3326f8da7ba2886cd71,4/17(木) 14:28
2025-04-17,18:07,TTL,総合,4,テレビ朝日系（ANN）,【訃報】俳優の板垣瑞生さん、24歳　事務所を退所し、今年１月から行方不明だった,https://news.yahoo.co.jp/articles/a228e4f9de20f0121b50bef7b798fff11439492d,4/17(木) 14:46
2025-04-17,18:07,TTL,総合,5,スポーツ報知,俳優の板垣瑞生さん死去、２４歳　ＳＮＳで家族が発表「不慮の事故により」…大河「花燃ゆ」「麒麟がくる」など出演,https://news.yahoo.co.jp/articles/ab7b4abe943c4a95ec626363b00864c5ef962fc8,4/17(木) 13:54
2025-04-17,18:07,TTL,総合,6,ABEMA TIMES,大谷翔平、今季初137メートル特大先頭打者アーチでキング争いトップに！ドジャースは初回7点の猛攻で3連勝,https://news.yahoo.co.jp/articles/56aa9404afa34c5a3a93a94b8022bd9b4a5b278d,4/17(木) 14:02
2025-04-17,18:07,TTL,総合,7,ハフポスト日本版,井戸田潤、明石家さんまも愛する名古屋の名物ラーメンを大絶賛！「世の中で1番うまい」！！,https://news.yahoo.co.jp/articles/22afc3ed4f9a0014c4b3ddebf38fac9870d4c5dc,4/17(木) 14:40
2025-04-17,18:07,TTL,総合,8,スポニチアネックス,板垣瑞生さんが死去、24歳　最後のインスタ本人投稿は24年12月に「来年も俳優として…」,https://news.yahoo.co.jp/articles/f391dd689b7fa9246dd8ad14e9ac7ea51ff7fef9,4/17(木) 14:51
2025-04-17,18:07,TTL,総合,9,スポニチアネックス,山本舞香　義兄の誕生日に貴重ツーショ「HappyBirthday　Brother」,https://news.yahoo.co.jp/articles/aa87d48518de45648d26855e70e8e641c4fced32,4/17(木) 15:56
2025-04-17,18:07,TTL,総合,10,J-CASTニュース,バドミントン志田千陽、「まるでアイドル」肩出し大胆ドレス姿　「まぶしすぎる美しさ」に悶絶,https://news.yahoo.co.jp/articles/e576a330d87d0fe6231b9f7ac1ad6ebb4a613bc5,4/17(木) 11:49
2025-04-17,18:07,TTL,総合,11,埼玉新聞,食中毒…客23人が嘔吐下痢　洋菓子店のケーキ、どら焼きプリンを食べて　「朝から体調不良」と通報　食べたのは保育園職員や家族…園児は食べていなかった　店員3人からノロウイルス検出、営業停止に,https://news.yahoo.co.jp/articles/e559cb37984af8ff0744fa643784dc1dced8b7a5,4/17(木) 14:44
2025-04-17,18:07,TTL,総合,12,デイリースポーツ,バレー男子日本代表４３人発表　パリ五輪後代表休養意向の西田有志、代表引退示唆の高橋健太郎、山内晶大も選出　初選出１１人　ティリ監督「困難や不確定要素は承知の上」【一覧】,https://news.yahoo.co.jp/articles/1834d809138f82289baeece5549c68ca043c0269,4/17(木) 15:10
2025-04-17,18:07,TTL,総合,13,ABEMA TIMES,西田議員「回りくどいんだよね、答弁が」と呆れ…1月利上げ→メガバンク3000億円の儲けに「日銀が上げてくれたから利益が出るのはちょっとおかしいんじゃないか？」国会で追及,https://news.yahoo.co.jp/articles/d1b91e0c8d5ccae38e55873db92ad25297c253aa,4/17(木) 12:31
2025-04-17,18:07,TTL,総合,14,ABEMA TIMES,24時間ジムで「宿泊」 寝袋を持参＆シャワー室に5時間 “出張時のホテル代わり”にする人まで…運営者は困惑,https://news.yahoo.co.jp/articles/899c34ef8f63ab9796eaa9138185744c0ae3372d,4/17(木) 12:03
2025-04-17,18:07,TTL,総合,15,SPAIA AI競馬,【皐月賞枠順】ホープフルS勝ち馬クロワデュノールは5枠10番　きさらぎ賞快勝のサトノシャイニングは8枠16番,https://news.yahoo.co.jp/articles/20a712d1cc1b2ae42154c221410ba3e679f2c827,4/17(木) 14:28
2025-04-17,18:07,TTL,総合,16,映画.com,板垣瑞生さん、不慮の事故で死去　NHK大河「麒麟がくる」、朝ドラ「エール」、「正直不動産」などに出演,https://news.yahoo.co.jp/articles/9a97fd26845da5636c3b5083a19003b4aa90919d,4/17(木) 15:46
2025-04-17,18:07,TTL,総合,17,みんかぶマガジン,不祥事がノンストップに出るわ出るわ！石橋貴明氏、青木実氏…フジテレビは本当に再発防止できるのか「栄華を誇っていたものは衰退していく」,https://news.yahoo.co.jp/articles/1cad7004b9d57b7e5ef6e9b23d224dc1b92a8780,4/17(木) 9:10
2025-04-17,18:07,TTL,総合,18,日刊スポーツ,大物歌手も憤り「日本が舐められている事が如実」高速道での「中国人女性２人」寝そべり画像,https://news.yahoo.co.jp/articles/3e9783474e1a3ad65f6003f34cfafbfa104d97b7,4/17(木) 12:24
2025-04-17,18:07,TTL,総合,19,ほ・とせなNEWS,母「遊びに行くならメモ残しておいて」小4男児におねがいしたら　残されたメモに「めちゃくちゃかわいい」「尊い」「嬉しいけど…」,https://news.yahoo.co.jp/articles/36d7779db6789f472abc8892d26cc9ba671b1499,4/16(水) 11:00
2025-04-17,18:07,TTL,総合,20,スポニチアネックス,ヤクルト・村上宗隆が復帰即スタメン「4番・右翼」プロ初の外野で先発出場　上半身コンデ不良から復活,https://news.yahoo.co.jp/articles/a3c21b3863565379dcee4f20fdfee4325e44439b,4/17(木) 17:17
2025-04-17,18:07,TTL,総合,21,FBC 福井放送,昨夜福井市内で事故　道路を横断していた86歳女性が軽自動車にはねられ死亡,https://news.yahoo.co.jp/articles/5ddb7dc239fc0780919bbc689bcd0ee8239f0f47,4/17(木) 8:03
2025-04-17,18:07,TTL,総合,22,スポニチアネックス,俳優の板垣瑞生さん死去　24歳　つづっていた事務所退所の経緯「前事務所の皆様のお心遣いに非常に感謝」,https://news.yahoo.co.jp/articles/9a4636da23bc99ce75adf578245ce368642bc30e,4/17(木) 15:07
2025-04-17,18:07,TTL,総合,23,J-CASTニュース,首都高でフェラーリ火災、実は人気YouTuberが同乗　納車1時間後の悲劇「えぐい」「無事でよかった」,https://news.yahoo.co.jp/articles/c71c901e28129b0cec3d1e849485b6297f1040f1,4/17(木) 16:22
2025-04-17,18:07,TTL,総合,24,ねとらぼ,飲み終えた“コーヒーかす”→捨てずに石と混ぜると、1カ月後……　「感動」目からウロコの裏ワザに「やってみよう」,https://news.yahoo.co.jp/articles/4671a8c49e1f9a76a4cf94afc5dab4417d484a1a,4/16(水) 12:05
2025-04-17,18:07,TTL,総合,25,ほ・とせなNEWS,妊娠が判明。しかしその後…医者「ん？」見せてもらったエコーに「え？」「思わず声が出た」「驚きを隠せない」,https://news.yahoo.co.jp/articles/d7dcd81ea6cf11ef2fc4463eeda7c68beeb51618,4/17(木) 16:03
2025-04-17,18:07,TTL,総合,26,シネマトゥデイ,遺体で発見された39歳の「ゴシップガール」女優、死因が判明,https://news.yahoo.co.jp/articles/0c46da9fb2414956da13d1a3ff0e022ecb0b8b6e,4/17(木) 10:28
2025-04-17,18:07,TTL,総合,27,日刊スポーツ,へずまりゅう「轢いたらドライバーが悪くなるんだろ？」高速道での「中国人女性２人」寝そべりに,https://news.yahoo.co.jp/articles/ef294604cd37cd1c1fc2e61a7be4d7b58d578fe7,4/17(木) 14:59
2025-04-17,18:07,TTL,総合,28,日刊スポーツ,「この発言は知事としてどう？」吉村洋文知事の万博無料招待めぐる記事への“ひとこと”投稿に,https://news.yahoo.co.jp/articles/fae1425854d76d357595e6a65fdc8a74c943e2a9,4/17(木) 14:20
2025-04-17,18:07,TTL,総合,29,ねとらぼ,マクドナルド、次回ハッピーセットコラボに「争奪戦すごそう」　品切れや転売の懸念も「1個でいいから欲しい」「たくさん作って」,https://news.yahoo.co.jp/articles/60f83506366574e59c9575f5bcb98f44ef06c02d,4/16(水) 9:09
2025-04-17,18:07,TTL,総合,30,よろず～ニュース,関西ラジオ界の大御所アナが難病の疑い告白「こんなこと言うてええかわからんけど…」,https://news.yahoo.co.jp/articles/fbf24bc152a6343f1e4e11efe652741324002afe,4/17(木) 14:12
2025-04-17,18:07,TTL,総合,31,RONSPO,なぜ横浜DeNAバウアーは巨人に通用しないのか…「サインにクビを振るシーンが目立つ」岡本和真に2打席連続本塁打を浴びるなど5失点…2年前も3発被弾で7失点,https://news.yahoo.co.jp/articles/108f3d64f53388e14882c5ac1a98eb149cb19f2a,4/17(木) 6:39
2025-04-17,18:07,TTL,総合,32,毎日新聞,1000円着服→退職金1200万円不支給は適法　市バス元運転手の敗訴確定,https://news.yahoo.co.jp/articles/4a5d5c9968df759dc166cb5e54507f6fdecbcd46,4/17(木) 15:01
2025-04-17,18:07,TTL,総合,33,スポーツ報知,元ＲＡＧ　ＦＡＩＲ「おっくん」激変した現在の姿…「驚いた」「衝撃」「脱退したの」保育士として働く姿も,https://news.yahoo.co.jp/articles/16d1a4048482ff805a8e896aa835d81216fbefed,4/17(木) 10:55
2025-04-17,18:07,TTL,総合,34,ENCOUNT,「男は触るな！」AED論争での一部女性意見に「理解できません」　車いすアイドルが語る投稿の真意,https://news.yahoo.co.jp/articles/22a3fca06b848119a2455ac858b976026ff7339f,4/17(木) 13:43
2025-04-17,18:07,TTL,総合,35,ENCOUNT,「俺もやられた」メルカリで相次ぐ詐欺被害　「バズらないと平気で放置」対応に不満続出…補償が可能なケースとは,https://news.yahoo.co.jp/articles/563f19a15a15855b6e8d38ce23c93d7c82ca658b,4/17(木) 16:03
2025-04-17,18:07,TTL,総合,36,朝日新聞,トランプ大統領と赤沢氏会談「格下と話をしてくれて感謝」,https://news.yahoo.co.jp/articles/7a48e3cf0250bbd3f90cdbbcd3f5e4bdc6476b0e,4/17(木) 7:08
2025-04-17,18:07,TTL,総合,37,Full-Count,ロバーツ監督が6失点右腕に苦言「もっと上手に」　狙われた変化球「戦えるだけの力がない」,https://news.yahoo.co.jp/articles/c6344362d76ffc251d572b2db232e5b438938a0b,4/17(木) 15:09
2025-04-17,18:07,TTL,総合,38,Full-Count,大谷翔平、WBC出場へ意欲「選んでいただけるなら光栄」　ド軍は“容認モード”…ジャッジらは参加決定,https://news.yahoo.co.jp/articles/bde13368191b0a6ac8f62e3d7a0819d6c1ba01b3,4/17(木) 14:14
2025-04-17,18:07,TTL,総合,39,Full-Count,マイナーでも防御率19点台…元楽天右腕が“自由契約”　米で復活も、34歳に厳しい現実,https://news.yahoo.co.jp/articles/595771bdae7764b54c73fd863524da2ec845fd95,4/17(木) 13:13
2025-04-17,18:07,TTL,総合,40,デイリースポーツ,佐藤仁美　最近めちゃくちゃ大喧嘩した有名芸人の実名「テメエなんか誰も知らねえよ！バーカ！」「金も払わねーくせして」　砲撃浴びた芸人に爆笑,https://news.yahoo.co.jp/articles/f7b766a64e0965e42e7d99853116a3d7e8c9c774,4/17(木) 15:51
