scrp_date,scrp_time,genre_en,genre_jp,rank,media_jp,title,link,date_original
2025-10-28,19:08,domestic,国内,1,中日スポーツ,小泉進次郎防衛相、討論番組での変わりように視聴者ら五度見 「農水相の時と違いすぎ」「ホンモノか？」「別人かと」,https://news.yahoo.co.jp/articles/2b5947f540f131bb1140d1de4d58743f3467253f,10/28(火) 14:15
2025-10-28,19:08,domestic,国内,2,関西テレビ,【速報】参政党「国旗損壊罪」提出に吉村・維新代表「ひと声かけてくれれば良かったのに」,https://news.yahoo.co.jp/articles/9eec72670d1d100b6515615f53947fab549d9903,10/28(火) 15:36
2025-10-28,19:08,domestic,国内,3,J-CASTニュース,目頭抑える茂木外相の姿にネット注目　トランプ米大統領「シンゾーは素晴らしい友人」、高市首相を前に哀悼,https://news.yahoo.co.jp/articles/03d6a9883b16e6b42a6c09582e347b067f3c759a,10/28(火) 16:15
2025-10-28,19:08,domestic,国内,4,テレビ朝日系（ANN）,トランプ大統領　約6年ぶり来日も…異例の総理主催夕食会“開催なし”の理由,https://news.yahoo.co.jp/articles/e7b94221df25986ba74f7bcbfe315e0414fb96ac,10/28(火) 16:36
2025-10-28,19:08,domestic,国内,5,BuzzFeed Japan,高市首相があたふた？ 隣のトランプ氏が“急停止”→冷静に対応、和やかな会談に「高市さんほんと上手い」,https://news.yahoo.co.jp/articles/46ba72fdfa33a0548da00b7790b1753772276086,10/28(火) 13:25
2025-10-28,19:08,domestic,国内,6,日刊スポーツ,高市早苗首相が珍しいパンツスーツ姿　午前から「お召し替え」トランプ氏とヘリ同乗で横須賀に,https://news.yahoo.co.jp/articles/2fd077616f1e78726d88ebae7cac8039adc31399,10/28(火) 16:53
2025-10-28,19:08,domestic,国内,7,ハフポスト日本版,高市首相の投稿に国内外から批判。「加害の歴史にこそ目を向けるべき」などの声,https://news.yahoo.co.jp/articles/f7bd289b821f4e9ba0e2e21c3b4ef87a3c31afbe,10/28(火) 17:03
2025-10-28,19:08,domestic,国内,8,読売新聞オンライン,クマ被害相次ぐ秋田県知事、自衛隊派遣を要請…小泉防衛相「危機的な事態」と陸自連絡員を派遣へ,https://news.yahoo.co.jp/articles/29fe081dac2be5aa59b4306a8ebb6bac7234933f,10/28(火) 11:42
2025-10-28,19:08,domestic,国内,9,スポーツ報知,デーブ・スペクター氏、トランプ大統領のご機嫌ぶりの理由を分析「逆に日本に来てリラックスできるんですよ」,https://news.yahoo.co.jp/articles/893fa1ebf572524748a85637717b35a87e64e376,10/28(火) 16:59
2025-10-28,19:08,domestic,国内,10,読売新聞オンライン,クマに襲われた８３歳女性「頭だけは守ろう」と防御姿勢…致命傷負わずに助かる,https://news.yahoo.co.jp/articles/3dd81899a98605b46e2011c5577cf13fb725fbdc,10/28(火) 16:46
2025-10-28,19:08,domestic,国内,11,弁護士ドットコムニュース,小野田紀美大臣、週刊新潮の取材を「迷惑行為」と批判　編集部は「正当な取材」と反論,https://news.yahoo.co.jp/articles/dee5ac3a5c5cc84acd9ac60d50dfc3689e828778,10/28(火) 12:21
2025-10-28,19:08,domestic,国内,12,日刊スポーツ,立憲議員、高市早苗首相「英語ペラペラ」投稿の自粛呼びかけ「総理に失礼」もし評価するなら…,https://news.yahoo.co.jp/articles/298148a9e6dd8114e76a649fa6f86ea4a56c3fdd,10/28(火) 16:13
2025-10-28,19:08,domestic,国内,13,J-CASTニュース,維新・藤田共同代表、国会ヤジ「普通におもんない」→立憲議員が反論　藤田氏「真意」を再度説明,https://news.yahoo.co.jp/articles/9da8a46bac1994cb95b20fe457925a7dde30d026,10/28(火) 13:51
2025-10-28,19:08,domestic,国内,14,J-CASTニュース,トランプ大統領、天皇陛下会見での「振る舞い」に賛否　「敬意を払ってくれている」の声の一方...「指差しはあかん」,https://news.yahoo.co.jp/articles/83bfe695ce15ab3186db6a0bf9cb301366cd6c72,10/28(火) 13:45
2025-10-28,19:08,domestic,国内,15,時事通信,故安倍氏のパター贈呈　高市首相、トランプ氏に,https://news.yahoo.co.jp/articles/843daabb1da1e06c1ab3325a16d370b2911023e1,10/28(火) 14:07
2025-10-28,19:08,domestic,国内,16,日刊スポーツ,片山さつき財務相が存在感　トランプ大統領と握手、日米首脳会談では高市早苗首相の隣に着席,https://news.yahoo.co.jp/articles/ecb832377c18b6c832a60a38f505806a025163f4,10/28(火) 12:09
2025-10-28,19:08,domestic,国内,17,日刊スポーツ,ウクライナ出身の評論家、高市首相の英語スピーチめぐる批判をピシャリ「見下せる程の語学力を」,https://news.yahoo.co.jp/articles/90e9ba8f067ef5fc25908c33adbef53686d2e8e0,10/28(火) 10:17
2025-10-28,19:08,domestic,国内,18,TBS NEWS DIG Powered by JNN,【速報】秋の園遊会はじまる　トランプ氏と会談終えた高市総理も　武豊さんら約1500人出席　今年は「洋」の装い,https://news.yahoo.co.jp/articles/e9815f0b9bf3f4e47eec3d5fcae46adf1cc1db09,10/28(火) 13:51
2025-10-28,19:08,domestic,国内,19,デイリースポーツ,倉田真由美氏　「射殺するのはクマがかわいそう」という意見に疑問→『自分が飼う』というなら分かるが何もできないのに言うのは失礼,https://news.yahoo.co.jp/articles/119deda8f029226ca164e6c262ecf0f64dbf0a40,10/28(火) 10:23
2025-10-28,19:08,domestic,国内,20,ABEMA TIMES,小泉防衛大臣、クマ対策で自衛隊派遣「毎日人の命が失われている」「自衛隊はそもそも、クマの駆除などに対応するための訓練をしているわけでもない」,https://news.yahoo.co.jp/articles/8f15a54bcb9879770123a3f3d2be500866d72e4f,10/28(火) 11:15
2025-10-28,19:08,domestic,国内,21,テレビ朝日系（ANN）,【速報中】このあと経済界トップらと夕食会を予定　トランプ大統領6年ぶりの来日,https://news.yahoo.co.jp/articles/85f108001303572c99b8674e093a246c470fda7c,10/27(月) 14:00
2025-10-28,19:08,domestic,国内,22,日刊スポーツ,田母神俊雄氏「バカなこと」クマ被害で秋田へ派遣の自衛隊の銃不使用巡り「行動縛るべきでない」,https://news.yahoo.co.jp/articles/f4fd36b50c29dd992cad7e2fdffc635573078406,10/28(火) 16:23
2025-10-28,19:08,domestic,国内,23,時事通信,立民・枝野氏の安保法発言評価　国民・玉木氏,https://news.yahoo.co.jp/articles/596a462fadb0583b2d7aa9872f77521d85385f75,10/28(火) 16:10
2025-10-28,19:08,domestic,国内,24,中日スポーツ,「虎ンプとも仲良さそう」高市早苗首相、過去に使用のスマホケースに再び注目が集まる「ガチ勢でワロタ」「完全に阪神ファンを味方につけたな」,https://news.yahoo.co.jp/articles/45fc868a57bffe8b87c3685db0e6940eef4fda8d,10/28(火) 15:12
2025-10-28,19:08,domestic,国内,25,産経新聞,自民・石井参院幹事長が佐藤官房副長官起用を巡り苦言　野党の出席拒否は「任命の結果」,https://news.yahoo.co.jp/articles/d48048acbb8322f7ffbb3a2f7cef9c9938e8c4f2,10/28(火) 18:05
2025-10-28,19:08,domestic,国内,26,日刊スポーツ,高市早苗首相が笑顔でサムアップ連発　米軍横須賀基地で発信、トランプ氏に「勝者」と紹介される,https://news.yahoo.co.jp/articles/0a717884ec0fee9db95d1409ce0b1b929f1cc895,10/28(火) 18:17
2025-10-28,19:08,domestic,国内,27,デイリースポーツ,トランプ大統領がボタンをしめてる！「サン！シャイン」コメンテーター大興奮「これはびっくり」高市総理と対面で,https://news.yahoo.co.jp/articles/a8ed20ddfc01168e076da81a990e21c1fd4f428d,10/28(火) 14:03
2025-10-28,19:08,domestic,国内,28,毎日新聞,秋の園遊会始まる　武豊さんら各界の功労者1800人招待,https://news.yahoo.co.jp/articles/ab291fa9eb869d3d7072fd10d324e8568ec3a07c,10/28(火) 13:57
2025-10-28,19:08,domestic,国内,29,FNNプライムオンライン（フジテレビ系）,国民・玉木代表が支持率下落に「実力通りになった」立憲・枝野氏の安保関連法「変えなくてよい」発言は「正しい方向での変化」と評価,https://news.yahoo.co.jp/articles/b11c0e00f1eaab5e374e6a20ee95e204ba53f504,10/28(火) 13:42
2025-10-28,19:08,domestic,国内,30,スポーツ報知,永谷園の「少し寂しいお知らせ」に悲鳴続々「とんでもなく寂しい」「広重も感謝」,https://news.yahoo.co.jp/articles/f037892239942325c26ada8d56533435008139e2,10/28(火) 18:15
2025-10-28,19:08,domestic,国内,31,FNNプライムオンライン（フジテレビ系）,秋の園遊会　天皇皇后両陛下、愛子さまが武豊さん夫妻ら参加者とご歓談　愛子さまがレースについて熱心にお尋ねになる場面も,https://news.yahoo.co.jp/articles/d172bfd5bc74ad7cebbb801e0ac96b6f633b80f5,10/28(火) 15:45
2025-10-28,19:08,domestic,国内,32,共同通信,剣道指導中に教諭が傷害疑い、生徒全治不詳,https://news.yahoo.co.jp/articles/15661b0ad74881e20e61aea4bbbd51e3859143ca,10/28(火) 17:24
2025-10-28,19:08,domestic,国内,33,TBS NEWS DIG Powered by JNN,【全文公開】トランプ大統領「日本という国を尊敬」日米首脳会談で「日本もかなり自衛隊や防衛を増加すると聞いている」など冒頭発言,https://news.yahoo.co.jp/articles/29187799b433b89c2ae9e16d49b960ce4920139b,10/28(火) 17:35
2025-10-28,19:08,domestic,国内,34,読売新聞オンライン,トランプ氏、高市首相を「近しい友達になった」と紹介…米空母で「日米同盟は世界で最もすばらしい」と演説,https://news.yahoo.co.jp/articles/141393ebfde08b1d4714a112b3ca7f574eb3960e,10/28(火) 16:59
2025-10-28,19:08,domestic,国内,35,共同通信,石破茂前首相、早期解散「痛恨」　退任後初の地元鳥取入りで謝意,https://news.yahoo.co.jp/articles/f8b66c61a2268427a894b73924ac439300d47abc,10/27(月) 11:05
2025-10-28,19:08,domestic,国内,36,MBC南日本放送,【警報級大雨 暴風】のおそれ「爆弾低気圧」台風並みの暴風か「3連休前半」は大荒れの可能性【雨風シミュレーション31日（金）〜11月2日（日）/ 全国各都市の週間予報】,https://news.yahoo.co.jp/articles/fcae06edb66c22edfc6544899eea667b30d8f301,10/27(月) 20:05
2025-10-28,19:08,domestic,国内,37,デイリースポーツ,【高市自民】人気アイドル「時代に合わせて憲法変えるのは当たり前。スマホをアップデートみたいなもの」憲法９条『正義のミカタ』で,https://news.yahoo.co.jp/articles/cd69c599cb1bb1560829e4392bfbe1a1245c4988,10/26(日) 18:51
2025-10-28,19:08,domestic,国内,38,時事通信,日米首脳、米空母で結束誇示　大統領ヘリに同乗,https://news.yahoo.co.jp/articles/8110ed9ebd8d0d3d454c60cad2aa93bc51a89633,10/28(火) 16:53
2025-10-28,19:08,domestic,国内,39,スポニチアネックス,なぜ2泊3日？トランプ大統領「非常に長い」滞在の理由は…クラフト氏推測「欧州に行く時は…」,https://news.yahoo.co.jp/articles/1d666d18e0b06cc052aaffb854a01f2f808b5402,10/27(月) 20:52
2025-10-28,19:08,domestic,国内,40,デイリースポーツ,トランプ大統領　天皇陛下を指差す動画がネット上に→「指差しするのは止めてください」の声、スーツの前ボタン留めに「敬意が感じられる」,https://news.yahoo.co.jp/articles/5445cda231c5af696b1ea108daa092db30a82dcb,10/28(火) 12:34
