scrp_date,scrp_time,genre_en,genre_jp,rank,media_jp,title,link,date_original
2024-12-22,17:07,domestic,国内,1,テレビ朝日系（ANN）,帯状疱疹のワクチン定期接種へ　50代から急増　激しい痛み「顔面神経まひ」「失明」も,https://news.yahoo.co.jp/articles/d3ed903af6e008c4e41684b35a9bbe89c7adb0bc,12/22(日) 13:46
2024-12-22,17:07,domestic,国内,2,J-CASTニュース,中国人「日本嫌いが9割」なのに銀座は観光客だらけのナゾ　対日イメージが激変「大好き」になる理由,https://news.yahoo.co.jp/articles/bf30668739dd598e2e50a0a9615d58d7ad5512fb,12/22(日) 13:00
2024-12-22,17:07,domestic,国内,3,47NEWS,２度仮釈放されたのに、そのたびにまた刑務所へ。「遺族の思いを裏切った」　金目当ての強盗殺人を起こした無期懲役囚の「更生」の意思,https://news.yahoo.co.jp/articles/a73ab01e813715138e7bed843618470defc43882,12/22(日) 9:02
2024-12-22,17:07,domestic,国内,4,読売新聞オンライン,北九州市殺傷事件、平原容疑者は資産家の生まれで「口数の少ない普通のお父さんだった」…１年以上前に離婚,https://news.yahoo.co.jp/articles/429974ddf7d684463cc1e7a1bcb8708d0dcd6875,12/22(日) 5:00
2024-12-22,17:07,domestic,国内,5,読売テレビ,【年金密着】年収3000万円の売れっ子漫画家が突然視力を失い、月3万5000円の年金生活に…“光”を失った絶望の中でも再び笑顔になれた背景には、献身的に支えてくれる“ギャル”の存在,https://news.yahoo.co.jp/articles/000813dde2e29cd5099b1a3a0a94da962cc8eed4,12/22(日) 12:00
2024-12-22,17:07,domestic,国内,6,ENCOUNT,刑事告発スピード受理、捜査本格化の機にスクープ記事…斉藤元彦知事を包囲する「2つの判例」,https://news.yahoo.co.jp/articles/fdbed495df5521772ab3df9f5286fb7a1fab7177,12/22(日) 9:13
2024-12-22,17:07,domestic,国内,7,読売新聞オンライン,マンション建設現場でクレーン車がつり上げたベニヤ板５０枚落下、作業中の男性が下敷きになり死亡,https://news.yahoo.co.jp/articles/9263c71d74a5057687879a7da59af88689249deb,12/22(日) 12:10
2024-12-22,17:07,domestic,国内,8,中日スポーツ,ひろゆきさん、「『日本で働いたら負け』は正解でした」 103万円の壁を巡る自民・政調会長の発言に強烈な皮肉,https://news.yahoo.co.jp/articles/01cf8643905dd0813e0085bc1eab3236769ee47d,12/22(日) 15:10
2024-12-22,17:07,domestic,国内,9,tenki.jp,北海道　明日23日は札幌周辺などで雪強まる　この先しばらくは雪の降る日が続きそう,https://news.yahoo.co.jp/articles/732aad76b88fbb8cd1fd3597987d5e4fce08dbf9,12/22(日) 15:33
2024-12-22,17:07,domestic,国内,10,FNNプライムオンライン,北九州 中学生2人殺傷事件 容疑者逮捕  SNSでデマ情報が拡散  子どもをどう守る?地域の苦悩 【福岡発】,https://news.yahoo.co.jp/articles/bf9b90402de7c2f36fa19456a3078eb3e53f5e8a,12/22(日) 14:09
2024-12-22,17:07,domestic,国内,11,時事通信,千葉で強盗致傷事件相次ぐ　住民刺されけが、容疑者逃走　県警,https://news.yahoo.co.jp/articles/aaf1608f925e412c6b4853a4ad1097da55226afc,12/22(日) 14:30
2024-12-22,17:07,domestic,国内,12,弁護士ドットコムニュース,“終身刑化”する無期懲役　2023年の仮釈放8人、獄死30人　無期囚「長い受刑生活を耐えるわずかな希望」,https://news.yahoo.co.jp/articles/f4f5689f13d56bb538a6f53568af9afa459878b5,12/17(火) 19:03
2024-12-22,17:07,domestic,国内,13,tenki.jp,大荒れの天気で車の立ち往生に警戒　影響はクリスマスまで続く,https://news.yahoo.co.jp/articles/178f91b2c736049c1f97e503e0682d35b1b91c12,12/22(日) 12:08
2024-12-22,17:07,domestic,国内,14,産経新聞,トランプ氏、日米戦争は「自分とシンゾーだったら起こらなかった」安倍昭恵さんに明かす,https://news.yahoo.co.jp/articles/777fe86fb8c61eb85ccbb45ff8adf65490b3f5f3,12/22(日) 16:01
2024-12-22,17:07,domestic,国内,15,TBS NEWS DIG Powered by JNN,苦痛に悶えながらも安楽死に反対――難病ALS患者が命を懸けた訴え、生きたいと思える社会を目指して,https://news.yahoo.co.jp/articles/3bb28b7c0b05680062c3d935532da3cd182d5c17,12/21(土) 18:04
2024-12-22,17:07,domestic,国内,16,テレビ朝日系（ANN）,「正座させて蹴ったり」同級生語る43歳男の“素顔” 北九州中3殺傷事件,https://news.yahoo.co.jp/articles/ebd4884cfe4abbe4a76efc6d34cf24927e7cf11b,12/20(金) 19:48
2024-12-22,17:07,domestic,国内,17,TBS NEWS DIG Powered by JNN,柿を食べ過ぎて緊急手術...? 「柿胃石症」にご注意　診察した医師も「びっくりした経験が」,https://news.yahoo.co.jp/articles/8315ab88cbec383b39e64c0987948fdf9c574e7e,12/22(日) 7:02
2024-12-22,17:07,domestic,国内,18,共同通信,千田謙蔵さん死去、93歳　東大ポポロ事件の元被告,https://news.yahoo.co.jp/articles/30abfe9494266346d0cc6cd697e1fabaa37f6488,12/22(日) 15:33
2024-12-22,17:07,domestic,国内,19,TBS NEWS DIG Powered by JNN,「安倍氏に相談」自民“裏金議員”が国会で新証言　真相解明は…【サンデーモーニング】,https://news.yahoo.co.jp/articles/c48b8bf1f5328b8653b19143790fce9177a787ea,12/22(日) 14:22
2024-12-22,17:07,domestic,国内,20,FNNプライムオンライン（フジテレビ系）,【速報】立憲・野田代表「学校給食無償化」法案提出で野党共闘を図る考え「一挙に実現に向け頑張りたい」,https://news.yahoo.co.jp/articles/271a4284e21474f2040d5e7d61d8d143a6de6f31,12/22(日) 12:13
2024-12-22,17:07,domestic,国内,21,弁護士ドットコムニュース,「一人一杯ラーメン注文して」ルール破ったカップルに店が激怒、SNSで話題　客に問題あったのか？,https://news.yahoo.co.jp/articles/feb92fe6223965031fbf9d2635ddd55c069589cf,12/19(木) 17:29
2024-12-22,17:07,domestic,国内,22,朝日新聞デジタル,「熟年不倫」調査で夫の依頼が増えた理由　女性探偵語る,https://news.yahoo.co.jp/articles/453d8ddf3b043458f5e9817c4d88257ad616eba7,12/22(日) 16:01
2024-12-22,17:07,domestic,国内,23,J-CASTニュース,閉店間際のスーパー「半額シール品」に猛ダッシュ　賞味期限に消費期限、気になるけれど大丈夫？,https://news.yahoo.co.jp/articles/7d154dbf72cc72fbe3236812a95abe2457816532,12/22(日) 16:00
2024-12-22,17:07,domestic,国内,24,毎日新聞,かつて消費増税を決断の立憲・野田佳彦氏　食料品0％の党内案に関心,https://news.yahoo.co.jp/articles/b2225b1cf647a22f465c889abcbec89fc4be5f48,12/20(金) 18:01
2024-12-22,17:07,domestic,国内,25,ABEMA TIMES,人権侵害、近くて遠いトイレ…河井元法務大臣が1160日の獄中体験を独白「逆さまつげで情けない気持ちに…」,https://news.yahoo.co.jp/articles/8a51c2fdb44bfc31e21354ca32a8614f47b2ed63,12/16(月) 6:50
2024-12-22,17:07,domestic,国内,26,共同通信,東大ポポロ事件元被告の千田謙蔵さん死去,https://news.yahoo.co.jp/articles/e85a1d2d7f835bcf937cc3042395de501c44998d,12/22(日) 14:47
2024-12-22,17:07,domestic,国内,27,福祉新聞,24年度補正予算が成立　介護、障害に一時金,https://news.yahoo.co.jp/articles/2a165c8cec62e4796cbd99415f37a2f73728352c,12/22(日) 13:00
2024-12-22,17:07,domestic,国内,28,よろず～ニュース,維新・前原共同代表「要返済の奨学金9.4兆円について返済免除」〝徳政令〟に言及 教育無償化の3党協議始まる,https://news.yahoo.co.jp/articles/aec6a2f40c2f4382bdce7e3d872908149eb778f7,12/20(金) 7:44
2024-12-22,17:07,domestic,国内,29,J-CASTニュース,河野太郎氏、マイナ保険証めぐる立憲のX投稿にチクリ　「同じ期間に新規登録は...」,https://news.yahoo.co.jp/articles/01b9d15cf5970932e8a28080ca7e2ceb6b1cf11e,12/22(日) 10:50
2024-12-22,17:07,domestic,国内,30,TBS NEWS DIG Powered by JNN,被害者語る「命があって良かった」千葉で強盗傷害事件相次ぎ犯人逃走中　柏市で男性が顔にけが　3時間後に旭市で男性が背中刺される　関連捜査「トクリュウ」の可能性も,https://news.yahoo.co.jp/articles/9ca945e470afb6a749245f689994110b0277f040,12/22(日) 10:58
2024-12-22,17:07,domestic,国内,31,読売新聞オンライン,海自艦艇部隊の「特定秘密」、１０００人無資格のまま…戦闘指揮所の急場しのぎ続く,https://news.yahoo.co.jp/articles/a496705573a584a6fba6cbf07c411027a01abdc8,12/22(日) 14:41
2024-12-22,17:07,domestic,国内,32,スポニチアネックス,自民・小野寺政調会長　ひろゆき氏に“返事”「他の方々からも同様なコメント…説明を」と自身の実績明記,https://news.yahoo.co.jp/articles/bc4e098ce882e65290af031eb1ab71955d2bd2f9,12/20(金) 8:46
2024-12-22,17:07,domestic,国内,33,産経新聞,選挙で敗北続きの大阪自民　「他力本願」の府連会長人事　内部から「情けない」と嘆き節,https://news.yahoo.co.jp/articles/4a1ded0fbec500ea24de3bf61b61bc90e906fe79,12/22(日) 15:52
2024-12-22,17:07,domestic,国内,34,共同通信,ベトナム人に給与未払いか、愛知　数千万円以上、大使館が調査要請,https://news.yahoo.co.jp/articles/528839f876275d67ddf1cf29030f9b4b9a849d0b,12/22(日) 16:39
2024-12-22,17:07,domestic,国内,35,読売新聞オンライン,黄信号→青にドラレコ映像改ざん、父親提訴で発覚…保険金詐欺未遂容疑で会社役員逮捕,https://news.yahoo.co.jp/articles/e0385d041cd1333295b5c279ef4abf982ee9f947,12/22(日) 12:43
2024-12-22,17:07,domestic,国内,36,テレビ朝日系（ANN）,帯状疱疹ワクチン定期接種化へ　65歳対象　来年4月から,https://news.yahoo.co.jp/articles/f64fd47d363d63b1b1e09196fdd724dabc9ee54b,12/18(水) 12:55
2024-12-22,17:07,domestic,国内,37,共同通信,釧路市中心部、高速道で札幌直結　道東道、災害時に活用も,https://news.yahoo.co.jp/articles/db2f02983ce3c38f0359febd80c00839b39f93b8,12/22(日) 16:14
2024-12-22,17:07,domestic,国内,38,レスキューナウニュース,名鉄犬山線で人身事故 一部運転見合わせ,https://news.yahoo.co.jp/articles/affd9fc66ddd5f4fefd95c4740f01786da4d7bfc,12/22(日) 13:05
2024-12-22,17:07,domestic,国内,39,デイリースポーツ,不倫→役職停止の玉木氏　土曜生ＴＶ→ほんこんが怒りガン詰め　公開大説教「高市さんとやれや」不倫処分ええから国民生活を先やれ「芸人やったら葬られるで」,https://news.yahoo.co.jp/articles/27265b07c81bf3e25ea5568827172af783e8417b,12/21(土) 13:17
2024-12-22,17:07,domestic,国内,40,中日スポーツ,「立花出ないってよ」「なにがしたいねん？」Ｎ党・立花孝志党首、「岸和田市に注力」兵庫・南あわじ市長選の見送り表明に…ツッコミ噴出,https://news.yahoo.co.jp/articles/824256be7d1025c3aa3499e8361649d21e461d4e,12/21(土) 17:14
