scrp_date,scrp_time,genre_en,genre_jp,rank,media_jp,title,link,date_original
2025-11-15,03:10,business,経済,1,LIMO,「さすが富裕層」元銀行員が印象に残った「お金に好かれる行動」3選。資産1億円以上の富裕層は日本に約3％,https://news.yahoo.co.jp/articles/1217a1d7c19ab9d7a5222e9efa91f5771b6f042c,11/14(金) 6:25
2025-11-15,03:10,business,経済,2,ファイナンシャルフィールド,父の遺産を兄「3000万円」と弟の私「2000万円」で相続しました。一人あたりの相続額は基礎控除の範囲内なので、税金はかかりませんよね？,https://news.yahoo.co.jp/articles/d037a53c23dfeb4073b5f51c7bb8d91d8ad6e370,11/13(木) 13:50
2025-11-15,03:10,business,経済,3,共同通信,NY株、続落,https://news.yahoo.co.jp/articles/f3166a2d296bf3c331d1bd9b18a6474a7cf78bf1,11/15(土) 0:14
2025-11-15,03:10,business,経済,4,LIMO,【申請必須】60歳・65歳以上のシニアが受け取れる《給付金・手当》を5つ紹介！「年金受給者向け・働くシニア向け」,https://news.yahoo.co.jp/articles/3f7819afc1dc9be27d8d8a410579c0e0eb0ae42a,11/14(金) 17:35
2025-11-15,03:10,business,経済,5,みんかぶマガジン,倒産連鎖、本格化へ…日経平均大暴落はすぐそこ！国際的投資家が日本に警鐘…バフェットも手じまい「すでに逆回転始まっている」,https://news.yahoo.co.jp/articles/086ffaa10d59d5ac2662f2f10aa643f288b5ce45,11/14(金) 9:10
2025-11-15,03:10,business,経済,6,Bloomberg,中国、日本への渡航を短期的に控えるよう国民に呼び掛け,https://news.yahoo.co.jp/articles/ee53de2f21771532aa06ffde5e55a75a6319ec4c,11/15(土) 0:02
2025-11-15,03:10,business,経済,7,読売新聞オンライン,「資さんうどん」来年の出店30店中29店を業態転換で対応…現状は「店舗売り上げが既存ブランドの3倍」,https://news.yahoo.co.jp/articles/232c94f9e38a8087a1845bdcfa599269aa8f5354,11/14(金) 14:03
2025-11-15,03:10,business,経済,8,LIMO,高齢者世帯の6割超が「資産を取り崩して生活している」と回答…【70歳代】みんなの平均貯蓄額・中央値はいくらか,https://news.yahoo.co.jp/articles/886e7f0071749291a445a287c10b477206127fc3,11/14(金) 20:25
2025-11-15,03:10,business,経済,9,Bloomberg,欧州、台湾要人を相次ぎ受け入れ－中国の「レッドライン」に踏み込む,https://news.yahoo.co.jp/articles/b9b54c118232d31246f542ab1db2116f5a7f3c7b,11/12(水) 13:10
2025-11-15,03:10,business,経済,10,共同通信,NY株、続落して始まる,https://news.yahoo.co.jp/articles/1ccad5c5ccb61489e1eac24d992a3639a8c530c2,11/14(金) 23:41
2025-11-15,03:10,business,経済,11,ファイナンシャルフィールド,夫がボーナスが60万円出るので「車のタイヤ交換」をしたいと言い出した！ 2年前に替えたばかりなのに「ディーラーに勧められた」とのこと…。本当に必要な出費？,https://news.yahoo.co.jp/articles/38056a96609400d417a46b6a44a5c8623b68aed7,11/14(金) 13:50
2025-11-15,03:10,business,経済,12,乗りものニュース,中国海軍「最大のミサイル駆逐艦」が日本に超接近！ 海自の艦艇と睨み合い 防衛省が画像を公開,https://news.yahoo.co.jp/articles/536a5d55353345596efcaf55b6fa91058d65591a,11/14(金) 11:42
2025-11-15,03:10,business,経済,13,ファイナンシャルフィールド,国民一人あたり“4万円の給付”を受けられる!? 納税額が一定額以下の国民は“現金給付”を受けられる可能性も！ 高市総理が推進する「給付付き税額控除」とは？,https://news.yahoo.co.jp/articles/f14a9b42830504ea6189151b7ace3973bf1789b9,11/11(火) 13:30
2025-11-15,03:10,business,経済,14,Bloomberg,トランプ政権、新たな関税免除措置を14日発表へ－食料価格高騰に対応,https://news.yahoo.co.jp/articles/62b0d69c07fdcb11458b2ca74dfd429405ec134c,11/15(土) 1:29
2025-11-15,03:10,business,経済,15,みんかぶマガジン,もう始まった嘘つき早苗の二枚舌「レジのせいで減税できぬ」9月の発言から180度急展開…自分のふがいなさをシステムのせいにする姑息,https://news.yahoo.co.jp/articles/f450c818077b6c62a2b99f060d50add31ae7c167,11/13(木) 9:10
2025-11-15,03:10,business,経済,16,毎日新聞,農業法人協会長がおこめ券に反対を表明　配布コストなど理由,https://news.yahoo.co.jp/articles/94f9365e771f76f6abcf416ea9c62383f21d6c71,11/14(金) 18:39
2025-11-15,03:10,business,経済,17,くるまのニュース,NEXCO激怒発表に反響殺到 「二度と通行させるな」「億単位の罰金でいい」 4年間で「21回“不正通行”」した悪質事業者を公表！ 法律フル無視・無許可の「規格外車両」通行 是正指導を公表,https://news.yahoo.co.jp/articles/3dd5e7f13f2b9b4dcf05ea0c736ea0c3baafe92e,11/14(金) 7:20
2025-11-15,03:10,business,経済,18,乗りものニュース,「日本屈指の深い湾」で航行不能になった貨物船が漂流 そこに現れたのは.. “見事な救出劇”の様子が公開,https://news.yahoo.co.jp/articles/c8f5a119fa88e7a379e154e04c2e51ae0b5d4697,11/14(金) 7:12
2025-11-15,03:10,business,経済,19,ファイナンシャルフィールド,金融機関で働く友人が「年収1500万円」だそうです。税金も高そうですが、年収1500万円の場合、手取りはどれくらいなのでしょうか？,https://news.yahoo.co.jp/articles/60be65a67e6900fe88f9fc90a72883d299aa8f5b,11/14(金) 5:50
2025-11-15,03:10,business,経済,20,食品産業新聞社ニュースWEB,【厚切りとんかつ 厚とん】冬季限定「大粒牡蠣フライ定食」発売/2025年に開業した串カツ田中HDの新業態,https://news.yahoo.co.jp/articles/40a249456663acb0a3dd3cf9499656da433c9cb3,11/14(金) 17:44
2025-11-15,03:10,business,経済,21,読売新聞オンライン,「なみえ焼そば」名称使用料の徴収撤回…弁護士「飲食店内での提供物には商標権が及ばない」,https://news.yahoo.co.jp/articles/ecb520197824fd84436039314e1ea23ed08af911,11/14(金) 19:31
2025-11-15,03:10,business,経済,22,ファイナンシャルフィールド,年末調整で「生命保険・医療保険」の申請を忘れた！「月5000円」以上払ってる場合、申告漏れで“いくら損”しますか？ 確定申告すれば大丈夫でしょうか？,https://news.yahoo.co.jp/articles/dbbd96f544cce449e5f45dfd177b5f88fdfa0fae,11/14(金) 14:20
2025-11-15,03:10,business,経済,23,まいどなニュース,「実在するよね」「そっくり」人気文具の新商品、デザイン酷似？→販売中止に　メーカー謝罪「類似性が指摘され得る」,https://news.yahoo.co.jp/articles/23a83879ceb39aed1fffa327da68efe213164b82,11/14(金) 14:30
2025-11-15,03:10,business,経済,24,Bloomberg,ラトニック兄弟のキャンター快進撃、米政権との癒着批判は意に介さず,https://news.yahoo.co.jp/articles/5e77f736926fd2c2b7fd686d5206a0211d32e064,11/15(土) 1:06
2025-11-15,03:10,business,経済,25,朝日新聞,米、スイスと関税交渉合意　税率39%を15%に、米に工場建設条件,https://news.yahoo.co.jp/articles/ba25ea89dd5dc6fa24329d27d37752b3c816c558,11/15(土) 1:26
2025-11-15,03:10,business,経済,26,MONEY PLUS,「資生堂」「コーセー」決算後の株価は対照的、2社の違いはどこにあった？,https://news.yahoo.co.jp/articles/411e0975c8e9bbc0cf6eeb2a669c3107ab32e8d9,11/14(金) 7:30
2025-11-15,03:10,business,経済,27,乗りものニュース,武蔵野線の「最閑散駅」に巨大店舗が開業へ “次世代型ホームセンター”誘致で駅利用者も増加!?,https://news.yahoo.co.jp/articles/d00a9ce5cdee53498a67eaece28871b01f7f46df,11/14(金) 8:12
2025-11-15,03:10,business,経済,28,共同通信,車通勤手当の非課税額を引き上げ　11年ぶり、物価高を考慮,https://news.yahoo.co.jp/articles/3448abc62feb0fc2ad5542ae0ef49a897adb8fd5,11/14(金) 17:37
2025-11-15,03:10,business,経済,29,くるまのニュース,「日本最大級のショッピングモール」が高速道路と繋がる!? 開通すれば春日部まで「信号ゼロ」で行ける！ 延長約17.6kmの国道4号バイパス「東埼玉道路」現在の進捗は,https://news.yahoo.co.jp/articles/86f7854b4baa3502a6c5e8b6da1ac98a0260d6ba,11/14(金) 8:00
2025-11-15,03:10,business,経済,30,食品産業新聞社ニュースWEB,【ローソン】6回目の「盛りすぎチャレンジ」開催、人気だった11品を2週にわたって販売,https://news.yahoo.co.jp/articles/eabdc4ae3cbf47d826b906d8a8d90dd7918f0588,11/14(金) 12:53
2025-11-15,03:10,business,経済,31,ファイナンシャルフィールド,高速道路の「深夜割引」が改定！ 今後は“年2回以上”利用しないと「還元が受けられなく」なる？“ETC深夜割引”の変更予定点を確認,https://news.yahoo.co.jp/articles/202ffaf954e9eea1fec535d841d49948151d21cf,11/11(火) 13:40
2025-11-15,03:10,business,経済,32,テレビ朝日系（ANN）,激安ガニ、厄介者から救世主に　関東上陸「1杯950円」連日完売　破格値段の秘密,https://news.yahoo.co.jp/articles/5bd6b9636d3778223cbfa4919e2e8c9f62ba0d2b,11/14(金) 14:51
2025-11-15,03:10,business,経済,33,LIMO,年末調整シーズン！会社員でも『確定申告』した方が良いケース5つ,https://news.yahoo.co.jp/articles/34fed50ccdd107d8697a02ff69338485244af34c,11/13(木) 14:50
2025-11-15,03:10,business,経済,34,朝日新聞,ニデック、800億円超の損失や債務を計上　相次ぐ不適切会計問題で,https://news.yahoo.co.jp/articles/d6d545689e3a3588ce7e9bc6929bdf356abf17b9,11/14(金) 16:20
2025-11-15,03:10,business,経済,35,毎日新聞,電気・ガス代補助、1～3月は計6000円　厳冬期に厚く　政府調整,https://news.yahoo.co.jp/articles/80096de4f3f6717301b6705a0c3f6b452b35db0d,11/14(金) 23:45
2025-11-15,03:10,business,経済,36,carview！,新型「RAV4」の実車を前に「デザインを見て購入を決意」したという声も。検討ユーザーが気になっているのはどんな点？,https://news.yahoo.co.jp/articles/032bf63b7bc36ad7e9a095aa5422196a12c95813,11/13(木) 12:06
2025-11-15,03:10,business,経済,37,共同通信,介護報酬、26年度に臨時改定へ　職員処遇改善、補正予算でも支援,https://news.yahoo.co.jp/articles/0e02fe5a2f857cbd37661f4fcdbb8a2f9f2931ae,11/14(金) 17:40
2025-11-15,03:10,business,経済,38,FNNプライムオンライン,カレーは注文から提供まで30秒　67年続く大衆食堂「1分ナンテ待たせるもんですか」　スピード提供で人気店に　2代目の70代夫婦が伝統の味守る,https://news.yahoo.co.jp/articles/0faa320c04e8ea3de00bbb3ff7223cac0401f9ea,11/14(金) 10:36
2025-11-15,03:10,business,経済,39,ロイター,カンザスシティー連銀総裁、12月ＦＯＭＣでも利下げ反対の可能性,https://news.yahoo.co.jp/articles/67241d23eb5d59c17fd475f1b94c5d50642bd992,11/15(土) 1:26
2025-11-15,03:10,business,経済,40,みんかぶマガジン,高市早苗首相が怯える「来年4月の大増税」国民の手取りが大きく減る前に「お米券解散」だ！「食料品消費税率0%」は永久に選択肢のまま…,https://news.yahoo.co.jp/articles/8a565273384e03647d2da70f313981a62b9e6fc4,11/12(水) 9:10
