scrp_date,scrp_time,genre_en,genre_jp,rank,media_jp,title,link,date_original
2024-05-08,12:19,sports,スポーツ,1,Full-Count,「何で交代なのか」納得いかぬ壮絶17連敗　外出禁止の厳戒態勢…迫ってきた“身の危険”,https://news.yahoo.co.jp/articles/8e35993875564067139aeaad58124a6376357a32,5/8(水) 7:20
2024-05-08,12:19,sports,スポーツ,2,RONSPO,まだそれ言うか？「井上尚弥はそれほど強くなかった。世界最高の選手ではない」東京ドーム決戦でダウン奪うも6回TKO負けしたネリが“悪童”に戻って米記者に負け惜しみ…一方のモンスターは？,https://news.yahoo.co.jp/articles/3834a68cc578af14caf5b5a5357e153281fb249e,5/8(水) 6:00
2024-05-08,12:19,sports,スポーツ,3,TBS NEWS DIG Powered by JNN,今永昇太、痛恨の逆転2ラン浴びる...8回途中で降板、7回まで無失点の快投、デビュー6連勝は持ち越しに,https://news.yahoo.co.jp/articles/209fa7cf949203a65e881026570931332b917b88,5/8(水) 10:41
2024-05-08,12:19,sports,スポーツ,4,ABEMA TIMES,衝撃の大爆音！大谷翔平の特大アーチで“異変”が起きた…！？ 打った瞬間の観客のリアクションがヤバすぎる 「ビックリしすぎ」「みんな同じリアクションｗ」,https://news.yahoo.co.jp/articles/60e444dd5fed413405fa48da7fa3dabfdbffa5c2,5/8(水) 6:32
2024-05-08,12:19,sports,スポーツ,5,Full-Count,奇跡の美貌「日本でも話題になる予感」　台湾で人気爆発…新生チアが「めっちゃかわいい」,https://news.yahoo.co.jp/articles/d63746ca166dfa3a6c991af2ef4ce9633322a0a1,5/8(水) 7:40
2024-05-08,12:19,sports,スポーツ,6,Full-Count,DeNA主力→戦力外に「もう辞めよう」　31歳で岐路も…新球団での再挑戦「まだできる」,https://news.yahoo.co.jp/articles/304d0240802fbc08782162659da46a7446cff4c6,5/8(水) 7:30
2024-05-08,12:19,sports,スポーツ,7,CoCoKARAnext,井上尚弥に牙をむくグッドマンとは何者か 敵陣営が期待する7桁規模の“怪物効果”「イノウエも人間だ。勝てる可能性はある」,https://news.yahoo.co.jp/articles/764e830072b4026ff490dc8d837472db16611187,5/8(水) 7:04
2024-05-08,12:19,sports,スポーツ,8,スポーツ報知,「老兵は消え去るのみ」尾車親方が相撲協会退職へ　元大関・琴風７０歳任期満了待たず６７歳で,https://news.yahoo.co.jp/articles/b314edaf1f39ea01e207483a509c073c35bec427,5/8(水) 4:00
2024-05-08,12:19,sports,スポーツ,9,日刊ゲンダイDIGITAL,メッツ傘下3A藤浪晋太郎の厳しすぎる現実 メジャー復帰どころか「日本球界出戻り」に現実味,https://news.yahoo.co.jp/articles/d4b0a669e6166664c85044ff1ce26aafb7d68e97,5/8(水) 11:02
2024-05-08,12:19,sports,スポーツ,10,中日スポーツ,ケビン・マグヌッセンの“蛮行”に国際自動車連盟FIAが動いた…第2戦で角田裕毅にも使った秘技は罰則強化で封印へ【F1】,https://news.yahoo.co.jp/articles/36045fb590c1f0ba62ea8ebad77cea7c89c4372c,5/8(水) 10:11
2024-05-08,12:19,sports,スポーツ,11,日刊スポーツ,【欧州CL】ドルトムント11年ぶり決勝進出！フンメルス決勝点、パリSGの猛攻封じ1－0勝利,https://news.yahoo.co.jp/articles/8651c21b2b99b631ea62422cdbd69729c1fc91b3,5/8(水) 5:52
2024-05-08,12:19,sports,スポーツ,12,スポーツ報知,トラウトの代役ケビン・ピラーが２発６打点の活躍でエンゼルス、連敗ストップで最下位脱出,https://news.yahoo.co.jp/articles/cf711e8f9fad2ec8ab700a6c2c1bd8cc3e9a9be1,5/8(水) 10:38
2024-05-08,12:19,sports,スポーツ,13,サンケイスポーツ,井上尚弥、１２月英国で２０億円超のビッグマッチ計画！,https://news.yahoo.co.jp/articles/df87d818cf8939a27b216b8cbcf077e78371505c,5/8(水) 7:30
2024-05-08,12:19,sports,スポーツ,14,日刊ゲンダイDIGITAL,巨人・秋広が今季初昇格も阿部監督「全く期待していない」…のんきな性格がアダで早くも背水の陣,https://news.yahoo.co.jp/articles/ca82e5fc88616a0971778ceb77ab66f08422d2a1,5/8(水) 11:17
2024-05-08,12:19,sports,スポーツ,15,スポニチアネックス,スター高校生だった元帝京のエース　しくじったJリーグ生活…朝まで遊びまわり「やっぱ狂ったよね」,https://news.yahoo.co.jp/articles/10007d84eb6a65a271d148bdb0aeba5fc06ec097,5/8(水) 7:30
2024-05-08,12:19,sports,スポーツ,16,ABEMA TIMES,球場騒然！あれっ？ 大谷翔平が突然、消えた…！？　相手投手のモーションを完全に盗む→あっさり盗塁を決めた瞬間 「いきなり二塁にいたw」「牽制しても走るんだろ？」,https://news.yahoo.co.jp/articles/60e63caae06ef3bff0412a42813fae86cf40ca29,5/8(水) 11:46
2024-05-08,12:19,sports,スポーツ,17,ゴルフ総合サイト ALBA Net,渋野日向子と勝みなみが同組、日本勢は8人が出場　史上初6連勝かかるネリー・コルダも復帰,https://news.yahoo.co.jp/articles/d3d91bd32ee98da653964e09fdc925097c260d85,5/8(水) 9:16
2024-05-08,12:19,sports,スポーツ,18,スポニチアネックス,今永昇太　8回途中無念降板も　米記者絶賛の投球「四球これほど少ない投手は他にいない」,https://news.yahoo.co.jp/articles/1a4db78f838b0322a2e93d7674376f94e38278e2,5/8(水) 11:36
2024-05-08,12:19,sports,スポーツ,19,スポニチアネックス,今永昇太「球団幹部が選ぶ最高のFA契約」大谷抑え1位　米記者報じる　「山本の陰に隠れ…」,https://news.yahoo.co.jp/articles/fd1802cb17c9da04709cae655a855162e9ce8001,5/8(水) 11:21
2024-05-08,12:19,sports,スポーツ,20,デイリースポーツ,井上尚弥　ネリは「もっとパワーがあるのかな、だった」　ダウンは死角からのパンチ「一番手ごわいとは言えない」【一問一答】,https://news.yahoo.co.jp/articles/22bff9f240972d680b2e88ed70fd5da08e45dff8,5/8(水) 5:00
2024-05-08,12:19,sports,スポーツ,21,ABEMA TIMES,なんだ、ただの聖人か… 大谷翔平、審判への対応がヤバすぎる　礼儀正しすぎる挨拶が話題に「さすがの人格者」「これが好かれる理由」,https://news.yahoo.co.jp/articles/6b661573031584cbd1310a09da5b0f4d546c5954,5/8(水) 11:51
2024-05-08,12:19,sports,スポーツ,22,スポーツ報知,大谷翔平、第１打席は四球で自身７試合連続出塁　キャリア初の４戦連発なるか,https://news.yahoo.co.jp/articles/bb461aaa224e3b19967c76e9c358f85973816c90,5/8(水) 11:20
2024-05-08,12:19,sports,スポーツ,23,スポーツ報知,山本由伸が先頭弾被弾もドジャース直後に満塁本塁打ですぐに逆転　大谷翔平も四球でチャンスメイク,https://news.yahoo.co.jp/articles/a6d6917d24b112e39e1435f829b4149fe44feecb,5/8(水) 11:37
2024-05-08,12:19,sports,スポーツ,24,日刊スポーツ,大谷翔平が米有名雑誌の表紙イラストに　デフォルメされズボンのポケットからは米ドル札が,https://news.yahoo.co.jp/articles/1aabc56939d2a325e71fe520cd0e40852ac6f52d,5/8(水) 8:57
2024-05-08,12:19,sports,スポーツ,25,デイリースポーツ,なぜ阪神・岡田監督は２点ビハインドの六回先頭で投手・村上を打席に立たせたのか　評論家が分析,https://news.yahoo.co.jp/articles/b9ef2191e90b30b4e509aecb5688be64fd7d530a,5/8(水) 11:00
2024-05-08,12:19,sports,スポーツ,26,netkeiba,GI史上最高の2070万5810円出た15年ヴィクトリアM 稀代の穴馬×稀代の穴騎手が“格言通り”に波乱呼ぶ,https://news.yahoo.co.jp/articles/35199bf9aeb7906c778b2fbd8e0bd72d3ef7bd54,5/8(水) 7:43
2024-05-08,12:19,sports,スポーツ,27,東スポWEB,衝撃事実！大谷翔平ＭＶＰの可能性はほぼゼロ　元番記者３人が断言「ベッツの方が上」,https://news.yahoo.co.jp/articles/9617b0c6bbaefe02f3809828300ee6dba0de3dba,5/8(水) 11:32
2024-05-08,12:19,sports,スポーツ,28,東スポWEB,松木玖生　今夏のヘーレンフェイン移籍浮上「他クラブも動いている」と地元メディア報道,https://news.yahoo.co.jp/articles/214837ea03416644528dc00940969027bb955195,5/8(水) 10:21
2024-05-08,12:19,sports,スポーツ,29,日テレNEWS NNN,今永昇太　7回無失点も8回に被弾…6勝目ならずも「サイ・ヤング賞レベル」の声　チームはサヨナラ勝利,https://news.yahoo.co.jp/articles/2bf2011f2aeaa7ad5917eb76ac7c118c1d915369,5/8(水) 11:14
2024-05-08,12:19,sports,スポーツ,30,Full-Count,前田健太、2回7失点と炎上　ベンチで愕然、今季3度目の5失点…防御率6.75と大苦戦,https://news.yahoo.co.jp/articles/a5f3a88253f4481971d90f6c6b2df912f1881192,5/8(水) 8:19
2024-05-08,12:19,sports,スポーツ,31,スポーツ報知,カブス今永昇太、タティスらから３者連続三振…パドレス戦で５回まで無失点、６勝目権利,https://news.yahoo.co.jp/articles/2a19ceb29cdbf94cdbf4301666756322802ee5ca,5/8(水) 9:50
2024-05-08,12:19,sports,スポーツ,32,スポニチアネックス,大谷翔平の第1打席は四球　マンシーの逆転満塁弾呼び込み笑顔　山本由伸が被弾も即援護,https://news.yahoo.co.jp/articles/5db2692280458c56d81dc4238b60e927f67bff4a,5/8(水) 11:32
2024-05-08,12:19,sports,スポーツ,33,スポーツ報知,カブス今永昇太「慌てて着替えてグラウンドに」６連勝ならずも劇的サヨナラ勝ちを喜ぶ,https://news.yahoo.co.jp/articles/87ace8cc9049a4c3ba2435e84d8173c5536ce06b,5/8(水) 11:50
2024-05-08,12:19,sports,スポーツ,34,中日スポーツ,今永昇太、メジャー自己最長８回マウンドも６勝目ならず 痛恨の逆転２ラン浴び降板、防御率１・08に,https://news.yahoo.co.jp/articles/02bea7ce2fc175173ec2ff691f065111c248ed8d,5/8(水) 10:56
2024-05-08,12:19,sports,スポーツ,35,Full-Count,育成から1年で主砲へ…オリ25歳が示す急激な進化　活躍の理由を示す「.170→.330」,https://news.yahoo.co.jp/articles/9988bc2364c415280f4f943196ebb8f69f27a2aa,5/8(水) 8:10
2024-05-08,12:19,sports,スポーツ,36,Full-Count,ド軍本拠地に現れた広島ユニ　元“お騒がせ”助っ人の孫も虜「オオタニを見に来たんだ」,https://news.yahoo.co.jp/articles/4241bd9ac6771e2eef32e15ac2e4c0f290e657b8,5/8(水) 10:40
2024-05-08,12:19,sports,スポーツ,37,日刊スポーツ,「本当に正気の沙汰とは思えないことばかり」ドジャース・マンシー、同僚の大谷翔平を語る,https://news.yahoo.co.jp/articles/de5b7e951229ebfe626f076e567026c85d4d4a72,5/8(水) 11:25
2024-05-08,12:19,sports,スポーツ,38,CoCoKARAnext,現在両リーグワーストの「42三振」阪神・佐藤輝明に松井秀喜氏から伝えられた＂復調の条件＂とは,https://news.yahoo.co.jp/articles/a954931b9ca15646463d61fb7c48c71bae64482e,5/8(水) 11:31
2024-05-08,12:19,sports,スポーツ,39,東スポWEB,【阪神】岡田監督が判定に不服の佐藤輝明に突きつけた「審判を味方につけなあかん」の意味,https://news.yahoo.co.jp/articles/313fbc3e1f9bba096a4ca228bca559fb629b8746,5/8(水) 5:16
2024-05-08,12:19,sports,スポーツ,40,ABEMA TIMES,「信じられないくらい素敵」日本人女子レスラー、“鬼滅”メイクに海外ファン熱狂,https://news.yahoo.co.jp/articles/09363439d989657354b17676199b91e3678d8905,5/8(水) 10:24
