scrp_date,scrp_time,genre_en,genre_jp,rank,media_jp,title,link,date_original
2024-05-08,16:18,TTL,総合,1,スポーツ報知,大谷翔平、米人気俳優との２ショットに世界が騒然！「推しと推しのツーショ最高すぎ」「大好きな二人」,https://news.yahoo.co.jp/articles/0f1f59967a2daa52fea506d55c4916c63d78bcc8,5/8(水) 12:55
2024-05-08,16:18,TTL,総合,2,スポーツ報知,５５歳・荻野目洋子の姿にネット衝撃「なんで…」「嘘だろ」「おいくつなんや」「元々細いけど」,https://news.yahoo.co.jp/articles/b3a39b36ba755b9a53763562cd8397ad0cebf63a,5/8(水) 11:35
2024-05-08,16:18,TTL,総合,3,スポーツ報知,「衝撃すぎる」「２度見した」ケミストリー、現在の姿にネット騒然…デビュー２４年目「どんな関係性？」,https://news.yahoo.co.jp/articles/c0de3cf52999b1f28084c5274fe481961cd6d223,5/8(水) 14:55
2024-05-08,16:18,TTL,総合,4,オリコン,「産まれた時はイケメン系って思ったけど…」ハンサムベビー、3年後の姿に174万再生「こんなの…不公平だよ神様！」「勝ち組のお顔」,https://news.yahoo.co.jp/articles/172aab05e9db52482d863b51d687290ec3272da3,5/8(水) 11:30
2024-05-08,16:18,TTL,総合,5,ENCOUNT,関根麻里、親子ショット公開も…激変した父の姿に「二度見しました」「絶対分からない」,https://news.yahoo.co.jp/articles/eb7d565a98e58dd93cba59966aef119a31cb8830,5/8(水) 13:26
2024-05-08,16:18,TTL,総合,6,スポーツ報知,ドジャースが１５戦１３勝の快進撃　山本由伸が本拠地初勝利で４勝　大谷翔平はキャリア初の４戦連発ならず,https://news.yahoo.co.jp/articles/afba84784cab23d37f066279947881c1fa39d59e,5/8(水) 13:21
2024-05-08,16:18,TTL,総合,7,スポニチアネックス,レッドソックス・上沢直之がマイナー降格へ　2試合で防御率2・25　米記者報道,https://news.yahoo.co.jp/articles/70dff757d386e6a14a5096e049b529ded011c453,5/8(水) 13:56
2024-05-08,16:18,TTL,総合,8,テレビ朝日系（ANN）,偽造マイナカードで勝手に機種変更 スマホ乗っ取り…225万円ロレックス買われる被害も,https://news.yahoo.co.jp/articles/0748119080f776ac94ef7203b273d00e5ef7bfdb,5/8(水) 13:16
2024-05-08,16:18,TTL,総合,9,Full-Count,「何で交代なのか」納得いかぬ壮絶17連敗　外出禁止の厳戒態勢…迫ってきた“身の危険”,https://news.yahoo.co.jp/articles/8e35993875564067139aeaad58124a6376357a32,5/8(水) 7:20
2024-05-08,16:18,TTL,総合,10,スポニチアネックス,山本由伸　降板後に大谷翔平からかけられた言葉明かす「投げている時は話すことは少ないですけど…」,https://news.yahoo.co.jp/articles/fd1776817bd159f2007d632081eebbd373c877f8,5/8(水) 14:04
2024-05-08,16:18,TTL,総合,11,スポーツ報知,元天才子役・黒田勇樹、激変した４２歳の姿「こうなって…」ドラマ美少年役から３０年超、意味深投稿も,https://news.yahoo.co.jp/articles/b1d73ab79112bc61cab74388fd25d6490716e28d,5/8(水) 15:30
2024-05-08,16:18,TTL,総合,12,音楽ナタリー,COCKROACHEEE'zのラッパー小宮守が死去,https://news.yahoo.co.jp/articles/f772ab49f7fd95599e0ce08727ad0f4578273c30,5/8(水) 15:02
2024-05-08,16:18,TTL,総合,13,スポーツ報知,「ヒルナンデス！」２８歳ゲスト「僕、ガチガチの２世なんで」と自虐さく裂　ネット「逆に好感度上がった」,https://news.yahoo.co.jp/articles/cc2dda167604eb2ccced8e25c3557252720b01c1,5/8(水) 13:55
2024-05-08,16:18,TTL,総合,14,オリコン,“ノリでやった”4度の二重整形に「後悔はありません」、カジュアル化が広がるもSNSではいまだ「美醜でアンチをしてくる人が多い」,https://news.yahoo.co.jp/articles/15e7290c6a500a7a5302c74f4b711c48a45b707a,5/8(水) 9:10
2024-05-08,16:18,TTL,総合,15,日刊スポーツ,56歳原田知世“衝撃の美貌”にネット騒然「可愛さに心臓が飛び出そうに」,https://news.yahoo.co.jp/articles/316f6b4d780eab8711222db2aa9569da52d24eaa,5/8(水) 13:52
2024-05-08,16:18,TTL,総合,16,スポーツ報知,売れっ子女優３人の女子会が「メンツ強すぎ」「ビビる」と騒然！「可愛さの塊」「楽しそう」…芳根京子が公開,https://news.yahoo.co.jp/articles/50b3200299461e6ccc70a947802437a695b221dd,5/8(水) 12:25
2024-05-08,16:18,TTL,総合,17,ENCOUNT,マクドナルド店員が年配客に「表に出ろ」激怒　同僚女性店員が止めに入る動画が拡散　「心より深くお詫び」謝罪,https://news.yahoo.co.jp/articles/182504b37bb46a1c808c7ba2cfc78fd814a176d1,5/7(火) 17:42
2024-05-08,16:18,TTL,総合,18,ハフポスト日本版,米セレブのきつすぎるドレスが物議「ファッションじゃなくて自傷。危険」の声も,https://news.yahoo.co.jp/articles/8f266b7740af987b51d64c2e681cf438db9f4838,5/8(水) 13:34
2024-05-08,16:18,TTL,総合,19,東海テレビ,40代位の母親と10代の娘が乗る…朝の踏切で立ち往生した車に電車衝突 母親を搬送 約2時間運転見合わせに,https://news.yahoo.co.jp/articles/a79c13eac0c2a87daa1628501ac6cce3aab7e919,5/8(水) 11:54
2024-05-08,16:18,TTL,総合,20,FNNプライムオンライン,「俺はストーカーじゃねえぞ」と女性蹴る…新宿区のタワマンで20代女性を複数回刺した51歳の男逮捕　被害者は病院搬送後死亡,https://news.yahoo.co.jp/articles/8b79ca945568444042bb7c4ddfcab6bd1d486140,5/8(水) 12:43
2024-05-08,16:18,TTL,総合,21,スポーツ報知,「そんなことある？」７２歳大物司会者が３８歳年下女性と服かぶり！「小顔」「おしゃれ」ファン仰天,https://news.yahoo.co.jp/articles/09c15a45c5eb570964c133625122e7a358d54e5a,5/8(水) 10:55
2024-05-08,16:18,TTL,総合,22,Hint-Pot,「月に75万円」　スイスの保育園料に日本人ママが悲鳴　一般家庭の子育て方法とは,https://news.yahoo.co.jp/articles/3a761e5080b311a3103d4cf22117a86dab7aaa32,5/8(水) 11:21
2024-05-08,16:18,TTL,総合,23,スポーツ報知,【巨人】 山瀬慎之助が１軍合流へ　不振の大城卓三と入れ替え,https://news.yahoo.co.jp/articles/bf897b3ad5971488126b9106d359d59cd6039d68,5/8(水) 12:14
2024-05-08,16:18,TTL,総合,24,ねとらぼ,加護亜依、小学校なじめず「荒れる7歳長男」に苦悩　“現場目撃”で衝撃「私の知ってる息子じゃない」「何回も悩んで泣いた」,https://news.yahoo.co.jp/articles/d8c66dcfba35210843fcefbbd2f02ea07a7b4579,5/8(水) 11:50
2024-05-08,16:18,TTL,総合,25,CoCoKARAnext,「この男は本物だ！」山本由伸がメジャー自己最長の8回を投げ切り今季4勝目！ 初回から19球連続ストライクの記録も達成,https://news.yahoo.co.jp/articles/160379d2e809662079470b3fc241199bbc9efe0e,5/8(水) 13:56
2024-05-08,16:18,TTL,総合,26,みんかぶマガジン,税金下げろ、政権交代へ！増税地獄、鬼の岸田に国民がNOを突き付けた…減税候補の得票総数は53%の真実が明らかになった,https://news.yahoo.co.jp/articles/a3d0bac4ab70b0fb748c47c27a5e1e4f80a9ccb9,5/8(水) 12:10
2024-05-08,16:18,TTL,総合,27,日刊ゲンダイDIGITAL,メッツ傘下3A藤浪晋太郎の厳しすぎる現実 メジャー復帰どころか「日本球界出戻り」に現実味,https://news.yahoo.co.jp/articles/d4b0a669e6166664c85044ff1ce26aafb7d68e97,5/8(水) 11:02
2024-05-08,16:18,TTL,総合,28,スポニチアネックス,看板で有名な「きぬた歯科」富士山人気撮影スポット問題解決に名乗り「いいアイデア」「逆に観光名所に」,https://news.yahoo.co.jp/articles/3e6e98a731574968e26a72918dfc4c1191cae228,5/2(木) 15:26
2024-05-08,16:18,TTL,総合,29,ハフポスト日本版,【刀剣ランキング】一度は実物を見たい日本刀1位は？『村雨』『和泉守兼定』を抑えたのは刃文が美しい刀だった,https://news.yahoo.co.jp/articles/b4e72523d0c7b35b6a717a5b07e9c1eddf364a97,5/8(水) 11:40
2024-05-08,16:18,TTL,総合,30,スポニチアネックス,元日テレ人気アナ　21歳の姿を公開「さすがのイケメン」「雰囲気違う」「タッキーに見えた」の声,https://news.yahoo.co.jp/articles/9a1354e65ebcf1fac54415b3a7140430cec4bc6e,5/8(水) 12:17
2024-05-08,16:18,TTL,総合,31,ABEMA TIMES,なんだ、ただの聖人か… 大谷翔平、審判への対応がヤバすぎる　礼儀正しすぎる挨拶が話題に「さすがの人格者」「これが好かれる理由」,https://news.yahoo.co.jp/articles/6b661573031584cbd1310a09da5b0f4d546c5954,5/8(水) 11:51
2024-05-08,16:18,TTL,総合,32,MRO北陸放送,「関東が優先なの?」の恨み節も 北陸新幹線敦賀延伸で見えた乗り換え問題 「北陸から西」の移動はどうする?,https://news.yahoo.co.jp/articles/3c83ec94b101a78b16106e7ce39e2af737b4f339,5/8(水) 13:06
2024-05-08,16:18,TTL,総合,33,BUSINESS INSIDER JAPAN,日本のイチゴが大ヒット、アメリカで脚光の200億円調達ベンチャー。「世界で一人勝ち」の理由,https://news.yahoo.co.jp/articles/684994faef0034b8abb0f6cb487209cef5a46971,5/8(水) 8:10
2024-05-08,16:18,TTL,総合,34,ABEMA TIMES,球場騒然！あれっ？ 大谷翔平が突然、消えた…！？　相手投手のモーションを完全に盗む→あっさり盗塁を決めた瞬間 「いきなり二塁にいたw」「牽制しても走るんだろ？」,https://news.yahoo.co.jp/articles/60e63caae06ef3bff0412a42813fae86cf40ca29,5/8(水) 11:46
2024-05-08,16:18,TTL,総合,35,Full-Count,大谷翔平、驚異のリーグ10冠　無安打でも得点1位浮上…“500億円軍団”で図抜けた成績,https://news.yahoo.co.jp/articles/00232aa578514aca7d08b38fb199e92bc180fb46,5/8(水) 13:30
2024-05-08,16:18,TTL,総合,36,スポニチアネックス,ヒカル　2400万円の新型レクサス譲り受け？「欲しいってツイートして3日後に」持論振りかざすも撃沈,https://news.yahoo.co.jp/articles/c0390ea2ffb48e4df009cdfd96758009c90c0778,5/8(水) 13:59
2024-05-08,16:18,TTL,総合,37,ABEMA TIMES,相手投手ビクッ！ 大谷翔平の“4戦連発目前弾”の衝撃で“少し縮んだ”！？ 視聴者「上がってたらスタンドぶち込んでた」「ぐわしゃ」,https://news.yahoo.co.jp/articles/150b5718baf4c7276c378c0605a3e81b8bdcd386,5/8(水) 14:54
2024-05-08,16:18,TTL,総合,38,日刊スポーツ,オードリー春日俊彰、“芸能界唯一の友人”は15歳下女性タレント「友達がいないんですよね」,https://news.yahoo.co.jp/articles/b7d399e4c776a67deba422604d65aae33dfb1444,5/8(水) 12:09
2024-05-08,16:18,TTL,総合,39,RONSPO,まだそれ言うか？「井上尚弥はそれほど強くなかった。世界最高の選手ではない」東京ドーム決戦でダウン奪うも6回TKO負けしたネリが“悪童”に戻って米記者に負け惜しみ…一方のモンスターは？,https://news.yahoo.co.jp/articles/3834a68cc578af14caf5b5a5357e153281fb249e,5/8(水) 6:00
2024-05-08,16:18,TTL,総合,40,日刊ゲンダイDIGITAL,生田斗真は氷山の一角か？「無痛分娩」不適切発言の裏に旧ジャニタレのSNS問題,https://news.yahoo.co.jp/articles/c170664e20cc952824fc718731509748dcf8d8c6,5/8(水) 13:58
