scrp_date,scrp_time,genre_en,genre_jp,rank,media_jp,title,link,date_original
2025-11-01,15:09,TTL,総合,1,Full-Count,佐々木朗希が安堵「助かったと思った」　ピンチで降板→劇的勝利で“逆王手”…試合後に本音,https://news.yahoo.co.jp/articles/ef2190e687d9aeb948393a144175b777f6cf4d91,11/1(土) 12:56
2025-11-01,15:09,TTL,総合,2,デイリースポーツ,ブルージェイズぼう然のまさかの幕切れ　バーガーが痛恨走塁死　ＮＨＫ解説田口氏もあ然「絶対にアウトになってはいけないところ。この幕切れで流れはドジャースかな」王手一転崖っぷちに,https://news.yahoo.co.jp/articles/4bc9a92a6630fe7ddc6c4b26ffd2f85ca43550e6,11/1(土) 12:28
2025-11-01,15:09,TTL,総合,3,Full-Count,山本由伸は「グレートだった」　ロバーツ監督が快投を絶賛…明かした6回降板の理由,https://news.yahoo.co.jp/articles/f1c243af144f30edf0167e8f9795657d463f7b3d,11/1(土) 12:39
2025-11-01,15:09,TTL,総合,4,産経新聞,「もう始まった…」石破氏が「後ろから鉄砲」解禁か　高市政権批判も党内「丁寧な無視で」,https://news.yahoo.co.jp/articles/301375e15ecf5296be3ab81ce8103e0fbebd4512,11/1(土) 7:00
2025-11-01,15:09,TTL,総合,5,Full-Count,ド軍が“逆王手”、日本人トリオ躍動　大谷は1安打1得点、由伸が6回1失点,https://news.yahoo.co.jp/articles/0c6dde79ea440af424f839f2a75635a53afb933b,11/1(土) 12:11
2025-11-01,15:09,TTL,総合,6,日刊スポーツ,ロバーツ監督、第７戦先発「未定」中３日の大谷翔平の投入問われ「やったことないこと出てくる」,https://news.yahoo.co.jp/articles/ab48b62191bf3ee52c8ad12a8323a10efacfbe03,11/1(土) 13:13
2025-11-01,15:09,TTL,総合,7,スポーツ報知,「きょう真美子さん…」ドジャースの美人妻たちが雰囲気ガラリ！「わあ素敵」おそろいコーデで一致団結,https://news.yahoo.co.jp/articles/5c9f6e2f12d9e49b35670af0b6120a9baec9ac88,11/1(土) 9:55
2025-11-01,15:09,TTL,総合,8,西スポWEB OTTO！,授かり婚→TVで衝撃の離婚発表から2カ月…40歳女優＆人気俳優〝親密〟ショットに「凄く幸せそう」「とっても素敵」「久々に見たけど美しい」の声　話題のドラマオフショットに反響,https://news.yahoo.co.jp/articles/849788c29470affc3ff03301487b6328a6816054,11/1(土) 11:04
2025-11-01,15:09,TTL,総合,9,Full-Count,山本由伸をグラスノー称賛「僕が見た中でも最高レベルの投手」　“救世主”に疑いなし「驚異的」,https://news.yahoo.co.jp/articles/3089fb1866cc67c636783dccd79d6e928285711e,11/1(土) 12:51
2025-11-01,15:09,TTL,総合,10,Full-Count,山本由伸は「3億2500万ドルでも安かった」　“救世主”に称賛殺到「650億円は与えるべき」,https://news.yahoo.co.jp/articles/29df1b3ed7cfae8e5dd0919865f44a79a5cdc225,11/1(土) 11:20
2025-11-01,15:09,TTL,総合,11,東スポWEB,赤井英和　亀田史郎氏の兄を全校生徒の目の前でボコボコに「先生も職員室から見てました」,https://news.yahoo.co.jp/articles/6b343937db79c65cf5eef5243b9920f59d83a093,11/1(土) 10:45
2025-11-01,15:09,TTL,総合,12,スポーツ報知,元ＮＨＫ中川安奈アナが「けしからん」「太もも」「あらま」「これは反則」「脚が」と絶賛,https://news.yahoo.co.jp/articles/398d5f8b94ed81243986bdc1f4cc2ac99b6445b9,11/1(土) 11:55
2025-11-01,15:09,TTL,総合,13,スポニチアネックス,ドジャース逆王手　幸運呼んだ9回土壇場での打球フェンス挟まり　SNSも騒然「天文学的確率」,https://news.yahoo.co.jp/articles/51fa6011f7c5036379fe8879551b7a9f87d59a98,11/1(土) 12:52
2025-11-01,15:09,TTL,総合,14,テレビユー山形,骨が皮膚を突き破るほどの衝撃で襲われた　南陽市職員がクマ警戒中にクマに襲われる　ケガは右手開放骨折の重傷と判明（山形）,https://news.yahoo.co.jp/articles/2d0f3cce05d99fd6cd667727f99ef01ce301e9ec,11/1(土) 11:24
2025-11-01,15:09,TTL,総合,15,CBCテレビ,「夢唯は気付いてもらえず心肺停止に」 “異常知らせるアラーム”は鳴らない設定になっていた 医療事故で亡くなった3歳の女の子 現場に広がる深刻な“アラーム慣れ”,https://news.yahoo.co.jp/articles/366c588880e7fac2776f610361f9d41388dd8163,11/1(土) 7:32
2025-11-01,15:09,TTL,総合,16,FNNプライムオンライン,容疑者は被害者夫の「高校の同級生」26年前の名古屋主婦殺害事件で安福久美子容疑者（69）を逮捕　被害者夫「26年かかったけど…よかった」,https://news.yahoo.co.jp/articles/c5e07b0e953dd2a53308b5bae1719cf9a7bc9298,11/1(土) 11:39
2025-11-01,15:09,TTL,総合,17,ねとらぼ,53年前のボロボロな自販機に、350円を入れると……　飛び出した“まさかの商品”に「こういうのでいいんだよ」「良すぎやろ…」,https://news.yahoo.co.jp/articles/f214067583cf4d1894cbf9342bacea4e54c0b64a,11/1(土) 11:30
2025-11-01,15:09,TTL,総合,18,デイリースポーツ,【高市首相】空母の上で跳びはね批判に青山和弘氏「野党側批判、本質じゃない」　元自衛官の前議員は大統領ヘリ同乗を高評価「外交的に大きい」,https://news.yahoo.co.jp/articles/471129c8b0217aabe8f8dee73fdc701e1c7b6c06,11/1(土) 11:12
2025-11-01,15:09,TTL,総合,19,デイリースポーツ,ドジャース奥さま会　おそろいコートで敵地に大集結！圧巻の光景に「みんな素敵」「コートが」「女の子たちも燃えている」,https://news.yahoo.co.jp/articles/a7c118cb4bdf7d2e0ee4306fde39fa5bddb37c31,11/1(土) 8:42
2025-11-01,15:09,TTL,総合,20,西スポWEB OTTO！,優勝会見での離婚発表から2カ月…〝雰囲気一変〟29歳アスリート「乗り越えた私お疲れ」プライベートショットに反響続々「印象変わる」「スタイル抜群」,https://news.yahoo.co.jp/articles/b92ee9c5ab36f101629054912b93f9c82c3d5cdc,11/1(土) 11:30
2025-11-01,15:09,TTL,総合,21,スポニチアネックス,山本由伸　第7戦はブルペン待機？「応援を頑張りたい」「プレーする人は大変だと…」会見で爆笑さらう,https://news.yahoo.co.jp/articles/cf911f0329698f49b9c0a744d7a8d66b252747fa,11/1(土) 12:55
2025-11-01,15:09,TTL,総合,22,スポニチアネックス,有吉弘行　妻から「“凄い人と写真撮ったよ”って写真が」まさかの人物に「笑っちゃいました」,https://news.yahoo.co.jp/articles/94c110a719f588de7ff32022c781dde5ff268501,11/1(土) 12:50
2025-11-01,15:09,TTL,総合,23,Full-Count,ド軍劇的勝利の裏で…NHK解説は苦言止まらず　断罪したBジェイズのミス「あってはいけない」,https://news.yahoo.co.jp/articles/fe6edd7848cf5806c38688f4d7258f78feaf7fba,11/1(土) 14:05
2025-11-01,15:09,TTL,総合,24,デイリースポーツ,ロバーツ監督「明日の先発は未定」会見で明言せず「ショウヘイも可能性ある」「ヨシノブ以外は全員投げられる」グラスノー連投も,https://news.yahoo.co.jp/articles/7281755bf5a32dea9e9babee8eaba170eaa79741,11/1(土) 12:49
2025-11-01,15:09,TTL,総合,25,朝鮮日報日本語版,トランプ大統領が李大統領に贈ったバット、サインしたのはメジャー2年目の2割打者だった,https://news.yahoo.co.jp/articles/6885806e424708809c32d2c3901c2c8c7aa77df4,11/1(土) 11:35
2025-11-01,15:09,TTL,総合,26,Full-Count,山本由伸に「またしても」　2度目の完敗…敵将も称賛「本当に素晴らしかった」,https://news.yahoo.co.jp/articles/ff9fca214c6422dbd0ab88aeb4fc7a15937714b7,11/1(土) 13:06
2025-11-01,15:09,TTL,総合,27,スポーツ報知,米レジェンド断言「明日ドジャースが勝てばＭＶＰは山本由伸」オルティス氏、理由も熱弁「真の戦士だ」,https://news.yahoo.co.jp/articles/fef523796102ff72d41836010d87546ae75efda3,11/1(土) 14:26
2025-11-01,15:09,TTL,総合,28,スポーツ報知,ドジャースＷＳ連覇へ逆王手　運命の第７戦先発は山本由伸以外の全員が「登板可能」とド軍監督　大谷翔平を中３日投入も,https://news.yahoo.co.jp/articles/a0ac0c444432ef4de095bcbe77def77831a575ce,11/1(土) 12:52
2025-11-01,15:09,TTL,総合,29,スポニチアネックス,ド軍ディーン「ちょっと怖かった」両軍の明暗分けたプレー振り返る「ルールは分かっていたけど…」,https://news.yahoo.co.jp/articles/b6622efedad98e78086c4cb3ce6a8476b04cb92e,11/1(土) 14:13
2025-11-01,15:09,TTL,総合,30,高校野球ドットコム,11球団が注目した大型外野手が4年目で戦力外…今季は左アキレス腱断裂手術で長期離脱,https://news.yahoo.co.jp/articles/7bf013d29c95bea36dd0eb61a76b17926c274914,11/1(土) 11:32
2025-11-01,15:09,TTL,総合,31,デイリースポーツ,山本由伸　ミスを犯したマンシーにベンチで目を合わせて声かけ　人柄にじんだワンシーン　ベッツにもジェスチャー　６回１失点で降板,https://news.yahoo.co.jp/articles/a594002eb89aaaceec660410e972825f2e559c29,11/1(土) 9:28
2025-11-01,15:09,TTL,総合,32,デイリースポーツ,佐々木朗希がまさか…イニングまたいだ九回に悪夢　死球とエンタイトル二塁打で絶体絶命のピンチ→グラスノーが完璧救援　キケの好プレーも,https://news.yahoo.co.jp/articles/89af9d15eb7b4a2fec447415cf082d822f66aade,11/1(土) 12:10
2025-11-01,15:09,TTL,総合,33,クランクイン！,奇跡の43歳・山川恵里佳、美スタイル全開のミニ丈で魅了「可愛い」　2児の母,https://news.yahoo.co.jp/articles/bada5225d504b429e4ad5bdacb08eb9bda14656b,11/1(土) 12:00
2025-11-01,15:09,TTL,総合,34,スポーツ報知,ロバーツ監督、９回のドタバタ劇を解説　ディーンの“頭脳プレー”は「素晴らしかったが…」　グラスノー投入の理由は？,https://news.yahoo.co.jp/articles/c7cfe93d261417cefffaee31c972f65ed086ff1e,11/1(土) 13:43
2025-11-01,15:09,TTL,総合,35,Hint-Pot,「日本とは比べ物にならないよ」　ドイツ人が驚愕　「数日で、ようやく1人見たくらい」と興奮した光景とは,https://news.yahoo.co.jp/articles/0b80637b7d45cfcb91f3645117e9e261eb99bcc7,11/1(土) 13:40
2025-11-01,15:09,TTL,総合,36,デイリースポーツ,マジ！？本当だったｗ　トランプ大統領、ＡＰＥＣから先に帰国した理由→ホワイトハウスのＸにネット爆笑「７９歳凄すぎる」「トランプすげえな」　習主席と会談→同じ日に！,https://news.yahoo.co.jp/articles/96d5e9e3c06fdda758bc914db84eeac669888fc8,11/1(土) 0:27
2025-11-01,15:09,TTL,総合,37,スポニチアネックス,Bジェイズ監督　決戦先発はレジェンドに託す「彼以上の適任者はいない」　32年ぶり世界一へ運命の最終戦,https://news.yahoo.co.jp/articles/ec6507661f0d750f1f040a176214e4ca7dedb5d7,11/1(土) 12:45
2025-11-01,15:09,TTL,総合,38,CoCoKARAnext,先発補強目指す巨人も興味？　「ソフトバンク33歳、最多勝右腕」の去就にX注目　3年連続2桁マークの鉄腕「今の巨人に1番必要な投手」「マジで来てほしい」,https://news.yahoo.co.jp/articles/fe86430cbe83ff5d9e5862ff665355cd0b620a15,11/1(土) 11:02
2025-11-01,15:09,TTL,総合,39,メ〜テレ（名古屋テレビ）,「意外すぎて実感がわかない…」容疑者は高校時代の同級生　1999年の主婦殺害事件、夫が驚きを語る,https://news.yahoo.co.jp/articles/3acdaf0939623df58b310bba4c676cdd406e3df2,10/31(金) 22:16
2025-11-01,15:09,TTL,総合,40,ゴルフ総合サイト ALBA Net,＜速報＞渋野日向子が起死回生の4連続バーディ　通算3アンダーで予選通過へ,https://news.yahoo.co.jp/articles/ba0fee46daa2b3675e345e935e63ed46d89cca30,11/1(土) 14:26
