scrp_date,scrp_time,genre_en,genre_jp,rank,media_jp,title,link,date_original
2026-01-24,16:08,domestic,国内,1,日刊スポーツ,高市首相が”本当に戦っている相手“は野党でなく「自民党内の超大物」…政治学者が実名推察,https://news.yahoo.co.jp/articles/8ff33380d6c79faf51ee7ee3577f8c2a8ea9b358,1/24(土) 9:42
2026-01-24,16:08,domestic,国内,2,日刊スポーツ,原口一博氏「河村のおやじと皆さんの力で」政党要件「ギリギリ得た」他の合流予定者も実名告白,https://news.yahoo.co.jp/articles/1e8efca746c32d2078171b99fb78769783b81c4a,1/24(土) 10:08
2026-01-24,16:08,domestic,国内,3,読売新聞オンライン,与党も８５小選挙区で激突の異例の構図…自民幹部「首相は今回、大阪には入れないのではないか」,https://news.yahoo.co.jp/articles/50aa07e7097462b53c83801d553a81faa8106f94,1/24(土) 9:15
2026-01-24,16:08,domestic,国内,4,日刊スポーツ,京大医学部卒の25歳モデル、国民民主公認で衆院選挑戦…Ｘ熱烈声援「合格」「玉木さん好きそう」,https://news.yahoo.co.jp/articles/6b77f295db3559c5c8e244bd31bfae1ca6e36b64,1/24(土) 11:02
2026-01-24,16:08,domestic,国内,5,読売新聞オンライン,「ファーストジェントルマン」の長男が衆院選出馬を断念…「世襲の批判は切っても切れず、党全体への影響を考え見送るべきだと考えた」,https://news.yahoo.co.jp/articles/232f51f642ffc0676e111a37100200a9c274f6d5,1/24(土) 14:59
2026-01-24,16:08,domestic,国内,6,弁護士JPニュース,内部通報したら「8畳の部屋で3年3か月独り勤務させられ」…あおぞら銀行員が逆転勝訴 東京高裁、約840万円の賠償命じる,https://news.yahoo.co.jp/articles/d4a76415f7b9f97e8b13304cd00f74534c890778,1/23(金) 18:04
2026-01-24,16:08,domestic,国内,7,デイリースポーツ,ひろゆき氏　「アメリカだけでなくドイツでも高市財政の失策を報道」→国債市場から信用されなくなった,https://news.yahoo.co.jp/articles/63ca3a9a1e611eccaa0f426f16a9c0aaafc9410d,1/24(土) 11:18
2026-01-24,16:08,domestic,国内,8,共同通信,中道、円より子氏の公認取り消し　比例東京、元国民民主,https://news.yahoo.co.jp/articles/a919f4766dec5342998ed08d20a725c45a09a2fd,1/24(土) 15:34
2026-01-24,16:08,domestic,国内,9,中日スポーツ,『高市早苗さんが総理のままがいい…』 吉村洋文氏、短文投稿に「ボケにわろた」「漫才ですか」ツッコミ相次ぐ,https://news.yahoo.co.jp/articles/9c79d33a3be58f6ec25dde3bed05602747434760,1/24(土) 11:30
2026-01-24,16:08,domestic,国内,10,共同通信,首相の長男、一転し福井2区から出馬見送り,https://news.yahoo.co.jp/articles/3336638db49b7af3d97f77df7d7d2be850b60f4a,1/23(金) 23:07
2026-01-24,16:08,domestic,国内,11,読売テレビ,【実態】幅80cmの待機スペース、1時間のうち46分“開かず”…全国に残る危険な踏切　“命の対策”が後回しにされるワケ,https://news.yahoo.co.jp/articles/e892e301555224b40caf542af339ee9d39cfc1ff,1/24(土) 13:00
2026-01-24,16:08,domestic,国内,12,日刊スポーツ,自民党鈴木貴子氏、百田尚樹氏に苦言「自民からカネもらってるインフルエンサー相当いる」発言に,https://news.yahoo.co.jp/articles/d93d688dfa4509d98d828d037fc8793e20ee26d6,1/24(土) 10:36
2026-01-24,16:08,domestic,国内,13,日刊スポーツ,「高市さんは今回、前回の選挙で落選した〝裏金議員〟も公認している」政治ジャーナリストが指摘,https://news.yahoo.co.jp/articles/8065531d9ccc8d24ecbef0aa63a1485341cb1f43,1/24(土) 12:24
2026-01-24,16:08,domestic,国内,14,FNNプライムオンライン,【大雪情報 関東甲信】「警報級の大雪」の可能性　甲信地方60センチ、関東地方北部25センチ　24時間予想降雪量（25日午前6時まで・多い所で）　交通障害に警戒,https://news.yahoo.co.jp/articles/ee1cf0e07e6df1b53f627bea8a3d4b4445206b59,1/24(土) 12:51
2026-01-24,16:08,domestic,国内,15,ABEMA TIMES,「パフェすげええ」永瀬拓矢九段は昼食にまさかの“特製フルーツパフェ”注文！「存在感が」「倒れそうな高さ」と反響続々,https://news.yahoo.co.jp/articles/f284324258a6530e437e7eee33748cf80f45fcc5,1/24(土) 14:15
2026-01-24,16:08,domestic,国内,16,スポニチアネックス,選挙プランナー　早くも衆院選の情勢分析　高市自民の獲得議席は？「選挙に奇跡は起きません」,https://news.yahoo.co.jp/articles/18766767940236dc465c63b0b114d89be51a86a4,1/23(金) 21:23
2026-01-24,16:08,domestic,国内,17,共同通信,自民元職が離党届、中道から出馬意向固める,https://news.yahoo.co.jp/articles/60fe6c17acf241c701e257cd7c66ba656009386c,1/22(木) 22:11
2026-01-24,16:08,domestic,国内,18,日刊スポーツ,橋本五郎氏、衆院選「公明票」の行方“２つのポイント”解説「これによってかなり違ってきます」,https://news.yahoo.co.jp/articles/16c2b914843537c22a38dd44121ee5bd8e3bc23e,1/24(土) 15:16
2026-01-24,16:08,domestic,国内,19,日刊スポーツ,鳩山由紀夫元首相「高市早苗を信任するか否かなどという低次元な茶番は願い下げ」衆院選に持論,https://news.yahoo.co.jp/articles/131838f1be58272c7737ae5917f5a22029ee6c95,1/24(土) 7:06
2026-01-24,16:08,domestic,国内,20,FNNプライムオンライン,高市総理の夫の長男・山本建氏が衆院選への出馬を辞退　自民党の公認見送りで「無所属」出馬の意向示した矢先…福井2区,https://news.yahoo.co.jp/articles/482b1d751fc2bab97a159505176810300f2ed40b,1/23(金) 23:45
2026-01-24,16:08,domestic,国内,21,ABEMA TIMES,参政党、参院選の「日本人ファースト」からキャッチコピー変更 神谷代表「文法間違えていると必ず突っ込まれると思いますが…」,https://news.yahoo.co.jp/articles/c7426956aaa1ec2a1d3f269d809a8db245095a0f,1/23(金) 21:24
2026-01-24,16:08,domestic,国内,22,スポニチアネックス,原口一博氏と河村たかし氏が新党「減税日本・ゆうこく連合」旗揚げ　元参政・鈴木敦氏ら合流 28人擁立へ,https://news.yahoo.co.jp/articles/8267711bcb942dd6ffd4f75c273ad4fa527760a3,1/24(土) 14:59
2026-01-24,16:08,domestic,国内,23,J-CASTニュース,自民党・河野太郎氏、衆院解散で「万歳」せず　その理由にネット反響「確かに」「わかります」,https://news.yahoo.co.jp/articles/d556d86429696729949058960325ad0d2ac1aee4,1/23(金) 18:14
2026-01-24,16:08,domestic,国内,24,毎日新聞,衆院千葉　12選挙区で自民と中道が激突へ　「全く票が読めない」,https://news.yahoo.co.jp/articles/3cf54745455a250de7cc47b0b11a0550c94c49de,1/24(土) 14:45
2026-01-24,16:08,domestic,国内,25,日刊スポーツ,原口一博氏、河村たかし氏を「副代表」と間違え謝罪→呼び名「３文字」ポロリで会見和やかムード,https://news.yahoo.co.jp/articles/59cfa1371db23d05df4b1d95f04b2d7567a69f49,1/24(土) 15:19
2026-01-24,16:08,domestic,国内,26,ねとらぼ,「あ！　本当だ！」　“愛子さまの着物”に28万いいね　天皇皇后両陛下は“おそろいコーデ”　「気が付きませんでした」【天皇ご一家】,https://news.yahoo.co.jp/articles/95be02117e87ec79998aecb9069469caa7eb26eb,1/24(土) 6:00
2026-01-24,16:08,domestic,国内,27,朝日新聞,回送の路面電車が脱線事故、運転士にけがなし　積雪の富山・高岡で,https://news.yahoo.co.jp/articles/0dacdade6a6c719be0816d5ce9aba2a4d0685d2f,1/24(土) 12:51
2026-01-24,16:08,domestic,国内,28,中日スポーツ,「自己中解散ヤバすぎ」 衆院選『費用850億円」報道に怒りの声 「そんなお金があるなら…」「はらわた煮えくり返りそう」,https://news.yahoo.co.jp/articles/a04ef9c743ba530e6c57b065148eec7b56da1fd2,1/24(土) 12:30
2026-01-24,16:08,domestic,国内,29,ABEMA TIMES,未確認生物「ムッシー」兵庫県加古川で目撃されブームも…目撃者が語る「ここ2年は姿が見えない」「あれは怪獣だと思っている」,https://news.yahoo.co.jp/articles/495cf39a5a55abd5476ab718b8ff6784180c51db,1/24(土) 12:30
2026-01-24,16:08,domestic,国内,30,中日スポーツ,真冬の衆院選に打って出た高市早苗首相、首相官邸SNSは『雪下ろし事故』注意呼びかけも… 小沢一郎議員は“ひと言”で批判,https://news.yahoo.co.jp/articles/411ee5bd7ed9a9ea623ababe879e87f81702ad8b,1/24(土) 13:15
2026-01-24,16:08,domestic,国内,31,ABEMA TIMES,トラックなど3台絡む事故 3人けがで搬送,https://news.yahoo.co.jp/articles/47a04d28d90962895b310dff51a474de3d42cabc,1/24(土) 14:27
2026-01-24,16:08,domestic,国内,32,読売新聞オンライン,自民党と国民民主党の前議員に２新人が挑む「経験したことがない厳しい戦い」…衆院愛媛１区「対決の構図」,https://news.yahoo.co.jp/articles/db785673c633660aba386d7ce711d41978546920,1/24(土) 15:15
2026-01-24,16:08,domestic,国内,33,47NEWS,批判されても、嫌われても、前首相・石破茂が「黙らない」理由　２４歳、「闇将軍」と呼ばれた政治の師の教えが原点　再登板への意欲は…,https://news.yahoo.co.jp/articles/4ab4be0e967584ca77bae049e358767ffcf426b1,1/24(土) 9:32
2026-01-24,16:08,domestic,国内,34,ABEMA TIMES,「そもそも皆さんは保険会社か？ 詐欺師を抱える犯罪組織か？」「高圧的に『質問するなら出て行け』と…」プルデンシャル生命 31億円“詐取” 会見で追及止まらず,https://news.yahoo.co.jp/articles/469ae947a9f64514afff4c0cc56b47a1cbb68e07,1/23(金) 18:15
2026-01-24,16:08,domestic,国内,35,TBS NEWS DIG Powered by JNN,茨城県ひたちなか市のバイク店で火事　男性1人が病院搬送　隣接する飲食店にも延焼し現在も消火活動中　茨城県警,https://news.yahoo.co.jp/articles/3a34df74331358d794a6e82d6f88f857b2a238f6,1/24(土) 15:16
2026-01-24,16:08,domestic,国内,36,読売新聞オンライン,食料品の消費税２年間ゼロ、高市首相「国債発行せずに財源確保できる」…税外収入や補助金見直しで,https://news.yahoo.co.jp/articles/10921cbebdbea9a477f240e32a165ce563e1db3a,1/24(土) 5:00
2026-01-24,16:08,domestic,国内,37,レスキューナウニュース,〔関西電力送配電〕和歌山県での停電は復旧(24日12時45分現在),https://news.yahoo.co.jp/articles/5a9cb9f55b16ad774042bd53c560c0f54f685123,1/24(土) 11:50
2026-01-24,16:08,domestic,国内,38,デイリースポーツ,立民前代表　「他者への嫌がらせ投稿はやめよう」→【中道改革連合と信教の自由】についての考えを示し,https://news.yahoo.co.jp/articles/7a5e9e0345a1573bbeaf541a07b79b876515723b,1/24(土) 9:46
2026-01-24,16:08,domestic,国内,39,TBS NEWS DIG Powered by JNN,「遭難で何人も亡くなるのを見て悲しい思いをする方を無くしたい」八ヶ岳・唯一の山岳診療所が向き合う命　小屋番と山岳医が描く“無報酬ボランティア”からの脱却,https://news.yahoo.co.jp/articles/dc3bee6982a84a32271736c608e7c0a3c5f2c74f,1/24(土) 14:32
2026-01-24,16:08,domestic,国内,40,共同通信,外国人の生活保護、見直し検討も　在留資格で利用実態を把握,https://news.yahoo.co.jp/articles/f8af0fbc1b226b869484d3b1571eaf3c872a5fa0,1/23(金) 16:17
