scrp_date,scrp_time,genre_en,genre_jp,rank,media_jp,title,link,date_original
2025-09-07,16:06,sports,スポーツ,1,スポニチアネックス,【山本由伸と一問一答②】大記録逃した一発は自身が球種を選択「凄く悔しかった。やられたかという感じ」,https://news.yahoo.co.jp/articles/f52215c2c567decd9a57ae7cb16b3b888de7ad14,9/7(日) 12:10
2025-09-07,16:06,sports,スポーツ,2,スポーツ報知,【高校野球】京都国際が２年ぶりのセンバツ出場絶望的　小牧憲継監督「野球の『や』の字にもなっていない」,https://news.yahoo.co.jp/articles/327712790c7a75729c9306e51c2c717440964b5f,9/7(日) 13:57
2025-09-07,16:06,sports,スポーツ,3,サッカーキング,メキシコ代表完封に一定の手応え…日本代表MF遠藤航「前向きな姿勢を見せたいと思っていた」,https://news.yahoo.co.jp/articles/c74ac04889459e7fd8afe0d1bbfe88761b87d125,9/7(日) 13:36
2025-09-07,16:06,sports,スポーツ,4,中日スポーツ,ロバーツ監督、山本由伸にかけた言葉、ノーノー逃した直後に耳元で…あと一人から衝撃の逆転サヨナラ負け「由伸の活躍を無駄にした」,https://news.yahoo.co.jp/articles/de622cb2a73ecb95701215c0aa0010cb1eb34f10,9/7(日) 12:20
2025-09-07,16:06,sports,スポーツ,5,デイリースポーツ,メキシコ戦終盤の不可解判定に元日本代表の解説が苦言止まらず「ＶＡＲみないと分からないんですかね？」「本当ふざけんな！ですよ」,https://news.yahoo.co.jp/articles/a0a80e57c4dae86777351b82e2a58cb270740498,9/7(日) 13:34
2025-09-07,16:06,sports,スポーツ,6,日刊スポーツ,【世界バレー壮行試合】日本男子、世界２位イタリアと連日の対戦　前日フルセット負けの雪辱へ,https://news.yahoo.co.jp/articles/ea89b624ce3a97ec5eb5c4ce96eccb40621b498f,9/7(日) 13:30
2025-09-07,16:06,sports,スポーツ,7,Full-Count,“あと1人”で起きた惨事　ロバーツ監督「台無しにした」…山本由伸の降板を決めた理由,https://news.yahoo.co.jp/articles/edd3160054b59d181c4288a4ffe2a6940829c677,9/7(日) 11:45
2025-09-07,16:06,sports,スポーツ,8,CoCoKARAnext,「どん底に落ちた」9回二死からまさかの敗北に怒りの声　山本由伸の快投をふいにしたド軍救援陣に非難噴出「本当に悪夢だ」,https://news.yahoo.co.jp/articles/3ee337c9a5c401cdd897c97cb8cdc4fbe4324835,9/7(日) 13:13
2025-09-07,16:06,sports,スポーツ,9,デイリースポーツ,「完全にドグソじゃないですか」解説発言にサラリ説明のＮＨＫ実況が話題「悪口かと思ってた」「最高にＮＨＫ」「らしくていい」,https://news.yahoo.co.jp/articles/7ce6afbf1ff1b5fdfe7daa154821e1e5ea326a79,9/7(日) 13:59
2025-09-07,16:06,sports,スポーツ,10,Full-Count,山本由伸の好投を「ぶち壊してしまった」　トライネン消沈…1死も取れず「最悪の気分」,https://news.yahoo.co.jp/articles/7fa19f5efc16bc8378d2ceac56d9116415ca01e2,9/7(日) 12:17
2025-09-07,16:06,sports,スポーツ,11,Full-Count,米記者も唖然…ド軍は「どん底に落ちた」　悪夢を一斉報道、誰も擁護せず「今季最悪」,https://news.yahoo.co.jp/articles/1fdac83a42837bbfe4a38f38b36bb14fe90a221c,9/7(日) 14:24
2025-09-07,16:06,sports,スポーツ,12,ゴルフのニュース,ルーキー・荒木優奈が悲願の初優勝！ 柏原明日架は1打及ばず2位　3位に永井花奈,https://news.yahoo.co.jp/articles/0f75c5b1614b6b514eb7fa6134e2f092ce366ed5,9/7(日) 15:18
2025-09-07,16:06,sports,スポーツ,13,スポーツ報知,全日本プロレス・長尾一大心選手、２１歳で死去…「巡業バス」事故で外傷性ショックのため治療を続けていた…死因は「遺体を警察にお預けし調査を進めております」,https://news.yahoo.co.jp/articles/24af95d4fd2ad50fa20ad7e46355bf62295ee63f,9/7(日) 14:07
2025-09-07,16:06,sports,スポーツ,14,日刊スポーツ,【阪神】熊谷敬宥が丸刈りスタイルでグラウンド入り　史上最速の優勝決定の可能性があるこの日から,https://news.yahoo.co.jp/articles/79c7967ad06f5301c00af611ec24b00a5866ae8d,9/7(日) 15:06
2025-09-07,16:06,sports,スポーツ,15,Full-Count,ド軍悪夢の敗戦にあった“3つのなぜ”　専門家も理解できず…指揮官の采配は「混乱を象徴」,https://news.yahoo.co.jp/articles/085da23f2d7fd1b7a455c74e75410dc459b3c40e,9/7(日) 15:44
2025-09-07,16:06,sports,スポーツ,16,スポニチアネックス,プロレスラー・長尾一大心さん死去　21歳　今年5月に交通事故　ICUでの治療続くも願い届かず,https://news.yahoo.co.jp/articles/1f3825080828fcf9d02f59b30d01ad9ee6838a7b,9/7(日) 14:02
2025-09-07,16:06,sports,スポーツ,17,ゴルフ総合サイト ALBA Net,＜中間速報＞柏原明日架が単独首位でサンデーバックナインへ　永井花奈と荒木優奈1差、政田夢乃ら2差,https://news.yahoo.co.jp/articles/856543da23747b5b739dfc95e630c8eb826c62ef,9/7(日) 12:32
2025-09-07,16:06,sports,スポーツ,18,東スポWEB,ドジャース・ロバーツ監督の「今日のプレーに文句はない」発言が火に油「最悪の監督」「去る時が来た」,https://news.yahoo.co.jp/articles/36f4bc5e8ad8cafe752af8ecfdab5dd49b970810,9/7(日) 15:35
2025-09-07,16:06,sports,スポーツ,19,Full-Count,M1の阪神…甲子園で異例の注意喚起　売店の営業時間変更、勝利後イベント中止の可能性,https://news.yahoo.co.jp/articles/22cb6491c1ed91cb47311122964e87d742548575,9/7(日) 13:19
2025-09-07,16:06,sports,スポーツ,20,Full-Count,大谷翔平、腕を組み見つめた屈辱の敗戦　両膝に手をつくベッツ…ド軍、悪夢の23分間,https://news.yahoo.co.jp/articles/7d623beb932837f4cdbd3083ab12bde59738a4a3,9/7(日) 13:36
2025-09-07,16:06,sports,スポーツ,21,スポーツ報知,２２歳の長野泰雅が完全Ｖでツアー初優勝　杉浦悠太２位、蝉川泰果３位、石川遼は今季初のトップ１０,https://news.yahoo.co.jp/articles/8ecef7b7b68220a628427f7f2158313ff0677d18,9/7(日) 15:04
2025-09-07,16:06,sports,スポーツ,22,デイリースポーツ,ドジャース　天国から地獄の２戦連続サヨナラ負け　山本由伸が九回２死から被弾でノーノー消滅→救援陣大炎上　スコットがまた…,https://news.yahoo.co.jp/articles/7e6fce61b015ce2d6c810754e51dc49454009d2b,9/7(日) 11:11
2025-09-07,16:06,sports,スポーツ,23,スポーツ報知,柏原明日架が１０番トラブルで後退　政田夢乃、永井花奈が首位浮上　大混戦に,https://news.yahoo.co.jp/articles/5a43c3652e09e0a923aceab060dc88be2655ee29,9/7(日) 13:46
2025-09-07,16:06,sports,スポーツ,24,日刊スポーツ,山本由伸のノーノー砕いた打球への右翼手の判断は正解？　SNS上でダイビング捕球求める声も,https://news.yahoo.co.jp/articles/e2f8edf3278207d69060e2e872875354e15cdcc0,9/7(日) 14:43
2025-09-07,16:06,sports,スポーツ,25,日刊スポーツ,「諦めてるじゃないですか」山本由伸のノーノー未遂にNHK解説が本音「跳んだら可能性が」,https://news.yahoo.co.jp/articles/fba10b36bde3b3f8f198de5a797012bc31470da6,9/7(日) 11:40
2025-09-07,16:06,sports,スポーツ,26,東スポWEB,ドジャース山本由伸の悲劇に米メディアも驚く「１０００回に４回の確率」,https://news.yahoo.co.jp/articles/e167fafed2f70dfacec22d737b6832721d964fe6,9/7(日) 13:40
2025-09-07,16:06,sports,スポーツ,27,サッカーキング,韓国に敗れて日本戦へ…アメリカ代表指揮官「結果はすぐに出るだろう」,https://news.yahoo.co.jp/articles/d5c1e2329ef859aed5a4437f3c8c23933e7e543c,9/7(日) 12:51
2025-09-07,16:06,sports,スポーツ,28,馬トク報知,マーク塗り忘れで思わぬ１８６万円超の馬券ゲット！爆笑問題・田中裕二の強運に「こんな奴おるんやなぁ」,https://news.yahoo.co.jp/articles/689567a595506136cc09ac78c1050f16542d9119,9/7(日) 11:57
2025-09-07,16:06,sports,スポーツ,29,TBS NEWS DIG Powered by JNN,森保ジャパン、難敵メキシコとスコアレスドロー　久保、三笘、南野ら海外組がゴールに迫るも得点できず【国際親善試合】,https://news.yahoo.co.jp/articles/501da5043c37122dc191ba05b75a86e031728f5b,9/7(日) 12:58
2025-09-07,16:06,sports,スポーツ,30,日刊スポーツ,【阪神】最強ブルペンにまた現れた新戦力　チーム18人目Ｈ　剛腕ぶり際立ち新天地ブレークなるか,https://news.yahoo.co.jp/articles/ce0bf936a0b3e0090daf9cb9105f192644281fb7,9/7(日) 11:48
2025-09-07,16:06,sports,スポーツ,31,東スポWEB,山本由伸の快投をフイにしたトライネンが反省「プロで給料をもらっているのにストライクが…」,https://news.yahoo.co.jp/articles/04b9a8511aa881d79b05eb889c056a9cf89ed464,9/7(日) 15:05
2025-09-07,16:06,sports,スポーツ,32,デイリースポーツ,Ｕ－１８キューバ代表の先発投手が与死球後に珍しい行動　マウンドを降り日本の岡部に近寄る,https://news.yahoo.co.jp/articles/1e9b8ecc012000b3536773b602935f044ab16b84,9/7(日) 14:41
2025-09-07,16:06,sports,スポーツ,33,ゲキサカ,「おいおいおい」戸田和幸氏が日本vsメキシコの退場めぐる判定に本音止まらず「先にイエロー出るって…」「ありえねぇだろって」,https://news.yahoo.co.jp/articles/bf8d1e8074bf4b069535ed7d25050c9579684d24,9/7(日) 14:38
2025-09-07,16:06,sports,スポーツ,34,CoCoKARAnext,「僕の望みとは真逆だった」角田裕毅、念願のQ3進出も陣営から飛んだ“不可解指示”に不満　上位との差を縮められた展開でなぜ？,https://news.yahoo.co.jp/articles/2f24cee163aaa32d7414d27afa36eab0847ee4fb,9/7(日) 11:01
2025-09-07,16:06,sports,スポーツ,35,Full-Count,呆然の山本由伸…NHK中継が捉えた大谷翔平も「悔しいよね」　滲ませた感情にファン涙,https://news.yahoo.co.jp/articles/e84d410b2f5acf8398252fc7c049e99faf792507,9/7(日) 14:57
2025-09-07,16:06,sports,スポーツ,36,TBS NEWS DIG Powered by JNN,女子日本代表、15年ぶりメダルへ大一番　7日3位決定戦は世界ランク2位のブラジルと激突【世界バレー】,https://news.yahoo.co.jp/articles/36b868ac2a31ddc8ac892248c8a3ef1b2fa31095,9/7(日) 13:01
2025-09-07,16:06,sports,スポーツ,37,サンケイスポーツ,阪神・高橋遥人、〝弟分〟早川太貴とのキャッチボールのきっかけは「あまりもん」,https://news.yahoo.co.jp/articles/ee614b26380939bbfa7805a77b06aa8fd25ecd26,9/7(日) 15:00
2025-09-07,16:06,sports,スポーツ,38,デイリースポーツ,ドジャース　ＭＬＢが惨劇の２１分間を異例のフル公開　山本由伸が九回のマウンドへ→被弾→サヨナラ負け　フリーマンらのハグが…,https://news.yahoo.co.jp/articles/c36c6952c4e947560a5d5ae4b4b753da81dfa838,9/7(日) 14:48
2025-09-07,16:06,sports,スポーツ,39,Full-Count,山本由伸、あと1アウトでノーノー逃す　快挙目前、9回2死から被弾…降板も場内喝采,https://news.yahoo.co.jp/articles/f44d31265a488869548b31b2687bc7e37808b30a,9/7(日) 10:52
2025-09-07,16:06,sports,スポーツ,40,毎日新聞,三菱自動車岡崎vs日本生命　スタメン発表　都市対抗野球・準決勝,https://news.yahoo.co.jp/articles/391172d1a085d59ce0c4d13b07352ae74487f4a5,9/7(日) 13:06
