scrp_date,scrp_time,genre_en,genre_jp,rank,media_jp,title,link,date_original
2026-01-30,01:17,domestic,国内,1,FNNプライムオンライン,「公約じゃないなら有権者への欺き」移民政策発言めぐり記者が追及　“全国最年少”の石田嵩人知事が就任会見　波乱のスタートに,https://news.yahoo.co.jp/articles/ea213d397e7601201406554d547c19bf1e79b5a3,1/29(木) 20:45
2026-01-30,01:17,domestic,国内,2,TBS NEWS DIG Powered by JNN,「いちゃいちゃできる」「本番でも何でも紹介できますよ」 錦糸町駅周辺の路上で執拗に客引きか　外国籍の男女5人を逮捕　警視庁,https://news.yahoo.co.jp/articles/78071056ddee5b5d54c62f67415dc3e83265370e,1/29(木) 13:33
2026-01-30,01:17,domestic,国内,3,共同通信,候補に罵声、演説「聞こえない」　おびえる聴衆、事前告知見送りも,https://news.yahoo.co.jp/articles/9e534b9af6a064da7a1de140b02a8d6b9e3307c5,1/29(木) 18:02
2026-01-30,01:17,domestic,国内,4,TBS NEWS DIG Powered by JNN,【第一声 全文】れいわ新撰組・大石晃子共同代表「高市早苗のわがまま解散許したらいけません」「庶民が自分たちの手に政治を取り戻さなければ」【衆議院選挙2026】,https://news.yahoo.co.jp/articles/a7a4129c1be662c37e2917b52d2bb8ce7743c9bb,1/29(木) 18:00
2026-01-30,01:17,domestic,国内,5,tenki.jp,明日30日にかけ日本海側は警報級大雪　関東平野も積雪注意　東京23区内で一時雪か,https://news.yahoo.co.jp/articles/7a9beb5da47ceade31d0d1b989f570fa61c0b5d8,1/29(木) 17:50
2026-01-30,01:17,domestic,国内,6,時事通信,東京・上野で4億円超奪われたか　逃走中にひき逃げも　警視庁,https://news.yahoo.co.jp/articles/2a2177bda5b30fd558e8efc3f895ea5da571b75d,1/29(木) 23:25
2026-01-30,01:17,domestic,国内,7,J-CASTニュース,国民・牛田茉友議員、日刊スポーツ報道に「元メディア出身者として、憤りを感じます」　Xで反論,https://news.yahoo.co.jp/articles/caead74e828ecc37cfeb9e51c85f71581cbff05d,1/29(木) 16:30
2026-01-30,01:17,domestic,国内,8,スポニチアネックス,れいわ幹事長　山本太郎代表の不在で選挙戦は？「山本太郎個人商店みたいに言われるけど…」,https://news.yahoo.co.jp/articles/87f0a1e1e9450a9dca239f4ef36f97e752b90fed,1/29(木) 21:48
2026-01-30,01:17,domestic,国内,9,中日スポーツ,「開き直っててワロタ」自民・萩生田光一幹事長代行の「他の人も不記載」発言にネット非難の声「小学生みたい」「正当化がすごすぎて」,https://news.yahoo.co.jp/articles/039463deef59ffb16aba4d5b15ff0e9cfe549ac0,1/29(木) 20:52
2026-01-30,01:17,domestic,国内,10,日刊スポーツ,【衆院選】橋本五郎氏「甘いんじゃないですか」自民・村上誠一郎氏の比例名簿下位処遇めぐり私見,https://news.yahoo.co.jp/articles/485d1d36b7a58b7590cd973e3c6b602d07bfecf6,1/29(木) 12:34
2026-01-30,01:17,domestic,国内,11,FNNプライムオンライン（フジテレビ系）,行方不明の14歳女子中学生リビング出たのは26日午後7時頃か　黒のジャンパー・黒のブーツ　29日も50人態勢で捜索　新潟・十日町市,https://news.yahoo.co.jp/articles/b4d4f8cdbab7aeac8be79558bf70831e1fcccc71,1/29(木) 11:15
2026-01-30,01:17,domestic,国内,12,日刊スポーツ,【衆院選】うじきつよしの「【大拡散希望！】」の呼びかけに賛否広がる,https://news.yahoo.co.jp/articles/bc2f616849ba588920400048e62e473e410ced83,1/29(木) 9:26
2026-01-30,01:17,domestic,国内,13,J-CASTニュース,ひろゆき氏、雪かき動画で波紋の米山隆一氏に「迷惑系Youtuber？」　本人反論後も「道路に雪をまく行為は禁止」,https://news.yahoo.co.jp/articles/19193d3ec55be4ee4f139a57a92223228bc0163b,1/29(木) 18:32
2026-01-30,01:17,domestic,国内,14,産経新聞,中道改革連合は「中革連」？　自民・麻生氏皮肉る　石破前政権は「どよーんと暗かった」,https://news.yahoo.co.jp/articles/52ca19b9df66326bbd56243cf2f587eff7074690,1/29(木) 17:19
2026-01-30,01:17,domestic,国内,15,産経新聞,埼玉1区は村井氏と武正氏の戦い軸　5区は枝野氏に2新人が挑む　県内選挙区の構図（上）,https://news.yahoo.co.jp/articles/8ab2cc6aefba9574253dbd5392041b136c2a74e5,1/29(木) 21:58
2026-01-30,01:17,domestic,国内,16,スポニチアネックス,ゆうこく・原口共同代表　日本衰退は「弱体化装置が入っているからです」　原因を指摘,https://news.yahoo.co.jp/articles/4622b521f55e0a4540dc38ccfbfc23ffdc5f6fb0,1/29(木) 22:07
2026-01-30,01:17,domestic,国内,17,デイリースポーツ,【高市自民】高市首相に説明責任　文春報道→旧統一教会関係を全面否定してた首相Ｘに→説明求める声　「徹底的に調べ　無し、無し、無し、無し」否定投稿してた　政府会見でも質問飛ぶ「コメント差し控える」,https://news.yahoo.co.jp/articles/30a256baa8e1e34c1fa52431be582961fa8adfe2,1/29(木) 15:36
2026-01-30,01:17,domestic,国内,18,読売新聞オンライン,ガソリンスタンドで給油レーンに駐車中の乗用車全焼、乗っていた複数人は出火後に姿消す,https://news.yahoo.co.jp/articles/dde2fa4a635d32ae1ee028e6752433e721717195,1/29(木) 14:01
2026-01-30,01:17,domestic,国内,19,FNNプライムオンライン,父「万が一を考えると…」中3女子が夕食後に行方不明に　2025年暮れ頃から病気で自宅療養　スマホや財布残し　新潟・十日町,https://news.yahoo.co.jp/articles/1438dedbbad9893c5dad45006a1192d06eeb658d,1/28(水) 19:54
2026-01-30,01:17,domestic,国内,20,TBS NEWS DIG Powered by JNN,【第一声 全文】チームみらい・安野貴博党首「社会保険料を下げることを優先すべき」「自動運転社会を10年以内に作りたい」【衆議院選挙2026】,https://news.yahoo.co.jp/articles/da32a533734c17c0a22db4f703ba04075b71657e,1/29(木) 18:00
2026-01-30,01:17,domestic,国内,21,日刊スポーツ,【衆院選】自民党が「急告」文書を発出「単独過半数うかがう」など序盤の情勢報道受けて,https://news.yahoo.co.jp/articles/70303a14ccd3c0d74d28f3f93e9aee57fdf0d08f,1/29(木) 14:34
2026-01-30,01:17,domestic,国内,22,スポニチアネックス,日本保守党・百田代表　外国人政策を声高訴え　移民政策失敗の欧州を例に「移民はもういらん！」,https://news.yahoo.co.jp/articles/0909ec52e07600b34fd5075373855dba76bdabb4,1/29(木) 22:27
2026-01-30,01:17,domestic,国内,23,FNNプライムオンライン,新潟の中3少女が行方不明に…警察が新たに着衣の情報公開　29日も50人態勢で捜索も発見に至らず…30日も朝から捜索へ,https://news.yahoo.co.jp/articles/a1d8d38a6b5d835ae626b2a50c9d50597d9f912a,1/29(木) 22:00
2026-01-30,01:17,domestic,国内,24,弁護士JPニュース,「吉村前知事は弁護士なのに法律を理解していない」大阪ダブル選の“法的問題点”を地方自治法の専門家が指摘,https://news.yahoo.co.jp/articles/f679b813b5a41daad20b712d11826b7c425f918c,1/29(木) 10:20
2026-01-30,01:17,domestic,国内,25,レスキューナウニュース,阪和線で人身事故 一部運転見合わせ,https://news.yahoo.co.jp/articles/241e084f4f555ff2669a0e3aa0675e72d48b17dc,1/29(木) 21:35
2026-01-30,01:17,domestic,国内,26,朝日新聞,15年前の病院射殺事件、容疑で男逮捕　被害者の1人は「人違い」か,https://news.yahoo.co.jp/articles/317221e1ee506ea626e91ad51fc3314e7e99d17e,1/29(木) 19:55
2026-01-30,01:17,domestic,国内,27,日刊スポーツ,【衆院選】米山隆一氏が謝罪、雪かき動画巡るスタッフの誤投稿を削除「米山本人から強く怒られ」,https://news.yahoo.co.jp/articles/12a6d7b9de5cbb748b0d9283cf061fec4381ed60,1/29(木) 15:31
2026-01-30,01:17,domestic,国内,28,産経新聞,菅氏引退で5新人激戦の神奈川2区　知名度アップ懸命　公明票の行方が焦点に　衆院選,https://news.yahoo.co.jp/articles/1e3c3c9e62f1731e834dbc16ee6a7628d45322fa,1/29(木) 22:03
2026-01-30,01:17,domestic,国内,29,産経新聞,組織戦vsバイク遊説　自民と無所属の前職が火花　茨城7区、先代から続く対決　衆院選,https://news.yahoo.co.jp/articles/088777ff1a5ebeea020900dac35da8652bd720b1,1/29(木) 22:07
2026-01-30,01:17,domestic,国内,30,中日スポーツ,「否定しないんだ？」「＝事実」　“高市早苗首相のパー券、旧統一教会関連が購入”報道への政府対応にネット疑念の声「やましくないならしっかり説明して」,https://news.yahoo.co.jp/articles/65e38ecf1c6ff8c57b004d64e528e57b932c1e90,1/29(木) 18:56
2026-01-30,01:17,domestic,国内,31,TBS NEWS DIG Powered by JNN,【第一声 全文】参政党・神谷宗幣代表「自維か中道の選択、そんなの悪魔の選択」「今日本人が失っているのは、希望であり未来のビジョン」【衆議院選挙2026】,https://news.yahoo.co.jp/articles/d59da0cccbbcb8ac487a4766896114ea9269c81e,1/29(木) 18:00
2026-01-30,01:17,domestic,国内,32,日刊スポーツ,米山隆一氏の“雪かき”動画への批判　新潟出身ミュージシャンが説明「常識」,https://news.yahoo.co.jp/articles/26556badcb281bb38bdd80f014d50b19cfbad1fa,1/29(木) 10:59
2026-01-30,01:17,domestic,国内,33,読売新聞オンライン,序盤情勢調査で「優勢」自民、緊急通達で引き締め…伸び悩む中道改革連合は党名浸透に注力,https://news.yahoo.co.jp/articles/53909c7c47b40efb16867b0b920232dd548159c4,1/29(木) 22:09
2026-01-30,01:17,domestic,国内,34,共同通信,東京・上野で4億円強奪か　逃走中にひき逃げ,https://news.yahoo.co.jp/articles/b4baf4e6d5dc5ba2930a13194e28da8b80b0b6c4,1/30(金) 0:16
2026-01-30,01:17,domestic,国内,35,J-CASTニュース,自民大勝はない、創価学会の動きは侮れない　「選挙の神様」久米晃さんの衆院選予想,https://news.yahoo.co.jp/articles/166b1783d90bf356873a08ec63a8c4c3f555bfc4,1/28(水) 17:00
2026-01-30,01:17,domestic,国内,36,毎日新聞,自民、単独過半数うかがう　中道は浸透せず　毎日新聞衆院選序盤調査,https://news.yahoo.co.jp/articles/6ea14d36b30a1c7bf2ea2124088815576eee466d,1/29(木) 17:50
2026-01-30,01:17,domestic,国内,37,スポーツ報知,「『高市さんでいいですよ』とみなさんが言っているんだと思う」安住紳一郎アナ、高市早苗首相の衆院解散表明に私見…「ＴＨＥ　ＴＩＭＥ，」,https://news.yahoo.co.jp/articles/8d633ca80690f0f48dab5cac09c689f34cd6434e,1/20(火) 9:20
2026-01-30,01:17,domestic,国内,38,共同通信,雪の事故か2人死亡　北海道,https://news.yahoo.co.jp/articles/99602126c9eda9500502755a59c09b1c270cc428,1/29(木) 22:26
2026-01-30,01:17,domestic,国内,39,産経新聞,JR阪和線の人身事故、約1万1000人に影響、午後11時ごろ運転再開,https://news.yahoo.co.jp/articles/a991e3b54254a65749150eb977c52cdf11436928,1/29(木) 23:52
2026-01-30,01:17,domestic,国内,40,中日スポーツ,「外国人が生活のエリアまで入ってきている」自民・丸川珠代氏の第一声が物議「発想がアパルトヘイト」「まるでナチス」「差別で票を稼ぐ戦法か」,https://news.yahoo.co.jp/articles/7ea20d51156cc31f0c1d33992b67a9fe2616f1dd,1/28(水) 21:39
