scrp_date,scrp_time,genre_en,genre_jp,rank,media_jp,title,link,date_original
2025-01-10,08:06,life,ライフ,1,Hint-Pot,「なぜ飛行機があるのに…」「本気で止めようと思っていない気がします」　ドイツ人やフランス人、アメリカ人が日本の公共交通機関を大絶賛したワケ,https://news.yahoo.co.jp/articles/647e14688ceca9e7f5701a48c0e371f73453610e,1/8(水) 6:10
2025-01-10,08:06,life,ライフ,2,ねとらぼ,「大根は全部冷凍してください」　“多くの人が知らない”画期的な保存方法に「これから躊躇なく買えます」「これで腐らせずに済む」,https://news.yahoo.co.jp/articles/a0f240610d538aef82adc12775416559ec6bbbaa,1/9(木) 10:00
2025-01-10,08:06,life,ライフ,3,ENCOUNT,「これは羨ましい」中学の卒業記念品がネットで大バズり　「貰った時はマジいらねーw」も今や生活に欠かせない相棒に,https://news.yahoo.co.jp/articles/a006ab289a2e4c8265100e3b84b01a9c60d1fb3e,1/9(木) 12:47
2025-01-10,08:06,life,ライフ,4,LIMO,双子が2歳になるまで気づかなかった「ミラーツイン」である証拠とは…X民びっくり「本当にあるんですね」,https://news.yahoo.co.jp/articles/1eb6a2f3210cb3b8479822891dc97ae0bd00986a,1/10(金) 5:11
2025-01-10,08:06,life,ライフ,5,ねとらぼ,卵からふ化させたナマズの稚魚を放して1年半、池の水を抜いたら……　驚がくの結果に「スゴい」「池はロマンがありますね」の声,https://news.yahoo.co.jp/articles/b3475499ff8cc367a17df45c942d1afcd2f828fe,1/9(木) 20:30
2025-01-10,08:06,life,ライフ,6,ねとらぼ,お釣りでもらった千円札がおかしい？　目を疑う“まさかの違和感”が2000万表示　「マネーロンダリング済み（物理）」,https://news.yahoo.co.jp/articles/7aca55c57812877099d9064aaeb43d9faa6cb956,1/10(金) 7:10
2025-01-10,08:06,life,ライフ,7,kufura,「一度着たけど洗わない服」はどこに置く？部屋が散らからないアイディアとは,https://news.yahoo.co.jp/articles/7230327963f964cb75e4a31ff90fbfa91b851e57,1/9(木) 22:10
2025-01-10,08:06,life,ライフ,8,ねとらぼ,浜崎あゆみ、母顔出しで「こんな風に皆さんの前でハグし合うとは、、、」熱い抱擁ショット公開、息子たちの性格も明かす　「同じ顔すぎ」と反響,https://news.yahoo.co.jp/articles/83b9e58916372d0b428e489d88596dd9fc032ae6,1/9(木) 21:22
2025-01-10,08:06,life,ライフ,9,ほ・とせなNEWS,夜泣きで起きたパパ　しかし、よく見ると…「これは爆笑」「気持ちは伝わった！」「お疲れ様です（笑）」,https://news.yahoo.co.jp/articles/cc3f0687fd5d0e9645f9507a65f5766483e6a0bf,1/9(木) 13:30
2025-01-10,08:06,life,ライフ,10,LIMO,自衛官の友人を自宅に泊めたら…布団の畳み方に「訓練の賜物」「誇りを感じる」の声が続出,https://news.yahoo.co.jp/articles/579669de19135209fc682952824249b7fb881917,1/10(金) 5:56
2025-01-10,08:06,life,ライフ,11,ねとらぼ,ハードオフでよく見る“激安ジャンク品”→修理すると……　予想外な展開に「掘り出し物でしたね」,https://news.yahoo.co.jp/articles/c3b6c12d2e414f47794220b243621ae338e4b491,1/9(木) 20:00
2025-01-10,08:06,life,ライフ,12,LIMO,ニトリ凄い！「机をコタツみたいにできるヒーター」が3000円台に！1時間使っても電気代は0.9円,https://news.yahoo.co.jp/articles/8181e896931ceea929260aee1ea17bf0596e01ec,1/6(月) 6:47
2025-01-10,08:06,life,ライフ,13,LASISA,20歳が「今欲しい車」ランキング！3位「アルファード」、2位「レクサス」…なら、1位は？,https://news.yahoo.co.jp/articles/ce787c2b3a5d8acb2ac19fb6aba3e3d36fff36ae,1/9(木) 19:40
2025-01-10,08:06,life,ライフ,14,ねとらぼ,アレン様、りゅうちぇるさんの“暴露”が「中居正広のことでは？」という説に言及,https://news.yahoo.co.jp/articles/8886d0553d790c78750b4a292ba3a057a5833c92,1/6(月) 18:45
2025-01-10,08:06,life,ライフ,15,まいどなニュース,水族館の休館中にマンボウの体調悪化→まさかの対応で改善！？ スタッフも驚愕「魚も寂しいのか」「嘘だろ」,https://news.yahoo.co.jp/articles/610261ae37a1d5340769836e433110153cce83cb,1/9(木) 6:50
2025-01-10,08:06,life,ライフ,16,ファイナンシャルフィールド,「県庁」で働く公務員は「市役所」で働く公務員より高収入？,https://news.yahoo.co.jp/articles/a9fb6a709410a82f6dabc7ad33ce9a1089791477,1/9(木) 19:10
2025-01-10,08:06,life,ライフ,17,ほ・とせなNEWS,じいじとばあばと遊ぶ2歳息子　5分後の姿に…「はや！」「3人が尊い」「可愛い」,https://news.yahoo.co.jp/articles/557707d22537c3504895dfb1c92227631e92282f,1/10(金) 6:30
2025-01-10,08:06,life,ライフ,18,ねとらぼ,4枚のスカーフを縫い合わせたら……　ゴージャスな完成品に「素晴らしいアイデア」「とてもきれい」【海外】,https://news.yahoo.co.jp/articles/71a4bb4ce2cb3242f72555ce5b87ddde005367fd,1/8(水) 8:30
2025-01-10,08:06,life,ライフ,19,まいどなニュース,「将来を不安にさせる」中3娘の落書きとは？「本物に見えるクオリティがエグい」「しかもうめぇw」,https://news.yahoo.co.jp/articles/83e4c6343d3e6d6717cacd3de250ec24510f4bbe,1/9(木) 7:30
2025-01-10,08:06,life,ライフ,20,ねとらぼ,マクドナルド、次回ハッピーセットのコラボを“チラ見せ★”するも……　分かりやすい正体に「きっとひっかけ問題」「めっちゃ嬉しい」,https://news.yahoo.co.jp/articles/6f3f4f0348ab7fcdea02bd1e7496011187167467,1/9(木) 7:00
2025-01-10,08:06,life,ライフ,21,ねとらぼ,四つん這いで撮影中、背中に乗ってきたのは……　フォロワー48万人の人気写真家に起こった奇跡に「羨ましい」「動けない」,https://news.yahoo.co.jp/articles/277921580ea58f6c35418a7ebefc78132f67aaf9,1/7(火) 10:30
2025-01-10,08:06,life,ライフ,22,ファイナンシャルフィールド,40代会社員のうち「部長」と「課長」はどちらが多い？ 割合や年収を解説,https://news.yahoo.co.jp/articles/3f88010d421ed0495c7f104a80d98e6739f9afb6,1/9(木) 19:50
2025-01-10,08:06,life,ライフ,23,まいどなニュース,ミスドでドーナツ購入→公式メニューに載っていないが絶品→ 「激レアメニュー」だった！？【いつ、どこで買えるのか聞いた】,https://news.yahoo.co.jp/articles/df6a3022dc5d4947d2d35114e5c42eadab2a053b,1/10(金) 6:50
2025-01-10,08:06,life,ライフ,24,ねとらぼ,浜崎あゆみの「9人のそっくりさん」が全国から大集合　“本人公認あゆ”、“11歳のあゆ”、“会社員あゆ”など,https://news.yahoo.co.jp/articles/25ccc2fb4eb5bfb25c93f63f8a911eea3a3bb659,1/9(木) 13:15
2025-01-10,08:06,life,ライフ,25,LIMO,「なんでそこ!?」寒くて毛布でぬくぬくする猫たちの中で…1匹だけツッコミ必至の場所選びにほっこり癒やされる,https://news.yahoo.co.jp/articles/b74cc030a5191278a18d44bc7615278bbfe8f4ec,1/7(火) 20:17
2025-01-10,08:06,life,ライフ,26,ねとらぼ,鮮魚コーナーで存命の“ウナギ”を飼ってみたら……　一生のパートナーになれる「全ての人類に勧めるペットです」と400万以上表示,https://news.yahoo.co.jp/articles/24aeef1a701d52f91b518b5a57fea9516b88bf3e,1/9(木) 20:30
2025-01-10,08:06,life,ライフ,27,ねとらぼ,【ロサンゼルス山火事】セレブの自宅が多数全焼　“がれきの山”と化した自宅公開し「美しいわが家が……」,https://news.yahoo.co.jp/articles/760e06f6d1fb560a2fc6dc8093f0f2ce0122a3a0,1/9(木) 15:47
2025-01-10,08:06,life,ライフ,28,KURU KURA（くるくら）,期待の国産原付ミニカー「Lean3」に試乗！ コスパと実用性に優れた次世代3輪モビリティの実力とは？【試乗レビュー】,https://news.yahoo.co.jp/articles/d34ea4db8a101a8f48b325c6a5cc9b84654bf5dd,1/8(水) 20:11
2025-01-10,08:06,life,ライフ,29,ねとらぼ,辻希美の17歳娘・希空が“大ハマり”　手作りのヘルシーデザートレシピに「とっても美味しそう!!」「センスがある」,https://news.yahoo.co.jp/articles/f0a8c3354ac1f7f65e677dfb7738bc97c8444ffe,1/9(木) 19:35
2025-01-10,08:06,life,ライフ,30,ENCOUNT,「信じられない」「初めて見ました」　タチウオ釣りで目を疑う1匹　驚きの個体、実際の味は？,https://news.yahoo.co.jp/articles/3144bc7307e8e6350555c762a7d9e412c2796de9,1/9(木) 8:40
2025-01-10,08:06,life,ライフ,31,ねとらぼ,松屋の「水煮牛肉」が“攻めすぎたからさ”でネットざわつく　「後頭部から汗が噴き出て呼吸困難」「チェーン店にあるまじき量の香辛料」,https://news.yahoo.co.jp/articles/489a2971007e1d5c438ebb4fcab1a0a0e927c5d0,1/9(木) 19:45
2025-01-10,08:06,life,ライフ,32,感染症・予防接種ナビ,【感染症ニュース】2025年1月は新型コロナウイルス感染症が増加か？ 一部医療機関では高齢者を中心に入院例が増加…　医師「高齢者は注意が必要な感染症。周囲も配慮を」,https://news.yahoo.co.jp/articles/76bfbe864cbb44d48da16261929758146833ab88,1/10(金) 7:00
2025-01-10,08:06,life,ライフ,33,ねとらぼ,67歳マダムの「ユニクロ・緑のヒートテック重ね着術」に「色の合わせ方が神すぎる」と大反響　2024年に読まれたコーディネート記事トップ5,https://news.yahoo.co.jp/articles/7050c1903171e3dfbf63036830d59bd8e0541d11,1/6(月) 21:30
2025-01-10,08:06,life,ライフ,34,ほ・とせなNEWS,息子が帰宅。しかし、玄関前をよく見ると…「天才です（笑）」「真似したくなりました」の声,https://news.yahoo.co.jp/articles/055890084d88532ad172cb46f02d7c85521121ca,1/7(火) 19:58
2025-01-10,08:06,life,ライフ,35,ファイナンシャルフィールド,友人とサイゼリヤに行ったら、ドリンクバー代を払っていないのに「炭酸水」を飲んでいた！ タダなのは「水」だけじゃないの？ 意外と知らない大手ファミレスのサービスを紹介,https://news.yahoo.co.jp/articles/d18c3a926ea597087a5f725c841d03c363b51b53,1/7(火) 13:50
2025-01-10,08:06,life,ライフ,36,ねとらぼ,100均「リングファイル」をカッターで切っていくと……　アイデアに脱帽、驚きのアイテム完成に「なかなかスグレモノ」,https://news.yahoo.co.jp/articles/3dc670fee083d1dfedd4b772d5a9a1ea97701061,1/8(水) 11:05
2025-01-10,08:06,life,ライフ,37,HugKum,キシリトール入りのガムって、ほんとに虫歯にならないの？ キシリトールが死亡リスクを上げるって本当？【歯科医師が解説】,https://news.yahoo.co.jp/articles/6026cc7573d45b71264aad2e5eaae863dfc409c2,1/9(木) 21:30
2025-01-10,08:06,life,ライフ,38,LIMO,クリスマスに妻が作った「わくわくするメニュー」に18万いいね　「この発想はなかった」,https://news.yahoo.co.jp/articles/647462026c27f06e04f6d71cad32442b6b9d558c,1/10(金) 5:17
2025-01-10,08:06,life,ライフ,39,クランクイン！,かつや「牛・豚・鶏のトリプルカツ丼」登場！　巳年にちなんだ“ヘビー級サイズ”も展開,https://news.yahoo.co.jp/articles/c8f267a56f478d709aff7dd49e621cc1bdd8e139,1/10(金) 7:00
2025-01-10,08:06,life,ライフ,40,グルメ Watch,イオン、ウイスキー「響21年」「白州18年」の抽選販売は1月10日まで,https://news.yahoo.co.jp/articles/f60b0b4612f52b6acfaedbd64fa90691e3067917,1/9(木) 12:41
