scrp_date,scrp_time,genre_en,genre_jp,rank,media_jp,title,link,date_original
2025-01-10,08:06,TTL,総合,1,デイリースポーツ,元国民的アイドル「幼稚園から皇族と一緒に通学」超名門一貫校の出身を告白　両親を「お父様、お母様と」に「お嬢様や！」浜田大騒ぎ,https://news.yahoo.co.jp/articles/7bce8308da41aca18913692e836ffc1a8226206a,1/9(木) 22:49
2025-01-10,08:06,TTL,総合,2,東スポWEB,「自分の車で局に駆けつけ…」中居正広　声明発表前に〝謝罪行脚〟していた！,https://news.yahoo.co.jp/articles/92ce9d6f13e863fe5310fd492d4ea348ef1755f0,1/10(金) 5:16
2025-01-10,08:06,TTL,総合,3,中日スポーツ,紀藤弁護士、中居正広コメントの『とある２行』は「不要ないし誤解を招くと思います」とばっさり,https://news.yahoo.co.jp/articles/ba17a513cb63917d488e8deaf9a18ad2315110ea,1/9(木) 21:28
2025-01-10,08:06,TTL,総合,4,デイリースポーツ,フジテレビ退社→ＰＴＳＤ公表の渡邊渚アナ　雑誌インタビュー掲載を告知,https://news.yahoo.co.jp/articles/d02a65a1b4caac8670036d66f8b28a49dc068970,1/9(木) 14:39
2025-01-10,08:06,TTL,総合,5,中日スポーツ,佐々木恭子アナ、フジテレビで何をした人物か… 中居正広めぐる女性トラブル報道、『文春オンライン』が写真を掲載,https://news.yahoo.co.jp/articles/5f29cf9307f5010bff0c9f7cd527cb6e103db849,1/9(木) 12:45
2025-01-10,08:06,TTL,総合,6,中日スポーツ,中居正広の謝罪めぐり「めざまし8、どうするか」長谷川良品さん指摘　「女子だけがスタジオから姿を消すとかありそう」とフォロワー,https://news.yahoo.co.jp/articles/7c394f45624deeebe73ff90864d04949c3f474d4,1/9(木) 22:09
2025-01-10,08:06,TTL,総合,7,双葉社 THE CHANGE,「真珠を入れるわけがない」KADOKAWA元会長が明かす収監時の身体検査と独居房のトイレ、8501番「名乗ったのは…ささやかな抵抗でした」,https://news.yahoo.co.jp/articles/6bf72fcc41e4728087f3510045bed0d0fd0cf3a1,1/10(金) 5:32
2025-01-10,08:06,TTL,総合,8,デイリースポーツ,【ｎｅｗｓ２３】小川彩佳　中居正広に「自らの口から説明する機会」求める　ＴＢＳ「今後の方針答え差し控える」,https://news.yahoo.co.jp/articles/60e9bb002d8f65bf646fcf80fecfd094cc3d2185,1/9(木) 23:25
2025-01-10,08:06,TTL,総合,9,東スポWEB,【西武】ダンマリ源田壮亮に球界内からブーイング　〝二次被害〟訴える主力選手は「説明するのが大人としての責務」,https://news.yahoo.co.jp/articles/da8db19119a3907d28487212dfa6c701ca8fcef5,1/10(金) 5:16
2025-01-10,08:06,TTL,総合,10,デイリースポーツ,米国人弁護士と再婚→ＬＡ在住２児ママ女優５４歳　山火事で「友達の家も全焼してしまいました…」マスク姿で報告,https://news.yahoo.co.jp/articles/d3b0fc3f386c053d140f7b2b61d2fc1ada7ff432,1/9(木) 21:15
2025-01-10,08:06,TTL,総合,11,デイリースポーツ,人気ＹｏｕＴｕｂｅｒ３９歳で心筋梗塞のため急死　大みそかにＳＮＳ投稿「新年はより健康的に」も,https://news.yahoo.co.jp/articles/634283ad9758ca26788a87c8e9f723bcc8b4b2c8,1/9(木) 16:32
2025-01-10,08:06,TTL,総合,12,シネマトゥデイ,「日本一の最低男」中山美穂さん生前の姿に悲痛の声　放送後に追悼テロップ,https://news.yahoo.co.jp/articles/e097b508c4a9eef644a182a6b9a9df2bc23543d2,1/9(木) 23:55
2025-01-10,08:06,TTL,総合,13,スポニチアネックス,“声明の最後”にネットざわつく　中居正広のトラブル謝罪書面に「シュール」「違和感」「パワーワード」,https://news.yahoo.co.jp/articles/df890a65704362fe772388284599e2c01ad30100,1/9(木) 19:46
2025-01-10,08:06,TTL,総合,14,デイリースポーツ,中居正広　代理人は超有名弁護士だった！中居も多数出演のＴＶ番組で人気　「示談が成立」「相手の提案に真摯に向き合った」,https://news.yahoo.co.jp/articles/a1ff5397372bd88263e7246a1cc63ee59b84892d,1/9(木) 20:27
2025-01-10,08:06,TTL,総合,15,夕刊フジ,「自分の顔が大好き、整形なんて興味なし」過去映像の露出ためらわず…マネジメント事務所社長が明かした「中森明菜」のプライド,https://news.yahoo.co.jp/articles/011c726fb0407a962a39bc3ed4b8847b25429373,1/9(木) 17:00
2025-01-10,08:06,TTL,総合,16,デイリースポーツ,「花より男子」女優　母校の高校を実名告白「あの頃はかなりやんちゃで　先生には大変な思い」恩返しの凱旋訪問を報告,https://news.yahoo.co.jp/articles/470660e1494b2434c65dd1b3a40f6385dec455a8,1/9(木) 23:38
2025-01-10,08:06,TTL,総合,17,西スポWEB OTTO！,父「年末にマドンナが来てよぉ」嘘かと思ったら…本物だった　衝撃投稿にネット仰天「まじすか!すごすぎ!」「迫力あり過ぎ」,https://news.yahoo.co.jp/articles/3ed2a49e773c2193272aa5942e978f055ccf947c,1/10(金) 0:10
2025-01-10,08:06,TTL,総合,18,J-CASTニュース,有名精神科医・和田秀樹、中居正広9000万円トラブル報道受け主張　「性犯罪に対する賠償は基本5億円が原則だと思う」,https://news.yahoo.co.jp/articles/b341387aed673be89fc863368d6f15030e5860e8,1/9(木) 17:15
2025-01-10,08:06,TTL,総合,19,東スポWEB,てんちむが〝ナイトブラ訴訟〟で控訴　３・８億円の賠償金で一時は「自己破産」検討も,https://news.yahoo.co.jp/articles/cdf54eb9cd7445ed9cf5f7090dfda47d7fcd710b,1/10(金) 5:16
2025-01-10,08:06,TTL,総合,20,MANTANWEB,＜相棒 season23＞ゲストの25歳美女が話題に　視聴者「顔整いすぎ」「えらいべっぴんさん」　特撮ファンも興奮,https://news.yahoo.co.jp/articles/187f5357f6968e9b2c1be41bab5de0a84d681bef,1/9(木) 22:11
2025-01-10,08:06,TTL,総合,21,中日スポーツ,堀江貴文さん、「皮肉なもんですね」　中居正広のソフトバンクCM非公開、自身の『お蔵入り』理由を暴露,https://news.yahoo.co.jp/articles/8bc01d381eeb283107f59acaece51a155b0589bb,1/9(木) 20:23
2025-01-10,08:06,TTL,総合,22,Full-Count,ド軍退団の27歳「僕はウザい存在だった」　フリーマンに“密着”…大谷らから得た財産,https://news.yahoo.co.jp/articles/b2d4c18160ff5944946c58964533314a31b5be12,1/9(木) 10:19
2025-01-10,08:06,TTL,総合,23,デイリースポーツ,中居正広の声明受け　レギュラー持つ民放各局がコメント　テレ朝「土曜な会」休止を発表　フジ「出演者との関係性誠実に対応」ＴＢＳ「確認中」,https://news.yahoo.co.jp/articles/7deb4680b5df0c058840839b581215e1708c0912,1/9(木) 21:26
2025-01-10,08:06,TTL,総合,24,スポニチアネックス,中居正広“お詫び”で女性トラブル認めるも…芸能活動続行宣言　今後は不透明,https://news.yahoo.co.jp/articles/53579beb4fb57f915305002ee00ce43793ff6315,1/10(金) 4:10
2025-01-10,08:06,TTL,総合,25,くるまのニュース,不正改造車「32台」に「ただちにクルマを直しなさい！」命令！ 大迷惑な出っ歯・竹ヤリ＆シャコタン＆爆音マフラー装着車を“一斉摘発”！ 年末年始で街頭検査を実施,https://news.yahoo.co.jp/articles/a79a7c47f0220800eead56e7e873c77ee8931538,1/10(金) 5:50
2025-01-10,08:06,TTL,総合,26,イーファイト,天心戦「うるうる瞳」のラウンドガール、小柄な水着でヤンマガGリーグ決勝へ！本職は看護師,https://news.yahoo.co.jp/articles/251c9dbd10e0f99c9f40a7655d17c70982deb685,1/10(金) 4:50
2025-01-10,08:06,TTL,総合,27,東スポWEB,青学大は「エキスポ駅伝」で実業団と真っ向勝負　原監督「ガチンコ対決を期待している」,https://news.yahoo.co.jp/articles/9b4d31a56cf7380b87b06e0397a4f1e85096f0fc,1/10(金) 5:16
2025-01-10,08:06,TTL,総合,28,スポーツ報知,梅沢富美男、昨年はＣＭ契約８社の大活躍「最高の年でしたよ」…５０００万円で購入したものは？,https://news.yahoo.co.jp/articles/001988679ca966ab4634ec5d93ded587afb58cc2,1/10(金) 4:05
2025-01-10,08:06,TTL,総合,29,スポニチアネックス,石田ひかり　歌舞伎町で…娘と食事した帰り道で目撃した光景に沈痛　「親じゃないわたしでも悲しかったよ」,https://news.yahoo.co.jp/articles/a0b2c1951ab1de881ab4dd2cfcd9637ec13d2c53,1/9(木) 21:08
2025-01-10,08:06,TTL,総合,30,日刊スポーツ,【ソフトバンク】1500万円全額負担の近藤健介に感謝状、自主トレ徳之島の練習場人工芝張り替え,https://news.yahoo.co.jp/articles/61c1fd2f67f050d8f474c5d3de7beb375ad64a3b,1/9(木) 17:44
2025-01-10,08:06,TTL,総合,31,ねとらぼ,「パッと見だとわからない」　“なぜか使えない”500円玉を所持→まさかの警察沙汰に……　衝撃の投稿が2200万表示,https://news.yahoo.co.jp/articles/b6c0634d64d2fd07627648f970d31ad4db3638a3,1/9(木) 20:50
2025-01-10,08:06,TTL,総合,32,中日スポーツ,中居正広、謝罪コメントにネットで厳しい声「示談が成立したから問題なく芸能活動継続って何？」「自分が判断できる立場だと思ってるのかな」,https://news.yahoo.co.jp/articles/88b2ce282b557449a3e5f0a6613947b856cebb39,1/9(木) 20:17
2025-01-10,08:06,TTL,総合,33,TBS NEWS DIG Powered by JNN,"【速報】中居正広さんコメント「トラブルがあったことは事実」も示談成立し「今後の芸能活動についても支障なく続けられることに」　""女性トラブル""報道を受け【全文掲載】",https://news.yahoo.co.jp/articles/f8c2ffe592be172ed208a53e0ec3a3e31e6a1362,1/9(木) 19:00
2025-01-10,08:06,TTL,総合,34,スポーツ報知,柏の日本代表ＤＦ関根大輝、フランス１部Ｓランス移籍へ　伊東純也、中村敬斗とチームメートに,https://news.yahoo.co.jp/articles/1bf202ce015187bfb3370c8fdb3cd5ac3871036a,1/9(木) 23:44
2025-01-10,08:06,TTL,総合,35,GOAL,レアル・マドリー、浅野拓磨途中出場のマジョルカに3発勝利！バルセロナが待ち受けるスペイン・スーパー杯決勝に進出,https://news.yahoo.co.jp/articles/b4573f7e526da5d28a6102d21daf7364597fdd3e,1/10(金) 5:57
2025-01-10,08:06,TTL,総合,36,中日スポーツ,ドラフト同期驚がく… 中日１位・金丸夢斗、入寮後初キャッチボールで『消える魔球』披露,https://news.yahoo.co.jp/articles/18b790bbbe588f243592607f34bc6ca71a89cd34,1/9(木) 15:57
2025-01-10,08:06,TTL,総合,37,西日本新聞,車23台、高級腕時計75本、北海道の土地…タイ最年少首相は資産632億円の大富豪,https://news.yahoo.co.jp/articles/fed8ff20719a26a95935a28aa70b49828aae47c7,1/9(木) 13:51
2025-01-10,08:06,TTL,総合,38,Hint-Pot,「なぜ飛行機があるのに…」「本気で止めようと思っていない気がします」　ドイツ人やフランス人、アメリカ人が日本の公共交通機関を大絶賛したワケ,https://news.yahoo.co.jp/articles/647e14688ceca9e7f5701a48c0e371f73453610e,1/8(水) 6:10
2025-01-10,08:06,TTL,総合,39,TopNews,平川亮、アルピーヌに加入！地元F1日本GPでの初走行も決定！新たな挑戦が始まる,https://news.yahoo.co.jp/articles/82f403e6c96138107578dcf860d890353de8449c,1/10(金) 4:43
2025-01-10,08:06,TTL,総合,40,日刊ゲンダイDIGITAL,中居正広の騒動拡大で木村拓哉ファンから聞こえるホンネ…「キムタクと他の4人、大きな差が付いたねぇ」などの声相次ぐ,https://news.yahoo.co.jp/articles/c21758f9b3c0f515dd9e02951acdbb626a70b829,1/9(木) 11:08
