scrp_date,scrp_time,genre_en,genre_jp,rank,media_jp,title,link,date_original
2025-09-17,12:15,sports,スポーツ,1,デイリースポーツ,ヤクルト・村上　メジャー本当の評価とは　成功のカギをスカウト言及「球種による対応力がどうなのか」,https://news.yahoo.co.jp/articles/771533855120c76180a49d5c34f5fcd3d287dfbe,9/17(水) 10:00
2025-09-17,12:15,sports,スポーツ,2,47NEWS,ドジャースよりチケット入手困難？アメリカで旋風巻き起こす野球チーム「サバンナ・バナナズ」　打って踊って宙に舞う…本拠地で見た人気の理由は「ファンファースト」にあった,https://news.yahoo.co.jp/articles/bc2b6b294300804369032d330d065b74b64dbe36,9/17(水) 9:02
2025-09-17,12:15,sports,スポーツ,3,ENCOUNT,関東最大ギャング総長、BreakingDown参戦　1000人超率いた人物の登場にネット騒然「えぐい」,https://news.yahoo.co.jp/articles/23fec1289dbff9fcd12a4c71d5e5e5f87f696781,9/17(水) 8:44
2025-09-17,12:15,sports,スポーツ,4,RONSPO,見苦しいぞ！「ウォーミングアップの時間が足りずに力を発揮できなかった」井上尚弥に判定負けのアフマダリエフが母国に戻り激白…運営進行にクレームをつける苦しい敗因の言い訳,https://news.yahoo.co.jp/articles/494a4f3cc26eeeaa4f7d16c762a3aac2b822c92f,9/17(水) 5:51
2025-09-17,12:15,sports,スポーツ,5,Full-Count,山本由伸にロバーツ監督が“苦言”「無理だ」　試合で見えた苦悩、指摘したエースの弱点,https://news.yahoo.co.jp/articles/edc09d136682b1a8cb6a49c5f1008f3c952e3340,9/17(水) 7:07
2025-09-17,12:15,sports,スポーツ,6,日テレNEWS NNN,【バレー男子】予選ラウンド第2戦まで終了　強豪にも波乱　日本は全敗回避へ17日リビア戦　意地見せるか＜世界選手権＞,https://news.yahoo.co.jp/articles/30bd8677e116ce8e41a4ffba3cf473c28c90b3c8,9/17(水) 10:00
2025-09-17,12:15,sports,スポーツ,7,スポーツ報知,マリナーズ・ローリーが５５号＆５６号連発…５５号で両打ち新記録、５６号でグリフィーの球団最多に並んだ…今季２度目両打席弾,https://news.yahoo.co.jp/articles/a12cc0a6bf8ccf370754e77152a33aeea6b835be,9/17(水) 9:46
2025-09-17,12:15,sports,スポーツ,8,デイリースポーツ,五輪金メダルの小平奈緒さん　引退から３年、意外な現在の姿に驚き「生き方を尊敬」「凄く穏やかな笑顔」「素敵すぎて」,https://news.yahoo.co.jp/articles/24ef44d2374e43d5fac43ccab403a32a27d6bc45,9/17(水) 7:00
2025-09-17,12:15,sports,スポーツ,9,Full-Count,「え、誰かと思った」始球式に現れた“美女の正体”　お腹チラリの豪快投球「クソかわええ」,https://news.yahoo.co.jp/articles/78c32f3bd6140339f0b9339a5fd3b57cb2e75b90,9/17(水) 7:43
2025-09-17,12:15,sports,スポーツ,10,CoCoKARAnext,「非情なんだよ、彼は」藤川野球は何がすごかったのか　球界OBの考察「働けないベテランはいらないと言ったのは…」,https://news.yahoo.co.jp/articles/86287d1f14fdf09dae91adfd0c0c766527626a1b,9/17(水) 11:29
2025-09-17,12:15,sports,スポーツ,11,Full-Count,大谷翔平の登板日に“違和感”「よくわからない」　忘れてた事実に困惑「どう考えても」,https://news.yahoo.co.jp/articles/642b4d4f1c996bcea1be7db2219d40a1f33c90c2,9/17(水) 5:32
2025-09-17,12:15,sports,スポーツ,12,中日スポーツ,大谷翔平、第1打席で二塁内野安打　21戦連続出塁で今季最長更新,https://news.yahoo.co.jp/articles/389813286312ffb1798196773a24cbd62eba27ab,9/17(水) 11:39
2025-09-17,12:15,sports,スポーツ,13,GOAL,後半だけで計8ゴールの打ち合いに！ ユヴェントスvsドルトムントは壮絶ドロー決着,https://news.yahoo.co.jp/articles/fe28a65a2212fb23511337c93d3c7e76fdbc4f54,9/17(水) 7:15
2025-09-17,12:15,sports,スポーツ,14,Full-Count,大谷翔平に“違和感”「投手でいないよね」　初回安打でまさか…NHKが気づいた事実,https://news.yahoo.co.jp/articles/c7cfb3da9fccdd649cee2f26762a8fa86401e1ce,9/17(水) 11:43
2025-09-17,12:15,sports,スポーツ,15,東スポWEB,大谷翔平の起用巡りドジャース〝内部分裂〟の危機　ロバーツ監督の迷走が「フロントとの意見割れを招いている」,https://news.yahoo.co.jp/articles/5e8be7183a03d68b7da69421d5d704afa9960609,9/17(水) 5:16
2025-09-17,12:15,sports,スポーツ,16,デイリースポーツ,なぜ阪神・藤川監督は優勝監督インタビューで「我々がリーグチャンピオンです」とあえて声を大にしたのか,https://news.yahoo.co.jp/articles/8227979398b0fedefdd9dd0c92e6a69a91ad3cc3,9/17(水) 10:00
2025-09-17,12:15,sports,スポーツ,17,スポニチアネックス,スケボー東京五輪代表の西村碧莉が第1子妊娠を発表「来年、家族が増える予定です」,https://news.yahoo.co.jp/articles/4107a1725e879807fe3874b9c89adfdc6306031b,9/17(水) 8:05
2025-09-17,12:15,sports,スポーツ,18,東スポWEB,【世界陸上】村竹ラシッド　メダル獲得へ不屈宣言…順大の同期・三浦龍司の存在「ずっと刺激になっていた」,https://news.yahoo.co.jp/articles/d02ceb2e22ea2b8d7a8eb23b1801a22aea588c5a,9/17(水) 5:16
2025-09-17,12:15,sports,スポーツ,19,ゴルフのニュース,「はりさけそうな時に撮った」よくこの状態で… 河本結のボディーライン際立つ私服姿にファン騒然「Tシャツピチピチ過ぎん!?」,https://news.yahoo.co.jp/articles/9bbd12db97849e57da66690aa4d8ae96f03e9269,9/17(水) 6:30
2025-09-17,12:15,sports,スポーツ,20,ゴルフのニュース,リブゴルフ創設で結局“得”をしたのはマキロイ＆シェフラーや松山英樹!? “居残り組”がつかんだ“LIV騒動バブル”の果実,https://news.yahoo.co.jp/articles/0689ea6641577720e30039f213edc800db87a096,9/17(水) 11:15
2025-09-17,12:15,sports,スポーツ,21,デイリースポーツ,大谷翔平　シュワバーに１６３キロ剛速球！メジャー自己最速タイ→変化球で見逃し三振　第２打席も左飛で大谷に軍配　序盤４回を無安打投球,https://news.yahoo.co.jp/articles/e5a431ff78cf59656676081536fc7a8e2cc8e649,9/17(水) 11:17
2025-09-17,12:15,sports,スポーツ,22,日刊スポーツ,【カーリング】あと１歩で代表を逃したSC軽井沢クラブ「五輪への道はここで終わり」応援に感謝,https://news.yahoo.co.jp/articles/f7e10c00498220cc78637a0b70864833d61031fc,9/17(水) 11:03
2025-09-17,12:15,sports,スポーツ,23,中日スポーツ,「もらい泣きした」失意の村竹ラシッドに寄り添い続けたTBSアナ…”天使のタッチ”反響「優しさ伝わる瞬間」「あの右手が日本人全ての想い」,https://news.yahoo.co.jp/articles/a4b64557bbe946cf9ac95f91f10219d0ceaf2c05,9/17(水) 11:15
2025-09-17,12:15,sports,スポーツ,24,ABEMA TIMES,「吹っ飛びましたね」親方絶句…横綱の取組で衝撃結末 「こんなん交通事故やん」「160キロをふっ飛ばすパワー」ファン騒然,https://news.yahoo.co.jp/articles/df7665254f5a144d4db7ea2d9840fe27c559ad06,9/17(水) 8:24
2025-09-17,12:15,sports,スポーツ,25,デイリースポーツ,パドレスがまさか…初回いきなり５失点の惨劇　キングの大炎上にシルト監督も厳しい表情　ドジャースを２ゲーム差追走も　メッツに大敗,https://news.yahoo.co.jp/articles/36ad14353524402c265327cf78434a520b228520,9/17(水) 8:39
2025-09-17,12:15,sports,スポーツ,26,日刊スポーツ,【世界陸上】佐藤早也伽「あともう少し挑戦を重ねて行けたら」女子マラソンで13位,https://news.yahoo.co.jp/articles/10469f2463cdf53074f12fdab6dc2773246e3eb7,9/17(水) 11:00
2025-09-17,12:15,sports,スポーツ,27,Full-Count,大谷翔平、メジャー自己最速タイ163.7キロ　シュワーバーを三振斬り…球場熱狂,https://news.yahoo.co.jp/articles/57f919b3cae45d35a025bb033d5fc17385afec0f,9/17(水) 11:15
2025-09-17,12:15,sports,スポーツ,28,Full-Count,稼働しないエ軍358億円男を「指摘するのは無意味」　米紙は諦め…“コスパ最悪”に選出,https://news.yahoo.co.jp/articles/508e9b58401c1556351b7ae87a688b19c96b63df,9/17(水) 10:03
2025-09-17,12:15,sports,スポーツ,29,Full-Count,ド軍モデル妻が忘れぬ“日本の味”「恋しい」　熱望した再来日…明かした意外な事実,https://news.yahoo.co.jp/articles/d9a1e214e3d0dca2a9ff8cc7b2da7ab49f91421e,9/17(水) 10:44
2025-09-17,12:15,sports,スポーツ,30,サンケイスポーツ,DeNA・牧秀悟「1軍の世界で戦うには中途半端じゃ駄目」　戦列復帰の見通しについて言及,https://news.yahoo.co.jp/articles/153323fee7b22bf8ed05615af882e019d02efc10,9/17(水) 7:30
2025-09-17,12:15,sports,スポーツ,31,サンケイスポーツ,大谷翔平が「1番・投手兼DH」　本塁打数トップのシュワバーと〝直接対決〟　史上6人目『2年連続50発』達成なるか,https://news.yahoo.co.jp/articles/013078e11e252160ea9b6c4e50f55888437c0682,9/17(水) 7:10
2025-09-17,12:15,sports,スポーツ,32,Full-Count,佐藤輝明は「抑えられない」　通算2133安打男も“ドン引き”…理不尽弾は「ちょっとお手上げ」,https://news.yahoo.co.jp/articles/a29671027816f0ab84582ce1b08e20fe9723f0fd,9/17(水) 6:13
2025-09-17,12:15,sports,スポーツ,33,tennis365.net,差別非難から一転、複世界1位タウンゼントが「やばすぎる」発言で非難殺到→即謝罪＜女子テニス＞,https://news.yahoo.co.jp/articles/9a39418cae03f742d3d9f0b254deca8bfe993049,9/17(水) 9:42
2025-09-17,12:15,sports,スポーツ,34,読売新聞オンライン,元カープ今村猛さん、ジム経営に出身地ではなく広島を選んだのは…「応援してくれた恩返し」,https://news.yahoo.co.jp/articles/3859f1d16ddec777584b9e080fda0f0b1e6f5980,9/17(水) 10:17
2025-09-17,12:15,sports,スポーツ,35,中日スポーツ,号泣の村竹ラシッド、ようやく笑みを見せたのは「ジョジョ立ち」に関する質問のとき　「実はインスタでヒントを…」【世界陸上】,https://news.yahoo.co.jp/articles/8f7bb091dfd31395756a90884c4b5b29f1085d99,9/17(水) 11:01
2025-09-17,12:15,sports,スポーツ,36,theWORLD（ザ・ワールドWeb）,アーノルドが5分で負傷交代、急遽投入のカルバハルは頭突きで1発レッド……　レアル・マドリードは一夜にして右SBが手薄に,https://news.yahoo.co.jp/articles/d9731b4e039d6c8c7cfbf17975ab9bfc5a1944bd,9/17(水) 11:02
2025-09-17,12:15,sports,スポーツ,37,デイリースポーツ,「銅メダルを返せ」三浦龍司との接触が物議　ケニア１７歳選手が中傷被害も「ただの空手選手」,https://news.yahoo.co.jp/articles/453dcc5132f63e065379fbcf8c97a124de285ede,9/16(火) 16:20
2025-09-17,12:15,sports,スポーツ,38,Full-Count,遠ざかるシュワーバーの背中…大谷翔平が背負う“重圧”　専門家が見た決定的な違い,https://news.yahoo.co.jp/articles/7ee1baf3c02953fe6500b697f0b7199a7b6f97de,9/17(水) 6:27
2025-09-17,12:15,sports,スポーツ,39,日刊スポーツ,栗原恵さんの生後８カ月愛息への離乳食に「まじえらい」「これは大きく育ちますね」の声,https://news.yahoo.co.jp/articles/4f8eadd8a5fb2cc4eaaa3c4dccfc9ced9ed79a74,9/17(水) 11:01
2025-09-17,12:15,sports,スポーツ,40,中日スポーツ,中日・中村奈一輝、”プロ1号”　矢場とんとの練習試合で2ラン,https://news.yahoo.co.jp/articles/e40caa245050c9bf9594e176c52cbf1441a47c22,9/17(水) 11:23
