scrp_date,scrp_time,genre_en,genre_jp,rank,media_jp,title,link,date_original
2024-10-23,11:29,domestic,国内,1,みんかぶマガジン,「萩生田さんをみんなでいじめて…でも負けやしない」誇りだった‟八王子の元ヤン”激戦東京24区に市民大困惑「いや地元の恥だ」,https://news.yahoo.co.jp/articles/9f1e9291a36c2003548683579dd617a364b11c23,10/23(水) 9:10
2024-10-23,11:29,domestic,国内,2,ABEMA TIMES,「1000万で警官を買収」重要指名手配・見立真一容疑者が逃亡できたのはワイロのおかげ 元刑事が解説,https://news.yahoo.co.jp/articles/54fe249f022e139b3ab763dcbd7b6dfa5e4d9d1e,10/23(水) 6:52
2024-10-23,11:29,domestic,国内,3,時事通信,俳優の稲垣美穂子さん死去,https://news.yahoo.co.jp/articles/c90b9c599bd06f4ede17bb19ac05bfb24a624384,10/22(火) 20:52
2024-10-23,11:29,domestic,国内,4,毎日新聞,「がん細胞死ぬ」自由診療の点滴投与で男性死亡　遺族が提訴へ,https://news.yahoo.co.jp/articles/4361d307171911c192c3876e6bb432d9f8b8a6ec,10/23(水) 5:00
2024-10-23,11:29,domestic,国内,5,弁護士ドットコムニュース,飲食店で「持ち合わせない」 後で支払う約束も、客は戻らず…「食い逃げ」はどんな罪になる？,https://news.yahoo.co.jp/articles/155439e35f8a4cd58ee5b0dee9beb44774a18032,10/23(水) 10:05
2024-10-23,11:29,domestic,国内,6,読売新聞オンライン,自民に危機感、石破首相「悪夢のような民主党政権」と安倍氏が多用のフレーズで野党批判,https://news.yahoo.co.jp/articles/afd15eeeeb25fc169a7312fb9396dd205336b166,10/22(火) 22:09
2024-10-23,11:29,domestic,国内,7,レスキューナウニュース,総武線(快速)で人身事故 運転見合わせ,https://news.yahoo.co.jp/articles/0777a2aac685b393651a39deae22d1abbfadcd2b,10/23(水) 8:50
2024-10-23,11:29,domestic,国内,8,レスキューナウニュース,京急本線で人身事故 一部運転見合わせ,https://news.yahoo.co.jp/articles/fa15741f8f691431621a80117ba6f0a2a5a7f33b,10/23(水) 10:20
2024-10-23,11:29,domestic,国内,9,読売新聞オンライン,内視鏡検査２日後に女性急死、順天堂医院教授が実施…外部調査「胆管損傷の可能性」,https://news.yahoo.co.jp/articles/287d103dcf937d2ceab563f3f2bd71dfab63ab6f,10/23(水) 5:00
2024-10-23,11:29,domestic,国内,10,産経新聞,38年前の中3女子殺害事件、再審開始を決定　21歳で逮捕の男性無実訴え,https://news.yahoo.co.jp/articles/d31884befb343af1b58602a814c08d9ce9dd547e,10/23(水) 10:32
2024-10-23,11:29,domestic,国内,11,毎日新聞,福井・中3殺害事件　服役後の男性に再審認める　名古屋高裁金沢支部,https://news.yahoo.co.jp/articles/c46cb735bb4ae4733faaab9f0951af51caea6ed6,10/23(水) 10:02
2024-10-23,11:29,domestic,国内,12,弁護士ドットコムニュース,闇バイト、自首で刑は軽くなるのか？　「あなたや家族を保護する」　警察庁幹部の異例メッセージが話題,https://news.yahoo.co.jp/articles/fec821b378a0aa5ce223854b5ba9adfd78c426e9,10/23(水) 10:34
2024-10-23,11:29,domestic,国内,13,読売新聞オンライン,３８年前の福井・女子中学生殺人、服役した前川彰司さんの再審開始を決定…名古屋高裁金沢支部,https://news.yahoo.co.jp/articles/1ba2db2ae0008fa8f61233487ccedd57ea1d771f,10/23(水) 10:09
2024-10-23,11:29,domestic,国内,14,共同通信,福井中3殺害、再審認める　関係者供述の信用性否定,https://news.yahoo.co.jp/articles/286ead58b18bec3a9270a4356b6868951f67a19b,10/23(水) 10:01
2024-10-23,11:29,domestic,国内,15,よろず～ニュース,「＃国民民主党に騙されるな」トレンドで玉木代表困惑「なんで急に」ネット「やっかみ」「はまると泥仕合」,https://news.yahoo.co.jp/articles/485e703f2ba8ede335cbfbc410dc3dbc527fc3e5,10/22(火) 19:28
2024-10-23,11:29,domestic,国内,16,TBS NEWS DIG Powered by JNN,和歌山県で最大震度3の地震　和歌山県・和歌山市、紀の川市,https://news.yahoo.co.jp/articles/b9643ccb6e9c5d11065a595ee71571941b5f141b,10/23(水) 7:12
2024-10-23,11:29,domestic,国内,17,朝日新聞デジタル,高知の「ゴトゴト石」動かなくした大学生、最後の一人を略式起訴,https://news.yahoo.co.jp/articles/43943d6cf71e6e9dd02e1d51832e6a519b49cfc1,10/22(火) 19:30
2024-10-23,11:29,domestic,国内,18,時事通信,福井中3殺害、再審開始決定　服役男性の第2次請求審　知人証言の信用性争点・名古屋高裁支部,https://news.yahoo.co.jp/articles/366edf602d780e7c6493511a5104e7a4538f083f,10/23(水) 10:07
2024-10-23,11:29,domestic,国内,19,TBS NEWS DIG Powered by JNN,和歌山県で最大震度2の地震　和歌山県・和歌山市,https://news.yahoo.co.jp/articles/138a5518c6cd868e6138f254fade43878fc27106,10/23(水) 10:22
2024-10-23,11:29,domestic,国内,20,共同通信,無許可ライブでアイドル書類送検　道交法違反疑い、警視庁新宿署,https://news.yahoo.co.jp/articles/2a4e6c25316cc03706dc9956da6cf43adc069247,10/23(水) 10:15
2024-10-23,11:29,domestic,国内,21,MBC南日本放送,二つの虹の間を離陸する飛行機　「地面に近すぎる虹」どうして?,https://news.yahoo.co.jp/articles/c535b5a15822ee2ef3b09bf71aab3dae44e4e0b7,10/23(水) 9:59
2024-10-23,11:29,domestic,国内,22,朝日新聞デジタル,38年前の福井中3殺害、再審認める決定　「知人供述に誘導の疑い」,https://news.yahoo.co.jp/articles/98dad4f57498fa948c3b71084895850072326f80,10/23(水) 10:05
2024-10-23,11:29,domestic,国内,23,テレビ朝日系（ANN）,メルカリ不正取引900回　闇バイト指示役か…26歳男を逮捕　暗号資産解析でたどりつく,https://news.yahoo.co.jp/articles/76c6c274f20f40b9ab751a67d77d3225805e981b,10/23(水) 10:39
2024-10-23,11:29,domestic,国内,24,TBS NEWS DIG Powered by JNN,スマホを見る時まばたきが半減!?紫外線や乾燥で「目バテ」に　医師が教える対処法【ひるおび】,https://news.yahoo.co.jp/articles/72f48b6d3a3e9c825419c6b78240e151bb4f3b68,10/22(火) 15:28
2024-10-23,11:29,domestic,国内,25,テレビ朝日系（ANN）,闇バイトが住宅侵入、1階の母親助けるため棒を床に叩きつけながら叫び撃退,https://news.yahoo.co.jp/articles/491ca683cc4f37b8b98817d4f6408326fbd28b32,10/23(水) 11:16
2024-10-23,11:29,domestic,国内,26,読売新聞オンライン,強盗予備容疑で逮捕された3少年、山口県外に当日集まり公共交通機関で現場へ…周辺に逃走用の車などなし,https://news.yahoo.co.jp/articles/45fb96eac24edf5279c52528ff2127ac57de2d4b,10/23(水) 10:40
2024-10-23,11:29,domestic,国内,27,産経新聞,「かなりしんどくなる」現場から懸念の声　議論呼ぶ高齢者医療費負担、原則3割の維新公約,https://news.yahoo.co.jp/articles/737d0024c28c350bbc62322fa2460c91085948dc,10/22(火) 20:08
2024-10-23,11:29,domestic,国内,28,日本ファクトチェックセンター,民主党政権下では株価が7000円台だった？日経平均株価が8000円を切ったのは自民党政権【ファクトチェック】,https://news.yahoo.co.jp/articles/113c799573ab66b8cbd38336c2775472f9a6a8e0,10/23(水) 10:50
2024-10-23,11:29,domestic,国内,29,産経新聞,「仕事手伝う優しい子」横浜の強盗殺人、容疑者の祖父が語る素顔　事件後も様子変わらず,https://news.yahoo.co.jp/articles/2814b0476ade1af6fecdd37a80ded8252fe0eb28,10/22(火) 21:10
2024-10-23,11:29,domestic,国内,30,読売新聞オンライン,「選挙後に連携したい政党」、野党の距離感に変化…候補者アンケート,https://news.yahoo.co.jp/articles/33854bdf1c8aec0131dc58dd4227acf28db6d1c1,10/23(水) 6:00
2024-10-23,11:29,domestic,国内,31,産経新聞,オール沖縄「歴史的役割終えた」　れいわ山本太郎代表が批判「選挙互助会に落ちぶれた」,https://news.yahoo.co.jp/articles/2550efee773b23cc2a7ee5edf49949451c335235,10/22(火) 23:15
2024-10-23,11:29,domestic,国内,32,選挙ドットコム,【情勢調査】公明と維新が激突！大阪5区・6区・16区の勢力図は？（衆院選注目選挙区）,https://news.yahoo.co.jp/articles/87ef6e516b29e72fd6f0af89b5cfc4248f9439dd,10/22(火) 17:03
2024-10-23,11:29,domestic,国内,33,よろず～ニュース,日本保守党・島田洋一氏 5議席獲得の予測に「全く楽観できない」「様々に不利な条件を課されている」,https://news.yahoo.co.jp/articles/a68a33a6d288d6af42d764d14452096123664eb6,10/22(火) 19:30
2024-10-23,11:29,domestic,国内,34,読売新聞オンライン,コロナ特例貸付の返済免除４６８５億円、会計検査院調べ…滞納などによる未返済は１１８８億円,https://news.yahoo.co.jp/articles/372e6d9e21d3899f30a1eb624b5c9d205a57ada9,10/22(火) 17:00
2024-10-23,11:29,domestic,国内,35,時事通信,無許可で路上ライブ容疑　アイドルら10人書類送検　警視庁,https://news.yahoo.co.jp/articles/2f42a9364597aa4b33d9cf5849301a1a162a1e20,10/23(水) 11:04
2024-10-23,11:29,domestic,国内,36,BUSINESS INSIDER JAPAN,ウェルスナビ vs. ROBOPRO。ロボアドバイザー二大巨頭を「自腹」比較レビューしてみた,https://news.yahoo.co.jp/articles/99fa1b405c7fbf6d8da30f43422a5efb0a53f399,10/22(火) 20:00
2024-10-23,11:29,domestic,国内,37,読売新聞オンライン,ＳＮＳで「ホワイト案件」「即金」の投稿見つけ応募…市川女性監禁、容疑で逮捕の男が供述,https://news.yahoo.co.jp/articles/e2de309b5c850143c0745390f9bf7a1e7d71f9cb,10/23(水) 7:57
2024-10-23,11:29,domestic,国内,38,読売新聞オンライン,衆院選で街頭演説中の候補者をペットボトルで殴ったか、男を逮捕…大阪府警,https://news.yahoo.co.jp/articles/d37a17d7ad378d67035b8973050469fca838adf7,10/23(水) 8:18
2024-10-23,11:29,domestic,国内,39,毎日新聞,また交代？1年で4人目の英語教員　教員の不足・働き過ぎ問題が子どもにしわ寄せ,https://news.yahoo.co.jp/articles/9cbc2f9475b3772af7372ed3843a8ce0939bbd17,10/22(火) 17:03
2024-10-23,11:29,domestic,国内,40,スポーツ報知,「モーニングショー」玉川徹氏、相次ぐ「闇バイト強盗事件」背景を解説…「反社会的な勢力が悪の鉱脈に気づいてしまった」,https://news.yahoo.co.jp/articles/e45a1c9785e6ef6a2a0df418671aaaff2db3a169,10/23(水) 8:37
