scrp_date,scrp_time,genre_en,genre_jp,rank,media_jp,title,link,date_original
2025-12-28,17:10,TTL,総合,1,HBCニュース北海道,「女子高校生コンクリ詰め殺人事件」準主犯格Bの孤独な最期　3年前51歳で自宅トイレで…加害者の“その後”から矯正や社会での処遇を考える《話題の記事2025》,https://news.yahoo.co.jp/articles/2afc2a9f66edd8a0249ae16686cd022cf185ea2f,12/28(日) 8:29
2025-12-28,17:10,TTL,総合,2,スポニチアネックス,【有馬記念】3歳馬ミュージアムマイルV！鮮やか差し切り「凄くうれしい」C・デムーロ7度目挑戦で初制覇,https://news.yahoo.co.jp/articles/7d3020f807aea014aa80630679771bb585b0426c,12/28(日) 15:45
2025-12-28,17:10,TTL,総合,3,中日スポーツ,堂本光一、舞台経験のある元女優と結婚 お相手は今年9月に所属事務所を退所し芸能界を引退,https://news.yahoo.co.jp/articles/e6d25d37b0d8df739bf0d209ae1f94397c39c15e,12/28(日) 14:01
2025-12-28,17:10,TTL,総合,4,LIMO,「死亡届の提出前ならATMでお金を引き出してもOK？」元銀行員が解説！親のもしもに備える《正しいお金の守り方》,https://news.yahoo.co.jp/articles/8e142e677caf3134c47c6c7d9e8fedcb20db5249,12/27(土) 18:06
2025-12-28,17:10,TTL,総合,5,ファイナンシャルフィールド,市営住宅に住む父が、家賃を3ヶ月滞納して「明け渡し勧告」が届きました。今から全額を支払えば退去せずに済みますか？,https://news.yahoo.co.jp/articles/72a748949433206d91d5d91f56d016a282e18a3b,12/28(日) 14:40
2025-12-28,17:10,TTL,総合,6,クランクイン！,芦田愛菜、難関資格1級に合格していた　プライベートで受験「（教科書の）ページが外れちゃうくらい頑張りました」,https://news.yahoo.co.jp/articles/1c4729dbf17843d9fb30f81309aab0661c3b8c2e,12/28(日) 11:30
2025-12-28,17:10,TTL,総合,7,ABEMA TIMES,「止めろ危ない」「壊されてしまう」カシメロ、流血の衝撃TKO劇にファン戦慄 強打炸裂で「大丈夫か？」相手を気遣う余裕も,https://news.yahoo.co.jp/articles/e6907c6aa3b2a8db47ea440d33c0438c4e9763f5,12/28(日) 9:42
2025-12-28,17:10,TTL,総合,8,西スポWEB OTTO！,「やばいって」「これはひどすぎ」新幹線での〝悪質行為〟に怒りの声続出「グリーン車でこの品格は…」「キレて当然」女性社長の投稿が話題,https://news.yahoo.co.jp/articles/c1a2314853c3f4b407be12c7027e25d1016c7d53,12/28(日) 7:00
2025-12-28,17:10,TTL,総合,9,CBCテレビ,体温計に残された41.5度の表示 ワクチン接種後に39歳息子が死亡 「検視時の体温が非常に高かった、普通じゃ考えられない」 【“ワクチン後遺症”を考える シリーズ5】,https://news.yahoo.co.jp/articles/b2391211209c8b1b902222c1c269d18aec8e0a78,12/28(日) 12:56
2025-12-28,17:10,TTL,総合,10,スポニチアネックス,DOMOTO堂本光一　結婚発表　お相手は共演経験ある元女優「これからも皆さまへの感謝の気持ちを胸に」,https://news.yahoo.co.jp/articles/e36d8ecbac06c9f381deb6a051065b45512fbbc4,12/28(日) 14:01
2025-12-28,17:10,TTL,総合,11,CoCoKARAnext,井上尚弥は完勝なのに…守勢だったピカソにポイントを付与したジャッジの採点が物議　米識者が苦言「お笑いの金メダルだ」,https://news.yahoo.co.jp/articles/ba1fed4d4986feb8236119cad0bc25d1e5c5985d,12/28(日) 11:40
2025-12-28,17:10,TTL,総合,12,日刊スポーツ,【有馬記念】伏兵コスモキュランダ２着　横山武史騎手「120点…勝ってないから100点かな」,https://news.yahoo.co.jp/articles/cafe6aa82b8ac93cbbca33df30c435ab25870477,12/28(日) 16:27
2025-12-28,17:10,TTL,総合,13,Hint-Pot,新幹線の自由席でハンカチを置いてトイレに行ったら、戻ったときに見知らぬ人が座っていました。勝手にどかされて座られたら、諦めるしかないのでしょうか？,https://news.yahoo.co.jp/articles/75f077c323e1250653908cb220349a6ffdfd11a3,12/28(日) 8:40
2025-12-28,17:10,TTL,総合,14,よろず～ニュース,悪性リンパ腫、脳炎も併発していた　2年前から休養の女性芸人が舞台復帰、相方は号泣　「THE W」決勝も経験の爛々,https://news.yahoo.co.jp/articles/e7f19604642eda7d62536a6cb16048db8ce5433d,12/28(日) 14:19
2025-12-28,17:10,TTL,総合,15,西スポWEB OTTO！,「久しぶりにお顔が...」昨年人気俳優と〝結婚＆妊娠〟電撃発表、今年第1子出産の田原俊彦・長女、田原可南子最新姿にファン歓喜「前髪可愛い」「ママになった」,https://news.yahoo.co.jp/articles/2500951cc7d673780b87a5bfdf434b96ac6f4760,12/28(日) 11:30
2025-12-28,17:10,TTL,総合,16,NBC長崎放送,「妹が殺された日、父の目が泳いでいた」佐世保小6同級生殺害　15歳の兄が貫いた「笑顔」の仮面と崩壊…33歳になった加害女性へ送る「重い願い」【2025年PV1位】,https://news.yahoo.co.jp/articles/fc60ae0c949b2a2dc228183a7abae4a1b79aa124,12/28(日) 12:00
2025-12-28,17:10,TTL,総合,17,デイリースポーツ,「何が起こっているの？」「ショック」ザギトワの挑発投稿に波紋広がる　衝撃姿で「最悪のコメントを」ファン動揺「一体何を」「こんな姿をみるのは悲しい」,https://news.yahoo.co.jp/articles/4f264432712628ffbba1ff7e7b8c1b80f48ea163,12/28(日) 7:00
2025-12-28,17:10,TTL,総合,18,まいどなニュース,信号待ちで追突され車は全損　ところが「保険会社は交渉しません」！？…“過失ゼロ”なのに「示談は自分で」【2025年・保険の“想定外”】,https://news.yahoo.co.jp/articles/a14040bcb00deffca82bbcf18012ea0c6bd94795,12/28(日) 15:00
2025-12-28,17:10,TTL,総合,19,日刊スポーツ,堂本光一が結婚発表、お相手は元女優の一般女性「感謝の気持ち」DOMOTO２人とも既婚者に,https://news.yahoo.co.jp/articles/10580f8bc0c213c47a5efb1148f2ef64b02099c2,12/28(日) 14:01
2025-12-28,17:10,TTL,総合,20,デイリースポーツ,中川家・剛「そら病気になるで」　かつて受けたパワハラ明かす「たばこの火を近づけられて」,https://news.yahoo.co.jp/articles/eb22f009462f6c33450a8ae3c0d3d0f670185b0d,12/28(日) 14:00
2025-12-28,17:10,TTL,総合,21,ファイナンシャルフィールド,夫が年収700万円、妻が550万円です。親には「パワーカップルだね」と言われますが、合っていますか？ 都内の平均的な世帯年収も解説,https://news.yahoo.co.jp/articles/4a8f674762f4b5abf35f52ea1343059006b23af4,12/28(日) 13:50
2025-12-28,17:10,TTL,総合,22,日刊スポーツ,中国駐日大使館Ｘ、米への警告を日本語で掲載しツッコミ「びびってる？」「米にも渡航自粛は？」,https://news.yahoo.co.jp/articles/ade0ff91ae16187d29f0144ac4f151e33f235211,12/28(日) 7:52
2025-12-28,17:10,TTL,総合,23,デイリースポーツ,「ばけばけ」放送されなかった次週予告、Ｘでチラ見せ公開　ネット「あ～ヘブン先生が抱きついてる！」,https://news.yahoo.co.jp/articles/57ecb48786e74533c8caf6d57b175526a35f0117,12/28(日) 13:37
2025-12-28,17:10,TTL,総合,24,高校野球ドットコム,昨季“防御率1.42”の左腕になぜオファーがないのか？技巧派投手に受難の時代,https://news.yahoo.co.jp/articles/2439beba5c04b4c456e20e416c2fc85462cd305a,12/28(日) 16:00
2025-12-28,17:10,TTL,総合,25,スポーツ報知,がん公表から８か月…石橋貴明、驚きの近況が判明「すごい…」最新２ショット公開「くれぐれもご自愛ください」,https://news.yahoo.co.jp/articles/8d0db764c05ed28a73952f05f88afa4b20989f05,12/28(日) 7:51
2025-12-28,17:10,TTL,総合,26,Full-Count,ド軍スネルに15億円“条項”発生か…明記された条件　285億円契約の特殊事情に米言及,https://news.yahoo.co.jp/articles/f7bc1b0bcc2012ae3cfa1f97a68366aee61f188d,12/28(日) 13:14
2025-12-28,17:10,TTL,総合,27,デイリースポーツ,美女アスリートが「逃走中」出演へ「マジで逃げ切りたい」決めポーズに反響「か、可愛すぎるやろ！」「挟み撃ちにしないで」,https://news.yahoo.co.jp/articles/ebc30ae27ab6c9a7252b4dd8c2b1104cd29b25b3,12/28(日) 14:46
2025-12-28,17:10,TTL,総合,28,オリコン,DOMOTO・堂本光一、結婚を発表「ご縁に感謝し精進してまいります」【コメント全文】,https://news.yahoo.co.jp/articles/c7a6573a989c7b6abad36679f77c589200644a57,12/28(日) 14:00
2025-12-28,17:10,TTL,総合,29,東スポWEB,堂本光一が結婚を発表　お相手は芸能界を引退した元女優,https://news.yahoo.co.jp/articles/3d0ef47d63fbe6072bb5c69ac1c610400f50cadc,12/28(日) 15:10
2025-12-28,17:10,TTL,総合,30,Lmaga.jp,大阪4店舗目のスーパー・ロピア、店内アナウンスの謎…「買い物に来る場所じゃありません」？,https://news.yahoo.co.jp/articles/17b652c31a52794b05143c218988d1621112c474,12/28(日) 14:40
2025-12-28,17:10,TTL,総合,31,時事通信,台湾北東部沖でM7．0　最大震度4、空港で天井落下,https://news.yahoo.co.jp/articles/cda4caac0c750e3e98c15b3c9084c968ec56e538,12/28(日) 11:52
2025-12-28,17:10,TTL,総合,32,馬トク報知,【有馬記念】途中からハナに立つも武豊騎手のメイショウタバルはまさかの２けた着順　同一年春秋グランプリ制覇ならず,https://news.yahoo.co.jp/articles/06cf78edf29e8847601a6a6ac010677c0032bbaa,12/28(日) 15:51
2025-12-28,17:10,TTL,総合,33,ほ・とせなNEWS,1歳妹を抱き上げる10歳兄「そろそろ降りる？」と聞いた直後…妹のまさかの行動に「気づいたら何回もみてた」「疲れ吹き飛んだ」,https://news.yahoo.co.jp/articles/dabb0faa5cbbb1977a7923c46db5a699df27c5cc,12/28(日) 15:24
2025-12-28,17:10,TTL,総合,34,デイリースポーツ,【有馬記念】長澤まさみのドレスカラーにネット沸く　フジ競馬番組に登場「サインに違いない」「キタコレ」,https://news.yahoo.co.jp/articles/83e2b56b50d70713e066e7c20c508f147f8453ab,12/28(日) 15:06
2025-12-28,17:10,TTL,総合,35,スポニチアネックス,粗品「現役最強だと思う」有馬記念で“本命”にした馬とは？ド派手ブッコミ宣言「エグいぐらいいくか！」,https://news.yahoo.co.jp/articles/cadae023ceced866b1dfb696ef76383ac91c5a6a,12/28(日) 15:07
2025-12-28,17:10,TTL,総合,36,ファイナンシャルフィールド,今年は「年収550万円」の予想が、“ボーナス”が少なく「年収500万円」に…ふるさと納税を「上限6万9000円」までしてしまったけど、いくら“損する”ことになりますか？,https://news.yahoo.co.jp/articles/40c109f2ed21b8217d02cac726295b7a3dc10e77,12/28(日) 14:10
2025-12-28,17:10,TTL,総合,37,スポニチアネックス,【有馬記念】ミュージアムマイルが頂点！3連単は3番人気→12番人気→2番人気で13万1710円,https://news.yahoo.co.jp/articles/f5ceffce4ed5fd7b27ef4963ccb65b7a375fbdec,12/28(日) 15:57
2025-12-28,17:10,TTL,総合,38,GOAL,選手が選ぶ最優秀選手選出の上田綺世。大学時代後輩や内田篤人氏からは「不思議な人」との声,https://news.yahoo.co.jp/articles/6383bf598ef4199a7bcbc4f0074b3e7bd7e0873d,12/28(日) 15:23
2025-12-28,17:10,TTL,総合,39,埼玉新聞,3歳の娘死亡…車にはねられ、妻も息を引き取る　夫が霊安室で対面…出産時は泣いた妻、指を握り返した娘　「3人で人生始まった」と振り返り、握った手は硬くて冷たく　さらに目立とうと誹謗中傷する人、夫の思い,https://news.yahoo.co.jp/articles/4481f4b9736c5e7d8dd8b80e272853fc421dfb24,12/28(日) 11:52
2025-12-28,17:10,TTL,総合,40,J-CASTニュース,前川喜平・元文科次官、悪化の日中関係・安全保障めぐって私見...日本の土地は「お荷物になるだけ」,https://news.yahoo.co.jp/articles/bf570585a2c3273fbb9a9ba1ac9ecd11a14fee1c,12/28(日) 13:21
