scrp_date,scrp_time,genre_en,genre_jp,rank,media_jp,title,link,date_original
2024-12-26,09:27,domestic,国内,1,FNNプライムオンライン,「Xマスパーティー中止に」予約の“ドミノ・ピザ”がイブに届かず　店には配達員と客が溢れ…担当者「急な人員不足」,https://news.yahoo.co.jp/articles/d49643333a838f09222fc23bb77a9743d791ebb4,12/25(水) 20:17
2024-12-26,09:27,domestic,国内,2,毎日新聞,トイレットペーパーで便座を拭いてはいけない理由　TOTOに聞いた,https://news.yahoo.co.jp/articles/a2a2491188fa0ee947dff18b0a45e44243cf25d9,12/25(水) 19:28
2024-12-26,09:27,domestic,国内,3,デイリースポーツ,斎藤知事「百条委」にデマ・誘導尋問の疑い　浴衣公民館パワハラ→知事「私は公民館に行ってない」　マスコミ偏向報道で誹謗中傷「私も大変厳しい状況になった」,https://news.yahoo.co.jp/articles/d0516fc013d4e1a70fd54be02405e4b7582468f2,12/25(水) 20:30
2024-12-26,09:27,domestic,国内,4,レスキューナウニュース,名古屋市営東山線で人身事故 一部運転見合わせ,https://news.yahoo.co.jp/articles/d1f66a8f04465343cdce2be7d269be1706d381eb,12/26(木) 6:45
2024-12-26,09:27,domestic,国内,5,日刊スポーツ,「もうけっこうです」斎藤元彦知事の「第三者委員会…」同じ答弁に委員が失笑、尋問打ち切り,https://news.yahoo.co.jp/articles/90ec91a4ee8317ea011e9e2291a00b351cd4717c,12/25(水) 18:50
2024-12-26,09:27,domestic,国内,6,ハフポスト日本版,「ホンダ」と「日産」が経営統合したら社名は…？周庭さんのユーモアあるコメントに「座布団1枚」！,https://news.yahoo.co.jp/articles/2b5664db7c3d221a5339487b5975bc6f98d746e1,12/24(火) 20:01
2024-12-26,09:27,domestic,国内,7,ニッポン放送,日産、いばらの道か？ ホンダから突き付けられたハードルは待ったなし,https://news.yahoo.co.jp/articles/d1b2e01f14819f737642c4b6d0f08fd06da3614c,12/25(水) 13:00
2024-12-26,09:27,domestic,国内,8,産経新聞,「百条委の判断」が「最終的に司法」へ　変遷した斎藤氏のパワハラ説明、選挙演説とも矛盾,https://news.yahoo.co.jp/articles/82dc91e536a4af557bbcbd178a415cd67ef1a830,12/26(木) 8:05
2024-12-26,09:27,domestic,国内,9,産経新聞,「知事が悪との報道ばかり」「反斎藤派OBがNHK出演」元副知事、BPOに申し立ても,https://news.yahoo.co.jp/articles/012e90c2e51e6e0ad1550caaba2725c3eeb2d055,12/25(水) 15:18
2024-12-26,09:27,domestic,国内,10,よろず～ニュース,片山元副知事、元県民局長の公用PCの中身「ほぼ事実。クーデターという風に解釈」「押収」ではなく「回収」,https://news.yahoo.co.jp/articles/a826fa6bd2447933471f3449b855be7b76af7f02,12/26(木) 7:10
2024-12-26,09:27,domestic,国内,11,共同通信,両陛下「いいね」1900万件　宮内庁インスタ、閲覧2億回,https://news.yahoo.co.jp/articles/a0448ef70c58ca36dae5e29973704f1a99ec4ce7,12/26(木) 5:04
2024-12-26,09:27,domestic,国内,12,デイリースポーツ,斎藤知事「百条委」知事が「人殺した」発言のＴＶ番組と発言者の実名　県議批判「放送に携わる資格ない」　前副知事「知事、副知事が悪の報道ばかり」,https://news.yahoo.co.jp/articles/8adea81edf08af0eeea82e9ab7afce6bc1f36c44,12/25(水) 16:25
2024-12-26,09:27,domestic,国内,13,毎日新聞,自宅の売却検討、騒音苦情…　北九州中3殺傷、容疑者逮捕から1週間,https://news.yahoo.co.jp/articles/426470af0cd44e738ecfd319ca93a03a51fb305a,12/26(木) 5:30
2024-12-26,09:27,domestic,国内,14,読売新聞オンライン,ピアノ・野球・学習…能登被災地で学びの場が消滅、子供たちに「体験格差」,https://news.yahoo.co.jp/articles/e9368b13133111cc7fd2aeee6c2bc8c2de0ed5d9,12/26(木) 5:00
2024-12-26,09:27,domestic,国内,15,スポーツ報知,「めざまし８」谷原章介、斎藤元彦兵庫県知事「百条委員会」最後の証人尋問に見解「本当に前に進んでいかない印象」,https://news.yahoo.co.jp/articles/d6be0c60a541cdaf32c45c4822a8f461726f7145,12/26(木) 8:34
2024-12-26,09:27,domestic,国内,16,信濃毎日新聞デジタル,子どもが不登校でフルタイム断念→退職、休職して貯金取り崩し生活… 働き方やかさむ出費に苦悩する親たちの切実な声,https://news.yahoo.co.jp/articles/72d9a2c01fceb97d2b704204dc8d09ef2f16390b,12/26(木) 6:02
2024-12-26,09:27,domestic,国内,17,読売新聞オンライン,日航機操縦室内では衝撃音の後「小型機いましたね」…羽田空港衝突事故・ＣＶＲの記録から,https://news.yahoo.co.jp/articles/6df4c3c5fa67bcc602942bcba1df490fc755213b,12/25(水) 11:32
2024-12-26,09:27,domestic,国内,18,スポーツ報知,斎藤元彦兵庫県知事の百条委員会最終尋問を前に県庁前でシュプレヒコール「不適切にもほどがある！」,https://news.yahoo.co.jp/articles/9765245093bf4c78c96b5b089c5c04a9930a0117,12/25(水) 13:38
2024-12-26,09:27,domestic,国内,19,読売テレビ,【悪質】「Snow Manチケット1枚25万円」「セーラームーンコラボチョコ発売日前なのに転売」相次ぐ高額転売問題に、怒りの声続出　しかし、その“怒り”が次の転売を生む…？「“転売ヤー”はSNS上の不満の声を基に、高額転売できる商品を探していた」,https://news.yahoo.co.jp/articles/cfd85671b5139debda5f4cfd27773cbe5878e93f,12/25(水) 14:00
2024-12-26,09:27,domestic,国内,20,読売新聞オンライン,緊急停車の北陸新幹線から男性客が線路へ、１時間５０分後に８ｋｍ離れた地点で確保,https://news.yahoo.co.jp/articles/7ee49224797833832f61cfa2c88f3285b5425be3,12/25(水) 20:48
2024-12-26,09:27,domestic,国内,21,日刊スポーツ,国民・榛葉賀津也幹事長「クリスマスプレゼントは来なかった」年収の壁引き上げ交渉「越年」決定で,https://news.yahoo.co.jp/articles/a61faa94bc72419e0a3a37a23ec95eac728f824b,12/26(木) 5:00
2024-12-26,09:27,domestic,国内,22,産経新聞,海保機長、時間余裕なく判断鈍る「ハリーアップ症候群」か　羽田事故報告で元機長ら指摘,https://news.yahoo.co.jp/articles/dcc66d3ddedb2e5c27d84edd36c110f6d93b48fd,12/25(水) 21:29
2024-12-26,09:27,domestic,国内,23,ABEMA TIMES,飛ばずにダッシュするインコ あまりの速さに飼い主「足の動かし方が最高です」,https://news.yahoo.co.jp/articles/5a9d681808d106cef2ddb5e7a271c294a324951f,12/26(木) 7:51
2024-12-26,09:27,domestic,国内,24,読売新聞オンライン,羽田航空機衝突、３要因重なり惨事に…海保機長は乗組員の帰宅考え「なるべく急ぎたかった」,https://news.yahoo.co.jp/articles/0e384c319360da7136adf898dea9186661441a87,12/25(水) 20:40
2024-12-26,09:27,domestic,国内,25,Yahoo!ニュース オリジナル 特集,愛と発信で支える復興と未来。元Juice=Juiceリーダー・宮崎由加が見つめる能登と石川 #知り続ける能登 #災害に備える,https://news.yahoo.co.jp/articles/6ab3d96cf279aa6b08a3d1bc219276c801a0e36e,12/25(水) 17:00
2024-12-26,09:27,domestic,国内,26,日刊スポーツ,斎藤元彦知事の最側近、片山安孝前副知事「委員長に対して異議」憤慨　百条委証人尋問,https://news.yahoo.co.jp/articles/66329a4c86134c17c5c6370bc27343212664debd,12/25(水) 14:02
2024-12-26,09:27,domestic,国内,27,TBS NEWS DIG Powered by JNN,【追悼】東京地検特捜部元検事・堀田力弁護士が語った「ロッキード事件」捜査秘話　「捜査はどこまでいくのか、いつやるのか」田中元総理逮捕の1か月前に掛かってきた電話の主は…　平成事件史（21）,https://news.yahoo.co.jp/articles/d76a24e75431ad66ed96e57d400ac39c5ad3b676,12/26(木) 8:01
2024-12-26,09:27,domestic,国内,28,産経新聞,部下の証言否定も矛盾露呈　斎藤知事、百条委で公益通報巡り平行線、主張の溝埋まらず,https://news.yahoo.co.jp/articles/15772d8ca65bd67207c589d9c50c4e6346773226,12/26(木) 7:16
2024-12-26,09:27,domestic,国内,29,読売新聞オンライン,アニメ見てペットに、でも成長すると粗暴で捨てられて…野生化したアライグマが久留米で急増,https://news.yahoo.co.jp/articles/46fbeb788846c617c3ee04fde863b4c08ab4e59e,12/25(水) 14:00
2024-12-26,09:27,domestic,国内,30,中日スポーツ,ブログで墓穴、続出の「キラキラ女子」にネットからくち「自己顕示欲の塊　倫理観ゼロ」「承認欲求とSNSがすべてを奪って行く」,https://news.yahoo.co.jp/articles/5a40a499365a0d5fdea0367cc1f5537ee53565d7,12/25(水) 19:04
2024-12-26,09:27,domestic,国内,31,テレビ朝日系（ANN）,伊豆の巨大廃虚ホテルが放置される“ワケ”　内部の様子をドローン撮影　行政の対策は,https://news.yahoo.co.jp/articles/191b345f05eb970de048fcf142e45cbc96c594a0,12/25(水) 17:01
2024-12-26,09:27,domestic,国内,32,日テレNEWS NNN,【速報】靖国神社に「Toilet」と落書き 中国籍の男（29）に懲役8か月の実刑判決　東京地裁,https://news.yahoo.co.jp/articles/3f510f9bc1bbe91bab0dfc76791cbc729c85bfe5,12/25(水) 14:35
2024-12-26,09:27,domestic,国内,33,読売新聞オンライン,市役所窓口の受付時間、45分短縮へ…職員の時間外勤務解消に,https://news.yahoo.co.jp/articles/8ae3f2ae44a58832e13988481c1994f9a06cba2c,12/25(水) 17:12
2024-12-26,09:27,domestic,国内,34,毎日新聞,百条委、元局長の私的文書の一部を資料請求　元副知事の主張受け,https://news.yahoo.co.jp/articles/963701eea1b8e7e2de7dbc09b7cc085dee406249,12/25(水) 21:02
2024-12-26,09:27,domestic,国内,35,ねとらぼ,岐阜では“目玉焼き”で電車に乗れる　ベーコンやうなぎでも乗れる“特殊な支払い方法”に「わぁーっ！」「なにこれかわいい」,https://news.yahoo.co.jp/articles/9d5e4558fa77998305d670bc66a437a0758ad8fe,12/26(木) 7:30
2024-12-26,09:27,domestic,国内,36,読売新聞オンライン,ＪＲ横須賀線東戸塚駅で人身事故、男性が死亡…運休で通勤客ら１４万人に影響,https://news.yahoo.co.jp/articles/9ac6df0ee9ae8d90989d534e31e7aee42f28ac94,12/25(水) 8:27
2024-12-26,09:27,domestic,国内,37,朝日新聞デジタル,三菱UFJ元副支店長、強要未遂罪認める 「死ねないなら退任しな」,https://news.yahoo.co.jp/articles/da24a165bc3da51d792606acda8eb29b564ca36a,12/25(水) 19:56
2024-12-26,09:27,domestic,国内,38,テレビ朝日系（ANN）,【報ステ】能登復旧なぜ終わらない？半壊の家に住む解体作業員から見えた“現状”,https://news.yahoo.co.jp/articles/a067c7d33082dfa07000e10692ceb1ff868fb71f,12/26(木) 2:06
2024-12-26,09:27,domestic,国内,39,J-CASTニュース,レプリコンワクチン批判書で「同じように考えていた社員は複数」出版社が反論　存在せぬ「チームK」正当化,https://news.yahoo.co.jp/articles/6922bb7dca959e9a87fe1998191e11c4a491728c,12/25(水) 16:30
2024-12-26,09:27,domestic,国内,40,テレビ朝日系（ANN）,美容外科医が献体画像をSNS投稿　「頭部たくさん」笑顔絵文字　倫理観を問う声相次ぐ,https://news.yahoo.co.jp/articles/823ea7a33f0eaad345fb708a053ee21765d5422e,12/25(水) 12:27
