scrp_date,scrp_time,genre_en,genre_jp,rank,media_jp,title,link,date_original
2026-02-06,14:29,business,経済,1,共同通信,トヨタ、社長が午後に緊急記者会見,https://news.yahoo.co.jp/articles/c84208fc85a8b5363829328b57386bd3308bf3f8,2/6(金) 13:20
2026-02-06,14:29,business,経済,2,共同通信,トヨタ、緊急会見は決算とは別内容,https://news.yahoo.co.jp/articles/6885a43876f82a1beac056847a3be50c0977e5c9,2/6(金) 13:27
2026-02-06,14:29,business,経済,3,ロイター,トヨタ、佐藤社長が午後3時半から記者会見,https://news.yahoo.co.jp/articles/5f73644354c8bdd886e50fa52fa14dc2d458a18b,2/6(金) 13:33
2026-02-06,14:29,business,経済,4,時事通信,トヨタ社長が記者会見,https://news.yahoo.co.jp/articles/83853a838cee4ceacb0e9ae88e5952888c2f866c,2/6(金) 14:01
2026-02-06,14:29,business,経済,5,読売新聞オンライン,トヨタ、午後３時半から緊急記者会見…佐藤恒治社長ら登壇,https://news.yahoo.co.jp/articles/10adfbfc19bff7b5ca9af25e7bcae178df57e8ea,2/6(金) 13:49
2026-02-06,14:29,business,経済,6,共同通信,トヨタ、午後に緊急会見　社長出席、決算とは別,https://news.yahoo.co.jp/articles/dfd16908c29543f73f5fcc3b3c55d4e46219fb47,2/6(金) 13:36
2026-02-06,14:29,business,経済,7,Finasee,【60代】金融資産保有額ランキング、半数の世帯が「1000万円以上」持っている？【最新版】,https://news.yahoo.co.jp/articles/a4e1f051e9fdde999be1f8513b14bb41b70fdf67,2/6(金) 13:30
2026-02-06,14:29,business,経済,8,ファイナンシャルフィールド,ガソリン代が月「1万2000円」なのに、また値上げ…。「暫定税率」っていつまで続く？ 家計はどれだけ変わる？,https://news.yahoo.co.jp/articles/75ebabfcf81ed85e7abfcecb75b5ad1b859b215a,2/6(金) 11:40
2026-02-06,14:29,business,経済,9,ファイナンシャルフィールド,40代「年収500万円」で“退職金なし”の会社に勤務中…妻に「退職金ある会社に転職したら？」と言われますが、今からでもNISAで「月2万円×年率5％」運用すれば、退職金代わりになりますか？,https://news.yahoo.co.jp/articles/1b58c186295d26dcfa582bf7e2180457c23938a9,2/6(金) 13:30
2026-02-06,14:29,business,経済,10,テレビ朝日系（ANN）,【速報】トヨタ自動車・佐藤恒治社長が退任へ　後任は近健太氏　社内の役割変更が理由,https://news.yahoo.co.jp/articles/f366f583c2885a64c3e4ba50f84f560c57285716,2/6(金) 14:11
2026-02-06,14:29,business,経済,11,くるまのニュース,「高速を乗らせません！」 NEXCO“異例の措置”実施に反響「殺到」！ 「ノーマルタイヤ車“3000台”」を通行拒否！ 「命を守る行動だ」と賞賛のコメントも！ 悪天候下で実施の「タイヤ確認」に寄せられた声とは,https://news.yahoo.co.jp/articles/ca1561e4e41a59b0798b05c2a31087c14be2d1c8,2/6(金) 6:45
2026-02-06,14:29,business,経済,12,BuzzFeed Japan,【ねこの日】ヤマト運輸とファミマが今年もコラボ→「え、かわいい」「にゃん好きにはたまらん」SNS歓喜,https://news.yahoo.co.jp/articles/51ecb811381a7e214f02f90c8f750b8bbe3e13e1,2/6(金) 12:05
2026-02-06,14:29,business,経済,13,Bloomberg,ビットコインが6.1万ドル割れ－トランプ氏再選後の上げが帳消し,https://news.yahoo.co.jp/articles/8ccd3214b3c7458c47899e99f048508b091d3fa2,2/5(木) 21:46
2026-02-06,14:29,business,経済,14,ITmedia ビジネスオンライン,メモリ価格の高騰、ゲーム機への影響は？ 「スイッチ2」「PS5」で値上げはなさそうだと言えるワケ,https://news.yahoo.co.jp/articles/698b8726ebc5b758078649363ddad70c79244bff,2/2(月) 5:55
2026-02-06,14:29,business,経済,15,ファイナンシャルフィールド,家族旅行で新幹線の座席を「バラバラ」で予約したら、車掌さんに「移動はご遠慮ください」と言われました。どうしても子どもの横に座りたいのですが、こういう場合に座席を“勝手に移動”してもいいのでしょうか？,https://news.yahoo.co.jp/articles/77382ebd741ca9acfb5dcbe16f04eb762a2cb426,2/5(木) 8:50
2026-02-06,14:29,business,経済,16,ファイナンシャルフィールド,【3月12日まで】新幹線が「1万円」で“1日乗り放題”！ 東京から「仙台・新潟」に行く場合“通常運賃”と比べてどれだけ得？ JR東日本「キュンパス」を解説,https://news.yahoo.co.jp/articles/1be05a8df03b0401a2e49e8869125b7962033f28,2/4(水) 14:10
2026-02-06,14:29,business,経済,17,ロイター,マクロスコープ：高市トレードに「改憲」の影　自民圧勝予測で日本株に期待と警戒,https://news.yahoo.co.jp/articles/b806413c3c82e7b2c5badb394750b8ea6115370b,2/6(金) 13:28
2026-02-06,14:29,business,経済,18,LIMO,最新【個人向け国債】「2026年2月募集の金利」は何％？税引後の利率もチェック！《変動10年・固定5年・固定3年》3種類の個人向け国債、人気が高いのはどれ？,https://news.yahoo.co.jp/articles/51f245fdc10c7a0b22896fa6499340428cd30303,2/4(水) 15:55
2026-02-06,14:29,business,経済,19,日刊自動車新聞,トヨタ、社長交代　新社長は近健太執行役員　佐藤恒治社長は副会長に,https://news.yahoo.co.jp/articles/8466543dcde69b1c45de2886f28770026c9fc054,2/6(金) 14:10
2026-02-06,14:29,business,経済,20,ファイナンシャルフィールド,他界した父が、私の名義の口座に300万円貯めていました。口座の名義が相続人の場合、相続税はかかりませんか？,https://news.yahoo.co.jp/articles/96537a766a7d095558509223f14ec458f2e39aad,2/6(金) 7:40
2026-02-06,14:29,business,経済,21,Finasee,花王【4452】35期連続増配「配当貴族」の気になる今後、株価は最安値圏から脱出も反発弱い理由は？ 株主還元の方針は変わるか,https://news.yahoo.co.jp/articles/33a3db97a53409f64fae62a1e2728cc5f1b75462,2/6(金) 11:53
2026-02-06,14:29,business,経済,22,読売新聞オンライン,熊本地震「阿蘇は九州観光のへそだ。まずいことになる」…菅義偉氏らに対策要望、「ふっこう割」初めて導入,https://news.yahoo.co.jp/articles/f9d96834899f76b921cf82f144f8c479c4bcb408,2/6(金) 11:30
2026-02-06,14:29,business,経済,23,ITmedia ビジネスオンライン,トヨタ「RAV4」はなぜ売れているのか　“トレンドの変化”に応じた巧みな商品戦略,https://news.yahoo.co.jp/articles/995e41c5fa11ba6639027a6f5aeda71410d2ea62,2/6(金) 7:10
2026-02-06,14:29,business,経済,24,朝日新聞 SDGs ACTION！,太陽光発電は自然破壊でエコじゃないって本当？　実は温暖化対策にならないの？　業界団体の「中の人」に聞いてみた,https://news.yahoo.co.jp/articles/fc3baf8fe92263fe25a33f76f359ba603fd6b67d,2/6(金) 11:40
2026-02-06,14:29,business,経済,25,メ〜テレ（名古屋テレビ）,【速報】トヨタ自動車の新社長に近健太氏　佐藤恒治社長は副会長に　4月1日付の役員人事,https://news.yahoo.co.jp/articles/c021c7f58bc276b536875c7ffc73d74abb1050ad,2/6(金) 14:12
2026-02-06,14:29,business,経済,26,ファイナンシャルフィールド,子ども2人いるママ友の家は給付金を「4万円」もらえるそうです！ うちは共働きで世帯年収800万円なのですが、対象になりますか？,https://news.yahoo.co.jp/articles/4be6443fab7c13785f6b14517a56bae481374385,2/6(金) 13:40
2026-02-06,14:29,business,経済,27,NewsPicks ＋ｄ,日本人を裏切れない…中国の“買い占め”から日本企業を救ったチリの絆,https://news.yahoo.co.jp/articles/4c54ab2b5a19288321fb6754825d6933d378ac79,2/4(水) 6:50
2026-02-06,14:29,business,経済,28,ファイナンシャルフィールド,寒さ対策に石油ファンヒーターを買おうか悩んでいます。電気代と灯油代を合わせると、エアコンよりも高くなるのでしょうか…？,https://news.yahoo.co.jp/articles/73dd9633038187d32f28738ee79fc53f4d49c41e,2/6(金) 12:12
2026-02-06,14:29,business,経済,29,Bloomberg,イーロン・マスク氏の夢「宇宙データセンター」はリアルな未来か,https://news.yahoo.co.jp/articles/6efe22d2049ec2e0ef085f94e578b7b659ddc1fc,2/6(金) 12:22
2026-02-06,14:29,business,経済,30,ファイナンシャルフィールド,親が亡くなり、生命保険金1000万円を受け取る予定です。どのような手続きが必要で、税金はいくらくらいかかるのでしょうか？,https://news.yahoo.co.jp/articles/1a86ebb9ad725ba0a666bc5d86026782b9472178,2/6(金) 7:10
2026-02-06,14:29,business,経済,31,ファイナンシャルフィールド,変動金利の上昇で、返済が「月12万→15万円」に増えそうです…今から「固定金利」に借り換えるべき？ 手数料“100万円”払っても損する人とは？ 月額返済の「損益分岐点」を確認,https://news.yahoo.co.jp/articles/8b9da77b1a933c53f2a4ed28e36dd707bc180473,2/6(金) 13:40
2026-02-06,14:29,business,経済,32,乗りものニュース,横浜の住宅街を貫く「新トンネル」40年越しの開通へはずみ！ 丁字路の山、反対側からも“ぶち抜き”着手へ 計画から80年越し!?,https://news.yahoo.co.jp/articles/0fe473ec66847773891148e3d29672fcd745e798,2/6(金) 7:42
2026-02-06,14:29,business,経済,33,ファイナンシャルフィールド,住宅ローンは変動金利のままです。金利が0.5％上がると、借入3800万円・35年返済の家計はどう変わりますか？,https://news.yahoo.co.jp/articles/71124134003afc3c5a6ec615e878b1a6f25bcf4e,2/6(金) 13:50
2026-02-06,14:29,business,経済,34,ファイナンシャルフィールド,年収300万円、去年の医療費は9万円でした。10万円にギリギリ足りないので、医療費控除は受けられないですよね？,https://news.yahoo.co.jp/articles/73158f04b7a8761edb2ff50447fe51a0978b2e70,2/6(金) 13:30
2026-02-06,14:29,business,経済,35,LIMO,【75歳以上 後期高齢夫婦】ふたり暮らしなら、月の生活費はどれくらい？医療費の窓口負担割合《1割・2割・3割》も解説！,https://news.yahoo.co.jp/articles/502a198a04cd7451f118c94d28b6d9c55dbd9fcb,2/4(水) 19:21
2026-02-06,14:29,business,経済,36,FNNプライムオンライン,狙われた“6億円”…現金強盗事件の背景に“金”の売買　乱高下する金価格の取引実態に密着　その影響は身近な銅にまで…,https://news.yahoo.co.jp/articles/bd1903fbb4501419aafbb3080f90852868219f39,2/6(金) 12:03
2026-02-06,14:29,business,経済,37,共同通信,トヨタ社長が交代、後任に近氏,https://news.yahoo.co.jp/articles/975a28d6ab523f208a69256f6f5968c33956eede,2/6(金) 14:08
2026-02-06,14:29,business,経済,38,朝日新聞,トヨタ社長が交代、近健太CFOが昇格　豊田章男会長は留任,https://news.yahoo.co.jp/articles/e33817c91f8efb3569350ab5e62b3bcba30e38df,2/6(金) 14:07
2026-02-06,14:29,business,経済,39,時事通信,トヨタ社長に近執行役員　佐藤社長は副会長に,https://news.yahoo.co.jp/articles/b4e6836ff35abf02fef9035f5e58ac6e567e6c0f,2/6(金) 14:09
2026-02-06,14:29,business,経済,40,ファイナンシャルフィールド,金価格「7000円」だった5年前から“1万円”純金積み立てしてたら…今ごろ「元本60万円」に対して、資産価値は“180万円”に!? これからはNISAと並行で「金投資」すべきでしょうか？,https://news.yahoo.co.jp/articles/2a336986ec6dd55e35f372527ecd4bfca21bfa36,2/5(木) 13:40
