scrp_date,scrp_time,genre_en,genre_jp,rank,media_jp,title,link,date_original
2025-11-13,09:32,sports,スポーツ,1,イーファイト,えなこ、刃牙の180度開脚、「実は…」話題のビキニ股割りポーズ”告白に騒然,https://news.yahoo.co.jp/articles/5f7fc077eb11848410705fd1a9026aa1e8cbed91,11/13(木) 6:42
2025-11-13,09:32,sports,スポーツ,2,Full-Count,ドジャースの早朝発表に騒然「マジか」「えっ！」　突然の報せ…日本ファンに悲しみ広がる,https://news.yahoo.co.jp/articles/67fedb4419bedcf05ee72f01cfd86ed678690f43,11/13(木) 7:56
2025-11-13,09:32,sports,スポーツ,3,Full-Count,大谷翔平、「レジェンダリー・モーメント賞」を初受賞　”伝説の1日”は「Greatest Sho」,https://news.yahoo.co.jp/articles/dc609c5b3f723807844c731fac6041ef67db2ba5,11/13(木) 8:38
2025-11-13,09:32,sports,スポーツ,4,サンケイスポーツ,中日が前楽天・阿部寿樹の獲得調査　「打球速度と強さは若手よりもはるかに上」,https://news.yahoo.co.jp/articles/9f3fdcf4f672e0d73f5f384b0a9b1e3c1bc045fd,11/13(木) 5:00
2025-11-13,09:32,sports,スポーツ,5,スポーツ報知,ドジャース世界一陰の立役者がレッズ移籍、球団発表　大谷翔平＆山本由伸との好相性…２２年１６勝右腕は退団,https://news.yahoo.co.jp/articles/46a8e7d9a62be70ad5c4d26df6d5d28a89ef12c3,11/13(木) 7:16
2025-11-13,09:32,sports,スポーツ,6,Full-Count,ド軍、控え捕手ロートベットがレッズへ移籍　球宴右腕ゴンソリンは退団…球団発表,https://news.yahoo.co.jp/articles/1dd552d17cd33e48603a641d43144bce0fd08c5f,11/13(木) 7:00
2025-11-13,09:32,sports,スポーツ,7,CoCoKARAnext,まさか育成で獲得できるとは…ドラフト育成指名でも支配下に限りなく近い「3選手」,https://news.yahoo.co.jp/articles/13bed6e2ccbb4a3b08b905b920f76170e76ad90f,11/13(木) 5:40
2025-11-13,09:32,sports,スポーツ,8,スポーツ報知,巨人戦力外の馬場皐輔をＤｅＮＡが獲得へ…今季救援防御率セ・ワーストで整備急務,https://news.yahoo.co.jp/articles/b7f321d213ef367d94b07df0d64f7dc4cd9886b3,11/13(木) 5:00
2025-11-13,09:32,sports,スポーツ,9,スポーツ報知,再婚＆出産から１年…古閑美保さん　現在の姿に衝撃「エレガント」「綺麗」「素敵」イメージ激変,https://news.yahoo.co.jp/articles/f215ad7946aa87fc6890ee519d93b2abbd625e6d,11/13(木) 6:42
2025-11-13,09:32,sports,スポーツ,10,中日スポーツ,大谷翔平、山本由伸のWBC参加、ドジャース”消極的”姿勢か…今季フル回転の山本への負担懸念、侍ジャパンとの綱引き,https://news.yahoo.co.jp/articles/76686f8e17b17b136d754ec9774ade40d31e079e,11/13(木) 3:49
2025-11-13,09:32,sports,スポーツ,11,日刊スポーツ,【ヤクルト】島内宏明、モンテルを獲得調査　手薄な外野手は補強ポイントに合致,https://news.yahoo.co.jp/articles/35820186495a1c4757b6eef319c32e86a2e68949,11/13(木) 4:56
2025-11-13,09:32,sports,スポーツ,12,日刊スポーツ,大谷翔平が連覇達成直後に発した言葉をドジャースCEO明かす「私も不可能だとは思っていない」,https://news.yahoo.co.jp/articles/d41f7150a3c2b1bacec0ff80803bc2643c7f823a,11/13(木) 8:17
2025-11-13,09:32,sports,スポーツ,13,スポーツ報知,【阪神】西武戦力外の元山飛優を獲得へ　内野全ポジション守れるユーティリティーさと犠打などの小技を評価,https://news.yahoo.co.jp/articles/55662b470473d31adb17e311fba632d442823fb9,11/13(木) 5:00
2025-11-13,09:32,sports,スポーツ,14,theWORLD（ザ・ワールドWeb）,ジダン氏が監督業復帰を発表　気になる就任チームはフランス代表が確定的か,https://news.yahoo.co.jp/articles/d32b648a3e267ba3da2f71adb2b0bb1612c2b1b0,11/13(木) 6:02
2025-11-13,09:32,sports,スポーツ,15,スポーツ報知,報道番組の美女コメンテーター　印象激変の正体に「ビックリ」「同一人物に思えない」「お綺麗」清水希容さんにくぎ付け,https://news.yahoo.co.jp/articles/1ecc4b6821480fe90f50bfc6b18dc03b6922f7b2,11/13(木) 5:18
2025-11-13,09:32,sports,スポーツ,16,東スポWEB,元日本ハム・宮台康平氏が司法試験に〝一発合格〟　清宮幸太郎、田中瑛斗ら同期の活躍刺激に,https://news.yahoo.co.jp/articles/ce717734049a101f445692a15435db74f8a9abd6,11/13(木) 5:15
2025-11-13,09:32,sports,スポーツ,17,スポニチアネックス,ソフトバンク　柳田悠岐「もう来季は、すがるっす。試合に出たいので、生き残る」来季は7年契約最終年,https://news.yahoo.co.jp/articles/7b90e0333494a707e6083305ab4665b94d118a65,11/13(木) 6:00
2025-11-13,09:32,sports,スポーツ,18,ゴルフダイジェスト・オンライン（GDO）,日本で再確認した米ツアーへの思い　渋野日向子は上を見て「ここで戦わなきゃ」,https://news.yahoo.co.jp/articles/a9eb7ad9e5740dd6b3c634b48d435001d0e074b0,11/13(木) 7:46
2025-11-13,09:32,sports,スポーツ,19,サンケイスポーツ,ドジャース28歳捕手がレッズ移籍…大谷翔平、山本由伸を好リードでリーグV貢献　DFAの31歳右腕はFA選択,https://news.yahoo.co.jp/articles/5b48c0e78ad6b85f50187e764547664c5edd2288,11/13(木) 7:53
2025-11-13,09:32,sports,スポーツ,20,スポニチアネックス,仙台育英　不祥事では史上初の全国高校サッカー選手権辞退　宮城県代表校の代替出場は未定,https://news.yahoo.co.jp/articles/f3bf43d7949fb129995cd45c526c974320b45e97,11/13(木) 5:30
2025-11-13,09:32,sports,スポーツ,21,スポーツ報知,西武が日本ハムからＦＡ宣言・石井一成に即日アタックへ　３年契約をベースに好条件を用意　１３日から交渉解禁,https://news.yahoo.co.jp/articles/b505ba332ed151667ab2e8fd93b6ac3e679692b1,11/13(木) 2:00
2025-11-13,09:32,sports,スポーツ,22,FITNESS LOVE,ボディコンテスト日本一を極めた43歳が自己改革に挑み、バキバキボディからなめらか曲線ボディに変化　「私なりのベストボディを作る」,https://news.yahoo.co.jp/articles/a31e744db947e17fda7baa7896a16eafaaad2c85,11/13(木) 4:30
2025-11-13,09:32,sports,スポーツ,23,4years.,"東日本実業団駅伝の裏で、3大駅伝「三冠」メンバーも力走！　駒澤大学が中心の""Ggoat""には、クラブチームもあります",https://news.yahoo.co.jp/articles/b52b9dbedd284e7e3bab64001c3e07a72c26ae2b,11/13(木) 8:20
2025-11-13,09:32,sports,スポーツ,24,CoCoKARAnext,大谷翔平は「幸運だった」　受賞確実MVPレースでの“ライバル不在”を米記者が嘆く「彼を追い詰める選手がいなかった」,https://news.yahoo.co.jp/articles/0ce8b908b3170c41ad065aa78bc8ee123127a74a,11/13(木) 5:30
2025-11-13,09:32,sports,スポーツ,25,Full-Count,わずか1年で“激変”…巨人逸材の球界No.1数値「11.9」　他球団ファンも激賞「圧倒的」,https://news.yahoo.co.jp/articles/88a1147fc23502f7e8b725c8c1b93b033035dc91,11/13(木) 7:30
2025-11-13,09:32,sports,スポーツ,26,スポニチアネックス,片岡篤史氏が明かす！　ドラフト3位で狙った源田壮亮を西武に奪われた阪神が指名したのは…,https://news.yahoo.co.jp/articles/682565844892d62d0a26250dd2fc1fb44a1bb709,11/12(水) 22:48
2025-11-13,09:32,sports,スポーツ,27,Full-Count,ド軍退団…美人妻から漏れた“本音”「みんなが恋しい」　激変イケメン剛腕の気になる去就,https://news.yahoo.co.jp/articles/80cc4d252b961cf6db339fbe7fc2b370d93cca38,11/13(木) 7:07
2025-11-13,09:32,sports,スポーツ,28,RONSPO,トライアウトで「ワンポイントで使える」とアピールに成功した人と「成長を感じない」と失敗した人は誰だ？…元ヤクルト編成部長がNPB復帰可能性のある「4プラス2」を緊急チェック！,https://news.yahoo.co.jp/articles/9c40dc20e555b66e60f6189de0655e3e2cc6e9ce,11/13(木) 6:02
2025-11-13,09:32,sports,スポーツ,29,サンケイスポーツ,ヤクルト、ロッテを戦力外の柿沼友哉捕手を獲得調査　西武を戦力外の日隈モンテル外野手は育成で,https://news.yahoo.co.jp/articles/a4d5b0a4f527cb5192e37fb989eadf94eb6e85e4,11/13(木) 5:00
2025-11-13,09:32,sports,スポーツ,30,サンケイスポーツ,村上宗隆の移籍先候補は〝5球団〟か　米記者が指摘…ドジャース「明らかに日本選手と相性良い」メッツ「もし契約がうまくいかなかった場合…」,https://news.yahoo.co.jp/articles/fdd7da8c22007d5020d63fa82f5b4f34c3a4c93c,11/13(木) 8:27
2025-11-13,09:32,sports,スポーツ,31,Full-Count,大谷翔平と真美子夫人を捉えた貴重写真　同僚夫妻と笑顔で…球団カメラマンが見たLAの熱狂,https://news.yahoo.co.jp/articles/5b2b14a2798277d7c3419629868641e539824c34,11/11(火) 17:16
2025-11-13,09:32,sports,スポーツ,32,スポニチアネックス,ヤンキースGMが語った「ドジャースには脱帽だ」　日本選手獲得の重要性にも言及,https://news.yahoo.co.jp/articles/16555c218738c5dc97158b0efb90dbdf70ed2486,11/13(木) 8:31
2025-11-13,09:32,sports,スポーツ,33,Full-Count,ド軍スコットの放出は可能？　あまりに重い85億円…米記者「賭けができるチームは」,https://news.yahoo.co.jp/articles/2a3176c4650d5164f81fae61932dbb1acba6189b,11/13(木) 7:40
2025-11-13,09:32,sports,スポーツ,34,CoCoKARAnext,NY識者が訴えた山本由伸への“出し惜しみ”　ヤ軍が敗れた2年前の争奪戦に異論「カネは関係ないというのは無理だ」,https://news.yahoo.co.jp/articles/490c8e85bb44bb5f7240545474fc1f2d52ea8d76,11/13(木) 6:00
2025-11-13,09:32,sports,スポーツ,35,オートスポーツweb,2026年F1デビューのアウディ、初のF1マシンの基本リバリーを発表。“R26コンセプト”として先行公開,https://news.yahoo.co.jp/articles/259a4250ef812ae0d7f0d5a713a9ed90ae7e40bb,11/13(木) 7:01
2025-11-13,09:32,sports,スポーツ,36,競馬のおはなし,ダミアン・レーン騎手が騎乗停止,https://news.yahoo.co.jp/articles/0f6ebd13d759f69895f0618c14a7ef980e71430b,11/13(木) 6:05
2025-11-13,09:32,sports,スポーツ,37,Full-Count,WS連覇→“即販売”グッズに騒然　凝った仕掛け…米羨望「ド軍ファンじゃないけど欲しい」,https://news.yahoo.co.jp/articles/9aa380d8e5db0f252ef0abafaf4064756b1b4d7a,11/13(木) 5:32
2025-11-13,09:32,sports,スポーツ,38,スポーティングニュース日本版,【NBA】クリッパーズのブラッドリー・ビールが股関節骨折で今季全休 復帰の見通しは？,https://news.yahoo.co.jp/articles/7a2b38d2e79d06e7f6158c7a1c8e75b61672b275,11/13(木) 8:30
2025-11-13,09:32,sports,スポーツ,39,デイリースポーツ,「この男にできないことなんてあるの？！？！」　ドジャース・ベッツはゴルフの腕前もプロ級！　大谷マニア記者が動画投稿,https://news.yahoo.co.jp/articles/682dc64f1665f440bd5faa13854e12e8a3aab9f7,11/13(木) 8:27
2025-11-13,09:32,sports,スポーツ,40,デイリースポーツ,プロ野球ＧＧ賞　セ三塁部門「該当者なし」４１票がＳＮＳで波紋「納得いかん」「今年は佐藤輝で文句なしやと」「値する選手がいたかと言われれば…」,https://news.yahoo.co.jp/articles/522d5a79ecc9c4de56f91b7df20da7822f67c2de,11/12(水) 21:40
