scrp_date,scrp_time,genre_en,genre_jp,rank,media_jp,title,link,date_original
2025-02-28,18:07,sports,スポーツ,1,日刊スポーツ,【巨人】阿部監督「ホールドのタイトル取れって言った」大勢は７回にも登板可能性「責任持って」,https://news.yahoo.co.jp/articles/0e7dcb99f0222fd4c03f46e011ef5c9ab18722de,2/28(金) 14:39
2025-02-28,18:07,sports,スポーツ,2,デイリースポーツ,再起戦ＢＤ人気選手、会社２社経営の実業家だった「仲間には全員年収１０００万以上稼いでもらうように」Ｗ不倫騒動の美人妻とは離婚協議中「雲行きは怪しい」,https://news.yahoo.co.jp/articles/bca33f37424d5d91edb92e63a669feff848f2c9d,2/28(金) 13:20
2025-02-28,18:07,sports,スポーツ,3,スポニチアネックス,NPB　新たなカジノ利用申告はなし　名前非公表の理由は「やった罰は受けるが、きちんと活動を」,https://news.yahoo.co.jp/articles/23cd0bcd83ec075b333378f760ef76e276d337d8,2/28(金) 15:26
2025-02-28,18:07,sports,スポーツ,4,RONSPO,「また井上尚弥から逃げた。考えられないよ」“モンスター”が5月3日に米国ラスベガスで対戦予定だった無敗のピカソが“敵前逃亡”で挑戦辞退…大橋会長はあきれて激怒…代役は別のメキシカンか,https://news.yahoo.co.jp/articles/68a2a602046ecf517247910d91bf0df9b70f7b94,2/28(金) 6:10
2025-02-28,18:07,sports,スポーツ,5,ABEMA TIMES,別格！ 長谷川唯、“絶品アウトサイド股抜きパス”で世界女王アメリカを完全翻弄「本当に上手い」「落ち着きえぐい」敵地スタジアムも騒然とした瞬間,https://news.yahoo.co.jp/articles/2cd96acf8b869a68d3e81bedee2d06ce5d7cd4cf,2/28(金) 17:02
2025-02-28,18:07,sports,スポーツ,6,高校野球ドットコム,阪神退団4選手に明暗くっきり、支配下へ猛アピールする23歳！DeNA移籍2投手は苦戦,https://news.yahoo.co.jp/articles/f020bff82932c5b1d0e69a85d5d75f1e7176c96b,2/28(金) 13:30
2025-02-28,18:07,sports,スポーツ,7,日刊スポーツ,アーモンドアイ×イクイノックスの牡馬が誕生「宝物のような血統」シルクＲ米本代表,https://news.yahoo.co.jp/articles/232e617c0018c3a36cb586a9fc10de7dccac9247,2/28(金) 17:00
2025-02-28,18:07,sports,スポーツ,8,イーファイト,井上尚弥vsアフマダリエフ戦は5月濃厚に！ピカソ戦は消滅の可能性,https://news.yahoo.co.jp/articles/9dbe3bf6c28648317d9ef59d4184f282baef89f3,2/28(金) 11:59
2025-02-28,18:07,sports,スポーツ,9,ゴルフ総合サイト ALBA Net,古江彩佳が5位で週末へ　渋野日向子、山下美夢有は16位,https://news.yahoo.co.jp/articles/c87173010572c0ba9bc1da8da1181a780ad7db26,2/28(金) 15:38
2025-02-28,18:07,sports,スポーツ,10,REAL SPORTS,「ドーピング検査で陽性が…」山中亮平を襲った身に覚えのない禁止薬物反応。日本代表離脱、実家で過ごす日々,https://news.yahoo.co.jp/articles/0339183a54588dc552d04d22d776790ad63e3e3d,2/28(金) 12:12
2025-02-28,18:07,sports,スポーツ,11,Full-Count,ド軍27歳は「自動アウト人間」　栄光から2年で転落、復活しない打棒「トレードしろ」,https://news.yahoo.co.jp/articles/c13841746653f1fb2dcdd9cfee4d62be3a10a9f9,2/28(金) 12:55
2025-02-28,18:07,sports,スポーツ,12,CoCoKARAnext,打率1割で退団したNPB助っ人が明かした日本野球　慣れない異文化で得た教訓「新しい文化にワクワクした。彼らの野球は少し違う」,https://news.yahoo.co.jp/articles/cc991a265517ff93ffffdc8d47e693cc6a599bd5,2/28(金) 17:00
2025-02-28,18:07,sports,スポーツ,13,ゴルフ総合サイト ALBA Net,勝みなみが2位で決勝へ　吉田優利31位、川崎春花は予選落ち,https://news.yahoo.co.jp/articles/156a87e012057ab987d107f73cfb432762d7640e,2/28(金) 17:16
2025-02-28,18:07,sports,スポーツ,14,スポニチアネックス,八村塁が左ヒザ負傷退場…速攻ダンク後にアクシデント　レブロン＆ドンチッチの活躍でレイカーズ4連勝,https://news.yahoo.co.jp/articles/d382471cec157367c04731d0fcdf19a9d3043574,2/28(金) 15:10
2025-02-28,18:07,sports,スポーツ,15,Full-Count,楽天21歳が左アキレス腱断裂手術　球団発表…剛腕救援に続き連日の6か月離脱者,https://news.yahoo.co.jp/articles/64ee9a7d08c74b25a28f6557ddf8c48818e2e443,2/28(金) 13:33
2025-02-28,18:07,sports,スポーツ,16,スポニチアネックス,電撃加入のG大阪MF満田誠が背番号51にした理由「言っていいんですかね？」広島戦出場も可能な契約,https://news.yahoo.co.jp/articles/a5bba1f3cbc3c196f639107eb844dbf0b3519eff,2/28(金) 14:49
2025-02-28,18:07,sports,スポーツ,17,スポーツ報知,【阪神】西純矢が「右肘関節鏡視下関節鼠摘出術」を終え退院「悔しい気持ちがあります」…球団発表,https://news.yahoo.co.jp/articles/7f9c79bf91f230e46ee9d43b2b0c31782805291e,2/28(金) 14:52
2025-02-28,18:07,sports,スポーツ,18,日刊スポーツ,NPB事務局長　オリックス山岡泰輔１人だけ実名報道の現状「非常にかわいそうだなと思います」,https://news.yahoo.co.jp/articles/e39d5c7b2cb636f8651fd3a2003a683af1caba19,2/28(金) 16:23
2025-02-28,18:07,sports,スポーツ,19,中日スポーツ,新谷仁美、名古屋ウィメンズマラソン欠場 左脚アキレス腱炎のため,https://news.yahoo.co.jp/articles/b0329ecda2882c7f60cbf60d27940359f28b96e9,2/28(金) 15:08
2025-02-28,18:07,sports,スポーツ,20,Full-Count,大谷翔平に流れる“デマ”に「どういうこと？」　ファン困惑…ジャッジも及ばぬ最強「18」,https://news.yahoo.co.jp/articles/24061930f92d97f21673f885ad9e49151781cbfd,2/28(金) 15:46
2025-02-28,18:07,sports,スポーツ,21,スポニチアネックス,つば九郎を日テレ「ZIP！」が特集　その構成にファン感動「号泣してしまった」「気持ち伝わりました」,https://news.yahoo.co.jp/articles/df95bf0401bc571d935523842f8c73100b78c45c,2/28(金) 16:19
2025-02-28,18:07,sports,スポーツ,22,Full-Count,色褪せぬ美しさ「39歳にはとても」　“国民的美女”にときめき「ずっとかわいい」,https://news.yahoo.co.jp/articles/3433371a9d5b003c769303c8248b6c539fdda2cf,2/28(金) 16:43
2025-02-28,18:07,sports,スポーツ,23,ABEMA TIMES,「タオル投げて」衝撃の3ダウンKOにファン騒然 「もうダメだ…」放送席からも心配の声,https://news.yahoo.co.jp/articles/c8e76575d805f97634c58a6a03981fbc7a15f584,2/28(金) 9:12
2025-02-28,18:07,sports,スポーツ,24,馬トク報知,両親で１５冠の夢配合！　父イクイノックス×母アーモンドアイの牡馬が誕生　順調なら２７年夏以降にデビュー,https://news.yahoo.co.jp/articles/9f2ca81bbb187c2e71335132d40f1753ef7e48bf,2/28(金) 17:14
2025-02-28,18:07,sports,スポーツ,25,デイリースポーツ,ドジャース・大谷翔平が苦笑いで大きなため息を２度　誰が親友？の質問に　ＳＮＳ「互いに名前を挙げたくないってこと？」「面白い」と反応,https://news.yahoo.co.jp/articles/f30c978f7f803660bedfce7fc22010d688650580,2/28(金) 14:49
2025-02-28,18:07,sports,スポーツ,26,高校野球ドットコム,崩壊寸前!? 中日は先発ローテーションを回せるのか…主力退団＆けが人続出＆高齢化の三重苦をどう打開する？,https://news.yahoo.co.jp/articles/f66aa32d0bd455037f6acda34e5dfc7575bf8bcb,2/28(金) 13:55
2025-02-28,18:07,sports,スポーツ,27,スポーツ報知,【ＮＰＢ】オリックス山岡泰輔含め８球団１５人が利用　オンラインカジノ新たな申告者はなし　実名公表避けた経緯は…,https://news.yahoo.co.jp/articles/77ee2d754a65741f7d3c4bd4b0612d3ccf19c6cb,2/28(金) 15:58
2025-02-28,18:07,sports,スポーツ,28,デイリースポーツ,毎日料亭のような弁当が凄すぎ！本田三姉妹の母　末っ子・紗来の言葉に「泣いた　我が子ながら最高すぎ」,https://news.yahoo.co.jp/articles/56f0520d1b304a5bd788489cb3044a06fcbf896a,2/28(金) 16:34
2025-02-28,18:07,sports,スポーツ,29,日刊スポーツ,タイムフォーム社がフォーエバーヤングのレーティング世界一を解説「本物」「ドバイも勝てる」,https://news.yahoo.co.jp/articles/89a3cf82f4ce883688aba7efb9e17c608bdbb6d3,2/28(金) 16:27
2025-02-28,18:07,sports,スポーツ,30,日刊スポーツ,藤波辰爾が西村修さん死去を悼む「同じ釜の飯を食った仲…根に持っていない」無我時代に確執,https://news.yahoo.co.jp/articles/85b6f1e0885b282929790efa742b9241fc60c94f,2/28(金) 16:56
2025-02-28,18:07,sports,スポーツ,31,Full-Count,「怪物ルーキー」の“1号”に鳥肌　止まらぬ無双、21歳ドラ1の衝撃は「本物」,https://news.yahoo.co.jp/articles/c5a64278b15400efddc35c12fbb198fadb2bc949,2/28(金) 15:01
2025-02-28,18:07,sports,スポーツ,32,東スポWEB,井上尚弥戦をピカソが回避した理由　元世界王者ら「全員がこの試合に否定的だった」,https://news.yahoo.co.jp/articles/16dd720857ded9c7f24a5bbad639622bf94582aa,2/28(金) 9:31
2025-02-28,18:07,sports,スポーツ,33,日刊スポーツ,NPB、オンラインカジノ利用申告者の所属チームを訂正　7球団にオリックスが含まれない可能性,https://news.yahoo.co.jp/articles/f38f2ecf5db32c3323cfcdd6102eea8b5e44bf8a,2/28(金) 16:14
2025-02-28,18:07,sports,スポーツ,34,東スポWEB,プロレスラーで文京区議会議員の西村修さんが５３歳で死去　２０２４年からステージ４の食道がんで闘病,https://news.yahoo.co.jp/articles/4aec61bd6ad28497485d635e1e3654f96da1944e,2/28(金) 11:31
2025-02-28,18:07,sports,スポーツ,35,デイリースポーツ,「こんなに早く効果が出るとは思ってませんでした」　臨時コーチを務めた糸井嘉男氏が阪神・佐藤輝明の成長速度に驚き,https://news.yahoo.co.jp/articles/7e0c71b3b85fc5ed3cdb56dbd77a96872ec7851d,2/28(金) 17:19
2025-02-28,18:07,sports,スポーツ,36,日刊スポーツ,吉田優利「思い出たくさん。心強いサポート」契約満了スポンサー企業などに感謝の意,https://news.yahoo.co.jp/articles/a3269ed9ffee0ba73c3b1d19c180f06b51e2bc39,2/28(金) 16:41
2025-02-28,18:07,sports,スポーツ,37,デイリースポーツ,藤浪晋太郎　阪神ＯＢがメンタル改革の提言　「死球の考え方を変えるだけで投球が変わる可能性がある」,https://news.yahoo.co.jp/articles/ab00e7188ed41b0e563394bfccb7e96f6f7739e6,2/28(金) 16:44
2025-02-28,18:07,sports,スポーツ,38,DAZN News,久保建英がレアル・マドリードで一番好きな選手は…「彼が11人プレーするチームが最も強い」｜ラ・リーガ,https://news.yahoo.co.jp/articles/dedc902aa5053e4754bd4a1da343c18e62cade31,2/28(金) 10:26
2025-02-28,18:07,sports,スポーツ,39,ゴルフ総合サイト ALBA Net,渋野日向子はダボ、ボギーで後退も　再浮上へ前向き「まだ上に行けるチャンスはある」,https://news.yahoo.co.jp/articles/7f943bfd570652681e75e5ed2a7c7cffb270c835,2/28(金) 17:02
2025-02-28,18:07,sports,スポーツ,40,GOAL,クロップは日本食が大好物？来日で語った“日本”の印象「シンジやタクミ、ワタルから聞いていたけど…」,https://news.yahoo.co.jp/articles/75a7bce306ca3c401d0b0f5655eac0cf7b4dfca7,2/28(金) 17:00
