scrp_date,scrp_time,genre_en,genre_jp,rank,media_jp,title,link,date_original
2025-08-31,08:06,domestic,国内,1,日刊スポーツ,石丸伸二氏、全敗参院選２日後の本音「そろそろ卒業ですかね」政治家引退に言及、理由も明かした,https://news.yahoo.co.jp/articles/b43f7cce6a65a5ec49f48a7ece3cd24fb6dcc4e0,8/31(日) 5:00
2025-08-31,08:06,domestic,国内,2,日刊スポーツ,「８歳に発情する49歳なんてどう考えても異常。世の中には鬼畜がいる」アイドルが私見,https://news.yahoo.co.jp/articles/b91e4d49cb20804f1548f71b074a98b5e25bf82e,8/30(土) 14:40
2025-08-31,08:06,domestic,国内,3,CBCテレビ,「元の体に戻りたい」 新型コロナワクチン後遺症に悩む患者たち  救済進まずかさむ医療負担,https://news.yahoo.co.jp/articles/bd45dae5425dbbb7aced4ed2160d3da557777977,8/30(土) 14:02
2025-08-31,08:06,domestic,国内,4,日刊スポーツ,斎藤元彦知事、万博会場で怒号「辞めろ！」にのけ反る　兵庫県舞台の映画舞台あいさつに登壇,https://news.yahoo.co.jp/articles/8071dbe88b8564775402e0b61eff64fb287c254e,8/30(土) 18:34
2025-08-31,08:06,domestic,国内,5,読売新聞オンライン,道央道を運転していた男性「目の前にクマが立っており、はねた」…衝突したヒグマ死ぬ,https://news.yahoo.co.jp/articles/19d8c99337cf20145ef5b0c998ac361ec1b5f83a,8/30(土) 23:17
2025-08-31,08:06,domestic,国内,6,共同通信,【独自】生活保護申請時に財布の中身確認　三重県鈴鹿市、1円単位で,https://news.yahoo.co.jp/articles/7d1fd5f9da5e83b022248f5d22e6e0e21cfb8968,8/30(土) 21:00
2025-08-31,08:06,domestic,国内,7,日刊スポーツ,「再生の道」代表退任の石丸伸二氏「石丸さんいないなら辞めますという人は政治家に向いてない」,https://news.yahoo.co.jp/articles/a76e6d2ac70a405eeeacf9cf4f7cf079370b6029,8/31(日) 5:00
2025-08-31,08:06,domestic,国内,8,西日本新聞,スーパーは閉まり、ファミレスも撤退した「消滅可能性都市」…定住奨励100万円や保育料無償化は子育て世帯に刺さるか,https://news.yahoo.co.jp/articles/eeea495f2d8cc94696024c834c6a99673b3c03ee,8/30(土) 14:00
2025-08-31,08:06,domestic,国内,9,デイリースポーツ,橋下徹氏　学歴疑惑の田久保市長が「勝つかもわからない」→兵庫斎藤知事のように失職を選び市長選となった場合,https://news.yahoo.co.jp/articles/5a98fc2a57d2580d6bb692aa337f762259f46bff,8/30(土) 12:26
2025-08-31,08:06,domestic,国内,10,弁護士JPニュース,“年金”で生活できず「生活保護」に頼った高齢者たちの“後悔”…日本の“老後生活”は「情報戦サバイバル」に？,https://news.yahoo.co.jp/articles/b4166e854d5a29ecf57f9c172068076f82b1f8b4,8/25(月) 10:00
2025-08-31,08:06,domestic,国内,11,産経新聞,「あしき前例に」「責務歪める」…自民総裁選「賛成なら政務三役辞任」論に若手・中堅異論,https://news.yahoo.co.jp/articles/a8d6d7e7b541c1d42c5fa2d34a48af6e6323f8ec,8/31(日) 7:00
2025-08-31,08:06,domestic,国内,12,弁護士JPニュース,斎藤知事「公職選挙法違反」が“セーフ”でも、今度は「政治資金規正法違反」で“詰み”？　神戸地検から聴取…罪に問われる可能性は【選挙法務のプロが解説】,https://news.yahoo.co.jp/articles/343e01c49f036f855953ba1b2fed212ad7ed6838,8/30(土) 10:40
2025-08-31,08:06,domestic,国内,13,TBS NEWS DIG Powered by JNN,妊婦の死亡事故「胎児も被害者と認めて」赤ちゃんに重い障害が…父親の訴えを阻む“刑法の壁”【報道特集】,https://news.yahoo.co.jp/articles/689ffa9bb6b6b9b7e1192e23f6434a0742505d2e,8/30(土) 20:45
2025-08-31,08:06,domestic,国内,14,FNNプライムオンライン,「ひたすら迷惑…」　人気の「伊根の舟屋」京都北部の町で住民疲弊　ポイ捨てに私有地侵入、無断トイレ使用まで…観光と住民の平穏は共存なるか,https://news.yahoo.co.jp/articles/6ed894f17462f91a584917f8bc1b0be91c1c1f17,8/30(土) 5:03
2025-08-31,08:06,domestic,国内,15,朝日新聞,娘が不登校、「教育者の子なのに」　言語学者が打ち明けた動揺と転機,https://news.yahoo.co.jp/articles/b0d0922430533ea7fc5148db3ec6879118a295b0,8/27(水) 6:00
2025-08-31,08:06,domestic,国内,16,毎日新聞,北海道・滝川の高速道路で車とクマが接触　けが人なし、クマは死ぬ,https://news.yahoo.co.jp/articles/b7bfed90429f94c5627fe316307c4e6ff8ad1298,8/30(土) 22:40
2025-08-31,08:06,domestic,国内,17,朝日新聞,鈴木のりたけさん、子ども3人が不登校　ハッピーな気持ちになるまで,https://news.yahoo.co.jp/articles/a02891bb851f152956643ee05eb5ee84fc21e746,8/30(土) 15:00
2025-08-31,08:06,domestic,国内,18,中日スポーツ,ロシア・プーチン大統領、『歴史問題で日本名指し非難』報道にネット猛反発「歪曲しているのはどっちだ！！」「おまいう」,https://news.yahoo.co.jp/articles/f41d29f5217ff3f9d5871822730edbd7f41a4d47,8/30(土) 19:36
2025-08-31,08:06,domestic,国内,19,日刊スポーツ,中林美恵子教授サラリと告白　日米交渉キーマンと「今週ご一緒した」…赤沢大臣は会えないけど…,https://news.yahoo.co.jp/articles/4b8773789657546c2e4763f5e7dd493153845640,8/31(日) 6:00
2025-08-31,08:06,domestic,国内,20,tenki.jp,9月は猛暑でスタート　関東で40℃に迫る所も　台風のたまごにも注意　2週間天気,https://news.yahoo.co.jp/articles/b7f0b6980c465d0a896c172d71a396b5601a8b89,8/31(日) 7:21
2025-08-31,08:06,domestic,国内,21,読売新聞オンライン,中学で「起立性調節障害」発症、芸能活動を始めクラスでいじめも…みりちゃむ救った“居場所”とは　#しんどい君へ,https://news.yahoo.co.jp/articles/63aecb1ef82ecb0568f57180c9f24d37f9e07f9f,8/30(土) 17:01
2025-08-31,08:06,domestic,国内,22,スポニチアネックス,なぜ?いつまで?　8月末に異例の、災害級の酷暑　東京都心でも今年最高の38・5度,https://news.yahoo.co.jp/articles/9c8c4ab0182658769a7c86404ee8d9eccc64528a,8/31(日) 5:30
2025-08-31,08:06,domestic,国内,23,日刊スポーツ,橋下徹氏、江藤前農相の“コメ対策”新組織のトップ就任「いいやり方なんですよ」,https://news.yahoo.co.jp/articles/18165c6ba33494f11c12f6cbe51527e56ee275e2,8/30(土) 16:48
2025-08-31,08:06,domestic,国内,24,日刊スポーツ,「担当者は更迭すべき」「もしSNSなければ…」著名人も多数反応　アフリカ・ホームタウン騒動,https://news.yahoo.co.jp/articles/857bf6ca78757bfb957ff512319c0595b5d8cfc9,8/31(日) 6:10
2025-08-31,08:06,domestic,国内,25,日刊スポーツ,石原伸晃氏「怖かった」自民党幹事長の名を告白「森山さんよりもっと怖いよ。ビクビクした」,https://news.yahoo.co.jp/articles/1bbf4b9f06054c84621eac27fc1bade91df4e357,8/30(土) 12:18
2025-08-31,08:06,domestic,国内,26,TBS NEWS DIG Powered by JNN,【解説】40年ぶり「成年式」とは?　秋篠宮家の悠仁さま　6mの装束・馬車・特別な冠・・・知られざる世界,https://news.yahoo.co.jp/articles/2d50dd414024196b49cb45128e236a1d1e784310,8/31(日) 7:01
2025-08-31,08:06,domestic,国内,27,デイリースポーツ,自民　耳疑う人物を新組織トップに起用→ズレすぎ批判殺到　「ひるおび」１万人アンケで→前代未聞の賛成意見ゼロ　司会の八代弁護士、偏向と誤解されかねないとお断り,https://news.yahoo.co.jp/articles/9ffd6cb34d6ff41f68f07ec907e53015b2072218,8/29(金) 19:53
2025-08-31,08:06,domestic,国内,28,ウェザーマップ,8月終盤の異例の酷暑　最終日も収まらず　東海や近畿中心に危険な暑さで名古屋40℃予想,https://news.yahoo.co.jp/articles/36b47b496bc36a22f9ea904b78f3947521620272,8/31(日) 6:30
2025-08-31,08:06,domestic,国内,29,産経新聞,米空軍嘉手納基地に侵入した中国人を逮捕　沖縄県警沖縄署、米空軍憲兵隊からの通報で発覚,https://news.yahoo.co.jp/articles/3f4afe74c6f26b9f431435640f5747391f3be471,8/31(日) 0:33
2025-08-31,08:06,domestic,国内,30,CBCテレビ,豊田本町駅構内で人身事故 71歳女性が死亡 名鉄常滑線 神宮前〜大江 約1時間半にわたって運転見合わせ,https://news.yahoo.co.jp/articles/5d978f9862f6898ea66fa79f3aa8c5905448b7c8,8/31(日) 0:03
2025-08-31,08:06,domestic,国内,31,時事通信,落とし物、無駄にしない　ブランド品や希少カードも　遺失物センターが一括売却・警視庁,https://news.yahoo.co.jp/articles/0ddaf02e6e59ec9e18aabf3f2d4736546ec10aee,8/31(日) 7:01
2025-08-31,08:06,domestic,国内,32,日刊スポーツ,大阪・関西万博の公式サイト「安全確保できる環境ではありません」早朝の入場待ち自粛を呼びかけ,https://news.yahoo.co.jp/articles/86e1201dc4a9a304ed1b8655ae0a51668e199d11,8/30(土) 11:36
2025-08-31,08:06,domestic,国内,33,デイリースポーツ,石破首相は「元々揉め事から逃げようとする性格」「ドタキャン３回」参院選で落選の『ヒゲの隊長』過去引き合いに怒り収まらず,https://news.yahoo.co.jp/articles/db473063cf001b227fb4d473548935de8c13c419,8/30(土) 15:13
2025-08-31,08:06,domestic,国内,34,弁護士JPニュース,「クルド人みんなが全員悪いと思わないでほしい」　友人も“強制送還”に…在日クルド人高校生が抱く思いとは,https://news.yahoo.co.jp/articles/e3055f794ab7df1a71b057042931d09107633b2a,8/27(水) 10:00
2025-08-31,08:06,domestic,国内,35,読売新聞オンライン,盲導犬になるために別れてウルウル、２か月後に「繁殖犬」として帰ってきてくれるなんて…小林まさみさん,https://news.yahoo.co.jp/articles/d406c5f5d043a61f62bce981f8872196100f6ce3,8/30(土) 14:00
2025-08-31,08:06,domestic,国内,36,Yahoo!ニュース オリジナル 特集,ハワイの別荘、推し活に散財……夏休みのSNSに表れる経済格差、女子学生たちはどう向き合う？ #今つらいあなたへ #SNSの功罪,https://news.yahoo.co.jp/articles/9d22187f30bf1bb58133b37a3739ba6c425bcbdb,8/28(木) 14:56
2025-08-31,08:06,domestic,国内,37,日刊スポーツ,ひろゆき氏、石丸伸二氏代表退任後の「再生の道」は「駄目じゃないですか？」即答、理由も説明,https://news.yahoo.co.jp/articles/eb832ce73d1f282fd19035679a83870cf5123475,8/28(木) 9:36
2025-08-31,08:06,domestic,国内,38,FNNプライムオンライン（フジテレビ系）,愛子さま担当職員2名増員要求　宮内庁が来年度予算にインスタなど広報費約5300万円計上もティアラ製作は見送り…概算要求で,https://news.yahoo.co.jp/articles/b01576c71abe7bb7bf6da09b4684eb6c535e085d,8/29(金) 18:01
2025-08-31,08:06,domestic,国内,39,CBCテレビ,自転車を引いて車道を歩いていたとみられる82歳男性 車にはねられ死亡 事故現場は緩やかなカーブで街灯ほとんどなし 愛知・岡崎市,https://news.yahoo.co.jp/articles/88227d86fd0a10f89087fceab799df004767482f,8/31(日) 7:37
2025-08-31,08:06,domestic,国内,40,withnews,「どれほどつらいか、ぼくにはわかる」日本語がわからないまま学校へ　外国ルーツの子〝支援する〟側へ,https://news.yahoo.co.jp/articles/ff85f96273a587b97cd88836900391083bb7d4cc,8/31(日) 7:00
