scrp_date,scrp_time,genre_en,genre_jp,rank,media_jp,title,link,date_original
2024-09-03,13:07,domestic,国内,1,MBSニュース,“米が買えない”で注目される国の『備蓄米』って何？常に100万トン備えるも政府が放出に慎重なのには理由が【令和の米騒動】,https://news.yahoo.co.jp/articles/35248a2ccc612183cae522e843cdb7d02aa0fd46,9/3(火) 10:20
2024-09-03,13:07,domestic,国内,2,FNNプライムオンライン,【独自】ディズニー新グッズ求め約80人の集団“転売ヤー”が並ばず悪質“横入り”…フリマサイトで2倍の価格で“転売”か　ファン憤り,https://news.yahoo.co.jp/articles/d1c6ebf251dd4770956c96e33943ac2ff37178d1,9/3(火) 7:13
2024-09-03,13:07,domestic,国内,3,読売新聞オンライン,中国製たばこか、長崎・熊本・鹿児島の海岸に大量漂着…市民団体回収も「拾っても拾っても出てくる」,https://news.yahoo.co.jp/articles/534e9fee23c6de97cb53572fb56dc96c10b8dec6,9/3(火) 8:59
2024-09-03,13:07,domestic,国内,4,読売新聞オンライン,ルイ・ヴィトンが茨城県内撤退へ…唯一の直営店がある水戸京成百貨店から、１２月２５日を最後に,https://news.yahoo.co.jp/articles/52c180cf401b87af69ec8a107686dbafdfde8fff,9/3(火) 9:09
2024-09-03,13:07,domestic,国内,5,tenki.jp,熱帯低気圧が次々発生　台風に発達して日本へ影響も　2週間天気,https://news.yahoo.co.jp/articles/2ca6e5f161de5eab736136ed8f970d3eb3c6d512,9/3(火) 11:40
2024-09-03,13:07,domestic,国内,6,デイリースポーツ,麻生太郎氏が影響力失墜の危機説「絶対乗れない総裁候補２人」の実名　岩田明子氏が指摘　敵２人の決戦投票なら→非主流転落ピンチ,https://news.yahoo.co.jp/articles/11d48a308447878beb9f59aed5c9480acce72ab6,9/2(月) 20:52
2024-09-03,13:07,domestic,国内,7,読売新聞オンライン,「知事説明責任果たして」神戸商議所会頭…県全体の影響懸念,https://news.yahoo.co.jp/articles/d84758ed0c62c1202717139bf9043ebf218a2426,9/3(火) 11:32
2024-09-03,13:07,domestic,国内,8,日刊スポーツ,菊間千乃氏「相当悪質だ」兵庫県による元局長の私的情報漏えい疑惑「事実ならちょっとひどい」,https://news.yahoo.co.jp/articles/7944972c00af37c6d4b0d96da2cc5faae679f087,9/3(火) 12:31
2024-09-03,13:07,domestic,国内,9,日刊スポーツ,玉川徹氏、斎藤元彦知事による深夜の県職員叱責「時代からズレている人に知事の資質あるのか」,https://news.yahoo.co.jp/articles/c9d77c0c972feee6e7a706795a477a7005ca32d5,9/3(火) 12:04
2024-09-03,13:07,domestic,国内,10,読売新聞オンライン,「やることが多すぎる。誰も気づいてくれない」遺書記した福岡県職員の自殺、5800万円支払いで和解,https://news.yahoo.co.jp/articles/73a417952450db42dc9a6196f2861fe467ddb918,9/3(火) 11:45
2024-09-03,13:07,domestic,国内,11,読売新聞オンライン,香川の住宅で８３歳男性と５歳ひ孫が死亡、警察は殺人事件で捜査…男性が関与の可能性,https://news.yahoo.co.jp/articles/6822c21a3ed616c42dd10a00410808a4bcdb6843,9/3(火) 7:48
2024-09-03,13:07,domestic,国内,12,産経新聞,自民・小林鷹之氏が麻生太郎氏と面会　自民総裁選「大いに頑張れ」と激励,https://news.yahoo.co.jp/articles/696fccedd6202cc4c3d63955397de4835195aca2,9/3(火) 11:41
2024-09-03,13:07,domestic,国内,13,時事通信,日産販売店に賠償命令、確定　「フーガ」不具合で520万円　最高裁,https://news.yahoo.co.jp/articles/fb0302d2b5b73e179b25b2874a9cbc4949d1440a,9/2(月) 19:58
2024-09-03,13:07,domestic,国内,14,東海テレビ,未明の交差点でバイクの17歳高校生が車にはねられ意識不明の重体 67歳男を現行犯逮捕 どちらかが信号無視か,https://news.yahoo.co.jp/articles/598631fbc07aecd2424ef9e48f5c73d41799841e,9/3(火) 11:25
2024-09-03,13:07,domestic,国内,15,読売新聞オンライン,家系図作るため戸籍を不正閲覧、履歴を残さないようにしていたが…上司の支所長が不審な行動に気づく,https://news.yahoo.co.jp/articles/ff2939e89c434807ea085d2507750b25c6337d6b,9/3(火) 11:25
2024-09-03,13:07,domestic,国内,16,TBS NEWS DIG Powered by JNN,千葉県内で大雨　千葉市緑区では土砂崩れ　車線規制して復旧作業中,https://news.yahoo.co.jp/articles/b7cb4d5511444f421a523c0f4188af3cb07a435a,9/3(火) 9:32
2024-09-03,13:07,domestic,国内,17,CBCテレビ,【台風情報】台風11号の後は… 日本の南に“台風の卵”　海面水温高いため“台風”に発達する可能性も,https://news.yahoo.co.jp/articles/ccde22102eec0b3b1a2c590cf887ea0b69f8473b,9/3(火) 12:09
2024-09-03,13:07,domestic,国内,18,ねとらぼ,「これはすごい」　三笠宮家・彬子さまの記事が無料で読めると話題　父・“ひげの殿下”の回も……　「読んでみたいです」の声,https://news.yahoo.co.jp/articles/5d908dfe36c60fb0bdb103d5aebe38fb155febfa,9/3(火) 11:55
2024-09-03,13:07,domestic,国内,19,FNNプライムオンライン,「知事出席で危険生じる可能性」　施設側からお断り　斎藤知事“肝入り”のイベント　知事の出席見送りへ,https://news.yahoo.co.jp/articles/d26b936ff8baed98d3c3eadb5529d5953a2032db,9/2(月) 16:32
2024-09-03,13:07,domestic,国内,20,tenki.jp,台風発生が続く可能性　11号に続き　新たな熱帯低気圧が発生か　9月は台風シーズン,https://news.yahoo.co.jp/articles/3972ea91ed3ee7a116e39f7cc648f438d4e7ccfa,9/2(月) 13:24
2024-09-03,13:07,domestic,国内,21,FNNプライムオンライン（フジテレビ系）,「顔も見たくないぐらいの恩讐あっても…」野田元首相が小沢氏の立憲代表選支持「重く受け止める」,https://news.yahoo.co.jp/articles/db051112d0426e3aa0a094bf44a1ac14f7e76819,9/3(火) 11:43
2024-09-03,13:07,domestic,国内,22,ABEMA TIMES,河野太郎氏「効率が上がらない企業は終わりにする」「働いている人は保証」 政治ジャーナリスト「血を見る改革。議員票が取れるか心配」,https://news.yahoo.co.jp/articles/87f5ab45a070d2f3dafd5586af14dc42bcc611db,9/2(月) 6:51
2024-09-03,13:07,domestic,国内,23,読売新聞オンライン,闇バイトの求人巧妙化、SNS投稿見分けつかず…「電話受付のお仕事」「学生可能、全国対応」,https://news.yahoo.co.jp/articles/89414d589052f84380ec045cb86b4726d8b8eb49,9/2(月) 16:31
2024-09-03,13:07,domestic,国内,24,日本ファクトチェックセンター,小泉進次郎氏が「これにお金を払ったらただで貰えました」などと発言？　大喜利サイトの書き込みが拡散【ファクトチェック】,https://news.yahoo.co.jp/articles/c53e3ac6927f65ea1ee3ab2e674cc77e05f87618,9/3(火) 8:02
2024-09-03,13:07,domestic,国内,25,FNNプライムオンライン,肩ぶつかりトラブルに…男性の顔を傘で突き刺す　自称・会社員の坂田一樹容疑者を逮捕　神奈川・JR茅ケ崎駅前,https://news.yahoo.co.jp/articles/9bf3b4528c004dfbf495acfd307c4609110d0f13,9/3(火) 12:22
2024-09-03,13:07,domestic,国内,26,朝日新聞デジタル,広島で被爆死の米兵「12人」　76年前の米公文書の存在が明らかに,https://news.yahoo.co.jp/articles/2f2d58af7c469ecc428a1231b3a19cb11928aa64,9/3(火) 12:00
2024-09-03,13:07,domestic,国内,27,毎日新聞,石破氏「実行したい」、小林氏「賛同しない」　金融所得課税でバトル,https://news.yahoo.co.jp/articles/b3129333ae788aafaecb2bb331b2a2cb9b9e27f3,9/3(火) 12:22
2024-09-03,13:07,domestic,国内,28,ABEMA TIMES,藤井聡太竜王・名人も思わずアワアワ！？ジャケット脱衣から盤側アイテムが舞台落下のプチハプニング 視聴者も「めずらしいｗ」/将棋・ABEMAトーナメント2024,https://news.yahoo.co.jp/articles/ea9483bb35458f7c8ef00c08ad4d5cd40630bcf8,9/3(火) 12:02
2024-09-03,13:07,domestic,国内,29,デイリースポーツ,田崎史郎氏　総裁候補に総理大臣に向かない「単なる理想主義者」がいる　名前当てられ「そうかも」　実現できない事を唱えてる,https://news.yahoo.co.jp/articles/29462815f3a8632500aeb592b44333c8b01b9ef0,9/2(月) 18:58
2024-09-03,13:07,domestic,国内,30,読売新聞オンライン,屋久島の「弥生杉」、台風１０号で倒れる…「縄文杉」へのルート近くでは土砂崩れ,https://news.yahoo.co.jp/articles/fa5ecd5164776118356856fe8524e2edac55e812,9/2(月) 23:34
2024-09-03,13:07,domestic,国内,31,SlowNews／スローニュース,マスコミが報じなかった和歌山毒物カレー事件の冤罪検証 〝毒婦 林眞須美〟の真相に迫る「マミー」で明かされる26 年目の衝撃,https://news.yahoo.co.jp/articles/1c7110815e8ee8e587f2db311b32246300b36ae8,9/3(火) 12:05
2024-09-03,13:07,domestic,国内,32,tenki.jp,関東　局地的に活発な雨雲　明日4日にかけて激しい雨や雷雨　災害リスク高まる恐れ,https://news.yahoo.co.jp/articles/52b84e04042755ac43c1e9e3026935166fcfb606,9/3(火) 11:18
2024-09-03,13:07,domestic,国内,33,弁護士ドットコムニュース,フィリピンの刑務所から「脱出したい」、日本人逃亡犯が語る「獄中生活」の実態,https://news.yahoo.co.jp/articles/f856eb199ba7057f2d942c5221d071a542b39c67,8/31(土) 9:39
2024-09-03,13:07,domestic,国内,34,FNNプライムオンライン,「文化がつぶされていく」路上ライブの聖地・川崎で通報相次ぐ…市は「大目に見て」　「マカロニえんぴつ」など輩出,https://news.yahoo.co.jp/articles/5603507cb85b245b22da6eca1d3648b508b985f8,9/2(月) 19:22
2024-09-03,13:07,domestic,国内,35,毎日新聞,希望を持って生きる「新しい認知症観」　基本計画案を了承,https://news.yahoo.co.jp/articles/66f87a0a806f8e24321238e537f413e8ff3ad638,9/2(月) 15:27
2024-09-03,13:07,domestic,国内,36,共同通信,東宝チケットを不正転売疑い　夫婦で1千万円超売り上げか,https://news.yahoo.co.jp/articles/9d36c6f0acbb8e920ef65677df5c08201b512285,9/3(火) 12:36
2024-09-03,13:07,domestic,国内,37,朝日新聞デジタル,泉代表もまだ出馬表明できず　「土下座してでも、お願いすべきだ」,https://news.yahoo.co.jp/articles/923ae17c18f0c4f8287c801712d4a6d69a156d1c,9/3(火) 7:00
2024-09-03,13:07,domestic,国内,38,FNNプライムオンライン（フジテレビ系）,自民・小泉進次郎氏が金融所得課税の強化に「議論するタイミングでない」　石破茂氏は「実行したい」と前向き,https://news.yahoo.co.jp/articles/304e931500ac76dc4b2a8a34ab80d2dfd1dd68c9,9/3(火) 12:39
2024-09-03,13:07,domestic,国内,39,FNNプライムオンライン,山口組竹中正久4代目組長射殺で時効成立の指名手配の75歳の男逮捕　長崎・松浦市元市議への名誉毀損の疑い,https://news.yahoo.co.jp/articles/9a190cdce9ac9f163620515ffcae01df371e8957,9/3(火) 12:32
2024-09-03,13:07,domestic,国内,40,レスキューナウニュース,南海高野線で人身事故 一部運転見合わせ,https://news.yahoo.co.jp/articles/fb118a45b426ede5a956fcbe9ca114996f693c6f,9/3(火) 8:20
