scrp_date,scrp_time,genre_en,genre_jp,rank,media_jp,title,link,date_original
2024-03-08,10:11,local,地域,1,ABCニュース,勤務時間中に昼食用弁当をレンジでチン　大阪市水道局が６０代男性職員を処分　約１年間で１８８回　「お弁当を温めている」と内部通報あり調査,https://news.yahoo.co.jp/articles/c188a74e6ba505b2722eff519902070469fa4735,3/7(木) 21:11
2024-03-08,10:11,local,地域,2,ＫＲＹ山口放送,【続報】山陽新幹線新岩国駅で列車と客が接触する事故…運転見合わせ区間拡大・運転取り止めも…,https://news.yahoo.co.jp/articles/8505f2d6f206e67d5dd32b65c6ae0a8c29edd079,3/8(金) 7:53
2024-03-08,10:11,local,地域,3,MBSニュース,【速報】「女子中学生らが男子大学生から金品奪おうとして…」結果、逃げた大学生が転落死　中学生ら強盗致死容疑で逮捕　美人局の可能性も視野,https://news.yahoo.co.jp/articles/66a10ca5094d8eb7a5837cbd25349c842db409c7,3/7(木) 10:02
2024-03-08,10:11,local,地域,4,FNNプライムオンライン（フジテレビ系）,茨城・坂東市の死亡ひき逃げ事件で26歳女を逮捕　防犯カメラに映った車を特定,https://news.yahoo.co.jp/articles/c0de490457d1278dd16b560b077cab10a5c21d24,3/8(金) 3:27
2024-03-08,10:11,local,地域,5,読売テレビ,勤務時間に弁当温め…終業30分前にPCの電源落とし5分前に帰宅準備繰り返す　大阪市職員を処分,https://news.yahoo.co.jp/articles/1415d2a46978390d38d564214c1a16fccec63e01,3/7(木) 17:08
2024-03-08,10:11,local,地域,6,河北新報,仙台・母子心中　遺族提出の手紙を廃棄か　市教委「存在を知らなかった」,https://news.yahoo.co.jp/articles/18a78d9eabd60caef8f143aef1a0818317ff9790,3/8(金) 9:12
2024-03-08,10:11,local,地域,7,RKB毎日放送,山陽新幹線が人身事故で新大阪～小倉で運転見合わせ、博多～鹿児島中央で遅延も,https://news.yahoo.co.jp/articles/7a40b30185447f1254b479bf450d6d5f7d19e802,3/8(金) 9:13
2024-03-08,10:11,local,地域,8,静岡放送（SBS）,8日未明、静岡県で最大震度2の地震　相模湾震源（3月8日午前2時58分の地震）,https://news.yahoo.co.jp/articles/274264b30fbe8c6639af8ea912d46ad4a80287ed,3/8(金) 7:48
2024-03-08,10:11,local,地域,9,MBSニュース,検索履歴は「溺死　殺人」「完全犯罪　海水浴」水難事故に見せかけて妻殺害の罪に問われた男　大阪高裁の判決を不服として最高裁へ上告　和歌山・白浜町,https://news.yahoo.co.jp/articles/8e355f51b3a8f03e3a65509cbe8648f8ebd43925,3/8(金) 6:32
2024-03-08,10:11,local,地域,10,神戸新聞NEXT,ローン残った重機を中古車買い取り業者に転売　詐欺容疑で解体業の男を逮捕　所有者が付けたGPSで発覚,https://news.yahoo.co.jp/articles/383694d64685c3463b27fd7d03bb4f33e8a32bb9,3/8(金) 9:08
2024-03-08,10:11,local,地域,11,HBCニュース北海道,もめごとの話し合いに入ったホテルで…「暴力を振るわれた」37歳女性が蹴られ内臓損傷のけが　37歳の会社役員の男を逮捕,https://news.yahoo.co.jp/articles/5663a32c7234bdbf8f5e671e89e140efe2789d66,3/8(金) 9:04
2024-03-08,10:11,local,地域,12,静岡朝日テレビ,缶ビールを床に落としたのがきっかけで…ペルー人の64歳女を暴行容疑で逮捕　浜松市,https://news.yahoo.co.jp/articles/de068a2a92d6cdd788453750bc07762fe6fc15ba,3/8(金) 8:54
2024-03-08,10:11,local,地域,13,宮崎日日新聞,「ボウフラが集まったような腐った組織」延岡市長、職員不祥事巡り発言,https://news.yahoo.co.jp/articles/8d0c16fdbfea0949f57e7e7d4f35b66d2c4e7b7a,3/8(金) 9:39
2024-03-08,10:11,local,地域,14,南日本新聞,鹿児島県職員、6割超が定年延長せず60歳で「自己都合退職」見込み　人事課「再就職先のめどついているのでは」,https://news.yahoo.co.jp/articles/36a3bb26748cf322fb1750e2532d0fbcc37df4b8,3/7(木) 7:20
2024-03-08,10:11,local,地域,15,ABCニュース,「子どもを蹴らせろ」「フォークで目刺させろや」飲食店でベビーカーに足が当たり因縁　男性客から１２０万円恐喝した疑い　２０代夫婦を逮捕　奈良・田原本町,https://news.yahoo.co.jp/articles/9836e8b378b6a0606a56a57afb1e86cb3906594c,3/6(水) 16:29
2024-03-08,10:11,local,地域,16,伊勢新聞,月124時間、違法残業させた疑い　津の運送会社を書類送検　三重・四日市労基署,https://news.yahoo.co.jp/articles/a026cd56fe203c085f938590047b6a087ef5a47b,3/8(金) 8:00
2024-03-08,10:11,local,地域,17,茨城新聞クロスアイ,シンドウ、自己破産申請へ　負債5億円　茨城・かすみがうら,https://news.yahoo.co.jp/articles/6a2742082c4dd934fac8f4a28420dd559da37a26,3/7(木) 21:00
2024-03-08,10:11,local,地域,18,ＫＲＹ山口放送,【続報】運転再開見込みは午前10時半ころ…「のぞみ4号」が新岩国駅の線路内で人と接触…山陽新幹線が新大阪-小倉間で運転見合わせ,https://news.yahoo.co.jp/articles/9ab6834462a629430b5d73dc455ea55595963c73,3/8(金) 9:05
2024-03-08,10:11,local,地域,19,新潟ニュースNST,ペーパーレス化が進み業績悪化…老舗業者“石井商店”自己破産申請 負債額約2億9000万円【新潟市】,https://news.yahoo.co.jp/articles/d41d4bbbd678a93d112c70d68acb199e83a6293a,3/7(木) 17:50
2024-03-08,10:11,local,地域,20,RKB毎日放送,「女性の下着の写真を撮りたかった」韓国人観光客のスカート内をデジカメで盗撮した疑い　無職の44歳男を逮捕,https://news.yahoo.co.jp/articles/65ba69972a3af1290e4341a4f7830cf53171b892,3/8(金) 7:24
2024-03-08,10:11,local,地域,21,読売テレビ,【速報】元タカラジェンヌを逮捕　知人から2000万円詐取した疑い　宝塚OGのイベントの企画演出も,https://news.yahoo.co.jp/articles/9a4a3caa7b4ca9bd90f3a229ee09eacfb77a1dad,3/7(木) 18:46
2024-03-08,10:11,local,地域,22,HBCニュース北海道,アパート住人とトラブル「男が恫喝している」仲裁に入った管理会社の男性に唾を吐きかけた疑い　41歳の男「ただくしゃみをしただけ」,https://news.yahoo.co.jp/articles/239b9b5ef1a4e4f94673fe9991b75a73589d5a55,3/8(金) 9:31
2024-03-08,10:11,local,地域,23,東海テレビ,老舗が“八丁味噌”の名称を自由に使えなくなる…ブランド登録巡る訴訟 愛知県岡崎市の「まるや」敗訴確定,https://news.yahoo.co.jp/articles/f93e05bd10ca3c53c0b6b0303ee1006baa4b216e,3/8(金) 6:40
2024-03-08,10:11,local,地域,24,ｔｙｓテレビ山口,「大きな音がして」住宅解体工事中ブロック塀の下敷きに　作業員男性（53）が死亡　山口県宇部市,https://news.yahoo.co.jp/articles/bbe3d1a07b1b784ca0b014d19dda7934ddbb5356,3/8(金) 7:44
2024-03-08,10:11,local,地域,25,岐阜新聞Ｗｅｂ,はしか岐阜県内で確認、渡航歴ある５０代女性が飛行機内感染か　１９年以来,https://news.yahoo.co.jp/articles/36dc25b5bbf8488ab6e3113cdc7ddac2a2b1e3c7,3/8(金) 7:37
2024-03-08,10:11,local,地域,26,中京テレビＮＥＷＳ,女性従業員6人に対し賃金未払いか　最低賃金法違反の疑いで業者と代表を書類送検　従業員が労働基準監督署に申告し発覚　岐阜,https://news.yahoo.co.jp/articles/42c44771a2b399ae29ae4e626bc078851de71aae,3/7(木) 18:54
2024-03-08,10:11,local,地域,27,tbc東北放送,ぴろんと伸びた鼻毛「むやみに抜いちゃダメ」医師が指摘する深いワケとは　,https://news.yahoo.co.jp/articles/dbfde61c967fafbc2e33f73d4c6887aa0c6cc765,3/5(火) 20:01
2024-03-08,10:11,local,地域,28,STVニュース北海道,子会社の男性にスタンガンを押し当て脅迫か「電話番号を教えろ」と憤慨 74歳の社長の男を逮捕,https://news.yahoo.co.jp/articles/ef242cd6ee1e804ecb7fa4b264896339dffb55a4,3/8(金) 4:55
2024-03-08,10:11,local,地域,29,千葉日報オンライン,3億円物件も、千葉三越跡にタワマン　23階建て80メートル、第1期分90戸の販売へ　千葉市中央区,https://news.yahoo.co.jp/articles/bcd4d28275ed9f3c9b46219168fce0056ceab72b,3/8(金) 7:07
2024-03-08,10:11,local,地域,30,ＢＳＮ新潟放送,バックカントリーのスノーボーダーが遭難　ヘリによる救助実施（新潟・午前8時半現在）,https://news.yahoo.co.jp/articles/d1b9a7a26e8c7d033972a84bf4d7b8c2af3889e2,3/8(金) 8:39
2024-03-08,10:11,local,地域,31,山陰中央新報,島根県、７６０万円の債権放棄　石州瓦製造、販売のセラミカ破綻を受け,https://news.yahoo.co.jp/articles/41af52e31ba352c5ed034c74a78cd5d26b560626,3/8(金) 7:00
2024-03-08,10:11,local,地域,32,南日本新聞,諏訪之瀬島で爆発2回、大きな噴石が400ｍ飛ぶ　噴煙は700ｍまで上がる,https://news.yahoo.co.jp/articles/52b6c043f92248be40adca0ce12c286c29b3a9db,3/8(金) 8:30
2024-03-08,10:11,local,地域,33,茨城新聞クロスアイ,ダンプ3000台分の残土、無許可で埋め立て　茨城・鹿嶋の空き地　容疑の男逮捕　県警,https://news.yahoo.co.jp/articles/57780895b6ca67066efbee11708fb5115df260ca,3/7(木) 19:29
2024-03-08,10:11,local,地域,34,中国新聞デジタル,テックコーポレーションが自己破産申請へ　負債150億円、従業員110人は解雇　広島市の環境機器開発販売,https://news.yahoo.co.jp/articles/b8a1754d06e3ad5ef5825aa995f7ec92a8206e7d,3/7(木) 11:05
2024-03-08,10:11,local,地域,35,河北新報,「スーパー銭湯」戦国時代　仙台で新設改装相次ぐ　サウナブームが追い風に,https://news.yahoo.co.jp/articles/2d58b101533d628b9e502e6650483cd3b564f3b2,3/8(金) 9:10
2024-03-08,10:11,local,地域,36,ＳＢＣ信越放送,県内は9日から大雪のおそれ　北部の多いところで30センチ～50センチの予想降雪量,https://news.yahoo.co.jp/articles/2da13e9d1fd5531bdee5f48cb7eacb5f67acb4d9,3/8(金) 8:32
2024-03-08,10:11,local,地域,37,九州朝日放送,福岡市天神で韓国人観光客を”盗撮”　男を逮捕,https://news.yahoo.co.jp/articles/6835e5ed7c10a9da683dc22d76598f4a72f0884b,3/8(金) 9:00
2024-03-08,10:11,local,地域,38,千葉日報オンライン,千葉市美浜区でマンション火災　室内から救助された女性ら搬送,https://news.yahoo.co.jp/articles/ef652c378e36b12ebb4fe282afd24ccc46b0d7f5,3/8(金) 7:06
2024-03-08,10:11,local,地域,39,RCC中国放送,【速報】山陽新幹線　新大阪～小倉　順次運転見合わせ　新岩国駅で列車が利用客と接触,https://news.yahoo.co.jp/articles/0c063a2879fb1a101097107c3aee8a20570e76c6,3/8(金) 8:24
2024-03-08,10:11,local,地域,40,神戸新聞NEXT,88歳男性「アクセル踏み間違えた」　車が分離帯に衝突、同乗の81歳妻が骨折　神戸,https://news.yahoo.co.jp/articles/d9d81abf5e9cb1b42a733f55996297a033013008,3/7(木) 23:43
