scrp_date,scrp_time,genre_en,genre_jp,rank,media_jp,title,link,date_original
2025-09-24,19:08,sports,スポーツ,1,Full-Count,カーショー、ブルペン待機を直訴　総崩れの救援陣の救世主に…佐々木朗希とリレーも,https://news.yahoo.co.jp/articles/54dc193ab63d6f80ba526ac353f15739d77ff422,9/24(水) 14:11
2025-09-24,19:08,sports,スポーツ,2,Full-Count,ド軍スコットが「オオタニの好投を台無し」　絶望の“10”にLAメディア落胆「また…」,https://news.yahoo.co.jp/articles/7183f00e1e9f07770eed13740fe6dd961ed5d070,9/24(水) 13:40
2025-09-24,19:08,sports,スポーツ,3,スポニチアネックス,大谷翔平「最終的なステップを踏めた」PS目前で投手復帰後最長6回投げ無失点「チーム状況を加味」,https://news.yahoo.co.jp/articles/fcf0c08a16c3e6f6d30fc0ce56c9eeb716539ff7,9/24(水) 13:36
2025-09-24,19:08,sports,スポーツ,4,Full-Count,ロバーツ監督、スコットを痛烈批判「ビビっている」　サヨナラ負けに“怒り”「信念ない」,https://news.yahoo.co.jp/articles/83853200e0cd2ad1da423217a8faf7aed31d7e36,9/24(水) 14:26
2025-09-24,19:08,sports,スポーツ,5,デイリースポーツ,巨人　町田行彦さんが死去　９１歳　国鉄時代にセ・リーグ最年少で本塁打王を獲得　１軍コーチ、２軍監督などを歴任,https://news.yahoo.co.jp/articles/b3d1f8b90a50be891da9ba2b1aaac59dd63609ed,9/24(水) 17:07
2025-09-24,19:08,sports,スポーツ,6,Full-Count,美女の“ミニスカ”きつねが「破壊力ありすぎ」　反響止まず…ファン悶絶「流石に可愛すぎる」,https://news.yahoo.co.jp/articles/0281b0141efad5ad726aace0b94410a8121445aa,9/24(水) 16:16
2025-09-24,19:08,sports,スポーツ,7,CoCoKARAnext,分かっていても大谷翔平は「捕球が難しい」　ド軍若手捕手がマスク越しに見た“メジャー随一の才覚”「次にどう来るかは読めない」,https://news.yahoo.co.jp/articles/0a549f6f9986fe696a422e97081d85cf716cdf19,9/24(水) 16:30
2025-09-24,19:08,sports,スポーツ,8,スポーツ報知,両横綱はともに勝つ　豊昇龍が全勝、単独トップを堅持　大の里は１敗で追走　若隆景は６敗目で大関昇進は絶望的,https://news.yahoo.co.jp/articles/c165654846bc2cce07fa0de0c7d3e3fc48f87bf0,9/24(水) 17:56
2025-09-24,19:08,sports,スポーツ,9,スポーツ報知,大谷翔平に試合中におねだり　日本語で「バット、サインください」　ダイヤモンドバックス“大谷ファン”が告白,https://news.yahoo.co.jp/articles/96712e081fd46b5d25509d13e7807a2c12287ecd,9/24(水) 14:33
2025-09-24,19:08,sports,スポーツ,10,東スポWEB,佐々木朗希〝放出報道〟が拡大「ドジャースはブルペンとして契約したわけじゃない」,https://news.yahoo.co.jp/articles/5b39787ba085bb8172d8dd3ae63a9985f3bf6ccc,9/24(水) 17:55
2025-09-24,19:08,sports,スポーツ,11,東スポWEB,大谷翔平の勝ち消したスコットが大炎上「南極に追放だ」 ロバーツ監督も延焼「全て台なし」,https://news.yahoo.co.jp/articles/6e419cf103ac053447f8ca6e6a496d5a3135071b,9/24(水) 14:25
2025-09-24,19:08,sports,スポーツ,12,東スポWEB,【ＤｅＮＡ】バウアーが体調不良で二軍戦回避　２２日に大相撲観戦でファン呆れ「もういいよ」,https://news.yahoo.co.jp/articles/1c2fec189d55311e40099ce4f028f85097518642,9/24(水) 15:35
2025-09-24,19:08,sports,スポーツ,13,スポーツ報知,世界陸上の美女アスリートが「別人に」激変のモデル姿「わからなかった」「可愛すぎん？」中島ひとみが「スタイル抜群」,https://news.yahoo.co.jp/articles/483d8c02fc67073df77d5168ec940b529a5a214a,9/24(水) 11:55
2025-09-24,19:08,sports,スポーツ,14,中日スポーツ,”背信”スコット意気消沈「俺のせいだ」、ファンから痛烈批判…監督も苦言「失敗恐れている」、ブルペン”解体”で佐々木朗希、カーショーがブルペンへ,https://news.yahoo.co.jp/articles/44e176973b17a5f13de59a00462d1cb1ba80a0f0,9/24(水) 14:40
2025-09-24,19:08,sports,スポーツ,15,CoCoKARAnext,余裕なく問われる佐々木朗希の“成否”　大谷翔平の6回8Kの快投を台無しにしたド軍中継ぎ陣を米記者も糾弾「大事な場面で脆弱」,https://news.yahoo.co.jp/articles/b0dbf41654bc72c65fcffcebea0e8417b4c816ea,9/24(水) 16:00
2025-09-24,19:08,sports,スポーツ,16,デイリースポーツ,ドジャース悪夢の逆転サヨナラ負け　大谷翔平が４点差降板も２勝目消える　６回無失点の圧巻投球　直後にリリーフ陣が崩れる,https://news.yahoo.co.jp/articles/f9b62f860ad856a6d0196e257a56bcc0510e9af3,9/24(水) 13:18
2025-09-24,19:08,sports,スポーツ,17,Full-Count,「給料3倍上がりますね」　新庄監督が絶賛した28歳「いなかったらゾッとする」,https://news.yahoo.co.jp/articles/6504adf20729869abbf0515be155e3f0f4e36d81,9/24(水) 10:17
2025-09-24,19:08,sports,スポーツ,18,中日スポーツ,ドジャース緊急事態、ブルペン崩壊でカーショー救援へ…佐々木、シーハンと”急造”勝ちパターン構築か、監督はお決まりの炎上に苦言「失敗恐れている」,https://news.yahoo.co.jp/articles/51ea1e279d6a25019a4f26e30b59e50abc56d0cd,9/24(水) 14:23
2025-09-24,19:08,sports,スポーツ,19,CoCoKARAnext,「オオタニの素晴らしい投球があったにもかかわらず…」ド軍ブルペン陣“崩壊”　指揮官も指摘した惨敗に共通するテーマ,https://news.yahoo.co.jp/articles/b867726d1724b5aa2b39744dd7034cc6f1055c8e,9/24(水) 18:11
2025-09-24,19:08,sports,スポーツ,20,高校野球ドットコム,プロ10年目右腕が現役引退...今季の1軍登板はオープン戦でわずか1球のみ,https://news.yahoo.co.jp/articles/eee6f26e3014fd8c71256fbe19b565d3baa51e91,9/24(水) 14:01
2025-09-24,19:08,sports,スポーツ,21,中日スポーツ,広島・新井監督、助っ人・モンテロに1年待って打撃指導「映像を初めて見たときから」気になる動作「きょう初めて言った」,https://news.yahoo.co.jp/articles/01f97b6c42d9ac3e7282386c36a03c0b96a0ba1f,9/24(水) 17:50
2025-09-24,19:08,sports,スポーツ,22,デイリースポーツ,人気女子ゴルファー　雰囲気一変のオフショットに反響「私服オシャレ」「美！」今季６年ぶりツアー優勝,https://news.yahoo.co.jp/articles/3871f66428546f326890f8f8ee30ac184a5a1383,9/24(水) 15:24
2025-09-24,19:08,sports,スポーツ,23,Full-Count,6回0封の大谷翔平が「支配した」　米メディア称賛の嵐…“最終登板”に脱帽「またも印象的」,https://news.yahoo.co.jp/articles/94d768f4f759746ff63128be4fafeb43830b09f1,9/24(水) 12:42
2025-09-24,19:08,sports,スポーツ,24,日刊スポーツ,【陸上】世陸出場の中島ひとみ、ヘソ出しショット　競技姿とのギャップに「モデルとの二刀流」,https://news.yahoo.co.jp/articles/7b5b43157d3e9982c224aaf1d07c719a9db2cf2d,9/24(水) 13:09
2025-09-24,19:08,sports,スポーツ,25,CoCoKARAnext,角田裕毅、今季最高位の躍進を支えた「異例特訓」　レッドブル首脳陣も驚かせた“休暇返上の決意”「なぜあんなにも遅いのか」,https://news.yahoo.co.jp/articles/6721b4cec669dfffbd8a931d9c5908ef56e16140,9/24(水) 17:01
2025-09-24,19:08,sports,スポーツ,26,Full-Count,大谷翔平、乱調の救援陣かばう「苦しいと思うけど」　9回に2勝目消滅…敗戦に明かした心境,https://news.yahoo.co.jp/articles/e879b72a35c018f003e96e60bd906f781afcdc2a,9/24(水) 13:49
2025-09-24,19:08,sports,スポーツ,27,中日スポーツ,守護神カーショー誕生の可能性、ドジャースのブルペン崩壊…中継ぎ配置転換の佐々木朗希も勝ちパターン？大一番なら大谷＆山本のリリーフも,https://news.yahoo.co.jp/articles/7f420b319ac92090148352fe4b9a5ba8048c775c,9/24(水) 17:00
2025-09-24,19:08,sports,スポーツ,28,CBCテレビ,「それじゃ誤審も起きる…」NPBリプレー検証の驚きの実態。新設リプレーセンターで家庭用テレビでの判定に終止符か,https://news.yahoo.co.jp/articles/420b27237b117b16c126e9cd2669996caa964c28,9/24(水) 18:10
2025-09-24,19:08,sports,スポーツ,29,デイリースポーツ,「どうなってんねん」ドジャース悪夢にＳＮＳ反応「嫌な予感した」大谷翔平の２勝目が消滅　解説者は「心のケア必要」,https://news.yahoo.co.jp/articles/ebf293f1049579ff25423f3dbe450e30eca064db,9/24(水) 13:34
2025-09-24,19:08,sports,スポーツ,30,サンケイスポーツ,112億円男は失意のどん底「今夜で終わらせないと…」　スライダー一辺倒で指揮官苦言「頼りすぎ」「簡単に狙われる」,https://news.yahoo.co.jp/articles/3c64407161e6a741be696f00794c918ce21fa707,9/24(水) 14:44
2025-09-24,19:08,sports,スポーツ,31,スポニチアネックス,阪神・藤川監督が2軍戦を緊急視察　ポストシーズンに向けて若虎発掘を狙う,https://news.yahoo.co.jp/articles/b723e8c561da50861a00588d30b0f4fbd4e7c09d,9/24(水) 17:41
2025-09-24,19:08,sports,スポーツ,32,ゲキサカ,飛び級のJ1選手2名も選出! 国内キャンプに向けたU-17日本代表候補メンバー発表,https://news.yahoo.co.jp/articles/7eb42224255da1eb553fe77edc478d18d72b5b06,9/24(水) 17:16
2025-09-24,19:08,sports,スポーツ,33,デイリースポーツ,ドジャース　背信のスコット　静まりかえるクラブハウスで声を振り絞る「完全に自分の責任だ」「明日は新しいスタートを」,https://news.yahoo.co.jp/articles/68185454a742aa08d35cd9311f7eabd7327df960,9/24(水) 15:57
2025-09-24,19:08,sports,スポーツ,34,Full-Count,ド軍ブルペン、“不名誉記録”を更新中　140年以上の名門史で断トツ…目を疑う「304」,https://news.yahoo.co.jp/articles/0d0af17bacf24ed5cefc74c5a9e854eb3f89d35b,9/24(水) 17:17
2025-09-24,19:08,sports,スポーツ,35,デイリースポーツ,２勝目消滅の大谷翔平は救援陣をかばう「ブルペンのおかげで勝っている試合はいっぱいある」「みんなで頑張りたい」,https://news.yahoo.co.jp/articles/3e88e37e0736b6d2d2e88bbc4f80ae67386f770b,9/24(水) 13:50
2025-09-24,19:08,sports,スポーツ,36,スポニチアネックス,金村義明氏　阪神の2年ぶり日本一に立ちふさがる秋の強敵「この時期強いねん！」,https://news.yahoo.co.jp/articles/ee4785eac975a36555fd684031f67dd0bb07b795,9/24(水) 14:51
2025-09-24,19:08,sports,スポーツ,37,日刊スポーツ,大谷翔平は二刀流も不発、シュワバー54号でその差は…／MLB打撃上位一覧（米９月23日現在）,https://news.yahoo.co.jp/articles/fe7e53cfa19ff8e9eea945d0ab4fb72aba0e324e,9/24(水) 18:00
2025-09-24,19:08,sports,スポーツ,38,スポニチアネックス,佐々木朗希「本番を想定」あえて短い準備で救援登板　中継ぎは「難しさある。適性あるとは思わない」,https://news.yahoo.co.jp/articles/cfc704f6adb8e1149f1b4a8099f72c83aab24c35,9/19(金) 14:20
2025-09-24,19:08,sports,スポーツ,39,Full-Count,勝負は大谷翔平の降板後…敵将が狙っていたド軍のブルペン　試合後にニヤリ「野球の醍醐味」,https://news.yahoo.co.jp/articles/1f5c570e4e0c621f939dbeaa7b49490552f42e87,9/24(水) 18:33
2025-09-24,19:08,sports,スポーツ,40,デイリースポーツ,「中谷潤人が勝つ」井上尚弥から初ダウン奪った悪童ネリが井上ＶＳ中谷戦を予想　自身は中谷とのビッグマッチ熱望「勝つ自信ある」,https://news.yahoo.co.jp/articles/22fc3a11adcc4a2a414bff08320c55db547a8ce3,9/24(水) 13:00
