scrp_date,scrp_time,genre_en,genre_jp,rank,media_jp,title,link,date_original
2025-03-14,17:09,sports,スポーツ,1,J-CASTニュース,「韓国のときより10倍すごいことに」フリーマンの発言が韓国で物議　「礼儀全くない」「韓国ファンに配慮ないのか？」,https://news.yahoo.co.jp/articles/cfdcd02dd4fd12bbea4a9a866ef477dcb7e686e2,3/14(金) 11:35
2025-03-14,17:09,sports,スポーツ,2,スポーツ報知,ロバーツ監督、プレシーズンゲームの先発を明言…１５日巨人戦はブルペンデー　１６日阪神戦はスネル＆グラスノーの豪華リレー,https://news.yahoo.co.jp/articles/5148f3dc2ed152df0be42bdf1a0d7aeafd2aa2dd,3/14(金) 15:34
2025-03-14,17:09,sports,スポーツ,3,Full-Count,大谷翔平、チームホテルには宿泊せず　日本で特別対応…指揮官が明かす「賢明なこと」,https://news.yahoo.co.jp/articles/0c7c08267ec41acbeaa864b15ff894e4c34f1681,3/14(金) 7:44
2025-03-14,17:09,sports,スポーツ,4,デイリースポーツ,巨人　田中将大がカブス戦の登板予定が変更「予定が変わりました」故障などは否定「投げるコンディションではあります」,https://news.yahoo.co.jp/articles/ea2014fafba5522dc2f493ed22c211f120f2a4ff,3/14(金) 15:04
2025-03-14,17:09,sports,スポーツ,5,スポニチアネックス,鈴木誠也　「トウキョウただいまおかえり」着物姿の畠山愛理との仲良し夫婦ショット披露,https://news.yahoo.co.jp/articles/d14c1679cbe67061e7f96a917a3d689c728205ca,3/14(金) 10:54
2025-03-14,17:09,sports,スポーツ,6,デイリースポーツ,元ＢＤ人気選手の料理人　化学調味料巡り論争の堀江貴文氏に噛みつく「そんだけ好きなら一生化学調味料食ってろ」,https://news.yahoo.co.jp/articles/7200dc9a84e33fbc8ca9fa5bc4fb8f8906b934bf,3/14(金) 12:15
2025-03-14,17:09,sports,スポーツ,7,TopNews,【F1オーストラリアGP：FP2タイム】角田裕毅4番手＆ハジャー6番手でレーシングブルズは3番目に速いチームへ！ローソン苦戦...最速はルクレール、ピアストリ母国で2番手,https://news.yahoo.co.jp/articles/373d8dc59ac109d94e4c4e0f6ce66bcd12edbba8,3/14(金) 15:32
2025-03-14,17:09,sports,スポーツ,8,デイリースポーツ,「大トロ」「本場のラーメン」「コンビニ」来日したドジャース選手に緊急アンケ「日本でやりたい事、行きたい場所は？」,https://news.yahoo.co.jp/articles/6e791c1dd0c7bb0ec45e044fbe1ab64bf2c1232a,3/14(金) 13:46
2025-03-14,17:09,sports,スポーツ,9,馬トク報知,２０年日本ダービー３着の血を後世へ「どうしても種を残したい」３９歳・ＪＲＡ馬主の挑戦,https://news.yahoo.co.jp/articles/ed3bee259670ed5ffa6652288b11490f114c40e9,3/14(金) 16:00
2025-03-14,17:09,sports,スポーツ,10,ゴルフ総合サイト ALBA Net,＜速報＞山下美夢有が首位でホールアウト　高木優奈も上位【韓国女子】,https://news.yahoo.co.jp/articles/8f50d3ba8af01c0636df8360e514e554e30516f5,3/14(金) 14:33
2025-03-14,17:09,sports,スポーツ,11,中日スポーツ,超特例待遇…大谷翔平はなぜチームホテルに宿泊しないのか!? ロバーツ監督明かした理由「賢明だね」,https://news.yahoo.co.jp/articles/1da6edafe5a95563d33bdf1be3eb22cf67e0c32e,3/14(金) 15:55
2025-03-14,17:09,sports,スポーツ,12,Full-Count,米記者は“理解不能”、平日昼間に…東京Dで広がる異様な光景「改めて言います」,https://news.yahoo.co.jp/articles/a940200a94588ac47c6bce8a46aa6eb168edbc37,3/14(金) 16:10
2025-03-14,17:09,sports,スポーツ,13,スポーツ報知,大谷翔平の同僚が都内各地に出現！居酒屋に築地…妻と一緒に「ＴＯＫＹＯ」満喫,https://news.yahoo.co.jp/articles/7efba538ce0d19392444b8939424445ee84edfe9,3/14(金) 12:23
2025-03-14,17:09,sports,スポーツ,14,中日スポーツ,サッカー日本代表・森保監督が物損事故、日本協会が厳重注意…接触されたトラック運転手は驚き「いまどき、そんな対応をしてくれる人もいるんですね」,https://news.yahoo.co.jp/articles/3bf94cf55a8b3155c22f2f148f477c4c0677caef,3/13(木) 14:53
2025-03-14,17:09,sports,スポーツ,15,Full-Count,ド軍284億円男、練習直前に妻と訪れた東京の名所　“恐怖体験”呼びかけ「あなたなら立つ？」,https://news.yahoo.co.jp/articles/1325f36a57cf38a0c7403a9860c43de95d37992d,3/14(金) 15:36
2025-03-14,17:09,sports,スポーツ,16,motorsport.com 日本版,F2開幕戦、3チーム6人に10グリッド降格ペナルティ。テスト時の不正なディフューザー改造、センサー搭載で厳罰,https://news.yahoo.co.jp/articles/b0215e1330ad407cb01b0db4ce09ba805b6edb03,3/14(金) 15:50
2025-03-14,17:09,sports,スポーツ,17,スポーツ報知,大谷翔平「時差ボケを直すことに専念」　公式会見に登場　東京開幕シリーズへ「日本人の活躍を見てもらえたら」,https://news.yahoo.co.jp/articles/845fd300a82479522fa60db28be10e2c1928314c,3/14(金) 14:21
2025-03-14,17:09,sports,スポーツ,18,デイリースポーツ,カブス　阪神の公式練習をズラリ並んでチェック　今永＆鈴木も驚き「みんな朝から準備してた」意識の高さ伺わせたワンシーン,https://news.yahoo.co.jp/articles/c77279f7604f0d48055fe1adb06b1941c2f629ad,3/14(金) 11:26
2025-03-14,17:09,sports,スポーツ,19,スポーツ報知,ドジャース選手の奥様たちが「ＪＡＰＡＮ」満喫！街に繰り出しマンガ、ラーメンなど続々ＳＮＳに投稿,https://news.yahoo.co.jp/articles/4461c5f11cb4ffb1e76539a550c8ebdc579ff85a,3/14(金) 16:00
2025-03-14,17:09,sports,スポーツ,20,日刊スポーツ,ドジャースの奥様たちが東京を満喫　キケ・ヘルナンデス妻は長女と原宿で「ちいかわ」グッズ集め,https://news.yahoo.co.jp/articles/de7e8b0ff20e61b6328bf39d1e5d502f9c15396f,3/14(金) 16:08
2025-03-14,17:09,sports,スポーツ,21,デイリースポーツ,ドジャース来日　奥様会メンバーは純和風の豪華機内食を公開、機内でパックしながらカップ麺の美貌妻も,https://news.yahoo.co.jp/articles/4ceba7e43bee22c82ef166dacec017a9e52d3fb6,3/13(木) 20:44
2025-03-14,17:09,sports,スポーツ,22,Full-Count,日本の“日常”は「天国だわ」　カブス左腕の妻が到着して即感動した米国との違い,https://news.yahoo.co.jp/articles/c40a73a4ec1e6ea65562ddc2fe7fcdc50e28d6a8,3/13(木) 19:50
2025-03-14,17:09,sports,スポーツ,23,オートスポーツweb,【タイム結果】2025年F1第1戦オーストラリアGPフリー走行2回目,https://news.yahoo.co.jp/articles/c2b93bcf6556354e0b006462fa0787f84a0e51dd,3/14(金) 15:05
2025-03-14,17:09,sports,スポーツ,24,デイリースポーツ,ドジャース　ロバーツ監督はトリシア夫人と仲むつまじく　第２の故郷で開幕「本当にワクワク」大谷翔平とのイタズラ合戦でも話題,https://news.yahoo.co.jp/articles/1828284072dca25612f3ab614f4c2614c47465db,3/14(金) 8:33
2025-03-14,17:09,sports,スポーツ,25,デイリースポーツ,阪神・佐藤輝が右翼で守備練習　フリー打撃ではカブス選手の前で柵越え連発,https://news.yahoo.co.jp/articles/552e0f564417373d297f1085d16aa4c694ab90a5,3/14(金) 14:55
2025-03-14,17:09,sports,スポーツ,26,ABEMA TIMES,サボるなよ！！守備しないヴィニシウスにブチギレ！「舐めたプレーにキレていい」「めっちゃ怒ってたな」ベリンガムが魂のロケットスライディング→地面を叩いて激怒した瞬間,https://news.yahoo.co.jp/articles/c033292b2f528c62bffdc5b3595d4e0c28608338,3/14(金) 12:02
2025-03-14,17:09,sports,スポーツ,27,日刊スポーツ,ドジャースのベテラン捕手が居酒屋へ　あまりの渋さに「ボトルキープしてそう」「常連さんだ」,https://news.yahoo.co.jp/articles/0a26098542f2b003e9e9eb50f050bf0b1651256c,3/14(金) 10:55
2025-03-14,17:09,sports,スポーツ,28,日刊スポーツ,大谷翔平らが日本で食事会開催「すご腕のすし職人呼んで31人全員参加」ロバーツ監督明かす,https://news.yahoo.co.jp/articles/bb3c85ccc19f659779aac0514d9bf9c39dceeee1,3/13(木) 18:23
2025-03-14,17:09,sports,スポーツ,29,ABEMA TIMES,「プレミアでも通用するよ」久保建英、マンU相手にたったひとりでチャンスメイク！「1人で完結」「メッシじゃん」超絶ダブルタッチ突破→カットインシュートの瞬間,https://news.yahoo.co.jp/articles/5b13f19f963a6a2eb246138d069a05b9b8199cf0,3/14(金) 12:09
2025-03-14,17:09,sports,スポーツ,30,日刊スポーツ,【巨人】田中将大、予定変更でカブス戦に登板せず「投げられるコンディションではあります」,https://news.yahoo.co.jp/articles/2bdb8a22e7625aadee5c0d5a8a9b56d24a92cfbe,3/14(金) 14:22
2025-03-14,17:09,sports,スポーツ,31,中日スポーツ,【中日】上林誠知また打った…オープン戦3発目は逆転2ラン、”2球”で2ホーマー開幕へ好調持続,https://news.yahoo.co.jp/articles/c8fdb262f4b3df9a0bd69edaefe10790d99ce933,3/14(金) 13:27
2025-03-14,17:09,sports,スポーツ,32,Full-Count,来日した大谷翔平の“すぐそば”にデコピン？　まさかの発見に日本人騒然「もしかして」,https://news.yahoo.co.jp/articles/f64cc37d097036cf9bb6e5d826e53c5b74c08c68,3/14(金) 7:45
2025-03-14,17:09,sports,スポーツ,33,日刊ゲンダイDIGITAL,巨人は今季もDeNAサマサマ…“拾ってきた”戦力外左腕が開幕ローテ候補に急浮上,https://news.yahoo.co.jp/articles/5d5da9ebd374eb903ba8c05bcc0ffbc4533a45f7,3/14(金) 11:32
2025-03-14,17:09,sports,スポーツ,34,CoCoKARAnext,「気分が悪い」フリーマンの“日本賛辞発言”が物議！ 何気ない比較に韓国メディアが反発「おもてなしの記憶は忘れたのか」,https://news.yahoo.co.jp/articles/2190850e9cc252d9459ce364501c1cef089a8208,3/14(金) 16:36
2025-03-14,17:09,sports,スポーツ,35,J-CASTニュース,全部リップサービスだった...大谷翔平「同僚」キム・ヘソン、開幕マイナーに地元メディア落胆「あれだけ褒めていたのに」,https://news.yahoo.co.jp/articles/de925b9ede34cc3e294b9ed1612c91287ecd5f84,3/13(木) 16:50
2025-03-14,17:09,sports,スポーツ,36,日刊スポーツ,カブスが公式練習　鈴木誠也は拍手を背に打撃練習へ　27スイングで８本のアーチ描く,https://news.yahoo.co.jp/articles/0ddbd7d5d57ca6601f1be38ffe2c2ffd7c594c44,3/14(金) 14:32
2025-03-14,17:09,sports,スポーツ,37,スポーツ報知,大谷翔平とびしょびしょになったドジャース専属の美女リポーターも日本満喫！アート施設でエンジョイ,https://news.yahoo.co.jp/articles/888369c40d68c2e55a1ad5b52d41a5680bd9318d,3/14(金) 9:55
2025-03-14,17:09,sports,スポーツ,38,日テレNEWS NNN,「スカイツリーに行ってきました」ドジャース・グラスノー　さっそく日本観光「大谷翔平がいたるところに・・・」,https://news.yahoo.co.jp/articles/3ba2113a465d99e1a570acac310f99a2443ef75e,3/14(金) 16:22
2025-03-14,17:09,sports,スポーツ,39,ABEMA TIMES,「大丈夫かこのレフェリー？」「主審がやりすぎ」交代選手がわずか7分で一発退場！「これは詰んだな」際どいドグソ判定にファン悲鳴も「レッドと言えばレッド」「カバーが一枚でもいれば」,https://news.yahoo.co.jp/articles/9cf7596d5ac715106f06b101ddebacde9fea554a,3/14(金) 12:39
2025-03-14,17:09,sports,スポーツ,40,motorsport.com 日本版,開幕戦は2チームの戦いに？　跳馬ルクレール最速でマクラーレン退ける。角田裕毅4番手と期待大……レッドブル低調な初日｜F1オーストラリアGP FP2,https://news.yahoo.co.jp/articles/ca1583f476a4d30b4e679cb9a61f9ba5380752d1,3/14(金) 15:29
