scrp_date,scrp_time,genre_en,genre_jp,rank,media_jp,title,link,date_original
2025-02-11,08:06,sports,スポーツ,1,スポニチアネックス,DeNA度会隆輝　元アイドルと交際宣言！ラブラブ2S「2人とも仕事を全力で頑張ります」昨年熱愛報道,https://news.yahoo.co.jp/articles/54555ce6da59162d83e801f33a1058e45acd6bc5,2/10(月) 9:44
2025-02-11,08:06,sports,スポーツ,2,RONSPO,【独占】中日の井上監督が「一度は考えた」元阪神監督・矢野氏の中日ヘッド招聘プランが消滅した理由とは…「タイガースから見たドラゴンズベンチの雰囲気は重たかった」,https://news.yahoo.co.jp/articles/5f9c9d681631a88f87df847868186324711cccac,2/11(火) 6:31
2025-02-11,08:06,sports,スポーツ,3,Full-Count,真美子夫人の変化に注目「本当に美人さん！」　大谷“家族のひととき”にX興奮「お似合い」,https://news.yahoo.co.jp/articles/429a1459e25c45041d66a191493ba48364bca326,2/10(月) 13:24
2025-02-11,08:06,sports,スポーツ,4,CoCoKARAnext,虚飾まみれの証言…大谷夫妻の婚前契約も暴露した水原被告　“騒動の発信地”で広まる波紋「恥知らずな言い訳ばかり」,https://news.yahoo.co.jp/articles/078cd1bffbdd34458384baa3e54cac386520c8e8,2/11(火) 5:30
2025-02-11,08:06,sports,スポーツ,5,超WORLDサッカー！,長期離脱から復帰のザルツブルクMF川村拓夢に悲劇、復帰6試合目で今度は鎖骨骨折…再び長期離脱に,https://news.yahoo.co.jp/articles/21c13f972d3ee58da3806850c80268ed92b9b51e,2/11(火) 1:05
2025-02-11,08:06,sports,スポーツ,6,Full-Count,イチロー氏、今季開幕戦で始球式　マリナーズ発表…3月28日に3年ぶり“登板”へ,https://news.yahoo.co.jp/articles/8a9e6ef6a62b212cc50ba27ac72eab51e9b5c8ed,2/11(火) 2:39
2025-02-11,08:06,sports,スポーツ,7,スポーツ報知,妊娠公表の真美子夫人＆デコピンがキャンプ施設“初訪問”　大谷翔平は自主トレせずに“家族サービス”,https://news.yahoo.co.jp/articles/a6e65714bd021cf7e098b4c93c7ddc9017bbfefa,2/10(月) 4:55
2025-02-11,08:06,sports,スポーツ,8,CoCoKARAnext,「絶対に忘れない」ド軍メディアが水原被告に痛烈宣言　大谷翔平を巻き込んだ偽証に嘆き「ショウヘイは刑務所を訪問しない」,https://news.yahoo.co.jp/articles/17502925650299bf7a9099d61ee2ae3ccb9f34cf,2/11(火) 5:40
2025-02-11,08:06,sports,スポーツ,9,Full-Count,阪神は「なんで放出？」　戦力外の変則左腕…2年連続で“お宝”獲得か「楽しみしかない」,https://news.yahoo.co.jp/articles/0f1921aa5bab26d699bfac9ef0e5bed173df17f6,2/11(火) 7:20
2025-02-11,08:06,sports,スポーツ,10,GOAL,絶好調・前田大然がCLバイエルン戦出場へ…出場停止処分の軽減を発表,https://news.yahoo.co.jp/articles/d5bf3eb546004dd99643c1ce9b003f73e0fb3105,2/11(火) 6:31
2025-02-11,08:06,sports,スポーツ,11,スポニチアネックス,青学大・原監督に教え子がクレーム！「足が折れると怒られる」「卒業の際のメッセージが…」,https://news.yahoo.co.jp/articles/6e76530c31a3a3cd1d79fb5f2b9c82ea1f8da75f,2/10(月) 22:38
2025-02-11,08:06,sports,スポーツ,12,CoCoKARAnext,「19時に寝るのか!?」元エ軍監督が愕然　私生活を犠牲にする大谷翔平の“人知を超える努力”「すべて史上最高の選手になるため」,https://news.yahoo.co.jp/articles/6a26dd7390a55381d1c04e2a952aab44db41cc02,2/11(火) 6:00
2025-02-11,08:06,sports,スポーツ,13,Full-Count,ドジャース、また“大物”補強　昨年9月に失職→再復帰…チーム黄金期を築いた敏腕,https://news.yahoo.co.jp/articles/90258890a8e4c59dd659ab3145b8e2a718ed3768,2/11(火) 7:07
2025-02-11,08:06,sports,スポーツ,14,Full-Count,闘将の前で大暴れ→2軍幽閉で「オフにクビに」　壊れたメンタル…1年で終わった中日生活,https://news.yahoo.co.jp/articles/c4cde30429f04a351e9e0df52d2bed0642f83605,2/11(火) 7:10
2025-02-11,08:06,sports,スポーツ,15,スポニチアネックス,阪神・森下　キャンプ中に異例“春期講習”で語学と両立　オンラインでスパルタ英会話講師から学ぶ,https://news.yahoo.co.jp/articles/c9ec1580c3e8d91246018e5a1c470571d718c69c,2/11(火) 5:15
2025-02-11,08:06,sports,スポーツ,16,GOAL,アンチェロッティ、アトレティコ戦のハーフタイムに「準備したプレーをするか交代するかだ」と忠告。ヴィニシウスは指示通りサイドに開かず,https://news.yahoo.co.jp/articles/a0fa4acff5973f130ce7cdac7370ec94b56906a9,2/11(火) 0:43
2025-02-11,08:06,sports,スポーツ,17,東スポWEB,井上尚弥との対戦を模索するカシメロ　地元紙は冷たい視線「放蕩息子」「井上戦は到底不可能」,https://news.yahoo.co.jp/articles/2c587de80c6dd29339f4becfe7e2548b1cf09fbc,2/11(火) 5:16
2025-02-11,08:06,sports,スポーツ,18,CoCoKARAnext,ド軍「26人」から漏れる“当落線上”の選手は　キケ・ヘルナンデス再契約で「アクティブ・ロースター」はどうなる？,https://news.yahoo.co.jp/articles/da490245f7d0ea8aec55eebb53a80c4ebea871ef,2/10(月) 12:02
2025-02-11,08:06,sports,スポーツ,19,スポニチアネックス,中村俊輔氏が指導者プロライセンス取得　日本代表、Jトップチーム指揮可能に「終わりでも始まりでもない」,https://news.yahoo.co.jp/articles/f07ab4d8e02350602b0b8d5ada5322dc778cfe06,2/10(月) 18:10
2025-02-11,08:06,sports,スポーツ,20,スポニチアネックス,今永昇太　日本開幕戦へ意気込み問われ、今永節で珍回答　からかわれた女性リポーターは大笑い,https://news.yahoo.co.jp/articles/296c0e3720e7672de833999d5e0a3d191d6530df,2/11(火) 6:47
2025-02-11,08:06,sports,スポーツ,21,日刊スポーツ,【ドジャース】予想布陣イラスト＆予想オーダー　MVPトリオの上位安泰　投手陣は一気に分厚く,https://news.yahoo.co.jp/articles/7ba59b9fe1b2a7df6918d935d2f0d8eb4c741758,2/11(火) 6:30
2025-02-11,08:06,sports,スポーツ,22,Full-Count,大反対の妻と義実家に「駄目なら何でもする」　入団拒否から決意…腹括った“3年間”,https://news.yahoo.co.jp/articles/8784562bac3279cf69d9f391665cb80d1fb16976,2/11(火) 6:50
2025-02-11,08:06,sports,スポーツ,23,スポニチアネックス,DeNA・度会　元アイドルと交際宣言　24歳インフルエンサーの「なっちー」とインスタで2ショット,https://news.yahoo.co.jp/articles/b54cc5170279eb9f102b382be0254afcb0c32209,2/11(火) 5:30
2025-02-11,08:06,sports,スポーツ,24,サッカー批評Web,「伝説の始まりです」なでしこの“未来”19歳MF谷川萌々子のバイエルンデビュー＆ワンタッチパスに脚光!「見事なワンタッチパスさすが」「存在感示したね」などの声,https://news.yahoo.co.jp/articles/af3e60922c0f09131b998d45b583e59df1d63ab4,2/11(火) 5:27
2025-02-11,08:06,sports,スポーツ,25,CoCoKARAnext,井上尚弥は「究極の破壊者」　キャリア50年の米名伯楽が説く怪物の“本質”「イノウエはリングから希望を奪っていく」,https://news.yahoo.co.jp/articles/0858f72397192ba95181c1793ecf6735d4420806,2/11(火) 7:02
2025-02-11,08:06,sports,スポーツ,26,スポーツ報知,村田真一氏、巨人の高卒ルーキー・石塚が、この時期に１軍の投手と対戦できるなんて幸せなことや,https://news.yahoo.co.jp/articles/588385c03fef8de88befe6e313c47b99587b708a,2/11(火) 5:20
2025-02-11,08:06,sports,スポーツ,27,スポニチアネックス,大谷翔平　キャンプイン前日に球団が出勤姿を今季初公開　手にしていたグラブ型のバッグが衝撃の値段,https://news.yahoo.co.jp/articles/a3381392bcd6c7434056ac66cdca7d9fcac86e48,2/11(火) 7:46
2025-02-11,08:06,sports,スポーツ,28,FITNESS LOVE,「ブヨブヨのお腹」から「タテ線腹筋ボディ」へ！　18kgの産後太りを解消しボディコンテストで活躍する41歳,https://news.yahoo.co.jp/articles/2c1b7b1402461f8d4ad6d2eec3e6ee5903b1bd27,2/11(火) 5:00
2025-02-11,08:06,sports,スポーツ,29,スポニチアネックス,阪神・井上　ノーステップ打法解禁、コンタクト率重視の打撃から「戻す」対外試合初戦は結果最優先に,https://news.yahoo.co.jp/articles/9bb93ac364462f43e74c49388eb0b67a73aecea6,2/11(火) 5:15
2025-02-11,08:06,sports,スポーツ,30,FITNESS LOVE,メリハリボディでコンテスト日本大会優勝、子育てや仕事と両立する38歳・会社員トレーニー,https://news.yahoo.co.jp/articles/be01273c9641666574dafa8fdb2467825b07f5cb,2/11(火) 7:10
2025-02-11,08:06,sports,スポーツ,31,馬トク報知,【共同通信杯】武豊騎手と福永祐一師が重賞初タッグの良血リスグラシュー半弟に注目,https://news.yahoo.co.jp/articles/cf35a9a3124efe5a5670a997d6457541d3746cd5,2/11(火) 7:00
2025-02-11,08:06,sports,スポーツ,32,東スポWEB,【阪神】ジェフ・ウィリアムス駐米スカウト〝熱血漢〟から一変？　宜野座で「JFK」揃い踏み,https://news.yahoo.co.jp/articles/3a5dc9438af42654c7369ef76f857a725457e435,2/11(火) 5:16
2025-02-11,08:06,sports,スポーツ,33,日テレNEWS NNN,デコピンの躍動感がすごいと話題　始球式で見せた完璧なボール運びもオフでは不発　真美子さんがすかさずフォロー,https://news.yahoo.co.jp/articles/ea5e54086f743b44f5dc8592baa7d155f2abf3aa,2/10(月) 12:32
2025-02-11,08:06,sports,スポーツ,34,CBCテレビ,中日OB・中村武志さんに聞く！「名物球場でなくなるのは残念だが…」テラス席を設置するバンテリンドームへの想いとは？,https://news.yahoo.co.jp/articles/ddd135143058a48f44dc99c5ac1251079e147fb8,2/11(火) 6:10
2025-02-11,08:06,sports,スポーツ,35,中日スポーツ,大谷翔平、デコピン＆真美子夫人と球団施設で「のんびりオフ」…「背番号17」着た「新たなワンちゃん」登場,https://news.yahoo.co.jp/articles/2144097a3ccca5213fa7108dca56ea16b5eee182,2/10(月) 5:01
2025-02-11,08:06,sports,スポーツ,36,スポニチアネックス,まるで別人！？体操女子・杉原愛子　“アダルト”ショット公開に「めっちゃ大人っぽい」「モデルに転向」,https://news.yahoo.co.jp/articles/ab61eb61da1f19934acd517b72add719a8119095,2/6(木) 8:57
2025-02-11,08:06,sports,スポーツ,37,東スポWEB,【新日本】IWGP世界王者ザック・セイバーJr.　最多防衛更新後の青写真…3・6大田区でタイチ戦熱望,https://news.yahoo.co.jp/articles/13f99cbdca6d08d5d236423f3801b2def95f6b14,2/11(火) 5:16
2025-02-11,08:06,sports,スポーツ,38,日刊スポーツ,都玲華「コップンカ～」白ワンピで馬乗りなどタイ満喫…充実の「化粧してない」すっぴんゴルフも,https://news.yahoo.co.jp/articles/d0cebee3dd9307833077a8c1b19a6eee9f781f09,2/11(火) 6:00
2025-02-11,08:06,sports,スポーツ,39,CoCoKARAnext,母になる真美子夫人の“ニュースタイル”に反響止まらず！大谷も寄り添い、キャンプイン前の貴重なひととき「素敵です」,https://news.yahoo.co.jp/articles/51e678e36da94e845cfb3b48d01b0a8c895afee2,2/11(火) 5:50
2025-02-11,08:06,sports,スポーツ,40,CoCoKARAnext,大谷翔平と真美子さんの「婚前契約」を漏らした水原被告の“暴露”に米司会が憤怒「呆れるほど忌々しい。卑劣な行為だ」,https://news.yahoo.co.jp/articles/4dac764edf5e63b20f14d047a9339dd9c2bf27c1,2/9(日) 5:30
