scrp_date,scrp_time,genre_en,genre_jp,rank,media_jp,title,link,date_original
2024-07-27,15:06,domestic,国内,1,日刊スポーツ,パリ五輪「衝撃演出」にSNS賛否…開会式でマリー・アントワネットらしき女性「生首」手に登場,https://news.yahoo.co.jp/articles/ec668de2b3c25f506b6c72bf6d9829e50d3f0782,7/27(土) 12:06
2024-07-27,15:06,domestic,国内,2,産経新聞,中国、コロナの窮状にあえぐイタリアを支援　本来〝絶賛〟で終わるはずが墓穴掘る　国際舞台駆けた外交官　大江博氏（１）,https://news.yahoo.co.jp/articles/17755cd1dc7efe40ba0ee6e472d71fc0ba77c808,7/27(土) 13:00
2024-07-27,15:06,domestic,国内,3,テレビ朝日系（ANN）,百条委調査受ける職員への口止めか　兵庫県知事パワハラ疑惑で人事課配布の資料に批判,https://news.yahoo.co.jp/articles/9d177d6b6de252805b50bd22cac7b3676e64c1b7,7/27(土) 13:31
2024-07-27,15:06,domestic,国内,4,MBSニュース,なぜ？クレジットカード“停止したのに”不正利用が止まらない…毎日1万円ずつ被害に「意味分からない」利用者に募る不安　スマホタッチ決済悪用か　専門家「今まで聞いたことない手口」,https://news.yahoo.co.jp/articles/390f8e8e261ccb6a422d868f1d2a91ff37d395d4,7/27(土) 8:00
2024-07-27,15:06,domestic,国内,5,デイリースポーツ,たかまつなな　都知事選での「支持者の暴走」に苦言　「石丸さん陣営と蓮舫さん陣営が過激な誹謗中傷」「蓮舫さんの支持者が小池さんの演説を妨害」,https://news.yahoo.co.jp/articles/7691423960b920a532fef2226ea1014a81ccc660,7/27(土) 12:28
2024-07-27,15:06,domestic,国内,6,読売新聞オンライン,大阪府医師会、コロナ感染「第11波突入」…免疫効きにくい新変異株が主流に,https://news.yahoo.co.jp/articles/5e57e49647ed354118e8553c9934a034c877a4ea,7/27(土) 11:40
2024-07-27,15:06,domestic,国内,7,FNNプライムオンライン,【独自】信号無視した自転車の男…クラクション鳴らされ“逆ギレ”　ドライバーに怒りをぶつけ再び信号無視　福岡市,https://news.yahoo.co.jp/articles/45a834f5fcb55befcf319f4395733481a14455a1,7/27(土) 14:02
2024-07-27,15:06,domestic,国内,8,CBCテレビ,"洗剤成分が実は効く？""殺虫剤を使わない""新たな「蚊」対策 蚊が肌にとまれない画期的なクリームや新製品のスプレーも",https://news.yahoo.co.jp/articles/2725251b44192e49e7ea35eae081f8fd6e25059f,7/27(土) 6:03
2024-07-27,15:06,domestic,国内,9,読売新聞オンライン,名前書き保管した「たらこパスタ」のラップ、後輩に張り替えられ別の同僚が食べてしまい…消防士が怒って暴行,https://news.yahoo.co.jp/articles/473e639b3ca00c22b6c119e17545d5672ae820cf,7/27(土) 8:16
2024-07-27,15:06,domestic,国内,10,夕刊フジ,トランプ氏「為替発言」の波紋　１ドル＝１１０～１２０円まで円高に　日本は今のうちに外貨準備を減らし「円安差益確保」を,https://news.yahoo.co.jp/articles/6646e693eea789054b42d3bfdf033e5d495f4947,7/26(金) 17:00
2024-07-27,15:06,domestic,国内,11,読売新聞オンライン,総裁選へ「反岸田」のマグマ…森元首相「なぜ安倍派だけがこんなにかわいそうな目に」,https://news.yahoo.co.jp/articles/09c68d33e30ab9d47cd98336cb18a5915211b99e,7/27(土) 5:01
2024-07-27,15:06,domestic,国内,12,MBSニュース,「自分のことが一番信用できない」若年性アルツハイマー型認知症　それでも一人暮らしを選ぶ59歳美香さんの決意,https://news.yahoo.co.jp/articles/ea8e00f10a33431461f1b9bb7d4219f4e5024790,7/27(土) 13:00
2024-07-27,15:06,domestic,国内,13,J-CASTニュース,「スーパーで買った野菜にカタツムリが...」　購入者の機転に「うれしい」「優しい」「素晴らしい」,https://news.yahoo.co.jp/articles/5ef1401bec40fcf732a3b42e3a4ef54c29178371,7/27(土) 9:00
2024-07-27,15:06,domestic,国内,14,読売新聞オンライン,職務質問した10歳代男性に暴行、引き離そうとした同僚も殴る…40歳代巡査長「やり過ぎてしまった」,https://news.yahoo.co.jp/articles/ed729e947e806568a2b7ef0f951e4d8605f54b6c,7/27(土) 10:22
2024-07-27,15:06,domestic,国内,15,テレビ朝日系（ANN）,大人も感染「激痛で歩けない」入念に対策しても…『手足口病』過去最悪ペースで拡大,https://news.yahoo.co.jp/articles/825fde1ac344f9278624ff7f7675c9a97a3c3f0d,7/24(水) 0:42
2024-07-27,15:06,domestic,国内,16,TBS NEWS DIG Powered by JNN,【速報】東京・足立区の住宅で閉じこもっていた男を確保　警視庁が捜査一課特殊班「SIT」を現場派遣,https://news.yahoo.co.jp/articles/6c6a00ab0cac9cca83f1e41ed58d7cf6cbd2de1d,7/26(金) 19:20
2024-07-27,15:06,domestic,国内,17,テレビ朝日系（ANN）,真夜中の富士山　9合目に120人野宿　国籍不明の集団が“弾丸登山”ご来光目当てか,https://news.yahoo.co.jp/articles/3331fbdd914a0c3b3c02af42b67bec4a739ae859,7/27(土) 13:09
2024-07-27,15:06,domestic,国内,18,ABEMA TIMES,「まるで戦隊ヒーロー！」5羽のインコが勢いよくケージから飛び出す様子に「地球を守るため出動だ！」「ゴーゴーファイブみたい」と話題,https://news.yahoo.co.jp/articles/6b7e79415ff944a888cbc7551f5af36d4780565c,7/27(土) 11:57
2024-07-27,15:06,domestic,国内,19,日テレNEWS NNN,選手を盗撮から守れ　ミズノの赤外線で透けないユニホーム～パリ五輪代表も採用,https://news.yahoo.co.jp/articles/26e018b2b11a2b39c64279e1642dc8008dc26ec8,7/27(土) 13:11
2024-07-27,15:06,domestic,国内,20,読売新聞オンライン,具のほとんどないカレーライス、おかずははんぺんだけ…障害者グループホーム「恵」処分　利用者の住まい確保急務　支援の質確保へ外部の目,https://news.yahoo.co.jp/articles/4312b077452c6383e888ca9f0c0728fcfeada01a,7/26(金) 11:37
2024-07-27,15:06,domestic,国内,21,日刊スポーツ,岸博幸氏、斎藤元彦兵庫県知事「元霞が関の役人出身」「無意味に頭がいい」,https://news.yahoo.co.jp/articles/7f9beed0204f67b9895bd44650c6673c40fc7bc8,7/20(土) 13:32
2024-07-27,15:06,domestic,国内,22,読売新聞オンライン,「女子生徒の姿を見たくて衝動的に」勤務高校トイレにカメラ…30歳教諭懲戒免,https://news.yahoo.co.jp/articles/1e5e7ea8a977a05390c936726c044b51f616573f,7/27(土) 11:52
2024-07-27,15:06,domestic,国内,23,朝日新聞デジタル,佐渡金山が世界文化遺産に登録決定　日本の世界遺産は計26件に,https://news.yahoo.co.jp/articles/16227021d329cd9185f8f1d1beec335d12a4c7df,7/27(土) 14:06
2024-07-27,15:06,domestic,国内,24,関西テレビ,吉村知事が『コロナ感染』「今まで一度もかかったことはなかった」と知事　「第11波」に入ったと医師会　,https://news.yahoo.co.jp/articles/2cfec8eb6b5435e4a915e23f171df44a9ac963b4,7/26(金) 13:03
2024-07-27,15:06,domestic,国内,25,中日スポーツ,『校庭で高齢者にぶつかる、当時小学生の２人に賠償命令』 ひろゆきさんは判決を疑問視 「子供優先にしないと」「骨折はやり過ぎ」反応さまざま,https://news.yahoo.co.jp/articles/cb6be49d955b012a9f3be2833c59c839817f247b,7/26(金) 11:30
2024-07-27,15:06,domestic,国内,26,毎日新聞,当時小学生の2人に賠償命令　学校のグラウンドで女性にぶつかる,https://news.yahoo.co.jp/articles/3e90cf32410b5a8580f8219ded9112be11d75eee,7/25(木) 17:00
2024-07-27,15:06,domestic,国内,27,47NEWS,言うこと聞かないと「気合」。県史も認める佐渡金山の朝鮮人強制労働、その痕跡を歩く　世界遺産登録へ「負の歴史」をどう説明するか,https://news.yahoo.co.jp/articles/a794df1c2acf859164f13abeacbd5295e8b43a30,7/21(日) 10:02
2024-07-27,15:06,domestic,国内,28,毎日新聞,「休暇の不正取得認定は不当」　川崎市立中教諭、措置要求を提出,https://news.yahoo.co.jp/articles/e1a9a4ae83edc5171ad80016c2522c3dd67b56fc,7/27(土) 13:15
2024-07-27,15:06,domestic,国内,29,テレビ朝日系（ANN）,気象庁も雨量予測は“非常に困難”氾濫・土砂崩れ…記録的大雨で被害拡大　山形・秋田,https://news.yahoo.co.jp/articles/d1d25c8eb7bb3715087e06262507131d493c84cd,7/27(土) 0:36
2024-07-27,15:06,domestic,国内,30,ABEMA TIMES,石戸諭氏の投稿が“炎上”…匿名アカに「会って話そう」と提案するも一度も実現せず　「大量攻撃」への向き合い方は？,https://news.yahoo.co.jp/articles/bb39e227ff366e05b28794deaf589c0ed9574f8d,7/27(土) 8:32
2024-07-27,15:06,domestic,国内,31,tenki.jp,記録的大雨の東北　午後は再び激しい雨　30日頃まで長引く大雨　氾濫など最大級警戒,https://news.yahoo.co.jp/articles/a697b4a18d4d04f76d4af1582e5b4820ade8bad0,7/27(土) 10:52
2024-07-27,15:06,domestic,国内,32,時事通信,【図解】新型コロナ「第11波」か＝感染者増加、変異株も流行―厚労省「手洗いなど対策を」,https://news.yahoo.co.jp/articles/841fb87e3b57c570db9699e9e56a1b3a128c7885,7/23(火) 20:34
2024-07-27,15:06,domestic,国内,33,FNNプライムオンライン,【独自】玄関ドア蹴り上げ「子どもを殺す」「早く死ね」3カ月間続く嫌がらせ…“虐待通報”の逆恨み　脅迫容疑で母親逮捕　宮城・大崎市,https://news.yahoo.co.jp/articles/4fd349cfc39cfdbd6427c765ef3a5a0d0c7f1b14,7/24(水) 14:13
2024-07-27,15:06,domestic,国内,34,tenki.jp,北海道の週間予報　しばらくはぐずついた天気続く　来週は元・台風の動向にも注意!?,https://news.yahoo.co.jp/articles/32327b516aac2a201e6aea6e0ebef02ea356e507,7/27(土) 14:24
2024-07-27,15:06,domestic,国内,35,産経新聞,中国人観光客刺し「マネー」要求か　刃物で女性脅した疑いで無職男を逮捕　大阪府警が捜査,https://news.yahoo.co.jp/articles/9f7162969712d11cc302865d3a86c7e3632a962e,7/27(土) 13:40
2024-07-27,15:06,domestic,国内,36,朝日新聞デジタル,ギャンブルにはまった巡査の隠密と裏切り　きっかけは給与明細だった,https://news.yahoo.co.jp/articles/5d78319f6d3ad5dec52678a9dada73dd410ca2f4,7/27(土) 10:00
2024-07-27,15:06,domestic,国内,37,日本ファクトチェックセンター,習近平国家主席が脳卒中で倒れた？ 椅子から転げ落ちたという画像が拡散【ファクトチェック】,https://news.yahoo.co.jp/articles/4d2c882472d294acf26617d6ea054430a4ca53c3,7/26(金) 13:36
2024-07-27,15:06,domestic,国内,38,読売新聞オンライン,京都市交通局の職員２人、市営地下鉄で無賃乗車繰り返す…駅務区長は隠蔽工作を提案,https://news.yahoo.co.jp/articles/aabf2067e356c4fc9581664c508f3d1f45366b87,7/27(土) 14:12
2024-07-27,15:06,domestic,国内,39,産経新聞,トラックでひき逃げ、60代男性死亡させる　容疑で運転手を逮捕　大阪府警,https://news.yahoo.co.jp/articles/b8b56e9e3c5fceec9f1efe7a022d3803d85189e9,7/27(土) 12:49
2024-07-27,15:06,domestic,国内,40,TBS NEWS DIG Powered by JNN,「エリート、来たな」灘高・ハーバード卒の最年少市長が「恵まれた教育」へのステレオタイプに出した答え,https://news.yahoo.co.jp/articles/6bf08a8fe93cc3c8c6ab778cee0d276ab16f7226,7/21(日) 7:02
