scrp_date,scrp_time,genre_en,genre_jp,rank,media_jp,title,link,date_original
2025-10-24,09:28,TTL,総合,1,RONSPO,「佐々木麟太郎に賭けたソフトバンクは最悪の評価」元ヤクルト編成部長がドラフト成否を独自採点…「最高は阪神。90点以上は中日、ロッテ、オリックス、広島の4球団」,https://news.yahoo.co.jp/articles/71524072017aa161d3a07dc4f4c8dd086d9bdb2b,10/24(金) 7:05
2025-10-24,09:28,TTL,総合,2,デイリースポーツ,【高市自民】ネット大荒れ「この人大丈夫か？」「不安しかない」小泉後任の農水大臣　お米４千円超→「おこめ券」発言に騒然　小泉備蓄米を否定「農水省は価格に関与しない」に反発「２万円給付の方がマシ！」「令和のマリーアントワネットｗ」,https://news.yahoo.co.jp/articles/08ac0f816201c19af78a35eea748f98f0b76101f,10/23(木) 21:05
2025-10-24,09:28,TTL,総合,3,スポニチアネックス,5年前に芸能界引退　山田優の弟・親太朗さんの現在の職業に驚きの声「そうだったんだ！」,https://news.yahoo.co.jp/articles/399cd4245b5ea7234c47339a876ec811d0a3c768,10/23(木) 22:35
2025-10-24,09:28,TTL,総合,4,オリコン,市原隼人、父の職業明かす　“日本で3人”「サンディエゴの方で15年くらい」,https://news.yahoo.co.jp/articles/a1964a188615cfc8d052ef432e015cd5da1dcb99,10/24(金) 6:00
2025-10-24,09:28,TTL,総合,5,スポーツ報知,ほしのあき　三浦皇成騎手＆美少女オーラの娘と家族ショット！Ｇ１初勝利を友人に祝われ「うれしいっ」,https://news.yahoo.co.jp/articles/e193567ba3a78a145a4cdab659cb3b463d453697,10/24(金) 5:08
2025-10-24,09:28,TTL,総合,6,スポーツ報知,平成の歌姫　ステージ衣装に衝撃！ついに「着てない？」「度肝抜かれた」倖田來未４２歳「見えない」,https://news.yahoo.co.jp/articles/79e3f1e811d47c3b02ab48836caf62da6e0bc60c,10/24(金) 5:47
2025-10-24,09:28,TTL,総合,7,スポーツ報知,「ガチのオタク」小野田紀美氏は「元本職の方です」有名漫画家からの投稿に「いえいえ、私なんぞ…」対応が反響,https://news.yahoo.co.jp/articles/2e968539c1082e9f25c9c87c2c95dcfff5574ab6,10/24(金) 5:28
2025-10-24,09:28,TTL,総合,8,CoCoKARAnext,「巨人とか行ったら面白いかも」4番不在の来季、阿部巨人が狙うべき戦力は？　球界OBは元阪神25歳、右のロマン砲を推薦「岡田監督が抜擢してね、野口いいよって」,https://news.yahoo.co.jp/articles/049a52d4a6814dd57162c3cf48136dc508ed96be,10/24(金) 5:20
2025-10-24,09:28,TTL,総合,9,デイリースポーツ,【高市自民】玉木代表、わずか１日でＴＶ公言を変える→吉村代表が不快感「どうかと思う」　自維の衆院議員１割削減「賛成します」断言も→翌日に批判して撤回,https://news.yahoo.co.jp/articles/8fbe97a132d1977d5f65260a2cf09822ce10dee5,10/23(木) 23:30
2025-10-24,09:28,TTL,総合,10,日刊スポーツ,金子恵美氏が反論、玉木氏が共演時言った「金子さんらしくない」発言に「私の何がわかるのか」,https://news.yahoo.co.jp/articles/3bef1b7868a5c8cb9c0caf0a20826e5f5db2727d,10/24(金) 6:34
2025-10-24,09:28,TTL,総合,11,中国新聞デジタル,広島太郎さん亡くなる　広島市中心部で路上生活　70代後半か,https://news.yahoo.co.jp/articles/2bd4354150cfbdc441994a92bcfabdf95a285af2,10/24(金) 6:50
2025-10-24,09:28,TTL,総合,12,Full-Count,東京六大学の3冠王、大阪桐蔭エース…主な指名漏れ選手　渡辺Jr.や慶応エース右腕も,https://news.yahoo.co.jp/articles/613dc9c63114acd364fbe73452ef89cd3f455792,10/23(木) 20:06
2025-10-24,09:28,TTL,総合,13,スポーツ報知,高市首相が政務官を決定　美ぼうのパンツスーツ女性　正体に騒然「マジ？」「青春時代のアイドル」「久々に見た」,https://news.yahoo.co.jp/articles/0154dbb535fb62be701f855d2045694d95ae9655,10/23(木) 14:55
2025-10-24,09:28,TTL,総合,14,スポーツ報知,６１歳の山口智子がカッコイイ！「美し過ぎます」１７０センチの全身ショット　夫・唐沢寿明と独立も話題,https://news.yahoo.co.jp/articles/80d3a76c11cb7db346aafb07891eb2a992ed558b,10/24(金) 6:55
2025-10-24,09:28,TTL,総合,15,スポーツ報知,ブルージェイズ指揮官が大谷翔平に異例の“返品要請”「我々のものを返してくれと言いたいところ」,https://news.yahoo.co.jp/articles/de9f272f0b20faa926190780795877cadf62c7ea,10/24(金) 4:43
2025-10-24,09:28,TTL,総合,16,スポニチアネックス,河北麻友子　実家の料理が常識と違った…収録の打ち合わせで「今日初めて知りました」　共演者たちが絶句,https://news.yahoo.co.jp/articles/413c405ea9e93f361e818fc85d4a5c93505c5033,10/24(金) 4:30
2025-10-24,09:28,TTL,総合,17,スポニチアネックス,大谷翔平　2年連続世界一へ、頂上決戦は「楽しむ」　敵地での前回対戦では大ブーイング「また力に変えて」,https://news.yahoo.co.jp/articles/df6c30c5f977415f8b765d55f1aae3f366b027ab,10/24(金) 6:00
2025-10-24,09:28,TTL,総合,18,新潟ニュースNST,トイレ休憩中に藪の中へ…夫と長野県から妙高市に来た79歳女性が行方不明に　翌日に約200m離れた沢の中で見つかるも社会死状態,https://news.yahoo.co.jp/articles/32d11a127f5eddea4bcb0e23641cdb7aabab42df,10/23(木) 21:30
2025-10-24,09:28,TTL,総合,19,ゴルフのニュース,「いつも輝いてるよ」34歳・元アイドルが見せた“極ミニスカ”ゴルフウエア姿に視線集中！「ヘッドスピード上がってないですか？」,https://news.yahoo.co.jp/articles/3ed820f4f21d7dab535eae733f9f29ed6c664daa,10/24(金) 6:00
2025-10-24,09:28,TTL,総合,20,Full-Count,WS前日のド軍に悲報「一体何が」　突然発表された“深刻な問題”に相次ぐ心配「大丈夫なの…」,https://news.yahoo.co.jp/articles/2559558c352ed58b55b704d16a144debf6ef406f,10/24(金) 8:25
2025-10-24,09:28,TTL,総合,21,ファイナンシャルフィールド,テレビを処分してNHKを解約しようとしたのに、「解約できません」と言われました。NHKを見られないのに、なぜ受信料を払う必要があるのでしょうか？,https://news.yahoo.co.jp/articles/5c71febd3b233ededaa0e0f0c673310bea133392,10/22(水) 5:20
2025-10-24,09:28,TTL,総合,22,埼玉新聞,東武線で人身事故　男児と女性死亡…急行にはねられる　朝の駅で　近くにいた警官が通報、最大3時間の遅れ　女性は20代、男児は5歳か,https://news.yahoo.co.jp/articles/c600a73712dae40665d9401b68df8de8479e25b8,10/24(金) 7:27
2025-10-24,09:28,TTL,総合,23,デイリースポーツ,高嶋ちさ子、ダウン症の姉が「暴行事件」で警察へ　英会話親子の会話に激高も「英語、わからないでしょ？」,https://news.yahoo.co.jp/articles/14fc35ab3f0a694db4d07b904da9890a2a85d2d4,10/23(木) 18:45
2025-10-24,09:28,TTL,総合,24,イーファイト,“令和の峰不二子”阿部なつき、魅せる迫力の身体！トレーニングとエステ姿でファン魅了,https://news.yahoo.co.jp/articles/fb30a42cae55f6cc7f17ab833b9eec241c6fccb8,10/24(金) 4:26
2025-10-24,09:28,TTL,総合,25,Full-Count,大谷翔平は「本当にすごい」　CY賞シャーザーが大絶賛「子どもたちが刺激に」,https://news.yahoo.co.jp/articles/3e866b5297f57e7629ee1cdc7482e4e80414d233,10/24(金) 5:21
2025-10-24,09:28,TTL,総合,26,Full-Count,大谷翔平はジャッジらとは「全く別」　伝説の1日に敵将が感じた恐怖…強調した“違い”,https://news.yahoo.co.jp/articles/95f088a505916a60b6c02858b9579f44bc6419a7,10/24(金) 5:24
2025-10-24,09:28,TTL,総合,27,ねとらぼ,21歳と42歳で付き合い始めた2人→世間体に囚われ葛藤も……　思わず声が出る“現在の姿”に「本当にステキ」,https://news.yahoo.co.jp/articles/1cc61615f3d8de206297490bd0d032d3d49bca2d,10/24(金) 7:00
2025-10-24,09:28,TTL,総合,28,ベースボールキング,阪神が創価大・立石正広の交渉権を獲得！野村弘樹氏「即戦力と考えると、どこで使うんですかね…」と解説陣が議論,https://news.yahoo.co.jp/articles/36237977a2fffaf5b172454eabad9da32c26517c,10/24(金) 6:30
2025-10-24,09:28,TTL,総合,29,スポーツ報知,大谷翔平、ブルージェイズ監督の“返却要請”にも「大事に取ってます」　２３年オフのＦＡ交渉で贈られたプレゼントとは,https://news.yahoo.co.jp/articles/1a42eddf72f1da30f894c959ef77ede46177cee9,10/24(金) 6:50
2025-10-24,09:28,TTL,総合,30,西スポWEB OTTO！,夫はW杯戦士・・・34歳女優、1歳の子どもとディズニーショットに反響続々「産後もスタイル抜群」「ママになっても変わらない可愛さ」「素敵な親子タイム」,https://news.yahoo.co.jp/articles/edc2006df2877b5022b44e7cb3ed376ea08ef134,10/24(金) 5:40
2025-10-24,09:28,TTL,総合,31,Full-Count,佐々木朗希が赤面告白「嘘でも嬉しかった」　どん底から救ったアイアトン通訳の“7文字”,https://news.yahoo.co.jp/articles/2d0f66dc4d2e46171d691ed09d47e8a621f75632,10/24(金) 8:35
2025-10-24,09:28,TTL,総合,32,ENCOUNT,ディズニーランド「美女と野獣」で救急搬送、本社が公表　ネット上で“3歳児が搬送”の情報拡散,https://news.yahoo.co.jp/articles/53fcda87d5c3b0b8d78edd0fa1898de53c028143,10/23(木) 13:33
2025-10-24,09:28,TTL,総合,33,日刊スポーツ,百田尚樹氏、NHKニュースに指摘「高市総理及び関連映像が斜めになってる。これは見る者に…」,https://news.yahoo.co.jp/articles/eea98ca690717b10ed6bc3d7bfa38dd32beaa4fb,10/24(金) 6:32
2025-10-24,09:28,TTL,総合,34,オリコン,【整形美女】“お金で手に入れた見た目”はズルい？…1300万課金した女性が語る美の価値観「包帯を取っても美しい自分はいなかった」,https://news.yahoo.co.jp/articles/e11ede71b7b8b751cb3f0594bcd8447c0ad2da25,10/24(金) 7:50
2025-10-24,09:28,TTL,総合,35,中日スポーツ,巨人の育成5位指名に…ドラフト会場が異例の盛り上がり　ネットも沸く「マジでおめでとう」「呼ばれてウルッ」「知念きたぁぁぁぁああああ」,https://news.yahoo.co.jp/articles/62ea6f67c10cb74d5cf611c1585fc66859886186,10/23(木) 20:26
2025-10-24,09:28,TTL,総合,36,スポニチアネックス,国分太一　窮状訴え「自宅を売ることになるかも」　どうなる？「人権救済」,https://news.yahoo.co.jp/articles/96d453cbbd70a3953c1942198803908e24a8d828,10/24(金) 5:00
2025-10-24,09:28,TTL,総合,37,スポーツ報知,田原総一朗氏、高市早苗氏への発言を謝罪「きわめて不適切な表現となり、深く反省しております」,https://news.yahoo.co.jp/articles/d23cd94715ca3c272dc9cc571cfb62f74d32d0b2,10/23(木) 22:15
2025-10-24,09:28,TTL,総合,38,スポニチアネックス,大谷翔平　取材の輪に見覚えある顔が“乱入”　「僕のことが嫌い？」恨み節に「いい打者なんで…」大笑い,https://news.yahoo.co.jp/articles/3b31384730f55903b37a2222cbceecaf588ec526,10/24(金) 7:30
2025-10-24,09:28,TTL,総合,39,ねとらぼ,「車こすった！」慌てて夫にLINE→“長文即レス”が686万表示　「私の夫と交換してください」「100万点」,https://news.yahoo.co.jp/articles/57993e04869e1c443e4963f387d58ed3f381c96d,10/24(金) 8:30
2025-10-24,09:28,TTL,総合,40,スポニチアネックス,Snow　Man渡辺翔太　週4日で会っている人物　物件探し、スマホの契約・解約も一任している!?,https://news.yahoo.co.jp/articles/2e878f7c91719ac02dea619379337ce9a3dc2aec,10/24(金) 5:00
