scrp_date,scrp_time,genre_en,genre_jp,rank,media_jp,title,link,date_original
2024-09-27,14:06,TTL,総合,1,MLB.jp,【MLB】ドジャースが3年連続の地区優勝　大谷は勝ち越しタイムリー　メジャー23年ぶりの400塁打も達成,https://news.yahoo.co.jp/articles/e3e1799e5fd1bc4ad3926a080ff5fcf93f671fd8,9/27(金) 13:40
2024-09-27,14:06,TTL,総合,2,オリコン,シンガー・ソングライターのさユりさん死去　享年28　公式Xで夫が報告「皆様と心からご冥福をお祈りしたい」,https://news.yahoo.co.jp/articles/67829d2ecfd23e5c9291a194f50b024558908ced,9/27(金) 12:12
2024-09-27,14:06,TTL,総合,3,中国新聞デジタル,カープ野村祐輔投手が現役引退,https://news.yahoo.co.jp/articles/d8b9b2f812dda00cb036e3fb62c8904f62af5d57,9/27(金) 13:06
2024-09-27,14:06,TTL,総合,4,時事通信,自民新総裁、午後に選出　石破氏22道県、高市氏15府県でトップ,https://news.yahoo.co.jp/articles/b1d66604a751a0d6d289ac2fd1dcd7f30be81e67,9/27(金) 5:02
2024-09-27,14:06,TTL,総合,5,スポーツ報知,フリーマン右足首ねんざか…地区優勝決まる試合でＭＶＰトリオ一角が負傷交代、ドジャースに激震,https://news.yahoo.co.jp/articles/22ce1513799e995f18c0a90d12111b88e25a56e0,9/27(金) 13:20
2024-09-27,14:06,TTL,総合,6,テレビ朝日系（ANN）,【ANN独自】総裁選の党員票分析　石破氏と高市氏が激しいトップ争い,https://news.yahoo.co.jp/articles/cd997c6f1a27ac92119e82838fdcb71e95b46b72,9/27(金) 12:49
2024-09-27,14:06,TTL,総合,7,デイリースポーツ,斎藤知事、出直し選告知Ｘに驚きの１０万いいね　コメント欄も急きょ解放で６０００件超え殺到,https://news.yahoo.co.jp/articles/66ba6b005c49c1bd4f5e7ccdb94c363182c108a7,9/27(金) 10:58
2024-09-27,14:06,TTL,総合,8,スポーツ報知,朝ドラヒロイン女優「今年だけで４本目」の骨折を報告…激変した現在の姿「何やってんだよ」,https://news.yahoo.co.jp/articles/ea5076edbacbad6406dd9c075d021d9b87311a60,9/27(金) 11:30
2024-09-27,14:06,TTL,総合,9,スポーツ報知,目をいじった人気女性芸人、証明写真が完全に別人！「覚醒が止まらない」「めっちゃかわいい」と衝撃,https://news.yahoo.co.jp/articles/629a9b5d87e6068f33b5e442184d3e1ccba1550c,9/27(金) 10:55
2024-09-27,14:06,TTL,総合,10,みんかぶマガジン,全ては麻生太郎次第だった…「最後の帝王」が日本の未来を決める！高市か、小泉か、それとも「石破5度目の正直シナリオ」,https://news.yahoo.co.jp/articles/a2fdfd2e4c0999f268cdc306270829a7ffb4d6e8,9/27(金) 9:10
2024-09-27,14:06,TTL,総合,11,スポーツ報知,３４歳になった浅田真央さん　雰囲気ガラリな最新姿にファン騒然「かわいい」「メンバーすごい」,https://news.yahoo.co.jp/articles/447291a5dd9bdae228545ddeca52096136dbb891,9/27(金) 9:55
2024-09-27,14:06,TTL,総合,12,ゴルフのニュース,【中間速報】山下美夢有が8アンダー単独首位　古江彩佳は「75」と失速　原英莉花は2アンダー11位【日本女子OP 2日目】,https://news.yahoo.co.jp/articles/bda45355cbc6478af10992ad8dbaf6e97e45e81d,9/27(金) 13:06
2024-09-27,14:06,TTL,総合,13,デイリースポーツ,急転、麻生派が河野太郎氏→高市早苗氏を支持報道　田崎史郎氏「１回目からはがすと、河野さん泣いちゃいますよ」,https://news.yahoo.co.jp/articles/e54e1b830fc57fb7787f16fc9c4ecec77abb3d85,9/27(金) 13:02
2024-09-27,14:06,TTL,総合,14,スポニチアネックス,大谷翔平　自らの一打で悲願の地区優勝決めた！ヒリヒリ決戦で決勝打放ち絶叫　5万超ファン酔いしれる,https://news.yahoo.co.jp/articles/bb51707b0ddde5d91ce73f30a5d702177de33934,9/27(金) 13:40
2024-09-27,14:06,TTL,総合,15,RSK山陽放送,【台風情報 最新】「台風17号」「台風18号」に発達か　さらに新たな「台風のたまご」熱帯低気圧が沖縄の南に発生し今後勢力を強める可能性あり　今後の進路は?全国の天気への影響は?【27日午前11時半更新】,https://news.yahoo.co.jp/articles/aed8950b7343eecc6a9d36d5d25337252d19cd45,9/27(金) 8:46
2024-09-27,14:06,TTL,総合,16,モデルプレス,シンガー・さユりさんが死去 享年28 夫・アマアラシが報告,https://news.yahoo.co.jp/articles/c3b219c1b2e5fd3fe14e1a8c879cd01813f7da4f,9/27(金) 12:34
2024-09-27,14:06,TTL,総合,17,MONEY PLUS,第1号被保険者の場合は手取りが増える？ 社会保険の適用拡大により恩恵を受ける人とは,https://news.yahoo.co.jp/articles/6d89b7aea5999eab3932e36a4bfa796e3e1d375e,9/25(水) 7:30
2024-09-27,14:06,TTL,総合,18,産経新聞,自民総裁選　1回目投票結果は午後2時20分、決戦投票結果は3時40分ごろ判明の見通し,https://news.yahoo.co.jp/articles/3c14792c1ba08ae4439c3a1fd492d6223ace7661,9/27(金) 11:46
2024-09-27,14:06,TTL,総合,19,スポーツ報知,えー！山口智子の最新姿にネット「！？」「歳とって…」「いつの間に」唐沢寿明と結婚２９年,https://news.yahoo.co.jp/articles/af4fbd72eccae03fa6894f7fc20a9f5621e7edd9,9/27(金) 12:50
2024-09-27,14:06,TTL,総合,20,Full-Count,大谷翔平、過去20年で最高の「398」　残り「2」…迫る球団94年ぶり大台,https://news.yahoo.co.jp/articles/251e16357629de287ad324cbc08fe124e755ec34,9/27(金) 13:19
2024-09-27,14:06,TTL,総合,21,FNNプライムオンライン（フジテレビ系）,【独自】女優の山本美月さんと麻生祐未さんがドラマ撮影中に照明落下しケガ　山本さんが頭切り麻生さんが首の打撲も軽傷,https://news.yahoo.co.jp/articles/dcc8c38c0525f82ce9a3b9406bd14a98e7e96cc2,9/26(木) 17:58
2024-09-27,14:06,TTL,総合,22,スポーツ報知,大谷翔平が７回に勝ち越し適時打で雄たけび　勝てば地区優勝決定の一戦で値千金打,https://news.yahoo.co.jp/articles/60a0a65609a7612bd25dff096c25e4a57d3df4dd,9/27(金) 12:58
2024-09-27,14:06,TTL,総合,23,スポーツ報知,千代の富士さんの娘、超ミニの全身ショット「かわいい」「美人すぎます」松田翔太と結婚６年,https://news.yahoo.co.jp/articles/5548df8a2727259187aae4697c2bceeb34837228,9/27(金) 12:25
2024-09-27,14:06,TTL,総合,24,スポーツ報知,樽美酒研二、イケメン素顔にノックダウン！「セクシーさ増し増し」「心臓飛び出るかと」,https://news.yahoo.co.jp/articles/5e8ae68a5e38921e008f8efe07656d2e63306a78,9/27(金) 7:32
2024-09-27,14:06,TTL,総合,25,ゴルフ総合サイト ALBA Net,＜速報＞初日単独首位の古江彩佳はパー発進　同組の山下美夢有はバーディスタート,https://news.yahoo.co.jp/articles/eb396e51fc51ccb2260670f2dee57c700c563258,9/27(金) 7:22
2024-09-27,14:06,TTL,総合,26,FNNプライムオンライン,SNSに潜む危険性!閉店後に男が大暴れ「ビールだ!」店主が一部始終を投稿　同意なし投稿は「名誉毀損」で訴えられる可能性も　岩手・盛岡市,https://news.yahoo.co.jp/articles/0d18e9e4d524d180880b8d87f0be1954de0f5eb3,9/27(金) 13:02
2024-09-27,14:06,TTL,総合,27,RONSPO,「井上尚弥が義務を果たさないのは恥。私と対戦しないならベルトを返上しろ！」12月の対戦を見送られたWBA指名挑戦者アフマダリエフが怒りの挑発,https://news.yahoo.co.jp/articles/a369bb517d3ece104b0f05c2d2380dc2453e51c2,9/27(金) 7:29
2024-09-27,14:06,TTL,総合,28,まいどなニュース,「ミスドにいるけど何かいる？」「何でも嬉しいけどタイヤみたいなのは嫌」夫のひと言に「どれのこと？」「むしろ9割がたタイヤ」,https://news.yahoo.co.jp/articles/7e439fec0e8bcbafe26fe91387e2a174e27110b5,9/26(木) 11:50
2024-09-27,14:06,TTL,総合,29,スポニチアネックス,人気歌手・酸欠少女さユりさん　死去　28歳　機能性発声障害で7月から活動休止も,https://news.yahoo.co.jp/articles/3717d8676b463f941d4ae17a26d71e235870786a,9/27(金) 12:29
2024-09-27,14:06,TTL,総合,30,朝日新聞デジタル,岸田首相「党員票が多い候補」支持の意向伝える　麻生氏は「高市氏」,https://news.yahoo.co.jp/articles/d82855a3454e171846f0b1bacf687f3114d8f5cd,9/27(金) 11:16
2024-09-27,14:06,TTL,総合,31,オリコン,「これは完璧なイメチェン！」秋葉原のゲーセンにいた地味男性、美容師の手で別人級イケメンに「諦めないで！」,https://news.yahoo.co.jp/articles/d4cbd621bf99cd8ea9223eefd89ecffe3578a4e7,9/27(金) 11:30
2024-09-27,14:06,TTL,総合,32,スポニチアネックス,ドジャース・ロハスは左内転筋断裂　MRI検査で発覚もポストシーズンは強行出場　オフに手術予定と米報道,https://news.yahoo.co.jp/articles/de8f4caad31e667dd5d55d7c1bdced8bbeaa64bd,9/27(金) 9:22
2024-09-27,14:06,TTL,総合,33,日刊スポーツ,大谷翔平が勝ち越し打！「大谷とかいう神」「エグすぎる！どこまでも主人公や」SNS大興奮,https://news.yahoo.co.jp/articles/cd16c4bbc69d4b02dd7c63eb077cfb60123155db,9/27(金) 13:12
2024-09-27,14:06,TTL,総合,34,日刊ゲンダイDIGITAL,阪神「アレンパ」は風前の灯火…V逸の戦犯は誰だ？フロントの“見る目のなさ”は巨人と真逆,https://news.yahoo.co.jp/articles/0a02ab3828a47cb88c1c6e7e6724f94c2a8b52a7,9/27(金) 11:27
2024-09-27,14:06,TTL,総合,35,GAME Watch,さユりさん逝去。享年28歳,https://news.yahoo.co.jp/articles/42743aaea1950dd90ed90f894cdeeac0ee22c396,9/27(金) 12:41
2024-09-27,14:06,TTL,総合,36,日刊スポーツ,「酸欠少女」さユりさんが28歳で死去、夫「彼女は持病と闘い続け」シンガー・ソングライター,https://news.yahoo.co.jp/articles/de59a80c448c38196dbd2310640c6acf78e7ac8a,9/27(金) 12:54
2024-09-27,14:06,TTL,総合,37,スポニチアネックス,「神かよ」雄叫び適時打の大谷翔平にファン大興奮！「千両役者すぎ」さあ地区Vへ！！,https://news.yahoo.co.jp/articles/8fc4c73114c91c6d81b18e6e9d040ef24f7dc5b3,9/27(金) 13:05
2024-09-27,14:06,TTL,総合,38,中央日報日本語版,「大谷の５０号ホームランボール、私が先に捕った」　１０代少年が提訴,https://news.yahoo.co.jp/articles/2e32d9db768c08710f89301f88d4ba8c5a27ca07,9/27(金) 10:03
2024-09-27,14:06,TTL,総合,39,ねとらぼ,酸欠少女さユりが逝去、28歳　公式Xで夫が報告「どうかさユりさんが産んだ愛を変わらず受け取って」,https://news.yahoo.co.jp/articles/36ca21216e33c91b9efe8bbd6383d04742240613,9/27(金) 13:12
2024-09-27,14:06,TTL,総合,40,ENCOUNT,「人権派」のはずが…羽賀研二容疑者と共に逮捕　日本司法書士会連合会・副会長の報酬は月15万円,https://news.yahoo.co.jp/articles/7c077c5025fc199e2e4031fcb7eed5f08a94c3c1,9/27(金) 10:45
