scrp_date,scrp_time,genre_en,genre_jp,rank,media_jp,title,link,date_original
2024-07-26,14:07,domestic,国内,1,中日スポーツ,『校庭で高齢者にぶつかる、当時小学生の２人に賠償命令』 ひろゆきさんは判決を疑問視 「子供優先にしないと」「骨折はやり過ぎ」反応さまざま,https://news.yahoo.co.jp/articles/cb6be49d955b012a9f3be2833c59c839817f247b,7/26(金) 11:30
2024-07-26,14:07,domestic,国内,2,毎日新聞,当時小学生の2人に賠償命令　学校のグラウンドで女性にぶつかる,https://news.yahoo.co.jp/articles/3e90cf32410b5a8580f8219ded9112be11d75eee,7/25(木) 17:00
2024-07-26,14:07,domestic,国内,3,中日スポーツ,「畜生すぎる」 兵庫県知事への告発文書、職員２人目死亡報道『最後の一文』に衝撃 「そこまでするかよ」「想像以上に酷い話に」,https://news.yahoo.co.jp/articles/8e09502183051f360f5f0be5bdbaa30fa76b6cbc,7/25(木) 11:21
2024-07-26,14:07,domestic,国内,4,弁護士JPニュース,古いお札はいつから“使えなくなる”？ 「新紙幣発行＝タンス預金のあぶり出し」説の真偽とは【弁護士解説】,https://news.yahoo.co.jp/articles/877765c9492caa62162283b115719d42a01c1287,7/25(木) 10:40
2024-07-26,14:07,domestic,国内,5,毎日新聞,最上川氾濫で複数の孤立地区　自衛隊が救助活動　山形,https://news.yahoo.co.jp/articles/7942c936aab937c011f1f5e944f0e5e459933d74,7/26(金) 10:55
2024-07-26,14:07,domestic,国内,6,共同通信,宜野湾市長が東京のホテルで死亡、病死か,https://news.yahoo.co.jp/articles/a2b082794f824da8b2c67f9fac12e12ea84bab45,7/26(金) 11:55
2024-07-26,14:07,domestic,国内,7,日本ファクトチェックセンター,習近平国家主席が脳卒中で倒れた？ 椅子から転げ落ちたという画像が拡散【ファクトチェック】,https://news.yahoo.co.jp/articles/4d2c882472d294acf26617d6ea054430a4ca53c3,7/26(金) 13:36
2024-07-26,14:07,domestic,国内,8,FNNプライムオンライン,日傘を差した32歳女が車に何度もレンガ投げつける…被害者通報で現行犯逮捕　同様被害複数で警察が余罪追及　鳥取・米子,https://news.yahoo.co.jp/articles/a979af7dbbe7faab520926beefaa81500e2bea3f,7/25(木) 20:09
2024-07-26,14:07,domestic,国内,9,日テレNEWS NNN,店に飲食物持ち込みで『罰金1万円』、居酒屋で吐いたら『罰金1万円』　飲食店の独自ルール　法的な有効性は？【#みんなのギモン】,https://news.yahoo.co.jp/articles/6d571bc7b459f70738f089bf05c024295b8aef92,7/26(金) 7:02
2024-07-26,14:07,domestic,国内,10,読売新聞オンライン,「高度成長は日本人がよく寝ていたおかげ」「若者は遅寝遅起きの方がいい」…筑波大・柳沢正史教授が語る睡眠の真実,https://news.yahoo.co.jp/articles/ca94222bd36f019c62ae206c34ec94415a53ee24,7/26(金) 11:00
2024-07-26,14:07,domestic,国内,11,スポニチアネックス,吉村洋文知事　新型コロナ感染「悪寒ととにかく高熱です。それと頭痛」万博の大屋根リング視察は欠席,https://news.yahoo.co.jp/articles/ad57db13c4faa61104aced2433d7c5df9d9f2c2b,7/26(金) 11:51
2024-07-26,14:07,domestic,国内,12,J-CASTニュース,女子小学生に「首から水筒をかけたら危ないぞ」→防犯メールで警告　「いい人では？」の疑問に福岡県警が答えた,https://news.yahoo.co.jp/articles/08b9e0956aa58dc5a91e883146d8e7d20effc30f,7/23(火) 20:24
2024-07-26,14:07,domestic,国内,13,デイリースポーツ,東国原英夫氏　立憲民主党に「都知事選惨敗のけじめを取るべき」と指摘　選挙後には蓮舫氏とトラブルも,https://news.yahoo.co.jp/articles/26d611b2f66aa9b92cf86c4e9d4b0eac659b8925,7/26(金) 12:09
2024-07-26,14:07,domestic,国内,14,スポニチアネックス,連日の酷暑で…イオンの“画期的”な取り組み「イオンモールウォーク」話題「天才」「その発想はなかった」,https://news.yahoo.co.jp/articles/4ff8a895b8ff0df4ee8fcd61b450f6fdb555f60c,7/26(金) 10:06
2024-07-26,14:07,domestic,国内,15,読売新聞オンライン,大雨の救助要請で現場に向かったパトカーか、逆さまになった状態で発見…警察官２人行方不明,https://news.yahoo.co.jp/articles/78201a887f712281eb378e099de7ac05ff1a9843,7/26(金) 11:24
2024-07-26,14:07,domestic,国内,16,読売新聞オンライン,「特殊な警察」皇宮護衛官、現役若手が明かす仕事内容とは「普通の警察は事件の解決目指すが…」,https://news.yahoo.co.jp/articles/9a0947dd38e1396b7a6140a0bd34aed65330be98,7/26(金) 13:00
2024-07-26,14:07,domestic,国内,17,ABEMA TIMES,「マジか！」自転車のサドルの下がサビサビ…“あるもの”を使って見事に落とす裏ワザが、SNSで話題沸騰！「これは目からウロコ」「今までの苦労はなんだったんだ…」,https://news.yahoo.co.jp/articles/107228219f1c45d77cfed70d79e28c4c7c97e5c4,7/26(金) 12:06
2024-07-26,14:07,domestic,国内,18,朝日新聞デジタル,吉村知事がコロナ感染　30日まで療養　大阪府,https://news.yahoo.co.jp/articles/e50d8e5ada7d439c5d86b1043c3aa58ef467b17c,7/26(金) 12:45
2024-07-26,14:07,domestic,国内,19,FNNプライムオンライン,【独自】玄関ドア蹴り上げ「子どもを殺す」「早く死ね」3カ月間続く嫌がらせ…“虐待通報”の逆恨み　脅迫容疑で母親逮捕　宮城・大崎市,https://news.yahoo.co.jp/articles/4fd349cfc39cfdbd6427c765ef3a5a0d0c7f1b14,7/24(水) 14:13
2024-07-26,14:07,domestic,国内,20,関西テレビ,吉村知事が『コロナ感染』「今まで一度もかかったことはなかった」と知事　「第11波」に入ったと医師会　,https://news.yahoo.co.jp/articles/2cfec8eb6b5435e4a915e23f171df44a9ac963b4,7/26(金) 13:03
2024-07-26,14:07,domestic,国内,21,Yahoo!ニュース オリジナル 特集,津久井やまゆり園の事件から8年、「自分らしく生きる」知的障害者の自立生活と支える人々 ＃令和の人権,https://news.yahoo.co.jp/articles/12722225b80aee9ee40d856ba3459c749b31b7f6,7/25(木) 18:05
2024-07-26,14:07,domestic,国内,22,日刊スポーツ,カズレーザー「県政を前に進めたいなら、早く説明すればいい」パワハラ告発の斎藤兵庫県知事,https://news.yahoo.co.jp/articles/2a306b74e3f08427593b9bef7b77aaca4261321b,7/26(金) 10:22
2024-07-26,14:07,domestic,国内,23,よろず～ニュース,吉村洋文大阪府知事が新型コロナ感染「悪寒ととにかく高熱」「今回初めて陽性」,https://news.yahoo.co.jp/articles/764f72d9b995f914eb9775dd7ed0877a7945ba30,7/26(金) 12:31
2024-07-26,14:07,domestic,国内,24,47NEWS,「パンデミック条約」反対集会に１万人超、拡散する陰謀論　強制接種、その情報はどこから？「光の戦士」発言も,https://news.yahoo.co.jp/articles/e2ed1b3afe28fd3ffe99fe7246c0166a1e1d9615,7/26(金) 10:02
2024-07-26,14:07,domestic,国内,25,弁護士JPニュース,兵庫県知事“パワハラ疑惑”騒動広がるも辞職を否定… 住民の手で「辞めさせる」方法は？,https://news.yahoo.co.jp/articles/bbb58b0849f9e2f90733dccb4de4a2b4bf24d081,7/26(金) 11:43
2024-07-26,14:07,domestic,国内,26,朝日新聞デジタル,全学生の前で謝罪強要は「アカハラ」主張　元専門学校生が学校側提訴,https://news.yahoo.co.jp/articles/15841d9bb72e944d33c5438a3116e735c2ecd4bc,7/26(金) 12:09
2024-07-26,14:07,domestic,国内,27,FNNプライムオンライン,関越道で6台からむ事故　トラック運転の男性死亡、男女8人が軽いけが…下りで渋滞続く,https://news.yahoo.co.jp/articles/116188b24d8f8241658d93a3fa8c675aaf70153b,7/26(金) 12:46
2024-07-26,14:07,domestic,国内,28,読売新聞オンライン,具のほとんどないカレーライス、おかずははんぺんだけ…障害者グループホーム「恵」処分　利用者の住まい確保急務　支援の質確保へ外部の目,https://news.yahoo.co.jp/articles/4312b077452c6383e888ca9f0c0728fcfeada01a,7/26(金) 11:37
2024-07-26,14:07,domestic,国内,29,カナロコ by 神奈川新聞,【やまゆり園事件８年】美帆さん母の変わらぬ悲しみ、募る疑問　本当に分かっているのは「娘に二度と会えないこと」,https://news.yahoo.co.jp/articles/84cfdb5b11e3284b00c9765b5e0375e47bbd0c40,7/26(金) 5:01
2024-07-26,14:07,domestic,国内,30,テレビ朝日系（ANN）,今後1カ月程度は暑さが続く見通し…長期間の記録的高温に関する情報　気象庁が発表,https://news.yahoo.co.jp/articles/d1a06f079625c155da146a47adb5831d956e668e,7/26(金) 12:59
2024-07-26,14:07,domestic,国内,31,東海テレビ,甲子園出場経験も…県立菰野高校の野球部監督が部員に“体罰”か 既に指導から外れる 27日に三重大会準決勝,https://news.yahoo.co.jp/articles/04d18826cd094831ed4be31f53c8676e9db94706,7/26(金) 11:48
2024-07-26,14:07,domestic,国内,32,毎日新聞,浸水で動けなくなった車が何台も　被害男性が語った恐怖　山形・酒田,https://news.yahoo.co.jp/articles/9ae2f6a6cde97cb99d2ff752932801be30c6d4e2,7/25(木) 16:53
2024-07-26,14:07,domestic,国内,33,MBSニュース,【独自】大阪・吉村知事が新型コロナ感染「初めて陽性。悪寒ととにかく高熱」きょうの万博リング視察は欠席　きのうは沿線知事らと上京して北陸新幹線の早期全線開通を要望,https://news.yahoo.co.jp/articles/4f36155c045421ad79cbc7a1b0291a6d3658ff53,7/26(金) 11:00
2024-07-26,14:07,domestic,国内,34,日本農業新聞,山形で線状降水帯発生　予測間に合わず　河川氾濫、田畑に濁流,https://news.yahoo.co.jp/articles/7a5788b544d48cc38b3929ab6c242202571027fd,7/26(金) 9:30
2024-07-26,14:07,domestic,国内,35,日刊スポーツ,吉村洋文大阪府知事がコロナ感染「高熱と頭痛」全国的流行に「感染力強い」呼びかけも,https://news.yahoo.co.jp/articles/a1642ead1922c0ceb1713f108ffbdb28e2b45437,7/26(金) 12:54
2024-07-26,14:07,domestic,国内,36,東海テレビ,「買った土地が被差別部落に」と不動産業者に主張…不当な部落差別で契約解除求めた小学校教師の夫婦を減給処分,https://news.yahoo.co.jp/articles/083e1d11c83d0c4515c420a18472661f106c6243,7/25(木) 21:38
2024-07-26,14:07,domestic,国内,37,読売新聞オンライン,山形・秋田で記録的な大雨、１人死亡・３人不明…最上川が氾濫しパトカー流される,https://news.yahoo.co.jp/articles/642bb66485794bf0c135829f351578381f05e99d,7/26(金) 13:13
2024-07-26,14:07,domestic,国内,38,J-CASTニュース,へずまりゅう「鹿叩いたやろ！」観光客追い回して怒声...奈良公園で動画撮影「口だけじゃ鹿さんは守れない」,https://news.yahoo.co.jp/articles/095ac8ad78a5d4b2a54dd521a638a02142664ac0,7/26(金) 13:15
2024-07-26,14:07,domestic,国内,39,産経新聞,「おかねのけいさんはできません」自殺男性の遺族が再び提訴　新発見の「遺書」が焦点に,https://news.yahoo.co.jp/articles/1f9caaaf6f08f1134b9bea686db1aa0c50abb068,7/25(木) 18:17
2024-07-26,14:07,domestic,国内,40,tenki.jp,関西　今夏の暑さピークへ　土日は京都で38℃予想　8月上旬は記録的な猛暑の恐れも,https://news.yahoo.co.jp/articles/59ad25c742d4b173485c85dc0457ce24e5c34362,7/26(金) 11:56
