scrp_date,scrp_time,genre_en,genre_jp,rank,media_jp,title,link,date_original
2024-02-27,07:17,TTL,総合,1,千葉日報オンライン,「いつか起こると…」「社会に殺された」　山崎製パン工場で60代女性事故死、ネット上で悲痛な声　【急上昇ニュースのウラ】,https://news.yahoo.co.jp/articles/8048bdd4c0feb8b23a58b64d32270d05d436509a,2/26(月) 19:16
2024-02-27,07:17,TTL,総合,2,Hint-Pot,祖母の“ど直球”結婚理由「顔がいいから」　102歳で亡くなった祖父は「今でも通用するイケメン」,https://news.yahoo.co.jp/articles/c92ed6d7cd2777217b6a60df81d35098809dbaa1,2/26(月) 17:07
2024-02-27,07:17,TTL,総合,3,スポニチアネックス,吉田鋼太郎　撮影現場で微妙な距離感だった人気女優「気難しい女優さんなんだと」　意外な真実とは,https://news.yahoo.co.jp/articles/7a4387265c0c695947893cc990b7fcbf7e0dfd75,2/26(月) 22:50
2024-02-27,07:17,TTL,総合,4,デイリースポーツ,ダルビッシュ母、次男の壮絶な非行語る　自身も暴力受けるも「生きにくかったやろな」と理解,https://news.yahoo.co.jp/articles/a94b4f6a3b208b62f0158a8d091260ffece0f301,2/26(月) 21:57
2024-02-27,07:17,TTL,総合,5,スポーツ報知,４０歳・磯山さやかの美スタイルにファン騒然！たまらんニット姿「健康体」「こんなキレイな人はいない」,https://news.yahoo.co.jp/articles/44adaea93d104be221d23eb985134f6325d2a8a6,2/26(月) 19:53
2024-02-27,07:17,TTL,総合,6,デイリースポーツ,ダルビッシュ弟　ステージ４のがん闘病をＴＶで告白　母は「なんで賢太が、と言葉出なかった」,https://news.yahoo.co.jp/articles/ecc45a1f32f6e4524506a3ad3321f488058f8dab,2/26(月) 22:26
2024-02-27,07:17,TTL,総合,7,スポニチアネックス,伊藤美誠　パリ補欠は辞退へ「将来を背負っていく選手が経験すべき」世界選手権では“監督”ぶり話題も,https://news.yahoo.co.jp/articles/1ef13301e60aff136c79e8f1dce853baa7667349,2/26(月) 16:57
2024-02-27,07:17,TTL,総合,8,北海道ニュースUHB,どうしてスカート履いたらダメなの？ 4歳長男の告白を受け止めた母「どんなあなたでも好きだよ」―子どもの“LGBTQ+” 試行錯誤の教育現場と進まぬ大人の理解,https://news.yahoo.co.jp/articles/3ef8459fa346680907152d71d4d26e90c812a3ac,2/26(月) 16:59
2024-02-27,07:17,TTL,総合,9,西スポWEB OTTO！,電撃入籍！  フォロワー13万人超の人気女子ゴルファーがSNSで発表！  海辺の幸せショット公開  ファン騒然  仲間も続々祝福「あすかお姉様おめでとう」,https://news.yahoo.co.jp/articles/4feabdaed47bff1516d5fb5a974f94b14f8cc773,2/26(月) 20:44
2024-02-27,07:17,TTL,総合,10,MBSニュース,大阪大の入学試験で「試験監督が談笑」受験生ら訴え…抗議の受験生「阪大入試は一発勝負…みんな緊張しているのに許せない」大学側「笑うことはなかった」再試験行わない方針,https://news.yahoo.co.jp/articles/82b1ad5d35506776dbebba97eabc914a1be4f112,2/26(月) 16:31
2024-02-27,07:17,TTL,総合,11,まいどなニュース,おばあさん「家まで送ってくれませんか？」→「いいよ、乗って乗って！」優しさと感謝の詰まった話にSNS感動　実は「沖縄ではよく聞く話」ですと,https://news.yahoo.co.jp/articles/5569558208cd66cfacaf6a3582392b298542d26a,2/26(月) 17:10
2024-02-27,07:17,TTL,総合,12,テレビ朝日系（ANN）,世界的に愛されたマフラーが消える　群馬の町工場が120年の歴史に幕…決断の理由とは,https://news.yahoo.co.jp/articles/fa9c82e51ca91b4de290e41eb6ac8284be1c0860,2/26(月) 11:57
2024-02-27,07:17,TTL,総合,13,オリコン,子ども6人の家事・育児「妻に丸投げから」激変　“大家族芸人”お宮の松、家族円満の秘訣【オリコン　ライターズ】,https://news.yahoo.co.jp/articles/1d3049209e339a79c312992b2b6f6c4b8f9f09d9,2/25(日) 18:00
2024-02-27,07:17,TTL,総合,14,スポニチアネックス,ダルビッシュの母・郁代さん　割引品買い、米国もエコノミーで行く理由明かす「有はすごく成功しても…」,https://news.yahoo.co.jp/articles/57884b20cbaea52c1bb023988496991a92e59e82,2/26(月) 21:53
2024-02-27,07:17,TTL,総合,15,クランクイン！,えなこ、「ご報告」にファン震かん「めちゃめちゃビックリした」,https://news.yahoo.co.jp/articles/1437864359f5d903c8ef1506daba6aa2152e41f0,2/26(月) 20:38
2024-02-27,07:17,TTL,総合,16,HBCニュース北海道,札幌市のコンビニ３人死傷事件、亡くなったのは40歳の運営会社の社員と判明「弁当の注文が多く、たまたま応援に出向いていた。店舗と容疑者にトラブルなく、通り魔的な犯行」,https://news.yahoo.co.jp/articles/55e5de653a18fa138c3d1673325e8e94bb52c71f,2/26(月) 16:55
2024-02-27,07:17,TTL,総合,17,テレビ朝日系（ANN）,「俺が出るまで待っとけよ」東名あおり運転死傷事故の差し戻し控訴審でも懲役18年判決,https://news.yahoo.co.jp/articles/a47fbb2ea4a9b1d563bcbd42ce50af11b5d6409d,2/26(月) 12:58
2024-02-27,07:17,TTL,総合,18,FITNESS LOVE,透き通るような白肌の美しいビキニ姿を披露した26歳・保育士　職場のストレスから十二指腸潰瘍を発症した過去も,https://news.yahoo.co.jp/articles/96997206be1d85c75f30a5c8914926fd2e6a655c,2/27(火) 5:00
2024-02-27,07:17,TTL,総合,19,ENCOUNT,ヒロミ、46年前の貴重バイクを入手　「すごい良い状態」「こんな綺麗な個体が」と仰天,https://news.yahoo.co.jp/articles/0d5ad2af3bf57460fd989a2f65acc27d9f35fa01,2/26(月) 22:20
2024-02-27,07:17,TTL,総合,20,夕刊フジ,旧ジャニーズ問題、当事者の会・石丸志門氏は補償金額として１８００万円を提示される　補償金額開示、心証が悪くなるだけ,https://news.yahoo.co.jp/articles/0f396d7601fc2c1e0de0f95a6db787f142229e36,2/26(月) 17:00
2024-02-27,07:17,TTL,総合,21,J-CASTニュース,「もう自分を止められへん」解散発表のプラス・マイナス岩橋が複雑胸中　ラジオで言及の明石家さんまには感謝「師匠、ありがとうございます」,https://news.yahoo.co.jp/articles/edcc7b1eb80de7dd8c2b68b3c496b352280f5a16,2/26(月) 11:23
2024-02-27,07:17,TTL,総合,22,ENCOUNT,ミスコン受賞した女子大生→メディア業界目指すも…現実は狭き門「どんな形でもやってみたい」,https://news.yahoo.co.jp/articles/98847be0cc3d5612301e5b327faa605e70d42c3f,2/26(月) 10:30
2024-02-27,07:17,TTL,総合,23,RCC中国放送,「背中に刺さったガラスを抜いてくれ」忘れられない父との最後の会話　“血の跡残る枕”に託された願い,https://news.yahoo.co.jp/articles/f86a839bdeaa8130ce189163a3cfbf35a55f2e12,2/26(月) 16:02
2024-02-27,07:17,TTL,総合,24,スポニチアネックス,日本ハム　3.3阪神とのオープン戦で前本拠地の札幌Dと“お別れ”か　今年度で使用契約が終了,https://news.yahoo.co.jp/articles/69aba18b3051fd8d026f0879a1b53e943e9d1d3b,2/27(火) 2:00
2024-02-27,07:17,TTL,総合,25,デイリースポーツ,高嶋ちさ子　ダウン症の姉いじめた子に仕返し「放送できるか分かんないですけど」と話す,https://news.yahoo.co.jp/articles/d0cb8e893dabbf1e2beb20e7e4371034637843ec,2/26(月) 17:51
2024-02-27,07:17,TTL,総合,26,乗りものニュース,ロシア空軍に大打撃？「貴重な目」また墜落か ウクライナ軍が撃墜と発表,https://news.yahoo.co.jp/articles/77c8d734c3a6214eea1d05447b8ea790ea2ff07f,2/27(火) 6:12
2024-02-27,07:17,TTL,総合,27,Merkmal,「滋賀は京都の植民地か」 北陸新幹線「大阪延伸」に立ちふさがる、湖西線“並行在来線”化という悩ましき宿痾,https://news.yahoo.co.jp/articles/a4ac5086d4701001f5c581001c8d1b239e1b693c,2/27(火) 5:41
2024-02-27,07:17,TTL,総合,28,TBS NEWS DIG Powered by JNN,ステージ4【下咽頭がん】見栄晴さん　2度目の抗がん剤治療のため再入院　「放射線治療も平行して行ないます」,https://news.yahoo.co.jp/articles/e39ea1cd7dd38c509018f3f1394a65f9d168d62b,2/26(月) 13:36
2024-02-27,07:17,TTL,総合,29,婦人公論.jp,志尊淳「自己肯定感ゼロの闇の時代を10年間。1ヵ月ほぼ寝たきりの闘病生活で人生観が変わった。朝ドラ『らんまん』でファンの年齢層もひろがり」,https://news.yahoo.co.jp/articles/7e25e980aac6b7c65498f2fe6ecd8724d35e180e,2/26(月) 12:32
2024-02-27,07:17,TTL,総合,30,デイリースポーツ,ｐｅｃｏ、長男の七五三で騒動が　和装写真アップで着付け店にクレーム電話「申し訳ないことを」,https://news.yahoo.co.jp/articles/879d5aca4f1ad2514f9b99bf86f67a8fa38784e1,2/26(月) 10:04
2024-02-27,07:17,TTL,総合,31,Hint-Pot,「スイスにはないなんて…」　日本でなじみのスイーツ　中欧生まれの男の子が生まれて初めて食べたら…反応が話題に,https://news.yahoo.co.jp/articles/2b40d89ae2a6be04cc2e824cf9d90401f7fedec9,2/26(月) 13:20
2024-02-27,07:17,TTL,総合,32,ENCOUNT,元NHK青井実アナ、4月からフジ『Live News イット！』キャスター就任　パックンと再タッグ,https://news.yahoo.co.jp/articles/d17af29100bc89f8e8c242641f8dc1f0eb046db3,2/27(火) 5:00
2024-02-27,07:17,TTL,総合,33,Full-Count,打率1割台で戦力外→新天地で絶好調　OP戦打率6割…韋駄天31歳が「状態良さげ」,https://news.yahoo.co.jp/articles/561c05df092f94f5f211418122afedb8347333f3,2/26(月) 10:48
2024-02-27,07:17,TTL,総合,34,BuzzFeed Japan,「脳が…脳がバグるぅぅ！！」玄関に巨大な“マスキングテープ”!? その正体にネット驚愕→「えっ」「最初、理解できなかった」,https://news.yahoo.co.jp/articles/d6fd8a698fdf27f39691b2616e93e8fd01eaf65f,2/26(月) 20:00
2024-02-27,07:17,TTL,総合,35,日刊スポーツ,中村獅童が明かした３歳次男の両手小指欠損公表の苦悩「あの人にしか分からない痛みを蓄えて」,https://news.yahoo.co.jp/articles/f105f08942506a95331049fab0b3e885f28f8399,2/26(月) 23:53
2024-02-27,07:17,TTL,総合,36,オリコン,ダルビッシュ有の母がバラエティー初登場　闘病中の息子・賢太と“絆の物語”,https://news.yahoo.co.jp/articles/94e14eac2d325ecf4f0eb1fd1d4d8790143ae00d,2/26(月) 14:40
2024-02-27,07:17,TTL,総合,37,中日スポーツ,東名あおり運転「俺が出るまで待ってろよ」被告の捨てゼリフにネットは非難「まったく反省がない」「裁判官まであおるとか…」,https://news.yahoo.co.jp/articles/0b7bdad04d3cf19b846c4f34dd4704b1b0f971ff,2/26(月) 16:14
2024-02-27,07:17,TTL,総合,38,マグミクス,「第1話で撃墜」「初陣で拿捕」…不遇すぎるだろ！　と言いたくなる「ガンダム」3選,https://news.yahoo.co.jp/articles/a2c9685be4b6980130a488916968b47cfac636cf,2/27(火) 6:10
2024-02-27,07:17,TTL,総合,39,ねとらぼ,「本人かと思った」「めっちゃ似てる」　日本破った卓球中国代表監督、チョコプラ松尾との「激似ぶり」に騒然,https://news.yahoo.co.jp/articles/efff52c439ad2dc5a39ad4ccd1824079447e5e9e,2/26(月) 14:03
2024-02-27,07:17,TTL,総合,40,ABEMA TIMES,薬丸裕英&石川秀美、同期夫婦とハワイにある長女・玲美（27）のお店でランチ,https://news.yahoo.co.jp/articles/404da98d158a15fe6405d67b8ad605ecc71d3629,2/26(月) 21:40
