scrp_date,scrp_time,genre_en,genre_jp,rank,media_jp,title,link,date_original
2025-10-27,09:34,business,経済,1,ITmedia ビジネスオンライン,もう、ショッピングセンターはバンバンできない！　オープンから3カ月で退店のテナントも……　厳しすぎる“戦国時代”に突入したワケ,https://news.yahoo.co.jp/articles/c9ae1c0c5b2c73813548e2410eb37e2b7559ca23,10/27(月) 5:55
2025-10-27,09:34,business,経済,2,みんかぶマガジン,ヒグマに100メートル引きずられて殺された…「クマは焼いて食べるか、捨てるしかない」弁護士、怒りの告発「地域経済への深刻な影響」農作物被害は7億超に,https://news.yahoo.co.jp/articles/48839af0a8d62abddbaae49189282ba1086657d0,10/26(日) 9:10
2025-10-27,09:34,business,経済,3,みんかぶマガジン,「玉木る」と言われ人気ガタ落ち国民民主と「減税潰しの維新の高笑い」…左派的ポピュリズムを始めた高市政権が日本経済を潰しにかかる,https://news.yahoo.co.jp/articles/8eb1c4c110176f844d240c5b86b3c64b24c71d13,10/27(月) 9:10
2025-10-27,09:34,business,経済,4,ファイナンシャルフィールド,10年ほど前に祖父から「1000万円」の“贈与”を受けたのですが、当時は贈与税の申告が必要なことを知らず、何もしなかったです。今からでも申告するべき？,https://news.yahoo.co.jp/articles/13f34a46eaf81513b134b731699088912f449323,10/27(月) 6:10
2025-10-27,09:34,business,経済,5,ハフポスト日本版,鳩サブレー「豊島屋」の鎌倉エコバッグが「センス良すぎ」と反響。「便利でうれしいセット」と絶賛する声も,https://news.yahoo.co.jp/articles/c302a6ffb86d59bf6257e30f663df288fb06a286,10/26(日) 14:41
2025-10-27,09:34,business,経済,6,TBS CROSS DIG with Bloomberg,首都圏中古マンション　1億超の都心と3000万円台の郊外　“荒川を超える”と変わる首都圏の価格差,https://news.yahoo.co.jp/articles/6e9042270a49c3be983c06190fbbdbff74211dfc,10/26(日) 9:00
2025-10-27,09:34,business,経済,7,ファイナンシャルフィールド,主人が骨折してしまい、今年は医療費が10万円を超えそうです。確定申告をすると医療費控除でどのくらい戻るのか、目安を教えてください。,https://news.yahoo.co.jp/articles/8c345df7be95a2cb8f463dfe8cc6ba2264802422,10/27(月) 6:20
2025-10-27,09:34,business,経済,8,Webikeプラス,ホンダ新型V3ターボマシンはプロアーム&トラスフレームのネイキッド！？ ついに姿の一部が明らかに,https://news.yahoo.co.jp/articles/82899127caae550aef61e8264984c6a0d8c3acaa,10/27(月) 6:40
2025-10-27,09:34,business,経済,9,日本農業新聞,中国は日本の30倍…シャインマスカット流出拡大　ライセンス許諾も「効果は未知数」の声,https://news.yahoo.co.jp/articles/38535046b7893a15f9ba005a175c043f2f89a6f7,10/27(月) 7:30
2025-10-27,09:34,business,経済,10,ITmedia ビジネスオンライン,くら寿司“しょうゆボトルなめ女”問題　「損害賠償請求しないほうがいい」と考える3つの理由,https://news.yahoo.co.jp/articles/ebcdd8143e5c2a3dfda4318fecbc751aa1fa3dbd,10/22(水) 7:40
2025-10-27,09:34,business,経済,11,LIMO,【生活保護】生活保護＋障害がある人がもらえる「障害者加算」とは？生活保護に含まれる「8つの扶助」も解説,https://news.yahoo.co.jp/articles/5970eb9c14ed6f1c0e16592020eb2c39b54987a0,10/26(日) 6:45
2025-10-27,09:34,business,経済,12,AUTOCAR JAPAN,次世代グリルと39.1インチタッチスクリーン採用　メルセデス・ベンツ新型『GLC』欧州発売　約1200万円から,https://news.yahoo.co.jp/articles/2f902a6564c35d3f78387650741bcbd5fd6f5fbc,10/27(月) 6:45
2025-10-27,09:34,business,経済,13,ENGINE WEB,フェラーリのランボルギーニに対抗する？　次世代のプロジェクト発表！　その名は「F76」,https://news.yahoo.co.jp/articles/5847d085d2f385eb7a81c964a8b3176eca22b0bb,10/27(月) 8:00
2025-10-27,09:34,business,経済,14,関西テレビ,『約3.8万人から集めた出資金2000億円超』は「もうほぼない」『みんなで大家さん』元関係者が「自転車操業」の実態を明かす　出資者は「半分でもいいから返してほしい」,https://news.yahoo.co.jp/articles/3572773f9c7d0697e0e5830bfd57cdaea047bba0,10/25(土) 11:00
2025-10-27,09:34,business,経済,15,ITmedia ビジネスオンライン,「日本版AIバブル」か？　データセクションに見る日本市場の熱狂と恐怖,https://news.yahoo.co.jp/articles/98d414f2b2d942a0a4350d48ca29a0020bc8de85,10/27(月) 8:10
2025-10-27,09:34,business,経済,16,ファイナンシャルフィールド,【給付金】住民税非課税世帯への「2万円給付」は高市首相で“見送り”に？ 実施の場合「正社員・手取り16万円」の自分に恩恵はあったのでしょうか？,https://news.yahoo.co.jp/articles/0ca9b561e92986517134ecb03690334cb5ebcf9a,10/26(日) 13:20
2025-10-27,09:34,business,経済,17,ファイナンシャルフィールド,10年前に加入した保険が満期を迎え、300万円を受け取りました。これは「所得」として確定申告が必要でしょうか？,https://news.yahoo.co.jp/articles/33bc9e871318ab476782cfc9b83d3e4f199d3700,10/26(日) 6:40
2025-10-27,09:34,business,経済,18,ファイナンシャルフィールド,退職金「2500万円」で住宅ローンの残債「1000万円」を一括返済しようと考えています。貯金も500万円ほどあるので、問題ないですよね？,https://news.yahoo.co.jp/articles/3330506e4e4827fd22559144ae7698203dac7868,10/26(日) 8:10
2025-10-27,09:34,business,経済,19,ファイナンシャルフィールド,金沢旅行で「北陸新幹線」に乗りますが、夫が普通席ではなく“グランクラス”を希望…「1万8000円」も高いので反対なのですが、料金に見合う価値があるんですか？,https://news.yahoo.co.jp/articles/ec8f2eaebfe17a57a0c19a9117d290520c5b9ce2,10/25(土) 13:40
2025-10-27,09:34,business,経済,20,くるまのニュース,【タイ】新車約213万円！ トヨタ「ハイラックスチャンプ」に反響殺到！ 「これで十分でしょ！」！ 「実用特化」な“カクカク”ボディに5速MT＆「人員輸送」仕様も!? 日本展開にも期待高まる,https://news.yahoo.co.jp/articles/2a37ea7742004bad2182dab663cdc48e4fd90938,10/27(月) 7:00
2025-10-27,09:34,business,経済,21,ファイナンシャルフィールド,定年退職した友人が「団地に住めば家賃が2万円になる」と言っていました。今住んでいる一軒家から“公営の団地”や“UR賃貸住宅の団地”へ移り住むことは可能なのでしょうか？,https://news.yahoo.co.jp/articles/1119d32155707ddfda0b8436c70e0f1273725202,10/24(金) 13:40
2025-10-27,09:34,business,経済,22,乗りものニュース,ドローンにミサイルってコスパ悪すぎますよね？ レーザーで安く撃ち落とすべきですよね？――防衛大手の答えが「極力安い“ミサイル”」だった背景,https://news.yahoo.co.jp/articles/d660e3df157ec0c9232d55eff7955acbc511836f,10/27(月) 8:42
2025-10-27,09:34,business,経済,23,日本農業新聞,シャインマスカットの輸出低調　輸出先の景気低迷、海外産と競争も,https://news.yahoo.co.jp/articles/ca075226e9603cf24d21f7d09266252bbe899f43,10/14(火) 8:10
2025-10-27,09:34,business,経済,24,J-CASTニュース,高価格帯カフェチェーンで明暗　コメダは過去最高益、星乃珈琲店かかえるドトール・日レスHDは苦戦のワケ,https://news.yahoo.co.jp/articles/ba717e89e2d7f855352bf769facd4af2bce3419e,10/25(土) 17:00
2025-10-27,09:34,business,経済,25,読売新聞オンライン,空前の「抹茶ブーム」世界中のバイヤー訪れ破格の金額提示…生産・価格上昇の一方「日本人の茶離れ」懸念も,https://news.yahoo.co.jp/articles/6887521c07467e516552597c2532d8b12b80a68d,10/25(土) 14:19
2025-10-27,09:34,business,経済,26,産経新聞,人手不足の近畿企業で外国人雇用意欲高まる　15・8％が採用拡大　高市政権どう向き合う,https://news.yahoo.co.jp/articles/5c8d27ee8235ed423ab8f08534495cad803223b8,10/27(月) 8:12
2025-10-27,09:34,business,経済,27,36Kr Japan,世界に広がる「チャイナ式職業教育」、人材育成でも進む一帯一路,https://news.yahoo.co.jp/articles/596732df37cb4048ea2e0939ec01d6f89f521bd3,10/27(月) 8:02
2025-10-27,09:34,business,経済,28,くるまのニュース,NEXCOが「今ここで高速を降りなさい！」命令!? 悪質な「ルール無視の大型車両」をその場で“完全排除” 「100万円以下」の高額罰金の可能性も？ 道央道で合同取締り実施,https://news.yahoo.co.jp/articles/7f3d81d9ef402d4951f4df05164f5da3915cef10,10/27(月) 7:20
2025-10-27,09:34,business,経済,29,Bloomberg,日本国債の利回り曲線フラット化に賭ける取引、日銀利上げ観測で人気,https://news.yahoo.co.jp/articles/de7927153527381fac411d41a1a246fbd2093b91,10/27(月) 7:07
2025-10-27,09:34,business,経済,30,withnews,「何のために働いてたんだろう」高卒で就職、転職…体調を崩し休職　27歳で会社を辞めて移住した男性,https://news.yahoo.co.jp/articles/006272b36ed948d34929cdec4c1557ae59533f2a,10/26(日) 7:00
2025-10-27,09:34,business,経済,31,鉄鋼新聞,イボキンが超大型建物解体専用機を導入。日本最大級、大規模施工に対応,https://news.yahoo.co.jp/articles/2d56bbebb1125b3494dbcd30d22bbeb7bf2445b6,10/27(月) 6:03
2025-10-27,09:34,business,経済,32,共同通信,平均株価、初の5万円,https://news.yahoo.co.jp/articles/9fabd7a158b8f89e0a2b05898a52a6fda0a16b5f,10/27(月) 9:04
2025-10-27,09:34,business,経済,33,ロイター,ボーイング防衛品工場ストが13週目に突入、労組投票で会社提案否決,https://news.yahoo.co.jp/articles/4ae27b9aa83b36ce6ef7253d68a612202b67474e,10/27(月) 8:15
2025-10-27,09:34,business,経済,34,乗りものニュース,27日から「車の利用控えて」 首都高で“大規模”交通規制 トランプ大統領の来日で警視庁が厳戒態勢,https://news.yahoo.co.jp/articles/a5cc3b5db399fc25460fe60f4c5fc9ed1d37ff76,10/26(日) 7:42
2025-10-27,09:34,business,経済,35,36Kr Japan,「中国版エヌビディア」カンブリコン、7〜9月期売上高1300％増　AIチップの国産化が追い風に,https://news.yahoo.co.jp/articles/10ca0387a703fefdd9a14cc716833844028af2ed,10/27(月) 7:00
2025-10-27,09:34,business,経済,36,Aviation Wire,羽田空港、トランプ大統領来日で展望デッキ一時閉鎖も 　羽田空港は、米,https://news.yahoo.co.jp/articles/779a6e871b4137eba35b55ffc4949a13d4da0d71,10/26(日) 19:12
2025-10-27,09:34,business,経済,37,LIMO,【確定申告不要制度とは？】「国民年金・厚生年金」の受給者《確定申告が必要な人・不要な人》をチェック！,https://news.yahoo.co.jp/articles/5db689b6042711567aed1abd3780ec38b437f16e,10/26(日) 19:05
2025-10-27,09:34,business,経済,38,乗りものニュース,35年越しの鉄道“再国有化”も「ふざけるな！」 劣悪サービス“ますます低下” 鉄道先進国「失敗の失敗ぶり」に国民怒り,https://news.yahoo.co.jp/articles/c59e58dc7f83daccba362ea9edc7555a1c85e8bf,10/27(月) 6:12
2025-10-27,09:34,business,経済,39,ファイナンシャルフィールド,「2万円給付金」は“住民税非課税世帯”に支給予定が取りやめに!? 代わりに「給付付き税額控除」を検討中らしいけど、中間層にも“恩恵”はあるの？,https://news.yahoo.co.jp/articles/f6ef5be9c6703850f53e9d2a6673ac8ed73cf296,10/25(土) 13:30
2025-10-27,09:34,business,経済,40,ニュースイッチ,燃費3割減…JR西日本が導入へ、ハイブリッド式新型事業用車の機能,https://news.yahoo.co.jp/articles/2516db10c01f46356aa768a46dd532031b9d9a53,10/27(月) 9:10
