scrp_date,scrp_time,genre_en,genre_jp,rank,media_jp,title,link,date_original
2025-10-21,12:23,TTL,総合,1,RONSPO,「1位同士がいくのが日本シリーズ。2位がいくべきじゃない」CS最終決戦で惜敗した日ハム新庄監督の問題発言がSNSで「思っていても口にしちゃアカン」と炎上騒ぎ…その真意とは？,https://news.yahoo.co.jp/articles/a6265d966101f4f32b721b88034aec16373ba39d,10/21(火) 8:36
2025-10-21,12:23,TTL,総合,2,くるまのニュース,トヨタ新型「ランドクルーザーFJ」世界初公開！ シリーズ最小モデル投入で群展開を拡充、26年年央に発売へ,https://news.yahoo.co.jp/articles/a5325aceb1eefabd34496d5ed747473e3a5f9682,10/21(火) 5:00
2025-10-21,12:23,TTL,総合,3,デイリースポーツ,「モーニングショー」山口真由氏後任女性　吉村代表批判「きょうはそれだけ言いたくて来た」「切られるのはアナタ！です」繰り返し視聴者に訴え,https://news.yahoo.co.jp/articles/8c62fe4dd82eee693c63486b82c2fff1c55b7078,10/20(月) 18:03
2025-10-21,12:23,TTL,総合,4,ねとらぼ,「こんなことある？」　ジョブチューンで“全員不合格”のセブン-イレブン商品に騒然　「マジかよ」「衝撃だよこれ」,https://news.yahoo.co.jp/articles/c558e44adfd45f6e3ecd39d28b9f1d5bdb105062,10/21(火) 6:30
2025-10-21,12:23,TTL,総合,5,日刊スポーツ,井川意高氏、堀江貴文氏に”衝撃通達”「これからは批判させてもらいます　もう無理です」,https://news.yahoo.co.jp/articles/3683ec455140928c096a50912c00179f21415df8,10/21(火) 8:10
2025-10-21,12:23,TTL,総合,6,スポニチアネックス,楽しんご、新幹線グリーン車で赤ちゃんがギャン泣き…「申し訳無いけど本当に嫌」と吐露,https://news.yahoo.co.jp/articles/e62cdbf1298a3e81ef51cdd0536210c7dfc7c3d4,10/20(月) 22:01
2025-10-21,12:23,TTL,総合,7,デイリースポーツ,玉川徹氏　「保守というよりも右翼と言ったほうが分かりやすい」→連立合意書について→公明というブレーキがなくなり維新というアクセル,https://news.yahoo.co.jp/articles/055fe58cefd7411621a8e9077a4715c2ae470e93,10/21(火) 9:45
2025-10-21,12:23,TTL,総合,8,サンケイスポーツ,巨人・岡本和真は今オフメジャー移籍見送りか　ロメロ記者伝える「プロ野球界で最高の打者」　代理人はスコット・ボラス氏,https://news.yahoo.co.jp/articles/65cd18174ccfaeb7f1f6351a9bdc093bcd4d3f5a,10/21(火) 3:07
2025-10-21,12:23,TTL,総合,9,共同通信,トランプ氏、大谷選手称賛　二刀流「驚異的だ」,https://news.yahoo.co.jp/articles/b5d0d99ec152243d20c3dd1de758eae890d819c7,10/21(火) 7:53
2025-10-21,12:23,TTL,総合,10,ねとらぼ,彼女「簡単なものでいい？」→彼氏が“お弁当”を開けてみると……　「全然簡単じゃない」「最高かよ」「絶対逃してはいけない」,https://news.yahoo.co.jp/articles/1cc533e52bdf12482b80adcd70e16eb3eb25319f,10/21(火) 11:20
2025-10-21,12:23,TTL,総合,11,日刊スポーツ,国民・玉木雄一郎氏、自維「議員定数の削減」に一転慎重姿勢「トーンダウン」合意文書にツッコミ,https://news.yahoo.co.jp/articles/7b8a032dd3b001eba6006cadfa9511ec7d3d09b6,10/21(火) 8:59
2025-10-21,12:23,TTL,総合,12,スポーツ報知,【阪神】藤川球児監督、日本シリーズ中の帰宿時間の緩和を検討「外食に行くのがダメなんじゃなくてすごく重要な時間になる」,https://news.yahoo.co.jp/articles/3cbc6e52aa462e559d6e77bf5453a027a15c7073,10/21(火) 5:00
2025-10-21,12:23,TTL,総合,13,よろず～ニュース,保守党・百田代表、首班指名で高市氏の支持を明言「記者たちは『聞くんじゃなかった』という顔」,https://news.yahoo.co.jp/articles/d7b865155f360504e461a7782f425ac32a2a7412,10/21(火) 7:01
2025-10-21,12:23,TTL,総合,14,日刊スポーツ,ロバーツ監督、ポストシーズンMVP投手を発表「アンビリーバブル」「球界最高クラス」と大絶賛,https://news.yahoo.co.jp/articles/141c224ceabdcac9231d49c5375e8850a4432b9e,10/21(火) 11:13
2025-10-21,12:23,TTL,総合,15,スポーツ報知,工藤静香　豪華メンバーのオフショット＆鮮やかな手料理に反響「かわいい」「おいしそう」「髪の毛切りましたか？」,https://news.yahoo.co.jp/articles/b49c0ad029ceb49c44452879f2be3d3445d42df2,10/21(火) 7:28
2025-10-21,12:23,TTL,総合,16,産経新聞,小野田紀美氏を経済安保相に起用へ　高市総裁が方針　片山さつき氏と同様、高市氏の推薦人,https://news.yahoo.co.jp/articles/9882808fe9b75faf9bd0c5265e174ec772a0b8f0,10/21(火) 9:47
2025-10-21,12:23,TTL,総合,17,CNN.co.jp,ランナーが森でクマと格闘、「一かみで腕をやられた」　日本・妙高,https://news.yahoo.co.jp/articles/2104ca3fb6f39b67f762032ea554db4f7801a7c8,10/21(火) 8:45
2025-10-21,12:23,TTL,総合,18,みんかぶマガジン,【いよいよ自維N政権が爆誕】維新・NHK党が夢のタッグ！ 「信念を捨てた権力者」の経済政策は野党横取り…ここを見よ！投資家要注意なのは高市早苗総理じゃなくて…,https://news.yahoo.co.jp/articles/55a604a8459014af9cef7c8f4ea63f48681ba1a5,10/21(火) 9:10
2025-10-21,12:23,TTL,総合,19,デイリースポーツ,【自維連立】吉村代表、ニヤリ　生出演中に「財務相に片山さつき氏」テロップ「高市さん、本気でやり始めた」,https://news.yahoo.co.jp/articles/2d340af3c0e1bc723ae452e115004588d45fd8c3,10/21(火) 10:56
2025-10-21,12:23,TTL,総合,20,スポニチアネックス,ブルージェイズ32年ぶりワールドシリーズ！7回スプリンガー逆転3ラン　25日からドジャースと頂上決戦,https://news.yahoo.co.jp/articles/5cdcecbe46999377b0155d47c46464fe4fc7c087,10/21(火) 12:01
2025-10-21,12:23,TTL,総合,21,FNNプライムオンライン（フジテレビ系）,経済安保相に小野田紀美参院議員の起用固まる 閣僚への女性登用は2人にとどまる見通し,https://news.yahoo.co.jp/articles/a40a5d582f91174490411fb62d31819c0ca72b4a,10/21(火) 9:09
2025-10-21,12:23,TTL,総合,22,朝日新聞,財務相に片山氏、経産相に赤沢氏、外国人政策担当に小野田氏　新内閣,https://news.yahoo.co.jp/articles/fe3acdd42338fa2aaafae6a8f7b1d3fc25ad74f8,10/21(火) 9:31
2025-10-21,12:23,TTL,総合,23,ねとらぼ,毛をカットしてもらった猫→帰ってきた姿を見ると……「笑ったww」　何かに似ている“まさかの1枚”に「思わず吹いちゃった」,https://news.yahoo.co.jp/articles/c0a5b3d8cbccf11da253a72f6a8294bf4f613447,10/21(火) 8:30
2025-10-21,12:23,TTL,総合,24,FNNプライムオンライン（フジテレビ系）,トランプ大統領がゼレンスキー大統領と会談で激しい口論　「何度も怒鳴り合い…トランプ氏が罵声浴びせ続けた」と米メディア,https://news.yahoo.co.jp/articles/e2a7b892581470949ab19ab4c7a87aab064530b0,10/21(火) 8:54
2025-10-21,12:23,TTL,総合,25,ねとらぼ,免許証更新の為に神田センターへ→到着したのは……　想定外の展開が2400万表示「なんか可哀想」,https://news.yahoo.co.jp/articles/82cc41b1f2e0cebcd3d7d0d6227db445965eb33d,10/21(火) 9:15
2025-10-21,12:23,TTL,総合,26,Full-Count,大谷翔平、MVPトロフィー“返却”の舞台裏　前日から置かれ…36歳リーダー感激「クール」,https://news.yahoo.co.jp/articles/77cda5a99b4ea6212c28602153c1be4fb96b2bb8,10/21(火) 11:42
2025-10-21,12:23,TTL,総合,27,スポーツ報知,「ＶＩＶＡＮＴ」続編、超豪華キャスト２６人発表　阿部寛、二階堂ふみ、二宮和也、松坂桃李ら…ＴＢＳ系来年放送,https://news.yahoo.co.jp/articles/6daaf7e98a5099eaf60e0813839c1f562c9dff40,10/21(火) 4:00
2025-10-21,12:23,TTL,総合,28,テレビ朝日系（ANN）,【速報】関越道上りでスポーツカーなど4台絡む事故　2人けが,https://news.yahoo.co.jp/articles/04b8ef869540f3eb2789e3b8ebd43853741f1425,10/21(火) 7:49
2025-10-21,12:23,TTL,総合,29,FNNプライムオンライン（フジテレビ系）,【速報】財務相に片山さつき氏の起用固まる,https://news.yahoo.co.jp/articles/c359fcac47588182817c0a88fa9a68a748c964ee,10/21(火) 8:57
2025-10-21,12:23,TTL,総合,30,FNNプライムオンライン（フジテレビ系）,赤沢亮正氏の経産相への起用固まる,https://news.yahoo.co.jp/articles/fa02c4c493fad558c3f6af69037fb02a39491fd6,10/21(火) 9:18
2025-10-21,12:23,TTL,総合,31,よろず～ニュース,76歳の名優、遠征先ではコインランドリーで洗濯　妻に任せっきりから変化、70代で新たな道【徹子の部屋】,https://news.yahoo.co.jp/articles/66f020294b198847533d62aad036bb8e740c8d92,10/21(火) 7:30
2025-10-21,12:23,TTL,総合,32,日刊スポーツ,ロバーツ監督、ワールドシリーズ先発ローテぶっちゃける「もし第７戦あれば」大谷翔平の起用法も,https://news.yahoo.co.jp/articles/89e6a5af9eb4424504a079f6659bf4ebe4cc230e,10/21(火) 11:03
2025-10-21,12:23,TTL,総合,33,日刊スポーツ,北村晴男氏、維新に言及「私はただ１点だけ、懸念を持っております。維新さんが必ずしも…」,https://news.yahoo.co.jp/articles/d38292d2b91a559cfdf4337e5309279766b7bb9b,10/21(火) 6:48
2025-10-21,12:23,TTL,総合,34,CoCoKARAnext,今オフ、移籍市場はベテラン外野手に注目か　「日本ハム32歳、元首位打者」「DeNA32歳、チームを引っ張るガッツマン」,https://news.yahoo.co.jp/articles/f7b067ae4e904b9a912a132af874fef91c0c9d35,10/21(火) 11:14
2025-10-21,12:23,TTL,総合,35,デイリースポーツ,杉村太蔵氏、国政語る吉村代表へ「ほれぼれしてます」も…「申し訳ないが、大阪府知事なんですよ」,https://news.yahoo.co.jp/articles/7df6afd276f6a525c805348fbf0013e866d32267,10/21(火) 11:26
2025-10-21,12:23,TTL,総合,36,スポニチアネックス,大谷翔平からのメッセージ？クラブハウスに「TEAM EFFORT」と書かれたトロフィー鎮座,https://news.yahoo.co.jp/articles/a77f8026d43b9fbf2821dc20fd4c6994e124a423,10/21(火) 7:40
2025-10-21,12:23,TTL,総合,37,スポーツ報知,「公明党はブレーキだった…維新はアクセル」玉川徹氏、高市早苗新政権誕生へ私見「完全に右側にかじを切っている」…「モーニングショー」,https://news.yahoo.co.jp/articles/00cdba2da24587205c655973fbc33ec8ca123cdc,10/21(火) 9:30
2025-10-21,12:23,TTL,総合,38,ねとらぼ,「激アツすぎる」　サイゼリヤで“奇跡の復活”遂げたメニューに歓喜続出　「これは嬉しい」「感動」「行かねば」,https://news.yahoo.co.jp/articles/74e3d6d173ff871481da054333f2828a6b6a7604,10/21(火) 7:00
2025-10-21,12:23,TTL,総合,39,RONSPO,「大谷翔平の偉業はスポーツ史上最高ではない？！」3本塁打＆6回10奪三振の史上初快挙を巡って異例の議論が起きる…“レジェンド”ジーター氏は「史上最高の選手とは言えない」と問題発言,https://news.yahoo.co.jp/articles/913d7e5f4f4c2dff90bb63d92b329a73726ff89b,10/21(火) 6:06
2025-10-21,12:23,TTL,総合,40,スポーツ報知,「ＶＩＶＡＮＴ」続編キャスト　まさかの人選にネット騒然「変わってる」「飯沼愛さんは？」「ちょっとショック」,https://news.yahoo.co.jp/articles/37d13eedf8f0811d7fa0a6445025e691ee6cbaac,10/21(火) 11:20
