scrp_date,scrp_time,genre_en,genre_jp,rank,media_jp,title,link,date_original
2025-10-21,15:11,world,国際,1,CNN.co.jp,ランナーが森でクマと格闘、「一かみで腕をやられた」　日本・妙高,https://news.yahoo.co.jp/articles/2104ca3fb6f39b67f762032ea554db4f7801a7c8,10/21(火) 8:45
2025-10-21,15:11,world,国際,2,朝鮮日報日本語版,美貌の女子大生（35）が5カ月間で4人殺害、ブラジル社会震撼,https://news.yahoo.co.jp/articles/92954729ac9ff37e911fb815626525e496314bbe,10/21(火) 11:33
2025-10-21,15:11,world,国際,3,CNN.co.jp,旅客機が緊急着陸　客室乗務員と連絡取れず、操縦室のドアをたたく音,https://news.yahoo.co.jp/articles/e25d2441c3aa88d6494e2d4958ef959de805e92e,10/21(火) 12:30
2025-10-21,15:11,world,国際,4,中央日報日本語版,オーストラリアの砂漠に燃えながら落ちた物体…奇異な形に当局が調査に乗り出す,https://news.yahoo.co.jp/articles/46cbc26c63b4ecb848dad40577f47688bad63930,10/21(火) 10:50
2025-10-21,15:11,world,国際,5,FNNプライムオンライン（フジテレビ系）,トランプ大統領がゼレンスキー大統領と会談で激しい口論　「何度も怒鳴り合い…トランプ氏が罵声浴びせ続けた」と米メディア,https://news.yahoo.co.jp/articles/e2a7b892581470949ab19ab4c7a87aab064530b0,10/21(火) 8:54
2025-10-21,15:11,world,国際,6,中央日報日本語版,ファン支援機能を停止して「すでに3500万ドル稼いだ」…米人気ユーチューバー、異例の宣言,https://news.yahoo.co.jp/articles/c186ae39c08cd38c86269c341be5daa4f87f41c3,10/21(火) 13:43
2025-10-21,15:11,world,国際,7,中央日報日本語版,エプスタイン事件を暴露した米女性、「アンドルー王子に性奴隷のように扱われた」,https://news.yahoo.co.jp/articles/27010b87dbccfafdc3fa23fdff5332ef1ffd2ee4,10/21(火) 9:43
2025-10-21,15:11,world,国際,8,FNNプライムオンライン（フジテレビ系）,トランプ大統領が大谷翔平選手を「最高の選手」と絶賛,https://news.yahoo.co.jp/articles/4c450a2d28812ffe49d2a5a77d11c0a6450a761f,10/21(火) 7:51
2025-10-21,15:11,world,国際,9,中央日報日本語版,実の娘に277回性的暴行…生まれた孫娘にも手を付けた70代の男に懲役25年＝韓国,https://news.yahoo.co.jp/articles/051347c89cd013d1781a077eb2e708f0098a5cdc,10/19(日) 9:33
2025-10-21,15:11,world,国際,10,FNNプライムオンライン（フジテレビ系）,高市新首相誕生で中国国営メディアが速報　「日本の右派政治家の代表格の1人…防衛費の増額を主張」,https://news.yahoo.co.jp/articles/06f237c951dbaedb9c7ff615eefb2ec072c0ab65,10/21(火) 14:27
2025-10-21,15:11,world,国際,11,中央日報日本語版,ゼレンスキー氏、再び屈辱…トランプ氏「もううんざり」と地図を投げつけ罵倒,https://news.yahoo.co.jp/articles/7e891a0cbdbe1a13e41c37e2cd9546856451cc70,10/21(火) 6:50
2025-10-21,15:11,world,国際,12,KOREA WAVE,日本アニメは大ヒットなのに、なぜ韓国映画は振るわないのか [韓国記者コラム],https://news.yahoo.co.jp/articles/307f7ccdc897ffb439cb4d82e0993fcbd256b589,10/21(火) 4:33
2025-10-21,15:11,world,国際,13,中央日報日本語版,カンボジアで殺害された韓国人大学生、現地で司法解剖…臓器摘出の有無も調査,https://news.yahoo.co.jp/articles/81597330fb79da0a8db4133d1f66f04318908f28,10/17(金) 13:28
2025-10-21,15:11,world,国際,14,FNNプライムオンライン（フジテレビ系）,若手ピアニストの登竜門「ショパン国際ピアノ・コンクール」で東京都出身の桑原志織さん（30）が4位入賞,https://news.yahoo.co.jp/articles/f0668d64447c5f9723591d1e696d510f2b27f193,10/21(火) 13:15
2025-10-21,15:11,world,国際,15,中央日報日本語版,韓国外交部「門前払い」の釈明に対し…拘禁被害者「大使館の哨所からも追い出された」,https://news.yahoo.co.jp/articles/511d0c0fc4e78c4a117d47c0cb407e0b64fdd9aa,10/21(火) 13:43
2025-10-21,15:11,world,国際,16,朝鮮日報日本語版,「韓国旅行でトイレに衝撃を受けた」　驚く外国人続出の理由とは,https://news.yahoo.co.jp/articles/15d6a3065ac628ea3cead1cabbd9228db7f24a37,10/20(月) 11:35
2025-10-21,15:11,world,国際,17,KOREA WAVE,「サイバーレッカー」被害、一般市民は到底対応できない…人気ユーチューバー、韓国国会で涙の訴え,https://news.yahoo.co.jp/articles/08dabbee61c9ecb3714cd2b3051177d2cf3ed116,10/21(火) 14:06
2025-10-21,15:11,world,国際,18,CNN.co.jp,トランプ米政権によるポートランドへの州兵派遣、控訴裁が認める判決,https://news.yahoo.co.jp/articles/38f7ec1a8d98f721106cacee58a440d9da639cc0,10/21(火) 13:51
2025-10-21,15:11,world,国際,19,BBC News,ロイヤル・アルバート・ホールが揺れた……大相撲ロンドン公演、ネットのファン層が集まる,https://news.yahoo.co.jp/articles/5211c249169bbc2e2d7fa7b745730166a669400d,10/21(火) 12:01
2025-10-21,15:11,world,国際,20,聯合ニュース,ソウル都心のオフィスビルで火災　1時間半後に鎮火＝125人が避難,https://news.yahoo.co.jp/articles/edf7c9a04afb98668be071265b6b6717f5dc19fd,10/21(火) 14:03
2025-10-21,15:11,world,国際,21,中央日報日本語版,カンボジアで「拷問死」した大学生、74日ぶりに韓国へ,https://news.yahoo.co.jp/articles/a6e71a01fbc29b207300b235ab0ae15cfa012bca,10/21(火) 14:00
2025-10-21,15:11,world,国際,22,ロイター,高市首相を選出、初の女性宰相　維新との連立政権発足へ,https://news.yahoo.co.jp/articles/8ce83b0bebdbd3724514cf021db50c55a504aebd,10/21(火) 13:52
2025-10-21,15:11,world,国際,23,中央日報日本語版,カンボジア在住韓国人「韓国人を含む20～30代、心臓まひで火葬場に多く来る」,https://news.yahoo.co.jp/articles/b20676031207fabfe1994f972c16f461455964ea,10/21(火) 14:35
2025-10-21,15:11,world,国際,24,共同通信,トランプ氏「私もあなたが嫌い」　豪ラッド駐米大使に酷評され,https://news.yahoo.co.jp/articles/41e9da2c9ddb6e20cf88c9cb137348ed1c533ea2,10/21(火) 11:40
2025-10-21,15:11,world,国際,25,中央日報日本語版,13万4429台を販売しておきながら…テスラ、バッテリー欠陥をめぐり批判の声＝韓国,https://news.yahoo.co.jp/articles/11728c497b78512a3e1b69b7ba463753c7a3595c,10/21(火) 7:26
2025-10-21,15:11,world,国際,26,中央日報日本語版,世界的名所のサグラダ・ファミリアにハングルの落書き…「国の品格損ねる」,https://news.yahoo.co.jp/articles/b489d665be6bd7fe3114c168a4dd9ae8a9dabe15,10/21(火) 10:36
2025-10-21,15:11,world,国際,27,FNNプライムオンライン,「人類の限界を超える瞬間を目撃」大谷翔平を“歴史に残る人物”として社会面で語るアメリカ主要メディアの興奮ぶり,https://news.yahoo.co.jp/articles/1dcf19960827c3047c6129bd2a5ff5c6afb9080f,10/20(月) 12:33
2025-10-21,15:11,world,国際,28,AP通信,大荒れのニュージーランド　木の枝が直撃男性1人が死亡,https://news.yahoo.co.jp/articles/9d149c0548b445c56f0d4f8acb03075be6548812,10/21(火) 13:46
2025-10-21,15:11,world,国際,29,読売新聞オンライン,米豪がレアアース共同開発で合意…トランプ氏「１年後には大量入手できるようになる」,https://news.yahoo.co.jp/articles/184f2fe792795a8e28bdf07eb6bd7d73e0494e4e,10/21(火) 13:19
2025-10-21,15:11,world,国際,30,KOREA WAVE,韓国人親子、ベンチ5席占拠して就寝…シンガポールの空港で「国の恥」、批判殺到,https://news.yahoo.co.jp/articles/d8cb64ddb62d9715b3114acdc346ca1b857ca1ce,10/21(火) 4:15
2025-10-21,15:11,world,国際,31,朝鮮日報日本語版,カンボジアに渡航した韓国人、毎年2000ー3000人帰国していなかった,https://news.yahoo.co.jp/articles/d7d5325d4e3823d271b01c92525a5aebf9d1c45c,10/21(火) 11:35
2025-10-21,15:11,world,国際,32,FNNプライムオンライン,韓国政府のサーバールームで爆発火災　システムダウンで郵便・ATM・保険手続き停止…未だ完全復旧ならず,https://news.yahoo.co.jp/articles/ba8981bebe1648ab06192ee6b6b4f665467b0074,10/21(火) 12:42
2025-10-21,15:11,world,国際,33,ＡＦＰ＝時事,不法滞在のアルジェリア出身女、12歳女児をレイプ殺人 仏,https://news.yahoo.co.jp/articles/ed76da09b1d9a007eb900f4013e3860506151746,10/18(土) 10:12
2025-10-21,15:11,world,国際,34,中央日報日本語版,ベンチ5席を占領して「昼寝」…「国の恥だ」と批判殺到、韓国人母娘が物議,https://news.yahoo.co.jp/articles/29726d2c83096507a1b0904b0aa456dfc86186d6,10/20(月) 15:15
2025-10-21,15:11,world,国際,35,毎日新聞,韓国メディア、高市首相の選出を一斉に速報　「保守色が濃くなる」,https://news.yahoo.co.jp/articles/93fcca722f96effe75cd68cf229af98350f333f4,10/21(火) 14:49
2025-10-21,15:11,world,国際,36,NNA,【中国】ヤクルト、広州第１工場を閉鎖,https://news.yahoo.co.jp/articles/539cb7ca6e4cd9e1511ffdf52cab958e461754d6,10/21(火) 11:30
2025-10-21,15:11,world,国際,37,朝鮮日報日本語版,曺国、『建国戦争2』を見た国民の力議員らに「普遍的常識に対する裏切り」,https://news.yahoo.co.jp/articles/1adef1e423f9084e2999f9a4ea9986018205f413,10/21(火) 14:25
2025-10-21,15:11,world,国際,38,テレビ朝日系（ANN）,【速報】ショパン国際ピアノコンクールで東京都出身の桑原志織さんが4位入賞,https://news.yahoo.co.jp/articles/dd9e09430882a3f1f57834dcc20d983376dc6a79,10/21(火) 10:01
2025-10-21,15:11,world,国際,39,BBC News,欧州部隊のウクライナ派遣、停戦が合意されれば「用意ある」　英国防相が発言,https://news.yahoo.co.jp/articles/7bfe33c6beb7ecf0053d177b7282ae801fc76e3d,10/21(火) 13:01
2025-10-21,15:11,world,国際,40,CNN.co.jp,購入した座席と違う、航空機で座席を「格下げ」された場合の対応とは,https://news.yahoo.co.jp/articles/f82f9a012cff388ffb7d5319f1757f4214797c64,10/19(日) 18:26
