scrp_date,scrp_time,genre_en,genre_jp,rank,media_jp,title,link,date_original
2024-11-06,03:07,sports,スポーツ,1,Full-Count,燕26歳が退団へ…SNSで報告「悲しいですが」　電撃表明にX騒然「え、うそでしょ」,https://news.yahoo.co.jp/articles/ad8c727bb7fab629ae764ff4f735b2b1eefcfce4,11/5(火) 20:03
2024-11-06,03:07,sports,スポーツ,2,日刊スポーツ,シドニー五輪銅の45歳田中雅美さん「孫が生まれました。おばあちゃんになりました」２Ｓ公開,https://news.yahoo.co.jp/articles/4db0549f7abe91f72fa11cfd40952f9e0e6f2393,11/5(火) 23:46
2024-11-06,03:07,sports,スポーツ,3,スポニチアネックス,ソフトバンク・和田毅　引退試合固辞した理由　「城島さんに怒られて…ずっとそういう気持ちで」,https://news.yahoo.co.jp/articles/a8c3222468bbe85c0f036512d0294eff2e0c809e,11/5(火) 17:49
2024-11-06,03:07,sports,スポーツ,4,スポニチアネックス,ドジャース・カーショー　残留オプション選択せずFAに　ヤンキース・コールは残留で合意,https://news.yahoo.co.jp/articles/616f1bc92355c820a37cd4a1bc440c2a6f02704e,11/6(水) 1:30
2024-11-06,03:07,sports,スポーツ,5,ABEMA TIMES,もうワケわからん… “火の玉すぎる”ストレートに「ドン引き」 MLB公認分析家が言及… 170キロ“剛速球”が「赤い藤浪」「スピード違反」,https://news.yahoo.co.jp/articles/1c27e4410ca246c21179decec32e40a9db1ed51f,11/5(火) 22:52
2024-11-06,03:07,sports,スポーツ,6,サンケイスポーツ,佐々木朗希に全米が熱視線　GM会議開幕前に記者に逆取材,https://news.yahoo.co.jp/articles/e44459cd6ac5f8c8aa568ab29b769d92412b0fb6,11/6(水) 2:10
2024-11-06,03:07,sports,スポーツ,7,TBS NEWS DIG Powered by JNN,柔道グランドスラム東京の代表発表　パリ五輪銀メダル村尾三四郎、銅メダル橋本壮市ら56人を選出,https://news.yahoo.co.jp/articles/c94bfde90e26d3bf80c683019019ccb57861da36,11/5(火) 21:24
2024-11-06,03:07,sports,スポーツ,8,スポニチアネックス,ソフトバンク・和田の引退会見　ダイエーユニ姿の人物駆け付けファン涙　「泣くしかないやん…」,https://news.yahoo.co.jp/articles/b17415beb3cc435048e9bb5d2f3e0bfde60ebd58,11/5(火) 20:18
2024-11-06,03:07,sports,スポーツ,9,スポニチアネックス,巨人・菅野に獲得候補4球団　メジャー移籍へ6日からGM会議　「NPBで最も成功した現役投手の一人」,https://news.yahoo.co.jp/articles/a0fc052076a48825d4aee0d336161f958b305d0e,11/6(水) 1:30
2024-11-06,03:07,sports,スポーツ,10,日刊スポーツ,【中日】FA権行使が注目される高橋周平は沖縄キャンプ同行せず「今言えることは何もありません」,https://news.yahoo.co.jp/articles/e40cc35a37c48576b7de665230a71cae71015f1a,11/5(火) 18:44
2024-11-06,03:07,sports,スポーツ,11,デイリースポーツ,競泳界のビッグカップル誕生に関係者も喜び　瀬戸大也は♥など３つずつで祝福、宮下純一氏は「めちゃくちゃ素敵なカップル　おめでとう」,https://news.yahoo.co.jp/articles/cded6f24e11f215cd3cc4372a033b2b0f24b9f5b,11/5(火) 19:45
2024-11-06,03:07,sports,スポーツ,12,日刊スポーツ,「睾丸が埋もれている」「生物学的に男」パリ五輪で性別騒動のヘリフ、報告書流出,https://news.yahoo.co.jp/articles/2883815cae6a44eb25db4f25b5d7478c79f5dcbc,11/5(火) 15:06
2024-11-06,03:07,sports,スポーツ,13,J-CASTニュース,日本シリーズ「3つ負けられる」で4連敗、小久保裕紀監督「発言」に嘆き　「余計なことを」「短期決戦で言ったらだめ」,https://news.yahoo.co.jp/articles/f578e288c404bb412afa5ee032c8c468484abc43,11/5(火) 12:06
2024-11-06,03:07,sports,スポーツ,14,TopNews,ドライバーズタイトル争いは終わったとマルコ博士が宣言！マクラーレン代表も認める,https://news.yahoo.co.jp/articles/d02775e5953679d6f334e499f881a708a7e3e6e1,11/6(水) 0:51
2024-11-06,03:07,sports,スポーツ,15,ABEMA TIMES,何が起きた…？ ド軍お騒がせ男の“予想外の姿”に「気絶しそう」 まさかの展開に… “変身”キケにファン熱狂「最高」「愛されすぎ」,https://news.yahoo.co.jp/articles/8f366292fb67226acd88c29da8d8074030d46e15,11/5(火) 23:42
2024-11-06,03:07,sports,スポーツ,16,サッカーキング,神戸、J1に続いてACLEでも首位浮上！　日本勢2連勝中の光州FCを撃破…宮代大聖は公式戦4戦5発,https://news.yahoo.co.jp/articles/e8c61ac0875bdbba43503aef99a27ad8773570e9,11/5(火) 20:58
2024-11-06,03:07,sports,スポーツ,17,RONSPO,今日からFA申請解禁…来季の巨人に日本シリーズで無安打に終わったソフトバンクの“世界一捕手”甲斐拓也は必要か？,https://news.yahoo.co.jp/articles/e4248041b613c667cea6a18443fa851928e47726,11/5(火) 6:54
2024-11-06,03:07,sports,スポーツ,18,デイリースポーツ,ドジャース「奥さま会」スミス夫人の熱い言葉に各選手の妻ら続々と同調「このグループが本当に素晴らしいことが分かりました」,https://news.yahoo.co.jp/articles/7e8065c8f09811cf10b8109ac069a8b6094a65c2,11/5(火) 19:24
2024-11-06,03:07,sports,スポーツ,19,Full-Count,ドジャース、T・ヘルナンデスへ33億円QOオファー　米報道…年俸ダウンで拒否か,https://news.yahoo.co.jp/articles/2155cbf4a8e540669a33f2ca4f33551b1929ac0a,11/5(火) 7:16
2024-11-06,03:07,sports,スポーツ,20,夕刊フジ,ソフトバンク・村上コーチに〝舌禍騒動〟独占直撃「いろいろ言っても仕方ない…」自身の発言で奮起、DeNA・東克樹が好投,https://news.yahoo.co.jp/articles/bd0b0198298723188e9dfe3f1775093be9134068,11/5(火) 17:00
2024-11-06,03:07,sports,スポーツ,21,デイリースポーツ,巨人　退団報告から異例の再契約へ　戦力外通告の直江大輔が１週間で復帰へ「ジャイアンツと再契約することになります」,https://news.yahoo.co.jp/articles/ab17692eafe1f68f2cbe5933590524c99e7565e6,11/4(月) 21:26
2024-11-06,03:07,sports,スポーツ,22,サンケイスポーツ,阪神・青柳晃洋、メジャー挑戦を電撃表明　球団がポスティング容認　マイナー契約も辞さず,https://news.yahoo.co.jp/articles/f95fa6ec29f66599117d1fefc1dabbf2b760b958,11/5(火) 23:41
2024-11-06,03:07,sports,スポーツ,23,theWORLD（ザ・ワールドWeb）,稀代のファンタジスタは引退へと向かっているのか　ネイマールが復帰2試合目で再び負傷,https://news.yahoo.co.jp/articles/af3672f0c1d53d793b5974aea0c463230f23b584,11/6(水) 2:00
2024-11-06,03:07,sports,スポーツ,24,スポニチアネックス,ドジャース世界一のWS第5戦中継視聴率8・7％　視聴者数は日本で過去最多の1試合平均1210万人,https://news.yahoo.co.jp/articles/a065c8a0a5c0904f7d8338a7caf81f35894a27b1,11/6(水) 1:30
2024-11-06,03:07,sports,スポーツ,25,スポニチアネックス,ソフトバンク・和田毅が現役引退　球界からねぎらい続々　「寂しい」「衝撃すぎて」「ゆっくり休んで」,https://news.yahoo.co.jp/articles/122f7419a41dbd770b36d346ffc04510db4fbf15,11/5(火) 19:49
2024-11-06,03:07,sports,スポーツ,26,超WORLDサッカー！,伊藤洋輝が中足骨を再手術　再離脱でさらに復帰ずれ込む…バイエルン発表,https://news.yahoo.co.jp/articles/30fa32beeb2610acda2048e5ff9fa261c2021202,11/5(火) 23:48
2024-11-06,03:07,sports,スポーツ,27,Full-Count,和田毅「どんどん体がボロボロに」　7月に妻に伝えた決断…会見で明かした引退の真相,https://news.yahoo.co.jp/articles/5626c94394c6b8d0e91b6b5a3f2f3e59a2040b7d,11/5(火) 17:02
2024-11-06,03:07,sports,スポーツ,28,ABEMA TIMES,こんなところに、井上尚弥！ 「気になってしょうがないw」予想外の出没にファン騒然,https://news.yahoo.co.jp/articles/631fb7e42715529a58532da0017497462d26ab5d,11/5(火) 23:16
2024-11-06,03:07,sports,スポーツ,29,ベースボールキング,侍ジャパン、広島との練習試合に5－0で勝利も…タイブレークに課題,https://news.yahoo.co.jp/articles/8eab6895bc16a320b0442e5a2a312ff022035f54,11/5(火) 15:48
2024-11-06,03:07,sports,スポーツ,30,Full-Count,ド軍カーショーがFAに　年俸7.6億円の来季契約を自ら破棄か…選手会発表,https://news.yahoo.co.jp/articles/5d6a94a7be6628a3489bd1cc3f1f3f91cb966b47,11/5(火) 9:49
2024-11-06,03:07,sports,スポーツ,31,motorsport.com 日本版,角田裕毅、F1サンパウロGPで予選3番手：これまで予選トップ5を記録した日本人ドライバーは5人,https://news.yahoo.co.jp/articles/02af824260f04ad5a4149d1f9b47e58f38cdadb7,11/5(火) 18:56
2024-11-06,03:07,sports,スポーツ,32,Full-Count,大谷翔平が呼ばれてるのに…「美味しいとこ獲った」　しゃしゃり出てきたド軍34歳に爆笑,https://news.yahoo.co.jp/articles/8154ec53167ad1d346025681c34f1f23b0ed9dc3,11/5(火) 18:42
2024-11-06,03:07,sports,スポーツ,33,サンケイスポーツ,阪神・前川右京、小谷野流練習に「めっちゃいい」,https://news.yahoo.co.jp/articles/2c18da17fa101f8a203e3feea00630f5647f437c,11/5(火) 23:53
2024-11-06,03:07,sports,スポーツ,34,FITNESS LOVE,産後1年弱でグランプリ獲得の31歳　子育てに奮闘しながら「スキマ時間」の宅トレで作り上げたメリハリボディ,https://news.yahoo.co.jp/articles/a36ab5bf11261d2f2785bfd1ce585bb1f6467153,11/5(火) 19:10
2024-11-06,03:07,sports,スポーツ,35,VITUP!,黒ビキニ、白ビキニどっち派？　ビキニフィットネス・Azusaの美ボディフォト撮影風景,https://news.yahoo.co.jp/articles/f80a2dc01361e99a5aec9859af89d2cf3f7d71db,11/5(火) 18:07
2024-11-06,03:07,sports,スポーツ,36,デイリースポーツ,南場オーナーからの温かい言葉にＤｅＮＡ・中川が涙　日本Ｓ制覇後のやり取りをＸで明かす　「感謝の気持ちを込めてビールかけました」とも,https://news.yahoo.co.jp/articles/ca4a208b4917b76e12188465e66e23de790bfd14,11/5(火) 17:46
2024-11-06,03:07,sports,スポーツ,37,CoCoKARAnext,日本一チームから流出も？　FA戦線目玉の一人　争奪戦必至の＂隠れキーマン＂　DeNA29歳外野手が「評価高まる理由」,https://news.yahoo.co.jp/articles/e818e3ab9326cd365d5bff7a68ebbd4e8d437e83,11/5(火) 12:25
2024-11-06,03:07,sports,スポーツ,38,RONSPO,米メディアが佐々木朗希のロッテの来季契約条件提示拒否報道を受けて早くも移籍先予想がヒートアップ…ドジャース、ヤンキース、メッツ、オリオールズなどの球団名が乱れ飛ぶ,https://news.yahoo.co.jp/articles/0a71c83d693c8c402c4ed78435d1365e74dc5647,11/5(火) 6:31
2024-11-06,03:07,sports,スポーツ,39,スポニチアネックス,江川卓氏　日本シリーズの予想が外れたことを潔く認めた「ソフトバンクが一番堪えたのは…」,https://news.yahoo.co.jp/articles/516b322328f81464d7e0052ab17a65adaf926ef8,11/5(火) 16:53
2024-11-06,03:07,sports,スポーツ,40,スポニチアネックス,シルバースラッガー賞　ドジャース・大谷2年連続?カブス・誠也が初受賞?　最終候補発表,https://news.yahoo.co.jp/articles/8aa9fff940a124a584d494072c0e343ce09627ec,11/6(水) 1:30
