scrp_date,scrp_time,genre_en,genre_jp,rank,media_jp,title,link,date_original
2024-02-18,04:13,domestic,国内,1,FNNプライムオンライン,「すごい音、尋常じゃない」19歳の男女2人に車突っ込む　男性は死亡…逮捕の女（72）「アクセルとブレーキ踏み間違えた」,https://news.yahoo.co.jp/articles/1f1ae9c79852daf7dc18e9312515b22043738e3c,2/17(土) 18:13
2024-02-18,04:13,domestic,国内,2,中日スポーツ,3月でレギュラー放送終了『ブラタモリ』は”マンスプレイニング”？　大学教授の投稿にSNS上では議論勃発,https://news.yahoo.co.jp/articles/229bbd88421f15472ccebf13309122ae606b3ca9,2/17(土) 22:22
2024-02-18,04:13,domestic,国内,3,中日スポーツ,ひろゆきさん『20年で利益100億円』個人投資家に驚き 「下手な上場企業より利益出しとるがな」 うらやむ声集まる,https://news.yahoo.co.jp/articles/d6d84524a05d6e8cd628397a00c7e019bbc2f65e,2/17(土) 20:43
2024-02-18,04:13,domestic,国内,4,読売テレビ,【特集】「仕事がない、何もできない、学もない」元力士が引退後に直面する“セカンドキャリア”問題　次なる“土俵”は『介護職』から『お笑い芸人』『力士専門芸能プロ』まで…多様化する選択肢とそれぞれの挑戦を追う,https://news.yahoo.co.jp/articles/10a39850a81e0404ab274ec7045e2f649f2d3623,2/17(土) 11:00
2024-02-18,04:13,domestic,国内,5,読売新聞オンライン,リンゴ詰まらせ男児重体、元調理師２人が「退職に追い込まれた」と労基署に相談…愛媛・新居浜,https://news.yahoo.co.jp/articles/3a6888e05a5cadeecafe986eb16ba5f4e5717e74,2/17(土) 14:04
2024-02-18,04:13,domestic,国内,6,ABEMA TIMES,給食ふりかけ持参で生徒と市議会が対立「食べ残しの問題がふりかけに集約されてしまった」「決め方に危機感を持っている」,https://news.yahoo.co.jp/articles/9fa6b1cae6549eb7a54cd78c77c7bacfa68cff69,2/17(土) 8:51
2024-02-18,04:13,domestic,国内,7,FNNプライムオンライン,人が行き交う中を…車が“歩行者専用”地下通路に進入　「注意したが無反応」70代女性が運転　神奈川・藤沢市,https://news.yahoo.co.jp/articles/3f5ad00858460c90569984ff2cea9fd80f4fbe7e,2/16(金) 6:13
2024-02-18,04:13,domestic,国内,8,Yahoo!ニュース オリジナル 特集,避難所運営になぜ女性が不足しているのか――性トラブルや健康被害を減らすためにできること #災害に備える,https://news.yahoo.co.jp/articles/cdaf138eec181be251910d18e712a859016d7e5f,2/17(土) 17:06
2024-02-18,04:13,domestic,国内,9,毎日新聞,教習所で卒検合格後の帰路で…高齢ドライバーにはねられ、19歳死亡,https://news.yahoo.co.jp/articles/a2b5c968480bd1b7f1efa57aa5b51b45150e62c7,2/17(土) 8:30
2024-02-18,04:13,domestic,国内,10,デイリースポーツ,森川ジョージ氏「はじめの一歩」アニメ化時の制作サイドとのトラブル明かす　出版社の及び腰も告白,https://news.yahoo.co.jp/articles/fd64a58299000220d7a5ebb06cc51060413837c9,2/17(土) 19:39
2024-02-18,04:13,domestic,国内,11,MBSニュース,「地震さえなければ100歳まで生きられた」98歳母親の災害関連死、息子悔やむ「避難所生活で言葉を発しなくなり、ご飯を自分で食べられなくなった」2次避難しない『選択の理由』を被災者に聞く【能登半島地震：取材リポート】,https://news.yahoo.co.jp/articles/e93b3d9bb50f0411a6b692bb455bda0f3d8e7d38,2/17(土) 7:02
2024-02-18,04:13,domestic,国内,12,FNNプライムオンライン,被害者は中国籍の男子高校生　浜名湖で殺人事件　死因は溺死　体には外傷…複数の皮下出血も　捜査本部設置【静岡発】,https://news.yahoo.co.jp/articles/a0a6140a0c4d9fd71965673ede8a438c2e998210,2/13(火) 22:03
2024-02-18,04:13,domestic,国内,13,共同通信,5歳女児がはねられ重体,https://news.yahoo.co.jp/articles/461e91801acd8fa300e233deea1d6d77fb3b5503,2/17(土) 23:31
2024-02-18,04:13,domestic,国内,14,関西テレビ,「築111年」寮費は月約2500円　最古の学生寮『京大・吉田寮』の立ち退きめぐる訴訟　裁判所は一部学生の継続居住を認める　歴史詰まった学生たちの居場所は守られた,https://news.yahoo.co.jp/articles/1b56144e5524789ea3087b12743ab6f87f75ef04,2/17(土) 10:20
2024-02-18,04:13,domestic,国内,15,中日スポーツ,三谷幸喜さん、1000年の歴史に幕『蘇民祭』中継でポロリを再三心配 「絶対期待してる」「不適切にもほどが」さまざまな声,https://news.yahoo.co.jp/articles/f1e9835574a109ab26eb404b4bfea2c7df4ca26a,2/17(土) 22:48
2024-02-18,04:13,domestic,国内,16,FNNプライムオンライン,"適量のカフェイン「認知症リスク」下げる　1日3杯のコーヒーで""発症リスク""は約半分に　ただし取りすぎは中毒になる危険性",https://news.yahoo.co.jp/articles/56349c403fa9422207925633cf0b2e5f20c41f23,2/16(金) 19:09
2024-02-18,04:13,domestic,国内,17,tenki.jp,2週間天気　来週から雨が続く　九州～関東で大雨の恐れ　激しい寒暖差　春のち冬に,https://news.yahoo.co.jp/articles/0786c7d15ef18067ffc865ac9ff169a34edef37b,2/17(土) 15:26
2024-02-18,04:13,domestic,国内,18,産経新聞,書類送検「暇空茜」氏「逮捕は必要なかったって事よ」 　ＮＨＫメモ拡散、著書は一部販売中止,https://news.yahoo.co.jp/articles/7082c67ab20dbf9b77876fb45d62c20cd9843770,2/17(土) 10:53
2024-02-18,04:13,domestic,国内,19,TBS NEWS DIG Powered by JNN,文科大臣に接近してきた旧統一教会　関連団体の現役幹部が新証言、ハグめぐり盛山大臣に猛反論【報道特集】,https://news.yahoo.co.jp/articles/1f700027a5713bacf14d53ce2e188323816f474d,2/17(土) 19:57
2024-02-18,04:13,domestic,国内,20,朝日新聞デジタル,奇祭・蘇民祭に幕「残念だが全力で」　千年以上続くも担い手不足に,https://news.yahoo.co.jp/articles/c9d685b0615191f337d6452779170b8f6fbd2656,2/17(土) 19:34
2024-02-18,04:13,domestic,国内,21,共同通信,追悼碑の撤去問題で憎悪扇動　杉田議員「朝鮮総連系が関与」,https://news.yahoo.co.jp/articles/ed6b060540dbbe40056712b888322cf22c4c1b44,2/17(土) 19:01
2024-02-18,04:13,domestic,国内,22,ABEMA TIMES,生配信されてる！…スマホ窃盗犯が財布物色中に「気づいた」瞬間 被害者「あまりにも出来すぎている映像」 犯人は逮捕,https://news.yahoo.co.jp/articles/67bd0077f90b1ac9c7078f31ab225370d3d873a1,2/16(金) 8:00
2024-02-18,04:13,domestic,国内,23,レスキューナウニュース,東武東上線で人身事故 一部運転見合わせ,https://news.yahoo.co.jp/articles/2591d4b7438645f97b8a881564ac4f78a2d30aef,2/17(土) 18:55
2024-02-18,04:13,domestic,国内,24,共同通信,自治体、精神疾患で休職1.8倍　20代と30代目立つ,https://news.yahoo.co.jp/articles/6c001809066303a23718cb422912270e479174b5,2/17(土) 15:25
2024-02-18,04:13,domestic,国内,25,夕刊フジ,主要私大志願者数ランク　近畿大が１１年連続１位か　減少幅がもっとも大きい日本大、他大学に志望変更した影響,https://news.yahoo.co.jp/articles/29d0df80fa12b963d33c9c61bf4149c3351c80ce,2/17(土) 17:00
2024-02-18,04:13,domestic,国内,26,読売新聞オンライン,４歳娘を「憎たらしい」、殺害容疑の両親がＬＩＮＥでやり取り…日常的に育児放棄か,https://news.yahoo.co.jp/articles/3b47a3bf90e80353f8992a2291842848d3de3877,2/17(土) 11:42
2024-02-18,04:13,domestic,国内,27,BUSINESS INSIDER JAPAN,成長投資枠で検討したい、5つの著名ETFシリーズの見分け方。NEXT FUNDS、iFreeにiシェアーズ…,https://news.yahoo.co.jp/articles/07bfe718e3854a34f5aa3ce6af47cedff1ac5abc,2/17(土) 20:00
2024-02-18,04:13,domestic,国内,28,夕刊フジ,桐島聡容疑者を名乗る男　死の数日前までは普通に暮らし、がん放置療法…「最期は本名で迎えたい」突然の自白は自分のためか,https://news.yahoo.co.jp/articles/52e92781acda2ee1afa4588f26a9d7cd59d67046,2/14(水) 17:00
2024-02-18,04:13,domestic,国内,29,TBS NEWS DIG Powered by JNN,【速報】元KAT-TUN 田中聖容疑者　指定薬物「THCH」所持の容疑で書類送検　警視庁,https://news.yahoo.co.jp/articles/64ef8e5a4d1e3609c300e4e73b3e91848fd76b98,2/16(金) 9:30
2024-02-18,04:13,domestic,国内,30,47NEWS,江戸時代には「全身白ギツネ男」が実在した　シーボルトお抱え絵師が残した２００年前の日本は「別世界」　ドイツの博物館収蔵の画像で判明,https://news.yahoo.co.jp/articles/f0a551947b833b3476e9baca97785132bfa42c94,2/17(土) 11:02
2024-02-18,04:13,domestic,国内,31,産経新聞,尖閣領空の自衛隊機に中国が退去警告を巡り、沖縄・玉城知事「日中両政府に信頼関係構築求める」,https://news.yahoo.co.jp/articles/5d2d07b6a8191c527300c491aa263c02b38557c4,2/16(金) 12:10
2024-02-18,04:13,domestic,国内,32,レスキューナウニュース,西武池袋線で人身事故 一部運転見合わせ,https://news.yahoo.co.jp/articles/b6df448c75d03f5f534671a159f6e80980302e8e,2/17(土) 20:40
2024-02-18,04:13,domestic,国内,33,デイリースポーツ,泉房穂氏、ネット上での批判急増に「組織的な動きのようにも感じる」,https://news.yahoo.co.jp/articles/c65f3ff6761bf90b931db28cbee5ad3b3225a2ef,2/16(金) 10:50
2024-02-18,04:13,domestic,国内,34,ねとらぼ,JRの駅で落とし物、郵送で返却をお願いしたら同封の「粋な計らい」にほっこり　取り組みをJR西に聞いた,https://news.yahoo.co.jp/articles/2a304038aa39e33319114c0d605a0e9ef45bcbbe,2/17(土) 11:45
2024-02-18,04:13,domestic,国内,35,中日スポーツ,国民の義務だけど… 確定申告スタート、納税者の不満収まらず 「次は裏金議員が筋を見せろ」「脱税議員の立件が先だよね？」,https://news.yahoo.co.jp/articles/ddc0510d038bf46be7b1319802f87e1fe9ad647b,2/17(土) 18:45
2024-02-18,04:13,domestic,国内,36,読売新聞オンライン,相模原両親死亡、直前に長男の「非行傾向」を児童相談所に相談…緊急性認められず,https://news.yahoo.co.jp/articles/6e9876a2d01aea7727baa07f87788db137c0d0ac,2/17(土) 17:13
2024-02-18,04:13,domestic,国内,37,日刊スポーツ,金子恵美氏、松本人志の週刊誌報道に「疑惑の段階で社会的制裁を受けるような社会は正しいのか」,https://news.yahoo.co.jp/articles/44f459edba0c8349ea0c79c2b22919473ef6cbc7,2/17(土) 12:39
2024-02-18,04:13,domestic,国内,38,弁護士ドットコムニュース,工業高卒、コンビニバイトから司法試験を上限5回目で合格…ギリギリすぎる弁護士の逆転人生,https://news.yahoo.co.jp/articles/c2dc96bdee95a186dcd5dda342198a753bf6f7bb,2/17(土) 7:38
2024-02-18,04:13,domestic,国内,39,日刊スポーツ,泉房穂氏「元マスコミでTwitterやってる人って全員頭おかs」の声に苦言「あまりにも極端」,https://news.yahoo.co.jp/articles/53577f8fe677d0ab9a236ff1a5120541dec365f2,2/17(土) 18:09
2024-02-18,04:13,domestic,国内,40,朝日新聞デジタル,地盤隆起で漁船転覆、海岸が真っ白に　ドローンで見た輪島の漁港,https://news.yahoo.co.jp/articles/801d635d127c9bdeff95c673b6dd8b3b6654df08,2/17(土) 19:00
