scrp_date,scrp_time,genre_en,genre_jp,rank,media_jp,title,link,date_original
2025-03-25,19:07,sports,スポーツ,1,産経新聞,マイナー降格の青柳晃洋にヤクルト移籍が急浮上　古巣・阪神への復帰はあるのか？　鬼筆のトラ漫遊記,https://news.yahoo.co.jp/articles/a1286c3d42013132609a276e77712987ea6383d2,3/25(火) 11:35
2025-03-25,19:07,sports,スポーツ,2,めざましmedia,【密着】元バレー日本代表・中垣内祐一氏（57）が米農家に転身！バレーコート2300面分「米づくりもバレーも一緒」地元大学で“教授”も,https://news.yahoo.co.jp/articles/53b9daed5c4446a6bf032d1fdf8edd592030393b,3/25(火) 15:31
2025-03-25,19:07,sports,スポーツ,3,ABEMA TIMES,【日本代表｜サウジアラビア戦の予想スタメン】久保建英と鎌田大地で先発初コンビ？ 伊東純也、中村敬斗、高井幸大、前田大然で６人を変更か【Ｗ杯予選】,https://news.yahoo.co.jp/articles/8d4dd78873521da449e4a69eda3c0eae8b84885f,3/25(火) 11:36
2025-03-25,19:07,sports,スポーツ,4,中日スポーツ,【中日】新人では石伊雄太捕手、外国人ではマラー、マルテが開幕1軍…全体練習前に参加ナインに“決定”伝える,https://news.yahoo.co.jp/articles/ff37911726239ada85f6c8fc263b783176198f03,3/25(火) 13:33
2025-03-25,19:07,sports,スポーツ,5,スポーツ報知,【巨人】山崎伊織が開幕ローテ入りへ　阿部監督が明言…２６日２軍で同日登板の赤星優志はロングリリーフ,https://news.yahoo.co.jp/articles/39a07fc84cb9511f1e948c0f0fd9593b1aa01565,3/25(火) 17:11
2025-03-25,19:07,sports,スポーツ,6,東スポWEB,【Ｆ１】ＢＢＣがローソンの更迭濃厚と報道　レッドブル首脳の責任も追及「経営陣に深刻な疑問」,https://news.yahoo.co.jp/articles/db83a2ce83ea7200f87ed1333e81faf55fe13988,3/25(火) 18:11
2025-03-25,19:07,sports,スポーツ,7,日刊スポーツ,【センバツ】ベスト８出揃う　浦和実が初の８強　変則左腕・石戸颯汰が今度は５回無失点救援,https://news.yahoo.co.jp/articles/8a4dad010c64c90b5f90a3e1943ecd48e7eb1a9c,3/25(火) 17:33
2025-03-25,19:07,sports,スポーツ,8,サンケイスポーツ,ボクシング　JBC、松本圭佑に1年間のライセンス停止処分　減量失敗による体調不良で5度目の防衛戦をキャンセル「権威と信用を著しく棄損」,https://news.yahoo.co.jp/articles/3ffefe3e0fdc8ca8be158d53a5e6009a9784e35b,3/25(火) 17:34
2025-03-25,19:07,sports,スポーツ,9,J-CASTニュース,原因不明の胃腸炎で10キロ「激やせ」ベッツ　地元メディアに明かした東京行きの「最悪」フライト「本当にひどい旅だった」,https://news.yahoo.co.jp/articles/93136ccd5f728dea139fd4a88332d5404644754e,3/25(火) 11:55
2025-03-25,19:07,sports,スポーツ,10,東スポWEB,ベッツ体調不良の「原因ウイルス」判明か　１１キロ激ヤセで食事困難＝地元紙報道,https://news.yahoo.co.jp/articles/aff22df21dab96c1359b4cce5c011bf58e9ba98d,3/25(火) 17:06
2025-03-25,19:07,sports,スポーツ,11,スポニチアネックス,浦和実・石戸颯汰の“独特フォーム”を仙台育英・須江監督が分析「足を上げるというより…」,https://news.yahoo.co.jp/articles/24a06619c1230873f38f0c167a978c2869ebd0b2,3/25(火) 16:44
2025-03-25,19:07,sports,スポーツ,12,サッカーキング,日本代表、ホーム2連勝を目指すサウジ戦のスタメン発表！　前節から6名変更、高井幸大が初先発,https://news.yahoo.co.jp/articles/9cb8bbc47071755179cc2657e22f11ceb9ae32df,3/25(火) 18:15
2025-03-25,19:07,sports,スポーツ,13,デイリースポーツ,ドジャース奥さま会メンバー　日本土産が大迫力！海外旅行者に大人気のお菓子爆買い　意外な小物も,https://news.yahoo.co.jp/articles/9bb0a0f674b7a16e2996fdae3fc597e2ae49eec5,3/25(火) 13:36
2025-03-25,19:07,sports,スポーツ,14,東スポWEB,野球殿堂入り３５０勝投手の米田哲也容疑者が万引で逮捕　プロ野球歴代２位,https://news.yahoo.co.jp/articles/145a525f0d82daec7af4570d5fc058aeb315621d,3/25(火) 18:02
2025-03-25,19:07,sports,スポーツ,15,motorsport.com 日本版,【海外F1記者の視点】不振ローソンは交代させるしかない？　後任は角田裕毅か……レッドブルが難しい決断を迫られる理由,https://news.yahoo.co.jp/articles/ebc26472bf4cd0afed9152b1992eed7fd674789d,3/25(火) 12:30
2025-03-25,19:07,sports,スポーツ,16,バスケットボールキング,強豪校への転校を目指してジェイコブス晶、山﨑一渉、ロロ・ルドルフがトランスファーポータルに登録,https://news.yahoo.co.jp/articles/ea77821f57b40b311d96fb3decd293c5003b2c9f,3/25(火) 15:56
2025-03-25,19:07,sports,スポーツ,17,デイリースポーツ,センバツ８強決定　関東が健大高崎、横浜、浦和実の３校　東北２校、関西１校、中国１校、九州１校,https://news.yahoo.co.jp/articles/99d8983110dcb9b443fcbf61ecbffe9f3f1a9c7a,3/25(火) 17:38
2025-03-25,19:07,sports,スポーツ,18,デイリースポーツ,「バイク似合いすぎ」朝倉未来のワイルドな姿に反響「センスが神っています！」,https://news.yahoo.co.jp/articles/73fd8f29eddecdbefe13dbd2eb6c15d3723012b8,3/25(火) 17:14
2025-03-25,19:07,sports,スポーツ,19,東スポWEB,【中日】開幕一軍メンバーが決定　井上監督「この練習に来ている選手が開幕一軍です」,https://news.yahoo.co.jp/articles/6d280f3d98ce617b58c110871867a1f9bcbd1243,3/25(火) 16:21
2025-03-25,19:07,sports,スポーツ,20,デイリースポーツ,衝撃ＫＯ負けの武尊、２週間前に肋骨と胸骨骨折しドクターストップだった　同門の野杁正明が告白　全治７週間、呼吸もままならず,https://news.yahoo.co.jp/articles/661a77af1e6cd2b52899046b494bf6f9deccfcc0,3/25(火) 12:15
2025-03-25,19:07,sports,スポーツ,21,デイリースポーツ,初出場・浦和実が８強入り！初出場校の８強入りは６年ぶり　８回集中打で一挙５点,https://news.yahoo.co.jp/articles/3c8e4a98fb706b2679152e6a890d07cb6ea6ebb6,3/25(火) 17:35
2025-03-25,19:07,sports,スポーツ,22,日刊ゲンダイDIGITAL,大谷の投打に痛烈ダブルパンチ！ ドジャース主砲ベッツ「原因不明の奇病」で激痩せ11キロの衝撃,https://news.yahoo.co.jp/articles/d80451e8cef10cdc0fcb11903cbbaf9dd065cfda,3/25(火) 16:45
2025-03-25,19:07,sports,スポーツ,23,高校野球ドットコム,センバツベスト8が決定！初出場浦和実が快挙！前評判の高かった東洋大姫路は2回戦敗退【センバツ】,https://news.yahoo.co.jp/articles/785734e4729b84db5dbf599f4b52798a2e18cc93,3/25(火) 17:35
2025-03-25,19:07,sports,スポーツ,24,スポーツ報知,Ｊ２札幌、三上大勝ＧＭの退任を正式発表　石水創社長が「存在が大きくなりすぎた」と決断,https://news.yahoo.co.jp/articles/b509d6c48bbfaedc4b74606c2c7af6314781d7f3,3/25(火) 16:48
2025-03-25,19:07,sports,スポーツ,25,日刊ゲンダイDIGITAL,東洋大姫路・岡田監督が吐露「本当は履正社に再任用で残る予定で、母校に戻るつもりは…」,https://news.yahoo.co.jp/articles/ad69a144a5a258120302c45f5db1fc51e5229bc0,3/25(火) 16:45
2025-03-25,19:07,sports,スポーツ,26,スポニチアネックス,通算350勝の大投手・米田哲也容疑者が窃盗の疑いで逮捕　缶酎ハイ2本盗んだか　尼崎市内のスーパーで,https://news.yahoo.co.jp/articles/ee8634caab27340e57e8959496cf686c246f533d,3/25(火) 18:17
2025-03-25,19:07,sports,スポーツ,27,Full-Count,トラウト、大谷翔平に「元気にしているか」　“再会”に笑顔…「日本でのプレーはどうだった」,https://news.yahoo.co.jp/articles/b18cb4aee0f81555854e79ea7339efe20aa8eecd,3/25(火) 13:45
2025-03-25,19:07,sports,スポーツ,28,GOAL,【予想スタメン】“消化試合”ではない。日本代表、サウジアラビア戦で森保監督は何をトライするか？,https://news.yahoo.co.jp/articles/d2494b0463a939e04033f2c99248767134cf2eb8,3/25(火) 15:59
2025-03-25,19:07,sports,スポーツ,29,スポーツ報知,アレクサンダー＝アーノルド、Ｒマドリード移籍確定！　年俸２４億６０００万円の５年契約！！,https://news.yahoo.co.jp/articles/ef0edbc117f472f484dffe1f48b35fa412b48a60,3/25(火) 18:13
2025-03-25,19:07,sports,スポーツ,30,Full-Count,開幕直前で巨人は動くか　最少の支配下62人、育成に眠る“逸材”…西武は2人が昇格,https://news.yahoo.co.jp/articles/c5e1a638bcb18c3e7f58f6c225d301561ff7027c,3/25(火) 14:59
2025-03-25,19:07,sports,スポーツ,31,motorsport.com 日本版,マシンバランスが全くダメだ……レッドブルF1との無線で明かされるローソンの苦戦。日本GPでは角田裕毅と交代との噂も,https://news.yahoo.co.jp/articles/acaad3ab9c8a170083e9263a0df859f1627228c6,3/25(火) 12:01
2025-03-25,19:07,sports,スポーツ,32,東スポWEB,【競泳】池江璃花子が明かす〝立場の変化〟　周囲は結婚、出産ラッシュも「水泳への思い入れが一番」,https://news.yahoo.co.jp/articles/35a4eaea85f83095eb88777daa0bc5b8df588954,3/25(火) 17:32
2025-03-25,19:07,sports,スポーツ,33,馬トク報知,【黒船賞】シャマルが逃げ切り史上２頭目の３連覇　斤量５９キロを克服してセイクリムズン以来の快挙,https://news.yahoo.co.jp/articles/028ee1a67e117868deea4e0506ace08ba2e08443,3/25(火) 16:54
2025-03-25,19:07,sports,スポーツ,34,超WORLDサッカー！,【日本代表プレビュー】最高の景色への第一歩…三笘、守田、上田らの代わりは誰が務める!?/vsサウジアラビア代表【2026W杯アジア最終予選】,https://news.yahoo.co.jp/articles/57a2b24acbe7fb0a1f25d7c9c0c956509c5ac187,3/25(火) 14:30
2025-03-25,19:07,sports,スポーツ,35,ABEMA TIMES,日本代表、サウジ戦のスタメン発表！ 久保建英と鎌田大地が先発初コンビ、高井幸大や菅原由勢などバーレーン戦から６人を変更,https://news.yahoo.co.jp/articles/39f36482266bbcec41d82e3ff20bf4ec85fffa00,3/25(火) 18:39
2025-03-25,19:07,sports,スポーツ,36,東スポWEB,川崎春花が出場エントリーでファン期待「外野の事は気にせず…」前回覇者の阿部未悠も,https://news.yahoo.co.jp/articles/c52986f8216397a76933c5063ce2df815fab12fb,3/25(火) 18:21
2025-03-25,19:07,sports,スポーツ,37,東スポWEB,元西武・スミス開幕ロースター入りならず…因縁の地では「韓国を侮辱した史上最悪の外国人」と報道,https://news.yahoo.co.jp/articles/5c83afcb73de7c1136dac9737a5798bb09fc67b2,3/25(火) 17:51
2025-03-25,19:07,sports,スポーツ,38,デイリースポーツ,巨人・阿部監督　山崎伊織の開幕ローテ入り示唆「伊織いかすと思うよ」　赤星はリリーフ起用へ,https://news.yahoo.co.jp/articles/c1cff0bfaa011f77b6ffcffe9f945e1fd151454d,3/25(火) 17:54
2025-03-25,19:07,sports,スポーツ,39,CoCoKARAnext,「状況は一転した」角田裕毅、レッドブル昇格は秒読みか　“マックス仕様”のマシンに苦戦を予想も「ツノダが断ることは考えにくい」,https://news.yahoo.co.jp/articles/3dc63696452ec1b9bef401d2599a8f0460f77a2c,3/25(火) 17:30
2025-03-25,19:07,sports,スポーツ,40,CoCoKARAnext,「ぜ～んぶお土産よ！」ドジャース奥様会メンバーが爆買いしたお菓子セレクトに注目　「食べたら、また来たくなるはず」,https://news.yahoo.co.jp/articles/1aed57aea50bf58a31d93b73645a98dd7ec3ed4b,3/25(火) 18:06
