scrp_date,scrp_time,genre_en,genre_jp,rank,media_jp,title,link,date_original
2025-03-25,13:08,sports,スポーツ,1,ABEMA TIMES,【日本代表｜サウジアラビア戦の予想スタメン】久保建英と鎌田大地で先発初コンビ？ 伊東純也、中村敬斗、高井幸大、前田大然で６人を変更か【Ｗ杯予選】,https://news.yahoo.co.jp/articles/8d4dd78873521da449e4a69eda3c0eae8b84885f,3/25(火) 11:36
2025-03-25,13:08,sports,スポーツ,2,Full-Count,プロ注目右腕が衝撃告白「靱帯が切れている」　わずか1イニングで終わった春,https://news.yahoo.co.jp/articles/b377a647f0ed965aef11f0ba1fc6eac20cee5179,3/25(火) 9:20
2025-03-25,13:08,sports,スポーツ,3,産経新聞,マイナー降格の青柳晃洋にヤクルト移籍が急浮上　古巣・阪神への復帰はあるのか？　鬼筆のトラ漫遊記,https://news.yahoo.co.jp/articles/a1286c3d42013132609a276e77712987ea6383d2,3/25(火) 11:35
2025-03-25,13:08,sports,スポーツ,4,ENCOUNT,BD出身戦士、元ラウンドガールにまさかの一本負け「情けない」　ファン仰天「あかんやろ！」,https://news.yahoo.co.jp/articles/cb95e316b6dc740daa3f6517f35fab9ff6f7f27f,3/25(火) 7:20
2025-03-25,13:08,sports,スポーツ,5,日刊スポーツ,【センバツ】エナジックスポーツ指揮官の表情が見えない…Ｘでは「考えを読ませないためか？」,https://news.yahoo.co.jp/articles/25b4332358eb788a248ec9fa82a92640ee6c5283,3/25(火) 10:25
2025-03-25,13:08,sports,スポーツ,6,Full-Count,大谷翔平、2打席連続三振で途中交代　エ軍本拠地は歓声も…米開幕まで残り1試合,https://news.yahoo.co.jp/articles/b0fc969b5f93e751aeb1ecc20959137b0e2a18b9,3/25(火) 11:09
2025-03-25,13:08,sports,スポーツ,7,ENCOUNT,80秒で7000万円稼いだロッタンが楽しんだ意外な日本食に好感度爆上がり「おれらと金銭感覚一緒」,https://news.yahoo.co.jp/articles/946aefa8c1aea329f357240d2983531d70bc4479,3/25(火) 8:44
2025-03-25,13:08,sports,スポーツ,8,motorsport.com 日本版,【海外F1記者の視点】不振ローソンは交代させるしかない？　後任は角田裕毅か……レッドブルが難しい決断を迫られる理由,https://news.yahoo.co.jp/articles/ebc26472bf4cd0afed9152b1992eed7fd674789d,3/25(火) 12:30
2025-03-25,13:08,sports,スポーツ,9,読売新聞オンライン,サッカー元日本代表・松井大輔が語るＷ杯、「最悪の雰囲気」だった日本はなぜ「海外で１勝」を挙げられたか,https://news.yahoo.co.jp/articles/dd1a8216a0784d6932f844833b779562862c0abd,3/25(火) 10:00
2025-03-25,13:08,sports,スポーツ,10,CoCoKARAnext,「キム・ヘソンを信じてトレードしたのに…」ラックス放出の“誤算”　「ドジャースは本当に後悔するだろう」韓国メディア指摘,https://news.yahoo.co.jp/articles/1604c66d4450f62d1852d0c76521a046ba95a6be,3/25(火) 5:30
2025-03-25,13:08,sports,スポーツ,11,デイリースポーツ,衝撃ＫＯ負けの武尊、大会２週間前に肋骨と胸骨骨折していた　同門の野杁正明が告白「武尊君はあんなもんじゃない」全治７週間、呼吸もままならず,https://news.yahoo.co.jp/articles/661a77af1e6cd2b52899046b494bf6f9deccfcc0,3/25(火) 12:15
2025-03-25,13:08,sports,スポーツ,12,スポーツ報知,【センバツ】智弁和歌山が近畿勢唯一の８強入り　２戦連続２ケタ安打でエナジックスポーツを撃破,https://news.yahoo.co.jp/articles/51c26c1644b7d91c8e5aeb6f96277423a736a752,3/25(火) 11:57
2025-03-25,13:08,sports,スポーツ,13,motorsport.com 日本版,マシンバランスが全くダメだ……レッドブルF1との無線で明かされるローソンの苦戦。日本GPでは角田裕毅と交代との噂も,https://news.yahoo.co.jp/articles/acaad3ab9c8a170083e9263a0df859f1627228c6,3/25(火) 12:01
2025-03-25,13:08,sports,スポーツ,14,スポニチアネックス,吐き気続き体重11キロ減のベッツ　26日にも試合復帰へ　指揮官が明言「食事も取れたとのこと」,https://news.yahoo.co.jp/articles/2f4fbe177bd5038f556f05993daf229708874a8b,3/25(火) 8:28
2025-03-25,13:08,sports,スポーツ,15,J-CASTニュース,原因不明の胃腸炎で10キロ「激やせ」ベッツ　地元メディアに明かした東京行きの「最悪」フライト「本当にひどい旅だった」,https://news.yahoo.co.jp/articles/93136ccd5f728dea139fd4a88332d5404644754e,3/25(火) 11:55
2025-03-25,13:08,sports,スポーツ,16,ゴルフのニュース,PGAツアーで選手とギャラリーの関係が悪化!? マキロイに心ないヤジ浴びせた男性の正体はなんと… 原因はオンラインカジノやSNSか？,https://news.yahoo.co.jp/articles/7212722d359555d2613f24bed9b0e7374f255bb9,3/25(火) 11:10
2025-03-25,13:08,sports,スポーツ,17,日刊スポーツ,フリーマン妻、日本での着物＆抹茶体験を公開　ひときわ目を引く鮮やかレッドの着物姿を披露,https://news.yahoo.co.jp/articles/42a53acd65c457dbe69c7927ac56cde852fd7c02,3/25(火) 10:52
2025-03-25,13:08,sports,スポーツ,18,中日スポーツ,大谷翔平、散髪で耳回りかなりスッキリ…SNSで話題沸騰「めっちゃ爽やか」「イケメンすぎて無理」「カッコイイ」,https://news.yahoo.co.jp/articles/ad04618f93041b26106d21051e168c38fb2b1a0d,3/25(火) 10:40
2025-03-25,13:08,sports,スポーツ,19,日刊スポーツ,アジア最終予選Ａ組はイランが引き分け以上でＷ杯出場　Ｂ組は首位韓国と２位ヨルダンが直接対決,https://news.yahoo.co.jp/articles/b1d90dc71b16943b2b909b8bcadd94a384412095,3/25(火) 10:00
2025-03-25,13:08,sports,スポーツ,20,DAZN News,イタリア、悪夢の2大会連続W杯予選敗退から3年「なんて不都合。W杯への道中にハーランドが…」伊紙がノルウェーと同組を警戒 ｜ UEFAネーションズリーグ,https://news.yahoo.co.jp/articles/112488b13bb2fbabe6e233005eaa88abd099d6b0,3/24(月) 18:37
2025-03-25,13:08,sports,スポーツ,21,Full-Count,大谷翔平、古巣本拠地でも“神対応”　地元出身の11歳少年は歓喜「興奮してます」,https://news.yahoo.co.jp/articles/a73f2b61c1e8f46eebf8f338eeaf3df2c1904aa1,3/25(火) 10:03
2025-03-25,13:08,sports,スポーツ,22,スポーツ報知,【巨人】開幕２軍スタートの浅野翔吾、ケラー、京本真、平内龍太、泉口友汰が２軍合流,https://news.yahoo.co.jp/articles/150b54505fe62d76cde46e2dac6a5c7319b1f10c,3/25(火) 10:20
2025-03-25,13:08,sports,スポーツ,23,東スポWEB,【Ｆ１】角田裕毅　日本ＧＰから緊急昇格濃厚とＥＳＰＮも報道「決定は今週前半に下される」,https://news.yahoo.co.jp/articles/ecf04a063f2b27741ca5be8bbf626e1b97f756d7,3/25(火) 5:17
2025-03-25,13:08,sports,スポーツ,24,東スポWEB,【Ｆ１】「角田裕毅を激しく非難」更迭秒読みローソンが怒りあらわで波紋「私はバカではない」,https://news.yahoo.co.jp/articles/e009804d2899018bcb2b8e280c5fc3c8e623e4e5,3/24(月) 17:21
2025-03-25,13:08,sports,スポーツ,25,ロイター,Ｆ１＝レーシングブルズ角田、レッドブル昇格の可能性─報道,https://news.yahoo.co.jp/articles/20af75a16ebf96419b0da7ed80a45c6e74e913f1,3/25(火) 9:26
2025-03-25,13:08,sports,スポーツ,26,ゴルフのニュース,女子ゴルフ会場で見られた美しい光景 ホールアウト後の選手たちが続々と… 激戦直後の“神対応”に長蛇の列,https://news.yahoo.co.jp/articles/b8fb5724cb7bc684e4154df290af87805cf96f0d,3/25(火) 11:42
2025-03-25,13:08,sports,スポーツ,27,スポニチアネックス,【センバツ】智弁和歌山・中谷監督　2戦連続2桁安打で快勝にも「自分の中では攻撃のチームではない」,https://news.yahoo.co.jp/articles/f62c82e3b11a7ce807956330e97a7a89d4ecd05d,3/25(火) 12:19
2025-03-25,13:08,sports,スポーツ,28,スポーツ報知,体重１１キロ減のベッツ、２８日の米開幕戦出場に望み　本拠地でフルメニュー消化＆固形物摂取に成功,https://news.yahoo.co.jp/articles/b6f07a0254273176fa9f2a3fb6f3887c2cd45387,3/25(火) 8:28
2025-03-25,13:08,sports,スポーツ,29,スポニチアネックス,【スポニチ本紙評論家セ・リーグ順位予想】25人中12人が連覇狙う阿部巨人を本命に指名、阪神が9人,https://news.yahoo.co.jp/articles/a7cc9dfd7b30812e4016013810b8f6659f48b3b9,3/25(火) 5:30
2025-03-25,13:08,sports,スポーツ,30,東スポWEB,笠りつ子ルール違反で「訂正」と「謝罪」　きっかけは視聴者ではなく大会関係者の指摘,https://news.yahoo.co.jp/articles/e1607347e4afada5f1e965378216ffb94ba82b7d,3/25(火) 11:36
2025-03-25,13:08,sports,スポーツ,31,日刊ゲンダイDIGITAL,健大高崎・石垣元気の圧巻投球にスカウトは「危ない」…プロが注目も故障復帰直後で緊張走る,https://news.yahoo.co.jp/articles/136062d6aae878515b217a044fdd576b95b54f19,3/25(火) 9:06
2025-03-25,13:08,sports,スポーツ,32,TopNews,大好きな鈴鹿に照準！フェルスタッペン「マシンは扱いづらい」F1中国GPで苦闘も最終スティントで希望見えた,https://news.yahoo.co.jp/articles/4a2fdb4e7d5a798621a05569ca8eaa12fd6b15a6,3/25(火) 12:04
2025-03-25,13:08,sports,スポーツ,33,TBS NEWS DIG Powered by JNN,河村勇輝、アリウープ演出など5アシスト12得点、ハッスルは最大19点のリード守れず延長戦で競り負け連敗【バスケGリーグ】,https://news.yahoo.co.jp/articles/881cced3372511b05c8d158248d82314df09ffeb,3/25(火) 11:22
2025-03-25,13:08,sports,スポーツ,34,RONSPO,ボクシング界の“ミラモン”松本圭佑が減量失敗で「白目をむいて痙攣し意識を失い」救急搬送されて日本王座戦が中止…1年間の出場停止処分で年内世界戦計画は白紙に,https://news.yahoo.co.jp/articles/01ec121bcf74d2c9914d8aa5f31fef2250d4e032,3/25(火) 6:43
2025-03-25,13:08,sports,スポーツ,35,ゴルフ総合サイト ALBA Net,河本結が出場権獲得に滑り込み　「全米女子オープン」の有資格者は笹生優花、渋野日向子ら日本勢13人,https://news.yahoo.co.jp/articles/a8c84e3488724a1d1eafe57f0f58b0e90a431612,3/25(火) 12:00
2025-03-25,13:08,sports,スポーツ,36,RONSPO,「世界ベルトのない那須川天心より中谷潤人とやりたい」フィリピンの超新星“リトル・パッキャオ”ラバーがヤバイくらい強い…東洋王座統一戦で栗原慶太を1ラウンドTKOして豪語,https://news.yahoo.co.jp/articles/e3744119cb9d5da0b8d4dbe674a5bd679b6d2c76,3/25(火) 6:32
2025-03-25,13:08,sports,スポーツ,37,東スポWEB,【女子ゴルフ】川崎春花が開幕３試合連続欠場でファン心配「このまま引退？」,https://news.yahoo.co.jp/articles/5bdc3ee0f5590831bbd7f343b87c1f380147d969,3/24(月) 19:11
2025-03-25,13:08,sports,スポーツ,38,スポニチアネックス,【ONE】グレゴリアン「海人は戦いたくなかったんでしょ」と再び批判！海人も反応「心の底から…」,https://news.yahoo.co.jp/articles/08859fd99f2cc9e6d2c1e0f70d77c24aded70cf7,3/25(火) 11:15
2025-03-25,13:08,sports,スポーツ,39,ABEMA TIMES,「髪切った？」大谷翔平、本土開幕を前に散髪でリフレッシュ 短髪姿で登場にファン大注目「さっぱり谷サン」「髪型変わった」,https://news.yahoo.co.jp/articles/16417be85b329fa3739034698be512e288430da4,3/25(火) 12:06
2025-03-25,13:08,sports,スポーツ,40,ゴルフのニュース,笠りつ子はなぜ「インプレーの球を再ドロップ」してしまったか？ 赤杭のドロップでアマチュアも注意すべき勘違いとは？,https://news.yahoo.co.jp/articles/7745077c7ea0222a3220456036bb88b303bf0dcc,3/25(火) 12:04
