scrp_date,scrp_time,genre_en,genre_jp,rank,media_jp,title,link,date_original
2024-07-16,00:07,TTL,総合,1,デイリースポーツ,佐久間宣行氏「すげぇと思った女子アナは１人しかいない」と実名告白「神田愛花さんも森香澄も仕事したけど」,https://news.yahoo.co.jp/articles/a7c9f515b169ddaf473a566cac3773fa899bdfcc,7/15(月) 20:37
2024-07-16,00:07,TTL,総合,2,ハフポスト日本版,26年連れ添った妻が亡くなり、半年後にかかってきた電話。伝えられた言葉に驚かないではいられなかった,https://news.yahoo.co.jp/articles/d69020a9759ecbe84079e0fff07253d554375ddd,7/15(月) 20:20
2024-07-16,00:07,TTL,総合,3,スポーツ報知,【光る君へ】生々しい「Ｗ不倫」シーン！宣孝は気付いてた「一番怖い」「普通なら気が狂う」,https://news.yahoo.co.jp/articles/a82f227faae65c077ff0597f445f7de17a27a2ae,7/15(月) 12:45
2024-07-16,00:07,TTL,総合,4,デイリースポーツ,千鳥・大悟の相方ヤギが急死「ロケで会えると楽しみにした矢先の出来事」２時間ＳＰに出演できず「つらいし、悲しい」,https://news.yahoo.co.jp/articles/680bab6f02bf473ac621e03d6e91472bdf16eaf5,7/15(月) 18:31
2024-07-16,00:07,TTL,総合,5,magacol,木村多江さんが10年苦しんだ【死別の悲しみ】…「子育てにも影響があった」｜美ST,https://news.yahoo.co.jp/articles/6d3200886f1d9e4bbe58581b04ffb0930fdb3508,7/15(月) 17:00
2024-07-16,00:07,TTL,総合,6,スポニチアネックス,横浜のハリー・キューウェル監督　電撃解任　成績不振のため…今季就任もふるわず,https://news.yahoo.co.jp/articles/5260bb57783bcbef0d6e0335e0d6eb16cc4db716,7/15(月) 21:10
2024-07-16,00:07,TTL,総合,7,スポニチアネックス,【1人賛否】粗品、またも先輩芸人を呼び捨て　不祥事からの活動再開も「復帰早いな～！！笑えへんかも」,https://news.yahoo.co.jp/articles/7e56a2fdbf4db4fd9e56c245e7287bf3a340c8fe,7/15(月) 19:36
2024-07-16,00:07,TTL,総合,8,デイリースポーツ,伝説の左腕、江夏豊氏が久々に公の場　阪神、巨人のレジェンドＯＢ対決に参加　王貞治氏と握手も,https://news.yahoo.co.jp/articles/e09a4b8d96c651f7d7f4ceabd465f4c4c9ff2b0f,7/15(月) 18:03
2024-07-16,00:07,TTL,総合,9,CoCoKARAnext,「なんと生々しい」負傷で大号泣のメッシ、痛めた右足の“異様な巨大化”に悲痛な声相次ぐ「彼を止める方法は不公平」,https://news.yahoo.co.jp/articles/0300e7e21095849fe365c1df1b40655c47efdd4f,7/15(月) 15:01
2024-07-16,00:07,TTL,総合,10,よろず～ニュース,橋下徹氏、石丸氏批判の学者を「詐欺師」と罵倒→「一括り」の物言いが問題視　「間違いでした」と認める,https://news.yahoo.co.jp/articles/f245a27dcff806d9b53895fe5c8386cd9460f824,7/15(月) 20:20
2024-07-16,00:07,TTL,総合,11,よろず～ニュース,分裂！ボーカルが10年間の「孤立」告白し脱退→人気バンド公式が反論「認識や事実とは違う箇所が多々」,https://news.yahoo.co.jp/articles/6bb1fedc6ed6ad5e361a3f1e662160793c51f0b3,7/15(月) 20:05
2024-07-16,00:07,TTL,総合,12,オリコン,生まれつき顔面に“赤アザ”の男性、思春期は「本音と建前に絶望」 結婚＆子育てを経て “普通”の生活に初めて感謝,https://news.yahoo.co.jp/articles/4ffc8282410d949eb8ae3f490a7cdfdeeee05286,7/15(月) 8:30
2024-07-16,00:07,TTL,総合,13,デイリースポーツ,すげぇ！名門大卒の元祖・才色兼備女優「Ｑさま」６６歳でカズ、宇治原に対抗！ネット「知識も品もあるしカッコイイ」,https://news.yahoo.co.jp/articles/a8a421b4fa3013903b8a04944530c1489b801e90,7/15(月) 21:54
2024-07-16,00:07,TTL,総合,14,ねとらぼ,「こんなことになるとは」　鋼製の包丁を食洗機で洗ってしまった結果……　“衝撃の変化”に仰天「1度でこれほど」,https://news.yahoo.co.jp/articles/bf62d5996ef6d265fd66d16f85923343e6d64fbb,7/15(月) 20:15
2024-07-16,00:07,TTL,総合,15,スポニチアネックス,ナイスバディーで話題のラウンドガール　タイトな黒ミニワンピS！「女神のように美しい」「可愛すぎ」の声,https://news.yahoo.co.jp/articles/f4f6a03be7b215f9fb5b99d52bf7b983fba580ff,7/15(月) 19:30
2024-07-16,00:07,TTL,総合,16,中日スポーツ,石丸伸二氏に一蹴された山崎怜奈、Ｘで反撃に出るも逆効果？「質問がおかしいのに気づいてない」など批判飛び交う,https://news.yahoo.co.jp/articles/60bbf59cd4bf2ec277793128418928e1552726dd,7/15(月) 19:12
2024-07-16,00:07,TTL,総合,17,スポニチアネックス,和田明日香「お義母さん、これ…」生放送で平野レミにまさかの指摘　出演者＆ネット大爆笑「ひどいww」,https://news.yahoo.co.jp/articles/1158ebf99b95fbb708b4b4ba5ccea5ab6d3e2715,7/15(月) 13:51
2024-07-16,00:07,TTL,総合,18,J-CASTニュース,俳優・中村靖日さん、51歳で急逝　名バイプレイヤー突然の訃報に「残念でしょうがない」「いい味出してたのに」,https://news.yahoo.co.jp/articles/0e7f5b7c82fcea77135247ba49ef611f368b2f67,7/15(月) 17:34
2024-07-16,00:07,TTL,総合,19,読売新聞オンライン,母から虐待、非行で少年院に「あなたはサバイバー」自分への見方を変えた矯正医官の言葉　#令和の子,https://news.yahoo.co.jp/articles/c8500976c19bda844b78afde6bb3e1751c973b74,7/15(月) 18:02
2024-07-16,00:07,TTL,総合,20,スポーツ報知,【海のはじまり】大竹しのぶ強烈「それを言っちゃダメだ」セリフに震撼「きっつー」「しんど過ぎる」,https://news.yahoo.co.jp/articles/e30780bb923042f1ef3dc4a070a31c7463ad260f,7/15(月) 22:38
2024-07-16,00:07,TTL,総合,21,デイリースポーツ,７０歳クロマティ氏が電動車いす姿で登場　「バンザーイ！」パフォーマンスで盛り上げ球場一体に　阪神・巨人レジェンドＯＢ戦、３万５０００人の観衆見守る,https://news.yahoo.co.jp/articles/1ed3018aa12b91631c5eb199971de73451d52275,7/15(月) 18:37
2024-07-16,00:07,TTL,総合,22,スポーツ報知,松雪泰子「美女オーラ消した」姿が別人！ネット二度見「５１歳！？」「気づかなかった」「変わりすぎ」,https://news.yahoo.co.jp/articles/6b20451de3c56583a02c73dd4a87fb4c7b523ab1,7/15(月) 16:55
2024-07-16,00:07,TTL,総合,23,マグミクス,「意外と知らない」『キャッツ・アイ』の最終回　瞳の正体は俊夫にバレた？,https://news.yahoo.co.jp/articles/96d2da01905bd454070d92d026a79f550e4c0786,7/15(月) 8:25
2024-07-16,00:07,TTL,総合,24,ENCOUNT,やす子の“激変”ぶりに「ど、どうした」「めっちゃ綺麗」　衝撃イメチェンが「スナックのママみたい」,https://news.yahoo.co.jp/articles/e3b84acce4307ce0da3dcaf0ebca275436708cf1,7/15(月) 18:36
2024-07-16,00:07,TTL,総合,25,スポニチアネックス,黒柳徹子が美貌を大絶賛する女優「あの方本当にきれいねえ」　今年第2子出産で話題に,https://news.yahoo.co.jp/articles/dfdd58d466261a8fb1238daf02cb0259a3550be4,7/15(月) 13:59
2024-07-16,00:07,TTL,総合,26,テレビ朝日系（ANN）,トランプ氏銃撃事件　大統領選挙への影響は…優勢になるほど新たな課題？　デスク解説,https://news.yahoo.co.jp/articles/b055a266e615197d1612b4aab004e2f58e92afc5,7/15(月) 19:09
2024-07-16,00:07,TTL,総合,27,スポニチアネックス,松本人志がX再開を宣言　早速のボケに三村マサカズ「ちょっとブランクあるのかなぁ。笑」,https://news.yahoo.co.jp/articles/27913ed097a712e7a216cb3cc5bd6e3011eb5f86,7/15(月) 19:04
2024-07-16,00:07,TTL,総合,28,よろず～ニュース,紅白出場バンドの女性メンバーが交際女性と「パートナーシップ宣言」 性自認も告白「いつか結婚できる日が」,https://news.yahoo.co.jp/articles/8c6d6798a6c61d33131b11ebd0dc1bbfb05b5429,7/15(月) 16:50
2024-07-16,00:07,TTL,総合,29,ＡＦＰ＝時事,家族かばって犠牲に、「父はスーパーヒーロー」 娘が投稿 トランプ氏銃撃,https://news.yahoo.co.jp/articles/8c3db2c48e5b50b3dc15137ba3b95665aea3a7d7,7/15(月) 10:43
2024-07-16,00:07,TTL,総合,30,スポーツ報知,体操の宮川紗江、２２年間の競技生活引退を発表「長かったようであっという間」今後は指導者の道へ,https://news.yahoo.co.jp/articles/2de10399f67b115e205322a2443aabce4c5f1131,7/15(月) 22:44
2024-07-16,00:07,TTL,総合,31,スポーツ報知,巨人・阪神ＯＢ戦に観衆３万５０００人　両軍懐かしの応援歌、王貞治氏サプライズ登場,https://news.yahoo.co.jp/articles/94b3fec4cac51f9b1c03507f12197321e2ad483c,7/15(月) 19:57
2024-07-16,00:07,TTL,総合,32,デイリースポーツ,阪神・岡田監督が巨人・阪神ＯＢ戦でベンチ入り　青いポロシャツ姿で登場し大歓声　江本さんらと談笑　デーゲーム後、宿舎で食事し再びドームに,https://news.yahoo.co.jp/articles/8cbb3d24e808efd2bb7c11540f6902951c5838c8,7/15(月) 19:34
2024-07-16,00:07,TTL,総合,33,CNN.co.jp,トランプ氏銃撃の会場で死亡した観客、身を投げ出して家族守った「英雄」,https://news.yahoo.co.jp/articles/6cb31f2ede62c751a373332323dcd4cae92dc0ce,7/15(月) 11:39
2024-07-16,00:07,TTL,総合,34,レスキューナウニュース,中央線(快速)で人身事故 運転見合わせ,https://news.yahoo.co.jp/articles/da6ec15b29ba14d3682b15af162837ded4e9c4fa,7/15(月) 22:50
2024-07-16,00:07,TTL,総合,35,スポーツ報知,フジ月９「海のはじまり」第３話タイトルが「これだけで苦しい」「もう泣く」池松壮亮が不穏,https://news.yahoo.co.jp/articles/d5dc109525a88c7671ef43421b1d2563dac1c850,7/15(月) 17:45
2024-07-16,00:07,TTL,総合,36,日刊スポーツ,【OB戦】阪神OB江夏豊さん、車いすで来場　王貞治さん田淵幸一さんらが寄り添い声かける,https://news.yahoo.co.jp/articles/b77ffae89357e6c7258b05beedb6807eacb81140,7/15(月) 19:02
2024-07-16,00:07,TTL,総合,37,デイリースポーツ,１６歳久保凛の衝撃の日本記録、世界では？　Ｕ１８世界歴代８位の快記録　今季Ｕ１８世界２位、Ｕ２０でも４位にランクイン,https://news.yahoo.co.jp/articles/25c1715d774bcc6d71290dee8843fe2032dcd670,7/15(月) 16:14
2024-07-16,00:07,TTL,総合,38,スポニチアネックス,九州の美人タレント　大人気キャラの上下ジャージ姿！「めっちゃ可愛い」「笑顔が素敵」の声,https://news.yahoo.co.jp/articles/3e5a4e6ebebea07d6afa7516806d328f93b4111f,7/15(月) 19:59
2024-07-16,00:07,TTL,総合,39,ENCOUNT,元乃木坂46メンバーが“角刈り”に　視聴者は困惑「誰か分からんかった」「勝新さんみたい」,https://news.yahoo.co.jp/articles/ef490f9c07c25382e90e3efeb931064c45bbc756,7/15(月) 21:10
2024-07-16,00:07,TTL,総合,40,クックパッドニュース,食卓にキッチンスケールを常備！50代でストレスなく－10kgを達成できた「食事のマイルール」とは？,https://news.yahoo.co.jp/articles/574a29e3133abd134c4a1e4b1fc71a8790889c1b,7/15(月) 21:00
