scrp_date,scrp_time,genre_en,genre_jp,rank,media_jp,title,link,date_original
2024-02-13,23:15,TTL,総合,1,ねとらぼ,療養中の渡邊渚アナ、測定結果を公表　病名は明かさず「頑張らないといけないのにね」ポツリ,https://news.yahoo.co.jp/articles/ca2f890f6aeaa30910101e6d15b5e013cd5e09bc,2/13(火) 18:38
2024-02-13,23:15,TTL,総合,2,スポーツ報知,松本人志問題「やっぱり…」人気ミュージシャンの私見がネットで話題「新しい視点」「納得しました」「泣けます」,https://news.yahoo.co.jp/articles/d766d49063197c6520e2f200b04825e8cfadc342,2/13(火) 16:16
2024-02-13,23:15,TTL,総合,3,ファイナンシャルフィールド,街中でよく「アルファード」クラスの高級ミニバンを見るのですが…世の中は「高収入」の人ばかりなのでしょうか？,https://news.yahoo.co.jp/articles/437ca138ac638dbd2b36c97a33aaecbd1f3636be,2/12(月) 11:20
2024-02-13,23:15,TTL,総合,4,J-CASTニュース,盗難車持ち込み→タイヤ交換中に警察官登場→客逃亡　タイヤショップがJ-CASTニュースに明かした客の素性,https://news.yahoo.co.jp/articles/97b2eb0fb9cd7e31c248e2e0b09152258d411066,2/13(火) 20:02
2024-02-13,23:15,TTL,総合,5,47NEWS,歩夢ちゃん虐待死事件には続きがあった　床下にあった「もう一つの遺体」は一体、誰なのか？　主犯とされた「あおい」の奇妙な人生,https://news.yahoo.co.jp/articles/5dbce323df31a9c376039388d5c3267ca5fa835a,2/13(火) 10:32
2024-02-13,23:15,TTL,総合,6,スポーツ報知,元ＴＢＳ安東弘樹アナ「実は、弟が」と驚きの職業を告白　フォロワーびっくり「おめでとうございます」の声,https://news.yahoo.co.jp/articles/be7fd7a36550838ee03e7f8323a8649c9ce8b138,2/13(火) 15:00
2024-02-13,23:15,TTL,総合,7,大手小町（読売新聞）,結婚式に黒のウェディングドレス…タブーだったはずなのに着用する花嫁が増えている背景とは,https://news.yahoo.co.jp/articles/f1a4bea5b36ab6affca850d98ad6709cadad356d,2/13(火) 12:13
2024-02-13,23:15,TTL,総合,8,スポニチアネックス,元TBS・安東弘樹アナ　「実は…」弟の職業を告白　「私が言うのもなんですが」,https://news.yahoo.co.jp/articles/2ea9ea80726f0546a0e5235033853df188fbbdee,2/13(火) 17:58
2024-02-13,23:15,TTL,総合,9,オリコン,「やめて！撮らないで」スーパーアキダイ社長がネット動画で暴走　“鮮度過ぎた食材”を撮影され、大慌て？,https://news.yahoo.co.jp/articles/9ff710848e661cbbc8b7ad5a727dcec6f6eec87f,2/13(火) 17:03
2024-02-13,23:15,TTL,総合,10,FNNプライムオンライン,【注目】大谷翔平の“日替わりポルシェ”　全て企業提供かと思いきや…意外な“事実”が判明,https://news.yahoo.co.jp/articles/e8a6656d2d80ec32810ee94a0ade9024aa643689,2/13(火) 15:07
2024-02-13,23:15,TTL,総合,11,中日スポーツ,楽天・今江監督が初のカミナリ 9四死球の救援陣に「投げ込めない時点で立つ資格が難しく」,https://news.yahoo.co.jp/articles/a39c27e3532953fcfce655da5413d7cd2d8af312,2/13(火) 19:13
2024-02-13,23:15,TTL,総合,12,まいどなニュース,ドミノ・ピザが謝罪 問題動画の店舗を即日営業停止、生地は全廃棄「またバイトテロ」と批判も「対応速い」と賞賛の声も,https://news.yahoo.co.jp/articles/66e96bb85cb1915d517bfafe044c25cf1f1ed3c1,2/12(月) 23:55
2024-02-13,23:15,TTL,総合,13,オリコン,『仮装大賞』梅沢富美男の審査に評価の声　厳しい1点…的確なコメントに欽ちゃん感謝「番組にずっと来てね。ありがたい」,https://news.yahoo.co.jp/articles/90c0ca80619392967c9900b67724b0f2e1f55587,2/12(月) 20:57
2024-02-13,23:15,TTL,総合,14,スポニチアネックス,吉本ばなな氏　カンテレから謝罪受けたこと明かす　番組スタッフがXで取材依頼、「失礼すぎる」と批判殺到,https://news.yahoo.co.jp/articles/5e9991176ca4de5dac5a81cab0912b0f453f0851,2/13(火) 16:18
2024-02-13,23:15,TTL,総合,15,スポニチアネックス,品川祐　「咳が止まらない」体調不良の原因が判明「ちょっとしたことで咳込むなぁとは思ってた」,https://news.yahoo.co.jp/articles/228a6fa420aca852745bf94f6c508940fbc64a97,2/13(火) 17:02
2024-02-13,23:15,TTL,総合,16,ねとらぼ,1歳妹を溺愛する18歳兄、しかし妹のひと言に表情が一変「ちがうなぁ!?」　ママも笑っちゃうオチに「かわいいし天才笑」「何度も見ちゃう」,https://news.yahoo.co.jp/articles/56e72cafb79e058a7ed5b349010cb877a0739b38,2/13(火) 8:30
2024-02-13,23:15,TTL,総合,17,Hint-Pot,「元気で明るい娘にいつ戻るの？返して」　保育園の節分で心に傷　どうすれば…母の悲痛,https://news.yahoo.co.jp/articles/db99bda80acf64ca5cc9d62e900d0618495ad3ab,2/13(火) 12:21
2024-02-13,23:15,TTL,総合,18,日刊スポーツ,若狭勝弁護士、松本人志の文春裁判の損害賠償額「２億円でも３億円でも松本さん側の勝利」,https://news.yahoo.co.jp/articles/4b3ff0d51d8d474aebfcf96f5a2eee058026a706,2/13(火) 13:42
2024-02-13,23:15,TTL,総合,19,スポニチアネックス,東出昌大　財布、クレカ、携帯、免許証…「ワケあって」全て紛失　「ワイルド」「何とかなりそう」の声,https://news.yahoo.co.jp/articles/38bd57440e2d68022384eb53e3c48d8fda16d90b,2/13(火) 19:25
2024-02-13,23:15,TTL,総合,20,スポーツ報知,「ラヴィット！」初出演した人気女優の姿にネット騒然「えっ…」「マジ？」「目が覚めた」「どゆこと？」,https://news.yahoo.co.jp/articles/893939a82d1a334f94571ce3b6a0b242eef2cdbc,2/13(火) 14:11
2024-02-13,23:15,TTL,総合,21,＆GP,ザ・ノース・フェイス「ソリッパー」が長時間移動をグッとラクにしてくれました,https://news.yahoo.co.jp/articles/d3e328b2f90a509262161ff4161de7d2c59e8c2b,2/12(月) 20:00
2024-02-13,23:15,TTL,総合,22,スポーツ報知,ミヤネ屋で「弁護士同士がバトってる」「半年分の『文春』聞いたわ」松本人志の訴訟めぐり１０分激論,https://news.yahoo.co.jp/articles/a42f55c332efebe9323d69390a07e121f2500145,2/13(火) 18:21
2024-02-13,23:15,TTL,総合,23,婦人公論.jp,麻疹にかかった息子が4歳で最重度知的障がい者に…「飛び降りたら楽になるかも」思いつめていた私の目を覚ました姉のある一言とは,https://news.yahoo.co.jp/articles/08343de435b0fb33faddeac2d2c460b9238c60de,2/13(火) 12:32
2024-02-13,23:15,TTL,総合,24,ゲキサカ,川崎Fが中国アウェーで先勝!相手がラフプレー連発の難戦も新外国人FWらのゴールで競り勝つ,https://news.yahoo.co.jp/articles/cc8e9dc4f48b25b106ac92d170a85b93b5bda31c,2/13(火) 21:01
2024-02-13,23:15,TTL,総合,25,LIMO,「東京藝術大学」の卒展の投稿でひと悶着かと思いきや　その後の展開に思わずほっこり,https://news.yahoo.co.jp/articles/dcc8d46dcde3cbee6e75dfff1e31d915eda7cd3b,2/13(火) 17:22
2024-02-13,23:15,TTL,総合,26,デイリースポーツ,「マエストロ」家族団らん直前、響・芦田愛菜のなにげない行為にネット悲鳴「流石にやばい」,https://news.yahoo.co.jp/articles/a0386a7c6475cc1dc44a3c0ba11d4fd967141c51,2/13(火) 16:47
2024-02-13,23:15,TTL,総合,27,RBC琉球放送,またドリフトダイビングで事故　与那国島沖で神奈川県の女性（39）が意識不明　去年9月には1人死亡、1人行方不明に,https://news.yahoo.co.jp/articles/5adb631de9a1b88fb23629e02c846ab3acdaa0c7,2/13(火) 15:14
2024-02-13,23:15,TTL,総合,28,婦人公論.jp,71歳団地ひとり暮らし、離婚・子ども3人の子育て・がん闘病…すべて乗り越えた先に辿り着いたもの,https://news.yahoo.co.jp/articles/bb14a9e0f15b6f99d49f993e2dbd1a111915ca59,2/13(火) 12:32
2024-02-13,23:15,TTL,総合,29,ABEMA TIMES,市川團十郎、長男・勸玄が体調不良で病院へ「めちゃくちゃ抱きしめました」,https://news.yahoo.co.jp/articles/95534b6e12c9ae612a2ea687a555c4c35f64c390,2/13(火) 18:35
2024-02-13,23:15,TTL,総合,30,中日スポーツ,東国原英夫、松本人志は「『文春』と『文春に告白した女性』両方を相手取って訴訟すべき」重ねて持論,https://news.yahoo.co.jp/articles/947ae503df475216dc8e736fd80f5468944958c8,2/13(火) 21:16
2024-02-13,23:15,TTL,総合,31,デイリースポーツ,「光る君へ」で清少納言の発音が話題に「そこで区切るって初めて知った」の声多数,https://news.yahoo.co.jp/articles/5c39215cbf5afac2dca36330d0b7f8cd2b9573c5,2/13(火) 15:50
2024-02-13,23:15,TTL,総合,32,ENCOUNT,療養中のフジ渡邊渚アナ、最新の血圧を公開　20代女性平均を大きく下回る数値に「血圧を上げたい」と切なる願い,https://news.yahoo.co.jp/articles/5fc974131a3feeb34a904e6b1b2fc8e5a00e87b8,2/13(火) 19:23
2024-02-13,23:15,TTL,総合,33,Full-Count,大谷翔平の隣にいた“懐かしき人物”　「お見かけしたことある」キャンプ登場で話題,https://news.yahoo.co.jp/articles/63fe1245a8cefe135c5f97fa687e177197f6ec05,2/13(火) 7:40
2024-02-13,23:15,TTL,総合,34,サンケイスポーツ,巨人・阿部慎之助監督が入れ替え明言　野手ではオコエ、中田が１軍へ　岡田、中山、ウレーニャが２軍降格,https://news.yahoo.co.jp/articles/c514604cba74d99ec29a204ef1e12a854b60ca43,2/13(火) 16:23
2024-02-13,23:15,TTL,総合,35,J-CASTニュース,「なぜメディアミックスに漫画家が細かく口出しするのか」　現役漫画家が解説するその背景,https://news.yahoo.co.jp/articles/adda3962fd56e02a2596980c1c13cdc1c70df836,2/13(火) 16:19
2024-02-13,23:15,TTL,総合,36,クックパッドニュース,え、そうだったの？実はコーヒーと食べ合わせNGな食べ物【管理栄養士が解説】,https://news.yahoo.co.jp/articles/9af9f51fe8d227e69e1f53ab42d311000f5a38fa,2/12(月) 21:30
2024-02-13,23:15,TTL,総合,37,まいどなニュース,韓国から8年ぶりに帰国したら→日本が「ややこしくなってた」　買い物事情に共感の声「非効率的すぎる」「店員も困る」,https://news.yahoo.co.jp/articles/02216931961cc923fbebaf0c470e3bd8add931e6,2/13(火) 20:05
2024-02-13,23:15,TTL,総合,38,LIMO,65歳以降、働く気は一切ありません。夫婦2人「貯蓄2000万円・年金20万円」の老後シミュレーション,https://news.yahoo.co.jp/articles/a1af5b677b9a2a11288f0c32578312df188f0337,2/13(火) 20:47
2024-02-13,23:15,TTL,総合,39,RONSPO,なぜ久保建英はビッグクラブ移籍を選択せずレアル・ソシエダと2029年6月まで契約を延長したのか…その裏事情とは？,https://news.yahoo.co.jp/articles/f8c236cd4c0ef9ff6fa61d8bba1174e6a7528f58,2/13(火) 6:12
2024-02-13,23:15,TTL,総合,40,ITmedia NEWS,ANYCOLOR、代表の謝罪動画を公開　「にじさんじEN」巡る問題で【全文書き起こし、日本語訳あり】,https://news.yahoo.co.jp/articles/6df3a9d40caa6efe5f16c5585dfb9e0bda8df4ef,2/13(火) 16:41
