scrp_date,scrp_time,genre_en,genre_jp,rank,media_jp,title,link,date_original
2026-02-02,22:31,world,国際,1,CNN.co.jp,記録的な寒波の米フロリダ州、「凍って」落ちたイグアナの回収呼びかけ,https://news.yahoo.co.jp/articles/411e0c591cc68ed85715090606d44b3c9b87d081,2/2(月) 9:58
2026-02-02,22:31,world,国際,2,中央日報日本語版,横になった女性に触れながら上から眺めるアンドルー元王子…衝撃の写真公開で英国に波紋,https://news.yahoo.co.jp/articles/21ca2686b960a260bc1ef6e6412ca95700578abb,2/2(月) 9:52
2026-02-02,22:31,world,国際,3,KOREA WAVE,韓流スターに人種差別？…ミラノのファッションショーで物議を醸す“窮屈な瞬間”,https://news.yahoo.co.jp/articles/babb6c1e4aa42d385b7df3dba2d7323411ee0f6a,2/2(月) 17:03
2026-02-02,22:31,world,国際,4,中央日報日本語版,日本、海底レアアースの試験掘削に成功…東京大「1600万トンと推計、埋蔵量世界3位」,https://news.yahoo.co.jp/articles/e504a4ddfa69e10571be91bbea8b263252e5c89a,2/2(月) 14:21
2026-02-02,22:31,world,国際,5,中央日報日本語版,白人夫妻の間に生まれた「黒人の赤ちゃん」…遺伝子検査で衝撃＝米国,https://news.yahoo.co.jp/articles/6308ced9cbb6f5f42c4cd0534602b9725518d865,2/2(月) 7:26
2026-02-02,22:31,world,国際,6,共同通信,雪中帰宅の少年、五輪開会式へ　バスの特別料金を支払えず下車,https://news.yahoo.co.jp/articles/eaf579b4f1fec8039f537e0fa97d1f1e376d94c3,2/2(月) 20:38
2026-02-02,22:31,world,国際,7,ロイター,金価格見通し、年末までに6300ドル　需要堅調＝ＪＰモルガン,https://news.yahoo.co.jp/articles/03940c3ae8b719652d7697b63dfb880e6b4871d0,2/2(月) 15:04
2026-02-02,22:31,world,国際,8,ハフポスト日本版,「私たちは野蛮人ではない」グラミー賞で最優秀アルバム賞歌手がトランプ政権を真っ向から批判,https://news.yahoo.co.jp/articles/eb7ee18004165c644f1523e35a90c4a0d401119a,2/2(月) 20:36
2026-02-02,22:31,world,国際,9,BBC News,映画「メラニア」監督、エプスティーン元被告関連資料に写真　女性に抱きつき,https://news.yahoo.co.jp/articles/4e26c5a54682436b9aa13e198aebc694e061ce7a,2/2(月) 18:06
2026-02-02,22:31,world,国際,10,中央日報日本語版,金・銀ショックの裏に中国の投機勢力か…前日に急落の警告もあった,https://news.yahoo.co.jp/articles/9e5366fbf4065b1fa3b703d814cac4513b8944cf,2/2(月) 16:40
2026-02-02,22:31,world,国際,11,中央日報日本語版,「ゲイツ氏、密かに性病の薬調達してほしい」…エプスタイン文書の追加公開で波紋,https://news.yahoo.co.jp/articles/781f33a5e474d19c7cc71079c2a4e79345c7578b,2/1(日) 13:24
2026-02-02,22:31,world,国際,12,ロイター,金・銀価格が続落、ＣＭＥの証拠金引き上げで売り加速,https://news.yahoo.co.jp/articles/953d0fd52a0c6324587ecb950918a65c8278c1e9,2/2(月) 18:42
2026-02-02,22:31,world,国際,13,CNN.co.jp,ドキュメンタリー映画「メラニア」が異例のヒット　アマゾンの法外な製作費に広がる疑念,https://news.yahoo.co.jp/articles/511b22fb5c318932c453a7ff8ce62f14fd9ef6ab,2/2(月) 14:40
2026-02-02,22:31,world,国際,14,CNN.co.jp,「エプスタイン文書」追加公開、元王子のアンドルー氏と床に倒れた女性の写真か,https://news.yahoo.co.jp/articles/ac999de75d8311e7a17b607f0943503e0ed8f5cb,2/1(日) 9:29
2026-02-02,22:31,world,国際,15,BuzzFeed Japan,「見ていて緊張した」極寒のなか池に落ちた犬→硬直する体を引き上げ、無事救出。当局が映像を公開（米ミズーリ）,https://news.yahoo.co.jp/articles/169b783bc77e43082bdd1ba508d4be9d17b93f7f,2/2(月) 21:10
2026-02-02,22:31,world,国際,16,読売新聞オンライン,中国・王毅外相と会談したロシア・ショイグ氏「日本の軍国主義加速させる政策注視」…協調し日本に圧力か,https://news.yahoo.co.jp/articles/821f45ec37b158d3b080f2ecfc6812047fc09ca2,2/2(月) 12:54
2026-02-02,22:31,world,国際,17,BBC News,ミャンマーで詐欺拠点運営、中国が一族4人を処刑　今年2例目,https://news.yahoo.co.jp/articles/12034845df4f4659bb9117bf6225cd4463ab36b5,2/2(月) 18:08
2026-02-02,22:31,world,国際,18,CNN.co.jp,「すべてを壊していく」、SNSで人気の教会の立ち入りを制限へ　イタリア,https://news.yahoo.co.jp/articles/316800b5d23d55f858af773348bdc7a8ac50a362,2/2(月) 17:57
2026-02-02,22:31,world,国際,19,KOREA WAVE,春節に中国人観光客25万人が韓国へ…人気旅行先で“日本超え”の逆転,https://news.yahoo.co.jp/articles/2d4ec93bb287ba532e56544ae723e240fd674aeb,2/2(月) 5:42
2026-02-02,22:31,world,国際,20,共同通信,中国、春節で95億人大移動　日本、人気旅行先10位の圏外に,https://news.yahoo.co.jp/articles/3e5a9a073946e57046a386e9f76aaecdbbf7d530,2/2(月) 16:07
2026-02-02,22:31,world,国際,21,FNNプライムオンライン（フジテレビ系）,中国と貿易協定結べば「非常に重要な措置を取る」トランプ大統領がカナダをけん制,https://news.yahoo.co.jp/articles/fc598c652b253461da2e70577277a66457890405,2/1(日) 18:27
2026-02-02,22:31,world,国際,22,中央日報日本語版,【コラム】韓国が米国の国防戦略で見落としていた真実,https://news.yahoo.co.jp/articles/a48bc8c57c4da15318a79f6ff8eaf117a65dc744,2/2(月) 17:15
2026-02-02,22:31,world,国際,23,中央日報日本語版,【ミリタリーブリーフィング】フィンランド軍が米軍をすべて圧倒…グリーンランド狙う米国、北極戦闘力は低い（2）,https://news.yahoo.co.jp/articles/56f3d4e76946716377ceaf8796b68797a556228f,2/2(月) 16:04
2026-02-02,22:31,world,国際,24,CNN.co.jp,致死率50％超のニパウイルス、インドで感染報告　知っておくべきこと,https://news.yahoo.co.jp/articles/9e33d4a0a0915ae371aaad113c64af2a39154b8f,1/30(金) 18:15
2026-02-02,22:31,world,国際,25,KOREA WAVE,韓国の友人が言い放った「日本は頂点を極めた国。韓国より上」…「給料聞いただけなのに」ネット騒然,https://news.yahoo.co.jp/articles/4e0f2b4863b9ed9d18bee69fa162e1c397d74ca1,2/2(月) 5:03
2026-02-02,22:31,world,国際,26,時事通信,米、円安けん制強める　日本の混乱波及懸念,https://news.yahoo.co.jp/articles/8ab51894bd51184f672fca40551708435121e64c,2/2(月) 7:07
2026-02-02,22:31,world,国際,27,中央日報日本語版,BTSツアー、中国だけ1公演もなし…「限韓令の解除には時間がかかるだろう」,https://news.yahoo.co.jp/articles/991cc61c200a2349df7c8bb533016f7e67560592,2/2(月) 9:07
2026-02-02,22:31,world,国際,28,MEGABRASIL,ブラジル陸軍、リオで初の女性新兵の編入開始,https://news.yahoo.co.jp/articles/f2d3d13863c43a6a8e993b99ce833476f87f0b46,2/2(月) 22:00
2026-02-02,22:31,world,国際,29,KOREA WAVE,韓国の高齢者支出、GDP比4.8％で日本の半分以下…OECD41カ国中「最下位」,https://news.yahoo.co.jp/articles/21adef149bcd868d9924ff814964e55b2ae26a09,2/2(月) 11:54
2026-02-02,22:31,world,国際,30,ロイター,焦点：日中関係の行方占う衆院選、高市氏勝利なら中国は戦略変更も,https://news.yahoo.co.jp/articles/90df27975839d9990c0dda8048a17f60dc5a7386,1/30(金) 7:11
2026-02-02,22:31,world,国際,31,読売新聞オンライン,中国の地裁、収賄罪に問われた前司法相に無期懲役と個人財産没収の判決,https://news.yahoo.co.jp/articles/647feafa5183cf4734c290700b2f3dc68a0327ae,2/2(月) 21:44
2026-02-02,22:31,world,国際,32,中央日報日本語版,ベッカム夫妻、長男の「絶縁」宣言に…「離婚してこそ和解できる」,https://news.yahoo.co.jp/articles/ae61555ad173e732896c1431e9dfa9759d93b317,1/30(金) 9:57
2026-02-02,22:31,world,国際,33,TBS NEWS DIG Powered by JNN,アメリカ移民当局また市民を射殺　トランプ政権批判が全米に拡大　“ICE監視活動”に密着　トランプ氏が姿勢軟化も抗議活動広がるばかり…【サンデーモーニング】,https://news.yahoo.co.jp/articles/dc9ef11ebcee6a46ea7c9d9377c79ccaa85ca526,2/1(日) 15:54
2026-02-02,22:31,world,国際,34,中央日報日本語版,小学生宅に侵入しベッドに寝かせた女性…見守り職員が来るとズボンを下ろす＝韓国,https://news.yahoo.co.jp/articles/05dae4e910f85465ed57a3a39957eddb638d530b,2/2(月) 10:21
2026-02-02,22:31,world,国際,35,時事通信,前司法相に無期懲役　収賄罪で　中国,https://news.yahoo.co.jp/articles/9c556007d885d22e9d2696ff6037976603b2af20,2/2(月) 20:29
2026-02-02,22:31,world,国際,36,朝鮮日報日本語版,腹痛を訴える6歳女児、胃の中に毛髪の塊　／サウジアラビア,https://news.yahoo.co.jp/articles/37da61c3d50586ceecdcfe106fa0fb42eed012fb,2/2(月) 11:23
2026-02-02,22:31,world,国際,37,中央日報日本語版,「かっこ悪いiPhone」よく売れたが…人材と革新で問題抱えるアップル,https://news.yahoo.co.jp/articles/e9f5b8188cfe186e6f01c2fd44b48f91220898e4,2/2(月) 10:47
2026-02-02,22:31,world,国際,38,中央日報日本語版,ドイツの韓国車代理店オープン行事に着物姿の女性が登場,https://news.yahoo.co.jp/articles/9bd3098725c943e1fa4cb3cd0f041acc40d5ed7b,2/2(月) 11:35
2026-02-02,22:31,world,国際,39,ロイター,ドイツ、最近の緊張にもかかわらず「中国より米国に近い」と外相,https://news.yahoo.co.jp/articles/365c11517e77837b5b11efe08d6fe59f2e6548e2,2/2(月) 16:48
2026-02-02,22:31,world,国際,40,産経新聞,ロシア、ウクライナの電力インフラへの攻撃を再開か　米露ウクライナ第2回協議の前に,https://news.yahoo.co.jp/articles/2c49639951d95ffb0845f02e4e21bf155fea830a,2/2(月) 21:30
