scrp_date,scrp_time,genre_en,genre_jp,rank,media_jp,title,link,date_original
2025-03-07,14:07,sports,スポーツ,1,Full-Count,阪神は「どうして手放してしまった」　トレードで覚醒→初侍Jで157キロ「世界にバレる」,https://news.yahoo.co.jp/articles/0f8e6e916d1297e05bffd4d93b70e08a1b9af256,3/7(金) 11:12
2025-03-07,14:07,sports,スポーツ,2,Full-Count,大谷翔平、5月の二刀流復帰が後倒しか　投手調整を中断→打者専念…指揮官説明「休養を」,https://news.yahoo.co.jp/articles/5fba2796b98b3e1b52c8f916fe2614a40ed81c02,3/7(金) 8:21
2025-03-07,14:07,sports,スポーツ,3,ENCOUNT,人気覆面レスラーが素顔披露　マスク脱いだ姿に「ものすごく綺麗ッ！」「素顔がバレないか心配」の声,https://news.yahoo.co.jp/articles/b460fea5be1ff271b1799ceeaba21f0ef79f63c1,3/7(金) 11:51
2025-03-07,14:07,sports,スポーツ,4,スポニチアネックス,ブラジルが3大会ぶりWBC本戦出場へ！松元ユウイチ監督は笑顔でガッツポーズ　出場全20チームが決定,https://news.yahoo.co.jp/articles/3a07c861e098d10919cac463c4d36fa88e4c8162,3/7(金) 12:32
2025-03-07,14:07,sports,スポーツ,5,東スポWEB,井上尚弥の今後２試合が決定　格下相手に米メディア不満「リスク冒さない」,https://news.yahoo.co.jp/articles/c61b403aa55eb1f6e4e89f71ed73e57387e6f4d0,3/7(金) 10:41
2025-03-07,14:07,sports,スポーツ,6,ゴルフのニュース,【速報】小祝さくらが予選通過に黄信号… スコアを落とし通算10オーバーで後半へ 吉田鈴が首位に浮上,https://news.yahoo.co.jp/articles/bddb808f410ac4400902739a4a4c3010c98b7e70,3/7(金) 12:14
2025-03-07,14:07,sports,スポーツ,7,西スポWEB OTTO！,異例の侍ジャパン→即2軍合流「爪痕残せれば可能性はある」ソフトバンク廣瀨隆太が誓う逆転開幕1軍,https://news.yahoo.co.jp/articles/499172a4085b4d723678edef54c17249c9aa1596,3/7(金) 7:11
2025-03-07,14:07,sports,スポーツ,8,スポーツ報知,新横綱・豊昇龍は初日に阿炎、２日目に若隆景と対戦　カド番大関の琴桜は若元春と豪ノ山の挑戦を受ける…春場所,https://news.yahoo.co.jp/articles/3403dfc69872e5ef639a0dbdf57babdce902dfab,3/7(金) 11:24
2025-03-07,14:07,sports,スポーツ,9,スポニチアネックス,阪神・前川が今春OP戦3号2ラン！DeNA左腕・東から右翼ポール際へ鮮やかなアーチ,https://news.yahoo.co.jp/articles/0c21baed85a4b52eccbca875366de22266c19f06,3/7(金) 13:28
2025-03-07,14:07,sports,スポーツ,10,デイリースポーツ,ＢＤ５秒ＫＯ負け　レオが謝罪　敗戦後にラウンドガール突き飛ばす　すでに直接やり取り「負けた事が悔しくて」と釈明,https://news.yahoo.co.jp/articles/901c918d5f9644aef991898bf1f2265a38ec219a,3/7(金) 10:22
2025-03-07,14:07,sports,スポーツ,11,Full-Count,ドジャースが5人のマイナー“降格”を発表　残り52人、開幕メジャー枠へ熾烈な競争,https://news.yahoo.co.jp/articles/e7367e81c8094cd77be4b51519fd7ac56f92d3a7,3/7(金) 7:49
2025-03-07,14:07,sports,スポーツ,12,高校野球ドットコム,先発と中継ぎの両立で「投げ方が分からなくなった」…プロ野球「最強世代」剛腕ドライチの苦悩,https://news.yahoo.co.jp/articles/3abb4cbda8d13372c43a6ace4f897bc06dc2823e,3/7(金) 12:00
2025-03-07,14:07,sports,スポーツ,13,RONSPO,横浜FCへ電撃移籍の山田康太が「チームメイト妻への不適切メール」問題をフライデーに暴露されてサポは騒然…元所属先ガンバは「事実と異なる報道」と抗議,https://news.yahoo.co.jp/articles/0d21bedeb03581cc725b6c2fa005d10d9cd7eecb,3/7(金) 6:32
2025-03-07,14:07,sports,スポーツ,14,REAL SPORTS,なぜJ1湘南は高卒選手が活躍できるのか？　開幕4戦無敗。「入った時みんなひょろひょろ」だった若手躍動の理由,https://news.yahoo.co.jp/articles/e0a42f0c858ec58705881131cc57fa919338932b,3/7(金) 11:59
2025-03-07,14:07,sports,スポーツ,15,高校野球ドットコム,「ハンカチ世代」のドライチ剛腕、27歳で引退後「ドラフト候補を次々輩出」野球塾塾長になっていた！,https://news.yahoo.co.jp/articles/90f0d57182cd80d1a5d77565fa66b3571dc0ae5b,3/7(金) 12:00
2025-03-07,14:07,sports,スポーツ,16,中日スポーツ,ロバーツ監督、大谷翔平の投手練習「ペースダウン」の理由語る…5月復帰のトーン微妙に変化、キャンプ中の「ライブBP」なし,https://news.yahoo.co.jp/articles/1bba5d9fd36533b98cf42c45c3e19c451086f76a,3/7(金) 8:32
2025-03-07,14:07,sports,スポーツ,17,日刊ゲンダイDIGITAL,男性キャディーが人気女子プロ3人と壮絶不倫！文春砲炸裂で関係者は「さらなる写真流出」に戦々恐々,https://news.yahoo.co.jp/articles/56a03c024b1ba46453ef0ca45ffebe35576e01ad,3/6(木) 7:03
2025-03-07,14:07,sports,スポーツ,18,4years.,戦力外通告を受けた後、警察官を経て、母校のコーチに就任　予測不能な未来でも「野球にずっと携わりたい」,https://news.yahoo.co.jp/articles/f5c51dce4dc1452f27343cdaa719e66e9fc4cf57,3/7(金) 12:12
2025-03-07,14:07,sports,スポーツ,19,日刊スポーツ,【ＢＤ】DEEP佐伯代表が水をかけられ、としぞうが素手で殴られ失神KOされたことの考察,https://news.yahoo.co.jp/articles/33128011df5f19777ca01cba5b9f2e902b6810c4,3/7(金) 11:45
2025-03-07,14:07,sports,スポーツ,20,Full-Count,巨人主砲への死球で苦情殺到「外に出るのも危ない」　あらぬ“故意”疑惑に苦悩,https://news.yahoo.co.jp/articles/621b55a3c3c7f2f9b891893bb4764a9395083953,3/7(金) 6:50
2025-03-07,14:07,sports,スポーツ,21,日刊ゲンダイDIGITAL,巨人阿部監督が見切り発車で田中将大に「ローテ当確」出した本当の理由…16日カブス戦にも登板予定,https://news.yahoo.co.jp/articles/45888c7d4f5638b4610776652969761d1a1a81f2,3/7(金) 11:31
2025-03-07,14:07,sports,スポーツ,22,ABEMA TIMES,「久保だけレベルが違いすぎる」久保建英、DFの想像を超えた“2連続縦突破”にスタジアム騒然「マークの足止まってたな」徹底マークのマンU守備網を破壊した圧巻・切り裂きドリブル！,https://news.yahoo.co.jp/articles/96f2a7acd85fdec554491b1c0da1942c0908647c,3/7(金) 12:02
2025-03-07,14:07,sports,スポーツ,23,ENCOUNT,西村修さん、生前に語っていた長州力への感謝　帰国命令拒否で「大げんか」も…鳴かず飛ばずの日々を救ったひと言,https://news.yahoo.co.jp/articles/c5efafae156bfdffb34e951f4c992945ee47e158,3/7(金) 9:40
2025-03-07,14:07,sports,スポーツ,24,CoCoKARAnext,「なんてことだ。全部が台無しなる」――ド軍CEOが舞台裏で漏らしていた本音　米記者が回想した水原被告の“虚飾まみれの事件”,https://news.yahoo.co.jp/articles/0fa2b93ef4dba955e99374290477bb718214b368,3/7(金) 11:01
2025-03-07,14:07,sports,スポーツ,25,Full-Count,清宮幸太郎は「40本打てると思う」　美しすぎる特大弾にX興奮「やっぱりガチ覚醒」,https://news.yahoo.co.jp/articles/764c5b854bc1b4413cde737c15e4f12300520e51,3/7(金) 13:05
2025-03-07,14:07,sports,スポーツ,26,日刊スポーツ,大谷翔平の偉業へのボンズ氏の発言が物議「今の選手がいい成績を残せるのは当たり前」,https://news.yahoo.co.jp/articles/ca74136a2d015134a8bba4e75672c1b2c49a6a12,3/7(金) 13:31
2025-03-07,14:07,sports,スポーツ,27,CoCoKARAnext,「ものすごいチャンスがある」阿部巨人注目のし烈な開幕1軍争い　球界OBが着目した「武器を持っている選手」とは,https://news.yahoo.co.jp/articles/4e3acb2925d081945691de62194c4aebb2174b5e,3/7(金) 12:33
2025-03-07,14:07,sports,スポーツ,28,東スポWEB,佐々木朗希を米誌が徹底分析　スプリット絶賛の一方で「直球で最も奇妙なのは回転数」,https://news.yahoo.co.jp/articles/cda5bcab8cfa452e34f32df15efeb909eaf4f1a5,3/7(金) 11:31
2025-03-07,14:07,sports,スポーツ,29,Full-Count,侍ジャパンの試合でも聞こえた「つば九郎」　粋な対応に「こんなの泣くって」,https://news.yahoo.co.jp/articles/bdc61ce6914707d3a7dd45a4bbb875a328503fea,3/7(金) 10:29
2025-03-07,14:07,sports,スポーツ,30,日刊ゲンダイDIGITAL,メジャースカウトが目を付けた侍J投打の若手2人は…23年ドラ1右腕と新庄監督のお墨付き野手,https://news.yahoo.co.jp/articles/30f88f2afed7a85a46e7ac0f1f1bf4de554517db,3/7(金) 11:31
2025-03-07,14:07,sports,スポーツ,31,イーファイト,“マッスル女子”平田樹、ブラから飛び出す広背筋にファン驚き！最強ケトルベル練習の効果か,https://news.yahoo.co.jp/articles/7cdd162870e431b3471b14ebba772af4aaa74813,3/7(金) 12:28
2025-03-07,14:07,sports,スポーツ,32,ENCOUNT,RIZINファイターが“美人女医”の姉の誕生日を祝福　家族ショットにはネット仰天「ご家族、若返ってない？」,https://news.yahoo.co.jp/articles/850e42af0419172a19b868d96a46d7677477a23a,3/7(金) 10:01
2025-03-07,14:07,sports,スポーツ,33,日刊スポーツ,ドジャース右腕の22歳妻、愛犬コーギーが大谷家のデコピンとコラボ　“両犬”ともご機嫌な表情,https://news.yahoo.co.jp/articles/8927eb194d35bed136d234400a761831a95c0fde,3/7(金) 10:37
2025-03-07,14:07,sports,スポーツ,34,RONSPO,朝倉未来―平本蓮中止で大ピンチのRIZINの5.4東京ドーム「THE MATCH2」にメイウェザーの緊急参戦プランが浮上…気になる対戦相手は？,https://news.yahoo.co.jp/articles/35ec8ee79f818a9813509cedaa291073a722b060,3/7(金) 6:40
2025-03-07,14:07,sports,スポーツ,35,Full-Count,ハムに現れた「日本が誇る二刀流」　投手なのにDHで快音…巧みな打撃は「野手以上」,https://news.yahoo.co.jp/articles/c67d9d083be909c0b478396237eb062295b707d5,3/7(金) 9:15
2025-03-07,14:07,sports,スポーツ,36,DAZN News,カペッロ氏、レアル・マドリード時代を振り返る「ロナウドは私が指導した中で一番の選手だった。しかし太っていたから追い出した」｜ラ・リーガ,https://news.yahoo.co.jp/articles/0de597226ca1362d04cbca9e6fca0862543731d1,3/7(金) 11:21
2025-03-07,14:07,sports,スポーツ,37,ゴング格闘技,フォロワー52.4万人の世界でも話題の制服女子ファイターがついに高校卒業、制服ともお別れに,https://news.yahoo.co.jp/articles/b169d6d8af765858bed522fc8183c0cf91888800,3/7(金) 12:20
2025-03-07,14:07,sports,スポーツ,38,ゴルフダイジェスト・オンライン（GDO）,【速報】畑岡奈紗が2Rを単独首位でターン　西郷真央も浮上中,https://news.yahoo.co.jp/articles/d792671346983bc8f1b1d728b8dcfd648ea40e27,3/7(金) 12:13
2025-03-07,14:07,sports,スポーツ,39,デイリースポーツ,大谷翔平、珍しくバット2本折られて“おかわり”　志願の打席でマルチ安打達成　オープン戦打率・417　ロバーツ監督「状態はいい」,https://news.yahoo.co.jp/articles/aa1fde741837c165a8cc9646039d851db6c224e9,3/7(金) 8:31
2025-03-07,14:07,sports,スポーツ,40,スポニチアネックス,「チャモさん」今永昇太が“元同僚”と再会ショット「元気そうやん」「素敵な仲間」とファン歓喜,https://news.yahoo.co.jp/articles/dac692ed07d5fd8a404e0db4d575f0a7818f19fc,3/7(金) 13:19
