scrp_date,scrp_time,genre_en,genre_jp,rank,media_jp,title,link,date_original
2025-04-03,15:09,domestic,国内,1,中日スポーツ,『開封済みの避妊具』皿の投入口に… くら寿司、迷惑行為に声明 「実行者ほぼ特定」「実行者を名乗る者から謝罪の連絡」,https://news.yahoo.co.jp/articles/c0a7bcf7dac941b77766a12ac714aeebec43e17c,4/3(木) 11:55
2025-04-03,15:09,domestic,国内,2,ABEMA TIMES,「礼を失する発言で許容しがたい」自民・船田議員が立憲・藤原議員の憲法審査会における発言に“怒り”,https://news.yahoo.co.jp/articles/e63f8beaeee5b80dd3e93372d0e66bf827f9da35,4/3(木) 11:42
2025-04-03,15:09,domestic,国内,3,デイリースポーツ,フジ被害女性Ａアナ　１人で中居氏部屋へ、直属上司に相談は？に→丸岡いずみ「正直、アナウンサーは上司に相談しにくい」理由→宮根もうなずく,https://news.yahoo.co.jp/articles/051691879d65ec7d94067f59dc5c9cbd37d9d9fe,4/3(木) 0:14
2025-04-03,15:09,domestic,国内,4,弁護士ドットコムニュース,唐揚げを買ったら「生」だった→医者「近々下痢するかも」　販売したキッチンカーの法的責任は？,https://news.yahoo.co.jp/articles/3fbc71ef4f96f9d6ba6b5aa18946f884d3a4e5a1,4/3(木) 14:07
2025-04-03,15:09,domestic,国内,5,産経新聞,枝野会長ら「筋違い」「礼失する」「不適切」　裏方批判の立民新人に苦言続出　衆院憲法審,https://news.yahoo.co.jp/articles/6b9cfc367a7f074e1384e662e03655b7c69d7aeb,4/3(木) 13:18
2025-04-03,15:09,domestic,国内,6,デイリースポーツ,【フジ】中居氏　被害女性Ａアナの酷い体調悪化・入院→本当に自分が原因なのか、仕事や家族の別件かもと思ったと　第三者委に,https://news.yahoo.co.jp/articles/219a9ae08cb2c350c1999213f6b40cdc77c2cdf2,4/2(水) 18:50
2025-04-03,15:09,domestic,国内,7,時事通信,作家の上田秀人さん死去,https://news.yahoo.co.jp/articles/337a595ce24a61c2e4b1276df9f30a0271ebe2a9,4/3(木) 12:54
2025-04-03,15:09,domestic,国内,8,東海テレビ,出れば出るほど赤字…ドリンク＋440円で『うな丼セット』毎朝100人以上訪れる“破格モーニング” 実現できる理由,https://news.yahoo.co.jp/articles/49c777ed7ccc188fab625a58d1dca3fbb30d4131,4/3(木) 12:04
2025-04-03,15:09,domestic,国内,9,読売新聞オンライン,瓶の中でホルマリン漬けにされた胎児の標本3体見つかる…大分県別府市の西別府病院、心当たりがある人探す,https://news.yahoo.co.jp/articles/c1de9ba7f570e9fb8c610a776484e27abbe91c7a,4/3(木) 11:33
2025-04-03,15:09,domestic,国内,10,日テレNEWS NNN,【速報】「ダイタク」大さんら吉本タレント6人書類送検　オンカジ賭博容疑―警視庁,https://news.yahoo.co.jp/articles/33076c7f154956f3e3026329cf99902ee3eef421,4/3(木) 10:00
2025-04-03,15:09,domestic,国内,11,スポニチアネックス,国民民主・玉木代表　トランプ氏の相互関税に「強力な経済対策が必要…ガソリン、電気、税金の負担…」,https://news.yahoo.co.jp/articles/42947de7a79dad68fb5d25c59c09e47285d5d9e5,4/3(木) 12:20
2025-04-03,15:09,domestic,国内,12,読売新聞オンライン,「安心してください、貼れますから」…一見「39枠」の選挙ポスター掲示板に「40～42枠目」,https://news.yahoo.co.jp/articles/a6deba29a0316499ceae4491dc52df5ba97ced99,4/3(木) 13:53
2025-04-03,15:09,domestic,国内,13,デイリースポーツ,【フジ】番組から消えた佐々木恭子アナ「心配の声」　中居氏問題、報告書に役職一致する女性「Ｆアナ」　被害女性支えるも、過酷板挟みでメンタルも限界ギリギリと,https://news.yahoo.co.jp/articles/d8008ca26fc5d51f24d4cb9a43385be3ec2c298e,4/2(水) 20:30
2025-04-03,15:09,domestic,国内,14,日刊スポーツ,くら寿司、迷惑行為の客を「ほぼ特定」→客側からの謝罪打診も→「厳正な対応を行う予定」声明で,https://news.yahoo.co.jp/articles/8361b86805f22b353d147ba6c406452c02f67109,4/3(木) 14:45
2025-04-03,15:09,domestic,国内,15,ハフポスト日本版,「米農家は時給10円」「暑さで野菜が育たない」。東京のど真ん中をトラクターが行進。「令和の百姓一揆」で農家が語った危機感,https://news.yahoo.co.jp/articles/3400f886c6ce6424e23334a5864962f0280bccd4,4/3(木) 10:38
2025-04-03,15:09,domestic,国内,16,テレビ朝日系（ANN）,鎌倉市で直進のバイクと右折のワンボックスカーが衝突　バイクの男性死亡　神奈川,https://news.yahoo.co.jp/articles/4c11bd20da6abd4d2a394b54af22c1bb298c9878,3/31(月) 0:26
2025-04-03,15:09,domestic,国内,17,CBCテレビ,"駆除しても減らない肉食外来魚「ブラウントラウト」""迷惑魚""が犬のおやつに大変身！？苦心する漁協に北海道から思わぬ""救いの手""",https://news.yahoo.co.jp/articles/db79f0be69b53ded48ae3cd858d79ff601f131c4,3/29(土) 6:03
2025-04-03,15:09,domestic,国内,18,FNNプライムオンライン,「かわいがっていたのに」爬虫類イベントで生きたヘビ盗難…スタッフの接客中狙い3万5000円の「ボールパイソン」盗って逃げる　名古屋市,https://news.yahoo.co.jp/articles/0a51222f223466ddf7ea1d7f92fe94bfbbed4aa8,4/3(木) 14:13
2025-04-03,15:09,domestic,国内,19,日刊スポーツ,玉川徹氏“退場”報道のイーロン・マスク氏突き放す「いなくなった方が米国にとってプラス」,https://news.yahoo.co.jp/articles/d32213ae573eb0021242a156d33da35af901f4f4,4/3(木) 13:03
2025-04-03,15:09,domestic,国内,20,読売新聞オンライン,飲食店で9人食中毒、便からノロウイルス検出…刺し身・牡蠣バターなど食べた後で発症,https://news.yahoo.co.jp/articles/120b9a502bbaf0d3577074eb51b412b989e84fdd,4/3(木) 11:50
2025-04-03,15:09,domestic,国内,21,産経新聞,中国と修学旅行相互受け入れ合意の岩屋外相「子供を使い媚びへつらっている」維新・西田氏,https://news.yahoo.co.jp/articles/8cd6cfdfad1f63933025b99c8380cff59cf4379f,4/3(木) 7:00
2025-04-03,15:09,domestic,国内,22,産経新聞,首相、自民政調会長に対応検討指示　日本に24％の相互関税　小野寺氏「大変厳しい数字」,https://news.yahoo.co.jp/articles/4dd626fdbfa78fb8dbd13923f457fd4eae3da5a1,4/3(木) 13:47
2025-04-03,15:09,domestic,国内,23,FNNプライムオンライン（フジテレビ系）,後部座席の女子高校生が投げ出され死亡…2人乗りのバイクが縁石に衝突、運転手の男性（17）は軽傷　埼玉・三郷市,https://news.yahoo.co.jp/articles/acda059e41be705f14363dd62a3d04242fa3ca78,4/3(木) 12:07
2025-04-03,15:09,domestic,国内,24,MBSニュース,"「ご飯は3日に1回。爪も結構かじってた」小学生のときに約3年""車中生活""...居所不明児童だった男性が語る実態　女児コンクリ詰め遺体事件に「僕がああなっていた可能性はゼロではない」",https://news.yahoo.co.jp/articles/58a29d4b4045d64f8af90687bd3afe479181f32b,4/2(水) 15:01
2025-04-03,15:09,domestic,国内,25,TBS NEWS DIG Powered by JNN,トラックと軽乗用車の事故　軽乗用車を運転していた50代男性死亡　群馬県邑楽町,https://news.yahoo.co.jp/articles/77fe0f5410664a2a796aea969c87819841732c28,4/3(木) 13:00
2025-04-03,15:09,domestic,国内,26,テレビ朝日系（ANN）,マンション管理費節約で住民団結　電気一括契約、保険期間10年などで520万円減,https://news.yahoo.co.jp/articles/f0c8fc9e60ec1260e5bc61efcbba9bd898ff59b4,4/3(木) 11:52
2025-04-03,15:09,domestic,国内,27,日刊スポーツ,トランプ関税は「最悪のシナリオ」国民・玉木雄一郎代表、石破首相の緊急渡米＆直接交渉を訴える,https://news.yahoo.co.jp/articles/7410e063021ff2ecb916c9492b9af3d6222a67ce,4/3(木) 14:10
2025-04-03,15:09,domestic,国内,28,読売新聞オンライン,千葉・柏の商業施設で「カッター持った男に１０万円取られた」と通報、アルバイト店員がけが,https://news.yahoo.co.jp/articles/51beb87fa6fa83cba6c066522995e147c1677603,4/3(木) 12:01
2025-04-03,15:09,domestic,国内,29,中日スポーツ,「友好国扱いされてない」 トランプ米大統領の『相互関税』、日本は24％… 「もはや経済的敵国」「報復関税を」反応さまざま,https://news.yahoo.co.jp/articles/cda06a090339af52dfe9e1deddc74982e9fcca6f,4/3(木) 11:30
2025-04-03,15:09,domestic,国内,30,デイリースポーツ,【フジ】中居氏　被害女子アナからの入院連絡に慌てる　入院費支払いにも言及　退院後のインスタ投稿受けフジ編成部長に探り依頼,https://news.yahoo.co.jp/articles/a2ba1c6ee7035c2c5981b14a7f3901262604240e,3/31(月) 20:24
2025-04-03,15:09,domestic,国内,31,日刊スポーツ,泉房穂氏、悪意あるデマ拡散に警告「あまり甘く考えないほうがいい」,https://news.yahoo.co.jp/articles/2f54267fb65582a4d448911bce53d37c1c1909cb,4/3(木) 12:06
2025-04-03,15:09,domestic,国内,32,読売新聞オンライン,東武東上線、池袋―和光市間で運転見合わせ…信号トラブル,https://news.yahoo.co.jp/articles/09bf838226558881c7291f94e2aa95d43ba1b75a,4/3(木) 14:19
2025-04-03,15:09,domestic,国内,33,毎日新聞,滋賀の冷凍庫遺体遺棄　堺市で死亡の夫婦遺書から容疑者らの関与浮上,https://news.yahoo.co.jp/articles/87d2495feb599abd2501f73e34b5c0c6bf13b015,4/3(木) 11:00
2025-04-03,15:09,domestic,国内,34,産経新聞,衆院憲法審の枝野会長「私の責任で提出している」　資料酷評の立民新人議員にきっぱり,https://news.yahoo.co.jp/articles/8c89afa2e8c0be4753606ea0e58c68de48f485ba,3/27(木) 13:46
2025-04-03,15:09,domestic,国内,35,TBS NEWS DIG Powered by JNN,【速報】石破総理　トランプ大統領への直接の働きかけは「全く躊躇するものではない」　アメリカの日本への24%の相互関税巡り,https://news.yahoo.co.jp/articles/3e57bcde92ab609be12a153d95cecc8f5f888adf,4/3(木) 14:19
2025-04-03,15:09,domestic,国内,36,読売新聞オンライン,指定暴力団山口組トップらに傘下組員の出所祝いで金品を与えることなどを禁じる命令…福岡県公安委員会,https://news.yahoo.co.jp/articles/03800bfdcb45343d2235ef274c6741b30ba6277a,4/3(木) 11:37
2025-04-03,15:09,domestic,国内,37,ニッポン放送,新体制、商品戦略……、今後の日産は？ メカニックの視点では？,https://news.yahoo.co.jp/articles/cea30b8e767e4792d16ef0a8c22708d1523f6cf8,4/3(木) 13:00
2025-04-03,15:09,domestic,国内,38,読売新聞オンライン,女性記者にセクハラに該当する不適切な内容のメールを複数回送信、佐賀県神埼市議会議員を議会が厳重注意,https://news.yahoo.co.jp/articles/df70770ac5b939a8ed8269edb4e79de7c4909c1b,4/3(木) 14:11
2025-04-03,15:09,domestic,国内,39,FNNプライムオンライン（フジテレビ系）,【速報】石破首相　トランプ大統領に「直接働きかけを躊躇せず」　追加関税「極めて残念で不本意」見直しを強く求めると表明,https://news.yahoo.co.jp/articles/9ddbef8174077167777ba6804fce9093ecbc7f6d,4/3(木) 14:03
2025-04-03,15:09,domestic,国内,40,日刊スポーツ,【叡王戦】伊藤匠叡王、斎藤慎太郎八段の昼食「一色産うなぎひつまぶし御膳」,https://news.yahoo.co.jp/articles/614e9b681b0d532a0b5a96332e78348b38590f87,4/3(木) 13:15
