scrp_date,scrp_time,genre_en,genre_jp,rank,media_jp,title,link,date_original
2024-09-29,15:07,TTL,総合,1,テレ東スポーツ,大谷翔平 マルチ安打で打率.310に伸ばし「三冠王」の行方は最終戦へ 打率.314で1位のアラエスとは4厘差,https://news.yahoo.co.jp/articles/f79d434336f8d9baec87f9f95244b5a3c1228609,9/29(日) 11:58
2024-09-29,15:07,TTL,総合,2,スポーツ報知,強烈ガラリ！戸田恵梨香　別人のような全身姿　すんごい色気…４年前に松坂桃李と結婚,https://news.yahoo.co.jp/articles/117d911ac0346617ea736cfdfc0fb42528f12ea7,9/29(日) 11:55
2024-09-29,15:07,TTL,総合,3,スポニチアネックス,19歳の浅野を守れ!　巨人ビールかけに専用ボディーガード出現　G党驚き「SPいる」「守られてる」,https://news.yahoo.co.jp/articles/55951d944202212bbdf863c613a3f207e449378d,9/29(日) 0:05
2024-09-29,15:07,TTL,総合,4,Full-Count,デコピンの“異変が「気になってしょうがない」　大谷に抱かれた直後…まさかの事態に注目,https://news.yahoo.co.jp/articles/1064e5f115b87e8e4ab047d1b9a5af0f03a3c058,9/29(日) 7:30
2024-09-29,15:07,TTL,総合,5,ほ・とせなNEWS,パパと遊ぶ生後6ヶ月の赤ちゃん　しかしよく見ると「大きくなったら覚えとけよ」「可愛すぎる」,https://news.yahoo.co.jp/articles/e93f97928842bc3385ae43d266ae1829cc50e6be,9/29(日) 11:30
2024-09-29,15:07,TTL,総合,6,ほ・とせなNEWS,【実話】様子のおかしい3歳児…母「まさかと思った」病院に連れていった結果「そんなことが！」「勉強になった」の声,https://news.yahoo.co.jp/articles/5c88554f91364772a7b1979298a9176733575228,9/28(土) 11:30
2024-09-29,15:07,TTL,総合,7,スポニチアネックス,石破茂新総裁　深センの邦人男児刺殺事件に“怒”「“こんなものはどこでも起こる”とは何ですか！」,https://news.yahoo.co.jp/articles/8c83e9e8cefe338a73f096e48f7f838c1819448c,9/29(日) 10:32
2024-09-29,15:07,TTL,総合,8,デイリースポーツ,小泉進次郎氏が政策まともに答えなかった理由　東野幸治「本当のこと言えないから？分かってないから？」に識者「たぶん後者」,https://news.yahoo.co.jp/articles/c44978a3ef1f907f3e5c0dfb6fe5d4f62608cbd3,9/29(日) 11:05
2024-09-29,15:07,TTL,総合,9,ねとらぼ,ホテルでシャワー、その前に……　ホテル従業員が「これを確認してほしい」と語る“意外なポイント”,https://news.yahoo.co.jp/articles/47a573928e2fc50d7564f9297b1e9e95aea68053,9/29(日) 11:45
2024-09-29,15:07,TTL,総合,10,東京商工リサーチ,ラーメン店と好対照、中華料理店の倒産が低水準の謎,https://news.yahoo.co.jp/articles/6d150e2f09afd6a0e074306bd720bcaa7bcda49d,9/29(日) 7:04
2024-09-29,15:07,TTL,総合,11,RSK山陽放送,【台風情報 最新】「台風18号（クラトーン）」強い勢力に　10月2日（水）以降に沖縄地方に接近か「台風17号（チェービー）」は10月1日（火）以降に関東接近の見込み　今後の進路は?全国の天気への影響は?【29日午後1時半更新】,https://news.yahoo.co.jp/articles/947bdf232842876c4ede1d161d4e1946a08cbe63,9/29(日) 11:08
2024-09-29,15:07,TTL,総合,12,オリコン,高嶋ちさ子“最悪の事態”を謝罪「二度とこの様な事がないよう」　飛行機乗り遅れ→「さすがとしか…」,https://news.yahoo.co.jp/articles/d1b80ceddf3807333ac101764b4e8fffc02dbb0d,9/29(日) 11:15
2024-09-29,15:07,TTL,総合,13,ねとらぼ,「ウソだろ？」　ハードオフに3万円で売っていた“衝撃の商品”に思わず二度見　「ヤバいことになってる」,https://news.yahoo.co.jp/articles/68ffd75ded01f3f7aeedd3cd6d55d5b19761b33b,9/29(日) 12:30
2024-09-29,15:07,TTL,総合,14,デイリースポーツ,上原浩治氏、プロ野球新記録の広島・矢野にまさかの喝「もういい加減にしてくれ、そういう気持ちです」,https://news.yahoo.co.jp/articles/61ba5afd8f5cf73c950398942325f6375aebb967,9/29(日) 9:54
2024-09-29,15:07,TTL,総合,15,Full-Count,首位打者アラエスは最終戦スタメン出場へ…指揮官明言　大谷翔平と4厘差、運命の最終戦,https://news.yahoo.co.jp/articles/e1d3120de780c4370f99dd42f9ee141616a68cf3,9/29(日) 12:26
2024-09-29,15:07,TTL,総合,16,日刊スポーツ,チョコプラ長田、“挨拶してない”と怒られた先輩芸人実名告白「今はもう…いなくなったんで」,https://news.yahoo.co.jp/articles/5687f6e50bec1ee67af8a67c4fc575400ea8426f,9/29(日) 7:57
2024-09-29,15:07,TTL,総合,17,Full-Count,真美子夫人がニヤリ…大谷翔平も思わず「おお！」　中継映像が捉えた“貴重な光景”,https://news.yahoo.co.jp/articles/b2486ad6082eb617774eaa76206f2e80781daccc,9/29(日) 7:10
2024-09-29,15:07,TTL,総合,18,ゴルフ総合サイト ALBA Net,＜中間速報＞竹田麗央が単独首位で後半へ、山下美夢有が1差追走　岩井明愛3差、佐久間朱莉がエース達成,https://news.yahoo.co.jp/articles/01ded21bfcd0dfb50a7013f6fabf256a1b8dc51b,9/29(日) 13:48
2024-09-29,15:07,TTL,総合,19,ENCOUNT,「こんな美人なRIZIN広報最高」　RIZINガールから異例の転身、激変ぶりにネット歓喜「イメージ変わった」,https://news.yahoo.co.jp/articles/6914850bd72fd2966781bf0f556d7ab1ffedef6d,9/29(日) 12:40
2024-09-29,15:07,TTL,総合,20,ENCOUNT,『虎に翼』でブレイクの32歳女優、“激変”ぶりにファン衝撃「全然ちゃう」「かわいすぎる！」,https://news.yahoo.co.jp/articles/ed12cbc38f3391aaab3e196e280bd7a216088d13,9/29(日) 11:05
2024-09-29,15:07,TTL,総合,21,デイリースポーツ,凄い光景　総裁選閉会→降壇した石破氏が→すれ違った人物と一瞬ニヤリ握手　逆転劇の黒幕か　ＮＨＫ中継に映る,https://news.yahoo.co.jp/articles/c9dbbb07faea99a1423922b3a90d8247206afe24,9/28(土) 20:25
2024-09-29,15:07,TTL,総合,22,TBS NEWS DIG Powered by JNN,山本由伸 5回2失点で7勝目、復帰後初勝利！約4か月半ぶりの被弾 得意のカーブは18球中見逃しストライク“1”も粘投,https://news.yahoo.co.jp/articles/b06dad7b142186da1b36d4829132a3217e5e399b,9/29(日) 12:05
2024-09-29,15:07,TTL,総合,23,ファイナンシャルフィールド,ボーナス支給ってなぜ「夏」か「冬」が多いの？秋や春の支給じゃだめなの？,https://news.yahoo.co.jp/articles/ff2b3bf182db6c92cf93336f0469ff5196af80de,9/27(金) 14:50
2024-09-29,15:07,TTL,総合,24,日刊スポーツ,石破茂氏が「固辞報道」高市早苗氏の要職起用問われ「いろんな可能性はまったくないことはない」,https://news.yahoo.co.jp/articles/01b4eb2bde7994122bdef09d040b5ad59910aff7,9/29(日) 11:53
2024-09-29,15:07,TTL,総合,25,オリコン,大谷翔平＆真美子さん＆デコピン、地区優勝決定後のほほ笑ましい姿　スタイル抜群の全身ショット＆夫に視線送る真美子さんの表情,https://news.yahoo.co.jp/articles/dba2442b8d2f947d5faf7b2b8ccadb8bc49d4774,9/29(日) 12:40
2024-09-29,15:07,TTL,総合,26,スポーツ報知,「シューイチ」中山秀征　ゲストに教示「ご本人は日本テレビを退社いたしました」…「それは…失礼しました」ゲスト恐縮,https://news.yahoo.co.jp/articles/89ad8575210d79176bf19f968bf03ff5b1e1529b,9/29(日) 9:04
2024-09-29,15:07,TTL,総合,27,ねとらぼ,「土下座するから復活して」　日清が販売→7年前終売のカップ麺に“復活希望”の声殺到　「工藤静香が……」,https://news.yahoo.co.jp/articles/a02934d371809cd806c0055d5056a959639abafb,9/29(日) 11:30
2024-09-29,15:07,TTL,総合,28,ABEMA TIMES,「なんやその盗塁」大谷翔平に相手野手が無反応…“幻の58盗塁”にファン騒然　神走塁に「棒立ち」記録取消も話題の一部始終,https://news.yahoo.co.jp/articles/b63b25ec604fd1690f1df126573b3f8565e2003b,9/29(日) 11:33
2024-09-29,15:07,TTL,総合,29,デイリースポーツ,「朝ドラ」ヒロインが９月で芸能活動一時休止「一度リセットして出直しまーす！」　事務所退社、ブログも閉鎖【報告全文】,https://news.yahoo.co.jp/articles/37e49ba7ab128a93730a3ae9cd459bdc3c6379c7,9/28(土) 12:16
2024-09-29,15:07,TTL,総合,30,LIMO,【厚生年金・国民年金】10月から住民税の定額減税がスタート！10月に年金手取り額が減る人・増える人とは,https://news.yahoo.co.jp/articles/d946bbb124b589159557c0a0ecaa4c073ce5ef8c,9/28(土) 5:26
2024-09-29,15:07,TTL,総合,31,朝日新聞デジタル,大阪桐蔭にまた楽しみな1年生　西谷監督「非凡なものを持っている」,https://news.yahoo.co.jp/articles/484d1d61d01c8bc5c387581c79218a4387f81bf7,9/29(日) 14:22
2024-09-29,15:07,TTL,総合,32,ABEMA TIMES,貯蓄額5000万円の30代男性「倹約しすぎて使えなくなっている」 “お金あるのに使わない”はダメ？ひろゆき氏「使わないことで幸せを感じるやり方がある」,https://news.yahoo.co.jp/articles/b00646c0d04a5d826c35e7f3db2d5fc826c516a7,9/29(日) 12:42
2024-09-29,15:07,TTL,総合,33,Full-Count,ド軍現場に微妙な空気感も…大谷翔平、大逆転3冠王へかける2.5％の可能性,https://news.yahoo.co.jp/articles/f3ae050a041078c7119ba8a6668bd7c68136cf7e,9/29(日) 14:17
2024-09-29,15:07,TTL,総合,34,スポーツ報知,パドレス・アラエスは欠場で打率・３１４のまま　大谷翔平は・３１０　３冠王へ４厘差で運命の最終戦,https://news.yahoo.co.jp/articles/d3ea406971c3d2714210800a2798ef6466da01e1,9/29(日) 12:12
2024-09-29,15:07,TTL,総合,35,デイリースポーツ,トレーニング歴１年足らずで優勝！圧倒的な曲線美で魅せた会社員女性がビキニ部門王者に輝く,https://news.yahoo.co.jp/articles/1ee23f0703e34dd8c424dcdd01f41fca9ff1543f,9/29(日) 9:00
2024-09-29,15:07,TTL,総合,36,スポーツ報知,もはや別人！松本明子５８歳　“激変”っぷりがエグい全身ショットに「かわい～」の声,https://news.yahoo.co.jp/articles/331ef8d67906a0984c8d17471c22ecc24220d63d,9/29(日) 7:42
2024-09-29,15:07,TTL,総合,37,Hint-Pot,「日本ではやらないと決めました」　初訪日のアメリカ人が母国との違いに驚愕　「大変そう」だと感じたこととは,https://news.yahoo.co.jp/articles/ba9d7c741371e5bc05a5e8cafad79f99253bb57f,9/29(日) 14:05
2024-09-29,15:07,TTL,総合,38,CoCoKARAnext,「同じ領域にはいない」大谷翔平よりも“全盛期のボンズ”の方が上 元MLB名捕手がまさかの比較論「何を摂取したかは気にしない」,https://news.yahoo.co.jp/articles/571b5596f5692110d4326835a0891d236356a3e6,9/29(日) 5:30
2024-09-29,15:07,TTL,総合,39,デイリースポーツ,大谷のライバル、首位打者アラエスがスタメン外れる　残り２試合　５厘差逃げ切れば三冠阻止　自身は３年連続タイトル獲得,https://news.yahoo.co.jp/articles/e06705693c4cae55e481a577f8e1e545da8d7b71,9/29(日) 9:08
2024-09-29,15:07,TTL,総合,40,時事通信,ホテル一室で17歳少女死亡　大阪,https://news.yahoo.co.jp/articles/a082690721ef8d6907d6b3672dd1f365343db36b,9/29(日) 11:47
