scrp_date,scrp_time,genre_en,genre_jp,rank,media_jp,title,link,date_original
2024-09-29,07:05,local,地域,1,RSK山陽放送,【台風情報 最新】新たに「台風18号（クラトーン）」発生　10月2日（水）以降に沖縄地方に影響か「台風17号（チェービー）」は10月1日（火）以降に関東接近の見込み　今後の進路は?全国の天気への影響は?【28日午後7時40分更新】,https://news.yahoo.co.jp/articles/02e385bca4918a1144abff8a095fb7230b9f21b6,9/28(土) 19:46
2024-09-29,07:05,local,地域,2,RCC中国放送,【台風情報】台風18号 “強い勢力”で沖縄へ北上　その後は九州接近おそれ　海外予報機関も同じ傾向示す　5日先までの進路予想の“その先”はどこへ?　台風17号も北上中　気象庁・アメリカ・ヨーロッパ進路予想比較【10月4日まで雨・風シミュレーション】,https://news.yahoo.co.jp/articles/8cfd11a53a01c1ffa57d0152ce14c4d14907ef5d,9/29(日) 0:19
2024-09-29,07:05,local,地域,3,MBSニュース,大阪・ミナミのホテルで女性の遺体見つかる 女性は20歳前後か 一緒にホテルに入った男性は行方不明 警察は事件の可能性も視野に捜査,https://news.yahoo.co.jp/articles/f9618227e6737ed8f7fed9ad8f2f868068b4abf9,9/29(日) 6:01
2024-09-29,07:05,local,地域,4,KFB福島放送,ロードレース大会中に男性はねられる　ひき逃げ事件として捜査（福島）,https://news.yahoo.co.jp/articles/1bd05fb78d3f66bb206781a706c5026479bc2da2,9/28(土) 23:11
2024-09-29,07:05,local,地域,5,福岡ふかぼりメディアささっとー,目の前に圧巻!!の光景　福岡市中心部にある造船所の進水式が話題に,https://news.yahoo.co.jp/articles/39a05bf8b0a81849afac2aa465ae53d16dd9b9eb,9/28(土) 8:10
2024-09-29,07:05,local,地域,6,あいテレビ,【台風情報】台風18号（クラトーン）発生 沖縄や九州に接近する可能性も…今後の進路に注意を【最新進路予想・雨と風のシミュレーション】,https://news.yahoo.co.jp/articles/98850205f29bc0b4143cc8f996d8fc4698a279b9,9/28(土) 22:24
2024-09-29,07:05,local,地域,7,伊勢新聞,津の飲食店で4人食中毒　三重県が営業禁止処分,https://news.yahoo.co.jp/articles/cc902091050c51d0f73079de2905b1346b80f062,9/28(土) 8:00
2024-09-29,07:05,local,地域,8,WBS和歌山放送ニュース,【衆院選】和歌山新2区出馬表明の小西氏がとりやめ,https://news.yahoo.co.jp/articles/d1921b344c1388f22104c3da0f8d6e9e72122a5f,9/29(日) 0:16
2024-09-29,07:05,local,地域,9,RSK山陽放送,【台風情報 最新】熱帯低気圧は「台風18号」に発達?10月2日（水）以降、天気に大きく影響のおそれ「台風17号」は10月1日（火）に関東接近か　今後の進路は?全国の天気への影響は?【28日午前7時45分更新】,https://news.yahoo.co.jp/articles/c0566c0d891cf98ca337ab0bd9a888411e8a55d9,9/28(土) 7:48
2024-09-29,07:05,local,地域,10,徳島新聞,徳島県の人口が島根県に抜かれる日?!,https://news.yahoo.co.jp/articles/316970f1d732d85a60a5e3804b751b29387ae695,9/28(土) 20:33
2024-09-29,07:05,local,地域,11,tbc東北放送,「民家の花壇に衝突し発覚」酒に酔った状態で車を運転した疑い　63歳の会社員の男逮捕　仙台,https://news.yahoo.co.jp/articles/8edaf76a130785d83ece1bd671b49d6450bc2785,9/29(日) 2:51
2024-09-29,07:05,local,地域,12,KAB熊本朝日放送,九州道下り線で大型バイク転倒　男性死亡　一部区間で６時間通行止め【熊本】,https://news.yahoo.co.jp/articles/5df8cbd8734eab0464ccd173834a7c93e31ae605,9/28(土) 19:11
2024-09-29,07:05,local,地域,13,埼玉新聞,母娘が恐怖…寝ていると男3人が襲いかかる　深夜に自宅で　テープで縛り暴行した26歳、カードなど強奪し逮捕　母娘は自力でテープはがす　カードで現金を下ろそうとした大学生も逮捕、番号が一致せず諦めた21歳,https://news.yahoo.co.jp/articles/731d96faf025a69f2ea01bede597b344c4cf82fd,9/24(火) 9:19
2024-09-29,07:05,local,地域,14,あいテレビ,【台風情報】台風17号（チェービー） 10月1日頃に関東に接近する可能性…今後の進路に注意を【最新進路予想・雨と風のシミュレーション】,https://news.yahoo.co.jp/articles/7c384d40da223dbf35784012831debbc3f0588fc,9/28(土) 22:24
2024-09-29,07:05,local,地域,15,千葉日報オンライン,松戸の36歳女性、HUS発症　O157感染で,https://news.yahoo.co.jp/articles/6f8fb6013d966a7cb0bc5b68babee35ee9aa6b83,9/28(土) 11:51
2024-09-29,07:05,local,地域,16,南日本新聞,銅高騰、狙われる太陽光発電所　人目につかずケーブル盗、法の未整備つき容易に売買　保険業界も困惑…発生保険金100倍超の会社も,https://news.yahoo.co.jp/articles/c0324957b6f1e83fdf79746262d357b5a2784f30,9/29(日) 6:03
2024-09-29,07:05,local,地域,17,カナロコ by 神奈川新聞,【高校野球秋季神奈川県大会】準々決勝、東海大相模と平塚学園４強入り　２９日は横浜隼人－向上と横浜－武相,https://news.yahoo.co.jp/articles/cce4a9fd893c3fc56d4e3808c7c4c16a44f25a7d,9/28(土) 17:20
2024-09-29,07:05,local,地域,18,テレビ愛知,ロードバイクの前輪が外れて転倒か？65歳の男性が死亡　愛知県内の交通事故死者100人に,https://news.yahoo.co.jp/articles/1edbd8565f015c46c3502c06b70106a60e5c7968,9/28(土) 19:07
2024-09-29,07:05,local,地域,19,読売テレビ,【速報】兵庫・斎藤知事が県庁を去る　ひっそりと“最後の退庁”退職セレモニー、花束もなく,https://news.yahoo.co.jp/articles/a4ad0c90c2949b051540a89fc12b39a4b261938c,9/27(金) 17:53
2024-09-29,07:05,local,地域,20,北海道ニュースUHB,【ファイターズ】首位ソフトバンク戦7連勝でエスコンフィールド初のCS開催決定！あるぞ下剋上！“神助っ人”2人で日本シリーズ進出目指す！,https://news.yahoo.co.jp/articles/96060944d4a72ef54be293b0622b333fe0d96223,9/28(土) 19:09
2024-09-29,07:05,local,地域,21,山陽新聞デジタル,岡山・倉敷の小学校で流行性疾患集団発生　患者16人、30日まで学級閉鎖,https://news.yahoo.co.jp/articles/6cdfb35d8175ca1f562301682cfd5f3f77a8e257,9/27(金) 18:19
2024-09-29,07:05,local,地域,22,沖縄タイムス,沖縄の都市部で火葬待ちが深刻、最長12日も　安置費用は数十万円、遺族の負担増　背景に「多死社会」、県に増設を訴え,https://news.yahoo.co.jp/articles/c9ee97173a9fb7167045c4423942bbe62b1e8405,9/29(日) 6:19
2024-09-29,07:05,local,地域,23,NBS長野放送,北アルプス槍ヶ岳で遭難　横浜市の64歳女性が山頂付近の鎖場から3メートル滑落　大腿骨骨折の重傷　ヘリで救助,https://news.yahoo.co.jp/articles/6d65ca605624a9631c39ceba1b61c01272c5cb12,9/28(土) 19:18
2024-09-29,07:05,local,地域,24,中国新聞デジタル,広陵、5季連続甲子園絶望的に　延長タイブレークで広島工に敗れる　秋季広島県高校野球大会,https://news.yahoo.co.jp/articles/2da8ffbc12b2c207836d253edbf8e4229b2e0363,9/28(土) 16:32
2024-09-29,07:05,local,地域,25,MRO北陸放送,石川県が安否不明者4人を公表 能登地方の豪雨で（9月28日午後2時現在）,https://news.yahoo.co.jp/articles/ff03f1944b39984f39131ae5cdb1ad5d4a268c6c,9/28(土) 20:48
2024-09-29,07:05,local,地域,26,ｔｙｓテレビ山口,未明オートバイがガードパイプなどに衝突・運転の男性（34）死亡　山口・下関,https://news.yahoo.co.jp/articles/f6f03fa2a4e020d35f4c3d0fa95d1606cffddfe8,9/29(日) 6:46
2024-09-29,07:05,local,地域,27,あいテレビ,最近届いた紙の保険証のような『資格情報のお知らせ』って何?実は、単体で利用不可…意外と知らないマイナ保険証をわかりやすく!,https://news.yahoo.co.jp/articles/ad9cd50163cf02e63856a84e31c018ada38f8c80,9/26(木) 16:02
2024-09-29,07:05,local,地域,28,新潟日報,世界遺産登録で観光客急増の佐渡困惑、路上駐車が緊急車両の妨げに、警察が取り締まり強化も商店街「客が遠のく」,https://news.yahoo.co.jp/articles/30de7acf3ad700b6950bdb445ef1e463b4202223,9/29(日) 6:02
2024-09-29,07:05,local,地域,29,北海道ニュースUHB,メガソーラーパネル建設現場で870キロの電気ケーブル4巻約723万円相当盗まれる 建設作業に当たっていた千葉県・愛知県・佐賀県の男3人窃盗の疑いで逮捕…　北海道石狩市,https://news.yahoo.co.jp/articles/0f85c0871d15eff733869fd4d33c3e52c9869b4d,9/28(土) 22:24
2024-09-29,07:05,local,地域,30,テレビ静岡NEWS,事件発生時の捜査員「もう一切しゃべりません」　袴田巖さんの再審無罪受け　以前は「本人が入れた」と主張,https://news.yahoo.co.jp/articles/9cd4fe9c2652a5036c0ea8f2fe2a9bd25320cbbe,9/27(金) 11:43
2024-09-29,07:05,local,地域,31,千葉日報オンライン,盗んだ女性用ショーツ「要らなくなった」　他人宅に捨てた疑い　市原,https://news.yahoo.co.jp/articles/18b3e2d8c935e30cf89e680cc0a17bfd2b979ad5,9/28(土) 21:01
2024-09-29,07:05,local,地域,32,カナロコ by 神奈川新聞,１１６年の歴史に幕　三浦市の小学校閉校直前の２５年春、クラファン花火計画中　漁港から２００発,https://news.yahoo.co.jp/articles/37d561ee47fc4d958114ce452b6ce3b88d7ea8cc,9/29(日) 5:30
2024-09-29,07:05,local,地域,33,京都新聞,石破氏が自民党新総裁、鉄道ファン仲間の前原誠司氏も喜び「野党で一番飲みに行くのは私」,https://news.yahoo.co.jp/articles/555b13312625344314e5765fcce980f25674b2dd,9/27(金) 18:09
2024-09-29,07:05,local,地域,34,ＡＴＶ青森テレビ,「バイト感覚で参加できることを魅力に思って」25歳の看護師は『予備自衛官』　非常勤の「特別職国家公務員」で手当ては月額4000円「看護師としても自衛官としても助け求める人に寄り添えるように…」,https://news.yahoo.co.jp/articles/7283f4dd47a289832d097e20d6ef5a6f79317f73,9/28(土) 11:16
2024-09-29,07:05,local,地域,35,北海道新聞,コメの返礼品争奪戦　北海道の米どころ上川エリアのふるさと納税　士別市は前年比9.8倍,https://news.yahoo.co.jp/articles/c2023f00bb667eb395fe1065aea80fd97c98a483,9/29(日) 6:00
2024-09-29,07:05,local,地域,36,北海道ニュースUHB,「居眠りして反対車線に飛び出す事故を起こした」乗用車が軽自動車と正面衝突…乗用車の男を過失運転致傷で逮捕 職場から帰宅中　北海道釧路町,https://news.yahoo.co.jp/articles/c7c0ec2c81db9b8a9b2dc8de0128f7503c712b34,9/28(土) 21:04
2024-09-29,07:05,local,地域,37,山陰中央新報,佳子さまが着用されたアクセサリーがＳＮＳで話題に　寄せ木細工のイヤリングとバレッタ　日南町の工房、注文が急増　「手話甲子園」で鳥取県をご訪問,https://news.yahoo.co.jp/articles/8693e2f22454dec4bd1199433e8d4af1aa00d3f4,9/28(土) 12:00
2024-09-29,07:05,local,地域,38,KAB熊本朝日放送,酒気帯び運転疑いで男を現行犯逮捕　無免許運転容疑でも捜査【熊本】,https://news.yahoo.co.jp/articles/08938dd127ccb5a750a7ac707f4c89b8ddda85c5,9/28(土) 19:11
2024-09-29,07:05,local,地域,39,あいテレビ,生後8か月で給食のリンゴをのどに詰まらせ…意識不明のまま迎えた2歳 家族が直面した課題と今伝えたいこと,https://news.yahoo.co.jp/articles/ca98bbb7168686ddaca7c476d27ec8c6bb84de8b,9/28(土) 8:04
2024-09-29,07:05,local,地域,40,チューリップテレビ,午前3時すぎに乗用車が電柱に衝突　10代の専門学生と大学生4人が重傷　富山・高岡,https://news.yahoo.co.jp/articles/2b325ee95b7ee00cc756f9355689f503c62f9c7f,9/28(土) 16:59
