scrp_date,scrp_time,genre_en,genre_jp,rank,media_jp,title,link,date_original
2024-09-12,09:25,domestic,国内,1,J-CASTニュース,「アッコにおまかせ！」の「初音ミク事件」17年ぶりに再燃...　番組終了報道で「ホントに酷かった」「未だに許していない」,https://news.yahoo.co.jp/articles/030d8927f9aad278d677b29dea0023e5a1635378,9/11(水) 16:15
2024-09-12,09:25,domestic,国内,2,関西テレビ,【速報】『涙』の斎藤知事 「告発者が亡くなったことへの後悔の涙か？」と問われ「今の思いは、自民党と維新の議員に対して」と知事,https://news.yahoo.co.jp/articles/515291b45237338e205f3e4af9953fe72908c76d,9/11(水) 16:41
2024-09-12,09:25,domestic,国内,3,デイリースポーツ,【悲報】丸川珠代議員　子ども手当「くだらん」猛反対してた映像ＴＶで流れる「愚か者めが！」「欠陥法案」と罵声　総裁選報道で晒され失笑,https://news.yahoo.co.jp/articles/a87ec52946094dca807b6bce50862d4a932a0edb,9/11(水) 21:30
2024-09-12,09:25,domestic,国内,4,朝日新聞デジタル,アイドルグループのファンに「∞」人気　神社が2億5千万円所得隠し,https://news.yahoo.co.jp/articles/bcc0e1dbf9eed9c49c0e141e260b6f6d65bd1fdd,9/12(木) 5:00
2024-09-12,09:25,domestic,国内,5,MBSニュース,【速報】斎藤知事、会見で目に涙浮かべ「申し訳ない、自分に対して悔しい」自民が”あす辞職申し入れ”　そして記者は涙のわけを問う「元幹部が亡くなったことへの後悔や感情ではないのか？」,https://news.yahoo.co.jp/articles/0145df0e72c3b591304a126fad84f3f0eddf4f53,9/11(水) 16:39
2024-09-12,09:25,domestic,国内,6,読売新聞オンライン,自宅に大麻、陽性反応でも無罪判決…「使用罪」創設前で所持は「女性が陥れた可能性」,https://news.yahoo.co.jp/articles/475a95cb8e494f8bf1415cc1db5fee7d67a360ce,9/12(木) 5:00
2024-09-12,09:25,domestic,国内,7,47NEWS,４億円の赤字を全額負担…それでも経営者養成のプロが「音楽フェス」にこだわるわけ　つてもノウハウもない「最後発」、ロッキン移転後の茨城で６万人を集めた戦略とは,https://news.yahoo.co.jp/articles/71777a6943489d88ce193d37f4a182c8b6670c97,9/11(水) 10:02
2024-09-12,09:25,domestic,国内,8,時事通信,兵庫知事と前副知事を告発　優勝パレード巡る背任容疑、大阪地検に,https://news.yahoo.co.jp/articles/17f89a686c9e01946dd35192eed118030788d3a6,9/11(水) 15:14
2024-09-12,09:25,domestic,国内,9,ABEMA TIMES,他人のバイクに勝手にまたがって記念撮影…被害者が語る衝撃の瞬間 犯罪になる？弁護士が解説,https://news.yahoo.co.jp/articles/ec182bc7a95b6cbefd728944ee6b3e6af0bff1f7,9/12(木) 7:02
2024-09-12,09:25,domestic,国内,10,読売新聞オンライン,東京・豊島区職員８４人が通勤手当を不正受給…実際と異なるルートを届け、過大に受け取る,https://news.yahoo.co.jp/articles/4c34019d59db85e72d0c909f3b6e4a25f2565d5f,9/12(木) 7:00
2024-09-12,09:25,domestic,国内,11,読売テレビ,【独自取材】事件の聴取後「捜査員カッコ良かった」自首を促すと「やってないもん(笑)」…元妻・須藤早貴被告を最も知る人物が語る“須藤被告の素顔”　『紀州のドン・ファン事件』初公判、最重要ポイントは「覚醒剤がどのように入ってきたか」,https://news.yahoo.co.jp/articles/759284a0d7b43d5302a3a44953b065709e54071a,9/12(木) 7:30
2024-09-12,09:25,domestic,国内,12,読売新聞オンライン,「まだ生きとったんか」と脅され…工藤会と決別後も身の危険、名前変え別人として生きる生活,https://news.yahoo.co.jp/articles/1081fad0745711dec7bdce22635ffb67eb38514a,9/12(木) 8:23
2024-09-12,09:25,domestic,国内,13,デイリースポーツ,高橋洋一氏　兵庫県知事は「どこかで辞める」後任知事候補に実名挙げる「官僚と違うタイプ　政策論はあり」,https://news.yahoo.co.jp/articles/5a714ae41d838f5fb7df5672c455a8db5804e0e3,9/11(水) 20:07
2024-09-12,09:25,domestic,国内,14,ABEMA TIMES,JR貨物 不正で運行停止 一部除き運転を順次再開,https://news.yahoo.co.jp/articles/ce321449dbb8364fe8e0ead35976edd4d0d3253a,9/12(木) 7:22
2024-09-12,09:25,domestic,国内,15,朝日新聞デジタル,モアイ像のイースター島、DNA分析で通説覆す　文明崩壊なかった？,https://news.yahoo.co.jp/articles/c85059944ae3efbf0f85a7910d26eb28b9cb2974,9/12(木) 0:00
2024-09-12,09:25,domestic,国内,16,共同通信,維新、掘井議員を厳重注意　告発者の不明確な情報流す,https://news.yahoo.co.jp/articles/0317596d59c245c9597d4adf3d200f92a9c6bee7,9/11(水) 17:13
2024-09-12,09:25,domestic,国内,17,デイリースポーツ,橋下徹氏　斎藤兵庫県知事の功績も「伝えてあげるべき」泉房穂元明石市長より「困難で規模の大きいことやってる」,https://news.yahoo.co.jp/articles/825004359b9c283dcc0554f620a60f2a713b26a9,9/11(水) 17:29
2024-09-12,09:25,domestic,国内,18,東海テレビ,「シカやイノシシひいた感覚」未明に28歳女性をはねて死亡させ逃走か「何かに乗り上げた」と出頭の43歳女逮捕,https://news.yahoo.co.jp/articles/f834df6306cfe6fa53ca6d387f95d0507aac686d,9/11(水) 21:19
2024-09-12,09:25,domestic,国内,19,FNNプライムオンライン,【独自】「太陽光パネル」“雲隠れ”社長を直撃　「資金繰り行き詰まり…」190万円支払うも“音信不通”に　設置業者に未払いも,https://news.yahoo.co.jp/articles/689f1b092dd181b531cc5e3f9a302902e091c8b2,9/12(木) 7:13
2024-09-12,09:25,domestic,国内,20,毎日新聞,トンネルでトラックと軽乗用車が正面衝突　1人死亡、3人重体　群馬,https://news.yahoo.co.jp/articles/0c41dd2418e002146ee44f76a5752f8ebeb52db8,9/12(木) 0:22
2024-09-12,09:25,domestic,国内,21,ABEMA TIMES,「ワンタッチ痴漢」の被害を女子プロレスラーが告白「あらゆるところから手が入ってくる」,https://news.yahoo.co.jp/articles/f64760f15b875160052fd3c3436c09cda588405e,9/11(水) 7:02
2024-09-12,09:25,domestic,国内,22,デイリースポーツ,野田聖子氏　総裁選断念→小泉氏を支援　菅義偉元首相に「全部ブロックされ」恨み節報道も,https://news.yahoo.co.jp/articles/6e7e822067b242d526f450a3f65e44c6f740ee7b,9/12(木) 0:06
2024-09-12,09:25,domestic,国内,23,毎日新聞,「80歳以上でも働ける」7割　シニアに聞いた仕事の本音　民間調査,https://news.yahoo.co.jp/articles/8e8401a09aa5e786985a86d19086fa2606b41d8f,9/12(木) 6:15
2024-09-12,09:25,domestic,国内,24,スポーツ報知,元大阪府知事・松井一郎氏、「めざまし８」で斎藤元彦知事へ提言「いったんは辞職をして…県民のみなさんに判断をいただいたらいい」,https://news.yahoo.co.jp/articles/18c00be1d2ed9d1ab0570accc494398979b81dae,9/12(木) 8:46
2024-09-12,09:25,domestic,国内,25,Yahoo!ニュース オリジナル THE PAGE,維新・吉村共同代表　兵庫・斎藤知事について「素直に認めて辞職すべき」　“パワハラ疑惑”告発文書問題,https://news.yahoo.co.jp/articles/ac8c94da74922304bb632df0ebfb357efa97a33a,9/12(木) 8:31
2024-09-12,09:25,domestic,国内,26,産経新聞,議会解散の判断、最短で29日までか　兵庫知事不信任案は19日提出、即日採決案が浮上,https://news.yahoo.co.jp/articles/4ee224868f7bedb87880408f16f27c0622c37971,9/11(水) 22:17
2024-09-12,09:25,domestic,国内,27,FNNプライムオンライン（フジテレビ系）,【速報】愛子さまが秋篠宮邸へ　クリーム色の装いで紀子さまにお祝いの挨拶,https://news.yahoo.co.jp/articles/dc09b0b44f42ba00ef9468c10f52c0b390646412,9/11(水) 10:02
2024-09-12,09:25,domestic,国内,28,読売新聞オンライン,立候補断念の野田聖子氏、小泉進次郎氏を支援へ…連携模索した石破茂氏陣営「期待したのがバカだった」,https://news.yahoo.co.jp/articles/f862ff43babf61d92539a8029ae5d6edcc6916dd,9/11(水) 21:14
2024-09-12,09:25,domestic,国内,29,時事通信,元アナウンサーの男逮捕　不同意わいせつ容疑　兵庫県警,https://news.yahoo.co.jp/articles/50bbe66ba7e47d4798f628f2873677347c77a213,9/11(水) 18:21
2024-09-12,09:25,domestic,国内,30,デイリースポーツ,「Ｎｅｗｓ２３」小泉純一郎元首相、進次郎氏の４３歳総裁選に「ちょっと若い、５０過ぎてと言ってんだけど」「なんか出るらしいね」,https://news.yahoo.co.jp/articles/babb1353e92e5088af959e102fd5b5044722c74b,9/11(水) 23:33
2024-09-12,09:25,domestic,国内,31,デイリースポーツ,ネット炎上「県民のため」兵庫知事ボロ泣き続投表明→大荒れ「泣きたいのは県民」「応援してません」「泣くの兵庫の伝統芸？」「兵庫じゃなくて良かった」,https://news.yahoo.co.jp/articles/db1d0ff707f6389a95d97512928f397a9a7ecd3f,9/11(水) 18:33
2024-09-12,09:25,domestic,国内,32,FNNプライムオンライン,火災で焼失した 仙台駅前“せんべろ”の人気店復活へ 「仙台の街や文化を楽しんでもらえるように」,https://news.yahoo.co.jp/articles/8297ab0d58fa79682badb117bf293d1d1fb5b408,9/12(木) 6:02
2024-09-12,09:25,domestic,国内,33,毎日新聞,「私の知っている兵庫知事の印象違う」　総務省出身の浜松市長が見解,https://news.yahoo.co.jp/articles/076e0f04cc4269fb1532448d63dfd531d0012868,9/11(水) 16:50
2024-09-12,09:25,domestic,国内,34,時事通信,解散にらみ「負担増」回避　増税ゼロ、バラマキも　自民総裁選,https://news.yahoo.co.jp/articles/a1a2c950bb3a8556137c38fc897b614b258ed9b1,9/12(木) 7:02
2024-09-12,09:25,domestic,国内,35,弁護士JPニュース,「迷わず逃げてください！」　もしも「上司が“齋藤知事タイプ”だったら」に即答した人事コンサルの真意,https://news.yahoo.co.jp/articles/eb1713b6b0d1ce7e01e461705ab6b623339f912a,9/11(水) 10:02
2024-09-12,09:25,domestic,国内,36,共同通信,歩道にワゴン車突っ込む　女性死亡、東京・小金井,https://news.yahoo.co.jp/articles/9cfe6ee145fb97a713afcc6f1c80c121f1c96192,9/10(火) 21:48
2024-09-12,09:25,domestic,国内,37,夕刊フジ,産業界が喜ぶ解雇規制緩和論　世界と比較も厳しくない日本の雇用規制　存在する「追い出し部屋」の不幸、必要なのは「明確化」の仕組み,https://news.yahoo.co.jp/articles/8904b155bbfc36e93d078fee875c7f129141255e,9/11(水) 17:00
2024-09-12,09:25,domestic,国内,38,レスキューナウニュース,〔JR東日本〕東海道本線で人身事故 一部運転見合わせ,https://news.yahoo.co.jp/articles/fb68d8e92ca8bcdc9bdf303a172394ed149535c1,9/11(水) 18:45
2024-09-12,09:25,domestic,国内,39,テレビ朝日系（ANN）,兵庫県知事に全会派辞任要求へ　“最側近”元副知事が証言 “告発者探し”の舞台裏,https://news.yahoo.co.jp/articles/a0ee8a23d8568048ded532a5a78ff07329c09dd7,9/11(水) 18:02
2024-09-12,09:25,domestic,国内,40,朝日新聞デジタル,「紀州のドン・ファン」殺害事件、元妻側は無罪主張へ　きょう初公判,https://news.yahoo.co.jp/articles/58b0f1b32bf72d325b6b5ff2eb0636666bfb368e,9/12(木) 6:00
