scrp_date,scrp_time,genre_en,genre_jp,rank,media_jp,title,link,date_original
2025-08-05,02:10,business,経済,1,ファイナンシャルフィールド,政府・与党が掲げた「一律2万円」の給付金。4人家族なら「8万円」のはずが、住民税非課税世帯なら「16万円」もらえるって本当ですか？“給付金の検討内容”を確認,https://news.yahoo.co.jp/articles/bf3ffcba3912fd41e0d903c98487d6b87a17d1c4,8/3(日) 13:30
2025-08-05,02:10,business,経済,2,時事通信,「パナソニック」社名、家電が承継　グループ再編後の体制発表,https://news.yahoo.co.jp/articles/ce108b23d8bb01dd5eee8ce7518079dadaf9ff9b,7/30(水) 21:01
2025-08-05,02:10,business,経済,3,共同通信,日立、白物家電売却を検討　韓国企業が買収意向か,https://news.yahoo.co.jp/articles/49d7f95d8bacee86fbbda40f200f3fb2fed83eda,8/4(月) 20:44
2025-08-05,02:10,business,経済,4,みんかぶマガジン,「飢えたヒグマたちが村を包囲、警備員2人が…！？」どうして日本は海外事例に学ぶことができないのか…経済損失も,https://news.yahoo.co.jp/articles/f32b3dc52e076db7a21e5664537a9c4ba7047652,8/4(月) 9:10
2025-08-05,02:10,business,経済,5,ファイナンシャルフィールド,「誰も住んでいない家」を更地にしたら、固定資産税が「5万円→30万円」に…。空き家を放置せず壊したのになぜ税金が高くなるのでしょうか？,https://news.yahoo.co.jp/articles/8dc856df3d9f227828529cb2a1525b930c2799ea,8/3(日) 10:10
2025-08-05,02:10,business,経済,6,ファイナンシャルフィールド,70代の父は「年金月7万円」で生活しています。「生活費を援助してほしい」と言われたのですが、受けられる“支援制度”はありますか？,https://news.yahoo.co.jp/articles/7041448d49e59c762f9c9bc4af60185b99acd730,8/4(月) 11:32
2025-08-05,02:10,business,経済,7,共同通信,スズキ「ジムニー　ノマド」国内出荷停止,https://news.yahoo.co.jp/articles/cd4aa7c34463fbfd1fea61c2b4327c2755e9831e,8/4(月) 19:27
2025-08-05,02:10,business,経済,8,くるまのニュース,【異例】市バスが急ブレーキ、転倒した女性が骨折！ 急ブレーキをかけさせた自転車を「ひき逃げ」容疑で捜査!? 元警察官が解説,https://news.yahoo.co.jp/articles/23155acb5b918b5da2e609935b3f09a46448e50b,7/29(火) 16:30
2025-08-05,02:10,business,経済,9,共同通信,新型ジムニー、国内出荷を停止　スズキ、インドで生産,https://news.yahoo.co.jp/articles/e0ac62fa07fa377854aef86806a17b46dad472ea,8/4(月) 20:24
2025-08-05,02:10,business,経済,10,日刊自動車新聞,ロバート・ボッシュ、ジョンソンコントロールズと日立の空調事業の買収完了　「白くまくん」はブランド継続,https://news.yahoo.co.jp/articles/6df43e89d4f8d4a3fe0633e8019efbfd1c0dbe7c,8/2(土) 15:00
2025-08-05,02:10,business,経済,11,共同通信,イオン、スーパー再編へ　来年3月、首都圏と近畿圏,https://news.yahoo.co.jp/articles/888250911119ec99382c59ed7eb9b46bc39e146a,8/4(月) 18:58
2025-08-05,02:10,business,経済,12,くるまのニュース,新車約129万円！ スズキ「“新”キャリイ」発表！ 鮮やかな「オレンジ」＆オシャレ「グリーン」新登場！ “派手”な新「軽トラ」どんなモデル？,https://news.yahoo.co.jp/articles/6efdedc5c8e9a595fbe80c1575b947c1bba588cd,7/31(木) 12:00
2025-08-05,02:10,business,経済,13,共同通信,インドの関税引き上げとトランプ氏投稿,https://news.yahoo.co.jp/articles/f90a7124be5be2c103ed065aec4fdb86ec2d8e31,8/5(火) 0:10
2025-08-05,02:10,business,経済,14,LIMO,【住民税非課税世帯】への現金給付「いつ・いくら・どんな目的」で実施された？？過去10年の「給付金」を振り返る,https://news.yahoo.co.jp/articles/214a9fa5c57206c586d8529c4db38b6055ea5171,8/4(月) 18:36
2025-08-05,02:10,business,経済,15,食品産業新聞社ニュースWEB,ハッピーセット「ポケモン」8月8日発売、ピカチュウなどおもちゃ全9種、ポケモンカードの週末プレゼントも/マクドナルド,https://news.yahoo.co.jp/articles/42ffbd955bd03096710f49dacade4abb6188a824,8/4(月) 14:08
2025-08-05,02:10,business,経済,16,ITmedia ビジネスオンライン,ビッグマックが1000円超　ウーバーや出前館が地方でなかなか浸透しない理由,https://news.yahoo.co.jp/articles/77442e79b45d0b2e9e9c04772e7f4a4aa358cdca,8/4(月) 8:10
2025-08-05,02:10,business,経済,17,くるまのニュース,約120万円！ スズキ新「エブリイ」発表！ 鮮烈「オレンジ」で商用車感ナシ！ 大人気商用軽バンに“ド派手”カラー新設定ってマジ？,https://news.yahoo.co.jp/articles/164c8392002608a6adf44a83c6a610336ae0e9c9,8/4(月) 19:30
2025-08-05,02:10,business,経済,18,＆GP,330円でコスパ最強!?風量アップで後部座席までエアコンの風をしっかり飛ばせるように！【CARGoodsPress】,https://news.yahoo.co.jp/articles/c3805e62f2813882f479174cea4385cee69c1da2,8/3(日) 21:40
2025-08-05,02:10,business,経済,19,LIMO,【年金】8月から振込額が変わるかも？「年金から天引きされるお金」にはどんなものがある？知っておきたい年金の「特別徴収」,https://news.yahoo.co.jp/articles/25160582c5190917d924b77851e2c9993c426592,8/4(月) 11:21
2025-08-05,02:10,business,経済,20,産経新聞,東急不動産分譲マンション　施工不良で建て替え方針も一転中止　住民と訴訟トラブルに,https://news.yahoo.co.jp/articles/760963b80cba487a8b3f63aeaf8c8bd52f2d8e39,8/4(月) 7:00
2025-08-05,02:10,business,経済,21,くるまのニュース,日産新型「エルグランド」発売へ！ 1.5Lハイブリッド搭載した“背が高い”高級ミニバンに進化！ 約500万円＆NISMO新設定で「アルファード」に対抗も!? 次期型どうなる？,https://news.yahoo.co.jp/articles/3da8c11c8567e51d284b0a2df9006f6cb32b98ef,8/1(金) 12:00
2025-08-05,02:10,business,経済,22,VAGUE,なぜ人は「修行」に夢中になってしまう!? JALの上級会員制度「JGC」“3つ星”から“4つ星”にランクアップした先に得られるメリットとは,https://news.yahoo.co.jp/articles/4c980eb85be2f0fed9f181725797c5ff656e9346,8/4(月) 12:10
2025-08-05,02:10,business,経済,23,産経新聞,最低賃金　6％増の1118円で決着　日商の小林会頭「地方や小規模事業者に厳しい結果」,https://news.yahoo.co.jp/articles/5a4a60e5b62416be338b8f544983a28816774c33,8/4(月) 20:18
2025-08-05,02:10,business,経済,24,ファイナンシャルフィールド,来年から徴収がスタートする予定の「子ども・子育て支援金」。独身で「年収600万円」の私は毎月いくら徴収されるのでしょうか？,https://news.yahoo.co.jp/articles/06b600f18f5b7e18f6629dd04e4829bcce1ab34d,7/30(水) 13:30
2025-08-05,02:10,business,経済,25,LIMO,男性「平均年収」は569万円｜自分の年収は平均以上？【平均年収一覧表】20歳代〜50歳代の平均はいくらか,https://news.yahoo.co.jp/articles/40a3bcdd8e0b71933261f5416048b867048659f7,8/4(月) 16:11
2025-08-05,02:10,business,経済,26,共同通信,厚生年金の加入漏れ97万人　事業者が保険料負担逃れ,https://news.yahoo.co.jp/articles/e7e9247ee2101c5a1a13b7f1b655385c3d84cc7f,8/2(土) 16:41
2025-08-05,02:10,business,経済,27,ファイナンシャルフィールド,夫の「夏のボーナス手取り60万円」に驚き！公務員ってこんなにもらえるの？,https://news.yahoo.co.jp/articles/764662ce9b66558ed5858bb475222e7e7b3f9d29,8/4(月) 12:11
2025-08-05,02:10,business,経済,28,くるまのニュース,スズキ「アルト」に“両側スライドドア”採用！ ガバッと開く斬新「3ドア車」がスゴかった！ “衝撃的ドア”搭載で1988年に登場した「スライドスリム」はインパクト大！,https://news.yahoo.co.jp/articles/10fea169ef71c156d3e23941a346cfb08e82a5ed,8/4(月) 9:10
2025-08-05,02:10,business,経済,29,Bloomberg,米国債を待ち受ける計1250億ドル大規模入札、下押し圧力となる可能性,https://news.yahoo.co.jp/articles/cedab71d7cb6d1c2196c8c1d94b3c81c25405d08,8/5(火) 1:13
2025-08-05,02:10,business,経済,30,＆GP,クルマのエアコン、きちんと知っておかないと後悔するかも…。行楽シーズン前にメンテナンスしよう！,https://news.yahoo.co.jp/articles/909c4a164b6b44896c5b7bd86c2ec9ba4cb56b2e,8/4(月) 21:30
2025-08-05,02:10,business,経済,31,ロイター,米テスラ、マスクＣＥＯに290億ドル相当の株式付与承認,https://news.yahoo.co.jp/articles/f80621f84557144c8474413b02ebdfdba4d4f58e,8/5(火) 0:23
2025-08-05,02:10,business,経済,32,GetNavi web,【大阪の最新喫煙所まとめ】万博、あべのハルカスから朝倉未来プロデュースの話題スポットを現地取材,https://news.yahoo.co.jp/articles/7a887e9be2aa9537a52ee553d0398c750f89d154,8/5(火) 0:40
2025-08-05,02:10,business,経済,33,共同通信,イオン、65億円赤字　売上高は過去最高、3～5月期,https://news.yahoo.co.jp/articles/8f58951abc03ab82280074fb85370c52d82c4553,7/31(木) 18:00
2025-08-05,02:10,business,経済,34,TBS CROSS DIG with Bloomberg,インド首相、国民に国産品の購入呼びかけ-米国の25％関税表明後,https://news.yahoo.co.jp/articles/1941775a1b9e951a0b09603c19c5353c996f1a84,8/4(月) 12:33
2025-08-05,02:10,business,経済,35,ハフポスト日本版,「さすが分かってる」ホテルオークラ、長岡花火大会での宿泊者への配慮に称賛の声。「何時でもお待ちしております」,https://news.yahoo.co.jp/articles/7f3952a4a664bd6e0904e87fbda3a8c677b89e74,8/3(日) 11:38
2025-08-05,02:10,business,経済,36,時事通信,首都圏・近畿でスーパー再編　店舗運営効率化　イオン,https://news.yahoo.co.jp/articles/91ac127fff145bc814457f782aaf0c9de0420e7b,8/4(月) 21:09
2025-08-05,02:10,business,経済,37,時事通信,〔米株式〕NYダウ反発、一時500ドル超高（4日午前11時すぎ）,https://news.yahoo.co.jp/articles/1f311c4ca456e7cdd8715bcb73d8e82bebfa03ed,8/5(火) 0:30
2025-08-05,02:10,business,経済,38,乗りものニュース,南アジアの大国、トランプ案のF-35にNO「メイク・イン・インディア」優先でロシア製ステルス機に照準？,https://news.yahoo.co.jp/articles/47092b6bc685dad69d41ac69b891ea9b7413e909,8/4(月) 11:42
2025-08-05,02:10,business,経済,39,読売新聞オンライン,三菱ＵＦＪ銀行、「個人専用店舗」増へ…資産運用への関心高まりに対応,https://news.yahoo.co.jp/articles/ebe0e85d31979c1f3fbd20d35cdc2fadb8149b5e,8/5(火) 0:32
2025-08-05,02:10,business,経済,40,LIMO,私は追加の給付金（不足額給付）の対象？定額減税補足給付金の最新情報や対象者をチェック,https://news.yahoo.co.jp/articles/38289c4711d6785008cc247b1bdb639c6ed45e7f,8/3(日) 6:16
