scrp_date,scrp_time,genre_en,genre_jp,rank,media_jp,title,link,date_original
2025-08-08,22:19,domestic,国内,1,デイリースポーツ,石破おろし両院議員総会→１時間後に突然「一気にステージ変わった」臨時総裁選が議題に　「石破総理は非常に不満そう」青山議員が読テレ出演し明かす,https://news.yahoo.co.jp/articles/e667bef941d01708443c11b8afc4d37c030bee70,8/8(金) 17:22
2025-08-08,22:19,domestic,国内,2,共同通信,ロシア巨大地震、マグニチュードは8.8,https://news.yahoo.co.jp/articles/7aa5210c4358c78f2fb525ef55ff9426aeea82a0,8/8(金) 18:43
2025-08-08,22:19,domestic,国内,3,デイリースポーツ,石破首相が結託したら政権倒せなくなる人物　元日テレ青山氏が指摘　石破おろし署名よりも重大焦点　総理は反石破勢力に「誰が引きずり下ろそうとしてるのかと敵がい心」,https://news.yahoo.co.jp/articles/082e00e1cbbc4920a1b30134cd5aa0c3f328aab1,8/8(金) 19:30
2025-08-08,22:19,domestic,国内,4,共同通信,横浜市立中校長が盗撮か　神奈川県警が書類送検,https://news.yahoo.co.jp/articles/bb1f034cdf512ea8e8eb2675bf6650996995cddb,8/8(金) 18:55
2025-08-08,22:19,domestic,国内,5,ABEMA TIMES,自民・西田議員「石破さんが辞めるもくそも、いろんな方がもう一度総裁選に出て議論される」「ほぼ全員の拍手で賛成」2時間の両院議員総会を終えてコメント,https://news.yahoo.co.jp/articles/561a80f4bd664498b5757feb57a0f5e642c75016,8/8(金) 17:42
2025-08-08,22:19,domestic,国内,6,東海テレビ,5mほど下の水路へ…堤防道路を走っていたトラックが道を外れて転落 運転していた59歳男性を搬送も死亡,https://news.yahoo.co.jp/articles/4ea35a017287e7fc016269d1d8310198ae52fd9f,8/8(金) 19:27
2025-08-08,22:19,domestic,国内,7,中日スポーツ,『ポケモン』ハッピーセット、マクドナルド＆メルカリは転売対策で声明も… 発売初日、サイトにはえげつない光景,https://news.yahoo.co.jp/articles/555785fdcb014560c01825427e8dafb5878ac0e3,8/8(金) 15:15
2025-08-08,22:19,domestic,国内,8,デイリースポーツ,ゴゴスマコメンテーターにも広陵高暴力事案のメールが　具体的内容拡散で「今手を打たないと」,https://news.yahoo.co.jp/articles/b6fa95748eed4615de6b45e92cf2eb85594b56a2,8/8(金) 15:55
2025-08-08,22:19,domestic,国内,9,テレビ朝日系（ANN）,石破総理の“兄貴分”明かす　「きのう総理と話した」内容は,https://news.yahoo.co.jp/articles/571543fcecf323db37a389d107f5cbe974e32a27,8/8(金) 20:16
2025-08-08,22:19,domestic,国内,10,弁護士JPニュース,健常者なのに“精神病院”に拉致され強制入院、薬を飲まされ副作用…背景にある「医療保護入院」制度の“闇”を被害男性が訴える,https://news.yahoo.co.jp/articles/97058f60bffb8acae0a9b7f4771516b7f3487b12,8/8(金) 18:02
2025-08-08,22:19,domestic,国内,11,共同通信,福岡のエレベーター部品下敷き、2人死亡,https://news.yahoo.co.jp/articles/15ca2bc5b7173ae01952f3ac3e05f30bd7d25735,8/8(金) 19:51
2025-08-08,22:19,domestic,国内,12,日刊スポーツ,百田尚樹氏、米山隆一氏の「日本にも過ち」に反論「自虐史観と偽善に基づいた捻じ曲がった解釈」,https://news.yahoo.co.jp/articles/12fb1cffc0583f571df219de50ed4c5bd9edb73e,8/8(金) 17:13
2025-08-08,22:19,domestic,国内,13,日刊スポーツ,「ジョーカー議員」河合悠祐氏が川口市長選出馬へ、12日に記者会見　新党立ち上げも,https://news.yahoo.co.jp/articles/b4e6f1bb8b351667bda20a78d86b5471f66c7273,8/8(金) 15:27
2025-08-08,22:19,domestic,国内,14,スポニチアネックス,ヒゲの隊長、両院議員総会で「潮目変わった」　総裁選前倒し是非の選管一任「石破総裁には想定外では」,https://news.yahoo.co.jp/articles/f67b6b30f5fb7d303ead0177795b051f0620f54a,8/8(金) 21:33
2025-08-08,22:19,domestic,国内,15,東海テレビ,もらえたら嬉しい…お盆休みに喜ばれる『この夏の名古屋土産4選』全国で名駅店だけの洋菓子ファン注目の逸品も,https://news.yahoo.co.jp/articles/2bab1814a12695b5dbd253845b307b08c7c1dc78,8/8(金) 20:33
2025-08-08,22:19,domestic,国内,16,信濃毎日新聞デジタル,中学校の吹奏楽部、大半が“廃部”へ　部活の地域移行、文化系に高いハードル　場所や楽器、指導者…難題いくつも抱え教員苦悩「タムリミット迫っている」,https://news.yahoo.co.jp/articles/d4b740401ff9cf03ebd4153169e9443d6978fc2c,8/8(金) 6:33
2025-08-08,22:19,domestic,国内,17,弁護士JPニュース,伊東市長、百条委員会“出頭拒否”に「正当な理由」ない…「法を軽視」「市民をバカにしている」弁護士が“苦言”のワケ,https://news.yahoo.co.jp/articles/1c4344012a53b93575aa8dcc8d2e88036099f9bb,8/8(金) 10:00
2025-08-08,22:19,domestic,国内,18,共同通信,ロシア巨大地震はM8.8　気象庁、規模や津波高更新,https://news.yahoo.co.jp/articles/3876206dce02c4adbd8ffa31e2edca56f9256f13,8/8(金) 19:43
2025-08-08,22:19,domestic,国内,19,毎日新聞,陸自宮古島駐屯地トップ、市民を威圧　抗議に「許可取れ、早く」,https://news.yahoo.co.jp/articles/54e094fcde594353a521c3a390c941e01a56189b,8/8(金) 20:21
2025-08-08,22:19,domestic,国内,20,共同通信,キッチンカーで34人食中毒　岐阜、トルコ料理原因,https://news.yahoo.co.jp/articles/39aa01b2f4df6a569dd1e24641a7a756e45a14c8,8/8(金) 18:11
2025-08-08,22:19,domestic,国内,21,FNNプライムオンライン（フジテレビ系）,自民・森山幹事長“石破おろし”巡り過半数以上の要求あれば”臨時総裁選を実施”との認識示す,https://news.yahoo.co.jp/articles/83ded4e493775ce00ae8420fd21cab544d46adda,8/8(金) 18:03
2025-08-08,22:19,domestic,国内,22,共同通信,斎藤元彦兵庫知事を任意聴取、神戸地検,https://news.yahoo.co.jp/articles/ae75fd2000421445d2ce3b5e9d983132db83d45c,8/8(金) 21:24
2025-08-08,22:19,domestic,国内,23,東海テレビ,延べ150人が“不合格”等…運転免許の学科試験で約2年間にわたり採点間違える マークシートの機械に正答を誤入力,https://news.yahoo.co.jp/articles/2d546793e23e9be3ed5605f8ac37ebad348cf3db,8/8(金) 11:52
2025-08-08,22:19,domestic,国内,24,信濃毎日新聞デジタル,「大動脈が…」 高まる火山活動、人気上昇中の避暑地に打撃　夏休みに首都圏の観光客運ぶ道路規制　「安全考えればやむを得ない」との声も,https://news.yahoo.co.jp/articles/36b865da744d1687165abace1ffe9ee6993c7967,8/8(金) 16:50
2025-08-08,22:19,domestic,国内,25,産経新聞,「加害者扱い、即時撤回せよ」　辺野古ダンプ事故、抗議女性聴取でオール沖縄会議が声明,https://news.yahoo.co.jp/articles/b0bf02bc26f53fc5b372446d0eba3a338142829e,8/8(金) 17:19
2025-08-08,22:19,domestic,国内,26,SlowNews／スローニュース,日本では「汚染が顕著」ですでに母親の体内に蓄積されているという調査結果も！ 新たに規制対象となった物質「PFNA」とは,https://news.yahoo.co.jp/articles/890addcd0249903b96eba8b462bb467d733f1dfd,8/8(金) 12:05
2025-08-08,22:19,domestic,国内,27,FNNプライムオンライン,被害総額170億円か…フィリピン拠点の男女9人を逮捕　自社発行の日本人向け「まにら新聞」を説明に使うなどして投資家を勧誘か,https://news.yahoo.co.jp/articles/6ac4df039a83392d779101eec8b06fa8562e1af1,8/8(金) 20:21
2025-08-08,22:19,domestic,国内,28,中国新聞デジタル,「ごめんね、先生だけ逃げて」 教員辞め実家へ　150人が被爆死した学校、教え子を思い今も胸痛める102歳　#戦争の記憶,https://news.yahoo.co.jp/articles/1546e41f5c966cfa9a3ac42f7b052b7afc5f5bbf,8/8(金) 11:01
2025-08-08,22:19,domestic,国内,29,FNNプライムオンライン,「ミスがガンガン起こっている」混迷の『トランプ関税』“上乗せ”は政府間の技術的ミス? 峯村健司氏「トランプ政権は空席多く意思疎通も緩い」,https://news.yahoo.co.jp/articles/460271f2f28bf0fbb22d22ea9608cd9d4bbe95d5,8/8(金) 14:15
2025-08-08,22:19,domestic,国内,30,共同通信,ホスピス最大手、訪問看護で実態ない報酬請求,https://news.yahoo.co.jp/articles/c8d0a925bda8bac902ddab48689c435b96c979f9,8/8(金) 20:51
2025-08-08,22:19,domestic,国内,31,共同通信,首相、靖国参拝見送りへ　小泉農相「適切に判断」,https://news.yahoo.co.jp/articles/1b6377703745cc02ac7e70c31c6cf51c236e1071,8/8(金) 17:23
2025-08-08,22:19,domestic,国内,32,デイリースポーツ,怒る石破首相　辞任しない最大理由→「自民の中で１番引きずり下ろそうとしている連中」の名前　元日テレ青山氏が明かしＴＶ騒然　最近総理が自民敗北の原因だと猛反発してると　正義のミカタ,https://news.yahoo.co.jp/articles/af48f717717687102adabd20c96f671c536ebce9,8/2(土) 20:06
2025-08-08,22:19,domestic,国内,33,TBS NEWS DIG Powered by JNN,「やばい溺れる」14歳少年が海水浴場で溺れて意識不明の重体　SNSで知り合った男女9人で遊んでいたか　片瀬東浜海水浴場,https://news.yahoo.co.jp/articles/f1d445537a7c282aec1068d64674c79e4b571f07,8/6(水) 19:12
2025-08-08,22:19,domestic,国内,34,レスキューナウニュース,JR神戸線で人身事故 一部運転見合わせ,https://news.yahoo.co.jp/articles/7099bcf8d5a77e2cffa62e7a05aa6de7ef343281,8/8(金) 13:35
2025-08-08,22:19,domestic,国内,35,京都新聞,【速報】北陸自動車道など11～13日に大雨で通行止めの可能性　ネクスコ中日本が注意呼びかけ,https://news.yahoo.co.jp/articles/dbdb32087ceb20a7e0055c44b72ab15af594833d,8/8(金) 19:00
2025-08-08,22:19,domestic,国内,36,東海テレビ,格安なだけじゃなかった…有名焼肉チェーンが『肉の直売所』コロナ禍で生まれ今や名物となった“進化に次ぐ進化”,https://news.yahoo.co.jp/articles/2ab340edfd74578ca4d1f18330a4f30ae0e06d6a,8/8(金) 18:11
2025-08-08,22:19,domestic,国内,37,毎日新聞,福井・中3殺害　県警本部長「反省している」　謝罪や検証はなし,https://news.yahoo.co.jp/articles/914ae3d43097f6ca6596120a5898a1e4d55fd041,8/1(金) 21:17
2025-08-08,22:19,domestic,国内,38,時事通信,参政幹事長に元自民・安藤氏　終戦記念日に靖国参拝,https://news.yahoo.co.jp/articles/7d69db2bbd9e097cf360abd610ff38df487f5f65,8/1(金) 20:43
2025-08-08,22:19,domestic,国内,39,朝日新聞,紀子さま、出産育児から復帰した研究者と交流,https://news.yahoo.co.jp/articles/246b366d6ddf9d80ef47cb25cb781d5c22f1e290,8/8(金) 19:54
2025-08-08,22:19,domestic,国内,40,デイリースポーツ,突然上乗せトランプ関税→合意文書作ってたら大変な事態だったと　「ひるおび」加谷氏が指摘「逆です。作んなくて正解。８０兆は払えと言われますよ」,https://news.yahoo.co.jp/articles/a21fe967bfdeeb0d3406699263404e19b7db8df2,8/7(木) 23:14
