scrp_date,scrp_time,genre_en,genre_jp,rank,media_jp,title,link,date_original
2024-02-03,19:15,TTL,総合,1,ABEMA TIMES,炊き出しの豚汁に“ミネラル入りサプリ”投入 被災者は知らず 団体は「どれだけ摂っても問題ない。アンチは無知」一方で健康被害の恐れも,https://news.yahoo.co.jp/articles/f95453cbdc8de96a28cba599c40520cee6a4e001,2/3(土) 11:50
2024-02-03,19:15,TTL,総合,2,BSS山陰放送,人気の牛骨白湯ラーメン店が突然臨時休業　足が腫れあがり、全身に激痛…店主を襲った「IgA血管炎」とは?,https://news.yahoo.co.jp/articles/a517e174ba05c4b107620a811183e8cba8167b81,2/3(土) 7:21
2024-02-03,19:15,TTL,総合,3,ENCOUNT,松本人志問題、元文春記者が“文春の内部事情”ネタバレ　OBからも「やりすぎじゃないか」の声,https://news.yahoo.co.jp/articles/9a60dd765a55bd2c951631e279d32fc01ccf36f7,2/3(土) 13:29
2024-02-03,19:15,TTL,総合,4,Hint-Pot,「東大出てないのに、俺に教える資格あるんですか？」　予備校講師の返答に称賛の声　「返しが完璧ですね」,https://news.yahoo.co.jp/articles/24079a7ed7070dbceafefe3707d7904aa24c125c,2/3(土) 9:10
2024-02-03,19:15,TTL,総合,5,スポーツ報知,エスパー伊東さん、告別式に「めちゃイケ」メンバーが参列　加藤浩次「大変お世話になり感謝している」,https://news.yahoo.co.jp/articles/4d7dc1b713f45c2bc6968be122078d3b18164208,2/3(土) 14:55
2024-02-03,19:15,TTL,総合,6,デイリースポーツ,井上尚弥　亡くなった穴口一輝選手を悼む　「すばらしい試合だった」「ご冥福をお祈りしたい」　自身４団体制覇のセミで激闘,https://news.yahoo.co.jp/articles/09a3ae88592958345c21fef4b6c8c724f0ccd347,2/3(土) 15:09
2024-02-03,19:15,TTL,総合,7,超WORLDサッカー！,【日本代表プレビュー】アジア頂上決戦、エース欠く相手に不測の事態に巻き込まれた日本はスタメン継続路線と予想/vsイラン代表【アジアカップ2023】,https://news.yahoo.co.jp/articles/4b9da746fde70f38dc5b31156118cfc8d4dcf1ab,2/3(土) 12:50
2024-02-03,19:15,TTL,総合,8,スポーツ報知,【大学野球】 母・谷亮子さんの願いは「粘り強く」　駒大に入寮した長男・佳亮外野手の旅立ちの朝のメニューは納豆,https://news.yahoo.co.jp/articles/612a662295a4d387883267e509453d5e91ae51b7,2/3(土) 13:33
2024-02-03,19:15,TTL,総合,9,読売新聞オンライン,雪遊び中に姿見えなくなった７歳男児…情報提供呼びかける母「忘れた日は一度もない」,https://news.yahoo.co.jp/articles/ce159215f163d1045dbeff62d320adcdbb521b58,2/3(土) 14:39
2024-02-03,19:15,TTL,総合,10,kufura,「恵方巻のおかず」一品合わせるなら何を選ぶ？何だかもの足りない…を解消！,https://news.yahoo.co.jp/articles/89b45a8b881404012716ec85d139f8b9e39fcaac,2/3(土) 10:10
2024-02-03,19:15,TTL,総合,11,ほ・とせなNEWS,交通事故で全身の60%を火傷　ほとんどの指を失い不自由な暮らしに…それでも“夢”に向かって進む女性に迫る,https://news.yahoo.co.jp/articles/bbad90da12b3c74bbdf21a3f4e963bddf997c286,2/3(土) 15:00
2024-02-03,19:15,TTL,総合,12,スポーツ報知,蛙亭イワクラ、別人級に変貌「薬師丸ひろ子かと」「ビックリ」「全然わかんない」とネット騒然,https://news.yahoo.co.jp/articles/34cafa38bf9ca0a599c002195b01fa7382678cda,2/3(土) 15:40
2024-02-03,19:15,TTL,総合,13,デイリースポーツ,東尾理子に夫・石田純一「いちいちうるさいな、だから３０半ばまで結婚できなかったんだよ」にスタジオ騒然,https://news.yahoo.co.jp/articles/0247dc37e2278a4d22c3a6759aefefd390947fee,2/2(金) 22:35
2024-02-03,19:15,TTL,総合,14,スポニチアネックス,上原さくら　入院していた　強烈な痛みで救急搬送、「泣き叫んで」検査　「私の病名は…」,https://news.yahoo.co.jp/articles/ff278a14b75de771ac0c25e52e39108cc10d4db5,2/3(土) 16:08
2024-02-03,19:15,TTL,総合,15,マグミクス,『クレヨンしんちゃん』公式で野原ひろしは「安月給」　ネット上の「勝ち組じゃん」説は本当か,https://news.yahoo.co.jp/articles/7ad0d1b15053a574dca795bb14f28ceaa9be22ef,2/3(土) 16:50
2024-02-03,19:15,TTL,総合,16,CoCoKARAnext,穴口一輝選手の死去を受けた青木真也の指摘に井上尚弥が持論「皆さんには誤解だけはして欲しくない」,https://news.yahoo.co.jp/articles/517d5d1f97057c84991d9337fc162136449e3033,2/3(土) 13:23
2024-02-03,19:15,TTL,総合,17,スポニチアネックス,上沼恵美子、松本人志の騒動に思うこと「私は早いこと年行っててよかった。もし20年若かったら…」,https://news.yahoo.co.jp/articles/535199b0d97d8cf11f4d9d945e7ec4cb49de5d07,2/3(土) 15:59
2024-02-03,19:15,TTL,総合,18,マイナビ子育て,優香さん「第一子の出産後は誰にも会えなかった」唯一よかったことは夫婦でぎゅっと一緒にいられたこと,https://news.yahoo.co.jp/articles/a2c6d027c1751f167b7b5249068cd27890ce8ed5,2/3(土) 11:33
2024-02-03,19:15,TTL,総合,19,モデルプレス,東貴博、第2子の名前を美文字で公開 苗字にも注目集まる「知らなかった」「新鮮」,https://news.yahoo.co.jp/articles/d9c515dbdc3de70748083a621a2e03789c0b85c2,2/3(土) 11:38
2024-02-03,19:15,TTL,総合,20,日刊ゲンダイDIGITAL,悠仁さま“トンボの論文”で東大推薦入学に動き出す…「手助けする人がいるのは公平か」の指摘,https://news.yahoo.co.jp/articles/faa6132ce06dbbf51f7af1d2761dd54a2a6a9529,2/3(土) 9:06
2024-02-03,19:15,TTL,総合,21,オリコン,『新婚さん』メンズフィジーク日本一の夫　グイグイ妻からホテルに誘われるもベットイン3秒で大事件,https://news.yahoo.co.jp/articles/521460ee8e638d4eb32a1e541493f743344c460d,2/3(土) 12:27
2024-02-03,19:15,TTL,総合,22,スポニチアネックス,出川哲朗　人気俳優から“充電旅”にまさかの逆オファー「番宣なんて関係ない。俺が出たいから出るんだよ」,https://news.yahoo.co.jp/articles/d2342a680db1c111307776649687538db4cb8c5e,2/3(土) 16:02
2024-02-03,19:15,TTL,総合,23,東スポWEB,【アジアカップ】イランが過密日程を理由に日本戦の日程変更を要求も…ＡＦＣは拒否,https://news.yahoo.co.jp/articles/94a778beca4fee609e033b78a54185f9462916b7,2/3(土) 17:16
2024-02-03,19:15,TTL,総合,24,スポーツ報知,住谷杏奈、娘の中学受験の結果を報告「受験を決めたのは２か月前」併願なし本命１校　合否に震え「ボタンを押せません」,https://news.yahoo.co.jp/articles/3521d44cc787dc6979175e6accdf72423808debb,2/3(土) 13:50
2024-02-03,19:15,TTL,総合,25,日刊スポーツ,【ジャンプ】51歳レジェンド葛西紀明が50代初V「やった！よっしゃー！」TVh杯で逆転優勝,https://news.yahoo.co.jp/articles/1d22a0c74c6a24fe07718da1643a182edd3ea75c,2/3(土) 14:00
2024-02-03,19:15,TTL,総合,26,デイリースポーツ,武尊が現役続行か　激闘惜敗喫した王者スーパーレックへメッセージ「あなたの強さを感じて、さらにやる気が出ました」　試合直後は引退示唆も,https://news.yahoo.co.jp/articles/cfa5d083e7df8395ea5e44cc7222d0ed90c29589,2/3(土) 17:20
2024-02-03,19:15,TTL,総合,27,スポニチアネックス,【来週のブギウギ】第19週　愛子が生まれて3か月　トミがスズ子の家を訪ねてきて、愛子を…,https://news.yahoo.co.jp/articles/4a2cc3aa547e8ea40ffde3c083a13683fbe0a59a,2/3(土) 13:32
2024-02-03,19:15,TTL,総合,28,スポニチアネックス,工藤静香　手作り「恵方巻き」披露「食べやすく、シンプルに」　フォロワー「美味しそう」「さすが」　,https://news.yahoo.co.jp/articles/556e99f22129c1cf569d12294955fa18338cc42a,2/3(土) 15:55
2024-02-03,19:15,TTL,総合,29,スポーツ報知,長嶋一茂、医療脱毛先の女性２人を食事に誘う「俺のすべてを見たんだから、食事してくれませんか？」,https://news.yahoo.co.jp/articles/fb0e440dc3a8824b840c1e038ad3914f22617c41,2/3(土) 6:12
2024-02-03,19:15,TTL,総合,30,東スポWEB,ＲａＭｕが松本人志めぐる番組コメントを謝罪　ＳＮＳで「論点が違う」の指摘受け,https://news.yahoo.co.jp/articles/7b30928f24b47be2048b59449ca7dfda85599e43,2/3(土) 18:21
2024-02-03,19:15,TTL,総合,31,オリコン,元文春エース記者、今田耕司の前で松本人志報道をネタバレへ　編集部内の“ある事態”で続報を確信,https://news.yahoo.co.jp/articles/9c8dca220e3a7e49eed3c5034656d18a6c53928b,2/2(金) 18:00
2024-02-03,19:15,TTL,総合,32,テレ東プラス,「ジャパネット」を継いだ2代目…900億円ビッグプロジェクトの全貌,https://news.yahoo.co.jp/articles/7a90bbcdbdd0c4363de600a835a56db76682984a,2/3(土) 11:02
2024-02-03,19:15,TTL,総合,33,スポニチアネックス,土屋太鳳、29歳の誕生日を報告「29歳の今、女優として生きることが出来ています」長文で思いつづる,https://news.yahoo.co.jp/articles/b6d6f955b1d7dac20931673b8e6905c7607f32cd,2/3(土) 17:17
2024-02-03,19:15,TTL,総合,34,Full-Count,中日加入の28歳は「まさか戦力外とは」　快音連発…熾烈な外野手争い「厳しくなる」,https://news.yahoo.co.jp/articles/61231ef7a541160c4848787e6e70439ac5521a7c,2/3(土) 15:26
2024-02-03,19:15,TTL,総合,35,スポーツ報知,和田明日香さん、ほぼ初対面の年上タレントに「ちょっと意外、料理できるんだ…ハッハッハッ！ごめんなさい」,https://news.yahoo.co.jp/articles/bf3e0657fcce5f62866133b990474a380a93f5f8,2/3(土) 14:50
2024-02-03,19:15,TTL,総合,36,西スポWEB OTTO！,ソフトバンク小久保監督「彼は救われたんじゃないですか」FA移籍の山川穂高が初の屋外フリーで柵越え連発　週末のスタンドに拍手や歓声,https://news.yahoo.co.jp/articles/04250d6de42363194d6f7cb1b38806d0b62a8a23,2/3(土) 13:47
2024-02-03,19:15,TTL,総合,37,デイリースポーツ,巨人・阿部慎之助監督「鬼退治からの虎退治だな」リップサービスも交え打倒・阪神の決意表明,https://news.yahoo.co.jp/articles/743636dd14ca850db0f756500a01de87ad2b046d,2/3(土) 18:05
2024-02-03,19:15,TTL,総合,38,スポニチアネックス,RaMu　松本人志巡る発言を謝罪「お子さんと奥さんが一番の被害者」がネット上で物議「言葉が至らず」,https://news.yahoo.co.jp/articles/6ebe322f98a4fbcdc1bf3b48f5d6fd5de677ff38,2/3(土) 17:26
2024-02-03,19:15,TTL,総合,39,東スポWEB,「セクシー田中さん」問題で注目集まる「海猿」原作者の〝暴露〟　主演・伊藤英明が反応,https://news.yahoo.co.jp/articles/252dbcb36cf53ee82a89478c6b4640347bfc663f,2/3(土) 9:21
2024-02-03,19:15,TTL,総合,40,中央日報日本語版,「キャサリン妃は昏睡状態だった」…スペイン報道を英王室が否定,https://news.yahoo.co.jp/articles/3c72d0acc226e21aa54d626e10b1a789fe9f68ad,2/3(土) 13:12
