scrp_date,scrp_time,genre_en,genre_jp,rank,media_jp,title,link,date_original
2025-10-18,15:09,TTL,総合,1,スポニチアネックス,ブルワーズ監督「ポストシーズンの個人では史上最高のパフォーマンス」　大谷の伝説的な活躍を称える,https://news.yahoo.co.jp/articles/8021b811a7086530bf908096cab44af1668ca877,10/18(土) 12:48
2025-10-18,15:09,TTL,総合,2,スポーツ報知,「その男は１０個の三振を奪い、３本のホームランを放った」敗軍の将ブルワーズ監督、大谷の名を出さず「ＰＳ史上最も素晴らしい個人パフォーマンス」,https://news.yahoo.co.jp/articles/99450cff029d749e65b7dd9b6c8949d6bf9326d4,10/18(土) 13:09
2025-10-18,15:09,TTL,総合,3,MLB公式日本語サイト,【MLB】 ドジャースがリーグ連覇＆ワールドシリーズ進出　大谷翔平が10三振・3本塁打の怪物パフォーマンス,https://news.yahoo.co.jp/articles/92bfff3428b09ebaf933ae58971a31213fa91281,10/18(土) 12:20
2025-10-18,15:09,TTL,総合,4,CoCoKARAnext,米国で広まる“史上最高”の声　想像を超えた大谷翔平の3HR＆10Kに重鎮記者も感嘆「これは不公平だ」「オオタニは王」,https://news.yahoo.co.jp/articles/86b2e00c2e38a78a854fffcac05f725d4666042f,10/18(土) 12:28
2025-10-18,15:09,TTL,総合,5,Full-Count,大谷の場外弾、同僚は“ドン引き”　フリーマンは口開け頭抱える…ブルペンは狂喜乱舞,https://news.yahoo.co.jp/articles/12b2d3b6aaf34cad065e807f2100dd1c3980da35,10/18(土) 11:09
2025-10-18,15:09,TTL,総合,6,Full-Count,大谷翔平が真っ先に感謝した人物「本当に助けられた」　3発＆10K無失点も…漏らした本音,https://news.yahoo.co.jp/articles/01c24a9f2aad04c060a5467a9d94652132bca4e8,10/18(土) 12:46
2025-10-18,15:09,TTL,総合,7,日刊スポーツ,堀江貴文氏「その後もワクチン打ち続けてますか？」と聞かれ“６文字”で返答,https://news.yahoo.co.jp/articles/f906c5e1e6d144e0880179f970e3c633c997b9d0,10/18(土) 11:15
2025-10-18,15:09,TTL,総合,8,スポニチアネックス,二階堂ふみと結婚のカズレーザー「家に帰ると大女優。もう働かなくていい」　山里も「いつでもヒモなれる」,https://news.yahoo.co.jp/articles/409ec084a4f56e43198f029c839eb2cbff3f29b1,10/18(土) 11:56
2025-10-18,15:09,TTL,総合,9,スポニチアネックス,【大谷翔平と一問一答】「打てそうな感じで打席に立てていた」3発＆10K「全体的には出来過ぎ」,https://news.yahoo.co.jp/articles/6127ced7819ae992867f95a1f4e8735968a66cdd,10/18(土) 14:30
2025-10-18,15:09,TTL,総合,10,Full-Count,大谷翔平、史上11人目の1試合3発　松井氏超えの特大5号＆7回途中無失点…本拠地大喝采,https://news.yahoo.co.jp/articles/34962f4b8b50171d819135af092617c4da9c2bf1,10/18(土) 11:44
2025-10-18,15:09,TTL,総合,11,西スポWEB OTTO！,「タトゥーは…」人気絶頂の中脱退から5年〝激変〟平手友梨奈の姿に衝撃「まさかの本人?」「どんなてちでも好き」「めっちゃ可愛い似合ってる」,https://news.yahoo.co.jp/articles/db5a0810a9160b9ca7692bdc8d67d2cf50d8a2ba,10/18(土) 11:02
2025-10-18,15:09,TTL,総合,12,デイリースポーツ,「私ならMVP票はベッツに入れる」ブルワーズ監督が大谷翔平MVP本命視に異論「本当に価値があった選手」,https://news.yahoo.co.jp/articles/840da5ab9124e879e81d4d2527e4018536755214,10/18(土) 7:42
2025-10-18,15:09,TTL,総合,13,朝鮮日報日本語版,訃報：元プロ野球選手・趙用勲さん37歳、ライブ配信中に転落死…視聴者が通報,https://news.yahoo.co.jp/articles/935112f4593c5e7683b6142bfd98422f33b8a7c4,10/18(土) 10:29
2025-10-18,15:09,TTL,総合,14,スポニチアネックス,大谷翔平3発＆10Kにド軍同僚は脱帽　フリーマン「ショウヘイ・オオタニ・ゲーム」スネル「クレイジー」,https://news.yahoo.co.jp/articles/34b5ebf20e504df8d7eeb95c9267ec6d394860a4,10/18(土) 13:11
2025-10-18,15:09,TTL,総合,15,デイリースポーツ,【玉木代表】大阪のＴＶ生出演、２０分熱弁→元日テレ解説委員に「ずっと同じ主張」「政治は即決。裏と表がある」と最後にまとめられる,https://news.yahoo.co.jp/articles/728bb2df9a8b916b0554180fefbfc72217b6b3f1,10/18(土) 10:31
2025-10-18,15:09,TTL,総合,16,CoCoKARAnext,「この男には7億ドルの価値がある」大谷翔平、優勝決定シリーズMVP！先発試合で1試合3発＆7回途中10K、史上初の快挙に米驚愕　「史上最高の選手が史上最高の試合をしている」,https://news.yahoo.co.jp/articles/7cb48cbff39204eb68f083f8fbff092aa12e1c6d,10/18(土) 12:42
2025-10-18,15:09,TTL,総合,17,Full-Count,山本由伸、大谷の活躍に「脳が追いつかない」　理解不能の二刀流…MVP逃すも「悔いない」,https://news.yahoo.co.jp/articles/3e6ede06f3743c418ae2d1bb54fce1eac6f24f22,10/18(土) 13:11
2025-10-18,15:09,TTL,総合,18,Full-Count,大谷翔平、異次元3HRに球団公式「なんてこった!!」　思わず漏れた一言「信じられない」,https://news.yahoo.co.jp/articles/95ae5b85ad1273e5a688fbf4f61691747028002d,10/18(土) 11:59
2025-10-18,15:09,TTL,総合,19,デイリースポーツ,佐々木朗希　集合写真撮影でカーショーがハグ求める　２人だけの歓喜のシーン　若き右腕も万感の表情に,https://news.yahoo.co.jp/articles/c327af9b48fefd8fb7735e0f43df8e7edb27a3fd,10/18(土) 13:15
2025-10-18,15:09,TTL,総合,20,Full-Count,大谷の歴史的活躍…スネルも高笑い「はっはっはっ」　衝撃3発＆10Kに「狂ってるね」,https://news.yahoo.co.jp/articles/cbfdd866d5af167bfb30220e40834581ec8d3c9c,10/18(土) 12:56
2025-10-18,15:09,TTL,総合,21,日刊スポーツ,小沢一郎氏実名明言「この人物を起用した時点で高市体制は終わっている。公明党が怒るのは当然」,https://news.yahoo.co.jp/articles/a33c3612956f44bd3f5c3d56f31d923f6f775fd5,10/18(土) 6:34
2025-10-18,15:09,TTL,総合,22,Full-Count,MVPの大谷翔平、シャンパンファイトで喜び爆発　ロバーツ監督の祝福で開始「翔平おめでとう」,https://news.yahoo.co.jp/articles/8d81ade1f83e79d9f4d3e77462528b0e5c3349ae,10/18(土) 12:52
2025-10-18,15:09,TTL,総合,23,バトル・ニュース,クマに襲われ死亡した男性には6歳と4歳の娘。今年3月に一家で移住したばかり…クマによる犠牲者が過去最多へ,https://news.yahoo.co.jp/articles/75c103d19e3dbdac0b0a66300981e741437b00bb,10/18(土) 14:09
2025-10-18,15:09,TTL,総合,24,スポニチアネックス,大谷翔平　MLBレジェンド2人が絶賛「放送席にいる私たち大人を子供に」投打の活躍「まるで草野球」驚き,https://news.yahoo.co.jp/articles/dfdac0745133d1e5a3c6a55926b2f69f3d197f28,10/18(土) 14:07
2025-10-18,15:09,TTL,総合,25,日刊スポーツ,「本当のユニコーン」３発＆10Ｋの大谷翔平をキケ・ヘルナンデスが称賛「非現実的だよ」,https://news.yahoo.co.jp/articles/b8305c1e4abcc0aec6bf539cfbdfea9028106db0,10/18(土) 13:54
2025-10-18,15:09,TTL,総合,26,ITmedia ビジネスオンライン,森永の「板チョコアイス」はなぜ消え、なぜ売上倍増で帰ってきたのか？,https://news.yahoo.co.jp/articles/7d5e5f0c7904a0b811e1ef208d058f54b686605c,10/18(土) 9:10
2025-10-18,15:09,TTL,総合,27,日刊スポーツ,古坂大魔王、首相指名巡る政局で「迫力が凄いと思った３人」を実名指摘「結局人間って…」,https://news.yahoo.co.jp/articles/06489c9546b2c6fca859e3a6b8d7ae8bfc70a8e2,10/18(土) 13:48
2025-10-18,15:09,TTL,総合,28,Full-Count,大谷翔平の場外弾…頭抱えるド軍ナイン「反応が野球少年」　凄すぎて起こった“シンクロ”,https://news.yahoo.co.jp/articles/cd90c02e186fd4eadaf157f47d9df5929a5c702b,10/18(土) 14:12
2025-10-18,15:09,TTL,総合,29,日刊スポーツ,大谷翔平の前代未聞のプレーを殿堂入り投手２人が称賛「どうかしてる」「野球史全体を書き換え」,https://news.yahoo.co.jp/articles/0af0dfd1963a6da6fec836d9e95d71e200534305,10/18(土) 13:50
2025-10-18,15:09,TTL,総合,30,テレビ朝日系（ANN）,アイドルグループのメンバーが脱退「グループ活動規約に反する行為が確認されました」,https://news.yahoo.co.jp/articles/a9d674fd1712b198b0c4965dcf5bb6a57347ee64,10/18(土) 11:18
2025-10-18,15:09,TTL,総合,31,Full-Count,大谷翔平にベッツ興奮「ジョーダンのよう」　示した最大限の敬意「我々はついていく」,https://news.yahoo.co.jp/articles/42eaa731d1a779e566f7731be0a820750271f892,10/18(土) 14:26
2025-10-18,15:09,TTL,総合,32,デイリースポーツ,大谷翔平　衝撃の１試合３発　ベンチのマーフィー監督も思わず首かしげる　打った瞬間に絶叫の一撃はバックスクリーン左へ,https://news.yahoo.co.jp/articles/e408e249883c15e8dbd7dd1f336f35bef1bf29c2,10/18(土) 11:50
2025-10-18,15:09,TTL,総合,33,スポニチアネックス,女優・髙橋智子さん　交通事故で急逝　39歳　所属事務所発表　舞台中止に活躍　ドラマ出演も,https://news.yahoo.co.jp/articles/67a1c322582c3d319605e63bf173ddd30f9bed34,10/18(土) 14:47
2025-10-18,15:09,TTL,総合,34,中日スポーツ,ロバーツ監督、大谷翔平への雑音「逆に火をつけた」…「PS史上最高のパフォーマンス」の裏側、２発目の場外弾「さすがに驚いた」,https://news.yahoo.co.jp/articles/cc5b96ca14fd3745db529162769adfbe4e2dc692,10/18(土) 13:53
2025-10-18,15:09,TTL,総合,35,まいどなニュース,「すぐに気づいた」NHKあさイチ…ゲスト着用のワンピが話題→ネット完売、公式も反応　「やっぱり」「とてもお似合い」,https://news.yahoo.co.jp/articles/80996c9578dad28aaa92a0a1fc23ed46339a08b9,10/18(土) 14:15
2025-10-18,15:09,TTL,総合,36,日刊スポーツ,大谷翔平の驚異的活躍に米国で反応続々「独壇場」「ザ・ベスト。以上」「あまりに驚異的」,https://news.yahoo.co.jp/articles/bbe6a74a09b6bc75006942553828989393264023,10/18(土) 11:38
2025-10-18,15:09,TTL,総合,37,まいどなニュース,セルフレジで感じた「違和感」に店内騒然…スーパーやコンビニで多発中の『カゴ抜け』とは？「これは一発実刑の詐欺罪」「自分もやられた…」,https://news.yahoo.co.jp/articles/e00da2b8ec278df32af43f35337f271a306acd77,10/18(土) 7:20
2025-10-18,15:09,TTL,総合,38,Full-Count,日本S進出も…阪神ファンを襲った「悲報」　“嬉しい悲鳴”に落胆「何をすれば」,https://news.yahoo.co.jp/articles/91cb0c75dafeb2408f3c83e54ad5c429b1f475bc,10/18(土) 6:13
2025-10-18,15:09,TTL,総合,39,RONSPO,「他に何があると言うんだ？」角田裕毅が渋滞で米国GPスプリント予選の最終アタックができず18番手に沈み不快感示す…接触しかけたローソンにも「彼にいつもあの通りだ」と激怒,https://news.yahoo.co.jp/articles/9b1df6962802356ec1dadc80b0d658638a83c484,10/18(土) 11:58
2025-10-18,15:09,TTL,総合,40,スポニチアネックス,NBAレイカーズの本拠地でも大谷翔平“衝撃3発”を速報！現地実況も大谷翔平を称賛「翔平の神業から…」,https://news.yahoo.co.jp/articles/e3ca04093a139ce0b29f5883049a86fba367a856,10/18(土) 12:57
