scrp_date,scrp_time,genre_en,genre_jp,rank,media_jp,title,link,date_original
2023-12-22,22:19,local,地域,1,神戸新聞NEXT,「それ詐欺ですよ」新人タクシー運転手、客乗せたまま交番へ　ピンときた! 会話で確信,https://news.yahoo.co.jp/articles/a868c97047f308675725b0409a54005e00327c55,12/21(木) 19:06
2023-12-22,22:19,local,地域,2,テレビ静岡NEWS,病院の薬剤師が足りない！薬局やドラッグストアに学生が流れ…その裏には“リアル”な現実　静岡,https://news.yahoo.co.jp/articles/67ac70dfa608d6d6a2488973b5b27069794570d1,12/22(金) 6:30
2023-12-22,22:19,local,地域,3,関西テレビ,従業員およそ8700人の給与は維持　22日も立ち入り検査　工場の稼働順次停止【ダイハツ不正問題】,https://news.yahoo.co.jp/articles/aaed29a37f3f1064a445296eb40d7df5bb8ac05f,12/22(金) 17:58
2023-12-22,22:19,local,地域,4,京都新聞,【速報】線路内に女性飛び込みか、JR堅田駅でサンダーバードにはねられ死亡　4千人に影響,https://news.yahoo.co.jp/articles/491cf23ce1572c05ee010a9f76fd3a2f8dc61ec5,12/22(金) 21:24
2023-12-22,22:19,local,地域,5,神戸新聞NEXT,宝塚歌劇団、月組公演日程をニュースで知らせず変更　来年の初日1日遅らせ、新人公演も中止,https://news.yahoo.co.jp/articles/fb4bfd577cb0b7b26eb0152afb67336481e8f260,12/22(金) 18:26
2023-12-22,22:19,local,地域,6,北海道新聞,ハンバーグに牛の毛の束混入　びっくりドンキー、釧路など2店で,https://news.yahoo.co.jp/articles/4e7715c874e3f0d7b53828ed4add9f8080ce87ab,12/22(金) 21:07
2023-12-22,22:19,local,地域,7,山陰中央新報,「どうやって学校行けば…」一畑バス４路線廃止　高校進学の直前、進路に影響も「行きたい学校に行かせたい」　代替手段なく、行政対策も不明,https://news.yahoo.co.jp/articles/af6df7677b5ef8313ecfc9fa826f53a7091c9d1e,12/22(金) 21:25
2023-12-22,22:19,local,地域,8,みんなの経済新聞ネットワーク,JR東日本が八王子発「成田エクスプレス」運転取りやめ　来年3月ダイヤ改正,https://news.yahoo.co.jp/articles/52c2b30641aa9828162ca8179eb0b0ee2a2e7aea,12/22(金) 20:36
2023-12-22,22:19,local,地域,9,神戸新聞NEXT,神戸徳洲会病院、持病見落とし患者死亡か　糖尿病に必要な対応せず　神戸市が立ち入り,https://news.yahoo.co.jp/articles/bccf9c9f9ecc6dce9d1dfa994ed6de24f7ccbc51,12/22(金) 12:10
2023-12-22,22:19,local,地域,10,HBCニュース北海道,交際していた高校教諭の女性殺害、36歳の元同僚の控訴審わずか10分で結審…666回の着信、700万円払っても別れられず「これが終わるために逃げたい、もう、死ぬしかない」承諾で１審判決は求刑の半分,https://news.yahoo.co.jp/articles/3d37b3d83dcb9a805deb48f431d6040417dafdf3,12/21(木) 10:17
2023-12-22,22:19,local,地域,11,北海道ニュースUHB,大学生を襲い死亡させ、消防隊員に反撃されて死んだヒグマ…過去に周辺で人を襲撃したクマとは別個体と判明…DNA型が一致せず　初めて人を襲ったか 北海道,https://news.yahoo.co.jp/articles/e26efdd13164949d18454e594d2dc1f87e5c9a39,12/21(木) 8:34
2023-12-22,22:19,local,地域,12,NBS長野放送,【大雪情報】あす午前6時までの24時間予想は…北陸70㎝、北海道・東北・関東甲信・東海・近畿50㎝ 、中国地方40㎝,https://news.yahoo.co.jp/articles/f403e8360a196e3ff6ba370519e5ae393073ebab,12/22(金) 20:38
2023-12-22,22:19,local,地域,13,千葉日報オンライン,京葉線ダイヤ改正は実施の考え　JR千葉支社長「丁寧に説明したい」　通勤快速廃止などで批判受け【追記あり】,https://news.yahoo.co.jp/articles/c717a8ce26437544cf8cd496fe14ae12ca5a9e87,12/22(金) 14:25
2023-12-22,22:19,local,地域,14,HBCニュース北海道,【全文掲載】札幌・中１女子いじめ自殺　両親の手記「いじめは殺人」「むすめは家族を笑顔にさせてくれる存在でした」,https://news.yahoo.co.jp/articles/f97edb3024f030db04aee7c636c9b5c0b8dc67c9,12/22(金) 20:59
2023-12-22,22:19,local,地域,15,河北新報,女子高校生に性的行為　児童福祉法違反で青森の県立高教諭逮捕,https://news.yahoo.co.jp/articles/a837626902771da545bcca4d0ea46b39016a2458,12/22(金) 21:06
2023-12-22,22:19,local,地域,16,BSS山陰放送,10年に一度レベルの暖かい年末になる可能性　その時期としては10年に1度程度しか起きないような著しい高温…日本各地に「早期天候情報」気象庁が発表,https://news.yahoo.co.jp/articles/530a15d4195e7524e7543679d52cddd0255ac81b,12/22(金) 14:14
2023-12-22,22:19,local,地域,17,HBCニュース北海道,「いじめは殺人」札幌・中学１年女子いじめ自殺で両親がコメント「加害者に怒り」「一生悔いを背負う家族が出ないように願う」,https://news.yahoo.co.jp/articles/03dc7a3eb34fd65f04d230f936450bc62ce30e81,12/22(金) 15:37
2023-12-22,22:19,local,地域,18,上毛新聞,司コーポレーション（群馬・沼田市）が自己破産申請へ,https://news.yahoo.co.jp/articles/44c8c8a4d4f09521bc41dc1021422512994372a7,12/22(金) 20:54
2023-12-22,22:19,local,地域,19,北海道新聞,最北のドナルド人形ついに冬眠？　劣化防止へ「冬囲い」　稚内のマクドナルド,https://news.yahoo.co.jp/articles/79b3418a4a6d24c1fdee1acbe7f4cf2e4eadee7a,12/20(水) 20:58
2023-12-22,22:19,local,地域,20,TOSテレビ大分,ダイハツ不正　中津の工場も生産停止へ　「仕事が無くなってしまう…」関係する地元企業は危機感　大分,https://news.yahoo.co.jp/articles/19bdf463a252f59916a6514ef4dcbf94374732f5,12/21(木) 18:56
2023-12-22,22:19,local,地域,21,京都新聞,【速報】JR湖西線・堅田駅で人身事故　山科－近江今津間で一時運転見合わせ,https://news.yahoo.co.jp/articles/54eaa22f3f4e426037ee923b6a4956b213ca459a,12/22(金) 20:27
2023-12-22,22:19,local,地域,22,神戸新聞NEXT,神戸市バス、乗客の要求で法令違反　経路誤り一方通行進入→バックで逆走し戻る　運転士「負い目から断れず」,https://news.yahoo.co.jp/articles/1f0c051002c8eb194e6e52decd7d84791cc8d8b5,12/22(金) 21:43
2023-12-22,22:19,local,地域,23,信濃毎日新聞デジタル,「岡谷工業のバレー部は終わった…」　県大会出場できず、部員10人切る…低迷したかつての全国屈指の強豪校はどう復活したのか,https://news.yahoo.co.jp/articles/d77c21f98c7e99f37c8ae73c56f0793b30b2a36e,12/22(金) 11:32
2023-12-22,22:19,local,地域,24,石川テレビ,奥能登で停電続く 輪島市の住宅ではお昼から7時間たっても解消せず,https://news.yahoo.co.jp/articles/35e66bf3e3f30fcb398daf8f13332648eae9b950,12/22(金) 20:49
2023-12-22,22:19,local,地域,25,南日本新聞,開店前から客が次々と…ダイハツ販売店、対応に追われる　新規契約中止、販売車の使用は「問題ない」と説明,https://news.yahoo.co.jp/articles/abb8e5e874a325b11425dfed2f9340f7b3f9aa1b,12/22(金) 8:25
2023-12-22,22:19,local,地域,26,HBCニュース北海道,体験走行中のスノーモービルが暴走　男性インストラクターが体当たりで停止させ足首骨折か　暴走の外国人女性にけがなし　札幌市西区,https://news.yahoo.co.jp/articles/1f64cfa77a9b0c108937fc5567e99a2e3dc96114,12/22(金) 18:07
2023-12-22,22:19,local,地域,27,静岡朝日テレビ,新東名工事残るは25km　急こう配の山、8割が「橋」「トンネル」…『最難関の工事区間』に潜入取材,https://news.yahoo.co.jp/articles/fd9a379762718e28e43e9b4d184027c61663ee2e,12/22(金) 14:55
2023-12-22,22:19,local,地域,28,ABCニュース,【運転再開】湖西線が一時運転見合わせ　堅田駅でサンダーバードと人が接触　２２日,https://news.yahoo.co.jp/articles/89c2811be9704b2bff2d15b8d6d296607ecf4645,12/22(金) 20:14
2023-12-22,22:19,local,地域,29,千葉日報オンライン,【速報】ディズニー爆破予告、浦安市に　京葉線の「快速廃止するJRへ報復」とメール,https://news.yahoo.co.jp/articles/7e0d9b6125251e3d185323c667bdaa9bb0666131,12/22(金) 16:45
2023-12-22,22:19,local,地域,30,群馬テレビ,群馬・渋川市の飲食店が製造のサンドイッチ食べた４６人が食中毒　全員快方に向かう,https://news.yahoo.co.jp/articles/87e2e4fecc3c1934b08905dc588572a88da75fd2,12/22(金) 20:22
2023-12-22,22:19,local,地域,31,上毛新聞,小貫製作所（群馬・太田市）に破産開始決定,https://news.yahoo.co.jp/articles/7296ac7a3a11e46e0df613eee1eb4859427ec7f2,12/22(金) 20:35
2023-12-22,22:19,local,地域,32,NBS長野放送,運転士のとっさの判断　一歩間違えば命に…列車と高齢女性が衝突　直前に急ブレーキ　命に別条なし,https://news.yahoo.co.jp/articles/487d4b0d08b28499606fdc619a48ed2696f26f4d,12/22(金) 20:19
2023-12-22,22:19,local,地域,33,関西テレビ,宝塚歌劇団『組ルール』年明けにも統一へ　元劇団員は「死ね！顔も見たくねーんだよ！と罵倒され続けた」,https://news.yahoo.co.jp/articles/57aa45dd3dac9e35bbea73505a030f633be2cfb0,12/22(金) 17:24
2023-12-22,22:19,local,地域,34,週刊大阪日日新聞,【外から見たニッポン】日本はそんなに住みにくい国なのか？　海外から見た日本のスゴさ,https://news.yahoo.co.jp/articles/7b65bd93afb911cda1f771eecd28414edbeb56be,12/22(金) 15:32
2023-12-22,22:19,local,地域,35,カナロコ by 神奈川新聞,横浜の長津田厚生総合病院、閉院へ　看護職員数水増し、報酬１．８億円を不正請求　保険医療機関指定取り消し,https://news.yahoo.co.jp/articles/9026126b6a1ce0eff981d2a921c6942aae1a0610,12/21(木) 21:20
2023-12-22,22:19,local,地域,36,サンテレビ,「希釈されていると思った」県立病院で医療事故 患者が心筋症に 後遺症なし／兵庫県,https://news.yahoo.co.jp/articles/ca8d7d9c8e5cde14348995af9e8ad7481c50ea9d,12/20(水) 16:52
2023-12-22,22:19,local,地域,37,南日本新聞,28歳でくも膜下出血、7度の手術…回復祈って名付けた「奈々レモン」、職場に復帰すると実をつけた,https://news.yahoo.co.jp/articles/59ea336bc077027eebd01d735af7d37e33172a37,12/22(金) 21:08
2023-12-22,22:19,local,地域,38,Daiichi-TV（静岡第一テレビ）,清水エスパルス・大熊清ＧＭ退任へ…チーム編成主導も今季Ｊ１昇格逃す　後任は「当面の間、空席に」,https://news.yahoo.co.jp/articles/d5b524fe214053e67c4df377f6a814c72352ab71,12/22(金) 16:53
2023-12-22,22:19,local,地域,39,京都新聞,【速報】漁港で沈んだ状態で発見の漁協組合長、死亡を確認,https://news.yahoo.co.jp/articles/514e7caef63bea73d8dc46b569dcef4cba5a2808,12/22(金) 21:32
2023-12-22,22:19,local,地域,40,静岡朝日テレビ,アダルトサイト閲覧していたら…「入金してください」と表示　翌日男から電話があり「サイト登録料」名目で1000万円だまし取られる　静岡・伊豆市,https://news.yahoo.co.jp/articles/bc0b3bb493330d4d569096edf8f8ed2cf84cb7d0,12/22(金) 21:38
