scrp_date,scrp_time,genre_en,genre_jp,rank,media_jp,title,link,date_original
2024-06-16,19:19,local,地域,1,神戸新聞NEXT,電柱が倒れ作業員が死亡　長さ10メートル、撤去作業中　突然根元から倒れ転落　兵庫,https://news.yahoo.co.jp/articles/5cf0f663562ff75beca1e4252adc239ddfeb7912,6/16(日) 14:15
2024-06-16,19:19,local,地域,2,北國新聞社,ウィーン出張中に音楽鑑賞　県土木部次長投稿と投書,https://news.yahoo.co.jp/articles/4bbb739a3debb77e2de3527ba638eb57950b245d,6/15(土) 8:02
2024-06-16,19:19,local,地域,3,MBSニュース,厚さ30センチ必要なのにたった3センチ…現場所長はさじ投げた『空洞だらけのトンネル』不良発覚も隠ぺいし改ざん　調査報告書から見えたトンネル工事の『ずさん』な実態,https://news.yahoo.co.jp/articles/18c300d63190548ea67e1ed4dfb5dae7ec28ab2a,6/16(日) 11:00
2024-06-16,19:19,local,地域,4,千葉日報オンライン,【速報】千葉県の「手首つなぎ」ギネス記録更新ならず　基準60秒に3秒不足　担当者「挑戦できたのは良かった」,https://news.yahoo.co.jp/articles/e20d794b9079ee307032e1f6c62c206883038182,6/16(日) 15:44
2024-06-16,19:19,local,地域,5,千葉日報オンライン,「母乳飲ませる練習しているの？」　夫の言葉に傷ついた…母乳育児に悩む母親たち　＃令和の親,https://news.yahoo.co.jp/articles/08e88fe7d4bd452a3fa9ab3f7fe9f4c2e6fc0e78,6/16(日) 18:00
2024-06-16,19:19,local,地域,6,HBCニュース北海道,掃除のため母親が勝手に部屋に入ったことに腹を立て…40代母親の背中や顔を足蹴りか　15歳の少年を逮捕　札幌市,https://news.yahoo.co.jp/articles/573f36e11f75c60b4e769bef77baf1fcefa45a1e,6/16(日) 9:59
2024-06-16,19:19,local,地域,7,埼玉新聞,異変…駅周辺にいた警官、ふと気になった男に職質　詐欺発覚し逮捕、住所不詳の25歳　「滞納している」と電話あり、だまされていた男性…寸前で救われる,https://news.yahoo.co.jp/articles/20b40160f1da146ccfe5504fb85e2824be23572f,6/16(日) 18:22
2024-06-16,19:19,local,地域,8,千葉日報オンライン,熊谷知事「つくづく申し訳ない」と陳謝　「手首つなぎ」ギネス世界記録ならず　「厳格に審査することが痛いほど分かった」,https://news.yahoo.co.jp/articles/767f14ae2149b9dc86b1a2bb0c6569b5c8a2f49f,6/16(日) 17:41
2024-06-16,19:19,local,地域,9,埼玉新聞,だまされかけた母、タクシーに乗る…“息子”に現金を届けるため　行き先を何度も変更する母…タクシー事務所で配車係の女性、異変に気付く　通報し詐欺阻止、感謝されるも「普通のことをしただけ」と話し称賛,https://news.yahoo.co.jp/articles/fac3fa7dff0716e2eaa5671bf9370ab82012cf7e,6/16(日) 16:05
2024-06-16,19:19,local,地域,10,MBSニュース,【斎藤知事】入り口20m手前で車降ろされ職員を『怒鳴り散らす』パワハラ告発文めぐり「百条委員会」専門家は「設置前に沈静化する方法はなかったのか」,https://news.yahoo.co.jp/articles/4e1f7026ca835c51015c4f4b8e5790d1df06e6a3,6/15(土) 9:01
2024-06-16,19:19,local,地域,11,琉球新報,【速報】濃霧で那覇空港に着陸できず　発着の6便が欠航　11便が目的地変更　沖縄（16日午後1時半）,https://news.yahoo.co.jp/articles/03ad42bad6c57d12b84b3372c385183abcf95ffa,6/16(日) 14:11
2024-06-16,19:19,local,地域,12,RCC中国放送,起訴後に勾留中の男（44）警察署の留置施設で警察官の腕を蹴ったか　公務執行妨害の疑いで現行犯逮捕　広島,https://news.yahoo.co.jp/articles/b1d7df19046a445a03bbeee781ac5c2f90bb17dc,6/16(日) 17:27
2024-06-16,19:19,local,地域,13,あなたの静岡新聞,中学生、陸橋から落下か　複数車両と衝突、現場で死亡確認　富士宮・西富士道路,https://news.yahoo.co.jp/articles/e8e107e69bf8e1f76efee1f66d4fa56e9ed9ee06,6/15(土) 21:54
2024-06-16,19:19,local,地域,14,静岡放送（SBS）,「男2人がもめている」コンビニで別の客を殴った疑い　自称・無職の男逮捕=静岡県警,https://news.yahoo.co.jp/articles/a7bfe398b0b65a63b2c9c2881b300f3c1ce50949,6/16(日) 17:12
2024-06-16,19:19,local,地域,15,OBS大分放送,同居していた2歳の女児の顔を圧迫して死亡させた疑い　大分県宇佐市の25歳の男を送検,https://news.yahoo.co.jp/articles/e782c9c17cc06f738bb4216d3d2cab26a4900924,6/16(日) 18:14
2024-06-16,19:19,local,地域,16,HTB北海道ニュース,「高校生に謝らせた」「その後、帰って行った」容疑者が友人にメッセージ　犯行隠そうとしたか　旭川殺人,https://news.yahoo.co.jp/articles/27e3f1cb5cad6be71e3a2829a7d32ee0ea0b5ee4,6/16(日) 15:39
2024-06-16,19:19,local,地域,17,カナロコ by 神奈川新聞,神奈川県内、１８日は大雨の恐れ　東京湾側は高波にも注意,https://news.yahoo.co.jp/articles/6a6f50d8bc13208df0b50561e2ba0a6dafdadbfb,6/16(日) 18:50
2024-06-16,19:19,local,地域,18,静岡朝日テレビ,静岡県御殿場市の畑でクマの目撃情報　体長１メートルほど やぶに逃げ込む　警察が警戒呼びかけ,https://news.yahoo.co.jp/articles/1bdf75038ce2d06c8d82fdc11271c6f532c1d966,6/16(日) 18:13
2024-06-16,19:19,local,地域,19,HBCニュース北海道,速報　「建物が燃えている」と119番通報　解体業者の２階建ての建物から出火　消防車５台が出て消火活動　けが人なし　北海道北見市,https://news.yahoo.co.jp/articles/2618552db57f31c6513563ff280a32b77468e83f,6/16(日) 16:05
2024-06-16,19:19,local,地域,20,チューリップテレビ,15歳少女が刃体18センチの包丁所持　富山市内の駐車場で現行犯逮捕　行方不明の届け出,https://news.yahoo.co.jp/articles/6f239b258ea17bdcfca594f46d8acf043d32ca49,6/16(日) 14:22
2024-06-16,19:19,local,地域,21,埼玉新聞,女子大生にわいせつ行為、夜の住宅街で…自転車の男逮捕、追い抜きざまに触っていた　女子大生は10代、帰宅中の恐怖　その後、男は警察署に自首…住所不定の無職38歳,https://news.yahoo.co.jp/articles/590df96fd8244a805fd6f413c2cc208ff2b363e8,6/16(日) 14:03
2024-06-16,19:19,local,地域,22,HBCニュース北海道,女子高生が着ていた衣類、川に落とされた現場の橋付近で発見か…証拠隠滅などの可能性含め捜査、ＳＮＳでトラブルの内田梨瑚容疑者「呼び出して謝罪を求めたが、失礼な態度を取られた。防犯カメラないこと知っていた」などほのめかす　北海道旭川市,https://news.yahoo.co.jp/articles/4101fd712b6aba4fb763ae04497731b17c78e946,6/15(土) 11:36
2024-06-16,19:19,local,地域,23,テレビ新広島,サンフレ川村拓夢選手が海外移籍へ チーム離脱に感極まる,https://news.yahoo.co.jp/articles/5b849a1e522062474a02192c7eea407e06526b30,6/16(日) 12:34
2024-06-16,19:19,local,地域,24,HBCニュース北海道,「いわゆる“問題児”みたいな扱い」旭川女子高校生殺害、高校の後輩らが語る内田梨瑚容疑者の人物像　逃げようとした被害者に暴行も,https://news.yahoo.co.jp/articles/2a29399ce9e0c0e58e26594c7b2e96cc2e670cdc,6/13(木) 19:29
2024-06-16,19:19,local,地域,25,福島中央テレビ,【ツーリングしていたか】南会津町の国道でバイク2台が絡む事故　2人が重軽傷・福島,https://news.yahoo.co.jp/articles/915c75600c38a8bee9a81e5fe22a918b09dd7802,6/16(日) 18:16
2024-06-16,19:19,local,地域,26,MRO北陸放送,覆いかぶさって守った生後9日の我が子…赤ちゃんの防災どうする? “ミルク”に“おむつ”に…能登半島地震から学ぶ災害時の対処法,https://news.yahoo.co.jp/articles/1d393908fc1e9a33c6db5281a8f2551360f56bd2,6/16(日) 12:12
2024-06-16,19:19,local,地域,27,神戸新聞NEXT,「おい、殺すぞ」損保会社オペレーターに怒号　事故の担当者に代わるよう執拗に要求、47歳男を逮捕,https://news.yahoo.co.jp/articles/eb021dcebbd88f7f147a00df68dc672d34790300,6/14(金) 10:00
2024-06-16,19:19,local,地域,28,あなたの静岡新聞,シカ用わなにクマ1頭、住民発見「出る地域ではないので驚いた」　富士宮・白糸ノ滝付近、近くに民家も,https://news.yahoo.co.jp/articles/43adbc2e315f1c8e1085ea813aa4aa1cb3550a40,6/16(日) 10:54
2024-06-16,19:19,local,地域,29,中京テレビＮＥＷＳ,長良川で水難事故　パキスタン国籍の男性（30）が溺れて死亡　岐阜・美濃市,https://news.yahoo.co.jp/articles/d7302daf937e761add7b12beb67c5e52a63af2a4,6/16(日) 17:04
2024-06-16,19:19,local,地域,30,YBS山梨放送,シャトレーゼに転籍した外国人 80人以上が2か月半働けず 山梨県,https://news.yahoo.co.jp/articles/599ca3a70af04236dd261d57b0da214af9a04674,6/14(金) 20:19
2024-06-16,19:19,local,地域,31,ＳＢＣ信越放送,「部員ゼロ」で存続の危機…7人で再出発した高校野球部、必死の勧誘に応えた野球未経験のドラマーら4人を得てようやく叶ったチーム作り…11人で甲子園目指す熱い夏,https://news.yahoo.co.jp/articles/fad360bcb505df389736da3f4f24d3dcaf48570c,6/16(日) 14:02
2024-06-16,19:19,local,地域,32,RCC中国放送,軽トラック盗んだ疑いで自称農業の男（30）逮捕　乗っていた男を見つけ警察が職務質問　広島,https://news.yahoo.co.jp/articles/6a091ab96b1db600975a0c9693372c3e7aecae1e,6/16(日) 14:12
2024-06-16,19:19,local,地域,33,福井新聞ＯＮＬＩＮＥ,北陸新幹線小浜・京都ルート「速く、乗り換えなく、運賃安い」　福井県、建設促進同盟会が意義強調,https://news.yahoo.co.jp/articles/585463ef29f0218b510227e23d67ce78bb44a2a4,6/16(日) 18:36
2024-06-16,19:19,local,地域,34,神戸新聞NEXT,家族4人で須磨シーワールドの帰り道、無免許運転で男逮捕　妻のシートベルト非着用で発覚,https://news.yahoo.co.jp/articles/1b8e5e3ed4a9705f84649432e15dd9642bfa0167,6/12(水) 23:23
2024-06-16,19:19,local,地域,35,九州朝日放送,”信号無視繰り返す”男を逮捕　「飲酒で逃げた」,https://news.yahoo.co.jp/articles/9e653f8e1d78bcf19f015e790730665452966df1,6/16(日) 18:45
2024-06-16,19:19,local,地域,36,ABCニュース,撤去作業中の電柱折れる　登って作業していた３０代男性死亡　兵庫・市川町のスーパー跡地,https://news.yahoo.co.jp/articles/2dac420b462234947f73c6af9d4d83ceffd45f9d,6/16(日) 14:29
2024-06-16,19:19,local,地域,37,ＢＳＮ新潟放送,西日本～北日本の広い範囲で大気の状態が非常に不安定　落雷や竜巻などの激しい突風、局地的な強い雨に注意　17日（月）朝までの各地の天気と雨のシミュレーション,https://news.yahoo.co.jp/articles/ee0267029722bb73a9322cc98520fdaccab81451,6/16(日) 17:36
2024-06-16,19:19,local,地域,38,tbc東北放送,【速報】楽天イーグルスが交流戦優勝!球団創設20年で初　ソフトバンクが阪神に敗れる【プロ野球セパ交流戦】,https://news.yahoo.co.jp/articles/9a04cce4383b7ab2c5bac2be457b8fc6d501efc6,6/16(日) 16:48
2024-06-16,19:19,local,地域,39,BSS山陰放送,珍事　謎の深海魚「リュウグウノツカイ」また生きた状態で捕まる…2週連続2匹目　ほぼ完全に近い綺麗な個体　今度は河口で,https://news.yahoo.co.jp/articles/3abe794d263fd8cd8124df30d6e2d12dd16692ed,6/15(土) 16:26
2024-06-16,19:19,local,地域,40,OHK岡山放送,【注意】山陽自動車道　あす（６月１７日）から一部区間夜間通行止め　舗装補修工事のため【岡山】,https://news.yahoo.co.jp/articles/3be3f1f6ad592ab48cb545d125994f5aefe1fe01,6/16(日) 16:28
