scrp_date,scrp_time,genre_en,genre_jp,rank,media_jp,title,link,date_original
2024-06-16,21:33,sports,スポーツ,1,TBS NEWS DIG Powered by JNN,眞鍋ジャパン、東京五輪金のアメリカにストレート負け...世界ランク“5位入り”消滅、通算8勝4敗でファイナルRへ,https://news.yahoo.co.jp/articles/b0e4f1c6d713c67a4342c07451fd4e77f54f6844,6/16(日) 20:07
2024-06-16,21:33,sports,スポーツ,2,スポニチアネックス,交流戦　パ・リーグが2年連続16度目の勝ち越し決める　楽天は球団創設20年目で初優勝,https://news.yahoo.co.jp/articles/da6d23e0052691721d054ab20104cf86269a6542,6/16(日) 18:02
2024-06-16,21:33,sports,スポーツ,3,デイリースポーツ,阪神　死球で左肩甲骨骨折の木浪　仲間に事実を打ち明けず離脱「自分のことに集中してほしい」同僚にも相手にも見せた気遣い,https://news.yahoo.co.jp/articles/d3a73e9a3ec38041029e449c1e45d23b3c498f3d,6/16(日) 17:49
2024-06-16,21:33,sports,スポーツ,4,TBS NEWS DIG Powered by JNN,【楽天】交流戦初優勝 球団創立20年目 史上8球団目 今江監督は就任1年目で快挙！同率決戦で広島に勝利 ソフトバンクが阪神に敗戦,https://news.yahoo.co.jp/articles/7f678f146dcfd568a2af673b984bf6bb264c492e,6/16(日) 16:46
2024-06-16,21:33,sports,スポーツ,5,中日スポーツ,ドジャース・ロバーツ監督、山本由伸めぐり問われた管理責任 試合後会見８分、腕の張り報告「驚いた」,https://news.yahoo.co.jp/articles/cb34e7c941d5a448df9469c62263cce3897634fe,6/16(日) 15:51
2024-06-16,21:33,sports,スポーツ,6,スポーツ報知,【阪神】岡田彰布監督、プロ初満弾の前川右京に「今がレギュラーポジションを取る、そういう過程」…一問一答,https://news.yahoo.co.jp/articles/d42b24bf0014a01a30e1d83f35d85a466dfdcdf3,6/16(日) 17:48
2024-06-16,21:33,sports,スポーツ,7,Full-Count,“12球団最高”の6.0…広島25歳は「GG賞確定ですね」　衝撃の跳躍力「ホント忍者」,https://news.yahoo.co.jp/articles/1ca023bef3578ef23a789ab9197d8e73253f4d99,6/16(日) 18:14
2024-06-16,21:33,sports,スポーツ,8,4years.,日本選手権で女子400mハードル4連覇へ、400mで得た手応えをぶつける　立命館大・山本亜美「55秒台を出したい」,https://news.yahoo.co.jp/articles/2e1262a5e880a5f4d52217f588a624c394eebdb6,6/16(日) 18:30
2024-06-16,21:33,sports,スポーツ,9,ABEMA TIMES,「ショーヘイさんが何か話した」一体、何が…山本由伸が緊急降板でベンチ内が騒然 川崎宗則氏が指摘したカメラが捉えた気になる瞬間,https://news.yahoo.co.jp/articles/99e41aa8a2d0edec90ea97b73242a21ed519c751,6/16(日) 11:39
2024-06-16,21:33,sports,スポーツ,10,東スポWEB,大谷翔平所属のドジャース　日本テレビとフジテレビのメディア資格はく奪「スーパースターを危険にさらす」,https://news.yahoo.co.jp/articles/e592623e8dfe7b887673cb10aab08e7ad142ba5d,6/16(日) 18:16
2024-06-16,21:33,sports,スポーツ,11,デイリースポーツ,阪神・岡田監督　満塁弾の前川に「やっぱ大きいよなあ。満塁いうたらな」小久保監督からまさかの一撃に「ふふっ」【一問一答】,https://news.yahoo.co.jp/articles/616fd858e9e36b41bae554cc4447e76a6adfddaa,6/16(日) 17:40
2024-06-16,21:33,sports,スポーツ,12,中日スポーツ,「今永昇太は全くすごいの一言」米解説者はうなりっぱなし「クレージーだ。14試合に先発しているのに、3失点以上が1試合しかない」,https://news.yahoo.co.jp/articles/6794dc4edccfd1dc5903a7900447eb89559d944c,6/16(日) 15:52
2024-06-16,21:33,sports,スポーツ,13,共同通信,ルマン、トヨタ8号車が2番手に　日本時間午後11時にゴール,https://news.yahoo.co.jp/articles/53b9f518fc5b56815060e3ad4057a90787c9f042,6/16(日) 17:51
2024-06-16,21:33,sports,スポーツ,14,中日スポーツ,中日・立浪監督、「我慢して使っているけど変わってこないと」岡林に代打「いろんな壁にぶつかっているので、考えていきたい」,https://news.yahoo.co.jp/articles/2b94cc9a123ebb50587f5c0bc4984961c7175857,6/16(日) 19:18
2024-06-16,21:33,sports,スポーツ,15,Full-Count,練習中に救急車で緊急搬送　押しつぶされた監督の責務…医師が告げた「ストレスですね」,https://news.yahoo.co.jp/articles/b561f61cecf89ec4566424d03efb4e960e536ebc,6/16(日) 6:50
2024-06-16,21:33,sports,スポーツ,16,Full-Count,スカートでキラキラ笑顔…元エースチアの一投に台湾熱狂　ストライク投球に大歓声,https://news.yahoo.co.jp/articles/555eff013bf9a445d949da400353fff57f19b800,6/16(日) 19:11
2024-06-16,21:33,sports,スポーツ,17,Full-Count,由伸の異変が一目瞭然…指揮官も隠せなかった動揺　渡米後初の“95未満”を米指摘,https://news.yahoo.co.jp/articles/47e987070ca44de21794bf28dfcf6bce191ee2f4,6/16(日) 18:46
2024-06-16,21:33,sports,スポーツ,18,スポーツ報知,【巨人】高梨雄平が好リリーフもチャック全開投法！？「今日のネタにしておいて」　「今日は優志が頑張った」,https://news.yahoo.co.jp/articles/e33108db2a68a851ad1613b2bd917ef719476567,6/16(日) 20:25
2024-06-16,21:33,sports,スポーツ,19,Full-Count,引退から22年も「フォームが現役のまま」　衰えぬ最多勝左腕…54歳が「若々しい」,https://news.yahoo.co.jp/articles/294dc217eae3fa8b1fa3b706d0f7e8dd46d5cc7f,6/16(日) 10:19
2024-06-16,21:33,sports,スポーツ,20,デイリースポーツ,日本ハム・新庄監督「もう大丈夫」田中正義守護神復帰へ完璧投球「今は僕は正念場というか、野球人生がかかっている」,https://news.yahoo.co.jp/articles/618592b4f6783f347b4cd110d54ae0f81d94dbdf,6/16(日) 20:25
2024-06-16,21:33,sports,スポーツ,21,スポーツ報知,【巨人】エスコンフィールド球場スタッフ一同から巨人ファンへ粋なメッセージが大型ビジョンに,https://news.yahoo.co.jp/articles/1d7f4890eb4088f6e637155d2b558e9e5dc02ad5,6/16(日) 20:48
2024-06-16,21:33,sports,スポーツ,22,Full-Count,プロ2試合目なのに…衝撃快挙に「こりゃ本物」　22歳の無双投球が「控えめに言って神」,https://news.yahoo.co.jp/articles/6a2d248cd46eab675c6766cc2a9c5eb26a4c6623,6/16(日) 19:19
2024-06-16,21:33,sports,スポーツ,23,中日スポーツ,糖尿病の影響で右腕切断・佐野慈紀さん、所属事務所が支援のクラウドファンディング立ち上げへ,https://news.yahoo.co.jp/articles/3c6fe372df70a52a6eeee30436a8ed2bfd6ab6d1,6/16(日) 18:50
2024-06-16,21:33,sports,スポーツ,24,東スポWEB,【Ｆ１】去就注目の〝天才デザイナー〟ニューウェイ氏が総額１６４億円で契約締結と英専門誌報道,https://news.yahoo.co.jp/articles/883f997deb704a7f4c422470f4eccc180b866bd9,6/16(日) 16:26
2024-06-16,21:33,sports,スポーツ,25,西スポWEB OTTO！,試合前に異例の「気合を入れろ、ライオンズ」も…西武がDeNA新人に〝マダックス〟許す　交流戦最下位に渡辺監督代行「いろいろ考えなくちゃいけない」,https://news.yahoo.co.jp/articles/4a926d24f6374bf9720590fff5d0b41d6711d71e,6/16(日) 17:54
2024-06-16,21:33,sports,スポーツ,26,スポニチアネックス,日本ハム・エスコンフィールドの巨人ファンへのメッセージが話題　「これはまた行きたくなるね」,https://news.yahoo.co.jp/articles/f53962eb6de3c5c170b0f8a280fd6c4ab9954fcd,6/16(日) 18:42
2024-06-16,21:33,sports,スポーツ,27,ABEMA TIMES,ヤマモトが…！？ ロバーツ監督、山本由伸の異変を告げられベンチ裏へ急行 驚きと心配のリアクションを見せた瞬間,https://news.yahoo.co.jp/articles/219cb2a069dde87c81395438c4bfc7493c02b4f2,6/16(日) 19:42
2024-06-16,21:33,sports,スポーツ,28,デイリースポーツ,阪神２軍は四国ＩＬｐ・徳島との交流試合にサヨナラ負け　椎葉が古巣に逆転３ラン被弾　和田２軍監督「今日の結果をどう生かしていくか」,https://news.yahoo.co.jp/articles/3b6dda082b1619176cf58ddc01fcf1982e7bcde5,6/16(日) 20:26
2024-06-16,21:33,sports,スポーツ,29,Full-Count,広島1年で退団→韓国で“HR王”　元助っ人は「もう1年見るべきやった」「神神神」,https://news.yahoo.co.jp/articles/9afc80e5ff2182bc0321e9399877af696ae4ee8c,6/16(日) 14:56
2024-06-16,21:33,sports,スポーツ,30,デイリースポーツ,阪神　初回の２死球で敵地の阪神ファンが騒然　渡辺にも危険な１球　前日に木浪が死球を受けて骨折　不穏な空気に,https://news.yahoo.co.jp/articles/645be18dfb776cb113971d6bc6a7940b60a36418,6/16(日) 14:23
2024-06-16,21:33,sports,スポーツ,31,ベースボールキング,里崎智也氏「タイミングも完璧アウト」、「もったいない」巨人・岸田が走塁ミス…直後にヘルナンデスが同点弾,https://news.yahoo.co.jp/articles/fc6cd2c81ba47b593194d3aae93acbfeadcdf1af,6/16(日) 18:18
2024-06-16,21:33,sports,スポーツ,32,イーファイト,わずか11秒！一撃KOパンチで相手は硬直失神、ノートンが団体最速記録で新女王に=米MMA,https://news.yahoo.co.jp/articles/0ff73b815c6b951dec2a33313198b9bdcd852c08,6/16(日) 18:55
2024-06-16,21:33,sports,スポーツ,33,東スポWEB,【スターダム】Ｓ・キッド　謎のマスクウーマン登場で胸中大揺れ「そろそろ決めないとね」,https://news.yahoo.co.jp/articles/80493a8028a5eac52c61a4343356cb357ea340cd,6/16(日) 20:21
2024-06-16,21:33,sports,スポーツ,34,ゴング格闘技,【訃報】鬼木貴典レフェリーが死去。朝倉海、DEEP佐伯繁代表ら多くの関係者が追悼メッセージ,https://news.yahoo.co.jp/articles/97c57e5c2541d4d7e3b6ddc3f01875f456b32235,6/16(日) 13:24
2024-06-16,21:33,sports,スポーツ,35,スポーツ報知,バレー日本女子、東京五輪金の米国と対戦　３○０で世界５位に浮上も…今夜ネーションズリーグ福岡大会最終戦,https://news.yahoo.co.jp/articles/ae6842efd357205e13d7bef8abc829b402f8b331,6/16(日) 15:12
2024-06-16,21:33,sports,スポーツ,36,Full-Count,虎逸材は「まだ21歳ってマジ？」　レジェンド彷彿…衝撃の“171”が示した才能,https://news.yahoo.co.jp/articles/eb00c720a50cffbd2b0d295a0badf052d2c91749,6/16(日) 15:24
2024-06-16,21:33,sports,スポーツ,37,スポーツ報知,中村敬斗　女性ファンの多さに「びっくりしました」…スキンケアブランドの都内イベントで,https://news.yahoo.co.jp/articles/d46e2a510782b76c95581049d3bb816a98388ac3,6/16(日) 16:33
2024-06-16,21:33,sports,スポーツ,38,DAZN News,BASEBALL ZONEで落合博満氏が語った選手の好き嫌い「性格的に嫌いだからって嫌っていたら話にならない」｜ プロ野球,https://news.yahoo.co.jp/articles/be1afb4ccbb2b249ccdf289bc0f0c672549b22d7,6/16(日) 19:14
2024-06-16,21:33,sports,スポーツ,39,スポニチアネックス,高橋慶彦氏「これから仲良くなれたような…」　命日から1年　バチバチだった北別府学さんへの喪失感明かす,https://news.yahoo.co.jp/articles/d3aa4355d3934e0b5d0224fc4540007c35ea4bf5,6/16(日) 18:10
2024-06-16,21:33,sports,スポーツ,40,東スポ競馬,【マーメイドＳ・１番人気の敗因】「勝った人馬を褒めるしかないですね」２着エーデルブルーメ＝川田も永島の手綱さばきに脱帽,https://news.yahoo.co.jp/articles/d72a4d8c3ff882715a877bc78bd04fadc59b0ba3,6/16(日) 17:37
