scrp_date,scrp_time,genre_en,genre_jp,rank,media_jp,title,link,date_original
2024-06-17,06:19,sports,スポーツ,1,東スポWEB,大谷翔平所属のドジャース　日本テレビとフジテレビのメディア資格はく奪「スーパースターを危険にさらす」＝現地報道,https://news.yahoo.co.jp/articles/e592623e8dfe7b887673cb10aab08e7ad142ba5d,6/16(日) 18:16
2024-06-17,06:19,sports,スポーツ,2,ABEMA TIMES,"えっ？あの最終走者は何者！？ミニスカ“爆速チア""がダッシュマンに圧勝　チアランナーの足が速すぎると話題「加速してからの伸びえっぐ」「末脚すこw」",https://news.yahoo.co.jp/articles/71d929be95640993a56c23769a3d585f0a787b05,6/16(日) 21:57
2024-06-17,06:19,sports,スポーツ,3,TBS NEWS DIG Powered by JNN,パリ五輪、女子バレー出場12チーム出揃う ! 日本は世界ランク7位、アジア最上位で中国、19日に1次リーグ抽選会,https://news.yahoo.co.jp/articles/d935d55d8a4e4bdb8abdb00e0eeb4abd594034c8,6/16(日) 23:42
2024-06-17,06:19,sports,スポーツ,4,motorsport.com 日本版,ル・マン24時間レース決勝速報｜フェラーリ、逃げ切り2連覇達成！　トヨタとの近年稀に見る大接戦を制す,https://news.yahoo.co.jp/articles/6143223cd13094e2d5c54bdcdb7541de550c9c02,6/16(日) 23:06
2024-06-17,06:19,sports,スポーツ,5,中日スポーツ,名古屋グランパス、猛抗議「審判にボール当たっていたならノーゴールでは」主審らに詰め寄り試合4分近く中断,https://news.yahoo.co.jp/articles/2289bcf9a93fe6c79f9e429412d8c8a0b90ddd77,6/16(日) 22:39
2024-06-17,06:19,sports,スポーツ,6,日刊スポーツ,ザギトワ、肩出し黒ドレスに裸足でクルーズ船「超美人」「何てステキな写真とビデオ」SNS沸騰,https://news.yahoo.co.jp/articles/b7aefafdd34e333866a6488a3179c07331c9327c,6/16(日) 23:09
2024-06-17,06:19,sports,スポーツ,7,Full-Count,練習中に救急車で緊急搬送　押しつぶされた監督の責務…医師が告げた「ストレスですね」,https://news.yahoo.co.jp/articles/b561f61cecf89ec4566424d03efb4e960e536ebc,6/16(日) 6:50
2024-06-17,06:19,sports,スポーツ,8,東スポWEB,【Ｆ１】角田裕毅 2026年にレッドブル昇格も…ホーナー代表〝翻意〟「オプションとして入れたい」,https://news.yahoo.co.jp/articles/af55809c0153c1e58d0a8ecabd205094876f3384,6/17(月) 5:16
2024-06-17,06:19,sports,スポーツ,9,デイリースポーツ,大谷翔平と父の貴重写真　ＭＬＢ公式が投稿　海外ファンも「そっくりすぎる」「まんまパパ」続々反応,https://news.yahoo.co.jp/articles/59ed532f26c907c0ed58c0f32ef3ac01c59d4a80,6/17(月) 0:09
2024-06-17,06:19,sports,スポーツ,10,西スポWEB OTTO！,UFC6連勝の平良達郎に称賛の嵐「日本の悲願を叶えてくれ」「日本人初王者は朝倉海でも堀口でもなく平良だ！」「鳥肌立った」「強さと可愛さのギャップよ」,https://news.yahoo.co.jp/articles/f42eb86e351ece226fd6cdcd9de0f1391d018a0f,6/16(日) 22:30
2024-06-17,06:19,sports,スポーツ,11,日刊スポーツ,【バレー】女子日本は20日に中国戦、ブラジル－開催国タイほか　VNLファイナルＲ組み合わせ,https://news.yahoo.co.jp/articles/ff3047007b8b23626ba32b033d46fc73182a56ed,6/17(月) 1:02
2024-06-17,06:19,sports,スポーツ,12,スポニチアネックス,渋野日向子　後半「ドタバタ」崩れた73…33位後退,https://news.yahoo.co.jp/articles/15e0dd53db07936f69daf82dc3cb32c1b49dc790,6/17(月) 4:00
2024-06-17,06:19,sports,スポーツ,13,東スポWEB,【西武】テコ入れも手詰まりでＯＢから〝爆弾プラン〟　元優良助っ人・メヒアの電撃復帰案浮上,https://news.yahoo.co.jp/articles/5f120943e647f87b8f961b1eec24219d5502a8d7,6/17(月) 5:16
2024-06-17,06:19,sports,スポーツ,14,FITNESS LOVE,ハリのある肉体で魅せた29歳・看護師　コンテストで活躍,https://news.yahoo.co.jp/articles/3b3c652c76d92b27c0288b37e38a1abd899397f0,6/17(月) 5:00
2024-06-17,06:19,sports,スポーツ,15,スポニチアネックス,交流戦　パ・リーグが2年連続16度目の勝ち越し決める　楽天は球団創設20年目で初優勝,https://news.yahoo.co.jp/articles/da6d23e0052691721d054ab20104cf86269a6542,6/16(日) 18:02
2024-06-17,06:19,sports,スポーツ,16,日刊スポーツ,【バレー】古賀紗理那、米国に「差を感じた」６度「チグハグ」…でも「楽しく過ごせた」,https://news.yahoo.co.jp/articles/c2b84a8fd8de6194c49bef345ed044b197edef94,6/16(日) 21:45
2024-06-17,06:19,sports,スポーツ,17,TBS NEWS DIG Powered by JNN,【楽天】交流戦初優勝 球団創立20年目 史上8球団目 今江監督は就任1年目で快挙！同率決戦で広島に勝利 ソフトバンクが阪神に敗戦,https://news.yahoo.co.jp/articles/7f678f146dcfd568a2af673b984bf6bb264c492e,6/16(日) 16:46
2024-06-17,06:19,sports,スポーツ,18,GOAL,ドイツ代表に急遽招集されたエムレ・ジャン「2日前までバケーションでビーチにいた。すると連絡が来て、1回だけ練習して、それでゴールさ」,https://news.yahoo.co.jp/articles/2d25cbe238a1514cf4ef529764c4d017fde2dcba,6/16(日) 23:14
2024-06-17,06:19,sports,スポーツ,19,競馬ラボ,【宝塚記念】出走馬格付けバトル！ドウデュースを抑えて総合1位に輝いた軸馬候補,https://news.yahoo.co.jp/articles/3b3a268fcf614a6a068bb9eb4122c6f285742a1b,6/16(日) 21:01
2024-06-17,06:19,sports,スポーツ,20,東スポWEB,有吉弘行　パッキャオのＲＩＺＩＮ参戦に複雑「現役の選手がどう思うかだよ」,https://news.yahoo.co.jp/articles/8e7f89c9e6ebef383ec09a7e28e8b974833bec74,6/16(日) 21:11
2024-06-17,06:19,sports,スポーツ,21,Full-Count,引退から22年も「フォームが現役のまま」　衰えぬ最多勝左腕…54歳が「若々しい」,https://news.yahoo.co.jp/articles/294dc217eae3fa8b1fa3b706d0f7e8dd46d5cc7f,6/16(日) 10:19
2024-06-17,06:19,sports,スポーツ,22,motorsport.com 日本版,あと1歩届かなかった……トヨタ小林可夢偉、前途多難のル・マン24時間レース惜敗に「めちゃめちゃ悔しい」,https://news.yahoo.co.jp/articles/5bb306897e2b6eb637b46a4c28d26e7f1e4ad060,6/17(月) 0:31
2024-06-17,06:19,sports,スポーツ,23,スポーツ報知,【巨人】エスコンフィールド球場スタッフ一同から巨人ファンへ粋なメッセージが大型ビジョンに,https://news.yahoo.co.jp/articles/1d7f4890eb4088f6e637155d2b558e9e5dc02ad5,6/16(日) 20:48
2024-06-17,06:19,sports,スポーツ,24,スポーツ報知,日本代表森保一監督、日本に危機感　欧州選手権視察予定「彼らより早く成長、進化しないと置いていかれる」,https://news.yahoo.co.jp/articles/f8a8936434bccd1a47ed51d727d3fa1c93d0fc51,6/16(日) 22:28
2024-06-17,06:19,sports,スポーツ,25,スポーツ報知,ドジャースに激震　山本由伸＆緊急降板の救援右腕がそろってＩＬ入り　地区首位独走も故障者続出,https://news.yahoo.co.jp/articles/08243b129c3732c340433823d02f229f431d3c8a,6/17(月) 4:43
2024-06-17,06:19,sports,スポーツ,26,東スポWEB,【巨人】笑顔弾けたキャンプから一転…　阿部監督〝能面采配〟の真相,https://news.yahoo.co.jp/articles/60d4413a97f9edc2d7a887f0bd8a9e38d4f37c2e,6/17(月) 5:16
2024-06-17,06:19,sports,スポーツ,27,デイリースポーツ,日本ハム・新庄監督「もう大丈夫」田中正義守護神復帰へ完璧投球「今は僕は正念場というか、野球人生がかかっている」,https://news.yahoo.co.jp/articles/618592b4f6783f347b4cd110d54ae0f81d94dbdf,6/16(日) 20:25
2024-06-17,06:19,sports,スポーツ,28,Full-Count,わずか52本で衝撃の「11」制覇　24歳が超速達成…菅野粉砕の一撃が「凄すぎる」,https://news.yahoo.co.jp/articles/8d7bc1c9cc08262ef4397c961a21106bd3ec2203,6/16(日) 20:41
2024-06-17,06:19,sports,スポーツ,29,デイリースポーツ,大谷翔平、4戦ぶり18号先制ソロ　飛距離137メートル　由伸離脱ショックはねのける豪快アーチ　同僚テオスカー抜いてリーグ単独2位浮上　直近11戦4発　トップと2差,https://news.yahoo.co.jp/articles/cc5b4cd3ce311822a262d63e6b9736d1e72119c4,6/17(月) 5:47
2024-06-17,06:19,sports,スポーツ,30,日刊スポーツ,佐久間朱莉が号泣…目を真っ赤にし「悔しい」またも初優勝に届かず　師匠尾崎将司への報告お預け,https://news.yahoo.co.jp/articles/f915940513ea84d9b827b93112d88ebc197aef34,6/16(日) 21:21
2024-06-17,06:19,sports,スポーツ,31,ABEMA TIMES,ヤマモトが…！？ ロバーツ監督、山本由伸の異変を告げられベンチ裏へ急行 驚きと心配のリアクションを見せた瞬間,https://news.yahoo.co.jp/articles/219cb2a069dde87c81395438c4bfc7493c02b4f2,6/16(日) 19:42
2024-06-17,06:19,sports,スポーツ,32,TBS NEWS DIG Powered by JNN,眞鍋ジャパン、東京五輪金のアメリカにストレート負け...世界ランク“5位入り”消滅、通算8勝4敗でファイナルRへ,https://news.yahoo.co.jp/articles/b0e4f1c6d713c67a4342c07451fd4e77f54f6844,6/16(日) 20:07
2024-06-17,06:19,sports,スポーツ,33,スポーツ報知,滑りやすいボール、硬いマウンド、国内時差などから自然に力み日本人投手は米１年目に故障多い,https://news.yahoo.co.jp/articles/983bca472da20d7086dd893d35c530ddedf95d9d,6/17(月) 2:05
2024-06-17,06:19,sports,スポーツ,34,theWORLD（ザ・ワールドWeb）,GKから繋ぐことにこだわる必要はあるのか　ルーニーが語る育成年代の異変「組み立てようとして失敗し、ゴールを許してしまう」,https://news.yahoo.co.jp/articles/7b4553d4347e40028b255746d2b6def6f19c678b,6/17(月) 0:30
2024-06-17,06:19,sports,スポーツ,35,日刊スポーツ,【中日】最下位転落で交流戦終了「先発立て直していかないと」立浪監督ローテ再編示唆／一問一答,https://news.yahoo.co.jp/articles/38afc46e1be8abd3ab065126cefde1a5640522c8,6/16(日) 20:43
2024-06-17,06:19,sports,スポーツ,36,スポーツ報知,村田真一氏、浅村を一時外した楽天・今江監督はすごい決断力「復調するならシーズンもまだ分からんよ」,https://news.yahoo.co.jp/articles/6704e94b38c4fd4891b8bbba93fc354437f32ebd,6/17(月) 5:15
2024-06-17,06:19,sports,スポーツ,37,スポニチアネックス,大谷翔平が4試合ぶり18号先制ソロ　リーグトップに2本差　「父の日」に「徹の息子」が豪快アーチ,https://news.yahoo.co.jp/articles/e43ec43b678f0b87abc82d2895f301430d446a4c,6/17(月) 5:48
2024-06-17,06:19,sports,スポーツ,38,ABEMA TIMES,大谷翔平、4試合ぶり18号！特大137メートル弾でリーグトップに2本差、年間約40発ペースに,https://news.yahoo.co.jp/articles/f87404f8359a2d87eb31559844efd857402da0b5,6/17(月) 5:47
2024-06-17,06:19,sports,スポーツ,39,スポニチアネックス,【マーメイドS】永島まなみ　10度目挑戦で重賞初制覇「凄くうれしい」先輩、後輩関係なく祝福の嵐,https://news.yahoo.co.jp/articles/532038ecc605d3e7ae6e4745ff61c13dcef1ee5a,6/17(月) 5:10
2024-06-17,06:19,sports,スポーツ,40,theWORLD（ザ・ワールドWeb）,「インスタをやるな、Tiktokをやるな、集中しろと」　C・ロナウドがユーヴェの若手に示したプロフェッショナルな姿勢とは,https://news.yahoo.co.jp/articles/01b8928616f5eafafe2cc7f4eb3620e0e5f9ff35,6/16(日) 23:10
