scrp_date,scrp_time,genre_en,genre_jp,rank,media_jp,title,link,date_original
2024-04-24,00:16,TTL,総合,1,デイリースポーツ,人気ミュージシャン　大麻所持の疑いで現行犯逮捕　所属事務所が謝罪,https://news.yahoo.co.jp/articles/caebaec39c15f8d6ef0777cb788381f958680f1f,4/23(火) 20:30
2024-04-24,00:16,TTL,総合,2,スポーツ報知,別人みたい！松本まりか“激変”姿にネット二度見「ヤバい」「どストライクだわ」「無双してる」,https://news.yahoo.co.jp/articles/9cd31527a513770845fcc50378cbd8158e200acf,4/23(火) 18:11
2024-04-24,00:16,TTL,総合,3,デイリースポーツ,延長１２回執念星で５連勝の日本ハム・新庄監督　劇的勝利に大興奮「脳の汁が…」　ナイン称える「あの一生懸命な姿を見たら涙出てくる。こんな勝ちある？」「今年はほんと面白い」,https://news.yahoo.co.jp/articles/0bb601aaccdc2da125f6a4c2b9a0a2457ce9f032,4/23(火) 22:15
2024-04-24,00:16,TTL,総合,4,モデルプレス,ヒカル、内田理央との熱愛認める「ほぼほぼ事実です」,https://news.yahoo.co.jp/articles/0534a6e1aacb1692b0ef0e41480c55580636c3f1,4/23(火) 19:52
2024-04-24,00:16,TTL,総合,5,デイリースポーツ,激変した元祖大食い美人芸人　細身ママＴＶ現る、夫も人気芸人　１０年ぶり爆食参戦「気付かなかった」「凄い」「めっちゃお母さん」,https://news.yahoo.co.jp/articles/678339c0adaa03da3024a0cc24405954746bb02b,4/23(火) 19:35
2024-04-24,00:16,TTL,総合,6,東スポWEB,WBC優勝の瞬間が再注目　水原一平容疑者が歓喜の輪から〝排除〟され「居場所がなくて帰っていく」,https://news.yahoo.co.jp/articles/fc23db5e3a74c2f7460a45379e037b1828eee797,4/23(火) 15:16
2024-04-24,00:16,TTL,総合,7,共同通信,作家の知念氏に賠償命令　ツイッター投稿で名誉毀損,https://news.yahoo.co.jp/articles/04076ffd1b6c0d2c725906ff475f99c528fe1e70,4/23(火) 21:13
2024-04-24,00:16,TTL,総合,8,シネマトゥデイ,妻の死に打ちのめされている『ハリー・ポッター』俳優、SNS休止…子供たちが発表,https://news.yahoo.co.jp/articles/31b62afeb57de61737ca78dda4209bd8998e2dfe,4/23(火) 11:10
2024-04-24,00:16,TTL,総合,9,スポーツ報知,えっ、香川照之！？近影衝撃「すごいグレイヘア」「渋く…」２年前に再婚＆子ども誕生,https://news.yahoo.co.jp/articles/a53a20f4d2bdad59a728eec631163d270681f52a,4/23(火) 12:30
2024-04-24,00:16,TTL,総合,10,デイリースポーツ,ＤＡＩＧＯの元カノ　２８年ぶり再会後の２ショット公開＆交際時の秘話も告白　現在は台湾の国民的人気タレント,https://news.yahoo.co.jp/articles/87c0116470322d67ed4ee6b55aa75a45b61ac510,4/23(火) 21:32
2024-04-24,00:16,TTL,総合,11,デイリースポーツ,岡村隆史　芸能界で唯一心を許せる芸人を明かす「ホンマの事言うていい？」「完璧やねん」,https://news.yahoo.co.jp/articles/7535c8f4b71bcfc9ce857df947611c4b699b43da,4/23(火) 16:40
2024-04-24,00:16,TTL,総合,12,クランクイン！,小柳ルミ子71歳、若々しいミニスカ姿に絶賛集まる「リカちゃん人形みたいにかわいい」,https://news.yahoo.co.jp/articles/7dd9b3c4ad683030d7d706fe8b470825e7479bf4,4/23(火) 18:00
2024-04-24,00:16,TTL,総合,13,KOREA WAVE,タイの伝統祭のさなか、性行為をした韓国人男性2人…映像拡散、罰金刑,https://news.yahoo.co.jp/articles/5cce2dbee4398703d3c18af85bcf75aa24325953,4/23(火) 20:03
2024-04-24,00:16,TTL,総合,14,ファイナンシャルフィールド,父が残したタンス預金。毎月の「食費」として小分けで使えば、相続税の申告をしなくてもバレないでしょうか?,https://news.yahoo.co.jp/articles/1a89f1d414358e104ca7656a94265c1bd4d0a8ed,4/22(月) 12:40
2024-04-24,00:16,TTL,総合,15,読売新聞オンライン,３年前にイタリアで日本人女性の遺体、裁判所が再捜査命令…両親「真相を究明してほしい」,https://news.yahoo.co.jp/articles/ba1e06d28a05901ebfd1abdfc521cbee5d2334ca,4/23(火) 16:19
2024-04-24,00:16,TTL,総合,16,ABEMA TIMES,大谷翔平に一体、何が起きたのか…？ 特大アーチ後のベンチの様子がヤバすぎると話題に　みんなから愛されてる“ほっこりシーン” 「泣けるな」「こっちまで嬉しくなる」,https://news.yahoo.co.jp/articles/2bbe5dea8fb661f43b44fda3a632ccb7b11c81d8,4/23(火) 21:46
2024-04-24,00:16,TTL,総合,17,中日スポーツ,人気ユーチューバー・ヒカル、女優との交際で文春砲浴び「超緊急動画」配信　「ほぼほぼ事実です」と認め文春挑発,https://news.yahoo.co.jp/articles/41c6aaf93fca7826ed10930cf6fa76bba5b7b6c5,4/23(火) 19:18
2024-04-24,00:16,TTL,総合,18,J-CASTニュース,人気女性YouTuber、親友との死別を涙ながらに報告　火葬場で父親とボタン押す,https://news.yahoo.co.jp/articles/22021b285f5fb5cd501b95fead822d0802b75e7a,4/23(火) 18:30
2024-04-24,00:16,TTL,総合,19,よろず～ニュース,立花孝志氏がつばさの党・根本陣営の街頭演説に凸撃、黒川敦彦氏と江東区内で路上討論 衆院東京15区補選,https://news.yahoo.co.jp/articles/6471f9721638a2bbfd83b9cca630949cc34cc809,4/23(火) 21:45
2024-04-24,00:16,TTL,総合,20,デイリースポーツ,長谷川博己　一度出演辞退した　まさか大ヒットドラマ明かす　脚本家に涙流して説得される,https://news.yahoo.co.jp/articles/4529109fe1373313f0ab5b05f20e674327f924b5,4/23(火) 20:14
2024-04-24,00:16,TTL,総合,21,J-CASTニュース,手足3本失ったYouTuberが結婚を報告　相手は「献身的に支えてくれるとても素敵な女性」,https://news.yahoo.co.jp/articles/50085d0023fe134f557c12aba418b0846e464880,4/23(火) 16:58
2024-04-24,00:16,TTL,総合,22,スポーツ報知,「１９歳なの？！」元人気子役が「ぽかぽか」に登場！激変姿にネット騒然「めちゃ美人」「綺麗なお姉さんになった」,https://news.yahoo.co.jp/articles/2eebdcfce50dfebd52410e05653154769a6fe5b0,4/23(火) 13:30
2024-04-24,00:16,TTL,総合,23,デイリースポーツ,日本ハムは延長１２回執念星！引き分け挟み５連勝で新庄政権最多更新の貯金４　上川畑の決勝適時打に新庄監督飛び跳ねてハイタッチ　大興奮「脳の汁が…」,https://news.yahoo.co.jp/articles/44222b08c5c57163a13969ffc19565a10c1e038d,4/23(火) 21:56
2024-04-24,00:16,TTL,総合,24,スポーツ報知,一瞬、誰？！加藤紗里、３３歳の姿が別人級「お美しい」「めちゃかわ」恋愛エピソード告白も話題,https://news.yahoo.co.jp/articles/b6ee10fc769b83491bf02b4698d9810d94434949,4/23(火) 16:55
2024-04-24,00:16,TTL,総合,25,スポニチアネックス,ヒカル、内田理央との交際は「ほぼほぼ事実」と認める　「申し訳ない気持ちでいっぱい」とも,https://news.yahoo.co.jp/articles/4cec4a6b4652695f4b839cec50df67825884c08c,4/23(火) 18:55
2024-04-24,00:16,TTL,総合,26,スポーツ報知,英国・ルイ王子が６歳に！母・キャサリン皇太子妃撮影の近影公開…王位継承順位は第４位,https://news.yahoo.co.jp/articles/49c8c7ed64b78841d6ac0cf543f052f5924b1cdc,4/23(火) 20:54
2024-04-24,00:16,TTL,総合,27,スポニチアネックス,長瀬智也　ひっそり快挙達成も「記者の方が一人もお見えにならなかったので僕からお伝え致します」,https://news.yahoo.co.jp/articles/582165878cfcc6aa914a7a8992737a7afffa8108,4/22(月) 15:07
2024-04-24,00:16,TTL,総合,28,デイリースポーツ,美人アイドル、親戚が人気歌手と結婚と告白→中居＆鶴瓶食いつく　ドルガバの女性か「じゃないの？」「モメるで」,https://news.yahoo.co.jp/articles/36cccb00aeac75fe66f14d267a8e893b5d6fe20f,4/23(火) 21:30
2024-04-24,00:16,TTL,総合,29,デイリースポーツ,米米ＣＬＵＢのライブパフォが急きょ中止　延長十二回の死闘で球団「時間が遅くなったため」石井竜也「野球最高！また会おうぜ～！」,https://news.yahoo.co.jp/articles/0462e12e5ea2f574bb6809493ad535bb345a7580,4/23(火) 21:55
2024-04-24,00:16,TTL,総合,30,TBS NEWS DIG Powered by JNN,【DeNA】阪神に延長12回の末1ー1の引き分け…山本の適時打で先制、牧は猛打賞も11回裏、痛恨の牽制アウトで好機逃す,https://news.yahoo.co.jp/articles/eba8868a70d9f8f57b3f2e293798a6fc94474dd7,4/23(火) 21:45
2024-04-24,00:16,TTL,総合,31,デイリースポーツ,ＤｅＮＡ・牧が痛恨ボーンヘッド　サヨナラ好機でまさかのけん制死　３イニング連続で絶好機生かせず　ハマスタが深いタメ息,https://news.yahoo.co.jp/articles/21d84e9ce75b58725c2cce3e91a2550859164f15,4/23(火) 21:27
2024-04-24,00:16,TTL,総合,32,弁護士JPニュース,「会社に来たくないから休み」身勝手すぎる行動で解雇…納得できず「無効」訴えた従業員に裁判所の判断は？,https://news.yahoo.co.jp/articles/b3c232605cde8890cb7af9ea42c6485aa1c0aafa,4/22(月) 12:32
2024-04-24,00:16,TTL,総合,33,スポーツ報知,【巨人】「オコエの走塁が良かったね」阿部監督も絶賛した超攻撃的リベンジ走塁が連敗止めた,https://news.yahoo.co.jp/articles/fc55799b8efd63cf5a540f9cd501f420fa286f6f,4/23(火) 21:13
2024-04-24,00:16,TTL,総合,34,ITmedia ビジネスオンライン,「転職エージェントの倒産」が急増　人手不足なのに“4年で4倍”に、なぜ？,https://news.yahoo.co.jp/articles/88f106e03fd3248adc39d75c21ab8ab9151c8b57,4/23(火) 7:00
2024-04-24,00:16,TTL,総合,35,エルザ,子ども・夫の世話、母の介護に追われ…65歳からダイエットを決意し”27kgの減量”「自分の人生の主人公になりたい」,https://news.yahoo.co.jp/articles/70d52292eb30814b5ca1d9cddcd85660c5ed86fe,4/23(火) 17:30
2024-04-24,00:16,TTL,総合,36,スポニチアネックス,ホリエモン、ヒカル＆内田理央の“熱愛”報道にコメント「知ってた笑」「桃鉄一緒にやったわ笑」,https://news.yahoo.co.jp/articles/798e3ae25cca4c531a07b208142fe9dc409cb92f,4/23(火) 22:50
2024-04-24,00:16,TTL,総合,37,J-CASTニュース,登録者173万人のラファエル「YouTuberはおもんないよ」　粗品の発言肯定もチクリ「明らかにプロの強い人間が言うと...」,https://news.yahoo.co.jp/articles/7c3a585d081ecfbb9a07c8469ff0b906bac6c1f5,4/23(火) 19:29
2024-04-24,00:16,TTL,総合,38,ABEMA TIMES,批判殺到！「悪意しか感じない」「遺恨になる」 “疑惑のジャッジ”が発生！ 審判が抗議を無視、後味が悪すぎるゲームセットの瞬間　“連続退場劇”の結末がヒドいと話題に,https://news.yahoo.co.jp/articles/3bf19f8a4d6d910279243a19b880bf6419193420,4/23(火) 21:57
2024-04-24,00:16,TTL,総合,39,LIMO,6月14日支給分からの「厚生年金と国民年金」一覧でチェック。2年連続増額も、気をつけたい注意点2つ,https://news.yahoo.co.jp/articles/219c3b05778d2e7fe0bc2c6724a08446c71bde51,4/23(火) 6:17
2024-04-24,00:16,TTL,総合,40,ENCOUNT,19歳になった元人気子役、現在の姿に称賛続々「喋るのうまい」「綺麗なお姉さん」,https://news.yahoo.co.jp/articles/413d0a5daf806b51736109d0795dca5ce6b144ce,4/23(火) 19:01
