scrp_date,scrp_time,genre_en,genre_jp,rank,media_jp,title,link,date_original
2024-04-24,08:16,life,ライフ,1,ファイナンシャルフィールド,父が残したタンス預金。毎月の「食費」として小分けで使えば、相続税の申告をしなくてもバレないでしょうか?,https://news.yahoo.co.jp/articles/1a89f1d414358e104ca7656a94265c1bd4d0a8ed,4/22(月) 12:40
2024-04-24,08:16,life,ライフ,2,LIMO,ダイソーで一人暮らしに必要なものを買っていたら…母親のまさかの一言に「膝から崩れ落ちた」,https://news.yahoo.co.jp/articles/7d2484073839d9e2a6ba9d598915b9dbcce0097d,4/24(水) 5:56
2024-04-24,08:16,life,ライフ,3,エルザ,子ども・夫の世話、母の介護に追われ…65歳からダイエットを決意し”27kgの減量”「自分の人生の主人公になりたい」,https://news.yahoo.co.jp/articles/70d52292eb30814b5ca1d9cddcd85660c5ed86fe,4/23(火) 17:30
2024-04-24,08:16,life,ライフ,4,ファイナンシャルフィールド,2024年の新札発行で「200万円」のタンス預金が全て旧札になります。紙幣交換をしたら税務署に目をつけられるでしょうか？,https://news.yahoo.co.jp/articles/b1581660dde74da9293cf0ce7472d577888ba883,4/23(火) 15:40
2024-04-24,08:16,life,ライフ,5,ほ・とせなNEWS,公園で泣き続ける赤ちゃんと暗い顔の母親　2時間以上同じ場所で座り続けている母親に声をかけると…「可愛いけど、しんどい…」,https://news.yahoo.co.jp/articles/a575af8f5b44a5127cfa84f6486abac2fd5d0568,4/23(火) 12:00
2024-04-24,08:16,life,ライフ,6,LIMO,「ンハァー！！」と犬を吸い、振り返ったら…目撃者の存在「見てはいけないものを見たような顔の猫」が話題,https://news.yahoo.co.jp/articles/b262986a199bbffc19275d3c7360bd981bf8f68a,4/24(水) 4:22
2024-04-24,08:16,life,ライフ,7,まいどなニュース,家庭訪問中、教員がコンビニでトイレ休憩→「けしからん」と学校にクレーム電話「地域の目、怖っ」「先生だって人間」,https://news.yahoo.co.jp/articles/b85724e90c0e139c9c5b59fb12065101410a9823,4/24(水) 7:20
2024-04-24,08:16,life,ライフ,8,LIMO,植えっぱなしOKで毎年キレイに花咲く多年草4選。初心者や忙しい人にもオススメ【ほったらかしガーデニング】,https://news.yahoo.co.jp/articles/629dbb0eb4317812ad9a2ab63bcf6b1f8b6eae05,4/23(火) 11:07
2024-04-24,08:16,life,ライフ,9,Medical DOC,「歯石」は何カ月に1回取るのがいい? 放置するリスクや除去後の注意点も歯科医が解説!,https://news.yahoo.co.jp/articles/98be3f5a135b2a9606ffd1b02bfe9ebd033cb3fc,4/23(火) 7:04
2024-04-24,08:16,life,ライフ,10,LIMO,嵐の中帰宅した妻「私よりボロボロの猫がいる…」目を疑う光景に「想像以上にボロボロ」「家にも嵐？」の声,https://news.yahoo.co.jp/articles/d6612ad259af1a41d86732b24dec6591dff12b9a,4/24(水) 6:22
2024-04-24,08:16,life,ライフ,11,LASISA,女性「電車で隣に座ってくる男キモい」SNS“炎上”…男女で《賛否》真っ二つ、それぞれの言い分とは,https://news.yahoo.co.jp/articles/9f00ad0d7464e6cf3411a22ed2713eb987c09cd2,4/22(月) 17:40
2024-04-24,08:16,life,ライフ,12,ファイナンシャルフィールド,孫に入学祝いで「5万円」を渡したら、不満そうな顔になりました。 どのくらいあげるのが「普通」なのでしょうか？,https://news.yahoo.co.jp/articles/98e68041d4a61deab3e5dded1f6a118a08526776,4/23(火) 11:20
2024-04-24,08:16,life,ライフ,13,Hint-Pot,「一番大きなカルチャーショック」　ニュージーランド人が日本のカフェで目撃　信じがたい光景とは,https://news.yahoo.co.jp/articles/9c87300945b230556ff75ff6807b95133183ca84,4/24(水) 7:40
2024-04-24,08:16,life,ライフ,14,BuzzFeed Japan,【ディズニー土産】ミッキーだらけの「大容量バッグ」が可愛い！荷物がたっぷり入るから、毎日使いにピッタリです,https://news.yahoo.co.jp/articles/1c05cb01b8123496302436eac4a0de84262ccb79,4/23(火) 20:05
2024-04-24,08:16,life,ライフ,15,LIMO,ALL980円【ワークマン】手ぶらになれる「大容量の便利バッグ」旅行にぴったり！,https://news.yahoo.co.jp/articles/91d68d4498b31729dac45e2f4f755aa8d91e4c8d,4/22(月) 10:47
2024-04-24,08:16,life,ライフ,16,ファイナンシャルフィールド,スパゲッティと一緒にソースの入った袋を茹でたら、彼氏に「汚い！」とドン引きされました。洗う食器や加熱代が浮くので気に入っているのですが、衛生面を考えてやめるべきでしょうか？,https://news.yahoo.co.jp/articles/16f4a0800a5f425c6aa16607b7004f6bccb0ca7c,4/23(火) 12:51
2024-04-24,08:16,life,ライフ,17,HugKum,知的障害を伴う自閉症スペクトラム・とんちゃんとの暮らし。夫を亡くしシングルマザーとして障害と向き合うママが、「ありのままの彼」をInstagramで発信する理由,https://news.yahoo.co.jp/articles/95991b204ae86035b6db4fb76dd81ca4144f615f,4/23(火) 21:30
2024-04-24,08:16,life,ライフ,18,LIMO,「壁紙も人工芝も安っぽくなって…」茨城県で「4000万円の注文住宅」を建てた夫婦の後悔とは,https://news.yahoo.co.jp/articles/36f0fba1671e77625179432ecab47a6b266e0c88,4/23(火) 18:02
2024-04-24,08:16,life,ライフ,19,Hint-Pot,シジミのみそ汁　身を食べるのはマナー違反？　注意したい2つのポイント,https://news.yahoo.co.jp/articles/ca329128cb03f7fbb758a1ef51d6c5cfdf907008,4/23(火) 7:10
2024-04-24,08:16,life,ライフ,20,ねとらぼ,息子発案、調味料ラベルのアイデアが「て、天才だ……」「うちもやってみる」と170万件表示　世界に1つだけ、見るたびに笑顔になれそう,https://news.yahoo.co.jp/articles/2367aac26dc27ef9bcf9a35798c4d4548d6b62f8,4/22(月) 8:30
2024-04-24,08:16,life,ライフ,21,ファイナンシャルフィールド,50代でアルバイトを始めようとしたら、面接で「パート扱いになる」と言われました。「アルバイト」と「パート」は同じではないのですか？,https://news.yahoo.co.jp/articles/6085b34514494918e7861fff36655c2f03118594,4/20(土) 13:30
2024-04-24,08:16,life,ライフ,22,ファイナンシャルフィールド,課長が毎日残業していて心配です。課長クラスになると残業代が出ないと聞いたのですが、それって本当ですか？,https://news.yahoo.co.jp/articles/5813a471ec132be07af87a9060d75c68a0f2be35,4/23(火) 8:30
2024-04-24,08:16,life,ライフ,23,LASISA,アラサー女性「8年交際した彼氏にフラれた」…SNS大議論　男性は“責任”とって結婚するべきか？,https://news.yahoo.co.jp/articles/5b40b1365f96b9db4dc2f3684280706d931246a0,4/23(火) 17:40
2024-04-24,08:16,life,ライフ,24,LIMO,自力で階段を上ったのはいいけど…　「降りられなくなってしまった」ラブラドールのその後が話題に,https://news.yahoo.co.jp/articles/d0f84fdfc1cfa43c0d6cb8ee376ceb99b4f0dc88,4/24(水) 5:17
2024-04-24,08:16,life,ライフ,25,Medical DOC,俳優・関貴昭さん逝去 死因の「食道がん」の初期症状・原因・なりやすい人の特徴を医師が解説,https://news.yahoo.co.jp/articles/73d76b4d90d0c1057febcc3b21aeaa59f1dec7d3,4/23(火) 16:16
2024-04-24,08:16,life,ライフ,26,ねとらぼ,0歳双子を19時15分に寝かせ続けたママ→1年後……　メリットだらけの挑戦記録に「偉い＆すごい！」「寝る子は育つ、その通りですね」,https://news.yahoo.co.jp/articles/f1d662b032931c9a5b052665cc43655219e37835,4/22(月) 10:00
2024-04-24,08:16,life,ライフ,27,ファイナンシャルフィールド,定年後も嘱託社員として働いてきましたが、67歳で契約解除に…この歳でも「失業保険」はもらえますか？,https://news.yahoo.co.jp/articles/8d3c39b4227f1cb48922e67d27f81f6f45a6f272,4/23(火) 12:01
2024-04-24,08:16,life,ライフ,28,ねとらぼ,「ハイブリッド」の燃費ランキング！　2位は「ホンダ フィット」、1位は？【2024年4月・カーセンサー調べ】,https://news.yahoo.co.jp/articles/a0723cb167c0e720de946d287f5574413b65c9a4,4/23(火) 20:40
2024-04-24,08:16,life,ライフ,29,まいどなニュース,1匹飼いの鳩から産まれた「奇跡のヒナ」…生後2週間で急死、〝鳩界のマリア様〟に悼む声「世界一愛された」,https://news.yahoo.co.jp/articles/a14da25a1423a8c97c4c4d7d1d03a6e87ca03bb0,4/24(水) 7:10
2024-04-24,08:16,life,ライフ,30,ねとらぼ,誰も教えてくれなかった“裁縫の裏ワザ”が目からウロコ　200万再生のライフハックに「画期的」と称賛【海外】,https://news.yahoo.co.jp/articles/1aee5977b068bbd3fdb5b8a75dc1326698d02d15,4/23(火) 17:00
2024-04-24,08:16,life,ライフ,31,magacol,女性社長7名に聞いた！「とっておきの人にだけ贈る…特別な手土産」7選｜美ST,https://news.yahoo.co.jp/articles/961074d6f065a09dd4c4e2231cd2d8a70d8d0518,4/24(水) 7:06
2024-04-24,08:16,life,ライフ,32,ダイヤモンド教育ラボ,「GMARCH」が中位層に？　少子化と大学進学率の上昇で『ブランド大学』の位置づけはどう変化するのか,https://news.yahoo.co.jp/articles/49d7469af18481f58eec754e016e48a8d1a83767,4/23(火) 11:09
2024-04-24,08:16,life,ライフ,33,まいどなニュース,2歳の双子を育てるママ、今度は三つ子を出産！育児に奮闘するママに聞いた「一気に5人兄弟！すごい！」「大変だけど頑張って」,https://news.yahoo.co.jp/articles/8dede2b598e3a52fc4dee3c5bf6c13fbbb6db351,4/24(水) 7:30
2024-04-24,08:16,life,ライフ,34,グルメ Watch,セブン-イレブン、ウイスキー「響2024」を抽選販売,https://news.yahoo.co.jp/articles/6db9b23b7d046e0c0b35dd64243495fb67cc30f9,4/23(火) 12:22
2024-04-24,08:16,life,ライフ,35,ファイナンシャルフィールド,仕事を終わらせて定時退社していたら、上司から「やる気がないなら仕事を辞めろ！」と説教されました。自分の仕事は終わっていますし、これは「パワハラ」ではないのでしょうか…？,https://news.yahoo.co.jp/articles/1745c3c6e08e57069ba320824406cc0e69678fa5,4/22(月) 11:20
2024-04-24,08:16,life,ライフ,36,BuzzFeed Japan,【GU】こんなパーカー待ってた！軽くて楽ちんな「着る日焼け止め」首元までカバーできるんです,https://news.yahoo.co.jp/articles/f3d8ffd45fc8f44971b94670019ab26bea3e09e5,4/22(月) 10:35
2024-04-24,08:16,life,ライフ,37,オリコン,黒髪両親から生まれた金髪ベビー、7ヵ月後の変化に290万再生「え～不思議！」「いずれにしても天使すぎんか」,https://news.yahoo.co.jp/articles/794edf5394af0d7b5f32d115b890af5cc2f4eaeb,4/16(火) 11:40
2024-04-24,08:16,life,ライフ,38,相続会議,贈与税の税率と計算法が一目で分かる　相続税対策の基本を解説,https://news.yahoo.co.jp/articles/e874dda46deb40c73d3d5589f04fc1d214383e35,4/24(水) 7:06
2024-04-24,08:16,life,ライフ,39,OTONA SALONE,「やせられない」「内臓脂肪が減らない」と思っていたら、なんと1か月で3㎏減！ MCTオイルで簡単にダイエットできるって本当？,https://news.yahoo.co.jp/articles/ef9db74218b32f0c933ca198883f464b48b88dea,4/23(火) 16:49
2024-04-24,08:16,life,ライフ,40,まいどなニュース,「進撃の巨人」！？…奈良の街なかにそびえる巨大な“壁”の正体は？ 　SNSをざわつかせた異様な写真の真相に迫る,https://news.yahoo.co.jp/articles/12fe672d072016bfce2cb10f72fd94255ad1526c,4/23(火) 7:10
