scrp_date,scrp_time,genre_en,genre_jp,rank,media_jp,title,link,date_original
2024-11-01,21:10,domestic,国内,1,ABEMA TIMES,「一目惚れだった」元オウム幹部と獄中結婚 なぜ決意？触れ合えない愛の形は？「（獄中結婚は）最大の愛情表現だと思っている」,https://news.yahoo.co.jp/articles/745f449a1b2841143e8e0bbc8d505092fdfab3c1,11/1(金) 12:32
2024-11-01,21:10,domestic,国内,2,産経新聞,国民・榛葉氏会見が荒れる　持論唱え続けるフリーにベテラン記者が苦言、会見で言い合いに,https://news.yahoo.co.jp/articles/152facb5f63c5d2347c66534401137bdfd3d3310,11/1(金) 18:59
2024-11-01,21:10,domestic,国内,3,スポニチアネックス,れいわ・山本太郎代表の“炎上”動画　党幹部が謝罪と動画削除を発表　「外国人差別」と批判受け,https://news.yahoo.co.jp/articles/4c51601d7bf9f9358ff6cc6f1ab979d4cd8a93c4,11/1(金) 18:38
2024-11-01,21:10,domestic,国内,4,デイリースポーツ,高橋洋一氏　大惨敗石破内閣の末路を予測「首班指名まで持たない」石破降ろしの発火点も推察「エラいとばっちり食ってるから」,https://news.yahoo.co.jp/articles/1fcffae90a54dc22657417b35f7bd3b5c80d8ea2,11/1(金) 18:43
2024-11-01,21:10,domestic,国内,5,デイリースポーツ,国民民主・玉木代表　元同志議員の印象聞かれ「コメント差し控えます」しこりアリアリ「ま、頑張って」松井氏が「個人的な感情置いといて」,https://news.yahoo.co.jp/articles/372d07d6c2e5f88618072215d803fa3811e02952,11/1(金) 17:23
2024-11-01,21:10,domestic,国内,6,弁護士ドットコムニュース,観光バスが「コーン乗り越え」強引に車線変更…SNSで拡散　道路会社「重大事故につながる危険行為」,https://news.yahoo.co.jp/articles/82ed8965732305a5e86f5f4dcb9549e874a33ce4,11/1(金) 18:41
2024-11-01,21:10,domestic,国内,7,日刊スポーツ,れいわ大石晃子氏が謝罪　炎上中のタイ人片言パロディー動画を削除「差別的意味ない」経緯説明,https://news.yahoo.co.jp/articles/5901ce5849176d21e7c4234e831354fa108c7bd8,11/1(金) 17:47
2024-11-01,21:10,domestic,国内,8,日刊スポーツ,国民榛葉幹事長「やらせ」発言でフリー記者を一喝「同業者にそういうのはだめ」場外乱闘にあきれ,https://news.yahoo.co.jp/articles/aa478d9a64c60b64602842964a5cc6c8a7c5bf31,11/1(金) 17:50
2024-11-01,21:10,domestic,国内,9,共同通信,健康保険証廃止まで1カ月　後継のマイナ利用率は低迷,https://news.yahoo.co.jp/articles/14bb9887a4cc672298e9666225db626fcf51e3df,11/1(金) 18:00
2024-11-01,21:10,domestic,国内,10,産経新聞,武藤容治経産相、国民民主の主張を一蹴　「トリガー条項」凍結解除などに否定的見方,https://news.yahoo.co.jp/articles/3a7b1afe511073f1d3956d034f489fa9b86ff9c5,10/29(火) 12:25
2024-11-01,21:10,domestic,国内,11,FNNプライムオンライン（フジテレビ系）,【速報】ユーチューバー水口恵容疑者が（37）知人男性ユーチューバー（40）の首をハサミで刺した容疑で逮捕　栃木・足利市,https://news.yahoo.co.jp/articles/21a2313726740a18aa84af8610351bc127ddb2ea,11/1(金) 11:07
2024-11-01,21:10,domestic,国内,12,中日スポーツ,れいわ・山本太郎代表、選挙動画が「外国人差別」と炎上　在日コリアン団体抗議に大石晃子共同代表が謝罪、動画を削除,https://news.yahoo.co.jp/articles/e62bcc8f0e84475f061ec90de310fe690ae7d836,11/1(金) 17:45
2024-11-01,21:10,domestic,国内,13,J-CASTニュース,ヒカキン「みそきん」繰り返される再販→即完売　転売でラーメン1個278円が5000円に,https://news.yahoo.co.jp/articles/7168a1f90a3dc82ee92efc9b896cd6a0abffef6d,11/1(金) 19:57
2024-11-01,21:10,domestic,国内,14,デイリースポーツ,高市早苗氏　選挙応援奔走も→自民執行部から「慰労の言葉ない」　憤慨Ｘに一文混入「酷い話」「石破政権の駄目な所」「書いちゃう辺りがなぁ」,https://news.yahoo.co.jp/articles/a5c0c3e97a96164a6468b4fa2cb7546ae0009cb7,11/1(金) 19:10
2024-11-01,21:10,domestic,国内,15,日刊スポーツ,維新の議席減の要因の１つは橋下徹氏の“口撃”盟友・松井一郎氏が「橋下さんのお遊芸」,https://news.yahoo.co.jp/articles/b1fe67aada4ee2c21dbf298d3a500eb612ef0f04,11/1(金) 20:03
2024-11-01,21:10,domestic,国内,16,よろず～ニュース,国民民主・榛葉幹事長「ヤラセ記者」発言に「それはダメ」　首班指名で「＃国民民主党に騙された」指摘の記者に,https://news.yahoo.co.jp/articles/d2931ff307dc3ac405b8130148ecd6625a94d0d2,11/1(金) 16:19
2024-11-01,21:10,domestic,国内,17,弁護士JPニュース,東京都内「ネズミ」増殖が止まらず、マンション上階も標的に…家庭で対策しても「完全駆除が困難」な絶望的現状,https://news.yahoo.co.jp/articles/25bf9e0f4c990d89ae0f6dedcef75d96fb74a4f9,11/1(金) 10:00
2024-11-01,21:10,domestic,国内,18,FNNプライムオンライン（フジテレビ系）,国民・榛葉幹事長「ずる賢い与党なら野田政権にして1本も法案を通させない」参院では自公が過半数,https://news.yahoo.co.jp/articles/dce6d229d686527cab4d59e2ff663c8ae16eda85,11/1(金) 17:17
2024-11-01,21:10,domestic,国内,19,デイリースポーツ,石破首相が怒らせられなくなった人物「気持ちパッと変わったら」→常時、政権終了の危機に　岩田明子氏が指摘「いばらの道」,https://news.yahoo.co.jp/articles/f2c7702bbb6c93b04e1a7a8328f69afe2293878a,11/1(金) 15:18
2024-11-01,21:10,domestic,国内,20,時事通信,元民社党参院議員の田渕哲也さん死去,https://news.yahoo.co.jp/articles/c1cdb2bdcbb94d6b9dcbf37b325c284f7de1cc1f,11/1(金) 19:22
2024-11-01,21:10,domestic,国内,21,テレビ朝日系（ANN）,「103万円の壁・ガソリン減税」自民と政策協議へ　強気の玉木氏「やらねば協力せず」,https://news.yahoo.co.jp/articles/119dc7854f7e3a0914f1ecde6bd79df6525d1210,11/1(金) 12:36
2024-11-01,21:10,domestic,国内,22,スポニチアネックス,在日コリアン人権団体　れいわ・山本太郎代表の動画に要望書「無関心で配慮に欠けるもの」,https://news.yahoo.co.jp/articles/9feb85985ea9a44a687c9717c00ffc92deccf715,11/1(金) 10:18
2024-11-01,21:10,domestic,国内,23,日刊スポーツ,維新の議席減の要因の１つは橋下徹氏の“口撃”　盟友・松井一郎氏が指摘「橋下さんのお遊芸」,https://news.yahoo.co.jp/articles/12c6d8c9928a027fd6572201a7b20e0a2548666e,11/1(金) 19:01
2024-11-01,21:10,domestic,国内,24,弁護士ドットコムニュース,「助けを呼んだらぶっ殺すぞ」若い女性を次々襲い「下着」まで奪った男に懲役9年、横浜地裁「悪質な態様」,https://news.yahoo.co.jp/articles/129faf81fa38e4a8755abbc1c8397a72b1968a18,11/1(金) 10:31
2024-11-01,21:10,domestic,国内,25,共同通信,従業員死亡ホテル、精算機破壊か　千葉・市原、強殺容疑で捜査,https://news.yahoo.co.jp/articles/bf6268ce70ef7eeb1d80a6c8510e20b66256f6b0,11/1(金) 18:16
2024-11-01,21:10,domestic,国内,26,毎日新聞,コロナワクチン「生物兵器まがい」　販売元が原口一博議員を提訴へ,https://news.yahoo.co.jp/articles/061c7f9b65c704ba0730919c56ed6f6be99fae77,11/1(金) 19:02
2024-11-01,21:10,domestic,国内,27,J-CASTニュース,渋滞中の高速でポール倒して別車線へ...Xで動画拡散、観光バス会社が謝罪　「急いでいたわけではない」のになぜ？,https://news.yahoo.co.jp/articles/4f162e4d322f57453dfca7e80ec5b680d8d21017,11/1(金) 20:23
2024-11-01,21:10,domestic,国内,28,FNNプライムオンライン,電動ドライバー刺し大便食べるよう強要 知人を殺害し切断…カップルが凶行に至るまで【宮城発】,https://news.yahoo.co.jp/articles/c8cd5ff39375812b99bc60dcb97962ae699abe1d,10/30(水) 11:02
2024-11-01,21:10,domestic,国内,29,J-CASTニュース,「大先輩は自重を」　立憲・米山氏、ついに「身内」にも苦言　レプリコンめぐり「安全である科学的根拠がある」,https://news.yahoo.co.jp/articles/039cd0904511ad7d8cd176af5902fe40674bc727,11/1(金) 12:00
2024-11-01,21:10,domestic,国内,30,TBS NEWS DIG Powered by JNN,台風21号が影響　日本三大花火「土浦全国花火競技大会」“延期なしの中止”に　「警備の労働力不足が極めて深刻」,https://news.yahoo.co.jp/articles/c6f041176190f9745bc18fa67b6aa2946ba8eb25,11/1(金) 11:32
2024-11-01,21:10,domestic,国内,31,毎日新聞,JR信越線で2件の人身事故相次ぐ　男性2人が死亡,https://news.yahoo.co.jp/articles/8c9839c7dfbb58f129905080dd474815be3d5370,11/1(金) 19:37
2024-11-01,21:10,domestic,国内,32,東海テレビ,「コラー！」で追い払う…住人は侵入者による被害をなぜ食い止められたのか 専門家が勧める“攻めの防犯”,https://news.yahoo.co.jp/articles/bec43c349dc2bea6e9cdd7c6ae8719a6d7854274,11/1(金) 16:39
2024-11-01,21:10,domestic,国内,33,TBS NEWS DIG Powered by JNN,「SIM貸しというお小遣い案件がある」と勧誘され　SIMカードを販売会社から詐取 自称・声優の女ら4人逮捕　架空請求メール送信に使用か　警視庁,https://news.yahoo.co.jp/articles/dec1bc1e0561c3da3846357d5b92efb3ce453425,10/31(木) 16:07
2024-11-01,21:10,domestic,国内,34,朝日新聞デジタル,ホテルで従業員女性死亡　強盗殺人で捜査　拘束し暴行、現金奪ったか,https://news.yahoo.co.jp/articles/eed726c728b5198d70cdfa5b3d6bd94c791b376e,11/1(金) 10:42
2024-11-01,21:10,domestic,国内,35,J-CASTニュース,食品のショーケースで掃除用モップを干す？　写真投稿でファミマが謝罪「該当店舗には厳正な対応」,https://news.yahoo.co.jp/articles/5e2045b093dcbedc2f3d471dd8232bac231b5cfe,10/29(火) 18:17
2024-11-01,21:10,domestic,国内,36,テレビ朝日系（ANN）,トラブル続くマイナ保険証 医療現場で混乱  「使うと便利」でも「紛失心配」の声も,https://news.yahoo.co.jp/articles/7be876a6f3646821cbd679f364b451b55426ded4,10/25(金) 17:51
2024-11-01,21:10,domestic,国内,37,共同通信,JR東海の指定席券売機、払い戻し機能停止,https://news.yahoo.co.jp/articles/d59cbbc2f167f313e3e2d84fb27c6e36c0325579,11/1(金) 18:31
2024-11-01,21:10,domestic,国内,38,みんかぶマガジン,「選挙負けたのに続投は理屈が通らない」と語った政治家は誰か…嘘つき石破をもう誰も信じない「メガネも嘘」増税はやる,https://news.yahoo.co.jp/articles/9d87aae49c6c8d2f4995e8f509c30c4a343d46e7,11/1(金) 9:10
2024-11-01,21:10,domestic,国内,39,デイリースポーツ,維新に激怒の橋下徹氏「一番嫌いな政治スタイル。ぶっ壊れてほしい」　馬場代表に「僕ら創業者メンバーは引いて」交代求める,https://news.yahoo.co.jp/articles/1f2904647109e20aa4fe3446aba7ef4c83db8b98,11/1(金) 20:49
2024-11-01,21:10,domestic,国内,40,時事通信,新迎撃弾開発、三菱重工に　防衛省、560億円で契約,https://news.yahoo.co.jp/articles/ada31e58823cdd342cd30fef683a107749028da0,11/1(金) 19:06
