scrp_date,scrp_time,genre_en,genre_jp,rank,media_jp,title,link,date_original
2024-11-01,02:05,domestic,国内,1,デイリースポーツ,維新・馬場代表「騙された」遺恨の自民党に怒り節　前日まで「全く連絡なし」だった　国民民主より後回し？「自民狡猾」「国民さんとご自由に」ＭＢＳ番組,https://news.yahoo.co.jp/articles/93c5d8521194be71e2539a25246097457128a3ef,10/31(木) 22:54
2024-11-01,02:05,domestic,国内,2,デイリースポーツ,「下品」「虚しい限り」高市早苗氏が憤慨Ｘ「民放２局」に不正確報道で叩かれたと　応援演説「殆ど落選」「総裁選目当て」報道に反論　１７００コメ殺到,https://news.yahoo.co.jp/articles/ef14c52a7c4b0543f354319bbb9c875d4c33c2e1,10/31(木) 19:14
2024-11-01,02:05,domestic,国内,3,デイリースポーツ,裏金１５６４万円→衆院選不出馬の杉田水脈氏「高市早苗先生の愛車です」いかついスポーツカー運転席で「おなか来る加速大好き」　来年参院選に出馬意向,https://news.yahoo.co.jp/articles/081a708ea3a0b6c5e012e2aa9130912847842029,10/31(木) 19:58
2024-11-01,02:05,domestic,国内,4,ABEMA TIMES,国民民主党・玉木雄一郎代表、自民党・石破総裁、立憲民主党・野田代表とそれぞれ党首会談へ 自民党とは「ご協力いただければお返しはする。でなければ相応の対応」,https://news.yahoo.co.jp/articles/b9cd044808973edd51efd86943f99efa9dd2a13e,10/31(木) 17:42
2024-11-01,02:05,domestic,国内,5,時事通信,萩生田氏ら「党所属」扱いせず　自民、批判懸念で異例対応,https://news.yahoo.co.jp/articles/e58bc992e6542d9b2d4fc7744ba4ee76ea27657b,10/31(木) 20:44
2024-11-01,02:05,domestic,国内,6,デイリースポーツ,橋下徹氏、馬場代表は「永田町自民党、大物政治家ぶるスタイル」と痛烈批判　「新生維新作るメンバーは馬場執行部の真逆の政治を」,https://news.yahoo.co.jp/articles/33ccd6ed54fed0d8632697aeac6758d15efca179,10/30(水) 16:08
2024-11-01,02:05,domestic,国内,7,時事通信,林官房長官、国民民主案なら7～8兆円減収　「103万円の壁」見直し,https://news.yahoo.co.jp/articles/d7c25b78d4c62c18f060e4b821fe841e84dc4106,10/31(木) 12:23
2024-11-01,02:05,domestic,国内,8,産経新聞,人気！強気！タマキ！　与野党からラブコール受ける国民民主の玉木代表、立民には冷たく…,https://news.yahoo.co.jp/articles/54b2be477737df05e1a27da6191ccef09563a9a8,10/30(水) 21:19
2024-11-01,02:05,domestic,国内,9,ABCニュース,「知らなかった」では済みません  自転車の「ながらスマホ」で懲役も　あす11月1日道交法改正で罰則強化　「酒気帯び運転」や酒類の提供者にも実刑　扱いは「原付と同じ」,https://news.yahoo.co.jp/articles/0593101344b78c35f6a0844f00e7144a2417c1b5,10/31(木) 18:00
2024-11-01,02:05,domestic,国内,10,毎日新聞,自民と国民民主「政策ごとに協議」で合意　「103万円の壁」焦点に,https://news.yahoo.co.jp/articles/4d46d60b36717aa0d13a1fafb7f6fa3c8c4abaa7,10/31(木) 20:12
2024-11-01,02:05,domestic,国内,11,ウェザーマップ,台風21号の影響　1日（金）～3日（日）は西日本と東日本で大雨に警戒,https://news.yahoo.co.jp/articles/bf7ac517fb5fd4841b8a9dff1c33c0ec056694f7,10/31(木) 17:23
2024-11-01,02:05,domestic,国内,12,東海テレビ,母親を殺害したとして逮捕…36歳無職の息子を父親への殺人容疑でも再逮捕「殺意はなかった」と容疑を否認,https://news.yahoo.co.jp/articles/2736a7cd404db1786e2509e213536a1dde48d72f,10/31(木) 22:45
2024-11-01,02:05,domestic,国内,13,弁護士ドットコムニュース,「15万を工面するためでした」 闇バイト応募で後悔、30代シングルマザーが呼びかける重み「みなさん、今ならまだ戻れます」,https://news.yahoo.co.jp/articles/8c7aa94d6c99009ccb47f823c8890d401ee257c3,10/31(木) 10:41
2024-11-01,02:05,domestic,国内,14,TBS NEWS DIG Powered by JNN,東京・葛飾「平沢王国」に異変　異例の“代議士3人時代”突入へ【衆院選2024】,https://news.yahoo.co.jp/articles/e66f8654b516e58ce1e647e71b543d94876b7ae9,10/31(木) 21:46
2024-11-01,02:05,domestic,国内,15,TBS NEWS DIG Powered by JNN,国民健康保険料　上限3万円引き上げへ　高所得者の負担増　厚労省専門部会,https://news.yahoo.co.jp/articles/ccd71d5b3bd7cd28641fb98c52f51e69bce5704b,10/31(木) 12:11
2024-11-01,02:05,domestic,国内,16,BUSINESS INSIDER JAPAN,3連休に行きたい「食事がおいしい温泉・スーパー銭湯」ランキング。東日本1位は「サ飯」が人気,https://news.yahoo.co.jp/articles/78f4f4d5032ff8ec7003c10cfbddb7ec09c08963,10/31(木) 20:00
2024-11-01,02:05,domestic,国内,17,よろず～ニュース,立花孝志氏が男泣き「斎藤元彦さんは圧勝しないといけない」兵庫県知事選第一声、異例ポスターも披露,https://news.yahoo.co.jp/articles/c0edc8cf658ca20093ba6a9c41b9d14aab9beb8b,10/31(木) 14:17
2024-11-01,02:05,domestic,国内,18,J-CASTニュース,渋谷の居酒屋で4人組が「食い逃げ」、店側「断じて許せません」　レジ前を走り抜ける防犯カメラ映像が拡散,https://news.yahoo.co.jp/articles/16f3a40004223fa0f09556c6db27793c6106c757,10/31(木) 13:02
2024-11-01,02:05,domestic,国内,19,みんかぶマガジン,玉木の犬となった石破「どんだけ要求飲めばいい？」自民関係者困惑…何がなんでも総理辞めない理由「自ら設定の勝敗ラインをガン無視」,https://news.yahoo.co.jp/articles/1514ee2d23a4426ec90c4ec68c9028cf3f5ed53c,10/31(木) 9:10
2024-11-01,02:05,domestic,国内,20,東海テレビ,厳戒エリアの“隣”に集結…ハロウィーンの名古屋・栄に200人超の群衆 半数以上が仮装し一時歩けない程の混雑に,https://news.yahoo.co.jp/articles/64e1b74f73fc38283806ec3b7dd8a94c87e2ebd2,10/31(木) 20:14
2024-11-01,02:05,domestic,国内,21,日テレNEWS NNN,横浜・みなとみらいの駐輪場で男女6人が“集団暴行”　男性（23）が財布奪われ顔骨折,https://news.yahoo.co.jp/articles/0034f754e03d63de8e6bd654edda5c3bde13abc1,10/31(木) 12:45
2024-11-01,02:05,domestic,国内,22,共同通信,渋谷「ハロウィーンぽくないね」　直前の週末、仮装姿まばら,https://news.yahoo.co.jp/articles/47cbb52b21edbdcfb8a3e801b0678ad5262ad08f,10/26(土) 20:11
2024-11-01,02:05,domestic,国内,23,スポニチアネックス,国民民主・玉木雄一郎氏　“年収の壁”引き上げ、政府試算に言及「7兆円の減税効果は大きい。まさに…」,https://news.yahoo.co.jp/articles/8a466d386827ea6a2434d16ee3a8309f5af87367,10/31(木) 10:29
2024-11-01,02:05,domestic,国内,24,朝日新聞デジタル,容疑者「被害者のカードで現金引き出した」　 大学生集団暴行死,https://news.yahoo.co.jp/articles/cf8ffbaac1305efb9ead12f01caf0176d69e9217,10/31(木) 20:42
2024-11-01,02:05,domestic,国内,25,産経新聞,最大勢力は麻生派に、旧安倍派は第5勢力へ後退　旧森山派は選挙後も維持　自民の衆院構図,https://news.yahoo.co.jp/articles/a18d33449927dbadf0fec8c4090c1fb4252e8112,10/31(木) 15:26
2024-11-01,02:05,domestic,国内,26,FNNプライムオンライン（フジテレビ系）,「防犯カメラを含めた店舗設備の見直し」も…ユニクロ店長が店内で女性客盗撮容疑で逮捕受けファストリが謝罪「お客様の信頼に背くような事態となった」,https://news.yahoo.co.jp/articles/968eb60b84321d26c7959a4c051f25b87315b5cc,10/31(木) 20:25
2024-11-01,02:05,domestic,国内,27,読売新聞オンライン,強い台風２１号、台湾に上陸…西日本は明日から大雨に警戒,https://news.yahoo.co.jp/articles/3d1dc524c50f9347dca8898f66da9b289716ce84,10/31(木) 21:52
2024-11-01,02:05,domestic,国内,28,デイリースポーツ,橋下徹氏、玉木雄一郎代表へ「国政維新に飲み食いなくても政治ができることを教えてあげて」,https://news.yahoo.co.jp/articles/21fd2d2577b817032adc23451b6f5f21f252bd47,10/31(木) 13:17
2024-11-01,02:05,domestic,国内,29,tenki.jp,明日11月1日～3日　九州から関東で警報級の大雨　11月とは思えない記録的大雨も,https://news.yahoo.co.jp/articles/5915f43b0e1b1db24615e7b0ab517ecbd7e19294,10/31(木) 18:14
2024-11-01,02:05,domestic,国内,30,FNNプライムオンライン,“マッチョドクター”美容外科医・藤岡淳朗容疑者（34）　20代女性患者に性的暴行の疑いで逮捕　睡眠薬を飲ませたか,https://news.yahoo.co.jp/articles/ac93ff693de894a227d7022deba4346aa6d3913a,10/25(金) 19:24
2024-11-01,02:05,domestic,国内,31,毎日新聞,カスハラ対策で「録音禁止」　広がる自治体の動きに懸念の声,https://news.yahoo.co.jp/articles/040bd03d3fcd23c7744d5df10a828e66944e1c17,10/31(木) 11:15
2024-11-01,02:05,domestic,国内,32,テレビ朝日系（ANN）,「1年後に別れると言われ…」交際トラブルか　北海道・大学生暴行死で新たに2人逮捕,https://news.yahoo.co.jp/articles/866bc7807d2c5c12ea0eaffcf261813539fb6ac3,10/31(木) 12:18
2024-11-01,02:05,domestic,国内,33,TBS NEWS DIG Powered by JNN,立憲民主党・野田代表、要請あれば自民との党首会談応じる考え,https://news.yahoo.co.jp/articles/7e7ea2f2324951743ffe5e3d61f0088c9de55f39,10/31(木) 20:07
2024-11-01,02:05,domestic,国内,34,時事通信,清水貴之氏が参院議員失職,https://news.yahoo.co.jp/articles/1ac1f4043f21a9cd3e80ce4333f8905e6e3aa180,10/31(木) 16:27
2024-11-01,02:05,domestic,国内,35,よろず～ニュース,「＃国民民主党に騙されるな」トレンドで玉木代表困惑「なんで急に」ネット「やっかみ」「はまると泥仕合」,https://news.yahoo.co.jp/articles/485e703f2ba8ede335cbfbc410dc3dbc527fc3e5,10/22(火) 19:28
2024-11-01,02:05,domestic,国内,36,FNNプライムオンライン（フジテレビ系）,「馬場代表は“裸の王様”」維新・猪瀬氏が猛批判　衆院選の引責辞任を要求　「吉村代表なら雰囲気変わる」,https://news.yahoo.co.jp/articles/db5fc7cacf939189c2f7bd504b7156583a8e7a96,10/30(水) 22:54
2024-11-01,02:05,domestic,国内,37,毎日新聞,「イノシシを手で捕まえられる度胸必要」　駆除の男性が一部始終語る,https://news.yahoo.co.jp/articles/a0ab884bfc88c7aa66bbdc2ba0a43a4f1a9a98fb,11/1(金) 0:18
2024-11-01,02:05,domestic,国内,38,TBS NEWS DIG Powered by JNN,東武東上線　池袋－小川町間の上下線で運転見合わせ　午後9時ごろ運転再開見込み,https://news.yahoo.co.jp/articles/fef584d64f741bed0dc2f066574e3433bb59503a,10/31(木) 18:45
2024-11-01,02:05,domestic,国内,39,東海テレビ,犯行時は警察学校に…交番勤務の25歳巡査を逮捕 16歳未満の女性とみだらな行為しスマホで撮影した疑い,https://news.yahoo.co.jp/articles/ca23f83f0b93be451831ef52624da1898d09e554,10/31(木) 22:20
2024-11-01,02:05,domestic,国内,40,J-CASTニュース,高市早苗氏、応援先が「ほとんど落選」報道に憤慨　地方遊説は「党役員をしておられる方々の仕事」と撤退宣言？,https://news.yahoo.co.jp/articles/42728343797257222c674aadc9215ab34befaea8,10/31(木) 14:45
