scrp_date,scrp_time,genre_en,genre_jp,rank,media_jp,title,link,date_original
2025-10-25,08:07,sports,スポーツ,1,スポーツ報知,「結婚１０周年」亀田和毅、メキシコ人の美人妻と息子２人の顔出しファミリーショットで報告,https://news.yahoo.co.jp/articles/de0144f66b8b481defce8c148515e9a67150874c,10/25(土) 5:56
2025-10-25,08:07,sports,スポーツ,2,GOAL,4試合ぶり勝利に貢献の田中碧、現地メディアで高評価「鋭い動きを見せた。守備を突破する原動力に」,https://news.yahoo.co.jp/articles/b80610693822cdb3eab0e376b71e643878ccd57f,10/25(土) 6:27
2025-10-25,08:07,sports,スポーツ,3,Full-Count,2時間46分…呼ばれぬ名前に「野球辞めようかな」　指名漏れの危機、侍左腕が籠ったトイレ,https://news.yahoo.co.jp/articles/9e25b2ff27225fe41bfe01b0aa1a29d6e8a1831f,10/24(金) 22:00
2025-10-25,08:07,sports,スポーツ,4,デイリースポーツ,フリーマンの妻・チェルシーさん「ベシア家のために、皆様の祈りを」と投稿　ド軍に広がる祈りの輪　同僚らも次々,https://news.yahoo.co.jp/articles/12af45d1254f207fe59427edf61837002a16349a,10/24(金) 19:09
2025-10-25,08:07,sports,スポーツ,5,サッカーキング,欧州遠征中のなでしこ、EURO4強のイタリアと1－1ドロー…長谷川唯が“芸術ループ”で同点弾,https://news.yahoo.co.jp/articles/ca7ed284c824037a3e1680780ab127317621449c,10/25(土) 3:16
2025-10-25,08:07,sports,スポーツ,6,Full-Count,ド軍、106億円左腕スコットはWS登録外　25億円男も…4投手の入れ替え、ロースター発表,https://news.yahoo.co.jp/articles/d6d8bd28c0929e552dfee1518bb947a84e86bd1c,10/24(金) 23:52
2025-10-25,08:07,sports,スポーツ,7,東スポWEB,「ドジャースの生存王」キム・ヘソンがＷＳメンバー残留…〝背信守護神〟はメンバー落ち,https://news.yahoo.co.jp/articles/9e353daaeee640b4a337802d70c91a2ee38c726c,10/25(土) 5:15
2025-10-25,08:07,sports,スポーツ,8,Full-Count,元中日のお騒がせ右腕がWS登録外　66登板で防御率3.08も…主力復帰でGM大ナタ,https://news.yahoo.co.jp/articles/8bbb4dae31292fb22056e90b862ac92e4fc2a808,10/25(土) 5:22
2025-10-25,08:07,sports,スポーツ,9,RONSPO,「佐々木麟太郎に賭けたソフトバンクは最悪の評価」元ヤクルト編成部長がドラフト成否を独自採点…「最高は阪神。90点以上は中日、ロッテ、オリックス、広島の4球団」,https://news.yahoo.co.jp/articles/71524072017aa161d3a07dc4f4c8dd086d9bdb2b,10/24(金) 7:05
2025-10-25,08:07,sports,スポーツ,10,CoCoKARAnext,最強左腕スクーバルの衝撃トレード説浮上！　米誌が佐々木朗希の絡むドジャース入りを予測「交渉材料となる“資金”は揃っている」,https://news.yahoo.co.jp/articles/fdf524f7c6dba30f79a1a85bdf58399f45d2ce85,10/25(土) 5:30
2025-10-25,08:07,sports,スポーツ,11,デイリースポーツ,大谷翔平　特注デコピンジャケットで球場入り　ファン反響「とってもかわいい」「デコイもワールドシリーズに」スネルはアンバランスコーデ,https://news.yahoo.co.jp/articles/25b0cae256cec39605e75d9e3440600e6b96ecce,10/25(土) 6:36
2025-10-25,08:07,sports,スポーツ,12,スポニチアネックス,ブルージェイズ・シャーザー「日本の先発投手の育成法に感銘」米国方式では「故障者が増えている」,https://news.yahoo.co.jp/articles/d3a2bb8924b71577f320e7b75e088ce025d7363b,10/25(土) 1:30
2025-10-25,08:07,sports,スポーツ,13,Full-Count,大谷球場入りに「デコ君も一緒」「デコピンだ！」　お披露目された私服が反響「欲しすぎる」,https://news.yahoo.co.jp/articles/a80ad5c77c331ea0f37f602755888b5ef3e6e94b,10/25(土) 6:59
2025-10-25,08:07,sports,スポーツ,14,CoCoKARAnext,なぜ“アジアの大砲”は巨人に戻ってきたのか　イ・スンヨプ氏が母国で漏らした臨時コーチ就任の理由「日本の野球が強いワケを知りたい」,https://news.yahoo.co.jp/articles/17bb4a31fa1630adc51ec05286cd34abb1f64b9f,10/25(土) 6:30
2025-10-25,08:07,sports,スポーツ,15,Full-Count,中日のドラフト戦略に疑問「見直すべきでは」　投手にも悪循環…OBが指摘した致命的な弱点,https://news.yahoo.co.jp/articles/d97b1056b2cb0c691a170f297bd6d3f69e31e148,10/25(土) 7:30
2025-10-25,08:07,sports,スポーツ,16,Full-Count,佐々木朗希が明かした“7文字”が「泣かせる」　伝えた感謝…ファン納得「ド軍に来て大正解」,https://news.yahoo.co.jp/articles/1511e2e5bee1f11fe893a80f48de846a0098f34b,10/25(土) 5:50
2025-10-25,08:07,sports,スポーツ,17,東スポWEB,ドジャース大谷翔平に屈辱を！ ブルージェイズ会長が大号令「弱点探し」の結果,https://news.yahoo.co.jp/articles/82561ea00f71524ecf6ef65f24ec773a44f9bacc,10/25(土) 5:15
2025-10-25,08:07,sports,スポーツ,18,ABEMA TIMES,ブルーロックかよ！日本代表MF、空中トラップからの超絶ボレー！「えぐいって」0.5秒で相手ゴールを脅かした瞬間,https://news.yahoo.co.jp/articles/f6a9d9cdf770e87ee37bb53a2023c10c69d9f73b,10/25(土) 7:00
2025-10-25,08:07,sports,スポーツ,19,スポニチアネックス,【F1】来季デビュー有力な18歳リンドブラッド6番手　8番手の角田裕毅上回る　メキシコGPフリー走行,https://news.yahoo.co.jp/articles/4384b5ed2408b952bf978a51330ba397a272c8a8,10/25(土) 5:09
2025-10-25,08:07,sports,スポーツ,20,RONSPO,WSもう一つの因縁…ブーイング候補は大谷翔平だけじゃなかった…「本当に契約寸前だったんだ」テオスカー・ヘルナンデスが約5年半プレーした古巣ブルージェイズとの復帰交渉を明かす,https://news.yahoo.co.jp/articles/e0462aa2cfc61289eb8f4c7d010a6a263ffaa5bd,10/25(土) 5:18
2025-10-25,08:07,sports,スポーツ,21,産経新聞,佐々木麟太郎の1位指名はリスペクト、ドラフト会議で見えた球団戦略…巨人とオリは対照的,https://news.yahoo.co.jp/articles/3d74652a9375deef712c46c23f3f6cfe3e2f9f94,10/25(土) 7:00
2025-10-25,08:07,sports,スポーツ,22,RONSPO,なぜ？今日開幕の日本Sで阪神絶対有利説が多勢を占める中で球界大御所は「4勝3敗でソフトバンク」と意外な予想,https://news.yahoo.co.jp/articles/320902d3d726094c59037e9cf3ff84aa3e04a475,10/25(土) 6:20
2025-10-25,08:07,sports,スポーツ,23,Full-Count,大谷翔平、デコピンジャケットで球場入り　WS開幕戦に“家族”と一緒…球団SNSが公開,https://news.yahoo.co.jp/articles/bd41d11d2c6e12b143f7b9935802e44cf4cd3f86,10/25(土) 6:18
2025-10-25,08:07,sports,スポーツ,24,Full-Count,大谷翔平が「1人だけ間違えている」　注目された手元…気づいた“違和感”「よく見たら」,https://news.yahoo.co.jp/articles/bdddecbced028dc91cd8658bdf4fced0821aeb2c,10/25(土) 6:10
2025-10-25,08:07,sports,スポーツ,25,TopNews,【FP1新人枠】日本人2名含め新人は9人が出場　18歳リンドブラッドが角田裕毅を上回る！岩佐歩夢・平川亮の結果は？／F1メキシコシティGP,https://news.yahoo.co.jp/articles/2d894015c50f90bfdf590ecd5435a57fc6bdb9f9,10/25(土) 6:53
2025-10-25,08:07,sports,スポーツ,26,スポニチアネックス,巨人　3選手に戦力外通告　17年阪神ドラフト1位・馬場は現役続行希望,https://news.yahoo.co.jp/articles/5ffebe544135427e7c60137f16cf91ef568ea833,10/25(土) 5:30
2025-10-25,08:07,sports,スポーツ,27,CoCoKARAnext,「トロントに来ている日本の報道陣は109人」大谷翔平のWS前日会見狂騒曲　カナダ発のルポから伝わる異様な熱気,https://news.yahoo.co.jp/articles/11147ce3ae4bde5d5766268c3597ff5a5587c215,10/25(土) 5:00
2025-10-25,08:07,sports,スポーツ,28,日刊スポーツ,【スピードスケート】高木美帆「殻を破るには必要不可欠」２種目で銀メダルを獲得,https://news.yahoo.co.jp/articles/8ba17cc2cb8915f92979a63fe23f304bd95f86a2,10/24(金) 19:31
2025-10-25,08:07,sports,スポーツ,29,Full-Count,大谷翔平、米老舗メディアの年間MVPならず　支持率11％で3位…60発ローリー受賞,https://news.yahoo.co.jp/articles/8775f0e6119c1add6ec4739686bb40dd921ac9ae,10/25(土) 5:58
2025-10-25,08:07,sports,スポーツ,30,デイリースポーツ,問題児カシメロＶＳ亀田京之介、前日計量ともに一発クリアも　メインはまさかの８・４キロ超過で中止に　１０・２５キルギス亀田興行,https://news.yahoo.co.jp/articles/0752691f40ff1107e65166a74ebea4a27bee2381,10/24(金) 20:45
2025-10-25,08:07,sports,スポーツ,31,デイリースポーツ,大谷翔平「1番DH」　不動のスタメン　Bジェイズは巧打者ビシェット戦列復帰　9月デビュー22歳が先発大役　ワールドシリーズ第1戦ラインアップ発表,https://news.yahoo.co.jp/articles/1d9d2ef2d5dcf7a6c7c89450cf8575c0642364a7,10/25(土) 5:28
2025-10-25,08:07,sports,スポーツ,32,スポニチアネックス,阪神・デュプランティエ　第2戦先発か？　CS登板なしも状態良好で急浮上　才木は甲子園登板が決定的,https://news.yahoo.co.jp/articles/91035a22c6955c74c325459404f539e81c227501,10/25(土) 5:15
2025-10-25,08:07,sports,スポーツ,33,FITNESS LOVE,60歳・ビキニフィットネスに初挑戦！「年齢は関係なく、楽しんだもの勝ちだと思います」,https://news.yahoo.co.jp/articles/8d2851fcc86e0bbefaf31c8d4b83233accd067cc,10/25(土) 7:10
2025-10-25,08:07,sports,スポーツ,34,高校野球ドットコム,巨人は移籍2年目の中継ぎ右腕、195センチ左腕、巨人レジェンドと同姓同名の捕手が戦力外に,https://news.yahoo.co.jp/articles/d4602cc4996e3a264f77b34ce1fd10bc58660e92,10/24(金) 22:00
2025-10-25,08:07,sports,スポーツ,35,ゲキサカ,田中碧が2か月ぶりの先発出場!! リーズはウエスト・ハムを破って4試合ぶり白星,https://news.yahoo.co.jp/articles/854784b80cbbd51cd86d8c60655672ef8d37c31e,10/25(土) 6:13
2025-10-25,08:07,sports,スポーツ,36,デイリースポーツ,ロバーツ監督がスコットのロースター外について説明「タイミングが悪かった」,https://news.yahoo.co.jp/articles/8aadae080d48e4f55f4293028ce9bb49d4e8b968,10/25(土) 7:14
2025-10-25,08:07,sports,スポーツ,37,スポニチアネックス,山本由伸　Bジェイズアナリスト・加藤豪将氏と再会のハグ　佐々木朗希も笑顔で談笑,https://news.yahoo.co.jp/articles/b553aa2a46b0bebb73cd65c3a59f962b81677382,10/25(土) 6:31
2025-10-25,08:07,sports,スポーツ,38,Full-Count,ド軍、「深刻な問題」のベシアに配慮　忌引きリストには入れず…編成本部長「野球と比べ物にならない」,https://news.yahoo.co.jp/articles/ef1c6f76d6beee6e4a2f035dae697c18e8738ba6,10/25(土) 7:31
2025-10-25,08:07,sports,スポーツ,39,GOAL,負ければ監督解任と報じられるソシエダ、久保建英欠場もオヤルサバルの2発でセビージャ撃破！今季2勝目で降格圏から脱出,https://news.yahoo.co.jp/articles/d0ac1580d33d1fd4d165f6ac7bcc48c77d09a094,10/25(土) 5:59
2025-10-25,08:07,sports,スポーツ,40,CoCoKARAnext,フリーマンが大谷翔平に抱く畏敬の念「わけがわからない。機械なんじゃないか」 「誰もがショウヘイになりたいだろう」,https://news.yahoo.co.jp/articles/db7fe38f6c61b11f5fe3133bd92bd89c4e90d1bf,10/25(土) 6:10
