scrp_date,scrp_time,genre_en,genre_jp,rank,media_jp,title,link,date_original
2025-10-25,13:08,sports,スポーツ,1,Full-Count,大谷翔平、WS初HR　松井秀喜以来の快挙、PS通算9号で日本人最多へあと1…反撃2ランに敵地騒然,https://news.yahoo.co.jp/articles/31dede652859fa95fc468282cdec4cc3bcfcc247,10/25(土) 11:45
2025-10-25,13:08,sports,スポーツ,2,Full-Count,ド軍、投壊11失点で黒星発進　大谷翔平は意地のWS初アーチも…6回の大量9失点が響く,https://news.yahoo.co.jp/articles/0ae5fb699ff33a5563ee4e2560be62e5a1e66c3d,10/25(土) 12:27
2025-10-25,13:08,sports,スポーツ,3,東スポWEB,大谷翔平の真美子夫人がトロント降臨　白トップスで〝奥様会〟写真に納まる,https://news.yahoo.co.jp/articles/85f2db4ddc265631829de7a64e0a79ea595050f7,10/25(土) 10:40
2025-10-25,13:08,sports,スポーツ,4,スポニチアネックス,中日　森野将彦打撃・作戦コーチの今季限りでの退団発表,https://news.yahoo.co.jp/articles/d68dafe7a8a2a2abe5a31830c51dd54faf4e47aa,10/25(土) 11:16
2025-10-25,13:08,sports,スポーツ,5,高校野球ドットコム,来年のドラフトはめったにない大豊作の予感！ドラ1候補7人衆を紹介！,https://news.yahoo.co.jp/articles/27345ccce05302c64492e56905ce847b0624c576,10/25(土) 12:12
2025-10-25,13:08,sports,スポーツ,6,デイリースポーツ,ドジャースが悪夢の大量９失点　ロバーツ監督の継投失敗　無死満塁から投入のシーハン乱調→バンダが満塁弾被弾　スネルは５失点ＫＯ,https://news.yahoo.co.jp/articles/5064d35670fe948988887203be3d721283f3eb1e,10/25(土) 11:34
2025-10-25,13:08,sports,スポーツ,7,スポーツ報知,中井美穂アナ＆古田敦也氏　レアな夫婦ショット「素敵」「いい写真」結婚３０年…元ヤクルト監督が披露,https://news.yahoo.co.jp/articles/8f07fb9f736274557373308fa98c3eb277dec6ac,10/25(土) 10:55
2025-10-25,13:08,sports,スポーツ,8,馬トク報知,未勝利戦で単勝１・１倍がまさかの掲示板外にＳＮＳ悲鳴「飛んで悲しすぎる」「雨が嫌だった？」,https://news.yahoo.co.jp/articles/218842e533755988aba78d57479fe7100bb8f5d3,10/25(土) 11:21
2025-10-25,13:08,sports,スポーツ,9,デイリースポーツ,ドジャース　ベッツが和風ジャケット？で球場入り　キケはさすがのオシャレコーデ　エドマンもかっこいい！球団が公開,https://news.yahoo.co.jp/articles/15736557f9ea46d51f4fda6ffb288ff89e24973a,10/25(土) 8:19
2025-10-25,13:08,sports,スポーツ,10,Full-Count,中日のドラフト戦略に疑問「見直すべきでは」　投手にも悪循環…OBが指摘した致命的な弱点,https://news.yahoo.co.jp/articles/d97b1056b2cb0c691a170f297bd6d3f69e31e148,10/25(土) 7:30
2025-10-25,13:08,sports,スポーツ,11,デイリースポーツ,大谷翔平、WS初本塁打　2戦連発PS6号2ラン　敵地ブーイングしずめる　継投ミス大敗の展開から反撃の一発,https://news.yahoo.co.jp/articles/4ecd2d9e3ff85d778e99b3973b4b292e8ee27587,10/25(土) 11:45
2025-10-25,13:08,sports,スポーツ,12,中日スポーツ,中日、森野将彦打撃・作戦コーチが退団,https://news.yahoo.co.jp/articles/e7bfb3860779058e2ef14e81cd8613fce9e13623,10/25(土) 9:57
2025-10-25,13:08,sports,スポーツ,13,ゴルフ総合サイト ALBA Net,＜速報＞竹田麗央＆古江彩佳が2UPで後半へ　山下美夢有＆西郷真央は劣勢,https://news.yahoo.co.jp/articles/bccdf2f8fdb53a996b4518f308fce9688a24b91c,10/25(土) 12:24
2025-10-25,13:08,sports,スポーツ,14,RONSPO,角田裕毅が「かなり満足な内容」でメキシコGPのFP2で7番手でも英メディアが「彼の将来に悪い兆候」と悲観的に報じた理由とは？,https://news.yahoo.co.jp/articles/532d911bc610b04982ee85aef820947f96bfc2bc,10/25(土) 12:24
2025-10-25,13:08,sports,スポーツ,15,CoCoKARAnext,「単純に考えたら、力はある」防御率0.00男の新天地はいかに？阪神を戦力外となった29歳右腕を球界OBが考察「ヤクルトとか投手に苦しんでいるところとか面白い」,https://news.yahoo.co.jp/articles/a066f6e2ac72cb9413d9814b458976400417f3a8,10/25(土) 11:41
2025-10-25,13:08,sports,スポーツ,16,デイリースポーツ,大谷翔平の衝撃弾に敵地がシ～ン　グシャッの打球音＆表情ゆがめるも右翼席へ　ＮＨＫ解説「球場もえっ！？ってなって」「あれで入るんだ」,https://news.yahoo.co.jp/articles/51eac0c99bf9c42082abffd24eafa5ae3e69c0eb,10/25(土) 11:49
2025-10-25,13:08,sports,スポーツ,17,Full-Count,ド軍、6回に悪夢の大量9失点　満塁＆2ラン被弾で2-11、スネルKOから相手打線止まらず,https://news.yahoo.co.jp/articles/9beb0a71ae1c3877fc03add3d5a5a95605cf382d,10/25(土) 11:33
2025-10-25,13:08,sports,スポーツ,18,デイリースポーツ,ドジャース　スネルがまさかの同点２ラン被弾　六回途中５失点ＫＯでＰＳ初黒星　３戦３勝、防御率０・８６の絶対エースが,https://news.yahoo.co.jp/articles/b8f28d487a80162fc4abd432f62e417d443eebc5,10/25(土) 10:39
2025-10-25,13:08,sports,スポーツ,19,Full-Count,大谷翔平が三振した裏で「大興奮w」　スタンドにいた人物に注目「誇りだろう」,https://news.yahoo.co.jp/articles/b474907894a7ce345941ef283cf6688b7e0dafc3,10/25(土) 9:57
2025-10-25,13:08,sports,スポーツ,20,スポーツ報知,【高校野球】金光大阪が初戦敗退、神戸国際大付との接戦落とす　大阪勢１回戦突破は大阪桐蔭のみ,https://news.yahoo.co.jp/articles/ca6c090b337f1daf8911f6f89e4eb0655d077aef,10/25(土) 11:46
2025-10-25,13:08,sports,スポーツ,21,サンケイスポーツ,ドジャース〝弱点〟の救援陣が大炎上…ロバーツ監督、継投失敗　25歳右腕が走者全て生還→バンダ満塁弾　スネルの粘投フイ,https://news.yahoo.co.jp/articles/460e135b243f4ff7134a13bca6dc608dffb34e43,10/25(土) 11:40
2025-10-25,13:08,sports,スポーツ,22,スポーツ報知,ブルージェイズの加藤豪将氏が佐々木朗希＆山本由伸とハグ　朗希との秘話明かす「会ったときに…」,https://news.yahoo.co.jp/articles/2373e0c0dbcc80d4741542d0edfc363692765709,10/25(土) 8:30
2025-10-25,13:08,sports,スポーツ,23,高校野球ドットコム,聖隷クリストファーの超高校級左腕がまさかの5回10失点…【東海大会】,https://news.yahoo.co.jp/articles/ea5fa1d06014ed421c94b5777c2ca06e1d03a982,10/25(土) 11:31
2025-10-25,13:08,sports,スポーツ,24,CoCoKARAnext,ドジャース、衝撃の“崩壊”…エース左腕スネルの降板から1回9失点を生んだ継投策に米記者たちが嘆き「ブルペンにとって悪夢だ」,https://news.yahoo.co.jp/articles/d1eea7e08ebcbf05dec878fb91eab3afa0d4f02d,10/25(土) 12:12
2025-10-25,13:08,sports,スポーツ,25,RONSPO,「佐々木麟太郎に賭けたソフトバンクは最悪の評価」元ヤクルト編成部長がドラフト成否を独自採点…「最高は阪神。90点以上は中日、ロッテ、オリックス、広島の4球団」,https://news.yahoo.co.jp/articles/71524072017aa161d3a07dc4f4c8dd086d9bdb2b,10/24(金) 7:05
2025-10-25,13:08,sports,スポーツ,26,高校野球ドットコム,聖隷クリストファーがコールド負け…全試合完投の超高校級左腕は6回10失点で東海3枠目も厳しい立場に【東海大会】,https://news.yahoo.co.jp/articles/fd2c45f2ecd0a39ac5c4c1993642b9e92e34b5db,10/25(土) 11:59
2025-10-25,13:08,sports,スポーツ,27,オートスポーツweb,角田裕毅7番手、順調な初日に満足「これほど安定した金曜日を過ごせたのは久しぶり。さらなるマシン改善に取り組む」,https://news.yahoo.co.jp/articles/2ea97d912b64ef805277b835a6b74384f36f852c,10/25(土) 10:07
2025-10-25,13:08,sports,スポーツ,28,スポーツ報知,「結婚１０周年」亀田和毅、メキシコ人の美人妻と息子２人の顔出しファミリーショットで報告,https://news.yahoo.co.jp/articles/de0144f66b8b481defce8c148515e9a67150874c,10/25(土) 5:56
2025-10-25,13:08,sports,スポーツ,29,サンケイスポーツ,大谷翔平のWS1号、投げ返す？「カナダ人そんなことしないよ」　地元の26歳キャッチ「オオタニへ敬意ありすぎる」,https://news.yahoo.co.jp/articles/f642cacb05db21f3d735076f4ff7d155325d7aa9,10/25(土) 12:25
2025-10-25,13:08,sports,スポーツ,30,TBS NEWS DIG Powered by JNN,ド軍、投手陣大崩壊で6回悪夢の9失点...スネル6回途中で降板、シーハンが無死満塁踏ん張れず→バンダが満塁HR＆2ラン被弾,https://news.yahoo.co.jp/articles/45aeabf7c6e4210f7e01610460fbbb2b120b857b,10/25(土) 11:20
2025-10-25,13:08,sports,スポーツ,31,日刊スポーツ,【阪神】ドラ２日大・谷端将伍がドラフト翌日に緊張の中でプレー、１位の立石正広とも連絡をとる,https://news.yahoo.co.jp/articles/2e1a0f206656300da8fb35dd3ede2c6d1dd48e96,10/25(土) 9:45
2025-10-25,13:08,sports,スポーツ,32,TBS NEWS DIG Powered by JNN,大谷翔平、第4打席でWS1号！松井秀喜以来、日本選手2人目の“ワールドシリーズ弾” 悪夢の9失点後に意地の一発,https://news.yahoo.co.jp/articles/2751188e716e402e772551c37c004650839afb87,10/25(土) 11:45
2025-10-25,13:08,sports,スポーツ,33,デイリースポーツ,フリーマンの妻・チェルシーさん「ベシア家のために、皆様の祈りを」と投稿　ド軍に広がる祈りの輪　同僚らも次々,https://news.yahoo.co.jp/articles/12af45d1254f207fe59427edf61837002a16349a,10/24(金) 19:09
2025-10-25,13:08,sports,スポーツ,34,TopNews,【F1メキシコシティGP：FP2】角田裕毅7番手で上位キープ　フェルスタッペンが貫禄の首位！ルクレールとアントネッリ迫る,https://news.yahoo.co.jp/articles/255d339f99537d0ffb9de092e4d00c7516c33265,10/25(土) 8:07
2025-10-25,13:08,sports,スポーツ,35,Full-Count,元中日のお騒がせ右腕がWS登録外　66登板で防御率3.08も…主力復帰でGM大ナタ,https://news.yahoo.co.jp/articles/8bbb4dae31292fb22056e90b862ac92e4fc2a808,10/25(土) 5:22
2025-10-25,13:08,sports,スポーツ,36,CoCoKARAnext,大谷翔平のWS初アーチも“珍現象”「さすが敵地」「なぜか寂しい」「試合展開はまぁあれだけど」ドジャースは初戦を落とす,https://news.yahoo.co.jp/articles/4b5e09fbf1f03504bd578da3766ff5174e20c406,10/25(土) 12:27
2025-10-25,13:08,sports,スポーツ,37,中日スポーツ,大谷翔平に「お前はいらない」大合唱… 2023年に移籍実現せず、ブルージェイズファン容赦ない洗礼,https://news.yahoo.co.jp/articles/95c4f13fa8584e2ab81a3633dac0ae3f41f207cc,10/25(土) 12:40
2025-10-25,13:08,sports,スポーツ,38,デイリースポーツ,ドジャースが悪夢の黒星発進　大谷翔平が衝撃WS1号弾も…まさか1イニング9失点　継投失敗で再びブルペンの不安露呈,https://news.yahoo.co.jp/articles/5f8d1ad7aca06e1ce9a5a8d6717cdcbb60dcadd6,10/25(土) 12:27
2025-10-25,13:08,sports,スポーツ,39,Full-Count,投手歴3年で驚きのドラ3指名　苦難の連続も…逸材右腕が救われた同級生の“説教”,https://news.yahoo.co.jp/articles/26df11c24659a9a3cca0927d41478debb1a491fc,10/25(土) 10:23
2025-10-25,13:08,sports,スポーツ,40,Full-Count,フリーマン、大谷への“疑惑”「理解できない」　目撃した衝撃の光景「ロボットじゃないか…」,https://news.yahoo.co.jp/articles/6fec015a593098f26bd18a8edc90139b3d762332,10/25(土) 8:57
