scrp_date,scrp_time,genre_en,genre_jp,rank,media_jp,title,link,date_original
2024-03-01,08:17,local,地域,1,OBS大分放送,遺族「娘は悪くない…それを証明したい」 給食をのどに詰まらせ女子生徒死亡　損害賠償訴訟あす判決,https://news.yahoo.co.jp/articles/b008bd7e76dc817dcba8945e68e2feba4735a630,2/29(木) 17:54
2024-03-01,08:17,local,地域,2,RKB毎日放送,松尾潔「バラエティ番組は地獄」という茂木健一郎の投稿をラジオで支持,https://news.yahoo.co.jp/articles/8e539594258df2f7573914b1dbabe900b8393f95,2/29(木) 17:19
2024-03-01,08:17,local,地域,3,長崎国際テレビ,【速報】「電停に衝突し…横転」長崎市で乗用車の横転事故　20代男性搬送《長崎》　,https://news.yahoo.co.jp/articles/f5f9e73f25d2c78c5039375bcbb40d5c31ab6977,3/1(金) 6:31
2024-03-01,08:17,local,地域,4,RKB毎日放送,「パトカーとすれ違う際に不審な動き職務質問すると・・・82歳男を逮捕」,https://news.yahoo.co.jp/articles/a1ca54a72521164ec2e78a6ecb8677abdb7821b3,3/1(金) 6:33
2024-03-01,08:17,local,地域,5,ABCニュース,准教授の男を逮捕　「男性教授が学内でセクハラ」虚偽文書を大学関係者に郵送　教授の名誉を毀損した疑い　兵庫県警,https://news.yahoo.co.jp/articles/08d0735dc4ca3f4ca202f6c2e310b0980b68bb50,3/1(金) 3:32
2024-03-01,08:17,local,地域,6,Daiichi-TV（静岡第一テレビ）,【地震速報】関東地方で震度４　静岡東部・伊豆で震度１　津波の心配なし　,https://news.yahoo.co.jp/articles/65ff7f8f2abaac83f63d49460ad47ded486b24da,3/1(金) 6:03
2024-03-01,08:17,local,地域,7,カナロコ by 神奈川新聞,横浜市港北区で震度３、川崎市などで震度２　千葉東方沖で地震相次ぐ,https://news.yahoo.co.jp/articles/c41fcad7d810e114973f8fd17873d44c42c7c1db,3/1(金) 6:41
2024-03-01,08:17,local,地域,8,南日本新聞,コロナ療養施設で強制性交捜査　鹿児島県警内部資料が流出か　被害者側「謝罪申し出あった」,https://news.yahoo.co.jp/articles/b8013e4bf210ad0a0e7e6a755a92ae2e04b61133,3/1(金) 7:00
2024-03-01,08:17,local,地域,9,千葉日報オンライン,女子中学生の口ふさぎ、車に連れこもうと…　目撃した警察官を車で引きずり重傷負わす　千葉県警、容疑で46歳男を再逮捕,https://news.yahoo.co.jp/articles/eea3b96554e531b1f6f0d98e1ebf1c8e36d8dce3,2/29(木) 11:48
2024-03-01,08:17,local,地域,10,京都新聞,急増する24時間ジム、人気の秘密　なぜ通い、どこを鍛えているのか　利用者を直撃すると,https://news.yahoo.co.jp/articles/54c4462219caeef78f9207da3d800283d6c1d916,2/29(木) 10:32
2024-03-01,08:17,local,地域,11,静岡朝日テレビ,関東地方で震度4の地震　静岡県内でも8市町で震度1,https://news.yahoo.co.jp/articles/6a7ae982a2e7cffd56192522797512335c061166,3/1(金) 6:16
2024-03-01,08:17,local,地域,12,北海道ニュースUHB,【行方不明から23年】 当時16歳の女子高校生 千田麻未さん…バスを降りたあとどこへ？　警察が情報提供を呼びかけ　北海道室蘭市,https://news.yahoo.co.jp/articles/187d6c751673c506c429e74642d4c698bc86cace,2/28(水) 21:00
2024-03-01,08:17,local,地域,13,ＢＳＮ新潟放送,『タカラ』が破産申請　地元では上位の建設会社も市町村合併後の先細りに勝てず資金繰りが限界に　新潟県長岡市,https://news.yahoo.co.jp/articles/4bd1b1c128b851144940ed408485dd763dbd52b4,2/28(水) 16:21
2024-03-01,08:17,local,地域,14,HBCニュース北海道,札幌ドームの命名権、タイムリミットまで応募なし…前回の“半額セール”で年間２億5000万円、期限を定めず募集延長　約10億円かけた新モード利用もわずか２件,https://news.yahoo.co.jp/articles/8a435ced4f195b587287e8a920cff78f7652b746,2/29(木) 8:44
2024-03-01,08:17,local,地域,15,静岡放送（SBS）,1日早朝、関東地方で震度4の地震　静岡県内も県東部や伊豆で震度1（午前5時43分の地震）,https://news.yahoo.co.jp/articles/ed2cee5c914b04e34fa291f91e0ee4ba1befd300,3/1(金) 7:36
2024-03-01,08:17,local,地域,16,沖縄タイムス,「チャージ代を払わないと店から出られないし、殺すよ」　バーで取り囲み40万円を脅し取った疑い　暴力団組員ら2人を逮捕,https://news.yahoo.co.jp/articles/f42991523a1817bb254b10cb6a7c1b1ea427d2e0,3/1(金) 6:03
2024-03-01,08:17,local,地域,17,あなたの静岡新聞,将棋・豊島九段が藤井名人への挑戦権　静岡で藤井八冠が大盤解説,https://news.yahoo.co.jp/articles/c2f8d71d5243ff3dc5b913ea5ef1b271f5dbafea,3/1(金) 7:33
2024-03-01,08:17,local,地域,18,HBCニュース北海道,「男がベッドの下にいる」無施錠の玄関から、20代女性の部屋に侵入し…仕事から帰宅の女性気づき、すぐ近くに住む顔見知りの24歳を逮捕「間違いない」,https://news.yahoo.co.jp/articles/1340fca9f4520e9b50eb4e5afd83e7401850c3ac,2/29(木) 8:10
2024-03-01,08:17,local,地域,19,NBS長野放送,若い女性が首都圏流出　男女比不均衡で婚姻数や出生数減少　女性に「選ばれる県」にならないと　止まらない人口減　1973年以来、約50年ぶりに200万人割れ,https://news.yahoo.co.jp/articles/ccbb69afc97b9345766123f8459c45fff1c35a80,2/29(木) 21:36
2024-03-01,08:17,local,地域,20,テレビ愛知,EVスーパーカー「アウル」　世界最速の加速力、価格は4億円！　アスパークが開発した電気自動車,https://news.yahoo.co.jp/articles/47343f0a27df698a758be3f27dd7fd979ac1b5e8,3/1(金) 7:30
2024-03-01,08:17,local,地域,21,中国新聞デジタル,サンフレの3月新サカスタ2試合、全席完売,https://news.yahoo.co.jp/articles/3ec7cc8825bbd80d4e6702a1a0a074c6247581c8,3/1(金) 7:01
2024-03-01,08:17,local,地域,22,BSS山陰放送,傷害容疑で逮捕・起訴猶予の島根大学准教授　停職3か月の処分…停職が明ければ授業を再開する予定,https://news.yahoo.co.jp/articles/fb3ce5c29cd234865c0e60a9356743d9bea6ede2,3/1(金) 7:01
2024-03-01,08:17,local,地域,23,テレビ愛知,ジブリ「魔女の宅急便」　グーチョキパン屋のパンが買える　ジブリパーク「魔女の谷」エリア公開,https://news.yahoo.co.jp/articles/69353812f34dbdac3ff1ce9a0c3b7cb9bf7cf5d0,2/29(木) 13:30
2024-03-01,08:17,local,地域,24,千葉日報オンライン,【速報】千葉県で地震相次ぐ　東方沖が震源　27日から10回以上、最大震度4　気象庁注意呼び掛け,https://news.yahoo.co.jp/articles/200fd56f4be8e6103643a38eaaab1a5381013060,2/29(木) 19:14
2024-03-01,08:17,local,地域,25,千葉日報オンライン,【速報】千葉県で地震相次ぐ　主に東方沖が震源　27日から10回以上、最大震度3　気象庁注意呼び掛け,https://news.yahoo.co.jp/articles/2ce93984e83370324288bfa674d55bb967b0daca,2/29(木) 12:05
2024-03-01,08:17,local,地域,26,千葉日報オンライン,【速報】2歳女児はねられ死亡　木更津アウトレット駐車場で　容疑で57歳男逮捕,https://news.yahoo.co.jp/articles/b12a03a4ef8284aef5eb61d959746a8892e12940,2/29(木) 19:43
2024-03-01,08:17,local,地域,27,TeNYテレビ新潟,土木工事などを手がけていた会社が破産申請へ　公共工事の減少や競争激化で受注落ち込む　負債総額1億8875万円 《新潟》　,https://news.yahoo.co.jp/articles/1cce6f053449d0a9370f480abae70f8132a4e3dc,2/29(木) 21:44
2024-03-01,08:17,local,地域,28,チューリップテレビ,警察官が見えるマネキンを「見えない」大学生を車でひいて死亡させ逃走…70歳男の態度に「不合理だと思った」,https://news.yahoo.co.jp/articles/610295f90b8030f3a78c9de291fdc0eba4084325,2/22(木) 17:42
2024-03-01,08:17,local,地域,29,中京テレビＮＥＷＳ,プラだけど「プラスチック資源」にならないもの　4月のプラごみ分別方法変更に向けて市がとりまとめ　名古屋市,https://news.yahoo.co.jp/articles/885e59c41feccd9386d8e8bdeddbc248ae64783d,2/29(木) 16:22
2024-03-01,08:17,local,地域,30,仙台放送,3人の子を津波で…すれ違った夫婦、再生の13年。亡き子に問う“幸せになってもいい？” #知り続ける,https://news.yahoo.co.jp/articles/aa9fcfe341cb2394662523234292508dfdcc6f8b,2/28(水) 12:01
2024-03-01,08:17,local,地域,31,KTNテレビ長崎,卓球・石川佳純さんが長与町で「サンクスツアー」　五輪メダリスト登場に大歓声【長崎】,https://news.yahoo.co.jp/articles/f8fdc9c0de1b93f42c8a7e4be3ba06f9655cea19,2/29(木) 17:31
2024-03-01,08:17,local,地域,32,Web東奥,隣に座った高齢女性、電子マネー5枚の番号入力し始め… 特殊詐欺阻止で弘前大生2人に感謝状,https://news.yahoo.co.jp/articles/b3e31040fcf4619d54179adeae7a13f3e717c9af,2/29(木) 11:50
2024-03-01,08:17,local,地域,33,FBS福岡放送,はみ出し運転や低速走行　飲酒運転の疑いで男２人逮捕　容疑認める,https://news.yahoo.co.jp/articles/730772c2d58419dcb9f793508573c17d5fba230e,3/1(金) 7:49
2024-03-01,08:17,local,地域,34,カナロコ by 神奈川新聞,横浜・南区で約１２５０軒停電,https://news.yahoo.co.jp/articles/53b43a41c58e0eb836d98e46368e8dd05189d289,2/29(木) 16:10
2024-03-01,08:17,local,地域,35,ＳＢＣ信越放送,大雪は峠越える　1日朝は交通障害や電線凍結に注意を　長野,https://news.yahoo.co.jp/articles/a45d428fcbe46f9b380cba76bc3e99e892a26c4b,3/1(金) 7:12
2024-03-01,08:17,local,地域,36,茨城新聞クロスアイ,日進工機、破産手続き開始決定　負債額約9600万円　コロナ融資導入も業績回復せず　茨城,https://news.yahoo.co.jp/articles/e0e0a5c8f1c2652578f42a0745eaa1debf9b48e4,2/29(木) 19:00
2024-03-01,08:17,local,地域,37,KSB瀬戸内海放送,クレーンの点検を実施しなかったり記録を改ざんしたりした疑い　今治造船と従業員3人を書類送検　香川労働局,https://news.yahoo.co.jp/articles/dd693708a5690d96d7e10b0b0783b16660f456e8,2/29(木) 18:11
2024-03-01,08:17,local,地域,38,Web東奥,給食費無償化に疑問の声　青森県知事の回答は,https://news.yahoo.co.jp/articles/fc355968b588f5fb329cfd34e2cdfafcfd9bb7ee,2/29(木) 23:02
2024-03-01,08:17,local,地域,39,UTYテレビ山梨,手術中の女性患者を盗撮した疑い　胸ポケットにペン型カメラで犯行か　山梨大学医学部附属病院に当時勤務の看護師を逮捕,https://news.yahoo.co.jp/articles/ea56bc34dc68bc75d4d99aac4816c868eb674be7,2/29(木) 16:06
2024-03-01,08:17,local,地域,40,静岡朝日テレビ,目撃者がナンバーを覚えていて…高校生ひき逃げ容疑で浜松市職員の女を逮捕　浜松市,https://news.yahoo.co.jp/articles/702498d48bf0bda5a16c692d39656231ef03cf27,2/29(木) 18:51
