scrp_date,scrp_time,genre_en,genre_jp,rank,media_jp,title,link,date_original
2025-11-16,22:11,sports,スポーツ,1,東スポWEB,ドジャースＦＡのキケ・ヘルナンデス　手術＆ＷＢＣ絶望で同僚とばっちり「すべてパヘスのせい」,https://news.yahoo.co.jp/articles/0c1678f6650425aea67f8e7900a3451140218052,11/16(日) 17:50
2025-11-16,22:11,sports,スポーツ,2,スポニチアネックス,【ONE】武尊が電撃引退表明！8カ月ぶり復帰戦で涙の2RTKO勝利　ラストマッチはロッタンと再戦へ,https://news.yahoo.co.jp/articles/5cba4621c024adfd4417137b20d6c9b7a772d905,11/16(日) 18:35
2025-11-16,22:11,sports,スポーツ,3,スポニチアネックス,落合博満氏　侍ジャパンで「凄い」と評価した22歳「現代っ子っていうのかな」　中畑氏も称賛「勝負強い」,https://news.yahoo.co.jp/articles/4501c9c215a140dffa766ead04ca50d694468ddc,11/16(日) 17:28
2025-11-16,22:11,sports,スポーツ,4,Full-Count,大谷翔平が突如投稿…視線が集中した“背後”　スポンサー企業の高級品が「凄すぎる」,https://news.yahoo.co.jp/articles/e69cfcfe6027daad676f633f5ea248c30499264f,11/16(日) 20:20
2025-11-16,22:11,sports,スポーツ,5,TBS NEWS DIG Powered by JNN,【侍ジャパン】“追加招集”石上泰輝が勝ち越し2点タイムリー！2死満塁からライトに運ぶ　佐々木の押し出し四球で同点,https://news.yahoo.co.jp/articles/f1ce05d0dc163f67f2b8a3dd79ee3c0e8666c7a7,11/16(日) 21:15
2025-11-16,22:11,sports,スポーツ,6,サンケイスポーツ,韓国美女チア軍団、東京ドームに集結　美脚ショーパン姿で連夜の応援,https://news.yahoo.co.jp/articles/69352f04a774257c1642b6d476fe5429f5c93b8c,11/16(日) 19:55
2025-11-16,22:11,sports,スポーツ,7,高校野球ドットコム,韓国、この日も中継ぎ陣崩壊…2試合通して19四死球に【侍ジャパン】,https://news.yahoo.co.jp/articles/5f7e1b5d45a9bd7a9ec9ecb1221122c1cc6ab5c0,11/16(日) 21:22
2025-11-16,22:11,sports,スポーツ,8,スポーツ報知,プロ４０周年の鈴鹿ＦＷカズが今季ホーム最終戦に後半４８分から途中出場　ＪＦＬ最年長記録を５８歳２６３日に更新,https://news.yahoo.co.jp/articles/0de465393843c244701e61c494f03adb6c236bbc,11/16(日) 15:07
2025-11-16,22:11,sports,スポーツ,9,スポニチアネックス,山本由伸　愛犬とのラブラブショット披露　名前も公表「僕の愛犬のカルロスです」「友達はデコピン」,https://news.yahoo.co.jp/articles/2aff108dc49d1297490337a77a89384a9e7be122,11/16(日) 12:57
2025-11-16,22:11,sports,スポーツ,10,デイリースポーツ,「生で拝めて幸せ」京都競馬場降臨の美人女優にＳＮＳ騒然　可憐なモノトーンドレス姿で魅了「顔ちっちゃいな～」「声かけられたら間違いなく気絶する」,https://news.yahoo.co.jp/articles/58b68e39b8a9d3bdf92bfe2bf81e1ed6ad2ec68c,11/16(日) 16:50
2025-11-16,22:11,sports,スポーツ,11,ABEMA TIMES,「肋骨が透けて…」「脚の筋肉が浮き出てる」36歳の“60キロ”力士、鍛え抜かれた筋肉美に驚きの声 劇的勝利に館内騒然,https://news.yahoo.co.jp/articles/b3636408bcb0486d0f078517821c08793ba007bd,11/16(日) 18:24
2025-11-16,22:11,sports,スポーツ,12,スポーツ報知,トットナム、１月久保獲得へ　１０７億円移籍金、妥当,https://news.yahoo.co.jp/articles/51eae69b6d7c2edc7749bf55737a4995b57ebcc6,11/16(日) 16:23
2025-11-16,22:11,sports,スポーツ,13,my caddie,中島啓太、来季のPGAツアーカード獲得　マキロイとフィッツパトリックがプレーオフへ,https://news.yahoo.co.jp/articles/55e557232a27bcae772fd93744578fbbeafcc505,11/16(日) 21:22
2025-11-16,22:11,sports,スポーツ,14,中日スポーツ,元広島・安部友裕さん、『カープ棺』に身を納めた終活ショットにファン衝撃「心臓がヒュッと」顔の周りには花、本格的な葬儀仕様,https://news.yahoo.co.jp/articles/a62d51ac2480a02e869f355f511a23013962b825,11/16(日) 19:58
2025-11-16,22:11,sports,スポーツ,15,高校野球ドットコム,韓国の高卒ルーキーが150キロ台の直球連発で日本を圧倒して3回無失点！高校時代はU-18日本代表も完璧に封じる【侍ジャパン】,https://news.yahoo.co.jp/articles/e710d89a71bc9ccaebde96fb07bddae871e94068,11/16(日) 20:21
2025-11-16,22:11,sports,スポーツ,16,デイリースポーツ,野杁正明は王座統一ならず　正規王者スーパーボンと壮絶打ち合いの死闘も判定０－３負けで陥落,https://news.yahoo.co.jp/articles/1516a32d7a1198702dc678856d0173e55f5db869,11/16(日) 21:12
2025-11-16,22:11,sports,スポーツ,17,中日スポーツ,サッカー日本代表・久保建英の獲得へ英プレミアリーグ強豪が100億円用意　英サッカーメディアが伝える,https://news.yahoo.co.jp/articles/99bf2499778cf80d4e39b2a05ab160f5ef07504f,11/16(日) 21:12
2025-11-16,22:11,sports,スポーツ,18,スポニチアネックス,【ONE】野杁正明　キックボクシング世界王座統一ならず…フルラウンド死闘も判定負け,https://news.yahoo.co.jp/articles/fa4034e03b072f9a359d992f1e6ce8e7e1138450,11/16(日) 21:10
2025-11-16,22:11,sports,スポーツ,19,デイリースポーツ,山本由伸　愛犬・カルロスの寝顔が「破壊力すごい」「電車で見てはいけない」「幸せそう」一気に日米ファンが虜に,https://news.yahoo.co.jp/articles/7346aecc58a35e0a496bfd1d49ecb72893e5b5d2,11/16(日) 20:49
2025-11-16,22:11,sports,スポーツ,20,中日スポーツ,「韓国チアの破壊力　これに関しては日本負けてる…」白のショーパン姿で笑顔ふりまく美女たちにX民メロメロ「韓国のチアかわいいな～」「見かけてテンション上がってしまった」,https://news.yahoo.co.jp/articles/a91565fceb0913362ea8606b5fc2cd879f981880,11/16(日) 20:06
2025-11-16,22:11,sports,スポーツ,21,Full-Count,名門封じた21歳左腕に騒然「想像以上に化け物」　繰り広げられる“争奪戦”「ドラ1間違いなし」,https://news.yahoo.co.jp/articles/345eb8473515b7513c65e9178f5d0900c7455487,11/16(日) 18:25
2025-11-16,22:11,sports,スポーツ,22,Full-Count,ベッツが突然“ブチギレ”「頭おかしいんじゃないの？」　ド軍同僚の話題で…米ファン驚愕「本当かと」,https://news.yahoo.co.jp/articles/bbd801707f58eb83559119c28fcf947c641e10b5,11/16(日) 14:16
2025-11-16,22:11,sports,スポーツ,23,日刊スポーツ,【日本ハム】阪神にトレードの伏見寅威SNSで「燃え尽きるまで」「できればファイターズで…」,https://news.yahoo.co.jp/articles/4bff3c996a12f162a4396757e40b76ef6a661c3e,11/16(日) 19:16
2025-11-16,22:11,sports,スポーツ,24,バスケットボールキング,福岡大学附属大濠高校がU18トップリーグ2連覇…最終戦で福岡第一高校に衝撃の49点差勝利,https://news.yahoo.co.jp/articles/16d107426094840b02f088892fdd75f786b3b02e,11/16(日) 19:23
2025-11-16,22:11,sports,スポーツ,25,Full-Count,山本由伸が公開した“10文字”がファン層拡大!?　突然の告白が思わぬ反響「ハンサムだね」,https://news.yahoo.co.jp/articles/4e8f66d2a071eadd7c3b267eed5bde18abec3123,11/16(日) 19:15
2025-11-16,22:11,sports,スポーツ,26,中日スポーツ,井上尚弥を狙う男、軽量級では規格外の身長185センチ、初回からリングを支配しWBOフェザー級タイトル戦でKO勝利,https://news.yahoo.co.jp/articles/da303031c9e870d1c53aa6c5b39cce5091a92651,11/16(日) 15:50
2025-11-16,22:11,sports,スポーツ,27,Full-Count,村上宗隆の“無視できない課題”　MLB注目も…米記者が指摘した“64/187”「外れれば大失敗」,https://news.yahoo.co.jp/articles/e1e341a4d4060a3fa9e8533d9c5eda2d31179396,11/16(日) 20:53
2025-11-16,22:11,sports,スポーツ,28,デイリースポーツ,元阪神の原口文仁氏　大腸がん発覚のきっかけ「１０時間寝ても異常に眠かった」　告知聞いた妻は「肝が据わっていた」,https://news.yahoo.co.jp/articles/a82e4ddeb0db8eb6bd1e39cfbd1cc33ec067e9da,11/16(日) 20:06
2025-11-16,22:11,sports,スポーツ,29,中日スポーツ,【侍ジャパン】先発の中日・金丸夢斗が3イニング3失点で降板　3回に1死満塁から右前適時打を浴び先制される,https://news.yahoo.co.jp/articles/dd39836b30f4b884d5a7459f126b4db77777f366,11/16(日) 20:43
2025-11-16,22:11,sports,スポーツ,30,CoCoKARAnext,キム・ヘソンは“お役御免”なのか　ド軍、28歳ユーティリティ獲得の動きで「構想から外れる可能性が高い」,https://news.yahoo.co.jp/articles/391771c0d85028d597c3818171a0a21a166eb0ea,11/16(日) 16:20
2025-11-16,22:11,sports,スポーツ,31,CoCoKARAnext,「#友達はデコピン」山本由伸が愛犬の名前を初披露　「散歩、昼寝、ご飯が大好き」　210万人超フォロワー大興奮「陰のMVP」,https://news.yahoo.co.jp/articles/e86e77c4dd998776f8ef435825fa4826bbf383bb,11/16(日) 16:50
2025-11-16,22:11,sports,スポーツ,32,ABEMA TIMES,「腹筋やばぁ」“美女”空手家、衝撃映像にネット騒然 「ツヨカワすぎる」「最強女子大生」,https://news.yahoo.co.jp/articles/ad782e8f65cf89c14467a70f30ac71dedf3e44ac,11/16(日) 19:30
2025-11-16,22:11,sports,スポーツ,33,CoCoKARAnext,新人王に最も近い男　超即戦力で活躍必至のオールドルーキー「3選手」,https://news.yahoo.co.jp/articles/33edeceea2ec47552bb1da15658ae3ffe21220ee,11/16(日) 18:30
2025-11-16,22:11,sports,スポーツ,34,theWORLD（ザ・ワールドWeb）,娘の試合観戦中に大惨事　サッカー選手が暴行を受け「車の鍵」が頭に刺さる重傷,https://news.yahoo.co.jp/articles/9430aca424747f2d2742f7df697860f3cccc598a,11/16(日) 20:31
2025-11-16,22:11,sports,スポーツ,35,デイリースポーツ,高校ラグビー奈良決勝は死闘両校優勝　花園切符は抽選決着で御所実に　４年ぶり１５度目,https://news.yahoo.co.jp/articles/4b2aed29146c47365094a39fbd7e065653bd0674,11/16(日) 15:53
2025-11-16,22:11,sports,スポーツ,36,日テレNEWS NNN,「カルロスです」山本由伸が愛犬の名前を初公開「友達はデコピン」かわいい寝顔の写真を投稿,https://news.yahoo.co.jp/articles/be4a132e0819f54a668071572dac5c70b8e040cc,11/16(日) 13:24
2025-11-16,22:11,sports,スポーツ,37,スポニチアネックス,韓国苦悶…救援投手が連日の四球連発　5回で8四球　“押し出し地獄”でネット「何回押し出すねん」,https://news.yahoo.co.jp/articles/92706f6c3f140000ce6c1bbdaa12272cd0e17de9,11/16(日) 21:14
2025-11-16,22:11,sports,スポーツ,38,デイリースポーツ,侍ジャパン　西川史礁に死球を与えた韓国代表投手が謝罪　試合前練習で直接訪問→手首を確認して握手をかわす,https://news.yahoo.co.jp/articles/13ba0a5aa1cc88cf36df8a150fe8c0b373fcfae1,11/16(日) 17:17
2025-11-16,22:11,sports,スポーツ,39,デイリースポーツ,宇野昌磨氏「ほぼ９割ダメ」な野菜嫌いでも食べられる大好物「野菜に入れてくれるんですか？」に加藤浩次が爆笑,https://news.yahoo.co.jp/articles/25478ea5ee3e946cb3482318b5ed7fac5416abd2,11/16(日) 17:12
2025-11-16,22:11,sports,スポーツ,40,ABEMA TIMES,「ロン毛の力士きた」「まじイケメン」19歳力士の“美脚”スタイルに熱視線,https://news.yahoo.co.jp/articles/b0dc12baa1fb0d1ededd3615bd081ff8a1591586,11/16(日) 19:57
