scrp_date,scrp_time,genre_en,genre_jp,rank,media_jp,title,link,date_original
2024-08-20,06:05,sports,スポーツ,1,日刊スポーツ,【バレー】古賀紗理那さんすっぴん公開!?「撮る前に化粧落としちゃったよｗ」石川真佑と2S,https://news.yahoo.co.jp/articles/77a4c5ec10198e3f2ab808f2e19ebd66c3927676,8/19(月) 23:51
2024-08-20,06:05,sports,スポーツ,2,ABEMA TIMES,アイツ、やってんな！ 大谷翔平を「舐めすぎ」 相手野手が“怠慢プレー”… まさかの“爆速走塁”に球場騒然,https://news.yahoo.co.jp/articles/a237bb7335ae48dfc18582b5c6706cb56ab12171,8/19(月) 22:32
2024-08-20,06:05,sports,スポーツ,3,CoCoKARAnext,「暗黒時代に押しやった」豪ブレイキン選手の“0点パフォ”に同胞ダンサーが苦言「私たちのシーンが笑いものになった」,https://news.yahoo.co.jp/articles/5168d28e34da2e6e89c5d42d245e4daeaa63dfa6,8/20(火) 5:00
2024-08-20,06:05,sports,スポーツ,4,サンケイスポーツ,ドジャース・大谷翔平、〝文句なし弾〟でヤンキース・ジャッジに並ぶ,https://news.yahoo.co.jp/articles/ece67c032a3bb176cb2555938b14256fc018199b,8/19(月) 20:12
2024-08-20,06:05,sports,スポーツ,5,Full-Count,打席で崩れ落ちた大谷翔平のライバル　衝撃の負傷でMVP戦線に影響か…監督悲痛「つらい」,https://news.yahoo.co.jp/articles/38be99a34f072bf165495287f49c1ea06e9d8efe,8/19(月) 17:47
2024-08-20,06:05,sports,スポーツ,6,スポニチアネックス,「出雲の虹」が話題　甲子園で惜敗の大社　試合終了直後、虹かかる　「奇跡」「神様も粋なことを」の声,https://news.yahoo.co.jp/articles/cb0d00cfcb1336c003258bf2760465babfe7e513,8/19(月) 22:50
2024-08-20,06:05,sports,スポーツ,7,デイリースポーツ,「ほんと美人」「美しすぎ」リオ金の女子レスリング代表が茶髪激変　黄ワンピ＆ばっちりメークで女子力スゴ！,https://news.yahoo.co.jp/articles/06030b99ca8cd5316928bf3739ef3fc23975b98d,8/19(月) 19:29
2024-08-20,06:05,sports,スポーツ,8,ゴルフ総合サイト ALBA Net,前週Vの松山英樹は12位から6位に浮上　2年半ぶりにトップ10返り咲き【男子世界ランキング】,https://news.yahoo.co.jp/articles/a0c09ab26a5cb74721ef25dd8e4c7ddb7d5d87db,8/19(月) 15:48
2024-08-20,06:05,sports,スポーツ,9,デイリースポーツ,競技時と別人！バレー石川真佑のノースリ黒コーデがモデル感　古賀紗理那が「まゆに会ったよ♥」２ショで報告,https://news.yahoo.co.jp/articles/35d375c21471ba76bc27dd4bc1f9570eaad03891,8/19(月) 19:08
2024-08-20,06:05,sports,スポーツ,10,イーファイト,最強女子ギャビ・ガルシア、男性との禁断マッチに無念のタップ！＝試合前の“不意打ちキス”事件も,https://news.yahoo.co.jp/articles/7c41d4da438ac990d652105ad4439694b18ac3e0,8/19(月) 19:00
2024-08-20,06:05,sports,スポーツ,11,Full-Count,4強ならずも…大社応援団に「もらい泣き」　鳴り響いた手拍子にX感動の嵐「鳥肌もん」,https://news.yahoo.co.jp/articles/ae908fa90f785be65177cd7bd439cd5bc7663411,8/19(月) 20:19
2024-08-20,06:05,sports,スポーツ,12,東スポWEB,【巨人】堀内恒夫氏が１球でサヨナラ被弾の平内龍太に苦言連発「いきがって打たれた」,https://news.yahoo.co.jp/articles/4755dee8c3cffafdc7246c449f49792f91dfde98,8/19(月) 19:46
2024-08-20,06:05,sports,スポーツ,13,デイリースポーツ,大社のエース・馬庭は４戦計４９２球　石飛監督は声を詰まらせ「点差が開いたので代えたかった。３年生に聞いたら投げさせてください、と」,https://news.yahoo.co.jp/articles/0d664ddafc2458cb82026d198fe6628608448f37,8/19(月) 19:03
2024-08-20,06:05,sports,スポーツ,14,日刊スポーツ,渋野日向子、練習ラウンドでしぶこスマイル連発！前戦で涙の途中棄権も不安払拭　全英女子OP,https://news.yahoo.co.jp/articles/081eed32b5365955d9fcb45b0a11dd7e3ef6662b,8/19(月) 22:25
2024-08-20,06:05,sports,スポーツ,15,スポニチアネックス,バドミントン“ワタガシ”ペア、連覇で有終の美へ！混合で活動予定の渡辺、新相棒は「見通し立っていない」,https://news.yahoo.co.jp/articles/4ccd03c04f06411aad471c3ea0ec96bfb8a63491,8/20(火) 4:30
2024-08-20,06:05,sports,スポーツ,16,ゴルフのニュース,「気絶しました」 ツアー1勝の中国人ゴルファーが披露した超タイトな“ドレス姿”にファン卒倒,https://news.yahoo.co.jp/articles/8704b58d03b3a3b3a1bfb1b5160e451ffce3bca8,8/19(月) 20:10
2024-08-20,06:05,sports,スポーツ,17,FITNESS LOVE,「びっくりしちゃうくらいお尻の仕上がりが良かった」　27歳・エステサロン経営者が健康美ボディコンテストで活躍,https://news.yahoo.co.jp/articles/1b8c1a98c344809294fe395aa3cced62ac223783,8/20(火) 5:00
2024-08-20,06:05,sports,スポーツ,18,朝日新聞デジタル,大社旋風はファンの心に　エース馬庭「大きな3勝を手にできた」,https://news.yahoo.co.jp/articles/d9c5cf294e857ef1743482b3ee5215a1569b7ffd,8/19(月) 21:30
2024-08-20,06:05,sports,スポーツ,19,スポーツ報知,宮田笙子、８月２６日インカレ欠場　エントリーに名前もメンバー変更へ　“復帰戦”は先送り,https://news.yahoo.co.jp/articles/eead63eaf14f609b49684307e295f9b16927ca3c,8/20(火) 4:00
2024-08-20,06:05,sports,スポーツ,20,スポーツ報知,【甲子園】大社、４強ならずもネット沸騰「興奮と感動をありがとう！！」「青春すぎてずっと泣きながら見てる…」,https://news.yahoo.co.jp/articles/98f8f7a71f300c6bc2778e6d0ba94492740b8249,8/19(月) 18:31
2024-08-20,06:05,sports,スポーツ,21,デイリースポーツ,パリ五輪銀メダルの１７歳　帰国便は「ビジネスクラス」に！！「快適でした」感動した部分も明かす,https://news.yahoo.co.jp/articles/427b950680f329c10b0f529e9d51370c9c5ddde6,8/20(火) 0:03
2024-08-20,06:05,sports,スポーツ,22,東スポWEB,【卓球】陳夢への中指、誹謗中傷が物議の中国　卓球協会が声明「法的責任を追求する」,https://news.yahoo.co.jp/articles/f786dd520563a1c2e8618653626963e7571fccec,8/19(月) 15:26
2024-08-20,06:05,sports,スポーツ,23,日刊スポーツ,「かわいい」話題のパリ五輪競泳３冠マッキントッシュ、18歳誕生日を報告　友人らと水着で笑顔,https://news.yahoo.co.jp/articles/b4cd5d8788d656b982b4c878c31930dc2cf6f815,8/19(月) 23:42
2024-08-20,06:05,sports,スポーツ,24,スポニチアネックス,スポクラ楢崎智亜　現役続行を明言「最後にもう一度、挑戦します」　ロス五輪でのリベンジ誓う,https://news.yahoo.co.jp/articles/b885a58b32baa939e72ec021432447e0b3abf764,8/19(月) 22:15
2024-08-20,06:05,sports,スポーツ,25,FITNESS LOVE,「おしり四角いね」と彼に言われてジムに入会　丸いヒップをつくりあげてコンテスト初出場,https://news.yahoo.co.jp/articles/37db75c74ae8224751346e1f6da322272a006cb9,8/19(月) 7:10
2024-08-20,06:05,sports,スポーツ,26,スポーツ報知,好きな選手は「Ｓｈｏｈｅｉ　Ｏｈｔａｎｉ」敵軍ファンも大谷に憧れるのはやめられない…２年連続４０号へ王手,https://news.yahoo.co.jp/articles/e072d80ed1975008d3b9b26d40fa081b637d72c1,8/20(火) 5:10
2024-08-20,06:05,sports,スポーツ,27,読売新聞オンライン,「最後まで馬庭を見ていたい、でもこれ以上投げさせたくない」「正直揺れました」大社・石飛文太監督インタビュー,https://news.yahoo.co.jp/articles/497145a949e1365b4effaf975b4b9d2816190719,8/20(火) 5:01
2024-08-20,06:05,sports,スポーツ,28,GOAL,ギュンドアン、今季レギュラー落ちを宣告されたために移籍を検討か…バルセロナはフリーで放出する方針とスペイン紙報道,https://news.yahoo.co.jp/articles/bc5a9a43319054310b727a7b0a9061af909d687e,8/20(火) 0:50
2024-08-20,06:05,sports,スポーツ,29,ABEMA TIMES,大谷翔平の弾丸39号アーチで「泣きそう」 被弾した瞬間にフラフラ… 相手投手がドン引き「また被害者の会か」,https://news.yahoo.co.jp/articles/8281523f869b57a6d72cd9b4239d79e8b5f7a61a,8/19(月) 23:46
2024-08-20,06:05,sports,スポーツ,30,東スポWEB,【阪神】岡田監督が先発ローテ大改革　どう出る「右左右」から「右右右→左左左」へ,https://news.yahoo.co.jp/articles/bb3be6c882c66e205c2ed1c706846beee2c1955e,8/20(火) 5:16
2024-08-20,06:05,sports,スポーツ,31,Full-Count,異次元の.443…DeNA24歳は「最高の1番打者」　“法則無視弾”に衝撃「大谷を彷彿」,https://news.yahoo.co.jp/articles/d98263cdc9d389d344cdb6e209e1f724fd790e6c,8/19(月) 7:55
2024-08-20,06:05,sports,スポーツ,32,中日スポーツ,雨の甲子園スタンドで傘目立つ「カッパにしていただけると」「周囲のお客さんに邪魔なのと危険なんだよな」,https://news.yahoo.co.jp/articles/90753b558125fc267290d8697b1b5164d234c54b,8/19(月) 21:00
2024-08-20,06:05,sports,スポーツ,33,スポーツ報知,東野有紗「新しい挑戦」女子ダブルスでロス五輪出場へ　桜本絢子と新ペア　渡辺勇大はまだ見通し立たず…バドミントン,https://news.yahoo.co.jp/articles/72b24d7f75a481385e0a5f9cd4234ce422016fc7,8/19(月) 20:00
2024-08-20,06:05,sports,スポーツ,34,ゴルフダイジェスト・オンライン（GDO）,全英女子で日本勢史上最多19人 古江彩佳、渋野日向子らセントアンドリュース挑戦,https://news.yahoo.co.jp/articles/965046c6da7eff357796e8268f020ff17ef3e801,8/20(火) 5:06
2024-08-20,06:05,sports,スポーツ,35,日刊スポーツ,大谷翔平、メジャー史上６人目の「40－40」へ本塁打でリーチ「打撃の質が好き」ロバーツ監督,https://news.yahoo.co.jp/articles/92d64193aa5fa089dd2cd131f1bf36bb75a4a3e5,8/19(月) 19:30
2024-08-20,06:05,sports,スポーツ,36,スポニチアネックス,大谷争奪戦に敗れ、現在最下位のブルージェイズ、問題は「次の手を全く考えていなかったこと」と選手発言,https://news.yahoo.co.jp/articles/61b60497483df8cf1e733eda43043f8d7f4d77d9,8/20(火) 5:33
2024-08-20,06:05,sports,スポーツ,37,スポーツ報知,ロッテ・佐々木朗希の今オフメジャー移籍は断念か、米報道「もう１シーズン日本にとどまる可能性がある」,https://news.yahoo.co.jp/articles/92d620368d862ee7ce962e8f0d54a5b9959b4951,8/19(月) 19:55
2024-08-20,06:05,sports,スポーツ,38,東スポWEB,【巨人】一塁・岡本和、捕手・大城の固定を！　伊原春樹氏が提言「４番の打撃に影響しては本末転倒」,https://news.yahoo.co.jp/articles/e46c610c025d3c1a6d8e4996a4fed9becd33f21e,8/20(火) 5:16
2024-08-20,06:05,sports,スポーツ,39,GOAL,ラ・リーガ初戦を落としたソシエダ、イマノル「優れたFWがやって来てほしい。来ないならば今のメンバーで最大限努力する」,https://news.yahoo.co.jp/articles/f1ed81399c2cf1750faa1b5214256b5107a18c59,8/19(月) 23:49
2024-08-20,06:05,sports,スポーツ,40,サッカーキング,なでしこMF北川ひかる、女子CLベスト8のスウェーデン1部強豪BKヘッケンへ移籍「アシストやゴールを決めてチームに貢献したい」,https://news.yahoo.co.jp/articles/7629cbcdcfebcc22211208177f26e73a549b9eea,8/19(月) 18:59
