scrp_date,scrp_time,genre_en,genre_jp,rank,media_jp,title,link,date_original
2025-05-08,23:07,TTL,総合,1,FNNプライムオンライン,「先生がやられたから逃げるしかなかった」小2授業中の教室に20代と40代の男が侵入し担任に暴行　逮捕の男2人は児童の母親の友人　東京・立川市立第三小学校,https://news.yahoo.co.jp/articles/307356bf7988bb1533267fa96da403545928a728,5/8(木) 19:52
2025-05-08,23:07,TTL,総合,2,J-CASTニュース,社長が従業員を殴る蹴る...暴行動画がネット拡散　札幌の建設会社側「補償のため示談したい」、支援のバスケチームは契約解除,https://news.yahoo.co.jp/articles/4720655693b66af72abf01e6ad35dfe8fbbd30e1,5/8(木) 18:25
2025-05-08,23:07,TTL,総合,3,Full-Count,14億円の前田健太を「獲得する球団は出てこない」　米メディア語る“本音”「急落した」,https://news.yahoo.co.jp/articles/70ca64fbcdee28b519d04f56d04c87612e841826,5/8(木) 19:51
2025-05-08,23:07,TTL,総合,4,東海テレビ,実は“適応障害の一種”…GW明けに気を付けたい『五月病』を防ぐには 規則正しい生活や休養などが重要に,https://news.yahoo.co.jp/articles/717da7846c17777b3f2f26ab6f4890e4b525b52d,5/8(木) 6:35
2025-05-08,23:07,TTL,総合,5,テレビ朝日系（ANN）,小学校に男ら侵入・暴行なぜ？　きっかけは“児童間のトラブル”,https://news.yahoo.co.jp/articles/b23a468e4208632749811ca5e1de7e7c253c1111,5/8(木) 20:01
2025-05-08,23:07,TTL,総合,6,デイリースポーツ,阪神伝説助っ人の孫が豪快ホームラン　ルーキーリーグのプロ初打席で　祖父はセシル、父はプリンスの２０歳、ジェイディン・フィルダー,https://news.yahoo.co.jp/articles/df974d59fc525a98320e033a533df3d694c28715,5/8(木) 18:59
2025-05-08,23:07,TTL,総合,7,東スポWEB,前田健太のタイガース解雇に地元メディアが大喜び「新時代を祝おう！」「これを願っていた」,https://news.yahoo.co.jp/articles/14d1bc17034bb47abb0367edceb968f23287befe,5/8(木) 13:11
2025-05-08,23:07,TTL,総合,8,HugKum,【東大王 伊藤七海さん】小中高と公立・塾なし、現役で東大合格！ 両親の教育方針は「先取り学習はしない」“自分で努力する力”が育ったワケ,https://news.yahoo.co.jp/articles/1692a6abeb61386a164d97c2668a0542b56ce197,5/8(木) 21:20
2025-05-08,23:07,TTL,総合,9,テレビ朝日系（ANN）,【トランプ政権が方針転換】プーチン氏に圧力強化　“ロシア寄り”からの路線変更に“ある人物”の存在　ウクライナ和平交渉,https://news.yahoo.co.jp/articles/1226b296e12585ee1c918eb8be88748cbb0512d2,5/8(木) 17:02
2025-05-08,23:07,TTL,総合,10,日刊スポーツ,白スーツ姿の愛子さまをお迎えした写真、吉村洋文知事が投稿「背中から緊張感が伝わってくる」,https://news.yahoo.co.jp/articles/24a713e4e97833797dd7215867ff794d0feb0d1b,5/8(木) 20:07
2025-05-08,23:07,TTL,総合,11,日刊スポーツ,ルメール騎手が「次のダービー馬」と言った今年の騎乗馬は…ひと足先に“公表”,https://news.yahoo.co.jp/articles/bf80a258b1f9d1fd55c0b004f7e04dd3a8b089e3,5/8(木) 13:14
2025-05-08,23:07,TTL,総合,12,ENCOUNT,フォロワー16万人の人気グラドル、最新の体重を赤裸々告白　ネット衝撃「すげぇな」「土俵入りは…」,https://news.yahoo.co.jp/articles/8943a1346531fd830af26127f13d0ec532677b15,5/8(木) 17:15
2025-05-08,23:07,TTL,総合,13,ねとらぼ,「女の子みたいな顔だね」と言われ続けた男の子、20歳になったら→「神がかってる」姿に驚がく　「人体の不思議」「オーラが凄い」,https://news.yahoo.co.jp/articles/9a09874c0f76dd4ecb7e94786de2fe2a893b78db,5/8(木) 21:00
2025-05-08,23:07,TTL,総合,14,J-CASTニュース,6年半交際した人気カップルYouTuber、号泣しながら破局を報告 別れの理由は「とてつもない大きな何かというよりは...」,https://news.yahoo.co.jp/articles/ca1ffbf2403d0d66abd565da8714bb8060ac1bf1,5/8(木) 16:30
2025-05-08,23:07,TTL,総合,15,毎日新聞,東京・立川の小学校侵入　いじめ対応を巡るトラブルが背景か,https://news.yahoo.co.jp/articles/4bac2b8871328c73a60baede4d9104f64200b3d3,5/8(木) 18:55
2025-05-08,23:07,TTL,総合,16,モデルプレス,人気バンドの元ボーカル、サプリ過剰摂取で緊急入院 高カルシウム血症で「十分死ねる数値だった」,https://news.yahoo.co.jp/articles/0ae9dd1ed2fea97ad00c3ae32918b32426d3b7e7,5/8(木) 19:48
2025-05-08,23:07,TTL,総合,17,スポニチアネックス,豊川悦司のめい、人気K－POPアイドルだった　事務所認める　日プも出演「あの俳優さんはおじです」,https://news.yahoo.co.jp/articles/05d62675e7c7d92852daa204a90f0631b9103d04,5/8(木) 21:27
2025-05-08,23:07,TTL,総合,18,読売新聞オンライン,立川小学校襲撃、男２人は瓶をたたきつけ椅子で担任殴る…児童間トラブルで面談した母親と来校,https://news.yahoo.co.jp/articles/0118caa564b91783a3feea805132498f5815eade,5/8(木) 20:33
2025-05-08,23:07,TTL,総合,19,東スポWEB,ドジャース・ベッツ　闘病後のプレーを自ら酷評「ゴミ」「僕は大谷翔平じゃない」＝現地報道,https://news.yahoo.co.jp/articles/a626388de90be4615bb55c13afa5712d2145466f,5/8(木) 18:36
2025-05-08,23:07,TTL,総合,20,スポーツ報知,告白物議の与沢翼氏「日本に帰国しました」最新ショットに驚きの声「え？」「心配」「無事で…」,https://news.yahoo.co.jp/articles/b0a97b34179bed7d83f0eec290bdf96fcdf55325,5/8(木) 19:55
2025-05-08,23:07,TTL,総合,21,スポニチアネックス,与沢翼氏、緊急帰国を報告「理由があって…ヤバい人帰ってきました。申し訳ありません」,https://news.yahoo.co.jp/articles/0287e5bf8205e8f946f83074425559771955314d,5/8(木) 18:34
2025-05-08,23:07,TTL,総合,22,ねとらぼ,豊川悦司、19歳の人気アイドルに“祝花”贈りファンざわつく→アイドルが“まさかの関係性”を明かし「まじかよ」「やばすぎ」と話題に,https://news.yahoo.co.jp/articles/eff49f8bed14d0317a8f6425386ea8ab15a93850,5/8(木) 19:01
2025-05-08,23:07,TTL,総合,23,TNCテレビ西日本,【速報】小学校の敷地内で男子児童が普通乗用車にはねられる　女性が運転し発進した際に衝突か　児童は下校中とみられる　山口・下関市,https://news.yahoo.co.jp/articles/ac64a805cf17754ae1214e3bb060d7f17bb56128,5/8(木) 17:52
2025-05-08,23:07,TTL,総合,24,スポニチアネックス,カズレーザー、もし今就活生だったら？「絶対に入りたくない！！」企業を実名告白,https://news.yahoo.co.jp/articles/de98c420b11534ad4ca3e22fb0474bcbc0a69a06,5/8(木) 20:18
2025-05-08,23:07,TTL,総合,25,FNNプライムオンライン（フジテレビ系）,【速報】「子供が体育館に向かって逃げる姿と助けを求める声…」東京・立川市の小学校に男2人侵入した暴行事件で市教委が会見「児童の安全を全力で守って下さった教職員に感謝」,https://news.yahoo.co.jp/articles/fb183cf10fb8926d341f4ce9433c516d5f532caa,5/8(木) 16:02
2025-05-08,23:07,TTL,総合,26,日刊スポーツ,オンラインカジノ、NPB調査で８球団16人判明　オリックス山岡は不起訴で６日初登板／経緯,https://news.yahoo.co.jp/articles/17e81cfad63f03e3b507c10125306c318e9c4206,5/8(木) 18:05
2025-05-08,23:07,TTL,総合,27,Full-Count,米で際立つ日本人の「0.90＆1.16」　3位も置き去り…“2強”状態に騒然「バケモンたち」,https://news.yahoo.co.jp/articles/70e539bf464ef4b0021a2202f00fc303f89f2616,5/8(木) 17:12
2025-05-08,23:07,TTL,総合,28,ねとらぼ,セールで6万5000円だった憧れの古代魚を、17年育てたら……“黄金の龍”に化けた鳥肌ものの姿に「生きた化石」「すげえかっこいい」,https://news.yahoo.co.jp/articles/04447a8f0d7b1597ce73969d6d1326f1a4a62d10,5/8(木) 21:35
2025-05-08,23:07,TTL,総合,29,スポーツ報知,活動再開の３６歳美人女優、透明感あふれる超どアップ最新ショットが衝撃「綺麗すぎ」「ずっと見ていたい」「美しすぎて…」,https://news.yahoo.co.jp/articles/dc39cdf1f375a31aa178c33b74fde30752b5b7dd,5/8(木) 20:55
2025-05-08,23:07,TTL,総合,30,FNNプライムオンライン,大学生を3回切りつけ逮捕の戸田佳孝容疑者（43）数年前に長野県移住、地元の人と交流も…地下鉄「東大前駅」をパニックに陥れる,https://news.yahoo.co.jp/articles/48f2c02a4f7b7ff0a0a6760bdcb7b8a91f90cb75,5/8(木) 20:37
2025-05-08,23:07,TTL,総合,31,日刊スポーツ,伝説的インディーズバンドのボーカルが死去　大槻ケンヂら追悼「美意識が高い人だなと…」,https://news.yahoo.co.jp/articles/4f8acf6ac51fa4768d137b9fb40e734e864fb58b,5/8(木) 17:33
2025-05-08,23:07,TTL,総合,32,スポーツ報知,父親は小日向文世　イケメン息子が雰囲気そっくり！２９歳芸能活動中…フジ月９にも出演,https://news.yahoo.co.jp/articles/a7c3f45a7ed3264b1522d954de1e929d798e4081,5/8(木) 15:03
2025-05-08,23:07,TTL,総合,33,ENCOUNT,BreakingDownの“歌舞伎町最強ホスト”、母親顔出しにネット仰天「本当に？お母さん？若すぎて彼女に見える」,https://news.yahoo.co.jp/articles/e484333ee832ee1363154e4e895e73ff0cb5b05a,5/8(木) 21:30
2025-05-08,23:07,TTL,総合,34,ベースボールキング,谷繁元信さんが「平成の右打者最強だと思っている」と話した選手は？,https://news.yahoo.co.jp/articles/c19a14f9692fdb7819c7cbe3209fa7ae446f51e4,5/8(木) 19:33
2025-05-08,23:07,TTL,総合,35,CoCoKARAnext,巨人27歳外野手は「救世主になってくれそう」3番起用も話題　「巨人に来てくれてありがとう」,https://news.yahoo.co.jp/articles/affec4372d3f85016bcb20b280cbebd586350938,5/8(木) 17:41
2025-05-08,23:07,TTL,総合,36,ABCニュース,【速報】万博イタリアパビリオンでミケランジェロの「復活のキリスト」展示へ　５月１８日から万博閉幕の１０月１３日まで,https://news.yahoo.co.jp/articles/d348fc711ab27d307c189e94737c631274f83a0a,5/8(木) 19:05
2025-05-08,23:07,TTL,総合,37,時事通信,持久走で中1男子倒れ死亡　体育の授業　京都,https://news.yahoo.co.jp/articles/60105a630362c64e2f03d0ea4c18bb546b2dd26d,5/8(木) 18:06
2025-05-08,23:07,TTL,総合,38,ABCニュース,【速報】京都・京丹後市の中学1年生が体育で1500メートル走を走っている途中に倒れ、搬送先の病院で亡くなる　死因は調査中,https://news.yahoo.co.jp/articles/a97a27edaf61d4a997a42ad5e02f640e0b0af6d4,5/8(木) 15:14
2025-05-08,23:07,TTL,総合,39,スポーツ報知,大御所芸能人の年下妻　別人のような姿に衝撃「めっちゃかわいい」「透明感」衝撃婚から１４年,https://news.yahoo.co.jp/articles/a0a744415adb2c7cdb48b6312e163b28cb7bcde9,5/8(木) 13:47
2025-05-08,23:07,TTL,総合,40,スポニチアネックス,ひろゆき氏「日本ってすげえな」と思うこと「フランスだったら捕まる」,https://news.yahoo.co.jp/articles/d643083877a7beab283f5d4a99633de3808df1c0,5/8(木) 17:50
