scrp_date,scrp_time,genre_en,genre_jp,rank,media_jp,title,link,date_original
2024-10-22,14:06,sports,スポーツ,1,日刊ゲンダイDIGITAL,巨人がマエケン獲得へ！カープ復帰は望み薄《夫人も在京志向できっと巨人》と広島OBも悲観的,https://news.yahoo.co.jp/articles/d212fc553799df5709de61fcc2e7bff7447b12ac,10/22(火) 11:39
2024-10-22,14:06,sports,スポーツ,2,デイリースポーツ,日本ハムが江越大賀、黒木優太ら４選手に戦力外通告と発表　現役続行は「家族と相談しながら」と江越、新庄監督には「感謝しかない」,https://news.yahoo.co.jp/articles/ce8aa28e1a5148074d4025546d9fbd70fcefe03d,10/22(火) 13:00
2024-10-22,14:06,sports,スポーツ,3,Full-Count,DeNA・石川達也が戦力外…今季15登板で防御率1.93　日本S進出翌日、下園2軍打撃コーチも退団,https://news.yahoo.co.jp/articles/a77b87ccc72fce786199be475bd04651fc18d710,10/22(火) 11:05
2024-10-22,14:06,sports,スポーツ,4,スポーツ報知,【巨人】 岡本和真が月間ＭＶＰ「優勝を決めた月にとれたのはすごくうれしい」…自身３度目の選出,https://news.yahoo.co.jp/articles/0a0dd9190b6de61186206bc7decb00b9774883c3,10/22(火) 13:00
2024-10-22,14:06,sports,スポーツ,5,日刊ゲンダイDIGITAL,日本ハム新庄監督「このまま退団」なら…球団、選手、コーチはドン引き＆大ヒンシュクだ,https://news.yahoo.co.jp/articles/7d2b5cfee66309cfd12de299d8fec63650c2f15f,10/22(火) 9:06
2024-10-22,14:06,sports,スポーツ,6,デイリースポーツ,西武が来季コーチ陣を発表　仁志野手チーフ兼打撃コーチ、大引内野守備走塁コーチ、辻２軍野手コーチを外部から招へい【一覧】,https://news.yahoo.co.jp/articles/19418db195ee37bddb61badd7a1f927e93eb292a,10/22(火) 13:15
2024-10-22,14:06,sports,スポーツ,7,ABEMA TIMES,こんなカーショー見たことない！ ド軍の“MVP”4番、執念の逆転打に大絶叫…カメラが捉えたド軍ナイン歓喜の一部始終,https://news.yahoo.co.jp/articles/b7b3206319a2ffd1017c569848ec372aa323d979,10/22(火) 11:54
2024-10-22,14:06,sports,スポーツ,8,Full-Count,大谷翔平獲り失敗→不良債権化した大砲　NY紙が手のひら返し、ヤ軍480億円男が覆した評価,https://news.yahoo.co.jp/articles/b26ffeaf36be374b9b5497773da0bc87a170dd0b,10/22(火) 10:31
2024-10-22,14:06,sports,スポーツ,9,スポニチアネックス,グリズリーズ河村勇輝　開幕戦ベンチ入り確定！日本人4人目のNBA選手誕生なるか　開幕ロースター発表,https://news.yahoo.co.jp/articles/fa680ce277e5bb0267dc3e6f09dd4f2ae8dbd7d4,10/22(火) 10:08
2024-10-22,14:06,sports,スポーツ,10,RCC中国放送,ドラフト会議　12球団の1位指名を天谷宗一郎さんが予想　宗山塁（明治大）は4球団競合か　金丸夢斗（関西大）に5球団?,https://news.yahoo.co.jp/articles/14c29e3b7620d819def0f33f83cda10a9937f4cd,10/22(火) 12:01
2024-10-22,14:06,sports,スポーツ,11,中日スポーツ,【日本ハム】江越大賀外野手ら4選手に戦力外通告…新庄監督の強い希望でトレードで阪神から加入,https://news.yahoo.co.jp/articles/a5b827f7ea7410e572a778ef07e6e7a2cb5c08b7,10/22(火) 13:22
2024-10-22,14:06,sports,スポーツ,12,スポニチアネックス,日本ハムが戦力外通告…江越大賀、福田光輝、黒木優太、安西叶翔　江越は現役続行を熟慮,https://news.yahoo.co.jp/articles/8720b0948cd483748f2a4f0e7293c21a26da0949,10/22(火) 13:03
2024-10-22,14:06,sports,スポーツ,13,日刊スポーツ,【日本ハム】江越大賀、黒木優太、福田光輝のトレード加入組に戦力外通告　安西叶翔には育成打診,https://news.yahoo.co.jp/articles/d1a1fe501325df7471ec6639b964efc7101f38d6,10/22(火) 13:00
2024-10-22,14:06,sports,スポーツ,14,J-CASTニュース,巨人「FA獲得調査」報道の甲斐拓也＆大山悠輔　ネットでファン反応「大山どこ守らせる？」「せっかく岸田が育ち始めてるのに」,https://news.yahoo.co.jp/articles/4d579684d9f6d2cdef4f1f01072647597b66eb0b,10/22(火) 11:29
2024-10-22,14:06,sports,スポーツ,15,CoCoKARAnext,【巨人】虎の主砲、大山悠輔を獲得調査報道　禁断のTG移籍は実現するか　「本気度」と「実行例」とは,https://news.yahoo.co.jp/articles/bfe9a56bd0364fa90ee49bc68457c86201a4917b,10/22(火) 11:35
2024-10-22,14:06,sports,スポーツ,16,日刊スポーツ,【日本ハム】戦力外の江越大賀「特に驚きとかはないです」新庄監督には「感謝」今後は未定,https://news.yahoo.co.jp/articles/feb7fe32e0c37589bbd2629a4ecf98cddf0ca2f7,10/22(火) 13:00
2024-10-22,14:06,sports,スポーツ,17,Full-Count,ベッツが明かす大谷翔平の「熱い思い」　ド軍移籍の“真相”激白「大好きなんだ」,https://news.yahoo.co.jp/articles/7d606ab5f60b2e0ffade0d4b8f36188319bf0b41,10/22(火) 7:50
2024-10-22,14:06,sports,スポーツ,18,Full-Count,西武が来季のコーチ陣発表　仁志敏久氏や大引啓次氏らが入閣…4人が新任,https://news.yahoo.co.jp/articles/24b2c1638d37962018a1ddc1d6436c934c9acb98,10/22(火) 13:06
2024-10-22,14:06,sports,スポーツ,19,日刊スポーツ,ドジャース夫人会が歓喜の写真を多数公開　WS進出決定に家族も選手も笑顔はじける,https://news.yahoo.co.jp/articles/0f8a806dde8f7e126b521410c5609ca2411c83c4,10/22(火) 12:24
2024-10-22,14:06,sports,スポーツ,20,ゴルフ総合サイト ALBA Net,へ～っ、体幹ってこう鍛えればいいのか！ 体を「板」のようにピーンで飛距離アップ！,https://news.yahoo.co.jp/articles/4c37ef155b80494acb668678306504ef267bcbad,10/22(火) 11:45
2024-10-22,14:06,sports,スポーツ,21,Full-Count,日本ハム、4選手の戦力外を発表…打率.000の江越、吉田輝星のトレードで加入の黒木ら,https://news.yahoo.co.jp/articles/680ff2f45340ce5042aa67d6effdbbb7826fb84d,10/22(火) 13:03
2024-10-22,14:06,sports,スポーツ,22,CoCoKARAnext,若き怪物ソトに大谷翔平の1015億円を超える可能性　米誌はドジャースとの電撃契約も指摘「金銭的な障害はない」,https://news.yahoo.co.jp/articles/312af3f0f75dd7a367e811fcd9a5468f0cb610f5,10/22(火) 11:01
2024-10-22,14:06,sports,スポーツ,23,読売新聞オンライン,ドジャースとヤンキースのワールドシリーズ、試合開始時刻を発表…ＮＨＫとフジテレビが生中継,https://news.yahoo.co.jp/articles/35c1984cdc019115c75f2ff6bb6fcce927d9809c,10/22(火) 10:38
2024-10-22,14:06,sports,スポーツ,24,デイリースポーツ,「地上波ばっさり終わったな」ＤｅＮＡが下剋上　日テレ地上波中継も勝利監督インタビューなく大谷Ｖの緊急放送に　ＳＮＳ憤り「失礼」「これは良くない」,https://news.yahoo.co.jp/articles/0b8e7e1f2252c8df82e717d5ebfeb7493df02dcc,10/21(月) 22:03
2024-10-22,14:06,sports,スポーツ,25,スポニチアネックス,NY紙　ヤ軍―ド軍のWSは「スターウォーズ」待望の対決に「MLBの重役は口に出さないかもしれないが」,https://news.yahoo.co.jp/articles/10db5afa9147ca11712757d6804f48650ab5b85a,10/22(火) 12:58
2024-10-22,14:06,sports,スポーツ,26,高校野球ドットコム,横浜高出身の大卒4年目左腕がドラフト直前に戦力外…今季は一軍で防御率1.95の好成績,https://news.yahoo.co.jp/articles/9b8a85551f3d7237fda8cdb820dc2b2e07851d6d,10/22(火) 13:18
2024-10-22,14:06,sports,スポーツ,27,デイリースポーツ,激震の監督解任から１年　なぜ４月就任の前駒大コーチが立大を箱根予選１位に導けたのか,https://news.yahoo.co.jp/articles/f34c2d6b8785a4870ce1c6a9c4c3d59826d7015b,10/22(火) 10:00
2024-10-22,14:06,sports,スポーツ,28,CoCoKARAnext,なぜ大谷翔平と勝負？ 得点圏打率「8割超え」なのに敵球団が避けない理由をMLB通算213勝の大投手が分析「どうやっても無理だ」,https://news.yahoo.co.jp/articles/11f644077be31c69b8139989a19c7d1be43ed829,10/22(火) 7:01
2024-10-22,14:06,sports,スポーツ,29,高校野球ドットコム,ソフトバンクは“最強投手陣に割って入れる”159キロ右腕を1位指名せよ！ポジション補強よりも才能重視で【12球団ドラフト指名予想】,https://news.yahoo.co.jp/articles/2aedb9ae7fc259e1da33f6b798173731fdbf17cb,10/22(火) 13:00
2024-10-22,14:06,sports,スポーツ,30,高校野球ドットコム,中日は1位も2位も投手を狙え！ 3位で将来の中軸・モイセエフ獲得を【12球団ドラフト指名予想】,https://news.yahoo.co.jp/articles/73fe2342bb98ffb9a3d9ba14140b4a4131c20db2,10/22(火) 13:01
2024-10-22,14:06,sports,スポーツ,31,RONSPO,「若手の成長は見えたが“下剋上”許すは恥。リーグ優勝の価値も下がる」巨人大物OBが横浜DeNAに敗れて日本シリーズ進出を逃した“古巣”に苦言,https://news.yahoo.co.jp/articles/d62992b97b4e41eba2b823b1891cf454bd4b90d2,10/22(火) 7:33
2024-10-22,14:06,sports,スポーツ,32,日刊ゲンダイDIGITAL,巨人がドラフト外れ1位の“隠し玉”に…「九州の大谷二世」の評判と実力,https://news.yahoo.co.jp/articles/1a08c4a09c19fe1e0ea75fdd75ebde7edb6742cd,10/22(火) 9:06
2024-10-22,14:06,sports,スポーツ,33,スポニチアネックス,ソフトバンク　吉本2軍打撃コーチらの退団を発表,https://news.yahoo.co.jp/articles/216d51f63ade933ac5234fbba24abb3ae17c9e74,10/22(火) 12:43
2024-10-22,14:06,sports,スポーツ,34,中日スポーツ,藤田菜七子元騎手の事件は、厩舎人とみられる通信相手側の調査をJRAが結果で示すべきだ【競馬】,https://news.yahoo.co.jp/articles/e30e5ee68af58f2f6406ed8003890dbb324428f0,10/22(火) 6:00
2024-10-22,14:06,sports,スポーツ,35,Full-Count,ド軍戦にいたデコピン、わずかな変化にX注目「たまらん」　大谷との2Sで発見「気づかなかった」,https://news.yahoo.co.jp/articles/80facf541974f978141cb256d443a8a6c07dfb65,10/22(火) 11:58
2024-10-22,14:06,sports,スポーツ,36,ABEMA TIMES,「こえぇ…ちびるわ」世界最速ラリーカー、工場の“間を”160キロで駆け抜ける狂気の瞬間 「はえー」視聴者驚愕,https://news.yahoo.co.jp/articles/4fe2271ad8d7eb243b8c3667cb96818b8b46d3e8,10/22(火) 11:46
2024-10-22,14:06,sports,スポーツ,37,産経新聞,巨人・桑田のクセを丸裸にした打撃職人、和田豊氏が佐藤輝の覚醒を後押しする　「鬼筆」越後屋のトラ漫遊記,https://news.yahoo.co.jp/articles/423075decbdaaefd885419b9968b18d3af894ffe,10/22(火) 11:50
2024-10-22,14:06,sports,スポーツ,38,サンケイスポーツ,阪神・藤川球児監督、ヘッドコーチ〝兼任〟　来季コーチ陣発表　各部門にチーフを配置,https://news.yahoo.co.jp/articles/111ea4929c71d45f328ac8f52a1b322db6dbc3bb,10/22(火) 7:30
2024-10-22,14:06,sports,スポーツ,39,デイリースポーツ,ＤｅＮＡが石川達也投手に戦力外通告と発表　今オフ１１人目　第２次通告期間がこの日から始まる,https://news.yahoo.co.jp/articles/1dbd28648ec36ce46a70c94ba915f87c7a0dcf23,10/22(火) 11:11
2024-10-22,14:06,sports,スポーツ,40,スポーツ報知,【日本ハム】江越大賀、黒木優太、福田光輝が戦力外　安西叶翔には育成契約打診,https://news.yahoo.co.jp/articles/9262a1b36e4a83a1952ce5cde8e141c0fe0e6b20,10/22(火) 13:00
