scrp_date,scrp_time,genre_en,genre_jp,rank,media_jp,title,link,date_original
2024-10-22,16:07,TTL,総合,1,日刊ゲンダイDIGITAL,巨人がマエケン獲得へ！カープ復帰は望み薄《夫人も在京志向できっと巨人》と広島OBも悲観的,https://news.yahoo.co.jp/articles/d212fc553799df5709de61fcc2e7bff7447b12ac,10/22(火) 11:39
2024-10-22,16:07,TTL,総合,2,スポーツ報知,「放送禁止用語かと」大竹しのぶ　昼の生放送でまさかの発言　慌てて口押さえる→ＣＭ突入「爆笑した」ネット騒然,https://news.yahoo.co.jp/articles/090df6329a9cc7d10f9c2351c6bc30779f1c16bb,10/22(火) 13:35
2024-10-22,16:07,TTL,総合,3,スポニチアネックス,詐欺受け子で実刑判決の俳優「まだファンでいてくれる貴方へ」直筆手紙公開　刑務所入りまで「お願い」,https://news.yahoo.co.jp/articles/bf121b0b79b63f5a0d801a4f1c85d85297400e83,10/22(火) 13:18
2024-10-22,16:07,TTL,総合,4,ほ・とせなNEWS,生後10ヶ月…医師「一生歩けないし、笑うこともない」その後25歳になった今。大学講師を目指す彼「自分を諦めない」その強い思いに迫る,https://news.yahoo.co.jp/articles/156896282db024aa2aa6c35cc596fd30bff8b0e4,10/22(火) 13:00
2024-10-22,16:07,TTL,総合,5,デイリースポーツ,中居正広　デビュー当時「尋常じゃなく怖かった！」大物芸人を実名告白「挨拶もしてくんないの」くわえタバコで睨み付け無言,https://news.yahoo.co.jp/articles/7c68ba6381754a815a6e7f7b19682dc12ea4aa46,10/22(火) 11:14
2024-10-22,16:07,TTL,総合,6,RCC中国放送,ドラフト会議　12球団の1位指名を天谷宗一郎さんが予想　宗山塁（明治大）は4球団競合か　金丸夢斗（関西大）に5球団?,https://news.yahoo.co.jp/articles/14c29e3b7620d819def0f33f83cda10a9937f4cd,10/22(火) 12:01
2024-10-22,16:07,TTL,総合,7,デイリースポーツ,西武が来季コーチ陣を発表　仁志野手チーフ兼打撃コーチ、大引内野守備走塁コーチ、辻２軍野手コーチを外部から招へい【一覧】,https://news.yahoo.co.jp/articles/19418db195ee37bddb61badd7a1f927e93eb292a,10/22(火) 13:15
2024-10-22,16:07,TTL,総合,8,スポーツ報知,「別人か？」朝ドラ俳優　ビジュアル激変「同じ人と思えない」「全く違う」とネット仰天,https://news.yahoo.co.jp/articles/51d1b07b690024699a15d9a1b02665af61933029,10/22(火) 12:20
2024-10-22,16:07,TTL,総合,9,日刊スポーツ,ドジャース夫人会が歓喜の写真を多数公開　WS進出決定に家族も選手も笑顔はじける,https://news.yahoo.co.jp/articles/0f8a806dde8f7e126b521410c5609ca2411c83c4,10/22(火) 12:24
2024-10-22,16:07,TTL,総合,10,日刊ゲンダイDIGITAL,名優・西田敏行さんの体を蝕んだ鯨飲馬食…焼き肉&ビールこよなく愛し、たばこは1日80本以上,https://news.yahoo.co.jp/articles/9d60e46d42ccf16d279fe740a03a29f4bb83e368,10/22(火) 10:58
2024-10-22,16:07,TTL,総合,11,デイリースポーツ,日本ハムが江越大賀、黒木優太ら４選手に戦力外通告と発表　現役続行は「家族と相談しながら」と江越、新庄監督には「感謝しかない」,https://news.yahoo.co.jp/articles/ce8aa28e1a5148074d4025546d9fbd70fcefe03d,10/22(火) 13:00
2024-10-22,16:07,TTL,総合,12,中日スポーツ,中日、小笠原慎之介のポスティング移籍容認 「井上監督にも理解していただきました」球団で米移籍なら03年大塚晶則以来,https://news.yahoo.co.jp/articles/b24febb8cfcc01666e6c37f19a0e814ad94f5a27,10/22(火) 15:11
2024-10-22,16:07,TTL,総合,13,ABEMA TIMES,こんなカーショー見たことない！ ド軍の“MVP”4番、執念の逆転打に大絶叫…カメラが捉えたド軍ナイン歓喜の一部始終,https://news.yahoo.co.jp/articles/b7b3206319a2ffd1017c569848ec372aa323d979,10/22(火) 11:54
2024-10-22,16:07,TTL,総合,14,LIMO,アパートに6年入居した住人がまさかの夜逃げ　「退去後の部屋の様子」に思わず声を上げてしまう,https://news.yahoo.co.jp/articles/a93932903fe5226f6ac47cbe1e6fabdfae9a68a7,10/20(日) 5:56
2024-10-22,16:07,TTL,総合,15,日刊スポーツ,特殊詐欺で実刑判決の元俳優「炎上なんて怖くもなんともない」出所後の活動再開に意欲,https://news.yahoo.co.jp/articles/13b4f0c988baf91ae2cbd4c339d7db5731a32d68,10/22(火) 14:22
2024-10-22,16:07,TTL,総合,16,よろず～ニュース,転落死した31歳リアムさん　死の直前に部屋に２人の女性を呼んでいた　欧米で報道,https://news.yahoo.co.jp/articles/f25299114b0d4602db924384b9b94d295d7aeaf6,10/22(火) 12:50
2024-10-22,16:07,TTL,総合,17,日刊スポーツ,元“アイドル芸人”絶望から再起へ　離婚、38歳妹と母の相次ぐ死…壮絶人生を振り返る,https://news.yahoo.co.jp/articles/ee075a255c5988f112092cf2d2a8c06b2b4ae03c,10/22(火) 13:14
2024-10-22,16:07,TTL,総合,18,デイリースポーツ,杉本哲太、不良に絡まれ救ってくれた大物芸能人　「革ジャンと白ボンタン」姿に舞い上がる「仲間に入れて！」,https://news.yahoo.co.jp/articles/43f81d113f2fc7e20615056a178cee8d3bd12944,10/22(火) 12:46
2024-10-22,16:07,TTL,総合,19,スポニチアネックス,山本聖子さん「そろそろお気づきかと」　穏やかなオフの食事…夫・ダルビッシュ“チラ見せ”反響,https://news.yahoo.co.jp/articles/12d105dc523fbe430c8c305db8da29b5c1cffb86,10/22(火) 11:40
2024-10-22,16:07,TTL,総合,20,みんかぶマガジン,ついに倒産連鎖が始まった…危険度が高い5つの業種「特にヤバイのは建設業と…」景気後退のシグナル,https://news.yahoo.co.jp/articles/1339a06b50353612a7b0309af208ccf288dc6480,10/22(火) 9:10
2024-10-22,16:07,TTL,総合,21,テレビ朝日系（ANN）,高須克弥院長が入院を報告、41.6度の高熱脳症でふらつき転倒、流血も,https://news.yahoo.co.jp/articles/cf3f54168666940707afbb24a46a8e4e564b3c90,10/22(火) 12:36
2024-10-22,16:07,TTL,総合,22,MBSニュース,【速報】行方不明のドイツ人大学生のパスポートや生活用品が『河川敷のトイレ』から見つかる　しかし財布やリュックは見つからず　和歌山市・紀の川,https://news.yahoo.co.jp/articles/6d7be2e0b09dc6c50bd76974cf55ea6e51a3e516,10/22(火) 11:25
2024-10-22,16:07,TTL,総合,23,日刊ゲンダイDIGITAL,日本ハム新庄監督「このまま退団」なら…球団、選手、コーチはドン引き＆大ヒンシュクだ,https://news.yahoo.co.jp/articles/7d2b5cfee66309cfd12de299d8fec63650c2f15f,10/22(火) 9:06
2024-10-22,16:07,TTL,総合,24,J-CASTニュース,人気インフルエンサー、お笑い芸人との離婚報告　「正直結婚した実感はほぼ無かった」,https://news.yahoo.co.jp/articles/80976ae1fa6d35a9cf2dba284eda64945db195a2,10/21(月) 15:44
2024-10-22,16:07,TTL,総合,25,ねとらぼ,21歳の元ジャニ、退所後の大暴れから4カ月「音沙汰なし」も……“激変姿”で突如復活＆車購入で「なんでバイトしてない若造が買えんねんって」,https://news.yahoo.co.jp/articles/abb5df94614a4af7161fd203e3ec09a9ba04437e,10/22(火) 12:00
2024-10-22,16:07,TTL,総合,26,Full-Count,大谷翔平獲り失敗→不良債権化した大砲　NY紙が手のひら返し、ヤ軍480億円男が覆した評価,https://news.yahoo.co.jp/articles/b26ffeaf36be374b9b5497773da0bc87a170dd0b,10/22(火) 10:31
2024-10-22,16:07,TTL,総合,27,オリコン,【30歳差カップル】「一生ひとり」覚悟していた56歳男性がなぜ26歳女性と？ 6年ぶり運命の再会で生まれた変化,https://news.yahoo.co.jp/articles/de4f4da218b1e2752691fc3315733d7a3b93bfd7,10/22(火) 11:30
2024-10-22,16:07,TTL,総合,28,モデルプレス,高畑充希、最近は「若干育児ノイローゼ気味というか、寝不足」近況明かす,https://news.yahoo.co.jp/articles/fae61bd1e9fdca0c1bfecb1483a23b53fc2c7144,10/22(火) 12:45
2024-10-22,16:07,TTL,総合,29,選挙ドットコム,【情勢調査】仁義なき戦い「和歌山2区」でリードしているのは？（衆院選注目選挙区）,https://news.yahoo.co.jp/articles/abba0c1e10a124c38ca10ebf7faac8203c1448b2,10/22(火) 13:58
2024-10-22,16:07,TTL,総合,30,みんかぶマガジン,まさかの支持率28％！石破の「国賊解散」で自民党大苦戦の末路…結局、国民人気もなかった男と「ポスト石破」の高市早苗,https://news.yahoo.co.jp/articles/4b87f8a158c827ee132e84323045cdace2c25eb1,10/22(火) 9:10
2024-10-22,16:07,TTL,総合,31,LIMO,「お布団に行きなさい」と土佐犬に言ったら…まさかの返しに爆笑「反抗期の娘とオカンww」,https://news.yahoo.co.jp/articles/95944832fd4ec609b51a79e42e1dc14991abd1fa,10/22(火) 11:56
2024-10-22,16:07,TTL,総合,32,映画チャンネル,世界観ぶち壊し…大失敗・大不評のゲーム実写化映画（1）日本への嫌がらせ？ 観るに耐えない改変の嵐とは？,https://news.yahoo.co.jp/articles/a87fc1fc3d44359ae2f25d68c7dea0efdf2299cf,10/22(火) 11:51
2024-10-22,16:07,TTL,総合,33,スポーツ報知,「これで還暦！？」杉田かおる　５９歳現在の姿にネット仰天　同い年の人気俳優と２ショットで驚き,https://news.yahoo.co.jp/articles/52db7a6ef57618c81bfd85e20b937f980a5fd224,10/22(火) 11:55
2024-10-22,16:07,TTL,総合,34,スポニチアネックス,グリズリーズ河村勇輝　開幕戦ベンチ入り確定！日本人4人目のNBA選手誕生なるか　開幕ロースター発表,https://news.yahoo.co.jp/articles/fa680ce277e5bb0267dc3e6f09dd4f2ae8dbd7d4,10/22(火) 10:08
2024-10-22,16:07,TTL,総合,35,ABEMA TIMES,女子レスラー、“前も、後ろも”規格外の衝撃ボディ ハルクのようなビキニ姿にファン騒然,https://news.yahoo.co.jp/articles/296e6476f1e707c8f0dab7ba06bfe7e1581176a9,10/22(火) 10:46
2024-10-22,16:07,TTL,総合,36,MBSニュース,【阪神】「優勝に必要なのは怒れるコーチ」掛布氏は藤本総合コーチが“変われるかどうか”と指摘　藤川新監督の『投手陣の整備』にも注目「まだまだ僕は青柳の力が必要だと思う」,https://news.yahoo.co.jp/articles/1f516a208093e1a9c5cb72945f09069623927b02,10/22(火) 14:15
2024-10-22,16:07,TTL,総合,37,MBSニュース,【速報】「殺すぞ」20代女性を背後から顔掴み暴行し脅迫…不同意わいせつ未遂の疑いで34歳男を再逮捕　大阪府警,https://news.yahoo.co.jp/articles/5ac4dbd144b45173f3af72bce2e534ef98b7f8ed,10/22(火) 14:00
2024-10-22,16:07,TTL,総合,38,オリコン,吉田知那美、ピチピチな服で美ボディ強調　お腹チラリで「筋肉すごい～」「色っぽい！」,https://news.yahoo.co.jp/articles/80e1d82d0b74d010c8cb6eb873d9fe9f4c145d42,10/22(火) 12:20
2024-10-22,16:07,TTL,総合,39,朝鮮日報日本語版,開戦以来ロシア兵士500人超を射殺　ウクライナ軍の29歳ドローン操縦士が死亡,https://news.yahoo.co.jp/articles/a7dcea3ecdd52b7dac02f5d6ce3d2dbcd120b6e9,10/22(火) 11:23
2024-10-22,16:07,TTL,総合,40,日刊スポーツ,洞口依子、10年以上向き合う疾患を公表「生きている事をありがたく…」,https://news.yahoo.co.jp/articles/0e6532d9233ba8d6afab0feca9c88aa91eb0d75b,10/22(火) 13:36
