scrp_date,scrp_time,genre_en,genre_jp,rank,media_jp,title,link,date_original
2025-06-04,01:09,TTL,総合,1,デイリースポーツ,長嶋茂雄さん死去　谷佳知氏、妻の亮子さんが弔問　次女・三奈さんが「亮子ちゃん！」と出迎え　中学時代から交流,https://news.yahoo.co.jp/articles/b3e5522f8da1e753b6d684312a5dcaed96d3c142,6/3(火) 19:27
2025-06-04,01:09,TTL,総合,2,デイリースポーツ,日本ハム・新庄監督　メンバー表交換で阪神・藤川監督と握手せず　目も合わさず立ち去る　解説者も驚き「いつもと違う雰囲気でしたね」,https://news.yahoo.co.jp/articles/80062abc326ed62aa217d7dd602f4680e6d46357,6/3(火) 18:09
2025-06-04,01:09,TTL,総合,3,テレビ朝日系（ANN）,ウクライナが大規模奇襲　ロシア戦略爆撃機など41機破壊　奇襲作戦「クモの巣」とは？,https://news.yahoo.co.jp/articles/06960cc712a4b4e1ca1a5b0d1be054a8b8278b1d,6/3(火) 13:32
2025-06-04,01:09,TTL,総合,4,BuzzFeed Japan,板谷由夏、突然の“ご報告”「正直、不安もあるけれど…」→「すごい決断」「おめでとうございます」と反響,https://news.yahoo.co.jp/articles/1eb9634bee9361cd69c72a3695432284130caa4e,6/3(火) 18:35
2025-06-04,01:09,TTL,総合,5,ENCOUNT,ヒロミ、“自腹”修理のGT-Rがまさかの値段　オークション結果に困惑「なんで？なんで？」,https://news.yahoo.co.jp/articles/bec4495af11be3eda5a7cab002b3e751b9354d41,6/3(火) 19:20
2025-06-04,01:09,TTL,総合,6,弁護士ドットコムニュース,長嶋茂雄さん死去、SNSで「遺産争い」心配の声も 一茂さんが口にした「放棄」って生前にできるの？,https://news.yahoo.co.jp/articles/f413d7877eb8bbd3e2d02acf5801e6e4817fa118,6/3(火) 12:49
2025-06-04,01:09,TTL,総合,7,西スポWEB OTTO！,「このタイミングでまさか…」23歳人気女優が事務所退所でSNS削除、新アカウントの近影に注目集まる「消えちゃうんですね」「きらきら笑顔も眩しい」,https://news.yahoo.co.jp/articles/5858e29bfabd4b05baf429f3c4523fc65f30e883,6/3(火) 22:50
2025-06-04,01:09,TTL,総合,8,デイリースポーツ,長嶋一茂氏　父・茂雄さんの死去でコメント「長嶋茂雄は野球の星に帰りました」「父にとって野球は人生そのものであり、最愛の存在でした」【全文】,https://news.yahoo.co.jp/articles/bc670fdf5c58960cafdedc9ff13d58721522e984,6/3(火) 15:55
2025-06-04,01:09,TTL,総合,9,ねとらぼ,「めっちゃかっけぇ」　紗栄子のモデル長男、成田空港の大型広告に堂々登場　ダルビッシュ有そっくりの顔話題も……母は過去に「この仕事選ぶとは」,https://news.yahoo.co.jp/articles/4fe1989be63daf80a3bbe2de1b30146f6cad9270,6/3(火) 16:25
2025-06-04,01:09,TTL,総合,10,ねとらぼ,ズカズカ家に入ってきたぼっちの子猫→妙になれなれしいので、風呂に入れてみると……　思わず腰を抜かす事態に「たまらんw」「この子は賢い」　半年後……飼い主に話を聞いた,https://news.yahoo.co.jp/articles/ed24595bc3caa077a8cb38f4c3de9425b6d8289b,6/3(火) 20:30
2025-06-04,01:09,TTL,総合,11,ENCOUNT,「痩せすぎてびびった」　長嶋茂雄さんを追悼した元木大介の姿にネット騒然「別人よね？」,https://news.yahoo.co.jp/articles/0c2b5a89b75d9894f7663fd0da5418caf24b9a8a,6/3(火) 17:35
2025-06-04,01:09,TTL,総合,12,スポニチアネックス,小泉孝太郎　弟・進次郎農相の子供たちは「フランスの血が…」「ちょっと違う。おもしろいなって」,https://news.yahoo.co.jp/articles/1f801512563777d40d31a75ad263a13132b03660,6/3(火) 21:53
2025-06-04,01:09,TTL,総合,13,日刊スポーツ,【中日】今季12度目の完封負けで借金４…井上監督「恥ずかしい」走塁ミスに苦言,https://news.yahoo.co.jp/articles/94b5e20b9db0586d0c152a32036aa9ef94fba017,6/3(火) 22:15
2025-06-04,01:09,TTL,総合,14,Full-Count,大谷翔平への“誤審”にNY放送局ヒートアップ　納得いかず不満連発「ワオ！」「いけません」,https://news.yahoo.co.jp/articles/4eac61ad2b28efd4c8e994b2748941a5e1810d5a,6/3(火) 22:03
2025-06-04,01:09,TTL,総合,15,中日スポーツ,身長２メートル超のジャッジ、「遠征先ではほぼ外出しないんだ」「当然のこと」 その理由は…明かしたヤンキース愛,https://news.yahoo.co.jp/articles/33b728082a267893ff76cefeccbd983d8930f01e,6/3(火) 18:15
2025-06-04,01:09,TTL,総合,16,J-CASTニュース,山と積まれたイオンの備蓄米、やっぱり一部で売れ残る　コメ価格への影響は？,https://news.yahoo.co.jp/articles/5d6453f45f6ccf8a969e24cf10f20bf5d1d499c4,6/2(月) 18:20
2025-06-04,01:09,TTL,総合,17,デイリースポーツ,テレビから消えていたカリスマ　１０００坪の豪邸で暮らしていた「本業がオファーいっぱいあるので」森泉が訪問,https://news.yahoo.co.jp/articles/ad6cd554071b0dab84a065f1bd18de4e326bbd72,6/3(火) 19:59
2025-06-04,01:09,TTL,総合,18,FNNプライムオンライン,【独自】「ジリリリリン!」「ピンポーン!」「バン!」連日深夜に騒音…迷惑住民の“中国人女性”直撃「嫌がらせ受けている…やり返しだ」主張　千葉・松戸市,https://news.yahoo.co.jp/articles/8fc0bc4d7e5784c2ed79f0f4232ebd845fefecd5,6/3(火) 21:17
2025-06-04,01:09,TTL,総合,19,ENCOUNT,ミキ亜生「こんな太ってる？」　最新の姿に自らドン引き…ファンも辛辣「二度見した」「ビビるぐらい老けてみえる」,https://news.yahoo.co.jp/articles/cf6eec9e3032f9210c4fe541c22e0155c0fbbc82,6/3(火) 21:20
2025-06-04,01:09,TTL,総合,20,スポニチアネックス,中畑清氏　長嶋茂雄氏の死去に声を震わせる　「こんなことはあってほしくない。俺のが先に死にたかった」,https://news.yahoo.co.jp/articles/c891b48c7f68c1fa4d88594e4afe8808526b0395,6/3(火) 15:53
2025-06-04,01:09,TTL,総合,21,オリコン,『対岸の家事』最終回　中谷の“決断”にネット反応「すごくリアル」「簡単に許せないのは当然」【ネタバレあり】,https://news.yahoo.co.jp/articles/8ab83f53f77f2adec69981fa618ec2ddfe452ba3,6/3(火) 22:57
2025-06-04,01:09,TTL,総合,22,メディカルドック,次長課長・河本準一さんが「うつ病」を公表、“顔つきや表情”の特徴・対処法を医師が解説,https://news.yahoo.co.jp/articles/411a817fb84251a74cad2d46bcb9d695251974d4,6/2(月) 14:30
2025-06-04,01:09,TTL,総合,23,ねとらぼ,業務スーパー「中国産冷凍食品」に基準値超え残留農薬……　運営謝罪、4万5000個回収命令　同様の事例相次ぐ,https://news.yahoo.co.jp/articles/f15605ae35c87cd3100b74a80d21eddeb879ffdc,6/2(月) 18:08
2025-06-04,01:09,TTL,総合,24,中日スポーツ,長嶋茂雄さん葬儀、喪主は次女・三奈さん、父の個人事務所の代表取締役、長年の高校野球取材で始球式も,https://news.yahoo.co.jp/articles/a7968da656e57318e44249c4cf39995f9cb7a329,6/3(火) 14:46
2025-06-04,01:09,TTL,総合,25,デイリースポーツ,長嶋さんの遺体が無言の帰宅　一茂氏、三奈さんが深々と頭を下げる　盟友・王貞治氏が弔問,https://news.yahoo.co.jp/articles/caf4eb19947e558c0952eb01f2da5ee649bd500f,6/3(火) 13:40
2025-06-04,01:09,TTL,総合,26,スポニチアネックス,小倉優子　顔に“謎の菌”が続々…専門家も興味津々「日本人から検出されたのは驚き」,https://news.yahoo.co.jp/articles/25a6ae0d8c00454f2e626c808211287db5b097bd,6/3(火) 22:25
2025-06-04,01:09,TTL,総合,27,スポーツ報知,【中日】９安打で無得点　走塁ミスに井上一樹監督「ガキのころから野球をしていて、あんなプレーをしたら」,https://news.yahoo.co.jp/articles/edbcb9553649aed775dd065916cfd84158e9eb7f,6/3(火) 22:27
2025-06-04,01:09,TTL,総合,28,FNNプライムオンライン,【独自】スーツケースに腰掛けて電動キックボードを運転…東京・中野区の車通りの多い道路で　「LUUP」側は「道交法違反なので絶対やめて」,https://news.yahoo.co.jp/articles/e0222d2d65cfbdc63ad5d866e448d4b8f105fa4c,6/3(火) 6:13
2025-06-04,01:09,TTL,総合,29,ENCOUNT,『電波少年』ブレイク芸人、23kg減で激変　糖尿病＆前立腺肥大症も…「全ての基本は健康！」,https://news.yahoo.co.jp/articles/6e44f1c58ecd02afe7271bed44a7ff861d932513,6/3(火) 10:52
2025-06-04,01:09,TTL,総合,30,Full-Count,大谷翔平、23号確信弾で樹立した史上初　揺るぎない“最強の1番”…メジャー唯一の領域に,https://news.yahoo.co.jp/articles/1b8c592de8a70fde53cf206e24efb5ce0558fc9c,6/3(火) 19:19
2025-06-04,01:09,TTL,総合,31,デイリースポーツ,「さすが日本ハムや！」阪神ファンがエスコンのおもてなしに感動　試合後の演出に「ビジターに手厚すぎる」,https://news.yahoo.co.jp/articles/761dbf0a420f9b059d8a4bbff00aab0617656f39,6/3(火) 21:38
2025-06-04,01:09,TTL,総合,32,スポニチアネックス,島崎遥香　首元の赤い斑点の原因が明らかに！　医師が収録中に診断「ずっと皮膚科に行こうと…」,https://news.yahoo.co.jp/articles/aefbbb0f00eb86b1022de18baa00b568b743c7d5,6/3(火) 21:51
2025-06-04,01:09,TTL,総合,33,Bloomberg,ロシア政府内に怒りと警戒感、ウクライナが戦略爆撃機攻撃で－関係者,https://news.yahoo.co.jp/articles/e001f8d553acc3404ce772d3e8e31bd82cbbe1b8,6/3(火) 3:44
2025-06-04,01:09,TTL,総合,34,日刊スポーツ,長嶋茂雄さんの次女・三奈さん「亮子ちゃん！」谷佳知・亮子夫妻ら関係者が自宅へ弔問続々,https://news.yahoo.co.jp/articles/89bbd9edc525b4e5db13706cff1d540e51c813a4,6/3(火) 20:43
2025-06-04,01:09,TTL,総合,35,RSK山陽放送,宿泊客の女性10人に睡眠作用のある薬物飲ませ性的暴行を加えたなどの罪　ゲストハウス経営の男（51）に懲役28年を求刑　男は「黒い影から命令されていた」【岡山・里庄町】,https://news.yahoo.co.jp/articles/f9b5b64f0ff19929cf0c14354e52eb93e5c5056c,6/3(火) 18:24
2025-06-04,01:09,TTL,総合,36,中日スポーツ,高嶋ちさ子、突然の”休養宣言”「しばらくお休み」　フォロワー反応「どうしましたか？」「寂しい」,https://news.yahoo.co.jp/articles/dfcc4c367a96668232f281d9e1a0f3b7a519f7fe,6/3(火) 19:27
2025-06-04,01:09,TTL,総合,37,ロイター,ウクライナ、クリミア橋を再び攻撃　爆発物で橋脚損傷,https://news.yahoo.co.jp/articles/2616825ce265b38ac494ba10a4260df15400d279,6/3(火) 21:53
2025-06-04,01:09,TTL,総合,38,ねとらぼ,「これで1017円」　神奈川在住35歳男性、閉店前の“脅威の買い物ぶり”にびっくり　「すごーーーーい！！！」「なかなか見たことないー」,https://news.yahoo.co.jp/articles/61773f681e139ac4fe42bf6887962124f8c3ecf4,6/3(火) 19:30
2025-06-04,01:09,TTL,総合,39,デイリースポーツ,長嶋茂雄さん　愛娘の誕生日に天国へ旅立つ　背番号「３」も命日に　ネット注目「切ないな」「色々と縁がある日に」,https://news.yahoo.co.jp/articles/7be1f5cd898c462d5d0fd89e07ada7840395f9f9,6/3(火) 17:55
2025-06-04,01:09,TTL,総合,40,Full-Count,長嶋茂雄さんが大谷翔平へ残した言葉　スーパースターは「負けるチームに生まれない」,https://news.yahoo.co.jp/articles/d47198ca614abf00dabe5c06a9383d661c728af9,6/3(火) 12:08
