scrp_date,scrp_time,genre_en,genre_jp,rank,media_jp,title,link,date_original
2024-12-02,14:07,life,ライフ,1,Hint-Pot,「ミュンヘンだったら4000円するわ」　ドイツ人の両親が人生で初体験　物価の違いに驚いた人気の日本食とは,https://news.yahoo.co.jp/articles/9d7becbfff80503582746a02411f210af65b445c,12/2(月) 12:26
2024-12-02,14:07,life,ライフ,2,Hint-Pot,「アメリカの価格上昇が思ってた以上にヤバそうだった件」　日本に来た友人のなにげないひと言に衝撃を受けた実体験漫画が話題に,https://news.yahoo.co.jp/articles/c22898eba6e884b383c653c97252dbc0e3ee9b00,12/2(月) 10:11
2024-12-02,14:07,life,ライフ,3,ねとらぼ,木下優樹菜、娘2人とディズニーへ　「娘白すぎ　笑」そっくりな12歳長女との2ショットに注目,https://news.yahoo.co.jp/articles/ffc2a728a9fad363a74aebf2028eb1f731aa0f1b,12/2(月) 8:38
2024-12-02,14:07,life,ライフ,4,ファイナンシャルフィールド,レジ袋が有料化になってから、ごみ箱用の袋を「100円ショップ」で購入しています。もしかしてスーパーで「レジ袋」を購入したほうが安いでしょうか？,https://news.yahoo.co.jp/articles/6ce824d0b9c0f101e9874b05e141ac2bca07ebac,12/2(月) 11:20
2024-12-02,14:07,life,ライフ,5,ファイナンシャルフィールド,出張で行ったホテルの「部屋着」を間違えて持って帰ってきてしまった夫…！もしかして「窃盗」になるのでしょうか？,https://news.yahoo.co.jp/articles/c0c58065f5e1da0fee55966f5ad5a24da7d4bee0,12/2(月) 11:31
2024-12-02,14:07,life,ライフ,6,グルメ Watch,マクドナルド、福袋2025は「ビッグマックランタン」だったりして。監修先は「B」……？,https://news.yahoo.co.jp/articles/287bd9ad36a52068e27572f39d39c686fd8f3478,12/2(月) 10:49
2024-12-02,14:07,life,ライフ,7,まいどなニュース,「店内撮影禁止です！」寿司屋で、料理を撮影しようとしたら怒られた…違法行為なの？【弁護士が解説】,https://news.yahoo.co.jp/articles/14c72cb9a1980374bc90e6f3c42cbc0f864b9413,12/2(月) 11:50
2024-12-02,14:07,life,ライフ,8,ほ・とせなNEWS,ばあばを駅で待つ2歳孫　ばあばを見つけた瞬間…！？「無条件にカワイイ！」「ばーばお若い」「幸せオーラ」,https://news.yahoo.co.jp/articles/edd1da8bf9867da718473cbfdb93de8b206c712c,12/1(日) 13:30
2024-12-02,14:07,life,ライフ,9,BuzzFeed Japan,【かつや】1人前とは思えない！ガッツリ感がスゴい「ボリューム満点メニュー」3選。あふれる肉汁たまりません《実食メニュー》,https://news.yahoo.co.jp/articles/3f5a520333f309d17135e7bbc2a23e947ced7cc5,12/2(月) 13:05
2024-12-02,14:07,life,ライフ,10,ねとらぼ,辻希美の17歳長女・希空、“ディズニーでのショット”に23万いいね　「ちょっと前ですが」「写真たくさんある」,https://news.yahoo.co.jp/articles/599025caa1f8aa7cfa210e0074430050dfd28d68,12/2(月) 12:50
2024-12-02,14:07,life,ライフ,11,Impress Watch,ゆうちょ銀、クレカ支払日の残高不足で「回収事務手数料」,https://news.yahoo.co.jp/articles/2dbb075cbb79f5c1c8e731d3f3beb37b1d231044,12/2(月) 11:55
2024-12-02,14:07,life,ライフ,12,BuzzFeed Japan,「僕、負けました」報告しに来た子猫ちゃんが尊すぎて10万いいね⇒「めっちゃ手加減できてる」先輩猫にも癒される人が続出,https://news.yahoo.co.jp/articles/51390c49ec632ec612319bec48312fd3f0629461,12/2(月) 8:35
2024-12-02,14:07,life,ライフ,13,ねとらぼ,友達が撮るとおしゃれな1枚→父が撮ると……　“別人級の仕上がり”に「笑ったww」「ちゃんと娘っぽくしてるw」,https://news.yahoo.co.jp/articles/c7824866ea857c9db19508028a5673e574f9b96e,12/2(月) 7:30
2024-12-02,14:07,life,ライフ,14,ファイナンシャルフィールド,ランチの飲み物に「水」をお願いしたら、友人に「ドリンクを頼んだほうがいい」とやんわり注意されました。無料の水で済ますのは非常識でしょうか…？,https://news.yahoo.co.jp/articles/d9b1e103d8833ac651ff4daaf9f7d3dbde697c94,11/29(金) 13:40
2024-12-02,14:07,life,ライフ,15,Hint-Pot,高齢者も気をつけて　洗濯用パック型液体洗剤の事故　消費者庁が呼びかけ,https://news.yahoo.co.jp/articles/064fd44a9f447c844a7e361d71a6e5ac272d6099,11/30(土) 10:25
2024-12-02,14:07,life,ライフ,16,リセマム,【中学受験2025】日能研「予想R4偏差値一覧」首都圏・関西・東海11月版,https://news.yahoo.co.jp/articles/f8e937bd811c8c5cd9d6e0169e56115af03836fb,12/2(月) 13:30
2024-12-02,14:07,life,ライフ,17,グルメ Watch,マクドナルド、福袋アイテムは「ビッグマック」の……!?,https://news.yahoo.co.jp/articles/4289709aeab2a7dc1b83beffce38baf96ea2dc7a,11/30(土) 23:33
2024-12-02,14:07,life,ライフ,18,日刊ゲンダイDIGITAL,斎藤元彦氏に女帝・小池都知事と酷似する“盛り癖”…兵庫県知事選で「公約達成98%」のガセ情報拡散,https://news.yahoo.co.jp/articles/571b887695fb6f53a1efc15db652d768abf81937,12/2(月) 11:02
2024-12-02,14:07,life,ライフ,19,Impress Watch,よみうりランドの新球場「ジャイアンツタウンスタジアム」3月1日開業,https://news.yahoo.co.jp/articles/15973dda35fe38776ee413dc2402eac536733342,12/2(月) 13:07
2024-12-02,14:07,life,ライフ,20,ねとらぼ,カルディの人気商品 → “ふりがな”をよく見たら……　とんでもない“無法”ぶりに思わず二度見　「目を疑うレベル」「声出た」と520万表示,https://news.yahoo.co.jp/articles/64e553bd61c8dfb31bd545d7c8db3d59918b437a,12/2(月) 12:20
2024-12-02,14:07,life,ライフ,21,まいどなニュース,【JR東海グッジョブ】不正乗車、マナー違反の抑止なるか　新幹線自由席の抜き打ち検札が話題,https://news.yahoo.co.jp/articles/7458cb46b06c4067971a1b9d53d9c0a6d9f5c364,12/1(日) 17:30
2024-12-02,14:07,life,ライフ,22,magacol,永遠の憧れ【エルメスのバッグ】みんな何持ってる？＜SNAP18選！＞｜STORY,https://news.yahoo.co.jp/articles/d7fe78e1a6871e02b1a73c8f5702468fb5eb7925,12/2(月) 7:30
2024-12-02,14:07,life,ライフ,23,LIMO,【ヘアドネーション】3年間髪を伸ばし続けた高校生がついに断髪する動画に感動の嵐「身も心も男前で素敵」,https://news.yahoo.co.jp/articles/f49bb316acb63321253d8424923f8e3ae35e601f,12/2(月) 10:22
2024-12-02,14:07,life,ライフ,24,ねとらぼ,平愛梨、“超レア!?”なおとなしすぎる4兄弟ショット公開　残り物で作ったお昼ごはんにも反響「美味しそう～」「素敵に育ってて……涙」,https://news.yahoo.co.jp/articles/c731a7f480289bdef9fbfee5bf395d2a0d6095a4,12/2(月) 13:13
2024-12-02,14:07,life,ライフ,25,KURU KURA（くるくら）,幻の阪神高速「大阪泉北線」が新たな姿へ。都市計画道路「天王寺大和川線」として期待される未来とは？ 【いま気になる道路計画】,https://news.yahoo.co.jp/articles/e13023bc37182ecc6d291d43f1b8e541525aa601,12/2(月) 12:10
2024-12-02,14:07,life,ライフ,26,BuzzFeed Japan,しまむらの「1419円トップス」ふわふわで暖かい！どんなボトムスとも合わせやすいから、コーデが楽ちんです《着用レビュー》,https://news.yahoo.co.jp/articles/8805df6035e82c4784562c5b28e74c72f7976f4b,12/2(月) 12:35
2024-12-02,14:07,life,ライフ,27,ねとらぼ,パパが好きすぎる元保護子猫、畑仕事中もくっついて離れない姿が「可愛すぎる」と反響　2年以上がたった現在は……飼い主に話を聞いた,https://news.yahoo.co.jp/articles/3baa509b6a7f816f394b5dfe0d6122131a9680c4,11/30(土) 9:15
2024-12-02,14:07,life,ライフ,28,ねとらぼ,「値段がバグすぎる」　セカストで買った“国民的人気ドール”→“価格破壊”な戦利品に「明日にでも行きます!!!」,https://news.yahoo.co.jp/articles/ff4fec7ad23fb87f4ec9daa79638aa6d34c56a4f,12/2(月) 7:50
2024-12-02,14:07,life,ライフ,29,ねとらぼ,ダイソーの毛糸を使って編み続けると……　おしゃれでかわいい冬のアイテムが完成「クリスマスプレゼントに練習します」,https://news.yahoo.co.jp/articles/053a9e544c5b19c14e002e2bbff742a5f70b101b,12/2(月) 9:00
2024-12-02,14:07,life,ライフ,30,LIMO,【しまむら福袋】豪華すぎるインフルエンサーコラボ〈8点セット〉高見え冬コーデが完成しちゃいます！,https://news.yahoo.co.jp/articles/dbe2ab8dd7a7f98f33c93155bfd92f2c178764de,12/2(月) 12:07
2024-12-02,14:07,life,ライフ,31,LIMO,海外のトイレでよく見かけるペーパーホルダー　「使い方に困っている」の声に多くのアドバイスが続出,https://news.yahoo.co.jp/articles/0e1d3423b34684c54970907a85b7622c7435266a,12/1(日) 5:56
2024-12-02,14:07,life,ライフ,32,マイナビ子育て,板野友美さんが長女の七五三で家族ショット公開「あー可愛かった♡」真っ赤な着物はママのお下がり,https://news.yahoo.co.jp/articles/14e920548b2080f20f905b27c09616852b938010,12/2(月) 12:11
2024-12-02,14:07,life,ライフ,33,ファイナンシャルフィールド,「私は扶養の範囲内で働いている」と周りに言ってしまうと、夫の年収が1000万円以内だと知られてしまう？配偶者控除と年収の関係とは,https://news.yahoo.co.jp/articles/6a291dadf5b5ebf74372e11f77e7059afdc28a2c,11/30(土) 11:30
2024-12-02,14:07,life,ライフ,34,ファイナンシャルフィールド,夫は毎晩、自宅でウイスキーを1杯ロックで飲んでいます。外に飲みに行くよりも節約にはなっているのですが、毎日飲むのは体によくないのでしょうか？,https://news.yahoo.co.jp/articles/00feebaca42afc02107a943a944bc16ccf4af8dc,11/30(土) 8:10
2024-12-02,14:07,life,ライフ,35,ねとらぼ,パパに抱っこされていてる娘→11年後……　同じ場所＆ポーズで撮影した“現在の姿”が「泣ける」「すてき」と反響,https://news.yahoo.co.jp/articles/6b193723b9327fc1017fdde8c6ffcd14deb367ea,12/1(日) 9:00
2024-12-02,14:07,life,ライフ,36,ねとらぼ,捨てられていた巨大クローゼットを大改造→出来上がったのは……　秘密の仕掛けが完成し267万いいね「このアイデアが好き！」【海外】,https://news.yahoo.co.jp/articles/c3aa6af9a2f59b59f4c92928aa0398f358fd2a44,12/2(月) 12:20
2024-12-02,14:07,life,ライフ,37,ねとらぼ,「何があった」　絵師が“大学4年間の成長過程”公開→たどり着いた“まさかの境地”に「ぶっ飛ばしてて草」,https://news.yahoo.co.jp/articles/2ff50fe4d57b21782cbf8732d4f62bc0262b51bd,12/1(日) 9:10
2024-12-02,14:07,life,ライフ,38,BuzzFeed Japan,【ディズニー土産】レトロ感たっぷりでかわいい！吸水力バツグンの「ふわふわミニタオル」カラフルで気分が上がります《購入レビュー》,https://news.yahoo.co.jp/articles/32d628cd024c6d149ae12d47bb86216a32fd1a92,12/2(月) 13:35
2024-12-02,14:07,life,ライフ,39,ねとらぼ,「これで330円！」　ダイソーのケースがガンプラにジャストフィット！　大物も飾れる包容力に驚きの声,https://news.yahoo.co.jp/articles/17b52b85f4d853c084cbfe2132bdc57e20dba564,12/2(月) 12:00
2024-12-02,14:07,life,ライフ,40,ねとらぼ,泥だらけで“汚いモップ”のようになったワンコを保護したら……　洗って毛をカットした姿に衝撃「涙が出ました」「ありがとうございます」,https://news.yahoo.co.jp/articles/c0abb367fbc06e17de1df113210252b716a8944b,12/1(日) 22:30
