scrp_date,scrp_time,genre_en,genre_jp,rank,media_jp,title,link,date_original
2025-07-18,10:37,life,ライフ,1,ほ・とせなNEWS,97kgだった女性。小5息子の”厳しい一言”をきっかけに、42kg痩せた結果「すごい努力」「綺麗！」「素敵です」,https://news.yahoo.co.jp/articles/69b68ca432118ef0bfaead6ddec0398ed84cc4a6,7/18(金) 9:00
2025-07-18,10:37,life,ライフ,2,ねとらぼ,柴犬が散歩中、おじいさんに「おい、その犬大丈夫か？」と言われ……　まさかの姿に「あははは」「やさしいジイちゃんだ」,https://news.yahoo.co.jp/articles/d44b95d1cc632ee2d993603a257c56bea35df550,7/18(金) 7:00
2025-07-18,10:37,life,ライフ,3,Hint-Pot,カナダ人「少し困惑する」　初めての日本で戸惑った光景　世界で3割しかないといわれるルールとは,https://news.yahoo.co.jp/articles/0c4bf5973bf83feab2c4e038d9bc225f0dc11aa0,7/18(金) 5:30
2025-07-18,10:37,life,ライフ,4,ねとらぼ,「開業102周年なのに」予算がない……　社員が1時間で作った“広告”が200万表示「90年代のホームページみたい」「草ww」,https://news.yahoo.co.jp/articles/7721c50568f24ca4753295ecd7b2d1d04984e94f,7/18(金) 8:00
2025-07-18,10:37,life,ライフ,5,ねとらぼ,冬に手入れしたはずの“裏山”→ズボラ主婦が5カ月放置したら……　まさかの光景に絶句「思わず笑った」「生命力すごい」,https://news.yahoo.co.jp/articles/bdfa1743116b8c3a15b1040ba6c7d518a04465e3,7/18(金) 8:45
2025-07-18,10:37,life,ライフ,6,ねとらぼ,かぎ針に毛糸をかけ、10回くるくる巻きつけて編むと……「わぁっすごい！」　1400万再生突破の仕上がりに驚きの声【海外】,https://news.yahoo.co.jp/articles/3ab3d23b8390e7266b3009dd35ab630b5c9a5516,7/18(金) 9:45
2025-07-18,10:37,life,ライフ,7,ねとらぼ,出張先で仕事を終え、ホテルのドアを開けると……　まさかの“先客”に反響　「すっぽり収まっとる（笑）」「お似合いですっ」,https://news.yahoo.co.jp/articles/40273c9602d1f444c1d3ae2be752d6208a82a0ea,7/18(金) 9:30
2025-07-18,10:37,life,ライフ,8,Hint-Pot,同級生の間違いを指摘するも「多数決で負けね」　担任の一言に絶句…「義務教育の敗北」とネット騒然,https://news.yahoo.co.jp/articles/1ecd101d7cb0e1a971b78219206f8549d681cc41,7/18(金) 8:10
2025-07-18,10:37,life,ライフ,9,ファイナンシャルフィールド,東横インを予約して「1万円」を払ったのに、当日ホテルで「予約が入っていない」と言われた！ 原因はホテルの“空室転売”？ トラブルを回避する方法とは,https://news.yahoo.co.jp/articles/dd8f60bb428afede4afe11619f3bde4923491bc5,7/16(水) 13:30
2025-07-18,10:37,life,ライフ,10,ねとらぼ,息子「鉛筆ある？」　母「小さい頃のやつ残ってるで」→見てみると……「俺には削れない」　1300万表示のレアものに「懐かしい！」,https://news.yahoo.co.jp/articles/cdf456e0df5e84b546d6341f9718e4c63de97f36,7/18(金) 7:00
2025-07-18,10:37,life,ライフ,11,HugKum,英語ペラペラお笑い芸人・トンツカタン森本さん「英語を話せない両親は僕をインターに入れて、妹を公立小学校に入れました」ずっと英語の環境で育ってきて、お笑いを選んだ理由は？,https://news.yahoo.co.jp/articles/f5560e3796b2e4f70ff87fc2882153b025834712,7/17(木) 21:40
2025-07-18,10:37,life,ライフ,12,ねとらぼ,マニキュアをこぼしてしまった娘→ふと見たら……うっかり「オシャレ」になった“父の持ち物”に反響　「1点物ですね」,https://news.yahoo.co.jp/articles/80a0ab435ff95217ec1c8fecf66d2a6f315a1d2b,7/18(金) 8:00
2025-07-18,10:37,life,ライフ,13,Hint-Pot,フランス人「ひとくちに感動が詰まっている」　日本で大興奮　「思っていたよりも素晴らしかった」体験とは,https://news.yahoo.co.jp/articles/45790a38c0ec8132be3f6827a8446bd70e66e612,7/18(金) 8:31
2025-07-18,10:37,life,ライフ,14,ねとらぼ,ズボラ母が家族5人分のサンドイッチ弁当を作ったら……　子ども大喜びの出来栄えに「すごい！」「作ってみます」,https://news.yahoo.co.jp/articles/6fe7ae356b5747dd36a4fa05bce5b75dab947482,7/18(金) 7:20
2025-07-18,10:37,life,ライフ,15,ENCOUNT,「日本ではこれはダメじゃないですか」ビーチの手洗い場で女子中学生が困惑…　文化の相違トラブルどう防ぐ,https://news.yahoo.co.jp/articles/41a28c9ccba3a68635fd7526e2064050be908c38,7/17(木) 8:40
2025-07-18,10:37,life,ライフ,16,LIMO,畑のスイカをアライグマから守る方法とは　100均で買える日用品での対策に 「目から鱗」「参考になる」,https://news.yahoo.co.jp/articles/1f2829c7be908b86ead899a8ebc5df8d64c426d0,7/18(金) 5:56
2025-07-18,10:37,life,ライフ,17,ファイナンシャルフィールド,庭の雑草に困って家族で「草むしり」を決行！「業者」に頼んだ場合と比べて“どのくらい”節約できるのでしょうか？,https://news.yahoo.co.jp/articles/30a61bbc7707aebb38f08dc38caa2d30da7cc8b3,7/18(金) 9:50
2025-07-18,10:37,life,ライフ,18,ほ・とせなNEWS,セロハンテープ　→まさかの”使用方法”に…「脱帽です」「今年初の驚き」「お母様天才すぎる」,https://news.yahoo.co.jp/articles/5485c1d1746a2894faa8a5602c3535ebf050f1a5,7/17(木) 21:56
2025-07-18,10:37,life,ライフ,19,LIMO,ニトリのミニ財布が便利すぎる！小銭とレシートもしっかりと収納可能！高級感もあって1480円,https://news.yahoo.co.jp/articles/ad0916c7b587e942ce2f3bc63b3cb2bda1fe34fd,7/18(金) 6:56
2025-07-18,10:37,life,ライフ,20,ねとらぼ,新築マイホーム、猫と“たった5年”暮らしただけで……　「ぎゃー！」リアルに反響　その後どうなった？現在を聞いた,https://news.yahoo.co.jp/articles/515ce1dfb996a7a2c0092b7c3ffed61380cb4ed7,7/18(金) 9:15
2025-07-18,10:37,life,ライフ,21,婦人公論.jp,追い込まれた民間病院は建て替えもできずじり貧に。最後は廃業か土地建物の売却か。多死社会を迎え、介護や火葬業界に動きが,https://news.yahoo.co.jp/articles/ef0627e03e912f1e52832ab4337b2161283167cf,7/18(金) 6:32
2025-07-18,10:37,life,ライフ,22,まいどなニュース,同級生を殴った祭の夜から10年…引きこもった女性に届いた結婚式の招待状、止まっていた時間が動き出した【漫画】,https://news.yahoo.co.jp/articles/9299baf86cba3c5135e5d66d9506e28df4922380,7/18(金) 7:21
2025-07-18,10:37,life,ライフ,23,SUUMOジャーナル,【東京駅30分以内】家賃相場が安い駅ランキング2025年。1位＆2位は千葉県で注目の再開発エリア,https://news.yahoo.co.jp/articles/b62f94fc2edffdd02a6a2f3684e6a99b82b575b0,7/18(金) 8:04
2025-07-18,10:37,life,ライフ,24,ハフポスト日本版,長野県の夏の景色に15万「いいね」⇒「絶景過ぎて行きたなる」「うひゃー！最高ー！」と話題に,https://news.yahoo.co.jp/articles/fb404c3c0c8267ab71cf44d4c9231aac4175a8e1,7/18(金) 9:12
2025-07-18,10:37,life,ライフ,25,ほ・とせなNEWS,泣きながらうつ伏せになっている2歳児息子　様子を見てみると…「事件現場みたい」「うちも1人いる」「見事です」,https://news.yahoo.co.jp/articles/aff4f428617fc9907603d6b6e9a6e880ff06000c,7/18(金) 10:00
2025-07-18,10:37,life,ライフ,26,LIMO,「管理が大変かも…」植えてはいけない！？「生育旺盛＆繫殖力が強い」常緑グランドカバー植物3選,https://news.yahoo.co.jp/articles/8620a91ed5223b5d8439fe149255c70ef23902a8,7/18(金) 9:47
2025-07-18,10:37,life,ライフ,27,ハフポスト日本版,マヨネーズなどの容器⇨「このくらい汚れていたら可燃ごみでOK」。わかりやすい発信に反響、「悩んでいた」「参考になる」,https://news.yahoo.co.jp/articles/6454ac24c2f719a748ded64b3e81bdba0c5683e9,7/18(金) 6:32
2025-07-18,10:37,life,ライフ,28,ねとらぼ,7歳娘「万博つくった」→「え！？」驚がくの光景が260万表示　「すっげぇな…」「レベル高すぎワロタ」,https://news.yahoo.co.jp/articles/cb0b18c6197550c8c2dba091f9dfb027b1dc6ff5,7/18(金) 8:30
2025-07-18,10:37,life,ライフ,29,LIMO,ミニおにぎりをたくさん詰めた「タッパー弁当」が話題！人気おかずも合わせて「可愛い」の声が続々！,https://news.yahoo.co.jp/articles/8d7a21c768bd8265a94527fbc982836b8365af1f,7/17(木) 15:02
2025-07-18,10:37,life,ライフ,30,ねとらぼ,ミャクミャクが好き過ぎる男性、地方まで行って……「そんなんあるんや！」　手に入れた“驚きの品”に「何これ欲しい」と1300万表示,https://news.yahoo.co.jp/articles/d6d8bdb130e4eac00f818b94ee28a62e063b1699,7/18(金) 9:00
2025-07-18,10:37,life,ライフ,31,ねとらぼ,釣り好き女子、コンビニで店員に「いいですね！」と褒められたTシャツは……　“二度見確定”なデザインに反響「センス勝ち」「どこで買えるの？」,https://news.yahoo.co.jp/articles/768cf47b95135e3e35cf5ca9aa91911071c5aa2f,7/18(金) 7:30
2025-07-18,10:37,life,ライフ,32,ファイナンシャルフィールド,定年後も働く予定なのですが、「年金が減らされる収入ライン」を先に知っておきたいです。また、実際に「減額されながら働いている」シニアは多いのでしょうか？,https://news.yahoo.co.jp/articles/a8d62a9468e684d59aa75a6beb4e96266f6509ae,7/18(金) 8:20
2025-07-18,10:37,life,ライフ,33,ねとらぼ,大量の余り布をつないで大きくしたら……　“夏らしさ満点”の完成品に「とてもかわいい」「ハギレ活用参考になる」,https://news.yahoo.co.jp/articles/a7424f6cf1d394bae7cc4db358c9676e85d98fe5,7/17(木) 10:30
2025-07-18,10:37,life,ライフ,34,ねとらぼ,髪にボリュームが“ありすぎる”女性→プロがカットすると……「ブラボー!!」　“まさかの大変身”が2400万再生「なんて素晴らしい」,https://news.yahoo.co.jp/articles/978633cfc3f060ca4dc1a92f6b4f4b049a80dae6,7/17(木) 21:00
2025-07-18,10:37,life,ライフ,35,ねとらぼ,「最高！4着買った」　無印良品の2000円オフ中“風を通すワンピース”が“誰にも教えたくない”と絶賛の声　「軽くて涼しいし着痩せも」「高確率でおしゃれだと褒められる」,https://news.yahoo.co.jp/articles/376f8209725b0634a4b237803734cf4c962b2a98,7/17(木) 20:40
2025-07-18,10:37,life,ライフ,36,ファイナンシャルフィールド,転勤に転勤を重ね、「10年以上」使っていない「銀行口座」があります。残高が残っていた場合、「ATM」で引き出せるのでしょうか？,https://news.yahoo.co.jp/articles/9a4086c342cce39e60b8d90df7e90003fb90d853,7/18(金) 9:30
2025-07-18,10:37,life,ライフ,37,まいどなニュース,「コスプレってこういうこと」女性が8年かけて極めた〝推しキャラ姿〟に驚き「むしろ男の子なんじゃ」,https://news.yahoo.co.jp/articles/dbe127aec6c28c3e2afd18e98355291c5e511668,7/18(金) 6:50
2025-07-18,10:37,life,ライフ,38,ファイナンシャルフィールド,2泊3日の出張から帰ってきたら、リビングの「エアコン」が「つけっぱなし」でした！電気代はいくら跳ね上がってしまったのでしょうか？,https://news.yahoo.co.jp/articles/31abd4652d85d08f9374b89e8c5e907cf28f923b,7/18(金) 7:50
2025-07-18,10:37,life,ライフ,39,ファイナンシャルフィールド,75歳の父は「後期高齢者医療制度」に切り替えたのに、医療費は「3割負担」のままでした。後期高齢者医療制度は、みんな「1割負担」ではないのですか？,https://news.yahoo.co.jp/articles/efc82a04fdddecd3caab3396a54374613d8c7ef3,7/18(金) 9:10
2025-07-18,10:37,life,ライフ,40,LIMO,「牛革ショルダーバッグ」が7370円でGETできる！？【しまむら】場面に応じて使い分けられる2WAY仕様もイイ,https://news.yahoo.co.jp/articles/9d1509b6e661073fef4b0616279092b250d9ba80,7/18(金) 8:17
