scrp_date,scrp_time,genre_en,genre_jp,rank,media_jp,title,link,date_original
2025-01-09,00:06,domestic,国内,1,tenki.jp,10日にかけ日本海側中心に警報級大雪　立往生や停電の備えを　12日は関東で雨や雪,https://news.yahoo.co.jp/articles/d6ec174c8930599312f9d16d65297b5df25935bc,1/8(水) 18:13
2025-01-09,00:06,domestic,国内,2,中日スポーツ,ケンタッキーフライドチキン「食べ放題」 1月14日から24日まで【全国353の実施店舗】をチェック！,https://news.yahoo.co.jp/articles/b73e217f7f0d04e3005b2188760d9372b2f435be,1/7(火) 15:16
2025-01-09,00:06,domestic,国内,3,J-CASTニュース,使い捨てゴム手袋がすぐ穴だらけ？投稿拡散　アスクルは販売停止、メーカーと「原因究明に向けた調査」へ,https://news.yahoo.co.jp/articles/38d6d957f8aa4b829f826ec6c84a5443fcefb414,1/8(水) 19:02
2025-01-09,00:06,domestic,国内,4,tenki.jp,強烈な寒波　日本海側でドカ雪の原因3つ　太平洋側も積雪　いつ・どこで・何に備える,https://news.yahoo.co.jp/articles/ce21be46282a3b6b0b21e192416e3e8836bc451d,1/8(水) 15:54
2025-01-09,00:06,domestic,国内,5,FNNプライムオンライン,「妻が先に感染、帰省した娘も」猛威振るうインフルエンザ　夫も38度台の熱に咳…A型陽性と判明　年末年始、家庭内での感染目立つ　学校、職場での感染拡大を懸念,https://news.yahoo.co.jp/articles/b405cd91841de056165fb7dccd83476aa1d1f5c0,1/8(水) 17:57
2025-01-09,00:06,domestic,国内,6,レスキューナウニュース,東武アーバンパークラインで人身事故 一部運転見合わせ,https://news.yahoo.co.jp/articles/60618a651f1ab21a0af524e1c20a9776fcbc55fa,1/8(水) 21:00
2025-01-09,00:06,domestic,国内,7,FNNプライムオンライン（フジテレビ系）,自民・森山幹事長「財源の裏付けのない政治は国をおかしくする」　103万円の壁で国民民主をけん制,https://news.yahoo.co.jp/articles/cef49c484b983316d33983d94732573aa17d145c,1/8(水) 22:02
2025-01-09,00:06,domestic,国内,8,京都新聞,9日夕方以降、近畿エリアの一部で運転取り止めの可能性　JR西日本、大雪の影響で,https://news.yahoo.co.jp/articles/fe7170b270e6a4275523b0cea7ee139989272eda,1/8(水) 18:18
2025-01-09,00:06,domestic,国内,9,時事通信,「2人を狙った」と供述　容疑者の男、9日にも再逮捕　中学生2人殺傷・福岡県警,https://news.yahoo.co.jp/articles/0105e747f127460c6251ef1c26c46addd831653a,1/8(水) 20:58
2025-01-09,00:06,domestic,国内,10,日刊スポーツ,【叡王戦】増田康宏八段「一方的に悪くなってしまった」「形勢判断間違った」藤井聡太７冠に惜敗,https://news.yahoo.co.jp/articles/07371fc9376d6c1e02d0e638063e627144700964,1/8(水) 18:00
2025-01-09,00:06,domestic,国内,11,弁護士ドットコムニュース,eラーニングは業務時間外？ 元バイトの投稿が波紋　タリーズは「驚いている」「就業時間内が原則」と説明,https://news.yahoo.co.jp/articles/578fa20fb2def1d0b9db396963d3b4444a078300,1/8(水) 12:47
2025-01-09,00:06,domestic,国内,12,tenki.jp,今日8日夜～10日　大阪や神戸など近畿の都市部でも道路への影響大　雪と風に注意,https://news.yahoo.co.jp/articles/51940cb8ec945f9742ceeb19bc929982a12a19ae,1/8(水) 16:10
2025-01-09,00:06,domestic,国内,13,FNNプライムオンライン,殺処分から戻る途中…鳥インフル対応の県職員30人が乗るバスが電柱に衝突し4人ケガ 真っ直ぐ突っ込んだか,https://news.yahoo.co.jp/articles/a5440688ecc0e00746e868167234c49ce71834d5,1/8(水) 21:02
2025-01-09,00:06,domestic,国内,14,関西テレビ,【大雪警戒】近畿の一部高速道路や国道などでも通行止め恐れ　「9日午後から10日午前にかけ開始見込み」,https://news.yahoo.co.jp/articles/a37f0f144299e5503da2af9f5d92896d1cbd79c7,1/8(水) 23:30
2025-01-09,00:06,domestic,国内,15,朝日新聞デジタル,埼玉の私立中入試、応募者1万6千人増 昨年開校の開智所沢が倍増,https://news.yahoo.co.jp/articles/e817b1dc097d6acdf1809b53cad991f5ded196e1,1/8(水) 20:00
2025-01-09,00:06,domestic,国内,16,ABCニュース,ＪＲ西日本　近畿エリア一部で９日夕方以降運転取り止めの可能性　大雪予報のため,https://news.yahoo.co.jp/articles/e6d5690e1f17cc5fbe98c5d5a711d560231aa39f,1/8(水) 17:23
2025-01-09,00:06,domestic,国内,17,読売新聞オンライン,平地でも警報級の大雪の恐れ、気象庁と国交省が緊急発表…１０日にかけ不要不急の外出控えるよう呼びかけ,https://news.yahoo.co.jp/articles/58bea7538a2f422816921f564ef24736bcf48cf8,1/8(水) 15:30
2025-01-09,00:06,domestic,国内,18,ABEMA TIMES,「君よ、大樹たれ」難病ALSと闘う合唱部の先生、28歳で診断され“失意”も…今、子どもたちに伝えたい思い,https://news.yahoo.co.jp/articles/1b6ed185c013b90d5ff4b6fd8d01f252b8647948,1/8(水) 7:06
2025-01-09,00:06,domestic,国内,19,東海テレビ,出頭した20歳無職の男を逮捕…横断歩道渡っていた男性を車でひき逃げか 被害者は一時意識不明に,https://news.yahoo.co.jp/articles/d318f31b2e150a0ae8bd4a87ffd4c37fc70462ee,1/8(水) 21:28
2025-01-09,00:06,domestic,国内,20,FNNプライムオンライン（フジテレビ系）,ロサンゼルスの高級住宅地で山火事が拡大…非常事態宣言で住民3万人に避難命令　観光地サンタモニカ近くの「パシフィック・パリセーズ」,https://news.yahoo.co.jp/articles/978fabb6acaccf48fe71db225057af1c603937fd,1/8(水) 13:03
2025-01-09,00:06,domestic,国内,21,TBS NEWS DIG Powered by JNN,専修大サッカー部員の男(21)を逮捕　東京・調布市　80代女性からひったくりしけがさせた疑い　高齢女性を狙った余罪も捜査　警視庁,https://news.yahoo.co.jp/articles/a21d395ad299c812829371014904196efca78f06,1/8(水) 16:40
2025-01-09,00:06,domestic,国内,22,朝日新聞デジタル,「最北の秘境駅」から「ばっかい」の駅名標撤去　再設置を望む声も,https://news.yahoo.co.jp/articles/bec1b7355577a966a6ec5d5c0908973c0c362192,1/8(水) 11:00
2025-01-09,00:06,domestic,国内,23,TBS NEWS DIG Powered by JNN,「財源の裏付けのない話はしてはいけない」103万円の壁引き上げ協議めぐり、自民・森山幹事長が国民民主をけん制,https://news.yahoo.co.jp/articles/0a8ae6c23168d52f6c5dd61f6e5058abcd152c74,1/8(水) 16:14
2025-01-09,00:06,domestic,国内,24,共同通信,成田空港の発着上限34万回に　10月末拡大へ自治体と調整,https://news.yahoo.co.jp/articles/e071a69133053ac2e7a14dad8c252933a1f14376,1/8(水) 20:36
2025-01-09,00:06,domestic,国内,25,日刊スポーツ,斎藤元彦兵庫県知事「見ていない」漏えい疑いがある元県幹部の男性のパソコンに保存の私的情報,https://news.yahoo.co.jp/articles/8f36daf3339a08403d5ebdc482293b8cafd6dc81,1/8(水) 17:22
2025-01-09,00:06,domestic,国内,26,BUSINESS INSIDER JAPAN,確定申告2025、知っておきたい「4つの変更点」。e-Taxがますます便利に,https://news.yahoo.co.jp/articles/0b1241d78b20e9d53690ab59fd4f19e548b71773,1/8(水) 20:00
2025-01-09,00:06,domestic,国内,27,tenki.jp,10日(金)にかけて　大雪エリア広がる　交通への影響が拡大する恐れ,https://news.yahoo.co.jp/articles/23203dfaac492592a34459ddeb6885477d150304,1/8(水) 7:17
2025-01-09,00:06,domestic,国内,28,メ〜テレ（名古屋テレビ）,必需品の「イヤホン」使うだけで法律違反の可能性も？　認知度向上が課題の「技適マーク」,https://news.yahoo.co.jp/articles/7abca41022449813efe084e7f80579809c57eb11,1/8(水) 6:00
2025-01-09,00:06,domestic,国内,29,テレビ朝日系（ANN）,ヒグマ目前で車を襲ったあと…こっち向いた！「来たぞ来たぞ」「怖い怖い怖い」,https://news.yahoo.co.jp/articles/1b86af856df9d1b9b0a3378f2f81e59a25927d61,1/8(水) 20:32
2025-01-09,00:06,domestic,国内,30,レスキューナウニュース,東武アーバンパークラインで人身事故 運転再開,https://news.yahoo.co.jp/articles/6282a7eeb281e89815ce755cf03a084313d2332f,1/8(水) 22:05
2025-01-09,00:06,domestic,国内,31,FNNプライムオンライン（フジテレビ系）,路上で面識ない女性にいきなり下半身見せ駐車場に連れ込みわいせつ行為した疑い　自称アルバイトの37歳男を逮捕「全く身に覚えない」,https://news.yahoo.co.jp/articles/c18799d861853e5046e68d2dddfb48c52fd03c8c,1/8(水) 20:54
2025-01-09,00:06,domestic,国内,32,tvkニュース（テレビ神奈川）,JR関内駅近くの焼き肉店で火事　けが人なし　横浜,https://news.yahoo.co.jp/articles/8ff6efae67b84db938f8163764a05922e4cf2a03,1/7(火) 19:08
2025-01-09,00:06,domestic,国内,33,読売新聞オンライン,西武池袋線の踏切で人身事故、池袋―所沢駅間など一時運転見合わせ…午後７時４５分頃に再開,https://news.yahoo.co.jp/articles/7a5dfbd427b2e61b19976f5da6634b1aa3dda53f,1/8(水) 19:09
2025-01-09,00:06,domestic,国内,34,tenki.jp,今季一番の強烈寒波　10日にかけ日本海側は警報級大雪のおそれ　立ち往生のリスク大,https://news.yahoo.co.jp/articles/a243bb4f70375c1702f15fca515d9ce6da527d90,1/8(水) 11:58
2025-01-09,00:06,domestic,国内,35,読売新聞オンライン,兵庫県の斎藤元彦知事、内部告発者の私的データ漏えい疑いで第三者委設置…立花孝志氏が昨秋公開,https://news.yahoo.co.jp/articles/b2f7f239dd84e7a9d48e4c66c8c02f6ac9740429,1/8(水) 20:53
2025-01-09,00:06,domestic,国内,36,時事通信,「父を継ぎ、建設会社つくりたい」　けんか好まず、優しい少年時代　踏切自殺偽装で死亡の高野さん,https://news.yahoo.co.jp/articles/b80afa6ae43f20d8aa7a5113fac38995645837b9,1/8(水) 12:21
2025-01-09,00:06,domestic,国内,37,共同通信,年収の壁「財源裏付けを」　自民森山幹事長、国民民主けん制,https://news.yahoo.co.jp/articles/dc4c339c05499e914c8659e15da69e1d5c28a579,1/8(水) 13:11
2025-01-09,00:06,domestic,国内,38,tenki.jp,明日8日～日本海側で大雪や吹雪　太平洋側の平地も積雪恐れ　10日にかけ交通影響大,https://news.yahoo.co.jp/articles/01e53817a9ed9d82cc1a513147a25ccb44ceec50,1/7(火) 18:03
2025-01-09,00:06,domestic,国内,39,FNNプライムオンライン,長崎にも今季一番の寒波!9日昼過ぎから山地中心に大雪　平地でも9日夜のはじめから10日午前中にかけ大雪のおそれ　積雪も,https://news.yahoo.co.jp/articles/e5c14791733cf6eba9a8a43fb8096b7ddf23b935,1/8(水) 20:52
2025-01-09,00:06,domestic,国内,40,TBS NEWS DIG Powered by JNN,【大雪警報】岐阜県・本巣市に発表,https://news.yahoo.co.jp/articles/ba771ed73781f3af8e5006ea98437fd6cd7a1383,1/8(水) 21:48
