scrp_date,scrp_time,genre_en,genre_jp,rank,media_jp,title,link,date_original
2025-02-27,20:06,domestic,国内,1,読売新聞オンライン,挙式まで３日しかないのに…結婚式場会社が突然の事業停止「許せない、大事な人が集まってくれるのに」,https://news.yahoo.co.jp/articles/1d37f993ab8a9ec39d2eaff30fdb708b3b4d713d,2/27(木) 15:56
2025-02-27,20:06,domestic,国内,2,ENCOUNT,怒号や乱入で「警察呼べ！」　千葉県知事選、立花孝志氏の第一声で騒然…やじ飛ばす聴衆に詰め寄る場面も,https://news.yahoo.co.jp/articles/7ae70d2dcc4ae8700f9cb90f46e03b4b5295cb41,2/27(木) 15:55
2025-02-27,20:06,domestic,国内,3,読売新聞オンライン,「なぜ免許返納しなかったのか」有罪確定９２歳の後悔、赤信号で止まらず衝突した女性引きずる…５年前にも罰金刑,https://news.yahoo.co.jp/articles/545e91ddb63f686124441d0868b1721a4587e985,2/27(木) 16:20
2025-02-27,20:06,domestic,国内,4,弁護士ドットコムニュース,女子プロレス選手の「性的部位」写真をSNSに投稿、訴訟が“勝訴的和解”…解決金100万円と会場出禁,https://news.yahoo.co.jp/articles/00d58cf98555253b765c22b076c29bef44e8a99e,2/27(木) 16:06
2025-02-27,20:06,domestic,国内,5,TBS NEWS DIG Powered by JNN,ノロウイルス猛威　低温・乾燥で1か月生存も…“トイレでスマホ”も要注意【ひるおび】,https://news.yahoo.co.jp/articles/f56d7cd626fd63ba3b43b75d2979c80c328a4c75,2/26(水) 16:39
2025-02-27,20:06,domestic,国内,6,中日スポーツ,堀江貴文さん、トランプ大統領の新政策を「大成功する」と絶賛　真の狙いも推察「ヤバい国ですよ、本当」「2世代、3世代先まで考えていると思う」,https://news.yahoo.co.jp/articles/bb75668712adb60a1ba715cd82e151221c2bcb76,2/27(木) 19:01
2025-02-27,20:06,domestic,国内,7,読売テレビ,【独自解説】女子トイレ行列問題はなぜ改善されないのか？「女性だけが待つじゃないかと頭にきて…」執念の調査から意外な事実が判明⁉さらに行列解消のための画期的なトイレも登場,https://news.yahoo.co.jp/articles/0c50c7147e071853cf336fc29c2b828056b8e84d,2/27(木) 16:00
2025-02-27,20:06,domestic,国内,8,FNNプライムオンライン,消費者からは“ボロカス”生産者からは「よく言った」備蓄米放出に“反対”のJA福井県五連が1050トン入札へ,https://news.yahoo.co.jp/articles/77ab78011ebf4579a9814bde01b01af31a0925cc,2/26(水) 12:22
2025-02-27,20:06,domestic,国内,9,日刊スポーツ,維新・吉村洋文代表「私立の選択肢はないような家庭で育った」合意の高校教育無償化について言及,https://news.yahoo.co.jp/articles/4048448259f57d6f90584773040ecf62407eaf8b,2/27(木) 18:41
2025-02-27,20:06,domestic,国内,10,読売新聞オンライン,「指が飛んだ人もいる」「なめているのか」と問い詰められても…「釣りバカ」女性、漁師目指し奮闘中,https://news.yahoo.co.jp/articles/2a8e9d403c4d41d0edb8e44792e5eed871a4331d,2/27(木) 17:10
2025-02-27,20:06,domestic,国内,11,メ〜テレ（名古屋テレビ）,浴室で倒れていた0歳の女児が死亡　帰宅した夫が発見　愛知・日進市,https://news.yahoo.co.jp/articles/e968d16f167249eaad5a6d2d409ee4b527282278,2/21(金) 7:42
2025-02-27,20:06,domestic,国内,12,読売新聞オンライン,現在１０００円の出国税、３０００～５０００円への引き上げ検討…観光公害対策に使い道拡大へ,https://news.yahoo.co.jp/articles/a1ebbb2126390ef59f5f01f69f0583ca0d664548,2/27(木) 15:00
2025-02-27,20:06,domestic,国内,13,J-CASTニュース,富士山絶景スポットで数十人が撮影で滞留、青信号でも車通れず...　中国人団体客？の迷惑行為動画が拡散,https://news.yahoo.co.jp/articles/be4532fb03d01a331000d52ee471e53ffb8a75a4,2/27(木) 18:18
2025-02-27,20:06,domestic,国内,14,読売新聞オンライン,修学旅行引率の教職員11人、交通費に充てる日当あるのに…業者から無償でバス1日乗車券受け取る,https://news.yahoo.co.jp/articles/61326a3fa557240785e1832f9158e20507b2896e,2/27(木) 11:30
2025-02-27,20:06,domestic,国内,15,ABEMA TIMES,国会に緊張走る「えー！？」「これマズイですよ」…高校無償化→入学金・修学旅行費が“便乗値上げ”？ 立憲・おおつき議員「総理、大臣にもまだ具体策ないですよ。大丈夫ですか？」,https://news.yahoo.co.jp/articles/b95bde36b238e8b26955723cf4bd409cf08ecd7f,2/26(水) 18:24
2025-02-27,20:06,domestic,国内,16,日テレNEWS NNN,【速報】違法麻雀店摘発“賭けマージャン”の疑い 客含む16人逮捕-警視庁,https://news.yahoo.co.jp/articles/f0803da939c1a6866ef0d8e668cb2aaa70fd4389,2/27(木) 14:07
2025-02-27,20:06,domestic,国内,17,スポニチアネックス,維新・吉村代表　誓約書「除名なら議員辞職」守る気ない岸口県議に苦言も「身分強制的に奪えない」,https://news.yahoo.co.jp/articles/f9605c3b3a6375cdfa3a157793558a0e7fbc8480,2/27(木) 15:30
2025-02-27,20:06,domestic,国内,18,毎日新聞,高額療養費制度の見直し案、政府が一時凍結へ　患者団体らが要望,https://news.yahoo.co.jp/articles/2f4dfbef89aab389f6786b9c8ed046a98651f49b,2/27(木) 19:10
2025-02-27,20:06,domestic,国内,19,時事通信,自民税調、160万円案了承　「壁」見直し、修正案国会提出へ,https://news.yahoo.co.jp/articles/2bc208e7b457d16f08594c97c84af873a68b186d,2/27(木) 16:03
2025-02-27,20:06,domestic,国内,20,中日スポーツ,岩手県大船渡市の山火事、Googleマップの表示に驚き「こんな広大に燃えてんのか」「本当に大変な状況なのがわかる」,https://news.yahoo.co.jp/articles/e85cd05d4e8a2b72707caf97a8a9f2ee580547a0,2/27(木) 12:15
2025-02-27,20:06,domestic,国内,21,J-CASTニュース,ホリエモン、ヒカルの「財務省解体デモ」動画批判　本人から反論も「大衆の気持ちがわかってない」,https://news.yahoo.co.jp/articles/bcc257a205552530f710477cb1c55a0ebe1f39a1,2/27(木) 14:30
2025-02-27,20:06,domestic,国内,22,ABEMA TIMES,“高校授業料無償化”で誰が救われるのか 公立校は定員割れ増加のエリアも ひろゆき氏「高校が維持できない地域は20年後に滅亡する」,https://news.yahoo.co.jp/articles/58a52fc0d4bb8b7f444861ec1f44e0c3ad37c97c,2/27(木) 17:02
2025-02-27,20:06,domestic,国内,23,ABEMA TIMES,藤井聡太名人が困惑＆長考！？「次の手を当てるよりも難しい…」女流棋士からの素朴な質問に“フリーズ” ファンは爆笑「真剣に考えてるｗ」「尊すぎるｗ」,https://news.yahoo.co.jp/articles/e3d07f69c3e543bf063703304d3e6ab5904741db,2/27(木) 18:57
2025-02-27,20:06,domestic,国内,24,FNNプライムオンライン（フジテレビ系）,国民民主・榛葉幹事長　「103万の壁」合意に至らず悔しさにじませる「壁の動かし方があまりにもセコい」,https://news.yahoo.co.jp/articles/2a3f619fb0c2d6863769d26e8250f7f2dc79932b,2/27(木) 17:17
2025-02-27,20:06,domestic,国内,25,東海テレビ,車を放置して逃走か…乗用車で軽乗用車と衝突し相手にケガさせ逃げた疑い 50歳男を逮捕「覚えがありません」,https://news.yahoo.co.jp/articles/46a1ba2b2c7e58e4d57c12536a894e06bac4f64f,2/27(木) 17:46
2025-02-27,20:06,domestic,国内,26,Yahoo!ニュース オリジナル 特集,過疎地では除雪できない未来も…除雪クライシスどう乗り越える？ #災害に備える,https://news.yahoo.co.jp/articles/85a9710a6f1d2529c2896237702461ca0066658d,2/27(木) 10:00
2025-02-27,20:06,domestic,国内,27,中日スポーツ,ひろゆきさん、給食無償化に私見 「『食育』とか言うんだから、給食も教育の一環でしょ」,https://news.yahoo.co.jp/articles/41cb666fb75780eb8835d9a310eac4b7183ff38d,2/27(木) 15:00
2025-02-27,20:06,domestic,国内,28,日刊スポーツ,玉木雄一郎氏が怒る「物価高騰に苦しむ国民を救えない」拒否した年収の壁・与党案をバッサリ,https://news.yahoo.co.jp/articles/0627b13e58191810d983e98f8580da4e53251243,2/27(木) 14:29
2025-02-27,20:06,domestic,国内,29,日テレNEWS NNN,【速報】東京都「宿泊税」見直し　2025年内メドに素案示す,https://news.yahoo.co.jp/articles/9472a9d7d43c3c1b24cd7b8818768f63c3ed3d67,2/26(水) 20:47
2025-02-27,20:06,domestic,国内,30,FNNプライムオンライン（フジテレビ系）,都営バスが急ブレーキで乗客9人が頭を打つなどケガ「血を流した男の方が…」車道の自転車避けようとして　東京・江東区,https://news.yahoo.co.jp/articles/500e50c1c055aa3cbaa36e1f8c837b1c5a7f92d6,2/27(木) 19:09
2025-02-27,20:06,domestic,国内,31,テレビ朝日系（ANN）,首都高を　散乱した大量のペットボトルが埋め尽くす　車線規制により一時　6キロ渋滞も,https://news.yahoo.co.jp/articles/1943a7204d3a0aced2386be1b526d16a7c9cb4d7,2/27(木) 17:40
2025-02-27,20:06,domestic,国内,32,時事通信,所得税2万～4万円減に　「年収の壁」再引き上げ　与党案,https://news.yahoo.co.jp/articles/1c51a64994432f826fd7c584486816e3b71a9b5b,2/27(木) 7:06
2025-02-27,20:06,domestic,国内,33,朝日新聞,エレベーターの真下で男性倒れ死亡　神戸・三宮、4階の扉開いた状態,https://news.yahoo.co.jp/articles/6d7b2da953d87076fb06951a99c39ca254bd02ce,2/27(木) 11:03
2025-02-27,20:06,domestic,国内,34,弁護士JPニュース,滋賀医大生らの性的暴行事件「逆転無罪判決」に“反対署名”10万筆　弁護士が危惧する「刑事裁判の大原則」軽視の行く末,https://news.yahoo.co.jp/articles/8e850b32f23bf4a986a0a7e612bae666618132cf,2/24(月) 9:40
2025-02-27,20:06,domestic,国内,35,J-CASTニュース,電車でリュック「前抱え」やめてほしいの声　「車内で迷惑な荷物の持ち方」5位、マナー啓発にも変化,https://news.yahoo.co.jp/articles/2228a4d84d20b0a0bac6cd3062e3018f2304bc55,2/24(月) 16:00
2025-02-27,20:06,domestic,国内,36,中日スポーツ,日本郵便、「トナミ買収」報道に20年前の民営化の因縁 「世の流れの残酷さ」「これほどの皮肉が…」,https://news.yahoo.co.jp/articles/f5f8b7e162b252ecbd025ff35a25431e0f01a64f,2/27(木) 11:25
2025-02-27,20:06,domestic,国内,37,スポーツ報知,「閑静な住宅街で８年間にわたって…迷惑行為を繰り返していました」…「モーニングショー」羽鳥慎一アナが伝えたニュース,https://news.yahoo.co.jp/articles/ed373cd07e49b78d5d5761bce626c3a90f6ec97a,2/27(木) 9:10
2025-02-27,20:06,domestic,国内,38,MBC南日本放送,【東京 横浜 さいたま 来週は雪か?】南岸低気圧 通過  東京の3月4日（火）最高気温7℃ 【雪のシミュレーション3月3日（月）〜4日（火）】,https://news.yahoo.co.jp/articles/dc2279a450e93375f5543921333e18cc255df22e,2/27(木) 16:09
2025-02-27,20:06,domestic,国内,39,時事通信,悠仁さま成年式、9月6日に　19歳の誕生日　宮内庁,https://news.yahoo.co.jp/articles/189f5e3c9332cf040709cc79b937677bc7d3391d,2/27(木) 14:20
2025-02-27,20:06,domestic,国内,40,共同通信,千葉知事選、4氏が届け出　再選期す現職に3新人,https://news.yahoo.co.jp/articles/704d8ffa7a2e40e7245b3d2ee925ac2771091128,2/27(木) 9:51
