scrp_date,scrp_time,genre_en,genre_jp,rank,media_jp,title,link,date_original
2025-12-06,22:12,sports,スポーツ,1,DAZN News,角田裕毅、アブダビGPのFP3終盤ピットロードで痛恨もらい事故＆アタックできず20番手…最速ラッセル、2番手ノリス、3番手フェルスタッペン｜F1,https://news.yahoo.co.jp/articles/41e8fec4af561403ab47e64ba1ee697c6a9bc6ed,12/6(土) 20:49
2025-12-06,22:12,sports,スポーツ,2,サンケイスポーツ,世界王者マリニン、衝撃のフリー世界歴代最高238.24点　SP3位から暫定1位へ／フィギュア,https://news.yahoo.co.jp/articles/1e54056db7bd1285aad34ffbc79c17b01fbd54fa,12/6(土) 20:46
2025-12-06,22:12,sports,スポーツ,3,デイリースポーツ,ドジャース美男美女カップルに「完璧！」「美しい！！！♥」　グラスノー夫妻が結婚式で熱いキス　奥さま会メンバーら祝福,https://news.yahoo.co.jp/articles/ca8878c145d95b5a76689002e24620c0c3bb920f,12/6(土) 8:52
2025-12-06,22:12,sports,スポーツ,4,東スポWEB,【バレーボール】西田有志　試合後に第一子誕生を公表！　妻は女子代表元主将・古賀紗理那さん,https://news.yahoo.co.jp/articles/ff45cbb5ed763a4ef1d2d039ff667f1c4035b94b,12/6(土) 20:45
2025-12-06,22:12,sports,スポーツ,5,テレ東スポーツ,日本が今大会初黒星 中国を追い詰めるも5-8で惜敗 2ndステージ5勝1敗で最終フランス戦へ【卓球 混合団体W杯】,https://news.yahoo.co.jp/articles/dbd1045aa01b9dbce7287e444a97f36186a347e4,12/6(土) 15:21
2025-12-06,22:12,sports,スポーツ,6,デイリースポーツ,「沈めてみろやコラァ！筋肉ジジイが！」問題児大阪喧嘩自慢と元関東最強ギャング最高幹部が壮絶殴り合い大乱闘で騒然「沈めてやるよ、リングの上でな」,https://news.yahoo.co.jp/articles/992bf15dfb70edd2eb10cdb5f2ac758b61a48c9f,12/6(土) 17:28
2025-12-06,22:12,sports,スポーツ,7,Full-Count,NPB去り5年…元阪神右腕が衝撃143キロ「まだやれそう」　剛速球連発にSNS騒然「すごいな」,https://news.yahoo.co.jp/articles/18ba1687bdb003067f76eaaacd29b86244fc8942,12/6(土) 19:21
2025-12-06,22:12,sports,スポーツ,8,イーファイト,陸上美女“ムキ子”、ゴールで倒れ込み腹筋を激しく上下！黒タイツ美脚で739段を登り切る,https://news.yahoo.co.jp/articles/f7d68984a3d08ca0d4bcb1ef180e11eff41f8129,12/6(土) 18:17
2025-12-06,22:12,sports,スポーツ,9,motorsport.com 日本版,ラッセル最速、ノリス、フェルスタッペンが続く。角田裕毅はピットでまさかのもらい事故……最下位に終わる｜F1アブダビGP FP3レポート,https://news.yahoo.co.jp/articles/39371e6466d92dc3d7e8cf9e9ea5c6922b536c04,12/6(土) 20:54
2025-12-06,22:12,sports,スポーツ,10,TBS NEWS DIG Powered by JNN,鍵山優真は銀メダル、マリニンが世界初全6種の4回転7本成功で逆転V　佐藤駿が会心演技で3位【GPファイナル】,https://news.yahoo.co.jp/articles/cbc705c2b3dd18f538bcb13cad0924ea0281c6a1,12/6(土) 20:55
2025-12-06,22:12,sports,スポーツ,11,スポニチアネックス,内川聖一氏の頭に浮かんだ次回WBCに“呼んだら面白い”選手　「凄く重要視される」ポジションとは,https://news.yahoo.co.jp/articles/6680ebb9850cca9d0c715e7bf1b07548722efa60,12/6(土) 19:41
2025-12-06,22:12,sports,スポーツ,12,CoCoKARAnext,「一体何があったの？」金メダルから7年で激変…ザギトワの「現在の姿」にネット驚愕「すっかり大人の女性に」,https://news.yahoo.co.jp/articles/e42744d0d82574e60091859b17a540cdb758b487,12/6(土) 16:24
2025-12-06,22:12,sports,スポーツ,13,スポニチアネックス,茨城県勢がJ1、J2制覇の快挙！　鹿島は9年ぶり　水戸は初　過去には神奈川県勢の2カテゴリー制覇も,https://news.yahoo.co.jp/articles/5ac130aafbbd7e08e132c3328a612b08060e8933,12/6(土) 17:07
2025-12-06,22:12,sports,スポーツ,14,東スポWEB,ドジャースに衝撃の超大型トレード報道　グラスノーらと最強左腕スクバル「ドジャースも喜んで応じる」,https://news.yahoo.co.jp/articles/02b94b4b5bdea4345c66768fb507c0170b1d8aff,12/6(土) 14:25
2025-12-06,22:12,sports,スポーツ,15,Full-Count,10月に戦力外…30歳に届いた“朗報”「感謝の気持ちでいっぱい」　消えぬ闘志「頑張るぞ」,https://news.yahoo.co.jp/articles/0c8eb1fc23c869c6fc9ef4c695d607cdb1061127,12/6(土) 15:30
2025-12-06,22:12,sports,スポーツ,16,デイリースポーツ,世界王者マリニンが大逆転３連覇！衝撃のフリー世界新２３８・２４点　自身の記録約１０点更新！会場騒然の神演技　４アクセル含む６種類７本の４回転成功　１５点差逆転し王座死守　鍵山は無念２位,https://news.yahoo.co.jp/articles/0cdb8720215e828f604a7850c0ee8c7cd3a07681,12/6(土) 20:39
2025-12-06,22:12,sports,スポーツ,17,GOAL,日本代表は17位に！抽選会が終わった時点でのワールドカップ優勝候補はどこ？出場国パワーランキング,https://news.yahoo.co.jp/articles/535bcda2d56e327171847779c648df44fe38cf34,12/6(土) 20:02
2025-12-06,22:12,sports,スポーツ,18,スポニチアネックス,鹿島・鬼木監督　FW鈴木優磨にシャーレを手渡したワケ「あんな風ぼうですけど」「凄いところは…」,https://news.yahoo.co.jp/articles/a464805b1000d7757838cf52d79c0de593438f8f,12/6(土) 18:33
2025-12-06,22:12,sports,スポーツ,19,デイリースポーツ,奢られてきた総額が破格すぎてヤバっ「今も絶対に奢ってくれる」世界記録の球界スター　西山秀二氏の告白に浜田雅功も爆笑,https://news.yahoo.co.jp/articles/b297687cbd01c390f4a7a0573c636ff9fdfe9ef7,12/6(土) 17:45
2025-12-06,22:12,sports,スポーツ,20,東スポWEB,【卓球】混合団体Ｗ杯　中国が日本に勝利も国内から不満「男子は苦戦した」「弱点を露呈」,https://news.yahoo.co.jp/articles/8549aed4ac2568621d44681bd5a68eac69dfced3,12/6(土) 18:15
2025-12-06,22:12,sports,スポーツ,21,Full-Count,ド軍補強“第1号”にまさかの声続出「どうなってやがるんだ」　明かされた順位…「????」,https://news.yahoo.co.jp/articles/4501b2899fd1fc837766e690c391a0ad9a72877f,12/6(土) 12:39
2025-12-06,22:12,sports,スポーツ,22,バレーボールキング,日本代表のOP西田有志が第1子の誕生を試合終了後に発表！「無事に母子ともに健康に生まれてきました」,https://news.yahoo.co.jp/articles/8791a3bd1bc2f4917e8230c176937f3dac4f57c0,12/6(土) 20:32
2025-12-06,22:12,sports,スポーツ,23,Full-Count,日本ハムと最大11億円契約の報道も…不発だった助っ人　防御率6点台から描く“逆襲”,https://news.yahoo.co.jp/articles/da0b7dafb92e70da7572939d61cf6bcb06266897,12/6(土) 18:35
2025-12-06,22:12,sports,スポーツ,24,スポニチアネックス,【柔道GS東京】阿部詩が来年世界選手権の代表内定最速で決めた！日本勢対決制して5度目の優勝,https://news.yahoo.co.jp/articles/78ae7708082b76d8a4d79da71421a5b4a9295ba9,12/6(土) 18:46
2025-12-06,22:12,sports,スポーツ,25,日テレNEWS NNN,【卓球】混合団体W杯・日本が中国相手に粘りを見せるも敗戦　ドイツは韓国に8-7の死闘を制す　残すはラスト1試合,https://news.yahoo.co.jp/articles/92b4c21bc048c4629c1a2d3cef7fcde70b41744d,12/6(土) 17:05
2025-12-06,22:12,sports,スポーツ,26,中日スポーツ,【J1名古屋】退団のユンカーが挨拶、「苦しいことたくさん…1つだけ失望させられなかったものがあります」通訳号泣のハプニングも,https://news.yahoo.co.jp/articles/c58c308177a0cd3d35e97faa626d807f657844e4,12/6(土) 19:14
2025-12-06,22:12,sports,スポーツ,27,デイリースポーツ,【チャンピオンズＣ】馬場状態から浮上するのはこの馬だ,https://news.yahoo.co.jp/articles/682f6c1c1189efb15da918637fe6c7aac7956e17,12/6(土) 20:19
2025-12-06,22:12,sports,スポーツ,28,motorsport.com 日本版,F1アブダビGP FP3速報｜角田裕毅はまたしても受難。ピットレーンでアントネッリに突っ込まれ、アタックできず最下位20番手。最速はラッセル,https://news.yahoo.co.jp/articles/6ec65a75533b932200b51ebb400ae3170593e175,12/6(土) 20:33
2025-12-06,22:12,sports,スポーツ,29,日刊スポーツ,「１連勝中」粗品、チャンピオンズＣも３連複勝負だがありえない馬番18が…,https://news.yahoo.co.jp/articles/e2c834d804fc5abc68351f892949de65d9fcc165,12/6(土) 19:57
2025-12-06,22:12,sports,スポーツ,30,スポニチアネックス,出会いは“球場ナンパ”！ドジャース“グラスノー王子”が結婚！ウエディングショット公開,https://news.yahoo.co.jp/articles/e3299560d64aab80c7254ca86e2ea9239b443c5f,12/6(土) 9:13
2025-12-06,22:12,sports,スポーツ,31,Full-Count,鷹の契約更改に異変　日本一も3人目の保留者…三笠GMが語る正当性「中身は控えるが」,https://news.yahoo.co.jp/articles/9e956e7528252caadbd90e96ccaba74e6ee1e84b,12/6(土) 16:30
2025-12-06,22:12,sports,スポーツ,32,デイリースポーツ,３５歳になったキム・ヨナの姿に衝撃「若返った！？」５歳下夫とのデートショットに反響「顔がだんだん似てきた」「高校生みたい」,https://news.yahoo.co.jp/articles/415e437afd1602b039988cdb4dd1c95599aab4e6,12/6(土) 19:30
2025-12-06,22:12,sports,スポーツ,33,CoCoKARAnext,角田裕毅はなぜ構想から漏れたのか　レッドブル幹部たちが証言した決断の舞台裏「我々は驚くべき可能性に賭けるべきだと…」,https://news.yahoo.co.jp/articles/beb69e741e33cd6802ce366e8b90b3be3445679e,12/6(土) 18:00
2025-12-06,22:12,sports,スポーツ,34,スポーツ報知,ドジャースのイケメン右腕が結婚！観客席の美女に一目ぼれ驚きの“ナンパ”で交際開始のＴ・グラスノー,https://news.yahoo.co.jp/articles/f6e94b686ae3365262cdd789759f20f868829da8,12/6(土) 4:58
2025-12-06,22:12,sports,スポーツ,35,日テレNEWS NNN,日本は初黒星　中国相手に第5戦までもつれる激闘　松島輝空や戸上＆篠塚ペアが奮闘「次は3-0で」「息のあったコンビネーションがさく裂した」,https://news.yahoo.co.jp/articles/d522a348cd374eece49b47dfd0d1ce7b864344b2,12/6(土) 18:45
2025-12-06,22:12,sports,スポーツ,36,イーファイト,【ボクシング】まるで別人！？フルトンが”ぽってり”お腹で計量オーバー、ライト級暫定王座戦に変更へ,https://news.yahoo.co.jp/articles/2d90273c57d0b8729509ba62585af5dc30bfedd5,12/6(土) 19:27
2025-12-06,22:12,sports,スポーツ,37,スポーツ報知,フリーで世界最高を更新のマリニン「めっちゃつかれた」を連呼も「日本でみなさんの前で演技ができて光栄」…ＧＰファイナル,https://news.yahoo.co.jp/articles/af85e30c9920e3589c5806e36ef91fe222a2f32a,12/6(土) 21:10
2025-12-06,22:12,sports,スポーツ,38,スポニチアネックス,SP悔し涙の坂本花織　ラストGPFでやり切った笑顔　華麗なスケーティング披露し会場も大きな拍手,https://news.yahoo.co.jp/articles/4a1652b5195670c246352926dc4d2229a4f9397b,12/6(土) 21:36
2025-12-06,22:12,sports,スポーツ,39,スポーツ報知,【広島】今季２冠の小園海斗、ＴＧＣで“モデルデビュー”渡辺リサと夫婦そろってランウェー登場,https://news.yahoo.co.jp/articles/c104fb113f065c46f0f654d8d7800071254d2c87,12/6(土) 18:16
2025-12-06,22:12,sports,スポーツ,40,Full-Count,判明したド軍の方針が賛否「ガッカリだ」　“No.1”を巡りファン本音「誰もとらないのか」,https://news.yahoo.co.jp/articles/9bfee6cae165a6d05d838326fbff9c627341785c,12/6(土) 21:30
