scrp_date,scrp_time,genre_en,genre_jp,rank,media_jp,title,link,date_original
2025-10-08,12:17,TTL,総合,1,Full-Count,佐々木朗希の“選外”にLA驚き　試合終了から70分後…ド軍公式の投稿が話題「最高の1枚」,https://news.yahoo.co.jp/articles/a52e586341f1ff7668c65cf02ddce2e9fa4b2a09,10/8(水) 9:54
2025-10-08,12:17,TTL,総合,2,日刊スポーツ,「支持率下げてやる」トレンド　高市早苗総裁待ちの記者音声？拾った動画拡散でSNS「酷過ぎ」,https://news.yahoo.co.jp/articles/7f5c87f0162dbb4365d945abb7b8c04a12cc77b7,10/8(水) 10:24
2025-10-08,12:17,TTL,総合,3,日刊スポーツ,北村晴男氏、上野千鶴子氏の初女性首相「うれしくない」発言に“２文”で返答「もう２度と…」,https://news.yahoo.co.jp/articles/438ea4a4a6f9ec6763efae0ffc19748a901bfef7,10/8(水) 7:22
2025-10-08,12:17,TTL,総合,4,Full-Count,ハーパー、山本由伸を「覚えていない」　4月に対戦も…まさかの謝罪「申し訳ない」,https://news.yahoo.co.jp/articles/8d01f675790c86a12aa29657c8a8cba001da7f7f,10/8(水) 7:10
2025-10-08,12:17,TTL,総合,5,RONSPO,「メジャー史上最も馬鹿な采配のひとつ」佐々木朗希を9回頭から起用しなかったロバーツ監督“迷走継投”を通算116セーブのフィリーズOBが過激批判「佐々木がいなければゴミ箱みたいなブルペン」,https://news.yahoo.co.jp/articles/98a8e882285174ace1214e91022751be1e42f85d,10/8(水) 5:54
2025-10-08,12:17,TTL,総合,6,弁護士JPニュース,伊東市議選「田久保派」7人当選で“失職回避”も…「極めて難しい」元市長が“非現実性”を指摘するワケ,https://news.yahoo.co.jp/articles/d8df6f4ae2297f2e6b46f46ee6db4a4f07db79c9,10/8(水) 10:20
2025-10-08,12:17,TTL,総合,7,時事通信,立民、玉木氏での一本化提案　首相指名、国民民主は慎重姿勢,https://news.yahoo.co.jp/articles/7d3db34f8314c17372160079ab8792e85dd75716,10/8(水) 11:17
2025-10-08,12:17,TTL,総合,8,日刊スポーツ,「支持率下げてやる」拡散動画に反応か　テレ東名物記者「冗談であれ、許されない言葉がある」,https://news.yahoo.co.jp/articles/9d08b8c36bc3918d77dba9487ad204351197ff73,10/8(水) 8:18
2025-10-08,12:17,TTL,総合,9,スポニチアネックス,ド軍指揮官「現時点では最優先の選択肢」佐々木朗希が抑えの第1候補と明言　連投は体調見極め判断へ,https://news.yahoo.co.jp/articles/6001350b5643bd353c54e41037cf2368681e6d45,10/8(水) 9:23
2025-10-08,12:17,TTL,総合,10,読売テレビ,【急展開】ヘンリー王子がチャールズ国王と電撃面会も『王室復帰計画』にウィリアム皇太子は大激怒⁉さらにメーガン妃の元友人が暴露した“本性”とは,https://news.yahoo.co.jp/articles/51afc5912167162703e255b54ea247baec5efa3a,10/8(水) 8:00
2025-10-08,12:17,TTL,総合,11,よろず～ニュース,がん闘病中の大先輩から「大丈夫」と激励→直後に訃報　3児のシンママ菊川怜、最後の会話が日々の励み【徹子の部屋】,https://news.yahoo.co.jp/articles/7b2e9b72e2627e8ae69634943557194b3a34401d,10/8(水) 6:50
2025-10-08,12:17,TTL,総合,12,オリコン,江口寿史のイラスト騒動広がる　新たにセゾンカード声明で企業対応追われる,https://news.yahoo.co.jp/articles/c45b805a0bb81f06b3fa8085a762ed1e2c5f0918,10/8(水) 8:20
2025-10-08,12:17,TTL,総合,13,ABEMA TIMES,DAIGO（47）＆北川景子（39）夫妻、家族で雨の東京ディズニーランドを満喫 投稿写真に「美しい」「貴重な2ショット」の声,https://news.yahoo.co.jp/articles/8e08e0363de8ead8a5e82e4a454bbffda3b70488,10/8(水) 9:27
2025-10-08,12:17,TTL,総合,14,ABEMA TIMES,小泉進次郎氏、ラスト演説で“異変”…「相当ショックだったのだろう」ジャーナリストが指摘,https://news.yahoo.co.jp/articles/a09d99f1d07a346ef8d37af8f4fb8e64263b68e2,10/8(水) 11:30
2025-10-08,12:17,TTL,総合,15,RONSPO,「サッカー界として許容できない」機内で児童ポルノ閲覧容疑でパリで逮捕された影山雅永・技術委員長を解雇したJFA“ツネ様”宮本恒靖会長が激怒…本人は「仏で禁止されているとは知らなかった」,https://news.yahoo.co.jp/articles/d0c2dea2b56e0d83b4c71dd3c4d4bbc6f235a16d,10/8(水) 6:02
2025-10-08,12:17,TTL,総合,16,デイリースポーツ,元国民的アイドル３０歳　母がバツ２、祖父母は離婚「私も同じ道たどってしまうんでは…」と不安吐露,https://news.yahoo.co.jp/articles/c2b8551668f6e01565c4e68a803467297c0d281b,10/8(水) 9:45
2025-10-08,12:17,TTL,総合,17,デイリースポーツ,西村優菜が３年ぶり米女子ツアー最終予選会挑戦の意向　自身のＳＮＳで明かす「今のわたしの目標はＬＰＧＡにある」,https://news.yahoo.co.jp/articles/bc6a040cfb6328e06283fc39db3eb23c90d4943e,10/8(水) 8:53
2025-10-08,12:17,TTL,総合,18,テレビユー山形,"【台風情報】今後は ""ダブル台風"" になる可能性...日本の南に新たな ""台風のたまご"" 発生　台風に発達後は日本列島に接近の可能性も　台風22号（ハーロン）のこのあとの勢力と進路は?　今後の全国の天気を画像で　気象庁",https://news.yahoo.co.jp/articles/85b08d987a8ea860a5ce96392b8993cd4258b04b,10/8(水) 11:08
2025-10-08,12:17,TTL,総合,19,スポニチアネックス,Cocomi　「甘えん坊さん」の愛犬の後ろに写る人物に反響「父がちら写り」「匂わせストーリー良すぎ」,https://news.yahoo.co.jp/articles/b5cf85d4bf6f0efdbd19d3ceec12f51da2f34fc2,10/8(水) 9:19
2025-10-08,12:17,TTL,総合,20,LASISA,一夜で異例の熱狂ぶり！『じゃあ、あんたが作ってみろよ』が話題に！SNSで「共感の爆弾」が炸裂,https://news.yahoo.co.jp/articles/7cc3c89ea23b80a47eb92b5fb362f3104ab2aced,10/8(水) 11:35
2025-10-08,12:17,TTL,総合,21,産経新聞,「麻生さんと裏金安倍派の復権だ」辻元氏、玉木氏に連携訴え　司会が制止も〝独演〟止まず,https://news.yahoo.co.jp/articles/35a445968e1581928529a200a2e8b74873bd9dcf,10/8(水) 7:00
2025-10-08,12:17,TTL,総合,22,スポニチアネックス,ブルズ河村勇輝　3P＆チーム最多タイ5Aの存在感！プレシーズン初戦で途中出場　わずか1分で3A決めた,https://news.yahoo.co.jp/articles/4d60ea3cb5d6e085a532db7752a11b38c697fabf,10/8(水) 10:35
2025-10-08,12:17,TTL,総合,23,読売新聞オンライン,高市総裁、写真撮影で麻生氏を右隣に…後ろ盾演出か,https://news.yahoo.co.jp/articles/8c0384044ac316984a68782707ba2cfcfe974e5a,10/8(水) 7:52
2025-10-08,12:17,TTL,総合,24,デイリースポーツ,田崎史郎氏　高市新執行部に「いつか仕返ししてやろうと爪研いでる人いる」　“勝ち組”一色に「麻生さん主導の人事」,https://news.yahoo.co.jp/articles/735ea5416912bd70889c7e81461656b69516b61e,10/8(水) 11:47
2025-10-08,12:17,TTL,総合,25,RBC琉球放送,新たな台風発生へ  フィリピンの東から日本の南へ向かう予想進路　22号を追いかけるようなW台風になるおそれ（8日午前11時現在）,https://news.yahoo.co.jp/articles/0c0ed70858e6606d954b5f5f08b1b5a2fcea8920,10/8(水) 11:45
2025-10-08,12:17,TTL,総合,26,Full-Count,ヤ軍へ容赦なき酷評「恥ずかしいチーム」　246億円左腕が炎上…迫る“終焉”にファン怒り,https://news.yahoo.co.jp/articles/b4b2301e8ac61526d7c976bafeed1ea183422b38,10/8(水) 10:30
2025-10-08,12:17,TTL,総合,27,Full-Count,ベッツが感謝してもしきれないド軍同僚　身近にいたお手本、苦難の1年で不可欠だった支え,https://news.yahoo.co.jp/articles/7a0dafffbd582394e3059731fefd961980686553,10/8(水) 8:57
2025-10-08,12:17,TTL,総合,28,デイリースポーツ,巨人・田中将　日米通算２００勝は久保コーチとの「積み重ね」　９月２１日敗戦翌日に即行動で修正,https://news.yahoo.co.jp/articles/f9738bb0aed0170782ffc07e015a28aeeaa04275,10/8(水) 10:00
2025-10-08,12:17,TTL,総合,29,日刊スポーツ,ハーパー「奇妙でクレイジー」本塁打王争った大谷翔平、シュワバーいても本塁打１本に,https://news.yahoo.co.jp/articles/1ad8d282468bdf28ce49b38499f37f6cbe1a90d3,10/8(水) 8:16
2025-10-08,12:17,TTL,総合,30,ねとらぼ,ソファでくつろぐ赤ちゃん→たった半年で……　父「こんな育つ!?」同じ場所で撮影した“衝撃の姿”が194万再生,https://news.yahoo.co.jp/articles/4a5669f0e6d57ee7a227e0642903dab1ffe739d0,10/8(水) 8:20
2025-10-08,12:17,TTL,総合,31,J-CASTニュース,プレーヤー気取る政治部記者たち　高市会見待ちながら「支持率下げてやる」...中継で流れて大ヒンシュク,https://news.yahoo.co.jp/articles/085327efbde839e1251c110bafe0130259a4a396,10/8(水) 10:15
2025-10-08,12:17,TTL,総合,32,オリコン,容姿をいじられ、お笑い担当だった高校生→10年後…無整形で“K-POPアイドル”級イケメンに「母に誰かわからないと驚かれました」,https://news.yahoo.co.jp/articles/5234eee7c6bb7c67698239a405530712839a94c1,10/8(水) 8:00
2025-10-08,12:17,TTL,総合,33,ABEMA TIMES,「そんな奥まで…」藤井聡太王座の“情報処理能力”に解説棋士が大混乱？挑戦者・伊藤匠叡王も「軽視していた」驚異の角引き,https://news.yahoo.co.jp/articles/bf67d77f32952bf5ae0ea607ac632fcb98cff59e,10/8(水) 7:30
2025-10-08,12:17,TTL,総合,34,ねとらぼ,クマが生息している都道府県に色を塗ってみたら……　「意外すぎた」まさかの結果に「えっ……本当？」「不思議だ」,https://news.yahoo.co.jp/articles/aa85da5073951ea53efa6b2f403e8f6056595e03,10/7(火) 19:30
2025-10-08,12:17,TTL,総合,35,47NEWS,車体に開けられた四角い穴…狙われる愛車、その対策で十分？　「まさか自分の家が」住宅もターゲットに、被害は深刻化,https://news.yahoo.co.jp/articles/53765da6415b80aa441b0708545f0f2954d9f873,10/8(水) 9:02
2025-10-08,12:17,TTL,総合,36,岐阜新聞デジタル,バスに２歳児１時間放置、アラーム手順外操作→出欠確認も怠る　岐阜・大垣市の認定園で９月,https://news.yahoo.co.jp/articles/ade33e45c0f5e5e3d18b1ca6aa7ec08292b7c7cf,10/8(水) 8:10
2025-10-08,12:17,TTL,総合,37,まいどなニュース,両親は芸能界の大物…加熱する週刊誌報道で運動会に来られなかった父、ファンに囲まれた背中を見た娘の思い【徹子の部屋】,https://news.yahoo.co.jp/articles/c9242ffa4460ea363ef362d1705acc6b3c815e2b,10/8(水) 7:30
2025-10-08,12:17,TTL,総合,38,西日本新聞,「事実上の麻生政権」高市執行部に戸惑いの声　「ぎりぎりアウトだ」火種になりそうな人事も,https://news.yahoo.co.jp/articles/258c5ce4ab321770e7553be0b38809f453275024,10/8(水) 11:41
2025-10-08,12:17,TTL,総合,39,デイリースポーツ,カズレーザー、麻生色強い高市人事に皮肉「どんだけ反対されても派閥は存続させた方が得だった」,https://news.yahoo.co.jp/articles/b742b4b2de774890fe61f03f0c9f8972683323d9,10/8(水) 9:26
2025-10-08,12:17,TTL,総合,40,LIMO,【老後】65歳以上の無職夫婦世帯、「ひと月の生活費」はいくら？シニア世代の平均貯蓄額・みんなの年金月額も紹介,https://news.yahoo.co.jp/articles/c2f3dd15478d7736732a5e9d6aecf8d6654a9ba0,10/7(火) 6:46
