scrp_date,scrp_time,genre_en,genre_jp,rank,media_jp,title,link,date_original
2025-10-08,15:10,sports,スポーツ,1,TBS NEWS DIG Powered by JNN,侍ジャパン、11月韓国戦の代表メンバー発表！井端監督「競争が第一」牧＆岡本ら23年WBC組から7人選出、2冠王・佐藤輝は外れる【一覧】,https://news.yahoo.co.jp/articles/874c4fe449c6e7774ef8b4107014a7abdbcf3f04,10/8(水) 14:11
2025-10-08,15:10,sports,スポーツ,2,Full-Count,佐々木朗希の“選外”にLA驚き　試合終了から70分後…ド軍公式の投稿が話題「最高の1枚」,https://news.yahoo.co.jp/articles/a52e586341f1ff7668c65cf02ddce2e9fa4b2a09,10/8(水) 9:54
2025-10-08,15:10,sports,スポーツ,3,Full-Count,ド軍勝利後…失意のトライネンを慰めた人物「だから好き」　中継に映った一幕「うるっときた」,https://news.yahoo.co.jp/articles/772739f644616ef83dedc57706afc037e44c8b1b,10/8(水) 12:23
2025-10-08,15:10,sports,スポーツ,4,デイリースポーツ,【一覧】侍ジャパン２８選手を発表　阪神・佐藤輝、ヤクルト・村上は招集見送り　井端監督「二遊間と外野の１ポジションを見極めたい」１１月に韓国戦,https://news.yahoo.co.jp/articles/02b5002eeba497ec2b77345b1d994c9c0583e12d,10/8(水) 14:09
2025-10-08,15:10,sports,スポーツ,5,Full-Count,“崖っぷち”ヤ軍が5点差逆転勝ち　ジャッジが起死回生の同点3ラン…投手陣は3戦29失点,https://news.yahoo.co.jp/articles/2468fd4e12c4cda4894b67522d8ec379c2c3ebc7,10/8(水) 12:38
2025-10-08,15:10,sports,スポーツ,6,Full-Count,「二度と守備をさせるな」　タイガース28歳に批判殺到…チームを崖っぷちに追い込み「酷すぎ」,https://news.yahoo.co.jp/articles/ebf091dea931ffe305c81e6f6bc3b32d2aef1070,10/8(水) 11:53
2025-10-08,15:10,sports,スポーツ,7,日刊スポーツ,【侍ジャパン】11月韓国戦の代表発表　ヤクルト村上宗隆、阪神佐藤輝明ら選外選手一覧,https://news.yahoo.co.jp/articles/a97331d051905a29e93709eaee7dd59338db73b1,10/8(水) 14:29
2025-10-08,15:10,sports,スポーツ,8,J-CASTニュース,ドジャースのキム・ヘソン、「地区シリーズでも無視される」...出場機会恵まれず韓国メディア嘆き節「大勝しないと出場できないのか？」,https://news.yahoo.co.jp/articles/dce0e50e148b4535dbd21e7d9a29016ac83e9b54,10/8(水) 14:07
2025-10-08,15:10,sports,スポーツ,9,デイリースポーツ,巨人　戦力外通告の今村がジャイアンツ球場で調整　現役続行でＮＰＢ希望,https://news.yahoo.co.jp/articles/a14b56eba525f8a14dfbef26ec8befea2a47629c,10/8(水) 12:34
2025-10-08,15:10,sports,スポーツ,10,高校野球ドットコム,未完の152キロ右腕が高卒3年目で戦力外…故障続きで二軍戦で未登板,https://news.yahoo.co.jp/articles/9f7bd84c975a1c8f8195e253265fa99893ebb354,10/8(水) 12:47
2025-10-08,15:10,sports,スポーツ,11,デイリースポーツ,ロッテ　サブロー新監督が就任会見「甘さを取り除いて厳しい練習を」目指すスタイルは「守り勝つ野球、粘りのある攻撃とうまい走塁」,https://news.yahoo.co.jp/articles/c9254bf89aa17761f51fafde8c80e1d2b0d03682,10/8(水) 12:39
2025-10-08,15:10,sports,スポーツ,12,デイリースポーツ,ロバーツ監督、ついに佐々木朗希を「抑え」に指名　発言に変化「間違いなく第一選択肢」　鮮やか火消し2セーブ目から一夜明け,https://news.yahoo.co.jp/articles/cd738ee4db0671cbd5cfc40019b06b597a76e164,10/8(水) 11:32
2025-10-08,15:10,sports,スポーツ,13,スポニチアネックス,侍ジャパン　11月の韓国戦メンバー28人発表　来春WBCの東京Rで対戦　大勢、伊藤、岡本、牧、森下ら,https://news.yahoo.co.jp/articles/353b4ca6b623cb84a664f75cd59aa2812324ba27,10/8(水) 14:08
2025-10-08,15:10,sports,スポーツ,14,スポニチアネックス,2冠王の阪神・佐藤輝が侍ジャパンのメンバー外れる　韓国と強化試合,https://news.yahoo.co.jp/articles/365438d095c79f13d72c9fc0a57e6234dff3b677,10/8(水) 14:00
2025-10-08,15:10,sports,スポーツ,15,日刊スポーツ,【阪神】２冠王・佐藤輝明は侍ジャパンに選出されず　40本塁打＆102打点と突出した成績も,https://news.yahoo.co.jp/articles/ff5ba0e08151e1f862bc7dfe13549918cafa9c22,10/8(水) 14:25
2025-10-08,15:10,sports,スポーツ,16,スポーツ報知,青学大はエース黒田朝日ら出雲駅伝メンバーに加え「キーマン荒巻朋熈」ら登録　全日本大学駅伝,https://news.yahoo.co.jp/articles/e656879b0b87c98f2f7c3697ce91cf7e08e1f3a2,10/8(水) 12:11
2025-10-08,15:10,sports,スポーツ,17,Full-Count,ハーパー、山本由伸を「覚えていない」　4月に対戦も…まさかの謝罪「申し訳ない」,https://news.yahoo.co.jp/articles/8d01f675790c86a12aa29657c8a8cba001da7f7f,10/8(水) 7:10
2025-10-08,15:10,sports,スポーツ,18,RONSPO,「サッカー界として許容できない」機内で児童ポルノ閲覧容疑でパリで逮捕された影山雅永・技術委員長を解雇したJFA“ツネ様”宮本恒靖会長が激怒…本人は「仏で禁止されているとは知らなかった」,https://news.yahoo.co.jp/articles/d0c2dea2b56e0d83b4c71dd3c4d4bbc6f235a16d,10/8(水) 6:02
2025-10-08,15:10,sports,スポーツ,19,Full-Count,侍ジャパン、強化試合・韓国戦の28人を発表　牧、岡本らWBC“世界一戦士”は7人,https://news.yahoo.co.jp/articles/1c50bcacb094bdd436bb540031512b5122ecf528,10/8(水) 14:07
2025-10-08,15:10,sports,スポーツ,20,デイリースポーツ,なぜ？リーグ２冠の阪神・佐藤輝は侍ジャパンに選出されず　強化委員長「コンディション面の不安で見送った選手も」,https://news.yahoo.co.jp/articles/e4f4b7730a506e6bc70129385c6fd444d6c6dadb,10/8(水) 14:43
2025-10-08,15:10,sports,スポーツ,21,東スポWEB,元Ｆ１戦士が角田裕毅の残留を支持　ハジャール昇格は不満「３、４人が犠牲になっている」,https://news.yahoo.co.jp/articles/38851e5f490083cc2d715a536159bec64ab10e5b,10/8(水) 11:55
2025-10-08,15:10,sports,スポーツ,22,日刊スポーツ,「すでに泣きそう」「玉置浩二は強すぎる」ザ・ロイヤルファミリーの主題歌発表にネット騒然,https://news.yahoo.co.jp/articles/366ba9f0b570feb64f615428b06f8f09922cf3a9,10/8(水) 11:46
2025-10-08,15:10,sports,スポーツ,23,中日スポーツ,日韓戦の代表メンバー28人発表　中日からは高橋宏斗、金丸夢斗、松山晋也、岡林勇希の4選手　阪神・佐藤輝明は選ばれず【侍ジャパン】,https://news.yahoo.co.jp/articles/ba1f0f998545b5893461ce6b968bf146f61b7bf1,10/8(水) 14:28
2025-10-08,15:10,sports,スポーツ,24,4years.,【全日本大学駅伝】チームエントリー・シード8校編　國學院大は連覇なるか、駒澤大は佐藤圭汰がエントリー,https://news.yahoo.co.jp/articles/3b158ada16b4d37ab8eddd158f3171c1d6ceab3c,10/8(水) 13:23
2025-10-08,15:10,sports,スポーツ,25,月刊陸上競技,【陸上】マラソン日本記録保持者・鈴木健吾が富士通を退部「マラソンランナーとして新たなステージに挑戦」,https://news.yahoo.co.jp/articles/e7e7ac50dd414ba26238a9dab0357f2dda71c006,10/8(水) 12:07
2025-10-08,15:10,sports,スポーツ,26,日テレNEWS NNN,【サッカーU-20W杯】ラウンド16の戦いスタート　スペインとメキシコが8強入り　日本はフランスと激突,https://news.yahoo.co.jp/articles/066abd347b719ca1529d35e95044e1fad3824dd2,10/8(水) 12:30
2025-10-08,15:10,sports,スポーツ,27,Full-Count,3戦29失点…260億円左腕が大炎上「ひでーな」　ヤ軍の止まらぬ“投壊”にSNSも疑問視,https://news.yahoo.co.jp/articles/c673db06d41513442b7c5a1f4b3ea9157d0c0b1f,10/8(水) 13:13
2025-10-08,15:10,sports,スポーツ,28,ハフポスト日本版,巨人・矢野謙次コーチ、ホテル竹園芦屋からの豪華差し入れに感激「めちゃくちゃ美味い」,https://news.yahoo.co.jp/articles/4cd0badcda720ef3da281932a429f93e5cfc6cbc,10/8(水) 12:42
2025-10-08,15:10,sports,スポーツ,29,RONSPO,「メジャー史上最も馬鹿な采配のひとつ」佐々木朗希を9回頭から起用しなかったロバーツ監督“迷走継投”を通算116セーブのフィリーズOBが過激批判「佐々木がいなければゴミ箱みたいなブルペン」,https://news.yahoo.co.jp/articles/98a8e882285174ace1214e91022751be1e42f85d,10/8(水) 5:54
2025-10-08,15:10,sports,スポーツ,30,東スポWEB,ニック・ボールが井上尚弥戦を熱望「みんなが『いつ？』と聞いてくる」 来夏以降に実現か,https://news.yahoo.co.jp/articles/b1ca212a29fe7c8de30183d8f5e92e58cb720d76,10/8(水) 11:50
2025-10-08,15:10,sports,スポーツ,31,高校野球ドットコム,侍ジャパンが強化試合のメンバー28名を発表！中日から最多の4選手！阪神・坂本らが初選出,https://news.yahoo.co.jp/articles/171845771f20f35673bef7e66d3b481b5fa15c75,10/8(水) 14:37
2025-10-08,15:10,sports,スポーツ,32,スポーツ報知,渋野日向子は菅沼菜々、桑木志帆と同組　原英莉花、岩井姉妹ら出場　スタンレーレディス初日組合せ発表,https://news.yahoo.co.jp/articles/f5826c055d6254d57b5addcc2f6eb2336b4ea705,10/8(水) 12:14
2025-10-08,15:10,sports,スポーツ,33,CoCoKARAnext,「絶対、打てると思う」阪神24歳ドラ1右腕の打者転向プランに球界OB太鼓判　「ものすごい非凡なものを持っている」,https://news.yahoo.co.jp/articles/1a98b464f16b74772feaa0d3c1291b83c496ce5b,10/8(水) 12:20
2025-10-08,15:10,sports,スポーツ,34,J SPORTS,史上初！無失点3連勝で快進撃のU-20日本代表、195cmジダン4男の壁を越え22年ぶりのベスト8進出なるか｜FIFA U-20 ワールドカップ チリ 2025,https://news.yahoo.co.jp/articles/9c02101c3323f449c31e60ae5570f698de7625f4,10/8(水) 12:16
2025-10-08,15:10,sports,スポーツ,35,Full-Count,ベッツが感謝してもしきれないド軍同僚　身近にいたお手本、苦難の1年で不可欠だった支え,https://news.yahoo.co.jp/articles/7a0dafffbd582394e3059731fefd961980686553,10/8(水) 8:57
2025-10-08,15:10,sports,スポーツ,36,サンケイスポーツ,オリックス・若月健矢が8年ぶりに侍ジャパンに選出　曽谷龍平は今春の強化試合に続いて日の丸入り,https://news.yahoo.co.jp/articles/1b4d9c7b22cf4b9ce4c78d21001439cd19ff35a3,10/8(水) 14:00
2025-10-08,15:10,sports,スポーツ,37,Full-Count,侍ジャパン、漏れた主な選手は？　米挑戦の村上、2冠佐藤輝は選出されず…周東＆近藤も,https://news.yahoo.co.jp/articles/04b0b2616e49a243d509075c80a9b23e186f6a14,10/8(水) 14:31
2025-10-08,15:10,sports,スポーツ,38,中日スポーツ,J1名古屋・骨折のMF中山克広は今季絶望　長谷川監督、代わりとなる選手問われ「無理です」チームにとって痛すぎる離脱,https://news.yahoo.co.jp/articles/a2fed5428d1113a4237c32d0e8165f84255d7732,10/8(水) 14:19
2025-10-08,15:10,sports,スポーツ,39,スポニチアネックス,江川卓氏　“主力が変わる”ソフトバンク強さの不思議「対戦相手は分析が難しいと思う」,https://news.yahoo.co.jp/articles/b83a36118b9e009d33485b5d557f30919e26e1b4,10/8(水) 14:24
2025-10-08,15:10,sports,スポーツ,40,Full-Count,トライネンが失いつつある信頼　ド軍監督が明かした“疑念”「素晴らしい経歴あるが…」,https://news.yahoo.co.jp/articles/8df9004f38423932893f26d2a45e9157fbccc69d,10/8(水) 11:00
