scrp_date,scrp_time,genre_en,genre_jp,rank,media_jp,title,link,date_original
2025-10-08,11:32,business,経済,1,LIMO,【老後】65歳以上の無職夫婦世帯、「ひと月の生活費」はいくら？シニア世代の平均貯蓄額・みんなの年金月額も紹介,https://news.yahoo.co.jp/articles/c2f3dd15478d7736732a5e9d6aecf8d6654a9ba0,10/7(火) 6:46
2025-10-08,11:32,business,経済,2,帝国データバンク,神奈川県内で分譲マンション事業を手がけていたビッグヴァンが破産,https://news.yahoo.co.jp/articles/cf2593044ef355008070c2fabc3e14192aed4084,10/8(水) 10:06
2025-10-08,11:32,business,経済,3,LIMO,「NISAつみたて投資枠フル活用して15年間投資！」その後15年間継続保有したら合計30年で元本はどう変わる？,https://news.yahoo.co.jp/articles/6ff6d3e4615c7a96f98916cde6b0190395cb6eaa,10/8(水) 6:01
2025-10-08,11:32,business,経済,4,みんかぶマガジン,もしあなたが“草津町長”になったら裁判にいくら金がかかるのか…性加害していなくても覚悟するべき驚きの額「もし録音なかったらどうなる？」,https://news.yahoo.co.jp/articles/1e0308e2fb855cd5abbcce2a2fc4748ae47a0285,10/8(水) 9:10
2025-10-08,11:32,business,経済,5,東京商工リサーチ,中古車買取・販売の（株）カートップ（東京）が破産,https://news.yahoo.co.jp/articles/ae8a7d412824dae7b3aa6043025a17bafaa58d62,10/8(水) 10:21
2025-10-08,11:32,business,経済,6,ロイター,アサヒＧＨＤへのサイバー攻撃、ランサムウエア集団「Qilin」が犯行声明,https://news.yahoo.co.jp/articles/2ce1ed5124e708aacbf89545937973bc49094b5d,10/8(水) 7:18
2025-10-08,11:32,business,経済,7,共同通信,アサヒ攻撃でハッカー集団が犯行声明,https://news.yahoo.co.jp/articles/7e2411dc490245d86c058edc4c2c567ac4e634aa,10/8(水) 8:52
2025-10-08,11:32,business,経済,8,ファイナンシャルフィールド,単身赴任中の夫から毎月「10万円」の生活費が私名義の口座に振り込まれます。友人に贈与税について心配されたのですが、申告が必要なんでしょうか？,https://news.yahoo.co.jp/articles/7e53fd14a6b02b117daf1b718e6316964a8c709a,10/7(火) 13:30
2025-10-08,11:32,business,経済,9,LIMO,【厚生年金と国民年金】10月15日の年金支給日に「40万円（月額20万円）以上もらえる人」は何パーセント？,https://news.yahoo.co.jp/articles/ff986bb3f079d2e73185e0718a453fce49070958,10/7(火) 12:36
2025-10-08,11:32,business,経済,10,Bloomberg,ピクテが日本株買い増し、高市政権の政策期待－投資に一段の拡大余地,https://news.yahoo.co.jp/articles/f3ba0597d4720c5036d45f8418d27e4e24fdf117,10/8(水) 10:05
2025-10-08,11:32,business,経済,11,東京商工リサーチ,マンション分譲の（株）ビッグヴァン（東京）が破産,https://news.yahoo.co.jp/articles/7a34eece4eba5e24a117dd6741cf430e7068a85e,10/8(水) 10:04
2025-10-08,11:32,business,経済,12,Bloomberg,日産、「リーフ」の新型発売も悲観的な声－小さい市場の食い合いに,https://news.yahoo.co.jp/articles/729b224c96afcfab8c94c48cd9b8a49976eb7e14,10/8(水) 10:03
2025-10-08,11:32,business,経済,13,J-CASTニュース,影響拡大の江口寿史氏「トレパク疑惑」騒動　「桜美林大学」イラスト利用中止＆グッズ販売停止へ,https://news.yahoo.co.jp/articles/7b06719e59a984cfd4751e8e396349188a0f0226,10/6(月) 20:43
2025-10-08,11:32,business,経済,14,ファイナンシャルフィールド,残クレが終わったアルファード、査定は120万円。「このまま乗るか」「買い替えるか」で迷っています。費用を抑えるならどっち？,https://news.yahoo.co.jp/articles/6d4f2177c1fe8ed3e2c33f65718c3fc24a36df1e,10/7(火) 18:20
2025-10-08,11:32,business,経済,15,乗りものニュース,もともと「さんふらわあ」でした――日韓航路で23年 まもなく“別の国際航路”へ 波乱万丈すぎる功労船,https://news.yahoo.co.jp/articles/e647310d6ad04d94efb6658e46ea8e41dde6608f,10/8(水) 9:42
2025-10-08,11:32,business,経済,16,AUTOCAR JAPAN,【次期ワゴンRか】スズキが軽自動車のEVコンセプト『ビジョンeスカイ』発表へ！スイフトスポーツはまだ出ない？,https://news.yahoo.co.jp/articles/4b3b513cd5f8ce3ba7698458074175f25a665966,10/8(水) 11:00
2025-10-08,11:32,business,経済,17,帝国データバンク,学習塾の倒産、9月までに37件　過去最多ペースで推移,https://news.yahoo.co.jp/articles/aef9a3e56490ed3c2be2f2475a48e240bab6083c,10/8(水) 10:02
2025-10-08,11:32,business,経済,18,TBS CROSS DIG with Bloomberg,セールスフォース、ハッカーの身代金要求に応じず-顧客データ流出,https://news.yahoo.co.jp/articles/8dea7e4b8c1dfaa57005d4f7ab4279070ece6dba,10/8(水) 10:02
2025-10-08,11:32,business,経済,19,乗りものニュース,事故で破損の「最新ハイブリッド特急」影響深刻 代打で「臨時快速」運転 3連休前の平日に,https://news.yahoo.co.jp/articles/8472ba77b2fb1a9d6d5097a8a40a26b0c971e01c,10/8(水) 7:42
2025-10-08,11:32,business,経済,20,ファイナンシャルフィールド,親から毎月5万円の住宅ローン援助。「ありがたい」と思っていたら「贈与にならないように注意してね」と友人にと言われました。この金額でも贈与税の対象になるのでしょうか？,https://news.yahoo.co.jp/articles/c7b57ca23e6c51c380f3fe0a69773efb132f9e93,10/8(水) 8:20
2025-10-08,11:32,business,経済,21,ファイナンシャルフィールド,夫の退職金は2200万円。でも「老後はこれじゃ足りないかも」と言われました。この金額だと実際どんな暮らし向きになるのでしょうか？,https://news.yahoo.co.jp/articles/f6fe057a506a234ef9850740d73921e0f32d4e42,10/8(水) 6:40
2025-10-08,11:32,business,経済,22,Bloomberg,「高市銘柄」本命にインフレ恩恵株が浮上、財政拡張で物価高再加速も,https://news.yahoo.co.jp/articles/cbf24dd89cb5a3cd225676ac792f38575fa17c8d,10/8(水) 8:03
2025-10-08,11:32,business,経済,23,帝国データバンク,設計士からも愛された「keep消しゴム」製造のホシヤ（東京）が破産,https://news.yahoo.co.jp/articles/a12b193af6c68b06bec559d9e2e321948bbc9606,10/8(水) 10:54
2025-10-08,11:32,business,経済,24,食品産業新聞社ニュースWEB,「資さんうどん」がフードコートに初出店/「ららぽーとTOKYO-BAY店」リニューアルオープンに合わせ、10月31日開業,https://news.yahoo.co.jp/articles/8c82b4a635be2db72f4686ac27e92b181dec1b01,10/8(水) 10:07
2025-10-08,11:32,business,経済,25,朝日新聞,万博の運営費、230億～280億円の黒字見込み　建設費は別,https://news.yahoo.co.jp/articles/d01bbdee6829a61fdcc433a815c5a558aac64b5e,10/7(火) 16:19
2025-10-08,11:32,business,経済,26,共同通信,日産、8年ぶり新型リーフ販売へ　フル充電で700キロ,https://news.yahoo.co.jp/articles/3f9f76dc106cccba41ee1932a1b3597cab821f90,10/8(水) 10:00
2025-10-08,11:32,business,経済,27,共同通信,ハッカー集団が犯行声明　アサヒにサイバー攻撃,https://news.yahoo.co.jp/articles/22b80ef0ae62eb17141878a74a423a51eb6ea312,10/8(水) 9:19
2025-10-08,11:32,business,経済,28,ITmedia ビジネスオンライン,宇宙人がバイト？　セブン謎CMの“真意”が分かるとゾッとする理由,https://news.yahoo.co.jp/articles/8cc128ac65d4ca19675e4d7c92ea40a1b40da7c5,10/8(水) 6:10
2025-10-08,11:32,business,経済,29,時事通信,〔東京株式〕切り返す＝TOPIXは取引時間中の最高値更新（8日前場中盤）,https://news.yahoo.co.jp/articles/ae08c35bfeb6cc0038e31cebd8756d06aafdfeb1,10/8(水) 10:30
2025-10-08,11:32,business,経済,30,信濃毎日新聞デジタル,開設以来赤字…地域で唯一、陽子線で先進的がん治療ができる施設、経営厳しく休止へ　地方の病院、経営維持へ「選択と集中」,https://news.yahoo.co.jp/articles/82130fc843feafde7fe3ce35473e300f9a493f52,10/7(火) 6:31
2025-10-08,11:32,business,経済,31,時事通信,ハッカー集団、犯行声明か　アサヒGHDシステム障害,https://news.yahoo.co.jp/articles/399bee50614ea9085745c1bf7431412381dab1a1,10/8(水) 10:33
2025-10-08,11:32,business,経済,32,TBS NEWS DIG Powered by JNN,薄い・軽い・折り曲げOK「夢の太陽電池」 “日本発”技術でスマホもEVも「充電いらず」に?【Bizスクエア】,https://news.yahoo.co.jp/articles/b0b84842a5176a98a019d0c17fa8bfda9bef22ed,10/8(水) 7:31
2025-10-08,11:32,business,経済,33,FNNプライムオンライン（フジテレビ系）,【速報】金価格の高騰続き1グラム2万1500円突破し最高値更新する2万1632円に,https://news.yahoo.co.jp/articles/f0fff887cd3f69661fba06d22a8125ebf53b4e2f,10/8(水) 9:39
2025-10-08,11:32,business,経済,34,GetNavi web,ライブ翻訳って本当に便利？ アップルのワイヤレスイヤホン「AirPods Pro 3」を海外で試してみた,https://news.yahoo.co.jp/articles/2db60df34da99b64ea59b5a06a2f8e7d7b0e9ae2,10/7(火) 20:10
2025-10-08,11:32,business,経済,35,LIMO,【70歳代の平均貯蓄額】シニアはいくら持っている？厚生年金＋国民年金の平均月額と夫婦世帯の生活費,https://news.yahoo.co.jp/articles/84d4d60fab19ffd5186c54cad600a54569792fa2,10/7(火) 20:31
2025-10-08,11:32,business,経済,36,Car Watch,日産、新型「リーフ」（第3世代）の受注を10月17日開始 まずは航続距離702km達成の「B7」グレードから,https://news.yahoo.co.jp/articles/ac7951537c5621131882dbf6b659169a28700c32,10/8(水) 11:00
2025-10-08,11:32,business,経済,37,Bloomberg,植田日銀総裁、利上げでジレンマに直面－高市総裁誕生でかじ取り困難,https://news.yahoo.co.jp/articles/2ff4a5b40632093101ac5f5fd68799594c149040,10/8(水) 7:02
2025-10-08,11:32,business,経済,38,ロイター,日産、日本向け新型リーフの航続距離は最大702キロ　価格518ー599万円,https://news.yahoo.co.jp/articles/701e303dbccc2db246d401d6784334539185c437,10/8(水) 10:32
2025-10-08,11:32,business,経済,39,ファイナンシャルフィールド,9月中に「みどりの封筒」が届いた方が対象！ 10月から年金が“月額5450円”上乗せされる対象者とは？ 「年金生活者支援給付金」の支給対象を改めておさらい,https://news.yahoo.co.jp/articles/fbd50c683d6d8dee59af1ffa1db3c815555f6843,10/6(月) 13:10
2025-10-08,11:32,business,経済,40,ニュースイッチ,核融合実験炉向け外側垂直ターゲット、三菱重工が初号機完成,https://news.yahoo.co.jp/articles/28afbb08e20d5be9e3c178ae20925a4452a3349d,10/8(水) 10:10
