scrp_date,scrp_time,genre_en,genre_jp,rank,media_jp,title,link,date_original
2024-03-23,19:16,sports,スポーツ,1,Full-Count,水原一平氏に“学歴詐称疑惑”　米報道…名門大卒業のはずが「通っていた記録ない」,https://news.yahoo.co.jp/articles/699e72c63f742e2b1fdbcf29cf504b9ee9e7ce9e,3/23(土) 14:57
2024-03-23,19:16,sports,スポーツ,2,CoCoKARAnext,「ギリギリの生活だった」水原元通訳の新証言 米ESPNで大谷翔平に肩代わりを求めた理由を告白「翔平を見るのは辛かった」,https://news.yahoo.co.jp/articles/92ab2cdc436e40442b100e46ee9cdb5152a99c9e,3/23(土) 11:03
2024-03-23,19:16,sports,スポーツ,3,中日スポーツ,19日の大谷翔平のコメントとして「何度か大金の送信をしました。送れる最大限度額でした」水原氏の借金を肩代わりしたと米ESPNが報道,https://news.yahoo.co.jp/articles/fb081afbe5ee63ab00d43184519c8c8ea1abea1f,3/23(土) 16:53
2024-03-23,19:16,sports,スポーツ,4,スポーツ報知,米ＮＢＣ局が水原一平氏の学歴詐称疑惑報じる,https://news.yahoo.co.jp/articles/e2f3e33effaaa78fd8ce5c30a423729555ac7297,3/23(土) 16:50
2024-03-23,19:16,sports,スポーツ,5,Full-Count,水原一平氏、友人や家族からお金を借りていた　米メディアに明かした窮状＆年俸,https://news.yahoo.co.jp/articles/2f0a6a539eadcb1af193211004587b4b79be514f,3/23(土) 12:46
2024-03-23,19:16,sports,スポーツ,6,TBS NEWS DIG Powered by JNN,尊富士が新入幕Vお預けも緊急事態...朝乃山との取組後花道では車いす→右足負傷で病院へ　大の里が3敗死守,https://news.yahoo.co.jp/articles/73d69151759f07b7366353f125a39d0941b39a24,3/23(土) 17:27
2024-03-23,19:16,sports,スポーツ,7,中日スポーツ,「せいぜい年収50万ドルの通訳にあんな大金、大谷翔平の承諾なしにブックメーカーが賭けさせるのはあり得ない」MLB関係者が断言,https://news.yahoo.co.jp/articles/435f6ca2414724e4b9ffa2d4628ea12f7b008189,3/23(土) 13:08
2024-03-23,19:16,sports,スポーツ,8,西スポWEB OTTO！,6度のV誇る東福岡がまさかの1回戦敗退…藤田監督「これだけミスをしたら勝てない」【全国高校選抜ラグビー】,https://news.yahoo.co.jp/articles/bf88ba46f85bfa573119c2975503af14653efd0d,3/23(土) 16:35
2024-03-23,19:16,sports,スポーツ,9,デイリースポーツ,阪神・岡田監督が前川の開幕スタメンを明言「右やったら使うよ。そらもう、そんなん。打つんやから使ったら」,https://news.yahoo.co.jp/articles/0df4eba64aea3eaaab2fe9b0e5ee4a9c158edeb5,3/23(土) 17:07
2024-03-23,19:16,sports,スポーツ,10,日刊ゲンダイDIGITAL,新婚ホヤホヤ真美子夫人を直撃、米国生活の根幹揺るがす「水原夫人」の離脱【大谷「相棒」違法賭博でクビの裏側と波紋】,https://news.yahoo.co.jp/articles/13201eebe4f5f9bb1307cccaa8b2da75e241786c,3/23(土) 14:00
2024-03-23,19:16,sports,スポーツ,11,CoCoKARAnext,「オオタニはミズハラを頼り続けていた」大谷翔平が水原元通訳の衝撃事実を知る“緊迫の瞬間”を球団関係者が告白,https://news.yahoo.co.jp/articles/abaf9b215dc16333f255d2aa270d242fcf2343e8,3/23(土) 15:02
2024-03-23,19:16,sports,スポーツ,12,中日スポーツ,「翔平の信頼を失うのが怖かった」「妻はこのことをいまも全く知りもしない」水原一平通訳の苦悩の告白を米ESPNが報道,https://news.yahoo.co.jp/articles/eeffde57f509992f22596347c02deca60253f04d,3/23(土) 18:13
2024-03-23,19:16,sports,スポーツ,13,デイリースポーツ,尊富士、１１０年ぶり新入幕Ｖ目前に緊急事態　右足負傷　朝乃山に敗れて２敗目　足ひきずり花道から車いすで医務室直行　その後、顔面蒼白で救急車で病院へ　偉業目前のアクシデントに場内騒然,https://news.yahoo.co.jp/articles/4e147c62a104e72a22de17fc1602cb581b709d03,3/23(土) 17:25
2024-03-23,19:16,sports,スポーツ,14,RONSPO,なぜドジャースは契約前にスキャンダルを起こした水原一平通訳の身辺調査をしていなかったのか…米メディアが問題視…MLB機構は大谷翔平の調査に乗り出す,https://news.yahoo.co.jp/articles/8206b8e837ff64662dc32ad514cab6704222e26a,3/23(土) 7:04
2024-03-23,19:16,sports,スポーツ,15,デイリースポーツ,楽天・田中将大が巨人・坂本に「ひざかっくん」で奇襲　振り返った坂本の目がまん丸に　２人は小学校の同級生,https://news.yahoo.co.jp/articles/222128e68e729b8eef253d7a2f350c7fea48a519,3/23(土) 13:35
2024-03-23,19:16,sports,スポーツ,16,ゴルフ総合サイト ALBA Net,臼井麗香が初優勝に王手　山下美夢有2位、小林夢果3位,https://news.yahoo.co.jp/articles/79061c7f5239ee8af970c3d860255327ce620990,3/23(土) 16:25
2024-03-23,19:16,sports,スポーツ,17,スポニチアネックス,戦後最年少のJFA会長誕生　宮本恒靖氏が就任会見　元W杯戦士、元Jリーガーとして初,https://news.yahoo.co.jp/articles/d0efe0659f59fb1c24a6c8547a43ff3a94b785d3,3/23(土) 15:07
2024-03-23,19:16,sports,スポーツ,18,ENCOUNT,【RIZIN】山本アーセン、まさかの105秒一本負け…ネットもあ然「トイレ行ってる間に終わった」,https://news.yahoo.co.jp/articles/bc4ac99b51272f5e0dc100ba716a8d5c3f68d076,3/23(土) 16:51
2024-03-23,19:16,sports,スポーツ,19,スポニチアネックス,ドジャース・大谷に超強力守護神！デップ＆ディカプリオの法律事務所が全面サポート,https://news.yahoo.co.jp/articles/15e3ea8807fb39b4a44dbd71bb49f96c5554ba57,3/23(土) 4:00
2024-03-23,19:16,sports,スポーツ,20,日刊ゲンダイDIGITAL,米国での評価は急転直下…「ユニコーン」から一夜にして「ピート・ローズ」になった背景【ドジャース大谷に吹き荒れる春の嵐】,https://news.yahoo.co.jp/articles/139f108011d3069bf8a1e64f2d6e6e719431e63d,3/23(土) 15:59
2024-03-23,19:16,sports,スポーツ,21,中日スポーツ,尊富士が2敗目　新入幕優勝は千秋楽へ持ち越し　足を痛めたか…車椅子で引き揚げ、救急車で病院へ【大相撲】,https://news.yahoo.co.jp/articles/402e7989395ebd2675fdd869111bc5eb4d7c947e,3/23(土) 17:36
2024-03-23,19:16,sports,スポーツ,22,Full-Count,大谷翔平、水原一平氏との写真を削除　フォロー外しに続き…ド軍解雇でSNSでも決別,https://news.yahoo.co.jp/articles/9a0513060277df0a4d79fa2fab3eb1dd76c5b483,3/23(土) 17:59
2024-03-23,19:16,sports,スポーツ,23,日刊スポーツ,尊富士が大阪市内の病院へ救急搬送、右足首付近負傷　膝から下ギプスで固定、車椅子で運ばれる,https://news.yahoo.co.jp/articles/8f9c20d3ed4b85726a56bdd6a77c9204290baa42,3/23(土) 18:27
2024-03-23,19:16,sports,スポーツ,24,スポニチアネックス,米NBC 水原一平氏の学歴詐称を報道　カリフォルニア大学リバーサイド校「彼が通っていた記録はない」,https://news.yahoo.co.jp/articles/40d6e17f2c3c9ddf2db126c47904a97f406d80c8,3/23(土) 14:02
2024-03-23,19:16,sports,スポーツ,25,東スポWEB,「僕は金を盗まれたんだ」大谷翔平　水原通訳〝裏切り〟聞いた第一声…ＬＡ敏腕記者明かす,https://news.yahoo.co.jp/articles/00391fbe724d5467b40195a6c282c52a73589249,3/22(金) 19:56
2024-03-23,19:16,sports,スポーツ,26,Full-Count,水原一平氏「妻は知らない」　違法賭博関与の疑い…大谷翔平には「言いたくなかった」,https://news.yahoo.co.jp/articles/7d16085a3c060271e6e51f69c7c595b869893efe,3/23(土) 10:43
2024-03-23,19:16,sports,スポーツ,27,ゲキサカ,元なでしこ鮫島彩の春らしい写真に絶賛続々「モデルさんかと思った」「美しい」「スタイル良い」,https://news.yahoo.co.jp/articles/cabcf43ea1dff0a575d78046c8f3e87b4af30d4d,3/23(土) 13:47
2024-03-23,19:16,sports,スポーツ,28,毎日新聞,優勝持ち越しの尊富士、右足けがか　車いすで引き揚げ　春場所,https://news.yahoo.co.jp/articles/fa7073306530291c8f6ca803ca79527e302afc49,3/23(土) 18:08
2024-03-23,19:16,sports,スポーツ,29,産経新聞,記憶に残る献身的プレー　大谷翔平選手と結婚の田中真美子さん　バスケ女子ユニバ代表、チーム支える,https://news.yahoo.co.jp/articles/fcc86d9859355e063302508c6b2c348c81504d2c,3/23(土) 18:00
2024-03-23,19:16,sports,スポーツ,30,CoCoKARAnext,「在籍した記録はない」水原元通訳に新問題も浮上 米放送局が“学歴詐称疑惑”を指摘「オオタニのイメージを汚す可能性」,https://news.yahoo.co.jp/articles/cd79fc0c0f8265004c9769f4a301955cef7078fe,3/23(土) 16:40
2024-03-23,19:16,sports,スポーツ,31,ABEMA TIMES,優勝をかけた一番で尊富士にアクシデント発生「これは大変なことになりました…」車椅子に乗って花道から引き揚げる事態にどよめき広がる,https://news.yahoo.co.jp/articles/02d55699bc0f5005ce58e51117eb0338cddfd29e,3/23(土) 18:06
2024-03-23,19:16,sports,スポーツ,32,スポニチアネックス,尊富士　2敗目で110年ぶり新入幕Vは千秋楽へ持ち越し　右足痛め車いすで医務室直行…救急車で病院へ,https://news.yahoo.co.jp/articles/3401bb7747f1097675485d469f8a0da1d3a04af6,3/23(土) 17:23
2024-03-23,19:16,sports,スポーツ,33,Full-Count,水原氏の賭博疑惑…違法胴元は元同僚と面識か　米報道、エ軍宿舎で「ポーカーに参加」,https://news.yahoo.co.jp/articles/cd86fdb2fa9658a2bce2f772e041425c2a5a4e25,3/23(土) 17:01
2024-03-23,19:16,sports,スポーツ,34,デイリースポーツ,阪神・岡田監督「そんな出んことはないから、おまえ。前飛んだらどっか落ちるよ」中野の３５打席ぶり安打に安ど【一問一答】,https://news.yahoo.co.jp/articles/03bb124a6f8ad6f552b1a432b6118aa23c96a711,3/23(土) 17:31
2024-03-23,19:16,sports,スポーツ,35,motorsport.com 日本版,角田裕毅、メルセデス＆アストンマーティンと互角の走りで2戦連続Q3進出。課題は決勝「全てをまとめ上げなければいけない」,https://news.yahoo.co.jp/articles/8199cb664bbc58810e51a65d35e278fb53894178,3/23(土) 17:10
2024-03-23,19:16,sports,スポーツ,36,東スポWEB,大谷翔平は真美子夫人と米帰国も…　水原一平氏の韓国脱出ルート「第三国に潜伏」説が浮上,https://news.yahoo.co.jp/articles/393c6d3e9971f6ea7eedb23e36f3bcb1577a6533,3/23(土) 6:16
2024-03-23,19:16,sports,スポーツ,37,デイリースポーツ,豊昇龍の自滅にＮＨＫアナ「作戦失敗でした」と実況　琴ノ若との大関対決に寄り倒しで敗れ、優勝争いから脱落,https://news.yahoo.co.jp/articles/8f62d78e143a12ea21dbc3e7663163cb980854d0,3/23(土) 18:24
2024-03-23,19:16,sports,スポーツ,38,motorsport.com 日本版,”お昼寝”ペレス、他車妨害で3グリッドの降格ペナルティ。F1オーストラリアGP決勝では6番手スタートに,https://news.yahoo.co.jp/articles/4e51094407802f616a7fc7de581e59da7ce76519,3/23(土) 18:26
2024-03-23,19:16,sports,スポーツ,39,スポニチアネックス,春場所優勝争いは千秋楽へ持ち越し　大の里3敗死守　尊富士は初V目前で緊急事態、右足痛め救急搬送,https://news.yahoo.co.jp/articles/fa18a988e146cfdf0e5db6e36cfd9dd2736c6f08,3/23(土) 17:58
2024-03-23,19:16,sports,スポーツ,40,中日スポーツ,「カリフォルニア州でスポーツ賭博は違法だが、起訴の確率はほぼゼロ」とギャンブル専門の米教授、同州では“事実上黙認”,https://news.yahoo.co.jp/articles/d675b74d8bc37e48bfde3db64390905bb540f437,3/23(土) 13:32
