scrp_date,scrp_time,genre_en,genre_jp,rank,media_jp,title,link,date_original
2023-12-14,21:33,entertainment,エンタメ,1,J-CASTニュース,遠野なぎこ、婚約者と破局　「彼が1回破った約束」とは...まさかの原因に共演者唖然「フェアじゃない」,https://news.yahoo.co.jp/articles/14c0d0cb5b327c7baae9efdb0a268587e7ffc118,12/14(木) 11:44
2023-12-14,21:33,entertainment,エンタメ,2,クランクイン！,オズワルド畠中の熱愛報道に芸人らザワつく「これを超えるニュースはもう自分の人生ではありえない」,https://news.yahoo.co.jp/articles/896185c33e00397e20ce09f50acb44652c989ae1,12/14(木) 18:00
2023-12-14,21:33,entertainment,エンタメ,3,ENCOUNT,再ブレークのおじさん芸人、15歳時が“国宝級イケメン”　ファン騒然「全部かっこいい」,https://news.yahoo.co.jp/articles/7022fde359c8d13632a17fc1224f29adecebb6e7,12/14(木) 19:02
2023-12-14,21:33,entertainment,エンタメ,4,スポニチアネックス,遠野なぎこ「痩せた」の声に傷心「まるで言葉の暴力だよ。病気なんだよ…。私だって努力してるんだよ…」,https://news.yahoo.co.jp/articles/8983aa4d3db9a3775710c2825b43b3667bda5896,12/14(木) 15:36
2023-12-14,21:33,entertainment,エンタメ,5,モデルプレス,オズワルド畠中、井上咲楽との“真剣交際”報道に反応,https://news.yahoo.co.jp/articles/1e0c68104e3300c1e80cd03bff036b011e037770,12/14(木) 19:10
2023-12-14,21:33,entertainment,エンタメ,6,モデルプレス,パク・ソジュン、本名を告白 芸名の理由に驚きの声,https://news.yahoo.co.jp/articles/d35efb2d3734638c6606d512c3ee4186d1d6d3ba,12/14(木) 16:33
2023-12-14,21:33,entertainment,エンタメ,7,ENCOUNT,チョコプラ松尾、原因不明の腹痛で大病院へ　まさかの病名判明で本音ポツリ「年末なのにな」,https://news.yahoo.co.jp/articles/268959888c3d30eb3eeee632c8f7e9e2f7f98209,12/14(木) 17:26
2023-12-14,21:33,entertainment,エンタメ,8,TBS NEWS DIG Powered by JNN,遠野なぎこさん　破局を報告　年下婚約者と　「私から『お別れしてもらえますか?』って相手の方に告げました」　マッチングアプリも再開　「もう3人とデートしました」,https://news.yahoo.co.jp/articles/6b874ed156c2d5ee601bf78987d6156f03dd1694,12/13(水) 21:29
2023-12-14,21:33,entertainment,エンタメ,9,デイリースポーツ,ＱｕｉｚＫｎｏｃｋから人気メンバーが卒業発表　東大法学部卒「前に進めないと思った　やり続けるのは違うと」今後は未定,https://news.yahoo.co.jp/articles/331e7e6aaa9dfa0667e9f0ec4a68477121cb333d,12/14(木) 17:21
2023-12-14,21:33,entertainment,エンタメ,10,スポニチアネックス,美保純　2人の超大物俳優に同時に口説かれた過去「どっちも凄い存在感」「あの2人は全然説教しなかった」,https://news.yahoo.co.jp/articles/8475c98691095c429eeae987990b087643c3da79,12/14(木) 15:58
2023-12-14,21:33,entertainment,エンタメ,11,スポニチアネックス,チョコプラ松尾　腹痛で病院受診しまさかの病名判明「これを機に本当にちゃんとしようって思った」,https://news.yahoo.co.jp/articles/cb460210b2379be27c019a72ed43208eb8ef7f4b,12/14(木) 12:14
2023-12-14,21:33,entertainment,エンタメ,12,ENCOUNT,朝比奈彩、第1子妊娠を正式発表「新たな命に感謝しながら」　夫は三代目JSB・山下健二郎,https://news.yahoo.co.jp/articles/9c844d73f5e413cd3e1829aa31d06118a49454f1,12/14(木) 13:01
2023-12-14,21:33,entertainment,エンタメ,13,ねとらぼ,経営者グラドル、ぷろたんの「女性127人リスト」入り→本人が事実と認める「いい感じだったときが」　現在の関係性も言及,https://news.yahoo.co.jp/articles/a8528b94a553e7a6b2a45ae96c77945e8e480289,12/14(木) 14:49
2023-12-14,21:33,entertainment,エンタメ,14,オリコン,有働由美子『news zero』来年3月卒業　後任は藤井貴彦アナ　『news every.』はダブルメインキャスターに,https://news.yahoo.co.jp/articles/02ec96367dd39f9f4b01e2fba3e6c32af89b5946,12/14(木) 12:00
2023-12-14,21:33,entertainment,エンタメ,15,デイリースポーツ,「ＦＮＳ歌謡祭」中にニュース速報が４度　歌唱とジングル重なり「せっかく録画してるのに」「せめて音無しで」「鬱陶しい」,https://news.yahoo.co.jp/articles/e0cdcb7bbb70c3ce0f8fac33809779314b64e336,12/13(水) 22:29
2023-12-14,21:33,entertainment,エンタメ,16,ABEMA TIMES,異例の交際発表で炎上中のアイドル「じゃあてめぇのツラ見せろ」アンチへの本音を明かす「他人を卑下することでしか自分の感情を保てない人間」,https://news.yahoo.co.jp/articles/7f4df3158efb25e3548c48b8d883ddc86ab199e3,12/14(木) 20:30
2023-12-14,21:33,entertainment,エンタメ,17,ABEMA TIMES,26歳差婚のモデル・菊池瑠々、夫と1歳第4子との家族写真に反響「年の差なんて関係ない」「旦那さん若々しい」,https://news.yahoo.co.jp/articles/59b1e7505e147d0a5692fdc19dc997654fd97731,12/14(木) 15:39
2023-12-14,21:33,entertainment,エンタメ,18,マグミクス,クソゲー扱いに異議あり「過小評価されがち」なファミコンソフトを今さら擁護してみた,https://news.yahoo.co.jp/articles/5852f7bb173b2449ec9ba0e49955ea153c65ddcc,12/14(木) 20:10
2023-12-14,21:33,entertainment,エンタメ,19,デイリースポーツ,「大奥」クソ野郎、史上最悪の徳川慶喜が嫌なヤツ　怪演すごいと拍手「ここまでクズ慶喜初めて」、「西郷に首どうぞ」の大合唱,https://news.yahoo.co.jp/articles/5d2c3a4ab3102404d5b07f09136fa75c7f96b933,12/14(木) 20:37
2023-12-14,21:33,entertainment,エンタメ,20,ねとらぼ,武田久美子、医師を目指す21歳の美人娘と親子ショット　大学を飛び級で卒業「私の願いはいつまでも健康でいてくれる事だけ」,https://news.yahoo.co.jp/articles/0424fa5fa94e71035652f402289a495871794018,12/14(木) 20:15
2023-12-14,21:33,entertainment,エンタメ,21,モデルプレス,かまいたち山内、舞台裏とギャップがある人気芸人明かす「別人格すぎて怖い」,https://news.yahoo.co.jp/articles/2930d6396358bf3a523feea25915bf8ad9ace651,12/14(木) 15:26
2023-12-14,21:33,entertainment,エンタメ,22,婦人公論.jp,なぜ家康は年少の秀忠を後継者として育てたのに、秀康とは対面すらなかなか果たさなかったのか…僕が出した極めてシンプルで残酷な＜答え＞,https://news.yahoo.co.jp/articles/9cc64e05625b34ae4e562290cb81422d012e1315,12/14(木) 12:36
2023-12-14,21:33,entertainment,エンタメ,23,中日スポーツ,えなこ、聖夜を彩りたいビキニショットにフォロワー熱視線「クリスマス感満載」「プレゼントがえなこだったらいい」,https://news.yahoo.co.jp/articles/803a2a5af75897144c55deb78e30800c6ce3668d,12/14(木) 20:43
2023-12-14,21:33,entertainment,エンタメ,24,デイリースポーツ,ニューヨーク屋敷　粗品破天荒の陰で、突然せいやが中田敦彦にブチギレ事件「ウンコみたいなやつ」　「めちゃくちゃおもろかった」,https://news.yahoo.co.jp/articles/cc9013efce34a3cdd06c187a654c3714a6d9b8e8,12/14(木) 19:14
2023-12-14,21:33,entertainment,エンタメ,25,スポーツ報知,元モー娘。超人気メンバー、３７歳の激変姿が話題！暗め茶系ショート→金髪ミディアムに…夫はお笑いタレント,https://news.yahoo.co.jp/articles/cede02a285d5489d76114ff3797c9b676e177a63,12/14(木) 18:01
2023-12-14,21:33,entertainment,エンタメ,26,スポーツ報知,街中でまさか！スカウトされた大物演歌歌手　私服姿が別人級すぎて…「ＣＭとか興味ないですか？」,https://news.yahoo.co.jp/articles/f805ce92243fe562b0ccafcf046fbf5e9735e14c,12/14(木) 11:25
2023-12-14,21:33,entertainment,エンタメ,27,よろず～ニュース,ビヨンセ、ツアーで日本人アーティストのデザイン盗用か　〝被害者〟は「正式に頼んでくれればいい物作れた」,https://news.yahoo.co.jp/articles/dd6668c9475efddc671e1a42017c22f6a96b45ce,12/14(木) 20:00
2023-12-14,21:33,entertainment,エンタメ,28,スポニチアネックス,五十嵐亮太氏　大谷翔平の「“僕もあれくらいの奥さんをもらいたいです”」大胆発言を期待,https://news.yahoo.co.jp/articles/4a4ac0c42a9eb77857ec610e6b22e0e01cba52b3,12/14(木) 18:11
2023-12-14,21:33,entertainment,エンタメ,29,ENCOUNT,【水ダウ】人気芸人が披露した“肉体美”に視聴者驚き「めっちゃいい身体してる！」,https://news.yahoo.co.jp/articles/dbfb736d830965d184b46ad484fb7764c4e7ab6f,12/14(木) 16:43
2023-12-14,21:33,entertainment,エンタメ,30,J-CASTニュース,「許せねぇ」アニソンイベント中止に追い込んだ脅迫犯に、ラブライブ！ファンが怒る理由,https://news.yahoo.co.jp/articles/c88f9a8313f0819051793e6f12e1786cc0d56181,12/14(木) 16:52
2023-12-14,21:33,entertainment,エンタメ,31,デイリースポーツ,ヤバすぎた！石原慎太郎邸の驚がく伝説「徒歩で行けず運転手が送迎」数えきれぬ家政婦「城のような内装」伸晃氏の同級生証言,https://news.yahoo.co.jp/articles/f82a9d5def8bc6b5d68b2c49c04144a8435148b6,12/14(木) 19:00
2023-12-14,21:33,entertainment,エンタメ,32,クランクイン！,『news zero』有働由美子が来年3月卒業！　後任は『news every.』藤井貴彦アナ,https://news.yahoo.co.jp/articles/ba4367b58b7cbc7a359ef802dc7f04534530aa90,12/14(木) 12:00
2023-12-14,21:33,entertainment,エンタメ,33,ENCOUNT,実写版『幽☆遊☆白書』、“9割”撮影済→全て撮り直し　町田啓太が明かす「決断できるのはすごい」,https://news.yahoo.co.jp/articles/5455f625ace784ba0d39801de0610bffcf0062fa,12/13(水) 21:54
2023-12-14,21:33,entertainment,エンタメ,34,スポニチアネックス,あのちゃん、超意外な仲良しタレントを明かす「僕の家がなくなっちゃったときとか…」心の支えに,https://news.yahoo.co.jp/articles/e795191da37899b08d57017bd40aa81b7491b57c,12/14(木) 16:58
2023-12-14,21:33,entertainment,エンタメ,35,中央日報日本語版,入隊するＢＴＳのジョングク、剃髪する後ろ姿を公開,https://news.yahoo.co.jp/articles/7b91ecb474f52274b4c2ef0859e482b701b87889,12/14(木) 16:58
2023-12-14,21:33,entertainment,エンタメ,36,スポーツ報知,６８歳・志穂美悦子さん、９０歳レジェンド女優との２ショットが素敵！「カッコ良すぎ」「お元気でお若い」,https://news.yahoo.co.jp/articles/2cd56aa674b25932cd16d04861ed6d22a60a6b6e,12/14(木) 5:59
2023-12-14,21:33,entertainment,エンタメ,37,スポニチアネックス,春風亭小朝　解散発表「和牛」がM-1で優勝できなかったのは「残念ながら…」　2017年に審査員,https://news.yahoo.co.jp/articles/7e8ba5065e6c248909f7e6ada172f813b6aec0f0,12/14(木) 20:09
2023-12-14,21:33,entertainment,エンタメ,38,スポニチアネックス,しずる村上純　10年来の飲み仲間の大女優　大ファンからわずか1週間で「本当にオンとオフがない方」,https://news.yahoo.co.jp/articles/ac2f179477c0006b775dedc17f32665b49ea8159,12/14(木) 15:03
2023-12-14,21:33,entertainment,エンタメ,39,スポニチアネックス,「和牛」解散へ　水田のコメントがネットで大論争「水田さんらしい」「最後の文に違和感」,https://news.yahoo.co.jp/articles/e213b14e26ee397160fe98bb4cb26c0c044d7c3b,12/13(水) 15:59
2023-12-14,21:33,entertainment,エンタメ,40,モデルプレス,QuizKnockこうちゃん、卒業発表 理由・今後について説明,https://news.yahoo.co.jp/articles/e53f470194f2bab95878e49277f24818d23d5533,12/14(木) 17:40
