scrp_date,scrp_time,genre_en,genre_jp,rank,media_jp,title,link,date_original
2025-03-23,15:08,TTL,総合,1,スポニチアネックス,片岡鶴太郎　三男の意外な職業告白も加藤浩次ツッコミ「ちょっとまずくないですか？」,https://news.yahoo.co.jp/articles/a55e38106e75305928145d6af044e2c193793b11,3/23(日) 11:52
2025-03-23,15:08,TTL,総合,2,スポーツ報知,「どの面下げて、そこに座っている！」…太田光、ゲスト出演者へ強烈な突っ込み「レッドカードで退場したはず」…「サンジャポ」,https://news.yahoo.co.jp/articles/cc065cc81e7297ae31f200b8973538be220dd59d,3/23(日) 10:40
2025-03-23,15:08,TTL,総合,3,ねとらぼ,ディズニーランドがオープンした1983年当時、カップルだった2人→37年後……　目頭が熱くなる現在の姿に感動,https://news.yahoo.co.jp/articles/99d1bf9fd60edc9103960a0a75fd8fe9cd27b065,3/22(土) 10:05
2025-03-23,15:08,TTL,総合,4,中日スポーツ,「たくさん日に焼けてしまって…」 角田夏実、ハワイでのショット反響 「女子力高いですね」,https://news.yahoo.co.jp/articles/587dec339c709c5968a469b0f2e1cb662f78ff9e,3/23(日) 11:50
2025-03-23,15:08,TTL,総合,5,ゴルフ総合サイト ALBA Net,＜速報＞吉田優利が首位独走　後続と9打差でバックナインへ,https://news.yahoo.co.jp/articles/06c09e9e44b90536d6f5145056558c55d076f36b,3/23(日) 12:29
2025-03-23,15:08,TTL,総合,6,LIMO,【女性が選ぶ！今、なりたい顔ランキング】2位の内田有紀を破った1位は圧倒的人気のママ女優「こんな洗練された顔になりたい」,https://news.yahoo.co.jp/articles/0c5cd73c614218c00c3ada8b84622e2726a12a80,3/23(日) 11:32
2025-03-23,15:08,TTL,総合,7,Full-Count,話題のダンスは「1日約4時間練習」　SNSでは批判の声も…“仕掛け人”明かす舞台裏,https://news.yahoo.co.jp/articles/c4f54466debfed4fb156670f9384096683bc796a,3/23(日) 8:48
2025-03-23,15:08,TTL,総合,8,デイリースポーツ,「ホットスポット」当初は東京０３角田じゃなかった！初期構想の宇宙人役を日テレが阻止,https://news.yahoo.co.jp/articles/144360fd12e270094f035b33c52986d688d4b407,3/23(日) 10:37
2025-03-23,15:08,TTL,総合,9,Full-Count,大谷翔平、愛犬デコピンの食事タイムを公開　由伸製作の陶器で“ご満悦”,https://news.yahoo.co.jp/articles/ce8e009f17742e94f0521bfc51f88440e3b0771c,3/23(日) 13:32
2025-03-23,15:08,TTL,総合,10,ファイナンシャルフィールド,娘が「iPhone」が欲しいと言うので、値段を聞くとなんと「20万円」近く！ さすがに高すぎると思うのですが、なんとか安くする方法はないでしょうか？,https://news.yahoo.co.jp/articles/71d253ef655376cc935a70b4d766e034edd548a2,3/23(日) 13:50
2025-03-23,15:08,TTL,総合,11,Hint-Pot,“40歳パーカーおじさん論争”をニューヨークで話してみたら…まさかの反応に日本人男性が気づいたこと,https://news.yahoo.co.jp/articles/f4c4e9e836ceed48863061cebd72d18ecc7c7522,3/23(日) 11:14
2025-03-23,15:08,TTL,総合,12,TopNews,F1日本GPが運命の分かれ道？マルコ博士が角田裕毅の「成長」を高評価、ローソンは「あと1戦」で判断か？,https://news.yahoo.co.jp/articles/d3e27e81936946095d8ba27898cfdeb90a207de6,3/23(日) 14:00
2025-03-23,15:08,TTL,総合,13,motorsport.com 日本版,海外F1記者の視点｜昇格させたローソンが大苦戦……レッドブルはどうするのが正解なのか？,https://news.yahoo.co.jp/articles/89b0fd82c8a896b0f3580e781e0c5c7926af524c,3/23(日) 13:12
2025-03-23,15:08,TTL,総合,14,日刊スポーツ,成田悠輔氏「橋下さんみたいなコメンテーターが庶民の怒りをかきたてて…」橋下徹氏は笑顔の返し,https://news.yahoo.co.jp/articles/9378827a4f3a1173187fb2f0c59f5e8529d059fa,3/23(日) 12:42
2025-03-23,15:08,TTL,総合,15,中央日報日本語版,「ペットの搭乗不可」告げられ…子犬溺死させた米国人を逮捕,https://news.yahoo.co.jp/articles/a6396f77892d171c57aa827cccf6cd13f3c98a2d,3/23(日) 11:18
2025-03-23,15:08,TTL,総合,16,ENCOUNT,「人間・斎藤元彦」が浮き彫りに…第三者委報告が明かした斎藤知事の「怒り」と「理不尽」【西脇亨輔弁護士】,https://news.yahoo.co.jp/articles/4861a101bd134e6286db4a361ef33f3926843fc2,3/23(日) 10:40
2025-03-23,15:08,TTL,総合,17,スポニチアネックス,【センバツ】二松学舎大付・永尾　今大会初柵越え本塁打　全校初戦終了で柵越えなしは金属バット導入後初,https://news.yahoo.co.jp/articles/00d9a4036b88986ee1eee056a595ba08e1a3a123,3/23(日) 13:17
2025-03-23,15:08,TTL,総合,18,スポーツ報知,フィギュアスケーターと女優の“二刀流”１７歳、プリンセスに大変身！「ついに天使が舞い降りた」「可愛すぎ」と絶賛の声,https://news.yahoo.co.jp/articles/98149ccf1a4a212ac97590abd417079b8abdea4f,3/23(日) 13:55
2025-03-23,15:08,TTL,総合,19,テレビ愛媛,「朝になっても起きてこない」キャンプ中の会社員男性がテントの中で死亡【愛媛】,https://news.yahoo.co.jp/articles/17c4f9f3053d8ebfa42adf2163fa498678b39ed2,3/22(土) 15:49
2025-03-23,15:08,TTL,総合,20,Full-Count,大谷翔平が感謝した陶器　山本由伸が明かす“舞台裏”「この時作ったお皿が」,https://news.yahoo.co.jp/articles/70bff82b5860750a5f58ad9d61543351eaf7e7ab,3/23(日) 13:47
2025-03-23,15:08,TTL,総合,21,スポニチアネックス,大谷翔平　デコピン用の手作り食事茶わん公開し「山本由伸先生による超大作」デコピンの食事動画もアップ,https://news.yahoo.co.jp/articles/8d320e15f420564dbd9ca35d25aa17852eb0fd57,3/23(日) 14:29
2025-03-23,15:08,TTL,総合,22,スポニチアネックス,和田アキ子　真美子夫人の差し入れケーキは入手困難も「半端なくおいしい」超人気俳優との食事の際…,https://news.yahoo.co.jp/articles/a78176c0c370ec8b71f81ec6001e39c5f95f3f4d,3/23(日) 12:59
2025-03-23,15:08,TTL,総合,23,デイリースポーツ,逆ギレ？ＯＮＥ計量失格で試合中止、失態の元Ｋ－１王者がなぜか相手の海人を非難「大和魂受け継いでない」「テニスでもしてろ」,https://news.yahoo.co.jp/articles/0da0fd0cc2dcfe2ecfec69db1a8e34c57e6533e5,3/23(日) 14:05
2025-03-23,15:08,TTL,総合,24,まいどなニュース,ロジャーのライバルだったのに…「どうしてルフィに負けたのか」「登場は早すぎた？」　ワンピース劇場版“金獅子のシキ”本編登場でファンがざわつくワケ,https://news.yahoo.co.jp/articles/fe81f998b60953b1fd722a2f37adc21eae90eb45,3/23(日) 11:50
2025-03-23,15:08,TTL,総合,25,中国新聞デジタル,【事故】パトカー追跡中の2人乗りバイクがトンネル外壁に衝突、男性1人死亡　広島市中区,https://news.yahoo.co.jp/articles/e427cc56bfde5da6569a7a1f2a0b7d1a9cb03ca9,3/23(日) 7:38
2025-03-23,15:08,TTL,総合,26,中日スポーツ,ひろゆきさん、”撮り鉄害悪論”「壊滅しても困らない」に…ネット「一番憤ってるのは『マナーを守る撮り鉄』」「有料スポット提供しては？」,https://news.yahoo.co.jp/articles/6a126c7dbb8311ad9fb336a699faa05f2d324267,3/23(日) 11:58
2025-03-23,15:08,TTL,総合,27,朝鮮日報日本語版,ウクライナで捕虜となった北朝鮮兵士を見て確信した、必ず統一を実現すべき理由【寄稿】,https://news.yahoo.co.jp/articles/5c4f33ae2a049e516509cb27405a2b64568c547a,3/23(日) 11:35
2025-03-23,15:08,TTL,総合,28,モデルプレス,第5子妊娠中の辻希美、エコー写真公開 性別は「100％じゃないけどわかってしまった」,https://news.yahoo.co.jp/articles/9ad569f922b8e73471fb4cf1917d048b9adbc35f,3/23(日) 12:12
2025-03-23,15:08,TTL,総合,29,読売テレビ,【独自解説】「違法」「不当」「極めて不適切」第三者委員会が兵庫県・斎藤知事らの対応を糾弾　“パワハラ”などが行われた背景、組織トップらへの“提言”も…調査報告書の内容を詳しく,https://news.yahoo.co.jp/articles/7d9bdc20ee27308eb0092c87675a3f45309c8aa6,3/23(日) 13:00
2025-03-23,15:08,TTL,総合,30,オリコン,話題の真美子さん差し入れケーキ　カブスにも…選手恋人がインスタで紹介「カブス側にもプレゼントされてたんや 気が利くな～」,https://news.yahoo.co.jp/articles/80471182a966764eaa5a859bc6b5f86c3e79f136,3/23(日) 9:25
2025-03-23,15:08,TTL,総合,31,ふたまん＋,「こんな作品だったの!?」ネットミーム化した「少女漫画の有名セリフ」と「意外な元ネタシーン」,https://news.yahoo.co.jp/articles/fe5e5c8c72733e2b2b7327dde4531a7cf37e36da,3/23(日) 11:32
2025-03-23,15:08,TTL,総合,32,スポーツ報知,吉岡里帆のバニーガール姿！美脚あらわ　全身ショットが破壊力　色気ダダ漏れ「御上先生」に出演中,https://news.yahoo.co.jp/articles/ac287dc19f18a92b5f11849ff4d3d4ff1ce7abcf,3/23(日) 5:36
2025-03-23,15:08,TTL,総合,33,J-CASTニュース,家賃170万円の港区豪邸、夫は22歳年上の元AKBママが自宅公開！　高級家具やバッグに憧れの声続出,https://news.yahoo.co.jp/articles/1ef968ee6047df3ce86a222d89d9dbe5d18b91a5,3/23(日) 11:00
2025-03-23,15:08,TTL,総合,34,モデルプレス,小泉今日子「最後から二番目の恋」現場へ差し入れ「豪華」「素敵な心遣い」と反響,https://news.yahoo.co.jp/articles/5c9a810c527f21034fffa4025bd08da9ea08277a,3/23(日) 12:54
2025-03-23,15:08,TTL,総合,35,スポーツ報知,「美人すぎます」元ＴＢＳアナ、アーティストに転身で激変の現在！「新しい旅」を報告に「めちゃめちゃカッコいい」,https://news.yahoo.co.jp/articles/30bda10e56fa7adabe64f677094f50792e185a4e,3/23(日) 11:55
2025-03-23,15:08,TTL,総合,36,LIMO,いまのシニアの貯蓄事情《60歳代・70歳代》3000万円以上の貯蓄を保有する世帯は何パーセントくらい？,https://news.yahoo.co.jp/articles/bdc300b69424ed100c28cd798707f4d5a57c1607,3/23(日) 11:37
2025-03-23,15:08,TTL,総合,37,日刊スポーツ,フィフィが実名告白「とんでもなくいい人」だった俳優「誰にでも気さくに笑顔で…」,https://news.yahoo.co.jp/articles/8e2b75407f128803441226169c1cc8cb2323c76d,3/23(日) 11:47
2025-03-23,15:08,TTL,総合,38,日刊スポーツ,上沼恵美子、一時休養の浜田雅功に「ちょっと心配してるねん」,https://news.yahoo.co.jp/articles/c20548b059a97aa930f055a054ebe7477d857039,3/23(日) 13:42
2025-03-23,15:08,TTL,総合,39,日刊スポーツ,和田アキ子、生放送で突然女性アナに「ありがとうね」一瞬スタジオがざわつく,https://news.yahoo.co.jp/articles/0679afab89d0c375bf872b71c6de4e5ae9423294,3/23(日) 14:24
2025-03-23,15:08,TTL,総合,40,東スポ競馬,ルメール騎乗の断然１番人気馬が大きく外に膨れて７着「ゲート裏からテンションが…」【中山６Ｒ】,https://news.yahoo.co.jp/articles/3b34051587c2bc414eac1c40e3a426b68d544352,3/23(日) 13:38
