scrp_date,scrp_time,genre_en,genre_jp,rank,media_jp,title,link,date_original
2024-09-17,08:06,local,地域,1,MBC南日本放送,【台風情報】台風14号に続き新たに台風発生へ　台風15号に「台風のたまご」熱帯低気圧が発達する予想　気象庁の予想進路詳しく,https://news.yahoo.co.jp/articles/6b065ca918b8063bbc8b09f569156962362399eb,9/16(月) 23:24
2024-09-17,08:06,local,地域,2,カナロコ by 神奈川新聞,茅ケ崎の市立小学校　複数男児が女児の下半身触る　学校の配慮欠く対応で２次被害に発展,https://news.yahoo.co.jp/articles/dbcd1de13b485a7e866b9702bedcbf838d7b0f41,9/16(月) 21:10
2024-09-17,08:06,local,地域,3,MRO北陸放送,活断層がない場所に“段差” 「なんでこんなとんでもない物が…」 掘削調査で見えた2つの地層,https://news.yahoo.co.jp/articles/c3b6333bbf74df650a8fc5041de3f1b928225e3f,9/16(月) 19:02
2024-09-17,08:06,local,地域,4,チューリップテレビ,【台風情報 17日午前7時更新】南シナ海の“台風のたまご” きょうにも台風になって東へ【雨風シミュレーション】台風14号あすにも奄美・沖縄へ『トリプル台風』になるか?,https://news.yahoo.co.jp/articles/cfe3e7eba6638bfa38ac158cc1816b92d1ae6ac9,9/17(火) 7:19
2024-09-17,08:06,local,地域,5,神戸新聞NEXT,通りすがりに6歳女児をバッグで殴る　容疑で44歳女逮捕　神戸のスーパー,https://news.yahoo.co.jp/articles/4e175ba064d4746835703b44fe68a3d38f97986d,9/16(月) 21:31
2024-09-17,08:06,local,地域,6,ＡＴＶ青森テレビ,【独自・続報】「ジェリー先生が娘の手を取って股間に…」女子児童にわいせつ行為の疑いで外国人英語講師（51）を逮捕の事件　別の女児にも被害あったか「言葉にならない。どうして…」緊急の保護者会も開催,https://news.yahoo.co.jp/articles/9867ce897d6217c55f41eb671f64bcef0686ff48,9/12(木) 21:02
2024-09-17,08:06,local,地域,7,南日本新聞,保育者を悩ます園児の「困り感」…10年で3倍に増えた発達支援児、現場の不安も増すばかり　専門教員を配置した学園に起きた変化とは,https://news.yahoo.co.jp/articles/5b56ff8c562bc6a9167b3532e8b0fc4e5f87c191,9/17(火) 7:03
2024-09-17,08:06,local,地域,8,福岡ふかぼりメディアささっとー,キセキの連続で話題に　福岡県糸島市の神在神社そばにある「神石」,https://news.yahoo.co.jp/articles/9ff58e9cb1784d72976d4b00e44c589d4afd4278,9/17(火) 6:10
2024-09-17,08:06,local,地域,9,埼玉新聞,【速報】JR湘南新宿ライン、高崎線が運転見合わせ　上野東京ラインは直通運転中止　人身事故の影響で,https://news.yahoo.co.jp/articles/e2eac6a5df5c1634e39ffe1152f532e97c287753,9/17(火) 6:21
2024-09-17,08:06,local,地域,10,南日本新聞,軍人になる男子第一の時代…9人娘のわが家には入隊時の「鎮台祝」も無縁だった。戦後、3人の娘に恵まれた。肩身の狭い思いはない。平和な世の中が一番だ【証言 語り継ぐ戦争】,https://news.yahoo.co.jp/articles/1069d2f61cb829b8693a5b85a9d45907217467a4,9/17(火) 6:28
2024-09-17,08:06,local,地域,11,新潟ニュースNST,アルコール検査を求められるも拒否した会社役員（49）を現行犯逮捕　逮捕後「飲酒をして運転したことは認める」,https://news.yahoo.co.jp/articles/828a80c81348b34a39bd73003e175519ba645e1d,9/17(火) 6:30
2024-09-17,08:06,local,地域,12,読売テレビ,【速報】水上バイクが引っ張るフロート遊具が関空連絡橋に衝突　6歳～11歳の子ども3人重軽傷　大阪,https://news.yahoo.co.jp/articles/481ac6b5d7934f69257f4fe04e712601f6c291c4,9/16(月) 19:44
2024-09-17,08:06,local,地域,13,埼玉新聞,【速報】〈続報〉JR湘南新宿ライン、高崎線の運転再開見込みが変更　午前7時10分頃に,https://news.yahoo.co.jp/articles/3c99131188896f721544e9fb32a2fdb5ef428f78,9/17(火) 6:59
2024-09-17,08:06,local,地域,14,埼玉新聞,東武線で人身事故　男性死亡…特急にはねられる　夕方前の駅ホームにいた30～60代　衝突直前に運転士、男性を目撃,https://news.yahoo.co.jp/articles/0a368cd8428bdc76d1e3db36d062329cd50cf84b,9/17(火) 7:24
2024-09-17,08:06,local,地域,15,千葉日報オンライン,「飲めるハンバーグ」食中毒　患者1人がHUSを発症、入院中　船橋,https://news.yahoo.co.jp/articles/045ebfc9694ce002bfdf6c8a767959804eeadd99,9/13(金) 19:26
2024-09-17,08:06,local,地域,16,山陰中央新報,ＰＴＡ組織　島根、鳥取の７校が退会　「限られた保護者で回すのは難しい」子ども減で保護者の負担増　岡山県の連合会解散受け「大きい組織抜ければ同じ事が起こる可能性」　ＰＴＡ協議会は「不要論」拡大を危惧,https://news.yahoo.co.jp/articles/0eefce502765932c20f01662f5b75a4ca12d0092,9/17(火) 6:45
2024-09-17,08:06,local,地域,17,読売新聞オンライン,オープン5年目のサッカースタジアム、活況の訳は？…試合がない平日の昼間に親子連れら,https://news.yahoo.co.jp/articles/d9761ac27983b3094c45ed7828758992d113f19f,9/16(月) 15:00
2024-09-17,08:06,local,地域,18,ＢＳＮ新潟放送,次の3連休は大雨? 前線が本州付近に停滞し太平洋側を中心に総雨量が多くなる恐れ　気温も下がる見込み【今後の雨と風のシミュレーション・16日午後6時半更新】,https://news.yahoo.co.jp/articles/d0855b0191b0cb8e202e9434dacd91c065b6a749,9/16(月) 18:43
2024-09-17,08:06,local,地域,19,神戸新聞NEXT,20代男性か、神戸の海上に遺体　船舶乗組員が発見　「アップルウオッチ」着用,https://news.yahoo.co.jp/articles/d01a517a45c63f47bfb2712b717cc6c0d5a3b050,9/16(月) 19:07
2024-09-17,08:06,local,地域,20,TNCテレビ西日本,三瀬トンネルでトラック１台と車２台が絡む事故　子供含む８人を病院搬送　２時間余り通行止めに　福岡市～佐賀市,https://news.yahoo.co.jp/articles/946c9e52a41848d1643334dc8eb11bbe10c4273d,9/16(月) 23:35
2024-09-17,08:06,local,地域,21,tvkニュース（テレビ神奈川）,横浜市南区で2人の変死体発見,https://news.yahoo.co.jp/articles/221190162e97e62bf76242de99d2a1157563f158,9/16(月) 21:14
2024-09-17,08:06,local,地域,22,神戸新聞NEXT,神戸淡路鳴門道でひき逃げ疑い、23歳男を逮捕　兵庫県警　バイクの男性が骨折,https://news.yahoo.co.jp/articles/33cfd278fc44ab589af21bfe093dab9301f57d7d,9/16(月) 23:05
2024-09-17,08:06,local,地域,23,北海道ニュースUHB,『スイートコーン』砕く作業中“機械急停止”→男性作業員がベルトコンベヤーに腕突っ込むと動き始めはさまれる…「右腕骨折」の重傷 警察が動いた原因を捜査―北海道遠軽町,https://news.yahoo.co.jp/articles/8a610692aabdf7dbb11d5f4f7bd1246579ec515d,9/17(火) 6:00
2024-09-17,08:06,local,地域,24,北海道ニュースUHB,「ボーンという音が聞こえて窓を開けたら炎が」爆発音とともに軽乗用車が激しく炎上　全焼した車内から性別不明の1人の遺体みつかる　警察が出火原因を調べる　北海道札幌市手稲区,https://news.yahoo.co.jp/articles/8fad80f021133b5d920fbf75effd2305cc7f6f1a,9/17(火) 4:59
2024-09-17,08:06,local,地域,25,北海道ニュースUHB,【59歳中学校教師の男】ドライブスルーで“下半身露出”し逮捕→女性店員に運転席で…商品受け取らず逃走したが警察すぐに発見―北海道苫小牧市,https://news.yahoo.co.jp/articles/a2c702df4de461fb3d6f981bdefac8eb2a6d51f8,9/17(火) 6:30
2024-09-17,08:06,local,地域,26,UX新潟テレビ21,新米コシヒカリ店頭に　品質上々・コメ不足解消に安堵も「値上がり」…「外食しない」「玄米買って安く」【新潟】,https://news.yahoo.co.jp/articles/768f80584d6da9e254f01a707b3550722981fb7e,9/16(月) 18:39
2024-09-17,08:06,local,地域,27,ラジトピ　ラジオ関西トピックス,本当に動かないの!?怪鳥「ハシビロコウ」関西初の飼育続ける神戸どうぶつ王国が10月にシンポジウム,https://news.yahoo.co.jp/articles/ce2142181a5aa899becfcb41dda47be85bb45760,9/17(火) 6:55
2024-09-17,08:06,local,地域,28,長崎新聞,長崎医療センター　４月から精神科病棟を休止　関係者「医療体制崩壊の危機」,https://news.yahoo.co.jp/articles/bde5cdaee11747f004dae8d4564295cecd605013,9/16(月) 10:30
2024-09-17,08:06,local,地域,29,NBS長野放送,やや値上がりも…「新米」売れる　3連休中、道の駅にぎわう　人気は「シャインマスカット」一日に400から500房ほどが,https://news.yahoo.co.jp/articles/d0ac4e6bb2096dde28a59c83437d226a29439cbe,9/16(月) 18:36
2024-09-17,08:06,local,地域,30,北海道ニュースUHB,【ヒグマ速報】ラウンド中のゴルファーの前に出没「体長1.5mのクマ 約30～40m先のコース横切る」ハンター4人出動し“騒然”―北海道千歳市,https://news.yahoo.co.jp/articles/bd2259532521e39ec4d8da2ae4bee5de87df05cc,9/16(月) 21:00
2024-09-17,08:06,local,地域,31,仙台放送,暴力団組織の“トップ”を強要容疑で送検 元風俗店従業員に堕胎迫った疑い〈宮城〉,https://news.yahoo.co.jp/articles/1da1700350e1f06c354387b1f9440c0d4251e9a3,9/13(金) 11:04
2024-09-17,08:06,local,地域,32,カナロコ by 神奈川新聞,深夜の横浜、路上で女子高生にわいせつ行為　容疑で大学生を逮捕「落ち込んでいて、むかついたからやった」,https://news.yahoo.co.jp/articles/137e98b3700338b194d6a26bf0ffdcaa1f96d1a0,9/13(金) 17:51
2024-09-17,08:06,local,地域,33,YBS山梨放送,【速報】70代女性が自宅で死亡 安否確認に訪れた警察官が発見 傷害容疑で80代男を逮捕 山梨,https://news.yahoo.co.jp/articles/450fa0e264a652ab292395635aca89e84f605197,9/17(火) 7:12
2024-09-17,08:06,local,地域,34,STVニュース北海道,車から走って逃走…検査でアルコール検出も 車を一時不停止の男逮捕 北海道上富良野町,https://news.yahoo.co.jp/articles/73c430eb91325e5a52f26f352469dfa5326ebae0,9/17(火) 7:10
2024-09-17,08:06,local,地域,35,HBCニュース北海道,缶入りアルコールを手に「酒を飲みながら車を運転している男がいる」目撃したドライバ―が通報　呼気検査で基準値２倍超、50歳の男「納得がいかない」,https://news.yahoo.co.jp/articles/b5df1c62d14d6dcc9e9d71feafa214ce22b494f3,9/15(日) 9:33
2024-09-17,08:06,local,地域,36,中国新聞デジタル,16日のJR人身事故、23本運休で1万人超に影響　広島市西区の踏切,https://news.yahoo.co.jp/articles/dce29307532aa7f81a5f98a845a4efbaea3b57df,9/17(火) 7:22
2024-09-17,08:06,local,地域,37,STVニュース北海道,「仕事のストレス発散のため…」女子学生のスカート内を盗撮しようとした男逮捕 北海道札幌市,https://news.yahoo.co.jp/articles/604ad6d55209d4fb2584f0817a48cb945d344a06,9/17(火) 7:09
2024-09-17,08:06,local,地域,38,みんなの経済新聞ネットワーク,大阪・本町に自家製うどん提供の居酒屋　堺筋本町から移転、冬はぼたん鍋も,https://news.yahoo.co.jp/articles/a3f28d1f4dba029bc4c94a64c5dc2243fdc6bf6a,9/17(火) 7:00
2024-09-17,08:06,local,地域,39,沖縄タイムス,大型の台風14号、18日にも沖縄地方に最接近　沖縄気象台、強風や土砂災害に注意呼びかけ【17日午前6時現在】,https://news.yahoo.co.jp/articles/a8d1635c48c0b2fd362cf43f87d432979327592c,9/17(火) 7:37
2024-09-17,08:06,local,地域,40,MRO北陸放送,石川県・金沢大学角間キャンパス内の県道で乗用車の単独事故　運転の66歳男性が死亡,https://news.yahoo.co.jp/articles/5121e78199ca5baf4dc0ce3407a7ff872d1bb484,9/16(月) 22:12
