scrp_date,scrp_time,genre_en,genre_jp,rank,media_jp,title,link,date_original
2025-04-23,14:07,TTL,総合,1,弁護士ドットコムニュース,田中圭さんと永野芽郁さんが不倫か…週刊文春が報道　2人は「関係」を否定、芸能人の慰謝料は高額になる？,https://news.yahoo.co.jp/articles/9eea2ece468b8e92512fd3d2bfdf7c45952888db,4/23(水) 12:35
2025-04-23,14:07,TTL,総合,2,読売新聞オンライン,「日本の競争は厳しくない」…子どもの教育目的に移住する中国人続々、各地で独自コミュニティー,https://news.yahoo.co.jp/articles/237cd99d1b59ba4529761f17d97c0cc1bcea5b0a,4/23(水) 11:02
2025-04-23,14:07,TTL,総合,3,日刊スポーツ,成田修造氏「なんで若い人は消費税を減税したいんだよｗアホなのか」私見に反響,https://news.yahoo.co.jp/articles/0e99ab48f2e239344e66b4466381d97e10d1506f,4/23(水) 9:53
2025-04-23,14:07,TTL,総合,4,スポーツ報知,１６歳差たまらん！人気女優＆年下ブレイク俳優が「お似合い」「美男美女」「この身長差」腕組みショット披露,https://news.yahoo.co.jp/articles/14c189b099ed602b2c0f044e3880d6d05271a938,4/23(水) 10:15
2025-04-23,14:07,TTL,総合,5,スポーツ報知,３８歳美人女優、「ずっと取りたかった」資格取得を報告に反響「尊敬します」…夫は７歳年下の人気俳優,https://news.yahoo.co.jp/articles/61aa8c5847686f401f67b6490d0cef284bdfab2d,4/23(水) 6:32
2025-04-23,14:07,TTL,総合,6,オリコン,錦織一清、3年待ちで納車されたばかりの“愛車”トラブルを報告「人生そんなもんです」,https://news.yahoo.co.jp/articles/1994471c364c241194a887538c3b0a2ab1cd0f69,4/23(水) 9:54
2025-04-23,14:07,TTL,総合,7,J-CASTニュース,動画拡散で波紋、万博で警備員はなぜ土下座したのか　万博協会が明かした意外な経緯,https://news.yahoo.co.jp/articles/889304adb917c9c7effc3f0b4d96fe14b3d751c6,4/22(火) 18:10
2025-04-23,14:07,TTL,総合,8,スポニチアネックス,大谷翔平　カブスのマスコット・クラークから出産祝い？満面の笑みでぬいぐるみを受け取る,https://news.yahoo.co.jp/articles/440a199ae5ad2047274ddaf825b99f2ea1456b31,4/23(水) 9:02
2025-04-23,14:07,TTL,総合,9,ABEMA TIMES,“1日1食で体重45kg”片岡鶴太郎（70）、最新の姿にファン衝撃「やばい」「内田裕也みたい」,https://news.yahoo.co.jp/articles/7946a58080b5bec0c829690cf9764f9d3dea2219,4/23(水) 9:46
2025-04-23,14:07,TTL,総合,10,スポーツ報知,ドジャースまさかのサヨナラ負け　大谷翔平は４の０で「パパ初安打」ならず…今永昇太は６回途中５失点,https://news.yahoo.co.jp/articles/1cfdf0db932712a397f6ea61cde957eefb1d3a89,4/23(水) 12:02
2025-04-23,14:07,TTL,総合,11,まいどなニュース,自宅の車にスプレー、券売機も破損…悪質な嫌がらせを受けるラーメン店の嘆き　卑劣な行為にファンから怒りの声,https://news.yahoo.co.jp/articles/c953d2be22e4d187cfc998f4956421fa8577e1f3,4/23(水) 7:55
2025-04-23,14:07,TTL,総合,12,J-CASTニュース,VTuberイベント、出演者続々辞退で波紋　主催者「運営体制や判断に不備」、「みけねこ」参戦との関係を否定,https://news.yahoo.co.jp/articles/91460a58888f6cc207c7bf42c38f01f9cdfc6985,4/23(水) 12:05
2025-04-23,14:07,TTL,総合,13,読売テレビ,【速報】「バスを急に100台用意できない、その場で待っていただく必要」一夜明け万博協会が見解表明　大阪メトロ・中央線が一時運転見合わせ　約4000人が夢洲駅に滞留「情報連携、改善を図る」,https://news.yahoo.co.jp/articles/de93d0548123768e5718375c2df92ea9c8708795,4/23(水) 9:45
2025-04-23,14:07,TTL,総合,14,シネマトゥデイ,『ノア 約束の舟』子役が死去　24歳,https://news.yahoo.co.jp/articles/317d7fe3be51aad1d1fd4447f595cc6f10086a6f,4/23(水) 11:53
2025-04-23,14:07,TTL,総合,15,テレビ朝日系（ANN）,農家反発「減反したのになぜ」　アメリカ産コメ輸入拡大案、交渉カードに浮上,https://news.yahoo.co.jp/articles/324feb6b2a0a40aba92e023e3f0077762db37529,4/23(水) 11:57
2025-04-23,14:07,TTL,総合,16,ITmedia ビジネスオンライン,なぜ旅館は「1泊2食付き」を続けるのか　観光地の夜が静まり返る本当の理由,https://news.yahoo.co.jp/articles/41573c9f0e6aa660e0c2113242cdfd121ef50901,4/23(水) 7:10
2025-04-23,14:07,TTL,総合,17,ABEMA TIMES,水着姿が話題・高島礼子（60）、美術館の庭園での自撮りショットに反響「めちゃくちゃ綺麗で若い！」「目が癒やされます！」,https://news.yahoo.co.jp/articles/2b9513dafb88651c3c9a9fbde00f59ec2ecdb5e5,4/23(水) 11:33
2025-04-23,14:07,TTL,総合,18,スポニチアネックス,人気俳優の6歳上タレント妻　仲良しのタレントが「娘に会いにきてくれた」今月誕生報告の愛娘交え3S,https://news.yahoo.co.jp/articles/56efaf02b419cee364164ec343e6d67b63ff984d,4/23(水) 10:30
2025-04-23,14:07,TTL,総合,19,デイリースポーツ,松嶋尚美、読み方は「まつしまなおみ」じゃなかった…スタジオも思わず「へー！」,https://news.yahoo.co.jp/articles/f2002c1365d7f6eae6769d6cb022af255cb3b6bb,4/23(水) 10:53
2025-04-23,14:07,TTL,総合,20,東スポWEB,【F1】ハミルトンが事業失敗で巨額損失　バーガーチェーン店が6年で破綻　150人解雇か,https://news.yahoo.co.jp/articles/47f5c177b4503bddba0d10b18d1f94ca3e2159b9,4/23(水) 11:11
2025-04-23,14:07,TTL,総合,21,スポニチアネックス,ミセス大森元貴　「結構2人でご飯とか」超人気アイドルとの交流告白「仕事の話もプライベートな話とかも」,https://news.yahoo.co.jp/articles/a79c83eec866766d6f7a00cbd405c17b7f7a2869,4/23(水) 11:54
2025-04-23,14:07,TTL,総合,22,サッカーキング,リヴァプール主将ファン・ダイク、遠藤航の重要性を強調「あと数年はいてほしい」,https://news.yahoo.co.jp/articles/0b58da401c9d85820ed15c53a2abed767505642b,4/23(水) 10:24
2025-04-23,14:07,TTL,総合,23,ねとらぼ,ティッシュの空箱に、クリアファイルを貼るだけで→この発想はなかった！　便利でかわいいアイテムに反響,https://news.yahoo.co.jp/articles/56215b3467f797d16c2a4e53cafcaccdcc4f21da,4/23(水) 9:05
2025-04-23,14:07,TTL,総合,24,スポーツ報知,電撃婚に「ビビった」百田夏菜子３０歳　最新姿に衝撃「誰？」「ぶっ飛んだ」「まじ」「色気ヤバい」,https://news.yahoo.co.jp/articles/f5213c27bb934088e6824d34edeb5cdfa44f8380,4/23(水) 5:28
2025-04-23,14:07,TTL,総合,25,クランクイン！,『あんぱん』朝ドラ初出演の人気女優が登場　ネット歓喜「待ってました」「存在感すげぇ」,https://news.yahoo.co.jp/articles/2980a4a2fbd937215f9e75a986542c437399f5cc,4/23(水) 11:00
2025-04-23,14:07,TTL,総合,26,ENCOUNT,「瓜田も気に入らねぇ」「喧嘩300戦くらい」所沢のタイソンの舎弟、威張りまくった挙句に“ばっくれ”,https://news.yahoo.co.jp/articles/0bd92658e22f99aa495c809c7076c6b1662c523a,4/23(水) 12:03
2025-04-23,14:07,TTL,総合,27,スポーツ報知,「今永先生降りた途端にこれは笑うしかない」カブス・今永昇太、３勝目消滅にファン複雑「逆転しちゃうドジャースやっぱり強い」,https://news.yahoo.co.jp/articles/161de540990b483d3f2bd561cbb33503b6db17bf,4/23(水) 11:23
2025-04-23,14:07,TTL,総合,28,ELLE DIGITAL,賞味期限が切れたら使わないほうがいい調味料 5,https://news.yahoo.co.jp/articles/5009abeffba5f7add3f81412d171d215af6611a2,4/22(火) 20:50
2025-04-23,14:07,TTL,総合,29,ENCOUNT,「これから大暴落が来る」森永卓郎さんの“予言”は的中したのか　ネット話題も森永康平氏「真意を全く理解していない」,https://news.yahoo.co.jp/articles/af384b7a9078e3ec83c7e9c1f751de43007a425c,4/23(水) 9:10
2025-04-23,14:07,TTL,総合,30,スポニチアネックス,五十嵐亮太氏　現役時代の最高年俸ぶっちゃけ　推定3億6000万円に「正直僕らもっと…」,https://news.yahoo.co.jp/articles/b0f11c49b4ac6a4d0ef58ed239dc1859e3e19f0d,4/23(水) 12:53
2025-04-23,14:07,TTL,総合,31,スポニチアネックス,サンド伊達　芸人仲間との食事後まさかの「お支払いされております」会計済ませた大物落語家とは,https://news.yahoo.co.jp/articles/0c09bc73aee0a6452a56ecce70ff5e926a1f6ebe,4/23(水) 13:07
2025-04-23,14:07,TTL,総合,32,日刊スポーツ,錦織一清、高速道路走行中にアクシデント「まだ買ったばかり」「人生そんなもんです」,https://news.yahoo.co.jp/articles/88059bbbe51f2d651529bad99413c574edcec6c9,4/23(水) 12:48
2025-04-23,14:07,TTL,総合,33,HBCニュース北海道,10歳の長男を殺害　同居する妻の外出中に犯行か　逮捕された43歳の父親、容疑認める　3人家族に何が…　札幌市手稲区,https://news.yahoo.co.jp/articles/a8c52e4be6dad021ddd3b4198e0bbd6c3e2198db,4/23(水) 11:36
2025-04-23,14:07,TTL,総合,34,スポニチアネックス,大物俳優の長男、25歳イケメンモデル　「イマがイチバンイイ」海辺の最新S披露に「かっこよすぎる」の声,https://news.yahoo.co.jp/articles/f5da3f73cc223e102ac7d85a50e65d4eb8e3383e,4/23(水) 11:07
2025-04-23,14:07,TTL,総合,35,スポニチアネックス,「小さな奇跡が10回続いただけ」今永昇太　大谷を10打数無安打に封じるも「たまたま」と謙虚,https://news.yahoo.co.jp/articles/005da8776cf972b351cb4e49bc4d505928114b46,4/23(水) 13:07
2025-04-23,14:07,TTL,総合,36,スポニチアネックス,人気芸人が給料をガチ告白「僕の中ではうれしくて」　ザキヤマが無茶ぶり「12月はいくらぐらい？」,https://news.yahoo.co.jp/articles/30ff57c0179f651777fc5fffc31a8a3b06817058,4/23(水) 10:58
2025-04-23,14:07,TTL,総合,37,スポーツ報知,平成のトレンディー俳優　雰囲気激変した最新姿「え！？」「誰かと思った」「半信半疑」「びっくり」,https://news.yahoo.co.jp/articles/08046ce27a45c6c906d05ffe1d1b22d87dd49a86,4/23(水) 6:42
2025-04-23,14:07,TTL,総合,38,ITmedia NEWS,東京から日帰り大阪万博レポート　滞在5時間、予約なしでこれだけできた,https://news.yahoo.co.jp/articles/ffc4cd098733fd09dee644a5eb12d3bc96b79872,4/23(水) 11:44
2025-04-23,14:07,TTL,総合,39,朝鮮日報日本語版,7万5000円コース料理のデザートに「ゾウの排せつ物」を提供、上海の高級レストランが営業停止に,https://news.yahoo.co.jp/articles/1c3e5d633d374e8fc1804eda26e878ff44515913,4/23(水) 11:33
2025-04-23,14:07,TTL,総合,40,ハフポスト日本版,米人気俳優、自慢のグレイヘアを染める➡︎もはや誰だか分からない,https://news.yahoo.co.jp/articles/77666f8690e83fbd8bd6f6be117fa1e00f5c25e9,4/23(水) 13:00
