scrp_date,scrp_time,genre_en,genre_jp,rank,media_jp,title,link,date_original
2024-04-30,02:14,life,ライフ,1,ねとらぼ,70代おじいちゃんの「17歳の姿」が衝撃　面影残る“イケメン”な白黒写真が2800万再生【イギリス】,https://news.yahoo.co.jp/articles/fb30b630ae3c8b185bf07b9d5756e6a5830b0321,4/29(月) 20:30
2024-04-30,02:14,life,ライフ,2,まいどなニュース,東大生、ワイヤレスイヤホン片方を紛失→ 数学の知識を使って場所を10分で特定「脳汁止まらなかった」,https://news.yahoo.co.jp/articles/30e48205291eaffe0bccd5580861c6a0d0119a75,4/29(月) 8:00
2024-04-30,02:14,life,ライフ,3,ほ・とせなNEWS,なかなか寝室に来ない1歳の娘　ようやくやって来た娘の行動に「可愛い」「悶絶」の声！,https://news.yahoo.co.jp/articles/18a736f296833d8fdd97f183b2f014eeb92b0a5f,4/29(月) 12:30
2024-04-30,02:14,life,ライフ,4,まいどなニュース,14歳年上の妻は、夫が通う高校の教師だった　「キレイな先生」と、いつしか一緒に働く関係になり…ドラマのような恋の行方は,https://news.yahoo.co.jp/articles/2fe1d21d9c5adcd86257e17d93af43a9b93ddd5b,4/27(土) 13:30
2024-04-30,02:14,life,ライフ,5,東京バーゲンマニア,【4時間紅茶・コーヒー飲み放題】ホテルの優雅なアフタヌーンティーがコスパ最強で天国だった...。≪編集部レポ≫,https://news.yahoo.co.jp/articles/b44fa0dd2335327b98a413c8050ffe21c2f19a61,4/29(月) 11:00
2024-04-30,02:14,life,ライフ,6,ねとらぼ,しぶとい雑草“ドクダミ”を生やさない超簡単な方法が115万再生！　除草剤を使わない画期的な対策に「スゴイ発見」,https://news.yahoo.co.jp/articles/0bcd7696601704013c7154018b6711273619e2b2,4/27(土) 10:05
2024-04-30,02:14,life,ライフ,7,産経新聞,あこがれの寝台特急「ブルートレイン」をホテルに改装　利用者が伸び悩む経営課題と存続問題,https://news.yahoo.co.jp/articles/92926ff834771ab105ecc1f541919959b89d753d,4/29(月) 20:00
2024-04-30,02:14,life,ライフ,8,日刊ゲンダイDIGITAL,スタバより仕事がはかどるチェーンは？コーヒー1杯じゃもったいない！メニューと居心地を徹底比較,https://news.yahoo.co.jp/articles/a4572b6345973ffe96214064c3097e0c434e5b65,4/29(月) 9:06
2024-04-30,02:14,life,ライフ,9,HugKum,5歳の娘とともに世界一周を決意したきっかけは番組の降板。32カ国を旅し、帰国直後のキャスター・榎戸教子さんが語る「子どもと向き合う旅で感じたこと、変化した価値観」,https://news.yahoo.co.jp/articles/2698fe6773905de0e972ec7b228e1f43518b59f8,4/29(月) 21:30
2024-04-30,02:14,life,ライフ,10,ハフポスト日本版,上司が早帰りし残業が確定「忙しい時に限って…」部下の怒りを鎮めた、ある理由に反響広がる,https://news.yahoo.co.jp/articles/320aa5dc99e550078ccb6d63b7300d95b72daf8e,4/28(日) 12:55
2024-04-30,02:14,life,ライフ,11,ねとらぼ,レジで出したら二度見されそうなクレカ、表面には……　財布の紐もゆる～くなりそうな1枚に「こんな事できるんだ！」「最高www」,https://news.yahoo.co.jp/articles/2abdf9f93e466cbefdc020c6bd89a295559c31a6,4/29(月) 21:00
2024-04-30,02:14,life,ライフ,12,ファイナンシャルフィールド,新卒で「手取り18万円」です。実家暮らしで親に「月5万円」入れるよう言われましたが、これって多いですか？ 正直多いようにも感じますが、「1人暮らし」にかかる費用に比べれば少ないでしょうか…？,https://news.yahoo.co.jp/articles/aef3215389f7424909d6c374d690ed20358901e6,4/29(月) 13:40
2024-04-30,02:14,life,ライフ,13,All About,いとこの結婚式にお呼ばれしましたが、ご祝儀が「1万円」しか出せません。マナー違反でしょうか？,https://news.yahoo.co.jp/articles/1f378c393039ed00d81f1b952ee0e77c803daa03,4/29(月) 20:15
2024-04-30,02:14,life,ライフ,14,Hint-Pot,「日本では誰も盗まないのよね」　外国人が飲食店を絶賛　驚いたよくあるサービスとは,https://news.yahoo.co.jp/articles/7bd5a654600b0ff06578758dae4e55f80db3dd89,4/29(月) 7:40
2024-04-30,02:14,life,ライフ,15,ねとらぼ,「とんでもないものが売ってた」　ハードオフに“33万円”で売られていた「まさかの商品」に思わず仰天,https://news.yahoo.co.jp/articles/bd1d36e5dd25a168c99fd7cc421cf4c20a5c8cef,4/28(日) 12:00
2024-04-30,02:14,life,ライフ,16,Hint-Pot,「見た目が苦手」だった日本のソウルフード　モロッコ人女性がおいしさにハマった味とは,https://news.yahoo.co.jp/articles/66638704eb082d942a7d08ac7cde53d3c6b5fb1a,4/29(月) 16:25
2024-04-30,02:14,life,ライフ,17,ねとらぼ,マステでアレンジしたキャンパスノート「発想が天才」「かっけぇ」と話題　コクヨ公式も反応,https://news.yahoo.co.jp/articles/1aac569a3c13ed575e7b3b5cb45ebc93b99385d1,4/28(日) 12:05
2024-04-30,02:14,life,ライフ,18,LIMO,トイレから戻るとカーペットがコンモリ…　踏む直前に気づいた「正体」に「危なかった！」猫飼いさんヒヤリ,https://news.yahoo.co.jp/articles/8bbb81ba89a314eb6c5a9e6312215a4a3f7b0e7b,4/29(月) 19:32
2024-04-30,02:14,life,ライフ,19,HugKum,実写映画『シティーハンター』鈴木亮平の捨て身の役者魂に感動！ “もっこり”やド派手なアクションから目が離せない,https://news.yahoo.co.jp/articles/455d455082013b94bf3811941fb9237b7718f589,4/29(月) 20:39
2024-04-30,02:14,life,ライフ,20,ねとらぼ,亡き父が植えた思い出のモミの木が巨大化→次男が伐採していると兄が現れ……　リアルな庭じまいの記録に共感と応援の声,https://news.yahoo.co.jp/articles/dc65db3e46a225f163a80a50eff1856adea4244b,4/29(月) 22:00
2024-04-30,02:14,life,ライフ,21,ねとらぼ,天井裏から変な音がする→スマホを突っ込んで撮影したら……　映った“とんでもねぇ”モノに「恐ろしい」「何これ」と騒然の196万表示！,https://news.yahoo.co.jp/articles/eb9f9a50284b6eaffea3a7bac3c8dfb91011a6da,4/29(月) 10:00
2024-04-30,02:14,life,ライフ,22,Hint-Pot,オーストラリア人が東京ディズニーランドで首を傾げた光景　日本人の女の子の独特な楽しみ方に「不思議すぎてググっちゃった」,https://news.yahoo.co.jp/articles/fe2421ffee5ea3d31a58a05792f49db99594a62a,4/27(土) 9:52
2024-04-30,02:14,life,ライフ,23,Hint-Pot,男性教師の育休取得に「信じられない！」　小学生男子の一言に称賛の声「将来有望過ぎて」,https://news.yahoo.co.jp/articles/0eef030b81fe7d5f330fcb48405637f6ed30ce4b,4/29(月) 9:10
2024-04-30,02:14,life,ライフ,24,Medical DOC,「自律神経失調症」と「うつ病」の違いをご存知ですか？ 自律神経の整え方を精神科医が解説,https://news.yahoo.co.jp/articles/3fcdd7ea6a4a7099dddc5ae26494952047c524bc,4/28(日) 19:00
2024-04-30,02:14,life,ライフ,25,LIMO,【セリア】「GWのお土産かと思った…」 かわいすぎるディズニー「ティンカー・ベル」アートパネルが最高！,https://news.yahoo.co.jp/articles/30447e4f42d2b62ff23d868e8ed015aeb655848d,4/29(月) 10:41
2024-04-30,02:14,life,ライフ,26,BuzzFeed Japan,【タリーズ×トゥイーティー】かわいくて一目惚れ！レトロ感がたまらない「カラフルマグ」何を入れてもオシャレです,https://news.yahoo.co.jp/articles/69dd14aac1934bd7d4f7f8ff3cc480366b1e8ba7,4/29(月) 20:35
2024-04-30,02:14,life,ライフ,27,ねとらぼ,730日間、髪を伸ばし続けたら……　坊主からワイルドな長髪になるまでの記録が60万回再生「素晴らしい」,https://news.yahoo.co.jp/articles/3577f477ba01490ec61c98281d82e3f4c2e704fe,4/29(月) 12:00
2024-04-30,02:14,life,ライフ,28,ねとらぼ,パンを焼くときに“肝心なもの”を入れ忘れたら……　思わぬ姿になったパンに「こんなふうになるんだ」と驚きの声,https://news.yahoo.co.jp/articles/ab354a116794b9702000351a7e1904a57ff59bee,4/29(月) 19:45
2024-04-30,02:14,life,ライフ,29,ファイナンシャルフィールド,友人から「ご祝儀ナシでいいから結婚式に参加して欲しい」といわれました。金欠なので助かりますが、本当にご祝儀は用意しなくていいのでしょうか？「マナー違反」になってしまいますか…？,https://news.yahoo.co.jp/articles/6fd76ba80fe01b601146248a2a7b6b78136869b9,4/29(月) 11:30
2024-04-30,02:14,life,ライフ,30,グルメ Watch,セブン-イレブン「感謝祭」で価格そのまま“おにぎり/サンド/スイーツ”など増量,https://news.yahoo.co.jp/articles/8b313dfebb60ca1201e8e4a503423d46af072223,4/29(月) 13:09
2024-04-30,02:14,life,ライフ,31,まいどなニュース,木の幹をよく見ると…眠ってた！「良い場所を見つけたね」「そういう種類の木の模様なんだよね」,https://news.yahoo.co.jp/articles/7f717c1dda28e8e89cd8a66e54920bcee2cc076a,4/28(日) 15:45
2024-04-30,02:14,life,ライフ,32,ねとらぼ,「なぜか普通に描けた」　真っ白な壁に“巨大マンガ”をスラスラ描画　圧倒的クオリティーに「言葉がでてこない……」「これぞ芸術」,https://news.yahoo.co.jp/articles/b2305733ad8e68c8d6f7dea248ecf075c43ea4f6,4/29(月) 20:15
2024-04-30,02:14,life,ライフ,33,クックパッドニュース,そうだったんだ…医師が教える「老化を早める食事」生活習慣も影響,https://news.yahoo.co.jp/articles/e735e7ee422daa278c8a43e8cab3b0022bb4dd55,4/29(月) 21:30
2024-04-30,02:14,life,ライフ,34,まいどなニュース,飼っているアヒルに毎日話しかけ続けたところ驚きの変化が！ 昔は「鳥なんかと気が合うわけない」と思っていたのに,https://news.yahoo.co.jp/articles/71c1ccfc7dd13726a623b21fd8377405345c9cb5,4/27(土) 9:32
2024-04-30,02:14,life,ライフ,35,ファイナンシャルフィールド,バイト先に「欠勤時に自分の代理を見つけられない場合は罰金3000円」というルールがあります。会社は「就業規則と労働契約書に書いてある」と言っていますが、本当に問題ないのでしょうか…？,https://news.yahoo.co.jp/articles/289393a4fb3beba36877429aa4e9260a9e64bf8e,4/29(月) 13:40
2024-04-30,02:14,life,ライフ,36,マネーの達人,「投資」より、借金の返済を急げ！　日銀「マイナス金利解除」で金利が上がる可能性大,https://news.yahoo.co.jp/articles/6311ed0137adf5bdc242d3194addcc0bca9d61af,4/29(月) 20:10
2024-04-30,02:14,life,ライフ,37,ねとらぼ,【40代が選ぶ】「M-1グランプリグランドチャンピオン大会」があったら優勝しそうな歴代王者ランキング！　1位は「サンドウィッチマン」【4月30日は富澤たけしさんの誕生日】,https://news.yahoo.co.jp/articles/5872f48f9e2c39105af063a97f1dfe133bb81d96,4/30(火) 0:01
2024-04-30,02:14,life,ライフ,38,ねとらぼ,数十年前に撮った母と赤ちゃん時代の自分と、現在の自分と息子を見比べると……　驚きの遺伝に「ここまで似てるの初めてみた」「同じ方かと」,https://news.yahoo.co.jp/articles/6fcbe14e25ef2bb5bdeb5327fa14f5e845b984b1,4/29(月) 8:00
2024-04-30,02:14,life,ライフ,39,ねとらぼ,一人暮らしで「もやし4キロ」を購入 → 4日かけて食べきった人が話題に　「でけえ！」「3キロのナムル!?」,https://news.yahoo.co.jp/articles/0ac0fd5b52a376bc4aef64a53847d3f85e09edae,4/29(月) 20:45
2024-04-30,02:14,life,ライフ,40,ねとらぼ,顔の半分は童顔メイク、もう半分の仕上がりに驚がく　同一人物と思えない半顔メイクが860万再生「凄いねメイクの力」,https://news.yahoo.co.jp/articles/55c6d40e6b1a189d6351635727a35ad32cb89075,4/27(土) 19:30
