scrp_date,scrp_time,genre_en,genre_jp,rank,media_jp,title,link,date_original
2025-07-06,11:45,domestic,国内,1,日刊スポーツ,れいわ大石晃子氏「最初に神谷さんに当てて…」８党首生出演のフジ番組討論、指名めぐりかみつく,https://news.yahoo.co.jp/articles/4c5a75abb7ef665026ab7199670ee225559a3715,7/6(日) 9:26
2025-07-06,11:45,domestic,国内,2,J-CASTニュース,7月5日「大災害」予言とは何だったのか　「予言の時間」「地球滅亡」トレンド入り...SNSではネタ投稿も,https://news.yahoo.co.jp/articles/ee7079fa75633e91d153ecdb5ea679d56257bf44,7/6(日) 10:45
2025-07-06,11:45,domestic,国内,3,読売新聞オンライン,「帰れない」万博、西ゲートの100人がバスに乗れず…全員がタクシーに乗れたのは翌日に,https://news.yahoo.co.jp/articles/7924e18680dd0b62b305f7a81fa17852654ee4fd,7/5(土) 12:50
2025-07-06,11:45,domestic,国内,4,デイリースポーツ,佐々木恭子アナ、Ａさん「退職をする日に見送ったときの光景を忘れない」、尊厳を傷つけられ絶望→フジテレビ検証番組,https://news.yahoo.co.jp/articles/19b349dfb26c41e7db448c2c33534242d0969e8a,7/6(日) 10:19
2025-07-06,11:45,domestic,国内,5,毎日新聞,高校無償化で「金持ちは金持ちのまま」私立進学を諦めた親子の嘆き　制度からこぼれ落ちる地方世帯,https://news.yahoo.co.jp/articles/b3024c50eb4c33560a2b40f4f1102fd55b602aae,7/5(土) 17:00
2025-07-06,11:45,domestic,国内,6,日テレNEWS NNN,【速報】天皇皇后両陛下、モンゴル公式訪問に向け皇居・正門を出発　羽田空港から政府専用機でウランバートルへ,https://news.yahoo.co.jp/articles/9a17a9c3ca6ebc2b007447cc3818ffc0db95da15,7/6(日) 10:21
2025-07-06,11:45,domestic,国内,7,スポニチアネックス,参政党・さや氏　東京選挙区“女の戦い”台風の目「国のお尻を私たちが叩きまくります！」,https://news.yahoo.co.jp/articles/bcef874b7689ad96796b66b10d7fa1f91b0a4140,7/6(日) 5:30
2025-07-06,11:45,domestic,国内,8,スポーツ報知,７月５日の“予言”を気象庁がバッサリ　日本で「震度１以上の地震は１年間でだいたい２０００回以上発生します」,https://news.yahoo.co.jp/articles/d7b2776108d924e97c481c5e810482b0e092adfd,7/6(日) 6:00
2025-07-06,11:45,domestic,国内,9,TBS NEWS DIG Powered by JNN,バイクと自転車の衝突事故　自転車に乗っていた39歳女性が死亡　信号や横断歩道ないところを横断か　横浜・戸塚区,https://news.yahoo.co.jp/articles/3ddf77af529ce311b463f3924ca202a670719681,7/6(日) 10:00
2025-07-06,11:45,domestic,国内,10,デイリースポーツ,橋下徹氏、「日曜報道」を欠席　梅津弥英子アナが報告　理由は明らかにせず　参院選・８党トップが生討論,https://news.yahoo.co.jp/articles/065784acaa47e97346e11b94fceadd57bf9b74e5,7/6(日) 9:57
2025-07-06,11:45,domestic,国内,11,弁護士JPニュース,「7月5日に大災害」信じて損した人は”予言者”に「損害賠償請求」できる？　世界的に“うわさ”広まり観光業に影響も,https://news.yahoo.co.jp/articles/3ed8ad62b479af2389037a7da5b02917b72da38c,7/3(木) 10:00
2025-07-06,11:45,domestic,国内,12,読売新聞オンライン,暴れる児童を羽交い絞め、暴行罪に問われた３７歳男性教師…違法な体罰か「懲戒権」の範囲内か,https://news.yahoo.co.jp/articles/d10bdf83f0db4c048b8dc6128f60ced4abb3978e,7/6(日) 10:40
2025-07-06,11:45,domestic,国内,13,FNNプライムオンライン,キャンプ場近くの川で男子中学生を助けた障害児支援施設の42歳男性職員と元利用者の18歳男性が死亡　深みにはまったか　徳島・上勝町,https://news.yahoo.co.jp/articles/72bae3e1a3e560d641a38e26f7246e4bba4c8252,7/6(日) 9:58
2025-07-06,11:45,domestic,国内,14,日刊スポーツ,「太陽フレア」今年ピークで小池百合子都知事が注意呼び掛ける　国が警報発令なら都も情報発信,https://news.yahoo.co.jp/articles/6beab092cc841042f3df5dc2a7e356d21f86ca0f,7/5(土) 12:01
2025-07-06,11:45,domestic,国内,15,レスキューナウニュース,大和路線で人身事故 一部運転見合わせ,https://news.yahoo.co.jp/articles/ee3a06855c2c74eaa4095a47254fce8ca604e585,7/6(日) 10:15
2025-07-06,11:45,domestic,国内,16,ハフポスト日本版,高卒からの学び直しで教授、地銀の社外取に。元アイドルのいとうまい子はなぜ大学・大学院進学を目指したのか？,https://news.yahoo.co.jp/articles/ba205a89640740974c50170c46895bb532009c07,7/6(日) 10:48
2025-07-06,11:45,domestic,国内,17,デイリースポーツ,フジ検証番組　港元社長、中居氏の問題「プライベートな男女間のトラブル」　大多元専務「連絡を取り合って食事行くのは当然ある」,https://news.yahoo.co.jp/articles/ff11b7b046661bdd473f8f704c52c775e8d8ef60,7/6(日) 10:34
2025-07-06,11:45,domestic,国内,18,弁護士ドットコムニュース,『アスリート盗撮』の行方 スポーツ基本法改正の影響は…選手が苦しめられた「法の不備」埋まるのか,https://news.yahoo.co.jp/articles/e6af79f77680d996527ed555df89331e330e2cc3,7/6(日) 9:08
2025-07-06,11:45,domestic,国内,19,時事通信,強気の作戦、狂った想定　国民民主、追い風弱まる　参院東京選挙区ルポ【注目区を行く】,https://news.yahoo.co.jp/articles/1d572de3a6d3942eea58deb1fac7a245ae3cf3a8,7/6(日) 6:58
2025-07-06,11:45,domestic,国内,20,J-CASTニュース,東洋大「除籍」だった伊東市・田久保市長　タモリ、堺雅人、五木寛之...卒業していなくても一流の人は多い,https://news.yahoo.co.jp/articles/b4911755a5b878f622c30a9046fc172a7bb63834,7/5(土) 17:30
2025-07-06,11:45,domestic,国内,21,レスキューナウニュース,近鉄大阪線で踏切事故 一部運転見合わせ,https://news.yahoo.co.jp/articles/7375e0ef910b646b50cebd6fedc1020a10c488b5,7/6(日) 10:40
2025-07-06,11:45,domestic,国内,22,共同通信,外国人は「ルール無視」　百田尚樹氏、ヘイトスピーチか,https://news.yahoo.co.jp/articles/f12a7d8518a651c413dc8f9bb550039bac89628b,7/5(土) 20:39
2025-07-06,11:45,domestic,国内,23,スポニチアネックス,無所属・山尾志桜里氏　聴衆増えた!「世論から逃げずにしっかり受け止めていく」,https://news.yahoo.co.jp/articles/cafa5f087b828655cd30115dd33501f55f509004,7/6(日) 5:30
2025-07-06,11:45,domestic,国内,24,日刊スポーツ,【参院選】松山千春が銀座＆有楽町で生歌街頭演説　“盟友”を応援「私は鈴木宗男にかけている」,https://news.yahoo.co.jp/articles/e6383a0e02be66d17761728180accd6bbf479d69,7/5(土) 21:09
2025-07-06,11:45,domestic,国内,25,日刊スポーツ,「７月５日４時18分」過ぎてＸ諸説飛び交う「今日と言っていません」「夢見た時間」「午前中」,https://news.yahoo.co.jp/articles/b9c8a0cbb781d9a0b5d1008f37519b12bb07bbd0,7/5(土) 13:44
2025-07-06,11:45,domestic,国内,26,J-CASTニュース,トカラ列島で地震1000回と「7月5日の大災害」の関係　『私が見た未来』予知まさか...でも震度6弱が起きて,https://news.yahoo.co.jp/articles/c84828b280c477f572e8e9db9c549f4b797d8aa5,7/4(金) 16:47
2025-07-06,11:45,domestic,国内,27,日刊スポーツ,【参院選】山尾志桜里氏「『捨て身の選挙』なんかじゃない。私は勝負している」街頭演説で訴える,https://news.yahoo.co.jp/articles/012397bf41793e6f478d2c2d650b38a2754e92a6,7/6(日) 8:48
2025-07-06,11:45,domestic,国内,28,読売新聞オンライン,フォークリフトのフォークが刺さり従業員が死亡、所長が運転しアルバイトの足に…兵庫・姫路,https://news.yahoo.co.jp/articles/cee813a8afd50a314cae645ea1f61d5b60e88eee,7/5(土) 18:59
2025-07-06,11:45,domestic,国内,29,TBS NEWS DIG Powered by JNN,「周りを見て何もなかったから行った」千葉・松戸市の死亡ひき逃げ事件　運送業の男（44）を逮捕　容疑一部否認,https://news.yahoo.co.jp/articles/7368d66a9e8297543a9b9edcb8939d83bd1bf27f,7/6(日) 9:18
2025-07-06,11:45,domestic,国内,30,毎日新聞,客からスマホで「チップ」　飲食店で導入進む　1カ月で7万円受領も,https://news.yahoo.co.jp/articles/6da80bd90fecb9ac9d7467ea41bc841bddb113e4,7/6(日) 10:45
2025-07-06,11:45,domestic,国内,31,朝日新聞,天皇、皇后両陛下、歴代天皇初のモンゴル訪問へ出発　8日間の旅路,https://news.yahoo.co.jp/articles/fcd66eb50135e576543373baad1a8ea16307553f,7/6(日) 6:00
2025-07-06,11:45,domestic,国内,32,読売新聞オンライン,大阪・阪急十三駅前の居酒屋で火事、店舗１０軒焼く…男性店員が逃げる際に軽傷,https://news.yahoo.co.jp/articles/3995981c42ec964d9f1659d6f26af48af555e9e6,7/6(日) 8:46
2025-07-06,11:45,domestic,国内,33,日刊スポーツ,【参院選】北村晴男氏が第一声「反日憎悪を染み込まされた方」中国人帰化に持論「極めて慎重に」,https://news.yahoo.co.jp/articles/0f16ebd174cdadba01ea01aefcf3859b151f45cb,7/3(木) 16:47
2025-07-06,11:45,domestic,国内,34,神戸新聞NEXT,万博会場で毎晩盛り上がる「カラオケ×盆踊り」　当初は閑散も…TikTokで大バズり,https://news.yahoo.co.jp/articles/c639ca13be80ceb2b672b0cf663956d8839acb4e,7/6(日) 10:33
2025-07-06,11:45,domestic,国内,35,CBCテレビ,ラーゲリから生還した100歳抑留者 戦後80年間封印されたロシア人女性との“禁断の恋” 命をつないだ「ロシア語」への執念【大石邦彦 取材記(2)】,https://news.yahoo.co.jp/articles/d558dd97345b5c1debad957145a26fccabe308d0,7/6(日) 8:02
2025-07-06,11:45,domestic,国内,36,時事通信,「生粋の猟犬」ベアドッグが立役者　クマの人身被害、軽井沢で14年連続ゼロ,https://news.yahoo.co.jp/articles/33e0da330afdea281a1ea17cd927cf650e17c204,7/4(金) 17:00
2025-07-06,11:45,domestic,国内,37,朝日新聞,十三の飲食店で火災、店舗10軒が燃える　20代男性が搬送　大阪,https://news.yahoo.co.jp/articles/cdbc86108c3bfaaf79deadbb9f8d485c44eec333,7/6(日) 6:56
2025-07-06,11:45,domestic,国内,38,テレビ朝日系（ANN）,「尻をクマにかまれた人がいる」　80代の男性がけが　栃木・那須塩原市,https://news.yahoo.co.jp/articles/8f9f26c4fafe8d6d45df30d02dfcbea94d0c3709,7/6(日) 11:05
2025-07-06,11:45,domestic,国内,39,J-CASTニュース,ひろゆき氏「日本人を減らしたい人達が高齢出産に反対してるんですかね？」　参政党・神谷代表の発言を批判,https://news.yahoo.co.jp/articles/202eeb61666c2c110476c2a35d17c243580c7ad5,7/4(金) 15:50
2025-07-06,11:45,domestic,国内,40,デイリースポーツ,大阪・ミナミのシンボル「味園ユニバースビル」が完全営業終了　ラストライブに７７７人　かつては日本最大級キャバレー営業,https://news.yahoo.co.jp/articles/df11562d01fd5b5d4754fee37d6e1998905fac7c,7/6(日) 7:00
