scrp_date,scrp_time,genre_en,genre_jp,rank,media_jp,title,link,date_original
2024-06-29,16:06,domestic,国内,1,みんかぶマガジン,超攻撃的スタイル蓮舫「とうとう3位墜落の危機」迫る石丸…右から左までバラマキ合戦の大炎上都知事選,https://news.yahoo.co.jp/articles/0466860327bddd6b447f938be78b158e99d0f676,6/29(土) 9:10
2024-06-29,16:06,domestic,国内,2,読売テレビ,【いまだ逃走中】『おい、八田！必ず捕まえてやる』大学生を死亡させた重要指名手配犯・八田與一容疑者、事故のシミュレーションから見えた“意思”『これは、凶器を車に変えただけの殺人事件』,https://news.yahoo.co.jp/articles/49be1fd3b6de5e02430040c7ef7e0c970571086f,6/29(土) 6:00
2024-06-29,16:06,domestic,国内,3,中日スポーツ,新検事総長・畝本直美氏、女性初起用で注目も…自民党裏金事件では検察ナンバー２ 「露骨なごほうび人事」「巨悪を助けて出世コース」の声,https://news.yahoo.co.jp/articles/d5d525daabf15f34537151712f222f2652381c4f,6/29(土) 14:04
2024-06-29,16:06,domestic,国内,4,時事通信,両陛下、帰国の途に　オックスフォード大に桜植樹,https://news.yahoo.co.jp/articles/03225ed7ff6a9b46cdd2478cbc35c6c013d79b37,6/29(土) 13:32
2024-06-29,16:06,domestic,国内,5,ウェザーマップ,7月スタートは警報級大雨のおそれ　来週は日本海側に梅雨前線が停滞　度々大雨の可能性も,https://news.yahoo.co.jp/articles/ce3e02a2c7e4a90f588feb9a2658cb58d2701793,6/29(土) 15:20
2024-06-29,16:06,domestic,国内,6,ねとらぼ,オックスフォード大学ご訪問の天皇陛下、“ネクタイの柄”に注目集まる,https://news.yahoo.co.jp/articles/fa37e64d970c1ff1d667a0efe4fbd8f7a905777b,6/29(土) 15:09
2024-06-29,16:06,domestic,国内,7,47NEWS,中国の鉄道車両メーカー、スパイ懸念や納入遅れで破談相次ぐ　日本に競り勝ったインドネシア高速鉄道は〝金食い虫〟に『鉄道なにコレ！？』【第６４回】　,https://news.yahoo.co.jp/articles/384e36745f5bf76260569562958b2841f009285f,6/27(木) 10:02
2024-06-29,16:06,domestic,国内,8,朝日新聞デジタル,「助けて！」川のぬかるみにはまった小学生　通りがかった男性が救助,https://news.yahoo.co.jp/articles/0e1202a15699b32ec679dbf4aaa5c3fdfb6cf068,6/29(土) 15:00
2024-06-29,16:06,domestic,国内,9,毎日新聞,北九州都市高速道路でトレーラー横転、石炭が散乱　一部通行止め,https://news.yahoo.co.jp/articles/de4b348049c234f36bf593f12828e472ff8c203b,6/29(土) 13:40
2024-06-29,16:06,domestic,国内,10,tenki.jp,来週は高温多湿で熱中症リスク一段と高まる　本州で危険ランクも　湿度の影響大,https://news.yahoo.co.jp/articles/78955a320b4d5e94ad718ea2c938025f2aafcbd2,6/29(土) 12:20
2024-06-29,16:06,domestic,国内,11,テレビ朝日系（ANN）,【賛否】人気ラーメン店「イヤホンやめて」SNS投稿　片手でゲーム…回転率はダウン,https://news.yahoo.co.jp/articles/b2ea8a39d6ec321cef71e6467f3a9c6de35ba5cd,6/29(土) 11:46
2024-06-29,16:06,domestic,国内,12,福祉新聞,国会閉幕、経済対策へ　首相「低所得者に給付金」,https://news.yahoo.co.jp/articles/fefd4e5774f4c25eeab1868c532a8ac2d620e6bc,6/29(土) 13:40
2024-06-29,16:06,domestic,国内,13,朝日新聞デジタル,盗品ランクルなど保管の疑い、ヤード経営者ら6人逮捕　解体し輸出か,https://news.yahoo.co.jp/articles/593318f1bce9cf530592f798763043eb6e383903,6/27(木) 18:00
2024-06-29,16:06,domestic,国内,14,毎日新聞,蓮舫氏、神宮外苑再開発の是非問う「都民投票」実施と公約　都知事選,https://news.yahoo.co.jp/articles/ead5eeca3efab4cceee1afb983b58aabd0ed938c,6/29(土) 14:36
2024-06-29,16:06,domestic,国内,15,朝日新聞デジタル,小学校2校で教諭のミスでプールの水が流出　学校長、損失負担の意向,https://news.yahoo.co.jp/articles/fa4c80cc6051a97eac1dc37f15891ff2e0cbddb9,6/29(土) 10:45
2024-06-29,16:06,domestic,国内,16,ABEMA TIMES,逃亡2年…“整形経験あり”の八田容疑者 証言からまとめた人物特徴「耳が特徴的」「笑うとアゴが割れている」 別府ひき逃げ事件,https://news.yahoo.co.jp/articles/3c10ecb952619985160b6e3afd6b16bfbceccad6,6/28(金) 6:50
2024-06-29,16:06,domestic,国内,17,共同通信,飛騨川で男女流され不明　岐阜、沢登り中,https://news.yahoo.co.jp/articles/ac10aa9d4910780ca83ce362e8fe9fda4af2a511,6/29(土) 13:41
2024-06-29,16:06,domestic,国内,18,中日スポーツ,強毒ヒアリ、万博会場の夢洲で発見…不安の声 「次から次へと問題が」「肝試し会場かな」,https://news.yahoo.co.jp/articles/4e9c0d582d3b390a049816278c1a01de9738a06e,6/29(土) 12:34
2024-06-29,16:06,domestic,国内,19,読売新聞オンライン,都知事選、立候補した現職は１２勝０敗…「現職無敗の法則」いつまで続く,https://news.yahoo.co.jp/articles/9a7c8bc92bebc21beefa06396a69cce229b384f3,6/29(土) 14:00
2024-06-29,16:06,domestic,国内,20,ねとらぼ,皇后陛下、「淡いピンクの装い」に注目集まる　「天皇陛下のネクタイ」に合わせたコーディネートか,https://news.yahoo.co.jp/articles/1b9e0f8c5a79852e5d198394682ef642f792992a,6/28(金) 13:52
2024-06-29,16:06,domestic,国内,21,共同通信,ゾコーバ投与、入院37％減　塩野義、コロナ患者調査を発表,https://news.yahoo.co.jp/articles/c056cf05fdcac1d381fd2198616ded1ee2b93602,6/29(土) 15:23
2024-06-29,16:06,domestic,国内,22,共同通信,旭川いじめ再調査、30日公表へ　自殺との因果関係焦点,https://news.yahoo.co.jp/articles/9baecbc8ac0d71c79e697d686d640a010e53deb4,6/29(土) 12:16
2024-06-29,16:06,domestic,国内,23,産経新聞,「後ろからバンバン仲間を撃てば、すぐに維新は潰れていく」馬場代表が執行部批判巡り懸念　今週の野党,https://news.yahoo.co.jp/articles/39399847c56a9795525a310ed2bd6f23c5a3f613,6/29(土) 11:15
2024-06-29,16:06,domestic,国内,24,時事通信,岸田首相、在職1000日　戦後8人目、浮揚の兆しなく,https://news.yahoo.co.jp/articles/e08575d015d859c2630eae3744967234f9149d54,6/29(土) 0:07
2024-06-29,16:06,domestic,国内,25,読売新聞オンライン,高校の共学化加速、男女別学はピーク時の３分の１に…埼玉県では卒業生ら反対で存続議論,https://news.yahoo.co.jp/articles/c53bb43ef93f76ee49054c5b1595a27953b92e42,6/29(土) 14:11
2024-06-29,16:06,domestic,国内,26,デイリースポーツ,ひろゆき氏　東大数学科卒の経済学者に「算数も出来なくなってるんですか？」円安で工場日本回帰を否定「嘘は証明済み」,https://news.yahoo.co.jp/articles/6cd0493df3875c0f5f90bcf9389ef02c6ac6970a,6/28(金) 17:56
2024-06-29,16:06,domestic,国内,27,レスキューナウニュース,名鉄犬山線で人身事故 一部運転見合わせ,https://news.yahoo.co.jp/articles/65ba577fecd2c0dcdd9e1a7c7a122032e0d1cfab,6/29(土) 12:15
2024-06-29,16:06,domestic,国内,28,FNNプライムオンライン,【独自】逃走中の八田與一容疑者がかつて交際相手に宛てた手紙に「思いやりなど大切に」　遺族の声は届くか　大分・別府ひき逃げ事件,https://news.yahoo.co.jp/articles/34a5feb7487d1c938d46b4a0c0d37d09562e5573,6/28(金) 20:22
2024-06-29,16:06,domestic,国内,29,朝日新聞デジタル,石丸伸二氏が去った安芸高田市　30日告示の市長選に4人が立候補へ,https://news.yahoo.co.jp/articles/980aa6ff9ca5ac40bacdf2bb450214cbbb66c91f,6/29(土) 8:30
2024-06-29,16:06,domestic,国内,30,読売新聞オンライン,田畑裕明衆院議員、政治資金パーティー案内状に「ご入金のみ」欄…次期衆院選への影響懸念の声も,https://news.yahoo.co.jp/articles/cb88f0591ca9a40f4ffe09e3ec318ddae3ef5ab0,6/29(土) 13:38
2024-06-29,16:06,domestic,国内,31,中日スポーツ,岸田文雄首相、『在職1000日』戦後８人目の大台も… 「長けりゃいいってもんじゃないと思う国民が多いのでは」泉房穂さん私見,https://news.yahoo.co.jp/articles/6a9eb104a4fb241d061ea68ad459bdfdeb078539,6/29(土) 11:16
2024-06-29,16:06,domestic,国内,32,日テレNEWS NNN,【速報】天皇皇后両陛下がイギリス訪問終え出発,https://news.yahoo.co.jp/articles/33dc4e0d250376ac85a72a7b6230d322058018a1,6/29(土) 4:38
2024-06-29,16:06,domestic,国内,33,読売新聞オンライン,警察官も暑さ対策が必要、耐刃防護衣の下に冷却ベスト…腰にドリンクホルダーも,https://news.yahoo.co.jp/articles/415dbe0341ccfca2efd6b417d1c27f2bfd493858,6/29(土) 12:49
2024-06-29,16:06,domestic,国内,34,TBS NEWS DIG Powered by JNN,弁当のおにぎり「ラップで握ったまま」はNG?ブロッコリーにも注意!食中毒対策を専門家＆管理栄養士がW解説【ひるおび】,https://news.yahoo.co.jp/articles/d5e2930c4aa2954c99576a6bb2aabefa4e5e40fb,6/27(木) 16:01
2024-06-29,16:06,domestic,国内,35,朝日新聞デジタル,飛驒川で2人流されて行方不明　うち1人は救助試みて流されたか,https://news.yahoo.co.jp/articles/0bc825870b1d0d00e3018fe991b0efa37fd0e571,6/29(土) 15:16
2024-06-29,16:06,domestic,国内,36,読売テレビ,【ナゼ？】 入手困難で価格高騰の“バーキン”　「販売方法が問題」　抱き合わせ販売・お得意様優先で仏・エルメスを独占禁止法違反で提訴！店舗による対応の違いが怒りを呼んだか…エルメスの主張は？裁判の行方は？,https://news.yahoo.co.jp/articles/d057eeca4dd8da2b89021dc68fd39266bdb4e171,6/29(土) 11:00
2024-06-29,16:06,domestic,国内,37,読売新聞オンライン,オックスフォード大で天皇陛下「豊かな機会と思い出を大事にしていきたい」…皇后さまに「名誉法学博士号」,https://news.yahoo.co.jp/articles/b6add3328da9780696ebf58eadeb17ba6268f6e7,6/29(土) 12:05
2024-06-29,16:06,domestic,国内,38,読売新聞オンライン,高校の食堂閉鎖で生徒ピンチ、ＯＢらキッチンカーで参上…「母校のため赤字は覚悟」,https://news.yahoo.co.jp/articles/cf9c307cc11016b89aa3846d63abb206a2831172,6/29(土) 9:23
2024-06-29,16:06,domestic,国内,39,ねとらぼ,天皇陛下とチャールズ国王、“満面の笑みのショット”に反響　カミラ王妃の“日本製バッグ”にも関心集まる,https://news.yahoo.co.jp/articles/3bd66dbbe89c0fe57a46dcd912ada62c82b1f86f,6/27(木) 12:00
2024-06-29,16:06,domestic,国内,40,日テレNEWS NNN,男性が路上で死亡　ひき逃げ事件とみて捜査　静岡市,https://news.yahoo.co.jp/articles/a9c86a0339b4a6da673e55817aab84ad7fa01ec5,6/29(土) 14:24
