scrp_date,scrp_time,genre_en,genre_jp,rank,media_jp,title,link,date_original
2025-12-24,08:07,TTL,総合,1,スポニチアネックス,石破茂氏「もう一度総理大臣をやる気はありますか？」に“たった一言”で回答,https://news.yahoo.co.jp/articles/9f9230cd3c44598e6008732e97ab02f1c5846440,12/23(火) 21:33
2025-12-24,08:07,TTL,総合,2,デイリースポーツ,グラドル　握手会開催も「並びが０人で中止」呆然写真に驚愕感想や辛辣意見も「謝罪」ＳＮＳに投稿,https://news.yahoo.co.jp/articles/42afc3d3e3e99e83503964459c2de6eccddf1154,12/23(火) 19:28
2025-12-24,08:07,TTL,総合,3,デイリースポーツ,ネット騒然「久々見たけどマジ可愛い」「もう３２歳なの！？」【さんま御殿】吉村知事の隣に美人女優「出てる」「やばい可愛さ」「なんという透明感」,https://news.yahoo.co.jp/articles/155a00b61c73d806b8463c69b9110f93d43929d1,12/23(火) 21:15
2025-12-24,08:07,TTL,総合,4,スポニチアネックス,松井ケムリ　たこ焼き屋で衝撃…30分後の新幹線までに余裕のはずが「一番前に並んでたやつが…」,https://news.yahoo.co.jp/articles/bd1485777bed614ff0501ac652068fa133c9941e,12/24(水) 4:30
2025-12-24,08:07,TTL,総合,5,イーファイト,三十路グラドル高橋凛、ミニサンタ姿で筋トレ！ムッチリな筋肉に「メリー・クリスマッスル」,https://news.yahoo.co.jp/articles/c770b2d0a70bdcaf78e4058803f74cceff435c20,12/24(水) 3:51
2025-12-24,08:07,TTL,総合,6,サンケイスポーツ,ハーパーが悲願のWBC参戦「15歳で初めて…」　代表に人一倍強い思い　前回大会は手術で辞退　米国は全ポジション埋まる,https://news.yahoo.co.jp/articles/3220405966a5f273189c03150578b0a72844296c,12/24(水) 0:55
2025-12-24,08:07,TTL,総合,7,デイリースポーツ,【高市自民】ネットあ然「キレてる」「制止聞かない」　岡田克也氏「ＮＨＫ日曜討論」高市発言を強烈批判　キャスター３回制止も論争やめず「間違ってるんですよ！」,https://news.yahoo.co.jp/articles/b785b541facd2957b2c3069bce3bf20125092e7b,12/23(火) 23:46
2025-12-24,08:07,TTL,総合,8,埼玉新聞,【速報】関東・東北で地震　M5.0　東京、埼玉、栃木、千葉、茨城、群馬、福島、宮城で揺れる　震源地は三重県南東沖　震源の深さ330キロ　深い太平洋プレートを地震が伝わる「異常震域」か　400キロ以上離れた栃木で最大震度,https://news.yahoo.co.jp/articles/c2acad6fbe8e365d0df2e836eaaef95d578ea489,12/23(火) 19:06
2025-12-24,08:07,TTL,総合,9,スポーツ報知,河野太郎氏、番組共演の席上で北村晴男氏を訴えること明言「もうじき訴訟をやります。ダメなものはダメ」,https://news.yahoo.co.jp/articles/286585284f68321529879f34c250ac0ada38d36b,12/23(火) 21:40
2025-12-24,08:07,TTL,総合,10,スポニチアネックス,MAX・LINA　クリスマスに恋人からプロポーズ　快諾も衝撃結末にスタジオ騒然「うそでしょ」「怖っ」,https://news.yahoo.co.jp/articles/8e39de00cb657a93160e8c866a8b931a03f28430,12/23(火) 22:37
2025-12-24,08:07,TTL,総合,11,スポニチアネックス,松井ケムリ　新幹線移動で睡眠中に隣の乗客から「トントンと起こされて…」お願いされたことにスタジオ驚き,https://news.yahoo.co.jp/articles/2a381de9a710836b1bbd9de605a0b3c7bce5e937,12/24(水) 4:15
2025-12-24,08:07,TTL,総合,12,DAZN News,久保建英「今年の夏、移籍の可能性はあったけれど残留した。ソシエダに追い出されなければここにいる」｜ラ・リーガ,https://news.yahoo.co.jp/articles/888b4527f6d2e1f0cf5306842a3a1777c53f0fb8,12/23(火) 23:50
2025-12-24,08:07,TTL,総合,13,ENCOUNT,写真集発売の女子アスリートが「モデルさん級」　まさかの日本代表…ネット騒然「かわいすぎます」,https://news.yahoo.co.jp/articles/6e95f6f31aaff1fbff945f8b43391672ebba5745,12/23(火) 20:37
2025-12-24,08:07,TTL,総合,14,BuzzFeed Japan,「え？ 本当…！？」『紅白歌合戦』出演者のお知らせにSNSざわつく「絶対ないと思ってた」「世界観ぶっ壊れそう」,https://news.yahoo.co.jp/articles/a829cd3239bce2fb0a94ca339cfcb6cde06c4b6e,12/24(水) 7:00
2025-12-24,08:07,TTL,総合,15,スポーツ報知,「報ステ」大越健介氏、西東京市の母子無理心中の母親名義の部屋での男性の遺体発見報じ「二つの事件は関わりがあるようです」,https://news.yahoo.co.jp/articles/d29afdd9add4b751fe41196742104d1960f129a2,12/23(火) 22:18
2025-12-24,08:07,TTL,総合,16,スポーツ報知,【巨人】２２歳・育成捕手が退団へ　遊撃など内、外野も守れるユーティリティー　北海出身・大津綾也,https://news.yahoo.co.jp/articles/76b7199bb871db955d25abe5caa20216f87147dc,12/24(水) 5:00
2025-12-24,08:07,TTL,総合,17,西スポWEB OTTO！,流行語大賞から11年「お笑いメイクしてなかったら…」日本エレキテル連合の最新ショットに驚きの声「よそ行きの顔しとる！」「いいじゃないの〜」,https://news.yahoo.co.jp/articles/3d2e0880ae0f69671c689c558be0a0d2dea60b96,12/23(火) 23:20
2025-12-24,08:07,TTL,総合,18,デイリースポーツ,阪神　佐藤輝＆才木は越年か　契約未更改残り２人　米挑戦希望の共通点も竹内球団副社長「それとは切り離して」交渉,https://news.yahoo.co.jp/articles/2d897f97bba71f7d00f9db0a74690ec69d05a15d,12/24(水) 5:01
2025-12-24,08:07,TTL,総合,19,スポニチアネックス,野呂佳代　苦手で「1種類しか使えない」もの　夫と別々にしているのは…スタジオびっくり,https://news.yahoo.co.jp/articles/de3bf9382349d49d3a05e36f2bed6881ace4a2a3,12/24(水) 4:45
2025-12-24,08:07,TTL,総合,20,CBCテレビ,コメが倉庫の天井近くまで山積みに… 「コメが余って売れない」 「年明け以降は価格下がる」 国の政策に振り回されたコメ業界,https://news.yahoo.co.jp/articles/2c752c5a0cd0f529fe7eb5e72a87388a2ec911c3,12/23(火) 18:45
2025-12-24,08:07,TTL,総合,21,スポニチアネックス,大久保佳代子　相方・光浦のお笑い“引退宣言”に仰天　27年から本格復帰告白も「えぇぇぇ…」,https://news.yahoo.co.jp/articles/b3b3218b52877a513bafa02626ff3cf31294fa08,12/24(水) 5:30
2025-12-24,08:07,TTL,総合,22,ENCOUNT,「12月に載せる格好じゃない」　ぴったぴたタンクトップの肌見せにネット驚き「寒くないの？」,https://news.yahoo.co.jp/articles/a71928b542f796be98ddb08b5ed383b61cc0f20a,12/24(水) 7:20
2025-12-24,08:07,TTL,総合,23,ENCOUNT,新幹線の予約スペースに無断荷物「中国人がキレ出して駅員と喧嘩」　日本人客も加わって…車内騒然,https://news.yahoo.co.jp/articles/97d2c57ff31d41f9a48ee26a822466c65736f3a0,12/23(火) 16:10
2025-12-24,08:07,TTL,総合,24,Full-Count,村上宗隆の入団会見が“物議”「印象が悪い」　WソックスTV局に苦言「深刻な損失」,https://news.yahoo.co.jp/articles/4b31a79197861cb7d84d43a3c631cb3b8e4e15a2,12/23(火) 12:00
2025-12-24,08:07,TTL,総合,25,産経新聞,小野田氏「ちょっと何を言っているか分からない」フリー記者「対中強硬で高支持率キープ」,https://news.yahoo.co.jp/articles/ab79ef209e681000ae8dcb8c31ae6c1e562f83d2,12/24(水) 7:00
2025-12-24,08:07,TTL,総合,26,FITNESS LOVE,高身長174㎝の「スタイル抜群白肌ボディ」を作り上げコンテスト日本大会入賞のモデル　「やるべきことはやりました」むくみ取りまで徹底準備,https://news.yahoo.co.jp/articles/c081232afdd6f8e5b91bc31492ab2ac3a22d5926,12/24(水) 4:10
2025-12-24,08:07,TTL,総合,27,スポニチアネックス,超豪華！3番・村上、4番・誠也、5番・岡本…侍初の“MLBクリーンアップ”実現も,https://news.yahoo.co.jp/articles/ab7b0b86ce2308102fa6948081c685cd78480a37,12/24(水) 5:30
2025-12-24,08:07,TTL,総合,28,LIMO,ホテルが満室の日にやってきた「予約なしの常連のお客様」　まさかの要求に「知らんがな」「空いてても断る」,https://news.yahoo.co.jp/articles/9ddfdb424efa35bdae32fb0481a7dbc7ce997456,12/24(水) 6:31
2025-12-24,08:07,TTL,総合,29,オリコン,大食い系YouTuber・とぎもち、無期限で休養　「もう自分でも限界を感じ…」いきさつ明かす,https://news.yahoo.co.jp/articles/e18eaff12cda8a93c2039a10d5009ff3a0b05d47,12/24(水) 6:00
2025-12-24,08:07,TTL,総合,30,スポニチアネックス,J2大宮　C大阪DF西尾隆矢の獲得決定的に!　複数クラブとの“争奪戦”決着へ,https://news.yahoo.co.jp/articles/38f86a40ea69c2159f74827fc68de40d55493a1c,12/24(水) 1:00
2025-12-24,08:07,TTL,総合,31,Full-Count,地元に嫌われた球団…勃発した“反対運動”　部屋に篭ったドラ1「とんでもないところに」,https://news.yahoo.co.jp/articles/07e449a921c6329bd05a1080218c8d2d9df719ca,12/24(水) 6:55
2025-12-24,08:07,TTL,総合,32,読売新聞オンライン,中国への「配慮」にじむトランプ政権に米議会で異論拡大…超党派で日本への「威圧的行為」非難の決議案,https://news.yahoo.co.jp/articles/63d8abca02632ad908511b7114873f843de20217,12/24(水) 0:03
2025-12-24,08:07,TTL,総合,33,スポーティングニュース日本版,【有馬記念】近年の好走馬には「2つの共通点」アリ！ 昨年覇者レガレイラは鉄板ではない⁉,https://news.yahoo.co.jp/articles/961e79189096fb3e32f72a3d22f8425bffd19061,12/24(水) 5:00
2025-12-24,08:07,TTL,総合,34,ねとらぼ,たくさんの生き物が泳ぐ“池”に緊急事態→水を抜いたら……　とんでもない光景に「しんどいですね」「相当な労力」,https://news.yahoo.co.jp/articles/a0ce58e0b9278c59c66ae3e373b0906fa89e2313,12/23(火) 22:05
2025-12-24,08:07,TTL,総合,35,GOAL,レアルの神童がフランスへ移籍。リヨンが今シーズン終了までエンドリッキをレンタル移籍で獲得,https://news.yahoo.co.jp/articles/28a1f4db190446b1b7288fca0f956f15b48a4d0c,12/24(水) 5:50
2025-12-24,08:07,TTL,総合,36,スポーツ報知,巨人、１９歳内野手に「三塁プラン」浮上で定位置争い激化,https://news.yahoo.co.jp/articles/b18ceea79afe6f8423f9e436204c0ab584f034f3,12/24(水) 5:15
2025-12-24,08:07,TTL,総合,37,オリコン,【M‐1】オール巨人の評価「トップ95点最下位85点」　「決勝戦の3組」の順位、敗者復活ミキにも言及,https://news.yahoo.co.jp/articles/3fc2024742dddaeebe4548f850beec518994c853,12/23(火) 20:14
2025-12-24,08:07,TTL,総合,38,ENCOUNT,大食いYouTuber、食べた直後に吐き出す映像が拡散　体調不良訴え休養「不健康な痩せ方をして」,https://news.yahoo.co.jp/articles/de19915e47d97b3327138496029115c77d7111de,12/23(火) 14:09
2025-12-24,08:07,TTL,総合,39,オリコン,『なんでも鑑定団』小早川清の美人画　本人評価額50万円→ド級値　今田耕司「やったじゃーーん！」,https://news.yahoo.co.jp/articles/7c79f6fc465d82cb45867f7ee3837fbce491e436,12/24(水) 6:00
2025-12-24,08:07,TTL,総合,40,LIMO,洗濯機でダウンジャケットを洗ってみた結果…衝撃的な姿に思わず目を疑う「ゾッとした」「何か宿ってる」,https://news.yahoo.co.jp/articles/5a974dc3d1c673791a0aa9f6c27b41dbfce04d5d,12/24(水) 5:55
