scrp_date,scrp_time,genre_en,genre_jp,rank,media_jp,title,link,date_original
2023-12-24,06:14,TTL,総合,1,スポーツ報知,水上恒司　自分が大物女優の“息子”であることに納得「似てるって自覚した時期があって」,https://news.yahoo.co.jp/articles/14bd45cdd2e89ada94da1c61ec708779b190a25b,12/23(土) 16:00
2023-12-24,06:14,TTL,総合,2,デイリースポーツ,「女優かと！」「北川景子みたい」石川佳純さんの密着番組にネット騒然「めっちゃ綺麗に」「綺麗すぎる…」,https://news.yahoo.co.jp/articles/36b65d7a34486e51edef3c2ded32b56931a1413f,12/23(土) 23:28
2023-12-24,06:14,TTL,総合,3,スポーツ報知,ＳＰＥＥＤ島袋寛子が“激変”「若返ってる」近影に衝撃「１７歳」「幼く見えます」「まじ可愛すぎ」,https://news.yahoo.co.jp/articles/2bdc08e61d979afa439f510ca6dfa91f870cab90,12/23(土) 16:35
2023-12-24,06:14,TTL,総合,4,スポニチアネックス,山田孝之　大親友だという芸歴22年のお笑い芸人を明かす「よく飲んだりしてた」も「本当に何も起きない」,https://news.yahoo.co.jp/articles/88b29a3d5a696123ff246664e51170477b606e60,12/23(土) 18:21
2023-12-24,06:14,TTL,総合,5,スポーツ報知,「久々に見た」剛力彩芽の姿が「別人」「雰囲気変わって誰かわからん」とネットざわつく「かなり印象違った」,https://news.yahoo.co.jp/articles/79953d1f08b778e73c82960473c32598d4d23edd,12/23(土) 11:25
2023-12-24,06:14,TTL,総合,6,スポーツ報知,小泉孝太郎、結婚できない理由の一端明かす…夜景を見ても「正直に言っていいですか？　面倒くさいなって…」,https://news.yahoo.co.jp/articles/8cbdd180f0701ad79e5e802be324097769528a2c,12/23(土) 21:57
2023-12-24,06:14,TTL,総合,7,スポーツ報知,４５歳独身の小泉孝太郎が断言「僕はプロポーズする気ない。何万人の女性を敵に回そうが、僕は変わらない」,https://news.yahoo.co.jp/articles/329d4fca0c299ce787c5751f9e9cf63f7e42ea7f,12/23(土) 22:54
2023-12-24,06:14,TTL,総合,8,西スポWEB OTTO！,バスケ日本代表の偉大な兄の支えで復帰、精華女子「背番号18」が残り1秒で描いた奇跡「感謝でいっぱい」【ウインターカップ】,https://news.yahoo.co.jp/articles/52a098966b1409c3375122b83582d65557400cbf,12/23(土) 18:51
2023-12-24,06:14,TTL,総合,9,日刊ゲンダイDIGITAL,北野武監督「首」大コケ？ 興収は製作費にも届かない見通し、意欲的な次回作に早くも“黄信号”,https://news.yahoo.co.jp/articles/07a39af77aed9a646ecc84469d671c0ba731fff5,12/23(土) 13:56
2023-12-24,06:14,TTL,総合,10,モデルプレス,「うち弁」吉瀬美智子、千鳥・大悟と密着2ショットで“伏線回収”「結婚しました」報告に反響続々,https://news.yahoo.co.jp/articles/b75fbdad84b45ea5092bd63220901b5aad2f7d1e,12/23(土) 12:24
2023-12-24,06:14,TTL,総合,11,ねとらぼ,吉瀬美智子、人気芸人との“結婚報告”に反響「ま、まさか」　話題の親密オフショットがそのままドラマに「伏線回収致しました！」,https://news.yahoo.co.jp/articles/685ec5d3dcc5be8bbe61fdeeec226913bbac6061,12/23(土) 12:26
2023-12-24,06:14,TTL,総合,12,スポーツ報知,衝撃Ｍａｔｔの金銭感覚「ディズニー行くからお金ちょうだい」でもらえる金額にスタジオ仰天「使い切れない」,https://news.yahoo.co.jp/articles/a23819d4d90801341179547975795f1ffcd4592f,12/23(土) 14:35
2023-12-24,06:14,TTL,総合,13,東スポWEB,田中みな実　また遅刻の〝ヘラヘラ男〟に大激怒「なんで来たんですか？」「何か言うことない？」,https://news.yahoo.co.jp/articles/19978e470d9283f4401bb351bc7d8ee8b3a1851f,12/23(土) 20:56
2023-12-24,06:14,TTL,総合,14,中日スポーツ,本田真凜、28人中の最下位でフリー進出ならず…大学4年生、今後については「お答えできることは今の時点ではない」,https://news.yahoo.co.jp/articles/4c2b4e368ca0a8fe3c57c955fb4d889a425bfe85,12/22(金) 20:07
2023-12-24,06:14,TTL,総合,15,日刊スポーツ,ゆたぼん「親父はどこかに消えました。それはどうでもいい」三者面談報告し「母と先生に感謝」,https://news.yahoo.co.jp/articles/33dab3c0a7d88313f3258375da50ef2a20304c49,12/22(金) 13:42
2023-12-24,06:14,TTL,総合,16,中日スポーツ,橋下徹さん「裏金や旧文通費で飲み食いしている国会議員は全員クビやね」 NHK記者の不正請求→懲戒免職めぐり言及,https://news.yahoo.co.jp/articles/bd9fb6a79227cf28d85addd906f809d803118956,12/23(土) 23:58
2023-12-24,06:14,TTL,総合,17,netkeiba.com,霜降り明星・粗品は有馬記念で3連単30点勝負 「ソールオリエンスより上だと思っている」,https://news.yahoo.co.jp/articles/fed9341eeffb625395f0d5134fdecbf6c05cff42,12/23(土) 21:15
2023-12-24,06:14,TTL,総合,18,中日スポーツ,ロッテ・吉井監督「競馬新聞風に言うと」来季開幕投手の本命、対抗、3番手候補をサプライズ発表,https://news.yahoo.co.jp/articles/300904666313903929fd4000d9a219d88af9b550,12/23(土) 19:04
2023-12-24,06:14,TTL,総合,19,デイリースポーツ,安藤美姫コーチからエール「１人じゃないよ」　教え子・田内誠悟が躍動　恩師は衣装とおそろい紫ストールで寄り添う,https://news.yahoo.co.jp/articles/134362d82c3488d85e06e8413c558b103456765b,12/23(土) 18:10
2023-12-24,06:14,TTL,総合,20,デイリースポーツ,【有馬記念】展開から浮上するのはこの馬だ,https://news.yahoo.co.jp/articles/3675a799f07fce62bfbd55414682d08d053acb2b,12/23(土) 21:18
2023-12-24,06:14,TTL,総合,21,夕刊フジ,安倍元首相「ただちに直せ」裏付ける報道続々　パー券疑惑　岩田明子氏リポートに〝かばっている〟批判も産経や朝日が補強報道,https://news.yahoo.co.jp/articles/0a42894915096e0bc314b190ac55e33167492320,12/23(土) 17:00
2023-12-24,06:14,TTL,総合,22,デイリースポーツ,ダウンタウン衝撃「ええっ！？」狂気芸人が６３７万円を「ガキ使」「ドキュメンタル」でドボン　ネタと思わせガチ出費,https://news.yahoo.co.jp/articles/d0f04406b467aff9cfe452ab83e7682c72700121,12/23(土) 21:48
2023-12-24,06:14,TTL,総合,23,GOAL,遠藤航、プレミア天王山でフル出場！リヴァプールはアーセナルと1-1ドローで首位奪還ならず,https://news.yahoo.co.jp/articles/f94f6a6e83d7dfd5062431247083c7a9f1e71d19,12/24(日) 4:26
2023-12-24,06:14,TTL,総合,24,＆GP,車両盗難被害の2位はプリウス、1位は…。最新の盗難手口に対抗するカーセキュリティ,https://news.yahoo.co.jp/articles/c4a246a7a26079b9c1245031696a1eb574d2c6b0,12/22(金) 19:01
2023-12-24,06:14,TTL,総合,25,毎日新聞,注目選手の起用は　全国高校駅伝、男女のオーダー発表,https://news.yahoo.co.jp/articles/22c1a054f5506df2d12c7615f303b104dc68956b,12/23(土) 14:48
2023-12-24,06:14,TTL,総合,26,スポニチアネックス,J2清水 鹿島元U23代表GK沖悠哉を獲得　GK大久保の後釜として,https://news.yahoo.co.jp/articles/e01ea85fd8cf2c206c020df00f01b3c9ec88e4a1,12/24(日) 4:40
2023-12-24,06:14,TTL,総合,27,クックパッドニュース,これ知らなかった…！医師が教える「なぜか若く見える人」が食べているもの,https://news.yahoo.co.jp/articles/c4ae9fd0310d1d6d133a47c2f80f50b8650b928b,12/23(土) 21:01
2023-12-24,06:14,TTL,総合,28,ねとらぼ,DIYで室温が約5度上がる「マイホームの寒さ対策」が参考になる！　工具なし＆5分で終わる簡単アイデアに「素晴らしい実験です」,https://news.yahoo.co.jp/articles/2d8d242b7040fcc2ceaf7b5f13ab521723854711,12/23(土) 21:30
2023-12-24,06:14,TTL,総合,29,スポニチアネックス,ジャンポケおたけ　今年最大の出費と理由ににスタジオザワつく「権利問題がだいぶもめまして…」,https://news.yahoo.co.jp/articles/59cf783e6f97e4c790d753e387cc6679d3e77cbe,12/23(土) 21:06
2023-12-24,06:14,TTL,総合,30,スポニチアネックス,キングオブコント王者・鈴木もぐら、最新月給ポロリ　視聴者ドン引き「それだけもらってるのに借金って…」,https://news.yahoo.co.jp/articles/6e0e7fdcc7dd5f05ff8f58f33b38b0cae47be785,12/23(土) 16:52
2023-12-24,06:14,TTL,総合,31,スポーツ報知,水上恒司　超仲良しの２９歳年上の大物芸能人　キャラ強烈で周囲に驚かれるも「あまり存じ上げなかった」,https://news.yahoo.co.jp/articles/4e6c48009edf2bc45de2566004f4bb11c89203bc,12/23(土) 17:00
2023-12-24,06:14,TTL,総合,32,BUSINESS INSIDER JAPAN,9時5時の仕事を嘆き悲しんだ女性、レイオフされていた（海外）,https://news.yahoo.co.jp/articles/c22b54786119fb4a060d61277b2d520348f997cc,12/23(土) 11:10
2023-12-24,06:14,TTL,総合,33,スポニチアネックス,キンプリ高橋海人　激動の1年に正直な胸中吐露「キャラ的に自分、大丈夫かな…って」「怖かった」,https://news.yahoo.co.jp/articles/0259579facee9fa59e26fdc9455cef02012169e0,12/23(土) 21:50
2023-12-24,06:14,TTL,総合,34,サッカーマガジンWeb,リバプールとアーセナルによる白熱の首位攻防戦はドロー！　遠藤航は先発フル出場で存在感を示す【イングランド】,https://news.yahoo.co.jp/articles/f39b57d527c963ca4bb25f7e7e7e1cc3e972d50c,12/24(日) 4:53
2023-12-24,06:14,TTL,総合,35,時事通信,帝京大、明大が準決勝へ　京産大と天理大も4強―全国大学ラグビー,https://news.yahoo.co.jp/articles/1368ec7fb9ef2cb0fcf889aeed6456b4016f48bf,12/23(土) 17:05
2023-12-24,06:14,TTL,総合,36,日刊スポーツ,田中みな実、写真集撮影中に恋人との別れ決意「プライベートで変な恋愛してる場合じゃない」,https://news.yahoo.co.jp/articles/2409a90a4aeed56565aafee1fa3e3ec0af1addc5,12/23(土) 20:09
2023-12-24,06:14,TTL,総合,37,オリコン,王林ヤンジャン』表紙で初写真集の秘蔵カット解禁　最強ブレイク美女の今を撮り下ろし,https://news.yahoo.co.jp/articles/422a2695e905c64589b15f81d19e560a5535e1bc,12/21(木) 0:00
2023-12-24,06:14,TTL,総合,38,J-CASTニュース,「ビッグモーターで購入しENEOSでオイル交換したダイハツ車」に乗る人は今、何を思う？　不祥事で話題...当事者明かした胸の内,https://news.yahoo.co.jp/articles/1e1130f0ce607bfb4249e53676d185b2558a2228,12/22(金) 20:47
2023-12-24,06:14,TTL,総合,39,読売新聞オンライン,歩道橋の欄干越えた少女、散歩中の８０歳男性がとっさに抱きかかえ救助…少女は言葉なく涙,https://news.yahoo.co.jp/articles/c6f715503f27aa4a0b24494e318fe8639e89cf4b,12/23(土) 7:10
2023-12-24,06:14,TTL,総合,40,TBS NEWS DIG Powered by JNN,宇野昌磨が激戦制し2連覇！羽生＆本田に並ぶ歴代2位の6度目V、鍵山がフリートップの演技で2位【全日本フィギュア】,https://news.yahoo.co.jp/articles/0c95bb718912589106b152f0263bfc0ed078d9c3,12/23(土) 20:53
